{
  "symbol": "A/RES/79/40",
  "filename": "A_RES_79_40.pdf",
  "title": "79/40. The illicit trade in small arms and light weapons in all its aspects",
  "text": "United Nations \nA/RES/79/40\n \n \nGeneral Assembly \nDistr.: General \n9 December 2024 \n \n24-23058 (E) \n*2423058* \n \n \nSeventy-ninth session \nAgenda item 98 (p) \nGeneral and complete disarmament: the illicit trade in \nsmall arms and light weapons in all its aspects \n \n \n \n \n Resolution adopted by the General Assembly \non 2 December 2024 \n \n \n \n \n[on the report of the First Committee (A/79/408, para. 114)] \n \n \n \n79/40. The illicit trade in small arms and light weapons in all its aspects \n \n \n \nThe General Assembly, \n \nRecalling its resolution 78/46 of 4 December 2023, as well as all previous \nresolutions on the illicit trade in small arms and light weapons in all its aspects, \nincluding resolution 56/24 V of 24 December 2001, \n \nEmphasizing the importance of the continued and full implementation of the \nProgramme of Action to Prevent, Combat and Eradicate the Illicit Trade in Small \nArms and Light Weapons in All Its Aspects, adopted by the United Nations \nConference on the Illicit Trade in Small Arms and Light Weapons in All Its Aspects,1 \nand recognizing its important contribution to international efforts on this matter, \n \nEmphasizing also the importance of the continued and full implementation of \nthe International Instrument to Enable States to Identify and Trace, in a Timely and \nReliable Manner, Illicit Small Arms and Light Weapons (the International Tracing \nInstrument),2  \n \nRecalling the commitment of States to the Programme of Action as the main \nframework for measures within the activities of the international community to \nprevent, combat and eradicate the illicit trade in small arms and light weapons in all \nits aspects, \n \nUnderlining the need for States to enhance their efforts to build national \ncapacity for the effective implementation of the Programme of Action and the \nInternational Tracing Instrument, \n__________________ \n \n1 Report of the United Nations Conference on the Illicit Trade in Small Arms and Light Weapons in \nAll Its Aspects, New York, 9\u201320 July 2001 (A/CONF.192/15), chap. IV, para. 24. \n \n2 See decision 60/519 and A/60/88 and A/60/88/Corr.2, annex. \n\nA/RES/79/40 \nThe illicit trade in small arms and light weapons in all its aspects\n \n24-23058\n2/7 \n \n \nMindful of the implementation of the outcomes adopted by the follow-up \nmeetings on the Programme of Action, \n \nWelcoming the successful convening of the Fourth United Nations Conference \nto Review Progress Made in the Implementation of the Programme of Action to \nPrevent, Combat and Eradicate the Illicit Trade in Small Arms and Light Weapons in \nAll Its Aspects, held in New York from 17 to 28 June 2024, and its outcome,3  \n \nRecognizing the need for the strengthened participation of women in decision-\nmaking and implementation processes relating to the Programme of Action and the \nInternational Tracing Instrument, and reaffirming the need for States to mainstream a \ngender perspective into their implementation efforts, \n \nNoting that web-based tools developed by the Secretariat, including its \nsearchable \ndatabase \nand \nthe \nModular \nSmall-arms-control \nImplementation \nCompendium, and the tools developed by Member States could be used to assess \nprogress made in the implementation of the Programme of Action, \n \nReaffirming its decision, in its resolution 77/71 of 7 December 2022, to establish \na dedicated fellowship training programme on small arms and light weapons in order \nto strengthen technical knowledge and expertise in areas relating to the \nimplementation of the Programme of Action and the International Tracing Instrument, \nin particular in developing countries, \n \nNoting that voluntary national reports on the implementation of the Programme \nof Action can serve, inter alia, to provide a baseline for measuring progress in its \nimplementation, build confidence and promote transparency, provide a basis for \ninformation exchange and action and serve to identify needs and opportunities for \ninternational assistance and cooperation, including the matching of needs with \navailable resources and expertise, \n \nNoting with satisfaction regional and subregional efforts being undertaken in \nsupport of the implementation of the Programme of Action, and commending the \nprogress that has already been made in this regard, including the tackling of both \nsupply and demand factors that are relevant to addressing the illicit trade in small \narms and light weapons, \n \nRecognizing that sharing and applying best practices, on a voluntary basis, at \nthe regional, subregional and national levels support the full and effective \nimplementation of the Programme of Action and the International Tracing Instrument \nand should therefore be an ongoing effort, in order to address ongoing challenges \nassociated with the diversion of and illicit trade in small arms and light weapons, \n \nReaffirming that international cooperation and assistance are an essential aspect \nof the full and effective implementation of the Programme of Action and the \nInternational Tracing Instrument, \n \nRecognizing the efforts undertaken by civil society in the provision of assistance \nto States for the implementation of the Programme of Action, \n \nRecalling that Governments bear the primary responsibility for preventing, \ncombating and eradicating the illicit trade in small arms and light weapons in all its \naspects, in accordance with the sovereignty of States and their relevant international \nobligations, \n \nReiterating that illicit brokering in small arms and light weapons is a serious \nproblem that the international community should address urgently, \n__________________ \n \n3 A/CONF.192/2024/RC/3, annex. \n\nThe illicit trade in small arms and light weapons in all its aspects \nA/RES/79/40\n \n3/7\n24-23058 \n \n \nReiterating also the new challenges and potential opportunities with regard to \neffective marking, record-keeping and tracing resulting from developments in the \nmanufacturing, technology and design of small arms and light weapons, and bearing \nin mind the different situations, capacities and priorities of States and regions, \n \nRecognizing that the opportunities and challenges associated with these \ndevelopments in the manufacturing, technology and design of small arms and light \nweapons, including polymer and modular weapons and firearms produced using \nthree-dimensional printing, must be addressed in a timely manner, \n \nTaking note of the report of the Secretary-General,4 which contains an overview \nof recent developments in the illicit trade in and circulation of small arms and light \nweapons, as well as the activities carried out by the United Nations,  \n \nWelcoming the inclusion of small arms and light weapons in the scope of the \nArms Trade Treaty,5  \n \nAcknowledging that effective national control systems for the transfer of \nconventional arms contribute to the prevention and eradication of the illicit trade in \nsmall arms and light weapons in all its aspects, \n \nRecalling the adoption of resolution 78/47 of 4 December 2023 and, without a \nvote, of the final report6 of the open-ended working group established pursuant to \nresolution 76/233 of 24 December 2021, and the Global Framework for Through-life \nConventional Ammunition Management, which is a cooperative framework that is \nvoluntary and contains a set of political commitments for strengthening and \npromoting existing initiatives on, and addressing existing gaps in, through-life \nconventional ammunition management, as contained in the annex to the report,  \n \n1. \nUnderlines the fact that the issue of the illicit trade in small arms and light \nweapons in all its aspects requires concerted efforts at the national, regional and \ninternational levels to prevent, combat and eradicate the illicit manufacture, \nbrokering, transfer and circulation of small arms and light weapons, and that their \nuncontrolled proliferation in many regions of the world has a wide range of \nhumanitarian and socioeconomic consequences and poses a serious threat to peace, \nreconciliation, safety, security, stability and sustainable development at the \nindividual, local, national, regional and international levels; \n \n2. \nRecognizes the urgent need to maintain and enhance national controls, in \naccordance with the Programme of Action to Prevent, Combat and Eradicate the Illicit \nTrade in Small Arms and Light Weapons in All Its Aspects, to prevent, combat and \neradicate the illicit trade in small arms and light weapons, including their diversion \nto illicit trade, illegal armed groups, terrorists and other unauthorized recipients, \ntaking into account, inter alia, their adverse humanitarian and socioeconomic \nconsequences for the affected States; \n \n3. \nEmphasizes the need for States to redouble national efforts to provide for \nthe safe, secure, comprehensive and effective management of stockpiles of small arms \nand light weapons held by Governments to prevent, combat and eradicate the \ndiversion of those weapons;  \n \n4. \nCalls upon all States to implement the International Instrument to Enable \nStates to Identify and Trace, in a Timely and Reliable Manner, Illicit Small Arms and \nLight Weapons (the International Tracing Instrument) by, inter alia, including in their \nnational reports the name and contact information of the national points of contact \n__________________ \n \n4 A/79/77. \n \n5 United Nations, Treaty Series, vol. 3013, No. 52373. \n \n6 A/78/111. \n\nA/RES/79/40 \nThe illicit trade in small arms and light weapons in all its aspects\n \n24-23058\n4/7 \n \nand information on national marking practices used to indicate country of \nmanufacture and/or country of import, as applicable; \n \n5. \nEncourages all relevant initiatives, including those of the United Nations, \nother international organizations, regional and subregional organizations and civil \nsociety, for the successful implementation of the Programme of Action, and calls upon \nall Member States to contribute towards the continued implementation of the \nProgramme of Action at the national, regional and global levels; \n \n6. \nEncourages States to implement the recommendations contained in the \nreport of the Group of Governmental Experts established pursuant to resolution 60/81 \nof 8 December 2005 to consider further steps to enhance international cooperation in \npreventing, combating and eradicating illicit brokering in small arms and light \nweapons;7  \n \n7. \nEndorses the outcome of the Fourth United Nations Conference to Review \nProgress Made in the Implementation of the Programme of Action to Prevent, Combat \nand Eradicate the Illicit Trade in Small Arms and Light Weapons in All Its Aspects, \nheld in New York from 17 to 28 June 2024;  \n \n8. \nDecides, pursuant to the schedule of meetings for the period from 2024 to \n2030 agreed upon at the Fourth Review Conference, to convene, in New York, a one-\nweek biennial meeting of States in 2026 (10 meetings) and a one-week biennial \nmeeting of States in 2028 (10 meetings), to consider key challenges and opportunities \nrelating to the implementation of the Programme of Action and the International \nTracing Instrument at the national, regional and global levels;  \n \n9. \nAlso decides to convene the Fifth United Nations Conference to Review \nProgress Made in the Implementation of the Programme of Action to Prevent, Combat \nand Eradicate the Illicit Trade in Small Arms and Light Weapons in All Its Aspects \n(and the International Tracing Instrument) in 2030 as a two-week event, to be \npreceded by a preparatory committee meeting of not more than five days, in early \n2030; \n \n10. Underlines the importance of the full and effective implementation of the \nProgramme of Action and the International Tracing Instrument for attaining Goal 16 \nand target 16.4 of the 2030 Agenda for Sustainable Development; 8 \n \n11. \nEmphasizes the need for the equal, full, meaningful and effective \nparticipation of women in all decision-making and implementation processes relating \nto the Programme of Action and the International Tracing Instrument;  \n \n12. Encourages States to take into account recent developments in small arms \nand light weapons manufacturing, technology and design, in particular polymer and \nmodular weapons, in the implementation of the Programme of Action and the \nInternational Tracing Instrument and to strengthen normative frameworks, where \nneeded, and cooperation between law enforcement agencies so as to prevent \nunauthorized recipients, including criminals and terrorists, from acquiring small arms \nand light weapons;  \n \n13. Emphasizes that international cooperation and assistance remain essential \nto the full and effective implementation of the Programme of Action and the \nInternational Tracing Instrument, while being mindful of the need to ensure the \nadequacy, accessibility, effectiveness and sustainability of international cooperation \nand assistance measures, including, as appropriate, improved funding arrangements, \n__________________ \n \n7 See A/62/163 and A/62/163/Corr.1. \n \n8 Resolution 70/1. \n\nThe illicit trade in small arms and light weapons in all its aspects \nA/RES/79/40\n \n5/7\n24-23058 \n \ntechnology transfer and adequate training and support programmes, as well as strong \nnational ownership;  \n \n14. Also emphasizes the fact that initiatives by the international community \nwith respect to international cooperation and assistance remain essential and \ncomplementary to national implementation efforts, as well as to those at the regional \nand global levels; \n \n15. Recognizes the necessity for interested States to develop effective \ncoordination mechanisms, where they do not exist, to enhance the implementation of \nthe Programme of Action and strengthen the exchange of information on international \ncooperation and assistance, including experiences on completed assistance projects;  \n \n16. Encourages States to consider, among other mechanisms, the coherent \nidentification of needs, priorities, national plans and programmes that may require \ninternational cooperation and assistance from States and regional and international \norganizations in a position to do so; \n \n17. Decides to establish and maintain a structured procedure within the \nSecretariat, starting in 2026, to process offers of and requests for assistance submitted \nunder the Programme of Action and the International Tracing Instrument to facilitate \nthe matching of needs and resources, as outlined in paragraph 212 of the outcome \ndocument of the Fourth Review Conference; \n \n18. Requests the Secretariat to establish a dedicated funding mechanism under \nthe trust fund for global and regional disarmament activities to receive voluntary \ncontributions from Member States to advance international cooperation and \nassistance activities related to the implementation of the Programme of Action and \nthe International Tracing Instrument, complementary to the United Nations Trust \nFacility Supporting Cooperation on Arms Regulation, the Saving Lives Entity fund \nand other existing funding mechanisms; \n \n19. Encourages States to make, on a voluntary basis, increasing use of their \nnational reports as a tool for communicating assistance needs and information on the \nresources and mechanisms available to address such needs, and encourages States in \na position to render such assistance to make use of those national reports; \n \n20. Encourages States, relevant international and regional organizations and \ncivil society with the capacity to do so to cooperate with and provide assistance to \nother States, upon request, in the preparation of comprehensive national reports on \ntheir implementation of the Programme of Action and the International Tracing \nInstrument; \n \n21. Encourages States to reinforce, as necessary, cross-border cooperation at \nthe national, subregional and regional levels in addressing the common problem of \nthe illicit trade in small arms and light weapons in all its aspects, with full respect for \neach State\u2019s sovereignty over its own borders; \n \n22. Also encourages States to take full advantage of the benefits of \ncooperation with the United Nations regional centres for peace and disarmament, the \nWorld Customs Organization, the International Criminal Police Organization \n(INTERPOL) and the United Nations Office on Drugs and Crime, in accordance with \ntheir mandates and consistent with national priorities; \n \n23. Encourages all efforts to build national capacity for the effective \nimplementation of the Programme of Action, including those highlighted in the \noutcome document of the Third Review Conference; \n \n24. Recalls its decision, in its resolution 77/71, to establish a dedicated \nfellowship training programme on small arms and light weapons in order to strengthen \n\nA/RES/79/40 \nThe illicit trade in small arms and light weapons in all its aspects\n \n24-23058\n6/7 \n \ntechnical knowledge and expertise in areas relating to the implementation of the \nProgramme of Action and the International Tracing Instrument, in particular in \ndeveloping countries, for a duration of four weeks in-person in four regions, \nrespectively, preceded by a preparatory self-paced online course, with the \nparticipation of 15 fellows per region, and in order to expedite the implementation of \nthe programme, to provide the yearly financial resources necessary to ensure a \nsustained operationalization of this programme and urges its implementation in 2025, \nand requests the Secretary-General to operationalize the decision and to report \nthereon to the General Assembly at its eightieth session and periodically thereafter \nfor follow-up;  \n \n25. Encourages States to submit, on a voluntary basis, national reports on their \nimplementation of the Programme of Action, notes that States will submit national \nreports on their implementation of the International Tracing Instrument, encourages \nthose States in a position to do so to use the reporting template made available by the \nOffice for Disarmament Affairs of the Secretariat, and reaffirms the utility of \nsynchronizing such reports with biennial meetings of States and review conferences \nas a means of increasing the submission rate and improving the utility of reports, as \nwell as contributing substantively to meeting discussions; \n \n26. Encourages States in a position to do so to provide financial assistance, \nthrough a voluntary sponsorship fund, that could be distributed, upon request, to \nStates otherwise unable to participate in meetings on the Programme of Action; \n \n27. Welcomes the establishment of the Saving Lives Entity fund to ensure \nsustained financing for coordinated, integrated small arms control measures in \ncountries most affected by the illicit trade in small arms and light weapons, and \nencourages States in a position to do so to make voluntary financial contributions to \nthe fund; \n \n28. Encourages interested States and relevant international and regional \norganizations in a position to do so to convene regional meetings to consider and \nadvance the implementation of the Programme of Action, as well as the International \nTracing Instrument, including in preparation for the meetings on the Programme of \nAction; \n \n29. Encourages civil society, industry and relevant organizations to strengthen \ntheir cooperation and work with States at the respective national and regional levels \nto achieve the implementation of the Programme of Action; \n \n30. Reaffirms the importance of States\u2019 undertaking to identify, where \napplicable, groups and individuals engaged in the illegal manufacture, trade, \nstockpiling, transfer, possession, as well as financing for acquisition, of illicit small \narms and light weapons, and take action under appropriate national law against such \ngroups and individuals;  \n \n31. Requests the Secretariat to prepare a comprehensive analysis, within \nexisting resources, of progress in the trends, challenges and opportunities related to \nthe implementation of the Programme of Action and the International Tracing \nInstrument, including with regard to national frameworks, based on available credible \ninformation, including information submitted and/or provided by Member States, for \npresentation at the Biennial Meeting of States in 2026 for consideration and \nappropriate follow-up;  \n \n32. Also requests the Secretariat to report on support provided by the United \nNations system for the implementation of the Programme of Action and the \nInternational Tracing Instrument, including experiences, best practices and lessons \nlearned regarding the efficient use of available resources, for presentation at \n\nThe illicit trade in small arms and light weapons in all its aspects \nA/RES/79/40\n \n7/7\n24-23058 \n \nupcoming meetings on the Programme of Action and the International Tracing \nInstrument;  \n \n33. Decides to establish an open-ended technical expert group, convening for \nat least two days, and no more than three days, in 2026 and 2028, within the schedule \nof meetings of the Biennial Meetings of States, to develop agreed recommendations, \nby consensus, to ensure the full and effective implementation of the Programme of \nAction and the International Tracing Instrument in preventing, combating and \neradicating the illicit trade in small arms and light weapons in the light of \ndevelopments in small arms and light weapons manufacturing, technology and design, \nin particular polymer and modular weapons and firearms produced using three-\ndimensional printing, focusing on the provision of international cooperation and \nassistance, as outlined in paragraphs 174 to 178 of the outcome document of the \nFourth Review Conference;  \n \n34. Requests the Secretariat, within existing resources, to conduct a study on \nobliterated markings and methods for marking recovery in the context of the \nInternational Tracing Instrument and to report to the Biennial Meeting of States in \n2026; \n \n35. Requests the Secretary-General to report to the General Assembly at its \neightieth session on the implementation of the present resolution;  \n \n36. Decides to include in the provisional agenda of its eightieth session, under \nthe item entitled \u201cGeneral and complete disarmament\u201d, the sub-item entitled \u201cThe \nillicit trade in small arms and light weapons in all its aspects\u201d.  \n \n43rd plenary meeting \n2 December 2024 \n \n",
  "paragraphs": {
    "1": "Underlines the fact that the issue of the illicit trade in small arms and light weapons in all its aspects requires concerted efforts at the national, regional and international levels to prevent, combat and eradicate the illicit manufacture, brokering, transfer and circulation of small arms and light weapons, and that their uncontrolled proliferation in many regions of the world has a wide range of humanitarian and socioeconomic consequences and poses a serious threat to peace, reconciliation, safety, security, stability and sustainable development at the individual, local, national, regional and international levels;",
    "2": "Recognizes the urgent need to maintain and enhance national controls, in accordance with the Programme of Action to Prevent, Combat and Eradicate the Illicit Trade in Small Arms and Light Weapons in All Its Aspects, to prevent, combat and eradicate the illicit trade in small arms and light weapons, including their diversion to illicit trade, illegal armed groups, terrorists and other unauthorized recipients, taking into account, inter alia, their adverse humanitarian and socioeconomic consequences for the affected States;",
    "3": "Emphasizes the need for States to redouble national efforts to provide for the safe, secure, comprehensive and effective management of stockpiles of small arms and light weapons held by Governments to prevent, combat and eradicate the diversion of those weapons;",
    "4": "Calls upon all States to implement the International Instrument to Enable States to Identify and Trace, in a Timely and Reliable Manner, Illicit Small Arms and Light Weapons (the International Tracing Instrument) by, inter alia, including in their national reports the name and contact information of the national points of contact and information on national marking practices used to indicate country of manufacture and/or country of import, as applicable;",
    "5": "Encourages all relevant initiatives, including those of the United Nations, other international organizations, regional and subregional organizations and civil society, for the successful implementation of the Programme of Action, and calls upon all Member States to contribute towards the continued implementation of the Programme of Action at the national, regional and global levels;",
    "6": "Encourages States to implement the recommendations contained in the report of the Group of Governmental Experts established pursuant to resolution 60/81 of 8 December 2005 to consider further steps to enhance international cooperation in preventing, combating and eradicating illicit brokering in small arms and light weapons;7",
    "7": "Endorses the outcome of the Fourth United Nations Conference to Review Progress Made in the Implementation of the Programme of Action to Prevent, Combat and Eradicate the Illicit Trade in Small Arms and Light Weapons in All Its Aspects, held in New York from 17 to 28 June 2024;",
    "8": "Decides, pursuant to the schedule of meetings for the period from 2024 to 2030 agreed upon at the Fourth Review Conference, to convene, in New York, a one- week biennial meeting of States in 2026 (10 meetings) and a one-week biennial meeting of States in 2028 (10 meetings), to consider key challenges and opportunities relating to the implementation of the Programme of Action and the International Tracing Instrument at the national, regional and global levels;",
    "9": "Also decides to convene the Fifth United Nations Conference to Review Progress Made in the Implementation of the Programme of Action to Prevent, Combat and Eradicate the Illicit Trade in Small Arms and Light Weapons in All Its Aspects (and the International Tracing Instrument) in 2030 as a two-week event, to be preceded by a preparatory committee meeting of not more than five days, in early 2030;",
    "10": "Underlines the importance of the full and effective implementation of the Programme of Action and the International Tracing Instrument for attaining Goal 16 and target 16.4 of the 2030 Agenda for Sustainable Development; 8",
    "11": "Emphasizes the need for the equal, full, meaningful and effective participation of women in all decision-making and implementation processes relating to the Programme of Action and the International Tracing Instrument;",
    "12": "Encourages States to take into account recent developments in small arms and light weapons manufacturing, technology and design, in particular polymer and modular weapons, in the implementation of the Programme of Action and the International Tracing Instrument and to strengthen normative frameworks, where needed, and cooperation between law enforcement agencies so as to prevent unauthorized recipients, including criminals and terrorists, from acquiring small arms and light weapons;",
    "13": "Emphasizes that international cooperation and assistance remain essential to the full and effective implementation of the Programme of Action and the International Tracing Instrument, while being mindful of the need to ensure the adequacy, accessibility, effectiveness and sustainability of international cooperation and assistance measures, including, as appropriate, improved funding arrangements, technology transfer and adequate training and support programmes, as well as strong national ownership;",
    "14": "Also emphasizes the fact that initiatives by the international community with respect to international cooperation and assistance remain essential and complementary to national implementation efforts, as well as to those at the regional and global levels;",
    "15": "Recognizes the necessity for interested States to develop effective coordination mechanisms, where they do not exist, to enhance the implementation of the Programme of Action and strengthen the exchange of information on international cooperation and assistance, including experiences on completed assistance projects;",
    "16": "Encourages States to consider, among other mechanisms, the coherent identification of needs, priorities, national plans and programmes that may require international cooperation and assistance from States and regional and international organizations in a position to do so;",
    "17": "Decides to establish and maintain a structured procedure within the Secretariat, starting in 2026, to process offers of and requests for assistance submitted under the Programme of Action and the International Tracing Instrument to facilitate the matching of needs and resources, as outlined in paragraph 212 of the outcome document of the Fourth Review Conference;",
    "18": "Requests the Secretariat to establish a dedicated funding mechanism under the trust fund for global and regional disarmament activities to receive voluntary contributions from Member States to advance international cooperation and assistance activities related to the implementation of the Programme of Action and the International Tracing Instrument, complementary to the United Nations Trust Facility Supporting Cooperation on Arms Regulation, the Saving Lives Entity fund and other existing funding mechanisms;",
    "19": "Encourages States to make, on a voluntary basis, increasing use of their national reports as a tool for communicating assistance needs and information on the resources and mechanisms available to address such needs, and encourages States in a position to render such assistance to make use of those national reports;",
    "20": "Encourages States, relevant international and regional organizations and civil society with the capacity to do so to cooperate with and provide assistance to other States, upon request, in the preparation of comprehensive national reports on their implementation of the Programme of Action and the International Tracing Instrument;",
    "21": "Encourages States to reinforce, as necessary, cross-border cooperation at the national, subregional and regional levels in addressing the common problem of the illicit trade in small arms and light weapons in all its aspects, with full respect for each State\u2019s sovereignty over its own borders;",
    "22": "Also encourages States to take full advantage of the benefits of cooperation with the United Nations regional centres for peace and disarmament, the World Customs Organization, the International Criminal Police Organization (INTERPOL) and the United Nations Office on Drugs and Crime, in accordance with their mandates and consistent with national priorities;",
    "23": "Encourages all efforts to build national capacity for the effective implementation of the Programme of Action, including those highlighted in the outcome document of the Third Review Conference;",
    "24": " technical knowledge and expertise in areas relating to the implementation of the Programme of Action and the International Tracing Instrument, in particular in developing countries, for a duration of four weeks in-person in four regions, respectively, preceded by a preparatory self-paced online course, with the participation of 15 fellows per region, and in order to expedite the implementation of the programme, to provide the yearly financial resources necessary to ensure a sustained operationalization of this programme and urges its implementation in 2025, and requests the Secretary-General to operationalize the decision and to report thereon to the General Assembly at its eightieth session and periodically thereafter for follow-up;",
    "25": "Encourages States to submit, on a voluntary basis, national reports on their implementation of the Programme of Action, notes that States will submit national reports on their implementation of the International Tracing Instrument, encourages those States in a position to do so to use the reporting template made available by the Office for Disarmament Affairs of the Secretariat, and reaffirms the utility of synchronizing such reports with biennial meetings of States and review conferences as a means of increasing the submission rate and improving the utility of reports, as well as contributing substantively to meeting discussions;",
    "26": "Encourages States in a position to do so to provide financial assistance, through a voluntary sponsorship fund, that could be distributed, upon request, to States otherwise unable to participate in meetings on the Programme of Action;",
    "27": "Welcomes the establishment of the Saving Lives Entity fund to ensure sustained financing for coordinated, integrated small arms control measures in countries most affected by the illicit trade in small arms and light weapons, and encourages States in a position to do so to make voluntary financial contributions to the fund;",
    "28": "Encourages interested States and relevant international and regional organizations in a position to do so to convene regional meetings to consider and advance the implementation of the Programme of Action, as well as the International Tracing Instrument, including in preparation for the meetings on the Programme of Action;",
    "29": "Encourages civil society, industry and relevant organizations to strengthen their cooperation and work with States at the respective national and regional levels to achieve the implementation of the Programme of Action;",
    "30": "Reaffirms the importance of States\u2019 undertaking to identify, where applicable, groups and individuals engaged in the illegal manufacture, trade, stockpiling, transfer, possession, as well as financing for acquisition, of illicit small arms and light weapons, and take action under appropriate national law against such groups and individuals;",
    "31": "Requests the Secretariat to prepare a comprehensive analysis, within existing resources, of progress in the trends, challenges and opportunities related to the implementation of the Programme of Action and the International Tracing Instrument, including with regard to national frameworks, based on available credible information, including information submitted and/or provided by Member States, for presentation at the Biennial Meeting of States in 2026 for consideration and appropriate follow-up;",
    "32": " upcoming meetings on the Programme of Action and the International Tracing Instrument;",
    "33": "Decides to establish an open-ended technical expert group, convening for at least two days, and no more than three days, in 2026 and 2028, within the schedule of meetings of the Biennial Meetings of States, to develop agreed recommendations, by consensus, to ensure the full and effective implementation of the Programme of Action and the International Tracing Instrument in preventing, combating and eradicating the illicit trade in small arms and light weapons in the light of developments in small arms and light weapons manufacturing, technology and design, in particular polymer and modular weapons and firearms produced using three- dimensional printing, focusing on the provision of international cooperation and assistance, as outlined in paragraphs 174 to 178 of the outcome document of the Fourth Review Conference;",
    "34": "Requests the Secretariat, within existing resources, to conduct a study on obliterated markings and methods for marking recovery in the context of the International Tracing Instrument and to report to the Biennial Meeting of States in 2026;",
    "35": "Requests the Secretary-General to report to the General Assembly at its eightieth session on the implementation of the present resolution;",
    "36": "Decides to include in the provisional agenda of its eightieth session, under the item entitled \u201cGeneral and complete disarmament\u201d, the sub-item entitled \u201cThe illicit trade in small arms and light weapons in all its aspects\u201d."
  },
  "agenda_items": [
    "Item 98"
  ],
  "symbol_references": []
}