{
  "symbol": "A/RES/79/296",
  "filename": "A_RES_79_296.pdf",
  "title": "79/296. Comprehensive review of the whole question of peacekeeping operations in all their aspects",
  "text": "United Nations \nA/RES/79/296\n \n \nGeneral Assembly \nDistr.: General \n2 July 2025 \n \n25-10880 (E) \n*2510880* \n \n \nSeventy-ninth session \nAgenda item 51 \nComprehensive review of the whole question of \npeacekeeping operations in all their aspects \n \n \n \n \n Resolution adopted by the General Assembly on \n30 June 2025 \n \n \n \n \n[on the report of the Special Political and Decolonization Committee \n(Fourth Committee) (A/79/424/Add.1, para. 6)] \n \n \n 79/296. Comprehensive review of the whole question of peacekeeping \noperations in all their aspects \n \n \n \nThe General Assembly, \n \nRecalling its resolution 2006 (XIX) of 18 February 1965 and all other relevant \nresolutions, \n \nRecalling in particular its resolution 78/291 of 28 June 2024, \n \nAffirming that the efforts of the United Nations in the peaceful settlement of \ndisputes, including through its peacekeeping operations, are indispensable, \n \nConvinced of the need for the United Nations to continue to improve its \ncapabilities in the field of peacekeeping and to enhance the effective and efficient \ndeployment of its peacekeeping operations, \n \nConsidering the contribution that all States Members of the United Nations \nmake to peacekeeping, \n \nNoting the widespread interest in contributing to the work of the Special \nCommittee on Peacekeeping Operations expressed by Member States, in particular \ntroop- and police-contributing countries, \n \nBearing in mind the continuous necessity of preserving the efficiency and \nstrengthening the effectiveness of the work of the Special Committee, \n \n1. \nTakes note of the report of the Special Committee on Peacekeeping \nOperations;1 \n__________________ \n \n1 Official Records of the General Assembly, Seventy-ninth Session, Supplement No. 19 (A/79/19). \n\nA/RES/79/296 \nComprehensive review of the whole question of peacekeeping \noperations in all their aspects\n \n25-10880\n2/2 \n \n \n2. \nReiterates that those Member States that become personnel contributors to \nthe United Nations peacekeeping operations in years to come or that participate in the \nfuture in the Special Committee for three consecutive years as observers shall, upon \nrequest in writing to the Chair of the Special Committee, become members at the \nfollowing session of the Special Committee; \n \n3. \nDecides that the Special Committee, in accordance with its mandate, shall \ncontinue its efforts for a comprehensive review of the whole question of peacekeeping \noperations in all their aspects and shall review the implementation of its previous \nproposals and consider any new proposals so as to enhance the capacity of the United \nNations to fulfil its responsibilities in this field; \n \n4. \nRequests the Special Committee to submit a report on its work to the \nGeneral Assembly at its eightieth session; \n \n5. \nRequests the Secretary-General to submit a report to the Special \nCommittee at its 2026 session; \n \n6. \nDecides to include in the provisional agenda of its eightieth session the \nitem entitled \u201cComprehensive review of the whole question of peacekeeping \noperations in all their aspects\u201d. \n \n81st plenary meeting \n30 June 2025 \n \n",
  "paragraphs": {
    "1": "Takes note of the report of the Special Committee on Peacekeeping Operations;1",
    "2": "Reiterates that those Member States that become personnel contributors to the United Nations peacekeeping operations in years to come or that participate in the future in the Special Committee for three consecutive years as observers shall, upon request in writing to the Chair of the Special Committee, become members at the following session of the Special Committee;",
    "3": "Decides that the Special Committee, in accordance with its mandate, shall continue its efforts for a comprehensive review of the whole question of peacekeeping operations in all their aspects and shall review the implementation of its previous proposals and consider any new proposals so as to enhance the capacity of the United Nations to fulfil its responsibilities in this field;",
    "4": "Requests the Special Committee to submit a report on its work to the General Assembly at its eightieth session;",
    "5": "Requests the Secretary-General to submit a report to the Special Committee at its 2026 session;",
    "6": "Decides to include in the provisional agenda of its eightieth session the item entitled \u201cComprehensive review of the whole question of peacekeeping operations in all their aspects\u201d."
  },
  "agenda_items": [
    "Item 51"
  ],
  "symbol_references": []
}