{
  "symbol": "A/RES/78/216",
  "filename": "A_RES_78_216.pdf",
  "title": "78/216. Implementing the Declaration on the Right and Responsibility of Individuals, Groups and Organs of Society to Promote and Protect Universally Recognized Human Rights and Fundamental Freedoms through providing a safe and enabling environment for human rights defenders and ensuring their protection",
  "text": "United Nations \nA/RES/78/216\n \n \nGeneral Assembly \nDistr.: General \n22 December 2023 \n \n \n23-26002 (E)    100124 \n*2326002* \n \n \nSeventy-eighth session \nAgenda item 71 (b) \nPromotion and protection of human rights: human rights \nquestions, including alternative approaches for improving \nthe effective enjoyment of human rights and \nfundamental freedoms  \n \n \n \n \n Resolution adopted by the General Assembly \non 19 December 2023 \n \n \n \n \n[on the report of the Third Committee (A/78/481/Add.2, para. 139)] \n \n \n 78/216. Implementing the Declaration on the Right and Responsibility of \nIndividuals, Groups and Organs of Society to Promote and Protect \nUniversally Recognized Human Rights and Fundamental \nFreedoms through providing a safe and enabling environment for \nhuman rights defenders and ensuring their protection \n \n \n \nThe General Assembly, \n \nGuided by the purposes and principles of the Charter of the United Nations, \n \nGuided also by the Universal Declaration of Human Rights,1 the International \nCovenants on Human Rights2 and other relevant instruments, \n \nRecalling its resolution 53/144 of 9 December 1998, by which it adopted by \nconsensus the Declaration on the Right and Responsibility of Individuals, Groups and \nOrgans of Society to Promote and Protect Universally Recognized Human Rights and \nFundamental Freedoms, commonly referred to as the Declaration on Human Rights \nDefenders, and encouraging States to uphold the purposes, principles and provisions \nof the Declaration in the context of its implementation, \n \nStressing, in this regard, that all human rights and fundamental freedoms apply \nto all persons equally, including human rights defenders, in the context of the \nDeclaration, and that these rights and freedoms must be respected, protected and \nfulfilled without discrimination, \n__________________ \n \n1  Resolution 217 A (III). \n \n2  Resolution 2200 A (XXI), annex. \n\nA/RES/78/216 \nImplementing the Declaration on the Right and Responsibility of Individuals, \nGroups and Organs of Society to Promote and Protect Universally Recognized \nHuman Rights and Fundamental Freedoms through providing a safe and enabling \nenvironment for human rights defenders and ensuring their protection\n \n23-26002\n2/9 \n \n \nRecalling all other previous resolutions on this subject, including its resolution \n76/174 of 16 December 2021 and Human Rights Council resolutions 49/18 of 1 April \n20223 and 52/4 of 3 April 2023,4 \n \nRecalling also resolution 68/181 of 18 December 2013 acknowledging the \nimportant and legitimate role of all women human rights defenders in the promotion \nand protection of human rights for all, contributing to gender equality, democracy, the \nrule of law, peace and security and sustainable development,  \n \nNoting that 2023 marks the seventy-fifth anniversary of the Universal \nDeclaration of Human Rights and the thirtieth anniversary of the Vienna Declaration \nand Programme of Action,5 and acknowledging the importance of these instruments \nfor the promotion and the protection of all human rights,  \n \nNoting also that 2023 marks the twenty-fifth anniversary of the Declaration on \nthe Right and Responsibility of Individuals, Groups and Organs of Society to Promote \nand Protect Universally Recognized Human Rights and Fundamental Freedoms, \ncommonly referred to as the Declaration on Human Rights Defenders, \n \nEmphasizing that these anniversaries offer a valuable opportunity to raise \nawareness and to reflect on achievements, best practices and challenges with regard \nto the full realization of human rights for all, without discrimination of any kind, \n \nReaffirming that States have the primary responsibility and are under the \nobligation to respect, promote and protect all human rights and fundamental freedoms \nof all persons, \n \nReiterating that all human rights and fundamental freedoms are universal, \nindivisible, interdependent and interrelated and should be promoted and implemented \nin a fair and equitable manner, without prejudice to the implementation of each of \nthose rights and freedoms, \n \nRecognizing that the work of human rights defenders to promote and protect \nhuman rights can contribute to achieving sustainable development and strengthening \npeace and security,  \n \nReaffirming the importance of the Declaration on Human Rights Defenders and \nits full and effective implementation, and that promoting respect, support and \nprotection for the activities of human rights defenders, including women, Indigenous \nand environmental human rights defenders, is essential to the overall enjoyment of \nhuman rights, and recognizing the substantial role that human rights defenders can \nplay in supporting efforts to strengthen conflict prevention, peace and sustainable \ndevelopment, including environmental protection, through dialogue, openness, \nparticipation and justice, including by monitoring, reporting on and contributing to \nthe promotion and protection of all civil, political, economic, social and cultural \nrights, and other rights, including the right to development, and in the context of the \nimplementation of the 2030 Agenda for Sustainable Development, 6 \n \nRecognizing the positive, important and legitimate role played by human rights \ndefenders in the promotion and protection of human rights as they relate to the \nenjoyment of a safe, clean, healthy and sustainable environment, and deeply concerned \nthat human rights defenders working in environmental matters, referred to as \n__________________ \n \n3  See Official Records of the General Assembly, Seventy-seventh Session, Supplement No. 53 \n(A/77/53), chap. VI, sect. A. \n \n4  Ibid., Seventy-eighth Session, Supplement No. 53 (A/78/53), chap. V, sect. A. \n \n5  A/CONF.157/24 (Part I), chap. III. \n \n6  Resolution 70/1. \n\nImplementing the Declaration on the Right and Responsibility of Individuals, \nGroups and Organs of Society to Promote and Protect Universally Recognized \nHuman Rights and Fundamental Freedoms through providing a safe and \nenabling environment for human rights defenders and ensuring their protection \nA/RES/78/216\n \n3/9\n23-26002 \n \nenvironmental human rights defenders, are among the human rights defenders most \nexposed and at risk, \n \nUnderscoring the positive, important and legitimate role of human rights \ndefenders in promoting and advocating the realization of all human rights, at the local, \nnational, regional and international levels, including by engaging with Governments \nand contributing to the efforts in the implementation of the obligations and \ncommitments of States in this regard, \n \nRecognizing the important and legitimate role of human rights defenders, \nincluding women human rights defenders, in the promotion and protection of human \nrights, including in conflict and post-conflict situations, with regard to monitoring, \ndocumenting and raising awareness about human rights violations and abuses and, as \napplicable, violations of international humanitarian law, promoting accountability, \nfighting impunity, countering hate speech, misinformation and disinformation, \nassisting victims of human rights violations and abuses in gaining access to justice, \nadvancing gender equality and the empowerment of all women and girls, raising \nawareness of the human rights impacts of conflict and humanitarian emergencies, and \ncontributing to the building of accountable and responsive institutions, \n \nStressing that, in the exercise of the rights and freedoms referred to in the \nDeclaration, human rights defenders, acting individually and in association with others, \nshall be subject only to such limitations as are in accordance with applicable \ninternational obligations and are determined by law solely for the purpose of securing \ndue recognition and respect for the rights and freedoms of others and of meeting the \njust requirements of morality, public order and the general welfare in a democratic \nsociety, \n \nUnderscoring that the legal framework within which human rights defenders work \npeacefully to promote and protect human rights and fundamental freedoms is that of \nnational legislation consistent with the Charter and international human rights law, \n \nWelcoming the steps taken by some States to create a safe and enabling \nenvironment, online and offline, for the promotion, protection and defence of human \nrights, and recognizing in this regard the positive efforts by authorities, national \nhuman rights institutions, where they exist, and civil society towards the development \nand enactment of relevant national policies, laws, programmes and practices, and the \nmonitoring of their implementation,  \n \nMindful that domestic law and administrative provisions and their application \nshould not hinder but enable the work, both online and offline, of human rights \ndefenders, including by avoiding any criminalization, stigmatization, impediments, \nobstructions or restrictions thereof, contrary to the obligations and commitments of \nStates under international human rights law, \n \nRecognizing that, while the institutional measures for the protection of human \nrights defenders and the promotion of their work within the United Nations, regional \norganizations and national systems have grown in number since the adoption of the \nDeclaration, they remain insufficient to address the ongoing human rights violations \nand abuses against human rights defenders around the world, and that strengthened \nefforts are required for the effective implementation of the Declaration, \n \nGravely concerned that, in many countries, persons and organizations engaged \nin promoting and defending human rights and fundamental freedoms frequently face \nthreats, harassment, discrimination, attacks and unlawful or arbitrary surveillance, \nboth online and offline, and suffer insecurity as a result of those activities, including \nthrough restrictions on freedom of association or expression or the right to peaceful \nassembly, arbitrary arrests and detention, abuse of criminal or civil proceedings or \ndeplorable acts of intimidation and reprisal intended to hinder and prevent their \n\nA/RES/78/216 \nImplementing the Declaration on the Right and Responsibility of Individuals, \nGroups and Organs of Society to Promote and Protect Universally Recognized \nHuman Rights and Fundamental Freedoms through providing a safe and enabling \nenvironment for human rights defenders and ensuring their protection\n \n23-26002\n4/9 \n \ncooperation with the United Nations and other international and regional bodies in \nthe field of human rights, and strongly condemning all such violations and abuses, \n \nDeeply concerned at the persistence of multiple and intersecting forms of \ndiscrimination against women and girls, online and offline, and all forms of violence \nagainst women and girls, including sexual and gender-based violence, noting that \ndefamation, stigmatization, smear campaigns and hate speech against women human \nrights defenders often aim to undermine their legitimacy and silence them, that \nwomen promoting access to sexual and reproductive health-care services may face \nstigma and violence, and that restrictive or discriminatory legislation or gender \nstereotypes and negative social norms can amplify these risks and embolden \nperpetrators of such attacks, \n \nGravely concerned that national security, counter-terrorism and cybercrime \nlegislation and other measures, such as laws regulating civil society organizations, \nare in some instances misused to target human rights defenders or have hindered their \nwork and endangered their safety in a manner contrary to international law, \n \nRecognizing the pressing importance of addressing, and taking concrete steps to \nprevent and stop, the use of legislation to hinder or limit unduly the ability of human \nrights defenders to exercise their work and access resources, including by reviewing \nand, where necessary, amending relevant legislation and its implementation in order \nto ensure compliance with international human rights law, \n \nRecognizing also that the protection of human rights defenders can be fully \nachieved only in the context of a holistic approach that includes the strengthening of \ndemocratic institutions, safeguarding civic space, the fight against impunity, ending \ngender and economic inequality and social exclusion, and equal access to justice, \n \nStressing the importance of meaningful participation of human rights defenders \nin the implementation of the Declaration, and reaffirming the right of everyone, \nindividually and in association with others, to unhindered access to and \ncommunication with international bodies, both online and offline, in particular the \nUnited Nations, its representatives and mechanisms in the field of human rights, \nincluding the Human Rights Council and its special procedures, the universal periodic \nreview mechanism and treaty bodies, as well as regional human rights mechanisms, \nin accordance with their respective mandates, existing rules of procedure and \nmodalities, without fear of reprisals, \n \nStressing also the need for further action by States and non-State actors to \npromote a safe and enabling environment for human rights defenders and their \nprotection, taking into account their diversity and the diverse contexts in which they \noperate, \n \n1. \nWelcomes the seventy-fifth anniversary of the Universal Declaration of \nHuman Rights, the thirtieth anniversary of the Vienna Declaration and Programme of \nAction and the twenty-fifth anniversary of the Declaration on the Right and \nResponsibility of Individuals, Groups and Organs of Society to Promote and Protect \nUniversally Recognized Human Rights and Fundamental Freedoms, 7 commonly \nreferred to as the Declaration on Human Rights Defenders, and stresses the \nimportance of the mandates of the Human Rights Council, the United Nations High \nCommissioner for Human Rights and all other United Nations human rights \nmechanisms with regard to the promotion and protection of the effective enjoyment \nby all of the human rights and fundamental freedoms enshrined in the Universal \nDeclaration of Human Rights and referenced in the Vienna Declaration and \n__________________ \n \n7  Resolution 53/144, annex. \n\nImplementing the Declaration on the Right and Responsibility of Individuals, \nGroups and Organs of Society to Promote and Protect Universally Recognized \nHuman Rights and Fundamental Freedoms through providing a safe and \nenabling environment for human rights defenders and ensuring their protection \nA/RES/78/216\n \n5/9\n23-26002 \n \nProgramme of Action, the Beijing Platform for Action 8 and the Declaration on Human \nRights Defenders; \n \n2. \nEncourages States to use these anniversaries to raise awareness of the \nUniversal Declaration of Human Rights and the Vienna Declaration and Programme \nof Action, and their role in the promotion and protection of all human rights and \nfundamental freedoms, and to acknowledge and celebrate the Declaration on Human \nRights Defenders and the contributions of human rights defenders to the realization \nof all human rights for all; \n \n3. \nTakes note with appreciation of the work of human rights defenders, \nincluding women human rights defenders, to develop and discuss new human rights \nideas, including how human rights relate to, inter alia, sustainable development, \nclimate change, environment, business, new digital technologies, and all forms of \ndiscrimination, and disseminate information about and advocate the acceptance of \nsuch ideas as a contribution to the realization of human rights for all; \n \n4. \nUrges States to redouble their efforts in fulfilling their duty to promote \nand protect all human rights and fundamental freedoms enshrined in the Universal \nDeclaration of Human Rights and referenced in the Vienna Declaration and \nProgramme of Action and the Declaration on Human Rights Defenders; \n \n5. \nAffirms the important role of human rights defenders in supporting States \nto realize the 2030 Agenda for Sustainable Development, including the pledge that no \none will be left behind and to reach the furthest behind first; \n \n6. \nExpresses grave concern at the situation of human rights defenders around \nthe world, strongly condemns the violence against and the criminalization, \nharassment, intimidation, attacks, torture, enforced disappearance, arbitrary arrest \nand detention, killing of and all other human rights violations or abuses against human \nrights defenders, including women, environmental and Indigenous human rights \ndefenders, by State and non-State actors, and stresses the need to combat impunity by \nensuring that those responsible for violations and abuses against human rights \ndefenders, including against their legal representatives, associates and family \nmembers, are promptly brought to justice through impartial investigations; \n \n7. \nCondemns all acts of intimidation and reprisal, both online and offline, by \nState and non-State actors against individuals, groups and organs of society, including \nagainst human rights defenders and their legal representatives, associates and family \nmembers, who seek to cooperate, are cooperating or have cooperated with \nsubregional, regional and international bodies, including the United Nations, its \nrepresentatives and mechanisms, in the field of human rights, and strongly calls upon \nall States to give effect to the right of everyone, individually and in association with \nothers, to unhindered access to and communication with international bodies, \nincluding the United Nations, its special procedures, the universal periodic review \nmechanism and the treaty bodies, as well as regional human rights mechanisms; \n \n8. \nWelcomes the work and takes note of the reports of the Special Rapporteur \non the situation of human rights defenders presented to the Human Rights Council and \nthe General Assembly, and encourages all States to consider implementing \nrecommendations contained in the reports and to cooperate with and assist the Special \nRapporteur; \n \n9. \nCalls upon States to ensure that the criminalization and prosecution of \nterrorism or national security offences, and the measures used to address threats in \nthis regard, are in accordance with their obligations under international human rights \n__________________ \n \n8  Report of the Fourth World Conference on Women, Beijing, 4\u201315 September 1995 (United \nNations publication, Sales No. E.96.IV.13), chap. I, resolution 1, annex II. \n\nA/RES/78/216 \nImplementing the Declaration on the Right and Responsibility of Individuals, \nGroups and Organs of Society to Promote and Protect Universally Recognized \nHuman Rights and Fundamental Freedoms through providing a safe and enabling \nenvironment for human rights defenders and ensuring their protection\n \n23-26002\n6/9 \n \nlaw, to avoid endangering the safety of human rights defenders or unduly hindering \ntheir work; \n \n10. Also calls upon States to take concrete steps to prevent and put an end to \narbitrary arrest and detention, including of human rights defenders, and in this regard \nstrongly urges the release of persons detained or imprisoned, in violation of the \nobligations and commitments of States under international human rights law, for \nexercising their human rights and fundamental freedoms, such as the rights to freedom \nof expression, peaceful assembly and association, including in relation to cooperation \nwith the United Nations or other international mechanisms in the area of human rights; \n \n11. \nUrges States to promote a safe and enabling environment, online and \noffline, including through the implementation of existing national legislation that is \nin compliance with international human rights law and, where necessary, through the \nadoption and implementation of more comprehensive legislative and administrative \nmeasures, in which human rights defenders can operate free from hindrance, arbitrary \nor unlawful surveillance, reprisals and insecurity, ensuring, among other things, the \nright to take part in the conduct of public affairs and in cultural life, the freedom to \nseek, receive and impart information and equal access to justice, including to an \neffective remedy; \n \n12. Stresses the legitimate and valuable role of women human rights defenders \nin promoting the human rights of women and girls, promoting access to sexual and \nreproductive health-care services, contributing to gender equality and the \nempowerment of all women and girls, and combating gender-based discrimination \nand violence, including discrimination and violence that occurs through or is \namplified by the use of technologies; \n \n13. Continues to express particular concern about systemic and structural \ndiscrimination, \neconomic \ndisenfranchisement, \nviolence \nand \nharassment \ndisproportionately faced by women human rights defenders in diverse situations and \nconditions, including sexual and gender-based violence as well as defamation and \nsmear campaigns, both online and offline; \n \n14. Condemns all attacks on women human rights defenders, and reiterates its \nstrong call upon States to take appropriate, robust and practical steps to protect \nwomen human rights defenders and to integrate a gender perspective into their efforts \nto create a safe and enabling environment for the defence of human rights;  \n \n15. Recognizes the contributions of children, their views being given due \nweight in accordance with their age and maturity, and youth in defending human \nrights, democracy and the rule of law and expresses deep concern about the threats, \nhuman rights violations and abuses and discrimination they may face because of their \nage and the nature of their civic engagement and as a result of their activities in \npromoting human rights, and in this regard calls upon States to provide a safe, \nenabling and empowering environment for young people to promote human rights; \n \n16. Also recognizes that democracy and the rule of law are essential \ncomponents for the creation of a safe and enabling environment, and the protection \nof human rights defenders, and urges States to take measures to strengthen democratic \ninstitutions, safeguard civic space, uphold the rule of law and combat impunity; \n \n17. Calls upon States to promote, through public statements, policies, \nprogrammes or laws, the important and legitimate role of human rights defenders, \nincluding women human rights defenders, in the promotion of all human rights, \ndemocracy and the rule of law as essential components of ensuring their protection, \nincluding by respecting the independence of their organizations and by denouncing \nthe stigmatization of their work;  \n\nImplementing the Declaration on the Right and Responsibility of Individuals, \nGroups and Organs of Society to Promote and Protect Universally Recognized \nHuman Rights and Fundamental Freedoms through providing a safe and \nenabling environment for human rights defenders and ensuring their protection \nA/RES/78/216\n \n7/9\n23-26002 \n \n \n18. Calls upon all States to take all measures necessary to ensure the rights \nand safety of all persons, including human rights defenders, who exercise, inter alia, \nthe rights to freedom of opinion, expression, peaceful assembly and association, \nwhich are essential for the promotion and protection of human rights; \n \n19. Calls upon States and encourages non-State actors to ensure that those \ninvolved in the protection of human rights defenders, their legal representatives, \nassociates or family members are trained in human rights and the protection-related \nneeds of human rights defenders at risk; \n \n20. Underlines the legitimate and valuable role of human rights defenders in \nmediation efforts and in supporting victims in accessing effective remedies for \nviolations and abuses of their human rights, including economic, social and cultural \nrights, including for members of impoverished communities and communities in \nvulnerable situations and for those belonging to minorities and Indigenous Peoples; \n \n21. Calls upon States to take appropriate measures for the prevention of all \nforms of violence, intimidation, threats, harassment and attacks against human rights \ndefenders on the Internet and through digital technologies and tools, to refrain from \nthe use of surveillance technologies against human rights defenders, in a manner that \nis not compliant with international human rights obligations, and to protect human \nrights defenders, including women human rights defenders, in online spaces and to \nconsider adopting laws, policies and practices that protect them against online threats \nof violence and intimidation while also affirming the rights to freedom of expression \nand privacy, and further encourages social media companies to condemn attacks \nagainst human rights defenders when they occur on their platforms; \n \n22. Also calls upon States to refrain from Internet shutdowns, network \nrestrictions or any other measures aiming to disrupt or prevent human rights \ndefenders, including women human rights defenders, from having access to and \ndisseminating information and communicating safely and securely, including \ninterference with the use of technologies, such as encryption and anonymity tools, \nand to ensure that any restrictions thereon comply with the obligations of States under \ninternational human rights law; \n \n23. Urges States to investigate, in a prompt, effective, independent and \naccountable manner, complaints and allegations regarding threats or human rights \nviolations and abuses perpetrated by State and non-State actors, including against \nhuman rights defenders, their legal representatives, associates or family members, \nand to initiate, when appropriate, proceedings against the perpetrators so as to ensure \nthat impunity for such acts is eliminated and, as far as possible, to report publicly on \ninvestigations and proceedings; \n \n24. Calls upon States to develop and implement appropriate and effective \nprotection mechanisms for human rights defenders at risk or in vulnerable situations, \nincluding through meaningful consultation with them and based on comprehensive \nrisk analysis, and also to ensure that these mechanisms are holistic, appropriately \nresourced, age- and gender-sensitive, and respond to the protection needs of \nindividuals and the communities in which they live, functioning also as an early \nwarning to ensure that human rights defenders, when threatened, have immediate \naccess to authorities that are competent and adequately resourced to provide effective \nprotective measures, while further research should be undertaken, with a view to \nimproving the effectiveness of existing protection mechanisms; \n \n25. Underlines the value of national human rights institutions, established and \noperating in accordance with the principles relating to the status of national \n\nA/RES/78/216 \nImplementing the Declaration on the Right and Responsibility of Individuals, \nGroups and Organs of Society to Promote and Protect Universally Recognized \nHuman Rights and Fundamental Freedoms through providing a safe and enabling \nenvironment for human rights defenders and ensuring their protection\n \n23-26002\n8/9 \n \ninstitutions for the promotion and protection of human rights (the Paris Principles), 9 \nin the continued engagement with human rights defenders and in the monitoring of \nexisting legislation and consistently informing the State about its impact on the \nactivities of human rights defenders, including by making relevant and concrete \nrecommendations, while noting with concern that national human rights institutions \nand their members and staff may themselves sometimes be in need of protection; \n \n26. Strongly encourages States to develop and put in place comprehensive, \nsustainable and age- and gender-responsive public policies and programmes that \nsupport and protect human rights defenders at all stages of their work, online and \noffline, that ensure effective coordination between relevant institutional actors, \nincluding coordination within national and local levels, and address causes of attacks \nagainst defenders and barriers against the defence of rights, and that take into account, \ninter alia, the diversity of human rights defenders and the diverse contexts in which \nthey operate, and the intersectional dimensions of violations and abuses against \nwomen human rights defenders, Indigenous Peoples, children, persons with \ndisabilities, persons belonging to minorities and rural communities and human rights \ndefenders working to address racism, racial discrimination, xenophobia and related \nintolerance; \n \n27. \nStrongly reaffirms the urgent need to respect, protect, facilitate and promote \nthe work of human rights defenders promoting and defending economic, social and \ncultural rights, as a vital factor contributing towards the realization of those rights, \nincluding as they relate to environmental, land and Indigenous Peoples\u2019 issues and \nbusiness activity, as well as development, including through corporate accountability; \n \n28. Urges non-State actors, including transnational corporations and other \nbusiness enterprises, to assume their responsibility to respect the human rights and \nfundamental freedoms of all persons, including human rights defenders, and \nunderlines the need to ensure human rights due diligence and the accountability of, \nand the provision of adequate remedies by, transnational corporations and other \nbusiness enterprises, while also urging States to adopt relevant policies and laws in \nthis regard, including to hold all companies to account for involvement in threats or \nattacks against human rights defenders; \n \n29. Calls upon all States and encourages non-State actors to implement the \nGuiding Principles on Business and Human Rights: Implementing the United Nations \n\u201cProtect, Respect and Remedy\u201d Framework,10 underscores the responsibility of all \nbusiness enterprises, both transnational and other, to respect human rights, including \nthe rights to life and to liberty and security of person of human rights defenders, and \ntheir exercise of the rights to freedom of expression, peaceful assembly and \nassociation, and participation in the conduct of public affairs, and underscores further \nthe importance that business enterprises establish or participate in effective and \naccessible operational-level grievance mechanisms for individuals and communities \nwho may be adversely impacted; \n \n30. Recognizes the important contribution of the promotion and protection of \nthe safety of human rights defenders in the realization of the Sustainable Development \nGoals, including target 16.10, and calls upon States to strengthen national \ndisaggregated data collection, analysis and reporting on the number of verified cases \nof killing, kidnapping, enforced disappearance, arbitrary detention, torture and other \nharmful acts against human rights advocates, as reflected in Sustainable Development \nGoal indicator 16.10.1, and to do their utmost to make these data available to the \nrelevant entities; \n__________________ \n \n9  Resolution 48/134, annex. \n \n10  A/HRC/17/31, annex. \n\nImplementing the Declaration on the Right and Responsibility of Individuals, \nGroups and Organs of Society to Promote and Protect Universally Recognized \nHuman Rights and Fundamental Freedoms through providing a safe and \nenabling environment for human rights defenders and ensuring their protection \nA/RES/78/216\n \n9/9\n23-26002 \n \n \n31. Takes note of the Secretary-General\u2019s Call to Action for Human Rights, \nand the United Nations Guidance Note on the Protection and Promotion of Civic \nSpace; \n \n32. Encourages all concerned United Nations system entities and \norganizations, within their mandates, to implement the United Nations Guidance Note \non the Protection and Promotion of Civic Space, and to consider ways in which they \ncan assist States, upon their request, in creating and maintaining a safe and enabling \nenvironment for human rights defenders, including women human rights defenders, \nand ensuring their protection; \n \n33. Encourages the Office of the United Nations High Commissioner for \nHuman Rights, in consultation with the Special Rapporteur and other special \nprocedures of the Human Rights Council, to continue to compile and share \ninformation on best practices and challenges for the development of a more coherent \napproach to support the Declaration by the United Nations; \n \n34. Also encourages the Office of the United Nations High Commissioner for \nHuman Rights to continue its work, within its mandate, including in cooperation with \nStates, regional organizations, civil society and human rights defenders, on collecting \ninformation on threats and attacks against human rights defenders, including cases of \ntheir arbitrary detention and deprivation of liberty for exercising their human rights, \nand to make this information publicly available through existing channels; \n \n35. Requests all concerned United Nations system entities and organizations, \nwithin their mandates, to provide all possible assistance and support to the Special \nRapporteur for the effective fulfilment of her mandate, including in the context of \ncountry visits and through suggestions on ways and means of ensuring the protection \nof human rights defenders; \n \n36. Requests the Special Rapporteur to continue to report annually on her \nactivities to the General Assembly and the Human Rights Council, in accordance with \nthe mandate; \n \n37. Decides to remain seized of the matter. \n \n50th plenary meeting \n19 December 2023 \n \n",
  "paragraphs": {
    "1": "Welcomes the seventy-fifth anniversary of the Universal Declaration of Human Rights, the thirtieth anniversary of the Vienna Declaration and Programme of Action and the twenty-fifth anniversary of the Declaration on the Right and Responsibility of Individuals, Groups and Organs of Society to Promote and Protect Universally Recognized Human Rights and Fundamental Freedoms, 7 commonly referred to as the Declaration on Human Rights Defenders, and stresses the importance of the mandates of the Human Rights Council, the United Nations High Commissioner for Human Rights and all other United Nations human rights mechanisms with regard to the promotion and protection of the effective enjoyment by all of the human rights and fundamental freedoms enshrined in the Universal Declaration of Human Rights and referenced in the Vienna Declaration and Programme of Action, the Beijing Platform for Action 8 and the Declaration on Human Rights Defenders;",
    "2": "Encourages States to use these anniversaries to raise awareness of the Universal Declaration of Human Rights and the Vienna Declaration and Programme of Action, and their role in the promotion and protection of all human rights and fundamental freedoms, and to acknowledge and celebrate the Declaration on Human Rights Defenders and the contributions of human rights defenders to the realization of all human rights for all;",
    "3": "Takes note with appreciation of the work of human rights defenders, including women human rights defenders, to develop and discuss new human rights ideas, including how human rights relate to, inter alia, sustainable development, climate change, environment, business, new digital technologies, and all forms of discrimination, and disseminate information about and advocate the acceptance of such ideas as a contribution to the realization of human rights for all;",
    "4": "Urges States to redouble their efforts in fulfilling their duty to promote and protect all human rights and fundamental freedoms enshrined in the Universal Declaration of Human Rights and referenced in the Vienna Declaration and Programme of Action and the Declaration on Human Rights Defenders;",
    "5": "Affirms the important role of human rights defenders in supporting States to realize the 2030 Agenda for Sustainable Development, including the pledge that no one will be left behind and to reach the furthest behind first;",
    "6": "Expresses grave concern at the situation of human rights defenders around the world, strongly condemns the violence against and the criminalization, harassment, intimidation, attacks, torture, enforced disappearance, arbitrary arrest and detention, killing of and all other human rights violations or abuses against human rights defenders, including women, environmental and Indigenous human rights defenders, by State and non-State actors, and stresses the need to combat impunity by ensuring that those responsible for violations and abuses against human rights defenders, including against their legal representatives, associates and family members, are promptly brought to justice through impartial investigations;",
    "7": "Condemns all acts of intimidation and reprisal, both online and offline, by State and non-State actors against individuals, groups and organs of society, including against human rights defenders and their legal representatives, associates and family members, who seek to cooperate, are cooperating or have cooperated with subregional, regional and international bodies, including the United Nations, its representatives and mechanisms, in the field of human rights, and strongly calls upon all States to give effect to the right of everyone, individually and in association with others, to unhindered access to and communication with international bodies, including the United Nations, its special procedures, the universal periodic review mechanism and the treaty bodies, as well as regional human rights mechanisms;",
    "8": "Welcomes the work and takes note of the reports of the Special Rapporteur on the situation of human rights defenders presented to the Human Rights Council and the General Assembly, and encourages all States to consider implementing recommendations contained in the reports and to cooperate with and assist the Special Rapporteur;",
    "9": "Calls upon States to ensure that the criminalization and prosecution of terrorism or national security offences, and the measures used to address threats in this regard, are in accordance with their obligations under international human rights law, to avoid endangering the safety of human rights defenders or unduly hindering their work;",
    "10": "Also calls upon States to take concrete steps to prevent and put an end to arbitrary arrest and detention, including of human rights defenders, and in this regard strongly urges the release of persons detained or imprisoned, in violation of the obligations and commitments of States under international human rights law, for exercising their human rights and fundamental freedoms, such as the rights to freedom of expression, peaceful assembly and association, including in relation to cooperation with the United Nations or other international mechanisms in the area of human rights;",
    "11": "Urges States to promote a safe and enabling environment, online and offline, including through the implementation of existing national legislation that is in compliance with international human rights law and, where necessary, through the adoption and implementation of more comprehensive legislative and administrative measures, in which human rights defenders can operate free from hindrance, arbitrary or unlawful surveillance, reprisals and insecurity, ensuring, among other things, the right to take part in the conduct of public affairs and in cultural life, the freedom to seek, receive and impart information and equal access to justice, including to an effective remedy;",
    "12": "Stresses the legitimate and valuable role of women human rights defenders in promoting the human rights of women and girls, promoting access to sexual and reproductive health-care services, contributing to gender equality and the empowerment of all women and girls, and combating gender-based discrimination and violence, including discrimination and violence that occurs through or is amplified by the use of technologies;",
    "13": "Continues to express particular concern about systemic and structural discrimination, economic disenfranchisement, violence and harassment disproportionately faced by women human rights defenders in diverse situations and conditions, including sexual and gender-based violence as well as defamation and smear campaigns, both online and offline;",
    "14": "Condemns all attacks on women human rights defenders, and reiterates its strong call upon States to take appropriate, robust and practical steps to protect women human rights defenders and to integrate a gender perspective into their efforts to create a safe and enabling environment for the defence of human rights;",
    "15": "Recognizes the contributions of children, their views being given due weight in accordance with their age and maturity, and youth in defending human rights, democracy and the rule of law and expresses deep concern about the threats, human rights violations and abuses and discrimination they may face because of their age and the nature of their civic engagement and as a result of their activities in promoting human rights, and in this regard calls upon States to provide a safe, enabling and empowering environment for young people to promote human rights;",
    "16": "Also recognizes that democracy and the rule of law are essential components for the creation of a safe and enabling environment, and the protection of human rights defenders, and urges States to take measures to strengthen democratic institutions, safeguard civic space, uphold the rule of law and combat impunity;",
    "17": "",
    "18": "Calls upon all States to take all measures necessary to ensure the rights and safety of all persons, including human rights defenders, who exercise, inter alia, the rights to freedom of opinion, expression, peaceful assembly and association, which are essential for the promotion and protection of human rights;",
    "19": "Calls upon States and encourages non-State actors to ensure that those involved in the protection of human rights defenders, their legal representatives, associates or family members are trained in human rights and the protection-related needs of human rights defenders at risk;",
    "20": "Underlines the legitimate and valuable role of human rights defenders in mediation efforts and in supporting victims in accessing effective remedies for violations and abuses of their human rights, including economic, social and cultural rights, including for members of impoverished communities and communities in vulnerable situations and for those belonging to minorities and Indigenous Peoples;",
    "21": "Calls upon States to take appropriate measures for the prevention of all forms of violence, intimidation, threats, harassment and attacks against human rights defenders on the Internet and through digital technologies and tools, to refrain from the use of surveillance technologies against human rights defenders, in a manner that is not compliant with international human rights obligations, and to protect human rights defenders, including women human rights defenders, in online spaces and to consider adopting laws, policies and practices that protect them against online threats of violence and intimidation while also affirming the rights to freedom of expression and privacy, and further encourages social media companies to condemn attacks against human rights defenders when they occur on their platforms;",
    "22": "Also calls upon States to refrain from Internet shutdowns, network restrictions or any other measures aiming to disrupt or prevent human rights defenders, including women human rights defenders, from having access to and disseminating information and communicating safely and securely, including interference with the use of technologies, such as encryption and anonymity tools, and to ensure that any restrictions thereon comply with the obligations of States under international human rights law;",
    "23": "Urges States to investigate, in a prompt, effective, independent and accountable manner, complaints and allegations regarding threats or human rights violations and abuses perpetrated by State and non-State actors, including against human rights defenders, their legal representatives, associates or family members, and to initiate, when appropriate, proceedings against the perpetrators so as to ensure that impunity for such acts is eliminated and, as far as possible, to report publicly on investigations and proceedings;",
    "24": "Calls upon States to develop and implement appropriate and effective protection mechanisms for human rights defenders at risk or in vulnerable situations, including through meaningful consultation with them and based on comprehensive risk analysis, and also to ensure that these mechanisms are holistic, appropriately resourced, age- and gender-sensitive, and respond to the protection needs of individuals and the communities in which they live, functioning also as an early warning to ensure that human rights defenders, when threatened, have immediate access to authorities that are competent and adequately resourced to provide effective protective measures, while further research should be undertaken, with a view to improving the effectiveness of existing protection mechanisms;",
    "25": " institutions for the promotion and protection of human rights (the Paris Principles), 9 in the continued engagement with human rights defenders and in the monitoring of existing legislation and consistently informing the State about its impact on the activities of human rights defenders, including by making relevant and concrete recommendations, while noting with concern that national human rights institutions and their members and staff may themselves sometimes be in need of protection;",
    "26": "Strongly encourages States to develop and put in place comprehensive, sustainable and age- and gender-responsive public policies and programmes that support and protect human rights defenders at all stages of their work, online and offline, that ensure effective coordination between relevant institutional actors, including coordination within national and local levels, and address causes of attacks against defenders and barriers against the defence of rights, and that take into account, inter alia, the diversity of human rights defenders and the diverse contexts in which they operate, and the intersectional dimensions of violations and abuses against women human rights defenders, Indigenous Peoples, children, persons with disabilities, persons belonging to minorities and rural communities and human rights defenders working to address racism, racial discrimination, xenophobia and related intolerance;",
    "27": "Strongly reaffirms the urgent need to respect, protect, facilitate and promote the work of human rights defenders promoting and defending economic, social and cultural rights, as a vital factor contributing towards the realization of those rights, including as they relate to environmental, land and Indigenous Peoples\u2019 issues and business activity, as well as development, including through corporate accountability;",
    "28": "Urges non-State actors, including transnational corporations and other business enterprises, to assume their responsibility to respect the human rights and fundamental freedoms of all persons, including human rights defenders, and underlines the need to ensure human rights due diligence and the accountability of, and the provision of adequate remedies by, transnational corporations and other business enterprises, while also urging States to adopt relevant policies and laws in this regard, including to hold all companies to account for involvement in threats or attacks against human rights defenders;",
    "29": "Calls upon all States and encourages non-State actors to implement the Guiding Principles on Business and Human Rights: Implementing the United Nations \u201cProtect, Respect and Remedy\u201d Framework,10 underscores the responsibility of all business enterprises, both transnational and other, to respect human rights, including the rights to life and to liberty and security of person of human rights defenders, and their exercise of the rights to freedom of expression, peaceful assembly and association, and participation in the conduct of public affairs, and underscores further the importance that business enterprises establish or participate in effective and accessible operational-level grievance mechanisms for individuals and communities who may be adversely impacted;",
    "30": "Recognizes the important contribution of the promotion and protection of the safety of human rights defenders in the realization of the Sustainable Development Goals, including target 16.10, and calls upon States to strengthen national disaggregated data collection, analysis and reporting on the number of verified cases of killing, kidnapping, enforced disappearance, arbitrary detention, torture and other harmful acts against human rights advocates, as reflected in Sustainable Development Goal indicator 16.10.1, and to do their utmost to make these data available to the relevant entities;",
    "31": "Takes note of the Secretary-General\u2019s Call to Action for Human Rights, and the United Nations Guidance Note on the Protection and Promotion of Civic Space;",
    "32": "Encourages all concerned United Nations system entities and organizations, within their mandates, to implement the United Nations Guidance Note on the Protection and Promotion of Civic Space, and to consider ways in which they can assist States, upon their request, in creating and maintaining a safe and enabling environment for human rights defenders, including women human rights defenders, and ensuring their protection;",
    "33": "Encourages the Office of the United Nations High Commissioner for Human Rights, in consultation with the Special Rapporteur and other special procedures of the Human Rights Council, to continue to compile and share information on best practices and challenges for the development of a more coherent approach to support the Declaration by the United Nations;",
    "34": "Also encourages the Office of the United Nations High Commissioner for Human Rights to continue its work, within its mandate, including in cooperation with States, regional organizations, civil society and human rights defenders, on collecting information on threats and attacks against human rights defenders, including cases of their arbitrary detention and deprivation of liberty for exercising their human rights, and to make this information publicly available through existing channels;",
    "35": "Requests all concerned United Nations system entities and organizations, within their mandates, to provide all possible assistance and support to the Special Rapporteur for the effective fulfilment of her mandate, including in the context of country visits and through suggestions on ways and means of ensuring the protection of human rights defenders;",
    "36": "Requests the Special Rapporteur to continue to report annually on her activities to the General Assembly and the Human Rights Council, in accordance with the mandate;",
    "37": "Decides to remain seized of the matter."
  },
  "agenda_items": [
    "Item 71"
  ],
  "symbol_references": []
}