{
  "symbol": "A/RES/75/271",
  "filename": "A_RES_75_271.pdf",
  "title": "75/271. Nature knows no borders: transboundary cooperation \u2013 a key factor for biodiversity conservation, restoration and sustainable use",
  "text": "United Nations \nA/RES/75/271\n \n \nGeneral Assembly \nDistr.: General \n20 April 2021 \n \n21-05137 (E)    220421 \n*2105137* \n \n \nSeventy-fifth session \nAgenda item 19 \nSustainable development  \n \n \n \n \n Resolution adopted by the General Assembly \non 16 April 2021 \n \n \n \n \n[without reference to a Main Committee (A/75/L.73 and A/75/L.73/Add.1)] \n \n \n 75/271. Nature knows no borders: transboundary cooperation \u2013 a key \nfactor for biodiversity conservation, restoration and \nsustainable use \n \n \n \nThe General Assembly,  \n \nReaffirming its resolution 70/1 of 25 September 2015, entitled \u201cTransforming \nour world: the 2030 Agenda for Sustainable Development\u201d, in which it adopted a \ncomprehensive, far-reaching and people-centred set of universal and transformative \nSustainable Development Goals and targets, its commitment to working tirelessly for \nthe full implementation of the Agenda by 2030, its recognition that eradicating \npoverty in all its forms and dimensions, including extreme poverty, is the greatest \nglobal challenge and an indispensable requirement for sustainable development, its \ncommitment to achieving sustainable development in its three dimensions \u2013 economic, \nsocial and environmental \u2013 in a balanced and integrated manner, and to building upon \nthe achievements of the Millennium Development Goals and seeking to address their \nunfinished business, \n \nEmphasizing the importance of conserving and sustainably using biodiversity \nand restoring and maintaining healthy ecosystems for the achievement of all the \nSustainable Development Goals, \n \nRecalling its resolution 75/219 of 21 December 2020, entitled \u201cImplementation \nof the Convention on Biological Diversity and its contribution to sustainable \ndevelopment\u201d, which calls upon parties to the Convention and stakeholders to \nstrengthen international cooperation measures for the fulfilment of obligations \ncontained in the Convention, \n \nRecalling also its resolution 73/284 of 1 March 2019, in which it proclaimed the \nUnited Nations Decade on Ecosystem Restoration (2021\u20132030), \n \nRecalling further its resolution 74/227 of 19 December 2019, entitled \n\u201cSustainable mountain development\u201d, which, inter alia, invites States to strengthen \n\nA/RES/75/271 \nNature knows no borders: transboundary cooperation \u2013 a key \nfactor for biodiversity conservation, restoration and sustainable use\n \n21-05137\n2/5 \n \ncooperative action and encourages transboundary cooperation approaches and \ninitiatives among States that share mountain ranges for the sustainable development \nof mountains, as appropriate, \n \nRecalling its resolution 74/135 of 18 December 2019, entitled \u201cRights of \nindigenous peoples\u201d, and recognizing the important contribution of indigenous \npeoples and local communities to the conservation and sustainable use of biodiversity, \n \nRecalling also its resolution 66/288 of 27 July 2012, entitled \u201cThe future we \nwant\u201d, \n \nNoting with appreciation the efforts made by countries to achieve Aichi \nBiodiversity Target 11 on protected areas1 and the contribution made by, inter alia, \nmultisectoral and multilevel approaches, \n \nRecognizing \nthe \nimportant \nrole \nof \nbiodiversity-related \nmultilateral \nenvironmental agreements in contributing to the conservation and sustainable use of \nbiodiversity, and welcoming the development of a post-2020 global biodiversity \nframework under the Convention on Biological Diversity, to be adopted by the \nfifteenth meeting of the Conference of the Parties to the Convention, to be held in \nKunming, China, in 2021, and looking forward to its implementation, \n \nTaking note of the Strategic Plan for Migratory Species 2015\u20132023 of the \nConference of the Parties to the Convention on the Conservation of Migratory Species \nof Wild Animals and the outcomes of its thirteenth meeting, the Strategic Plan \n2016\u20132024 of the Conference of the Contracting Parties to the Convention on \nWetlands of International Importance especially as Waterfowl Habitat (Ramsar \nConvention on Wetlands) and the Strategic Vision 2021\u20132030 of the Conference of \nthe Parties to the Convention on International Trade in Endangered Species of Wild \nFauna and Flora, as well as other international initiatives in the field of transboundary \ncooperation and biodiversity conservation, restoration and protection, \n \nWelcoming regional initiatives for range State cooperation, transboundary \napproaches and outcomes of multi-partner initiatives, conventions and mechanisms \nat the regional level, such as the Framework Convention on the Protection and \nSustainable Development of the Carpathians, the Convention on the Protection of the \nAlps (Alpine Convention),2 Saudi Arabia and Panthera\u2019s Arabian Leopard Initiative, \nthe Strategic Plans for 2016\u20132024 and 2019\u20132027 of the Meeting of the Parties to the \nAgreement on the Conservation of African-Eurasian Migratory Waterbirds, the \nGlobal Coral Reef R&D Accelerator Platform, the Global Initiative on Reducing Land \nDegradation and Enhancing Conservation of Terrestrial Habitats, the Global Snow \nLeopard and Ecosystem Protection Programme, the Central Asian Mammals \nInitiative, the Central Asian Flyway, the Global Tiger Recovery Programme, the East \nAsian-Australasian Flyway Partnership, the Jaguar Plan 2030: Regional Plan for the \nConservation of the Largest Feline on the Continent and Its Ecosystems, the 2017 \nBishkek Declaration entitled \u201cCaring for snow leopards and mountains: our \necological future\u201d, the Saint Petersburg Declaration on Tiger Conservation of the \nInternational Tiger Conservation Forum, held in 2010, and the second International \nTiger Conservation Forum, to be held in 2022, and taking note of the Leaders\u2019 Pledge \nfor Nature, \n \nRecognizing the importance of supporting policies and activities of developing \ncountries in the fields of science, technology and innovation through North-South, \n__________________ \n \n1  See United Nations Environment Programme, document UNEP/CBD/COP/10/27, annex, \ndecision X/2. \n \n2  United Nations, Treaty Series, vol. 1917, No. 32724. \n\nNature knows no borders: transboundary cooperation \u2013 a key \nfactor for biodiversity conservation, restoration and sustainable use \nA/RES/75/271\n \n3/5\n21-05137 \n \nSouth-South and triangular cooperation in the areas of financial and technical \nassistance, capacity-building and technology transfer on mutually agreed terms, \n \nReaffirming that, in accordance with the Charter of the United Nations and the \nprinciples of international law, States have the sovereign right to exploit their own \nresources pursuant to their own environmental policies and the responsibility to \nensure that activities within their jurisdiction or control do not cause damage to the \nenvironment of other States or of areas beyond the limits of national jurisdiction, \n \nNoting the collaborative efforts of the International Partnership for Sustainable \nDevelopment in Mountain Regions (Mountain Partnership), launched during the World \nSummit on Sustainable Development as a multi-stakeholder approach and engaged in \nthe promotion of sustainable development in its three dimensions \u2013 economic, social \nand environmental \u2013 in mountain regions, and other biodiversity-related initiatives, \n \nNoting with concern the particular vulnerability of ecosystems to adverse \nimpacts of climate change, and reaffirming the importance of conserving and \nsustainably using biodiversity, restoring and maintaining healthy ecosystems to \nmaintain resilience and address climate change and its adverse impacts as well as to \nensure that the benefits that people obtain from healthy and intact ecosystems, which \nare essential for the three dimensions of sustainable development, continue to be \nprovided, \n \nNoting with concern also the findings of the Intergovernmental Science-Policy \nPlatform on Biodiversity and Ecosystem Services, and stressing the urgent need to \nhalt the global decline of biodiversity, which is unprecedented in human history, \nincluding its main indirect and direct drivers, in particular changes in land and sea \nuse, direct exploitation of organisms, climate change, pollution and invasion of alien \nspecies, \n \nWelcoming the initiative of the Conference of the Parties to the Convention on \nBiological Diversity at its fourteenth meeting to promote a coherent approach \nbetween the United Nations Framework Convention on Climate Change, 3  the \nConvention on Biological Diversity4 and the United Nations Convention to Combat \nDesertification in Those Countries Experiencing Serious Drought and/or \nDesertification, Particularly in Africa,5 to address biodiversity loss, climate change \nand land and ecosystem degradation, \n \nEmphasizing that biodiversity and health linkages should be addressed \nholistically, and recalling in this regard decision 14/4 of 30 November 2018 of the \nConference of the Parties to the Convention on Biological Diversity 6 and resolution \n3/4 of 30 January 2018 of the United Nations Environment Assembly,7 \n \nRecognizing that the coronavirus disease (COVID-19) pandemic and other \npandemics underscore the need to conserve, restore and sustainably use biodiversity \nand the need for concerted enhanced action and transformative change to adopt a post-\n2020 global biodiversity framework that contributes to the 2030 Agenda for \nSustainable Development and places the global community on a path towards \nrealizing the 2050 Vision for Biodiversity of living in harmony with nature, stressing \nthat the COVID-19 pandemic has highlighted the urgent need to reduce the risk of the \neconomic, social and environmental impacts of disasters and future pandemic \noutbreaks, many of which are exacerbated by biodiversity loss, the increased scale of \npoaching and the illegal use of and trade in wildlife and wildlife products, \n__________________ \n \n3  Ibid., vol. 1771, No. 30822. \n \n4  Ibid., vol. 1760, No. 30619. \n \n5  Ibid., vol. 1954, No. 33480. \n \n6  See United Nations Environment Programme, document CBD/COP/14/14, sect. I. \n \n7  UNEP/EA.3/Res.4. \n\nA/RES/75/271 \nNature knows no borders: transboundary cooperation \u2013 a key \nfactor for biodiversity conservation, restoration and sustainable use\n \n21-05137\n4/5 \n \ndesertification, land degradation and drought and climate change, emphasizing the \nneed to support and invest at all levels, to enhance efforts to build resilience, to reduce \nthe likelihood of zoonotic infections and to avoid or minimize adverse impacts on \nbiological diversity in order to achieve the objectives of the Convention on Biological \nDiversity and build back better, and taking note of the fifth edition of the Global \nBiodiversity Outlook, which provides a summary of progress towards the Aichi \nBiodiversity Targets and highlights that none of the 20 targets has been fully achieved, \nalthough six have been partially achieved (targets 9, 11, 16, 17, 19 and 20), \n \nRecognizing also the vital role that women play in the conservation and \nsustainable use of biological diversity, and reaffirming the need for their full \nparticipation at all levels of policymaking and implementation for the conservation \nand sustainable use of biological diversity, \n \n1. \nStresses the need for international and transboundary cooperation at all \nappropriate levels, as well as between relevant stakeholders, on the enhancement of \nconnectivity between ecosystems and cooperation in order to maintain healthy and \nintact ecosystems and habitats, which are needed to conserve biodiversity and to \nensure that nature can continue to provide ecosystem services to people; \n \n2. \nAlso stresses the need to maintain connectivity across ecosystems, which \noften requires cooperation among range States inhabited by a certain species; \n \n3. \nEmphasizes the importance of cooperation to avoid the fragmentation of \ntransboundary habitats and to maintain and enhance connectivity between \necosystems, and stresses the importance of the application of environmental impact \nassessments in line with national legislation, where appropriate; \n \n4. \nWelcomes the convening of the summit on biodiversity on 30 September \n2020, at the level of Heads of State and Government, in order to highlight the urgency \nof action at the highest levels in support of a post-2020 global biodiversity framework \nthat contributes to the 2030 Agenda for Sustainable Development 8 and places the \nglobal community on a path towards realizing the 2050 Vision for Biodiversity, \n\u201cLiving in harmony with nature\u201d; \n \n5. \nEncourages the use of economic models in the context of sustainable \ndevelopment and poverty eradication that are aimed at accelerating inclusive and \nsustainable economic growth and improving human well-being and social equity, \nwhile significantly reducing environmental degradation and risks and natural resource \nscarcities, as a means of contributing to the implementation of the 2030 Agenda and \nthe Sustainable Development Goals; \n \n6. \nEncourages Member States, and invites international organizations and \nother relevant stakeholders, to contribute to the implementation of the United Nations \nDecade on Ecosystem Restoration (2021\u20132030); \n \n7. \nEncourages Member States and international organizations and other \nrelevant stakeholders to emphasize the importance of protecting vulnerable \necosystems and their connectivity, to contribute to the development and adoption of \napproaches and initiatives for transboundary cooperation, at appropriate levels, for \nthe conservation, restoration and sustainable use of biodiversity, maintaining and \nenhancing ecosystem services, and to participate in such endeavours, as appropriate; \n \n8. \nAcknowledges the importance of the protection of all species in order to \nensure the health and intactness of the ecosystems in which they live, and encourages \nMember States to cooperate in protecting all species and their habitats and in raising \nawareness of their importance; \n__________________ \n \n8  Resolution 70/1. \n\nNature knows no borders: transboundary cooperation \u2013 a key \nfactor for biodiversity conservation, restoration and sustainable use \nA/RES/75/271\n \n5/5\n21-05137 \n \n \n9. \nEncourages Member States to maintain and enhance connectivity of \nhabitats, including but not limited to those of protected species and those relevant for \nthe provision of ecosystem services, including through increasing the establishment \nof transboundary protected areas, as appropriate, and ecological corridors based on \nthe best available scientific data, in accordance with international law and national \nlegislation, and to promote initiatives to strengthen the already existing ones and \nimprove their effective management and other effective area-based conservation \nmeasures, thereby contributing to the maintenance of their functioning; \n \n10. Encourages Member States, and invites international organizations and \nother relevant stakeholders, to integrate and apply ecosystem-based approaches and \nto include such nature-based solutions in plans and policies, as appropriate for \nbiodiversity, climate change adaptation and mitigation and disaster risk reduction, in \norder to achieve co-benefits for climate change adaptation and mitigation with \nbiodiversity conservation, restoration and sustainable use; \n \n11. \nUrges \nMember \nStates, \nand \ninvites \ninternational \norganizations, \ninternational financial institutions and other relevant stakeholders, to increase \ncooperation at appropriate levels, including transboundary cooperation, collaboration \nand synergies on biodiversity conservation, restoration and sustainable use, and the \nfair and equitable sharing of benefits arising from the utilization of genetic resources; \n \n12. Invites the Secretary-General, within existing resources, to provide \ninformation to the General Assembly at its seventy-seventh session on the \nimplementation of the present resolution, as part of his report to be submitted under \nthe sub-item entitled \u201cConvention on Biological Diversity\u201d of the item entitled \n\u201cSustainable development\u201d. \n \n59th plenary meeting \n16 April 2021 \n \n \n",
  "paragraphs": {
    "1": "Stresses the need for international and transboundary cooperation at all appropriate levels, as well as between relevant stakeholders, on the enhancement of connectivity between ecosystems and cooperation in order to maintain healthy and intact ecosystems and habitats, which are needed to conserve biodiversity and to ensure that nature can continue to provide ecosystem services to people;",
    "2": "Also stresses the need to maintain connectivity across ecosystems, which often requires cooperation among range States inhabited by a certain species;",
    "3": "Emphasizes the importance of cooperation to avoid the fragmentation of transboundary habitats and to maintain and enhance connectivity between ecosystems, and stresses the importance of the application of environmental impact assessments in line with national legislation, where appropriate;",
    "4": "Welcomes the convening of the summit on biodiversity on 30 September 2020, at the level of Heads of State and Government, in order to highlight the urgency of action at the highest levels in support of a post-2020 global biodiversity framework that contributes to the 2030 Agenda for Sustainable Development 8 and places the global community on a path towards realizing the 2050 Vision for Biodiversity, \u201cLiving in harmony with nature\u201d;",
    "5": "Encourages the use of economic models in the context of sustainable development and poverty eradication that are aimed at accelerating inclusive and sustainable economic growth and improving human well-being and social equity, while significantly reducing environmental degradation and risks and natural resource scarcities, as a means of contributing to the implementation of the 2030 Agenda and the Sustainable Development Goals;",
    "6": "Encourages Member States, and invites international organizations and other relevant stakeholders, to contribute to the implementation of the United Nations Decade on Ecosystem Restoration (2021\u20132030);",
    "7": "Encourages Member States and international organizations and other relevant stakeholders to emphasize the importance of protecting vulnerable ecosystems and their connectivity, to contribute to the development and adoption of approaches and initiatives for transboundary cooperation, at appropriate levels, for the conservation, restoration and sustainable use of biodiversity, maintaining and enhancing ecosystem services, and to participate in such endeavours, as appropriate;",
    "8": "Acknowledges the importance of the protection of all species in order to ensure the health and intactness of the ecosystems in which they live, and encourages Member States to cooperate in protecting all species and their habitats and in raising awareness of their importance;",
    "9": "Encourages Member States to maintain and enhance connectivity of habitats, including but not limited to those of protected species and those relevant for the provision of ecosystem services, including through increasing the establishment of transboundary protected areas, as appropriate, and ecological corridors based on the best available scientific data, in accordance with international law and national legislation, and to promote initiatives to strengthen the already existing ones and improve their effective management and other effective area-based conservation measures, thereby contributing to the maintenance of their functioning;",
    "10": "Encourages Member States, and invites international organizations and other relevant stakeholders, to integrate and apply ecosystem-based approaches and to include such nature-based solutions in plans and policies, as appropriate for biodiversity, climate change adaptation and mitigation and disaster risk reduction, in order to achieve co-benefits for climate change adaptation and mitigation with biodiversity conservation, restoration and sustainable use;",
    "11": "Urges Member States, and invites international organizations, international financial institutions and other relevant stakeholders, to increase cooperation at appropriate levels, including transboundary cooperation, collaboration and synergies on biodiversity conservation, restoration and sustainable use, and the fair and equitable sharing of benefits arising from the utilization of genetic resources;",
    "12": "Invites the Secretary-General, within existing resources, to provide information to the General Assembly at its seventy-seventh session on the implementation of the present resolution, as part of his report to be submitted under the sub-item entitled \u201cConvention on Biological Diversity\u201d of the item entitled \u201cSustainable development\u201d."
  },
  "agenda_items": [
    "Item 19"
  ],
  "symbol_references": [
    "A/75/L.73"
  ]
}