{
  "symbol": "A/RES/75/150",
  "filename": "A_RES_75_150.pdf",
  "title": "75/150. Observer status for the Global Dryland Alliance in the General Assembly",
  "text": "United Nations \nA/RES/75/150\n \n \nGeneral Assembly \nDistr.: General \n22 December 2020 \n \n \n20-17238 (E)    291220 \n*2017238* \n \n \nSeventy-fifth session \nAgenda item 183 \nObserver status for the Global Dryland Alliance in the \nGeneral Assembly  \n \n \n \n \n Resolution adopted by the General Assembly \non 15 December 2020 \n \n \n \n \n[on the report of the Sixth Committee (A/75/451, para. 8)] \n \n \n 75/150. Observer status for the Global Dryland Alliance in the \nGeneral Assembly \n \n \n \nThe General Assembly, \n \nWishing to promote cooperation between the United Nations and the Global \nDryland Alliance, \n \n1. \nDecides to invite the Global Dryland Alliance to participate in the sessions \nand the work of the General Assembly in the capacity of observer; \n \n2. \nRequests the Secretary-General to take the action necessary to implement \nthe present resolution. \n \n45th plenary meeting \n15 December 2020 \n \n \n",
  "paragraphs": {
    "1": "Decides to invite the Global Dryland Alliance to participate in the sessions and the work of the General Assembly in the capacity of observer;",
    "2": "Requests the Secretary-General to take the action necessary to implement the present resolution. 45th plenary meeting 15 December 2020"
  },
  "agenda_items": [
    "Item 183"
  ],
  "symbol_references": []
}