{
  "symbol": "A/RES/73/215",
  "filename": "A_RES_73_215.pdf",
  "title": "73/215.  Observer status for the European Public Law Organization in the General Assembly",
  "text": "United Nations \nA/RES/73/215\n \n \nGeneral Assembly \nDistr.: General \n11 January 2019 \n \n18-22534 (E)    150119     \n*1822534* \n \n \nSeventy-third session \nAgenda item 176 \n \n \n \n \n Resolution adopted by the General Assembly \non 20 December 2018 \n \n \n \n \n[on the report of the Sixth Committee (A/73/462)] \n \n \n 73/215.  Observer status for the European Public Law Organization \nin the General Assembly  \n \n \n \nThe General Assembly, \n \nWishing to promote cooperation between the United Nations and the European \nPublic Law Organization, \n \n1. \nDecides to invite the European Public Law Organization to participate in \nthe sessions and the work of the General Assembly in the capacity of observer; \n \n2. \nRequests the Secretary-General to take the action necessary to implement \nthe present resolution. \n \n62nd plenary meeting  \n20 December 2018 \n \n",
  "paragraphs": {
    "1": "Decides to invite the European Public Law Organization to participate in the sessions and the work of the General Assembly in the capacity of observer;",
    "2": "Requests the Secretary-General to take the action necessary to implement the present resolution."
  },
  "agenda_items": [
    "Item 176"
  ],
  "symbol_references": []
}