{
  "symbol": "A/RES/75/310",
  "filename": "A_RES_75_310.pdf",
  "title": "75/310. Vision for Everyone: accelerating action to achieve the Sustainable Development Goals",
  "text": "United Nations \nA/RES/75/310\n \n \nGeneral Assembly \nDistr.: General \n26 July 2021 \n \n21-10241 (E)    300721     \n*2110241* \n \n \nSeventy-fifth session \nAgenda item 24 \nEradication of poverty and other development issues \n \n \n \n \n Resolution adopted by the General Assembly \non 23 July 2021 \n \n \n \n \n[without reference to a Main Committee (A/75/L.108 and A/75/L.108/Add.1)] \n \n \n 75/310. Vision for Everyone: accelerating action to achieve the Sustainable \nDevelopment Goals \n \n \n \nThe General Assembly, \n \nReaffirming its resolution 70/1 of 25 September 2015, entitled \u201cTransforming \nour world: the 2030 Agenda for Sustainable Development\u201d, in which it adopted a \ncomprehensive, far-reaching and people-centred set of universal and transformative \nSustainable Development Goals and targets, its commitment to working tirelessly for \nthe full implementation of the Agenda by 2030, ensuring that no one is left behind, \nits recognition that eradicating poverty in all its forms and dimensions, including \nextreme poverty, is the greatest global challenge and an indispensable requirement \nfor sustainable development, its commitment to achieving sustainable development \nin its three dimensions \u2013 economic, social and environmental \u2013 in a balanced and \nintegrated manner, and to building upon the achievements of the Millennium \nDevelopment Goals and seeking to address their unfinished business, \n \nRecognizing the important contribution that the promotion of eye health can \nmake to accelerating action towards the achievement of the Sustainable Development \nGoals,  \n \nRecognizing also that the contributions of persons with disabilities are important \nto the full and effective implementation of the 2030 Agenda, and noting the need for \nMember States, the United Nations system and other stakeholders to further \nstrengthen the normative framework on disability, including the rights of persons with \ndisabilities, in line with the pledge of leaving no one behind, and to consider disability \nas a global issue, cutting across the pillars of the United Nations,  \n \nNoting that at least 2 billion people are living with vision impairment or \nblindness and 1.1 billion people have vision impairment that could have been \nprevented or is yet to be addressed, and that global eye care needs are projected to \n\nA/RES/75/310 \nVision for Everyone: accelerating action to \nachieve the Sustainable Development Goals\n \n2/4 \n \nincrease substantially, with half the global population expected to be living with a \nvision impairment by 2050, \n \nReaffirming the right of every human being, without distinction of any kind, to \nthe enjoyment of the highest attainable standard of physical and mental health,  \n \nRecalling the high-level meeting on universal health coverage, held in New York \non 23 September 2019, and reaffirming its political declaration, entitled \u201cUniversal \nhealth coverage: moving together to build a healthier world\u201d, 1  including the \ncommitment therein to strengthen efforts to address eye health conditions as part of \nuniversal health coverage,  \n \nWelcoming the adoption of World Health Assembly resolution 73.4 of 3 August \n2020, entitled \u201cIntegrated people-centred eye care, including preventable vision \nimpairment and blindness\u201d,2 in which Member States are urged, taking into account \ntheir national circumstances and priorities, inter alia, to take action to implement the \nrecommendations contained in the World Health Organization World Report on \nVision, including to make eye care an integral part of universal health coverage and \nto implement integrated people-centred eye care in health systems across the spectrum \nof promotive, preventive, curative and rehabilitative services,  \n \nAcknowledging the significance of raising awareness and engaging and \nempowering people and communities in respect of eye care needs and the importance \nof vision for all,  \n \nNoting with concern the threat to human health, safety and well-being caused \nby the coronavirus disease (COVID-19) pandemic, which has spread all around the \nglobe, as well as the unprecedented and multifaceted effects of the pandemic, \nincluding the disruption of essential health services, and recognizing the \ndisproportionate impact of COVID-19 on the health, social and economic situation of \npersons with blindness and vision impairments,  \n \nAcknowledging that improving eye health will support efforts to build a more \nequitable, inclusive, sustainable and resilient future,  \n \nExpressing appreciation for the efforts made by Member States, the United \nNations system, including the World Health Organization, and international partners \nin recent years to prevent and address vision impairment and eye health conditions, \nbut mindful of the need for further action,  \n \nNoting with appreciation the work of the Friends of Vision Group, an informal \nnetwork of Member States sharing knowledge and information on eye health and \nworking to advance the issue of vision within the 2030 Agenda,  \n \nRecognizing that improved vision and optimized functional ability for people \nwith blindness or vision impairment leads to improvement in employment prospects, \nenhanced workplace productivity, increased household income and spending and \nenhanced economic productivity, and that these economic benefits, particularly when \ndelivered in low-resource areas, can be instrumental in achieving Sustainable \nDevelopment Goal 1 (End poverty in all its forms everywhere), Goal 2 (End hunger, \nachieve food security and improved nutrition and promote sustainable agriculture) \nand Goal 8 (Promote sustained, inclusive and sustainable economic growth, full and \nproductive employment and decent work for all), \n \nAcknowledging that eye care services as part of universal health coverage are \nrelevant to achieving Sustainable Development Goal 3 (Ensure healthy lives and \npromote well-being for all at all ages), noting that vision loss leads to an increased \n__________________ \n \n1  Resolution 74/2. \n \n2  World Health Organization, document WHA73.4. \n\nVision for Everyone: accelerating action to \nachieve the Sustainable Development Goals \nA/RES/75/310\n \n3/4\n21-10241 \n \nrisk of mortality and affects mental health and well-being, and recognizing the need \nto ensure access to a quality standard of eye care, and other affordable and accessible \nassistive technology, and that health-care services are inclusive and accessible for all, \n \nRecognizing that access to eye care is essential to achieving Sustainable \nDevelopment Goal 4 (Ensure inclusive and equitable quality education and promote \nlifelong learning opportunities for all) and has a positive impact on school enrolment, \neducational attainment, learning and the achievement of inclusive education systems, \n \nRecognizing also that vision is an important contributor to child development, \nand underscoring the need for appropriate legal, social and physical infrastructures to \nensure that eye health care is provided in the best interest of every child, while \nconscious that support from family members, friends and other caregivers has a \npositive influence on those with vision impairment,  \n \nExpressing concern that the burden of eye health conditions has a \ndisproportionate impact on people in vulnerable situations, including women, \nchildren, youth, persons with disabilities, older persons, indigenous peoples, local \ncommunities, refugees and internally displaced persons and migrants, slowing \nprogress towards achieving Sustainable Development Goal 10 (Reduce inequality \nwithin and among countries), \n \nExpressing concern also that the prevalence of vision impairment is higher \namong women, and stressing the need to achieve gender equality in eye health and in \naccess to eye care in order to ensure progress on Sustainable Development Goal 5 \n(Achieve gender equality and empower all women and girls), \n \nRecognizing that the risk of vision loss increases with age and that many older \npersons live with vision impairments or blindness, while noting the United Nations \nDecade of Healthy Ageing (2021\u20132030) and the need to ensure that issues of \nrelevance to older persons are taken into account in the implementation of the 2030 \nAgenda, \n \nNoting the importance of good vision for road safety and its contribution, inter \nalia, to the achievement of Sustainable Development Goal 11 (Make cities inclusive, \nsafe, resilient and sustainable), \n \nAffirming that the realization of \u201cVision for Everyone\u201d will make a crucial \ncontribution to the 2030 Agenda and achieving sustained, inclusive and equitable \neconomic growth and development, and to ensuring that no one is left behind,  \n \n1. \nCalls upon Member States to ensure access to eye care services for their \npopulation and to mobilize the necessary resources and support in this regard, in order \nto contribute to global efforts to reach, by 2030, at least 1.1 billion people who have \na vision impairment and currently do not have access to the eye care services that they \nneed;  \n \n2. \nCalls upon Member States and other stakeholders to include persons with \ndisabilities, including those with visual impairments, in all stages of policymaking \nand decision-making, as well as to eliminate barriers and discrimination against \npersons with disabilities, in particular women and girls and those in vulnerable \nsituations, in accessing support and health-care services on an equal basis with others; \n \n3. \nEncourages Member States to put in place an integrated and whole-of-\ngovernment approach to eye care, building synergies with other development \npriorities and strengthening their collaboration with academia, research institutions, \nthe scientific community, civil society and the private sector, in order to improve safe \nand affordable access to eye care services;  \n\nA/RES/75/310 \nVision for Everyone: accelerating action to \nachieve the Sustainable Development Goals\n \n4/4 \n \n \n4. \nInvites international financial institutions and donors to provide \nappropriate targeted finances, especially for developing countries, to address the \nincreasing impact of vision loss on sustainable development and to build an \ninternational campaign on eye health towards the fulfilment of the Sustainable \nDevelopment Goals and leaving no one behind by 2030;  \n \n5. \nRecognizes the need to further encourage the transfer of technology from \ndeveloped countries to developing countries, on mutually agreed terms, to advance \naccess to eye care services and assistive technologies;  \n \n6. \nNotes the contribution of the private sector, academia and civil society to \nthe promotion of eye health, and encourages the development of public-private \npartnerships, aligned with national government plans, legislation, contexts and \npriorities, and national policies and priorities to advance vision for everyone;  \n \n7. \nEncourages Member States to consider addressing the situation of eye \nhealth in their voluntary national reviews presented at the high-level political forum \non sustainable development;  \n \n8. \nInvites the Inter-Agency and Expert Group on Sustainable Development \nGoal Indicators to review and consider in the context of the global indicator \nframework for the Sustainable Development Goals, at the fifty-sixth session of the \nStatistical Commission, to be held in 2025, the feasible global indicators on eye health \nincluded in World Health Assembly resolution 73.4, as a mechanism for monitoring \nand reporting on progress towards Vision for Everyone and its contributions to the \n2030 Agenda for Sustainable Development;3 \n \n9. \nEncourages the World Health Organization and other relevant entities of \nthe United Nations development system, including but not limited to the International \nLabour Organization, the United Nations Educational, Scientific and Cultural \nOrganization, the United Nations Development Programme, the United Nations \nChildren\u2019s Fund and the United Nations Entity for Gender Equality and the \nEmpowerment of Women (UN-Women), as well as the United Nations Road Safety \nCollaboration, within their respective mandates, to support global efforts to achieve \nVision for Everyone in the implementation of the 2030 Agenda;  \n \n10. \nRequests the Secretary-General to take the steps necessary to effectively \ncoordinate and follow up on the implementation of the present resolution and, in this \nregard, to consider briefing the General Assembly on its implementation, as \nappropriate. \n \n93rd plenary meeting \n23 July 2021 \n \n__________________ \n \n3  Resolution 70/1. \n",
  "paragraphs": {
    "1": "Calls upon Member States to ensure access to eye care services for their population and to mobilize the necessary resources and support in this regard, in order to contribute to global efforts to reach, by 2030, at least 1.1 billion people who have a vision impairment and currently do not have access to the eye care services that they need;",
    "2": "Calls upon Member States and other stakeholders to include persons with disabilities, including those with visual impairments, in all stages of policymaking and decision-making, as well as to eliminate barriers and discrimination against persons with disabilities, in particular women and girls and those in vulnerable situations, in accessing support and health-care services on an equal basis with others;",
    "3": "Encourages Member States to put in place an integrated and whole-of- government approach to eye care, building synergies with other development priorities and strengthening their collaboration with academia, research institutions, the scientific community, civil society and the private sector, in order to improve safe and affordable access to eye care services; A/RES/75/310 Vision for Everyone: accelerating action to achieve the Sustainable Development Goals 4/4",
    "4": "Invites international financial institutions and donors to provide appropriate targeted finances, especially for developing countries, to address the increasing impact of vision loss on sustainable development and to build an international campaign on eye health towards the fulfilment of the Sustainable Development Goals and leaving no one behind by 2030;",
    "5": "Recognizes the need to further encourage the transfer of technology from developed countries to developing countries, on mutually agreed terms, to advance access to eye care services and assistive technologies;",
    "6": "Notes the contribution of the private sector, academia and civil society to the promotion of eye health, and encourages the development of public-private partnerships, aligned with national government plans, legislation, contexts and priorities, and national policies and priorities to advance vision for everyone;",
    "7": "Encourages Member States to consider addressing the situation of eye health in their voluntary national reviews presented at the high-level political forum on sustainable development;",
    "8": "Invites the Inter-Agency and Expert Group on Sustainable Development Goal Indicators to review and consider in the context of the global indicator framework for the Sustainable Development Goals, at the fifty-sixth session of the Statistical Commission, to be held in 2025, the feasible global indicators on eye health included in World Health Assembly resolution 73.4, as a mechanism for monitoring and reporting on progress towards Vision for Everyone and its contributions to the 2030 Agenda for Sustainable Development;3",
    "9": "Encourages the World Health Organization and other relevant entities of the United Nations development system, including but not limited to the International Labour Organization, the United Nations Educational, Scientific and Cultural Organization, the United Nations Development Programme, the United Nations Children\u2019s Fund and the United Nations Entity for Gender Equality and the Empowerment of Women (UN-Women), as well as the United Nations Road Safety Collaboration, within their respective mandates, to support global efforts to achieve Vision for Everyone in the implementation of the 2030 Agenda;",
    "10": "Requests the Secretary-General to take the steps necessary to effectively coordinate and follow up on the implementation of the present resolution and, in this regard, to consider briefing the General Assembly on its implementation, as appropriate. 93rd plenary meeting 23 July 2021 __________________ 3 Resolution 70/1."
  },
  "agenda_items": [
    "Item 24"
  ],
  "symbol_references": [
    "A/75/L.108"
  ]
}