{
  "symbol": "A/RES/73/186",
  "filename": "A_RES_73_186.pdf",
  "title": "73/186. Strengthening the United Nations crime prevention and criminal justice programme, in particular its technical cooperation capacity",
  "text": "United Nations \nA/RES/73/186\n \n \nGeneral Assembly \nDistr.: General \n29 January 2019 \n \n18-22282 (E)    010218     \n*1822282* \n \n \nSeventy-third session \nAgenda item 109 \n \n \n \n \n Resolution adopted by the General Assembly \non 17 December 2018 \n \n \n \n \n[on the report of the Third Committee (A/73/590)] \n \n \n 73/186. Strengthening the United Nations crime prevention and criminal \njustice programme, in particular its technical cooperation capacity \n \n \n \nThe General Assembly, \n \nReaffirming its resolutions 46/152 of 18 December 1991, 60/1 of 16 September \n2005, 67/1 of 19 September 2012, 69/193 and 69/196 of 18 December 2014, 70/178 \nand 70/182 of 17 December 2015, 71/209 of 19 December 2016 and 72/196 of \n19 December 2017,  \n \nReaffirming also its resolutions relating to the urgent need to strengthen \ninternational cooperation and technical assistance in promoting and facilitating the \nratification and implementation of the United Nations Convention against \nTransnational Organized Crime and the Protocols thereto, 1 the Single Convention on \nNarcotic Drugs of 1961 as amended by the 1972 Protocol, 2  the Convention on \nPsychotropic Substances of 1971, 3 the United Nations Convention against Illicit \nTraffic in Narcotic Drugs and Psychotropic Substances of 1988, 4 the United Nations \nConvention against Corruption5 and all the international conventions and protocols \nagainst terrorism,  \n \nRecalling the importance of the Doha Declaration on Integrating Crime \nPrevention and Criminal Justice into the Wider United Nations Agenda to Address \nSocial and Economic Challenges and to Promote the Rule of Law at the National and \nInternational Levels, and Public Participation, adopted by the Thirteenth United \nNations Congress on Crime Prevention and Criminal Justice, 6 \n__________________ \n \n1 United Nations, Treaty Series, vols. 2225, 2237, 2241 and 2326, No. 39574. \n \n2 Ibid., vol. 976, No. 14152. \n \n3 Ibid., vol. 1019, No. 14956. \n \n4 Ibid., vol. 1582, No. 27627. \n \n5 Ibid., vol. 2349, No. 42146. \n \n6 Resolution 70/174, annex. \n\nA/RES/73/186 \nStrengthening the United Nations crime prevention and criminal\njustice programme, in particular its technical cooperation capacity\n \n18-22282\n2/20 \n \n \nWelcoming Economic and Social Council resolution 2018/16 of 2 July 2018 on \nthe follow-up to the Thirteenth United Nations Congress on Crime Prevention and \nCriminal Justice and preparations for the Fourteenth United Nations Congress on \nCrime Prevention and Criminal Justice, and recalling that the theme of the Fourteenth \nCongress, to be held in Kyoto, Japan, from 20 to 27 April 2020, will be \u201cAdvancing \ncrime prevention, criminal justice and the rule of law: towards the achievement of the \n2030 Agenda\u201d,  \n \nReaffirming its resolution 73/183 of 17 December 2018 on enhancing the role \nof the Commission on Crime Prevention and Criminal Justice in contributing to the \nimplementation of the 2030 Agenda for Sustainable Development, in which Member \nStates were encouraged to raise awareness about the work of the Commission in the \nsuccessful implementation of the 2030 Agenda,  \n \nReaffirming also its resolution 73/185 of 17 December 2018 on the rule of law, \ncrime prevention and criminal justice in the context of the Sustainable Development \nGoals, \n \nExpressing its grave concern about the negative effects of transnational \norganized crime on development, peace, stability and security and human rights, \nabout the increasing vulnerability of States to such crime and about the growing \ndegree of penetration of criminal organizations and their financial and economic \nresources into the economy,  \n \nExpressing concern at the involvement of organized criminal groups, as well as \nthe substantial increase in the volume, rate of transnational occurrence and range of \ncriminal offences related to trafficking in precious metals, stones and other minerals \nin some parts of the world, and the potential use of trafficking in precious metals, \nstones and other minerals as a source of funding for organized crime, other relevant \ncriminal activities and terrorism,  \n \nDeeply concerned about the growing links, in some cases, between forms of \ntransnational organized crime and terrorism, recognizing that countering \ntransnational organized crime and terrorism is a common and shared responsibility, \nand in this respect reaffirming its resolution 72/194 of 19 December 2017 on technical \nassistance for implementing the international conventions and protocols related to \ncounter-terrorism, \n \nConvinced that the rule of law and development are strongly interrelated and \nmutually reinforcing and that the advancement of the rule of law at the national and \ninternational levels, including through crime prevention and criminal justice \nmechanisms, is essential for sustained and inclusive economic growth and sustainable \ndevelopment and the full realization of all human rights and fundamental freedoms, \nincluding the right to development, and in this respect welcoming the adoption of the \n2030 Agenda for Sustainable Development, 7  which, inter alia, includes the \ncommitment to promote peaceful and inclusive societies for sustainable development, \nprovide access to justice for all and build effective, accountable and inclusive \ninstitutions at all levels, and in this respect recalling its resolution 70/299 of 29 July \n2016 on the follow-up and review of the 2030 Agenda at the global level,  \n \nEmphasizing that transnational organized crime must be addressed with full \nrespect for the principle of the sovereignty of States and in accordance with the rule \nof law as part of a comprehensive response to promote durable solutions through the \npromotion of human rights and more equitable socioeconomic conditions,  \n__________________ \n \n7 Resolution 70/1. \n\nStrengthening the United Nations crime prevention and criminal \njustice programme, in particular its technical cooperation capacity \nA/RES/73/186\n \n3/20\n18-22282 \n \n \nEncouraging Member States to develop and implement, as appropriate, \ncomprehensive crime prevention policies, national and local strategies and action \nplans based on an understanding of the multiple factors that contribute to crime and \nto address such factors in a holistic manner, in close cooperation with all stakeholders, \nincluding civil society, and in this respect stressing that social development and the \npromotion of the rule of law, including the fostering of a culture of lawfulness while \nrespecting cultural identities, in accordance with the Doha Declaration, should be \nintegral elements of strategies to foster crime prevention and economic development \nin all States,  \n \nReaffirming its commitment and strong political will in support of effective, fair, \nhumane and accountable criminal justice systems and the institutions comprising \nthem, encouraging the effective participation and inclusion of all sectors of society, \nthus creating the conditions needed to advance the wider United Nations agenda, and \nrecognizing the responsibility of Member States to uphold human dignity, all human \nrights and fundamental freedoms for all, in particular for those affected by crime and \nthose who may be in contact with the criminal justice system, including vulnerable \nmembers of society, regardless of their status, who may be subject to multiple and \naggravated forms of discrimination, and to prevent and counter crime motivated by \nintolerance or discrimination of any kind,  \n \nTaking note of Commission on Crime Prevention and Criminal Justice resolution \n25/2 of 27 May 2016 on promoting legal aid, including through a network of legal aid \nproviders, 8  in which the Commission encouraged Member States to adopt or \nstrengthen legislative or other measures to ensure that effective legal aid, including \nfor victims of crime, is provided consistent with their domestic legislation and in line \nwith the United Nations Principles and Guidelines on Access to Legal Aid in Criminal \nJustice Systems, 9 and which also contributes to the implementation of the 2030 \nAgenda for Sustainable Development,  \n \nWelcoming the efforts made by some Member States to establish a common \ndocumentation standard as a tool for facilitating both technical interoperability and \naccessibility of legal documentation,  \n \nDeeply concerned about the negative impact of corruption on development and \non the enjoyment of human rights, and recognizing the universal importance of good \ngovernance, transparency, integrity and accountability, thus calling for a zero-\ntolerance approach to corruption and more effective measures to prevent and counter \ncorruption in all its forms, including bribery, as well as measures to prevent the \nlaundering of proceeds of corruption and other forms of crime,  \n \nWelcoming resolution 7/2 of 10 November 2017 on preventing and combating \ncorruption in all its forms more effectively, including, among others, when it involves \nvast quantities of assets, based on a comprehensive and multidisciplinary approach, \nin accordance with the United Nations Convention against Corruption, adopted at the \nseventh session of the Conference of the States Parties to the Convention, held in \nVienna from 6 to 10 November 2017,10 \n \nWelcoming also the progress made with regard to the second cycle of the \nMechanism for the Review of Implementation of the United Nations Convention \nagainst Corruption, and stressing the importance of effective implementation of the \nConvention in all its aspects by all States parties, \n__________________ \n \n8 See Official Records of the Economic and Social Council, 2016, Supplement No. 10 (E/2016/30), \nchap. I, sect. D. \n \n9 Resolution 67/187, annex. \n10 See CAC/COSP/2017/14, sect. I.A. \n\nA/RES/73/186 \nStrengthening the United Nations crime prevention and criminal\njustice programme, in particular its technical cooperation capacity\n \n18-22282\n4/20 \n \n \nBearing in mind that, pursuant to chapter V of the United Nations Convention \nagainst Corruption, the return of assets is one of the main objectives, an integral part \nand a fundamental principle of the Convention and that the States parties to the \nConvention shall afford one another the widest measure of cooperation and assistance \nin that regard, \n \nRecognizing that, thanks to their nearly universal adherence and wide scope of \napplication, the United Nations Convention against Transnational Organized Crime 11 \nand the United Nations Convention against Corruption offer fundamental legal bases \nfor international cooperation to support the investigation and prosecution of crimes \ncovered by those Conventions, including for extradition, mutual legal assistance and \nconfiscation and asset recovery, and that they provide effective mechanisms that \nshould be further implemented and utilized in practice,  \n \nWelcoming, in this respect, the high-level debate held on 23 May 2018 to mark \nthe fifteenth anniversary of the adoption of the United Nations Convention against \nCorruption and to highlight emerging trends and promote the effective \nimplementation of the Convention, and taking note of the summary of the discussion \nprepared by the President of the General Assembly and transmitted to the Conference \nof the States Parties to the Convention and to all Member States, \n \nRecognizing the efforts of the Group of 20 in countering corruption at both the \nglobal and the national levels, taking note with appreciation of the anti-corruption \ninitiatives outlined in the communiqu\u00e9 of the Summit of the Group of 20, held in \nHamburg, Germany, on 7 and 8 July 2017, and urging the Group of 20 to continue to \nengage other States Members of the United Nations and the United Nations Office on \nDrugs and Crime in its work in an inclusive and transparent manner to ensure that \ninitiatives of the Group of 20 complement or strengthen the work being undertaken \nby the United Nations system, \n \nStressing the importance of strengthened international cooperation, based on the \nprinciples of shared responsibility and in accordance with international law, to \neffectively address the world drug problem, dismantle illicit networks and counter \ntransnational organized crime, including money-laundering, illicit financial flows, \nsmuggling of migrants, trafficking in persons, trafficking in arms and other forms of \norganized crime, all of which threaten national security and undermine sustainable \ndevelopment and the rule of law, and stressing also in this respect the importance of \nlaw enforcement cooperation and exchange of information, as well as of designated \ncentral authorities and effective points of contact dedicated to facilitating the \nprocedures related to international cooperation, including for extradition and mutual \nlegal assistance requests, as well as the importance of the coordinating role of relevant \nregional networks, \n \nNoting the important contribution that public-private sector cooperation can \nmake in efforts to prevent and combat criminal activities, such as transnational \norganized crime, corruption, cybercrime and terrorism, in particular in the tourism \nsector, \n \nReaffirming the commitments made by Member States in the United Nations \nGlobal Counter-Terrorism Strategy, adopted on 8 September 2006, 12  and its \nsuccessive biennial reviews, in particular in its resolution 72/284 of 26 June 2018, in \nwhich it encouraged Member States and United Nations entities to strengthen and \nbetter coordinate their actions against terrorism and to prevent and combat violent \nextremism as and when conducive to terrorism, including through technical assistance \nprovided to Member States upon their request, and highlighting in this respect the \n__________________ \n \n11 United Nations, Treaty Series, vol. 2225, No. 39574. \n \n12 Resolution 60/288. \n\nStrengthening the United Nations crime prevention and criminal \njustice programme, in particular its technical cooperation capacity \nA/RES/73/186\n \n5/20\n18-22282 \n \nwork of the Office of Counter-Terrorism, established through its resolution 71/291 of \n15 June 2017 on strengthening the capability of the United Nations system to assist \nMember States in implementing the United Nations Global Counter-Terrorism \nStrategy, \n \nHighlighting the importance of its resolutions on measures to eliminate \ninternational terrorism and on the protection of human rights and fundamental \nfreedoms while countering terrorism adopted at its seventy-third session, \n \nBearing in mind its resolution 73/190 of 17 December 2018 on preventing and \ncombating corrupt practices and the transfer of proceeds of corruption, facilitating \nasset recovery and returning such assets to legitimate owners, in particular to \ncountries of origin, in accordance with the United Nations Convention against \nCorruption, \n \nRecalling its resolution 66/177 of 19 December 2011 on strengthening \ninternational cooperation in combating the harmful effects of illicit financial flows \nresulting from criminal activities, in which it urged States parties to the United \nNations Convention against Illicit Traffic in Narcotic Drugs and Psychotropic \nSubstances of 1988, the United Nations Convention against Transnational Organized \nCrime and the United Nations Convention against Corruption to apply fully the \nprovisions of those Conventions, in particular measures to prevent and combat \nmoney-laundering, including by criminalizing the laundering of proceeds of \ntransnational organized crime, as well as measures to enhance national confiscation \nregimes and international cooperation, including in asset recovery, and recalling also \nits resolution 72/207 of 20 December 2017, in which, inter alia, it reiterated its deep \nconcern about the impact of illicit financial flows, in particular those caused by tax \nevasion, corruption and transnational organized crime, on the economic, social and \npolitical stability and development of societies, and especially on developing \ncountries, \n \nExpressing concern that terrorists may benefit from transnational organized \ncrime in some regions, including from trafficking in arms, persons, human organs, \ndrugs and cultural property and from the illicit trade in natural resources, including \noil, and in oil products, modular refineries and related material, precious metals, \nstones and other minerals, charcoal and wildlife, as well as from kidnapping for \nransom and other crimes, including extortion, money-laundering and bank robbery, \nand condemning the destruction of cultural heritage perpetrated by terrorist groups in \nsome countries, \n \nTaking into consideration all resolutions of the Commission on Crime \nPrevention and Criminal Justice and the relevant resolutions of the Economic and \nSocial Council, in particular those relating to the strengthening of international \ncooperation, as well as the technical assistance and advisory services of the United \nNations crime prevention and criminal justice programme of the United Nations \nOffice on Drugs and Crime in the fields of crime prevention and criminal justice, \npromotion and reinforcement of the rule of law and reform of criminal justice \ninstitutions, including with regard to the implementation of technical assistance,  \n \nNoting the establishment by the Secretary-General of the United Nations system \ntask force on transnational organized crime and drug trafficking for the purpose of \ndeveloping an effective and comprehensive approach to those crimes within the \nUnited Nations system, and reaffirming the crucial role of Member States in this \nregard, as reflected in the Charter of the United Nations, \n \nRecognizing the progress made by the United Nations Office on Drugs and Crime \nin the delivery of advisory services and technical assistance to requesting Member \nStates in the areas of crime prevention and criminal justice reform, data and \n\nA/RES/73/186 \nStrengthening the United Nations crime prevention and criminal\njustice programme, in particular its technical cooperation capacity\n \n18-22282\n6/20 \n \ninformation analysis, preventing and countering organized crime, corruption, piracy \nand transnational organized crime committed at sea, illicit financial flows, money-\nlaundering, economic and financial crimes, including fraud, as well as tax and \ncorporate crimes, cybercrime, criminal misuse of the Internet and other information \nand communications technologies as well as such misuse for terrorist purposes, crimes \nthat affect the environment, illicit trafficking in endangered species of wild fauna and \nflora, trafficking in precious metals, stones and other minerals, direct and indirect trade \nin oil and refined oil products with organized criminal and terrorist groups, \ncounterfeiting in trademark goods, match-fixing, trafficking in cultural property and \nartefacts, kidnapping, smuggling of migrants, organ trafficking, trafficking in persons, \nincluding the support and protection, as appropriate, of victims, their families and \nwitnesses, illicit manufacturing of and trafficking in firearms, drug trafficking and \nterrorism, including progress in tackling the phenomenon of foreign terrorist fighters, \nas well as in the area of international cooperation, with special emphasis on extradition \nand mutual legal assistance and the international transfer of sentenced persons, \n \nWelcoming the adoption by the United Nations Office on Drugs and Crime of a \nregional approach to programming, based on continuing consultations and \npartnerships at the national and regional levels, particularly on its implementation, \nand focused on ensuring that the Office responds in a sustainable and coherent manner \nto the priorities of Member States,  \n \nReiterating its concern regarding the overall financial situation of the United \nNations Office on Drugs and Crime, and welcoming the extension of the mandate of \nthe standing open-ended intergovernmental working group on improving the \ngovernance and financial situation of the Office,  \n \nWelcoming Commission on Crime Prevention and Criminal Justice resolution \n26/3 of 26 May 2017 on mainstreaming a gender perspective into crime prevention \nand criminal justice policies and programmes and into efforts to prevent and combat \ntransnational organized crime,13 \n \nReaffirming its resolution 71/170 of 19 December 2016, entitled \u201cIntensification \nof efforts to prevent and eliminate all forms of violence against women and girls: \ndomestic violence\u201d, recalling the resolutions of the Commission on Human Rights \nand the Human Rights Council addressing various aspects of violence against women \nand girls of all ages, and recalling also the agreed conclusions adopted by the \nCommission on the Status of Women at its fifty-eighth session, which addressed the \nelimination and prevention of all forms of violence against women and girls,14 \n \nReiterating its condemnation of all forms of violence against women and girls, \nexpressing deep concern about gender-related killing of women and girls, recalling \nall its relevant resolutions, including resolutions 68/191 of 18 December 2013 and \n70/176 of 17 December 2015 on taking action against gender-related killing of \nwomen and girls, and recognizing the key role of law enforcement and the criminal \njustice system in preventing and responding to gender-related killing of women and \ngirls, including by ending impunity for such crimes,  \n \nNoting the significance of the United Nations Model Strategies and Practical \nMeasures on the Elimination of Violence against Children in the Field of Crime \nPrevention and Criminal Justice15 as a way to assist countries in strengthening their \nnational crime prevention and criminal justice capacities to respond to all forms of \nviolence against women and girls,  \n__________________ \n \n13 See Official Records of the Economic and Social Council, 2017, Supplement No. 10 (E/2017/30), \nchap. I, sect. D. \n \n14 Ibid., 2014, Supplement No. 7 (E/2014/27), chap. I, sect. A. \n \n15 Resolution 69/194, annex. \n\nStrengthening the United Nations crime prevention and criminal \njustice programme, in particular its technical cooperation capacity \nA/RES/73/186\n \n7/20\n18-22282 \n \n \nRecalling its resolution 69/194 of 18 December 2014, by which it adopted the \nUnited Nations Model Strategies and Practical Measures on the Elimination of \nViolence against Children in the Field of Crime Prevention and Criminal Justice, \nconvinced of the importance of preventing youth crime, including through sports, \nsupporting the rehabilitation of young offenders and their reintegration into society, \nprotecting in particular child victims of all forms of violence, including those in \ncontact with the law and witnesses, including efforts to prevent their revictimization, \nand addressing the needs of children of prisoners, stressing that such responses should \ntake into account the human rights and best interests of children and young people, \nconsistent with the obligations of the States parties under relevant international \ninstruments, including the Convention on the Rights of the Child 16 and the Optional \nProtocols thereto,17 and noting other relevant United Nations standards and norms in \njuvenile justice, where appropriate,  \n \nTaking note with appreciation of the partnership between the United Nations \nEducational, Scientific and Cultural Organization and the United Nations Office on \nDrugs and Crime in promoting the importance of education as an effective tool for \nthe prevention of crime and terrorism, under the Education for Justice initiative, \n \nEmphasizing the relevance of international instruments and United Nations \nstandards and norms in crime prevention and criminal justice related to the treatment \nof prisoners, in particular women and juveniles,  \n \nRecalling its resolution 70/146 of 17 December 2015, in which it reaffirmed that \nno one shall be subjected to torture or other cruel, inhuman or degrading treatment or \npunishment,  \n \nStressing the importance of the Code of Conduct for Law Enforcement \nOfficials 18  and the Basic Principles on the Use of Force and Firearms by Law \nEnforcement Officials,19 which are voluntary guidelines that emphasize, inter alia, \nefficient and human rights-based policing,  \n \nRecalling its resolution 65/229 of 21 December 2010 on the United Nations \nRules for the Treatment of Women Prisoners and Non-custodial Measures for Women \nOffenders (the Bangkok Rules), and in this regard encouraging the efforts of Member \nStates to implement the Bangkok Rules,  \n \nWelcoming the adoption, by its resolution 70/175 of 17 December 2015, of the \nrevision to the Standard Minimum Rules for the Treatment of Prisoners, as the United \nNations Standard Minimum Rules for the Treatment of Prisoners (the Nelson Mandela \nRules), and reaffirming its resolution 72/193 of 19 December 2017, in which, inter \nalia, Member States were encouraged to endeavour to improve conditions of \nimprisonment and to promote the practical application of the Nelson Mandela Rules \nas the universally acknowledged and updated minimum standards for the treatment of \nprisoners, to use the Rules as a guide in the development of prison laws, policies and \npractices, to continue exchanging good practices and identifying challenges faced in \nthe practical application of the Rules and to share their experiences in dealing with \nthose challenges, \n \nWelcoming also Economic and Social Council resolution 2017/19 of 6 July 2017 \non promoting and encouraging the implementation of alternatives to imprisonment as \npart of comprehensive crime prevention and criminal justice policies,  \n__________________ \n \n16 United Nations, Treaty Series, vol. 1577, No. 27531. \n \n17 Ibid., vols. 2171 and 2173, No. 27531; and resolution 66/138, annex. \n \n18 Resolution 34/169, annex. \n \n19 See Eighth United Nations Congress on the Prevention of Crime and the Treatment of Offenders, \nHavana, 27 August\u20137 September 1990: report prepared by the Secretariat (United Nations \npublication, Sales No. E.91.IV.2), chap. I, sect. B. \n\nA/RES/73/186 \nStrengthening the United Nations crime prevention and criminal\njustice programme, in particular its technical cooperation capacity\n \n18-22282\n8/20 \n \n \nReiterating its strong condemnation of trafficking in persons, which constitutes \na serious crime and a grave offence to human dignity and physical integrity, a \nviolation and abuse of human rights and a challenge to sustainable development and \nrequires the implementation of a comprehensive approach that includes measures to \nprevent such trafficking, to punish the traffickers and to identify and protect the \nvictims of such trafficking, and a robust criminal justice response, and recalling in \nthis respect the United Nations Convention against Transnational Organized Crime \nand the Protocol to Prevent, Suppress and Punish Trafficking in Persons, Especially \nWomen and Children, supplementing the United Nations Convention against \nTransnational Organized Crime,20 and its resolutions 70/179 of 17 December 2015, \n71/167 of 19 December 2016 and 72/195 of 19 December 2017,  \n \nBearing in mind its resolution 73/189 of 17 December 2018 on strengthening \nand promoting effective measures and international cooperation on organ donation \nand transplantation to prevent and combat trafficking in persons for the purpose of \norgan removal and trafficking in human organs,  \n \nReaffirming its resolution 72/1 of 27 September 2017, by which it adopted the \npolitical declaration on the implementation of the United Nations Global Plan of \nAction to Combat Trafficking in Persons,  \n \nUnderlining that Member States need to recognize that the crime of smuggling \nof migrants and the crime of trafficking in persons are distinct crimes and require \nseparate and complementary legal, operational and policy responses, and recalling its \nresolutions 69/187 of 18 December 2014 and 70/147 of 17 December 2015, in which \nit called upon all Member States to protect and assist migrants, including migrant \nchildren and adolescents, and Economic and Social Council resolutions 2014/23 of \n16 July 2014 and 2015/23 of 21 July 2015,  \n \nReaffirming its resolution 70/1 of 25 September 2015, in which it, inter alia, \ncommitted to taking immediate and effective measures to eradicate forced labour, end \nmodern slavery and human trafficking and secure the prohibition and elimination of \nthe worst forms of child labour,  \n \nRecalling its resolution 71/1 of 19 September 2016, by which it adopted the \nNew York Declaration for Refugees and Migrants, which addresses the issue of large \nmovements of refugees and migrants,  \n \nWelcoming the work of the United Nations voluntary trust fund for victims of \ntrafficking in persons, especially women and children, established in accordance with \nthe United Nations Global Plan of Action to Combat Trafficking in Persons, adopted \nby its resolution 64/293 of 30 July 2010, as well as the important contribution of the \nSpecial Rapporteur of the Human Rights Council on trafficking in persons, especially \nwomen and children,  \n \nConcerned at the growing involvement of terrorist and organized criminal \ngroups in all forms and aspects of trafficking in cultural property and related offences, \nand alarmed by the destruction of cultural heritage perpetrated recently by terrorist \ngroups, which is linked to trafficking in cultural property in some countries and to \nfinancing of terrorist activities,  \n \nRecognizing the indispensable role of crime prevention and criminal justice \nresponses in combating all forms and aspects of trafficking in cultural property and \nrelated offences in a comprehensive and effective manner, and underlining the \nimportance of the practical assistance tool aimed at supporting the implementation of \nthe International Guidelines for Crime Prevention and Criminal Justice Responses \n__________________ \n \n20 United Nations, Treaty Series, vol. 2237, No. 39574. \n\nStrengthening the United Nations crime prevention and criminal \njustice programme, in particular its technical cooperation capacity \nA/RES/73/186\n \n9/20\n18-22282 \n \nwith Respect to Trafficking in Cultural Property and Other Related Offences 21 \nthrough the Commission on Crime Prevention and Criminal Justice, in this respect \nwelcoming Commission resolution 27/5 of 18 May 2018,22 and the implementation of \nGeneral Assembly resolutions 68/186 of 18 December 2013, 69/196, and 70/76 of \n9 December 2015, and facilitating operational cooperation against all forms of \ntrafficking in cultural property, and the request to the United Nations Office on Drugs \nand Crime to provide practical assistance in the implementation of the Guidelines and \nto facilitate cooperation in this area, including in countering the financing of terrorism \nin accordance with resolution 70/177 of 17 December 2015,  \n \nAffirming that the destruction of cultural heritage, which is representative of the \ndiversity of human culture, erases the collective memories of a nation, destabilizes \ncommunities and threatens their cultural identity, and emphasizing the importance of \ncultural diversity and pluralism as well as freedom of religion and belief for achieving \npeace, stability, reconciliation and social cohesion, and recalling in this respect its \nresolution 70/76, \n \nReaffirming the intrinsic value of biological diversity and its various \ncontributions to sustainable development and human well-being, and recognizing that \nwild fauna and flora in their many beautiful and varied forms are an irreplaceable part \nof the natural systems of the Earth which must be protected for this generation and \nthe generations to come,  \n \nEmphasizing that the protection of wildlife must be part of a comprehensive \napproach to achieving poverty eradication, food security, sustainable development, \nincluding the conservation and sustainable use of biological diversity, economic \ngrowth, social well-being and sustainable livelihoods,  \n \nExpressing deep concern about crimes that affect the environment, including \nillicit trafficking in endangered and, where applicable, protected species of wild fauna \nand flora, and in hazardous waste, and emphasizing the need to combat such crimes \nby strengthening coordinated action to eliminate, prevent and combat corruption and \ndisrupt illicit networks and also by coordinating international cooperation, capacity-\nbuilding, criminal justice responses and law enforcement efforts,  \n \nRecognizing, in this respect, the legal framework provided by and the important \nrole of the Convention on International Trade in Endangered Species of Wild Fauna \nand Flora23 as the primary mechanism for regulating international trade in species of \nwild fauna and flora listed in its appendices, \n \nRecalling the adoption of its resolutions 69/314 of 30 July 2015, 70/301 of \n9 September 2016 and 71/326 of 11 September 2017 on tackling illicit trafficking in \nwildlife, \n \nConcerned at the growing trend of cybercrime and the misuse of information \nand communications technologies in multiple forms of crime, \n \nWelcoming, in this respect, Commission on Crime Prevention and Criminal \nJustice resolution 26/4 of 26 May 2017 on strengthening international cooperation to \ncombat cybercrime,13 in which the open-ended intergovernmental Expert Group to \nConduct a Comprehensive Study on Cybercrime was requested to continue its work and \nexchange of information on national legislation, best practices, technical assistance and \ninternational cooperation with a view to examining options to strengthen existing \n__________________ \n \n21 Resolution 69/196, annex. \n \n22 See Official Records of the Economic and Social Council, 2018, Supplement No. 10 (E/2018/30), \nchap. I, sect. C. \n \n23 United Nations, Treaty Series, vol. 993, No. 14537. \n\nA/RES/73/186 \nStrengthening the United Nations crime prevention and criminal\njustice programme, in particular its technical cooperation capacity\n \n18-22282\n10/20 \n \nresponses and propose new national and international legal or other responses to \ncybercrime, and was encouraged to develop possible conclusions and recommendations \nfor submission to the Commission, \n \nConcerned at the serious challenges and threats posed by illicit trafficking in \nfirearms, their parts and components and ammunition, and about its links with other \nforms of transnational organized crime, including drug trafficking, as well as \nterrorism, \n \nNoting international efforts to prevent, combat and eradicate the illicit trade in \nconventional arms, in particular in small arms and light weapons, as demonstrated by \nthe adoption in 2001 of the Programme of Action to Prevent, Combat and Eradicate \nthe Illicit Trade in Small Arms and Light Weapons in All Its Aspects, 24 the entry into \nforce in 2005 of the Protocol against the Illicit Manufacturing of and Trafficking in \nFirearms, Their Parts and Components and Ammunition, supplementing the United \nNations Convention against Transnational Organized Crime, 25 and the entry into force \nin 2014 of the Arms Trade Treaty,26 \n \nReaffirming its resolution 71/211 of 19 December 2016 on international \ncooperation to address and counter the world drug problem, and reaffirming also the \noutcome document, entitled \u201cOur joint commitment to effectively addressing and \ncountering the world drug problem,\u201d adopted at the thirtieth special session of the \nGeneral Assembly, held at United Nations Headquarters from 19 to 21 April 2016,27 \nand the Political Declaration and Plan of Action on International Cooperation towards \nan Integrated and Balanced Strategy to Counter the World Drug Problem, adopted by \nthe General Assembly at its sixty-fourth session,28 and the Joint Ministerial Statement \nof the 2014 high-level review by the Commission on Narcotic Drugs of the \nimplementation by Member States of the Political Declaration and Plan of Action, 29 \n \n1. \nTakes note with appreciation of the report of the Secretary-General \nprepared pursuant to resolutions 71/208 of 19 December 2016, 72/1 and 72/196;30 \n \n2. \nReaffirms its resolution 70/1, entitled \u201cTransforming our world: the 2030 \nAgenda for Sustainable Development\u201d, which, inter alia, includes the commitment to \npromote peaceful and inclusive societies for sustainable development, provide access \nto justice for all and build effective, accountable and inclusive institutions at all levels; \n \n3. \nCalls upon all Member States, when appropriate, to take into consideration \nthe Doha Declaration on Integrating Crime Prevention and Criminal Justice into the \nWider United Nations Agenda to Address Social and Economic Challenges and to \nPromote the Rule of Law at the National and International Levels, and Public \nParticipation, adopted at the Thirteenth United Nations Congress on Crime Prevention \nand Criminal Justice, held in Doha from 12 to 19 April 2015,6 when formulating \nlegislation and policy directives, and to make every effort, where appropriate, to \nimplement the principles contained therein in conformity with the purposes and \nprinciples of the Charter of the United Nations, and requests the United Nations \nOffice on Drugs and Crime to continue to provide technical assistance, upon request, \nto Member States, including through its Global Programme for the Implementation \nof the Doha Declaration; \n__________________ \n \n24 Report of the United Nations Conference on the Illicit Trade in Small Arms and Light Weapons in \nAll Its Aspects, New York, 9\u201320 July 2001 (A/CONF.192/15), chap. IV, para. 24. \n \n25 United Nations, Treaty Series, vol. 2326, No. 39574. \n \n26 See resolution 67/234 B. \n \n27 Resolution S-30/1, annex. \n \n28 See Official Records of the Economic and Social Council, 2009, Supplement No. 8 (E/2009/28), \nchap. I, sect. C. \n \n29 Ibid, 2014, Supplement No. 8 (E/2014/28), chap. I, sect. C. \n \n30 A/73/131. \n\nStrengthening the United Nations crime prevention and criminal \njustice programme, in particular its technical cooperation capacity \nA/RES/73/186\n \n11/20\n18-22282 \n \n \n4. \nUrges Member States that have not yet done so to consider ratifying or \nacceding to the United Nations Convention against Transnational Organized Crime \nand the Protocols thereto,1 the Single Convention on Narcotic Drugs of 1961 as \namended by the 1972 Protocol,2 the Convention on Psychotropic Substances of 1971,3 \nthe United Nations Convention against Illicit Traffic in Narcotic Drugs and \nPsychotropic Substances of 1988,4 the United Nations Convention against \nCorruption5 and the international conventions and protocols related to terrorism, and \nurges States parties to those conventions and protocols to make efforts towards their \neffective implementation;  \n \n5. \nReaffirms that the United Nations Convention against Transnational \nOrganized Crime and the Protocols thereto represent the most important tools of the \ninternational community for fighting transnational organized crime, and notes with \nappreciation that the number of States parties has reached 189, which is a significant \nindication of the commitment shown by the international community to combating \ntransnational organized crime; \n \n6. \nWelcomes the adoption of resolution 9/1 of 19 October 2018, entitled \n\u201cEstablishment of the Mechanism for the Review of the Implementation of the United \nNations Convention against Transnational Organized Crime and the Protocols \nthereto\u201d, at the ninth session of the Conference of the Parties to the Convention, held \nin Vienna from 15 to 19 October 2018,31 and urges States parties to implement and \nsupport the Mechanism; \n \n7. \nAlso welcomes the decisions of the Conference of the Parties at its eighth \nsession, held in Vienna from 17 to 21 October 2016, to promote greater use of the \nConvention by central authorities in extradition and mutual legal assistance and to \nenhance the effectiveness of these authorities and to strengthen, as appropriate, the \nimplementation of the Protocol against the Illicit Manufacturing of and Trafficking in \nFirearms, Their Parts and Components and Ammunition, supplementing the United \nNations Convention against Transnational Organized Crime;25 \n \n8. \nUrges States parties to the United Nations Convention against Corruption \nto continue to provide full support to the review mechanism adopted by the \nConference of the States Parties to the Convention, notes the progress made under the \nsecond cycle of the Mechanism for the Review of Implementation of the Convention, \nand further notes with appreciation that the number of States parties has reached 186, \nwhich is a significant indication of the commitment shown by the international \ncommunity to combating corruption and related crimes; \n \n9. \nAlso urges States parties to the United Nations Convention against \nCorruption to increase their efforts and to take measures to prevent and counter \ncorruption, with the necessary focus on, among others, acts of corruption that involve \nvast quantities of assets, without undermining their commitment to preventing and \ncountering corruption at all levels and in all forms, and calls upon States parties to \nthe Convention to take measures to ensure that legal and natural persons are held \naccountable for corruption offences, including when they involve vast quantities of \nassets, in accordance with the Convention; \n \n10. Welcomes the progress achieved by the Conference of the Parties to the \nUnited Nations Convention against Transnational Organized Crime and the \nConference of the States Parties to the United Nations Convention against Corruption \nin the implementation of their respective mandates, and calls upon States parties to \ngive full effect to the resolutions adopted by those bodies, including providing \ninformation regarding compliance with the treaties;  \n__________________ \n31 See CTOC/COP/2018/13, sect. I.A. \n\nA/RES/73/186 \nStrengthening the United Nations crime prevention and criminal\njustice programme, in particular its technical cooperation capacity\n \n18-22282\n12/20 \n \n \n11. \nInvites the President of the General Assembly, in cooperation with the \nUnited Nations Office on Drugs and Crime and with the involvement of relevant \nstakeholders, to hold, within existing resources and during the seventy-third session, \na high-level debate on the role of regional organizations in strengthening and \nimplementing crime prevention initiatives and criminal justice responses, and to \nprepare a President\u2019s summary of the discussion for transmission to the Commission \non Crime Prevention and Criminal Justice and to all Member States;  \n \n12. Encourages Member States to strengthen the capacity of their respective \ncriminal justice systems to investigate, prosecute and punish all forms of crime, while \nsupporting an effective, fair, humane and accountable criminal justice system and \nprotecting the human rights and fundamental freedoms of defendants, as well as the \nlegitimate interests of victims and witnesses, and to adopt and reinforce measures to \nensure access to effective legal aid in criminal justice systems, and in this context \ntakes note of the establishment of the Global Judicial Integrity Network in April 2018; \n \n13. Requests the United Nations Office on Drugs and Crime to continue to \nprovide technical assistance to Member States, upon request, including, inter alia, in \nthe field of international cooperation in criminal matters, to strengthen the rule of law, \nalso taking into account the work undertaken by other United Nations entities, within \nexisting mandates, as well as regional and bilateral efforts, and to continue to ensure \ncoordination and coherence, including through the Rule of Law Coordination and \nResource Group; \n \n14. Calls for greater coordination and coherence among United Nations \nentities and with stakeholders, including donors, host countries and recipients of \ncapacity-building, in countering transnational organized crime; \n \n15. Reiterates the importance of providing the United Nations crime \nprevention and criminal justice programme with sufficient, stable and predictable \nfunding for the full implementation of its mandates;  \n \n16. Encourages all States to have national and local action plans for crime \nprevention in order to take into account, in a comprehensive, integrated and \nparticipatory manner, inter alia, factors that place certain populations and places at \nhigher risk of victimization and/or of offending, and to ensure that such plans are \nbased on the best available evidence and good practices, and stresses that crime \nprevention should be considered an integral element of strategies to foster social and \neconomic development in all States, in accordance with the commitments contained \nin General Assembly resolutions 70/1 and 70/299;  \n \n17. Recommends that Member States adopt multisectoral crime prevention \npolicies and programmes for youth, taking into consideration their varying needs, and \nsafeguard their well-being, recognizing that youth may face specific challenges and \nrisk factors that make them particularly vulnerable to crime, all forms of violence, \nterrorism and victimization; \n \n18. Urges Member States, in cooperation with the United Nations crime \nprevention and criminal justice programme, to develop national, subregional, regional \nand international strategies, with the support of relevant international organizations, \nas appropriate, and other necessary measures, including the establishment, in \naccordance with domestic legislation, of designated central and competent authorities \nand effective points of contact dedicated to facilitating the procedures related to \ninternational cooperation, including for extradition and mutual legal assistance \nrequests, in order to effectively address transnational organized crime; to strengthen \nall forms of cooperation to enable the return of illicitly acquired assets in accordance \nwith the provisions of the United Nations Convention against Corruption for asset \nrecovery, in particular chapter V, with the cooperation of the United Nations Office \n\nStrengthening the United Nations crime prevention and criminal \njustice programme, in particular its technical cooperation capacity \nA/RES/73/186\n \n13/20\n18-22282 \n \non Drugs and Crime, within its existing mandate; and to inform accordingly the Office \nabout existing or updated contact details of such authorities and points of contact to \nfacilitate international cooperation as appropriate; \n \n19. Encourages Member States to study the implementation of a common \ndocumentation standard, including within the United Nations system and in \ncooperation with relevant international institutions; \n \n20. Reaffirms the importance of the United Nations crime prevention and \ncriminal justice programme in promoting effective action to strengthen international \ncooperation in crime prevention and criminal justice, as well as of the work of the \nUnited Nations Office on Drugs and Crime in the fulfilment of its mandate in crime \nprevention and criminal justice, including providing to Member States, upon request \nand as a matter of high priority, technical cooperation, advisory services and other \nforms of assistance, and coordinating with and complementing the work of all \nrelevant and competent United Nations bodies and offices in respect of all forms of \norganized crime, including piracy and transnational organized crime committed at \nsea, cybercrime, criminal misuse of the Internet and other information and \ncommunications technologies as well as such misuse for terrorist purposes, the use of \nnew information technologies to abuse and exploit children, trafficking in cultural \nproperty and artefacts, illicit financial flows, money-laundering, economic and \nfinancial crimes, including fraud, as well as tax and corporate crimes, match-fixing, \ntrafficking in precious metals, stones and other minerals, counterfeiting in trademark \ngoods, crimes that affect the environment, illicit trafficking in endangered species of \nwild fauna and flora, drug trafficking, kidnapping, trafficking in persons, including \nthe support and protection, as appropriate, of victims, their families and witnesses, \norgan trafficking, smuggling of migrants and illicit manufacturing of and trafficking \nin firearms, direct and indirect trade in oil and refined oil products with organized \ncriminal and terrorist groups, as well as corruption and terrorism; \n \n21. Encourages Member States to collect relevant information and to further \nidentify, analyse and counter any existing, growing or potential links, in some cases, \nbetween transnational organized crime, illicit drug-related activities, money-\nlaundering and the financing of terrorism, in order to enhance criminal justice \nresponses to those crimes, and calls upon the United Nations Office on Drugs and \nCrime, within its relevant mandates, to support, upon request, the efforts of Member \nStates in that regard; \n \n22. Calls upon Member States to strengthen cooperation at the international, \nregional, subregional and bilateral levels to counter the threat posed by foreign \nterrorist fighters, including through enhanced operational and timely information-\nsharing, logistical support, as appropriate, and capacity-building activities, such as \nthose provided by the United Nations Office on Drugs and Crime, to share and adopt \nbest practices to identify foreign terrorist fighters, to prevent the travel of foreign \nterrorist fighters from, into or through Member States, to prevent the financing, \nmobilization, recruitment and organization of foreign terrorist fighters, to prevent and \ncounter violent extremism as and when conducive to terrorism, to enhance efforts to \nimplement prosecution, rehabilitation and reintegration strategies, taking into account \ngender and age dimensions, and to ensure that any person who participates in the \nfinancing, planning, preparation or perpetration of terrorist acts or in the supporting \nof terrorist acts is brought to justice, in compliance with obligations under \ninternational law, as well as applicable domestic law, and requests the Office to \ncontinue to provide technical assistance, upon request, in this regard in cooperation \nand coordination with the Office of Counter-Terrorism; \n \n23. Calls upon the United Nations Office on Drugs and Crime to further \nenhance technical assistance, upon request, for building the capacity of Member \nStates to become party to and implement the international conventions and protocols \n\nA/RES/73/186 \nStrengthening the United Nations crime prevention and criminal\njustice programme, in particular its technical cooperation capacity\n \n18-22282\n14/20 \n \nrelated to counter-terrorism, including through targeted programmes and the training \nof relevant criminal justice and law enforcement officials, upon request, and the \ndevelopment of technical tools and publications, within its mandate; \n \n24. Calls upon Member States to address the threat posed by radicalization to \nterrorism in prisons, and calls upon the United Nations, especially the United Nations \nOffice on Drugs and Crime, to continue to support Member States in this regard in \ncooperation and coordination with the Office of Counter-Terrorism; \n \n25. \nUrges the United Nations Office on Drugs and Crime to increase \ncollaboration with intergovernmental, international and regional organizations that have \ntransnational organized crime mandates, as appropriate, in order to share best practices, \nfoster cooperation and take advantage of their unique and comparative advantage; \n \n26. Reaffirms the importance of the United Nations Office on Drugs and Crime \nand its country and regional offices in building capacity at the local level in the field \nof crime prevention and criminal justice, and urges the Office to consider regional \nvulnerabilities, projects and impacts in the fight against transnational organized crime \nin all its forms, in particular in developing countries, when deciding to close and \nallocate offices, with a view to maintaining an effective level of support to national \nand regional efforts in those areas;  \n \n27. Requests the Secretary-General to continue to provide the United Nations \nOffice on Drugs and Crime with adequate resources to support, in an effective \nmanner, efforts towards the implementation of the United Nations Convention against \nTransnational Organized Crime and the Protocols thereto, the Single Convention on \nNarcotic Drugs of 1961 as amended by the 1972 Protocol, the Convention on \nPsychotropic Substances of 1971, the United Nations Convention against Illicit \nTraffic in Narcotic Drugs and Psychotropic Substances of 1988 and the United \nNations Convention against Corruption, and to discharge its functions as the \nsecretariat of the conferences of the parties to the conventions, the Commission on \nCrime Prevention and Criminal Justice and the Commission on Narcotic Drugs, as \nwell as the United Nations congresses on crime prevention and criminal justice, in \naccordance with its mandate, and requests the Secretariat to continue to provide \nsupport to the Commissions within their respective mandates, enabling them to \nactively contribute, as appropriate, to the global follow-up and the thematic review \nof progress made by Member States in the achievement of the Sustainable \nDevelopment Goals as set forth in resolutions 70/299, and 72/305 of 23 July 2018;  \n \n28. Urges all Member States to provide the fullest possible financial and \npolitical support to the United Nations Office on Drugs and Crime by widening its \ndonor base and increasing voluntary contributions, in particular general-purpose \ncontributions, so as to enable it to continue, expand, improve and strengthen, within \nits mandates, its research, operational and technical cooperation activities;  \n \n29. Expresses concern regarding the overall financial situation of the United \nNations Office on Drugs and Crime, emphasizes the need to provide the Office with \nadequate, predictable and stable resources and to ensure their cost-effective utilization, \nand requests the Secretary-General, also considering the extension of the mandate of \nthe standing open-ended intergovernmental working group on improving the \ngovernance and financial situation of the Office, to continue to report, within existing \nreporting obligations, on the financial situation of the Office and to continue to ensure \nthat the Office has sufficient resources to carry out its mandates fully and effectively; \n \n30. Invites States and other interested parties to make further voluntary \ncontributions to the United Nations voluntary trust fund for victims of trafficking in \npersons, especially women and children, and to the United Nations voluntary trust \nfund on contemporary forms of slavery;  \n\nStrengthening the United Nations crime prevention and criminal \njustice programme, in particular its technical cooperation capacity \nA/RES/73/186\n \n15/20\n18-22282 \n \n \n31. Calls upon Member States to intensify national and international efforts to \neliminate all forms of discrimination, including racism, religious intolerance, \nxenophobia and gender-related discrimination by, inter alia, raising awareness, \ndeveloping educational materials and programmes and considering, where \nappropriate, drafting and enforcing legislation against discrimination;  \n \n32. Emphasizes the importance of protecting vulnerable members of society, \nregardless of their status, who may be subject to multiple and aggravated forms of \ndiscrimination, and in that regard expresses its concern about the increase in the \nactivities of transnational and national organized criminal groups and others who \nprofit from crimes against migrants, especially women and children, without regard \nfor dangerous and inhumane conditions and in flagrant violation of national laws and \ninternational law;  \n \n33. Calls upon Member States to implement, when appropriate, the United \nNations Standard Minimum Rules for the Treatment of Prisoners (the Nelson Mandela \nRules),32 bearing in mind their spirit and purpose, and to intensify their efforts to \naddress the challenge of prison overcrowding through appropriate criminal justice \nreforms, which should include, where appropriate, a review of penal policies and \npractical measures to reduce pretrial detention, to enhance the use of non-custodial \nsanctions and measures and to improve access to legal aid to the extent possible, and \nrequests the United Nations Office on Drugs and Crime to continue to provide \ntechnical assistance to Member States, upon request, in this respect;  \n \n34. Invites Member States to mainstream a gender perspective into their \ncriminal justice systems, including by the use of non-custodial measures for women, \nwhen appropriate, and by improving the treatment of women prisoners, taking into \nconsideration the United Nations Rules for the Treatment of Women Prisoners and \nNon-custodial Measures for Women Offenders (the Bangkok Rules), 33  and by \ndeveloping and implementing national strategies and plans to promote the full \nprotection of women and girls from all acts of violence and to strengthen the crime \nprevention and criminal justice response to the gender-related killing of women and \ngirls, in particular by taking measures to support the practical capacity of Member \nStates to prevent, investigate, prosecute and punish all forms of such crime, and \nwelcomes in this respect the practical tools recommended by the open-ended \nintergovernmental expert group on gender-related killing of women and girls at its \nmeeting held in Bangkok from 11 to 13 November 2014;34 \n \n35. Also invites Member States to integrate child- and youth-related issues into \ntheir criminal justice reform efforts, recognizing the importance of protecting children \nfrom all forms of violence, exploitation and abuse, consistent with the obligations of \nparties under relevant international instruments, and to develop comprehensive child-\nsensitive justice policies focused on the best interests of the child, consistent with the \nprinciple that the deprivation of liberty of children should be used only as a measure \nof last resort and for the shortest appropriate period of time;  \n \n36. Recognizes the efforts made by the United Nations Office on Drugs and \nCrime to assist Member States in developing their abilities and strengthening their \ncapacity to prevent and combat kidnapping, and requests the Office to continue to \nprovide technical assistance, upon request, with a view to fostering international \ncooperation, in particular mutual legal assistance, aimed at countering effectively this \ngrowing serious crime;  \n__________________ \n \n32 Resolution 70/175, annex. \n \n33 Resolution 65/229, annex. \n \n34 See E/CN.15/2015/16. \n\nA/RES/73/186 \nStrengthening the United Nations crime prevention and criminal\njustice programme, in particular its technical cooperation capacity\n \n18-22282\n16/20 \n \n \n37. Calls upon Member States to consider ratifying or acceding to, and for \nStates parties to effectively implement, the Protocol against the Smuggling of \nMigrants by Land, Sea and Air, supplementing the United Nations Convention against \nTransnational Organized Crime,35 to reinforce international cooperation for preventing \nand combating the smuggling of migrants and for the prosecution of smugglers, in \naccordance, as appropriate, with article 6 of the Protocol and with national laws and \nlegislation, while effectively protecting the rights and respecting the dignity of \nsmuggled migrants, consistent with the principles of non-discrimination and other \napplicable obligations under relevant international law, taking into account the special \nneeds of women, children, especially when unaccompanied, and persons with \ndisabilities and older persons, and in collaboration with international organizations, \ncivil society and the private sector, and in this regard calls upon the United Nations \nOffice on Drugs and Crime to continue its technical assistance to Member States in \naccordance with the Protocol;  \n \n38. Takes note of the launch of the first United Nations Office on Drugs and \nCrime Global Study on Smuggling of Migrants, encourages Member States to promote \nthe reliable collection of relevant data and research, at the national and, as \nappropriate, the regional and international levels, and invites the Office to \nsystematically collect data and information from Member States on migrant \nsmuggling routes, the modus operandi of migrant smugglers and the role of \ntransnational organized crime, and invites Member States and other donors to provide \nextrabudgetary resources for this purpose; \n \n39. Encourages Member States to ensure that, in investigating and \nprosecuting trafficking in persons and the smuggling of migrants, the concurrent \nundertaking of financial investigations is a standard practice, with a view to tracing, \nfreezing and confiscating proceeds acquired through those crimes, and to consider \ntrafficking in persons and the smuggling of migrants to be predicate offences of \nmoney-laundering; \n \n40. Emphasizes the importance of preventing and combating all forms of \ntrafficking in persons, and in this regard expresses its concern about the activities of \ntransnational and national organized criminal groups and others who profit from such \ncrimes, including for the purpose of organ removal, and calls upon Member States to \nconsider ratifying or acceding to, and for States parties, in accordance with their \nobligations, to fully and effectively implement the Protocol to Prevent, Suppress and \nPunish Trafficking in Persons, Especially Women and Children, supplementing the \nUnited Nations Convention against Transnational Organized Crime, 20 as well as to \nstrengthen national efforts to combat all forms of trafficking in persons and to protect \nand assist the victims of trafficking in accordance with all relevant legal obligations \nand in collaboration with international organizations, civil society and the private \nsector, and in this regard calls upon the United Office on Drugs and Crime to continue \nits technical assistance to Member States in accordance with the Protocol;  \n \n41. Requests the United Nations Office on Drugs and Crime to enhance its \ntechnical assistance to Member States, upon request, to strengthen international \ncooperation in preventing and combating terrorism, including the phenomenon of \ntravelling, returning and relocating foreign terrorist fighters, especially with regard \nto extradition and mutual legal assistance, and its financial sources, through the \nfacilitation of the ratification and implementation of the universal conventions and \nprotocols related to terrorism, in close consultation and cooperation with the Security \nCouncil Committee established pursuant to resolution 1373 (2001) concerning \ncounter-terrorism (the Counter-Terrorism Committee) and its Executive Directorate, \n__________________ \n \n35 United Nations, Treaty Series, vol. 2241, No. 39574. \n\nStrengthening the United Nations crime prevention and criminal \njustice programme, in particular its technical cooperation capacity \nA/RES/73/186\n \n17/20\n18-22282 \n \nas well as to contribute to the work of the Office of Counter-Terrorism, established in \naccordance with resolution 71/291, and invites Member States to provide the United \nNations Office on Drugs and Crime with appropriate resources for its mandate;  \n \n42. Urges the United Nations Office on Drugs and Crime to continue to \nprovide, within its mandate, technical assistance to Member States, upon their \nrequest, to combat money-laundering and the financing of terrorism through the \nGlobal Programme against Money-Laundering, Proceeds of Crime and the Financing \nof Terrorism, in accordance with United Nations-related instruments and international \nstandards, including, where applicable, standards and relevant initiatives of regional, \ninterregional and multilateral organizations and intergovernmental bodies against \nmoney-laundering, inter alia and as appropriate, the Financial Action Task Force, in \naccordance with national legislation;  \n \n43. Encourages Member States to enhance the effectiveness of countering \ncriminal threats to the tourism sector, including terrorist threats, through, when \nappropriate, the activities of the United Nations Office on Drugs and Crime and other \nrelevant international organizations, in cooperation with the World Tourism \nOrganization and the private sector;  \n \n44. Affirms that attacks intentionally directed against buildings dedicated to \nreligion, education, art, science or charitable purposes, or historic monuments, or \nhospitals and places where the sick and wounded are collected, may amount to war \ncrimes, stresses the importance of holding accountable perpetrators of attacks \nintentionally directed against the above-mentioned buildings, provided that they are \nnot military objectives, and calls upon all States to take appropriate action to this end \nwithin their jurisdiction in accordance with applicable international law;  \n \n45. Urges States parties to make effective use of the United Nations \nConvention against Transnational Organized Crime for broad cooperation in \npreventing and combating all forms and aspects of trafficking in cultural property and \nrelated offences, including money-laundering and the financing of terrorism, \nespecially in returning such confiscated proceeds of crime or property to their \nlegitimate owners, in accordance with article 14, paragraph 2, of the Convention; \n \n46. Encourages States parties to the United Nations Convention against \nTransnational Organized Crime to promptly notify countries of origin when objects \nthat may be cultural property removed from their territory are identified, and to \nexchange information and statistical data on all forms and aspects of trafficking in \ncultural property and related offences, and reaffirms in this regard the importance of \nthe International Guidelines for Crime Prevention and Criminal Justice Responses \nwith Respect to Trafficking in Cultural Property and Other Related Offences, as \nadopted by the General Assembly in its resolution 69/196; \n \n47. Urges Member States to introduce effective national and international \nmeasures to prevent and combat illicit trafficking in cultural property, including \npublicizing legislation, international guidelines and related technical background \ndocuments, and offering special training for police, customs and border services, and \ninvites Member States to make trafficking in cultural property, including stealing from \nand looting of archaeological and other cultural sites, a serious crime, as defined in \narticle 2 (b) of the United Nations Convention against Transnational Organized Crime; \n \n48. Also urges Member States to take decisive steps at the national level to \nprevent, combat and eradicate the illegal trade in wildlife, on both the supply and \ndemand sides, including by strengthening the legislation necessary for the prevention, \ninvestigation and prosecution of such illegal trade, as well as by strengthening \nenforcement and criminal justice responses, in accordance with national legislation \nand international law, acknowledging that the International Consortium on \nCombating Wildlife Crime can provide valuable technical assistance in this regard;  \n\nA/RES/73/186 \nStrengthening the United Nations crime prevention and criminal\njustice programme, in particular its technical cooperation capacity\n \n18-22282\n18/20 \n \n \n49. Calls upon Member States to make illicit trafficking in protected species \nof wild fauna and flora and in hazardous waste involving organized criminal groups \na serious crime in accordance with their national legislation and with article 2 (b) of \nthe United Nations Convention against Transnational Organized Crime;  \n \n50. Also calls upon Member States to take appropriate and effective measures \nto prevent and combat trafficking in precious metals, stones and other minerals by \norganized criminal groups, including, where appropriate, the adoption and effective \nimplementation of the necessary legislation for the prevention, investigation and \nprosecution of illicit trafficking in precious metals, stones and other minerals; \n \n51. Encourages Member States to continue to support the United Nations \nOffice on Drugs and Crime in providing targeted technical assistance, within its \nexisting mandate, to enhance the capacity of affected States, upon their request, to \ncombat piracy and other forms of crime committed at sea, including by assisting \nMember States in creating an effective law enforcement response and strengthening \ntheir judicial capacity;  \n \n52. Notes with appreciation the fourth meeting of the open-ended \nintergovernmental Expert Group to Conduct a Comprehensive Study on Cybercrime \nand the responses to cybercrime by Member States, the international community and \nthe private sector, and calls upon Member States to support the workplan of the Expert \nGroup and to explore specific measures and develop possible conclusions and \nrecommendations designed to create a secure and resilient cyberenvironment, to \nprevent and counter effectively criminal activities carried out over the Internet, \npaying particular attention to identity fraud-related offences, recruitment for the \npurpose of trafficking in persons and protecting children from online exploitation and \nabuse, to strengthen law enforcement cooperation at the national and international \nlevels, including with the aim of identifying and protecting victims by, inter alia, \nremoving child pornography and other child sexual abuse material from the Internet, \nto enhance the security of computer networks and protect the integrity of relevant \ninfrastructure, and to endeavour to provide long-term technical assistance and \ncapacity-building to strengthen the ability of national authorities to deal with \ncybercrime, including the prevention, detection, investigation and prosecution of such \ncrime in all its forms;  \n \n53. Encourages Member States to strengthen their efforts in combating \ncybercrime and all forms of criminal misuse of information and communications \ntechnologies and to enhance international cooperation involving electronic evidence \nin this regard; \n \n54. Requests the United Nations Office on Drugs and Crime to continue to \nassist Member States, upon request, in combating the illicit manufacturing of and \ntrafficking in firearms, their parts and components and ammunition, and to support \nthem in their efforts to address the links with other forms of transnational organized \ncrime, through, inter alia, legislative assistance, technical support, improved data \ncollection and analysis and strengthened national statistical systems, and in this \nrespect invites Member States to provide the Office with relevant information and \nsuitably disaggregated data through the regular data collection instrument on firearms \ntrafficking; \n \n55. Urges Member States to exchange good practices and experiences of \npractitioners who are involved in combating illicit trafficking in firearms and to \nconsider the use of available tools, including marking and record-keeping \ntechnologies, to facilitate the tracing of firearms and, where possible, their parts and \ncomponents and ammunition, in order to enhance criminal investigations into illicit \ntrafficking in firearms;  \n\nStrengthening the United Nations crime prevention and criminal \njustice programme, in particular its technical cooperation capacity \nA/RES/73/186\n \n19/20\n18-22282 \n \n \n56. Urges States parties to the Protocol against the Illicit Manufacturing of \nand Trafficking in Firearms, Their Parts and Components and Ammunition that import \nand export parts and components of firearms to reinforce their control measures in \nline with the Protocol and other relevant international legal instruments to which they \nare party, with a view to preventing and reducing the risks of their diversion, illicit \nmanufacturing and trafficking; \n \n57. Calls upon Member States to intensify all efforts to address the world drug \nproblem, based upon the principle of common and shared responsibility and through \na comprehensive and balanced approach, including through more effective bilateral, \nregional and international cooperation among judicial and law enforcement \nauthorities, to counter the involvement of organized criminal groups in illicit drug \nproduction and trafficking and related criminal activities and to take steps to reduce \nthe violence that accompanies drug trafficking;  \n \n58. Recommends that Member States, as appropriate to their national contexts, \nadopt a comprehensive and integrated approach to crime prevention and criminal \njustice reform, based on baseline assessments, regular data collection and analysis, \nand focusing on all sectors of the justice system, and develop crime prevention \npolicies, strategies and programmes, including ones that focus on early prevention by \nusing multidisciplinary and participatory approaches, in close cooperation with all \nstakeholders, including civil society, and requests the United Nations Office on Drugs \nand Crime to continue to provide technical assistance, upon request, to Member States \nfor this purpose;  \n \n59. Invites Member States to start the gradual adoption of the International \nClassification of Crime for Statistical Purposes and to strengthen national statistical \nsystems of criminal justice, requests the United Nations Office on Drugs and Crime, \nwithin its existing mandate, to continue to strengthen the regular collection, analysis \nand dissemination of accurate, reliable, timely and comparable data and information, \nincluding, as appropriate, data disaggregated by sex, age and other relevant criteria, \nand strongly encourages Member States to share such data and information with the \nOffice;  \n \n60. Requests the United Nations Office on Drugs and Crime to continue to \ndevelop, in close cooperation with Member States, technical and methodological tools \nand trend analyses and studies to enhance knowledge of crime trends and support \nMember States in designing appropriate responses in specific areas of crime, in \nparticular in their transnational dimension and in relation to the Sustainable \nDevelopment Goals,7 taking into account the need to make the best possible use of \nexisting resources;  \n \n61. Encourages Member States to take relevant measures, as appropriate to \ntheir national contexts, to ensure the diffusion, use and application of the United \nNations standards and norms in crime prevention and criminal justice, including the \nconsideration and, where they deem it necessary, dissemination of existing manuals, \nhandbooks and capacity-building material developed and published by the United \nNations Office on Drugs and Crime;  \n \n62. Requests the United Nations Office on Drugs and Crime, in collaboration \nand close consultation with Member States and within existing resources, to continue \nto support the enhancement of capacity and skills in the field of forensic sciences, \nincluding the setting of standards, and the development of technical assistance \nmaterial for training, such as manuals, compilations of useful practices and guidelines \nand scientific and forensic reference material, for law enforcement officials and \nprosecution authorities, and to promote and facilitate the establishment and \n\nA/RES/73/186 \nStrengthening the United Nations crime prevention and criminal\njustice programme, in particular its technical cooperation capacity\n \n18-22282\n20/20 \n \nsustainability of regional networks of forensic science providers in order to enhance \ntheir expertise and capacity to prevent and combat transnational organized crime; \n \n63. Requests the Secretary-General to submit a report to the General Assembly \nat its seventy-fourth session on the implementation of the mandates of the United \nNations crime prevention and criminal justice programme, reflecting also emerging \npolicy issues and possible responses. \n \n56th plenary meeting  \n17 December 2018 \n \n",
  "paragraphs": {
    "1": "Takes note with appreciation of the report of the Secretary-General prepared pursuant to resolutions 71/208 of 19 December 2016, 72/1 and 72/196;30",
    "2": "Reaffirms its resolution 70/1, entitled \u201cTransforming our world: the 2030 Agenda for Sustainable Development\u201d, which, inter alia, includes the commitment to promote peaceful and inclusive societies for sustainable development, provide access to justice for all and build effective, accountable and inclusive institutions at all levels;",
    "3": "Calls upon all Member States, when appropriate, to take into consideration the Doha Declaration on Integrating Crime Prevention and Criminal Justice into the Wider United Nations Agenda to Address Social and Economic Challenges and to Promote the Rule of Law at the National and International Levels, and Public Participation, adopted at the Thirteenth United Nations Congress on Crime Prevention and Criminal Justice, held in Doha from 12 to 19 April 2015,6 when formulating legislation and policy directives, and to make every effort, where appropriate, to implement the principles contained therein in conformity with the purposes and principles of the Charter of the United Nations, and requests the United Nations Office on Drugs and Crime to continue to provide technical assistance, upon request, to Member States, including through its Global Programme for the Implementation of the Doha Declaration;",
    "4": "Urges Member States that have not yet done so to consider ratifying or acceding to the United Nations Convention against Transnational Organized Crime and the Protocols thereto,1 the Single Convention on Narcotic Drugs of 1961 as amended by the 1972 Protocol,2 the Convention on Psychotropic Substances of 1971,3 the United Nations Convention against Illicit Traffic in Narcotic Drugs and Psychotropic Substances of 1988,4 the United Nations Convention against Corruption5 and the international conventions and protocols related to terrorism, and urges States parties to those conventions and protocols to make efforts towards their effective implementation;",
    "5": "Reaffirms that the United Nations Convention against Transnational Organized Crime and the Protocols thereto represent the most important tools of the international community for fighting transnational organized crime, and notes with appreciation that the number of States parties has reached 189, which is a significant indication of the commitment shown by the international community to combating transnational organized crime;",
    "6": "Welcomes the adoption of resolution 9/1 of 19 October 2018, entitled \u201cEstablishment of the Mechanism for the Review of the Implementation of the United Nations Convention against Transnational Organized Crime and the Protocols thereto\u201d, at the ninth session of the Conference of the Parties to the Convention, held in Vienna from 15 to 19 October 2018,31 and urges States parties to implement and support the Mechanism;",
    "7": "Also welcomes the decisions of the Conference of the Parties at its eighth session, held in Vienna from 17 to 21 October 2016, to promote greater use of the Convention by central authorities in extradition and mutual legal assistance and to enhance the effectiveness of these authorities and to strengthen, as appropriate, the implementation of the Protocol against the Illicit Manufacturing of and Trafficking in Firearms, Their Parts and Components and Ammunition, supplementing the United Nations Convention against Transnational Organized Crime;25",
    "8": "Urges States parties to the United Nations Convention against Corruption to continue to provide full support to the review mechanism adopted by the Conference of the States Parties to the Convention, notes the progress made under the second cycle of the Mechanism for the Review of Implementation of the Convention, and further notes with appreciation that the number of States parties has reached 186, which is a significant indication of the commitment shown by the international community to combating corruption and related crimes;",
    "9": "Also urges States parties to the United Nations Convention against Corruption to increase their efforts and to take measures to prevent and counter corruption, with the necessary focus on, among others, acts of corruption that involve vast quantities of assets, without undermining their commitment to preventing and countering corruption at all levels and in all forms, and calls upon States parties to the Convention to take measures to ensure that legal and natural persons are held accountable for corruption offences, including when they involve vast quantities of assets, in accordance with the Convention;",
    "10": "Welcomes the progress achieved by the Conference of the Parties to the United Nations Convention against Transnational Organized Crime and the Conference of the States Parties to the United Nations Convention against Corruption in the implementation of their respective mandates, and calls upon States parties to give full effect to the resolutions adopted by those bodies, including providing information regarding compliance with the treaties;",
    "11": "Invites the President of the General Assembly, in cooperation with the United Nations Office on Drugs and Crime and with the involvement of relevant stakeholders, to hold, within existing resources and during the seventy-third session, a high-level debate on the role of regional organizations in strengthening and implementing crime prevention initiatives and criminal justice responses, and to prepare a President\u2019s summary of the discussion for transmission to the Commission on Crime Prevention and Criminal Justice and to all Member States;",
    "12": "Encourages Member States to strengthen the capacity of their respective criminal justice systems to investigate, prosecute and punish all forms of crime, while supporting an effective, fair, humane and accountable criminal justice system and protecting the human rights and fundamental freedoms of defendants, as well as the legitimate interests of victims and witnesses, and to adopt and reinforce measures to ensure access to effective legal aid in criminal justice systems, and in this context takes note of the establishment of the Global Judicial Integrity Network in April 2018;",
    "13": "Requests the United Nations Office on Drugs and Crime to continue to provide technical assistance to Member States, upon request, including, inter alia, in the field of international cooperation in criminal matters, to strengthen the rule of law, also taking into account the work undertaken by other United Nations entities, within existing mandates, as well as regional and bilateral efforts, and to continue to ensure coordination and coherence, including through the Rule of Law Coordination and Resource Group;",
    "14": "Calls for greater coordination and coherence among United Nations entities and with stakeholders, including donors, host countries and recipients of capacity-building, in countering transnational organized crime;",
    "15": "Reiterates the importance of providing the United Nations crime prevention and criminal justice programme with sufficient, stable and predictable funding for the full implementation of its mandates;",
    "16": "Encourages all States to have national and local action plans for crime prevention in order to take into account, in a comprehensive, integrated and participatory manner, inter alia, factors that place certain populations and places at higher risk of victimization and/or of offending, and to ensure that such plans are based on the best available evidence and good practices, and stresses that crime prevention should be considered an integral element of strategies to foster social and economic development in all States, in accordance with the commitments contained in General Assembly resolutions 70/1 and 70/299;",
    "17": "Recommends that Member States adopt multisectoral crime prevention policies and programmes for youth, taking into consideration their varying needs, and safeguard their well-being, recognizing that youth may face specific challenges and risk factors that make them particularly vulnerable to crime, all forms of violence, terrorism and victimization;",
    "18": " on Drugs and Crime, within its existing mandate; and to inform accordingly the Office about existing or updated contact details of such authorities and points of contact to facilitate international cooperation as appropriate;",
    "19": "Encourages Member States to study the implementation of a common documentation standard, including within the United Nations system and in cooperation with relevant international institutions;",
    "20": "Reaffirms the importance of the United Nations crime prevention and criminal justice programme in promoting effective action to strengthen international cooperation in crime prevention and criminal justice, as well as of the work of the United Nations Office on Drugs and Crime in the fulfilment of its mandate in crime prevention and criminal justice, including providing to Member States, upon request and as a matter of high priority, technical cooperation, advisory services and other forms of assistance, and coordinating with and complementing the work of all relevant and competent United Nations bodies and offices in respect of all forms of organized crime, including piracy and transnational organized crime committed at sea, cybercrime, criminal misuse of the Internet and other information and communications technologies as well as such misuse for terrorist purposes, the use of new information technologies to abuse and exploit children, trafficking in cultural property and artefacts, illicit financial flows, money-laundering, economic and financial crimes, including fraud, as well as tax and corporate crimes, match-fixing, trafficking in precious metals, stones and other minerals, counterfeiting in trademark goods, crimes that affect the environment, illicit trafficking in endangered species of wild fauna and flora, drug trafficking, kidnapping, trafficking in persons, including the support and protection, as appropriate, of victims, their families and witnesses, organ trafficking, smuggling of migrants and illicit manufacturing of and trafficking in firearms, direct and indirect trade in oil and refined oil products with organized criminal and terrorist groups, as well as corruption and terrorism;",
    "21": "Encourages Member States to collect relevant information and to further identify, analyse and counter any existing, growing or potential links, in some cases, between transnational organized crime, illicit drug-related activities, money- laundering and the financing of terrorism, in order to enhance criminal justice responses to those crimes, and calls upon the United Nations Office on Drugs and Crime, within its relevant mandates, to support, upon request, the efforts of Member States in that regard;",
    "22": "Calls upon Member States to strengthen cooperation at the international, regional, subregional and bilateral levels to counter the threat posed by foreign terrorist fighters, including through enhanced operational and timely information- sharing, logistical support, as appropriate, and capacity-building activities, such as those provided by the United Nations Office on Drugs and Crime, to share and adopt best practices to identify foreign terrorist fighters, to prevent the travel of foreign terrorist fighters from, into or through Member States, to prevent the financing, mobilization, recruitment and organization of foreign terrorist fighters, to prevent and counter violent extremism as and when conducive to terrorism, to enhance efforts to implement prosecution, rehabilitation and reintegration strategies, taking into account gender and age dimensions, and to ensure that any person who participates in the financing, planning, preparation or perpetration of terrorist acts or in the supporting of terrorist acts is brought to justice, in compliance with obligations under international law, as well as applicable domestic law, and requests the Office to continue to provide technical assistance, upon request, in this regard in cooperation and coordination with the Office of Counter-Terrorism;",
    "23": " related to counter-terrorism, including through targeted programmes and the training of relevant criminal justice and law enforcement officials, upon request, and the development of technical tools and publications, within its mandate;",
    "24": "Calls upon Member States to address the threat posed by radicalization to terrorism in prisons, and calls upon the United Nations, especially the United Nations Office on Drugs and Crime, to continue to support Member States in this regard in cooperation and coordination with the Office of Counter-Terrorism;",
    "25": "Urges the United Nations Office on Drugs and Crime to increase collaboration with intergovernmental, international and regional organizations that have transnational organized crime mandates, as appropriate, in order to share best practices, foster cooperation and take advantage of their unique and comparative advantage;",
    "26": "Reaffirms the importance of the United Nations Office on Drugs and Crime and its country and regional offices in building capacity at the local level in the field of crime prevention and criminal justice, and urges the Office to consider regional vulnerabilities, projects and impacts in the fight against transnational organized crime in all its forms, in particular in developing countries, when deciding to close and allocate offices, with a view to maintaining an effective level of support to national and regional efforts in those areas;",
    "27": "Requests the Secretary-General to continue to provide the United Nations Office on Drugs and Crime with adequate resources to support, in an effective manner, efforts towards the implementation of the United Nations Convention against Transnational Organized Crime and the Protocols thereto, the Single Convention on Narcotic Drugs of 1961 as amended by the 1972 Protocol, the Convention on Psychotropic Substances of 1971, the United Nations Convention against Illicit Traffic in Narcotic Drugs and Psychotropic Substances of 1988 and the United Nations Convention against Corruption, and to discharge its functions as the secretariat of the conferences of the parties to the conventions, the Commission on Crime Prevention and Criminal Justice and the Commission on Narcotic Drugs, as well as the United Nations congresses on crime prevention and criminal justice, in accordance with its mandate, and requests the Secretariat to continue to provide support to the Commissions within their respective mandates, enabling them to actively contribute, as appropriate, to the global follow-up and the thematic review of progress made by Member States in the achievement of the Sustainable Development Goals as set forth in resolutions 70/299, and 72/305 of 23 July 2018;",
    "28": "Urges all Member States to provide the fullest possible financial and political support to the United Nations Office on Drugs and Crime by widening its donor base and increasing voluntary contributions, in particular general-purpose contributions, so as to enable it to continue, expand, improve and strengthen, within its mandates, its research, operational and technical cooperation activities;",
    "29": "Expresses concern regarding the overall financial situation of the United Nations Office on Drugs and Crime, emphasizes the need to provide the Office with adequate, predictable and stable resources and to ensure their cost-effective utilization, and requests the Secretary-General, also considering the extension of the mandate of the standing open-ended intergovernmental working group on improving the governance and financial situation of the Office, to continue to report, within existing reporting obligations, on the financial situation of the Office and to continue to ensure that the Office has sufficient resources to carry out its mandates fully and effectively;",
    "30": "",
    "31": "Calls upon Member States to intensify national and international efforts to eliminate all forms of discrimination, including racism, religious intolerance, xenophobia and gender-related discrimination by, inter alia, raising awareness, developing educational materials and programmes and considering, where appropriate, drafting and enforcing legislation against discrimination;",
    "32": "Emphasizes the importance of protecting vulnerable members of society, regardless of their status, who may be subject to multiple and aggravated forms of discrimination, and in that regard expresses its concern about the increase in the activities of transnational and national organized criminal groups and others who profit from crimes against migrants, especially women and children, without regard for dangerous and inhumane conditions and in flagrant violation of national laws and international law;",
    "33": "Calls upon Member States to implement, when appropriate, the United Nations Standard Minimum Rules for the Treatment of Prisoners (the Nelson Mandela Rules),32 bearing in mind their spirit and purpose, and to intensify their efforts to address the challenge of prison overcrowding through appropriate criminal justice reforms, which should include, where appropriate, a review of penal policies and practical measures to reduce pretrial detention, to enhance the use of non-custodial sanctions and measures and to improve access to legal aid to the extent possible, and requests the United Nations Office on Drugs and Crime to continue to provide technical assistance to Member States, upon request, in this respect;",
    "34": "Invites Member States to mainstream a gender perspective into their criminal justice systems, including by the use of non-custodial measures for women, when appropriate, and by improving the treatment of women prisoners, taking into consideration the United Nations Rules for the Treatment of Women Prisoners and Non-custodial Measures for Women Offenders (the Bangkok Rules), 33 and by developing and implementing national strategies and plans to promote the full protection of women and girls from all acts of violence and to strengthen the crime prevention and criminal justice response to the gender-related killing of women and girls, in particular by taking measures to support the practical capacity of Member States to prevent, investigate, prosecute and punish all forms of such crime, and welcomes in this respect the practical tools recommended by the open-ended intergovernmental expert group on gender-related killing of women and girls at its meeting held in Bangkok from 11 to 13 November 2014;34",
    "35": "Also invites Member States to integrate child- and youth-related issues into their criminal justice reform efforts, recognizing the importance of protecting children from all forms of violence, exploitation and abuse, consistent with the obligations of parties under relevant international instruments, and to develop comprehensive child- sensitive justice policies focused on the best interests of the child, consistent with the principle that the deprivation of liberty of children should be used only as a measure of last resort and for the shortest appropriate period of time;",
    "36": "Recognizes the efforts made by the United Nations Office on Drugs and Crime to assist Member States in developing their abilities and strengthening their capacity to prevent and combat kidnapping, and requests the Office to continue to provide technical assistance, upon request, with a view to fostering international cooperation, in particular mutual legal assistance, aimed at countering effectively this growing serious crime;",
    "37": "Calls upon Member States to consider ratifying or acceding to, and for States parties to effectively implement, the Protocol against the Smuggling of Migrants by Land, Sea and Air, supplementing the United Nations Convention against Transnational Organized Crime,35 to reinforce international cooperation for preventing and combating the smuggling of migrants and for the prosecution of smugglers, in accordance, as appropriate, with article 6 of the Protocol and with national laws and legislation, while effectively protecting the rights and respecting the dignity of smuggled migrants, consistent with the principles of non-discrimination and other applicable obligations under relevant international law, taking into account the special needs of women, children, especially when unaccompanied, and persons with disabilities and older persons, and in collaboration with international organizations, civil society and the private sector, and in this regard calls upon the United Nations Office on Drugs and Crime to continue its technical assistance to Member States in accordance with the Protocol;",
    "38": "Takes note of the launch of the first United Nations Office on Drugs and Crime Global Study on Smuggling of Migrants, encourages Member States to promote the reliable collection of relevant data and research, at the national and, as appropriate, the regional and international levels, and invites the Office to systematically collect data and information from Member States on migrant smuggling routes, the modus operandi of migrant smugglers and the role of transnational organized crime, and invites Member States and other donors to provide extrabudgetary resources for this purpose;",
    "39": "Encourages Member States to ensure that, in investigating and prosecuting trafficking in persons and the smuggling of migrants, the concurrent undertaking of financial investigations is a standard practice, with a view to tracing, freezing and confiscating proceeds acquired through those crimes, and to consider trafficking in persons and the smuggling of migrants to be predicate offences of money-laundering;",
    "40": "Emphasizes the importance of preventing and combating all forms of trafficking in persons, and in this regard expresses its concern about the activities of transnational and national organized criminal groups and others who profit from such crimes, including for the purpose of organ removal, and calls upon Member States to consider ratifying or acceding to, and for States parties, in accordance with their obligations, to fully and effectively implement the Protocol to Prevent, Suppress and Punish Trafficking in Persons, Especially Women and Children, supplementing the United Nations Convention against Transnational Organized Crime, 20 as well as to strengthen national efforts to combat all forms of trafficking in persons and to protect and assist the victims of trafficking in accordance with all relevant legal obligations and in collaboration with international organizations, civil society and the private sector, and in this regard calls upon the United Office on Drugs and Crime to continue its technical assistance to Member States in accordance with the Protocol;",
    "41": "Requests the United Nations Office on Drugs and Crime to enhance its technical assistance to Member States, upon request, to strengthen international cooperation in preventing and combating terrorism, including the phenomenon of travelling, returning and relocating foreign terrorist fighters, especially with regard to extradition and mutual legal assistance, and its financial sources, through the facilitation of the ratification and implementation of the universal conventions and protocols related to terrorism, in close consultation and cooperation with the Security Council Committee established pursuant to resolution 1373 (2001) concerning counter-terrorism (the Counter-Terrorism Committee) and its Executive Directorate, as well as to contribute to the work of the Office of Counter-Terrorism, established in accordance with resolution 71/291, and invites Member States to provide the United Nations Office on Drugs and Crime with appropriate resources for its mandate;",
    "42": "Urges the United Nations Office on Drugs and Crime to continue to provide, within its mandate, technical assistance to Member States, upon their request, to combat money-laundering and the financing of terrorism through the Global Programme against Money-Laundering, Proceeds of Crime and the Financing of Terrorism, in accordance with United Nations-related instruments and international standards, including, where applicable, standards and relevant initiatives of regional, interregional and multilateral organizations and intergovernmental bodies against money-laundering, inter alia and as appropriate, the Financial Action Task Force, in accordance with national legislation;",
    "43": "Encourages Member States to enhance the effectiveness of countering criminal threats to the tourism sector, including terrorist threats, through, when appropriate, the activities of the United Nations Office on Drugs and Crime and other relevant international organizations, in cooperation with the World Tourism Organization and the private sector;",
    "44": "Affirms that attacks intentionally directed against buildings dedicated to religion, education, art, science or charitable purposes, or historic monuments, or hospitals and places where the sick and wounded are collected, may amount to war crimes, stresses the importance of holding accountable perpetrators of attacks intentionally directed against the above-mentioned buildings, provided that they are not military objectives, and calls upon all States to take appropriate action to this end within their jurisdiction in accordance with applicable international law;",
    "45": "Urges States parties to make effective use of the United Nations Convention against Transnational Organized Crime for broad cooperation in preventing and combating all forms and aspects of trafficking in cultural property and related offences, including money-laundering and the financing of terrorism, especially in returning such confiscated proceeds of crime or property to their legitimate owners, in accordance with article 14, paragraph 2, of the Convention;",
    "46": "Encourages States parties to the United Nations Convention against Transnational Organized Crime to promptly notify countries of origin when objects that may be cultural property removed from their territory are identified, and to exchange information and statistical data on all forms and aspects of trafficking in cultural property and related offences, and reaffirms in this regard the importance of the International Guidelines for Crime Prevention and Criminal Justice Responses with Respect to Trafficking in Cultural Property and Other Related Offences, as adopted by the General Assembly in its resolution 69/196;",
    "47": "Urges Member States to introduce effective national and international measures to prevent and combat illicit trafficking in cultural property, including publicizing legislation, international guidelines and related technical background documents, and offering special training for police, customs and border services, and invites Member States to make trafficking in cultural property, including stealing from and looting of archaeological and other cultural sites, a serious crime, as defined in article 2 (b) of the United Nations Convention against Transnational Organized Crime;",
    "48": "",
    "49": "Calls upon Member States to make illicit trafficking in protected species of wild fauna and flora and in hazardous waste involving organized criminal groups a serious crime in accordance with their national legislation and with article 2 (b) of the United Nations Convention against Transnational Organized Crime;",
    "50": "Also calls upon Member States to take appropriate and effective measures to prevent and combat trafficking in precious metals, stones and other minerals by organized criminal groups, including, where appropriate, the adoption and effective implementation of the necessary legislation for the prevention, investigation and prosecution of illicit trafficking in precious metals, stones and other minerals;",
    "51": "Encourages Member States to continue to support the United Nations Office on Drugs and Crime in providing targeted technical assistance, within its existing mandate, to enhance the capacity of affected States, upon their request, to combat piracy and other forms of crime committed at sea, including by assisting Member States in creating an effective law enforcement response and strengthening their judicial capacity;",
    "52": "Notes with appreciation the fourth meeting of the open-ended intergovernmental Expert Group to Conduct a Comprehensive Study on Cybercrime and the responses to cybercrime by Member States, the international community and the private sector, and calls upon Member States to support the workplan of the Expert Group and to explore specific measures and develop possible conclusions and recommendations designed to create a secure and resilient cyberenvironment, to prevent and counter effectively criminal activities carried out over the Internet, paying particular attention to identity fraud-related offences, recruitment for the purpose of trafficking in persons and protecting children from online exploitation and abuse, to strengthen law enforcement cooperation at the national and international levels, including with the aim of identifying and protecting victims by, inter alia, removing child pornography and other child sexual abuse material from the Internet, to enhance the security of computer networks and protect the integrity of relevant infrastructure, and to endeavour to provide long-term technical assistance and capacity-building to strengthen the ability of national authorities to deal with cybercrime, including the prevention, detection, investigation and prosecution of such crime in all its forms;",
    "53": "Encourages Member States to strengthen their efforts in combating cybercrime and all forms of criminal misuse of information and communications technologies and to enhance international cooperation involving electronic evidence in this regard;",
    "54": "Requests the United Nations Office on Drugs and Crime to continue to assist Member States, upon request, in combating the illicit manufacturing of and trafficking in firearms, their parts and components and ammunition, and to support them in their efforts to address the links with other forms of transnational organized crime, through, inter alia, legislative assistance, technical support, improved data collection and analysis and strengthened national statistical systems, and in this respect invites Member States to provide the Office with relevant information and suitably disaggregated data through the regular data collection instrument on firearms trafficking;",
    "55": "",
    "56": "Urges States parties to the Protocol against the Illicit Manufacturing of and Trafficking in Firearms, Their Parts and Components and Ammunition that import and export parts and components of firearms to reinforce their control measures in line with the Protocol and other relevant international legal instruments to which they are party, with a view to preventing and reducing the risks of their diversion, illicit manufacturing and trafficking;",
    "57": "Calls upon Member States to intensify all efforts to address the world drug problem, based upon the principle of common and shared responsibility and through a comprehensive and balanced approach, including through more effective bilateral, regional and international cooperation among judicial and law enforcement authorities, to counter the involvement of organized criminal groups in illicit drug production and trafficking and related criminal activities and to take steps to reduce the violence that accompanies drug trafficking;",
    "58": "Recommends that Member States, as appropriate to their national contexts, adopt a comprehensive and integrated approach to crime prevention and criminal justice reform, based on baseline assessments, regular data collection and analysis, and focusing on all sectors of the justice system, and develop crime prevention policies, strategies and programmes, including ones that focus on early prevention by using multidisciplinary and participatory approaches, in close cooperation with all stakeholders, including civil society, and requests the United Nations Office on Drugs and Crime to continue to provide technical assistance, upon request, to Member States for this purpose;",
    "59": "Invites Member States to start the gradual adoption of the International Classification of Crime for Statistical Purposes and to strengthen national statistical systems of criminal justice, requests the United Nations Office on Drugs and Crime, within its existing mandate, to continue to strengthen the regular collection, analysis and dissemination of accurate, reliable, timely and comparable data and information, including, as appropriate, data disaggregated by sex, age and other relevant criteria, and strongly encourages Member States to share such data and information with the Office;",
    "60": "Requests the United Nations Office on Drugs and Crime to continue to develop, in close cooperation with Member States, technical and methodological tools and trend analyses and studies to enhance knowledge of crime trends and support Member States in designing appropriate responses in specific areas of crime, in particular in their transnational dimension and in relation to the Sustainable Development Goals,7 taking into account the need to make the best possible use of existing resources;",
    "61": "Encourages Member States to take relevant measures, as appropriate to their national contexts, to ensure the diffusion, use and application of the United Nations standards and norms in crime prevention and criminal justice, including the consideration and, where they deem it necessary, dissemination of existing manuals, handbooks and capacity-building material developed and published by the United Nations Office on Drugs and Crime;",
    "62": " sustainability of regional networks of forensic science providers in order to enhance their expertise and capacity to prevent and combat transnational organized crime;",
    "63": "Requests the Secretary-General to submit a report to the General Assembly at its seventy-fourth session on the implementation of the mandates of the United Nations crime prevention and criminal justice programme, reflecting also emerging policy issues and possible responses."
  },
  "agenda_items": [
    "Item 109"
  ],
  "symbol_references": []
}