{
  "symbol": "A/RES/76/33",
  "filename": "A_RES_76_33.pdf",
  "title": "76/33. Compliance with non-proliferation, arms limitation and disarmament agreements and commitments",
  "text": "United Nations \nA/RES/76/33\n \n \nGeneral Assembly \nDistr.: General \n10 December 2021 \n \n21-18425 (E)    151221     \n*2118425* \n \n \nSeventy-sixth session \nAgenda item 100 (aa) \nGeneral and complete disarmament: compliance with \nnon-proliferation, arms limitation and disarmament \nagreements and commitments \n \n \n \n \n Resolution adopted by the General Assembly \non 6 December 2021 \n \n \n \n \n[on the report of the First Committee (A/76/444, para. 93)] \n \n \n \n76/33. Compliance with non-proliferation, arms limitation and \ndisarmament agreements and commitments \n \n \n \nThe General Assembly, \n \nRecalling its decision 75/517 of 7 December 2020 and relevant resolutions on \nthe question, \n \nRecognizing the abiding concern of all Member States for ensuring respect for \nthe rights and obligations arising from treaties to which they are parties and from \nother sources of international law, \n \nConvinced that observance by Member States of the Charter of the United \nNations and compliance with non-proliferation, arms limitation and disarmament \nagreements to which they are parties and with other agreed obligations are essential \nfor regional and global peace, security and stability, \n \nStressing that failure by States parties to comply with such agreements and with \nother agreed obligations not only adversely affects the security of States parties but \nalso can create security risks for other States relying on the constraints and \ncommitments stipulated in those agreements, \n \nStressing also that the viability and effectiveness of non-proliferation, arms \nlimitation and disarmament agreements and of other agreed obligations require that \nthose agreements be fully complied with and enforced, \n \nConcerned by non-compliance by some States with their respective obligations, \n \nNoting that verification and compliance, and enforcement in a manner consistent \nwith the Charter, are integrally related, \n \nRecognizing the importance of and support for effective national, regional and \ninternational capacities for such verification, compliance and enforcement, \n\nA/RES/76/33 \nCompliance with non-proliferation, arms limitation \nand disarmament agreements and commitments\n \n21-18425\n2/2 \n \n \nRecognizing also that full compliance by States with all their respective \nnon-proliferation, arms limitation and disarmament agreements and with other agreed \nobligations they have undertaken contributes to efforts to prevent the development \nand proliferation, contrary to international obligations, of weapons of mass \ndestruction, related technologies and means of delivery, as well as to efforts to deny \nnon-State actors access to such capabilities, \n \n1. \nUnderscores the contribution that compliance with non-proliferation, arms \nlimitation and disarmament agreements and with other agreed obligations makes to \nenhancing confidence and to strengthening international security and stability; \n \n2. \nUrges all States to implement and to comply fully with their respective \nobligations; \n \n3. \nWelcomes efforts by all States to pursue additional areas of cooperation, \nas appropriate, that can increase confidence in compliance with existing \nnon-proliferation, arms limitation and disarmament agreements and commitments and \nreduce the possibility of misinterpretation and misunderstanding; \n \n4. \nCalls upon all States to include and empower women, including through \ncapacity-building efforts, as appropriate, as full, equal and meaningful participants in the \ndesign and implementation of disarmament, non-proliferation and arms control efforts; \n \n5. \nCalls upon all Member States to encourage and, for those States in a \nposition to do so, to appropriately help States that request assistance to increase their \ncapacity to implement fully their obligations; \n \n6. \nCalls upon Member States to support efforts aimed at the resolution of \ncompliance questions by means consistent with such agreements and other applicable \ninternational law; \n \n7. \nWelcomes the role that the United Nations has played and continues to play in \nmaintaining the integrity of certain arms limitation, disarmament and non-proliferation \nagreements and in addressing threats to international peace and security; \n \n8. \nCalls upon all concerned States to take concerted action, in a manner \nconsistent with relevant international law, to encourage, through bilateral and \nmultilateral means, the compliance by all States with their respective non-proliferation, \narms limitation and disarmament agreements and with other agreed obligations, and \nto hold those not in compliance with such agreements or obligations accountable for \ntheir non-compliance in a manner consistent with the Charter of the United Nations; \n \n9. \nUrges those States not currently in compliance with their respective \nobligations and commitments to make the strategic decision to come back into \ncompliance; \n \n10. Encourages efforts by all States, the United Nations and other \ninternational organizations, pursuant to their respective mandates, to take action, \nconsistent with the Charter, to prevent serious damage to international security and \nstability arising from non-compliance by States with their existing non-proliferation, \narms limitation and disarmament obligations; \n \n11. \nDecides to include in the provisional agenda of its seventy-ninth session, \nunder the item entitled \u201cGeneral and complete disarmament\u201d, the sub-item entitled \n\u201cCompliance with non-proliferation, arms limitation and disarmament agreements \nand commitments\u201d. \n \n45th plenary meeting \n6 December 2021 \n \n",
  "paragraphs": {
    "1": "Underscores the contribution that compliance with non-proliferation, arms limitation and disarmament agreements and with other agreed obligations makes to enhancing confidence and to strengthening international security and stability;",
    "2": "Urges all States to implement and to comply fully with their respective obligations;",
    "3": "Welcomes efforts by all States to pursue additional areas of cooperation, as appropriate, that can increase confidence in compliance with existing non-proliferation, arms limitation and disarmament agreements and commitments and reduce the possibility of misinterpretation and misunderstanding;",
    "4": "Calls upon all States to include and empower women, including through capacity-building efforts, as appropriate, as full, equal and meaningful participants in the design and implementation of disarmament, non-proliferation and arms control efforts;",
    "5": "Calls upon all Member States to encourage and, for those States in a position to do so, to appropriately help States that request assistance to increase their capacity to implement fully their obligations;",
    "6": "Calls upon Member States to support efforts aimed at the resolution of compliance questions by means consistent with such agreements and other applicable international law;",
    "7": "Welcomes the role that the United Nations has played and continues to play in maintaining the integrity of certain arms limitation, disarmament and non-proliferation agreements and in addressing threats to international peace and security;",
    "8": "Calls upon all concerned States to take concerted action, in a manner consistent with relevant international law, to encourage, through bilateral and multilateral means, the compliance by all States with their respective non-proliferation, arms limitation and disarmament agreements and with other agreed obligations, and to hold those not in compliance with such agreements or obligations accountable for their non-compliance in a manner consistent with the Charter of the United Nations;",
    "9": "Urges those States not currently in compliance with their respective obligations and commitments to make the strategic decision to come back into compliance;",
    "10": "Encourages efforts by all States, the United Nations and other international organizations, pursuant to their respective mandates, to take action, consistent with the Charter, to prevent serious damage to international security and stability arising from non-compliance by States with their existing non-proliferation, arms limitation and disarmament obligations;",
    "11": "Decides to include in the provisional agenda of its seventy-ninth session, under the item entitled \u201cGeneral and complete disarmament\u201d, the sub-item entitled \u201cCompliance with non-proliferation, arms limitation and disarmament agreements and commitments\u201d."
  },
  "agenda_items": [
    "Item 100"
  ],
  "symbol_references": []
}