{
  "symbol": "A/RES/79/283",
  "filename": "A_RES_79_283.pdf",
  "title": "79/283. United Nations Decade for Afforestation and Reforestation in line with Sustainable Forest Management (2027\u20132036)",
  "text": "United Nations \nA/RES/79/283 \n \nGeneral Assembly \nDistr.: General \n16 April 2025 \n25-06209 (E) \n*2506209* \n \n \nSeventy-ninth session \nAgenda item 13 \nIntegrated and coordinated implementation of and follow-up \nto the outcomes of the major United Nations conferences and \nsummits in the economic, social and related fields \n \n \n \n \n Resolution adopted by the General Assembly \non 16 April 2025 \n \n \n[without reference to a Main Committee (A/79/L.64)] \n \n \n 79/283. United Nations Decade for Afforestation and Reforestation in line \nwith Sustainable Forest Management (2027\u20132036) \n \n \n \nThe General Assembly, \n \nReaffirming its resolution 70/1 of 25 September 2015, entitled \u201cTransforming \nour world: the 2030 Agenda for Sustainable Development\u201d, in which it adopted a \ncomprehensive far-reaching and people-centred set of universal and transformative \nSustainable Development Goals and targets, its commitment to working tirelessly for \nthe full implementation of the Agenda by 2030, its recognition that eradicating \npoverty in all its forms and dimensions, including extreme poverty, is the greatest \nglobal challenge and an indispensable requirement for sustainable development, its \ncommitment to achieving sustainable development in its three dimensions \u2013 \neconomic, social and environmental \u2013 in a balanced and integrated manner, and to \nbuilding upon the achievements of the Millennium Development Goals and seeking \nto address their unfinished business, \n \nRecalling its resolution 73/284 of 1 March 2019, entitled \u201cUnited Nations \nDecade on Ecosystem Restoration (2021\u20132030)\u201d, adopted with the aim of supporting \nand scaling up efforts to prevent, halt and reverse the degradation of ecosystems \nworldwide and raise awareness of the importance of successful ecosystem restoration,  \n \nRecalling also Economic and Social Council resolutions 1980/67 of 25 July \n1980 on international years and anniversaries and 1989/84 of 24 May 1989 on \nguidelines for international decades in economic and social fields and General \nAssembly resolutions 53/199 of 15 December 1998 and 61/185 of 20 December 2006 \non the proclamation of international years, \n \nRecalling further its resolution 78/320 of 13 August 2024 on fostering \nsustainable forest management, including afforestation and reforestation, in degraded \nlands, including drylands, as an effective solution to environmental challenges,  \n\nA/RES/79/283 \nUnited Nations Decade for Afforestation and Reforestation in line \nwith Sustainable Forest Management (2027\u20132036)\n \n25-06209\n2/3 \n \n \nRecalling the declaration of the high-level segment of the nineteenth session of \nthe United Nations Forum on Forests,1 \n \nReaffirming the United Nations strategic plan for forests 2017\u201320302 as a global \nframework for action at all levels to protect and sustainably manage all types of \nforests and trees outside forests, to halt deforestation and forest degradation and \ncontribute to the implementation of the 2030 Agenda for Sustainable Development \nand other international forest-related instruments, processes, commitments and goals, \n \nTaking note of relevant regional initiatives, including the launch of an African \nand Global Decade of Afforestation and Reforestation,  \n \nRecognizing the multiple values and contributions of forests and sustainable \nforest management to sustainable development in its three dimensions, as well as the \nmyriad benefits provided by all types of forests and trees outside forests, their wood \nand non\u2011wood products, their functions and services to the environment, health and \nwell-being, and to socioeconomic development, poverty eradication, and \nemployment, such as food security, clean water, provision of wood, fuel and fibre, \nclimate change mitigation and adaptation, biodiversity conservation and restoration, \nprevention of land degradation and floods, and sand and dust storm mitigation, among \nothers, \n \nRecalling the United Nations Framework Convention on Climate Change3 and \nthe Paris Agreement,4 the Convention on Biological Diversity 5 and the Kunming-\nMontreal Global Biodiversity Framework adopted at the fifteenth meeting of the \nConference of the Parties to the Convention,6 and the United Nations Convention to \nCombat Desertification in Those Countries Experiencing Serious Drought and/or \nDesertification, Particularly in Africa, 7 including the Land Degradation Neutrality \nTarget Setting Programme, as well as the outcomes of the high-level political forum \non sustainable development, \n \nExpressing deep concerns about the continued global trend in deforestation as \nwell as the mutually reinforcing adverse impacts of climate change, desertification \nand land degradation, biodiversity loss, pollution and waste, while acknowledging \nefforts of countries in addressing deforestation, \n \nRecalling the six global forest goals and their associated targets of the United \nNations strategic plan for forests 2017\u20132030, including target 1.3 of goal 1, which \ncalls for promoting the implementation of sustainable management of all types of \nforests, halting deforestation, restoring degraded forests and substantially increasing \nafforestation and reforestation globally, and emphasizing the need for enhanced \ncooperation at all levels, including within the United Nations system to this end, \n \nEmphasizing that sustainable forest management, including afforestation and \nreforestation through tree planting, seeding and regeneration in degraded lands, \nincluding drylands, can have economic, social and environmental benefits, inter alia, \nby increasing biodiversity, providing habitat for diverse plant and animal species, \nprotecting against natural hazards and disasters, contributing substantially to climate \nchange mitigation and adaptation, particularly by absorbing and storing carbon dioxide \n_______________ \n \n1 Economic and Social Council decision 2024/328. \n \n2 See resolution 71/285. \n \n3 United Nations, Treaty Series, vol. 1771, No. 30822. \n \n4 Adopted under the UNFCCC in FCCC/CP/2015/10/Add.1, decision 1/CP.21. \n \n5 United Nations, Treaty Series, vol. 1760, No. 30619. \n \n6 United Nations Environment Programme, document CBD/COP/15/17, decision 15/4, annex. \n \n7 United Nations, Treaty Series, vol. 1954, No. 33480. \n\nUnited Nations Decade for Afforestation and Reforestation in line \nwith Sustainable Forest Management (2027\u20132036) \nA/RES/79/283\n \n3/3\n25-06209 \n \nfrom the atmosphere, as well as providing opportunities for agroforestry and \necotourism,  \n \nNoting the many initiatives related to afforestation and reforestation under way \naround the world, and emphasizing the need to ensure that afforestation and \nreforestation activities are carried out in line with sustainable forest management, \ninformed by the best available science, and that they do not lead to the degradation of \nnon\u2011forested natural ecosystems,  \n \n1. \nDecides to proclaim the period 2027\u20132036 as the United Nations Decade \nfor Afforestation and Reforestation in line with Sustainable Forest Management, \nwithin existing structures and available resources, with the objective of raising global \nawareness, fostering political will, mobilizing action at all levels and strengthening \ninternational cooperation and capacity-building to halt and reverse the loss of forest \ncover worldwide and to support efforts in afforestation and reforestation in line with \nsustainable forest management, in alignment with relevant global frameworks;  \n \n2. \nEmphasizes the need for full consistency and coordination between the \nimplementation of the Decade and existing global frameworks, including the United \nNations Decade on Ecosystem Restoration (2021\u20132030) and the United Nations \nstrategic plan for forests 2017\u20132030 and its global forest goals, and relevant United \nNations major outcome documents and multilateral environmental agreements, \nensuring that efforts are mutually reinforcing and contribute to long-term global forest \nsustainability; \n \n3. \nInvites the United Nations Environment Programme, the Food and \nAgricultural Organization of the United Nations and the secretariat of the United \nNations Forum on Forests to facilitate the observance of the Decade;  \n \n4. \nInvites the United Nations Forum on Forests, within its existing mandates \nand resources, to consider, as appropriate, the role and contributions of the United \nNations Decade for Afforestation and Reforestation in line with Sustainable Forest \nManagement (2027\u20132036) in its deliberations;  \n \n5. \nStresses that the costs of all activities that may arise from the \nimplementation of the present resolution should be met from voluntary contributions, \nincluding from the private sector;  \n \n6. \nInvites Governments and other relevant stakeholders, including \ninternational and regional organizations, civil society, Indigenous Peoples, local \ncommunities, the private sector and academia, to actively support the implementation \nof the Decade, including through voluntary contributions, as appropriate, and to share \nbest practices and knowledge in this regard. \n \n64th plenary meeting \n16 April 2025 \n \n",
  "paragraphs": {
    "1": "Decides to proclaim the period 2027\u20132036 as the United Nations Decade for Afforestation and Reforestation in line with Sustainable Forest Management, within existing structures and available resources, with the objective of raising global awareness, fostering political will, mobilizing action at all levels and strengthening international cooperation and capacity-building to halt and reverse the loss of forest cover worldwide and to support efforts in afforestation and reforestation in line with sustainable forest management, in alignment with relevant global frameworks;",
    "2": "Emphasizes the need for full consistency and coordination between the implementation of the Decade and existing global frameworks, including the United Nations Decade on Ecosystem Restoration (2021\u20132030) and the United Nations strategic plan for forests 2017\u20132030 and its global forest goals, and relevant United Nations major outcome documents and multilateral environmental agreements, ensuring that efforts are mutually reinforcing and contribute to long-term global forest sustainability;",
    "3": "Invites the United Nations Environment Programme, the Food and Agricultural Organization of the United Nations and the secretariat of the United Nations Forum on Forests to facilitate the observance of the Decade;",
    "4": "Invites the United Nations Forum on Forests, within its existing mandates and resources, to consider, as appropriate, the role and contributions of the United Nations Decade for Afforestation and Reforestation in line with Sustainable Forest Management (2027\u20132036) in its deliberations;",
    "5": "Stresses that the costs of all activities that may arise from the implementation of the present resolution should be met from voluntary contributions, including from the private sector;",
    "6": "Invites Governments and other relevant stakeholders, including international and regional organizations, civil society, Indigenous Peoples, local communities, the private sector and academia, to actively support the implementation of the Decade, including through voluntary contributions, as appropriate, and to share best practices and knowledge in this regard. 64th plenary meeting 16 April 2025"
  },
  "agenda_items": [
    "Item 13"
  ],
  "symbol_references": [
    "A/79/L.64"
  ]
}