{
  "symbol": "A/RES/75/94",
  "filename": "A_RES_75_94.pdf",
  "title": "75/94. Operations of the United Nations Relief and Works Agency for Palestine Refugees in the Near East",
  "text": "United Nations \nA/RES/75/94 \n \n \nGeneral Assembly \nDistr.: General \n18 December 2020 \n \n20-16925 (E)    221220     \n*2016925* \n \n \nSeventy-fifth session \nAgenda item 52 \nUnited Nations Relief and Works Agency for Palestine \nRefugees in the Near East  \n \n \n \n \n Resolution adopted by the General Assembly \non 10 December 2020 \n \n \n \n \n[on the report of the Special Political and Decolonization Committee \n(Fourth Committee) (A/75/411, para. 12)] \n \n \n \n75/94. Operations of the United Nations Relief and Works Agency for \nPalestine Refugees in the Near East \n \n \n \nThe General Assembly, \n \nRecalling its resolutions 194 (III) of 11 December 1948, 212 (III) of \n19 November 1948, 302 (IV) of 8 December 1949 and all subsequent related \nresolutions, including its resolution 74/85 of 13 December 2019, \n \nRecalling also the relevant resolutions of the Security Council, \n \nHaving considered the report of the Commissioner-General of the United \nNations Relief and Works Agency for Palestine Refugees in the Near East covering \nthe period from 1 January to 31 December 2019,1  \n \nTaking note of the letter dated 2 July 2020 from the Chair of the Advisory \nCommission of the Agency addressed to the Commissioner-General,2  \n \nUnderlining that, at a time of heightened conflict and instability in the Middle \nEast, the Agency continues to play a vital role in ameliorating the plight of the \nPalestine refugees through the provision of, inter alia, essential education, health, \nrelief and social services programmes and emergency assistance to a registered \npopulation of more than 5.6 million refugees whose situation has become extremely \nprecarious, in mitigating the consequences of alarming trends, including increasing \nviolence, marginalization and poverty, in the areas of operation, and in providing a \ncrucial measure of stability in the region, \n \nRecalling its resolutions 2252 (ES-V) of 4 July 1967 and 2341 B (XXII) of \n19 December 1967 and all subsequent related resolutions, recalling also Security \n__________________ \n \n1  Official Records of the General Assembly, Seventy-fifth Session, Supplement No. 13 (A/75/13). \n \n2  Ibid., pp. 6\u20138. \n\nA/RES/75/94 \nOperations of the United Nations Relief and Works Agency for \nPalestine Refugees in the Near East\n \n20-16925\n2/11 \n \nCouncil resolutions 237 (1967) of 14 June 1967 and 259 (1968) of 27 September \n1968, stressing the necessity of an accelerated return of displaced persons, and calling \nfor compliance with the mechanism agreed upon by the parties in article XII of the \nDeclaration of Principles on Interim Self-Government Arrangements of 13 September \n19933 on the return of displaced persons, \n \nDeeply concerned about the extremely critical financial situation of the Agency, \ncaused by the structural underfunding of the Agency, as well as by rising needs and \nexpenditures resulting from the deterioration of the socioeconomic and humanitarian \nconditions and the conflicts and rising instability in the region and their significant \nnegative impact on the ability of the Agency to deliver essential services to the \nPalestine refugees, including its emergency, recovery, reconstruction and \ndevelopment programmes in all fields of operation, \n \nTaking note of the report of the Secretary-General on the operations of the \nUnited Nations Relief and Works Agency for Palestine Refugees in the Near East,4 \nsubmitted pursuant to resolution 71/93 of 6 December 2016, and the request contained \ntherein for broad consultations to explore all ways and means, including through \nvoluntary and assessed contributions, to ensure that the Agency\u2019s funding is \nsufficient, predictable and sustained for the duration of its mandate, and considering \nthe recommendations contained in the report, \n \nTaking note also of the report of 31 May 2020 of the Commissioner-General, \nsubmitted pursuant to paragraph 57 of the report of the Secretary-General and in \nfollow-up to the update to the special report of 3 August 2015 of the Commissioner-\nGeneral,5 submitted pursuant to paragraph 21 of General Assembly resolution 302 (IV), \nregarding the severe financial crisis of the Agency and the negative implications for \nthe continued delivery of core Agency programmes to the Palestine refugees in all \nfields of operation, \n \nExpressing appreciation for the efforts of donors and host countries to respond \nto the Agency\u2019s unprecedented financial crisis, including through generous, \nadditional contributions and, where possible, continued increases in voluntary \ncontributions, while acknowledging the steadfast support of all other donors to the \nAgency, \n \nWelcoming the contributions made to the Agency\u2019s emergency appeals, \nincluding for the Gaza Strip and for the Syrian Arab Republic, and calling urgently \nupon the international community to continue its support, since needs persist and \nthese appeals remain severely underfunded, \n \nNoting that contributions have not been predictable enough or sufficient to meet \ngrowing needs and remedy the persistent shortfalls, which have, since 2018, been \nexacerbated by the suspension of the single largest voluntary contribution to the \nAgency, undermining the Agency\u2019s operations and efforts to promote human \ndevelopment and meet Palestine refugees\u2019 basic needs, and stressing the need for \nfurther efforts to comprehensively address the recurrent funding shortfalls affecting \nthe Agency\u2019s operations, \n \nRecognizing the Agency\u2019s extensive efforts to rapidly develop innovative and \ndiversified ways to address its financial shortfall and mobilize resources, including \nthrough the expansion of the donor base and partnerships with international financial \ninstitutions, the private sector and civil society, including through special digital \ncampaigns, \n__________________ \n \n3  A/48/486-S/26560, annex. \n \n4  A/71/849. \n \n5  A/70/272, annex. \n\nOperations of the United Nations Relief and Works Agency for \nPalestine Refugees in the Near East \nA/RES/75/94\n \n3/11\n20-16925 \n \n \nCommending the Agency for the measures taken to address the financial crisis, \ndespite difficult operational circumstances, including through the implementation of \nthe medium-term strategy for 2016\u20132021 and various internal measures to contain \nexpenditures, reduce operational and administrative costs, maximize the use of \nresources and reduce the funding shortfalls, and expressing profound concern that, \ndespite such measures, the Agency\u2019s programme budget, which is funded primarily \nby voluntary contributions from Member States and intergovernmental organizations, \nfaces persistent shortfalls that continue to threaten the delivery of the Agency\u2019s core \nprogrammes of assistance to the Palestine refugees, \n \nEncouraging the Agency to sustain those reform efforts, while also taking all \npossible measures to protect and improve the quality of access to and the delivery of \ncore programmes of assistance, \n \nRecalling its resolution 65/272 of 18 April 2011, in which it requested the \nSecretary-General to continue to support the institutional strengthening of the \nAgency, \n \nStressing the need to support the Agency\u2019s capacity to uphold its mandate and \nto avert the serious humanitarian, political and security risks that would result from \nany interruption or suspension of its vital work, \n \nRecognizing that the recurring and growing financial shortfalls directly affecting \nthe sustainability of the Agency\u2019s operations need to be remedied by examining new \nfunding modalities designed to put the Agency on a stable financial footing to enable \nit to effectively carry out its core programmes in accordance with its mandate and \ncommensurate with humanitarian needs, \n \nWelcoming the affirmation in the New York Declaration for Refugees and \nMigrants, adopted by the General Assembly on 19 September 2016, 6 that, inter alia, \nthe Agency, along with other relevant organizations, requires sufficient funding to be \nable to carry out its activities effectively and in a predictable manner, \n \nBearing in mind the 2030 Agenda for Sustainable Development,7 including the \npledge that no one will be left behind, emphasizing that the Sustainable Development \nGoals apply to all, including refugees, and commending the efforts of the Agency\u2019s \nprogrammes to promote 10 of the 17 Goals, as indicated in the report of the Secretary-\nGeneral, \n \nWelcoming the joint efforts of host countries and donors to mobilize support for \nthe Agency, including through extraordinary ministerial meetings, inter alia, the \nextraordinary ministerial conference held in Rome on 15 March 2018, the ministerial \nmeeting convened at United Nations Headquarters in New York on 26 September \n2019 and the extraordinary virtual ministerial pledging conference convened on \n23 June 2020, hosted by Jordan and Sweden, aimed at urgently addressing the \nAgency\u2019s funding shortfall and the need for predictable multi-year funding, \nexpanding donor support for the Agency and reaffirming support for its mandate, \n \nWelcoming also the establishment, pursuant to the recommendations made by \nthe Secretary-General in his report on the operations of the Agency, by the \nOrganization of Islamic Cooperation at the forty-sixth session of its Council of \nForeign Ministers, held in Abu Dhabi in March 2019, of a waqf fund at the Islamic \nDevelopment Bank to support Palestine refugees through enhanced support to the \nAgency, \n__________________ \n \n6  Resolution 71/1. \n \n7  Resolution 70/1. \n\nA/RES/75/94 \nOperations of the United Nations Relief and Works Agency for \nPalestine Refugees in the Near East\n \n20-16925\n4/11 \n \n \nRecalling Articles 100, 104 and 105 of the Charter of the United Nations and \nthe Convention on the Privileges and Immunities of the United Nations,8  \n \nRecalling also the Convention on the Safety of United Nations and Associated \nPersonnel,9  \n \nRecalling further its resolutions 74/116 of 16 December 2019 on the safety and \nsecurity of humanitarian personnel and protection of United Nations personnel and \n74/118 of 16 December 2019 on the strengthening of the coordination of emergency \nhumanitarian assistance of the United Nations, calling upon, inter alia, all States to \nensure respect for and the protection of all humanitarian personnel and United Nations \nand associated personnel, to respect the principles of humanity, neutrality, \nimpartiality and independence for the provision of humanitarian assistance and to \nrespect and ensure respect for the inviolability of United Nations premises, \n \nAffirming the applicability of the Geneva Convention relative to the Protection \nof Civilian Persons in Time of War, of 12 August 1949,10 to the Palestinian territory \noccupied since 1967, including East Jerusalem, \n \nAware of the continuing needs of the Palestine refugees in all fields of operation, \nnamely Jordan, Lebanon, the Syrian Arab Republic and the Occupied Palestinian \nTerritory, \n \nGravely concerned about the extremely difficult socioeconomic conditions \nbeing faced by the Palestine refugees in the Occupied Palestinian Territory, including \nEast Jerusalem, particularly in the refugee camps in the Gaza Strip, as a result of the \nrecurrent military operations, continuing prolonged Israeli closures, the construction \nof settlements and the wall, evictions, the demolition of homes and livelihood \nproperties causing forced transfers of civilians, and the severe economic and \nmovement restrictions that in effect amount to a blockade, which have deepened \nunemployment and poverty rates among the refugees, with potentially lasting, long-\nterm negative effects, while taking note of developments with regard to the situation \nof access there, \n \nConcerned about plans and measures to interfere with or obstruct the operations \nof the Agency, including in East Jerusalem, contrary to international law and the \nConvention on the Safety of United Nations and Associated Personnel, and reiterating \nthe need for the Agency to fully implement its mandate in support of Palestine \nrefugees without interference, including in the Occupied Palestinian Territory, \nincluding East Jerusalem, \n \nCommending the health-care staff of the Agency for their dedication in \nresponding to the profound stresses caused to the health system by the high number \nof Palestinian civilian casualties in the recent period in the Gaza Strip, \n \nCommending also the important role played by the Agency throughout its areas \nof operations to help to prevent and contain the spread of the coronavirus disease \n(COVID-19), \n \nExpressing grave concern in this regard about the lasting impact on the \nhumanitarian and socioeconomic situation of the Palestine refugees in the Gaza Strip, \nincluding high rates of food insecurity, poverty, displacement and the depletion of \ncoping capacities, \n__________________ \n \n8  Resolution 22 A (I). \n \n9  United Nations, Treaty Series, vol. 2051, No. 35457. \n \n10  Ibid., vol. 75, No. 973. \n\nOperations of the United Nations Relief and Works Agency for \nPalestine Refugees in the Near East \nA/RES/75/94\n \n5/11\n20-16925 \n \n \nRecalling the temporary tripartite agreement facilitated by the United Nations \nin September 2014, and stressing the urgent need for the lifting of all Israeli closures \nand restrictions on the Gaza Strip, \n \nRecalling also its resolution ES-10/18 of 16 January 2009 and Security Council \nresolution 1860 (2009) of 8 January 2009, as well as the Agreement on Movement \nand Access of 15 November 2005, \n \nExpressing concern about the continuing classroom shortage, including in the \nGaza Strip, and the consequent negative impact on the right to education of refugee \nchildren, \n \nStressing the urgent need for the advancement of reconstruction in the Gaza \nStrip, including by ensuring the timely facilitation of construction projects, including \nextensive shelter repair, and the need for the accelerated implementation of other \nurgent United Nations-led civilian reconstruction activities, and calling upon Israel \nto ensure the expedited and unimpeded import of all necessary construction materials \ninto the Gaza Strip and to reduce the burdensome cost of importation of Agency \nsupplies, while taking note of the continued implementation of the tripartite \nagreement facilitated by the United Nations, \n \nUrging the full disbursement of pledges made at the Cairo International \nConference on Palestine: Reconstructing Gaza, held on 12 October 2014, for ensuring \nthe provision of the necessary humanitarian assistance and accelerating the \nreconstruction, rehabilitation and recovery process, \n \nStressing that the situation in the Gaza Strip is unsustainable and that a durable \nceasefire agreement must lead to a fundamental improvement in the living conditions \nof the Palestinian people in the Gaza Strip, including through the sustained and \nregular opening of crossing points, and must ensure the safety and well-being of \ncivilians on both sides, \n \nAffirming the need to support the Palestinian Government in its assumption of \nfull government responsibilities in both the West Bank and the Gaza Strip, in all \nfields, as well as through its presence at Gaza\u2019s crossing points, \n \nExpressing deep concern at the critical situation of Palestine refugees in the \nSyrian Arab Republic and at the impact of the crisis on the Agency\u2019s installations and \nits ability to deliver its services, and regretting profoundly the loss of life and \nwidespread displacement among refugees and the killing of staff members of the \nAgency in the crisis since 2012, \n \nEmphasizing the continuing need for assistance to Palestine refugees in the \nSyrian Arab Republic as well as those who have fled to neighbouring countries, and \nemphasizing the necessity of ensuring open borders for Palestine refugees fleeing the \ncrisis in the Syrian Arab Republic, consistent with the principles of \nnon-discrimination and non-refoulement under international law, and recalling in this \nregard the statement by the President of the Security Council of 2 October 201311 and \nthe New York Declaration for Refugees and Migrants, \n \nAware of the valuable work done by the Agency in providing protection to the \nPalestinian people, in particular Palestine refugees, and recalling the need for the \nprotection of all civilians in situations of armed conflict, \n \nDeploring the endangerment of the safety of the Agency\u2019s staff and the damage \nand destruction caused to the facilities and properties of the Agency during the period \ncovered by the report of the Commissioner-General, and stressing the need to \n__________________ \n \n11  S/PRST/2013/15; see Resolutions and Decisions of the Security Council, 1 August 2013\u201331 July \n2014 (S/INF/69). \n\nA/RES/75/94 \nOperations of the United Nations Relief and Works Agency for \nPalestine Refugees in the Near East\n \n20-16925\n6/11 \n \nmaintain the neutrality and safeguard the inviolability of United Nations premises, \ninstallations and equipment at all times, \n \nDeploring also the breaches of the inviolability of United Nations premises, the \nfailure to accord the property and assets of the Organization immunity from any form \nof interference, incursions or misuse, the failure to protect United Nations personnel, \npremises and property and any disruption caused to Agency operations by such \nviolations, \n \nDeploring further all attacks affecting United Nations installations, including \nAgency schools sheltering displaced civilians, and all other breaches of the \ninviolability of United Nations premises, including during the conflict in the Gaza \nStrip in July and August 2014, as reported in the summary by the Secretary-General \nof the report of the Board of Inquiry12 and by the independent commission of inquiry \nestablished pursuant to Human Rights Council resolution S-21/1,13 and stressing the \nimperative of ensuring accountability, \n \nCondemning the killing, injury and detention contrary to international law of \nAgency staff members, \n \nCondemning also the killing, wounding and detention contrary to international \nlaw of refugee children and women, \n \nAffirming the need for accountability and compensation to victims of violations \nof international law in accordance with international standards by all sides, \n \nDeeply concerned about the continuing imposition of restrictions on the \nfreedom of movement and access of the Agency\u2019s staff, vehicles and goods, and the \ninjury, harassment and intimidation of the Agency\u2019s staff, which undermine and \nobstruct the work of the Agency, including its ability to provide essential basic and \nemergency services, \n \nRecalling the statement of 15 July 1999 and the declarations adopted on \n5 December 2001 and on 17 December 201414 by the Conference of High Contracting \nParties to the Fourth Geneva Convention, including the call upon parties to facilitate \nthe activities of the Agency, to guarantee its protection and to refrain from levying \ntaxes and imposing undue financial burdens, \n \nAware of the agreement between the Agency and the Government of Israel, \n \nTaking note of the agreement reached on 24 June 1994, embodied in an exchange \nof letters between the Agency and the Palestine Liberation Organization, 15  \n \n1. \nReaffirms that the effective functioning of the United Nations Relief and \nWorks Agency for Palestine Refugees in the Near East remains essential in all fields \nof operation; \n \n2. \nExpresses its appreciation to the Commissioner-General of the Agency, as \nwell as to all the staff of the Agency, for their tireless efforts and valuable work, \nparticularly in the light of the difficult conditions, instability and crises faced during \nthe past year; \n \n3. \nExpresses special commendation to the Agency for the essential role that \nit has played for almost seven decades since its establishment in providing vital \nservices for the well-being, human development and protection of the Palestine \n__________________ \n \n12  S/2015/286, annex. \n \n13  See A/HRC/29/52. \n \n14  A/69/711-S/2015/1, annex. \n \n15  Official Records of the General Assembly, Forty-ninth Session, Supplement No. 13 (A/49/13), \nannex I. \n\nOperations of the United Nations Relief and Works Agency for \nPalestine Refugees in the Near East \nA/RES/75/94\n \n7/11\n20-16925 \n \nrefugees and the amelioration of their plight and for the stability of the region, and \naffirms the necessity for continuing the work of the Agency and its unimpeded \noperation and provision of services, pending the just resolution of the question of the \nPalestine refugees; \n \n4. \nCommends the Agency for its extraordinary efforts, in cooperation with \nother United Nations agencies on the ground, to provide emergency humanitarian \nassistance, including shelter, food and medical aid, to refugees and affected civilians \nduring periods of crisis and conflict, and recognizes its exemplary capacity to \nmobilize in emergency situations while continuously carrying out its core human \ndevelopment programmes; \n \n5. \nEndorses in this regard the efforts of the Commissioner-General of the \nAgency to continue to provide humanitarian assistance, as far as practicable, on an \nemergency basis, and as a temporary measure, to persons in the area who are currently \ndisplaced and in serious need of continued assistance as a result of the June 1967 and \nsubsequent hostilities, while reaffirming the right of all persons displaced as a result \nof the June 1967 and subsequent hostilities to return to their homes or former places \nof residence in the territories occupied by Israel since 1967; \n \n6. \nStrongly appeals to all Governments and to organizations and individuals \nto contribute generously to the Agency and to the other intergovernmental and \nnon-governmental organizations concerned for the above-mentioned purpose; \n \n7. \nExpresses its grave concern about attempts to discredit the Agency despite \nits proven operational capacity, record of effective provision of humanitarian and \ndevelopment assistance and consistent implementation of its mandate in accordance \nwith relevant resolutions and its regulatory framework, even under the most difficult \ncircumstances; \n \n8. \nReaffirms the Agency\u2019s important role in providing humanitarian and \ndevelopment assistance to Palestine refugees, engaging with international human \nrights mechanisms, as appropriate, and in doing so contributing to the protection and \nresilience of Palestinian civilians, as outlined in the report of the Secretary-General \non the protection of the Palestinian civilian population,16 and contributing to regional \nstability; \n \n9. \nExpresses its appreciation for the important support and cooperation \nprovided by the host Governments to the Agency in the discharge of its duties; \n \n10. Expresses its appreciation to the Advisory Commission of the Agency, and \nrequests it to continue its efforts and to keep the General Assembly informed of its \nactivities; \n \n11. Takes note of the report of the Working Group on the Financing of the \nUnited Nations Relief and Works Agency for Palestine Refugees in the Near East 17 \nand the efforts to assist in ensuring the financial security of the Agency, and requests \nthe Secretary-General to provide the necessary services and assistance to the Working \nGroup for the conduct of its work; \n \n12. Expresses its deep appreciation to all donor countries and organizations \nthat have, inter alia, sustained, accelerated or increased their contributions to the \nAgency, helping to alleviate its unprecedented financial crisis in 2018 and 2019, to \nmitigate imminent risks to its core and emergency programming and to prevent an \ninterruption of essential assistance to Palestine refugees; \n__________________ \n \n16  A/ES-10/794. \n \n17  A/75/196. \n\nA/RES/75/94 \nOperations of the United Nations Relief and Works Agency for \nPalestine Refugees in the Near East\n \n20-16925\n8/11 \n \n \n13. Commends the Agency for its six-year medium-term strategy for 2016\u20132021 \nand the Commissioner-General for his continuing efforts to increase the budgetary \ntransparency and efficiency of the Agency, as reflected in the Agency\u2019s proposed \nprogramme budget for 2021;18  \n \n14. Also commends the Agency for sustaining its robust internal reform efforts, \ndespite difficult operational circumstances, and recognizes its implementation of \nmaximum efficiency procedures to contain expenditures, reduce operational and \nadministrative costs, reduce its funding shortfalls and maximize the use of resources; \n \n15. Takes note of the report of the Secretary-General on the operations of the \nUnited Nations Relief and Works Agency for Palestine Refugees in the Near East and \nthe conclusions and recommendations contained therein; \n \n16. Appeals to States and organizations for the maintenance of their voluntary \ncontributions to the Agency, as well as an increase in contributions where possible, in \nparticular to the Agency\u2019s programme budget, including in the consideration of their \nallocation of resources for international human rights, peace and stability, \ndevelopment and humanitarian efforts, to support the Agency\u2019s mandate and its ability \nto meet the rising needs of the Palestine refugees and essential associated costs of \noperations; \n \n17. Appeals to States and organizations not currently contributing to the \nAgency to urgently consider making voluntary contributions in response to the calls \nof the Secretary-General for expansion of the Agency\u2019s donor base, in order to \nstabilize funding and ensure greater sharing of the financial burden of supporting the \nAgency\u2019s operations, in accordance with the continuing responsibility of the \ninternational community as a whole to assist the Palestine refugees; \n \n18. Calls for the provision by donors of early annual voluntary contributions, \nless earmarking, and multi-year funding, in line with the Grand Bargain on \nhumanitarian financing announced at the World Humanitarian Summit, held in \nIstanbul, Turkey, in May 2016, in order to enhance the Agency\u2019s ability to plan and \nimplement its operations with a greater degree of assurance regarding resource flows; \n \n19. Also calls for the full and timely funding by donors of the Agency\u2019s \nemergency, recovery and reconstruction programmes as set out in its appeals and \nresponse plans; \n \n20. Requests the Commissioner-General to continue efforts to maintain and \nincrease traditional donor support and to enhance income from non-traditional \ndonors, including through partnerships with public and private entities; \n \n21. Encourages the Agency to explore financing avenues in relation to the \nimplementation of the Sustainable Development Goals;19  \n \n22. Urges States and organizations to actively pursue partnerships with and \ninnovative support for the Agency, including as recommended in paragraphs 47, 48 \nand 50 of the report of the Secretary-General,20 including through the establishment \nof endowments, trust funds or revolving fund mechanisms and assistance to the \nAgency to access humanitarian, development and peace and security trust funds and \ngrants; \n \n23. Welcomes pledges by States and organizations to provide diplomatic and \ntechnical support to the Agency, including engagement with international and \nfinancial development institutions, including the World Bank and the Islamic \n__________________ \n \n18  A/75/6 (Sect. 26). \n \n19  See resolution 70/1. \n \n20  A/71/849. \n\nOperations of the United Nations Relief and Works Agency for \nPalestine Refugees in the Near East \nA/RES/75/94\n \n9/11\n20-16925 \n \nDevelopment Bank, and, where appropriate, to facilitate support for the establishment \nof financing mechanisms that can provide assistance to refugees and in fragile \ncontexts, including to meet the needs of the Palestine refugees, and calls for serious \nfollow-up efforts; \n \n24. Encourages further progress with regard to the creation of a World Bank \nmulti-donor trust fund, as well as for the financing of a waqf fund by the Organization \nof Islamic Cooperation at the Islamic Development Bank to support Palestine \nrefugees through the Agency; \n \n25. Requests the Agency to continue to implement efficiency measures \nthrough its medium-term strategy and the development of a five-year proposal for \nstabilizing the Agency\u2019s finances, including specific and time-bound measures, and \nto continue to improve its cost efficiency and resource mobilization efforts; \n \n26. Calls upon the members of the Advisory Commission and the Working \nGroup on the Financing of the United Nations Relief and Works Agency for Palestine \nRefugees in the Near East to consider the relevant recommendations in the report of \nthe Secretary-General, including to help the Agency to address resource mobilization \nchallenges and to actively assist the Commissioner-General in the efforts to create \nsustainable, sufficient and predictable support for the Agency\u2019s operations; \n \n27. Takes note of the recommendations of the Secretary-General regarding the \nsupport provided to the Agency from the regular budget of the United Nations; \n \n28. Endorses the efforts of the Commissioner-General to continue to provide \nhumanitarian assistance, as far as is practicable, on an emergency basis and as a \ntemporary measure, to persons in the area who are internally displaced and in serious \nneed of continuing assistance as a result of recent crises in the Agency\u2019s fields of \noperation; \n \n29. Encourages the Agency to provide increased assistance, in accordance \nwith its mandate, to affected Palestine refugees in the Syrian Arab Republic as well \nas to those who have fled to neighbouring countries, as detailed in the Syrian regional \ncrisis response plans, and calls upon donors to urgently ensure sustained support to \nthe Agency in this regard in the light of the continuing grave deterioration of the \nsituation and the growing needs of the refugees; \n \n30. Welcomes the progress made thus far by the Agency in rebuilding the Nahr \nel-Bared refugee camp in northern Lebanon, and calls for donor funding to enable the \nexpeditious completion of its reconstruction, for the continued provision of relief \nassistance to those displaced following its destruction in 2007 and for the alleviation \nof their ongoing suffering through the provision of the necessary support and financial \nassistance until the reconstruction of the camp is complete; \n \n31. Encourages the Agency, in close cooperation with other relevant United \nNations entities, to continue to make progress in addressing the needs, rights and \nprotection of children, women and persons with disabilities in its operations, \nincluding through the provision of necessary psychosocial and humanitarian support, \nin accordance with the Convention on the Rights of the Child,21 the Convention on \nthe Elimination of All Forms of Discrimination against Women22 and the Convention \non the Rights of Persons with Disabilities;23  \n \n32. Also encourages the Agency to continue to reduce the vulnerability and \nimprove the self-reliance and resilience of Palestine refugees through its programmes; \n__________________ \n \n21  United Nations, Treaty Series, vol. 1577, No. 27531. \n \n22  Ibid., vol. 1249, No. 20378. \n \n23  Ibid., vol. 2515, No. 44910. \n\nA/RES/75/94 \nOperations of the United Nations Relief and Works Agency for \nPalestine Refugees in the Near East\n \n20-16925\n10/11 \n \n \n33. Recognizes the acute protection needs of Palestine refugees across the \nregion, and encourages the Agency\u2019s efforts to contribute to a coordinated and \nsustained response in accordance with international law, including the Agency\u2019s \ndevelopment of its protection framework and function in all field offices, including \nfor child protection; \n \n34. Commends the Agency for its humanitarian and psychosocial support \nprogrammes and other initiatives that provide recreational, cultural and educational \nactivities for children in all fields, including in the Gaza Strip, recognizing their \npositive contribution, as well as the detrimental impact of the funding shortfall on \nsome emergency assistance provided by the Agency, calls for full support for such \ninitiatives by donor and host countries, and encourages the building and strengthening \nof partnerships to facilitate and enhance the provision of these services; \n \n35. Calls upon Israel, the occupying Power, to comply fully with the \nprovisions of the Geneva Convention relative to the Protection of Civilian Persons in \nTime of War, of 12 August 1949; \n \n36. Also calls upon Israel to abide by Articles 100, 104 and 105 of the Charter \nof the United Nations and the Convention on the Privileges and Immunities of the \nUnited Nations in order to ensure the safety of the personnel of the Agency, the \nprotection of its institutions and the safeguarding of the security of its facilities in the \nOccupied Palestinian Territory, including East Jerusalem, at all times; \n \n37. Urges the Government of Israel to expeditiously reimburse the Agency for \nall transit charges incurred and other financial losses sustained as a result of the delays \nand restrictions on movement and access imposed by Israel; \n \n38. Calls upon Israel particularly to cease obstructing the movement and \naccess of the staff, vehicles and supplies of the Agency and to cease levying taxes, \nextra fees and charges, which affect the Agency\u2019s operations detrimentally; \n \n39. Reiterates its call upon Israel to fully lift the restrictions impeding or \ndelaying the import of necessary construction materials and supplies for the \nreconstruction and repair of the remaining damaged or destroyed refugee shelters, and \nfor the implementation of suspended and urgently needed civilian infrastructure \nprojects in refugee camps in the Gaza Strip, noting the alarming figures reflected in \nthe United Nations country team reports of 26 August 2016, entitled \u201cGaza: two years \nafter\u201d, and of July 2017, entitled \u201cGaza ten years later\u201d; \n \n40. Notes with appreciation the positive contribution of the Agency\u2019s \nmicrofinance and job creation programmes, encourages efforts to enhance the \nsustainability and benefits of microfinance services to a greater number of Palestine \nrefugees, especially in view of the high unemployment rates affecting them, and youth \nin particular, welcomes the Agency\u2019s efforts to streamline costs and increase \nmicrofinance services through internal reform efforts, and calls upon the Agency, in \nclose cooperation with the relevant agencies, to continue to contribute to the \ndevelopment of the economic and social stability of the Palestine refugees in all fields \nof operation; \n \n41. Reiterates its appeals to all States, the specialized agencies, and \nintergovernmental and non-governmental organizations to continue and to augment \ntheir contributions to the programme budget of the Agency, to increase their special \nallocations for grants and scholarships for higher education to Palestine refugees and \nto contribute to the establishment of vocational training centres for Palestine refugees, \nand requests the Agency to act as the recipient and trustee for the special allocations \nfor grants and scholarships; \n\nOperations of the United Nations Relief and Works Agency for \nPalestine Refugees in the Near East \nA/RES/75/94\n \n11/11\n20-16925 \n \n \n42. Calls upon the Commissioner-General to include, in the annual reporting \nto the General Assembly, assessments on the progress made to remedy the recurrent \nfunding shortfalls of the Agency and ensure sustained, sufficient and predictable \nsupport for the Agency\u2019s operations, including through the implementation of the \nrelevant provisions of the present resolution. \n \n41st plenary meeting \n10 December 2020 \n \n",
  "paragraphs": {
    "1": "Reaffirms that the effective functioning of the United Nations Relief and Works Agency for Palestine Refugees in the Near East remains essential in all fields of operation;",
    "2": "Expresses its appreciation to the Commissioner-General of the Agency, as well as to all the staff of the Agency, for their tireless efforts and valuable work, particularly in the light of the difficult conditions, instability and crises faced during the past year;",
    "3": "Expresses special commendation to the Agency for the essential role that it has played for almost seven decades since its establishment in providing vital services for the well-being, human development and protection of the Palestine __________________ 12 S/2015/286, annex. 13 See A/HRC/29/52. 14 A/69/711-S/2015/1, annex. 15 Official Records of the General Assembly, Forty-ninth Session, Supplement No. 13 (A/49/13), annex I. Operations of the United Nations Relief and Works Agency for Palestine Refugees in the Near East A/RES/75/94 7/11 20-16925 refugees and the amelioration of their plight and for the stability of the region, and affirms the necessity for continuing the work of the Agency and its unimpeded operation and provision of services, pending the just resolution of the question of the Palestine refugees;",
    "4": "Commends the Agency for its extraordinary efforts, in cooperation with other United Nations agencies on the ground, to provide emergency humanitarian assistance, including shelter, food and medical aid, to refugees and affected civilians during periods of crisis and conflict, and recognizes its exemplary capacity to mobilize in emergency situations while continuously carrying out its core human development programmes;",
    "5": "Endorses in this regard the efforts of the Commissioner-General of the Agency to continue to provide humanitarian assistance, as far as practicable, on an emergency basis, and as a temporary measure, to persons in the area who are currently displaced and in serious need of continued assistance as a result of the June 1967 and subsequent hostilities, while reaffirming the right of all persons displaced as a result of the June 1967 and subsequent hostilities to return to their homes or former places of residence in the territories occupied by Israel since 1967;",
    "6": "Strongly appeals to all Governments and to organizations and individuals to contribute generously to the Agency and to the other intergovernmental and non-governmental organizations concerned for the above-mentioned purpose;",
    "7": "Expresses its grave concern about attempts to discredit the Agency despite its proven operational capacity, record of effective provision of humanitarian and development assistance and consistent implementation of its mandate in accordance with relevant resolutions and its regulatory framework, even under the most difficult circumstances;",
    "8": "Reaffirms the Agency\u2019s important role in providing humanitarian and development assistance to Palestine refugees, engaging with international human rights mechanisms, as appropriate, and in doing so contributing to the protection and resilience of Palestinian civilians, as outlined in the report of the Secretary-General on the protection of the Palestinian civilian population,16 and contributing to regional stability;",
    "9": "Expresses its appreciation for the important support and cooperation provided by the host Governments to the Agency in the discharge of its duties;",
    "10": "Expresses its appreciation to the Advisory Commission of the Agency, and requests it to continue its efforts and to keep the General Assembly informed of its activities;",
    "11": "Takes note of the report of the Working Group on the Financing of the United Nations Relief and Works Agency for Palestine Refugees in the Near East 17 and the efforts to assist in ensuring the financial security of the Agency, and requests the Secretary-General to provide the necessary services and assistance to the Working Group for the conduct of its work;",
    "12": "Expresses its deep appreciation to all donor countries and organizations that have, inter alia, sustained, accelerated or increased their contributions to the Agency, helping to alleviate its unprecedented financial crisis in 2018 and 2019, to mitigate imminent risks to its core and emergency programming and to prevent an interruption of essential assistance to Palestine refugees; __________________ 16 A/ES-10/794. 17 A/75/196. A/RES/75/94 Operations of the United Nations Relief and Works Agency for Palestine Refugees in the Near East 20-16925 8/11",
    "13": "Commends the Agency for its six-year medium-term strategy for 2016\u20132021 and the Commissioner-General for his continuing efforts to increase the budgetary transparency and efficiency of the Agency, as reflected in the Agency\u2019s proposed programme budget for 2021;18",
    "14": "Also commends the Agency for sustaining its robust internal reform efforts, despite difficult operational circumstances, and recognizes its implementation of maximum efficiency procedures to contain expenditures, reduce operational and administrative costs, reduce its funding shortfalls and maximize the use of resources;",
    "15": "Takes note of the report of the Secretary-General on the operations of the United Nations Relief and Works Agency for Palestine Refugees in the Near East and the conclusions and recommendations contained therein;",
    "16": "Appeals to States and organizations for the maintenance of their voluntary contributions to the Agency, as well as an increase in contributions where possible, in particular to the Agency\u2019s programme budget, including in the consideration of their allocation of resources for international human rights, peace and stability, development and humanitarian efforts, to support the Agency\u2019s mandate and its ability to meet the rising needs of the Palestine refugees and essential associated costs of operations;",
    "17": "Appeals to States and organizations not currently contributing to the Agency to urgently consider making voluntary contributions in response to the calls of the Secretary-General for expansion of the Agency\u2019s donor base, in order to stabilize funding and ensure greater sharing of the financial burden of supporting the Agency\u2019s operations, in accordance with the continuing responsibility of the international community as a whole to assist the Palestine refugees;",
    "18": "Calls for the provision by donors of early annual voluntary contributions, less earmarking, and multi-year funding, in line with the Grand Bargain on humanitarian financing announced at the World Humanitarian Summit, held in Istanbul, Turkey, in May 2016, in order to enhance the Agency\u2019s ability to plan and implement its operations with a greater degree of assurance regarding resource flows;",
    "19": "Also calls for the full and timely funding by donors of the Agency\u2019s emergency, recovery and reconstruction programmes as set out in its appeals and response plans;",
    "20": "Requests the Commissioner-General to continue efforts to maintain and increase traditional donor support and to enhance income from non-traditional donors, including through partnerships with public and private entities;",
    "21": "Encourages the Agency to explore financing avenues in relation to the implementation of the Sustainable Development Goals;19",
    "22": "Urges States and organizations to actively pursue partnerships with and innovative support for the Agency, including as recommended in paragraphs 47, 48 and 50 of the report of the Secretary-General,20 including through the establishment of endowments, trust funds or revolving fund mechanisms and assistance to the Agency to access humanitarian, development and peace and security trust funds and grants;",
    "23": "Welcomes pledges by States and organizations to provide diplomatic and technical support to the Agency, including engagement with international and financial development institutions, including the World Bank and the Islamic __________________ 18 A/75/6 (Sect. 26). 19 See resolution 70/1. 20 A/71/849. Operations of the United Nations Relief and Works Agency for Palestine Refugees in the Near East A/RES/75/94 9/11 20-16925 Development Bank, and, where appropriate, to facilitate support for the establishment of financing mechanisms that can provide assistance to refugees and in fragile contexts, including to meet the needs of the Palestine refugees, and calls for serious follow-up efforts;",
    "24": "Encourages further progress with regard to the creation of a World Bank multi-donor trust fund, as well as for the financing of a waqf fund by the Organization of Islamic Cooperation at the Islamic Development Bank to support Palestine refugees through the Agency;",
    "25": "Requests the Agency to continue to implement efficiency measures through its medium-term strategy and the development of a five-year proposal for stabilizing the Agency\u2019s finances, including specific and time-bound measures, and to continue to improve its cost efficiency and resource mobilization efforts;",
    "26": "Calls upon the members of the Advisory Commission and the Working Group on the Financing of the United Nations Relief and Works Agency for Palestine Refugees in the Near East to consider the relevant recommendations in the report of the Secretary-General, including to help the Agency to address resource mobilization challenges and to actively assist the Commissioner-General in the efforts to create sustainable, sufficient and predictable support for the Agency\u2019s operations;",
    "27": "Takes note of the recommendations of the Secretary-General regarding the support provided to the Agency from the regular budget of the United Nations;",
    "28": "Endorses the efforts of the Commissioner-General to continue to provide humanitarian assistance, as far as is practicable, on an emergency basis and as a temporary measure, to persons in the area who are internally displaced and in serious need of continuing assistance as a result of recent crises in the Agency\u2019s fields of operation;",
    "29": "Encourages the Agency to provide increased assistance, in accordance with its mandate, to affected Palestine refugees in the Syrian Arab Republic as well as to those who have fled to neighbouring countries, as detailed in the Syrian regional crisis response plans, and calls upon donors to urgently ensure sustained support to the Agency in this regard in the light of the continuing grave deterioration of the situation and the growing needs of the refugees;",
    "30": "Welcomes the progress made thus far by the Agency in rebuilding the Nahr el-Bared refugee camp in northern Lebanon, and calls for donor funding to enable the expeditious completion of its reconstruction, for the continued provision of relief assistance to those displaced following its destruction in 2007 and for the alleviation of their ongoing suffering through the provision of the necessary support and financial assistance until the reconstruction of the camp is complete;",
    "31": "Encourages the Agency, in close cooperation with other relevant United Nations entities, to continue to make progress in addressing the needs, rights and protection of children, women and persons with disabilities in its operations, including through the provision of necessary psychosocial and humanitarian support, in accordance with the Convention on the Rights of the Child,21 the Convention on the Elimination of All Forms of Discrimination against Women22 and the Convention on the Rights of Persons with Disabilities;23",
    "32": "Also encourages the Agency to continue to reduce the vulnerability and improve the self-reliance and resilience of Palestine refugees through its programmes; __________________ 21 United Nations, Treaty Series, vol. 1577, No. 27531. 22 Ibid., vol. 1249, No. 20378. 23 Ibid., vol. 2515, No. 44910. A/RES/75/94 Operations of the United Nations Relief and Works Agency for Palestine Refugees in the Near East 20-16925 10/11",
    "33": "Recognizes the acute protection needs of Palestine refugees across the region, and encourages the Agency\u2019s efforts to contribute to a coordinated and sustained response in accordance with international law, including the Agency\u2019s development of its protection framework and function in all field offices, including for child protection;",
    "34": "Commends the Agency for its humanitarian and psychosocial support programmes and other initiatives that provide recreational, cultural and educational activities for children in all fields, including in the Gaza Strip, recognizing their positive contribution, as well as the detrimental impact of the funding shortfall on some emergency assistance provided by the Agency, calls for full support for such initiatives by donor and host countries, and encourages the building and strengthening of partnerships to facilitate and enhance the provision of these services;",
    "35": "Calls upon Israel, the occupying Power, to comply fully with the provisions of the Geneva Convention relative to the Protection of Civilian Persons in Time of War, of 12 August 1949;",
    "36": "Also calls upon Israel to abide by Articles 100, 104 and 105 of the Charter of the United Nations and the Convention on the Privileges and Immunities of the United Nations in order to ensure the safety of the personnel of the Agency, the protection of its institutions and the safeguarding of the security of its facilities in the Occupied Palestinian Territory, including East Jerusalem, at all times;",
    "37": "Urges the Government of Israel to expeditiously reimburse the Agency for all transit charges incurred and other financial losses sustained as a result of the delays and restrictions on movement and access imposed by Israel;",
    "38": "Calls upon Israel particularly to cease obstructing the movement and access of the staff, vehicles and supplies of the Agency and to cease levying taxes, extra fees and charges, which affect the Agency\u2019s operations detrimentally;",
    "39": "Reiterates its call upon Israel to fully lift the restrictions impeding or delaying the import of necessary construction materials and supplies for the reconstruction and repair of the remaining damaged or destroyed refugee shelters, and for the implementation of suspended and urgently needed civilian infrastructure projects in refugee camps in the Gaza Strip, noting the alarming figures reflected in the United Nations country team reports of 26 August 2016, entitled \u201cGaza: two years after\u201d, and of July 2017, entitled \u201cGaza ten years later\u201d;",
    "40": "Notes with appreciation the positive contribution of the Agency\u2019s microfinance and job creation programmes, encourages efforts to enhance the sustainability and benefits of microfinance services to a greater number of Palestine refugees, especially in view of the high unemployment rates affecting them, and youth in particular, welcomes the Agency\u2019s efforts to streamline costs and increase microfinance services through internal reform efforts, and calls upon the Agency, in close cooperation with the relevant agencies, to continue to contribute to the development of the economic and social stability of the Palestine refugees in all fields of operation;",
    "41": "Reiterates its appeals to all States, the specialized agencies, and intergovernmental and non-governmental organizations to continue and to augment their contributions to the programme budget of the Agency, to increase their special allocations for grants and scholarships for higher education to Palestine refugees and to contribute to the establishment of vocational training centres for Palestine refugees, and requests the Agency to act as the recipient and trustee for the special allocations for grants and scholarships; Operations of the United Nations Relief and Works Agency for Palestine Refugees in the Near East A/RES/75/94 11/11 20-16925",
    "42": "Calls upon the Commissioner-General to include, in the annual reporting to the General Assembly, assessments on the progress made to remedy the recurrent funding shortfalls of the Agency and ensure sustained, sufficient and predictable support for the Agency\u2019s operations, including through the implementation of the relevant provisions of the present resolution. 41st plenary meeting 10 December 2020"
  },
  "agenda_items": [
    "Item 52"
  ],
  "symbol_references": []
}