{
  "symbol": "A/RES/78/163",
  "filename": "A_RES_78_163.pdf",
  "title": "78/163. Follow-up to the Second United Nations Conference on Landlocked Developing Countries",
  "text": "United Nations \nA/RES/78/163\n \n \nGeneral Assembly \nDistr.: General \n21 December 2023 \n \n23-25887 (E)    030124 \n*2325887* \n \n \nSeventy-eighth session \nAgenda item 20 (b) \nGroups of countries in special situations: follow-up to the \nsecond United Nations Conference on Landlocked \nDeveloping Countries  \n \n \n \n \n Resolution adopted by the General Assembly \non 19 December 2023 \n \n \n \n \n[on the report of the Second Committee (A/78/463/Add.2, para. 7)] \n \n \n 78/163. Follow-up to the Second United Nations Conference on \nLandlocked Developing Countries \n \n \n \nThe General Assembly,  \n \nRecalling the Vienna Declaration,1 the Vienna Programme of Action for Landlocked \nDeveloping Countries for the Decade 2014\u201320242 and the Political Declaration of the \nHigh-level Midterm Review on the Implementation of the Vienna Programme of Action \nfor Landlocked Developing Countries for the Decade 2014\u2013 2024,3 \n \nReaffirming the overarching goal of the Vienna Programme of Action of \naddressing the special development needs and challenges of landlocked developing \ncountries arising from their landlockedness, remoteness and geographical constraints \nin a more coherent manner and thus contributing to an enhanced rate of sustainable \nand inclusive growth, which can contribute to the eradication of poverty in all its \nforms and dimensions, including extreme poverty, \n \nRecalling its resolutions 71/239 of 21 December 2016, 72/232 of 20 December \n2017, 73/243 of 20 December 2018, 74/233 of 19 December 2019 and 75/228 of \n21 December 2020, \n \nRecalling also its resolution 76/217 of 17 December 2021, in which the General \nAssembly decided to convene the third United Nations Conference on Landlocked \nDeveloping Countries, in 2024, its resolution 77/246 of 30 December 2022, in which \nit outlined modalities for the third United Nations Conference on Landlocked \nDeveloping Countries, and its resolution 77/329 of 25 August 2023 on further \n__________________ \n \n1  Resolution 69/137, annex I. \n \n2  Ibid., annex II. \n \n3  Resolution 74/15. \n\nA/RES/78/163 \nFollow-up to the Second United Nations Conference on \nLandlocked Developing Countries\n \n23-25887\n2/12 \n \nmodalities of the third United Nations Conference on Landlocked Developing \nCountries, \n \nNoting with great concern the severe negative impact on human health, safety \nand well-being caused by the coronavirus disease (COVID-19) pandemic, as well as \nthe severe disruption to societies and economies and the devastating impact on lives \nand livelihoods, and that the poorest and most vulnerable are the hardest hit by the \npandemic, reaffirming the ambition to get back on track to achieve the Sustainable \nDevelopment Goals by designing and implementing sustainable and inclusive recovery \nstrategies to accelerate progress towards the full implementation of the 2030 Agenda \nfor Sustainable Development and to help to reduce the risk of and build resilience to \nfuture shocks, crises and pandemics, including by strengthening health systems and \nachieving universal health coverage, and recognizing that equitable and timely access \nfor all to safe, quality, effective and affordable COVID-19 vaccines, therapeutics and \ndiagnostics are an essential part of a global response based on unity, solidarity, renewed \nmultilateral cooperation and the principle of leaving no one behind, \n \nReaffirming its resolution 70/1 of 25 September 2015, entitled \u201cTransforming \nour world: the 2030 Agenda for Sustainable Development\u201d, in which it adopted a \ncomprehensive, far-reaching and people-centred set of universal and transformative \nSustainable Development Goals and targets, its commitment to working tirelessly for \nthe full implementation of the Agenda by 2030, its recognition that eradicating \npoverty in all its forms and dimensions, including extreme poverty, is the greatest \nglobal challenge and an indispensable requirement for sustainable development, its \ncommitment to achieving sustainable development in its three dimensions \u2013 \neconomic, social and environmental \u2013 in a balanced and integrated manner, and to \nbuilding upon the achievements of the Millennium Development Goals and seeking \nto address their unfinished business, \n \nReaffirming also its resolution 69/313 of 27 July 2015 on the Addis Ababa \nAction Agenda of the Third International Conference on Financing for Development, \nwhich is an integral part of the 2030 Agenda for Sustainable Development, supports \nand complements it, helps to contextualize its means of implementation targets with \nconcrete policies and actions, and reaffirms the strong political commitment to \naddress the challenge of financing and creating an enabling environment at all levels \nfor sustainable development in the spirit of global partnership and solidarity, \n \nReaffirming further the Paris Agreement4and its early entry into force, encouraging \nall its parties to fully implement the Agreement, and parties to the United Nations \nFramework Convention on Climate Change5 that have not yet done so to deposit their \ninstruments of ratification, acceptance, approval or accession, where appropriate, as \nsoon as possible, \n \nRecalling the Sendai Declaration and the Sendai Framework for Disaster Risk \nReduction 2015\u201320306 and the political declaration of the high-level meeting on the \nmidterm review of the Sendai Framework for Disaster Risk Reduction 2015\u20132030, \nheld in New York on 18 and 19 May 2023, 7  while recognizing that landlocked \ndeveloping countries face some specific disaster risk challenges, and reiterating the \ncommitment to addressing disaster risk reduction and building resilience to disasters \nwithin the context of sustainable development and poverty eradication,  \n \nReaffirming the New Urban Agenda, adopted at the United Nations Conference \non Housing and Sustainable Urban Development (Habitat III), held in Quito from 17 to \n__________________ \n \n4  Adopted under the UNFCCC in FCCC/CP/2015/10/Add.1, decision 1/CP.21. \n \n5  United Nations, Treaty Series, vol. 1771, No. 30822. \n \n6  Resolution 69/283, annexes I and II. \n \n7  Resolution 77/289, annex. \n\nFollow-up to the Second United Nations Conference on \nLandlocked Developing Countries \nA/RES/78/163\n \n3/12\n23-25887 \n \n20 October 2016,8 and recognizing the importance of sustainable urban development \nfor landlocked developing countries, \n \nWelcoming the Doha Political Declaration,9 and reaffirming the Doha Programme \nof Action for the Least Developed Countries,10 which represents a new generation of \nrenewed and strengthened commitments between the least developed countries and \ntheir development partners, including the private sector, civil society and governments \nat all levels, cognizant that many landlocked developing countries belong to the least \ndeveloped country category, \n \nLooking forward to the fourth International Conference on Small Island \nDeveloping States, to take place in Antigua and Barbuda from 27 to 30 May 2024 \nunder the overarching theme \u201cCharting the course towards resilient prosperity\u201d, \n \nRecognizing that the lack of territorial access to the sea, aggravated by \nremoteness from world markets and high transit costs and risks, continues to pose \nserious constraints on the overall growth and socioeconomic development of \nlandlocked developing countries, \n \nRecognizing also the importance of unfettered, efficient and cost-effective \naccess for landlocked developing countries to and from the sea, on the basis of \nfreedom of transit and other related matters, in accordance with the applicable rules \nof international law, \n \nAcknowledging the importance of promoting collaboration between landlocked \ndeveloping countries and transit countries on the basis of common interest, and noting \nthat collaboration efforts need to be supported by an enabling international economic \nenvironment, taking into account different national realities, capacities and levels of \ndevelopment and respecting national priorities, while remaining consistent with \ninternational rules and commitments, \n \nRecognizing the transport infrastructure gap in landlocked developing countries \nand the need to bring the level of transport infrastructure up to global standards and, \nin this regard, the crucial importance of strong national and international partnerships \nto bridging the gap and enhancing existing transport infrastructure facilities, \n \nAcknowledging the need to promote meaningful regional integration to \nencompass cooperation among countries for the implementation of the Vienna \nProgramme of Action, \n \nRecognizing that it is important for all countries, including landlocked \ndeveloping countries, to commit to a world in which all women and girls enjoy full \ngender equality with all men and boys and all legal, social and economic barriers to \ntheir empowerment and equality have been removed, \n \nTaking note of the declaration of the twenty-second annual Ministerial Meeting \nof Landlocked Developing Countries, which was held at United Nations Headquarters \non 21 September 2023 on the theme \u201cFrom Vienna to Kigali: building momentum \ntowards a new decade of action for prosperity and transformation of landlocked \ndeveloping countries\u201d,  \n \nNoting with great concern that the last half of the implementation period of the \nVienna Programme of Action was marked by the devastating impacts of the \nCOVID-19 pandemic, which stalled or reversed socioeconomic development gains \nthat had been achieved by landlocked developing countries, and that the fragile \nrecovery from the COVID-19 pandemic has been further disturbed by the challenging \n__________________ \n \n8  Resolution 71/256, annex. \n \n9  A/CONF.219/2023/L.1. \n \n10  Resolution 76/258, annex. \n\nA/RES/78/163 \nFollow-up to the Second United Nations Conference on \nLandlocked Developing Countries\n \n23-25887\n4/12 \n \nglobal macroeconomic conditions, resulting in the exacerbation of their structural and \ngeographical vulnerabilities, and concerned also that the modest recovery is \ninsufficient to reverse the increase in poverty owing to the COVID-19 pandemic,  \n \nRecognizing that the disruption in trade logistics that hampered global value \nchains and the high cost of global supply chains led to an increase in landlocked \ndeveloping countries\u2019 trade costs due to their vulnerability and high dependence on \ntransit countries to access international markets,  \n \nRecognizing also that the Vienna Programme of Action, which is integral to the \n2030 Agenda, is based on renewed and strengthened partnerships for supporting \nlandlocked developing countries in harnessing benefits from international trade, \nstructurally transforming their economies and achieving more inclusive and \nsustainable growth, \n \nWelcoming the convening of the High-level Dialogue on Financing for \nDevelopment in New York on 20 September 2023, \n \nWelcoming also the convening of the United Nations Conference on the Midterm \nComprehensive Review of the Implementation of the Objectives of the International \nDecade for Action, \u201cWater for Sustainable Development\u201d, 2018\u20132028, in New York \nfrom 22 to 24 March 2023, \n \nTaking note of the Joint Inspection Unit review 11  of United Nations system \nsupport for landlocked developing countries to implement the Vienna Programme of \nAction, in which concern was expressed about the vast gaps between the expectations \nfrom the work of the Office of the High Representative for the Least Developed \nCountries, Landlocked Developing Countries and Small Island Developing States to \ndeliver and the existing resources of the subprogramme on landlocked developing \ncountries, \n \nReaffirming the recognition of the special needs and challenges of landlocked \ndeveloping countries in the 2030 Agenda and in the Addis Ababa Action Agenda, and \naffirming further that their effective implementation, together with the \nimplementation of the six priority areas of the Vienna Programme of Action, which \nbuilds upon the Almaty Programme of Action: Addressing the Special Needs of \nLandlocked Developing Countries within a New Global Framework for Transit \nTransport Cooperation for Landlocked and Transit Developing Countries, 12 can drive \nthe social and economic progress of landlocked developing countries and assist in \ntheir transformation from landlocked to land-linked countries,  \n \n1. \nTakes note of the report of the Secretary-General on the implementation of \nthe Vienna Programme of Action for Landlocked Developing Countries for the \nDecade 2014\u20132024;13 \n \n2. \nRecalls the convening of the comprehensive high-level midterm review of \nthe implementation of the Vienna Programme of Action for Landlocked Developing \nCountries for the Decade 2014\u20132024 in New York on 5 and 6 December 2019 and the \nhigh-level Political Declaration, in which all the relevant stakeholders are called upon \nto commit to the accelerated implementation of the Vienna Programme of Action; \n__________________ \n \n11  JIU/REP/2021/2. \n \n12  Report of the International Ministerial Conference of Landlocked and Transit Developing \nCountries and Donor Countries and International Financial and Development Institutions on \nTransit Transport Cooperation, Almaty, Kazakhstan, 28 and 29 August 2003 (A/CONF.202/3), \nannex I. \n \n13  A/78/283. \n\nFollow-up to the Second United Nations Conference on \nLandlocked Developing Countries \nA/RES/78/163\n \n5/12\n23-25887 \n \n \n3. \nUnderlines the need to give particular attention to the concerns and \nspecific challenges of landlocked developing countries in all relevant major United \nNations conferences and processes; \n \n4. \nRecognizes that slow global economic growth, rising inflation and interest \nrates, geopolitical tensions and conflicts, supply chain disruptions, rising food prices \nand the energy crisis and the exacerbating impacts of climate change are all \ncompounding \nlandlocked \ndeveloping \ncountries\u2019 \ntrade- \nand \ntransit-related \nvulnerabilities; \n \n5. \nCalls upon States to ensure the normal functioning of open markets, global \nsupply chain connectivity and cross-border travel for essential purposes, and to \nenhance the sustainability and resilience of supply chains that foster the sustainable \nintegration of landlocked developing countries and promote inclusive economic \ngrowth, including through the increased participation of micro-, small and medium-\nsized enterprises in international trade and investment; \n \n6. \nRecognizes that the landlocked developing countries\u2019 share in global \nmerchandise \nexports \nhas \nremained \nsubstantially \nunchanged \nduring \nthe \nimplementation period of the Vienna Programme of Action, and calls for the \nstrengthening of the trade and productive capacities of the landlocked developing \ncountries, by enhancing aid for trade as well as market access towards landlocked \ndeveloping countries; \n \n7. \nReaffirms the commitment at the very heart of the 2030 Agenda for \nSustainable Development 14  to leave no one behind and commit to taking more \ntangible steps to support people in vulnerable situations and the most vulnerable \ncountries and to reach the furthest behind first; \n \n8. \nWelcomes the political declaration adopted by the high-level political \nforum on sustainable development 15 convened under the auspices of the General \nAssembly, held in New York on 18 and 19 September 2023, and urges timely action \nto ensure its full implementation; \n \n9. \nCalls upon the landlocked developing countries and transit countries to \nenhance cross-border collaboration by minimizing disruptions to international \ntransport during health emergencies such as the COVID-19 pandemic and to prevent \nfuture disruptions of a similar nature, while recognizing that regional economic \nintegration is an important driver for sustainable development and integration into the \nglobal economy, and invites development partners and relevant international, regional \nand subregional organizations to enhance support to landlocked developing countries \nand transit countries in implementing the relevant international trade and transport \nfacilitation conventions;16 \n \n10. Encourages the landlocked developing countries, transit countries and \ndevelopment partners to actively engage in the dedicated session on transit issues that \nwill be held annually until the next review of the Trade Facilitation Agreement is \ncompleted, pursuant to the decision taken at the twelfth Ministerial Conference of the \nWorld Trade Organization, held in Geneva from 12 to 17 June 2022, which will \n__________________ \n \n14  Resolution 70/1. \n \n15  Resolution 78/1, annex. \n \n16  Including the Customs Convention on Containers (Geneva, 2 December 1972), the Customs \nConvention on the Temporary Importation of Commercial Road Vehicles (Geneva, 18 May \n1956), the Customs Convention on the International Transport of Goods under Cover of TIR \nCarnets (Geneva, 14 November 1975), the International Convention on the Harmonization of \nFrontier Controls of Goods (Geneva, 21 October 1982) and the World Trade Organization \nAgreement on Trade Facilitation (2013). \n\nA/RES/78/163 \nFollow-up to the Second United Nations Conference on \nLandlocked Developing Countries\n \n23-25887\n6/12 \n \ncontribute to enhancing reforms aimed at facilitating transit for landlocked \ndeveloping countries; \n \n11. Invites the landlocked developing countries, transit countries, their \ndevelopment partners, the United Nations system and all other actors to implement \nthe relevant actions, consistent with national priorities, agreed upon in the Vienna \nProgramme of Action in its six priority areas in a coordinated, coherent and \nexpeditious manner in the remaining period; \n \n12. Reiterates the commitment to enhancing global, regional, national and \nlocal partnerships for sustainable development in landlocked developing countries, \nengaging all relevant stakeholders, including civil society, the private sector, academia \nand youth, recognizing the important contribution they can make towards achieving the \n2030 Agenda, and the localization of the Sustainable Development Goals, and also \nreaffirms the importance of the original dimension of sustainable development in \naddressing regional challenges and scaling up actions among countries; \n \n13. Stresses that the harmonization, simplification and standardization of rules \nand documentation should be promoted, including the full and effective \nimplementation of international conventions on transport and transit and bilateral, \nsubregional and regional agreements, and invites Member States that have not joined \nthe existing conventions to consider the possibility of accession; \n \n14. Also stresses that cooperation on fundamental transit policies, laws and \nregulations between landlocked developing countries and their transit neighbours is \ncrucial for the effective and integrated solution of cross-border trade and transit \ntransport problems, and underlines that this cooperation should be promoted on the \nbasis of the mutual interests of both landlocked developing countries and transit \ncountries; \n \n15. Calls upon the landlocked developing countries and transit countries, in a \ncoordinated manner, to develop and upgrade international transport and transit \ncorridors encompassing all modes of transportation, including roads, railroads, inland \nwaterways, ports and pipelines, to address the special development needs and \nchallenges of landlocked developing countries;  \n \n16. Recognizes that investing in the maintenance and development of hard and \nsoft infrastructure can boost pandemic recovery efforts, notes the importance of sound \ninfrastructure governance over the life cycle of the projects to ensure the long-term \ncost-effectiveness, economic efficiency, accountability, transparency and integrity of \ninfrastructure investment, including through an open procurement process, stresses \nthat the magnitude of the resources required to invest in quality, reliable, sustainable \nand resilient infrastructure development and maintenance remains a major challenge \nthat requires the forging of international, regional, subregional and bilateral \ncooperation on infrastructure projects, the allocation of more resources from national \nbudgets, the effective deployment of international development assistance and \nmultilateral financing in the development and maintenance of infrastructure and the \nreinforcement of the role of the private sector; \n \n17. Also recognizes that both public and private investment have key roles to \nplay in sustainable infrastructure financing, including through development banks, \ndevelopment finance institutions and tools and mechanisms such as public-private \npartnerships, blended finance, which combines concessional public finance, \nnon-concessional private finance and expertise from the public and private sector, \nspecial purpose vehicles, non-recourse project financing, risk mitigation instruments \nand pooled financing structures; \n \n18. Encourages multilateral financial and development institutions and \nmultilateral development banks, including regional banks, in collaboration with other \n\nFollow-up to the Second United Nations Conference on \nLandlocked Developing Countries \nA/RES/78/163\n \n7/12\n23-25887 \n \nstakeholders, including the private sector, to make investments in landlocked \ndeveloping countries to increase access to affordable, reliable, sustainable and \nmodern energy, as well as in addressing gaps in renewable energy, information and \ncommunications technology, e-commerce, trade, transport and transit-related regional \ninfrastructure; \n \n19. Calls for the full and timely implementation of the Agreement on Trade \nFacilitation annexed to the Protocol amending the Marrakesh Agreement Establishing \nthe World Trade Organization, and in this regard urges members and relevant \ninternational and regional organizations to continue to provide and enhance technical \nand capacity-building assistance, particularly for the effective implementation of the \nprovisions of articles on the release and clearance of goods, border agency \ncooperation, formalities connected with importation, exportation and transit, freedom \nof transit and customs cooperation; \n \n20. Also calls for renewed and strengthened partnerships to support \nlandlocked developing countries in diversifying their economic base and enhancing \nvalue addition to their exports in order to eradicate poverty and achieve sustainable, \ninclusive and sustained economic growth; \n \n21. Reiterates its invitation to development partners to provide targeted \ntechnical and financial support, as appropriate, towards the implementation of the \nspecific actions listed in the Vienna Programme of Action; \n \n22. Underlines that South-South and triangular cooperation is vital to the \nlandlocked developing countries, especially in the areas of productive capacity-\nbuilding and training, infrastructure, energy, water, science and technology, trade, \ninvestment and transit transport cooperation, and its significant contributions to short-\nterm pandemic response and long-term COVID-19 recovery, and in this regard \nhighlights the importance of the implementation of the Buenos Aires outcome \ndocument of the second High-level United Nations Conference on South-South \nCooperation;17 \n \n23. Recognizes that landlocked developing countries and their transit country \nneighbours need to effectively mobilize adequate domestic and external resources for \nthe effective implementation of the Vienna Programme of Action, reaffirms that, for \nall countries, public policies and the mobilization and effective use of domestic \nresources, underlined by the principle of national ownership, are central to the \ncommon pursuit of sustainable development, including the implementation of the \nProgramme of Action, and also recognizes that international public finance plays an \nimportant role in complementing those efforts, especially in the poorest and most \nvulnerable countries with limited domestic resources; \n \n24. Also recognizes the constraints faced by landlocked developing countries \nin gaining access to sustainable investment, and stresses the need to strengthen \ncapacity-building support for these countries, to integrate sustainable investment \napproaches into capital market development plans; \n \n25. Underlines the prominent role that foreign direct investment plays in \naccelerating development and poverty reduction through employment, the transfer of \nmanagerial and technological know-how, on mutually agreed terms, and non-debt-\ncreating flows of capital, recognizes the considerable role and potential of private \nsector involvement in infrastructure development for transport, telecommunications \nand utilities for landlocked developing countries, encourages Member States to \nfacilitate foreign direct investment flows to landlocked developing countries in this \nregard, and calls upon landlocked and transit developing countries to promote an \n__________________ \n \n17  Resolution 73/291, annex. \n\nA/RES/78/163 \nFollow-up to the Second United Nations Conference on \nLandlocked Developing Countries\n \n23-25887\n8/12 \n \nenabling environment, to attract foreign direct investment and private sector \ninvolvement; \n \n26. Reiterates that the fulfilment of all official development assistance \ncommitments remains crucial, and urges development partners to step up efforts to \nincrease their official development assistance and to make additional concrete efforts \nto fulfil their respective official development assistance commitments;  \n \n27. Recognizes the essential role of the private sector in the development of \nlandlocked developing countries, and in this regard underlines the need to continue \npromoting the participation of the private sector in achieving sustainable development \nand the critical importance of mobilizing private resources, including through foreign \ndirect investment, for the development of landlocked developing countries, taking \ninto account the leading role of Member States in the implementation of the 2030 \nAgenda, the Addis Ababa Action Agenda of the Third International Conference on \nFinancing for Development18 and the Vienna Programme of Action; \n \n28. Also recognizes that the economies of many landlocked developing \ncountries remain reliant on a few export commodities, which often have low value \naddition and are greatly affected by external shocks, and stresses the need for renewed \nand strengthened partnerships for development to support landlocked developing \ncountries in diversifying their economic base and enhancing value addition to their \nexports by entering and moving up global value chains through the development of \ntheir productive capacities, including through private sector involvement, and the \ndevelopment and formalization of small and medium-sized enterprises, with a view \nto increasing the competitiveness of the products of landlocked developing countries \nin export markets; \n \n29. Further recognizes that foreign direct investment can reduce inequalities \nand help commodity-dependent landlocked developing countries to make the \ntransition to manufacturing activities and other higher value-added activities; \n \n30. Recognizes the crucial role of micro-, small and medium-sized enterprises \nin contributing to inclusive growth and achievement of the Sustainable Development \nGoals through job creation and improving livelihoods for the poorest and most \nvulnerable, and in promoting support measures to develop micro-, small and medium-\nsized enterprises in landlocked developing countries, including their formalization \nand participation in international trade; \n \n31. Stresses the need to assist landlocked developing countries in attaining \nlong-term debt sustainability through coordinated policies aimed at fostering debt \nrelief and debt restructuring and sound debt management, as appropriate, and \nwelcomes the multilateral response to the pandemic, including the Group of 20 and \nParis Club Debt Service Suspension Initiative, which ended in December 2021, and \nthe Common Framework for Debt Treatments beyond the Debt Service Suspension \nInitiative; \n \n32. Invites development partners to effectively implement the Aid for Trade \ninitiative in assisting landlocked developing countries to address their special needs \nand requirements, including capacity-building for the formulation of trade policies, \nparticipation in trade negotiations and the implementation of trade facilitation \nmeasures, as well as the diversification of export products; \n \n33. Recognizes that landlocked developing countries are vulnerable to and \nremain negatively affected by the adverse impacts of climate change, land \ndegradation, desertification, deforestation, receding glaciers, floods, including glacial \nlake outburst floods, and droughts, recognizes the potential benefits of mutually \n__________________ \n \n18  Resolution 69/313, annex. \n\nFollow-up to the Second United Nations Conference on \nLandlocked Developing Countries \nA/RES/78/163\n \n9/12\n23-25887 \n \naddressing these challenges, and calls upon the international community to continue \nto support the efforts of landlocked developing countries towards climate change \nmitigation, adaptation and resilience-building; \n \n34. Takes note of scientific research undertaken by the International Think \nTank for Landlocked Developing Countries, encourages the International Think Tank \nto continue to undertake its role of supporting the development efforts of the \nlandlocked developing countries, urges those landlocked developing countries that \nhave not yet done so to ratify, at their earliest convenience, the Multilateral \nAgreement for the Establishment of an International Think Tank for Landlocked \nDeveloping Countries, and invites relevant stakeholders to support the International \nThink Tank; \n \n35. Urges that coherent and effective linkages be made between the \nimplementation, follow-up and review arrangements for the 2030 Agenda and those \nof all relevant United Nations conferences and processes, including the Vienna \nProgramme of Action; \n \n36. Calls upon relevant organizations and bodies of the United Nations \nsystem, and invites international organizations and relevant regional and subregional \norganizations, to integrate the Vienna Programme of Action into their programmes of \nwork, as appropriate, within their respective mandates, and to support landlocked and \ntransit developing countries in their implementation of the Programme of Action in a \nwell-coordinated and coherent manner; \n \n37. Stresses that, in accordance with the mandate given by the General \nAssembly, the Office of the High Representative for the Least Developed Countries, \nLandlocked Developing Countries and Small Island Developing States should \ncontinue to ensure the coordinated follow-up to, effective monitoring of and reporting \non the implementation of the Vienna Programme of Action and the outcome of its \nmidterm review and undertake advocacy efforts at the national, regional and global \nlevels; \n \n38. Recalls its resolution 77/329, in which the General Assembly decided that \nthe third United Nations Conference on Landlocked Developing Countries would be \nheld in Kigali for a duration of four days, from 18 to 21 June 2024, and called upon \nall States Members of the United Nations and members of specialized agencies, in \nparticular landlocked and transit developing countries and donor countries, as well as \nthe United Nations system and international and regional organizations and other \nrelevant stakeholders, to participate actively in the Conference at the highest level \npossible, and looks forward to its successful conclusion and an ambitious outcome \nwith concrete targets and specific deliverables; \n \n39. Decides that the theme of the third United Nations Conference on \nLandlocked Developing Countries shall be \u201cDriving partnerships for progress\u201d; \n \n40. Expresses its appreciation to the Government of Rwanda as host of the \nthird United Nations Conference on Landlocked Developing Countries, in Kigali, to \nbe held at the highest possible level, including Heads of State and Government, in \nline with the mandate specified in its resolutions 76/217, 77/246 and 77/329; \n \n41. Welcomes the establishment of the Bureau of the intergovernmental \npreparatory committee and the appointment of its Co-Chairs, and recalls its decision \nto convene the first and second sessions of the preparatory committee in New York, \nfrom 5 to 8 February 2024 and from 29 April to 1 May 2024, respectively; \n \n42. Invites the Bureau to convene further meetings on an informal basis in \nNew York, as required and in the most efficient and effective manner, to discuss the \ndraft outcome document of the Conference;  \n\nA/RES/78/163 \nFollow-up to the Second United Nations Conference on \nLandlocked Developing Countries\n \n23-25887\n10/12 \n \n \n43. Takes note of the substantive and organizational preparations for the \nConference, including the successful holding of the organizational session of the \nintergovernmental preparatory committee in New York, on 13 September 2023, and \nthe three regional review meetings, with one meeting for the landlocked developing \ncountries in Africa, jointly organized by the Government of Botswana, the Office of \nthe High Representative for the Least Developed Countries, Landlocked Developing \nCountries and Small Island Developing States and the Economic Commission for \nAfrica, held in Gaborone on 29 and 30 May 2023, one meeting for the landlocked \ndeveloping countries in Latin America, jointly organized by the Government of \nParaguay, the Office of the High Representative and the Economic Commission for \nLatin America and the Caribbean, held in Asunci\u00f3n on 27 and 28 July 2023, and one \nmeeting for the landlocked developing countries in Europe and Asia, jointly organized \nby the Office of the High Representative, the Economic and Social Commission for \nAsia and the Pacific and the Economic Commission for Europe, held in Bangkok on \n22 and 23 August 2023, and also takes note of the outcomes of those meetings; \n \n44. Emphasizes the importance of country-level preparations as a critical input \nto the preparatory process for the Conference and in the implementation of and \nfollow-up to its outcome, and calls upon the Governments of the landlocked \ndeveloping countries to submit their reports in a timely manner; \n \n45. Requests the Secretary-General to ensure, as appropriate, the full \ninvolvement of resident coordinators and country teams in the preparations for the \nConference, in particular in the country level and regional preparations; \n \n46. Stresses that the Conference and the preparatory activities should be \norganized and carried out in the most effective and efficient manner possible; \n \n47. Encourages the active participation of all States Members of the United \nNations, in particular landlocked and transit developing countries and donor \ncountries, as well as of the United Nations system and international and regional \norganizations, in the Conference at the highest level possible; \n \n48. Calls upon all stakeholders, while reviewing implementation of the Vienna \nProgramme of Action, to identify innovative solutions and initiatives that can be \nlaunched as key deliverables at the Conference; \n \n49. Reiterates its invitation to the Secretary-General to convene a high-level \nevent of the United Nations system and other relevant international and regional \norganizations during the Conference, with a view to ensuring the full mobilization of \nthe United Nations system in support of the landlocked developing countries; \n \n50. Welcomes the holding by the President of the General Assembly and the \nPresident of the Economic and Social Council of a half-day dedicated thematic event \non 7 December 2023 to provide substantive input to the Conference; \n \n51. Stresses, while recognizing the intergovernmental nature of the \nConference, the importance of the effective, well-structured and broad participation \nof all relevant stakeholders, including parliamentarians, civil society and the private \nsector, in the Conference and its preparatory process, including national and regional \nreviews and thematic preparations, as well as in the interactive thematic round tables \nand side events during the Conference, underlines that intergovernmental mechanisms \nat the global and regional levels, including those of the United Nations regional \ncommissions, as well as relevant substantive material and statistical data, should be \neffectively utilized in the review process, and decides:  \n \n(a) \nTo invite non-governmental organizations that are in consultative status \nwith the Economic and Social Council to register with the Secretariat in order to \nparticipate in the Conference and its preparatory process;  \n\nFollow-up to the Second United Nations Conference on \nLandlocked Developing Countries \nA/RES/78/163\n \n11/12\n23-25887 \n \n \n(b) \nTo invite other relevant stakeholders, including organizations and bodies \nof the United Nations system, international financial institutions, civil society \norganizations, \nthe \nprivate \nsector, \nother \ninternational \nbodies \nand \nother \nnon-governmental organizations, to participate as observers in the Conference and its \npreparatory process;  \n \n(c) \nTo request the President of the General Assembly to draw up a list of \nrepresentatives of other relevant non-governmental organizations, civil society \norganizations, academic institutions and the private sector who may participate in the \nConference and its preparatory process, taking into account the principles of \ntransparency and of equitable geographical representation and with due regard for \ngender parity, and to submit the proposed list to Member States for their consideration \non a non-objection basis and bring the list to the attention of the Assembly for a final \ndecision by the Assembly on participation in the Conference;19 \n \n52. Recalls its request to the Office of the High Representative to act as the \nUnited Nations system-wide focal point for the preparations for the third United \nNations Conference on Landlocked Developing Countries, pursuant to resolution \n76/217, and reiterates its invitation to the Secretary-General to take the measures \nnecessary to ensure effective, efficient and timely preparations for the Conference \nand to further mobilize and coordinate the active involvement of the organizations of \nthe United Nations system; \n \n53. Emphasizes the critical importance of the full and effective participation \nof the landlocked developing countries in the Conference and its preparatory process \nat the national, regional and global levels, stresses that adequate resources should be \nprovided, and in this regard requests the Secretary-General to mobilize voluntary \ncontributions in order to support the cost of the participation of government \nrepresentatives from the landlocked developing countries; \n \n54. Requests the Secretary-General to ensure that necessary and sufficient \nsupport is given to transit countries to maximize their contribution to the success of \nthe Conference and its preparatory process; \n \n55. Requests the Secretary-General, with the assistance of relevant \norganizations and bodies of the United Nations system, including the Department of \nGlobal Communications of the Secretariat, in collaboration and avoiding overlap and \nduplication with the Office of the High Representative, to take the measures necessary \nto intensify their public information efforts and other appropriate initiatives to \nenhance public awareness of the Conference, including by highlighting its objectives \nand its significance; \n \n56. Welcomes the decision of the Secretary-General to appoint the Under-\nSecretary-General and High Representative for the Least Developed Countries, \nLandlocked Developing Countries and Small Island Developing States as Secretary-\nGeneral of the Conference, with responsibility for making the arrangements necessary \nfor carrying out the work of the Conference; \n \n57. Reaffirms the important role of the Group of Friends of Landlocked \nDeveloping Countries, and calls for their active participation and support in the \npreparation for the Conference and at the Conference itself; \n \n58. Underlines that the Office of the High Representative should be provided \nwith adequate resources to fulfil its mandate for the timely and effective follow-up, \n__________________ \n \n19  The list will include proposed and final names. The general basis of any objections, if requested \nby one or more States Members of the United Nations or States members of the specialized \nagencies, will be made known to the Office of the President of the General Assembly and the \nrequester. \n\nA/RES/78/163 \nFollow-up to the Second United Nations Conference on \nLandlocked Developing Countries\n \n23-25887\n12/12 \n \nmonitoring and implementation of the Vienna Programme of Action and its successor \nand to extend effective support to the landlocked developing countries, and requests \nthe Secretary-General to address the allocation of adequate resources for the Office \nin the context of the proposed programme budget for 2025; \n \n59. Requests \nGovernments, \nintergovernmental \nand \nnon-governmental \norganizations, major groups and other donors to contribute in a timely manner to the \ntrust fund in support of activities undertaken by the Office of the High Representative \nto support the implementation of, follow-up to and monitoring of the Vienna \nProgramme of Action, as well as the preparations for the third United Nations \nConference on Landlocked Developing Countries and the participation of landlocked \ndeveloping countries in the Conference; \n \n60. Requests the Secretary-General to submit to the General Assembly at its \nseventy-ninth session a report on the third United Nations Conference on Landlocked \nDeveloping Countries and decides to include in the provisional agenda of its seventy-\nninth session, under the item entitled \u201cGroups of countries in special situations\u201d, the \nsub-item entitled \u201cFollow-up to the third United Nations Conference on Landlocked \nDeveloping Countries\u201d. \n \n49th plenary meeting \n19 December 2023 \n \n",
  "paragraphs": {
    "1": "Takes note of the report of the Secretary-General on the implementation of the Vienna Programme of Action for Landlocked Developing Countries for the Decade 2014\u20132024;13",
    "2": "Recalls the convening of the comprehensive high-level midterm review of the implementation of the Vienna Programme of Action for Landlocked Developing Countries for the Decade 2014\u20132024 in New York on 5 and 6 December 2019 and the high-level Political Declaration, in which all the relevant stakeholders are called upon to commit to the accelerated implementation of the Vienna Programme of Action;",
    "3": "Underlines the need to give particular attention to the concerns and specific challenges of landlocked developing countries in all relevant major United Nations conferences and processes;",
    "4": "Recognizes that slow global economic growth, rising inflation and interest rates, geopolitical tensions and conflicts, supply chain disruptions, rising food prices and the energy crisis and the exacerbating impacts of climate change are all compounding landlocked developing countries\u2019 trade- and transit-related vulnerabilities;",
    "5": "Calls upon States to ensure the normal functioning of open markets, global supply chain connectivity and cross-border travel for essential purposes, and to enhance the sustainability and resilience of supply chains that foster the sustainable integration of landlocked developing countries and promote inclusive economic growth, including through the increased participation of micro-, small and medium- sized enterprises in international trade and investment;",
    "6": "Recognizes that the landlocked developing countries\u2019 share in global merchandise exports has remained substantially unchanged during the implementation period of the Vienna Programme of Action, and calls for the strengthening of the trade and productive capacities of the landlocked developing countries, by enhancing aid for trade as well as market access towards landlocked developing countries;",
    "7": "Reaffirms the commitment at the very heart of the 2030 Agenda for Sustainable Development 14 to leave no one behind and commit to taking more tangible steps to support people in vulnerable situations and the most vulnerable countries and to reach the furthest behind first;",
    "8": "Welcomes the political declaration adopted by the high-level political forum on sustainable development 15 convened under the auspices of the General Assembly, held in New York on 18 and 19 September 2023, and urges timely action to ensure its full implementation;",
    "9": "Calls upon the landlocked developing countries and transit countries to enhance cross-border collaboration by minimizing disruptions to international transport during health emergencies such as the COVID-19 pandemic and to prevent future disruptions of a similar nature, while recognizing that regional economic integration is an important driver for sustainable development and integration into the global economy, and invites development partners and relevant international, regional and subregional organizations to enhance support to landlocked developing countries and transit countries in implementing the relevant international trade and transport facilitation conventions;16",
    "10": "Encourages the landlocked developing countries, transit countries and development partners to actively engage in the dedicated session on transit issues that will be held annually until the next review of the Trade Facilitation Agreement is completed, pursuant to the decision taken at the twelfth Ministerial Conference of the World Trade Organization, held in Geneva from 12 to 17 June 2022, which will contribute to enhancing reforms aimed at facilitating transit for landlocked developing countries;",
    "11": "Invites the landlocked developing countries, transit countries, their development partners, the United Nations system and all other actors to implement the relevant actions, consistent with national priorities, agreed upon in the Vienna Programme of Action in its six priority areas in a coordinated, coherent and expeditious manner in the remaining period;",
    "12": "Reiterates the commitment to enhancing global, regional, national and local partnerships for sustainable development in landlocked developing countries, engaging all relevant stakeholders, including civil society, the private sector, academia and youth, recognizing the important contribution they can make towards achieving the 2030 Agenda, and the localization of the Sustainable Development Goals, and also reaffirms the importance of the original dimension of sustainable development in addressing regional challenges and scaling up actions among countries;",
    "13": "Stresses that the harmonization, simplification and standardization of rules and documentation should be promoted, including the full and effective implementation of international conventions on transport and transit and bilateral, subregional and regional agreements, and invites Member States that have not joined the existing conventions to consider the possibility of accession;",
    "14": "Also stresses that cooperation on fundamental transit policies, laws and regulations between landlocked developing countries and their transit neighbours is crucial for the effective and integrated solution of cross-border trade and transit transport problems, and underlines that this cooperation should be promoted on the basis of the mutual interests of both landlocked developing countries and transit countries;",
    "15": "Calls upon the landlocked developing countries and transit countries, in a coordinated manner, to develop and upgrade international transport and transit corridors encompassing all modes of transportation, including roads, railroads, inland waterways, ports and pipelines, to address the special development needs and challenges of landlocked developing countries;",
    "16": "Recognizes that investing in the maintenance and development of hard and soft infrastructure can boost pandemic recovery efforts, notes the importance of sound infrastructure governance over the life cycle of the projects to ensure the long-term cost-effectiveness, economic efficiency, accountability, transparency and integrity of infrastructure investment, including through an open procurement process, stresses that the magnitude of the resources required to invest in quality, reliable, sustainable and resilient infrastructure development and maintenance remains a major challenge that requires the forging of international, regional, subregional and bilateral cooperation on infrastructure projects, the allocation of more resources from national budgets, the effective deployment of international development assistance and multilateral financing in the development and maintenance of infrastructure and the reinforcement of the role of the private sector;",
    "17": "Also recognizes that both public and private investment have key roles to play in sustainable infrastructure financing, including through development banks, development finance institutions and tools and mechanisms such as public-private partnerships, blended finance, which combines concessional public finance, non-concessional private finance and expertise from the public and private sector, special purpose vehicles, non-recourse project financing, risk mitigation instruments and pooled financing structures;",
    "18": " stakeholders, including the private sector, to make investments in landlocked developing countries to increase access to affordable, reliable, sustainable and modern energy, as well as in addressing gaps in renewable energy, information and communications technology, e-commerce, trade, transport and transit-related regional infrastructure;",
    "19": "Calls for the full and timely implementation of the Agreement on Trade Facilitation annexed to the Protocol amending the Marrakesh Agreement Establishing the World Trade Organization, and in this regard urges members and relevant international and regional organizations to continue to provide and enhance technical and capacity-building assistance, particularly for the effective implementation of the provisions of articles on the release and clearance of goods, border agency cooperation, formalities connected with importation, exportation and transit, freedom of transit and customs cooperation;",
    "20": "Also calls for renewed and strengthened partnerships to support landlocked developing countries in diversifying their economic base and enhancing value addition to their exports in order to eradicate poverty and achieve sustainable, inclusive and sustained economic growth;",
    "21": "Reiterates its invitation to development partners to provide targeted technical and financial support, as appropriate, towards the implementation of the specific actions listed in the Vienna Programme of Action;",
    "22": "Underlines that South-South and triangular cooperation is vital to the landlocked developing countries, especially in the areas of productive capacity- building and training, infrastructure, energy, water, science and technology, trade, investment and transit transport cooperation, and its significant contributions to short- term pandemic response and long-term COVID-19 recovery, and in this regard highlights the importance of the implementation of the Buenos Aires outcome document of the second High-level United Nations Conference on South-South Cooperation;17",
    "23": "Recognizes that landlocked developing countries and their transit country neighbours need to effectively mobilize adequate domestic and external resources for the effective implementation of the Vienna Programme of Action, reaffirms that, for all countries, public policies and the mobilization and effective use of domestic resources, underlined by the principle of national ownership, are central to the common pursuit of sustainable development, including the implementation of the Programme of Action, and also recognizes that international public finance plays an important role in complementing those efforts, especially in the poorest and most vulnerable countries with limited domestic resources;",
    "24": "Also recognizes the constraints faced by landlocked developing countries in gaining access to sustainable investment, and stresses the need to strengthen capacity-building support for these countries, to integrate sustainable investment approaches into capital market development plans;",
    "25": "Underlines the prominent role that foreign direct investment plays in accelerating development and poverty reduction through employment, the transfer of managerial and technological know-how, on mutually agreed terms, and non-debt- creating flows of capital, recognizes the considerable role and potential of private sector involvement in infrastructure development for transport, telecommunications and utilities for landlocked developing countries, encourages Member States to facilitate foreign direct investment flows to landlocked developing countries in this regard, and calls upon landlocked and transit developing countries to promote an enabling environment, to attract foreign direct investment and private sector involvement;",
    "26": "Reiterates that the fulfilment of all official development assistance commitments remains crucial, and urges development partners to step up efforts to increase their official development assistance and to make additional concrete efforts to fulfil their respective official development assistance commitments;",
    "27": "Recognizes the essential role of the private sector in the development of landlocked developing countries, and in this regard underlines the need to continue promoting the participation of the private sector in achieving sustainable development and the critical importance of mobilizing private resources, including through foreign direct investment, for the development of landlocked developing countries, taking into account the leading role of Member States in the implementation of the 2030 Agenda, the Addis Ababa Action Agenda of the Third International Conference on Financing for Development18 and the Vienna Programme of Action;",
    "28": "Also recognizes that the economies of many landlocked developing countries remain reliant on a few export commodities, which often have low value addition and are greatly affected by external shocks, and stresses the need for renewed and strengthened partnerships for development to support landlocked developing countries in diversifying their economic base and enhancing value addition to their exports by entering and moving up global value chains through the development of their productive capacities, including through private sector involvement, and the development and formalization of small and medium-sized enterprises, with a view to increasing the competitiveness of the products of landlocked developing countries in export markets;",
    "29": "Further recognizes that foreign direct investment can reduce inequalities and help commodity-dependent landlocked developing countries to make the transition to manufacturing activities and other higher value-added activities;",
    "30": "Recognizes the crucial role of micro-, small and medium-sized enterprises in contributing to inclusive growth and achievement of the Sustainable Development Goals through job creation and improving livelihoods for the poorest and most vulnerable, and in promoting support measures to develop micro-, small and medium- sized enterprises in landlocked developing countries, including their formalization and participation in international trade;",
    "31": "Stresses the need to assist landlocked developing countries in attaining long-term debt sustainability through coordinated policies aimed at fostering debt relief and debt restructuring and sound debt management, as appropriate, and welcomes the multilateral response to the pandemic, including the Group of 20 and Paris Club Debt Service Suspension Initiative, which ended in December 2021, and the Common Framework for Debt Treatments beyond the Debt Service Suspension Initiative;",
    "32": "Invites development partners to effectively implement the Aid for Trade initiative in assisting landlocked developing countries to address their special needs and requirements, including capacity-building for the formulation of trade policies, participation in trade negotiations and the implementation of trade facilitation measures, as well as the diversification of export products;",
    "33": "Recognizes that landlocked developing countries are vulnerable to and remain negatively affected by the adverse impacts of climate change, land degradation, desertification, deforestation, receding glaciers, floods, including glacial lake outburst floods, and droughts, recognizes the potential benefits of mutually addressing these challenges, and calls upon the international community to continue to support the efforts of landlocked developing countries towards climate change mitigation, adaptation and resilience-building;",
    "34": "Takes note of scientific research undertaken by the International Think Tank for Landlocked Developing Countries, encourages the International Think Tank to continue to undertake its role of supporting the development efforts of the landlocked developing countries, urges those landlocked developing countries that have not yet done so to ratify, at their earliest convenience, the Multilateral Agreement for the Establishment of an International Think Tank for Landlocked Developing Countries, and invites relevant stakeholders to support the International Think Tank;",
    "35": "Urges that coherent and effective linkages be made between the implementation, follow-up and review arrangements for the 2030 Agenda and those of all relevant United Nations conferences and processes, including the Vienna Programme of Action;",
    "36": "Calls upon relevant organizations and bodies of the United Nations system, and invites international organizations and relevant regional and subregional organizations, to integrate the Vienna Programme of Action into their programmes of work, as appropriate, within their respective mandates, and to support landlocked and transit developing countries in their implementation of the Programme of Action in a well-coordinated and coherent manner;",
    "37": "Stresses that, in accordance with the mandate given by the General Assembly, the Office of the High Representative for the Least Developed Countries, Landlocked Developing Countries and Small Island Developing States should continue to ensure the coordinated follow-up to, effective monitoring of and reporting on the implementation of the Vienna Programme of Action and the outcome of its midterm review and undertake advocacy efforts at the national, regional and global levels;",
    "38": "Recalls its resolution 77/329, in which the General Assembly decided that the third United Nations Conference on Landlocked Developing Countries would be held in Kigali for a duration of four days, from 18 to 21 June 2024, and called upon all States Members of the United Nations and members of specialized agencies, in particular landlocked and transit developing countries and donor countries, as well as the United Nations system and international and regional organizations and other relevant stakeholders, to participate actively in the Conference at the highest level possible, and looks forward to its successful conclusion and an ambitious outcome with concrete targets and specific deliverables;",
    "39": "Decides that the theme of the third United Nations Conference on Landlocked Developing Countries shall be \u201cDriving partnerships for progress\u201d;",
    "40": "Expresses its appreciation to the Government of Rwanda as host of the third United Nations Conference on Landlocked Developing Countries, in Kigali, to be held at the highest possible level, including Heads of State and Government, in line with the mandate specified in its resolutions 76/217, 77/246 and 77/329;",
    "41": "Welcomes the establishment of the Bureau of the intergovernmental preparatory committee and the appointment of its Co-Chairs, and recalls its decision to convene the first and second sessions of the preparatory committee in New York, from 5 to 8 February 2024 and from 29 April to 1 May 2024, respectively;",
    "42": "",
    "43": "Takes note of the substantive and organizational preparations for the Conference, including the successful holding of the organizational session of the intergovernmental preparatory committee in New York, on 13 September 2023, and the three regional review meetings, with one meeting for the landlocked developing countries in Africa, jointly organized by the Government of Botswana, the Office of the High Representative for the Least Developed Countries, Landlocked Developing Countries and Small Island Developing States and the Economic Commission for Africa, held in Gaborone on 29 and 30 May 2023, one meeting for the landlocked developing countries in Latin America, jointly organized by the Government of Paraguay, the Office of the High Representative and the Economic Commission for Latin America and the Caribbean, held in Asunci\u00f3n on 27 and 28 July 2023, and one meeting for the landlocked developing countries in Europe and Asia, jointly organized by the Office of the High Representative, the Economic and Social Commission for Asia and the Pacific and the Economic Commission for Europe, held in Bangkok on 22 and 23 August 2023, and also takes note of the outcomes of those meetings;",
    "44": "Emphasizes the importance of country-level preparations as a critical input to the preparatory process for the Conference and in the implementation of and follow-up to its outcome, and calls upon the Governments of the landlocked developing countries to submit their reports in a timely manner;",
    "45": "Requests the Secretary-General to ensure, as appropriate, the full involvement of resident coordinators and country teams in the preparations for the Conference, in particular in the country level and regional preparations;",
    "46": "Stresses that the Conference and the preparatory activities should be organized and carried out in the most effective and efficient manner possible;",
    "47": "Encourages the active participation of all States Members of the United Nations, in particular landlocked and transit developing countries and donor countries, as well as of the United Nations system and international and regional organizations, in the Conference at the highest level possible;",
    "48": "Calls upon all stakeholders, while reviewing implementation of the Vienna Programme of Action, to identify innovative solutions and initiatives that can be launched as key deliverables at the Conference;",
    "49": "Reiterates its invitation to the Secretary-General to convene a high-level event of the United Nations system and other relevant international and regional organizations during the Conference, with a view to ensuring the full mobilization of the United Nations system in support of the landlocked developing countries;",
    "50": "Welcomes the holding by the President of the General Assembly and the President of the Economic and Social Council of a half-day dedicated thematic event on 7 December 2023 to provide substantive input to the Conference;",
    "51": " (b) To invite other relevant stakeholders, including organizations and bodies of the United Nations system, international financial institutions, civil society organizations, the private sector, other international bodies and other non-governmental organizations, to participate as observers in the Conference and its preparatory process; (c) To request the President of the General Assembly to draw up a list of representatives of other relevant non-governmental organizations, civil society organizations, academic institutions and the private sector who may participate in the Conference and its preparatory process, taking into account the principles of transparency and of equitable geographical representation and with due regard for gender parity, and to submit the proposed list to Member States for their consideration on a non-objection basis and bring the list to the attention of the Assembly for a final decision by the Assembly on participation in the Conference;19",
    "52": "Recalls its request to the Office of the High Representative to act as the United Nations system-wide focal point for the preparations for the third United Nations Conference on Landlocked Developing Countries, pursuant to resolution 76/217, and reiterates its invitation to the Secretary-General to take the measures necessary to ensure effective, efficient and timely preparations for the Conference and to further mobilize and coordinate the active involvement of the organizations of the United Nations system;",
    "53": "Emphasizes the critical importance of the full and effective participation of the landlocked developing countries in the Conference and its preparatory process at the national, regional and global levels, stresses that adequate resources should be provided, and in this regard requests the Secretary-General to mobilize voluntary contributions in order to support the cost of the participation of government representatives from the landlocked developing countries;",
    "54": "Requests the Secretary-General to ensure that necessary and sufficient support is given to transit countries to maximize their contribution to the success of the Conference and its preparatory process;",
    "55": "Requests the Secretary-General, with the assistance of relevant organizations and bodies of the United Nations system, including the Department of Global Communications of the Secretariat, in collaboration and avoiding overlap and duplication with the Office of the High Representative, to take the measures necessary to intensify their public information efforts and other appropriate initiatives to enhance public awareness of the Conference, including by highlighting its objectives and its significance;",
    "56": "Welcomes the decision of the Secretary-General to appoint the Under- Secretary-General and High Representative for the Least Developed Countries, Landlocked Developing Countries and Small Island Developing States as Secretary- General of the Conference, with responsibility for making the arrangements necessary for carrying out the work of the Conference;",
    "57": "Reaffirms the important role of the Group of Friends of Landlocked Developing Countries, and calls for their active participation and support in the preparation for the Conference and at the Conference itself;",
    "58": "Underlines that the Office of the High Representative should be provided with adequate resources to fulfil its mandate for the timely and effective follow-up, monitoring and implementation of the Vienna Programme of Action and its successor and to extend effective support to the landlocked developing countries, and requests the Secretary-General to address the allocation of adequate resources for the Office in the context of the proposed programme budget for 2025;",
    "59": "Requests Governments, intergovernmental and non-governmental organizations, major groups and other donors to contribute in a timely manner to the trust fund in support of activities undertaken by the Office of the High Representative to support the implementation of, follow-up to and monitoring of the Vienna Programme of Action, as well as the preparations for the third United Nations Conference on Landlocked Developing Countries and the participation of landlocked developing countries in the Conference;",
    "60": "Requests the Secretary-General to submit to the General Assembly at its seventy-ninth session a report on the third United Nations Conference on Landlocked Developing Countries and decides to include in the provisional agenda of its seventy- ninth session, under the item entitled \u201cGroups of countries in special situations\u201d, the sub-item entitled \u201cFollow-up to the third United Nations Conference on Landlocked Developing Countries\u201d."
  },
  "agenda_items": [
    "Item 20"
  ],
  "symbol_references": [
    "A/CONF.219/2023/L.1"
  ]
}