{
  "symbol": "A/RES/79/42",
  "filename": "A_RES_79_42.pdf",
  "title": "79/42. Measures to prevent terrorists from acquiring weapons of mass destruction",
  "text": "United Nations \nA/RES/79/42\n \n \nGeneral Assembly \nDistr.: General \n9 December 2024 \n \n24-23061 (E)     \n*2423061* \n \n \nSeventy-ninth session \nAgenda item 98 (v) \nGeneral and complete disarmament: measures to prevent \nterrorists from acquiring weapons of mass destruction\n \n \n \n \n \n Resolution adopted by the General Assembly \non 2 December 2024 \n \n \n \n \n[on the report of the First Committee (A/79/408, para. 114)] \n \n \n \n79/42. Measures to prevent terrorists from acquiring weapons of \nmass destruction \n \n \n \nThe General Assembly, \n \nRecalling its resolution 78/43 of 4 December 2023, \n \nRecognizing the determination of the international community to combat \nterrorism, as evidenced in relevant General Assembly and Security Council \nresolutions, \n \nDeeply concerned by the growing risk of linkages between terrorism and \nweapons of mass destruction, and in particular by the fact that terrorists may seek to \nacquire weapons of mass destruction, \n \nCognizant of the steps taken by States to implement Security Council resolution \n1540 (2004) of 28 April 2004 on the non-proliferation of weapons of mass \ndestruction, \n \nRecalling Security Council resolutions 2325 (2016) of 15 December 2016 and \n2663 (2022) of 30 November 2022 on the non-proliferation of weapons of mass \ndestruction, \n \nRecalling also the entry into force on 7 July 2007 of the International \nConvention for the Suppression of Acts of Nuclear Terrorism,1 \n \nRecalling further the adoption, by consensus of the States parties, of the \nAmendment2 to the Convention on the Physical Protection of Nuclear Material 3 by \n__________________ \n \n1  United Nations, Treaty Series, vol. 2445, No. 44004. \n \n2  Ibid., vol. 3132, No. 24631. \n \n3  Ibid., vol. 1456, No. 24631. \n\nA/RES/79/42 \nMeasures to prevent terrorists from acquiring weapons of \nmass destruction\n \n24-23061\n2/3 \n \nthe International Atomic Energy Agency on 8 July 2005, and its entry into force on \n8 May 2016, \n \nRecalling the support expressed in the Final Document of the Nineteenth \nSummit of Heads of State or Government of Non-Aligned Countries, held in Kampala \non 19 and 20 January 2024, for measures to prevent terrorists from acquiring weapons \nof mass destruction, \n \nRecalling also that the Group of Eight, the European Union, the Regional Forum \nof the Association of Southeast Asian Nations and others have taken into account in \ntheir deliberations the dangers posed by the likely acquisition by terrorists of weapons \nof mass destruction and the need for international cooperation in combating it, and \nthat the Global Initiative to Combat Nuclear Terrorism was launched jointly by the \nRussian Federation and the United States of America, \n \nRecalling further the holding of the Nuclear Security Summit on 12 and 13 April \n2010 in Washington, D.C., on 26 and 27 March 2012 in Seoul, on 24 and 25 March \n2014 in The Hague and on 31 March and 1 April 2016 in Washington, D.C., \n \nRecalling the holding of the high-level meeting on countering nuclear terrorism, \nwith a focus on strengthening the legal framework, in New York on 28 September \n2012, \n \nAcknowledging the consideration of issues relating to terrorism and weapons of \nmass destruction by the Advisory Board on Disarmament Matters, 4 \n \nTaking note of the holding by the International Atomic Energy Agency of the \nfourth International Conference on Nuclear Security: Shaping the Future, in Vienna \nin May 2024, the third International Conference on Nuclear Security: Sustaining and \nStrengthening Efforts, in Vienna in February 2020, the second International \nConference on Nuclear Security: Commitments and Actions, in Vienna in December \n2016, and the first International Conference on Nuclear Security: Enhancing Global \nEfforts, in Vienna in July 2013, and the relevant resolutions adopted by the General \nConference of the Agency at its sixty-eighth regular session, \n \nRecalling the Code of Conduct on the Safety and Security of Radioactive \nSources, approved by the Board of Governors of the International Atomic Energy \nAgency on 8 September 2003, and the supplementary Guidance on the Management \nof Disused Radioactive Sources, approved by the Board of Governors of the Agency \non 11 September 2017, \n \nRecalling also the 2005 World Summit Outcome adopted at the high-level \nplenary meeting of the General Assembly on 16 September 2005 5 and the adoption of \nthe United Nations Global Counter-Terrorism Strategy on 8 September 2006, 6 \n \nTaking note of the report of the Secretary-General submitted pursuant to \nparagraph 5 of resolution 78/43,7 \n \nMindful of the urgent need for addressing, within the United Nations framework \nand through international cooperation, this threat to humanity, \n \nEmphasizing that progress is urgently needed in the area of disarmament and \nnon-proliferation in order to maintain international peace and security and to \ncontribute to global efforts against terrorism, \n__________________ \n \n4  See A/59/361. \n \n5  Resolution 60/1. \n \n6  Resolution 60/288. \n \n7  A/79/138. \n\nMeasures to prevent terrorists from acquiring weapons of \nmass destruction \nA/RES/79/42\n \n3/3\n24-23061 \n \n \n1. \nCalls upon all Member States to support international efforts to prevent \nterrorists from acquiring weapons of mass destruction and their means of delivery; \n \n2. \nAppeals to all Member States to consider early accession to and ratification \nof the International Convention for the Suppression of Acts of Nuclear Terrorism, and \nencourages States parties to the Convention to review its implementation; \n \n3. \nUrges all Member States to take and strengthen national measures, as \nappropriate, to prevent terrorists from acquiring weapons of mass destruction, their \nmeans of delivery and materials and technologies related to their manufacture; \n \n4. \nEncourages cooperation among and between Member States and relevant \nregional and international organizations for strengthening national capacities in this \nregard; \n \n5. \nRequests the Secretary-General to compile a report on measures already \ntaken by international organizations on issues relating to the linkage between the fight \nagainst terrorism and the proliferation of weapons of mass destruction and to seek the \nviews of Member States on additional relevant measures, including national \nmeasures, for tackling the global threat posed by the acquisition by terrorists of \nweapons of mass destruction and to report to the General Assembly at its eightieth \nsession; \n \n6. \nDecides to include in the provisional agenda of its eightieth session, under \nthe item entitled \u201cGeneral and complete disarmament\u201d, the sub-item entitled \n\u201cMeasures to prevent terrorists from acquiring weapons of mass destruction\u201d. \n \n43rd plenary meeting \n2 December 2024 \n \n",
  "paragraphs": {
    "1": "Calls upon all Member States to support international efforts to prevent terrorists from acquiring weapons of mass destruction and their means of delivery;",
    "2": "Appeals to all Member States to consider early accession to and ratification of the International Convention for the Suppression of Acts of Nuclear Terrorism, and encourages States parties to the Convention to review its implementation;",
    "3": "Urges all Member States to take and strengthen national measures, as appropriate, to prevent terrorists from acquiring weapons of mass destruction, their means of delivery and materials and technologies related to their manufacture;",
    "4": "Encourages cooperation among and between Member States and relevant regional and international organizations for strengthening national capacities in this regard;",
    "5": "Requests the Secretary-General to compile a report on measures already taken by international organizations on issues relating to the linkage between the fight against terrorism and the proliferation of weapons of mass destruction and to seek the views of Member States on additional relevant measures, including national measures, for tackling the global threat posed by the acquisition by terrorists of weapons of mass destruction and to report to the General Assembly at its eightieth session;",
    "6": "Decides to include in the provisional agenda of its eightieth session, under the item entitled \u201cGeneral and complete disarmament\u201d, the sub-item entitled \u201cMeasures to prevent terrorists from acquiring weapons of mass destruction\u201d. 43rd plenary meeting 2 December 2024"
  },
  "agenda_items": [
    "Item 98"
  ],
  "symbol_references": []
}