{
  "symbol": "A/RES/72/241",
  "filename": "A_RES_72_241.pdf",
  "title": "72/241. A world against violence and violent extremism",
  "text": "United Nations \nA/RES/72/241\n \n \nGeneral Assembly \nDistr.: General \n19 January 2018 \n \n17-23322 (E)    240118     \n*1723322* \n \n \nSeventy-second session \nAgenda item 15 \n \n \n \n \n Resolution adopted by the General Assembly \non 20 December 2017 \n \n \n \n \n[without reference to a Main Committee (A/72/L.32 and A/72/L.32/Add.1)] \n \n \n 72/241. A world against violence and violent extremism \n \n \n \nThe General Assembly, \n \nGuided by the purposes and principles set forth in the Charter of the United \nNations and the Universal Declaration of Human Rights,1  \n \nReaffirming its resolutions 2625 (XXV) of 24 October 1970, 36/103 of \n9 December 1981, 39/11 of 12 November 1984, 49/60 of 9 December 1994, 53/243 of \n13 September 1999, 55/282 of 7 September 2001, 56/6 of 9 November 2001, 60/288 of \n8 September 2006, 64/14 of 10 November 2009, 66/171 of 19 December 2011, 67/99 of \n14 December 2012 and 67/173, 67/178 and 67/179 of 20 December 2012 and the Beijing \nDeclaration and Platform for Action,2 and reaffirming also its resolution on the most \nrecent review of the United Nations Global Counter-Terrorism Strategy,3 in which it \nurged Member States to unite against violent extremism as and when conducive to \nterrorism, and its resolutions 69/174 and 69/175 of 18 December 2014,  \n \nRecalling with appreciation the high-level thematic debate of the General \nAssembly on the topic \u201cPromoting tolerance and reconciliation: fostering peaceful, \ninclusive societies and countering violent extremism\u201d, held on 21 and 22 April 2015, \nand the high-level conversation on religions for peace, held by the Assembly on 6 May \n2016,  \n \nReaffirming that the purposes and principles embodied in the Charter include, inter \nalia, to develop friendly relations among nations based on respect for the principle of \nequal rights and self-determination of peoples, to take other appropriate measures to \nstrengthen universal peace, and to achieve international cooperation in solving \ninternational problems of an economic, social, cultural or humanitarian character, and \nin promoting and encouraging respect for human rights and for fundamental freedoms \n__________________ \n \n1  Resolution 217 A (III). \n \n2  Report of the Fourth World Conference on Women, Beijing, 4\u201315 September 1995 (United \nNations publication, Sales No. E.96.IV.13), chap. I, resolution 1, annexes I and II. \n \n3  Resolution 70/291. \n\nA/RES/72/241 \nA world against violence and violent extremism\n \n17-23322 \n2/4 \n \nfor all without distinction of any kind such as to race, colour, sex, language, religion, \npolitical or other opinions, national or social origin, property, birth or other status,  \n \nUnderlining that all Member States have undertaken to refrain in their \ninternational relations from the threat or use of force against the territorial integrity or \npolitical independence of any State or in any other manner inconsistent with the \npurposes of the United Nations, \n \nAlarmed by the acts of intolerance, violent extremism, violence, including \nsectarian violence, and terrorism in various parts of the world, which claim innocent \nlives, cause destruction and displace people, and rejecting the use of violence, regardless \nof any motivation, \n \nReaffirming the commitment made by all States under the Charter to promote and \nencourage universal respect for and observance of all human rights and fundamental \nfreedoms without distinction, and reaffirming also that States are under the obligation \nto protect and respect all human rights and fundamental freedoms of all persons, \n \nConvinced that wars and armed conflicts can lead to radicalization and the spread \nof violent extremism and disrupt development of human societies and thwart the well-\nbeing of humankind, \n \nRecognizing that a primary responsibility of each State is to ensure a peaceful and \nviolence-free life for its people, while fully respecting their human rights without \ndistinction of any kind, to live together in peace with its neighbours, in full respect for \npolitical independence and the principle of sovereign equality of others, and to help to \nmaintain international peace and security, \n \nRecalling that, as affirmed in the Preamble to the Charter, the practice of tolerance \nis one of the principles to be applied to attain the ends pursued by the United Nations of \npreventing war and maintaining peace, and convinced that the respect for and protection \nof all human rights and fundamental freedoms of all persons, as well as tolerance, the \nrecognition and appreciation of others and the ability to live together with and to listen \nto others, form a sound foundation of any society and of peace, \n \nWelcoming the efforts made by the Secretary-General and his High Representative \nfor the Alliance of Civilizations to promote greater understanding and respect among \ncivilizations, cultures and religions, \n \nReaffirming that violent extremism constitutes a serious common concern for all \nMember States, threatening the security and well-being of human societies, and \nconvinced that there is no justification for violent extremism, whatever the motivation, \n \nRecognizing the need for a comprehensive approach to preventing and countering \nviolent extremism and to addressing the conditions conducive to its spread, and \nencouraged by increasing awareness in this regard, \n \nStressing that States must ensure that any measure taken to combat violent \nextremism complies with their obligations under international law, in particular \ninternational human rights, refugee and humanitarian law, and underscoring that \ncounter-terrorism measures and the protection of human rights, fundamental freedoms \nand the rule of law are not conflicting goals, but complementary and mutually \nreinforcing, and are an essential part of a successful effort to counter violent extremism, \n \nRecognizing the commitment of all religions to peace, determined to condemn \nviolent extremism, which spreads hate and threatens lives, and reaffirming that violent \nextremism, in all its forms and manifestations, cannot and should not be associated with \nany religion, nationality, civilization or ethnic group, \n \nRecognizing also local, national, regional and multilateral initiatives aimed at \naddressing both directly and indirectly the grievances that drive violent extremism, \n\nA world against violence and violent extremism \nA/RES/72/241\n \n3/4 \n17-23322 \n \n \n1. \nStresses the international obligations of all States under the Charter of the \nUnited Nations and international law, in particular refraining in their international \nrelations from the threat or use of force against the territorial integrity or political \nindependence of any State or in any other manner inconsistent with the purposes of the \nUnited Nations and settling their international disputes by peaceful means on the basis \nof the Charter; \n \n2. \nCondemns the targeting of civilian populations, including women and \nchildren, in violation of international law, in particular human rights and humanitarian \nlaw, including by violent extremists, as well as the attempts to disrupt and divert the \npopular quest for political reform, moderation and inclusive development in different \nsocieties and drive it away from the hard work of development towards violence; \n \n3. \nDeplores attacks on religious places and shrines and cultural sites in \nviolation of international law, in particular human rights and humanitarian law, including \nany deliberate destruction of relics and monuments; \n \n4. \nUrges all Member States to unite against violent extremism in all its forms \nand manifestations as well as sectarian violence, encourages the efforts of leaders to \ndiscuss within their communities the causes of violent extremism and discrimination \nand to evolve strategies to address these causes, and underlines that States, regional \norganizations, non-governmental organizations, religious bodies and the media have an \nimportant role to play in promoting tolerance and respect for religious and cultural \ndiversity; \n \n5. \nStresses that it is important that States strongly condemn all forms of \nviolence against women and refrain from invoking any custom, tradition or religious \nconsideration to avoid their obligations with respect to its elimination, as set out in the \nDeclaration on the Elimination of Violence against Women;4  \n \n6. \nEncourages all States and international organizations to generate public \nawareness, to enlighten the public about the dangers of intolerance and sectarian \nviolence and to react with renewed commitment and action in support of the promotion \nof tolerance and human rights, and invites them to continue to pay attention to the \nimportance of mutual cooperation, understanding and dialogue in ensuring the \npromotion of moderation and tolerance and respect for human rights; \n \n7. \nCalls upon all States to respect and protect, in their fight against violent \nextremism, all human rights and fundamental freedoms and the rule of law and to \nsupport all actions at the local, national, regional and international levels, in cooperation \nwith civil society, to foster understanding, tolerance and non-violence, inter alia, through \nprogrammes and institutions in the fields of education, science, culture, communication \nand information, strengthen democratic institutions, ensure the all-inclusiveness of the \ndevelopment process, eliminate all forms of intolerance and violence, eradicate poverty \nand illiteracy and reduce inequalities within and among nations in order to leave no one \nbehind; \n \n8. \nUnderlines the vital importance of education, including human rights \neducation, as the most effective means of promoting tolerance, in preventing the spread \nof extremism by instilling respect for life and promoting the practice of non-violence, \nmoderation, dialogue and cooperation, and encourages all States, the specialized \nagencies of the United Nations and intergovernmental and non-governmental \norganizations to contribute actively to this endeavour by, inter alia, placing emphasis on \ncivic education and life skills as well as democratic principles and practices at all levels \nof formal, informal and non-formal education, and in this regard recognizes the effort \nmade by the United Nations Educational, Scientific and Cultural Organization, including \n__________________ \n \n4  Resolution 48/104. \n\nA/RES/72/241 \nA world against violence and violent extremism\n \n17-23322 \n4/4 \n \nthrough its organization of the conference on the theme \u201cInternet and the radicalization \nof youth: preventing, acting and living together\u201d in Quebec City, Canada, from \n30 October to 1 November 2016; \n \n9. \nRecommends promoting community engagement in countering violent \nextremism, including by strengthening ties between communities and emphasizing their \ncommon bonds and interests; \n \n10. \nCalls upon Member States to advocate for and disseminate information on \ntolerance and mutual respect, and underlines the potential contribution of the media and \nnew communications technologies, including the Internet, to promoting respect for all \nhuman rights, to developing a better understanding among all religions, beliefs, cultures \nand peoples, to enhancing tolerance and mutual respect and thus to strengthening the \nrejection of violent extremism; \n \n11. \nRecognizes the positive contribution that the exercise of the right to freedom \nof expression, particularly by the media and new technologies, including the Internet, \nand full respect for the freedom to seek, receive and impart information can make to the \nfight against racism, racial discrimination, xenophobia and related intolerance, and \nreiterates the need to respect the editorial independence and autonomy of the media in \nthis regard; \n \n12. \nStrongly condemns any advocacy of national, racial or religious hatred that \nconstitutes incitement to discrimination, hostility or violence; \n \n13. \nEncourages Member States to increase their understanding of the drivers of \nviolent extremism, particularly for women and youth, so as to develop targeted and \ncomprehensive solutions to this threat; \n \n14. \nInvites all Member States, organizations of the United Nations system, \nregional and non-governmental organizations and other relevant stakeholders to \nendeavour to fulfil, in an appropriate manner, the objectives set out in the present \nresolution; \n \n15. \nNotes the Secretary-General\u2019s Plan of Action to Prevent Violent Extremism;5  \n \n16. \nTakes note of the report of the Secretary-General prepared in response to its \nresolution 70/109 of 10 December 2015, entitled \u201cA world against violence and violent \nextremism\u201d;6  \n \n17. \nRequests the Secretary-General to report to the General Assembly at its \nseventy-fourth session on the implementation of the present resolution and to \nrecommend ways and means by which the United Nations system and the Secretariat \ncould assist Member States, upon their request and within existing resources, in \ngenerating public awareness about the dangers of intolerance, as well as in fostering \nunderstanding and non-violence. \n \n74th plenary meeting \n20 December 2017 \n \n__________________ \n \n5  See A/70/674. \n \n6  A/72/621. \n",
  "paragraphs": {
    "1": "Stresses the international obligations of all States under the Charter of the United Nations and international law, in particular refraining in their international relations from the threat or use of force against the territorial integrity or political independence of any State or in any other manner inconsistent with the purposes of the United Nations and settling their international disputes by peaceful means on the basis of the Charter;",
    "2": "Condemns the targeting of civilian populations, including women and children, in violation of international law, in particular human rights and humanitarian law, including by violent extremists, as well as the attempts to disrupt and divert the popular quest for political reform, moderation and inclusive development in different societies and drive it away from the hard work of development towards violence;",
    "3": "Deplores attacks on religious places and shrines and cultural sites in violation of international law, in particular human rights and humanitarian law, including any deliberate destruction of relics and monuments;",
    "4": "Urges all Member States to unite against violent extremism in all its forms and manifestations as well as sectarian violence, encourages the efforts of leaders to discuss within their communities the causes of violent extremism and discrimination and to evolve strategies to address these causes, and underlines that States, regional organizations, non-governmental organizations, religious bodies and the media have an important role to play in promoting tolerance and respect for religious and cultural diversity;",
    "5": "Stresses that it is important that States strongly condemn all forms of violence against women and refrain from invoking any custom, tradition or religious consideration to avoid their obligations with respect to its elimination, as set out in the Declaration on the Elimination of Violence against Women;4",
    "6": "Encourages all States and international organizations to generate public awareness, to enlighten the public about the dangers of intolerance and sectarian violence and to react with renewed commitment and action in support of the promotion of tolerance and human rights, and invites them to continue to pay attention to the importance of mutual cooperation, understanding and dialogue in ensuring the promotion of moderation and tolerance and respect for human rights;",
    "7": "Calls upon all States to respect and protect, in their fight against violent extremism, all human rights and fundamental freedoms and the rule of law and to support all actions at the local, national, regional and international levels, in cooperation with civil society, to foster understanding, tolerance and non-violence, inter alia, through programmes and institutions in the fields of education, science, culture, communication and information, strengthen democratic institutions, ensure the all-inclusiveness of the development process, eliminate all forms of intolerance and violence, eradicate poverty and illiteracy and reduce inequalities within and among nations in order to leave no one behind;",
    "8": "Underlines the vital importance of education, including human rights education, as the most effective means of promoting tolerance, in preventing the spread of extremism by instilling respect for life and promoting the practice of non-violence, moderation, dialogue and cooperation, and encourages all States, the specialized agencies of the United Nations and intergovernmental and non-governmental organizations to contribute actively to this endeavour by, inter alia, placing emphasis on civic education and life skills as well as democratic principles and practices at all levels of formal, informal and non-formal education, and in this regard recognizes the effort made by the United Nations Educational, Scientific and Cultural Organization, including through its organization of the conference on the theme \u201cInternet and the radicalization of youth: preventing, acting and living together\u201d in Quebec City, Canada, from 30 October to 1 November 2016;",
    "9": "Recommends promoting community engagement in countering violent extremism, including by strengthening ties between communities and emphasizing their common bonds and interests;",
    "10": "Calls upon Member States to advocate for and disseminate information on tolerance and mutual respect, and underlines the potential contribution of the media and new communications technologies, including the Internet, to promoting respect for all human rights, to developing a better understanding among all religions, beliefs, cultures and peoples, to enhancing tolerance and mutual respect and thus to strengthening the rejection of violent extremism;",
    "11": "Recognizes the positive contribution that the exercise of the right to freedom of expression, particularly by the media and new technologies, including the Internet, and full respect for the freedom to seek, receive and impart information can make to the fight against racism, racial discrimination, xenophobia and related intolerance, and reiterates the need to respect the editorial independence and autonomy of the media in this regard;",
    "12": "Strongly condemns any advocacy of national, racial or religious hatred that constitutes incitement to discrimination, hostility or violence;",
    "13": "Encourages Member States to increase their understanding of the drivers of violent extremism, particularly for women and youth, so as to develop targeted and comprehensive solutions to this threat;",
    "14": "Invites all Member States, organizations of the United Nations system, regional and non-governmental organizations and other relevant stakeholders to endeavour to fulfil, in an appropriate manner, the objectives set out in the present resolution;",
    "15": "Notes the Secretary-General\u2019s Plan of Action to Prevent Violent Extremism;5",
    "16": "Takes note of the report of the Secretary-General prepared in response to its resolution 70/109 of 10 December 2015, entitled \u201cA world against violence and violent extremism\u201d;6",
    "17": "Requests the Secretary-General to report to the General Assembly at its seventy-fourth session on the implementation of the present resolution and to recommend ways and means by which the United Nations system and the Secretariat could assist Member States, upon their request and within existing resources, in generating public awareness about the dangers of intolerance, as well as in fostering understanding and non-violence."
  },
  "agenda_items": [
    "Item 15"
  ],
  "symbol_references": [
    "A/72/L.32"
  ]
}