{
  "symbol": "A/RES/73/212",
  "filename": "A_RES_73_212.pdf",
  "title": "73/212. Report of the Committee on Relations with the Host Country",
  "text": "United Nations \nA/RES/73/212 \n \n \nGeneral Assembly \nDistr.: General \n14 January 2019 \n \n18-22530 (E)    160119 \n*1822530* \n \n \nSeventy-third session \nAgenda item 167 \n \n \n \n \n Resolution adopted by the General Assembly \non 20 December 2018 \n \n \n \n \n[on the report of the Sixth Committee (A/73/552)] \n \n \n 73/212. Report of the Committee on Relations with the Host Country  \n \n \n \nThe General Assembly, \n \nHaving considered the report of the Committee on Relations with the Host \nCountry,1 \n \nRecalling Article 105 of the Charter of the United Nations, the Convention on \nthe Privileges and Immunities of the United Nations, 2 the Agreement between the \nUnited Nations and the United States of America regarding the Headquarters of the \nUnited Nations3 and the responsibilities of the host country, \n \nRecalling also that, in accordance with paragraph 7 of General Assembly \nresolution 2819 (XXVI) of 15 December 1971, the Committee should consider, and \nadvise the host country on, issues arising in connection with the implementation of \nthe Headquarters Agreement, \n \nRecognizing that effective measures should continue to be taken by the \ncompetent authorities of the host country, in particular to prevent any acts violating \nthe security of missions and the safety of their personnel, \n \n1. \nEndorses the recommendations and conclusions of the Committee on \nRelations with the Host Country contained in paragraph 111 of its report;1 \n \n2. \nConsiders that the maintenance of appropriate conditions for the normal \nwork of the delegations and the missions accredited to the United Nations and the \nobservance of their privileges and immunities, which cannot be subject to any \nrestrictions arising from the bilateral relations of the host country, are in the interest \nof the United Nations and all Member States, takes seriously the recent concerns \nraised by permanent missions regarding the normal performance of their functions, \nrequests the host country to continue to solve, through negotiations, problems that \n__________________ \n \n1  Official Records of the General Assembly, Seventy-third Session, Supplement No. 26 (A/73/26). \n \n2  Resolution 22 A (I). \n \n3  See resolution 169 (II). \n\nA/RES/73/212 \nReport of the Committee on Relations with the Host Country\n \n18-22530\n2/3 \n \nmight arise and to take all measures necessary to prevent any interference with the \nfunctioning of missions, and urges the host country to continue to take appropriate \naction, such as the training of police, security, customs and border control officers, \nwith a view to maintaining respect for diplomatic privileges and immunities and, if \nviolations occur, to ensure that such cases are properly investigated and remedied, in \naccordance with applicable law; \n \n3. \nRecalls the privileges and immunities applicable to the premises of the \npermanent missions to the United Nations enjoyed under international law, in \nparticular the instruments listed in paragraph 111 (a) of the report of the Committee \non Relations with the Host Country, and the obligations of the host country to observe \nsuch privileges and immunities, takes note of the alleged ongoing violations thereof \nby the host country and of the concerns expressed thereon, urges the host country to \nremove without delay any restrictions applied to the premises of a Permanent Mission \ninconsistent with those privileges and immunities, and in that regard to ensure respect \nfor such privileges and immunities, takes seriously the lack of resolution of these \nmatters and the concerns expressed about such lack of resolution, remains seized of \nthese matters, and anticipates that they shall be duly addressed in a spirit of \ncooperation and in accordance with international law; \n \n4. \nAlso recalls that, prior to the institution by the host country of any \nproceedings that require any person referred to in article IV, section 11, of the \nAgreement between the United Nations and the United States of America regarding \nthe Headquarters of the United Nations,3 including representatives of a Member State, \nto leave the host country, article IV, section 13 (b) (1) of the Headquarters Agreement, \ninter alia, requires the host country to consult with the Member State, the Secretary-\nGeneral or other principal executive officer, as appropriate, and considers that, given \nthe seriousness of any such measure being exercised by the host country, the \nconsultation should be meaningful; \n \n5. \nNotes the problems experienced by some permanent missions to the United \nNations in connection with the implementation of the Parking Programme for Diplomatic \nVehicles,4 and notes that the Committee shall remain seized of the matter, with a view to \ncontinuing to maintain the proper implementation of the Parking Programme in a manner \nthat is fair, non-discriminatory, effective and therefore consistent with international law; \n \n6. \nRequests again the host country to consider removing the remaining travel \nrestrictions imposed by it on staff of certain missions and staff members of the \nSecretariat of certain nationalities, and in this regard takes seriously recent concerns \nand notes the long-standing positions of affected States, of the Secretary-General and \nof the host country; \n \n7. \nRecalls article IV of the Headquarters Agreement, and notes the concerns \nexpressed by some delegations concerning the denial and delay of entry visas to \nrepresentatives of Member States; \n \n8. \nNotes that the Committee anticipates that the host country will continue to \nenhance its efforts to ensure the issuance of entry visas to representatives of Member \nStates and members of the Secretariat pursuant to article IV, section 11, of the \nHeadquarters Agreement and, in a timely manner, to enable persons assigned as \nmembers of permanent missions or recruited to serve in the Secretariat to take up their \nassignments as promptly as possible and to enable representatives of Member States \nto travel to New York on United Nations business, and that the Committee anticipates \nthat the host country will continue to enhance efforts, including visa issuance, to \nfacilitate the participation of representatives of Member States in other United \nNations meetings, as appropriate; \n__________________ \n \n4  A/AC.154/355, annex.  \n\nReport of the Committee on Relations with the Host Country \nA/RES/73/212\n \n3/3\n18-22530 \n \n \n9. \nAlso notes that a number of delegations have requested shortening the time \nframe applied by the host country for issuance of entry visas to representatives of \nMember States since the time frame poses difficulties for the full-fledged participation \nof Member States in United Nations meetings, and invites the host country to inform \nthe Committee, as appropriate, of efforts to address such difficulties; \n \n10. Notes with concern the difficulties experienced by some permanent \nmissions to the United Nations in obtaining suitable banking services, and welcomes \nthe continued efforts of the host country to facilitate the opening of bank accounts for \nthose permanent missions; \n \n11. Stresses the need for the permanent missions and the United Nations to \nbenefit from appropriate banking services, and anticipates that the host country will \ncontinue to assist the permanent missions accredited to the United Nations and their \nstaff in obtaining such services;  \n \n12. Expresses its appreciation for the efforts made by the host country, and \nexpects that the issues raised at the meetings of the Committee will be resolved in a \nspirit of cooperation and in accordance with international law, including the \nHeadquarters Agreement; \n \n13. Affirms the importance of the Committee being in a position to fulfil its \nmandate and meet on short notice to deal with urgent and important matters \nconcerning the relations between the United Nations and the host country, and in that \nconnection requests the Secretariat and the Committee on Conferences to accord \npriority to requests from the Committee on Relations with the Host Country for \nconference-servicing facilities for meetings of that Committee that must be held while \nthe General Assembly and its Main Committees are meeting, without prejudice to the \nrequirements of those bodies and on an \u201cas available\u201d basis; \n \n14. Requests the Secretary-General to remain actively engaged in all aspects \nof the relations of the United Nations with the host country and to actively engage in \nthe work of the Committee with a view to ensuring the representation of the interests \nconcerned, in accordance with General Assembly resolution 2819 (XXVI), and \nrecalls that the Secretary-General may bring to the attention of the Committee issues \nof mutual concern relating to the implementation of the Headquarters Agreement and \nthe Convention on the Privileges and Immunities of the United Nations; 2 \n \n15. Requests the Committee to continue its work in conformity with General \nAssembly resolution 2819 (XXVI) and, in this framework, to continue to consider \nadditional appropriate measures to enhance the work of the Committee and its \neffectiveness; \n \n16. Decides to include in the provisional agenda of its seventy-fourth session \nthe item entitled \u201cReport of the Committee on Relations with the Host Country\u201d. \n \n62nd plenary meeting  \n20 December 2018 \n \n",
  "paragraphs": {
    "1": "Endorses the recommendations and conclusions of the Committee on Relations with the Host Country contained in paragraph 111 of its report;1",
    "2": "Considers that the maintenance of appropriate conditions for the normal work of the delegations and the missions accredited to the United Nations and the observance of their privileges and immunities, which cannot be subject to any restrictions arising from the bilateral relations of the host country, are in the interest of the United Nations and all Member States, takes seriously the recent concerns raised by permanent missions regarding the normal performance of their functions, requests the host country to continue to solve, through negotiations, problems that __________________ 1 Official Records of the General Assembly, Seventy-third Session, Supplement No. 26 (A/73/26). 2 Resolution 22 A (I). 3 See resolution 169 (II). A/RES/73/212 Report of the Committee on Relations with the Host Country 18-22530 2/3 might arise and to take all measures necessary to prevent any interference with the functioning of missions, and urges the host country to continue to take appropriate action, such as the training of police, security, customs and border control officers, with a view to maintaining respect for diplomatic privileges and immunities and, if violations occur, to ensure that such cases are properly investigated and remedied, in accordance with applicable law;",
    "3": "Recalls the privileges and immunities applicable to the premises of the permanent missions to the United Nations enjoyed under international law, in particular the instruments listed in paragraph 111 (a) of the report of the Committee on Relations with the Host Country, and the obligations of the host country to observe such privileges and immunities, takes note of the alleged ongoing violations thereof by the host country and of the concerns expressed thereon, urges the host country to remove without delay any restrictions applied to the premises of a Permanent Mission inconsistent with those privileges and immunities, and in that regard to ensure respect for such privileges and immunities, takes seriously the lack of resolution of these matters and the concerns expressed about such lack of resolution, remains seized of these matters, and anticipates that they shall be duly addressed in a spirit of cooperation and in accordance with international law;",
    "4": "Also recalls that, prior to the institution by the host country of any proceedings that require any person referred to in article IV, section 11, of the Agreement between the United Nations and the United States of America regarding the Headquarters of the United Nations,3 including representatives of a Member State, to leave the host country, article IV, section 13 (b) (1) of the Headquarters Agreement, inter alia, requires the host country to consult with the Member State, the Secretary- General or other principal executive officer, as appropriate, and considers that, given the seriousness of any such measure being exercised by the host country, the consultation should be meaningful;",
    "5": "Notes the problems experienced by some permanent missions to the United Nations in connection with the implementation of the Parking Programme for Diplomatic Vehicles,4 and notes that the Committee shall remain seized of the matter, with a view to continuing to maintain the proper implementation of the Parking Programme in a manner that is fair, non-discriminatory, effective and therefore consistent with international law;",
    "6": "Requests again the host country to consider removing the remaining travel restrictions imposed by it on staff of certain missions and staff members of the Secretariat of certain nationalities, and in this regard takes seriously recent concerns and notes the long-standing positions of affected States, of the Secretary-General and of the host country;",
    "7": "Recalls article IV of the Headquarters Agreement, and notes the concerns expressed by some delegations concerning the denial and delay of entry visas to representatives of Member States;",
    "8": "Notes that the Committee anticipates that the host country will continue to enhance its efforts to ensure the issuance of entry visas to representatives of Member States and members of the Secretariat pursuant to article IV, section 11, of the Headquarters Agreement and, in a timely manner, to enable persons assigned as members of permanent missions or recruited to serve in the Secretariat to take up their assignments as promptly as possible and to enable representatives of Member States to travel to New York on United Nations business, and that the Committee anticipates that the host country will continue to enhance efforts, including visa issuance, to facilitate the participation of representatives of Member States in other United Nations meetings, as appropriate; __________________ 4 A/AC.154/355, annex. Report of the Committee on Relations with the Host Country A/RES/73/212 3/3 18-22530",
    "9": "Also notes that a number of delegations have requested shortening the time frame applied by the host country for issuance of entry visas to representatives of Member States since the time frame poses difficulties for the full-fledged participation of Member States in United Nations meetings, and invites the host country to inform the Committee, as appropriate, of efforts to address such difficulties;",
    "10": "Notes with concern the difficulties experienced by some permanent missions to the United Nations in obtaining suitable banking services, and welcomes the continued efforts of the host country to facilitate the opening of bank accounts for those permanent missions;",
    "11": "Stresses the need for the permanent missions and the United Nations to benefit from appropriate banking services, and anticipates that the host country will continue to assist the permanent missions accredited to the United Nations and their staff in obtaining such services;",
    "12": "Expresses its appreciation for the efforts made by the host country, and expects that the issues raised at the meetings of the Committee will be resolved in a spirit of cooperation and in accordance with international law, including the Headquarters Agreement;",
    "13": "Affirms the importance of the Committee being in a position to fulfil its mandate and meet on short notice to deal with urgent and important matters concerning the relations between the United Nations and the host country, and in that connection requests the Secretariat and the Committee on Conferences to accord priority to requests from the Committee on Relations with the Host Country for conference-servicing facilities for meetings of that Committee that must be held while the General Assembly and its Main Committees are meeting, without prejudice to the requirements of those bodies and on an \u201cas available\u201d basis;",
    "14": "Requests the Secretary-General to remain actively engaged in all aspects of the relations of the United Nations with the host country and to actively engage in the work of the Committee with a view to ensuring the representation of the interests concerned, in accordance with General Assembly resolution 2819 (XXVI), and recalls that the Secretary-General may bring to the attention of the Committee issues of mutual concern relating to the implementation of the Headquarters Agreement and the Convention on the Privileges and Immunities of the United Nations; 2",
    "15": "Requests the Committee to continue its work in conformity with General Assembly resolution 2819 (XXVI) and, in this framework, to continue to consider additional appropriate measures to enhance the work of the Committee and its effectiveness;",
    "16": "Decides to include in the provisional agenda of its seventy-fourth session the item entitled \u201cReport of the Committee on Relations with the Host Country\u201d. 62nd plenary meeting 20 December 2018"
  },
  "agenda_items": [
    "Item 167"
  ],
  "symbol_references": []
}