{
  "symbol": "A/RES/74/303",
  "filename": "A_RES_74_303.pdf",
  "title": "74/303. Revitalization of the work of the General Assembly",
  "text": "United Nations \nA/RES/74/303\n \n \nGeneral Assembly \nDistr.: General \n9 September 2020 \n \n20-11626 (E)    110920     \n*2011626* \n \n \nSeventy-fourth session \nAgenda item 121 \nRevitalization of the work of the General Assembly \n \n \n \n \n Resolution adopted by the General Assembly \non 4 September 2020 \n \n \n \n \n[without reference to a Main Committee (A/74/L.90)] \n \n \n 74/303. Revitalization of the work of the General Assembly \n \n \n \nThe General Assembly,  \n \nBearing in mind the role and authority of the General Assembly as a principal \norgan of the United Nations and the importance of its effectiveness and efficiency in \nfulfilling its functions under the Charter of the United Nations,  \n \nReiterating that the revitalization of the work of the General Assembly is a \ncritical component of the overall reform of the United Nations,  \n \nWelcoming the commemoration of the seventy-fifth anniversary of the United \nNations in 2020 under the theme \u201cThe future we want, the United Nations we need: \nreaffirming our collective commitment to multilateralism\u201d,  \n \nRecognizing the impact of the coronavirus disease (COVID-19) pandemic on \nthe work of the General Assembly during the seventy-fourth session, and welcoming \nthe efforts of the President of the General Assembly at its seventy-fourth session to \nensure the continued functioning of the General Assembly despite the limitations for \nits normal work as a consequence of the pandemic,  \n \nUnderlining the need to further enhance the role, authority, effectiveness and \nefficiency of the General Assembly to address the evolving global challenges,  \n \n1. \nReaffirms its resolution 73/341 of 12 September 2019 and all other \nprevious resolutions adopted by consensus relating to the revitalization of the work \nof the General Assembly, and agrees that resolution 73/341 as a whole will form the \nbasis for the work of the Ad Hoc Working Group on the Revitalization of the Work of \nthe General Assembly during the seventy-fifth session;  \n \n2. \nRequests the Secretariat to continue updating regularly and equally the \nmultilingual web page devoted to the revitalization of the work of the General \nAssembly in all six official languages and its substantive content within existing \n\nA/RES/74/303 \nRevitalization of the work of the General Assembly\n \n20-11626\n2/2 \n \nresources in a cost-effective manner, including through the use of existing capabilities \nsuch as automation of translation, while ensuring the accuracy of translation;  \n \n3. \nDecides to establish, at its seventy-fifth session, an ad hoc working group \non the revitalization of the work of the General Assembly, open to all Member States:  \n \n(a) \nTo identify further ways to enhance the role, authority, effectiveness and \nefficiency of the Assembly, inter alia, by building on the progress achieved in past \nsessions as well as on previous resolutions, including evaluating the status of their \nimplementation;  \n \n(b) \nTo submit a report thereon to the Assembly at its seventy-fifth session;  \n \n4. \nRequests the Secretary-General to undertake within existing resources an \nanalysis of the impact of the COVID-19 pandemic on the work of the General \nAssembly and to provide a briefing thereon to the Ad Hoc Working Group during the \nseventy-fifth session;  \n \n5. \nDecides that the Ad Hoc Working Group shall continue its review of the \ninventory of General Assembly resolutions on revitalization annexed to the report of \nthe Ad Hoc Working Group submitted at the seventy-third session1 and, as a result, \ncontinue to update the inventory to be attached to the report to be submitted at the \nseventy-fifth session of the Assembly, including the separate indication of relevant \nprovisions that were not implemented, with reasons therefor;  \n \n6. \nRequests the President of the General Assembly at its seventy-fifth session \nto identify proposals, in a timely manner, through consultations with all Member \nStates, the President of the Economic and Social Council and the General Committee, \nwithin their respective mandates, aimed at addressing gaps, overlaps and duplication \nwhere they are found to exist in the agenda of the Assembly as they relate to the 2030 \nAgenda for Sustainable Development2 as a whole, and reaffirms the respective \nmandates of the Main Committees of the Assembly, and on that basis, calls upon all \nof them to continue their consideration of addressing gaps, overlaps and duplication \nin their respective agendas as they relate to the 2030 Agenda as a whole, and in this \nregard requests them to make proposals available for discussion during the seventy-\nfifth session of the Assembly;  \n \n7. \nTakes note of the report of the Secretary-General.3  \n \n63rd plenary meeting \n4 September 2020 \n \n__________________ \n \n1  A/73/956. \n \n2  Resolution 70/1. \n \n3  A/74/704. \n",
  "paragraphs": {
    "1": "Reaffirms its resolution 73/341 of 12 September 2019 and all other previous resolutions adopted by consensus relating to the revitalization of the work of the General Assembly, and agrees that resolution 73/341 as a whole will form the basis for the work of the Ad Hoc Working Group on the Revitalization of the Work of the General Assembly during the seventy-fifth session;",
    "2": " resources in a cost-effective manner, including through the use of existing capabilities such as automation of translation, while ensuring the accuracy of translation;",
    "3": "Decides to establish, at its seventy-fifth session, an ad hoc working group on the revitalization of the work of the General Assembly, open to all Member States: (a) To identify further ways to enhance the role, authority, effectiveness and efficiency of the Assembly, inter alia, by building on the progress achieved in past sessions as well as on previous resolutions, including evaluating the status of their implementation; (b) To submit a report thereon to the Assembly at its seventy-fifth session;",
    "4": "Requests the Secretary-General to undertake within existing resources an analysis of the impact of the COVID-19 pandemic on the work of the General Assembly and to provide a briefing thereon to the Ad Hoc Working Group during the seventy-fifth session;",
    "5": "Decides that the Ad Hoc Working Group shall continue its review of the inventory of General Assembly resolutions on revitalization annexed to the report of the Ad Hoc Working Group submitted at the seventy-third session1 and, as a result, continue to update the inventory to be attached to the report to be submitted at the seventy-fifth session of the Assembly, including the separate indication of relevant provisions that were not implemented, with reasons therefor;",
    "6": "Requests the President of the General Assembly at its seventy-fifth session to identify proposals, in a timely manner, through consultations with all Member States, the President of the Economic and Social Council and the General Committee, within their respective mandates, aimed at addressing gaps, overlaps and duplication where they are found to exist in the agenda of the Assembly as they relate to the 2030 Agenda for Sustainable Development2 as a whole, and reaffirms the respective mandates of the Main Committees of the Assembly, and on that basis, calls upon all of them to continue their consideration of addressing gaps, overlaps and duplication in their respective agendas as they relate to the 2030 Agenda as a whole, and in this regard requests them to make proposals available for discussion during the seventy- fifth session of the Assembly;",
    "7": "Takes note of the report of the Secretary-General.3"
  },
  "agenda_items": [
    "Item 121"
  ],
  "symbol_references": [
    "A/74/L.90"
  ]
}