{
  "symbol": "A/RES/79/50",
  "filename": "A_RES_79_50.pdf",
  "title": "79/50. Nuclear disarmament",
  "text": "United Nations \nA/RES/79/50\n \n \nGeneral Assembly \nDistr.: General \n9 December 2024 \n \n24-23073 (E)     \n*2423073* \n \n \nSeventy-ninth session \nAgenda item 98 (b) \nGeneral and complete disarmament: nuclear disarmament  \n \n \n \n \n Resolution adopted by the General Assembly \non 2 December 2024 \n \n \n \n \n[on the report of the First Committee (A/79/408, para. 114)] \n \n \n \n79/50. Nuclear disarmament \n \n \n \nThe General Assembly, \n \nRecalling its resolution 49/75 E of 15 December 1994 on a step-by-step \nreduction of the nuclear threat, and its resolutions 50/70 P of 12 December 1995, \n51/45 O of 10 December 1996, 52/38 L of 9 December 1997, 53/77 X of 4 December \n1998, 54/54 P of 1 December 1999, 55/33 T of 20 November 2000, 56/24 R of \n29 November 2001, 57/79 of 22 November 2002, 58/56 of 8 December 2003, 59/77 \nof 3 December 2004, 60/70 of 8 December 2005, 61/78 of 6 December 2006, 62/42 \nof 5 December 2007, 63/46 of 2 December 2008, 64/53 of 2 December 2009, 65/56 \nof 8 December 2010, 66/51 of 2 December 2011, 67/60 of 3 December 2012, 68/47 \nof 5 December 2013, 69/48 of 2 December 2014, 70/52 of 7 December 2015, 71/63 \nof 5 December 2016, 72/38 of 4 December 2017, 73/50 of 5 December 2018, 74/45 \nof 19 December 2019, 75/63 of 7 December 2020, 76/46 of 6 December 2021, 77/65 \nof 7 December 2022 and 78/53 of 4 December 2023 on nuclear disarmament, \n \nReaffirming the commitment of the international community to the goal of the \ntotal elimination of nuclear weapons and the establishment of a nuclear-weapon-free \nworld, \n \nBearing in mind that the Convention on the Prohibition of the Development, \nProduction and Stockpiling of Bacteriological (Biological) and Toxin Weapons and \non Their Destruction of 1972 1  and the Convention on the Prohibition of the \nDevelopment, Production, Stockpiling and Use of Chemical Weapons and on Their \nDestruction of 1993 2  have already established legal regimes on the complete \nprohibition of biological and chemical weapons, respectively, and determined to \nachieve a comprehensive nuclear weapons convention on the prohibition of the \ndevelopment, testing, production, stockpiling, loan, transfer, use and threat of use of \n__________________ \n \n1 United Nations, Treaty Series, vol. 1015, No. 14860. \n \n2 Ibid., vol. 1974, No. 33757. \n\nA/RES/79/50 \nNuclear disarmament\n \n24-23073\n2/7 \n \nnuclear weapons and on their destruction, and to conclude such an international \nconvention at an early date,  \n \nRecognizing the urgent need to take concrete practical steps towards achieving \nthe establishment of a world free of nuclear weapons, \n \nBearing in mind paragraph 50 of the Final Document of the Tenth Special \nSession of the General Assembly, the first special session devoted to disarmament, 3 \ncalling for the urgent negotiation of agreements for the cessation of the qualitative \nimprovement and development of nuclear-weapon systems and for a comprehensive \nand phased programme with agreed time frames, wherever feasible, for the \nprogressive and balanced reduction of nuclear weapons and their means of delivery, \nleading to their ultimate and complete elimination at the earliest possible time,  \n \nReaffirming the conviction of the States parties to the Treaty on the \nNon-Proliferation of Nuclear Weapons4 that the Treaty is a cornerstone of nuclear \nnon-proliferation and nuclear disarmament, and the importance of the decision on \nstrengthening the review process for the Treaty, the decision on principles and \nobjectives for nuclear non-proliferation and disarmament, the decision on the \nextension of the Treaty and the resolution on the Middle East, adopted by the 1995 \nReview and Extension Conference of the Parties to the Treaty on the Non-Proliferation \nof Nuclear Weapons,5  \n \nStressing the importance of the 13 steps for the systematic and progressive \nefforts to achieve the objective of nuclear disarmament leading to the total elimination \nof nuclear weapons, as agreed to by the States parties in the Final Document of the \n2000 Review Conference of the Parties to the Treaty on the Non-Proliferation of \nNuclear Weapons,6  \n \nRecognizing the important work done at the 2010 Review Conference of the \nParties to the Treaty on the Non-Proliferation of Nuclear Weapons,7 and affirming its \n22-point action plan on nuclear disarmament as an impetus to intensify work aimed \nat beginning negotiations for a nuclear weapons convention,  \n \nRegretting that the tenth Review Conference of the Parties to the Treaty on the \nNon-Proliferation of Nuclear Weapons, held from 1 to 26 August 2022, and the ninth \nReview Conference, held from 27 April to 22 May 2015, did not reach agreement on \nthe substantive final document,  \n \nReaffirming the continued validity of agreements reached at the 1995 Review \nand Extension Conference and the 2000 and 2010 Review Conferences until all their \nobjectives are achieved, and calling for their full and immediate fulfilment, including \nthe action plan on nuclear disarmament adopted at the 2010 Review Conference,  \n \nReiterating the highest priority accorded to nuclear disarmament in the Final \nDocument of the Tenth Special Session of the General Assembly and by the \ninternational community,  \n__________________ \n \n3 Resolution S-10/2. \n \n4 United Nations, Treaty Series, vol. 729, No. 10485. \n \n5 See 1995 Review and Extension Conference of the Parties to the Treaty on the Non-Proliferation \nof Nuclear Weapons, Final Document, Part I (NPT/CONF.1995/32 (Part I) and \nNPT/CONF.1995/32 (Part I)/Corr.2), annex. \n \n6 2000 Review Conference of the Parties to the Treaty on the Non-Proliferation of Nuclear \nWeapons, Final Document, vol. I (NPT/CONF.2000/28 (Parts I and II)), part I, section entitled \n\u201cArticle VI and eighth to twelfth preambular paragraphs\u201d, para. 15. \n \n7 2010 Review Conference of the Parties to the Treaty on the Non-Proliferation of Nuclear \nWeapons, Final Document, vols. I\u2013III (NPT/CONF.2010/50 (Vol. I), NPT/CONF.2010/50 (Vol. II) \nand NPT/CONF.2010/50 (Vol. III)). \n\nNuclear disarmament \nA/RES/79/50\n \n3/7\n24-23073 \n \n \nReiterating its call for an early entry into force of the Comprehensive Nuclear-\nTest-Ban Treaty,8  \n \nNoting the new strategic arms reduction treaty between the Russian Federation \nand the United States of America, in order to achieve further cuts in their deployed \nand non-deployed strategic nuclear weapons, and stressing that such cuts should be \nirreversible, verifiable and transparent,  \n \nNoting also the statements by nuclear-weapon States of their intention to pursue \nactions in achieving a world free of nuclear weapons, as well as the steps taken to \nreduce the role and number of nuclear weapons, and urging nuclear-weapon States to \ntake further measures for progress on nuclear disarmament within a specified \nframework of time,  \n \nRecognizing the complementarity of bilateral, plurilateral and multilateral \nnegotiations on nuclear disarmament, and that bilateral negotiations can never replace \nmultilateral negotiations in this respect,  \n \nNoting the support expressed in the Conference on Disarmament and in the \nGeneral Assembly for the elaboration of an international convention to assure \nnon-nuclear-weapon States, without exception or discrimination, against the use or \nthreat of use of nuclear weapons under any circumstances, and the multilateral efforts \nin the Conference to reach agreement on such an international convention at an early \ndate,  \n \nRecalling the advisory opinion of the International Court of Justice on the \nlegality of the threat or use of nuclear weapons, issued on 8 July 1996, 9  and \nwelcoming the unanimous reaffirmation by all judges of the Court that there exists an \nobligation for all States to pursue in good faith and bring to a conclusion negotiations \nleading to nuclear disarmament in all its aspects under strict and effective \ninternational control,  \n \nRecalling also paragraph 176 of the Final Document of the Seventeenth \nConference of Heads of State or Government of Non-Aligned Countries, held on \nMargarita Island, Bolivarian Republic of Venezuela, from 13 to 18 September 2016, \nin which the Conference on Disarmament was called upon to agree on a balanced and \ncomprehensive programme of work by, inter alia, establishing an ad hoc committee \non nuclear disarmament as soon as possible and as the highest priority, while the \nnecessity was emphasized of starting negotiations in the Conference on Disarmament, \nwithout further delay, on a comprehensive nuclear weapons convention that sets, \ninter alia, a phased programme for the complete elimination of nuclear weapons \nwithin a specified framework of time,  \n \nNoting the adoption of the programme of work for the 2009 session by the \nConference on Disarmament on 29 May 2009, 10  after years of stalemate, and \nregretting that the Conference did not succeed in reaching consensus on a programme \nof work for its 2024 session,  \n \nReaffirming the proposals submitted by the States members of the Conference \non Disarmament that are members of the Group of 21 on the follow-up to the 2013 \nhigh-level meeting of the General Assembly on nuclear disarmament, pursuant to \nAssembly resolution 68/32 of 5 December 2013, as contained in documents of the \nConference,11  \n__________________ \n \n8 See resolution 50/245 and A/50/1027. \n \n9 A/51/218, annex. \n \n10 See Official Records of the General Assembly, Sixty-fourth Session, Supplement No. 27 \n(A/64/27), para. 18. \n \n11 See CD/1999 and CD/2067. \n\nA/RES/79/50 \nNuclear disarmament\n \n24-23073\n4/7 \n \n \nReaffirming also the importance and validity of the Conference on Disarmament \nas the sole multilateral disarmament negotiating forum, and expressing the need to \nadopt and implement a balanced and comprehensive programme of work on the basis \nof its agenda and dealing with, inter alia, four core issues, in accordance with the \nrules of procedure,12 and by taking into consideration the security concerns of all \nStates,  \n \nReaffirming further the specific mandate conferred upon the Disarmament \nCommission by the General Assembly, in its decision 52/492 of 8 September 1998, \nto discuss the subject of nuclear disarmament as one of its main substantive agenda \nitems,  \n \nRecalling the United Nations Millennium Declaration,13 in which Heads of State \nand Government resolved to strive for the elimination of weapons of mass destruction, \nin particular nuclear weapons, and to keep all options open for achieving that aim, \nincluding the possibility of convening an international conference to identify ways of \neliminating nuclear dangers,  \n \nUnderlining the importance of convening, as a priority, a United Nations high-\nlevel international conference on nuclear disarmament to review the progress made \nin this regard,  \n \nRecalling the high-level meeting of the General Assembly on nuclear \ndisarmament held on 26 September 2013, and the strong support for nuclear \ndisarmament expressed therein,  \n \nRecalling also action 25 of the Pact for the Future,14 in which Heads of State \nand Government decided, inter alia, to recommit to the goal of the total elimination \nof nuclear weapons and seek to accelerate the full and effective implementation of \nrespective nuclear disarmament and non-proliferation obligations and commitments, \n \nWelcoming the commemoration of 26 September as the International Day for \nthe Total Elimination of Nuclear Weapons, devoted to furthering this objective, as \ndeclared by the General Assembly in its resolution 68/32 and subsequently welcomed \nin its resolutions 69/58 of 2 December 2014, 70/34 of 7 December 2015, 71/71 of \n5 December 2016, 72/251 of 24 December 2017, 73/40 of 5 December 2018, 74/54 \nof 19 December 2019, 75/45 of 17 December 2020, 76/36 of 6 December 2021, 77/47 \nof 7 December 2022 and 78/27 of 4 December 2023, \n \nRecalling the declaration of the States members of the Agency for the \nProhibition of Nuclear Weapons in Latin America and the Caribbean on the \nInternational Day for the Total Elimination of Nuclear Weapons, in Mexico City on \n26 September 2024, \n \nExpressing deep concern about the catastrophic humanitarian consequences of \nany use of nuclear weapons,  \n \nRecalling the successful convening of the first, second, third and fourth \nConferences on the Humanitarian Impact of Nuclear Weapons, in Oslo on 4 and \n5 March 2013, in Nayarit, Mexico, on 13 and 14 February 2014, and in Vienna on 8 \nand 9 December 2014 and on 20 June 2022, and recalling also that 127 nations have \nformally endorsed the Humanitarian Pledge issued following the third Conference, 15  \n \nRecalling also the signing by the nuclear-weapon States, namely, China, France, \nthe Russian Federation, the United Kingdom of Great Britain and Northern Ireland \n__________________ \n \n12 CD/8/Rev.9. \n \n13 Resolution 55/2. \n \n14 Resolution 79/1. \n \n15 See CD/2039. \n\nNuclear disarmament \nA/RES/79/50\n \n5/7\n24-23073 \n \nand the United States of America, of the Protocol to the Treaty on a Nuclear-Weapon-\nFree Zone in Central Asia,16 in New York on 6 May 2014,  \n \nRecalling further the proclamation of Latin America and the Caribbean as a \nZone of Peace on 29 January 2014 during the Second Summit of the Community of \nLatin American and Caribbean States, held in Havana on 28 and 29 January 2014,  \n \nWelcoming the entry into force of the Treaty on the Prohibition of Nuclear \nWeapons17 on 22 January 2021 and the successful convening of the second Meeting \nof States Parties to the Treaty in New York from 27 November to 1 December 2023, \nand the ratifications by Indonesia, Sierra Leone and Solomon Islands on 24 September \n2024, \n \nReaffirming that, in accordance with the Charter of the United Nations, States \nshould refrain from the use or threat of use of nuclear weapons in settling their \ndisputes in international relations,  \n \nSeized of the danger of the use of weapons of mass destruction, particularly \nnuclear weapons, in terrorist acts and the urgent need for concerted international \nefforts to control and overcome it,  \n \n1. \nUrges all nuclear-weapon States to take effective disarmament measures \nto achieve the total elimination of all nuclear weapons at the earliest possible time;  \n \n2. \nReaffirms that nuclear disarmament and nuclear non-proliferation are \nsubstantively interrelated and mutually reinforcing, that the two processes must go \nhand in hand and that there is a genuine need for a systematic and progressive process \nof nuclear disarmament;  \n \n3. \nWelcomes and encourages the efforts to establish new nuclear-weapon-\nfree zones in different parts of the world, including the establishment of a Middle East \nzone free of nuclear weapons, on the basis of agreements or arrangements freely \narrived at among the States of the regions concerned, which is an effective measure \nfor limiting the further spread of nuclear weapons geographically and contributes to \nthe cause of nuclear disarmament;  \n \n4. \nEncourages States parties to the Treaty on the South-East Asia Nuclear-\nWeapon-Free Zone18 and the nuclear-weapon States to intensify ongoing efforts to \nresolve all outstanding issues, in accordance with the objectives and principles of the \nTreaty;  \n \n5. \nRecognizes that there is a genuine need to diminish the role of nuclear \nweapons in strategic doctrines and security policies to minimize the risk that these \nweapons will ever be used and to facilitate the process of their total elimination;  \n \n6. \nUrges the nuclear-weapon States to stop immediately the qualitative \nimprovement, development, production and stockpiling of nuclear warheads and their \ndelivery systems;  \n \n7. \nAlso urges the nuclear-weapon States, as an interim measure, to de-alert \nand deactivate immediately their nuclear weapons and to take other concrete measures \nto reduce further the operational status of their nuclear-weapon systems, while \nstressing that reductions in deployments and in operational status cannot substitute \nfor irreversible cuts in and the total elimination of nuclear weapons;  \n__________________ \n \n16 United Nations, Treaty Series, vol. 2970, No. 51633. \n \n17 A/CONF.229/2017/8. \n \n18 United Nations, Treaty Series, vol. 1981, No. 33873. \n\nA/RES/79/50 \nNuclear disarmament\n \n24-23073\n6/7 \n \n \n8. \nReiterates its call upon the nuclear-weapon States to carry out effective \nnuclear disarmament measures with a view to achieving the total elimination of \nnuclear weapons within a specified framework of time;  \n \n9. \nCalls upon the nuclear-weapon States, pending the achievement of the \ntotal elimination of nuclear weapons, to agree on an internationally and legally \nbinding instrument on a joint undertaking not to be the first to use nuclear weapons;  \n \n10. Urges the nuclear-weapon States to commence plurilateral negotiations \namong themselves at an appropriate stage on further deep reductions of their nuclear \nweapons, in an irreversible, verifiable and transparent manner, as an effective \nmeasure of nuclear disarmament;  \n \n11. \nUnderlines the importance of applying the principles of transparency, \nirreversibility and verifiability to the process of nuclear disarmament;  \n \n12. Also underlines the importance of the unequivocal undertaking by the \nnuclear-weapon States, in the Final Document of the 2000 Review Conference of the \nParties to the Treaty on the Non-Proliferation of Nuclear Weapons, to accomplish the \ntotal elimination of their nuclear arsenals leading to nuclear disarmament, to which \nall States parties are committed under article VI of the Treaty, and the reaffirmation \nby the States parties that the total elimination of nuclear weapons is the only absolute \nguarantee against the use or threat of use of nuclear weapons;19  \n \n13. Calls for the full and effective implementation of the 13 practical steps for \nnuclear disarmament contained in the Final Document of the 2000 Review \nConference; \n \n14. Also calls for the full implementation of the action plan as set out in the \nconclusions and recommendations for follow-on actions of the Final Document of the \n2010 Review Conference of the Parties to the Treaty on the Non-Proliferation of \nNuclear Weapons, particularly the 22-point action plan on nuclear disarmament; \n \n15. Urges the nuclear-weapon States to carry out further reductions of \nnon-strategic nuclear weapons, including on unilateral initiatives and as an integral \npart of the nuclear arms reduction and disarmament process;  \n \n16. Calls for the immediate commencement of negotiations in the Conference \non Disarmament, in the context of an agreed, comprehensive and balanced \nprogramme of work, on a non-discriminatory, multilateral and internationally and \neffectively verifiable treaty banning the production of fissile material for nuclear \nweapons or other nuclear explosive devices on the basis of the report of the Special \nCoordinator20 and the mandate contained therein;  \n \n17. Urges the Conference on Disarmament to commence as early as possible \nits substantive work during its 2024 session, on the basis of a comprehensive and \nbalanced programme of work that takes into consideration all the real and existing \npriorities in the field of disarmament and arms control, including the immediate \ncommencement of negotiations on a comprehensive nuclear weapons convention;  \n \n18. Calls for the conclusion of an international legal instrument on \nunconditional security assurances to non-nuclear-weapon States against the threat or \nuse of nuclear weapons under any circumstances;  \n \n19. Also calls for the early entry into force, universalization and strict \nobservance of the Comprehensive Nuclear-Test-Ban Treaty as a contribution to \n__________________ \n \n19 2000 Review Conference of the Parties to the Treaty on the Non-Proliferation of Nuclear \nWeapons, Final Document, vol. I (NPT/CONF.2000/28 (Parts I and II)), part I, section entitled \n\u201cArticle VII and the security of non-nuclear-weapon States\u201d, para. 2. \n \n20 CD/1299. \n\nNuclear disarmament \nA/RES/79/50\n \n7/7\n24-23073 \n \nnuclear disarmament, while welcoming the ratification by Papua New Guinea on \n13 March 2024; \n \n20. Reiterates its call upon the Conference on Disarmament to establish, as \nsoon as possible and as the highest priority, an ad hoc committee on nuclear \ndisarmament in 2024 and to commence negotiations on a phased programme of \nnuclear disarmament leading to the total elimination of nuclear weapons within a \nspecified framework of time;  \n \n21. Calls for the convening, as soon as possible, of a United Nations high-\nlevel international conference on nuclear disarmament to review the progress made \nin this regard;  \n \n22. Requests the Secretary-General to submit to the General Assembly at its \neightieth session a report on the implementation of the present resolution;  \n \n23. Decides to include in the provisional agenda of its eightieth session, under \nthe item entitled \u201cGeneral and complete disarmament\u201d, the sub-item entitled \u201cNuclear \ndisarmament\u201d. \n \n43rd plenary meeting \n2 December 2024 \n \n",
  "paragraphs": {
    "1": "Urges all nuclear-weapon States to take effective disarmament measures to achieve the total elimination of all nuclear weapons at the earliest possible time;",
    "2": "Reaffirms that nuclear disarmament and nuclear non-proliferation are substantively interrelated and mutually reinforcing, that the two processes must go hand in hand and that there is a genuine need for a systematic and progressive process of nuclear disarmament;",
    "3": "Welcomes and encourages the efforts to establish new nuclear-weapon- free zones in different parts of the world, including the establishment of a Middle East zone free of nuclear weapons, on the basis of agreements or arrangements freely arrived at among the States of the regions concerned, which is an effective measure for limiting the further spread of nuclear weapons geographically and contributes to the cause of nuclear disarmament;",
    "4": "Encourages States parties to the Treaty on the South-East Asia Nuclear- Weapon-Free Zone18 and the nuclear-weapon States to intensify ongoing efforts to resolve all outstanding issues, in accordance with the objectives and principles of the Treaty;",
    "5": "Recognizes that there is a genuine need to diminish the role of nuclear weapons in strategic doctrines and security policies to minimize the risk that these weapons will ever be used and to facilitate the process of their total elimination;",
    "6": "Urges the nuclear-weapon States to stop immediately the qualitative improvement, development, production and stockpiling of nuclear warheads and their delivery systems;",
    "7": "Also urges the nuclear-weapon States, as an interim measure, to de-alert and deactivate immediately their nuclear weapons and to take other concrete measures to reduce further the operational status of their nuclear-weapon systems, while stressing that reductions in deployments and in operational status cannot substitute for irreversible cuts in and the total elimination of nuclear weapons; __________________ 16 United Nations, Treaty Series, vol. 2970, No. 51633. 17 A/CONF.229/2017/8. 18 United Nations, Treaty Series, vol. 1981, No. 33873. A/RES/79/50 Nuclear disarmament 24-23073 6/7",
    "8": "Reiterates its call upon the nuclear-weapon States to carry out effective nuclear disarmament measures with a view to achieving the total elimination of nuclear weapons within a specified framework of time;",
    "9": "Calls upon the nuclear-weapon States, pending the achievement of the total elimination of nuclear weapons, to agree on an internationally and legally binding instrument on a joint undertaking not to be the first to use nuclear weapons;",
    "10": "Urges the nuclear-weapon States to commence plurilateral negotiations among themselves at an appropriate stage on further deep reductions of their nuclear weapons, in an irreversible, verifiable and transparent manner, as an effective measure of nuclear disarmament;",
    "11": "Underlines the importance of applying the principles of transparency, irreversibility and verifiability to the process of nuclear disarmament;",
    "12": "Also underlines the importance of the unequivocal undertaking by the nuclear-weapon States, in the Final Document of the 2000 Review Conference of the Parties to the Treaty on the Non-Proliferation of Nuclear Weapons, to accomplish the total elimination of their nuclear arsenals leading to nuclear disarmament, to which all States parties are committed under article VI of the Treaty, and the reaffirmation by the States parties that the total elimination of nuclear weapons is the only absolute guarantee against the use or threat of use of nuclear weapons;19",
    "13": "Calls for the full and effective implementation of the 13 practical steps for nuclear disarmament contained in the Final Document of the 2000 Review Conference;",
    "14": "Also calls for the full implementation of the action plan as set out in the conclusions and recommendations for follow-on actions of the Final Document of the 2010 Review Conference of the Parties to the Treaty on the Non-Proliferation of Nuclear Weapons, particularly the 22-point action plan on nuclear disarmament;",
    "15": "Urges the nuclear-weapon States to carry out further reductions of non-strategic nuclear weapons, including on unilateral initiatives and as an integral part of the nuclear arms reduction and disarmament process;",
    "16": "Calls for the immediate commencement of negotiations in the Conference on Disarmament, in the context of an agreed, comprehensive and balanced programme of work, on a non-discriminatory, multilateral and internationally and effectively verifiable treaty banning the production of fissile material for nuclear weapons or other nuclear explosive devices on the basis of the report of the Special Coordinator20 and the mandate contained therein;",
    "17": "Urges the Conference on Disarmament to commence as early as possible its substantive work during its 2024 session, on the basis of a comprehensive and balanced programme of work that takes into consideration all the real and existing priorities in the field of disarmament and arms control, including the immediate commencement of negotiations on a comprehensive nuclear weapons convention;",
    "18": "Calls for the conclusion of an international legal instrument on unconditional security assurances to non-nuclear-weapon States against the threat or use of nuclear weapons under any circumstances;",
    "19": "Also calls for the early entry into force, universalization and strict observance of the Comprehensive Nuclear-Test-Ban Treaty as a contribution to __________________ 19 2000 Review Conference of the Parties to the Treaty on the Non-Proliferation of Nuclear Weapons, Final Document, vol. I (NPT/CONF.2000/28 (Parts I and II)), part I, section entitled \u201cArticle VII and the security of non-nuclear-weapon States\u201d, para. 2. 20 CD/1299. Nuclear disarmament A/RES/79/50 7/7 24-23073 nuclear disarmament, while welcoming the ratification by Papua New Guinea on 13 March 2024;",
    "20": "Reiterates its call upon the Conference on Disarmament to establish, as soon as possible and as the highest priority, an ad hoc committee on nuclear disarmament in 2024 and to commence negotiations on a phased programme of nuclear disarmament leading to the total elimination of nuclear weapons within a specified framework of time;",
    "21": "Calls for the convening, as soon as possible, of a United Nations high- level international conference on nuclear disarmament to review the progress made in this regard;",
    "22": "Requests the Secretary-General to submit to the General Assembly at its eightieth session a report on the implementation of the present resolution;",
    "23": "Decides to include in the provisional agenda of its eightieth session, under the item entitled \u201cGeneral and complete disarmament\u201d, the sub-item entitled \u201cNuclear disarmament\u201d. 43rd plenary meeting 2 December 2024"
  },
  "agenda_items": [
    "Item 98"
  ],
  "symbol_references": []
}