{
  "symbol": "A/RES/75/27",
  "filename": "A_RES_75_27.pdf",
  "title": "75/27. International Day of Epidemic Preparedness",
  "text": "United Nations \nA/RES/75/27 \n \n \nGeneral Assembly \nDistr.: General \n11 December 2020 \n \n \n20-16516 (E)    181220     \n*2016516* \n \n \nSeventy-fifth session \nAgenda item 131 \nGlobal health and foreign policy \n \n \n \n \n Resolution adopted by the General Assembly on \n7 December 2020 \n \n \n \n \n[without reference to a Main Committee (A/75/L.18 and A/75/L.18/Add.1)] \n \n \n \n75/27. International Day of Epidemic Preparedness \n \n \n \nThe General Assembly, \n \nReaffirming its resolution 70/1 of 25 September 2015, entitled \u201cTransforming \nour world: the 2030 Agenda for Sustainable Development\u201d, in which it adopted a \ncomprehensive, far-reaching and people-centred set of universal and transformative \nSustainable Development Goals and targets, its commitment to working tirelessly for \nthe full implementation of the Agenda by 2030, its recognition that eradicating \npoverty in all its forms and dimensions, including extreme poverty, is the greatest \nglobal challenge and an indispensable requirement for sustainable development, its \ncommitment to achieving sustainable development in its three dimensions \u2013 \neconomic, social and environmental \u2013 in a balanced and integrated manner, and to \nbuilding upon the achievements of the Millennium Development Goals and seeking \nto address their unfinished business,  \n \nReaffirming also its resolutions 53/199 of 15 December 1998 and 61/185 of \n20 December 2006 on the proclamation of international years and Economic and \nSocial Council resolution 1980/67 of 25 July 1980 on international years and \nanniversaries, particularly paragraphs 1 to 10 of the annex thereto on the agreed \ncriteria for the proclamation of international years, as well as paragraphs 13 and 14, \nin which it is stated that an international day or year should not be proclaimed before \nthe basic arrangements for its organization and financing have been made,  \n \nExpressing grave concern at the devastating impacts of major infectious \ndiseases and epidemics, as exemplified by the ongoing coronavirus disease \n(COVID-19) pandemic, on human lives, wreaking havoc on long-term social and \neconomic development, and that global health crises threaten to overwhelm already \noverstretched health systems, disrupt global supply chains and cause disproportionate \ndevastation of the livelihoods of people, including women and children, and the \neconomies of the poorest and most vulnerable countries,  \n\nA/RES/75/27 \nInternational Day of Epidemic Preparedness\n \n20-16516\n2/2 \n \n \nUnderlining the urgency of having resilient and robust health systems, reaching \nthose who are vulnerable or in vulnerable situations, and capable of effectively \nimplementing the International Health Regulations (2005),1  \n \nExpressing deep concern that, with the absence of international attention, future \nepidemics could surpass previous outbreaks in terms of intensity and gravity, and \ntherefore emphasizing the utmost importance of awareness-raising, the exchange of \ninformation, scientific knowledge and best practices, quality education, and advocacy \nprogrammes on epidemics at the local, national, regional and global levels as effective \nmeasures to prevent and respond to epidemics,  \n \nRecognizing the need to strengthen epidemic prevention by applying lessons \nlearned on epidemic management and how to prevent the stoppage of basic services, \nand to raise the level of preparedness in order to have the earliest and most adequate \nresponse to any epidemic that may arise, and recognizing also the value of an \nintegrated One Health approach that fosters cooperation between the human health, \nanimal health and plant health, as well as environmental and other relevant sectors,  \n \nReaffirming the importance of international cooperation and multilateralism in \nresponse to epidemics, and acknowledging the significance of partnership and \nsolidarity among every individual, community and State, and regional and \ninternational organizations, in all stages of epidemic management, as well as the \nimportance of considering a gender perspective in this regard,  \n \nRecognizing the pivotal role of the United Nations system, in particular the \nWorld Health Organization, in coordinating responses to epidemics, in accordance \nwith its mandate, and supporting national, regional and international efforts to \nprevent, mitigate and address the impacts of infectious diseases and epidemics in \naccordance with the goal of advancing the 2030 Agenda,  \n \nAcknowledging the primary role and responsibility of Governments and the \nindispensable contribution of relevant stakeholders in tackling global health \nchallenges, especially women, who make up the majority of the world\u2019s health \nworkers, and underscoring the commitment to ensure inclusive, equal and \nnon-discriminatory participation, with special attention to those who are vulnerable \nor in vulnerable situations with the highest chance of epidemic infection, \n \n1. \nDecides to proclaim 27 December as the International Day of Epidemic \nPreparedness;  \n \n2. \nInvites all Member States, organizations of the United Nations system and \nother global, regional and subregional organizations, the private sector and civil society, \nincluding non-governmental organizations, academic institutions, individuals and \nother relevant stakeholders to observe the International Day of Epidemic Preparedness \nannually in an appropriate manner and in accordance with national contexts and \npriorities, through education and awareness-raising activities, in order to highlight the \nimportance of the prevention of, preparedness for and partnership against epidemics;  \n \n3. \nInvites the World Health Organization to facilitate the observance of the \nInternational Day, in collaboration with other relevant organizations, mindful of the \nprovisions contained in the annex to Economic and Social Council resolution 1980/67;  \n \n4. \nStresses that the cost of all activities that may arise from the \nimplementation of the present resolution should be met from voluntary contributions;  \n \n5. \nRequests the Secretary-General to bring the present resolution to the \nattention of all Member States and organizations of the United Nations system. \n \n36th plenary meeting \n7 December 2020 \n__________________ \n \n1  World Health Organization, document WHA58/2005/REC/1, resolution 58.3, annex. \n",
  "paragraphs": {
    "1": "Decides to proclaim 27 December as the International Day of Epidemic Preparedness;",
    "2": "Invites all Member States, organizations of the United Nations system and other global, regional and subregional organizations, the private sector and civil society, including non-governmental organizations, academic institutions, individuals and other relevant stakeholders to observe the International Day of Epidemic Preparedness annually in an appropriate manner and in accordance with national contexts and priorities, through education and awareness-raising activities, in order to highlight the importance of the prevention of, preparedness for and partnership against epidemics;",
    "3": "Invites the World Health Organization to facilitate the observance of the International Day, in collaboration with other relevant organizations, mindful of the provisions contained in the annex to Economic and Social Council resolution 1980/67;",
    "4": "Stresses that the cost of all activities that may arise from the implementation of the present resolution should be met from voluntary contributions;",
    "5": "Requests the Secretary-General to bring the present resolution to the attention of all Member States and organizations of the United Nations system."
  },
  "agenda_items": [
    "Item 131"
  ],
  "symbol_references": [
    "A/75/L.18"
  ]
}