{
  "symbol": "A/RES/78/157",
  "filename": "A_RES_78_157.pdf",
  "title": "78/157. Ensuring access to affordable, reliable, sustainable and modern energy for all",
  "text": "United Nations \nA/RES/78/157\n \n \nGeneral Assembly \nDistr.: General \n21 December 2023 \n \n23-25895 (E)    030124     \n*2325895* \n \n \nSeventy-eighth session \nAgenda item 18 (h) \nSustainable development: ensuring access to affordable, \nreliable, sustainable and modern energy for all  \n \n \n \n \n Resolution adopted by the General Assembly \non 19 December 2023 \n \n \n \n \n[on the report of the Second Committee (A/78/461/Add.8, para. 7)] \n \n \n 78/157. Ensuring access to affordable, reliable, sustainable and modern \nenergy for all \n \n \n \nThe General Assembly, \n \nRecalling its resolutions 53/7 of 16 October 1998, 54/215 of 22 December 1999, \n55/205 of 20 December 2000, 56/200 of 21 December 2001, 58/210 of 23 December \n2003, 60/199 of 22 December 2005, 62/197 of 19 December 2007, 64/206 of \n21 December 2009, 66/206 of 22 December 2011, 69/225 of 19 December 2014, \n70/201 of 22 December 2015, 71/233 of 21 December 2016, 72/224 of 20 December \n2017, 73/236 of 20 December 2018, 74/225 of 19 December 2019, 75/221 of \n21 December 2020, 76/210 of 17 December 2021 and 77/170 of 14 December 2022, \nas well as its resolutions 65/151 of 20 December 2010 on the International Year of \nSustainable Energy for All and 67/215 of 21 December 2012, in which it decided to \ndeclare 2014\u20132024 the United Nations Decade of Sustainable Energy for All,  \n \nReaffirming its resolution 70/1 of 25 September 2015, entitled \u201cTransforming \nour world: the 2030 Agenda for Sustainable Development\u201d, in which it adopted a \ncomprehensive, far-reaching and people-centred set of universal and transformative \nSustainable Development Goals and targets, its commitment to working tirelessly for \nthe full implementation of the Agenda by 2030, its recognition that eradicating \npoverty in all its forms and dimensions, including extreme poverty, is the greatest \nglobal challenge and an indispensable requirement for sustainable development, its \ncommitment to achieving sustainable development in its three dimensions \u2013 \neconomic, social and environmental \u2013 in a balanced and integrated manner, and to \nbuilding upon the achievements of the Millennium Development Goals and seeking \nto address their unfinished business,  \n \nReaffirming also its resolution 69/313 of 27 July 2015 on the Addis Ababa \nAction Agenda of the Third International Conference on Financing for Development, \nwhich is an integral part of the 2030 Agenda for Sustainable Development, supports \n\nA/RES/78/157 \nEnsuring access to affordable, reliable, sustainable and modern \nenergy for all\n \n23-25895\n2/11 \n \nand complements it, helps to contextualize its means of implementation targets with \nconcrete policies and actions, and reaffirms the strong political commitment to \naddress the challenge of financing and creating an enabling environment at all levels \nfor sustainable development in the spirit of global partnership and solidarity,  \n \nReaffirming further the Paris Agreement1 and its early entry into force, and \nencouraging all its parties to fully implement the Agreement and parties to the United \nNations Framework Convention on Climate Change2 that have not yet done so to \ndeposit their instruments of ratification, acceptance, approval or accession, where \nappropriate, as soon as possible, \n \nRecalling the Climate Ambition Summit convened by the Secretary-General on \n20 September 2023,  \n \nTaking note of the World Investment Report 2023, entitled Investing in \nSustainable Energy for All,  \n \nNoting the establishment by the Secretary-General of the Global Crisis \nResponse Group on Food, Energy and Finance,  \n \nHighlighting the synergies between the 2030 Agenda for Sustainable \nDevelopment and the Paris Agreement,  \n \nRecalling the ministerial declaration of the high-level political forum on \nsustainable development3 held in 2022, which took note of the Secretary-General\u2019s \nproposed global road map for accelerated Sustainable Development Goal 7 action and \nreaffirmed the need to continuously engage on the implementation of Goal 7,  \n \nRecalling also its resolution 77/327 of 25 August 2023, in which it proclaimed \n26 January as the International Day of Clean Energy,  \n \nExpressing concern that, at current rates of progress, none of the global energy \ntargets of the Sustainable Development Goals will be achieved by 2030,  \n \nReaffirming the United Nations Millennium Declaration,4 the Rio Declaration \non Environment and Development5 and Agenda 216 and the principles set out therein, \nand recalling the recommendations and conclusions contained in the Plan of \nImplementation of the World Summit on Sustainable Development (Johannesburg \nPlan of Implementation)7 and the outcome documents of the United Nations \nConference on Sustainable Development, entitled \u201cThe future we want\u201d, 8 the third \nInternational Conference on Small Island Developing States, entitled \u201cSIDS \nAccelerated Modalities of Action (SAMOA) Pathway\u201d, 9 the second United Nations \nConference on Landlocked Developing Countries, entitled \u201cVienna Programme of \nAction for Landlocked Developing Countries for the Decade 2014\u20132024\u201d,10 the \nFourth United Nations Conference on the Least Developed Countries, entitled \n__________________ \n \n1  Adopted under the UNFCCC in FCCC/CP/2015/10/Add.1, decision 1/CP.21. \n \n2  United Nations, Treaty Series, vol. 1771, No. 30822. \n \n3  See Official Records of the General Assembly, Seventy-seventh Session, Supplement No. 3 \n(A/77/3), chap. VI, sect. D. \n \n4  Resolution 55/2. \n \n5  Report of the United Nations Conference on Environment and Development, Rio de Janeiro, \n3\u2013 14 June 1992, vol. I, Resolutions Adopted by the Conference (United Nations publication, \nSales No. E.93.I.8 and corrigendum), resolution 1, annex I. \n \n6  Ibid., annex II. \n \n7  Report of the World Summit on Sustainable Development, Johannesburg, South Africa, \n26 August\u20134 September 2002 (United Nations publication, Sales No. E.03.II.A.1 and \ncorrigendum), chap. I, resolution 2, annex. \n \n8  Resolution 66/288, annex. \n \n9  Resolution 69/15, annex. \n \n10  Resolution 69/137, annex II. \n\nEnsuring access to affordable, reliable, sustainable and modern \nenergy for all \nA/RES/78/157\n \n3/11\n23-25895 \n \n\u201cIstanbul Programme of Action for the Least Developed Countries for the Decade \n2011\u20132020\u201d,11 and the Fifth United Nations Conference on the Least Developed \nCountries, entitled \u201cDoha Programme of Action for the Least Developed Countries\u201d 12 \nfor the decade 2022\u20132031, as well as the New Urban Agenda, adopted at the United \nNations Conference on Housing and Sustainable Urban Development (Habitat III), \nheld in Quito from 17 to 20 October 2016,13 which underlines, inter alia, the \nimportance of energy for cities,  \n \nReaffirming also that each country must take primary responsibility for its own \ndevelopment and that the role of national policies and development strategies cannot \nbe overemphasized in the achievement of sustainable development, and recognizing \nthe need for the creation of an enabling environment at all levels and across all sectors \nfor the achievement of sustainable development,  \n \nReaffirming further the sovereign rights of countries over their energy resources \nand their right to define appropriate policies for the production and use of energy, \nrecognizing that the 2030 Agenda shall be implemented for the full benefit of all, for \ntoday\u2019s generation and for future generations,  \n \nEmphasizing that universal access to affordable, reliable, sustainable and \nmodern energy for all is an integral part of poverty eradication and the achievement \nof the 2030 Agenda, and that the increased use and promotion of clean technologies \nand renewable energy, including in off-grid and decentralized systems, and energy \nefficiency could make a significant contribution in that regard,  \n \nReaffirming the commitment to Sustainable Development Goal 7, which aims at \nensuring affordable, reliable, sustainable and modern energy for all, and stressing the \nuniversality of access to energy, in line with the 2030 Agenda pledge that no one will \nbe left behind,  \n \nDeeply concerned that, while progress towards the achievement of Goal 7 has \nbeen made in some regions of the world, efforts remain well below the scale required \nto meet the Goal by 2030,14  \n \nDeeply concerned also that 2.3 billion people in developing countries, \nespecially in rural areas, rely on traditional biomass, coal and kerosene for cooking \nand heating, with disproportionate health and workload impacts on women, children \nand people in vulnerable situations, including an estimated 4 million premature deaths \nannually, that, while the global population without access to electricity has fallen \nbelow 1 billion, close to 675 million people are still without access to electricity, that \nreliability and affordability remain challenges in many countries, even as the number \nof household connections increases, that Africa accounts for more than half of both \naccess figures and that, even when energy services are available, millions of poor \npeople are unable to pay for them,  \n \nNoting with concern that energy represents less than 1 per cent of overall United \nNations expenditure on the Sustainable Development Goals, despite its critical \nimportance also in achieving other goals,  \n \nNoting with great concern the severe negative impact on human health, safety \nand well-being caused by the coronavirus disease (COVID-19) pandemic, as well as \nthe severe disruption to societies and economies and the devastating impact on lives \nand livelihoods, and that the poorest and most vulnerable are the hardest hit by the \n__________________ \n \n11  Report of the Fourth United Nations Conference on the Least Developed Countries, Istanbul, \nTurkey, 9\u201313 May 2011 (A/CONF.219/7), chap. II. \n \n12  Resolution 76/258, annex. \n \n13  Resolution 71/256, annex. \n \n14  See A/77/211. \n\nA/RES/78/157 \nEnsuring access to affordable, reliable, sustainable and modern \nenergy for all\n \n23-25895\n4/11 \n \npandemic, reaffirming the ambition to get back on track to achieve the Sustainable \nDevelopment Goals by designing and implementing sustainable and inclusive \nrecovery strategies to accelerate progress towards the full implementation of the 2030 \nAgenda for Sustainable Development and to help to reduce the risk of and build \nresilience to future shocks, crises and pandemics, including by strengthening health \nsystems and achieving universal health coverage, and recognizing that equitable and \ntimely access for all to safe, quality, effective and affordable COVID-19 vaccines, \ntherapeutics and diagnostics are an essential part of a global response based on unity, \nsolidarity, renewed multilateral cooperation and the principle of leaving no one \nbehind,  \n \nEmphasizing the critical socioeconomic benefits of affordable, reliable, \nsustainable and modern energy and the need to reframe the understanding of energy \nfrom a technical unit to a requirement for basic social services, including health care, \neconomic development, and poverty eradication,  \n \nRecognizing that affordable, reliable, sustainable and modern energy services \nare essential for effectively responding to and achieving sustainable, inclusive and \nresilient recovery from the COVID-19 pandemic and socioeconomic crises, including \nfor powering health-care and educational facilities, supplying safe drinking water and \nwater for sanitation, including hand-washing, as well as water for agriculture and food \nproduction, supporting sustainable food systems and providing communications and \ndigital services to connect people, share information and facilitate education, and \nfurther recognizing that ensuring access to affordable, reliable, sustainable and \nmodern energy for all contributes to the achievement of the 2030 Agenda and the \nimplementation of other relevant intergovernmentally agreed frameworks in the \neconomic, social and environmental fields and that reaching Sustainable \nDevelopment Goal 7 by the end of the decade requires an urgent and steep rise in \ninvestment in and financing of affordable, reliable, sustainable and modern energy \nand energy efficiency, while noting that the unprecedented crisis caused by the \nCOVID-19 pandemic will have serious impacts on progress towards fulfilling the \ncommitment on ensuring access to affordable, reliable, sustainable and modern \nenergy for all by 2030, and economic disruptions related to the COVID-19 crisis have \nmade it even harder for developing countries to reach Goal 7, noting the \nannouncement of Governments aiming to achieve net-zero emissions, and taking note \nof the findings, in the report of the Secretary-General,15 to put the world on track for \nreaching this objective,  \n \nWelcoming the convening of the United Nations Conference on the Midterm \nComprehensive Review of the Implementation of the Objectives of the International \nDecade for Action, \u201cWater for Sustainable Development\u201d, 2018\u20132028, in New York \nfrom 22 to 24 March 2023,  \n \nHighlighting the importance of the empowerment of developing countries to \nachieve universal access through the rapid expansion of affordable, reliable, \nsustainable and modern energy worldwide,  \n \nHighlighting also the significant efforts made in developing countries that \ncontributed to an increase in the global electrification rate to 91 per cent in 2021, and \nstressing the need to further close the electrification gap in many difficult-to-reach \npopulations, in particular in sub-Saharan Africa,  \n \nRecognizing that each country has primary responsibility for its own economic \nand social development and that this will include the mobilization of financial \nresources, as well as capacity-building and the transfer of environmentally sound \n__________________ \n \n15  A/77/211. \n\nEnsuring access to affordable, reliable, sustainable and modern \nenergy for all \nA/RES/78/157\n \n5/11\n23-25895 \n \ntechnologies to developing countries on mutually agreed terms, including \nconcessional and preferential terms,  \n \nNoting with concern that lack of energy access has remained a challenge for \ndeveloping countries and that sustainable and resilient and inclusive development \nwould be unachievable without ensuring access to affordable, reliable, sustainable \nand modern energy for all,  \n \nWelcoming the increase in the share of renewable energy as a part of total final \nenergy consumption over the past decade and the significant reductions in the cost of \nrenewable energy, the sector\u2019s net positive job contributions and the rapid expansion \nof renewable energy capacity additions, which are now greater than those of other \nresources in the electricity sector, and noting that the levelized cost of solar and wind \nenergy in many regions of the world is fully competitive with or undercuts traditional \nenergy resources,  \n \nNoting with appreciation the work of the International Renewable Energy \nAgency, which facilitates the widespread and increased adoption and sustainable use \nof all forms of renewable energy, \n \nNoting the work of multi-stakeholder partnerships, including Sustainable \nEnergy for All, which has given strong momentum to the promotion of renewable \nenergy and energy efficiency, the initiatives of the Global Climate Action Agenda, the \nSmall Island Developing States Lighthouses Initiative, SIDS DOCK, the Energy \nEfficiency Hub and others that can contribute to reaching the objective of ensuring \naccess to affordable, reliable, sustainable and modern energy for all,  \n \nNoting with appreciation that the transformation of the world\u2019s energy systems \nis being accelerated by advances in technology, rapid declines in the cost of renewable \nenergy, the deployment of least-cost decentralized solutions, policy support, new \nbusiness models and the sharing of best practices, and noting the continuing work of \nthe International Renewable Energy Agency and the International Solar Alliance,  \n \nStressing the need for a coherent, integrated approach to energy issues and the \npromotion of synergies across the global energy agenda, with a focus on eradicating \npoverty and achieving the Sustainable Development Goals,  \n \nReiterating the pledge that no one will be left behind, reaffirming the \nrecognition that the dignity of the human person is fundamental, and the wish to see \nthe Goals and targets met for all nations and peoples and for all segments of society, \nand recommitting to endeavour to reach the furthest behind first,  \n \nNoting that the transitions to affordable, reliable, sustainable and modern energy \nfor all should be just, inclusive, equitable and secure, in line with national \ncircumstances, in order to achieve universal access by 2030, while recognizing the \nneed to increase the share of renewable and clean energy, including as a cooking \nsource in urban areas, to significantly reduce negative health impacts and contribute \nto decreased greenhouse gas emissions and to achieving the goals of the Paris \nAgreement,  \n \n1. \nTakes note of the report of the Secretary-General;16  \n \n2. \nAlso takes note of the role and activities of the International Renewable \nEnergy Agency, in its capacity as an observer of the General Assembly in accordance \nwith resolution 66/110 of 9 December 2011, encouraging the Agency to continue to \nsupport its members in the achievement of their renewable energy objectives, as well \nas the contributions of the International Solar Alliance, including in its capacity as an \nobserver of the General Assembly in accordance with resolution 76/123 of \n__________________ \n \n16  A/78/201. \n\nA/RES/78/157 \nEnsuring access to affordable, reliable, sustainable and modern \nenergy for all\n \n23-25895\n6/11 \n \n9 December 2021, and encouraging its work to collectively address key common \nchallenges to the scaling up of solar energy, as well as the contributions of other \ninternational and regional organizations and forums to the global energy agenda; \n \n3. \nWelcomes the political declaration adopted by the high-level political \nforum on sustainable development convened under the auspices of the General \nAssembly (Sustainable Development Goals Summit),17 held in New York on 18 and \n19 September 2023, and urges timely action to ensure its full implementation; \n \n4. \nNotes with concern the continued decline in international financial flows \nto developing countries in support of clean, sustainable, affordable, reliable, just and \ninclusive energy transitions, recognizes that the achievement of Sustainable \nDevelopment Goal 7 requires an urgent and steep rise in energy investment and \nfinance, including investments in clean technologies and quality infrastructure, and \nin that regard calls upon countries, public and private financial institutions and other \nstakeholders to scale up the provision of finance for developing countries; \n \n5. \nStrongly encourages Governments and other relevant stakeholders to take \nactions to achieve universal access to affordable, reliable, sustainable and modern \nenergy, increase the global share of renewable energy, improve the inclusion of \ndeveloping countries in energy sector cooperation, where relevant, and increase the \nrate of improvement in energy efficiency for a clean, low-emission, low-carbon, \nclimate-resilient, safe, efficient, modern, affordable, reliable and sustainable energy \nsystem, given the systemic sustainable development benefits, while taking into \nconsideration the diversity of national situations, priorities, policies, specific needs \nand challenges and capacities of developing countries, including their energy mix and \nenergy systems; \n \n6. \nCalls for ensuring access to affordable, reliable, sustainable and modern \nenergy for all, as such services are an integral part of poverty eradication measures, \nhuman dignity, quality of life, economic opportunity, the combating of inequality, the \npromotion of health and the prevention of morbidity and mortality, access to \neducation, safe drinking water and sanitation, food security, nutrition, disaster risk \nreduction and resilience, climate change mitigation and adaptation, environmental \nimpact reduction, social inclusion and gender equality, including for persons affected \nby humanitarian emergencies; \n \n7. \nUnderscores the importance of access to cleaner and more efficient and \nsustainable cooking and heating methods, welcomes ongoing efforts, and in this \nregard calls for the promotion of an enabling environment at the national and \ninternational levels for the increased usage of sustainable, cleaner and more efficient \ncooking and heating methods in all countries, in particular developing countries; \n \n8. \nAcknowledges that means of implementation must be significantly \nstrengthened, to enable decisive action and focusing in particular on additional \nfinance and investment in line with target 7.a of the Sustainable Development Goals, \nand agrees that, without a strong push on innovation, new technologies, capacity-\nbuilding and quality data, global efforts to achieve Goal 7 are bound to fail; \n \n9. \nEncourages Governments, the United Nations system and relevant \nstakeholders to leverage the cost-competitiveness of renewable energy, especially in \noff-grid areas, in order to achieve universal energy access, such as by establishing \npolicy frameworks, facilitating investment by domestic and foreign banks and \neducating students, communities, investors and entrepreneurs on renewable energy, \nenergy efficiency and conservation, among other activities, where feasible and \nappropriate; \n__________________ \n \n17  Resolution 78/1. \n\nEnsuring access to affordable, reliable, sustainable and modern \nenergy for all \nA/RES/78/157\n \n7/11\n23-25895 \n \n \n10. Recognizes the role that natural gas can play in supporting transitions \ntowards lower-emission energy systems, and calls upon Governments to enhance and \ncollaborate on energy security, including through the sharing of best practices and \nknowledge for the security of gas supply and demand, in the broader context of the \ntransition towards lower-emission energy systems; \n \n11. \nAlso recognizes the vital role of energy storage, in particular battery energy \nstorage, in supporting transitions towards lower-emission energy systems, by \nintegrating energy sources as well as enhancing grid flexibility, resilience and off-\ngrid energy affordability, and calls upon Governments to collaborate to overcome \nbarriers and accelerate the deployment of these essential technologies while ensuring \nthe sustainable expansion and transition of industries, including that of critical \nminerals, and to facilitate technology transfer on mutually agreed terms to developing \ncountries; \n \n12. Supports energy access in accordance with the national needs of \ndeveloping countries, in particular the least developed countries and small island \ndeveloping States, to tackle their energy access challenges according to the specific \nneeds of each country by mobilizing technical and financial assistance and tools to \ndeploy affordable, reliable, sustainable and modern energy solutions to tackle the \nenergy access deficit; \n \n13. Calls upon Governments to expand the use of renewable energy beyond \nthe power sector, taking into account national priorities and constraints, to industry, \nheating and cooling, construction and infrastructure and, in particular, the transport \nsector, including through sustainable sector coupling, energy storage, carbon capture, \nutilization and storage, sustainable and modern bioenergy and hydrogen in the context \nof sustainable development, including climate change, and calls for supportive policy \ninitiatives and investments at the national and international levels; \n \n14. Recognizes that current global progress in improving energy efficiency \nfalls well below the pace necessary to double the global rate of improvement in energy \nefficiency by 2030, and encourages, in accordance with national laws and regulations, \nthe promotion of widespread energy efficiency initiatives in all economic sectors, the \nadoption and updating of building performance codes and standards, energy \nefficiency labelling, the promotion of energy management systems, the retrofitting of \nexisting buildings and public procurement policies on energy, among other \nmodalities, as appropriate, as well as the prioritization of smart grid systems, district \nenergy systems and community energy plans to improve synergies among clean and \neffective use of traditional resources, renewable energy, energy efficiency and energy \nstorage, which aim to promote the interconnectivity of clean and renewable energy \ninfrastructure and improve energy efficiency; \n \n15. Also recognizes the vast investment needs and the significant challenges \ndeveloping countries face to attract investment for affordable, reliable, sustainable \nand modern energy for all, including the high cost of capital, and calls for multilateral \ndevelopment banks and other international financial institutions to strengthen their \nsupport for just and inclusive energy transitions by, inter alia, mobilizing additional \nfinancing and funds, providing technical assistance, and facilitating knowledge-\nsharing on mutually agreed terms and capacity-building to assist developing \ncountries, and strengthening public-private partnerships, in the context of poverty \neradication and achieving sustainable development; \n \n16. Calls for strengthened cooperation at the regional level to promote \ninnovation and facilitate financing, support regional cross-border power grid \nconnectivity, as appropriate, to advance economic integration and sustainable \ndevelopment and share best practices that are responsive to regional needs with regard \nto Sustainable Development Goal 7 and its interlinkages with the other Goals, and in \n\nA/RES/78/157 \nEnsuring access to affordable, reliable, sustainable and modern \nenergy for all\n \n23-25895\n8/11 \n \nthis regard encourages Governments to reinforce their energy interconnections, \nconnecting regional energy markets and increasing energy security at the global level; \n \n17. Calls upon Governments, as well as relevant international and regional \norganizations and other relevant stakeholders, to combine, as appropriate, the \nincreased use of clean technologies and renewable energy technologies, other low- or \nzero-emissions solutions, more efficient use of energy, energy storage and greater \nreliance on advanced energy technologies, including technologies that avoid, abate \nand remove greenhouse gas emissions, such as carbon capture, utilization and storage \ntechnologies; \n \n18. Encourages \nGovernments, \nrelevant \ninternational \nand \nregional \norganizations and other relevant stakeholders to promote investments in developing \nsustainable, reliable, modern, inclusive and equitable energy systems, inter alia, by \nstrengthening energy systems through cross-border grid connections, as appropriate, \nand to consider incorporating decentralized renewable energy solutions in energy \nplanning, as appropriate, and recognizes that energy transitions will take different \npaths in different parts of the world; \n \n19. Encourages Governments and all relevant stakeholders to increase \ninvestment and actions to support the implementation of Sustainable Development \nGoal 7, and to integrate affordable, reliable, sustainable and modern energy solutions \nto enhance responses to and recovery from COVID-19, in line with resilient, inclusive \nand sustainable development pathways, and to ensure energy security, and urges \ndeveloped countries, relevant international and regional organizations and other \nrelevant stakeholders to support the efforts of developing countries, especially the \npoorest and most vulnerable, taking into consideration the different national \ncircumstances and in line with the national development priorities of developing \ncountries, including through multi-stakeholder partnerships, in order to fulfil the \ncommitment on ensuring access to affordable, reliable, sustainable and modern \nenergy for all by 2030, recognizing that increased investments in affordable, reliable, \nsustainable and modern energy solutions and accelerated action beyond a business-\nas-usual recovery will aid countries in responding to the pandemic and economic \ncrisis, for a sustainable, resilient and inclusive recovery, including by reducing \nemissions, creating jobs and promoting resource efficiency, and in advancing long-\nterm resilience and the Sustainable Development Goals, which are integrated and \ninterrelated; \n \n20. Encourages Governments, relevant international organizations and other \nrelevant stakeholders to use and promote an integrated resource planning and \nmanagement approach in their energy strategies that considers energy choices in the \ncontext of linked sectors, inter alia, water, waste, air quality and food, taking into \naccount national circumstances; \n \n21. Recognizes that sustainable energy access and its deployment can be both \nimproved and accelerated by gender equality and the empowerment of all women and \ngirls, and calls upon Governments, the United Nations development system and other \nstakeholders to increase educational and capacity-building programmes for women in \nthe sector, further advance equal pay and leadership and other opportunities for \nwomen in the energy sector, promote women\u2019s full, equal and meaningful \nparticipation and leadership in the design and implementation of energy policies and \nprogrammes, mainstream a gender perspective in such policies and programmes and \nensure women\u2019s full and equal access to and use of sustainable energy to enhance \ntheir economic and social empowerment, including employment and other income-\ngenerating opportunities; \n \n22. Encourages Governments, with the support of relevant stakeholders, as \nappropriate, to accelerate the transition towards sustainable economies, according to \n\nEnsuring access to affordable, reliable, sustainable and modern \nenergy for all \nA/RES/78/157\n \n9/11\n23-25895 \n \nnational policies and plans, through mitigation and adaptation strategies that improve \nenergy efficiency and create more and better employment opportunities for all, \nincluding young people and women, in wage and self-employment; \n \n23. Emphasizes the potential of sustainable energy use to contribute to climate \nchange mitigation and adaptation, recognizes that increasing the deployment of clean \nand renewable energy and enhancing energy efficiency are components of many \ncountries\u2019 nationally determined contributions under the Paris Agreement adopted \nunder the United Nations Framework Convention on Climate Change, and urges \neffective and timely support for the full implementation of all those contributions, as \napplicable; \n \n24. Notes that the impacts of climate change can also threaten access to and \nthe supply of energy, and also notes the importance of increasing the resilience of the \nenergy sector to climate change, which can be facilitated by the expansion of \nrenewable energy and supporting resilient associated supply chains; \n \n25. Emphasizes, while noting progress, that the large-scale deployment of \nclean energy technologies has been insufficient and uneven, and that support is \nrequired to realize their potential, along with appropriate policy initiatives and \ninvestments at the national and international levels, with Governments working in \ncollaboration with relevant stakeholders, including the private sector; \n \n26. Also emphasizes the value of regional and interregional approaches, which \ncan, among other advantages, enhance the deployment of renewable and sustainable \nenergy by facilitating the sharing of experiences, reduce transaction costs, leverage \neconomies of scale, enable greater cross-border interconnectivity to promote energy \nsystem reliability and resilience and augment domestic capacity-building, and \nrecognizes the work of organizations and initiatives in that regard; \n \n27. Invites all relevant funding institutions and bilateral and multilateral \ndonors, as well as regional funding institutions, the private sector and \nnon-governmental organizations, to continue ongoing efforts and take further action \nto provide financial resources, as appropriate, to support efforts aimed at ensuring \naccess to affordable, reliable, sustainable and modern energy in developing countries \nand countries with economies in transition, including low-emission, low-carbon, \nclimate-resilient clean technologies and renewable resources of energy of \ndemonstrated viability, especially focused on energy access and economic \ndevelopment in both urban and rural areas, while noting the potential catalytic effect \nof concessional and other finance and taking fully into account the development \nstructure of energy-based economies of developing countries; \n \n28. Encourages the development, dissemination, diffusion and transfer of \nenvironmentally sound technologies to developing countries on mutually agreed \nterms, including concessional and preferential terms, and highlights the importance \nof integrating sustainable energy in the Technology Facilitation Mechanism; \n \n29. Stresses the importance of strategies and contributions by Governments \nand relevant stakeholders to multi-stakeholder partnerships in ensuring access to \naffordable, reliable, sustainable and modern energy for all, and encourages \ncoordination and collaboration between the United Nations and relevant \nmulti-stakeholder partnerships and international organizations, such as Sustainable \nEnergy for All; \n \n30. Recognizes the catalytic effect of the sharing of knowledge and \nexperience, capacity-building and technical assistance on sustainable energy \ndeployment, and encourages existing and new efforts to enable Governments of \ndeveloping countries and relevant stakeholders to plan, finance, implement and \n\nA/RES/78/157 \nEnsuring access to affordable, reliable, sustainable and modern \nenergy for all\n \n23-25895\n10/11 \n \nmonitor sustainable energy projects to further strengthen their national institutions \nand capacities; \n \n31. Encourages the development of viable market-oriented strategies that \ncould result in further rapid reductions in the cost of new technologies and renewable \nresources of energy and could further increase the competitiveness of those \ntechnologies, including through the adoption, as appropriate, of public policies for \nresearch, development and market deployment, including phasing out inefficient \nfossil fuel subsidies that encourage wasteful consumption while providing targeted \nsupport to the poor and most vulnerable, in accordance with national circumstances; \n \n32. Emphasizes the value of education, academia, technology and \nentrepreneurship in developing solutions to face energy challenges and achieve \nenergy sustainability, as well as the importance of investing in research and \ndevelopment and demonstrations in sustainable and clean energy technologies, and \nalso emphasizes in this context the urgent need to enhance international cooperation \nto facilitate access to clean energy research and technology, including renewable \nenergy, energy efficiency, hydrogen, energy storage, carbon capture, utilization and \nstorage, bioenergy with carbon capture and storage, and advanced and cleaner fossil-\nfuel technologies, including technologies that avoid, abate and remove greenhouse \ngas emissions, and improved infrastructures for supplying affordable, reliable, \nsustainable and modern energy for all; \n \n33. Calls for national efforts to promote access to affordable, reliable, \nsustainable and modern energy for all and strengthened local engagement to \ncomplement current approaches, and reaffirms the commitment to supporting \nsubnational and local efforts, taking advantage of their direct control, where \napplicable, of local infrastructure and codes to foster uptake in end-use sectors, such \nas residential, commercial and industrial buildings, industry, agriculture, transport, \nwaste and sanitation; \n \n34. Encourages the Secretary-General to continue efforts to promote the \nprovision of stable, adequate and predictable financial resources and technical \nassistance for sustainable energy and to enhance the effectiveness, coordination and \nfull utilization of appropriate international funds for the effective implementation of \nnational and regional high-priority projects for ensuring access to affordable, reliable, \nsustainable and modern energy for all, and recalls the convening of the high-level \ndialogue on the midpoint review of the United Nations Decade of Sustainable Energy \nfor All (2014\u20132024), held on 23 and 24 May 2019; \n \n35. Takes note of the high-level dialogue on energy held on 24 September 2021 \nto promote the implementation of the energy-related goals and targets of the 2030 \nAgenda for Sustainable Development18 in support of the implementation of the United \nNations Decade of Sustainable Energy for All and the voluntary commitments in the \nform of 200 energy compacts, and also takes note of the Secretary-General\u2019s proposed \nroad map for accelerated action on Sustainable Development Goal 7, as described in \nthe report of the Secretary-General,19 and the high-level political forum on sustainable \ndevelopment; \n \n36. Requests the Secretary-General to continue engagement with Member \nStates on the implementation of Sustainable Development Goal 7 in a comprehensive \nand evidence-based manner, as a follow-up to the high-level dialogue on energy and \nthe United Nations Decade of Sustainable Energy for All; \n__________________ \n \n18  Resolution 70/1. \n \n19  A/77/211. \n\nEnsuring access to affordable, reliable, sustainable and modern \nenergy for all \nA/RES/78/157\n \n11/11\n23-25895 \n \n \n37. Recalls its request for the President of the General Assembly to convene a \nglobal stocktaking, funded from extrabudgetary resources, to be held in 2024, \nmarking the completion of the ongoing efforts to implement the plan of action of the \nDecade, and building on the follow-up to the high-level dialogue on energy, to further \naccelerate the implementation of Sustainable Development Goal 7 of the 2030 \nAgenda; \n \n38. Requests the President of the General Assembly, supported by the \nSecretariat and in collaboration with UN-Energy and relevant United Nations system \nentities, to support the preparations for the global stocktaking, including through \nregional and thematic consultations financed through voluntary contributions, so as \nto facilitate intergovernmental dialogues on energy and spur further action and \npartnerships to accelerate the implementation of Sustainable Development Goal 7; \n \n39. Calls upon the United Nations development system to work through \nexisting initiatives and resources and within its mandate with relevant stakeholders, \nsuch as international financial institutions, along with development partners, such as \nmultilateral and regional development banks and the private sector, to address \ncapacity and funding gaps, particularly in developing countries, to scale up energy-\nrelated investments and to provide support to countries in need so as to ensure access \nto affordable, reliable, sustainable and modern energy for all; \n \n40. Encourages UN-Energy to support coherence and coordination among the \nenergy-related activities of the entities of the United Nations development system, \nwithin their respective mandates, and with existing resources in line with the \nimplementation of resolutions 71/243 of 21 December 2016, 72/279 of 31 May 2018 \nand 74/297 of 11 August 2020 and Economic and Social Council resolution 2019/15 \nof 8 July 2019, in order to assist countries, in particular at the country level, inter alia, \nthrough normative support and expertise to the resident coordinator system, upon \nrequest by their Governments, by leveraging partnerships with other international \norganizations, donors and relevant stakeholders, including in their efforts to achieve \nuniversal access to affordable, reliable, sustainable and modern energy for all and to \naccelerate its deployment; \n \n41. Reaffirms the commitment at the very heart of the 2030 Agenda to leave \nno one behind and commit to taking more tangible steps to support people in \nvulnerable situations and the most vulnerable countries and to reach the furthest \nbehind first; \n \n42. Calls upon the Secretary-General to promote renewable energy, energy \nefficiency and related sustainable practices in all United Nations facilities and \noperations around the world, where appropriate and economically viable; \n \n43. Requests the Secretary-General to submit to the General Assembly at its \nseventy-ninth session a report on the implementation of the present resolution, \nincluding activities carried out to mark the United Nations Decade of Sustainable \nEnergy for All, and decides to include in the provisional agenda of its seventy-ninth \nsession, under the item entitled \u201cSustainable development\u201d, the sub-item entitled \n\u201cEnsuring access to affordable, reliable, sustainable and modern energy for all\u201d. \n \n49th plenary meeting \n19 December 2023 \n \n",
  "paragraphs": {
    "1": "Takes note of the report of the Secretary-General;16",
    "2": "Also takes note of the role and activities of the International Renewable Energy Agency, in its capacity as an observer of the General Assembly in accordance with resolution 66/110 of 9 December 2011, encouraging the Agency to continue to support its members in the achievement of their renewable energy objectives, as well as the contributions of the International Solar Alliance, including in its capacity as an observer of the General Assembly in accordance with resolution 76/123 of 9 December 2021, and encouraging its work to collectively address key common challenges to the scaling up of solar energy, as well as the contributions of other international and regional organizations and forums to the global energy agenda;",
    "3": "Welcomes the political declaration adopted by the high-level political forum on sustainable development convened under the auspices of the General Assembly (Sustainable Development Goals Summit),17 held in New York on 18 and 19 September 2023, and urges timely action to ensure its full implementation;",
    "4": "Notes with concern the continued decline in international financial flows to developing countries in support of clean, sustainable, affordable, reliable, just and inclusive energy transitions, recognizes that the achievement of Sustainable Development Goal 7 requires an urgent and steep rise in energy investment and finance, including investments in clean technologies and quality infrastructure, and in that regard calls upon countries, public and private financial institutions and other stakeholders to scale up the provision of finance for developing countries;",
    "5": "Strongly encourages Governments and other relevant stakeholders to take actions to achieve universal access to affordable, reliable, sustainable and modern energy, increase the global share of renewable energy, improve the inclusion of developing countries in energy sector cooperation, where relevant, and increase the rate of improvement in energy efficiency for a clean, low-emission, low-carbon, climate-resilient, safe, efficient, modern, affordable, reliable and sustainable energy system, given the systemic sustainable development benefits, while taking into consideration the diversity of national situations, priorities, policies, specific needs and challenges and capacities of developing countries, including their energy mix and energy systems;",
    "6": "Calls for ensuring access to affordable, reliable, sustainable and modern energy for all, as such services are an integral part of poverty eradication measures, human dignity, quality of life, economic opportunity, the combating of inequality, the promotion of health and the prevention of morbidity and mortality, access to education, safe drinking water and sanitation, food security, nutrition, disaster risk reduction and resilience, climate change mitigation and adaptation, environmental impact reduction, social inclusion and gender equality, including for persons affected by humanitarian emergencies;",
    "7": "Underscores the importance of access to cleaner and more efficient and sustainable cooking and heating methods, welcomes ongoing efforts, and in this regard calls for the promotion of an enabling environment at the national and international levels for the increased usage of sustainable, cleaner and more efficient cooking and heating methods in all countries, in particular developing countries;",
    "8": "Acknowledges that means of implementation must be significantly strengthened, to enable decisive action and focusing in particular on additional finance and investment in line with target 7.a of the Sustainable Development Goals, and agrees that, without a strong push on innovation, new technologies, capacity- building and quality data, global efforts to achieve Goal 7 are bound to fail;",
    "9": "Encourages Governments, the United Nations system and relevant stakeholders to leverage the cost-competitiveness of renewable energy, especially in off-grid areas, in order to achieve universal energy access, such as by establishing policy frameworks, facilitating investment by domestic and foreign banks and educating students, communities, investors and entrepreneurs on renewable energy, energy efficiency and conservation, among other activities, where feasible and appropriate;",
    "10": "Recognizes the role that natural gas can play in supporting transitions towards lower-emission energy systems, and calls upon Governments to enhance and collaborate on energy security, including through the sharing of best practices and knowledge for the security of gas supply and demand, in the broader context of the transition towards lower-emission energy systems;",
    "11": "Also recognizes the vital role of energy storage, in particular battery energy storage, in supporting transitions towards lower-emission energy systems, by integrating energy sources as well as enhancing grid flexibility, resilience and off- grid energy affordability, and calls upon Governments to collaborate to overcome barriers and accelerate the deployment of these essential technologies while ensuring the sustainable expansion and transition of industries, including that of critical minerals, and to facilitate technology transfer on mutually agreed terms to developing countries;",
    "12": "Supports energy access in accordance with the national needs of developing countries, in particular the least developed countries and small island developing States, to tackle their energy access challenges according to the specific needs of each country by mobilizing technical and financial assistance and tools to deploy affordable, reliable, sustainable and modern energy solutions to tackle the energy access deficit;",
    "13": "Calls upon Governments to expand the use of renewable energy beyond the power sector, taking into account national priorities and constraints, to industry, heating and cooling, construction and infrastructure and, in particular, the transport sector, including through sustainable sector coupling, energy storage, carbon capture, utilization and storage, sustainable and modern bioenergy and hydrogen in the context of sustainable development, including climate change, and calls for supportive policy initiatives and investments at the national and international levels;",
    "14": "Recognizes that current global progress in improving energy efficiency falls well below the pace necessary to double the global rate of improvement in energy efficiency by 2030, and encourages, in accordance with national laws and regulations, the promotion of widespread energy efficiency initiatives in all economic sectors, the adoption and updating of building performance codes and standards, energy efficiency labelling, the promotion of energy management systems, the retrofitting of existing buildings and public procurement policies on energy, among other modalities, as appropriate, as well as the prioritization of smart grid systems, district energy systems and community energy plans to improve synergies among clean and effective use of traditional resources, renewable energy, energy efficiency and energy storage, which aim to promote the interconnectivity of clean and renewable energy infrastructure and improve energy efficiency;",
    "15": "Also recognizes the vast investment needs and the significant challenges developing countries face to attract investment for affordable, reliable, sustainable and modern energy for all, including the high cost of capital, and calls for multilateral development banks and other international financial institutions to strengthen their support for just and inclusive energy transitions by, inter alia, mobilizing additional financing and funds, providing technical assistance, and facilitating knowledge- sharing on mutually agreed terms and capacity-building to assist developing countries, and strengthening public-private partnerships, in the context of poverty eradication and achieving sustainable development;",
    "16": " this regard encourages Governments to reinforce their energy interconnections, connecting regional energy markets and increasing energy security at the global level;",
    "17": "Calls upon Governments, as well as relevant international and regional organizations and other relevant stakeholders, to combine, as appropriate, the increased use of clean technologies and renewable energy technologies, other low- or zero-emissions solutions, more efficient use of energy, energy storage and greater reliance on advanced energy technologies, including technologies that avoid, abate and remove greenhouse gas emissions, such as carbon capture, utilization and storage technologies;",
    "18": "Encourages Governments, relevant international and regional organizations and other relevant stakeholders to promote investments in developing sustainable, reliable, modern, inclusive and equitable energy systems, inter alia, by strengthening energy systems through cross-border grid connections, as appropriate, and to consider incorporating decentralized renewable energy solutions in energy planning, as appropriate, and recognizes that energy transitions will take different paths in different parts of the world;",
    "19": "Encourages Governments and all relevant stakeholders to increase investment and actions to support the implementation of Sustainable Development Goal 7, and to integrate affordable, reliable, sustainable and modern energy solutions to enhance responses to and recovery from COVID-19, in line with resilient, inclusive and sustainable development pathways, and to ensure energy security, and urges developed countries, relevant international and regional organizations and other relevant stakeholders to support the efforts of developing countries, especially the poorest and most vulnerable, taking into consideration the different national circumstances and in line with the national development priorities of developing countries, including through multi-stakeholder partnerships, in order to fulfil the commitment on ensuring access to affordable, reliable, sustainable and modern energy for all by 2030, recognizing that increased investments in affordable, reliable, sustainable and modern energy solutions and accelerated action beyond a business- as-usual recovery will aid countries in responding to the pandemic and economic crisis, for a sustainable, resilient and inclusive recovery, including by reducing emissions, creating jobs and promoting resource efficiency, and in advancing long- term resilience and the Sustainable Development Goals, which are integrated and interrelated;",
    "20": "Encourages Governments, relevant international organizations and other relevant stakeholders to use and promote an integrated resource planning and management approach in their energy strategies that considers energy choices in the context of linked sectors, inter alia, water, waste, air quality and food, taking into account national circumstances;",
    "21": "Recognizes that sustainable energy access and its deployment can be both improved and accelerated by gender equality and the empowerment of all women and girls, and calls upon Governments, the United Nations development system and other stakeholders to increase educational and capacity-building programmes for women in the sector, further advance equal pay and leadership and other opportunities for women in the energy sector, promote women\u2019s full, equal and meaningful participation and leadership in the design and implementation of energy policies and programmes, mainstream a gender perspective in such policies and programmes and ensure women\u2019s full and equal access to and use of sustainable energy to enhance their economic and social empowerment, including employment and other income- generating opportunities;",
    "22": " national policies and plans, through mitigation and adaptation strategies that improve energy efficiency and create more and better employment opportunities for all, including young people and women, in wage and self-employment;",
    "23": "Emphasizes the potential of sustainable energy use to contribute to climate change mitigation and adaptation, recognizes that increasing the deployment of clean and renewable energy and enhancing energy efficiency are components of many countries\u2019 nationally determined contributions under the Paris Agreement adopted under the United Nations Framework Convention on Climate Change, and urges effective and timely support for the full implementation of all those contributions, as applicable;",
    "24": "Notes that the impacts of climate change can also threaten access to and the supply of energy, and also notes the importance of increasing the resilience of the energy sector to climate change, which can be facilitated by the expansion of renewable energy and supporting resilient associated supply chains;",
    "25": "Emphasizes, while noting progress, that the large-scale deployment of clean energy technologies has been insufficient and uneven, and that support is required to realize their potential, along with appropriate policy initiatives and investments at the national and international levels, with Governments working in collaboration with relevant stakeholders, including the private sector;",
    "26": "Also emphasizes the value of regional and interregional approaches, which can, among other advantages, enhance the deployment of renewable and sustainable energy by facilitating the sharing of experiences, reduce transaction costs, leverage economies of scale, enable greater cross-border interconnectivity to promote energy system reliability and resilience and augment domestic capacity-building, and recognizes the work of organizations and initiatives in that regard;",
    "27": "Invites all relevant funding institutions and bilateral and multilateral donors, as well as regional funding institutions, the private sector and non-governmental organizations, to continue ongoing efforts and take further action to provide financial resources, as appropriate, to support efforts aimed at ensuring access to affordable, reliable, sustainable and modern energy in developing countries and countries with economies in transition, including low-emission, low-carbon, climate-resilient clean technologies and renewable resources of energy of demonstrated viability, especially focused on energy access and economic development in both urban and rural areas, while noting the potential catalytic effect of concessional and other finance and taking fully into account the development structure of energy-based economies of developing countries;",
    "28": "Encourages the development, dissemination, diffusion and transfer of environmentally sound technologies to developing countries on mutually agreed terms, including concessional and preferential terms, and highlights the importance of integrating sustainable energy in the Technology Facilitation Mechanism;",
    "29": "Stresses the importance of strategies and contributions by Governments and relevant stakeholders to multi-stakeholder partnerships in ensuring access to affordable, reliable, sustainable and modern energy for all, and encourages coordination and collaboration between the United Nations and relevant multi-stakeholder partnerships and international organizations, such as Sustainable Energy for All;",
    "30": " monitor sustainable energy projects to further strengthen their national institutions and capacities;",
    "31": "Encourages the development of viable market-oriented strategies that could result in further rapid reductions in the cost of new technologies and renewable resources of energy and could further increase the competitiveness of those technologies, including through the adoption, as appropriate, of public policies for research, development and market deployment, including phasing out inefficient fossil fuel subsidies that encourage wasteful consumption while providing targeted support to the poor and most vulnerable, in accordance with national circumstances;",
    "32": "Emphasizes the value of education, academia, technology and entrepreneurship in developing solutions to face energy challenges and achieve energy sustainability, as well as the importance of investing in research and development and demonstrations in sustainable and clean energy technologies, and also emphasizes in this context the urgent need to enhance international cooperation to facilitate access to clean energy research and technology, including renewable energy, energy efficiency, hydrogen, energy storage, carbon capture, utilization and storage, bioenergy with carbon capture and storage, and advanced and cleaner fossil- fuel technologies, including technologies that avoid, abate and remove greenhouse gas emissions, and improved infrastructures for supplying affordable, reliable, sustainable and modern energy for all;",
    "33": "Calls for national efforts to promote access to affordable, reliable, sustainable and modern energy for all and strengthened local engagement to complement current approaches, and reaffirms the commitment to supporting subnational and local efforts, taking advantage of their direct control, where applicable, of local infrastructure and codes to foster uptake in end-use sectors, such as residential, commercial and industrial buildings, industry, agriculture, transport, waste and sanitation;",
    "34": "Encourages the Secretary-General to continue efforts to promote the provision of stable, adequate and predictable financial resources and technical assistance for sustainable energy and to enhance the effectiveness, coordination and full utilization of appropriate international funds for the effective implementation of national and regional high-priority projects for ensuring access to affordable, reliable, sustainable and modern energy for all, and recalls the convening of the high-level dialogue on the midpoint review of the United Nations Decade of Sustainable Energy for All (2014\u20132024), held on 23 and 24 May 2019;",
    "35": "Takes note of the high-level dialogue on energy held on 24 September 2021 to promote the implementation of the energy-related goals and targets of the 2030 Agenda for Sustainable Development18 in support of the implementation of the United Nations Decade of Sustainable Energy for All and the voluntary commitments in the form of 200 energy compacts, and also takes note of the Secretary-General\u2019s proposed road map for accelerated action on Sustainable Development Goal 7, as described in the report of the Secretary-General,19 and the high-level political forum on sustainable development;",
    "36": "Requests the Secretary-General to continue engagement with Member States on the implementation of Sustainable Development Goal 7 in a comprehensive and evidence-based manner, as a follow-up to the high-level dialogue on energy and the United Nations Decade of Sustainable Energy for All;",
    "37": "Recalls its request for the President of the General Assembly to convene a global stocktaking, funded from extrabudgetary resources, to be held in 2024, marking the completion of the ongoing efforts to implement the plan of action of the Decade, and building on the follow-up to the high-level dialogue on energy, to further accelerate the implementation of Sustainable Development Goal 7 of the 2030 Agenda;",
    "38": "Requests the President of the General Assembly, supported by the Secretariat and in collaboration with UN-Energy and relevant United Nations system entities, to support the preparations for the global stocktaking, including through regional and thematic consultations financed through voluntary contributions, so as to facilitate intergovernmental dialogues on energy and spur further action and partnerships to accelerate the implementation of Sustainable Development Goal 7;",
    "39": "Calls upon the United Nations development system to work through existing initiatives and resources and within its mandate with relevant stakeholders, such as international financial institutions, along with development partners, such as multilateral and regional development banks and the private sector, to address capacity and funding gaps, particularly in developing countries, to scale up energy- related investments and to provide support to countries in need so as to ensure access to affordable, reliable, sustainable and modern energy for all;",
    "40": "Encourages UN-Energy to support coherence and coordination among the energy-related activities of the entities of the United Nations development system, within their respective mandates, and with existing resources in line with the implementation of resolutions 71/243 of 21 December 2016, 72/279 of 31 May 2018 and 74/297 of 11 August 2020 and Economic and Social Council resolution 2019/15 of 8 July 2019, in order to assist countries, in particular at the country level, inter alia, through normative support and expertise to the resident coordinator system, upon request by their Governments, by leveraging partnerships with other international organizations, donors and relevant stakeholders, including in their efforts to achieve universal access to affordable, reliable, sustainable and modern energy for all and to accelerate its deployment;",
    "41": "Reaffirms the commitment at the very heart of the 2030 Agenda to leave no one behind and commit to taking more tangible steps to support people in vulnerable situations and the most vulnerable countries and to reach the furthest behind first;",
    "42": "Calls upon the Secretary-General to promote renewable energy, energy efficiency and related sustainable practices in all United Nations facilities and operations around the world, where appropriate and economically viable;",
    "43": "Requests the Secretary-General to submit to the General Assembly at its seventy-ninth session a report on the implementation of the present resolution, including activities carried out to mark the United Nations Decade of Sustainable Energy for All, and decides to include in the provisional agenda of its seventy-ninth session, under the item entitled \u201cSustainable development\u201d, the sub-item entitled \u201cEnsuring access to affordable, reliable, sustainable and modern energy for all\u201d."
  },
  "agenda_items": [
    "Item 18"
  ],
  "symbol_references": []
}