{
  "symbol": "A/RES/75/309",
  "filename": "A_RES_75_309.pdf",
  "title": "75/309. Promoting interreligious and intercultural dialogue and tolerance in countering hate speech",
  "text": "United Nations \nA/RES/75/309\n \n \nGeneral Assembly \nDistr.: General \n22 July 2021 \n \n21-10119 (E)    280721 \n*2110119* \n \n \nSeventy-fifth session \nAgenda item 15 \nCulture of peace \n \n \n \n \n Resolution adopted by the General Assembly \non 21 July 2021 \n \n \n \n \n[without reference to a Main Committee (A/75/L.115 and A/75/L.115/Add.1)] \n \n \n 75/309. Promoting interreligious and intercultural dialogue and tolerance \nin countering hate speech \n \n \n \nThe General Assembly,  \n \nReaffirming the commitment made by all Member States under the Charter of \nthe United Nations to promote and encourage universal respect for and observance of \nall human rights and fundamental freedoms without distinction as to, inter alia, \nreligion or belief,  \n \nRecalling article 18 of the International Covenant on Civil and Political Rights, 1 \narticle 18 of the Universal Declaration of Human Rights 2 and other relevant human \nrights provisions, \n \nRecalling also its resolution 36/55 of 25 November 1981, by which it \nproclaimed the Declaration on the Elimination of All Forms of Intolerance and of \nDiscrimination Based on Religion or Belief, \n \nRecognizing the importance of the Declaration and Programme of Action on a \nCulture of Peace, 3  which serve as the universal mandate for the international \ncommunity, particularly the United Nations system, for the promotion of a culture of \npeace and non-violence that benefits humanity, in particular future generations,  \n \nReaffirming the obligation of Member States to prohibit discrimination and \nviolence on the basis of religion or belief and to implement measures to guarantee the \nequal and effective protection of the law, \n__________________ \n \n1  See resolution 2200 A (XXI), annex. \n \n2  Resolution 217 A (III). \n \n3  Resolutions 53/243 A and B. \n\nA/RES/75/309 \nPromoting interreligious and intercultural dialogue and tolerance \nin countering hate speech\n \n21-10119\n2/5 \n \n \nWelcoming, in this regard, all international, regional and national initiatives, as \nwell as efforts by religious and other leaders to promote interreligious and \nintercultural dialogue, \n \nReaffirming the positive role that the exercise of the right to freedom of opinion \nand expression and full respect for the freedom to seek, receive and impart \ninformation can play in strengthening democracy and combating religious \nintolerance, and reaffirming further that the exercise of the right to freedom of \nexpression carries with it special duties and responsibilities, in accordance with \narticle 19 of the International Covenant on Civil and Political Rights, \n \nRecalling article 20 (2) of the International Covenant on Civil and Political \nRights, which states that any advocacy of national, racial or religious hatred that \nconstitutes incitement to discrimination, hostility or violence shall be prohibited by \nlaw,  \n \nRecognizing the commitment of all religions to peace and the contribution that \ninterreligious and intercultural dialogue among religions, groups and individuals, in \nparticular religious leaders, can make towards an improved awareness and \nunderstanding of the common values shared by all humankind,  \n \nStrongly deploring all acts of violence against persons on the basis of their \nreligion or belief, as well as any such acts directed against their homes, businesses, \nproperties, schools, cultural centres or places of worship, as well as all attacks on and \nin religious places, sites and shrines that are in violation of international law,  \n \nExpressing concern at the growing manifestations of intolerance based on \nreligion or belief, which can generate hatred and violence among individuals from \nand within different nations and which may have serious implications at the national, \nregional and international levels, and in this regard emphasizing the importance of \nrespect for religious and cultural diversity, as well as interreligious, interfaith and \nintercultural dialogue aimed at promoting a culture of tolerance and respect among \nindividuals, societies and nations, \n \nNoting with appreciation the efforts of the United Nations system in helping to \ncounter the proliferation of hate speech, misinformation and disinformation, \nincluding during the coronavirus disease (COVID-19) pandemic, by sharing accurate, \ntimely, relevant and multilingual information, as reflected in the COVID-19 \ncommunications response initiative of the Department of Global Communications of \nthe Secretariat,  \n \nBearing in mind the International Day Commemorating the Victims of Acts of \nViolence Based on Religion or Belief, which contributes to the promotion of \ninterreligious and intercultural dialogue, \n \nExpressing deep concern at all acts of hate speech that undermine the spirit of \ntolerance and respect for diversity and constitute a serious common concern for all \nMember States, and convinced that there is no justification for hate speech, whatever \nbe the motivation,  \n \nHighlighting the global concerns about the exponential spread and proliferation \nof hate speech, disinformation and misinformation, thereby increasing the need for \nthe dissemination of factual, timely, targeted, clear, accessible, multilingual and \nscience-based information, and emphasizing the need for all Member States to stand \ntogether to address the challenge of disinformation and misinformation,  \n \nTaking note of the Cross-Regional Statement on \u201cInfodemic\u201d in the Context of \nCOVID-19 that called upon Member States to fight the \u201cinfodemic\u201d to build a \nhealthier, more equitable, just and resilient world, \n\nPromoting interreligious and intercultural dialogue and tolerance \nin countering hate speech \nA/RES/75/309\n \n3/5\n21-10119 \n \n \nEmphasizing that Member States, regional organizations, national human rights \ninstitutions, the private sector, non-governmental organizations, religious bodies, the \nmedia, and civil society as a whole have an important role to play in promoting \ntolerance and respect for religious and cultural diversity and in the universal \npromotion and protection of human rights, including freedom of religion or belief, \n \nRecognizing the role played by many religious leaders and faith-based \norganizations, through speaking out against hate speech, misinformation and \ndisinformation, expressing solidarity with those targeted by such expressions, and \namplifying messages that serve to reduce discrimination and stigma,  \n \nRecognizing also the leading role of the United Nations Educational, Scientific \nand Cultural Organization and the work of the United Nations Alliance of \nCivilizations in promoting intercultural dialogue and their contribution to \ninterreligious dialogue, as well as their activities related to the culture of peace and \nnon-violence and their focus on concrete actions at the global, regional and \nsubregional levels, \n \nNoting the role of the Special Adviser to the Secretary-General on the \nPrevention of Genocide, in the launch of the United Nations Strategy and Plan of \nAction on Hate Speech, and as part of efforts to address and counter hate speech, \n \nNoting also the Rabat Plan of Action on the prohibition of advocacy of national, \nracial or religious hatred that constitutes incitement to discrimination, hostility or \nviolence,4  \n \nNoting further the Plan of Action for Religious Leaders and Actors to Prevent \nIncitement to Violence that Could Lead to Atrocity Crimes, also called the Fez Plan \nof Action, and the Plan of Action to Safeguard Religious Sites, \n \nNoting the Secretary General\u2019s special appeal to religious leaders to join forces, \nwork for peace and focus on the world\u2019s common battle to defeat COVID-19, the \nUnited Nations Guidance Note on Addressing and Countering COVID-19-related \nHate Speech and the \u201cCall for mutual respect\u201d by the High Representative for the \nUnited Nations Alliance of Civilizations, \n \nRecognizing that cultural diversity and the pursuit of cultural development by \nall peoples and nations are sources of mutual enrichment for the cultural life of \nhumankind,  \n \n1. \nRecognizes the importance of interreligious and intercultural dialogue and \nits valuable contribution to promoting social cohesion, peace and development, and \ncalls upon Member States to consider, as appropriate and where applicable, \ninterreligious and intercultural dialogue as an important tool in efforts aimed at \nachieving peace and social stability and the full realization of internationally agreed \ndevelopment goals; \n \n2. \nDecides to proclaim 18 June as the International Day for Countering Hate \nSpeech, to be observed annually;  \n \n3. \nInvites all Member States, organizations and agencies of the United \nNations system, other international and regional organizations and civil society \norganizations, non-governmental organizations, academic institutions, the private \nsector, individuals and other relevant stakeholders to observe the International Day \nfor Countering Hate Speech, as appropriate, with the cost covered exclusively by \nvoluntary contributions; \n__________________ \n \n4  A/HRC/22/17/Add.4, appendix. \n\nA/RES/75/309 \nPromoting interreligious and intercultural dialogue and tolerance \nin countering hate speech\n \n21-10119\n4/5 \n \n \n4. \nInvites all Member States to further promote the culture of peace to help \nto ensure peace and sustainable development, including through the celebration of the \ninternational, regional and national days in this regard and by mobilizing the efforts \nof the international community to promote peace, tolerance, inclusion, understanding \nand solidarity;  \n \n5. \nCondemns any advocacy of hatred that constitutes incitement to \ndiscrimination, hostility or violence, whether it involves the use of print, audiovisual \nor electronic media, social media or any other means; \n \n6. \nExpresses its concern that incidents of racial and religious intolerance, \ndiscrimination and related violence, as well as of negative racial and religious \nstereotyping, continue to rise around the world, and condemns, in this context, any \nadvocacy of national, racial or religious hatred that constitutes incitement to \ndiscrimination, hostility or violence, and urges States to take effective measures, \nconsistent with their obligations under international human rights law, to address and \ncombat such incidents;  \n \n7. \nEmphasizes that freedom of religion or belief, freedom of opinion and \nexpression, the right to peaceful assembly and the right to freedom of association are \ninterdependent, interrelated and mutually reinforcing, and stresses the role that these \nrights can play in the fight against all forms of intolerance and of discrimination based \non religion or belief;  \n \n8. \nTakes note of the United Nations Strategy and Plan of Action on Hate \nSpeech, in which it is proposed that the United Nations system establish and \nstrengthen partnerships with new and traditional media to promote the values of \ntolerance, non-discrimination, pluralism and freedom of opinion and expression, and \nto address hate speech narratives; \n \n9. \nEncourages Member States to consider, as and where appropriate, \ninitiatives that identify areas for practical action in all sectors and levels of society \nfor the promotion of interreligious and intercultural dialogue, tolerance, \nunderstanding and cooperation; \n \n10. Calls upon Member States to engage with all relevant stakeholders to \npromote the virtues of interreligious and intercultural dialogue, respect and \nacceptance of differences, tolerance, respect for diversity, peaceful coexistence and \ncohabitation, inclusion and respect for human rights, to reject the spread of hate \nspeech, that constitutes incitement to discrimination, hostility and violence; \n \n11. Encourages all Member States and international organizations to generate \npublic awareness, to enlighten the public about the dangers of intolerance and \nsectarian violence and to react with renewed commitment and action in support of the \npromotion of tolerance and human rights, and invites them to continue to pay attention \nto the importance of mutual cooperation, understanding and dialogue in ensuring the \npromotion of moderation and tolerance, and respect for human rights; \n \n12. Requests the President of the General Assembly to convene an informal \nhigh-level meeting, on 18 June 2022, to mark the commemoration of the first \nInternational Day for Countering Hate Speech to contribute to spearheading political \nsupport to develop strategies to identify, address and counter hate speech at the \nnational and global levels, taking into account, as appropriate, the United Nations \nStrategy and Plan of Action on Hate Speech;  \n \n13. Encourages Member States to focus on promoting interreligious and \nintercultural dialogue, respect for diversity, and the elimination of discrimination \nbased on religion or belief, while underlining the importance of education, culture, \npeace, tolerance, mutual understanding and human rights; \n\nPromoting interreligious and intercultural dialogue and tolerance \nin countering hate speech \nA/RES/75/309\n \n5/5\n21-10119 \n \n \n14. Invites Member States to support, in accordance with relevant \ninternational obligations, transparent and accessible systems to identify, track, collect \ndata and analyse trends on hate speech, both in person and in digital contexts, at all \nnational levels, as appropriate, to support effective responses; \n \n15. Also invites Member States to further promote reconciliation to help \nensure durable peace and sustainable development, and to encourage religious and \ncommunity leaders to engage in intra- and interfaith dialogue to respond to incitement \nto violence, discrimination and hate speech; \n \n16. Calls upon Member States, who have the primary responsibility to counter \ndiscrimination and hate speech, and all relevant actors, including political and \nreligious leaders, to promote inclusion and unity in response to the COVID-19 \npandemic and to speak out and take strong action against racism, xenophobia, hate \nspeech, violence, discrimination, including on the basis of age, and stigmatization;  \n \n17. Welcomes the proclamation of the first week of February of every year as \nthe World Interfaith Harmony Week between all religions, faiths and beliefs; \n \n18. Takes note of global efforts to support implementing the Secretary-\nGeneral\u2019s Plan of Action for Religious Leaders and Actors to Prevent Incitement to \nViolence that Could Lead to Atrocity Crimes, also called the Fez Plan of Action, the \nSecretary-General\u2019s Strategy and Plan of Action on Hate Speech and the Secretary- \nGeneral\u2019s Plan of Action to Safeguard Religious Sites; \n \n19. Invites all Member States, the United Nations system, regional and \nnon-governmental organizations and other relevant stakeholders to increase their \nunderstanding of the Plan of Action for Religious Leaders and Actors to Prevent \nIncitement to Violence that Could Lead to Atrocity Crimes, also called the Fez Plan \nof Action, and the Plan of Action on Hate Speech, and other initiatives promoting \ntolerance and mutual understanding. \n \n92nd plenary meeting \n21 July 2021 \n \n",
  "paragraphs": {
    "1": "Recognizes the importance of interreligious and intercultural dialogue and its valuable contribution to promoting social cohesion, peace and development, and calls upon Member States to consider, as appropriate and where applicable, interreligious and intercultural dialogue as an important tool in efforts aimed at achieving peace and social stability and the full realization of internationally agreed development goals;",
    "2": "Decides to proclaim 18 June as the International Day for Countering Hate Speech, to be observed annually;",
    "3": "Invites all Member States, organizations and agencies of the United Nations system, other international and regional organizations and civil society organizations, non-governmental organizations, academic institutions, the private sector, individuals and other relevant stakeholders to observe the International Day for Countering Hate Speech, as appropriate, with the cost covered exclusively by voluntary contributions;",
    "4": "Invites all Member States to further promote the culture of peace to help to ensure peace and sustainable development, including through the celebration of the international, regional and national days in this regard and by mobilizing the efforts of the international community to promote peace, tolerance, inclusion, understanding and solidarity;",
    "5": "Condemns any advocacy of hatred that constitutes incitement to discrimination, hostility or violence, whether it involves the use of print, audiovisual or electronic media, social media or any other means;",
    "6": "Expresses its concern that incidents of racial and religious intolerance, discrimination and related violence, as well as of negative racial and religious stereotyping, continue to rise around the world, and condemns, in this context, any advocacy of national, racial or religious hatred that constitutes incitement to discrimination, hostility or violence, and urges States to take effective measures, consistent with their obligations under international human rights law, to address and combat such incidents;",
    "7": "Emphasizes that freedom of religion or belief, freedom of opinion and expression, the right to peaceful assembly and the right to freedom of association are interdependent, interrelated and mutually reinforcing, and stresses the role that these rights can play in the fight against all forms of intolerance and of discrimination based on religion or belief;",
    "8": "Takes note of the United Nations Strategy and Plan of Action on Hate Speech, in which it is proposed that the United Nations system establish and strengthen partnerships with new and traditional media to promote the values of tolerance, non-discrimination, pluralism and freedom of opinion and expression, and to address hate speech narratives;",
    "9": "Encourages Member States to consider, as and where appropriate, initiatives that identify areas for practical action in all sectors and levels of society for the promotion of interreligious and intercultural dialogue, tolerance, understanding and cooperation;",
    "10": "Calls upon Member States to engage with all relevant stakeholders to promote the virtues of interreligious and intercultural dialogue, respect and acceptance of differences, tolerance, respect for diversity, peaceful coexistence and cohabitation, inclusion and respect for human rights, to reject the spread of hate speech, that constitutes incitement to discrimination, hostility and violence;",
    "11": "Encourages all Member States and international organizations to generate public awareness, to enlighten the public about the dangers of intolerance and sectarian violence and to react with renewed commitment and action in support of the promotion of tolerance and human rights, and invites them to continue to pay attention to the importance of mutual cooperation, understanding and dialogue in ensuring the promotion of moderation and tolerance, and respect for human rights;",
    "12": "Requests the President of the General Assembly to convene an informal high-level meeting, on 18 June 2022, to mark the commemoration of the first International Day for Countering Hate Speech to contribute to spearheading political support to develop strategies to identify, address and counter hate speech at the national and global levels, taking into account, as appropriate, the United Nations Strategy and Plan of Action on Hate Speech;",
    "13": "",
    "14": "Invites Member States to support, in accordance with relevant international obligations, transparent and accessible systems to identify, track, collect data and analyse trends on hate speech, both in person and in digital contexts, at all national levels, as appropriate, to support effective responses;",
    "15": "Also invites Member States to further promote reconciliation to help ensure durable peace and sustainable development, and to encourage religious and community leaders to engage in intra- and interfaith dialogue to respond to incitement to violence, discrimination and hate speech;",
    "16": "Calls upon Member States, who have the primary responsibility to counter discrimination and hate speech, and all relevant actors, including political and religious leaders, to promote inclusion and unity in response to the COVID-19 pandemic and to speak out and take strong action against racism, xenophobia, hate speech, violence, discrimination, including on the basis of age, and stigmatization;",
    "17": "Welcomes the proclamation of the first week of February of every year as the World Interfaith Harmony Week between all religions, faiths and beliefs;",
    "18": "Takes note of global efforts to support implementing the Secretary- General\u2019s Plan of Action for Religious Leaders and Actors to Prevent Incitement to Violence that Could Lead to Atrocity Crimes, also called the Fez Plan of Action, the Secretary-General\u2019s Strategy and Plan of Action on Hate Speech and the Secretary- General\u2019s Plan of Action to Safeguard Religious Sites;",
    "19": "Invites all Member States, the United Nations system, regional and non-governmental organizations and other relevant stakeholders to increase their understanding of the Plan of Action for Religious Leaders and Actors to Prevent Incitement to Violence that Could Lead to Atrocity Crimes, also called the Fez Plan of Action, and the Plan of Action on Hate Speech, and other initiatives promoting tolerance and mutual understanding."
  },
  "agenda_items": [
    "Item 15"
  ],
  "symbol_references": [
    "A/75/L.115"
  ]
}