{
  "symbol": "A/RES/75/174",
  "filename": "A_RES_75_174.pdf",
  "title": "75/174. Human rights treaty body system",
  "text": "United Nations \nA/RES/75/174\n \n \nGeneral Assembly \nDistr.: General \n28 December 2020 \n \n20-17314 (E)    050121 \n*2017314* \n \n \nSeventy-fifth session \nAgenda item 72 (a) \nPromotion and protection of human rights: implementation \nof human rights instruments \n \n \n \n \n Resolution adopted by the General Assembly \non 16 December 2020 \n \n \n \n \n[on the report of the Third Committee (A/75/478/Add.1, para. 10)] \n \n \n 75/174. Human rights treaty body system \n \n \n \nThe General Assembly, \n \nRecalling the International Covenant on Civil and Political Rights, 1 the \nInternational Covenant on Economic, Social and Cultural Rights, 2 the Convention on \nthe Rights of Persons with Disabilities,3 the International Convention for the \nProtection of All Persons from Enforced Disappearance, 4 the International \nConvention on the Protection of the Rights of All Migrant Workers and Members of \nTheir Families,5 the Convention on the Elimination of All Forms of Discrimination \nagainst Women,6 the Convention on the Rights of the Child,7 the International \nConvention on the Elimination of All Forms of Racial Discrimination, 8 the \nConvention against Torture and Other Cruel, Inhuman or Degrading Treatment or \nPunishment9 and the Optional Protocol to the Convention against Torture and Other \nCruel, Inhuman or Degrading Treatment or Punishment, 10 \n \nRecalling also Economic and Social Council resolution 1985/17 of 28 May 1985, \n \nRecalling further its resolution 68/268 of 9 April 2014 on strengthening and \nenhancing the effective functioning of the human rights treaty body system, \n__________________ \n \n1 See resolution 2200 A (XXI), annex. \n \n2 Ibid. \n \n3 United Nations, Treaty Series, vol. 2515, No. 44910. \n \n4 Ibid., vol. 2716, No. 48088. \n \n5 Ibid., vol. 2220, No. 39481. \n \n6 Ibid., vol. 1249, No. 20378. \n \n7 Ibid., vol. 1577, No. 27531. \n \n8 Ibid., vol. 660, No. 9464. \n \n9 Ibid., vol. 1465, No. 24841. \n \n10 Ibid., vol. 2375, No. 24841. \n\nA/RES/75/174 \nHuman rights treaty body system\n \n20-17314\n2/3 \n \n \nRecalling its resolution 73/162 of 17 December 2018 on the human rights treaty \nbody system, \n \nReaffirming that the full and effective implementation of international human \nrights instruments by States parties is of major importance to the efforts of the United \nNations to promote universal respect for and observance of human rights and \nfundamental freedoms, and that the effective functioning of the human rights treaty \nbody system is indispensable for the full and effective implementation of such \ninstruments, \n \nRecognizing the important, valuable and unique role and contribution of each of \nthe human rights treaty bodies in the promotion and protection of human rights and \nfundamental freedoms, including through their examination of the progress made by \nStates parties to the respective human rights treaties in fulfilling their relevant \nobligations and their provision of recommendations to States parties on the \nimplementation of such treaties, \n \nEmphasizing the importance of multilingualism in the activities of the United \nNations, including those linked to the promotion and protection of human rights, and \nreaffirming the paramount importance of the equality of the six official languages of \nthe United Nations for the effective functioning of the human rights treaty bodies, \n \nRecalling paragraph 41 of its resolution 68/268, and in this regard welcoming \nthe process of the consideration of the state of the human rights treaty body system \nand taking note of the report of the co-facilitators, the Permanent Representatives of \nMorocco and Switzerland to the United Nations, to the President of the General \nAssembly,11 \n \n1. \nTakes note of the report of the Secretary-General on the status of the human \nrights treaty body system;12 \n \n2. \nWelcomes the annual reports of the human rights treaty bodies submitted \nto the General Assembly at its seventy-fourth13 and seventy-fifth14 sessions and to the \nEconomic and Social Council at its 201915 and 2020 sessions;16 \n \n3. \nInvites the Chairs of the human rights treaty bodies to address and engage \nin an interactive dialogue with the General Assembly at its seventy-sixth and seventy-\nseventh sessions under the item relevant to the work of the treaty body; \n \n4. \nEncourages all stakeholders to continue their efforts for the full \nimplementation of resolution 68/268; \n \n5. \nReaffirms paragraphs 26 to 28 of its resolution 68/268, in which it set out \nhow the allocation of meeting time to the treaty bodies would be identified and \nrequested the Secretary-General to provide the corresponding financial and human \nresources, decided that the meeting time allocated would be reviewed biennially and \namended on that basis at the request of the Secretary-General in line with established \n__________________ \n \n11 See letter dated 14 September 2020 from the President of the General Assembly at its seventy-\nfourth session. \n \n12 A/74/643. \n \n13 Official Records of the General Assembly, Seventy-fourth Session, Supplement No. 18 (A/74/18); \nibid., Supplement No. 38 (A/74/38); ibid., Supplement No. 40 (A/74/40); ibid., Supplement \nNo. 44 (A/74/44); ibid., Supplement No. 48 (A/74/48); ibid., Supplement No. 55 (A/74/55); and \nibid., Supplement No. 56 (A/74/56); see also A/74/256. \n \n14 Official Records of the General Assembly, Seventy-fifth Session, Supplement No. 18 (A/75/18); \nibid., Supplement No. 38 (A/75/38); ibid., Supplement No. 40 (A/75/40); ibid., Supplement \nNo. 41 (A/75/41); ibid., Supplement No. 44 (A/75/44); ibid., Supplement No. 48 (A/75/48); and \nibid., Supplement No. 56 (A/75/56). \n \n15 Official Records of the Economic and Social Council, 2019, Supplement No. 2 (E/2019/22). \n \n16 Ibid., 2020, Supplement No. 2 (E/2020/22). \n\nHuman rights treaty body system \nA/RES/75/174\n \n3/3\n20-17314 \n \nbudgetary procedures, and requested the Secretary-General accordingly to take into \naccount the meeting time needed by the human rights treaty body system in his future \nbiennial programme budget; \n \n6. \nExpresses appreciation for the organization of discussions on matters \nrelated to the implementation of each human rights treaty at meetings of the States \nparties thereto, and requests the Secretary-General to continue to support such practices; \n \n7. \nAlso expresses appreciation for the opportunity to interact with the Chairs \nof the treaty bodies during their annual meetings, and requests the Secretary-General \nto continue to support such opportunities; \n \n8. \nFurther expresses appreciation for the advisory services, capacity-\nbuilding and technical assistance provided by the Secretary-General to support States \nparties in building their capacity to implement their treaty obligations, and requests \nthe Secretary-General to continue his efforts in this regard; \n \n9. \nReiterates its request, made in paragraph 40 of its resolution 68/268, that \nthe Secretary-General submit to the General Assembly at its seventy-seventh session \na report on the status of the human rights treaty body system. \n \n46th plenary meeting \n16 December 2020 \n \n",
  "paragraphs": {
    "1": "Takes note of the report of the Secretary-General on the status of the human rights treaty body system;12",
    "2": "Welcomes the annual reports of the human rights treaty bodies submitted to the General Assembly at its seventy-fourth13 and seventy-fifth14 sessions and to the Economic and Social Council at its 201915 and 2020 sessions;16",
    "3": "Invites the Chairs of the human rights treaty bodies to address and engage in an interactive dialogue with the General Assembly at its seventy-sixth and seventy- seventh sessions under the item relevant to the work of the treaty body;",
    "4": "Encourages all stakeholders to continue their efforts for the full implementation of resolution 68/268;",
    "5": "Reaffirms paragraphs 26 to 28 of its resolution 68/268, in which it set out how the allocation of meeting time to the treaty bodies would be identified and requested the Secretary-General to provide the corresponding financial and human resources, decided that the meeting time allocated would be reviewed biennially and amended on that basis at the request of the Secretary-General in line with established budgetary procedures, and requested the Secretary-General accordingly to take into account the meeting time needed by the human rights treaty body system in his future biennial programme budget;",
    "6": "Expresses appreciation for the organization of discussions on matters related to the implementation of each human rights treaty at meetings of the States parties thereto, and requests the Secretary-General to continue to support such practices;",
    "7": "Also expresses appreciation for the opportunity to interact with the Chairs of the treaty bodies during their annual meetings, and requests the Secretary-General to continue to support such opportunities;",
    "8": "Further expresses appreciation for the advisory services, capacity- building and technical assistance provided by the Secretary-General to support States parties in building their capacity to implement their treaty obligations, and requests the Secretary-General to continue his efforts in this regard;",
    "9": "Reiterates its request, made in paragraph 40 of its resolution 68/268, that the Secretary-General submit to the General Assembly at its seventy-seventh session a report on the status of the human rights treaty body system."
  },
  "agenda_items": [
    "Item 72"
  ],
  "symbol_references": []
}