{
  "symbol": "A/RES/76/295",
  "filename": "A_RES_76_295.pdf",
  "title": "76/295. Strengthening connectivity between Central and South Asia",
  "text": "United Nations \nA/RES/76/295\n \n \nGeneral Assembly \nDistr.: General \n14 July 2022 \n \n22-10931 (E)    190722 \n*2210931* \n \n \nSeventy-sixth session \nAgenda item 20 \nSustainable development \n \n \n \n \n Resolution adopted by the General Assembly \non 11 July 2022 \n \n \n \n \n[without reference to a Main Committee (A/76/L.68 and A/76/L.68/Add.1)] \n \n \n 76/295. Strengthening connectivity between Central and South Asia \n \n \n \nThe General Assembly, \n \nGuided by the provisions of the Charter of the United Nations that encourage \nmeasures for regional cooperation to advance the purposes and principles of the \nUnited Nations, \n \nReaffirming its resolution 70/1 of 25 September 2015, entitled \u201cTransforming \nour world: the 2030 Agenda for Sustainable Development\u201d, in which it adopted a \ncomprehensive, far-reaching and people-centred set of universal and transformative \nSustainable Development Goals and targets, its commitment to working tirelessly for \nthe full implementation of the Agenda by 2030, its recognition that eradicating \npoverty in all its forms and dimensions, including extreme poverty, is the greatest \nglobal challenge and an indispensable requirement for sustainable development, its \ncommitment to achieving sustainable development in its three dimensions \u2013 \neconomic, social and environmental \u2013 in a balanced and integrated manner, and to \nbuilding upon the achievements of the Millennium Development Goals and seeking \nto address their unfinished business, \n \nReaffirming also the commitment to accelerating collective economic, social \nand environmental solutions for a better recovery from the coronavirus disease \n(COVID-19) and the achievement of the Sustainable Development Goals in the \ndecade of action, \n \nWelcoming the international conference on the theme \u201cCentral and South Asia: \nregional connectivity \u2013 challenges and opportunities\u201d, held in Tashkent, Uzbekistan, \nin July 2021, and taking note of the joint statement by the Ministers for Foreign \nAffairs of the Central and South Asian States adopted at that conference, 1 \n__________________ \n \n1 A/75/948, annex. \n\nA/RES/76/295 \nStrengthening connectivity between Central and South Asia\n \n22-10931\n2/4 \n \n \nStressing the importance of strengthening cooperation for the implementation \nof the Vienna Declaration and the Vienna Programme of Action for Landlocked \nDeveloping Countries for the Decade 2014\u20132024, 2  which are based on the \nestablishment of new, stronger partnerships between these countries and transit \ncountries and their development partners at all levels, \n \nRecalling the first United Nations Global Sustainable Transport Conference, \nheld in Ashgabat, Turkmenistan, in November 2016, and the second United Nations \nGlobal Sustainable Transport Conference, held in Beijing, China, in October 2021, \n \nRecognizing that quality, reliable, sustainable and resilient connectivity based \non stability plays a key role in trade, economic growth and sustainable development \nand enhances regional and international cooperation, \n \nEmphasizing the importance of transport and transit corridors for accelerating \neconomic growth, increasing the efficiency of trade and economic ties between the \ncountries of Central and South Asia, and realizing their unique transport, transit and \ninvestment potential, \n \nStressing the importance of the comprehensive and progressive development of \nties between Central and South Asia in areas of mutual interest, on the basis of mutual \ntrust and the full benefit of all, in a spirit of global solidarity, and for the common \nfuture of present and coming generations, in promoting infrastructure connectivity \nand sustainable transport, as well as regional and interregional economic integration \nand cooperation, \n \nAcknowledging the important role of regional organizations in enhancing \ninterregional and intraregional connectivity, and in this regard noting the \nproclamation by the Economic Cooperation Organization of 2022 as the Year of \nStrengthening Connectivity, \n \nRecognizing the importance of cooperation between Central and South Asia in \nfinding ways to enhance poverty alleviation and food security, among others, \nincluding through agricultural technologies and digitalization that can increase food \nsecurity by improving the sustainability of storage, transport, trade, processing, \ntransformation, retail, waste reduction and recycling, as well as interactions among \nthese processes, \n \n1. \nReaffirms that regional cooperation is an effective form of multilateralism \nand international cooperation contributing to the promotion of the purposes and \nprinciples of the United Nations; \n \n2. \nRecognizes the importance of cooperation in establishing safe, affordable, \naccessible and sustainable transport networks supported by inclusive and sustainable \nindustrialization and information technologies with a view to achieving transport \nconnectivity across Central and South Asia that is economically, socially and \nenvironmentally viable and financially sustainable, and is resilient to unexpected \nemergencies; \n \n3. \nEmphasizes the importance of effective border management in promoting \nconnectivity among the countries and the role of international cooperation in this \nregard; \n \n4. \nEncourages the continuation and advancement of cooperation between \nCentral and South Asia by expanding transport and information and communications \ntechnologies infrastructure and creating new international transport corridors that \n__________________ \n \n2 Resolution 69/137, annexes I and II. \n\nStrengthening connectivity between Central and South Asia \nA/RES/76/295\n \n3/4\n22-10931 \n \nopen convenient, sustainable, commercially viable, affordable, accessible, inclusive \nand safe routes to seaports; \n \n5. \nRecognizes the importance of Afghanistan\u2019s potential role in connecting \nCentral and South Asia, as well as its economic development and integration into \ninterregional economic processes for lasting peace and stability; \n \n6. \nAlso recognizes the importance of multimodal transport for connectivity \nof Central and South Asia, and in this context encourages the development of \ninteroperability of infrastructure to enhance air, land and sea connectivity among \ncountries; \n \n7. \nStresses the need to promote cooperation between civil aviation authorities \nin the regions for enhancing regional connectivity and economic cooperation; \n \n8. \nTakes note of the report of the Secretary-General entitled \u201cRoad map for \ndigital cooperation\u201d,3 which calls for every person to have safe and affordable access \nto the Internet by 2030, including meaningful use of digitally enabled services, in line \nwith the Sustainable Development Goals, and in this regard recognizes the importance \nof coordination among the countries of Central and South Asia on the widespread \nintroduction of digital economy, connectivity infrastructure and platforms through \ninformation and communications technologies; \n \n9. \nNotes the contribution of mutual exchange and learning through \nexperience between Central and South Asia in the study, preservation and \nstrengthening of their tangible and intangible cultural heritage for the popularization \nof the richness of historical and cultural contacts between the two regions; \n \n10. Emphasizes the importance of developing potential tourist routes covering \nthe historical and cultural centres of the Central and South Asian States; \n \n11. \nSupports the efforts of Central and South Asia to further strengthen \nrelationships between the regions and their people, including in the fields of \neducation, science and technology, innovation, tourism, culture, art and sports; \n \n12. Recognizes the importance of energy connectivity between Central and \nSouth Asia; \n \n13. Emphasizes the importance of the exchange of experience on voluntary \nand mutually agreed terms between Central and South Asia in promoting sustainable \ndevelopment, including through access to clean energy technology and disaster risk \nreduction strategies, and enhancing cooperation, including through initiatives that \naddress environmental challenges and contribute to the protection of the environment \nand ecosystems, while ensuring social and environmental safeguards; \n \n14. Commits to enhancing the role of sustainable transport in job creation, \nmobility facilitation and improvement of the efficiency of logistics chains in \nconnecting people and communities, particularly people in vulnerable situations, thus \nproviding all with equal opportunities and leaving no one behind; \n \n15. Recognizes the significant potential of regional economic integration and \ninterconnectivity to promote inclusive growth and sustainable development, commits \nto strengthening regional cooperation and regional trade agreements, reaffirms the \nimportance of strengthening coherence and consistency among bilateral and regional \ntrade and investment agreements and ensuring that they are compatible with World \nTrade Organization rules, and encourages multilateral development banks, including \nregional banks, in collaboration with other stakeholders, to address gaps in trade, \ntransport and transit-related regional infrastructure, including completing missing \n__________________ \n \n3 A/74/821. \n\nA/RES/76/295 \nStrengthening connectivity between Central and South Asia\n \n22-10931\n4/4 \n \nlinks connecting landlocked developing countries, least developed countries and \nsmall island developing States within regional networks to ensure quality, reliable, \nsustainable and resilient connectivity; \n \n16. Reaffirms the interests of Central and South Asia to continue to work on \nthe development of regional connectivity to advance the 2030 Agenda for Sustainable \nDevelopment;4 \n \n17. Invites Member States to consolidate their efforts in the fight against \ncommon challenges and threats to stability and security in Central and South Asia. \n \n93rd plenary meeting \n11 July 2022 \n \n__________________ \n \n4 Resolution 70/1. \n",
  "paragraphs": {
    "1": "Reaffirms that regional cooperation is an effective form of multilateralism and international cooperation contributing to the promotion of the purposes and principles of the United Nations;",
    "2": "Recognizes the importance of cooperation in establishing safe, affordable, accessible and sustainable transport networks supported by inclusive and sustainable industrialization and information technologies with a view to achieving transport connectivity across Central and South Asia that is economically, socially and environmentally viable and financially sustainable, and is resilient to unexpected emergencies;",
    "3": "Emphasizes the importance of effective border management in promoting connectivity among the countries and the role of international cooperation in this regard;",
    "4": "Encourages the continuation and advancement of cooperation between Central and South Asia by expanding transport and information and communications technologies infrastructure and creating new international transport corridors that __________________ 2 Resolution 69/137, annexes I and II. Strengthening connectivity between Central and South Asia A/RES/76/295 3/4 22-10931 open convenient, sustainable, commercially viable, affordable, accessible, inclusive and safe routes to seaports;",
    "5": "Recognizes the importance of Afghanistan\u2019s potential role in connecting Central and South Asia, as well as its economic development and integration into interregional economic processes for lasting peace and stability;",
    "6": "Also recognizes the importance of multimodal transport for connectivity of Central and South Asia, and in this context encourages the development of interoperability of infrastructure to enhance air, land and sea connectivity among countries;",
    "7": "Stresses the need to promote cooperation between civil aviation authorities in the regions for enhancing regional connectivity and economic cooperation;",
    "8": "Takes note of the report of the Secretary-General entitled \u201cRoad map for digital cooperation\u201d,3 which calls for every person to have safe and affordable access to the Internet by 2030, including meaningful use of digitally enabled services, in line with the Sustainable Development Goals, and in this regard recognizes the importance of coordination among the countries of Central and South Asia on the widespread introduction of digital economy, connectivity infrastructure and platforms through information and communications technologies;",
    "9": "Notes the contribution of mutual exchange and learning through experience between Central and South Asia in the study, preservation and strengthening of their tangible and intangible cultural heritage for the popularization of the richness of historical and cultural contacts between the two regions;",
    "10": "Emphasizes the importance of developing potential tourist routes covering the historical and cultural centres of the Central and South Asian States;",
    "11": "Supports the efforts of Central and South Asia to further strengthen relationships between the regions and their people, including in the fields of education, science and technology, innovation, tourism, culture, art and sports;",
    "12": "Recognizes the importance of energy connectivity between Central and South Asia;",
    "13": "Emphasizes the importance of the exchange of experience on voluntary and mutually agreed terms between Central and South Asia in promoting sustainable development, including through access to clean energy technology and disaster risk reduction strategies, and enhancing cooperation, including through initiatives that address environmental challenges and contribute to the protection of the environment and ecosystems, while ensuring social and environmental safeguards;",
    "14": "Commits to enhancing the role of sustainable transport in job creation, mobility facilitation and improvement of the efficiency of logistics chains in connecting people and communities, particularly people in vulnerable situations, thus providing all with equal opportunities and leaving no one behind;",
    "15": "Recognizes the significant potential of regional economic integration and interconnectivity to promote inclusive growth and sustainable development, commits to strengthening regional cooperation and regional trade agreements, reaffirms the importance of strengthening coherence and consistency among bilateral and regional trade and investment agreements and ensuring that they are compatible with World Trade Organization rules, and encourages multilateral development banks, including regional banks, in collaboration with other stakeholders, to address gaps in trade, transport and transit-related regional infrastructure, including completing missing __________________ 3 A/74/821. A/RES/76/295 Strengthening connectivity between Central and South Asia 22-10931 4/4 links connecting landlocked developing countries, least developed countries and small island developing States within regional networks to ensure quality, reliable, sustainable and resilient connectivity;",
    "16": "Reaffirms the interests of Central and South Asia to continue to work on the development of regional connectivity to advance the 2030 Agenda for Sustainable Development;4",
    "17": "Invites Member States to consolidate their efforts in the fight against common challenges and threats to stability and security in Central and South Asia. 93rd plenary meeting 11 July 2022 __________________ 4 Resolution 70/1."
  },
  "agenda_items": [
    "Item 20"
  ],
  "symbol_references": [
    "A/76/L.68"
  ]
}