{
  "symbol": "A/RES/78/325",
  "filename": "A_RES_78_325.pdf",
  "title": "78/325. United Nations Games",
  "text": "United Nations \nA/RES/78/325\n \n \nGeneral Assembly \nDistr.: General \n11 September 2024 \n \n24-14713 (E)     \n*2414713* \n \n \nSeventy-eighth session \nAgenda item 11 \nSport for development and peace: building a peaceful and \nbetter world through sport and the Olympic ideal \n \n \n \n \n Resolution adopted by the General Assembly \non 6 September 2024 \n \n \n \n \n[without reference to a Main Committee (A/78/L.107)] \n \n \n 78/325. United Nations Games \n \n \n \nThe General Assembly, \n \nRecalling its resolutions 58/5 of 3 November 2003 and 59/10 of 27 October \n2004, its decision to proclaim 2005 the International Year for Sport and Physical \nEducation to strengthen sport as a means to promote education, health, development \nand peace, and its resolutions 60/1 of 16 September 2005, 60/9 of 3 November 2005, \n61/10 of 3 November 2006, 62/271 of 23 July 2008, 63/135 of 11 December 2008, \n65/4 of 18 October 2010, 67/17 of 28 November 2012, 69/6 of 31 October 2014, \n71/160 of 16 December 2016, 73/24 of 3 December 2018, 75/18 of 1 December 2020 \nand 77/27 of 1 December 2022, \n \nRecognizing that sports, the arts and physical activity have the power to change \nperceptions, prejudices and behaviours, as well as to inspire people, break down racial \nand political barriers, combat discrimination and defuse conflict as reflected in the \npolitical declaration adopted at the Nelson Mandela Peace Summit in 2018, 1 \n \nRecognizing also the valuable contribution of sport in promoting education, \nsustainable development, peace, cooperation, solidarity, fairness, social inclusion and \nhealth at the local, regional and international levels, and noting that, as declared in \nthe 2005 World Summit Outcome, 2  sports can contribute to an atmosphere of \ntolerance and understanding among peoples and nations, \n \nRecognizing further that sport, including sport for persons with disabilities and \npersons living with rare diseases, has an important role to play in the promotion of \npeace and development, physical and mental health, gender equality, the \n__________________ \n \n1 Resolution 73/1. \n \n2 Resolution 60/1. \n\nA/RES/78/325 \nUnited Nations Games\n \n24-14713\n2/3 \n \nempowerment of women and girls, respect for human rights, and the fight against \nracism and racial discrimination, \n \nRecognizing the importance of international, continental and regional sport \nevents, such as the World Artistic Gymnastics Championships, the Special Olympics \nWorld Games, the Deaflympics, the World Indigenous Games, the European Games, \nthe Games of La Francophonie, the Pan American Games and the Parapan American \nGames, the All-Africa Games, the Asian Games, the Pacific Games, the Asian Indoor \nand Martial Arts Games, the World Nomad Games, the Commonwealth Games and \nthe World University Games, for promoting education, health, development, peace \nand solidarity among nations, \n \nWelcoming the designation of 6 April as the International Day of Sport for \nDevelopment and Peace, \n \nAcknowledging the success of the inaugural United Nations New York-based \nMissions Games (United Nations Games), held in New York from 11 April to 8 May \n2024 at the initiative of Turkmenistan within the framework of the General Assembly \nSustainability Week, and devoted to the International Day of Sport for Development \nand Peace, \n \nWelcoming the positive impact of the United Nations Games on fostering \ncamaraderie, collaboration and dialogue among the staff of the permanent missions \naccredited to the United Nations and the Secretariat of the United Nations, \n \n1. \nCommends the efforts and contribution of Australia, El Salvador, India, \nKazakhstan, Qatar and Turkmenistan in organizing the inaugural United Nations \nGames; \n \n2. \nRecognizes the potential of the United Nations Games to serve as a sports \ndiplomacy platform for cultivating sport culture and promoting sport as a tool for \ndevelopment and peace; \n \n3. \nCalls for the convening of the United Nations Games annually, in venues \naccessible to representatives of all Member States of the United Nations, members of \nthe specialized agencies and observers of the General Assembly, and of the Second \nUnited Nations Games in New York in April 2025, and encourages all delegations to \nsupport the organization of these Games, in collaboration with the Department of \nEconomic and Social Affairs of the Secretariat; \n \n4. \nInvites the five regional groups to nominate their candidates, one from \neach regional group, for the organizing committee of the Second United Nations \nGames in a timely fashion, so that they can participate in the first meeting of the \ncommittee on an informal basis in New York in January 2025; \n \n5. \nInvites all relevant stakeholders to make voluntary contributions to a trust \nfund dedicated to the United Nations Games and to provide other forms of support \nfor their observance; \n \n6. \nStresses that the costs of all the activities that may arise from the \nimplementation of the present resolution should be met through voluntary \ncontributions to the trust fund of the United Nations Games, including from the \nprivate sector; \n \n7. \nRequests the organizing committee of the Second United Nations Games, \nin collaboration with the Department of Economic and Social Affairs of the \nSecretariat, to collect feedback from all Member States of the United Nations, \nmembers of the specialized agencies and observers of the General Assembly on the \ninaugural United Nations Games in the form of an informal summary to incorporate \nlessons learned into the planning of future Games; \n\nUnited Nations Games \nA/RES/78/325 \n \n3/3\n24-14713 \n \n \n8. \nRequests the Secretary-General to bring the present resolution to the \nattention of all Member States and organizations of the United Nations system and \nother relevant stakeholders. \n \n107th plenary meeting \n6 September 2024 \n \n",
  "paragraphs": {
    "1": "Commends the efforts and contribution of Australia, El Salvador, India, Kazakhstan, Qatar and Turkmenistan in organizing the inaugural United Nations Games;",
    "2": "Recognizes the potential of the United Nations Games to serve as a sports diplomacy platform for cultivating sport culture and promoting sport as a tool for development and peace;",
    "3": "Calls for the convening of the United Nations Games annually, in venues accessible to representatives of all Member States of the United Nations, members of the specialized agencies and observers of the General Assembly, and of the Second United Nations Games in New York in April 2025, and encourages all delegations to support the organization of these Games, in collaboration with the Department of Economic and Social Affairs of the Secretariat;",
    "4": "Invites the five regional groups to nominate their candidates, one from each regional group, for the organizing committee of the Second United Nations Games in a timely fashion, so that they can participate in the first meeting of the committee on an informal basis in New York in January 2025;",
    "5": "Invites all relevant stakeholders to make voluntary contributions to a trust fund dedicated to the United Nations Games and to provide other forms of support for their observance;",
    "6": "Stresses that the costs of all the activities that may arise from the implementation of the present resolution should be met through voluntary contributions to the trust fund of the United Nations Games, including from the private sector;",
    "7": "",
    "8": "Requests the Secretary-General to bring the present resolution to the attention of all Member States and organizations of the United Nations system and other relevant stakeholders."
  },
  "agenda_items": [
    "Item 11"
  ],
  "symbol_references": [
    "A/78/L.107"
  ]
}