{
  "symbol": "A/RES/79/303",
  "filename": "A_RES_79_303.pdf",
  "title": "79/303. Financing of the United Nations Peacekeeping Force in Cyprus",
  "text": "United Nations \nA/RES/79/303\n \n \nGeneral Assembly \nDistr.: General \n1 July 2025 \n \n25-10826 (E) \n*2510826* \n \n \nSeventy-ninth session \nAgenda item 158 \nFinancing of the United Nations Peacekeeping Force \nin Cyprus \n \n \n \n \n Resolution adopted by the General Assembly \non 30 June 2025 \n \n \n \n \n[on the report of the Fifth Committee (A/79/928, para. 6)] \n \n \n 79/303. Financing of the United Nations Peacekeeping Force in Cyprus \n \n \n \nThe General Assembly, \n \nHaving considered the reports of the Secretary-General on the financing of the \nUnited Nations Peacekeeping Force in Cyprus1 and the related report of the Advisory \nCommittee on Administrative and Budgetary Questions,2  \n \nRecalling Security Council resolution 186 (1964) of 4 March 1964 regarding \nthe establishment of the United Nations Peacekeeping Force in Cyprus and the \nsubsequent resolutions by which the Council extended the mandate of the Force, the \nlatest of which was resolution 2771 (2025) of 31 January 2025, by which the Council \nextended the mandate of the Force until 31 January 2026,  \n \nRecalling also its resolution 47/236 of 14 September 1993 on the financing of \nthe Force and its subsequent resolutions and decisions thereon, the latest of which \nwas resolution 78/300 of 28 June 2024, \n \nReaffirming the general principles underlying the financing of United Nations \npeacekeeping operations, as stated in its resolutions 1874 (S-IV) of 27 June 1963, \n3101 (XXVIII) of 11 December 1973 and 55/235 of 23 December 2000, \n \nNoting with appreciation that voluntary contributions have been made to the \nForce by certain Governments, \n \nNoting that voluntary contributions were insufficient to cover all the costs of the \nForce, including those incurred by troop-contributing Governments prior to 16 June \n1993, and regretting the absence of an adequate response to appeals for voluntary \n__________________ \n \n1  A/79/595 and A/79/733. \n \n2  A/79/724/Add.2. \n\nA/RES/79/303 \nFinancing of the United Nations Peacekeeping Force in Cyprus\n \n25-10826\n2/4 \n \ncontributions, including that contained in the letter dated 17 May 1994 from the \nSecretary-General to all Member States,3  \n \nMindful of the fact that it is essential to provide the Force with the financial \nresources necessary to enable it to fulfil its responsibilities under the relevant \nresolutions of the Security Council, \n \n1. \nRequests the Secretary-General to entrust the Head of Mission with the \ntask of formulating future budget proposals in full accordance with the provisions of \nits resolutions 59/296 of 22 June 2005, 60/266 of 30 June 2006, 61/276 of 29 June \n2007, 64/269 of 24 June 2010, 65/289 of 30 June 2011, 66/264 of 21 June 2012, \n69/307 of 25 June 2015, 70/286 of 17 June 2016 and 76/274 of 29 June 2022, as well \nas other relevant resolutions; \n \n2. \nTakes note of the status of contributions to the United Nations \nPeacekeeping Force in Cyprus as at 30 April 2025, including the contributions \noutstanding in the amount of 21 million United States dollars, representing some 2.5 \nper cent of the total assessed contributions, notes with concern that only 81 Member \nStates have paid their assessed contributions in full, and urges all other Member \nStates, in particular those in arrears, to ensure payment of their outstanding assessed \ncontributions; \n \n3. \nExpresses its appreciation to those Member States that have paid their \nassessed contributions in full, and urges all other Member States to make every \npossible effort to ensure payment of their assessed contributions to the Force in full; \n \n4. \nExpresses concern at the financial situation with regard to peacekeeping \nactivities, in particular as regards the reimbursements to troop contributors that bear \nadditional burdens owing to overdue payments by Member States of their \nassessments; \n \n5. \nEmphasizes that all future and existing peacekeeping missions shall be \ngiven equal and non-discriminatory treatment in respect of financial and \nadministrative arrangements; \n \n6. \nAlso emphasizes that all peacekeeping missions shall be provided with \nadequate resources for the effective and efficient discharge of their respective \nmandates; \n \n7. \nRequests the Secretary-General to ensure that proposed peacekeeping \nbudgets are based on the relevant legislative mandates; \n \n8. \nEndorses the conclusions and recommendations contained in the report of \nthe Advisory Committee on Administrative and Budgetary Questions, and requests \nthe Secretary-General to ensure their full implementation; \n \n9. \nRequests the Secretary-General to ensure the full implementation of the \nrelevant provisions of its resolutions 59/296, 60/266, 61/276, 64/269, 65/289, 66/264, \n69/307, 70/286 and 76/274; \n \n10. Also requests the Secretary-General to take all action necessary to ensure \nthat the Force is administered with a maximum of efficiency and economy; \n \n \n \nBudget performance report for the period from 1 July 2023 to 30 June 2024 \n \n \n11. \nTakes note of the report of the Secretary-General on the budget \nperformance of the Force for the period from 1 July 2023 to 30 June 2024; 4  \n \n__________________ \n \n3  S/1994/647. \n \n4  A/79/595. \n\nFinancing of the United Nations Peacekeeping Force in Cyprus \nA/RES/79/303\n \n3/4\n25-10826 \n \n \n \nBudget estimates for the period from 1 July 2025 to 30 June 2026 \n \n \n12. Decides to appropriate to the special account for the United Nations \nPeacekeeping Force in Cyprus the amount of 62,762,100 dollars for the period from \n1 July 2025 to 30 June 2026, inclusive of 57,319,100 dollars for the maintenance of \nthe Force, 4,779,000 dollars for the support account for peacekeeping operations and \n664,000 dollars for the United Nations Logistics Base at Brindisi, Italy; \n \n \n \nFinancing of the appropriation for the period from 1 July 2025 to 30 June 2026 \n \n \n13. Notes with appreciation that a one-third share of the net appropriation, \nequivalent to 19,865,367 dollars, will be funded through voluntary contributions from \nthe Government of Cyprus and the amount of 6.5 million dollars from the Government \nof Greece; \n \n14. Decides to apportion among Member States the amount of 21,231,428 \ndollars for the period from 1 July 2025 to 31 January 2026, in accordance with the \nlevels updated in its resolution 79/250 of 24 December 2024, taking into account the \nscale of assessments for 2025 and 2026, as set out in its resolution 79/249 of \n24 December 2024; \n \n15. Also decides that, in accordance with the provisions of its resolution 973 (X) \nof 15 December 1955, there shall be set off against the apportionment among Member \nStates, as provided for in paragraph 14 above, their respective share in the Tax \nEqualization Fund of 1,846,833 dollars, comprising the estimated staff assessment \nincome of 1,546,533 dollars approved for the Force, the prorated share of 256,142 \ndollars of the estimated staff assessment income approved for the support account and \nthe prorated share of 44,158 dollars of the estimated staff assessment income \napproved for the United Nations Logistics Base; \n \n16. Further decides to apportion among Member States the amount of \n15,165,305 dollars for the period from 1 February to 30 June 2026 at a monthly rate \nof 3,033,061 dollars, in accordance with the levels updated in its resolution 79/250, \ntaking into account the scale of assessments for 2026, as set out in its resolution \n79/249, subject to a decision of the Security Council to extend the mandate of the \nForce; \n \n17. Decides that, in accordance with the provisions of its resolution 973 (X), \nthere shall be set off against the apportionment among Member States, as provided \nfor in paragraph 16 above, their respective share in the Tax Equalization Fund of \n1,319,167 dollars, comprising the estimated staff assessment income of 1,104,667 \ndollars approved for the Force, the prorated share of 182,958 dollars of the estimated \nstaff assessment income approved for the support account and the prorated share of \n31,542 dollars of the estimated staff assessment income approved for the United \nNations Logistics Base; \n \n18. Also decides that, for Member States that have fulfilled their financial \nobligations to the Force, there shall be set off against the apportionment, as provided \nfor in paragraphs 14 and 16 above, their respective share of the unencumbered balance \nand other revenue in the amount of 756,602 dollars in respect of the financial period \nended 30 June 2024, in accordance with the levels updated in its resolution 76/239 of \n24 December 2021, taking into account the scale of assessments for 2024, as set out \nin its resolution 76/238 of 24 December 2021; \n \n19. Further decides that, for Member States that have not fulfilled their \nfinancial obligations to the Force, there shall be set off against their outstanding \nobligations, their respective share of the unencumbered balance and other revenue in \n\nA/RES/79/303 \nFinancing of the United Nations Peacekeeping Force in Cyprus\n \n25-10826\n4/4 \n \nthe amount of 756,602 dollars in respect of the financial period ended 30 June 2024, \nin accordance with the scheme set out in paragraph 18 above; \n \n20. Decides that the decrease of 33,200 dollars in the estimated staff \nassessment income in respect of the financial period ended 30 June 2024 shall be set \noff against the credits in the amount of 756,602 dollars referred to in paragraphs 18 \nand 19 above; \n \n21. Also decides, taking into account its voluntary contribution for the \nfinancial period ended 30 June 2024, that one third of the net unencumbered balance \nand other revenue in the amount of 454,267 dollars in respect of the financial period \nended 30 June 2024 shall be returned to the Government of Cyprus; \n \n22. Further decides, taking into account its voluntary contribution for the \nfinancial period ended 30 June 2024, that the prorated share of the net unencumbered \nbalance and other revenue in the amount of 151,931 dollars in respect of the financial \nperiod ended 30 June 2024 shall be returned to the Government of Greece; \n \n23. Decides to continue to maintain as separate the account established for the \nForce for the period prior to 16 June 1993, invites Member States to make voluntary \ncontributions to that account, and requests the Secretary-General to continue his \nefforts in appealing for voluntary contributions to the account; \n \n24. Encourages the Secretary-General to continue to take additional measures \nto ensure the safety and security of all personnel participating in the Force under the \nauspices of the United Nations, bearing in mind paragraphs 5 and 6 of Security \nCouncil resolution 1502 (2003) of 26 August 2003; \n \n25. Invites voluntary contributions to the Force in cash and in the form of \nservices and supplies acceptable to the Secretary-General, to be administered, as \nappropriate, in accordance with the procedure and practices established by the \nGeneral Assembly; \n \n26. Decides to include in the provisional agenda of its eightieth session the \nitem entitled \u201cFinancing of the United Nations Peacekeeping Force in Cyprus\u201d. \n \n81st plenary meeting \n30 June 2025 \n \n",
  "paragraphs": {
    "1": "Requests the Secretary-General to entrust the Head of Mission with the task of formulating future budget proposals in full accordance with the provisions of its resolutions 59/296 of 22 June 2005, 60/266 of 30 June 2006, 61/276 of 29 June 2007, 64/269 of 24 June 2010, 65/289 of 30 June 2011, 66/264 of 21 June 2012, 69/307 of 25 June 2015, 70/286 of 17 June 2016 and 76/274 of 29 June 2022, as well as other relevant resolutions;",
    "2": "Takes note of the status of contributions to the United Nations Peacekeeping Force in Cyprus as at 30 April 2025, including the contributions outstanding in the amount of 21 million United States dollars, representing some 2.5 per cent of the total assessed contributions, notes with concern that only 81 Member States have paid their assessed contributions in full, and urges all other Member States, in particular those in arrears, to ensure payment of their outstanding assessed contributions;",
    "3": "Expresses its appreciation to those Member States that have paid their assessed contributions in full, and urges all other Member States to make every possible effort to ensure payment of their assessed contributions to the Force in full;",
    "4": "Expresses concern at the financial situation with regard to peacekeeping activities, in particular as regards the reimbursements to troop contributors that bear additional burdens owing to overdue payments by Member States of their assessments;",
    "5": "Emphasizes that all future and existing peacekeeping missions shall be given equal and non-discriminatory treatment in respect of financial and administrative arrangements;",
    "6": "Also emphasizes that all peacekeeping missions shall be provided with adequate resources for the effective and efficient discharge of their respective mandates;",
    "7": "Requests the Secretary-General to ensure that proposed peacekeeping budgets are based on the relevant legislative mandates;",
    "8": "Endorses the conclusions and recommendations contained in the report of the Advisory Committee on Administrative and Budgetary Questions, and requests the Secretary-General to ensure their full implementation;",
    "9": "Requests the Secretary-General to ensure the full implementation of the relevant provisions of its resolutions 59/296, 60/266, 61/276, 64/269, 65/289, 66/264, 69/307, 70/286 and 76/274;",
    "10": "Also requests the Secretary-General to take all action necessary to ensure that the Force is administered with a maximum of efficiency and economy; Budget performance report for the period from 1 July 2023 to 30 June 2024",
    "11": "Takes note of the report of the Secretary-General on the budget performance of the Force for the period from 1 July 2023 to 30 June 2024; 4 __________________ 3 S/1994/647. 4 A/79/595. Financing of the United Nations Peacekeeping Force in Cyprus A/RES/79/303 3/4 25-10826 Budget estimates for the period from 1 July 2025 to 30 June 2026",
    "12": "Decides to appropriate to the special account for the United Nations Peacekeeping Force in Cyprus the amount of 62,762,100 dollars for the period from 1 July 2025 to 30 June 2026, inclusive of 57,319,100 dollars for the maintenance of the Force, 4,779,000 dollars for the support account for peacekeeping operations and 664,000 dollars for the United Nations Logistics Base at Brindisi, Italy; Financing of the appropriation for the period from 1 July 2025 to 30 June 2026",
    "13": "Notes with appreciation that a one-third share of the net appropriation, equivalent to 19,865,367 dollars, will be funded through voluntary contributions from the Government of Cyprus and the amount of 6.5 million dollars from the Government of Greece;",
    "14": "Decides to apportion among Member States the amount of 21,231,428 dollars for the period from 1 July 2025 to 31 January 2026, in accordance with the levels updated in its resolution 79/250 of 24 December 2024, taking into account the scale of assessments for 2025 and 2026, as set out in its resolution 79/249 of 24 December 2024;",
    "15": "Also decides that, in accordance with the provisions of its resolution 973 (X) of 15 December 1955, there shall be set off against the apportionment among Member States, as provided for in paragraph 14 above, their respective share in the Tax Equalization Fund of 1,846,833 dollars, comprising the estimated staff assessment income of 1,546,533 dollars approved for the Force, the prorated share of 256,142 dollars of the estimated staff assessment income approved for the support account and the prorated share of 44,158 dollars of the estimated staff assessment income approved for the United Nations Logistics Base;",
    "16": "Further decides to apportion among Member States the amount of 15,165,305 dollars for the period from 1 February to 30 June 2026 at a monthly rate of 3,033,061 dollars, in accordance with the levels updated in its resolution 79/250, taking into account the scale of assessments for 2026, as set out in its resolution 79/249, subject to a decision of the Security Council to extend the mandate of the Force;",
    "17": "Decides that, in accordance with the provisions of its resolution 973 (X), there shall be set off against the apportionment among Member States, as provided for in paragraph 16 above, their respective share in the Tax Equalization Fund of 1,319,167 dollars, comprising the estimated staff assessment income of 1,104,667 dollars approved for the Force, the prorated share of 182,958 dollars of the estimated staff assessment income approved for the support account and the prorated share of 31,542 dollars of the estimated staff assessment income approved for the United Nations Logistics Base;",
    "18": "Also decides that, for Member States that have fulfilled their financial obligations to the Force, there shall be set off against the apportionment, as provided for in paragraphs 14 and 16 above, their respective share of the unencumbered balance and other revenue in the amount of 756,602 dollars in respect of the financial period ended 30 June 2024, in accordance with the levels updated in its resolution 76/239 of 24 December 2021, taking into account the scale of assessments for 2024, as set out in its resolution 76/238 of 24 December 2021;",
    "19": "Further decides that, for Member States that have not fulfilled their financial obligations to the Force, there shall be set off against their outstanding obligations, their respective share of the unencumbered balance and other revenue in A/RES/79/303 Financing of the United Nations Peacekeeping Force in Cyprus 25-10826 4/4 the amount of 756,602 dollars in respect of the financial period ended 30 June 2024, in accordance with the scheme set out in paragraph 18 above;",
    "20": "Decides that the decrease of 33,200 dollars in the estimated staff assessment income in respect of the financial period ended 30 June 2024 shall be set off against the credits in the amount of 756,602 dollars referred to in paragraphs 18 and 19 above;",
    "21": "Also decides, taking into account its voluntary contribution for the financial period ended 30 June 2024, that one third of the net unencumbered balance and other revenue in the amount of 454,267 dollars in respect of the financial period ended 30 June 2024 shall be returned to the Government of Cyprus;",
    "22": "Further decides, taking into account its voluntary contribution for the financial period ended 30 June 2024, that the prorated share of the net unencumbered balance and other revenue in the amount of 151,931 dollars in respect of the financial period ended 30 June 2024 shall be returned to the Government of Greece;",
    "23": "Decides to continue to maintain as separate the account established for the Force for the period prior to 16 June 1993, invites Member States to make voluntary contributions to that account, and requests the Secretary-General to continue his efforts in appealing for voluntary contributions to the account;",
    "24": "Encourages the Secretary-General to continue to take additional measures to ensure the safety and security of all personnel participating in the Force under the auspices of the United Nations, bearing in mind paragraphs 5 and 6 of Security Council resolution 1502 (2003) of 26 August 2003;",
    "25": "Invites voluntary contributions to the Force in cash and in the form of services and supplies acceptable to the Secretary-General, to be administered, as appropriate, in accordance with the procedure and practices established by the General Assembly;",
    "26": "Decides to include in the provisional agenda of its eightieth session the item entitled \u201cFinancing of the United Nations Peacekeeping Force in Cyprus\u201d. 81st plenary meeting 30 June 2025"
  },
  "agenda_items": [
    "Item 158"
  ],
  "symbol_references": []
}