{
  "symbol": "A/RES/75/246",
  "filename": "A_RES_75_246.pdf",
  "title": "75/246. United Nations pension system",
  "text": "United Nations \nA/RES/75/246\n \n \nGeneral Assembly \nDistr.: General \n7 January 2021 \n \n \n21-00051 (E)    080121 \n*2100051* \n \n \nSeventy-fifth session \nAgenda item 149 \nUnited Nations pension system \n \n \n \n \n Resolution adopted by the General Assembly \non 31 December 2020 \n \n \n \n \n[on the report of the Fifth Committee (A/75/669, para. 6)] \n \n \n 75/246. United Nations pension system \n \n \n \nThe General Assembly, \n \nRecalling its resolutions 70/238 A of 23 December 2015, 73/274 of 22 December \n2018 and section VIII of its resolution 74/263 of 27 December 2019,  \n \nHaving considered the report of the United Nations Joint Staff Pension Board \nfor 2020,1 the reports of the Secretary-General on the investments of the United \nNations Joint Staff Pension Fund and measures undertaken to increase the \ndiversification of the Fund2 and on the administrative and financial implications \narising from the report of the United Nations Joint Staff Pension Board, 3 the financial \nreport and audited financial statements for the year ended 31 December 2019 and the \nreport of the Board of Auditors on the United Nations Joint Staff Pension Fund 4 and \nthe recommendations contained therein, the report of the Chief Executive of Pension \nAdministration and the Representative of the Secretary-General for the investment of \nthe assets of the Fund on the implementation of the recommendations of the Board of \nAuditors contained in its report for the year ended 31 December 2019 on the Fund, 5 \nthe report of the Office of Internal Oversight Services on the audit of governance \nmechanisms and related processes in the Office of Investment Management of the \nUnited Nations Joint Staff Pension Fund6 and the related report of the Advisory \nCommittee on Administrative and Budgetary Questions,7  \n__________________ \n \n1  Official Records of the General Assembly, Seventy-fifth Session, Supplement No. 9 (A/75/9). \n \n2  A/C.5/75/2. \n \n3  A/C.5/75/3. \n \n4  Official Records of the General Assembly, Seventy-fifth Session, Supplement No. 5P \n(A/75/5/Add.16). \n \n5  A/75/318. \n \n6  A/75/215. \n \n7  A/75/7/Add.18 and A/75/7/Add.18/Corr.1. \n\nA/RES/75/246 \nUnited Nations pension system\n \n21-00051\n2/7 \n \n \n1. \nTakes note of the report of the United Nations Joint Staff Pension Board; \n \n2. \nAlso takes note of the reports of the Secretary-General on the investments \nof the United Nations Joint Staff Pension Fund and measures undertaken to increase \nthe diversification of the Fund and on the administrative and financial implications \narising from the report of the United Nations Joint Staff Pension Board; \n \n3. \nFurther takes note of the report of the Chief Executive of Pension \nAdministration and the Representative of the Secretary-General for the investment of \nthe assets of the Fund on the implementation of the recommendations of the Board of \nAuditors contained in its report for the year ended 31 December 2019 on the Fund; \n \n4. \nEndorses the conclusions and recommendations of the Advisory \nCommittee on Administrative and Budgetary Questions; \n \n5. \nEmphasizes the existing prerogative of the General Assembly on matters \npertaining to the Fund;  \n \n6. \nStresses the need for the Fund to address all the recommendations \nidentified by the Board of Auditors and the Office of Internal Oversight Services, \nincluding in relation to vacancies in key positions, risk management, investment \nmanagement, management of external fund managers, benefits payments \nmanagement and other administrative processes;  \n \n7. \nRecalls paragraph 15 of section VIII of its resolution 74/263, and reiterates \nits request that the Secretary-General and the Pension Board ensure that the staff \ncomposition of the Office of Investment Management and of the Pension \nAdministration is based on as wide a geographical basis as possible, bearing in mind \nArticle 101, paragraph 3, of the Charter of the United Nations, and to make every \neffort to provide an update on progress achieved in the context of their next reports;  \n \n8. \nAlso recalls paragraph 29 of the report of the Advisory Committee, and \nrequests the Pension Administration and the Office of Investment Management to \nensure that all vacancy announcements advertised before approval of the \ncorresponding resources by the General Assembly indicate clearly that the \nrecruitment is subject to a decision of the Assembly, and to review all the general \ntemporary assistance positions of the Fund with a view to identifying potential \nduplication of functions and efficiencies, while ensuring that their establishment and \nmanagement comply with the applicable Assembly resolutions and the Staff \nRegulations and Rules of the United Nations,8 notably in terms of responding to peak \nworkload;  \n \n \n \nActuarial matters \n \n \n9. \nStresses the importance of continuing to achieve the necessary 3.5 per cent \nannual real rate of return on a long-term basis for the future solvency of the Fund;  \n \n \n \nGovernance matters \n \n \n10. Recognizes that the Financial Regulations and Rules of the United \nNations9 remain the highest framework governing all aspects related to the \nadministrative services provided by the Secretariat, including the procurement of \ngoods and services, the management of property and internal and external audit \narrangements;  \n__________________ \n \n8  ST/SGB/2018/1. \n \n9  ST/SGB/2013/4 and ST/SGB/2013/4/Amend.1. \n\nUnited Nations pension system \nA/RES/75/246\n \n3/7\n21-00051 \n \n \n11. \nRecalls paragraph 61 of the report of the Advisory Committee, and stresses \nthat the recruitment of all posts and positions of the Fund shall be done in accordance \nwith the relevant Staff Regulations and Rules;  \n \n12. Emphasizes that the Office of Internal Oversight Services shall remain the \nsole internal oversight body of the secretariat of the Fund and its investments, in line \nwith the mandate of the Office, as set out by the General Assembly its resolution \n48/218 B of 29 July 1994, and stresses that any change to the mandate in this regard \nremains the sole prerogative of the Assembly;  \n \n13. Recalls paragraph 8 of section VIII of its resolution 74/263, including \nsubparagraphs (a) to (e), in which it called for a comprehensive and objective analysis \nof pension fund governance matters, notes the decision of the Pension Board to \nrequest the Governance Working Group to review and analyse the report of the \nindependent external entity, and looks forward to further considering the report \ntogether with the recommendations of the Board, noting the significant variances \nfrom best practices in respect of the governance of the Fund as reflected in the report \nof the independent external entity, while respecting the unique nature of the Fund;  \n \n14. Notes that the key focus of this review in the context of best practices in \nrespect of the governance of the Fund should be aimed, in particular, at the size, \ncomposition and frequency of meetings of the Pension Board, in order for its members \nto fulfil their fiduciary responsibilities in the best interest of the participants and the \nbeneficiaries of the Fund;  \n \n15. Recognizes the need for the Governance Working Group to collaborate \nclosely with the independent external entity, as appropriate, and for the Pension Board \nto take into account governance best practices in providing its comments on the report \nof the independent external entity, and looks forward to receiving updates, including \nconcrete reform proposals and plans, taking into account the recommendations of the \nindependent external entity as mentioned in paragraphs 13 and 14 of the present \nresolution, in the context of the first part of the resumed seventy-fifth session and the \nnext annual report of the Board to the General Assembly;  \n \n16. Recalls its resolutions 73/274 and 74/263, in which it decided that the \nSecretary of the Pension Board should be fully independent of the Chief Executive of \nPension Administration, and requests the Board to include the terms of reference and \nrelated reporting lines for both the Secretary and the Chief Executive in the context \nof the next report;  \n \n17. Welcomes the decision of the Pension Board to recognize, mutatis \nmutandis, the Regulations Governing the Status, Basic Rights and Duties of Officials \nother than Secretariat Officials, and Experts on Mission,10 adopted by the General \nAssembly by its resolution 56/280 of 27 March 2002, as the code of conduct for the \nBoard, without prejudice to the legal status, privileges and immunities of those \nattending sessions of the Board or any of its committees or working groups;  \n \n18. Recalls paragraph 16 of section VIII of its resolution 74/263, and decides \nthat the proposed amendment to article 6 of the Regulations of the Pension Fund, as \nrecommended by the Pension Board, should be considered in the context of the review \nof the recommendations of the Board on the report of the independent external entity \nand upon submission of further proposals, including changes to the Regulations and \nRules of the Fund to ensure adherence to the code of conduct;  \n \n__________________ \n \n10  ST/SGB/2002/9. \n\nA/RES/75/246 \nUnited Nations pension system\n \n21-00051\n4/7 \n \n \n \nPension Board \n \n \n19. Notes the progress made in order to eliminate all delays in payments of \nbenefits, encourages the Pension Board to continue to enhance cooperation between \nthe Fund and the member organizations in this regard, and requests the Pension \nAdministration to establish and fully implement a procedure for following up on cases \nwith missing or invalid documents and to report thereon, including on statistics, the \nentities involved and progress made, at the seventy-sixth session of the General \nAssembly;  \n \n20. Requests the Pension Board to provide in its future reports detailed updates \nfor any recommendation of the Board of Auditors that has not been agreed upon or \nimplemented;  \n \n21. Recalls paragraph 35 of section VIII of its resolution 74/263, and requests \nthe Pension Board to clarify the functional responsibilities and reporting lines of the \nNew York and Geneva offices and to submit, in the context of its next report, \ninformation on specific measures to ensure the efficiency of the Geneva office in \nrendering services to clients;  \n \n22. Requests the Pension Board to conduct proper monitoring through annual \nreports regarding the status of implementation of the Integrated Pension \nAdministration System, specifically the challenges experienced with regard to the \nimplementation of the system, including granting of other forms of assistance, as well \nas the enhancements made to address these challenges;  \n \n23. Emphasizes the need for the Pension Board to ensure that the Fund takes \nappropriate measures to use existing internal capacities and keeps the use of \nconsultants in its operations to a minimum;  \n \n24. Encourages the Secretary of the Pension Board to restructure and \nstreamline the report of the Board with the aim of making it more concise and to the \npoint and presenting the rationale of financial and administrative proposals in a more \ncomprehensive manner;  \n \n25. Highlights the importance attached by the General Assembly to continuing \nto ensure accountability by the Pension Board, and requests the Board to provide \nfollow-up on all aspects of the implementation of the present resolution in the context \nof its report to be submitted to the Assembly at its seventy-sixth session;  \n \n \n \nPension Administration \n \n \n26. Welcomes the three strategic goals established by the Chief Executive of \nPension Administration;  \n \n27. Requests the Pension Administration to continue to adhere to the target \nbenchmark of 75 per cent of initial benefit processing in 15 business days and to \neliminate the practice of postponing the benchmark for additional documentation \nrequirements, according to the recommendation of the Board of Auditors in its report, \nand to report the actual time for completion of the processing of initial benefits, \nincluding those without proper documentation, as well as the reasons for exceeding \nthe 15 business-day target benchmark as appropriate, in the context of the next report \nof the Pension Board;  \n \n28. Recalls paragraph 35 of the report of the Advisory Committee, welcomes \nthe proposal to establish a new Business Transformation and Accountability Unit in \nthe Pension Administration, stresses the importance of developing key performance \nindicators to assess its efficiency and its impact on the work of the Fund, and requests \n\nUnited Nations pension system \nA/RES/75/246\n \n5/7\n21-00051 \n \nthe Pension Board to provide updated information thereon in the context of its next \nreport;  \n \n \n \nInvestments of the United Nations Joint Staff Pension Fund \n \n \n29. Notes the restructuring of the Office of Investment Management, including \nthe change of the reporting lines of the Risk and Compliance Section and the \nOperations Service to the Representative of the Secretary-General, and requests the \nRepresentative to report on the achievements of those offices;  \n \n30. Reaffirms that the Secretary-General serves as fiduciary for the investment \nof the assets of the Fund;  \n \n31. Supports all recommendations as contained in the report of the Office of \nInternal Oversight Services, including the critical recommendations 1 and 10, and \nrequests the Secretary-General to report on their implementation in detail at the main \npart of its seventy-sixth session;  \n \n32. Recalls paragraph 26 of the report of the Advisory Committee, and \nrequests the Secretary-General to address all matters related to preventing and \naddressing actual or perceived conflicts of interest in all areas of the Fund, including \nimplementing the recommendations of the Board of Auditors on personal securities \ntrading policy in respect of all personnel who may be involved in investment \noperations, and at all levels of the Fund\u2019s activities;  \n \n33. Notes the report of the Representative of the Secretary-General on the \nproposal of the Pension Board to engage, for the first time, in a range of derivative \ninstruments available to the Fund, to effectively manage the Fund\u2019s investments and \naddress the increasing complexity of the global capital markets environment, and in \nthis context requests the Secretary-General to submit more detailed proposals to the \nGeneral Assembly at its seventy-sixth session, including information on the use of \nderivative instruments, engagement in margin trading and participation in securities \nlending, as well as compliance measures, with a view to ensuring strict adherence to \nthe existing policies and accountability framework and a cost-effective investment \nstrategy, and authorizes the Secretary-General to conduct margin trading for the \nlimited purpose set out in paragraphs 43 and 44 of his report 11 on a trial basis for two \nyears;  \n \n34. Requests the Secretary-General to report on the use of these expanded \ninvestment strategies, including on their impact on the diversification of the Fund, in \nthe context of his next report on the investments of the Fund, and to review the use \nof these expanded investment strategies and to report thereon to the General Assembly \nat its seventy-seventh session in order to determine whether to continue these \nstrategies;  \n \n35. Also requests the Secretary-General, as fiduciary for the investment of the \nassets of the Fund, to continue to diversify its investments among developed, \ndeveloping and emerging markets, wherever this serves the interests of the \nparticipants and the beneficiaries of the Fund, and further requests the Secretary-\nGeneral to ensure that decisions concerning the investments of the Fund in any market \nare implemented prudently, taking fully into account the four main criteria for \ninvestment, namely, safety, profitability, liquidity and convertibility;  \n \n36. Recalls paragraphs 10 and 13 of the report of the Advisory Committee, \nand notes that emerging and frontier markets, including markets in Africa, are \nincreasingly important to the investment strategy of the Fund;  \n__________________ \n \n11  A/C.5/75/2. \n\nA/RES/75/246 \nUnited Nations pension system\n \n21-00051\n6/7 \n \n \n37. Also recalls paragraph 45 of the report of the Advisory Committee, and \nrequests the Secretary-General to provide updated information on vacant posts and \nthe granting of special post allowance in the Office of Investment Management in the \nnext report of the Pension Board;  \n \n \n \nOther matters \n \n \n38. Approves the admission of the Wassenaar Arrangement on Export Controls \nfor Conventional Arms and Dual-Use Goods and Technologies to membership in the \nFund, with effect from 1 January 2021;12  \n \n39. Recalls paragraph 17 of section VIII of its resolution 74/263, and requests \nthe Pension Board to provide further analysis of and clarification on the proposed \namendment to article 48 of the Regulations of the Pension Fund in the context of its \nnext report;  \n \n40. Approves the proposed amendments to articles 4 and 8 of the Regulations \nof the Fund as proposed by the Pension Board;  \n \n41. Decides to defer consideration of the amendments to article 7 of the \nRegulations and paragraph 19 of the pension adjustment system of the Fund to its \nseventy-sixth session;  \n \n \n \nBudget estimates for 2021 \n \n \n42. Recalls paragraph 14 of the report of the Advisory Committee, and stresses \nthe importance of the Fund\u2019s improving its budgeting accuracy and presentation of costs;  \n \n43. Approves the changes to the staffing table as set out in the table below: \n \n \n \nA. Pension Administration \n \n \nAction \nTitle of post \nCategory \nNumber \nNew post \nChief of Business Transformation and \nAccountability Unit \nP-5 \n1 \nConversion \nProgramme Management Officer (Risk) \nP-3 \n1 \nConversion \nBenefits Assistant (Operations) \nGS (OL) \n2 \nTotal net changes \n  \n \n4 \nReclassification \nBenefits Officer \nP-3 to P-4 \n1 \nReclassification \nAccounting Assistant \nGS (OL) to GS (PL) \n1 \nRedeployment (from executive direction \nand management to programme of work) \nProgramme Management Officer \nP-3 \n1 \nRedeployment (from programme of work \nto executive direction and management) \nRisk Officer \nP-4 \n1 \nRedeployment (from programme of work \nto executive direction and management) \nLegal Officer (Compliance)  \nP-3 \n1 \n \n \n \n \n \n__________________ \n \n12  The admission of the Wassenaar Arrangement to membership in the United Nations Joint Staff \nPension Fund on the recommendation of the Pension Board does not amount to recognition of the \nWassenaar Arrangement by Member States that are not participating States of the Arrangement. \n\nUnited Nations pension system \nA/RES/75/246\n \n7/7\n21-00051 \n \n \nB. Office of Investment Management \n \n \nAction \nTitle of post \nCategory \nNumber \nAbolishment \nInvestment Assistant (Fixed Income) \nGS (OL) \n(1) \nAbolishment \nRisk Assistant \nGS (OL) \n(1) \nTotal net changes \n  \n \n(2) \nReclassification \nAccountant \u2013 Middle Office \nP-2/P-1 to P-3 \n1 \nRedeployment (from executive direction \nand management to programme of work) \nSenior Programme Officer \nP-5 \n1 \nRedeployment (from executive direction \nand management to programme of work) \nAdministrative Officer \nP-4 \n1 \nRedeployment (from executive direction \nand management to programme of work) \nSenior Administrative Assistant \nGS (PL) \n1 \nRedeployment (from executive direction \nand management to programme of work) \nAdministrative Assistant \nGS (OL) \n3 \nRedeployment (from programme of work \nto executive direction and management) \nRisk Officer (Portfolio Construction) \nP-4 \n1 \n \nAbbreviations: GS (OL), General Service (Other level); GS (PL), General Service (Principal level). \n \n \n \n44. Recalls paragraphs 40 (c) and 51 of the report of the Advisory Committee, \nand requests the Pension Administration and the Office of Investment Management \nto seek to further optimize premises occupation and rental costs in the light of, inter \nalia, the lessons learned during the coronavirus disease (COVID-19) pandemic, and \nto report thereon in the context of the next budget submission;  \n \n45. Approves the estimates of 111,212,700 United States dollars for the \nadministration of the Fund for 2021;  \n \n46. Also approves expenses, chargeable directly to the Fund, totalling \n103,217,600 dollars net for 2021;  \n \n47. Further approves the amount of 7,995,100 dollars as the United Nations \nshare of the cost of the administrative expenses of the Fund for 2021, of which \n4,885,000 dollars would represent the share of the regular budget and the balance of \n3,110,100 dollars would represent the share of the funds and programmes;  \n \n48. Approves the decrease of 71,300 dollars in the United Nations share of the \ncost of the administrative expenses of the central secretariat of the Fund under section 1, \nOverall policymaking, direction and coordination, of the proposed programme budget \nfor 2021;  \n \n49. \nAuthorizes the Pension Board to supplement the voluntary contributions to \nthe Emergency Fund for 2021 by an amount not to exceed 112,500 dollars. \n \n48th (resumed) plenary meeting \n31 December 2020 \n \n \n",
  "paragraphs": {
    "1": "Takes note of the report of the United Nations Joint Staff Pension Board;",
    "2": "Also takes note of the reports of the Secretary-General on the investments of the United Nations Joint Staff Pension Fund and measures undertaken to increase the diversification of the Fund and on the administrative and financial implications arising from the report of the United Nations Joint Staff Pension Board;",
    "3": "Further takes note of the report of the Chief Executive of Pension Administration and the Representative of the Secretary-General for the investment of the assets of the Fund on the implementation of the recommendations of the Board of Auditors contained in its report for the year ended 31 December 2019 on the Fund;",
    "4": "Endorses the conclusions and recommendations of the Advisory Committee on Administrative and Budgetary Questions;",
    "5": "Emphasizes the existing prerogative of the General Assembly on matters pertaining to the Fund;",
    "6": "Stresses the need for the Fund to address all the recommendations identified by the Board of Auditors and the Office of Internal Oversight Services, including in relation to vacancies in key positions, risk management, investment management, management of external fund managers, benefits payments management and other administrative processes;",
    "7": "Recalls paragraph 15 of section VIII of its resolution 74/263, and reiterates its request that the Secretary-General and the Pension Board ensure that the staff composition of the Office of Investment Management and of the Pension Administration is based on as wide a geographical basis as possible, bearing in mind Article 101, paragraph 3, of the Charter of the United Nations, and to make every effort to provide an update on progress achieved in the context of their next reports;",
    "8": "Also recalls paragraph 29 of the report of the Advisory Committee, and requests the Pension Administration and the Office of Investment Management to ensure that all vacancy announcements advertised before approval of the corresponding resources by the General Assembly indicate clearly that the recruitment is subject to a decision of the Assembly, and to review all the general temporary assistance positions of the Fund with a view to identifying potential duplication of functions and efficiencies, while ensuring that their establishment and management comply with the applicable Assembly resolutions and the Staff Regulations and Rules of the United Nations,8 notably in terms of responding to peak workload; Actuarial matters",
    "9": "Stresses the importance of continuing to achieve the necessary 3.5 per cent annual real rate of return on a long-term basis for the future solvency of the Fund; Governance matters",
    "10": "Recognizes that the Financial Regulations and Rules of the United Nations9 remain the highest framework governing all aspects related to the administrative services provided by the Secretariat, including the procurement of goods and services, the management of property and internal and external audit arrangements; __________________ 8 ST/SGB/2018/1. 9 ST/SGB/2013/4 and ST/SGB/2013/4/Amend.1. United Nations pension system A/RES/75/246 3/7 21-00051",
    "11": "Recalls paragraph 61 of the report of the Advisory Committee, and stresses that the recruitment of all posts and positions of the Fund shall be done in accordance with the relevant Staff Regulations and Rules;",
    "12": "Emphasizes that the Office of Internal Oversight Services shall remain the sole internal oversight body of the secretariat of the Fund and its investments, in line with the mandate of the Office, as set out by the General Assembly its resolution 48/218 B of 29 July 1994, and stresses that any change to the mandate in this regard remains the sole prerogative of the Assembly;",
    "13": "Recalls paragraph 8 of section VIII of its resolution 74/263, including subparagraphs (a) to (e), in which it called for a comprehensive and objective analysis of pension fund governance matters, notes the decision of the Pension Board to request the Governance Working Group to review and analyse the report of the independent external entity, and looks forward to further considering the report together with the recommendations of the Board, noting the significant variances from best practices in respect of the governance of the Fund as reflected in the report of the independent external entity, while respecting the unique nature of the Fund;",
    "14": "Notes that the key focus of this review in the context of best practices in respect of the governance of the Fund should be aimed, in particular, at the size, composition and frequency of meetings of the Pension Board, in order for its members to fulfil their fiduciary responsibilities in the best interest of the participants and the beneficiaries of the Fund;",
    "15": "Recognizes the need for the Governance Working Group to collaborate closely with the independent external entity, as appropriate, and for the Pension Board to take into account governance best practices in providing its comments on the report of the independent external entity, and looks forward to receiving updates, including concrete reform proposals and plans, taking into account the recommendations of the independent external entity as mentioned in paragraphs 13 and 14 of the present resolution, in the context of the first part of the resumed seventy-fifth session and the next annual report of the Board to the General Assembly;",
    "16": "Recalls its resolutions 73/274 and 74/263, in which it decided that the Secretary of the Pension Board should be fully independent of the Chief Executive of Pension Administration, and requests the Board to include the terms of reference and related reporting lines for both the Secretary and the Chief Executive in the context of the next report;",
    "17": "Welcomes the decision of the Pension Board to recognize, mutatis mutandis, the Regulations Governing the Status, Basic Rights and Duties of Officials other than Secretariat Officials, and Experts on Mission,10 adopted by the General Assembly by its resolution 56/280 of 27 March 2002, as the code of conduct for the Board, without prejudice to the legal status, privileges and immunities of those attending sessions of the Board or any of its committees or working groups;",
    "18": "Recalls paragraph 16 of section VIII of its resolution 74/263, and decides that the proposed amendment to article 6 of the Regulations of the Pension Fund, as recommended by the Pension Board, should be considered in the context of the review of the recommendations of the Board on the report of the independent external entity and upon submission of further proposals, including changes to the Regulations and Rules of the Fund to ensure adherence to the code of conduct; __________________ 10 ST/SGB/2002/9. A/RES/75/246 United Nations pension system 21-00051 4/7 Pension Board",
    "19": "Notes the progress made in order to eliminate all delays in payments of benefits, encourages the Pension Board to continue to enhance cooperation between the Fund and the member organizations in this regard, and requests the Pension Administration to establish and fully implement a procedure for following up on cases with missing or invalid documents and to report thereon, including on statistics, the entities involved and progress made, at the seventy-sixth session of the General Assembly;",
    "20": "Requests the Pension Board to provide in its future reports detailed updates for any recommendation of the Board of Auditors that has not been agreed upon or implemented;",
    "21": "Recalls paragraph 35 of section VIII of its resolution 74/263, and requests the Pension Board to clarify the functional responsibilities and reporting lines of the New York and Geneva offices and to submit, in the context of its next report, information on specific measures to ensure the efficiency of the Geneva office in rendering services to clients;",
    "22": "Requests the Pension Board to conduct proper monitoring through annual reports regarding the status of implementation of the Integrated Pension Administration System, specifically the challenges experienced with regard to the implementation of the system, including granting of other forms of assistance, as well as the enhancements made to address these challenges;",
    "23": "Emphasizes the need for the Pension Board to ensure that the Fund takes appropriate measures to use existing internal capacities and keeps the use of consultants in its operations to a minimum;",
    "24": "Encourages the Secretary of the Pension Board to restructure and streamline the report of the Board with the aim of making it more concise and to the point and presenting the rationale of financial and administrative proposals in a more comprehensive manner;",
    "25": "Highlights the importance attached by the General Assembly to continuing to ensure accountability by the Pension Board, and requests the Board to provide follow-up on all aspects of the implementation of the present resolution in the context of its report to be submitted to the Assembly at its seventy-sixth session; Pension Administration",
    "26": "Welcomes the three strategic goals established by the Chief Executive of Pension Administration;",
    "27": "Requests the Pension Administration to continue to adhere to the target benchmark of 75 per cent of initial benefit processing in 15 business days and to eliminate the practice of postponing the benchmark for additional documentation requirements, according to the recommendation of the Board of Auditors in its report, and to report the actual time for completion of the processing of initial benefits, including those without proper documentation, as well as the reasons for exceeding the 15 business-day target benchmark as appropriate, in the context of the next report of the Pension Board;",
    "28": "Recalls paragraph 35 of the report of the Advisory Committee, welcomes the proposal to establish a new Business Transformation and Accountability Unit in the Pension Administration, stresses the importance of developing key performance indicators to assess its efficiency and its impact on the work of the Fund, and requests United Nations pension system A/RES/75/246 5/7 21-00051 the Pension Board to provide updated information thereon in the context of its next report; Investments of the United Nations Joint Staff Pension Fund",
    "29": "Notes the restructuring of the Office of Investment Management, including the change of the reporting lines of the Risk and Compliance Section and the Operations Service to the Representative of the Secretary-General, and requests the Representative to report on the achievements of those offices;",
    "30": "Reaffirms that the Secretary-General serves as fiduciary for the investment of the assets of the Fund;",
    "31": "Supports all recommendations as contained in the report of the Office of Internal Oversight Services, including the critical recommendations 1 and 10, and requests the Secretary-General to report on their implementation in detail at the main part of its seventy-sixth session;",
    "32": "Recalls paragraph 26 of the report of the Advisory Committee, and requests the Secretary-General to address all matters related to preventing and addressing actual or perceived conflicts of interest in all areas of the Fund, including implementing the recommendations of the Board of Auditors on personal securities trading policy in respect of all personnel who may be involved in investment operations, and at all levels of the Fund\u2019s activities;",
    "33": "Notes the report of the Representative of the Secretary-General on the proposal of the Pension Board to engage, for the first time, in a range of derivative instruments available to the Fund, to effectively manage the Fund\u2019s investments and address the increasing complexity of the global capital markets environment, and in this context requests the Secretary-General to submit more detailed proposals to the General Assembly at its seventy-sixth session, including information on the use of derivative instruments, engagement in margin trading and participation in securities lending, as well as compliance measures, with a view to ensuring strict adherence to the existing policies and accountability framework and a cost-effective investment strategy, and authorizes the Secretary-General to conduct margin trading for the limited purpose set out in paragraphs 43 and 44 of his report 11 on a trial basis for two years;",
    "34": "Requests the Secretary-General to report on the use of these expanded investment strategies, including on their impact on the diversification of the Fund, in the context of his next report on the investments of the Fund, and to review the use of these expanded investment strategies and to report thereon to the General Assembly at its seventy-seventh session in order to determine whether to continue these strategies;",
    "35": "Also requests the Secretary-General, as fiduciary for the investment of the assets of the Fund, to continue to diversify its investments among developed, developing and emerging markets, wherever this serves the interests of the participants and the beneficiaries of the Fund, and further requests the Secretary- General to ensure that decisions concerning the investments of the Fund in any market are implemented prudently, taking fully into account the four main criteria for investment, namely, safety, profitability, liquidity and convertibility;",
    "36": "Recalls paragraphs 10 and 13 of the report of the Advisory Committee, and notes that emerging and frontier markets, including markets in Africa, are increasingly important to the investment strategy of the Fund; __________________ 11 A/C.5/75/2. A/RES/75/246 United Nations pension system 21-00051 6/7",
    "37": "Also recalls paragraph 45 of the report of the Advisory Committee, and requests the Secretary-General to provide updated information on vacant posts and the granting of special post allowance in the Office of Investment Management in the next report of the Pension Board; Other matters",
    "38": "Approves the admission of the Wassenaar Arrangement on Export Controls for Conventional Arms and Dual-Use Goods and Technologies to membership in the Fund, with effect from 1 January 2021;12",
    "39": "Recalls paragraph 17 of section VIII of its resolution 74/263, and requests the Pension Board to provide further analysis of and clarification on the proposed amendment to article 48 of the Regulations of the Pension Fund in the context of its next report;",
    "40": "Approves the proposed amendments to articles 4 and 8 of the Regulations of the Fund as proposed by the Pension Board;",
    "41": "Decides to defer consideration of the amendments to article 7 of the Regulations and paragraph 19 of the pension adjustment system of the Fund to its seventy-sixth session; Budget estimates for 2021",
    "42": "Recalls paragraph 14 of the report of the Advisory Committee, and stresses the importance of the Fund\u2019s improving its budgeting accuracy and presentation of costs;",
    "43": "Approves the changes to the staffing table as set out in the table below: A. Pension Administration Action Title of post Category Number New post Chief of Business Transformation and Accountability Unit P-5 1 Conversion Programme Management Officer (Risk) P-3 1 Conversion Benefits Assistant (Operations) GS (OL) 2 Total net changes 4 Reclassification Benefits Officer P-3 to P-4 1 Reclassification Accounting Assistant GS (OL) to GS (PL) 1 Redeployment (from executive direction and management to programme of work) Programme Management Officer P-3 1 Redeployment (from programme of work to executive direction and management) Risk Officer P-4 1 Redeployment (from programme of work to executive direction and management) Legal Officer (Compliance) P-3 1 __________________ 12 The admission of the Wassenaar Arrangement to membership in the United Nations Joint Staff Pension Fund on the recommendation of the Pension Board does not amount to recognition of the Wassenaar Arrangement by Member States that are not participating States of the Arrangement. United Nations pension system A/RES/75/246 7/7 21-00051 B. Office of Investment Management Action Title of post Category Number Abolishment Investment Assistant (Fixed Income) GS (OL) (1) Abolishment Risk Assistant GS (OL) (1) Total net changes (2) Reclassification Accountant \u2013 Middle Office P-2/P-1 to P-3 1 Redeployment (from executive direction and management to programme of work) Senior Programme Officer P-5 1 Redeployment (from executive direction and management to programme of work) Administrative Officer P-4 1 Redeployment (from executive direction and management to programme of work) Senior Administrative Assistant GS (PL) 1 Redeployment (from executive direction and management to programme of work) Administrative Assistant GS (OL) 3 Redeployment (from programme of work to executive direction and management) Risk Officer (Portfolio Construction) P-4 1 Abbreviations: GS (OL), General Service (Other level); GS (PL), General Service (Principal level).",
    "44": "Recalls paragraphs 40 (c) and 51 of the report of the Advisory Committee, and requests the Pension Administration and the Office of Investment Management to seek to further optimize premises occupation and rental costs in the light of, inter alia, the lessons learned during the coronavirus disease (COVID-19) pandemic, and to report thereon in the context of the next budget submission;",
    "45": "Approves the estimates of 111,212,700 United States dollars for the administration of the Fund for 2021;",
    "46": "Also approves expenses, chargeable directly to the Fund, totalling 103,217,600 dollars net for 2021;",
    "47": "Further approves the amount of 7,995,100 dollars as the United Nations share of the cost of the administrative expenses of the Fund for 2021, of which 4,885,000 dollars would represent the share of the regular budget and the balance of 3,110,100 dollars would represent the share of the funds and programmes;",
    "48": "Approves the decrease of 71,300 dollars in the United Nations share of the cost of the administrative expenses of the central secretariat of the Fund under section 1, Overall policymaking, direction and coordination, of the proposed programme budget for 2021;",
    "49": "Authorizes the Pension Board to supplement the voluntary contributions to the Emergency Fund for 2021 by an amount not to exceed 112,500 dollars. 48th (resumed) plenary meeting 31 December 2020"
  },
  "agenda_items": [
    "Item 149"
  ],
  "symbol_references": []
}