{
  "symbol": "A/RES/80/35",
  "filename": "A_RES_80_35.pdf",
  "title": "80/35. Implementation of the Convention on the Prohibition of the Use, Stockpiling, Production and Transfer of Anti-Personnel Mines and on Their Destruction",
  "text": "United Nations \nA/RES/80/35\n \nGeneral Assembly \nDistr.: General \n3 December 2025 \n25-19827 (E) \n*2519827* \n \n \nEightieth session \nAgenda item 99 (n) \nGeneral and complete disarmament: implementation of \nthe Convention on the Prohibition of the Use, Stockpiling, \nProduction and Transfer of Anti-Personnel Mines and on \nTheir Destruction \n \n \n \n \n Resolution adopted by the General Assembly \non 1 December 2025 \n \n \n[on the report of the First Committee (A/80/534, para. 7)] \n \n \n \n80/35. Implementation of the Convention on the Prohibition of the Use, \nStockpiling, Production and Transfer of Anti-Personnel Mines and \non Their Destruction \n \n \n \nThe General Assembly, \n \nRecalling its resolutions 54/54 B of 1 December 1999, 55/33 V of 20 November \n2000, 56/24 M of 29 November 2001, 57/74 of 22 November 2002, 58/53 of \n8 December 2003, 59/84 of 3 December 2004, 60/80 of 8 December 2005, 61/84 of \n6 December 2006, 62/41 of 5 December 2007, 63/42 of 2 December 2008, 64/56 of \n2 December 2009, 65/48 of 8 December 2010, 66/29 of 2 December 2011, 67/32 of \n3 December 2012, 68/30 of 5 December 2013, 69/34 of 2 December 2014, 70/55 of \n7 December 2015, 71/34 of 5 December 2016, 72/53 of 4 December 2017, 73/61 of \n5 December 2018, 74/61 of 12 December 2019, 75/52 of 7 December 2020, 76/26 of \n6 December 2021, 77/63 of 7 December 2022, 78/45 of 4 December 2023 and 79/34 \nof 2 December 2024, \n \nReaffirming its determination to put an end to the suffering and casualties caused \nby anti\u2011personnel mines, which kill or injure thousands of people \u2013 women, girls, \nboys and men \u2013 every year, and which place people living in affected areas at risk and \nhinder the development of their communities, \n \nBelieving it necessary to do the utmost to contribute in an efficient and \ncoordinated manner to facing the challenge of removing anti\u2011personnel mines placed \nthroughout the world and to assure their destruction, \n \nWishing to do the utmost to ensure assistance for the care and rehabilitation, \nincluding the social and economic reintegration, of mine victims, \n\nA/RES/80/35 \nImplementation of the Convention on the Prohibition \nof the Use, Stockpiling, Production and Transfer of \nAnti-Personnel Mines and on Their Destruction\n \n25-19827\n2/3 \n \n \nNoting with satisfaction the work undertaken to implement the Convention on \nthe Prohibition of the Use, Stockpiling, Production and Transfer of Anti-Personnel \nMines and on Their Destruction1 and the substantial progress made towards \naddressing the global anti\u2011personnel landmine problem, and stressing the importance \nof implementing all of the provisions of the Convention, \n \nRecalling the First to Twenty-first Meetings of the States Parties to the \nConvention, held in Maputo (1999), Geneva (2000), Managua (2001), Geneva (2002), \nBangkok (2003), Zagreb (2005), Geneva (2006), the Dead Sea (2007), Geneva (2008 \nand 2010), Phnom Penh (2011), Geneva (2012, 2013 and 2015), Santiago (2016), \nVienna (2017), Geneva (2018 and 2020), The Hague (2021) and Geneva (2022 and \n2023), and the First, Second, Third, Fourth and Fifth Review Conferences of the \nStates Parties to the Convention, held in Nairobi (2004), Cartagena, Colombia (2009), \nMaputo (2014), Oslo (2019) and Siem Reap, Cambodia (2024), \n \nRecalling also that, at the Fifth Review Conference of the States Parties to the \nConvention, the international community reviewed the implementation of the \nConvention, and the States Parties adopted a declaration and an action plan for the \nperiod 2025\u20132029 to support the enhanced implementation and promotion of the \nConvention, and stressing the importance of implementing the Siem Reap \u2013 Angkor \nAction Plan 2025\u20132029, \n \nUnderlining the importance of cooperation and assistance in the implementation \nof the Convention, including through the so-called individualized approach, which \noffers mine-affected countries a platform for presenting their challenges, \n \nStressing the need to take into account gender aspects in mine action, \n \nNoting with satisfaction that 166 States have ratified or acceded to the \nConvention and have formally accepted the obligations of the Convention, and \nwelcoming the ratification of the Convention by the Marshall Islands and the \naccession of Tonga, \n \nNoting with regret that five States have decided to withdraw from the \nConvention, representing a setback and challenges in the universalization efforts, \n \nNoting with deep regret that anti\u2011personnel mines continue to be used in some \nconflicts around the world, causing human suffering and impeding post-conflict \nreconstruction and development, \n \nEmphasizing the desirability of attracting the adherence of all States to the \nConvention, determined to work strenuously towards the promotion of its \nuniversalization and norms, and acknowledging the campaign by the Secretary-\nGeneral for humanitarian disarmament and mine action, \n \n1. \nInvites all States that are not party to the Convention on the Prohibition of \nthe Use, Stockpiling, Production and Transfer of Anti-Personnel Mines and on Their \nDestruction to accede to it without delay; \n \n2. \nStresses the importance of the full and effective implementation of and \ncompliance with the Convention, including through the continued implementation of \nthe action plans under the Convention; \n \n3. \nExpresses strong concern regarding the use of anti\u2011personnel mines in \nvarious parts of the world, including use highlighted in recent allegations, reports and \ndocumented evidence; \n_______________ \n \n1 United Nations, Treaty Series, vol. 2056, No. 35597. \n\nImplementation of the Convention on the Prohibition \nof the Use, Stockpiling, Production and Transfer of \nAnti-Personnel Mines and on Their Destruction \nA/RES/80/35\n \n3/3\n25-19827 \n \n \n4. \nUrges all States Parties to provide the Secretary-General with complete \nand timely information as required under article 7 of the Convention in order to \npromote transparency and compliance with the Convention; \n \n5. \nInvites all States that are not party to the Convention to provide, on a \nvoluntary basis, information to make global mine action efforts more effective; \n \n6. \nRenews its call upon all States and other relevant parties to work together \nto promote, support and advance the care, rehabilitation and social and economic \nreintegration of mine victims, mine risk education and reduction programmes and the \nremoval and destruction of anti\u2011personnel mines placed or stockpiled throughout the \nworld; \n \n7. \nUrges all States to remain seized of the issue at the highest political level \nand, where in a position to do so, to promote adherence to the Convention through \nbilateral, subregional, regional and multilateral contacts, outreach, seminars and other \nmeans, in particular in the light of the decisions adopted at the Fifth Review \nConference; \n \n8. \nInvites and encourages all interested States, the United Nations, other \nrelevant international organizations or institutions, regional organizations, the \nInternational Committee of the Red Cross and relevant non\u2011governmental \norganizations to attend the Twenty-second Meeting of the States Parties, to be held in \nGeneva from 1 to 5 December 2025, and to participate in the future programme of \nmeetings of the States Parties to the Convention; \n \n9. \nRequests the Secretary-General, in accordance with article 12, \nparagraph 1, of the Convention, to undertake the preparations necessary to convene \nthe Twenty third Meeting of the States Parties to the Convention and, on behalf of the \nStates Parties and in accordance with article 12, paragraph 3, of the Convention, to \ninvite States not Parties to the Convention, as well as the United Nations, other \nrelevant international organizations or institutions, regional organizations, the \nInternational Committee of the Red Cross and relevant non\u2011governmental \norganizations, to attend the Twenty-third Meeting of the States Parties as observers; \n \n10. Calls upon States Parties and States participating in meetings to address \nissues arising from outstanding dues and to proceed promptly with the payment of \ntheir share of the estimated costs; \n \n11. \nDecides to include in the provisional agenda of its eighty-first session, \nunder the item entitled \u201cGeneral and complete disarmament\u201d, the sub-item entitled \n\u201cImplementation of the Convention on the Prohibition of the Use, Stockpiling, \nProduction and Transfer of Anti-Personnel Mines and on Their Destruction\u201d. \n \n52nd plenary meeting \n1 December 2025 \n \n",
  "paragraphs": {
    "1": "Invites all States that are not party to the Convention on the Prohibition of the Use, Stockpiling, Production and Transfer of Anti-Personnel Mines and on Their Destruction to accede to it without delay;",
    "2": "Stresses the importance of the full and effective implementation of and compliance with the Convention, including through the continued implementation of the action plans under the Convention;",
    "3": "Expresses strong concern regarding the use of anti\u2011personnel mines in various parts of the world, including use highlighted in recent allegations, reports and documented evidence; _______________ 1 United Nations, Treaty Series, vol. 2056, No. 35597. Implementation of the Convention on the Prohibition of the Use, Stockpiling, Production and Transfer of Anti-Personnel Mines and on Their Destruction A/RES/80/35 3/3 25-19827",
    "4": "Urges all States Parties to provide the Secretary-General with complete and timely information as required under article 7 of the Convention in order to promote transparency and compliance with the Convention;",
    "5": "Invites all States that are not party to the Convention to provide, on a voluntary basis, information to make global mine action efforts more effective;",
    "6": "Renews its call upon all States and other relevant parties to work together to promote, support and advance the care, rehabilitation and social and economic reintegration of mine victims, mine risk education and reduction programmes and the removal and destruction of anti\u2011personnel mines placed or stockpiled throughout the world;",
    "7": "Urges all States to remain seized of the issue at the highest political level and, where in a position to do so, to promote adherence to the Convention through bilateral, subregional, regional and multilateral contacts, outreach, seminars and other means, in particular in the light of the decisions adopted at the Fifth Review Conference;",
    "8": "Invites and encourages all interested States, the United Nations, other relevant international organizations or institutions, regional organizations, the International Committee of the Red Cross and relevant non\u2011governmental organizations to attend the Twenty-second Meeting of the States Parties, to be held in Geneva from 1 to 5 December 2025, and to participate in the future programme of meetings of the States Parties to the Convention;",
    "9": "Requests the Secretary-General, in accordance with article 12, paragraph 1, of the Convention, to undertake the preparations necessary to convene the Twenty third Meeting of the States Parties to the Convention and, on behalf of the States Parties and in accordance with article 12, paragraph 3, of the Convention, to invite States not Parties to the Convention, as well as the United Nations, other relevant international organizations or institutions, regional organizations, the International Committee of the Red Cross and relevant non\u2011governmental organizations, to attend the Twenty-third Meeting of the States Parties as observers;",
    "10": "Calls upon States Parties and States participating in meetings to address issues arising from outstanding dues and to proceed promptly with the payment of their share of the estimated costs;",
    "11": "Decides to include in the provisional agenda of its eighty-first session, under the item entitled \u201cGeneral and complete disarmament\u201d, the sub-item entitled \u201cImplementation of the Convention on the Prohibition of the Use, Stockpiling, Production and Transfer of Anti-Personnel Mines and on Their Destruction\u201d. 52nd plenary meeting 1 December 2025"
  },
  "agenda_items": [
    "Item 99"
  ],
  "symbol_references": []
}