{
  "symbol": "A/RES/78/161",
  "filename": "A_RES_78_161.pdf",
  "title": "78/161. Culture and sustainable development",
  "text": "United Nations \nA/RES/78/161\n \n \nGeneral Assembly \nDistr.: General \n21 December 2023 \n \n23-25890 (E)    030124 \n*2325890* \n \n \nSeventy-eighth session \nAgenda item 19 (b) \nGlobalization and interdependence: culture and \nsustainable development \n \n \n \n \n Resolution adopted by the General Assembly on \n19 December 2023 \n \n \n \n \n[on the report of the Second Committee (A/78/462/Add.2, para. 7)] \n \n \n 78/161. Culture and sustainable development \n \n \n \nThe General Assembly, \n \nGuided by the purposes and principles enshrined in the Charter of the United \nNations,  \n \nRecalling its resolutions 41/187 of 8 December 1986, 46/158 of 19 December \n1991, 51/179 of 16 December 1996, 52/197 of 18 December 1997, 53/184 of \n15 December 1998, 55/192 of 20 December 2000, 57/249 of 20 December 2002, \n65/166 of 20 December 2010 and 66/208 of 22 December 2011 concerning culture \nand development, 66/288 of 27 July 2012, entitled \u201cThe future we want\u201d, and 68/223 \nof 20 December 2013, 69/230 of 19 December 2014, 70/214 of 22 December 2015, \n72/229 of 20 December 2017, 74/230 of 19 December 2019 and 76/214 of \n17 December 2021 on culture and sustainable development,  \n \nReaffirming its resolution 70/1 of 25 September 2015, entitled \u201cTransforming \nour world: the 2030 Agenda for Sustainable Development\u201d, in which it adopted a \ncomprehensive, far-reaching and people-centred set of universal and transformative \nSustainable Development Goals and targets, its commitment to working tirelessly for \nthe full implementation of the Agenda by 2030, its recognition that eradicating \npoverty in all its forms and dimensions, including extreme poverty, is the greatest \nglobal challenge and an indispensable requirement for sustainable development, its \ncommitment to achieving sustainable development in its three dimensions \u2013 \neconomic, social and environmental \u2013 in a balanced and integrated manner, and to \nbuilding upon the achievements of the Millennium Development Goals and seeking \nto address their unfinished business,  \n \nWelcoming the final declaration of the World Conference on Cultural Policies \nand Sustainable Development (Mondiacult 2022), \n\nA/RES/78/161 \nCulture and sustainable development\n \n23-25890\n2/11 \n \n \nReaffirming the Paris Agreement1 and its early entry into force, encouraging all \nits parties to fully implement the Agreement, and parties to the United Nations \nFramework Convention on Climate Change2 that have not yet done so to deposit their \ninstruments of ratification, acceptance, approval or accession, where appropriate, as \nsoon as possible,  \n \nRecalling the Sharm el-Sheikh Implementation Plan,3 adopted at the twenty-\nseventh session of the Conference of the Parties to the United Nations Framework \nConvention on Climate Change, which also notes with grave concern the adverse \neffects of climate change resulting in devastating impacts on cultural heritage,  \n \nReaffirming its resolution 69/313 of 27 July 2015 on the Addis Ababa Action \nAgenda of the Third International Conference on Financing for Development, which \nis an integral part of the 2030 Agenda for Sustainable Development, supports and \ncomplements it, helps to contextualize its means of implementation targets with \nconcrete policies and actions, and reaffirms the strong political commitment to \naddress the challenge of financing and creating an enabling environment at all levels \nfor sustainable development in the spirit of global partnership and solidarity,  \n \nWelcoming the New Urban Agenda, adopted at the United Nations Conference \non Housing and Sustainable Urban Development (Habitat III), held in Quito, Ecuador, \nfrom 17 to 20 October 2016,4 calling for its full, effective and timely implementation \nat all levels, and reaffirming that culture and cultural diversity are sources of \nenrichment for humankind and provide an important contribution to the sustainable \ndevelopment of cities, human settlements and citizens, empowering them to play an \nactive and unique role in development initiatives, and generating full and productive \nemployment, decent work for all and livelihood opportunities,  \n \nRecalling that, in the 2030 Agenda, inter alia, the natural and cultural diversity \nof the world is acknowledged, and it is recognized that cultures and civilizations can \ncontribute to, and are crucial enablers of, sustainable development,  \n \nRecalling also the 2005 Convention on the Protection and Promotion of the \nDiversity of Cultural Expressions,5 as well as other international conventions of the \nUnited Nations Educational, Scientific and Cultural Organization that provide a \ncomprehensive framework for the protection, safeguarding and promotion of culture \nin all its dimensions and acknowledge cultural diversity and economic and social \ndevelopment,6  \n \nRecognizing that culture is an essential component of human development, that \nit represents a source of identity, innovation and creativity for the individual and the \ncommunity and that it is an important factor in social inclusion and poverty \neradication, providing for sustainable economic growth and ownership of \ndevelopment processes,  \n__________________ \n \n1  Adopted under the UNFCCC in FCCC/CP/2015/10/Add.1, decision 1/CP.21.  \n \n2  United Nations, Treaty Series, vol. 1771, No. 30822. \n \n3  FCCC/CP/2022/10/Add.1, decision 1/CP.27. \n \n4  Resolution 71/256, annex. \n \n5  United Nations, Treaty Series, vol. 2440, No. 43977. \n \n6  Convention for the Protection of Cultural Property in the Event of Armed Conflict, of 1954 \n(United Nations, Treaty Series, vol. 249, No. 3511); Convention on the Means of Prohibiting and \nPreventing the Illicit Import, Export and Transfer of Ownership of Cultural Property, of 1970 \n(United Nations, Treaty Series, vol. 823, No. 11806); Convention concerning the Protection of \nthe World Cultural and Natural Heritage, of 1972 (United Nations, Treaty Series, vol. 1037, \nNo. 15511); Convention on the Protection of the Underwater Cultural Heritage, of 2001 (United \nNations, Treaty Series, vol. 2562, No. 45694); and Convention for the Safeguarding of the \nIntangible Cultural Heritage, of 2003 (United Nations, Treaty Series, vol. 2368, No. 42671). \n\nCulture and sustainable development \nA/RES/78/161\n \n3/11\n23-25890 \n \n \nRecognizing also the growing importance of the digital transformation in \nopening up prospects for broadening access to culture for all, including by creating \nan enabling environment for the creative economy, \n \nRecognizing further the importance of respect and understanding for cultural \ndiversity throughout the world and of working together and not against each other \nand of fostering intercultural understanding and dialogue, mutual listening and \nlearning and an ethic of global citizenship and solidarity,  \n \nRecalling its resolutions 73/130 of 13 December 2018 and 76/16 of 6 December \n2021 on the return or restitution of cultural property to the countries of origin, in line \nwith the Convention on the Means of Prohibiting and Preventing the Illicit Import, \nExport and Transfer of Ownership of Cultural Property of the United Nations \nEducational, \nScientific \nand \nCultural \nOrganization, \nand \nother \nrelevant \nintergovernmentally agreed instruments, aware of the importance attached to the \nreturn of cultural property that is of fundamental spiritual, historical and cultural \nvalue, and expressing deep concern about the continuing illicit trafficking in cultural \nproperty and the ensuing damage to the cultural heritage of nations, \n \nRecalling also the adoption of the United Nations Declaration on the Rights of \nIndigenous Peoples, on 13 September 2007,7 and its call for States to enable access \nto and/or the repatriation of ceremonial objects and human remains in their possession \nthrough fair, transparent and effective mechanisms developed in conjunction with \nIndigenous Peoples concerned, \n \nRecalling further the principles of the Universal Declaration on Cultural \nDiversity of the United Nations Educational, Scientific and Cultural Organization, 8 \nand acknowledging that cultural diversity is a source of enrichment for humankind \nand an important contribution to the sustainable development of local communities, \nIndigenous Peoples, and nations, supporting their ability to play an active and unique \nrole in development initiatives, \n \nRecognizing the importance of multilingualism as a means of promoting, \nprotecting and preserving the diversity of languages and cultures globally, including \nIndigenous languages, and that genuine multilingualism promotes unity in diversity \nand international understanding, and recognizing also the importance for the peoples \nof the world of being able to communicate in their own language, \n \nRecalling its resolution 71/178 of 19 December 2016, in which it proclaimed \nthe year beginning on 1 January 2019 the International Year of Indigenous Languages, \nas well as its resolution 74/135 of 18 December 2019, in which it proclaimed the \nperiod 2022\u20132032 as the International Decade of Indigenous Languages, to draw \nattention to the critical loss of Indigenous languages and the urgent need to preserve, \nrevitalize and promote Indigenous languages,  \n \nRecalling also its resolution 74/198 of 19 December 2019, in which it declared \n2021 the International Year of Creative Economy for Sustainable Development, to \ndraw attention to the relevance of the creative economy in creating full and productive \nemployment and decent work, supporting entrepreneurship, creativity and innovation, \nempowering people, promoting social inclusion and reducing poverty so as to attain \ninclusive, equitable and sustainable growth and development, and encouraging the \nformalization and growth of micro-, small and medium-sized enterprises, \n__________________ \n \n7  Resolution 61/295, annex. \n \n8  United Nations Educational, Scientific and Cultural Organization, Records of the General \nConference, Thirty-first Session, Paris, 15 October\u20133 November 2001, vol. 1 and corrigendum, \nResolutions, sect. V, resolution 25, annex I. \n\nA/RES/78/161 \nCulture and sustainable development\n \n23-25890\n4/11 \n \n \nNoting the fourth international conference on the theme \u201cPreservation of world \nlanguages and development of linguistic diversity in cyberspace: context, policy, \npractice\u201d, held under the auspices of the United Nations Educational, Scientific and \nCultural Organization in Yakutsk, Russian Federation, from 1 to 5 July 2019, \n \nRecalling the concerns expressed in the Beijing Declaration and Platform for \nAction9 on the underrepresentation of women in decision-making positions in the area \nof culture, which has prevented women from having a significant impact in the area \nof culture and development, \n \nRecalling also the importance of the promotion of national cultures, artistic \ncreation in all its forms and international and regional cultural cooperation, and \nreaffirming in this regard the relevance of strengthening national efforts and regional \nand international cooperation mechanisms for cultural action and artistic creation and \nrecognizing respect for cultural pluralism, as defined by the Universal Declaration on \nCultural Diversity, adopted in 2001, as policies for the inclusion and participation of \nall citizens that guarantee social cohesion and the vitality of civil society and peace, \nenhance cultural development and contribute to sustainable development,  \n \nRecognizing the linkages between cultural and biological diversity and the \npositive contribution of local and Indigenous traditional knowledge in addressing \nenvironmental challenges in a sustainable manner,  \n \nWelcoming the first part of the fifteenth meeting of the Conference of the Parties \nto the Convention on Biological Diversity, held in Kunming, China, from 11 to \n15 October 2021, and the second part of the fifteenth meeting of the Conference of \nthe Parties to the Convention, held in Montreal, Canada, from 7 to 19 December 2022, \nand its outcomes, including the Kunming-Montreal Global Biodiversity Framework, \nand urging their early, inclusive and effective implementation, \n \nRecalling the United Nations strategic plan for forests 2017\u20132030, 10  and \nacknowledging that, in many regions, forests have important cultural and spiritual value, \n \nTaking note of the declaration adopted in Florence, Italy, on 4 October 2014, at \nthe third United Nations Educational, Scientific and Cultural Organization World \nForum on Culture and Cultural Industries, the Hangzhou outcomes, adopted at the \nconference on the theme \u201cCulture for sustainable cities\u201d, held in Hangzhou, China, \nfrom 10 to 12 December 2015, the Bali Declaration, adopted at the second World \nCulture Forum, held in Bali, Indonesia, from 10 to 14 October 2016, the global report \non culture for sustainable urban development of the United Nations Educational, \nScientific and Cultural Organization, entitled Culture: Urban Future, of October \n2016, the new strategy for the integration of culture and creativity in the \nimplementation of the 2030 Agenda for Sustainable Development, adopted at the \neleventh annual meeting of the Creative Cities Network, held in Enghien-les-Bains, \nFrance, from 30 June to 2 July 2017, the twelfth annual meeting of the Creative Cities \nNetwork, held in Krakow and Katowice, Poland, from 12 to 15 June 2018, and the \nthirteenth annual meeting of the Creative Cities Network, held in Fabriano, Italy, from \n10 to 15 June 2019, as well as its discussions on the role of culture across development \nareas, including education, entrepreneurship, innovation, inclusiveness and \nenvironmental sustainability, the third edition of the United Nations Educational, \nScientific and Cultural Organization Creative Cities Beijing Summit on the theme \n\u201cCreativity empowers cities, technology creates the future\u201d, held in hybrid format on \n17 and 18 September 2020, the online meeting of the Creative Cities Network \nco-organized with the creative city of Santos, Brazil, on 6 and 7 July 2021, with a \n__________________ \n \n9  Report of the Fourth World Conference on Women, Beijing, 4\u201315 September 1995 (United \nNations publication, Sales No. E.96.IV.13), chap. I, resolution 1, annexes I and II. \n \n10  See resolution 71/285. \n\nCulture and sustainable development \nA/RES/78/161\n \n5/11\n23-25890 \n \nspecial focus on creative cities\u2019 responses to the coronavirus disease (COVID-19), the \nfourteenth annual conference of the Creative Cities Network, held in Santos, Brazil, \nfrom 18 to 22 July 2022 on the theme \u201cCreativity, Path to Equality\u201d, and its fifteenth \nedition held in Istanbul, T\u00fcrkiye, from 11 to 15 September 2023, on the theme \n\u201cFuture-proof cities\u201d,  \n \nRecognizing the role of museums as crucial partners for protecting and \npromoting culture, from safeguarding world heritage to countering illicit trafficking \nin cultural property, in particular through their preservation, research, communication \nand education efforts, \n \nRecognizing also that culture in diplomacy remains an important component of \nstrengthening international relations, \n \nNoting with great concern the severe negative impact on human health, safety \nand well-being caused by the coronavirus disease (COVID-19) pandemic, as well as \nthe severe disruption to societies and economies and the devastating impact on lives \nand livelihoods, and that the poorest and most vulnerable are the hardest hit by the \npandemic, reaffirming the ambition to get back on track to achieve the Sustainable \nDevelopment Goals by designing and implementing sustainable and inclusive \nrecovery strategies to accelerate progress towards the full implementation of the 2030 \nAgenda for Sustainable Development and to help to reduce the risk of and build \nresilience to future shocks, crises and pandemics, including by strengthening health \nsystems and achieving universal health coverage, and recognizing that equitable and \ntimely access for all to safe, quality, effective and affordable COVID-19 vaccines, \ntherapeutics and diagnostics are an essential part of a global response based on unity, \nsolidarity, renewed multilateral cooperation and the principle of leaving no one \nbehind, \n \nExpressing its concern about the continued vulnerability of the cultural sector, \nparticularly in the wake of the global COVID-19 crisis, which has profoundly \ndisrupted the cultural ecosystem as a whole, exacerbating structural fragilities and \ninequalities, including social and gender gaps, unequal access to culture, restrictions \non artistic freedom, and the status and livelihoods of artists, cultural professionals, \npractitioners and communities, affecting the creation, production, distribution and \naccess to cultural goods and services, aggravating the loss of tourism revenues and \nbringing to light the critical contribution of the cultural and creative sectors to \nsocieties and to the achievement of the 2030 Agenda, and taking note of the reports \nentitled \u201cAssessment of the impact of COVID-19 on cultural and creative industries\u201d, \n\u201cCulture in times of COVID-19: resilience, recovery and revival\u201d and \u201cCultural and \ncreative industries in the face of COVID-19: an economic impact outlook\u201d, produced \nin 2021 and 2022 by the United Nations Educational, Scientific and Cultural \nOrganization, \n \nReiterating the pledge that no one will be left behind, reaffirming the \nrecognition that the dignity of the human person is fundamental, and the wish to see \nthe Goals and targets met for all nations and peoples and for all segments of society, \nand recommitting to endeavour to reach the furthest behind first, \n \n1. \nTakes note of the note by the Secretary-General transmitting the report of \nthe United Nations Educational, Scientific and Cultural Organization; 11  \n \n2. \nReaffirms the role of culture as an enabler of sustainable development that \nprovides people and communities with a strong sense of identity and social cohesion \nand contributes to more effective and sustainable development policies and measures \n__________________ \n \n11  A/78/217. \n\nA/RES/78/161 \nCulture and sustainable development\n \n23-25890\n6/11 \n \nat all levels, and stresses in this regard that policies responsive to cultural contexts \ncan yield better, sustainable, inclusive and equitable development outcomes; \n \n3. \nAlso reaffirms the intrinsic value of culture, and recognizes its contribution \nto all three dimensions of sustainable development;  \n \n4. \nRecognizes the power of culture as a driver of sustainable development, \nwhich contributes to fostering social inclusion and developing a strong and viable \neconomic sector by generating income, creating decent jobs for all, and addressing \nboth the economic and social dimensions of poverty through cultural heritage, \nincluding its protection and preservation, and cultural and creative sectors, while \nproviding innovative and effective solutions to cross-cutting issues, such as education, \nhealth, gender equality and women\u2019s empowerment, technology and the environment;  \n \n5. \nCalls for enhanced support, including additional financial resources and \ninvestments, for the cultural and creative sectors, including in the context of \nCOVID-19 recovery efforts, while recognizing culture\u2019s fundamental role in societies \nand its impact on sustainable development, to protect artists and cultural \nprofessionals, foster knowledge, innovation and intercultural dialogue, adapt them to \nthe digital transformation, strengthen linkages between culture and education, \nsafeguard cultural heritage and traditional and ancestral knowledge, including of \nIndigenous Peoples and local communities, promote peaceful and inclusive societies, \nengage all segments of society through culture, including by noting the challenges \nfaced by women and youth, address the impacts of the pandemic on the cultural value \nchain and cultural diversity, reinforce interlinkages between culture and nature, and \nharness the potential and transformative impact of culture for sustainable \ndevelopment, recognizing its multidimensional impact on the resilience, well-being \nand prosperity of people and their communities;  \n \n6. \nEmphasizes the important contribution of culture to the three dimensions \nof sustainable development and to the achievement of national development \nobjectives, the 2030 Agenda for Sustainable Development 12  and its Sustainable \nDevelopment Goals, as well as other internationally agreed development goals, and \nin this regard acknowledges:  \n \n(a) \nThat culture contributes to inclusive economic development, as cultural \nheritage preservation, cultural and creative sectors, sustainable cultural tourism and \ncultural infrastructure, including urban regeneration, are sources of income \ngeneration, job creation and decent work for all, including at the community level, \nthus improving living conditions and fostering community-based economic growth, \nand contribute to the empowerment of individuals;  \n \n(b) \nThat culture contributes to inclusive social development for all, including \nlocal communities, and Indigenous Peoples, with respect for cultural diversity, \nsafeguarding of the cultural and natural heritage, fostering of cultural institutions and \nstrengthening of cultural and creative sectors, in urban and rural contexts;  \n \n(c) \nThat culture contributes to environmental sustainability, since the \nprotection of cultural and biological diversity and natural heritage is important for \nsustainable development, and that support for traditional systems of environmental \nprotection, and resource management, can contribute to the increased sustainability \nof fragile ecosystems and the conservation, protection and sustainable use of \nbiodiversity and to avoiding land degradation and addressing climate change;  \n \n7. \nReaffirms that sustainable development cannot be realized without peace \nand security and that peace and security will be at risk without sustainable \ndevelopment, and acknowledges that culture can contribute to sustainable \n__________________ \n \n12  Resolution 70/1. \n\nCulture and sustainable development \nA/RES/78/161\n \n7/11\n23-25890 \n \ndevelopment by constituting a valuable resource for enabling communities to \nparticipate fully in social and cultural life, facilitating inclusive governance and \ndialogue at the national, regional and international levels and contributing to conflict \nprevention and resolution, as well as to reconciliation, recovery and resilience;  \n \n8. \nReaffirms its commitment to embracing diversity in cities and human \nsettlements, to strengthening social cohesion, intercultural dialogue and understanding, \ntolerance, mutual respect, gender equality and women\u2019s empowerment, innovation, \nentrepreneurship, inclusion, identity and safety, and the dignity of all people, \nincluding people in vulnerable situations, as well as to fostering liveability and a \nvibrant urban economy and to taking steps to ensure that local institutions promote \npluralism and peaceful coexistence within increasingly heterogeneous and \nmulticultural societies;  \n \n9. \nRecognizes that culture should be taken into account in the promotion and \nimplementation of new sustainable consumption and production patterns that \ncontribute to the responsible use of resources and address the adverse impacts of \nclimate change;  \n \n10. Acknowledges that quality education, non-formal education and lifelong \nlearning are enriched by culture, transmitting shared values, knowledge and skills, \nand also acknowledges that culture and arts education can make a direct contribution \nto the constructive transformation of educational systems, including through technical \nand vocational education and training, to meet the needs of learners in a rapidly \nchanging world and the need for a creative and adaptive workforce;13  \n \n11. \nCalls for the development of learners\u2019 potential for creativity and \ninnovation, their capacity to enjoy and to express themselves through the arts, their \nawareness of history and the diversity of cultures, as well as the promotion of \neducation for the protection of cultural and natural heritage and places of memory \nwhose existence is necessary for the safeguarding of cultural expressions;  \n \n12. Recalls the inclusion in the 2030 Agenda of several targets reflecting the \ncontribution of culture to sustainable development, also recalls that the Sustainable \nDevelopment Goals and targets are integrated and indivisible and balance the three \ndimensions of sustainable development, and in this regard looks forward to their \nachievement, building on the power of culture as an enabler and driver of progress on \nthe Sustainable Development Goals;  \n \n13. Welcomes the efforts and initiatives of the United Nations Educational, \nScientific and Cultural Organization, as the mandated United Nations agency on \nculture, to strengthen and measure the transformational impact of culture on the \nrealization of the 2030 Agenda, building on information and data provided by the \nMember States in the framework of the periodic reports of the complete set of United \nNations Educational, Scientific and Cultural Organization instruments in the field of \nculture and other related indicator frameworks, including the Culture 2030 Indicators;  \n \n14. Decides to give consideration, as appropriate, to the contribution of culture \nto sustainable development in the follow-up and review framework of the 2030 \nAgenda, including pursuant to the review of Goal 11, which would generate an \nimportant boost for implementation of Goal 11 between now and 2030; \n \n15. Takes note with appreciation of the high-level event on culture and \nsustainable development in July 2023, convened by the President of the General \nAssembly, with the support of the United Nations Educational, Scientific and Cultural \n__________________ \n \n13  As stated in the preamble to the outcome document of the second World Conference on Arts \nEducation, held in Seoul from 25 to 28 May 2010, namely, the Seoul Agenda: Goals for the \nDevelopment of Arts Education. \n\nA/RES/78/161 \nCulture and sustainable development\n \n23-25890\n8/11 \n \nOrganization, on the occasion of the World Day for Cultural Diversity for Dialogue \nand Development, pursuant to resolution 76/214;  \n \n16. Welcomes the convening of the World Conference on Cultural Policies and \nSustainable Development, also known as \u201cMondiacult 2022\u201d, hosted by the \nGovernment of Mexico from 28 to 30 September 2022, looks forward to the \nforthcoming World Conference on Culture and Arts Education, to be held in the \nUnited Arab Emirates in 2024, for the further strengthening of the linkages between \nculture and education, and welcomes the convening in Saudi Arabia of the forty-fifth \nsession of the World Heritage Committee, from 10 to 25 September 2023; \n \n17. Invites all countries, as well as intergovernmental bodies and organizations \nof the United Nations system, within their respective mandates and resources, \nrelevant non-governmental organizations and all other relevant stakeholders:  \n \n(a) \nTo raise public awareness of the importance of cultural diversity for \nsustainable development, promoting its positive value through education and media \ntools, while also pursuing multilingualism as a mean of promoting, protecting and \npreserving diversity of languages and cultures globally;  \n \n(b) \nTo ensure a more visible and effective integration and mainstreaming of \nculture into economic, social and environmental development policies and strategies \nat all levels;  \n \n(c) \nTo ensure that women and men can equally access, participate in and \ncontribute to cultural life and decision-making, and to further commit themselves to \nthe development of cultural policies and programmes with a gender perspective at the \nlocal, national and international levels in order to achieve gender equality and the \nempowerment of all women and girls;  \n \n(d) \nTo undertake relevant intercultural dialogue and cooperation and cultural \ndiversity programmes for youth to engage in a multicultural society, participate in the \nachievement of the 2030 Agenda, achieve better educational results and acquire a \nbroader and more diverse range of skills and competences;  \n \n(e) \nTo promote capacity-building, where appropriate, at all levels for the \ndevelopment of dynamic cultural and creative sectors, in particular by encouraging \ncreativity, innovation and entrepreneurship, including for women and youth, \nsupporting the development of cultural institutions and cultural and creative sectors, \nproviding technical and vocational training for culture professionals and increasing \nemployment opportunities in the cultural and creative sectors for sustained, inclusive \nand equitable economic growth and development;  \n \n(f) \nTo actively support the emergence of local markets for cultural goods and \nservices and to facilitate the effective, equitable and licit access of such goods and \nservices to international markets, including in the digital environment, taking into \naccount the expanding range of cultural production and consumption and, for States \nparties thereto, the provisions of the Convention on the Protection and Promotion of \nthe Diversity of Cultural Expressions, adopted in 2005;  \n \n(g) \nTo promote cultural and linguistic diversity, and equal access to cultural \nexpressions in the digital environment, and to reinforce more balanced global flows \nof cultural goods and services, by guaranteeing the social and economic rights of \nartists and cultural professionals, and better regulating digital platforms; \n \n(h) \nTo preserve and maintain local and Indigenous traditional knowledge and \ncommunity practices of environmental management, which are valuable examples of \nculture as a vehicle for sustainable development, and to foster synergies between \nmodern science and technology and local and Indigenous knowledge, practices and \ninnovation;  \n\nCulture and sustainable development \nA/RES/78/161\n \n9/11\n23-25890 \n \n \n(i) \nTo accelerate efforts to protect cultural and natural heritage from extreme \nweather events, sea level rise, desertification and other threats exacerbated by climate \nchange, which jeopardize its integrity and preservation for present and future \ngenerations;  \n \n(j) \nTo promote global awareness of the linkages between cultural and \nbiological diversity, including through the protection and preservation and \nencouragement of the customary use of biological resources, in accordance with \ntraditional cultural practices, as an important element of a comprehensive approach \nto sustainable development;  \n \n(k) \nTo support national legal frameworks and policies for the protection and \npreservation of cultural heritage and cultural property, encouraging initiatives and \ncooperation among States, including through the promotion of bilateral and \nmultilateral cooperation, as relevant, to fight against illicit trafficking in cultural \nproperty, and for the return or restitution of cultural property, in accordance with \nnational legislation and applicable international legal frameworks; \n \n(l) \nTo support national legal frameworks and policies to enable intellectual \nproperty rights to sustain those involved in cultural creativity, including by promoting \ninternational cooperation to prevent the misappropriation of creative works;  \n \n(m) To promote access to and/or the repatriation of ceremonial objects and \nhuman remains in their possession through fair, transparent and effective mechanisms \ndeveloped in conjunction with Indigenous Peoples concerned;  \n \n(n) \nTo note that, in achieving these objectives, innovative mechanisms of \nfinancing, public and private, can make a positive contribution in assisting developing \ncountries in mobilizing additional resources for development on a stable, predictable \nand voluntary basis, and to reiterate that such voluntary mechanisms should be \neffective, should aim to mobilize resources that are stable and predictable, should \nsupplement and not be a substitute for traditional sources of financing, should be \ndisbursed in accordance with the priorities of developing countries and should not \nunduly burden such countries;  \n \n(o) \nTo mobilize culture as a vehicle to foster tolerance, mutual understanding, \npeace and reconciliation in the context of conflict-prevention, conflict-resolution and \npeacebuilding processes;  \n \n18. Expresses deep concern that cultural property, including religious sites, \nshrines and cemeteries, and objects, is increasingly targeted by terrorist attacks and \nvandalism, often resulting in its damage, theft or complete destruction, and condemns \nsuch attacks;  \n \n19. Encourages all countries, intergovernmental bodies, organizations of the \nUnited Nations system, as appropriate, within their existing mandates, relevant \nnon-governmental organizations and all other relevant stakeholders to enhance \ninternational cooperation in supporting the efforts of developing countries towards \nthe development and strengthening of cultural and creative sectors, cultural tourism \nand culture-related microenterprises and to assist those countries in developing the \nnecessary infrastructure and skills, as well as in mastering information and \ncommunications technologies and in gaining access to new technologies on mutually \nagreed terms;  \n \n20. Encourages initiatives to foster cultural cooperation agreements and \nnetworks at the local, national and regional levels for knowledge and information-\nsharing for sustainable development;  \n \n21. Also encourages programmes that facilitate social benefits and economic \nrights for artists and cultural professionals, including those working in the digital \n\nA/RES/78/161 \nCulture and sustainable development\n \n23-25890\n10/11 \n \nenvironment, thus promoting opportunities for decent work, fair remuneration and \nequal pay for work of equal value, as well as training in the light of technological \nadvancement and digitalization;  \n \n22. Invites the organizations of the United Nations system, in particular the \nUnited Nations Educational, Scientific and Cultural Organization, to continue to \nprovide support, to facilitate financing and to assist countries, upon their request, in \ndeveloping their national capacities to optimize the contribution of culture to \nsustainable development, including through policy advice, information-sharing, the \nexchange of best practices, data collection, research and study and the use of \nappropriate evaluation indicators, as well as to implement applicable international \ncultural conventions, taking into account the relevant resolutions of the General \nAssembly;  \n \n23. Invites the United Nations Educational, Scientific and Cultural Organization \nand other relevant United Nations bodies to continue to assess, in consultation with \ncountries, the contribution of culture to the achievement of sustainable development \nthrough the compilation of quantitative and qualitative data, including indicators and \nstatistics, with a view to informing development policies and relevant reports, where \nappropriate, and to continue to act as a platform for exchange among countries on the \nlinkages between culture and sustainable development, including through a World \nForum on Cultural Policies, to be held every four years, from 2025 onwards;  \n \n24. Requests the Secretary-General to ensure that United Nations country \nteams continue to further integrate and mainstream culture into their programming \nexercises, in particular United Nations Sustainable Development Cooperation \nFrameworks, in consultation with relevant national authorities, when assisting \ncountries in the pursuit of their development objectives; \n \n25. Recognizes the role of the voluntary national reviews in generating \nvaluable lessons learned and best practices on the contribution of culture to the \nachievement of the Sustainable Development Goals, and invites countries to integrate \nculture and creative economy in the preparation and presentation of the voluntary \nnational reviews;  \n \n26. Encourages all countries, intergovernmental bodies, organizations of the \nUnited Nations system, relevant non-governmental organizations and all other \nrelevant stakeholders to give due consideration to the contribution of culture to the \nachievement of sustainable development in the formulation of national, regional and \ninternational development policies and international cooperation instruments, and in \nthis regard, building upon the discussion at the previous high-level event on culture \nand sustainable development, invites the President of the General Assembly to host a \none-day high-level interactive dialogue on this subject, within existing resources, \nduring the seventy-ninth session of the Assembly, and to invite the United Nations \nEducational, Scientific and Cultural Organization to support the President of the \nAssembly, within its existing mandates; \n \n27. Reaffirms the commitment at the very heart of the 2030 Agenda to leave \nno one behind and commit to taking more tangible steps to support people in \nvulnerable situations and the most vulnerable countries and to reach the furthest \nbehind first; \n\nCulture and sustainable development \nA/RES/78/161\n \n11/11\n23-25890 \n \n \n28. Requests the Secretary-General to submit to the General Assembly at its \neightieth session a report on the implementation of the present resolution and decides \nto include in the provisional agenda of its eightieth session, under the item entitled \n\u201cGlobalization and interdependence\u201d, the sub-item entitled \u201cCulture and sustainable \ndevelopment\u201d. \n \n49th plenary meeting \n19 December 2023 \n \n",
  "paragraphs": {
    "1": "Takes note of the note by the Secretary-General transmitting the report of the United Nations Educational, Scientific and Cultural Organization; 11",
    "2": "Reaffirms the role of culture as an enabler of sustainable development that provides people and communities with a strong sense of identity and social cohesion and contributes to more effective and sustainable development policies and measures __________________ 11 A/78/217. A/RES/78/161 Culture and sustainable development 23-25890 6/11 at all levels, and stresses in this regard that policies responsive to cultural contexts can yield better, sustainable, inclusive and equitable development outcomes;",
    "3": "Also reaffirms the intrinsic value of culture, and recognizes its contribution to all three dimensions of sustainable development;",
    "4": "Recognizes the power of culture as a driver of sustainable development, which contributes to fostering social inclusion and developing a strong and viable economic sector by generating income, creating decent jobs for all, and addressing both the economic and social dimensions of poverty through cultural heritage, including its protection and preservation, and cultural and creative sectors, while providing innovative and effective solutions to cross-cutting issues, such as education, health, gender equality and women\u2019s empowerment, technology and the environment;",
    "5": "Calls for enhanced support, including additional financial resources and investments, for the cultural and creative sectors, including in the context of COVID-19 recovery efforts, while recognizing culture\u2019s fundamental role in societies and its impact on sustainable development, to protect artists and cultural professionals, foster knowledge, innovation and intercultural dialogue, adapt them to the digital transformation, strengthen linkages between culture and education, safeguard cultural heritage and traditional and ancestral knowledge, including of Indigenous Peoples and local communities, promote peaceful and inclusive societies, engage all segments of society through culture, including by noting the challenges faced by women and youth, address the impacts of the pandemic on the cultural value chain and cultural diversity, reinforce interlinkages between culture and nature, and harness the potential and transformative impact of culture for sustainable development, recognizing its multidimensional impact on the resilience, well-being and prosperity of people and their communities;",
    "6": "Emphasizes the important contribution of culture to the three dimensions of sustainable development and to the achievement of national development objectives, the 2030 Agenda for Sustainable Development 12 and its Sustainable Development Goals, as well as other internationally agreed development goals, and in this regard acknowledges: (a) That culture contributes to inclusive economic development, as cultural heritage preservation, cultural and creative sectors, sustainable cultural tourism and cultural infrastructure, including urban regeneration, are sources of income generation, job creation and decent work for all, including at the community level, thus improving living conditions and fostering community-based economic growth, and contribute to the empowerment of individuals; (b) That culture contributes to inclusive social development for all, including local communities, and Indigenous Peoples, with respect for cultural diversity, safeguarding of the cultural and natural heritage, fostering of cultural institutions and strengthening of cultural and creative sectors, in urban and rural contexts; (c) That culture contributes to environmental sustainability, since the protection of cultural and biological diversity and natural heritage is important for sustainable development, and that support for traditional systems of environmental protection, and resource management, can contribute to the increased sustainability of fragile ecosystems and the conservation, protection and sustainable use of biodiversity and to avoiding land degradation and addressing climate change;",
    "7": "Reaffirms that sustainable development cannot be realized without peace and security and that peace and security will be at risk without sustainable development, and acknowledges that culture can contribute to sustainable __________________ 12 Resolution 70/1. Culture and sustainable development A/RES/78/161 7/11 23-25890 development by constituting a valuable resource for enabling communities to participate fully in social and cultural life, facilitating inclusive governance and dialogue at the national, regional and international levels and contributing to conflict prevention and resolution, as well as to reconciliation, recovery and resilience;",
    "8": "Reaffirms its commitment to embracing diversity in cities and human settlements, to strengthening social cohesion, intercultural dialogue and understanding, tolerance, mutual respect, gender equality and women\u2019s empowerment, innovation, entrepreneurship, inclusion, identity and safety, and the dignity of all people, including people in vulnerable situations, as well as to fostering liveability and a vibrant urban economy and to taking steps to ensure that local institutions promote pluralism and peaceful coexistence within increasingly heterogeneous and multicultural societies;",
    "9": "Recognizes that culture should be taken into account in the promotion and implementation of new sustainable consumption and production patterns that contribute to the responsible use of resources and address the adverse impacts of climate change;",
    "10": "Acknowledges that quality education, non-formal education and lifelong learning are enriched by culture, transmitting shared values, knowledge and skills, and also acknowledges that culture and arts education can make a direct contribution to the constructive transformation of educational systems, including through technical and vocational education and training, to meet the needs of learners in a rapidly changing world and the need for a creative and adaptive workforce;13",
    "11": "Calls for the development of learners\u2019 potential for creativity and innovation, their capacity to enjoy and to express themselves through the arts, their awareness of history and the diversity of cultures, as well as the promotion of education for the protection of cultural and natural heritage and places of memory whose existence is necessary for the safeguarding of cultural expressions;",
    "12": "Recalls the inclusion in the 2030 Agenda of several targets reflecting the contribution of culture to sustainable development, also recalls that the Sustainable Development Goals and targets are integrated and indivisible and balance the three dimensions of sustainable development, and in this regard looks forward to their achievement, building on the power of culture as an enabler and driver of progress on the Sustainable Development Goals;",
    "13": "Welcomes the efforts and initiatives of the United Nations Educational, Scientific and Cultural Organization, as the mandated United Nations agency on culture, to strengthen and measure the transformational impact of culture on the realization of the 2030 Agenda, building on information and data provided by the Member States in the framework of the periodic reports of the complete set of United Nations Educational, Scientific and Cultural Organization instruments in the field of culture and other related indicator frameworks, including the Culture 2030 Indicators;",
    "14": "Decides to give consideration, as appropriate, to the contribution of culture to sustainable development in the follow-up and review framework of the 2030 Agenda, including pursuant to the review of Goal 11, which would generate an important boost for implementation of Goal 11 between now and 2030;",
    "15": "Takes note with appreciation of the high-level event on culture and sustainable development in July 2023, convened by the President of the General Assembly, with the support of the United Nations Educational, Scientific and Cultural __________________ 13 As stated in the preamble to the outcome document of the second World Conference on Arts Education, held in Seoul from 25 to 28 May 2010, namely, the Seoul Agenda: Goals for the Development of Arts Education. A/RES/78/161 Culture and sustainable development 23-25890 8/11 Organization, on the occasion of the World Day for Cultural Diversity for Dialogue and Development, pursuant to resolution 76/214;",
    "16": "Welcomes the convening of the World Conference on Cultural Policies and Sustainable Development, also known as \u201cMondiacult 2022\u201d, hosted by the Government of Mexico from 28 to 30 September 2022, looks forward to the forthcoming World Conference on Culture and Arts Education, to be held in the United Arab Emirates in 2024, for the further strengthening of the linkages between culture and education, and welcomes the convening in Saudi Arabia of the forty-fifth session of the World Heritage Committee, from 10 to 25 September 2023;",
    "17": "Invites all countries, as well as intergovernmental bodies and organizations of the United Nations system, within their respective mandates and resources, relevant non-governmental organizations and all other relevant stakeholders: (a) To raise public awareness of the importance of cultural diversity for sustainable development, promoting its positive value through education and media tools, while also pursuing multilingualism as a mean of promoting, protecting and preserving diversity of languages and cultures globally; (b) To ensure a more visible and effective integration and mainstreaming of culture into economic, social and environmental development policies and strategies at all levels; (c) To ensure that women and men can equally access, participate in and contribute to cultural life and decision-making, and to further commit themselves to the development of cultural policies and programmes with a gender perspective at the local, national and international levels in order to achieve gender equality and the empowerment of all women and girls; (d) To undertake relevant intercultural dialogue and cooperation and cultural diversity programmes for youth to engage in a multicultural society, participate in the achievement of the 2030 Agenda, achieve better educational results and acquire a broader and more diverse range of skills and competences; (e) To promote capacity-building, where appropriate, at all levels for the development of dynamic cultural and creative sectors, in particular by encouraging creativity, innovation and entrepreneurship, including for women and youth, supporting the development of cultural institutions and cultural and creative sectors, providing technical and vocational training for culture professionals and increasing employment opportunities in the cultural and creative sectors for sustained, inclusive and equitable economic growth and development; (f) To actively support the emergence of local markets for cultural goods and services and to facilitate the effective, equitable and licit access of such goods and services to international markets, including in the digital environment, taking into account the expanding range of cultural production and consumption and, for States parties thereto, the provisions of the Convention on the Protection and Promotion of the Diversity of Cultural Expressions, adopted in 2005; (g) To promote cultural and linguistic diversity, and equal access to cultural expressions in the digital environment, and to reinforce more balanced global flows of cultural goods and services, by guaranteeing the social and economic rights of artists and cultural professionals, and better regulating digital platforms; (h) To preserve and maintain local and Indigenous traditional knowledge and community practices of environmental management, which are valuable examples of culture as a vehicle for sustainable development, and to foster synergies between modern science and technology and local and Indigenous knowledge, practices and innovation; Culture and sustainable development A/RES/78/161 9/11 23-25890 (i) To accelerate efforts to protect cultural and natural heritage from extreme weather events, sea level rise, desertification and other threats exacerbated by climate change, which jeopardize its integrity and preservation for present and future generations; (j) To promote global awareness of the linkages between cultural and biological diversity, including through the protection and preservation and encouragement of the customary use of biological resources, in accordance with traditional cultural practices, as an important element of a comprehensive approach to sustainable development; (k) To support national legal frameworks and policies for the protection and preservation of cultural heritage and cultural property, encouraging initiatives and cooperation among States, including through the promotion of bilateral and multilateral cooperation, as relevant, to fight against illicit trafficking in cultural property, and for the return or restitution of cultural property, in accordance with national legislation and applicable international legal frameworks; (l) To support national legal frameworks and policies to enable intellectual property rights to sustain those involved in cultural creativity, including by promoting international cooperation to prevent the misappropriation of creative works; (m) To promote access to and/or the repatriation of ceremonial objects and human remains in their possession through fair, transparent and effective mechanisms developed in conjunction with Indigenous Peoples concerned; (n) To note that, in achieving these objectives, innovative mechanisms of financing, public and private, can make a positive contribution in assisting developing countries in mobilizing additional resources for development on a stable, predictable and voluntary basis, and to reiterate that such voluntary mechanisms should be effective, should aim to mobilize resources that are stable and predictable, should supplement and not be a substitute for traditional sources of financing, should be disbursed in accordance with the priorities of developing countries and should not unduly burden such countries; (o) To mobilize culture as a vehicle to foster tolerance, mutual understanding, peace and reconciliation in the context of conflict-prevention, conflict-resolution and peacebuilding processes;",
    "18": "Expresses deep concern that cultural property, including religious sites, shrines and cemeteries, and objects, is increasingly targeted by terrorist attacks and vandalism, often resulting in its damage, theft or complete destruction, and condemns such attacks;",
    "19": "Encourages all countries, intergovernmental bodies, organizations of the United Nations system, as appropriate, within their existing mandates, relevant non-governmental organizations and all other relevant stakeholders to enhance international cooperation in supporting the efforts of developing countries towards the development and strengthening of cultural and creative sectors, cultural tourism and culture-related microenterprises and to assist those countries in developing the necessary infrastructure and skills, as well as in mastering information and communications technologies and in gaining access to new technologies on mutually agreed terms;",
    "20": "Encourages initiatives to foster cultural cooperation agreements and networks at the local, national and regional levels for knowledge and information- sharing for sustainable development;",
    "21": "Also encourages programmes that facilitate social benefits and economic rights for artists and cultural professionals, including those working in the digital A/RES/78/161 Culture and sustainable development 23-25890 10/11 environment, thus promoting opportunities for decent work, fair remuneration and equal pay for work of equal value, as well as training in the light of technological advancement and digitalization;",
    "22": "Invites the organizations of the United Nations system, in particular the United Nations Educational, Scientific and Cultural Organization, to continue to provide support, to facilitate financing and to assist countries, upon their request, in developing their national capacities to optimize the contribution of culture to sustainable development, including through policy advice, information-sharing, the exchange of best practices, data collection, research and study and the use of appropriate evaluation indicators, as well as to implement applicable international cultural conventions, taking into account the relevant resolutions of the General Assembly;",
    "23": "Invites the United Nations Educational, Scientific and Cultural Organization and other relevant United Nations bodies to continue to assess, in consultation with countries, the contribution of culture to the achievement of sustainable development through the compilation of quantitative and qualitative data, including indicators and statistics, with a view to informing development policies and relevant reports, where appropriate, and to continue to act as a platform for exchange among countries on the linkages between culture and sustainable development, including through a World Forum on Cultural Policies, to be held every four years, from 2025 onwards;",
    "24": "Requests the Secretary-General to ensure that United Nations country teams continue to further integrate and mainstream culture into their programming exercises, in particular United Nations Sustainable Development Cooperation Frameworks, in consultation with relevant national authorities, when assisting countries in the pursuit of their development objectives;",
    "25": "Recognizes the role of the voluntary national reviews in generating valuable lessons learned and best practices on the contribution of culture to the achievement of the Sustainable Development Goals, and invites countries to integrate culture and creative economy in the preparation and presentation of the voluntary national reviews;",
    "26": "Encourages all countries, intergovernmental bodies, organizations of the United Nations system, relevant non-governmental organizations and all other relevant stakeholders to give due consideration to the contribution of culture to the achievement of sustainable development in the formulation of national, regional and international development policies and international cooperation instruments, and in this regard, building upon the discussion at the previous high-level event on culture and sustainable development, invites the President of the General Assembly to host a one-day high-level interactive dialogue on this subject, within existing resources, during the seventy-ninth session of the Assembly, and to invite the United Nations Educational, Scientific and Cultural Organization to support the President of the Assembly, within its existing mandates;",
    "27": "Reaffirms the commitment at the very heart of the 2030 Agenda to leave no one behind and commit to taking more tangible steps to support people in vulnerable situations and the most vulnerable countries and to reach the furthest behind first; Culture and sustainable development A/RES/78/161 11/11 23-25890",
    "28": "Requests the Secretary-General to submit to the General Assembly at its eightieth session a report on the implementation of the present resolution and decides to include in the provisional agenda of its eightieth session, under the item entitled \u201cGlobalization and interdependence\u201d, the sub-item entitled \u201cCulture and sustainable development\u201d. 49th plenary meeting 19 December 2023"
  },
  "agenda_items": [
    "Item 19"
  ],
  "symbol_references": []
}