{
  "symbol": "A/RES/78/286",
  "filename": "A_RES_78_286.pdf",
  "title": "78/286. International Day for Dialogue among Civilizations",
  "text": "United Nations \nA/RES/78/286\n \n \nGeneral Assembly \nDistr.: General \n19 June 2024 \n \n24-11034 (E)    240624 \n*2411034* \n \n \nSeventy-eighth session \nAgenda item 14 \nCulture of peace \n \n \n \n \n Resolution adopted by the General Assembly \non 7 June 2024 \n \n \n \n \n[without reference to a Main Committee (A/78/L.75)] \n \n \n 78/286. International Day for Dialogue among Civilizations \n \n \n \nThe General Assembly, \n \nReaffirming the purposes and principles of the Charter of the United Nations, \nthe Universal Declaration of Human Rights,1 in which it is proclaimed that everyone \nis entitled to all the rights and freedoms set forth therein, without distinction of any \nkind, and States\u2019 obligations under international human rights law,  \n \nRecalling previous resolutions of the General Assembly on promoting \nunderstanding, development and exchange among civilizations and cultures, in \nparticular its resolution 53/22 of 4 November 1998, by which the Assembly \nproclaimed the year 2001 as the United Nations Year of Dialogue among \nCivilizations, and its resolution 56/6 of 9 November 2001 on the Global Agenda for \nDialogue among Civilizations and the Programme of Action and its objectives, \nprinciples and participants, contained therein,  \n \nNoting that globalization brings greater interrelatedness among people and \nincreased interaction among cultures and civilizations, and encouraged by the fact \nthat the proclamation and celebration of the United Nations Year of Dialogue among \nCivilizations in 2001 and the implementation of the Global Agenda for Dialogue \namong Civilizations invite us to embrace the interdependence of humankind and its \nrich cultural diversity,  \n \nRecalling its resolutions 53/199 of 15 December 1998 and 61/185 of \n20 December 2006 on the proclamation of international years and Economic and \nSocial Council resolution 1980/67 of 25 July 1980 on international years and \nanniversaries, \n \nRecalling also previous relevant resolutions of the General Assembly, including \nits resolution 51/95 of 12 December 1996, by which the Assembly proclaimed \n__________________ \n \n1  Resolution 217 A (III). \n\nA/RES/78/286 \nInternational Day for Dialogue among Civilizations\n \n24-11034\n2/3 \n \n16 November as the International Day for Tolerance, its resolution 72/130 of \n8 December 2017, by which it declared 16 May as the International Day of Living \nTogether in Peace, its resolution 75/200 of 21 December 2020, by which it \nproclaimed 4 February as the International Day of Human Fraternity, and its \nresolution 75/309 of 21 July 2021, by which it proclaimed 18 June as the International \nDay for Countering Hate Speech, \n \nBearing in mind the valuable contribution that dialogue among civilizations can \nmake to an improved awareness and understanding of the universal values, enshrined \nin the Charter of the United Nations and the Universal Declaration of Human Rights, \nand reaffirming that civilizational achievements constitute the collective heritage of \nhumankind,  \n \nConvinced that dialogue contributes to combining the efforts of the international \ncommunity in consolidating the traditions of peaceful and trust-based coexistence \namong the peoples of the world,  \n \nEmphasizing that participation in dialogue among civilizations should be global \nin scope and open to all and should contribute to gender equality and the \nempowerment of women and girls from different backgrounds and cultures,  \n \nRecognizing with deep concern the overall rise in instances of discrimination, \nintolerance and violence, regardless of the actors, directed against members of many \nreligious and other communities in various parts of the world, \n \nRecognizing that all cultures and civilizations contribute to the enrichment of \nhumankind, and encouraging tolerance, peaceful coexistence, respect, dialogue and \ncooperation among different cultures, civilizations and peoples in order to promote \ninternational peace and security, human welfare, freedom and progress everywhere,  \n \nRecalling the United Nations Millennium Declaration of 8 September 2000, 2 in \nwhich Member States consider, inter alia, that tolerance is one of the fundamental \nvalues essential to international relations in the twenty-first century and should \ninclude the active promotion of a culture of peace and dialogue among civilizations, \nwith human beings respecting one another, in all their diversity of belief, culture and \nlanguage, neither fearing nor repressing differences within and between societies but \ncherishing them as a precious asset of humanity,  \n \nRecalling also the 2005 World Summit Outcome,3 in which the Heads of State \nand Government reaffirmed the Global Agenda for Dialogue among Civilizations and \nits Programme of Action and the value of different initiatives on dialogue among \ncultures and civilizations, welcomed the United Nations Alliance of Civilizations \ninitiative announced by the Secretary-General on 14 July 2005 and committed to \npromoting a culture of peace and dialogue at the local, national, regional and \ninternational levels, \n \nUnderlining that all civilizations celebrate the unity and diversity of humankind \nand are enriched and have evolved through dialogue with others, respect for human \nrights as well as the need to acknowledge and respect the richness of all civilizations \nand to seek common ground among civilizations in order to address comprehensively \nchallenges facing humanity, \n \nConvinced that the full enjoyment of human rights by all persons, the promotion \nof cultural pluralism and tolerance towards and dialogue among various cultures and \ncivilizations would contribute to the efforts of all peoples and nations to enrich their \n__________________ \n \n2  Resolution 55/2. \n \n3  Resolution 60/1. \n\nInternational Day for Dialogue among Civilizations \nA/RES/78/286\n \n3/3\n24-11034 \n \ncultures and traditions by engaging in a mutually beneficial exchange of knowledge \nand intellectual, moral and material achievements, \n \nAware that positive and mutually beneficial interaction among civilizations has \ncontinued throughout human history despite impediments arising from intolerance, \ndisputes and wars,  \n \nRecognizing that civilizations and cultures take diverse forms across time and \nspace and flourish in contact with others and therefore shall be preserved, enhanced \nand handed on for the benefit of current and future generations as a record of human \nexperience and aspirations, and recognizing also that the defence of cultural diversity \nimplies a commitment to human rights and fundamental freedoms, \n \nNoting with appreciation the valuable role played by the United Nations \nEducational, Scientific and Cultural Organization and the other relevant entities of \nthe United Nations, within their mandates, in implementing relevant resolutions and \nagendas,  \n \nNoting with appreciation also the valuable role of the United Nations Alliance \nof Civilizations and its High Representative in promoting greater understanding and \nrespect among civilizations, cultures, religions and beliefs,  \n \nNoting with appreciation further the United Nations Alliance of Civilizations \nGlobal Forum as a global platform for dialogue among various stakeholders, \nincluding civil society organizations, religious leaders, youth, media and academia, \nas well as artists and athletes, and noting the efforts of relevant stakeholders to \npromote cross-cultural dialogue and mutual understanding among different \ncivilizations, cultures, religions and beliefs,  \n \nNoting the various initiatives at the local, national, regional and international \nlevels for enhancing dialogue, understanding and cooperation among civilizations, as \nwell as declarations and statements from various meetings in this regard,  \n \nRecognizing the role of national parliaments and their active contribution at the \nnational, regional and international levels for the dialogue among civilizations,  \n \n1. \nDecides to declare 10 June the International Day for Dialogue among \nCivilizations, in order to raise awareness of the value of the diversity of civilizations \nand promote dialogue, mutual respect, tolerance and global solidarity in this regard; \n \n2. \nInvites all Member States and organizations of the United Nations system, \nwithin existing resources, as well as other international and regional organizations \nand other relevant stakeholders, including civil society, the private sector, academia \nand the media, to commemorate the International Day in an appropriate manner, \nincluding through educational and public awareness-raising activities, and to share \nbest practices in this regard; \n \n3. \nInvites the United Nations Educational, Scientific and Cultural \nOrganization and the United Nations Alliance of Civilizations with other relevant \nentities of the United Nations to facilitate the observance of the International Day; \n \n4. \nStresses that the cost of all activities that may arise from the \nimplementation of the present resolution should be met from voluntary contributions; \n \n5. \nInvites all relevant stakeholders to contribute to and support the \nInternational Day. \n \n88th plenary meeting \n7 June 2024 \n \n",
  "paragraphs": {
    "1": "Decides to declare 10 June the International Day for Dialogue among Civilizations, in order to raise awareness of the value of the diversity of civilizations and promote dialogue, mutual respect, tolerance and global solidarity in this regard;",
    "2": "Invites all Member States and organizations of the United Nations system, within existing resources, as well as other international and regional organizations and other relevant stakeholders, including civil society, the private sector, academia and the media, to commemorate the International Day in an appropriate manner, including through educational and public awareness-raising activities, and to share best practices in this regard;",
    "3": "Invites the United Nations Educational, Scientific and Cultural Organization and the United Nations Alliance of Civilizations with other relevant entities of the United Nations to facilitate the observance of the International Day;",
    "4": "Stresses that the cost of all activities that may arise from the implementation of the present resolution should be met from voluntary contributions;",
    "5": "Invites all relevant stakeholders to contribute to and support the International Day."
  },
  "agenda_items": [
    "Item 14"
  ],
  "symbol_references": [
    "A/78/L.75"
  ]
}