{
  "symbol": "A/RES/72/285",
  "filename": "A_RES_72_285.pdf",
  "title": "72/285. Rates of reimbursement to troop- and police-contributing countries",
  "text": "United Nations \nA/RES/72/285\n \n \nGeneral Assembly \nDistr.: General \n17 July 2018 \n \n18-11301 (E)    190718     \n*1811301* \n \n \nSeventy-second session \nAgenda item 149 \n \n \n \n \n Resolution adopted by the General Assembly on 5 July 2018 \n \n \n \n \n[on the report of the Fifth Committee (A/72/917)] \n \n \n 72/285. Rates of reimbursement to troop- and police-contributing countries  \n \n \n \nThe General Assembly, \n \nRecalling its resolutions 65/289 of 30 June 2011, 67/261 of 10 May 2013 and \n68/281 of 30 June 2014, \n \nHaving considered the report of the Secretary-General on the results of the \nsurvey to support the review of the standard rate of reimbursement to troop- and \npolice-contributing countries1 and the related report of the Advisory Committee on \nAdministrative and Budgetary Questions,2 \n \n1. \nTakes note of the report of the Secretary-General;1 \n \n2. \nEndorses the conclusions and recommendations of the Advisory \nCommittee on Administrative and Budgetary Questions,2 subject to the provisions of \nthe present resolution; \n \n3. \nDecides to establish a single rate of reimbursement to countries \ncontributing contingent personnel to United Nations field operations in the amount of \n1,428 United States dollars per person per month as from 1 July 2018; \n \n4. \nAlso decides to increase the death and disability compensation rates by \n10 per cent as from 1 July 2018. \n \n104th plenary meeting  \n5 July 2018 \n \n__________________ \n \n1 A/72/728. \n \n2 A/72/771. \n",
  "paragraphs": {
    "1": "Takes note of the report of the Secretary-General;1",
    "2": "Endorses the conclusions and recommendations of the Advisory Committee on Administrative and Budgetary Questions,2 subject to the provisions of the present resolution;",
    "3": "Decides to establish a single rate of reimbursement to countries contributing contingent personnel to United Nations field operations in the amount of 1,428 United States dollars per person per month as from 1 July 2018;",
    "4": "Also decides to increase the death and disability compensation rates by 10 per cent as from 1 July 2018."
  },
  "agenda_items": [
    "Item 149"
  ],
  "symbol_references": []
}