{
  "symbol": "A/RES/76/272",
  "filename": "A_RES_76_272.pdf",
  "title": "76/272. Improving the financial situation of the United Nations",
  "text": "United Nations \nA/RES/76/272\n \n \nGeneral Assembly \nDistr.: General \n6 July 2022 \n \n22-10326 (E)    070722 \n*2210326* \n \n \nSeventy-sixth session \nAgenda item 140 \nImproving the financial situation of the United Nations \n \n \n \n \n Resolution adopted by the General Assembly \non 29 June 2022 \n \n \n \n \n[on the report of the Fifth Committee (A/76/873, para. 6)] \n \n \n 76/272. Improving the financial situation of the United Nations \n \n \n \nThe General Assembly, \n \nRecalling its resolution 73/307 of 3 July 2019, \n \nHaving considered the report of the Secretary-General1 and the related report of \nthe Advisory Committee on Administrative and Budgetary Questions, 2 \n \n1. \nTakes note of the report of the Secretary-General; \n \n2. \nEndorses the conclusions and recommendations contained in the report of \nthe Advisory Committee on Administrative and Budgetary Questions, subject to the \nprovisions of the present resolution; \n \n3. \nUrges all Member States to fulfil their financial obligations as set out in \nthe Charter of the United Nations on time, in full and without conditions; \n \n4. \nNotes the exceptional amount of unspent funds from the 2021 regular \nbudget to be credited to Member States, and decides to use 100 million United States \ndollars of these unspent funds to increase, on an exceptional basis and without setting \na precedent, the Working Capital Fund; \n \n5. \nRequests the Secretary-General to review the credits in the Working \nCapital Fund and report to the General Assembly at its eightieth session; \n \n6. \nNotes the surplus in closed international tribunals accounts and the \npossibility of using it as a last resort to cover temporary liquidity shortfalls of the \nregular budget, in full compliance with the Financial Regulations and Rules of the \nUnited Nations,3 also notes this is not an established mechanism, emphasizes that this \npractice cannot be sustainable, and requests the Secretary-General to provide a report \n__________________ \n \n1 A/76/429. \n \n2 A/76/7/Add.29. \n \n3 ST/SGB/2013/4 and ST/SGB/2013/4/Amend.1. \n\nA/RES/76/272 \nImproving the financial situation of the United Nations\n \n22-10326\n2/2 \n \non international tribunals surplus to be considered by the General Assembly at its \neightieth session; \n \n7. \nWelcomes the continued management of the cash resources of the active \npeacekeeping missions as a pool, notes the positive impact that it has had on the \ntimeliness of settlement of payments to troop- and police-contributing countries, and \nrequests the Secretary-General to continue this practice on a trial period for another \nfive years; \n \n8. \nRequests the Secretary-General to report to the General Assembly on the \nimpact of the present resolution and any further measures to improve the financial \nsituation of the United Nations at its eightieth session. \n \n89th plenary meeting \n29 June 2022 \n \n",
  "paragraphs": {
    "1": "Takes note of the report of the Secretary-General;",
    "2": "Endorses the conclusions and recommendations contained in the report of the Advisory Committee on Administrative and Budgetary Questions, subject to the provisions of the present resolution;",
    "3": "Urges all Member States to fulfil their financial obligations as set out in the Charter of the United Nations on time, in full and without conditions;",
    "4": "Notes the exceptional amount of unspent funds from the 2021 regular budget to be credited to Member States, and decides to use 100 million United States dollars of these unspent funds to increase, on an exceptional basis and without setting a precedent, the Working Capital Fund;",
    "5": "Requests the Secretary-General to review the credits in the Working Capital Fund and report to the General Assembly at its eightieth session;",
    "6": "Notes the surplus in closed international tribunals accounts and the possibility of using it as a last resort to cover temporary liquidity shortfalls of the regular budget, in full compliance with the Financial Regulations and Rules of the United Nations,3 also notes this is not an established mechanism, emphasizes that this practice cannot be sustainable, and requests the Secretary-General to provide a report on international tribunals surplus to be considered by the General Assembly at its eightieth session;",
    "7": "Welcomes the continued management of the cash resources of the active peacekeeping missions as a pool, notes the positive impact that it has had on the timeliness of settlement of payments to troop- and police-contributing countries, and requests the Secretary-General to continue this practice on a trial period for another five years;",
    "8": "Requests the Secretary-General to report to the General Assembly on the impact of the present resolution and any further measures to improve the financial situation of the United Nations at its eightieth session."
  },
  "agenda_items": [
    "Item 140"
  ],
  "symbol_references": []
}