{
  "symbol": "A/RES/74/254",
  "filename": "A_RES_74_254.pdf",
  "title": "74/254. Seconded active-duty military and police personnel",
  "text": "United Nations \nA/RES/74/254\n \n \nGeneral Assembly \nDistr.: General \n9 January 2020 \n \n19-22682 (E)    100120 \n*1922682* \n \n \nSeventy-fourth session \nAgenda item 140 \nHuman resources management \n \n \n \n \n Resolution adopted by the General Assembly \non 27 December 2019 \n \n \n \n \n[on the report of the Fifth Committee (A/74/615)] \n \n \n 74/254. Seconded active-duty military and police personnel \n \n \n \nThe General Assembly, \n \nRecalling its resolutions 67/287 of 28 June 2013, 68/252 of 27 December 2013 \nand 71/263 of 23 December 2016, \n \nHaving considered the note by the Secretary-General on seconded active-duty \nmilitary and police personnel1 and the related report of the Advisory Committee on \nAdministrative and Budgetary Questions,2  \n \n1. \nTakes note of the note by the Secretary-General;1 \n \n2. \nEndorses the conclusions and recommendations contained in the report of \nthe Advisory Committee on Administrative and Budgetary Questions, 2 subject to the \nprovisions of the present resolution; \n \n3. \nExpresses serious regret that the Secretary-General has not been able to \nidentify solutions for addressing the conflicts between national legislation and the \nstaff regulations and rules of the United Nations regarding the secondment of active -\nduty military and police personnel since 2013; \n \n4. \nRequests the Secretary-General to intensify his efforts to engage with \nMember States and explore all viable options to resolve the conflicts, and to report \non the development of the matter and present his proposals to address the conflicts to \nthe General Assembly at the first part of its resumed seventy-fourth session; \n \n5. \nTakes note of paragraph 11 of the report of the Advisory Committee, and, \nwith a view to identifying solutions to conflicts between national legislation and the \n__________________ \n \n1  A/74/546. \n \n2  A/74/584. \n\nA/RES/74/254 \nSeconded active-duty military and police personnel\n \n19-22682\n2/2 \n \nstaff regulations and rules, decides to authorize the Secretary-General to extend the \nexceptional measures regarding seconded active-duty military and police personnel \nto 30 June 2020. \n \n52nd (resumed) plenary meeting \n27 December 2019 \n \n",
  "paragraphs": {
    "1": "Takes note of the note by the Secretary-General;1",
    "2": "Endorses the conclusions and recommendations contained in the report of the Advisory Committee on Administrative and Budgetary Questions, 2 subject to the provisions of the present resolution;",
    "3": "Expresses serious regret that the Secretary-General has not been able to identify solutions for addressing the conflicts between national legislation and the staff regulations and rules of the United Nations regarding the secondment of active - duty military and police personnel since 2013;",
    "4": "Requests the Secretary-General to intensify his efforts to engage with Member States and explore all viable options to resolve the conflicts, and to report on the development of the matter and present his proposals to address the conflicts to the General Assembly at the first part of its resumed seventy-fourth session;",
    "5": "Takes note of paragraph 11 of the report of the Advisory Committee, and, with a view to identifying solutions to conflicts between national legislation and the staff regulations and rules, decides to authorize the Secretary-General to extend the exceptional measures regarding seconded active-duty military and police personnel to 30 June 2020."
  },
  "agenda_items": [
    "Item 140"
  ],
  "symbol_references": []
}