{
  "symbol": "A/RES/78/98",
  "filename": "A_RES_78_98.pdf",
  "title": "78/98. Question of the Turks and Caicos Islands",
  "text": "United Nations \nA/RES/78/98\n \n \nGeneral Assembly \nDistr.: General \n11 December 2023 \n \n23-24982 (E)    201223     \n*2324982* \n \n \nSeventy-eighth session \nAgenda item 58 \nImplementation of the Declaration on the Granting of \nIndependence to Colonial Countries and Peoples \n \n \n \n \n Resolution adopted by the General Assembly \non 7 December 2023 \n \n \n \n \n[on the report of the Special Political and Decolonization Committee  \n(Fourth Committee) (A/78/429, para. 33)] \n \n \n \n78/98. Question of the Turks and Caicos Islands \n \n \n \nThe General Assembly, \n \nHaving considered the question of the Turks and Caicos Islands and examined \nthe report of the Special Committee on the Situation with regard to the \nImplementation of the Declaration on the Granting of Independence to Colonial \nCountries and Peoples for 2023,1 \n \nTaking note of the working paper prepared by the Secretariat on the Turks and \nCaicos Islands2 and other relevant information,  \n \nRecognizing that all available options for self-determination of the Territory are \nvalid as long as they are in accordance with the freely expressed wishes of the people \nof the Turks and Caicos Islands and in conformity with the clearly defined principles \ncontained in General Assembly resolutions 1514 (XV) of 14 December 1960, 1541 \n(XV) of 15 December 1960 and other resolutions of the Assembly,  \n \nExpressing concern that, more than 60 years after the adoption of the \nDeclaration on the Granting of Independence to Colonial Countries and Peoples, 3 \nthere still remain 17 Non-Self-Governing Territories, including the Turks and Caicos \nIslands,  \n \nConscious of the importance of continuing the effective implementation of the \nDeclaration, taking into account the target set by the United Nations to eradicate \n__________________ \n \n1  Official Records of the General Assembly, Seventy-eighth Session, Supplement No. 23 (A/78/23). \n \n2  A/AC.109/2023/15. \n \n3  Resolution 1514 (XV). \n\nA/RES/78/98 \nQuestion of the Turks and Caicos Islands\n \n23-24982\n2/5 \n \ncolonialism by 2030 and the plan of action for the International Decades for the \nEradication of Colonialism,4 \n \nRecognizing that the specific characteristics and the aspirations of the people of \nthe Turks and Caicos Islands require flexible, practical and innovative approaches to \nthe options for self-determination, without any prejudice to territorial size, \ngeographical location, size of population or natural resources, \n \nConvinced that the wishes and aspirations of the people of the Territory should \ncontinue to guide the development of their future political status and that \nreferendums, free and fair elections and other forms of popular consultation play an \nimportant role in ascertaining the wishes and aspirations of the people,  \n \nConcerned by the use and exploitation of the natural resources of the Non-Self-\nGoverning Territories by the administering Powers for their benefit, by the use of the \nTerritories as international financial centres to the detriment of the world economy \nand by the consequences of any economic activities of the administering Powers that \nare contrary to the interests of the people of the Territories, as well as to resolution \n1514 (XV),  \n \nConvinced that any negotiations to determine the status of the Territory must \ntake place with the active involvement and participation of the people of the Territory, \nunder the auspices of the United Nations, on a case-by-case basis, and that the views \nof the people of the Turks and Caicos Islands in respect of their right to self-\ndetermination should be ascertained,  \n \nNoting the continued cooperation of the Non-Self-Governing Territories at the \nlocal and regional levels, including participation in the work of regional \norganizations,  \n \nMindful that, in order for the Special Committee to enhance its understanding \nof the political status of the people of the Turks and Caicos Islands and to fulfil its \nmandate effectively, it is important for it to be apprised by the United Kingdom of \nGreat Britain and Northern Ireland as the administering Power and to receive \ninformation from other appropriate sources, including the representatives of the \nTerritory, concerning the wishes and aspirations of the people of the Territory,  \n \nAware of the importance both to the Turks and Caicos Islands and to the Special \nCommittee of the participation of elected and appointed representatives of the Turks \nand Caicos Islands in the work of the Committee,  \n \nRecognizing the need for the Special Committee to ensure that the appropriate \nbodies of the United Nations actively pursue a public awareness campaign aimed at \nassisting the people of the Turks and Caicos Islands with their inalienable right to \nself-determination and in gaining a better understanding of the options for self-\ndetermination, on a case-by-case basis,  \n \nMindful, in that connection, that the holding of regional seminars in the \nCaribbean and Pacific regions and at Headquarters, with the active participation of \nrepresentatives of the Non-Self-Governing Territories, provides a helpful means for \nthe Special Committee to fulfil its mandate and that the regional nature of the \nseminars, which alternate between the Caribbean and the Pacific, is a crucial element \nin the context of a United Nations programme for ascertaining the political status of \nthe Territories,  \n \nWelcoming the Pacific regional seminar on the theme \u201cInnovative steps to ensure \nthe attainment of the Sustainable Development Goals in the Non-Self-Governing \nTerritories\u201d, held by the Special Committee in Bali, Indonesia, and hosted by the \n__________________ \n \n4  A/56/61, annex. \n\nQuestion of the Turks and Caicos Islands \nA/RES/78/98\n \n3/5\n23-24982 \n \nGovernment of Indonesia from 24 to 26 May 2023, as a significant and forward-\nlooking event, which enabled the participants to assess progress made and address \nchallenges faced in the decolonization process, review the existing working methods \nof the Committee and renew its commitment to implementing its historic task,  \n \nRecalling the importance of the conclusions and recommendations adopted by \nthe seminar, which are annexed to the report of the Special Committee and which \noutline the findings of the seminar, including, especially, the way forward for the \ndecolonization process within the context of the proclamation by the General \nAssembly of the period 2021\u20132030 as the Fourth International Decade for the \nEradication of Colonialism,5 \n \nNoting with appreciation the contribution to the development of some \nTerritories by the specialized agencies and other organizations of the United Nations \nsystem, in particular the Economic Commission for Latin America and the Caribbean, \nthe Economic and Social Commission for Asia and the Pacific, the United Nations \nDevelopment Programme and the World Food Programme, as well as regional \ninstitutions such as the Caribbean Development Bank, the Caribbean Community, the \nOrganisation of Eastern Caribbean States, the Pacific Islands Forum and the agencies \nof the Council of Regional Organizations in the Pacific,  \n \nRecalling the statement made by a representative of the Government of the \nTurks and Caicos Islands at the 2022 Pacific regional seminar,6 \n \nRecalling also the re-engagement of the Territory with the Special Committee \nin 2022, \n \nRecalling further the dispatch of the United Nations special mission to the Turks \nand Caicos Islands in 2006 at the request of the territorial Government and with the \nconcurrence of the administering Power,  \n \nRecalling the endorsement by the Heads of Government of the Caribbean \nCommunity of the report of the Community\u2019s fact-finding mission to the Turks and \nCaicos Islands in 2013, which called for, inter alia, a referendum on self-\ndetermination and a mechanism for amending the Constitution,  \n \nRecalling also that, in March 2014, the Heads of Government of the Caribbean \nCommunity received an update on the situation in the Turks and Caicos Islands, which \nthey will continue to monitor, and that they expressed their support for the full \nrestoration of democracy in the Territory on terms driven by its people, \n \nRecalling with concern the devastating damage and impact caused in the \nTerritory by Hurricane Irma and Hurricane Maria in 2017, \n \nStressing the importance of regional ties for the development of a small island \nTerritory,  \n \nRecalling the general election that was held in February 2021,7 \n \nRecalling also relevant resolutions adopted by the General Assembly in \nconnection with the coronavirus disease (COVID-19) pandemic,  \n \n1. \nReaffirms the inalienable right of the people of the Turks and Caicos \nIslands to self-determination, in conformity with the Charter of the United Nations \nand with General Assembly resolution 1514 (XV), containing the Declaration on the \nGranting of Independence to Colonial Countries and Peoples;  \n__________________ \n \n5  See resolution 75/123. \n \n6  Available at www.un.org/dppa/decolonization/en/c24/regional-seminars/2022. \n \n7  See A/AC.109/2023/15, para. 18. \n\nA/RES/78/98 \nQuestion of the Turks and Caicos Islands\n \n23-24982\n4/5 \n \n \n2. \nAlso reaffirms that, in the process of decolonization of the Turks and \nCaicos Islands, there is no alternative to the principle of self-determination, which is \nalso a fundamental human right, as recognized under the relevant human rights \nconventions;  \n \n3. \nFurther reaffirms that it is ultimately for the people of the Turks and \nCaicos Islands to determine freely their future political status in accordance with the \nrelevant provisions of the Charter, the Declaration and the relevant resolutions of the \nGeneral Assembly, and in that connection calls upon the administering Power, in \ncooperation with the territorial Government and appropriate bodies of the United \nNations system, to develop political education programmes for the Territory in order \nto foster an awareness among the people of their right to self-determination in \nconformity with the legitimate political status options, based on the principles clearly \ndefined in Assembly resolution 1541 (XV) and other relevant resolutions and \ndecisions;  \n \n4. \nTakes note of the positions and repeated calls of the Caribbean Community \nand the Movement of Non-Aligned Countries in support of a democratically elected \nterritorial Government and of the full restoration of democracy in the Territory as \ndecided by its people; \n \n5. \nNotes the continuing debate on constitutional reform within the Territory, \nand stresses the importance of participation by all groups and interested parties in the \nconsultation process;  \n \n6. \nStresses the importance of having in place in the Territory a constitution \nthat reflects the aspirations and wishes of its people, based on the mechanisms for \npopular consultation;  \n \n7. \nRequests the administering Power to assist the Territory by facilitating its \nwork concerning public educational outreach efforts, consistent with Article 73 b of \nthe Charter, and in that regard calls upon the relevant United Nations organizations \nto provide assistance to the Territory, if requested;  \n \n8. \nWelcomes the active participation of the Territory in the work of the \nEconomic Commission for Latin America and the Caribbean;  \n \n9. \nStresses that the Territory should continue to participate in the activities of \nthe Special Committee on the Situation with regard to the Implementation of the \nDeclaration on the Granting of Independence to Colonial Countries and Peoples, \nincluding regional seminars, in order to provide the Committee with up-to-date \ninformation regarding the decolonization process;  \n \n10. Welcomes the continuing efforts made by the territorial Government \naddressing the need for attention to be paid to the enhancement of socioeconomic \ndevelopment across the Territory;  \n \n11. \nStresses the importance of the Special Committee being apprised of the \nviews and wishes of the people of the Turks and Caicos Islands and enhancing its \nunderstanding of their conditions, including the nature and scope of the existing \npolitical and constitutional arrangements between the Turks and Caicos Islands and \nthe administering Power;  \n \n12. Calls upon the administering Power to participate in and cooperate fully \nwith the work of the Special Committee in order to implement the provisions of \nArticle 73 e of the Charter and the Declaration and in order to advise the Committee \non the implementation of the provisions under Article 73 b of the Charter on efforts \nto promote self-government in the Turks and Caicos Islands, and encourages the \nadministering Power to facilitate visiting and special missions to the Territory;  \n\nQuestion of the Turks and Caicos Islands \nA/RES/78/98\n \n5/5\n23-24982 \n \n \n13. Reaffirms the responsibility of the administering Power under the Charter \nto promote the economic and social development and to preserve the cultural identity \nof the Territory, and requests the administering Power to take steps to enlist and make \neffective use of all possible assistance, on both a bilateral and a multilateral basis, in \nthe strengthening of the economy of the Territory;  \n \n14. Takes into account the 2030 Agenda for Sustainable Development,8 including \nthe Sustainable Development Goals, stresses the importance of fostering the \neconomic and social sustainable development of the Territory by promoting sustained, \ninclusive and equitable economic growth, creating greater opportunities for all, \nreducing inequalities, raising basic standards of living, fostering equitable social \ndevelopment and inclusion and promoting the integrated and sustainable management \nof natural resources and ecosystems that supports, inter alia, economic, social and \nhuman development, while facilitating ecosystem conservation, regeneration, \nrestoration and resilience in the face of new and emerging challenges, and strongly \nurges the administering Power to refrain from undertaking any kind of illicit, harmful \nand unproductive activities, including the use of the Territory as an international \nfinancial centre, that are not aligned with the interest of the people of the Territory; \n \n15. Requests the Territory and the administering Power to take all measures \nnecessary to protect and conserve the environment of the Territory against any \ndegradation, and once again requests the specialized agencies concerned to monitor \nenvironmental conditions in the Territory and to provide assistance to the Territory, \nconsistent with their prevailing rules of procedure;  \n \n16. Reiterates its call upon the administering Power, the specialized agencies \nand other organizations of the United Nations system and regional organizations to \nprovide all the assistance necessary to the Territory, support the recovery and \nrebuilding efforts and enhance capabilities for emergency preparedness and risk \nreduction, in particular in the aftermath of Hurricane Irma and Hurricane Maria that \nimpacted the Territory in 2017;  \n \n17. Requests the Special Committee to continue to examine the question of the \nTurks and Caicos Islands and to report thereon to the General Assembly at its seventy-\nninth session and on the implementation of the present resolution. \n \n45th plenary meeting \n7 December 2023 \n \n__________________ \n \n8  Resolution 70/1. \n",
  "paragraphs": {
    "1": "Reaffirms the inalienable right of the people of the Turks and Caicos Islands to self-determination, in conformity with the Charter of the United Nations and with General Assembly resolution 1514 (XV), containing the Declaration on the Granting of Independence to Colonial Countries and Peoples; __________________ 5 See resolution 75/123. 6 Available at www.un.org/dppa/decolonization/en/c24/regional-seminars/2022. 7 See A/AC.109/2023/15, para. 18. A/RES/78/98 Question of the Turks and Caicos Islands 23-24982 4/5",
    "2": "Also reaffirms that, in the process of decolonization of the Turks and Caicos Islands, there is no alternative to the principle of self-determination, which is also a fundamental human right, as recognized under the relevant human rights conventions;",
    "3": "Further reaffirms that it is ultimately for the people of the Turks and Caicos Islands to determine freely their future political status in accordance with the relevant provisions of the Charter, the Declaration and the relevant resolutions of the General Assembly, and in that connection calls upon the administering Power, in cooperation with the territorial Government and appropriate bodies of the United Nations system, to develop political education programmes for the Territory in order to foster an awareness among the people of their right to self-determination in conformity with the legitimate political status options, based on the principles clearly defined in Assembly resolution 1541 (XV) and other relevant resolutions and decisions;",
    "4": "Takes note of the positions and repeated calls of the Caribbean Community and the Movement of Non-Aligned Countries in support of a democratically elected territorial Government and of the full restoration of democracy in the Territory as decided by its people;",
    "5": "Notes the continuing debate on constitutional reform within the Territory, and stresses the importance of participation by all groups and interested parties in the consultation process;",
    "6": "Stresses the importance of having in place in the Territory a constitution that reflects the aspirations and wishes of its people, based on the mechanisms for popular consultation;",
    "7": "Requests the administering Power to assist the Territory by facilitating its work concerning public educational outreach efforts, consistent with Article 73 b of the Charter, and in that regard calls upon the relevant United Nations organizations to provide assistance to the Territory, if requested;",
    "8": "Welcomes the active participation of the Territory in the work of the Economic Commission for Latin America and the Caribbean;",
    "9": "Stresses that the Territory should continue to participate in the activities of the Special Committee on the Situation with regard to the Implementation of the Declaration on the Granting of Independence to Colonial Countries and Peoples, including regional seminars, in order to provide the Committee with up-to-date information regarding the decolonization process;",
    "10": "Welcomes the continuing efforts made by the territorial Government addressing the need for attention to be paid to the enhancement of socioeconomic development across the Territory;",
    "11": "Stresses the importance of the Special Committee being apprised of the views and wishes of the people of the Turks and Caicos Islands and enhancing its understanding of their conditions, including the nature and scope of the existing political and constitutional arrangements between the Turks and Caicos Islands and the administering Power;",
    "12": "Calls upon the administering Power to participate in and cooperate fully with the work of the Special Committee in order to implement the provisions of Article 73 e of the Charter and the Declaration and in order to advise the Committee on the implementation of the provisions under Article 73 b of the Charter on efforts to promote self-government in the Turks and Caicos Islands, and encourages the administering Power to facilitate visiting and special missions to the Territory; Question of the Turks and Caicos Islands A/RES/78/98 5/5 23-24982",
    "13": "Reaffirms the responsibility of the administering Power under the Charter to promote the economic and social development and to preserve the cultural identity of the Territory, and requests the administering Power to take steps to enlist and make effective use of all possible assistance, on both a bilateral and a multilateral basis, in the strengthening of the economy of the Territory;",
    "14": "Takes into account the 2030 Agenda for Sustainable Development,8 including the Sustainable Development Goals, stresses the importance of fostering the economic and social sustainable development of the Territory by promoting sustained, inclusive and equitable economic growth, creating greater opportunities for all, reducing inequalities, raising basic standards of living, fostering equitable social development and inclusion and promoting the integrated and sustainable management of natural resources and ecosystems that supports, inter alia, economic, social and human development, while facilitating ecosystem conservation, regeneration, restoration and resilience in the face of new and emerging challenges, and strongly urges the administering Power to refrain from undertaking any kind of illicit, harmful and unproductive activities, including the use of the Territory as an international financial centre, that are not aligned with the interest of the people of the Territory;",
    "15": "Requests the Territory and the administering Power to take all measures necessary to protect and conserve the environment of the Territory against any degradation, and once again requests the specialized agencies concerned to monitor environmental conditions in the Territory and to provide assistance to the Territory, consistent with their prevailing rules of procedure;",
    "16": "Reiterates its call upon the administering Power, the specialized agencies and other organizations of the United Nations system and regional organizations to provide all the assistance necessary to the Territory, support the recovery and rebuilding efforts and enhance capabilities for emergency preparedness and risk reduction, in particular in the aftermath of Hurricane Irma and Hurricane Maria that impacted the Territory in 2017;",
    "17": "Requests the Special Committee to continue to examine the question of the Turks and Caicos Islands and to report thereon to the General Assembly at its seventy- ninth session and on the implementation of the present resolution. 45th plenary meeting 7 December 2023 __________________ 8 Resolution 70/1."
  },
  "agenda_items": [
    "Item 58"
  ],
  "symbol_references": []
}