{
  "symbol": "A/RES/78/293",
  "filename": "A_RES_78_293.pdf",
  "title": "78/293. Support account for peacekeeping operations",
  "text": "United Nations \nA/RES/78/293\n \n \nGeneral Assembly \nDistr.: General \n3 July 2024 \n \n24-12054 (E)     \n*2412054* \n \n \nSeventy-eighth session \nAgenda item 146 \nAdministrative and budgetary aspects of the financing of \nthe United Nations peacekeeping operations \n \n \n \n \n Resolution adopted by the General Assembly on \n28 June 2024 \n \n \n \n \n[on the report of the Fifth Committee (A/78/920, para. 13)] \n \n \n 78/293. Support account for peacekeeping operations \n \n \n \nThe General Assembly, \n \nRecalling its resolutions 45/258 of 3 May 1991, 47/218 A of 23 December 1992, \n48/226 A of 23 December 1993, 48/226 C of 29 July 1994, 49/250 of 20 July 1995, \n50/221 B of 7 June 1996, section I of its resolution 55/238 of 23 December 2000, its \nresolutions 55/271 of 14 June 2001, 56/241 of 24 December 2001, 56/293 of 27 June \n2002, 57/318 of 18 June 2003, 58/298 of 18 June 2004, 59/301 of 22 June 2005, \n60/268 of 30 June 2006, 61/279 of 29 June 2007, 62/250 of 20 June 2008, 63/287 of \n30 June 2009, 64/271 of 24 June 2010, 65/290 of 30 June 2011, 66/265 of 21 June \n2012, 67/287 of 28 June 2013, 68/283 of 30 June 2014, 69/308 of 25 June 2015, \n70/287 of 17 June 2016, 71/295 of 30 June 2017, 72/288 of 5 July 2018, 73/308 of \n3 July 2019, 74/280 of 30 June 2020, 75/293 of 30 June 2021, 76/279 of 29 June 2022, \n77/304 of 30 June 2023 and its other relevant resolutions, as well as its decisions \n49/469 of 23 December 1994, 50/473 of 23 December 1995, 72/558 of 5 July 2018, \n73/555 of 3 July 2019 and 74/571 of 3 September 2020, \n \nHaving considered the reports of the Secretary-General on the budget \nperformance of the support account for peacekeeping operations for the period from \n1 July 2022 to 30 June 2023 1  and on the budget for the support account for \npeacekeeping operations for the period from 1 July 2024 to 30 June 2025, 2 the report \nof the Independent Audit Advisory Committee on the proposed budget of the Office \nof Internal Oversight Services under the support account for peacekeeping operations \n__________________ \n \n1  A/78/638. \n \n2  A/78/746. \n\nA/RES/78/293 \nSupport account for peacekeeping operations\n \n24-12054\n2/3 \n \nfor the period from 1 July 2024 to 30 June 20253 and the related report of the Advisory \nCommittee on Administrative and Budgetary Questions,4  \n \nRecognizing the importance of the United Nations being able to respond and \ndeploy rapidly to a peacekeeping operation upon the adoption of a relevant resolution \nof the Security Council, within 30 days for traditional peacekeeping operations and \n90 days for complex peacekeeping operations,  \n \nRecognizing also the need for adequate support during all phases of \npeacekeeping operations, including the liquidation and termination phases,  \n \nMindful that the level of the support account should broadly correspond to the \nmandate, number, size and complexity of peacekeeping missions,  \n \n1. \nTakes note of the report of the Secretary-General on the budget for the \nsupport account for peacekeeping operations for the period from 1 July 2024 to \n30 June 2025 and the report of the Independent Audit Advisory Committee on the \nproposed budget of the Office of Internal Oversight Services under the support \naccount for peacekeeping operations for the period from 1 July 2024 to 30 June 2025;  \n \n2. \nReaffirms its role in carrying out a thorough analysis and approval of \nhuman and financial resources and policies with a view to ensuring the full, effective \nand efficient implementation of all mandated programmes and activities and the \nimplementation of policies in this regard;  \n \n3. \nAlso reaffirms that the Fifth Committee is the appropriate Main Committee \nof the General Assembly entrusted with responsibility for administrative and \nbudgetary matters;  \n \n4. \nFurther reaffirms rule 153 of its rules of procedure;  \n \n5. \nReaffirms that the support account funds shall be used for the sole purpose \nof financing human resources and non-human resources requirements for \nbackstopping and supporting peacekeeping operations at Headquarters, and that any \nchanges in this limitation require the prior approval of the General Assembly;  \n \n6. \nAlso reaffirms the need for adequate funding for the backstopping of \npeacekeeping operations, as well as the need for full justification for that funding in \nsupport account budget submissions;  \n \n7. \nFurther reaffirms the need for effective and efficient administration and \nfinancial management of peacekeeping operations, and urges the Secretary-General \nto continue to identify measures to increase the productivity and efficiency of the \nsupport account;  \n \n8. \nRequests the Secretary-General to ensure the full implementation of the \nrelevant provisions of its resolutions 59/296 of 22 June 2005, 60/266 of 30 June 2006, \n61/276 of 29 June 2007, 64/269 of 24 June 2010, 65/289 of 30 June 2011, 66/264 of \n21 June 2012, 69/307 of 25 June 2015, 70/286 of 17 June 2016 and 76/274 of 29 June \n2022, and its other relevant resolutions;  \n \n9. \nEndorses the conclusions and recommendations contained in the report of \nthe Advisory Committee on Administrative and Budgetary Questions, and requests \nthe Secretary-General to ensure their full implementation;  \n \n10. Decides to maintain, for the financial period from 1 July 2024 to 30 June \n2025, the funding mechanism for the support account used in the current period, from \n1 July 2023 to 30 June 2024, as approved in paragraph 3 of its resolution 50/221 B;  \n__________________ \n \n3  A/78/788. \n \n4  A/78/820. \n\nSupport account for peacekeeping operations \nA/RES/78/293\n \n3/3\n24-12054 \n \n \nBudget performance report for the period from 1 July 2022 to 30 June 2023 \n \n \n11. \nTakes note of the report of the Secretary-General on the budget \nperformance of the support account for peacekeeping operations for the period from \n1 July 2022 to 30 June 2023; \n \n \nBudget estimates for the financial period from 1 July 2024 to 30 June 2025 \n \n \n12. Approves the support account requirements in the amount of 384,229,600 \nUnited States dollars for the financial period from 1 July 2024 to 30 June 2025, \ninclusive of the amount of 18,318,600 dollars under enterprise resource planning, \n518,400 dollars for death and disability claims for closed peacekeeping operations, \n868,500 dollars for the efficiency model for management services (previously the \nglobal service delivery model project), 3,326,800 dollars for peacekeeping capability \nreadiness, 19,493,600 dollars for Umoja maintenance and support costs and \n13,332,200 dollars for after-service health insurance costs, including 1,336 \ncontinuing posts and 2 new temporary posts, as well as the abolishment, \nredeployment, reassignment and reclassification of posts, 75 continuing and 4 new \ngeneral temporary assistance positions and 52 person-months, as well as related post \nand non-post requirements; \n \n \nFinancing of the support account for peacekeeping operations for the financial \nperiods from 1 July 2022 to 30 June 2023 and from 1 July 2024 to 30 June 2025 \n \n \n13. Decides that the requirements for the support account for peacekeeping \noperations for the financial period from 1 July 2024 to 30 June 2025 shall be financed \nas follows: \n \n(a) \nThe unencumbered balance in the amount of 3,234,100 dollars, in respect \nof the financial period from 1 July 2022 to 30 June 2023, to be applied to the resources \nrequired for the financial period from 1 July 2024 to 30 June 2025;  \n \n(b) \nThe total amount of 6,117,400 dollars, comprising investment revenue of \n4,065,200 dollars, other miscellaneous revenue of 269,000 dollars and cancellation \nof prior-period obligations of 1,783,200 dollars in respect of the period from 1 July \n2022 to 30 June 2023, to be applied to the resources required for the financial period \nfrom 1 July 2024 to 30 June 2025;  \n \n(c) \nThe amount of 4,839,200 dollars, representing the excess of the authorized \nlevel of the Peacekeeping Reserve Fund in respect of the financial period ended \n30 June 2023, to be applied to the resources required for the financial period from \n1 July 2024 to 30 June 2025;  \n \n(d) \nThe balance of 370,038,900 dollars to be prorated among the budgets of \nthe active peacekeeping operations for the financial period from 1 July 2024 to \n30 June 2025;  \n \n(e) \nThe net estimated staff assessment income of 30,163,300 dollars, \ncomprising the amount of 29,083,900 dollars for the financial period from 1 July 2024 \nto 30 June 2025 and the increase of 1,079,400 dollars in respect of the financial period \nended 30 June 2023, to be offset against the balance referred to in subparagraph (d) \nabove, to be prorated among the budgets of the individual active peacekeeping \noperations. \n \n95th plenary meeting \n28 June 2024 \n \n",
  "paragraphs": {
    "1": "Takes note of the report of the Secretary-General on the budget for the support account for peacekeeping operations for the period from 1 July 2024 to 30 June 2025 and the report of the Independent Audit Advisory Committee on the proposed budget of the Office of Internal Oversight Services under the support account for peacekeeping operations for the period from 1 July 2024 to 30 June 2025;",
    "2": "Reaffirms its role in carrying out a thorough analysis and approval of human and financial resources and policies with a view to ensuring the full, effective and efficient implementation of all mandated programmes and activities and the implementation of policies in this regard;",
    "3": "Also reaffirms that the Fifth Committee is the appropriate Main Committee of the General Assembly entrusted with responsibility for administrative and budgetary matters;",
    "4": "Further reaffirms rule 153 of its rules of procedure;",
    "5": "Reaffirms that the support account funds shall be used for the sole purpose of financing human resources and non-human resources requirements for backstopping and supporting peacekeeping operations at Headquarters, and that any changes in this limitation require the prior approval of the General Assembly;",
    "6": "Also reaffirms the need for adequate funding for the backstopping of peacekeeping operations, as well as the need for full justification for that funding in support account budget submissions;",
    "7": "Further reaffirms the need for effective and efficient administration and financial management of peacekeeping operations, and urges the Secretary-General to continue to identify measures to increase the productivity and efficiency of the support account;",
    "8": "Requests the Secretary-General to ensure the full implementation of the relevant provisions of its resolutions 59/296 of 22 June 2005, 60/266 of 30 June 2006, 61/276 of 29 June 2007, 64/269 of 24 June 2010, 65/289 of 30 June 2011, 66/264 of 21 June 2012, 69/307 of 25 June 2015, 70/286 of 17 June 2016 and 76/274 of 29 June 2022, and its other relevant resolutions;",
    "9": "Endorses the conclusions and recommendations contained in the report of the Advisory Committee on Administrative and Budgetary Questions, and requests the Secretary-General to ensure their full implementation;",
    "10": "Decides to maintain, for the financial period from 1 July 2024 to 30 June 2025, the funding mechanism for the support account used in the current period, from 1 July 2023 to 30 June 2024, as approved in paragraph 3 of its resolution 50/221 B; Budget performance report for the period from 1 July 2022 to 30 June 2023",
    "11": "Takes note of the report of the Secretary-General on the budget performance of the support account for peacekeeping operations for the period from 1 July 2022 to 30 June 2023; Budget estimates for the financial period from 1 July 2024 to 30 June 2025",
    "12": "Approves the support account requirements in the amount of 384,229,600 United States dollars for the financial period from 1 July 2024 to 30 June 2025, inclusive of the amount of 18,318,600 dollars under enterprise resource planning, 518,400 dollars for death and disability claims for closed peacekeeping operations, 868,500 dollars for the efficiency model for management services (previously the global service delivery model project), 3,326,800 dollars for peacekeeping capability readiness, 19,493,600 dollars for Umoja maintenance and support costs and 13,332,200 dollars for after-service health insurance costs, including 1,336 continuing posts and 2 new temporary posts, as well as the abolishment, redeployment, reassignment and reclassification of posts, 75 continuing and 4 new general temporary assistance positions and 52 person-months, as well as related post and non-post requirements; Financing of the support account for peacekeeping operations for the financial periods from 1 July 2022 to 30 June 2023 and from 1 July 2024 to 30 June 2025",
    "13": "Decides that the requirements for the support account for peacekeeping operations for the financial period from 1 July 2024 to 30 June 2025 shall be financed as follows: (a) The unencumbered balance in the amount of 3,234,100 dollars, in respect of the financial period from 1 July 2022 to 30 June 2023, to be applied to the resources required for the financial period from 1 July 2024 to 30 June 2025; (b) The total amount of 6,117,400 dollars, comprising investment revenue of 4,065,200 dollars, other miscellaneous revenue of 269,000 dollars and cancellation of prior-period obligations of 1,783,200 dollars in respect of the period from 1 July 2022 to 30 June 2023, to be applied to the resources required for the financial period from 1 July 2024 to 30 June 2025; (c) The amount of 4,839,200 dollars, representing the excess of the authorized level of the Peacekeeping Reserve Fund in respect of the financial period ended 30 June 2023, to be applied to the resources required for the financial period from 1 July 2024 to 30 June 2025; (d) The balance of 370,038,900 dollars to be prorated among the budgets of the active peacekeeping operations for the financial period from 1 July 2024 to 30 June 2025; (e) The net estimated staff assessment income of 30,163,300 dollars, comprising the amount of 29,083,900 dollars for the financial period from 1 July 2024 to 30 June 2025 and the increase of 1,079,400 dollars in respect of the financial period ended 30 June 2023, to be offset against the balance referred to in subparagraph (d) above, to be prorated among the budgets of the individual active peacekeeping operations."
  },
  "agenda_items": [
    "Item 146"
  ],
  "symbol_references": []
}