{
  "symbol": "A/RES/74/221",
  "filename": "A_RES_74_221.pdf",
  "title": "74/221. Implementation of the Convention on Biological Diversity and its contribution to sustainable development",
  "text": "United Nations \nA/RES/74/221\n \n \nGeneral Assembly \nDistr.: General \n20 January 2020 \n \n19-22490 (E)    220120 \n*1922490* \n \n \nSeventy-fourth session \nAgenda item 19 (f) \nSustainable development: Convention on \nBiological Diversity \n \n \n \n \n Resolution adopted by the General Assembly \non 19 December 2019 \n \n \n \n \n[on the report of the Second Committee (A/74/381/Add.6)] \n \n \n 74/221. Implementation of the Convention on Biological Diversity \nand its contribution to sustainable development \n \n \n \nThe General Assembly, \n \nRecalling its resolutions 64/203 of 21 December 2009, 65/161 of 20 December \n2010, 66/202 of 22 December 2011, 67/212 of 21 December 2012, 68/214 of \n20 December 2013, 69/222 of 19 December 2014, 70/207 of 22 December 2015, \n71/230 of 21 December 2016, 72/221 of 20 December 2017 and 73/234 of \n20 December 2018 and its previous resolutions relating to the Convention on \nBiological Diversity,1  \n \nReaffirming the outcomes of the United Nations Conference on Environment \nand Development, including the Rio Declaration on Environment and Development 2 \nand its principles, the outcome document of the United Nations Conference on \nSustainable Development, entitled \u201cThe future we want\u201d, 3  and, inter alia, the \ncommitments concerning biodiversity contained therein, the Programme for the \nFurther Implementation of Agenda 21,4 the Johannesburg Declaration on Sustainable \nDevelopment5 and the Plan of Implementation of the World Summit on Sustainable \nDevelopment (Johannesburg Plan of Implementation) 6 and the outcome document of \n__________________ \n \n1  United Nations, Treaty Series, vol. 1760, No. 30619. \n \n2  Report of the United Nations Conference on Environment and Development, Rio de Janeiro, \n3\u221214 June 1992, vol. I, Resolutions Adopted by the Conference (United Nations publication, \nSales No. E.93.I.8 and corrigendum), resolution 1, annex I. \n \n3  Resolution 66/288, annex. \n \n4  Resolution S-19/2, annex. \n \n5  Report of the World Summit on Sustainable Development, Johannesburg, South Africa, \n26 August\u20134 September 2002 (United Nations publication, Sales No. E.03.II.A.1 and \ncorrigendum), chap. I, resolution 1, annex. \n \n6  Ibid., resolution 2, annex. \n\nA/RES/74/221 \nImplementation of the Convention on Biological Diversity\nand its contribution to sustainable development\n \n19-22490\n2/11 \n \nthe special event to follow up efforts made towards achieving the Millennium \nDevelopment Goals convened by the President of the General Assembly, 7  \n \nReaffirming also its resolution 70/1 of 25 September 2015, entitled \n\u201cTransforming our world: the 2030 Agenda for Sustainable Development\u201d, in which \nit adopted a comprehensive, far-reaching and people-centred set of universal and \ntransformative Sustainable Development Goals and targets, its commitment to \nworking tirelessly for the full implementation of the Agenda by 2030, its recognition \nthat eradicating poverty in all its forms and dimensions, including extreme poverty, \nis the greatest global challenge and an indispensable requirement for sustainable \ndevelopment, its commitment to achieving sustainable development in its three \ndimensions \u2013 economic, social and environmental \u2013 in a balanced and integrated \nmanner, and to building upon the achievements of the Millennium Development \nGoals and seeking to address their unfinished business,  \n \nReaffirming further its resolution 69/313 of 27 July 2015 on the Addis Ababa \nAction Agenda of the Third International Conference on Financing for Development, \nwhich is an integral part of the 2030 Agenda for Sustainable Development, supports \nand complements it, helps to contextualize its means of implementation targets with \nconcrete policies and actions, and reaffirms the strong political commitment to \naddress the challenge of financing and creating an enabling environment at all levels \nfor sustainable development in the spirit of global partnership and solidarity,  \n \nReaffirming the Paris Agreement, 8  and encouraging all its parties to fully \nimplement the Agreement, and parties to the United Nations Framework Convention \non Climate Change 9  that have not yet done so to deposit their instruments of \nratification, acceptance, approval or accession, where appropriate, as soon as \npossible, \n \nReaffirming also the New Urban Agenda, adopted at the United Nations \nConference on Housing and Sustainable Urban Development (Habitat III), held in \nQuito, Ecuador, from 17 to 20 October 2016,10 and its vision for cities and human \nsettlements that protect, conserve, restore and promote their ecosystems, water, \nnatural habitats and biodiversity and minimize their environmental impact, \n \nWelcoming the 2019 Climate Action Summit convened by the Secretary-General \non 23 September, and noting the multi-partner initiatives and commitments presented \nduring the Summit, \n \nEncouraging parties, other Governments and relevant organizations to integrate \necosystem-based approaches and nature-based solutions to climate change adaptation \nand mitigation and disaster risk reduction into their strategic planning, as appropriate, \nacross sectors, \n \nRecalling that the objectives of the Convention on Biological Diversity, to be \npursued in accordance with its relevant provisions, are the conservation of biological \ndiversity, the sustainable use of its components and the fair and equitable sharing of \nthe benefits arising out of the utilization of genetic resources, including by \nappropriate access to genetic resources, by appropriate transfer of relevant \ntechnologies, taking into account all rights over those resources and to technologies, \nand by appropriate funding, \n \nReaffirming the intrinsic value of biological diversity, as well as the ecological, \ngenetic, social, economic, scientific, educational, cultural, recreational and aesthetic \n__________________ \n \n7  Resolution 68/6. \n \n8  Adopted under the UNFCCC in FCCC/CP/2015/10/Add.1, decision 1/CP.21. \n \n9  United Nations, Treaty Series, vol. 1771, No. 30822. \n \n10  Resolution 71/256, annex. \n\nImplementation of the Convention on Biological Diversity \nand its contribution to sustainable development \nA/RES/74/221\n \n3/11\n19-22490 \n \nvalues of biological diversity, and its critical role in maintaining ecosystems that \nprovide essential services, which are critical foundations for sustainable development \nand human well-being, \n \nRecognizing that the achievement of the three objectives of the Convention is \ncrucial for sustainable development, poverty eradication, food security and the \nimprovement of human well-being and a major factor underpinning the achievement \nof the Sustainable Development Goals and other internationally agreed development \ngoals, \n \nReaffirming that, in accordance with the Charter of the United Nations and the \nprinciples of international law, States have the sovereign right to exploit their own \nresources pursuant to their own environmental policies and the responsibility to \nensure that activities within their jurisdiction or control do not cause damage to the \nenvironment of other States or of areas beyond the limits of national jurisdiction,  \n \nRecalling that, in its resolution 65/161, the General Assembly declared 2011\u20132020 \nthe United Nations Decade on Biodiversity, with a view to contributing to the \nimplementation of the Strategic Plan for Biodiversity 2011\u20132020,11  \n \nRecalling also that, in its resolution 73/284 of 1 March 2019, the General \nAssembly declared 2021\u20132030 the United Nations Decade on Ecosystem Restoration, \nwith the aim of supporting and scaling up efforts to prevent, halt and reverse the \ndegradation of ecosystems worldwide and raise awareness of the importance of \nsuccessful ecosystem restoration,  \n \nRecognizing that the traditional knowledge, innovations and practices of \nindigenous peoples and local communities that are relevant to the Convention make \na key contribution to the conservation and sustainable use of biodiversity and that \ntheir wider application can support social well-being and sustainable livelihoods,  \n \nTaking note of the decision adopted by the Conference of the Parties to the \nConvention on Biological Diversity at its thirteenth meeting entitled \u201cArticle 8 (j) \nand related provisions\u201d,\n12  decision CBD/CP/MOP/VIII/19\n13  and decision \nCBD/NP/MOP/DEC/2/7,14 as well as of the work done by the Ad Hoc Open-ended \nInter-sessional Working Group on Article 8 (j) and related provisions, \n \nRecalling the United Nations Declaration on the Rights of Indigenous Peoples15 \nand the outcome document of the high-level plenary meeting of the General Assembly \nknown as the World Conference on Indigenous Peoples, 16  \n \nRecognizing the vital role that women play in the conservation and sustainable \nuse of biological diversity, and reaffirming the need for their full participation at all \nlevels of policymaking and implementation for the conservation and sustainable use \nof biological diversity, \n__________________ \n \n11  United Nations Environment Programme, document UNEP/CBD/COP/10/27, annex, \ndecision X/2, annex. \n \n12  United Nations Environment Programme, document UNEP/CBD/COP/13/25, decision XIII/18. \n \n13  Adopted by the Conference of the Parties serving as the Meeting of the Parties to the Cartagena \nProtocol on Biosafety at its eighth meeting (see United Nations Environment Programme, \ndocument UNEP/CBD/CP/MOP/8/17). \n \n14  Adopted by the Conference of the Parties serving as the Meeting of the Parties to the Nagoya \nProtocol on Access to Genetic Resources and the Fair and Equitable Sharing of Benefits Arising \nfrom Their Utilization at its second meeting (see United Nations Environment Programme, \ndocument UNEP/CBD/NP/MOP/2/13). \n \n15  Resolution 61/295, annex. \n \n16  Resolution 69/2. \n\nA/RES/74/221 \nImplementation of the Convention on Biological Diversity\nand its contribution to sustainable development\n \n19-22490\n4/11 \n \n \nRecalling the 2015\u20132020 Gender Plan of Action under the Convention on \nBiological Diversity,17 which will contribute to the integration of a gender perspective \nand promote gender equality within the implementation of the Strategic Plan for \nBiodiversity 2011\u20132020 and its 20 Aichi Biodiversity Targets, \n \nRecognizing the important role of other biodiversity-related multilateral \nenvironmental agreements, including the Convention on International Trade in \nEndangered Species of Wild Fauna and Flora,18 in contributing to the conservation \nand sustainable use of biodiversity and in ensuring that no species entering into \ninternational trade is threatened with extinction, 19 recognizing also the economic, \nsocial and environmental impacts of poaching and trafficking in wildlife, and noting \nthe contribution of parties to and the secretariat20 of the Convention on International \nTrade in Endangered Species of Wild Fauna and Flora to the implementation of the \nStrategic Plan for Biodiversity 2011\u20132020, its 20 Aichi Biodiversity Targets and the \nGlobal Strategy for Plant Conservation,  \n \nRecalling its resolution 71/312 of 6 July 2017, in which it endorsed the \ndeclaration entitled \u201cOur ocean, our future: call for action\u201d adopted by the high-level \nUnited Nations Conference to Support the Implementation of Sustainable \nDevelopment Goal 14: Conserve and sustainably use the oceans, seas and marine \nresources for sustainable development, in this regard reaffirming the important role \nof the declaration in demonstrating the collective will to take action to conserve and \nsustainably use our oceans, seas and marine resources for sustainable development, \nto halt and reverse the decline in the health and productivity of our ocean and its \necosystems and to protect and restore its resilience and ecological integrity, and \nrecognizing the important contributions of the partnership dialogues and voluntary \ncommitments made in the context of that Conference to the effective and timely \nimplementation of Sustainable Development Goal 14,  \n \nRecalling also the United Nations strategic plan for forests 2017\u20132030,21 and \nrecognizing that forests are home to an estimated 80 per cent of all terrestrial species \nand that forests, including boreal, temperate and tropical, contribute substantially to \nclimate change mitigation and adaptation and to the conservation of biodiversity,  \n \nNoting the adoption by the Conference of the Parties to the Convention on \nBiological Diversity, at its tenth meeting, of the Nagoya Protocol on Access to \nGenetic Resources and the Fair and Equitable Sharing of Benefits Arising from Their \nUtilization to the Convention on Biological Diversity, 22 the objective of which is the \nfair and equitable sharing of the benefits arising from the utilization of genetic \nresources, including by appropriate access to genetic resources and by appropriate \ntransfer of relevant technologies, taking into account all rights over those resources \nand to technologies, and by appropriate funding, and acknowledging the role of access \nto genetic resources and equitable benefit-sharing arising from their utilization in \ncontributing to the conservation and sustainable use of biological diversity, poverty \neradication and environmental sustainability, and thereby to the achievement of \nsustainable development, \n__________________ \n \n17  United Nations Environment Programme, document UNEP/CBD/COP/12/29, sect. I, \ndecision XII/7, annex. \n \n18  United Nations, Treaty Series, vol. 993, No. 14537. \n \n19  See resolution Conf. 16.7 of the Conference of the Parties to the Convention on International \nTrade in Endangered Species of Wild Fauna and Flora. \n \n20  See resolution Conf. 16.3 (Rev. CoP17), entitled \u201cCITES Strategic Vision: 2008\u20132020\u201d. \n \n21  See resolution 71/285. \n \n22  United Nations Environment Programme, document UNEP/CBD/COP/10/27, annex, \ndecision X/1. \n\nImplementation of the Convention on Biological Diversity \nand its contribution to sustainable development \nA/RES/74/221\n \n5/11\n19-22490 \n \n \nNoting also that 195 States and 1 regional economic integration organization are \nparties to the Convention, noting further that 91 States and 1 regional economic \nintegration organization have signed the Nagoya Protocol and that 122 States and \n1 regional economic integration organization that are parties to the Convention have \ndeposited their instruments of ratification, acceptance, approval or accession to the \nNagoya Protocol, and noting that 171 States and 1 regional economic integration \norganization are parties to the Cartagena Protocol on Biosafety to the Convention on \nBiological Diversity 23  and that 46 States and 1 regional economic integration \norganization are parties to the Nagoya-Kuala Lumpur Supplementary Protocol on \nLiability and Redress to the Cartagena Protocol on Biosafety, 24  \n \nWelcoming the entry into force of the Nagoya-Kuala Lumpur Supplementary \nProtocol on 5 March 2018, \n \nRecalling the adoption by the Conference of the Parties to the Convention at its \nninth meeting of the strategy for resource mobilization in support of the achievement \nof the three objectives of the Convention,25 as well as decision X/3, adopted by the \nConference of the Parties at its tenth meeting,26 on the review of its implementation, \nand the targets for resource mobilization, under Aichi Target 20 of the Strategic Plan \nfor Biodiversity 2011\u20132020, adopted by the Conference of the Parties in its \ndecision XII/3,27  \n \nNoting the outcomes of the thirteenth meeting of the Conference of the Parties \nto the Convention,28 the eighth meeting of the Conference of the Parties serving as \nthe Meeting of the Parties to the Cartagena Protocol 29 and the second meeting of the \nConference of the Parties serving as the Meeting of the Parties to the Nagoya \nProtocol,30 all held in Cancun, Mexico, in 2016,  \n \nRecalling with appreciation the Cancun Declaration on Mainstreaming the \nConservation and Sustainable Use of Biodiversity for Well-being, adopted at the high-\nlevel segment of the thirteenth meeting of the Conference of the Parties to the \nConvention,31  \n \nNoting the outcomes of the eighteenth meeting of the Conference of the Parties \nto the Convention on International Trade in Endangered Species of Wild Fauna and \nFlora, held in Geneva from 17 to 28 August 2019, and of the fourteenth session of the \nConference of the Parties to the United Nations Convention to Combat Desertification \nin Those Countries Experiencing Serious Drought and/or Desertification, Particularly \nin Africa, held in New Delhi from 2 to 13 September 2019, 32 which will contribute \nsignificantly to the protection and sustainable use of species and ecosystems, \n \nTaking note of the African Ministerial Declaration on Biodiversity and the \nPan-African Action Agenda on Ecosystem Restoration for Increased Resilience, \nadopted in Sharm el-Sheikh, Egypt, on 13 November 2018, \n \nReiterating the pledge that no one will be left behind, reaffirming the \nrecognition that the dignity of the human person is fundamental, and the wish to see \n__________________ \n \n23  United Nations, Treaty Series, vol. 2226, No. 30619. \n \n24  See United Nations Environment Programme, document UNEP/CBD/BS/COP-MOP/5/17, annex, \ndecision BS-V/11. \n \n25  United Nations Environment Programme, document UNEP/CBD/COP/9/29, annex I, \ndecision IX/11. \n \n26  See United Nations Environment Programme, document UNEP/CBD/COP/10/27, annex. \n \n27  See United Nations Environment Programme, document UNEP/CBD/COP/12/29, sect. I. \n \n28  See United Nations Environment Programme, document UNEP/CBD/COP/13/25, sect. I. \n \n29  See United Nations Environment Programme, document UNEP/CBD/CP/MOP/8/17, sect. I. \n \n30  See United Nations Environment Programme, document UNEP/CBD/NP/MOP/2/13, sect. I. \n \n31  United Nations Environment Programme, document UNEP/CBD/COP/13/24. \n \n32  See ICCD/COP(14)/23/Add.1. \n\nA/RES/74/221 \nImplementation of the Convention on Biological Diversity\nand its contribution to sustainable development\n \n19-22490\n6/11 \n \nthe Goals and targets met for all nations and peoples and for all segments of society, \nand recommitting to endeavour to reach the furthest behind first,  \n \n1. \nTakes note of the report of the Executive Secretary of the Convention on \nBiological Diversity;33  \n \n2. \nLooks forward to the fifteenth meeting of the Conference of the Parties to \nthe Convention, as well as the meetings of the Conference of the Parties serving as \nthe Meetings of the Parties to the Protocols to the Convention, to be held in Kunming, \nChina, in the fourth quarter of 2020, all under the theme proposed by the host, \n\u201cEcological civilization: building a shared future for all life on Earth\u201d, and recognizes \nthat a post-2020 global biodiversity framework to be adopted is intended to contribute \nto the 2030 Agenda for Sustainable Development34 and is expected to place the global \ncommunity on a path towards realizing the 2050 Vision for Biodiversity;  \n \n3. \nAlso looks forward to the sixteenth meeting of the Conference of the \nParties and the meetings of the Conference of the Parties serving as the Meetings of \nthe Parties to the Protocols to the Convention, which will be held in Turkey in the \nfourth quarter of 2022;  \n \n4. \nWelcomes the outcomes of the fourteenth meeting of Conference of the \nParties to the Convention,35 and recalls with appreciation the convening of the ninth \nmeeting of the Conference of the Parties serving as the Meeting of the Parties to the \nCartagena Protocol and the third meeting of the Conference of the Parties serving as \nthe Meeting of the Parties to the Nagoya Protocol, in Sharm el-Sheikh from 17 to \n29 November 2018, under the theme \u201cInvesting in biodiversity for people and planet\u201d, \nrecognizes that the outcomes of the meetings will contribute to the implementation of \nthe 2030 Agenda for Sustainable Development, and takes note with appreciation of \nthe Sharm el-Sheikh Declaration, adopted at the high-level segment of the fourteenth \nmeeting of the Conference of the Parties; \n \n5. \nAlso welcomes the hosting by Egypt of the fourteenth meeting of the \nConference of the Parties to the Convention, from 17 to 29 November 2018, and of \nthe African Biodiversity Summit, held on 13 November 2018, as well as the initiative \nof the Conference of the Parties at its fourteenth meeting to promote a coherent \napproach between the United Nations Framework Convention on Climate Change, 9 \nthe Convention on Biological Diversity1 and the United Nations Convention to \nCombat Desertification in Those Countries Experiencing Serious Drought and/or \nDesertification, Particularly in Africa36 (the Rio conventions), to address biodiversity \nloss, climate change and land and ecosystem degradation;  \n \n6.  \nEncourages support for the Sharm el-Sheikh to Kunming Action Agenda \nfor Nature and People, which is aimed at collecting, coordinating and celebrating \nactions in support of biodiversity conservation and its sustainable use, encourages all \nrelevant stakeholders, including indigenous peoples and local communities and the \nprivate sector, to consider developing biodiversity commitments, and invites relevant \nagencies, funds and programmes of the United Nations system and other relevant \ninstitutions and intergovernmental organizations, where relevant, to support the \nimplementation of the Action Agenda; \n \n7. \nHighlights the importance of parties raising high-level political \nengagement for the achievement of the Aichi Biodiversity Targets by 2020 and the \nrelated Goals and targets of the 2030 Agenda for Sustainable Development; \n__________________ \n \n33  A/74/207, sect. III. \n \n34  Resolution 70/1. \n \n35  See United Nations Environment Programme, document UNEP/CBD/COP/14/14, sect. I. \n \n36  United Nations, Treaty Series, vol. 1954, No. 33480. \n\nImplementation of the Convention on Biological Diversity \nand its contribution to sustainable development \nA/RES/74/221\n \n7/11\n19-22490 \n \n \n8. \nWelcomes the commitments made by the parties at the high-level segment \nof the fourteenth meeting of the Conference of the Parties and through the decisions \nadopted, which support the implementation of the current Strategic Plan for \nBiodiversity 2011\u2013202011 and the development of a post-2020 global biodiversity \nframework, inter alia, to: \n \n(a) \nAccelerating efforts to implement the Strategic Plan for Biodiversity \n2011\u20132020 and achieve the Aichi Biodiversity Targets, including by implementing \nthe decisions of the Conference of the Parties and the Cartagena and Nagoya \nProtocols, as appropriate, and by providing and mobilizing international and national \nresources, thereby contributing to the implementation of the 2030 Agenda for \nSustainable Development; \n \n(b) \nSupporting the development and implementation of a post-2020 global \nbiodiversity framework, building on the Aichi Biodiversity Targets and the lessons \nlearned from the implementation of the Strategic Plan for Biodiversity 2011\u20132020 \nand aligned with the 2030 Agenda for Sustainable Development, with a level of \nambition and practicality that will facilitate the transformational changes needed to \nachieve the 2050 Vision for Biodiversity, as noted in the conclusions of the Subsidiary \nBody on Scientific, Technical and Technological Advice;  \n \n(c) \nPromoting, prior to the fifteenth meeting of the Conference of the Parties, \nvoluntary biodiversity contributions by parties and other actors towards achieving the \n2050 Vision for Biodiversity; \n \n(d) \nEngaging indigenous peoples and local communities, women, youth, civil \nsociety, local governments and authorities, academia, the business and financial \nsectors and other relevant stakeholders to support action towards the 2050 Vision for \nBiodiversity and to provide momentum for the implementation of a post-2020 global \nbiodiversity framework; \n \n9. \nUrges parties to the Convention on Biological Diversity to ensure the \ncoherence and complementarity of a post-2020 global biodiversity framework with \nother existing or upcoming international processes, in particular with regard to the \n2030 Agenda for Sustainable Development, the Paris Agreement 8 and other related \nprocesses, frameworks and strategies, and reiterates the invitation to the other \nmultilateral environmental agreements, including biodiversity-related conventions \nand the Rio conventions, relevant international organizations and their programmes, \nand other relevant processes to actively participate in the development process for a \npost-2020 global biodiversity framework; \n \n10. Recalls the invitation to the Executive Director of the United Nations \nEnvironment Programme, in the capacity as Chair of the United Nations Environment \nManagement Group, to facilitate, in collaboration with the members of the Group, the \ncontribution of the United Nations system to the development and implementation of \na post-2020 global biodiversity framework; \n \n11. \nReaffirms its decision to convene a summit on biodiversity at the level of \nHeads of State and Government, within existing resources, before the fifteenth \nmeeting of the Conference of the Parties to the Convention, in 2020, in order to \nhighlight the urgency of action at the highest levels in support of a post-2020 global \nbiodiversity framework that contributes to the 2030 Agenda for Sustainable \nDevelopment and places the global community on a path towards realizing the \n2050 Vision for Biodiversity, \u201cLiving in harmony with nature\u201d;  \n \n12. Urges Member States and other potential donors to contribute to the \nUnited Nations multi-partner trust fund to support the summit, primarily to support \npreparations as well as travel and participation by representatives of developing \ncountries, in the event that a country offers to host the summit;  \n\nA/RES/74/221 \nImplementation of the Convention on Biological Diversity\nand its contribution to sustainable development\n \n19-22490\n8/11 \n \n \n13. Requests the President of the General Assembly, within existing resources, \nto start preparations for the summit in close collaboration with the secretariat of the \nConvention, and with the support of the United Nations Environment Programme and \nother relevant United Nations entities, also requests the President to appoint as early \nas possible two co-facilitators, one each from a developing and a developed country, \nby the end of 2019, to lead the preparatory process in an expedited manner, in \nconsultation with Member States, including on the modalities of the summit, to be \nagreed upon by the Assembly no later than March 2020, and invites the President to \nkeep Member States updated on developments in the process; \n \n14. Recalls with appreciation the entry into force of the Nagoya Protocol \non Access to Genetic Resources and the Fair and Equitable Sharing of Benefits \nArising from Their Utilization to the Convention on Biological Diversity 22 on \n12 October 2014;  \n \n15. Stresses the importance of mainstreaming biodiversity for achieving the \nobjectives of the Convention, the Strategic Plan for Biodiversity 2011\u20132020, its Aichi \nBiodiversity Targets and the 2050 Vision for Biodiversity in order to achieve the \ntransformational change required throughout societies and economies, including \nchanges in behaviour and decision-making at all levels, and urges all relevant \nstakeholders to mainstream biodiversity in all relevant sectors; \n \n16. Welcomes the decisions of the parties to the Convention to better \nmainstream biodiversity and to take specific actions tailored to national needs and \ncircumstances, and in line with other relevant international agreements, including in \nkey sectors, such as agriculture, forestry, fisheries and tourism, as well as health, \nenergy, mining, infrastructure, manufacturing and processing sectors, which are \ncrucial for addressing biodiversity loss, bearing in mind the impact of these sectors \non biodiversity;  \n \n17. Stresses \nthe \nimportance \nof \nmainstreaming \nbiodiversity \nin \nthe \nimplementation of the 2030 Agenda for Sustainable Development as part of national \nimplementation plans for the Sustainable Development Goals, in particular all \nbiodiversity-related Goals and targets;  \n \n18. Recognizes that integrating biodiversity considerations into sectoral and \ncross-sectoral policies, plans and programmes at all levels is critical for harnessing \nthe benefits of enhanced synergies and policy coherence;  \n \n19. Encourages the respective parties, in close collaboration with relevant \nstakeholders, to take concrete measures towards achieving the objectives of the \nConvention on Biological Diversity and the Protocols thereto, the Cartagena Protocol \non Biosafety23 and the Nagoya Protocol, requests the parties, in close collaboration \nwith relevant stakeholders, to coherently and efficiently implement the obligations \nand commitments under the Convention and the Protocols, and in this regard \nemphasizes the need to comprehensively address at all levels the difficulties that may \nimpede their implementation;  \n \n20. Recognizes that the conservation and sustainable use of biodiversity can \nsignificantly contribute to disaster risk reduction and to reducing the adverse impacts \nof climate change, including by adding resilience to fragile ecosystems and making \nthem less vulnerable;  \n \n21. Urges the parties to the Convention to facilitate the transfer of technology \nfor the effective implementation of the Convention in accordance with article 16 and \nother relevant provisions of the Convention, in this regard takes note of the strategy \nfor the practical implementation of the programme of work on technology transfer \nand scientific and technical cooperation developed by the Ad Hoc Technical Expert \nGroup on Technology Transfer and Scientific and Technological Cooperation, as well \n\nImplementation of the Convention on Biological Diversity \nand its contribution to sustainable development \nA/RES/74/221\n \n9/11\n19-22490 \n \nas of decision XI/2, entitled \u201cReview of progress in implementation of national \nbiodiversity strategies and action plans and related capacity-building support to \nparties\u201d,37 and recalls the relevant decisions adopted by the Conference of the Parties \nat its twelfth meeting in this regard;27  \n \n22. Notes with appreciation the efforts made by the secretariat of the \nConvention, parties to the Convention and the Global Environment Facility, as the \nfinancial mechanism of the Convention, in conjunction with United Nations funds \nand programmes and the specialized agencies, as well as other entities, in organizing \ncapacity-building workshops to support countries in the updating of national \nbiodiversity strategies and action plans, with a view to enhancing capacity and \naddressing the need for human, technical and financial resources to implement the \nStrategic Plan for Biodiversity 2011\u20132020 and the Aichi Biodiversity Targets, adopted \nby the Conference of the Parties to the Convention at its tenth meeting, in particular \nfor developing countries;  \n \n23. Recognizes with concern the limited progress in the achievement of the \nAichi Biodiversity Targets and the implementation of the Strategic Plan for \nBiodiversity 2011\u20132020 by the parties to the Convention, and, given the limited time \nremaining, calls upon all parties to accelerate and scale up efforts to implement \nthem, acknowledging the contribution of such efforts to the implementation of the \n2030 Agenda for Sustainable Development and the achievement of the Sustainable \nDevelopment Goals;  \n \n24. Notes with concern the limited progress made in the implementation of the \nthree objectives of the Convention, namely, the conservation of biological diversity, \nthe sustainable use of its components and the fair and equitable sharing of the benefits \narising out of the utilization of genetic resources; \n \n25. Notes with particular concern the limited progress made by its parties in \nthe implementation of the Nagoya Protocol; \n \n26. Notes the limited progress made in mainstreaming article 8 (j) of the \nConvention and related provisions into various areas of work under the Convention, \ntakes note with appreciation of decision 14/17 of the Conference of the Parties to the \nConvention to consider the development of a fully integrated programme of work on \narticle 8 (j) and related provisions within a post-2020 global biodiversity framework, \nto allow for the full and effective participation of indigenous peoples and local \ncommunities in the work of the Convention, and in this regard invites the secretariat \nof the Convention, through the Secretary-General, to report on the progress made by \nthe Ad Hoc Open-ended Inter-sessional Working Group on Article 8 (j) and related \nprovisions when reporting on the implementation of the present resolution to the \nGeneral Assembly; \n \n27. Encourages \nparties \nto \npromote \nthe \nmainstreaming \nof \ngender \nconsiderations, taking into account the 2015\u20132020 Gender Plan of Action under the \nConvention on Biological Diversity,17 in developing, implementing and revising their \nnational and, where appropriate, regional and subnational biodiversity strategies and \naction plans and equivalent instruments in implementing the three objectives of the \nConvention, recognizes the need to enhance cooperation on capacity-building in order \nto support parties in this process, and emphasizes the importance of integrating a \ngender perspective into the process of developing a post-2020 global biodiversity \nframework; \n \n28. Calls upon Governments and all stakeholders to take appropriate measures \nto mainstream consideration of the socioeconomic impacts and benefits of the \n__________________ \n \n37  See United Nations Environment Programme, document UNEP/CBD/COP/11/35, annex I. \n\nA/RES/74/221 \nImplementation of the Convention on Biological Diversity\nand its contribution to sustainable development\n \n19-22490\n10/11 \n \nconservation and sustainable use of biodiversity and its components, as well as \necosystems that provide essential services, into relevant programmes and policies at \nall levels, in accordance with national legislation, circumstances and priorities;  \n \n29. Reaffirms the importance of continuing to pursue more efficient and \ncoherent implementation of the three objectives of the Convention, and calls upon \nparties and stakeholders to strengthen international cooperation measures for the \nfulfilment of obligations contained in the Convention;  \n \n30. Invites all parties, relevant departments of the Secretariat, the specialized \nagencies, funds and programmes of the United Nations system and the regional \ncommissions to continue to contribute to the achievement of the objectives of the \nStrategic Plan for Biodiversity 2011\u20132020; \n \n31. Reaffirms the need for a comprehensive and participatory process towards \ndeveloping proposals for the follow-up to the Strategic Plan for Biodiversity 2011\u20132020, \nfully in line with decision XIII/128 and decision 14/34, as well as other relevant \ndecisions of the Conference of the Parties to the Convention; \n \n32. Recognizes that parties to the Convention have reiterated that resources, \nfinancial, human and technical, need to be provided and mobilized from all sources, \nwith a view to the effective implementation of the Strategic Plan for Biodiversity \n2011\u20132020 and a post-2020 global biodiversity framework to follow it, stresses the \nneed for further consideration of the evaluation of all resources mobilized in terms of \nthe biodiversity outcomes achieved, and, in this regard, welcomes the decision of the \nparties to the Convention on an overall substantial increase in total biodiversity-\nrelated funding for the implementation of the Strategic Plan from a variety of sources, \nincluding national and international resource mobilization, international cooperation \nand the exploration of new and innovative financial mechanisms, as appropriate, and \nnotes that the fourteenth meeting of the Conference of the Parties affirmed that \nresource mobilization will be an integral part of a post-2020 global biodiversity \nframework and initiated preparations of this resource mobilization component at an \nearly stage and in full coherence and coordination with the overall process of \ndeveloping a post-2020 framework; \n \n33. Invites countries that have not yet done so to ratify or accede to the \nConvention;  \n \n34. Invites parties to the Convention to ratify or accede to the Nagoya \nProtocol, and invites the Executive Secretary of the Convention and the Global \nEnvironment Facility, within its mandate as the financial mechanism of the \nConvention, in collaboration with relevant organizations, to continue to support \ncapacity-building and development activities to support the ratification and \nimplementation of the Protocol;  \n \n35. Also invites parties to the Convention to consider, as appropriate, ratifying \nor acceding to the Cartagena Protocol;  \n \n36. Invites parties to the Cartagena Protocol to consider, as appropriate, \nratifying or acceding to the Nagoya-Kuala Lumpur Supplementary Protocol on \nLiability and Redress to the Cartagena Protocol on Biosafety; 24  \n \n37. Notes with concern the findings of the Intergovernmental Science-Policy \nPlatform on Biodiversity and Ecosystem Services, and stresses the urgent need to halt \nthe global decline of biodiversity, which is unprecedented in human history, including \nits main indirect and direct drivers, in particular changes in land and sea use, direct \nexploitation of organisms, climate change, pollution and invasion of alien species; \n \n38. Notes that increasing investments in nature-based solutions has the \npotential to cost-effectively support biodiversity conservation, restoration and its \n\nImplementation of the Convention on Biological Diversity \nand its contribution to sustainable development \nA/RES/74/221\n \n11/11\n19-22490 \n \nsustainable use, to help advance climate mitigation and adaptation and to reduce \nadverse impacts of climate change and to slow, halt and even reverse some aspects of \nbiodiversity and ecosystem loss, and therefore invites all relevant stakeholders to pay \ndue attention to the opportunities it presents; \n \n39. Takes note with concern of the findings of the Intergovernmental Panel on \nClimate Change in its special reports entitled Global Warming of 1.5\u00b0C, The Ocean \nand Cryosphere in a Changing Climate and Climate Change and Land: An IPCC \nSpecial Report on Climate Change, Desertification, Land Degradation, Sustainable \nLand Management, Food Security, and Greenhouse Gas Fluxes in Terrestrial \nEcosystems;  \n \n40. Stresses the importance of the engagement of the private sector and other \nrelevant stakeholders, as well as indigenous peoples and local communities, women \nand youth, in the implementation of the three objectives of the Convention and in the \nachievement of the biodiversity targets, invites them to align their practices more \nexplicitly with the objectives of the Convention, including through partnerships, in \naccordance with national legislation, circumstances and priorities, in this regard \nstresses the importance of the ongoing work of the Global Partnership for Business \nand Biodiversity, and notes other related and complementary initiatives;  \n \n41. Notes the ongoing work of the Joint Liaison Group of the secretariats and \noffices of the relevant subsidiary bodies of the Convention on Biological Diversity, \nthe Convention to Combat Desertification and the United Nations Framework \nConvention on Climate Change and the Liaison Group of Biodiversity-related \nConventions, acknowledges the importance of improving coherence in the \nimplementation of those conventions, recognizes the importance of enhancing \nsynergies among the biodiversity-related conventions, without prejudice to their \nspecific objectives, in this regard notes the contribution of the United Nations \nEnvironment Assembly, as reflected in its resolution 2/17 of 27 May 2016, 38 and the \noutcomes of its fourth session, held in Nairobi from 11 to 15 March 2019, 39 in \nparticular its ministerial declaration, and encourages the conferences of the parties to \nthe biodiversity-related multilateral environmental agreements to consider \nstrengthening efforts in this regard, taking into account relevant experiences and \nbearing in mind the respective independent legal status and mandates of those \ninstruments;  \n \n42. Reaffirms the commitment at the very heart of the 2030 Agenda to leave \nno one behind and commit to taking more tangible steps to support people in \nvulnerable situations and the most vulnerable countries and to reach the furthest \nbehind first; \n \n43. Requests the Secretary-General to submit to the General Assembly, at its \nseventy-fifth session, a report on the implementation of the present resolution, \nincluding on progress in the implementation of the Convention on Biological \nDiversity and the Aichi Biodiversity Targets and difficulties encountered in the \nprocess of their implementation, and decides to include in the provisional agenda of \nits seventy-fifth session, under the item entitled \u201cSustainable development\u201d, the \nsub-item entitled \u201cConvention on Biological Diversity\u201d. \n \n52nd plenary meeting \n19 December 2019 \n \n__________________ \n \n38  See Official Records of the General Assembly, Seventy-first Session, Supplement No. 25 \n(A/71/25), annex. \n \n39  Ibid., Seventy-fourth Session, Supplement No. 25 (A/74/25), annex I.  \n",
  "paragraphs": {
    "1": "Takes note of the report of the Executive Secretary of the Convention on Biological Diversity;33",
    "2": "Looks forward to the fifteenth meeting of the Conference of the Parties to the Convention, as well as the meetings of the Conference of the Parties serving as the Meetings of the Parties to the Protocols to the Convention, to be held in Kunming, China, in the fourth quarter of 2020, all under the theme proposed by the host, \u201cEcological civilization: building a shared future for all life on Earth\u201d, and recognizes that a post-2020 global biodiversity framework to be adopted is intended to contribute to the 2030 Agenda for Sustainable Development34 and is expected to place the global community on a path towards realizing the 2050 Vision for Biodiversity;",
    "3": "Also looks forward to the sixteenth meeting of the Conference of the Parties and the meetings of the Conference of the Parties serving as the Meetings of the Parties to the Protocols to the Convention, which will be held in Turkey in the fourth quarter of 2022;",
    "4": "Welcomes the outcomes of the fourteenth meeting of Conference of the Parties to the Convention,35 and recalls with appreciation the convening of the ninth meeting of the Conference of the Parties serving as the Meeting of the Parties to the Cartagena Protocol and the third meeting of the Conference of the Parties serving as the Meeting of the Parties to the Nagoya Protocol, in Sharm el-Sheikh from 17 to 29 November 2018, under the theme \u201cInvesting in biodiversity for people and planet\u201d, recognizes that the outcomes of the meetings will contribute to the implementation of the 2030 Agenda for Sustainable Development, and takes note with appreciation of the Sharm el-Sheikh Declaration, adopted at the high-level segment of the fourteenth meeting of the Conference of the Parties;",
    "5": "Also welcomes the hosting by Egypt of the fourteenth meeting of the Conference of the Parties to the Convention, from 17 to 29 November 2018, and of the African Biodiversity Summit, held on 13 November 2018, as well as the initiative of the Conference of the Parties at its fourteenth meeting to promote a coherent approach between the United Nations Framework Convention on Climate Change, 9 the Convention on Biological Diversity1 and the United Nations Convention to Combat Desertification in Those Countries Experiencing Serious Drought and/or Desertification, Particularly in Africa36 (the Rio conventions), to address biodiversity loss, climate change and land and ecosystem degradation;",
    "6": "Encourages support for the Sharm el-Sheikh to Kunming Action Agenda for Nature and People, which is aimed at collecting, coordinating and celebrating actions in support of biodiversity conservation and its sustainable use, encourages all relevant stakeholders, including indigenous peoples and local communities and the private sector, to consider developing biodiversity commitments, and invites relevant agencies, funds and programmes of the United Nations system and other relevant institutions and intergovernmental organizations, where relevant, to support the implementation of the Action Agenda;",
    "7": "Highlights the importance of parties raising high-level political engagement for the achievement of the Aichi Biodiversity Targets by 2020 and the related Goals and targets of the 2030 Agenda for Sustainable Development;",
    "8": "Welcomes the commitments made by the parties at the high-level segment of the fourteenth meeting of the Conference of the Parties and through the decisions adopted, which support the implementation of the current Strategic Plan for Biodiversity 2011\u2013202011 and the development of a post-2020 global biodiversity framework, inter alia, to: (a) Accelerating efforts to implement the Strategic Plan for Biodiversity 2011\u20132020 and achieve the Aichi Biodiversity Targets, including by implementing the decisions of the Conference of the Parties and the Cartagena and Nagoya Protocols, as appropriate, and by providing and mobilizing international and national resources, thereby contributing to the implementation of the 2030 Agenda for Sustainable Development; (b) Supporting the development and implementation of a post-2020 global biodiversity framework, building on the Aichi Biodiversity Targets and the lessons learned from the implementation of the Strategic Plan for Biodiversity 2011\u20132020 and aligned with the 2030 Agenda for Sustainable Development, with a level of ambition and practicality that will facilitate the transformational changes needed to achieve the 2050 Vision for Biodiversity, as noted in the conclusions of the Subsidiary Body on Scientific, Technical and Technological Advice; (c) Promoting, prior to the fifteenth meeting of the Conference of the Parties, voluntary biodiversity contributions by parties and other actors towards achieving the 2050 Vision for Biodiversity; (d) Engaging indigenous peoples and local communities, women, youth, civil society, local governments and authorities, academia, the business and financial sectors and other relevant stakeholders to support action towards the 2050 Vision for Biodiversity and to provide momentum for the implementation of a post-2020 global biodiversity framework;",
    "9": "Urges parties to the Convention on Biological Diversity to ensure the coherence and complementarity of a post-2020 global biodiversity framework with other existing or upcoming international processes, in particular with regard to the 2030 Agenda for Sustainable Development, the Paris Agreement 8 and other related processes, frameworks and strategies, and reiterates the invitation to the other multilateral environmental agreements, including biodiversity-related conventions and the Rio conventions, relevant international organizations and their programmes, and other relevant processes to actively participate in the development process for a post-2020 global biodiversity framework;",
    "10": "Recalls the invitation to the Executive Director of the United Nations Environment Programme, in the capacity as Chair of the United Nations Environment Management Group, to facilitate, in collaboration with the members of the Group, the contribution of the United Nations system to the development and implementation of a post-2020 global biodiversity framework;",
    "11": "Reaffirms its decision to convene a summit on biodiversity at the level of Heads of State and Government, within existing resources, before the fifteenth meeting of the Conference of the Parties to the Convention, in 2020, in order to highlight the urgency of action at the highest levels in support of a post-2020 global biodiversity framework that contributes to the 2030 Agenda for Sustainable Development and places the global community on a path towards realizing the 2050 Vision for Biodiversity, \u201cLiving in harmony with nature\u201d;",
    "12": "",
    "13": "Requests the President of the General Assembly, within existing resources, to start preparations for the summit in close collaboration with the secretariat of the Convention, and with the support of the United Nations Environment Programme and other relevant United Nations entities, also requests the President to appoint as early as possible two co-facilitators, one each from a developing and a developed country, by the end of 2019, to lead the preparatory process in an expedited manner, in consultation with Member States, including on the modalities of the summit, to be agreed upon by the Assembly no later than March 2020, and invites the President to keep Member States updated on developments in the process;",
    "14": "Recalls with appreciation the entry into force of the Nagoya Protocol on Access to Genetic Resources and the Fair and Equitable Sharing of Benefits Arising from Their Utilization to the Convention on Biological Diversity 22 on 12 October 2014;",
    "15": "Stresses the importance of mainstreaming biodiversity for achieving the objectives of the Convention, the Strategic Plan for Biodiversity 2011\u20132020, its Aichi Biodiversity Targets and the 2050 Vision for Biodiversity in order to achieve the transformational change required throughout societies and economies, including changes in behaviour and decision-making at all levels, and urges all relevant stakeholders to mainstream biodiversity in all relevant sectors;",
    "16": "Welcomes the decisions of the parties to the Convention to better mainstream biodiversity and to take specific actions tailored to national needs and circumstances, and in line with other relevant international agreements, including in key sectors, such as agriculture, forestry, fisheries and tourism, as well as health, energy, mining, infrastructure, manufacturing and processing sectors, which are crucial for addressing biodiversity loss, bearing in mind the impact of these sectors on biodiversity;",
    "17": "Stresses the importance of mainstreaming biodiversity in the implementation of the 2030 Agenda for Sustainable Development as part of national implementation plans for the Sustainable Development Goals, in particular all biodiversity-related Goals and targets;",
    "18": "Recognizes that integrating biodiversity considerations into sectoral and cross-sectoral policies, plans and programmes at all levels is critical for harnessing the benefits of enhanced synergies and policy coherence;",
    "19": "Encourages the respective parties, in close collaboration with relevant stakeholders, to take concrete measures towards achieving the objectives of the Convention on Biological Diversity and the Protocols thereto, the Cartagena Protocol on Biosafety23 and the Nagoya Protocol, requests the parties, in close collaboration with relevant stakeholders, to coherently and efficiently implement the obligations and commitments under the Convention and the Protocols, and in this regard emphasizes the need to comprehensively address at all levels the difficulties that may impede their implementation;",
    "20": "Recognizes that the conservation and sustainable use of biodiversity can significantly contribute to disaster risk reduction and to reducing the adverse impacts of climate change, including by adding resilience to fragile ecosystems and making them less vulnerable;",
    "21": " as of decision XI/2, entitled \u201cReview of progress in implementation of national biodiversity strategies and action plans and related capacity-building support to parties\u201d,37 and recalls the relevant decisions adopted by the Conference of the Parties at its twelfth meeting in this regard;27",
    "22": "Notes with appreciation the efforts made by the secretariat of the Convention, parties to the Convention and the Global Environment Facility, as the financial mechanism of the Convention, in conjunction with United Nations funds and programmes and the specialized agencies, as well as other entities, in organizing capacity-building workshops to support countries in the updating of national biodiversity strategies and action plans, with a view to enhancing capacity and addressing the need for human, technical and financial resources to implement the Strategic Plan for Biodiversity 2011\u20132020 and the Aichi Biodiversity Targets, adopted by the Conference of the Parties to the Convention at its tenth meeting, in particular for developing countries;",
    "23": "Recognizes with concern the limited progress in the achievement of the Aichi Biodiversity Targets and the implementation of the Strategic Plan for Biodiversity 2011\u20132020 by the parties to the Convention, and, given the limited time remaining, calls upon all parties to accelerate and scale up efforts to implement them, acknowledging the contribution of such efforts to the implementation of the 2030 Agenda for Sustainable Development and the achievement of the Sustainable Development Goals;",
    "24": "Notes with concern the limited progress made in the implementation of the three objectives of the Convention, namely, the conservation of biological diversity, the sustainable use of its components and the fair and equitable sharing of the benefits arising out of the utilization of genetic resources;",
    "25": "Notes with particular concern the limited progress made by its parties in the implementation of the Nagoya Protocol;",
    "26": "Notes the limited progress made in mainstreaming article 8 (j) of the Convention and related provisions into various areas of work under the Convention, takes note with appreciation of decision 14/17 of the Conference of the Parties to the Convention to consider the development of a fully integrated programme of work on article 8 (j) and related provisions within a post-2020 global biodiversity framework, to allow for the full and effective participation of indigenous peoples and local communities in the work of the Convention, and in this regard invites the secretariat of the Convention, through the Secretary-General, to report on the progress made by the Ad Hoc Open-ended Inter-sessional Working Group on Article 8 (j) and related provisions when reporting on the implementation of the present resolution to the General Assembly;",
    "27": "Encourages parties to promote the mainstreaming of gender considerations, taking into account the 2015\u20132020 Gender Plan of Action under the Convention on Biological Diversity,17 in developing, implementing and revising their national and, where appropriate, regional and subnational biodiversity strategies and action plans and equivalent instruments in implementing the three objectives of the Convention, recognizes the need to enhance cooperation on capacity-building in order to support parties in this process, and emphasizes the importance of integrating a gender perspective into the process of developing a post-2020 global biodiversity framework;",
    "28": "Calls upon Governments and all stakeholders to take appropriate measures to mainstream consideration of the socioeconomic impacts and benefits of the conservation and sustainable use of biodiversity and its components, as well as ecosystems that provide essential services, into relevant programmes and policies at all levels, in accordance with national legislation, circumstances and priorities;",
    "29": "Reaffirms the importance of continuing to pursue more efficient and coherent implementation of the three objectives of the Convention, and calls upon parties and stakeholders to strengthen international cooperation measures for the fulfilment of obligations contained in the Convention;",
    "30": "Invites all parties, relevant departments of the Secretariat, the specialized agencies, funds and programmes of the United Nations system and the regional commissions to continue to contribute to the achievement of the objectives of the Strategic Plan for Biodiversity 2011\u20132020;",
    "31": "Reaffirms the need for a comprehensive and participatory process towards developing proposals for the follow-up to the Strategic Plan for Biodiversity 2011\u20132020, fully in line with decision XIII/128 and decision 14/34, as well as other relevant decisions of the Conference of the Parties to the Convention;",
    "32": "Recognizes that parties to the Convention have reiterated that resources, financial, human and technical, need to be provided and mobilized from all sources, with a view to the effective implementation of the Strategic Plan for Biodiversity 2011\u20132020 and a post-2020 global biodiversity framework to follow it, stresses the need for further consideration of the evaluation of all resources mobilized in terms of the biodiversity outcomes achieved, and, in this regard, welcomes the decision of the parties to the Convention on an overall substantial increase in total biodiversity- related funding for the implementation of the Strategic Plan from a variety of sources, including national and international resource mobilization, international cooperation and the exploration of new and innovative financial mechanisms, as appropriate, and notes that the fourteenth meeting of the Conference of the Parties affirmed that resource mobilization will be an integral part of a post-2020 global biodiversity framework and initiated preparations of this resource mobilization component at an early stage and in full coherence and coordination with the overall process of developing a post-2020 framework;",
    "33": "Invites countries that have not yet done so to ratify or accede to the Convention;",
    "34": "Invites parties to the Convention to ratify or accede to the Nagoya Protocol, and invites the Executive Secretary of the Convention and the Global Environment Facility, within its mandate as the financial mechanism of the Convention, in collaboration with relevant organizations, to continue to support capacity-building and development activities to support the ratification and implementation of the Protocol;",
    "35": "Also invites parties to the Convention to consider, as appropriate, ratifying or acceding to the Cartagena Protocol;",
    "36": "Invites parties to the Cartagena Protocol to consider, as appropriate, ratifying or acceding to the Nagoya-Kuala Lumpur Supplementary Protocol on Liability and Redress to the Cartagena Protocol on Biosafety; 24",
    "37": "Notes with concern the findings of the Intergovernmental Science-Policy Platform on Biodiversity and Ecosystem Services, and stresses the urgent need to halt the global decline of biodiversity, which is unprecedented in human history, including its main indirect and direct drivers, in particular changes in land and sea use, direct exploitation of organisms, climate change, pollution and invasion of alien species;",
    "38": " sustainable use, to help advance climate mitigation and adaptation and to reduce adverse impacts of climate change and to slow, halt and even reverse some aspects of biodiversity and ecosystem loss, and therefore invites all relevant stakeholders to pay due attention to the opportunities it presents;",
    "39": "Takes note with concern of the findings of the Intergovernmental Panel on Climate Change in its special reports entitled Global Warming of 1.5\u00b0C, The Ocean and Cryosphere in a Changing Climate and Climate Change and Land: An IPCC Special Report on Climate Change, Desertification, Land Degradation, Sustainable Land Management, Food Security, and Greenhouse Gas Fluxes in Terrestrial Ecosystems;",
    "40": "Stresses the importance of the engagement of the private sector and other relevant stakeholders, as well as indigenous peoples and local communities, women and youth, in the implementation of the three objectives of the Convention and in the achievement of the biodiversity targets, invites them to align their practices more explicitly with the objectives of the Convention, including through partnerships, in accordance with national legislation, circumstances and priorities, in this regard stresses the importance of the ongoing work of the Global Partnership for Business and Biodiversity, and notes other related and complementary initiatives;",
    "41": "Notes the ongoing work of the Joint Liaison Group of the secretariats and offices of the relevant subsidiary bodies of the Convention on Biological Diversity, the Convention to Combat Desertification and the United Nations Framework Convention on Climate Change and the Liaison Group of Biodiversity-related Conventions, acknowledges the importance of improving coherence in the implementation of those conventions, recognizes the importance of enhancing synergies among the biodiversity-related conventions, without prejudice to their specific objectives, in this regard notes the contribution of the United Nations Environment Assembly, as reflected in its resolution 2/17 of 27 May 2016, 38 and the outcomes of its fourth session, held in Nairobi from 11 to 15 March 2019, 39 in particular its ministerial declaration, and encourages the conferences of the parties to the biodiversity-related multilateral environmental agreements to consider strengthening efforts in this regard, taking into account relevant experiences and bearing in mind the respective independent legal status and mandates of those instruments;",
    "42": "Reaffirms the commitment at the very heart of the 2030 Agenda to leave no one behind and commit to taking more tangible steps to support people in vulnerable situations and the most vulnerable countries and to reach the furthest behind first;",
    "43": "Requests the Secretary-General to submit to the General Assembly, at its seventy-fifth session, a report on the implementation of the present resolution, including on progress in the implementation of the Convention on Biological Diversity and the Aichi Biodiversity Targets and difficulties encountered in the process of their implementation, and decides to include in the provisional agenda of its seventy-fifth session, under the item entitled \u201cSustainable development\u201d, the sub-item entitled \u201cConvention on Biological Diversity\u201d."
  },
  "agenda_items": [
    "Item 19"
  ],
  "symbol_references": []
}