{
  "symbol": "A/RES/73/243",
  "filename": "A_RES_73_243.pdf",
  "title": "73/243. Follow-up to the second United Nations Conference on Landlocked Developing Countries",
  "text": "United Nations \nA/RES/73/243 \n \n \nGeneral Assembly \nDistr.: General \n24 January 2019 \n \n18-22621 (E)    280119     \n*1822621* \n \n \nSeventy-third session \nAgenda item 23 (b) \n \n \n \n \n Resolution adopted by the General Assembly \non 20 December 2018 \n \n \n \n \n[on the report of the Second Committee (A/73/541/Add.2)] \n \n \n 73/243. Follow-up to the second United Nations Conference on Landlocked \nDeveloping Countries \n \n \n \nThe General Assembly, \n \nRecalling the Vienna Declaration and the Vienna Programme of Action for \nLandlocked Developing Countries for the Decade 2014\u20132024, adopted at the second \nUnited Nations Conference on Landlocked Developing Countries, held in Vienna \nfrom 3 to 5 November 2014, 1 at which all relevant stakeholders expressed their \ncommitment to the implementation of the Programme of Action, \n \nReaffirming the overarching goal of the Vienna Programme of Action of \naddressing the special development needs and challenges of landlocked developing \ncountries arising from their landlockedness, remoteness and geographical constraints \nin a more coherent manner and thus contributing to an enhanced rate of sustainable \nand inclusive growth, which can contribute to the eradication of poverty in all its \nforms and dimensions, including extreme poverty, \n \nRecalling its resolutions 71/239 of 21 December 2016 and 72/232 of \n20 December 2017, \n \nReaffirming its resolution 70/1 of 25 September 2015, entitled \u201cTransforming \nour world: the 2030 Agenda for Sustainable Development\u201d, in which it adopted a \ncomprehensive, far-reaching and people-centred set of universal and transformative \nSustainable Development Goals and targets, its commitment to working tirelessly for \nthe full implementation of the Agenda by 2030, its recognition that eradicating \npoverty in all its forms and dimensions, including extreme poverty, is the greatest \nglobal challenge and an indispensable requirement for sustainable development, its \ncommitment to achieving sustainable development in its three dimensions \u2014 \neconomic, social and environmental \u2014 in a balanced and integrated manner, and to \n__________________ \n \n1  Resolution 69/137, annexes I and II. \n\nA/RES/73/243 \nFollow-up to the second United Nations Conference\non Landlocked Developing Countries\n \n18-22621\n2/11 \n \nbuilding upon the achievements of the Millennium Development Goals and seeking \nto address their unfinished business, \n \nReaffirming also its resolution 69/313 of 27 July 2015 on the Addis Ababa \nAction Agenda of the Third International Conference on Financing for Development, \nwhich is an integral part of the 2030 Agenda for Sustainable Development, supports \nand complements it, helps to contextualize its means of implementation targets with \nconcrete policies and actions, and reaffirms the strong political commitment to \naddress the challenge of financing and creating an enabling environment at all levels \nfor sustainable development in the spirit of global partnership and solidarity, \n \nWelcoming the Paris Agreement2 and its early entry into force, encouraging all \nits parties to fully implement the Agreement, and parties to the United Nations \nFramework Convention on Climate Change3 that have not yet done so to deposit their \ninstruments of ratification, acceptance, approval or accession, where appropriate, as \nsoon as possible, \n \nRecalling the Sendai Declaration and the Sendai Framework for Disaster Risk \nReduction 2015\u20132030,4 while recognizing that landlocked developing countries face \nsome specific disaster risk challenges, and reiterating the commitment to addressing \ndisaster risk reduction and building resilience to disasters within the context of \nsustainable development and poverty eradication, \n \nReaffirming the New Urban Agenda,5 adopted at the United Nations Conference \non Housing and Sustainable Urban Development (Habitat III), held in Quito from \n17 to 20 October 2016, and recognizing the importance of sustainable urban \ndevelopment for landlocked developing countries, \n \nWelcoming the holding of the 2018 Global Infrastructure Forum, in Bali, \nIndonesia, on 13 October 2018, on the theme \u201cUnlocking inclusive, resilient and \nsustainable technology-driven infrastructure\u201d, and taking note of its outcome, \n \nTaking note of the transport infrastructure gap in landlocked developing \ncountries and the need to bring the level of transport infrastructure up to global \nstandards, and in this regard the crucial importance of strong national and \ninternational partnerships to bridging the gap, \n \nRecognizing the specific needs and special circumstances of developing country \nparties, especially those that are particularly vulnerable to the adverse effects of \nclimate change, as provided for in the United Nations Framework Convention on \nClimate Change, \n \nReaffirming its resolution 71/243 of 21 December 2016 on the quadrennial \ncomprehensive policy review of operational activities for development of the United \nNations system and its general guidelines and principles, as well as its resolution \n72/279 of 31 May 2018, and welcoming the ongoing efforts of the Secretary-General \nto better position the operational activities for development of the United Nations \nsystem to support countries in their efforts to implement the 2030 Agenda for \nSustainable Development, \n \nRecognizing that the lack of territorial access to the sea, aggravated by \nremoteness from world markets and high transit costs and risks, continues to impose \nserious constraints on export earnings, private capital inflow and the domestic \n__________________ \n \n2 Adopted under the UNFCCC in FCCC/CP/2015/10/Add.1, decision 1/CP.21. \n \n3 United Nations, Treaty Series, vol. 1771, No. 30822. \n \n4 Resolution 69/283, annexes I and II. \n \n5 Resolution 71/256, annex. \n\nFollow-up to the second United Nations Conference \non Landlocked Developing Countries \nA/RES/73/243\n \n3/11\n18-22621 \n \nresource mobilization of landlocked developing countries and therefore adversely \naffects their overall growth and socioeconomic development, \n \nRecalling the Almaty Declaration 6  and the Almaty Programme of Action: \nAddressing the Special Needs of Landlocked Developing Countries within a New \nGlobal Framework for Transit Transport Cooperation for Landlocked and Transit \nDeveloping Countries,7 the first programme of action for the landlocked developing \ncountries, \n \nAcknowledging the importance of promoting collaboration between landlocked \ndeveloping countries and transit countries on the basis of common interest, and noting \nthat collaboration efforts need to be supported by an enabling international economic \nenvironment, taking into account different national realities, capacities and levels of \ndevelopment and respecting national priorities, while remaining consistent with \ninternational rules and commitments, \n \nRecognizing the need to promote both public and private investment in energy \ninfrastructure and clean energy technologies, taking into account the special \nvulnerabilities and needs of landlocked developing countries, \n \nTaking note of the Astana Ministerial Declaration, adopted at the Ministerial \nMeeting of Landlocked Developing Countries on Trade and Transport, held in Astana \non 16 and 17 May 2018, in the context of the midterm review of the Vienna \nProgramme of Action, \n \nAcknowledging the need to promote meaningful regional integration to \nencompass cooperation among countries and the importance of enhancing existing \ntransport infrastructure facilities for the implementation of the Vienna Programme of \nAction, \n \nReaffirming that achieving food security and improving nutrition, ensuring \nhealthy lives and promoting well-being for all, achieving inclusive and equitable \nquality education, achieving gender equality and empowering all women and girls, as \nwell as ensuring the availability and sustainable management of water and sanitation \nfor all, are important for achieving sustainable development, in line with the 2030 \nAgenda for Sustainable Development, \n \nTaking note of the declaration of the annual ministerial meeting of Landlocked \nDeveloping Countries, held at United Nations Headquarters on 28 September 2018 \non the theme \u201cRevitalizing partnerships to enhance the implementation of the Vienna \nProgramme of Action and the 2030 Agenda for Sustainable Development\u201d, \n \nRecognizing that the Vienna Programme of Action, which is integral to the 2030 \nAgenda for Sustainable Development, is based on renewed and strengthened \npartnerships for accompanying landlocked developing countries in harnessing \nbenefits from international trade, structurally transforming their economies and \nachieving more inclusive and sustainable growth, \n \nTaking note of the Livingstone Call for Action for the Accelerated \nImplementation of the Vienna Programme of Action, adopted at the high-level follow \nup meeting to the second United Nations Conference on Landlocked Developing \nCountries, held in Livingstone, Zambia, in June 2015, \n__________________ \n \n6 Report of the International Ministerial Conference of Landlocked and Transit Developing \nCountries and Donor Countries and International Financial and Development Institutions on \nTransit Transport Cooperation, Almaty, Kazakhstan, 28 and 29 August 2003 (A/CONF.202/3), \nannex II. \n \n7 Ibid., annex I. \n\nA/RES/73/243 \nFollow-up to the second United Nations Conference\non Landlocked Developing Countries\n \n18-22621\n4/11 \n \n \n1. \nTakes note of the report of the Secretary-General on the implementation of \nthe Vienna Programme of Action for Landlocked Developing Countries for the \nDecade 2014\u20132024;8 \n \n2. \nWelcomes the recognition of the special needs and challenges of \nlandlocked developing countries in the 2030 Agenda for Sustainable Development 9 \nand in the Addis Ababa Action Agenda of the Third International Conference on \nFinancing for Development, 10  and affirms that their effective implementation, \ntogether with the implementation of the six priority areas of the Vienna Programme \nof Action for Landlocked Developing Countries for the Decade 2014\u20132024,11 can \ndrive the social and economic progress of landlocked developing countries and assist \nin their transformation from landlocked to land-linked countries; \n \n3. \nRecalls paragraph 11 of its resolution 67/290 of 9 July 2013, and stresses \nthat the concerns and specific challenges of landlocked developing countries should \nbe given consideration, as appropriate, in the implementation, follow-up and review \nprocess of the 2030 Agenda for Sustainable Development; \n \n4. \nRecognizes that landlocked developing countries face specific challenges \nin their efforts towards the eradication of poverty in all its forms and dimensions, \nincluding extreme poverty, and the pursuit of sustainable development, and in this \nregard underlines the importance of continued international support to complement \nthe efforts of landlocked developing countries; \n \n5. \nAlso recognizes that efforts will need to be scaled up and sustained in order \nto eradicate extreme poverty by 2030 in landlocked developing countries; \n \n6. \nInvites the landlocked developing countries, transit countries, their \ndevelopment partners, the United Nations system and all other actors to implement \nthe relevant actions, consistent with national priorities, agreed upon in the Vienna \nProgramme of Action in its six priority areas in a coordinated, coherent and \nexpeditious manner; \n \n7. \nReiterates its invitation to development partners to provide targeted \ntechnical and financial support, as appropriate, towards the implementation of the \nspecific actions listed in the Vienna Programme of Action; \n \n8. \nInvites Member States that have not yet done so to mainstream the Vienna \nProgramme of Action into their national and sectoral development strategies in order \nto ensure its effective implementation, and encourages development partners, the \nUnited Nations system and the relevant international and regional organizations to \ncontinue to provide technical support, within their respective mandates, to the \nlandlocked developing countries in their efforts to mainstream the Vienna Programme \nof Action and the 2030 Agenda for Sustainable Development into their national \ndevelopment strategies; \n \n9. \nEncourages landlocked developing countries that have not yet done so to \nmainstream the 2030 Agenda for Sustainable Development into their national \ndevelopment planning and foster coherence in its implementation with the Vienna \nProgramme of Action; \n \n10. Stresses that the harmonization, simplification and standardization of rules \nand documentation should be promoted, including the full and effective \nimplementation of international conventions on transport and transit and bilateral, \nsubregional and regional agreements, and invites Member States that have not joined \n__________________ \n \n8 A/73/297. \n \n9 Resolution 70/1. \n \n10 Resolution 69/313, annex. \n \n11 Resolution 69/137, annex II. \n\nFollow-up to the second United Nations Conference \non Landlocked Developing Countries \nA/RES/73/243\n \n5/11\n18-22621 \n \nthe existing conventions to consider the possibility of accession, stresses also that \ncooperation on fundamental transit policies, laws and regulations between landlocked \ndeveloping countries and their transit neighbours is crucial for the effective and \nintegrated solution of cross-border trade and transit transport problems, and \nunderlines that this cooperation should be promoted on the basis of the mutual \ninterests of both landlocked developing countries and transit countries; \n \n11. Recognizes the importance of addressing the special needs of landlocked \ndeveloping countries, inter alia, by establishing and promoting efficient transit \ntransport systems, including roads, railroads and inland waterways, that link \nlandlocked developing countries to international markets, reaffirms that the Vienna \nProgramme of Action constitutes a fundamental framework for genuine partnerships \nbetween landlocked and transit developing countries and their development partners \nat the national, bilateral, subregional, regional and global levels, and in this regard \nhighlights the need to establish secure, reliable, efficient, high-quality, sustainable \nand resilient infrastructure, including transit transport systems, renewable energy and \ninformation and communications technology, with the support of development \npartners, multilateral financial and development institutions and regional banks; \n \n12. Notes that, despite the continued growth of air passenger and freight \ntransport, landlocked developing countries are still faced with low volumes of freight \ntransported by air, and stresses that air transport is particularly important, as it \nprovides landlocked developing countries with direct access to international markets; \n \n13. Invites landlocked developing countries and transit countries to consider \nratifying, as appropriate, relevant international trade and transport facilitation \nconventions;12 \n \n14. Underlines that infrastructure development plays a key role in reducing \nthe cost of development for landlocked developing countries and that the development \nand maintenance of transit transport infrastructure, information and communications \ntechnology and energy infrastructure are crucial for landlocked developing countries \nin order to reduce high trading costs, improve their competitiveness and become fully \nintegrated into the global market; \n \n15. Stresses that the magnitude of the resources required to invest in \ninfrastructure development and maintenance remains a major challenge and requires \nthe forging of international, regional, subregional and bilateral cooperation on \ninfrastructure projects, the allocation of more resources from national budgets, the \neffective deployment of international development assistance and multilateral \nfinancing in the development and maintenance of infrastructure and strengthening of \nthe role of the private sector, and recognizes that both public and private investment \nhave key roles to play in infrastructure financing, including through development \nbanks, development finance institutions and tools and mechanisms such as public-\nprivate partnerships, blended finance, which combines concessional public finance, \nnon-concessional private finance and expertise from the public and private sector, \nspecial purpose vehicles, non-recourse project financing, risk mitigation instruments \nand pooled funding structures; \n \n16. Calls upon the landlocked developing countries and transit countries, in a \ncoordinated manner, to develop and upgrade international transport and transit \n__________________ \n \n12 Including the Customs Convention on Containers (Geneva, 2 December 1972), the Customs \nConvention on the Temporary Importation of Commercial Road Vehicles (Geneva, 18 May \n1956), the Customs Convention on the International Transport of Goods under Cover of TIR \nCarnets (Geneva, 14 November 1975), the International Convention on the Harmonization of \nFrontier Controls of Goods (Geneva, 21 October 1982) and the World Trade Organization \nAgreement on Trade Facilitation (2013). \n\nA/RES/73/243 \nFollow-up to the second United Nations Conference\non Landlocked Developing Countries\n \n18-22621\n6/11 \n \ncorridors encompassing all modes of transportation, such as inland waterways, roads, \nrail networks, ports and pipelines, in order to address the special development needs \nand challenges of landlocked developing countries; \n \n17. Underlines the significance of international transport corridors for \nreducing trade costs and promoting regional sustainable development, recognizes that \njoint regional efforts to reduce transit time through corridor facilitation contribute to \nimproving export competitiveness and attracting more business to landlocked \ndeveloping countries, and invites the international community to provide, within \nexisting resources, support in this regard; \n \n18. Acknowledges that impediments to private investment in infrastructure \nexist on both the supply and the demand side and that insufficient investment is due \nin part to inadequate infrastructure plans and an insufficient number of well-prepared \ninvestable projects, along with private sector incentive structures that are not \nnecessarily appropriate for investing in many long-term projects and risk perceptions \nof investors, encourages landlocked developing countries to embed resilient and \nquality infrastructure investment plans into their national sustainable development \nstrategies, while also strengthening their domestic enabling environments, and calls \nupon the international community to provide technical support to landlocked \ndeveloping countries to translate plans into concrete project pipelines, as well as \nsupport for individual implementable projects, including for feasibility studies, the \nnegotiation of complex contracts and project management; \n \n19. Encourages multilateral development banks, including regional banks, in \ncollaboration with other stakeholders, to address gaps in trade, transport and transit-\nrelated regional infrastructure, including by completing missing links connecting, \ninter alia, landlocked developing countries within regional networks; \n \n20. Invites the multilateral financial and development institutions to consider \nhow they can best support landlocked developing countries with infrastructure \ndevelopment, including through project financing, planning for operations and \nmaintenance, technical and regulatory advice and project preparation; \n \n21. Stresses the importance of universal access to affordable, reliable, \nsustainable and modern energy services and the need for accelerating sustainable \nenergy for all in landlocked developing countries, including through innovative \npartnerships; \n \n22. Underlines that greater integration of landlocked developing countries into \nworld trade and global as well as regional value chains is vital for increasing their \ncompetitiveness and diversification and ensuring their economic development, and \ninvites the United Nations Conference on Trade and Development, the United Nations \nIndustrial Development Organization, the United Nations Development Programme, \nthe Office of the High Representative for the Least Developed Countries, Landlocked \nDeveloping Countries and Small Island Developing States to provide assistance, \nwithin existing resources, to landlocked developing countries to strengthen their \ncapacity to participate in regional and global value chains; \n \n23. Recognizes that services sectors are important enablers of trade in goods \nand effective participation in international trade and global value chains, that efficient \nservices sectors enhance productivity, reduce the cost of doing business and promote \njob creation and that landlocked developing countries should be supported so as to \nincrease the share of services in their economies and exports, including through \nenabling policies; \n \n24. Stresses that improved trade facilitation, including through further \nstreamlining and harmonization of customs and transit procedures and formalities and \ntransparent and efficient border management and coordination of agencies involved \n\nFollow-up to the second United Nations Conference \non Landlocked Developing Countries \nA/RES/73/243\n \n7/11\n18-22621 \n \nin border clearance, would help landlocked developing countries to enhance the \ncompetitiveness of their export products and services; \n \n25. Recognizes the importance of the World Trade Organization Agreement on \nTrade Facilitation in addressing high trade and transit costs, and in this regard calls \nfor its full and timely implementation by all members of the World Trade \nOrganization, calls upon those members that have not yet done so to deposit their \ninstrument of acceptance, where appropriate, as soon as possible, and in this regard \nurges members and relevant international and regional organizations to continue to \nprovide and enhance technical and capacity-building assistance, particularly for the \neffective implementation of the provisions of articles on the release and clearance of \ngoods, border agency cooperation, formalities connected with importation, \nexportation and transit, freedom of transit and customs cooperation, which are very \nrelevant for landlocked developing countries; \n \n26. Also recognizes that the growth in e-commerce provides international \ntrade opportunities for landlocked developing countries, including new market \nopportunities, and encourages development partners to consider assisting landlocked \ndeveloping countries in developing information and communications technology \ninfrastructure and helping to ensure that appropriate policies and legal and regulatory \nframeworks are in place to support the development of information and \ncommunications technology and close the digital divide; \n \n27. Stresses the need to promote meaningful regional integration to encompass \ncooperation among countries in a broader range of areas than just trade and trade \nfacilitation, including investment, research and development and policies aimed at \naccelerating regional industrial development and regional connectivity, that this \napproach is aimed at fostering structural change and economic growth in landlocked \ndeveloping countries as a goal, and also as a means of collectively linking regions to \nglobal markets, that this would enhance competitiveness and help to maximize \nbenefits from globalization and that documentation and the sharing and dissemination \nof best practices are important to allow cooperating partners to benefit from each \nother\u2019s experience; \n \n28. Recognizes that the economies of many landlocked developing countries \nare still reliant on a few export commodities, which often have low value addition, \nstresses the need for renewed and strengthened partnerships for development to \nsupport landlocked developing countries in diversifying their economic base and \nenhancing value addition to their exports by entering and moving up global value \nchains through the development of their productive capacities, including through \nprivate sector involvement, and the development of small and medium-sized \nenterprises, with a view to increasing the competitiveness of the products of \nlandlocked developing countries in export markets, and welcomes the establishment \nof the Technology Facilitation Mechanism in the Addis Ababa Action Agenda; \n \n29. Underlines that, in order for landlocked developing countries to fully \nutilize their export and trade potential, it is important to undertake measures, \nconsistent with relevant international rules and obligations, that promote structural \neconomic transformation capable of reducing the negative impact of their \ngeographical disadvantages and external shocks, creating jobs and ultimately leading \nto the eradication of poverty in all its forms and dimensions and inclusive and \nsustainable growth and development, stresses that each landlocked developing \ncountry has primary responsibility for its own economic and social development and \nthat the role of national policies and development strategies cannot be \noveremphasized, and in this regard stresses that the national development efforts of \nlandlocked developing countries need to be supported by an enabling international \neconomic environment; \n\nA/RES/73/243 \nFollow-up to the second United Nations Conference\non Landlocked Developing Countries\n \n18-22621\n8/11 \n \n \n30. Emphasizes that infrastructure, industry and innovation are strongly \nconnected, share the common goal of achieving inclusive and sustainable economic \ndevelopment and contribute to poverty eradication, and recognizes that inclusive and \nsustainable industrialization that provides open and equal social and economic \nopportunities for all, including women and girls, is integral to the structural \ntransformation of the economies of all countries, including the landlocked developing \ncountries; \n \n31. Recognizes that landlocked developing countries remain highly vulnerable \nto external economic shocks and to the multiple other challenges faced by the \ninternational community; \n \n32. Also recognizes that landlocked developing countries are vulnerable to and \nremain negatively affected by the adverse impacts of climate change, land \ndegradation, desertification, deforestation, floods, including glacial lake outburst \nfloods, and droughts, recognizes the potential benefits of mutually addressing these \nchallenges, and calls upon the international community to continue to support the \nefforts of landlocked developing countries to address these challenges in an integrated \nmanner, as appropriate; \n \n33. Underlines that South-South and triangular cooperation are vital to the \nlandlocked developing countries, especially in the areas of productive capacity-\nbuilding, infrastructure, energy, science and technology, trade, investment and transit \ntransport cooperation, and in this regard highlights the importance of the second \nHigh-level United Nations Conference on South-South Cooperation in addressing the \nneeds of countries in special situations; \n \n34. Notes with appreciation the inauguration of the International Think Tank \nfor Landlocked Developing Countries as the first-ever intergovernmental entity of the \nlandlocked developing countries, invites the International Think Tank to continue to \nundertake its role of supporting the development efforts of the landlocked developing \ncountries, urges those landlocked developing countries that have not yet done so to \nratify, at their earliest convenience, the Multilateral Agreement for the Establishment \nof an International Think Tank for Landlocked Developing Countries, and invites \nrelevant stakeholders to support the International Think Tank; \n \n35. Recognizes that landlocked developing countries and their transit country \nneighbours need to effectively mobilize adequate domestic and external resources for \nthe effective implementation of the Vienna Programme of Action, reaffirms that, for \nall countries, public policies and the mobilization and effective use of domestic \nresources, underlined by the principle of national ownership, are central to the \ncommon pursuit of sustainable development, including the implementation of the \nProgramme of Action, and also recognizes that international public finance plays an \nimportant role in complementing those efforts, especially in the poorest and most \nvulnerable countries with limited domestic resources; \n \n36. Underlines the prominent role that foreign direct investment plays in \naccelerating development and poverty reduction through employment, the transfer of \nmanagerial and technological know-how, on mutually agreed terms, and non-debt-\ncreating flows of capital, recognizes the considerable role and potential of private \nsector involvement in infrastructure development for transport, telecommunications \nand utilities for landlocked developing countries, encourages Member States to \nfacilitate foreign direct investment flows to landlocked developing countries in this \nregard, and calls upon landlocked and transit developing countries to promote an \nenabling environment to attract foreign direct investment and private sector \ninvolvement; \n\nFollow-up to the second United Nations Conference \non Landlocked Developing Countries \nA/RES/73/243\n \n9/11\n18-22621 \n \n \n37. Reiterates that the fulfilment of all official development assistance \ncommitments remains crucial, with providers of official development assistance \nreaffirming their respective commitments; \n \n38. Recognizes the essential role of the private sector in the development of \nlandlocked developing countries, and in this regard underlines the need to continue \npromoting the participation of the private sector in achieving sustainable development \nand the critical importance of mobilizing private resources, including through foreign \ndirect investment, for the development of landlocked developing countries, taking \ninto account the leading role of Member States in the implementation of the 2030 \nAgenda for Sustainable Development, the Addis Ababa Action Agenda and the Vienna \nProgramme of Action; \n \n39. Invites developing countries, guided by the spirit of solidarity and \nconsistent with their capabilities, to provide support for the effective implementation \nof the Vienna Programme of Action in mutually agreed areas of cooperation, within \nthe framework of South-South cooperation, which is a complement to, but not a \nsubstitute for, North-South cooperation; \n \n40. Invites development partners to effectively implement the Aid for Trade \ninitiative in assisting landlocked developing countries to address their special needs \nand requirements, including capacity-building for the formulation of trade policies, \nparticipation in trade negotiations and the implementation of trade facilitation \nmeasures, as well as the diversification of export products; \n \n41. Calls upon relevant organizations and bodies of the United Nations \nsystem, and invites international organizations and relevant regional and subregional \norganizations, to integrate the Vienna Programme of Action into their programmes of \nwork, as appropriate, within their respective mandates, and to support landlocked and \ntransit developing countries in their implementation of the Programme of Action in a \nwell-coordinated and coherent manner; \n \n42. Underlines the importance of increasing the availability and use of high-\nquality, timely and reliable data disaggregated by sex, age, geography, income, race, \nethnicity, migratory status, disability and other characteristics relevant in national \ncontexts, stresses the need to enhance capacity-building support for developing \ncountries, including landlocked developing countries, for this purpose, and reaffirms \nthe commitment to strengthen the capacity of national statistical offices and data \nsystems to ensure access to high-quality, timely, reliable and disaggregated data; \n \n43. Recognizes that it is important for all countries, including landlocked \ndeveloping countries, to commit to a world in which all women and girls enjoy full \ngender equality with men and boys and all legal, social and economic barriers to their \nempowerment and equality have been removed; \n \n44. Reaffirms its resolution 71/243 on the quadrennial comprehensive policy \nreview of operational activities for development of the United Nations development \nsystem, in which it urged the United Nations development system to enhance its \nsupport for, inter alia, the implementation of the Vienna Programme of Action, and \ncalls upon the entities of the United Nations development system to integrate and \nmainstream it fully into their operational activities for development; \n \n45. Also reaffirms its resolution 72/279 on the repositioning of the United \nNations development system, in which it agreed on reforms to improve the United \nNations system collective support to countries as they implement the 2030 Agenda \nfor Sustainable Development; \n \n46. Urges that coherent and effective linkages be made between the \nimplementation, follow-up and review arrangements for the 2030 Agenda for \n\nA/RES/73/243 \nFollow-up to the second United Nations Conference\non Landlocked Developing Countries\n \n18-22621\n10/11 \n \nSustainable Development and those of all relevant United Nations conferences and \nprocesses, including the Vienna Programme of Action; \n \n47. Underlines the importance of the successful implementation of, follow-up \nto and review of the Vienna Programme of Action at the national, subregional, \nregional and global levels; \n \n48. Stresses that, in accordance with the mandate given by the General \nAssembly, the Office of the High Representative for the Least Developed Countries, \nLandlocked Developing Countries and Small Island Developing States should \ncontinue to ensure the coordinated follow-up to, effective monitoring of and reporting \non the implementation of the Vienna Programme of Action and undertake advocacy \nefforts at the national, regional and global levels; \n \n49. Reaffirms its decision, in its resolution 72/232, to convene, as called for in \nparagraph 78 of the Vienna Programme of Action, a comprehensive high-level \nmidterm review on the implementation of the Vienna Programme of Action for the \nDecade 2014\u20132024, to be held no later than December 2019, that the Office of the \nHigh Representative shall coordinate the preparatory process, that all relevant United \nNations system organizations, including the United Nations Conference on Trade and \nDevelopment, the United Nations Development Programme, the regional \ncommissions and other relevant organizations, within their respective mandates and \nwithin existing resources, shall be invited to provide support to the review process, \nthat the high-level midterm review shall be preceded by regional preparatory \nmeetings, as appropriate and within existing resources, that the high-level midterm \nreview shall adopt an intergovernmentally negotiated and agreed outcome in the form \nof a political declaration, that the midterm review and its preparation shall be \nconducted within existing resources and that all costs relating to the midterm review \nand its preparation shall be financed through voluntary contributions; \n \n50. Also reaffirms that the comprehensive high-level midterm review shall \nreview progress made by the landlocked developing countries, transit countries and \ndevelopment partners in the implementation of the Vienna Programme of Action and \nshall be a forum for sharing best practices and lessons learned and identifying \nobstacles and constraints encountered and actions and initiatives needed to overcome \nthem, as well as new challenges and emerging issues, in order to further accelerate \nthe implementation of the Vienna Programme of Action; \n \n51. Decides to hold no more than two days of high-level plenary meetings of \nthe General Assembly devoted to the midterm review in early December 2019, to be \nchaired by the President of the Assembly; \n \n52. Also decides to invite the President of the General Assembly to chair the \nhigh-level midterm review, requests the President of the Assembly to convene \ninformal consultations, as required, and in the most efficient and effective manner, to \nfinalize its outstanding organizational arrangements, including the dates, and to \nfacilitate the preparation of an outcome document for the midterm review, and in this \nregard welcomes the appointment by the President of the General Assembly of co \nfacilitators to lead the informal consultations; \n \n53. Requests the Office of the High Representative, in close consultation with \nthe relevant United Nations system organizations, to prepare a draft outline of the \noutcome document of the midterm review so as to facilitate the intergovernmental \nconsultations, taking into account the outcomes of the regional meetings and the \nreports of the Secretary-General on the progress made in the implementation of the \nVienna Programme of Action; \n \n54. Encourages all Member States, in particular landlocked and transit \ndeveloping countries and donor countries, as well as the United Nations system and \n\nFollow-up to the second United Nations Conference \non Landlocked Developing Countries \nA/RES/73/243\n \n11/11\n18-22621 \n \ninternational and regional organizations, to participate actively in the midterm review \nat the highest possible level, and reiterates the critical importance of the full and \neffective participation of the landlocked developing countries in the high-level \nmidterm review process; \n \n55. Stresses the importance of the effective participation of all relevant \nstakeholders, including civil society and the private sector, in the high-level midterm \nreview and its preparatory process; \n \n56. Decides that the high-level midterm review and its preparatory process \nshall be open to participation by all States Members of the United Nations and \nmembers of the specialized agencies and observers in the General Assembly; \n \n57. Emphasizes the importance of country-level preparations as a critical input \nto the preparatory process for the high-level midterm review and to the \nimplementation of and follow-up to its outcome, and in this context calls upon the \nlandlocked developing countries to undertake their national reviews on the \nimplementation of the Vienna Programme of Action, with a particular focus on \nprogress, obstacles, constraints, actions and measures necessary to further its \nimplementation, in close collaboration with the Office of the High Representative; \n \n58. Strongly encourages Governments, intergovernmental and non-governmental \norganizations, major groups and other donors to contribute in a timely manner to the \ntrust fund in support of activities undertaken by the Office of the High Representative \nto support the implementation of, follow-up to and monitoring of the Vienna \nProgramme of Action, including the preparations for and organization of the high-\nlevel midterm review of the implementation of the Vienna Programme of Action; \n \n59. Requests the Secretary-General to submit to the General Assembly at its \nseventy-fourth session a progress report on the implementation of the Vienna \nProgramme of Action for its high-level midterm review, and decides to include in the \nprovisional agenda of its seventy-fourth session, under the item entitled \u201cGroups of \ncountries in special situations\u201d, the sub-item entitled \u201cFollow-up to the second United \nNations Conference on Landlocked Developing Countries\u201d, unless otherwise agreed. \n \n62nd plenary meeting  \n20 December 2018 \n \n",
  "paragraphs": {
    "1": "Takes note of the report of the Secretary-General on the implementation of the Vienna Programme of Action for Landlocked Developing Countries for the Decade 2014\u20132024;8",
    "2": "Welcomes the recognition of the special needs and challenges of landlocked developing countries in the 2030 Agenda for Sustainable Development 9 and in the Addis Ababa Action Agenda of the Third International Conference on Financing for Development, 10 and affirms that their effective implementation, together with the implementation of the six priority areas of the Vienna Programme of Action for Landlocked Developing Countries for the Decade 2014\u20132024,11 can drive the social and economic progress of landlocked developing countries and assist in their transformation from landlocked to land-linked countries;",
    "3": "Recalls paragraph 11 of its resolution 67/290 of 9 July 2013, and stresses that the concerns and specific challenges of landlocked developing countries should be given consideration, as appropriate, in the implementation, follow-up and review process of the 2030 Agenda for Sustainable Development;",
    "4": "Recognizes that landlocked developing countries face specific challenges in their efforts towards the eradication of poverty in all its forms and dimensions, including extreme poverty, and the pursuit of sustainable development, and in this regard underlines the importance of continued international support to complement the efforts of landlocked developing countries;",
    "5": "Also recognizes that efforts will need to be scaled up and sustained in order to eradicate extreme poverty by 2030 in landlocked developing countries;",
    "6": "Invites the landlocked developing countries, transit countries, their development partners, the United Nations system and all other actors to implement the relevant actions, consistent with national priorities, agreed upon in the Vienna Programme of Action in its six priority areas in a coordinated, coherent and expeditious manner;",
    "7": "Reiterates its invitation to development partners to provide targeted technical and financial support, as appropriate, towards the implementation of the specific actions listed in the Vienna Programme of Action;",
    "8": "Invites Member States that have not yet done so to mainstream the Vienna Programme of Action into their national and sectoral development strategies in order to ensure its effective implementation, and encourages development partners, the United Nations system and the relevant international and regional organizations to continue to provide technical support, within their respective mandates, to the landlocked developing countries in their efforts to mainstream the Vienna Programme of Action and the 2030 Agenda for Sustainable Development into their national development strategies;",
    "9": "Encourages landlocked developing countries that have not yet done so to mainstream the 2030 Agenda for Sustainable Development into their national development planning and foster coherence in its implementation with the Vienna Programme of Action;",
    "10": "Stresses that the harmonization, simplification and standardization of rules and documentation should be promoted, including the full and effective implementation of international conventions on transport and transit and bilateral, subregional and regional agreements, and invites Member States that have not joined the existing conventions to consider the possibility of accession, stresses also that cooperation on fundamental transit policies, laws and regulations between landlocked developing countries and their transit neighbours is crucial for the effective and integrated solution of cross-border trade and transit transport problems, and underlines that this cooperation should be promoted on the basis of the mutual interests of both landlocked developing countries and transit countries;",
    "11": "Recognizes the importance of addressing the special needs of landlocked developing countries, inter alia, by establishing and promoting efficient transit transport systems, including roads, railroads and inland waterways, that link landlocked developing countries to international markets, reaffirms that the Vienna Programme of Action constitutes a fundamental framework for genuine partnerships between landlocked and transit developing countries and their development partners at the national, bilateral, subregional, regional and global levels, and in this regard highlights the need to establish secure, reliable, efficient, high-quality, sustainable and resilient infrastructure, including transit transport systems, renewable energy and information and communications technology, with the support of development partners, multilateral financial and development institutions and regional banks;",
    "12": "Notes that, despite the continued growth of air passenger and freight transport, landlocked developing countries are still faced with low volumes of freight transported by air, and stresses that air transport is particularly important, as it provides landlocked developing countries with direct access to international markets;",
    "13": "Invites landlocked developing countries and transit countries to consider ratifying, as appropriate, relevant international trade and transport facilitation conventions;12",
    "14": "Underlines that infrastructure development plays a key role in reducing the cost of development for landlocked developing countries and that the development and maintenance of transit transport infrastructure, information and communications technology and energy infrastructure are crucial for landlocked developing countries in order to reduce high trading costs, improve their competitiveness and become fully integrated into the global market;",
    "15": "Stresses that the magnitude of the resources required to invest in infrastructure development and maintenance remains a major challenge and requires the forging of international, regional, subregional and bilateral cooperation on infrastructure projects, the allocation of more resources from national budgets, the effective deployment of international development assistance and multilateral financing in the development and maintenance of infrastructure and strengthening of the role of the private sector, and recognizes that both public and private investment have key roles to play in infrastructure financing, including through development banks, development finance institutions and tools and mechanisms such as public- private partnerships, blended finance, which combines concessional public finance, non-concessional private finance and expertise from the public and private sector, special purpose vehicles, non-recourse project financing, risk mitigation instruments and pooled funding structures;",
    "16": "Calls upon the landlocked developing countries and transit countries, in a coordinated manner, to develop and upgrade international transport and transit corridors encompassing all modes of transportation, such as inland waterways, roads, rail networks, ports and pipelines, in order to address the special development needs and challenges of landlocked developing countries;",
    "17": "Underlines the significance of international transport corridors for reducing trade costs and promoting regional sustainable development, recognizes that joint regional efforts to reduce transit time through corridor facilitation contribute to improving export competitiveness and attracting more business to landlocked developing countries, and invites the international community to provide, within existing resources, support in this regard;",
    "18": "Acknowledges that impediments to private investment in infrastructure exist on both the supply and the demand side and that insufficient investment is due in part to inadequate infrastructure plans and an insufficient number of well-prepared investable projects, along with private sector incentive structures that are not necessarily appropriate for investing in many long-term projects and risk perceptions of investors, encourages landlocked developing countries to embed resilient and quality infrastructure investment plans into their national sustainable development strategies, while also strengthening their domestic enabling environments, and calls upon the international community to provide technical support to landlocked developing countries to translate plans into concrete project pipelines, as well as support for individual implementable projects, including for feasibility studies, the negotiation of complex contracts and project management;",
    "19": "Encourages multilateral development banks, including regional banks, in collaboration with other stakeholders, to address gaps in trade, transport and transit- related regional infrastructure, including by completing missing links connecting, inter alia, landlocked developing countries within regional networks;",
    "20": "Invites the multilateral financial and development institutions to consider how they can best support landlocked developing countries with infrastructure development, including through project financing, planning for operations and maintenance, technical and regulatory advice and project preparation;",
    "21": "Stresses the importance of universal access to affordable, reliable, sustainable and modern energy services and the need for accelerating sustainable energy for all in landlocked developing countries, including through innovative partnerships;",
    "22": "Underlines that greater integration of landlocked developing countries into world trade and global as well as regional value chains is vital for increasing their competitiveness and diversification and ensuring their economic development, and invites the United Nations Conference on Trade and Development, the United Nations Industrial Development Organization, the United Nations Development Programme, the Office of the High Representative for the Least Developed Countries, Landlocked Developing Countries and Small Island Developing States to provide assistance, within existing resources, to landlocked developing countries to strengthen their capacity to participate in regional and global value chains;",
    "23": "Recognizes that services sectors are important enablers of trade in goods and effective participation in international trade and global value chains, that efficient services sectors enhance productivity, reduce the cost of doing business and promote job creation and that landlocked developing countries should be supported so as to increase the share of services in their economies and exports, including through enabling policies;",
    "24": " in border clearance, would help landlocked developing countries to enhance the competitiveness of their export products and services;",
    "25": "Recognizes the importance of the World Trade Organization Agreement on Trade Facilitation in addressing high trade and transit costs, and in this regard calls for its full and timely implementation by all members of the World Trade Organization, calls upon those members that have not yet done so to deposit their instrument of acceptance, where appropriate, as soon as possible, and in this regard urges members and relevant international and regional organizations to continue to provide and enhance technical and capacity-building assistance, particularly for the effective implementation of the provisions of articles on the release and clearance of goods, border agency cooperation, formalities connected with importation, exportation and transit, freedom of transit and customs cooperation, which are very relevant for landlocked developing countries;",
    "26": "Also recognizes that the growth in e-commerce provides international trade opportunities for landlocked developing countries, including new market opportunities, and encourages development partners to consider assisting landlocked developing countries in developing information and communications technology infrastructure and helping to ensure that appropriate policies and legal and regulatory frameworks are in place to support the development of information and communications technology and close the digital divide;",
    "27": "Stresses the need to promote meaningful regional integration to encompass cooperation among countries in a broader range of areas than just trade and trade facilitation, including investment, research and development and policies aimed at accelerating regional industrial development and regional connectivity, that this approach is aimed at fostering structural change and economic growth in landlocked developing countries as a goal, and also as a means of collectively linking regions to global markets, that this would enhance competitiveness and help to maximize benefits from globalization and that documentation and the sharing and dissemination of best practices are important to allow cooperating partners to benefit from each other\u2019s experience;",
    "28": "Recognizes that the economies of many landlocked developing countries are still reliant on a few export commodities, which often have low value addition, stresses the need for renewed and strengthened partnerships for development to support landlocked developing countries in diversifying their economic base and enhancing value addition to their exports by entering and moving up global value chains through the development of their productive capacities, including through private sector involvement, and the development of small and medium-sized enterprises, with a view to increasing the competitiveness of the products of landlocked developing countries in export markets, and welcomes the establishment of the Technology Facilitation Mechanism in the Addis Ababa Action Agenda;",
    "29": "",
    "30": "Emphasizes that infrastructure, industry and innovation are strongly connected, share the common goal of achieving inclusive and sustainable economic development and contribute to poverty eradication, and recognizes that inclusive and sustainable industrialization that provides open and equal social and economic opportunities for all, including women and girls, is integral to the structural transformation of the economies of all countries, including the landlocked developing countries;",
    "31": "Recognizes that landlocked developing countries remain highly vulnerable to external economic shocks and to the multiple other challenges faced by the international community;",
    "32": "Also recognizes that landlocked developing countries are vulnerable to and remain negatively affected by the adverse impacts of climate change, land degradation, desertification, deforestation, floods, including glacial lake outburst floods, and droughts, recognizes the potential benefits of mutually addressing these challenges, and calls upon the international community to continue to support the efforts of landlocked developing countries to address these challenges in an integrated manner, as appropriate;",
    "33": "Underlines that South-South and triangular cooperation are vital to the landlocked developing countries, especially in the areas of productive capacity- building, infrastructure, energy, science and technology, trade, investment and transit transport cooperation, and in this regard highlights the importance of the second High-level United Nations Conference on South-South Cooperation in addressing the needs of countries in special situations;",
    "34": "Notes with appreciation the inauguration of the International Think Tank for Landlocked Developing Countries as the first-ever intergovernmental entity of the landlocked developing countries, invites the International Think Tank to continue to undertake its role of supporting the development efforts of the landlocked developing countries, urges those landlocked developing countries that have not yet done so to ratify, at their earliest convenience, the Multilateral Agreement for the Establishment of an International Think Tank for Landlocked Developing Countries, and invites relevant stakeholders to support the International Think Tank;",
    "35": "Recognizes that landlocked developing countries and their transit country neighbours need to effectively mobilize adequate domestic and external resources for the effective implementation of the Vienna Programme of Action, reaffirms that, for all countries, public policies and the mobilization and effective use of domestic resources, underlined by the principle of national ownership, are central to the common pursuit of sustainable development, including the implementation of the Programme of Action, and also recognizes that international public finance plays an important role in complementing those efforts, especially in the poorest and most vulnerable countries with limited domestic resources;",
    "36": "",
    "37": "Reiterates that the fulfilment of all official development assistance commitments remains crucial, with providers of official development assistance reaffirming their respective commitments;",
    "38": "Recognizes the essential role of the private sector in the development of landlocked developing countries, and in this regard underlines the need to continue promoting the participation of the private sector in achieving sustainable development and the critical importance of mobilizing private resources, including through foreign direct investment, for the development of landlocked developing countries, taking into account the leading role of Member States in the implementation of the 2030 Agenda for Sustainable Development, the Addis Ababa Action Agenda and the Vienna Programme of Action;",
    "39": "Invites developing countries, guided by the spirit of solidarity and consistent with their capabilities, to provide support for the effective implementation of the Vienna Programme of Action in mutually agreed areas of cooperation, within the framework of South-South cooperation, which is a complement to, but not a substitute for, North-South cooperation;",
    "40": "Invites development partners to effectively implement the Aid for Trade initiative in assisting landlocked developing countries to address their special needs and requirements, including capacity-building for the formulation of trade policies, participation in trade negotiations and the implementation of trade facilitation measures, as well as the diversification of export products;",
    "41": "Calls upon relevant organizations and bodies of the United Nations system, and invites international organizations and relevant regional and subregional organizations, to integrate the Vienna Programme of Action into their programmes of work, as appropriate, within their respective mandates, and to support landlocked and transit developing countries in their implementation of the Programme of Action in a well-coordinated and coherent manner;",
    "42": "Underlines the importance of increasing the availability and use of high- quality, timely and reliable data disaggregated by sex, age, geography, income, race, ethnicity, migratory status, disability and other characteristics relevant in national contexts, stresses the need to enhance capacity-building support for developing countries, including landlocked developing countries, for this purpose, and reaffirms the commitment to strengthen the capacity of national statistical offices and data systems to ensure access to high-quality, timely, reliable and disaggregated data;",
    "43": "Recognizes that it is important for all countries, including landlocked developing countries, to commit to a world in which all women and girls enjoy full gender equality with men and boys and all legal, social and economic barriers to their empowerment and equality have been removed;",
    "44": "Reaffirms its resolution 71/243 on the quadrennial comprehensive policy review of operational activities for development of the United Nations development system, in which it urged the United Nations development system to enhance its support for, inter alia, the implementation of the Vienna Programme of Action, and calls upon the entities of the United Nations development system to integrate and mainstream it fully into their operational activities for development;",
    "45": "Also reaffirms its resolution 72/279 on the repositioning of the United Nations development system, in which it agreed on reforms to improve the United Nations system collective support to countries as they implement the 2030 Agenda for Sustainable Development;",
    "46": " Sustainable Development and those of all relevant United Nations conferences and processes, including the Vienna Programme of Action;",
    "47": "Underlines the importance of the successful implementation of, follow-up to and review of the Vienna Programme of Action at the national, subregional, regional and global levels;",
    "48": "Stresses that, in accordance with the mandate given by the General Assembly, the Office of the High Representative for the Least Developed Countries, Landlocked Developing Countries and Small Island Developing States should continue to ensure the coordinated follow-up to, effective monitoring of and reporting on the implementation of the Vienna Programme of Action and undertake advocacy efforts at the national, regional and global levels;",
    "49": "Reaffirms its decision, in its resolution 72/232, to convene, as called for in paragraph 78 of the Vienna Programme of Action, a comprehensive high-level midterm review on the implementation of the Vienna Programme of Action for the Decade 2014\u20132024, to be held no later than December 2019, that the Office of the High Representative shall coordinate the preparatory process, that all relevant United Nations system organizations, including the United Nations Conference on Trade and Development, the United Nations Development Programme, the regional commissions and other relevant organizations, within their respective mandates and within existing resources, shall be invited to provide support to the review process, that the high-level midterm review shall be preceded by regional preparatory meetings, as appropriate and within existing resources, that the high-level midterm review shall adopt an intergovernmentally negotiated and agreed outcome in the form of a political declaration, that the midterm review and its preparation shall be conducted within existing resources and that all costs relating to the midterm review and its preparation shall be financed through voluntary contributions;",
    "50": "Also reaffirms that the comprehensive high-level midterm review shall review progress made by the landlocked developing countries, transit countries and development partners in the implementation of the Vienna Programme of Action and shall be a forum for sharing best practices and lessons learned and identifying obstacles and constraints encountered and actions and initiatives needed to overcome them, as well as new challenges and emerging issues, in order to further accelerate the implementation of the Vienna Programme of Action;",
    "51": "Decides to hold no more than two days of high-level plenary meetings of the General Assembly devoted to the midterm review in early December 2019, to be chaired by the President of the Assembly;",
    "52": "Also decides to invite the President of the General Assembly to chair the high-level midterm review, requests the President of the Assembly to convene informal consultations, as required, and in the most efficient and effective manner, to finalize its outstanding organizational arrangements, including the dates, and to facilitate the preparation of an outcome document for the midterm review, and in this regard welcomes the appointment by the President of the General Assembly of co facilitators to lead the informal consultations;",
    "53": "Requests the Office of the High Representative, in close consultation with the relevant United Nations system organizations, to prepare a draft outline of the outcome document of the midterm review so as to facilitate the intergovernmental consultations, taking into account the outcomes of the regional meetings and the reports of the Secretary-General on the progress made in the implementation of the Vienna Programme of Action;",
    "54": " international and regional organizations, to participate actively in the midterm review at the highest possible level, and reiterates the critical importance of the full and effective participation of the landlocked developing countries in the high-level midterm review process;",
    "55": "Stresses the importance of the effective participation of all relevant stakeholders, including civil society and the private sector, in the high-level midterm review and its preparatory process;",
    "56": "Decides that the high-level midterm review and its preparatory process shall be open to participation by all States Members of the United Nations and members of the specialized agencies and observers in the General Assembly;",
    "57": "Emphasizes the importance of country-level preparations as a critical input to the preparatory process for the high-level midterm review and to the implementation of and follow-up to its outcome, and in this context calls upon the landlocked developing countries to undertake their national reviews on the implementation of the Vienna Programme of Action, with a particular focus on progress, obstacles, constraints, actions and measures necessary to further its implementation, in close collaboration with the Office of the High Representative;",
    "58": "Strongly encourages Governments, intergovernmental and non-governmental organizations, major groups and other donors to contribute in a timely manner to the trust fund in support of activities undertaken by the Office of the High Representative to support the implementation of, follow-up to and monitoring of the Vienna Programme of Action, including the preparations for and organization of the high- level midterm review of the implementation of the Vienna Programme of Action;",
    "59": "Requests the Secretary-General to submit to the General Assembly at its seventy-fourth session a progress report on the implementation of the Vienna Programme of Action for its high-level midterm review, and decides to include in the provisional agenda of its seventy-fourth session, under the item entitled \u201cGroups of countries in special situations\u201d, the sub-item entitled \u201cFollow-up to the second United Nations Conference on Landlocked Developing Countries\u201d, unless otherwise agreed."
  },
  "agenda_items": [
    "Item 23"
  ],
  "symbol_references": []
}