{
  "symbol": "A/RES/79/299",
  "filename": "A_RES_79_299.pdf",
  "title": "79/299. Financing of the Regional Service Centre in Entebbe, Uganda",
  "text": "United Nations \nA/RES/79/299\n \n \nGeneral Assembly \nDistr.: General \n1 July 2025 \n \n25-10824 (E) \n*2510824* \n \n \nSeventy-ninth session \nAgenda item 155 \nAdministrative and budgetary aspects of the financing of \nthe United Nations peacekeeping operations \n \n \n \n \n Resolution adopted by the General Assembly \non 30 June 2025 \n \n \n \n \n[on the report of the Fifth Committee (A/79/925, para. 12)] \n \n \n 79/299. Financing of the Regional Service Centre in Entebbe, Uganda \n \n \n \nThe General Assembly, \n \nRecalling its resolutions 69/307 of 25 June 2015 concerning the financing of the \nRegional Service Centre in Entebbe, Uganda, and its subsequent resolutions thereon, \nthe latest of which was resolution 78/294 of 28 June 2024, \n \nHaving considered the reports of the Secretary-General on the financing of the \nRegional Service Centre 1  and the related report of the Advisory Committee on \nAdministrative and Budgetary Questions,2  \n \n1. \nReaffirms its resolutions 57/290 B of 18 June 2003, 59/296 of 22 June \n2005, 60/266 of 30 June 2006, 61/276 of 29 June 2007, 64/269 of 24 June 2010, \n65/289 of 30 June 2011, 66/264 of 21 June 2012, 69/307, 70/286 of 17 June 2016 and \n76/274 of 29 June 2022, and requests the Secretary-General to ensure the full \nimplementation of their relevant provisions; \n \n2. \nTakes note of the reports of the Secretary-General;  \n \n3. \nEndorses the conclusions and recommendations contained in the report of \nthe Advisory Committee on Administrative and Budgetary Questions, and requests \nthe Secretary-General to ensure their full implementation; \n \n4. \nAcknowledges the support of the Government of Uganda in facilitating the \nwork of the United Nations at the Regional Service Centre in Entebbe, Uganda; \n \n__________________ \n \n1  A/79/596 and A/79/751. \n \n2  A/79/724/Add.5. \n\nA/RES/79/299 \nFinancing of the Regional Service Centre in Entebbe, Uganda\n \n25-10824\n2/2 \n \n \n \nBudget performance report for the period from 1 July 2023 to 30 June 2024 \n \n \n5. \nTakes note of the report of the Secretary-General on the budget \nperformance of the Regional Service Centre for the period from 1 July 2023 to \n30 June 2024;3  \n \n \n \nBudget estimates for the period from 1 July 2025 to 30 June 2026 \n \n \n6. \nApproves the amount of 46,154,000 United States dollars for the \nmaintenance of the Regional Service Centre for the period from 1 July 2025 to \n30 June 2026; \n \n \n \nFinancing of the budget estimates for the period from 1 July 2025 to 30 June 2026 \n \n \n7. \nDecides that the requirements for the Regional Service Centre for the \nperiod from 1 July 2025 to 30 June 2026 shall be financed as follows: \n \n(a) \nThe unencumbered balance and other revenue in the amount of \n621,900 dollars in respect of the financial period ended 30 June 2024, to be applied \nagainst the resources required for the period from 1 July 2025 to 30 June 2026; \n \n(b) \nThe amount of 43,209,100 dollars, to be prorated among the budgets of \nthe active client peacekeeping operations for the period from 1 July 2025 to 30 June \n2026; \n \n(c) \nThe amount of 2,323,000 dollars, with respect to the share of client special \npolitical missions, to be funded under section 3, Political affairs, as may be approved \nby the General Assembly in the context of the proposed programme budget for 2026; \n \n(d) \nThe estimated staff assessment income of 5,247,400 dollars, comprising \nthe amount of 5,006,500 dollars for the period from 1 July 2025 to 30 June 2026 and \nthe increase of 240,900 dollars in respect of the period from 1 July 2023 to 30 June \n2024, to be offset against the balance referred to in subparagraph (b) above, to be \nprorated among the budgets of the individual active client peacekeeping operations; \n \n8. \nAlso decides to consider at its eightieth session the question of the \nfinancing of the Regional Service Centre.  \n \n81st plenary meeting \n30 June 2025 \n \n__________________ \n \n3  A/79/596. \n",
  "paragraphs": {
    "1": "Reaffirms its resolutions 57/290 B of 18 June 2003, 59/296 of 22 June 2005, 60/266 of 30 June 2006, 61/276 of 29 June 2007, 64/269 of 24 June 2010, 65/289 of 30 June 2011, 66/264 of 21 June 2012, 69/307, 70/286 of 17 June 2016 and 76/274 of 29 June 2022, and requests the Secretary-General to ensure the full implementation of their relevant provisions;",
    "2": "Takes note of the reports of the Secretary-General;",
    "3": "Endorses the conclusions and recommendations contained in the report of the Advisory Committee on Administrative and Budgetary Questions, and requests the Secretary-General to ensure their full implementation;",
    "4": "Acknowledges the support of the Government of Uganda in facilitating the work of the United Nations at the Regional Service Centre in Entebbe, Uganda; __________________ 1 A/79/596 and A/79/751. 2 A/79/724/Add.5. A/RES/79/299 Financing of the Regional Service Centre in Entebbe, Uganda 25-10824 2/2 Budget performance report for the period from 1 July 2023 to 30 June 2024",
    "5": "Takes note of the report of the Secretary-General on the budget performance of the Regional Service Centre for the period from 1 July 2023 to 30 June 2024;3 Budget estimates for the period from 1 July 2025 to 30 June 2026",
    "6": "Approves the amount of 46,154,000 United States dollars for the maintenance of the Regional Service Centre for the period from 1 July 2025 to 30 June 2026; Financing of the budget estimates for the period from 1 July 2025 to 30 June 2026",
    "7": "Decides that the requirements for the Regional Service Centre for the period from 1 July 2025 to 30 June 2026 shall be financed as follows: (a) The unencumbered balance and other revenue in the amount of 621,900 dollars in respect of the financial period ended 30 June 2024, to be applied against the resources required for the period from 1 July 2025 to 30 June 2026; (b) The amount of 43,209,100 dollars, to be prorated among the budgets of the active client peacekeeping operations for the period from 1 July 2025 to 30 June 2026; (c) The amount of 2,323,000 dollars, with respect to the share of client special political missions, to be funded under section 3, Political affairs, as may be approved by the General Assembly in the context of the proposed programme budget for 2026; (d) The estimated staff assessment income of 5,247,400 dollars, comprising the amount of 5,006,500 dollars for the period from 1 July 2025 to 30 June 2026 and the increase of 240,900 dollars in respect of the period from 1 July 2023 to 30 June 2024, to be offset against the balance referred to in subparagraph (b) above, to be prorated among the budgets of the individual active client peacekeeping operations;",
    "8": "Also decides to consider at its eightieth session the question of the financing of the Regional Service Centre. 81st plenary meeting 30 June 2025 __________________ 3 A/79/596."
  },
  "agenda_items": [
    "Item 155"
  ],
  "symbol_references": []
}