{
  "symbol": "A/RES/78/134",
  "filename": "A_RES_78_134.pdf",
  "title": "78/134. International trade and development",
  "text": "United Nations \nA/RES/78/134\n \n \nGeneral Assembly \nDistr.: General \n21 December 2023 \n \n23-25912 (E)    291223 \n*2325912* \n \n \nSeventy-eighth session \nAgenda item 16 (a) \nMacroeconomic policy questions: international trade \nand development \n \n \n \nResolution adopted by the General Assembly \non 19 December 2023 \n \n \n[on the report of the Second Committee (A/78/459/Add.1, para. 25)] \n \n \n 78/134. International trade and development \n \n \n \nThe General Assembly, \n \nRecalling its resolutions 56/178 of 21 December 2001, 57/235 of 20 December \n2002, 58/197 of 23 December 2003, 59/221 of 22 December 2004, 60/184 of \n22 December 2005, 61/186 of 20 December 2006, 62/184 of 19 December 2007, \n63/203 of 19 December 2008, 64/188 of 21 December 2009, 65/142 of 20 December \n2010, 66/185 of 22 December 2011, 67/196 of 21 December 2012, 68/199 of \n20 December 2013, 69/205 of 19 December 2014, 70/187 of 22 December 2015, \n71/214 of 21 December 2016, 72/202 of 20 December 2017, 73/219 of 20 December \n2018, 74/201 of 19 December 2019, 75/203 of 21 December 2020, 76/190 of \n17 December 2021 and 77/151 of 14 December 2022,  \n \nReaffirming its resolution 70/1 of 25 September 2015, entitled \u201cTransforming \nour world: the 2030 Agenda for Sustainable Development\u201d, in which it adopted a \ncomprehensive, far-reaching and people-centred set of universal and transformative \nSustainable Development Goals and targets, its commitment to working tirelessly for \nthe full implementation of the Agenda by 2030, its recognition that eradicating \npoverty in all its forms and dimensions, including extreme poverty, is the greatest \nglobal challenge and an indispensable requirement for sustainable development, its \ncommitment to achieving sustainable development in its three dimensions \u2013 \neconomic, social and environmental \u2013 in a balanced and integrated manner, and to \nbuilding upon the achievements of the Millennium Development Goals and seeking \nto address their unfinished business,  \n \nReaffirming also its resolution 69/313 of 27 July 2015 on the Addis Ababa \nAction Agenda of the Third International Conference on Financing for Development, \nwhich is an integral part of the 2030 Agenda for Sustainable Development, supports \nand complements it, helps to contextualize its means of implementation targets with \nconcrete policies and actions, and reaffirms the strong political commitment to \naddress the challenge of financing and creating an enabling environment at all levels \nfor sustainable development in the spirit of global partnership and solidarity,  \n\nA/RES/78/134 \nInternational trade and development\n \n23-25912\n2/7 \n \n \nRecognizing the need to ensure that the benefits of trade are more widely shared,  \n \nReaffirming World Trade Organization decision WT/MIN(15)/48-WT/L/982 of \n19 December 2015 on the implementation of preferential treatment in favour of \nservices and service suppliers of the least developed countries and increasing their \nparticipation in services trade and decision WT/L/508/Add.1 of 25 July 2012 on \naccession by the least developed countries, encouraging progress on the implementation \nof the World Trade Organization work programme on small economies, which supports \ntheir efforts towards sustainable development, as also reflected in the outcome \ndocument of the third International Conference on Small Island Developing States, the \nSIDS Accelerated Modalities of Action (SAMOA) Pathway,1 and stressing that Aid for \nTrade and targeted trade-related capacity-building are essential to integrating \ndeveloping countries, in particular the least developed countries, landlocked developing \ncountries and small island developing States, into the international trading system,  \n \nRecognizing the critical role of women as producers and traders and the need to \naddress their specific challenges in order to facilitate their full, equal and meaningful \nparticipation in domestic, regional and international trade,  \n \nRecognizing also that multilateral rules and disciplines are the best guarantee \nagainst protectionism and are fundamental to the transparency, predictability and \nstability of international trade,  \n \nNoting the commitments to working to ensure that bilateral, regional and \nplurilateral trade agreements complement the multilateral trading system, recognizing \nthat they can play an important role in complementing global liberalization initiatives, \nand in this regard recalling, inter alia, the entry into force of the Agreement \nEstablishing the African Continental Free Trade Area, on 30 May 2019, and \nwelcoming ongoing efforts to fully operationalize the Agreement, including the \ncommencement of actual trading under the Agreement aimed at doubling \nintra-African trade to deliver economic transformation and strengthen Africa\u2019s \nresilience, including food security and nutrition, COVID-19 recovery and \nachievement of the Sustainable Development Goals,  \n \nNoting with great concern the severe negative impact on human health, safety \nand well-being caused by the coronavirus disease (COVID-19) pandemic, as well as \nthe severe disruption to societies and economies and the devastating impact on lives \nand livelihoods, and that the poorest and most vulnerable are the hardest hit by the \npandemic, reaffirming the ambition to get back on track to achieve the Sustainable \nDevelopment Goals by designing and implementing sustainable and inclusive \nrecovery strategies to accelerate progress towards the full implementation of the 2030 \nAgenda for Sustainable Development and to help to reduce the risk of and build \nresilience to future shocks, crises and pandemics, including by strengthening health \nsystems and achieving universal health coverage, and recognizing that equitable and \ntimely access for all to safe, quality, effective and affordable COVID-19 vaccines, \ntherapeutics and diagnostics are an essential part of a global response based on unity, \nsolidarity, renewed multilateral cooperation and the principle of leaving no one behind,  \n \nNoting with concern the fragile and highly uncertain global socioeconomic \noutlook, persisting negative effects of the COVID-19 pandemic, geopolitical tensions \nand conflicts and current multiple crises, which increased pressure on food, energy \nand finance, affecting many countries around the world and their ability to achieve \nthe Sustainable Development Goals,  \n \nDeeply concerned that the COVID-19 pandemic has disrupted trade, transport, \ntourism, cross-border travel, commodity markets, investment, debt service and \n__________________ \n \n1  Resolution 69/15, annex. \n\nInternational trade and development \nA/RES/78/134\n \n3/7\n23-25912 \n \nfinancial flows, including remittances, with significant impacts on the poorest and the \nmost vulnerable and the operation of global value chains, affecting all sectors of the \neconomy, including micro-, small and medium-sized enterprises and people\u2019s lives, \nespecially in developing and least developed countries, compounding the challenges \nposed by climate change, which have had a devastating impact on sustainable \ndevelopment and humanitarian needs, including on poverty eradication, reduction of \ninequalities, including gender inequality, livelihoods, ending hunger, food security \nand nutrition, education, environmentally sound waste management and access to \nhealth care, particularly in developing countries, including countries in special \nsituations, as well as countries facing specific challenges and those most affected by \nthe pandemic and its socioeconomic consequences, and that restrictive trade measures \nand the lack of transparency and cooperation within the multilateral trading system \nhave affected access for all to safe, quality, effective and affordable COVID-19 \nvaccines, other essential goods and basic and nutritious foodstuffs,  \n \nReiterating the pledge that no one will be left behind, reaffirming the \nrecognition that the dignity of the human person is fundamental, and the wish to see \nthe Goals and targets met for all nations and peoples and for all segments of society, \nand recommitting to endeavour to reach the furthest behind first, \n \n1. \nTakes note of the report of the Trade and Development Board of the United \nNations Conference on Trade and Development 2  and the report of the Secretary-\nGeneral;3 \n \n2. \nReaffirms that international trade is an engine for inclusive growth and \npoverty eradication and that it contributes to the promotion of sustainable development, \nstructural transformation and industrialization, particularly in developing countries;  \n \n3. \nUnderscores that a universal, rules-based, open, transparent, predictable, \ninclusive, non-discriminatory and equitable multilateral trading system should \ncontribute to the achievement of the Sustainable Development Goals, providing policy \nspace for national development objectives, poverty eradication and sustainable \ndevelopment, consistent with relevant international rules and countries\u2019 commitments, \nand promote export-led growth in the developing countries through, inter alia, \npreferential trade access for developing countries, targeted special and differential \ntreatment that responds to the development needs of individual countries, and the \nelimination of trade barriers that are inconsistent with World Trade Organization \nagreements; \n \n4. \nRecalls the ministerial decision of 7 December 2013 on duty-free and \nquota-free market access for least developed countries, 4 recognizes that nearly all \ndeveloped country members of the World Trade Organization provide either full or \nnearly full duty-free and quota-free market access to least developed country products \nand that a number of developing country members of the World Trade Organization also \ngrant a significant degree of duty-free and quota-free market access to least developed \ncountry products, and takes note of the adoption of trading arrangements that further \nextend preferential market access for the benefit of other developing States;  \n \n5. \nWelcomes the commitment of World Trade Organization members to work \ntowards the necessary reform of the Organization, with the aim of improving all its \nfunctions, while reaffirming the foundational principles of the Organization, and to \nconduct discussions with a view to having a fully and well-functioning dispute settlement \nsystem accessible to all members by 2024, while taking advantage of the available \nopportunities, addressing the challenges that the Organization is facing and ensuring the \n__________________ \n \n2  A/78/15 (Part I) and A/78/15 (Part II). \n \n3  A/78/230. \n \n4  World Trade Organization, document WT/MIN(13)/44. \n\nA/RES/78/134 \nInternational trade and development\n \n23-25912\n4/7 \n \nOrganization\u2019s proper functioning; the work shall be member-driven, open, transparent, \ninclusive and must address the interests of all members, including development issues; \nand notes the contribution of the multilateral trading system to promote the 2030 Agenda \nfor Sustainable Development5 and its Sustainable Development Goals; \n \n6. \nReaffirms that maintaining stable trade flows is essential to urgently \naddressing the multiple global crises, inter alia, of food, energy and finance faced by \ndeveloping countries, as well as enhancing food security and nutrition in these countries;  \n \n7. \nUnderscores the urgent need to keep markets, including for food, fertilizer \nand agriculture, open, equitable, transparent, non-discriminatory and predictable by \neliminating trade-restrictive measures and distortions, speculations and hoarding \nthrough the reform of the multilateral trade rules on agriculture, according to World \nTrade Organization mandates, and to ensure sustained food security and nutrition of \ncountries, particularly the least developed and net food-importing developing countries;  \n \n8. \nEncourages cooperation among countries to improve agricultural \nproductivity and trade with a view to increasing the availability, accessibility and \naffordability of food to help address global food security; \n \n9. \nNotes with concern that certain forms of support for agricultural producers \nare either trade-distorting or harmful to nature and health, and reaffirms its \ncommitment to correct and prevent trade restrictions and distortions in world \nagricultural markets, including through the parallel elimination of all forms of \nagricultural export subsidies and all export measures with equivalent effect, \nhighlights the need to address trade-distorting domestic support in agriculture, and \nlooks forward to continuing the World Trade Organization negotiations consistent \nwith existing mandates to further reform agricultural trade rules, with a view to \nachieving concrete and positive results at the thirteenth Ministerial Conference; \n \n10. Stresses the continuing importance of the provision and mobilization of \nnew and additional means of implementation, such as climate finance, technology \ntransfer on mutually agreed terms and capacity-building to developing countries, for \nexpanding trade in renewable energy, that can contribute to ensure access to \naffordable, reliable, sustainable and modern energy and in line with their national \ndevelopment priorities, including through making clean and renewable energy \ntechnologies available for all; \n \n11. \nRecognizes the role of services to global economic output and employment \nand in supporting global and regional connectivity and business continuity in times \nof crises and post-crisis recovery, in this respect underlines the critical role of \nservices, digital technology and creative economy, and notes that the COVID-19 \npandemic has had a significant impact on services trade and services sectors, \nparticularly for developing countries, including the least developed countries;  \n \n12. Underscores the continuing need for international support to increase \neconomic resilience and diversification of commodity-dependent developing \ncountries in such a way that their structural transformation is sustainable and \neconomically meaningful; \n \n13. Calls upon Member States to take complementary actions at the national \nlevel to strengthen domestic enabling environments and implement sound domestic \npolicies and reforms conducive to realizing the potential of trade for inclusive growth \nand sustainable development; \n \n14. Reaffirms the importance of promoting regional economic integration of \ndeveloping countries to foster trade recovery and development, and in this regard \n__________________ \n \n5  Resolution 70/1. \n\nInternational trade and development \nA/RES/78/134\n \n5/7\n23-25912 \n \nwelcomes ongoing efforts to fully operationalize the Agreement Establishing the \nAfrican Continental Free Trade Area, including the commencement of actual trading \nunder the Agreement aimed at doubling intra-African trade to deliver economic \ntransformation and strengthen Africa\u2019s resilience, including food security and \nnutrition, COVID-19 recovery and achievement of the Sustainable Development \nGoals, and notes the progress made in the implementation of the Regional \nComprehensive Economic Partnership Agreement;  \n \n15. Reiterates that States will not be able to achieve the ambitious Goals and \ntargets of the 2030 Agenda for Sustainable Development without a revitalized and \nenhanced global partnership and comparably ambitious means of implementation and \nthat a revitalized global partnership will facilitate an intensive global engagement in \nsupport of the implementation of the 2030 Agenda, bringing together Governments, \ncivil society, the private sector, the United Nations system and other actors and \nmobilizing all available resources;  \n \n16. Reaffirms the commitments made through the adoption of the Addis Ababa \nAction Agenda of the Third International Conference on Financing for Development6 \nin, inter alia, international trade as an important action area for sustainable \ndevelopment, and looks forward to the convening of a fourth international conference \non financing for development; \n \n17. Recommits firmly to promoting a rules-based, non-discriminatory, open, fair, \ninclusive, equitable and transparent multilateral trading system, with the World Trade \nOrganization at its core, as well as meaningful trade liberalization, and with a strong \ndevelopment dimension in line with the 2030 Agenda for Sustainable Development, \nwhile preserving the fundamental principles of the World Trade Organization;  \n \n18. Encourages the development and the implementation of inclusive trade \npolicies that can contribute to advancing gender equality and women\u2019s economic \nempowerment, which has a positive impact on economic growth and helps to reduce \npoverty; \n \n19. Welcomes the successful conclusion of the twelfth Ministerial Conference \nof the World Trade Organization, held in Geneva from 12 to 17 June 2022, under the \npresidency of the Government of Kazakhstan, and looks forward to the convening of \nthe thirteenth Ministerial Conference, to be held from 26 to 29 February 2024 in Abu \nDhabi, United Arab Emirates;  \n \n20. Emphasizes the need to continue combating protectionism in all its forms \nand to rectify any trade-distorting measures, including trade barriers, that are \ninconsistent with World Trade Organization rules, recognizing the right of countries, \nin particular developing countries, to fully utilize flexibilities consistent with their \nWorld Trade Organization commitments and obligations, and emphasizes that the \nwork of the World Trade Organization shall continue to promote sustainable economic \ndevelopment with provisions for special and differential treatment remaining integral; \n \n21. Takes note with appreciation of the ministerial decision on the TRIPS \nAgreement that was adopted at the twelfth Ministerial Conference of the World Trade \nOrganization to authorize the use of the subject matter of a patent required for the \nproduction and supply of COVID-19 vaccines without the consent of the right holder \nto the extent necessary to address the COVID-19 pandemic, in accordance with the \nprovisions of article 31 of the TRIPS Agreement,7 and recognizes that paragraph 8 of \nthe ministerial decision on the TRIPS Agreement (WT/MIN(22)/30) states that \n__________________ \n \n6  Resolution 69/313, annex. \n \n7  See World Trade Organization, ministerial decision on the TRIPS Agreement (WT/MIN(22)/30), \nadopted on 17 June 2022. \n\nA/RES/78/134 \nInternational trade and development\n \n23-25912\n6/7 \n \nmembers of the World Trade Organization will decide on the extension of the ministerial \ndecision to cover the production and supply of COVID-19 diagnostics and therapeutics; \n \n22. Calls for enhancing the capacity of the multilateral trading system to \nincrease pandemic and disaster preparedness and resilience through a multifaceted \nresponse, including by strengthening the resilience of global supply chains, including \nshort-term measures such as trade facilitation, transparency and restraint in relation \nto export restrictions on vaccines, therapeutics and diagnostics supplies, as well as \nthe rapid scaling up and expansion of vaccine production globally, including in \ndeveloping countries, and welcomes the ministerial declaration on the World Trade \nOrganization response to the COVID-19 pandemic and preparedness for future \npandemics, adopted on 17 June 2022;8 \n \n23. Recalls the decision at the twelfth Ministerial Conference of the World \nTrade Organization not to impose export restrictions on foodstuffs purchased for \nnon-commercial humanitarian purposes by the World Food Programme; 9 \n \n24. Urges the members of the World Trade Organization to start the effective \nimplementation and monitoring of the Marrakesh Ministerial Decision on Measures \nConcerning the Possible Negative Effects of the Reform Programme on Least \nDeveloped and Net Food-Importing Developing Countries,10 and notes the importance \nof having a dedicated work programme to operationalize it, according to World Trade \nOrganization mandates, to ensure sustained food security and nutrition, including in \nthe least developed and net food-importing developing countries;  \n \n25. Underlines that any emergency measures introduced to address food \nsecurity concerns shall minimize trade distortions as far as possible, be temporary, \ntargeted, transparent and be notified and implemented in accordance with World \nTrade Organization rules, and underscores that particular regard should be given to \nthe effect that such measures have on developing countries, including the least \ndeveloped and net food-importing developing countries;  \n \n26. Welcomes the adoption of the Agreement on Fisheries Subsidies11 at the \ntwelfth Ministerial Conference of the World Trade Organization regarding \nSustainable Development Goal target 14.6, and urges the members of the World Trade \nOrganization to promptly ratify or accept this agreement according to their domestic \nprocedures, aiming for an expedited entry into force, and encourages members to \ncontinue negotiations on outstanding issues, with a view to making recommendations \nby the thirteenth Ministerial Conference of the World Trade Organization for \nadditional provisions that would achieve a comprehensive agreement on fisheries \nsubsidies, including through further disciplines on certain forms of fisheries subsidies \nthat contribute to overcapacity and overfishing, recognizing that appropriate and \neffective special and differential treatment for developing country members and least \ndeveloped country members should be an integral part of these negotiations; \n \n27. Underlines the importance of the Agreement on Trade Facilitation annexed \nto the Protocol amending the Marrakesh Agreement Establishing the World Trade \nOrganization in improving transparency, expediting the movement, release and \nclearance of goods, including goods in transit, and thereby reducing trade costs, and \nin this regard encourages its full and effective implementation, including through \nenhanced support towards its implementation; \n__________________ \n \n8  World Trade Organization, document WT/MIN(22)/31. \n \n9  See World Trade Organization, ministerial decision on World Food Programme food purchases \nexemption from export prohibitions or restrictions (WT/MIN(22)/29), adopted on 17 June 2022. \n \n10  See World Trade Organization, ministerial declaration on the emergency response to food \ninsecurity (WT/MIN(22)/28), adopted on 17 June 2022. \n \n11  World Trade Organization, document WT/MIN(22)/W/22. \n\nInternational trade and development \nA/RES/78/134\n \n7/7\n23-25912 \n \n \n28. Urges the international community to adopt urgent and effective measures \nto eliminate the use of unilateral economic, financial or trade measures that are not \nauthorized by relevant organs of the United Nations, and that are inconsistent with \nthe principles of international law or the Charter of the United Nations or that \ncontravene the basic principles of the multilateral trading system and that affect, in \nparticular, but not exclusively, developing countries;  \n \n29. Notes that the use of policy instruments for environmental purposes with \npotential impact on international trade can have unintended consequences for partner \ncountries, especially the least developed countries, which need to be addressed to aid \ntheir pursuit of structural transformation and economic diversification; \n \n30. Welcomes efforts to enhance South-South and triangular trade cooperation \nunder interregional trade arrangements, such as the Global System of Trade \nPreferences among Developing Countries, as a vehicle to support export \ndiversification, economic resilience and technological upgrading;  \n \n31. Reiterates the important role of the United Nations Conference on Trade \nand Development as the focal point within the United Nations system for the \nintegrated treatment of trade and development and interrelated issues in the areas of \nfinance, technology, investment and sustainable development, and in contributing to \nsupporting the implementation of the 2030 Agenda;  \n \n32. Looks forward to the celebration of the sixtieth anniversary of the United \nNations Conference on Trade and Development expected in June 2024;  \n \n33. Recalls the holding of the fifteenth session of the United Nations \nConference on Trade and Development, held in Bridgetown from 3 to 7 October 2021, \nand the adoption of its outcome document, the Bridgetown Covenant; 12 \n \n34. Reaffirms the commitment at the very heart of the 2030 Agenda to leave \nno one behind and commit to taking more tangible steps to support people in \nvulnerable situations and the most vulnerable countries and to reach the furthest \nbehind first;  \n \n35. Requests the Secretary-General, in collaboration with the secretariat of the \nUnited Nations Conference on Trade and Development, to submit to the General \nAssembly at its seventy-ninth session a report on the implementation of the present \nresolution and developments in the international trading system, including concrete \nrecommendations to accelerate the implementation of the Addis Ababa Action \nAgenda in this regard, and decides to include in the provisional agenda of its seventy-\nninth session, under the item entitled \u201cMacroeconomic policy questions\u201d, the \nsub-item entitled \u201cInternational trade and development\u201d. \n \n49th plenary meeting \n19 December 2023 \n \n__________________ \n \n12  United Nations Conference on Trade and Development, The Bridgetown Covenant: from \ninequality and vulnerability to prosperity for all (TD/541/Add.2), adopted on 7 October 2021. \n",
  "paragraphs": {
    "1": "Takes note of the report of the Trade and Development Board of the United Nations Conference on Trade and Development 2 and the report of the Secretary- General;3",
    "2": "Reaffirms that international trade is an engine for inclusive growth and poverty eradication and that it contributes to the promotion of sustainable development, structural transformation and industrialization, particularly in developing countries;",
    "3": "Underscores that a universal, rules-based, open, transparent, predictable, inclusive, non-discriminatory and equitable multilateral trading system should contribute to the achievement of the Sustainable Development Goals, providing policy space for national development objectives, poverty eradication and sustainable development, consistent with relevant international rules and countries\u2019 commitments, and promote export-led growth in the developing countries through, inter alia, preferential trade access for developing countries, targeted special and differential treatment that responds to the development needs of individual countries, and the elimination of trade barriers that are inconsistent with World Trade Organization agreements;",
    "4": "Recalls the ministerial decision of 7 December 2013 on duty-free and quota-free market access for least developed countries, 4 recognizes that nearly all developed country members of the World Trade Organization provide either full or nearly full duty-free and quota-free market access to least developed country products and that a number of developing country members of the World Trade Organization also grant a significant degree of duty-free and quota-free market access to least developed country products, and takes note of the adoption of trading arrangements that further extend preferential market access for the benefit of other developing States;",
    "5": "Welcomes the commitment of World Trade Organization members to work towards the necessary reform of the Organization, with the aim of improving all its functions, while reaffirming the foundational principles of the Organization, and to conduct discussions with a view to having a fully and well-functioning dispute settlement system accessible to all members by 2024, while taking advantage of the available opportunities, addressing the challenges that the Organization is facing and ensuring the __________________ 2 A/78/15 (Part I) and A/78/15 (Part II). 3 A/78/230. 4 World Trade Organization, document WT/MIN(13)/44. A/RES/78/134 International trade and development 23-25912 4/7 Organization\u2019s proper functioning; the work shall be member-driven, open, transparent, inclusive and must address the interests of all members, including development issues; and notes the contribution of the multilateral trading system to promote the 2030 Agenda for Sustainable Development5 and its Sustainable Development Goals;",
    "6": "Reaffirms that maintaining stable trade flows is essential to urgently addressing the multiple global crises, inter alia, of food, energy and finance faced by developing countries, as well as enhancing food security and nutrition in these countries;",
    "7": "Underscores the urgent need to keep markets, including for food, fertilizer and agriculture, open, equitable, transparent, non-discriminatory and predictable by eliminating trade-restrictive measures and distortions, speculations and hoarding through the reform of the multilateral trade rules on agriculture, according to World Trade Organization mandates, and to ensure sustained food security and nutrition of countries, particularly the least developed and net food-importing developing countries;",
    "8": "Encourages cooperation among countries to improve agricultural productivity and trade with a view to increasing the availability, accessibility and affordability of food to help address global food security;",
    "9": "Notes with concern that certain forms of support for agricultural producers are either trade-distorting or harmful to nature and health, and reaffirms its commitment to correct and prevent trade restrictions and distortions in world agricultural markets, including through the parallel elimination of all forms of agricultural export subsidies and all export measures with equivalent effect, highlights the need to address trade-distorting domestic support in agriculture, and looks forward to continuing the World Trade Organization negotiations consistent with existing mandates to further reform agricultural trade rules, with a view to achieving concrete and positive results at the thirteenth Ministerial Conference;",
    "10": "Stresses the continuing importance of the provision and mobilization of new and additional means of implementation, such as climate finance, technology transfer on mutually agreed terms and capacity-building to developing countries, for expanding trade in renewable energy, that can contribute to ensure access to affordable, reliable, sustainable and modern energy and in line with their national development priorities, including through making clean and renewable energy technologies available for all;",
    "11": "Recognizes the role of services to global economic output and employment and in supporting global and regional connectivity and business continuity in times of crises and post-crisis recovery, in this respect underlines the critical role of services, digital technology and creative economy, and notes that the COVID-19 pandemic has had a significant impact on services trade and services sectors, particularly for developing countries, including the least developed countries;",
    "12": "Underscores the continuing need for international support to increase economic resilience and diversification of commodity-dependent developing countries in such a way that their structural transformation is sustainable and economically meaningful;",
    "13": "Calls upon Member States to take complementary actions at the national level to strengthen domestic enabling environments and implement sound domestic policies and reforms conducive to realizing the potential of trade for inclusive growth and sustainable development;",
    "14": "Reaffirms the importance of promoting regional economic integration of developing countries to foster trade recovery and development, and in this regard __________________ 5 Resolution 70/1. International trade and development A/RES/78/134 5/7 23-25912 welcomes ongoing efforts to fully operationalize the Agreement Establishing the African Continental Free Trade Area, including the commencement of actual trading under the Agreement aimed at doubling intra-African trade to deliver economic transformation and strengthen Africa\u2019s resilience, including food security and nutrition, COVID-19 recovery and achievement of the Sustainable Development Goals, and notes the progress made in the implementation of the Regional Comprehensive Economic Partnership Agreement;",
    "15": "Reiterates that States will not be able to achieve the ambitious Goals and targets of the 2030 Agenda for Sustainable Development without a revitalized and enhanced global partnership and comparably ambitious means of implementation and that a revitalized global partnership will facilitate an intensive global engagement in support of the implementation of the 2030 Agenda, bringing together Governments, civil society, the private sector, the United Nations system and other actors and mobilizing all available resources;",
    "16": "Reaffirms the commitments made through the adoption of the Addis Ababa Action Agenda of the Third International Conference on Financing for Development6 in, inter alia, international trade as an important action area for sustainable development, and looks forward to the convening of a fourth international conference on financing for development;",
    "17": "Recommits firmly to promoting a rules-based, non-discriminatory, open, fair, inclusive, equitable and transparent multilateral trading system, with the World Trade Organization at its core, as well as meaningful trade liberalization, and with a strong development dimension in line with the 2030 Agenda for Sustainable Development, while preserving the fundamental principles of the World Trade Organization;",
    "18": "Encourages the development and the implementation of inclusive trade policies that can contribute to advancing gender equality and women\u2019s economic empowerment, which has a positive impact on economic growth and helps to reduce poverty;",
    "19": "Welcomes the successful conclusion of the twelfth Ministerial Conference of the World Trade Organization, held in Geneva from 12 to 17 June 2022, under the presidency of the Government of Kazakhstan, and looks forward to the convening of the thirteenth Ministerial Conference, to be held from 26 to 29 February 2024 in Abu Dhabi, United Arab Emirates;",
    "20": "Emphasizes the need to continue combating protectionism in all its forms and to rectify any trade-distorting measures, including trade barriers, that are inconsistent with World Trade Organization rules, recognizing the right of countries, in particular developing countries, to fully utilize flexibilities consistent with their World Trade Organization commitments and obligations, and emphasizes that the work of the World Trade Organization shall continue to promote sustainable economic development with provisions for special and differential treatment remaining integral;",
    "21": "Takes note with appreciation of the ministerial decision on the TRIPS Agreement that was adopted at the twelfth Ministerial Conference of the World Trade Organization to authorize the use of the subject matter of a patent required for the production and supply of COVID-19 vaccines without the consent of the right holder to the extent necessary to address the COVID-19 pandemic, in accordance with the provisions of article 31 of the TRIPS Agreement,7 and recognizes that paragraph 8 of the ministerial decision on the TRIPS Agreement (WT/MIN(22)/30) states that __________________ 6 Resolution 69/313, annex. 7 See World Trade Organization, ministerial decision on the TRIPS Agreement (WT/MIN(22)/30), adopted on 17 June 2022. A/RES/78/134 International trade and development 23-25912 6/7 members of the World Trade Organization will decide on the extension of the ministerial decision to cover the production and supply of COVID-19 diagnostics and therapeutics;",
    "22": "Calls for enhancing the capacity of the multilateral trading system to increase pandemic and disaster preparedness and resilience through a multifaceted response, including by strengthening the resilience of global supply chains, including short-term measures such as trade facilitation, transparency and restraint in relation to export restrictions on vaccines, therapeutics and diagnostics supplies, as well as the rapid scaling up and expansion of vaccine production globally, including in developing countries, and welcomes the ministerial declaration on the World Trade Organization response to the COVID-19 pandemic and preparedness for future pandemics, adopted on 17 June 2022;8",
    "23": "Recalls the decision at the twelfth Ministerial Conference of the World Trade Organization not to impose export restrictions on foodstuffs purchased for non-commercial humanitarian purposes by the World Food Programme; 9",
    "24": "Urges the members of the World Trade Organization to start the effective implementation and monitoring of the Marrakesh Ministerial Decision on Measures Concerning the Possible Negative Effects of the Reform Programme on Least Developed and Net Food-Importing Developing Countries,10 and notes the importance of having a dedicated work programme to operationalize it, according to World Trade Organization mandates, to ensure sustained food security and nutrition, including in the least developed and net food-importing developing countries;",
    "25": "Underlines that any emergency measures introduced to address food security concerns shall minimize trade distortions as far as possible, be temporary, targeted, transparent and be notified and implemented in accordance with World Trade Organization rules, and underscores that particular regard should be given to the effect that such measures have on developing countries, including the least developed and net food-importing developing countries;",
    "26": "Welcomes the adoption of the Agreement on Fisheries Subsidies11 at the twelfth Ministerial Conference of the World Trade Organization regarding Sustainable Development Goal target 14.6, and urges the members of the World Trade Organization to promptly ratify or accept this agreement according to their domestic procedures, aiming for an expedited entry into force, and encourages members to continue negotiations on outstanding issues, with a view to making recommendations by the thirteenth Ministerial Conference of the World Trade Organization for additional provisions that would achieve a comprehensive agreement on fisheries subsidies, including through further disciplines on certain forms of fisheries subsidies that contribute to overcapacity and overfishing, recognizing that appropriate and effective special and differential treatment for developing country members and least developed country members should be an integral part of these negotiations;",
    "27": "Underlines the importance of the Agreement on Trade Facilitation annexed to the Protocol amending the Marrakesh Agreement Establishing the World Trade Organization in improving transparency, expediting the movement, release and clearance of goods, including goods in transit, and thereby reducing trade costs, and in this regard encourages its full and effective implementation, including through enhanced support towards its implementation; __________________ 8 World Trade Organization, document WT/MIN(22)/31. 9 See World Trade Organization, ministerial decision on World Food Programme food purchases exemption from export prohibitions or restrictions (WT/MIN(22)/29), adopted on 17 June 2022. 10 See World Trade Organization, ministerial declaration on the emergency response to food insecurity (WT/MIN(22)/28), adopted on 17 June 2022. 11 World Trade Organization, document WT/MIN(22)/W/22. International trade and development A/RES/78/134 7/7 23-25912",
    "28": "Urges the international community to adopt urgent and effective measures to eliminate the use of unilateral economic, financial or trade measures that are not authorized by relevant organs of the United Nations, and that are inconsistent with the principles of international law or the Charter of the United Nations or that contravene the basic principles of the multilateral trading system and that affect, in particular, but not exclusively, developing countries;",
    "29": "Notes that the use of policy instruments for environmental purposes with potential impact on international trade can have unintended consequences for partner countries, especially the least developed countries, which need to be addressed to aid their pursuit of structural transformation and economic diversification;",
    "30": "Welcomes efforts to enhance South-South and triangular trade cooperation under interregional trade arrangements, such as the Global System of Trade Preferences among Developing Countries, as a vehicle to support export diversification, economic resilience and technological upgrading;",
    "31": "Reiterates the important role of the United Nations Conference on Trade and Development as the focal point within the United Nations system for the integrated treatment of trade and development and interrelated issues in the areas of finance, technology, investment and sustainable development, and in contributing to supporting the implementation of the 2030 Agenda;",
    "32": "Looks forward to the celebration of the sixtieth anniversary of the United Nations Conference on Trade and Development expected in June 2024;",
    "33": "Recalls the holding of the fifteenth session of the United Nations Conference on Trade and Development, held in Bridgetown from 3 to 7 October 2021, and the adoption of its outcome document, the Bridgetown Covenant; 12",
    "34": "Reaffirms the commitment at the very heart of the 2030 Agenda to leave no one behind and commit to taking more tangible steps to support people in vulnerable situations and the most vulnerable countries and to reach the furthest behind first;",
    "35": "Requests the Secretary-General, in collaboration with the secretariat of the United Nations Conference on Trade and Development, to submit to the General Assembly at its seventy-ninth session a report on the implementation of the present resolution and developments in the international trading system, including concrete recommendations to accelerate the implementation of the Addis Ababa Action Agenda in this regard, and decides to include in the provisional agenda of its seventy- ninth session, under the item entitled \u201cMacroeconomic policy questions\u201d, the sub-item entitled \u201cInternational trade and development\u201d. 49th plenary meeting 19 December 2023 __________________ 12 United Nations Conference on Trade and Development, The Bridgetown Covenant: from inequality and vulnerability to prosperity for all (TD/541/Add.2), adopted on 7 October 2021."
  },
  "agenda_items": [
    "Item 16"
  ],
  "symbol_references": []
}