{
  "symbol": "A/RES/75/294",
  "filename": "A_RES_75_294.pdf",
  "title": "75/294. Financing of the Regional Service Centre in Entebbe, Uganda",
  "text": "United Nations \nA/RES/75/294\n \n \nGeneral Assembly \nDistr.: General \n7 July 2021 \n \n21-08997 (E)    080721 \n*2108997* \n \n \nSeventy-fifth session \nAgenda item 154 \nAdministrative and budgetary aspects of the financing of \nthe United Nations peacekeeping operations \n \n \n \n \n Resolution adopted by the General Assembly \non 30 June 2021 \n \n \n \n \n[on the report of the Fifth Committee (A/75/936, para. 15)] \n \n \n 75/294. Financing of the Regional Service Centre in Entebbe, Uganda \n \n \n \nThe General Assembly, \n \nRecalling its resolution 69/307 of 25 June 2015 concerning the financing of the \nRegional Service Centre in Entebbe, Uganda, and its subsequent resolutions thereon, the \nlatest of which was resolution 74/281 of 30 June 2020, as well as its decision 74/571 \nof 3 September 2020, \n \nHaving considered the reports of the Secretary-General on the financing of the \nRegional Service Centre,1 and the related report of the Advisory Committee on \nAdministrative and Budgetary Questions, 2 \n \n1. \nReaffirms its resolutions 57/290 B of 18 June 2003, 59/296 of 22 June \n2005, 60/266 of 30 June 2006, 61/276 of 29 June 2007, 64/269 of 24 June 2010, \n65/289 of 30 June 2011, 66/264 of 21 June 2012, 69/307, and 70/286 of 17 June 2016, \nand requests the Secretary-General to ensure the full implementation of their relevant \nprovisions; \n \n2. \nTakes note of the reports of the Secretary-General; \n \n3. \nEndorses the conclusions and recommendations contained in the report of \nthe Advisory Committee on Administrative and Budgetary Questions, subject to the \nprovisions of the present resolution, and requests the Secretary-General to ensure \ntheir full implementation; \n \n4. \nAcknowledges the support of the Government of Uganda in facilitating the \nwork of the United Nations at the Regional Service Centre in Entebbe, Uganda; \n \n__________________ \n \n1 A/75/621 and A/75/770. \n \n2 A/75/822/Add.9. \n\nA/RES/75/294 \nFinancing of the Regional Service Centre in Entebbe, Uganda\n \n21-08997\n2/2 \n \n \n \nBudget performance report for the period from 1 July 2019 to 30 June 2020 \n \n \n5. \nTakes note of the report of the Secretary-General on the budget performance \nof the Regional Service Centre for the period from 1 July 2019 to 30 June 2020; 3 \n \n \n \nBudget estimates for the period from 1 July 2021 to 30 June 2022 \n \n \n6. \nApproves the amount of 40,272,300 United States dollars for the maintenance \nof the Regional Service Centre for the period from 1 July 2021 to 30 June 2022; \n \n \n \nFinancing of the budget estimates for the period from 1 July 2021 to 30 June 2022 \n \n \n7. \nDecides that the requirements for the Regional Service Centre for the \nperiod from 1 July 2021 to 30 June 2022 shall be financed as follows: \n \n(a) \nThe unencumbered balance and other revenue in the amount of 158,400 \ndollars in respect of the financial period ended 30 June 2020, to be applied against \nthe resources required for the period from 1 July 2021 to 30 June 2022; \n \n(b) \nThe amount of 38,293,700 dollars, to be prorated among the budgets of the \nactive client peacekeeping operations for the period from 1 July 2021 to 30 June 2022; \n \n(c) \nThe amount of 1,820,200 dollars, with respect to the share of client special \npolitical missions, to be funded under section 3, Political affairs, as may be approved \nby the General Assembly in the context of the proposed programme budget for 2022; \n \n(d) \nThe estimated staff assessment income of 3,910,300 dollars, comprising \nthe amount of 3,893,200 dollars for the period from 1 July 2021 to 30 June 2022 and \nthe increase of 17,100 dollars in respect of the period from 1 July 2019 to 30 June \n2020, to be offset against the balance referred to in subparagraph (b) above, to be \nprorated among the budgets of the individual active client peacekeeping operations; \n \n8. \nAlso decides to consider at its seventy-sixth session the question of the \nfinancing of the Regional Service Centre. \n \n88th plenary meeting \n30 June 2021 \n \n__________________ \n3 A/75/621. \n",
  "paragraphs": {
    "1": "Reaffirms its resolutions 57/290 B of 18 June 2003, 59/296 of 22 June 2005, 60/266 of 30 June 2006, 61/276 of 29 June 2007, 64/269 of 24 June 2010, 65/289 of 30 June 2011, 66/264 of 21 June 2012, 69/307, and 70/286 of 17 June 2016, and requests the Secretary-General to ensure the full implementation of their relevant provisions;",
    "2": "Takes note of the reports of the Secretary-General;",
    "3": "Endorses the conclusions and recommendations contained in the report of the Advisory Committee on Administrative and Budgetary Questions, subject to the provisions of the present resolution, and requests the Secretary-General to ensure their full implementation;",
    "4": "Acknowledges the support of the Government of Uganda in facilitating the work of the United Nations at the Regional Service Centre in Entebbe, Uganda; __________________ 1 A/75/621 and A/75/770. 2 A/75/822/Add.9. A/RES/75/294 Financing of the Regional Service Centre in Entebbe, Uganda 21-08997 2/2 Budget performance report for the period from 1 July 2019 to 30 June 2020",
    "5": "Takes note of the report of the Secretary-General on the budget performance of the Regional Service Centre for the period from 1 July 2019 to 30 June 2020; 3 Budget estimates for the period from 1 July 2021 to 30 June 2022",
    "6": "Approves the amount of 40,272,300 United States dollars for the maintenance of the Regional Service Centre for the period from 1 July 2021 to 30 June 2022; Financing of the budget estimates for the period from 1 July 2021 to 30 June 2022",
    "7": "Decides that the requirements for the Regional Service Centre for the period from 1 July 2021 to 30 June 2022 shall be financed as follows: (a) The unencumbered balance and other revenue in the amount of 158,400 dollars in respect of the financial period ended 30 June 2020, to be applied against the resources required for the period from 1 July 2021 to 30 June 2022; (b) The amount of 38,293,700 dollars, to be prorated among the budgets of the active client peacekeeping operations for the period from 1 July 2021 to 30 June 2022; (c) The amount of 1,820,200 dollars, with respect to the share of client special political missions, to be funded under section 3, Political affairs, as may be approved by the General Assembly in the context of the proposed programme budget for 2022; (d) The estimated staff assessment income of 3,910,300 dollars, comprising the amount of 3,893,200 dollars for the period from 1 July 2021 to 30 June 2022 and the increase of 17,100 dollars in respect of the period from 1 July 2019 to 30 June 2020, to be offset against the balance referred to in subparagraph (b) above, to be prorated among the budgets of the individual active client peacekeeping operations;",
    "8": "Also decides to consider at its seventy-sixth session the question of the financing of the Regional Service Centre. 88th plenary meeting 30 June 2021 __________________ 3 A/75/621."
  },
  "agenda_items": [
    "Item 154"
  ],
  "symbol_references": []
}