{
  "symbol": "A/RES/79/285",
  "filename": "A_RES_79_285.pdf",
  "title": "79/285. International Day in Memory of the Victims of Earthquakes",
  "text": "United Nations \nA/RES/79/285\n \n \nGeneral Assembly \nDistr.: General \n2 May 2025 \n \n25-06950 (E) \n*2506950* \n \n \nSeventy-ninth session \nAgenda item 13 \nIntegrated and coordinated implementation of and follow-up \nto the outcomes of the major United Nations conferences and \nsummits in the economic, social and related fields \n \n \n \n \n Resolution adopted by the General Assembly \non 29 April 2025 \n \n \n[without reference to a Main Committee (A/79/L.76)] \n \n \n 79/285. International Day in Memory of the Victims of Earthquakes \n \n \n \nThe General Assembly, \n \nReaffirming its resolution 70/1 of 25 September 2015, entitled \u201cTransforming \nour world: the 2030 Agenda for Sustainable Development\u201d, in which it adopted a \ncomprehensive, far-reaching and people-centred set of universal and transformative \nSustainable Development Goals and targets, and its commitment to working tirelessly \nfor the full implementation of the Agenda by 2030, \n \nRecalling the Sendai Declaration, 1 the Sendai Framework for Disaster Risk \nReduction 2015\u201320302 and the political declaration of the high-level meeting on the \nmidterm review of the Sendai Framework for Disaster Risk Reduction 2015\u20132030,3 \nand recognizing that one of the priorities for action of the Sendai Framework is an \nunderstanding of disaster risk for prevention and mitigation and for the development \nand implementation of appropriate preparedness for and effective response to \ndisasters, which continue to undermine efforts to achieve sustainable development, \n \nReaffirming its resolution 46/182 of 19 December 1991 on strengthening the \ncoordination of humanitarian emergency assistance of the United Nations and \nsubsequent related resolutions on humanitarian assistance, including resolutions \n57/150 of 16 December 2002 and 79/139 and 79/140 of 9 December 2024, \n \nReaffirming also its resolutions 53/199 of 15 December 1998 and 61/185 of \n20 December 2006 on the proclamation of international years, and Economic and \nSocial Council resolution 1980/67 of 25 July 1980 on international years and \nanniversaries, in particular paragraphs 1 to 10 of the annex thereto on the agreed \n__________________ \n \n1 Resolution 69/283, annex I. \n \n2 Ibid., annex II. \n \n3 Resolution 77/289, annex. \n\nA/RES/79/285 \nInternational Day in Memory of the Victims of Earthquakes\n \n25-06950\n2/3 \n \ncriteria for the proclamation of international years, as well as paragraphs 13 and 14, \nin which it is stated that an international year should not be proclaimed before the \nbasic arrangements for its organization and financing have been made, \n \nAcknowledging the importance of the work of the agencies, funds and \nprogrammes of the United Nations system and other relevant institutions in disaster \nrisk reduction, including assessing seismic hazards and building resilience to \nearthquakes, \n \nEmphasizing that earthquakes have claimed millions of lives and caused \nextensive destruction, as well as exacerbated existing socioeconomic challenges, and \nremain a significant challenge for many countries, \n \nRecognizing resolution 1753 (XVII) of 5 October 1962 as the first-ever General \nAssembly resolution reflecting international solidarity in foreseeing practical steps in \ninternational assistance for the victims of earthquakes, \n \nAcknowledging that earthquakes have resulted in significant loss of lives, \ndamage to property, displacement of communities and the loss of livelihoods, food \nsecurity and nutrition, health and access to social infrastructure, calling for support \nto countries to better understand the exposure and vulnerability to earthquake risks, \nand further calling upon the international community to provide financial, technical \nand capacity-building support to countries prone to earthquake risk, prioritizing \nresources to developing countries, \n \nRecognizing the long-term impact of earthquakes on survivors and affected \ncommunities and the need for psychosocial support, inclusive recovery planning and \nsustainable rebuilding efforts for the well-being of those most affected, \n \nRecognizing also the importance of promoting risk-informed, inclusive policies, \nplanning and investments that build resilience to earthquakes and reduce \ndisplacement risk arising from earthquakes, \n \nReiterating its call for the implementation of integrated and inclusive economic, \nstructural, legal, social, health, cultural, educational, environmental, technological, \npolitical, financial and institutional measures that reduce risks caused by earthquakes \nand vulnerability to them, and increase preparedness for response and recovery, \n \nRecognizing that it is urgent and critical to anticipate, plan for and reduce risks, \nto protect the lives of people and prevent the damage caused by earthquakes, and \nnoting the need for policies and focused action to understand and address disaster \nrisk, strengthen disaster risk governance to manage disaster risk, invest in disaster \nrisk reduction for resilience and enhance disaster preparedness for effective response \nand to build back better in recovery, rehabilitation and reconstruction through people-\ncentred, resilient, sustainable and inclusive recovery approaches that leave no one \nbehind, \n \nNoting the importance of the prompt dissemination of information through early \nwarning systems, and promoting the incorporation of earthquake risk knowledge, \nincluding preparedness, response, recovery and rehabilitation, in formal and \nnon\u2011formal education, as well as in civic education at all levels and in professional \neducation and training, and of raising awareness and creating a culture of disaster \nprevention, resilience and responsible citizenship to foster all-of-society engagement \nin disaster risk reduction, \n \nNoting with appreciation the important contribution made by humanitarian \norganizations and international urban search and rescue teams in the aftermath of \nearthquakes and other events resulting in structural collapse, which has helped to \nreduce loss of life and human suffering, \n\nInternational Day in Memory of the Victims of Earthquakes \nA/RES/79/285\n \n3/3\n25-06950 \n \n \nNoting with appreciation also the important contribution of the International \nSearch and Rescue Advisory Group to improve the efficiency and the effectiveness \nof international urban search and rescue assistance, supported by the Office for the \nCoordination of Humanitarian Affairs of the Secretariat, in line with General \nAssembly resolution 57/150, \n \nReiterating the pledge that no one will be left behind, reaffirming the \nrecognition that the dignity of the human person is fundamental, and the wish to see \nthe Goals and targets met for all nations and peoples and for all segments of society, \nand recommitting to endeavour to reach the furthest behind first, \n \nExpressing solidarity with all countries and peoples affected by earthquakes,  \n \n1. \nDecides to proclaim 29 April as the International Day in Memory of the \nVictims of Earthquakes, to be observed annually; \n \n2. \nInvites all Member States, organizations of the United Nations system and \nother relevant international organizations to collaborate on the commemoration of the \nInternational Day in Memory of the Victims of Earthquakes with other competent \norganizations \nand \nstakeholders, \ncivil \nsociety, \nincluding \nnon\u2011governmental \norganizations, as well as the private sector, local authorities, Indigenous Peoples and \nlocal communities, as appropriate, including through activities aimed at education \nand awareness-raising of the importance of strengthening resilience and increasing \npreparedness for response and recovery; \n \n3. \nInvites the United Nations Office for Disaster Risk Reduction to facilitate \nthe observance of the International Day, mindful of the provisions contained in the \nannex to Economic and Social Council resolution 1980/67; \n \n4. \nStresses that the cost of all activities that may arise from the \nimplementation of the present resolution should be met from voluntary contributions \nand that such activities would be subject to the availability and provision of voluntary \ncontributions; \n \n5. \nRequests the Secretary-General to bring the present resolution to the \nattention of all Member States, the organizations of the United Nations system and \ncivil society organizations for appropriate observance. \n \n67th plenary meeting \n29 April 2025 \n \n",
  "paragraphs": {
    "1": "Decides to proclaim 29 April as the International Day in Memory of the Victims of Earthquakes, to be observed annually;",
    "2": "Invites all Member States, organizations of the United Nations system and other relevant international organizations to collaborate on the commemoration of the International Day in Memory of the Victims of Earthquakes with other competent organizations and stakeholders, civil society, including non\u2011governmental organizations, as well as the private sector, local authorities, Indigenous Peoples and local communities, as appropriate, including through activities aimed at education and awareness-raising of the importance of strengthening resilience and increasing preparedness for response and recovery;",
    "3": "Invites the United Nations Office for Disaster Risk Reduction to facilitate the observance of the International Day, mindful of the provisions contained in the annex to Economic and Social Council resolution 1980/67;",
    "4": "Stresses that the cost of all activities that may arise from the implementation of the present resolution should be met from voluntary contributions and that such activities would be subject to the availability and provision of voluntary contributions;",
    "5": "Requests the Secretary-General to bring the present resolution to the attention of all Member States, the organizations of the United Nations system and civil society organizations for appropriate observance."
  },
  "agenda_items": [
    "Item 13"
  ],
  "symbol_references": [
    "A/79/L.76"
  ]
}