{
  "symbol": "A/RES/74/286",
  "filename": "A_RES_74_286.pdf",
  "title": "74/286. Financing of the United Nations Organization Stabilization Mission in the Democratic Republic of the Congo",
  "text": "United Nations \nA/RES/74/286\n \n \nGeneral Assembly \nDistr.: General \n14 July 2020 \n \n \n20-08794 (E)     \n*2008794* \n \n \nSeventy-fourth session \nAgenda item 153 \nFinancing of the United Nations Organization Stabilization \nMission in the Democratic Republic of the Congo \n \n \n \n \n Resolution adopted by the General Assembly \non 30 June 2020 \n \n \n \n \n[on the report of the Fifth Committee (A/74/914)] \n \n \n 74/286. Financing of the United Nations Organization Stabilization \nMission in the Democratic Republic of the Congo \n \n \n \nThe General Assembly, \n \nHaving considered the reports of the Secretary-General on the financing of the \nUnited Nations Organization Stabilization Mission in the Democratic Republic of the \nCongo1 and the related report of the Advisory Committee on Administrative and \nBudgetary Questions,2  \n \nRecalling Security Council resolution 1925 (2010) of 28 May 2010, by which \nthe Council decided that, as from 1 July 2010, the United Nations Organization \nMission in the Democratic Republic of the Congo would bear the title \u201cUnited \nNations Organization Stabilization Mission in the Democratic Republic of the \nCongo\u201d, and recalling also the subsequent resolutions by which the Council extended \nthe mandate of the Mission, the latest of which was resolution 2502 (2019) of \n19 December 2019, by which the Council extended the mandate of the Mission until \n20 December 2020, \n \nRecalling also its resolution 54/260 A of 7 April 2000 on the financing of the \nMission and its subsequent resolutions thereon, the latest of which was resolution \n73/315 of 3 July 2019, as well as its decision 73/555 of 3 July 2019, \n \nRecalling further its resolution 58/315 of 1 July 2004, \n \nReaffirming the general principles underlying the financing of United Nations \npeacekeeping operations, as stated in its resolutions 1874 (S-IV) of 27 June 1963, \n3101 (XXVIII) of 11 December 1973 and 55/235 of 23 December 2000, \n__________________ \n \n1  A/74/617 and A/74/738. \n \n2  A/74/737/Add.12. \n\nA/RES/74/286 \nFinancing of the United Nations Organization Stabilization Mission \nin the Democratic Republic of the Congo\n \n20-08794\n2/6 \n \n \nNoting with appreciation that voluntary contributions have been made to the \nMission, \n \nMindful of the fact that it is essential to provide the Mission with the financial \nresources necessary to enable it to fulfil its responsibilities under the relevant \nresolutions of the Security Council, \n \n1. \nRequests the Secretary General to entrust the Head of Mission with the \ntask of formulating future budget proposals in full accordance with the provisions of \nits resolutions 59/296 of 22 June 2005, 60/266 of 30 June 2006, 61/276 of 29 June \n2007, 64/269 of 24 June 2010, 65/289 of 30 June 2011, 66/264 of 21 June 2012, \n69/307 of 25 June 2015 and 70/286 of 17 June 2016, as well as other relevant \nresolutions; \n \n2. \nTakes note of the status of contributions to the United Nations \nOrganization Stabilization Mission in the Democratic Republic of the Congo as at \n30 April 2020, including the contributions outstanding in the amount of \n266,482,094 United States dollars, representing some 1.2 per cent of the total \nassessed contributions, notes with concern that only 79 Member States have paid their \nassessed contributions in full, and urges all other Member States, in particular those \nin arrears, to ensure payment of their outstanding assessed contributions; \n \n3. \nExpresses its appreciation to those Member States that have paid their \nassessed contributions in full, and urges all other Member States to make every \npossible effort to ensure payment of their assessed contributions to the Mission in full; \n \n4. \nExpresses concern at the financial situation with regard to peacekeeping \nactivities, in particular as regards the reimbursements to troop contributors that bear \nadditional burdens owing to overdue payments by Member States of their \nassessments; \n \n5. \nEmphasizes that all future and existing peacekeeping missions shall be \ngiven equal and non-discriminatory treatment in respect of financial and \nadministrative arrangements; \n \n6. \nAlso emphasizes that all peacekeeping missions shall be provided with \nadequate resources for the effective and efficient discharge of their respective \nmandates; \n \n7. \nRequests the Secretary-General to ensure that proposed peacekeeping \nbudgets are based on the relevant legislative mandates; \n \n8. \nEndorses the conclusions and recommendations contained in the report of \nthe Advisory Committee on Administrative and Budgetary Questions, 2 subject to the \nprovisions of the present resolution, and requests the Secretary-General to ensure \ntheir full implementation; \n \n9. \nRequests the Secretary-General to establish clear frameworks and \nguidelines to determine the solicitation procedure, whether invitation to bid or request \nfor proposal, to be utilized for, inter alia, acquiring different types of goods and \nservices, including aviation services, and to update the United Nations Procurement \nManual accordingly; \n \n10. Also requests the Secretary-General to take measures to ensure that the \nOrganization conforms to best practices in public procurement with respect to \ntransparency, including by placing additional information in the public domain on the \noutcome of procurement exercises conducted, including in the area of aviation \nservices, so as to further increase the transparency of the procurement operations of \nthe Organization, and to update the United Nations Procurement Manual accordingly; \n\nFinancing of the United Nations Organization Stabilization Mission \nin the Democratic Republic of the Congo \nA/RES/74/286\n \n3/6\n20-08794 \n \n \n11. \nNotes the ongoing development of impact-based performance indicators \nas part of the implementation of the Comprehensive Performance Assessment System, \nand in this regard requests the Secretary-General in his next report to provide \ninformation on how the indicators will measure the performance by the Mission of \nmandated tasks and the impact of resource allocation on that performance, as well as \nhow the indicators will contribute to the identification of the resources required for \neach mandated task; \n \n12. Requests the Secretary-General to provide in his next report an execution \nplan for, and analysis of, the implementation of the new Comprehensive Performance \nAssessment System, including on its correlation with mission planning and budget \nformulation, in order to facilitate consideration by the General Assembly of resource \nrequests for implementation of the System; \n \n13. Emphasizes the importance of the accountability system of the Secretariat, \nand requests the Secretary-General to continue to strengthen risk management and \ninternal controls in the management of peacekeeping budgets, in order to facilitate \nmandate implementation and increase transparency, and to report thereon in his next \nreport; \n \n14. Also emphasizes the importance of overall budgetary performance in \npeacekeeping operations, and requests the Secretary-General to continue to \nimplement the recommendations of the relevant oversight bodies, while giving due \nregard to the guidance and recommendations of the General Assembly, and to report \nthereon in the context of the performance reports; \n \n15. Notes with grave concern the threat to life, health, safety and security \ncaused by the coronavirus disease (COVID-19) pandemic and the importance of \nensuring the safety, security and health of peacekeeping personnel, maintaining the \ncontinuity of critical mandate delivery, including protection of civilians, minimizing \nthe risk of mission activities causing the virus to spread and, where appropriate and \nwithin mandates, supporting national authorities, upon their request, in their response \nto COVID-19, in collaboration with the Resident Coordinator and other United \nNations entities in the country; \n \n16. Requests the Secretary-General to include in his next performance report \ninformation on how the Mission has responded and on lessons learned from past and \npresent epidemics and pandemics, and to propose options for improving future \npreparedness for epidemics and pandemics, including for business continuity; \n \n17. Notes the progress made in the implementation of the multi-year \nenvironmental strategy to reduce the footprint of peacekeeping operations, and \nrequests the Secretary-General to enhance measures for the implementation of the \nstrategy in all peacekeeping missions, in line with the five pillars of the strategy, in \naccordance with particular conditions on the ground and in full compliance with the \nrelevant rules and regulations, and to report thereon in the context of his next \noverview report; \n \n18. Underlines the important contribution that programmatic activities make \nto the implementation of the mandates of the Mission, including for the prevention \nand resolution of conflicts, and that all such activities must be directly linked to the \nmandates of the Mission; \n \n19. Requests the Secretary-General to ensure that the Mission is responsible \nand accountable for the use of its programmatic funds, in line with relevant guidance \nand bearing in mind the specific context in which the Mission operates, and to include, \nin his next budget submission and performance report, detailed information on the \nprogrammatic activities of the Mission, including on how those activities have \ncontributed to the implementation of mission mandates, on the linkage to the \n\nA/RES/74/286 \nFinancing of the United Nations Organization Stabilization Mission \nin the Democratic Republic of the Congo\n \n20-08794\n4/6 \n \nmandates, on the implementing entities and on the performance by the Mission of \nappropriate oversight; \n \n20. Expresses concern over the allegations of sexual exploitation and abuse \nreported in peacekeeping missions, and requests the Secretary-General to continue to \nimplement his zero-tolerance policy on sexual exploitation and abuse with regard to \nall civilian, military and police personnel, and to report thereon in the context of his \nnext report on cross-cutting issues; \n \n21. Requests the \nSecretary-General to ensure \nthat United \nNations \npeacekeeping mission staff has the capacity to provide technical oversight of the use \nof unmanned aerial and aircraft systems technologies; \n \n22. Recognizes the increasing security challenges faced by United Nations \npeacekeepers, reaffirms its commitment to the improvement of the safety and security \nof Mission personnel, in particular uniformed personnel, and requests the Secretary-\nGeneral to further strengthen the measures in this regard and to report thereon to the \nGeneral Assembly in the context of the next budget submission for the Mission; \n \n23. Reaffirms the provisions of section XVIII of its resolution 61/276, further \nrecognizes the important role played by quick-impact projects in supporting the \nimplementation of mission mandates, stresses the need for the timely, responsible and \naccountable implementation of all such projects, and requests the Secretary-General \nto enhance their impact while addressing underlying challenges; \n \n24. Requests the Secretary-General to consider options for greater \nnationalization of functions when formulating budget submissions, commensurate \nwith mission mandates and requirements; \n \n25. Reiterates its concern about the high number of vacancies in civilian \nstaffing, and further reiterates its request to the Secretary-General to ensure that \nvacant posts are filled expeditiously; \n \n26. Requests the Secretary-General to ensure that vacant posts are filled \nexpeditiously, and decides not to abolish the posts that have been vacant for 24 months \nor longer during the current budget period, except for those in paragraph 27; \n \n27. Decides to abolish the following National Professional Officer posts: one \npost of Associate Security Coordination Officer, one post of Medical Officer, one post \nof Assistant Engineer, one post of Assistant Finance and Budget Officer, one post of \nAssistant Supply Officer and one post of Associate Disarmament, Demobilization and \nReintegration Officer; \n \n28. Requests the Secretary-General to review the posts that have been vacant \nfor 24 months or longer and to propose in his next budget submission either their \nretention, with clear justification of need, or their abolishment; \n \n29. Also requests the Secretary-General to conduct a comparative assessment \nof the services provided by respective entities for mine action activities and to provide \nthe results in the context of his next report; \n \n30. Recognizes the important role played by regional and subregional actors \nfor peacekeeping operations, and in this regard encourages the Secretary-General to \ndeepen the partnership, cooperation and coordination of the United Nations with \nregional and subregional actors, in accordance with relevant mandates, and to provide \ninformation on such deepened engagement in the context of his next report; \n \n31. Requests the Secretary-General to ensure the full implementation of the \nrelevant provisions of its resolutions 59/296, 60/266, 61/276, 64/269, 65/289, 66/264, \n69/307 and 70/286; \n\nFinancing of the United Nations Organization Stabilization Mission \nin the Democratic Republic of the Congo \nA/RES/74/286\n \n5/6\n20-08794 \n \n \n32. Also requests the Secretary-General to take all action necessary to ensure \nthat the Mission is administered with a maximum of efficiency and economy;  \n \n \n \nBudget performance report for the period from 1 July 2018 to 30 June 2019 \n \n \n33. Takes note of the report of the Secretary-General on the budget \nperformance of the Mission for the period from 1 July 2018 to 30 June 2019; 3  \n \n34. Decides to reduce the commitment authority in the amount of \n80,000,000 dollars, previously approved for the same period under the terms of its \nresolution 72/293 of 5 July 2018, as well as its decision 72/558 of 5 July 2018, by the \namount of 62,300 dollars to the amount of 79,937,700 dollars, as a result of which the \ntotal resources approved for the maintenance and operation of the Mission for \nthe period will amount to 1,194,557,200 dollars, equal to the expenditure incurred by \nthe Mission during the period; \n \n35. Also decides to appropriate to the special account for the United Nations \nOrganization Stabilization Mission in the Democratic Republic of the Congo an \nadditional amount of 79,937,700 dollars for the period from 1 July 2018 to 30 June \n2019 for the maintenance of the Mission, taking into account the amount of \n1,114,619,500 dollars previously approved for the Mission under the terms of its \nresolution 72/293, as well as its decision 72/558; \n \n \n \nFinancing of the additional appropriation for the period from 1 July 2018  \nto 30 June 2019 \n \n \n36. Decides \nto \napportion \namong \nMember \nStates \nthe \namount \nof \n64,956,800 dollars, \nrepresenting \nthe \ndifference \nbetween \nthe \namount \nof \n1,114,619,500 dollars already appropriated under the terms of resolution 72/293 and \ndecision 72/558 for the maintenance of the Mission and the actual expenditure of \n1,194,557,200 dollars for the period from 1 July 2018 to 30 June 2019, less the \namount of 14,980,900 dollars, representing other revenue in respect of the financial \nperiod ended 30 June 2019, in accordance with the levels updated in its resolution \n70/246 of 23 December 2015 and 73/272 of 22 December 2018, taking into account \nthe scale of assessments for 2018, as set out in its resolution 70/245 of 23 December \n2015, and for 2019, as set out in its resolution 73/271 of 22 December 2018; \n \n37. Also decides that, in accordance with the provisions of its resolution 973 (X) \nof 15 December 1955, there shall be set off against the apportionment among Member \nStates, as provided for in paragraph 36 above, their respective share in the Tax \nEqualization Fund of 3,362,900 dollars, representing the increase in the estimated \nstaff assessment income for the Mission in respect of the financial periods ended \n30 June 2018 and 30 June 2019; \n \n \n \nBudget estimates for the period from 1 July 2020 to 30 June 2021 \n \n \n38. Decides to appropriate to the special account the amount of 1,154,140,500 \ndollars for the period from 1 July 2020 to 30 June 2021, inclusive of 1,075,338,600 \ndollars for the maintenance of the Mission, 61,467,500 dollars for the support account \nfor peacekeeping operations, 10,361,300 dollars for the United Nations Logistics \nBase at Brindisi, Italy, and 6,973,100 dollars for the Regional Service Centre in \nEntebbe, Uganda; \n \n__________________ \n \n3  A/74/617. \n\nA/RES/74/286 \nFinancing of the United Nations Organization Stabilization Mission \nin the Democratic Republic of the Congo\n \n20-08794\n6/6 \n \n \n \nFinancing of the appropriation for the period from 1 July 2020 to 30 June 2021 \n \n \n39. Decides \nto \napportion \namong \nMember \nStates \nthe \namount \nof \n547,030,977 dollars for the period from 1 July to 20 December 2020, in accordance \nwith the levels updated in its resolution 73/272, taking into account the scale of \nassessments for 2020, as set out in its resolution 73/271; \n \n40. Also decides that, in accordance with the provisions of its resolution 973 (X), \nthere shall be set off against the apportionment among Member States, as provided \nfor in paragraph 39 above, their respective share in the Tax Equalization Fund of \n15,675,791 dollars, comprising the estimated staff assessment income of \n12,510,128 dollars approved for the Mission, the prorated share of 2,341,567 dollars \nof the estimated staff assessment income approved for the support account, the \nprorated share of 478,238 dollars of the estimated staff assessment income approved \nfor the United Nations Logistics Base and the prorated share of 345,858 dollars of the \nestimated staff assessment income approved for the Regional Service Centre; \n \n41. Further decides to apportion among Member States the amount of \n607,109,523 dollars for the period from 21 December 2020 to 30 June 2021, at a \nmonthly rate of 96,178,375 dollars, in accordance with the levels updated in its \nresolution 73/272, taking into account the scale of assessments for 2020 and 2021, as \nset out in its resolution 73/271, subject to a decision of the Security Council to extend \nthe mandate of the Mission; \n \n42. Decides that, in accordance with the provisions of its resolution 973 (X), \nthere shall be set off against the apportionment among Member States, as provided \nfor in paragraph 41 above, their respective share in the Tax Equalization Fund of \n17,397,409 dollars, comprising the estimated staff assessment income of \n13,884,072 dollars approved for the Mission, the prorated share of 2,598,733 dollars \nof the estimated staff assessment income approved for the support account, the \nprorated share of 530,762 dollars of the estimated staff assessment income approved \nfor the United Nations Logistics Base and the prorated share of 383,842 dollars of the \nestimated staff assessment income approved for the Regional Service Centre; \n \n43. Encourages the Secretary-General to continue to take additional measures \nto ensure the safety and security of all personnel participating in the Mission under \nthe auspices of the United Nations, bearing in mind paragraphs 5 and 6 of Security \nCouncil resolution 1502 (2003) of 26 August 2003; \n \n44. Invites voluntary contributions to the Mission in cash and in the form of \nservices and supplies acceptable to the Secretary-General, to be administered, as \nappropriate, in accordance with the procedure and practices established by the \nGeneral Assembly; \n \n45. Decides to include in the provisional agenda of its seventy-fifth session \nthe item entitled \u201cFinancing of the United Nations Organization Stabilization Mission \nin the Democratic Republic of the Congo\u201d.  \n \n30 June 2020 \n \n",
  "paragraphs": {
    "1": "Requests the Secretary General to entrust the Head of Mission with the task of formulating future budget proposals in full accordance with the provisions of its resolutions 59/296 of 22 June 2005, 60/266 of 30 June 2006, 61/276 of 29 June 2007, 64/269 of 24 June 2010, 65/289 of 30 June 2011, 66/264 of 21 June 2012, 69/307 of 25 June 2015 and 70/286 of 17 June 2016, as well as other relevant resolutions;",
    "2": "Takes note of the status of contributions to the United Nations Organization Stabilization Mission in the Democratic Republic of the Congo as at 30 April 2020, including the contributions outstanding in the amount of 266,482,094 United States dollars, representing some 1.2 per cent of the total assessed contributions, notes with concern that only 79 Member States have paid their assessed contributions in full, and urges all other Member States, in particular those in arrears, to ensure payment of their outstanding assessed contributions;",
    "3": "Expresses its appreciation to those Member States that have paid their assessed contributions in full, and urges all other Member States to make every possible effort to ensure payment of their assessed contributions to the Mission in full;",
    "4": "Expresses concern at the financial situation with regard to peacekeeping activities, in particular as regards the reimbursements to troop contributors that bear additional burdens owing to overdue payments by Member States of their assessments;",
    "5": "Emphasizes that all future and existing peacekeeping missions shall be given equal and non-discriminatory treatment in respect of financial and administrative arrangements;",
    "6": "Also emphasizes that all peacekeeping missions shall be provided with adequate resources for the effective and efficient discharge of their respective mandates;",
    "7": "Requests the Secretary-General to ensure that proposed peacekeeping budgets are based on the relevant legislative mandates;",
    "8": "Endorses the conclusions and recommendations contained in the report of the Advisory Committee on Administrative and Budgetary Questions, 2 subject to the provisions of the present resolution, and requests the Secretary-General to ensure their full implementation;",
    "9": "Requests the Secretary-General to establish clear frameworks and guidelines to determine the solicitation procedure, whether invitation to bid or request for proposal, to be utilized for, inter alia, acquiring different types of goods and services, including aviation services, and to update the United Nations Procurement Manual accordingly;",
    "10": "Also requests the Secretary-General to take measures to ensure that the Organization conforms to best practices in public procurement with respect to transparency, including by placing additional information in the public domain on the outcome of procurement exercises conducted, including in the area of aviation services, so as to further increase the transparency of the procurement operations of the Organization, and to update the United Nations Procurement Manual accordingly; Financing of the United Nations Organization Stabilization Mission in the Democratic Republic of the Congo A/RES/74/286 3/6 20-08794",
    "11": "Notes the ongoing development of impact-based performance indicators as part of the implementation of the Comprehensive Performance Assessment System, and in this regard requests the Secretary-General in his next report to provide information on how the indicators will measure the performance by the Mission of mandated tasks and the impact of resource allocation on that performance, as well as how the indicators will contribute to the identification of the resources required for each mandated task;",
    "12": "Requests the Secretary-General to provide in his next report an execution plan for, and analysis of, the implementation of the new Comprehensive Performance Assessment System, including on its correlation with mission planning and budget formulation, in order to facilitate consideration by the General Assembly of resource requests for implementation of the System;",
    "13": "Emphasizes the importance of the accountability system of the Secretariat, and requests the Secretary-General to continue to strengthen risk management and internal controls in the management of peacekeeping budgets, in order to facilitate mandate implementation and increase transparency, and to report thereon in his next report;",
    "14": "Also emphasizes the importance of overall budgetary performance in peacekeeping operations, and requests the Secretary-General to continue to implement the recommendations of the relevant oversight bodies, while giving due regard to the guidance and recommendations of the General Assembly, and to report thereon in the context of the performance reports;",
    "15": "Notes with grave concern the threat to life, health, safety and security caused by the coronavirus disease (COVID-19) pandemic and the importance of ensuring the safety, security and health of peacekeeping personnel, maintaining the continuity of critical mandate delivery, including protection of civilians, minimizing the risk of mission activities causing the virus to spread and, where appropriate and within mandates, supporting national authorities, upon their request, in their response to COVID-19, in collaboration with the Resident Coordinator and other United Nations entities in the country;",
    "16": "Requests the Secretary-General to include in his next performance report information on how the Mission has responded and on lessons learned from past and present epidemics and pandemics, and to propose options for improving future preparedness for epidemics and pandemics, including for business continuity;",
    "17": "Notes the progress made in the implementation of the multi-year environmental strategy to reduce the footprint of peacekeeping operations, and requests the Secretary-General to enhance measures for the implementation of the strategy in all peacekeeping missions, in line with the five pillars of the strategy, in accordance with particular conditions on the ground and in full compliance with the relevant rules and regulations, and to report thereon in the context of his next overview report;",
    "18": "Underlines the important contribution that programmatic activities make to the implementation of the mandates of the Mission, including for the prevention and resolution of conflicts, and that all such activities must be directly linked to the mandates of the Mission;",
    "19": "Requests the Secretary-General to ensure that the Mission is responsible and accountable for the use of its programmatic funds, in line with relevant guidance and bearing in mind the specific context in which the Mission operates, and to include, in his next budget submission and performance report, detailed information on the programmatic activities of the Mission, including on how those activities have contributed to the implementation of mission mandates, on the linkage to the A/RES/74/286 Financing of the United Nations Organization Stabilization Mission in the Democratic Republic of the Congo 20-08794 4/6 mandates, on the implementing entities and on the performance by the Mission of appropriate oversight;",
    "20": "Expresses concern over the allegations of sexual exploitation and abuse reported in peacekeeping missions, and requests the Secretary-General to continue to implement his zero-tolerance policy on sexual exploitation and abuse with regard to all civilian, military and police personnel, and to report thereon in the context of his next report on cross-cutting issues;",
    "21": "Requests the Secretary-General to ensure that United Nations peacekeeping mission staff has the capacity to provide technical oversight of the use of unmanned aerial and aircraft systems technologies;",
    "22": "Recognizes the increasing security challenges faced by United Nations peacekeepers, reaffirms its commitment to the improvement of the safety and security of Mission personnel, in particular uniformed personnel, and requests the Secretary- General to further strengthen the measures in this regard and to report thereon to the General Assembly in the context of the next budget submission for the Mission;",
    "23": "Reaffirms the provisions of section XVIII of its resolution 61/276, further recognizes the important role played by quick-impact projects in supporting the implementation of mission mandates, stresses the need for the timely, responsible and accountable implementation of all such projects, and requests the Secretary-General to enhance their impact while addressing underlying challenges;",
    "24": "Requests the Secretary-General to consider options for greater nationalization of functions when formulating budget submissions, commensurate with mission mandates and requirements;",
    "25": "Reiterates its concern about the high number of vacancies in civilian staffing, and further reiterates its request to the Secretary-General to ensure that vacant posts are filled expeditiously;",
    "26": "Requests the Secretary-General to ensure that vacant posts are filled expeditiously, and decides not to abolish the posts that have been vacant for 24 months or longer during the current budget period, except for those in paragraph 27;",
    "27": "Decides to abolish the following National Professional Officer posts: one post of Associate Security Coordination Officer, one post of Medical Officer, one post of Assistant Engineer, one post of Assistant Finance and Budget Officer, one post of Assistant Supply Officer and one post of Associate Disarmament, Demobilization and Reintegration Officer;",
    "28": "Requests the Secretary-General to review the posts that have been vacant for 24 months or longer and to propose in his next budget submission either their retention, with clear justification of need, or their abolishment;",
    "29": "Also requests the Secretary-General to conduct a comparative assessment of the services provided by respective entities for mine action activities and to provide the results in the context of his next report;",
    "30": "Recognizes the important role played by regional and subregional actors for peacekeeping operations, and in this regard encourages the Secretary-General to deepen the partnership, cooperation and coordination of the United Nations with regional and subregional actors, in accordance with relevant mandates, and to provide information on such deepened engagement in the context of his next report;",
    "31": "Requests the Secretary-General to ensure the full implementation of the relevant provisions of its resolutions 59/296, 60/266, 61/276, 64/269, 65/289, 66/264, 69/307 and 70/286; Financing of the United Nations Organization Stabilization Mission in the Democratic Republic of the Congo A/RES/74/286 5/6 20-08794",
    "32": "Also requests the Secretary-General to take all action necessary to ensure that the Mission is administered with a maximum of efficiency and economy; Budget performance report for the period from 1 July 2018 to 30 June 2019",
    "33": "Takes note of the report of the Secretary-General on the budget performance of the Mission for the period from 1 July 2018 to 30 June 2019; 3",
    "34": "Decides to reduce the commitment authority in the amount of 80,000,000 dollars, previously approved for the same period under the terms of its resolution 72/293 of 5 July 2018, as well as its decision 72/558 of 5 July 2018, by the amount of 62,300 dollars to the amount of 79,937,700 dollars, as a result of which the total resources approved for the maintenance and operation of the Mission for the period will amount to 1,194,557,200 dollars, equal to the expenditure incurred by the Mission during the period;",
    "35": "Also decides to appropriate to the special account for the United Nations Organization Stabilization Mission in the Democratic Republic of the Congo an additional amount of 79,937,700 dollars for the period from 1 July 2018 to 30 June 2019 for the maintenance of the Mission, taking into account the amount of 1,114,619,500 dollars previously approved for the Mission under the terms of its resolution 72/293, as well as its decision 72/558; Financing of the additional appropriation for the period from 1 July 2018 to 30 June 2019",
    "36": "Decides to apportion among Member States the amount of 64,956,800 dollars, representing the difference between the amount of 1,114,619,500 dollars already appropriated under the terms of resolution 72/293 and decision 72/558 for the maintenance of the Mission and the actual expenditure of 1,194,557,200 dollars for the period from 1 July 2018 to 30 June 2019, less the amount of 14,980,900 dollars, representing other revenue in respect of the financial period ended 30 June 2019, in accordance with the levels updated in its resolution 70/246 of 23 December 2015 and 73/272 of 22 December 2018, taking into account the scale of assessments for 2018, as set out in its resolution 70/245 of 23 December 2015, and for 2019, as set out in its resolution 73/271 of 22 December 2018;",
    "37": "Also decides that, in accordance with the provisions of its resolution 973 (X) of 15 December 1955, there shall be set off against the apportionment among Member States, as provided for in paragraph 36 above, their respective share in the Tax Equalization Fund of 3,362,900 dollars, representing the increase in the estimated staff assessment income for the Mission in respect of the financial periods ended 30 June 2018 and 30 June 2019; Budget estimates for the period from 1 July 2020 to 30 June 2021",
    "38": "Decides to appropriate to the special account the amount of 1,154,140,500 dollars for the period from 1 July 2020 to 30 June 2021, inclusive of 1,075,338,600 dollars for the maintenance of the Mission, 61,467,500 dollars for the support account for peacekeeping operations, 10,361,300 dollars for the United Nations Logistics Base at Brindisi, Italy, and 6,973,100 dollars for the Regional Service Centre in Entebbe, Uganda; __________________ 3 A/74/617. A/RES/74/286 Financing of the United Nations Organization Stabilization Mission in the Democratic Republic of the Congo 20-08794 6/6 Financing of the appropriation for the period from 1 July 2020 to 30 June 2021",
    "39": "Decides to apportion among Member States the amount of 547,030,977 dollars for the period from 1 July to 20 December 2020, in accordance with the levels updated in its resolution 73/272, taking into account the scale of assessments for 2020, as set out in its resolution 73/271;",
    "40": "Also decides that, in accordance with the provisions of its resolution 973 (X), there shall be set off against the apportionment among Member States, as provided for in paragraph 39 above, their respective share in the Tax Equalization Fund of 15,675,791 dollars, comprising the estimated staff assessment income of 12,510,128 dollars approved for the Mission, the prorated share of 2,341,567 dollars of the estimated staff assessment income approved for the support account, the prorated share of 478,238 dollars of the estimated staff assessment income approved for the United Nations Logistics Base and the prorated share of 345,858 dollars of the estimated staff assessment income approved for the Regional Service Centre;",
    "41": "Further decides to apportion among Member States the amount of 607,109,523 dollars for the period from 21 December 2020 to 30 June 2021, at a monthly rate of 96,178,375 dollars, in accordance with the levels updated in its resolution 73/272, taking into account the scale of assessments for 2020 and 2021, as set out in its resolution 73/271, subject to a decision of the Security Council to extend the mandate of the Mission;",
    "42": "Decides that, in accordance with the provisions of its resolution 973 (X), there shall be set off against the apportionment among Member States, as provided for in paragraph 41 above, their respective share in the Tax Equalization Fund of 17,397,409 dollars, comprising the estimated staff assessment income of 13,884,072 dollars approved for the Mission, the prorated share of 2,598,733 dollars of the estimated staff assessment income approved for the support account, the prorated share of 530,762 dollars of the estimated staff assessment income approved for the United Nations Logistics Base and the prorated share of 383,842 dollars of the estimated staff assessment income approved for the Regional Service Centre;",
    "43": "Encourages the Secretary-General to continue to take additional measures to ensure the safety and security of all personnel participating in the Mission under the auspices of the United Nations, bearing in mind paragraphs 5 and 6 of Security Council resolution 1502 (2003) of 26 August 2003;",
    "44": "Invites voluntary contributions to the Mission in cash and in the form of services and supplies acceptable to the Secretary-General, to be administered, as appropriate, in accordance with the procedure and practices established by the General Assembly;",
    "45": "Decides to include in the provisional agenda of its seventy-fifth session the item entitled \u201cFinancing of the United Nations Organization Stabilization Mission in the Democratic Republic of the Congo\u201d. 30 June 2020"
  },
  "agenda_items": [
    "Item 153"
  ],
  "symbol_references": []
}