{
  "symbol": "A/RES/72/306",
  "filename": "A_RES_72_306.pdf",
  "title": "72/306. Implementation of the United Nations Decade of Action on Nutrition (2016\u20132025)",
  "text": "United Nations \nA/RES/72/306\n \n \nGeneral Assembly \nDistr.: General \n25 July 2018 \n \n18-12294 (E)    270718     \n*1812294* \n \n \nSeventy-second session \nAgenda item 14 \n \n \n \n \n Resolution adopted by the General Assembly \non 24 July 2018 \n \n \n \n \n[without reference to a Main Committee (A/72/L.63 and A/72/L.63/Add.1)] \n \n \n 72/306. Implementation of the United Nations Decade of Action \non Nutrition (2016\u20132025) \n \n \n \nThe General Assembly, \n \nRecalling its resolution 70/259 of 1 April 2016, by which it proclaimed the \nperiod 2016\u20132025 the United Nations Decade of Action on Nutrition and endorsed \nthe Rome Declaration on Nutrition and the Framework for Action adopted at the \nSecond International Conference on Nutrition, jointly organized by the Food and \nAgriculture Organization of the United Nations and the World Health Organization, \nin Rome from 19 to 21 November 2014,1  \n \nEmphasizing the need to eradicate hunger and prevent all forms of malnutrition \nworldwide, particularly undernourishment, stunting, wasting, underweight and \noverweight in children under 5 years of age and anaemia in women and children, \namong other micronutrient deficiencies, as well as to reverse the rising trends in \noverweight and obesity and reduce the burden of diet-related non-communicable \ndiseases in all age groups,  \n \nReaffirming its resolution 70/1 of 25 September 2015, entitled \u201cTransforming \nour world: the 2030 Agenda for Sustainable Development\u201d, in which it adopted a \ncomprehensive, far-reaching and people-centred set of universal and transformative \nSustainable Development Goals and targets, its commitment to working tirelessly for \nthe full implementation of the Agenda by 2030, its recognition that eradicating \npoverty in all its forms and dimensions, including extreme poverty, is the greatest \nglobal challenge and an indispensable requirement for sustainable development, its \ncommitment to achieving sustainable development in its three dimensions \u2013 economic, \nsocial and environmental \u2013 in a balanced and integrated manner, and to building upon \nthe achievements of the Millennium Development Goals and seeking to address their \nunfinished business,  \n__________________ \n \n1  World Health Organization, document EB 136/8, annexes I and II. \n\nA/RES/72/306 \nImplementation of the United Nations Decade of Action on Nutrition (2016\u20132025)\n \n18-12294\n2/3 \n \n \nExpressing concern that the world is not on track to eradicate hunger and \nmalnutrition by 2030 and that, at the current pace, the targets of Sustainable \nDevelopment Goal 2 will not be achieved in many parts of the world, and calling for \nadditional efforts to support the transformational change needed, \n \nAcknowledging the importance of promoting sustainable farming and \nagriculture, which will contribute to sustainable food production systems and the \nconservation of biodiversity and ecosystems and help to eradicate hunger and \nmalnutrition,  \n \nExpressing concern that, at the global level, the number of undernourished \npeople has been on the rise since 2014, reaching an estimated 815 million in 2016,  \n \nRecognizing the important contribution that family farming and smallholder \nfarming can play in providing food security and eradicating poverty in the attainment \nof the Sustainable Development Goals,  \n \nRecognizing with concern that women are more likely to be food insecure than \nmen in every region of the world, that almost one third of women of reproductive age \nworldwide suffer from anaemia, a persistent problem that also puts the nutrition and \nhealth of many children at risk, that, despite considerable reduction in the global \nprevalence of stunting between 2005 and 2017, 150.8 million children under 5 years \nof age still suffer from stunted growth, and that wasting, undernutrition, overweight \nand obesity are recurrent problems for children in several countries,  \n \nRecalling the 2011 political declaration of the high-level meeting of the General \nAssembly on the prevention and control of non-communicable diseases2 and the 2014 \noutcome document of the high-level meeting of the Assembly on the comprehensive \nreview and assessment of the progress achieved in the prevention and control of \nnon-communicable diseases,3 and looking forward to the third high-level meeting of \nthe Assembly on the prevention and control of non-communicable diseases, to be held \nin 2018,  \n \n1. \nTakes note of the report of the Secretary-General;4  \n \n2. \nNotes the development of the work programme of the United Nations \nDecade of Action on Nutrition (2016\u20132025),5 as a living document developed through \nan inclusive, continuous and collaborative process, including the intention of \nconvening open and inclusive dialogues at midterm (2020/21) and at the end (2025) \nof the Decade, building upon and connecting initiatives of Governments and their \nmany partners;  \n \n3. \nRecognizes the commitments made by Governments, and acknowledges \nthe contributions by all relevant stakeholders at the national, regional and \ninternational levels, including United Nations organizations, civil society and the \nprivate sector, in advancing the implementation of the Decade; \n \n4. \nEncourages \nGovernments, \nUnited \nNations \norganizations, \nother \ninternational and regional organizations, civil society, the private sector and academia \nto make ambitious commitments with a view to intensifying their efforts and scaling \nup their activities under the work programme of the Decade; \n \n5. \nCalls upon the Food and Agriculture Organization of the United Nations \nand the World Health Organization to further strengthen their efforts in continuing to \nlead and monitor the implementation of the Decade, in collaboration with the World \n__________________ \n \n2  Resolution 66/2, annex. \n \n3  Resolution 68/300. \n \n4  A/72/829. \n \n5  Available at www.unscn.org/en/topics/un-decade-of-action-on-nutrition?idnews=1791. \n\nImplementation of the United Nations Decade of Action on Nutrition (2016\u20132025) \nA/RES/72/306\n \n3/3\n18-12294 \n \nFood Programme, the International Fund for Agricultural Development and the \nUnited Nations Children\u2019s Fund, using coordination mechanisms such as the Standing \nCommittee on Nutrition and multi-stakeholder platforms such as the Committee on \nWorld Food Security, in line with its mandate, and in consultation with other \ninternational and regional organizations and platforms;  \n \n6. \nRecalls its invitation to the Secretary-General to inform the General \nAssembly about the implementation of the Decade, on the basis of the biennial reports \njointly compiled by the Food and Agriculture Organization of the United Nations and \nthe World Health Organization. \n \n108th plenary meeting  \n24 July 2018 \n \n",
  "paragraphs": {
    "1": "Takes note of the report of the Secretary-General;4",
    "2": "Notes the development of the work programme of the United Nations Decade of Action on Nutrition (2016\u20132025),5 as a living document developed through an inclusive, continuous and collaborative process, including the intention of convening open and inclusive dialogues at midterm (2020/21) and at the end (2025) of the Decade, building upon and connecting initiatives of Governments and their many partners;",
    "3": "Recognizes the commitments made by Governments, and acknowledges the contributions by all relevant stakeholders at the national, regional and international levels, including United Nations organizations, civil society and the private sector, in advancing the implementation of the Decade;",
    "4": "Encourages Governments, United Nations organizations, other international and regional organizations, civil society, the private sector and academia to make ambitious commitments with a view to intensifying their efforts and scaling up their activities under the work programme of the Decade;",
    "5": "Calls upon the Food and Agriculture Organization of the United Nations and the World Health Organization to further strengthen their efforts in continuing to lead and monitor the implementation of the Decade, in collaboration with the World __________________ 2 Resolution 66/2, annex. 3 Resolution 68/300. 4 A/72/829. 5 Available at www.unscn.org/en/topics/un-decade-of-action-on-nutrition?idnews=1791. Implementation of the United Nations Decade of Action on Nutrition (2016\u20132025) A/RES/72/306 3/3 18-12294 Food Programme, the International Fund for Agricultural Development and the United Nations Children\u2019s Fund, using coordination mechanisms such as the Standing Committee on Nutrition and multi-stakeholder platforms such as the Committee on World Food Security, in line with its mandate, and in consultation with other international and regional organizations and platforms;",
    "6": "Recalls its invitation to the Secretary-General to inform the General Assembly about the implementation of the Decade, on the basis of the biennial reports jointly compiled by the Food and Agriculture Organization of the United Nations and the World Health Organization. 108th plenary meeting 24 July 2018"
  },
  "agenda_items": [
    "Item 14"
  ],
  "symbol_references": [
    "A/72/L.63"
  ]
}