{
  "symbol": "A/RES/74/41",
  "filename": "A_RES_74_41.pdf",
  "title": "74/41. Treaty on the Prohibition of Nuclear Weapons",
  "text": "United Nations \nA/RES/74/41\n \n \nGeneral Assembly \nDistr.: General \n19 December 2019 \n \n19-21742 (E)    231219 \n*1921742* \n \n \nSeventy-fourth session \nAgenda item 98 (ii) \nGeneral and complete disarmament: Treaty on the \nProhibition of Nuclear Weapons \n \n \n \n \n Resolution adopted by the General Assembly \non 12 December 2019 \n \n \n \n \n[on the report of the First Committee (A/74/368)] \n \n \n \n74/41. Treaty on the Prohibition of Nuclear Weapons \n \n \n \nThe General Assembly, \n \nRecalling its resolutions 72/31 of 4 December 2017 and 73/48 of 5 December 2018, \n \n1. \nWelcomes the adoption of the Treaty on the Prohibition of Nuclear \nWeapons1 on 7 July 2017; \n \n2. \nNotes that the Treaty has been open for signature at United Nations \nHeadquarters in New York since 20 September 2017; \n \n3. \nWelcomes that already 79 States had signed the Treaty and 33 States had \nratified or acceded to it as at 1 November 2019; \n \n4. \nCalls upon all States that have not yet done so to sign, ratify, accept, \napprove or accede to the Treaty at the earliest possible date; \n \n5. \nCalls upon those States in a position to do so to promote adherence to the \nTreaty through bilateral, subregional, regional and multilateral contacts, outreach and \nother means; \n \n6. \nRequests the Secretary-General, as depositary of the Treaty, to report to \nthe General Assembly at its seventy-fifth session on the status of signature and \nratification, acceptance, approval or accession of the Treaty; \n \n7. \nDecides to include in the provisional agenda of its seventy-fifth session, \nunder the item entitled \u201cGeneral and complete disarmament\u201d, the sub-item entitled \n\u201cTreaty on the Prohibition of Nuclear Weapons\u201d. \n \n46th plenary meeting \n12 December 2019 \n__________________ \n \n1  A/CONF.229/2017/8. \n",
  "paragraphs": {
    "1": "Welcomes the adoption of the Treaty on the Prohibition of Nuclear Weapons1 on 7 July 2017;",
    "2": "Notes that the Treaty has been open for signature at United Nations Headquarters in New York since 20 September 2017;",
    "3": "Welcomes that already 79 States had signed the Treaty and 33 States had ratified or acceded to it as at 1 November 2019;",
    "4": "Calls upon all States that have not yet done so to sign, ratify, accept, approve or accede to the Treaty at the earliest possible date;",
    "5": "Calls upon those States in a position to do so to promote adherence to the Treaty through bilateral, subregional, regional and multilateral contacts, outreach and other means;",
    "6": "Requests the Secretary-General, as depositary of the Treaty, to report to the General Assembly at its seventy-fifth session on the status of signature and ratification, acceptance, approval or accession of the Treaty;",
    "7": "Decides to include in the provisional agenda of its seventy-fifth session, under the item entitled \u201cGeneral and complete disarmament\u201d, the sub-item entitled \u201cTreaty on the Prohibition of Nuclear Weapons\u201d."
  },
  "agenda_items": [
    "Item 98"
  ],
  "symbol_references": []
}