{
  "symbol": "A/RES/75/298",
  "filename": "A_RES_75_298.pdf",
  "title": "75/298. Financing of the United Nations Multidimensional Integrated Stabilization Mission in the Central African Republic",
  "text": "United Nations \nA/RES/75/298\n \n \nGeneral Assembly \nDistr.: General \n7 July 2021 \n \n21-09012 (E)    080721 \n*2109012* \n \n \nSeventy-fifth session \nAgenda item 156 \nFinancing of the United Nations Multidimensional Integrated \nStabilization Mission in the Central African Republic \n \n \n \n \n Resolution adopted by the General Assembly \non 30 June 2021 \n \n \n \n \n[on the report of the Fifth Committee (A/75/938, para. 6)] \n \n \n 75/298. Financing of the United Nations Multidimensional Integrated \nStabilization Mission in the Central African Republic \n \n \n \nThe General Assembly, \n \nHaving considered the reports of the Secretary-General on the financing of the \nUnited Nations Multidimensional Integrated Stabilization Mission in the Central \nAfrican Republic,1 and the related report of the Advisory Committee on Administrative \nand Budgetary Questions,2  \n \nRecalling Security Council resolution 2149 (2014) of 10 April 2014, by which \nthe Council established the United Nations Multidimensional Integrated Stabilization \nMission in the Central African Republic as from 10 April 2014 for an initial period \nuntil 30 April 2015, and the subsequent resolutions by which the Council extended \nthe mandate of the Mission, the latest of which was resolution 2552 (2020) of \n12 November 2020, by which the Council extended the mandate of the Mission until \n15 November 2021,  \n \nRecalling also its resolution 68/299 of 30 June 2014 on the financing of the \nMission and its subsequent resolutions thereon, the latest of which was resolution \n74/284 of 30 June 2020, as well as its decision 74/571 of 3 September 2020, \n \nReaffirming the general principles underlying the financing of United Nations \npeacekeeping operations, as stated in its resolutions 1874 (S-IV) of 27 June 1963, \n3101 (XXVIII) of 11 December 1973 and 55/235 of 23 December 2000, \n \nMindful of the fact that it is essential to provide the Mission with the financial \nresources necessary to enable it to fulfil its responsibilities under the relevant \nresolutions of the Security Council, \n__________________ \n \n1  A/75/620, A/75/760 and A/75/760/Add.1. \n \n2  A/75/822/Add.7. \n\nA/RES/75/298 \nFinancing of the United Nations Multidimensional Integrated \nStabilization Mission in the Central African Republic\n \n21-09012\n2/8 \n \n \n1. \nRequests the Secretary-General to entrust the Head of Mission with the task \nof formulating future budget proposals in full accordance with the provisions of its \nresolutions 59/296 of 22 June 2005, 60/266 of 30 June 2006, 61/276 of 29 June 2007, \n64/269 of 24 June 2010, 65/289 of 30 June 2011, 66/264 of 21 June 2012, 69/307 of \n25 June 2015 and 70/286 of 17 June 2016, as well as other relevant resolutions; \n \n2. \nTakes note of the status of contributions to the United Nations \nMultidimensional Integrated Stabilization Mission in the Central African Republic as \nat 30 April 2021, including the contributions outstanding in the amount of \n200.4 million United States dollars, representing some 3.2 per cent of the total \nassessed contributions, notes with concern that only 99 Member States have paid their \nassessed contributions in full, and urges all other Member States, in particular those \nin arrears, to ensure payment of their outstanding assessed contributions;  \n \n3. \nExpresses its appreciation to those Member States that have paid their \nassessed contributions in full, and urges all other Member States to make every \npossible effort to ensure payment of their assessed contributions to the Mission in full; \n \n4. \nExpresses concern at the financial situation with regard to peacekeeping \nactivities, in particular as regards the reimbursements to troop contributors that bear \nadditional burdens owing to overdue payments by Member States of their \nassessments; \n \n5. \nEmphasizes that all future and existing peacekeeping missions shall be \ngiven equal and non-discriminatory treatment in respect of financial and \nadministrative arrangements; \n \n6. \nAlso emphasizes that all peacekeeping missions shall be provided with \nadequate resources for the effective and efficient discharge of their respective \nmandates;  \n \n7. \nRequests the Secretary-General to ensure that proposed peacekeeping \nbudgets are based on the relevant legislative mandates; \n \n8. \nEndorses the conclusions and recommendations contained in the report of \nthe Advisory Committee on Administrative and Budgetary Questions, subject to the \nprovisions of the present resolution, and requests the Secretary-General to ensure \ntheir full implementation; \n \n9. \nNotes with appreciation the support of the Government of the Central \nAfrican Republic in facilitating the work of the Mission;  \n \n10. Takes note of paragraph 35 of the report of the Advisory Committee, and \ndecides not to abolish one P-3 post of Security Coordination Officer;  \n \n11. Also takes note of paragraph 35 of the report of the Advisory Committee, \nand decides not to abolish the National Professional Officer post of Associate \nInformation Analyst, Political Affairs; \n \n12. Notes with concern the shortcomings in partnership operations between \nthe Mine Action Service and the United Nations Office for Project Services, and \nrequests the Secretary-General to conduct an independent review on the use of the \nservices of the Office and the partners selected to implement mine action activities, \nincluding an assessment of the comparative advantage of each mission in the delivery \nof those activities, and to submit the results of the analysis in the context of his report \nat the seventy-seventh session; \n \n13. Reiterates its grave concern about the continued threat to life, health, \nsafety and security caused by the coronavirus disease (COVID-19) pandemic and the \nimportance of ensuring the safety, security and health of peacekeeping personnel, \nincluding through the use of safe and effective vaccines for civilian and uniformed \n\nFinancing of the United Nations Multidimensional Integrated \nStabilization Mission in the Central African Republic \nA/RES/75/298\n \n3/8\n21-09012 \n \npersonnel, maintaining the continuity of mandate delivery, including protection of \ncivilians, minimizing the risk of mission activities causing the virus to spread and, \nwhere appropriate and within mandates, supporting national authorities, upon their \nrequest, in their response to COVID-19, in collaboration with the Resident \nCoordinator and other United Nations entities in the country; \n \n14. Notes the measures adopted to mitigate the effect of the COVID-19 \npandemic on peacekeeping operations, including facilitating the continued \nimplementation of mission mandates while ensuring the health and safety of \npeacekeeping personnel and local communities in the host country, and requests the \nSecretary-General to provide updated information on the impact of the pandemic, the \nlessons learned, best practices and how the mission improved its preparedness and \nresilience and collaborated with the host Government and regional and subregional \nactors in response to the pandemic in the context of the next performance report and \nbudget submission for the mission;  \n \n15. Notes with concern the mid- and long-term impact of the COVID-19 \npandemic on countries, regions and subregions in conflict, and emphasizes the \nimportance of United Nations peacekeeping operations, where appropriate and within \ntheir respective mandates, coordinating with national authorities and other United \nNations entities in promoting post-conflict reconstruction, peacebuilding and post-\npandemic recovery of countries and regions in conflict, especially those in Africa;  \n \n16. Recalls paragraphs 16 and 18 of its resolution 69/273 of 2 April 2015, and \nin this regard reiterates its request to the Secretary-General that he continue to explore \nadditional innovative ways to promote procurement from developing countries and \ncountries with economies in transition at Headquarters and field offices and to \nencourage interested local vendors to apply for registration on the Secretariat vendor \nroster, with a view to broadening its geographical base;  \n \n17. Encourages the Secretary-General to utilize local materials, capacity and \nknowledge in the implementation of construction projects for peacekeeping \noperations, in compliance with the United Nations Procurement Manual;  \n \n18. Requests the Secretary-General to establish clear frameworks and \nguidelines to determine the solicitation procedure, whether invitation to bid or request \nfor proposal, to be utilized for, inter alia, acquiring different types of goods and \nservices, including aviation services, and to update the United Nations Procurement \nManual accordingly; \n \n19. Also requests the Secretary-General to take measures to ensure that the \nOrganization conforms to best practices in public procurement with respect to \ntransparency, including by placing additional information in the public domain on the \noutcome of procurement exercises conducted, including in the area of aviation \nservices, so as to further increase the transparency of the procurement operations of \nthe Organization, and to update the United Nations Procurement Manual accordingly; \n \n20. Recognizes the important role played by regional and subregional actors \nfor peacekeeping operations, and in this regard encourages the Secretary-General to \ncontinue to deepen the partnership, cooperation and coordination of the United \nNations with regional and subregional actors, in accordance with relevant mandates, \nand to provide information on such deepened engagement in the context of his next \nreport;  \n \n21. Underlines the important contribution that programmatic activities make \nto the implementation of the mandates of the Mission, including for the prevention \nand resolution of conflicts, and that all such activities must be directly linked to the \nmandates of the Mission; \n\nA/RES/75/298 \nFinancing of the United Nations Multidimensional Integrated \nStabilization Mission in the Central African Republic\n \n21-09012\n4/8 \n \n \n22. Requests the Secretary-General to ensure that the Mission is responsible \nand accountable for the use of its programmatic funds, in line with relevant guidance \nand bearing in mind the specific context in which the Mission operates, and to include, \nin his next budget submission and performance report, detailed information on the \nprogrammatic activities of the Mission, including on how those activities have \ncontributed to the implementation of mission mandates, on the linkage to the \nmandates, on the implementing entities and on the performance by the Mission of \nappropriate oversight; \n \n23. Reaffirms the provisions of section XVIII of its resolution 61/276, further \nrecognizes the important role played by quick-impact projects in supporting the \nimplementation of mission mandates, stresses the need for the timely, responsible and \naccountable implementation of all such projects, and requests the Secretary-General \nto enhance their impact while addressing underlying challenges;  \n \n24. Reiterates that the use of external consultants should be kept to an absolute \nminimum and that the Organization should utilize its in-house capacity to perform \ncore activities or to fulfil functions that are recurrent over the long term; \n \n25. Stresses the importance of prioritizing the safety and security of United \nNations personnel as well as protection of civilians activities in the context of \nchallenging security situations, and requests that all peacekeeping missions be \nprovided with adequate resources for the effective and efficient discharge of their \nrespective mandates, including the protection of civilians where mandated; \n \n26. Recognizes the increasing security challenges faced by United Nations \npeacekeepers, re-emphasizes the importance of improving the safety and security of \npeacekeepers and mission personnel in an integrated manner, including enhanced \ntraining and capacity-building, force protection planning for United Nations camps \nand situational awareness, requests the Secretary-General and host Governments to \nfulfil their responsibilities under the relevant resolutions of the General Assembly and \nthe Security Council to improve the safety and security of United Nations \npeacekeepers and mission personnel, and requests the Secretary-General to report \nthereon in his next report, and notes with appreciation the efforts of Member States \nin promoting the safety and security of United Nations peacekeepers in this regard;  \n \n27. Reiterates its concern about the high number of vacancies in civilian \nstaffing, further reiterates its request to the Secretary-General to ensure that vacant \nposts are filled expeditiously, and requests the Secretary-General to review the posts \nthat have been vacant for 24 months or longer and to propose in his next budget \nsubmission either their retention, with clear justification of need, or their abolishment;  \n \n28. Requests the Secretary-General to consider options for greater \nnationalization of functions when formulating budget submissions, commensurate \nwith mission mandates and requirements;  \n \n29. Requests that the Secretary-General continue his ongoing efforts to ensure \nthe attainment of equitable geographical distribution in the Secretariat and to ensure \nas wide a geographical distribution of staff as possible in all departments and offices \nand at all levels, including at the Director and higher levels, of the Secretariat, and \nrequests him to report thereon in his next overview report; \n \n30. Expresses its deep concern at the delay in the settlement of claims in \nrespect of death and disability, and reiterates its request to the Secretary-General to \nsettle death and disability claims as expeditiously as possible, but no later than three \nmonths from the date of submission of a claim; \n \n31. Notes the ongoing development of impact-based performance indicators \nas part of the implementation of the Comprehensive Performance Assessment System, \n\nFinancing of the United Nations Multidimensional Integrated \nStabilization Mission in the Central African Republic \nA/RES/75/298\n \n5/8\n21-09012 \n \nand in this regard requests the Secretary-General in his next report to provide \ninformation on how the indicators will measure the performance by the Mission of \nmandated tasks and the impact of resource allocation on that performance, as well as \nhow the indicators will contribute to the identification of the resources required for \neach mandated task; \n \n32. Requests the Secretary-General to provide in his next report an execution \nplan for, and analysis of, the implementation of the new Comprehensive Performance \nAssessment System, including on its correlation with mission planning and budget \nformulation, in order to facilitate consideration by the General Assembly of resource \nrequests for implementation of the System; \n \n33. Notes the progress made in the implementation of the multi-year \nenvironmental strategy to reduce the footprint of peacekeeping operations, and \nrequests the Secretary-General to enhance measures for the implementation of the \nstrategy in all peacekeeping missions, in line with the five pillars of the strategy and \nin accordance with the legislative mandates and particular conditions on the ground \nand in full compliance with the relevant rules and regulations, and to report thereon \nin the context of his next overview report; \n \n34. Also notes the recommendations of the Advisory Committee on the use of \nvirtual platforms and cost recovery of air transportation of non-United Nations \npersonnel, and urges that their implementation should take into consideration the \nspecific contexts for each mission without impacting mandate implementation;  \n \n35. Requests the Secretary-General to ensure that United Nations \npeacekeeping mission staff has the capacity to provide technical oversight of the use \nof unmanned aerial and aircraft systems technologies; \n \n36. Emphasizes the importance of the accountability system of the Secretariat, \nand requests the Secretary-General to continue to strengthen risk management, \ntransparency and internal controls in the management of peacekeeping budgets, in \norder to facilitate mandate implementation, and to report thereon in his next report;  \n \n37. Also emphasizes the importance of overall budgetary performance in \npeacekeeping operations, and requests the Secretary-General to continue to improve \noversight of the activities of peacekeeping missions, and implement the \nrecommendations of the relevant oversight bodies, and in this regard to avoid \ndeficiencies in management and related economic losses with the aim of ensuring full \ncompliance with financial regulations and rules, while giving due regard to the \nguidance and recommendations of the General Assembly, and to report thereon in the \ncontext of the performance reports;  \n \n38. Highlights the importance of the women and peace and security agenda, \nand underlines that full implementation of the agenda by the mission can contribute \nto achieving sustainable peace and political solutions; \n \n39. Expresses concern over the allegations of sexual exploitation and abuse \nreported in peacekeeping missions, and requests the Secretary-General to continue to \nimplement his zero-tolerance policy on sexual exploitation and abuse with regard to \nall civilian, military and police personnel, and to report thereon in the context of his \nnext report on cross-cutting issues;  \n \n40. Recalls Security Council resolution 2566 (2021) of 12 March 2021, by \nwhich the Council decided to increase the authorized size of the Mission\u2019s military \nand police components, and requests the Secretary-General to ensure that his \nproposals in the Mission\u2019s budget related to the increased deployments are in line \nwith the Mission\u2019s mandate; \n\nA/RES/75/298 \nFinancing of the United Nations Multidimensional Integrated \nStabilization Mission in the Central African Republic\n \n21-09012\n6/8 \n \n \n41. Also recalls paragraph 44 of the report of the Advisory Committee, and \nencourages the Secretary-General to ensure the proper qualification and classification \nof expenses, particularly regarding official travel and training activities; \n \n42. Notes the importance of local elections in the peacebuilding and \nconsolidation process and the high interest of local populations in this type of \nconsultation with a direct impact on their daily lives and of ensuring adequate \nresources to support the upcoming elections; \n \n43. Recognizes the important role of the Mission in the protection of civilians, \nrequests the Secretary-General to continue to engage with the Mission\u2019s relevant \ncomponents with the aim of helping them to effectively achieve the set objectives of \nthe Mission, and emphasizes the importance of ensuring adequate resources for the \neffective and efficient discharge of its protection of civilians mandates commensurate \nwith the increase of uniformed personnel deployment; \n \n44. Requests the Secretary-General to ensure the full implementation of the \nrelevant provisions of its resolutions 59/296, 60/266, 61/276, 64/269, 65/289, 66/264, \n69/307 and 70/286; \n \n45. Also requests the Secretary-General to take all action necessary to ensure \nthat the Mission is administered with a maximum of efficiency and economy; \n \n \n \nBudget performance report for the period from 1 July 2019 to 30 June 2020 \n \n \n46. Takes note of the report of the Secretary-General on the budget \nperformance of the Mission for the period from 1 July 2019 to 30 June 2020; 3  \n \n \n \nBudget estimates for the period from 1 July 2021 to 30 June 2022 \n \n \n47. Decides to appropriate to the special account for the United Nations \nMultidimensional Integrated Stabilization Mission in the Central African Republic \nthe amount of 1,116, 738,700 dollars for the period from 1 July 2021 to 30 June 2022, \ninclusive of 1,036,595,600 dollars for the maintenance of the Mission, 61,311,500 \ndollars for the support account for peacekeeping operations, 11,316,800 dollars for \nthe United Nations Logistics Base at Brindisi, Italy, and 7,514,800 dollars for the \nRegional Service Centre in Entebbe, Uganda; \n \n \n \nFinancing of the appropriation for the period from 1 July 2021 to 30 June 2022  \n \n \n48. Decides to apportion among Member States the amount of 418,777,000 \ndollars for the period from 1 July to 15 November 2021, in accordance with the levels \nupdated in its resolution 73/272 of 22 December 2018, taking into account the scale \nof assessments for 2021, as set out in its resolution 73/271 of 22 December 2018; \n \n49. Also decides that, in accordance with the provisions of its resolution \n973 (X) of 15 December 1955, there shall be set off against the apportionment among \nMember States, as provided for in paragraph 48 above, their respective share in the \nTax Equalization Fund of 8,261,400 dollars, comprising the estimated staff \nassessment income of 5,619,900 dollars approved for the Mission, the prorated share \nof 1,913,900 dollars of the estimated staff assessment income approved for the \nsupport account, the prorated share of 440,000 dollars of the estimated staff \nassessment income approved for the United Nations Logistics Base and the prorated \nshare of 287,600 dollars of the estimated staff assessment income approved for the \nRegional Service Centre;  \n__________________ \n \n3  A/75/620. \n\nFinancing of the United Nations Multidimensional Integrated \nStabilization Mission in the Central African Republic \nA/RES/75/298\n \n7/8\n21-09012 \n \n \n50. Further decides to apportion among Member States the amount of \n139,592,300 dollars for the period from 16 November to 31 December 2021, at a \nmonthly rate of 93,061,567 dollars, in accordance with the levels updated in its \nresolution 73/272, taking into account the scale of assessments for 2021, as set out in \nits resolution 73/271, subject to a decision of the Security Council to extend the \nmandate of the Mission;  \n \n51. Decides that, in accordance with the provisions of its resolution 973 (X), \nthere shall be set off against the apportionment among Member States, as provided \nfor in paragraph 50 above, their respective share in the Tax Equalization Fund of \n2,753,800 dollars, comprising the estimated staff assessment income of 1,873,200 \ndollars approved for the Mission, the prorated share of 637,900 dollars of the \nestimated staff assessment income approved for the support account, the prorated \nshare of 146,700 dollars of the estimated staff assessment income approved for the \nUnited Nations Logistics Base and the prorated share of 96,000 dollars of the \nestimated staff assessment income approved for the Regional Service Centre;  \n \n52. Also decides to apportion among Member States the amount of \n558,369,400 dollars for the period from 1 January to 30 June 2022, at a monthly rate \nof 93,061,567 dollars, in accordance with the scale of assessments for 2022 and the \nupdated levels,4 subject to a decision of the Security Council to extend the mandate \nof the Mission; \n \n53. Further decides that, in accordance with the provisions of its resolution \n973 (X), there shall be set off against the apportionment among Member States, as \nprovided for in paragraph 52 above, their respective share in the Tax Equalization \nFund of 11,015,300 dollars, comprising the estimated staff assessment income of \n7,493,100 dollars approved for the Mission, the prorated share of 2,551,900 dollars \nof the estimated staff assessment income approved for the support account, the \nprorated share of 586,600 dollars of the estimated staff assessment income approved \nfor the United Nations Logistics Base and the prorated share of 383,700 dollars of the \nestimated staff assessment income approved for the Regional Service Centre;  \n \n54. Decides that, for Member States that have fulfilled their financial \nobligations to the Mission, there shall be set off against the apportionment, as \nprovided for in paragraphs 48, 50 and 52 above, their respective share of the \nunencumbered balance and other revenue in the amount of 42,322,900 dollars in \nrespect of the financial period ended 30 June 2020, in accordance with the levels \nupdated in its resolution 73/272, taking into account the scale of assessments for 2020, \nas set out in its resolution 73/271; \n \n55. Also decides that, for Member States that have not fulfilled their financial \nobligations to the Mission, there shall be set off against their outstanding obligations \ntheir respective share of the unencumbered balance and other revenue in the amount \nof 42,322,900 dollars, in respect of the financial period ended 30 June 2020, in \naccordance with the scheme set out in paragraph 54 above; \n \n56. Further decides that the increase of 1,011,600 dollars in the estimated staff \nassessment income in respect of the financial period ended 30 June 2020 shall be \nadded to the credits in the amount of 42,322,900 dollars referred to in paragraphs 54 \nand 55 above; \n \n57. Encourages the Secretary-General to continue to take additional measures \nto ensure the safety and security of all personnel participating in the Mission under \nthe auspices of the United Nations, bearing in mind paragraphs 5 and 6 of Security \nCouncil resolution 1502 (2003) of 26 August 2003; \n__________________ \n \n4  To be adopted by the General Assembly. \n\nA/RES/75/298 \nFinancing of the United Nations Multidimensional Integrated \nStabilization Mission in the Central African Republic\n \n21-09012\n8/8 \n \n \n58. Invites voluntary contributions to the Mission in cash and in the form of \nservices and supplies acceptable to the Secretary-General, to be administered, as \nappropriate, in accordance with the procedure and practices established by the \nGeneral Assembly; \n \n59. Decides to include in the provisional agenda of its seventy-sixth session \nthe item entitled \u201cFinancing of the United Nations Multidimensional Integrated \nStabilization Mission in the Central African Republic\u201d. \n \n88th plenary meeting \n30 June 2021 \n \n \n",
  "paragraphs": {
    "1": "Requests the Secretary-General to entrust the Head of Mission with the task of formulating future budget proposals in full accordance with the provisions of its resolutions 59/296 of 22 June 2005, 60/266 of 30 June 2006, 61/276 of 29 June 2007, 64/269 of 24 June 2010, 65/289 of 30 June 2011, 66/264 of 21 June 2012, 69/307 of 25 June 2015 and 70/286 of 17 June 2016, as well as other relevant resolutions;",
    "2": "Takes note of the status of contributions to the United Nations Multidimensional Integrated Stabilization Mission in the Central African Republic as at 30 April 2021, including the contributions outstanding in the amount of 200.4 million United States dollars, representing some 3.2 per cent of the total assessed contributions, notes with concern that only 99 Member States have paid their assessed contributions in full, and urges all other Member States, in particular those in arrears, to ensure payment of their outstanding assessed contributions;",
    "3": "Expresses its appreciation to those Member States that have paid their assessed contributions in full, and urges all other Member States to make every possible effort to ensure payment of their assessed contributions to the Mission in full;",
    "4": "Expresses concern at the financial situation with regard to peacekeeping activities, in particular as regards the reimbursements to troop contributors that bear additional burdens owing to overdue payments by Member States of their assessments;",
    "5": "Emphasizes that all future and existing peacekeeping missions shall be given equal and non-discriminatory treatment in respect of financial and administrative arrangements;",
    "6": "Also emphasizes that all peacekeeping missions shall be provided with adequate resources for the effective and efficient discharge of their respective mandates;",
    "7": "Requests the Secretary-General to ensure that proposed peacekeeping budgets are based on the relevant legislative mandates;",
    "8": "Endorses the conclusions and recommendations contained in the report of the Advisory Committee on Administrative and Budgetary Questions, subject to the provisions of the present resolution, and requests the Secretary-General to ensure their full implementation;",
    "9": "Notes with appreciation the support of the Government of the Central African Republic in facilitating the work of the Mission;",
    "10": "Takes note of paragraph 35 of the report of the Advisory Committee, and decides not to abolish one P-3 post of Security Coordination Officer;",
    "11": "Also takes note of paragraph 35 of the report of the Advisory Committee, and decides not to abolish the National Professional Officer post of Associate Information Analyst, Political Affairs;",
    "12": "Notes with concern the shortcomings in partnership operations between the Mine Action Service and the United Nations Office for Project Services, and requests the Secretary-General to conduct an independent review on the use of the services of the Office and the partners selected to implement mine action activities, including an assessment of the comparative advantage of each mission in the delivery of those activities, and to submit the results of the analysis in the context of his report at the seventy-seventh session;",
    "13": "Reiterates its grave concern about the continued threat to life, health, safety and security caused by the coronavirus disease (COVID-19) pandemic and the importance of ensuring the safety, security and health of peacekeeping personnel, including through the use of safe and effective vaccines for civilian and uniformed Financing of the United Nations Multidimensional Integrated Stabilization Mission in the Central African Republic A/RES/75/298 3/8 21-09012 personnel, maintaining the continuity of mandate delivery, including protection of civilians, minimizing the risk of mission activities causing the virus to spread and, where appropriate and within mandates, supporting national authorities, upon their request, in their response to COVID-19, in collaboration with the Resident Coordinator and other United Nations entities in the country;",
    "14": "Notes the measures adopted to mitigate the effect of the COVID-19 pandemic on peacekeeping operations, including facilitating the continued implementation of mission mandates while ensuring the health and safety of peacekeeping personnel and local communities in the host country, and requests the Secretary-General to provide updated information on the impact of the pandemic, the lessons learned, best practices and how the mission improved its preparedness and resilience and collaborated with the host Government and regional and subregional actors in response to the pandemic in the context of the next performance report and budget submission for the mission;",
    "15": "Notes with concern the mid- and long-term impact of the COVID-19 pandemic on countries, regions and subregions in conflict, and emphasizes the importance of United Nations peacekeeping operations, where appropriate and within their respective mandates, coordinating with national authorities and other United Nations entities in promoting post-conflict reconstruction, peacebuilding and post- pandemic recovery of countries and regions in conflict, especially those in Africa;",
    "16": "Recalls paragraphs 16 and 18 of its resolution 69/273 of 2 April 2015, and in this regard reiterates its request to the Secretary-General that he continue to explore additional innovative ways to promote procurement from developing countries and countries with economies in transition at Headquarters and field offices and to encourage interested local vendors to apply for registration on the Secretariat vendor roster, with a view to broadening its geographical base;",
    "17": "Encourages the Secretary-General to utilize local materials, capacity and knowledge in the implementation of construction projects for peacekeeping operations, in compliance with the United Nations Procurement Manual;",
    "18": "Requests the Secretary-General to establish clear frameworks and guidelines to determine the solicitation procedure, whether invitation to bid or request for proposal, to be utilized for, inter alia, acquiring different types of goods and services, including aviation services, and to update the United Nations Procurement Manual accordingly;",
    "19": "Also requests the Secretary-General to take measures to ensure that the Organization conforms to best practices in public procurement with respect to transparency, including by placing additional information in the public domain on the outcome of procurement exercises conducted, including in the area of aviation services, so as to further increase the transparency of the procurement operations of the Organization, and to update the United Nations Procurement Manual accordingly;",
    "20": "Recognizes the important role played by regional and subregional actors for peacekeeping operations, and in this regard encourages the Secretary-General to continue to deepen the partnership, cooperation and coordination of the United Nations with regional and subregional actors, in accordance with relevant mandates, and to provide information on such deepened engagement in the context of his next report;",
    "21": "Underlines the important contribution that programmatic activities make to the implementation of the mandates of the Mission, including for the prevention and resolution of conflicts, and that all such activities must be directly linked to the mandates of the Mission; A/RES/75/298 Financing of the United Nations Multidimensional Integrated Stabilization Mission in the Central African Republic 21-09012 4/8",
    "22": "Requests the Secretary-General to ensure that the Mission is responsible and accountable for the use of its programmatic funds, in line with relevant guidance and bearing in mind the specific context in which the Mission operates, and to include, in his next budget submission and performance report, detailed information on the programmatic activities of the Mission, including on how those activities have contributed to the implementation of mission mandates, on the linkage to the mandates, on the implementing entities and on the performance by the Mission of appropriate oversight;",
    "23": "Reaffirms the provisions of section XVIII of its resolution 61/276, further recognizes the important role played by quick-impact projects in supporting the implementation of mission mandates, stresses the need for the timely, responsible and accountable implementation of all such projects, and requests the Secretary-General to enhance their impact while addressing underlying challenges;",
    "24": "Reiterates that the use of external consultants should be kept to an absolute minimum and that the Organization should utilize its in-house capacity to perform core activities or to fulfil functions that are recurrent over the long term;",
    "25": "Stresses the importance of prioritizing the safety and security of United Nations personnel as well as protection of civilians activities in the context of challenging security situations, and requests that all peacekeeping missions be provided with adequate resources for the effective and efficient discharge of their respective mandates, including the protection of civilians where mandated;",
    "26": "Recognizes the increasing security challenges faced by United Nations peacekeepers, re-emphasizes the importance of improving the safety and security of peacekeepers and mission personnel in an integrated manner, including enhanced training and capacity-building, force protection planning for United Nations camps and situational awareness, requests the Secretary-General and host Governments to fulfil their responsibilities under the relevant resolutions of the General Assembly and the Security Council to improve the safety and security of United Nations peacekeepers and mission personnel, and requests the Secretary-General to report thereon in his next report, and notes with appreciation the efforts of Member States in promoting the safety and security of United Nations peacekeepers in this regard;",
    "27": "Reiterates its concern about the high number of vacancies in civilian staffing, further reiterates its request to the Secretary-General to ensure that vacant posts are filled expeditiously, and requests the Secretary-General to review the posts that have been vacant for 24 months or longer and to propose in his next budget submission either their retention, with clear justification of need, or their abolishment;",
    "28": "Requests the Secretary-General to consider options for greater nationalization of functions when formulating budget submissions, commensurate with mission mandates and requirements;",
    "29": "Requests that the Secretary-General continue his ongoing efforts to ensure the attainment of equitable geographical distribution in the Secretariat and to ensure as wide a geographical distribution of staff as possible in all departments and offices and at all levels, including at the Director and higher levels, of the Secretariat, and requests him to report thereon in his next overview report;",
    "30": "Expresses its deep concern at the delay in the settlement of claims in respect of death and disability, and reiterates its request to the Secretary-General to settle death and disability claims as expeditiously as possible, but no later than three months from the date of submission of a claim;",
    "31": "Notes the ongoing development of impact-based performance indicators as part of the implementation of the Comprehensive Performance Assessment System, Financing of the United Nations Multidimensional Integrated Stabilization Mission in the Central African Republic A/RES/75/298 5/8 21-09012 and in this regard requests the Secretary-General in his next report to provide information on how the indicators will measure the performance by the Mission of mandated tasks and the impact of resource allocation on that performance, as well as how the indicators will contribute to the identification of the resources required for each mandated task;",
    "32": "Requests the Secretary-General to provide in his next report an execution plan for, and analysis of, the implementation of the new Comprehensive Performance Assessment System, including on its correlation with mission planning and budget formulation, in order to facilitate consideration by the General Assembly of resource requests for implementation of the System;",
    "33": "Notes the progress made in the implementation of the multi-year environmental strategy to reduce the footprint of peacekeeping operations, and requests the Secretary-General to enhance measures for the implementation of the strategy in all peacekeeping missions, in line with the five pillars of the strategy and in accordance with the legislative mandates and particular conditions on the ground and in full compliance with the relevant rules and regulations, and to report thereon in the context of his next overview report;",
    "34": "Also notes the recommendations of the Advisory Committee on the use of virtual platforms and cost recovery of air transportation of non-United Nations personnel, and urges that their implementation should take into consideration the specific contexts for each mission without impacting mandate implementation;",
    "35": "Requests the Secretary-General to ensure that United Nations peacekeeping mission staff has the capacity to provide technical oversight of the use of unmanned aerial and aircraft systems technologies;",
    "36": "Emphasizes the importance of the accountability system of the Secretariat, and requests the Secretary-General to continue to strengthen risk management, transparency and internal controls in the management of peacekeeping budgets, in order to facilitate mandate implementation, and to report thereon in his next report;",
    "37": "Also emphasizes the importance of overall budgetary performance in peacekeeping operations, and requests the Secretary-General to continue to improve oversight of the activities of peacekeeping missions, and implement the recommendations of the relevant oversight bodies, and in this regard to avoid deficiencies in management and related economic losses with the aim of ensuring full compliance with financial regulations and rules, while giving due regard to the guidance and recommendations of the General Assembly, and to report thereon in the context of the performance reports;",
    "38": "Highlights the importance of the women and peace and security agenda, and underlines that full implementation of the agenda by the mission can contribute to achieving sustainable peace and political solutions;",
    "39": "Expresses concern over the allegations of sexual exploitation and abuse reported in peacekeeping missions, and requests the Secretary-General to continue to implement his zero-tolerance policy on sexual exploitation and abuse with regard to all civilian, military and police personnel, and to report thereon in the context of his next report on cross-cutting issues;",
    "40": "Recalls Security Council resolution 2566 (2021) of 12 March 2021, by which the Council decided to increase the authorized size of the Mission\u2019s military and police components, and requests the Secretary-General to ensure that his proposals in the Mission\u2019s budget related to the increased deployments are in line with the Mission\u2019s mandate; A/RES/75/298 Financing of the United Nations Multidimensional Integrated Stabilization Mission in the Central African Republic 21-09012 6/8",
    "41": "Also recalls paragraph 44 of the report of the Advisory Committee, and encourages the Secretary-General to ensure the proper qualification and classification of expenses, particularly regarding official travel and training activities;",
    "42": "Notes the importance of local elections in the peacebuilding and consolidation process and the high interest of local populations in this type of consultation with a direct impact on their daily lives and of ensuring adequate resources to support the upcoming elections;",
    "43": "Recognizes the important role of the Mission in the protection of civilians, requests the Secretary-General to continue to engage with the Mission\u2019s relevant components with the aim of helping them to effectively achieve the set objectives of the Mission, and emphasizes the importance of ensuring adequate resources for the effective and efficient discharge of its protection of civilians mandates commensurate with the increase of uniformed personnel deployment;",
    "44": "Requests the Secretary-General to ensure the full implementation of the relevant provisions of its resolutions 59/296, 60/266, 61/276, 64/269, 65/289, 66/264, 69/307 and 70/286;",
    "45": "Also requests the Secretary-General to take all action necessary to ensure that the Mission is administered with a maximum of efficiency and economy; Budget performance report for the period from 1 July 2019 to 30 June 2020",
    "46": "Takes note of the report of the Secretary-General on the budget performance of the Mission for the period from 1 July 2019 to 30 June 2020; 3 Budget estimates for the period from 1 July 2021 to 30 June 2022",
    "47": "Decides to appropriate to the special account for the United Nations Multidimensional Integrated Stabilization Mission in the Central African Republic the amount of 1,116, 738,700 dollars for the period from 1 July 2021 to 30 June 2022, inclusive of 1,036,595,600 dollars for the maintenance of the Mission, 61,311,500 dollars for the support account for peacekeeping operations, 11,316,800 dollars for the United Nations Logistics Base at Brindisi, Italy, and 7,514,800 dollars for the Regional Service Centre in Entebbe, Uganda; Financing of the appropriation for the period from 1 July 2021 to 30 June 2022",
    "48": "Decides to apportion among Member States the amount of 418,777,000 dollars for the period from 1 July to 15 November 2021, in accordance with the levels updated in its resolution 73/272 of 22 December 2018, taking into account the scale of assessments for 2021, as set out in its resolution 73/271 of 22 December 2018;",
    "49": "Also decides that, in accordance with the provisions of its resolution 973 (X) of 15 December 1955, there shall be set off against the apportionment among Member States, as provided for in paragraph 48 above, their respective share in the Tax Equalization Fund of 8,261,400 dollars, comprising the estimated staff assessment income of 5,619,900 dollars approved for the Mission, the prorated share of 1,913,900 dollars of the estimated staff assessment income approved for the support account, the prorated share of 440,000 dollars of the estimated staff assessment income approved for the United Nations Logistics Base and the prorated share of 287,600 dollars of the estimated staff assessment income approved for the Regional Service Centre; __________________ 3 A/75/620. Financing of the United Nations Multidimensional Integrated Stabilization Mission in the Central African Republic A/RES/75/298 7/8 21-09012",
    "50": "Further decides to apportion among Member States the amount of 139,592,300 dollars for the period from 16 November to 31 December 2021, at a monthly rate of 93,061,567 dollars, in accordance with the levels updated in its resolution 73/272, taking into account the scale of assessments for 2021, as set out in its resolution 73/271, subject to a decision of the Security Council to extend the mandate of the Mission;",
    "51": "Decides that, in accordance with the provisions of its resolution 973 (X), there shall be set off against the apportionment among Member States, as provided for in paragraph 50 above, their respective share in the Tax Equalization Fund of 2,753,800 dollars, comprising the estimated staff assessment income of 1,873,200 dollars approved for the Mission, the prorated share of 637,900 dollars of the estimated staff assessment income approved for the support account, the prorated share of 146,700 dollars of the estimated staff assessment income approved for the United Nations Logistics Base and the prorated share of 96,000 dollars of the estimated staff assessment income approved for the Regional Service Centre;",
    "52": "Also decides to apportion among Member States the amount of 558,369,400 dollars for the period from 1 January to 30 June 2022, at a monthly rate of 93,061,567 dollars, in accordance with the scale of assessments for 2022 and the updated levels,4 subject to a decision of the Security Council to extend the mandate of the Mission;",
    "53": "Further decides that, in accordance with the provisions of its resolution 973 (X), there shall be set off against the apportionment among Member States, as provided for in paragraph 52 above, their respective share in the Tax Equalization Fund of 11,015,300 dollars, comprising the estimated staff assessment income of 7,493,100 dollars approved for the Mission, the prorated share of 2,551,900 dollars of the estimated staff assessment income approved for the support account, the prorated share of 586,600 dollars of the estimated staff assessment income approved for the United Nations Logistics Base and the prorated share of 383,700 dollars of the estimated staff assessment income approved for the Regional Service Centre;",
    "54": "Decides that, for Member States that have fulfilled their financial obligations to the Mission, there shall be set off against the apportionment, as provided for in paragraphs 48, 50 and 52 above, their respective share of the unencumbered balance and other revenue in the amount of 42,322,900 dollars in respect of the financial period ended 30 June 2020, in accordance with the levels updated in its resolution 73/272, taking into account the scale of assessments for 2020, as set out in its resolution 73/271;",
    "55": "Also decides that, for Member States that have not fulfilled their financial obligations to the Mission, there shall be set off against their outstanding obligations their respective share of the unencumbered balance and other revenue in the amount of 42,322,900 dollars, in respect of the financial period ended 30 June 2020, in accordance with the scheme set out in paragraph 54 above;",
    "56": "Further decides that the increase of 1,011,600 dollars in the estimated staff assessment income in respect of the financial period ended 30 June 2020 shall be added to the credits in the amount of 42,322,900 dollars referred to in paragraphs 54 and 55 above;",
    "57": "Encourages the Secretary-General to continue to take additional measures to ensure the safety and security of all personnel participating in the Mission under the auspices of the United Nations, bearing in mind paragraphs 5 and 6 of Security Council resolution 1502 (2003) of 26 August 2003; __________________ 4 To be adopted by the General Assembly. A/RES/75/298 Financing of the United Nations Multidimensional Integrated Stabilization Mission in the Central African Republic 21-09012 8/8",
    "58": "Invites voluntary contributions to the Mission in cash and in the form of services and supplies acceptable to the Secretary-General, to be administered, as appropriate, in accordance with the procedure and practices established by the General Assembly;",
    "59": "Decides to include in the provisional agenda of its seventy-sixth session the item entitled \u201cFinancing of the United Nations Multidimensional Integrated Stabilization Mission in the Central African Republic\u201d. 88th plenary meeting 30 June 2021"
  },
  "agenda_items": [
    "Item 156"
  ],
  "symbol_references": []
}