{
  "symbol": "A/RES/75/279",
  "filename": "A_RES_75_279.pdf",
  "title": "75/279. International Year of Glass, 2022",
  "text": "United Nations \nA/RES/75/279 \n \n \nGeneral Assembly \nDistr.: General \n21 May 2021 \n \n21-06600 (E)    070621     \n*2106600* \n \n \nSeventy-fifth session \nAgenda item 136 \nImpact of rapid technological change on the achievement of \nthe Sustainable Development Goals and targets   \n \n \n \n \n Resolution adopted by the General Assembly \non 18 May 2021 \n \n \n \n \n[without reference to a Main Committee (A/75/L.84 and A/75/L.84/Add.1)] \n \n \n 75/279. International Year of Glass, 2022 \n \n \n \nThe General Assembly, \n \nReaffirming its resolution 70/1 of 25 September 2015, entitled \u201cTransforming \nour world: the 2030 Agenda for Sustainable Development\u201d, in which it adopted a \ncomprehensive, far-reaching and people-centred set of universal and transformative \nSustainable Development Goals and targets, its commitment to working tirelessly for \nthe full implementation of the Agenda by 2030, its recognition that eradicating \npoverty in all its forms and dimensions, including extreme poverty, is the greatest \nglobal challenge and an indispensable requirement for sustainable development, its \ncommitment to achieving sustainable development in its three dimensions \u2013 economic, \nsocial and environmental \u2013 in a balanced and integrated manner, and to building upon \nthe achievements of the Millennium Development Goals and seeking to address their \nunfinished business, \n \nReaffirming also its resolution 69/313 of 27 July 2015 on the Addis Ababa \nAction Agenda of the Third International Conference on Financing for Development, \nwhich is an integral part of the 2030 Agenda for Sustainable Development, supports \nand complements it, helps to contextualize its means of implementation targets with \nconcrete policies and actions, and reaffirms the strong political commitment to \naddress the challenge of financing and creating an enabling environment at all levels \nfor sustainable development in the spirit of global partnership and solidarity, \n \nReaffirming further the Paris Agreement,1 and encouraging all its parties to fully \nimplement the Agreement, and parties to the United Nations Framework Convention \non Climate Change 2  that have not yet done so to deposit their instruments of \nratification, acceptance, approval or accession, where appropriate, as soon as possible, \n__________________ \n \n1 See FCCC/CP/2015/10/Add.1, decision 1/CP.21, annex. \n \n2 United Nations, Treaty Series, vol. 1771, No. 30822. \n\nA/RES/75/279 \nInternational Year of Glass, 2022\n \n21-06600\n2/3 \n \n \nReaffirming its resolutions 53/199 of 15 December 1998 and 61/185 of \n20 December 2006 on the proclamation of international years, and Economic and \nSocial Council resolution 1980/67 of 25 July 1980 on international years and \nanniversaries, particularly paragraphs 1 to 10 of the annex thereto on the agreed \ncriteria for the proclamation of international years, as well as paragraphs 13 and 14, \nin which it is stated that an international year should not be proclaimed before the \nbasic arrangements for its organization and financing have been made, \n \nRecalling its resolution 75/231 of 21 December 2020, in which it recognizes \nthat multi-stakeholder partnerships and the resources, knowledge and ingenuity of the \nprivate sector, civil society, the scientific community, academia, philanthropy and \nfoundations, parliaments, local authorities, volunteers and other stakeholders will be \nimportant in order to mobilize and share knowledge, expertise, technology and \nfinancial resources and complement the efforts of Governments, \n \nRecalling also its resolution 73/17 of 26 November 2018, in which it encourages \nMember States to continue to consider the impact of key rapid technological changes \non the achievement of the Sustainable Development Goals and targets in order to \nbenefit from opportunities and address challenges, promote the development of \nnational strategies and public policies, science, technology and innovation road maps, \ncapacity-building and scientific engagement, and share best practices, \n \nRecognizing that glass has accompanied humankind for centuries, enriching the \nquality of life of millions, and that, as one of the most important, versatile and \ntransformative materials of history, glass is an important component in many areas, \nincluding in aerospace and the automotive sector, architecture, the arts, information \nand communications technology, energy, health care, laboratory work, optics and \npackaging and storage, \n \nConsidering the opportunities that glass, glass-related technologies and further \ninnovations in this area can provide in modern applications, including but not limited \nto display panels and ultra-thin sensor glass, fibre-optic cables, laboratory equipment, \nlenses and optical microscopes, medical equipment, pharmaceutical use, photovoltaic \nglass, reinforced plastics and insulation, \n \nRecognizing that, although the production of glass is an energy-intensive \nactivity with major historical and ongoing environmental impacts, glass can serve as \nan alternative to plastics and other materials and has the potential to contribute to the \nimplementation of sustainable production and consumption patterns, \n \nConsidering the progress made in glass manufacturing to reduce energy \nconsumption, atmospheric emissions and other environmental impacts, and the \nopportunities to enhance sustainability in the glass industry, enhance efficiencies in \nglass production, advance the sustainable use of natural resources, including sand, \nand shift to using renewable energies, \n \nEncouraging Member States to advance innovative pathways to achieving \nsustainable consumption and production in line with United Nations Environment \nAssembly resolution 4/1 of 15 March 2019,3 and to promote sustainable consumer \nbehaviour and consumption patterns, including glass reuse and recycling and other \nassociated practices, \n \nConsidering that the International Year of Glass, 2022 will underline the \ntechnological, scientific, economic, environmental, historical and artistic role of glass \nin our societies, emphasizing the rich possibilities of developing technologies and \ntheir potential contribution to meeting the challenges of sustainable development and \ninclusive societies, achieving world economic recovery and building back better from \n__________________ \n \n3 UNEP/EA.4/Res.1. \n\nInternational Year of Glass, 2022 \nA/RES/75/279\n \n3/3\n21-06600 \n \nthe coronavirus disease (COVID-19), and bringing together the threads of technology, \nsocial history and art through educational programmes and museum exhibitions, \n \nConsidering also that the celebration of the International Year of Glass in 2022 \nprovides an opportunity to promote the contribution of the science and technology \ncommunity to sustainable development and in promoting the empowerment, \nparticipation and contribution of women, and of girls through education, in science, \ntechnology and innovation, \n \nWelcoming that the International Year of Glass, 2022 can facilitate the exchange \nof best practices and the creation of partnerships between key stakeholders to support \ndeveloping countries in achieving sustainability in the glass industry, creating jobs and \nimproving livelihoods, and that it can help to identify priority investment opportunities, \ncapacity-building needs, and mechanisms for equitable technology transfer, \n \nNoting the support of the International Commission on Glass, the Community \nof Glass Associations and the International Committee for Museums and Collections \nof Glass to promote the International Year of Glass, 2022, gathering more than 1,300 \nendorsements from the sector in 78 countries,  \n \n1. \nDecides to proclaim 2022 as the International Year of Glass; \n \n2. \nInvites all Member States, organizations of the United Nations system, \nother international and regional organizations and other relevant stakeholders, \nincluding civil society, the private sector and academia, to observe the International \nYear, in an appropriate manner and in accordance with national contexts and \npriorities, through activities aimed at raising awareness of and directing policy \nattention to the importance of glass in daily life; \n \n3. \nStresses that the costs of all activities that may arise from the \nimplementation of the present resolution should be met by voluntary contributions, \nincluding from the private sector; \n \n4. \nInvites all relevant stakeholders to make voluntary contributions and to \nprovide other forms of support for the International Year; \n \n5. \nRequests the Secretary-General to bring the present resolution to the \nattention of all Member States and organizations of the United Nations system. \n \n66th plenary meeting \n18 May 2021 \n \n",
  "paragraphs": {
    "1": "Decides to proclaim 2022 as the International Year of Glass;",
    "2": "Invites all Member States, organizations of the United Nations system, other international and regional organizations and other relevant stakeholders, including civil society, the private sector and academia, to observe the International Year, in an appropriate manner and in accordance with national contexts and priorities, through activities aimed at raising awareness of and directing policy attention to the importance of glass in daily life;",
    "3": "Stresses that the costs of all activities that may arise from the implementation of the present resolution should be met by voluntary contributions, including from the private sector;",
    "4": "Invites all relevant stakeholders to make voluntary contributions and to provide other forms of support for the International Year;",
    "5": "Requests the Secretary-General to bring the present resolution to the attention of all Member States and organizations of the United Nations system. 66th plenary meeting 18 May 2021"
  },
  "agenda_items": [
    "Item 136"
  ],
  "symbol_references": [
    "A/75/L.84"
  ]
}