{
  "symbol": "A/RES/75/247",
  "filename": "A_RES_75_247.pdf",
  "title": "75/247. Report on the activities of the Office of Internal Oversight Services",
  "text": "United Nations \nA/RES/75/247\n \n \nGeneral Assembly \nDistr.: General \n7 January 2021 \n \n \n21-00054 (E)    070121 \n*2100054* \n \n \nSeventy-fifth session \nAgenda items 139 and 151 \nReview of the efficiency of the administrative and financial \nfunctioning of the United Nations \nReport on the activities of the Office of Internal \nOversight Services \n \n \n \n \n Resolution adopted by the General Assembly \non 31 December 2020 \n \n \n \n \n[on the report of the Fifth Committee (A/75/671, para. 6)] \n \n \n 75/247. Report on the activities of the Office of Internal Oversight Services \n \n \n \nThe General Assembly, \n \n \n \nI  \n \n \nActivities of the Office of Internal Oversight Services \n \n \nRecalling its resolutions 48/218 B of 29 July 1994, 54/244 of 23 December \n1999, 59/272 of 23 December 2004, 60/259 of 8 May 2006, 63/265 of 24 December \n2008, 64/232 of 22 December 2009, 64/263 of 29 March 2010, 65/250 of \n24 December 2010, 66/236 of 24 December 2011, 67/258 of 12 April 2013, 68/21 of \n4 December 2013, 69/252 and 69/253 of 29 December 2014, 70/111 of 14 December \n2015, 71/7 of 27 October 2016, 72/18 of 1 December 2017, 73/275 of 22 December \n2018 and 74/256 of 27 December 2019, \n \nHaving considered the report of the Office of Internal Oversight Services on its \nactivities for the period from 1 July 2019 to 30 June 2020, 1 \n \n1. \nReaffirms its primary role in the consideration of and action taken on \nreports submitted to it; \n \n2. \nAlso reaffirms its oversight role and the role of the Fifth Committee in \nadministrative and budgetary matters; \n \n3. \nFurther reaffirms the independence and the separate and distinct roles of \nthe internal and external oversight mechanisms; \n__________________ \n \n1  A/75/301 (Part I) and A/75/301 (Part I)/Add.1. \n\nA/RES/75/247 \nReport on the activities of the Office of Internal Oversight Services\n \n21-00054\n2/4 \n \n \n4. \nRecognizes the important roles and operational independence of the \noversight bodies, including the Office of Internal Oversight Services of the \nSecretariat, in contributing to improvements in the effectiveness, transparency and \naccountability of the Organization; \n \n5. \nRecalls that the Office shall exercise operational independence relating to \nthe performance of its internal oversight functions, under the authority of the \nSecretary-General, in accordance with the relevant resolutions; \n \n6. \nReaffirms the operational independence of the Office, stresses that its \nindependence and objectivity are vital in ensuring that its internal oversight functions \nare carried out in a credible, factual and unbiased manner, and reaffirms the authority \nof the Office to initiate, carry out and report on any action to fulfil its responsibilities \nwith regard to internal audit, inspection and evaluation, and investigations; \n \n7. \nRequests the Secretary-General to ensure that the annual reports of the \nOffice continue to include a brief description of any impairment of its independence; \n \n8. \nEncourages United Nations internal and external oversight bodies to \nfurther enhance the level of cooperation with one another, such as through joint work-\nplanning sessions, without prejudice to the independence of each; \n \n9. \nReaffirms that the Board of Auditors and the Joint Inspection Unit shall \ncontinue to be provided with copies of all reports produced by the Office, and requests \nthat those reports be made available within one month of their finalization; \n \n10. Takes note of the report of the Office of Internal Oversight Services on its \nactivities for the period from 1 July 2019 to 30 June 2020; \n \n11. \nRequests the Secretary-General to ensure that all relevant resolutions \npertaining to the work of the Office are brought to the attention of the relevant \nmanagers; \n \n12. Also requests the Secretary-General to ensure that all relevant resolutions, \nincluding those of a cross-cutting nature, are brought to the attention of relevant \nmanagers and that the Office also takes those resolutions into account in the conduct \nof its activities; \n \n13. Notes with appreciation the efforts of the Office to improve the \nimplementation by the Organization of its recommendations, including through \nincreased engagement with entities on long open recommendations and providing \nclearer recommendations with a focus on implementation, and encourages the Office \nto continue to make recommendations more actionable; \n \n14. Welcomes the reviewed approach of the Office towards recommendations, \nand requests the Secretary-General to continue to increase efforts to ensure the full \nimplementation of the accepted recommendations of the Office, including those \nrelated to accountability mechanisms, cost savings, recovery of overpayments, \ntechnological improvements, organizational efficiency and effectiveness and other \nimprovements, in a prompt and timely manner, and to provide detailed justifications \nin cases in which recommendations of the Office are not accepted; \n \n15. Notes with concern the continued delays in the implementation of the \nrecommendations of the Office, and requests the Secretary-General to implement the \noutstanding and critical recommendations of the Office in a timely manner; \n \n16. Welcomes the continued efforts of the Office to promote the Organization\u2019s \nzero-tolerance approach to fraud, corruption, sexual harassment and sexual \nexploitation and abuse, and the actions taken in this regard, including the creation of \na specialized team to investigate sexual harassment complaints and the \nimplementation of a procedure for addressing such complaints, and also welcomes \n\nReport on the activities of the Office of Internal Oversight Services \nA/RES/75/247\n \n3/4\n21-00054 \n \nthe efforts made to strengthen the investigative capacity of the Office in the light of \nthe need to improve the average time required to complete the growing number of \ninvestigations into a range of misconduct, including cases of sexual harassment; \n \n17. Commends the Office for reducing the average time taken to complete \ninvestigations, and encourages the Office to continue to reduce the average time taken \nto complete investigations in order to meet relevant time frames as prescribed by the \nOffice in its programme impact pathways, and to continue to report on the measures \nundertaken in this regard in its next report; \n \n18. Notes the impacts of the coronavirus disease (COVID-19) pandemic, in \nparticular the restrictions on travel and movement, on the ability of the Office to \nconduct investigations, encourages the Office to enhance its other capacities to \nmitigate any gaps created by the pandemic, and requests the Office to provide \ninformation in its next report on the direct impact of the pandemic on its ability to \ncarry out investigations fully; \n \n19. Encourages the Office to continue to ensure the oversight, through audits \nand investigations, of United Nations peacekeeping missions that are closing and to \nreport thereon in its next report; \n \n20. Recognizes the high level of risk inherent in United Nations procurement \nactivities, and requests the Secretary-General to entrust the Office with strengthening \nits focus on the monitoring of such activities, including on evaluating implementation \nand existing practice within the Organization regarding restrictions on employment \nafter separation of staff involved in the procurement process and sanctions for \nviolations, as well as with reporting thereon in conjunction with the related report of \nthe Secretary-General on procurement; \n \n21. Welcomes the efforts and progress made by the Office in reducing the \nnumber of vacant posts, and requests the Secretary-General to continue to make every \neffort to fill the remaining vacant posts and ensure the retention of staff, particularly \nin the Inspection and Evaluation Division, in accordance with Article 101 of the \nCharter of the United Nations; \n \n \n \nII \n \n \nActivities of the Independent Audit Advisory Committee \n \n \nRecalling its resolutions 61/275 of 29 June 2007, 64/263, section II of its \nresolution 65/250, section II of its resolution 66/236, section II of its resolution \n67/258, section II of its resolution 68/21, section II of its resolution 69/252, section II \nof its resolution 70/111, section II of its resolution 71/7, section II of its resolution \n72/18, section II of its resolution 73/275 and section II of its resolution 74/256, \n \nHaving considered the report of the Independent Audit Advisory Committee on \nits activities for the period from 1 August 2019 to 31 July 2020, 2 \n \n1. \nNotes with appreciation the work of the Independent Audit Advisory \nCommittee; \n \n2. \nReaffirms the terms of reference of the Committee, as contained in the \nannex to its resolution 61/275; \n \n3. \nEndorses the observations, comments and recommendations contained in \nthe report of the Committee; \n__________________ \n \n2  A/75/293. \n\nA/RES/75/247 \nReport on the activities of the Office of Internal Oversight Services\n \n21-00054\n4/4 \n \n \n4. \nEncourages the Committee to continue its consultations with all relevant \nbodies in the United Nations, including on the implementation of its \nrecommendations, as appropriate; \n \n5. \nInvites the Committee to continue to examine the operational \nindependence of the Office, including on budgetary matters. \n \n48th (resumed) plenary meeting \n31 December 2020 \n \n \n",
  "paragraphs": {
    "1": "Notes with appreciation the work of the Independent Audit Advisory Committee;",
    "2": "Reaffirms the terms of reference of the Committee, as contained in the annex to its resolution 61/275;",
    "3": "Endorses the observations, comments and recommendations contained in the report of the Committee; __________________ 2 A/75/293. A/RES/75/247 Report on the activities of the Office of Internal Oversight Services 21-00054 4/4",
    "4": "Encourages the Committee to continue its consultations with all relevant bodies in the United Nations, including on the implementation of its recommendations, as appropriate;",
    "5": "Invites the Committee to continue to examine the operational independence of the Office, including on budgetary matters. 48th (resumed) plenary meeting 31 December 2020",
    "6": "Reaffirms the operational independence of the Office, stresses that its independence and objectivity are vital in ensuring that its internal oversight functions are carried out in a credible, factual and unbiased manner, and reaffirms the authority of the Office to initiate, carry out and report on any action to fulfil its responsibilities with regard to internal audit, inspection and evaluation, and investigations;",
    "7": "Requests the Secretary-General to ensure that the annual reports of the Office continue to include a brief description of any impairment of its independence;",
    "8": "Encourages United Nations internal and external oversight bodies to further enhance the level of cooperation with one another, such as through joint work- planning sessions, without prejudice to the independence of each;",
    "9": "Reaffirms that the Board of Auditors and the Joint Inspection Unit shall continue to be provided with copies of all reports produced by the Office, and requests that those reports be made available within one month of their finalization;",
    "10": "Takes note of the report of the Office of Internal Oversight Services on its activities for the period from 1 July 2019 to 30 June 2020;",
    "11": "Requests the Secretary-General to ensure that all relevant resolutions pertaining to the work of the Office are brought to the attention of the relevant managers;",
    "12": "Also requests the Secretary-General to ensure that all relevant resolutions, including those of a cross-cutting nature, are brought to the attention of relevant managers and that the Office also takes those resolutions into account in the conduct of its activities;",
    "13": "Notes with appreciation the efforts of the Office to improve the implementation by the Organization of its recommendations, including through increased engagement with entities on long open recommendations and providing clearer recommendations with a focus on implementation, and encourages the Office to continue to make recommendations more actionable;",
    "14": "Welcomes the reviewed approach of the Office towards recommendations, and requests the Secretary-General to continue to increase efforts to ensure the full implementation of the accepted recommendations of the Office, including those related to accountability mechanisms, cost savings, recovery of overpayments, technological improvements, organizational efficiency and effectiveness and other improvements, in a prompt and timely manner, and to provide detailed justifications in cases in which recommendations of the Office are not accepted;",
    "15": "Notes with concern the continued delays in the implementation of the recommendations of the Office, and requests the Secretary-General to implement the outstanding and critical recommendations of the Office in a timely manner;",
    "16": "Welcomes the continued efforts of the Office to promote the Organization\u2019s zero-tolerance approach to fraud, corruption, sexual harassment and sexual exploitation and abuse, and the actions taken in this regard, including the creation of a specialized team to investigate sexual harassment complaints and the implementation of a procedure for addressing such complaints, and also welcomes Report on the activities of the Office of Internal Oversight Services A/RES/75/247 3/4 21-00054 the efforts made to strengthen the investigative capacity of the Office in the light of the need to improve the average time required to complete the growing number of investigations into a range of misconduct, including cases of sexual harassment;",
    "17": "Commends the Office for reducing the average time taken to complete investigations, and encourages the Office to continue to reduce the average time taken to complete investigations in order to meet relevant time frames as prescribed by the Office in its programme impact pathways, and to continue to report on the measures undertaken in this regard in its next report;",
    "18": "Notes the impacts of the coronavirus disease (COVID-19) pandemic, in particular the restrictions on travel and movement, on the ability of the Office to conduct investigations, encourages the Office to enhance its other capacities to mitigate any gaps created by the pandemic, and requests the Office to provide information in its next report on the direct impact of the pandemic on its ability to carry out investigations fully;",
    "19": "Encourages the Office to continue to ensure the oversight, through audits and investigations, of United Nations peacekeeping missions that are closing and to report thereon in its next report;",
    "20": "Recognizes the high level of risk inherent in United Nations procurement activities, and requests the Secretary-General to entrust the Office with strengthening its focus on the monitoring of such activities, including on evaluating implementation and existing practice within the Organization regarding restrictions on employment after separation of staff involved in the procurement process and sanctions for violations, as well as with reporting thereon in conjunction with the related report of the Secretary-General on procurement;",
    "21": "Welcomes the efforts and progress made by the Office in reducing the number of vacant posts, and requests the Secretary-General to continue to make every effort to fill the remaining vacant posts and ensure the retention of staff, particularly in the Inspection and Evaluation Division, in accordance with Article 101 of the Charter of the United Nations; II Activities of the Independent Audit Advisory Committee Recalling its resolutions 61/275 of 29 June 2007, 64/263, section II of its resolution 65/250, section II of its resolution 66/236, section II of its resolution 67/258, section II of its resolution 68/21, section II of its resolution 69/252, section II of its resolution 70/111, section II of its resolution 71/7, section II of its resolution 72/18, section II of its resolution 73/275 and section II of its resolution 74/256, Having considered the report of the Independent Audit Advisory Committee on its activities for the period from 1 August 2019 to 31 July 2020, 2"
  },
  "agenda_items": [
    "Item 139"
  ],
  "symbol_references": []
}