{
  "symbol": "A/RES/80/101",
  "filename": "A_RES_80_101.pdf",
  "title": "80/101. Question of Tokelau",
  "text": "United Nations \nA/RES/80/101 \n \nGeneral Assembly \nDistr.: General \n8 December 2025 \n25-20114 (E) \n*2520114* \n \n \nEightieth session \nAgenda item 58 \nImplementation of the Declaration on the Granting \nof Independence to Colonial Countries and Peoples  \n \n \n \n \n Resolution adopted by the General Assembly \non 5 December 2025 \n \n \n[on the report of the Special Political and Decolonization Committee \n(Fourth Committee) (A/80/537, para. 15)] \n \n \n 80/101. Question of Tokelau \n \n \n \nThe General Assembly, \n \nHaving considered the question of Tokelau, \n \nTaking note of the report of the Special Committee on the Situation with regard \nto the Implementation of the Declaration on the Granting of Independence to Colonial \nCountries and Peoples for 2025,1 \n \nRecalling its resolution 1514 (XV) of 14 December 1960, containing the \nDeclaration on the Granting of Independence to Colonial Countries and Peoples, and \nall resolutions and decisions of the United Nations relating to Non-Self-Governing \nTerritories, in particular General Assembly resolution 79/110 of 4 December 2024,  \n \nNoting with appreciation the continuing cooperation of New Zealand as the \nadministering Power with regard to the work of the Special Committee relating to \nTokelau and its readiness to permit access by United Nations visiting missions to the \nTerritory,  \n \nNoting with appreciation also the collaborative contribution to the development \nof Tokelau by New Zealand and the specialized agencies and other organizations of \nthe United Nations system, in particular the United Nations Development Programme \nand the Food and Agriculture Organization of the United Nations, \n \nBearing in mind that, as a small island Territory, Tokelau exemplifies the \nsituation of most remaining Non-Self-Governing Territories and that, as a case study \npointing to successful cooperation for decolonization, Tokelau has wider significance \nfor the United Nations as it seeks to complete its work in decolonization, \n_______________ \n \n1 Official Records of the General Assembly, Eightieth Session, Supplement No. 23 (A/80/23). \n\nA/RES/80/101 \nQuestion of Tokelau\n \n25-20114\n2/5 \n \n \nRecalling the status of Tokelau as an associate member of the Food and \nAgriculture Organization of the United Nations and of the Pacific Islands Forum, \n \nAcknowledging the importance of the health and well-being of the Territory and \nits people,  \n \nCognizant that New Zealand and Tokelau signed, on 21 November 2003, a \ndocument entitled \u201cJoint statement of the principles of partnership\u201d, which sets out \nthe rights and responsibilities of the two partners, including in relation to the question \nof self-determination for Tokelau, \n \nBearing in mind the decision of the General Fono at its meeting in November \n2003, following extensive consultations undertaken in all three villages, to explore \nformally with New Zealand the option of self-government in free association, its \ndecision in August 2005 to hold in February 2006 a referendum on self-determination \non the basis of a draft constitution for Tokelau and a draft treaty of free association \nwith New Zealand, and its subsequent decision to hold a further referendum in \nOctober 2007, and bearing in mind also that the two referendums did not produce the \ntwo-thirds majority of valid votes cast required by the General Fono to change the \nstatus of Tokelau from that of a Non-Self-Governing Territory under the \nadministration of New Zealand, \n \nRecalling the decision of the General Fono on 23 May 2022 to revive dialogue \non self-determination for Tokelau in the lead-up to the centenary of New Zealand \nadministration of Tokelau in February 2026, which was supported by New Zealand, \nas the administering Power,  \n \nRecalling also the holding of free and fair elections in the Territory on \n26 January 2023, and noting the change of the Ulu-o-Tokelau during the General \nFono, on 17 March 2025, \n \nRecalling further the 2013 constitutional consultations, to be further considered \nby the Constitution Committee, which were driven by the people of Tokelau and \nwhich aimed at developing a model of government structure that is culturally \nappropriate and sensitive to their current situation, culminating in the approval and \nratification of the national symbol of the Territory, along with the constitution, \nnational anthem and national flag,  \n \nCognizant of the statement made by the Ulu-o-Tokelau at the Pacific regional \nseminar on the implementation of the Third International Decade for the Eradication \nof Colonialism, held in Nadi, Fiji, from 21 to 23 May 2014, and also of the written \nstatement for the Pacific regional seminar held in Saint George\u2019s from 9 to 11 May \n2018, as well as the statement made on 12 June 2023 to the resumed session of the \nSpecial Committee, that the self-determination process of the Territory could not be \naddressed in isolation from the threat of climate change, the rise in sea level and the \nchallenges to the 2030 Agenda for Sustainable Development,2 and bearing in mind \nthe development aspirations of Tokelau as expressed in its revised National Strategic \nPlan 2021\u20132026, with a shared vision of \u201cThriving communities with opportunities \nfor all\u201d, including an ambition to confidently declare that Tokelau has made \nsignificant progress in its development journey and that it is ready and capable of \nproceeding to be a self-governing nation, \n \nRecalling the official launch in April 2017 of the climate change strategy of \nTokelau, entitled \u201cLiving with change: an integrated national strategy for enhancing \nthe resilience of Tokelau to climate change and related hazards, 2017\u20132030\u201d, and the \nimplementation plan for the first five years of the strategy, from 1 July 2017 to \n_______________ \n \n2 Resolution 70/1. \n\nQuestion of Tokelau \nA/RES/80/101\n \n3/5\n25-20114 \n \n30 June 2022, and recalling the launch of the Tokelau national greenhouse gas \ninventory report on 11 April 2019, \n \nRecalling also the announcement of the administering Power that, as requested \nby the Government of Tokelau, it had submitted a formal declaration to the United \nNations to extend the territorial application of both the United Nations Framework \nConvention on Climate Change3 and the Paris Agreement4 to Tokelau, \n \nNoting with concern the impact of climate change and sea level rise on the \nlivelihood of the people of Tokelau and its humanitarian, economic, social, cultural \nand ecological consequences, \n \nRecalling the statements made by the representatives of the Government of New \nZealand, as the administering Power, on 17 June 2019, at a session of the Special \nCommittee, and at the Caribbean regional seminar held in Grand Anse, Grenada, in \nMay 2019, which underlined the shared vision with Tokelau of building a stronger \npartnership, including on the governance and more effective management of public \nservices, finances and infrastructure assets, with emphasis on quality healthcare and \neducation, gender empowerment, disaster risk mitigation and resilience-building, and \nenhancing inter-atoll connectivity, including the vessel to support search and rescue \nmissions, medical evacuations and general transport between the atolls, which entered \ninto service in April 2019, as well as at the 9th meeting of the Special Political and \nDecolonization Committee (Fourth Committee), on 14 October 2022, and on 12 June \n2023 at the resumed session of the Special Committee on the Situation with regard to \nthe Implementation of the Declaration on the Granting of Independence to Colonial \nCountries and Peoples, where it further reaffirmed the strengthened partnership \nbetween New Zealand and Tokelau, including in combating the coronavirus disease \n(COVID\u201119) pandemic, and commitment to work in trilateral cooperation with the \nUnited Nations to deliver on the self-determination outcome as desired by the people \nof Tokelau,  \n \nRecalling also the landmark first-ever international submarine fibre-optic cable \nconnecting to Tokelau on 20 September 2021 for strengthening information and \ncommunications technology for the sustainable development of Tokelau, \n \nTaking note of the special committee established in Tokelau to ensure that all \nresidents are well informed ahead of a potential third referendum regarding their \npolitical status, as announced by the Ulu-o-Tokelau in March 2025, which aims to \ngather comprehensive details about the choices available to the people of Tokelau and \nto emphasize the importance of understanding the effects of the outcome of the \nreferendum for its people, \n \n1. \nRecalls with appreciation the decision of the General Fono on 23 May \n2022 to revisit the views of the people of Tokelau and revive the dialogue on the \nquestion of self-determination for Tokelau in the lead-up to the centenary of New \nZealand administration of Tokelau in February 2026; \n \n2. \nWelcomes the progress made towards the devolution of power to the three \ntaupulega (village councils) since 2004, and notes that further discussion is planned \non the recommendations in the report on the devolution review, compiled in 2012, \nand the additional recent efforts in Tokelau in addressing a future governance model \nthat accounts for, inter alia, the Territory\u2019s religious faith, culture and identity; \n \n3. \nRecalls with satisfaction the democratic elections in Tokelau held on \n23 January 2020 for the tenth General Fono and the subsequent swearing-in of the \n_______________ \n \n3 United Nations, Treaty Series, vol. 1771, No. 30822. \n \n4 See FCCC/CP/2015/10/Add.1, decision 1/CP.21, annex. \n\nA/RES/80/101 \nQuestion of Tokelau\n \n25-20114\n4/5 \n \nUlu-o-Tokelau on 8 March 2021, and the subsequent change of the Ulu-o-Tokelau on \n19 May 2022 at the General Fono, and also notes the most recent election of the \nGeneral Fono on 26 January 2023 and the subsequent inauguration of the Ulu-o-\nTokelau in March 2025;  \n \n4. \nRecognizes the ongoing socioeconomic development challenges posed by \nthe COVID\u201119 pandemic to Tokelau, including the first recorded cases of community \ntransmission in May 2023, and the close cooperation with the administering Power, \nNew Zealand, neighbouring countries and the World Health Organization in \nsuccessfully addressing the pandemic in Tokelau;  \n \n5. \nNotes with appreciation that Tokelau and New Zealand remain firmly \ncommitted to the ongoing development of Tokelau for the long-term benefit of the \npeople of Tokelau, with particular emphasis on the further development of facilities \non each atoll that meet their current requirements, including investment that has \nenabled Tokelau to be directly connected by an undersea fibre-optic cable on \n20 September 2021 for faster and more reliable Internet services, improved maritime \ntransport infrastructure and services, quality healthcare and education and support for \nthe fisheries sector; and encourages the administering Power to work collaboratively \nwith Tokelau to expedite implementation of plans for the development of Tokelau;  \n \n6. \nTakes note of the National Strategic Plan 2021\u20132026 of Tokelau, which \nfurther prioritizes good governance, human and infrastructure development, \ntelecommunication, transportation, sustainability and climate change adaptation, as \nan important framework for the Territory\u2019s sustainable future, with a shared vision of \n\u201cThriving communities with opportunities for all\u201d; \n \n7. \nAcknowledges the ongoing and consistent commitment of New Zealand to \nmeeting the social and economic requirements of the people of Tokelau, including \nthrough new shipping service assets and shipping infrastructure development, and \nbudget support for the delivery of education services ranging from early childhood \neducation to foundation courses for tertiary study, as well as the support and \ncooperation of the United Nations Development Programme and the World Health \nOrganization; \n \n8. \nRecalls the completion by Tokelau in 2013 of the Tokelau Renewable \nEnergy Project with the support of the administering Power and the receipt by the \nGovernment of the Renewable Energy Award granted by the New Zealand Energy \nEfficiency and Conservation Authority; \n \n9. \nAlso recalls measures taken by Tokelau to safeguard the health of its \npeople, including the continued implementation of universal health coverage with the \nsupport of the administering Power, the United Nations system and relevant \nstakeholders;  \n \n10. Acknowledges the need of Tokelau for continued support from the \ninternational community and its desire to become part of the discussions on the 2030 \nAgenda for Sustainable Development, the impacts of climate change and the \nprotection of the environment and oceans, and in this regard encourages, as \nappropriate, assistance towards the implementation of the climate change strategy of \nTokelau, entitled \u201cLiving with change: an integrated national strategy for enhancing \nthe resilience of Tokelau to climate change and related hazards, 2017\u20132030\u201d; \n \n11. Appreciates the efforts of the administering Power to include in its national \nreporting to the secretariat of the United Nations Framework Convention on Climate \nChange the climate mitigation action taken by Tokelau, and also recalls the milestone \nachievement of Tokelau in the launch of its national greenhouse gas inventory report \non 11 April 2019; \n\nQuestion of Tokelau \nA/RES/80/101\n \n5/5\n25-20114 \n \n \n12. Recalls with satisfaction the establishment and operation of the Tokelau \nInternational Trust Fund to support the ongoing needs of Tokelau, and calls upon \nMember States and international and regional agencies to contribute to the Fund and \nthereby lend practical support to Tokelau in overcoming the problems of smallness, \nisolation and lack of resources; \n \n13. Welcomes the ongoing cooperative attitude of the other States and \nterritories in the Pacific region towards Tokelau and their support for its economic \nand political aspirations and its increasing participation in regional and international \naffairs, including at the fiftieth Pacific Islands Forum Leaders Meeting, held in Tuvalu \nin August 2019, as an associate member, represented by the Ulu-o-Tokelau; \n \n14. Calls upon the administering Power and United Nations agencies to \ncontinue to provide assistance to Tokelau as it further develops; \n \n15. Calls upon the administering Power to consider prioritizing the \ndevelopment of climate-related projects, such as shelters and coastal defences to \ncounter the impacts of climate change and sea level rise;  \n \n16. Recognizes the positive actions taken by the administering Power to \ntransmit to the Secretary-General under Article 73 e of the Charter of the United \nNations information regarding the political, economic and social situation of Tokelau; \n \n17. Commends the renewed strong commitment of both Tokelau and New \nZealand to continuing to work together in the interests of Tokelau and its people; \n \n18. Calls upon the administering Power to strengthen technical assistance and \ncapacity-building programmes aimed at enhancing the human resources capacity of \nTokelau;  \n \n19. Requests the Special Committee on the Situation with regard to the \nImplementation of the Declaration on the Granting of Independence to Colonial \nCountries and Peoples to continue to examine the question of the Non-Self-Governing \nTerritory of Tokelau and to report thereon to the General Assembly at its eighty-first \nsession.  \n \n55th plenary meeting \n5 December 2025 \n \n",
  "paragraphs": {
    "1": "Recalls with appreciation the decision of the General Fono on 23 May 2022 to revisit the views of the people of Tokelau and revive the dialogue on the question of self-determination for Tokelau in the lead-up to the centenary of New Zealand administration of Tokelau in February 2026;",
    "2": "Welcomes the progress made towards the devolution of power to the three taupulega (village councils) since 2004, and notes that further discussion is planned on the recommendations in the report on the devolution review, compiled in 2012, and the additional recent efforts in Tokelau in addressing a future governance model that accounts for, inter alia, the Territory\u2019s religious faith, culture and identity;",
    "3": "Recalls with satisfaction the democratic elections in Tokelau held on 23 January 2020 for the tenth General Fono and the subsequent swearing-in of the _______________ 3 United Nations, Treaty Series, vol. 1771, No. 30822. 4 See FCCC/CP/2015/10/Add.1, decision 1/CP.21, annex. A/RES/80/101 Question of Tokelau 25-20114 4/5 Ulu-o-Tokelau on 8 March 2021, and the subsequent change of the Ulu-o-Tokelau on 19 May 2022 at the General Fono, and also notes the most recent election of the General Fono on 26 January 2023 and the subsequent inauguration of the Ulu-o- Tokelau in March 2025;",
    "4": "Recognizes the ongoing socioeconomic development challenges posed by the COVID\u201119 pandemic to Tokelau, including the first recorded cases of community transmission in May 2023, and the close cooperation with the administering Power, New Zealand, neighbouring countries and the World Health Organization in successfully addressing the pandemic in Tokelau;",
    "5": "Notes with appreciation that Tokelau and New Zealand remain firmly committed to the ongoing development of Tokelau for the long-term benefit of the people of Tokelau, with particular emphasis on the further development of facilities on each atoll that meet their current requirements, including investment that has enabled Tokelau to be directly connected by an undersea fibre-optic cable on 20 September 2021 for faster and more reliable Internet services, improved maritime transport infrastructure and services, quality healthcare and education and support for the fisheries sector; and encourages the administering Power to work collaboratively with Tokelau to expedite implementation of plans for the development of Tokelau;",
    "6": "Takes note of the National Strategic Plan 2021\u20132026 of Tokelau, which further prioritizes good governance, human and infrastructure development, telecommunication, transportation, sustainability and climate change adaptation, as an important framework for the Territory\u2019s sustainable future, with a shared vision of \u201cThriving communities with opportunities for all\u201d;",
    "7": "Acknowledges the ongoing and consistent commitment of New Zealand to meeting the social and economic requirements of the people of Tokelau, including through new shipping service assets and shipping infrastructure development, and budget support for the delivery of education services ranging from early childhood education to foundation courses for tertiary study, as well as the support and cooperation of the United Nations Development Programme and the World Health Organization;",
    "8": "Recalls the completion by Tokelau in 2013 of the Tokelau Renewable Energy Project with the support of the administering Power and the receipt by the Government of the Renewable Energy Award granted by the New Zealand Energy Efficiency and Conservation Authority;",
    "9": "Also recalls measures taken by Tokelau to safeguard the health of its people, including the continued implementation of universal health coverage with the support of the administering Power, the United Nations system and relevant stakeholders;",
    "10": "Acknowledges the need of Tokelau for continued support from the international community and its desire to become part of the discussions on the 2030 Agenda for Sustainable Development, the impacts of climate change and the protection of the environment and oceans, and in this regard encourages, as appropriate, assistance towards the implementation of the climate change strategy of Tokelau, entitled \u201cLiving with change: an integrated national strategy for enhancing the resilience of Tokelau to climate change and related hazards, 2017\u20132030\u201d;",
    "11": "Appreciates the efforts of the administering Power to include in its national reporting to the secretariat of the United Nations Framework Convention on Climate Change the climate mitigation action taken by Tokelau, and also recalls the milestone achievement of Tokelau in the launch of its national greenhouse gas inventory report on 11 April 2019; Question of Tokelau A/RES/80/101 5/5 25-20114",
    "12": "Recalls with satisfaction the establishment and operation of the Tokelau International Trust Fund to support the ongoing needs of Tokelau, and calls upon Member States and international and regional agencies to contribute to the Fund and thereby lend practical support to Tokelau in overcoming the problems of smallness, isolation and lack of resources;",
    "13": "Welcomes the ongoing cooperative attitude of the other States and territories in the Pacific region towards Tokelau and their support for its economic and political aspirations and its increasing participation in regional and international affairs, including at the fiftieth Pacific Islands Forum Leaders Meeting, held in Tuvalu in August 2019, as an associate member, represented by the Ulu-o-Tokelau;",
    "14": "Calls upon the administering Power and United Nations agencies to continue to provide assistance to Tokelau as it further develops;",
    "15": "Calls upon the administering Power to consider prioritizing the development of climate-related projects, such as shelters and coastal defences to counter the impacts of climate change and sea level rise;",
    "16": "Recognizes the positive actions taken by the administering Power to transmit to the Secretary-General under Article 73 e of the Charter of the United Nations information regarding the political, economic and social situation of Tokelau;",
    "17": "Commends the renewed strong commitment of both Tokelau and New Zealand to continuing to work together in the interests of Tokelau and its people;",
    "18": "Calls upon the administering Power to strengthen technical assistance and capacity-building programmes aimed at enhancing the human resources capacity of Tokelau;",
    "19": "Requests the Special Committee on the Situation with regard to the Implementation of the Declaration on the Granting of Independence to Colonial Countries and Peoples to continue to examine the question of the Non-Self-Governing Territory of Tokelau and to report thereon to the General Assembly at its eighty-first session. 55th plenary meeting 5 December 2025"
  },
  "agenda_items": [
    "Item 58"
  ],
  "symbol_references": []
}