{
  "symbol": "A/RES/72/237",
  "filename": "A_RES_72_237.pdf",
  "title": "72/237. South-South cooperation",
  "text": "United Nations \nA/RES/72/237\n \n \nGeneral Assembly \nDistr.: General \n23 January 2018 \n \n17-23315 (E)    260118 \n*1723315* \n \n \nSeventy-second session \nAgenda item 24 (b) \n \n \n \n \n Resolution adopted by the General Assembly \non 20 December 2017 \n \n \n \n \n[on the report of the Second Committee (A/72/425/Add.2)] \n \n \n 72/237. South-South cooperation  \n \n \n \nThe General Assembly, \n \nReaffirming its resolution 64/222 of 21 December 2009, in which it endorsed \nthe Nairobi outcome document of the High-level United Nations Conference on \nSouth-South Cooperation, \n \nReaffirming also its resolution 33/134 of 19 December 1978, in which it \nendorsed the Buenos Aires Plan of Action for Promoting and Implementing Technical \nCooperation among Developing Countries,1  \n \nRecalling its resolutions 57/270 B of 23 June 2003, 60/212 of 22 December \n2005, 62/209 of 19 December 2007, 63/233 of 19 December 2008, 64/1 of 6 October \n2009, 66/219 of 22 December 2011, 67/227 of 21 December 2012, 68/230 of \n20 December 2013, 69/239 of 19 December 2014, 70/222 of 22 December 2015 and \n71/244 of 21 December 2016, \n \nReaffirming its resolution 71/318 of 28 August 2017, on the modalities of the \nSecond High-level United Nations Conference on South-South Cooperation, \n \nReaffirming also its resolution 70/1 of 25 September 2015, entitled \n\u201cTransforming our world: the 2030 Agenda for Sustainable Development\u201d, in which \nit adopted a comprehensive, far-reaching and people-centred set of universal and \ntransformative Sustainable Development Goals and targets, its commitment to \nworking tirelessly for the full implementation of the Agenda by 2030, its recognition \nthat eradicating poverty in all its forms and dimensions, including extreme poverty, \nis the greatest global challenge and an indispensable requirement for sustainable \ndevelopment, its commitment to achieving sustainable development in its three \ndimensions \u2014 economic, social and environmental \u2014 in a balanced and integrated \n__________________ \n \n1  Report of the United Nations Conference on Technical Cooperation among Developing \nCountries, Buenos Aires, 30 August\u201312 September 1978 (United Nations publication, Sales \nNo. E.78.II.A.11 and corrigendum), chap. I. \n\nA/RES/72/237 \nSouth-South cooperation\n \n17-23315 \n2/7 \n \nmanner, and to building upon the achievements of the Millennium Development \nGoals and seeking to address their unfinished business, \n \nReaffirming further its resolution 69/313 of 27 July 2015 on the Addis Ababa \nAction Agenda of the Third International Conference on Financing for Development, \nwhich is an integral part of the 2030 Agenda for Sustainable Development, supports \nand complements it, helps to contextualize its means of implementation targets with \nconcrete policies and actions, and reaffirms the strong political commitment to \naddress the challenge of financing and creating an enabling environment at all levels \nfor sustainable development in the spirit of global partnership and solidarity, \n \nRecalling its resolution 69/283 of 3 June 2015 on the Sendai Framework for \nDisaster Risk Reduction 2015\u20132030, \n \nWelcoming the Paris Agreement2 and its early entry into force, encouraging all \nits parties to fully implement the Agreement, and parties to the United Nations \nFramework Convention on Climate Change3 that that have not yet done so to deposit \ntheir instruments of ratification, acceptance, approval or accession, where \nappropriate, as soon as possible, \n \nWelcoming also the convening of the twenty-third session of the Conference of \nthe Parties to the United Nations Framework Convention on Climate Change, the \nthirteenth session of the Conference of the Parties serving as the Meeting of the \nParties to the Kyoto Protocol and the second part of the first session of the Conference \nof the Parties serving as the Meeting of the Parties to the Paris Agreement, held in \nBonn, Germany, from 6 to 17 November 2017, \n \nWelcoming further the New Urban Agenda, adopted at the United Nations \nConference on Housing and Sustainable Urban Development (Habitat III), held in \nQuito, Ecuador, from 17 to 20 October 2016,4  \n \nWelcoming the convening of the first preparatory symposium for the 2018 \nDevelopment Cooperation Forum, hosted by the Government of Argentina, from 6 to \n8 September 2017, with the support of the Department of Economic and Social Affairs \nof the Secretariat, on the theme \u201cSouth-South and triangular cooperation for achieving \nthe 2030 Agenda. Building innovative and inclusive partnerships\u201d, \n \nNoting that 2018 will mark the commemoration of the fortieth anniversary of \nthe adoption of the Buenos Aires Plan of Action, \n \nRecognizing that, since the adoption of the Buenos Aires Plan of Action, South-\nSouth cooperation has intensified significantly, achieving a prominent level of \ninstitutionalization, increasingly engaging national and international players, \nfostering regional integration and strengthening its contribution to sustainable \ndevelopment in its three dimensions, \n \nRecognizing also that South-South cooperation is increasingly critical to \nbolstering the productive capacities of developing countries and has positive impacts \non trade and financial flows, technological capabilities and economic growth, and \nreiterating the importance of global partnerships, \n \nReiterating the pledge that no one will be left behind, reaffirming the \nrecognition that the dignity of the human person is fundamental, and the wish to see \nthe Goals and targets met for all nations and peoples and for all segments of society, \nand recommitting to endeavour to reach the furthest behind first, \n__________________ \n \n2  Adopted under the UNFCCC in FCCC/CP/2015/10/Add.1, decision 1/CP.21. \n \n3  United Nations, Treaty Series, vol. 1771, No. 30822 \n \n4  Resolution 71/256, annex. \n\nSouth-South cooperation \nA/RES/72/237\n \n3/7 \n17-23315 \n \n \nRecommitting to ensuring that no country or person is left behind and to focusing \nour effort where the challenges are greatest, including by ensuring the inclusion and \nparticipation of those who are furthest behind, \n \n1. \nTakes note of the decisions adopted by the High-level Committee on \nSouth-South Cooperation at its nineteenth session, held from 16 to 19 May 2016;5  \n \n2. \nAlso takes note of the report of the Secretary-General on the state of South-\nSouth cooperation6 and his report entitled \u201cComprehensive proposal on concrete ways \nto enhance the role and impact of the United Nations Office for South-South \nCooperation as well as the key measures taken to improve the coordination and \ncoherence of United Nations support to South-South cooperation\u201d,7 as well as the \nreport of the Joint Inspection Unit on South-South and triangular cooperation in the \nUnited Nations system, of 2011, and the Secretary-General\u2019s response;8  \n \n3. \nReiterates its request to the Joint Inspection Unit to present, by the end of \nthe seventy-second session of the General Assembly, a progress report on its \nrecommendations to the United Nations development system on implementing \nmeasures to further strengthen the United Nations Office for South-South \nCooperation; \n \n4. \nRecognizes the importance and unique history and particularities of South-\nSouth cooperation, reaffirms its view of South-South cooperation as a manifestation \nof solidarity among peoples and countries of the South that contributes to their \nnational well-being, national and collective self-reliance and the attainment of the \nSustainable Development Goals,9 which build upon the achievements of the \nMillennium Development Goals and seek to address their unfinished business, and \nalso reaffirms that South-South cooperation and its agenda must be set by countries \nof the South and should continue to be guided by the principles of respect for national \nsovereignty, national ownership and independence, equality, non-conditionality, \nnon-interference in domestic affairs and mutual benefit; \n \n5. \nStresses that South-South cooperation is not a substitute for, but rather a \ncomplement to, North-South cooperation; \n \n6. \nWelcomes the increased contributions of South-South cooperation to \npoverty eradication and sustainable development, encourages developing countries to \nvoluntarily step up their efforts to strengthen South-South cooperation and to further \nimprove its development effectiveness, in accordance with the provisions of the \nNairobi outcome document of the High-level United Nations Conference on South-\nSouth Cooperation,10 and welcomes commitments to strengthen triangular \ncooperation as a means of bringing relevant experience and expertise to bear in \ndevelopment cooperation; \n \n7. \nReaffirms that South-South cooperation is a common endeavour of peoples \nand countries of the South, born out of shared experiences and sympathies, based on \ntheir common objectives and solidarity and guided by, inter alia, the principles of \nrespect for national sovereignty and ownership, free from any conditionalities, that \nSouth-South cooperation should not be seen as official development assistance and \nthat it is a partnership among equals based on solidarity, acknowledges in this regard \nthe need to enhance the development effectiveness of South-South cooperation by \n__________________ \n \n5  See Official Records of the General Assembly, Seventy-first Session, Supplement No. 39 \n(A/71/39), chap. I. \n \n6  A/71/208. \n \n7  SSC/19/2. \n \n8  A/66/717 and A/66/717/Add.1. \n \n9  See resolution 70/1. \n \n10  Resolution 64/222, annex. \n\nA/RES/72/237 \nSouth-South cooperation\n \n17-23315 \n4/7 \n \ncontinuing to increase its mutual accountability and transparency as well as \ncoordinating its initiatives with other development projects and programmes on the \nground, in accordance with national development plans and priorities, and recognizes \nthat the impact of South-South cooperation should be assessed with a view to \nimproving, as appropriate, its quality in a results-oriented manner; \n \n8. \nAcknowledges the progress made and encourages the continued integration \nof South-South cooperation and triangular cooperation into the policies and strategic \nframeworks of the funds, programmes and specialized agencies of the United Nations \nsystem, and requests those funds, programmes and specialized agencies of the United \nNations system that have not yet integrated South-South and triangular cooperation \ninto their policies to do so, taking into account the Nairobi outcome document of the \nHigh-level United Nations Conference on South-South Cooperation, the 2030 Agenda \nfor Sustainable Development11 and the complementary nature of South-South to \nNorth-South cooperation; \n \n9. \nReiterates its request to the Chair of the United Nations Development \nGroup to make specific recommendations on additional support that United Nations \nsystem organizations and all States could provide to South-South and triangular \ncooperation, which could include the voluntary secondment of staff and the \nappointment of Junior Professional Officers to the United Nations Office for South-\nSouth Cooperation, as well as measures to strengthen the system-wide efficiency and \nimpact of the Office; \n \n10. Requests the Secretary-General to make necessary adjustments, as \nappropriate, to the framework of operational guidelines on United Nations support to \nSouth-South and triangular cooperation,12 in consultation with all States and \norganizations of the United Nations development system; \n \n11. \nReaffirms the mandate and the central role of the United Nations Office \nfor South-South Cooperation as the focal point for promoting and facilitating South-\nSouth and triangular cooperation for development on a global and United Nations \nsystem-wide basis; \n \n12. Reiterates the request to the Chair of the United Nations Development \nGroup to establish a more formalized and strengthened inter-agency mechanism, \ncoordinated by the United Nations Office for South-South Cooperation, with a view \nto encouraging joint support to South-South and triangular initiatives and sharing \ninformation on development activities and results achieved by various organizations \nthrough their respective business models in support of South-South and triangular \ncooperation, calls upon the United Nations development system to designate \nrepresentational focal points to join the mechanism, requests the Chair of the United \nNations Development Group to give the United Nations Office for South-South \nCooperation the opportunity to be represented more regularly in strategic and \ncoordination mechanisms of the United Nations Development Group when matters \naffecting South-South and triangular cooperation are being discussed, and in this \nregard welcomes the progress made by the South-South and Triangular Cooperation \nTask Team of the United Nations Development Group to this effect; \n \n13. Calls upon the United Nations Development Programme and other \nrelevant organizations of the United Nations development system to assist developing \ncountries in implementing projects of South-South cooperation, including sharing \nbest practices and experiences from the South, especially with the least developed \n__________________ \n \n11  Resolution 70/1. \n \n12  SSC/17/3. \n\nSouth-South cooperation \nA/RES/72/237\n \n5/7 \n17-23315 \n \ncountries, upon request and in a manner consistent with their mandates and strategic \nplans; \n \n14. Invites the United Nations development system to encourage the transfer \nof technologies on mutually agreed terms for the benefit of developing countries to \naddress poverty eradication and sustainable development; \n \n15. Welcomes the launch, in the 2030 Agenda for Sustainable Development, \nof the Technology Facilitation Mechanism, and looks forward to its continued \ndevelopment and full operationalization; \n \n16. Requests the United Nations Development Group, including its South-\nSouth and Triangular Cooperation Task Team, and the United Nations country teams, \nwithin existing resources and in close consultation and coordination with the \nGovernments of developing countries and other United Nations organizations, in \nparticular the United Nations Development Programme and the United Nations \nConference on Trade and Development, to continue the mapping and documentation \nof good practices in South-South and triangular cooperation, in particular those that \nare relevant to meeting the Sustainable Development Goals and targets, taking into \naccount the Nairobi outcome document of the High-level United Nations Conference \non South-South Cooperation, the Addis Ababa Action Agenda13 and the \ncomplementary nature of South-South to North-South cooperation; \n \n17. Urges the United Nations to continue to support South-South cooperation \nprojects that contribute to the implementation of the New Urban Agenda, adopted in \nQuito in 2016;4 \n \n18. Takes note with appreciation of the ninth annual Global South-South \nDevelopment Expo, held from 27 to 30 November 2017, hosted by the Government \nof Turkey, on the theme \u201cSouth-South cooperation in the era of economic, social and \nenvironmental transformation: road to the fortieth anniversary of the adoption of the \nBuenos Aires Plan of Action\u201d, which aims at showcasing sustainable development \nsolutions that can be scaled up and replicated through South-South and triangular \ncooperation; \n \n19. Recognizes the important role of South-South cooperation and triangular \ncooperation, and in this context requests the Secretary-General, with the support of \nthe United Nations Office for South-South Cooperation, to take steps, within existing \nresources, to update existing and to create appropriate new policy tools, in order that \nthe United Nations system may effectively support Member States, upon request, in \nusing South-South cooperation and triangular cooperation to assist in the \nimplementation of the 2030 Agenda for Sustainable Development; \n \n20. Acknowledges the positive efforts made by United Nations organizations \nto develop thematic strategies for the implementation of South-South cooperation, \nand in this regard urges the United Nations development system, in consultation with \nall States, to strive to increasingly leverage, as appropriate, South-South cooperation \nto bolster its impact in the context of the implementation of the 2030 Agenda for \nSustainable Development; \n \n21. Requests the United Nations system to enhance its support in the areas \nwhere South-South cooperation has proved effective, namely capacity-building, \nregional integration, interregional linkages, infrastructure interconnectivity and the \ndevelopment of national productive capacities through exchanges of knowledge, \ntechnological innovations and technology transfer on mutually agreed terms, and in \n__________________ \n \n13  Resolution 69/313, annex. \n\nA/RES/72/237 \nSouth-South cooperation\n \n17-23315 \n6/7 \n \nseveral areas of sustainable development such as poverty eradication and gender \nequality and the empowerment of women and girls; \n \n22. Welcomes the support provided by developing countries to South-South \nand triangular initiatives aimed at improving nutrition and food security, and invites \nthe replication of this approach in other relevant areas, drawing on the technical \nexpertise of various United Nations organizations; \n \n23. Recognizes the contribution of South-South cooperation in promoting \ngender equality and the empowerment of women and girls in sustainable \ndevelopment, and encourages further efforts to mainstream gender perspectives in \nSouth-South and triangular cooperation; \n \n24. Notes that, in response to the growing demand for support to South-South \ncooperation at the regional and subregional levels, the regional commissions have \nadvanced South-South cooperation by undertaking policy research and analysis on \nissues of importance to their member States, convening high-level policy dialogues, \nforging strategic partnerships and promoting specific capacity development and other \ninitiatives, and in this regard invites the regional commissions to support developing \ncountries, upon request, in integrating the 2030 Agenda for Sustainable Development \ninto their nationally owned sustainable development strategies, in areas such as \nregional development planning and fiscal frameworks, and to help to promote policy \ncoherence and coordination and the enhancement of the data and statistical capacities \nof member States for the implementation of the 2030 Agenda for Sustainable \nDevelopment; \n \n25. Reaffirms that South-South cooperation has a role to play as a strategic \nlink between regions and embraces a multi-stakeholder approach, including \nnon-governmental organizations, the private sector, civil society, academia and other \nactors that contribute to meeting development challenges and objectives in line with \nnational development strategies and plans; \n \n26. Urges the United Nations system to continue its support to regional and \nsubregional organizations, enabling their member countries to build more \npartnerships and cross-border frameworks, with a view to promoting and scaling up \nbest practices with the potential to benefit a large number of developing countries; \n \n27. Welcomes the growing number of forums convened for Governments and \nother policymakers to discuss, in a participatory and inclusive manner, South-South \ncooperation initiatives and their contribution towards the implementation of the 2030 \nAgenda for Sustainable Development, including addressing challenges, lessons \nlearned and good practices in key areas; \n \n28. Requests the Secretary-General to present, as part of his comprehensive \nreport to the High-level Committee on South-South Cooperation at its twentieth \nsession, in consultation with all States, the United Nations Office for South-South \nCooperation and the United Nations Development Programme, recommendations and \nan update on the concrete steps taken to strengthen the United Nations Office for \nSouth-South Cooperation, taking into account the need to enhance the role and \nimprove the impact of the Office under the auspices of the United Nations \nDevelopment Programme, including in the areas of financial, human and budgetary \nresources and through the potential appointment of a Special Representative of the \nSecretary-General on South-South Cooperation, as well as to clarify the management \nrelationships, reporting lines and functions and to improve transparency, \naccountability and efficiency, taking into account matters covered in the report of the \nHigh-level Committee on South-South Cooperation on its nineteenth session, 14 \n__________________ \n \n14  Official Records of the General Assembly, Seventy-first Session, Supplement No. 39 (A/71/39). \n\nSouth-South cooperation \nA/RES/72/237\n \n7/7 \n17-23315 \n \nCommittee decision 19/1 of 19 May 2016 and decision 2016/13 of 10 June 2016 of \nthe Executive Board of the United Nations Development Programme, the United \nNations Population Fund and the United Nations Office for Project Services; 15  \n \n29. Recognizes the need to mobilize adequate resources for enhancing South-\nSouth and triangular cooperation, and in this context invites all countries in a position \nto do so to contribute, in support of such cooperation, to the United Nations Fund for \nSouth-South Cooperation and to the P\u00e9rez-Guerrero Trust Fund for South-South \nCooperation, in accordance with its resolution 57/263 of 20 December 2002, and to \nsupport other initiatives for all developing countries, including technology transfer \namong developing countries on mutually agreed terms; \n \n30. Requests the United Nations Office for South-South Cooperation to \ncontinue to effectively provide the secretariat required by States in marking the \nfortieth anniversary of the adoption in 1978 of the Buenos Aires Plan of Action for \nPromoting and Implementing Technical Cooperation among Developing Countries; \n \n31. Recognizes the need to strengthen and further invigorate South-South \ncooperation, in this regard reiterates its decision to convene the Second High-level \nUnited Nations Conference on South-South Cooperation on the occasion of the \nfortieth anniversary of the adoption of the Buenos Aires Plan of Action, to be held in \nBuenos Aires from 20 to 22 March 2019; \n \n32. Calls upon all Member States to participate fully and constructively in the \nHigh-level United Nations Conference on South-South Cooperation to be held in \nBuenos Aires in 2019, and welcomes the Secretary-General\u2019s recommendation to the \nUnited Nations system to provide substantive inputs to inform discussions among the \nStates in preparation for the Conference, through the United Nations Office for South-\nSouth Cooperation as Conference secretariat; \n \n33. Welcomes the generous offer by the Government of Argentina to host and \nassume all costs of the High-level United Nations Conference on South-South \nCooperation; \n \n34. Calls upon the relevant organizations of the United Nations system, within \ntheir respective mandates and resources, to ensure that no one is left behind and no \ncountry is left behind in the implementation of the present resolution; \n \n35. Decides to include in the provisional agenda of its seventy-third session, \nunder the item entitled \u201cOperational activities for development\u201d, the sub-item entitled \n\u201cSouth-South cooperation for development\u201d, unless otherwise agreed, and requests \nthe Secretary-General to submit to the General Assembly at its seventy-third session \na comprehensive report on the state of South-South cooperation, including an \nassessment of the concrete measures taken by the United Nations development system \nto improve its support to South-South cooperation at the global, regional and national \nlevels, as appropriate, and on the implementation of the present resolution, including \nall aspects set out in paragraph 28 above, on an exceptional basis and without setting \nany precedent for future reports of the Secretary-General. \n \n74th plenary meeting  \n20 December 2017 \n \n__________________ \n \n15  See DP/2016/19. \n",
  "paragraphs": {
    "1": "Takes note of the decisions adopted by the High-level Committee on South-South Cooperation at its nineteenth session, held from 16 to 19 May 2016;5",
    "2": "Also takes note of the report of the Secretary-General on the state of South- South cooperation6 and his report entitled \u201cComprehensive proposal on concrete ways to enhance the role and impact of the United Nations Office for South-South Cooperation as well as the key measures taken to improve the coordination and coherence of United Nations support to South-South cooperation\u201d,7 as well as the report of the Joint Inspection Unit on South-South and triangular cooperation in the United Nations system, of 2011, and the Secretary-General\u2019s response;8",
    "3": "Reiterates its request to the Joint Inspection Unit to present, by the end of the seventy-second session of the General Assembly, a progress report on its recommendations to the United Nations development system on implementing measures to further strengthen the United Nations Office for South-South Cooperation;",
    "4": "Recognizes the importance and unique history and particularities of South- South cooperation, reaffirms its view of South-South cooperation as a manifestation of solidarity among peoples and countries of the South that contributes to their national well-being, national and collective self-reliance and the attainment of the Sustainable Development Goals,9 which build upon the achievements of the Millennium Development Goals and seek to address their unfinished business, and also reaffirms that South-South cooperation and its agenda must be set by countries of the South and should continue to be guided by the principles of respect for national sovereignty, national ownership and independence, equality, non-conditionality, non-interference in domestic affairs and mutual benefit;",
    "5": "Stresses that South-South cooperation is not a substitute for, but rather a complement to, North-South cooperation;",
    "6": "Welcomes the increased contributions of South-South cooperation to poverty eradication and sustainable development, encourages developing countries to voluntarily step up their efforts to strengthen South-South cooperation and to further improve its development effectiveness, in accordance with the provisions of the Nairobi outcome document of the High-level United Nations Conference on South- South Cooperation,10 and welcomes commitments to strengthen triangular cooperation as a means of bringing relevant experience and expertise to bear in development cooperation;",
    "7": "Reaffirms that South-South cooperation is a common endeavour of peoples and countries of the South, born out of shared experiences and sympathies, based on their common objectives and solidarity and guided by, inter alia, the principles of respect for national sovereignty and ownership, free from any conditionalities, that South-South cooperation should not be seen as official development assistance and that it is a partnership among equals based on solidarity, acknowledges in this regard the need to enhance the development effectiveness of South-South cooperation by __________________ 5 See Official Records of the General Assembly, Seventy-first Session, Supplement No. 39 (A/71/39), chap. I. 6 A/71/208. 7 SSC/19/2. 8 A/66/717 and A/66/717/Add.1. 9 See resolution 70/1. 10 Resolution 64/222, annex. A/RES/72/237 South-South cooperation 17-23315 4/7 continuing to increase its mutual accountability and transparency as well as coordinating its initiatives with other development projects and programmes on the ground, in accordance with national development plans and priorities, and recognizes that the impact of South-South cooperation should be assessed with a view to improving, as appropriate, its quality in a results-oriented manner;",
    "8": "Acknowledges the progress made and encourages the continued integration of South-South cooperation and triangular cooperation into the policies and strategic frameworks of the funds, programmes and specialized agencies of the United Nations system, and requests those funds, programmes and specialized agencies of the United Nations system that have not yet integrated South-South and triangular cooperation into their policies to do so, taking into account the Nairobi outcome document of the High-level United Nations Conference on South-South Cooperation, the 2030 Agenda for Sustainable Development11 and the complementary nature of South-South to North-South cooperation;",
    "9": "Reiterates its request to the Chair of the United Nations Development Group to make specific recommendations on additional support that United Nations system organizations and all States could provide to South-South and triangular cooperation, which could include the voluntary secondment of staff and the appointment of Junior Professional Officers to the United Nations Office for South- South Cooperation, as well as measures to strengthen the system-wide efficiency and impact of the Office;",
    "10": "Requests the Secretary-General to make necessary adjustments, as appropriate, to the framework of operational guidelines on United Nations support to South-South and triangular cooperation,12 in consultation with all States and organizations of the United Nations development system;",
    "11": "Reaffirms the mandate and the central role of the United Nations Office for South-South Cooperation as the focal point for promoting and facilitating South- South and triangular cooperation for development on a global and United Nations system-wide basis;",
    "12": "Reiterates the request to the Chair of the United Nations Development Group to establish a more formalized and strengthened inter-agency mechanism, coordinated by the United Nations Office for South-South Cooperation, with a view to encouraging joint support to South-South and triangular initiatives and sharing information on development activities and results achieved by various organizations through their respective business models in support of South-South and triangular cooperation, calls upon the United Nations development system to designate representational focal points to join the mechanism, requests the Chair of the United Nations Development Group to give the United Nations Office for South-South Cooperation the opportunity to be represented more regularly in strategic and coordination mechanisms of the United Nations Development Group when matters affecting South-South and triangular cooperation are being discussed, and in this regard welcomes the progress made by the South-South and Triangular Cooperation Task Team of the United Nations Development Group to this effect;",
    "13": "Calls upon the United Nations Development Programme and other relevant organizations of the United Nations development system to assist developing countries in implementing projects of South-South cooperation, including sharing best practices and experiences from the South, especially with the least developed __________________ 11 Resolution 70/1. 12 SSC/17/3. South-South cooperation A/RES/72/237 5/7 17-23315 countries, upon request and in a manner consistent with their mandates and strategic plans;",
    "14": "Invites the United Nations development system to encourage the transfer of technologies on mutually agreed terms for the benefit of developing countries to address poverty eradication and sustainable development;",
    "15": "Welcomes the launch, in the 2030 Agenda for Sustainable Development, of the Technology Facilitation Mechanism, and looks forward to its continued development and full operationalization;",
    "16": "Requests the United Nations Development Group, including its South- South and Triangular Cooperation Task Team, and the United Nations country teams, within existing resources and in close consultation and coordination with the Governments of developing countries and other United Nations organizations, in particular the United Nations Development Programme and the United Nations Conference on Trade and Development, to continue the mapping and documentation of good practices in South-South and triangular cooperation, in particular those that are relevant to meeting the Sustainable Development Goals and targets, taking into account the Nairobi outcome document of the High-level United Nations Conference on South-South Cooperation, the Addis Ababa Action Agenda13 and the complementary nature of South-South to North-South cooperation;",
    "17": "Urges the United Nations to continue to support South-South cooperation projects that contribute to the implementation of the New Urban Agenda, adopted in Quito in 2016;4",
    "18": "Takes note with appreciation of the ninth annual Global South-South Development Expo, held from 27 to 30 November 2017, hosted by the Government of Turkey, on the theme \u201cSouth-South cooperation in the era of economic, social and environmental transformation: road to the fortieth anniversary of the adoption of the Buenos Aires Plan of Action\u201d, which aims at showcasing sustainable development solutions that can be scaled up and replicated through South-South and triangular cooperation;",
    "19": "Recognizes the important role of South-South cooperation and triangular cooperation, and in this context requests the Secretary-General, with the support of the United Nations Office for South-South Cooperation, to take steps, within existing resources, to update existing and to create appropriate new policy tools, in order that the United Nations system may effectively support Member States, upon request, in using South-South cooperation and triangular cooperation to assist in the implementation of the 2030 Agenda for Sustainable Development;",
    "20": "Acknowledges the positive efforts made by United Nations organizations to develop thematic strategies for the implementation of South-South cooperation, and in this regard urges the United Nations development system, in consultation with all States, to strive to increasingly leverage, as appropriate, South-South cooperation to bolster its impact in the context of the implementation of the 2030 Agenda for Sustainable Development;",
    "21": "Requests the United Nations system to enhance its support in the areas where South-South cooperation has proved effective, namely capacity-building, regional integration, interregional linkages, infrastructure interconnectivity and the development of national productive capacities through exchanges of knowledge, technological innovations and technology transfer on mutually agreed terms, and in __________________ 13 Resolution 69/313, annex. A/RES/72/237 South-South cooperation 17-23315 6/7 several areas of sustainable development such as poverty eradication and gender equality and the empowerment of women and girls;",
    "22": "Welcomes the support provided by developing countries to South-South and triangular initiatives aimed at improving nutrition and food security, and invites the replication of this approach in other relevant areas, drawing on the technical expertise of various United Nations organizations;",
    "23": "Recognizes the contribution of South-South cooperation in promoting gender equality and the empowerment of women and girls in sustainable development, and encourages further efforts to mainstream gender perspectives in South-South and triangular cooperation;",
    "24": "Notes that, in response to the growing demand for support to South-South cooperation at the regional and subregional levels, the regional commissions have advanced South-South cooperation by undertaking policy research and analysis on issues of importance to their member States, convening high-level policy dialogues, forging strategic partnerships and promoting specific capacity development and other initiatives, and in this regard invites the regional commissions to support developing countries, upon request, in integrating the 2030 Agenda for Sustainable Development into their nationally owned sustainable development strategies, in areas such as regional development planning and fiscal frameworks, and to help to promote policy coherence and coordination and the enhancement of the data and statistical capacities of member States for the implementation of the 2030 Agenda for Sustainable Development;",
    "25": "Reaffirms that South-South cooperation has a role to play as a strategic link between regions and embraces a multi-stakeholder approach, including non-governmental organizations, the private sector, civil society, academia and other actors that contribute to meeting development challenges and objectives in line with national development strategies and plans;",
    "26": "Urges the United Nations system to continue its support to regional and subregional organizations, enabling their member countries to build more partnerships and cross-border frameworks, with a view to promoting and scaling up best practices with the potential to benefit a large number of developing countries;",
    "27": "Welcomes the growing number of forums convened for Governments and other policymakers to discuss, in a participatory and inclusive manner, South-South cooperation initiatives and their contribution towards the implementation of the 2030 Agenda for Sustainable Development, including addressing challenges, lessons learned and good practices in key areas;",
    "28": "Requests the Secretary-General to present, as part of his comprehensive report to the High-level Committee on South-South Cooperation at its twentieth session, in consultation with all States, the United Nations Office for South-South Cooperation and the United Nations Development Programme, recommendations and an update on the concrete steps taken to strengthen the United Nations Office for South-South Cooperation, taking into account the need to enhance the role and improve the impact of the Office under the auspices of the United Nations Development Programme, including in the areas of financial, human and budgetary resources and through the potential appointment of a Special Representative of the Secretary-General on South-South Cooperation, as well as to clarify the management relationships, reporting lines and functions and to improve transparency, accountability and efficiency, taking into account matters covered in the report of the High-level Committee on South-South Cooperation on its nineteenth session, 14 __________________ 14 Official Records of the General Assembly, Seventy-first Session, Supplement No. 39 (A/71/39). South-South cooperation A/RES/72/237 7/7 17-23315 Committee decision 19/1 of 19 May 2016 and decision 2016/13 of 10 June 2016 of the Executive Board of the United Nations Development Programme, the United Nations Population Fund and the United Nations Office for Project Services; 15",
    "29": "Recognizes the need to mobilize adequate resources for enhancing South- South and triangular cooperation, and in this context invites all countries in a position to do so to contribute, in support of such cooperation, to the United Nations Fund for South-South Cooperation and to the P\u00e9rez-Guerrero Trust Fund for South-South Cooperation, in accordance with its resolution 57/263 of 20 December 2002, and to support other initiatives for all developing countries, including technology transfer among developing countries on mutually agreed terms;",
    "30": "Requests the United Nations Office for South-South Cooperation to continue to effectively provide the secretariat required by States in marking the fortieth anniversary of the adoption in 1978 of the Buenos Aires Plan of Action for Promoting and Implementing Technical Cooperation among Developing Countries;",
    "31": "Recognizes the need to strengthen and further invigorate South-South cooperation, in this regard reiterates its decision to convene the Second High-level United Nations Conference on South-South Cooperation on the occasion of the fortieth anniversary of the adoption of the Buenos Aires Plan of Action, to be held in Buenos Aires from 20 to 22 March 2019;",
    "32": "Calls upon all Member States to participate fully and constructively in the High-level United Nations Conference on South-South Cooperation to be held in Buenos Aires in 2019, and welcomes the Secretary-General\u2019s recommendation to the United Nations system to provide substantive inputs to inform discussions among the States in preparation for the Conference, through the United Nations Office for South- South Cooperation as Conference secretariat;",
    "33": "Welcomes the generous offer by the Government of Argentina to host and assume all costs of the High-level United Nations Conference on South-South Cooperation;",
    "34": "Calls upon the relevant organizations of the United Nations system, within their respective mandates and resources, to ensure that no one is left behind and no country is left behind in the implementation of the present resolution;",
    "35": "Decides to include in the provisional agenda of its seventy-third session, under the item entitled \u201cOperational activities for development\u201d, the sub-item entitled \u201cSouth-South cooperation for development\u201d, unless otherwise agreed, and requests the Secretary-General to submit to the General Assembly at its seventy-third session a comprehensive report on the state of South-South cooperation, including an assessment of the concrete measures taken by the United Nations development system to improve its support to South-South cooperation at the global, regional and national levels, as appropriate, and on the implementation of the present resolution, including all aspects set out in paragraph 28 above, on an exceptional basis and without setting any precedent for future reports of the Secretary-General. 74th plenary meeting 20 December 2017 __________________ 15 See DP/2016/19."
  },
  "agenda_items": [
    "Item 24"
  ],
  "symbol_references": []
}