{
  "symbol": "A/RES/76/148",
  "filename": "A_RES_76_148.pdf",
  "title": "76/148. Rights of indigenous peoples",
  "text": "United Nations \nA/RES/76/148\n \n \nGeneral Assembly \nDistr.: General \n6 January 2022 \n \n \n21-19190 (E)    120122 \n*2119190* \n \n \nSeventy-sixth session \nAgenda item 71 (a) \nRights of indigenous peoples: rights of indigenous peoples \n \n \n \n \n Resolution adopted by the General Assembly \non 16 December 2021 \n \n \n \n \n[on the report of the Third Committee (A/76/459, para. 10)] \n \n \n 76/148. Rights of indigenous peoples \n \n \n \nThe General Assembly, \n \nRecalling all relevant resolutions of the General Assembly, the Human Rights \nCouncil and the Economic and Social Council relating to the rights of indigenous \npeoples, reaffirming its resolutions 65/198 of 21 December 2010, 66/142 of \n19 December 2011, 67/153 of 20 December 2012, 68/149 of 18 December 2013, 69/2 \nof 22 September 2014, 69/159 of 18 December 2014, 70/232 of 23 December 2015, \n71/178 of 19 December 2016, 71/321 of 8 September 2017, 72/155 of 19 December \n2017, 72/247 of 24 December 2017, 73/156 of 17 December 2018, 74/135 of \n18 December 2019 and 75/168 of 16 December 2020, and recalling Human Rights \nCouncil resolutions 27/13 of 25 September 2014,1 30/4 of 1 October 2015,2 33/12 and \n33/13 of 29 September 2016,3 36/14 of 28 September 2017,4 39/13 of 28 September \n2018,5 42/19 of 26 September 2019,6 45/12 of 6 October 20207 and 48/11 of 8 October \n2021,8 \n \nReaffirming the United Nations Declaration on the Rights of Indigenous \nPeoples,9 which addresses the individual and collective rights of indigenous peoples \nand has positively influenced the drafting of several constitutions and statutes at the \n__________________ \n \n1  See Official Records of the General Assembly, Sixty-ninth Session, Supplement No. 53A and \ncorrigenda (A/69/53/Add.1, A/69/53/Add.1/Corr.1 and A/69/53/Add.1/Corr.2), chap. IV, sect. A. \n \n2  Ibid., Seventieth Session, Supplement No. 53A (A/70/53/Add.1), chap. III. \n \n3  Ibid., Seventy-first Session, Supplement No. 53A and corrigendum (A/71/53/Add.1 and \nA/71/53/Add.1/Corr.1), chap. II. \n \n4  Ibid., Seventy-second Session, Supplement No. 53A (A/72/53/Add.1), chap. III. \n \n5  Ibid., Seventy-third Session, Supplement No. 53A (A/73/53/Add.1), chap. II. \n \n6  Ibid., Seventy-fourth Session, Supplement No. 53A (A/74/53/Add.1), chap. III. \n \n7  Ibid., Seventy-fifth Session, Supplement No. 53A (A/75/53/Add.1), chap. III. \n \n8  Ibid., Seventy-sixth Session, Supplement No. 53A (A/76/53/Add.1), chap. IV, sect. A. \n \n9  Resolution 61/295, annex. \n\nA/RES/76/148 \nRights of indigenous peoples\n \n21-19190\n2/11 \n \nnational and local levels and contributed to the progressive development of \ninternational and national legal frameworks and policies, \n \nRecalling the outcome document of the high-level plenary meeting of the \nGeneral Assembly known as the World Conference on Indigenous Peoples, held in \nNew York on 22 and 23 September 2014,10 in which Heads of State and Government, \nministers and representatives of Member States reiterated the important and \ncontinuing role of the United Nations in promoting and protecting the rights of \nindigenous peoples, recalling also the inclusive preparatory process for the high-level \nplenary meeting, including the comprehensive engagement of the representatives of \nindigenous peoples, and welcoming and reaffirming the commitments, measures and \nefforts undertaken by States, the United Nations system, indigenous peoples and other \nactors in its implementation, \n \nEncouraging \nthe \nactive \nengagement \nof \nindigenous \npeoples \nin \nthe \nimplementation of the outcome document of the high-level plenary meeting of the \nGeneral Assembly known as the World Conference on Indigenous Peoples, including \nat the regional and global levels, \n \nRecalling the 2030 Agenda for Sustainable Development,11 and stressing the \nneed to ensure that no one is left behind and to endeavour to reach the furthest behind \nfirst, including indigenous peoples, who should participate in, contribute to and \nbenefit without discrimination from the implementation of the 2030 Agenda, and \nencouraging Member States to give due consideration to all the rights of indigenous \npeoples while implementing the 2030 Agenda, \n \nStressing the importance of promoting and pursuing the objectives of the United \nNations Declaration on the Rights of Indigenous Peoples also through international \ncooperation to support national and regional efforts to achieve the ends of the \nDeclaration, including the right to maintain and strengthen the distinct political, legal, \neconomic, social and cultural institutions of indigenous peoples and the right to \nparticipate fully, if they so choose, in the political, economic, social and cultural life \nof the State, \n \nReiterating the call made in its resolution 74/306 of 11 September 2020, \nacknowledging that the coronavirus disease (COVID-19) pandemic is one of the \ngreatest global challenges, and noting with deep concern its impact on individuals \nand groups of society, in particular indigenous peoples, on loss of life, health, mental \nhealth and well-being, and the enjoyment of human rights, and across all spheres of \nsociety, including on livelihoods, food security and nutrition, and education, the \nexacerbation of poverty and hunger, and disruption to economies, trade, societies and \nenvironments, and that these effects disproportionately impact poor, vulnerable and \nmarginalized segments of the population, as well as women and girls, \n \nExpressing deep concern about the rise in discrimination, hate speech, \nstigmatization, racism and xenophobia exacerbated by the COVID-19 pandemic, and \nstressing the need to counter them, in a manner consistent with international human \nrights law, as part of the COVID-19 response, \n \nNoting with concern the cases of threats, harassment and murder of indigenous \npeoples, in particular women and girls, often with impunity, as well as land invasions, \narbitrary forced evictions and other abusive practices, \n__________________ \n \n10  Resolution 69/2. \n \n11  Resolution 70/1. \n\nRights of indigenous peoples \nA/RES/76/148\n \n3/11\n21-19190 \n \n \nBearing in mind the policy instruments in the Global Compact for Safe, Orderly \nand Regular Migration12 for Member States to draw on, including to respond to the \nneeds of migrants who face situations of vulnerability, including indigenous peoples, \n \nTaking note with appreciation of the agreed conclusions of the sixty-third \nsession of the Commission on the Status of Women,13 in which Governments at all \nlevels and as appropriate, with the relevant entities of the United Nations system and \ninternational and regional organizations, within their respective mandates and bearing \nin mind national priorities, were urged to promote and protect the rights of indigenous \nwomen and girls living in rural and remote areas by addressing the multiple and \nintersecting forms of discrimination and barriers they face, including violence, \nensuring access to quality and inclusive education, health care, public services, \neconomic resources, including land and natural resources, and women\u2019s access to \ndecent work, and promoting their meaningful participation in the economy and in \ndecision-making processes at all levels and in all areas, while respecting and \nprotecting their traditional and ancestral knowledge, recognizing that indigenous \nwomen and girls living in rural and remote areas, regardless of age, often face \nviolence and higher rates of poverty, limited access to health-care services, \ninformation and communications technologies, infrastructure, financial services, \neducation and employment, while also recognizing their cultural, social, economic, \npolitical and environmental contributions, including to climate change mitigation and \nadaptation, noting the importance of the United Nations Declaration on the Rights of \nIndigenous Peoples for indigenous women and girls, \n \nRecognizing that violence against indigenous women and girls has a negative \nimpact on their enjoyment of human rights and fundamental freedoms and constitutes \na major impediment to indigenous women\u2019s full, equal, meaningful and effective \nparticipation in society, the economy and political decision-making, and in this regard \nrecalling Human Rights Council resolution 32/19 of 1 July 2016, entitled \n\u201cAccelerating efforts to eliminate violence against women: preventing and \nresponding to violence against women and girls, including indigenous women and \ngirls\u201d,14 which brings closer attention to this issue, and recognizing also the negative \neffects of multiple and intersecting forms of discrimination, \n \nStressing the importance of the empowerment and capacity-building of \nindigenous women and youth, including their full and effective participation in \ndecision-making processes in matters that affect them directly, including policies, \nprogrammes and resources, where relevant, that target the well-being of indigenous \nwomen, children and youth, in particular in the areas of health, education, \nemployment and the transmission of traditional knowledge, languages, spiritual and \nreligious traditions and practices, and the importance of taking measures to promote \nawareness and understanding of their rights, \n \nDeeply concerned at the vast number of endangered languages, in particular \nindigenous languages, and stressing that, despite the continuing efforts, there is an \nurgent need to preserve, promote and revitalize endangered languages, in particular \nindigenous languages, \n \nRecognizing the importance of the International Year of Indigenous Languages \nand the International Decade of Indigenous Languages to draw attention to the critical \nloss of indigenous languages and the urgent need to preserve, revitalize and promote \n__________________ \n \n12  Resolution 73/195, annex. \n \n13  See Official Records of the Economic and Social Council, 2019, Supplement No. 7 (E/2019/27), \nchap. I, sect. A. \n \n14  See Official Records of the General Assembly, Seventy-first Session, Supplement No. 53 \n(A/71/53), chap. V, sect. A. \n\nA/RES/76/148 \nRights of indigenous peoples\n \n21-19190\n4/11 \n \nindigenous languages, and to take further urgent steps to that end at the national and \ninternational levels,  \n \nRecalling the initiatives and events undertaken by Governments, indigenous \npeoples and the United Nations system related to the celebration of the 2019 \nInternational Year of Indigenous Languages, including the lead role of the United \nNations Educational, Scientific and Cultural Organization and the steering committee \nfor organizing the International Year, in consultation and cooperation with Member \nStates, the Permanent Forum on Indigenous Issues, the Special Rapporteur on the \nrights of indigenous peoples and the Expert Mechanism on the Rights of Indigenous \nPeoples, as well as indigenous peoples and a range of different stakeholders, \n \nRecognizing that indigenous peoples can contribute to a range of issues on the \ninternational agenda, \n \nRecognizing also the importance to indigenous peoples of revitalizing, using, \ndeveloping and transmitting to future generations their histories, languages, oral \ntraditions, philosophies, writing systems and literature, \n \nDeeply concerned that, in many cases, suicide rates in indigenous peoples\u2019 \ncommunities, in particular among indigenous youth and children, are significantly \nhigher than in the general population, \n \nBearing in mind the importance of promoting respect for the rights of \nindigenous children, in particular eliminating the worst forms of child labour, in \naccordance with international law, including relevant human rights law and \ninternational labour law obligations, \n \nRecognizing the importance of access to justice in the promotion and protection \nof the rights of indigenous peoples and individuals and the need to examine and take \nsteps to remove obstacles to justice, especially for indigenous women, indigenous \nchildren, youth, older persons and indigenous persons with disabilities, \n \nReiterating the responsibility of transnational corporations and other business \nenterprises to respect all human rights, while recognizing the specific challenges that \nmay be faced by indigenous peoples, and all applicable laws and international \nprinciples and to operate transparently and in a socially and environmentally \nresponsible manner, and emphasizing the need to refrain from negatively affecting \nthe well-being of indigenous peoples and to take further action towards corporate \nresponsibility and accountability, including the prevention, mitigation and \nremediation of human rights abuses, in line with the Guiding Principles on Business \nand Human Rights: Implementing the United Nations \u201cProtect, Respect and Remedy\u201d \nFramework,15  \n \nRecalling the work carried out by the Special Rapporteur on the protection of \nthe rights of indigenous peoples, including on the protection of indigenous human \nrights defenders, taking note of his report on the rights of indigenous peoples living \nin urban areas,16 and calling upon all States to consider the recommendations \ncontained in the report, \n \nTaking note with appreciation of the decision of the Human Rights Council, in \nits resolution 48/11, that the theme of the annual half-day panel discussion on the \nrights of indigenous peoples to be held during the fifty-first session of the Council \nwill be the impact of social and economic recovery plans in the COVID-19 context \non indigenous peoples, with a special focus on food security, \n__________________ \n \n15  A/HRC/17/31, annex. \n \n16  A/76/202/Rev.1. \n\nRights of indigenous peoples \nA/RES/76/148\n \n5/11\n21-19190 \n \n \nNoting the discussions to facilitate the participation of indigenous peoples in the \nwork of the Human Rights Council, including the intersessional round table on ways \nto enhance the participation of indigenous peoples\u2019 representatives and institutions in \nmeetings of the Council on issues affecting them, held on 16 July 2021, the half-day \nintersessional interactive dialogue, held on 28 September 2021, on the situation of \nhuman rights of indigenous peoples facing the COVID-19 pandemic, with a special \nfocus on the right to participation, and the endorsement to convene a four-day expert \nworkshop in 2022 to discuss recommendations on possible ways to ensure the \nenhanced participation of indigenous peoples in the work of the Council, and looking \nforward to the summary reports prepared thereon by the Office of the United Nations \nHigh Commissioner for Human Rights, \n \nRecognizing the importance of free, prior and informed consent, as outlined in \nthe United Nations Declaration on the Rights of Indigenous Peoples, \n \nRecognizing also the value and the diversity of the cultures and the form of \nsocial organization of indigenous peoples and their holistic traditional knowledge of \ntheir lands, natural resources and environment, \n \nNoting that the General Assembly, in the outcome document of the high-level \nplenary meeting of the Assembly known as the World Conference on Indigenous \nPeoples, affirmed and recognized the importance of indigenous peoples\u2019 religious and \ncultural sites and of providing access to and repatriation of their ceremonial objects \nand human remains, as contemplated in the United Nations Declaration on the Rights \nof Indigenous Peoples, \n \nCommending Member States, cultural and educational institutions, museums, \nindigenous peoples and civil society for their efforts to combat the illicit trade in \nindigenous peoples\u2019 cultural property, and welcoming all initiatives, whether by \nStates, institutions or private persons, for the voluntary return of indigenous peoples\u2019 \ncultural property that has been illicitly appropriated, \n \nRecognizing that agricultural practices that include indigenous traditional \nknowledge and innovations can contribute to overcoming the combined challenges of \nclimate \nchange, \nfood \nsecurity, \nbiodiversity \nconservation \nand \ncombating \ndesertification and land degradation, \n \nRecognizing also the importance of facilitating indigenous peoples\u2019 livelihoods, \nwhich may be achieved by, inter alia, the recognition of their traditions, land tenure \nsystems, adequate public policies and economic empowerment, \n \nRecognizing further that the economic empowerment, inclusion and \ndevelopment of indigenous peoples, including through the establishment of \nindigenous-owned businesses, can enable them to improve their social, cultural, civil \nand political engagement, achieve greater economic independence and build more \nsustainable and resilient communities, and noting the contribution of indigenous \npeoples to the broader economy, \n \nConcerned about the extreme disadvantages that indigenous peoples have \ntypically faced across a range of social and economic indicators and about the \nimpediments to their full enjoyment of their rights, \n \nStressing the need to pay particular attention to the rights and special needs of \nindigenous women, children, youth, older persons and persons with disabilities, as set \nout in the United Nations Declaration on the Rights of Indigenous Peoples, including \nin the process of protecting and promoting their equal access to justice, \n \nRecalling its resolution 72/128 of 7 December 2017, entitled \u201cObserver status \nfor the Fund for the Development of the Indigenous Peoples of Latin America and the \n\nA/RES/76/148 \nRights of indigenous peoples\n \n21-19190\n6/11 \n \nCaribbean in the General Assembly\u201d, in which it decided to invite the Fund to \nparticipate in the sessions and the work of the Assembly in the capacity of observer, \n \nRecalling also the outcome document of the dialogue meeting on enhanced \nindigenous peoples\u2019 participation at the United Nations, organized by indigenous \norganizations and institutions and held in Quito from 27 to 30 January 2020, and the \nLos Pinos Declaration [Chapoltepek] \u2013 Making a Decade of Action for Indigenous \nLanguages of the high-level event entitled \u201cMaking a Decade of Action for \nIndigenous Languages\u201d, held in Mexico on 27 and 28 February 2020, with the support \nof the United Nations Educational, Scientific and Cultural Organization, \n \n1. \nNotes with appreciation the work of the Expert Mechanism on the Rights \nof Indigenous Peoples, the Permanent Forum on Indigenous Issues and the Special \nRapporteur on the rights of indigenous peoples, takes note of the report of the Special \nRapporteur,17 and encourages all Governments to respond favourably to the requests \nof the Special Rapporteur for visits; \n \n2. \nUrges Governments and the United Nations system, in consultation and \ncooperation with indigenous peoples through their representatives and institutions, to \ncontinue to implement appropriate measures at the national level, including \nlegislative measures, to achieve the ends of the United Nations Declaration on the \nRights of Indigenous Peoples and to promote awareness of it among all sectors of \nsociety, including members of legislatures, the judiciary and the civil service, as well \nas among indigenous peoples, and invites international and regional organizations, \nwithin their respective mandates, national human rights institutions, where they exist, \ncivil society, including non-governmental organizations, and other relevant actors to \ncontribute to those efforts; \n \n3. \nUnderscores the importance of implementing the outcome document of \nthe high-level plenary meeting of the General Assembly known as the World \nConference on Indigenous Peoples, and reiterates the commitment of Member States \nto cooperating with indigenous peoples, through their own representative institutions, \nto develop and implement national action plans, strategies or other measures, where \nrelevant, to achieve the ends of the United Nations Declaration on the Rights of \nIndigenous Peoples; \n \n4. \nEncourages the leadership of the Secretary-General and of the Under-\nSecretary-General for Economic and Social Affairs, as the responsible senior official \nof the United Nations system, in overseeing the implementation of and following up \non the system-wide action plan to ensure a coherent approach to achieving the ends \nof the United Nations Declaration on the Rights of Indigenous Peoples, raising \nawareness of the rights of indigenous peoples and increasing the coherence of the \nactivities of the system in this regard, and encourages the funds, programmes and \nspecialized agencies of the United Nations system, resident coordinators and United \nNations country teams to implement this plan in full alignment with national \ndevelopment needs and priorities; \n \n5. \nEncourages Member States, resident coordinators and United Nations \ncountry teams, within their mandates and in coordination with the Governments \nconcerned, to involve indigenous peoples regarding issues affecting them in the \npreparation of the United Nations Sustainable Development Cooperation Frameworks \nand country programme action plans; \n \n6. \nEncourages Member States to work towards achieving the ends of the \nUnited Nations Declaration on the Rights of Indigenous Peoples; \n__________________ \n \n17  A/HRC/48/54. \n\nRights of indigenous peoples \nA/RES/76/148\n \n7/11\n21-19190 \n \n \n7. \nEncourages those States that have not yet ratified or acceded to the \nIndigenous and Tribal Peoples Convention, 1989 (No. 169), of the International \nLabour Organization18 to consider doing so; \n \n8. \nReiterates the need for Member States to ensure protection for indigenous \npeoples affected by the COVID-19 pandemic and prevent all forms of discrimination, \nespecially in the context of timely, universal, inclusive, equitable and \nnon-discriminatory access to safe, quality, effective and affordable health care and \nservices and medical supplies and equipment, including diagnostics, therapeutics, \nmedicine and vaccines, and through the dissemination of accurate, clear and evidence- \nand science-based information, including in indigenous languages as appropriate, and \nto leave no one behind, with an endeavour to reach the furthest behind first, founded \non the dignity of the human person and reflecting the principles of equality and \nnon-discrimination, and calls upon Member States to put in place an inclusive \nresponse to and recovery from the COVID-19 pandemic and engage with indigenous \npeoples and other relevant stakeholders to fully empower all in improving and \nprotecting their own health; \n \n9. \nReaffirms that indigenous peoples have the right to their traditional \nmedicines and to maintain their health practices,19 including, inter alia, the \nconservation of their vital medicinal plants, as part of the response to the COVID-19 \npandemic and its consequences, and also reaffirms that indigenous individuals have \nthe right to access, without any discrimination, to all social and health services; \n \n10. Recalls the report of the Secretary-General on the status of the United \nNations Voluntary Fund for Indigenous Peoples,20 and encourages Governments and \nintergovernmental and non-governmental organizations to continue to contribute to \nthe trust fund on indigenous issues, the United Nations Voluntary Fund for Indigenous \nPeoples and the United Nations Indigenous Peoples\u2019 Partnership, invites indigenous \norganizations and private institutions and individuals to do likewise, and notes the \nimportance of accessibility, accountability, transparency and balanced geographical \ndistribution in the management of these funds; \n \n11. \nAlso recalls the expansion of the mandate of the United Nations Voluntary \nFund for Indigenous Peoples so that it can assist representatives of indigenous \npeoples\u2019 organizations and communities in participating in other mechanisms and \nnegotiations such as the Forum on Business and Human Rights and in the Conference \nof the Parties to the United Nations Framework Convention on Climate Change, \nincluding in its preparatory sessions and in the meetings of the Local Communities \nand Indigenous Peoples Platform Facilitative Working Group organized by the \nsecretariat of the Convention, in accordance with their respective rules and \nregulations; \n \n12. Notes the ongoing work and potential of the Local Communities and \nIndigenous Peoples Platform of the United Nations Framework Convention on \nClimate Change, emphasizes the role of indigenous peoples in achieving the targets \nand goals set out in the United Nations Framework Convention on Climate Change, 21 \nthe Paris Agreement22 and the 2030 Agenda for Sustainable Development, and \nrecognizes that indigenous peoples are among the first to face the direct consequences \nof climate change owing to their dependence upon and close relationship with the \nenvironment and its resources; \n__________________ \n \n18  United Nations, Treaty Series, vol. 1650, No. 28383. \n \n19  Resolution 61/295, annex, art. 24, para. 1. \n \n20  A/75/222. \n \n21  United Nations, Treaty Series, vol. 1771, No. 30822. \n \n22  See FCCC/CP/2015/10/Add.1, decision 1/CP.21, annex. \n\nA/RES/76/148 \nRights of indigenous peoples\n \n21-19190\n8/11 \n \n \n13. Stresses the urgent need to enhance adaptive capacity, strengthen \nresilience and reduce vulnerability of indigenous peoples to climate change and \nextreme weather events, and to support the leadership, knowledge, technologies, \npractices and efforts of indigenous peoples to address and respond to climate change, \nand encourages Member States to take measures that will ensure the full and effective \nparticipation of indigenous peoples in decision-making processes relating to climate \nchange on issues affecting them; \n \n14. Decides to continue to observe the International Day of Indigenous \nPeoples every year on 9 August, and requests the Secretary-General to support the \nobservance of the Day from within existing resources; \n \n15. Encourages Member States and all organizations and bodies of the United \nNations system and other international and regional organizations, the private sector \nand academia, as well as civil society, including non-governmental organizations, to \nobserve the International Day of Indigenous Peoples in an appropriate manner, \nincluding through educational and public awareness-raising activities; \n \n16. Encourages Member States to give due consideration to all the rights of \nindigenous peoples in fulfilling the commitments undertaken in the 2030 Agenda for \nSustainable Development and in the elaboration of national action plans and \nprogrammes as well as international and regional programmes, applying the pledge \nto leave no one behind and to endeavour to reach the furthest behind first; \n \n17. Encourages States to continue to consider including in their voluntary \nnational reviews for the high-level political forum on sustainable development and \ntheir national and global reports information related to indigenous peoples on the \nprogress made and challenges in the implementation of the 2030 Agenda, bearing in \nmind paragraphs 78 and 79 of the 2030 Agenda, and also encourages States to compile \ndisaggregated data to measure progress and to ensure that no one is left behind; \n \n18. Also encourages States, according to their relevant national context and \ncharacteristics, to collect and disseminate data disaggregated by ethnicity, income, \ngender, age, race, migratory status, disability, geographic location or other factors, as \nappropriate, in order to monitor and improve the impact of development policies, \nstrategies and programmes aimed at improving the well-being of indigenous peoples \nand individuals, to combat and eliminate violence and multiple and intersecting forms \nof discrimination against them and to support work towards the achievement of the \nSustainable Development Goals and the 2030 Agenda; \n \n19. Calls upon States to foster an enabling online environment that is safe and \nconducive to engagement by all indigenous peoples, and to take all necessary and \nappropriate measures to address disinformation and advocacy of hatred constituting \nincitement to discrimination, hostility or violence towards indigenous peoples; \n \n20. Encourages the Secretary-General to include information pertinent to \nindigenous peoples in the forthcoming annual reports on progress towards the \nSustainable Development Goals; \n \n21. Stresses the need to strengthen the commitment of States and the entities \nof the United Nations system to mainstream the promotion and protection of the rights \nof indigenous peoples into development policies and programmes at the national, \nregional and international levels, and encourages them to give due consideration to \nthe rights of indigenous peoples in achieving the goals of the 2030 Agenda; \n \n22. Also stresses the need for indigenous peoples of all regions to contribute \nto the high-level political forum on sustainable development, and encourages States \nto engage with indigenous peoples at the local, national and regional levels in relation \n\nRights of indigenous peoples \nA/RES/76/148\n \n9/11\n21-19190 \n \nto the Sustainable Development Goals and to promote indigenous peoples\u2019 leadership \nin their achievement; \n \n23. Invites the Expert Mechanism on the Rights of Indigenous Peoples, the \nPermanent Forum on Indigenous Issues and the Special Rapporteur on the rights of \nindigenous peoples to give due consideration, within their mandates, to the rights of \nindigenous peoples as related to the implementation of the 2030 Agenda; \n \n24. Encourages the Permanent Forum on Indigenous Issues to continue to \nprovide inputs on indigenous issues to the high-level political forum on sustainable \ndevelopment for consideration in its thematic reviews; \n \n25. Underlines the need to intensify efforts, in cooperation with indigenous \npeoples, to prevent and eliminate all forms of violence and discrimination against \nindigenous women, children, youth, older persons and persons with disabilities and \nto support measures that will ensure their empowerment and full, meaningful and \neffective participation in decision-making processes at all levels and in all areas and \neliminate structural and legal barriers to their full, equal and effective participation \nin political, economic, social and cultural life; \n \n26. Urges States to take necessary measures where appropriate to ensure the \nrights, protection and safety of indigenous peoples, including indigenous leaders and \nindigenous human rights defenders, and to promote a safe and enabling environment \nin which human rights violations and abuses against or related to them are prevented \nand investigated, the perpetrators are held accountable and access to justice and \nremedy are ensured; \n \n27. Reaffirms the importance of effective accountability with regard to \nviolence against indigenous women and girls, including all forms of sexual violence, \ndomestic violence, abuse, exploitation and sexual harassment, as well as with regard \nto taking adequate measures to prevent and eliminate such violence; \n \n28. Encourages States to consider including in their reports related to \nindigenous peoples and women information on the progress made and challenges in \nthe implementation of Commission on the Status of Women resolutions 49/7 of \n11 March 2005, entitled \u201cIndigenous women: beyond the ten-year review of the \nBeijing Declaration and Platform for Action\u201d,23 and 56/4 of 9 March 2012, entitled \n\u201cIndigenous women: key actors in poverty and hunger eradication\u201d; 24  \n \n29. Recalls the proclamation of the period 2022\u20132032 as the International \nDecade of Indigenous Languages, to draw attention to the critical loss of indigenous \nlanguages and the urgent need to preserve, revitalize and promote indigenous \nlanguages and to take urgent steps at the national and international levels, and the \ninvitation to the United Nations Educational, Scientific and Cultural Organization to \nserve as the lead agency for the International Decade, in collaboration with the \nDepartment of Economic and Social Affairs of the Secretariat, and other relevant \nagencies, within existing resources; \n \n30. Welcomes the decision to convene a high-level event during 2022, \norganized by the President of the General Assembly, for the launch of the \nInternational Decade of Indigenous Languages, and further requests the President of \nthe General Assembly to support initiatives relevant to the successful celebration of \nthe International Decade of Indigenous Languages, within existing resources; \n__________________ \n \n23  See Official Records of the Economic and Social Council, 2005, Supplement No. 7 and \ncorrigendum (E/2005/27 and E/2005/27/Corr.1), chap. I, sect. D. \n \n24  Ibid., 2012, Supplement No. 7 and corrigendum (E/2012/27 and E/2012/27/Corr.1), chap. I, \nsect. D. \n\nA/RES/76/148 \nRights of indigenous peoples\n \n21-19190\n10/11 \n \n \n31. Invites Member States to consider establishing national mechanisms with \nadequate funding for the successful implementation of the International Decade of \nIndigenous Languages, in partnership with indigenous peoples, and to support \nindigenous peoples, as custodians of their own languages, to initiate and develop \nappropriate measures for the implementation of the International Decade, with the \naim to preserve, revitalize and promote indigenous languages; \n \n32. Recognizes that the United Nations pursues multilingualism as a means of \npromoting, protecting and preserving diversity of languages and cultures globally, \nreaffirms that linguistic diversity is an important element of cultural diversity, and \nencourages Member States to adopt public policies with an intercultural approach in \ntheir design and implementation, aiming to preserve, revitalize and promote \nindigenous languages, the possibility of including educational programmes that \nreinforce the use of indigenous languages among children and youth by using an \nintergenerational approach with the participation of indigenous elders, as well as the \npromotion and use of indigenous languages at the international level; \n \n33. Encourages Governments to redouble efforts to eliminate child labour, \nboth in legislation and in practice, in the context of respect for the human rights of \nindigenous children, including through international cooperation, as appropriate; \n \n34. Also encourages Governments to promote actions to end hunger and \nmalnutrition in all its forms and achieve food security for indigenous children, \nespecially for those living in rural areas, by providing them with adequate access to \nfood, water and sanitation, education, and universal and equitable access to quality \nhealth services, and to implement actions for poverty eradication and build \nsustainable food systems;  \n \n35. Urges Governments to ensure that indigenous peoples shall not be forcibly \nremoved from their lands or territories and that no relocation shall take place without \nthe free, prior and informed consent of the indigenous peoples concerned, after \nagreement on just and fair compensation and, where possible, with the option of \nreturn, and to take effective measures to ensure that all indigenous peoples, regardless \nof their tenure status, have access to essential services, including access to safe and \naffordable water, sanitation, energy and health services; \n \n36. Encourages transnational corporations and other business enterprises to \nrespect human rights, including the rights of indigenous children, and to eliminate \nforced labour and child labour from their operations; \n \n37. Expresses concern over the misappropriation and misuse of indigenous \npeoples\u2019 cultural heritage, reaffirms that indigenous peoples have the right to \nmaintain, control, protect and develop their cultural heritage, traditional knowledge \nand traditional cultural expressions, and that they also have the right to maintain, \ncontrol, protect and develop their intellectual property over such cultural heritage, \ntraditional knowledge and traditional cultural expressions, and recalls that States, in \nconjunction with indigenous peoples, shall take effective measures to recognize and \nprotect the exercise of these rights, in accordance with the United Nations Declaration \non the Rights of Indigenous Peoples, and as acknowledged in national law; \n \n38. Underscores the need to ensure equal protection of the law and equality \nbefore the courts for indigenous women and girls at all levels and, to that end, the \nimportance of providing systematic gender-sensitivity training, as appropriate, for \npolice and security forces, prosecutors, judges and lawyers, integrating gender \nconsiderations into security sector reform initiatives, developing protocols and \nguidelines and enhancing or putting in place appropriate accountability measures for \nadjudicators; \n\nRights of indigenous peoples \nA/RES/76/148\n \n11/11\n21-19190 \n \n \n39. Encourages States and entities of the United Nations system to strengthen \ninternational cooperation, including to address the disadvantages faced by indigenous \npeoples, and to increase technical cooperation and financial assistance in this regard; \n \n40. Encourages the World Health Organization, the United Nations Children\u2019s \nFund and other relevant United Nations agencies, funds and programmes, in \naccordance with their mandates, to carry out research and evidence-gathering on the \nprevalence and root causes of suicide among indigenous youth and children and good \npractices on its prevention and to consider developing, as appropriate, strategies or \npolicies, consistent with national priorities, in cooperation with Member States, to \ntackle it, including through consultation with indigenous peoples, in particular \nindigenous youth organizations; \n \n41. Recalls the report of the Secretary-General on enhancing the participation \nof indigenous peoples\u2019 representatives and institutions in meetings of relevant United \nNations bodies on issues affecting them,25 and recalls with appreciation the work led \nby the Presidents of the General Assembly at its seventieth to seventy-fifth sessions \nin conducting consultations with Member States, indigenous peoples\u2019 representatives \nand institutions from all regions of the world and existing mechanisms of the United \nNations on possible measures to enable the participation of indigenous peoples\u2019 \nrepresentatives and institutions in meetings of relevant United Nations bodies on \nissues affecting them, which led to the adoption of Assembly resolution 71/321, \ntaking into account the achievements in that regard of other bodies and organizations \nthroughout the United Nations system, to be preceded by consultations with \nindigenous peoples\u2019 representatives and institutions from all regions of the world as \nan input to the intergovernmental process; \n \n42. Also recalls its decision 75/561 of 16 April 2020, by which it postponed \nto its seventy-sixth session the organization of an informal interactive hearing with \nindigenous peoples, as requested in resolution 71/321;  \n \n43. Decides to continue the consideration of possible further measures \nnecessary to enhance the participation of indigenous peoples\u2019 representatives and \ninstitutions in relevant United Nations meetings on issues affecting them at the \nseventy-seventh session, as originally requested in resolution 71/321;  \n \n44. Invites Member States to support the Secretary-General in his efforts or \nactivities to hold regional consultations, including through the regional commissions, \nas appropriate, before the twenty-first session of the Permanent Forum on Indigenous \nIssues, including by hosting such consultations, in accordance with resolution 71/321; \n \n45. Encourages the United Nations system to strengthen cooperation with the \nFund for the Development of the Indigenous Peoples of Latin America and the \nCaribbean, considering its fundamental role in the Latin American and Caribbean \nregion in processes of dialogue and consultation between States and indigenous \npeoples; \n \n46. Decides to continue its consideration of the question at its seventy-seventh \nsession, under the item entitled \u201cRights of indigenous peoples\u201d, and to maintain in \nthe provisional agenda the sub-item entitled \u201cFollow-up to the outcome document of \nthe high-level plenary meeting of the General Assembly known as the World \nConference on Indigenous Peoples\u201d. \n \n53rd plenary meeting \n16 December 2021 \n__________________ \n \n25  A/75/255. \n",
  "paragraphs": {
    "1": "Notes with appreciation the work of the Expert Mechanism on the Rights of Indigenous Peoples, the Permanent Forum on Indigenous Issues and the Special Rapporteur on the rights of indigenous peoples, takes note of the report of the Special Rapporteur,17 and encourages all Governments to respond favourably to the requests of the Special Rapporteur for visits;",
    "2": "Urges Governments and the United Nations system, in consultation and cooperation with indigenous peoples through their representatives and institutions, to continue to implement appropriate measures at the national level, including legislative measures, to achieve the ends of the United Nations Declaration on the Rights of Indigenous Peoples and to promote awareness of it among all sectors of society, including members of legislatures, the judiciary and the civil service, as well as among indigenous peoples, and invites international and regional organizations, within their respective mandates, national human rights institutions, where they exist, civil society, including non-governmental organizations, and other relevant actors to contribute to those efforts;",
    "3": "Underscores the importance of implementing the outcome document of the high-level plenary meeting of the General Assembly known as the World Conference on Indigenous Peoples, and reiterates the commitment of Member States to cooperating with indigenous peoples, through their own representative institutions, to develop and implement national action plans, strategies or other measures, where relevant, to achieve the ends of the United Nations Declaration on the Rights of Indigenous Peoples;",
    "4": "Encourages the leadership of the Secretary-General and of the Under- Secretary-General for Economic and Social Affairs, as the responsible senior official of the United Nations system, in overseeing the implementation of and following up on the system-wide action plan to ensure a coherent approach to achieving the ends of the United Nations Declaration on the Rights of Indigenous Peoples, raising awareness of the rights of indigenous peoples and increasing the coherence of the activities of the system in this regard, and encourages the funds, programmes and specialized agencies of the United Nations system, resident coordinators and United Nations country teams to implement this plan in full alignment with national development needs and priorities;",
    "5": "Encourages Member States, resident coordinators and United Nations country teams, within their mandates and in coordination with the Governments concerned, to involve indigenous peoples regarding issues affecting them in the preparation of the United Nations Sustainable Development Cooperation Frameworks and country programme action plans;",
    "6": "Encourages Member States to work towards achieving the ends of the United Nations Declaration on the Rights of Indigenous Peoples; __________________ 17 A/HRC/48/54. Rights of indigenous peoples A/RES/76/148 7/11 21-19190",
    "7": "Encourages those States that have not yet ratified or acceded to the Indigenous and Tribal Peoples Convention, 1989 (No. 169), of the International Labour Organization18 to consider doing so;",
    "8": "Reiterates the need for Member States to ensure protection for indigenous peoples affected by the COVID-19 pandemic and prevent all forms of discrimination, especially in the context of timely, universal, inclusive, equitable and non-discriminatory access to safe, quality, effective and affordable health care and services and medical supplies and equipment, including diagnostics, therapeutics, medicine and vaccines, and through the dissemination of accurate, clear and evidence- and science-based information, including in indigenous languages as appropriate, and to leave no one behind, with an endeavour to reach the furthest behind first, founded on the dignity of the human person and reflecting the principles of equality and non-discrimination, and calls upon Member States to put in place an inclusive response to and recovery from the COVID-19 pandemic and engage with indigenous peoples and other relevant stakeholders to fully empower all in improving and protecting their own health;",
    "9": "Reaffirms that indigenous peoples have the right to their traditional medicines and to maintain their health practices,19 including, inter alia, the conservation of their vital medicinal plants, as part of the response to the COVID-19 pandemic and its consequences, and also reaffirms that indigenous individuals have the right to access, without any discrimination, to all social and health services;",
    "10": "Recalls the report of the Secretary-General on the status of the United Nations Voluntary Fund for Indigenous Peoples,20 and encourages Governments and intergovernmental and non-governmental organizations to continue to contribute to the trust fund on indigenous issues, the United Nations Voluntary Fund for Indigenous Peoples and the United Nations Indigenous Peoples\u2019 Partnership, invites indigenous organizations and private institutions and individuals to do likewise, and notes the importance of accessibility, accountability, transparency and balanced geographical distribution in the management of these funds;",
    "11": "Also recalls the expansion of the mandate of the United Nations Voluntary Fund for Indigenous Peoples so that it can assist representatives of indigenous peoples\u2019 organizations and communities in participating in other mechanisms and negotiations such as the Forum on Business and Human Rights and in the Conference of the Parties to the United Nations Framework Convention on Climate Change, including in its preparatory sessions and in the meetings of the Local Communities and Indigenous Peoples Platform Facilitative Working Group organized by the secretariat of the Convention, in accordance with their respective rules and regulations;",
    "12": "Notes the ongoing work and potential of the Local Communities and Indigenous Peoples Platform of the United Nations Framework Convention on Climate Change, emphasizes the role of indigenous peoples in achieving the targets and goals set out in the United Nations Framework Convention on Climate Change, 21 the Paris Agreement22 and the 2030 Agenda for Sustainable Development, and recognizes that indigenous peoples are among the first to face the direct consequences of climate change owing to their dependence upon and close relationship with the environment and its resources; __________________ 18 United Nations, Treaty Series, vol. 1650, No. 28383. 19 Resolution 61/295, annex, art. 24, para. 1. 20 A/75/222. 21 United Nations, Treaty Series, vol. 1771, No. 30822. 22 See FCCC/CP/2015/10/Add.1, decision 1/CP.21, annex. A/RES/76/148 Rights of indigenous peoples 21-19190 8/11",
    "13": "Stresses the urgent need to enhance adaptive capacity, strengthen resilience and reduce vulnerability of indigenous peoples to climate change and extreme weather events, and to support the leadership, knowledge, technologies, practices and efforts of indigenous peoples to address and respond to climate change, and encourages Member States to take measures that will ensure the full and effective participation of indigenous peoples in decision-making processes relating to climate change on issues affecting them;",
    "14": "Decides to continue to observe the International Day of Indigenous Peoples every year on 9 August, and requests the Secretary-General to support the observance of the Day from within existing resources;",
    "15": "Encourages Member States and all organizations and bodies of the United Nations system and other international and regional organizations, the private sector and academia, as well as civil society, including non-governmental organizations, to observe the International Day of Indigenous Peoples in an appropriate manner, including through educational and public awareness-raising activities;",
    "16": "Encourages Member States to give due consideration to all the rights of indigenous peoples in fulfilling the commitments undertaken in the 2030 Agenda for Sustainable Development and in the elaboration of national action plans and programmes as well as international and regional programmes, applying the pledge to leave no one behind and to endeavour to reach the furthest behind first;",
    "17": "Encourages States to continue to consider including in their voluntary national reviews for the high-level political forum on sustainable development and their national and global reports information related to indigenous peoples on the progress made and challenges in the implementation of the 2030 Agenda, bearing in mind paragraphs 78 and 79 of the 2030 Agenda, and also encourages States to compile disaggregated data to measure progress and to ensure that no one is left behind;",
    "18": "Also encourages States, according to their relevant national context and characteristics, to collect and disseminate data disaggregated by ethnicity, income, gender, age, race, migratory status, disability, geographic location or other factors, as appropriate, in order to monitor and improve the impact of development policies, strategies and programmes aimed at improving the well-being of indigenous peoples and individuals, to combat and eliminate violence and multiple and intersecting forms of discrimination against them and to support work towards the achievement of the Sustainable Development Goals and the 2030 Agenda;",
    "19": "Calls upon States to foster an enabling online environment that is safe and conducive to engagement by all indigenous peoples, and to take all necessary and appropriate measures to address disinformation and advocacy of hatred constituting incitement to discrimination, hostility or violence towards indigenous peoples;",
    "20": "Encourages the Secretary-General to include information pertinent to indigenous peoples in the forthcoming annual reports on progress towards the Sustainable Development Goals;",
    "21": "Stresses the need to strengthen the commitment of States and the entities of the United Nations system to mainstream the promotion and protection of the rights of indigenous peoples into development policies and programmes at the national, regional and international levels, and encourages them to give due consideration to the rights of indigenous peoples in achieving the goals of the 2030 Agenda;",
    "22": "Also stresses the need for indigenous peoples of all regions to contribute to the high-level political forum on sustainable development, and encourages States to engage with indigenous peoples at the local, national and regional levels in relation Rights of indigenous peoples A/RES/76/148 9/11 21-19190 to the Sustainable Development Goals and to promote indigenous peoples\u2019 leadership in their achievement;",
    "23": "Invites the Expert Mechanism on the Rights of Indigenous Peoples, the Permanent Forum on Indigenous Issues and the Special Rapporteur on the rights of indigenous peoples to give due consideration, within their mandates, to the rights of indigenous peoples as related to the implementation of the 2030 Agenda;",
    "24": "Encourages the Permanent Forum on Indigenous Issues to continue to provide inputs on indigenous issues to the high-level political forum on sustainable development for consideration in its thematic reviews;",
    "25": "Underlines the need to intensify efforts, in cooperation with indigenous peoples, to prevent and eliminate all forms of violence and discrimination against indigenous women, children, youth, older persons and persons with disabilities and to support measures that will ensure their empowerment and full, meaningful and effective participation in decision-making processes at all levels and in all areas and eliminate structural and legal barriers to their full, equal and effective participation in political, economic, social and cultural life;",
    "26": "Urges States to take necessary measures where appropriate to ensure the rights, protection and safety of indigenous peoples, including indigenous leaders and indigenous human rights defenders, and to promote a safe and enabling environment in which human rights violations and abuses against or related to them are prevented and investigated, the perpetrators are held accountable and access to justice and remedy are ensured;",
    "27": "Reaffirms the importance of effective accountability with regard to violence against indigenous women and girls, including all forms of sexual violence, domestic violence, abuse, exploitation and sexual harassment, as well as with regard to taking adequate measures to prevent and eliminate such violence;",
    "28": "Encourages States to consider including in their reports related to indigenous peoples and women information on the progress made and challenges in the implementation of Commission on the Status of Women resolutions 49/7 of 11 March 2005, entitled \u201cIndigenous women: beyond the ten-year review of the Beijing Declaration and Platform for Action\u201d,23 and 56/4 of 9 March 2012, entitled \u201cIndigenous women: key actors in poverty and hunger eradication\u201d; 24",
    "29": "Recalls the proclamation of the period 2022\u20132032 as the International Decade of Indigenous Languages, to draw attention to the critical loss of indigenous languages and the urgent need to preserve, revitalize and promote indigenous languages and to take urgent steps at the national and international levels, and the invitation to the United Nations Educational, Scientific and Cultural Organization to serve as the lead agency for the International Decade, in collaboration with the Department of Economic and Social Affairs of the Secretariat, and other relevant agencies, within existing resources;",
    "30": "Welcomes the decision to convene a high-level event during 2022, organized by the President of the General Assembly, for the launch of the International Decade of Indigenous Languages, and further requests the President of the General Assembly to support initiatives relevant to the successful celebration of the International Decade of Indigenous Languages, within existing resources; __________________ 23 See Official Records of the Economic and Social Council, 2005, Supplement No. 7 and corrigendum (E/2005/27 and E/2005/27/Corr.1), chap. I, sect. D. 24 Ibid., 2012, Supplement No. 7 and corrigendum (E/2012/27 and E/2012/27/Corr.1), chap. I, sect. D. A/RES/76/148 Rights of indigenous peoples 21-19190 10/11",
    "31": "Invites Member States to consider establishing national mechanisms with adequate funding for the successful implementation of the International Decade of Indigenous Languages, in partnership with indigenous peoples, and to support indigenous peoples, as custodians of their own languages, to initiate and develop appropriate measures for the implementation of the International Decade, with the aim to preserve, revitalize and promote indigenous languages;",
    "32": "Recognizes that the United Nations pursues multilingualism as a means of promoting, protecting and preserving diversity of languages and cultures globally, reaffirms that linguistic diversity is an important element of cultural diversity, and encourages Member States to adopt public policies with an intercultural approach in their design and implementation, aiming to preserve, revitalize and promote indigenous languages, the possibility of including educational programmes that reinforce the use of indigenous languages among children and youth by using an intergenerational approach with the participation of indigenous elders, as well as the promotion and use of indigenous languages at the international level;",
    "33": "Encourages Governments to redouble efforts to eliminate child labour, both in legislation and in practice, in the context of respect for the human rights of indigenous children, including through international cooperation, as appropriate;",
    "34": "Also encourages Governments to promote actions to end hunger and malnutrition in all its forms and achieve food security for indigenous children, especially for those living in rural areas, by providing them with adequate access to food, water and sanitation, education, and universal and equitable access to quality health services, and to implement actions for poverty eradication and build sustainable food systems;",
    "35": "Urges Governments to ensure that indigenous peoples shall not be forcibly removed from their lands or territories and that no relocation shall take place without the free, prior and informed consent of the indigenous peoples concerned, after agreement on just and fair compensation and, where possible, with the option of return, and to take effective measures to ensure that all indigenous peoples, regardless of their tenure status, have access to essential services, including access to safe and affordable water, sanitation, energy and health services;",
    "36": "Encourages transnational corporations and other business enterprises to respect human rights, including the rights of indigenous children, and to eliminate forced labour and child labour from their operations;",
    "37": "Expresses concern over the misappropriation and misuse of indigenous peoples\u2019 cultural heritage, reaffirms that indigenous peoples have the right to maintain, control, protect and develop their cultural heritage, traditional knowledge and traditional cultural expressions, and that they also have the right to maintain, control, protect and develop their intellectual property over such cultural heritage, traditional knowledge and traditional cultural expressions, and recalls that States, in conjunction with indigenous peoples, shall take effective measures to recognize and protect the exercise of these rights, in accordance with the United Nations Declaration on the Rights of Indigenous Peoples, and as acknowledged in national law;",
    "38": "Underscores the need to ensure equal protection of the law and equality before the courts for indigenous women and girls at all levels and, to that end, the importance of providing systematic gender-sensitivity training, as appropriate, for police and security forces, prosecutors, judges and lawyers, integrating gender considerations into security sector reform initiatives, developing protocols and guidelines and enhancing or putting in place appropriate accountability measures for adjudicators; Rights of indigenous peoples A/RES/76/148 11/11 21-19190",
    "39": "Encourages States and entities of the United Nations system to strengthen international cooperation, including to address the disadvantages faced by indigenous peoples, and to increase technical cooperation and financial assistance in this regard;",
    "40": "Encourages the World Health Organization, the United Nations Children\u2019s Fund and other relevant United Nations agencies, funds and programmes, in accordance with their mandates, to carry out research and evidence-gathering on the prevalence and root causes of suicide among indigenous youth and children and good practices on its prevention and to consider developing, as appropriate, strategies or policies, consistent with national priorities, in cooperation with Member States, to tackle it, including through consultation with indigenous peoples, in particular indigenous youth organizations;",
    "41": "Recalls the report of the Secretary-General on enhancing the participation of indigenous peoples\u2019 representatives and institutions in meetings of relevant United Nations bodies on issues affecting them,25 and recalls with appreciation the work led by the Presidents of the General Assembly at its seventieth to seventy-fifth sessions in conducting consultations with Member States, indigenous peoples\u2019 representatives and institutions from all regions of the world and existing mechanisms of the United Nations on possible measures to enable the participation of indigenous peoples\u2019 representatives and institutions in meetings of relevant United Nations bodies on issues affecting them, which led to the adoption of Assembly resolution 71/321, taking into account the achievements in that regard of other bodies and organizations throughout the United Nations system, to be preceded by consultations with indigenous peoples\u2019 representatives and institutions from all regions of the world as an input to the intergovernmental process;",
    "42": "Also recalls its decision 75/561 of 16 April 2020, by which it postponed to its seventy-sixth session the organization of an informal interactive hearing with indigenous peoples, as requested in resolution 71/321;",
    "43": "Decides to continue the consideration of possible further measures necessary to enhance the participation of indigenous peoples\u2019 representatives and institutions in relevant United Nations meetings on issues affecting them at the seventy-seventh session, as originally requested in resolution 71/321;",
    "44": "Invites Member States to support the Secretary-General in his efforts or activities to hold regional consultations, including through the regional commissions, as appropriate, before the twenty-first session of the Permanent Forum on Indigenous Issues, including by hosting such consultations, in accordance with resolution 71/321;",
    "45": "Encourages the United Nations system to strengthen cooperation with the Fund for the Development of the Indigenous Peoples of Latin America and the Caribbean, considering its fundamental role in the Latin American and Caribbean region in processes of dialogue and consultation between States and indigenous peoples;",
    "46": "Decides to continue its consideration of the question at its seventy-seventh session, under the item entitled \u201cRights of indigenous peoples\u201d, and to maintain in the provisional agenda the sub-item entitled \u201cFollow-up to the outcome document of the high-level plenary meeting of the General Assembly known as the World Conference on Indigenous Peoples\u201d. 53rd plenary meeting 16 December 2021 __________________ 25 A/75/255."
  },
  "agenda_items": [
    "Item 71"
  ],
  "symbol_references": []
}