{
  "symbol": "A/RES/73/88",
  "filename": "A_RES_73_88.pdf",
  "title": "73/88. The situation in Afghanistan",
  "text": "United Nations \nA/RES/73/88\n \n \nGeneral Assembly \nDistr.: General \n14 December 2018 \n \n18-21201 (E)    211218 \n*1821201* \n \n \nSeventy-third session \nAgenda item 40 \n \n \n \n \n Resolution adopted by the General Assembly \non 6 December 2018 \n \n \n \n \n[without reference to a Main Committee (A/73/L.44 and A/73/L.44/Add.1)] \n \n \n \n73/88. The situation in Afghanistan \n \n \n \nThe General Assembly,  \n \nRecalling its resolution 72/10 of 21 November 2017 and all its previous relevant \nresolutions,  \n \nRecalling also all relevant Security Council resolutions and statements by the \nPresident of the Council on the situation in Afghanistan, in particular resolutions \n2189 (2014) of 12 December 2014, 2210 (2015) of 16 March 2015, 2274 (2016) of \n15 March 2016, 2344 (2017) of 17 March 2017 and 2405 (2018) of 8 March 2018,  \n \nReaffirming its strong commitment to the sovereignty, independence, territorial \nintegrity and national unity of Afghanistan, and respecting its multicultural, \nmulti-ethnic and historical heritage,  \n \nWelcoming the efforts by Afghanistan in the framework of the Transformation \nDecade (2015\u20132024) to consolidate its sovereignty through strengthening a fully \nfunctioning, sustainable State in the service of its people, with the goal of becoming \nfully self-reliant,  \n \nReaffirming the long-term partnership between the Government of Afghanistan \nand the international community based on their renewed mutual commitments, as laid \ndown in the Geneva Mutual Accountability Framework, as agreed upon at the Geneva \nConference on Afghanistan held on 27 and 28 November 2018, and recalling the long-\nterm commitment of the international community to Afghanistan, reaffirmed at the \nGeneva Conference, with the aim of continuing to strengthen national ownership and \nleadership, taking into account the evolving nature of the presence of the international \ncommunity,  \n \nReaffirming also the commitment of the international community to continuing \nto support the training, equipping, financing and development of the capacity of the \nAfghan National Defence and Security Forces, including as agreed in the Chicago \nSummit Declaration on Afghanistan in 2012 and in the Wales, Warsaw and Brussels \nSummit Declarations on Afghanistan, and honouring the memory of the men and \n\nA/RES/73/88 \nThe situation in Afghanistan\n \n18-21201\n2/15 \n \nwomen of the Afghan and international security forces who have given their lives in \nthe course of duty, \n \nReiterating the urgent need to tackle the challenges facing Afghanistan, in \nparticular the region-based terrorist or violent extremist activities of the Taliban, \nincluding the Haqqani Network, as well as Al-Qaida, Islamic State in Iraq and the \nLevant (ISIL) (Da\u2019esh) affiliates and other terrorist and violent extremist groups and \ncriminals, the development of the institutions of the Government of Afghanistan, \nincluding at the subnational level, the strengthening of the rule of law and democratic \nprocesses, the fight against corruption, the continuation of justice sector reform, the \npromotion of the peace process, without prejudice to the fulfilment of the measures \nintroduced by the Security Council in its relevant resolutions, in particular resolutions \n1267 (1999) of 15 October 1999, 1988 (2011) and 1989 (2011) of 17 June 2011, \n2082 (2012) and 2083 (2012) of 17 December 2012, 2160 (2014) and 2161 (2014) of \n17 June 2014, 2253 (2015) of 17 December 2015, 2255 (2015) of 21 December 2015 \nand 2368 (2017) of 20 July 2017, an Afghan-led transitional justice process, the safe \nand voluntary return of Afghan refugees and internally displaced persons in an orderly \nand dignified manner, the promotion and protection of human rights, interfaith and \nintra-faith tolerance and the advancement of economic and social development,  \n \nExpressing its deep concern about the continuous high level of violence in \nAfghanistan, especially the number of civilian casualties, condemning in the strongest \nterms all terrorist activity and all violent attacks, recalling that the Taliban, as well as \nAl-Qaida, ISIL (Da\u2019esh) affiliates and other terrorist and violent extremist groups and \nillegal armed groups are responsible for the significant majority of the civilian \ncasualties in Afghanistan, and calling for compliance with international humanitarian \nlaw and international human rights law, as applicable, including the obligation of all \nparties to armed conflict to ensure respect for and the protection of civilians and \nhumanitarian and medical personnel, as well as aid and humanitarian and medical \nfacilities, \n \nWelcoming the courageous steps taken by the Government of Afghanistan to \npromote an Afghan-led and Afghan-owned peace through the Kabul Process for Peace \nand Security Cooperation, including through the offer of talks without preconditions \nand the temporary ceasefire during Eid al-Fitr, and calling upon the Taliban to respond \nto the call for peace from the Afghan people and Government, \n \nWelcoming also the achievements of the National Unity Government in political, \neconomic, governance and social reforms and in the management of the transition, \nunderlining the need to preserve past achievements, and urging further improvement \nin this regard, in particular to address poverty and the delivery of services, stimulate \neconomic growth, create employment opportunities, increase domestic revenue and \npromote human rights, especially women\u2019s full and equal enjoyment of these rights, \nchildren\u2019s rights and the rights of persons belonging to minorities,  \n \nWelcoming further the holding of parliamentary elections in October 2018, \nwhich marked another important step towards the consolidation of democracy in the \ncountry, condemning in the strongest terms all terrorist activity and violent attacks \naimed at disrupting the elections, commending, in that regard, the people of \nAfghanistan for their courage and determination in defying terrorism and insecurity \nto take part in that national process, as well as the Afghan National Defence and \nSecurity Forces for the effective manner in which they provided security for the \nelections, and urging further technical and operational improvements to the electoral \nprocess ahead of the presidential elections in April 2019, \n \nEmphasizing the central and impartial role of the United Nations in promoting \npeace and stability in Afghanistan, expressing its appreciation and strong support for \nall of the efforts of the Secretary-General and his Special Representative for \n\nThe situation in Afghanistan \nA/RES/73/88\n \n3/15\n18-21201 \n \nAfghanistan in this regard, expressing its appreciation also for the work of the United \nNations Assistance Mission in Afghanistan in accordance with Security Council \nresolution 2405 (2018), and stressing the important role of the Assistance Mission in \nseeking to further improve the coherence and coordination of international civilian \nefforts, based on the \u201cOne United Nations\u201d approach and guided by the principle of \nreinforcing Afghan ownership and leadership,  \n \nNoting the visit of the Security Council to Kabul from 12 to 15 January 2018 as \nan affirmation of the continued and steadfast support of the international community \nfor a peaceful, secure, stable and prosperous Afghanistan, \n \nWelcoming the reports of the Secretary-General and the recommendations \ncontained therein,1  \n \n1. \nPledges its continued support to the Government and people of \nAfghanistan as they rebuild a stable, secure and economically self-sufficient State, \nfree of terrorism and narcotics, and strengthen the foundations of a constitutional \ndemocracy as a responsible member of the international community;  \n \n2. \nEncourages all partners to support constructively the Government of \nAfghanistan\u2019s reform agenda, including as envisaged in the Afghanistan National \nPeace and Development Framework and the Geneva Mutual Accountability \nFramework, so as to secure a prosperous and democratic Afghanistan, focusing on \nstrengthening the constitutional checks and balances that guarantee citizens\u2019 rights \nand obligations and implementing structural reform to enable an accountable and \neffective Government to deliver concrete progress to its people;  \n \n3. \nSupports the continuing and growing ownership of reconstruction and \ndevelopment efforts by the Government of Afghanistan, emphasizes the crucial need \nto achieve ownership and accountability in all fields of governance and to improve \ninstitutional capabilities, including at the subnational level, in order to use aid more \neffectively, and underscores in this regard the importance of the commitments of the \ninternational community and of the new set of indicators for the Self-Reliance through \nMutual Accountability Framework, as reiterated in the communiqu\u00e9 of the Brussels \nConference on Afghanistan in October 2016; \n \n4. \nWelcomes the adoption of the Geneva Mutual Accountability Framework, \nas reflected in the communiqu\u00e9 adopted at the international Geneva Conference on \nAfghanistan, which underscores the importance of the effective implementation of \nmutual commitments of the Government of Afghanistan and the international \ncommunity on a reciprocal basis; \n \n5. \nEmphasizes that threats to stability and development in Afghanistan and \nthe region require closer and more coordinated cooperation, as well as greater \ncoherence and complementarity of approach between countries of the region and the \ninternational community, for the long-term peace, security, prosperity and sustainable \ndevelopment of the country, and underscores in this regard the standing of \nAfghanistan as a platform for such international cooperation; \n \n \n \nSecurity \n \n \n6. \nRecognizes the commitment of the international community to supporting \nthe training, equipping, financing and development of the capacity of the Afghan \nNational Defence and Security Forces throughout the Transformation Decade, as \nagreed in the Chicago Summit Declaration on Afghanistan in 2012, the Wales Summit \nDeclaration on Afghanistan in 2014, the Warsaw Summit Declaration on Afghanistan \n__________________ \n \n1  A/71/682-S/2016/1049, A/71/826-S/2017/189, A/71/932-S/2017/508, A/72/392-S/2017/783 and \nA/73/374/Rev.1-S/2018/824/Rev.1. \n\nA/RES/73/88 \nThe situation in Afghanistan\n \n18-21201\n4/15 \n \nin 2016 and the Brussels Summit Declaration on Afghanistan in 2018, including \nthrough the Resolute Support Mission, as welcomed by the Security Council in its \nresolution 2189 (2014); \n \n7. \nWelcomes the pledges and commitments made at the Warsaw Summit of \nthe North Atlantic Treaty Organization held on 8 and 9 July 2016, as reinforced at the \nBrussels Summit held on 11 and 12 July 2018, to continuing national contributions to \nthe financial sustainment of the Afghan National Defence and Security Forces until \nthe end of 2024, to sustaining the Resolute Support Mission and to continuing to \ndeliver training, advice and assistance to the Afghan security institutions, including \nthe police, the air force and special operations forces;  \n \n8. \nTakes note of the announcement in 2017 by the United States of America \nof its strategy for Afghanistan and the adoption by the European Union of its strategy \non Afghanistan as important components of the continued support of the international \ncommunity for the security, development and stability of Afghanistan;  \n \n9. \nReiterates once again its serious concern about the security situation in \nAfghanistan, stresses the need to continue to address the threat to the security and \nstability of Afghanistan caused by the region-based violent extremist and other illegal \narmed groups and criminals, including those involved in the narcotics trade, expresses \nconcern over the serious threat posed by the presence of foreign terrorist fighters, \nreiterates in this regard its call for the full and serious implementation of measures \nand the application of procedures introduced in relevant Security Council resolutions, \nin particular resolutions 1267 (1999), 1988 (2011), 1989 (2011), 2082 (2012), \n2083 (2012), 2160 (2014), 2161 (2014), 2253 (2015), 2255 (2015) and 2368 (2017), \nand calls upon all States to strengthen their international and regional cooperation to \nenhance information-sharing, border control, law enforcement and criminal justice to \nbetter counter the threat posed by foreign terrorist fighters and returning foreign \nterrorist fighters in Afghanistan and the region;  \n \n10. Expresses its serious concern regarding the presence of terrorist \norganizations, in particular Islamic State in Iraq and the Levant (ISIL) (Da\u2019esh) \naffiliates and its brutal acts, including killings of Afghan nationals, and deplorable \nattempts to undermine relations between communities, commends the progress of the \nGovernment of Afghanistan in combating these threats in the country and affirms its \nsupport for continued efforts in this regard, and calls for enhanced regional \ncooperation in the fight against these groups;  \n \n11. \nCondemns in the strongest terms all unlawful acts of violence, intimidation \nand attacks, including improvised explosive device attacks, suicide attacks, \nassassinations, including of public figures, abductions, indiscriminate attacks against \ncivilians, killings, attacks against individuals, media groups and organs of society \nengaged in the promotion and protection of universally recognized human rights, \nattacks against humanitarian and medical personnel and civilian objects, including \nschools and hospitals, and the targeting of Afghan and international forces, which \nhave a deleterious effect on stabilization and development efforts in Afghanistan, and \nalso condemns the use, by the Taliban, including the Haqqani Network, Al-Qaida and \nother terrorist and violent extremist groups and illegal armed groups, of civilians as \nhuman shields, as well as Taliban attacks and acts of international terrorists;  \n \n12. Stresses the need for the Government of Afghanistan and the international \ncommunity to continue to work closely together and to improve coordination in \ncountering such acts, which are threatening peace and stability in Afghanistan and the \ndemocratic process, the achievements and the continued implementation of the \nAfghanistan development gains and process, as well as humanitarian aid measures, \nrecognizes the achievements of the Afghan National Defence and Security Forces in \nthis regard, and calls upon all Member States, in particular neighbouring countries, \n\nThe situation in Afghanistan \nA/RES/73/88\n \n5/15\n18-21201 \n \nto deny those groups any form of sanctuary, freedom of operations, movement, \nrecruitment and financial, material or political support that endangers the State system \nand regional peace and security;  \n \n13. Condemns in the strongest terms the heinous and cowardly terrorist attack \nthat took place in Kabul on 20 November 2018 targeting a gathering of religious \nscholars, which resulted in at least 55 people being killed and more than 80 injured, \nas well as other terrorist attacks throughout Afghanistan which took the lives of \nAfghan parliamentary candidates, government officials, senior army, police and \nsecurity officials and civilians, including women and children, diplomatic personnel \nand religious minorities; \n \n14. Welcomes the assumption of full security responsibility by the Afghan \nNational Defence and Security Forces, commends the resilience and courage \ndisplayed in this regard, calls upon the international community to provide the support \nnecessary to increase security, including public order, law enforcement, the security \nof Afghanistan\u2019s borders and the preservation of the constitutional rights of Afghan \ncitizens, as well as to provide continued support by training, equipping and \ncontributing to the financing of the Afghan National Defence and Security Forces to \ntake on the task of securing their country and fighting against terrorism, and \nunderscores the importance of the Chicago, Wales, Warsaw and Brussels Summit \nDeclarations on Afghanistan and other relevant agreements with regional and \ninternational partners;  \n \n15. Also welcomes, in this regard, the presence of the Resolute Support \nMission, expresses its appreciation to Member States for having contributed \npersonnel, equipment and other resources to the Mission and for the support provided \nto the Afghan National Defence and Security Forces by all international partners, in \nparticular by the North Atlantic Treaty Organization through its previous combat and \ncurrent non-combat missions in Afghanistan, as well as other bilateral training \nprogrammes, and encourages further coordination, where appropriate;  \n \n16. Further welcomes the commitment of the Government of Afghanistan, \nwith a view to ensuring stability and providing conditions for the effective rule of law \nand respect for human rights for all, including women\u2019s full and equal enjoyment of \nthese rights, to continuing its security sector reform by making the security provision, \nmanagement and oversight of the Afghan National Defence and Security Forces more \neffective and accountable, welcomes in this regard the progress being made in the \nAfghan national security institutions, as presented at the Geneva Conference, \nrecognizes the importance of the further implementation of the Afghan National \nPolice Strategy and the 10-year vision presented by the Ministry of the Interior, and \nexpresses its appreciation for the support that Member States have provided to the \nAfghan National Defence and Security Forces;  \n \n17. Recalls that regional security cooperation plays a key role in maintaining \nstability in Afghanistan and the region, welcomes the progress achieved by \nAfghanistan and regional partners in this regard, calls for further efforts by \nAfghanistan and regional partners and organizations, including the Shanghai \nCooperation Organization, to strengthen their partnership and cooperation, takes note \nof the eighteenth meeting of the Council of Heads of State of the Shanghai \nCooperation Organization held in Qingdao, China, on 9 and 10 June 2018, as it related \nto Afghanistan, and in this regard also takes note of the meeting of the Shanghai \nCooperation Organization-Afghanistan Contact Group held in Beijing on \n28 May 2018; \n \n18. Remains deeply concerned about the persistent problem of anti-personnel \nlandmines and explosive remnants of war, welcomes the achievements to date in the \nimplementation of the Mine Action Programme for Afghanistan aimed at declaring \n\nA/RES/73/88 \nThe situation in Afghanistan\n \n18-21201\n6/15 \n \nAfghanistan mine-free by 2023, underscores the importance of sustained international \nassistance, encourages the Government of Afghanistan, with the support of the United \nNations and all relevant actors, to continue its efforts to meet its responsibilities under \nthe Convention on the Prohibition of the Use, Stockpiling, Production and Transfer \nof Anti-Personnel Mines and on Their Destruction,2 expresses concern at the use of \nimprovised explosive devices by the Taliban against civilians and the Afghan security \nforces, and notes the need to enhance coordination and information-sharing between \nboth Member States and the private sector to prevent the flow of improvised explosive \ndevice components to the Taliban; \n \n \n \nPeace and reconciliation  \n \n \n19. Recognizes that an Afghan-led and Afghan-owned inclusive peace process \nbacked by regional actors, in particular Pakistan, supported by the international \ncommunity, is essential for achieving long-term peace and stability in Afghanistan \nand reiterates its firm commitment to supporting the Government of Afghanistan in \nits efforts in this regard, and that, to be successful, a political solution must ensure \nthe renunciation of violence and the breaking of all ties to international terrorism, \nprotect the human rights of all, including women, children and persons belonging to \nminorities, in accordance with international law and as enshrined in the Constitution \nof Afghanistan, and build a peaceful Afghanistan, with full respect for the \nimplementation of the measures and application of the procedures introduced by the \nSecurity Council in its resolutions 1267 (1999), 1988 (2011), 2082 (2012), \n2160 (2014) and 2255 (2015), as well as other relevant resolutions of the Council, \ncalls upon all relevant States, especially neighbouring countries, and international \norganizations to remain engaged in the Afghan-led and Afghan-owned peace process, \nand recognizes the impact that terrorist attacks have on the Afghan people, while \nunderlining that such acts should not hinder efforts to achieve a peace settlement;  \n \n20. Welcomes the offer made by the Government of Afghanistan to begin direct \nnegotiations within the framework of a comprehensive peace plan and the offer made \nto the Taliban of talks without preconditions at the second meeting of the Kabul \nProcess for Peace and Security Cooperation, on 28 February 2018, and calls upon the \nTaliban to accept this offer without any preconditions and without the threat of \nviolence, with the aim of agreeing on an ultimate political settlement that leads to \nsustainable peace for the people of Afghanistan; \n \n21. Also welcomes the temporary and partial ceasefire announced separately \nby the Government of Afghanistan and the Taliban, for the end of Ramadan and the \nEid al-Fitr holiday, expresses its strong disappointment that the Taliban has not agreed \nto the Government\u2019s offer to extend or repeat them, and urges the Taliban to respond \nto the call for peace from the Afghan people; \n \n22. Encourages Afghanistan and Pakistan to enhance their relationship, which \ncould lead to cooperation to combat terrorism effectively and move forward the \nAfghan-led and Afghan-owned peace process, takes note, in that regard, of the \nconclusion of the Afghanistan-Pakistan Action Plan for Peace and Solidarity as an \nimportant mechanism of cooperation, and underscores the importance of the effective \nimplementation of the commitments made;  \n \n23. Recalls that women play a vital role in the peace process, as recognized \nby the Security Council in its resolution 1325 (2000) of 31 October 2000 and in \nrelated resolutions, including resolution 2242 (2015) of 13 October 2015, welcomes \nsteps taken by the Government of Afghanistan in implementing its national action \nplan on women, peace and security, recognizes in this regard the increasing role of \n__________________ \n \n2  United Nations, Treaty Series, vol. 2056, No. 35597. \n\nThe situation in Afghanistan \nA/RES/73/88\n \n7/15\n18-21201 \n \nwomen in the peace process, as manifested in their representation in the High Peace \nCouncil and its provincial committees and secretariats, as well as their contribution \nto the development of the Afghanistan peace and reconciliation strategy, as reflected \nin the report of the Secretary-General,3 supports further efforts in this regard, and \nencourages the Government of Afghanistan to further support the active participation \nof women in the peace process;  \n \n24. Recognizes that there is no purely military solution to ensure the stability \nof Afghanistan, welcomes the Afghan-led and Afghan-owned peace process, as \narticulated at the second meeting of the Kabul Process for Peace and Security \nCooperation as a main forum and vehicle under the leadership of the Government of \nAfghanistan to lead peace efforts, notes the work of the Quadrilateral Coordination \nGroup, the International Contact Group on Afghanistan, the Tashkent dialogue \nconsultations and the Moscow format consultations to reinforce Afghan-led and \nAfghan-owned efforts towards the holding of early direct peace talks between the \nGovernment of Afghanistan and authorized representatives of Taliban groups, and \ncalls upon all regional and international partners of Afghanistan to continue their \nefforts, recognizing that success can be achieved only through the unified and close \ncoordination of efforts under the leadership and ownership of the Government of \nAfghanistan; \n \n \n \nDemocracy \n \n \n25. Emphasizes the importance of all parties in Afghanistan working together \nto achieve a unified, peaceful, democratic and prosperous future for all the people of \nAfghanistan;  \n \n26. Recalls the commitment of the Government of Afghanistan to improving \nAfghanistan\u2019s electoral process, welcomes the parliamentary elections held in \nOctober 2018 and commends the participation and courage of millions of Afghans, \nincluding women as voters and candidates, condemns in the strongest terms all \nterrorist activity and violent attacks aimed at disrupting the elections, reiterates the \nimportant role of the independent Afghan electoral institutions in upholding the \nintegrity of the electoral process, calls upon all stakeholders to continue to engage \nwith the electoral institutions with patience and respect and to channel complaints \nthrough established constitutional mechanisms in line with Afghanistan\u2019s electoral \nlaws and Constitution, and also calls upon Afghanistan\u2019s Government and \ninstitutions, including the Independent Election Commission and the Electoral \nComplaints Commission, to ensure that the forthcoming presidential elections and \nother elections foreseen in 2019 are credible, inclusive, fair and free, safe and \ntransparent by continuing to implement the necessary electoral reforms and further \ntechnical and operational improvements to strengthen trust and confidence, including \nthe updating of the voter registration databases; \n \n27. Welcomes the increasingly wide and comprehensive dialogue on the \npolitical transition towards strengthening the unity of the Afghan people, and \nunderscores its importance for consolidating democracy and Afghan political \nstability;  \n \n28. Calls upon the Government of Afghanistan to continue to reform \neffectively the public administration sector in order to implement the rule of law and \nto ensure good governance and accountability, and welcomes the commitments, \nefforts and progress made by the Government in this regard;  \n \n__________________ \n \n3  A/72/392-S/2017/783. \n\nA/RES/73/88 \nThe situation in Afghanistan\n \n18-21201\n8/15 \n \n \n \nRule of law, human rights and good governance  \n \n \n29. Emphasizes that the rule of law, human rights and good governance form \nthe foundation for the achievement of a stable and prosperous Afghanistan;  \n \n30. Recalls the constitutional guarantee of respect for human rights and \nfundamental freedoms for all Afghans, without discrimination of any kind, stresses \nthe need to fully implement the human rights provisions of the Afghan Constitution, \nin accordance with obligations under applicable international law, in particular those \nregarding the full enjoyment by women and children of their human rights, and \nacknowledges efforts of the Government of Afghanistan in this regard;  \n \n31. Recognizes the membership of Afghanistan in the Human Rights Council, \nand welcomes the commitment and responsibility assumed in upholding and \npromoting human rights at the national, regional and international levels, within the \nframework of relevant international human rights instruments to which it is a party;  \n \n32. Reiterates its concern at the destructive consequences of violent and \nterrorist activities, including against persons belonging to ethnic and religious \nminorities, by the Taliban, including the Haqqani Network, as well as Al-Qaida, ISIL \n(Da\u2019esh) affiliates and other terrorist and violent extremist groups and other illegal \narmed groups and criminals, for the enjoyment of human rights and for the capacity \nof the Government to ensure human rights and fundamental freedoms for all Afghans, \nand stresses the need to further promote tolerance and to ensure respect for the right \nto freedom of expression and the right to freedom of thought, conscience, religion or \nbelief as enshrined in the Afghan Constitution and the international covenants that \nAfghanistan adheres to;  \n \n33. Emphasizes the necessity of investigating allegations of current and past \nviolations, and stresses the importance of facilitating the provision of efficient and \neffective remedies to the victims and of bringing the perpetrators to justice in \naccordance with national and international law; \n \n34. Calls for the full implementation of the mass media law, while noting with \nconcern and condemning the continuing intimidation and violence targeting Afghan \njournalists, such as cases of abduction and even the killing of journalists by terrorist \nand violent extremist and criminal groups, urges that the harassment of and attacks \non journalists be investigated by Afghan authorities and that those responsible be \nbrought to justice, and welcomes in this regard the issuance of the presidential decree \nof 3 January 2017 on better implementation of the laws related to mass media to \nreinforce freedom of expression and ensure access to information and the creation of \na journalists\u2019 support fund aimed at assisting the bereaved families of journalists and \nreporters;  \n \n35. Reiterates its unwavering commitment and that of the Government of \nAfghanistan to achieving the full and equal participation of women in all spheres of \nAfghan life, commends the achievements and efforts of the Government aimed at \ncountering discrimination and protecting and promoting the equal rights of women \nand men consistent with its international obligations under the Convention on the \nElimination of All Forms of Discrimination against Women 4 and pursuant to the \nAfghan Constitution, the National Action Plan for the Women of Afghanistan, the \nAfghan national action plan on women, peace and security, the law on the elimination \nof violence against women and the national strategy to prevent violence against \nwomen, and welcomes recent measures taken towards the protection of women\u2019s and \ngirls\u2019 full and equal enjoyment of human rights, including the establishment of a \n__________________ \n \n4  United Nations, Treaty Series, vol. 1249, No. 20378. \n\nThe situation in Afghanistan \nA/RES/73/88\n \n9/15\n18-21201 \n \nsenior position in the Office of the Attorney General on the elimination of violence \nagainst women and the appointment of 44 female attorneys in 25 provinces; \n \n36. Emphasizes the need to ensure respect for the human rights and \nfundamental freedoms of children in Afghanistan, recalls the need for the full \nimplementation of the Convention on the Rights of the Child, 5 its Optional Protocol \non the sale of children, child prostitution and child pornography 6 and its Optional \nProtocol on the involvement of children in armed conflict 7 by all States parties, as \nwell as of Security Council resolution 1612 (2005) of 26 July 2005, and all other \nsubsequent resolutions on children and armed conflict, and Council resolutions \n1998 (2011) of 12 July 2011 and 2286 (2016) of 3 May 2016 on attacks against \nschools and hospitals, in particular by terrorist and violent extremist and criminal \ngroups, commends the Government of Afghanistan for introducing legislation \nbanning the recruitment and use of children and for establishing local child protection \nunits, and welcomes the progress made on the implementation of the action plan for \nthe prevention of underage recruitment, signed in January 2011, and the annex thereto \non children associated with the Afghan National Defence and Security Forces, and of \nthe road map towards compliance, as well as the signing in 2017 of a child protection \npolicy to protect children from the effects of armed conflict;  \n \n37. Recalls Security Council resolutions 2250 (2015) of 9 December 2015 on \nthe maintenance of international peace and security and 2419 (2018) of 6 June 2018 \non youth, peace and security, in which the Council reaffirmed the important role youth \ncan play in the prevention and resolution of conflicts, welcomes the appointment of \nAfghanistan\u2019s first youth representative to the United Nations, recognizes in this \nregard the Government of Afghanistan\u2019s efforts in enhancing the representation of \nyouth for the prevention and resolution of conflict, and encourages continued efforts \nin this regard; \n \n38. Reiterates its appreciation for the anti-corruption commitment made by \nthe Government of Afghanistan, welcomes in this respect the establishment of the \nNational High Council for Rule of Law and Anti-Corruption, the Anti-Corruption \nJustice Centre and the National Procurement Commission, the adoption on \n28 September 2017 of the Afghanistan National Strategy for Combating Corruption, \nthe enactment of the revised penal code and the anti-corruption law of 2018 and the \nfinalization of anti-corruption action plans for various ministries, as measures taken \nby the Government to implement its comprehensive reform agenda, strengthen \ngovernance and achieve a more effective, accountable and transparent administration \nat the national, provincial and local levels of government, takes note in this regard of \nthe progress made thus far against the benchmarks of its comprehensive reform \nagenda presented and endorsed at the third Senior Officials Meeting and at the Geneva \nConference on Afghanistan, and urges continued decisive action and accelerated \nimplementation by the Government to establish a more effective, accountable and \ntransparent administration at the national, provincial and local levels of government;  \n \n39. Calls upon the international community to support the efforts of \nAfghanistan to meet governance objectives in this regard;  \n \n \n \nCounter-narcotics  \n \n \n40. Welcomes the efforts of the Government of Afghanistan in fighting drug \nproduction in Afghanistan, takes note of the report of the United Nations Office on \nDrugs and Crime entitled Afghanistan Opium Survey 2018: Cultivation and \n__________________ \n \n5  Ibid., vol. 1577, No. 27531. \n \n6  Ibid., vol. 2171, No. 27531. \n \n7  Ibid., vol. 2173, No. 27531. \n\nA/RES/73/88 \nThe situation in Afghanistan\n \n18-21201\n10/15 \n \nProduction, released on 19 November 2018, which, inter alia, notes a significant \ndecrease in the production and cultivation of drugs, due in part to the drought \naffecting Afghanistan, notes that areas under cultivation remain at high levels, \nstresses the need to further strengthen joint, coordinated and resolute efforts by the \nGovernment, supported by the United Nations Office on Drugs and Crime and \ninternational and regional actors, within their designated responsibilities, and \nencourages international and regional cooperation with Afghanistan in its sustained \nefforts to address drug production and trafficking;  \n \n41. Stresses the importance of a comprehensive and balanced approach in \naddressing the drug problem of Afghanistan, which, to be effective, must be \nintegrated into the wider context of efforts carried out in the areas of security, \ngovernance, the rule of law, human rights and economic and social development, in \nparticular in rural areas, including the development of improved alternative livelihood \nprogrammes;  \n \n42. Notes with great concern the strong nexus between the drug trade and \nterrorist activities by the Taliban, including the Haqqani Network, as well as \nAl-Qaida, ISIL (Da\u2019esh) affiliates and other terrorist groups, violent and extremist \ngroups and criminal groups, which pose a serious threat to security, the rule of law \nand development in Afghanistan and the region, and stresses the importance of the \nfull implementation of all relevant Security Council resolutions in this regard, \nincluding resolutions 2255 (2015) and 2368 (2017), and in this regard emphasizes the \nneed for the Security Council Committee established pursuant to resolution \n1988 (2011) and the Committee pursuant to resolutions 1267 (1999), 1989 (2011) and \n2253 (2015) to continue to pay attention to the linkages between the proceeds of \norganized crime, inter alia, the illicit production of and trafficking in drugs and their \nchemical precursors and the financing, respectively, of the Taliban, including the \nHaqqani Network, and of ISIL (Da\u2019esh), Al-Qaida and associated individuals, groups, \nundertakings and entities; \n \n43. Calls upon the international community to continue to assist the \nGovernment of Afghanistan in its National Drug Control Strategy and National Drug \nAction Plan, calls for such efforts to eliminate the cultivation and production of, \ntrafficking in and consumption of illicit drugs, increase support for Afghan law \nenforcement and criminal justice agencies, agricultural and rural development for the \ncreation of improved alternative, licit livelihoods for farmers and demand reduction \nsupport, increase public awareness of counter-narcotics issues and build the capacity \nof drug control institutions and care and treatment centres for drug users, reiterates \nits call upon the international community to channel counter-narcotics funding \nthrough the Government of Afghanistan, the United Nations Office on Drugs and \nCrime and other relevant organizations and mechanisms to the extent possible, notes \nthat the problem of production, cultivation, trafficking in and consumption of narcotic \ndrugs, as well as the problem of precursors, should be addressed on the basis of the \nprinciple of common and shared responsibility of the Government and the \ninternational community, and welcomes and supports relevant international and \nregional projects and activities, including those carried out by Afghanistan, Iran \n(Islamic Republic of) and Pakistan within the framework of the triangular initiative \nto counter narcotics, as well as the Paris Pact initiative; 8  \n \n__________________ \n \n8  See S/2003/641, annex. \n\nThe situation in Afghanistan \nA/RES/73/88\n \n11/15\n18-21201 \n \n \n \nSocial and economic development  \n \n \n44. Notes Afghanistan\u2019s position as the top improver in the World Bank Doing \nBusiness 2019 report and the work of the Government of Afghanistan in implementing \nreforms to improve the business regulatory framework; \n \n45. Welcomes the Afghanistan National Peace and Development Framework \nsetting out the strategic policy priorities of Afghanistan towards achieving \nself-reliance and the presentation of five national priority programmes, on a citizens\u2019 \ncharter, women\u2019s economic empowerment, urban development, comprehensive \nagriculture and national infrastructure, to improve the conditions for advancing \nsustainable development and stability;  \n \n46. Renews its commitment to long-term support for the economic \ndevelopment of Afghanistan on the basis of mutual accountability as stated in the \nGeneva Mutual Accountability Framework, urgently appeals to all States, the United \nNations system and international and non-governmental organizations, including the \ninternational and regional financial institutions, to continue to provide, in close \ncoordination with the Government of Afghanistan and in accordance with the \nAfghanistan National Peace and Development Framework and the national priority \nprogrammes contained therein, all possible and necessary humanitarian, recovery, \nreconstruction, development, financial, educational, technical and material assistance \nfor Afghanistan, and underscores the crucial importance of continued and sequenced \nimplementation of the reform agenda, national priority programmes and the \ndevelopment and governance goals as agreed in the Geneva Mutual Accountability \nFramework;  \n \n47. Recognizes the substantial development and notable progress achieved by \nAfghanistan with the steadfast support of the international community in the past \nyears, expresses its support for the reaffirmation and consolidation of the partnership \nbetween Afghanistan and the international community midway through the \nTransformation Decade (2015\u20132024), during which Afghanistan will consolidate its \nsovereignty through strengthening a fully functioning, sustainable State in the service \nof its people, urges the Government of Afghanistan to involve all elements of Afghan \nsociety, in particular women, in the development and implementation of relief, \nrehabilitation, recovery and reconstruction programmes, welcomes the presentation \nby the Government of Afghanistan of the National Priority Programme on Women\u2019s \nEconomic Empowerment and encourages its continued implementation, and \nwelcomes the launch of the women\u2019s economic empowerment plan in March 2017 \nand the creation of a coordination unit for the National Priority Programme within the \nMinistry of Labour, Social Affairs, Martyrs and Disabled as important measures for \nthe implementation of the National Priority Programme;  \n \n48. Welcomes the progress made in implementing the Self-Reliance through \nMutual Accountability Framework and the commitment to continuing the reforms \nagreed in the Geneva Mutual Accountability Framework and the monitoring \nmechanism included therein, in which the Government of Afghanistan reaffirmed its \ncommitment to strengthening governance, grounded in human rights, the rule of law \nand adherence to the Afghan Constitution and held it as integral to sustained growth \nand economic development, and in which the international community committed to \nenhancing the efficiency of development aid by aligning assistance with the Afghan \nnational priority programmes and by channelling assistance through the national \nbudget of the Government, as outlined in the Tokyo Declaration: Partnership for Self-\nReliance in Afghanistan \u2013 From Transition to Transformation9 and reaffirmed in the \n__________________ \n \n9  A/66/867-S/2012/532, annex I. \n\nA/RES/73/88 \nThe situation in Afghanistan\n \n18-21201\n12/15 \n \ncommuniqu\u00e9 of the Brussels Conference on Afghanistan and the new Geneva Mutual \nAccountability Framework indicators;  \n \n49. Commends the Government of Afghanistan for aligning its new \ndevelopment strategy with the 2030 Agenda for Sustainable Development, 10 and \nurges the international community to assist the Government in implementing its \nunfinished Millennium Development Goals and its Sustainable Development Goals;  \n \n50. Also commends the Government of Afghanistan for improving budgetary \ntransparency and its efforts to reach fiscal sustainability, notes the challenges ahead, \nand urges that continued efforts be made to meet revenue targets;  \n \n51. Recognizes the necessity for further improvement in the living conditions \nof the Afghan people, and emphasizes the need to strengthen and support the \ndevelopment of the capacity of the Government of Afghanistan to deliver basic social \nservices at the national, provincial and local levels, in particular education and public \nhealth services;  \n \n52. Reiterates the necessity of providing Afghan children, especially Afghan \ngirls, with educational and health facilities in all parts of the country, and welcomes \nthe progress achieved in the sector of public education;  \n \n53. Notes with concern the severe drought affecting Afghanistan, with \n3.3 million Afghans facing emergency-level food insecurity and more than \n220,000 Afghans displaced from their homes, and urges the international community \nto provide the necessary support and to work with the Government of Afghanistan \nand humanitarian organizations to respond effectively to the drought needs identified \nin the revised Afghanistan Humanitarian Response Plan without delay, prior to the \nonset of winter; \n \n54. Underscores the urgent need to address the impacts of climate change in \nAfghanistan, and emphasizes the need for local, subnational, national, regional and \ninternational action to enhance efforts to build resilience, especially for the most \nvulnerable, by investing in resilience, including disaster risk reduction, strengthening \nadaptation strategies and enhancing joint risk assessments and risk management \nstrategies, including early warning systems in the country to monitor environmental \nchanges, to cut the impact and cost of natural disasters; \n \n \n \nRefugees  \n \n \n55. Expresses its appreciation to those Governments that continue to host \nAfghan refugees, in particular Pakistan and the Islamic Republic of Iran, \nacknowledging the huge burden they have so far shouldered in this regard, asks for \ncontinued generous support by the international community, and asks relevant \ninternational organizations, in particular the Office of the United Nations High \nCommissioner for Refugees and the International Organization for Migration, to \ncontinue to work closely with Afghanistan and the countries hosting Afghan refugees \nwith a view to facilitating their voluntary, safe, dignified and sustainable return, \nrehabilitation and reintegration;  \n \n56. Welcomes the outcome of the high-level segment on the Afghan refugee \nproblem of the sixty-sixth session of the Executive Committee of the Programme of \nthe United Nations High Commissioner for Refugees,11 emphasizes the importance of \nthe Solutions Strategy for Afghan Refugees to Support Voluntary Repatriation, \nSustainable Reintegration and Assistance to Host Countries, and looks forward to the \n__________________ \n \n10  Resolution 70/1. \n \n11  See Official Records of the General Assembly, Seventieth Session, Supplement No. 12A \n(A/70/12/Add.1), annex II. \n\nThe situation in Afghanistan \nA/RES/73/88\n \n13/15\n18-21201 \n \nfurther implementation of the joint communiqu\u00e9 of the International Conference on \nthe Solutions Strategy for Afghan Refugees to Support Voluntary Repatriation, \nSustainable Reintegration and Assistance to Host Countries aimed at increased \nsustainability of returns and continued support for host countries, through the \nsustained support and the directed efforts of the international community;  \n \n57. Expresses its concern over the increase in the number of internally \ndisplaced persons and refugees from Afghanistan, stresses that stability and \ndevelopment in Afghanistan can be achieved if its citizens can see a future for \nthemselves within their country, reiterates to host countries and the international \ncommunity the obligations under international refugee law with respect to the \nprotection of refugees, the principle of voluntary return and the right to seek asylum \nand to ensure full, safe and unhindered access for humanitarian relief agencies in \norder to provide protection and assistance to internally displaced persons and \nrefugees, and calls upon countries to continue to accept an appropriate number of \nAfghan refugees for resettlement as a manifestation of their shared responsibility and \nsolidarity;  \n \n58. Takes note of the cooperation framework signed between the Government \nof Afghanistan and the European Union, entitled \u201cJoint way forward on migration \nissues\u201d, and in this context underscores the importance of close and effective \ncooperation to address the problem of irregular migration in a comprehensive manner, \nwith due focus on and consideration of addressing the root causes of migration, \nincluding through job creation and the establishment of returnees\u2019 livelihoods in \nAfghanistan, and in accordance with international commitments and obligations, \nincluding the human rights and legal rights of all migrants and the rights of persons \nin need of international protection in line with the provisions of the 1951 Convention \nrelating to the Status of Refugees12 and the 1967 Protocol thereto,13 as applicable;  \n \n59. Welcomes the commitment of the Government of Afghanistan to making \nthe repatriation and reintegration of Afghan refugees one of its highest national \npriorities, including their voluntary, safe and dignified return and their sustainable \nreintegration into national development planning and prioritization processes, takes \nnote in this regard of the accession of Afghanistan to the Protocol against the \nsmuggling of Migrants by Land, Sea and Air, supplementing the United Nations \nConvention against Transnational Organized Crime, 14  on 2 February 2017, and \nencourages and supports all efforts of the Government towards the implementation of \nthis commitment;  \n \n60. Reaffirms its firm support for the implementation of the Solutions Strategy \nfor Afghan Refugees to Support Voluntary Repatriation, Sustainable Reintegration \nand Assistance to Host Countries endorsed by the international community in 2012, \nand acknowledges the Enhanced Voluntary Return and Reintegration Package for \nAfghan Refugees as an innovative way to enhance sustainable return and \nreintegration;  \n \n61. Welcomes the continued return of Afghan refugees and internally displaced \npersons, in a voluntary, safe, dignified and sustainable manner, while noting with \nconcern the security challenges of Afghanistan;  \n \n \n \nRegional cooperation  \n \n \n62. Stresses the crucial importance of advancing constructive and sustainable \nregional cooperation as an effective means of promoting and complementing peace, \n__________________ \n \n12  United Nations, Treaty Series, vol. 189, No. 2545. \n \n13  Ibid., vol. 606, No. 8791. \n \n14  Ibid., vol. 2241, No. 39574. \n\nA/RES/73/88 \nThe situation in Afghanistan\n \n18-21201\n14/15 \n \nsecurity, stability and economic and social development in Afghanistan, recognizes \nin this regard the importance of the contribution of neighbouring and regional partners \nand regional organizations, recalls the importance of the Kabul Declaration on Good-\nneighbourly Relations of 22 December 2002 15  and welcomes in this regard the \ncontinued commitment of the international community to supporting the stability and \ndevelopment of Afghanistan, encourages further improved relations and enhanced \nengagement between Afghanistan and its neighbours, calls for further efforts in this \nregard, including in the framework of the Heart of Asia-Istanbul Process on Regional \nSecurity and Cooperation for a Secure and Stable Afghanistan and by regional \norganizations and long-term strategic partnerships and other agreements aimed at \nachieving a peaceful, stable and prosperous Afghanistan, welcomes international and \nregional initiatives in this regard, such as those of the Collective Security Treaty \nOrganization, the South Asian Association for Regional Cooperation, the Economic \nCooperation Organization, the Regional Economic Cooperation Conference on \nAfghanistan process, the European Union, the Organization for Security and \nCooperation in Europe, the Quadrilateral Cooperation and Coordination Mechanism \nin Counter-Terrorism comprising the armed forces of Afghanistan, China, Pakistan \nand Tajikistan, the China-Afghanistan-Pakistan dialogues and the Conference on \nInteraction and Confidence-building Measures in Asia;  \n \n63. Welcomes the important initiatives for regional connectivity, notably in the \nframeworks of the Regional Economic Cooperation Conference on Afghanistan and \nthe Heart of Asia-Istanbul Process confidence-building measures to facilitate \nincreased trade throughout the region, commends the holding of the seventh Regional \nEconomic Cooperation Conference on Afghanistan in Ashgabat on 14 and \n15 November 2017, and looks forward to the forthcoming Heart of Asia Ministerial \nConference, to be held in Turkey in 2019;  \n \n64. Emphasizes, in this regard, the importance of strengthening local and \nregional networks of transportation that will facilitate connectivity for economic \ndevelopment, stability and self-sustainability, particularly the completion and \nmaintenance of local railroad and land routes, the development of regional projects \nto foster further connectivity and the enhancement of international civil aviation \ncapabilities;  \n \n65. Welcomes and urges further efforts to strengthen the process of regional \neconomic cooperation, including measures to facilitate regional connectivity, trade \nand transit, acknowledges the progress made on such projects and initiatives as the \nTurkmenistan-Afghanistan-Pakistan-India (TAPI) gas pipeline project, the Central \nAsia South Asia Electricity Transmission and Trade Project (CASA-1000), the \nTurkmenistan-Afghanistan-Pakistan (TAP) 500 and Turkmenistan-Uzbekistan-\nTajikistan-Afghanistan-Pakistan (TUTAP) \nelectricity projects, the Pakistan-\nAfghanistan-Tajikistan Regional Integration Programme (PATRIP), the Chabahar \nagreement between Afghanistan, India and the Islamic Republic of Iran and the \ntransport of development assistance from India to Afghanistan through the Chabahar \nport, the Lapis Lazuli Transit, Trade and Transport Route agreement and the \nTurkmenistan-Aqina railway segment and on bilateral transit trade agreements, \nexpanded consular visa cooperation and the facilitation of business travel, to expand \ntrade, increase foreign investments and develop infrastructure, including \ninfrastructural connectivity, energy supply, transport and integrated border \nmanagement, with a view to promoting sustainable economic growth and the creation \nof jobs in Afghanistan and the region, notes the historical role of Afghanistan as a \nland bridge in Asia, recalls that such regional economic cooperation plays an \nimportant role in achieving stability and development in Afghanistan, in this regard \n__________________ \n \n15  S/2002/1416, annex. \n\nThe situation in Afghanistan \nA/RES/73/88\n \n15/15\n18-21201 \n \nurges all relevant stakeholders to create a feasible and secure environment for the full \nimplementation of these development initiatives and trade agreements, and welcomes \nthe progress made by these initiatives and projects in enhancing regional connectivity, \ntrade and transit, including the creation of direct air freight corridors between \nAfghanistan and China, India, Italy, Kazakhstan, the Russian Federation, Saudi \nArabia, Turkey and the United Arab Emirates; \n \n \n \nUnited Nations Assistance Mission in Afghanistan and Joint Coordination \nand Monitoring Board  \n \n \n66. Expresses its appreciation for the work of the United Nations Assistance \nMission in Afghanistan, as mandated by the Security Council in its resolution \n2405 (2018), stresses the continued importance of the central and impartial \ncoordinating role of the United Nations in promoting a more coherent international \nengagement, and acknowledges the central role played by the Joint Coordination and \nMonitoring Board in this regard;  \n \n67. Emphasizes the importance of the strategic review of the mandated tasks, \npriorities and related resources of the United Nations Assistance Mission in \nAfghanistan, and calls for the continued implementation of the recommendations of \nthe Secretary-General,16 with a view to supporting efforts for peace and ensuring \ngreater coordination, coherence and efficiency among relevant United Nations \nagencies, funds and programmes, based on the \u201cOne United Nations\u201d approach, in \nline with the reform agenda and the national priority programmes of the Government \nof Afghanistan;  \n \n68. Requests the Secretary-General to continue to report every three months \non developments in Afghanistan, as well as on the progress made in the \nimplementation of the present resolution;  \n \n69. Decides to include in the provisional agenda of its seventy-fourth session \nthe item entitled \u201cThe situation in Afghanistan\u201d. \n \n46th plenary meeting  \n6 December 2018 \n \n__________________ \n16 See A/72/312-S/2017/696. \n",
  "paragraphs": {
    "1": "Pledges its continued support to the Government and people of Afghanistan as they rebuild a stable, secure and economically self-sufficient State, free of terrorism and narcotics, and strengthen the foundations of a constitutional democracy as a responsible member of the international community;",
    "2": "Encourages all partners to support constructively the Government of Afghanistan\u2019s reform agenda, including as envisaged in the Afghanistan National Peace and Development Framework and the Geneva Mutual Accountability Framework, so as to secure a prosperous and democratic Afghanistan, focusing on strengthening the constitutional checks and balances that guarantee citizens\u2019 rights and obligations and implementing structural reform to enable an accountable and effective Government to deliver concrete progress to its people;",
    "3": "Supports the continuing and growing ownership of reconstruction and development efforts by the Government of Afghanistan, emphasizes the crucial need to achieve ownership and accountability in all fields of governance and to improve institutional capabilities, including at the subnational level, in order to use aid more effectively, and underscores in this regard the importance of the commitments of the international community and of the new set of indicators for the Self-Reliance through Mutual Accountability Framework, as reiterated in the communiqu\u00e9 of the Brussels Conference on Afghanistan in October 2016;",
    "4": "Welcomes the adoption of the Geneva Mutual Accountability Framework, as reflected in the communiqu\u00e9 adopted at the international Geneva Conference on Afghanistan, which underscores the importance of the effective implementation of mutual commitments of the Government of Afghanistan and the international community on a reciprocal basis;",
    "5": "Emphasizes that threats to stability and development in Afghanistan and the region require closer and more coordinated cooperation, as well as greater coherence and complementarity of approach between countries of the region and the international community, for the long-term peace, security, prosperity and sustainable development of the country, and underscores in this regard the standing of Afghanistan as a platform for such international cooperation; Security",
    "6": "Recognizes the commitment of the international community to supporting the training, equipping, financing and development of the capacity of the Afghan National Defence and Security Forces throughout the Transformation Decade, as agreed in the Chicago Summit Declaration on Afghanistan in 2012, the Wales Summit Declaration on Afghanistan in 2014, the Warsaw Summit Declaration on Afghanistan __________________ 1 A/71/682-S/2016/1049, A/71/826-S/2017/189, A/71/932-S/2017/508, A/72/392-S/2017/783 and A/73/374/Rev.1-S/2018/824/Rev.1. A/RES/73/88 The situation in Afghanistan 18-21201 4/15 in 2016 and the Brussels Summit Declaration on Afghanistan in 2018, including through the Resolute Support Mission, as welcomed by the Security Council in its resolution 2189 (2014);",
    "7": "Welcomes the pledges and commitments made at the Warsaw Summit of the North Atlantic Treaty Organization held on 8 and 9 July 2016, as reinforced at the Brussels Summit held on 11 and 12 July 2018, to continuing national contributions to the financial sustainment of the Afghan National Defence and Security Forces until the end of 2024, to sustaining the Resolute Support Mission and to continuing to deliver training, advice and assistance to the Afghan security institutions, including the police, the air force and special operations forces;",
    "8": "Takes note of the announcement in 2017 by the United States of America of its strategy for Afghanistan and the adoption by the European Union of its strategy on Afghanistan as important components of the continued support of the international community for the security, development and stability of Afghanistan;",
    "9": "Reiterates once again its serious concern about the security situation in Afghanistan, stresses the need to continue to address the threat to the security and stability of Afghanistan caused by the region-based violent extremist and other illegal armed groups and criminals, including those involved in the narcotics trade, expresses concern over the serious threat posed by the presence of foreign terrorist fighters, reiterates in this regard its call for the full and serious implementation of measures and the application of procedures introduced in relevant Security Council resolutions, in particular resolutions 1267 (1999), 1988 (2011), 1989 (2011), 2082 (2012), 2083 (2012), 2160 (2014), 2161 (2014), 2253 (2015), 2255 (2015) and 2368 (2017), and calls upon all States to strengthen their international and regional cooperation to enhance information-sharing, border control, law enforcement and criminal justice to better counter the threat posed by foreign terrorist fighters and returning foreign terrorist fighters in Afghanistan and the region;",
    "10": "Expresses its serious concern regarding the presence of terrorist organizations, in particular Islamic State in Iraq and the Levant (ISIL) (Da\u2019esh) affiliates and its brutal acts, including killings of Afghan nationals, and deplorable attempts to undermine relations between communities, commends the progress of the Government of Afghanistan in combating these threats in the country and affirms its support for continued efforts in this regard, and calls for enhanced regional cooperation in the fight against these groups;",
    "11": "Condemns in the strongest terms all unlawful acts of violence, intimidation and attacks, including improvised explosive device attacks, suicide attacks, assassinations, including of public figures, abductions, indiscriminate attacks against civilians, killings, attacks against individuals, media groups and organs of society engaged in the promotion and protection of universally recognized human rights, attacks against humanitarian and medical personnel and civilian objects, including schools and hospitals, and the targeting of Afghan and international forces, which have a deleterious effect on stabilization and development efforts in Afghanistan, and also condemns the use, by the Taliban, including the Haqqani Network, Al-Qaida and other terrorist and violent extremist groups and illegal armed groups, of civilians as human shields, as well as Taliban attacks and acts of international terrorists;",
    "12": "Stresses the need for the Government of Afghanistan and the international community to continue to work closely together and to improve coordination in countering such acts, which are threatening peace and stability in Afghanistan and the democratic process, the achievements and the continued implementation of the Afghanistan development gains and process, as well as humanitarian aid measures, recognizes the achievements of the Afghan National Defence and Security Forces in this regard, and calls upon all Member States, in particular neighbouring countries, The situation in Afghanistan A/RES/73/88 5/15 18-21201 to deny those groups any form of sanctuary, freedom of operations, movement, recruitment and financial, material or political support that endangers the State system and regional peace and security;",
    "13": "Condemns in the strongest terms the heinous and cowardly terrorist attack that took place in Kabul on 20 November 2018 targeting a gathering of religious scholars, which resulted in at least 55 people being killed and more than 80 injured, as well as other terrorist attacks throughout Afghanistan which took the lives of Afghan parliamentary candidates, government officials, senior army, police and security officials and civilians, including women and children, diplomatic personnel and religious minorities;",
    "14": "Welcomes the assumption of full security responsibility by the Afghan National Defence and Security Forces, commends the resilience and courage displayed in this regard, calls upon the international community to provide the support necessary to increase security, including public order, law enforcement, the security of Afghanistan\u2019s borders and the preservation of the constitutional rights of Afghan citizens, as well as to provide continued support by training, equipping and contributing to the financing of the Afghan National Defence and Security Forces to take on the task of securing their country and fighting against terrorism, and underscores the importance of the Chicago, Wales, Warsaw and Brussels Summit Declarations on Afghanistan and other relevant agreements with regional and international partners;",
    "15": "Also welcomes, in this regard, the presence of the Resolute Support Mission, expresses its appreciation to Member States for having contributed personnel, equipment and other resources to the Mission and for the support provided to the Afghan National Defence and Security Forces by all international partners, in particular by the North Atlantic Treaty Organization through its previous combat and current non-combat missions in Afghanistan, as well as other bilateral training programmes, and encourages further coordination, where appropriate;",
    "16": "Further welcomes the commitment of the Government of Afghanistan, with a view to ensuring stability and providing conditions for the effective rule of law and respect for human rights for all, including women\u2019s full and equal enjoyment of these rights, to continuing its security sector reform by making the security provision, management and oversight of the Afghan National Defence and Security Forces more effective and accountable, welcomes in this regard the progress being made in the Afghan national security institutions, as presented at the Geneva Conference, recognizes the importance of the further implementation of the Afghan National Police Strategy and the 10-year vision presented by the Ministry of the Interior, and expresses its appreciation for the support that Member States have provided to the Afghan National Defence and Security Forces;",
    "17": "Recalls that regional security cooperation plays a key role in maintaining stability in Afghanistan and the region, welcomes the progress achieved by Afghanistan and regional partners in this regard, calls for further efforts by Afghanistan and regional partners and organizations, including the Shanghai Cooperation Organization, to strengthen their partnership and cooperation, takes note of the eighteenth meeting of the Council of Heads of State of the Shanghai Cooperation Organization held in Qingdao, China, on 9 and 10 June 2018, as it related to Afghanistan, and in this regard also takes note of the meeting of the Shanghai Cooperation Organization-Afghanistan Contact Group held in Beijing on 28 May 2018;",
    "18": "Remains deeply concerned about the persistent problem of anti-personnel landmines and explosive remnants of war, welcomes the achievements to date in the implementation of the Mine Action Programme for Afghanistan aimed at declaring A/RES/73/88 The situation in Afghanistan 18-21201 6/15 Afghanistan mine-free by 2023, underscores the importance of sustained international assistance, encourages the Government of Afghanistan, with the support of the United Nations and all relevant actors, to continue its efforts to meet its responsibilities under the Convention on the Prohibition of the Use, Stockpiling, Production and Transfer of Anti-Personnel Mines and on Their Destruction,2 expresses concern at the use of improvised explosive devices by the Taliban against civilians and the Afghan security forces, and notes the need to enhance coordination and information-sharing between both Member States and the private sector to prevent the flow of improvised explosive device components to the Taliban; Peace and reconciliation",
    "19": "Recognizes that an Afghan-led and Afghan-owned inclusive peace process backed by regional actors, in particular Pakistan, supported by the international community, is essential for achieving long-term peace and stability in Afghanistan and reiterates its firm commitment to supporting the Government of Afghanistan in its efforts in this regard, and that, to be successful, a political solution must ensure the renunciation of violence and the breaking of all ties to international terrorism, protect the human rights of all, including women, children and persons belonging to minorities, in accordance with international law and as enshrined in the Constitution of Afghanistan, and build a peaceful Afghanistan, with full respect for the implementation of the measures and application of the procedures introduced by the Security Council in its resolutions 1267 (1999), 1988 (2011), 2082 (2012), 2160 (2014) and 2255 (2015), as well as other relevant resolutions of the Council, calls upon all relevant States, especially neighbouring countries, and international organizations to remain engaged in the Afghan-led and Afghan-owned peace process, and recognizes the impact that terrorist attacks have on the Afghan people, while underlining that such acts should not hinder efforts to achieve a peace settlement;",
    "20": "Welcomes the offer made by the Government of Afghanistan to begin direct negotiations within the framework of a comprehensive peace plan and the offer made to the Taliban of talks without preconditions at the second meeting of the Kabul Process for Peace and Security Cooperation, on 28 February 2018, and calls upon the Taliban to accept this offer without any preconditions and without the threat of violence, with the aim of agreeing on an ultimate political settlement that leads to sustainable peace for the people of Afghanistan;",
    "21": "Also welcomes the temporary and partial ceasefire announced separately by the Government of Afghanistan and the Taliban, for the end of Ramadan and the Eid al-Fitr holiday, expresses its strong disappointment that the Taliban has not agreed to the Government\u2019s offer to extend or repeat them, and urges the Taliban to respond to the call for peace from the Afghan people;",
    "22": "Encourages Afghanistan and Pakistan to enhance their relationship, which could lead to cooperation to combat terrorism effectively and move forward the Afghan-led and Afghan-owned peace process, takes note, in that regard, of the conclusion of the Afghanistan-Pakistan Action Plan for Peace and Solidarity as an important mechanism of cooperation, and underscores the importance of the effective implementation of the commitments made;",
    "23": "Recalls that women play a vital role in the peace process, as recognized by the Security Council in its resolution 1325 (2000) of 31 October 2000 and in related resolutions, including resolution 2242 (2015) of 13 October 2015, welcomes steps taken by the Government of Afghanistan in implementing its national action plan on women, peace and security, recognizes in this regard the increasing role of __________________ 2 United Nations, Treaty Series, vol. 2056, No. 35597. The situation in Afghanistan A/RES/73/88 7/15 18-21201 women in the peace process, as manifested in their representation in the High Peace Council and its provincial committees and secretariats, as well as their contribution to the development of the Afghanistan peace and reconciliation strategy, as reflected in the report of the Secretary-General,3 supports further efforts in this regard, and encourages the Government of Afghanistan to further support the active participation of women in the peace process;",
    "24": "Recognizes that there is no purely military solution to ensure the stability of Afghanistan, welcomes the Afghan-led and Afghan-owned peace process, as articulated at the second meeting of the Kabul Process for Peace and Security Cooperation as a main forum and vehicle under the leadership of the Government of Afghanistan to lead peace efforts, notes the work of the Quadrilateral Coordination Group, the International Contact Group on Afghanistan, the Tashkent dialogue consultations and the Moscow format consultations to reinforce Afghan-led and Afghan-owned efforts towards the holding of early direct peace talks between the Government of Afghanistan and authorized representatives of Taliban groups, and calls upon all regional and international partners of Afghanistan to continue their efforts, recognizing that success can be achieved only through the unified and close coordination of efforts under the leadership and ownership of the Government of Afghanistan; Democracy",
    "25": "Emphasizes the importance of all parties in Afghanistan working together to achieve a unified, peaceful, democratic and prosperous future for all the people of Afghanistan;",
    "26": "Recalls the commitment of the Government of Afghanistan to improving Afghanistan\u2019s electoral process, welcomes the parliamentary elections held in October 2018 and commends the participation and courage of millions of Afghans, including women as voters and candidates, condemns in the strongest terms all terrorist activity and violent attacks aimed at disrupting the elections, reiterates the important role of the independent Afghan electoral institutions in upholding the integrity of the electoral process, calls upon all stakeholders to continue to engage with the electoral institutions with patience and respect and to channel complaints through established constitutional mechanisms in line with Afghanistan\u2019s electoral laws and Constitution, and also calls upon Afghanistan\u2019s Government and institutions, including the Independent Election Commission and the Electoral Complaints Commission, to ensure that the forthcoming presidential elections and other elections foreseen in 2019 are credible, inclusive, fair and free, safe and transparent by continuing to implement the necessary electoral reforms and further technical and operational improvements to strengthen trust and confidence, including the updating of the voter registration databases;",
    "27": "Welcomes the increasingly wide and comprehensive dialogue on the political transition towards strengthening the unity of the Afghan people, and underscores its importance for consolidating democracy and Afghan political stability;",
    "28": "Calls upon the Government of Afghanistan to continue to reform effectively the public administration sector in order to implement the rule of law and to ensure good governance and accountability, and welcomes the commitments, efforts and progress made by the Government in this regard; __________________ 3 A/72/392-S/2017/783. A/RES/73/88 The situation in Afghanistan 18-21201 8/15 Rule of law, human rights and good governance",
    "29": "Emphasizes that the rule of law, human rights and good governance form the foundation for the achievement of a stable and prosperous Afghanistan;",
    "30": "Recalls the constitutional guarantee of respect for human rights and fundamental freedoms for all Afghans, without discrimination of any kind, stresses the need to fully implement the human rights provisions of the Afghan Constitution, in accordance with obligations under applicable international law, in particular those regarding the full enjoyment by women and children of their human rights, and acknowledges efforts of the Government of Afghanistan in this regard;",
    "31": "Recognizes the membership of Afghanistan in the Human Rights Council, and welcomes the commitment and responsibility assumed in upholding and promoting human rights at the national, regional and international levels, within the framework of relevant international human rights instruments to which it is a party;",
    "32": "Reiterates its concern at the destructive consequences of violent and terrorist activities, including against persons belonging to ethnic and religious minorities, by the Taliban, including the Haqqani Network, as well as Al-Qaida, ISIL (Da\u2019esh) affiliates and other terrorist and violent extremist groups and other illegal armed groups and criminals, for the enjoyment of human rights and for the capacity of the Government to ensure human rights and fundamental freedoms for all Afghans, and stresses the need to further promote tolerance and to ensure respect for the right to freedom of expression and the right to freedom of thought, conscience, religion or belief as enshrined in the Afghan Constitution and the international covenants that Afghanistan adheres to;",
    "33": "Emphasizes the necessity of investigating allegations of current and past violations, and stresses the importance of facilitating the provision of efficient and effective remedies to the victims and of bringing the perpetrators to justice in accordance with national and international law;",
    "34": "Calls for the full implementation of the mass media law, while noting with concern and condemning the continuing intimidation and violence targeting Afghan journalists, such as cases of abduction and even the killing of journalists by terrorist and violent extremist and criminal groups, urges that the harassment of and attacks on journalists be investigated by Afghan authorities and that those responsible be brought to justice, and welcomes in this regard the issuance of the presidential decree of 3 January 2017 on better implementation of the laws related to mass media to reinforce freedom of expression and ensure access to information and the creation of a journalists\u2019 support fund aimed at assisting the bereaved families of journalists and reporters;",
    "35": "Reiterates its unwavering commitment and that of the Government of Afghanistan to achieving the full and equal participation of women in all spheres of Afghan life, commends the achievements and efforts of the Government aimed at countering discrimination and protecting and promoting the equal rights of women and men consistent with its international obligations under the Convention on the Elimination of All Forms of Discrimination against Women 4 and pursuant to the Afghan Constitution, the National Action Plan for the Women of Afghanistan, the Afghan national action plan on women, peace and security, the law on the elimination of violence against women and the national strategy to prevent violence against women, and welcomes recent measures taken towards the protection of women\u2019s and girls\u2019 full and equal enjoyment of human rights, including the establishment of a __________________ 4 United Nations, Treaty Series, vol. 1249, No. 20378. The situation in Afghanistan A/RES/73/88 9/15 18-21201 senior position in the Office of the Attorney General on the elimination of violence against women and the appointment of 44 female attorneys in 25 provinces;",
    "36": "Emphasizes the need to ensure respect for the human rights and fundamental freedoms of children in Afghanistan, recalls the need for the full implementation of the Convention on the Rights of the Child, 5 its Optional Protocol on the sale of children, child prostitution and child pornography 6 and its Optional Protocol on the involvement of children in armed conflict 7 by all States parties, as well as of Security Council resolution 1612 (2005) of 26 July 2005, and all other subsequent resolutions on children and armed conflict, and Council resolutions 1998 (2011) of 12 July 2011 and 2286 (2016) of 3 May 2016 on attacks against schools and hospitals, in particular by terrorist and violent extremist and criminal groups, commends the Government of Afghanistan for introducing legislation banning the recruitment and use of children and for establishing local child protection units, and welcomes the progress made on the implementation of the action plan for the prevention of underage recruitment, signed in January 2011, and the annex thereto on children associated with the Afghan National Defence and Security Forces, and of the road map towards compliance, as well as the signing in 2017 of a child protection policy to protect children from the effects of armed conflict;",
    "37": "Recalls Security Council resolutions 2250 (2015) of 9 December 2015 on the maintenance of international peace and security and 2419 (2018) of 6 June 2018 on youth, peace and security, in which the Council reaffirmed the important role youth can play in the prevention and resolution of conflicts, welcomes the appointment of Afghanistan\u2019s first youth representative to the United Nations, recognizes in this regard the Government of Afghanistan\u2019s efforts in enhancing the representation of youth for the prevention and resolution of conflict, and encourages continued efforts in this regard;",
    "38": "Reiterates its appreciation for the anti-corruption commitment made by the Government of Afghanistan, welcomes in this respect the establishment of the National High Council for Rule of Law and Anti-Corruption, the Anti-Corruption Justice Centre and the National Procurement Commission, the adoption on 28 September 2017 of the Afghanistan National Strategy for Combating Corruption, the enactment of the revised penal code and the anti-corruption law of 2018 and the finalization of anti-corruption action plans for various ministries, as measures taken by the Government to implement its comprehensive reform agenda, strengthen governance and achieve a more effective, accountable and transparent administration at the national, provincial and local levels of government, takes note in this regard of the progress made thus far against the benchmarks of its comprehensive reform agenda presented and endorsed at the third Senior Officials Meeting and at the Geneva Conference on Afghanistan, and urges continued decisive action and accelerated implementation by the Government to establish a more effective, accountable and transparent administration at the national, provincial and local levels of government;",
    "39": "Calls upon the international community to support the efforts of Afghanistan to meet governance objectives in this regard; Counter-narcotics",
    "40": "Welcomes the efforts of the Government of Afghanistan in fighting drug production in Afghanistan, takes note of the report of the United Nations Office on Drugs and Crime entitled Afghanistan Opium Survey 2018: Cultivation and __________________ 5 Ibid., vol. 1577, No. 27531. 6 Ibid., vol. 2171, No. 27531. 7 Ibid., vol. 2173, No. 27531. A/RES/73/88 The situation in Afghanistan 18-21201 10/15 Production, released on 19 November 2018, which, inter alia, notes a significant decrease in the production and cultivation of drugs, due in part to the drought affecting Afghanistan, notes that areas under cultivation remain at high levels, stresses the need to further strengthen joint, coordinated and resolute efforts by the Government, supported by the United Nations Office on Drugs and Crime and international and regional actors, within their designated responsibilities, and encourages international and regional cooperation with Afghanistan in its sustained efforts to address drug production and trafficking;",
    "41": "Stresses the importance of a comprehensive and balanced approach in addressing the drug problem of Afghanistan, which, to be effective, must be integrated into the wider context of efforts carried out in the areas of security, governance, the rule of law, human rights and economic and social development, in particular in rural areas, including the development of improved alternative livelihood programmes;",
    "42": "Notes with great concern the strong nexus between the drug trade and terrorist activities by the Taliban, including the Haqqani Network, as well as Al-Qaida, ISIL (Da\u2019esh) affiliates and other terrorist groups, violent and extremist groups and criminal groups, which pose a serious threat to security, the rule of law and development in Afghanistan and the region, and stresses the importance of the full implementation of all relevant Security Council resolutions in this regard, including resolutions 2255 (2015) and 2368 (2017), and in this regard emphasizes the need for the Security Council Committee established pursuant to resolution 1988 (2011) and the Committee pursuant to resolutions 1267 (1999), 1989 (2011) and 2253 (2015) to continue to pay attention to the linkages between the proceeds of organized crime, inter alia, the illicit production of and trafficking in drugs and their chemical precursors and the financing, respectively, of the Taliban, including the Haqqani Network, and of ISIL (Da\u2019esh), Al-Qaida and associated individuals, groups, undertakings and entities;",
    "43": "Calls upon the international community to continue to assist the Government of Afghanistan in its National Drug Control Strategy and National Drug Action Plan, calls for such efforts to eliminate the cultivation and production of, trafficking in and consumption of illicit drugs, increase support for Afghan law enforcement and criminal justice agencies, agricultural and rural development for the creation of improved alternative, licit livelihoods for farmers and demand reduction support, increase public awareness of counter-narcotics issues and build the capacity of drug control institutions and care and treatment centres for drug users, reiterates its call upon the international community to channel counter-narcotics funding through the Government of Afghanistan, the United Nations Office on Drugs and Crime and other relevant organizations and mechanisms to the extent possible, notes that the problem of production, cultivation, trafficking in and consumption of narcotic drugs, as well as the problem of precursors, should be addressed on the basis of the principle of common and shared responsibility of the Government and the international community, and welcomes and supports relevant international and regional projects and activities, including those carried out by Afghanistan, Iran (Islamic Republic of) and Pakistan within the framework of the triangular initiative to counter narcotics, as well as the Paris Pact initiative; 8 __________________ 8 See S/2003/641, annex. The situation in Afghanistan A/RES/73/88 11/15 18-21201 Social and economic development",
    "44": "Notes Afghanistan\u2019s position as the top improver in the World Bank Doing Business 2019 report and the work of the Government of Afghanistan in implementing reforms to improve the business regulatory framework;",
    "45": "Welcomes the Afghanistan National Peace and Development Framework setting out the strategic policy priorities of Afghanistan towards achieving self-reliance and the presentation of five national priority programmes, on a citizens\u2019 charter, women\u2019s economic empowerment, urban development, comprehensive agriculture and national infrastructure, to improve the conditions for advancing sustainable development and stability;",
    "46": "Renews its commitment to long-term support for the economic development of Afghanistan on the basis of mutual accountability as stated in the Geneva Mutual Accountability Framework, urgently appeals to all States, the United Nations system and international and non-governmental organizations, including the international and regional financial institutions, to continue to provide, in close coordination with the Government of Afghanistan and in accordance with the Afghanistan National Peace and Development Framework and the national priority programmes contained therein, all possible and necessary humanitarian, recovery, reconstruction, development, financial, educational, technical and material assistance for Afghanistan, and underscores the crucial importance of continued and sequenced implementation of the reform agenda, national priority programmes and the development and governance goals as agreed in the Geneva Mutual Accountability Framework;",
    "47": "Recognizes the substantial development and notable progress achieved by Afghanistan with the steadfast support of the international community in the past years, expresses its support for the reaffirmation and consolidation of the partnership between Afghanistan and the international community midway through the Transformation Decade (2015\u20132024), during which Afghanistan will consolidate its sovereignty through strengthening a fully functioning, sustainable State in the service of its people, urges the Government of Afghanistan to involve all elements of Afghan society, in particular women, in the development and implementation of relief, rehabilitation, recovery and reconstruction programmes, welcomes the presentation by the Government of Afghanistan of the National Priority Programme on Women\u2019s Economic Empowerment and encourages its continued implementation, and welcomes the launch of the women\u2019s economic empowerment plan in March 2017 and the creation of a coordination unit for the National Priority Programme within the Ministry of Labour, Social Affairs, Martyrs and Disabled as important measures for the implementation of the National Priority Programme;",
    "48": "Welcomes the progress made in implementing the Self-Reliance through Mutual Accountability Framework and the commitment to continuing the reforms agreed in the Geneva Mutual Accountability Framework and the monitoring mechanism included therein, in which the Government of Afghanistan reaffirmed its commitment to strengthening governance, grounded in human rights, the rule of law and adherence to the Afghan Constitution and held it as integral to sustained growth and economic development, and in which the international community committed to enhancing the efficiency of development aid by aligning assistance with the Afghan national priority programmes and by channelling assistance through the national budget of the Government, as outlined in the Tokyo Declaration: Partnership for Self- Reliance in Afghanistan \u2013 From Transition to Transformation9 and reaffirmed in the __________________ 9 A/66/867-S/2012/532, annex I. A/RES/73/88 The situation in Afghanistan 18-21201 12/15 communiqu\u00e9 of the Brussels Conference on Afghanistan and the new Geneva Mutual Accountability Framework indicators;",
    "49": "Commends the Government of Afghanistan for aligning its new development strategy with the 2030 Agenda for Sustainable Development, 10 and urges the international community to assist the Government in implementing its unfinished Millennium Development Goals and its Sustainable Development Goals;",
    "50": "Also commends the Government of Afghanistan for improving budgetary transparency and its efforts to reach fiscal sustainability, notes the challenges ahead, and urges that continued efforts be made to meet revenue targets;",
    "51": "Recognizes the necessity for further improvement in the living conditions of the Afghan people, and emphasizes the need to strengthen and support the development of the capacity of the Government of Afghanistan to deliver basic social services at the national, provincial and local levels, in particular education and public health services;",
    "52": "Reiterates the necessity of providing Afghan children, especially Afghan girls, with educational and health facilities in all parts of the country, and welcomes the progress achieved in the sector of public education;",
    "53": "Notes with concern the severe drought affecting Afghanistan, with 3.3 million Afghans facing emergency-level food insecurity and more than 220,000 Afghans displaced from their homes, and urges the international community to provide the necessary support and to work with the Government of Afghanistan and humanitarian organizations to respond effectively to the drought needs identified in the revised Afghanistan Humanitarian Response Plan without delay, prior to the onset of winter;",
    "54": "Underscores the urgent need to address the impacts of climate change in Afghanistan, and emphasizes the need for local, subnational, national, regional and international action to enhance efforts to build resilience, especially for the most vulnerable, by investing in resilience, including disaster risk reduction, strengthening adaptation strategies and enhancing joint risk assessments and risk management strategies, including early warning systems in the country to monitor environmental changes, to cut the impact and cost of natural disasters; Refugees",
    "55": "Expresses its appreciation to those Governments that continue to host Afghan refugees, in particular Pakistan and the Islamic Republic of Iran, acknowledging the huge burden they have so far shouldered in this regard, asks for continued generous support by the international community, and asks relevant international organizations, in particular the Office of the United Nations High Commissioner for Refugees and the International Organization for Migration, to continue to work closely with Afghanistan and the countries hosting Afghan refugees with a view to facilitating their voluntary, safe, dignified and sustainable return, rehabilitation and reintegration;",
    "56": "Welcomes the outcome of the high-level segment on the Afghan refugee problem of the sixty-sixth session of the Executive Committee of the Programme of the United Nations High Commissioner for Refugees,11 emphasizes the importance of the Solutions Strategy for Afghan Refugees to Support Voluntary Repatriation, Sustainable Reintegration and Assistance to Host Countries, and looks forward to the __________________ 10 Resolution 70/1. 11 See Official Records of the General Assembly, Seventieth Session, Supplement No. 12A (A/70/12/Add.1), annex II. The situation in Afghanistan A/RES/73/88 13/15 18-21201 further implementation of the joint communiqu\u00e9 of the International Conference on the Solutions Strategy for Afghan Refugees to Support Voluntary Repatriation, Sustainable Reintegration and Assistance to Host Countries aimed at increased sustainability of returns and continued support for host countries, through the sustained support and the directed efforts of the international community;",
    "57": "Expresses its concern over the increase in the number of internally displaced persons and refugees from Afghanistan, stresses that stability and development in Afghanistan can be achieved if its citizens can see a future for themselves within their country, reiterates to host countries and the international community the obligations under international refugee law with respect to the protection of refugees, the principle of voluntary return and the right to seek asylum and to ensure full, safe and unhindered access for humanitarian relief agencies in order to provide protection and assistance to internally displaced persons and refugees, and calls upon countries to continue to accept an appropriate number of Afghan refugees for resettlement as a manifestation of their shared responsibility and solidarity;",
    "58": "Takes note of the cooperation framework signed between the Government of Afghanistan and the European Union, entitled \u201cJoint way forward on migration issues\u201d, and in this context underscores the importance of close and effective cooperation to address the problem of irregular migration in a comprehensive manner, with due focus on and consideration of addressing the root causes of migration, including through job creation and the establishment of returnees\u2019 livelihoods in Afghanistan, and in accordance with international commitments and obligations, including the human rights and legal rights of all migrants and the rights of persons in need of international protection in line with the provisions of the 1951 Convention relating to the Status of Refugees12 and the 1967 Protocol thereto,13 as applicable;",
    "59": "Welcomes the commitment of the Government of Afghanistan to making the repatriation and reintegration of Afghan refugees one of its highest national priorities, including their voluntary, safe and dignified return and their sustainable reintegration into national development planning and prioritization processes, takes note in this regard of the accession of Afghanistan to the Protocol against the smuggling of Migrants by Land, Sea and Air, supplementing the United Nations Convention against Transnational Organized Crime, 14 on 2 February 2017, and encourages and supports all efforts of the Government towards the implementation of this commitment;",
    "60": "Reaffirms its firm support for the implementation of the Solutions Strategy for Afghan Refugees to Support Voluntary Repatriation, Sustainable Reintegration and Assistance to Host Countries endorsed by the international community in 2012, and acknowledges the Enhanced Voluntary Return and Reintegration Package for Afghan Refugees as an innovative way to enhance sustainable return and reintegration;",
    "61": "Welcomes the continued return of Afghan refugees and internally displaced persons, in a voluntary, safe, dignified and sustainable manner, while noting with concern the security challenges of Afghanistan; Regional cooperation",
    "62": "Stresses the crucial importance of advancing constructive and sustainable regional cooperation as an effective means of promoting and complementing peace, __________________ 12 United Nations, Treaty Series, vol. 189, No. 2545. 13 Ibid., vol. 606, No. 8791. 14 Ibid., vol. 2241, No. 39574. A/RES/73/88 The situation in Afghanistan 18-21201 14/15 security, stability and economic and social development in Afghanistan, recognizes in this regard the importance of the contribution of neighbouring and regional partners and regional organizations, recalls the importance of the Kabul Declaration on Good- neighbourly Relations of 22 December 2002 15 and welcomes in this regard the continued commitment of the international community to supporting the stability and development of Afghanistan, encourages further improved relations and enhanced engagement between Afghanistan and its neighbours, calls for further efforts in this regard, including in the framework of the Heart of Asia-Istanbul Process on Regional Security and Cooperation for a Secure and Stable Afghanistan and by regional organizations and long-term strategic partnerships and other agreements aimed at achieving a peaceful, stable and prosperous Afghanistan, welcomes international and regional initiatives in this regard, such as those of the Collective Security Treaty Organization, the South Asian Association for Regional Cooperation, the Economic Cooperation Organization, the Regional Economic Cooperation Conference on Afghanistan process, the European Union, the Organization for Security and Cooperation in Europe, the Quadrilateral Cooperation and Coordination Mechanism in Counter-Terrorism comprising the armed forces of Afghanistan, China, Pakistan and Tajikistan, the China-Afghanistan-Pakistan dialogues and the Conference on Interaction and Confidence-building Measures in Asia;",
    "63": "Welcomes the important initiatives for regional connectivity, notably in the frameworks of the Regional Economic Cooperation Conference on Afghanistan and the Heart of Asia-Istanbul Process confidence-building measures to facilitate increased trade throughout the region, commends the holding of the seventh Regional Economic Cooperation Conference on Afghanistan in Ashgabat on 14 and 15 November 2017, and looks forward to the forthcoming Heart of Asia Ministerial Conference, to be held in Turkey in 2019;",
    "64": "Emphasizes, in this regard, the importance of strengthening local and regional networks of transportation that will facilitate connectivity for economic development, stability and self-sustainability, particularly the completion and maintenance of local railroad and land routes, the development of regional projects to foster further connectivity and the enhancement of international civil aviation capabilities;",
    "65": "Welcomes and urges further efforts to strengthen the process of regional economic cooperation, including measures to facilitate regional connectivity, trade and transit, acknowledges the progress made on such projects and initiatives as the Turkmenistan-Afghanistan-Pakistan-India (TAPI) gas pipeline project, the Central Asia South Asia Electricity Transmission and Trade Project (CASA-1000), the Turkmenistan-Afghanistan-Pakistan (TAP) 500 and Turkmenistan-Uzbekistan- Tajikistan-Afghanistan-Pakistan (TUTAP) electricity projects, the Pakistan- Afghanistan-Tajikistan Regional Integration Programme (PATRIP), the Chabahar agreement between Afghanistan, India and the Islamic Republic of Iran and the transport of development assistance from India to Afghanistan through the Chabahar port, the Lapis Lazuli Transit, Trade and Transport Route agreement and the Turkmenistan-Aqina railway segment and on bilateral transit trade agreements, expanded consular visa cooperation and the facilitation of business travel, to expand trade, increase foreign investments and develop infrastructure, including infrastructural connectivity, energy supply, transport and integrated border management, with a view to promoting sustainable economic growth and the creation of jobs in Afghanistan and the region, notes the historical role of Afghanistan as a land bridge in Asia, recalls that such regional economic cooperation plays an important role in achieving stability and development in Afghanistan, in this regard __________________ 15 S/2002/1416, annex. The situation in Afghanistan A/RES/73/88 15/15 18-21201 urges all relevant stakeholders to create a feasible and secure environment for the full implementation of these development initiatives and trade agreements, and welcomes the progress made by these initiatives and projects in enhancing regional connectivity, trade and transit, including the creation of direct air freight corridors between Afghanistan and China, India, Italy, Kazakhstan, the Russian Federation, Saudi Arabia, Turkey and the United Arab Emirates; United Nations Assistance Mission in Afghanistan and Joint Coordination and Monitoring Board",
    "66": "Expresses its appreciation for the work of the United Nations Assistance Mission in Afghanistan, as mandated by the Security Council in its resolution 2405 (2018), stresses the continued importance of the central and impartial coordinating role of the United Nations in promoting a more coherent international engagement, and acknowledges the central role played by the Joint Coordination and Monitoring Board in this regard;",
    "67": "Emphasizes the importance of the strategic review of the mandated tasks, priorities and related resources of the United Nations Assistance Mission in Afghanistan, and calls for the continued implementation of the recommendations of the Secretary-General,16 with a view to supporting efforts for peace and ensuring greater coordination, coherence and efficiency among relevant United Nations agencies, funds and programmes, based on the \u201cOne United Nations\u201d approach, in line with the reform agenda and the national priority programmes of the Government of Afghanistan;",
    "68": "Requests the Secretary-General to continue to report every three months on developments in Afghanistan, as well as on the progress made in the implementation of the present resolution;",
    "69": "Decides to include in the provisional agenda of its seventy-fourth session the item entitled \u201cThe situation in Afghanistan\u201d. 46th plenary meeting 6 December 2018 __________________ 16 See A/72/312-S/2017/696."
  },
  "agenda_items": [
    "Item 40"
  ],
  "symbol_references": [
    "A/73/L.44"
  ]
}