{
  "symbol": "A/RES/79/277",
  "filename": "A_RES_79_277.pdf",
  "title": "79/277. Modalities for the overall review by the General Assembly of the implementation of the outcomes of the World Summit on the Information Society",
  "text": "United Nations \nA/RES/79/277\n \nGeneral Assembly \nDistr.: General \n27 March 2025 \n25-04977 (E)  \n*2504977* \n \n \nSeventy-ninth session \nAgenda item 15 \nInformation and communications technologies for \nsustainable development \n \n \n \n \n Resolution adopted by the General Assembly \non 25 March 2025 \n \n \n[without reference to a Main Committee (A/79/L.62)] \n \n \n 79/277. Modalities for the overall review by the General Assembly of the \nimplementation of the outcomes of the World Summit on the \nInformation Society \n \n \n \nThe General Assembly, \n \nRecalling the Declaration of Principles and the Plan of Action adopted by the \nWorld Summit on the Information Society at its first phase, held in Geneva from \n10 to 12 December 2003, 1 and endorsed by the General Assembly, 2 and the Tunis \nCommitment and the Tunis Agenda for the Information Society adopted by the \nSummit at its second phase, held in Tunis from 16 to 18 November 2005, 3 and \nendorsed by the Assembly,4 \n \nRecalling also the outcome document of the high-level meeting of the General \nAssembly on the overall review of the implementation of the outcomes of the World \nSummit on the Information Society, held in New York on 15 and 16 December 2015,5 \nin which the General Assembly was requested to undertake the overall review of the \nimplementation of the outcomes of the World Summit on the Information Society in \n2025, and in this regard reaffirming the centrality of the General Assembly to this \nprocess, \n \nRecognizing that the overall review will be undertaken on the basis of and with \nfull respect for the Tunis Agenda,  \n_______________ \n \n1 See A/C.2/59/3, annex.  \n \n2 See resolution 59/220.  \n \n3 See A/60/687.  \n \n4 See resolution 60/252. \n \n5 Resolution 70/125.  \n\nA/RES/79/277 \nModalities for the overall review by the General Assembly of the \nimplementation of the outcomes of the World Summit on the \nInformation Society\n \n25-04977\n2/3 \n \n \nRecalling its resolution 79/194 of 19 December 2024 and, in particular, \nparagraph 62 thereof, in which it decided to finalize the modalities for the overall \nreview by the General Assembly of the implementation of the outcomes of the World \nSummit on the Information Society to be held in 2025 in accordance with paragraph \n71 of General Assembly resolution 70/125 of 16 December 2015, \n \nRecognizing the role of the Commission on Science and Technology for \nDevelopment in assisting the Economic and Social Council as the focal point in the \nsystem-wide follow-up, in particular the review and assessment of the progress made \nin implementing the outcomes of the World Summit on the Information Society, while \nat the same time maintaining its original mandate concerning science and technology \nfor development, and the work carried out by the Commission to that effect, \n \nReaffirming that science, innovation and technology, including information and \ncommunications technologies, are essential enablers and drivers for the achievement \nof the Sustainable Development Goals6 and the promotion of the economic, social and \nenvironmental components of sustainable development and should be given due \nconsideration in the elaboration of the post 2030 development agenda, \n \nNoting that the Commission on Science and Technology for Development \nshould submit after its twenty-eighth session, by June 2025, its report on the 20-year \nreview of progress made in the implementation of the outcomes of the World Summit \non the Information Society, through the Economic and Social Council, to the General \nAssembly, \n \nNoting also the holding of the World Summit on the Information Society Forum, \nand looking forward to the \u201cWSIS+20 Forum High-level Event\u201d, to be held in Geneva \nin 2025, \n \n1. \nDecides that the overall review will be concluded by a two-day high-level \nmeeting of the General Assembly, to be preceded by an intergovernmental preparatory \nprocess that also takes into account inputs from all relevant stakeholders of the World \nSummit on the Information Society; \n \n2. \nAlso decides to convene the high-level meeting of the General Assembly, \nat the highest possible level, on 16 and 17 December 2025, in accordance with the \nrules of procedure of the General Assembly; \n \n3. \nFurther decides that the President of the General Assembly, in consultation \nwith Member States, will invite, in addition to all Member and observer States and \nobservers, representatives of all relevant stakeholders of the World Summit on the \nInformation Society to speak during the high-level meeting, and in this regard also \nencourages the participation of those stakeholders in the meeting; \n \n4. \nDecides that the overall review by the General Assembly shall take stock \nof the progress made in the implementation of the outcomes of the World Summit on \nthe Information Society and address potential information and communications \ntechnology gaps and areas for continued focus, as well as addressing challenges, \nincluding bridging the digital divide, and harnessing information and communications \ntechnologies for development; \n \n5. \nRequests the President of the General Assembly, in 2025, to appoint two \nco-facilitators to lead, on the basis of, among other relevant inputs, submissions from \nMember and observer States and observers, and the final report of the Commission \non Science and Technology for Development, an intergovernmental negotiation \nprocess, which will include preparatory meetings, resulting in an intergovernmentally \n_______________ \n \n6 See resolution 70/1. \n\nModalities for the overall review by the General Assembly of the \nimplementation of the outcomes of the World Summit on the \nInformation Society \nA/RES/79/277\n \n3/3\n25-04977 \n \nagreed outcome document, for adoption at the high-level meeting of the General \nAssembly; \n \n6. \nDecides that during the preparatory process for the high-level meeting, the \nPresident of the General Assembly will organize informal interactive consultations \nwith all relevant stakeholders of the World Summit on the Information Society, in \norder to collect their inputs for the intergovernmental negotiation process. \n \n62nd plenary meeting \n25 March 2025 \n \n",
  "paragraphs": {
    "1": "Decides that the overall review will be concluded by a two-day high-level meeting of the General Assembly, to be preceded by an intergovernmental preparatory process that also takes into account inputs from all relevant stakeholders of the World Summit on the Information Society;",
    "2": "Also decides to convene the high-level meeting of the General Assembly, at the highest possible level, on 16 and 17 December 2025, in accordance with the rules of procedure of the General Assembly;",
    "3": "Further decides that the President of the General Assembly, in consultation with Member States, will invite, in addition to all Member and observer States and observers, representatives of all relevant stakeholders of the World Summit on the Information Society to speak during the high-level meeting, and in this regard also encourages the participation of those stakeholders in the meeting;",
    "4": "Decides that the overall review by the General Assembly shall take stock of the progress made in the implementation of the outcomes of the World Summit on the Information Society and address potential information and communications technology gaps and areas for continued focus, as well as addressing challenges, including bridging the digital divide, and harnessing information and communications technologies for development;",
    "5": "Requests the President of the General Assembly, in 2025, to appoint two co-facilitators to lead, on the basis of, among other relevant inputs, submissions from Member and observer States and observers, and the final report of the Commission on Science and Technology for Development, an intergovernmental negotiation process, which will include preparatory meetings, resulting in an intergovernmentally _______________ 6 See resolution 70/1. Modalities for the overall review by the General Assembly of the implementation of the outcomes of the World Summit on the Information Society A/RES/79/277 3/3 25-04977 agreed outcome document, for adoption at the high-level meeting of the General Assembly;",
    "6": "Decides that during the preparatory process for the high-level meeting, the President of the General Assembly will organize informal interactive consultations with all relevant stakeholders of the World Summit on the Information Society, in order to collect their inputs for the intergovernmental negotiation process. 62nd plenary meeting 25 March 2025"
  },
  "agenda_items": [
    "Item 15"
  ],
  "symbol_references": [
    "A/79/L.62"
  ]
}