{
  "symbol": "A/RES/73/294",
  "filename": "A_RES_73_294.pdf",
  "title": "73/294. Twenty-fifth anniversary of the Fourth World Conference on Women",
  "text": "United Nations \nA/RES/73/294\n \n \nGeneral Assembly \nDistr.: General \n24 May 2019 \n \n19-08473 (E)    290519     \n*1908473* \n \n \nSeventy-third session \nAgenda item 29 \n \n \n \n \n Resolution adopted by the General Assembly \non 22 May 2019 \n \n \n \n \n[without reference to a Main Committee (A/73/L.86 and A/73/L.86/Add.1)] \n \n \n 73/294. Twenty-fifth anniversary of the Fourth World Conference \non Women  \n \n \n \nThe General Assembly, \n \nRecalling Economic and Social Council resolution 2018/9 of 12 June 2018, \n \nRecognizing the significance of the Fourth World Conference on Women, held \nin Beijing in September 1995,  \n \nRecalling that the Council, in its resolution 2016/3 of 2 June 2016, requested \nthe Commission on the Status of Women, in order to achieve concrete results in each \nreview cycle, to consider and make a recommendation at its sixty-second session on \nhow best to utilize the year 2020, on the occasion of the twenty-fifth anniversary of \nthe Fourth World Conference on Women, so as to accelerate the realization of gender \nequality and the empowerment of women and girls,  \n \n1. \nDecides, in order to celebrate the twenty-fifth anniversary of the Fourth \nWorld Conference on Women, so as to accelerate the realization of gender equality \nand the empowerment of all women and girls, to convene a one-day high-level \nmeeting of the General Assembly in the margins of the general debate of the Assembly \nat its seventy-fifth session, and that the outcome of the high-level meeting shall take \nthe form of a Chair\u2019s summary;  \n \n2. \nRecommends that the President of the General Assembly conduct \nconsultations to finalize the organizational arrangements for the high-level meeting \nof the Assembly. \n \n83rd plenary meeting \n22 May 2019 \n \n",
  "paragraphs": {
    "1": "Decides, in order to celebrate the twenty-fifth anniversary of the Fourth World Conference on Women, so as to accelerate the realization of gender equality and the empowerment of all women and girls, to convene a one-day high-level meeting of the General Assembly in the margins of the general debate of the Assembly at its seventy-fifth session, and that the outcome of the high-level meeting shall take the form of a Chair\u2019s summary;",
    "2": "Recommends that the President of the General Assembly conduct consultations to finalize the organizational arrangements for the high-level meeting of the Assembly."
  },
  "agenda_items": [
    "Item 29"
  ],
  "symbol_references": [
    "A/73/L.86"
  ]
}