{
  "symbol": "A/RES/72/77",
  "filename": "A_RES_72_77.pdf",
  "title": "72/77. International cooperation in the peaceful uses of outer space",
  "text": "United Nations \nA/RES/72/77\n \n \nGeneral Assembly \nDistr.: General \n14 December 2017 \n \n17-22102 (E)    181217     \n*1722102* \n \n \nSeventy-second session \nAgenda item 52 \n \n \n \n \n Resolution adopted by the General Assembly \non 7 December 2017 \n \n \n \n \n[on the report of the Special Political and Decolonization Committee \n(Fourth Committee) (A/72/446)] \n \n \n \n72/77. International cooperation in the peaceful uses of outer space  \n \n \n \nThe General Assembly, \n \nRecalling its resolutions 51/122 of 13 December 1996, 54/68 of 6 December \n1999, 59/2 of 20 October 2004, 61/110 and 61/111 of 14 December 2006, 62/101 of \n17 December 2007, 62/217 of 22 December 2007, 65/97 of 10 December 2010, \n65/271 of 7 April 2011, 66/71 of 9 December 2011, 67/113 of 18 December 2012, \n68/50 of 5 December 2013, 68/74 and 68/75 of 11 December 2013, 69/85 of \n5 December 2014, 70/1 of 25 September 2015, 70/82 of 9 December 2015, 70/230 of \n23 December 2015 and 71/90 of 6 December 2016,  \n \nEmphasizing the significant progress in the development of space science and \ntechnology and their applications that has enabled humans to explore the universe, \nand the extraordinary achievements made in space exploration efforts, including \ndeepening the understanding of the planetary system and the Sun and the Earth itself, \nin the use of space science and technology for the benefit of all humankind and in the \ndevelopment of the international legal regime governing space activities,  \n \nRecognizing, in that regard, the unique platform at the global level for \ninternational cooperation in space activities represented by the Committee on the \nPeaceful Uses of Outer Space and its Scientific and Technical Subcommittee and \nLegal Subcommittee and assisted by the Office for Outer Space Affairs of the \nSecretariat,  \n \nDeeply convinced of the common interest of all humankind in promoting and \nexpanding the exploration and use of outer space, as the province of all humankind, \nfor peaceful purposes and in continuing efforts to extend to all Member States the \nbenefits derived therefrom, and also of the importance of international cooperation in \nthis field, for which the United Nations should continue to provide a focal point,  \n \nReaffirming the importance of international cooperation in developing the rule \nof international law, including the relevant norms of international space law and their \n\nA/RES/72/77 \nInternational cooperation in the peaceful uses of outer space\n \n17-22102 \n2/7 \n \nimportant role in international cooperation for the exploration and use of outer space \nfor peaceful purposes, and of the widest possible adherence to international treaties \nthat promote the peaceful uses of outer space in order to meet emerging new \nchallenges, especially for developing countries,  \n \nSeriously concerned about the possibility of an arms race in outer space, and \nbearing in mind the importance of article IV of the Treaty on Principles Governing \nthe Activities of States in the Exploration and Use of Outer Space, including the Moon \nand Other Celestial Bodies,1 \n \nRecognizing that all Member States, in particular those with major space \ncapabilities, should contribute actively to the prevention of an arms race in outer \nspace with a view to promoting and strengthening international cooperation in the \nexploration and use of outer space for peaceful purposes, \n \nDeeply concerned about the fragility of the space environment and the \nchallenges to the long-term sustainability of outer space activities, in particular the \nimpact of space debris, which is an issue of concern to all nations,  \n \nNoting the progress achieved in the development of peaceful space exploration \nand applications as well as in various national and cooperative space projects, and the \nimportance of further developing the legal framework to strengthen international \ncooperation in space,  \n \nConvinced that space science and technology and their applications, including \nsatellite communications, Earth observation systems and satellite navigation \ntechnologies, provide indispensable tools for viable long-term solutions for \nsustainable development and can contribute more effectively to efforts to promote the \ndevelopment of all countries and regions of the world, and stressing in that regard the \nneed to harness the benefits of space technology towards implementing the 2030 \nAgenda for Sustainable Development,2 \n \nSeriously concerned about the devastating impact of disasters,3 and desirous of \nenhancing international coordination and cooperation at the global level in disaster \nmanagement and emergency response through greater access to and use of space-\nbased services and geospatial information for all countries and facilitating capacity-\nbuilding and institutional strengthening for disaster management, in particular in \ndeveloping countries, \n \nFirmly convinced that the use of space science and technology and their \napplications in areas such as tele-health, tele-education, disaster management, \nenvironmental protection, natural resources management and ocean and climate \nmonitoring contribute to achieving the objectives of the global conferences of the \nUnited Nations that address various aspects of economic, social and cultural \ndevelopment, particularly poverty eradication,  \n \nDeeply concerned about the devastating effects of infectious diseases, including \nEbola virus disease, to the detriment of human life, society and development, and urging \nthe international community to enhance the role of space-based solutions, in particular \ntele-epidemiology, in monitoring, preparedness and response activities,  \n \nRecalling the fact that the United Nations Conference on Sustainable \nDevelopment, held in Rio de Janeiro, Brazil, from 20 to 22 June 2012, recognized the \nimportant role that space science and technology play in promoting sustainable \ndevelopment,4 \n__________________ \n \n1  United Nations, Treaty Series, vol. 610, No. 8843. \n \n2  Resolution 70/1. \n \n3  The term \u201cdisasters\u201d refers to natural or technological disasters. \n \n4  Resolution 66/288, annex, para. 274. \n\nInternational cooperation in the peaceful uses of outer space \nA/RES/72/77\n \n3/7 \n17-22102 \n \n \nHaving considered the report of the Committee on the Peaceful Uses of Outer \nSpace on the work of its sixtieth session,5 \n \n1. \nEndorses the report of the Committee on the Peaceful Uses of Outer Space \non the work of its sixtieth session;5 \n \n2. \nAgrees that the Committee, at its sixty-first session, should consider the \nsubstantive items recommended at its sixtieth session, 6 taking into account the \nconcerns of all countries, in particular those of developing countries;  \n \n3. \nNotes that, at its fifty-sixth session, the Legal Subcommittee of the \nCommittee continued its work,7 as mandated by the General Assembly in its \nresolution 71/90;  \n \n4. \nAgrees that the Legal Subcommittee, at its fifty-seventh session, should \nconsider the substantive items and reconvene the working groups recommended by \nthe Committee,8 taking into account the concerns of all countries, in particular those \nof developing countries;  \n \n5. \nUrges Member States that have not yet become parties to the international \ntreaties governing the uses of outer space9 to give consideration to ratifying or \nacceding to those treaties in accordance with their national law, as well as \nincorporating them into their national legislation;  \n \n6. \nNotes with satisfaction that the space law curriculum developed by the \nOffice for Outer Space Affairs of the Secretariat and published in all official \nlanguages of the United Nations could encourage further studies within Member \nStates in cooperation with relevant entities in support of capacity-building efforts in \nspace law and policy;  \n \n7. \nTakes note of the report of the Working Group on the Review of \nInternational Mechanisms for Cooperation in the Peaceful Exploration and Use of \nOuter Space on the work conducted under its multi-year workplan,10 as finalized at \nthe fifty-sixth session of the Legal Subcommittee, and notes that the report provides \nan important source of information and useful guidance for further joint undertakings \nby spacefaring nations and emerging space nations, as appropriate; \n \n8. \nNotes that, at its fifty-fourth session, the Scientific and Technical \nSubcommittee of the Committee continued its work, 11 as mandated by the General \nAssembly in its resolution 71/90;  \n \n9. \nAgrees that the Scientific and Technical Subcommittee, at its fifty-fifth \nsession, should consider the substantive items and reconvene the working groups \n__________________ \n \n5  Official Records of the General Assembly, Seventy-second Session, Supplement No. 20 (A/72/20). \n \n6  Ibid., para. 349. \n \n7  Ibid., chap. II.C; see also A/AC.105/1122. \n \n8  Official Records of the General Assembly, Seventy-second Session, Supplement No. 20 (A/72/20), \nparas. 244\u2013246. \n \n9  Treaty on Principles Governing the Activities of States in the Exploration and Use of Outer \nSpace, including the Moon and Other Celestial Bodies (United Nations, Treaty Series, vol. 610, \nNo. 8843); Agreement on the Rescue of Astronauts, the Return of Astronauts and the Return of \nObjects Launched into Outer Space (United Nations, Treaty Series, vol. 672, No. 9574); \nConvention on International Liability for Damage Caused by Space Objects (United Nations, \nTreaty Series, vol. 961, No. 13810); Convention on Registration of Objects Launched into Outer \nSpace (United Nations, Treaty Series, vol. 1023, No. 15020); and Agreement Governing the \nActivities of States on the Moon and Other Celestial Bodies (United Nations, Treaty Series, \nvol. 1363, No. 23002). \n \n10  A/AC.105/C.2/112. \n \n11  Official Records of the General Assembly, Seventy-second Session, Supplement No. 20 (A/72/20), \nchap. II.B; see also A/AC.105/1138. \n\nA/RES/72/77 \nInternational cooperation in the peaceful uses of outer space\n \n17-22102 \n4/7 \n \nrecommended by the Committee,12 taking into account the concerns of all countries, \nin particular those of developing countries;  \n \n10. Reiterates the importance of information-sharing in discovering, \nmonitoring and physically characterizing potentially hazardous near-Earth objects to \nensure that all countries, in particular developing countries with limited capacity for \npredicting and mitigating a near-Earth object impact, are aware of potential threats, \nemphasizes the need for capacity-building for effective emergency response and \ndisaster management in the event of a near-Earth object impact, and notes with \nsatisfaction the work carried out by the International Asteroid Warning Network and \nthe Space Mission Planning Advisory Group to strengthen international cooperation \nto mitigate the potential threat posed by near-Earth objects, with the support of the \nOffice, serving as the permanent secretariat of the Advisory Group; 13 \n \n11. \nNotes with appreciation that some Member States are already \nimplementing space debris mitigation measures on a voluntary basis, through national \nmechanisms and consistent with the Space Debris Mitigation Guidelines of the Inter-\nAgency Space Debris Coordination Committee and with the Space Debris Mitigation \nGuidelines of the Committee on the Peaceful Uses of Outer Space,14 endorsed by the \nGeneral Assembly in its resolution 62/217, and invites other Member States to \nimplement, through relevant national mechanisms, the Space Debris Mitigation \nGuidelines of the Committee on the Peaceful Uses of Outer Space;  \n \n12. Considers that it is essential that Member States pay more attention to the \nproblem of the gradually increasing probability of collisions of space objects, \nespecially those with nuclear power sources, with space debris, and other aspects of \nspace debris, calls for the continuation of national research on this question, for the \ndevelopment of improved technology for the monitoring of space debris and for the \ncompilation and dissemination of data on space debris, also considers that, to the \nextent possible, information thereon should be provided to the Scientific and \nTechnical Subcommittee, and agrees that international cooperation is needed to \nexpand appropriate and affordable strategies to minimize the impact of space debris \non future space missions;  \n \n13. Urges all Member States, in particular those with major space capabilities, \nto contribute actively to the goal of preventing an arms race in outer space as an \nessential condition for the promotion of international cooperation in the exploration \nand use of outer space for peaceful purposes;  \n \n14. Requests the Committee to continue to consider, as a matter of priority, \nways and means of maintaining outer space for peaceful purposes and to report \nthereon to the General Assembly at its seventy-third session, and agrees that the \nCommittee should continue to consider the broader perspective of space security and \nassociated matters that would be instrumental in ensuring the safe and responsible \nconduct of space activities, including ways to promote international, regional and \ninterregional cooperation to that end; \n \n15. Emphasizes the significant role of the Office in promoting international \ncooperation in the exploration and peaceful uses of outer space for economic, social \nand scientific development, in particular for the benefit of developing countries;  \n \n16. Notes with satisfaction the programme of work undertaken by the Office \nin 2017 to strengthen international cooperation in the conduct of space activities for \n__________________ \n \n12  Official Records of the General Assembly, Seventy-second Session, Supplement No. 20 (A/72/20), \nparas. 164 and 165. \n \n13  See A/AC.105/1138, paras. 205\u2013210. \n \n14  Official Records of the General Assembly, Sixty-second Session, Supplement No. 20 (A/62/20), \nannex. \n\nInternational cooperation in the peaceful uses of outer space \nA/RES/72/77\n \n5/7 \n17-22102 \n \npeaceful purposes and the use of space science and technology and their applications \ntowards the achievement of the internationally agreed Sustainable Development \nGoals, including the workshops and symposiums conducted to build capacity, the \nassistance provided to developing countries, at their request, in the development of \nnational space policy and legislation in conformity with international space law, and \nactions implemented to strengthen institutional capacity in space activities; \n \n17. Requests the Office to continue to apprise the Committee and its Scientific \nand Technical Subcommittee and Legal Subcommittee, at their respective sessions in \n2018, of the status of its capacity-building activities; \n \n18. Recognizes the capacity-building activities under the United Nations \nProgramme on Space Applications, which provide unique benefits for Member States, \nin particular developing countries, participating in those activities; 15 \n \n19. Notes with satisfaction the activities carried out under the United Nations \nPlatform for Space-based Information for Disaster Management and Emergency \nResponse (UN-SPIDER), and recognizes the significant achievements made and the \nadvisory support provided to 40 Member States within the framework of UN-SPIDER \nsince its establishment in 200616 with the valuable contributions of its network of \nregional support offices, and encourages Member States, on a voluntary basis, to \nprovide the programme with the additional resources necessary to address the \nincreasing demand for support successfully and in a timely manner;  \n \n20. Reiterates the importance of the Sendai Framework for Disaster Risk \nReduction 2015\u20132030,17 in which the value of space-based technology and Earth \nobservation for disaster management and emergency response is recognized, and \nnotes with satisfaction the efforts of the Office and its UN-SPIDER programme \ntowards promoting international cooperation as a way to enhance the use of space-\nbased technologies and related services at the national and local levels in contributing \nto the implementation of the Sendai Framework and the 2030 Agenda for Sustainable \nDevelopment;2 \n \n21. Notes with satisfaction the continuous progress made by the International \nCommittee on Global Navigation Satellite Systems with the support of the Office, in \nits capacity as executive secretariat of the International Committee, towards achieving \ncompatibility and interoperability among global and regional space-based \npositioning, navigation and timing systems and in the promotion of the use of global \nnavigation satellite systems and their integration into national infrastructure, \nparticularly in developing countries, and notes with appreciation that the International \nCommittee will hold its twelfth meeting in Kyoto, Japan, from 2 to 7 December 2017;  \n \n22. Notes with appreciation that the regional centres for space science and \ntechnology education, affiliated to the United Nations, namely, the African regional \ncentres for space science and technology education in the French and English \nlanguages, located in Morocco and Nigeria, respectively, the Regional Centre for \nSpace Science and Technology Education for Asia and the Pacific, located in China, \nthe Centre for Space Science and Technology Education in Asia and the Pacific, \nlocated in India, the Regional Centre for Space Science and Technology Education \nfor Latin America and the Caribbean, with campuses located in Brazil and Mexico, \nand the Centre for Space Science and Technology Education for Western Asia, located \nin Jordan, have continued their education programmes in 2017, encourages the \nregional centres to continue to promote greater participation of women in their \n__________________ \n \n15  See A/AC.105/1138, sect. II. \n \n16  Resolution 61/110. \n \n17  Resolution 69/283, annex II. \n\nA/RES/72/77 \nInternational cooperation in the peaceful uses of outer space\n \n17-22102 \n6/7 \n \neducation programmes, and agrees that the regional centres should continue to report \nto the Committee on the Peaceful Uses of Outer Space on their activities;  \n \n23. Emphasizes that regional and interregional cooperation in the field of \nspace activities is essential to strengthen the peaceful uses of outer space, assist \nMember States in the development of their space capabilities and contribute to the \nimplementation of the 2030 Agenda for Sustainable Development, to that end requests \nrelevant regional organizations and their groups of experts to offer the assistance \nnecessary so that countries can carry out the recommendations of regional \nconferences, and in that regard notes the importance of the equal participation of \nwomen in all fields of science and technology;  \n \n24. Recognizes, in that regard, the important role played by such organizations \nas the Asia-Pacific Space Cooperation Organization and the European Space Agency \nand by conferences and other mechanisms, such as the Asia-Pacific Regional Space \nAgency Forum and the Space Conference of the Americas, in strengthening regional \nand international cooperation among Member States;  \n \n25. Welcomes the adoption of the African Space Policy and Strategy by the \nAssembly of the African Union at its twenty-sixth ordinary session, held in Addis \nAbaba on 30 and 31 January 2016, and notes that this achievement marks the first \nstep towards the realization of an African outer space programme within the \nframework of the African Union Agenda 2063; \n \n26. Emphasizes the need to increase the benefits of space technology and its \napplications and to contribute to an orderly growth of space activities favourable to \nsustained economic growth and sustainable development in all countries, including \nstrengthening sustainable spatial data infrastructure at the regional and national levels \nand building resilience to reduce the consequences of disasters, in particular in \ndeveloping countries;  \n \n27. Reiterates the need to promote the benefits of space technology and its \napplications in the major United Nations conferences and summits for economic, \nsocial and cultural development and related fields, and recognizes that the \nfundamental significance of space science and technology and their applications for \nglobal, regional, national and local sustainable development processes should be \npromoted in the formulation of policies and programmes of action and their \nimplementation, including through efforts towards achieving the objectives of those \nconferences and summits and in implementing the 2030 Agenda for Sustainable \nDevelopment;  \n \n28. Encourages Member States, to that end, to promote the inclusion in those \nconferences, summits and processes of the relevance of space science and technology \napplications and the use of space-derived geospatial data, with the involvement of the \nOffice;  \n \n29. Encourages the Office to take active part in those conferences, summits \nand processes and other activities in support of the objectives, as appropriate, and to \nconduct capacity-building activities, hold lectures and participate in academic and \nresearch activities to foster international cooperation in the peaceful uses of outer \nspace;  \n \n30. Urges the Inter-Agency Meeting on Outer Space Activities (UN-Space), \nunder the leadership of the Office, to continue to examine how space science and \ntechnology and their applications could contribute to the 2030 Agenda for Sustainable \nDevelopment, and encourages entities of the United Nations system to participate, as \nappropriate, in UN-Space coordination efforts;  \n\nInternational cooperation in the peaceful uses of outer space \nA/RES/72/77\n \n7/7 \n17-22102 \n \n \n31. Encourages the Office to continue to conduct capacity-building and \noutreach activities associated with space security and transparency and confidence-\nbuilding measures in outer space activities, as appropriate, and within the context of \nthe long-term sustainability of outer space activities;  \n \n32. Also encourages the Office to continue exploring existing avenues and \nnew opportunities to increase its capability to meet the growing demand for support \nto strengthen the capacity of countries, in particular developing countries, in using \nspace science and technology and their applications and to inform the Committee of \nthose efforts; \n \n33. Agrees that the Office should pursue greater engagement with industry and \nprivate sector entities to further their support for and contributions to the overall work \nof the Office;18 \n \n34. Appeals to Governments, the relevant entities of the United Nations \nsystem, intergovernmental and non-governmental organizations, institutions, industry \nand private sector entities and individuals to make voluntary contributions to the trust \nfund in support of the United Nations Programme on the Peaceful Uses of Outer Space \nin order to support the efforts of the Office to secure additional resources to facilitate \nthe full implementation of its programme of work, including, where appropriate, the \nfinancing of special projects, and otherwise to assist the Office in carrying out \ntechnical cooperation and assistance activities, in particular for developing countries; \n \n35. Decides that Bahrain, Denmark and Norway shall become members of the \nCommittee; \n \n36. Endorses the decision of the Committee to grant permanent observer status \nto the European Science Foundation, represented by the European Space Sciences \nCommittee, and the University Space Engineering Consortium-Global;19 \n \n37. Encourages the regional groups to promote active participation in the \nwork of the Committee on the Peaceful Uses of Outer Space and its subsidiary bodies \nby the States members of the Committee that are also members of the respective \nregional groups. \n \n66th plenary meeting  \n7 December 2017 \n \n__________________ \n \n18  See Official Records of the General Assembly, Seventy-second Session, Supplement No. 20 \n(A/72/20), para. 326. \n \n19  Ibid., paras. 345 and 347. \n",
  "paragraphs": {
    "1": "Endorses the report of the Committee on the Peaceful Uses of Outer Space on the work of its sixtieth session;5",
    "2": "Agrees that the Committee, at its sixty-first session, should consider the substantive items recommended at its sixtieth session, 6 taking into account the concerns of all countries, in particular those of developing countries;",
    "3": "Notes that, at its fifty-sixth session, the Legal Subcommittee of the Committee continued its work,7 as mandated by the General Assembly in its resolution 71/90;",
    "4": "Agrees that the Legal Subcommittee, at its fifty-seventh session, should consider the substantive items and reconvene the working groups recommended by the Committee,8 taking into account the concerns of all countries, in particular those of developing countries;",
    "5": "Urges Member States that have not yet become parties to the international treaties governing the uses of outer space9 to give consideration to ratifying or acceding to those treaties in accordance with their national law, as well as incorporating them into their national legislation;",
    "6": "Notes with satisfaction that the space law curriculum developed by the Office for Outer Space Affairs of the Secretariat and published in all official languages of the United Nations could encourage further studies within Member States in cooperation with relevant entities in support of capacity-building efforts in space law and policy;",
    "7": "Takes note of the report of the Working Group on the Review of International Mechanisms for Cooperation in the Peaceful Exploration and Use of Outer Space on the work conducted under its multi-year workplan,10 as finalized at the fifty-sixth session of the Legal Subcommittee, and notes that the report provides an important source of information and useful guidance for further joint undertakings by spacefaring nations and emerging space nations, as appropriate;",
    "8": "Notes that, at its fifty-fourth session, the Scientific and Technical Subcommittee of the Committee continued its work, 11 as mandated by the General Assembly in its resolution 71/90;",
    "9": "Agrees that the Scientific and Technical Subcommittee, at its fifty-fifth session, should consider the substantive items and reconvene the working groups __________________ 5 Official Records of the General Assembly, Seventy-second Session, Supplement No. 20 (A/72/20). 6 Ibid., para. 349. 7 Ibid., chap. II.C; see also A/AC.105/1122. 8 Official Records of the General Assembly, Seventy-second Session, Supplement No. 20 (A/72/20), paras. 244\u2013246. 9 Treaty on Principles Governing the Activities of States in the Exploration and Use of Outer Space, including the Moon and Other Celestial Bodies (United Nations, Treaty Series, vol. 610, No. 8843); Agreement on the Rescue of Astronauts, the Return of Astronauts and the Return of Objects Launched into Outer Space (United Nations, Treaty Series, vol. 672, No. 9574); Convention on International Liability for Damage Caused by Space Objects (United Nations, Treaty Series, vol. 961, No. 13810); Convention on Registration of Objects Launched into Outer Space (United Nations, Treaty Series, vol. 1023, No. 15020); and Agreement Governing the Activities of States on the Moon and Other Celestial Bodies (United Nations, Treaty Series, vol. 1363, No. 23002). 10 A/AC.105/C.2/112. 11 Official Records of the General Assembly, Seventy-second Session, Supplement No. 20 (A/72/20), chap. II.B; see also A/AC.105/1138. A/RES/72/77 International cooperation in the peaceful uses of outer space 17-22102 4/7 recommended by the Committee,12 taking into account the concerns of all countries, in particular those of developing countries;",
    "10": "Reiterates the importance of information-sharing in discovering, monitoring and physically characterizing potentially hazardous near-Earth objects to ensure that all countries, in particular developing countries with limited capacity for predicting and mitigating a near-Earth object impact, are aware of potential threats, emphasizes the need for capacity-building for effective emergency response and disaster management in the event of a near-Earth object impact, and notes with satisfaction the work carried out by the International Asteroid Warning Network and the Space Mission Planning Advisory Group to strengthen international cooperation to mitigate the potential threat posed by near-Earth objects, with the support of the Office, serving as the permanent secretariat of the Advisory Group; 13",
    "11": "Notes with appreciation that some Member States are already implementing space debris mitigation measures on a voluntary basis, through national mechanisms and consistent with the Space Debris Mitigation Guidelines of the Inter- Agency Space Debris Coordination Committee and with the Space Debris Mitigation Guidelines of the Committee on the Peaceful Uses of Outer Space,14 endorsed by the General Assembly in its resolution 62/217, and invites other Member States to implement, through relevant national mechanisms, the Space Debris Mitigation Guidelines of the Committee on the Peaceful Uses of Outer Space;",
    "12": "Considers that it is essential that Member States pay more attention to the problem of the gradually increasing probability of collisions of space objects, especially those with nuclear power sources, with space debris, and other aspects of space debris, calls for the continuation of national research on this question, for the development of improved technology for the monitoring of space debris and for the compilation and dissemination of data on space debris, also considers that, to the extent possible, information thereon should be provided to the Scientific and Technical Subcommittee, and agrees that international cooperation is needed to expand appropriate and affordable strategies to minimize the impact of space debris on future space missions;",
    "13": "Urges all Member States, in particular those with major space capabilities, to contribute actively to the goal of preventing an arms race in outer space as an essential condition for the promotion of international cooperation in the exploration and use of outer space for peaceful purposes;",
    "14": "Requests the Committee to continue to consider, as a matter of priority, ways and means of maintaining outer space for peaceful purposes and to report thereon to the General Assembly at its seventy-third session, and agrees that the Committee should continue to consider the broader perspective of space security and associated matters that would be instrumental in ensuring the safe and responsible conduct of space activities, including ways to promote international, regional and interregional cooperation to that end;",
    "15": "Emphasizes the significant role of the Office in promoting international cooperation in the exploration and peaceful uses of outer space for economic, social and scientific development, in particular for the benefit of developing countries;",
    "16": "Notes with satisfaction the programme of work undertaken by the Office in 2017 to strengthen international cooperation in the conduct of space activities for __________________ 12 Official Records of the General Assembly, Seventy-second Session, Supplement No. 20 (A/72/20), paras. 164 and 165. 13 See A/AC.105/1138, paras. 205\u2013210. 14 Official Records of the General Assembly, Sixty-second Session, Supplement No. 20 (A/62/20), annex. International cooperation in the peaceful uses of outer space A/RES/72/77 5/7 17-22102 peaceful purposes and the use of space science and technology and their applications towards the achievement of the internationally agreed Sustainable Development Goals, including the workshops and symposiums conducted to build capacity, the assistance provided to developing countries, at their request, in the development of national space policy and legislation in conformity with international space law, and actions implemented to strengthen institutional capacity in space activities;",
    "17": "Requests the Office to continue to apprise the Committee and its Scientific and Technical Subcommittee and Legal Subcommittee, at their respective sessions in 2018, of the status of its capacity-building activities;",
    "18": "Recognizes the capacity-building activities under the United Nations Programme on Space Applications, which provide unique benefits for Member States, in particular developing countries, participating in those activities; 15",
    "19": "Notes with satisfaction the activities carried out under the United Nations Platform for Space-based Information for Disaster Management and Emergency Response (UN-SPIDER), and recognizes the significant achievements made and the advisory support provided to 40 Member States within the framework of UN-SPIDER since its establishment in 200616 with the valuable contributions of its network of regional support offices, and encourages Member States, on a voluntary basis, to provide the programme with the additional resources necessary to address the increasing demand for support successfully and in a timely manner;",
    "20": "Reiterates the importance of the Sendai Framework for Disaster Risk Reduction 2015\u20132030,17 in which the value of space-based technology and Earth observation for disaster management and emergency response is recognized, and notes with satisfaction the efforts of the Office and its UN-SPIDER programme towards promoting international cooperation as a way to enhance the use of space- based technologies and related services at the national and local levels in contributing to the implementation of the Sendai Framework and the 2030 Agenda for Sustainable Development;2",
    "21": "Notes with satisfaction the continuous progress made by the International Committee on Global Navigation Satellite Systems with the support of the Office, in its capacity as executive secretariat of the International Committee, towards achieving compatibility and interoperability among global and regional space-based positioning, navigation and timing systems and in the promotion of the use of global navigation satellite systems and their integration into national infrastructure, particularly in developing countries, and notes with appreciation that the International Committee will hold its twelfth meeting in Kyoto, Japan, from 2 to 7 December 2017;",
    "22": "Notes with appreciation that the regional centres for space science and technology education, affiliated to the United Nations, namely, the African regional centres for space science and technology education in the French and English languages, located in Morocco and Nigeria, respectively, the Regional Centre for Space Science and Technology Education for Asia and the Pacific, located in China, the Centre for Space Science and Technology Education in Asia and the Pacific, located in India, the Regional Centre for Space Science and Technology Education for Latin America and the Caribbean, with campuses located in Brazil and Mexico, and the Centre for Space Science and Technology Education for Western Asia, located in Jordan, have continued their education programmes in 2017, encourages the regional centres to continue to promote greater participation of women in their __________________ 15 See A/AC.105/1138, sect. II. 16 Resolution 61/110. 17 Resolution 69/283, annex II. A/RES/72/77 International cooperation in the peaceful uses of outer space 17-22102 6/7 education programmes, and agrees that the regional centres should continue to report to the Committee on the Peaceful Uses of Outer Space on their activities;",
    "23": "Emphasizes that regional and interregional cooperation in the field of space activities is essential to strengthen the peaceful uses of outer space, assist Member States in the development of their space capabilities and contribute to the implementation of the 2030 Agenda for Sustainable Development, to that end requests relevant regional organizations and their groups of experts to offer the assistance necessary so that countries can carry out the recommendations of regional conferences, and in that regard notes the importance of the equal participation of women in all fields of science and technology;",
    "24": "Recognizes, in that regard, the important role played by such organizations as the Asia-Pacific Space Cooperation Organization and the European Space Agency and by conferences and other mechanisms, such as the Asia-Pacific Regional Space Agency Forum and the Space Conference of the Americas, in strengthening regional and international cooperation among Member States;",
    "25": "Welcomes the adoption of the African Space Policy and Strategy by the Assembly of the African Union at its twenty-sixth ordinary session, held in Addis Ababa on 30 and 31 January 2016, and notes that this achievement marks the first step towards the realization of an African outer space programme within the framework of the African Union Agenda 2063;",
    "26": "Emphasizes the need to increase the benefits of space technology and its applications and to contribute to an orderly growth of space activities favourable to sustained economic growth and sustainable development in all countries, including strengthening sustainable spatial data infrastructure at the regional and national levels and building resilience to reduce the consequences of disasters, in particular in developing countries;",
    "27": "Reiterates the need to promote the benefits of space technology and its applications in the major United Nations conferences and summits for economic, social and cultural development and related fields, and recognizes that the fundamental significance of space science and technology and their applications for global, regional, national and local sustainable development processes should be promoted in the formulation of policies and programmes of action and their implementation, including through efforts towards achieving the objectives of those conferences and summits and in implementing the 2030 Agenda for Sustainable Development;",
    "28": "Encourages Member States, to that end, to promote the inclusion in those conferences, summits and processes of the relevance of space science and technology applications and the use of space-derived geospatial data, with the involvement of the Office;",
    "29": "Encourages the Office to take active part in those conferences, summits and processes and other activities in support of the objectives, as appropriate, and to conduct capacity-building activities, hold lectures and participate in academic and research activities to foster international cooperation in the peaceful uses of outer space;",
    "30": "Urges the Inter-Agency Meeting on Outer Space Activities (UN-Space), under the leadership of the Office, to continue to examine how space science and technology and their applications could contribute to the 2030 Agenda for Sustainable Development, and encourages entities of the United Nations system to participate, as appropriate, in UN-Space coordination efforts; International cooperation in the peaceful uses of outer space A/RES/72/77 7/7 17-22102",
    "31": "Encourages the Office to continue to conduct capacity-building and outreach activities associated with space security and transparency and confidence- building measures in outer space activities, as appropriate, and within the context of the long-term sustainability of outer space activities;",
    "32": "Also encourages the Office to continue exploring existing avenues and new opportunities to increase its capability to meet the growing demand for support to strengthen the capacity of countries, in particular developing countries, in using space science and technology and their applications and to inform the Committee of those efforts;",
    "33": "Agrees that the Office should pursue greater engagement with industry and private sector entities to further their support for and contributions to the overall work of the Office;18",
    "34": "Appeals to Governments, the relevant entities of the United Nations system, intergovernmental and non-governmental organizations, institutions, industry and private sector entities and individuals to make voluntary contributions to the trust fund in support of the United Nations Programme on the Peaceful Uses of Outer Space in order to support the efforts of the Office to secure additional resources to facilitate the full implementation of its programme of work, including, where appropriate, the financing of special projects, and otherwise to assist the Office in carrying out technical cooperation and assistance activities, in particular for developing countries;",
    "35": "Decides that Bahrain, Denmark and Norway shall become members of the Committee;",
    "36": "Endorses the decision of the Committee to grant permanent observer status to the European Science Foundation, represented by the European Space Sciences Committee, and the University Space Engineering Consortium-Global;19",
    "37": "Encourages the regional groups to promote active participation in the work of the Committee on the Peaceful Uses of Outer Space and its subsidiary bodies by the States members of the Committee that are also members of the respective regional groups. 66th plenary meeting 7 December 2017 __________________ 18 See Official Records of the General Assembly, Seventy-second Session, Supplement No. 20 (A/72/20), para. 326. 19 Ibid., paras. 345 and 347."
  },
  "agenda_items": [
    "Item 52"
  ],
  "symbol_references": []
}