{
  "symbol": "A/RES/72/273",
  "filename": "A_RES_72_273.pdf",
  "title": "72/273. Cooperation between the United Nations and the International Fund for Saving the Aral Sea",
  "text": "United Nations \nA/RES/72/273\n \n \nGeneral Assembly \nDistr.: General \n16 April 2018 \n \n18-05868 (E)    180418 \n*1805868* \n \n \nSeventy-second session \nAgenda item 19 \n \n \n \n \n Resolution adopted by the General Assembly \non 12 April 2018 \n \n \n \n \n[without reference to a Main Committee (A/72/L.42 and A/72/L.42/Add.1)] \n \n \n 72/273. Cooperation between the United Nations and the International \nFund for Saving the Aral Sea \n \n \n \nThe General Assembly, \n \nReferring to the Articles of the Charter of the United Nations that encourage \nmeasures for regional cooperation to advance the purposes and principles of the \nUnited Nations,  \n \nReferring also to its resolution 63/133 of 11 December 2008, by which it granted \nthe International Fund for Saving the Aral Sea observer status in the General \nAssembly,  \n \nAcknowledging \nthat \nthe \nnegative \nhumanitarian, \nenvironmental \nand \nsocioeconomic consequences of the Aral Sea basin tragedy go well beyond the region \nand represent a global concern, \n \nWelcoming the efforts of the States members of the International Fund for \nSaving the Aral Sea to attain objectives consistent with the purposes and principles \nof the United Nations,  \n \nConvinced that the activities of the International Fund for Saving the Aral Sea \nand its bodies should take into account the interests and needs of all the countries of \nCentral Asia,  \n \nReaffirming that achieving international cooperation in solving international \nproblems of an economic, social or humanitarian nature is one of the purposes of the \nUnited Nations,  \n \nReferring to the relevant resolutions of the Security Council, including \nresolution 1631 (2005) of 17 October 2005, as well as statements by the President of \nthe Council in which the Council emphasized the importance of developing effective \npartnerships between the United Nations and regional and subregional organizations, \nin accordance with the Charter,  \n\nA/RES/72/273 \nCooperation between the United Nations and the International Fund for Saving the Aral Sea\n \n18-05868\n2/2 \n \n \nWelcoming the commitment of the International Fund for Saving the Aral Sea to \nintensifying and deepening its cooperation with the agencies, programmes and funds \nof the United Nations system,  \n \nConvinced that strengthening cooperation between the United Nations and the \nInternational Fund for Saving the Aral Sea will advance the purposes and principles \nof the United Nations,  \n \n1. \nNotes the need for further improvement of the activities of the \nInternational Fund for Saving the Aral Sea to strengthen regional cooperation in such \nareas as social and economic development; environmental protection and response to \nnatural disasters; water resources management; adaptation to climate change and \nmitigation of its consequences; exchange of information; science and innovation; and \nother related areas;  \n \n2. \nAlso notes the importance of strengthening cooperation and coordination \nbetween the United Nations system and the International Fund for Saving the Aral \nSea, and invites the Secretary-General to hold for that purpose regular consultations \nwith the Chair of the Executive Committee of the International Fund, making use of \nappropriate inter-agency forums and formats, including consultations between the \nSecretary-General and the heads of regional organizations;  \n \n3. \nInvites the specialized agencies and other organizations, programmes and \nfunds of the United Nations system, as well as international financial institutions, to \ndevelop their cooperation with the International Fund for Saving the Aral Sea;  \n \n4. \nRequests the Secretary-General to report to the General Assembly at its \nseventy-third session on the implementation of the present resolution;  \n \n5. \nDecides to include in the provisional agenda of its seventy-third session, \nunder the item entitled \u201cCooperation between the United Nations and regional and \nother organizations\u201d, a sub-item entitled \u201cCooperation between the United Nations \nand the International Fund for Saving the Aral Sea\u201d. \n \n82nd plenary meeting \n12 April 2018 \n \n",
  "paragraphs": {
    "1": "Notes the need for further improvement of the activities of the International Fund for Saving the Aral Sea to strengthen regional cooperation in such areas as social and economic development; environmental protection and response to natural disasters; water resources management; adaptation to climate change and mitigation of its consequences; exchange of information; science and innovation; and other related areas;",
    "2": "Also notes the importance of strengthening cooperation and coordination between the United Nations system and the International Fund for Saving the Aral Sea, and invites the Secretary-General to hold for that purpose regular consultations with the Chair of the Executive Committee of the International Fund, making use of appropriate inter-agency forums and formats, including consultations between the Secretary-General and the heads of regional organizations;",
    "3": "Invites the specialized agencies and other organizations, programmes and funds of the United Nations system, as well as international financial institutions, to develop their cooperation with the International Fund for Saving the Aral Sea;",
    "4": "Requests the Secretary-General to report to the General Assembly at its seventy-third session on the implementation of the present resolution;",
    "5": "Decides to include in the provisional agenda of its seventy-third session, under the item entitled \u201cCooperation between the United Nations and regional and other organizations\u201d, a sub-item entitled \u201cCooperation between the United Nations and the International Fund for Saving the Aral Sea\u201d."
  },
  "agenda_items": [
    "Item 19"
  ],
  "symbol_references": [
    "A/72/L.42"
  ]
}