{
  "symbol": "A/RES/78/265",
  "filename": "A_RES_78_265.pdf",
  "title": "78/265. Seizing the opportunities of safe, secure and trustworthy artificial intelligence systems for sustainable development",
  "text": "United Nations \nA/RES/78/265\n \n \nGeneral Assembly \nDistr.: General \n1 April 2024 \n \n24-05969 (E)    050424 \n*2405969* \n \n \nSeventy-eighth session \nAgenda item 13 \nIntegrated and coordinated implementation of and follow-up \nto the outcomes of the major United Nations conferences and \nsummits in the economic, social and related fields \n \n \n \n \n Resolution adopted by the General Assembly \non 21 March 2024 \n \n \n \n \n[without reference to a Main Committee (A/78/L.49)] \n \n \n 78/265. Seizing the opportunities of safe, secure and trustworthy artificial \nintelligence systems for sustainable development \n \n \n \nThe General Assembly, \n \nReaffirming international law, in particular the Charter of the United Nations, \nand recalling the Universal Declaration of Human Rights, 1 \n \nReaffirming also its resolution 70/1 of 25 September 2015, entitled \n\u201cTransforming our world: the 2030 Agenda for Sustainable Development\u201d, its \nresolution 69/313 of 27 July 2015 on the Addis Ababa Action Agenda of the Third \nInternational Conference on Financing for Development, and the political declaration \nadopted at the high-level political forum on sustainable development convened under \nthe auspices of the General Assembly contained in the annex to its resolution 78/1 of \n29 September 2023, \n \nRecalling its resolutions 77/320 of 25 July 2023 on the impact of rapid \ntechnological change on the achievement of the Sustainable Development Goals and \ntargets, 78/132 of 19 December 2023 on information and communications technologies \nfor sustainable development, 78/160 of 19 December 2023 on science, technology and \ninnovation for sustainable development, 78/213 of 19 December 2023 on the promotion \nand protection of human rights in the context of digital technologies, 77/211 of \n15 December 2022 on the right to privacy in the digital age, 70/125 of 16 December \n2015 on the overall review of the implementation of the outcomes of the World Summit \non the Information Society, all the outcomes of the World Summit on the Information \nSociety, including the Geneva Declaration of Principles,2 the Geneva Plan of Action,3 \n__________________ \n \n1 Resolution 217 A (III). \n \n2 See A/C.2/59/3, annex. \n \n3 Ibid. \n\nA/RES/78/265 \nSeizing the opportunities of safe, secure and trustworthy artificial \nintelligence systems for sustainable development\n \n24-05969\n2/8 \n \nthe Tunis Commitment4 and the Tunis Agenda for the Information Society,5 and the \ndeclaration on the commemoration of the seventy-fifth anniversary of the United \nNations contained in its resolution 75/1 of 21 September 2020, \n \nTaking note of the efforts of the International Telecommunication Union, in \npartnership with 40 United Nations bodies, to convene the Artificial Intelligence for \nGood platform, including its annual summit and the launch of the International \nTelecommunication Union\u2019s Artificial Intelligence Repository to identify responsible \nand practical applications of artificial intelligence to advance the Sustainable \nDevelopment Goals; and the adoption by the General Conference of the United \nNations Educational, Scientific and Cultural Organization of its Recommendation on \nthe Ethics of Artificial Intelligence of 23 November 2021, 6 its implementation plan, \nincluding the Readiness Assessment Methodology and the Ethical Impact Assessment \nand the Global Forum on the Ethics of Artificial Intelligence; as well as taking note of \nthe Guiding Principles on Business and Human Rights: Implementing the United \nNations \u201cProtect, Respect and Remedy\u201d Framework,7 as endorsed by the Human Rights \nCouncil in its resolution 17/4 of 16 June 2011;8 and the work of the Office of the United \nNations High Commissioner for Human Rights regarding artificial intelligence, \n \nTaking note also of the report of the Secretary-General of the United Nations \nentitled \u201cRoad map for digital cooperation\u201d, 9 as well as the establishment of the \nOffice of the Secretary-General\u2019s Envoy on Technology to coordinate its \nimplementation \nand \nthe \nestablishment \nby \nthe \nSecretary-General \nof \na \nmulti-stakeholder High-level Advisory Body on Artificial Intelligence and of its \ninterim report issued on 21 December 2023, and looking forward to its final report, \n \nRecognizing that safe, secure and trustworthy artificial intelligence systems \u2013 \nwhich, for the purpose of this resolution, refers to artificial intelligence systems in \nthe non-military domain, whose life cycle includes the stages: pre-design, design, \ndevelopment, evaluation, testing, deployment, use, sale, procurement, operation and \ndecommissioning, are such that they are human-centric, reliable, explainable, ethical, \ninclusive, in full respect, promotion and protection of human rights and international \nlaw, privacy preserving, sustainable development oriented, and responsible \u2013 have the \npotential to accelerate and enable progress towards the achievement of all \n17 Sustainable Development Goals and sustainable development in its three \ndimensions \u2013 economic, social and environmental \u2013 in a balanced and integrated \nmanner; promote digital transformation; promote peace; overcome digital divides \nbetween and within countries; and promote and protect the enjoyment of human rights \nand fundamental freedoms for all, while keeping the human person at the centre, \n \nRecognizing also that the improper or malicious design, development, \ndeployment and use of artificial intelligence systems, such as without adequate \nsafeguards or in a manner inconsistent with international law, pose risks that could \nhinder progress towards the achievement of the 2030 Agenda for Sustainable \nDevelopment and its Sustainable Development Goals and undermine sustainable \ndevelopment in its three dimensions \u2013 economic, social and environmental; widen \ndigital divides between and within countries; reinforce structural inequalities and \nbiases; lead to discrimination; undermine information integrity and access to \ninformation; undercut the protection, promotion and enjoyment of human rights and \n__________________ \n \n4 See A/60/687. \n \n5 Ibid. \n \n6 United Nations Educational, Scientific and Cultural Organization, Records of the General \nConference, Forty-first Session, Paris, 9\u201324 November 2021, vol. 1, Resolutions, annex VII. \n \n7 A/HRC/17/31, annex. \n \n8 See Official Records of the General Assembly, Sixty-sixth Session, Supplement No. 53 (A/66/53), \nchap. III, sect. A. \n \n9 A/74/821. \n\nSeizing the opportunities of safe, secure and trustworthy artificial \nintelligence systems for sustainable development \nA/RES/78/265\n \n3/8\n24-05969 \n \nfundamental freedoms, including the right not to be subject to unlawful or arbitrary \ninterference with one\u2019s privacy; and increase the potential risk for accidents and \ncompound threats from malicious actors, \n \nRecognizing further the rapid acceleration of the design, development, \ndeployment and use of artificial intelligence systems and rapid technological change, \nand their potential impact in accelerating the achievement of the Sustainable \nDevelopment Goals, therefore stressing the urgency of achieving global consensus on \nsafe, secure and trustworthy artificial intelligence systems; facilitating inclusive \ninternational cooperation to formulate and use effective, internationally interoperable \nsafeguards, practices and standards that promote innovation and prevent the \nfragmentation of the governance of safe, secure and trustworthy artificial intelligence \nsystems; and recognizing also existing artificial intelligence and other digital divides, \nand the varying levels of technological development between and within countries, \nthat developing countries face unique challenges in keeping pace with this rapid \nacceleration, which cause obstacles to sustainable development, the need to narrow \nthe existing disparities between developed and developing countries in terms of \nconditions, possibilities and capacities, therefore stressing also the urgency of \nstrengthening capacity building and technical and financial assistance to developing \ncountries to close digital divides between and within countries and support developing \ncountries\u2019 effective, equitable and meaningful participation and representation in \ninternational processes and forums on the governance of artificial intelligence systems, \n \nRecognizing also that the governance of artificial intelligence systems is an \nevolving area and the need for continued discussions on possible governance \napproaches that are appropriate, based on international law, interoperable, agile, \nadaptable, inclusive, responsive to the different needs and capacities of developed \nand developing countries alike and for the benefit of all, as the technology and our \nunderstanding of it develops, \n \n1. \nResolves to bridge the artificial intelligence and other digital divides \nbetween and within countries; \n \n2. \nResolves to promote safe, secure and trustworthy artificial intelligence \nsystems to accelerate progress towards the full realization of the 2030 Agenda for \nSustainable Development, 10  further bridging the artificial intelligence and other \ndigital divides between and within countries; and stresses the need for the standard of \nsafe, secure and trustworthy artificial intelligence systems to promote, not hinder, \ndigital transformation and equitable access to their benefits in order to achieve all 17 \nSustainable Development Goals and sustainable development in its three \ndimensions \u2013 economic, social and environmental \u2013 and address other shared global \nchallenges, particularly for developing countries; \n \n3. \nEncourages Member States and invites multi-stakeholders from all regions \nand countries, within their respective roles and responsibilities, including from the \nprivate sector, international and regional organizations, civil society, the media, \nacademia and research institutions and technical communities and individuals, to \ndevelop and support regulatory and governance approaches and frameworks related \nto safe, secure and trustworthy artificial intelligence systems that create an enabling \necosystem at all levels, including for innovation, entrepreneurship and the \ndissemination of knowledge and technologies on mutually agreed terms, recognizing \nthat \neffective \npartnership \nand \ncooperation \nbetween \nGovernments \nand \nmulti-stakeholders is necessary in developing such approaches and frameworks; \n \n4. \nCalls upon Member States and invites other stakeholders to take action to \ncooperate with and provide assistance to developing countries towards inclusive and \n__________________ \n \n10 Resolution 70/1. \n\nA/RES/78/265 \nSeizing the opportunities of safe, secure and trustworthy artificial \nintelligence systems for sustainable development\n \n24-05969\n4/8 \n \nequitable access to the benefits of digital transformation and safe, secure and \ntrustworthy artificial intelligence systems, including by: \n \n(a) \nExpanding participation of all countries, in particular developing \ncountries, in digital transformation to harness the benefits and effectively participate \nin the development, deployment and use of safe, secure and trustworthy artificial \nintelligence systems, including by capacity building relating to artificial intelligence \nsystems, recognizing that promoting knowledge sharing activities and the transfer of \ntechnology on mutually agreed terms is an important aspect of building capacity, \nstressing the need to close the artificial intelligence and other digital divides; and \nincrease digital literacy;  \n \n(b) \nEnhancing digital infrastructure connectivity and access to technological \ninnovations through stronger partnerships to help developing countries effectively \nparticipate throughout the life cycle of artificial intelligence systems and accelerate \nthe inclusive and positive contribution of artificial intelligence systems to society, \nincluding towards the full realization of the 2030 Agenda and its Sustainable \nDevelopment Goals, while ensuring that artificial intelligence systems around the \nworld are safe, secure and trustworthy throughout their life cycle; \n \n(c) \nEnhancing the ability of developing countries, in particular the least \ndeveloped countries, to address major structural impediments and lift obstacles to \naccessing the benefits of new and emerging technologies and artificial intelligence \ninnovation to achieve all 17 Sustainable Development Goals, including through \nscaling up the use of scientific sources, affordable technology, research and \ndevelopment, including through strengthened partnerships; \n \n(d) \nAiming to increase funding for Sustainable Development Goals related \nresearch and innovation related to digital technologies and safe, secure and \ntrustworthy artificial intelligence systems and build capacity in all regions and \ncountries to contribute to and benefit from this research; \n \n(e) \nEnabling international innovation-based environments to enhance the \nability of developing countries to develop technical expertise and capacities, harness \ndata and compute resources, and national regulatory and governance approaches, \nframeworks and procurement capacity, and create an inclusive enabling environment \nat all levels for safe, secure and trustworthy artificial intelligence systems-based \nsolutions; \n \n(f) \nUrgently mobilizing means of implementation such as technology transfer \non mutually agreed terms, capacity building to close the artificial intelligence and \nother digital divides, technical assistance and financing to developing countries \nrelated to artificial intelligence systems in accordance with developing countries\u2019 \nnational needs, policies and priorities;  \n \n(g) \nPromoting the access to and design, development, deployment and use of \nsafe, secure and trustworthy artificial intelligence systems to achieve sustainable \ndevelopment in its three dimensions \u2013 economic, social and environmental; \n \n5. \nEmphasizes that human rights and fundamental freedoms must be \nrespected, protected and promoted throughout the life cycle of artificial intelligence \nsystems, calls upon all Member States and, where applicable, other stakeholders to \nrefrain from or cease the use of artificial intelligence systems that are impossible to \noperate in compliance with international human rights law or that pose undue risks to \nthe enjoyment of human rights, especially of those who are in vulnerable situations, \nand reaffirms that the same rights that people have offline must also be protected \nonline, including throughout the life cycle of artificial intelligence systems; \n\nSeizing the opportunities of safe, secure and trustworthy artificial \nintelligence systems for sustainable development \nA/RES/78/265\n \n5/8\n24-05969 \n \n \n6. \nEncourages all Member States, where appropriate, in line with their \nnational priorities and circumstances and while implementing their distinct national \nregulatory and governance approaches and frameworks, and, where applicable, other \nstakeholders to promote safe, secure and trustworthy artificial intelligence systems in \nan inclusive and equitable manner, and for the benefit of all, and foster an enabling \nenvironment for such systems to address the world\u2019s greatest challenges, including \nachieving sustainable development in its three dimensions \u2013 economic, social and \nenvironmental \u2013 with specific consideration of developing countries and leaving no \none behind by: \n \n(a) \nPromoting the development and implementation of domestic regulatory \nand governance approaches and frameworks, in line with their respective national, \nand where applicable subnational, policies and priorities and obligations under \ninternational law, to support responsible and inclusive artificial intelligence \ninnovation and investment for sustainable development, while simultaneously \npromoting safe, secure and trustworthy artificial intelligence systems; \n \n(b) \nEncouraging effective measures, that promote innovation for the \ninternationally interoperable identification, classification, evaluation, testing, \nprevention and mitigation of vulnerabilities and risks during the design and \ndevelopment and prior to the deployment and use of artificial intelligence systems; \n \n(c) \nEncouraging the incorporation of feedback mechanisms to allow evidence-\nbased discovery and reporting by end-users and third parties of technical \nvulnerabilities and, as appropriate, misuses of artificial intelligence systems and \nartificial intelligence incidents following their development, testing and deployment \nto address them; \n \n(d) \nRaising public awareness and understanding of the core functions, \ncapabilities, limitations and domains of appropriate civil use of artificial intelligence \nsystems; \n \n(e) \nFostering the development, implementation and disclosure of mechanisms \nof risk monitoring and management, mechanisms for securing data, including \npersonal data protection and privacy policies, as well as impact assessments as \nappropriate, across the life cycle of artificial intelligence systems; \n \n(f) \nStrengthening investment in developing and implementing effective \nsafeguards, including physical security, artificial intelligence systems security, and \nrisk management across the life cycle of artificial intelligence systems; \n \n(g) \nEncouraging the development and deployment of effective, accessible, \nadaptable, internationally interoperable technical tools, standards or practices, \nincluding reliable content authentication and provenance mechanisms \u2013 such as \nwatermarking or labelling, where technically feasible and appropriate, that enable \nusers to identify information manipulation, distinguish or determine the origins of \nauthentic digital content and artificial intelligence-generated or manipulated digital \ncontent \u2013 and increasing media and information literacy; \n \n(h) \nFacilitating \nthe \ndevelopment \nand \nimplementation \nof \neffective, \ninternationally interoperable frameworks, practices and standards for training and \ntesting artificial intelligence systems to enhance policymaking and to help protect \nindividuals from all forms of discrimination, bias, misuse or other harm, and avoid \nreinforcing or perpetuating discriminatory or biased applications and outcomes \nthroughout the life cycle of artificial intelligence systems, including, for example, by \nanalysing and mitigating bias encoded in datasets and otherwise combating \nalgorithmic discrimination and bias, while not inadvertently or disproportionally \nimpacting the positive development, access and uses of other users and beneficiaries; \n\nA/RES/78/265 \nSeizing the opportunities of safe, secure and trustworthy artificial \nintelligence systems for sustainable development\n \n24-05969\n6/8 \n \n \n(i) \nEncouraging, where appropriate and relevant, the implementation of \nappropriate safeguards to respect intellectual property rights, including copyright-\nprotected content, while promoting innovation; \n \n(j) \nSafeguarding privacy and the protection of personal data when testing and \nevaluating systems, and for transparency and reporting requirements in compliance \nwith applicable international, national and subnational legal frameworks, including \non the use of personal data throughout the life cycle of artificial intelligence systems; \n \n(k) \nPromoting transparency, predictability, reliability and understandability \nthroughout the life cycle of artificial intelligence systems that make or support \ndecisions impacting end-users, including providing notice and explanation, and \npromoting human oversight, such as, for example, through review of automated \ndecisions and related processes or, where appropriate and relevant, human decision-\nmaking alternatives or effective redress and accountability for those adversely \nimpacted by automated decisions of artificial intelligence systems; \n \n(l) \nStrengthening investment in developing and implementing effective \nsafeguards, including risk and impact assessments, throughout the life cycle of \nartificial intelligence systems to protect the exercise of and mitigate against the \npotential impact on the full and effective enjoyment of human rights and fundamental \nfreedoms; \n \n(m) Promoting artificial intelligence systems that advance, protect and \npreserve linguistic and cultural diversity, taking into account multilingualism in their \ntraining data and throughout the life cycle of the artificial intelligence system, \nparticularly for the large language models; \n \n(n) \nIntensifying information-sharing on mutually agreed terms among entities \nwith roles across the life cycle of artificial intelligence systems to identify, understand \nand act using scientific and evidence-based best practices, policies and approaches to \nartificial intelligence systems to maximize the benefits while mitigating the potential \nrisks across the life cycle of artificial intelligence systems, including advanced \nartificial intelligence systems; \n \n(o) \nEncouraging research and international cooperation to understand, balance \nand address the potential benefits and risks related to the role of artificial intelligence \nsystems in bridging digital divides and achieving all 17 Sustainable Development \nGoals, including the role of scaling up of digital solutions such as open-source \nartificial intelligence systems; \n \n(p) \nCalling upon Member States to adopt specific measures to close the gender \ndigital divide and to ensure that particular attention is paid to access, affordability, \ndigital literacy, privacy and online safety, to enhance the use of digital technologies, \nincluding artificial intelligence systems, and to mainstream a disability, gender and \nracial equality perspective in policy decisions and the frameworks that guide them;  \n \n(q) \nEncouraging research and international cooperation to develop measures \nfor the identification and assessment of the impacts of the deployment of artificial \nintelligence systems on labour markets, and providing support for the mitigation of \npotential negative consequences for workforces, especially in developing countries, \nin particular the least developed countries, and fostering programmes aimed at digital \ntraining, capacity building, supporting innovation and enhancing access to benefits of \nartificial intelligence systems; \n \n7. \nRecognizes also that data is fundamental to the development and operation \nof artificial intelligence systems; emphasizes that the fair, inclusive, responsible and \neffective data governance, improving data generation, accessibility and infrastructure, \nand the use of digital public goods are essential to harnessing the potential of safe, \n\nSeizing the opportunities of safe, secure and trustworthy artificial \nintelligence systems for sustainable development \nA/RES/78/265\n \n7/8\n24-05969 \n \nsecure and trustworthy artificial intelligence systems for sustainable development, \nand urges Member States to share best practices on data governance and to promote \ninternational cooperation, collaboration and assistance on data governance for greater \nconsistency and interoperability, where feasible, of approaches for advancing trusted \ncross-border data flows for safe, secure and trustworthy artificial intelligence systems, \nand make its development more inclusive, equitable, effective and beneficial to all; \n \n8. \nAcknowledges the importance of continuing the discussion on \ndevelopments in the area of artificial intelligence governance so that international \napproaches keep pace with the evolution of artificial intelligence systems and their \nuses; and encourages continued efforts by the international community to promote \ninclusive research, mapping and analysis that benefit all parties on the potential \nimpacts and applications that artificial intelligence systems and rapid technological \nchange can have in the development of existing and new and emerging technologies \nand on accelerating the achievement of all 17 Sustainable Development Goals, and to \ninform how to develop, promote and implement effective, internationally interoperable \nsafeguards, practices, standards and tools for artificial intelligence designers, \ndevelopers, evaluators, deployers, users and other stakeholders for safe, secure and \ntrustworthy artificial intelligence systems; as well as stresses the need for Governments, \nthe private sector, civil society, international and regional organizations, academia and \nresearch institutions and technical communities and all other stakeholders to continue \nto work together, as appropriate; as well as acknowledges the need for more cohesive, \neffective, coordinated and inclusive engagement and participation of all communities, \nparticularly from developing countries, in the inclusive governance of safe, secure and \ntrustworthy artificial intelligence systems; \n \n9. \nEncourages the private sector to adhere to applicable international and \ndomestic laws and act in line with the United Nations Guiding Principles on Business \nand Human Rights: Implementing the United Nations \u201cProtect, Respect and Remedy\u201d \nFramework; acknowledges the importance of more inclusive and equitable access to \nthe benefits of safe, secure and trustworthy artificial intelligence systems; and \nrecognizes the need for increased collaboration, including between and within the \npublic and private sectors and civil society, academia and research institutions and \ntechnical communities, to provide and promote fair, open, inclusive and \nnon-discriminatory business environment, economic and commercial activities, \ncompetitive ecosystems and marketplaces across the life cycle of safe, secure and \ntrustworthy artificial intelligence; as well as encourages Member States to develop \npolicies and regulations to promote competition in safe, secure and trustworthy \nartificial intelligence systems and related technologies, including by supporting and \nenabling new opportunities for small businesses and entrepreneurs and technical \ntalent, and enabling fair competition in the artificial intelligence marketplace, through \ncritical investment, especially for developing countries; \n \n10. Calls upon specialized agencies, funds, programmes, other entities, bodies \nand offices, and related organizations of the United Nations system, within their \nrespective mandates and resources, to continue to assess and enhance their response \nto leverage the opportunities and address the challenges posed by artificial \nintelligence systems in a collaborative, coordinated and inclusive manner, through \nappropriate inter-agency mechanisms, including by conducting research, mapping \nand analysis that benefit all parties on the potential impacts and applications; \nreporting on progress and challenges in addressing issues; and cooperating with and \nassisting developing countries in capacity building, access and sharing the benefits of \nsafe, secure and trustworthy artificial intelligence systems in achieving all \n17 Sustainable Development Goals and sustainable development in its three \ndimensions \u2013 economic, social and environmental; stressing the need to close \nartificial intelligence and other digital divides between and within countries; \n\nA/RES/78/265 \nSeizing the opportunities of safe, secure and trustworthy artificial \nintelligence systems for sustainable development\n \n24-05969\n8/8 \n \n \n11. \nRecalls its resolution 76/307 of 8 September 2022 and its decision 77/568 \nof 1 September 2023 on the modalities and the scope of the Summit of the Future and, \nin this regard, looks forward to the development of a global digital compact; \n \n12. Looks forward also to the overall review by the General Assembly, in \n2025, of the progress made since the World Summit on the Information Society; \n \n13. Acknowledges that the United Nations system, consistent with its mandate, \nuniquely contributes to reaching global consensus on safe, secure and trustworthy \nartificial intelligence systems, that is consistent with international law, in particular \nthe Charter of the United Nations; the Universal Declaration of Human Rights; and \nthe 2030 Agenda for Sustainable Development, including by promoting inclusive \ninternational cooperation and facilitating the inclusion, participation and \nrepresentation of developing countries in deliberations. \n \n63rd plenary meeting \n21 March 2024 \n \n",
  "paragraphs": {
    "1": "Resolves to bridge the artificial intelligence and other digital divides between and within countries;",
    "2": "Resolves to promote safe, secure and trustworthy artificial intelligence systems to accelerate progress towards the full realization of the 2030 Agenda for Sustainable Development, 10 further bridging the artificial intelligence and other digital divides between and within countries; and stresses the need for the standard of safe, secure and trustworthy artificial intelligence systems to promote, not hinder, digital transformation and equitable access to their benefits in order to achieve all 17 Sustainable Development Goals and sustainable development in its three dimensions \u2013 economic, social and environmental \u2013 and address other shared global challenges, particularly for developing countries;",
    "3": "Encourages Member States and invites multi-stakeholders from all regions and countries, within their respective roles and responsibilities, including from the private sector, international and regional organizations, civil society, the media, academia and research institutions and technical communities and individuals, to develop and support regulatory and governance approaches and frameworks related to safe, secure and trustworthy artificial intelligence systems that create an enabling ecosystem at all levels, including for innovation, entrepreneurship and the dissemination of knowledge and technologies on mutually agreed terms, recognizing that effective partnership and cooperation between Governments and multi-stakeholders is necessary in developing such approaches and frameworks;",
    "4": "Calls upon Member States and invites other stakeholders to take action to cooperate with and provide assistance to developing countries towards inclusive and __________________ 10 Resolution 70/1. A/RES/78/265 Seizing the opportunities of safe, secure and trustworthy artificial intelligence systems for sustainable development 24-05969 4/8 equitable access to the benefits of digital transformation and safe, secure and trustworthy artificial intelligence systems, including by: (a) Expanding participation of all countries, in particular developing countries, in digital transformation to harness the benefits and effectively participate in the development, deployment and use of safe, secure and trustworthy artificial intelligence systems, including by capacity building relating to artificial intelligence systems, recognizing that promoting knowledge sharing activities and the transfer of technology on mutually agreed terms is an important aspect of building capacity, stressing the need to close the artificial intelligence and other digital divides; and increase digital literacy; (b) Enhancing digital infrastructure connectivity and access to technological innovations through stronger partnerships to help developing countries effectively participate throughout the life cycle of artificial intelligence systems and accelerate the inclusive and positive contribution of artificial intelligence systems to society, including towards the full realization of the 2030 Agenda and its Sustainable Development Goals, while ensuring that artificial intelligence systems around the world are safe, secure and trustworthy throughout their life cycle; (c) Enhancing the ability of developing countries, in particular the least developed countries, to address major structural impediments and lift obstacles to accessing the benefits of new and emerging technologies and artificial intelligence innovation to achieve all 17 Sustainable Development Goals, including through scaling up the use of scientific sources, affordable technology, research and development, including through strengthened partnerships; (d) Aiming to increase funding for Sustainable Development Goals related research and innovation related to digital technologies and safe, secure and trustworthy artificial intelligence systems and build capacity in all regions and countries to contribute to and benefit from this research; (e) Enabling international innovation-based environments to enhance the ability of developing countries to develop technical expertise and capacities, harness data and compute resources, and national regulatory and governance approaches, frameworks and procurement capacity, and create an inclusive enabling environment at all levels for safe, secure and trustworthy artificial intelligence systems-based solutions; (f) Urgently mobilizing means of implementation such as technology transfer on mutually agreed terms, capacity building to close the artificial intelligence and other digital divides, technical assistance and financing to developing countries related to artificial intelligence systems in accordance with developing countries\u2019 national needs, policies and priorities; (g) Promoting the access to and design, development, deployment and use of safe, secure and trustworthy artificial intelligence systems to achieve sustainable development in its three dimensions \u2013 economic, social and environmental;",
    "5": "Emphasizes that human rights and fundamental freedoms must be respected, protected and promoted throughout the life cycle of artificial intelligence systems, calls upon all Member States and, where applicable, other stakeholders to refrain from or cease the use of artificial intelligence systems that are impossible to operate in compliance with international human rights law or that pose undue risks to the enjoyment of human rights, especially of those who are in vulnerable situations, and reaffirms that the same rights that people have offline must also be protected online, including throughout the life cycle of artificial intelligence systems; Seizing the opportunities of safe, secure and trustworthy artificial intelligence systems for sustainable development A/RES/78/265 5/8 24-05969",
    "6": "Encourages all Member States, where appropriate, in line with their national priorities and circumstances and while implementing their distinct national regulatory and governance approaches and frameworks, and, where applicable, other stakeholders to promote safe, secure and trustworthy artificial intelligence systems in an inclusive and equitable manner, and for the benefit of all, and foster an enabling environment for such systems to address the world\u2019s greatest challenges, including achieving sustainable development in its three dimensions \u2013 economic, social and environmental \u2013 with specific consideration of developing countries and leaving no one behind by: (a) Promoting the development and implementation of domestic regulatory and governance approaches and frameworks, in line with their respective national, and where applicable subnational, policies and priorities and obligations under international law, to support responsible and inclusive artificial intelligence innovation and investment for sustainable development, while simultaneously promoting safe, secure and trustworthy artificial intelligence systems; (b) Encouraging effective measures, that promote innovation for the internationally interoperable identification, classification, evaluation, testing, prevention and mitigation of vulnerabilities and risks during the design and development and prior to the deployment and use of artificial intelligence systems; (c) Encouraging the incorporation of feedback mechanisms to allow evidence- based discovery and reporting by end-users and third parties of technical vulnerabilities and, as appropriate, misuses of artificial intelligence systems and artificial intelligence incidents following their development, testing and deployment to address them; (d) Raising public awareness and understanding of the core functions, capabilities, limitations and domains of appropriate civil use of artificial intelligence systems; (e) Fostering the development, implementation and disclosure of mechanisms of risk monitoring and management, mechanisms for securing data, including personal data protection and privacy policies, as well as impact assessments as appropriate, across the life cycle of artificial intelligence systems; (f) Strengthening investment in developing and implementing effective safeguards, including physical security, artificial intelligence systems security, and risk management across the life cycle of artificial intelligence systems; (g) Encouraging the development and deployment of effective, accessible, adaptable, internationally interoperable technical tools, standards or practices, including reliable content authentication and provenance mechanisms \u2013 such as watermarking or labelling, where technically feasible and appropriate, that enable users to identify information manipulation, distinguish or determine the origins of authentic digital content and artificial intelligence-generated or manipulated digital content \u2013 and increasing media and information literacy; (h) Facilitating the development and implementation of effective, internationally interoperable frameworks, practices and standards for training and testing artificial intelligence systems to enhance policymaking and to help protect individuals from all forms of discrimination, bias, misuse or other harm, and avoid reinforcing or perpetuating discriminatory or biased applications and outcomes throughout the life cycle of artificial intelligence systems, including, for example, by analysing and mitigating bias encoded in datasets and otherwise combating algorithmic discrimination and bias, while not inadvertently or disproportionally impacting the positive development, access and uses of other users and beneficiaries; A/RES/78/265 Seizing the opportunities of safe, secure and trustworthy artificial intelligence systems for sustainable development 24-05969 6/8 (i) Encouraging, where appropriate and relevant, the implementation of appropriate safeguards to respect intellectual property rights, including copyright- protected content, while promoting innovation; (j) Safeguarding privacy and the protection of personal data when testing and evaluating systems, and for transparency and reporting requirements in compliance with applicable international, national and subnational legal frameworks, including on the use of personal data throughout the life cycle of artificial intelligence systems; (k) Promoting transparency, predictability, reliability and understandability throughout the life cycle of artificial intelligence systems that make or support decisions impacting end-users, including providing notice and explanation, and promoting human oversight, such as, for example, through review of automated decisions and related processes or, where appropriate and relevant, human decision- making alternatives or effective redress and accountability for those adversely impacted by automated decisions of artificial intelligence systems; (l) Strengthening investment in developing and implementing effective safeguards, including risk and impact assessments, throughout the life cycle of artificial intelligence systems to protect the exercise of and mitigate against the potential impact on the full and effective enjoyment of human rights and fundamental freedoms; (m) Promoting artificial intelligence systems that advance, protect and preserve linguistic and cultural diversity, taking into account multilingualism in their training data and throughout the life cycle of the artificial intelligence system, particularly for the large language models; (n) Intensifying information-sharing on mutually agreed terms among entities with roles across the life cycle of artificial intelligence systems to identify, understand and act using scientific and evidence-based best practices, policies and approaches to artificial intelligence systems to maximize the benefits while mitigating the potential risks across the life cycle of artificial intelligence systems, including advanced artificial intelligence systems; (o) Encouraging research and international cooperation to understand, balance and address the potential benefits and risks related to the role of artificial intelligence systems in bridging digital divides and achieving all 17 Sustainable Development Goals, including the role of scaling up of digital solutions such as open-source artificial intelligence systems; (p) Calling upon Member States to adopt specific measures to close the gender digital divide and to ensure that particular attention is paid to access, affordability, digital literacy, privacy and online safety, to enhance the use of digital technologies, including artificial intelligence systems, and to mainstream a disability, gender and racial equality perspective in policy decisions and the frameworks that guide them; (q) Encouraging research and international cooperation to develop measures for the identification and assessment of the impacts of the deployment of artificial intelligence systems on labour markets, and providing support for the mitigation of potential negative consequences for workforces, especially in developing countries, in particular the least developed countries, and fostering programmes aimed at digital training, capacity building, supporting innovation and enhancing access to benefits of artificial intelligence systems;",
    "7": "Recognizes also that data is fundamental to the development and operation of artificial intelligence systems; emphasizes that the fair, inclusive, responsible and effective data governance, improving data generation, accessibility and infrastructure, and the use of digital public goods are essential to harnessing the potential of safe, Seizing the opportunities of safe, secure and trustworthy artificial intelligence systems for sustainable development A/RES/78/265 7/8 24-05969 secure and trustworthy artificial intelligence systems for sustainable development, and urges Member States to share best practices on data governance and to promote international cooperation, collaboration and assistance on data governance for greater consistency and interoperability, where feasible, of approaches for advancing trusted cross-border data flows for safe, secure and trustworthy artificial intelligence systems, and make its development more inclusive, equitable, effective and beneficial to all;",
    "8": "Acknowledges the importance of continuing the discussion on developments in the area of artificial intelligence governance so that international approaches keep pace with the evolution of artificial intelligence systems and their uses; and encourages continued efforts by the international community to promote inclusive research, mapping and analysis that benefit all parties on the potential impacts and applications that artificial intelligence systems and rapid technological change can have in the development of existing and new and emerging technologies and on accelerating the achievement of all 17 Sustainable Development Goals, and to inform how to develop, promote and implement effective, internationally interoperable safeguards, practices, standards and tools for artificial intelligence designers, developers, evaluators, deployers, users and other stakeholders for safe, secure and trustworthy artificial intelligence systems; as well as stresses the need for Governments, the private sector, civil society, international and regional organizations, academia and research institutions and technical communities and all other stakeholders to continue to work together, as appropriate; as well as acknowledges the need for more cohesive, effective, coordinated and inclusive engagement and participation of all communities, particularly from developing countries, in the inclusive governance of safe, secure and trustworthy artificial intelligence systems;",
    "9": "Encourages the private sector to adhere to applicable international and domestic laws and act in line with the United Nations Guiding Principles on Business and Human Rights: Implementing the United Nations \u201cProtect, Respect and Remedy\u201d Framework; acknowledges the importance of more inclusive and equitable access to the benefits of safe, secure and trustworthy artificial intelligence systems; and recognizes the need for increased collaboration, including between and within the public and private sectors and civil society, academia and research institutions and technical communities, to provide and promote fair, open, inclusive and non-discriminatory business environment, economic and commercial activities, competitive ecosystems and marketplaces across the life cycle of safe, secure and trustworthy artificial intelligence; as well as encourages Member States to develop policies and regulations to promote competition in safe, secure and trustworthy artificial intelligence systems and related technologies, including by supporting and enabling new opportunities for small businesses and entrepreneurs and technical talent, and enabling fair competition in the artificial intelligence marketplace, through critical investment, especially for developing countries;",
    "10": "Calls upon specialized agencies, funds, programmes, other entities, bodies and offices, and related organizations of the United Nations system, within their respective mandates and resources, to continue to assess and enhance their response to leverage the opportunities and address the challenges posed by artificial intelligence systems in a collaborative, coordinated and inclusive manner, through appropriate inter-agency mechanisms, including by conducting research, mapping and analysis that benefit all parties on the potential impacts and applications; reporting on progress and challenges in addressing issues; and cooperating with and assisting developing countries in capacity building, access and sharing the benefits of safe, secure and trustworthy artificial intelligence systems in achieving all 17 Sustainable Development Goals and sustainable development in its three dimensions \u2013 economic, social and environmental; stressing the need to close artificial intelligence and other digital divides between and within countries; A/RES/78/265 Seizing the opportunities of safe, secure and trustworthy artificial intelligence systems for sustainable development 24-05969 8/8",
    "11": "Recalls its resolution 76/307 of 8 September 2022 and its decision 77/568 of 1 September 2023 on the modalities and the scope of the Summit of the Future and, in this regard, looks forward to the development of a global digital compact;",
    "12": "Looks forward also to the overall review by the General Assembly, in 2025, of the progress made since the World Summit on the Information Society;",
    "13": "Acknowledges that the United Nations system, consistent with its mandate, uniquely contributes to reaching global consensus on safe, secure and trustworthy artificial intelligence systems, that is consistent with international law, in particular the Charter of the United Nations; the Universal Declaration of Human Rights; and the 2030 Agenda for Sustainable Development, including by promoting inclusive international cooperation and facilitating the inclusion, participation and representation of developing countries in deliberations. 63rd plenary meeting 21 March 2024"
  },
  "agenda_items": [
    "Item 13"
  ],
  "symbol_references": [
    "A/78/L.49"
  ]
}