{
  "symbol": "A/RES/73/216",
  "filename": "A_RES_73_216.pdf",
  "title": "73/216.  Observer status for the Asian Infrastructure Investment Bank in the General Assembly",
  "text": "United Nations \nA/RES/73/216\n \n \nGeneral Assembly \nDistr.: General \n11 January 2019 \n \n18-22535 (E)    150119     \n*1822535* \n \n \nSeventy-third session \nAgenda item 177 \n \n \n \n \n Resolution adopted by the General Assembly \non 20 December 2018 \n \n \n \n \n[on the report of the Sixth Committee (A/73/464)] \n \n \n 73/216.  Observer status for the Asian Infrastructure Investment Bank \nin the General Assembly \n \n \n \nThe General Assembly, \n \nWishing to promote cooperation between the United Nations and the Asian \nInfrastructure Investment Bank, \n \n1. \nDecides to invite the Asian Infrastructure Investment Bank to participate \nin the sessions and the work of the General Assembly in the capacity of observer; \n \n2. \nRequests the Secretary-General to take the action necessary to implement \nthe present resolution. \n \n62nd plenary meeting  \n20 December 2018 \n \n",
  "paragraphs": {
    "1": "Decides to invite the Asian Infrastructure Investment Bank to participate in the sessions and the work of the General Assembly in the capacity of observer;",
    "2": "Requests the Secretary-General to take the action necessary to implement the present resolution."
  },
  "agenda_items": [
    "Item 177"
  ],
  "symbol_references": []
}