{
  "symbol": "A/RES/72/4",
  "filename": "A_RES_72_4.pdf",
  "title": "72/4. Necessity of ending the economic, commercial and financial embargo imposed by the United States of America against Cuba",
  "text": "United Nations \nA/RES/72/4\n \n \nGeneral Assembly \nDistr.: General \n10 November 2017 \n \n17-19321 (E)    011117    011117 \n*1719321* \n \n \nSeventy-second session \nAgenda item 42 \n \n \n \n \n Resolution adopted by the General Assembly \non 1 November 2017 \n \n \n \n \n[without reference to a Main Committee (A/72/L.2)] \n \n \n \n72/4. Necessity of ending the economic, commercial and financial \nembargo imposed by the United States of America against Cuba \n \n \n \nThe General Assembly, \n \nDetermined to encourage strict compliance with the purposes and principles \nenshrined in the Charter of the United Nations, \n \nReaffirming, among other principles, the sovereign equality of States, \nnon-intervention and non-interference in their internal affairs and freedom of \ninternational trade and navigation, which are also enshrined in many international \nlegal instruments, \n \nRecalling the statements of the Heads of State or Government of Latin \nAmerica and the Caribbean at the Summits of the Community of Latin American \nand Caribbean States regarding the need to put an end to the economic, commercial \nand financial embargo imposed against Cuba, \n \nConcerned about the continued promulgation and application by Member \nStates of laws and regulations, such as that promulgated on 12 March 1996 known \nas \u201cthe Helms-Burton Act\u201d, the extraterritorial effects of which affect the \nsovereignty of other States, the legitimate interests of entities or persons under their \njurisdiction and the freedom of trade and navigation, \n \nTaking note of declarations and resolutions of different intergovernmental \nforums, bodies and Governments that express the rejection by the international \ncommunity and public opinion of the promulgation and application of measures of \nthe kind referred to above, \n \nRecalling its resolutions 47/19 of 24 November 1992, 48/16 of 3 November \n1993, 49/9 of 26 October 1994, 50/10 of 2 November 1995, 51/17 of 12 November \n1996, 52/10 of 5 November 1997, 53/4 of 14 October 1998, 54/21 of 9 November \n1999, 55/20 of 9 November 2000, 56/9 of 27 November 2001, 57/11 of \n12 November 2002, 58/7 of 4 November 2003, 59/11 of 28 October 2004, 60/12 of \n\nA/RES/72/4 \nNecessity of ending the economic, commercial and financial embargo\nimposed by the United States of America against Cuba\n \n17-19321 \n2/2 \n \n8 November 2005, 61/11 of 8 November 2006, 62/3 of 30 October 2007, 63/7 of \n29 October 2008, 64/6 of 28 October 2009, 65/6 of 26 October 2010, 66/6 of \n25 October 2011, 67/4 of 13 November 2012, 68/8 of 29 October 2013, 69/5 of \n28 October 2014, 70/5 of 27 October 2015 and 71/5 of 26 October 2016, \n \nRecalling also the measures adopted by the Executive of the United States of \nAmerica in 2015 and 2016 to modify several aspects of the application of the \nembargo, which contrast with the measures announced on 16 June 2017 to reinforce \nits implementation, \n \nConcerned that, since the adoption of its resolutions 47/19, 48/16, 49/9, 50/10, \n51/17, 52/10, 53/4, 54/21, 55/20, 56/9, 57/11, 58/7, 59/11, 60/12, 61/11, 62/3, 63/7, \n64/6, 65/6, 66/6, 67/4, 68/8, 69/5, 70/5 and 71/5, the economic, commercial and \nfinancial embargo against Cuba is still in place, and concerned also about the \nadverse effects of such measures on the Cuban people and on Cuban nationals living \nin other countries, \n \n1. \nTakes note of the report of the Secretary-General on the implementation \nof resolution 71/5;1 \n \n2. \nReiterates its call upon all States to refrain from promulgating and \napplying laws and measures of the kind referred to in the preamble to the present \nresolution, in conformity with their obligations under the Charter of the United \nNations and international law, which, inter alia, reaffirm the freedom of trade and \nnavigation; \n \n3. \nOnce again urges States that have and continue to apply such laws and \nmeasures to take the steps necessary to repeal or invalidate them as soon as possible \nin accordance with their legal regime; \n \n4. \nRequests the Secretary-General, in consultation with the appropriate \norgans and agencies of the United Nations system, to prepare a report on the \nimplementation of the present resolution in the light of the purposes and principles \nof the Charter and international law and to submit it to the General Assembly at its \nseventy-third session; \n \n5. \nDecides to include in the provisional agenda of its seventy-third session \nthe item entitled \u201cNecessity of ending the economic, commercial and financial \nembargo imposed by the United States of America against Cuba\u201d. \n \n38th plenary meeting \n1 November 2017 \n \n__________________ \n \n1  A/72/94. \n",
  "paragraphs": {
    "1": "Takes note of the report of the Secretary-General on the implementation of resolution 71/5;1",
    "2": "Reiterates its call upon all States to refrain from promulgating and applying laws and measures of the kind referred to in the preamble to the present resolution, in conformity with their obligations under the Charter of the United Nations and international law, which, inter alia, reaffirm the freedom of trade and navigation;",
    "3": "Once again urges States that have and continue to apply such laws and measures to take the steps necessary to repeal or invalidate them as soon as possible in accordance with their legal regime;",
    "4": "Requests the Secretary-General, in consultation with the appropriate organs and agencies of the United Nations system, to prepare a report on the implementation of the present resolution in the light of the purposes and principles of the Charter and international law and to submit it to the General Assembly at its seventy-third session;",
    "5": "Decides to include in the provisional agenda of its seventy-third session the item entitled \u201cNecessity of ending the economic, commercial and financial embargo imposed by the United States of America against Cuba\u201d."
  },
  "agenda_items": [
    "Item 42"
  ],
  "symbol_references": [
    "A/72/L.2"
  ]
}