{
  "symbol": "A/RES/72/302",
  "filename": "A_RES_72_302.pdf",
  "title": "72/302. Financing of the activities arising from Security Council resolution 1863 (2009)",
  "text": "United Nations \nA/RES/72/302\n \n \nGeneral Assembly \nDistr.: General \n17 July 2018 \n \n18-11319 (E)    190718     \n*1811319* \n \n \nSeventy-second session \nAgenda item 164 \n \n \n \n \n Resolution adopted by the General Assembly on 5 July 2018 \n \n \n \n \n[on the report of the Fifth Committee (A/72/912)] \n \n \n 72/302. Financing of the activities arising from Security Council \nresolution 1863 (2009) \n \n \n \nThe General Assembly, \n \nHaving considered the reports of the Secretary-General on the financing of the \nUnited Nations Support Office in Somalia 1 and the related report of the Advisory \nCommittee on Administrative and Budgetary Questions,2 \n \nRecalling Security Council resolution 1863 (2009) of 16 January 2009, in which \nthe Council expressed its intent to establish a United Nations peacekeeping operation \nin Somalia as a follow-on force to the African Union Mission in Somalia, subject to \na further decision of the Council by 1 June 2009, and requested the Secretary-General, \nin order for the forces of the Mission to be incorporated into a United Nations \npeacekeeping operation, to provide a United Nations logistical support package to the \nMission, including equipment and services,  \n \nRecalling also the subsequent resolutions of the Security Council by which the \nlogistical support package for the Mission was extended, the latest of which was \nresolution 2415 (2018) of 15 May 2018, by which the Council extended the logistical \nsupport package until 31 July 2018,  \n \nRecalling further its resolution 63/275 A of 7 April 2009 on the financing of the \nactivities arising from Security Council resolution 1863 (2009) and its subsequent \nresolutions thereon, the latest of which was resolution 71/311 of 30 June 2017,  \n \nReaffirming the general principles underlying the financing of United Nations \npeacekeeping operations, as stated in its resolutions 1874 (S-IV) of 27 June 1963, \n3101 (XXVIII) of 11 December 1973 and 55/235 of 23 December 2000,  \n \nNoting with appreciation that voluntary contributions have been made to the \nUnited Nations trust fund established to support the African Union Mission in \nSomalia,  \n__________________ \n \n1  A/72/650 and A/72/763. \n \n2  A/72/789/Add.6. \n\nA/RES/72/302 \nFinancing of the activities arising from Security Council resolution 1863 (2009)\n \n18-11319\n2/4 \n \n \nMindful of the fact that the Support Office operates in a hostile environment and \nthat it is essential to provide it with the financial resources necessary to enable it to \nfulfil its mandate, \n \n1. \nTakes note of the status of contributions to the United Nations Support \nOffice in Somalia as at 30 April 2018, including the contributions outstanding in the \namount of 178.3 million United States dollars, representing some 5 per cent of the \ntotal assessed contributions, notes with concern that only 87 Member States have paid \ntheir assessed contributions in full, and urges all other Member States, in particular \nthose in arrears, to ensure payment of their outstanding assessed contributions;  \n \n2. \nEndorses the conclusions and recommendations contained in the report of \nthe Advisory Committee on Administrative and Budgetary Questions, 2 subject to the \nprovisions of the present resolution, and requests the Secretary-General to ensure \ntheir full implementation;  \n \n3. \nDecides to allocate an amount of 75,565,500 dollars for air operations \nfrom the overall resources for the Support Office;  \n \n4. \nAlso decides not to establish the post of Programme Management Officer \n(human rights due diligence policy) (P-4) in the immediate office of the Assistant \nSecretary-General;  \n \n5. \nRequests the Secretary-General to ensure the full implementation of the \nrelevant provisions of its resolutions 59/296 of 22 June 2005, 60/266 of 30 June 2006, \n61/276 of 29 June 2007, 64/269 of 24 June 2010, 65/289 of 30 June 2011, 66/264 of \n21 June 2012, 69/307 of 25 June 2015 and 70/286 of 17 June 2016, as well as other \nrelevant resolutions;  \n \n \n \nBudget performance report for the period from 1 July 2016 to 30 June 2017 \n \n \n6. \nTakes note of the report of the Secretary-General on the budget \nperformance of the Support Office for the period from 1 July 2016 to 30 June 2017;3 \n \n \n \nBudget estimates for the period from 1 July 2018 to 30 June 2019 \n \n \n7. \nDecides to appropriate to the Special Account for the United Nations \nSupport Office in Somalia the amount of 597,034,000 dollars for the period from \n1 July 2018 to 30 June 2019, inclusive of 558,152,300 dollars for the maintenance of \nthe Support Office, 28,809,000 dollars for the support account for peacekeeping \noperations, 7,247,700 dollars for the United Nations Logistics Base at Brindisi, Italy, \nand 2,825,000 dollars for the Regional Service Centre in Entebbe, Uganda; \n \n \n \nFinancing of the appropriation \n \n \n8. \nDecides to apportion among Member States the amount of 49,752,833 \ndollars for the period from 1 to 31 July 2018, in accordance with the levels updated \nin its resolution 70/246 of 23 December 2015, taking into account the scale of \nassessments for 2018, as set out in its resolution 70/245 of 23 December 2015; \n \n9. \nAlso decides that, in accordance with the provisions of its resolution \n973 (X) of 15 December 1955, there shall be set off against the apportionment among \nMember States, as provided for in paragraph 8 above, their respective share in the \nTax Equalization Fund of 811,300 dollars, comprising the estimated staff assessment \nincome of 541,933 dollars approved for the Support Office, the prorated share of \n193,992 dollars of the estimated staff assessment income approved for the support \naccount, the prorated share of 51,783 dollars of the estimated staff assessment income \n__________________ \n \n3  A/72/650. \n\nFinancing of the activities arising from Security Council resolution 1863 (2009) \nA/RES/72/302\n \n3/4\n18-11319 \n \napproved for the United Nations Logistics Base and the prorated share of \n23,592 dollars of the estimated staff assessment income approved for the Regional \nService Centre;  \n \n10. Further decides to apportion among Member States the amount of \n248,764,167 dollars for the period from 1 August to 31 December 2018, at a monthly \nrate of 49,752,833 dollars, in accordance with the levels updated in its resolution \n70/246, taking into account the scale of assessments for 2018, as set out in its \nresolution 70/245, subject to a decision of the Security Council to extend the mandate \nof the Support Office;  \n \n11. \nDecides that, in accordance with the provisions of its resolution 973 (X), \nthere shall be set off against the apportionment among Member States, as provided \nfor in paragraph 10 above, their respective share in the Tax Equalization Fund of \n4,056,500 dollars, comprising the estimated staff assessment income of 2,709,667 \ndollars approved for the Support Office, the prorated share of 969,958 dollars of the \nestimated staff assessment income approved for the support account, the prorated \nshare of 258,917 dollars of the estimated staff assessment income approved for the \nUnited Nations Logistics Base and the prorated share of 117,958 dollars of the \nestimated staff assessment income approved for the Regional Service Centre;  \n \n12. Also decides to apportion among Member States the amount of \n298,517,000 dollars for the period from 1 January to 30 June 2019, at a monthly rate \nof 49,752,833 dollars, in accordance with the scale of assessments for 2019 and the \nupdated levels,4 subject to a decision of the Security Council to extend the mandate \nof the Support Office;  \n \n13. Further decides that, in accordance with the provisions of its resolution \n973 (X), there shall be set off against the apportionment among Member States, as \nprovided for in paragraph 12 above, their respective share in the Tax Equalization \nFund of 4,867,800 dollars, comprising the estimated staff assessment income of \n3,251,600 dollars approved for the Support Office, the prorated share of 1,163,950 \ndollars of the estimated staff assessment income approved for the support account, \nthe prorated share of 310,700 dollars of the estimated staff assessment income \napproved for the United Nations Logistics Base and the prorated share of 141,550 \ndollars of the estimated staff assessment income approved for the Regional Service \nCentre;  \n \n14. Decides that, for Member States that have fulfilled their financial \nobligations to the Support Office, there shall be set off against their apportionment, \nas provided for in paragraph 8 above, their respective share of the unencumbered \nbalance and other revenue in the amount of 16,558,400 dollars in respect of the \nfinancial period ended 30 June 2017, in accordance with the levels updated in its \nresolution 70/246, taking into account the scale of assessments for 2017, as set out in \nits resolution 70/245;  \n \n15. Also decides that, for Member States that have not fulfilled their financial \nobligations to the Support Office, there shall be set off against their outstanding \nobligations their respective share of the unencumbered balance and other revenue in \nthe amount of 16,558,400 dollars in respect of the financial period ended 30 June \n2017, in accordance with the scheme set out in paragraph 14 above;  \n \n16. Further decides that the increase of 688,600 dollars in the estimated staff \nassessment income in respect of the financial period ended 30 June 2017 shall be \nadded to the credits in the amount of 16,558,400 dollars referred to in paragraphs 14 \nand 15 above;  \n__________________ \n \n4  To be adopted by the General Assembly. \n\nA/RES/72/302 \nFinancing of the activities arising from Security Council resolution 1863 (2009)\n \n18-11319\n4/4 \n \n \n17. Invites voluntary contributions to the United Nations trust fund established \nto support the African Union Mission in Somalia;  \n \n18. Decides to include in the provisional agenda of its seventy-third session \nthe item entitled \u201cFinancing of the activities arising from Security Council resolution \n1863 (2009)\u201d.  \n \n104th plenary meeting  \n5 July 2018 \n \n",
  "paragraphs": {
    "1": "Takes note of the status of contributions to the United Nations Support Office in Somalia as at 30 April 2018, including the contributions outstanding in the amount of 178.3 million United States dollars, representing some 5 per cent of the total assessed contributions, notes with concern that only 87 Member States have paid their assessed contributions in full, and urges all other Member States, in particular those in arrears, to ensure payment of their outstanding assessed contributions;",
    "2": "Endorses the conclusions and recommendations contained in the report of the Advisory Committee on Administrative and Budgetary Questions, 2 subject to the provisions of the present resolution, and requests the Secretary-General to ensure their full implementation;",
    "3": "Decides to allocate an amount of 75,565,500 dollars for air operations from the overall resources for the Support Office;",
    "4": "Also decides not to establish the post of Programme Management Officer (human rights due diligence policy) (P-4) in the immediate office of the Assistant Secretary-General;",
    "5": "Requests the Secretary-General to ensure the full implementation of the relevant provisions of its resolutions 59/296 of 22 June 2005, 60/266 of 30 June 2006, 61/276 of 29 June 2007, 64/269 of 24 June 2010, 65/289 of 30 June 2011, 66/264 of 21 June 2012, 69/307 of 25 June 2015 and 70/286 of 17 June 2016, as well as other relevant resolutions; Budget performance report for the period from 1 July 2016 to 30 June 2017",
    "6": "Takes note of the report of the Secretary-General on the budget performance of the Support Office for the period from 1 July 2016 to 30 June 2017;3 Budget estimates for the period from 1 July 2018 to 30 June 2019",
    "7": "Decides to appropriate to the Special Account for the United Nations Support Office in Somalia the amount of 597,034,000 dollars for the period from 1 July 2018 to 30 June 2019, inclusive of 558,152,300 dollars for the maintenance of the Support Office, 28,809,000 dollars for the support account for peacekeeping operations, 7,247,700 dollars for the United Nations Logistics Base at Brindisi, Italy, and 2,825,000 dollars for the Regional Service Centre in Entebbe, Uganda; Financing of the appropriation",
    "8": "Decides to apportion among Member States the amount of 49,752,833 dollars for the period from 1 to 31 July 2018, in accordance with the levels updated in its resolution 70/246 of 23 December 2015, taking into account the scale of assessments for 2018, as set out in its resolution 70/245 of 23 December 2015;",
    "9": "Also decides that, in accordance with the provisions of its resolution 973 (X) of 15 December 1955, there shall be set off against the apportionment among Member States, as provided for in paragraph 8 above, their respective share in the Tax Equalization Fund of 811,300 dollars, comprising the estimated staff assessment income of 541,933 dollars approved for the Support Office, the prorated share of 193,992 dollars of the estimated staff assessment income approved for the support account, the prorated share of 51,783 dollars of the estimated staff assessment income approved for the United Nations Logistics Base and the prorated share of 23,592 dollars of the estimated staff assessment income approved for the Regional Service Centre;",
    "10": "Further decides to apportion among Member States the amount of 248,764,167 dollars for the period from 1 August to 31 December 2018, at a monthly rate of 49,752,833 dollars, in accordance with the levels updated in its resolution 70/246, taking into account the scale of assessments for 2018, as set out in its resolution 70/245, subject to a decision of the Security Council to extend the mandate of the Support Office;",
    "11": "Decides that, in accordance with the provisions of its resolution 973 (X), there shall be set off against the apportionment among Member States, as provided for in paragraph 10 above, their respective share in the Tax Equalization Fund of 4,056,500 dollars, comprising the estimated staff assessment income of 2,709,667 dollars approved for the Support Office, the prorated share of 969,958 dollars of the estimated staff assessment income approved for the support account, the prorated share of 258,917 dollars of the estimated staff assessment income approved for the United Nations Logistics Base and the prorated share of 117,958 dollars of the estimated staff assessment income approved for the Regional Service Centre;",
    "12": "Also decides to apportion among Member States the amount of 298,517,000 dollars for the period from 1 January to 30 June 2019, at a monthly rate of 49,752,833 dollars, in accordance with the scale of assessments for 2019 and the updated levels,4 subject to a decision of the Security Council to extend the mandate of the Support Office;",
    "13": "Further decides that, in accordance with the provisions of its resolution 973 (X), there shall be set off against the apportionment among Member States, as provided for in paragraph 12 above, their respective share in the Tax Equalization Fund of 4,867,800 dollars, comprising the estimated staff assessment income of 3,251,600 dollars approved for the Support Office, the prorated share of 1,163,950 dollars of the estimated staff assessment income approved for the support account, the prorated share of 310,700 dollars of the estimated staff assessment income approved for the United Nations Logistics Base and the prorated share of 141,550 dollars of the estimated staff assessment income approved for the Regional Service Centre;",
    "14": "Decides that, for Member States that have fulfilled their financial obligations to the Support Office, there shall be set off against their apportionment, as provided for in paragraph 8 above, their respective share of the unencumbered balance and other revenue in the amount of 16,558,400 dollars in respect of the financial period ended 30 June 2017, in accordance with the levels updated in its resolution 70/246, taking into account the scale of assessments for 2017, as set out in its resolution 70/245;",
    "15": "Also decides that, for Member States that have not fulfilled their financial obligations to the Support Office, there shall be set off against their outstanding obligations their respective share of the unencumbered balance and other revenue in the amount of 16,558,400 dollars in respect of the financial period ended 30 June 2017, in accordance with the scheme set out in paragraph 14 above;",
    "16": "Further decides that the increase of 688,600 dollars in the estimated staff assessment income in respect of the financial period ended 30 June 2017 shall be added to the credits in the amount of 16,558,400 dollars referred to in paragraphs 14 and 15 above;",
    "17": "Invites voluntary contributions to the United Nations trust fund established to support the African Union Mission in Somalia;",
    "18": "Decides to include in the provisional agenda of its seventy-third session the item entitled \u201cFinancing of the activities arising from Security Council resolution 1863 (2009)\u201d."
  },
  "agenda_items": [
    "Item 164"
  ],
  "symbol_references": []
}