{
  "symbol": "A/RES/73/63",
  "filename": "A_RES_73_63.pdf",
  "title": "73/63. Preventing and combating illicit brokering activities",
  "text": "United Nations \nA/RES/73/63\n \n \nGeneral Assembly \nDistr.: General \n13 December 2018 \n \n18-21270 (E)    171218     \n*1821270* \n \n \nSeventy-third session \nAgenda item 101 (ff) \n \n \n \n \n Resolution adopted by the General Assembly \non 5 December 2018 \n \n \n \n \n[on the report of the First Committee (A/73/510 and A/73/510/Corr.1)] \n \n \n \n73/63. Preventing and combating illicit brokering activities \n \n \n \nThe General Assembly, \n \nRecalling its resolutions 69/62 of 2 December 2014 and 71/36 of 5 December 2016, \n \nNoting the threat to international peace and security posed by illicit brokering \nactivities circumventing the international arms control and non-proliferation \nframework,  \n \nConcerned that, if proper measures are not taken, the illicit brokering of arms \nin all its aspects will adversely affect the maintenance of international peace and \nsecurity, and prolong conflicts, and could be an obstacle to sustainable economic and \nsocial development and result in illicit transfers of conventional arms and the \nacquisition of weapons of mass destruction by non-State actors, \n \nRecognizing the need for Member States to prevent and combat illicit brokering \nactivities, which covers not only conventional arms but also materials, equipment and \ntechnology that could contribute to the proliferation of weapons of mass destruction \nand their means of delivery, \n \nReaffirming that efforts to prevent and combat illicit brokering activities should \nnot hamper the legitimate arms trade and international cooperation with respect to \nmaterials, equipment and technology for peaceful purposes, \n \nRecalling Security Council resolution 1540 (2004) of 28 April 2004, in \nparticular paragraph 3, in which the Council determined that all States shall develop \nand maintain appropriate effective border controls and law enforcement efforts to \ndetect, deter, prevent and combat, including through international cooperation when \nnecessary, illicit trafficking in and brokering of materials related to nuclear, chemical \nor biological weapons and their means of delivery, in accordance with their national \nlegal authorities and legislation and consistent with international law, and taking note \nof the comprehensive review of the status of implementation of resolution \n1540 (2004) conducted in 2016, \n\nA/RES/73/63 \nPreventing and combating illicit brokering activities\n \n18-21270\n2/3 \n \n \nNoting international efforts to prevent and combat illicit arms brokering, in \nparticular in small arms and light weapons, as demonstrated by the adoption in 2001 \nof the Programme of Action to Prevent, Combat and Eradicate the Illicit Trade in \nSmall Arms and Light Weapons in All Its Aspects,1 and the entry into force in 2005 \nof the Protocol against the Illicit Manufacturing of and Trafficking in Firearms, Their \nParts and Components and Ammunition, supplementing the United Nations \nConvention against Transnational Organized Crime,2  \n \nWelcoming efforts to implement the Programme of Action and the International \nInstrument to Enable States to Identify and Trace, in a Timely and Reliable Manner, \nIllicit Small Arms and Light Weapons,3 including the holding of mandated meetings \nto review their implementation and the submission by Member States of national \nreports, \n \nRecognizing the importance of States parties to the Arms Trade Treaty4 taking \nmeasures, pursuant to their national laws, to regulate brokering taking place under \ntheir jurisdiction, in accordance with article 10 of the Treaty,  \n \nTaking note of Security Council resolutions 2117 (2013) of 26 September 2013 \nand 2220 (2015) of 22 May 2015 on small arms and light weapons, in which the \nCouncil encouraged cooperation and information-sharing on suspect brokering \nactivities to address the illicit transfer, destabilizing accumulation and misuse of small \narms and light weapons, \n \nTaking note also of the report issued on 30 August 2007 by the Group of \nGovernmental Experts established pursuant to General Assembly resolution 60/81 of \n8 December 2005 to consider further steps to enhance international cooperation in \npreventing, combating and eradicating illicit brokering in small arms and light \nweapons5 as an international initiative within the framework of the United Nations, \n \nUnderlining the inherent right of Member States to determine the specific scope \nand content of domestic regulations in accordance with their legislative frameworks \nand export control systems, consistent with international law, \n \nWelcoming the efforts made by Member States to implement laws and/or \nadministrative measures to regulate arms brokering within their legal systems, \n \nEncouraging cooperation among Member States to prevent and combat illicit \ntrafficking in nuclear materials, and recognizing in this regard existing efforts at all \nlevels, consistent with international law, \n \nWelcoming the technical guidance and capacity-building assistance provided by \nthe International Atomic Energy Agency to enhance nuclear security globally, \n \nEncouraging Member States in a position to do so to share their experience and \npractices in relation to the control of illicit brokering and to further enhance \ninternational cooperation to this end,  \n \nNoting with satisfaction the awareness-raising activities of the United Nations \nInstitute for Disarmament Research, which contribute to efforts aimed at preventing \nand combating illicit brokering activities,  \n__________________ \n \n1  Report of the United Nations Conference on the Illicit Trade in Small Arms and Light Weapons in \nAll Its Aspects, New York, 9\u201320 July 2001 (A/CONF.192/15), chap. IV, para. 24. \n \n2  United Nations, Treaty Series, vol. 2326, No. 39574. \n \n3  See decision 60/519 and A/60/88 and A/60/88/Corr.2, annex. \n \n4  See resolution 67/234 B. \n \n5  A/62/163 and A/62/163/Corr.1. \n\nPreventing and combating illicit brokering activities \nA/RES/73/63\n \n3/3\n18-21270 \n \n \nAcknowledging the constructive role that civil society can play in raising \nawareness and providing practical expertise on the prevention of illicit brokering \nactivities,  \n \n1. \nUnderlines the commitment of Member States to address the threat posed \nby illicit brokering activities;  \n \n2. \nEncourages Member States to fully implement relevant international \ntreaties, instruments and resolutions to prevent and combat illicit brokering activities, \nand implement, where appropriate, the recommendations contained in the report of \nthe Group of Governmental Experts;5 \n \n3. \nCalls upon Member States to establish appropriate national laws and/or \nmeasures to prevent and combat the illicit brokering of conventional arms and \nmaterials, equipment and technology that could contribute to the proliferation of \nweapons of mass destruction and their means of delivery, in a manner consistent with \ninternational law; \n \n4. \nAcknowledges that national efforts to prevent and combat illicit brokering \nactivities can be reinforced by such efforts at the regional and subregional levels; \n \n5. \nEmphasizes the importance of international cooperation and assistance, \ncapacity-building and information-sharing in preventing and combating illicit \nbrokering activities, and encourages Member States to take such measures as \nappropriate and in a manner consistent with international law; \n \n6. \nEncourages Member States to draw, where appropriate, on the relevant \nexpertise of civil society in developing effective measures to prevent and combat \nillicit brokering activities. \n \n45th plenary meeting  \n5 December 2018 \n \n",
  "paragraphs": {
    "1": "Underlines the commitment of Member States to address the threat posed by illicit brokering activities;",
    "2": "Encourages Member States to fully implement relevant international treaties, instruments and resolutions to prevent and combat illicit brokering activities, and implement, where appropriate, the recommendations contained in the report of the Group of Governmental Experts;5",
    "3": "Calls upon Member States to establish appropriate national laws and/or measures to prevent and combat the illicit brokering of conventional arms and materials, equipment and technology that could contribute to the proliferation of weapons of mass destruction and their means of delivery, in a manner consistent with international law;",
    "4": "Acknowledges that national efforts to prevent and combat illicit brokering activities can be reinforced by such efforts at the regional and subregional levels;",
    "5": "Emphasizes the importance of international cooperation and assistance, capacity-building and information-sharing in preventing and combating illicit brokering activities, and encourages Member States to take such measures as appropriate and in a manner consistent with international law;",
    "6": "Encourages Member States to draw, where appropriate, on the relevant expertise of civil society in developing effective measures to prevent and combat illicit brokering activities. 45th plenary meeting 5 December 2018"
  },
  "agenda_items": [
    "Item 101"
  ],
  "symbol_references": []
}