{
  "symbol": "A/RES/76/126",
  "filename": "A_RES_76_126.pdf",
  "title": "76/126. Assistance to the Palestinian people",
  "text": "United Nations \nA/RES/76/126\n \n \nGeneral Assembly \nDistr.: General \n17 December 2021 \n \n21-18800 (E)    231221    \n*2118800* \n \n \nSeventy-sixth session \nAgenda item 75 (b) \nStrengthening of the coordination of humanitarian and \ndisaster relief assistance of the United Nations, including \nspecial economic assistance: assistance to the \nPalestinian people \n \n \n \n \n Resolution adopted by the General Assembly \non 10 December 2021 \n \n \n \n \n[without reference to a Main Committee (A/76/L.25 and A/76/L.25/Add.1)] \n \n \n 76/126. Assistance to the Palestinian people \n \n \n \nThe General Assembly, \n \nRecalling its resolution 75/126 of 11 December 2020, as well as its previous \nresolutions on the question, \n \nRecalling also the signing of the Declaration of Principles on Interim Self-\nGovernment Arrangements in Washington, D.C., on 13 September 1993, by the \nGovernment of the State of Israel and the Palestine Liberation Organization, the \nrepresentative of the Palestinian people, 1  and the subsequent implementation \nagreements concluded by the two sides, \n \nRecalling further all relevant international law, including humanitarian and \nhuman rights law, and, in particular, the International Covenant on Civil and Political \nRights,2 the International Covenant on Economic, Social and Cultural Rights, 3 the \nConvention on the Rights of the Child4 and the Convention on the Elimination of All \nForms of Discrimination against Women,5 \n \nGravely concerned at the difficult living conditions and humanitarian situation \naffecting the Palestinian people, in particular women and children, throughout the \noccupied Palestinian territory, particularly in the Gaza Strip where economic recovery \n__________________ \n \n1 A/48/486-S/26560, annex. \n \n2 See resolution 2200 A (XXI), annex. \n \n3 Ibid. \n \n4 United Nations, Treaty Series, vol. 1577, No. 27531. \n \n5 Ibid., vol. 1249, No. 20378. \n\nA/RES/76/126 \nAssistance to the Palestinian people\n \n21-18800\n2/6 \n \nand vast infrastructure repair, rehabilitation and development are urgently needed, \nespecially in the aftermath of the conflict of July and August 2014, \n \nConscious of the urgent need for improvement in the economic and social \ninfrastructure of the occupied territory, \n \nWelcoming, in this context, the development of projects, notably on \ninfrastructure, to revive the Palestinian economy and improve the living conditions \nof the Palestinian people, stressing the need to create the appropriate conditions to \nfacilitate the implementation of these projects, and noting the contribution of partners \nin the region and of the international community, \n \nAware that development is difficult under occupation and is best promoted in \ncircumstances of peace and stability,  \n \nNoting the great economic and social challenges facing the Palestinian people \nand their leadership, \n \nEmphasizing the importance of the safety and well-being of all people, in \nparticular women and children, in the whole Middle East region, the promotion of \nwhich is facilitated, inter alia, in a stable and secure environment, \n \nDeeply concerned about the negative impact, including the health and \npsychological consequences, of violence on the present and future well-being of \nchildren in the region, \n \nConscious of the urgent necessity for international assistance to the Palestinian \npeople, taking into account the Palestinian priorities, and recalling in this regard the \nNational Early Recovery and Reconstruction Plan for Gaza, \n \nExpressing grave concern about the grave humanitarian situation in the Gaza \nStrip, and underlining the importance of emergency and humanitarian assistance and \nthe need for the advancement of reconstruction in the Gaza Strip, \n \nWelcoming the results of the Conference to Support Middle East Peace, \nconvened in Washington, D.C., on 1 October 1993, the establishment of the Ad Hoc \nLiaison Committee for the Coordination of the International Assistance to \nPalestinians and the work being done by the World Bank as its secretariat and the \nestablishment of the Consultative Group, as well as all follow-up meetings and \ninternational mechanisms established to provide assistance to the Palestinian people, \n \nUnderlining the importance of the Cairo International Conference on Palestine: \nReconstructing Gaza, held on 12 October 2014, and urging the timely and full \ndisbursement of pledges for expediting the provision of humanitarian assistance and \nthe reconstruction process, \n \nRecalling the International Donors\u2019 Conference for the Palestinian State, held \nin Paris on 17 December 2007, the Berlin Conference in Support of Palestinian Civil \nSecurity and the Rule of Law, held on 24 June 2008, and the Palestine Investment \nConferences, held in Bethlehem from 21 to 23 May 2008 and on 2 and 3 June 2010, \nand the International Conference in Support of the Palestinian Economy for the \nReconstruction of Gaza, held in Sharm el-Sheikh, Egypt, on 2 March 2009, \n \nWelcoming the ministerial meetings of the Conference on Cooperation among \nEast Asian Countries for Palestinian Development, convened in Tokyo in February \n2013 and in Jakarta in March 2014, as a forum to mobilize political and economic \nassistance, including through exchanges of expertise and lessons learned, in support \nof Palestinian development, \n \nWelcoming also the latest meetings of the Ad Hoc Liaison Committee for the \nCoordination of the International Assistance to Palestinians, held in Brussels on \n\nAssistance to the Palestinian people \nA/RES/76/126\n \n3/6\n21-18800 \n \n27 May 2015, in New York on 25 September 2013, 22 September 2014, 30 September \n2015, 19 September 2016, 18 September 2017, 27 September 2018 and 26 September \n2019, by videoconference on 2 June 2020 and on 23 February 2021 and in Oslo on \n17 November 2021, \n \nWelcoming further the activities of the Joint Liaison Committee, which provides \na forum in which economic policy and practical matters related to donor assistance \nare discussed with the Palestinian Authority, \n \nWelcoming the implementation of the Palestinian National Development Plan \n2011\u20132013 on governance, economy, social development and infrastructure and the \nadoption of the Palestinian National Development Plan 2014\u20132016: State-building to \nSovereignty, and stressing the need for continued international support for the \nPalestinian State-building process, as outlined in the summary by the Chair of the \nmeeting of the Ad Hoc Liaison Committee held on 22 September 2014, \n \nStressing the need for the full engagement of the United Nations in the process \nof building Palestinian institutions and in providing broad assistance to the \nPalestinian people, \n \nRecognizing, in this regard, the positive contribution of the United Nations \nDevelopment Assistance Framework 2014\u20132016, which is aimed, inter alia, at \nenhancing developmental support and assistance to the Palestinian people and \nstrengthening institutional capacity in line with Palestinian national priorities, \n \nWelcoming steps to ease the restrictions on movement and access in the West \nBank, while stressing the need for further steps to be taken in this regard, and \nrecognizing that such steps would improve living conditions and the situation on the \nground and could promote further Palestinian economic development, \n \nWelcoming also the tripartite agreement facilitated by the United Nations \nregarding access to the Gaza Strip, and calling for its full implementation and \ncomplementary measures that address the need for a fundamental change in policy \nthat allows for the sustained and regular opening of the border crossings for the \nmovement of persons and goods, including for humanitarian and commercial flows \nand for the reconstruction and economic recovery of Gaza, \n \nStressing that the situation in the Gaza Strip is unsustainable and that a durable \nceasefire agreement must lead to a fundamental improvement in the living conditions \nof the Palestinian people in the Gaza Strip and ensure the safety and well-being of \ncivilians on both sides, \n \nStressing also the urgency of reaching a durable solution to the crisis in Gaza \nthrough the full implementation of Security Council resolution 1860 (2009) of \n8 January 2009, including by preventing the illicit trafficking in arms and ammunition \nand by ensuring the sustained reopening of the crossing points on the basis of existing \nagreements, including the 2005 Agreement on Movement and Access between the \nPalestinian Authority and Israel, \n \nStressing, in this regard, the importance of the effective exercise by the \nPalestinian Authority of its full government responsibilities in the Gaza Strip in all \nfields, including through its presence at the Gaza crossing points,  \n \nNoting the active participation of the United Nations Special Coordinator for \nthe Middle East Peace Process and Personal Representative of the Secretary-General \nto the Palestine Liberation Organization and the Palestinian Authority in the activities \nof the Special Envoys of the Quartet, \n \nReaffirming the necessity of achieving a comprehensive resolution of the Arab-\nIsraeli conflict in all its aspects, on the basis of relevant Security Council resolutions, \n\nA/RES/76/126 \nAssistance to the Palestinian people\n \n21-18800\n4/6 \n \nincluding resolutions 242 (1967) of 22 November 1967, 338 (1973) of 22 October \n1973, 1397 (2002) of 12 March 2002, 1515 (2003) of 19 November 2003, 1850 (2008) \nof 16 December 2008 and 1860 (2009), as well as the terms of reference of the Madrid \nConference and the principle of land for peace, in order to ensure a political solution, \nwith two States \u2013 Israel and an independent, democratic, contiguous, sovereign and \nviable Palestinian State \u2013 living side by side in peace and security and mutual \nrecognition, \n \nHaving considered the report of the Secretary-General,6 \n \nExpressing grave concern about continuing violence against civilians, \n \n1. \nTakes note of the report of the Secretary-General; \n \n2. \nExpresses its appreciation to the Secretary-General for his rapid response \nand ongoing efforts regarding assistance to the Palestinian people, including with \nregard to the emergency humanitarian needs in the Gaza Strip; \n \n3. \nAlso expresses its appreciation to the Member States, United Nations \nbodies and intergovernmental, regional and non-governmental organizations that \nhave provided and continue to provide assistance to the Palestinian people; \n \n4. \nStresses the importance of the work of the United Nations Special \nCoordinator for the Middle East Peace Process and Personal Representative of the \nSecretary-General to the Palestine Liberation Organization and the Palestinian \nAuthority and of the steps taken under the auspices of the Secretary-General to ensure \nthe achievement of a coordinated mechanism for United Nations activities throughout \nthe occupied territories; \n \n5. \nUrges Member States, international financial institutions of the United \nNations system, intergovernmental and non-governmental organizations and regional \nand interregional organizations to extend, as rapidly and as generously as possible, \neconomic and social assistance to the Palestinian people, in close cooperation with \nthe Palestine Liberation Organization and through official Palestinian institutions; \n \n6. \nWelcomes the meetings of the Ad Hoc Liaison Committee for the \nCoordination of the International Assistance to Palestinians of 25 September 2013, \n22 September 2014, 27 May and 30 September 2015, 19 September 2016, 18 September \n2017, 27 September 2018, 26 September 2019, 2 June 2020 and 23 February and \n17 November 2021, the outcome of the Cairo International Conference on Palestine: \nReconstructing Gaza, held on 12 October 2014, and the generous donor response to \nsupport the needs of the Palestinian people, and urges the rapid disbursement of donor \npledges; \n \n7. \nStresses the importance of following up on the results of the Cairo \nInternational Conference on Palestine: Reconstructing Gaza to effectively promote \neconomic recovery and reconstruction in a timely and sustainable manner; \n \n8. \nCalls upon donors that have not yet converted their budget support pledges \ninto disbursements to transfer funds as soon as possible, encourages all donors to \nincrease their direct assistance to the Palestinian Authority in accordance with its \ngovernment programme in order to enable it to build a viable and prosperous \nPalestinian State, underlines the need for equitable burden-sharing by donors in this \neffort, and encourages donors to consider aligning funding cycles with the Palestinian \nAuthority\u2019s national budget cycle; \n__________________ \n \n6 A/76/78-E/2021/71. \n\nAssistance to the Palestinian people \nA/RES/76/126\n \n5/6\n21-18800 \n \n \n9. \nCalls upon relevant organizations and agencies of the United Nations \nsystem to intensify their assistance in response to the urgent needs of the Palestinian \npeople in accordance with priorities set forth by the Palestinian side; \n \n10. Expresses its appreciation for the work of the United Nations Relief and \nWorks Agency for Palestine Refugees in the Near East, and recognizes the vital role \nof the Agency in providing humanitarian assistance to the Palestinian people, \nparticularly in the Gaza Strip; \n \n11. \nCalls upon the international community to provide urgently needed \nassistance and services in an effort to alleviate the difficult humanitarian situation \nbeing faced by Palestinian women, children and their families and to help in the \nreconstruction and development of relevant Palestinian institutions; \n \n12. Stresses the role that all funding instruments, including the European \nCommission\u2019s Palestinian-European Mechanism for the Management of Socioeconomic \nAid and the World Bank trust fund, have been playing in directly assisting the \nPalestinian people; \n \n13. Urges Member States to open their markets to exports of Palestinian \nproducts on the most favourable terms, consistent with appropriate trading rules, and \nto implement fully existing trade and cooperation agreements; \n \n14. Calls upon the international donor community to expedite the delivery of \npledged assistance to the Palestinian people to meet their urgent needs; \n \n15. Stresses, in this context, the importance of ensuring free humanitarian \naccess to the Palestinian people and the free movement of persons and goods; \n \n16. Also stresses the need for the full implementation by both parties of \nexisting agreements, including the Agreement on Movement and Access and the \nAgreed Principles for the Rafah Crossing, of 15 November 2005, to allow for the \nfreedom of movement of the Palestinian civilian population, as well as for imports \nand exports, within and into and out of the Gaza Strip; \n \n17. Further stresses the need to ensure the safety and security of humanitarian \npersonnel, premises, facilities, equipment, vehicles and supplies, as well as the need \nto ensure safe and unhindered access by humanitarian personnel and delivery of \nsupplies and equipment, in order to allow such personnel to efficiently perform their \ntask of assisting affected civilian populations; \n \n18. Urges the international donor community, United Nations agencies and \norganizations and non-governmental organizations to extend to the Palestinian \npeople, as rapidly as possible, emergency economic assistance and humanitarian \nassistance, particularly in the Gaza Strip, to counter the impact of the current crisis; \n \n19. Stresses the need for the continued implementation of the Paris Protocol \non Economic Relations of 29 April 1994, fifth annex to the Israeli-Palestinian Interim \nAgreement on the West Bank and the Gaza Strip, signed in Washington, D.C., on \n28 September 1995,7 including with regard to the full, prompt and regular transfer of \nPalestinian indirect tax revenues; \n \n20. Requests the Secretary-General to submit a report to the General Assembly \nat its seventy-seventh session, through the Economic and Social Council, on the \nimplementation of the present resolution, containing: \n \n(a) \nAn assessment of the assistance actually received by the Palestinian \npeople; \n__________________ \n \n7 A/51/889-S/1997/357, annex. \n\nA/RES/76/126 \nAssistance to the Palestinian people\n \n21-18800\n6/6 \n \n \n(b) \nAn assessment of the needs still unmet and specific proposals for \nresponding effectively to them; \n \n21. Decides to include in the provisional agenda of its seventy-seventh \nsession, under the item entitled \u201cStrengthening of the coordination of humanitarian \nand disaster relief assistance of the United Nations, including special economic \nassistance\u201d, the sub-item entitled \u201cAssistance to the Palestinian people\u201d. \n \n51st plenary meeting \n10 December 2021 \n \n",
  "paragraphs": {
    "1": "Takes note of the report of the Secretary-General;",
    "2": "Expresses its appreciation to the Secretary-General for his rapid response and ongoing efforts regarding assistance to the Palestinian people, including with regard to the emergency humanitarian needs in the Gaza Strip;",
    "3": "Also expresses its appreciation to the Member States, United Nations bodies and intergovernmental, regional and non-governmental organizations that have provided and continue to provide assistance to the Palestinian people;",
    "4": "Stresses the importance of the work of the United Nations Special Coordinator for the Middle East Peace Process and Personal Representative of the Secretary-General to the Palestine Liberation Organization and the Palestinian Authority and of the steps taken under the auspices of the Secretary-General to ensure the achievement of a coordinated mechanism for United Nations activities throughout the occupied territories;",
    "5": "Urges Member States, international financial institutions of the United Nations system, intergovernmental and non-governmental organizations and regional and interregional organizations to extend, as rapidly and as generously as possible, economic and social assistance to the Palestinian people, in close cooperation with the Palestine Liberation Organization and through official Palestinian institutions;",
    "6": "Welcomes the meetings of the Ad Hoc Liaison Committee for the Coordination of the International Assistance to Palestinians of 25 September 2013, 22 September 2014, 27 May and 30 September 2015, 19 September 2016, 18 September 2017, 27 September 2018, 26 September 2019, 2 June 2020 and 23 February and 17 November 2021, the outcome of the Cairo International Conference on Palestine: Reconstructing Gaza, held on 12 October 2014, and the generous donor response to support the needs of the Palestinian people, and urges the rapid disbursement of donor pledges;",
    "7": "Stresses the importance of following up on the results of the Cairo International Conference on Palestine: Reconstructing Gaza to effectively promote economic recovery and reconstruction in a timely and sustainable manner;",
    "8": "Calls upon donors that have not yet converted their budget support pledges into disbursements to transfer funds as soon as possible, encourages all donors to increase their direct assistance to the Palestinian Authority in accordance with its government programme in order to enable it to build a viable and prosperous Palestinian State, underlines the need for equitable burden-sharing by donors in this effort, and encourages donors to consider aligning funding cycles with the Palestinian Authority\u2019s national budget cycle;",
    "9": "Calls upon relevant organizations and agencies of the United Nations system to intensify their assistance in response to the urgent needs of the Palestinian people in accordance with priorities set forth by the Palestinian side;",
    "10": "Expresses its appreciation for the work of the United Nations Relief and Works Agency for Palestine Refugees in the Near East, and recognizes the vital role of the Agency in providing humanitarian assistance to the Palestinian people, particularly in the Gaza Strip;",
    "11": "Calls upon the international community to provide urgently needed assistance and services in an effort to alleviate the difficult humanitarian situation being faced by Palestinian women, children and their families and to help in the reconstruction and development of relevant Palestinian institutions;",
    "12": "Stresses the role that all funding instruments, including the European Commission\u2019s Palestinian-European Mechanism for the Management of Socioeconomic Aid and the World Bank trust fund, have been playing in directly assisting the Palestinian people;",
    "13": "Urges Member States to open their markets to exports of Palestinian products on the most favourable terms, consistent with appropriate trading rules, and to implement fully existing trade and cooperation agreements;",
    "14": "Calls upon the international donor community to expedite the delivery of pledged assistance to the Palestinian people to meet their urgent needs;",
    "15": "Stresses, in this context, the importance of ensuring free humanitarian access to the Palestinian people and the free movement of persons and goods;",
    "16": "Also stresses the need for the full implementation by both parties of existing agreements, including the Agreement on Movement and Access and the Agreed Principles for the Rafah Crossing, of 15 November 2005, to allow for the freedom of movement of the Palestinian civilian population, as well as for imports and exports, within and into and out of the Gaza Strip;",
    "17": "Further stresses the need to ensure the safety and security of humanitarian personnel, premises, facilities, equipment, vehicles and supplies, as well as the need to ensure safe and unhindered access by humanitarian personnel and delivery of supplies and equipment, in order to allow such personnel to efficiently perform their task of assisting affected civilian populations;",
    "18": "Urges the international donor community, United Nations agencies and organizations and non-governmental organizations to extend to the Palestinian people, as rapidly as possible, emergency economic assistance and humanitarian assistance, particularly in the Gaza Strip, to counter the impact of the current crisis;",
    "19": "Stresses the need for the continued implementation of the Paris Protocol on Economic Relations of 29 April 1994, fifth annex to the Israeli-Palestinian Interim Agreement on the West Bank and the Gaza Strip, signed in Washington, D.C., on 28 September 1995,7 including with regard to the full, prompt and regular transfer of Palestinian indirect tax revenues;",
    "20": "Requests the Secretary-General to submit a report to the General Assembly at its seventy-seventh session, through the Economic and Social Council, on the implementation of the present resolution, containing: (a) An assessment of the assistance actually received by the Palestinian people; (b) An assessment of the needs still unmet and specific proposals for responding effectively to them;",
    "21": "Decides to include in the provisional agenda of its seventy-seventh session, under the item entitled \u201cStrengthening of the coordination of humanitarian and disaster relief assistance of the United Nations, including special economic assistance\u201d, the sub-item entitled \u201cAssistance to the Palestinian people\u201d."
  },
  "agenda_items": [
    "Item 75"
  ],
  "symbol_references": [
    "A/76/L.25"
  ]
}