{
  "symbol": "A/RES/73/13",
  "filename": "A_RES_73_13.pdf",
  "title": "73/13. Cooperation between the United Nations and the Black Sea Economic Cooperation Organization",
  "text": "United Nations \nA/RES/73/13\n \n \nGeneral Assembly \nDistr.: General \n30 November 2018 \n \n18-20447 (E)    041218 \n*1820447* \n \n \nSeventy-third session \nAgenda item 128 (o) \n \n \n \n \n Resolution adopted by the General Assembly \non 26 November 2018 \n \n \n \n \n[without reference to a Main Committee (A/73/L.25 and A/73/L.25/Add.1)] \n \n \n \n73/13. Cooperation between the United Nations and the Black Sea \nEconomic Cooperation Organization \n \n \n \nThe General Assembly,  \n \nRecalling its resolution 54/5 of 8 October 1999, by which it granted observer \nstatus to the Black Sea Economic Cooperation Organization, as well as its previous \nresolutions on cooperation between the United Nations and the Black Sea Economic \nCooperation Organization, including resolution 71/18 of 21 November 2016,  \n \nRecalling also that one of the purposes of the United Nations is to achieve \ninternational cooperation in solving international problems of an economic, social or \nhumanitarian nature,  \n \nRecalling further the Articles of the Charter of the United Nations that \nencourage activities through regional cooperation for the promotion of the purposes \nand principles of the United Nations,  \n \nReaffirming its resolution 70/1 of 25 September 2015, entitled \u201cTransforming \nour world: the 2030 Agenda for Sustainable Development\u201d, and its resolution 69/313 \nof 27 July 2015 on the Addis Ababa Action Agenda of the Third International \nConference on Financing for Development, \n \nRecalling its Declaration on the Enhancement of Cooperation between the \nUnited Nations and Regional Arrangements or Agencies in the Maintenance of \nInternational Peace and Security of 9 December 1994, 1 \n \nRecognizing that any dispute or conflict in the region impedes cooperation, and \nstressing the need to solve such a dispute or conflict on the basis of the norms and \nprinciples of international law,  \n__________________ \n \n1  Resolution 49/57, annex. \n\nA/RES/73/13 \nCooperation between the United Nations and the Black Sea Economic Cooperation Organization\n \n18-20447\n2/5 \n \n \nConvinced that the strengthening of cooperation between the United Nations \nand other organizations contributes to the promotion of the purposes and principles \nof the United Nations,  \n \nTaking note of the report of the Secretary-General submitted pursuant to \nresolution 71/18,2 \n \n1. \nRecalls the declaration adopted by the Heads of State and Government of \nthe States members of the Black Sea Economic Cooperation Organization on the \noccasion of the Twenty-fifth Anniversary Summit of the Organization, held in \nIstanbul, Turkey, on 22 May 2017; \n \n2. \nReiterates the conviction that multilateral economic cooperation \ncontributes to enhancing peace, stability and security to the benefit of the wider Black \nSea area;  \n \n3. \nWelcomes the ongoing commitment of the States members of the Black \nSea Economic Cooperation Organization to the implementation of the Black Sea \nEconomic Cooperation Agenda, \u201cTowards an enhanced Black Sea Economic \nCooperation Partnership\u201d, endorsed by the Heads of State and Government of the \nStates members of the Organization at its Twentieth Anniversary Summit, held in \nIstanbul, in which the member States had reiterated their commitment to enhancing \nthe economic mission and the project-oriented vision of the Organization;  \n \n4. \nAlso welcomes the joint statement of the Speakers of the Parliaments of \nthe Black Sea Economic Cooperation member States on the occasion of the Twenty-\nfifth Anniversary Summit of the Parliamentary Assembly of the Black Sea Economic \nCooperation, held in Istanbul on 16 May 2018; \n \n5. \nValues the activities of the Black Sea Economic Cooperation Organization \naimed at strengthening regional cooperation in such fields as energy, including \nrenewable energy and energy efficiency, transport, institutional renewal and good \ngovernance, trade and economic development, banking and finance, environmental \nprotection, sustainable development and entrepreneurship, communications, \nagriculture and agro-industry, health care and pharmaceutics, culture, education, \nyouth and sports, tourism, science and technology, exchange of statistical data and \neconomic information, collaboration among customs authorities and combating \norganized crime and trafficking in drugs, weapons and radioactive material, acts of \nterrorism and illegal migration and in other related spheres;  \n \n6. \nWelcomes the reform efforts within the Black Sea Economic Cooperation \nOrganization aimed at increasing its efficiency and effectiveness;  \n \n7. \nAlso welcomes the ongoing efforts of the Black Sea Economic Cooperation \nOrganization to elaborate and implement concrete joint regional projects, particularly \nin the field of transport, which will contribute to the development of Euro-Asian \ntransport links, and recalls, within this framework, the Memorandum of \nUnderstanding for the Coordinated Development of the Black Sea Ring Highway, the \nMemorandum of Understanding on the Development of Motorways of the Sea in the \nBlack Sea Economic Cooperation Organization Region and the Memorandum of \nUnderstanding on Facilitation of Road Transport of Goods in the Black Sea Economic \nCooperation Organization Region;  \n \n8. \nFurther welcomes the adoption of the Black Sea Economic Cooperation \nOrganization Green Energy Strategy, which affords States members of the Black Sea \nEconomic Cooperation Organization new opportunities with regard to the elaboration \nand adoption of their green energy policies and the strengthening of regional \n__________________ \n \n2  See A/73/328-S/2018/592, sect. II. \n\nCooperation between the United Nations and the Black Sea Economic Cooperation Organization \nA/RES/73/13\n \n3/5\n18-20447 \n \ncooperation in the field of green energy, endorsed at the thirty-eighth meeting of the \nCouncil of Ministers of Foreign Affairs of the Black Sea Economic Cooperation \nOrganization, held in Yerevan on 27 June 2018;  \n \n9. \nNotes the activities undertaken by the Black Sea Economic Cooperation \nOrganization Green Energy Network with regard to exchanging information, sharing \nexperiences and good practices, elaborating and implementing regional energy \nefficiency projects and promoting investments in green energy in the Black Sea \nregion;  \n \n10. Also notes the activities aimed at developing effective policies and \nconcrete measures to support the sustainable development of small and medium-sized \nenterprises in the Black Sea region and to help them to improve their quality \nperformance through, inter alia, the assistance of the Black Sea Trade and \nDevelopment Bank;  \n \n11. \nCalls for greater cooperation between the Black Sea Economic \nCooperation Organization and international financial institutions, and welcomes the \ncontacts between the Organization and the World Bank, the Asian Development Bank, \nthe Asian Infrastructure Investment Bank, the Silk Road Fund and other financial \ninstitutions with a view to exploring the possibility of co-financing projects in the \nwider Black Sea area that are economically prudent and within their respective \nmandates;  \n \n12. Acknowledges the interest of the Black Sea Economic Cooperation \nOrganization in contributing to the implementation of the 2030 Agenda for \nSustainable Development, 3  bearing in mind the importance of the regional and \nsubregional dimensions, regional economic integration and interconnectivity in \nsustainable development and that regional and subregional frameworks can facilitate \nthe effective translation of sustainable development policies into concrete action at \nthe national level;  \n \n13. Notes the ongoing contributions of the related bodies of the Black Sea \nEconomic Cooperation Organization, namely, the Parliamentary Assembly of the \nBlack Sea Economic Cooperation, the Black Sea Economic Cooperation Business \nCouncil, the Black Sea Trade and Development Bank and the International Centre for \nBlack Sea Studies, to the strengthening of multifaceted regional cooperation in the \nregion;  \n \n14. Welcomes the ongoing commitment of the Black Sea Economic \nCooperation Organization to promoting fruitful cooperation with the funds, \nprogrammes and specialized agencies of the United Nations system, in particular to \ndeveloping practical and goal-oriented projects, in areas of common interest, as \nreiterated in the Black Sea Economic Cooperation Agenda, \u201cTowards an Enhanced \nBlack Sea Economic Cooperation Partnership\u201d, endorsed at the Twentieth \nAnniversary Summit of the Organization;  \n \n15. Also welcomes the ongoing cooperation between the Black Sea Economic \nCooperation Organization and the United Nations Development Programme, the \nEconomic Commission for Europe, the United Nations Office on Drugs and Crime, \nthe International Organization for Migration, the United Nations Environment \nProgramme, the United Nations Industrial Development Organization, the World \nHealth Organization, the World Tourism Organization, the Food and Agriculture \nOrganization of the United Nations and the United Nations Educational, Scientific \nand Cultural Organization, as well as the working contacts of the Black Sea Economic \n__________________ \n \n3  Resolution 70/1. \n\nA/RES/73/13 \nCooperation between the United Nations and the Black Sea Economic Cooperation Organization\n \n18-20447\n4/5 \n \nCooperation Organization with the World Bank aimed at promoting sustainable \ndevelopment in the Black Sea region;  \n \n16. Further welcomes the efforts of the Permanent International Secretariat of \nthe Black Sea Economic Cooperation Organization in strengthening its project-\noriented dimension by further enhancing the Black Sea Economic Cooperation \nProject Development Fund and the capacities of the Black Sea Economic Cooperation \nProject Management Unit;  \n \n17. Takes note of the establishment of the Black Sea Project Promotion \nFacility and the effective start of its operations in support of regional projects in the \nfields of renewable energy, energy efficiency, green technologies, the development of \nsmall and medium-sized enterprises, the advancement of the knowledge economy, \ncapacity-building and the promotion of the export potential of the States members of \nthe Black Sea Economic Cooperation Organization; \n \n18. Notes the willingness of the Black Sea Economic Cooperation \nOrganization to continue to implement sustainable development strategies based on a \nbalanced and harmonious relationship between social needs and economic activities \nand to encourage measures to rehabilitate, protect and preserve the environment in \nthe Black Sea region, and in this regard welcomes its cooperation with the United \nNations Environment Programme and the Commission on the Protection of the Black \nSea against Pollution;  \n \n19. Also notes the ongoing cooperation between the Black Sea Economic \nCooperation Organization and the United Nations Office on Drugs and Crime, and \nwithin this framework welcomes the positive results of the ongoing joint project to \nstrengthen the criminal justice response to trafficking in persons in the Black Sea \nregion;  \n \n20. Welcomes the ongoing multifaceted and fruitful cooperation between the \nBlack Sea Economic Cooperation Organization and the Economic Commission for \nEurope, especially in the area of transport, within the framework of the Cooperation \nAgreement signed by the two organizations;  \n \n21. Encourages the full implementation of the Cooperation Agreement \nbetween the Black Sea Economic Cooperation Organization and the United Nations \nEnvironment Programme of 20 February 2002 and the Relationship Agreement \nbetween the Organization and the United Nations Industrial Development \nOrganization;  \n \n22. Notes that the Black Sea Economic Cooperation Organization is a member \nof the Group of Friends of the United Nations Alliance of Civilizations, and welcomes \nthe commitment to broaden cooperation in the accomplishment of the mission of the \nAlliance, as established by the Secretary-General, and in the promotion of \nunderstanding and reconciliation among cultures, globally and regionally, as set out \nin the Memorandum of Understanding between the Black Sea Economic Cooperation \nOrganization and the United Nations Alliance of Civilizations, which was approved \nin Bucharest and signed in Baku;  \n \n23. Appreciates the endeavours of the Black Sea Economic Cooperation \nOrganization in enhancing project-oriented cooperation with the European Union in \na balanced and mutually beneficial way;  \n \n24. Takes note of the cooperation established between the Black Sea Economic \nCooperation Organization and other regional organizations and initiatives, and in this \nregard encourages the further development of cooperation with the regional \norganizations and integration unions concerned, in particular those in Eastern Europe \nand Central Asia;  \n\nCooperation between the United Nations and the Black Sea Economic Cooperation Organization \nA/RES/73/13\n \n5/5\n18-20447 \n \n \n25. Invites the Secretary-General to strengthen dialogue with the Black Sea \nEconomic Cooperation Organization with a view to promoting cooperation and \ncoordination between the secretariats of the two organizations;  \n \n26. Invites the funds, programmes and specialized agencies of the United \nNations system to cooperate with the Black Sea Economic Cooperation Organization \nin order to continue joint projects and programmes with the Organization and its \nrelated bodies for the achievement of their objectives;  \n \n27. Requests the Secretary-General to submit to the General Assembly at its \nseventy-fifth session a report on the implementation of the present resolution; \n \n28. Decides to include in the provisional agenda of its seventy-fifth session, \nunder the item entitled \u201cCooperation between the United Nations and regional and \nother organizations\u201d, the sub-item entitled \u201cCooperation between the United Nations \nand the Black Sea Economic Cooperation Organization\u201d.  \n \n39th plenary meeting \n26 November 2018 \n \n",
  "paragraphs": {
    "1": "Recalls the declaration adopted by the Heads of State and Government of the States members of the Black Sea Economic Cooperation Organization on the occasion of the Twenty-fifth Anniversary Summit of the Organization, held in Istanbul, Turkey, on 22 May 2017;",
    "2": "Reiterates the conviction that multilateral economic cooperation contributes to enhancing peace, stability and security to the benefit of the wider Black Sea area;",
    "3": "Welcomes the ongoing commitment of the States members of the Black Sea Economic Cooperation Organization to the implementation of the Black Sea Economic Cooperation Agenda, \u201cTowards an enhanced Black Sea Economic Cooperation Partnership\u201d, endorsed by the Heads of State and Government of the States members of the Organization at its Twentieth Anniversary Summit, held in Istanbul, in which the member States had reiterated their commitment to enhancing the economic mission and the project-oriented vision of the Organization;",
    "4": "Also welcomes the joint statement of the Speakers of the Parliaments of the Black Sea Economic Cooperation member States on the occasion of the Twenty- fifth Anniversary Summit of the Parliamentary Assembly of the Black Sea Economic Cooperation, held in Istanbul on 16 May 2018;",
    "5": "Values the activities of the Black Sea Economic Cooperation Organization aimed at strengthening regional cooperation in such fields as energy, including renewable energy and energy efficiency, transport, institutional renewal and good governance, trade and economic development, banking and finance, environmental protection, sustainable development and entrepreneurship, communications, agriculture and agro-industry, health care and pharmaceutics, culture, education, youth and sports, tourism, science and technology, exchange of statistical data and economic information, collaboration among customs authorities and combating organized crime and trafficking in drugs, weapons and radioactive material, acts of terrorism and illegal migration and in other related spheres;",
    "6": "Welcomes the reform efforts within the Black Sea Economic Cooperation Organization aimed at increasing its efficiency and effectiveness;",
    "7": "Also welcomes the ongoing efforts of the Black Sea Economic Cooperation Organization to elaborate and implement concrete joint regional projects, particularly in the field of transport, which will contribute to the development of Euro-Asian transport links, and recalls, within this framework, the Memorandum of Understanding for the Coordinated Development of the Black Sea Ring Highway, the Memorandum of Understanding on the Development of Motorways of the Sea in the Black Sea Economic Cooperation Organization Region and the Memorandum of Understanding on Facilitation of Road Transport of Goods in the Black Sea Economic Cooperation Organization Region;",
    "8": "Further welcomes the adoption of the Black Sea Economic Cooperation Organization Green Energy Strategy, which affords States members of the Black Sea Economic Cooperation Organization new opportunities with regard to the elaboration and adoption of their green energy policies and the strengthening of regional __________________ 2 See A/73/328-S/2018/592, sect. II. Cooperation between the United Nations and the Black Sea Economic Cooperation Organization A/RES/73/13 3/5 18-20447 cooperation in the field of green energy, endorsed at the thirty-eighth meeting of the Council of Ministers of Foreign Affairs of the Black Sea Economic Cooperation Organization, held in Yerevan on 27 June 2018;",
    "9": "Notes the activities undertaken by the Black Sea Economic Cooperation Organization Green Energy Network with regard to exchanging information, sharing experiences and good practices, elaborating and implementing regional energy efficiency projects and promoting investments in green energy in the Black Sea region;",
    "10": "Also notes the activities aimed at developing effective policies and concrete measures to support the sustainable development of small and medium-sized enterprises in the Black Sea region and to help them to improve their quality performance through, inter alia, the assistance of the Black Sea Trade and Development Bank;",
    "11": "Calls for greater cooperation between the Black Sea Economic Cooperation Organization and international financial institutions, and welcomes the contacts between the Organization and the World Bank, the Asian Development Bank, the Asian Infrastructure Investment Bank, the Silk Road Fund and other financial institutions with a view to exploring the possibility of co-financing projects in the wider Black Sea area that are economically prudent and within their respective mandates;",
    "12": "Acknowledges the interest of the Black Sea Economic Cooperation Organization in contributing to the implementation of the 2030 Agenda for Sustainable Development, 3 bearing in mind the importance of the regional and subregional dimensions, regional economic integration and interconnectivity in sustainable development and that regional and subregional frameworks can facilitate the effective translation of sustainable development policies into concrete action at the national level;",
    "13": "Notes the ongoing contributions of the related bodies of the Black Sea Economic Cooperation Organization, namely, the Parliamentary Assembly of the Black Sea Economic Cooperation, the Black Sea Economic Cooperation Business Council, the Black Sea Trade and Development Bank and the International Centre for Black Sea Studies, to the strengthening of multifaceted regional cooperation in the region;",
    "14": "Welcomes the ongoing commitment of the Black Sea Economic Cooperation Organization to promoting fruitful cooperation with the funds, programmes and specialized agencies of the United Nations system, in particular to developing practical and goal-oriented projects, in areas of common interest, as reiterated in the Black Sea Economic Cooperation Agenda, \u201cTowards an Enhanced Black Sea Economic Cooperation Partnership\u201d, endorsed at the Twentieth Anniversary Summit of the Organization;",
    "15": "Also welcomes the ongoing cooperation between the Black Sea Economic Cooperation Organization and the United Nations Development Programme, the Economic Commission for Europe, the United Nations Office on Drugs and Crime, the International Organization for Migration, the United Nations Environment Programme, the United Nations Industrial Development Organization, the World Health Organization, the World Tourism Organization, the Food and Agriculture Organization of the United Nations and the United Nations Educational, Scientific and Cultural Organization, as well as the working contacts of the Black Sea Economic __________________ 3 Resolution 70/1. A/RES/73/13 Cooperation between the United Nations and the Black Sea Economic Cooperation Organization 18-20447 4/5 Cooperation Organization with the World Bank aimed at promoting sustainable development in the Black Sea region;",
    "16": "Further welcomes the efforts of the Permanent International Secretariat of the Black Sea Economic Cooperation Organization in strengthening its project- oriented dimension by further enhancing the Black Sea Economic Cooperation Project Development Fund and the capacities of the Black Sea Economic Cooperation Project Management Unit;",
    "17": "Takes note of the establishment of the Black Sea Project Promotion Facility and the effective start of its operations in support of regional projects in the fields of renewable energy, energy efficiency, green technologies, the development of small and medium-sized enterprises, the advancement of the knowledge economy, capacity-building and the promotion of the export potential of the States members of the Black Sea Economic Cooperation Organization;",
    "18": "Notes the willingness of the Black Sea Economic Cooperation Organization to continue to implement sustainable development strategies based on a balanced and harmonious relationship between social needs and economic activities and to encourage measures to rehabilitate, protect and preserve the environment in the Black Sea region, and in this regard welcomes its cooperation with the United Nations Environment Programme and the Commission on the Protection of the Black Sea against Pollution;",
    "19": "Also notes the ongoing cooperation between the Black Sea Economic Cooperation Organization and the United Nations Office on Drugs and Crime, and within this framework welcomes the positive results of the ongoing joint project to strengthen the criminal justice response to trafficking in persons in the Black Sea region;",
    "20": "Welcomes the ongoing multifaceted and fruitful cooperation between the Black Sea Economic Cooperation Organization and the Economic Commission for Europe, especially in the area of transport, within the framework of the Cooperation Agreement signed by the two organizations;",
    "21": "Encourages the full implementation of the Cooperation Agreement between the Black Sea Economic Cooperation Organization and the United Nations Environment Programme of 20 February 2002 and the Relationship Agreement between the Organization and the United Nations Industrial Development Organization;",
    "22": "Notes that the Black Sea Economic Cooperation Organization is a member of the Group of Friends of the United Nations Alliance of Civilizations, and welcomes the commitment to broaden cooperation in the accomplishment of the mission of the Alliance, as established by the Secretary-General, and in the promotion of understanding and reconciliation among cultures, globally and regionally, as set out in the Memorandum of Understanding between the Black Sea Economic Cooperation Organization and the United Nations Alliance of Civilizations, which was approved in Bucharest and signed in Baku;",
    "23": "Appreciates the endeavours of the Black Sea Economic Cooperation Organization in enhancing project-oriented cooperation with the European Union in a balanced and mutually beneficial way;",
    "24": "Takes note of the cooperation established between the Black Sea Economic Cooperation Organization and other regional organizations and initiatives, and in this regard encourages the further development of cooperation with the regional organizations and integration unions concerned, in particular those in Eastern Europe and Central Asia; Cooperation between the United Nations and the Black Sea Economic Cooperation Organization A/RES/73/13 5/5 18-20447",
    "25": "Invites the Secretary-General to strengthen dialogue with the Black Sea Economic Cooperation Organization with a view to promoting cooperation and coordination between the secretariats of the two organizations;",
    "26": "Invites the funds, programmes and specialized agencies of the United Nations system to cooperate with the Black Sea Economic Cooperation Organization in order to continue joint projects and programmes with the Organization and its related bodies for the achievement of their objectives;",
    "27": "Requests the Secretary-General to submit to the General Assembly at its seventy-fifth session a report on the implementation of the present resolution;",
    "28": "Decides to include in the provisional agenda of its seventy-fifth session, under the item entitled \u201cCooperation between the United Nations and regional and other organizations\u201d, the sub-item entitled \u201cCooperation between the United Nations and the Black Sea Economic Cooperation Organization\u201d. 39th plenary meeting 26 November 2018"
  },
  "agenda_items": [
    "Item 128"
  ],
  "symbol_references": [
    "A/73/L.25"
  ]
}