{
  "symbol": "A/RES/74/245",
  "filename": "A_RES_74_245.pdf",
  "title": "74/245. International Day of Banks",
  "text": "United Nations \nA/RES/74/245\n \n \nGeneral Assembly \nDistr.: General \n20 January 2020 \n \n19-22520 (E)    210120 \n*1922520* \n \n \nSeventy-fourth session \nAgenda item 17 (b) \nMacroeconomic policy questions: international financial \nsystem and development \n \n \n \n \n Resolution adopted by the General Assembly \non 19 December 2019 \n \n \n \n \n[without reference to a Main Committee (A/74/L.38 and A/74/L.38/Add.1)] \n \n \n 74/245. International Day of Banks \n \n \n \nThe General Assembly,  \n \nReaffirming its resolution 70/1 of 25 September 2015, entitled \u201cTransforming \nour world: the 2030 Agenda for Sustainable Development\u201d, in which it adopted a \ncomprehensive, far-reaching and people-centred set of universal and transformative \nSustainable Development Goals and targets, its commitment to working tirelessly for \nthe full implementation of the Agenda by 2030, its recognition that eradicating \npoverty in all its forms and dimensions, including extreme poverty, is the greatest \nglobal challenge and an indispensable requirement for sustainable development, its \ncommitment to achieving sustainable development in its three dimensions \u2013 \neconomic, social and environmental \u2013 in a balanced and integrated manner, and to \nbuilding upon the achievements of the Millennium Development Goals and seeking \nto address their unfinished business,  \n \nReaffirming also its resolution 69/313 of 27 July 2015 on the Addis Ababa \nAction Agenda of the Third International Conference on Financing for Development, \nwhich is an integral part of the 2030 Agenda for Sustainable Development, supports \nand complements it, helps to contextualize its means of implementation targets with \nconcrete policies and actions, and reaffirms the strong political commitment to \naddress the challenge of financing and creating an enabling environment at all levels \nfor sustainable development in the spirit of global partnership and solidarity,  \n \nRecalling the report of the Inter-Agency Task Force on Financing for \nDevelopment entitled Financing for Sustainable Development Report 2019,1  \n__________________ \n \n1  United Nations publication, Sales No. E.19.I.7. \n\nA/RES/74/245 \nInternational Day of Banks\n \n19-22520\n2/2 \n \n \nEmphasizing the relevance of inclusion in the international financial system at \nall levels and the importance of considering financial inclusion as a policy objective \nin financial regulation, in accordance with national priorities and legislation,  \n \nRecognizing the significant potential of multilateral development banks and \nother international development banks in financing sustainable development and \nproviding know-how, \n \nRecognizing also, at the national level, the vital role of banking systems in \nMember States in contributing to the improvement of the standard of living,  \n \nReaffirming its resolutions 53/199 of 15 December 1998 and 61/185 of \n20 December 2006 on the proclamation of international years, and Economic and \nSocial Council resolution 1980/67 of 25 July 1980 on international years and \nanniversaries,  \n \n1. \nDecides to designate 4 December as the International Day of Banks, to be \nobserved annually;  \n \n2. \nInvites all Member States, the organizations of the United Nations system \nand non-governmental organizations to observe the International Day of Banks, in a \nmanner consistent with national priorities, in order to highlight the role of banks in \ncontributing to achieving sustainable development;   \n \n3. \nInvites the Department of Economic and Social Affairs of the Secretariat, \nthe United Nations Development Programme, the United Nations Conference on \nTrade and Development and other relevant United Nations entities to facilitate the \nobservance of the International Day of Banks in collaboration with other relevant \norganizations, mindful of the provisions contained in the annex to Economic and \nSocial Council resolution 1980/67;  \n \n4. \nStresses that the cost of all activities that may arise from the \nimplementation of the present resolution should be met from voluntary contributions;  \n \n5. \nRequests the Secretary-General to bring the present resolution to the \nattention of all Member States, the organizations of the United Nations system and \nother relevant stakeholders for appropriate observance. \n \n52nd plenary meeting \n19 December 2019 \n \n",
  "paragraphs": {
    "1": "Decides to designate 4 December as the International Day of Banks, to be observed annually;",
    "2": "Invites all Member States, the organizations of the United Nations system and non-governmental organizations to observe the International Day of Banks, in a manner consistent with national priorities, in order to highlight the role of banks in contributing to achieving sustainable development;",
    "3": "Invites the Department of Economic and Social Affairs of the Secretariat, the United Nations Development Programme, the United Nations Conference on Trade and Development and other relevant United Nations entities to facilitate the observance of the International Day of Banks in collaboration with other relevant organizations, mindful of the provisions contained in the annex to Economic and Social Council resolution 1980/67;",
    "4": "Stresses that the cost of all activities that may arise from the implementation of the present resolution should be met from voluntary contributions;",
    "5": "Requests the Secretary-General to bring the present resolution to the attention of all Member States, the organizations of the United Nations system and other relevant stakeholders for appropriate observance. 52nd plenary meeting 19 December 2019"
  },
  "agenda_items": [
    "Item 17"
  ],
  "symbol_references": [
    "A/74/L.38"
  ]
}