{
  "symbol": "A/RES/74/259",
  "filename": "A_RES_74_259.pdf",
  "title": "74/259. Financing of the International Residual Mechanism for Criminal Tribunals",
  "text": "United Nations \nA/RES/74/259\n \n \nGeneral Assembly \nDistr.: General \n9 January 2020 \n \n19-22725 (E)    100120 \n*1922725* \n \n \nSeventy-fourth session \nAgenda item 147 \nFinancing of the International Residual Mechanism \nfor Criminal Tribunals \n \n \n \n \n Resolution adopted by the General Assembly \non 27 December 2019 \n \n \n \n \n[on the report of the Fifth Committee (A/74/601)] \n \n \n 74/259. Financing of the International Residual Mechanism for Criminal \nTribunals \n \n \n \nThe General Assembly, \n \n \n \nI \nSecond performance report on the budget of the International Residual \nMechanism for Criminal Tribunals for the biennium 2018\u20132019 \n \n \nHaving considered the second performance report of the Secretary-General on \nthe budget of the International Residual Mechanism for Criminal Tribunals for the \nbiennium 2018\u20132019,\n1  the related report of the Advisory Committee on \nAdministrative and Budgetary Questions,2 the financial report and audited financial \nstatements for the year ended 31 December 2018 and the report of the Board of \nAuditors on the International Residual Mechanism for Criminal Tribunals 3 and the \nrecommendations contained therein,  \n \nRecalling its resolution 66/240 A of 24 December 2011 on the financing of the \nInternational Residual Mechanism for Criminal Tribunals and its subsequent \nresolutions thereon, the latest of which was resolution 73/277 of 22 December 2018,  \n \n1. \nTakes note of the second performance report of the Secretary-General on \nthe budget of the International Residual Mechanism for Criminal Tribunals for the \nbiennium 2018\u20132019;1  \n__________________ \n \n1  A/74/566. \n \n2  A/74/593. \n \n3  Official Records of the General Assembly, Seventy-fourth Session, Supplement No. 5O \n(A/74/5/Add.15). \n\nA/RES/74/259 \nFinancing of the International Residual\n Mechanism for Criminal Tribunals\n \n19-22725\n2/3 \n \n \n2. \nEndorses the conclusions and recommendations contained in section II of \nthe report of the Advisory Committee on Administrative and Budgetary Questions; 2  \n \n3. \nResolves that, for the biennium 2018\u20132019, the amount of 195,720,600 \nUnited States dollars gross (174,690,800 dollars net) approved in its resolution 73/277 \nfor the financing of the Mechanism shall be adjusted by the amount of 10,292,300 \ndollars gross (8,668,900 dollars net), for a total amount of 185,428,300 dollars gross \n(166,021,900 dollars net);  \n \n \n \nII \nBudget for the International Residual Mechanism for Criminal Tribunals \nfor 2020 \n \n \nHaving considered the reports of the Secretary-General on the proposed budget \nfor the International Residual Mechanism for Criminal Tribunals for 2020 4 and on the \nrevised estimates arising from the effect of changes in rates of exchange and \ninflation,5  \n \nHaving also considered the related reports of the Advisory Committee,6  \n \n1. \nTakes note of the reports of the Secretary-General on the proposed budget \nfor the International Residual Mechanism for Criminal Tribunals for 2020 4 and on the \nrevised estimates arising from the effect of changes in rates of exchange and \ninflation;5 \n \n2. \nEndorses the conclusions and recommendations contained in the reports \nof the Advisory Committee;6 \n \n3. \nDecides to establish one temporary P-4 (Budget and Finance) post in the \nArusha branch, within existing resources;  \n \n4. \nRequests the Secretary-General to ensure that the Mechanism makes every \neffort to promptly complete its remaining work;  \n \n5. \nDecides to appropriate to the Special Account for the International \nResidual Mechanism for Criminal Tribunals a total amount of 96,924,500 dollars \ngross (86,911,800 dollars net) for 2020, as detailed in the annex to the present \nresolution;  \n \n6. \nAlso decides that the total assessment for 2020 under the Special Account \namounting to 86,632,200 dollars shall consist of:  \n \n(a) \n96,924,500 dollars, being the estimated appropriation approved for the period; \n \n(b) \nLess 10,292,300 dollars, being the decrease in the final appropriation for \nthe biennium 2018\u20132019, approved by the General Assembly in paragraph 3 of \nsection I above;  \n \n7. \nFurther decides to apportion the amount of 43,316,100 dollars gross \n(39,121,450 dollars net) among Member States in accordance with the scale of \nassessments applicable to the regular budget of the United Nations for 2020;  \n \n8. \nDecides to apportion the amount of 43,316,100 dollars gross (39,121,450 \ndollars net) among Member States in accordance with the scale of assessments \napplicable to peacekeeping operations of the United Nations for 2020;  \n \n9. \nAlso decides that, in accordance with the provisions of its resolution 973 (X) \nof 15 December 1955, there shall be set off against the apportionment among Member \n__________________ \n \n4  A/74/355 and A/74/355/Corr.1. \n \n5  A/74/586. \n \n6  A/74/593 and A/74/7/Add.31. \n\nFinancing of the International Residual \nMechanism for Criminal Tribunals \nA/RES/74/259\n \n3/3\n19-22725 \n \nStates, as provided for in paragraphs 7 and 8 above, their respective share in the Tax \nEqualization Fund of the estimated staff assessment income in the amount of \n8,389,300 dollars approved for the Mechanism for 2020. \n \n52nd (resumed) plenary meeting \n27 December 2019 \n \n \nAnnex \n \n \n Financing of the International Residual Mechanism for Criminal \nTribunals for 2020 \n \n \nGross \nNet of staff \nassessment \n(United States dollars) \nEstimated appropriation for 2020 (A/74/355 and A/74/355/Corr.1) \n106 054 900 \n94 793 800 \nRevised estimates: effect of changes in rates of exchange and \ninflation \n(3 488 400) \n(2 967 900) \nRecommendations of the Advisory Committee on Administrative \nand Budgetary Questionsa \n(5 642 000) \n(4 914 100) \nRecommendations of the Fifth Committee \n\u2013 \n\u2013 \nEstimated initial appropriation for 2020 \n96 924 500 \n86 911 800 \nTotal assessment for 2020 \n \n \nRequirements for 2020 \n96 924 500 \n86 911 800 \nRequirements arising from the final appropriation for the \nbiennium 2018\u20132019 \n(10 292 300) \n(8 668 900) \nNet contributions assessed on Member States for 2020 \n86 632 200 \n78 242 900 \nIncluding: \n \n \nContributions assessed on Member States in accordance with \nthe scale of assessments applicable to the regular budget of the \nUnited Nations for 2020 \n43 316 100 \n39 121 450 \nContributions assessed on Member States in accordance with \nthe scale of assessments applicable to peacekeeping operations \nof the United Nations for 2020 \n43 316 100 \n39 121 450 \n \n \na Reflect amounts after recosting.  \n \n",
  "paragraphs": {
    "1": "Takes note of the reports of the Secretary-General on the proposed budget for the International Residual Mechanism for Criminal Tribunals for 2020 4 and on the revised estimates arising from the effect of changes in rates of exchange and inflation;5",
    "2": "Endorses the conclusions and recommendations contained in the reports of the Advisory Committee;6",
    "3": "Decides to establish one temporary P-4 (Budget and Finance) post in the Arusha branch, within existing resources;",
    "4": "Requests the Secretary-General to ensure that the Mechanism makes every effort to promptly complete its remaining work;",
    "5": "Decides to appropriate to the Special Account for the International Residual Mechanism for Criminal Tribunals a total amount of 96,924,500 dollars gross (86,911,800 dollars net) for 2020, as detailed in the annex to the present resolution;",
    "6": "Also decides that the total assessment for 2020 under the Special Account amounting to 86,632,200 dollars shall consist of: (a) 96,924,500 dollars, being the estimated appropriation approved for the period; (b) Less 10,292,300 dollars, being the decrease in the final appropriation for the biennium 2018\u20132019, approved by the General Assembly in paragraph 3 of section I above;",
    "7": "Further decides to apportion the amount of 43,316,100 dollars gross (39,121,450 dollars net) among Member States in accordance with the scale of assessments applicable to the regular budget of the United Nations for 2020;",
    "8": "Decides to apportion the amount of 43,316,100 dollars gross (39,121,450 dollars net) among Member States in accordance with the scale of assessments applicable to peacekeeping operations of the United Nations for 2020;",
    "9": "Also decides that, in accordance with the provisions of its resolution 973 (X) of 15 December 1955, there shall be set off against the apportionment among Member __________________ 4 A/74/355 and A/74/355/Corr.1. 5 A/74/586. 6 A/74/593 and A/74/7/Add.31. Financing of the International Residual Mechanism for Criminal Tribunals A/RES/74/259 3/3 19-22725 States, as provided for in paragraphs 7 and 8 above, their respective share in the Tax Equalization Fund of the estimated staff assessment income in the amount of 8,389,300 dollars approved for the Mechanism for 2020. 52nd (resumed) plenary meeting 27 December 2019 Annex Financing of the International Residual Mechanism for Criminal Tribunals for 2020 Gross Net of staff assessment (United States dollars) Estimated appropriation for 2020 (A/74/355 and A/74/355/Corr.1) 106 054 900 94 793 800 Revised estimates: effect of changes in rates of exchange and inflation (3 488 400) (2 967 900) Recommendations of the Advisory Committee on Administrative and Budgetary Questionsa (5 642 000) (4 914 100) Recommendations of the Fifth Committee \u2013 \u2013 Estimated initial appropriation for 2020 96 924 500 86 911 800 Total assessment for 2020 Requirements for 2020 96 924 500 86 911 800 Requirements arising from the final appropriation for the biennium 2018\u20132019 (10 292 300) (8 668 900) Net contributions assessed on Member States for 2020 86 632 200 78 242 900 Including: Contributions assessed on Member States in accordance with the scale of assessments applicable to the regular budget of the United Nations for 2020 43 316 100 39 121 450 Contributions assessed on Member States in accordance with the scale of assessments applicable to peacekeeping operations of the United Nations for 2020 43 316 100 39 121 450 a Reflect amounts after recosting."
  },
  "agenda_items": [
    "Item 147"
  ],
  "symbol_references": []
}