{
  "symbol": "A/RES/72/277",
  "filename": "A_RES_72_277.pdf",
  "title": "72/277. Towards a Global Pact for the Environment",
  "text": "United Nations \nA/RES/72/277\n \n \nGeneral Assembly \nDistr.: General \n14 May 2018 \n \n18-07627 (E)    160518     \n*1807627* \n \n \nSeventy-second session \nAgenda item 14 \n \n \n \n \n Resolution adopted by the General Assembly \non 10 May 2018 \n \n \n \n \n[without reference to a Main Committee (A/72/L.51 and A/72/L.51/Add.1)] \n \n \n 72/277. Towards a Global Pact for the Environment \n \n \n \nThe General Assembly, \n \nReaffirming the purposes and principles of the Charter of the United Nations, \n \nRecalling the Declaration of the United Nations Conference on the Human \nEnvironment,1 the Rio Declaration on Environment and Development, 2 Agenda 21,3 \nthe Programme for the Further Implementation of Agenda 21,4 the Johannesburg \nDeclaration on Sustainable Development5 and the Plan of Implementation of the \nWorld Summit on Sustainable Development (Johannesburg Plan of Implementation) 6 \nand the outcome document of the United Nations Conference on Sustainable \nDevelopment, entitled \u201cThe future we want\u201d,7 as well as the outcomes of all the \nmajor United Nations conferences and summits in the economic, social and \nenvironmental fields, \n \nRecognizing existing obligations and commitments under international \nenvironmental law, \n \nReaffirming all the principles of the Rio Declaration, \n__________________ \n \n1  See Report of the United Nations Conference on the Human Environment, Stockholm, 5\u201316 June \n1972 (A/CONF.48/14/Rev.1), part one, chap. I. \n \n2  Report of the United Nations Conference on Environment and Development, Rio de Janeiro, \n3\u221214 June 1992, vol. I, Resolutions Adopted by the Conference (United Nations publication, \nSales No. E.93.I.8 and corrigendum), resolution 1, annex I. \n \n3  Ibid., annex II. \n \n4  Resolution S-19/2, annex. \n \n5  Report of the World Summit on Sustainable Development, Johannesburg, South Africa, \n26 August\u20134 September 2002 (United Nations publication, Sales No. 03.II.A.1 and corrigendum), \nchap. I, resolution 1, annex. \n \n6  Ibid., resolution 2, annex. \n \n7  Resolution 66/288, annex. \n\nA/RES/72/277 \nTowards a Global Pact for the Environment\n \n18-07627\n2/3 \n \n \nReaffirming also its resolution 70/1 of 25 September 2015, entitled \n\u201cTransforming our world: the 2030 Agenda for Sustainable Development\u201d, in which \nit adopted a comprehensive, far-reaching and people-centred set of universal and \ntransformative Sustainable Development Goals and targets, its commitment to \nworking tirelessly for the full implementation of the Agenda by 2030, its recognition \nthat eradicating poverty in all its forms and dimensions, including extreme poverty, \nis the greatest global challenge and an indispensable requirement for sustainable \ndevelopment, its commitment to achieving sustainable development in its three \ndimensions \u2013 economic, social and environmental \u2013 in a balanced and integrated \nmanner, and to building upon the achievements of the Millennium Development \nGoals and seeking to address their unfinished business, \n \nNoting the convening of the high-level event held on the sidelines of the \nseventy-second session of the General Assembly on 19 September 2017, entitled \n\u201cSummit on a Global Pact for the Environment\u201d, \n \nStressing the need to continue to address, in a comprehensive and coherent \nmanner, the challenges posed by environmental degradation in the context of \nsustainable development, \n \n1. \nRequests the Secretary-General to submit to the General Assembly at its \nseventy-third session in 2018 a technical and evidence-based report that identifies and \nassesses possible gaps in international environmental law and environment-related \ninstruments with a view to strengthening their implementation; \n \n2. \nDecides to establish an ad hoc open-ended working group, under the \nauspices of the General Assembly, to consider the report and discuss possible options \nto address possible gaps in international environmental law and environment-related \ninstruments, as appropriate, and, if deemed necessary, the scope, parameters and \nfeasibility of an international instrument, with a view to making recommendations, \nwhich may include the convening of an intergovernmental conference to adopt an \ninternational instrument, to the Assembly during the first half of 2019; \n \n3. \nAlso decides that the ad hoc open-ended working group shall be open to \nparticipation by all States Members of the United Nations and all members of the \nspecialized agencies; \n \n4. \nFurther decides that attendance at the sessions of the ad hoc open-ended \nworking group as observers will be opened to relevant non-governmental \norganizations in consultative status with the Economic and Social Council in \naccordance with the provisions of Council resolution 1996/31 of 25 July 1996, as well \nas to those that were accredited to relevant conferences and summits, 8 on the \nunderstanding that participation means attending formal meetings, unless otherwise \ndecided by the working group in specific situations, receiving copies of the official \ndocuments, making available their materials to delegates and addressing the meetings, \nthrough a limited number of their representatives, as appropriate; \n \n5. \nDecides that the ad hoc open-ended working group shall hold the following \nsessions, with the provision of interpretation services, in accordance with established \npractice:  \n \n(a) \nAn organizational session, to be held for a duration of three working days, \nby the end of the seventy-second session of the General Assembly, in New York, in \n__________________ \n \n8  Reference is made to the non-governmental organizations that were accredited to the following \nrelevant conferences and summits: the United Nations Conference on Environment and \nDevelopment, the World Summit on Sustainable Development, the United Nations Conference on \nSustainable Development and the United Nations summit for the adoption of the post-2015 \ndevelopment agenda. \n\nTowards a Global Pact for the Environment \nA/RES/72/277\n \n3/3\n18-07627 \n \norder to examine matters related to the organization of the work of the ad hoc open-\nended working group, including the duration and number of its substantive sessions; \n \n(b) \nSubstantive sessions, to be held in Nairobi, the first of which at least one \nmonth after the submission of the report of the Secretary-General; \n \n6. \nRequests the President of the General Assembly at its seventy-second \nsession to appoint two co-chairs of the ad hoc open-ended working group, one from \na developing country and one from a developed country, to oversee its consultations, \nin regular coordination and consultation with all Member States, regional groups and \nall relevant stakeholders, and underlines that the work of the working group must be \nopen, transparent and inclusive; \n \n7. \nDecides that the costs associated with the work of the ad hoc open-ended \nworking group shall be met from voluntary contributions; \n \n8. \nRequests the Secretary-General to arrange for substantive support to be \nprovided by the United Nations Environment Programme, on the basis of voluntary \ncontributions, without prejudice to the current voluntary funded programmatic \nactivities of the Programme, including all assistance necessary for the performance \nof the work of the ad hoc open-ended working group, secretariat services and the \nprovision of essential background information and relevant documents, complemented, \nas appropriate, by other relevant United Nations agencies, funds and programmes;  \n \n9. \nRecognizes that the process indicated above should not undermine existing \nrelevant legal instruments and frameworks and relevant global, regional and sectoral \nbodies; \n \n10. Requests the Secretary-General to establish a special voluntary trust fund \nin support of the process, and invites Member States, international financial \ninstitutions, donor agencies, intergovernmental organizations, non-governmental \norganizations and natural and juridical persons to make financial contributions to the \nvoluntary trust fund; \n \n11. \nAlso requests the Secretary-General to establish a special voluntary trust \nfund for the purpose of assisting developing countries, in particular, the least \ndeveloped countries, landlocked developing countries and small island developing \nStates, in attending the sessions of the ad hoc open-ended working group, including \ndaily subsistence allowance, in addition to defraying the costs of economy-class \ntravel for one delegate per State for each session, and invites Member States, \ninternational financial institutions, donor agencies, intergovernmental organizations, \nnon-governmental organizations and natural and juridical persons to make financial \ncontributions to the voluntary trust fund. \n \n88th plenary meeting  \n10 May 2018 \n \n",
  "paragraphs": {
    "1": "Requests the Secretary-General to submit to the General Assembly at its seventy-third session in 2018 a technical and evidence-based report that identifies and assesses possible gaps in international environmental law and environment-related instruments with a view to strengthening their implementation;",
    "2": "Decides to establish an ad hoc open-ended working group, under the auspices of the General Assembly, to consider the report and discuss possible options to address possible gaps in international environmental law and environment-related instruments, as appropriate, and, if deemed necessary, the scope, parameters and feasibility of an international instrument, with a view to making recommendations, which may include the convening of an intergovernmental conference to adopt an international instrument, to the Assembly during the first half of 2019;",
    "3": "Also decides that the ad hoc open-ended working group shall be open to participation by all States Members of the United Nations and all members of the specialized agencies;",
    "4": "Further decides that attendance at the sessions of the ad hoc open-ended working group as observers will be opened to relevant non-governmental organizations in consultative status with the Economic and Social Council in accordance with the provisions of Council resolution 1996/31 of 25 July 1996, as well as to those that were accredited to relevant conferences and summits, 8 on the understanding that participation means attending formal meetings, unless otherwise decided by the working group in specific situations, receiving copies of the official documents, making available their materials to delegates and addressing the meetings, through a limited number of their representatives, as appropriate;",
    "5": "Decides that the ad hoc open-ended working group shall hold the following sessions, with the provision of interpretation services, in accordance with established practice: (a) An organizational session, to be held for a duration of three working days, by the end of the seventy-second session of the General Assembly, in New York, in __________________ 8 Reference is made to the non-governmental organizations that were accredited to the following relevant conferences and summits: the United Nations Conference on Environment and Development, the World Summit on Sustainable Development, the United Nations Conference on Sustainable Development and the United Nations summit for the adoption of the post-2015 development agenda. Towards a Global Pact for the Environment A/RES/72/277 3/3 18-07627 order to examine matters related to the organization of the work of the ad hoc open- ended working group, including the duration and number of its substantive sessions; (b) Substantive sessions, to be held in Nairobi, the first of which at least one month after the submission of the report of the Secretary-General;",
    "6": "Requests the President of the General Assembly at its seventy-second session to appoint two co-chairs of the ad hoc open-ended working group, one from a developing country and one from a developed country, to oversee its consultations, in regular coordination and consultation with all Member States, regional groups and all relevant stakeholders, and underlines that the work of the working group must be open, transparent and inclusive;",
    "7": "Decides that the costs associated with the work of the ad hoc open-ended working group shall be met from voluntary contributions;",
    "8": "Requests the Secretary-General to arrange for substantive support to be provided by the United Nations Environment Programme, on the basis of voluntary contributions, without prejudice to the current voluntary funded programmatic activities of the Programme, including all assistance necessary for the performance of the work of the ad hoc open-ended working group, secretariat services and the provision of essential background information and relevant documents, complemented, as appropriate, by other relevant United Nations agencies, funds and programmes;",
    "9": "Recognizes that the process indicated above should not undermine existing relevant legal instruments and frameworks and relevant global, regional and sectoral bodies;",
    "10": "Requests the Secretary-General to establish a special voluntary trust fund in support of the process, and invites Member States, international financial institutions, donor agencies, intergovernmental organizations, non-governmental organizations and natural and juridical persons to make financial contributions to the voluntary trust fund;",
    "11": "Also requests the Secretary-General to establish a special voluntary trust fund for the purpose of assisting developing countries, in particular, the least developed countries, landlocked developing countries and small island developing States, in attending the sessions of the ad hoc open-ended working group, including daily subsistence allowance, in addition to defraying the costs of economy-class travel for one delegate per State for each session, and invites Member States, international financial institutions, donor agencies, intergovernmental organizations, non-governmental organizations and natural and juridical persons to make financial contributions to the voluntary trust fund. 88th plenary meeting 10 May 2018"
  },
  "agenda_items": [
    "Item 14"
  ],
  "symbol_references": [
    "A/72/L.51"
  ]
}