{
  "symbol": "A/RES/73/319",
  "filename": "A_RES_73_319.pdf",
  "title": "73/319. Financing of the United Nations Mission in Liberia",
  "text": "United Nations \nA/RES/73/319\n \n \nGeneral Assembly \nDistr.: General \n17 July 2019 \n \n19-11315 (E)    190719 \n*1911315* \n \n \nSeventy-third session \nAgenda item 160 \n \n \n \n \n Resolution adopted by the General Assembly on 3 July 2019 \n \n \n \n \n[on the report of the Fifth Committee (A/73/935)] \n \n \n 73/319. Financing of the United Nations Mission in Liberia \n \n \n \nThe General Assembly, \n \nHaving considered the report of the Secretary-General on the financing of the \nUnited Nations Mission in Liberia1 and the related report of the Advisory Committee \non Administrative and Budgetary Questions,2 \n \nRecalling Security Council resolution 1497 (2003) of 1 August 2003, by which \nthe Council declared its readiness to establish a United Nations stabilization force to \nsupport the transitional government and to assist in the implementation of a \ncomprehensive peace agreement in Liberia, \n \nRecalling also Security Council resolution 1509 (2003) of 19 September 2003, \nby which the Council established the United Nations Mission in Liberia for a period \nof 12 months, and the subsequent resolutions by which the Council extended the \nmandate of the Mission, the latest of which was resolution 2333 (2016) of \n23 December 2016, by which the Council extended the mandate of the Mission for a \nfinal period until 30 March 2018 and requested the Secretary-General to complete by \n30 April 2018 the withdrawal of all uniformed and civilian components, other than \nthose required to complete the liquidation of the Mission, \n \nRecalling further its resolution 58/315 of 1 July 2004, \n \nRecalling its resolution 58/261 A of 23 December 2003 on the financing of the \nMission and its subsequent resolutions thereon, the latest of which was resolution \n72/296 of 5 July 2018, as well as its decision 72/558 of 5 July 2018, \n \nReaffirming the general principles underlying the financing of United Nations \npeacekeeping operations, as stated in its resolutions 1874 (S-IV) of 27 June 1963, \n3101 (XXVIII) of 11 December 1973 and 55/235 of 23 December 2000, \n__________________ \n \n1 A/73/692. \n \n2 A/73/855. \n\nA/RES/73/319 \n \n19-11315\n2/3 \n \n \nNoting with appreciation that voluntary contributions have been made to the \nMission, \n \nMindful of the fact that it is essential to provide the Mission with the financial \nresources necessary to enable it to fulfil its responsibilities under the relevant \nresolutions of the Security Council, \n \n1. \nTakes note of the status of contributions to the United Nations Mission in \nLiberia as at 30 April 2019, including the contributions outstanding in the amount of \n12.8 million United States dollars, representing some 0.2 per cent of the total assessed \ncontributions, notes with concern that only 141 Member States have paid their \nassessed contributions in full, and urges all other Member States, in particular those \nin arrears, to ensure payment of their outstanding assessed contributions; \n \n2. \nExpresses its appreciation to those Member States that have paid their \nassessed contributions in full, and urges all other Member States to make every \npossible effort to ensure payment of their assessed contributions to the Mission in full; \n \n3. \nEndorses the conclusions and recommendations contained in the report of \nthe Advisory Committee on Administrative and Budgetary Questions,2 and requests \nthe Secretary-General to ensure their full implementation; \n \n4. \nEncourages the Secretary-General to continue to draw on lessons learned \nand best practices for future drawdowns and closures; \n \n5. \nWelcomes the capacity-building programme for national staff, and \nencourages the Secretary-General to implement similar programmes for future \nclosing missions; \n \n6. \nStresses the important contribution of experienced staff, in particular the \nnational staff, during the drawdown and the liquidation of the Mission; \n \n7. \nEncourages the Mission to continue to assist national staff in their \ntransition to future professional careers outside the Mission, and requests the \nSecretary-General to report thereon; \n \n8. \nRequests the Secretary-General to identify the optimal level of personnel \nresources and corresponding skill sets necessary to effectively and efficiently draw \ndown and liquidate a closing mission, taking into consideration the experience of \nexisting personnel; \n \n9. \nRecalls paragraph 7 of the report of the Advisory Committee, and in this \nregard requests the Secretary-General to more closely analyse costing assumptions \nassociated with closing missions to provide a more realistic budgeting methodology \nfor future missions undergoing drawdown and liquidation, and to ensure that relevant \ndepartments and support structures are involved with the monitoring and oversight of \nthe liquidation process in missions from an early stage; \n \n10. Requests the Secretary-General to continue his efforts to identify and \naddress on time and in full all the residual activities, including unforeseen liabilities \nidentified after the closure of the Mission, and stresses the importance of informing \ncontractors of the settlement of any residual claims; \n \n11. \nAlso requests the Secretary-General in future mission liquidation plans to \ninclude a risk assessment, mitigation measures and, in the case of theft, appropriate \nsteps to recover stolen assets, and to ensure that the relevant staff and financial \nregulations and rules are applied in any future cases of loss or theft of assets; \n \n12. Welcomes the efforts of the Secretary-General to reduce the overall \nenvironmental footprint of the Mission in cooperation with the Liberian authorities, \n\nA/RES/73/319\n \n3/3\n19-11315 \n \nand stresses the necessity to further ensure that all relevant measures are taken in line \nwith the respective regulations and rules in order to ensure an environmentally \nresponsible closure of the Mission; \n \n \n \nBudget performance report for the period from 1 July 2017 to 30 June 2018 \n \n \n13. Takes note of the report of the Secretary-General on the budget \nperformance of the Mission for the period from 1 July 2017 to 30 June 2018; 1 \n \n14. Also takes note of the amount of 6,614,700 dollars comprising the \nunencumbered balance of 385,100 dollars in respect of the financial period from \n1 July 2017 to 30 June 2018, as well as the other revenue and adjustments in the \namount of 6,229,600 dollars in respect of the same period, and decides to defer action \nthereon until it considers the final performance report of the Mission; \n \n15. Further takes note of the amount of 405,100 dollars representing the \nincrease in estimated staff assessment revenue in respect of the financial period from \n1 July 2017 to 30 June 2018, and decides to defer action thereon until it considers the \nfinal performance report of the Mission; \n \n16. Decides to include in the provisional agenda of its seventy-fourth session \nthe item entitled \u201cFinancing of the United Nations Mission in Liberia\u201d. \n \n97th plenary meeting \n3 July 2019 \n \n",
  "paragraphs": {
    "1": "Takes note of the status of contributions to the United Nations Mission in Liberia as at 30 April 2019, including the contributions outstanding in the amount of 12.8 million United States dollars, representing some 0.2 per cent of the total assessed contributions, notes with concern that only 141 Member States have paid their assessed contributions in full, and urges all other Member States, in particular those in arrears, to ensure payment of their outstanding assessed contributions;",
    "2": "Expresses its appreciation to those Member States that have paid their assessed contributions in full, and urges all other Member States to make every possible effort to ensure payment of their assessed contributions to the Mission in full;",
    "3": "Endorses the conclusions and recommendations contained in the report of the Advisory Committee on Administrative and Budgetary Questions,2 and requests the Secretary-General to ensure their full implementation;",
    "4": "Encourages the Secretary-General to continue to draw on lessons learned and best practices for future drawdowns and closures;",
    "5": "Welcomes the capacity-building programme for national staff, and encourages the Secretary-General to implement similar programmes for future closing missions;",
    "6": "Stresses the important contribution of experienced staff, in particular the national staff, during the drawdown and the liquidation of the Mission;",
    "7": "Encourages the Mission to continue to assist national staff in their transition to future professional careers outside the Mission, and requests the Secretary-General to report thereon;",
    "8": "Requests the Secretary-General to identify the optimal level of personnel resources and corresponding skill sets necessary to effectively and efficiently draw down and liquidate a closing mission, taking into consideration the experience of existing personnel;",
    "9": "Recalls paragraph 7 of the report of the Advisory Committee, and in this regard requests the Secretary-General to more closely analyse costing assumptions associated with closing missions to provide a more realistic budgeting methodology for future missions undergoing drawdown and liquidation, and to ensure that relevant departments and support structures are involved with the monitoring and oversight of the liquidation process in missions from an early stage;",
    "10": "Requests the Secretary-General to continue his efforts to identify and address on time and in full all the residual activities, including unforeseen liabilities identified after the closure of the Mission, and stresses the importance of informing contractors of the settlement of any residual claims;",
    "11": "Also requests the Secretary-General in future mission liquidation plans to include a risk assessment, mitigation measures and, in the case of theft, appropriate steps to recover stolen assets, and to ensure that the relevant staff and financial regulations and rules are applied in any future cases of loss or theft of assets;",
    "12": " and stresses the necessity to further ensure that all relevant measures are taken in line with the respective regulations and rules in order to ensure an environmentally responsible closure of the Mission; Budget performance report for the period from 1 July 2017 to 30 June 2018",
    "13": "Takes note of the report of the Secretary-General on the budget performance of the Mission for the period from 1 July 2017 to 30 June 2018; 1",
    "14": "Also takes note of the amount of 6,614,700 dollars comprising the unencumbered balance of 385,100 dollars in respect of the financial period from 1 July 2017 to 30 June 2018, as well as the other revenue and adjustments in the amount of 6,229,600 dollars in respect of the same period, and decides to defer action thereon until it considers the final performance report of the Mission;",
    "15": "Further takes note of the amount of 405,100 dollars representing the increase in estimated staff assessment revenue in respect of the financial period from 1 July 2017 to 30 June 2018, and decides to defer action thereon until it considers the final performance report of the Mission;",
    "16": "Decides to include in the provisional agenda of its seventy-fourth session the item entitled \u201cFinancing of the United Nations Mission in Liberia\u201d."
  },
  "agenda_items": [
    "Item 160"
  ],
  "symbol_references": []
}