{
  "symbol": "A/RES/72/192",
  "filename": "A_RES_72_192.pdf",
  "title": "72/192. Follow-up to the Thirteenth United Nations Congress on Crime Prevention and Criminal Justice and preparations for the Fourteenth United Nations Congress on Crime Prevention and Criminal Justice",
  "text": "United Nations \nA/RES/72/192\n \n \nGeneral Assembly \nDistr.: General \n23 January 2018 \n \n17-23190 (E)    260118 \n*1723190* \n \n \nSeventy-second session \nAgenda item 107 \n \n \n \n \n Resolution adopted by the General Assembly \non 19 December 2017 \n \n \n \n \n[on the report of the Third Committee (A/72/440)] \n \n \n 72/192. Follow-up to the Thirteenth United Nations Congress on \nCrime Prevention and Criminal Justice and preparations \nfor the Fourteenth United Nations Congress on Crime \nPrevention and Criminal Justice \n \n \n \nThe General Assembly, \n \nRecalling its resolution 56/119 of 19 December 2001 on the role, function, \nperiodicity and duration of the United Nations congresses on the prevention of crime \nand the treatment of offenders, in which it stipulated the guidelines in accordance \nwith which, beginning in 2005, the congresses, pursuant to paragraphs 29 and 30 of \nthe statement of principles and programme of action of the United Nations crime \nprevention and criminal justice programme,1 should be held, \n \nEmphasizing the responsibility assumed by the United Nations in the field of \ncrime prevention and criminal justice in pursuance of Economic and Social Council \nresolution 155 C (VII) of 13 August 1948 and General Assembly resolution 415 (V) \nof 1 December 1950, \n \nAcknowledging that the United Nations congresses on crime prevention and \ncriminal justice, as major intergovernmental forums, have influenced national \npolicies and practices and promoted international cooperation in that field by \nfacilitating the exchange of views and experience, mobilizing public opinion and \nrecommending policy options at the national, regional and international levels, \n \nBearing in mind the consultative nature of the United Nations congresses on \ncrime prevention and criminal justice and their role as a forum for promoting the \nexchange of experience in research, law and policy development and the \nidentification of emerging trends and issues in crime prevention and criminal justice \namong States, intergovernmental organizations and individual experts representing \nvarious professions and disciplines, \n__________________ \n \n1  Resolution 46/152, annex. \n\nA/RES/72/192 \nFollow-up to the Thirteenth United Nations Congress on Crime Prevention\nand Criminal Justice and preparations for the Fourteenth United Nations\nCongress on Crime Prevention and Criminal Justice\n \n17-23190 \n2/5 \n \n \nRecalling its resolution 57/270 B of 23 June 2003 on the integrated and \ncoordinated implementation of and follow-up to the outcomes of the major United \nNations conferences and summits in the economic and social fields, in which it \nstressed that all countries should promote policies consistent and coherent with the \ncommitments of the major United Nations conferences and summits, emphasized that \nthe United Nations system had an important responsibility to assist Governments to \nstay fully engaged in the follow-up to and implementation of agreements and \ncommitments reached at the major United Nations conferences and summits, and \ninvited its intergovernmental bodies to further promote the implementation of the \noutcomes of the major United Nations conferences and summits, \n \nRecalling also its resolution 62/173 of 18 December 2007, in which it endorsed \nthe recommendations made by the Intergovernmental Group of Experts on Lessons \nLearned from United Nations Congresses on Crime Prevention and Criminal Justice \nat its meeting held in Bangkok from 15 to 18 August 2006,2 \n \nRecalling further its resolution 70/174 of 17 December 2015, in which it \nendorsed the Doha Declaration on Integrating Crime Prevention and Criminal Justice \ninto the Wider United Nations Agenda to Address Social and Economic Challenges \nand to Promote the Rule of Law at the National and International Levels, and Public \nParticipation, adopted by the Thirteenth United Nations Congress on Crime \nPrevention and Criminal Justice, requested the Commission on Crime Prevention and \nCriminal Justice to review the implementation of the Doha Declaration under the \nstanding item on its agenda entitled \u201cFollow-up to the Thirteenth United Nations \nCongress on Crime Prevention and Criminal Justice and preparations for the \nFourteenth United Nations Congress on Crime Prevention and Criminal Justice\u201d, and \nwelcomed with appreciation the offer of the Government of Japan to act as host to the \nFourteenth United Nations Congress on Crime Prevention and Criminal Justice, to be \nheld in 2020, \n \nReaffirming the commitment expressed by Member States in the Doha \nDeclaration to endeavour to mainstream a gender perspective into their criminal \njustice systems by developing and implementing national strategies and plans to \npromote the full protection of women and girls from all acts of violence, including \ngender-related killing of women and girls, and to promote gender-specific measures \nas an integral part of their policies on crime prevention, criminal justice and the \ntreatment of offenders, including the rehabilitation and reintegration of women \noffenders into society, taking into consideration the United Nations Rules for the \nTreatment of Women Prisoners and Non-custodial Measures for Women Offenders \n(the Bangkok Rules),3 \n \nRecalling its resolution 71/206 of 19 December 2016, in which it requested the \nCommission to approve at its twenty-sixth session the overall theme, the agenda items \nand the topics for the workshops of the Fourteenth Congress, recommended that, \nbuilding on the experience and the success of the Thirteenth Congress, all efforts be \nmade to ensure that the overall theme and the agenda items and workshop topics of \nthe Fourteenth Congress be interrelated and that the agenda items and workshop \ntopics be streamlined and limited in number, and encouraged the holding of side \nevents that were focused on and complemented the agenda items and workshops, \n \nRecalling also its resolution 70/1 of 25 September 2015, \n \nEncouraged by the success of the Thirteenth Congress as one of the largest and \nmost diverse forums for the exchange of views on and experiences in research, law \nand policy and programme development between States, intergovernmental and non-\n__________________ \n \n2  See E/CN.15/2007/6, chap. IV. \n \n3  Resolution 65/229, annex. \n\nFollow-up to the Thirteenth United Nations Congress on Crime Prevention \nand Criminal Justice and preparations for the Fourteenth United Nations \nCongress on Crime Prevention and Criminal Justice \nA/RES/72/192\n \n3/5 \n17-23190 \n \ngovernmental organizations and individual experts representing various professions \nand disciplines, \n \nStressing the importance of undertaking all preparatory activities for the \nFourteenth Congress in a timely and concerted manner, \n \nHaving considered the report of the Secretary-General,4 \n \n1. \nReiterates its invitation to Governments to take into consideration the \nDoha Declaration on Integrating Crime Prevention and Criminal Justice into the \nWider United Nations Agenda to Address Social and Economic Challenges and to \nPromote the Rule of Law at the National and International Levels, and Public \nParticipation, adopted by the Thirteenth United Nations Congress on Crime \nPrevention and Criminal Justice,5 when formulating legislation and policy directives \nand to make every effort, where appropriate, to implement the principles contained \ntherein in conformity with the purposes and principles of the Charter of the United \nNations; \n \n2. \nWelcomes the work undertaken by the United Nations Office on Drugs and \nCrime in ensuring appropriate follow-up to the implementation of the Doha \nDeclaration, and also welcomes in that regard the contribution of the Government of \nQatar; \n \n3. \nNotes the progress made thus far in the preparations for the Fourteenth \nUnited Nations Congress on Crime Prevention and Criminal Justice; \n \n4. \nDecides that the duration of the Fourteenth Congress should not exceed \neight days, including pre-Congress consultations; \n \n5. \nAlso decides that the main theme of the Fourteenth Congress shall be \n\u201cAdvancing crime prevention, criminal justice and the rule of law: towards the \nachievement of the 2030 Agenda\u201d; \n \n6. \nFurther decides that, in accordance with its resolution 56/119, the \nFourteenth Congress shall open with a high-level segment, at which States will be \ninvited to be represented at the highest possible level, for example, by Heads of State \nor Government, Government ministers or attorneys general, and that representatives \nwill be given an opportunity to make statements on the topics of the Congress; \n \n7. \nDecides that, in accordance with its resolution 56/119, the Fourteenth \nCongress shall adopt a single declaration, to be submitted to the Commission on \nCrime Prevention and Criminal Justice for its consideration; \n \n8. \nRequests the Secretary-General to encourage the participation of \nrepresentatives from relevant entities of the United Nations system in the Fourteenth \nCongress, bearing in mind the main theme, agenda items and workshop topics of the \nCongress; \n \n9. \nApproves the following provisional agenda for the Fourteenth Congress, \nfinalized by the Commission at its twenty-sixth session: \n1. \nOpening of the Congress. \n2. \nOrganizational matters. \n3. \nComprehensive strategies for crime prevention towards social and \neconomic development. \n__________________ \n \n4  E/CN.15/2017/11. \n \n5  Resolution 70/174, annex. \n\nA/RES/72/192 \nFollow-up to the Thirteenth United Nations Congress on Crime Prevention\nand Criminal Justice and preparations for the Fourteenth United Nations\nCongress on Crime Prevention and Criminal Justice\n \n17-23190 \n4/5 \n \n4. \nIntegrated approaches to challenges facing the criminal justice \nsystem. \n5. \nMultidimensional approaches by Governments to promoting the \nrule of law by, inter alia, providing access to justice for all; \nbuilding effective, accountable, impartial and inclusive institutions; \nand considering social, educational and other relevant measures, \nincluding fostering a culture of lawfulness while respecting cultural \nidentities, in line with the Doha Declaration. \n6. \nInternational cooperation and technical assistance to prevent and \naddress all forms of crime: \n(a) \nTerrorism in all its forms and manifestations; \n(b) \nNew and emerging forms of crime. \n7. \nAdoption of the report of the Congress. \n \n10. Decides that the following issues shall be considered in workshops within \nthe framework of the Fourteenth Congress: \n \n(a) \nEvidence-based crime prevention: statistics, indicators and evaluation in \nsupport of successful practices; \n \n(b) \nReducing reoffending: identifying risks and developing solutions; \n \n(c) \nEducation and youth engagement as key to making societies resilient to \ncrime; \n \n(d) \nCurrent crime trends, recent developments and emerging solutions, in \nparticular new technologies as means for and tools against crime; \n \n11. \nRequests the Secretary-General, in cooperation with the institutes of the \nUnited Nations crime prevention and criminal justice programme network, to prepare \na discussion guide for the regional preparatory meetings for the Fourteenth Congress \nand for the Congress itself in a timely manner in order to enable those meetings to be \nheld as early as possible in 2019, and invites Member States to be actively involved \nin that process; \n \n12. Also requests the Secretary-General to facilitate the organization of the \nregional preparatory meetings and to make available the necessary resources for the \nparticipation of the least developed countries in those meetings and in the Fourteenth \nCongress itself, in accordance with past practice and in consultation with Member \nStates; \n \n13. Urges participants in the regional preparatory meetings to examine the \nsubstantive items on the agenda and the topics of the workshops of the Fourteenth \nCongress and to make action-oriented recommendations to serve as a basis for the \ndraft recommendations and conclusions for consideration by the Congress; \n \n14. Invites Member States to be represented at the highest possible level at the \nFourteenth Congress, for example, by Heads of State or Government, Government \nministers or attorneys general, to make statements on the theme and topics of the \nCongress and to participate actively in the high-level segment; \n \n15. Calls upon Member States to play an active role in the Fourteenth \nCongress by sending legal and policy experts, including practitioners with special \ntraining and practical experience in crime prevention and criminal justice; \n \n16. Emphasizes the importance of the workshops to be held within the \nframework of the Fourteenth Congress, and invites Member States, intergovernmental \nand non-governmental organizations and other relevant entities to provide financial, \n\nFollow-up to the Thirteenth United Nations Congress on Crime Prevention \nand Criminal Justice and preparations for the Fourteenth United Nations \nCongress on Crime Prevention and Criminal Justice \nA/RES/72/192\n \n5/5 \n17-23190 \n \norganizational and technical support to the United Nations Office on Drugs and Crime \nand the institutes of the United Nations crime prevention and criminal justice \nprogramme network for the preparations for the workshops, including the preparation \nand circulation of relevant background material; \n \n17. Requests the Secretary-General to facilitate the organization of ancillary \nmeetings of non-governmental and professional organizations participating in the \nFourteenth Congress, in accordance with past practice, as well as meetings of \nprofessional and geographical interest groups, and to take appropriate measures to \nencourage the participation of the academic and research community in the Congress, \nand encourages Member States to actively participate in the above-mentioned \nmeetings, as they provide an opportunity to develop and maintain strong partnerships \nwith the private sector and civil society organizations; \n \n18. Encourages Governments to undertake preparations for the Fourteenth \nCongress at an early stage and by all appropriate means, including, where appropriate, \nthe establishment of national preparatory committees; \n \n19. Encourages the relevant United Nations programmes, specialized agencies \nof the United Nations system and intergovernmental and non-governmental \norganizations, as well as other professional organizations, to cooperate with the \nUnited Nations Office on Drugs and Crime in the preparations for the Fourteenth \nCongress; \n \n20. Requests the Commission to accord sufficient time at its twenty-seventh \nsession to reviewing the progress made in the preparations for the Fourteenth \nCongress, to finalize in a timely manner all outstanding organizational and \nsubstantive arrangements and to make its recommendations to the General Assembly \nthrough the Economic and Social Council; \n \n21. Requests the Secretary-General to ensure proper follow-up to the present \nresolution and to report thereon to the General Assembly through the Commission at \nits twenty-seventh session. \n \n73rd plenary meeting  \n19 December 2017 \n \n",
  "paragraphs": {
    "1": "Opening of the Congress.",
    "2": "Organizational matters.",
    "3": "Comprehensive strategies for crime prevention towards social and economic development.",
    "4": "Integrated approaches to challenges facing the criminal justice system.",
    "5": "Multidimensional approaches by Governments to promoting the rule of law by, inter alia, providing access to justice for all; building effective, accountable, impartial and inclusive institutions; and considering social, educational and other relevant measures, including fostering a culture of lawfulness while respecting cultural identities, in line with the Doha Declaration.",
    "6": "International cooperation and technical assistance to prevent and address all forms of crime: (a) Terrorism in all its forms and manifestations; (b) New and emerging forms of crime.",
    "7": "Adoption of the report of the Congress.",
    "8": "Requests the Secretary-General to encourage the participation of representatives from relevant entities of the United Nations system in the Fourteenth Congress, bearing in mind the main theme, agenda items and workshop topics of the Congress;",
    "9": "Approves the following provisional agenda for the Fourteenth Congress, finalized by the Commission at its twenty-sixth session:",
    "10": "Decides that the following issues shall be considered in workshops within the framework of the Fourteenth Congress: (a) Evidence-based crime prevention: statistics, indicators and evaluation in support of successful practices; (b) Reducing reoffending: identifying risks and developing solutions; (c) Education and youth engagement as key to making societies resilient to crime; (d) Current crime trends, recent developments and emerging solutions, in particular new technologies as means for and tools against crime;",
    "11": "Requests the Secretary-General, in cooperation with the institutes of the United Nations crime prevention and criminal justice programme network, to prepare a discussion guide for the regional preparatory meetings for the Fourteenth Congress and for the Congress itself in a timely manner in order to enable those meetings to be held as early as possible in 2019, and invites Member States to be actively involved in that process;",
    "12": "Also requests the Secretary-General to facilitate the organization of the regional preparatory meetings and to make available the necessary resources for the participation of the least developed countries in those meetings and in the Fourteenth Congress itself, in accordance with past practice and in consultation with Member States;",
    "13": "Urges participants in the regional preparatory meetings to examine the substantive items on the agenda and the topics of the workshops of the Fourteenth Congress and to make action-oriented recommendations to serve as a basis for the draft recommendations and conclusions for consideration by the Congress;",
    "14": "Invites Member States to be represented at the highest possible level at the Fourteenth Congress, for example, by Heads of State or Government, Government ministers or attorneys general, to make statements on the theme and topics of the Congress and to participate actively in the high-level segment;",
    "15": "Calls upon Member States to play an active role in the Fourteenth Congress by sending legal and policy experts, including practitioners with special training and practical experience in crime prevention and criminal justice;",
    "16": " organizational and technical support to the United Nations Office on Drugs and Crime and the institutes of the United Nations crime prevention and criminal justice programme network for the preparations for the workshops, including the preparation and circulation of relevant background material;",
    "17": "Requests the Secretary-General to facilitate the organization of ancillary meetings of non-governmental and professional organizations participating in the Fourteenth Congress, in accordance with past practice, as well as meetings of professional and geographical interest groups, and to take appropriate measures to encourage the participation of the academic and research community in the Congress, and encourages Member States to actively participate in the above-mentioned meetings, as they provide an opportunity to develop and maintain strong partnerships with the private sector and civil society organizations;",
    "18": "Encourages Governments to undertake preparations for the Fourteenth Congress at an early stage and by all appropriate means, including, where appropriate, the establishment of national preparatory committees;",
    "19": "Encourages the relevant United Nations programmes, specialized agencies of the United Nations system and intergovernmental and non-governmental organizations, as well as other professional organizations, to cooperate with the United Nations Office on Drugs and Crime in the preparations for the Fourteenth Congress;",
    "20": "Requests the Commission to accord sufficient time at its twenty-seventh session to reviewing the progress made in the preparations for the Fourteenth Congress, to finalize in a timely manner all outstanding organizational and substantive arrangements and to make its recommendations to the General Assembly through the Economic and Social Council;",
    "21": "Requests the Secretary-General to ensure proper follow-up to the present resolution and to report thereon to the General Assembly through the Commission at its twenty-seventh session."
  },
  "agenda_items": [
    "Item 107"
  ],
  "symbol_references": []
}