{
  "symbol": "A/RES/73/259",
  "filename": "A_RES_73_259.pdf",
  "title": "73/259. Cooperation between the United Nations and the Association of Southeast Asian Nations",
  "text": "United Nations \nA/RES/73/259\n \n \nGeneral Assembly \nDistr.: General \n23 January 2019 \n \n18-22640 (E)    250119  \n*1822640* \n \n \nSeventy-third session \nAgenda item 128 (q) \n \n \n \n \n Resolution adopted by the General Assembly \non 20 December 2018 \n \n \n \n \n[without reference to a Main Committee (A/73/L.71 and A/73/L.71/Add.1)] \n \n \n 73/259. Cooperation between the United Nations and the Association \nof Southeast Asian Nations  \n \n \n \nThe General Assembly,  \n \nRecalling the aims and purposes of the Association of Southeast Asian Nations, \nas enshrined in the Bangkok Declaration of 8 August 1967, 1  in particular the \nmaintenance of close and beneficial cooperation with existing international and \nregional organizations with similar aims and purposes,  \n \nNoting the purposes and principles enshrined in the Charter of the Association \nof Southeast Asian Nations, which came into force on 15 December 2008, 2 \nparticularly on upholding the Charter of the United Nations and international law,  \n \nNoting with satisfaction that the activities of the Association of Southeast Asian \nNations are consistent with the purposes and principles of the United Nations,  \n \nRecalling all previous resolutions on cooperation between the United Nations \nand the Association of Southeast Asian Nations,3  \n \nRecalling also the fiftieth anniversary of the Association of Southeast Asian \nNations in 2017, under the chairmanship of the Philippines, and its resolution 71/317 \nof 19 July 2017 on the commemoration of the fiftieth anniversary of the Association \nof Southeast Asian Nations,  \n \nTaking note of the report of the Secretary-General,4  \n \nWelcoming the participation of the Association of Southeast Asian Nations in \nthe high-level meetings between the United Nations and regional organizations, as \nwell as the collaboration between the Association of Southeast Asian Nations and the \n__________________ \n \n1  United Nations, Treaty Series, vol. 1331, No. 22341. \n \n2  Ibid., vol. 2624, No. 46745.  \n \n3  Resolutions 57/35, 59/5, 61/46, 63/35, 65/235, 67/110, 69/110 and 71/255.  \n \n4  See A/73/328-S/2018/592, sect. II.  \n\nA/RES/73/259 \nCooperation between the United Nations and the Association of Southeast Asian Nations\n \n18-22640\n2/5 \n \nEconomic and Social Commission for Asia and the Pacific to promote dialogue and \ncooperation among regional organizations in Asia and the Pacific,  \n \nRecalling the First to Ninth Summits of the Association of Southeast Asian \nNations and the United Nations and the commitment of the leaders of the Association \nof Southeast Asian Nations and the Secretary-General of the United Nations to further \ndeepen the comprehensive partnership between the two organizations,  \n \nWelcoming the adoption of the Kuala Lumpur Declaration on the Association of \nSoutheast Asian Nations 2025: Forging Ahead Together and its three Community \nBlueprints, namely the Association of Southeast Asian Nations Political-Security \nCommunity Blueprint 2025, the Association of Southeast Asian Nations Economic \nCommunity Blueprint 2025 and the Association of Southeast Asian Nations \nSocio-Cultural Community Blueprint 2025, at the twenty-seventh Association of \nSoutheast Asian Nations Summit, held in Kuala Lumpur in November 2015,  \n \nWelcoming also the adoption of the Vientiane Declaration on the Adoption of \nthe Initiative for Association of Southeast Asian Nations Integration Work Plan III \nand the Vientiane Declaration on the Adoption of the Master Plan on Association of \nSoutheast Asian Nations Connectivity 2025 at the twenty-eighth Association of \nSoutheast Asian Nations Summit, held in Vientiane in September 2016,  \n \nRecognizing the efforts of the Association of Southeast Asian Nations to \nstrengthen its institutions, and in this regard welcoming the establishment of the \nAssociation of Southeast Asian Nations Community on 31 December 2015,  \n \nWelcoming the adoption, in 2017, of the Association of Southeast Asian Nations \nDeclaration on Culture of Prevention for a Peaceful, Inclusive, Resilient, Healthy and \nHarmonious Society, which complements the culture of peace agenda of the United \nNations,  \n \n1. \nWelcomes the progress in the implementation of the Association of \nSoutheast Asian Nations Community Vision 2025, which will ensure lasting peace \nand stability, sustained economic growth, shared prosperity and social progress in the \nregion;  \n \n2. \nReaffirms the commitment of the United Nations and the Association of \nSoutheast Asian Nations to develop the partnership between the two organizations, as \ndescribed in the Memorandum of Understanding signed on 27 September 2007;  \n \n3. \nRecognizes the efforts of the Association of Southeast Asian Nations and \nthe United Nations to further intensify and strengthen the level of and framework for \ncooperation between the two organizations through the implementation of the Joint \nDeclaration on Comprehensive Partnership between the Association of Southeast \nAsian Nations and the United Nations, issued on 19 November 2011 at the Fourth \nSummit of the Association of Southeast Asian Nations and the United Nations, held \nin Bali, Indonesia, and welcomes the adoption and progress in the implementation of \nthe Plan of Action to Implement the Joint Declaration on Comprehensive Partnership \nbetween the Association of Southeast Asian Nations and the United Nations (2016\u2013\n2020);  \n \n4. \nEncourages the United Nations, including the Economic and Social \nCommission for Asia and the Pacific and other relevant United Nations agencies, to \ncontinue to work closely with the Association of Southeast Asian Nations in \nimplementing the 2030 Agenda for Sustainable Development 5 and the Association of \nSoutheast Asian Nations Community Vision 2025, to promote complementarities \nbetween the two to ensure that regional integration efforts in the Association of \n__________________ \n \n5  Resolution 70/1. \n\nCooperation between the United Nations and the Association of Southeast Asian Nations \nA/RES/73/259\n \n3/5\n18-22640 \n \nSoutheast Asian Nations reinforce the attainment of the Sustainable Development \nGoals and vice versa, through developing a regional road map, as well as other \nconcrete activities and projects under the Plan of Action to Implement the Joint \nDeclaration on Comprehensive Partnership;  \n \n5.  \nRecognizes the efforts to establish the Association of Southeast Asian \nNations Centre for Sustainable Development Studies and Dialogue in Thailand in \n2019 in order to enhance cooperation on sustainable development between the \nAssociation of Southeast Asian Nations and external partners, including the United \nNations and related agencies;  \n \n6. \nCommends the President of the General Assembly, the Secretary-General \nof the United Nations, the Ministers for Foreign Affairs of the States members of the \nAssociation of Southeast Asian Nations and the Secretary-General of the Association \nof Southeast Asian Nations for their efforts to hold annual meetings during the regular \nsessions of the General Assembly, with a view to further enhancing the Association \nof Southeast Asian Nations-United Nations partnership, including by reviewing, \noverseeing and directing the implementation of the present resolution;  \n \n7. \nEncourages the United Nations and the Association of Southeast Asian \nNations to continue regular meetings of senior officials, ministerial meetings and \nsummits, and in this regard welcomes the convening of the Ninth Summit of the \nAssociation of Southeast Asian Nations and the United Nations in Manila on \n13 November 2017; \n \n8.  \nWelcomes the successful convening of the Association of Southeast Asian \nNations leaders\u2019 gathering with the Secretary-General of the Association of Southeast \nAsian Nations, the Secretary-General of the United Nations, the Managing Director \nof the International Monetary Fund and the President of the World Bank in Bali, on \n11 October 2018, which reaffirmed the importance of the role of the Association of \nSoutheast Asian Nations in promoting multilateralism, further enhancing existing \ncooperation and forging close cooperation with the International Monetary Fund, the \nWorld Bank and the United Nations to implement the 2030 Agenda for Sustainable \nDevelopment, and in improving the lives of its peoples;  \n \n9. \nEncourages the United Nations to provide strengthened support, including \nthrough exchanges of relevant experiences, information, best practices, lessons \nlearned and capacity-building, based on mutual respect, for the relevant Association \nof Southeast Asian Nations mechanisms and Association of Southeast Asian Nations-\nled arrangements;  \n \n10. Reaffirms the importance of enhancing regional security and cooperation \nand the peaceful settlement of disputes to promote peace, stability and prosperity, in \naccordance with the purposes and principles of the Charter of the United Nations, the \nCharter of the Association of Southeast Asian Nations, the Treaty of Amity and \nCooperation in Southeast Asia and international law;  \n \n11. \nSupports the convening of workshops and seminars between the Association \nof Southeast Asian Nations and the United Nations to promote dialogue on regional \nand global security issues, including conflict prevention, preventive diplomacy, \ndisarmament and non-proliferation, cybersecurity, peacekeeping operations, \ntransnational crime, counter-terrorism and the prevention of violent extremism as and \nwhen conducive to terrorism, based on mutual trust, shared interests and mutual respect;  \n \n12. Encourages cooperation between the United Nations and the Association \nof Southeast Asian Nations to exchange expertise, best practices, lessons learned and \nexperiences in countering terrorism and radicalization to terrorism and preventing \nviolent extremism as and when conducive to terrorism, as well as in addressing \ntransnational crime and cross-border challenges, including through effective regional \n\nA/RES/73/259 \nCooperation between the United Nations and the Association of Southeast Asian Nations\n \n18-22640\n4/5 \n \ncooperation, in order to foster a more secure, interconnected and prosperous \nAssociation of Southeast Asian Nations community;  \n \n13. Also encourages cooperation between the United Nations and the \nAssociation of Southeast Asian Nations in the field of human rights, particularly \nthrough the Association of Southeast Asian Nations Intergovernmental Commission \non Human Rights and the Association of Southeast Asian Nations Commission on the \nPromotion and Protection of the Rights of Women and Children, based on the \nAssociation of Southeast Asian Nations Human Rights Declaration, the Phnom Penh \nStatement on the Adoption of the Association of Southeast Asian Nations Human \nRights Declaration, the Universal Declaration of Human Rights 6  and other \ninternational human rights instruments and mechanisms to which all of the States \nmembers of the Association of Southeast Asian Nations are parties;  \n \n14. Acknowledges the importance of maritime cooperation, including \nmaritime security cooperation, between the United Nations and the Association of \nSoutheast Asian Nations, including in the form of training workshops and the \nexchange of relevant experiences, information, best practices and lessons learned, to \nfurther promote the rule of law and the implementation of relevant international law, \nincluding the United Nations Convention on the Law of the Sea, 7  and other \ninternational instruments, and underscores the need to further strengthen such \ncooperation in order to address related issues and challenges;  \n \n15. Reiterates the importance of regional integration and enhancement of \nconnectivity in the South-East Asian region and their potential contribution to \nregional and global peace, prosperity and sustainable development, and in this regard \nencourages cooperation between the Association of Southeast Asian Nations and the \nUnited Nations to narrow the development gap within and between the States \nmembers of the Association of Southeast Asian Nations;  \n \n16. Encourages continued efforts and enhanced cooperation between the \nUnited Nations and the Association of Southeast Asian Nations towards deepening \neconomic integration both within the region and in the global economy so as to \npromote mutual benefits through capacity-building and advisory services in the \nimplementation of the Association of Southeast Asian Nations Economic Community \nBlueprint 2025 in areas such as trade, investment, the development of micro, small \nand medium-sized enterprises, regulatory frameworks, global supply chains and \nresource management;  \n \n17.  Welcomes the establishment of the Association of Southeast Asian Nations \nSmart Cities Network as part of the integration efforts of the Association that will \nsynergise development efforts, promote greater cooperation among member cities, the \nprivate sector and external partners, spearhead smart city development and \nsustainable urbanization, with the goal of improving the lives of the citizens of the \nStates members of the Association of Southeast Asian Nations using technology and \ndigital infrastructure as enablers, and facilitate the implementation of the \n2030 Agenda and its Sustainable Development Goals;  \n \n18. Also welcomes the Association of Southeast Asian Nations-led \narrangements, in particular the meeting of the Ministers of Defence and experts \nworking group on peacekeeping operations of the Association of Southeast Asian \nNations on various important issues related to peacekeeping operations, including \nimprovement in the meaningful participation of women peacekeepers from States \nmembers of the Association of Southeast Asian Nations at all levels and key positions, \nand encourages efforts to implement joint peacekeeping and peacebuilding-related \n__________________ \n \n6  Resolution 217 A (III). \n \n7  United Nations, Treaty Series, vol. 1833, No. 31363.  \n\nCooperation between the United Nations and the Association of Southeast Asian Nations \nA/RES/73/259\n \n5/5\n18-22640 \n \nactivities under the Plan of Action to Implement the Joint Declaration on \nComprehensive Partnership between the Association of Southeast Asian Nations and \nthe United Nations (2016\u20132020);  \n \n19. Encourages collaboration between the United Nations and the Association \nof Southeast Asian Nations Regional Mine Action Centre, including the sharing of \nexpertise and best practices, training and capacity-building activities, in addressing \nthe humanitarian aspects of landmines and explosive remnants of war;  \n \n20. Also encourages closer cooperation on disaster management between the \nUnited Nations and the Association of Southeast Asian Nations in order to ensure an \neffective response to and management of natural disasters, through the \nimplementation of the Association of Southeast Asian Nations-United Nations Joint \nStrategic Plan of Action on Disaster Management 2016\u20132020, and to enhance the \ncapacity of and technical support to the Association of Southeast Asian Nations \nCoordinating Centre for Humanitarian Assistance on Disaster Management;  \n \n21. Takes note with appreciation of the ongoing work of the Association of \nSoutheast Asian Nations Coordinating Centre for Humanitarian Assistance on \nDisaster Management in addressing disaster management, emergency response and \nhumanitarian assistance in the region;  \n \n22.  Encourages closer cooperation on the culture of peace agenda between the \nUnited Nations and the Association of Southeast Asian Nations, including through the \nsix thrusts of the 2017 Association of Southeast Asian Nations Declaration on Culture \nof Prevention for a Peaceful, Inclusive, Resilient, Healthy and Harmonious Society;  \n \n23.  Also encourages further cooperation and collaborative efforts between the \nUnited Nations and the Association of Southeast Asian Nations on addressing \nenvironmental sustainability, climate change and the protection, restoration and \nsustainable use of terrestrial, coastal and marine ecosystems, including the prevention \nand reduction of marine plastic debris, and welcomes the adoption of the Association \nof Southeast Asian Nations-United Nations Action Plan on Environment and Climate \nChange (2017\u20132020) in September 2017;  \n \n24. Further encourages the exploration of measures by the Association of \nSoutheast Asian Nations and the United Nations to further the effective and timely \nimplementation of joint activities under the Plan of Action to Implement the Joint \nDeclaration on Comprehensive Partnership;  \n \n25.  Encourages the conduct of the Secretariat-to-Secretariat annual review on \nthe implementation of the comprehensive partnership to identify challenges and \ndiscuss practical modalities for the two Secretariats to effectively contribute to \nenhancing Association of Southeast Asian Nations and United Nations cooperation, \nand takes note with appreciation of the Secretariat-to-Secretariat engagements, which \ncontribute to the implementation of the Plan of Action to Implement the Joint \nDeclaration on Comprehensive Partnership; \n \n26. Requests the Secretary-General to submit to the General Assembly, at its \nseventy-fifth session, a report on the implementation of the present resolution;  \n \n27. Decides to include in the provisional agenda of its seventy-fifth session, \nunder the item entitled \u201cCooperation between the United Nations and regional and \nother organizations\u201d, the sub-item entitled \u201cCooperation between the United Nations \nand the Association of Southeast Asian Nations\u201d.  \n \n63rd plenary meeting  \n20 December 2018 \n \n",
  "paragraphs": {
    "1": "Welcomes the progress in the implementation of the Association of Southeast Asian Nations Community Vision 2025, which will ensure lasting peace and stability, sustained economic growth, shared prosperity and social progress in the region;",
    "2": "Reaffirms the commitment of the United Nations and the Association of Southeast Asian Nations to develop the partnership between the two organizations, as described in the Memorandum of Understanding signed on 27 September 2007;",
    "3": "Recognizes the efforts of the Association of Southeast Asian Nations and the United Nations to further intensify and strengthen the level of and framework for cooperation between the two organizations through the implementation of the Joint Declaration on Comprehensive Partnership between the Association of Southeast Asian Nations and the United Nations, issued on 19 November 2011 at the Fourth Summit of the Association of Southeast Asian Nations and the United Nations, held in Bali, Indonesia, and welcomes the adoption and progress in the implementation of the Plan of Action to Implement the Joint Declaration on Comprehensive Partnership between the Association of Southeast Asian Nations and the United Nations (2016\u2013 2020);",
    "4": "Encourages the United Nations, including the Economic and Social Commission for Asia and the Pacific and other relevant United Nations agencies, to continue to work closely with the Association of Southeast Asian Nations in implementing the 2030 Agenda for Sustainable Development 5 and the Association of Southeast Asian Nations Community Vision 2025, to promote complementarities between the two to ensure that regional integration efforts in the Association of __________________ 5 Resolution 70/1. Cooperation between the United Nations and the Association of Southeast Asian Nations A/RES/73/259 3/5 18-22640 Southeast Asian Nations reinforce the attainment of the Sustainable Development Goals and vice versa, through developing a regional road map, as well as other concrete activities and projects under the Plan of Action to Implement the Joint Declaration on Comprehensive Partnership;",
    "5": "Recognizes the efforts to establish the Association of Southeast Asian Nations Centre for Sustainable Development Studies and Dialogue in Thailand in 2019 in order to enhance cooperation on sustainable development between the Association of Southeast Asian Nations and external partners, including the United Nations and related agencies;",
    "6": "Commends the President of the General Assembly, the Secretary-General of the United Nations, the Ministers for Foreign Affairs of the States members of the Association of Southeast Asian Nations and the Secretary-General of the Association of Southeast Asian Nations for their efforts to hold annual meetings during the regular sessions of the General Assembly, with a view to further enhancing the Association of Southeast Asian Nations-United Nations partnership, including by reviewing, overseeing and directing the implementation of the present resolution;",
    "7": "Encourages the United Nations and the Association of Southeast Asian Nations to continue regular meetings of senior officials, ministerial meetings and summits, and in this regard welcomes the convening of the Ninth Summit of the Association of Southeast Asian Nations and the United Nations in Manila on 13 November 2017;",
    "8": "Welcomes the successful convening of the Association of Southeast Asian Nations leaders\u2019 gathering with the Secretary-General of the Association of Southeast Asian Nations, the Secretary-General of the United Nations, the Managing Director of the International Monetary Fund and the President of the World Bank in Bali, on 11 October 2018, which reaffirmed the importance of the role of the Association of Southeast Asian Nations in promoting multilateralism, further enhancing existing cooperation and forging close cooperation with the International Monetary Fund, the World Bank and the United Nations to implement the 2030 Agenda for Sustainable Development, and in improving the lives of its peoples;",
    "9": "Encourages the United Nations to provide strengthened support, including through exchanges of relevant experiences, information, best practices, lessons learned and capacity-building, based on mutual respect, for the relevant Association of Southeast Asian Nations mechanisms and Association of Southeast Asian Nations- led arrangements;",
    "10": "Reaffirms the importance of enhancing regional security and cooperation and the peaceful settlement of disputes to promote peace, stability and prosperity, in accordance with the purposes and principles of the Charter of the United Nations, the Charter of the Association of Southeast Asian Nations, the Treaty of Amity and Cooperation in Southeast Asia and international law;",
    "11": "Supports the convening of workshops and seminars between the Association of Southeast Asian Nations and the United Nations to promote dialogue on regional and global security issues, including conflict prevention, preventive diplomacy, disarmament and non-proliferation, cybersecurity, peacekeeping operations, transnational crime, counter-terrorism and the prevention of violent extremism as and when conducive to terrorism, based on mutual trust, shared interests and mutual respect;",
    "12": "Encourages cooperation between the United Nations and the Association of Southeast Asian Nations to exchange expertise, best practices, lessons learned and experiences in countering terrorism and radicalization to terrorism and preventing violent extremism as and when conducive to terrorism, as well as in addressing transnational crime and cross-border challenges, including through effective regional A/RES/73/259 Cooperation between the United Nations and the Association of Southeast Asian Nations 18-22640 4/5 cooperation, in order to foster a more secure, interconnected and prosperous Association of Southeast Asian Nations community;",
    "13": "Also encourages cooperation between the United Nations and the Association of Southeast Asian Nations in the field of human rights, particularly through the Association of Southeast Asian Nations Intergovernmental Commission on Human Rights and the Association of Southeast Asian Nations Commission on the Promotion and Protection of the Rights of Women and Children, based on the Association of Southeast Asian Nations Human Rights Declaration, the Phnom Penh Statement on the Adoption of the Association of Southeast Asian Nations Human Rights Declaration, the Universal Declaration of Human Rights 6 and other international human rights instruments and mechanisms to which all of the States members of the Association of Southeast Asian Nations are parties;",
    "14": "Acknowledges the importance of maritime cooperation, including maritime security cooperation, between the United Nations and the Association of Southeast Asian Nations, including in the form of training workshops and the exchange of relevant experiences, information, best practices and lessons learned, to further promote the rule of law and the implementation of relevant international law, including the United Nations Convention on the Law of the Sea, 7 and other international instruments, and underscores the need to further strengthen such cooperation in order to address related issues and challenges;",
    "15": "Reiterates the importance of regional integration and enhancement of connectivity in the South-East Asian region and their potential contribution to regional and global peace, prosperity and sustainable development, and in this regard encourages cooperation between the Association of Southeast Asian Nations and the United Nations to narrow the development gap within and between the States members of the Association of Southeast Asian Nations;",
    "16": "Encourages continued efforts and enhanced cooperation between the United Nations and the Association of Southeast Asian Nations towards deepening economic integration both within the region and in the global economy so as to promote mutual benefits through capacity-building and advisory services in the implementation of the Association of Southeast Asian Nations Economic Community Blueprint 2025 in areas such as trade, investment, the development of micro, small and medium-sized enterprises, regulatory frameworks, global supply chains and resource management;",
    "17": "Welcomes the establishment of the Association of Southeast Asian Nations Smart Cities Network as part of the integration efforts of the Association that will synergise development efforts, promote greater cooperation among member cities, the private sector and external partners, spearhead smart city development and sustainable urbanization, with the goal of improving the lives of the citizens of the States members of the Association of Southeast Asian Nations using technology and digital infrastructure as enablers, and facilitate the implementation of the 2030 Agenda and its Sustainable Development Goals;",
    "18": "Also welcomes the Association of Southeast Asian Nations-led arrangements, in particular the meeting of the Ministers of Defence and experts working group on peacekeeping operations of the Association of Southeast Asian Nations on various important issues related to peacekeeping operations, including improvement in the meaningful participation of women peacekeepers from States members of the Association of Southeast Asian Nations at all levels and key positions, and encourages efforts to implement joint peacekeeping and peacebuilding-related __________________ 6 Resolution 217 A (III). 7 United Nations, Treaty Series, vol. 1833, No. 31363. Cooperation between the United Nations and the Association of Southeast Asian Nations A/RES/73/259 5/5 18-22640 activities under the Plan of Action to Implement the Joint Declaration on Comprehensive Partnership between the Association of Southeast Asian Nations and the United Nations (2016\u20132020);",
    "19": "Encourages collaboration between the United Nations and the Association of Southeast Asian Nations Regional Mine Action Centre, including the sharing of expertise and best practices, training and capacity-building activities, in addressing the humanitarian aspects of landmines and explosive remnants of war;",
    "20": "Also encourages closer cooperation on disaster management between the United Nations and the Association of Southeast Asian Nations in order to ensure an effective response to and management of natural disasters, through the implementation of the Association of Southeast Asian Nations-United Nations Joint Strategic Plan of Action on Disaster Management 2016\u20132020, and to enhance the capacity of and technical support to the Association of Southeast Asian Nations Coordinating Centre for Humanitarian Assistance on Disaster Management;",
    "21": "Takes note with appreciation of the ongoing work of the Association of Southeast Asian Nations Coordinating Centre for Humanitarian Assistance on Disaster Management in addressing disaster management, emergency response and humanitarian assistance in the region;",
    "22": "Encourages closer cooperation on the culture of peace agenda between the United Nations and the Association of Southeast Asian Nations, including through the six thrusts of the 2017 Association of Southeast Asian Nations Declaration on Culture of Prevention for a Peaceful, Inclusive, Resilient, Healthy and Harmonious Society;",
    "23": "Also encourages further cooperation and collaborative efforts between the United Nations and the Association of Southeast Asian Nations on addressing environmental sustainability, climate change and the protection, restoration and sustainable use of terrestrial, coastal and marine ecosystems, including the prevention and reduction of marine plastic debris, and welcomes the adoption of the Association of Southeast Asian Nations-United Nations Action Plan on Environment and Climate Change (2017\u20132020) in September 2017;",
    "24": "Further encourages the exploration of measures by the Association of Southeast Asian Nations and the United Nations to further the effective and timely implementation of joint activities under the Plan of Action to Implement the Joint Declaration on Comprehensive Partnership;",
    "25": "Encourages the conduct of the Secretariat-to-Secretariat annual review on the implementation of the comprehensive partnership to identify challenges and discuss practical modalities for the two Secretariats to effectively contribute to enhancing Association of Southeast Asian Nations and United Nations cooperation, and takes note with appreciation of the Secretariat-to-Secretariat engagements, which contribute to the implementation of the Plan of Action to Implement the Joint Declaration on Comprehensive Partnership;",
    "26": "Requests the Secretary-General to submit to the General Assembly, at its seventy-fifth session, a report on the implementation of the present resolution;",
    "27": "Decides to include in the provisional agenda of its seventy-fifth session, under the item entitled \u201cCooperation between the United Nations and regional and other organizations\u201d, the sub-item entitled \u201cCooperation between the United Nations and the Association of Southeast Asian Nations\u201d. 63rd plenary meeting 20 December 2018"
  },
  "agenda_items": [
    "Item 128"
  ],
  "symbol_references": [
    "A/73/L.71"
  ]
}