{
  "symbol": "A/RES/74/12",
  "filename": "A_RES_74_12.pdf",
  "title": "74/12. Division for Palestinian Rights of the Secretariat",
  "text": "United Nations \nA/RES/74/12\n \n \nGeneral Assembly \nDistr.: General \n9 December 2019 \n \n19-20910 (E)    111219     \n*1920910* \n \n \nSeventy-fourth session \nAgenda item 35 \nQuestion of Palestine \n \n \n \n \n Resolution adopted by the General Assembly on \n3 December 2019 \n \n \n \n \n[without reference to a Main Committee (A/74/L.16 and A/74/L.16/Add.1)] \n \n \n \n74/12. Division for Palestinian Rights of the Secretariat \n \n \n \nThe General Assembly, \n \nHaving considered the report of the Committee on the Exercise of the \nInalienable Rights of the Palestinian People,1  \n \nTaking note, in particular, of the action taken by the Committee and the Division \nfor Palestinian Rights of the Secretariat in accordance with their mandates, \n \nRecalling its resolution 32/40 B of 2 December 1977 and all its subsequent \nrelevant resolutions, including its resolution 73/21 of 30 November 2018, \n \n1. \nNotes with appreciation the action taken by the Secretary-General in \ncompliance with its resolution 73/21; \n \n2. \nConsiders that, by providing substantive support to the Committee on the \nExercise of the Inalienable Rights of the Palestinian People in the implementation of \nits mandate, the Division for Palestinian Rights of the Secretariat continues to make \na constructive and positive contribution to raising international awareness of the \nquestion of Palestine and of the urgency of a peaceful settlement of the question of \nPalestine in all its aspects on the basis of international law and United Nations \nresolutions and the efforts being exerted in this regard and to generating international \nsupport for the rights of the Palestinian people; \n \n3. \nRequests the Secretary-General to continue to provide the Division with \nthe necessary resources and to ensure that it continues to effectively carry out its \nprogramme of work as detailed in relevant earlier resolutions, in consultation with \nthe Committee and under its guidance; \n \n4. \nRequests the Division, in particular, to continue to monitor developments \nrelevant to the question of Palestine, to organize international meetings and activities \n__________________ \n \n1  Official Records of the General Assembly, Seventy-fourth Session, Supplement No. 35 (A/74/35). \n\nA/RES/74/12 \n \n19-20910\n2/2 \n \nin support of the Committee\u2019s mandate with the participation of all sectors of the \ninternational community and to ensure, within existing resources, the continued \nparticipation of eminent persons and international renowned experts in these meetings \nand activities, to be invited on a par with the members of the Committee, to liaise and \ncooperate with civil society and parliamentarians, including through the Working \nGroup of the Committee, to develop and expand the \u201cQuestion of Palestine\u201d website \nand the documents collection of the United Nations Information System on the \nQuestion of Palestine, to prepare and widely disseminate the publications listed in \nparagraph 81 of the report of the Committee for the period 2017/18,2 in the relevant \nofficial languages of the United Nations, and information materials on various aspects \nof the question of Palestine and to develop and enhance the annual training \nprogramme for staff of the Palestinian Government in contribution to Palestinian \ncapacity-building efforts; \n \n5. \nAlso requests the Division, as part of the observance of the International \nDay of Solidarity with the Palestinian People on 29 November, to continue to \norganize, under the guidance of the Committee, an annual exhibit on Palestinian rights \nor a cultural event in cooperation with the Permanent Observer Mission of the State \nof Palestine to the United Nations, and encourages Member States to continue to give \nthe widest support and publicity to the observance of the Day of Solidarity; \n \n6. \nRequests the Secretary-General to ensure the continued cooperation with \nthe Division of the United Nations system entities with programme components \naddressing various aspects of the question of Palestine and the situation in the \nOccupied Palestinian Territory, including East Jerusalem; \n \n7. \nInvites all Governments and organizations to extend their cooperation to \nthe Division in the performance of its tasks. \n \n38th plenary meeting \n3 December 2019 \n \n__________________ \n \n2  Ibid., Seventy-third Session, Supplement No. 35 (A/73/35). \n",
  "paragraphs": {
    "1": "Notes with appreciation the action taken by the Secretary-General in compliance with its resolution 73/21;",
    "2": "Considers that, by providing substantive support to the Committee on the Exercise of the Inalienable Rights of the Palestinian People in the implementation of its mandate, the Division for Palestinian Rights of the Secretariat continues to make a constructive and positive contribution to raising international awareness of the question of Palestine and of the urgency of a peaceful settlement of the question of Palestine in all its aspects on the basis of international law and United Nations resolutions and the efforts being exerted in this regard and to generating international support for the rights of the Palestinian people;",
    "3": "Requests the Secretary-General to continue to provide the Division with the necessary resources and to ensure that it continues to effectively carry out its programme of work as detailed in relevant earlier resolutions, in consultation with the Committee and under its guidance;",
    "4": "Requests the Division, in particular, to continue to monitor developments relevant to the question of Palestine, to organize international meetings and activities in support of the Committee\u2019s mandate with the participation of all sectors of the international community and to ensure, within existing resources, the continued participation of eminent persons and international renowned experts in these meetings and activities, to be invited on a par with the members of the Committee, to liaise and cooperate with civil society and parliamentarians, including through the Working Group of the Committee, to develop and expand the \u201cQuestion of Palestine\u201d website and the documents collection of the United Nations Information System on the Question of Palestine, to prepare and widely disseminate the publications listed in paragraph 81 of the report of the Committee for the period 2017/18,2 in the relevant official languages of the United Nations, and information materials on various aspects of the question of Palestine and to develop and enhance the annual training programme for staff of the Palestinian Government in contribution to Palestinian capacity-building efforts;",
    "5": "Also requests the Division, as part of the observance of the International Day of Solidarity with the Palestinian People on 29 November, to continue to organize, under the guidance of the Committee, an annual exhibit on Palestinian rights or a cultural event in cooperation with the Permanent Observer Mission of the State of Palestine to the United Nations, and encourages Member States to continue to give the widest support and publicity to the observance of the Day of Solidarity;",
    "6": "Requests the Secretary-General to ensure the continued cooperation with the Division of the United Nations system entities with programme components addressing various aspects of the question of Palestine and the situation in the Occupied Palestinian Territory, including East Jerusalem;",
    "7": "Invites all Governments and organizations to extend their cooperation to the Division in the performance of its tasks."
  },
  "agenda_items": [
    "Item 35"
  ],
  "symbol_references": [
    "A/74/L.16"
  ]
}