{
  "symbol": "A/RES/74/5",
  "filename": "A_RES_74_5.pdf",
  "title": "74/5. Proclamation of 28 September as the International Day for Universal Access to Information",
  "text": "United Nations \nA/RES/74/5\n \n \nGeneral Assembly \nDistr.: General \n21 October 2019 \n \n19-17863 (E)    241019     \n*1917863* \n \n \nSeventy-fourth session \nAgenda item 14 \nIntegrated and coordinated implementation of and follow-up \nto the outcomes of the major United Nations conferences \nand summits in the economic, social and related fields \n \n \n \n \n Resolution adopted by the General Assembly \non 15 October 2019 \n \n \n \n \n[without reference to a Main Committee (A/74/L.1 and A/74/L.1/Add.1)] \n \n \n \n74/5. Proclamation of 28 September as the International Day \nfor Universal Access to Information \n \n \n \nThe General Assembly, \n \nRecalling that the right to seek, receive and impart information is an integral \npart of the right to freedom of expression, as defined in article 19 of the Universal \nDeclaration of Human Rights1 and article 19 of the International Covenant on Civil \nand Political Rights,2 \n \nReaffirming the purposes and principles enshrined in the Charter of the United \nNations and the Universal Declaration of Human Rights, \n \nRecalling resolution 57 adopted on 17 November 2015 by the General \nConference of the United Nations Educational, Scientific and Cultural Organization \nat its thirty-eighth session,3 \n \nStressing that freedom of information is also central in the context of the World \nSummit on the Information Society, which reaffirmed freedom of expression and \nuniversal access to information as cornerstones of inclusive knowledge societies, \n \nStressing also the importance of full respect for the freedom of opinion and \nexpression, including the right to seek, receive and impart information, and the \nfundamental importance of access to information and ideas through any media, and \ndemocratic participation, \n__________________ \n \n1  Resolution 217 A (III). \n \n2  See resolution 2200 A (XXI), annex. \n \n3  See United Nations Educational, Scientific and Cultural Organization, Records of the General \nConference, Thirty-eighth Session, Paris, 3\u201318 November 2015, vol. 1, Resolutions, sect. IV. \n\nA/RES/74/5 \nProclamation of 28 September as the International Day \nfor Universal Access to Information\n \n19-17863\n2/2 \n \n \nNoting that in the declaration by the African Platform on Access to Information, \nadopted at the Pan-African Conference on Access to Information, organized by the \nWindhoek+20 Campaign on Access to Information in Africa in partnership with the \nUnited Nations Educational, Scientific and Cultural Organization, the African Union \nCommission and the Special Rapporteur on Freedom of Expression and Access to \nInformation in Africa of the African Commission on Human and Peoples\u2019 Rights in \nCape Town, South Africa, from 17 to 19 September 2011, the right to information was \nrecognized as a human right and also as fundamental to development, \n \nRecalling article 6 of the Declaration on the Right and Responsibility of \nIndividuals, Groups and Organs of Society to Promote and Protect Universally \nRecognized Human Rights and Fundamental Freedoms, adopted by the General \nAssembly in its resolution 53/144 of 9 December 1998, \n \nBearing in mind the efforts of the United Nations Educational, Scientific and \nCultural Organization to highlight the relevance and importance of the right to \ninformation in the Brisbane Declaration, adopted at the International Conference on \nFreedom of Information: the Right to Know, held in May 2010, \n \nReaffirming the 2030 Agenda for Sustainable Development, adopted by the \nGeneral Assembly in its resolution 70/1 of 25 September 2015, and the commitments \nmade therein to, inter alia, promote peaceful and inclusive societies for sustainable \ndevelopment, including by ensuring public access to information and protecting \nfundamental freedoms, in accordance with national legislation and international \nagreements, \n \nConsidering that several civil society organizations and government bodies in \nthe world have adopted and currently celebrate 28 September as the International Day \nfor Universal Access to Information, \n \nTaking note of the principles established in the declaration by the African \nPlatform on Access to Information, and recognizing that these principles can play a \ncrucial role in development, democracy, equality and the delivery of public services, \n \n1. \nProclaims 28 September as the International Day for Universal Access to \nInformation; \n \n2. \nInvites all Member States, organizations of the United Nations system and \nother international and regional organizations, as well as civil society, including \nnon-governmental organizations and individuals, to celebrate the International Day \nin a manner that each considers most appropriate, with the cost to be met exclusively \nfrom voluntary contributions. \n \n15th plenary meeting \n15 October 2019 \n \n",
  "paragraphs": {
    "1": "Proclaims 28 September as the International Day for Universal Access to Information;",
    "2": "Invites all Member States, organizations of the United Nations system and other international and regional organizations, as well as civil society, including non-governmental organizations and individuals, to celebrate the International Day in a manner that each considers most appropriate, with the cost to be met exclusively from voluntary contributions."
  },
  "agenda_items": [
    "Item 14"
  ],
  "symbol_references": [
    "A/74/L.1"
  ]
}