{
  "symbol": "A/RES/72/287",
  "filename": "A_RES_72_287.pdf",
  "title": "72/287. Financing of the United Nations Logistics Base at Brindisi, Italy",
  "text": "United Nations \nA/RES/72/287\n \n \nGeneral Assembly \nDistr.: General \n18 July 2018 \n \n18-11303 (E)    200718 \n*1811303* \n \n \nSeventy-second session \nAgenda item 149 \n \n \n \n \n Resolution adopted by the General Assembly on 5 July 2018 \n \n \n \n \n[on the report of the Fifth Committee (A/72/917)] \n \n \n 72/287. Financing of the United Nations Logistics Base at Brindisi, Italy \n \n \n \nThe General Assembly, \n \nRecalling section XIV of its resolution 49/233 A of 23 December 1994 and its \nresolution 62/231 of 22 December 2007,  \n \nRecalling also its decision 50/500 of 17 September 1996 on the financing of the \nUnited Nations Logistics Base at Brindisi, Italy, and its subsequent resolutions \nthereon, the latest of which was resolution 71/294 of 30 June 2017,  \n \nRecalling further its resolution 56/292 of 27 June 2002 concerning the \nestablishment of the strategic deployment stocks and its subsequent resolutions on the \nstatus of the implementation of the strategic deployment stocks, the latest of which \nwas resolution 71/294,  \n \nHaving considered the reports of the Secretary-General on the financing of the \nUnited Nations Logistics Base1 and the related report of the Advisory Committee on \nAdministrative and Budgetary Questions,2  \n \nReiterating the importance of establishing an accurate inventory of assets,  \n \n1. \nNotes with appreciation the facilities provided by the Government of Italy \nto the United Nations Logistics Base at Brindisi, Italy, and by the Government of \nSpain to the secondary active telecommunications facility in Valencia, Spain;  \n \n2. \nEndorses the conclusions and recommendations contained in the report of \nthe Advisory Committee on Administrative and Budgetary Questions, 2 subject to the \nprovisions of the present resolution, and requests the Secretary-General to ensure \ntheir full implementation;  \n \n3. \nRequests the Secretary-General to ensure the full implementation of the \nrelevant provisions of its resolutions 59/296 of 22 June 2005, 60/266 of 30 June 2006, \n61/276 of 29 June 2007, 64/269 of 24 June 2010, 65/289 of 30 June 2011, 66/264 of \n__________________ \n \n1  A/72/648 and A/72/783. \n \n2  A/72/789/Add.10. \n\nA/RES/72/287 \nFinancing of the United Nations Logistics Base at Brindisi, Italy\n \n18-11303\n2/2 \n \n21 June 2012, 69/307 of 25 June 2015 and 70/286 of 17 June 2016, as well as other \nrelevant resolutions;  \n \n4. \nRecalls paragraph 39 of the report of the Advisory Committee, looks \nforward to considering a proposal on the revised concept of operations for strategic \ndeployment stocks that takes into account the observations and recommendations of \nthe Office of Internal Oversight Services, and stresses the need for further analysis \non enhanced effectiveness, expected efficiencies and location issues;  \n \n5. \nDecides not to rename the Service for Geospatial, Information and \nTelecommunications Technologies as the Field Technology Service; \n \n6. \nRecalls paragraph 23 of the report of the Advisory Committee, and decides \nto approve the conversion of six international general temporary assistance positions \nto posts: two positions of Information Systems Officer (P-4), one position of \nGeospatial Information Systems Officer (P-3), one position of Environmental \nEngineer (P-3) and two positions of Engineering Technician (Field Service); \n \n \n \nBudget performance report for the period from 1 July 2016 to 30 June 2017 \n \n \n7. \nTakes note of the report of the Secretary-General on the budget \nperformance of the United Nations Logistics Base for the period from 1 July 2016 to \n30 June 2017;3  \n \n \n \nBudget estimates for the period from 1 July 2018 to 30 June 2019 \n \n \n8. \nApproves the cost estimates for the United Nations Logistics Base \namounting to 82,448,900 United States dollars for the period from 1 July 2018 to \n30 June 2019;  \n \n \n \nFinancing of the budget estimates \n \n \n9. \nDecides that the requirements for the United Nations Logistics Base for \nthe period from 1 July 2018 to 30 June 2019 shall be financed as follows:  \n \n(a) \nThe unencumbered balance and other revenue in the amount of 1,280,600 \ndollars in respect of the financial period ended 30 June 2017, to be applied against \nthe resources required for the period from 1 July 2018 to 30 June 2019;  \n \n(b) \nThe balance of 81,168,300 dollars, to be prorated among the budgets of \nthe active peacekeeping operations for the period from 1 July 2018 to 30 June 2019; \n \n(c) \nThe estimated staff assessment income of 6,959,100 dollars, comprising \nthe amount of 6,610,400 dollars for the period from 1 July 2018 to 30 June 2019 and \nthe increase of 348,700 dollars in respect of the period from 1 July 2016 to 30 June \n2017, to be offset against the balance referred to in subparagraph (b) above, to be \nprorated among the budgets of the individual active peacekeeping operations;  \n \n10. Also decides to consider at its seventy-third session the question of the \nfinancing of the United Nations Logistics Base.  \n \n104th plenary meeting  \n5 July 2018 \n \n__________________ \n \n3  A/72/648. \n",
  "paragraphs": {
    "1": "Notes with appreciation the facilities provided by the Government of Italy to the United Nations Logistics Base at Brindisi, Italy, and by the Government of Spain to the secondary active telecommunications facility in Valencia, Spain;",
    "2": "Endorses the conclusions and recommendations contained in the report of the Advisory Committee on Administrative and Budgetary Questions, 2 subject to the provisions of the present resolution, and requests the Secretary-General to ensure their full implementation;",
    "3": "Requests the Secretary-General to ensure the full implementation of the relevant provisions of its resolutions 59/296 of 22 June 2005, 60/266 of 30 June 2006, 61/276 of 29 June 2007, 64/269 of 24 June 2010, 65/289 of 30 June 2011, 66/264 of 21 June 2012, 69/307 of 25 June 2015 and 70/286 of 17 June 2016, as well as other relevant resolutions;",
    "4": "Recalls paragraph 39 of the report of the Advisory Committee, looks forward to considering a proposal on the revised concept of operations for strategic deployment stocks that takes into account the observations and recommendations of the Office of Internal Oversight Services, and stresses the need for further analysis on enhanced effectiveness, expected efficiencies and location issues;",
    "5": "Decides not to rename the Service for Geospatial, Information and Telecommunications Technologies as the Field Technology Service;",
    "6": "Recalls paragraph 23 of the report of the Advisory Committee, and decides to approve the conversion of six international general temporary assistance positions to posts: two positions of Information Systems Officer (P-4), one position of Geospatial Information Systems Officer (P-3), one position of Environmental Engineer (P-3) and two positions of Engineering Technician (Field Service); Budget performance report for the period from 1 July 2016 to 30 June 2017",
    "7": "Takes note of the report of the Secretary-General on the budget performance of the United Nations Logistics Base for the period from 1 July 2016 to 30 June 2017;3 Budget estimates for the period from 1 July 2018 to 30 June 2019",
    "8": "Approves the cost estimates for the United Nations Logistics Base amounting to 82,448,900 United States dollars for the period from 1 July 2018 to 30 June 2019; Financing of the budget estimates",
    "9": "Decides that the requirements for the United Nations Logistics Base for the period from 1 July 2018 to 30 June 2019 shall be financed as follows: (a) The unencumbered balance and other revenue in the amount of 1,280,600 dollars in respect of the financial period ended 30 June 2017, to be applied against the resources required for the period from 1 July 2018 to 30 June 2019; (b) The balance of 81,168,300 dollars, to be prorated among the budgets of the active peacekeeping operations for the period from 1 July 2018 to 30 June 2019; (c) The estimated staff assessment income of 6,959,100 dollars, comprising the amount of 6,610,400 dollars for the period from 1 July 2018 to 30 June 2019 and the increase of 348,700 dollars in respect of the period from 1 July 2016 to 30 June 2017, to be offset against the balance referred to in subparagraph (b) above, to be prorated among the budgets of the individual active peacekeeping operations;",
    "10": "Also decides to consider at its seventy-third session the question of the financing of the United Nations Logistics Base."
  },
  "agenda_items": [
    "Item 149"
  ],
  "symbol_references": []
}