{
  "symbol": "A/RES/76/103",
  "filename": "A_RES_76_103.pdf",
  "title": "76/103. Question of the United States Virgin Islands",
  "text": "United Nations \nA/RES/76/103\n \n \nGeneral Assembly \nDistr.: General \n16 December 2021 \n \n21-18709 (E)    211221     \n*2118709* \n \n \nSeventy-sixth session \nAgenda item 63 \nImplementation of the Declaration on the Granting of \nIndependence to Colonial Countries and Peoples \n \n \n \n \n Resolution adopted by the General Assembly \non 9 December 2021 \n \n \n \n \n[on the report of the Special Political and Decolonization Committee \n(Fourth Committee) (A/76/425, para. 37)] \n \n \n 76/103. Question of the United States Virgin Islands \n \n \n \n \nThe General Assembly, \n \nHaving considered the question of the United States Virgin Islands and \nexamined the report of the Special Committee on the Situation with regard to the \nImplementation of the Declaration on the Granting of Independence to Colonial \nCountries and Peoples for 2021,1  \n \nTaking note of the working paper prepared by the Secretariat on the United \nStates Virgin Islands2 and other relevant information,  \n \nRecognizing that all available options for self-determination of the Territory are \nvalid as long as they are in accordance with the freely expressed wishes of the people \nof the United States Virgin Islands and in conformity with the clearly defined \nprinciples contained in General Assembly resolutions 1514 (XV) of 14 December \n1960, 1541 (XV) of 15 December 1960 and other resolutions of the Assembly,  \n \nExpressing concern that, more than 60 years after the adoption of the \nDeclaration on the Granting of Independence to Colonial Countries and Peoples,3 \nthere still remain 17 Non-Self-Governing Territories, including the United States \nVirgin Islands,  \n \nConscious of the importance of continuing the effective implementation of the \nDeclaration, taking into account the target set by the United Nations to eradicate \n__________________ \n \n1  Official Records of the General Assembly, Seventy-sixth Session, Supplement No. 23 (A/76/23). \n \n2  A/AC.109/2021/16. \n \n3  Resolution 1514 (XV). \n\nA/RES/76/103 \nQuestion of the United States Virgin Islands\n \n21-18709\n2/6 \n \ncolonialism by 2030 and the plan of action for the International Decades for the \nEradication of Colonialism,4 \n \nRecognizing that the specific characteristics and the aspirations of the people of \nthe United States Virgin Islands require flexible, practical and innovative approaches \nto the options for self-determination, without any prejudice to territorial size, \ngeographical location, size of population or natural resources,  \n \nConvinced that the wishes and aspirations of the people of the Territory should \ncontinue to guide the development of their future political status and that \nreferendums, free and fair elections and other forms of popular consultation play an \nimportant role in ascertaining the wishes and aspirations of the people,  \n \nConcerned by the use and exploitation of the natural resources of the \nNon-Self-Governing Territories by the administering Powers for their benefit, by the \nuse of the Territories as international financial centres to the detriment of the world \neconomy and by the consequences of any economic activities of the administering \nPowers that are contrary to the interests of the people of the Territories, as well as to \nresolution 1514 (XV),  \n \nConvinced that any negotiations to determine the status of the Territory must \ntake place with the active involvement and participation of the people of the Territory, \nunder the auspices of the United Nations, on a case-by-case basis, and that the views \nof the people of the United States Virgin Islands in respect of their right to \nself-determination should be ascertained,  \n \nNoting the continued cooperation of the Non-Self-Governing Territories at the \nlocal and regional levels, including participation in the work of regional \norganizations,  \n \nMindful that, in order for the Special Committee to enhance its understanding \nof the political status of the people of the United States Virgin Islands and to fulfil its \nmandate effectively, it is important for it to be apprised by the United States of \nAmerica as the administering Power and to receive information from other \nappropriate sources, including the representatives of the Territory, concerning the \nwishes and aspirations of the people of the Territory,  \n \nAware of the importance both to the United States Virgin Islands and to the \nSpecial Committee of the participation of elected and appointed representatives of the \nUnited States Virgin Islands in the work of the Committee,  \n \nRecognizing the need for the Special Committee to ensure that the appropriate \nbodies of the United Nations actively pursue a public awareness campaign aimed at \nassisting the people of the United States Virgin Islands with their inalienable right to \nself-determination and in gaining a better understanding of the options for \nself-determination, on a case-by-case basis,  \n \nMindful, in that connection, that the holding of regional seminars in the \nCaribbean and Pacific regions and at Headquarters, with the active participation of \nrepresentatives of the Non-Self-Governing Territories, provides a helpful means for \nthe Special Committee to fulfil its mandate and that the regional nature of the \nseminars, which alternate between the Caribbean and the Pacific, is a crucial element \nin the context of a United Nations programme for ascertaining the political status of \nthe Territories,  \n \nRecalling the Caribbean regional seminar on the theme \u201cImplementation of the \nThird International Decade for the Eradication of Colonialism: accelerating \ndecolonization through renewed commitment and pragmatic measures\u201d, held by the \n__________________ \n \n4  A/56/61, annex. \n\nQuestion of the United States Virgin Islands \nA/RES/76/103\n \n3/6\n21-18709 \n \nSpecial Committee in Grand Anse, Grenada, and hosted by the Government of \nGrenada from 2 to 4 May 2019, as a significant and forward-looking event, which \nenabled the participants to assess progress made and address challenges faced in the \ndecolonization process, review the existing working methods of the Committee and \nrenew its commitment to implementing its historic task,  \n \nRecalling also the importance of the conclusions and recommendations adopted \nby the seminar, which were annexed to the report of the Special Committee for 2019 5 \nand which outlined the findings of the seminar, including, especially, the way forward \nfor the decolonization process within the context of the proclamation by the General \nAssembly of the period 2011\u20132020 as the Third International Decade for the \nEradication of Colonialism,6  \n \nMindful that the 2021 Caribbean regional seminar, originally scheduled to be \nconvened in Dominica, from 19 to 21 May 2021, had to be rescheduled, and \nwelcoming the holding of the regional seminar in the Parish of Saint John, Dominica, \nfrom 25 to 27 August 2021, \n \nRecalling the statement made by the Lieutenant Governor, as a representative \nof the Government of the United States Virgin Islands, at the 2019 Caribbean regional \nseminar,7  \n \nRecalling also the re-engagement of the Territory with the Special Committee \nin 2019,  \n \nNoting with appreciation the contribution to the development of some \nTerritories by the specialized agencies and other organizations of the United Nations \nsystem, in particular the Economic Commission for Latin America and the Caribbean, \nthe Economic and Social Commission for Asia and the Pacific, the United Nations \nDevelopment Programme and the World Food Programme, as well as regional \ninstitutions such as the Caribbean Development Bank, the Caribbean Community, the \nOrganisation of Eastern Caribbean States, the Pacific Islands Forum and the agencies \nof the Council of Regional Organizations in the Pacific,  \n \nAware of the fifth attempt of the Territory to review the existing Revised Organic \nAct, which organizes its internal governance arrangements, as well as its requests to \nthe administering Power and the United Nations system for assistance to its public \neducation programme,  \n \nCognizant that a draft constitution was proposed in 2009 and subsequently \nforwarded to the administering Power, which in 2010 requested the Territory to \nconsider its objections to the draft constitution,  \n \nCognizant also that the Fifth Revision Convention, established and convened in \n2012, was mandated to ratify and approve the final revised draft constitution,  \n \nExpressing its concern about the extended time spent on the constitutional review \nprocess, and stressing the importance of the Special Committee receiving updated \ninformation in due time regarding the status of the drafting of the constitution,  \n \nNoting the referendum held on 3 November 2020 on convening a constitutional \nconvention to consider adopting the Revised Organic Act of the United States Virgin \nIslands, or portions of it, as the Constitution of the Territory,  \n \nStressing the importance of regional ties for the development of a small island \nTerritory,  \n__________________ \n \n5  Official Records of the General Assembly, Seventy-fourth Session, Supplement No. 23 (A/74/23). \n \n6  See resolution 65/119. \n \n7  Available at www.un.org/dppa/decolonization/en/c24/regional-seminars/2019. \n\nA/RES/76/103 \nQuestion of the United States Virgin Islands\n \n21-18709\n4/6 \n \n \nRecalling with concern the devastating damage and impact caused in the \nTerritory by Hurricane Irma and Hurricane Maria in 2017,  \n \nNoting the election that was held in November 2020, 8 \n \nRecalling its resolutions 74/270 of 2 April 2020, entitled \u201cGlobal solidarity to \nfight the coronavirus disease 2019 (COVID-19)\u201d, 74/274 of 20 April 2020, entitled \n\u201cInternational cooperation to ensure global access to medicines, vaccines and medical \nequipment to face COVID-19\u201d, 74/306 of 11 September 2020, entitled \n\u201cComprehensive and coordinated response to the coronavirus disease (COVID-19) \npandemic\u201d, 74/307 of 11 September 2020, entitled \u201cUnited response against global \nhealth threats: combating COVID-19\u201d, 75/156 of 16 December 2020, entitled \n\u201cStrengthening national and international rapid response to the impact of the \ncoronavirus disease (COVID-19) on women and girls\u201d, and 75/157 of 16 December \n2020, entitled \u201cWomen and girls and the response to the coronavirus disease \n(COVID-19)\u201d, as well as other relevant resolutions,  \n \n1. \nReaffirms the inalienable right of the people of the United States Virgin \nIslands to self-determination, in conformity with the Charter of the United Nations \nand with General Assembly resolution 1514 (XV), containing the Declaration on the \nGranting of Independence to Colonial Countries and Peoples;  \n \n2. \nAlso reaffirms that, in the process of decolonization of the United States \nVirgin Islands, there is no alternative to the principle of self-determination, which is \nalso a fundamental human right, as recognized under the relevant human rights \nconventions;  \n \n3. \nFurther reaffirms that it is ultimately for the people of the United States \nVirgin Islands to determine freely their future political status in accordance with the \nrelevant provisions of the Charter, the Declaration and the relevant resolutions of the \nGeneral Assembly, and in that connection calls upon the administering Power, in \ncooperation with the territorial Government and appropriate bodies of the United \nNations system, to develop political education programmes for the Territory in order \nto foster an awareness among the people of their right to self-determination in \nconformity with the legitimate political status options, based on the principles clearly \ndefined in Assembly resolution 1541 (XV) and other relevant resolutions and \ndecisions;  \n \n4. \nWelcomes the proposal of a draft constitution emanating from the Territory \nin 2009, as a result of the work of the United States Virgin Islands Fifth Constitutional \nConvention, for review by the administering Power, and requests the administering \nPower to assist the territorial Government in achieving its political, economic and \nsocial goals, in particular the successful conclusion of the internal Constitutional \nConvention exercise;  \n \n5. \nRequests the administering Power to facilitate the process for approval of \nthe proposed constitution and its implementation, once agreed upon in the Territory, \nand to regularly provide the Special Committee on the Situation with regard to the \nImplementation of the Declaration on the Granting of Independence to Colonial \nCountries and Peoples with relevant updates in this regard, including on the process \nfor convening a constitutional convention following the referendum held in \nNovember 2020;  \n \n6. \nAlso requests the administering Power to assist the Territory by facilitating \nits work concerning public educational outreach efforts, consistent with Article 73 b \n__________________ \n \n8  See A/AC.109/2021/16, para. 2. \n\nQuestion of the United States Virgin Islands \nA/RES/76/103\n \n5/6\n21-18709 \n \nof the Charter, and in that regard calls upon the relevant United Nations organizations \nto provide assistance to the Territory, if requested;  \n \n7. \nWelcomes the establishment of the Office of Self-Determination and \nConstitutional Development in the University of the Virgin Islands, with funding from \nthe administering Power, to address the issue of self-determination, including \npolitical status and constitutional education;  \n \n8. \nRecalls the closing of the Hovensa plant in 2012, which had a negative \neconomic impact on the Territory;  \n \n9. \nReiterates its call for the inclusion of the Territory in regional programmes \nof the United Nations Development Programme, consistent with the participation of \nother Non-Self-Governing Territories;  \n \n10. Welcomes the active participation of the Territory in the work of the \nEconomic Commission for Latin America and the Caribbean;  \n \n11. Stresses that the Territory should continue to participate in the activities of \nthe Special Committee, including regional seminars, in order to provide the \nCommittee with up-to-date information regarding the decolonization process;  \n \n12. Also stresses the importance of the Special Committee being apprised of \nthe views and wishes of the people of the United States Virgin Islands and enhancing \nits understanding of their conditions, including the nature and scope of the existing \npolitical and constitutional arrangements between the United States Virgin Islands \nand the administering Power;  \n \n13. Calls upon the administering Power to participate in and cooperate fully \nwith the work of the Special Committee in order to implement the provisions of \nArticle 73 e of the Charter and the Declaration and in order to advise the Committee \non the implementation of the provisions under Article 73 b of the Charter on efforts \nto promote self-government in the United States Virgin Islands, and encourages the \nadministering Power to facilitate visiting and special missions to the Territory;  \n \n14. Reaffirms the responsibility of the administering Power under the Charter \nto promote the economic and social development and to preserve the cultural identity \nof the Territory, and requests the administering Power to take steps to enlist and make \neffective use of all possible assistance, on both a bilateral and a multilateral basis, in \nthe strengthening of the economy of the Territory;  \n \n15. Takes into account the 2030 Agenda for Sustainable Development, 9 \nincluding the Sustainable Development Goals, stresses the importance of fostering \nthe economic and social sustainable development of the Territory by promoting \nsustained, inclusive and equitable economic growth, creating greater opportunities for \nall, reducing inequalities, raising basic standards of living, fostering equitable social \ndevelopment and inclusion and promoting the integrated and sustainable management \nof natural resources and ecosystems that supports, inter alia, economic, social and \nhuman development, while facilitating ecosystem conservation, regeneration, \nrestoration and resilience in the face of new and emerging challenges, and strongly \nurges the administering Power to refrain from undertaking any kind of illicit, harmful \nand unproductive activities, including the use of the Territory as an international \nfinancial centre, that are not aligned with the interest of the people of the Territory;  \n \n16. Requests the Territory and the administering Power to take all measures \nnecessary to protect and conserve the environment of the Territory against any \ndegradation, and once again requests the specialized agencies concerned to monitor \n__________________ \n \n9  Resolution 70/1. \n\nA/RES/76/103 \nQuestion of the United States Virgin Islands\n \n21-18709\n6/6 \n \nenvironmental conditions in the Territory and to provide assistance to the Territory, \nconsistent with their prevailing rules of procedure;  \n \n17. Reiterates its call upon the administering Power, the specialized agencies \nand other organizations of the United Nations system and regional organizations to \nprovide all the assistance necessary to the Territory, support the recovery and \nrebuilding efforts and enhance capabilities for emergency preparedness and risk \nreduction, in particular in the aftermath of Hurricane Irma and Hurricane Maria that \nimpacted the Territory in 2017;  \n \n18. Requests the Special Committee to continue to examine the question of the \nUnited States Virgin Islands and to report thereon to the General Assembly at its \nseventy-seventh session and on the implementation of the present resolution. \n \n49th plenary meeting \n9 December 2021 \n \n \n",
  "paragraphs": {
    "1": "Reaffirms the inalienable right of the people of the United States Virgin Islands to self-determination, in conformity with the Charter of the United Nations and with General Assembly resolution 1514 (XV), containing the Declaration on the Granting of Independence to Colonial Countries and Peoples;",
    "2": "Also reaffirms that, in the process of decolonization of the United States Virgin Islands, there is no alternative to the principle of self-determination, which is also a fundamental human right, as recognized under the relevant human rights conventions;",
    "3": "Further reaffirms that it is ultimately for the people of the United States Virgin Islands to determine freely their future political status in accordance with the relevant provisions of the Charter, the Declaration and the relevant resolutions of the General Assembly, and in that connection calls upon the administering Power, in cooperation with the territorial Government and appropriate bodies of the United Nations system, to develop political education programmes for the Territory in order to foster an awareness among the people of their right to self-determination in conformity with the legitimate political status options, based on the principles clearly defined in Assembly resolution 1541 (XV) and other relevant resolutions and decisions;",
    "4": "Welcomes the proposal of a draft constitution emanating from the Territory in 2009, as a result of the work of the United States Virgin Islands Fifth Constitutional Convention, for review by the administering Power, and requests the administering Power to assist the territorial Government in achieving its political, economic and social goals, in particular the successful conclusion of the internal Constitutional Convention exercise;",
    "5": "Requests the administering Power to facilitate the process for approval of the proposed constitution and its implementation, once agreed upon in the Territory, and to regularly provide the Special Committee on the Situation with regard to the Implementation of the Declaration on the Granting of Independence to Colonial Countries and Peoples with relevant updates in this regard, including on the process for convening a constitutional convention following the referendum held in November 2020;",
    "6": "Also requests the administering Power to assist the Territory by facilitating its work concerning public educational outreach efforts, consistent with Article 73 b of the Charter, and in that regard calls upon the relevant United Nations organizations to provide assistance to the Territory, if requested;",
    "7": "Welcomes the establishment of the Office of Self-Determination and Constitutional Development in the University of the Virgin Islands, with funding from the administering Power, to address the issue of self-determination, including political status and constitutional education;",
    "8": "Recalls the closing of the Hovensa plant in 2012, which had a negative economic impact on the Territory;",
    "9": "Reiterates its call for the inclusion of the Territory in regional programmes of the United Nations Development Programme, consistent with the participation of other Non-Self-Governing Territories;",
    "10": "Welcomes the active participation of the Territory in the work of the Economic Commission for Latin America and the Caribbean;",
    "11": "Stresses that the Territory should continue to participate in the activities of the Special Committee, including regional seminars, in order to provide the Committee with up-to-date information regarding the decolonization process;",
    "12": "Also stresses the importance of the Special Committee being apprised of the views and wishes of the people of the United States Virgin Islands and enhancing its understanding of their conditions, including the nature and scope of the existing political and constitutional arrangements between the United States Virgin Islands and the administering Power;",
    "13": "Calls upon the administering Power to participate in and cooperate fully with the work of the Special Committee in order to implement the provisions of Article 73 e of the Charter and the Declaration and in order to advise the Committee on the implementation of the provisions under Article 73 b of the Charter on efforts to promote self-government in the United States Virgin Islands, and encourages the administering Power to facilitate visiting and special missions to the Territory;",
    "14": "Reaffirms the responsibility of the administering Power under the Charter to promote the economic and social development and to preserve the cultural identity of the Territory, and requests the administering Power to take steps to enlist and make effective use of all possible assistance, on both a bilateral and a multilateral basis, in the strengthening of the economy of the Territory;",
    "15": "Takes into account the 2030 Agenda for Sustainable Development, 9 including the Sustainable Development Goals, stresses the importance of fostering the economic and social sustainable development of the Territory by promoting sustained, inclusive and equitable economic growth, creating greater opportunities for all, reducing inequalities, raising basic standards of living, fostering equitable social development and inclusion and promoting the integrated and sustainable management of natural resources and ecosystems that supports, inter alia, economic, social and human development, while facilitating ecosystem conservation, regeneration, restoration and resilience in the face of new and emerging challenges, and strongly urges the administering Power to refrain from undertaking any kind of illicit, harmful and unproductive activities, including the use of the Territory as an international financial centre, that are not aligned with the interest of the people of the Territory;",
    "16": "Requests the Territory and the administering Power to take all measures necessary to protect and conserve the environment of the Territory against any degradation, and once again requests the specialized agencies concerned to monitor environmental conditions in the Territory and to provide assistance to the Territory, consistent with their prevailing rules of procedure;",
    "17": "Reiterates its call upon the administering Power, the specialized agencies and other organizations of the United Nations system and regional organizations to provide all the assistance necessary to the Territory, support the recovery and rebuilding efforts and enhance capabilities for emergency preparedness and risk reduction, in particular in the aftermath of Hurricane Irma and Hurricane Maria that impacted the Territory in 2017;",
    "18": "Requests the Special Committee to continue to examine the question of the United States Virgin Islands and to report thereon to the General Assembly at its seventy-seventh session and on the implementation of the present resolution."
  },
  "agenda_items": [
    "Item 63"
  ],
  "symbol_references": []
}