{
  "symbol": "A/RES/78/140",
  "filename": "A_RES_78_140.pdf",
  "title": "78/140. Promotion of international cooperation to combat illicit financial flows and strengthen good practices on assets return to foster sustainable development",
  "text": "United Nations \nA/RES/78/140 \n \n \nGeneral Assembly \nDistr.: General \n21 December 2023 \n \n23-25931 (E)    020124 \n*2325931*\n \n \n \nSeventy-eighth session \nAgenda item 16 (f) \nMacroeconomic policy questions: promotion of \ninternational cooperation to combat illicit financial flows \nand strengthen good practices on assets return to foster \nsustainable development  \n \n \n \n \n Resolution adopted by the General Assembly \non 19 December 2023 \n \n \n \n \n[on the report of the Second Committee (A/78/459/Add.6, para. 7)] \n \n \n 78/140. Promotion of international cooperation to combat illicit financial \nflows and strengthen good practices on assets return to foster \nsustainable development \n \n \n \nThe General Assembly, \n \nGuided by the purposes and principles enshrined in the Charter of the United \nNations, \n \nReaffirming its resolution 70/1 of 25 September 2015, entitled \u201cTransforming \nour world: the 2030 Agenda for Sustainable Development\u201d, in which it adopted a \ncomprehensive, far-reaching and people-centred set of universal and transformative \nSustainable Development Goals and targets, its commitment to working tirelessly for \nthe full implementation of the Agenda by 2030, its recognition that eradicating \npoverty in all its forms and dimensions, including extreme poverty, is the greatest \nglobal challenge and an indispensable requirement for sustainable development, its \ncommitment to achieving sustainable development in its three dimensions \u2013 \neconomic, social and environmental \u2013 in a balanced and integrated manner, and to \nbuilding upon the achievements of the Millennium Development Goals and seeking \nto address their unfinished business, \n \nReaffirming also its resolution 69/313 of 27 July 2015 on the Addis Ababa \nAction Agenda of the Third International Conference on Financing for Development, \nwhich is an integral part of the 2030 Agenda for Sustainable Development, supports \nand complements it, helps to contextualize its means of implementation targets with \nconcrete policies and actions, and reaffirms the strong political commitment to \naddress the challenge of financing and creating an enabling environment at all levels \nfor sustainable development in the spirit of global partnership and solidarity, \n\nA/RES/78/140 \nPromotion of international cooperation to combat illicit financial \nflows and strengthen good practices on assets return to foster \nsustainable development\n \n23-25931\n2/10 \n \n \nReaffirming further the United Nations Convention against Corruption,1 which \nis the most comprehensive and universal instrument on corruption, and recognizing \nthe need for its full and effective implementation, to continue to promote its \nratification or accession thereto, and its full support for the Mechanism for the Review \nof Implementation of the Convention, \n \nRecalling its resolution S-32/1 of 2 June 2021 containing the political \ndeclaration entitled \u201cOur common commitment to effectively addressing challenges \nand implementing measures to prevent and combat corruption and strengthen \ninternational cooperation\u201d, and recalling also the resolutions and decisions adopted \nby the Conference of the States Parties to the United Nations Convention against \nCorruption at its ninth session, held in Sharm el-Sheikh, Egypt, from 13 to \n17 December 2021,2 \n \nReaffirming the United Nations Convention against Transnational Organized \nCrime,3 \n \nRecalling its resolutions 65/169 of 20 December 2010, 71/213 of 21 December \n2016, 72/207 of 20 December 2017, 73/222 of 20 December 2018, 74/206 of \n19 December 2019, 75/206 of 21 December 2020 and 76/196 of 17 December 2021 \nand 77/154 of 14 December 2022, \n \nRecalling also its resolutions 71/208 of 19 December 2016, 72/196 of \n19 December 2017, 73/186 of 17 December 2018, 74/177 of 18 December 2019, \n74/276 of 1 June 2020 and 75/194 of 16 December 2020, \n \nTaking note of the 2023 report of the Inter-Agency Task Force on Financing for \nDevelopment4 and its policy recommendations for combating illicit financial flows, \n \nRecognizing that making progress on reducing illicit financial flows as \nfacilitated through strengthened international tax cooperation could contribute to \ndomestic resource mobilization and the achievement of other goals and targets in the \n2030 Agenda, \n \nRecalling the report of the High-level Panel on Illicit Financial Flows from \nAfrica and its relevant contributions in increasing knowledge of the sources of illicit \nfinancial flows, and reiterating its invitation to other regions to carry out similar \nexercises, \n \nRecalling also the high-level meeting on international cooperation to combat \nillicit financial flows and strengthen good practices on assets return, convened by the \nPresident of the General Assembly at Headquarters on 16 May 2019, and taking note \nof the Chair\u2019s summary, \n \nRecalling further the focus on combating illicit financial flows at the High-level \nDialogue on Financing for Development, held on 26 September 2019, as well as the \nHigh-level Dialogue on Financing for Development, held on 20 September 2023, \n \nTaking note of the policy recommendations of the sixth Intergovernmental \nGroup of Experts on Financing for Development of the United Nations Conference \non Trade and Development,5 and recalling the 2020 publication of the Conference on \ntackling illicit financial flows for sustainable development in Africa, 6 \n__________________ \n \n1 United Nations, Treaty Series, vol. 2349, No. 42146. \n \n2 CAC/COSP/2021/17, sect. I. \n \n3 United Nations, Treaty Series, vol. 2225, No. 39574. \n \n4 Financing for Sustainable Development Report 2023 (United Nations publication, 2023). \n \n5 See TD/B/EFD/6/3. \n \n6 Economic Development in Africa Report 2020: Tackling Illicit Financial Flows for Sustainable \nDevelopment in Africa (United Nations publication, 2020). \n\nPromotion of international cooperation to combat illicit financial \nflows and strengthen good practices on assets return to foster \nsustainable development \nA/RES/78/140\n \n3/10\n23-25931 \n \n \nRecalling the report of the High-level Panel on International Financial \nAccountability, Transparency and Integrity for Achieving the 2030 Agenda, 7 and \ntaking note of the recommendations by independent experts contained therein for \nfurther consideration, as appropriate, \n \nRecalling also the conceptual framework for the statistical measurement of \nillicit financial flows of the United Nations Conference on Trade and Development \nand the United Nations Office on Drugs and Crime, recalling further that it was \nendorsed by the Statistical Commission at its fifty-third session for global use as \nindicator 16.4.1 to measure illicit financial flows in the context of the 2030 Agenda \nand its indicator framework, and noting the availability of the first official estimates \nof illicit financial flows based on the endorsed methodology and reported for that \nindicator, \n \nReiterating its deep concern about the impact of illicit financial flows, in \nparticular those caused by tax evasion, corruption and transnational organized crime, \non the economic, social and political stability and development of societies, and \nespecially on developing countries and their progress in financing the 2030 Agenda, \n \nNoting with great concern the severe negative impact on human health, safety \nand well-being caused by the coronavirus disease (COVID-19) pandemic, as well as \nthe severe disruption to societies and economies and the devastating impact on lives \nand livelihoods, and that the poorest and most vulnerable are the hardest hit by the \npandemic, reaffirming the ambition to get back on track to achieve the Sustainable \nDevelopment Goals by designing and implementing sustainable and inclusive \nrecovery strategies to accelerate progress towards the full implementation of the 2030 \nAgenda for Sustainable Development and to help to reduce the risk of and build \nresilience to future shocks, crises and pandemics, including by strengthening health \nsystems and achieving universal health coverage, and recognizing that equitable and \ntimely access for all to safe, quality, effective and affordable COVID-19 vaccines, \ntherapeutics and diagnostics are an essential part of a global response based on unity, \nsolidarity, renewed multilateral cooperation and the principle of leaving no one \nbehind, \n \nAcknowledging that the COVID-19 pandemic has put a spotlight on the \nlimitations of the Governments of developing countries to marshal resources in times \nof crisis, reiterating the need to enhance and strengthen effective domestic resource \nmobilization, including accountable and transparent public expenditure systems, and \nstrengthen domestic regulatory and legal frameworks, as necessary, to more \neffectively counter the harm resulting from illicit financial flows, and that the harm \ndone by such flows in straining the limited resources of developing countries \nevidently affects their ability to address the Sustainable Development Goal financing \ngap and to mobilize domestic resources for longer-term sustainable development, and \nrecalling the meetings of discussion group VI of the informal process launched by the \nSecretary-General and the Governments of Canada and Jamaica on Financing for \nDevelopment in the Era of COVID-19 and Beyond, \n \nEncouraging Member States to use and strengthen appropriate focal points to \nfacilitate information exchange among one another, acknowledging the Riyadh \ninitiative for enhancing international anti-corruption law enforcement cooperation \nand its Global Operational Network of Anti-Corruption Law Enforcement Authorities, \nas well as existing agreements, formal forums or networks, including the International \nCriminal Police Organization (INTERPOL) Global Focal Point Network on Asset \nRecovery,  \n__________________ \n \n7 A/75/810/Rev.1, annex. \n\nA/RES/78/140 \nPromotion of international cooperation to combat illicit financial \nflows and strengthen good practices on assets return to foster \nsustainable development\n \n23-25931\n4/10 \n \n \nBearing in mind that there are different sources of illicit financial flows and that \na separate analysis of each source is more beneficial in designing policy responses to \nprevent illicit financial flows,  \n \nNoting with appreciation the ongoing efforts by regional organizations and other \nrelevant international forums to strengthen cooperation in preventing and combating \nillicit financial flows, as well as new initiatives taken by Governments and the private \nsector to mobilize the financial sector in the collective fight against illicit financial \nflows,  \n \nRecognizing that combating illicit financial flows is an essential development \nchallenge, noting that developing countries are particularly susceptible to the negative \nimpact of illicit financial flows, and emphasizing that illicit financial flows reduce \nthe availability of valuable resources for financing for development,  \n \nRecognizing also the importance of studying the potential relationship between \ncombating illicit financial flows and attaining debt sustainability, \n \nRecognizing further the challenge posed by the increasing scope and complexity \nof illicit financial flows, and recognizing also that the need for the recovery and return \nof stolen assets in accordance with the United Nations Convention against Corruption \nrequires strengthened international cooperation,  \n \nRecognizing that numerous technical, legal and practical challenges are to be \naddressed in order to facilitate the repatriation of proceeds of crime to countries from \nwhere they were originally stolen,  \n \nRecognizing also that global knowledge of the importance of combating illicit \nfinancial flows and enhancing the return of assets is rapidly increasing, as is the \npolitical will to recover illicitly acquired assets by both requesting and requested \nStates, and noting that, while many challenges remain unresolved, tackling them \neffectively requires a holistic approach that recognizes the different types of illicit \nfinancial flows and their impact on sustainable development,  \n \nRecognizing further that the loss of resources caused by corruption, including \ncomplex cases such as those involving multiple national jurisdictions and vast \nquantities of assets, may constitute a substantial proportion of the resources of States, \nand has a particularly negative impact on developing countries, \n \nReaffirming the importance of chapter V of the United Nations Convention \nagainst Corruption, and underlining that the recovery and return of stolen assets \npursuant to that chapter is a fundamental principle of the Convention,  \n \nRecognizing the work carried out by the Conference of the States Parties to the \nUnited Nations Convention against Corruption, and in particular its Open-ended \nIntergovernmental Working Group on Asset Recovery, to advance the full and \neffective implementation of chapter V of the Convention,  \n \nNoting the efforts to promote the exchange of information and synergies \nbetween the open-ended intergovernmental expert meetings to enhance international \ncooperation under the United Nations Convention against Corruption and the Working \nGroup on International Cooperation established by the Conference of the Parties to \nthe United Nations Convention against Transnational Organized Crime, \n \nRecalling the third International Expert Meeting on the Return of Stolen Assets, \nheld in Nairobi on 28 and 29 November 2022, \n \nRecalling also the holding of the second session of the Illicit Trade Forum, in \nGeneva on 6 and 7 September 2022, which highlighted the negative impact of illicit \ntrade, including related illicit financial flows, on the implementation of the \nSustainable Development Goals, revenue generation and economic activity, \n\nPromotion of international cooperation to combat illicit financial \nflows and strengthen good practices on assets return to foster \nsustainable development \nA/RES/78/140\n \n5/10\n23-25931 \n \n \nRecalling further the work of the Platform for Collaboration on Tax, which is to \nintensify collaboration and coordination on tax issues between the United Nations, \nthe International Monetary Fund, the World Bank Group and the Organisation for \nEconomic Co-operation and Development, including on formalizing regular \ndiscussions among the four international organizations on the implementation of \nstandards for international tax matters and on the strengthening of their ability to \nprovide capacity-building support to developing countries, \n \nNoting the ongoing efforts of the joint Organisation for Economic Co-operation \nand Development/United Nations Development Programme initiative, Tax Inspectors \nWithout Borders, to support developing countries through targeted tax audit \nassistance programmes, \n \nRecognizing the important work undertaken by academia and civil society, \nincluding the International Centre for Asset Recovery and the U4 Anti-Corruption \nResource Centre, in assisting Member States in understanding the challenges \nassociated with the return of stolen assets under chapter V of the United Nations \nConvention against Corruption,  \n \nNoting the work of the 143 members of the Organisation for Economic \nCo-operation and Development/Group of 20 Inclusive Framework on Base Erosion \nand Profit Shifting, which provides a forum for collaboration for tackling tax \navoidance, improving the coherence of international tax rules and ensuring a more \ntransparent and fair tax environment, \n \nNoting also international developments on the implementation of the Standard \nfor Automatic Exchange of Financial Account Information in Tax Matters under a \ncommon reporting standard developed by the Organisation for Economic \nCo-operation and Development, which 123 members have already committed to \nimplementing by 2026, as well as the role of the 168 members of the Global Forum \non Transparency and Exchange of Information for Tax Purposes, which enables \ncooperation on an equal footing, \n \nReiterating the pledge that no one will be left behind, reaffirming the \nrecognition that the dignity of the human person is fundamental, and the wish to see \nthe Goals and targets met for all nations and peoples and for all segments of society, \nand recommitting to endeavour to reach the furthest behind first, \n \n1. \nAcknowledges that combating illicit financial flows contributes to \ndomestic resource mobilization, which is essential to finance policies aiming to \nachieve the Sustainable Development Goals;  \n \n2. \nTakes note of the report of the Secretary-General;8 \n \n3. \nReiterates its commitment to financial integrity for sustainable \ndevelopment, through national efforts and international cooperation to combat illicit \nfinancial flows and promote good practices on assets return to foster sustainable \ndevelopment, including through existing relevant international frameworks, such as \nthe United Nations Convention Against Corruption, while noting the ongoing work of \nthe United Nations Office on Drugs and Crime, the United Nations Conference on \nTrade and Development and the Group of 20;  \n \n4. \nReaffirms its commitment to strive to eliminate safe havens that create \nincentives for the transfer abroad of stolen assets and illicit financial flows;  \n \n5. \nAlso reaffirms its commitment to strengthen regulatory frameworks at all \nlevels in accordance with international standards and to further increase the \n__________________ \n \n8 A/78/186. \n\nA/RES/78/140 \nPromotion of international cooperation to combat illicit financial \nflows and strengthen good practices on assets return to foster \nsustainable development\n \n23-25931\n6/10 \n \ntransparency and accountability of financial institutions and the corporate sector, as \nwell as public administrations; \n \n6. \nTakes note of the work of the media in exposing corruption, tax abuse and \nthe failings of financial integrity regulations and controls; \n \n7. \nWelcomes the ongoing efforts of Member States to enhance knowledge and \nbroaden understanding of the challenges and opportunities involved in international \ncooperation to combat illicit financial flows and strengthen good practices on assets \nrecovery and return consistent with the United Nations Convention against Corruption \nso as to foster sustainable development; \n \n8. \nAcknowledges that combating illicit financial flows requires a range of \nactions that includes deterring, detecting, preventing and countering such flows in \nsource, transit and destination countries and expeditious law enforcement action and \ncooperation; \n \n9. \nAlso acknowledges the need to combat illicit financial flows and \nstrengthen good practices on assets return and recovery as one of the sources of \nfinancing for development in a broad range of areas, such as poverty eradication, food \nsecurity, health, education, investment in social programmes or adaptation to climate \nchange, and may contribute to improved sustainable development outcomes; \n \n10. Recognizes that combating illicit financial flows requires a coordinated, \nwhole-of-government approach and therefore encourages Member States to create \ndomestic institutional mechanisms as appropriate and necessary, including those \nrelated to digitalization or other appropriate measures to ensure information-sharing \nand whole-of-government coordination, in this regard invites those Member States \nwilling to prepare integrated national financing frameworks to include plans for \ncombating illicit financial flows, including through the transfer and sharing of data, \nwhere appropriate, and with the necessary safeguards, and looks forward to the \nformulation by the Inter-Agency Task Force on Financing for Development of \nguidance on how countries can incorporate financial integrity actions into their \nfinancing frameworks; \n \n11. Notes that international cooperation in combating illicit financial flows is \na work in progress that must continue to be pursued, and encourages all countries to \ndevelop effective tools and create a policy environment for combating illicit financial \nflows, in accordance with the existing relevant international frameworks, including \nthe United Nations Convention against Corruption;  \n \n12. Recognizes that measures aimed at combating illicit financial flows often \nrequire cross-border cooperation between law enforcement agencies and that, where \nrequested, technical assistance can also contribute to better international cooperation, \nand encourages Member States, where applicable and subject to their domestic legal \nsystems, and in line with their treaty obligations, to cooperate and exchange \ninformation and best practices in this regard; \n \n13. Encourages countries and relevant multilateral and international \norganizations to continue and strengthen their efforts to provide, upon request, \ntechnical assistance and capacity-building assistance to developing countries, as well \nas to support African and other regional initiatives, to prevent, detect and combat \nillicit financial flows and to strengthen good practices on assets recovery and return \nto foster sustainable development in line with the 2030 Agenda for Sustainable \nDevelopment;9 \n__________________ \n \n9 Resolution 70/1. \n\nPromotion of international cooperation to combat illicit financial \nflows and strengthen good practices on assets return to foster \nsustainable development \nA/RES/78/140\n \n7/10\n23-25931 \n \n \n14. Urges Member States that have not yet done so to consider ratifying or \nacceding to the United Nations Convention against Corruption and the United Nations \nConvention against Transnational Organized Crime and the Protocols thereto, 10 and \nurges States parties to those Conventions and Protocols to make efforts towards their \neffective implementation; \n \n15. Reaffirms the need for Member States to effectively implement and \nenforce all existing obligations under the United Nations Convention against \nCorruption, as a critical part of combating illicit financial flows; \n \n16. Urges Member States to increase their efforts to prevent and counter \ncorruption that involves vast quantities of assets and related illicit financial flows, \nnoting that no country alone can effectively combat complex cases involving multiple \njurisdictions and that international cooperation and technical assistance are needed in \nthe prevention of and fight against corruption, including in asset recovery; \n \n17. Stresses that anti-corruption measures should be an integral part of \nnational development policies and strategies and therefore invites countries \ndeveloping integrated national financing frameworks to include anti-corruption \ncomponents and standards therein, as appropriate, further stresses that all jurisdictions \nshould consider undertaking further research, policy development and programming, \nas appropriate, to address corruption, and decides to deter, detect, prevent and counter \ncorruption, increase transparency and promote good governance; \n \n18. Encourages closer public-private sector collaboration to better tackle \ncorruption, and stresses that further research, policy development and programming \nshould help in reaching this goal; \n \n19. Notes with concern that proceeds derived from offences established under \nthe United Nations Convention against Corruption have yet to be disposed of in favour \nof the requesting States parties, their prior legitimate owners and victims of the \ncrimes, and decides to deter, detect, prevent and counter corruption, increase \ntransparency and promote good governance; \n \n20. Encourages States parties to the United Nations Convention against \nCorruption to make full use of the asset recovery tools set forth in chapter V of the \nConvention, including mechanisms for the enforcement of foreign restraining and \nconfiscation orders; \n \n21. Calls upon all States parties to the United Nations Convention against \nCorruption, in particular requesting and requested States parties, to cooperate to \nrecover the proceeds of crime as defined in the Convention, and to fulfil their \nobligation to ensure the return or disposal of such proceeds, in accordance with \narticle 57 of the Convention, and invites States parties, in accordance with their \nrespective domestic laws, to consider allocating recovered resources to finance the \nachievement of the Sustainable Development Goals and to strengthening the \nimplementation of existing multilateral legal instruments for the purpose of asset \nrecovery and return; \n \n22. Requests the United Nations Office on Drugs and Crime, in coordination \nwith the Stolen Asset Recovery Initiative, to continue to expand global knowledge \nand data collection on asset recovery and return by gathering and sharing information \non challenges and good practices, as well as on volumes of assets frozen, seized, \nconfiscated and returned in relation to corruption offences, and the number and types \n__________________ \n \n10 United Nations, Treaty Series, vols. 2225, 2237, 2241 and 2326, No. 39574. \n\nA/RES/78/140 \nPromotion of international cooperation to combat illicit financial \nflows and strengthen good practices on assets return to foster \nsustainable development\n \n23-25931\n8/10 \n \nof cases, as appropriate, while ensuring the protection of personal data and privacy \nrights, drawing upon existing efforts, within existing resources; 11 \n \n23. Stresses that efforts in international tax cooperation should be universal in \napproach and scope and fully take into account the different needs and capacities of \nall countries, in particular the least developed countries, landlocked developing \ncountries, small island developing States and African countries; \n \n24. Encourages further efforts by relevant national and international actors to \nmitigate transfer pricing not in line with the arm\u2019s length principle and trade \nmisinvoicing; \n \n25. Calls upon all countries to work together to eliminate base erosion and \nprofit shifting and to ensure that all companies, including multinationals, pay taxes to \nthe Governments of countries where economic activity occurs and value is created, in \naccordance with national and international laws and policies; \n \n26. Also calls upon all countries to cooperate, in accordance with applicable \nbilateral or multilateral agreements, in the areas of mutual legal assistance, \nadministrative assistance and the exchange of information in tax matters, as well as \nthe automatic exchange of financial account information;  \n \n27. Invites signatories to bilateral or multilateral tax transparency agreements \nto consider allowing information exchanged pursuant to those agreements to be used \nwhere permitted under such agreements and when written consent is provided, having \nregard to confidentiality and domestic law limitations; \n \n28. Invites the Economic and Social Council to update and strengthen the \nUnited Nations code of conduct on cooperation in combating international tax \nevasion 12  in response to new international agreements and to emphasize the \nimportance of developing countries being able to benefit from international tax \ncooperation;  \n \n29. Recognizes the importance of the consideration of international tax \ncooperation at the United Nations, in that regard takes note with appreciation of the \nwork of the Committee of Experts on International Cooperation in Tax Matters, and \ninvites the Economic and Social Council to explore options to strengthen the role of \nthe Committee while giving due consideration to the need that efforts in international \ntax cooperation should be universal in approach and scope;  \n \n30. Takes note of the ongoing work on the implementation of the Organisation \nfor Economic Co-operation and Development/Group of 20 two-pillar solution to \naddress the tax challenges arising from the digitalization of the economy, \nacknowledges the need for a careful analysis of the implications for developing \ncountries, and encourages a special focus on their unique needs and capacities;  \n \n31. Recalls the analysis, in the Financing for Sustainable Development Report \n2022, the Trade and Development Report 2021 of the United Nations Conference on \nTrade and Development and World Economic Situation and Prospects 2022 of the \nDepartment of Economic and Social Affairs of the Secretariat, of the Organisation for \nEconomic Co-operation and Development/Group of 20 two-pillar solution, and calls \nfor inclusive discussions to address the uncertainties and implications for developing \ncountries, including their capacity-building needs; \n \n32. Also recalls that new technologies can both increase efficiency in revenue \ncollection and strengthen the efforts to combat illicit financial flows, expresses \nconcern that virtual assets are being used for illicit activities, and in this regard \n__________________ \n \n11 CAC/COSP/2021/17, sect I.A, resolution 9/2, para. 15. \n \n12 Economic and Social Council resolution 2017/3. \n\nPromotion of international cooperation to combat illicit financial \nflows and strengthen good practices on assets return to foster \nsustainable development \nA/RES/78/140\n \n9/10\n23-25931 \n \nencourages Member States and other relevant organizations to take measures in line \nwith international standards, where applicable, to prevent and counter their illicit use; \n \n33. Notes that various jurisdictions have introduced mechanisms to increase \nbeneficial ownership transparency, including beneficial ownership registries of legal \nentities and legal arrangements, such as companies, trusts and limited liability \npartnerships, encourages all jurisdictions to consider establishing appropriate \nmechanisms through either a registry of beneficial ownership or an alternative \nmechanism, in line with domestic law and applicable international standards, and \nencourages Member States to facilitate the timely availability of adequate, accurate \nand up-to-date beneficial ownership information; \n \n34. Also notes that a wide variety of individuals and entities are involved in \nthe transactions that comprise an illicit financial flow, recognizes the need to consider \nappropriate business regulatory policies, taking into account national circumstances, \nand in this regard reiterates the invitation to the Department of Economic and Social \nAffairs, the United Nations Office on Drugs and Crime and the United Nations \nConference on Trade and Development to jointly prepare a global mapping of existing \nstandards and guidelines, in consultation with all relevant stakeholders, taking into \naccount national circumstances, and to submit these to the Economic and Social \nCouncil for intergovernmental discussion; \n \n35. Recognizes the significant progress and availability of concepts and tested \nmethods to measure illicit financial flows, notes the outcomes of pilot studies across \nthree continents showing that measurement of these flows is possible, while \nchallenging, and requires strengthened support, and calls for increased transparency \nand the strengthening of efforts to enhance the capacity of national authorities for data \ncollection and analysis to combat illicit financial flows with more informed and \ntargeted policy efforts, emphasizing the need to strengthen national capacity to \nmeasure illicit financial flows in the context of the 2030 Agenda and increase the \nexchange of data within national government institutions as well as from international \ninstitutions; \n \n36. Invites the United Nations Office on Drugs and Crime and the United \nNations Conference on Trade and Development as custodian agencies of Sustainable \nDevelopment Goal indicator 16.4.1 on the total value of inward and outward illicit \nfinancial flows, in consultation with other institutions, to leverage and continue \ndeveloping concepts and refine methods developed to date and to provide stronger \nsupport to national authorities, and invites all Member States to engage with the \ncustodian agencies towards reporting data on the indicator; \n \n37. Invites all institutions involved in measuring and reporting on illicit \nfinancial flows to use the statistical concepts and methods to estimate illicit financial \nflows, encourages all Member States to report on Sustainable Development Goal \nindicator 16.4.1, using the methodology adopted by the Statistical Commission, and \ncalls upon the United Nations system entities, international organizations and donors \nto work in coordination with the custodian agencies to train national statistical offices \nand other entities in charge of reporting on illicit financial flows on these agreed \nmethods; \n \n38. Invites the President of the General Assembly, the President of the Economic \nand Social Council, the Secretary-General and the United Nations Office on Drugs and \nCrime to give appropriate consideration to the importance of combating illicit financial \nflows and strengthening good practices on asset return to foster sustainable \ndevelopment, calls upon the relevant organizations of the United Nations system, within \ntheir respective mandates and resources, to continue their consideration of the negative \nimpact of illicit financial flows on financing the 2030 Agenda based on its indicator \n16.4.1 and to coordinate their efforts to further explore policy responses to the \n\nA/RES/78/140 \nPromotion of international cooperation to combat illicit financial \nflows and strengthen good practices on assets return to foster \nsustainable development\n \n23-25931\n10/10 \n \nphenomenon, and in this regard invites all other relevant international institutions to \nsupport these efforts, in accordance with their respective mandates; \n \n39. Reaffirms the commitment at the very heart of the 2030 Agenda to leave \nno one behind and commit to taking more tangible steps to support people in \nvulnerable situations and the most vulnerable countries and to reach the furthest \nbehind first; \n \n40. Calls upon the Economic and Social Council and the United Nations Office \non Drugs and Crime to enhance, within existing mandates, policy recommendations for \ncombating illicit financial flows, involving all the relevant institutions and using \nexisting bodies, to review progress on financial integrity issues, to scale up efforts to \nprovide data on indicator 16.4.1, as well as to foster the implementation of existing \nintergovernmental agreements to address illicit financial flows; \n \n41. Looks forward to the inclusion, in the 2024 report of the Inter-Agency Task \nForce on Financing for Development, of an analysis of international cooperation to \ncombat illicit financial flows and strengthen good practices on assets recovery and \nreturn to foster sustainable development, pursuant to the mandate of the Task Force, \nand also looks forward to the deliberations of the Economic and Social Council forum \non financing for development follow-up on efforts to combat illicit financial flows;  \n \n42. Requests the Secretary-General to submit to the General Assembly at its \nseventy-ninth session a report, within existing resources, in relation to progress made \non combating illicit financial flows and the implementation of assets return and \nrecovery based on existing mechanisms, and to elaborate on strengthening \ninternational coordination in this regard, and requests the United Nations Conference \non Trade and Development and the United Nations Office on Drugs and Crime to \ninform the General Assembly at its seventy-ninth session about the implementation \nof the present resolution, through a dedicated section of the Sustainable Development \nGoals Pulse report, to be introduced to the Second Committee by the Secretariat, \nelaborating in particular on the progress in testing, refining and applying the \nmethodology to report on indicator 16.4.1, and the need to combat illicit financial \nflows and recover and return stolen assets in line with commitments contained in the \nAddis Ababa Action Agenda of the Third International Conference on Financing for \nDevelopment13 and the 2030 Agenda for Sustainable Development, in the context of \nthe COVID-19 pandemic; \n \n43. Decides to include in the provisional agenda of its seventy-ninth session, \nunder the item entitled \u201cMacroeconomic policy questions\u201d, the sub-item entitled \n\u201cPromotion of international cooperation to combat illicit financial flows and \nstrengthen good practices on assets return to foster sustainable development\u201d. \n \n49th plenary meeting \n19 December 2023 \n \n__________________ \n \n13 Resolution 69/313, annex. \n",
  "paragraphs": {
    "1": "Acknowledges that combating illicit financial flows contributes to domestic resource mobilization, which is essential to finance policies aiming to achieve the Sustainable Development Goals;",
    "2": "Takes note of the report of the Secretary-General;8",
    "3": "Reiterates its commitment to financial integrity for sustainable development, through national efforts and international cooperation to combat illicit financial flows and promote good practices on assets return to foster sustainable development, including through existing relevant international frameworks, such as the United Nations Convention Against Corruption, while noting the ongoing work of the United Nations Office on Drugs and Crime, the United Nations Conference on Trade and Development and the Group of 20;",
    "4": "Reaffirms its commitment to strive to eliminate safe havens that create incentives for the transfer abroad of stolen assets and illicit financial flows;",
    "5": "Also reaffirms its commitment to strengthen regulatory frameworks at all levels in accordance with international standards and to further increase the transparency and accountability of financial institutions and the corporate sector, as well as public administrations;",
    "6": "Takes note of the work of the media in exposing corruption, tax abuse and the failings of financial integrity regulations and controls;",
    "7": "Welcomes the ongoing efforts of Member States to enhance knowledge and broaden understanding of the challenges and opportunities involved in international cooperation to combat illicit financial flows and strengthen good practices on assets recovery and return consistent with the United Nations Convention against Corruption so as to foster sustainable development;",
    "8": "Acknowledges that combating illicit financial flows requires a range of actions that includes deterring, detecting, preventing and countering such flows in source, transit and destination countries and expeditious law enforcement action and cooperation;",
    "9": "Also acknowledges the need to combat illicit financial flows and strengthen good practices on assets return and recovery as one of the sources of financing for development in a broad range of areas, such as poverty eradication, food security, health, education, investment in social programmes or adaptation to climate change, and may contribute to improved sustainable development outcomes;",
    "10": "Recognizes that combating illicit financial flows requires a coordinated, whole-of-government approach and therefore encourages Member States to create domestic institutional mechanisms as appropriate and necessary, including those related to digitalization or other appropriate measures to ensure information-sharing and whole-of-government coordination, in this regard invites those Member States willing to prepare integrated national financing frameworks to include plans for combating illicit financial flows, including through the transfer and sharing of data, where appropriate, and with the necessary safeguards, and looks forward to the formulation by the Inter-Agency Task Force on Financing for Development of guidance on how countries can incorporate financial integrity actions into their financing frameworks;",
    "11": "Notes that international cooperation in combating illicit financial flows is a work in progress that must continue to be pursued, and encourages all countries to develop effective tools and create a policy environment for combating illicit financial flows, in accordance with the existing relevant international frameworks, including the United Nations Convention against Corruption;",
    "12": "Recognizes that measures aimed at combating illicit financial flows often require cross-border cooperation between law enforcement agencies and that, where requested, technical assistance can also contribute to better international cooperation, and encourages Member States, where applicable and subject to their domestic legal systems, and in line with their treaty obligations, to cooperate and exchange information and best practices in this regard;",
    "13": "Encourages countries and relevant multilateral and international organizations to continue and strengthen their efforts to provide, upon request, technical assistance and capacity-building assistance to developing countries, as well as to support African and other regional initiatives, to prevent, detect and combat illicit financial flows and to strengthen good practices on assets recovery and return to foster sustainable development in line with the 2030 Agenda for Sustainable Development;9",
    "14": "Urges Member States that have not yet done so to consider ratifying or acceding to the United Nations Convention against Corruption and the United Nations Convention against Transnational Organized Crime and the Protocols thereto, 10 and urges States parties to those Conventions and Protocols to make efforts towards their effective implementation;",
    "15": "Reaffirms the need for Member States to effectively implement and enforce all existing obligations under the United Nations Convention against Corruption, as a critical part of combating illicit financial flows;",
    "16": "Urges Member States to increase their efforts to prevent and counter corruption that involves vast quantities of assets and related illicit financial flows, noting that no country alone can effectively combat complex cases involving multiple jurisdictions and that international cooperation and technical assistance are needed in the prevention of and fight against corruption, including in asset recovery;",
    "17": "Stresses that anti-corruption measures should be an integral part of national development policies and strategies and therefore invites countries developing integrated national financing frameworks to include anti-corruption components and standards therein, as appropriate, further stresses that all jurisdictions should consider undertaking further research, policy development and programming, as appropriate, to address corruption, and decides to deter, detect, prevent and counter corruption, increase transparency and promote good governance;",
    "18": "Encourages closer public-private sector collaboration to better tackle corruption, and stresses that further research, policy development and programming should help in reaching this goal;",
    "19": "Notes with concern that proceeds derived from offences established under the United Nations Convention against Corruption have yet to be disposed of in favour of the requesting States parties, their prior legitimate owners and victims of the crimes, and decides to deter, detect, prevent and counter corruption, increase transparency and promote good governance;",
    "20": "Encourages States parties to the United Nations Convention against Corruption to make full use of the asset recovery tools set forth in chapter V of the Convention, including mechanisms for the enforcement of foreign restraining and confiscation orders;",
    "21": "Calls upon all States parties to the United Nations Convention against Corruption, in particular requesting and requested States parties, to cooperate to recover the proceeds of crime as defined in the Convention, and to fulfil their obligation to ensure the return or disposal of such proceeds, in accordance with article 57 of the Convention, and invites States parties, in accordance with their respective domestic laws, to consider allocating recovered resources to finance the achievement of the Sustainable Development Goals and to strengthening the implementation of existing multilateral legal instruments for the purpose of asset recovery and return;",
    "22": "Requests the United Nations Office on Drugs and Crime, in coordination with the Stolen Asset Recovery Initiative, to continue to expand global knowledge and data collection on asset recovery and return by gathering and sharing information on challenges and good practices, as well as on volumes of assets frozen, seized, confiscated and returned in relation to corruption offences, and the number and types of cases, as appropriate, while ensuring the protection of personal data and privacy rights, drawing upon existing efforts, within existing resources; 11",
    "23": "Stresses that efforts in international tax cooperation should be universal in approach and scope and fully take into account the different needs and capacities of all countries, in particular the least developed countries, landlocked developing countries, small island developing States and African countries;",
    "24": "Encourages further efforts by relevant national and international actors to mitigate transfer pricing not in line with the arm\u2019s length principle and trade misinvoicing;",
    "25": "Calls upon all countries to work together to eliminate base erosion and profit shifting and to ensure that all companies, including multinationals, pay taxes to the Governments of countries where economic activity occurs and value is created, in accordance with national and international laws and policies;",
    "26": "Also calls upon all countries to cooperate, in accordance with applicable bilateral or multilateral agreements, in the areas of mutual legal assistance, administrative assistance and the exchange of information in tax matters, as well as the automatic exchange of financial account information;",
    "27": "Invites signatories to bilateral or multilateral tax transparency agreements to consider allowing information exchanged pursuant to those agreements to be used where permitted under such agreements and when written consent is provided, having regard to confidentiality and domestic law limitations;",
    "28": "Invites the Economic and Social Council to update and strengthen the United Nations code of conduct on cooperation in combating international tax evasion 12 in response to new international agreements and to emphasize the importance of developing countries being able to benefit from international tax cooperation;",
    "29": "Recognizes the importance of the consideration of international tax cooperation at the United Nations, in that regard takes note with appreciation of the work of the Committee of Experts on International Cooperation in Tax Matters, and invites the Economic and Social Council to explore options to strengthen the role of the Committee while giving due consideration to the need that efforts in international tax cooperation should be universal in approach and scope;",
    "30": "Takes note of the ongoing work on the implementation of the Organisation for Economic Co-operation and Development/Group of 20 two-pillar solution to address the tax challenges arising from the digitalization of the economy, acknowledges the need for a careful analysis of the implications for developing countries, and encourages a special focus on their unique needs and capacities;",
    "31": "Recalls the analysis, in the Financing for Sustainable Development Report 2022, the Trade and Development Report 2021 of the United Nations Conference on Trade and Development and World Economic Situation and Prospects 2022 of the Department of Economic and Social Affairs of the Secretariat, of the Organisation for Economic Co-operation and Development/Group of 20 two-pillar solution, and calls for inclusive discussions to address the uncertainties and implications for developing countries, including their capacity-building needs;",
    "32": "Also recalls that new technologies can both increase efficiency in revenue collection and strengthen the efforts to combat illicit financial flows, expresses concern that virtual assets are being used for illicit activities, and in this regard encourages Member States and other relevant organizations to take measures in line with international standards, where applicable, to prevent and counter their illicit use;",
    "33": "Notes that various jurisdictions have introduced mechanisms to increase beneficial ownership transparency, including beneficial ownership registries of legal entities and legal arrangements, such as companies, trusts and limited liability partnerships, encourages all jurisdictions to consider establishing appropriate mechanisms through either a registry of beneficial ownership or an alternative mechanism, in line with domestic law and applicable international standards, and encourages Member States to facilitate the timely availability of adequate, accurate and up-to-date beneficial ownership information;",
    "34": "Also notes that a wide variety of individuals and entities are involved in the transactions that comprise an illicit financial flow, recognizes the need to consider appropriate business regulatory policies, taking into account national circumstances, and in this regard reiterates the invitation to the Department of Economic and Social Affairs, the United Nations Office on Drugs and Crime and the United Nations Conference on Trade and Development to jointly prepare a global mapping of existing standards and guidelines, in consultation with all relevant stakeholders, taking into account national circumstances, and to submit these to the Economic and Social Council for intergovernmental discussion;",
    "35": "Recognizes the significant progress and availability of concepts and tested methods to measure illicit financial flows, notes the outcomes of pilot studies across three continents showing that measurement of these flows is possible, while challenging, and requires strengthened support, and calls for increased transparency and the strengthening of efforts to enhance the capacity of national authorities for data collection and analysis to combat illicit financial flows with more informed and targeted policy efforts, emphasizing the need to strengthen national capacity to measure illicit financial flows in the context of the 2030 Agenda and increase the exchange of data within national government institutions as well as from international institutions;",
    "36": "Invites the United Nations Office on Drugs and Crime and the United Nations Conference on Trade and Development as custodian agencies of Sustainable Development Goal indicator 16.4.1 on the total value of inward and outward illicit financial flows, in consultation with other institutions, to leverage and continue developing concepts and refine methods developed to date and to provide stronger support to national authorities, and invites all Member States to engage with the custodian agencies towards reporting data on the indicator;",
    "37": "Invites all institutions involved in measuring and reporting on illicit financial flows to use the statistical concepts and methods to estimate illicit financial flows, encourages all Member States to report on Sustainable Development Goal indicator 16.4.1, using the methodology adopted by the Statistical Commission, and calls upon the United Nations system entities, international organizations and donors to work in coordination with the custodian agencies to train national statistical offices and other entities in charge of reporting on illicit financial flows on these agreed methods;",
    "38": " phenomenon, and in this regard invites all other relevant international institutions to support these efforts, in accordance with their respective mandates;",
    "39": "Reaffirms the commitment at the very heart of the 2030 Agenda to leave no one behind and commit to taking more tangible steps to support people in vulnerable situations and the most vulnerable countries and to reach the furthest behind first;",
    "40": "Calls upon the Economic and Social Council and the United Nations Office on Drugs and Crime to enhance, within existing mandates, policy recommendations for combating illicit financial flows, involving all the relevant institutions and using existing bodies, to review progress on financial integrity issues, to scale up efforts to provide data on indicator 16.4.1, as well as to foster the implementation of existing intergovernmental agreements to address illicit financial flows;",
    "41": "Looks forward to the inclusion, in the 2024 report of the Inter-Agency Task Force on Financing for Development, of an analysis of international cooperation to combat illicit financial flows and strengthen good practices on assets recovery and return to foster sustainable development, pursuant to the mandate of the Task Force, and also looks forward to the deliberations of the Economic and Social Council forum on financing for development follow-up on efforts to combat illicit financial flows;",
    "42": "Requests the Secretary-General to submit to the General Assembly at its seventy-ninth session a report, within existing resources, in relation to progress made on combating illicit financial flows and the implementation of assets return and recovery based on existing mechanisms, and to elaborate on strengthening international coordination in this regard, and requests the United Nations Conference on Trade and Development and the United Nations Office on Drugs and Crime to inform the General Assembly at its seventy-ninth session about the implementation of the present resolution, through a dedicated section of the Sustainable Development Goals Pulse report, to be introduced to the Second Committee by the Secretariat, elaborating in particular on the progress in testing, refining and applying the methodology to report on indicator 16.4.1, and the need to combat illicit financial flows and recover and return stolen assets in line with commitments contained in the Addis Ababa Action Agenda of the Third International Conference on Financing for Development13 and the 2030 Agenda for Sustainable Development, in the context of the COVID-19 pandemic;",
    "43": "Decides to include in the provisional agenda of its seventy-ninth session, under the item entitled \u201cMacroeconomic policy questions\u201d, the sub-item entitled \u201cPromotion of international cooperation to combat illicit financial flows and strengthen good practices on assets return to foster sustainable development\u201d."
  },
  "agenda_items": [
    "Item 16"
  ],
  "symbol_references": []
}