{
  "symbol": "A/RES/75/118",
  "filename": "A_RES_75_118.pdf",
  "title": "75/118. Question of Tokelau",
  "text": "United Nations \nA/RES/75/118\n \n \nGeneral Assembly \nDistr.: General \n21 December 2020 \n \n20-16953 (E)    281220     \n*2016953* \n \n \nSeventy-fifth session \nAgenda item 61 \nImplementation of the Declaration on the Granting of \nIndependence to Colonial Countries and Peoples  \n \n \n \n \n Resolution adopted by the General Assembly \non 10 December 2020 \n \n \n \n \n[on the report of the Special Political and Decolonization Committee  \n \n \n(Fourth Committee) (A/75/420, para. 27)] \n \n \n \n75/118. Question of Tokelau \n \n \n \nThe General Assembly, \n \nHaving considered the question of Tokelau, \n \nTaking note of the report of the Special Committee on the Situation with regard \nto the Implementation of the Declaration on the Granting of Independence to Colonial \nCountries and Peoples for 2020,1  \n \nRecalling its resolution 1514 (XV) of 14 December 1960, containing the \nDeclaration on the Granting of Independence to Colonial Countries and Peoples, and \nall resolutions and decisions of the United Nations relating to Non-Self-Governing \nTerritories, in particular General Assembly resolution 74/109 of 13 December 2019, \n \nNoting with appreciation the continuing exemplary cooperation of New Zealand \nas the administering Power with regard to the work of the Special Committee relating \nto Tokelau and its readiness to permit access by United Nations visiting missions to \nthe Territory,  \n \nNoting with appreciation also the collaborative contribution to the development \nof Tokelau by New Zealand and the specialized agencies and other organizations of \nthe United Nations system, in particular the United Nations Development Programme \nand the Food and Agriculture Organization of the United Nations, \n \nBearing in mind that, as a small island Territory, Tokelau exemplifies the \nsituation of most remaining Non-Self-Governing Territories and that, as a case study \npointing to successful cooperation for decolonization, Tokelau has wider significance \nfor the United Nations as it seeks to complete its work in decolonization, \n__________________ \n \n1  Official Records of the General Assembly, Seventy-fifth Session, Supplement No. 23 (A/75/23). \n\nA/RES/75/118 \nQuestion of Tokelau\n \n20-16953\n2/4 \n \n \nRecalling the status of Tokelau as an associate member of the Food and \nAgriculture Organization of the United Nations and of the Pacific Islands Forum, \n \nAcknowledging the World No Tobacco Day Award for the western Pacific region \ngranted to Tokelau in 2017 by the World Health Organization for its policy entitled \n\u201cTobacco-Free Tokelau by 2020\u201d, and expressing hope that this could contribute to \nthe well-being of the Territory and its peoples, \n \nCognizant that New Zealand and Tokelau signed, on 21 November 2003, a \ndocument entitled \u201cJoint statement of the principles of partnership\u201d, which sets out \nthe rights and responsibilities of the two partners, \n \nBearing in mind the decision of the General Fono at its meeting in November \n2003, following extensive consultations undertaken in all three villages, to explore \nformally with New Zealand the option of self-government in free association, its \ndecision in August 2005 to hold in February 2006 a referendum on self-determination \non the basis of a draft constitution for Tokelau and a draft treaty of free association \nwith New Zealand, and its subsequent decision to hold a further referendum in \nOctober 2007, and bearing in mind also that the two referendums did not produce the \ntwo-thirds majority of valid votes cast required by the General Fono to change the \nstatus of Tokelau from that of a Non-Self-Governing Territory under the \nadministration of New Zealand, \n \nNoting the holding of free and fair elections in the Territory on 23 January 2020, \nand noting also the most recent change of the Ulu-o-Tokelau during the General Fono, \non 9 March 2020, \n \nRecalling the 2013 constitutional consultations, to be further considered by the \nConstitution Committee, which were driven by the people of Tokelau and which \naimed at developing a model of government structure that is culturally appropriate \nand sensitive to their current situation, culminating in the approval and ratification of \nthe national symbol of the Territory, along with the constitution, national anthem and \nnational flag,  \n \nCognizant of the statement made by the Ulu-o-Tokelau at the Pacific regional \nseminar on the implementation of the Third International Decade for the Eradication \nof Colonialism, held in Nadi, Fiji, from 21 to 23 May 2014, and also of the written \nstatement for the Pacific regional seminar held in Saint George\u2019s from 9 to 11 May \n2018 that the self-determination process of the Territory could not be addressed in \nisolation from the threat of climate change, the rise in sea level and the challenges to \nthe 2030 Agenda for Sustainable Development,2 and bearing in mind the intention of \nTokelau to articulate its development and other priorities in the National Strategic \nPlan for 2016\u20132020, including consideration of the issue of self-determination and \nhow it would prepare for a possible referendum on self-determination in cooperation \nwith the administering Power,  \n \nRecalling the official launch in April 2017 of the climate change strategy of \nTokelau, entitled \u201cLiving with change: an integrated national strategy for enhancing \nthe resilience of Tokelau to climate change and related hazards, 2017\u20132030\u201d, and the \nimplementation plan for the first five years of the strategy, from 1 July 2017 to \n30 June 2022, and welcoming the launch of the Tokelau national greenhouse gas \ninventory report on 11 April 2019, \n \nRecalling also the announcement of the administering Power that, as requested \nby the Government of Tokelau, it had submitted a formal declaration to the United \n__________________ \n \n2  Resolution 70/1. \n\nQuestion of Tokelau \nA/RES/75/118\n \n3/4\n20-16953 \n \nNations to extend the territorial application of both the United Nations Framework \nConvention on Climate Change3 and the Paris Agreement4 to Tokelau,  \n \nRecalling further the statements made by the representatives of the Government \nof New Zealand, as the administering Power, on 22 June 2018, at a session of the \nSpecial Committee, and at the Caribbean regional seminar held in Grand Anse, \nGrenada, in May 2019, which underlined the shared vision with Tokelau of building \nstronger governance and more effective management of public services, finances and \ninfrastructure assets, with emphasis on quality health care and education, enhancing \ninter-atoll connectivity, including the vessel to support search and rescue missions, \nmedical evacuations and general transport between the atolls, which entered into \nservice in April 2019, \n \nRecalling its resolutions 74/270 of 2 April 2020, entitled \u201cGlobal solidarity to \nfight the coronavirus disease 2019 (COVID-19)\u201d, and 74/274 of 20 April 2020, \nentitled \u201cInternational cooperation to ensure global access to medicines, vaccines and \nmedical equipment to face COVID-19\u201d,  \n \n1. \nAcknowledges the decision of the General Fono in 2008 that consideration \nof any future act of self-determination by Tokelau will be deferred and that New \nZealand and Tokelau will devote renewed effort and attention to ensuring that essential \nservices and infrastructure on the atolls of Tokelau are enhanced and strengthened, \nthereby ensuring an enhanced quality of life and opportunities for the people of Tokelau; \n \n2. \nWelcomes the progress made towards the devolution of power to the three \ntaupulega (village councils) since 2004, and notes that further discussion is planned \non the recommendations in the report on the devolution review, compiled in 2012; \n \n3. \nNotes with satisfaction the democratic elections in Tokelau held on \n23 January 2020 for the tenth General Fono and the subsequent swearing-in of the \nUlu-o-Tokelau on 9 March 2020; \n \n4. \nNotes with appreciation that Tokelau and New Zealand remain firmly \ncommitted to the ongoing development of Tokelau for the long-term benefit of the \npeople of Tokelau, with particular emphasis on the further development of facilities \non each atoll that meet their current requirements, including investment to connect \nTokelau to an undersea fibre-optic cable for faster and more reliable Internet services, \nimproved maritime transport infrastructure and services, quality health care and \neducation and support for the fisheries sector; \n \n5. \nRecalls the consideration by Tokelau of its National Strategic Plan for \n2016\u20132020, which prioritizes good governance, human development, infrastructure \ndevelopment, sustainability and climate change adaptation, and notes the completion \nby Tokelau of the Plan, which determines development and other priorities for the \n2016\u20132020 period, and the Plan\u2019s focus on infrastructure development to support \nservice delivery, including through transport and telecommunications solutions; \n \n6. \nAcknowledges the ongoing and consistent commitment of New Zealand to \nmeeting the social and economic requirements of the people of Tokelau, including \nthrough new shipping service assets and shipping infrastructure development, and \nbudget support for the delivery of education services ranging from early childhood \neducation to foundation courses for tertiary study, as well as the support and \ncooperation of the United Nations Development Programme and the World Health \nOrganization;  \n \n7. \nCommends the completion by Tokelau in 2013 of the Tokelau Renewable \nEnergy Project with the support of the administering Power and the receipt by the \n__________________ \n \n3  United Nations, Treaty Series, vol. 1771, No. 30822. \n \n4  See FCCC/CP/2015/10/Add.1, decision 1/CP.21, annex. \n\nA/RES/75/118 \nQuestion of Tokelau\n \n20-16953\n4/4 \n \nGovernment of the Renewable Energy Award granted by the New Zealand Energy \nEfficiency and Conservation Authority; \n \n8. \nAlso commends Tokelau for the recent measures taken to safeguard the \nhealth of its peoples through its \u201cTobacco-Free Tokelau by 2020\u201d policy, and \nencourages the necessary support for its implementation from the administering \nPower, the United Nations system and relevant stakeholders; \n \n9. \nAcknowledges the need of Tokelau for continued support from the \ninternational community and its desire to become part of the discussions on the 2030 \nAgenda for Sustainable Development, the impacts of climate change and the \nprotection of the environment and oceans, and in this regard encourages, as \nappropriate, assistance towards the implementation of the climate change strategy of \nTokelau, entitled \u201cLiving with change: an integrated national strategy for enhancing \nthe resilience of Tokelau to climate change and related hazards, 2017\u20132030\u201d, and the \nassociated plan, also acknowledges the efforts of the administering Power to include \nin its national reporting to the secretariat of the United Nations Framework \nConvention on Climate Change the climate mitigation action taken by Tokelau, and \nnotes with appreciation the launch of the Tokelau national greenhouse gas inventory \nreport on 11 April 2019 as a milestone achievement; \n \n10. Recalls with satisfaction the establishment and operation of the Tokelau \nInternational Trust Fund to support the ongoing needs of Tokelau, and calls upon \nMember States and international and regional agencies to contribute to the Fund and \nthereby lend practical support to Tokelau in overcoming the problems of smallness, \nisolation and lack of resources; \n \n11. \nWelcomes the cooperative attitude of the other States and territories in the \nregion towards Tokelau and their support for its economic and political aspirations \nand its increasing participation in regional and international affairs, and in this regard \nnotes the successful chairmanship by Tokelau of the tenth annual ministerial meeting \nof the Forum Fisheries Committee of the Pacific Islands Forum Fisheries Agency, \nheld in Tokelau on 1 and 2 July 2014, the representation of the Agency by the \nUlu-o-Tokelau at the third International Conference on Small Island Developing \nStates, held in Apia from 1 to 4 September 2014, and the signing by Tokelau of the \nPacific Islands Development Forum Charter on 27 April 2016 so as to become the \ntwelfth member of the Forum, and the recent participation of Tokelau, represented by \nthe Ulu-o-Tokelau, as an associate member in the forty-ninth Pacific Islands Forum \nLeaders Meeting, held in Nauru in September 2018; \n \n12. Calls upon the administering Power and United Nations agencies to \ncontinue to provide assistance to Tokelau as it further develops;  \n \n13. Recognizes the positive actions taken by the administering Power to \ntransmit to the Secretary-General under Article 73 e of the Charter of the United \nNations information regarding the political, economic and social situation of \nTokelau; \n \n14. Commends the renewed strong commitment of both Tokelau and New \nZealand to continuing to work together in the interests of Tokelau and its people;  \n \n15. \nRequests the Special Committee on the Situation with regard to the \nImplementation of the Declaration on the Granting of Independence to Colonial Countries \nand Peoples to continue to examine the question of the Non-Self-Governing Territory of \nTokelau and to report thereon to the General Assembly at its seventy-sixth session. \n \n41st plenary meeting \n10 December 2020 \n \n",
  "paragraphs": {
    "1": "Acknowledges the decision of the General Fono in 2008 that consideration of any future act of self-determination by Tokelau will be deferred and that New Zealand and Tokelau will devote renewed effort and attention to ensuring that essential services and infrastructure on the atolls of Tokelau are enhanced and strengthened, thereby ensuring an enhanced quality of life and opportunities for the people of Tokelau;",
    "2": "Welcomes the progress made towards the devolution of power to the three taupulega (village councils) since 2004, and notes that further discussion is planned on the recommendations in the report on the devolution review, compiled in 2012;",
    "3": "Notes with satisfaction the democratic elections in Tokelau held on 23 January 2020 for the tenth General Fono and the subsequent swearing-in of the Ulu-o-Tokelau on 9 March 2020;",
    "4": "Notes with appreciation that Tokelau and New Zealand remain firmly committed to the ongoing development of Tokelau for the long-term benefit of the people of Tokelau, with particular emphasis on the further development of facilities on each atoll that meet their current requirements, including investment to connect Tokelau to an undersea fibre-optic cable for faster and more reliable Internet services, improved maritime transport infrastructure and services, quality health care and education and support for the fisheries sector;",
    "5": "Recalls the consideration by Tokelau of its National Strategic Plan for 2016\u20132020, which prioritizes good governance, human development, infrastructure development, sustainability and climate change adaptation, and notes the completion by Tokelau of the Plan, which determines development and other priorities for the 2016\u20132020 period, and the Plan\u2019s focus on infrastructure development to support service delivery, including through transport and telecommunications solutions;",
    "6": "Acknowledges the ongoing and consistent commitment of New Zealand to meeting the social and economic requirements of the people of Tokelau, including through new shipping service assets and shipping infrastructure development, and budget support for the delivery of education services ranging from early childhood education to foundation courses for tertiary study, as well as the support and cooperation of the United Nations Development Programme and the World Health Organization;",
    "7": "Commends the completion by Tokelau in 2013 of the Tokelau Renewable Energy Project with the support of the administering Power and the receipt by the __________________ 3 United Nations, Treaty Series, vol. 1771, No. 30822. 4 See FCCC/CP/2015/10/Add.1, decision 1/CP.21, annex. A/RES/75/118 Question of Tokelau 20-16953 4/4 Government of the Renewable Energy Award granted by the New Zealand Energy Efficiency and Conservation Authority;",
    "8": "Also commends Tokelau for the recent measures taken to safeguard the health of its peoples through its \u201cTobacco-Free Tokelau by 2020\u201d policy, and encourages the necessary support for its implementation from the administering Power, the United Nations system and relevant stakeholders;",
    "9": "Acknowledges the need of Tokelau for continued support from the international community and its desire to become part of the discussions on the 2030 Agenda for Sustainable Development, the impacts of climate change and the protection of the environment and oceans, and in this regard encourages, as appropriate, assistance towards the implementation of the climate change strategy of Tokelau, entitled \u201cLiving with change: an integrated national strategy for enhancing the resilience of Tokelau to climate change and related hazards, 2017\u20132030\u201d, and the associated plan, also acknowledges the efforts of the administering Power to include in its national reporting to the secretariat of the United Nations Framework Convention on Climate Change the climate mitigation action taken by Tokelau, and notes with appreciation the launch of the Tokelau national greenhouse gas inventory report on 11 April 2019 as a milestone achievement;",
    "10": "Recalls with satisfaction the establishment and operation of the Tokelau International Trust Fund to support the ongoing needs of Tokelau, and calls upon Member States and international and regional agencies to contribute to the Fund and thereby lend practical support to Tokelau in overcoming the problems of smallness, isolation and lack of resources;",
    "11": "Welcomes the cooperative attitude of the other States and territories in the region towards Tokelau and their support for its economic and political aspirations and its increasing participation in regional and international affairs, and in this regard notes the successful chairmanship by Tokelau of the tenth annual ministerial meeting of the Forum Fisheries Committee of the Pacific Islands Forum Fisheries Agency, held in Tokelau on 1 and 2 July 2014, the representation of the Agency by the Ulu-o-Tokelau at the third International Conference on Small Island Developing States, held in Apia from 1 to 4 September 2014, and the signing by Tokelau of the Pacific Islands Development Forum Charter on 27 April 2016 so as to become the twelfth member of the Forum, and the recent participation of Tokelau, represented by the Ulu-o-Tokelau, as an associate member in the forty-ninth Pacific Islands Forum Leaders Meeting, held in Nauru in September 2018;",
    "12": "Calls upon the administering Power and United Nations agencies to continue to provide assistance to Tokelau as it further develops;",
    "13": "Recognizes the positive actions taken by the administering Power to transmit to the Secretary-General under Article 73 e of the Charter of the United Nations information regarding the political, economic and social situation of Tokelau;",
    "14": "Commends the renewed strong commitment of both Tokelau and New Zealand to continuing to work together in the interests of Tokelau and its people;",
    "15": "Requests the Special Committee on the Situation with regard to the Implementation of the Declaration on the Granting of Independence to Colonial Countries and Peoples to continue to examine the question of the Non-Self-Governing Territory of Tokelau and to report thereon to the General Assembly at its seventy-sixth session. 41st plenary meeting 10 December 2020"
  },
  "agenda_items": [
    "Item 61"
  ],
  "symbol_references": []
}