{
  "symbol": "A/RES/75/48",
  "filename": "A_RES_75_48.pdf",
  "title": "75/48. Women, disarmament, non-proliferation and arms control",
  "text": "United Nations \nA/RES/75/48 \n \n \nGeneral Assembly \nDistr.: General \n17 December 2020 \n \n20-16861 (E)    221220     \n*2016861* \n \n \nSeventy-fifth session \nAgenda item 103 (gg) \nGeneral and complete disarmament: women, disarmament, \nnon-proliferation and arms control \n \n \n \nResolution adopted by the General Assembly on \n7 December 2020 \n \n \n[on the report of the First Committee (A/75/399, para. 96)] \n \n \n \n75/48. Women, disarmament, non-proliferation and arms control \n \n \n \nThe General Assembly, \n \nRecalling that the Charter of the United Nations reaffirms the equal rights of \nwomen and men, \n \nRecalling also its resolutions 65/69 of 8 December 2010, 67/48 of 3 December \n2012, 68/33 of 5 December 2013, 69/61 of 2 December 2014, 71/56 of 5 December \n2016 and 73/46 of 5 December 2018, \n \nRecalling further General Assembly and Security Council resolutions on the \nissue of women and peace and security, \n \nRecognizing that 2020 marks the twenty-fifth anniversary of the Fourth World \nConference on Women and the adoption of the Beijing Declaration and Platform for \nAction1 and the twentieth anniversary of the adoption of Security Council resolution \n1325 (2000) on women and peace and security, \n \nTaking note of action 36 of the Agenda for Disarmament of the Secretary-\nGeneral, on the full and equal participation of women in decision-making processes, \nand action 37, on gender parity on disarmament bodies established by the Secretariat, \n \nReaffirming the Sustainable Development Goals relevant to the promotion of \nwomen, disarmament, non-proliferation and arms control, and acknowledging that the \nsuccess of efforts to achieve sustainable development and disarmament depends on \nthe full and effective inclusion of women in all aspects of these efforts, \n \nWelcoming the call for the full and meaningful participation of women in efforts \nto prevent, combat and eradicate the illicit transfer of small arms, pursuant to Security \n__________________ \n \n1 Report of the Fourth World Conference on Women, Beijing, 4\u201315 September 1995 (United \nNations publication, Sales No. E.96.IV.13), chap. I, resolution 1, annexes I and II. \n\nA/RES/75/48 \nWomen, disarmament, non-proliferation and arms control\n \n20-16861\n2/3 \n \nCouncil resolutions 2106 (2013) of 24 June 2013, 2117 (2013) of 26 September 2013, \n2122 (2013) of 18 October 2013 and 2220 (2015) of 22 May 2015, \n \nReaffirming that the equal, full and effective participation of both women and \nmen is one of the essential factors for the promotion and attainment of sustainable \npeace and security, \n \nRecognizing that women should not only be perceived as victims of gender-\nbased armed violence, but also are essential in preventing and reducing armed \nviolence and are active and key players in advocating for arms control, disarmament \nand non-proliferation, \n \nRecognizing also the valuable contribution of women to practical disarmament \nmeasures carried out at the local, national, subregional and regional levels in the \nprevention and reduction of armed violence and armed conflict, and in promoting \ndisarmament, non-proliferation and arms control, \n \nRecalling its resolution 74/64 of 12 December 2019, in which it reaffirmed the \nimportant and positive contribution that young people could make to the promotion \nand attainment of sustainable peace and security, \n \nRecognizing that the role of women in disarmament, non-proliferation and arms \ncontrol should be further developed and in particular the need to facilitate the \nparticipation and representation of women in policymaking, planning and \nimplementation processes related to disarmament, non-proliferation and arms \ncontrol, \n \nRecalling the entry into force of the Arms Trade Treaty,2 therefore encouraging \nStates parties to ensure the full and equal participation of women and men in pursuing \nthe objective and purpose of all provisions of the Treaty, including the provisions on \nserious acts of gender-based violence and on violence against children, and also \nnoting the adoption of the action-oriented decision on gender and gender-based \nviolence at the Fifth Conference of States Parties to the Arms Trade Treaty, \n \nNoting with appreciation the efforts of Member States to increase the \nparticipation of women in their national and regional coordination mechanisms on \ndisarmament-related matters, including in efforts to prevent, combat and eradicate the \nillicit trade in small arms and light weapons in all its aspects, \n \nRecognizing the important role played by civil society organizations in \npromoting the role of women in disarmament, non-proliferation and arms control, \n \nTaking into consideration the impact of the coronavirus disease (COVID-19) \npandemic on the progress made in gender equality, multilateral disarmament and arms \ncontrol, and acknowledging that the pandemic has further exacerbated the \nsocioeconomic conditions of vulnerable groups across the world, which has resulted \nin the intensification of tensions and an alarming increase in cases of domestic and \ngender-based armed violence, \n \n1. \nUrges Member States, relevant subregional and regional organizations, the \nUnited Nations and the specialized agencies to promote equal opportunities for the \nrepresentation of women in all decision-making processes with regard to matters \nrelated to disarmament, non-proliferation and arms control, in particular as it relates \nto the prevention and reduction of armed violence and armed conflict; \n \n2. \nWelcomes the report of the Secretary-General on the measures taken by \nMember States to implement General Assembly resolution 73/46;3 \n__________________ \n \n2 See resolution 67/234 B. \n \n3 A/75/133. \n\nWomen, disarmament, non-proliferation and arms control \nA/RES/75/48\n \n3/3\n20-16861 \n \n \n3. \nAlso welcomes the continuing efforts of the United Nations organs, \nagencies, funds and programmes to accord high priority to the issue of women and \npeace and security, and in this regard notes the role of the United Nations Entity for \nGender Equality and the Empowerment of Women (UN-Women) in promoting the \nimplementation of all resolutions related to women in the context of peace and \nsecurity; \n \n4. \nEncourages Member States to better understand the impact of armed \nviolence, in particular the impact of the illicit trafficking in small arms and light \nweapons on women and girls, through, inter alia, the development of national action \nplans on women and peace and security and strengthening the collection of data \ndisaggregated by sex and age; \n \n5. \nUrges Member States to support and strengthen the effective participation \nof women in organizations in the field of disarmament at the local, national, \nsubregional and regional levels; \n \n6. \nCalls upon all States to empower women, including through mentoring, \nnetworking, knowledge-sharing and capacity-building efforts, as appropriate, to \nparticipate in the design and implementation of disarmament, non-proliferation and \narms control efforts; \n \n7. \nEncourages States to seriously consider increasing funding for policies \nand programmes that take account of the differing impacts of illicit small arms and \nlight weapons on women, men, girls and boys; \n \n8. \nCalls upon all States to develop appropriate and effective national risk \nassessment criteria to facilitate the prevention of the use of arms to commit violence \nagainst women; \n \n9. \nRequests the relevant United Nations organs, agencies, funds and \nprogrammes to assist States, upon request, in promoting the role of women in \ndisarmament, non-proliferation and arms control, including in preventing, combating \nand eradicating the illicit trade in small arms and light weapons; \n \n10. Requests the Secretary-General to seek the views of Member States on \nways and means of promoting the role of women in disarmament, non-proliferation \nand arms control and to report to the General Assembly at its seventy-seventh session \non the implementation of the present resolution; \n \n11. Decides to include in the provisional agenda of its seventy-seventh \nsession, under the item entitled \u201cGeneral and complete disarmament\u201d, the sub-item \nentitled \u201cWomen, disarmament, non-proliferation and arms control\u201d. \n \n37th plenary meeting \n7 December 2020 \n \n",
  "paragraphs": {
    "1": "Urges Member States, relevant subregional and regional organizations, the United Nations and the specialized agencies to promote equal opportunities for the representation of women in all decision-making processes with regard to matters related to disarmament, non-proliferation and arms control, in particular as it relates to the prevention and reduction of armed violence and armed conflict;",
    "2": "Welcomes the report of the Secretary-General on the measures taken by Member States to implement General Assembly resolution 73/46;3 __________________ 2 See resolution 67/234 B. 3 A/75/133. Women, disarmament, non-proliferation and arms control A/RES/75/48 3/3 20-16861",
    "3": "Also welcomes the continuing efforts of the United Nations organs, agencies, funds and programmes to accord high priority to the issue of women and peace and security, and in this regard notes the role of the United Nations Entity for Gender Equality and the Empowerment of Women (UN-Women) in promoting the implementation of all resolutions related to women in the context of peace and security;",
    "4": "Encourages Member States to better understand the impact of armed violence, in particular the impact of the illicit trafficking in small arms and light weapons on women and girls, through, inter alia, the development of national action plans on women and peace and security and strengthening the collection of data disaggregated by sex and age;",
    "5": "Urges Member States to support and strengthen the effective participation of women in organizations in the field of disarmament at the local, national, subregional and regional levels;",
    "6": "Calls upon all States to empower women, including through mentoring, networking, knowledge-sharing and capacity-building efforts, as appropriate, to participate in the design and implementation of disarmament, non-proliferation and arms control efforts;",
    "7": "Encourages States to seriously consider increasing funding for policies and programmes that take account of the differing impacts of illicit small arms and light weapons on women, men, girls and boys;",
    "8": "Calls upon all States to develop appropriate and effective national risk assessment criteria to facilitate the prevention of the use of arms to commit violence against women;",
    "9": "Requests the relevant United Nations organs, agencies, funds and programmes to assist States, upon request, in promoting the role of women in disarmament, non-proliferation and arms control, including in preventing, combating and eradicating the illicit trade in small arms and light weapons;",
    "10": "Requests the Secretary-General to seek the views of Member States on ways and means of promoting the role of women in disarmament, non-proliferation and arms control and to report to the General Assembly at its seventy-seventh session on the implementation of the present resolution;",
    "11": "Decides to include in the provisional agenda of its seventy-seventh session, under the item entitled \u201cGeneral and complete disarmament\u201d, the sub-item entitled \u201cWomen, disarmament, non-proliferation and arms control\u201d. 37th plenary meeting 7 December 2020"
  },
  "agenda_items": [
    "Item 103"
  ],
  "symbol_references": []
}