{
  "symbol": "A/RES/74/172",
  "filename": "A_RES_74_172.pdf",
  "title": "74/172. Education for Justice and the rule of law in the context of sustainable development",
  "text": "United Nations \nA/RES/74/172\n \n \nGeneral Assembly \nDistr.: General \n7 January 2020 \n \n19-22318 (E)    100120 \n*1922318* \n \n \nSeventy-fourth session \nAgenda item 106 \nCrime prevention and criminal justice \n \n \n \n \n Resolution adopted by the General Assembly \non 18 December 2019 \n \n \n \n \n[on the report of the Third Committee (A/74/400)] \n \n \n 74/172. Education for Justice and the rule of law in the context \nof sustainable development \n \n \n \nThe General Assembly, \n \nReaffirming its commitment to the purposes and principles of the Charter of the \nUnited Nations and international law, which are the indispensable foundation of a \nmore peaceful, prosperous and just world, and reiterating its determination to foster \nstrict respect for them and to establish a just and lasting peace all over the world, \n \nReaffirming also the right of everyone to education, which is enshrined in the \nUniversal Declaration of Human Rights1 and is recognized by States parties to the \nInternational Covenant on Economic, Social and Cultural Rights,2 the Convention on \nthe Rights of the Child, 3  the Convention on the Elimination of All Forms of \nDiscrimination against Women, 4  the Convention on the Rights of Persons with \nDisabilities5 and other relevant instruments, \n \nRecalling that the Sustainable Development Goals and targets, as set out in the \n2030 Agenda for Sustainable Development, 6  are integrated and indivisible and \nbalance the three dimensions of sustainable development, and acknowledging the \nimportance of taking measures to ensure inclusive and equitable quality education \nand promoting lifelong learning opportunities for all, including expanded \nopportunities for all children, particularly girls, to access quality education, as well \n__________________ \n \n1  Resolution 217 A (III). \n \n2  See resolution 2200 A (XXI), annex. \n \n3  United Nations, Treaty Series, vol. 1577, No. 27531. \n \n4  Ibid., vol. 1249, No. 20378. \n \n5  Ibid., vol. 2515, No. 44910. \n \n6  Resolution 70/1. \n\nA/RES/74/172 \nEducation for Justice and the rule of law\nin the context of sustainable development\n \n19-22318\n2/4 \n \nas the need to promote peaceful and inclusive societies for sustainable development, \nprovide access to justice for all and build effective, accountable and inclusive \ninstitutions at all levels,  \n \nRecognizing the important and positive contribution of young people to efforts \nto maintain and promote peace and the rule of law,  \n \nReaffirming the Doha Declaration on Integrating Crime Prevention and \nCriminal Justice into the Wider United Nations Agenda to Address Social and \nEconomic Challenges and to Promote the Rule of Law at the National and \nInternational Levels, and Public Participation,7 in which Member States emphasized \nthat education for all children and youth, including the eradication of illiteracy, was \nfundamental to the prevention of crime and corruption and to the promotion of the \nrule of law and human rights while respecting cultural identities, and stressed the \nfundamental role of youth participation in crime prevention efforts,  \n \nTaking note of the Incheon Declaration: Education 2030 \u2013 towards inclusive and \nequitable quality education and lifelong learning for all, adopted at the World \nEducation Forum 2015, held in Incheon, Republic of Korea, from 19 to 22 May 2015, 8 \nwhich affirmed the understanding of education as a main driver of development that \nis essential for peace, tolerance, human fulfilment and sustainable development, as \nwell as key to achieving full employment and poverty eradication,  \n \nAcknowledging the importance of working to ensure inclusive and equitable \nquality education at all levels \u2013 early childhood, primary, secondary, tertiary, adult \nand distance education, including technical and vocational training \u2013 so that all people \nmay have access to lifelong learning opportunities that help them to acquire the \nknowledge and skills needed to access opportunities to participate fully in society and \ncontribute to sustainable development,  \n \n1. \nReiterates its invitation to Governments to take into consideration the \nDoha Declaration on Integrating Crime Prevention and Criminal Justice into the \nWider United Nations Agenda to Address Social and Economic Challenges and to \nPromote the Rule of Law at the National and International Levels, and Public \nParticipation,7 adopted by the Thirteenth United Nations Congress on Crime \nPrevention and Criminal Justice, when formulating legislation and policy directives \nand to make every effort, where appropriate, to implement the principles contained \ntherein, in conformity with the purposes and principles of the Charter of the United \nNations;  \n \n2. \nRecalls the 2030 Agenda for Sustainable Development,6 in which Member \nStates committed themselves to the Sustainable Development Goals and targets and \nto ensuring that all learners acquired the knowledge and skills needed to promote \nsustainable development, including through education for sustainable development;  \n \n3. \nUrges Member States to provide access to education for all, including \ntechnical and professional skills, and to promote lifelong learning skills for all, and \ninvites Member States to promote educational programmes related to crime \nprevention, criminal justice and the rule of law, in particular for children and young \npeople; \n \n4. \nCalls upon Member States to integrate crime prevention and criminal \njustice strategies into all relevant social and economic policies and programmes, in \n__________________ \n \n7  Resolution 70/174, annex. \n \n8  See United Nations Educational, Scientific and Cultural Organization, Final Report of the World \nEducation Forum 2015, Incheon, Republic of Korea, 19\u201322 May 2015 (Paris, 2015). \n\nEducation for Justice and the rule of law \nin the context of sustainable development \nA/RES/74/172\n \n3/4\n19-22318 \n \nparticular those affecting youth, with a special emphasis on programmes focused on \nincreasing educational and employment opportunities for youth and young adults; \n \n5. \nInvites Member States, in accordance with domestic legislation, to \nencourage strengthened cooperation between the crime prevention and criminal \njustice sectors and the education sector, as well as other relevant sectors, to promote \nthe integration of education on justice and the rule of law into their education systems \nand programmes;  \n \n6. \nEmphasizes the right to education, recognizes that investment in universal, \nquality and inclusive education and training is the most important investment that \nStates can make to ensure the short- and long-term development of youth, reiterates \nthat access to inclusive, equitable and quality formal and non-formal education at all \nlevels, including, as appropriate, catch-up and literacy education, including in \ninformation and communications technologies, for those who did not receive formal \neducation, information and communications technologies and volunteerism are \nimportant factors that enable young people to acquire the relevant skills and to build \ntheir capacities, including for employability and entrepreneurial development, and to \nobtain decent and productive work, and calls upon Member States to take the actions \nnecessary to ensure that young people have access to such services and opportunities, \nwhich will allow them to be drivers of development;  \n \n7. \nInvites Member States to develop awareness-raising programmes to \nconvey key values based on the rule of law and supported by educational programmes, \nto be accompanied by economic and social policies promoting equality, solidarity and \njustice, and to reach out to young people, drawing on them as agents of positive \nchange;  \n \n8. \nAlso invites Member States to intensify, in line with their domestic legal \nframeworks, national and international efforts to eliminate all forms of \ndiscrimination, including racism, religious intolerance, xenophobia and gender-\nrelated discrimination, by, inter alia, raising awareness, developing educational \nmaterials and programmes and considering, where appropriate, drafting and enforcing \nlegislation against discrimination and, to these ends, to strive to achieve all relevant \nSustainable Development Goals, including Goals 4, 5, 8, 10 and 16;  \n \n9. \nWelcomes the ongoing work of the United Nations Office on Drugs and \nCrime, within its mandate, in the area of education on justice and the rule of law, \nincluding under the Education for Justice initiative, which is a key component of the \nGlobal Programme for the Implementation of the Doha Declaration: Towards the \nPromotion of a Culture of Lawfulness; \n \n10. Requests the United Nations Office on Drugs and Crime to continue its \nefforts to promote education on the rule of law and justice in collaboration with the \nUnited Nations Educational, Scientific and Cultural Organization, in particular under \nthe Global Citizenship Education for the Rule of Law: Doing the Right Thing \npartnership, and welcomes in this regard the launch of the joint publication entitled \nStrengthening the Rule of Law through Education: A Guide for Policymakers; \n \n11. \nNotes that the main theme of the Fourteenth United Nations Congress on \nCrime Prevention and Criminal Justice, to be held in Kyoto, Japan, in 2020, is \n\u201cAdvancing crime prevention, criminal justice and the rule of law: towards the \nachievement of the 2030 Agenda\u201d, and welcomes the fruitful discussions and \ndeliberations at the regional preparatory meetings for the Fourteenth Congress on that \nsubject, particularly those relating to education; \n \n12. Requests the United Nations Office on Drugs and Crime to report on its \nactivities to promote education on justice in the report of the Secretary-General on \n\nA/RES/74/172 \nEducation for Justice and the rule of law\nin the context of sustainable development\n \n19-22318\n4/4 \n \nthe implementation of the Doha Declaration to be submitted at the Fourteenth \nCongress; \n \n13. Invites Member States and other donors to provide extrabudgetary \nresources for the purposes described above, in accordance with the rules and \nprocedures of the United Nations. \n \n50th plenary meeting \n18 December 2019 \n \n",
  "paragraphs": {
    "1": "Reiterates its invitation to Governments to take into consideration the Doha Declaration on Integrating Crime Prevention and Criminal Justice into the Wider United Nations Agenda to Address Social and Economic Challenges and to Promote the Rule of Law at the National and International Levels, and Public Participation,7 adopted by the Thirteenth United Nations Congress on Crime Prevention and Criminal Justice, when formulating legislation and policy directives and to make every effort, where appropriate, to implement the principles contained therein, in conformity with the purposes and principles of the Charter of the United Nations;",
    "2": "Recalls the 2030 Agenda for Sustainable Development,6 in which Member States committed themselves to the Sustainable Development Goals and targets and to ensuring that all learners acquired the knowledge and skills needed to promote sustainable development, including through education for sustainable development;",
    "3": "Urges Member States to provide access to education for all, including technical and professional skills, and to promote lifelong learning skills for all, and invites Member States to promote educational programmes related to crime prevention, criminal justice and the rule of law, in particular for children and young people;",
    "4": "Calls upon Member States to integrate crime prevention and criminal justice strategies into all relevant social and economic policies and programmes, in particular those affecting youth, with a special emphasis on programmes focused on increasing educational and employment opportunities for youth and young adults;",
    "5": "Invites Member States, in accordance with domestic legislation, to encourage strengthened cooperation between the crime prevention and criminal justice sectors and the education sector, as well as other relevant sectors, to promote the integration of education on justice and the rule of law into their education systems and programmes;",
    "6": "Emphasizes the right to education, recognizes that investment in universal, quality and inclusive education and training is the most important investment that States can make to ensure the short- and long-term development of youth, reiterates that access to inclusive, equitable and quality formal and non-formal education at all levels, including, as appropriate, catch-up and literacy education, including in information and communications technologies, for those who did not receive formal education, information and communications technologies and volunteerism are important factors that enable young people to acquire the relevant skills and to build their capacities, including for employability and entrepreneurial development, and to obtain decent and productive work, and calls upon Member States to take the actions necessary to ensure that young people have access to such services and opportunities, which will allow them to be drivers of development;",
    "7": "Invites Member States to develop awareness-raising programmes to convey key values based on the rule of law and supported by educational programmes, to be accompanied by economic and social policies promoting equality, solidarity and justice, and to reach out to young people, drawing on them as agents of positive change;",
    "8": "Also invites Member States to intensify, in line with their domestic legal frameworks, national and international efforts to eliminate all forms of discrimination, including racism, religious intolerance, xenophobia and gender- related discrimination, by, inter alia, raising awareness, developing educational materials and programmes and considering, where appropriate, drafting and enforcing legislation against discrimination and, to these ends, to strive to achieve all relevant Sustainable Development Goals, including Goals 4, 5, 8, 10 and 16;",
    "9": "Welcomes the ongoing work of the United Nations Office on Drugs and Crime, within its mandate, in the area of education on justice and the rule of law, including under the Education for Justice initiative, which is a key component of the Global Programme for the Implementation of the Doha Declaration: Towards the Promotion of a Culture of Lawfulness;",
    "10": "Requests the United Nations Office on Drugs and Crime to continue its efforts to promote education on the rule of law and justice in collaboration with the United Nations Educational, Scientific and Cultural Organization, in particular under the Global Citizenship Education for the Rule of Law: Doing the Right Thing partnership, and welcomes in this regard the launch of the joint publication entitled Strengthening the Rule of Law through Education: A Guide for Policymakers;",
    "11": "Notes that the main theme of the Fourteenth United Nations Congress on Crime Prevention and Criminal Justice, to be held in Kyoto, Japan, in 2020, is \u201cAdvancing crime prevention, criminal justice and the rule of law: towards the achievement of the 2030 Agenda\u201d, and welcomes the fruitful discussions and deliberations at the regional preparatory meetings for the Fourteenth Congress on that subject, particularly those relating to education;",
    "12": " the implementation of the Doha Declaration to be submitted at the Fourteenth Congress;",
    "13": "Invites Member States and other donors to provide extrabudgetary resources for the purposes described above, in accordance with the rules and procedures of the United Nations."
  },
  "agenda_items": [
    "Item 106"
  ],
  "symbol_references": []
}