{
  "symbol": "A/RES/79/142",
  "filename": "A_RES_79_142.pdf",
  "title": "79/142. World Lake Day",
  "text": "United Nations \nA/RES/79/142\n \nGeneral Assembly \nDistr.: General \n16 December 2024 \n24-23830 (E) \n*2423830* \n \n \nSeventy-ninth session \nAgenda item 13 \nIntegrated and coordinated implementation of and follow-up \nto the outcomes of the major United Nations conferences and \nsummits in the economic, social and related fields \n \n \n \n \n Resolution adopted by the General Assembly \non 12 December 2024 \n \n \n[without reference to a Main Committee (A/79/L.39)] \n \n \n 79/142. World Lake Day \n \n \n \nThe General Assembly, \n \nReaffirming its resolution 66/288 of 27 July 2012, which endorsed the outcome \ndocument of the United Nations Conference on Sustainable Development, entitled \n\u201cThe future we want\u201d, \n \nReaffirming also its resolution 70/1 of 25 September 2015, entitled \n\u201cTransforming our world: the 2030 Agenda for Sustainable Development\u201d, by which \nit adopted a comprehensive, far-reaching and people-centred set of universal and \ntransformative Sustainable Development Goals and targets, \n \nReaffirming further its resolutions 53/199 of 15 December 1998 and 61/185 of \n20 December 2006 on the proclamation of international years, and Economic and \nSocial Council resolution 1980/67 of 25 July 1980 on international years and \nanniversaries, in particular paragraphs 1 to 10 of the annex thereto on the agreed \ncriteria for the proclamation of international years, as well as paragraphs 13 and 14, \nin which it is stated that an international year should not be proclaimed before the \nbasic arrangements for its organization and financing have been made, \n \nReiterating that lakes are one of the water-related ecosystems that should be \nprotected and restored, in line with target 6.6 of the Sustainable Development Goals, \n \nTaking note of resolution 5/4 of the United Nations Environment Assembly, \nentitled \u201cSustainable lake management\u201d, adopted on 2 March 2022, and reaffirming \nthe importance of integrated, intersectoral, collaborative and coordinated approaches, \nat all levels, in the management and protection of lakes, \n \nRecognizing the important contribution of sustainable lake management in \ntackling environmental challenges, \n\nA/RES/79/142 \nWorld Lake Day\n \n24-23830\n2/2 \n \n \nEmphasizing that water ecosystems, including lakes, energy, food security and \nnutrition are linked and that water is indispensable for health, well-being and human \ndevelopment, and a vital element of achieving the Sustainable Development Goals \nand other relevant goals in the social, environmental and economic fields, \n \nRecognizing that the state of lake environments, notably in terms of water \nquality and quantity, is severely deteriorating around the world and that this needs to \nbe urgently addressed in a sustainable manner, \n \nStressing the urgent need to address the unprecedented global decline in \nbiodiversity, including through the preservation and restoring and safeguarding \necosystems that provide essential functions and services, including services related to \nwater, health, livelihoods and well-being, \n \nEmphasizing the need for raising awareness and promoting education of the \nvalue of lakes and their essential role in supporting human livelihood, biodiversity \nand ecosystems resilience through sustainable lake management, in line with SDG 6, \n \nTrusting that the observance of an international day will create a comprehensive \nplatform to promote sustainable lake management, \n \n1. \nDecides to designate 27 August as World Lake Day, to be observed \nannually;  \n \n2. \nInvites all States Members of the United Nations, members of the \nspecialized agencies and observers of the General Assembly, as well as the \norganizations of the United Nations system, other international, regional and \nsubregional organizations and other relevant stakeholders, including civil society, the \nprivate sector and academia, to observe World Lake Day in an appropriate manner \nthrough activities aimed at education and awareness-raising of the importance of lakes \nand preserving, conserving, restoring and sustainably managing lake and related \necosystems;  \n \n3. \nInvites the United Nations Environment Programme to facilitate the \nobservance of World Lake Day, mindful of the provisions contained in the annex to \nEconomic and Social Council resolution 1980/67;  \n \n4. \nStresses that the cost of all activities that may arise from the \nimplementation of the present resolution should be met through voluntary \ncontributions, including from the private sector; \n \n5. \nRequests the Secretary-General to bring the present resolution to the \nattention of all States Members of the United Nations, members of the specialized \nagencies and observers of the General Assembly, as well as the organizations of the \nUnited Nations system and other relevant stakeholders, for appropriate observance of \nWorld Lake Day. \n \n52nd plenary meeting \n12 December 2024 \n \n",
  "paragraphs": {
    "1": "Decides to designate 27 August as World Lake Day, to be observed annually;",
    "2": "Invites all States Members of the United Nations, members of the specialized agencies and observers of the General Assembly, as well as the organizations of the United Nations system, other international, regional and subregional organizations and other relevant stakeholders, including civil society, the private sector and academia, to observe World Lake Day in an appropriate manner through activities aimed at education and awareness-raising of the importance of lakes and preserving, conserving, restoring and sustainably managing lake and related ecosystems;",
    "3": "Invites the United Nations Environment Programme to facilitate the observance of World Lake Day, mindful of the provisions contained in the annex to Economic and Social Council resolution 1980/67;",
    "4": "Stresses that the cost of all activities that may arise from the implementation of the present resolution should be met through voluntary contributions, including from the private sector;",
    "5": "Requests the Secretary-General to bring the present resolution to the attention of all States Members of the United Nations, members of the specialized agencies and observers of the General Assembly, as well as the organizations of the United Nations system and other relevant stakeholders, for appropriate observance of World Lake Day. 52nd plenary meeting 12 December 2024"
  },
  "agenda_items": [
    "Item 13"
  ],
  "symbol_references": [
    "A/79/L.39"
  ]
}