{
  "symbol": "A/RES/76/261",
  "filename": "A_RES_76_261.pdf",
  "title": "76/261. Joint Inspection Unit",
  "text": "United Nations \nA/RES/76/261\n \n \nGeneral Assembly \nDistr.: General \n18 April 2022 \n \n22-05579 (E)    210422 \n*2205579* \n \n \nSeventy-sixth session \nAgenda item 144 \nJoint Inspection Unit \n \n \n \n \n Resolution adopted by the General Assembly \non 13 April 2022 \n \n \n \n \n[on the report of the Fifth Committee (A/76/778, para. 6)] \n \n \n 76/261. Joint Inspection Unit \n \n \n \nThe General Assembly, \n \nRecalling its previous resolutions on the Joint Inspection Unit, in particular \nresolutions 31/192 of 22 December 1976, 50/233 of 7 June 1996, 54/16 of 29 October \n1999, 56/245 of 24 December 2001, 57/284 A and B of 20 December 2002, 58/286 of \n8 April 2004, 59/267 of 23 December 2004, 60/258 of 8 May 2006, 61/238 of \n22 December 2006, 61/260 of 4 April 2007, 62/226 of 22 December 2007, 62/246 of \n3 April 2008, 63/272 of 7 April 2009, 64/262 of 29 March 2010, 65/270 of 4 April \n2011, 66/259 of 9 April 2012, 67/256 of 12 April 2013, 68/266 of 9 April 2014, 69/275 \nof 2 April 2015, 70/257 of 1 April 2016, 71/281 of 6 April 2017, 72/269 of 4 April \n2018, 73/287 of 15 April 2018 and 75/270 of 16 April 2021, \n \nReaffirming the statute of the Unit1 and the unique role of the Unit as the only \nexternal and independent system-wide inspection, evaluation and investigation body, \n \nHaving considered the report of the Unit for 2021 and programme of work for \n20222 and the note by the Secretary-General on the report of the Unit for 2021,3 \n \n1. \nTakes note with appreciation of the report of the Joint Inspection Unit for \n2021 and programme of work for 2022; \n \n2. \nTakes note of the note by the Secretary-General on the report of the Unit \nfor 2021; \n \n3. \nStresses the importance of the oversight functions of the Unit in \nidentifying concrete managerial, administrative and programming questions within \nthe participating organizations and providing the General Assembly and other \nlegislative organs of participating organizations with practical and action-oriented \n__________________ \n \n1 Resolution 31/192, annex. \n \n2 Official Records of the General Assembly, Seventy-sixth Session, Supplement No. 34 (A/76/34). \n \n3 A/76/603. \n\nA/RES/76/261 \nJoint Inspection Unit\n \n22-05579\n2/3 \n \nrecommendations to improve and strengthen the governance of the United Nations as \na whole; \n \n4. \nNotes with appreciation the continued efforts of the Unit to ensure \nefficient and effective mandate delivery, and encourages the Unit to continue its \nefforts towards enhancing accountability, oversight and governance of the United \nNations; \n \n5. \nRecognizes that the effectiveness of the Unit system-wide is a shared \nresponsibility of the Unit, the Member States and the secretariats of the participating \norganizations; \n \n6. \nAlso recognizes the need to continue to enhance the impact of the Unit on \nthe management efficiency and transparency of the participating organizations within \nthe United Nations system; \n \n7. \nWelcomes the coordination of the Unit with the Board of Auditors and the \nOffice of Internal Oversight Services of the Secretariat, and encourages those bodies \nto continue to share experiences, knowledge, best practices and lessons learned with \nother United Nations audit and oversight bodies, as well as with the Independent \nAudit Advisory Committee, with a view to avoiding overlap or duplication and \nachieving further synergy, cooperation, effectiveness and efficiency, without \nprejudice to the respective mandates of the audit and oversight bodies; \n \n8. \nInvites the legislative bodies of participating organizations to effectively \nuse the reports of the Unit, and to give timely and due consideration to its \nrecommendations, in accordance with article 11, paragraph 4, of the statute of the \nUnit, and requests the Secretary-General, as Chair of the United Nations System Chief \nExecutives Board for Coordination, to continue to encourage participating \norganizations within the United Nations system to regularly review the status of \nacceptance and implementation of the recommendations of the Unit, especially those \nrelated to system-wide coordination and coherence, and to consider reporting \nexplanations for non-acceptance and non-implementation to the Unit; \n \n9. \nCommends the Unit on conducting an internal self-assessment of its work \nand operations, and looks forward to an update in the context of the next report of the \nUnit; \n \n10. Welcomes the implementation of the strategic framework for the period \n2020\u20132029 of the Joint Inspection Unit, stresses the need to continuously update and \nimprove the strategic framework, taking into account the dynamics and challenges, \nincluding those related to the coronavirus disease (COVID-19) pandemic and ongoing \nreform efforts, and requests the Unit to report on its outreach strategy to familiarize \nthe leadership of participating organizations with the strategic framework and to \nexchange information on the work of participating organizations in supporting the \nimplementation of the 2030 Agenda for Sustainable Development 4  as well as \nemerging challenges; \n \n11. \nNotes with appreciation the performance plan established to monitor and \nassess the implementation of the strategic framework, as well as the intention of the \nUnit to make a comprehensive midpoint assessment in 2024, and encourages it to \nreport on the progress of the strategic framework, including these targets, annually \nand to consider improving the individual performance measures; \n \n12. Also notes with appreciation the efforts of the Unit to improve the quality \nof its reports, including their readability and timeliness, and encourages the Unit to \n__________________ \n \n4 Resolution 70/1. \n\nJoint Inspection Unit \nA/RES/76/261\n \n3/3\n22-05579 \n \nseek feedback regularly from participating organizations regarding the quality and \nutility of its products and to utilize it for enhancing the efficiency of its work; \n \n13. Requests the Unit to continue to provide the Secretariat with its reports in \na timely manner in order to ensure their simultaneous translation in all the official \nlanguages of the United Nations, well in advance of meetings of the legislative organs \nof participating organizations so that the reports can be thoroughly and effectively \nutilized in their deliberations; \n \n14. Reiterates its request to the executive heads of the participating \norganizations to fully comply with the statutory procedures for consideration of the \nreports of the Unit and, in particular, to submit their comments, including information \non what they intend to do regarding the recommendations of the Unit, to distribute \nreports in time for their consideration by legislative organs and to provide information \non the steps to be taken to implement those recommendations accepted by the \nlegislative organs and the executive heads of participating organizations; \n \n15. Reiterates its request to the Secretary-General and the other executive \nheads of the participating organizations to fully assist the Unit with the timely \nprovision of all information requested by it; \n \n16. Recognizes the efforts of the Unit to further strengthen its outreach and \nenhance its engagement with the senior management of its participating organizations \nand the Member States, and requests the Unit to continue such efforts with a view to \nimproving acceptance of recommendations, including further engagement with the \nUnited Nations System Chief Executives Board for Coordination. \n \n68th plenary meeting \n13 April 2022 \n \n",
  "paragraphs": {
    "1": "Takes note with appreciation of the report of the Joint Inspection Unit for 2021 and programme of work for 2022;",
    "2": "Takes note of the note by the Secretary-General on the report of the Unit for 2021;",
    "3": "Stresses the importance of the oversight functions of the Unit in identifying concrete managerial, administrative and programming questions within the participating organizations and providing the General Assembly and other legislative organs of participating organizations with practical and action-oriented __________________ 1 Resolution 31/192, annex. 2 Official Records of the General Assembly, Seventy-sixth Session, Supplement No. 34 (A/76/34). 3 A/76/603. A/RES/76/261 Joint Inspection Unit 22-05579 2/3 recommendations to improve and strengthen the governance of the United Nations as a whole;",
    "4": "Notes with appreciation the continued efforts of the Unit to ensure efficient and effective mandate delivery, and encourages the Unit to continue its efforts towards enhancing accountability, oversight and governance of the United Nations;",
    "5": "Recognizes that the effectiveness of the Unit system-wide is a shared responsibility of the Unit, the Member States and the secretariats of the participating organizations;",
    "6": "Also recognizes the need to continue to enhance the impact of the Unit on the management efficiency and transparency of the participating organizations within the United Nations system;",
    "7": "Welcomes the coordination of the Unit with the Board of Auditors and the Office of Internal Oversight Services of the Secretariat, and encourages those bodies to continue to share experiences, knowledge, best practices and lessons learned with other United Nations audit and oversight bodies, as well as with the Independent Audit Advisory Committee, with a view to avoiding overlap or duplication and achieving further synergy, cooperation, effectiveness and efficiency, without prejudice to the respective mandates of the audit and oversight bodies;",
    "8": "Invites the legislative bodies of participating organizations to effectively use the reports of the Unit, and to give timely and due consideration to its recommendations, in accordance with article 11, paragraph 4, of the statute of the Unit, and requests the Secretary-General, as Chair of the United Nations System Chief Executives Board for Coordination, to continue to encourage participating organizations within the United Nations system to regularly review the status of acceptance and implementation of the recommendations of the Unit, especially those related to system-wide coordination and coherence, and to consider reporting explanations for non-acceptance and non-implementation to the Unit;",
    "9": "Commends the Unit on conducting an internal self-assessment of its work and operations, and looks forward to an update in the context of the next report of the Unit;",
    "10": "Welcomes the implementation of the strategic framework for the period 2020\u20132029 of the Joint Inspection Unit, stresses the need to continuously update and improve the strategic framework, taking into account the dynamics and challenges, including those related to the coronavirus disease (COVID-19) pandemic and ongoing reform efforts, and requests the Unit to report on its outreach strategy to familiarize the leadership of participating organizations with the strategic framework and to exchange information on the work of participating organizations in supporting the implementation of the 2030 Agenda for Sustainable Development 4 as well as emerging challenges;",
    "11": "Notes with appreciation the performance plan established to monitor and assess the implementation of the strategic framework, as well as the intention of the Unit to make a comprehensive midpoint assessment in 2024, and encourages it to report on the progress of the strategic framework, including these targets, annually and to consider improving the individual performance measures;",
    "12": "Also notes with appreciation the efforts of the Unit to improve the quality of its reports, including their readability and timeliness, and encourages the Unit to __________________ 4 Resolution 70/1. Joint Inspection Unit A/RES/76/261 3/3 22-05579 seek feedback regularly from participating organizations regarding the quality and utility of its products and to utilize it for enhancing the efficiency of its work;",
    "13": "Requests the Unit to continue to provide the Secretariat with its reports in a timely manner in order to ensure their simultaneous translation in all the official languages of the United Nations, well in advance of meetings of the legislative organs of participating organizations so that the reports can be thoroughly and effectively utilized in their deliberations;",
    "14": "Reiterates its request to the executive heads of the participating organizations to fully comply with the statutory procedures for consideration of the reports of the Unit and, in particular, to submit their comments, including information on what they intend to do regarding the recommendations of the Unit, to distribute reports in time for their consideration by legislative organs and to provide information on the steps to be taken to implement those recommendations accepted by the legislative organs and the executive heads of participating organizations;",
    "15": "Reiterates its request to the Secretary-General and the other executive heads of the participating organizations to fully assist the Unit with the timely provision of all information requested by it;",
    "16": "Recognizes the efforts of the Unit to further strengthen its outreach and enhance its engagement with the senior management of its participating organizations and the Member States, and requests the Unit to continue such efforts with a view to improving acceptance of recommendations, including further engagement with the United Nations System Chief Executives Board for Coordination. 68th plenary meeting 13 April 2022"
  },
  "agenda_items": [
    "Item 144"
  ],
  "symbol_references": []
}