{
  "symbol": "A/RES/79/56",
  "filename": "A_RES_79_56.pdf",
  "title": "79/56. Implementation of the Convention on the Prohibition of the Development, Production, Stockpiling and Use of Chemical Weapons and on Their Destruction",
  "text": "United Nations \nA/RES/79/56\n \n \nGeneral Assembly \nDistr.: General \n9 December 2024 \n \n24-23081 (E)     \n*2423081* \n \n \nSeventy-ninth session \nAgenda item 98 (j) \nGeneral and complete disarmament: implementation of the \nConvention on the Prohibition of the Development, \nProduction, Stockpiling and Use of Chemical Weapons and \non Their Destruction  \n \n \n \n \n Resolution adopted by the General Assembly \non 2 December 2024 \n \n \n \n \n[on the report of the First Committee (A/79/408, para. 114)] \n \n \n \n79/56. Implementation of the Convention on the Prohibition of the \nDevelopment, Production, Stockpiling and Use of Chemical \nWeapons and on Their Destruction \n \n \n \nThe General Assembly, \n \nRecalling its previous resolutions on the subject of chemical weapons, in \nparticular resolution 78/29 of 4 December 2023, \n \nDetermined to achieve the effective prohibition of the development, production, \nacquisition, transfer, stockpiling and use of chemical weapons and their destruction, \n \nHonouring the memory of and paying tribute to all victims of chemical weapons, \n \nReaffirming its strong support for the Convention on the Prohibition of the \nDevelopment, Production, Stockpiling and Use of Chemical Weapons and on Their \nDestruction1 and for the Organisation for the Prohibition of Chemical Weapons and \nits deep appreciation of the Organisation, which was awarded the Nobel Peace Prize \nfor 2013 for its extensive efforts to eliminate chemical weapons, \n \nRecalling decisions C-24/DEC.4 and C-24/DEC.5 of 27 November 2019 \nadopted by the Conference of the States Parties at its twenty-fourth session, \nintroducing changes to schedules 1 (A) and 1, respectively, of the Annex on \nChemicals to the Convention, \n \nRe-emphasizing its unequivocal support for the decision of the Director General \nof the Organisation for the Prohibition of Chemical Weapons to continue the mission \nto establish the facts surrounding the allegations of the use of chemical weapons, \n__________________ \n \n1 United Nations, Treaty Series, vol. 1974, No. 33757. \n\nA/RES/79/56 \nImplementation of the Convention on the Prohibition of the \nDevelopment, Production, Stockpiling and Use of Chemical \nWeapons and on Their Destruction\n \n24-23081\n2/8 \n \nincluding toxic chemicals, for hostile purposes in the Syrian Arab Republic, while \nstressing that the safety and security of mission personnel remains the top priority, \nand recalling the work, pursuant to Security Council resolutions 2235 (2015) of \n7 August 2015 and 2319 (2016) of 17 November 2016, of the Joint Investigative \nMechanism of the Organisation for the Prohibition of Chemical Weapons and the \nUnited Nations, \n \nRecalling the work related to the Fourth Special Session of the Conference of \nthe States Parties to Review the Operation of the Chemical Weapons Convention, held \nin The Hague from 21 to 30 November 2018, \n \nRecalling also the work related to the Fifth Special Session of the Conference \nof the States Parties to Review the Operation of the Chemical Weapons Convention, \nheld in The Hague from 15 to 19 May 2023, \n \nReaffirming the importance of the outcome of the Third Special Session of the \nConference of the States Parties to Review the Operation of the Chemical Weapons \nConvention, held in The Hague from 8 to 19 April 2013 (the Third Review \nConference), including its consensus final report, in which the Conference addressed \nall aspects of the Convention and made important recommendations on its continued \nimplementation, \n \nEmphasizing that the Third Review Conference welcomed the fact that the \nConvention is a unique multilateral agreement banning an entire category of weapons \nof mass destruction in a non-discriminatory and verifiable manner under strict and \neffective international control and noted with satisfaction that the Convention \ncontinues to be a remarkable success and an example of effective multilateralism, \n \nConvinced that the Convention, 27 years after its entry into force, has reinforced \nits role as the international norm against chemical weapons, and that it constitutes a \nmajor contribution to: \n \n(a) \nInternational peace and security, \n \n(b) \nEliminating chemical weapons and preventing their re-emergence, \n \n(c) \nThe ultimate objective of general and complete disarmament under strict \nand effective international control, \n \n(d) \nExcluding completely, for the sake of all mankind, the possibility of the \nuse of chemical weapons, \n \n(e) \nPromoting international cooperation and exchange in scientific and \ntechnical information in the field of chemical activities among States parties for \npeaceful purposes in order to enhance the economic and technological development \nof all States parties, \n \nNoting the efforts to ensure the effectiveness of the Organisation for the \nProhibition of Chemical Weapons and its business continuity in all circumstances, \ndrawing lessons from the impact of the coronavirus disease (COVID-19) pandemic, \n \n1. \nReaffirms its condemnation in the strongest possible terms of the use of \nchemical weapons by anyone under any circumstances, emphasizing that any use of \nchemical weapons anywhere, at any time, by anyone, under any circumstances is \nunacceptable and is and would be a violation of international law and expressing its \nstrong conviction that those individuals responsible for the use of chemical weapons \nmust and should be held accountable; \n \n2. \nRecalls that article I, paragraph 5, of the Convention on the Prohibition of \nthe Development, Production, Stockpiling and Use of Chemical Weapons and on \nTheir Destruction provides that each State party undertakes not to use riot control \n\nImplementation of the Convention on the Prohibition of the \nDevelopment, Production, Stockpiling and Use of Chemical \nWeapons and on Their Destruction \nA/RES/79/56\n \n3/8\n24-23081 \n \nagents as a method of warfare, and in this context expresses grave concern about \nallegations of their use by the Russian Federation in its war of aggression against \nUkraine and urges the Organisation for the Prohibition of Chemical Weapons to \ncontinue to closely monitor the situation and be ready to investigate the matter as \nappropriate, notes the requests for clarification on this issue submitted under \narticle IX of the Convention and subsequent discussions in the Executive Council of \nthe Organisation for the Prohibition of Chemical Weapons, and recalls the technical \nassistance provided to Ukraine by the Technical Secretariat of the Organisation; \n \n3. \nCondemns in the strongest possible terms the use of a toxic chemical as a \nweapon against Alexei Navalny in the Russian Federation, notes with grave concern \nthe note by the Technical Secretariat of the Organisation for the Prohibition of \nChemical Weapons of 6 October 2020 on the summary of the report on activities \ncarried out in support of a request for technical assistance by Germany, 2  and \nunderlines the need for a full and transparent investigation and that those responsible \nfor the use of chemical weapons against Alexei Navalny must be held accountable;  \n \n4. \nAlso condemns in the strongest possible terms that chemical weapons have \nsince 2012 been used in Iraq, Malaysia, the Syrian Arab Republic and the United \nKingdom of Great Britain and Northern Ireland, including as reported by the Joint \nInvestigative Mechanism of the Organisation for the Prohibition of Chemical \nWeapons and the United Nations and by the Investigation and Identification Team of \nthe Organisation for the Prohibition of Chemical Weapons in: \n \n(a) \nThe reports of the Joint Investigative Mechanism of 24 August 2016 3 and \n21 October 2016,4 which concluded that there was sufficient information to determine \nthat the Syrian Arab Armed Forces were responsible for the attacks which released \ntoxic substances in Talmenes, Syrian Arab Republic, on 21 April 2014, in Sarmin, \nSyrian Arab Republic, on 16 March 2015, and in Qmenas, Syrian Arab Republic, also \non 16 March 2015, and that the so-called \u201cIslamic State in Iraq and the Levant\u201d used \nsulfur mustard in Marea, Syrian Arab Republic, on 21 August 2015; \n \n(b) \nThe report of the Joint Investigative Mechanism of 26 October 2017, 5 \nwhich concluded that there was sufficient information to be confident that Islamic \nState in Iraq and the Levant was responsible for the use of sulfur mustard at Umm \nHawsh on 15 and 16 September 2016 and that the Syrian Arab Republic was \nresponsible for the release of sarin at Khan Shaykhun on 4 April 2017; \n \n(c) \nThe first report of the Investigation and Identification Team, of 8 April \n2020,6 which concluded that there were reasonable grounds to believe that the Syrian \nArab Air Force used chemical weapons in Ltamenah on 24, 25 and 30 March 2017; \n \n(d) \nThe second report of the Investigation and Identification Team, of 12 April \n2021,7 which concluded that there were reasonable grounds to believe that a military \nhelicopter of the Syrian Arab Air Force carried out a chemical weapons attack on \nSaraqib on 4 February 2018;  \n \n(e) \nThe third report of the Investigation and Identification Team, of 27 January \n2023,8 which concluded that there were reasonable grounds to believe that the Syrian \n__________________ \n \n2 S/1906/2020. \n \n3 See S/2016/738/Rev.1. \n \n4 See S/2016/888. \n \n5 See S/2017/904, annex. \n \n6 See S/2020/310, annex. \n \n7 See S/2021/371, annex. \n \n8 See S/2023/81, annex. \n\nA/RES/79/56 \nImplementation of the Convention on the Prohibition of the \nDevelopment, Production, Stockpiling and Use of Chemical \nWeapons and on Their Destruction\n \n24-23081\n4/8 \n \nArab Air Force carried out a chemical weapons attack on 7 April 2018 in Duma, \nSyrian Arab Republic;  \n \n(f) \nThe fourth report of the Investigation and Identification Team, of \n22 February 2024,9 which concluded that there were reasonable grounds to believe \nthat units of Islamic State in Iraq and the Levant used chemical weapons during \nattacks on 1 September 2015 in Marea, Syrian Arab Republic; \nand demands that the perpetrators be held accountable;  \n \n5. \nTakes note with great concern in that regard of the reports of the fact-\nfinding mission of the Organisation for the Prohibition of Chemical Weapons \nregarding alleged incidents in Ltamenah, 10  Saraqib 11  and Duma, 12  Syrian Arab \nRepublic, as well as reports regarding the alleged incidents in Marea 13 and Kafr \nZayta,14 Syrian Arab Republic, which concluded there were reasonable grounds to \nbelieve that a toxic chemical or a vesicant chemical substance from 1.A.04 scheduled \nchemicals under the Convention had been used as a weapon; \n \n6. \nTakes note of the report of the fact-finding mission of the Organisation for \nthe Prohibition of Chemical Weapons of 28 June 2023, 15  which concluded that \ninformation obtained and analysed by the fact-finding mission did not provide \nreasonable grounds to determine that chemicals were used as a weapon in the reported \nincidents that occurred in Kharbit Massasneh, Syrian Arab Republic, on 7 July and \n4 August 2017; \n \n7. \nAlso takes note of the report of the fact-finding mission of the Organisation \nfor the Prohibition of Chemical Weapons of 22 February 2024, 16 which concluded \nthat information obtained and analysed by the fact-finding mission did not provide \nreasonable grounds to determine that toxic chemicals were used as a weapon in the \nreported incident that occurred in Al-Yarmouk, Syrian Arab Republic, on 22 October \n2017; \n \n8. \nFurther takes note of the report of the fact-finding mission of the \nOrganisation for the Prohibition of Chemical Weapons of 11 June 2024, 17 which \nconcluded that information obtained and analysed by the fact-finding mission did not \nprovide reasonable grounds to determine that toxic chemicals were used as a weapon \nin the reported incidents that occurred on 9 August 2017 in Qalib al-Thawr and on \n8 November 2017 in al-Balil, Syrian Arab Republic; \n \n9. \nRecalls the adoption of: \n \n(a) \nDecision C-SS-4/DEC.3 of the Fourth Special Session of the Conference \nof the States Parties, entitled \u201cAddressing the threat from chemical weapons use\u201d, of \n27 June 2018; \n \n(b) \nDecision EC-94/DEC.2 of the Executive Council, entitled \u201cAddressing the \npossession and use of chemical weapons by the Syrian Arab Republic\u201d, of 9 July \n2020; \n__________________ \n \n9 See S/2024/200, annex. \n \n10 See S/2017/931, annex, and S/2018/620, annex. \n \n11 See S/2018/478, annex. \n \n12 See S/2019/208, annex. \n \n13 See S/2022/85, annex. \n \n14 See S/2022/116, annex. \n \n15 See S/2023/508, annex. \n \n16 See S/2024/214, annex. \n \n17 See S/2024/486, annex. \n\nImplementation of the Convention on the Prohibition of the \nDevelopment, Production, Stockpiling and Use of Chemical \nWeapons and on Their Destruction \nA/RES/79/56\n \n5/8\n24-23081 \n \n \n(c) \nDecision C-25/DEC.9 of the Conference of the States Parties, entitled \n\u201cAddressing the possession and use of chemical weapons by the Syrian Arab \nRepublic\u201d, of 21 April 2021; \n \n(d) \nDecision C-28/DEC.12 of the Conference of the States Parties, entitled \n\u201cAddressing the threat from chemical weapons use and the threat of future use\u201d, of \n30 November 2023; \nand stresses the importance of their implementation, in accordance with the \nConvention, and, accordingly, expresses concern with the conclusions contained in \nthe report of the Director General of the Organisation for the Prohibition of Chemical \nWeapons of 14 October 2020 on the implementation of decision EC-94/DEC.2;18 \n \n10. Also recalls decision C-26/DEC.10 of the Conference of the States Parties, \nentitled \u201cUnderstanding regarding the aerosolised use of central nervous system-\nacting chemicals for law enforcement purposes\u201d, of 1 December 2021; \n \n11. \nEmphasizes that the universality of the Convention is essential to \nachieving its object and purpose and to enhancing the security of States parties, as \nwell as to international peace and security, underlines the fact that the objectives of \nthe Convention will not be fully realized as long as there remains even a single State \nnot party to the Convention that could possess or acquire such weapons, calls upon \nall States that have not yet done so to become parties to the Convention without delay, \nand in this regard recalls the outcome of the Third Special Session of the Conference \nof the States Parties to Review the Operation of the Chemical Weapons Convention \n(the Third Review Conference); \n \n12. Underlines the fact that the full, effective and non-discriminatory \nimplementation of all articles of the Convention makes a major contribution to \ninternational peace and security through the elimination of existing stockpiles of \nchemical weapons and the prohibition of their acquisition and use, and provides for \nassistance and protection in the event of use or threat of use of chemical weapons and \nfor international cooperation for peaceful purposes in the field of chemical activities; \n \n13. Notes the impact of scientific and technological progress, including \nchallenges and opportunities arising from the rapid development of artificial \nintelligence, on the effective implementation of the Convention and the importance \nfor the Organisation for the Prohibition of Chemical Weapons and its policymaking \norgans of taking due account of such developments; \n \n14. Reaffirms that the obligation of the States parties to complete the \ndestruction of chemical weapons stockpiles and the destruction or conversion of \nchemical weapons production facilities in accordance with the provisions of the \nConvention and the Annex on Implementation and Verification (Verification Annex) \nand under the verification of the Technical Secretariat of the Organisation for the \nProhibition of Chemical Weapons is essential for the realization of the object and \npurpose of the Convention; \n \n15. Stresses the importance to the Convention that all possessors of chemical \nweapons, chemical weapons production facilities or chemical weapons development \nfacilities, including previously declared possessor States, should be among the States \nparties to the Convention, and welcomes progress to that end; \n \n16. Recalls that the Third Review Conference expressed concern regarding the \nstatement made by the Director General of the Organisation for the Prohibition of \nChemical Weapons in his report to the Executive Council of the Organisation at its \nsixty-eighth session, provided in accordance with paragraph 2 of decision C-16/DEC.11 \n__________________ \n \n18 EC-96/DG.1. \n\nA/RES/79/56 \nImplementation of the Convention on the Prohibition of the \nDevelopment, Production, Stockpiling and Use of Chemical \nWeapons and on Their Destruction\n \n24-23081\n6/8 \n \nof 1 December 2011 adopted by the Conference of the States Parties at its sixteenth \nsession, that three possessor States parties, namely, Libya, the Russian Federation and \nthe United States of America, had been unable to fully meet the final extended \ndeadline of 29 April 2012 for the destruction of their chemical weapons stockpiles, \nand also expressed determination that the destruction of all categories of chemical \nweapons should be completed in the shortest time possible in accordance with the \nprovisions of the Convention and the Verification Annex, and with the full application \nof the relevant decisions that have been taken; \n \n17. Welcomes the confirmation by the Director General of the Organisation for \nthe Prohibition of Chemical Weapons expressed in his report of 5 October 2017, 19 \nbased upon information received from the Russian Federation and independent \ninformation received from the inspectors of the Organisation, regarding the \ncompletion of the full destruction of chemical weapons declared by the Russian \nFederation; \n \n18. Also welcomes the completed destruction of Libya\u2019s remaining category 2 \nchemical weapons, as reported by the Director General of the Organisation for the \nProhibition of Chemical Weapons in his report of 22 December 2017, 20 as well as the \ncompleted destruction by Iraq of its entire declared stockpile of chemical weapons \nremnants, as reported by the Director General in his report of 28 February 2018; 21 \n \n19. Further welcomes the confirmation by the Organisation for the Prohibition \nof Chemical Weapons that the last chemical munition of the declared chemical \nweapons stockpile of the United States of America was irreversibly destroyed in \naccordance with the Convention on 7 July 2023; \n \n20. Underlines that the end of destruction of all declared chemical weapons \nstockpiles is an important milestone for the Organisation for the Prohibition of \nChemical Weapons and a critical step towards achieving its mission to permanently \neliminate all chemical weapons; \n \n21. Notes with concern that, along with the threat of the possible production, \nacquisition and use of chemical weapons by States, the international community also \nfaces the danger of the production, acquisition and use of chemical weapons by \nnon-State actors, including terrorists, concerns which have highlighted the necessity \nof achieving universal adherence to the Convention, as well as the high level of \nreadiness of the Organisation for the Prohibition of Chemical Weapons, and stresses \nthat the full and effective implementation of all provisions of the Convention, \nincluding those on national implementation (article VII) and assistance and protection \n(article X), constitutes an important contribution to the efforts of the United Nations \nin the global fight against terrorism in all its forms and manifestations; \n \n22. Notes that the effective application of the verification system builds \nconfidence in compliance with the Convention by States parties; \n \n23. Stresses the importance of the Organisation for the Prohibition of \nChemical Weapons in verifying compliance with the provisions of the Convention as \nwell as in promoting the timely and efficient accomplishment of all its objectives; \n \n24. Expresses grave concern that, despite the verified destruction of all 27 \nchemical weapons production facilities declared by the Syrian Arab Republic, the \nTechnical Secretariat, as recently reported by the Director General in his report of \n24 September 2024, 22  assesses that the Syrian Arab Republic has submitted a \n__________________ \n \n19 EC-86/DG.31. \n \n20 EC-87/DG.6. \n \n21 EC-87/DG.18. \n \n22 EC-107/DG.20. \n\nImplementation of the Convention on the Prohibition of the \nDevelopment, Production, Stockpiling and Use of Chemical \nWeapons and on Their Destruction \nA/RES/79/56\n \n7/8\n24-23081 \n \ndeclaration that still cannot be considered accurate and complete in accordance with \nthe Convention, Executive Council decisions EC-M-33/DEC.1 and EC-94/DEC.2 and \nSecurity Council resolution 2118 (2013), as well as with the conclusion of decision \nC-SS-4/DEC.3, of the Fourth Review Conference, that the Syrian Arab Republic \nfailed to declare and destroy all of its chemical weapons and chemical weapons \nproduction facilities, and underscores the importance of such full verification; \n \n25. Urges all States parties to the Convention to meet in full and on time their \nobligations under the Convention and to support the Organisation for the Prohibition \nof Chemical Weapons in its implementation activities; \n \n26. Welcomes the progress made in the national implementation of article VII \nobligations, commends the States parties and the Technical Secretariat for assisting \nother States parties, on request, with the implementation of the follow-up to the plan \nof action regarding article VII obligations, urges States parties that have not fulfilled \ntheir obligations under article VII to do so without further delay, in accordance with \ntheir constitutional processes, and in this context reaffirms that full, effective and \nnon-discriminatory implementation of article VII is essential for the realization of the \nobject and purpose of the Convention; \n \n27. Emphasizes the continuing relevance and importance of the provisions of \narticle X of the Convention, welcomes the activities of the Organisation for the \nProhibition of Chemical Weapons in relation to assistance and protection against \nchemical weapons, supports further efforts by both States parties and the Technical \nSecretariat to promote a high level of readiness to respond to chemical weapons \nthreats as articulated in article X, and welcomes the effectiveness and efficiency of \nthe increased focus on making full use of regional and subregional capacities and \nexpertise, including taking advantage of established training centres; \n \n28. Reaffirms that the provisions of the Convention shall be implemented in a \nmanner that avoids hampering the economic or technological development of States \nparties and international cooperation in the field of chemical activities for purposes \nnot prohibited under the Convention, including the international exchange of \nscientific and technical information, and chemicals and equipment for the production, \nprocessing or use of chemicals for purposes not prohibited under the Convention; \n \n29. Emphasizes the importance of the provisions of article XI of the \nConvention relating to the economic and technological development of States parties, \nrecalls that the full, effective and non-discriminatory implementation of those \nprovisions contributes to universality, and reaffirms the undertaking of the States \nparties to foster international cooperation for peaceful purposes in the field of \nchemical activities of the States parties and the importance of that cooperation and its \ncontribution to the promotion of the Convention as a whole; \n \n30. Notes with appreciation the ongoing work of the Organisation for the \nProhibition of Chemical Weapons to achieve the object and purpose of the \nConvention, to ensure the full implementation of its provisions, including those for \ninternational verification of compliance with it, and to provide a forum for \nconsultation and cooperation among States parties; \n \n31. Regrets that, despite the constructive engagement of most of the States \nparties in the preparatory process leading to the Fifth Special Session of the \nConference of the States Parties to Review the Operation of the Chemical Weapons \nConvention, it was not possible to adopt a final document, notwithstanding the fact \nthat the majority of subjects covered at the Fifth Review Conference received very \nbroad support and that a wide range of delegations undertook efforts towards a \nconsensual outcome; \n\nA/RES/79/56 \nImplementation of the Convention on the Prohibition of the \nDevelopment, Production, Stockpiling and Use of Chemical \nWeapons and on Their Destruction\n \n24-23081\n8/8 \n \n \n32. Welcomes the opening of the Centre for Chemistry and Technology, which \nstrengthens the capabilities of the Organisation for the Prohibition of Chemical \nWeapons and its member States to implement the Convention, uphold the global norm \nagainst chemical weapons, address threats and opportunities arising from rapid \nprogress in science and technology in the evolving global security landscape and \nsupport international cooperation;  \n \n33. Takes note of decision EC-102/DEC.6 of the Executive Council, entitled \n\u201cAllowing the convening of Executive Council meetings or sessions in extraordinary \ncircumstances\u201d, of 16 March 2023; \n \n34. Welcomes the cooperation between the United Nations and the \nOrganisation for the Prohibition of Chemical Weapons within the framework of the \nrelationship agreement between the United Nations and the Organisation, 23  in \naccordance with the provisions of the Convention; \n \n35. Decides to include in the provisional agenda of its eightieth session, under \nthe item entitled \u201cGeneral and complete disarmament\u201d, the sub-item entitled \n\u201cImplementation of the Convention on the Prohibition of the Development, \nProduction, Stockpiling and Use of Chemical Weapons and on Their Destruction\u201d.  \n \n43rd plenary meeting \n2 December 2024 \n \n__________________ \n \n23 United Nations, Treaty Series, vol. 2160, No. 1240. \n",
  "paragraphs": {
    "1": "Reaffirms its condemnation in the strongest possible terms of the use of chemical weapons by anyone under any circumstances, emphasizing that any use of chemical weapons anywhere, at any time, by anyone, under any circumstances is unacceptable and is and would be a violation of international law and expressing its strong conviction that those individuals responsible for the use of chemical weapons must and should be held accountable;",
    "2": " agents as a method of warfare, and in this context expresses grave concern about allegations of their use by the Russian Federation in its war of aggression against Ukraine and urges the Organisation for the Prohibition of Chemical Weapons to continue to closely monitor the situation and be ready to investigate the matter as appropriate, notes the requests for clarification on this issue submitted under article IX of the Convention and subsequent discussions in the Executive Council of the Organisation for the Prohibition of Chemical Weapons, and recalls the technical assistance provided to Ukraine by the Technical Secretariat of the Organisation;",
    "3": "Condemns in the strongest possible terms the use of a toxic chemical as a weapon against Alexei Navalny in the Russian Federation, notes with grave concern the note by the Technical Secretariat of the Organisation for the Prohibition of Chemical Weapons of 6 October 2020 on the summary of the report on activities carried out in support of a request for technical assistance by Germany, 2 and underlines the need for a full and transparent investigation and that those responsible for the use of chemical weapons against Alexei Navalny must be held accountable;",
    "4": "Also condemns in the strongest possible terms that chemical weapons have since 2012 been used in Iraq, Malaysia, the Syrian Arab Republic and the United Kingdom of Great Britain and Northern Ireland, including as reported by the Joint Investigative Mechanism of the Organisation for the Prohibition of Chemical Weapons and the United Nations and by the Investigation and Identification Team of the Organisation for the Prohibition of Chemical Weapons in: (a) The reports of the Joint Investigative Mechanism of 24 August 2016 3 and 21 October 2016,4 which concluded that there was sufficient information to determine that the Syrian Arab Armed Forces were responsible for the attacks which released toxic substances in Talmenes, Syrian Arab Republic, on 21 April 2014, in Sarmin, Syrian Arab Republic, on 16 March 2015, and in Qmenas, Syrian Arab Republic, also on 16 March 2015, and that the so-called \u201cIslamic State in Iraq and the Levant\u201d used sulfur mustard in Marea, Syrian Arab Republic, on 21 August 2015; (b) The report of the Joint Investigative Mechanism of 26 October 2017, 5 which concluded that there was sufficient information to be confident that Islamic State in Iraq and the Levant was responsible for the use of sulfur mustard at Umm Hawsh on 15 and 16 September 2016 and that the Syrian Arab Republic was responsible for the release of sarin at Khan Shaykhun on 4 April 2017; (c) The first report of the Investigation and Identification Team, of 8 April 2020,6 which concluded that there were reasonable grounds to believe that the Syrian Arab Air Force used chemical weapons in Ltamenah on 24, 25 and 30 March 2017; (d) The second report of the Investigation and Identification Team, of 12 April 2021,7 which concluded that there were reasonable grounds to believe that a military helicopter of the Syrian Arab Air Force carried out a chemical weapons attack on Saraqib on 4 February 2018; (e) The third report of the Investigation and Identification Team, of 27 January 2023,8 which concluded that there were reasonable grounds to believe that the Syrian Arab Air Force carried out a chemical weapons attack on 7 April 2018 in Duma, Syrian Arab Republic; (f) The fourth report of the Investigation and Identification Team, of 22 February 2024,9 which concluded that there were reasonable grounds to believe that units of Islamic State in Iraq and the Levant used chemical weapons during attacks on 1 September 2015 in Marea, Syrian Arab Republic; and demands that the perpetrators be held accountable;",
    "5": "Takes note with great concern in that regard of the reports of the fact- finding mission of the Organisation for the Prohibition of Chemical Weapons regarding alleged incidents in Ltamenah, 10 Saraqib 11 and Duma, 12 Syrian Arab Republic, as well as reports regarding the alleged incidents in Marea 13 and Kafr Zayta,14 Syrian Arab Republic, which concluded there were reasonable grounds to believe that a toxic chemical or a vesicant chemical substance from 1.A.04 scheduled chemicals under the Convention had been used as a weapon;",
    "6": "Takes note of the report of the fact-finding mission of the Organisation for the Prohibition of Chemical Weapons of 28 June 2023, 15 which concluded that information obtained and analysed by the fact-finding mission did not provide reasonable grounds to determine that chemicals were used as a weapon in the reported incidents that occurred in Kharbit Massasneh, Syrian Arab Republic, on 7 July and 4 August 2017;",
    "7": "Also takes note of the report of the fact-finding mission of the Organisation for the Prohibition of Chemical Weapons of 22 February 2024, 16 which concluded that information obtained and analysed by the fact-finding mission did not provide reasonable grounds to determine that toxic chemicals were used as a weapon in the reported incident that occurred in Al-Yarmouk, Syrian Arab Republic, on 22 October 2017;",
    "8": "Further takes note of the report of the fact-finding mission of the Organisation for the Prohibition of Chemical Weapons of 11 June 2024, 17 which concluded that information obtained and analysed by the fact-finding mission did not provide reasonable grounds to determine that toxic chemicals were used as a weapon in the reported incidents that occurred on 9 August 2017 in Qalib al-Thawr and on 8 November 2017 in al-Balil, Syrian Arab Republic;",
    "9": "Recalls the adoption of: (a) Decision C-SS-4/DEC.3 of the Fourth Special Session of the Conference of the States Parties, entitled \u201cAddressing the threat from chemical weapons use\u201d, of 27 June 2018; (b) Decision EC-94/DEC.2 of the Executive Council, entitled \u201cAddressing the possession and use of chemical weapons by the Syrian Arab Republic\u201d, of 9 July 2020; (c) Decision C-25/DEC.9 of the Conference of the States Parties, entitled \u201cAddressing the possession and use of chemical weapons by the Syrian Arab Republic\u201d, of 21 April 2021; (d) Decision C-28/DEC.12 of the Conference of the States Parties, entitled \u201cAddressing the threat from chemical weapons use and the threat of future use\u201d, of 30 November 2023; and stresses the importance of their implementation, in accordance with the Convention, and, accordingly, expresses concern with the conclusions contained in the report of the Director General of the Organisation for the Prohibition of Chemical Weapons of 14 October 2020 on the implementation of decision EC-94/DEC.2;18",
    "10": "Also recalls decision C-26/DEC.10 of the Conference of the States Parties, entitled \u201cUnderstanding regarding the aerosolised use of central nervous system- acting chemicals for law enforcement purposes\u201d, of 1 December 2021;",
    "11": "Emphasizes that the universality of the Convention is essential to achieving its object and purpose and to enhancing the security of States parties, as well as to international peace and security, underlines the fact that the objectives of the Convention will not be fully realized as long as there remains even a single State not party to the Convention that could possess or acquire such weapons, calls upon all States that have not yet done so to become parties to the Convention without delay, and in this regard recalls the outcome of the Third Special Session of the Conference of the States Parties to Review the Operation of the Chemical Weapons Convention (the Third Review Conference);",
    "12": "Underlines the fact that the full, effective and non-discriminatory implementation of all articles of the Convention makes a major contribution to international peace and security through the elimination of existing stockpiles of chemical weapons and the prohibition of their acquisition and use, and provides for assistance and protection in the event of use or threat of use of chemical weapons and for international cooperation for peaceful purposes in the field of chemical activities;",
    "13": "Notes the impact of scientific and technological progress, including challenges and opportunities arising from the rapid development of artificial intelligence, on the effective implementation of the Convention and the importance for the Organisation for the Prohibition of Chemical Weapons and its policymaking organs of taking due account of such developments;",
    "14": "Reaffirms that the obligation of the States parties to complete the destruction of chemical weapons stockpiles and the destruction or conversion of chemical weapons production facilities in accordance with the provisions of the Convention and the Annex on Implementation and Verification (Verification Annex) and under the verification of the Technical Secretariat of the Organisation for the Prohibition of Chemical Weapons is essential for the realization of the object and purpose of the Convention;",
    "15": "Stresses the importance to the Convention that all possessors of chemical weapons, chemical weapons production facilities or chemical weapons development facilities, including previously declared possessor States, should be among the States parties to the Convention, and welcomes progress to that end;",
    "16": "Recalls that the Third Review Conference expressed concern regarding the statement made by the Director General of the Organisation for the Prohibition of Chemical Weapons in his report to the Executive Council of the Organisation at its sixty-eighth session, provided in accordance with paragraph 2 of decision C-16/DEC.11 of 1 December 2011 adopted by the Conference of the States Parties at its sixteenth session, that three possessor States parties, namely, Libya, the Russian Federation and the United States of America, had been unable to fully meet the final extended deadline of 29 April 2012 for the destruction of their chemical weapons stockpiles, and also expressed determination that the destruction of all categories of chemical weapons should be completed in the shortest time possible in accordance with the provisions of the Convention and the Verification Annex, and with the full application of the relevant decisions that have been taken;",
    "17": "Welcomes the confirmation by the Director General of the Organisation for the Prohibition of Chemical Weapons expressed in his report of 5 October 2017, 19 based upon information received from the Russian Federation and independent information received from the inspectors of the Organisation, regarding the completion of the full destruction of chemical weapons declared by the Russian Federation;",
    "18": "Also welcomes the completed destruction of Libya\u2019s remaining category 2 chemical weapons, as reported by the Director General of the Organisation for the Prohibition of Chemical Weapons in his report of 22 December 2017, 20 as well as the completed destruction by Iraq of its entire declared stockpile of chemical weapons remnants, as reported by the Director General in his report of 28 February 2018; 21",
    "19": "Further welcomes the confirmation by the Organisation for the Prohibition of Chemical Weapons that the last chemical munition of the declared chemical weapons stockpile of the United States of America was irreversibly destroyed in accordance with the Convention on 7 July 2023;",
    "20": "Underlines that the end of destruction of all declared chemical weapons stockpiles is an important milestone for the Organisation for the Prohibition of Chemical Weapons and a critical step towards achieving its mission to permanently eliminate all chemical weapons;",
    "21": "Notes with concern that, along with the threat of the possible production, acquisition and use of chemical weapons by States, the international community also faces the danger of the production, acquisition and use of chemical weapons by non-State actors, including terrorists, concerns which have highlighted the necessity of achieving universal adherence to the Convention, as well as the high level of readiness of the Organisation for the Prohibition of Chemical Weapons, and stresses that the full and effective implementation of all provisions of the Convention, including those on national implementation (article VII) and assistance and protection (article X), constitutes an important contribution to the efforts of the United Nations in the global fight against terrorism in all its forms and manifestations;",
    "22": "Notes that the effective application of the verification system builds confidence in compliance with the Convention by States parties;",
    "23": "Stresses the importance of the Organisation for the Prohibition of Chemical Weapons in verifying compliance with the provisions of the Convention as well as in promoting the timely and efficient accomplishment of all its objectives;",
    "24": "Expresses grave concern that, despite the verified destruction of all 27 chemical weapons production facilities declared by the Syrian Arab Republic, the Technical Secretariat, as recently reported by the Director General in his report of 24 September 2024, 22 assesses that the Syrian Arab Republic has submitted a declaration that still cannot be considered accurate and complete in accordance with the Convention, Executive Council decisions EC-M-33/DEC.1 and EC-94/DEC.2 and Security Council resolution 2118 (2013), as well as with the conclusion of decision C-SS-4/DEC.3, of the Fourth Review Conference, that the Syrian Arab Republic failed to declare and destroy all of its chemical weapons and chemical weapons production facilities, and underscores the importance of such full verification;",
    "25": "Urges all States parties to the Convention to meet in full and on time their obligations under the Convention and to support the Organisation for the Prohibition of Chemical Weapons in its implementation activities;",
    "26": "Welcomes the progress made in the national implementation of article VII obligations, commends the States parties and the Technical Secretariat for assisting other States parties, on request, with the implementation of the follow-up to the plan of action regarding article VII obligations, urges States parties that have not fulfilled their obligations under article VII to do so without further delay, in accordance with their constitutional processes, and in this context reaffirms that full, effective and non-discriminatory implementation of article VII is essential for the realization of the object and purpose of the Convention;",
    "27": "Emphasizes the continuing relevance and importance of the provisions of article X of the Convention, welcomes the activities of the Organisation for the Prohibition of Chemical Weapons in relation to assistance and protection against chemical weapons, supports further efforts by both States parties and the Technical Secretariat to promote a high level of readiness to respond to chemical weapons threats as articulated in article X, and welcomes the effectiveness and efficiency of the increased focus on making full use of regional and subregional capacities and expertise, including taking advantage of established training centres;",
    "28": "Reaffirms that the provisions of the Convention shall be implemented in a manner that avoids hampering the economic or technological development of States parties and international cooperation in the field of chemical activities for purposes not prohibited under the Convention, including the international exchange of scientific and technical information, and chemicals and equipment for the production, processing or use of chemicals for purposes not prohibited under the Convention;",
    "29": "Emphasizes the importance of the provisions of article XI of the Convention relating to the economic and technological development of States parties, recalls that the full, effective and non-discriminatory implementation of those provisions contributes to universality, and reaffirms the undertaking of the States parties to foster international cooperation for peaceful purposes in the field of chemical activities of the States parties and the importance of that cooperation and its contribution to the promotion of the Convention as a whole;",
    "30": "Notes with appreciation the ongoing work of the Organisation for the Prohibition of Chemical Weapons to achieve the object and purpose of the Convention, to ensure the full implementation of its provisions, including those for international verification of compliance with it, and to provide a forum for consultation and cooperation among States parties;",
    "31": "",
    "32": "Welcomes the opening of the Centre for Chemistry and Technology, which strengthens the capabilities of the Organisation for the Prohibition of Chemical Weapons and its member States to implement the Convention, uphold the global norm against chemical weapons, address threats and opportunities arising from rapid progress in science and technology in the evolving global security landscape and support international cooperation;",
    "33": "Takes note of decision EC-102/DEC.6 of the Executive Council, entitled \u201cAllowing the convening of Executive Council meetings or sessions in extraordinary circumstances\u201d, of 16 March 2023;",
    "34": "Welcomes the cooperation between the United Nations and the Organisation for the Prohibition of Chemical Weapons within the framework of the relationship agreement between the United Nations and the Organisation, 23 in accordance with the provisions of the Convention;",
    "35": "Decides to include in the provisional agenda of its eightieth session, under the item entitled \u201cGeneral and complete disarmament\u201d, the sub-item entitled \u201cImplementation of the Convention on the Prohibition of the Development, Production, Stockpiling and Use of Chemical Weapons and on Their Destruction\u201d."
  },
  "agenda_items": [
    "Item 98"
  ],
  "symbol_references": []
}