{
  "symbol": "A/RES/73/225",
  "filename": "A_RES_73_225.pdf",
  "title": "73/225.  Entrepreneurship for sustainable development",
  "text": "United Nations \nA/RES/73/225\n \n \nGeneral Assembly \nDistr.: General \n15 January 2019 \n \n18-22548 (E)    170119     \n*1822548* \n \n \nSeventy-third session \nAgenda item 20 \n \n \n \n \n Resolution adopted by the General Assembly \non 20 December 2018 \n \n \n \n \n[on the report of the Second Committee (A/73/538)] \n \n \n 73/225.  Entrepreneurship for sustainable development  \n \n \n \nThe General Assembly,  \n \nRecalling its resolutions 67/202 of 21 December 2012, 69/210 of 19 December \n2014 and 71/221 of 21 December 2016,  \n \nReaffirming its resolution 70/1 of 25 September 2015, entitled \u201cTransforming \nour world: the 2030 Agenda for Sustainable Development\u201d, in which it adopted a \ncomprehensive, far-reaching and people-centred set of universal and transformative \nSustainable Development Goals and targets, its commitment to working tirelessly for \nthe full implementation of the Agenda by 2030, its recognition that eradicating \npoverty in all its forms and dimensions, including extreme poverty, is the greatest \nglobal challenge and an indispensable requirement for sustainable development, its \ncommitment to achieving sustainable development in its three dimensions \u2014 \neconomic, social and environmental \u2014 in a balanced and integrated manner, and to \nbuilding upon the achievements of the Millennium Development Goals and seeking \nto address their unfinished business,  \n \nReaffirming also its resolution 70/299 of 29 July 2016 on the follow-up and \nreview of the 2030 Agenda for Sustainable Development at the global level,  \n \nReiterating the pledge that no one will be left behind, reaffirming the \nrecognition that the dignity of the human person is fundamental and the wish to see \nthe Sustainable Development Goals and targets met for all nations and peoples and \nfor all segments of society, and recommitting to endeavour to reach the furthest \nbehind first,  \n \nReaffirming its resolution 69/313 of 27 July 2015 on the Addis Ababa Action \nAgenda of the Third International Conference on Financing for Development, which \nis an integral part of the 2030 Agenda for Sustainable Development, supports and \ncomplements it, helps to contextualize its means of implementation targets with \nconcrete policies and actions, and reaffirms the strong political commitment to \n\nA/RES/73/225 \nEntrepreneurship for sustainable development\n \n18-22548\n2/9 \n \naddress the challenge of financing and creating an enabling environment at all levels \nfor sustainable development in the spirit of global partnership and solidarity,  \n \nWelcoming the Paris Agreement1 and its early entry into force, encouraging all \nits parties to fully implement the Agreement, and parties to the United Nations \nFramework Convention on Climate Change2 that have not yet done so to deposit their \ninstruments of ratification, acceptance, approval or accession, where appropriate, as \nsoon as possible,  \n \nRecalling the Sendai Declaration and the Sendai Framework for Disaster Risk \nReduction 2015\u20132030,3 and reaffirming that the Addis Ababa Action Agenda, among \nother things, seeks to develop and implement holistic disaster risk reduction \nmanagement at all levels in line with the Sendai Framework,  \n \nRecalling also relevant strategies and programmes of action, including the \nIstanbul Declaration and Programme of Action for the Least Developed Countries for \nthe Decade 2011\u20132020, 4  the SIDS Accelerated Modalities of Action (SAMOA) \nPathway,5 the Vienna Declaration and Vienna Programme of Action for Landlocked \nDeveloping Countries for the Decade 2014\u20132024,6 taking note of Agenda 2063 of the \nAfrican Union, and recognizing the importance of addressing the diverse needs and \nchallenges faced by countries in special situations, in particular African countries, the \nleast developed countries, landlocked developing countries and small island \ndeveloping States, as well as the specific challenges facing middle-income countries,  \n \nReaffirming the Beijing Declaration and Platform for Action,7 the Programme \nof Action of the International Conference on Population and Development 8 and the \noutcome documents of their review conferences,  \n \nAcknowledging that entrepreneurship and innovation are essential for \nharnessing the economic potential of each nation and the importance of supporting \nmass entrepreneurship, creativity and innovation, which create new momentum for \neconomic growth and job creation and expand opportunities for all, including women \nand youth, \n \nRecalling relevant agreed conclusions and resolutions adopted by the \nCommission on the Status of Women, including the agreed conclusions adopted at its \nsixty-first session, entitled \u201cWomen\u2019s economic empowerment in the changing world \nof work\u201d,9 and the agreed conclusions adopted at its sixty-second session, entitled \n\u201cChallenges and opportunities in achieving gender equality and the empowerment of \nrural women and girls\u201d,10 stressing that women and girls, particularly in developing \ncountries, are important drivers of entrepreneurship and sustainable development, \ncalling for measures to enable women to leverage science and technology for \nentrepreneurship and economic empowerment, and recognizing the importance of \n__________________ \n \n1  Adopted under the UNFCCC in FCCC/CP/2015/10/Add.1, decision 1/CP.21.  \n \n2  United Nations, Treaty Series, vol. 1771, No. 30822.  \n \n3  Resolution 69/283, annexes I and II.  \n \n4  Report of the Fourth United Nations Conference on the Least Developed Countries, Istanbul, \nTurkey, 9\u201313 May 2011 (A/CONF.219/7), chaps. I and II.  \n \n5  Resolution 69/15, annex.  \n \n6  Resolution 69/137, annexes I and II.  \n \n7  Report of the Fourth World Conference on Women, Beijing, 4\u201315 September 1995 (United \nNations publication, Sales No. E.96.IV.13), chap. I, resolution 1, annexes I and II.  \n \n8  Report of the International Conference on Population and Development, Cairo, 5\u201313 September \n1994 (United Nations publication, Sales No. E.95.XIII.18), chap. I, resolution 1, annex.  \n \n9  See Official Records of the Economic and Social Council, 2017, Supplement No. 7 (E/2017/27), \nchap. I, sect. A. \n \n10  Ibid., 2018, Supplement No. 7 (E/2018/27), chap. I, sect. A.  \n\nEntrepreneurship for sustainable development \nA/RES/73/225\n \n3/9\n18-22548 \n \npolicies and programmes that eliminate discrimination against women and provide \npublic infrastructure to ensure equal access for women and men entrepreneurs,  \n \nRecognizing that multi-stakeholder partnerships and the resources, knowledge \nand ingenuity of the private sector, civil society, the scientific community, academia, \nphilanthropy and foundations, parliaments, local authorities, volunteers and other \nstakeholders will be important in order to mobilize and access knowledge, expertise, \ntechnology and financial resources, complement the efforts of Governments and \ncontribute to the implementation of the outcomes of the United Nations conferences \nand summits, as well as support the achievement of the Sustainable Development \nGoals in all countries, including developing countries,  \n \nUnderlining the need to promote peaceful and inclusive societies for achieving \nsustainable development and to build effective, accountable and inclusive institutions \nat all levels, and reaffirming that good governance, the rule of law, human rights, \nfundamental freedoms, equal access to fair justice systems and measures to combat \ncorruption and curb illicit financial flows will be integral to those efforts,  \n \nEmphasizing the pivotal role of entrepreneurship in achieving sustainable \ndevelopment in its three dimensions, and emphasizing that achieving the Sustainable \nDevelopment Goals requires the talents, creativity and entrepreneurial vigour of the \nentire population,  \n \nWelcoming the United Nations Youth Strategy, launched by the Secretary-\nGeneral,  \n \nRecognizing that entrepreneurship drives economic growth by creating jobs, \npromoting decent work and sustainable agriculture, and fostering innovation,  \n \nRecognizing also that entrepreneurship can help to address environmental \nchallenges through the introduction of new climate change mitigation and adaptation \ntechnologies and resilience measures, as well as by promoting environmentally \nsustainable practices and consumption patterns,  \n \nRecognizing further the positive contribution entrepreneurship can make in \npromoting social cohesion, reducing inequalities and expanding opportunities for all, \nincluding women, young people, persons with disabilities and the most vulnerable \npeople, and reaching the furthest behind first,  \n \nNoting the role entrepreneurship can play in supporting participation in the \nlabour market for persons with disabilities, and that promoting the feasibility of \nentrepreneurship for persons with disabilities will increase awareness of \nentrepreneurship as a potential labour market activity, not only for persons with \ndisabilities, but also for self-employment and micro-, small and medium-sized \nenterprises, and noting also that persons with disabilities, including women with \ndisabilities, face disproportionate and intersecting forms of discrimination, including \nin access to financial resources,  \n \nRecalling its resolution 71/279 of 6 April 2017 on Micro-, Small and Medium-\nsized Enterprises Day,  \n \nRecognizing the importance of encouraging the formalization, participation and \ngrowth of micro-, small and medium-sized enterprises in international, regional and \nnational markets, including through access for all to capacity-building and financial \nservices, such as affordable microfinance and credit,  \n \nRemaining deeply concerned by continued high rates of youth unemployment, \nparticularly in developing countries, which stifle the transformative potential of \nyoung people in sustainable development,  \n\nA/RES/73/225 \nEntrepreneurship for sustainable development\n \n18-22548\n4/9 \n \n \nReaffirming its commitment to substantially increase the number of young \npeople and all adults who have relevant skills, including technical and vocational \nskills, for employment, decent jobs and entrepreneurship, and acknowledging the \nimportance of strengthening education systems, including vocational training, in \norder to develop relevant skills and competences,  \n \nAcknowledging that social entrepreneurship plays an important role in achieving \nthe sustainable development challenges by applying innovative market-based \nsolutions to social and environmental problems, while being financially sustainable, \nand providing job and income opportunities for disadvantaged groups,  \n \nAcknowledging also the importance of promoting development-oriented policies \nthat support productive activities, job creation and entrepreneurship, including social \nentrepreneurship, creativity and innovation, and encourage the formalization and \ngrowth of micro-, small and medium-sized enterprises, including through access to \nfinancial services and the improvement of financial literacy, and in this regard \nrecognizing the role of micro-, small and medium-sized enterprises in promoting \ninclusive and sustainable industrialization that could contribute to job creation for all,  \n \nRecognizing that businesses will play a central role in the transition towards \nsustainable development and a more resource-efficient economy, including concepts \nsuch as the circular economy, by adapting their business models and value chains,  \n \nNoting with concern that societal attitudes and negative preconceptions, in \nparticular towards women, including the fear of failure, the lack of opportunity and \ninsufficient support structures, can undermine efforts to create a culture of \nentrepreneurship,  \n \nRecognizing the importance of quality, accessible, timely and reliable \ndisaggregated data for monitoring progress in the implementation of entrepreneurship \npolicies and their direct and indirect contribution to the attainment of the Sustainable \nDevelopment Goals, and addressing sex-disaggregated data gaps, to ensure that no \none is left behind,  \n \n1. \nWelcomes the report of the Secretary-General;11  \n \n2. \nReiterates the need to promote sustained, inclusive and sustainable \neconomic growth, full and productive employment and decent work for all, and in \nthat regard emphasizes the importance of improved regulatory environments and \npolicy initiatives that promote entrepreneurship, including social entrepreneurship, \nand foster micro-, small and medium-sized enterprises, and stresses the positive role \nthat entrepreneurship plays in driving job creation, reducing inequalities and \nexpanding opportunities for all, including for women and youth;  \n \n3. \nAlso reiterates that the persistently low wages earned by women workers \nimpact their economic empowerment, giving rise to the need to build their economic \nresilience by helping them access and mobilize adequate financial resources and \ntechnologies and to undertake capacity-building to promote women\u2019s entrepreneurship \nand economic empowerment, and, in addition, to empower women through \nentrepreneurship by increasing their employment and market opportunities through \ntargeted education and training and greater legal protections in the workplace;  \n \n4. \nEncourages Governments to take a coordinated and inclusive approach to \npromoting entrepreneurship involving all stakeholders, while noting initiatives of \ncivil society, academia and the private sector as important entrepreneurship drivers, \nand to develop policies, taking into account national priorities and circumstances, that \naddress the legal, social and regulatory barriers to equal, effective economic \n__________________ \n \n11  A/73/258.  \n\nEntrepreneurship for sustainable development \nA/RES/73/225\n \n5/9\n18-22548 \n \nparticipation, and stresses the need for a comprehensive and holistic approach to \nentrepreneurship that includes long-term and cross-sectoral strategies;  \n \n5. \nAcknowledges that promoting entrepreneurship can stimulate new \nproduction processes and technology development, including the building of \nendogenous capacities for enabling climate change mitigation and adaptation and \nenhancing energy efficiency, and recognizes that such a policy, which could draw on \nthe initiatives presented in the Global Climate Action Agenda, can help Governments \nto meet their targets for the Paris Agreement on climate change;1  \n \n6. \nAlso acknowledges that the private sector contributes to the achievement \nof sustainable development and poverty eradication, and that partnerships with the \nprivate sector play an important role in promoting entrepreneurship, generating \nemployment and investment, increasing revenue potential, developing new \ntechnologies and innovative business models and enabling high, sustained, inclusive \nand equitable economic growth while protecting workers\u2019 rights;  \n \n7. \nFurther acknowledges the need for Member States to develop policies and, \nwhere appropriate, strengthen national and international policy regulatory frameworks \nand their coherence, harnessing the potential of science, technology and innovation, \nclosing technology gaps and scaling up capacity-building at all levels to better align \nprivate sector incentives with public goals, including incentivizing the private sector \nto adopt sustainable practices, and foster long-term quality investment, taking into \naccount the importance of responsible business practices and corporate social \nresponsibility, as reflected in the 10 principles of the United Nations Global Compact \nand in the Guiding Principles on Business and Human Rights: Implementing the \nUnited Nations \u201cProtect, Respect and Remedy\u201d Framework,12 environmental, social \nand governance performance standards and greater transparency in supply chains to \nend forced and child labour;  \n \n8. \nRecognizes the vital role of entrepreneurship in the development of \nregional economic integration, which can be an important catalyst for implementing \neconomic reforms, reducing trade barriers and decreasing trade costs;  \n \n9. \nInvites Member States to strengthen the capacity of national financial \ninstitutions to reach out to those who have no access to banking, insurance and other \nfinancial services, particularly women and women-led micro-, small and medium-\nsized enterprises, green and inclusive businesses, and digital entrepreneurs, in urban \nand especially in rural areas, including through the use of innovative tools, including \nmobile banking, payment platforms and digitalized payments, and encourages them \nto adopt regulatory and supervisory frameworks that facilitate the safe and sound \nprovision of financial services, increase access to information to protect consumers \nand promote financial literacy, particularly for women, young people and the most \nvulnerable people;  \n \n10. Also invites Member States to support the digital entrepreneurship of \nwomen, including in e-commerce, including for micro-, small and medium-sized \nenterprises, to develop local solutions and relevant content and promote innovation \nand decent job creation;  \n \n11. \nEncourages Member States to expand alternative sources of financing, \nincluding blended finance as well as impact investing, cooperatives and venture \nphilanthropy, venture capital and angel investors for start-ups, and diversify the retail \nfinancial service system to include non-traditional providers of financial services, \nsuch as microcredit and microfinance, stresses the value of a sound regulatory \nframework in this regard, and also encourages the provision of incentives to \n__________________ \n \n12  A/HRC/17/31, annex.  \n\nA/RES/73/225 \nEntrepreneurship for sustainable development\n \n18-22548\n6/9 \n \nmicrofinance institutions that meet national standards for delivering sound financial \nservices to the poor, with a particular emphasis on women;  \n \n12. Emphasizes the important role of national efforts aimed at bringing all \nworkers from the informal to the formal economy and integrating them into national \nsocial security systems, as appropriate, including by simplifying administrative \nprocesses, such as enabling business registration through single-window and \ne-registration procedures, notes that recommendation No. 204 of the International \nLabour Organization can provide useful guidance on the transition from the informal \nto the formal economy, and recognizes that women face unique barriers to entering \nthe formal workforce;  \n \n13. Invites Member States to strengthen the capacity of women to transition \nfrom the informal economy to formal employment and outline measures to reduce \nand redistribute women\u2019s and girls\u2019 disproportionate share of unpaid care and \ndomestic work and promote decent paid care and domestic work for women and men \nin the public and private sectors by providing social protection, safe working \nconditions and equal pay for equal work or work of equal value, thereby facilitating \nthe transition of informal workers, including those engaged in informal paid care and \ndomestic work, into the formal economy;  \n \n14. Recognizes that technological improvement, particularly through the \ndiffusion of technology, can provide new opportunities for businesses to improve their \ncompetitiveness and increase their productive capacities, and in this regard \nencourages Member States to increase cooperation in support of technology exchange \nand transfer on mutually agreed terms, innovation, capacity-building programmes and \nthe sharing of best practices for promoting entrepreneurship;  \n \n15. Highlights the importance of supporting technologies that can have a high \nsocial return, correspond to local needs and contribute to technological upgrading and \nsocial development;  \n \n16. Recognizes that entrepreneurs can address sustainable development \nchallenges by developing effective and simple solutions in the areas of utility \nservices, education, health care, hunger eradication and the environment, and that \nsocial entrepreneurship, including cooperatives and social enterprises, can help to \nalleviate poverty and catalyse social transformation by strengthening the productive \ncapacities of vulnerable groups, including persons with disabilities, and producing \ngoods and services that are accessible to them;  \n \n17. Acknowledges the value of entrepreneurship education and the \ndissemination of entrepreneurial thinking across all sectors, encourages all relevant \nactors to increase efforts to systemically integrate entrepreneurship within the formal \nand informal education systems, including through, inter alia, skills development, \ncareer guidance to support entrepreneurship, behavioural approach programmes such \nas the Empretec programme of the United Nations Conference on Trade and \nDevelopment and the Start and Improve Your Business programme of the International \nLabour Organization, capacity-building, professional training programmes, business \nincubators and national centres of excellence, as well as online platforms and \ne-mentorships, and also encourages cooperation and networking and the sharing of \nbest practices while fostering innovation and using innovative teaching methods in \nline with the demands of the competitive markets and ensuring the full participation \nof women and girls;  \n \n18. Encourages all stakeholders, in particular women and young entrepreneurs, \nto apply their creativity and innovation to solving sustainable development \nchallenges, and emphasizes that local innovation and entrepreneurship systems need \nto be able to fully participate in the implementation of the 2030 Agenda for \n\nEntrepreneurship for sustainable development \nA/RES/73/225\n \n7/9\n18-22548 \n \nSustainable Development,13 including the Sustainable Development Goals, and that \nconcerted efforts are needed to ensure the participation of all;  \n \n19. Reiterates the need for the promotion and advancement of women in \nlabour markets, including through policies and programmes aimed at the elimination \nof structural barriers and stereotypes that women of all ages face in the transition from \nschool to work, and the need to address challenges faced by women returning from \ncare-related career breaks and by older women, by providing access to technical and \nvocational skills training, as well as access to science, technology, engineering and \nmathematics training, entrepreneurship development and job-matching, and \naddressing the multiple and intersecting forms of discrimination and barriers they \nface, including violence, and the unequal distribution of unpaid care and work, and \npromoting their participation in relevant decision-making processes;  \n \n20. Encourages all relevant stakeholders to further develop financial literacy \nand financial education programmes that include an emphasis on the impact of finance \non sustainable development, as appropriate, in order to ensure that all learners acquire \nthe knowledge and skills needed to access financial services, in particular women and \ngirls, farmers and those working in micro-, small and medium-sized enterprises; \n \n21. Encourages and facilitates women\u2019s entrepreneurship, including by \nimproving access to financing and investment opportunities, tools of trade, business \ndevelopment and training, in order to increase trade and procurement, including \npublic procurement from women\u2019s enterprises, including micro-, small and medium-\nsized enterprises, cooperatives and self-help groups in both the public and private \nsectors;  \n \n22. Strengthens science and technology education policies and curricula to \npromote girls in science, technology, engineering and mathematics so that they are \nrelevant to the needs of and benefit women and girls, and encourages investment and \nresearch in sustainable technology that meets the needs of women, particularly in \ndeveloping countries, in order to strengthen their capacities, so as to enable women \nto leverage science and technology for entrepreneurship and economic empowerment \nin the changing world of work;  \n \n23. Highlights the importance of developing and implementing policies and \nprogrammes to support women\u2019s entrepreneurship, in particular opportunities for new \nwomen entrepreneurs and those that lead to business expansion for existing women-\nowned micro-, small and medium-sized enterprises, and encourages Governments to \nincrease investments in women-owned companies and businesses, to reduce \nadministrative barriers in the regulatory environment, removing restrictions that deter \nwomen from engaging in business activities, and to create a climate that is conducive \nto increasing the number of women entrepreneurs and the size of their businesses by \nproviding them with training and advisory services in business, access to finance, \nadministration and information and communications technology, facilitating \nnetworking and information-sharing and increasing their participation on advisory \nboards and in other forums so as to enable them to contribute to the formulation and \nreview of policies and programmes being developed, in particular by financial \ninstitutions;  \n \n24. Recognizes that social entrepreneurs are agents of change who can create \nalternative sustainable models of production, finance and consumption to respond to \nsocial, economic and environmental issues, while generating value for their \ncommunity and stakeholders, also recognizes the need to implement policies and \n__________________ \n \n13  Resolution 70/1.  \n\nA/RES/73/225 \nEntrepreneurship for sustainable development\n \n18-22548\n8/9 \n \nprogrammes aimed at supporting social entrepreneurship, and encourages \nGovernments to set up an environment conducive to social innovation;  \n \n25. Also recognizes that harnessing entrepreneurial talents among all young \npeople is vital for increasing productive capacities, developing new forms of \nentrepreneurship focused on information and communications technology, big data, \ndigitization, smart cities and creating start-ups, and generating full and productive \nemployment and decent work and inclusive economic growth, and encourages \nMember States to integrate youth entrepreneurship strategies and innovative \nprogrammes into their national policies, create a nurturing environment for the full \nrealization of the rights and capabilities of all young people, and increase investment \nin micro-, small and medium-sized enterprises, including through impact investment \nfavouring the poorest and most vulnerable, entrepreneurial education, youth capacity-\nbuilding and information and communications technology;  \n \n26. Encourages Governments and all sectors of society to take sustainable \nmeasures to achieve full and productive employment and decent work for persons \nwith disabilities, on an equal basis and without discrimination on the basis of gender \nand disability, including by promoting access to inclusive education systems, skills \ndevelopment and vocational and entrepreneurial training, in order to enable persons \nwith disabilities to attain and maintain maximum independence, notes that further \nefforts are needed to increase awareness of the ability of persons with disabilities to \ninnovate and contribute to the achievement of sustainable development through \nentrepreneurship, and in this regard calls upon all stakeholders to establish research \non policy support for entrepreneurs with disabilities and collect data in order to \ndevelop or improve programmes, taking into account their capabilities, skills, \nsocioeconomic status and other personal characteristics;  \n \n27. Stresses the need to highlight the value of entrepreneurship and its \ncontribution to the 2030 Agenda for Sustainable Development, including the \neradication of poverty in all its forms and dimensions, by promoting policies, \ninitiatives and programmes that support the development of an enabling \nentrepreneurial ecosystem, including by raising public awareness, reinforcing local \nsupport networks and employing specific measures aimed at removing negative \npreconceptions and negative cultural biases;  \n \n28. Calls upon all stakeholders to implement the present resolution as a means \nto deliver the comprehensive, far-reaching and people-centred set of universal and \ntransformative Goals and targets of the 2030 Agenda, in which the dignity of the \nhuman person is fundamental, the Goals and targets are met for all nations and peoples \nand for all segments of society, no one is left behind and we endeavour to reach the \nfurthest behind first;  \n \n29. Stresses the importance of indicators that can be used to formulate targeted \nentrepreneurship policies and measure their impact on the Sustainable Development \nGoals, and in this regard encourages Member States, in cooperation with all relevant \nstakeholders, to further identify and develop indicators at the national and regional \nlevels as appropriate;  \n \n30. Recognizes that democratic political institutions, transparent and \naccountable public and private entities, effective anti-corruption measures and \nresponsible corporate governance are key conditions for making market economies \nand enterprises more responsive to the values and long-term goals of society;  \n \n31. Calls upon the relevant organizations and bodies of the United Nations \nsystem to further recognize and integrate entrepreneurship in its various forms into \ntheir policies, programmes and reports, as appropriate, and invites the United Nations \nsystem, and in particular the United Nations Conference on Trade and Development, \n\nEntrepreneurship for sustainable development \nA/RES/73/225\n \n9/9\n18-22548 \n \nto continue to provide support to and assist Member States, at their request, to identify, \nformulate, implement and assess coherent policy measures on entrepreneurship and \nthe promotion of micro-, small and medium-sized enterprises;  \n \n32. Decides to give consideration, as appropriate, to the contribution of \nentrepreneurship to sustainable development in the follow-up and review framework \nof the 2030 Agenda for Sustainable Development;  \n \n33. Requests the Secretary-General to submit to the General Assembly at its \nseventy-fifth session a report on the implementation of the present resolution, and \ndecides to include the item entitled \u201cSustainable development\u201d in the provisional \nagenda of its seventy-fifth session, unless otherwise agreed.  \n \n62nd plenary meeting  \n20 December 2018 \n \n",
  "paragraphs": {
    "1": "Welcomes the report of the Secretary-General;11",
    "2": "Reiterates the need to promote sustained, inclusive and sustainable economic growth, full and productive employment and decent work for all, and in that regard emphasizes the importance of improved regulatory environments and policy initiatives that promote entrepreneurship, including social entrepreneurship, and foster micro-, small and medium-sized enterprises, and stresses the positive role that entrepreneurship plays in driving job creation, reducing inequalities and expanding opportunities for all, including for women and youth;",
    "3": "Also reiterates that the persistently low wages earned by women workers impact their economic empowerment, giving rise to the need to build their economic resilience by helping them access and mobilize adequate financial resources and technologies and to undertake capacity-building to promote women\u2019s entrepreneurship and economic empowerment, and, in addition, to empower women through entrepreneurship by increasing their employment and market opportunities through targeted education and training and greater legal protections in the workplace;",
    "4": "Encourages Governments to take a coordinated and inclusive approach to promoting entrepreneurship involving all stakeholders, while noting initiatives of civil society, academia and the private sector as important entrepreneurship drivers, and to develop policies, taking into account national priorities and circumstances, that address the legal, social and regulatory barriers to equal, effective economic participation, and stresses the need for a comprehensive and holistic approach to entrepreneurship that includes long-term and cross-sectoral strategies;",
    "5": "Acknowledges that promoting entrepreneurship can stimulate new production processes and technology development, including the building of endogenous capacities for enabling climate change mitigation and adaptation and enhancing energy efficiency, and recognizes that such a policy, which could draw on the initiatives presented in the Global Climate Action Agenda, can help Governments to meet their targets for the Paris Agreement on climate change;1",
    "6": "Also acknowledges that the private sector contributes to the achievement of sustainable development and poverty eradication, and that partnerships with the private sector play an important role in promoting entrepreneurship, generating employment and investment, increasing revenue potential, developing new technologies and innovative business models and enabling high, sustained, inclusive and equitable economic growth while protecting workers\u2019 rights;",
    "7": "Further acknowledges the need for Member States to develop policies and, where appropriate, strengthen national and international policy regulatory frameworks and their coherence, harnessing the potential of science, technology and innovation, closing technology gaps and scaling up capacity-building at all levels to better align private sector incentives with public goals, including incentivizing the private sector to adopt sustainable practices, and foster long-term quality investment, taking into account the importance of responsible business practices and corporate social responsibility, as reflected in the 10 principles of the United Nations Global Compact and in the Guiding Principles on Business and Human Rights: Implementing the United Nations \u201cProtect, Respect and Remedy\u201d Framework,12 environmental, social and governance performance standards and greater transparency in supply chains to end forced and child labour;",
    "8": "Recognizes the vital role of entrepreneurship in the development of regional economic integration, which can be an important catalyst for implementing economic reforms, reducing trade barriers and decreasing trade costs;",
    "9": "Invites Member States to strengthen the capacity of national financial institutions to reach out to those who have no access to banking, insurance and other financial services, particularly women and women-led micro-, small and medium- sized enterprises, green and inclusive businesses, and digital entrepreneurs, in urban and especially in rural areas, including through the use of innovative tools, including mobile banking, payment platforms and digitalized payments, and encourages them to adopt regulatory and supervisory frameworks that facilitate the safe and sound provision of financial services, increase access to information to protect consumers and promote financial literacy, particularly for women, young people and the most vulnerable people;",
    "10": "Also invites Member States to support the digital entrepreneurship of women, including in e-commerce, including for micro-, small and medium-sized enterprises, to develop local solutions and relevant content and promote innovation and decent job creation;",
    "11": "Encourages Member States to expand alternative sources of financing, including blended finance as well as impact investing, cooperatives and venture philanthropy, venture capital and angel investors for start-ups, and diversify the retail financial service system to include non-traditional providers of financial services, such as microcredit and microfinance, stresses the value of a sound regulatory framework in this regard, and also encourages the provision of incentives to microfinance institutions that meet national standards for delivering sound financial services to the poor, with a particular emphasis on women;",
    "12": "Emphasizes the important role of national efforts aimed at bringing all workers from the informal to the formal economy and integrating them into national social security systems, as appropriate, including by simplifying administrative processes, such as enabling business registration through single-window and e-registration procedures, notes that recommendation No. 204 of the International Labour Organization can provide useful guidance on the transition from the informal to the formal economy, and recognizes that women face unique barriers to entering the formal workforce;",
    "13": "Invites Member States to strengthen the capacity of women to transition from the informal economy to formal employment and outline measures to reduce and redistribute women\u2019s and girls\u2019 disproportionate share of unpaid care and domestic work and promote decent paid care and domestic work for women and men in the public and private sectors by providing social protection, safe working conditions and equal pay for equal work or work of equal value, thereby facilitating the transition of informal workers, including those engaged in informal paid care and domestic work, into the formal economy;",
    "14": "Recognizes that technological improvement, particularly through the diffusion of technology, can provide new opportunities for businesses to improve their competitiveness and increase their productive capacities, and in this regard encourages Member States to increase cooperation in support of technology exchange and transfer on mutually agreed terms, innovation, capacity-building programmes and the sharing of best practices for promoting entrepreneurship;",
    "15": "Highlights the importance of supporting technologies that can have a high social return, correspond to local needs and contribute to technological upgrading and social development;",
    "16": "Recognizes that entrepreneurs can address sustainable development challenges by developing effective and simple solutions in the areas of utility services, education, health care, hunger eradication and the environment, and that social entrepreneurship, including cooperatives and social enterprises, can help to alleviate poverty and catalyse social transformation by strengthening the productive capacities of vulnerable groups, including persons with disabilities, and producing goods and services that are accessible to them;",
    "17": "Acknowledges the value of entrepreneurship education and the dissemination of entrepreneurial thinking across all sectors, encourages all relevant actors to increase efforts to systemically integrate entrepreneurship within the formal and informal education systems, including through, inter alia, skills development, career guidance to support entrepreneurship, behavioural approach programmes such as the Empretec programme of the United Nations Conference on Trade and Development and the Start and Improve Your Business programme of the International Labour Organization, capacity-building, professional training programmes, business incubators and national centres of excellence, as well as online platforms and e-mentorships, and also encourages cooperation and networking and the sharing of best practices while fostering innovation and using innovative teaching methods in line with the demands of the competitive markets and ensuring the full participation of women and girls;",
    "18": " Sustainable Development,13 including the Sustainable Development Goals, and that concerted efforts are needed to ensure the participation of all;",
    "19": "Reiterates the need for the promotion and advancement of women in labour markets, including through policies and programmes aimed at the elimination of structural barriers and stereotypes that women of all ages face in the transition from school to work, and the need to address challenges faced by women returning from care-related career breaks and by older women, by providing access to technical and vocational skills training, as well as access to science, technology, engineering and mathematics training, entrepreneurship development and job-matching, and addressing the multiple and intersecting forms of discrimination and barriers they face, including violence, and the unequal distribution of unpaid care and work, and promoting their participation in relevant decision-making processes;",
    "20": "Encourages all relevant stakeholders to further develop financial literacy and financial education programmes that include an emphasis on the impact of finance on sustainable development, as appropriate, in order to ensure that all learners acquire the knowledge and skills needed to access financial services, in particular women and girls, farmers and those working in micro-, small and medium-sized enterprises;",
    "21": "Encourages and facilitates women\u2019s entrepreneurship, including by improving access to financing and investment opportunities, tools of trade, business development and training, in order to increase trade and procurement, including public procurement from women\u2019s enterprises, including micro-, small and medium- sized enterprises, cooperatives and self-help groups in both the public and private sectors;",
    "22": "Strengthens science and technology education policies and curricula to promote girls in science, technology, engineering and mathematics so that they are relevant to the needs of and benefit women and girls, and encourages investment and research in sustainable technology that meets the needs of women, particularly in developing countries, in order to strengthen their capacities, so as to enable women to leverage science and technology for entrepreneurship and economic empowerment in the changing world of work;",
    "23": "Highlights the importance of developing and implementing policies and programmes to support women\u2019s entrepreneurship, in particular opportunities for new women entrepreneurs and those that lead to business expansion for existing women- owned micro-, small and medium-sized enterprises, and encourages Governments to increase investments in women-owned companies and businesses, to reduce administrative barriers in the regulatory environment, removing restrictions that deter women from engaging in business activities, and to create a climate that is conducive to increasing the number of women entrepreneurs and the size of their businesses by providing them with training and advisory services in business, access to finance, administration and information and communications technology, facilitating networking and information-sharing and increasing their participation on advisory boards and in other forums so as to enable them to contribute to the formulation and review of policies and programmes being developed, in particular by financial institutions;",
    "24": "Recognizes that social entrepreneurs are agents of change who can create alternative sustainable models of production, finance and consumption to respond to social, economic and environmental issues, while generating value for their community and stakeholders, also recognizes the need to implement policies and programmes aimed at supporting social entrepreneurship, and encourages Governments to set up an environment conducive to social innovation;",
    "25": "Also recognizes that harnessing entrepreneurial talents among all young people is vital for increasing productive capacities, developing new forms of entrepreneurship focused on information and communications technology, big data, digitization, smart cities and creating start-ups, and generating full and productive employment and decent work and inclusive economic growth, and encourages Member States to integrate youth entrepreneurship strategies and innovative programmes into their national policies, create a nurturing environment for the full realization of the rights and capabilities of all young people, and increase investment in micro-, small and medium-sized enterprises, including through impact investment favouring the poorest and most vulnerable, entrepreneurial education, youth capacity- building and information and communications technology;",
    "26": "Encourages Governments and all sectors of society to take sustainable measures to achieve full and productive employment and decent work for persons with disabilities, on an equal basis and without discrimination on the basis of gender and disability, including by promoting access to inclusive education systems, skills development and vocational and entrepreneurial training, in order to enable persons with disabilities to attain and maintain maximum independence, notes that further efforts are needed to increase awareness of the ability of persons with disabilities to innovate and contribute to the achievement of sustainable development through entrepreneurship, and in this regard calls upon all stakeholders to establish research on policy support for entrepreneurs with disabilities and collect data in order to develop or improve programmes, taking into account their capabilities, skills, socioeconomic status and other personal characteristics;",
    "27": "Stresses the need to highlight the value of entrepreneurship and its contribution to the 2030 Agenda for Sustainable Development, including the eradication of poverty in all its forms and dimensions, by promoting policies, initiatives and programmes that support the development of an enabling entrepreneurial ecosystem, including by raising public awareness, reinforcing local support networks and employing specific measures aimed at removing negative preconceptions and negative cultural biases;",
    "28": "Calls upon all stakeholders to implement the present resolution as a means to deliver the comprehensive, far-reaching and people-centred set of universal and transformative Goals and targets of the 2030 Agenda, in which the dignity of the human person is fundamental, the Goals and targets are met for all nations and peoples and for all segments of society, no one is left behind and we endeavour to reach the furthest behind first;",
    "29": "Stresses the importance of indicators that can be used to formulate targeted entrepreneurship policies and measure their impact on the Sustainable Development Goals, and in this regard encourages Member States, in cooperation with all relevant stakeholders, to further identify and develop indicators at the national and regional levels as appropriate;",
    "30": "Recognizes that democratic political institutions, transparent and accountable public and private entities, effective anti-corruption measures and responsible corporate governance are key conditions for making market economies and enterprises more responsive to the values and long-term goals of society;",
    "31": " to continue to provide support to and assist Member States, at their request, to identify, formulate, implement and assess coherent policy measures on entrepreneurship and the promotion of micro-, small and medium-sized enterprises;",
    "32": "Decides to give consideration, as appropriate, to the contribution of entrepreneurship to sustainable development in the follow-up and review framework of the 2030 Agenda for Sustainable Development;",
    "33": "Requests the Secretary-General to submit to the General Assembly at its seventy-fifth session a report on the implementation of the present resolution, and decides to include the item entitled \u201cSustainable development\u201d in the provisional agenda of its seventy-fifth session, unless otherwise agreed."
  },
  "agenda_items": [
    "Item 20"
  ],
  "symbol_references": []
}