{
  "symbol": "A/RES/78/160",
  "filename": "A_RES_78_160.pdf",
  "title": "78/160. Science, technology and innovation for sustainable development",
  "text": "United Nations \nA/RES/78/160\n \n \nGeneral Assembly \nDistr.: General \n21 December 2023 \n \n23-25892 (E)    030124 \n*2325892* \n \n \nSeventy-eighth session \nAgenda item 19 (a) \nGlobalization and interdependence: science, technology \nand innovation for sustainable development  \n \n \n \n \n Resolution adopted by the General Assembly \non 19 December 2023 \n \n \n \n \n[on the report of the Second Committee (A/78/462/Add.1, para. 7)] \n \n \n 78/160. Science, technology and innovation for sustainable development \n \n \n \nThe General Assembly,  \n \nReaffirming its resolution 70/1 of 25 September 2015, entitled \u201cTransforming \nour world: the 2030 Agenda for Sustainable Development\u201d, in which it adopted a \ncomprehensive, far-reaching and people-centred set of universal and transformative \nSustainable Development Goals and targets, its commitment to working tirelessly for \nthe full implementation of the Agenda by 2030, its recognition that eradicating \npoverty in all its forms and dimensions, including extreme poverty, is the greatest \nglobal challenge and an indispensable requirement for sustainable development, its \ncommitment to achieving sustainable development in its three dimensions \u2013 economic, \nsocial and environmental \u2013 in a balanced and integrated manner, and to building upon \nthe achievements of the Millennium Development Goals and seeking to address their \nunfinished business,  \n \nReaffirming also its resolution 69/313 of 27 July 2015 on the Addis Ababa \nAction Agenda of the Third International Conference on Financing for Development, \nwhich is an integral part of the 2030 Agenda for Sustainable Development, supports \nand complements it, helps to contextualize its means of implementation targets with \nconcrete policies and actions, and reaffirms the strong political commitment to \naddress the challenge of financing and creating an enabling environment at all levels \nfor sustainable development in the spirit of global partnership and solidarity,  \n \nReaffirming further the Paris Agreement 1  and its early entry into force, \nencouraging all its parties to fully implement the Agreement, and parties to the United \nNations Framework Convention on Climate Change 2 that have not yet done so to \n__________________ \n \n1  Adopted under the UNFCCC in FCCC/CP/2015/10/Add.1, decision 1/CP.21. \n \n2  United Nations, Treaty Series, vol. 1771, No. 30822. \n\nA/RES/78/160 \nScience, technology and innovation for sustainable development\n \n23-25892\n2/12 \n \ndeposit their instruments of ratification, acceptance, approval or accession, where \nappropriate, as soon as possible,  \n \nRecalling its resolution 76/213 of 17 December 2021 on science, technology \nand innovation for development and its previous resolutions on the issue, 3 \n \nTaking note of Economic and Social Council resolution 2023/4 of 7 June 2023 \non science, technology and innovation for development and previous Council \nresolutions on the issue, 4 and taking note also of Council resolution 2021/30 of \n22 July 2021 on open-source technologies for sustainable development,  \n \nRecalling with appreciation its resolution 77/320 of 25 July 2023 on the impact \nof rapid technological change on the achievement of the Sustainable Development \nGoals and targets,  \n \nRecalling the World Summit on the Information Society and its outcomes, 5 as \nwell as other relevant intergovernmentally agreed outcomes,  \n \nTaking note of the reports of the Commission on Science and Technology for \nDevelopment on its fourteenth to twenty-sixth sessions,6 \n \nTaking note also of the report of the Secretary-General,7 \n \nRecalling its resolution 76/307 of 8 September 2022 and its decision 77/568 of \n1 September 2023 on the modalities and the scope of the Summit of the Future to be \nheld on 22 and 23 September 2024, mandating a concise, action-oriented outcome \ndocument entitled \u201cA Pact for the Future\u201d, including a chapter on science, technology \nand innovation and digital cooperation,  \n \nLooking forward to the elaboration of a Global Digital Compact including to \nbridge the digital divides, and to accelerate the achievement of the Sustainable \nDevelopment Goals and to strengthen digital cooperation, \n \nRecalling its resolution 77/326 of 25 August 2023 proclaiming the period 2024\u2013\n2034 the International Decade on Sciences for Sustainable Development, which \nhighlighted the critical role that sciences play in the pursuit of sustainable \ndevelopment in its three dimensions as one of the key means of implementation,  \n \nTaking note of the work of the United Nations System Chief Executives Board \nfor Coordination on the impact of new and emerging technologies and on promoting \ninnovation to accelerate the achievement of the Sustainable Development Goals,  \n \nRecognizing that science, technology and innovation, including environmentally \nsound technologies and information and communications technologies, are critical in \nthe pursuit of sustainable development and are one of the key means of \nimplementation of the intergovernmentally agreed development outcomes, including \nthe 2030 Agenda and its Sustainable Development Goals,  \n__________________ \n \n3  Resolutions 58/200, 59/220, 60/205, 61/207, 62/201, 64/212, 66/211, 68/220, 70/213, 72/228 and \n74/229. \n \n4  Economic and Social Council resolutions 2006/46, 2009/8, 2010/3, 2011/17, 2012/6, 2013/10, \n2014/28, 2015/27, 2016/23, 2017/22, 2018/29, 2019/25, 2020/13, 2021/29 and 2022/16. \n \n5  See A/C.2/59/3 and A/60/687. \n \n6  Official Records of the Economic and Social Council, 2011, Supplement No. 11 (E/2011/31); \nibid., 2012, Supplement No. 11 and corrigendum (E/2012/31 and E/2012/31/Corr.1); ibid., 2013, \nSupplement No. 11 and corrigendum (E/2013/31 and E/2013/31/Corr.1); ibid., 2014, Supplement \nNo. 11 (E/2014/31); ibid., 2015, Supplement No. 11 (E/2015/31); ibid., 2016, Supplement No. 11 \n(E/2016/31); ibid., 2017, Supplement No. 11 (E/2017/31); ibid., 2018, Supplement No. 11 \n(E/2018/31); ibid., 2019, Supplement No. 11 (E/2019/31); ibid., 2020, Supplement No. 11 \n(E/2020/31); ibid., 2021, Supplement No. 11 (E/2021/31); ibid., 2022, Supplement No. 11 \n(E/2022/31); and ibid., 2023, Supplement No. 11 (E/2023/31). \n \n7  A/78/232. \n\nScience, technology and innovation for sustainable development \nA/RES/78/160\n \n3/12\n23-25892 \n \n \nNoting that the 2023 Global Sustainable Development Report identifies science, \ntechnology and innovation as one of the levers for transformation to accelerate \nprogress in achieving the Sustainable Development Goals, that its strategic \ndeployment has the potential to resolve and minimize trade-offs among the Goals and \ntargets, and recognizes that technology transfer to developing countries on mutually \nagreed terms will be critical to scale up and accelerate the implementation of the 2030 \nAgenda, and advocates for science that is multidisciplinary, equitably and inclusively \nproduced, openly shared, trusted and relevant to society,  \n \nTaking note of the June 2019 report of the Secretary-General\u2019s High-level Panel \non Digital Cooperation entitled \u201cThe age of digital interdependence\u201d, and the May 2020 \nreport of the Secretary-General entitled \u201cRoad map for digital cooperation\u201d,8 and of the \nhigh-level thematic debate on digital cooperation and connectivity convened by the \nPresident of the General Assembly at its seventy-fifth session on 27 April 2021, as well \nas the establishment of the Office of the Secretary-General\u2019s Envoy on Technology,  \n \nEmphasizing that science, technology and innovation play a key role in \naccelerating the pace of economic diversification and transformation, improving \nproductivity and competitiveness, as well as enabling the full participation of \ndeveloping countries in the global economy,  \n \nAcknowledging the contribution of science, technology and innovation to \naccelerate sustainable and inclusive development and the transition to resilient, \nknowledge-based societies and economies, including in low and middle-income \ncountries, and, in that context, acknowledging the importance of the provision of the \nnecessary means of implementation to developing countries to strengthen their \nscientific and technological capacities, including in the field of higher education, \nresearch and innovation,  \n \nReaffirming that the creation, development and diffusion of new innovations \nand technologies and associated know-how, including the transfer of technology on \nmutually agreed terms, are powerful drivers of economic growth and sustainable \ndevelopment,  \n \nUnderscoring that rapid technological change brings enormous opportunities to \naccelerate progress towards the Sustainable Development Goals, while it also poses \nnew challenges, including perpetuating divides within and between countries,  \n \nNoting that the coronavirus disease (COVID-19) pandemic, with persistent \nnegative effects worldwide and especially in developing countries, has demonstrated \nthe importance of science, technology and innovation, of scientific collaboration and \nthe need to strengthen global solidarity, of international cooperation, and of providing \nthe required means of implementation for developing countries to prevent, prepare \nand respond to future pandemics and other health emergencies, taking into account \nlessons learned from the pandemic, reaffirming that the same rights that people have \noffline must also be protected online, and emphasizing that adaptation to rapid \ntechnological change should be considered not only as a function of sustainable \ndevelopment and the spreading of information and communications technologies, but \nalso with respect to the realization of all human rights and fundamental freedoms,  \n \nNoting also the multilateral and regional initiatives aimed at promoting social \nprosperity through inclusive participation and growth across the digital economy, \nincluding, inter alia, the establishment of the Digital Cooperation Organization in \n2020,  \n \nRecognizing that new technologies increase the demand for digital skills and \ncompetencies and that, at the same time, developing countries are experiencing higher \n__________________ \n \n8  A/74/821. \n\nA/RES/78/160 \nScience, technology and innovation for sustainable development\n \n23-25892\n4/12 \n \nnumbers of young people entering the labour market and a widening gap between \ntheir knowledge, skills and abilities and those sought by employers, and expressing \nconcern that the share of women in specialist information and communications \ntechnology occupations remains low, especially in developing countries,  \n \nRecognizing also that education, training and capacity-building in science, \ntechnology and innovation can provide new skills and so widen employment \nopportunities, while addressing market needs,  \n \nCalling upon the international community and all stakeholders to support efforts \nby developing countries to provide opportunities for science, technology, engineering \nand mathematics education and research for all, including youth and women, and \nparticularly in the emerging technologies, and to provide suitable working conditions \nand opportunities in order to prevent brain drain and ensure human resources \nadaptation to technological change, including through upskilling and reskilling \nprogrammes for the workforce,  \n \nRecognizing that innovation, such as pro-poor, inclusive, grass-roots and social \ninnovation that seeks to solve problems, is not always addressed by markets,  \n \nRecognizing also the importance of utilizing science, technology and innovation \nin a manner relevant to specific national and local situations and needs,  \n \nRecognizing further the importance of data protection and privacy, in particular \nfor developing countries in the context of science and technology for development, \nespecially regarding the adoption of new technologies,  \n \nTaking note of the Technology and Innovation Report 2023 of the United \nNations Conference on Trade and Development, which highlights that innovation and \nfrontier technologies can drive the transformative solutions needed, and the need to \nexplore ways for developing countries to use, improve, adopt and adapt such \ntechnologies and to take up the opportunities to harness frontier technologies, as well \nas the potential for frontier technologies to address existing inequalities and foster \nsustainable development, and recalling the Digital Economy Report 2021 of the \nUnited Nations Conference on Trade and Development, which examines the role of \ngrowing cross-border data flows for development,  \n \nRecognizing that realizing gender equality and the empowerment of all women \nand girls will make a crucial contribution to progress across all of the Sustainable \nDevelopment Goals and targets, and recognizing also that there is a need to ensure full \nand equal access to and participation in science, technology and innovation for women \nof all ages, as well as to target science, technology and innovation strategies to address \nwomen\u2019s empowerment and inequalities, including the gender digital divide,  \n \nRecalling the agreed conclusions of the Commission on the Status of Women on \nwomen\u2019s economic empowerment in the changing world of work, adopted at its sixty-\nfirst session,9 which, inter alia, highlighted the need to manage technological and \ndigital change for women\u2019s economic empowerment, particularly to strengthen the \ncapacities of developing countries, so as to enable women to leverage science and \ntechnology for entrepreneurship and economic empowerment in the changing world \nof work and to support women\u2019s access, throughout their life cycle, to skills \ndevelopment and decent work in new and emerging fields by expanding the scope of \neducation and training opportunities in, inter alia, science, technology, engineering \nand mathematics, information and communications technology and digital fluency, \nand to enhance women\u2019s and, as appropriate, girls\u2019 participation as users, content \ncreators, employees, entrepreneurs, innovators and leaders, and further recalling the \n__________________ \n \n9  Official Records of the Economic and Social Council, 2017, Supplement No. 7 (E/2017/27), \nchap. I, sect. A. \n\nScience, technology and innovation for sustainable development \nA/RES/78/160\n \n5/12\n23-25892 \n \nagreed conclusions of the sixty-seventh session of the Commission on the Status of \nWomen on the theme \u201cInnovation and technological change, and education in the \ndigital age for achieving gender equality and the empowerment of all women and \ngirls\u201d,10 and underlining the importance of mainstreaming a gender perspective into \nthe policies and programmes related to innovation and technological change and to \neducation in the digital age, with the aim of achieving gender equality and the \nempowerment of all women and girls,  \n \nExpressing concern that many developing countries still face serious challenges \nin building or improving their national science, technology and innovation base and \necosystems, and a lack of digital skills and affordable and equitable access to \ninformation and communications technologies, and that, for the poor, the promise of \nscience, technology and innovation remains unfulfilled, and that more efforts have to \nbe deployed to increase the benefits of science, technology and innovation for all,  \n \nTaking note with appreciation of the United Nations Technology Innovation \nLabs, in their efforts to facilitate and stimulate innovation for the implementation of \nthe 2030 Agenda,  \n \nRecognizing that science, technology and innovation cooperation and \ncollaboration with, as well as foreign direct investment in and trade with and among, \ndeveloping countries, as well as international support, are fundamental to enhancing \ndeveloping countries\u2019 ability to benefit from technological advances and to produce, \nnurture, access, comprehend, select, adapt and use science, technology and innovation \nknowledge,  \n \nRecognizing also the importance of supporting national strategies, policies and \nactivities of developing countries in the fields of science, technology and innovation \nthrough international cooperation for development, including multilateral, North-\nSouth, South-South and triangular cooperation, while recalling that South-South \ncooperation is not a substitute for, but rather a complement to, North-South \ncooperation, in the areas of financial and technical assistance, capacity-building and \ntechnology transfer on mutually agreed terms,  \n \nReaffirming its resolution 73/291 of 15 April 2019, in which it endorsed the \nBuenos Aires outcome document of the second High-level United Nations Conference \non South-South Cooperation,11 and renewing the call for its implementation,  \n \nRecognizing the need to mobilize and scale up the means of implementation, \nincluding financing, for science, technology and innovation, especially in developing \ncountries, in support of the Sustainable Development Goals,  \n \nWelcoming the increase in official development assistance targeting the \ndevelopment of science, technology and innovation capacities in developing countries \nin the past two decades, however, remaining concerned that official development \nassistance for science, technology and innovation capacities directed to the least \ndeveloped countries, landlocked developing countries, small island developing States \nand African countries has remained at about the same levels for the past decade,  \n \nRecognizing the central role that the Commission on Science and Technology \nfor Development plays, as the United Nations focal point for science, technology and \ninnovation for sustainable development, in analysing how science, technology and \ninnovation, including information and communications technologies, serve as \nenablers of the 2030 Agenda by acting as a forum for strategic planning, sharing \nlessons learned and best practices, providing foresight about critical trends in science, \n__________________ \n \n10  Ibid., 2023, Supplement No. 7 (E/2023/27), chap. I, sect. A. \n \n11  Resolution 73/291, annex. \n\nA/RES/78/160 \nScience, technology and innovation for sustainable development\n \n23-25892\n6/12 \n \ntechnology and innovation in key sectors of the economy, the environment and \nsociety, and drawing attention to emerging and disruptive technologies,  \n \nReaffirming the need to enhance the science, technology and innovation \nprogrammes of the relevant entities of the United Nations system, and in this regard \nrecalling the mandate of the Technology Facilitation Mechanism on science, technology \nand innovation for the achievement of the Sustainable Development Goals to promote \ncoordination, coherence and cooperation within the United Nations system,  \n \nRecognizing the need to strengthen the collaboration and exchange between \npolicymakers and scientific and technological communities,  \n \nWelcoming the convening of the first to eighth annual multi-stakeholder forums \non science, technology and innovation for the Sustainable Development Goals, noting \nwith appreciation the ongoing work of the United Nations inter-agency task team on \nscience, technology and innovation for the Sustainable Development Goals, including \nthe Global Pilot Programme on Science, Technology and Innovation for the Sustainable \nDevelopment Goals Road Maps (STI for SDGs road maps), and noting the expanded \noperationalization of the 2030 Connect online platform, as the three components of the \nTechnology Facilitation Mechanism, that can help to advance the 2030 Agenda,  \n \nNoting the ongoing efforts of the World Intellectual Property Organization to \nassist Member States in establishing intellectual property strategies and national \necosystems that promote innovation and creativity and support the flow of knowledge \nand technical expertise,  \n \nNoting also the existing efforts and contributions of the regional commissions \non science, technology and innovation for sustainable development,  \n \nRecalling the importance of supporting the African Union\u2019s Agenda 2063, as \nwell as its 10-year plan of action, as a strategic framework for ensuring a positive \nsocioeconomic transformation in Africa within the next 50 years, and its continental \nprogramme embedded in the resolutions of the General Assembly on the New \nPartnership for Africa\u2019s Development and regional initiatives, and in this context \nnoting the Declaration of Sharm el-Sheikh, adopted by the African Union in October \n2019, which commits to work towards an integrated and inclusive Digital Society and \nEconomy in Africa that improves the quality of life of Africa\u2019s citizens, as well as the \nScience, Technology and Innovation Strategy for Africa 2024 of the African Union,  \n \nReiterating the pledge that no one will be left behind, reaffirming the \nrecognition that the dignity of the human person is fundamental, and the wish to see \nthe Goals and targets met for all nations and peoples and for all segments of society, \nand recommitting to endeavour to reach the furthest behind first,  \n \nNoting with great concern the severe negative impact on human health, safety \nand well-being caused by the coronavirus disease (COVID-19) pandemic, as well as \nthe severe disruption to societies and economies and the devastating impact on lives \nand livelihoods, and that the poorest and most vulnerable are the hardest hit by the \npandemic, reaffirming the ambition to get back on track to achieve the Sustainable \nDevelopment Goals by designing and implementing sustainable and inclusive \nrecovery strategies to accelerate progress towards the full implementation of the 2030 \nAgenda for Sustainable Development and to help to reduce the risk of and build \nresilience to future shocks, crises and pandemics, including by strengthening health \nsystems and achieving universal health coverage, and recognizing that equitable and \ntimely access for all to safe, quality, effective and affordable COVID-19 vaccines, \ntherapeutics and diagnostics are an essential part of a global response based on unity, \nsolidarity, renewed multilateral cooperation and the principle of leaving no one behind, \n\nScience, technology and innovation for sustainable development \nA/RES/78/160\n \n7/12\n23-25892 \n \n \n1. \nReaffirms its commitments made in the Addis Ababa Action Agenda of the \nThird International Conference on Financing for Development 12 on, inter alia, science, \ntechnology and innovation, as an important action area for sustainable development;  \n \n2. \nAlso reaffirms its commitment to continue promoting the use of science, \ntechnology and innovation, including through evidence-based policymaking, in \nfacilitating efforts to address global challenges, and to accelerate progress on the \nachievement of the Sustainable Development Goals, such as efforts to eradicate \npoverty, including extreme poverty; achieve food security and nutrition; increase \nagricultural productivity; enhance access to affordable, reliable, sustainable and \nmodern energy for all; fight diseases; improve education; protect the environment and \naddress climate change; foster disaster preparedness and strengthen the effectiveness \nand efficiency of disaster resilience-building;  \n \n3. \nEmphasizes that applying science to solve complex global challenges calls \nfor cross- and trans-disciplinary collaboration and a strong science-policy-society \ninterface in order to build trust in science and evidence;  \n \n4. \nReaffirms its commitment to the actions agreed upon by the least developed \ncountries and development partners on science, technology and innovation, as \noutlined in the Doha Programme of Action for the Least Developed Countries, 13 and \ntakes note of the Doha Political Declaration, adopted during the second part of the \nFifth United Nations Conference on the Least Developed Countries, held in Doha, \nfrom 5 to 9 March 2023;14 \n \n5. \nNotes the central role of Governments, with active contribution from \nstakeholders from the private sector, civil society, academia and research institutions, \nappropriate United Nations entities, relevant international entities and forums, in \ncreating and supporting an enabling environment at all levels, including enabling \nregulatory and governance frameworks, in accordance with national priorities, to nurture \nscience, innovation, entrepreneurship and the dissemination of knowledge and \ntechnologies that is on mutually agreed terms, particularly to micro-, small and medium-\nsized enterprises, as well as industrial diversification and value added to commodities;  \n \n6. \nUnderscores the need to adopt science, technology and innovation strategies \nas integral elements of national sustainable development plans and strategies that help \nto strengthen knowledge-sharing on mutually agreed terms and collaboration and scale \nup investment in science, technology, engineering and mathematics education, and \nenhance technical, vocational and tertiary education and training;  \n \n7. \nAcknowledges the contribution of science, technology and innovation to \nindustrial development in developing countries and as a critical source of economic \ngrowth, economic diversification and value addition;  \n \n8. \nRecognizes the importance of addressing the gap in capabilities across and \nbetween countries, sectors and segments of society so that all parts of society, \nespecially people in vulnerable situations and the poor, can adapt and benefit from \ntechnological changes;  \n \n9. \nAlso recognizes the importance of the creation of a conducive environment \nthat attracts and supports private investment, entrepreneurship and corporate social \nresponsibility, including an efficient, adequate, balanced and effective intellectual \nproperty framework, while encouraging access to science, technology and innovation \nby developing countries;  \n__________________ \n \n12  Resolution 69/313, annex. \n \n13  Resolution 76/258, annex. \n \n14  Report of the Fifth United Nations Conference on the Least Developed Countries, New York, \n17 March 2022, and Doha, 5\u20139 March 2023 (A/CONF.219/2023/3), chap. I, resolution 2. \n\nA/RES/78/160 \nScience, technology and innovation for sustainable development\n \n23-25892\n8/12 \n \n \n10. Encourages Member States to strengthen and foster investment in research \nand development for environmentally sound technologies and to promote the \ninvolvement of the business and financial sectors in the development of those \ntechnologies, and invites the international community to support those efforts; \n \n11. \nEncourages all stakeholders, in an effort to prepare for existing and future \nopportunities and challenges presented by technological change, including the fourth \nindustrial revolution among others, to explore ways and means of conducting \ninclusive national, regional and international technology assessment and foresight \nexercises on existing, new and emerging technologies to help to evaluate their \ndevelopment potential and mitigate possible negative effects and risks;  \n \n12. Requests the Technology Facilitation Mechanism and the Commission on \nScience and Technology for Development, through the Economic and Social Council, \nto continue to consider, in a coordinated manner within their respective mandates and \nexisting resources, the impact of rapid technological changes and frontier technologies \non the achievement of the Sustainable Development Goals and targets, and to align \nthis endeavour with the follow-up cycle of the high-level political forum on sustainable \ndevelopment in order to support the efforts of all countries towards the attainment of \nthe Goals, including through forging partnerships with other relevant stakeholders, \norganizations, initiatives and forums, such as the Partnership in Action on STI for \nSDGs Road Maps, initiated by the United Nations inter-agency task team on science, \ntechnology and innovation for the Sustainable Development Goals, and the \ndissemination of advances and best practices to facilitate cooperation towards this end;  \n \n13. Welcomes the support by the Department of Economic and Social Affairs \nof the Secretariat and the Economic Commission for Africa for the establishment of \nthe Coalition on Science, Technology, and Innovation for Africa\u2019s Development \nduring the eighth multi-stakeholder forum on science, technology and innovation for \nthe Sustainable Development Goals to create pathways for African countries to \ndevelop, deploy and expand their use of science, technology and innovation in the \ncontext of the Sustainable Development Goals;  \n \n14. Encourages Member States, individually and collectively, to support \npolicies that increase financial inclusion, including through making use of financial \ntechnology, with a view to deepening and diversifying the sources of financing and \nof direct investments towards science, technology and innovations that address the \nSustainable Development Goals;15 \n \n15. Also encourages Member States to promote local innovation capabilities \nfor inclusive and sustainable economic development by bringing together local \nscientific, vocational and engineering knowledge, mobilizing resources from multiple \nchannels, improving information and communications technology and supporting \ninfrastructure development;  \n \n16. Further encourages Member States to promote digital inclusion and \nliteracy and to consider incorporating digital competencies into the education system, \nwith a special focus on encouraging girls and enhancing digital skills and \ncompetences development, including through investment in digital qualification, \nspecialization in digital technologies, digital infrastructure, public policies and \ninstitutional development and multi-stakeholder and international collaboration;  \n \n17. Underlines that addressing persistent barriers to equal access for women \nand girls to science, technology and innovation, and their meaningful participation in \nlearning, as well as workforce opportunities for women requires a systematic, \ncomprehensive, integrated, sustainable, multidisciplinary and multisectoral approach, \n__________________ \n \n15  See resolution 70/1. \n\nScience, technology and innovation for sustainable development \nA/RES/78/160\n \n9/12\n23-25892 \n \nin this regard urges Member States to mainstream a gender perspective in legislation, \npolicies and programmes, encourages decision makers to create supportive workplace \nand educational settings, and also encourages efforts to promote, mentor, attract and \nretain women and girls in science, technology, engineering and mathematics \neducation and research and to support women in leveraging science and technology \nfor entrepreneurship and economic empowerment in the changing world of work;  \n \n18. Emphasizes the importance of the participation of women and girls in \nscience, technology and innovation, and further encourages the United Nations \ndevelopment system to support efforts to reduce gender disparity in these areas, with the \ncooperation of Member States and international collaborative research organizations;  \n \n19. Also emphasizes that efforts to close all digital divides and ensure that no \none is left behind in the digital transformation and digital economy should be \nexpanded and grounded in digital inclusion, and encourages all relevant stakeholders \nto promote equal, equitable and affordable access to digital skills and online services, \nincluding through digital public goods and digital government;  \n \n20. Notes the importance of facilitating access to and sharing accessible and \nassistive technologies, through the transfer of technology on mutually agreed terms \nand other actions, to advance disability-inclusive development, ensure accessibility \nfor persons with disabilities and promote their empowerment;  \n \n21. Also notes the critical role of science, technology and innovation in \naccelerating the recovery from the coronavirus disease (COVID-19) pandemic, and \nthat in order to facilitate a more robust and resilient recovery, a strong global \nfinancing framework for development in science, technology and innovation, should \nbe considered to bridge the digital divides, promote sustainable development and \nensure flexibility and resilience in the face of future disruptions, highlighting how \nopen-source technology could facilitate knowledge-sharing on mutually agreed terms \nand respond to common challenges across countries, reaffirming the World Trade \nOrganization Agreement on Trade-Related Aspects of Intellectual Property Rights \n(TRIPS Agreement) as amended, also reaffirming the 2001 World Trade Organization \nDoha Declaration on the TRIPS Agreement and Public Health, which recognizes that \nintellectual property rights should be interpreted and implemented in a manner \nsupportive of the right of States to protect public health and, in particular, to promote \naccess to medicines for all, and reaffirms the need for appropriate incentives in the \ndevelopment of new health products;  \n \n22. Encourages efforts to increase the availability of data to support the \nmeasurement of national innovation systems (such as the existing Global Innovation \nIndex) and empirical research on innovation and development to assist policymakers \nin designing and implementing innovation strategies in order to measure the impact \nof digital technologies for sustainable development;  \n \n23. Emphasizes the need to effectively harness technology to bridge the digital \ndivides within countries and between developed and developing countries;  \n \n24. Calls for action to be taken to enhance the ability of developing countries \nto benefit from science, technology and innovation and address the major structural \nimpediments to accessing new and emerging technologies, including through scaling \nup the use of open science, affordable and open-source technology, research and \ndevelopment, including through strengthened partnerships, strengthening their \nproductive capacities and aiming to increase funding for Sustainable Development \nGoal-related research and innovation and build capacity in all regions to contribute \nto and benefit from this research;  \n \n25. Encourages enhanced capacity-building support for developing countries \nin order to generate the use of high-quality, timely and reliable disaggregated data, \n\nA/RES/78/160 \nScience, technology and innovation for sustainable development\n \n23-25892\n10/12 \n \nand also encourages international cooperation, including through technical and \nfinancial support, to strengthen the capacity of national statistical systems;  \n \n26. Also encourages existing arrangements and the further promotion of \ninternational, regional, subregional and interregional joint multi-stakeholder research \nand development projects, as well as training programmes and university-to-\nuniversity collaborations where feasible, by mobilizing scientific and research \ndevelopment resources, facilities and equipment;  \n \n27. Calls upon Member States and the United Nations development system, \nand encourages other stakeholders, as appropriate, to continue to initiate, implement \nand support measures to improve the level of participation of scientists and engineers \nfrom developing countries in international collaborative research, science, technology \nand innovation projects;  \n \n28. Also calls upon Member States and the United Nations development \nsystem, and encourages other stakeholders, as appropriate, to continue to strengthen \ntheir support for the different science, technology and innovation partnerships with \ndeveloping countries in primary, secondary and higher education, vocational \neducation and continuing education; business opportunities for the private sector; \nscience, technology and innovation infrastructure; and science, technology and \ninnovation advice for developing countries;  \n \n29. Requests the Commission on Science and Technology for Development to \ncontinue to assist the Economic and Social Council as the focal point in the system-\nwide follow-up to the outcomes of the World Summit on the Information Society and \nto continue its science, technology and innovation activities;  \n \n30. Encourages the Commission on Science and Technology for Development \nto discuss and explore innovative financing models, such as impact investment, as a \nmeans of attracting new stakeholders, innovators and sources of investment capital \nfor science, technology, engineering and innovation-based solutions, in collaboration \nwith other organizations, where appropriate;  \n \n31. Encourages the United Nations Conference on Trade and Development, in \ncollaboration with relevant partners, such as the World Intellectual Property \nOrganization, the International Telecommunication Union, the United Nations \nEducational, Scientific and Cultural Organization and the United Nations University, \nto continue to undertake science, technology and innovation policy reviews, with a \nview to assisting developing countries, upon request, in identifying the measures \nneeded to integrate science, technology and innovation policies into their national \ndevelopment strategies and ensuring that they are supportive of national development \nagendas, as appropriate, and in this regard takes note of the new science, technology \nand innovation policy review framework developed by the United Nations \nConference on Trade and Development;  \n \n32. Emphasizes the importance of better coordination and coherence among \nexisting mechanisms, including the Technology Facilitation Mechanism, United \nNations agencies and international organizations in providing support to Member \nStates in the field of science, technology and innovation directed towards \ndevelopment priorities and needs;  \n \n33. Invites the Commission on Science and Technology for Development and \nthe Technology Facilitation Mechanism to strengthen synergies and mutually \nreinforce their work on science, technology and innovation, and invites the Secretariat \nto coordinate the dates of their meetings in order to avoid overlap and to ensure \ncoherence and coordination between both entities;  \n\nScience, technology and innovation for sustainable development \nA/RES/78/160\n \n11/12\n23-25892 \n \n \n34. Continues to encourage the United Nations inter-agency task team on \nscience, technology and innovation for the Sustainable Development Goals to further \nrefine and update its mapping of science, technology and innovation activities in the \nUnited Nations system with a view to guiding further efforts at collaboration and \ncapacity-building and formulating coherent advice for Member States advancing \nnational science, technology and innovation frameworks within the 2030 Agenda, \nincluding through scaling up the Global Pilot Programme on Science, Technology and \nInnovation for Sustainable Development Goals Road Maps;  \n \n35. Reiterates its call for voluntary contributions for resources from both the \nprivate and the public sectors to support the full operationalization of all components \nof the Technology Facilitation Mechanism;  \n \n36. Encourages the World Intellectual Property Organization to continue to \nundertake technical support activities, including helping countries to design, develop \nand implement national intellectual property and innovation strategies aligned with \ntheir development strategies;  \n \n37. Welcomes the operationalization of the Technology Bank for the Least \nDeveloped Countries, and calls upon Member States and other stakeholders to provide \nvoluntary funding to the trust fund of the Technology Bank so that it can pursue its \nobjectives in the area of science, technology and innovation for the least developed \ncountries;  \n \n38. Notes with deep concern the existing disparities between developed and \ndeveloping countries in terms of conditions, possibilities and capacities to produce \nnew scientific and technological knowledge, and in this regard urges developed \ncountries to urgently mobilize means of implementation such as technology transfer \non mutually agreed terms, technical assistance, capacity-building and financing \nthrough new, additional and predictable resources in relation to the needs of \ndeveloping countries, as appropriate, for the production of new scientific and \ntechnological knowledge, in accordance with developing countries\u2019 national needs, \npolicies and priorities;  \n \n39. Notes with concern that unfair practices could hinder technological \ndevelopment and innovation worldwide, in particular in developing countries, and \ncalls upon the international community to foster an open, fair and inclusive \nenvironment for scientific and technological development;  \n \n40. Continues to encourage the United Nations system to take an active role in \nforging a closer link with national and multilateral science advisory bodies to optimally \nleverage science, technology and innovation for the Sustainable Development Goals, \nand looks forward to receiving updates and outcomes of the actions through the report \nof the Commission on Science and Technology for Development; \n \n41. Calls upon the United Nations funds and programmes and the specialized \nagencies, the international community and international institutions, at the request of \nMember States, to support the efforts of the countries of the South to develop and \nstrengthen their national science, technology and innovation systems through North-\nSouth, regional and international cooperation, including South-South and triangular \ncooperation, on access to science, technology, innovation and knowledge-sharing on \nmutually agreed terms;  \n \n42. Recognizes the importance of creating synergies, developing expertise and \nboosting resources in various regions and institutions, and in this regard takes note of \nthe Summit on Science, Technology and Innovation of the Group of 77, held in \nHavana in September 2023, as an effort to boost cooperation in this field;  \n\nA/RES/78/160 \nScience, technology and innovation for sustainable development\n \n23-25892\n12/12 \n \n \n43. Reiterates its call for continued collaboration between United Nations \nentities and other international organizations, civil society and the private sector in \nimplementing the outcomes of the World Summit on the Information Society;  \n \n44. Reaffirms the commitment at the very heart of the 2030 Agenda to leave \nno one behind and commit to taking more tangible steps to support people in \nvulnerable situations and the most vulnerable countries and to reach the furthest \nbehind first;  \n \n45. Invites the President of the General Assembly to consider convening, \nduring the eightieth session of the Assembly, a meeting on science, technology and \ninnovation for development with a special focus on actions to address the needs of \ndeveloping countries in those fields, and requests the Secretary-General to consider \nthese discussions in the drafting of his report on the implementation of the present \nresolution;  \n \n46. Requests the Secretary-General to submit to the General Assembly at its \neightieth session a report on the implementation of the present resolution and \nrecommendations for future follow-up, including lessons learned in integrating \nscience, technology and innovation policies into national development strategies, as \nwell as concrete recommendations in supporting the implementation of the 2030 \nAgenda, and decides to include in the provisional agenda of its eightieth session, \nunder the item entitled \u201cGlobalization and interdependence\u201d, the sub-item entitled \n\u201cScience, technology and innovation for sustainable development\u201d. \n \n49th plenary meeting \n19 December 2023 \n \n",
  "paragraphs": {
    "1": "Reaffirms its commitments made in the Addis Ababa Action Agenda of the Third International Conference on Financing for Development 12 on, inter alia, science, technology and innovation, as an important action area for sustainable development;",
    "2": "Also reaffirms its commitment to continue promoting the use of science, technology and innovation, including through evidence-based policymaking, in facilitating efforts to address global challenges, and to accelerate progress on the achievement of the Sustainable Development Goals, such as efforts to eradicate poverty, including extreme poverty; achieve food security and nutrition; increase agricultural productivity; enhance access to affordable, reliable, sustainable and modern energy for all; fight diseases; improve education; protect the environment and address climate change; foster disaster preparedness and strengthen the effectiveness and efficiency of disaster resilience-building;",
    "3": "Emphasizes that applying science to solve complex global challenges calls for cross- and trans-disciplinary collaboration and a strong science-policy-society interface in order to build trust in science and evidence;",
    "4": "Reaffirms its commitment to the actions agreed upon by the least developed countries and development partners on science, technology and innovation, as outlined in the Doha Programme of Action for the Least Developed Countries, 13 and takes note of the Doha Political Declaration, adopted during the second part of the Fifth United Nations Conference on the Least Developed Countries, held in Doha, from 5 to 9 March 2023;14",
    "5": "Notes the central role of Governments, with active contribution from stakeholders from the private sector, civil society, academia and research institutions, appropriate United Nations entities, relevant international entities and forums, in creating and supporting an enabling environment at all levels, including enabling regulatory and governance frameworks, in accordance with national priorities, to nurture science, innovation, entrepreneurship and the dissemination of knowledge and technologies that is on mutually agreed terms, particularly to micro-, small and medium- sized enterprises, as well as industrial diversification and value added to commodities;",
    "6": "Underscores the need to adopt science, technology and innovation strategies as integral elements of national sustainable development plans and strategies that help to strengthen knowledge-sharing on mutually agreed terms and collaboration and scale up investment in science, technology, engineering and mathematics education, and enhance technical, vocational and tertiary education and training;",
    "7": "Acknowledges the contribution of science, technology and innovation to industrial development in developing countries and as a critical source of economic growth, economic diversification and value addition;",
    "8": "Recognizes the importance of addressing the gap in capabilities across and between countries, sectors and segments of society so that all parts of society, especially people in vulnerable situations and the poor, can adapt and benefit from technological changes;",
    "9": "Also recognizes the importance of the creation of a conducive environment that attracts and supports private investment, entrepreneurship and corporate social responsibility, including an efficient, adequate, balanced and effective intellectual property framework, while encouraging access to science, technology and innovation by developing countries;",
    "10": "Encourages Member States to strengthen and foster investment in research and development for environmentally sound technologies and to promote the involvement of the business and financial sectors in the development of those technologies, and invites the international community to support those efforts;",
    "11": "Encourages all stakeholders, in an effort to prepare for existing and future opportunities and challenges presented by technological change, including the fourth industrial revolution among others, to explore ways and means of conducting inclusive national, regional and international technology assessment and foresight exercises on existing, new and emerging technologies to help to evaluate their development potential and mitigate possible negative effects and risks;",
    "12": "Requests the Technology Facilitation Mechanism and the Commission on Science and Technology for Development, through the Economic and Social Council, to continue to consider, in a coordinated manner within their respective mandates and existing resources, the impact of rapid technological changes and frontier technologies on the achievement of the Sustainable Development Goals and targets, and to align this endeavour with the follow-up cycle of the high-level political forum on sustainable development in order to support the efforts of all countries towards the attainment of the Goals, including through forging partnerships with other relevant stakeholders, organizations, initiatives and forums, such as the Partnership in Action on STI for SDGs Road Maps, initiated by the United Nations inter-agency task team on science, technology and innovation for the Sustainable Development Goals, and the dissemination of advances and best practices to facilitate cooperation towards this end;",
    "13": "Welcomes the support by the Department of Economic and Social Affairs of the Secretariat and the Economic Commission for Africa for the establishment of the Coalition on Science, Technology, and Innovation for Africa\u2019s Development during the eighth multi-stakeholder forum on science, technology and innovation for the Sustainable Development Goals to create pathways for African countries to develop, deploy and expand their use of science, technology and innovation in the context of the Sustainable Development Goals;",
    "14": "Encourages Member States, individually and collectively, to support policies that increase financial inclusion, including through making use of financial technology, with a view to deepening and diversifying the sources of financing and of direct investments towards science, technology and innovations that address the Sustainable Development Goals;15",
    "15": "Also encourages Member States to promote local innovation capabilities for inclusive and sustainable economic development by bringing together local scientific, vocational and engineering knowledge, mobilizing resources from multiple channels, improving information and communications technology and supporting infrastructure development;",
    "16": "Further encourages Member States to promote digital inclusion and literacy and to consider incorporating digital competencies into the education system, with a special focus on encouraging girls and enhancing digital skills and competences development, including through investment in digital qualification, specialization in digital technologies, digital infrastructure, public policies and institutional development and multi-stakeholder and international collaboration;",
    "17": "Underlines that addressing persistent barriers to equal access for women and girls to science, technology and innovation, and their meaningful participation in learning, as well as workforce opportunities for women requires a systematic, comprehensive, integrated, sustainable, multidisciplinary and multisectoral approach, in this regard urges Member States to mainstream a gender perspective in legislation, policies and programmes, encourages decision makers to create supportive workplace and educational settings, and also encourages efforts to promote, mentor, attract and retain women and girls in science, technology, engineering and mathematics education and research and to support women in leveraging science and technology for entrepreneurship and economic empowerment in the changing world of work;",
    "18": "Emphasizes the importance of the participation of women and girls in science, technology and innovation, and further encourages the United Nations development system to support efforts to reduce gender disparity in these areas, with the cooperation of Member States and international collaborative research organizations;",
    "19": "Also emphasizes that efforts to close all digital divides and ensure that no one is left behind in the digital transformation and digital economy should be expanded and grounded in digital inclusion, and encourages all relevant stakeholders to promote equal, equitable and affordable access to digital skills and online services, including through digital public goods and digital government;",
    "20": "Notes the importance of facilitating access to and sharing accessible and assistive technologies, through the transfer of technology on mutually agreed terms and other actions, to advance disability-inclusive development, ensure accessibility for persons with disabilities and promote their empowerment;",
    "21": "Also notes the critical role of science, technology and innovation in accelerating the recovery from the coronavirus disease (COVID-19) pandemic, and that in order to facilitate a more robust and resilient recovery, a strong global financing framework for development in science, technology and innovation, should be considered to bridge the digital divides, promote sustainable development and ensure flexibility and resilience in the face of future disruptions, highlighting how open-source technology could facilitate knowledge-sharing on mutually agreed terms and respond to common challenges across countries, reaffirming the World Trade Organization Agreement on Trade-Related Aspects of Intellectual Property Rights (TRIPS Agreement) as amended, also reaffirming the 2001 World Trade Organization Doha Declaration on the TRIPS Agreement and Public Health, which recognizes that intellectual property rights should be interpreted and implemented in a manner supportive of the right of States to protect public health and, in particular, to promote access to medicines for all, and reaffirms the need for appropriate incentives in the development of new health products;",
    "22": "Encourages efforts to increase the availability of data to support the measurement of national innovation systems (such as the existing Global Innovation Index) and empirical research on innovation and development to assist policymakers in designing and implementing innovation strategies in order to measure the impact of digital technologies for sustainable development;",
    "23": "Emphasizes the need to effectively harness technology to bridge the digital divides within countries and between developed and developing countries;",
    "24": "Calls for action to be taken to enhance the ability of developing countries to benefit from science, technology and innovation and address the major structural impediments to accessing new and emerging technologies, including through scaling up the use of open science, affordable and open-source technology, research and development, including through strengthened partnerships, strengthening their productive capacities and aiming to increase funding for Sustainable Development Goal-related research and innovation and build capacity in all regions to contribute to and benefit from this research;",
    "25": " and also encourages international cooperation, including through technical and financial support, to strengthen the capacity of national statistical systems;",
    "26": "Also encourages existing arrangements and the further promotion of international, regional, subregional and interregional joint multi-stakeholder research and development projects, as well as training programmes and university-to- university collaborations where feasible, by mobilizing scientific and research development resources, facilities and equipment;",
    "27": "Calls upon Member States and the United Nations development system, and encourages other stakeholders, as appropriate, to continue to initiate, implement and support measures to improve the level of participation of scientists and engineers from developing countries in international collaborative research, science, technology and innovation projects;",
    "28": "Also calls upon Member States and the United Nations development system, and encourages other stakeholders, as appropriate, to continue to strengthen their support for the different science, technology and innovation partnerships with developing countries in primary, secondary and higher education, vocational education and continuing education; business opportunities for the private sector; science, technology and innovation infrastructure; and science, technology and innovation advice for developing countries;",
    "29": "Requests the Commission on Science and Technology for Development to continue to assist the Economic and Social Council as the focal point in the system- wide follow-up to the outcomes of the World Summit on the Information Society and to continue its science, technology and innovation activities;",
    "30": "Encourages the Commission on Science and Technology for Development to discuss and explore innovative financing models, such as impact investment, as a means of attracting new stakeholders, innovators and sources of investment capital for science, technology, engineering and innovation-based solutions, in collaboration with other organizations, where appropriate;",
    "31": "Encourages the United Nations Conference on Trade and Development, in collaboration with relevant partners, such as the World Intellectual Property Organization, the International Telecommunication Union, the United Nations Educational, Scientific and Cultural Organization and the United Nations University, to continue to undertake science, technology and innovation policy reviews, with a view to assisting developing countries, upon request, in identifying the measures needed to integrate science, technology and innovation policies into their national development strategies and ensuring that they are supportive of national development agendas, as appropriate, and in this regard takes note of the new science, technology and innovation policy review framework developed by the United Nations Conference on Trade and Development;",
    "32": "Emphasizes the importance of better coordination and coherence among existing mechanisms, including the Technology Facilitation Mechanism, United Nations agencies and international organizations in providing support to Member States in the field of science, technology and innovation directed towards development priorities and needs;",
    "33": "",
    "34": "Continues to encourage the United Nations inter-agency task team on science, technology and innovation for the Sustainable Development Goals to further refine and update its mapping of science, technology and innovation activities in the United Nations system with a view to guiding further efforts at collaboration and capacity-building and formulating coherent advice for Member States advancing national science, technology and innovation frameworks within the 2030 Agenda, including through scaling up the Global Pilot Programme on Science, Technology and Innovation for Sustainable Development Goals Road Maps;",
    "35": "Reiterates its call for voluntary contributions for resources from both the private and the public sectors to support the full operationalization of all components of the Technology Facilitation Mechanism;",
    "36": "Encourages the World Intellectual Property Organization to continue to undertake technical support activities, including helping countries to design, develop and implement national intellectual property and innovation strategies aligned with their development strategies;",
    "37": "Welcomes the operationalization of the Technology Bank for the Least Developed Countries, and calls upon Member States and other stakeholders to provide voluntary funding to the trust fund of the Technology Bank so that it can pursue its objectives in the area of science, technology and innovation for the least developed countries;",
    "38": "Notes with deep concern the existing disparities between developed and developing countries in terms of conditions, possibilities and capacities to produce new scientific and technological knowledge, and in this regard urges developed countries to urgently mobilize means of implementation such as technology transfer on mutually agreed terms, technical assistance, capacity-building and financing through new, additional and predictable resources in relation to the needs of developing countries, as appropriate, for the production of new scientific and technological knowledge, in accordance with developing countries\u2019 national needs, policies and priorities;",
    "39": "Notes with concern that unfair practices could hinder technological development and innovation worldwide, in particular in developing countries, and calls upon the international community to foster an open, fair and inclusive environment for scientific and technological development;",
    "40": "Continues to encourage the United Nations system to take an active role in forging a closer link with national and multilateral science advisory bodies to optimally leverage science, technology and innovation for the Sustainable Development Goals, and looks forward to receiving updates and outcomes of the actions through the report of the Commission on Science and Technology for Development;",
    "41": "Calls upon the United Nations funds and programmes and the specialized agencies, the international community and international institutions, at the request of Member States, to support the efforts of the countries of the South to develop and strengthen their national science, technology and innovation systems through North- South, regional and international cooperation, including South-South and triangular cooperation, on access to science, technology, innovation and knowledge-sharing on mutually agreed terms;",
    "42": "",
    "43": "Reiterates its call for continued collaboration between United Nations entities and other international organizations, civil society and the private sector in implementing the outcomes of the World Summit on the Information Society;",
    "44": "Reaffirms the commitment at the very heart of the 2030 Agenda to leave no one behind and commit to taking more tangible steps to support people in vulnerable situations and the most vulnerable countries and to reach the furthest behind first;",
    "45": "Invites the President of the General Assembly to consider convening, during the eightieth session of the Assembly, a meeting on science, technology and innovation for development with a special focus on actions to address the needs of developing countries in those fields, and requests the Secretary-General to consider these discussions in the drafting of his report on the implementation of the present resolution;",
    "46": "Requests the Secretary-General to submit to the General Assembly at its eightieth session a report on the implementation of the present resolution and recommendations for future follow-up, including lessons learned in integrating science, technology and innovation policies into national development strategies, as well as concrete recommendations in supporting the implementation of the 2030 Agenda, and decides to include in the provisional agenda of its eightieth session, under the item entitled \u201cGlobalization and interdependence\u201d, the sub-item entitled \u201cScience, technology and innovation for sustainable development\u201d."
  },
  "agenda_items": [
    "Item 19"
  ],
  "symbol_references": []
}