{
  "symbol": "A/RES/76/262",
  "filename": "A_RES_76_262.pdf",
  "title": "76/262. Standing mandate for a General Assembly debate when a veto is cast in the Security Council",
  "text": "United Nations \nA/RES/76/262\n \n \nGeneral Assembly \nDistr.: General \n28 April 2022 \n \n22-06243 (E)    040522 \n*2206243* \n \n \nSeventy-sixth session \nAgenda item 124 \nStrengthening of the United Nations system \n \n \n \n \n Resolution adopted by the General Assembly \non 26 April 2022 \n \n \n \n \n[without reference to a Main Committee (A/76/L.52 and A/76/L.52/Add.1)] \n \n \n 76/262. Standing mandate for a General Assembly debate when a veto is \ncast in the Security Council \n \n \n \nThe General Assembly, \n \nGuided by the purposes and principles of the Charter of the United Nations, \n \nRecalling its authority under Article 10 of the Charter, \n \nRecalling also Article 12 of the Charter, \n \nRecalling further Article 24 (1) of the Charter, which provides that, in order to \nensure prompt and effective action by the United Nations, its Members have conferred \non the Security Council primary responsibility for the maintenance of international \npeace and security, and agreed that in carrying out its duties under this responsibility \nthe Security Council acts on their behalf, \n \nRecalling Article 27 of the Charter on voting in the Security Council, \n \nRecalling also the provisions of the Charter relating to the powers and functions \nof the General Assembly in matters pertaining to the maintenance of international \npeace and security, \n \nRecalling further that the International Court of Justice has observed the \ncompetence of the General Assembly on questions relating to the maintenance of \ninternational peace and security, \n \nBearing in mind its decision 62/557 of 15 September 2008, and noting that the \npresent resolution and its provisions are without prejudice to the intergovernmental \nnegotiations on Security Council reform, \n \n1. \nDecides that the President of the General Assembly shall convene a formal \nmeeting of the General Assembly within 10 working days of the casting of a veto by \none or more permanent members of the Security Council, to hold a debate on the \n\nA/RES/76/262 \nStanding mandate for a General Assembly debate \nwhen a veto is cast in the Security Council\n \n22-06243\n2/2 \n \nsituation as to which the veto was cast, provided that the Assembly does not meet in \nan emergency special session on the same situation; \n \n2. \nAlso decides, on an exceptional basis, to accord precedence in the list of \nspeakers to the permanent member or permanent members of the Security Council \nhaving cast a veto; \n \n3. \nInvites the Security Council, in accordance with Article 24 (3) of the \nCharter of the United Nations, to submit a special report on the use of the veto in \nquestion to the General Assembly at least 72 hours before the relevant discussion in \nthe Assembly; \n \n4. \nDecides to include in the provisional agenda of its seventy-seventh session \nan item entitled \u201cUse of the veto\u201d, and that the item should remain on the agenda of \nthe Assembly for consideration in accordance with paragraph 1 of the present \nresolution; \n \n5. \nAlso decides that, should a veto be cast by one or more permanent members \nof the Security Council during the remainder of the seventy-sixth session of the \nGeneral Assembly, the President of the General Assembly shall convene a formal \nmeeting of the Assembly, in accordance with paragraph 1 of the present resolution, \nunder the agenda item entitled \u201cStrengthening of the United Nations system\u201d. \n \n69th plenary meeting \n26 April 2022 \n \n",
  "paragraphs": {
    "1": "Decides that the President of the General Assembly shall convene a formal meeting of the General Assembly within 10 working days of the casting of a veto by one or more permanent members of the Security Council, to hold a debate on the A/RES/76/262 Standing mandate for a General Assembly debate when a veto is cast in the Security Council 22-06243 2/2 situation as to which the veto was cast, provided that the Assembly does not meet in an emergency special session on the same situation;",
    "2": "Also decides, on an exceptional basis, to accord precedence in the list of speakers to the permanent member or permanent members of the Security Council having cast a veto;",
    "3": "Invites the Security Council, in accordance with Article 24 (3) of the Charter of the United Nations, to submit a special report on the use of the veto in question to the General Assembly at least 72 hours before the relevant discussion in the Assembly;",
    "4": "Decides to include in the provisional agenda of its seventy-seventh session an item entitled \u201cUse of the veto\u201d, and that the item should remain on the agenda of the Assembly for consideration in accordance with paragraph 1 of the present resolution;",
    "5": "Also decides that, should a veto be cast by one or more permanent members of the Security Council during the remainder of the seventy-sixth session of the General Assembly, the President of the General Assembly shall convene a formal meeting of the Assembly, in accordance with paragraph 1 of the present resolution, under the agenda item entitled \u201cStrengthening of the United Nations system\u201d. 69th plenary meeting 26 April 2022"
  },
  "agenda_items": [
    "Item 124"
  ],
  "symbol_references": [
    "A/76/L.52"
  ]
}