{
  "symbol": "A/RES/72/143",
  "filename": "A_RES_72_143.pdf",
  "title": "72/143. Cooperatives in social development",
  "text": "United Nations \nA/RES/72/143\n \n \nGeneral Assembly \nDistr.: General \n17 January 2018 \n \n17-22931 (E)    220118 \n*1722931* \n \n \nSeventy-second session \nAgenda item 27 (b) \n \n \n \n \n Resolution adopted by the General Assembly \non 19 December 2017 \n \n \n \n \n[on the report of the Third Committee (A/72/431)] \n \n \n 72/143. Cooperatives in social development \n \n \n \nThe General Assembly,  \n \nRecalling its resolutions 47/90 of 16 December 1992, 49/155 of 23 December \n1994, 51/58 of 12 December 1996, 54/123 of 17 December 1999, 56/114 of \n19 December 2001, 58/131 of 22 December 2003, 60/132 of 16 December 2005, \n62/128 of 18 December 2007, 64/136 of 18 December 2009, 65/184 of 21 December \n2010, 66/123 of 19 December 2011, 68/133 of 18 December 2013 and 70/128 of \n17 December 2015 concerning cooperatives in social development, \n \nRecognizing that cooperatives, in their various forms, promote the fullest \npossible participation in the economic and social development of local communities \nand all people, including women, youth, older persons, persons with disabilities and \nindigenous peoples, are becoming a significant factor of economic and social \ndevelopment and contribute to the eradication of poverty and hunger, \n \nRecognizing also that as cooperative enterprises often serve the socially \nexcluded and vulnerable sectors of the population that profit-driven businesses tend \nto neglect, they are therefore important for the support of socially inclusive policies \nthat drive inclusive development, particularly in developing countries,  \n \nRecognizing further the important contribution and potential of all forms of \ncooperatives to the follow-up to the World Summit for Social Development and the \nFourth World Conference on Women, including their five-year reviews, the United \nNations Conference on Housing and Sustainable Urban Development (Habitat III), \nthe World Food Summit, the Second World Assembly on Ageing, the International \nConference on Financing for Development, the World Summit on Sustainable \nDevelopment and the United Nations summit for the adoption of the post-2015 \ndevelopment agenda,  \n \nWelcoming the adoption of the outcome document of the United Nations \nsummit, entitled \u201cTransforming our world: the 2030 Agenda for Sustainable \n\nA/RES/72/143 \nCooperatives in social development\n \n17-22931 \n2/3 \n \nDevelopment\u201d,1 and the Addis Ababa Action Agenda of the Third International \nConference on Financing for Development,2 and noting the acknowledgement therein \nof the role of cooperatives in the implementation of the 2030 Agenda and in relation \nto financing for development, \n \nNoting with appreciation the potential role of cooperative development in the \nimprovement of the social and economic conditions of indigenous peoples and rural \ncommunities,  \n \nWelcoming the efforts of the Food and Agriculture Organization of the United \nNations to showcase the role of agricultural cooperatives, including in improving food \nsecurity and nutrition, particularly in rural areas, promoting sustainable agricultural \npractices, improving the agricultural productivity of farmers and facilitating access \nto markets, savings, credit, insurance and technology,  \n \n1. \nTakes note of the report of the Secretary-General;3   \n \n2. \nNotes with appreciation the celebration of the International Year of \nCooperatives, in 2012;  \n \n3. \nEncourages all Member States, as well as the United Nations and all other \nrelevant stakeholders, to share best practices identified through activities \nimplemented during the International Year of Cooperatives and to continue those \nactivities, as appropriate;  \n \n4. \nRecalls the draft plan of action on cooperatives for 2012 and beyond, based \non the outcome document of the expert group meeting held in Ulaanbaatar in 2011 \nfor the promotion of cooperatives for sustainable socioeconomic development, to \npromote focused and effective follow-up to the activities of the International Year, \nwithin existing resources;  \n \n5. \nDraws the attention of Governments to the recommendations contained in \nthe report of the Secretary-General to focus support on cooperatives as sustainable \nand successful business enterprises that contribute directly to employment generation, \npoverty and hunger eradication, education, social protection and the creation of \naffordable housing options across a variety of economic sectors in urban and rural \nareas and to review existing legislation and regulations to make the national legal and \nregulatory environment more conducive to the creation and growth of cooperatives \nby improving existing laws and regulations and/or by establishing new ones, \nespecially in the areas of access to capital, competitiveness and fair taxation; \n \n6. \nInvites Governments and international organizations, in partnership with \ncooperatives and cooperative organizations, to strengthen and build the capacity of \nall forms of cooperatives, especially those run by the poor, young people, women, \npersons with disabilities and other vulnerable groups, so that they can empower \npeople to transform their lives and communities positively and build inclusive \nsocieties;  \n \n7. \nInvites Governments to strengthen efforts to enhance food security and \nnutrition and to focus efforts on smallholders and women farmers, as well as on \nagricultural cooperatives and farmers\u2019 networks, supported by measures to improve \naccess to markets, enable domestic and international environments and strengthen \ncollaboration across the many initiatives in this area, including regional initiatives; \n__________________ \n \n1  Resolution 70/1. \n \n2  Resolution 69/313, annex. \n \n3  A/72/159. \n\nCooperatives in social development \nA/RES/72/143\n \n3/3 \n17-22931 \n \n \n8. \nEncourages Governments to promote access to information and \ncommunications technologies as a vital channel for collaboration and the expansion \nof cooperatives, especially in rural areas;  \n \n9. \nAlso encourages Governments to intensify and expand the availability, \naccessibility and dissemination of evidence-based research on the operations and \ncontribution of cooperatives, to develop a statistical framework for the systematic \ncollection of comprehensive data on and the best practices of cooperative enterprises, \nin collaboration with all stakeholders, and to raise public awareness of the linkages \nbetween cooperatives and sustainable development, especially in the areas of social \ninclusion, employment creation, poverty eradication, inequality reduction and \npeacebuilding; \n \n10. Invites Governments, relevant international organizations, the specialized \nagencies and local, national and international cooperative organizations to continue \nto observe the International Day of Cooperatives annually, on the first Saturday of \nJuly, as proclaimed by the General Assembly in its resolution 47/90;  \n \n11. \nInvites Governments, in collaboration with the cooperative movement, to \ndevelop programmes aimed at enhancing the capacity-building of cooperatives, \nincluding by strengthening the organizational, management and financial skills of \ntheir members, while respecting the principles of gender equality and the \nempowerment of women and girls, and to introduce and support programmes to \nimprove the access of cooperatives to new technologies; \n \n12. Requests the Secretary-General, in cooperation with the relevant United \nNations and other international organizations and national, regional and international \ncooperative organizations, to continue rendering support to Member States, as \nappropriate, in their efforts to create a supportive environment for the development \nof cooperatives, integrating cooperative values, principles and business models into \neducational programming, including school curricula, as appropriate, providing \nassistance for human resources development, technical advice and training and \npromoting an exchange of experience and best practices through, inter alia, \nconferences, workshops and seminars at the national and regional levels, within \nexisting resources;  \n \n13. Also requests the Secretary-General to submit to the General Assembly at \nits seventy-fourth session a report on the implementation of the present resolution. \n \n73rd plenary meeting \n19 December 2017 \n \n",
  "paragraphs": {
    "1": "Takes note of the report of the Secretary-General;3",
    "2": "Notes with appreciation the celebration of the International Year of Cooperatives, in 2012;",
    "3": "Encourages all Member States, as well as the United Nations and all other relevant stakeholders, to share best practices identified through activities implemented during the International Year of Cooperatives and to continue those activities, as appropriate;",
    "4": "Recalls the draft plan of action on cooperatives for 2012 and beyond, based on the outcome document of the expert group meeting held in Ulaanbaatar in 2011 for the promotion of cooperatives for sustainable socioeconomic development, to promote focused and effective follow-up to the activities of the International Year, within existing resources;",
    "5": "Draws the attention of Governments to the recommendations contained in the report of the Secretary-General to focus support on cooperatives as sustainable and successful business enterprises that contribute directly to employment generation, poverty and hunger eradication, education, social protection and the creation of affordable housing options across a variety of economic sectors in urban and rural areas and to review existing legislation and regulations to make the national legal and regulatory environment more conducive to the creation and growth of cooperatives by improving existing laws and regulations and/or by establishing new ones, especially in the areas of access to capital, competitiveness and fair taxation;",
    "6": "Invites Governments and international organizations, in partnership with cooperatives and cooperative organizations, to strengthen and build the capacity of all forms of cooperatives, especially those run by the poor, young people, women, persons with disabilities and other vulnerable groups, so that they can empower people to transform their lives and communities positively and build inclusive societies;",
    "7": "Invites Governments to strengthen efforts to enhance food security and nutrition and to focus efforts on smallholders and women farmers, as well as on agricultural cooperatives and farmers\u2019 networks, supported by measures to improve access to markets, enable domestic and international environments and strengthen collaboration across the many initiatives in this area, including regional initiatives;",
    "8": "Encourages Governments to promote access to information and communications technologies as a vital channel for collaboration and the expansion of cooperatives, especially in rural areas;",
    "9": "Also encourages Governments to intensify and expand the availability, accessibility and dissemination of evidence-based research on the operations and contribution of cooperatives, to develop a statistical framework for the systematic collection of comprehensive data on and the best practices of cooperative enterprises, in collaboration with all stakeholders, and to raise public awareness of the linkages between cooperatives and sustainable development, especially in the areas of social inclusion, employment creation, poverty eradication, inequality reduction and peacebuilding;",
    "10": "Invites Governments, relevant international organizations, the specialized agencies and local, national and international cooperative organizations to continue to observe the International Day of Cooperatives annually, on the first Saturday of July, as proclaimed by the General Assembly in its resolution 47/90;",
    "11": "Invites Governments, in collaboration with the cooperative movement, to develop programmes aimed at enhancing the capacity-building of cooperatives, including by strengthening the organizational, management and financial skills of their members, while respecting the principles of gender equality and the empowerment of women and girls, and to introduce and support programmes to improve the access of cooperatives to new technologies;",
    "12": "Requests the Secretary-General, in cooperation with the relevant United Nations and other international organizations and national, regional and international cooperative organizations, to continue rendering support to Member States, as appropriate, in their efforts to create a supportive environment for the development of cooperatives, integrating cooperative values, principles and business models into educational programming, including school curricula, as appropriate, providing assistance for human resources development, technical advice and training and promoting an exchange of experience and best practices through, inter alia, conferences, workshops and seminars at the national and regional levels, within existing resources;",
    "13": "Also requests the Secretary-General to submit to the General Assembly at its seventy-fourth session a report on the implementation of the present resolution."
  },
  "agenda_items": [
    "Item 27"
  ],
  "symbol_references": []
}