{
  "symbol": "A/RES/76/284",
  "filename": "A_RES_76_284.pdf",
  "title": "76/284. Financing of the United Nations Organization Stabilization Mission in the Democratic Republic of the Congo",
  "text": "United Nations \nA/RES/76/284\n \n \nGeneral Assembly \nDistr.: General \n7 July 2022 \n \n22-10342 (E)    070722     \n*2210342* \n \n \nSeventy-sixth session \nAgenda item 155 \nFinancing of the United Nations Organization Stabilization \nMission in the Democratic Republic of the Congo  \n \n \n \n \n Resolution adopted by the General Assembly \non 29 June 2022 \n \n \n \n \n[on the report of the Fifth Committee (A/76/878, para. 6)] \n \n \n 76/284. Financing of the United Nations Organization Stabilization \nMission in the Democratic Republic of the Congo \n \n \n \nThe General Assembly, \n \nHaving considered the reports of the Secretary-General on the financing of the \nUnited Nations Organization Stabilization Mission in the Democratic Republic of the \nCongo1 and the related report of the Advisory Committee on Administrative and \nBudgetary Questions,2  \n \nHaving also considered the report of the Office of Internal Oversight Services \non the outcome evaluation of United Nations Organization Stabilization Mission in \nthe Democratic Republic of the Congo support provided to the rule of law and security \ninstitutions in the Democratic Republic of the Congo,3  \n \nRecalling Security Council resolution 1925 (2010) of 28 May 2010, by which \nthe Council decided that, as from 1 July 2010, the United Nations Organization \nMission in the Democratic Republic of the Congo would bear the title \u201cUnited \nNations Organization Stabilization Mission in the Democratic Republic of the \nCongo\u201d, and recalling also the subsequent resolutions by which the Council extended \nthe mandate of the Mission, the latest of which was resolution 2612 (2021) of \n20 December 2021, by which the Council extended the mandate of the Mission until \n20 December 2022, \n \nRecalling also its resolution 54/260 A of 7 April 2000 on the financing of the \nMission and its subsequent resolutions thereon, the latest of which was resolution \n75/300 of 30 June 2021, \n__________________ \n \n1  A/76/563 and A/76/718. \n \n2  A/76/760/Add.4. \n \n3  A/76/707. \n\nA/RES/76/284 \nFinancing of the United Nations Organization\nStabilization Mission in the Democratic Republic of the Congo\n \n22-10342\n2/4 \n \n \nRecalling further its resolution 58/315 of 1 July 2004, \n \nReaffirming the general principles underlying the financing of United Nations \npeacekeeping operations, as stated in its resolutions 1874 (S-IV) of 27 June 1963, \n3101 (XXVIII) of 11 December 1973 and 55/235 of 23 December 2000, \n \nNoting with appreciation that voluntary contributions have been made to the \nMission, \n \nMindful of the fact that it is essential to provide the Mission with the financial \nresources necessary to enable it to fulfil its responsibilities under the relevant \nresolutions of the Security Council, \n \n1. \nRequests the Secretary-General to entrust the Head of Mission with the \ntask of formulating future budget proposals in full accordance with the provisions of \nits resolutions 59/296 of 22 June 2005, 60/266 of 30 June 2006, 61/276 of 29 June \n2007, 64/269 of 24 June 2010, 65/289 of 30 June 2011, 66/264 of 21 June 2012, \n69/307 of 25 June 2015, 70/286 of 17 June 2016 and 76/274 of 29 June 2022, as well \nas other relevant resolutions; \n \n2. \nTakes note of the status of contributions to the United Nations \nOrganization Stabilization Mission in the Democratic Republic of the Congo as at \n30 April 2022, including the contributions outstanding in the amount of 415,480,551 \nUnited States dollars, representing some 1.7 per cent of the total assessed \ncontributions, notes with concern that only 80 Member States have paid their assessed \ncontributions in full, and urges all other Member States, in particular those in arrears, \nto ensure payment of their outstanding assessed contributions; \n \n3. \nExpresses its appreciation to those Member States that have paid their \nassessed contributions in full, and urges all other Member States to make every \npossible effort to ensure payment of their assessed contributions to the Mission in \nfull; \n \n4. \nExpresses concern at the financial situation with regard to peacekeeping \nactivities, in particular as regards the reimbursements to troop contributors that bear \nadditional burdens owing to overdue payments by Member States of their \nassessments; \n \n5. \nEmphasizes that all future and existing peacekeeping missions shall be \ngiven equal and non-discriminatory treatment in respect of financial and \nadministrative arrangements; \n \n6. \nAlso emphasizes that all peacekeeping missions shall be provided with \nadequate resources for the effective and efficient discharge of their respective \nmandates; \n \n7. \nRequests the Secretary-General to ensure that proposed peacekeeping \nbudgets are based on the relevant legislative mandates; \n \n8. \nEndorses the conclusions and recommendations contained in the report of \nthe Advisory Committee on Administrative and Budgetary Questions, subject to the \nprovisions of the present resolution, and requests the Secretary-General to ensure \ntheir full implementation; \n \n9. \nDecides to abolish one post of Associate Security Officer (P-2) in the \nSecurity and Safety Section that has been vacant for 24 months or longer; \n \n10. Requests the Secretary-General to ensure the full implementation of the \nrelevant provisions of its resolutions 59/296, 60/266, 61/276, 64/269, 65/289, 66/264, \n69/307, 70/286 and 76/274; \n\nFinancing of the United Nations Organization Stabilization Mission \nin the Democratic Republic of the Congo \nA/RES/76/284\n \n3/4\n22-10342 \n \n \n11. \nAlso requests the Secretary-General to take all action necessary to ensure \nthat the Mission is administered with a maximum of efficiency and economy; \n \n \n \nBudget performance report for the period from 1 July 2020 to 30 June 2021 \n \n \n12. Takes note of the report of the Secretary-General on the budget \nperformance of the Mission for the period from 1 July 2020 to 30 June 2021; 4  \n \n \n \nBudget estimates for the period from 1 July 2022 to 30 June 2023 \n \n \n13. Decides to appropriate to the special account for the United Nations \nOrganization Stabilization Mission in the Democratic Republic of the Congo the \namount of 1,112,242,200 dollars for the period from 1 July 2022 to 30 June 2023, \ninclusive of 1,030,269,900 dollars for the maintenance of the Mission, 62,939,400 \ndollars for the support account for peacekeeping operations, 11,331,700 dollars for \nthe United Nations Logistics Base at Brindisi, Italy, and 7,701,200 dollars for the \nRegional Service Centre in Entebbe, Uganda; \n \n \n \nFinancing of the appropriation for the period from 1 July 2022 to 30 June 2023 \n \n \n14. Decides to apportion among Member States the amount of 522,874,730 \ndollars for the period from 1 July to 20 December 2022 in accordance with the levels \nupdated in its resolution 76/239 of 24 December 2021, taking into account the scale \nof assessments for 2022, as set out in its resolution 76/238 of 24 December 2021; \n \n15. Also decides that, in accordance with the provisions of its resolution \n973 (X) of 15 December 1955, there shall be set off against the apportionment among \nMember States, as provided for in paragraph 14 above, their respective share in the \nTax Equalization Fund of 16,208,313 dollars, comprising the estimated staff \nassessment income of 12,798,803 dollars approved for the Mission, the prorated share \nof 2,386,930 dollars of the estimated staff assessment income approved for the \nsupport account, the prorated share of 619,039 dollars of the estimated staff \nassessment income approved for the United Nations Logistics Base and the prorated \nshare of 403,541 dollars of the estimated staff assessment income approved for the \nRegional Service Centre; \n \n16. Further decides to apportion among Member States the amount of \n589,367,470 dollars for the period from 21 December 2022 to 30 June 2023, at a \nmonthly rate of 92,686,850 dollars, in accordance with the levels updated in its \nresolution 76/239, taking into account the scale of assessments for 2022 and 2023, as \nset out in its resolution 76/238, subject to a decision of the Security Council to extend \nthe mandate of the Mission; \n \n17. Decides that, in accordance with the provisions of its resolution 973 (X), \nthere shall be set off against the apportionment among Member States, as provided \nfor in paragraph 16 above, their respective share in the Tax Equalization Fund of \n18,269,487 dollars, comprising the estimated staff assessment income of 14,426,397 \ndollars approved for the Mission, the prorated share of 2,690,470 dollars of the \nestimated staff assessment income approved for the support account, the prorated \nshare of 697,761 dollars of the estimated staff assessment income approved for the \nUnited Nations Logistics Base and the prorated share of 454,859 dollars of the \nestimated staff assessment income approved for the Regional Service Centre; \n \n18. Also decides that, for Member States that have fulfilled their financial \nobligations to the Mission, there shall be set off against their apportionment, as \nprovided for in paragraphs 14 and 16 above, their respective share of the \n__________________ \n \n4  A/76/563. \n\nA/RES/76/284 \nFinancing of the United Nations Organization\nStabilization Mission in the Democratic Republic of the Congo\n \n22-10342\n4/4 \n \nunencumbered balance and other revenue in the amount of 96,320,000 dollars in \nrespect of the financial period ended 30 June 2021, in accordance with the levels \nupdated in its resolution 73/272 of 22 December 2018, taking into account the scale \nof assessments for 2021, as set out in its resolution 73/271 of 22 December 2018; \n \n19. Further decides that, for Member States that have not fulfilled their \nfinancial obligations to the Mission, there shall be set off against their outstanding \nobligations their respective share of the unencumbered balance and other revenue in \nthe amount of 96,320,000 dollars in respect of the financial period ended 30 June \n2021, in accordance with the scheme set out in paragraph 18 above; \n \n20. Decides that the increase of 516,300 dollars in the estimated staff \nassessment income in respect of the financial period ended 30 June 2021 shall be \nadded to the credits in the amount of 96,320,000 dollars referred to in paragraphs 18 \nand 19 above; \n \n21. Encourages the Secretary-General to continue to take additional measures \nto ensure the safety and security of all personnel participating in the Mission under \nthe auspices of the United Nations, bearing in mind paragraphs 5 and 6 of Security \nCouncil resolution 1502 (2003) of 26 August 2003; \n \n22. Invites voluntary contributions to the Mission in cash and in the form of \nservices and supplies acceptable to the Secretary-General, to be administered, as \nappropriate, in accordance with the procedure and practices established by the \nGeneral Assembly; \n \n23. Decides to include in the provisional agenda of its seventy-seventh session \nthe item entitled \u201cFinancing of the United Nations Organization Stabilization Mission \nin the Democratic Republic of the Congo\u201d. \n \n89th plenary meeting \n29 June 2022 \n \n",
  "paragraphs": {
    "1": "Requests the Secretary-General to entrust the Head of Mission with the task of formulating future budget proposals in full accordance with the provisions of its resolutions 59/296 of 22 June 2005, 60/266 of 30 June 2006, 61/276 of 29 June 2007, 64/269 of 24 June 2010, 65/289 of 30 June 2011, 66/264 of 21 June 2012, 69/307 of 25 June 2015, 70/286 of 17 June 2016 and 76/274 of 29 June 2022, as well as other relevant resolutions;",
    "2": "Takes note of the status of contributions to the United Nations Organization Stabilization Mission in the Democratic Republic of the Congo as at 30 April 2022, including the contributions outstanding in the amount of 415,480,551 United States dollars, representing some 1.7 per cent of the total assessed contributions, notes with concern that only 80 Member States have paid their assessed contributions in full, and urges all other Member States, in particular those in arrears, to ensure payment of their outstanding assessed contributions;",
    "3": "Expresses its appreciation to those Member States that have paid their assessed contributions in full, and urges all other Member States to make every possible effort to ensure payment of their assessed contributions to the Mission in full;",
    "4": "Expresses concern at the financial situation with regard to peacekeeping activities, in particular as regards the reimbursements to troop contributors that bear additional burdens owing to overdue payments by Member States of their assessments;",
    "5": "Emphasizes that all future and existing peacekeeping missions shall be given equal and non-discriminatory treatment in respect of financial and administrative arrangements;",
    "6": "Also emphasizes that all peacekeeping missions shall be provided with adequate resources for the effective and efficient discharge of their respective mandates;",
    "7": "Requests the Secretary-General to ensure that proposed peacekeeping budgets are based on the relevant legislative mandates;",
    "8": "Endorses the conclusions and recommendations contained in the report of the Advisory Committee on Administrative and Budgetary Questions, subject to the provisions of the present resolution, and requests the Secretary-General to ensure their full implementation;",
    "9": "Decides to abolish one post of Associate Security Officer (P-2) in the Security and Safety Section that has been vacant for 24 months or longer;",
    "10": "Requests the Secretary-General to ensure the full implementation of the relevant provisions of its resolutions 59/296, 60/266, 61/276, 64/269, 65/289, 66/264, 69/307, 70/286 and 76/274; Financing of the United Nations Organization Stabilization Mission in the Democratic Republic of the Congo A/RES/76/284 3/4 22-10342",
    "11": "Also requests the Secretary-General to take all action necessary to ensure that the Mission is administered with a maximum of efficiency and economy; Budget performance report for the period from 1 July 2020 to 30 June 2021",
    "12": "Takes note of the report of the Secretary-General on the budget performance of the Mission for the period from 1 July 2020 to 30 June 2021; 4 Budget estimates for the period from 1 July 2022 to 30 June 2023",
    "13": "Decides to appropriate to the special account for the United Nations Organization Stabilization Mission in the Democratic Republic of the Congo the amount of 1,112,242,200 dollars for the period from 1 July 2022 to 30 June 2023, inclusive of 1,030,269,900 dollars for the maintenance of the Mission, 62,939,400 dollars for the support account for peacekeeping operations, 11,331,700 dollars for the United Nations Logistics Base at Brindisi, Italy, and 7,701,200 dollars for the Regional Service Centre in Entebbe, Uganda; Financing of the appropriation for the period from 1 July 2022 to 30 June 2023",
    "14": "Decides to apportion among Member States the amount of 522,874,730 dollars for the period from 1 July to 20 December 2022 in accordance with the levels updated in its resolution 76/239 of 24 December 2021, taking into account the scale of assessments for 2022, as set out in its resolution 76/238 of 24 December 2021;",
    "15": "Also decides that, in accordance with the provisions of its resolution 973 (X) of 15 December 1955, there shall be set off against the apportionment among Member States, as provided for in paragraph 14 above, their respective share in the Tax Equalization Fund of 16,208,313 dollars, comprising the estimated staff assessment income of 12,798,803 dollars approved for the Mission, the prorated share of 2,386,930 dollars of the estimated staff assessment income approved for the support account, the prorated share of 619,039 dollars of the estimated staff assessment income approved for the United Nations Logistics Base and the prorated share of 403,541 dollars of the estimated staff assessment income approved for the Regional Service Centre;",
    "16": "Further decides to apportion among Member States the amount of 589,367,470 dollars for the period from 21 December 2022 to 30 June 2023, at a monthly rate of 92,686,850 dollars, in accordance with the levels updated in its resolution 76/239, taking into account the scale of assessments for 2022 and 2023, as set out in its resolution 76/238, subject to a decision of the Security Council to extend the mandate of the Mission;",
    "17": "Decides that, in accordance with the provisions of its resolution 973 (X), there shall be set off against the apportionment among Member States, as provided for in paragraph 16 above, their respective share in the Tax Equalization Fund of 18,269,487 dollars, comprising the estimated staff assessment income of 14,426,397 dollars approved for the Mission, the prorated share of 2,690,470 dollars of the estimated staff assessment income approved for the support account, the prorated share of 697,761 dollars of the estimated staff assessment income approved for the United Nations Logistics Base and the prorated share of 454,859 dollars of the estimated staff assessment income approved for the Regional Service Centre;",
    "18": "Also decides that, for Member States that have fulfilled their financial obligations to the Mission, there shall be set off against their apportionment, as provided for in paragraphs 14 and 16 above, their respective share of the __________________ 4 A/76/563. A/RES/76/284 Financing of the United Nations Organization Stabilization Mission in the Democratic Republic of the Congo 22-10342 4/4 unencumbered balance and other revenue in the amount of 96,320,000 dollars in respect of the financial period ended 30 June 2021, in accordance with the levels updated in its resolution 73/272 of 22 December 2018, taking into account the scale of assessments for 2021, as set out in its resolution 73/271 of 22 December 2018;",
    "19": "Further decides that, for Member States that have not fulfilled their financial obligations to the Mission, there shall be set off against their outstanding obligations their respective share of the unencumbered balance and other revenue in the amount of 96,320,000 dollars in respect of the financial period ended 30 June 2021, in accordance with the scheme set out in paragraph 18 above;",
    "20": "Decides that the increase of 516,300 dollars in the estimated staff assessment income in respect of the financial period ended 30 June 2021 shall be added to the credits in the amount of 96,320,000 dollars referred to in paragraphs 18 and 19 above;",
    "21": "Encourages the Secretary-General to continue to take additional measures to ensure the safety and security of all personnel participating in the Mission under the auspices of the United Nations, bearing in mind paragraphs 5 and 6 of Security Council resolution 1502 (2003) of 26 August 2003;",
    "22": "Invites voluntary contributions to the Mission in cash and in the form of services and supplies acceptable to the Secretary-General, to be administered, as appropriate, in accordance with the procedure and practices established by the General Assembly;",
    "23": "Decides to include in the provisional agenda of its seventy-seventh session the item entitled \u201cFinancing of the United Nations Organization Stabilization Mission in the Democratic Republic of the Congo\u201d. 89th plenary meeting 29 June 2022"
  },
  "agenda_items": [
    "Item 155"
  ],
  "symbol_references": []
}