{
  "symbol": "A/RES/72/7",
  "filename": "A_RES_72_7.pdf",
  "title": "72/7. Role of the United Nations Regional Centre for Preventive Diplomacy for Central Asia",
  "text": "United Nations \nA/RES/72/7\n \n \nGeneral Assembly \nDistr.: General \n20 November 2017 \n \n17-20520 (E)    201117    201117 \n*1720520* \n \n \nSeventy-second session \nAgenda item 65 \n \n \n \n \n Resolution adopted by the General Assembly \non 17 November 2017 \n \n \n \n \n[without reference to a Main Committee (A/72/L.4 and A/72/L.4/Add.1)] \n \n \n \n72/7. Role of the United Nations Regional Centre for Preventive \nDiplomacy for Central Asia \n \n \n \nThe General Assembly, \n \nGuided by the Charter of the United Nations,  \n \nRecalling the exchange of letters between the Secretary-General and the \nPresident of the Security Council on the establishment of a United Nations Regional \nCentre for Preventive Diplomacy in Ashgabat,1 \n \nWelcoming the twenty-fifth anniversary of the membership of the Central Asian \ncountries in the United Nations, reaffirming the unique role of the United Nations in \nthe system of international relations, and encouraging political dialogue directed \ntowards collective action to address common challenges and the development of \neconomic and social cooperation between the countries of the region, \n \nNoting the tenth anniversary of the establishment of the United Nations \nRegional Centre for Preventive Diplomacy for Central Asia, in December 2017, and \nrelying on the experience of the Regional Centre, \n \nReaffirming the importance of preventive diplomacy in supporting United \nNations efforts to assist in the peaceful settlement of disputes, and acknowledging in \nthis context the role of the Regional Centre in assisting the Central Asian States, in \naccordance with its mandate and through enhanced regional cooperation, to respond \nto transnational threats to peace and in supporting sustainable development in the \nregion, \n \nUnderstanding the importance of the creation and preservation of the most \nstable and secure Central Asian space, supporting the aspiration of the countries of \nthe region to establish a model of a Central Asian regional zone of peace, security, \ncooperation and development, taking into account the experience gained in regional \n__________________ \n \n1  See S/2007/279 and S/2007/280. \n\nA/RES/72/7 \nRole of the United Nations Regional Centre for Preventive Diplomacy for Central Asia\n \n17-20520 \n2/2 \n \ncooperation, as well as the assistance of the international community, represented by \nthe United Nations, \n \nNoting the specific focus of the Regional Centre on supporting cooperation \namong the Central Asian States in the areas of counter-terrorism and prevention of \nviolent extremism conducive to terrorism, with a view to the integrated and balanced \nimplementation of all pillars of the United Nations Global Counter-Terrorism \nStrategy2 in the region, \n \nRecalling the Ashgabat Declaration of the high-level United Nations-Central \nAsia dialogue on implementing the United Nations Global Counter-Terrorism \nStrategy in Central Asia, adopted on 13 June 2017,3 \n \nUnderlining the necessity of countering illicit drug production and trafficking \nin the region, and in this regard commending the efforts being made by the Regional \nCentre, jointly with the United Nations Office on Drugs and Crime through its \nRegional Office for Central Asia, in Tashkent, and the Central Asian Regional \nInformation and Coordination Centre for combating the illicit trafficking of narcotic \ndrugs, psychotropic substances and their precursors, in Almaty, Kazakhstan, \n \nWelcoming the close interaction of the Regional Centre with United Nations \ncountry teams, as well as the Peacebuilding Fund, in the areas of conflict prevention \nand peacebuilding, \n \nWelcoming also the readiness of the Central Asian countries to make efforts to \nreach mutually beneficial agreements on the integrated use of water and energy \nresources in the region, \n \n1. \nEncourages the United Nations Regional Centre for Preventive Diplomacy \nfor Central Asia to continue to liaise with the Governments of the region and, with \ntheir concurrence, with other parties concerned on issues relevant to preventive \ndiplomacy;  \n \n2. \nWelcomes the assistance of the Regional Centre in implementing the \ninitiatives of the Central Asian countries towards a stable, peaceful and prosperous \nregion;  \n \n3. \nEncourages the Regional Centre to continue close cooperation with the \nGovernments of the region to strengthen the capacity of the region to overcome \nchallenges to peace, stability and sustainable development through preventive \ndiplomacy and dialogue. \n \n55th plenary meeting \n17 November 2017 \n \n__________________ \n \n2  Resolution 60/288. \n \n3  A/71/982-S/2017/600, annex. \n",
  "paragraphs": {
    "1": "Encourages the United Nations Regional Centre for Preventive Diplomacy for Central Asia to continue to liaise with the Governments of the region and, with their concurrence, with other parties concerned on issues relevant to preventive diplomacy;",
    "2": "Welcomes the assistance of the Regional Centre in implementing the initiatives of the Central Asian countries towards a stable, peaceful and prosperous region;",
    "3": "Encourages the Regional Centre to continue close cooperation with the Governments of the region to strengthen the capacity of the region to overcome challenges to peace, stability and sustainable development through preventive diplomacy and dialogue. 55th plenary meeting 17 November 2017 __________________ 2 Resolution 60/288. 3 A/71/982-S/2017/600, annex."
  },
  "agenda_items": [
    "Item 65"
  ],
  "symbol_references": [
    "A/72/L.4"
  ]
}