{
  "symbol": "A/RES/73/82",
  "filename": "A_RES_73_82.pdf",
  "title": "73/82. Report of the Disarmament Commission",
  "text": "United Nations \nA/RES/73/82\n \n \nGeneral Assembly \nDistr.: General \n14 December 2018 \n \n18-21295 (E)    181218     \n*1821295* \n \n \nSeventy-third session \nAgenda item 103 (b) \n \n \n \n \n Resolution adopted by the General Assembly \non 5 December 2018 \n \n \n \n \n[on the report of the First Committee (A/73/512)] \n \n \n \n73/82. Report of the Disarmament Commission  \n \n \n \nThe General Assembly,  \n \nHaving considered the report of the Disarmament Commission,1  \n \nRecalling its resolutions 47/54 A of 9 December 1992, 47/54 G of 8 April 1993, \n48/77 A of 16 December 1993, 49/77 A of 15 December 1994, 50/72 D of \n12 December 1995, 51/47 B of 10 December 1996, 52/40 B of 9 December 1997, \n53/79 A of 4 December 1998, 54/56 A of 1 December 1999, 55/35 C of 20 November \n2000, 56/26 A of 29 November 2001, 57/95 of 22 November 2002, 58/67 of \n8 December 2003, 59/105 of 3 December 2004, 60/91 of 8 December 2005, 61/98 of \n6 December 2006, 62/54 of 5 December 2007, 63/83 of 2 December 2008, 64/65 \nof 2 December 2009, 65/86 of 8 December 2010, 66/60 of 2 December 2011, 67/71 \nof 3 December 2012, 68/63 of 5 December 2013, 69/77 of 2 December 2014, 70/68 \nof 7 December 2015, 71/82 of 5 December 2016 and 72/66 of 4 December 2017,  \n \nConsidering the role that the Disarmament Commission has been called upon to \nplay and the contribution that it should make in examining and submitting \nrecommendations on various problems in the field of disarmament and in promoting \nthe implementation of the relevant decisions adopted by the General Assembly at its \ntenth special session,  \n \nRecalling in particular General Assembly resolution 45/62 B of 4 December \n1990, in which it noted with satisfaction the adoption by consensus of a set of \u201cWays \nand means to enhance the functioning of the Disarmament Commission\u201d,2 Assembly \ndecision 52/492 of 8 September 1998 concerning the efficient functioning of the \nCommission and Assembly resolution 61/98, which contains additional measures for \nimproving the effectiveness of the methods of work of the Commission,  \n__________________ \n \n1  Official Records of the General Assembly, Seventy-third Session, Supplement No. 42 (A/73/42). \n \n2  Resolution 44/119 C, annex. \n\nA/RES/73/82 \nReport of the Disarmament Commission\n \n18-21295\n2/3 \n \n \nReaffirming the mandate of the Disarmament Commission as the specialized, \ndeliberative subsidiary body of the General Assembly that allows for in-depth \ndeliberations on specific disarmament issues, leading to the submission of concrete \nrecommendations on those issues, and recalling that the Commission shall make every \neffort to ensure that, insofar as possible, decisions on substantive issues be adopted \nby consensus, as set forth in paragraph 118 of the Final Document of the Tenth Special \nSession of the General Assembly,3  \n \nEmphasizing once again the important place of the Disarmament Commission \nwithin the United Nations multilateral disarmament machinery, \n \n1. \nTakes note of the report of the Disarmament Commission;1 \n \n2. \nReaffirms the importance of further enhancing the dialogue and \ncooperation among the First Committee, the Disarmament Commission and the \nConference on Disarmament; \n \n3. \nEmphasizes the need for a focused and results-oriented discussion of the \nitems on the agenda of the Disarmament Commission; \n \n4. \nRequests the Disarmament Commission to continue its work in accordance \nwith its mandate, as set forth in paragraph 118 of the Final Document of the Tenth \nSpecial Session of the General Assembly,3 and with paragraph 3 of Assembly \nresolution 37/78 H of 9 December 1982 and to that end to make every effort to \nachieve specific recommendations on the items on its agenda, taking into account the \nadopted \u201cWays and means to enhance the functioning of the Disarmament \nCommission\u201d;2 \n \n5. \nWelcomes the fact that, in accordance with General Assembly decision \n52/492, at its 368th meeting, on 21 February 2018, the Disarmament Commission \nadopted the provisional agenda for its substantive session of 2018, and that the \nCommission decided that the agenda for its substantive session of 2018 should serve \nfor the period 2018\u20132020;  \n \n6. \nRecommends that the Disarmament Commission continue its consideration \nof the following items at its substantive session of 2019: \n \n(a) \nRecommendations for achieving the objective of nuclear disarmament and \nnon-proliferation of nuclear weapons; \n \n(b) \nPreparation of recommendations to promote the practical implementation \nof transparency and confidence-building measures in outer space activities with the \ngoal of preventing an arms race in outer space, in accordance with the \nrecommendations set out in the report of the Group of Governmental Experts on \nTransparency and Confidence-Building Measures in Outer Space Activities;4  \n \n7. \nNotes that the Disarmament Commission encourages the Chairs of its \nworking groups to continue informal consultations during the intersessional period \non the agenda item allocated to each of the groups; \n \n8. \nEncourages the Disarmament Commission to invite, as appropriate, the \nUnited Nations Institute for Disarmament Research to prepare background papers on \nthe items on its agenda and, if need be, other disarmament experts to present their \nviews, as provided for in paragraph 3 (e) of resolution 61/98, upon the invitation of \nthe Chair and with the prior approval of the Commission; \n \n9. \nRequests the Disarmament Commission to meet for a period not exceeding \nthree weeks during 2019, namely from 8 to 29 April, and to submit a substantive \n__________________ \n \n3  Resolution S-10/2. \n \n4  A/68/189. \n\nReport of the Disarmament Commission \nA/RES/73/82\n \n3/3\n18-21295 \n \nreport to the General Assembly at its seventy-fourth session, and stresses that the \nreport of the Commission should contain a summary by the Chair of the proceedings \nto reflect different views or positions if no agreement can be reached on the specific \nagenda item deliberated on, as provided for in paragraph 3.4 of the adopted \u201cWays \nand means to enhance the functioning of the Disarmament Commission\u201d; \n \n10. Requests the Secretary-General to ensure full provision to the \nDisarmament Commission and its subsidiary bodies of interpretation and translation \nfacilities in the official languages and to assign, as a matter of priority, all the \nresources and services necessary, including verbatim records, to that end, and also \nrequests the Secretary-General to transmit to the Commission the annual report of the \nConference on Disarmament on its 2018 session,5 together with all the official records \nof the seventy-third session of the General Assembly relating to disarmament matters, \nand to render all assistance that the Commission may require for implementing the \npresent resolution; \n \n11. \nInvites Member States to submit their views and proposals on the matter \nearly enough to enable practical consultations among them prior to the beginning of \nthe substantive session of 2019 of the Disarmament Commission, with a view to \nfacilitating its constructive outcome, and in this regard encourages the Chair-\ndesignate, upon nomination, to commence consultations and preparations for the \nsubstantive session of 2019 in a timely manner; \n \n12. Decides to include in the provisional agenda of its seventy-fourth session, \nunder the item entitled \u201cReview of the implementation of the recommendations and \ndecisions adopted by the General Assembly at its tenth special session\u201d, the sub-item \nentitled \u201cReport of the Disarmament Commission\u201d. \n \n45th plenary meeting  \n5 December 2018 \n \n__________________ \n \n5  Official Records of the General Assembly, Seventy-third Session, Supplement No. 27 (A/73/27). \n",
  "paragraphs": {
    "1": "Takes note of the report of the Disarmament Commission;1",
    "2": "Reaffirms the importance of further enhancing the dialogue and cooperation among the First Committee, the Disarmament Commission and the Conference on Disarmament;",
    "3": "Emphasizes the need for a focused and results-oriented discussion of the items on the agenda of the Disarmament Commission;",
    "4": "Requests the Disarmament Commission to continue its work in accordance with its mandate, as set forth in paragraph 118 of the Final Document of the Tenth Special Session of the General Assembly,3 and with paragraph 3 of Assembly resolution 37/78 H of 9 December 1982 and to that end to make every effort to achieve specific recommendations on the items on its agenda, taking into account the adopted \u201cWays and means to enhance the functioning of the Disarmament Commission\u201d;2",
    "5": "Welcomes the fact that, in accordance with General Assembly decision 52/492, at its 368th meeting, on 21 February 2018, the Disarmament Commission adopted the provisional agenda for its substantive session of 2018, and that the Commission decided that the agenda for its substantive session of 2018 should serve for the period 2018\u20132020;",
    "6": "Recommends that the Disarmament Commission continue its consideration of the following items at its substantive session of 2019: (a) Recommendations for achieving the objective of nuclear disarmament and non-proliferation of nuclear weapons; (b) Preparation of recommendations to promote the practical implementation of transparency and confidence-building measures in outer space activities with the goal of preventing an arms race in outer space, in accordance with the recommendations set out in the report of the Group of Governmental Experts on Transparency and Confidence-Building Measures in Outer Space Activities;4",
    "7": "Notes that the Disarmament Commission encourages the Chairs of its working groups to continue informal consultations during the intersessional period on the agenda item allocated to each of the groups;",
    "8": "Encourages the Disarmament Commission to invite, as appropriate, the United Nations Institute for Disarmament Research to prepare background papers on the items on its agenda and, if need be, other disarmament experts to present their views, as provided for in paragraph 3 (e) of resolution 61/98, upon the invitation of the Chair and with the prior approval of the Commission;",
    "9": "Requests the Disarmament Commission to meet for a period not exceeding three weeks during 2019, namely from 8 to 29 April, and to submit a substantive __________________ 3 Resolution S-10/2. 4 A/68/189. Report of the Disarmament Commission A/RES/73/82 3/3 18-21295 report to the General Assembly at its seventy-fourth session, and stresses that the report of the Commission should contain a summary by the Chair of the proceedings to reflect different views or positions if no agreement can be reached on the specific agenda item deliberated on, as provided for in paragraph 3.4 of the adopted \u201cWays and means to enhance the functioning of the Disarmament Commission\u201d;",
    "10": "Requests the Secretary-General to ensure full provision to the Disarmament Commission and its subsidiary bodies of interpretation and translation facilities in the official languages and to assign, as a matter of priority, all the resources and services necessary, including verbatim records, to that end, and also requests the Secretary-General to transmit to the Commission the annual report of the Conference on Disarmament on its 2018 session,5 together with all the official records of the seventy-third session of the General Assembly relating to disarmament matters, and to render all assistance that the Commission may require for implementing the present resolution;",
    "11": "Invites Member States to submit their views and proposals on the matter early enough to enable practical consultations among them prior to the beginning of the substantive session of 2019 of the Disarmament Commission, with a view to facilitating its constructive outcome, and in this regard encourages the Chair- designate, upon nomination, to commence consultations and preparations for the substantive session of 2019 in a timely manner;",
    "12": "Decides to include in the provisional agenda of its seventy-fourth session, under the item entitled \u201cReview of the implementation of the recommendations and decisions adopted by the General Assembly at its tenth special session\u201d, the sub-item entitled \u201cReport of the Disarmament Commission\u201d. 45th plenary meeting 5 December 2018 __________________ 5 Official Records of the General Assembly, Seventy-third Session, Supplement No. 27 (A/73/27)."
  },
  "agenda_items": [
    "Item 103"
  ],
  "symbol_references": []
}