{
  "symbol": "A/RES/79/246",
  "filename": "A_RES_79_246.pdf",
  "title": "79/246. Capital master plan",
  "text": "United Nations \nA/RES/79/246\n \n \nGeneral Assembly \nDistr.: General \n31 December 2024 \n \n24-24685 (E) \n*2424685* \n \n \nSeventy-ninth session \nAgenda item 138 \nProgramme budget for 2024 \n \n \n \n \n Resolution adopted by the General Assembly \non 24 December 2024 \n \n \n \n \n[on the report of the Fifth Committee (A/79/641, para. 7)] \n \n \n 79/246. Capital master plan \n \n \n \nThe General Assembly, \n \nRecalling its resolutions 54/249 of 23 December 1999, section IV of its \nresolution 55/238 of 23 December 2000, its resolutions 56/234 and 56/236 of \n24 December 2001 and 56/286 of 27 June 2002, section II of its resolution 57/292 of \n20 December 2002, section XXII of its resolution 58/272 of 23 December 2003, \nsection XI of its resolution 59/276 of 23 December 2004, its resolution 59/295 of \n22 June 2005, section II of its resolution 60/248 of 23 December 2005, its resolutions \n60/256 of 8 May 2006, 60/282 of 30 June 2006, 61/251 of 22 December 2006, 62/87 \nof 10 December 2007, 63/270 of 7 April 2009, 64/228 of 22 December 2009 and \n65/269 of 4 April 2011, section III of its resolution 66/258 of 9 April 2012, section V \nof its resolution 67/246 of 24 December 2012, sections III and IV of its resolution \n67/254 of 12 April 2013, section IV of its resolution 68/247 A of 27 December 2013, \nsection VII of its resolution 68/247 B of 9 April 2014, section VIII of its resolution \n69/274 A of 2 April 2015 and its resolution 70/239 of 23 December 2015, and its \ndecisions 58/566 of 8 April 2004, 65/543 of 24 December 2010 and 66/555 of \n24 December 2011, \n \nHaving considered the twenty-second annual progress report of the Secretary-\nGeneral on the implementation of the capital master plan, 1 the report of the Board of \nAuditors on the financial report and audited financial statements for the year ended \n31 December 2023,2 the report of the Secretary-General on the implementation of the \nrecommendations of the Board of Auditors contained in its report for the year ended \n__________________ \n \n1  A/79/313. \n \n2  Relevant parts of the Official Records of the General Assembly, Seventy-ninth Session, \nSupplement No. 5, vol. I (A/79/5 (Vol. I)). \n\nA/RES/79/246 \nCapital master plan\n \n24-24685\n2/2 \n \n31 December 2023 on the United Nations 3 and the related report of the Advisory \nCommittee on Administrative and Budgetary Questions,4  \n \n1. \nTakes note of the report of the Secretary-General, the report of the Board \nof Auditors and the report of the Secretary-General on the implementation of the \nrecommendations of the Board of Auditors;  \n \n2. \nEndorses the conclusions and recommendations contained in the report of \nthe Advisory Committee; \n \n3. \nNotes with concern that, to date, the Organization has disbursed a higher \namount in legal fees for arbitration under the capital master plan than the total in \ndamages subsequently awarded to the plaintiffs, and requests the Secretary-General \nto ensure the cost- and time-effective resolution of the remaining arbitration; \n \n4. \nRecalls paragraphs 9 of the report of the Advisory Committee, and \nrequests the Secretary-General to provide in his future reports detailed information \nand precise estimates on the concluded second phase and the remaining third phase \nof the second arbitration case, including projected expenditures required for each year \nbased on the latest assumptions and the anticipated timing for when Member States \nmay incur financial obligations, and also requests the Secretary-General to take \nnecessary steps to limit the financial liabilities and protect the rights of the United \nNations to the fullest extent possible; \n \n5. \nAlso recalls paragraph 10 of the report of the Advisory Committee, and \nrequests the Secretary-General to continue to gather lessons learned related to the \narbitration cases and share them with other construction projects with a view to \navoiding litigation insofar as feasible, including from subcontractors and third parties, \nand protecting the rights of the United Nations in other construction projects; \n \n6. \nRequests the Secretary-General to continue to hold managers accountable \nwhen their decisions have been established to be grossly negligent according to the \napplicable Staff Regulations and Rules of the United Nations and have led to litigation \nand subsequent financial loss; \n \n7. \nAlso requests the Secretary-General to entrust the Office of Internal \nOversight Services with conducting a comprehensive audit of the reasons that led to \narbitration proceedings, and submitting its findings and recommendations on \nenhancing project governance, as well as limiting financial liability and protecting \nthe rights of the United Nations, for the consideration of the General Assembly at its \neightieth session. \n \n55th (resumed) plenary meeting \n24 December 2024 \n \n__________________ \n \n3  Relevant parts of A/79/328. \n \n4  A/79/551. \n",
  "paragraphs": {
    "1": "Takes note of the report of the Secretary-General, the report of the Board of Auditors and the report of the Secretary-General on the implementation of the recommendations of the Board of Auditors;",
    "2": "Endorses the conclusions and recommendations contained in the report of the Advisory Committee;",
    "3": "Notes with concern that, to date, the Organization has disbursed a higher amount in legal fees for arbitration under the capital master plan than the total in damages subsequently awarded to the plaintiffs, and requests the Secretary-General to ensure the cost- and time-effective resolution of the remaining arbitration;",
    "4": "Recalls paragraphs 9 of the report of the Advisory Committee, and requests the Secretary-General to provide in his future reports detailed information and precise estimates on the concluded second phase and the remaining third phase of the second arbitration case, including projected expenditures required for each year based on the latest assumptions and the anticipated timing for when Member States may incur financial obligations, and also requests the Secretary-General to take necessary steps to limit the financial liabilities and protect the rights of the United Nations to the fullest extent possible;",
    "5": "Also recalls paragraph 10 of the report of the Advisory Committee, and requests the Secretary-General to continue to gather lessons learned related to the arbitration cases and share them with other construction projects with a view to avoiding litigation insofar as feasible, including from subcontractors and third parties, and protecting the rights of the United Nations in other construction projects;",
    "6": "Requests the Secretary-General to continue to hold managers accountable when their decisions have been established to be grossly negligent according to the applicable Staff Regulations and Rules of the United Nations and have led to litigation and subsequent financial loss;",
    "7": "Also requests the Secretary-General to entrust the Office of Internal Oversight Services with conducting a comprehensive audit of the reasons that led to arbitration proceedings, and submitting its findings and recommendations on enhancing project governance, as well as limiting financial liability and protecting the rights of the United Nations, for the consideration of the General Assembly at its eightieth session."
  },
  "agenda_items": [
    "Item 138"
  ],
  "symbol_references": []
}