{
  "symbol": "A/RES/72/301",
  "filename": "A_RES_72_301.pdf",
  "title": "72/301. Financing of the United Nations Mission for the Referendum in Western Sahara",
  "text": "United Nations \nA/RES/72/301\n \n \nGeneral Assembly \nDistr.: General \n17 July 2018 \n \n18-11318 (E)    190718  \n*1811318* \n \n \nSeventy-second session \nAgenda item 162 \n \n \n \n \n Resolution adopted by the General Assembly on 5 July 2018 \n \n \n \n \n[on the report of the Fifth Committee (A/72/910)] \n \n \n 72/301. Financing of the United Nations Mission for the Referendum \nin Western Sahara \n \n \n \nThe General Assembly, \n \nHaving considered the reports of the Secretary-General on the financing of the \nUnited Nations Mission for the Referendum in Western Sahara 1 and the related report \nof the Advisory Committee on Administrative and Budgetary Questions,2 \n \nRecalling Security Council resolution 690 (1991) of 29 April 1991, by which \nthe Council established the United Nations Mission for the Referendum in Western \nSahara, and the subsequent resolutions by which the Council extended the mandate \nof the Mission, the latest of which was resolution 2414 (2018) of 27 April 2018, by \nwhich the Council extended the mandate of the Mission until 31 October 2018, \n \nRecalling also its resolution 45/266 of 17 May 1991 on the financing of the \nMission and its subsequent resolutions thereon, the latest of which was resolution \n71/309 of 30 June 2017,  \n \nReaffirming the general principles underlying the financing of United Nations \npeacekeeping operations, as stated in its resolutions 1874 (S-IV) of 27 June 1963, \n3101 (XXVIII) of 11 December 1973 and 55/235 of 23 December 2000, \n \nNoting with appreciation that voluntary contributions have been made to the \nMission, \n \nMindful of the fact that it is essential to provide the Mission with the financial \nresources necessary to enable it to fulfil its responsibilities under the relevant \nresolutions of the Security Council, \n \n1. \nRequests the Secretary-General to entrust the Head of Mission with the \ntask of formulating future budget proposals in full accordance with the provisions of \nits resolutions 59/296 of 22 June 2005, 60/266 of 30 June 2006, 61/276 of 29 June \n__________________ \n \n1  A/72/623 and A/72/731. \n \n2  A/72/789/Add.1/Rev.1. \n\nA/RES/72/301 \nFinancing of the United Nations Mission for the Referendum in Western Sahara\n \n18-11318\n2/4 \n \n2007, 64/269 of 24 June 2010, 65/289 of 30 June 2011, 66/264 of 21 June 2012, \n69/307 of 25 June 2015 and 70/286 of 17 June 2016, as well as other relevant \nresolutions; \n \n2. \nTakes note of the status of contributions to the United Nations Mission for \nthe Referendum in Western Sahara as at 30 April 2018, including the contributions \noutstanding in the amount of 40.7 million United States dollars, representing some \n3.3 per cent of the total assessed contributions, notes with concern that only \n101 Member States have paid their assessed contributions in full, and urges all other \nMember States, in particular those in arrears, to ensure payment of their outstanding \nassessed contributions; \n \n3. \nExpresses its appreciation to those Member States that have paid their \nassessed contributions in full, and urges all other Member States to make every \npossible effort to ensure payment of their assessed contributions to the Mission in full; \n \n4. \nExpresses concern at the financial situation with regard to peacekeeping \nactivities, in particular as regards the reimbursements to troop contributors that bear \nadditional burdens owing to overdue payments by Member States of their assessments; \n \n5. \nEmphasizes that all future and existing peacekeeping missions shall be \ngiven equal and non-discriminatory treatment in respect of financial and \nadministrative arrangements; \n \n6. \nAlso emphasizes that all peacekeeping missions shall be provided with \nadequate resources for the effective and efficient discharge of their respective \nmandates; \n \n7. \nRequests the Secretary-General to ensure that proposed peacekeeping \nbudgets are based on the relevant legislative mandates; \n \n8. \nEndorses the conclusions and recommendations contained in the report of \nthe Advisory Committee on Administrative and Budgetary Questions, 2 subject to the \nprovisions of the present resolution, and requests the Secretary-General to ensure \ntheir full implementation; \n \n9. \nDecides to allocate an amount of 11,311,600 dollars for air operations from \nthe overall resources for the Mission; \n \n10. Requests the Secretary-General to ensure the full implementation of the \nrelevant provisions of its resolutions 59/296, 60/266, 61/276, 64/269, 65/289, 66/264, \n69/307 and 70/286; \n \n11. \nAlso requests the Secretary-General to take all action necessary to ensure \nthat the Mission is administered with a maximum of efficiency and economy; \n \n \n \nBudget performance report for the period from 1 July 2016 to 30 June 2017 \n \n \n12. Takes note of the report of the Secretary-General on the budget \nperformance of the Mission for the period from 1 July 2016 to 30 June 2017;3 \n \n \n \nBudget estimates for the period from 1 July 2018 to 30 June 2019 \n \n \n13. Decides to appropriate to the Special Account for the United Nations \nMission for the Referendum in Western Sahara the amount of 55,997,700 dollars for \nthe period from 1 July 2018 to 30 June 2019, inclusive of 52,350,800 dollars for the \nmaintenance of the Mission, 2,702,100 dollars for the support account for \npeacekeeping operations, 679,800 dollars for the United Nations Logistics Base at \nBrindisi, Italy, and 265,000 dollars for the Regional Service Centre in Entebbe, \nUganda; \n__________________ \n \n3  A/72/623. \n\nFinancing of the United Nations Mission for the Referendum in Western Sahara \nA/RES/72/301\n \n3/4\n18-11318 \n \n \n \nFinancing of the appropriation \n \n \n14. Decides to apportion among Member States the amount of 18,665,900 \ndollars for the period from 1 July to 31 October 2018, in accordance with the levels \nupdated in its resolution 70/246 of 23 December 2015, taking into account the scale \nof assessments for 2018, as set out in its resolution 70/245 of 23 December 2015; \n \n15. Also decides that, in accordance with the provisions of its resolution \n973 (X) of 15 December 1955, there shall be set off against the apportionment among \nMember States, as provided for in paragraph 14 above, their respective share in the \nTax Equalization Fund of 846,767 dollars, comprising the estimated staff assessment \nincome of 745,700 dollars approved for the Mission, the prorated share of 72,767 \ndollars of the estimated staff assessment income approved for the support account, \nthe prorated share of 19,433 dollars of the estimated staff assessment income \napproved for the United Nations Logistics Base and the prorated share of 8,867 \ndollars of the estimated staff assessment income approved for the Regional Service \nCentre; \n \n16. Further decides to apportion among Member States the amount of \n9,332,950 dollars for the period from 1 November to 31 December 2018, at a monthly \nrate of 4,666,475 dollars, in accordance with the levels updated in its resolution \n70/246, taking into account the scale of assessments for 2018, as set out in its \nresolution 70/245, subject to a decision of the Security Council to extend the mandate \nof the Mission; \n \n17. Decides that, in accordance with the provisions of its resolution 973 (X), \nthere shall be set off against the apportionment among Member States, as provided \nfor in paragraph 16 above, their respective share in the Tax Equalization Fund of \n423,383 dollars, comprising the estimated staff assessment income of 372,850 dollars \napproved for the Mission, the prorated share of 36,383 dollars of the estimated staff \nassessment income approved for the support account, the prorated share of 9,717 \ndollars of the estimated staff assessment income approved for the United Nations \nLogistics Base and the prorated share of 4,433 dollars of the estimated staff \nassessment income approved for the Regional Service Centre; \n \n18. Also decides to apportion among Member States the amount of 27,998,850 \ndollars for the period from 1 January to 30 June 2019, at a monthly rate of 4,666,475 \ndollars, in accordance with the scale of assessments for 2019 and the updated levels, 4 \nsubject to a decision of the Security Council to extend the mandate of the Mission; \n \n19. Further decides that, in accordance with the provisions of its resolution \n973 (X), there shall be set off against the apportionment among Member States, as \nprovided for in paragraph 18 above, their respective share in the Tax Equalization \nFund of 1,270,150 dollars, comprising the estimated staff assessment income of \n1,118,550 dollars approved for the Mission, the prorated share of 109,150 dollars of \nthe estimated staff assessment income approved for the support account, the prorated \nshare of 29,150 dollars of the estimated staff assessment income approved for the \nUnited Nations Logistics Base and the prorated share of 13,300 dollars of the \nestimated staff assessment income approved for the Regional Service Centre; \n \n20. Decides that, for Member States that have fulfilled their financial \nobligations to the Mission, there shall be set off against their apportionment, as \nprovided for in paragraph 14 above, their respective share of the unencumbered \nbalance and other revenue in the amount of 1,731,100 dollars in respect of the \nfinancial period ended 30 June 2017, in accordance with the levels updated in its \n__________________ \n \n4  To be adopted by the General Assembly. \n\nA/RES/72/301 \nFinancing of the United Nations Mission for the Referendum in Western Sahara\n \n18-11318\n4/4 \n \nresolution 70/246, taking into account the scale of assessments for 2017, as set out in \nits resolution 70/245; \n \n21. Also decides that, for Member States that have not fulfilled their financial \nobligations to the Mission, there shall be set off against their outstanding obligations \ntheir respective share of the unencumbered balance and other revenue in the amount \nof 1,731,100 dollars in respect of the financial period ended 30 June 2017, in \naccordance with the scheme set out in paragraph 20 above; \n \n22. Further decides that the decrease of 141,000 dollars in the estimated staff \nassessment income in respect of the financial period ended 30 June 2017 shall be set \noff against the credits in the amount of 1,731,100 dollars referred to in paragraphs 20 \nand 21 above; \n \n23. Emphasizes that no peacekeeping mission shall be financed by borrowing \nfunds from other active peacekeeping missions; \n \n24. Encourages the Secretary-General to continue to take additional measures \nto ensure the safety and security of all personnel participating in the Mission under \nthe auspices of the United Nations, bearing in mind paragraphs 5 and 6 of Security \nCouncil resolution 1502 (2003) of 26 August 2003; \n \n25. Invites voluntary contributions to the Mission in cash and in the form of \nservices and supplies acceptable to the Secretary-General, to be administered, as \nappropriate, in accordance with the procedure and practices established by the \nGeneral Assembly; \n \n26. Decides to include in the provisional agenda of its seventy-third session \nthe item entitled \u201cFinancing of the United Nations Mission for the Referendum in \nWestern Sahara\u201d. \n \n104th plenary meeting  \n5 July 2018 \n \n",
  "paragraphs": {
    "1": "Requests the Secretary-General to entrust the Head of Mission with the task of formulating future budget proposals in full accordance with the provisions of its resolutions 59/296 of 22 June 2005, 60/266 of 30 June 2006, 61/276 of 29 June __________________ 1 A/72/623 and A/72/731. 2 A/72/789/Add.1/Rev.1. A/RES/72/301 Financing of the United Nations Mission for the Referendum in Western Sahara 18-11318 2/4 2007, 64/269 of 24 June 2010, 65/289 of 30 June 2011, 66/264 of 21 June 2012, 69/307 of 25 June 2015 and 70/286 of 17 June 2016, as well as other relevant resolutions;",
    "2": "Takes note of the status of contributions to the United Nations Mission for the Referendum in Western Sahara as at 30 April 2018, including the contributions outstanding in the amount of 40.7 million United States dollars, representing some 3.3 per cent of the total assessed contributions, notes with concern that only 101 Member States have paid their assessed contributions in full, and urges all other Member States, in particular those in arrears, to ensure payment of their outstanding assessed contributions;",
    "3": "Expresses its appreciation to those Member States that have paid their assessed contributions in full, and urges all other Member States to make every possible effort to ensure payment of their assessed contributions to the Mission in full;",
    "4": "Expresses concern at the financial situation with regard to peacekeeping activities, in particular as regards the reimbursements to troop contributors that bear additional burdens owing to overdue payments by Member States of their assessments;",
    "5": "Emphasizes that all future and existing peacekeeping missions shall be given equal and non-discriminatory treatment in respect of financial and administrative arrangements;",
    "6": "Also emphasizes that all peacekeeping missions shall be provided with adequate resources for the effective and efficient discharge of their respective mandates;",
    "7": "Requests the Secretary-General to ensure that proposed peacekeeping budgets are based on the relevant legislative mandates;",
    "8": "Endorses the conclusions and recommendations contained in the report of the Advisory Committee on Administrative and Budgetary Questions, 2 subject to the provisions of the present resolution, and requests the Secretary-General to ensure their full implementation;",
    "9": "Decides to allocate an amount of 11,311,600 dollars for air operations from the overall resources for the Mission;",
    "10": "Requests the Secretary-General to ensure the full implementation of the relevant provisions of its resolutions 59/296, 60/266, 61/276, 64/269, 65/289, 66/264, 69/307 and 70/286;",
    "11": "Also requests the Secretary-General to take all action necessary to ensure that the Mission is administered with a maximum of efficiency and economy; Budget performance report for the period from 1 July 2016 to 30 June 2017",
    "12": "Takes note of the report of the Secretary-General on the budget performance of the Mission for the period from 1 July 2016 to 30 June 2017;3 Budget estimates for the period from 1 July 2018 to 30 June 2019",
    "13": "Decides to appropriate to the Special Account for the United Nations Mission for the Referendum in Western Sahara the amount of 55,997,700 dollars for the period from 1 July 2018 to 30 June 2019, inclusive of 52,350,800 dollars for the maintenance of the Mission, 2,702,100 dollars for the support account for peacekeeping operations, 679,800 dollars for the United Nations Logistics Base at Brindisi, Italy, and 265,000 dollars for the Regional Service Centre in Entebbe, Uganda; __________________ 3 A/72/623. Financing of the United Nations Mission for the Referendum in Western Sahara A/RES/72/301 3/4 18-11318 Financing of the appropriation",
    "14": "Decides to apportion among Member States the amount of 18,665,900 dollars for the period from 1 July to 31 October 2018, in accordance with the levels updated in its resolution 70/246 of 23 December 2015, taking into account the scale of assessments for 2018, as set out in its resolution 70/245 of 23 December 2015;",
    "15": "Also decides that, in accordance with the provisions of its resolution 973 (X) of 15 December 1955, there shall be set off against the apportionment among Member States, as provided for in paragraph 14 above, their respective share in the Tax Equalization Fund of 846,767 dollars, comprising the estimated staff assessment income of 745,700 dollars approved for the Mission, the prorated share of 72,767 dollars of the estimated staff assessment income approved for the support account, the prorated share of 19,433 dollars of the estimated staff assessment income approved for the United Nations Logistics Base and the prorated share of 8,867 dollars of the estimated staff assessment income approved for the Regional Service Centre;",
    "16": "Further decides to apportion among Member States the amount of 9,332,950 dollars for the period from 1 November to 31 December 2018, at a monthly rate of 4,666,475 dollars, in accordance with the levels updated in its resolution 70/246, taking into account the scale of assessments for 2018, as set out in its resolution 70/245, subject to a decision of the Security Council to extend the mandate of the Mission;",
    "17": "Decides that, in accordance with the provisions of its resolution 973 (X), there shall be set off against the apportionment among Member States, as provided for in paragraph 16 above, their respective share in the Tax Equalization Fund of 423,383 dollars, comprising the estimated staff assessment income of 372,850 dollars approved for the Mission, the prorated share of 36,383 dollars of the estimated staff assessment income approved for the support account, the prorated share of 9,717 dollars of the estimated staff assessment income approved for the United Nations Logistics Base and the prorated share of 4,433 dollars of the estimated staff assessment income approved for the Regional Service Centre;",
    "18": "Also decides to apportion among Member States the amount of 27,998,850 dollars for the period from 1 January to 30 June 2019, at a monthly rate of 4,666,475 dollars, in accordance with the scale of assessments for 2019 and the updated levels, 4 subject to a decision of the Security Council to extend the mandate of the Mission;",
    "19": "Further decides that, in accordance with the provisions of its resolution 973 (X), there shall be set off against the apportionment among Member States, as provided for in paragraph 18 above, their respective share in the Tax Equalization Fund of 1,270,150 dollars, comprising the estimated staff assessment income of 1,118,550 dollars approved for the Mission, the prorated share of 109,150 dollars of the estimated staff assessment income approved for the support account, the prorated share of 29,150 dollars of the estimated staff assessment income approved for the United Nations Logistics Base and the prorated share of 13,300 dollars of the estimated staff assessment income approved for the Regional Service Centre;",
    "20": "Decides that, for Member States that have fulfilled their financial obligations to the Mission, there shall be set off against their apportionment, as provided for in paragraph 14 above, their respective share of the unencumbered balance and other revenue in the amount of 1,731,100 dollars in respect of the financial period ended 30 June 2017, in accordance with the levels updated in its __________________ 4 To be adopted by the General Assembly. A/RES/72/301 Financing of the United Nations Mission for the Referendum in Western Sahara 18-11318 4/4 resolution 70/246, taking into account the scale of assessments for 2017, as set out in its resolution 70/245;",
    "21": "Also decides that, for Member States that have not fulfilled their financial obligations to the Mission, there shall be set off against their outstanding obligations their respective share of the unencumbered balance and other revenue in the amount of 1,731,100 dollars in respect of the financial period ended 30 June 2017, in accordance with the scheme set out in paragraph 20 above;",
    "22": "Further decides that the decrease of 141,000 dollars in the estimated staff assessment income in respect of the financial period ended 30 June 2017 shall be set off against the credits in the amount of 1,731,100 dollars referred to in paragraphs 20 and 21 above;",
    "23": "Emphasizes that no peacekeeping mission shall be financed by borrowing funds from other active peacekeeping missions;",
    "24": "Encourages the Secretary-General to continue to take additional measures to ensure the safety and security of all personnel participating in the Mission under the auspices of the United Nations, bearing in mind paragraphs 5 and 6 of Security Council resolution 1502 (2003) of 26 August 2003;",
    "25": "Invites voluntary contributions to the Mission in cash and in the form of services and supplies acceptable to the Secretary-General, to be administered, as appropriate, in accordance with the procedure and practices established by the General Assembly;",
    "26": "Decides to include in the provisional agenda of its seventy-third session the item entitled \u201cFinancing of the United Nations Mission for the Referendum in Western Sahara\u201d. 104th plenary meeting 5 July 2018"
  },
  "agenda_items": [
    "Item 162"
  ],
  "symbol_references": []
}