{
  "symbol": "A/RES/76/8",
  "filename": "A_RES_76_8.pdf",
  "title": "76/8. Graduation of Bangladesh, the Lao People\u2019s Democratic Republic and Nepal from the least developed country category",
  "text": "United Nations \nA/RES/76/8\n \n \nGeneral Assembly \nDistr.: General \n29 November 2021 \n \n21-17325 (E)    021221 \n*2117325* \n \n \nSeventy-sixth session \nAgenda item 9 \nReport of the Economic and Social Council \n \n \n \n \n Resolution adopted by the General Assembly \non 24 November 2021 \n \n \n \n \n[without reference to a Main Committee (A/76/L.6/Rev.1)] \n \n \n \n76/8. Graduation of Bangladesh, the Lao People\u2019s Democratic Republic \nand Nepal from the least developed country category \n \n \n \nThe General Assembly, \n \nRecalling Economic and Social Council resolution 2021/11 of 8 June 2021 on \nthe report of the Committee for Development Policy on its twenty-third session,  \n \nTaking into account its resolutions 59/209 of 20 December 2004, 65/286 of \n29 June 2011 and 67/221 of 21 December 2012 on a smooth transition for countries \ngraduating from the list of least developed countries,  \n \nRecalling paragraph 10 of its resolution 67/221, in which it decided to take note \nof the decisions of the Economic and Social Council regarding the graduation of \ncountries from the least developed country category, as well as the inclusion of \ncountries in that category, at the first session of the General Assembly following the \nadoption of the decisions,  \n \nEmphasizing that graduation from the least developed country category is a \nmajor milestone for the country involved as it means that significant progress has \nbeen made towards reaching at least some of its development goals,  \n \nNoting with great concern the negative impact on the vulnerable economies of \nthe least developed countries from the global crisis triggered by the coronavirus \ndisease (COVID-19) pandemic, which has further disrupted the sustainable \ndevelopment progress of these countries,  \n \n1. \nReaffirms that graduating from the category of least developed countries \nshould not result in a disruption or reversal of development plans, programmes and \nprojects;  \n \n2. \nTakes note of the endorsement by the Economic and Social Council of the \nrecommendation of the Committee for Development Policy that Bangladesh, the Lao \n\nA/RES/76/8 \nGraduation of Bangladesh, the Lao People\u2019s Democratic Republic \nand Nepal from the least developed country category\n \n21-17325\n2/2 \n \nPeople\u2019s Democratic Republic and Nepal be graduated from the least developed \ncountry category;  \n \n3. \nAlso takes note that the Committee found that a five-year preparatory \nperiod would be necessary for the three countries recommended for graduation at the \n2021 triennial review to effectively prepare for a smooth transition, as those countries \nwould need to prepare for graduation while planning for a post-COVID-19 recovery \nand implementing policies and strategies to reverse the economic and social damage \nincurred by the COVID-19 shock;  \n \n4. \nDecides to provide Bangladesh, the Lao People\u2019s Democratic Republic \nand Nepal, on an exceptional basis, with a five-year preparatory period leading to \ngraduation;  \n \n5. \nTakes note that the Committee will analyse at its 2024 triennial review \nwhether the five-year preparatory period has been adequate to manage the effects of \nCOVID-19 and make any recommendation, including on whether a further extension \nwould be necessary;  \n \n6. \nInvites Bangladesh, the Lao People\u2019s Democratic Republic and Nepal to \nprepare, during the five-year period between the adoption of the present resolution \nand their graduation from the least developed country category, their national smooth \ntransition strategy, with the support of the United Nations system and in cooperation \nwith their bilateral, regional and multilateral development and trading partners. \n \n40th plenary meeting \n24 November 2021 \n \n \n",
  "paragraphs": {
    "1": "Reaffirms that graduating from the category of least developed countries should not result in a disruption or reversal of development plans, programmes and projects;",
    "2": "Takes note of the endorsement by the Economic and Social Council of the recommendation of the Committee for Development Policy that Bangladesh, the Lao A/RES/76/8 Graduation of Bangladesh, the Lao People\u2019s Democratic Republic and Nepal from the least developed country category 21-17325 2/2 People\u2019s Democratic Republic and Nepal be graduated from the least developed country category;",
    "3": "Also takes note that the Committee found that a five-year preparatory period would be necessary for the three countries recommended for graduation at the 2021 triennial review to effectively prepare for a smooth transition, as those countries would need to prepare for graduation while planning for a post-COVID-19 recovery and implementing policies and strategies to reverse the economic and social damage incurred by the COVID-19 shock;",
    "4": "Decides to provide Bangladesh, the Lao People\u2019s Democratic Republic and Nepal, on an exceptional basis, with a five-year preparatory period leading to graduation;",
    "5": "Takes note that the Committee will analyse at its 2024 triennial review whether the five-year preparatory period has been adequate to manage the effects of COVID-19 and make any recommendation, including on whether a further extension would be necessary;",
    "6": "Invites Bangladesh, the Lao People\u2019s Democratic Republic and Nepal to prepare, during the five-year period between the adoption of the present resolution and their graduation from the least developed country category, their national smooth transition strategy, with the support of the United Nations system and in cooperation with their bilateral, regional and multilateral development and trading partners. 40th plenary meeting 24 November 2021"
  },
  "agenda_items": [
    "Item 9"
  ],
  "symbol_references": [
    "A/76/L.6"
  ]
}