{
  "symbol": "A/RES/75/4",
  "filename": "A_RES_75_4.pdf",
  "title": "75/4. Special session of the General Assembly in response to the coronavirus disease (COVID-19) pandemic",
  "text": "United Nations \nA/RES/75/4 \n \n \nGeneral Assembly \nDistr.: General \n9 November 2020 \n \n20-14789 (E)    111120     \n*2014789* \n \n \nSeventy-fifth session \nAgenda item 128 \nStrengthening of the United Nations system  \n \n \n \n \n Resolution adopted by the General Assembly \non 5 November 2020 \n \n \n \n \n[without reference to a Main Committee (A/75/L.8)] \n \n \n \n75/4. Special session of the General Assembly in response to the \ncoronavirus disease (COVID-19) pandemic \n \n \n \nThe General Assembly, \n \nRecalling its resolutions 74/270 of 2 April 2020, entitled \u201cGlobal solidarity to \nfight the coronavirus disease 2019 (COVID-19)\u201d, 74/274 of 20 April 2020, entitled \n\u201cInternational cooperation to ensure global access to medicines, vaccines and medical \nequipment to face COVID-19\u201d, 74/306 of 11 September 2020, entitled \u201cComprehensive \nand coordinated response to the coronavirus disease (COVID-19) pandemic\u201d, and \n74/307 of 11 September 2020, entitled \u201cUnited response against global health threats: \ncombating COVID-19\u201d, \n \nNoting with concern the threat to human health, safety and well-being caused \nby the coronavirus disease (COVID-19) pandemic, which has spread all around the \nglobe, as well as the unprecedented and multifaceted effects of the pandemic, \nincluding the severe disruption to societies, economies, global trade and travel and \nthe devastating impact on the livelihoods of people, \n \nRecognizing that the COVID-19 global pandemic requires a global response \nthat is people-centred, gender-responsive, with full respect for human rights, \nmultidimensional, coordinated, inclusive and innovative, based on unity, solidarity \nand multilateral cooperation, \n \nReaffirming its commitment to international cooperation and multilateralism and \nnoting the fundamental role of the United Nations system in the comprehensive global \nresponse to the COVID-19 pandemic, including the crucial role played by the World \nHealth Organization, and the crucial efforts of Member States therein, \n \nNoting that a majority of States Members of the United Nations have concurred \nwith the request, submitted on behalf of the States members of the Movement of \nNon-Aligned Countries, to convene a special session of the General Assembly in \nresponse to the COVID-19 pandemic, at the level of Heads of State and Government, \n\nA/RES/75/4 \nSpecial session of the General Assembly in response \nto the coronavirus disease (COVID-19) pandemic\n \n20-14789\n2/4 \n \n \nRecalling its decisions S-31/1, S-31/2 and S-31/3 of 15 July 2020, S-31/4, \nS-31/5 and S-31/6 of 21 July 2020, and S-31/7 and S-31/8 of 14 September 2020, \n \n1. \nDecides that the special session of the General Assembly in response to \nthe COVID-19 pandemic at the level of Heads of State and Government will be held \nfor two days, on 3 and 4 December 2020, from 9 a.m. to 9 p.m. at United Nations \nHeadquarters in New York; \n \n2. \nAlso decides that the proceedings of the special session shall be governed \nby the rules of procedure of the General Assembly; \n \n3. \nFurther decides that the organizational arrangements for the special \nsession shall be as follows: \n \n(a) \nThe special session shall consist of: \n \n(i) \nAn opening segment; \n \n(ii) A general debate; \n \n(iii) A presentation by and an interactive dialogue led by the Head of the World \nHealth Organization and other relevant United Nations entities1 and, if time \npermits, with relevant stakeholders, on their inter-agency coordination efforts \nto address the COVID-19 pandemic and its impacts; \n \n(iv) A closing segment; \n \n(b) \nThe opening of the special session shall include statements by the \nPresident of the General Assembly, the Secretary-General, including in his role as \nChair of the United Nations System Chief Executives Board for Coordination, the \nPresident of the Economic and Social Council, the President of the Security Council \nand the Chair of the Movement of Non-Aligned Countries; \n \n(c) \nThe general debate shall take place on the first day of the special session \nand shall include statements by Member and Observer States, the European Union, \nand, time permitting, a limited number of representatives from relevant organizations \nattending the special session, in line with subparagraphs (d) and (e) below, selected \nby the President of the General Assembly, in consultation with Member States, with \ndue regard for geographical balance and gender equity; the list of speakers shall be \nestablished in accordance with the established practices of the Assembly, and the time \nlimit for the statements will be five minutes for individual delegations and seven \nminutes for statements made on behalf of a group of States; \n__________________ \n \n1 Including the United Nations funds, programmes and specialized agencies, other entities and \nbodies, and other departments of the Secretariat, as follows: Food and Agriculture Organization \nof the United Nations, International Civil Aviation Organization, International Fund for \nAgricultural Development, International Labour Organization, International Maritime \nOrganization, International Monetary Fund, International Telecommunication Union, Joint \nUnited Nations Programme on HIV/AIDS (UNAIDS), Office for the Coordination of \nHumanitarian Affairs, Office of the United Nations High Commissioner for Human Rights, \nOffice of the United Nations High Commissioner for Refugees, United Nations Children\u2019s Fund, \nUnited Nations Development Programme, United Nations Educational, Scientific and Cultural \nOrganization, United Nations Entity for Gender Equality and the Empowerment of Women \n(UN-Women), United Nations Environment Programme, United Nations Human Settlements \nProgramme (UN-Habitat), United Nations Industrial Development Organization, United Nations \nInstitute for Disarmament Research, United Nations Institute for Training and Research, United \nNations Office for Project Services, United Nations Population Fund, United Nations Relief and \nWorks Agency for Palestine Refugees in the Near East, United Nations System Staff College, \nUnited Nations University, Universal Postal Union, World Bank, World Food Programme, World \nHealth Organization, World Intellectual Property Organization, World Meteorological \nOrganization and World Trade Organization. \n\nSpecial session of the General Assembly in response  \nto the coronavirus disease (COVID-19) pandemic \nA/RES/75/4\n \n3/4\n20-14789 \n \n \n(d) \nRepresentatives of non-governmental organizations in consultative status \nwith the Economic and Social Council are invited to participate in the special session \nin accordance with the rules of procedure and established practice of the General \nAssembly; \n \n(e) \nRecalling the established practice of the General Assembly, the President \nof the General Assembly shall draw up a list of other relevant representatives of \nnon-governmental organizations, civil society organizations, academic institutions \nand the private sector who may participate in the special session, taking into account \nthe principles of transparency and equitable geographical representation, with due \nregard for the meaningful participation of women, and submit the list to Member \nStates for their consideration on a non-objection basis;2 \n \n4. \nDecides, without setting a precedent for future special sessions, that, in \nconnection with the limitations recommended for meetings held on United Nations \npremises as precautionary measures aimed at containing the spread of COVID-19: \n \n(a) \nWithout setting a precedent for future special sessions of the General \nAssembly, each Member State, Observer State, and the European Union, as well as \nrepresentatives from relevant organizations attending the special session, in line with \nsubparagraphs (a), (d) and (e) of paragraph 3 above, can submit a pre-recorded \nstatement by their Head of State or Government, head of delegation or other dignitary, \nwhich will be played in the General Assembly Hall during the opening and general \ndebate of the special session, after introduction by their representative who is \nphysically present in the Assembly Hall; \n \n(b) \nIn addition to the verbatim records of the special session, the President of \nthe General Assembly will circulate as a document of the Assembly a compilation \ndocument of the statements delivered by Heads of State and Government or other \ndignitaries by means of pre-recorded statements during the special session and \nsubmitted to the President no later than the day on which the pre-recorded statement \nis played in the Assembly Hall; \n \n(c) \nThese procedures shall apply only to the meetings of the special session \nof the General Assembly in response to the COVID-19 pandemic; \n \n5. \nAlso decides that the proceedings of the special session shall be webcast, \nand encourages the President of the General Assembly and the Secretary-General to \ngive the highest visibility to the special session, through all relevant media platforms \nand information and communications technologies; \n \n6. \nRequests the Secretary-General to include in his statement, as appropriate, \ninformation about the implementation of the relevant General Assembly resolutions \non the COVID-19 pandemic, including but not limited to, access to vaccines and \nmedical equipment to face the COVID-19 pandemic; \n \n7. \nInvites all relevant United Nations system entities, including United \nNations funds, programmes, and specialized agencies and regional commissions, as \nwell as relevant intergovernmental, regional and subregional organizations, to \nparticipate in the special session; \n \n8. \nRequests the President of the General Assembly to prepare an informal \nfactual summary to reflect information presented during the special session; \n__________________ \n \n2 The list will include proposed as well as final names. The general basis of any objections, if \nrequested by one or more States Members of the United Nations or States members of the \nspecialized agencies, will be made known to the Office of the President of the General Assembly \nand the requester. \n\nA/RES/75/4 \nSpecial session of the General Assembly in response \nto the coronavirus disease (COVID-19) pandemic\n \n20-14789\n4/4 \n \n \n9. \nAlso requests the President of the General Assembly, in consultation with \nMember States, to finalize the other organizational arrangements for the special \nsession; \n \n10. Decides that the special session shall be conducted within existing \nresources.  \n \n21st plenary meeting \n5 November 2020 \n \n",
  "paragraphs": {
    "1": "Decides that the special session of the General Assembly in response to the COVID-19 pandemic at the level of Heads of State and Government will be held for two days, on 3 and 4 December 2020, from 9 a.m. to 9 p.m. at United Nations Headquarters in New York;",
    "2": "Also decides that the proceedings of the special session shall be governed by the rules of procedure of the General Assembly;",
    "3": "Further decides that the organizational arrangements for the special session shall be as follows: (a) The special session shall consist of: (i) An opening segment; (ii) A general debate; (iii) A presentation by and an interactive dialogue led by the Head of the World Health Organization and other relevant United Nations entities1 and, if time permits, with relevant stakeholders, on their inter-agency coordination efforts to address the COVID-19 pandemic and its impacts; (iv) A closing segment; (b) The opening of the special session shall include statements by the President of the General Assembly, the Secretary-General, including in his role as Chair of the United Nations System Chief Executives Board for Coordination, the President of the Economic and Social Council, the President of the Security Council and the Chair of the Movement of Non-Aligned Countries; (c) The general debate shall take place on the first day of the special session and shall include statements by Member and Observer States, the European Union, and, time permitting, a limited number of representatives from relevant organizations attending the special session, in line with subparagraphs (d) and (e) below, selected by the President of the General Assembly, in consultation with Member States, with due regard for geographical balance and gender equity; the list of speakers shall be established in accordance with the established practices of the Assembly, and the time limit for the statements will be five minutes for individual delegations and seven minutes for statements made on behalf of a group of States; (d) Representatives of non-governmental organizations in consultative status with the Economic and Social Council are invited to participate in the special session in accordance with the rules of procedure and established practice of the General Assembly; (e) Recalling the established practice of the General Assembly, the President of the General Assembly shall draw up a list of other relevant representatives of non-governmental organizations, civil society organizations, academic institutions and the private sector who may participate in the special session, taking into account the principles of transparency and equitable geographical representation, with due regard for the meaningful participation of women, and submit the list to Member States for their consideration on a non-objection basis;2",
    "4": "Decides, without setting a precedent for future special sessions, that, in connection with the limitations recommended for meetings held on United Nations premises as precautionary measures aimed at containing the spread of COVID-19: (a) Without setting a precedent for future special sessions of the General Assembly, each Member State, Observer State, and the European Union, as well as representatives from relevant organizations attending the special session, in line with subparagraphs (a), (d) and (e) of paragraph 3 above, can submit a pre-recorded statement by their Head of State or Government, head of delegation or other dignitary, which will be played in the General Assembly Hall during the opening and general debate of the special session, after introduction by their representative who is physically present in the Assembly Hall; (b) In addition to the verbatim records of the special session, the President of the General Assembly will circulate as a document of the Assembly a compilation document of the statements delivered by Heads of State and Government or other dignitaries by means of pre-recorded statements during the special session and submitted to the President no later than the day on which the pre-recorded statement is played in the Assembly Hall; (c) These procedures shall apply only to the meetings of the special session of the General Assembly in response to the COVID-19 pandemic;",
    "5": "Also decides that the proceedings of the special session shall be webcast, and encourages the President of the General Assembly and the Secretary-General to give the highest visibility to the special session, through all relevant media platforms and information and communications technologies;",
    "6": "Requests the Secretary-General to include in his statement, as appropriate, information about the implementation of the relevant General Assembly resolutions on the COVID-19 pandemic, including but not limited to, access to vaccines and medical equipment to face the COVID-19 pandemic;",
    "7": "Invites all relevant United Nations system entities, including United Nations funds, programmes, and specialized agencies and regional commissions, as well as relevant intergovernmental, regional and subregional organizations, to participate in the special session;",
    "8": "Requests the President of the General Assembly to prepare an informal factual summary to reflect information presented during the special session;",
    "9": "Also requests the President of the General Assembly, in consultation with Member States, to finalize the other organizational arrangements for the special session;",
    "10": "Decides that the special session shall be conducted within existing resources."
  },
  "agenda_items": [
    "Item 128"
  ],
  "symbol_references": [
    "A/75/L.8"
  ]
}