{
  "symbol": "A/RES/78/136",
  "filename": "A_RES_78_136.pdf",
  "title": "78/136. International financial system and development",
  "text": "United Nations \nA/RES/78/136\n \n \nGeneral Assembly \nDistr.: General \n21 December 2023 \n \n23-25926 (E)    291223 \n*2325926* \n \n \nSeventy-eighth session \nAgenda item 16 (b) \nMacroeconomic policy questions: international financial \nsystem and development  \n \n \n \n \n Resolution adopted by the General Assembly \non 19 December 2023 \n \n \n \n \n[on the report of the Second Committee (A/78/459/Add.2, para. 7)] \n \n \n 78/136. International financial system and development \n \n \n \nThe General Assembly, \n \nRecalling its resolutions 55/186 of 20 December 2000 and 56/181 of 21 December \n2001, entitled \u201cTowards a strengthened and stable international financial architecture \nresponsive to the priorities of growth and development, especially in developing \ncountries, and to the promotion of economic and social equity\u201d, as well as its \nresolutions 57/241 of 20 December 2002, 58/202 of 23 December 2003, 59/222 of \n22 December 2004, 60/186 of 22 December 2005, 61/187 of 20 December 2006, \n62/185 of 19 December 2007, 63/205 of 19 December 2008, 64/190 of 21 December \n2009, 65/143 of 20 December 2010, 66/187 of 22 December 2011, 67/197 of \n21 December 2012, 68/201 of 20 December 2013, 69/206 of 19 December 2014, \n70/188 of 22 December 2015, 71/215 of 21 December 2016, 72/203 of 20 December \n2017, 73/220 of 20 December 2018, 74/202 of 19 December 2019, 75/204 of \n21 December 2020, 76/192 of 17 December 2021 and 77/152 of 14 December 2022,  \n \nReaffirming its resolution 70/1 of 25 September 2015, entitled \u201cTransforming \nour world: the 2030 Agenda for Sustainable Development\u201d, in which it adopted a \ncomprehensive, far-reaching and people-centred set of universal and transformative \nSustainable Development Goals and targets, its commitment to working tirelessly for \nthe full implementation of the Agenda by 2030, its recognition that eradicating \npoverty in all its forms and dimensions, including extreme poverty, is the greatest \nglobal challenge and an indispensable requirement for sustainable development, its \ncommitment to achieving sustainable development in its three dimensions \u2013 \neconomic, social and environmental \u2013 in a balanced and integrated manner, and to \nbuilding upon the achievements of the Millennium Development Goals and seeking \nto address their unfinished business,  \n \nReaffirming also its resolution 69/313 of 27 July 2015 on the Addis Ababa \nAction Agenda of the Third International Conference on Financing for Development, \nwhich is an integral part of the 2030 Agenda for Sustainable Development, supports \n\nA/RES/78/136 \nInternational financial system and development\n \n23-25926\n2/13 \n \nand complements it, helps to contextualize its means of implementation targets with \nconcrete policies and actions, and reaffirms the strong political commitment to \naddress the challenge of financing and creating an enabling environment at all levels \nfor sustainable development in the spirit of global partnership and solidarity,  \n \nRecalling the Doha Declaration on Financing for Development: outcome \ndocument of the Follow-up International Conference on Financing for Development \nto Review the Implementation of the Monterrey Consensus, held in Doha from \n29 November to 2 December 2008,1  \n \nRecalling also the United Nations Millennium Declaration,2 its resolution 56/210 B \nof 9 July 2002, in which it endorsed the Monterrey Consensus of the International \nConference on Financing for Development,3 the Rio Declaration on Environment and \nDevelopment,4 Agenda 21,5 the Programme for the Further Implementation of Agenda 216 \nand the Plan of Implementation of the World Summit on Sustainable Development, 7  \n \nRecalling further the Conference on the World Financial and Economic Crisis \nand Its Impact on Development and its outcome document, 8 recognizing the work \nundertaken by the Ad Hoc Open-ended Working Group of the General Assembly to \nfollow up on the issues contained in the Outcome of the Conference, and recalling its \nprogress report,9  \n \nRecalling the United Nations Conference on Sustainable Development, held in \nRio de Janeiro, Brazil, from 20 to 22 June 2012, and its outcome document, entitled \n\u201cThe future we want\u201d,10  \n \nAppreciating the fact that the Summit of the Group of 20 held in Hangzhou, \nChina, on 4 and 5 September 2016, with the broad participation of developing \ncountries, including the Chair of the Group of 77, endorsed the Group of 20 Action \nPlan on the 2030 Agenda for Sustainable Development as an important contribution \nto the global implementation of the 2030 Agenda, recalling that the Summit of the \nGroup of 20 held in Hamburg, Germany, on 7 and 8 July 2017 endorsed the Hamburg \nUpdate: Taking Forward the Group of 20 Action Plan on the 2030 Agenda for \nSustainable Development, recalling also that the Summit of the Group of 20 held in \nBuenos Aires on 30 November and 1 December 2018 endorsed the Buenos Aires \nUpdate: Moving Forward the Group of 20 Action Plan on the 2030 Agenda for \nSustainable Development, recalling further that the Summit of the Group of 20 held \nin Osaka, Japan, on 28 and 29 June 2019 endorsed the Osaka Update on the Group of \n20 Action Plan on the 2030 Agenda for Sustainable Development, recalling that the \nSummit of the Group of 20, held virtually on 21 and 22 November 2020, endorsed \nthe Riyadh Update on the Group of 20 Action Plan on the 2030 Agenda for Sustainable \nDevelopment, recalling also that the Summit of the Group of 20 held in Rome on \n__________________ \n \n1  Resolution 63/239, annex. \n \n2  Resolution 55/2. \n \n3  Report of the International Conference on Financing for Development, Monterrey, Mexico, \n18 \u2013 22 March 2002 (United Nations publication, Sales No. E.02.II.A.7), chap. I, resolution 1, \nannex. \n \n4  Report of the United Nations Conference on Environment and Development, Rio de Janeiro, \n3 \u2013 14 June 1992, vol. I, Resolutions Adopted by the Conference (United Nations publication, \nSales No. E.93.I.8 and corrigendum), resolution 1, annex I. \n \n5  Ibid., annex II. \n \n6  Resolution S-19/2, annex. \n \n7  Report of the World Summit on Sustainable Development, Johannesburg, South Africa, \n26 August\u20134 September 2002 (United Nations publication, Sales No. E.03.II.A.1 and \ncorrigendum), chap. I, resolution 2, annex. \n \n8  Resolution 63/303, annex. \n \n9  A/64/884. \n \n10  Resolution 66/288, annex. \n\nInternational financial system and development \nA/RES/78/136\n \n3/13\n23-25926 \n \n30 and 31 October 2021 endorsed the Rome Update on the Group of 20 Action Plan \non the 2030 Agenda for Sustainable Development, recalling further that the Summit \nof the Group of 20 held in Bali, Indonesia, on 15 and 16 November 2022 endorsed \nthe Bali Update on the Group of 20 Action Plan on the 2030 Agenda for Sustainable \nDevelopment and the Group of 20 Development Commitments, recalling that the \nSummit of the Group of 20 held in New Delhi on 9 and 10 September 2023 endorsed \nthe 2023 Action Plan to Accelerate Progress on the Sustainable Development Goals, \nand looking forward to their implementation, while urging the Group of 20 to continue \nto engage in an inclusive and transparent manner with other States Members of the \nUnited Nations in its work in order to ensure that the initiatives of the Group of 20 \ncomplement or strengthen the United Nations system,  \n \nNoting the holding of the twenty-sixth Saint Petersburg International Economic \nForum in Saint Petersburg, Russian Federation, from 14 to 17 June 2023, and noting \nalso the Financing for Development in the Era of COVID-19 and Beyond Initiative,  \n \nTaking note of the proposal by the Secretary-General, in his report entitled \u201cOur \nCommon Agenda\u201d, regarding a biennial summit between the members of the Group \nof 20 and of the Economic and Social Council, the Secretary-General and the heads \nof the international financial institutions,11  \n \nRecalling the establishment of the Global Crisis Response Group on Food, \nEnergy and Finance, chaired and convened by the Secretary-General, and taking note \nof its briefs on the three-dimensional crisis,  \n \nNoting with great concern the severe negative impact on human health, safety \nand well-being caused by the coronavirus disease (COVID-19) pandemic, as well as \nthe severe disruption to societies and economies and the devastating impact on lives \nand livelihoods, and that the poorest and most vulnerable are the hardest hit by the \npandemic, reaffirming the ambition to get back on track to achieve the Sustainable \nDevelopment Goals by designing and implementing sustainable and inclusive \nrecovery strategies to accelerate progress towards the full implementation of the 2030 \nAgenda for Sustainable Development and to help to reduce the risk of and build \nresilience to future shocks, crises and pandemics, including by strengthening health \nsystems and achieving universal health coverage, and recognizing that equitable and \ntimely access for all to safe, quality, effective and affordable COVID-19 vaccines, \ntherapeutics and diagnostics are an essential part of a global response based on unity, \nsolidarity, renewed multilateral cooperation and the principle of leaving no one behind,  \n \nNoting with great concern also that the COVID-19 pandemic, and the social and \neconomic crisis that it has triggered, geopolitical tensions and conflicts have \namplified underlying risks in the international financial system and brought to the \nfore the growing importance of non-economic risks, including climate and disaster \nrisks, as well as opportunities and risks associated with the rapid digitization of the \neconomy, that women, young people and informal and low-skilled workers face a \nhigher share of job losses, that many micro-, small and medium-sized enterprises have \nhad to close or are at risk of closing amid uncertain prospects for economic recovery \nand the emergence of new variants of the coronavirus, that most developing countries \nlack the resources to implement large-scale monetary and fiscal policy responses and \nthat debt risks and liquidity constraints remain elevated for many developing \ncountries, leading to a risk of a diverging and uneven recovery, and having already \ncontributed to the finance divide between and within countries, \n \nRecognizing the steps that the international community, including the \nInternational Monetary Fund, the World Bank and the Group of 20, along with \nregional financial arrangements and development banks, has taken to respond to the \n__________________ \n \n11  See A/75/982. \n\nA/RES/78/136 \nInternational financial system and development\n \n23-25926\n4/13 \n \ncrisis through increased global liquidity and debt relief measures for the poorest \ncountries, and recognizing also that the COVID-19 crisis along with the current \nmultiple crises have exposed and exacerbated gaps and vulnerabilities in the \ninternational system and underscored the importance of strengthening the global \nfinancial safety net and the need to work together to help to build a more resilient and \nsustainable global economy and that more remains to be done, also noting that the \nscale and prolonged duration of the crisis call for continued concerted and inclusive \nefforts to mitigate the impacts of the pandemic on economies and people and to ensure \na more inclusive, sustainable and resilient recovery,  \n \nRecognizing also that the current multiple crises, the adverse impacts of climate \nchange and the remaining effects of the world financial and economic crisis, as well \nas the COVID-19 pandemic have undermined debt sustainability and progress \ntowards achieving the internationally agreed development goals, including the \nSustainable Development Goals, especially in developing countries, and stressing the \nneed to better prepare for such crises that may happen in the future, including by \naddressing the lessons learned, improving confidence, sustaining economic growth, \ninvesting in the adoption of resilience measures and promoting full and productive \nemployment and decent work for all women and men, including young people, older \npersons and people with disabilities, and by continuing to promote global economic \nstability and the underlying institutional reforms required to achieve the Sustainable \nDevelopment Goals,  \n \nExpressing concern about the adverse impact of the continuing fragility of the \nglobal economy, the slow pace of the restoration of global growth and trade, \nincreasing protectionism and inward-looking policies, continued high inflation, high \ninterest rates and increasing debt vulnerabilities, with increasing systemic risks that \nthreaten financial stability, including in developing countries,  \n \nNoting the growing usage of local currencies in cross-border payments, \nincluding for trade and investment, from the standpoint that it can contribute to \nreducing vulnerabilities,  \n \nExpressing concern at the continued decline in correspondent banking \nrelationships, impacting the ability to send and receive international payments, with \npotential consequences for the cost of remittances, which remain high, affecting those \nin vulnerable situations, such as migrants, financial inclusion and international trade, \namong other areas, and thus for the achievement of the Sustainable Development Goals,  \n \nReaffirming the purposes and principles of the United Nations, as set forth in its \nCharter, including, inter alia, to achieve international cooperation in solving \ninternational problems of an economic, social, cultural or humanitarian character, and \nto be a centre for harmonizing the actions of nations in the attainment of common \nends, and reiterating the need to strengthen the leadership role of the United Nations \nin promoting development,  \n \nRecognizing the contribution of the original and reconvened Panel of Eminent \nPersons of the United Nations Conference on Trade and Development in the context \nof the United Nations sustainable development pillar and United Nations reform, as \nwell as the contribution of the United Nations system to sustainable finance and \ninvestments in the Sustainable Development Goals, and recognizing also the \ncontribution of the independent team of advisers to the Economic and Social Council \ndialogue on the longer-term positioning of the United Nations development system in \nthe context of the implementation of the 2030 Agenda,  \n \nRecognizing also that adequate incentives for international and private investors \nto adopt longer-term investment strategies can support the achievement of sustainable \ndevelopment and potentially reduce capital market volatility,  \n\nInternational financial system and development \nA/RES/78/136\n \n5/13\n23-25926 \n \n \nEmphasizing that the international financial system should bolster sustainable, \ninclusive and sustained economic growth, sustainable development and job creation, \npromote financial inclusion and support efforts to eradicate poverty in all its forms \nand dimensions, including extreme poverty, and hunger, in particular in developing \ncountries, while allowing for the coherent mobilization of all sources of financing for \ndevelopment,  \n \nTaking note of the work of the United Nations in the area of external debt \nsustainability and development,  \n \nRecognizing the importance of scaling up international tax cooperation, and in \nthis regard welcoming the work of the Committee of Experts on International \nCooperation in Tax Matters and the support to tax authorities of developing countries \nthrough the Addis Tax Initiative, which contribute to the mobilization of domestic \nresources for the Sustainable Development Goals and the curbing of illicit financial \nflows and tax evasion,  \n \nRecognizing also the need to reduce mechanistic reliance on credit-rating \nagency assessments, including in regulations, and to promote increased competition \nas well as measures to avoid conflict of interest in the provision of credit ratings in \norder to improve the quality of ratings, acknowledging the efforts of the Financial \nStability Board and others in this area, and affirming the commitment to continue \nongoing work on these issues, while noting with concern that some countries stated \nthat the fear of a credit rating downgrade discouraged them from accessing the Group \nof 20 and Paris Club Debt Service Suspension Initiative,  \n \nAcknowledging the 2016 implementation of quota and governance reforms at \nthe International Monetary Fund and the 2018 agreement on shareholding reforms at \nthe World Bank Group, including a general capital increase, a selective capital \nincrease and a financial sustainability framework, the conclusion of the fifteenth \ngeneral quota review by the Board of Governors of the Fund in February 2020, and \nthe twentieth replenishment of the International Development Association, with a \nfinancing package amounting to 93 billion United States dollars, and acknowledging \nalso that, in October 2016, the Chinese renminbi officially became the fifth currency \nin the special drawing rights basket, pursuant to the decision taken by the Executive \nBoard of the Fund in November 2015,  \n \n1. \nTakes note of the report of the Secretary-General;12  \n \n2. \nRecognizes the need to continue and intensify efforts to enhance the \ncoherence and consistency of the international monetary, financial and trading systems, \nreiterates the importance of ensuring their openness, fairness and inclusiveness in order \nto complement national efforts to ensure sustainable development, including strong, \nsustained, balanced, inclusive and equitable economic growth, and that all people, in \nparticular the poor and vulnerable, have equal rights to economic resources and \nappropriate financial services, and the achievement of the internationally agreed \ndevelopment goals, including the Sustainable Development Goals and the Paris \nAgreement, 13  and encourages the international financial institutions to align their \nprogrammes and policies with the 2030 Agenda for Sustainable Development 14 in \naccordance with their mandates;  \n \n3. \nAlso recognizes that the twenty-first century requires an international \ndevelopment finance system that is fit for purpose, including for the scale of need and \ndepth of the shocks facing developing countries, in particular the poorest and most \n__________________ \n \n12  A/78/178. \n \n13  See FCCC/CP/2015/10/Add.1, decision 1/CP.21, annex. \n \n14  Resolution 70/1. \n\nA/RES/78/136 \nInternational financial system and development\n \n23-25926\n6/13 \n \nvulnerable, keeping pace with a changing global landscape characterized by deeply \nintegrated financial markets, multiple crises with cascading effects, systemic risks, \nthe adverse impacts of climate change, shifting trade and financial relations, and rapid \ntechnological change, recognizes in this regard the urgent need for bold and ambitious \nreforms to create a stable, sustainable and inclusive international financial \narchitecture, and reiterates that the international financial architecture, including its \nbusiness models and financing capacities, must be made more fit for purpose, \nequitable and responsive to the financing needs of developing countries, to broaden \nand strengthen the voice and participation of developing countries in international \neconomic decision-making, norm-setting and global economic governance;  \n \n4. \nWelcomes the work of the High-level Panel on the Development of a \nMultidimensional Vulnerability Index for Small Island Developing States, which was \nco-chaired by the Prime Minister of Antigua and Barbuda, Gaston Browne, and the \nformer Prime Minister of Norway, Erna Solberg, including its consultations with \nMember States, and in this regard takes note of the Panel\u2019s final report and the \nrecommendations contained therein;  \n \n5. \nNotes that the United Nations, on the basis of its universal membership \nand legitimacy, provides a unique and key forum for discussing international \neconomic issues and their impact on development, and reaffirms that the United \nNations is well positioned to participate in various reform processes aimed at \nimproving and strengthening the effective functioning of the international financial \nsystem and architecture, while recognizing that the United Nations and the \ninternational financial institutions have complementary mandates that make the \ncoordination of their actions crucial;  \n \n6. \nRecognizes the important efforts undertaken nationally, regionally and \ninternationally to respond to the challenges posed by the global financial and \neconomic crisis, the COVID-19 pandemic and the recent multiple crises, and also \nrecognizes that more needs to be done in order to promote the economic recovery, to \nmanage the consequences of volatility in global financial and commodity markets, \nespecially continued high inflation, high interest rates and exchange rate pressures, \nas well as capital flight from shock-vulnerable countries, to tackle high \nunemployment and rising indebtedness in many countries, as well as widespread \nfiscal strains, to reinforce the banking sector, including by increasing its transparency \nand accountability, to address systemic fragilities and imbalances, to reform and \nstrengthen the international financial system and to continue and to enhance the \ncoordination of financial and economic policies at the international level;  \n \n7. \nAcknowledges that growing risks from more frequent and interconnected \nshocks require new and innovative financing instruments to boost the availability of \nresources for all countries in need;  \n \n8. \nAlso acknowledges that endeavours to overcome the global financial and \neconomic crisis, the COVID-19 pandemic and the recent multiple crises must go \nbeyond short-term relief, and recognizes the need for continued action to support the \ndeveloping countries, including middle-income countries, that are most in need, on \nan inclusive basis, including through enhanced cooperation between the United \nNations and international financial institutions and multilateral and regional \ndevelopment banks, according to their respective mandates, net positive flows from \nthe international financial institutions to developing countries, sufficient concessional \nfinance by, inter alia, enhancing access to concessional, long-term loans and \ndevelopment assistance while mobilizing catalytically additional resources from the \nprivate sector and assisting developing countries in addressing debt vulnerability and \nliquidity risk in the immediate term and in attaining debt sustainability in the long \nterm, notes the multilateral response to the pandemic, including the Group of 20 and \n\nInternational financial system and development \nA/RES/78/136\n \n7/13\n23-25926 \n \nParis Club Debt Service Suspension Initiative, and remains concerned with the lack \nof participation of private creditors, appreciates the recent progress made in the \nongoing implementation of the Common Framework for Debt Treatments beyond the \nDebt Service Suspension Initiative, encourages the Group of 20 and Paris Club \ncreditors to discuss options for implementing comparability of the treatment of \nprivate and other official bilateral creditors, expanding support to highly indebted \ndeveloping countries, considering the provision of temporary debt standstills on a \ncase-by-case basis throughout negotiations and facilitating rapid recovery of capital \nmarket access following restructuring, and calls for stepping up efforts to improve \nand implement the Common Framework in a timely, orderly, predictable and \ncoordinated manner, noting the possibility for greater collaboration of credit rating \nagencies in this regard, and notes the liquidity support for countries with liquidity \nconstraints and the forthcoming evaluation of funding needs of the International \nMonetary Fund Catastrophe Containment and Relief Trust;  \n \n9. \nRecognizes the role of special drawing rights as an international reserve \nasset, acknowledges that special drawing rights allocations helped to supplement \ninternational reserves in response to the world financial and economic crisis as well \nas the COVID-19 pandemic, thus contributing to the stability of the international \nfinancial system and global economic resilience, and supports the continued \nexamination of the broader use of special drawing rights as a way to enhance the \nresilience of the international monetary system, including with reference to their \npotential role in the international reserve system;  \n \n10. Welcomes the special drawing rights allocation of the equivalent of \n650 billion United States dollars of 23 August 2021, recommends the exploration of \nfurther voluntary options related to special drawing rights that could serve the needs \nof developing member countries of the International Monetary Fund, calls for the \nurgent voluntary rechannelling of special drawing rights for countries most in need, \nincluding through multilateral development banks, while respecting relevant legal \nframeworks and preserving the reserve asset character of special drawing rights, and \nwill explore ways for future allocations of special drawing rights to benefit those \ncountries most in need;  \n \n11. \nTakes note with appreciation of the operationalization of the Resilience \nand Sustainability Trust of the International Monetary Fund to help eligible countries \naddress longer-term structural challenges that pose macroeconomic risks, looks \nforward to the upcoming interim review of the Trust, and notes that debt sustainability \nand liquidity can play an important role in achieving a sustainable, inclusive and \nresilient recovery and the Sustainable Development Goals;  \n \n12. Stresses that multilateral development banks are a key component of the \nreform of the international financial system, and also stresses the need to strengthen \nmultilateral development banks and consider an increase in concessional funding \nfrom multilateral development banks, taking note of the recommendations under the \nCapital Adequacy Framework review by multilateral development banks to increase \ntheir lending and for the consideration of global financial system reform, which \nincludes lending criteria that complement or go beyond gross domestic product and \nare based on a comprehensive understanding of multidimensional factors, including \nbut not limited to vulnerability and resilience of developing countries;  \n \n13. Urges multilateral development banks to bring forward actions to mobilize \nand provide additional financing within their mandates to support developing \ncountries to achieve the Sustainable Development Goals, supports multilateral \ndevelopment bank reform efforts and calls for continued tangible progress in this \nregard, including through securing increases to grants and concessional finance, \nbetter leveraging their capital bases and considering ways for the respective boards \n\nA/RES/78/136 \nInternational financial system and development\n \n23-25926\n8/13 \n \nof the multilateral development banks to increase their capitalization, and encourages \ndialogue between multilateral development banks and other financial institutions;  \n \n14. Stresses the critical importance of a stable, inclusive and enabling global \neconomic environment for the advancement of sustainable development, for the reliable \nand effective financing of development and for the implementation of the 2030 Agenda, \nmobilizing public and private, as well as domestic and international resources;  \n \n15. Notes the adoption by the Statistical Commission of the proposed new \nindicator 17.3.1 under Sustainable Development Goal target 17.3 (Mobilize \nadditional financial resources for developing countries from multiple sources), also \nnotes the need for open, inclusive and transparent discussions on the modernization \nof official development assistance measurement and the new measure of \u201ctotal official \nsupport for sustainable development\u201d, and affirms that any such measure will not \ndilute commitments already made;  \n \n16. Reiterates that debtors and creditors, including both public and private, \nmust work together in a transparent manner to prevent and resolve unsustainable debt \nsituations and that maintaining sustainable debt levels is the responsibility of the \nborrowing countries, acknowledging, however, that lenders also have a responsibility \nto lend in a way that does not undermine a country\u2019s debt sustainability, and in this \nregard takes note of the United Nations Conference on Trade and Development \nprinciples on responsible sovereign lending and borrowing and recognizes the \napplicable requirements of the International Monetary Fund debt limits policy and/or \nthe World Bank Sustainable Development Finance Policy, as well as the safeguards \nof the Development Assistance Committee of the Organisation for Economic \nCo-operation and Development in its statistical system to enhance the debt \nsustainability of recipient countries, and will work towards a global consensus on \nguidelines for debtor and creditor responsibilities in borrowing by and lending to \nsovereigns, building on existing initiatives;  \n \n17. Invites, in this regard, the President of the General Assembly and the \nSecretary-General to give appropriate consideration to the central role of maintaining \nand facilitating the financial and macroeconomic stability of developing countries, \nincluding debt sustainability, and of supporting an appropriately enabling domestic \nand international economic, financial and regulatory environment for the means of \nimplementation of the 2030 Agenda, including financial inclusion, and in this regard \ninvites all major institutional stakeholders, including the International Monetary \nFund, the World Bank and the United Nations Conference on Trade and Development, \nto support these efforts, in accordance with their respective mandates;  \n \n18. Encourages, in this regard, the Economic and Social Council to consider, \nat its annual forum on financing for development follow-up, a dedicated discussion \nand analysis of systemic issues and challenges, taking into account the roles of all \ninternational financial institutions and also the United Nations Conference on Trade \nand Development, in accordance with their respective mandates, pursuant to the \nrelevant resolutions on this matter, including its resolution 69/313 on the Addis Ababa \nAction Agenda of the Third International Conference on Financing for Development \nand the mandate of the annual forum on financing for development follow-up set out \ntherein;  \n \n19. Resolves to strengthen the coherence and consistency of multilateral \nfinancial, investment, trade and development policy and environment institutions and \nplatforms and to increase cooperation between major international institutions, while \nrespecting mandates and governance structures, and commits itself to taking better \nadvantage of relevant United Nations forums for promoting universal and holistic \ncoherence and international commitments to sustainable development, building on \n\nInternational financial system and development \nA/RES/78/136\n \n9/13\n23-25926 \n \nthe vision of the Monterrey Consensus, with a view to supporting the implementation \nof the Addis Ababa Action Agenda and the 2030 Agenda;  \n \n20. Recalls that countries must have, in accordance with their specific needs \nand circumstances, the flexibility necessary to implement countercyclical measures \nand pursue tailored and targeted responses to the various types of shocks, including \neconomic and financial crises, notes that, in the 2018 International Monetary Fund \nreview of programme design and conditionality, it was found that the number of \nstructural conditions included in programmes of the Fund had increased over time, \nand calls for the Fund to build on recent progress to further prioritize reforms and \nstreamline conditions to ensure that they are timely, tailored and targeted, in \naccordance with national circumstances and priorities, and that they support \ndeveloping countries in the face of financial, economic and development challenges;  \n \n21. Notes, in this regard, the new strategy of the International Monetary Fund \nfor engagement on social spending, welcomes the Fund\u2019s recognition of the adverse \nimpacts that fiscal adjustment could have on the vulnerable, for whom social spending \nis critical to achieving the commitments under the 2030 Agenda, including nationally \nappropriate social protection systems and measures for all, including floors, and \nencourages greater collaboration on social protection finance among all international \ndevelopment institutions;  \n \n22. Invites the multilateral development banks and other international \ndevelopment banks to continue to provide both concessional and non-concessional, \nstable, long-term development finance by leveraging contributions and capital, \nincluding hybrid capital, and by mobilizing resources for developing countries from \nmultiple sources, for example from capital markets, and stresses that development \nbanks should make optimal use of their resources and balance sheets, while preserving \nlong-term financial sustainability, robust credit ratings and preferred creditor status, \nconsistent with maintaining their financial integrity, and should continue to discuss \noptions for implementing the recommendations of the independent review of \nmultilateral development banks\u2019 capital adequacy frameworks, commissioned by the \nGroup of 20, and should update and develop their policies in support of the 2030 \nAgenda, including the Sustainable Development Goals, as appropriate;  \n \n23. Welcomes, in this regard, the ongoing work of international financial \ninstitutions, including the more recently established New Development Bank and the \nAsian Infrastructure Investment Bank, in the global development finance architecture, \nand encourages enhanced regional and subregional cooperation, including through \nregional and subregional development banks, commercial and reserve currency \narrangements and other regional and subregional initiatives;  \n \n24. Encourages, in this regard, the multilateral development banks to continue \nto move forward on flexible, concessional, fast-disbursing and front-loaded assistance \nand innovative financial instruments that can absorb or diminish the financial costs \nfor developing countries, with due regard to ensuring the financial sustainability of \nthe banks, that will substantially and quickly assist developing countries facing \nfinancing gaps in their efforts to achieve the Sustainable Development Goals, in line \nwith their national development priorities, taking into consideration the individual \nabsorptive capacities and debt sustainability of those countries, and invites \nshareholders of regional development banks to ensure that they remain sufficiently \ncapitalized so as to be able to meet those needs, and encourages an ambitious \nreplenishment of the International Development Association to keep and increase the \nfunding of the most concessional facilities of the World Bank;  \n \n25. Also encourages the multilateral development banks, within their \nrespective mandates and in a coordinated way, to continue to expand technical \nassistance, disseminate and share their knowledge and best practices, as well as foster \n\nA/RES/78/136 \nInternational financial system and development\n \n23-25926\n10/13 \n \na deeper understanding of financial capacity and capital needs, in order to enhance \nthe multiplier effect of their financing by leveraging more resources and diversifying \ntheir sources, including by mobilizing long-term and sustainable private investment, \nfrom domestic and international actors, to provide innovative and integral solutions \nto multidimensional development problems, in particular in developing and emerging \neconomies;  \n \n26. Recognizes the need for the international financial institutions, as \nappropriate, to promote gender mainstreaming in their policies and programmes, \nincluding macroeconomic, job creation and structural reform policies and \nprogrammes, in accordance with relevant national priorities and strategies;  \n \n27. Urges multilateral donors and invites the international financial \ninstitutions and regional development banks, within their respective mandates, to \nreview and implement policies that support national efforts to ensure that a higher \nproportion of resources reach women and girls, in particular in rural and remote areas, \nand invites multilateral and regional development banks to agree on common \nindicators for analysing the gender impact of their lending;  \n \n28. Recognizes that it is important that all international financial institutions \nand multilateral development banks continue to be adequately resourced, and \nreiterates the importance of further governance reform in order to adapt to changes in \nthe global economy;  \n \n29. Recalls the commitment of the International Monetary Fund to revisiting \nthe adequacy of quotas and continuing the process of governance reform under the \nsixteenth general review of quotas, including a new quota formula as a guide, by \n15 December 2023, and the commitment to ensuring the primary role of quotas in \nFund resources, and that any adjustment in quota shares would be expected to result \nin increases in the quota shares of dynamic economies in line with their relative \npositions in the world economy and hence likely in the share of emerging market and \ndeveloping countries as a whole, while protecting the voice and representation of the \npoorest members, and recommits itself to the broadening and strengthening of the \nvoice and participation of developing countries, including African countries, the least \ndeveloped countries, landlocked developing countries, small island developing \nStates, middle-income countries and countries in conflict and post-conflict situations, \nin international economic decision-making, norm-setting and global economic \ngovernance;  \n \n30. Encourages Member States to work together to strengthen and improve a \nsystem in which different layers of the global financial safety net are closely \ncoordinated and have clear assignments of responsibilities and consider enhancing \nregional financial arrangements to help countries to weather shocks, strengthen their \ncapacity to detect risk and create new regional arrangements where there are not \nsufficient institutions in place;  \n \n31. Acknowledges the importance of the international financial institutions \nsupporting, in line with their mandates, the policy space of each country, while \nremaining consistent with relevant international rules and commitments, in particular \ndeveloping countries;  \n \n32. Reaffirms that cohesive, nationally owned sustainable development \nstrategies, supported by integrated national financing frameworks, will be at the heart \nof efforts, reiterates that each country has primary responsibility for its own economic \nand social development and that the role of national policies and development \nstrategies cannot be overemphasized, expresses respect for each country\u2019s policy \nspace and leadership to implement policies for the eradication of poverty in all its \nforms and dimensions and for sustainable development, while remaining consistent \n\nInternational financial system and development \nA/RES/78/136\n \n11/13\n23-25926 \n \nwith relevant international rules and commitments, at the same time recognizes that \nnational development efforts need to be supported by an enabling international \neconomic environment, including coherent and mutually supporting world trade, \nmonetary and financial systems and strengthened and enhanced global economic \ngovernance, and that processes to develop and facilitate the availability of appropriate \nknowledge and technologies globally, as well as capacity-building, are also critical, \nand commits to pursuing policy coherence and an enabling environment for \nsustainable development at all levels and by all actors, and to reinvigorating the \nGlobal Partnership for Sustainable Development;  \n \n33. Recommits itself to a redoubling of its efforts to substantially reduce illicit \nfinancial flows by 2030, with a view to eventually eliminating them, including by \ncombating tax evasion and corruption through strengthened national regulation and \nstronger and more effective international cooperation;  \n \n34. Notes that rapid developments in digital financial technology, further \naccelerated by the COVID-19 pandemic, have transformed the provision of financial \nservices and created a new ecosystem of digital assets, recognizes the relevance of \ncarefully monitoring domestic and global developments, reviewing and updating \nregulatory frameworks when necessary and cooperating across sectors and borders to \nsupport enabling environments that take due account of opportunities and risks to \nensure a more balanced view of digital financial innovations, while still fostering \ncompetition and innovations in the financial system, and requests the United Nations \nsystem to continue to support developing countries through knowledge-sharing, \ntechnology transfer on mutually agreed terms and capacity-building in order to better \naddress the opportunities, challenges and implications of emerging digital financial \ntechnologies, including digital inequality;  \n \n35. Also notes the development of central bank digital currencies, and \nencourages regulators to consider potential opportunities and risks for the \ninternational and domestic financial system;  \n \n36. Further notes the statement by the Financial Stability Board on international \nregulation and supervision of cryptoasset activities, including stablecoins, of 11 July \n2022, underlining that stablecoins should be covered by robust regulations and \nsupervision by relevant authorities if they are to be adopted as a widely used means \nof payment or otherwise play an important role in the financial system, in line with \ntheir national regulations and policies;  \n \n37. Notes the work by the Financial Stability Board on financial market \nreform, commits itself to sustaining or strengthening frameworks for macroprudential \nregulation and countercyclical buffers, reaffirms the commitment to hastening the \ncompletion of the reform agenda on financial market regulation, including assessing \nand if necessary reducing the systemic risks associated with non-bank financial \nintermediation, markets for derivatives, securities lending and repurchase \nagreements, and also reaffirms the commitment to addressing the risk created by \u201ctoo-\nbig-to-fail\u201d financial institutions and to addressing cross-border elements in the \neffective resolution of troubled, systemically important financial institutions;  \n \n38. Also notes that there are growing risks outside the regulatory framework, \nincluding through non-bank financial institutions and financial technology, and calls \nupon financial regulators to increasingly shift towards examining the underlying risks \nassociated with financial activity rather than the type of financial institution;  \n \n39. Calls upon financial regulators to encourage financial institutions to \nexplore new opportunities to improve their ability to better manage risks, including \nthrough anti-money-laundering and countering the financing of terrorism measures, \n\nA/RES/78/136 \nInternational financial system and development\n \n23-25926\n12/13 \n \nas well as through the greater use of technology to help to address the costs and risks \nof operating correspondent banking relationships;  \n \n40. Emphasizes the relevance of inclusion in the international financial system \nat all levels and the importance of considering financial inclusion as a policy objective \nin financial regulation, in accordance with national priorities and legislation;  \n \n41. Reiterates that effective, inclusive multilateral surveillance should be at \nthe centre of crisis prevention efforts, stresses the need to continue to strengthen \nsurveillance of the financial policies of countries, and in this regard notes the current \nefforts to update the surveillance approach of the International Monetary Fund in line \nwith its mandate to better integrate bilateral and multilateral surveillance, along with \ncross-border and cross-sectoral linkages with macroeconomic and macroprudential \npolicies, while paying closer attention to the spillover effects from national economic \nand financial policies on to the global economy;  \n \n42. Notes the potential for source countries of capital flows to use appropriate \ncombinations of macroeconomic, macroprudential and regulatory policies that avoid \nexcessive leverage and large international spillovers in the form of capital flow \nvolatility, while still meeting domestic macroeconomic objectives, encourages source \ncountries to consider such policies, while clearly communicating monetary policy \ndecisions, and calls for greater macroeconomic coordination among systemically \nimportant economies, which can also help to address global financial market volatility;  \n \n43. Invites the international financial and banking institutions, in consultation \nwith national Governments, to develop tailored guidelines on how countries can \nattract long-term international investments, guided by the 2030 Agenda, in line with \nnational plans and policies, and with a view to minimizing the adverse effects of \ncapital market volatility;  \n \n44. Reiterates the need to resolve to reduce mechanistic reliance on credit-\nrating agency assessments, including in regulations, and to promote increased \ncompetition as well as measures to avoid conflict of interest in the provision of credit \nratings, underlining the importance that credit rating agencies ensure that their ratings \nare objective, independent, forward-looking and based on accurate information and \nsound analytical methods, and notes that Member States may consider the feasibility \nof establishing public rating agencies;  \n \n45. Invites the international financial and banking institutions to continue to \nenhance the transparency and analytical rigour of risk-rating mechanisms, noting that \nsovereign risk assessments should maximize the use of objective and transparent \nparameters, which can be facilitated by high-quality data and analysis, and \nencourages relevant institutions, including the United Nations Conference on Trade \nand Development, to continue their work on the issue, including the potential impact \nof the role played by private credit-rating agencies on the development prospects of \ndeveloping countries, in accordance with their mandates;  \n \n46. Recommits itself to enabling women\u2019s full, equal and meaningful \nparticipation in the economy and their equal access to decision-making processes and \nleadership;  \n \n47. Encourages all development banks to establish or maintain social and \nenvironmental safeguard systems, including on sustainable infrastructure, human \nrights, gender equality and women\u2019s empowerment, that are transparent, effective, \nefficient and time-sensitive, and engage affected communities in project design and \nimplementation; \n \n48. Reiterates that States are strongly urged to refrain from promulgating and \napplying any unilateral economic, financial or trade measures not in accordance with \n\nInternational financial system and development \nA/RES/78/136\n \n13/13\n23-25926 \n \ninternational law and the Charter of the United Nations that impede the full \nachievement of economic and social development, particularly in developing \ncountries;  \n \n49. Requests, in this regard, the Secretary-General to submit to the General \nAssembly at its seventy-ninth session an action-oriented report on the implementation \nof the present resolution, with a particular focus on reform of the international \nfinancial system in the post-COVID era;  \n \n50. Decides to include in the provisional agenda of its seventy-ninth session, \nunder the item entitled \u201cMacroeconomic policy questions\u201d, the sub-item entitled \n\u201cInternational financial system and development\u201d, unless otherwise agreed. \n \n49th plenary meeting \n19 December 2023 \n \n \n",
  "paragraphs": {
    "1": "Takes note of the report of the Secretary-General;12",
    "2": "Recognizes the need to continue and intensify efforts to enhance the coherence and consistency of the international monetary, financial and trading systems, reiterates the importance of ensuring their openness, fairness and inclusiveness in order to complement national efforts to ensure sustainable development, including strong, sustained, balanced, inclusive and equitable economic growth, and that all people, in particular the poor and vulnerable, have equal rights to economic resources and appropriate financial services, and the achievement of the internationally agreed development goals, including the Sustainable Development Goals and the Paris Agreement, 13 and encourages the international financial institutions to align their programmes and policies with the 2030 Agenda for Sustainable Development 14 in accordance with their mandates;",
    "3": "Also recognizes that the twenty-first century requires an international development finance system that is fit for purpose, including for the scale of need and depth of the shocks facing developing countries, in particular the poorest and most vulnerable, keeping pace with a changing global landscape characterized by deeply integrated financial markets, multiple crises with cascading effects, systemic risks, the adverse impacts of climate change, shifting trade and financial relations, and rapid technological change, recognizes in this regard the urgent need for bold and ambitious reforms to create a stable, sustainable and inclusive international financial architecture, and reiterates that the international financial architecture, including its business models and financing capacities, must be made more fit for purpose, equitable and responsive to the financing needs of developing countries, to broaden and strengthen the voice and participation of developing countries in international economic decision-making, norm-setting and global economic governance;",
    "4": "Welcomes the work of the High-level Panel on the Development of a Multidimensional Vulnerability Index for Small Island Developing States, which was co-chaired by the Prime Minister of Antigua and Barbuda, Gaston Browne, and the former Prime Minister of Norway, Erna Solberg, including its consultations with Member States, and in this regard takes note of the Panel\u2019s final report and the recommendations contained therein;",
    "5": "Notes that the United Nations, on the basis of its universal membership and legitimacy, provides a unique and key forum for discussing international economic issues and their impact on development, and reaffirms that the United Nations is well positioned to participate in various reform processes aimed at improving and strengthening the effective functioning of the international financial system and architecture, while recognizing that the United Nations and the international financial institutions have complementary mandates that make the coordination of their actions crucial;",
    "6": "Recognizes the important efforts undertaken nationally, regionally and internationally to respond to the challenges posed by the global financial and economic crisis, the COVID-19 pandemic and the recent multiple crises, and also recognizes that more needs to be done in order to promote the economic recovery, to manage the consequences of volatility in global financial and commodity markets, especially continued high inflation, high interest rates and exchange rate pressures, as well as capital flight from shock-vulnerable countries, to tackle high unemployment and rising indebtedness in many countries, as well as widespread fiscal strains, to reinforce the banking sector, including by increasing its transparency and accountability, to address systemic fragilities and imbalances, to reform and strengthen the international financial system and to continue and to enhance the coordination of financial and economic policies at the international level;",
    "7": "Acknowledges that growing risks from more frequent and interconnected shocks require new and innovative financing instruments to boost the availability of resources for all countries in need;",
    "8": " Paris Club Debt Service Suspension Initiative, and remains concerned with the lack of participation of private creditors, appreciates the recent progress made in the ongoing implementation of the Common Framework for Debt Treatments beyond the Debt Service Suspension Initiative, encourages the Group of 20 and Paris Club creditors to discuss options for implementing comparability of the treatment of private and other official bilateral creditors, expanding support to highly indebted developing countries, considering the provision of temporary debt standstills on a case-by-case basis throughout negotiations and facilitating rapid recovery of capital market access following restructuring, and calls for stepping up efforts to improve and implement the Common Framework in a timely, orderly, predictable and coordinated manner, noting the possibility for greater collaboration of credit rating agencies in this regard, and notes the liquidity support for countries with liquidity constraints and the forthcoming evaluation of funding needs of the International Monetary Fund Catastrophe Containment and Relief Trust;",
    "9": "Recognizes the role of special drawing rights as an international reserve asset, acknowledges that special drawing rights allocations helped to supplement international reserves in response to the world financial and economic crisis as well as the COVID-19 pandemic, thus contributing to the stability of the international financial system and global economic resilience, and supports the continued examination of the broader use of special drawing rights as a way to enhance the resilience of the international monetary system, including with reference to their potential role in the international reserve system;",
    "10": "Welcomes the special drawing rights allocation of the equivalent of 650 billion United States dollars of 23 August 2021, recommends the exploration of further voluntary options related to special drawing rights that could serve the needs of developing member countries of the International Monetary Fund, calls for the urgent voluntary rechannelling of special drawing rights for countries most in need, including through multilateral development banks, while respecting relevant legal frameworks and preserving the reserve asset character of special drawing rights, and will explore ways for future allocations of special drawing rights to benefit those countries most in need;",
    "11": "Takes note with appreciation of the operationalization of the Resilience and Sustainability Trust of the International Monetary Fund to help eligible countries address longer-term structural challenges that pose macroeconomic risks, looks forward to the upcoming interim review of the Trust, and notes that debt sustainability and liquidity can play an important role in achieving a sustainable, inclusive and resilient recovery and the Sustainable Development Goals;",
    "12": "Stresses that multilateral development banks are a key component of the reform of the international financial system, and also stresses the need to strengthen multilateral development banks and consider an increase in concessional funding from multilateral development banks, taking note of the recommendations under the Capital Adequacy Framework review by multilateral development banks to increase their lending and for the consideration of global financial system reform, which includes lending criteria that complement or go beyond gross domestic product and are based on a comprehensive understanding of multidimensional factors, including but not limited to vulnerability and resilience of developing countries;",
    "13": " of the multilateral development banks to increase their capitalization, and encourages dialogue between multilateral development banks and other financial institutions;",
    "14": "Stresses the critical importance of a stable, inclusive and enabling global economic environment for the advancement of sustainable development, for the reliable and effective financing of development and for the implementation of the 2030 Agenda, mobilizing public and private, as well as domestic and international resources;",
    "15": "Notes the adoption by the Statistical Commission of the proposed new indicator 17.3.1 under Sustainable Development Goal target 17.3 (Mobilize additional financial resources for developing countries from multiple sources), also notes the need for open, inclusive and transparent discussions on the modernization of official development assistance measurement and the new measure of \u201ctotal official support for sustainable development\u201d, and affirms that any such measure will not dilute commitments already made;",
    "16": "Reiterates that debtors and creditors, including both public and private, must work together in a transparent manner to prevent and resolve unsustainable debt situations and that maintaining sustainable debt levels is the responsibility of the borrowing countries, acknowledging, however, that lenders also have a responsibility to lend in a way that does not undermine a country\u2019s debt sustainability, and in this regard takes note of the United Nations Conference on Trade and Development principles on responsible sovereign lending and borrowing and recognizes the applicable requirements of the International Monetary Fund debt limits policy and/or the World Bank Sustainable Development Finance Policy, as well as the safeguards of the Development Assistance Committee of the Organisation for Economic Co-operation and Development in its statistical system to enhance the debt sustainability of recipient countries, and will work towards a global consensus on guidelines for debtor and creditor responsibilities in borrowing by and lending to sovereigns, building on existing initiatives;",
    "17": "Invites, in this regard, the President of the General Assembly and the Secretary-General to give appropriate consideration to the central role of maintaining and facilitating the financial and macroeconomic stability of developing countries, including debt sustainability, and of supporting an appropriately enabling domestic and international economic, financial and regulatory environment for the means of implementation of the 2030 Agenda, including financial inclusion, and in this regard invites all major institutional stakeholders, including the International Monetary Fund, the World Bank and the United Nations Conference on Trade and Development, to support these efforts, in accordance with their respective mandates;",
    "18": "Encourages, in this regard, the Economic and Social Council to consider, at its annual forum on financing for development follow-up, a dedicated discussion and analysis of systemic issues and challenges, taking into account the roles of all international financial institutions and also the United Nations Conference on Trade and Development, in accordance with their respective mandates, pursuant to the relevant resolutions on this matter, including its resolution 69/313 on the Addis Ababa Action Agenda of the Third International Conference on Financing for Development and the mandate of the annual forum on financing for development follow-up set out therein;",
    "19": " the vision of the Monterrey Consensus, with a view to supporting the implementation of the Addis Ababa Action Agenda and the 2030 Agenda;",
    "20": "Recalls that countries must have, in accordance with their specific needs and circumstances, the flexibility necessary to implement countercyclical measures and pursue tailored and targeted responses to the various types of shocks, including economic and financial crises, notes that, in the 2018 International Monetary Fund review of programme design and conditionality, it was found that the number of structural conditions included in programmes of the Fund had increased over time, and calls for the Fund to build on recent progress to further prioritize reforms and streamline conditions to ensure that they are timely, tailored and targeted, in accordance with national circumstances and priorities, and that they support developing countries in the face of financial, economic and development challenges;",
    "21": "Notes, in this regard, the new strategy of the International Monetary Fund for engagement on social spending, welcomes the Fund\u2019s recognition of the adverse impacts that fiscal adjustment could have on the vulnerable, for whom social spending is critical to achieving the commitments under the 2030 Agenda, including nationally appropriate social protection systems and measures for all, including floors, and encourages greater collaboration on social protection finance among all international development institutions;",
    "22": "Invites the multilateral development banks and other international development banks to continue to provide both concessional and non-concessional, stable, long-term development finance by leveraging contributions and capital, including hybrid capital, and by mobilizing resources for developing countries from multiple sources, for example from capital markets, and stresses that development banks should make optimal use of their resources and balance sheets, while preserving long-term financial sustainability, robust credit ratings and preferred creditor status, consistent with maintaining their financial integrity, and should continue to discuss options for implementing the recommendations of the independent review of multilateral development banks\u2019 capital adequacy frameworks, commissioned by the Group of 20, and should update and develop their policies in support of the 2030 Agenda, including the Sustainable Development Goals, as appropriate;",
    "23": "Welcomes, in this regard, the ongoing work of international financial institutions, including the more recently established New Development Bank and the Asian Infrastructure Investment Bank, in the global development finance architecture, and encourages enhanced regional and subregional cooperation, including through regional and subregional development banks, commercial and reserve currency arrangements and other regional and subregional initiatives;",
    "24": "Encourages, in this regard, the multilateral development banks to continue to move forward on flexible, concessional, fast-disbursing and front-loaded assistance and innovative financial instruments that can absorb or diminish the financial costs for developing countries, with due regard to ensuring the financial sustainability of the banks, that will substantially and quickly assist developing countries facing financing gaps in their efforts to achieve the Sustainable Development Goals, in line with their national development priorities, taking into consideration the individual absorptive capacities and debt sustainability of those countries, and invites shareholders of regional development banks to ensure that they remain sufficiently capitalized so as to be able to meet those needs, and encourages an ambitious replenishment of the International Development Association to keep and increase the funding of the most concessional facilities of the World Bank;",
    "25": " a deeper understanding of financial capacity and capital needs, in order to enhance the multiplier effect of their financing by leveraging more resources and diversifying their sources, including by mobilizing long-term and sustainable private investment, from domestic and international actors, to provide innovative and integral solutions to multidimensional development problems, in particular in developing and emerging economies;",
    "26": "Recognizes the need for the international financial institutions, as appropriate, to promote gender mainstreaming in their policies and programmes, including macroeconomic, job creation and structural reform policies and programmes, in accordance with relevant national priorities and strategies;",
    "27": "Urges multilateral donors and invites the international financial institutions and regional development banks, within their respective mandates, to review and implement policies that support national efforts to ensure that a higher proportion of resources reach women and girls, in particular in rural and remote areas, and invites multilateral and regional development banks to agree on common indicators for analysing the gender impact of their lending;",
    "28": "Recognizes that it is important that all international financial institutions and multilateral development banks continue to be adequately resourced, and reiterates the importance of further governance reform in order to adapt to changes in the global economy;",
    "29": "Recalls the commitment of the International Monetary Fund to revisiting the adequacy of quotas and continuing the process of governance reform under the sixteenth general review of quotas, including a new quota formula as a guide, by 15 December 2023, and the commitment to ensuring the primary role of quotas in Fund resources, and that any adjustment in quota shares would be expected to result in increases in the quota shares of dynamic economies in line with their relative positions in the world economy and hence likely in the share of emerging market and developing countries as a whole, while protecting the voice and representation of the poorest members, and recommits itself to the broadening and strengthening of the voice and participation of developing countries, including African countries, the least developed countries, landlocked developing countries, small island developing States, middle-income countries and countries in conflict and post-conflict situations, in international economic decision-making, norm-setting and global economic governance;",
    "30": "Encourages Member States to work together to strengthen and improve a system in which different layers of the global financial safety net are closely coordinated and have clear assignments of responsibilities and consider enhancing regional financial arrangements to help countries to weather shocks, strengthen their capacity to detect risk and create new regional arrangements where there are not sufficient institutions in place;",
    "31": "Acknowledges the importance of the international financial institutions supporting, in line with their mandates, the policy space of each country, while remaining consistent with relevant international rules and commitments, in particular developing countries;",
    "32": " with relevant international rules and commitments, at the same time recognizes that national development efforts need to be supported by an enabling international economic environment, including coherent and mutually supporting world trade, monetary and financial systems and strengthened and enhanced global economic governance, and that processes to develop and facilitate the availability of appropriate knowledge and technologies globally, as well as capacity-building, are also critical, and commits to pursuing policy coherence and an enabling environment for sustainable development at all levels and by all actors, and to reinvigorating the Global Partnership for Sustainable Development;",
    "33": "Recommits itself to a redoubling of its efforts to substantially reduce illicit financial flows by 2030, with a view to eventually eliminating them, including by combating tax evasion and corruption through strengthened national regulation and stronger and more effective international cooperation;",
    "34": "Notes that rapid developments in digital financial technology, further accelerated by the COVID-19 pandemic, have transformed the provision of financial services and created a new ecosystem of digital assets, recognizes the relevance of carefully monitoring domestic and global developments, reviewing and updating regulatory frameworks when necessary and cooperating across sectors and borders to support enabling environments that take due account of opportunities and risks to ensure a more balanced view of digital financial innovations, while still fostering competition and innovations in the financial system, and requests the United Nations system to continue to support developing countries through knowledge-sharing, technology transfer on mutually agreed terms and capacity-building in order to better address the opportunities, challenges and implications of emerging digital financial technologies, including digital inequality;",
    "35": "Also notes the development of central bank digital currencies, and encourages regulators to consider potential opportunities and risks for the international and domestic financial system;",
    "36": "Further notes the statement by the Financial Stability Board on international regulation and supervision of cryptoasset activities, including stablecoins, of 11 July 2022, underlining that stablecoins should be covered by robust regulations and supervision by relevant authorities if they are to be adopted as a widely used means of payment or otherwise play an important role in the financial system, in line with their national regulations and policies;",
    "37": "Notes the work by the Financial Stability Board on financial market reform, commits itself to sustaining or strengthening frameworks for macroprudential regulation and countercyclical buffers, reaffirms the commitment to hastening the completion of the reform agenda on financial market regulation, including assessing and if necessary reducing the systemic risks associated with non-bank financial intermediation, markets for derivatives, securities lending and repurchase agreements, and also reaffirms the commitment to addressing the risk created by \u201ctoo- big-to-fail\u201d financial institutions and to addressing cross-border elements in the effective resolution of troubled, systemically important financial institutions;",
    "38": "Also notes that there are growing risks outside the regulatory framework, including through non-bank financial institutions and financial technology, and calls upon financial regulators to increasingly shift towards examining the underlying risks associated with financial activity rather than the type of financial institution;",
    "39": " as well as through the greater use of technology to help to address the costs and risks of operating correspondent banking relationships;",
    "40": "Emphasizes the relevance of inclusion in the international financial system at all levels and the importance of considering financial inclusion as a policy objective in financial regulation, in accordance with national priorities and legislation;",
    "41": "Reiterates that effective, inclusive multilateral surveillance should be at the centre of crisis prevention efforts, stresses the need to continue to strengthen surveillance of the financial policies of countries, and in this regard notes the current efforts to update the surveillance approach of the International Monetary Fund in line with its mandate to better integrate bilateral and multilateral surveillance, along with cross-border and cross-sectoral linkages with macroeconomic and macroprudential policies, while paying closer attention to the spillover effects from national economic and financial policies on to the global economy;",
    "42": "Notes the potential for source countries of capital flows to use appropriate combinations of macroeconomic, macroprudential and regulatory policies that avoid excessive leverage and large international spillovers in the form of capital flow volatility, while still meeting domestic macroeconomic objectives, encourages source countries to consider such policies, while clearly communicating monetary policy decisions, and calls for greater macroeconomic coordination among systemically important economies, which can also help to address global financial market volatility;",
    "43": "Invites the international financial and banking institutions, in consultation with national Governments, to develop tailored guidelines on how countries can attract long-term international investments, guided by the 2030 Agenda, in line with national plans and policies, and with a view to minimizing the adverse effects of capital market volatility;",
    "44": "Reiterates the need to resolve to reduce mechanistic reliance on credit- rating agency assessments, including in regulations, and to promote increased competition as well as measures to avoid conflict of interest in the provision of credit ratings, underlining the importance that credit rating agencies ensure that their ratings are objective, independent, forward-looking and based on accurate information and sound analytical methods, and notes that Member States may consider the feasibility of establishing public rating agencies;",
    "45": "Invites the international financial and banking institutions to continue to enhance the transparency and analytical rigour of risk-rating mechanisms, noting that sovereign risk assessments should maximize the use of objective and transparent parameters, which can be facilitated by high-quality data and analysis, and encourages relevant institutions, including the United Nations Conference on Trade and Development, to continue their work on the issue, including the potential impact of the role played by private credit-rating agencies on the development prospects of developing countries, in accordance with their mandates;",
    "46": "Recommits itself to enabling women\u2019s full, equal and meaningful participation in the economy and their equal access to decision-making processes and leadership;",
    "47": "Encourages all development banks to establish or maintain social and environmental safeguard systems, including on sustainable infrastructure, human rights, gender equality and women\u2019s empowerment, that are transparent, effective, efficient and time-sensitive, and engage affected communities in project design and implementation;",
    "48": " international law and the Charter of the United Nations that impede the full achievement of economic and social development, particularly in developing countries;",
    "49": "Requests, in this regard, the Secretary-General to submit to the General Assembly at its seventy-ninth session an action-oriented report on the implementation of the present resolution, with a particular focus on reform of the international financial system in the post-COVID era;",
    "50": "Decides to include in the provisional agenda of its seventy-ninth session, under the item entitled \u201cMacroeconomic policy questions\u201d, the sub-item entitled \u201cInternational financial system and development\u201d, unless otherwise agreed."
  },
  "agenda_items": [
    "Item 16"
  ],
  "symbol_references": []
}