{
  "symbol": "A/RES/73/204",
  "filename": "A_RES_73_204.pdf",
  "title": "73/204. Status of the Protocols Additional to the Geneva Conventions of 1949 and relating to the protection of victims of armed conflicts",
  "text": "United Nations \nA/RES/73/204\n \n \nGeneral Assembly \nDistr.: General \n9 January 2019 \n \n18-22496 (E)    110119 \n*1822496* \n \n \nSeventy-third session \nAgenda item 83 \n \n \n \n \n Resolution adopted by the General Assembly \non 20 December 2018 \n \n \n \n \n[on the report of the Sixth Committee (A/73/555)] \n \n \n 73/204. Status of the Protocols Additional to the Geneva Conventions of \n1949 and relating to the protection of victims of armed conflicts \n \n \n \nThe General Assembly, \n \nRecalling its biennial resolutions on the status of the Protocols Additional to the \nGeneva Conventions of 1949 and relating to the protection of victims of armed \nconflicts, including its resolution 71/144 of 13 December 2016, \n \nHaving considered the report of the Secretary-General,1 \n \nReaffirming the continuing value of established humanitarian rules relating to \narmed conflicts and the need to respect and ensure respect for those rules in all \ncircumstances within the scope of the relevant international instruments, pending the \nearliest possible termination of such conflicts, \n \nStressing the need to consolidate the existing body of international humanitarian \nlaw through its universal acceptance and the need for wide dissemination and full \nimplementation of such law at the national level, and expressing concern about all \nviolations of the Geneva Conventions of 19492 and the Additional Protocols,3 \n \nCalling upon Member States to disseminate knowledge of international \nhumanitarian law as widely as possible, and calling upon all parties to armed conflict \nto apply international humanitarian law, \n \nNoting with satisfaction the increasing number of national commissions and \nother bodies involved in advising authorities at the national level on the \nimplementation, dissemination and development of international humanitarian law, \n \nNoting with appreciation the meetings of representatives of those bodies \norganized by the International Committee of the Red Cross, together with relevant \n__________________ \n \n1 A/73/277. \n \n2 United Nations, Treaty Series, vol. 75, Nos. 970\u2013973. \n \n3 Ibid., vol. 1125, Nos. 17512 and 17513, and vol. 2404, No. 43425. \n\nA/RES/73/204 \nStatus of the Protocols Additional to the Geneva Conventions of 1949\nand relating to the protection of victims of armed conflicts\n \n18-22496\n2/5 \n \npartners such as national Red Cross and Red Crescent societies, to facilitate the \nsharing of concrete experience and the exchange of views on their roles and on the \nchallenges they face, \n \nStressing the possibility of making use of the International Humanitarian Fact-\nFinding Commission in relation to an armed conflict, pursuant to article 90 of \nProtocol I4 to the Geneva Conventions, \n \nStressing also the possibility for the International Humanitarian Fact-Finding \nCommission to facilitate, through its good offices, the restoration of an attitude of \nrespect for the Geneva Conventions and Protocol I, \n \nTaking note of the fact that the International Humanitarian Fact-Finding \nCommission conducted its first operational mission in 2017, \n \nTaking note also of the fact that, in paragraphs 8 and 9 of its resolution \n1894 (2009) of 11 November 2009 on the protection of civilians in armed conflict, \nthe Security Council noted the range of existing methods used, on a case-by-case \nbasis, for gathering information on alleged violations of applicable international law \nrelating to the protection of civilians, underlined the importance in that regard of \nreceiving information that is timely, objective, accurate and reliable, and considered \nthe possibility, to that end, of using the International Humanitarian Fact-Finding \nCommission established by article 90 of Protocol I, \n \nNoting with appreciation the role of the International Committee of the Red \nCross in facilitating and offering protection to the victims of armed conflicts, \n \nNoting with appreciation also the continuing efforts of the International \nCommittee of the Red Cross to promote and disseminate knowledge of international \nhumanitarian law, in particular the Geneva Conventions and the Additional Protocols, \n \nNoting the special responsibilities of national Red Cross and Red Crescent \nsocieties, as auxiliaries to the public authorities of their respective States in the \nhumanitarian field, to cooperate with and assist their Governments in the promotion, \ndissemination and implementation of international humanitarian law, \n \nWelcoming the universal acceptance of the Geneva Conventions of 1949, \n \nEmphasizing the fundamentally non-discriminatory character of international \nhumanitarian law, including as reflected in the preamble to the 1977 Additional \nProtocol I to the 1949 Geneva Conventions of 12 August 1949, relating to the \nProtection of Victims of International Armed Conflicts, which, inter alia, reaffirms \nthat the provisions of the Geneva Conventions of 12 August 1949 and of Additional \nProtocol I must be fully applied in all circumstances to all persons who are protected \nby those instruments, without any adverse distinction based on the origin of the armed \nconflict or on the causes espoused by or attributed to the parties to the conflict, \n \nRecalling the imperative need to improve compliance with international \nhumanitarian law, recognized by all States at the thirty-second International \nConference of the Red Cross and Red Crescent, held in Geneva from 8 to \n10 December 2015, \n \nWelcoming the continued engagement of States in the intergovernmental \nprocess, and recalling its State-driven and consensus-based character, aimed at \nfinding ways to enhance the implementation of international humanitarian law, \n__________________ \n \n4 Ibid., vol. 1125, No. 17512. \n\nStatus of the Protocols Additional to the Geneva Conventions of 1949 \nand relating to the protection of victims of armed conflicts \nA/RES/73/204\n \n3/5\n18-22496 \n \n \nNoting the close cooperation between the International Committee of the Red \nCross and States to further strengthen international humanitarian law protecting \npersons deprived of their liberty in relation to armed conflict, \n \nWelcoming efforts by States to implement their obligations under international \nhumanitarian law, as well as programmes and other measures of States and their \narmed forces that promote or ensure compliance with international humanitarian law, \n \nNoting the work undertaken by States and by the International Committee of the \nRed Cross in relation to sexual and gender-based violence in armed conflict, \n \nNoting also the work undertaken by States, the International Red Cross and Red \nCrescent Movement and other actors in the \u201cHealth Care in Danger\u201d project to \nimprove the protection of the provision of and access to health care, \n \nNoting with appreciation Security Council resolution 2286 (2016) of 3 May \n2016, and in this regard calling upon all parties to armed conflict to respect and \nprotect the wounded and sick, as well as health-care personnel, humanitarian \npersonnel exclusively engaged in medical duties and their means of transport and \nequipment, as well as hospitals and other medical facilities, in armed conflict, in \naccordance with their obligations under international humanitarian law, \n \nNoting the serious concern expressed by States regarding the humanitarian \nimpact caused by cluster munitions, and noting the entry into force of the Convention \non Cluster Munitions5 on 1 August 2010, \n \nNoting also the entry into force of the Arms Trade Treaty6 on 24 December 2014, \n \nWelcoming the important contribution to the protection of victims of armed \nconflicts made by the significant debate generated by the publication in 2005 of the \nstudy by the International Committee of the Red Cross on customary international \nhumanitarian law, as well as other recent initiatives by the Committee, welcoming \nalso its efforts to update regularly its customary international humanitarian law \ndatabase, and looking forward to further constructive discussion on the subject, \n \nAcknowledging the fact that the Rome Statute of the International Criminal \nCourt7 covers the most serious crimes of international concern under international \nhumanitarian law and that the Rome Statute, while recalling that it is the duty of every \nState to exercise its criminal jurisdiction over those responsible for such crimes, \nshows the determination of the international community to put an end to impunity for \nthe perpetrators of such crimes and thus to contribute to their prevention, \n \nNoting the amendments to article 8 of the Rome Statute of the International \nCriminal Court, relating to war crimes under the Rome Statute, adopted on 10 June \n2010 at the Review Conference of the Rome Statute, held in Kampala from 31 May \nto 11 June 2010, \n \nAcknowledging the usefulness of discussing in the General Assembly the status \nof instruments of international humanitarian law relevant to the protection of victims \nof armed conflicts, \n \n1. \nWelcomes the universal acceptance of the Geneva Conventions of 1949, 2 \nand notes the trend towards a similarly wide acceptance of the two Additional \nProtocols of 1977;8 \n__________________ \n \n5  Ibid., vol. 2688, No. 47713. \n \n6 See resolution 67/234 B. \n \n7 United Nations, Treaty Series, vol. 2187, No. 38544. \n \n8 Ibid., vol. 1125, Nos. 17512 and 17513. \n\nA/RES/73/204 \nStatus of the Protocols Additional to the Geneva Conventions of 1949\nand relating to the protection of victims of armed conflicts\n \n18-22496\n4/5 \n \n \n2. \nCalls upon all States parties to the Geneva Conventions that have not yet \ndone so to consider becoming parties to the Additional Protocols 3 at the earliest \npossible date; \n \n3. \nCalls upon all States that are already parties to Protocol I,4 or those States \nnot parties, upon becoming parties to Protocol I, to make the declaration provided for \nunder article 90 of that Protocol and to consider making use, where appropriate, of \nthe services of the International Humanitarian Fact-Finding Commission in \naccordance with the provisions of article 90 of Protocol I; \n \n4. \nCalls upon all States that have not yet done so to consider becoming parties \nto the Convention for the Protection of Cultural Property in the Event of Armed \nConflict and the two Protocols thereto, 9 in the context of the upcoming twentieth \nanniversary of the Second Protocol to the Hague Convention of 1954 for the \nProtection of Cultural Property in the Event of Armed Conflict, and to other relevant \ntreaties on international humanitarian law relating to the protection of victims of \narmed conflict; \n \n5. \nCalls upon States to consider becoming parties to the Optional Protocol to \nthe Convention on the Rights of the Child on the involvement of children in armed \nconflict;10 \n \n6. \nCalls upon all States parties to the Protocols Additional to the Geneva \nConventions to ensure their wide dissemination and full implementation; \n \n7. \nAffirms the necessity of making the implementation of international \nhumanitarian law more effective, and supports its further strengthening and \ndevelopment; \n \n8. \nNotes with appreciation the 10 resolutions adopted at the thirty-second \nInternational Conference of the Red Cross and Red Crescent, held in Geneva from 8 \nto 10 December 2015, in particular resolutions 1 to 4, recalls their importance, as well \nas the recommendations for further actions therein, in strengthening international \nhumanitarian law, and notes with appreciation in this regard resolution 2, entitled \n\u201cStrengthening compliance with international humanitarian law\u201d, in which the \nConference, inter alia, recommended the continuation of an inclusive, State-driven \nintergovernmental process based on the principle of consensus and in line with the \nguiding principles of the consultation process to find agreement on features and \nfunctions of a potential forum of States and to find ways to enhance the \nimplementation of international humanitarian law using the potential of the \nInternational Conference and international humanitarian law regional forums; \n \n9. \nCalls upon Member States to actively participate in the thirty-third \nInternational Conference of the Red Cross and Red Crescent, to be held in Geneva \nin 2019; \n \n10. Welcomes the activities of the Advisory Service on International \nHumanitarian Law of the International Committee of the Red Cross in supporting \nefforts made by Member States to take legislative and administrative action to \nimplement international humanitarian law and in promoting the exchange of \ninformation on those efforts between Governments, and reminds Member States of \nthe availability of the manual on domestic implementation of international \nhumanitarian law; \n \n11. \nAlso welcomes the increasing number of national commissions or \ncommittees for the implementation of international humanitarian law and their work \n__________________ \n \n9 Ibid., vol. 249, No. 3511, and vol. 2253, No. 3511. \n \n10 Ibid., vol. 2173, No. 27531. \n\nStatus of the Protocols Additional to the Geneva Conventions of 1949 \nand relating to the protection of victims of armed conflicts \nA/RES/73/204\n \n5/5\n18-22496 \n \nin promoting the incorporation of treaties on international humanitarian law into \nnational law and disseminating the rules of international humanitarian law, and \nencourages Member States that have not yet done so to consider establishing national \ncommissions or committees with the support of national Red Cross and Red Crescent \nsocieties where relevant, to advise and assist Governments in implementing and \ndisseminating knowledge of international humanitarian law; \n \n12. Commends the International Committee of the Red Cross for organizing \nthe universal meeting of national committees and similar bodies on international \nhumanitarian law, held in Geneva from 30 November to 2 December 2016, and invites \nthe International Committee of the Red Cross to continue to organize this meeting; \n \n13. Requests the Secretary-General to submit to the General Assembly at its \nseventy-fifth session a comprehensive report on the status of the Additional Protocols \nrelating to the protection of victims of armed conflicts, as well as on measures taken \nto strengthen the existing body of international humanitarian law, inter alia, with \nrespect to its dissemination and full implementation at the national level, based on \ninformation received from Member States and the International Committee of the \nRed Cross; \n \n14. Encourages Member States and the International Committee of the Red \nCross, in transmitting information to the Secretary-General, to focus on new \ndevelopments and activities during the reporting period; \n \n15. Encourages Member States to explore ways of facilitating the submission \nof information for future reports of the Secretary-General and, in this context, to \nconsider the convenience of using a questionnaire as drafted by Member States, with \nthe assistance of the International Committee of the Red Cross and, as appropriate, in \nconsultation with the Secretariat, for submission to the General Assembly at its \nseventy-fifth session; \n \n16. Decides to include in the provisional agenda of its seventy-fifth session \nthe item entitled \u201cStatus of the Protocols Additional to the Geneva Conventions of \n1949 and relating to the protection of victims of armed conflicts\u201d. \n \n62nd plenary meeting  \n20 December 2018 \n \n",
  "paragraphs": {
    "1": "Welcomes the universal acceptance of the Geneva Conventions of 1949, 2 and notes the trend towards a similarly wide acceptance of the two Additional Protocols of 1977;8",
    "2": "Calls upon all States parties to the Geneva Conventions that have not yet done so to consider becoming parties to the Additional Protocols 3 at the earliest possible date;",
    "3": "Calls upon all States that are already parties to Protocol I,4 or those States not parties, upon becoming parties to Protocol I, to make the declaration provided for under article 90 of that Protocol and to consider making use, where appropriate, of the services of the International Humanitarian Fact-Finding Commission in accordance with the provisions of article 90 of Protocol I;",
    "4": "Calls upon all States that have not yet done so to consider becoming parties to the Convention for the Protection of Cultural Property in the Event of Armed Conflict and the two Protocols thereto, 9 in the context of the upcoming twentieth anniversary of the Second Protocol to the Hague Convention of 1954 for the Protection of Cultural Property in the Event of Armed Conflict, and to other relevant treaties on international humanitarian law relating to the protection of victims of armed conflict;",
    "5": "Calls upon States to consider becoming parties to the Optional Protocol to the Convention on the Rights of the Child on the involvement of children in armed conflict;10",
    "6": "Calls upon all States parties to the Protocols Additional to the Geneva Conventions to ensure their wide dissemination and full implementation;",
    "7": "Affirms the necessity of making the implementation of international humanitarian law more effective, and supports its further strengthening and development;",
    "8": "Notes with appreciation the 10 resolutions adopted at the thirty-second International Conference of the Red Cross and Red Crescent, held in Geneva from 8 to 10 December 2015, in particular resolutions 1 to 4, recalls their importance, as well as the recommendations for further actions therein, in strengthening international humanitarian law, and notes with appreciation in this regard resolution 2, entitled \u201cStrengthening compliance with international humanitarian law\u201d, in which the Conference, inter alia, recommended the continuation of an inclusive, State-driven intergovernmental process based on the principle of consensus and in line with the guiding principles of the consultation process to find agreement on features and functions of a potential forum of States and to find ways to enhance the implementation of international humanitarian law using the potential of the International Conference and international humanitarian law regional forums;",
    "9": "Calls upon Member States to actively participate in the thirty-third International Conference of the Red Cross and Red Crescent, to be held in Geneva in 2019;",
    "10": "Welcomes the activities of the Advisory Service on International Humanitarian Law of the International Committee of the Red Cross in supporting efforts made by Member States to take legislative and administrative action to implement international humanitarian law and in promoting the exchange of information on those efforts between Governments, and reminds Member States of the availability of the manual on domestic implementation of international humanitarian law;",
    "11": "Also welcomes the increasing number of national commissions or committees for the implementation of international humanitarian law and their work in promoting the incorporation of treaties on international humanitarian law into national law and disseminating the rules of international humanitarian law, and encourages Member States that have not yet done so to consider establishing national commissions or committees with the support of national Red Cross and Red Crescent societies where relevant, to advise and assist Governments in implementing and disseminating knowledge of international humanitarian law;",
    "12": "Commends the International Committee of the Red Cross for organizing the universal meeting of national committees and similar bodies on international humanitarian law, held in Geneva from 30 November to 2 December 2016, and invites the International Committee of the Red Cross to continue to organize this meeting;",
    "13": "Requests the Secretary-General to submit to the General Assembly at its seventy-fifth session a comprehensive report on the status of the Additional Protocols relating to the protection of victims of armed conflicts, as well as on measures taken to strengthen the existing body of international humanitarian law, inter alia, with respect to its dissemination and full implementation at the national level, based on information received from Member States and the International Committee of the Red Cross;",
    "14": "Encourages Member States and the International Committee of the Red Cross, in transmitting information to the Secretary-General, to focus on new developments and activities during the reporting period;",
    "15": "Encourages Member States to explore ways of facilitating the submission of information for future reports of the Secretary-General and, in this context, to consider the convenience of using a questionnaire as drafted by Member States, with the assistance of the International Committee of the Red Cross and, as appropriate, in consultation with the Secretariat, for submission to the General Assembly at its seventy-fifth session;",
    "16": "Decides to include in the provisional agenda of its seventy-fifth session the item entitled \u201cStatus of the Protocols Additional to the Geneva Conventions of 1949 and relating to the protection of victims of armed conflicts\u201d."
  },
  "agenda_items": [
    "Item 83"
  ],
  "symbol_references": []
}