{
  "symbol": "A/RES/72/310",
  "filename": "A_RES_72_310.pdf",
  "title": "72/310. New Partnership for Africa\u2019s Development: progress in implementation and international support",
  "text": "United Nations \nA/RES/72/310\n \n \nGeneral Assembly \nDistr.: General \n19 September 2018 \n \n18-15053 (E)    210918     \n*1815053* \n \n \nSeventy-second session \nAgenda item 66 (a) \n \n \n \n \n Resolution adopted by the General Assembly \non 10 September 2018 \n \n \n \n \n[without reference to a Main Committee (A/72/L.57/Rev.1 and \nA/72/L.57/Rev.1/Add.1)] \n \n \n 72/310. New Partnership for Africa\u2019s Development: progress \nin implementation and international support \n \n \n \nThe General Assembly, \n \nRecalling its resolution 57/2 of 16 September 2002 on the United Nations \nDeclaration on the New Partnership for Africa\u2019s Development,  \n \nRecalling also its resolution 57/7 of 4 November 2002 on the final review and \nappraisal of the United Nations New Agenda for the Development of Africa in the \n1990s and support for the New Partnership for Africa\u2019s Development and all its \nsubsequent resolutions, including resolution 71/320 of 8 September 2017, entitled \n\u201cNew Partnership for Africa\u2019s Development: progress in implementation and \ninternational support\u201d,  \n \nReaffirming its resolution 70/1 of 25 September 2015, entitled \u201cTransforming \nour world: the 2030 Agenda for Sustainable Development\u201d, in which it adopted a \ncomprehensive, far-reaching and people-centred set of universal and transformative \nSustainable Development Goals and targets, its commitment to working tirelessly for \nthe full implementation of the Agenda by 2030, its recognition that eradicating \npoverty in all its forms and dimensions, including extreme poverty, is the greatest \nglobal challenge and an indispensable requirement for sustainable development, its \ncommitment to achieving sustainable development in its three dimensions \u2013 economic, \nsocial and environmental \u2013 in a balanced and integrated manner, and to building upon \nthe achievements of the Millennium Development Goals and seeking to address their \nunfinished business,  \n \nReaffirming also its resolution 69/313 of 27 July 2015, entitled \u201cAddis Ababa \nAction Agenda of the Third International Conference on Financing for Development \n(Addis Ababa Action Agenda)\u201d, which is an integral part of the 2030 Agenda for \nSustainable Development, supports and complements it, helps to contextualize its \nmeans of implementation targets with concrete policies and actions, and reaffirms the \n\nA/RES/72/310 \nNew Partnership for Africa\u2019s Development: progress\nin implementation and international support\n \n18-15053\n2/11 \n \nstrong political commitment to address the challenge of financing and creating an \nenabling environment at all levels for sustainable development in the spirit of global \npartnership and solidarity,  \n \nWelcoming the adoption by the Assembly of Heads of State and Government of \nthe African Union of the decision proclaiming \u201cWinning the fight against corruption: \na sustainable path to Africa\u2019s transformation\u201d as the theme for 2018, and the \nappointment of the African Union Champion against Corruption,  \n \nRecalling that the 2030 Agenda for Sustainable Development underscores the \nspecial challenges facing the most vulnerable countries, including African countries, \nand recalling also that significant challenges remain in achieving sustainable \ndevelopment in Africa and the importance of fulfilling all commitments to advance \naction in areas critical to Africa\u2019s sustainable development,  \n \nRecalling also the commitment of the African leaders to Africa\u2019s political, social \nand economic integration agenda and to the ideal of pan-Africanism and African \nrenaissance, as reaffirmed in the 50th Anniversary Solemn Declaration adopted on \n26 May 2013 on the occasion of the fiftieth anniversary of the Organization of African \nUnity/African Union, \n \nRecognizing the adoption of Agenda 2063 by the Assembly of Heads of State and \nGovernment of the African Union at its twenty-fourth ordinary session, held in Addis \nAbaba on 30 and 31 January 2015, as the African Union long-term strategy \nemphasizing industrialization, youth employment, improved natural resource \ngovernance and the reduction of inequalities, and recognizing also the adoption by the \nAssembly of Heads of State and Government of the African Union of the first 10-year \nimplementation plan (2014\u20132023) of the African Union Agenda 2063, which outlines \nkey African flagship projects, fast-track programmes, priority areas, specific targets \nand African strategies and policy measures at all levels to support its implementation, \n \nNoting with appreciation the signing by the Secretary-General and the \nChairperson of the African Union Commission on 27 January 2018 of the African \nUnion-United Nations Framework for the Implementation of Agenda 2063 and the \n2030 Agenda for Sustainable Development to promote the integrated and coordinated \nimplementation, monitoring and reporting of both Agendas through joint activities \nand programmes, \n \nRecognizing the Malabo Declaration on Accelerated Agricultural Growth and \nTransformation for Shared Prosperity and Improved Livelihoods and the Declaration \non Nutrition Security for Inclusive Economic Growth and Sustainable Development in \nAfrica, adopted by the Assembly of Heads of State and Government of the African \nUnion at its twenty-third ordinary session, held in Malabo on 26 and 27 June 2014, and \nrecognizing also the African Union strategy and road map for facilitating the realization \nof the 2014 Malabo Commitments on Agriculture, launched during the twenty-fourth \nordinary session of the Assembly of Heads of State and Government, in January 2015, \n \nRecalling the adoption of its resolution 72/207 of 20 December 2017 on the \npromotion of international cooperation to combat illicit financial flows in order to \nfoster sustainable development,  \n \nWelcoming the Paris Agreement1 and its early entry into force, encouraging all \nits parties to fully implement the Agreement, and parties to the United Nations \nFramework Convention on Climate Change2 that have not yet done so to deposit their \ninstruments of ratification, acceptance, approval or accession, where appropriate, as \nsoon as possible,  \n__________________ \n \n1  See FCCC/CP/2015/10/Add.1, decision 1/CP.21, annex. \n \n2  United Nations, Treaty Series, vol. 1771, No. 30822. \n\nNew Partnership for Africa\u2019s Development: progress \nin implementation and international support \nA/RES/72/310\n \n3/11\n18-15053 \n \n \nRecalling the declaration of the high-level meeting of African and international \nleaders, entitled \u201cToward African renaissance: renewed partnership for a unified \napproach to end hunger in Africa by 2025 under the framework of the Comprehensive \nAfrica Agriculture Development Programme\u201d,  \n \nRecalling also the adoption of General Assembly resolution 71/254 of \n23 December 2016 on the Framework for a Renewed United Nations-African Union \nPartnership on Africa\u2019s Integration and Development Agenda 2017\u20132027,  \n \nWelcoming the adoption by the Economic and Social Council of resolution \n2018/4 of 17 April 2018 on social dimensions of the New Partnership for Africa\u2019s \nDevelopment,  \n \nRecalling its resolution 70/259 of 1 April 2016, by which it proclaimed  \n2016\u20132025 the United Nations Decade of Action on Nutrition,  \n \nRecognizing the Malabo Declaration on Accelerated Agricultural Growth and \nTransformation for Shared Prosperity and Improved Livelihoods, recognizing the \nneed of Africa\u2019s development partners to implement the commitments contained \nwithin, and recalling the African Union strategy and road map for facilitating the \nrealization of the 2014 Malabo Commitments on Agriculture, \n \nRecalling its resolution 66/293 of 17 September 2012, by which it established a \nUnited Nations monitoring mechanism to review commitments made towards \nAfrica\u2019s development, and looking forward to the third biennial report of the \nSecretary-General on the review of the implementation of the commitments made \ntowards Africa\u2019s development, to be submitted to the General Assembly at its \nseventy-third session,  \n \nWelcoming the high-level events organized by the Office of the Special Adviser \nto the Secretary-General on Africa during Africa Week 2017, on the theme \n\u201cSupporting an integrated, prosperous, people-centred and peaceful Africa: towards \nthe implementation of Agenda 2063 and the 2030 Agenda for Sustainable \nDevelopment\u201d,  \n \nBearing in mind that African countries have primary responsibility for their own \neconomic and social development and that the role of national policies and \ndevelopment strategies cannot be overemphasized, bearing in mind also the need for \ntheir development efforts to be supported by the international community and an \nenabling international economic environment, reiterating the need for the \ninternational community to implement all commitments regarding the economic and \nsocial development of Africa, and in this regard recalling the support given by the \nInternational Conference on Financing for Development to the New Partnership, 3 \n \n1. \nTakes note with appreciation of the fifteenth consolidated progress report \nof the Secretary-General;4 \n \n2. \nRecognizes the New Partnership for Africa\u2019s Development,5 and welcomes \nin this regard the efforts by development partners to strengthen cooperation with the \nPartnership and recognizes the progress made, while acknowledging that much needs \nto be done in its implementation; \n \n3. \nAlso recognizes the importance of supporting the African Union Agenda \n2063 and its first 10-year implementation plan (2014\u20132023) and acknowledges the \nprogramme of the New Partnership for Africa\u2019s Development, both of which are \n__________________ \n \n3  See Report of the International Conference on Financing for Development, Monterrey, Mexico, \n18\u201322 March 2002 (United Nations publication, Sales No. E.02.II.A.7), chap. I, resolution 1, \nannex. \n \n4  A/72/223.  \n \n5  A/57/304, annex.  \n\nA/RES/72/310 \nNew Partnership for Africa\u2019s Development: progress\nin implementation and international support\n \n18-15053\n4/11 \n \nintegral to the 2030 Agenda for Sustainable Development, 6 and underscores in this \nregard the importance of a coherent and coordinated implementation of Agenda 2063 \nand the 2030 Agenda; \n \n4. \nCalls upon developing countries and countries with economies in \ntransition to continue their efforts to create a domestic environment conducive to \nencouraging entrepreneurship, promoting the formalization of informal sector \nactivities in Africa and attracting investments by, inter alia, achieving a transparent, \nstable and predictable investment climate with proper contract enforcement and \nrespect for property rights, embedded in sound macroeconomic policies and \ninstitutions;  \n \n5. \nNotes that foreign direct investment is a major source of financing for \ndevelopment, that it has a critical role in achieving inclusive economic growth and \nsustainable development, including through the promotion of job creation and the \neradication of poverty and hunger, and that it contributes to the active participation \nof the African economies in the global economy and facilitates regional economic \ncooperation and integration, and in this regard calls upon, as appropriate, developed \ncountries to continue to devise source-country measures to encourage and facilitate \nthe flow of foreign direct investment through, inter alia, the provision of export \ncredits and other lending instruments, risk guarantees and business development \nservices;  \n \n6. \nEmphasizes that economic development, including inclusive industrial \ndevelopment, and policies which seek to enhance productive capacities in Africa can \ngenerate employment and income for the poor and, therefore, be an engine for poverty \neradication and for achieving internationally agreed development goals, including the \nSustainable Development Goals, and recognizes in this regard the adoption by the \nGeneral Assembly of resolution 70/293 of 25 July 2016 on the Third Industrial \nDevelopment Decade for Africa (2016\u20132025);  \n \n7. \nCalls for effective measures and targeted investments to overcome \ndifficulties, to support recovery priorities and to strengthen national health systems \nto prevent, protect against and combat outbreaks of diseases, inter alia, the Ebola \noutbreak, particularly in the most affected countries, in line with the obligations of \nthe International Health Regulations (2005) 7 and the outcome of the International \nEbola Recovery Conference, held in New York on 10 July 2015, invites development \npartners to continue to assist African countries in their efforts to strengthen national \nhealth systems, to expand surveillance systems in the health sector, in compliance \nwith the International Health Regulations (2005), and to eliminate diseases, and in \nthis context calls upon development partners to support the implementation of the \nAfrican Health Strategy 2016\u20132030 and the transition towards universal health \ncoverage in Africa; \n \n8. \nRecalls its commitment to broadening and strengthening the voice and \nparticipation of developing countries, including African countries, in international \neconomic decision-making, norm-setting and global economic governance; \n \n9. \nExpresses concern about the increasing challenges posed by climate \nchange, drought, land degradation, desertification, the loss of biodiversity and floods, \nand their negative consequences for the fight against poverty, famine and hunger, \nwhich could pose serious additional challenges to the achievement of the \ninternationally agreed development goals, including the Sustainable Development \nGoals, particularly in Africa;  \n__________________ \n \n6  Resolution 70/1.  \n \n7  World Health Organization, document WHA58/2005/REC/1, resolution 58.3, annex.  \n\nNew Partnership for Africa\u2019s Development: progress \nin implementation and international support \nA/RES/72/310\n \n5/11\n18-15053 \n \n \n10. Notes with concern that gross official development assistance to Africa \ndecreased by 1.3 per cent in 2016;  \n \n11. \nAlso notes with concern Africa\u2019s disproportionately low share of the \nvolume of international trade, which stands at approximately 2.65 per cent for 2016, \nand expresses concern at the increased debt burden of some African countries;  \n \n12. Reaffirms that achieving gender equality, empowering all women and \ngirls, and the full realization of their human rights are essential to achieving sustained, \ninclusive and equitable economic growth and sustainable development, reiterates the \nneed for gender mainstreaming, including targeted actions and investments in the \nformulation and implementation of all financial, economic, environmental and social \npolicies, and recommits to adopting and strengthening sound policies and enforceable \nlegislation and transformative actions for the promotion of gender equality and \nwomen\u2019s and girls\u2019 empowerment at all levels, to ensure women\u2019s equal rights, \naccess and opportunities for participation and leadership in the economy and to \neliminate gender-based violence, sexual exploitation and abuse and discrimination \nin all its forms;  \n \n13. Recognizes its commitment to the full implementation of the political \ndeclaration on Africa\u2019s development needs, adopted at the high-level meeting on \nAfrica\u2019s development needs on 22 September 2008;8 \n \n \n \nI \n \n \nActions by African countries and organizations \n \n \n14. Welcomes the progress made by African countries in fulfilling their \ncommitments in the implementation of the New Partnership to deepen democracy, \nhuman rights, good governance and sound economic management, and encourages \nAfrican countries, with the participation of stakeholders, including civil society and \nthe private sector, to continue their efforts towards achieving the Sustainable \nDevelopment Goals, developing and strengthening institutions for governance, \ncreating an environment conducive to involving the private sector, including small \nand medium-sized enterprises, in the New Partnership implementation process, \ndeveloping innovative public-private partnerships for financing infrastructure \nprojects9 and attracting foreign direct investment for development;  \n \n15. Notes with appreciation the efforts exerted by the African Union and the \nregional economic communities in the area of economic integration, as well as \nongoing efforts by the African Union in the operationalization of the provision \ncontained in all previous General Assembly resolutions on cooperation between the \nUnited Nations and the African Union, and stresses the key role of the United Nations \nsystem in supporting the African Union in the social, economic and political fields \nand in the area of peace and security; \n \n16. Recognizes the important role that African regional economic communities \ncan play in the implementation of the New Partnership and Agenda 2063 and its first \n10-year implementation plan in close cooperation with the African Union, and in this \nregard encourages African countries and the international community to give regional \neconomic communities the support necessary to strengthen their capacity;  \n \n17. Acknowledges the progress made towards ensuring free movement of \npersons as well as goods and services in Africa, and in this regard notes with \n__________________ \n \n8  Resolution 63/1. \n \n9  Such as the project entitled \u201cOptic fibre link between Algeria and Nigeria via Niger\u201d aimed at \nconnecting Algeria and Nigeria through the installation of 4,500 kilometres of terrestrial optic \nfibre. \n\nA/RES/72/310 \nNew Partnership for Africa\u2019s Development: progress\nin implementation and international support\n \n18-15053\n6/11 \n \nappreciation the signing of the agreement launching the African Continental Free \nTrade Area at the tenth extraordinary summit of the African Union, held in Kigali on \n21 March 2018, which aims at doubling intra-African trade by removing non-tariff \nand tariff barriers on goods and services;  \n \n18. Notes with appreciation the decision to establish the Single African Air \nTransport Market, adopted by the Assembly of Heads of State and Government of the \nAfrican Union at its thirtieth ordinary session, held in Addis Ababa on 28 and \n29 January 2018;  \n \n19. Encourages African countries to strengthen and expand local and regional \ninfrastructure and to continue to share best practices with a view to strengthening \nregional and continental integration, and in this regard notes with appreciation the \nwork of the high-level subcommittee of the African Union on the Presidential \nInfrastructure Champion Initiative, which seeks to further strengthen the development \nof infrastructure on the African continent in collaboration with relevant development \npartners;  \n \n20. Also encourages African countries to maintain the trend of increasing both \nforeign and domestic investment in infrastructure development, including through \nstrengthened domestic resource mobilization from the public and private sectors, and \nimproving the efficiency of existing infrastructure investment;  \n \n21. Further encourages African countries to accelerate the achievement of the \nobjective of food security and nutrition in Africa, welcomes the commitment made \nby African leaders to allocate at least 10 per cent of public expenditure to agriculture \nand to ensure its efficiency and effectiveness, in this regard recognizes its support for \nthe commitments contained in the Malabo Declaration on Accelerated Agricultural \nGrowth and Transformation for Shared Prosperity and Improved Livelihoods and for \nthe Comprehensive Africa Agriculture Development Programme, under the strong \nleadership of African countries, and in this regard notes the important progress made \nby the 44 African countries and the 4 regional economic communities that have signed \ncompacts under the Programme;  \n \n22. Encourages African countries to continue their efforts in investing in \neducation, science, technology and innovation to enhance value addition and \nindustrial development;  \n \n23. Takes note of the declaration on the theme of the year 2016 adopted by the \nAssembly of Heads of State and Government of the African Union at its twenty-\nseventh ordinary session, held in Kigali on 17 and 18 July 2016, including the \ndetermination to protect and promote women\u2019s human rights, and expresses its \nappreciation for the continuing and increasing efforts of African countries in \nmainstreaming the gender perspective and the empowerment of women in the \nimplementation of the New Partnership;  \n \n24. Welcomes the noteworthy progress that has been achieved in implementing \nthe African Peer Review Mechanism, in particular the voluntary adherence of \n37 African countries to the Mechanism and the completion of the peer review process \nin 21 countries, welcomes the progress in implementing the national programmes of \naction resulting from those reviews, in this regard urges African States that have not \nyet done so to consider joining the Mechanism process, and encourages further \nstrengthening of the Mechanism process for its efficient performance;  \n \n25. Reiterates its commitment to further strengthen public policies and the \nmobilization and effective use of domestic resources, recognizing that domestic \nresources are first and foremost generated by economic growth, supported by an \nenabling environment at all levels;  \n\nNew Partnership for Africa\u2019s Development: progress \nin implementation and international support \nA/RES/72/310\n \n7/11\n18-15053 \n \n \n26. Welcomes the collaboration between the African Private Sector Forum and \nthe United Nations Global Compact, and encourages the further enhancement of this \npartnership in conjunction with the African Union Commission in support of the \ndevelopment of the African private sector and the achievement of the Sustainable \nDevelopment Goals, in line with the relevant executive decisions of the African Union; \n \n27. Also welcomes the efforts of the United Nations and the African Union to \nalign the clusters of the Regional Coordination Mechanism for Africa 10 with the \nstrategic frameworks of the African Union and the New Partnership for 2014\u20132017 \nand Agenda 2063, and invites development partners, including the United Nations \nsystem, to continue to support the Regional Coordination Mechanism for Africa in \nachieving its objectives, including through the allocation of necessary funds to \nsupport the implementation of its activities;  \n \n \n \nII \n \n \nResponse of the international community \n \n \n28. Reiterates that we are setting out together on the path towards sustainable \ndevelopment, devoting ourselves collectively to the pursuit of global development \nand of \u201cwin-win\u201d cooperation which can bring huge gains to all countries and all parts \nof the world;  \n \n29. Urges the international community to continue to give due attention to \nAfrica\u2019s priorities, including the New Partnership, in line with the 2030 Agenda for \nSustainable Development;  \n \n30. Reiterates that the fulfilment of all official development assistance \ncommitments remains crucial, including the commitment by many developed \ncountries to achieve the target of 0.7 per cent of gross national income for official \ndevelopment assistance and 0.15 to 0.20 per cent of gross national income for official \ndevelopment assistance to least developed countries, is encouraged by those few \ncountries that have met or surpassed their commitment to 0.7 per cent of gross \nnational income for official development assistance and the target of 0.15 to 0.20 per \ncent of gross national income for official development assistance to least developed \ncountries, and urges all others to step up efforts to increase their official development \nassistance and to make additional concrete efforts towards official development \nassistance targets;  \n \n31. Underlines the importance of debt crisis prevention and prudent debt \nmanagement, calls for a comprehensive and sustainable solution to the external debt \nproblems of African countries, including the challenge of undeclared or hidden debt, \nand recognizes the important role, on a case-by-case basis, of debt relief, including \ndebt cancellation, as appropriate, the Heavily Indebted Poor Countries Initiative and \ndebt restructuring;  \n \n32. Reiterates that international trade is an engine for inclusive economic \ngrowth and can contribute to the promotion of sustainable development for all, in \nparticular through its contribution to boosting job creation, given the high youth \nunemployment in Africa, and to the attainment of the Sustainable Development \nGoals;  \n__________________ \n \n10  The clusters adopted by the Regional Coordination Mechanism at its seventeenth session are \n(a) sustainable and inclusive economic growth, industry, trade and regional integration; \n(b) infrastructure development; (c) human capital development, health, science, technology and \ninnovation; (d) social development, labour, employment creation, social protection, migration \nand mobility; (e) women and gender equality and youth empowerment; (f) humanitarian matters \nand disaster risk management; (g) environment, urbanization and population; and (h) advocacy, \ninformation, communications and culture. \n\nA/RES/72/310 \nNew Partnership for Africa\u2019s Development: progress\nin implementation and international support\n \n18-15053\n8/11 \n \n \n33. Also reiterates the need for all countries and relevant multilateral \ninstitutions to continue efforts to enhance coherence in their trade policies towards \nAfrican countries, and acknowledges the importance of efforts to fully integrate \nAfrican countries into the multilateral trading system and to build their capacity to \ncompete through such initiatives as Aid for Trade and, given the world economic and \nfinancial crisis, the provision of assistance to address the adjustment challenges of \ntrade liberalization;  \n \n34. Looks forward to the convening of the third Global Infrastructure Forum \nin Bali, Indonesia, on 13 October 2018, and in this regard recalls, as outlined in the \nAddis Ababa Action Agenda of the Third International Conference on Financing for \nDevelopment, 11 that a greater range of voices should be heard, particularly from \ndeveloping countries, to identify and address infrastructure and capacity gaps, in \nparticular in, inter alia, African countries, and that it will highlight opportunities for \ninvestment and cooperation and work to ensure that investments are environmentally, \nsocially and economically sustainable; \n \n35. Welcomes the various important initiatives established between African \ncountries and their development partners, as well as other initiatives, emphasizes the \nimportance of coordination in such initiatives on Africa and the need for their \neffective implementation, and in this regard recognizes the important role that North-\nSouth, South-South and triangular cooperation can play in supporting Africa\u2019s \ndevelopment efforts, particularly the implementation of the New Partnership, while \nbearing in mind that South-South cooperation is not a substitute for but rather a \ncomplement to North-South cooperation;  \n \n36. Acknowledges the establishment of the Africa Global Partnership Platform \nas a mechanism for advancing Africa\u2019s interests and perspectives into wider global \nprocesses;  \n \n37. Welcomes the increasing efforts to improve the quality of official \ndevelopment assistance and increase its development impact, recognizes the \nDevelopment Cooperation Forum of the Economic and Social Council, notes other \ninitiatives, such as the high-level forums on aid effectiveness, which produced, inter \nalia, the Paris Declaration on Aid Effectiveness, the Accra Agenda for Action12 and \nthe Busan Partnership for Effective Development Cooperation, which make important \ncontributions to the efforts of the countries that have made commitments to them, \nincluding through the adoption of the fundamental principles of national ownership, \nalignment, harmonization, transparency, accountability and managing for results, and \nbears in mind that there is no one-size-fits-all formula that will guarantee effective \nassistance and that the specific situation of each country needs to be fully considered; \n \n38. Invites all of Africa\u2019s development partners, in particular developed \ncountries, to support the efforts of African countries to promote and maintain \nmacroeconomic stability, to help African countries to attract investments and promote \npolicies conducive to attracting domestic and foreign investment, for example by \nencouraging private financial flows and supporting small and medium-sized \nenterprises, especially those owned by women, to promote investment by their private \nsectors in Africa, to encourage and facilitate the development and transfer of \ntechnology to African countries, on mutually agreed terms, and to assist in \nstrengthening human and institutional capacities for the implementation of the New \nPartnership, consistent with its priorities and objectives and with a view to furthering \nAfrica\u2019s development at all levels;  \n__________________ \n \n11  Resolution 69/313, annex. \n \n12  A/63/539, annex. \n\nNew Partnership for Africa\u2019s Development: progress \nin implementation and international support \nA/RES/72/310\n \n9/11\n18-15053 \n \n \n39. Underlines the importance of South-South cooperation as an expression of \nsolidarity among peoples and countries of the South, based on their shared \nexperiences and objectives, and that it should continue to be guided by the principles \nof respect for national sovereignty, national ownership and independence, equality, \nnon-conditionality, non-interference in domestic affairs and mutual benefit, welcomes \nthe increased contributions of South-South cooperation to poverty eradication and \nsustainable development, encourages developing countries to voluntarily step up their \nefforts to strengthen South-South cooperation and to further improve its development \neffectiveness in accordance with the provisions of the Nairobi outcome document of \nthe High-level United Nations Conference on South-South Cooperation,13 and looks \nforward to the second High-level United Nations Conference on South-South \nCooperation, to be held in Buenos Aires from 20 to 22 March 2019;  \n \n40. Considers that innovative mechanisms of financing can make a positive \ncontribution towards assisting developing countries in mobilizing additional \nresources for financing for development on a voluntary basis and that such financing \nshould supplement and not be a substitute for traditional sources of financing, and, \nwhile highlighting the considerable progress on innovative sources of financing for \ndevelopment achieved to date, stresses the importance of scaling up present initiatives \nand developing new mechanisms, as appropriate;  \n \n41. Underscores the importance of support by Africa\u2019s partners, in particular \ndeveloped countries, of efforts by African countries to strengthen domestic resource \nmobilization, including through capacity-building and strengthening of international \ncooperation to combat illicit financial flows and enhance asset recovery and return; \n \n42. Reiterates the commitment to redouble efforts to substantially reduce \nillicit financial flows by 2030, with a view to eventually eliminating them, including \nby combating tax evasion and corruption through strengthened national regulation \nand increased international cooperation, in line with the Addis Ababa Action Agenda, \nand the strengthening of international cooperation to combat illicit financial flows; \n \n43. Recognizes the need for Africa\u2019s development partners to align their \nefforts in infrastructure investment towards supporting the Programme for \nInfrastructure Development in Africa, and notes in this regard the convening in Dakar \non 14 and 15 June 2014 of the Financing Summit for Africa\u2019s Infrastructure, which \nadopted the Dakar Agenda for Action to mobilize investment towards infrastructure \ndevelopment projects, and calls upon development partners to support the \nimplementation of the Dakar Agenda;  \n \n44. Urges continued support of measures to address the challenges of poverty \neradication, hunger and malnutrition, job creation and sustainable development in \nAfrica, including, as appropriate, debt relief, improved market access, support for the \nprivate sector and entrepreneurship, fulfilment of commitments on official \ndevelopment assistance and increased flows of foreign direct investment, and transfer \nof technology on mutually agreed terms;  \n \n45. Recognizes the need for Africa\u2019s development partners to align their \nefforts to implement the commitments contained in the Declaration on Nutrition \nSecurity for Inclusive Economic Growth and Sustainable Development in Africa, \ntowards supporting the Comprehensive Africa Agriculture Development Programme \nand the implementation of its national and regional investment plans of the \nProgramme for alignment of external funding, and takes note of the Declaration of \nthe World Summit on Food Security;14  \n__________________ \n \n13  Resolution 64/222, annex. \n \n14  Food and Agriculture Organization of the United Nations, document WSFS 2009/2. \n\nA/RES/72/310 \nNew Partnership for Africa\u2019s Development: progress\nin implementation and international support\n \n18-15053\n10/11 \n \n \n46. Expresses deep concern about the continuing negative effects of \ndesertification, land degradation and drought on the African continent and underlines \nthe need for short-, medium- and long-term measures, and in this regard calls for the \ncontinued effective implementation of the United Nations Convention to Combat \nDesertification \nin \nThose \nCountries \nExperiencing \nSerious \nDrought \nand/or \nDesertification, Particularly in Africa,15 including its 2018\u20132030 Strategic Framework;16 \n \n47. Recognizes that Africa is one of the regions that contribute the least to \nclimate change, yet is extremely vulnerable and exposed to the adverse impacts of \nclimate change, and in this regard calls upon the international community, including \ndeveloped countries, to continue to support Africa to address its adaptation needs \nthrough, inter alia, the development, transfer and deployment of technology on \nmutually agreed terms, capacity-building and the provision of adequate and \npredictable resources, in line with existing commitments, and highlights the need for \nfull implementation of the agreed outcomes of the United Nations Framework \nConvention on Climate Change,2 including the Paris Agreement;1  \n \n48. Reiterates the need to support developing countries in strengthening the \ncapacity of national statistical offices and data systems to ensure access to high-\nquality, timely, reliable and disaggregated data;  \n \n49. Stresses that the prevention, management and resolution of conflict and \npost-conflict consolidation are essential for the achievement of the objectives of the \nNew Partnership, and welcomes in this regard the cooperation and support granted by \nthe United Nations and development partners to the African regional and subregional \norganizations in the implementation of the New Partnership;  \n \n50. Welcomes the continued efforts of the United Nations Peacebuilding \nCommission in assisting post-conflict countries in Africa, particularly the six African \ncountries for which the Commission has established country-specific configurations; \n \n51. Requests the United Nations system to continue to provide assistance to \nthe Planning and Coordinating Agency of the New Partnership and to African \ncountries in developing projects and programmes within the scope of the priorities of \nthe New Partnership and to place greater emphasis on monitoring, evaluation and \ndissemination of the effectiveness of its activities in support of the New Partnership; \n \n52. Emphasizes African ownership of the African Peer Review Mechanism \nprocess, and invites the international community to support the efforts of African \ncountries, at their request, in implementing their respective national programmes of \naction arising from the process;  \n \n53. Requests the Secretary-General to promote greater coherence in the work \nof the United Nations system in support of the New Partnership, on the basis of the \nagreed clusters of the Regional Coordination Mechanism for Africa, and in this regard \ncalls upon the United Nations system to continue to mainstream the special needs of \nAfrica in all its normative and operational activities;  \n \n54. Recalls the establishment of the United Nations monitoring mechanism to \nreview commitments made relating to Africa\u2019s development, and invites Member \nStates and all relevant entities of the United Nations system, including funds, \nprogrammes, specialized agencies and regional commissions, in particular the \nEconomic Commission for Africa, and all relevant international and regional \norganizations, to continue to contribute to the effectiveness and reliability of the \nreview process by cooperating in the collection of data and the evaluation of \nperformance;  \n__________________ \n \n15  United Nations, Treaty Series, vol. 1954, No. 33480. \n \n16  ICCD/COP(13)/21/Add.1, decision 7/COP.13, annex. \n\nNew Partnership for Africa\u2019s Development: progress \nin implementation and international support \nA/RES/72/310\n \n11/11\n18-15053 \n \n \n55. Requests the Secretary-General to submit a comprehensive report on the \nimplementation of the present resolution to the General Assembly on an annual basis \non the provision of inputs from Governments, organizations of the United Nations \nsystem and other stakeholders in the New Partnership.  \n \n113th plenary meeting  \n10 September 2018 \n \n",
  "paragraphs": {
    "1": "Takes note with appreciation of the fifteenth consolidated progress report of the Secretary-General;4",
    "2": "Recognizes the New Partnership for Africa\u2019s Development,5 and welcomes in this regard the efforts by development partners to strengthen cooperation with the Partnership and recognizes the progress made, while acknowledging that much needs to be done in its implementation;",
    "3": "Also recognizes the importance of supporting the African Union Agenda 2063 and its first 10-year implementation plan (2014\u20132023) and acknowledges the programme of the New Partnership for Africa\u2019s Development, both of which are __________________ 3 See Report of the International Conference on Financing for Development, Monterrey, Mexico, 18\u201322 March 2002 (United Nations publication, Sales No. E.02.II.A.7), chap. I, resolution 1, annex. 4 A/72/223. 5 A/57/304, annex. A/RES/72/310 New Partnership for Africa\u2019s Development: progress in implementation and international support 18-15053 4/11 integral to the 2030 Agenda for Sustainable Development, 6 and underscores in this regard the importance of a coherent and coordinated implementation of Agenda 2063 and the 2030 Agenda;",
    "4": "Calls upon developing countries and countries with economies in transition to continue their efforts to create a domestic environment conducive to encouraging entrepreneurship, promoting the formalization of informal sector activities in Africa and attracting investments by, inter alia, achieving a transparent, stable and predictable investment climate with proper contract enforcement and respect for property rights, embedded in sound macroeconomic policies and institutions;",
    "5": "Notes that foreign direct investment is a major source of financing for development, that it has a critical role in achieving inclusive economic growth and sustainable development, including through the promotion of job creation and the eradication of poverty and hunger, and that it contributes to the active participation of the African economies in the global economy and facilitates regional economic cooperation and integration, and in this regard calls upon, as appropriate, developed countries to continue to devise source-country measures to encourage and facilitate the flow of foreign direct investment through, inter alia, the provision of export credits and other lending instruments, risk guarantees and business development services;",
    "6": "Emphasizes that economic development, including inclusive industrial development, and policies which seek to enhance productive capacities in Africa can generate employment and income for the poor and, therefore, be an engine for poverty eradication and for achieving internationally agreed development goals, including the Sustainable Development Goals, and recognizes in this regard the adoption by the General Assembly of resolution 70/293 of 25 July 2016 on the Third Industrial Development Decade for Africa (2016\u20132025);",
    "7": "Calls for effective measures and targeted investments to overcome difficulties, to support recovery priorities and to strengthen national health systems to prevent, protect against and combat outbreaks of diseases, inter alia, the Ebola outbreak, particularly in the most affected countries, in line with the obligations of the International Health Regulations (2005) 7 and the outcome of the International Ebola Recovery Conference, held in New York on 10 July 2015, invites development partners to continue to assist African countries in their efforts to strengthen national health systems, to expand surveillance systems in the health sector, in compliance with the International Health Regulations (2005), and to eliminate diseases, and in this context calls upon development partners to support the implementation of the African Health Strategy 2016\u20132030 and the transition towards universal health coverage in Africa;",
    "8": "Recalls its commitment to broadening and strengthening the voice and participation of developing countries, including African countries, in international economic decision-making, norm-setting and global economic governance;",
    "9": "Expresses concern about the increasing challenges posed by climate change, drought, land degradation, desertification, the loss of biodiversity and floods, and their negative consequences for the fight against poverty, famine and hunger, which could pose serious additional challenges to the achievement of the internationally agreed development goals, including the Sustainable Development Goals, particularly in Africa; __________________ 6 Resolution 70/1. 7 World Health Organization, document WHA58/2005/REC/1, resolution 58.3, annex. New Partnership for Africa\u2019s Development: progress in implementation and international support A/RES/72/310 5/11 18-15053",
    "10": "Notes with concern that gross official development assistance to Africa decreased by 1.3 per cent in 2016;",
    "11": "Also notes with concern Africa\u2019s disproportionately low share of the volume of international trade, which stands at approximately 2.65 per cent for 2016, and expresses concern at the increased debt burden of some African countries;",
    "12": "Reaffirms that achieving gender equality, empowering all women and girls, and the full realization of their human rights are essential to achieving sustained, inclusive and equitable economic growth and sustainable development, reiterates the need for gender mainstreaming, including targeted actions and investments in the formulation and implementation of all financial, economic, environmental and social policies, and recommits to adopting and strengthening sound policies and enforceable legislation and transformative actions for the promotion of gender equality and women\u2019s and girls\u2019 empowerment at all levels, to ensure women\u2019s equal rights, access and opportunities for participation and leadership in the economy and to eliminate gender-based violence, sexual exploitation and abuse and discrimination in all its forms;",
    "13": "Recognizes its commitment to the full implementation of the political declaration on Africa\u2019s development needs, adopted at the high-level meeting on Africa\u2019s development needs on 22 September 2008;8 I Actions by African countries and organizations",
    "14": "Welcomes the progress made by African countries in fulfilling their commitments in the implementation of the New Partnership to deepen democracy, human rights, good governance and sound economic management, and encourages African countries, with the participation of stakeholders, including civil society and the private sector, to continue their efforts towards achieving the Sustainable Development Goals, developing and strengthening institutions for governance, creating an environment conducive to involving the private sector, including small and medium-sized enterprises, in the New Partnership implementation process, developing innovative public-private partnerships for financing infrastructure projects9 and attracting foreign direct investment for development;",
    "15": "Notes with appreciation the efforts exerted by the African Union and the regional economic communities in the area of economic integration, as well as ongoing efforts by the African Union in the operationalization of the provision contained in all previous General Assembly resolutions on cooperation between the United Nations and the African Union, and stresses the key role of the United Nations system in supporting the African Union in the social, economic and political fields and in the area of peace and security;",
    "16": "Recognizes the important role that African regional economic communities can play in the implementation of the New Partnership and Agenda 2063 and its first 10-year implementation plan in close cooperation with the African Union, and in this regard encourages African countries and the international community to give regional economic communities the support necessary to strengthen their capacity;",
    "17": "Acknowledges the progress made towards ensuring free movement of persons as well as goods and services in Africa, and in this regard notes with __________________ 8 Resolution 63/1. 9 Such as the project entitled \u201cOptic fibre link between Algeria and Nigeria via Niger\u201d aimed at connecting Algeria and Nigeria through the installation of 4,500 kilometres of terrestrial optic fibre. A/RES/72/310 New Partnership for Africa\u2019s Development: progress in implementation and international support 18-15053 6/11 appreciation the signing of the agreement launching the African Continental Free Trade Area at the tenth extraordinary summit of the African Union, held in Kigali on 21 March 2018, which aims at doubling intra-African trade by removing non-tariff and tariff barriers on goods and services;",
    "18": "Notes with appreciation the decision to establish the Single African Air Transport Market, adopted by the Assembly of Heads of State and Government of the African Union at its thirtieth ordinary session, held in Addis Ababa on 28 and 29 January 2018;",
    "19": "Encourages African countries to strengthen and expand local and regional infrastructure and to continue to share best practices with a view to strengthening regional and continental integration, and in this regard notes with appreciation the work of the high-level subcommittee of the African Union on the Presidential Infrastructure Champion Initiative, which seeks to further strengthen the development of infrastructure on the African continent in collaboration with relevant development partners;",
    "20": "Also encourages African countries to maintain the trend of increasing both foreign and domestic investment in infrastructure development, including through strengthened domestic resource mobilization from the public and private sectors, and improving the efficiency of existing infrastructure investment;",
    "21": "Further encourages African countries to accelerate the achievement of the objective of food security and nutrition in Africa, welcomes the commitment made by African leaders to allocate at least 10 per cent of public expenditure to agriculture and to ensure its efficiency and effectiveness, in this regard recognizes its support for the commitments contained in the Malabo Declaration on Accelerated Agricultural Growth and Transformation for Shared Prosperity and Improved Livelihoods and for the Comprehensive Africa Agriculture Development Programme, under the strong leadership of African countries, and in this regard notes the important progress made by the 44 African countries and the 4 regional economic communities that have signed compacts under the Programme;",
    "22": "Encourages African countries to continue their efforts in investing in education, science, technology and innovation to enhance value addition and industrial development;",
    "23": "Takes note of the declaration on the theme of the year 2016 adopted by the Assembly of Heads of State and Government of the African Union at its twenty- seventh ordinary session, held in Kigali on 17 and 18 July 2016, including the determination to protect and promote women\u2019s human rights, and expresses its appreciation for the continuing and increasing efforts of African countries in mainstreaming the gender perspective and the empowerment of women in the implementation of the New Partnership;",
    "24": "Welcomes the noteworthy progress that has been achieved in implementing the African Peer Review Mechanism, in particular the voluntary adherence of 37 African countries to the Mechanism and the completion of the peer review process in 21 countries, welcomes the progress in implementing the national programmes of action resulting from those reviews, in this regard urges African States that have not yet done so to consider joining the Mechanism process, and encourages further strengthening of the Mechanism process for its efficient performance;",
    "25": "Reiterates its commitment to further strengthen public policies and the mobilization and effective use of domestic resources, recognizing that domestic resources are first and foremost generated by economic growth, supported by an enabling environment at all levels; New Partnership for Africa\u2019s Development: progress in implementation and international support A/RES/72/310 7/11 18-15053",
    "26": "Welcomes the collaboration between the African Private Sector Forum and the United Nations Global Compact, and encourages the further enhancement of this partnership in conjunction with the African Union Commission in support of the development of the African private sector and the achievement of the Sustainable Development Goals, in line with the relevant executive decisions of the African Union;",
    "27": "Also welcomes the efforts of the United Nations and the African Union to align the clusters of the Regional Coordination Mechanism for Africa 10 with the strategic frameworks of the African Union and the New Partnership for 2014\u20132017 and Agenda 2063, and invites development partners, including the United Nations system, to continue to support the Regional Coordination Mechanism for Africa in achieving its objectives, including through the allocation of necessary funds to support the implementation of its activities; II Response of the international community",
    "28": "Reiterates that we are setting out together on the path towards sustainable development, devoting ourselves collectively to the pursuit of global development and of \u201cwin-win\u201d cooperation which can bring huge gains to all countries and all parts of the world;",
    "29": "Urges the international community to continue to give due attention to Africa\u2019s priorities, including the New Partnership, in line with the 2030 Agenda for Sustainable Development;",
    "30": "Reiterates that the fulfilment of all official development assistance commitments remains crucial, including the commitment by many developed countries to achieve the target of 0.7 per cent of gross national income for official development assistance and 0.15 to 0.20 per cent of gross national income for official development assistance to least developed countries, is encouraged by those few countries that have met or surpassed their commitment to 0.7 per cent of gross national income for official development assistance and the target of 0.15 to 0.20 per cent of gross national income for official development assistance to least developed countries, and urges all others to step up efforts to increase their official development assistance and to make additional concrete efforts towards official development assistance targets;",
    "31": "Underlines the importance of debt crisis prevention and prudent debt management, calls for a comprehensive and sustainable solution to the external debt problems of African countries, including the challenge of undeclared or hidden debt, and recognizes the important role, on a case-by-case basis, of debt relief, including debt cancellation, as appropriate, the Heavily Indebted Poor Countries Initiative and debt restructuring;",
    "32": "Reiterates that international trade is an engine for inclusive economic growth and can contribute to the promotion of sustainable development for all, in particular through its contribution to boosting job creation, given the high youth unemployment in Africa, and to the attainment of the Sustainable Development Goals; __________________ 10 The clusters adopted by the Regional Coordination Mechanism at its seventeenth session are (a) sustainable and inclusive economic growth, industry, trade and regional integration; (b) infrastructure development; (c) human capital development, health, science, technology and innovation; (d) social development, labour, employment creation, social protection, migration and mobility; (e) women and gender equality and youth empowerment; (f) humanitarian matters and disaster risk management; (g) environment, urbanization and population; and (h) advocacy, information, communications and culture. A/RES/72/310 New Partnership for Africa\u2019s Development: progress in implementation and international support 18-15053 8/11",
    "33": "Also reiterates the need for all countries and relevant multilateral institutions to continue efforts to enhance coherence in their trade policies towards African countries, and acknowledges the importance of efforts to fully integrate African countries into the multilateral trading system and to build their capacity to compete through such initiatives as Aid for Trade and, given the world economic and financial crisis, the provision of assistance to address the adjustment challenges of trade liberalization;",
    "34": "Looks forward to the convening of the third Global Infrastructure Forum in Bali, Indonesia, on 13 October 2018, and in this regard recalls, as outlined in the Addis Ababa Action Agenda of the Third International Conference on Financing for Development, 11 that a greater range of voices should be heard, particularly from developing countries, to identify and address infrastructure and capacity gaps, in particular in, inter alia, African countries, and that it will highlight opportunities for investment and cooperation and work to ensure that investments are environmentally, socially and economically sustainable;",
    "35": "Welcomes the various important initiatives established between African countries and their development partners, as well as other initiatives, emphasizes the importance of coordination in such initiatives on Africa and the need for their effective implementation, and in this regard recognizes the important role that North- South, South-South and triangular cooperation can play in supporting Africa\u2019s development efforts, particularly the implementation of the New Partnership, while bearing in mind that South-South cooperation is not a substitute for but rather a complement to North-South cooperation;",
    "36": "Acknowledges the establishment of the Africa Global Partnership Platform as a mechanism for advancing Africa\u2019s interests and perspectives into wider global processes;",
    "37": "Welcomes the increasing efforts to improve the quality of official development assistance and increase its development impact, recognizes the Development Cooperation Forum of the Economic and Social Council, notes other initiatives, such as the high-level forums on aid effectiveness, which produced, inter alia, the Paris Declaration on Aid Effectiveness, the Accra Agenda for Action12 and the Busan Partnership for Effective Development Cooperation, which make important contributions to the efforts of the countries that have made commitments to them, including through the adoption of the fundamental principles of national ownership, alignment, harmonization, transparency, accountability and managing for results, and bears in mind that there is no one-size-fits-all formula that will guarantee effective assistance and that the specific situation of each country needs to be fully considered;",
    "38": "Invites all of Africa\u2019s development partners, in particular developed countries, to support the efforts of African countries to promote and maintain macroeconomic stability, to help African countries to attract investments and promote policies conducive to attracting domestic and foreign investment, for example by encouraging private financial flows and supporting small and medium-sized enterprises, especially those owned by women, to promote investment by their private sectors in Africa, to encourage and facilitate the development and transfer of technology to African countries, on mutually agreed terms, and to assist in strengthening human and institutional capacities for the implementation of the New Partnership, consistent with its priorities and objectives and with a view to furthering Africa\u2019s development at all levels; __________________ 11 Resolution 69/313, annex. 12 A/63/539, annex. New Partnership for Africa\u2019s Development: progress in implementation and international support A/RES/72/310 9/11 18-15053",
    "39": "Underlines the importance of South-South cooperation as an expression of solidarity among peoples and countries of the South, based on their shared experiences and objectives, and that it should continue to be guided by the principles of respect for national sovereignty, national ownership and independence, equality, non-conditionality, non-interference in domestic affairs and mutual benefit, welcomes the increased contributions of South-South cooperation to poverty eradication and sustainable development, encourages developing countries to voluntarily step up their efforts to strengthen South-South cooperation and to further improve its development effectiveness in accordance with the provisions of the Nairobi outcome document of the High-level United Nations Conference on South-South Cooperation,13 and looks forward to the second High-level United Nations Conference on South-South Cooperation, to be held in Buenos Aires from 20 to 22 March 2019;",
    "40": "Considers that innovative mechanisms of financing can make a positive contribution towards assisting developing countries in mobilizing additional resources for financing for development on a voluntary basis and that such financing should supplement and not be a substitute for traditional sources of financing, and, while highlighting the considerable progress on innovative sources of financing for development achieved to date, stresses the importance of scaling up present initiatives and developing new mechanisms, as appropriate;",
    "41": "Underscores the importance of support by Africa\u2019s partners, in particular developed countries, of efforts by African countries to strengthen domestic resource mobilization, including through capacity-building and strengthening of international cooperation to combat illicit financial flows and enhance asset recovery and return;",
    "42": "Reiterates the commitment to redouble efforts to substantially reduce illicit financial flows by 2030, with a view to eventually eliminating them, including by combating tax evasion and corruption through strengthened national regulation and increased international cooperation, in line with the Addis Ababa Action Agenda, and the strengthening of international cooperation to combat illicit financial flows;",
    "43": "Recognizes the need for Africa\u2019s development partners to align their efforts in infrastructure investment towards supporting the Programme for Infrastructure Development in Africa, and notes in this regard the convening in Dakar on 14 and 15 June 2014 of the Financing Summit for Africa\u2019s Infrastructure, which adopted the Dakar Agenda for Action to mobilize investment towards infrastructure development projects, and calls upon development partners to support the implementation of the Dakar Agenda;",
    "44": "Urges continued support of measures to address the challenges of poverty eradication, hunger and malnutrition, job creation and sustainable development in Africa, including, as appropriate, debt relief, improved market access, support for the private sector and entrepreneurship, fulfilment of commitments on official development assistance and increased flows of foreign direct investment, and transfer of technology on mutually agreed terms;",
    "45": "Recognizes the need for Africa\u2019s development partners to align their efforts to implement the commitments contained in the Declaration on Nutrition Security for Inclusive Economic Growth and Sustainable Development in Africa, towards supporting the Comprehensive Africa Agriculture Development Programme and the implementation of its national and regional investment plans of the Programme for alignment of external funding, and takes note of the Declaration of the World Summit on Food Security;14 __________________ 13 Resolution 64/222, annex. 14 Food and Agriculture Organization of the United Nations, document WSFS 2009/2. A/RES/72/310 New Partnership for Africa\u2019s Development: progress in implementation and international support 18-15053 10/11",
    "46": "Expresses deep concern about the continuing negative effects of desertification, land degradation and drought on the African continent and underlines the need for short-, medium- and long-term measures, and in this regard calls for the continued effective implementation of the United Nations Convention to Combat Desertification in Those Countries Experiencing Serious Drought and/or Desertification, Particularly in Africa,15 including its 2018\u20132030 Strategic Framework;16",
    "47": "Recognizes that Africa is one of the regions that contribute the least to climate change, yet is extremely vulnerable and exposed to the adverse impacts of climate change, and in this regard calls upon the international community, including developed countries, to continue to support Africa to address its adaptation needs through, inter alia, the development, transfer and deployment of technology on mutually agreed terms, capacity-building and the provision of adequate and predictable resources, in line with existing commitments, and highlights the need for full implementation of the agreed outcomes of the United Nations Framework Convention on Climate Change,2 including the Paris Agreement;1",
    "48": "Reiterates the need to support developing countries in strengthening the capacity of national statistical offices and data systems to ensure access to high- quality, timely, reliable and disaggregated data;",
    "49": "Stresses that the prevention, management and resolution of conflict and post-conflict consolidation are essential for the achievement of the objectives of the New Partnership, and welcomes in this regard the cooperation and support granted by the United Nations and development partners to the African regional and subregional organizations in the implementation of the New Partnership;",
    "50": "Welcomes the continued efforts of the United Nations Peacebuilding Commission in assisting post-conflict countries in Africa, particularly the six African countries for which the Commission has established country-specific configurations;",
    "51": "Requests the United Nations system to continue to provide assistance to the Planning and Coordinating Agency of the New Partnership and to African countries in developing projects and programmes within the scope of the priorities of the New Partnership and to place greater emphasis on monitoring, evaluation and dissemination of the effectiveness of its activities in support of the New Partnership;",
    "52": "Emphasizes African ownership of the African Peer Review Mechanism process, and invites the international community to support the efforts of African countries, at their request, in implementing their respective national programmes of action arising from the process;",
    "53": "Requests the Secretary-General to promote greater coherence in the work of the United Nations system in support of the New Partnership, on the basis of the agreed clusters of the Regional Coordination Mechanism for Africa, and in this regard calls upon the United Nations system to continue to mainstream the special needs of Africa in all its normative and operational activities;",
    "54": "Recalls the establishment of the United Nations monitoring mechanism to review commitments made relating to Africa\u2019s development, and invites Member States and all relevant entities of the United Nations system, including funds, programmes, specialized agencies and regional commissions, in particular the Economic Commission for Africa, and all relevant international and regional organizations, to continue to contribute to the effectiveness and reliability of the review process by cooperating in the collection of data and the evaluation of performance; __________________ 15 United Nations, Treaty Series, vol. 1954, No. 33480. 16 ICCD/COP(13)/21/Add.1, decision 7/COP.13, annex. New Partnership for Africa\u2019s Development: progress in implementation and international support A/RES/72/310 11/11 18-15053",
    "55": "Requests the Secretary-General to submit a comprehensive report on the implementation of the present resolution to the General Assembly on an annual basis on the provision of inputs from Governments, organizations of the United Nations system and other stakeholders in the New Partnership. 113th plenary meeting 10 September 2018"
  },
  "agenda_items": [
    "Item 66"
  ],
  "symbol_references": [
    "A/72/L.57"
  ]
}