{
  "symbol": "A/RES/78/302",
  "filename": "A_RES_78_302.pdf",
  "title": "78/302.  Financing of the United Nations Interim Administration Mission in Kosovo",
  "text": "United Nations \nA/RES/78/302\n \n \nGeneral Assembly \nDistr.: General \n3 July 2024 \n \n24-12151 (E)     \n*2412151* \n \n \nSeventy-eighth session \nAgenda item 153 \nFinancing of the United Nations Interim Administration \nMission in Kosovo \n \n \n \n \n Resolution adopted by the General Assembly on \n28 June 2024 \n \n \n \n \n[on the report of the Fifth Committee (A/78/926, para. 6)] \n \n \n 78/302.  Financing of the United Nations Interim Administration Mission \nin Kosovo \n \n \n \nThe General Assembly, \n \nHaving considered the reports of the Secretary-General on the financing of the \nUnited Nations Interim Administration Mission in Kosovo 1 and the related report of \nthe Advisory Committee on Administrative and Budgetary Questions, 2 \n \nRecalling Security Council resolution 1244 (1999) of 10 June 1999 regarding \nthe establishment of the United Nations Interim Administration Mission in Kosovo,  \n \nRecalling also its resolution 53/241 of 28 July 1999 on the financing of the \nMission and its subsequent resolutions thereon, the latest of which was resolution \n77/311 of 30 June 2023, \n \nAcknowledging the complexity of the Mission,  \n \nReaffirming the general principles underlying the financing of United Nations \npeacekeeping operations, as stated in its resolutions 1874 (S-IV) of 27 June 1963, \n3101 (XXVIII) of 11 December 1973 and 55/235 of 23 December 2000,  \n \nMindful of the fact that it is essential to provide the Mission with the financial \nresources necessary to enable it to fulfil its responsibilities under the relevant \nresolutions of the Security Council, \n \nMindful also of the need to ensure coordination and cooperation with the \nEuropean Union Rule of Law Mission in Kosovo,  \n__________________ \n \n1  A/78/581 and A/78/721. \n \n2  A/78/744/Add.7. \n\nA/RES/78/302 \nFinancing of the United Nations Interim Administration \nMission in Kosovo\n \n24-12151\n2/4 \n \n \n1. \nRequests the Secretary-General to entrust the Head of Mission with the \ntask of formulating future budget proposals in full accordance with the provisions of \nits resolutions 59/296 of 22 June 2005, 60/266 of 30 June 2006, 61/276 of 29 June \n2007, 64/269 of 24 June 2010, 65/289 of 30 June 2011, 66/264 of 21 June 2012, \n69/307 of 25 June 2015, 70/286 of 17 June 2016 and 76/274 of 29 June 2022, as well \nas other relevant resolutions;  \n \n2. \nTakes note of the status of contributions to the United Nations Interim \nAdministration Mission in Kosovo as at 30 April 2024, including the contributions \noutstanding in the amount of 36.1 million United States dollars, representing some \n1 per cent of the total assessed contributions, notes with concern that only 118 \nMember States have paid their assessed contributions in full, and urges all other \nMember States, in particular those in arrears, to ensure payment of their outstanding \nassessed contributions;  \n \n3. \nExpresses its appreciation to those Member States that have paid their \nassessed contributions in full, and urges all other Member States to make every \npossible effort to ensure payment of their assessed contributions to the Mission in \nfull;  \n \n4. \nExpresses concern at the financial situation with regard to peacekeeping \nactivities, in particular as regards the reimbursements to troop contributors that bear \nadditional burdens owing to overdue payments by Member States of their \nassessments;  \n \n5. \nEmphasizes that all future and existing peacekeeping missions shall be \ngiven equal and non-discriminatory treatment in respect of financial and \nadministrative arrangements;  \n \n6. \nAlso emphasizes that all peacekeeping missions shall be provided with \nadequate resources for the effective and efficient discharge of their respective \nmandates;  \n \n7. \nRequests the Secretary-General to ensure that proposed peacekeeping \nbudgets are based on the relevant legislative mandates;  \n \n8. \nEndorses the conclusions and recommendations contained in the report of \nthe Advisory Committee on Administrative and Budgetary Questions, subject to the \nprovisions of the present resolution, and requests the Secretary-General to ensure \ntheir full implementation; \n \n9. \nDecides to reclassify the post of Civil Affairs Officer in the Office of \nCommunity Support and Facilitation in Pristina from the P-4 to the P-5 level;  \n \n10. Requests the Secretary-General to ensure the full implementation of the \nrelevant provisions of its resolutions 59/296, 60/266, 61/276, 64/269, 65/289, 66/264, \n69/307, 70/286 and 76/274;  \n \n11. \nAlso requests the Secretary-General to take all action necessary to ensure \nthat the Mission is administered with a maximum of efficiency and economy;  \n \n \n \nBudget performance report for the period from 1 July 2022 to 30 June 2023 \n \n \n12. Takes note of the report of the Secretary-General on the budget \nperformance of the Mission for the period from 1 July 2022 to 30 June 2023; 3 \n \n__________________ \n \n3  A/78/581. \n\nFinancing of the United Nations Interim Administration \nMission in Kosovo \nA/RES/78/302\n \n3/4\n24-12151 \n \n \n \nBudget estimates for the period from 1 July 2024 to 30 June 2025 \n \n \n13. Decides to appropriate to the special account for the United Nations \nInterim Administration Mission in Kosovo the amount of 47,413,200 dollars for the \nperiod from 1 July 2024 to 30 June 2025, inclusive of 43,684,700 dollars for the \nmaintenance of the Mission, 3,174,400 dollars for the support account for \npeacekeeping operations and 554,100 dollars for the United Nations Logistics Base \nat Brindisi, Italy;  \n \n \n \nFinancing of the appropriation for the period from 1 July 2024 to 30 June 2025 \n \n \n14. Decides to apportion among Member States the amount of 23,706,600 \ndollars for the period from 1 July to 31 December 2024, in accordance with the levels \nupdated in its resolution 76/239 of 24 December 2021, taking into account the scale \nof assessments for 2024, as set out in its resolution 76/238 of 24 December 2021; \n \n15. Also decides that, in accordance with the provisions of its resolution 973 (X) \nof 15 December 1955, there shall be set off against the apportionment among Member \nStates, as provided for in paragraph 14 above, their respective share in the Tax \nEqualization Fund of 2,307,600 dollars, comprising the estimated staff assessment \nincome of 2,152,900 dollars approved for the Mission, the prorated share of 129,400 \ndollars of the estimated staff assessment income approved for the support account and \nthe prorated share of 25,300 dollars of the estimated staff assessment income \napproved for the United Nations Logistics Base; \n \n16. Further decides to apportion among Member States the amount of \n23,706,600 dollars for the period from 1 January to 30 June 2025, in accordance with \nthe scale of assessments for 2025 and the updated levels;4 \n \n17. Decides that, in accordance with the provisions of its resolution 973 (X), \nthere shall be set off against the apportionment among Member States, as provided \nfor in paragraph 16 above, their respective share in the Tax Equalization Fund of \n2,307,500 dollars, comprising the estimated staff assessment income of 2,152,900 \ndollars approved for the Mission, the prorated share of 129,400 dollars of the \nestimated staff assessment income approved for the support account and the prorated \nshare of 25,200 dollars of the estimated staff assessment income approved for the \nUnited Nations Logistics Base; \n \n18. Also decides that, for Member States that have fulfilled their financial \nobligations to the Mission, there shall be set off against the apportionment, as \nprovided for in paragraphs 14 and 16 above, their respective share of the \nunencumbered balance and other revenue in the amount of 1,446,900 dollars in \nrespect of the financial period ended 30 June 2023, in accordance with the levels \nupdated in its resolution 76/239, taking into account the scale of assessments for 2023, \nas set out in its resolution 76/238; \n \n19. Further decides that, for Member States that have not fulfilled their \nfinancial obligations to the Mission, there shall be set off against their outstanding \nobligations their respective share of the unencumbered balance and other revenue in \nthe amount of 1,446,900 dollars in respect of the financial period ended 30 June 2023, \nin accordance with the scheme set out in paragraph 18 above;  \n \n20. Decides that the decrease of 86,400 dollars in the estimated staff \nassessment income in respect of the financial period ended 30 June 2023 shall be set \noff against the credits in the amount of 1,446,900 dollars referred to in paragraphs 18 \nand 19 above;  \n__________________ \n \n4  To be adopted by the General Assembly. \n\nA/RES/78/302 \nFinancing of the United Nations Interim Administration \nMission in Kosovo\n \n24-12151\n4/4 \n \n \n21. Encourages the Secretary-General to continue to take additional measures \nto ensure the safety and security of all personnel participating in the Mission under \nthe auspices of the United Nations, bearing in mind paragraphs 5 and 6 of Security \nCouncil resolution 1502 (2003) of 26 August 2003;  \n \n22. Invites voluntary contributions to the Mission in cash and in the form of \nservices and supplies acceptable to the Secretary-General, to be administered, as \nappropriate, in accordance with the procedure and practices established by the \nGeneral Assembly;  \n \n23. Decides to include in the provisional agenda of its seventy-ninth session \nthe item entitled \u201cFinancing of the United Nations Interim Administration Mission in \nKosovo\u201d.  \n \n95th plenary meeting \n28 June 2024 \n \n",
  "paragraphs": {
    "1": "Requests the Secretary-General to entrust the Head of Mission with the task of formulating future budget proposals in full accordance with the provisions of its resolutions 59/296 of 22 June 2005, 60/266 of 30 June 2006, 61/276 of 29 June 2007, 64/269 of 24 June 2010, 65/289 of 30 June 2011, 66/264 of 21 June 2012, 69/307 of 25 June 2015, 70/286 of 17 June 2016 and 76/274 of 29 June 2022, as well as other relevant resolutions;",
    "2": "Takes note of the status of contributions to the United Nations Interim Administration Mission in Kosovo as at 30 April 2024, including the contributions outstanding in the amount of 36.1 million United States dollars, representing some 1 per cent of the total assessed contributions, notes with concern that only 118 Member States have paid their assessed contributions in full, and urges all other Member States, in particular those in arrears, to ensure payment of their outstanding assessed contributions;",
    "3": "Expresses its appreciation to those Member States that have paid their assessed contributions in full, and urges all other Member States to make every possible effort to ensure payment of their assessed contributions to the Mission in full;",
    "4": "Expresses concern at the financial situation with regard to peacekeeping activities, in particular as regards the reimbursements to troop contributors that bear additional burdens owing to overdue payments by Member States of their assessments;",
    "5": "Emphasizes that all future and existing peacekeeping missions shall be given equal and non-discriminatory treatment in respect of financial and administrative arrangements;",
    "6": "Also emphasizes that all peacekeeping missions shall be provided with adequate resources for the effective and efficient discharge of their respective mandates;",
    "7": "Requests the Secretary-General to ensure that proposed peacekeeping budgets are based on the relevant legislative mandates;",
    "8": "Endorses the conclusions and recommendations contained in the report of the Advisory Committee on Administrative and Budgetary Questions, subject to the provisions of the present resolution, and requests the Secretary-General to ensure their full implementation;",
    "9": "Decides to reclassify the post of Civil Affairs Officer in the Office of Community Support and Facilitation in Pristina from the P-4 to the P-5 level;",
    "10": "Requests the Secretary-General to ensure the full implementation of the relevant provisions of its resolutions 59/296, 60/266, 61/276, 64/269, 65/289, 66/264, 69/307, 70/286 and 76/274;",
    "11": "Also requests the Secretary-General to take all action necessary to ensure that the Mission is administered with a maximum of efficiency and economy; Budget performance report for the period from 1 July 2022 to 30 June 2023",
    "12": "Takes note of the report of the Secretary-General on the budget performance of the Mission for the period from 1 July 2022 to 30 June 2023; 3 Budget estimates for the period from 1 July 2024 to 30 June 2025",
    "13": "Decides to appropriate to the special account for the United Nations Interim Administration Mission in Kosovo the amount of 47,413,200 dollars for the period from 1 July 2024 to 30 June 2025, inclusive of 43,684,700 dollars for the maintenance of the Mission, 3,174,400 dollars for the support account for peacekeeping operations and 554,100 dollars for the United Nations Logistics Base at Brindisi, Italy; Financing of the appropriation for the period from 1 July 2024 to 30 June 2025",
    "14": "Decides to apportion among Member States the amount of 23,706,600 dollars for the period from 1 July to 31 December 2024, in accordance with the levels updated in its resolution 76/239 of 24 December 2021, taking into account the scale of assessments for 2024, as set out in its resolution 76/238 of 24 December 2021;",
    "15": "Also decides that, in accordance with the provisions of its resolution 973 (X) of 15 December 1955, there shall be set off against the apportionment among Member States, as provided for in paragraph 14 above, their respective share in the Tax Equalization Fund of 2,307,600 dollars, comprising the estimated staff assessment income of 2,152,900 dollars approved for the Mission, the prorated share of 129,400 dollars of the estimated staff assessment income approved for the support account and the prorated share of 25,300 dollars of the estimated staff assessment income approved for the United Nations Logistics Base;",
    "16": "Further decides to apportion among Member States the amount of 23,706,600 dollars for the period from 1 January to 30 June 2025, in accordance with the scale of assessments for 2025 and the updated levels;4",
    "17": "Decides that, in accordance with the provisions of its resolution 973 (X), there shall be set off against the apportionment among Member States, as provided for in paragraph 16 above, their respective share in the Tax Equalization Fund of 2,307,500 dollars, comprising the estimated staff assessment income of 2,152,900 dollars approved for the Mission, the prorated share of 129,400 dollars of the estimated staff assessment income approved for the support account and the prorated share of 25,200 dollars of the estimated staff assessment income approved for the United Nations Logistics Base;",
    "18": "Also decides that, for Member States that have fulfilled their financial obligations to the Mission, there shall be set off against the apportionment, as provided for in paragraphs 14 and 16 above, their respective share of the unencumbered balance and other revenue in the amount of 1,446,900 dollars in respect of the financial period ended 30 June 2023, in accordance with the levels updated in its resolution 76/239, taking into account the scale of assessments for 2023, as set out in its resolution 76/238;",
    "19": "Further decides that, for Member States that have not fulfilled their financial obligations to the Mission, there shall be set off against their outstanding obligations their respective share of the unencumbered balance and other revenue in the amount of 1,446,900 dollars in respect of the financial period ended 30 June 2023, in accordance with the scheme set out in paragraph 18 above;",
    "20": "Decides that the decrease of 86,400 dollars in the estimated staff assessment income in respect of the financial period ended 30 June 2023 shall be set off against the credits in the amount of 1,446,900 dollars referred to in paragraphs 18 and 19 above;",
    "21": "Encourages the Secretary-General to continue to take additional measures to ensure the safety and security of all personnel participating in the Mission under the auspices of the United Nations, bearing in mind paragraphs 5 and 6 of Security Council resolution 1502 (2003) of 26 August 2003;",
    "22": "Invites voluntary contributions to the Mission in cash and in the form of services and supplies acceptable to the Secretary-General, to be administered, as appropriate, in accordance with the procedure and practices established by the General Assembly;",
    "23": "Decides to include in the provisional agenda of its seventy-ninth session the item entitled \u201cFinancing of the United Nations Interim Administration Mission in Kosovo\u201d."
  },
  "agenda_items": [
    "Item 153"
  ],
  "symbol_references": []
}