{
  "symbol": "A/RES/80/62",
  "filename": "A_RES_80_62.pdf",
  "title": "80/62. United Nations Regional Centre for Peace and Disarmament in Asia and the Pacific",
  "text": "United Nations \nA/RES/80/62\n \nGeneral Assembly \nDistr.: General \n5 December 2025 \n25-19997 (E) \n*2519997* \n \n \nEightieth session \nAgenda item 100 (d) \nReview and implementation of the Concluding Document \nof the Twelfth Special Session of the General Assembly: \nUnited Nations Regional Centre for Peace and \nDisarmament in Asia and the Pacific \n \n \n \n \n Resolution adopted by the General Assembly \non 1 December 2025 \n \n \n[on the report of the First Committee (A/80/534, para. 7)] \n \n \n \n80/62. United Nations Regional Centre for Peace and Disarmament in \nAsia and the Pacific \n \n \n \nThe General Assembly, \n \nRecalling its resolutions 42/39 D of 30 November 1987 and 44/117 F of \n15 December 1989, by which it established the United Nations Regional Centre for \nPeace and Disarmament in Asia and renamed it the United Nations Regional Centre \nfor Peace and Disarmament in Asia and the Pacific, with headquarters in Kathmandu, \n \nRecalling also the mandate of the Regional Centre to provide, on request, \nsubstantive support for the initiatives and other activities mutually agreed upon by \nthe Member States of the Asia-Pacific region for the implementation of measures for \npeace and disarmament, through appropriate utilization of available resources, \n \nTaking note of the report of the Secretary-General, 1  and expressing its \nappreciation to the Regional Centre for its important work in promoting dialogue and \nconfidence-building measures through the organization of meetings, conferences and \nworkshops in the region, including the twenty-third United Nations-Republic of \nKorea Joint Conference on Disarmament and Non-Proliferation Issues and national \nand subregional workshops on awareness-raising and promoting the full and universal \nimplementation of the Convention on the Prohibition of the Development, Production \nand Stockpiling of Bacteriological (Biological) and Toxin Weapons and on Their \nDestruction2 and the Convention on the Prohibition of the Development, Production, \nStockpiling and Use of Chemical Weapons and on Their Destruction 3  and the \n_______________ \n \n1 A/80/129. \n \n2 United Nations, Treaty Series, vol. 1015, No. 14860. \n \n3 Ibid., vol. 1974, No. 33757. \n\nA/RES/80/62 \nUnited Nations Regional Centre for Peace \nand Disarmament in Asia and the Pacific\n \n25-19997\n2/3 \n \nimplementation of the Global Framework for Through-life Conventional Ammunition \nManagement, 4 as well as preparations for the open-ended working group on the \nprevention of an arms race in outer space in all its aspects,  \n \nExpressing its appreciation to the Regional Centre for its capacity-building \ntraining for States of Asia and the Pacific on fostering gender-responsive arms control, \nformulating national policies on small arms and light weapons control and promoting \nthe responsible innovation and application of new technologies, its activities under \nthe Saving Lives Entity initiative carried out jointly with the United Nations \nDevelopment Programme, its activities to promote transparency and confidence-\nbuilding measures among States in Asia and the Pacific, its initiatives to promote the \nvoices of young people in the region on issues related to disarmament, arms control \nand non\u2011proliferation and its activities to strengthen partnership with civil society \norganizations, universities and schools in the region on disarmament issues, the \nlinkages between gender and peace and disarmament, and the nexus between \ndisarmament and the 2030 Agenda for Sustainable Development, 5 \n \nExpressing appreciation for the timely execution by Nepal of its host country \ncommitments for the physical operation of the Regional Centre, \n \nWelcoming the work by the Regional Centre in support of the achievement of \nSustainable Development Goals 5 and 16, in particular target 5.2 to eliminate all \nforms of violence against all women and girls, target 5.5 to ensure women\u2019s full and \neffective participation and equal opportunities for leadership and target 16.4 to \nsignificantly reduce illicit financial and arms flows, \n \nWelcoming also the efforts by the Regional Centre to promote the role and \nrepresentation of women in disarmament, non\u2011proliferation and arms control \nactivities, \n \nWelcoming further the youth-focused outreach activities undertaken by the \nRegional Centre, \n \n1. \nExpresses its satisfaction at the activities carried out over the past year by \nthe United Nations Regional Centre for Peace and Disarmament in Asia and the \nPacific, and requests the Regional Centre to continue to take into account the \nproposals for activities submitted by the countries of the region for the \nimplementation of the mandate of the Centre in the areas of peace, disarmament and \ndevelopment; \n \n2. \nInvites all States of the region to continue to support the activities of the \nRegional Centre, including by continuing to take part in them, where possible, and by \nproposing items for inclusion in the programme of activities of the Centre, in order to \ncontribute to the implementation of measures for peace and disarmament; \n \n3. \nExpresses its gratitude to the Government of Nepal for its cooperation and \nfinancial support, which has enabled the Regional Centre to operate from Kathmandu; \n \n4. \nExpresses its appreciation to the Secretary-General and the Office for \nDisarmament Affairs of the Secretariat for providing the necessary support with a \nview to ensuring the smooth operation of the Regional Centre and to enabling the \nCentre to function effectively; \n \n5. \nAppeals to Member States, in particular those within the Asia-Pacific \nregion, as well as to international governmental and non\u2011governmental organizations \n_______________ \n \n4 A/78/111, annex. \n \n5 Resolution 70/1. \n\nUnited Nations Regional Centre for Peace \nand Disarmament in Asia and the Pacific \nA/RES/80/62\n \n3/3\n25-19997 \n \nand foundations, to make voluntary contributions, the only resources of the Regional \nCentre, to strengthen its programme of activities and the implementation thereof; \n \n6. \nReaffirms its strong support for the role of the Regional Centre in the \npromotion of activities of the United Nations at the regional level to strengthen peace, \nstability and security among its Member States; \n \n7. \nEncourages the Regional Centre to further explore new programmes and \nactivities on areas of international focus, such as new and emerging technologies, \nincluding outer space, information and communications technologies in the context \nof international peace and security and the military applications of artificial \nintelligence, in collaboration with Member States, United Nations entities and \ninternational and regional organizations; \n \n8. \nUnderlines the importance of the Kathmandu process for the development \nof the practice of region-wide security and disarmament dialogues; \n \n9. \nRequests the Secretary-General to report to the General Assembly at its \neighty-first session on the implementation of the present resolution; \n \n10. Decides to include in the provisional agenda of its eighty-first session, \nunder the item entitled \u201cReview and implementation of the Concluding Document of \nthe Twelfth Special Session of the General Assembly\u201d, the sub-item entitled \u201cUnited \nNations Regional Centre for Peace and Disarmament in Asia and the Pacific\u201d. \n \n52nd plenary meeting \n1 December 2025 \n \n",
  "paragraphs": {
    "1": "Expresses its satisfaction at the activities carried out over the past year by the United Nations Regional Centre for Peace and Disarmament in Asia and the Pacific, and requests the Regional Centre to continue to take into account the proposals for activities submitted by the countries of the region for the implementation of the mandate of the Centre in the areas of peace, disarmament and development;",
    "2": "Invites all States of the region to continue to support the activities of the Regional Centre, including by continuing to take part in them, where possible, and by proposing items for inclusion in the programme of activities of the Centre, in order to contribute to the implementation of measures for peace and disarmament;",
    "3": "Expresses its gratitude to the Government of Nepal for its cooperation and financial support, which has enabled the Regional Centre to operate from Kathmandu;",
    "4": "Expresses its appreciation to the Secretary-General and the Office for Disarmament Affairs of the Secretariat for providing the necessary support with a view to ensuring the smooth operation of the Regional Centre and to enabling the Centre to function effectively;",
    "5": "Appeals to Member States, in particular those within the Asia-Pacific region, as well as to international governmental and non\u2011governmental organizations _______________ 4 A/78/111, annex. 5 Resolution 70/1. United Nations Regional Centre for Peace and Disarmament in Asia and the Pacific A/RES/80/62 3/3 25-19997 and foundations, to make voluntary contributions, the only resources of the Regional Centre, to strengthen its programme of activities and the implementation thereof;",
    "6": "Reaffirms its strong support for the role of the Regional Centre in the promotion of activities of the United Nations at the regional level to strengthen peace, stability and security among its Member States;",
    "7": "Encourages the Regional Centre to further explore new programmes and activities on areas of international focus, such as new and emerging technologies, including outer space, information and communications technologies in the context of international peace and security and the military applications of artificial intelligence, in collaboration with Member States, United Nations entities and international and regional organizations;",
    "8": "Underlines the importance of the Kathmandu process for the development of the practice of region-wide security and disarmament dialogues;",
    "9": "Requests the Secretary-General to report to the General Assembly at its eighty-first session on the implementation of the present resolution;",
    "10": "Decides to include in the provisional agenda of its eighty-first session, under the item entitled \u201cReview and implementation of the Concluding Document of the Twelfth Special Session of the General Assembly\u201d, the sub-item entitled \u201cUnited Nations Regional Centre for Peace and Disarmament in Asia and the Pacific\u201d. 52nd plenary meeting 1 December 2025"
  },
  "agenda_items": [
    "Item 100"
  ],
  "symbol_references": []
}