{
  "symbol": "A/RES/75/155",
  "filename": "A_RES_75_155.pdf",
  "title": "75/155. Literacy for life: shaping future agendas",
  "text": "United Nations \nA/RES/75/155\n \n \nGeneral Assembly \nDistr.: General \n23 December 2020 \n \n \n20-17288 (E)    301220 \n*2017288* \n \n \nSeventy-fifth session \nAgenda item 27 (c) \nSocial development: literacy for life: shaping \nfuture agendas  \n \n \n \n \n Resolution adopted by the General Assembly \non 16 December 2020 \n \n \n \n \n[on the report of the Third Committee (A/75/470, para. 26)] \n \n \n 75/155. Literacy for life: shaping future agendas \n \n \n \nThe General Assembly, \n \nRecalling its resolution 56/116 of 19 December 2001, by which it proclaimed \nthe 10-year period beginning on 1 January 2003 the United Nations Literacy Decade, \nits resolution 57/166 of 18 December 2002, in which it welcomed the International \nPlan of Action for the United Nations Literacy Decade, 1 and its resolutions 59/149 of \n20 December 2004, 61/140 of 19 December 2006, 63/154 of 18 December 2008, \n65/183 of 21 December 2010, 68/132 of 18 December 2013, 69/141 of 18 December \n2014, 71/166 of 19 December 2016 and 73/145 of 17 December 2018,  \n \nRecalling also the 2030 Agenda for Sustainable Development,2 which includes \nSustainable Development Goal 4 on ensuring inclusive and equitable quality \neducation and promoting lifelong learning opportunities for all, with a specific target \non ensuring that all youth and a substantial proportion of adults, both men and women, \nachieve literacy and numeracy by 2030, \n \nConvinced that literacy is crucial to the acquisition by every child, young person \nand adult of the essential knowledge, skills and competencies that will enable them \nto address the challenges that they may face in life and represents an essential \ncondition of lifelong learning, which is an indispensable means for effective \nparticipation in the knowledge societies and economies of the twenty-first century, \nand to promote inclusive and equitable societies, \n \nReaffirming the right of indigenous peoples to have non-discriminatory access \nto all levels and forms of education provided by States, and recognizing the \nimportance of effective measures to promote access for indigenous individuals, in \n__________________ \n \n1  See A/57/218 and A/57/218/Corr.1. \n \n2  Resolution 70/1. \n\nA/RES/75/155 \nLiteracy for life: shaping future agendas\n \n20-17288\n2/4 \n \nparticular children, to education in their own language, whenever possible, as \naddressed in the United Nations Declaration on the Rights of Indigenous Peoples, 3 \n \nDeeply concerned that, according to the United Nations Educational, Scientific \nand Cultural Organization, prior to the coronavirus disease (COVID-19) pandemic, \n773 million adults, two thirds of them women, lacked basic literacy skills, that more \nthan 617 million children and adolescents were not achieving minimum proficiency \nlevels in reading and mathematics and that 258 million children, adolescents and \nyouth worldwide (or 1 in 5) were out of school \u2013 a figure that has barely changed over \nthe past seven years,4  \n \nRecognizing that literacy is crucial in a lifelong learning perspective as a \ncontinuum of different proficiency levels that are developed throughout life and \nacross different life contexts, \n \nRecognizing also that substantial and efficiently spent investments are needed \nto improve the quality of education in order to enable millions of people to acquire \nliteracy skills for decent work, \n \nRecognizing further that literacy is a foundation for lifelong learning, a building \nblock for achieving human rights and fundamental freedoms and a driver of \nsustainable development, and that the United Nations Literacy Decade (2003\u20132012) \nhad a catalytic effect as a global framework for sustained and focused efforts for the \npromotion of literacy and literate environments, \n \nRecalling the International Conference on Girls\u2019 and Women\u2019s Literacy and \nEducation: Foundations for Sustainable Development, held in Dhaka and co-hosted \nby the Government of Bangladesh and the United Nations Educational, Scientific and \nCultural Organization, in support of the Global Education First Initiative and on the \noccasion of International Literacy Day, on 8 September 2014, and taking note with \nappreciation of the adoption of the Dhaka Declaration, \n \nAffirming that the realization of the right to education, especially for girls, \ncontributes to the promotion of human rights, gender equality, the empowerment of \nwomen and the eradication of poverty, as well as to development, \n \nRecognizing the importance of continuing to implement national and \nsubnational programmes and measures to eliminate illiteracy worldwide as reflected \nin the Dakar Framework for Action, adopted on 28 April 2000 at the World Education \nForum,5 consistent with Sustainable Development Goal 4, and in this regard \nrecognizing also the important contribution of North-South, South-South and \ntriangular cooperation through, inter alia, innovative pedagogical methods in literacy, \n \nDeeply concerned about the persistence of the gender gap in education, which \nis reflected by the fact that, according to the United Nations Educational, Scientific \nand Cultural Organization, nearly two thirds of the world\u2019s non-literate adults are \nwomen, \n \nConcerned that, according to the United Nations Educational, Scientific and \nCultural Organization, one third of the children not attending school are children with \ndisabilities and that the literacy rate among adults with disabilities is as low as 3 per \ncent in some countries, \n__________________ \n \n3  Resolution 61/295, annex. \n \n4  See A/75/188. \n \n5  See United Nations Educational, Scientific and Cultural Organization, Final Report of the World \nEducation Forum, Dakar, Senegal, 26\u201328 April 2000 (Paris, 2000).  \n\nLiteracy for life: shaping future agendas \nA/RES/75/155\n \n3/4\n20-17288 \n \n \nDeeply concerned about the impact of disrupted educational services in \nhumanitarian emergencies on efforts to promote literacy skills, especially for all \nchildren and young people, \n \n1. \nTakes note with appreciation of the report of the Secretary-General entitled \n\u201cLiteracy for life, work, lifelong learning and education for democracy\u201d; 6  \n \n2. \nCommends the efforts made by Member States, their development \npartners, the international donor community, the private sector, civil society and the \nspecialized agencies and other organizations of the United Nations system, including \nthe lead organization of the United Nations Literacy Decade, the United Nations \nEducational, Scientific and Cultural Organization, in promoting enjoyment of the \nright to education, including by making progress on the five strategic axes of action \nfor the period following the Decade; \n \n3. \nCalls upon Governments at all levels, as appropriate, to scale up literacy \nprogrammes for all boys and girls, youth and adults, including older persons, with \nparticular attention to those who are vulnerable or marginalized, to foster inclusive \nand innovative delivery of literacy services, including through technology and a \nstrengthened institutional network, to promote an intersectoral approach by linking \nliteracy learning with multiple sectors to address diverse learning needs, such as \nthrough relevant and inclusive educational resources in different languages, to \nestablish multi-stakeholder partnerships with the active participation of civil society \nand the private sector, to encourage the integration of literacy learning into vocational \neducation and training, to mobilize resources to strengthen literacy measurements and \nstatistics, and to invest in education management information systems and data \nmanagement capacities according to every State\u2019s financial and human capabilities; \n \n4. \nEncourages Member States, United Nations organizations, multilateral \nand bilateral donors, regional organizations, civil society, academia and the private \nsector to sustain their collective efforts for the promotion of literacy and literate \nenvironments and to contribute to the implementation of the Strategies (2020\u20132025) \nof the Global Alliance for Literacy within the Framework of Lifelong Learning for \nsynergistic action at the global, regional, national and community levels; \n \n5.  \nTakes note of the adoption by the United Nations Educational, Scientific \nand Cultural Organization of its new Strategy for Youth and Adult Literacy (2020\u2013\n2025) and its action plan; \n \n6. \nUrges international development partners and Governments to cooperate \nin order to strive to ensure that sufficient and sustainable funds continue to be \nmobilized, including during the COVID-19 pandemic, by and channelled through \nexisting international financing mechanisms for education and that they also \nexplicitly target and benefit youth and adult literacy; \n \n7. \nCalls upon States, and invites other relevant stakeholders, to implement \nthe 2030 Agenda for Sustainable Development, including all literacy-related \nSustainable Development Goals and targets; \n \n8. \nInvites the United Nations Educational, Scientific and Cultural \nOrganization, as the specialized United Nations agency for education, to continue its \nmandated role to lead and coordinate the Education 2030 agenda, in particular through \nthe Sustainable Development Goal Education 2030 Steering Committee, as an \ninclusive global multi-stakeholder consultation and coordination mechanism for \neducation in the 2030 Agenda in accordance with the 2030 Agenda follow-up and \nreview process; \n__________________ \n \n6  A/75/188. \n\nA/RES/75/155 \nLiteracy for life: shaping future agendas\n \n20-17288\n4/4 \n \n \n9. \nRequests the United Nations Educational, Scientific and Cultural \nOrganization to continue its coordinating and catalysing role through the \nimplementation of the strategy of the Global Alliance for Literacy and by continuing \nto provide support to Member States, in collaboration with partners, in enhancing \ncapacities for policy formulation, programme implementation, monitoring and \nevaluation, as well as sharing information and knowledge on policies, programmes \nand progress in the achievement of the Sustainable Development Goal targets \nconnected with literacy, especially target 4.1 on reading skills in primary and lower \nsecondary school (including in indigenous languages) and target 4.6 on youth and \nadult literacy, and creating synergies of action between the Alliance and other \ninitiatives, including its Global Partnership for Girls\u2019 and Women\u2019s Education and \nGlobal Network of Learning Cities; \n \n10. Encourages efforts to provide quality education in safe learning \nenvironments for all, especially for boys, girls and youth, in humanitarian \nemergencies to contribute to a smooth transition from relief to development; \n \n11. \nRequests the Secretary-General, in cooperation with the Director General \nof the United Nations Educational, Scientific and Cultural Organization, to submit to \nthe General Assembly at its seventy-seventh session a report on the implementation \nof the present resolution; \n \n12. Decides to include in the provisional agenda of its seventy-seventh \nsession, under the item entitled \u201cSocial development\u201d, the sub-item entitled \u201cLiteracy \nfor life: shaping future agendas\u201d. \n \n46th plenary meeting \n16 December 2020 \n \n \n",
  "paragraphs": {
    "1": "Takes note with appreciation of the report of the Secretary-General entitled \u201cLiteracy for life, work, lifelong learning and education for democracy\u201d; 6",
    "2": "Commends the efforts made by Member States, their development partners, the international donor community, the private sector, civil society and the specialized agencies and other organizations of the United Nations system, including the lead organization of the United Nations Literacy Decade, the United Nations Educational, Scientific and Cultural Organization, in promoting enjoyment of the right to education, including by making progress on the five strategic axes of action for the period following the Decade;",
    "3": "Calls upon Governments at all levels, as appropriate, to scale up literacy programmes for all boys and girls, youth and adults, including older persons, with particular attention to those who are vulnerable or marginalized, to foster inclusive and innovative delivery of literacy services, including through technology and a strengthened institutional network, to promote an intersectoral approach by linking literacy learning with multiple sectors to address diverse learning needs, such as through relevant and inclusive educational resources in different languages, to establish multi-stakeholder partnerships with the active participation of civil society and the private sector, to encourage the integration of literacy learning into vocational education and training, to mobilize resources to strengthen literacy measurements and statistics, and to invest in education management information systems and data management capacities according to every State\u2019s financial and human capabilities;",
    "4": "Encourages Member States, United Nations organizations, multilateral and bilateral donors, regional organizations, civil society, academia and the private sector to sustain their collective efforts for the promotion of literacy and literate environments and to contribute to the implementation of the Strategies (2020\u20132025) of the Global Alliance for Literacy within the Framework of Lifelong Learning for synergistic action at the global, regional, national and community levels;",
    "5": "Takes note of the adoption by the United Nations Educational, Scientific and Cultural Organization of its new Strategy for Youth and Adult Literacy (2020\u2013 2025) and its action plan;",
    "6": "Urges international development partners and Governments to cooperate in order to strive to ensure that sufficient and sustainable funds continue to be mobilized, including during the COVID-19 pandemic, by and channelled through existing international financing mechanisms for education and that they also explicitly target and benefit youth and adult literacy;",
    "7": "Calls upon States, and invites other relevant stakeholders, to implement the 2030 Agenda for Sustainable Development, including all literacy-related Sustainable Development Goals and targets;",
    "8": "Invites the United Nations Educational, Scientific and Cultural Organization, as the specialized United Nations agency for education, to continue its mandated role to lead and coordinate the Education 2030 agenda, in particular through the Sustainable Development Goal Education 2030 Steering Committee, as an inclusive global multi-stakeholder consultation and coordination mechanism for education in the 2030 Agenda in accordance with the 2030 Agenda follow-up and review process;",
    "9": "Requests the United Nations Educational, Scientific and Cultural Organization to continue its coordinating and catalysing role through the implementation of the strategy of the Global Alliance for Literacy and by continuing to provide support to Member States, in collaboration with partners, in enhancing capacities for policy formulation, programme implementation, monitoring and evaluation, as well as sharing information and knowledge on policies, programmes and progress in the achievement of the Sustainable Development Goal targets connected with literacy, especially target 4.1 on reading skills in primary and lower secondary school (including in indigenous languages) and target 4.6 on youth and adult literacy, and creating synergies of action between the Alliance and other initiatives, including its Global Partnership for Girls\u2019 and Women\u2019s Education and Global Network of Learning Cities;",
    "10": "Encourages efforts to provide quality education in safe learning environments for all, especially for boys, girls and youth, in humanitarian emergencies to contribute to a smooth transition from relief to development;",
    "11": "Requests the Secretary-General, in cooperation with the Director General of the United Nations Educational, Scientific and Cultural Organization, to submit to the General Assembly at its seventy-seventh session a report on the implementation of the present resolution;",
    "12": "Decides to include in the provisional agenda of its seventy-seventh session, under the item entitled \u201cSocial development\u201d, the sub-item entitled \u201cLiteracy for life: shaping future agendas\u201d."
  },
  "agenda_items": [
    "Item 27"
  ],
  "symbol_references": []
}