{
  "symbol": "A/RES/78/272",
  "filename": "A_RES_78_272.pdf",
  "title": "78/272. Agreement under the United Nations Convention on the Law of the Sea on the Conservation and Sustainable Use of Marine Biological Diversity of Areas beyond National Jurisdiction",
  "text": "United Nations \nA/RES/78/272\n \n \nGeneral Assembly \nDistr.: General \n29 April 2024 \n \n24-07683 (E)    020524    \n*2407683* \n \n \nSeventy-eighth session \nAgenda item 75 (c) \nOceans and the law of the sea: Agreement under the \nUnited Nations Convention on the Law of the Sea on the \nConservation and Sustainable Use of Marine Biological \nDiversity of Areas beyond National Jurisdiction \n \n \n \n \n Resolution adopted by the General Assembly \non 24 April 2024 \n \n \n \n \n[without reference to a Main Committee (A/78/L.41)] \n \n \n 78/272. Agreement under the United Nations Convention on the Law of \nthe Sea on the Conservation and Sustainable Use of Marine \nBiological Diversity of Areas beyond National Jurisdiction \n \n \n \nThe General Assembly, \n \nRecalling its resolution 72/249 of 24 December 2017, in which it decided to \nconvene an intergovernmental conference, under the auspices of the United Nations, \nto consider the recommendations of the Preparatory Committee established by \nresolution 69/292 of 19 June 2015 on the elements and to elaborate the text of an \ninternational legally binding instrument under the United Nations Convention on the \nLaw of the Sea1 on the conservation and sustainable use of marine biological diversity \nof areas beyond national jurisdiction, with a view to developing the instrument as \nsoon as possible, and relevant resolutions and decisions relating to the convening of \nthe fourth and fifth sessions of the conference, the resumed fifth session of the \nconference and the further resumed fifth session of the conference, 2 \n \nRecalling also the adoption by the conference, on 19 June 2023, of the \nAgreement under the United Nations Convention on the Law of the Sea on the \nConservation and Sustainable Use of Marine Biological Diversity of Areas beyond \nNational Jurisdiction,3 by consensus,  \n \nRecalling further that, pursuant to article 47, paragraph 2, of the Agreement, the \nfirst meeting of the Conference of the Parties established under article 47, \n__________________ \n \n1 United Nations, Treaty Series, vol. 1833, No. 31363. \n \n2 Resolutions 75/239 and 77/248 and decisions 74/543, 75/570, 76/564 and 77/556. \n \n3 A/CONF.232/2023/4. \n\nA/RES/78/272 \nAgreement under the United Nations Convention on the Law of the \nSea on the Conservation and Sustainable Use of Marine Biological \nDiversity of Areas beyond National Jurisdiction\n \n24-07683\n2/4 \n \nparagraph 1, of the Agreement shall be convened by the Secretary-General of the \nUnited Nations no later than one year after the entry into force of the Agreement, \n \nNoting that, in a letter dated 30 June 2023 addressed to the President of the \nGeneral Assembly, the President of the conference drew attention to the desire \nexpressed by several delegations that efforts be undertaken with a view to supporting \nthe early entry into force of the Agreement as well as its early implementation, \nincluding through a preparatory process such as a preparatory commission, and the \nPresident also observed that a preparatory process, to be established under the \nauspices of the Assembly, to carry out the required preparations for the first meeting \nof the Conference of the Parties to the Agreement and to provide guidance on the \nwork of the interim secretariat under the Agreement until the convening of that \nmeeting would be very helpful,4 \n \nRecalling its resolution 77/321 of 1 August 2023 on the Agreement, \n \nNoting that the Agreement was opened for signature in New York at United \nNations Headquarters on 20 September 2023,  \n \nNoting also the number of signatories that the Agreement has to date,  \n \nRecognizing the need to prepare for the entry into force of the Agreement and \nfor the convening of the first meeting of the Conference of the Parties to the \nAgreement, \n \n1. \nWelcomes the opening for signature of the Agreement under the United \nNations Convention on the Law of the Sea on the Conservation and Sustainable Use \nof Marine Biological Diversity of Areas beyond National Jurisdiction;  \n \n2. \nEmphasizes the importance of the early entry into force and effective \nimplementation of the Agreement; \n \n3. \nDecides to establish a preparatory commission, which shall meet at United \nNations Headquarters unless otherwise decided, on dates to be determined, to prepare \nfor the entry into force of the Agreement and to prepare for the convening of the first \nmeeting of the Conference of the Parties to the Agreement, at the conclusion of which \nthe commission will cease to exist; \n \n4. \nAlso decides that the commission shall be open to all States Members of \nthe United Nations, members of the specialized agencies and parties to the United \nNations Convention on the Law of the Sea;  \n \n5. \nFurther decides to invite to the commission representatives of \norganizations and other entities that have received a standing invitation from the \nGeneral Assembly pursuant to its relevant resolutions to participate, in the capacity \nof observer, in its sessions and work, on the understanding that such representatives \nwould participate in the work of the commission in that capacity, and to invite, as \nobservers to the commission, representatives of interested global and regional \nintergovernmental organizations and other interested international bodies that were \ninvited to participate in relevant conferences and summits, 5 associate members of the \n__________________ \n \n4 See A/77/945. \n \n5 Reference is made to the following relevant conferences and summits: the World Summit on \nSustainable Development, the United Nations Conference on Sustainable Development, the \nUnited Nations conferences on the sustainable development of small island developing States, \nthe United Nations Conference on Straddling Fish Stocks and Highly Migratory Fish Stocks, the \nReview Conference on the Agreement for the Implementation of the Provisions of the United \nNations Convention on the Law of the Sea of 10 December 1982 relating to the Conservation and \nManagement of Straddling Fish Stocks and Highly Migratory Fish Stocks, as well as the United \nNations Conferences to Support the Implementation of Sustainable Development Goal 14: \nConserve and sustainably use the oceans, seas and marine resources for sustainable development.  \n\nAgreement under the United Nations Convention on the Law of the \nSea on the Conservation and Sustainable Use of Marine Biological \nDiversity of Areas beyond National Jurisdiction \nA/RES/78/272\n \n3/4\n24-07683 \n \nregional commissions6 and representatives of relevant specialized agencies, as well \nas other organs, organizations, funds and programmes of the United Nations system;  \n \n6. \nDecides that attendance at the meetings of the commission as observers \nwill also be opened to relevant non-governmental organizations in consultative status \nwith the Economic and Social Council in accordance with the provisions of Council \nresolution 1996/31 of 25 July 1996, as well as to those that were accredited to relevant \nconferences and summits referred to in paragraph 5 of the present resolution, on the \nunderstanding that participation means attending formal meetings, unless otherwise \ndecided by the commission in specific situations, receiving copies of the official \ndocuments, making available their materials to delegates and addressing the meetings, \nthrough a limited number of their representatives, as appropriate;  \n \n7. \nAlso decides that, subject to paragraphs 8 and 9 of the present resolution, \nthe rules and the established practice applicable to the procedure of the \nintergovernmental conference on an international legally binding instrument under \nthe United Nations Convention on the Law of the Sea on the conservation and \nsustainable use of marine biological diversity of areas beyond national jurisdiction, \nas reflected in paragraphs 17, 18 and 19 of resolution 72/249, shall apply mutatis \nmutandis to the procedure of the commission unless otherwise agreed by the \ncommission; \n \n8. \nFurther decides that, after 20 September 2025 or the date of entry into force \nof the Agreement, whichever comes earlier, the taking of decisions by the commission \nshall only be by States and regional economic integration organizations that have \nsigned the Agreement or have ratified, approved, accepted or acceded to the \nAgreement; \n \n9. \nDecides that the commission will take decisions on any recommendations \nto the Conference of Parties to the Agreement at the final meeting of the commission; \n \n10. \nAlso decides that the commission shall be chaired by Co-Chairs, one from a \ndeveloped country and one from a developing country, taking into account gender \nbalance, and requests the President of the General Assembly to undertake consultations, \nin an open and transparent manner, for the nomination of the Co-Chairs-designate of the \ncommission; \n \n11. \nFurther decides that the commission shall hold a three-day organizational \nmeeting in the first half of 2024 with full conference services, including documentation, \nto discuss organizational matters, including the election of the Co-Chairs and a Bureau \nof the commission consisting of up to 15 members with up to 3 members from each \nregional group and taking into account gender balance, the dates of the meetings of the \ncommission and the programme of work of the commission; \n \n12. \nDecides that the commission shall prepare a final report on all matters within \nits mandate for presentation to the Conference of the Parties to the Agreement at its \nfirst meeting;  \n \n13. Requests the Secretary-General to provide the commission with the \nassistance necessary for the performance of its work, including secretariat services \nand the provision of essential background information and relevant documents, and \nto arrange for support to be provided by the Division for Ocean Affairs and the Law \n__________________ \n \n6 American Samoa, Anguilla, Aruba, Bermuda, the British Virgin Islands, the Cayman Islands, the \nCommonwealth of the Northern Mariana Islands, Cura\u00e7ao, French Polynesia, Guam, Montserrat, \nNew Caledonia, Puerto Rico, Sint Maarten, the Turks and Caicos Islands and the United States \nVirgin Islands. \n\nA/RES/78/272 \nAgreement under the United Nations Convention on the Law of the \nSea on the Conservation and Sustainable Use of Marine Biological \nDiversity of Areas beyond National Jurisdiction\n \n24-07683\n4/4 \n \nof the Sea of the Office of Legal Affairs in cooperation with other relevant \ndepartments of the Secretariat;  \n \n14. Also requests the Secretary-General to continue to administer the \nvoluntary trust fund established pursuant to resolution 69/292 for the purpose of \nassisting developing countries, in particular the least developed countries, landlocked \ndeveloping countries and small island developing States, in attending the meetings of \nthe commission, and authorizes the Secretary-General to expand the assistance \nprovided by the trust fund to include daily subsistence allowance in addition to \ndefraying the costs of economy-class travel, limiting requests for assistance from the \ntrust fund to one delegate per State for each meeting of the commission;  \n \n15. Invites Member States, international financial institutions, donor agencies, \nintergovernmental organizations, non-governmental organizations and natural and \njuridical persons to make financial contributions to the voluntary trust fund;  \n \n16. Invites States to provide information to the Secretary-General on their \ncapacity-building and technical assistance needs with a view to becoming parties to \nthe Agreement to inform the further development and provision of capacity-building \nand technical assistance activities of the Division in support of requesting States \nbecoming parties to the Agreement and the effective implementation of the \nAgreement; \n \n17. Decides to include in the provisional agenda of its seventy-ninth session, \nunder the item entitled \u201cOceans and the law of the sea\u201d, the sub-item entitled \n\u201cAgreement under the United Nations Convention on the Law of the Sea on the \nConservation and Sustainable Use of Marine Biological Diversity of Areas beyond \nNational Jurisdiction\u201d. \n \n73rd plenary meeting \n24 April 2024 \n \n",
  "paragraphs": {
    "1": "Welcomes the opening for signature of the Agreement under the United Nations Convention on the Law of the Sea on the Conservation and Sustainable Use of Marine Biological Diversity of Areas beyond National Jurisdiction;",
    "2": "Emphasizes the importance of the early entry into force and effective implementation of the Agreement;",
    "3": "Decides to establish a preparatory commission, which shall meet at United Nations Headquarters unless otherwise decided, on dates to be determined, to prepare for the entry into force of the Agreement and to prepare for the convening of the first meeting of the Conference of the Parties to the Agreement, at the conclusion of which the commission will cease to exist;",
    "4": "Also decides that the commission shall be open to all States Members of the United Nations, members of the specialized agencies and parties to the United Nations Convention on the Law of the Sea;",
    "5": "Further decides to invite to the commission representatives of organizations and other entities that have received a standing invitation from the General Assembly pursuant to its relevant resolutions to participate, in the capacity of observer, in its sessions and work, on the understanding that such representatives would participate in the work of the commission in that capacity, and to invite, as observers to the commission, representatives of interested global and regional intergovernmental organizations and other interested international bodies that were invited to participate in relevant conferences and summits, 5 associate members of the regional commissions6 and representatives of relevant specialized agencies, as well as other organs, organizations, funds and programmes of the United Nations system;",
    "6": "Decides that attendance at the meetings of the commission as observers will also be opened to relevant non-governmental organizations in consultative status with the Economic and Social Council in accordance with the provisions of Council resolution 1996/31 of 25 July 1996, as well as to those that were accredited to relevant conferences and summits referred to in paragraph 5 of the present resolution, on the understanding that participation means attending formal meetings, unless otherwise decided by the commission in specific situations, receiving copies of the official documents, making available their materials to delegates and addressing the meetings, through a limited number of their representatives, as appropriate;",
    "7": "Also decides that, subject to paragraphs 8 and 9 of the present resolution, the rules and the established practice applicable to the procedure of the intergovernmental conference on an international legally binding instrument under the United Nations Convention on the Law of the Sea on the conservation and sustainable use of marine biological diversity of areas beyond national jurisdiction, as reflected in paragraphs 17, 18 and 19 of resolution 72/249, shall apply mutatis mutandis to the procedure of the commission unless otherwise agreed by the commission;",
    "8": "Further decides that, after 20 September 2025 or the date of entry into force of the Agreement, whichever comes earlier, the taking of decisions by the commission shall only be by States and regional economic integration organizations that have signed the Agreement or have ratified, approved, accepted or acceded to the Agreement;",
    "9": "Decides that the commission will take decisions on any recommendations to the Conference of Parties to the Agreement at the final meeting of the commission;",
    "10": "Also decides that the commission shall be chaired by Co-Chairs, one from a developed country and one from a developing country, taking into account gender balance, and requests the President of the General Assembly to undertake consultations, in an open and transparent manner, for the nomination of the Co-Chairs-designate of the commission;",
    "11": "Further decides that the commission shall hold a three-day organizational meeting in the first half of 2024 with full conference services, including documentation, to discuss organizational matters, including the election of the Co-Chairs and a Bureau of the commission consisting of up to 15 members with up to 3 members from each regional group and taking into account gender balance, the dates of the meetings of the commission and the programme of work of the commission;",
    "12": "Decides that the commission shall prepare a final report on all matters within its mandate for presentation to the Conference of the Parties to the Agreement at its first meeting;",
    "13": "Requests the Secretary-General to provide the commission with the assistance necessary for the performance of its work, including secretariat services and the provision of essential background information and relevant documents, and to arrange for support to be provided by the Division for Ocean Affairs and the Law of the Sea of the Office of Legal Affairs in cooperation with other relevant departments of the Secretariat;",
    "14": "Also requests the Secretary-General to continue to administer the voluntary trust fund established pursuant to resolution 69/292 for the purpose of assisting developing countries, in particular the least developed countries, landlocked developing countries and small island developing States, in attending the meetings of the commission, and authorizes the Secretary-General to expand the assistance provided by the trust fund to include daily subsistence allowance in addition to defraying the costs of economy-class travel, limiting requests for assistance from the trust fund to one delegate per State for each meeting of the commission;",
    "15": "Invites Member States, international financial institutions, donor agencies, intergovernmental organizations, non-governmental organizations and natural and juridical persons to make financial contributions to the voluntary trust fund;",
    "16": "Invites States to provide information to the Secretary-General on their capacity-building and technical assistance needs with a view to becoming parties to the Agreement to inform the further development and provision of capacity-building and technical assistance activities of the Division in support of requesting States becoming parties to the Agreement and the effective implementation of the Agreement;",
    "17": "Decides to include in the provisional agenda of its seventy-ninth session, under the item entitled \u201cOceans and the law of the sea\u201d, the sub-item entitled \u201cAgreement under the United Nations Convention on the Law of the Sea on the Conservation and Sustainable Use of Marine Biological Diversity of Areas beyond National Jurisdiction\u201d."
  },
  "agenda_items": [
    "Item 75"
  ],
  "symbol_references": [
    "A/78/L.41"
  ]
}