{
  "symbol": "A/RES/78/184",
  "filename": "A_RES_78_184.pdf",
  "title": "78/184. Office of the United Nations High Commissioner for Refugees",
  "text": "United Nations \nA/RES/78/184\n \n \nGeneral Assembly \nDistr.: General \n22 December 2023 \n \n23-26027 (E)    050124     \n*2326027* \n \n \nSeventy-eighth session \nAgenda item 60 \nReport of the United Nations High Commissioner for \nRefugees, questions relating to refugees, returnees and \ndisplaced persons and humanitarian questions  \n \n \n \n \n Resolution adopted by the General Assembly \non 19 December 2023 \n \n \n \n \n[on the report of the Third Committee (A/78/474, para. 26)] \n \n \n 78/184. Office of the United Nations High Commissioner for Refugees \n \n \n \nThe General Assembly, \n \nHaving considered the report of the United Nations High Commissioner for \nRefugees on the activities of his Office,1 noting that it includes the second decennial \nstrategic review pursuant to General Assembly resolution 58/153 of 22 December \n2003, and the report of the Executive Committee of the Programme of the United \nNations High Commissioner for Refugees on the work of its seventy-fourth session2 \nand the decisions contained therein, \n \nRecalling its previous annual resolutions on the work of the Office of the United \nNations High Commissioner for Refugees since its establishment by the General \nAssembly,  \n \nExpressing deep concern that the number of people who are forcibly displaced \nowing to, inter alia, conflict, persecution and violence, including terrorism, is \nincreasing,  \n \nExpressing deep concern also that the adverse effects of climate change, hazards \nand environmental degradation are increasing in intensity and frequency, contributing \nto drive forced displacement and disproportionately affecting persons in vulnerable \nsituations, including forcibly displaced populations in developing countries and \nparticularly in small island developing States and the least developed countries,  \n \nNoting with grave concern that, despite the unprecedented generosity of host \ncountries and donors, the gap between needs and humanitarian funding continues to \n__________________ \n \n1  Official Records of the General Assembly, Seventy-eighth Session, Supplement No. 12 (A/78/12 \n(Part I) and A/78/12 (Part II)). \n \n2  Ibid., Supplement No. 12A (A/78/12/Add.1). \n\nA/RES/78/184 \nOffice of the United Nations High Commissioner for Refugees\n \n23-26027\n2/13 \n \ngrow, and recalling in this context the need for equitable burden- and responsibility-\nsharing, \n \nRecognizing that the greatest share of the refugees and other persons of concern \nto the Office of the High Commissioner, the majority of whom are women and \nchildren, are hosted by developing countries, \n \nNoting with grave concern the continuing impact of the coronavirus disease \n(COVID-19) pandemic on refugees and other persons of concern to the Office of the \nHigh Commissioner, as well as their host communities and countries and countries of \norigin, and recalling that the pandemic requires a global response based on unity, \nsolidarity and multilateral cooperation, \n \nRecognizing that forced displacement has, inter alia, humanitarian and \ndevelopment implications, \n \nExpressing its appreciation for the leadership shown by the High Commissioner, \nand commending the staff of his Office and its partners for the competent, courageous \nand dedicated manner in which they discharge their responsibilities, \n \nUnderlining its strong condemnation of all forms of violence to which \nhumanitarian personnel are increasingly and perilously exposed, \n \nReaffirming the need for consistency with international law and relevant \nGeneral Assembly resolutions, and taking into account national policies, priorities \nand realities, \n \nRecalling its resolution 46/182 of 19 December 1991 on the strengthening of \nthe coordination of emergency humanitarian assistance of the United Nations and all \nsubsequent General Assembly resolutions on the subject, including resolution 77/28 \nof 6 December 2022, \n \n1. \nWelcomes the important work undertaken by the Office of the United \nNations High Commissioner for Refugees and its Executive Committee in the course \nof the year, which is aimed at strengthening the international protection regime and \nassisting Governments in meeting protection responsibilities, and underlines the \nimportance of seeking durable solutions, and the significance of the Office\u2019s efforts \nto promote addressing root causes, within its mandate; \n \n2. \nEndorses the report of the Executive Committee of the Programme of the \nUnited Nations High Commissioner for Refugees on the work of its seventy-fourth \nsession; \n \n3. \nRecognizes the relevance of the Executive Committee\u2019s practice of \nadopting conclusions, welcomes the adoption of a multi-year workplan for the \nExecutive Committee conclusions at its seventy-fourth session, and encourages the \nExecutive Committee to continue the process of adopting conclusions;  \n \n4. \nReaffirms the 1951 Convention relating to the Status of Refugees 3 and the \n1967 Protocol thereto 4  as the foundation of the international refugee protection \nregime, recognizes the importance of their full and effective application by States \nparties and the values they embody, notes with satisfaction that 149 States are now \nparties to one or both instruments, encourages States not parties to consider acceding \nto those instruments and States parties with reservations to give consideration to \nwithdrawing them, underlines, in particular, the importance of full respect for the \nprinciple of non-refoulement, and recognizes that a number of States not parties to \n__________________ \n \n3  United Nations, Treaty Series, vol. 189, No. 2545. \n \n4  Ibid., vol. 606, No. 8791. \n\nOffice of the United Nations High Commissioner for Refugees \nA/RES/78/184\n \n3/13\n23-26027 \n \nthe international refugee instruments have shown a generous approach to hosting \nrefugees; \n \n5. \nUrges States that are parties to the 1951 Convention relating to the Status \nof Refugees and the 1967 Protocol thereto to respect their obligations in letter and \nspirit; \n \n6. \nRe-emphasizes that the protection of refugees is primarily the \nresponsibility of States, whose full and effective cooperation, action and political \nresolve are required to enable the Office of the High Commissioner to fulfil its \nmandated functions, and strongly emphasizes the importance of active international \nsolidarity and burden- and responsibility-sharing;  \n \n7. \nWelcomes recent accessions to the 1954 Convention relating to the Status \nof Stateless Persons5 and the 1961 Convention on the Reduction of Statelessness, 6 \nnotes that 97 States are now parties to the 1954 Convention and 79 States are parties \nto the 1961 Convention, encourages States that have not done so to give consideration \nto acceding to those instruments, notes the work of the United Nations High \nCommissioner for Refugees with regard to identifying stateless persons, preventing \nand reducing statelessness and protecting stateless persons, and urges the Office of \nthe High Commissioner to continue to work in this area in accordance with relevant \nGeneral Assembly resolutions and Executive Committee conclusions;  \n \n8. \nRe-emphasizes that prevention and reduction of statelessness are primarily \nthe responsibility of States, in appropriate cooperation with the international \ncommunity, encourages the fulfilment of the goals of the I Belong campaign to end \nstatelessness, including through the implementation by States of pledges made at the \nhigh-level segment that took place at the start of the seventieth plenary session of the \nExecutive Committee, and encourages all States to consider actions they may take to \nfurther accelerate the prevention and reduction of statelessness;  \n \n9. \nRe-emphasizes that protection of, assistance to and achieving durable \nsolutions for internally displaced persons are primarily the responsibility of States, in \nappropriate cooperation with the international community, in line with applicable \ninternational law, and taking into consideration international and regional norms and \nstandards, as appropriate, and welcomes efforts by States to incorporate such norms \nand standards into domestic law and national development plans, aimed at, inter alia, \nfacilitating voluntary, safe, sustainable and dignified return, local integration or \nrelocation in their own country;  \n \n10. Recognizes the importance of the Secretary-General\u2019s Action Agenda on \nInternal Displacement, calls for sustained momentum on this important issue, and \nencourages the Office of the High Commissioner, in coordination with the Special \nAdviser on Solutions to Internal Displacement, to contribute to the United Nations \nsystem\u2019s collective efforts to advance durable solutions, with ownership and \nleadership of affected States;  \n \n11. \nNotes the activities of the Office of the High Commissioner related to the \nprotection of, assistance to and durable solutions for internally displaced persons, \nincluding in the context of inter-agency arrangements in this field, emphasizes that \nsuch activities should be carried out with the full consent of the affected States, \nconsistent with relevant General Assembly resolutions, and should not undermine the \nrefugee mandate of the Office, and encourages the High Commissioner to continue \nhis support for States in this regard; \n__________________ \n \n5  Ibid., vol. 360, No. 5158. \n \n6  Ibid., vol. 989, No. 14458. \n\nA/RES/78/184 \nOffice of the United Nations High Commissioner for Refugees\n \n23-26027\n4/13 \n \n \n12. Encourages the Office of the High Commissioner to continue to respond \nadequately to emergencies, in accordance with its mandate and in cooperation with \nStates, notes the ongoing measures to reinforce its capacity to respond to emergencies, \nand encourages the Office to redouble its efforts to ensure a more predictable, \neffective and timely response;  \n \n13. Also encourages the Office of the High Commissioner to work in \npartnership and full cooperation with relevant national authorities, United Nations \noffices and agencies, international and intergovernmental organizations, regional \norganizations, the private sector and non-governmental organizations to continue to \ncontribute to the development of humanitarian response capacities at all levels; \n \n14. Welcomes the efforts by the Office of the High Commissioner to ensure an \ninclusive, transparent, predictable and well-coordinated response to refugees, as well \nas internally displaced persons and other persons of concern, consistent with its \nmandate, and in this regard takes note of the refugee coordination model; \n \n15. Notes the significant global and regional initiatives, conferences and \nsummits undertaken to strengthen international solidarity with and cooperation for \nrefugees and other persons of concern, and encourages those who participated to \nimplement their commitments made therein;  \n \n16. Recalls the adoption of the New York Declaration for Refugees and \nMigrants7 at the high-level plenary meeting of the General Assembly on addressing \nlarge movements of refugees and migrants, on 19 September 2016, and encourages \nStates to implement relevant commitments made therein; \n \n17. Also recalls the Global Compact on Refugees,8 affirmed on 17 December \n2018,9 and calls upon the international community as a whole, including States and \nother relevant stakeholders, to implement the Compact to achieve its four objectives \non an equal footing based on the principle of burden- and responsibility-sharing, and \nin accordance with the guiding principles and paragraph 4 of the Global Compact on \nRefugees, through concrete actions, pledges and contributions;  \n \n18. Welcomes the pledges, contributions and commitments made at the first \nGlobal Refugee Forum, in December 2019, as well as the sustained engagement of \nStates and other relevant stakeholders in the implementation of pledges and in their \nreview process at the first meeting of high-level officials in December 2021, also \nwelcomes the High Commissioner\u2019s regular progress report, and encourages \nengagement in the second Global Refugee Forum, in December 2023; \n \n19. Underlines the centrality of international cooperation to the refugee \nprotection regime, recognizes the burden that large movements of refugees place on \nmajor and long-standing refugee-hosting countries and communities, as well as their \nnational resources, especially in the case of developing countries, and calls for a more \nequitable sharing of the burden and responsibility for hosting and supporting the \nworld\u2019s refugees, addressing the needs of refugees and hosting States, while taking \naccount of existing contributions and the differing capacities and resources among \nStates; \n \n20. Expresses concern over the significant challenges associated with hosting, \nprotecting and integrating refugees in national systems and strategies, given \nsocioeconomic \ndifficulties \nand \nstretched \nresources, \naffecting, \ninter \nalia, \ninfrastructure, social security and the provision of protection services, education, \n__________________ \n \n7  Resolution 71/1. \n \n8  Official Records of the General Assembly, Seventy-third Session, Supplement No. 12 (A/73/12 \n(Part I) and A/73/12 (Part II)), part II. \n \n9  See resolution 73/151. \n\nOffice of the United Nations High Commissioner for Refugees \nA/RES/78/184\n \n5/13\n23-26027 \n \nhealth and employment, and stresses the importance of easing pressure on host \ncountries by facilitating more equitable, sustained and predictable burden- and \nresponsibility-sharing among States and other relevant stakeholders; \n \n21. Invites the High Commissioner to continue coordinating the effort to \nmeasure the impacts arising from hosting, protecting and assisting refugees, with a \nview to assessing gaps in international cooperation and promoting burden- and \nresponsibility-sharing that is more equitable, predictable and sustainable, and to \nreport on the results to Member States in 2024; \n \n22. Emphasizes the need for robust, well-functioning, concrete arrangements \nand potential, complementary mechanisms for ensuring predictable, equitable, \nefficient and effective burden- and responsibility-sharing in the context of the Global \nCompact on Refugees;  \n \n23. Notes with appreciation the efforts made by the increased number of \ncountries applying the comprehensive refugee response framework that is part of the \nGlobal Compact on Refugees, including through regional approaches, where \napplicable, such as the comprehensive regional protection and solutions framework \n(MIRPS), the Intergovernmental Authority on Development regional approach, the \nSolutions Strategy for Afghan Refugees and the regional cooperation framework to \nstrengthen protection and the search for solutions for people displaced by the Central \nAfrican crisis, welcomes the launch and efforts of support platforms established for \nthese mechanisms, as concrete arrangements to support responsibility-sharing, and \nencourages States, and other stakeholders, to continue their efforts to address the \nneeds of the people who require international protection, including through support \nfor host communities; \n \n24. Calls upon the Office of the High Commissioner and partners to \neffectively provide and facilitate further support for States in different situations, \nenabling them to build and expand the capacity of national systems to protect persons \nof concern to the Office and to the communities hosting them, as well as support for \ndurable solutions and emergency responses, consistent with the principles of burden- \nand responsibility-sharing, taking into account the importance of national ownership \nand leadership; \n \n25. Calls upon States and other stakeholders that have not yet contributed to \nburden- and responsibility-sharing to do so, with a view to broadening the support \nbase, in a spirit of international solidarity and cooperation; \n \n26. Recognizes the importance of meaningful refugee participation and of \nintegrating the perspectives of refugees and other persons of concern to the Office of \nthe High Commissioner in humanitarian responses;  \n \n27. Requests the Office of the High Commissioner to continue improving its \nhumanitarian assistance response, and stresses the importance of tailored, innovative \napproaches, including effective cash-based interventions; \n \n28. Highlights the importance for States and the Office of the High \nCommissioner to have, when possible, high-quality and disaggregated data, in \naccordance with data protection and data privacy principles, and stresses the \nimportance of interoperable data collection and analysis within the United Nations \nsystem, consistent with relevant United Nations provisions relating to data, further \ncalls for strengthened coordination in this regard, and welcomes the collaboration of \nthe Office of the High Commissioner with key data actors, development partners and \nStates, including through the Joint Data Center on Forced Displacement, in order to \npromote evidence-based programming and policymaking at all levels to better target \nand monitor assistance;  \n\nA/RES/78/184 \nOffice of the United Nations High Commissioner for Refugees\n \n23-26027\n6/13 \n \n \n29. Encourages the Office of the High Commissioner to continue to work with \nthe Office for the Coordination of Humanitarian Affairs of the Secretariat to enhance \nthe coordination, effectiveness and efficiency of humanitarian response and to \ncontribute, in consultation with States, as appropriate, to making further progress \ntowards common humanitarian needs assessments, as stated, among other important \nissues, in General Assembly resolution 77/28 on the strengthening of the coordination \nof emergency humanitarian assistance of the United Nations, and recalls the role of \nthe Office of the High Commissioner as the leading entity of the clusters for \nprotection, camp coordination and camp management and emergency shelter in \ncomplex emergencies;  \n \n30. Recognizes the importance of a comprehensive and principled approach to \nhumanitarian response, in particular in protracted situations, including through early \nrecovery activities, to strengthen the resilience of the persons of concern to the Office \nof the High Commissioner and their access to basic services; \n \n31. Welcomes the active engagement of the Office of the High Commissioner \nin the United Nations development system reform, including as part of broader efforts \ntowards generating system-wide effectiveness, transparency, accountability and \nefficiencies; \n \n32. Expresses deep concern about the increasing threats to the safety and \nsecurity of humanitarian aid workers, facilities and convoys and, in particular, the \nloss of life of humanitarian personnel working in the most difficult and challenging \nconditions in order to assist those in need, and calls upon all States and parties to \narmed conflict to fulfil their obligations under international humanitarian law to \nprotect civilian populations and humanitarian personnel and facilities; \n \n33. Emphasizes the need for States to ensure that perpetrators of attacks \ncommitted on their territory against humanitarian personnel and United Nations and \nassociated personnel do not act with impunity and that the perpetrators of such acts \nare promptly brought to justice as provided for by national laws and obligations under \ninternational law; \n \n34. Strongly condemns attacks on refugees, asylum-seekers, stateless persons \nand internally displaced persons and acts that pose a threat to their personal security \nand well-being, calls upon all States concerned and, where applicable, parties \ninvolved in an armed conflict to take all measures necessary to respect and ensure \nrespect for human rights, and international humanitarian law, and urges all States to \nfight racism and all forms of discrimination and intolerance, including racial \ndiscrimination, xenophobia, hate speech, stigmatization and stereotyping;  \n \n35. Urges States to uphold the civilian and humanitarian character of camps \nand settlements for refugees and internally displaced persons, inter alia, through \neffective measures to prevent the infiltration of armed elements, to identify and \nseparate any such armed elements from refugee populations, to settle refugees and \ninternally displaced persons in secure locations and to afford to the Office of the High \nCommissioner and, where appropriate, to other humanitarian organizations prompt, \nunhindered and safe access to asylum-seekers, refugees and other persons of concern; \n \n36. Emphasizes that the international protection of refugees is a dynamic and \naction-oriented function that is at the core of the mandate of the Office of the High \nCommissioner and that it includes, in cooperation with States and other partners, the \npromotion and facilitation of the admission, reception and treatment of refugees in \naccordance with internationally agreed standards and the ensuring of durable, \nprotection-oriented solutions, bearing in mind the particular needs of the most \nvulnerable, and notes in this context that the delivery of international protection is a \n\nOffice of the United Nations High Commissioner for Refugees \nA/RES/78/184\n \n7/13\n23-26027 \n \nstaff-intensive service that requires adequate staff with the appropriate expertise, \nespecially at the field level; \n \n37. Calls upon States to process asylum applications by duly identifying those \nin need of international protection, in accordance with their applicable international \nand regional obligations, so as to strengthen the refugee protection regime;  \n \n38. Deplores the growing number of incidents of refoulement and unlawful \nexpulsion of refugees and asylum-seekers, as well as practices of denial of access to \nasylum, and calls upon all States concerned to respect the relevant principles of \nrefugee protection and human rights;  \n \n39. Stresses the importance of preventing abuse of asylum systems, including \nfor political purposes, in order to safeguard the efficiency and functionality of asylum \nsystems for those in need of international protection; \n \n40. Notes with increasing concern that asylum-seekers, refugees and stateless \npersons are subject to arbitrary detention in numerous situations and encourages \nworking towards the ending of this practice, welcomes the increasing use of \nalternatives to detention, especially in the case of children, and emphasizes the need \nfor States to limit detention of asylum-seekers, refugees and stateless persons to that \nwhich is necessary, giving full consideration to possible alternatives; \n \n41. Notes with grave concern the significant risks to which many persons of \nconcern to the Office of the High Commissioner are exposed as they attempt to reach \nsafety, and encourages international cooperation to step up efforts to prevent and \ncombat human trafficking and smuggling and to ensure adequate response \nmechanisms, including, as appropriate, life-saving measures, reception, registration \nand assistance, including trauma-informed assistance for victims of human trafficking \nand smuggling, as well as to ensure that safe and regular access to asylum for persons \nin need of international protection remains open and accessible; \n \n42. Expresses grave concern at the large number of asylum-seekers who have \nlost their lives or gone missing at sea and on land trying to reach safety, encourages \ninternational cooperation to further strengthen prevention, search and rescue \nmechanisms that are in accordance with international law, and commends the great \nlife-saving efforts and actions taken by a number of States in this regard; \n \n43. Notes that the lack of civil registration and related documentation makes \npersons vulnerable to statelessness and associated protection risks, recognizes that \nbirth registration provides an official record of a child\u2019s legal identity and is crucial \nto preventing and reducing statelessness, and welcomes efforts by States to ensure the \nbirth registration of children and other essential documentation; \n \n44. Notes with concern that arbitrary deprivation of nationality pushes people \ninto statelessness and is a source of widespread suffering, and calls upon States to \nrefrain from adopting discriminatory measures and from enacting or maintaining \nlegislation that would arbitrarily revoke citizenship of their nationals, rendering a \nperson stateless;  \n \n45. Expresses grave concern over the unprecedented scale of the global food \nsecurity and nutrition crisis and the impacts this will have on persons of concern to \nthe Office of the High Commissioner, who are already in a situation of vulnerability, \nand calls upon States, humanitarian and development organizations and other relevant \npartners to take coordinated and immediate action to save lives and reduce suffering \nin countries at risk of famine, food insecurity, hunger and acute malnutrition, and in \nthis regard takes note of the work of the Secretary-General\u2019s Global Crisis Response \nGroup on Food, Energy and Finance and the Committee on World Food Security, \n\nA/RES/78/184 \nOffice of the United Nations High Commissioner for Refugees\n \n23-26027\n8/13 \n \nbearing in mind its resolution 76/264 of 23 May 2022 on the state of global food \ninsecurity and measures contained to reinforce global food security; \n \n46. Also expresses grave concern about the negative long-term impact of \ncontinued cuts in food rations on the nutrition, health and well-being of refugees and \nhosting communities globally and especially its impacts on women and children, \nowing to insufficient funding and increased costs, and calls upon donors to ensure \nsustained support for the Office of the High Commissioner and the World Food \nProgramme, while looking to provide refugees with alternatives to food assistance, \npending a durable solution; \n \n47. Recognizes that the COVID-19 pandemic requires a global response to \nensure that all States, in particular developing States, including refugee-hosting \ncountries as well as the countries of origin, have universal, timely, effective and \nequitable access to safe and effective diagnostics, therapeutics, medicines, vaccines \nand medical supplies and equipment, calls upon States and other partners to urgently \nsupport funding and further explore innovative financing mechanisms aimed at \nensuring equitable access to COVID-19 vaccines for all, including persons of concern \nto the Office of the High Commissioner and their host communities, bearing in mind \nthat extensive immunization against COVID-19 is a global public good for health in \npreventing, containing and stopping transmission as countries transition to pandemic \nrecovery, and to ensure that refugees can access correct information to avoid the \nnegative impact of disinformation and misinformation, and stresses the need to \nadequately prepare for and respond to future public health emergencies of \ninternational concern; \n \n48. Encourages States and the Office of the High Commissioner to address \nmental health and psychosocial well-being by promoting the availability and \naffordability of mental health and psychosocial support to persons of concern to the \nOffice, as well as host communities, and encourages the further strengthening of such \nmeasures, including through additional international support; \n \n49. Recognizes the generosity of host countries and their differentiated \nexperiences and situations, and in particular welcomes the positive steps taken by \nindividual States to open their labour markets to refugees; \n \n50. Notes with appreciation the contributions of refugees in host countries and \ncountries of resettlement, including facilitating the generation of decent work \nopportunities, with the purpose of developing sustainable livelihoods until durable \nsolutions are achieved, and recalls that further international cooperation is needed in \nsupport of host communities, particularly in long-standing refugee-hosting countries; \n \n51. Notes the importance of age, gender and diversity mainstreaming in \nanalysing protection needs and ensuring the participation of refugees and other \npersons of concern to the Office of the High Commissioner, as appropriate, in the \nplanning and implementation of programmes of the Office and of State policies, \naffirms the importance of according priority to addressing discrimination, gender \ninequality and the problem of sexual and gender-based violence, recognizing the \nimportance of addressing the protection needs and rights of women, children and \npersons with disabilities in particular, through an inclusive approach, and underlines \nthe importance of continuing to work on those issues;  \n \n52. Encourages States and the Office of the High Commissioner to ensure that \nthe perspectives of women and girls in situations of displacement are taken into \naccount by promoting their meaningful participation in matters affecting them, as well \nas women\u2019s full and equal participation in the design, implementation, follow-up and \nevaluation of policies, programmes and activities related to humanitarian response; \n\nOffice of the United Nations High Commissioner for Refugees \nA/RES/78/184\n \n9/13\n23-26027 \n \n \n53. Calls upon Member States, in cooperation with the Office of the High \nCommissioner and with the support of other stakeholders, to ensure that the \nhumanitarian needs of persons of concern to the Office of the High Commissioner, \nand their host communities, including clean water, food and nutrition, shelter, \neducation, livelihoods, energy, health, including sexual and reproductive health, and \nother protection needs, are addressed as components of humanitarian response, \nincluding through providing timely and adequate resources, while ensuring that their \ncollaborative efforts fully adhere to humanitarian principles; \n \n54. Welcomes and calls upon States, the Office of the High Commissioner and \nother stakeholders to promote gender equality and the empowerment of women, and \nin this regard urges Member States, in cooperation with the Office of the High \nCommissioner, and with the support of other stakeholders, to ensure reliable and safe \naccess for persons of concern to the Office of the High Commissioner to sexual and \nreproductive health-care services, as well as basic health-care services and \npsychosocial support from the onset of emergencies, while recognizing that relevant \nservices are important in order to effectively meet the needs of women and adolescent \ngirls and infants and protect them from preventable mortality and morbidity that occur \nin humanitarian emergencies; \n \n55. Encourages States to put in place appropriate systems and procedures to \nensure that the best interests of the child are a primary consideration with regard to \nall actions concerning refugee children and to protect them from all forms of abuse, \nneglect, exploitation and violence, while taking into account the situation of those \nwith disabilities; \n \n56. Encourages States and the Office of the High Commissioner to support \nand enable the full and meaningful participation of persons with disabilities, including \nthose in particularly vulnerable situations, and their representative organizations, in \nthe design, implementation, follow-up and evaluation of policies, programmes and \nactivities related to humanitarian response, and to consult relevant experts on the \nrights of persons with disabilities, and further requests the Office to continue its work \non the implementation of the United Nations Disability Inclusion Strategy and to \nregularly report to the Executive Committee on its progress; \n \n57. Notes with concern that a large proportion of the world\u2019s out-of-school \npopulation lives in conflict-affected areas, and calls upon States, in their \nimplementation of the Global Compact on Refugees, to lend support to host countries \nin providing quality primary, secondary and tertiary education in safe learning \nenvironments for all refugee children, youth and adults, and to develop more \ninclusive, responsive and resilient education systems to meet the needs of children, \nyouth and adults in these contexts, including internally displaced persons and \nrefugees,10 and underlines the importance of quality education in countries of origin \nand the role of international cooperation in this regard; \n \n58. Welcomes the increased attention and efforts of the Office of the High \nCommissioner to address and respond to matters related to the impact of climate \nchange in its work, including the adoption of a strategic framework for climate action, \nwithin its mandate, in consultation with national authorities and in cooperation with \ncompetent agencies; \n \n59. Calls upon States to take appropriate measures to address climate change, \nincluding with a view to building local and national resilience and capacity to prevent, \nprepare for and respond to displacement in this context in particular in developing \n__________________ \n \n10  See United Nations Educational, Scientific and Cultural Organization, Final Report of the World \nEducation Forum 2015, Incheon, Republic of Korea, 19\u201322 May 2015 (Paris, 2015). \n\nA/RES/78/184 \nOffice of the United Nations High Commissioner for Refugees\n \n23-26027\n10/13 \n \ncountries, including in small island developing States and the least developed \ncountries; \n \n60. Calls upon donors, the Office of the High Commissioner and other \nstakeholders to mobilize and provide additional support for adaptation and mitigation \nof environmental impacts of hosting large numbers of refugees and other forcibly \ndisplaced people, including by supporting renewable energy, environmental \nprotection and rehabilitation initiatives for refugees and other forcibly displaced \npeople and their host communities; \n \n61. Recognizes the importance of achieving durable solutions to refugee \nsituations and, in particular, the need to address in this process their root causes; \n \n62. Strongly reaffirms the fundamental importance and the purely \nhumanitarian and non-political character of the function of the Office of the High \nCommissioner of providing international protection to refugees and seeking durable \nsolutions for them and for refugee situations, and recalls that those solutions include \nvoluntary repatriation and, where appropriate and feasible, local integration and \nresettlement in a third country, while reaffirming that voluntary repatriation, \nsupported, as necessary, by rehabilitation and development assistance to facilitate \nsustainable reintegration, remains the preferred solution; \n \n63. Expresses concern about the particular difficulties faced by the millions of \nrefugees in protracted situations, recognizes with deep concern that the average length \nof stay has continued to grow, and emphasizes the need to redouble international \nefforts and cooperation to find practical and comprehensive approaches to resolving \nthe plight of refugees and to realize durable solutions, consistent with international \nlaw and relevant General Assembly resolutions; \n \n64. Encourages further efforts by the Office of the High Commissioner, in \ncooperation with countries hosting refugees and countries of origin, including their \nrespective local communities, relevant United Nations agencies, international and \nintergovernmental \norganizations, \nregional \norganizations, \nas \nappropriate, \nnon- governmental organizations and development actors, to actively promote durable \nsolutions, particularly in protracted refugee situations, with a focus on sustainable, \ntimely, voluntary, safe and dignified return, which encompasses repatriation, \nreintegration, rehabilitation and reconstruction activities, and encourages States and \nother relevant actors to continue to support these efforts through, inter alia, the \nallocation of funds; \n \n65. Recalls the purely humanitarian and non-political character of the Office \nof the High Commissioner, calls upon the international community and the Office to \ncoordinate and exert further efforts to promote and facilitate, whenever the prevailing \ncircumstances are deemed appropriate, the safe, dignified and voluntary repatriation \nof refugees, through their free and informed choice, in a sustainable manner, to their \ncountries of origin, and encourages the Office and, where appropriate, other United \nNations agencies, to mobilize further resources in this regard; \n \n66. Expresses concern about the current low level of voluntary repatriation, \nencourages the solution-oriented approach pursued by the Office of the High \nCommissioner to support the sustainability of voluntary repatriation and \nreintegration, including from the onset of displacement, and in this regard urges the \nOffice to further strengthen partnerships with national Governments and development \nactors, as well as international financial institutions; \n \n67. Recognizes, in the context of voluntary repatriation, the importance of \nresolute efforts in the country of origin, including rehabilitation and development \nassistance, to foster the voluntary, safe and dignified return and sustainable \nreintegration of refugees and to ensure the restoration of national protection; \n\nOffice of the United Nations High Commissioner for Refugees \nA/RES/78/184\n \n11/13\n23-26027 \n \n \n68. Acknowledges with appreciation voluntary action taken by several host \ncountries to enable permanent residence and naturalization for refugees and former \nrefugees; \n \n69. Recognizes the importance of resettlement as a strategic protection tool \nand a durable solution for refugees in reducing the pressure on refugee-hosting \ncountries in protracted situations, as a measure for international protection, as well as \nin opening possibilities for other durable solutions; \n \n70. Calls upon States and the Office of the High Commissioner to create \nexpanded opportunities for inclusive and non-discriminatory resettlement as a durable \nsolution, broaden the base of countries and actors engaged, expand the scope and size, \nand maximize the protection and quality of resettlement as an invaluable tool for \nburden- and responsibility-sharing, and acknowledges with appreciation countries \nthat continue to offer enhanced resettlement opportunities;  \n \n71. Reaffirms that accelerating complementary pathways to solutions is \ncrucial for addressing protracted refugee situations, and recognizes the importance of \nthe work of the Office of the High Commissioner for seeking durable solutions for \nrefugees, in accordance with its mandate; \n \n72. Calls upon States to consider creating, expanding or facilitating access to \ncomplementary and sustainable pathways to protection and solutions for refugees, in \ncooperation with relevant partners, including the private sector, where appropriate, \nincluding through humanitarian admission or transfer, family reunification, skilled \nmigration, labour mobility schemes, scholarships and education mobility schemes; \n \n73. Notes the importance of States and the Office of the High Commissioner \ndiscussing and clarifying the role of the Office in mixed movements in order to better \naddress protection needs of people in the context of mixed movements, bearing in \nmind the particular needs of persons in vulnerable situations, especially women, \nchildren and persons with disabilities, including by safeguarding access to asylum for \nthose in need of international protection, and also notes the readiness of the High \nCommissioner, consistent with his mandate, to assist States in fulfilling their \nprotection responsibilities in this regard; \n \n74. Emphasizes the obligation of all States to accept the return of their \nnationals, calls upon States to facilitate the return of their nationals who have been \ndetermined not to be in need of international protection, in collaboration with the \nOffice of the High Commissioner and other relevant stakeholders, as appropriate, and \naffirms the need for the return of persons to be undertaken in a safe and humane \nmanner and with full respect for their human rights and dignity, irrespective of the \nstatus of the persons concerned; \n \n75. Notes the transformation process that the High Commissioner is \nimplementing to establish clearer authorities and lines of accountability, including \nthrough regionalization and decentralization, to enable a more timely, relevant and \nefficient response to the needs of persons of concern and to ensure the effective and \ntransparent use of the Office\u2019s resources; \n \n76. Affirms the importance of a geographically diverse, inclusive and \nrepresentative workforce, with a view to reflecting the international character of the \nOffice of the High Commissioner, and calls upon the Office to take effective measures \nto ensure balanced geographical representation across the regions, in particular from \nunderrepresented States and large refugee-hosting States, among its workforce both \nat headquarters and in the field, with due consideration for gender parity, racial \nequality, disability and age, particularly at the senior level, which will also promote \na better understanding of the working environment; \n\nA/RES/78/184 \nOffice of the United Nations High Commissioner for Refugees\n \n23-26027\n12/13 \n \n \n77. Welcomes the commitment and efforts of the Office of the High \nCommissioner to prevent, mitigate and respond to sexual exploitation and abuse, \nsexual harassment, fraud, corruption and other forms of misconduct, and encourages \nthe Office to sustain action with a view to strengthening and enforcing the zero-\ntolerance approach; \n \n78. Expresses concern that the needs required to protect and assist persons of \nconcern to the Office of the High Commissioner continue to increase and that the gap \nbetween global needs and available resources continues to grow, appreciates the \ncontinued and increasing hospitality of host countries and generosity of donors, and \ntherefore calls upon the Office to further enhance efforts to broaden its donor base so \nas to achieve greater burden- and responsibility-sharing by reinforcing cooperation \nwith governmental donors, non-governmental donors and the private sector; \n \n79. Recognizes that adequate and timely resources are essential for the Office \nof the High Commissioner to continue to fulfil the mandate conferred upon it through \nits statute11 and by subsequent General Assembly resolutions on refugees and other \npersons of concern, recalls its resolution 58/153 and subsequent resolutions on the \nOffice of the High Commissioner concerning, inter alia, the implementation of \nparagraph 20 of the statute of the Office, and urges Governments and other donors to \nrespond promptly to annual and supplementary appeals issued by the Office for \nrequirements under its programmes, keeping in mind the importance of unearmarked \nand other flexible funding;  \n \n80. Acknowledges with appreciation the cooperation of the Office of the High \nCommissioner with development partners, noting the advantages of complementarity \nof funding sources to support refugees and host communities as requested by host \nGovernments, and the importance of doing so in a manner that does not negatively \nimpact or reduce support for broader development objectives in host countries and, \nwhere appropriate, countries of origin; \n \n81. Renews its call upon all States and other relevant stakeholders to provide \nthe necessary support for the implementation of the Global Compact on Refugees and \nits comprehensive refugee response framework with a view to sharing the burden and \nresponsibilities for hosting and supporting refugees, while recognizing contributions \nalready made to ensure timely, adequate, flexible and needs-driven humanitarian \nassistance, and underscores the critical importance of additional development support \nover and above regular development assistance for host countries and countries of \norigin in a spirit of partnership, respecting country ownership and leadership; \n \n82. Urges all States and relevant non-governmental and other organizations, \nin conjunction with the Office of the High Commissioner, in a spirit of international \nsolidarity and burden- and responsibility-sharing, to cooperate and to mobilize \nresources, including through financial and in-kind assistance, as well as direct aid to \nhost countries, countries of origin, refugee populations and the communities hosting \nthem, with a view to enhancing their capacity and reducing the heavy burden borne \nby countries and communities hosting refugees, in particular those that have received \nlarge numbers of refugees and asylum-seekers, and whose generosity is appreciated; \n \n83. Calls upon the Office of the High Commissioner to continue to play its \ncatalytic role in mobilizing assistance from the international community to address \nthe root causes, as well as the environmental, development, security and social \nimpacts and economic and financial constraints faced by developing countries hosting \nrefugee populations, in particular the least developed countries, and countries with \neconomies in transition, and notes with appreciation those States, organizations and \nindividuals that contribute to improving the conditions for refugees through building \n__________________ \n \n11  Resolution 428 (V), annex. \n\nOffice of the United Nations High Commissioner for Refugees \nA/RES/78/184\n \n13/13\n23-26027 \n \ntheir resilience and that of their host communities, while working towards addressing \nroot causes and the attainment of durable solutions; \n \n84. Requests the High Commissioner to report on his annual activities to the \nGeneral Assembly at its seventy-ninth session. \n \n50th plenary meeting \n19 December 2023 \n \n",
  "paragraphs": {
    "1": "Welcomes the important work undertaken by the Office of the United Nations High Commissioner for Refugees and its Executive Committee in the course of the year, which is aimed at strengthening the international protection regime and assisting Governments in meeting protection responsibilities, and underlines the importance of seeking durable solutions, and the significance of the Office\u2019s efforts to promote addressing root causes, within its mandate;",
    "2": "Endorses the report of the Executive Committee of the Programme of the United Nations High Commissioner for Refugees on the work of its seventy-fourth session;",
    "3": "Recognizes the relevance of the Executive Committee\u2019s practice of adopting conclusions, welcomes the adoption of a multi-year workplan for the Executive Committee conclusions at its seventy-fourth session, and encourages the Executive Committee to continue the process of adopting conclusions;",
    "4": "Reaffirms the 1951 Convention relating to the Status of Refugees 3 and the 1967 Protocol thereto 4 as the foundation of the international refugee protection regime, recognizes the importance of their full and effective application by States parties and the values they embody, notes with satisfaction that 149 States are now parties to one or both instruments, encourages States not parties to consider acceding to those instruments and States parties with reservations to give consideration to withdrawing them, underlines, in particular, the importance of full respect for the principle of non-refoulement, and recognizes that a number of States not parties to __________________ 3 United Nations, Treaty Series, vol. 189, No. 2545. 4 Ibid., vol. 606, No. 8791. Office of the United Nations High Commissioner for Refugees A/RES/78/184 3/13 23-26027 the international refugee instruments have shown a generous approach to hosting refugees;",
    "5": "Urges States that are parties to the 1951 Convention relating to the Status of Refugees and the 1967 Protocol thereto to respect their obligations in letter and spirit;",
    "6": "Re-emphasizes that the protection of refugees is primarily the responsibility of States, whose full and effective cooperation, action and political resolve are required to enable the Office of the High Commissioner to fulfil its mandated functions, and strongly emphasizes the importance of active international solidarity and burden- and responsibility-sharing;",
    "7": "Welcomes recent accessions to the 1954 Convention relating to the Status of Stateless Persons5 and the 1961 Convention on the Reduction of Statelessness, 6 notes that 97 States are now parties to the 1954 Convention and 79 States are parties to the 1961 Convention, encourages States that have not done so to give consideration to acceding to those instruments, notes the work of the United Nations High Commissioner for Refugees with regard to identifying stateless persons, preventing and reducing statelessness and protecting stateless persons, and urges the Office of the High Commissioner to continue to work in this area in accordance with relevant General Assembly resolutions and Executive Committee conclusions;",
    "8": "Re-emphasizes that prevention and reduction of statelessness are primarily the responsibility of States, in appropriate cooperation with the international community, encourages the fulfilment of the goals of the I Belong campaign to end statelessness, including through the implementation by States of pledges made at the high-level segment that took place at the start of the seventieth plenary session of the Executive Committee, and encourages all States to consider actions they may take to further accelerate the prevention and reduction of statelessness;",
    "9": "Re-emphasizes that protection of, assistance to and achieving durable solutions for internally displaced persons are primarily the responsibility of States, in appropriate cooperation with the international community, in line with applicable international law, and taking into consideration international and regional norms and standards, as appropriate, and welcomes efforts by States to incorporate such norms and standards into domestic law and national development plans, aimed at, inter alia, facilitating voluntary, safe, sustainable and dignified return, local integration or relocation in their own country;",
    "10": "Recognizes the importance of the Secretary-General\u2019s Action Agenda on Internal Displacement, calls for sustained momentum on this important issue, and encourages the Office of the High Commissioner, in coordination with the Special Adviser on Solutions to Internal Displacement, to contribute to the United Nations system\u2019s collective efforts to advance durable solutions, with ownership and leadership of affected States;",
    "11": "Notes the activities of the Office of the High Commissioner related to the protection of, assistance to and durable solutions for internally displaced persons, including in the context of inter-agency arrangements in this field, emphasizes that such activities should be carried out with the full consent of the affected States, consistent with relevant General Assembly resolutions, and should not undermine the refugee mandate of the Office, and encourages the High Commissioner to continue his support for States in this regard; __________________ 5 Ibid., vol. 360, No. 5158. 6 Ibid., vol. 989, No. 14458. A/RES/78/184 Office of the United Nations High Commissioner for Refugees 23-26027 4/13",
    "12": "Encourages the Office of the High Commissioner to continue to respond adequately to emergencies, in accordance with its mandate and in cooperation with States, notes the ongoing measures to reinforce its capacity to respond to emergencies, and encourages the Office to redouble its efforts to ensure a more predictable, effective and timely response;",
    "13": "Also encourages the Office of the High Commissioner to work in partnership and full cooperation with relevant national authorities, United Nations offices and agencies, international and intergovernmental organizations, regional organizations, the private sector and non-governmental organizations to continue to contribute to the development of humanitarian response capacities at all levels;",
    "14": "Welcomes the efforts by the Office of the High Commissioner to ensure an inclusive, transparent, predictable and well-coordinated response to refugees, as well as internally displaced persons and other persons of concern, consistent with its mandate, and in this regard takes note of the refugee coordination model;",
    "15": "Notes the significant global and regional initiatives, conferences and summits undertaken to strengthen international solidarity with and cooperation for refugees and other persons of concern, and encourages those who participated to implement their commitments made therein;",
    "16": "Recalls the adoption of the New York Declaration for Refugees and Migrants7 at the high-level plenary meeting of the General Assembly on addressing large movements of refugees and migrants, on 19 September 2016, and encourages States to implement relevant commitments made therein;",
    "17": "Also recalls the Global Compact on Refugees,8 affirmed on 17 December 2018,9 and calls upon the international community as a whole, including States and other relevant stakeholders, to implement the Compact to achieve its four objectives on an equal footing based on the principle of burden- and responsibility-sharing, and in accordance with the guiding principles and paragraph 4 of the Global Compact on Refugees, through concrete actions, pledges and contributions;",
    "18": "Welcomes the pledges, contributions and commitments made at the first Global Refugee Forum, in December 2019, as well as the sustained engagement of States and other relevant stakeholders in the implementation of pledges and in their review process at the first meeting of high-level officials in December 2021, also welcomes the High Commissioner\u2019s regular progress report, and encourages engagement in the second Global Refugee Forum, in December 2023;",
    "19": "Underlines the centrality of international cooperation to the refugee protection regime, recognizes the burden that large movements of refugees place on major and long-standing refugee-hosting countries and communities, as well as their national resources, especially in the case of developing countries, and calls for a more equitable sharing of the burden and responsibility for hosting and supporting the world\u2019s refugees, addressing the needs of refugees and hosting States, while taking account of existing contributions and the differing capacities and resources among States;",
    "20": "Expresses concern over the significant challenges associated with hosting, protecting and integrating refugees in national systems and strategies, given socioeconomic difficulties and stretched resources, affecting, inter alia, infrastructure, social security and the provision of protection services, education, __________________ 7 Resolution 71/1. 8 Official Records of the General Assembly, Seventy-third Session, Supplement No. 12 (A/73/12 (Part I) and A/73/12 (Part II)), part II. 9 See resolution 73/151. Office of the United Nations High Commissioner for Refugees A/RES/78/184 5/13 23-26027 health and employment, and stresses the importance of easing pressure on host countries by facilitating more equitable, sustained and predictable burden- and responsibility-sharing among States and other relevant stakeholders;",
    "21": "Invites the High Commissioner to continue coordinating the effort to measure the impacts arising from hosting, protecting and assisting refugees, with a view to assessing gaps in international cooperation and promoting burden- and responsibility-sharing that is more equitable, predictable and sustainable, and to report on the results to Member States in 2024;",
    "22": "Emphasizes the need for robust, well-functioning, concrete arrangements and potential, complementary mechanisms for ensuring predictable, equitable, efficient and effective burden- and responsibility-sharing in the context of the Global Compact on Refugees;",
    "23": "Notes with appreciation the efforts made by the increased number of countries applying the comprehensive refugee response framework that is part of the Global Compact on Refugees, including through regional approaches, where applicable, such as the comprehensive regional protection and solutions framework (MIRPS), the Intergovernmental Authority on Development regional approach, the Solutions Strategy for Afghan Refugees and the regional cooperation framework to strengthen protection and the search for solutions for people displaced by the Central African crisis, welcomes the launch and efforts of support platforms established for these mechanisms, as concrete arrangements to support responsibility-sharing, and encourages States, and other stakeholders, to continue their efforts to address the needs of the people who require international protection, including through support for host communities;",
    "24": "Calls upon the Office of the High Commissioner and partners to effectively provide and facilitate further support for States in different situations, enabling them to build and expand the capacity of national systems to protect persons of concern to the Office and to the communities hosting them, as well as support for durable solutions and emergency responses, consistent with the principles of burden- and responsibility-sharing, taking into account the importance of national ownership and leadership;",
    "25": "Calls upon States and other stakeholders that have not yet contributed to burden- and responsibility-sharing to do so, with a view to broadening the support base, in a spirit of international solidarity and cooperation;",
    "26": "Recognizes the importance of meaningful refugee participation and of integrating the perspectives of refugees and other persons of concern to the Office of the High Commissioner in humanitarian responses;",
    "27": "Requests the Office of the High Commissioner to continue improving its humanitarian assistance response, and stresses the importance of tailored, innovative approaches, including effective cash-based interventions;",
    "28": "Highlights the importance for States and the Office of the High Commissioner to have, when possible, high-quality and disaggregated data, in accordance with data protection and data privacy principles, and stresses the importance of interoperable data collection and analysis within the United Nations system, consistent with relevant United Nations provisions relating to data, further calls for strengthened coordination in this regard, and welcomes the collaboration of the Office of the High Commissioner with key data actors, development partners and States, including through the Joint Data Center on Forced Displacement, in order to promote evidence-based programming and policymaking at all levels to better target and monitor assistance; A/RES/78/184 Office of the United Nations High Commissioner for Refugees 23-26027 6/13",
    "29": "Encourages the Office of the High Commissioner to continue to work with the Office for the Coordination of Humanitarian Affairs of the Secretariat to enhance the coordination, effectiveness and efficiency of humanitarian response and to contribute, in consultation with States, as appropriate, to making further progress towards common humanitarian needs assessments, as stated, among other important issues, in General Assembly resolution 77/28 on the strengthening of the coordination of emergency humanitarian assistance of the United Nations, and recalls the role of the Office of the High Commissioner as the leading entity of the clusters for protection, camp coordination and camp management and emergency shelter in complex emergencies;",
    "30": "Recognizes the importance of a comprehensive and principled approach to humanitarian response, in particular in protracted situations, including through early recovery activities, to strengthen the resilience of the persons of concern to the Office of the High Commissioner and their access to basic services;",
    "31": "Welcomes the active engagement of the Office of the High Commissioner in the United Nations development system reform, including as part of broader efforts towards generating system-wide effectiveness, transparency, accountability and efficiencies;",
    "32": "Expresses deep concern about the increasing threats to the safety and security of humanitarian aid workers, facilities and convoys and, in particular, the loss of life of humanitarian personnel working in the most difficult and challenging conditions in order to assist those in need, and calls upon all States and parties to armed conflict to fulfil their obligations under international humanitarian law to protect civilian populations and humanitarian personnel and facilities;",
    "33": "Emphasizes the need for States to ensure that perpetrators of attacks committed on their territory against humanitarian personnel and United Nations and associated personnel do not act with impunity and that the perpetrators of such acts are promptly brought to justice as provided for by national laws and obligations under international law;",
    "34": "Strongly condemns attacks on refugees, asylum-seekers, stateless persons and internally displaced persons and acts that pose a threat to their personal security and well-being, calls upon all States concerned and, where applicable, parties involved in an armed conflict to take all measures necessary to respect and ensure respect for human rights, and international humanitarian law, and urges all States to fight racism and all forms of discrimination and intolerance, including racial discrimination, xenophobia, hate speech, stigmatization and stereotyping;",
    "35": "Urges States to uphold the civilian and humanitarian character of camps and settlements for refugees and internally displaced persons, inter alia, through effective measures to prevent the infiltration of armed elements, to identify and separate any such armed elements from refugee populations, to settle refugees and internally displaced persons in secure locations and to afford to the Office of the High Commissioner and, where appropriate, to other humanitarian organizations prompt, unhindered and safe access to asylum-seekers, refugees and other persons of concern;",
    "36": "Emphasizes that the international protection of refugees is a dynamic and action-oriented function that is at the core of the mandate of the Office of the High Commissioner and that it includes, in cooperation with States and other partners, the promotion and facilitation of the admission, reception and treatment of refugees in accordance with internationally agreed standards and the ensuring of durable, protection-oriented solutions, bearing in mind the particular needs of the most vulnerable, and notes in this context that the delivery of international protection is a Office of the United Nations High Commissioner for Refugees A/RES/78/184 7/13 23-26027 staff-intensive service that requires adequate staff with the appropriate expertise, especially at the field level;",
    "37": "Calls upon States to process asylum applications by duly identifying those in need of international protection, in accordance with their applicable international and regional obligations, so as to strengthen the refugee protection regime;",
    "38": "Deplores the growing number of incidents of refoulement and unlawful expulsion of refugees and asylum-seekers, as well as practices of denial of access to asylum, and calls upon all States concerned to respect the relevant principles of refugee protection and human rights;",
    "39": "Stresses the importance of preventing abuse of asylum systems, including for political purposes, in order to safeguard the efficiency and functionality of asylum systems for those in need of international protection;",
    "40": "Notes with increasing concern that asylum-seekers, refugees and stateless persons are subject to arbitrary detention in numerous situations and encourages working towards the ending of this practice, welcomes the increasing use of alternatives to detention, especially in the case of children, and emphasizes the need for States to limit detention of asylum-seekers, refugees and stateless persons to that which is necessary, giving full consideration to possible alternatives;",
    "41": "Notes with grave concern the significant risks to which many persons of concern to the Office of the High Commissioner are exposed as they attempt to reach safety, and encourages international cooperation to step up efforts to prevent and combat human trafficking and smuggling and to ensure adequate response mechanisms, including, as appropriate, life-saving measures, reception, registration and assistance, including trauma-informed assistance for victims of human trafficking and smuggling, as well as to ensure that safe and regular access to asylum for persons in need of international protection remains open and accessible;",
    "42": "Expresses grave concern at the large number of asylum-seekers who have lost their lives or gone missing at sea and on land trying to reach safety, encourages international cooperation to further strengthen prevention, search and rescue mechanisms that are in accordance with international law, and commends the great life-saving efforts and actions taken by a number of States in this regard;",
    "43": "Notes that the lack of civil registration and related documentation makes persons vulnerable to statelessness and associated protection risks, recognizes that birth registration provides an official record of a child\u2019s legal identity and is crucial to preventing and reducing statelessness, and welcomes efforts by States to ensure the birth registration of children and other essential documentation;",
    "44": "Notes with concern that arbitrary deprivation of nationality pushes people into statelessness and is a source of widespread suffering, and calls upon States to refrain from adopting discriminatory measures and from enacting or maintaining legislation that would arbitrarily revoke citizenship of their nationals, rendering a person stateless;",
    "45": "Expresses grave concern over the unprecedented scale of the global food security and nutrition crisis and the impacts this will have on persons of concern to the Office of the High Commissioner, who are already in a situation of vulnerability, and calls upon States, humanitarian and development organizations and other relevant partners to take coordinated and immediate action to save lives and reduce suffering in countries at risk of famine, food insecurity, hunger and acute malnutrition, and in this regard takes note of the work of the Secretary-General\u2019s Global Crisis Response Group on Food, Energy and Finance and the Committee on World Food Security, A/RES/78/184 Office of the United Nations High Commissioner for Refugees 23-26027 8/13 bearing in mind its resolution 76/264 of 23 May 2022 on the state of global food insecurity and measures contained to reinforce global food security;",
    "46": "Also expresses grave concern about the negative long-term impact of continued cuts in food rations on the nutrition, health and well-being of refugees and hosting communities globally and especially its impacts on women and children, owing to insufficient funding and increased costs, and calls upon donors to ensure sustained support for the Office of the High Commissioner and the World Food Programme, while looking to provide refugees with alternatives to food assistance, pending a durable solution;",
    "47": "Recognizes that the COVID-19 pandemic requires a global response to ensure that all States, in particular developing States, including refugee-hosting countries as well as the countries of origin, have universal, timely, effective and equitable access to safe and effective diagnostics, therapeutics, medicines, vaccines and medical supplies and equipment, calls upon States and other partners to urgently support funding and further explore innovative financing mechanisms aimed at ensuring equitable access to COVID-19 vaccines for all, including persons of concern to the Office of the High Commissioner and their host communities, bearing in mind that extensive immunization against COVID-19 is a global public good for health in preventing, containing and stopping transmission as countries transition to pandemic recovery, and to ensure that refugees can access correct information to avoid the negative impact of disinformation and misinformation, and stresses the need to adequately prepare for and respond to future public health emergencies of international concern;",
    "48": "Encourages States and the Office of the High Commissioner to address mental health and psychosocial well-being by promoting the availability and affordability of mental health and psychosocial support to persons of concern to the Office, as well as host communities, and encourages the further strengthening of such measures, including through additional international support;",
    "49": "Recognizes the generosity of host countries and their differentiated experiences and situations, and in particular welcomes the positive steps taken by individual States to open their labour markets to refugees;",
    "50": "Notes with appreciation the contributions of refugees in host countries and countries of resettlement, including facilitating the generation of decent work opportunities, with the purpose of developing sustainable livelihoods until durable solutions are achieved, and recalls that further international cooperation is needed in support of host communities, particularly in long-standing refugee-hosting countries;",
    "51": "Notes the importance of age, gender and diversity mainstreaming in analysing protection needs and ensuring the participation of refugees and other persons of concern to the Office of the High Commissioner, as appropriate, in the planning and implementation of programmes of the Office and of State policies, affirms the importance of according priority to addressing discrimination, gender inequality and the problem of sexual and gender-based violence, recognizing the importance of addressing the protection needs and rights of women, children and persons with disabilities in particular, through an inclusive approach, and underlines the importance of continuing to work on those issues;",
    "52": "Encourages States and the Office of the High Commissioner to ensure that the perspectives of women and girls in situations of displacement are taken into account by promoting their meaningful participation in matters affecting them, as well as women\u2019s full and equal participation in the design, implementation, follow-up and evaluation of policies, programmes and activities related to humanitarian response; Office of the United Nations High Commissioner for Refugees A/RES/78/184 9/13 23-26027",
    "53": "Calls upon Member States, in cooperation with the Office of the High Commissioner and with the support of other stakeholders, to ensure that the humanitarian needs of persons of concern to the Office of the High Commissioner, and their host communities, including clean water, food and nutrition, shelter, education, livelihoods, energy, health, including sexual and reproductive health, and other protection needs, are addressed as components of humanitarian response, including through providing timely and adequate resources, while ensuring that their collaborative efforts fully adhere to humanitarian principles;",
    "54": "Welcomes and calls upon States, the Office of the High Commissioner and other stakeholders to promote gender equality and the empowerment of women, and in this regard urges Member States, in cooperation with the Office of the High Commissioner, and with the support of other stakeholders, to ensure reliable and safe access for persons of concern to the Office of the High Commissioner to sexual and reproductive health-care services, as well as basic health-care services and psychosocial support from the onset of emergencies, while recognizing that relevant services are important in order to effectively meet the needs of women and adolescent girls and infants and protect them from preventable mortality and morbidity that occur in humanitarian emergencies;",
    "55": "Encourages States to put in place appropriate systems and procedures to ensure that the best interests of the child are a primary consideration with regard to all actions concerning refugee children and to protect them from all forms of abuse, neglect, exploitation and violence, while taking into account the situation of those with disabilities;",
    "56": "Encourages States and the Office of the High Commissioner to support and enable the full and meaningful participation of persons with disabilities, including those in particularly vulnerable situations, and their representative organizations, in the design, implementation, follow-up and evaluation of policies, programmes and activities related to humanitarian response, and to consult relevant experts on the rights of persons with disabilities, and further requests the Office to continue its work on the implementation of the United Nations Disability Inclusion Strategy and to regularly report to the Executive Committee on its progress;",
    "57": "Notes with concern that a large proportion of the world\u2019s out-of-school population lives in conflict-affected areas, and calls upon States, in their implementation of the Global Compact on Refugees, to lend support to host countries in providing quality primary, secondary and tertiary education in safe learning environments for all refugee children, youth and adults, and to develop more inclusive, responsive and resilient education systems to meet the needs of children, youth and adults in these contexts, including internally displaced persons and refugees,10 and underlines the importance of quality education in countries of origin and the role of international cooperation in this regard;",
    "58": "Welcomes the increased attention and efforts of the Office of the High Commissioner to address and respond to matters related to the impact of climate change in its work, including the adoption of a strategic framework for climate action, within its mandate, in consultation with national authorities and in cooperation with competent agencies;",
    "59": "Calls upon States to take appropriate measures to address climate change, including with a view to building local and national resilience and capacity to prevent, prepare for and respond to displacement in this context in particular in developing __________________ 10 See United Nations Educational, Scientific and Cultural Organization, Final Report of the World Education Forum 2015, Incheon, Republic of Korea, 19\u201322 May 2015 (Paris, 2015). A/RES/78/184 Office of the United Nations High Commissioner for Refugees 23-26027 10/13 countries, including in small island developing States and the least developed countries;",
    "60": "Calls upon donors, the Office of the High Commissioner and other stakeholders to mobilize and provide additional support for adaptation and mitigation of environmental impacts of hosting large numbers of refugees and other forcibly displaced people, including by supporting renewable energy, environmental protection and rehabilitation initiatives for refugees and other forcibly displaced people and their host communities;",
    "61": "Recognizes the importance of achieving durable solutions to refugee situations and, in particular, the need to address in this process their root causes;",
    "62": "Strongly reaffirms the fundamental importance and the purely humanitarian and non-political character of the function of the Office of the High Commissioner of providing international protection to refugees and seeking durable solutions for them and for refugee situations, and recalls that those solutions include voluntary repatriation and, where appropriate and feasible, local integration and resettlement in a third country, while reaffirming that voluntary repatriation, supported, as necessary, by rehabilitation and development assistance to facilitate sustainable reintegration, remains the preferred solution;",
    "63": "Expresses concern about the particular difficulties faced by the millions of refugees in protracted situations, recognizes with deep concern that the average length of stay has continued to grow, and emphasizes the need to redouble international efforts and cooperation to find practical and comprehensive approaches to resolving the plight of refugees and to realize durable solutions, consistent with international law and relevant General Assembly resolutions;",
    "64": "Encourages further efforts by the Office of the High Commissioner, in cooperation with countries hosting refugees and countries of origin, including their respective local communities, relevant United Nations agencies, international and intergovernmental organizations, regional organizations, as appropriate, non- governmental organizations and development actors, to actively promote durable solutions, particularly in protracted refugee situations, with a focus on sustainable, timely, voluntary, safe and dignified return, which encompasses repatriation, reintegration, rehabilitation and reconstruction activities, and encourages States and other relevant actors to continue to support these efforts through, inter alia, the allocation of funds;",
    "65": "Recalls the purely humanitarian and non-political character of the Office of the High Commissioner, calls upon the international community and the Office to coordinate and exert further efforts to promote and facilitate, whenever the prevailing circumstances are deemed appropriate, the safe, dignified and voluntary repatriation of refugees, through their free and informed choice, in a sustainable manner, to their countries of origin, and encourages the Office and, where appropriate, other United Nations agencies, to mobilize further resources in this regard;",
    "66": "Expresses concern about the current low level of voluntary repatriation, encourages the solution-oriented approach pursued by the Office of the High Commissioner to support the sustainability of voluntary repatriation and reintegration, including from the onset of displacement, and in this regard urges the Office to further strengthen partnerships with national Governments and development actors, as well as international financial institutions;",
    "67": "Recognizes, in the context of voluntary repatriation, the importance of resolute efforts in the country of origin, including rehabilitation and development assistance, to foster the voluntary, safe and dignified return and sustainable reintegration of refugees and to ensure the restoration of national protection; Office of the United Nations High Commissioner for Refugees A/RES/78/184 11/13 23-26027",
    "68": "Acknowledges with appreciation voluntary action taken by several host countries to enable permanent residence and naturalization for refugees and former refugees;",
    "69": "Recognizes the importance of resettlement as a strategic protection tool and a durable solution for refugees in reducing the pressure on refugee-hosting countries in protracted situations, as a measure for international protection, as well as in opening possibilities for other durable solutions;",
    "70": "Calls upon States and the Office of the High Commissioner to create expanded opportunities for inclusive and non-discriminatory resettlement as a durable solution, broaden the base of countries and actors engaged, expand the scope and size, and maximize the protection and quality of resettlement as an invaluable tool for burden- and responsibility-sharing, and acknowledges with appreciation countries that continue to offer enhanced resettlement opportunities;",
    "71": "Reaffirms that accelerating complementary pathways to solutions is crucial for addressing protracted refugee situations, and recognizes the importance of the work of the Office of the High Commissioner for seeking durable solutions for refugees, in accordance with its mandate;",
    "72": "Calls upon States to consider creating, expanding or facilitating access to complementary and sustainable pathways to protection and solutions for refugees, in cooperation with relevant partners, including the private sector, where appropriate, including through humanitarian admission or transfer, family reunification, skilled migration, labour mobility schemes, scholarships and education mobility schemes;",
    "73": "Notes the importance of States and the Office of the High Commissioner discussing and clarifying the role of the Office in mixed movements in order to better address protection needs of people in the context of mixed movements, bearing in mind the particular needs of persons in vulnerable situations, especially women, children and persons with disabilities, including by safeguarding access to asylum for those in need of international protection, and also notes the readiness of the High Commissioner, consistent with his mandate, to assist States in fulfilling their protection responsibilities in this regard;",
    "74": "Emphasizes the obligation of all States to accept the return of their nationals, calls upon States to facilitate the return of their nationals who have been determined not to be in need of international protection, in collaboration with the Office of the High Commissioner and other relevant stakeholders, as appropriate, and affirms the need for the return of persons to be undertaken in a safe and humane manner and with full respect for their human rights and dignity, irrespective of the status of the persons concerned;",
    "75": "Notes the transformation process that the High Commissioner is implementing to establish clearer authorities and lines of accountability, including through regionalization and decentralization, to enable a more timely, relevant and efficient response to the needs of persons of concern and to ensure the effective and transparent use of the Office\u2019s resources;",
    "76": "Affirms the importance of a geographically diverse, inclusive and representative workforce, with a view to reflecting the international character of the Office of the High Commissioner, and calls upon the Office to take effective measures to ensure balanced geographical representation across the regions, in particular from underrepresented States and large refugee-hosting States, among its workforce both at headquarters and in the field, with due consideration for gender parity, racial equality, disability and age, particularly at the senior level, which will also promote a better understanding of the working environment; A/RES/78/184 Office of the United Nations High Commissioner for Refugees 23-26027 12/13",
    "77": "Welcomes the commitment and efforts of the Office of the High Commissioner to prevent, mitigate and respond to sexual exploitation and abuse, sexual harassment, fraud, corruption and other forms of misconduct, and encourages the Office to sustain action with a view to strengthening and enforcing the zero- tolerance approach;",
    "78": "Expresses concern that the needs required to protect and assist persons of concern to the Office of the High Commissioner continue to increase and that the gap between global needs and available resources continues to grow, appreciates the continued and increasing hospitality of host countries and generosity of donors, and therefore calls upon the Office to further enhance efforts to broaden its donor base so as to achieve greater burden- and responsibility-sharing by reinforcing cooperation with governmental donors, non-governmental donors and the private sector;",
    "79": "Recognizes that adequate and timely resources are essential for the Office of the High Commissioner to continue to fulfil the mandate conferred upon it through its statute11 and by subsequent General Assembly resolutions on refugees and other persons of concern, recalls its resolution 58/153 and subsequent resolutions on the Office of the High Commissioner concerning, inter alia, the implementation of paragraph 20 of the statute of the Office, and urges Governments and other donors to respond promptly to annual and supplementary appeals issued by the Office for requirements under its programmes, keeping in mind the importance of unearmarked and other flexible funding;",
    "80": "Acknowledges with appreciation the cooperation of the Office of the High Commissioner with development partners, noting the advantages of complementarity of funding sources to support refugees and host communities as requested by host Governments, and the importance of doing so in a manner that does not negatively impact or reduce support for broader development objectives in host countries and, where appropriate, countries of origin;",
    "81": "Renews its call upon all States and other relevant stakeholders to provide the necessary support for the implementation of the Global Compact on Refugees and its comprehensive refugee response framework with a view to sharing the burden and responsibilities for hosting and supporting refugees, while recognizing contributions already made to ensure timely, adequate, flexible and needs-driven humanitarian assistance, and underscores the critical importance of additional development support over and above regular development assistance for host countries and countries of origin in a spirit of partnership, respecting country ownership and leadership;",
    "82": "Urges all States and relevant non-governmental and other organizations, in conjunction with the Office of the High Commissioner, in a spirit of international solidarity and burden- and responsibility-sharing, to cooperate and to mobilize resources, including through financial and in-kind assistance, as well as direct aid to host countries, countries of origin, refugee populations and the communities hosting them, with a view to enhancing their capacity and reducing the heavy burden borne by countries and communities hosting refugees, in particular those that have received large numbers of refugees and asylum-seekers, and whose generosity is appreciated;",
    "83": "Calls upon the Office of the High Commissioner to continue to play its catalytic role in mobilizing assistance from the international community to address the root causes, as well as the environmental, development, security and social impacts and economic and financial constraints faced by developing countries hosting refugee populations, in particular the least developed countries, and countries with economies in transition, and notes with appreciation those States, organizations and individuals that contribute to improving the conditions for refugees through building __________________ 11 Resolution 428 (V), annex. Office of the United Nations High Commissioner for Refugees A/RES/78/184 13/13 23-26027 their resilience and that of their host communities, while working towards addressing root causes and the attainment of durable solutions;",
    "84": "Requests the High Commissioner to report on his annual activities to the General Assembly at its seventy-ninth session. 50th plenary meeting 19 December 2023"
  },
  "agenda_items": [
    "Item 60"
  ],
  "symbol_references": []
}