{
  "symbol": "A/RES/77/55",
  "filename": "A_RES_77_55.pdf",
  "title": "77/55. Women, disarmament, non-proliferation and arms control",
  "text": "United Nations \nA/RES/77/55\n \n \nGeneral Assembly \nDistr.: General \n13 December 2022 \n \n22-28170 (E)    161222    \n*2228170* \n \n \nSeventy-seventh session \nAgenda item 99 (gg) \nGeneral and complete disarmament: women, disarmament, \nnon-proliferation and arms control  \n \n \n \n \n Resolution adopted by the General Assembly \non 7 December 2022 \n \n \n \n \n[on the report of the First Committee (A/77/385, para. 110)] \n \n \n \n77/55. Women, disarmament, non-proliferation and arms control \n \n \n \nThe General Assembly, \n \nRecalling that the Charter of the United Nations reaffirms the equal rights of \nwomen and men, \n \nRecalling also its resolutions 65/69 of 8 December 2010, 67/48 of 3 December \n2012, 68/33 of 5 December 2013, 69/61 of 2 December 2014, 71/56 of 5 December \n2016, 73/46 of 5 December 2018 and 75/48 of 7 December 2020, \n \nRecalling further General Assembly and Security Council resolutions on the \nissue of women and peace and security, \n \nRecalling the Fourth World Conference on Women and the adoption of the \nBeijing Declaration and Platform for Action,1 \n \nTaking note of action 36 of the Agenda for Disarmament of the Secretary-\nGeneral, on the full and equal participation of women in decision-making processes, \nand action 37, on gender parity on disarmament bodies established by the Secretariat, \n \nReaffirming the Sustainable Development Goals relevant to the promotion of \nwomen, disarmament, non-proliferation and arms control, and acknowledging that the \nsuccess of efforts to achieve sustainable development and disarmament depends on \nthe full and effective inclusion of women in all aspects of these efforts, \n \nWelcoming the call for the full, equal and meaningful participation of women in \nefforts to prevent, combat and eradicate the illicit transfer of small arms, pursuant to \nSecurity Council resolutions 2106 (2013) of 24 June 2013, 2117 (2013) of \n__________________ \n \n1 Report of the Fourth World Conference on Women, Beijing, 4\u201315 September 1995 (United \nNations publication, Sales No. E.96.IV.13), chap. I, resolution 1, annexes I and II. \n\nA/RES/77/55 \nWomen, disarmament, non-proliferation and arms control\n \n22-28170\n2/4 \n \n26 September 2013, 2122 (2013) of 18 October 2013 and 2220 (2015) of 22 May \n2015, \n \nReaffirming that the full, equal and meaningful participation of both women and \nmen is one of the essential factors for the promotion and attainment of sustainable \npeace and security, \n \nRecognizing that women should not only be perceived as victims and survivors \nof gender-based armed violence, but are also essential in preventing and reducing armed \nviolence, and are active and key players in advocating for arms control, disarmament \nand non-proliferation, \n \nRecognizing also the valuable contribution of women to practical disarmament \nmeasures carried out at the local, national, subregional, regional and global levels in \nthe prevention and reduction of armed violence and armed conflict, and in promoting \ndisarmament, non-proliferation and arms control, \n \nRecalling its resolution 76/45 of 6 December 2021, in which it reaffirms the \nimportant and positive contribution that young people can make to the promotion and \nattainment of sustainable peace and security, \n \nRecognizing that the role of women in disarmament, non-proliferation and arms \ncontrol should be further developed and in particular the need to facilitate the \nparticipation and representation of women in policymaking, planning and \nimplementation processes related to disarmament, non-proliferation and arms control, \n \nRecalling the entry into force of the Arms Trade Treaty,2 therefore reiterating \nthe need for States parties to ensure the full, equal and meaningful participation of \nwomen and men in pursuing the object and purpose of all provisions of the Treaty, \nand welcoming the inclusion of the provisions on serious acts of gender-based \nviolence and on violence against children, while also recalling the adoption of the \naction-oriented decision on gender and gender-based violence at the Fifth Conference \nof States Parties to the Arms Trade Treaty, \n \nWelcoming the outcome of the Eighth Biennial Meeting of States to Consider \nthe Implementation of the Programme of Action to Prevent, Combat and Eradicate \nthe Illicit Trade in Small Arms and Light Weapons in All Its Aspects, \n \nNoting with appreciation the efforts of Member States to increase the \nparticipation of women in their national and regional coordination mechanisms on \ndisarmament-related matters, including in efforts to prevent, combat and eradicate the \nillicit trade in small arms and light weapons in all its aspects, \n \nRecognizing the important role played by civil society organizations in \npromoting the role of women in disarmament, non-proliferation and arms control, \n \nTaking into consideration the impact of the coronavirus disease (COVID-19) \npandemic on the progress made in gender equality, multilateral disarmament and arms \ncontrol, and acknowledging that the pandemic has further exacerbated the \nsocioeconomic conditions of people in vulnerable situations across the world, which \nhas resulted in the intensification of tensions and an alarming increase in cases of \ndomestic and gender-based armed violence, \n \n1. \nUrges Member States, relevant subregional and regional organizations, the \nUnited Nations and the specialized agencies to promote equal opportunities for the \nrepresentation of women in all decision-making processes with regard to matters \nrelated to disarmament, non-proliferation and arms control, in particular as it relates \nto the prevention and reduction of armed violence and armed conflict; \n__________________ \n \n2 United Nations, Treaty Series, vol. 3013, No. 52373. \n\nWomen, disarmament, non-proliferation and arms control \nA/RES/77/55\n \n3/4\n22-28170 \n \n \n2. \nWelcomes the report of the Secretary-General on the measures taken by \nMember States to implement General Assembly resolution 75/48;3 \n \n3. \nAlso welcomes the continuing efforts of the United Nations organs, \nagencies, funds and programmes to accord high priority to the issue of women and \npeace and security, particularly in assisting Member States in the implementation of \nall resolutions related to women in the context of peace and security, and in this regard \nnotes the important role of the United Nations Entity for Gender Equality and the \nEmpowerment of Women (UN-Women); \n \n4. \nEncourages Member States to better understand the impact of armed \nviolence, in particular the impact of the illicit trafficking in small arms and light \nweapons on women and girls, through, inter alia, the development of national action \nplans on women and peace and security, strengthening the collection of data, where \nfeasible disaggregated by income, sex, age, race, ethnicity, marital status, migration \nstatus, disability, geographical location and other characteristics relevant in national \ncontexts, and utilizing analysis mechanisms to inform evidence-based, gender-sensitive \npolicymaking and programming; \n \n5. \nCalls upon Member States to take account of the differing impacts of the \nillicit trade in small arms and light weapons on women, men, girls and boys and to \nstrengthen or develop, where they do not exist, response mechanisms to address such \nimpacts; \n \n6. \nEncourages Member States to mainstream a gender perspective into their \nimplementation efforts to address the differential impact of the illicit trade in small \narms and light weapons on women, men, girls and boys; \n \n7. \nUrges Member States to support and strengthen the full, equal, meaningful \nand effective participation of women in organizations in the field of disarmament at \nthe local, national, subregional, regional and global levels; \n \n8. \nCalls upon all States to empower women, including through mentoring, \nnetworking, knowledge-sharing and capacity-building efforts, as appropriate, to \nparticipate in the design and implementation of disarmament, non-proliferation and \narms control efforts; \n \n9. \nEncourages States to seriously consider increasing funding for policies \nand programmes, advocacy, education, training and research that take account of the \ndiffering impacts of illicit small arms and light weapons on women, men, girls and \nboys; \n \n10. Calls upon all States to develop appropriate and effective national risk \nassessment criteria to facilitate the prevention of the use of arms to commit violence \nagainst women; \n \n11. \nUrges Member States to voluntarily share good practices and experiences \nof the successes of the role of women at the national, regional and global levels, in \norder to promote and strengthen coordination and cooperation in disarmament, \nnon-proliferation and arms control; \n \n12. Requests the relevant United Nations organs, agencies, funds and \nprogrammes to assist States, upon request, in promoting the role of women in \ndisarmament, non-proliferation and arms control, including in preventing, combating \nand eradicating the illicit trade in small arms and light weapons; \n \n13. Requests the Secretary-General to seek the views of Member States on \nways and means of promoting the role of women in disarmament, non-proliferation \n__________________ \n \n3 A/77/122. \n\nA/RES/77/55 \nWomen, disarmament, non-proliferation and arms control\n \n22-28170\n4/4 \n \nand arms control and to report to the General Assembly at its seventy-ninth session \non the implementation of the present resolution; \n \n14. Decides to include in the provisional agenda of its seventy-ninth session, \nunder the item entitled \u201cGeneral and complete disarmament\u201d, the sub-item entitled \n\u201cWomen, disarmament, non-proliferation and arms control\u201d. \n \n46th plenary meeting \n7 December 2022 \n \n",
  "paragraphs": {
    "1": "Urges Member States, relevant subregional and regional organizations, the United Nations and the specialized agencies to promote equal opportunities for the representation of women in all decision-making processes with regard to matters related to disarmament, non-proliferation and arms control, in particular as it relates to the prevention and reduction of armed violence and armed conflict;",
    "2": "Welcomes the report of the Secretary-General on the measures taken by Member States to implement General Assembly resolution 75/48;3",
    "3": "Also welcomes the continuing efforts of the United Nations organs, agencies, funds and programmes to accord high priority to the issue of women and peace and security, particularly in assisting Member States in the implementation of all resolutions related to women in the context of peace and security, and in this regard notes the important role of the United Nations Entity for Gender Equality and the Empowerment of Women (UN-Women);",
    "4": "Encourages Member States to better understand the impact of armed violence, in particular the impact of the illicit trafficking in small arms and light weapons on women and girls, through, inter alia, the development of national action plans on women and peace and security, strengthening the collection of data, where feasible disaggregated by income, sex, age, race, ethnicity, marital status, migration status, disability, geographical location and other characteristics relevant in national contexts, and utilizing analysis mechanisms to inform evidence-based, gender-sensitive policymaking and programming;",
    "5": "Calls upon Member States to take account of the differing impacts of the illicit trade in small arms and light weapons on women, men, girls and boys and to strengthen or develop, where they do not exist, response mechanisms to address such impacts;",
    "6": "Encourages Member States to mainstream a gender perspective into their implementation efforts to address the differential impact of the illicit trade in small arms and light weapons on women, men, girls and boys;",
    "7": "Urges Member States to support and strengthen the full, equal, meaningful and effective participation of women in organizations in the field of disarmament at the local, national, subregional, regional and global levels;",
    "8": "Calls upon all States to empower women, including through mentoring, networking, knowledge-sharing and capacity-building efforts, as appropriate, to participate in the design and implementation of disarmament, non-proliferation and arms control efforts;",
    "9": "Encourages States to seriously consider increasing funding for policies and programmes, advocacy, education, training and research that take account of the differing impacts of illicit small arms and light weapons on women, men, girls and boys;",
    "10": "Calls upon all States to develop appropriate and effective national risk assessment criteria to facilitate the prevention of the use of arms to commit violence against women;",
    "11": "Urges Member States to voluntarily share good practices and experiences of the successes of the role of women at the national, regional and global levels, in order to promote and strengthen coordination and cooperation in disarmament, non-proliferation and arms control;",
    "12": "Requests the relevant United Nations organs, agencies, funds and programmes to assist States, upon request, in promoting the role of women in disarmament, non-proliferation and arms control, including in preventing, combating and eradicating the illicit trade in small arms and light weapons;",
    "13": "Requests the Secretary-General to seek the views of Member States on ways and means of promoting the role of women in disarmament, non-proliferation and arms control and to report to the General Assembly at its seventy-ninth session on the implementation of the present resolution;",
    "14": "Decides to include in the provisional agenda of its seventy-ninth session, under the item entitled \u201cGeneral and complete disarmament\u201d, the sub-item entitled \u201cWomen, disarmament, non-proliferation and arms control\u201d."
  },
  "agenda_items": [
    "Item 99"
  ],
  "symbol_references": []
}