{
  "symbol": "A/RES/76/136",
  "filename": "A_RES_76_136.pdf",
  "title": "76/136. Promoting social integration through social inclusion",
  "text": "United Nations \nA/RES/76/136\n \n \nGeneral Assembly \nDistr.: General \n6 January 2022 \n \n \n21-19166 (E)    110122 \n*2119166* \n \n \nSeventy-sixth session \nAgenda item 28 (b) \nSocial development: social development, including \nquestions relating to the world social situation and to \nyouth, ageing, persons with disabilities and the family \n \n \n \n \n Resolution adopted by the General Assembly \non 16 December 2021 \n \n \n \n \n[on the report of the Third Committee (A/76/454, para. 51)] \n \n \n 76/136. Promoting social integration through social inclusion \n \n \n \nThe General Assembly, \n \nRecalling the World Summit for Social Development, held in Copenhagen from \n6 to 12 March 1995, and the twenty-fourth special session of the General Assembly, \nentitled \u201cWorld Summit for Social Development and beyond: achieving social \ndevelopment for all in a globalizing world\u201d, held in Geneva from 26 June to 1 July \n2000, and noting the role of the Commission for Social Development, \n \nRecalling also Economic and Social Council resolution 2010/12 of 22 July 2010 \non promoting social integration and General Assembly resolution 74/120 of \n18 December 2019 and its previous resolutions on promoting social integration \nthrough social inclusion, \n \nReaffirming its resolution 70/1 of 25 September 2015, entitled \u201cTransforming \nour world: the 2030 Agenda for Sustainable Development\u201d, in which it adopted a \ncomprehensive, far-reaching and people-centred set of universal and transformative \nSustainable Development Goals and targets, its commitment to working tirelessly for \nthe full implementation of the Agenda by 2030, its recognition that eradicating \npoverty in all its forms and dimensions, including extreme poverty, is the greatest \nglobal challenge and an indispensable requirement for sustainable development, and \nits commitment to achieving sustainable development in its three dimensions \u2013 \neconomic, social and environmental \u2013 in a balanced and integrated manner, and to \nbuilding upon the achievements of the Millennium Development Goals and seeking \nto address their unfinished business, \n \nRecalling its resolution 74/4 of 15 October 2019, in which it endorsed the \npolitical declaration in the annex thereto entitled \u201cGearing up for a decade of action \n\nA/RES/76/136 \nPromoting social integration through social inclusion\n \n21-19166\n2/8 \n \nand delivery for sustainable development: political declaration of the Sustainable \nDevelopment Goals Summit\u201d, \n \nWelcoming the fact that the 2030 Agenda reflects the cross-cutting nature and \nimportance of social inclusion, through the relevant Sustainable Development Goals \nand associated targets, and acknowledging that its promotion is required to achieve \nsustainable development in all its dimensions, \n \nReiterating the pledge that no one will be left behind, reaffirming the \nrecognition that the dignity of the human person is fundamental, and the wish to see \nthe Goals and targets met for all nations and peoples and for all segments of society, \nand recommitting to focusing our effort where the challenges are greatest, including \nby ensuring the inclusion and participation of those who are furthest behind, \n \nRecalling that the 2030 Agenda includes, among the 17 Sustainable \nDevelopment Goals, which are integrated and indivisible, a goal to promote peaceful \nand inclusive societies for sustainable development, provide access to justice for all \nand build effective, accountable and inclusive institutions at all levels, \n \nReaffirming its resolution 69/313 of 27 July 2015 on the Addis Ababa Action \nAgenda of the Third International Conference on Financing for Development, which \nis an integral part of the 2030 Agenda for Sustainable Development, supports and \ncomplements it, helps to contextualize its means of implementation targets with \nconcrete policies and actions, and reaffirms the strong political commitment to \naddress the challenge of financing and creating an enabling environment at all levels \nfor sustainable development in the spirit of global partnership and solidarity, \n \nDeeply concerned that the coronavirus disease (COVID-19) pandemic, owing \nto its severe disruptions to societies, economies, employment, global trade, supply \nchains and travel, and agricultural, industrial and commercial systems, is having a \ndevastating impact on sustainable development, health and humanitarian needs, \nincluding on poverty eradication, livelihoods, ending hunger, food security and \nnutrition, education and environmentally sound waste management, especially for \nthose most affected, the poor and people in vulnerable situations, in countries in \nspecial situations and in low- and middle-income countries, and is making the \nprospect of achieving all Sustainable Development Goals more difficult, including \neradicating poverty in all its forms and dimensions by 2030, ending hunger and \nachieving food security and improved nutrition, and achieving gender equality and \nempowering all women and girls, thereby making it more difficult to achieve social \nintegration through social inclusion, \n \nAcknowledging the significant progress made in several parts of the world in \ncombating poverty in all its forms and dimensions, deeply concerned, however, that \npoverty persists and is estimated to increase because of the effects of the COVID-19 \npandemic, in all countries of the world, regardless of their economic, social and \ncultural situation, and is particularly severe in developing countries, and that it \nextends to and manifests itself in, among other things, social exclusion, hunger, \ndiscrimination, the feminization of poverty, vulnerability to trafficking in persons and \ndisease, lack of adequate shelter, lack of access to basic services, illiteracy and \nhopelessness, \n \nReaffirming that empowerment, participation and social protection are essential \nfor social development, as well as for social inclusion, and that sustainable \ndevelopment requires the meaningful, full and equal participation of all, \n \nRecognizing the great importance of promoting comprehensive systems of \nsocial protection that provide universal access to essential social services, consistent \nwith national priorities and circumstances, in order to help to meet the internationally \nagreed development goals, including the Sustainable Development Goals, \n\nPromoting social integration through social inclusion \nA/RES/76/136\n \n3/8\n21-19166 \n \n \nTaking note with appreciation of the commitment of several United Nations \nentities to mainstream social inclusion into their work, and encouraging others to do \nthe same, \n \nReaffirming the commitment of the international community to promote \nsustained, inclusive and sustainable economic growth, full and productive employment \nand decent work for everyone, as necessary, to eradicate poverty in all its forms and \ndimensions, including extreme poverty, which should be complemented, as appropriate, \nby effective social protection policies, including social inclusion policies, \n \nReaffirming also the importance of reducing inequalities within and among \ncountries through the empowerment of all and the promotion of social, economic and \npolitical inclusion, especially for those in vulnerable or marginalized groups or \nsituations, \n \nRecognizing that the gains of economic growth should also benefit those in \nvulnerable or marginalized groups or situations, \n \nAffirming its strong support for fair globalization and the need to translate \ngrowth into the reduction of inequalities, eradication of poverty and strategies and \npolicies that promote full, freely chosen and productive employment and decent work \nfor all and that these strategies and policies should constitute fundamental \ncomponents of relevant national and international policies and national development \nstrategies, including inequality and poverty reduction strategies, and reaffirming that \nemployment creation and decent work for all should be incorporated into \nmacroeconomic policies, taking fully into account the impact and social dimension \nof globalization, the benefits and costs of which are often unevenly shared and \ndistributed, \n \nRecognizing that the three core themes of social development, namely, poverty \neradication, full and productive employment and decent work for all and social \nintegration, are interrelated and mutually reinforcing, and that an enabling environment \ntherefore needs to be created so that all three objectives can be pursued simultaneously, \n \nReaffirming its resolution 73/342 of 16 September 2019 on the International \nLabour Organization Centenary Declaration for the Future of Work, in which it \nreaffirmed that full and productive employment and decent work for all are key \nelements of sustainable development, \n \nTaking note of the International Labour Organization global call to action for a \nhuman-centred recovery from the COVID-19 crisis that is inclusive, sustainable and \nresilient, \n \nRecognizing that social inclusion and equality are intrinsically linked and that \nfocusing on and investing in the most disadvantaged and excluded populations, which \nmay include children, women, youth, persons with disabilities, older persons, \nmigrants and indigenous peoples, is critically important for the effective achievement \nof the Sustainable Development Goals, \n \nRecognizing also that social inclusion policies and systems play a critical role \nin promoting an inclusive society and are also crucial for fostering stable, safe, \nharmonious, peaceful and just societies and for improving social cohesion and \ninclusion so as to create an environment for development and progress, \n \nReaffirming the important role of corporate social responsibility and \naccountability in contributing to an enabling environment to promote inclusive \neconomic growth and social integration, \n\nA/RES/76/136 \nPromoting social integration through social inclusion\n \n21-19166\n4/8 \n \n \nRecognizing that social inclusion policies also strengthen the democratic \nprocess and play a critical role in progressively realizing economic, social and \ncultural rights for all, \n \nStressing that social inclusion policies should promote gender equality and the \nempowerment of women and girls and equal access to opportunities and social \nprotection for all, in particular for those in vulnerable or marginalized groups or \nsituations, including women and girls who experience multiple and intersecting forms \nof discrimination and violence, considering that the empowerment of women and girls \nwill make a crucial contribution to progress across all the Goals and targets of the \n2030 Agenda, \n \nReaffirming the importance of ensuring the social integration of older persons \nand the promotion and protection of their rights, as an integral part of development \npolicies at all levels, and recognizing that older persons can make a significant \ncontribution to sustainable development in its three dimensions \u2013 economic, social \nand environmental, \n \nRecognizing persons with disabilities as both agents and beneficiaries of \ndevelopment, stressing the need to promote the rights of persons with disabilities and \ntheir participation, including through their representative organizations, in \nimplementing the 2030 Agenda, and in that regard noting with appreciation the 2018 \nDisability and Development Report: Realizing the Sustainable Development Goals \nby, for and with Persons with Disabilities,1 the first progress report on disability \ninclusion in the context of the 2030 Agenda, which is aimed at advancing efforts to \nremove barriers and empower persons with disabilities, \n \nReaffirming that youth participation is important for development, and \nencouraging Member States to explore and promote the participation of young people \nin relevant decision-making processes and monitoring, including in designing and \nimplementing policies and programmes involving them, while implementing the 2030 \nAgenda, \n \nRecognizing \nthe \nimportant \nrole \nplayed \nby \ncivil \nsociety, \nincluding \nnon-governmental organizations, in promoting social integration, inter alia, through \nsocial programmes and support for the development of socially inclusive policies, \n \nAcknowledging that the participation of persons in vulnerable or marginalized \ngroups or situations is crucial to formulating and implementing social inclusion \npolicies that effectively achieve social integration, as appropriate, \n \nReaffirming the important role of cooperatives, especially in developing \ncountries, in reducing inequality within and among countries and ensuring social \ninclusion while promoting more inclusive and equitable growth in order to achieve \nthe Sustainable Development Goals with the aim of leaving no one behind, \n \nRecognizing that each country has primary responsibility for its own economic \nand social development, and reaffirming the essential role of national policies and \nstrategies in promoting sustainable development in all its forms, particularly the \npromotion of social inclusion, \n \nRecognizing also the importance of an enabling international environment, and \nstressing the importance of enhanced international cooperation to support national \nefforts towards promoting social integration through social inclusion in every country, \nincluding the fulfilment of all commitments on official development assistance, debt \nrelief, market access, financial and technical support and capacity-building, \n__________________ \n \n1 United Nations publication, Sales No. 19.IV.4. \n\nPromoting social integration through social inclusion \nA/RES/76/136\n \n5/8\n21-19166 \n \n \nExpressing concern that, in times of economic and financial crisis and ongoing \nconcern about energy and food insecurity, social exclusion can be exacerbated, and \nstressing in this regard that sustainable and reliable social inclusion policies and \nprogrammes can play a positive role, \n \nRecalling its resolution 74/205 of 19 December 2019 on financial inclusion for \nsustainable development, in which it recognized the importance of financial inclusion \nfor achieving sustainable development, \n \nRecognizing that digital technologies have profoundly transformed society, \npromote innovation and offer unprecedented opportunities and that they have the \npotential to accelerate the realization of the 2030 Agenda, advancing social \ndevelopment and promoting social inclusion, by ensuring access to lifelong quality \neducation and training, health and related social services, decent work, affordable \nhousing, social protection, especially for those who are vulnerable or in vulnerable \nsituations, as well as fostering gender equality and the empowerment of all women \nand girls, and in this regard considering that bridging the digital divide is essential \nfor all and necessary for achieving social integration through social inclusion, while \nalso acknowledging the risk that digitalization may contribute to rising inequalities \nand that it also poses new challenges regarding data protection and privacy,  \n \nRecalling its resolution 75/202 of 21 December 2020 on information and \ncommunications technologies for sustainable development, \n \nRecognizing that, in order to leave no one behind and bring everyone forward, \nactions are needed for the promotion of equality of opportunity so that no person is \ndenied basic economic and social opportunities, and recognizing also that the \npromotion of equality of opportunity contributes significantly to the enjoyment of all \nhuman rights, \n \n1. \nTakes note of the report of the Secretary-General;2 \n \n2. \nStresses that Member States, which bear the main responsibility for social \nintegration and social inclusion, should prioritize the creation of a \u201csociety for all\u201d \nbased on respect for all human rights and the principles of equality among individuals, \nnon-discrimination, access to basic social services and promotion of the active \nparticipation of every member of society, in particular those in vulnerable or \nmarginalized groups or situations, in all aspects of life, including civic, social, \neconomic, cultural and political activities, as well as participation in decision-making \nprocesses; \n \n3. \nReaffirms that social integration policies should seek to reduce inequalities \nand that equity and social inclusion are important for achieving sustainable \ndevelopment, ensuring that individuals can participate without discrimination and \ncontribute to its social, economic and environmental dimensions; \n \n4. \nRecognizes that a framework for social development that is people-\ncentred, gender-sensitive, respects human rights and has a particular focus on the \npoorest, most vulnerable and those furthest behind can promote social integration \nthrough social inclusion, and that the integrated nature of the Sustainable \nDevelopment Goals requires a global response and can benefit from international \ncooperation; \n \n5. \nCalls upon Member States and other relevant stakeholders to advance, \nwith determination, bold and concerted actions to address the social, economic and \nhealth impacts of the COVID-19 pandemic, while striving to get back on track to \nachieve the Sustainable Development Goals by designing and implementing age-, \n__________________ \n \n2 A/76/184. \n\nA/RES/76/136 \nPromoting social integration through social inclusion\n \n21-19166\n6/8 \n \ndisability- and gender-sensitive recovery strategies to accelerate progress towards the \nfull implementation of the 2030 Agenda for Sustainable Development, 3 as well as \nhelping to enhance resilience to future shocks, as one of the measures to ensure social \nintegration through the social inclusion of all; \n \n6. \nRecognizes that the social integration of people living in poverty should \nencompass addressing and meeting their basic human needs, including safe, nutritious \nand sufficient food, health, safe drinking water and sanitation, housing and access to \nquality education and employment, through integrated development strategies, and \nreaffirms that the provision of basic social services in these areas should be seen as a \nmeans of fighting poverty, exclusion and promoting social integration, and in that \nregard encourages Member States to provide universal age-, disability- and gender-\nsensitive social protection systems, which are key to ensuring poverty reduction and \neradicating extreme poverty, including, as appropriate, targeted cash transfers for \npeople and families in vulnerable situations, which are most effective in reducing \npoverty when accompanied by other measures, such as providing access to essential \nservices, high-quality education and health and related social services;  \n \n7. \nAcknowledges that investment in human capital and social protection has \nbeen proven to be effective in reducing poverty and inequality, and invites Member \nStates to mobilize additional innovative sources of financing, as appropriate, \nincluding through public-private partnerships, to secure adequate levels of social \nexpenditure necessary for expanding coverage towards universal access to health, \neducation, innovation, new technologies and basic social protection, and to address \nthe issues of illicit financial flows and corruption; \n \n8. \nStresses the importance of promoting inclusive and equitable quality \neducation that is age-, disability- and gender-sensitive, as well as lifelong learning \nopportunities for all, especially for children, women, youth, persons with disabilities, \nolder persons, migrants, indigenous peoples and persons belonging to national or \nethnic, religious and linguistic minorities, and of skills development and quality \ntraining as essential means for inclusive participation and integration in society;  \n \n9. \nCalls upon Member States to promote a more equitable participation in \nand access to economic growth gains, through, inter alia, policies that ensure inclusive \nlabour markets and by implementing socially responsive macroeconomic policies, in \nwhich employment has a key role, and social inclusion strategies that promote social \nintegration, implementing nationally appropriate social protection systems and \nmeasures for all, including floors, particularly for those who are in vulnerable or \nmarginalized groups or situations, as defined by each country in accordance with its \nindividual circumstances, including on a demand-driven basis, and the promotion and \nprotection of their social and economic rights; \n \n10. Encourages Member States to consider, when appropriate, the creation or \nthe strengthening of national institutions or agencies for promoting, implementing \nand evaluating social inclusion programmes and mechanisms, at the national and local \nlevels, in order to help to ensure that no one is left behind; \n \n11. \nAlso encourages Member States to consider promoting the increased civil, \npolitical and economic participation of women, young people, older persons, persons \nwith disabilities, indigenous peoples and persons belonging to national or ethnic, \nreligious and linguistic minorities, including through promoting their involvement in \npolitical processes and their access to social protection, credit, vocational training and \nemployment support services; \n__________________ \n \n3  Resolution 70/1. \n\nPromoting social integration through social inclusion \nA/RES/76/136\n \n7/8\n21-19166 \n \n \n12. Further encourages Member States to ensure inclusive participatory and \nrepresentative decision-making processes, at all levels, and to review existing legal \nframeworks, as appropriate, with a view to removing discriminatory provisions so as \nto reduce inequalities; \n \n13. Encourages Member States to promote social inclusion as a matter of \nsocial justice in order to build the resilience of vulnerable populations and to help \nthem to adapt to the negative impact of economic crises, humanitarian emergencies, \nnatural disasters and climate change, and in this regard invites relevant United \nNations entities and international institutions to support such efforts; \n \n14. Invites Member States, and encourages regional organizations, to support \nnational efforts to achieve inclusive societies, in particular in developing countries, \nupon their request, by providing, inter alia, financial and technical cooperation for the \ndesign and implementation of sound social inclusion policies; \n \n15. Encourages Member States to mainstream social integration objectives \ninto social inclusion policies, promoting the participation of persons in vulnerable or \nmarginalized groups or situations in planning, implementing and monitoring \nprocesses, in collaboration, as appropriate, with relevant organizations of the United \nNations development system, regional organizations, international and regional \nfinancial institutions, development and social partners, the private sector and civil \nsociety organizations; \n \n16. Also encourages Member States, recognizing that all legal, social and \neconomic barriers to the empowerment of all women and girls have to be removed, \nto promote the systematic mainstreaming and inclusion of a gender perspective in all \nsocial inclusion strategies or initiatives, while giving special consideration to the \npromotion of a gender-responsive policy environment in the workplace for the \nempowerment of women in the workplace; \n \n17. Further encourages Member States to consider adopting and pursuing \nnational financial inclusion strategies or initiatives that take into account a gender \nperspective and comprise, inter alia, measures for promoting full and equal access to \nformal financial services and financial literacy, as a way to increase the capacity of \nyoung people, women, persons with disabilities, older persons and indigenous peoples \nto leverage various types of opportunities for their full participation in society, such \nas entrepreneurs; \n \n18. Recognizes that information and communications technologies have the \npotential to provide new solutions to development challenges, particularly in the \ncontext of globalization and the COVID-19 pandemic, and can foster sustained, \ninclusive \nand \nequitable \neconomic \ngrowth \nand \nsustainable \ndevelopment, \ncompetitiveness, access to information and knowledge, trade and development, \npoverty eradication and social inclusion, accordingly reaffirms its commitment to \nbridging the digital divide, and calls upon Member States to implement policies and \nto accelerate their efforts to close the digital divide, as a measure to attain the social \ninclusion of all, with a focus on children, youth, women, persons with disabilities, \nolder persons, migrants and indigenous peoples, without any discrimination; \n \n19. Urges Member States, in collaboration with other stakeholders, to close \nthe digital divide, both between and within countries and including rural-urban, \nyouth-older persons and gender digital divides, and to promote digital inclusion, by \ntaking into account national and regional contexts and addressing the lack of efficient, \naffordable and accessible digital technology infrastructure, access to the Internet and \ncommunication devices, especially in rural and remote areas, and the challenges \nassociated with digital literacy, digital skills, training and awareness, by ensuring that \n\nA/RES/76/136 \nPromoting social integration through social inclusion\n \n21-19166\n8/8 \n \nthe benefits of new technologies are available to all, taking into account the needs of \nthose who are vulnerable or in vulnerable situations; \n \n20. Reaffirms the commitment of the New Urban Agenda, adopted at the \nUnited Nations Conference on Housing and Sustainable Urban Development \n(Habitat III), held in Quito from 17 to 20 October 2016,4 to embracing diversity in \ncities and human settlements, to strengthening social cohesion, intercultural dialogue \nand understanding, tolerance, mutual respect, gender equality, innovation, \nentrepreneurship, inclusion, identity and safety, and the dignity of all people, as well \nas to fostering liveability and a vibrant urban economy and to taking steps to ensure \nthat local institutions promote pluralism and peaceful coexistence within increasingly \nheterogeneous and multicultural societies; \n \n21. Invites Member States, relevant organizations of the United Nations \nsystem, regional organizations, international and regional financial institutions, \ndevelopment and social partners, the private sector and civil society organizations to \ncontinue to share their experience in respect of practical initiatives to promote \neconomic, civil and political participation and non-discrimination measures and other \nmeasures for advancing social integration; \n \n22. Invites Member States to consider a systematic exchange of good practices \nin social integration at the regional and international levels so that policymakers and \nother stakeholders can apply them to their national circumstances and step up progress \ntowards achieving a \u201csociety for all\u201d; \n \n23. Encourages Member States to improve the collection and use of high-\nquality, timely, reliable, disaggregated data and statistics for the formulation of \npolicies and programmes aimed at achieving social inclusion, and stresses the \nimportance of international cooperation in this regard; \n \n24. Requests the Secretary-General to submit a report, taking into account the \ninformation provided by Member States and relevant actors of the United Nations \nsystem, on the implementation of the present resolution to the General Assembly at \nits seventy-eighth session; \n \n25. Decides to consider the question further at its seventy-eighth session under \nthe item entitled \u201cSocial development\u201d. \n \n53rd plenary meeting \n16 December 2021 \n \n \n__________________ \n \n4 Resolution 71/256, annex. \n",
  "paragraphs": {
    "1": "Takes note of the report of the Secretary-General;2",
    "2": "Stresses that Member States, which bear the main responsibility for social integration and social inclusion, should prioritize the creation of a \u201csociety for all\u201d based on respect for all human rights and the principles of equality among individuals, non-discrimination, access to basic social services and promotion of the active participation of every member of society, in particular those in vulnerable or marginalized groups or situations, in all aspects of life, including civic, social, economic, cultural and political activities, as well as participation in decision-making processes;",
    "3": "Reaffirms that social integration policies should seek to reduce inequalities and that equity and social inclusion are important for achieving sustainable development, ensuring that individuals can participate without discrimination and contribute to its social, economic and environmental dimensions;",
    "4": "Recognizes that a framework for social development that is people- centred, gender-sensitive, respects human rights and has a particular focus on the poorest, most vulnerable and those furthest behind can promote social integration through social inclusion, and that the integrated nature of the Sustainable Development Goals requires a global response and can benefit from international cooperation;",
    "5": "Calls upon Member States and other relevant stakeholders to advance, with determination, bold and concerted actions to address the social, economic and health impacts of the COVID-19 pandemic, while striving to get back on track to achieve the Sustainable Development Goals by designing and implementing age-, disability- and gender-sensitive recovery strategies to accelerate progress towards the full implementation of the 2030 Agenda for Sustainable Development, 3 as well as helping to enhance resilience to future shocks, as one of the measures to ensure social integration through the social inclusion of all;",
    "6": "Recognizes that the social integration of people living in poverty should encompass addressing and meeting their basic human needs, including safe, nutritious and sufficient food, health, safe drinking water and sanitation, housing and access to quality education and employment, through integrated development strategies, and reaffirms that the provision of basic social services in these areas should be seen as a means of fighting poverty, exclusion and promoting social integration, and in that regard encourages Member States to provide universal age-, disability- and gender- sensitive social protection systems, which are key to ensuring poverty reduction and eradicating extreme poverty, including, as appropriate, targeted cash transfers for people and families in vulnerable situations, which are most effective in reducing poverty when accompanied by other measures, such as providing access to essential services, high-quality education and health and related social services;",
    "7": "Acknowledges that investment in human capital and social protection has been proven to be effective in reducing poverty and inequality, and invites Member States to mobilize additional innovative sources of financing, as appropriate, including through public-private partnerships, to secure adequate levels of social expenditure necessary for expanding coverage towards universal access to health, education, innovation, new technologies and basic social protection, and to address the issues of illicit financial flows and corruption;",
    "8": "Stresses the importance of promoting inclusive and equitable quality education that is age-, disability- and gender-sensitive, as well as lifelong learning opportunities for all, especially for children, women, youth, persons with disabilities, older persons, migrants, indigenous peoples and persons belonging to national or ethnic, religious and linguistic minorities, and of skills development and quality training as essential means for inclusive participation and integration in society;",
    "9": "Calls upon Member States to promote a more equitable participation in and access to economic growth gains, through, inter alia, policies that ensure inclusive labour markets and by implementing socially responsive macroeconomic policies, in which employment has a key role, and social inclusion strategies that promote social integration, implementing nationally appropriate social protection systems and measures for all, including floors, particularly for those who are in vulnerable or marginalized groups or situations, as defined by each country in accordance with its individual circumstances, including on a demand-driven basis, and the promotion and protection of their social and economic rights;",
    "10": "Encourages Member States to consider, when appropriate, the creation or the strengthening of national institutions or agencies for promoting, implementing and evaluating social inclusion programmes and mechanisms, at the national and local levels, in order to help to ensure that no one is left behind;",
    "11": "Also encourages Member States to consider promoting the increased civil, political and economic participation of women, young people, older persons, persons with disabilities, indigenous peoples and persons belonging to national or ethnic, religious and linguistic minorities, including through promoting their involvement in political processes and their access to social protection, credit, vocational training and employment support services;",
    "12": "Further encourages Member States to ensure inclusive participatory and representative decision-making processes, at all levels, and to review existing legal frameworks, as appropriate, with a view to removing discriminatory provisions so as to reduce inequalities;",
    "13": "Encourages Member States to promote social inclusion as a matter of social justice in order to build the resilience of vulnerable populations and to help them to adapt to the negative impact of economic crises, humanitarian emergencies, natural disasters and climate change, and in this regard invites relevant United Nations entities and international institutions to support such efforts;",
    "14": "Invites Member States, and encourages regional organizations, to support national efforts to achieve inclusive societies, in particular in developing countries, upon their request, by providing, inter alia, financial and technical cooperation for the design and implementation of sound social inclusion policies;",
    "15": "Encourages Member States to mainstream social integration objectives into social inclusion policies, promoting the participation of persons in vulnerable or marginalized groups or situations in planning, implementing and monitoring processes, in collaboration, as appropriate, with relevant organizations of the United Nations development system, regional organizations, international and regional financial institutions, development and social partners, the private sector and civil society organizations;",
    "16": "Also encourages Member States, recognizing that all legal, social and economic barriers to the empowerment of all women and girls have to be removed, to promote the systematic mainstreaming and inclusion of a gender perspective in all social inclusion strategies or initiatives, while giving special consideration to the promotion of a gender-responsive policy environment in the workplace for the empowerment of women in the workplace;",
    "17": "Further encourages Member States to consider adopting and pursuing national financial inclusion strategies or initiatives that take into account a gender perspective and comprise, inter alia, measures for promoting full and equal access to formal financial services and financial literacy, as a way to increase the capacity of young people, women, persons with disabilities, older persons and indigenous peoples to leverage various types of opportunities for their full participation in society, such as entrepreneurs;",
    "18": "Recognizes that information and communications technologies have the potential to provide new solutions to development challenges, particularly in the context of globalization and the COVID-19 pandemic, and can foster sustained, inclusive and equitable economic growth and sustainable development, competitiveness, access to information and knowledge, trade and development, poverty eradication and social inclusion, accordingly reaffirms its commitment to bridging the digital divide, and calls upon Member States to implement policies and to accelerate their efforts to close the digital divide, as a measure to attain the social inclusion of all, with a focus on children, youth, women, persons with disabilities, older persons, migrants and indigenous peoples, without any discrimination;",
    "19": " the benefits of new technologies are available to all, taking into account the needs of those who are vulnerable or in vulnerable situations;",
    "20": "Reaffirms the commitment of the New Urban Agenda, adopted at the United Nations Conference on Housing and Sustainable Urban Development (Habitat III), held in Quito from 17 to 20 October 2016,4 to embracing diversity in cities and human settlements, to strengthening social cohesion, intercultural dialogue and understanding, tolerance, mutual respect, gender equality, innovation, entrepreneurship, inclusion, identity and safety, and the dignity of all people, as well as to fostering liveability and a vibrant urban economy and to taking steps to ensure that local institutions promote pluralism and peaceful coexistence within increasingly heterogeneous and multicultural societies;",
    "21": "Invites Member States, relevant organizations of the United Nations system, regional organizations, international and regional financial institutions, development and social partners, the private sector and civil society organizations to continue to share their experience in respect of practical initiatives to promote economic, civil and political participation and non-discrimination measures and other measures for advancing social integration;",
    "22": "Invites Member States to consider a systematic exchange of good practices in social integration at the regional and international levels so that policymakers and other stakeholders can apply them to their national circumstances and step up progress towards achieving a \u201csociety for all\u201d;",
    "23": "Encourages Member States to improve the collection and use of high- quality, timely, reliable, disaggregated data and statistics for the formulation of policies and programmes aimed at achieving social inclusion, and stresses the importance of international cooperation in this regard;",
    "24": "Requests the Secretary-General to submit a report, taking into account the information provided by Member States and relevant actors of the United Nations system, on the implementation of the present resolution to the General Assembly at its seventy-eighth session;",
    "25": "Decides to consider the question further at its seventy-eighth session under the item entitled \u201cSocial development\u201d."
  },
  "agenda_items": [
    "Item 28"
  ],
  "symbol_references": []
}