{
  "symbol": "A/RES/76/278",
  "filename": "A_RES_76_278.pdf",
  "title": "76/278. Financing of the Regional Service Centre in Entebbe, Uganda",
  "text": "United Nations \nA/RES/76/278\n \n \nGeneral Assembly \nDistr.: General \n7 July 2022 \n \n22-10334 (E)    070722 \n*2210334* \n \n \nSeventy-sixth session \nAgenda item 150 \nAdministrative and budgetary aspects of the financing of \nthe United Nations peacekeeping operations  \n \n \n \n \n Resolution adopted by the General Assembly \non 29 June 2022 \n \n \n \n \n[on the report of the Fifth Committee (A/76/874, para. 21)] \n \n \n 76/278. Financing of the Regional Service Centre in Entebbe, Uganda \n \n \n \nThe General Assembly, \n \nRecalling its resolution 69/307 of 25 June 2015 concerning the financing of the \nRegional Service Centre in Entebbe, Uganda, and its subsequent resolutions thereon, \nthe latest of which was resolution 75/294 of 30 June 2021,  \n \nHaving considered the reports of the Secretary-General on the financing of the \nRegional Service Centre 1  and the related report of the Advisory Committee on \nAdministrative and Budgetary Questions,2  \n \n1. \nReaffirms its resolutions 57/290 B of 18 June 2003, 59/296 of 22 June \n2005, 60/266 of 30 June 2006, 61/276 of 29 June 2007, 64/269 of 24 June 2010, \n65/289 of 30 June 2011, 66/264 of 21 June 2012, 69/307, 70/286 of 17 June 2016 and \n76/274 of 29 June 2022, and requests the Secretary-General to ensure the full \nimplementation of their relevant provisions;  \n \n2. \nTakes note of the reports of the Secretary-General;  \n \n3. \nEndorses the conclusions and recommendations contained in the report of \nthe Advisory Committee on Administrative and Budgetary Questions, and requests \nthe Secretary-General to ensure their full implementation;  \n \n4. \nAcknowledges the support of the Government of Uganda in facilitating the \nwork of the United Nations at the Regional Service Centre in Entebbe, Uganda;  \n \n__________________ \n \n1  A/76/548 and A/76/685. \n \n2  A/76/760/Add.6. \n\nA/RES/76/278 \nFinancing of the Regional Service Centre in Entebbe, Uganda\n \n22-10334\n2/2 \n \n \n \nBudget performance report for the period from 1 July 2020 to 30 June 2021 \n \n \n5. \nTakes note of the report of the Secretary-General on the budget \nperformance of the Regional Service Centre for the period from 1 July 2020 to \n30 June 2021;3  \n \n \n \nBudget estimates for the period from 1 July 2022 to 30 June 2023 \n \n \n6. \nApproves the amount of 43,122,200 United States dollars for the \nmaintenance of the Regional Service Centre for the period from 1 July 2022 to \n30 June 2023;  \n \n \n \nFinancing of the budget estimates for the period from 1 July 2022 to \n30 June 2023 \n \n \n7. \nDecides that the requirements for the Regional Service Centre for the \nperiod from 1 July 2022 to 30 June 2023 shall be financed as follows:  \n \n(a) \nThe unencumbered balance and other revenue in the amount of \n1,302,100 dollars in respect of the financial period ended 30 June 2021, to be applied \nagainst the resources required for the period from 1 July 2022 to 30 June 2023;  \n \n(b) \nThe amount of 39,679,000 dollars, to be prorated among the budgets of \nthe active client peacekeeping operations for the period from 1 July 2022 to 30 June \n2023;  \n \n(c) \nThe amount of 2,141,100 dollars, with respect to the share of client special \npolitical missions, to be funded under section 3, Political affairs, as may be approved \nby the General Assembly in the context of the proposed programme budget for 2023;  \n \n(d) \nThe estimated staff assessment income of 4,423,000 dollars, comprising \nthe amount of 4,242,800 dollars for the period from 1 July 2022 to 30 June 2023 and \nthe increase of 180,200 dollars in respect of the period from 1 July 2020 to 30 June \n2021, to be offset against the balance referred to in subparagraph (b) above, to be \nprorated among the budgets of the individual active client peacekeeping operations;  \n \n8. \nAlso decides to consider at its seventy-seventh session the question of the \nfinancing of the Regional Service Centre. \n \n89th plenary meeting \n29 June 2022 \n \n__________________ \n \n3  A/76/548. \n",
  "paragraphs": {
    "1": "Reaffirms its resolutions 57/290 B of 18 June 2003, 59/296 of 22 June 2005, 60/266 of 30 June 2006, 61/276 of 29 June 2007, 64/269 of 24 June 2010, 65/289 of 30 June 2011, 66/264 of 21 June 2012, 69/307, 70/286 of 17 June 2016 and 76/274 of 29 June 2022, and requests the Secretary-General to ensure the full implementation of their relevant provisions;",
    "2": "Takes note of the reports of the Secretary-General;",
    "3": "Endorses the conclusions and recommendations contained in the report of the Advisory Committee on Administrative and Budgetary Questions, and requests the Secretary-General to ensure their full implementation;",
    "4": "Acknowledges the support of the Government of Uganda in facilitating the work of the United Nations at the Regional Service Centre in Entebbe, Uganda; __________________ 1 A/76/548 and A/76/685. 2 A/76/760/Add.6. A/RES/76/278 Financing of the Regional Service Centre in Entebbe, Uganda 22-10334 2/2 Budget performance report for the period from 1 July 2020 to 30 June 2021",
    "5": "Takes note of the report of the Secretary-General on the budget performance of the Regional Service Centre for the period from 1 July 2020 to 30 June 2021;3 Budget estimates for the period from 1 July 2022 to 30 June 2023",
    "6": "Approves the amount of 43,122,200 United States dollars for the maintenance of the Regional Service Centre for the period from 1 July 2022 to 30 June 2023; Financing of the budget estimates for the period from 1 July 2022 to 30 June 2023",
    "7": "Decides that the requirements for the Regional Service Centre for the period from 1 July 2022 to 30 June 2023 shall be financed as follows: (a) The unencumbered balance and other revenue in the amount of 1,302,100 dollars in respect of the financial period ended 30 June 2021, to be applied against the resources required for the period from 1 July 2022 to 30 June 2023; (b) The amount of 39,679,000 dollars, to be prorated among the budgets of the active client peacekeeping operations for the period from 1 July 2022 to 30 June 2023; (c) The amount of 2,141,100 dollars, with respect to the share of client special political missions, to be funded under section 3, Political affairs, as may be approved by the General Assembly in the context of the proposed programme budget for 2023; (d) The estimated staff assessment income of 4,423,000 dollars, comprising the amount of 4,242,800 dollars for the period from 1 July 2022 to 30 June 2023 and the increase of 180,200 dollars in respect of the period from 1 July 2020 to 30 June 2021, to be offset against the balance referred to in subparagraph (b) above, to be prorated among the budgets of the individual active client peacekeeping operations;",
    "8": "Also decides to consider at its seventy-seventh session the question of the financing of the Regional Service Centre. 89th plenary meeting 29 June 2022 __________________ 3 A/76/548."
  },
  "agenda_items": [
    "Item 150"
  ],
  "symbol_references": []
}