{
  "symbol": "A/RES/74/64",
  "filename": "A_RES_74_64.pdf",
  "title": "74/64. Youth, disarmament and non-proliferation",
  "text": "United Nations \nA/RES/74/64\n \n \nGeneral Assembly \nDistr.: General \n20 December 2019 \n \n19-21863 (E)    030120 \n*1921863* \n \n \nSeventy-fourth session \nAgenda item 98 \nGeneral and complete disarmament \n \n \n \n \n Resolution adopted by the General Assembly \non 12 December 2019 \n \n \n \n \n[on the report of the First Committee (A/74/368)] \n \n \n \n74/64. Youth, disarmament and non-proliferation \n \n \n \nThe General Assembly,  \n \nRecognizing that young people in all countries are key agents for social change, \neconomic development and technological innovation, \n \nReaffirming the important and positive contribution that young people can make \nto the promotion and attainment of sustainable peace and security,  \n \nNoting that engagement with young people can provide opportunities to benefit \nfrom their views, insights and ideas,  \n \nBearing in mind its resolution 73/59 of 5 December 2018, which highlights the \nneed for disarmament and non-proliferation education, particularly among youth, \n \nRecalling its resolution 73/46 of 5 December 2018, in which it reaffirms that the \nequal, full and effective participation of both women and men is one of the essential \nfactors for the promotion and attainment of sustainable peace and security,  \n \nRecalling also relevant General Assembly and Security Council resolutions on \nthe issue of youth, peace and security,  \n \nNoting the launch on 24 September 2018 of Youth 2030: The United Nations \nYouth Strategy, which includes peace and security as a thematic priority area,  \n \nNoting also Action 38 of the disarmament agenda put forward by the Secretary-\nGeneral, in which he describes the young generation as the ultimate force for change \nand proposes actions to promote youth engagement, \n \nMindful of the initiatives and activities undertaken by Member States, the \nUnited Nations entities and relevant civil society organizations for the \n\nA/RES/74/64 \nYouth, disarmament and non-proliferation\n \n19-21863\n2/2 \n \nimplementation of the World Programme of Action for Youth 1 and the achievement \nof the Sustainable Development Goals,2  \n \nRecognizing the role of civil society in promoting the engagement of young \npeople in the field of disarmament and non-proliferation, \n \n1. \nEncourages Member States, the United Nations, relevant specialized \nagencies and regional and subregional organizations to promote the meaningful and \ninclusive participation of young people in discussions in the field of disarmament and \nnon-proliferation, including through dialogue platforms, mentoring, internships, \nfellowships, scholarships, model events and youth group activities;  \n \n2. \nCalls upon Member States, the United Nations, relevant specialized \nagencies and regional and subregional organizations to consider developing and \nimplementing policies and programmes for young people to increase and facilitate \ntheir constructive engagement in the field of disarmament and non-proliferation;  \n \n3. \nStresses the importance of realizing the full potential of young people \nthrough education and capacity-building, bearing in mind the ongoing efforts and the \nneed to promote the sustainable entry of young people into the field of disarmament \nand non-proliferation; \n \n4. \nRequests the Secretary-General to seek specific measures to promote the \nmeaningful and inclusive participation and empowerment of youth on disarmament \nand non-proliferation issues;  \n \n5. \nEncourages Member States to continue efforts to raise awareness and \nstrengthen coordination within the United Nations system and beyond on ongoing \nefforts to promote the role of youth;  \n \n6. \nDecides to include in the provisional agenda of its seventy-sixth session, \nunder the item entitled \u201cGeneral and complete disarmament\u201d, a sub-item entitled \n\u201cYouth, disarmament and non-proliferation\u201d. \n \n46th plenary meeting \n12 December 2019 \n \n__________________ \n \n1  Resolution 50/81, annex, and resolution 62/126, annex.  \n \n2  See resolution 70/1. \n",
  "paragraphs": {
    "1": "Encourages Member States, the United Nations, relevant specialized agencies and regional and subregional organizations to promote the meaningful and inclusive participation of young people in discussions in the field of disarmament and non-proliferation, including through dialogue platforms, mentoring, internships, fellowships, scholarships, model events and youth group activities;",
    "2": "Calls upon Member States, the United Nations, relevant specialized agencies and regional and subregional organizations to consider developing and implementing policies and programmes for young people to increase and facilitate their constructive engagement in the field of disarmament and non-proliferation;",
    "3": "Stresses the importance of realizing the full potential of young people through education and capacity-building, bearing in mind the ongoing efforts and the need to promote the sustainable entry of young people into the field of disarmament and non-proliferation;",
    "4": "Requests the Secretary-General to seek specific measures to promote the meaningful and inclusive participation and empowerment of youth on disarmament and non-proliferation issues;",
    "5": "Encourages Member States to continue efforts to raise awareness and strengthen coordination within the United Nations system and beyond on ongoing efforts to promote the role of youth;",
    "6": "Decides to include in the provisional agenda of its seventy-sixth session, under the item entitled \u201cGeneral and complete disarmament\u201d, a sub-item entitled \u201cYouth, disarmament and non-proliferation\u201d. 46th plenary meeting 12 December 2019 __________________ 1 Resolution 50/81, annex, and resolution 62/126, annex. 2 See resolution 70/1."
  },
  "agenda_items": [
    "Item 98"
  ],
  "symbol_references": []
}