{
  "symbol": "A/RES/78/282",
  "filename": "A_RES_78_282.pdf",
  "title": "78/282. International Day of Reflection and Commemoration of the 1995 Genocide in Srebrenica",
  "text": "United Nations \nA/RES/78/282\n \n \nGeneral Assembly \nDistr.: General \n30 May 2024 \n \n24-09647 (E)    050624     \n*2409647* \n \n \nSeventy-eighth session \nAgenda item 14 \nCulture of peace \n \n \n \n \n Resolution adopted by the General Assembly \non 23 May 2024 \n \n \n \n \n[without reference to a Main Committee (A/78/L.67/Rev.1)] \n \n \n 78/282. International Day of Reflection and Commemoration of the \n1995 Genocide in Srebrenica \n \n \n \nThe General Assembly,  \n \nGuided by the Charter of the United Nations, the Universal Declaration of \nHuman Rights1 and the Convention on the Prevention and Punishment of the Crime \nof Genocide,2  \n \nRecalling Security Council resolution 819 (1993) of 16 April 1993 declaring \nSrebrenica a safe area, resolution 827 (1993) of 25 May 1993 concerning the \nestablishment of the International Tribunal for the Former Yugoslavia and resolution \n1966 (2010) of 22 December 2010 concerning the establishment of the International \nResidual Mechanism for Criminal Tribunals,  \n \nRecalling also all judgments of the International Tribunal for the Former \nYugoslavia, in particular eight that contain guilty verdicts for the crime of genocide \nagainst Bosnian Muslims committed at Srebrenica in 1995, most notably the Tribunal \nAppeals Chamber judgment of 19 April 2004 (The Prosecutor v. Krsti\u0107), the \nInternational Residual Mechanism for Criminal Tribunals Appeals Chamber judgment \nof 8 June 2021 (The Prosecutor v. Mladi\u0107) and the Mechanism Appeals Chamber \njudgment of 20 March 2019 (The Prosecutor v. Karad\u017ei\u0107), as well as the judgment of \nthe International Court of Justice of 26 February 2007, in which the Court determined \nthat the acts committed in Srebrenica constituted acts of genocide, \n \nReaffirming its strong opposition to impunity for genocide, crimes against \nhumanity, war crimes or other violations of international humanitarian law and \ninternational human rights law, and emphasizing in this context the responsibility of \nStates to end impunity and, to that end, to thoroughly investigate and prosecute, in \n__________________ \n \n1  Resolution 217 A (III). \n \n2  Resolution 260 A (III), annex. \n\nA/RES/78/282 \nInternational Day of Reflection and Commemoration of the \n1995 Genocide in Srebrenica\n \n24-09647\n2/3 \n \naccordance with their relevant international legal obligations and their domestic law, \npersons responsible for such acts, in order to avoid their recurrence and to seek \nsustainable peace, justice, truth and reconciliation, for which the participation of \nvictims and survivors as well as their family members is central, \n \nWelcoming the important progress made by international courts in recent years \nwith respect to the fight against impunity and in ensuring accountability for genocide, \ncrimes against humanity, war crimes and other egregious crimes achieved through the \ninternational criminal justice system, \n \nRecognizing in this regard the particular contribution of the International \nTribunal for the Former Yugoslavia, and emphasizing the importance of the \ninternational community being prepared to take collective action through the Security \nCouncil, in accordance with the Charter, and on a case-by-case basis to further ensure \naccountability for and the prevention of genocide, \n \nReiterating that criminal accountability under international law for the crime of \ngenocide is individualized and cannot be attributed to any ethnic, religious or other \ngroup or community as a whole, \n \nTaking note of the role of the Special Advisers to the Secretary-General on the \nPrevention of Genocide and on the Responsibility to Protect, and noting the \nimportance of regular briefings on human rights and international humanitarian law \nviolations as well as on hate speech and incitement in raising early awareness of \npotential genocide, \n \nNoting that the prosecution of persons responsible for genocide and other \ninternational crimes in national justice systems, including the Court of Bosnia and \nHerzegovina, and the International Tribunal for the Former Yugoslavia as well as the \nInternational Residual Mechanism for Criminal Tribunals, remains central to the \nprocess of national reconciliation and trust-building and to the restoration and \nmaintenance of peace in Bosnia and Herzegovina, and recognizing that strong \nregional cooperation between national prosecutors\u2019 offices is essential in fostering \npeace, justice, truth and reconciliation among countries in the region, \n \nReiterating the unwavering commitment to maintaining stability and fostering \nunity in diversity in Bosnia and Herzegovina, \n \nNoting that 2025 will mark the thirtieth anniversary of the genocide in \nSrebrenica, in which at least 8,372 lives were lost, thousands were displaced and \nfamilies and communities were devastated, \n \n1. \nDecides to designate 11 July as the International Day of Reflection and \nCommemoration of the 1995 Genocide in Srebrenica, to be observed annually; \n \n2. \nCondemns without reservation any denial of the Srebrenica genocide as a \nhistorical event, and urges Member States to preserve the established facts, including \nthrough their educational systems by developing appropriate programmes, also in \nremembrance, towards preventing denial and distortion, and occurrence of genocides \nin the future;  \n \n3. \nAlso condemns without reservation actions that glorify those convicted of \nwar crimes, crimes against humanity and genocide by international courts, including \nthose responsible for the Srebrenica genocide; \n \n4. \nEmphasizes the importance of completing the process of finding and \nidentifying the remaining victims of the Srebrenica genocide and according them \ndignified burials, and calls for the continued prosecution of those perpetrators of the \nSrebrenica genocide who have yet to face justice; \n\nInternational Day of Reflection and Commemoration of the  \n1995 Genocide in Srebrenica \nA/RES/78/282\n \n3/3\n24-09647 \n \n \n5. \nUrges all States to fully adhere to their obligations under the Convention \non the Prevention and Punishment of the Crime of Genocide, as applicable, and \ncustomary international law on the prevention and punishment of genocide, with due \nregard to relevant decisions of the International Court of Justice; \n  \n6. \nRequests the Secretary-General to establish an outreach programme \nentitled \u201cThe Srebrenica Genocide and the United Nations\u201d, starting its activities with \npreparations for the thirtieth anniversary in 2025, and also requests the Secretary-\nGeneral to bring the present resolution to the attention of all Member States, \norganizations of the United Nations system and civil society organizations for \nappropriate observance; \n \n7. \nInvites all Member States, organizations of the United Nations system, \nother international and regional organizations and civil society, including \nnon- governmental \norganizations, \nacademic \ninstitutions \nand \nother \nrelevant \nstakeholders to observe the International Day, including special observances and \nactivities in memory and honour of the victims of the 1995 genocide in Srebrenica, \nas well as appropriate education and public awareness-raising activities. \n \n82nd plenary meeting \n23 May 2024 \n \n",
  "paragraphs": {
    "1": "Decides to designate 11 July as the International Day of Reflection and Commemoration of the 1995 Genocide in Srebrenica, to be observed annually;",
    "2": "Condemns without reservation any denial of the Srebrenica genocide as a historical event, and urges Member States to preserve the established facts, including through their educational systems by developing appropriate programmes, also in remembrance, towards preventing denial and distortion, and occurrence of genocides in the future;",
    "3": "Also condemns without reservation actions that glorify those convicted of war crimes, crimes against humanity and genocide by international courts, including those responsible for the Srebrenica genocide;",
    "4": "",
    "5": "Urges all States to fully adhere to their obligations under the Convention on the Prevention and Punishment of the Crime of Genocide, as applicable, and customary international law on the prevention and punishment of genocide, with due regard to relevant decisions of the International Court of Justice;",
    "6": "Requests the Secretary-General to establish an outreach programme entitled \u201cThe Srebrenica Genocide and the United Nations\u201d, starting its activities with preparations for the thirtieth anniversary in 2025, and also requests the Secretary- General to bring the present resolution to the attention of all Member States, organizations of the United Nations system and civil society organizations for appropriate observance;",
    "7": "Invites all Member States, organizations of the United Nations system, other international and regional organizations and civil society, including non- governmental organizations, academic institutions and other relevant stakeholders to observe the International Day, including special observances and activities in memory and honour of the victims of the 1995 genocide in Srebrenica, as well as appropriate education and public awareness-raising activities."
  },
  "agenda_items": [
    "Item 14"
  ],
  "symbol_references": [
    "A/78/L.67"
  ]
}