{
  "symbol": "A/RES/76/285",
  "filename": "A_RES_76_285.pdf",
  "title": "76/285. Financing of the United Nations Stabilization Mission in Haiti",
  "text": "United Nations \nA/RES/76/285\n \n \nGeneral Assembly \nDistr.: General \n7 July 2022 \n \n22-10344 (E)    070722     \n*2210344* \n \n \nSeventy-sixth session \nAgenda item 157 \nFinancing of the United Nations Stabilization Mission \nin Haiti  \n \n \n \n \n Resolution adopted by the General Assembly \non 29 June 2022 \n \n \n \n \n[on the report of the Fifth Committee (A/76/886, para. 6)] \n \n \n 76/285. Financing of the United Nations Stabilization Mission in Haiti \n \n \n \nThe General Assembly, \n \nHaving considered the report of the Secretary-General on the final performance \nof the United Nations Stabilization Mission in Haiti1 and the related report of the \nAdvisory Committee on Administrative and Budgetary Questions, 2  \n \n1. \nTakes note of the status of contributions to the United Nations Stabilization \nMission in Haiti as at 30 April 2022, including the contributions outstanding in the \namount of 2.3 million United States dollars, representing some 0.03 per cent of the \ntotal assessed contributions, notes with concern that only 181 Member States have \npaid their assessed contributions in full, and urges all other Member States, in \nparticular those in arrears, to ensure payment of their outstanding assessed \ncontributions;  \n \n2. \nEndorses the conclusions and recommendations contained in the report of \nthe Advisory Committee on Administrative and Budgetary Questions, and requests \nthe Secretary-General to ensure their full implementation;  \n \n3. \nTakes note of the report of the Secretary-General on the final performance \nand financing of the United Nations Stabilization Mission in Haiti;  \n \n4. \nAlso takes note of the net cash available in the special account for the \nUnited Nations Stabilization Mission in Haiti in the amount of 9,285,000 dollars as \nat 30 April 2022, and decides to defer action thereon until consideration of the final \nperformance report of the United Nations Mission for Justice Support in Haiti by the \nGeneral Assembly at its seventy-seventh session;  \n__________________ \n \n1  A/75/604. \n \n2  A/75/850. \n\nA/RES/76/285 \nFinancing of the United Nations Stabilization Mission in Haiti\n \n22-10344\n2/2 \n \n \n5. \nUrges all Member States to make every possible effort to ensure payment \nof their assessed contributions in full;  \n \n6. \nDecides to include in the provisional agenda of its seventy-seventh session \nthe item entitled \u201cFinancing of the United Nations Stabilization Mission in Haiti\u201d. \n \n89th plenary meeting \n29 June 2022 \n \n \n",
  "paragraphs": {
    "1": "Takes note of the status of contributions to the United Nations Stabilization Mission in Haiti as at 30 April 2022, including the contributions outstanding in the amount of 2.3 million United States dollars, representing some 0.03 per cent of the total assessed contributions, notes with concern that only 181 Member States have paid their assessed contributions in full, and urges all other Member States, in particular those in arrears, to ensure payment of their outstanding assessed contributions;",
    "2": "Endorses the conclusions and recommendations contained in the report of the Advisory Committee on Administrative and Budgetary Questions, and requests the Secretary-General to ensure their full implementation;",
    "3": "Takes note of the report of the Secretary-General on the final performance and financing of the United Nations Stabilization Mission in Haiti;",
    "4": "Also takes note of the net cash available in the special account for the United Nations Stabilization Mission in Haiti in the amount of 9,285,000 dollars as at 30 April 2022, and decides to defer action thereon until consideration of the final performance report of the United Nations Mission for Justice Support in Haiti by the General Assembly at its seventy-seventh session; __________________ 1 A/75/604. 2 A/75/850. A/RES/76/285 Financing of the United Nations Stabilization Mission in Haiti 22-10344 2/2",
    "5": "Urges all Member States to make every possible effort to ensure payment of their assessed contributions in full;",
    "6": "Decides to include in the provisional agenda of its seventy-seventh session the item entitled \u201cFinancing of the United Nations Stabilization Mission in Haiti\u201d. 89th plenary meeting 29 June 2022"
  },
  "agenda_items": [
    "Item 157"
  ],
  "symbol_references": []
}