{
  "symbol": "A/RES/73/311",
  "filename": "A_RES_73_311.pdf",
  "title": "73/311. Financing of the United Nations Interim Security Force for Abyei",
  "text": "United Nations \nA/RES/73/311\n \n \nGeneral Assembly \nDistr.: General \n16 July 2019 \n \n19-11307 (E)    180719   \n*1911307* \n \n \nSeventy-third session \nAgenda item 151 \n \n \n \n \n Resolution adopted by the General Assembly on 3 July 2019 \n \n \n \n \n \n[on the report of the Fifth Committee (A/73/925)] \n \n \n \n73/311. Financing of the United Nations Interim Security Force for Abyei \n \n \n \nThe General Assembly, \n \nHaving considered the reports of the Secretary-General on the financing of the \nUnited Nations Interim Security Force for Abyei 1  and the related report of the \nAdvisory Committee on Administrative and Budgetary Questions, 2  \n \nRecalling Security Council resolution 1990 (2011) of 27 June 2011, by which \nthe Council established the United Nations Interim Security Force for Abyei for a \nperiod of six months, and the subsequent resolutions by which the Council extended \nthe mandate of the Force, the latest of which were resolution 2469 (2019) of 14 May \n2019, by which the Council extended until 15 November 2019 the mandate of the \nForce as set out in paragraph 2 of resolution 1990 (2011), and resolution 2465 (2019) \nof 12 April 2019, by which the Council extended until 15 October 2019 the mandate \nmodification set forth in resolution 2024 (2011) of 14 December 2011 and paragraph 1 \nof resolution 2075 (2012) of 16 November 2012, \n \nRecalling also its resolution 66/241 A of 24 December 2011 on the financing of \nthe Force and its subsequent resolutions thereon, the latest of which was resolution \n72/289 of 5 July 2018, as well as its decision 72/558 of 5 July 2018,  \n \nReaffirming the general principles underlying the financing of United Nations \npeacekeeping operations, as stated in its resolutions 1874 (S-IV) of 27 June 1963, \n3101 (XXVIII) of 11 December 1973 and 55/235 of 23 December 2000,  \n \nMindful of the fact that it is essential to provide the Force with the financial \nresources necessary to enable it to fulfil its responsibilities under the relevant \nresolutions of the Security Council,  \n \n1. \nRequests the Secretary-General to entrust the Head of Mission with the \ntask of formulating future budget proposals in full accordance with the provisions of \nits resolutions 59/296 of 22 June 2005, 60/266 of 30 June 2006, 61/276 of 29 June \n__________________ \n \n1  A/73/610 and A/73/742. \n \n2  A/73/755/Add.11. \n\nA/RES/73/311 \nFinancing of the United Nations Interim Security Force for Abyei\n \n19-11307\n2/4 \n \n2007, 64/269 of 24 June 2010, 65/289 of 30 June 2011, 66/264 of 21 June 2012, \n69/307 of 25 June 2015 and 70/286 of 17 June 2016, as well as other relevant \nresolutions;  \n \n2. \nTakes note of the status of contributions to the United Nations Interim \nSecurity Force for Abyei as at 30 April 2019, including the contributions outstanding \nin the amount of 40.1 million United States dollars, representing some 1.9 per cent of \nthe total assessed contributions, notes with concern that only 70 Member States have \npaid their assessed contributions in full, and urges all other Member States, in \nparticular those in arrears, to ensure payment of their outstanding assessed \ncontributions;  \n \n3. \nExpresses its appreciation to those Member States that have paid their \nassessed contributions in full, and urges all other Member States to make every \npossible effort to ensure payment of their assessed contributions to the Force in full; \n \n4. \nExpresses concern at the financial situation with regard to peacekeeping \nactivities, in particular as regards the reimbursements to troop contributors that bear \nadditional burdens owing to overdue payments by Member States of their \nassessments;  \n \n5. \nEmphasizes that all future and existing peacekeeping missions shall be \ngiven equal and non-discriminatory treatment in respect of financial and \nadministrative arrangements;  \n \n6. \nAlso emphasizes that all peacekeeping missions shall be provided with \nadequate resources for the effective and efficient discharge of their respective \nmandates;  \n \n7. \nRequests the Secretary-General to ensure that proposed peacekeeping \nbudgets are based on the relevant legislative mandates; \n \n8. \nEndorses the conclusions and recommendations contained in the report of \nthe Advisory Committee on Administrative and Budgetary Questions, 2 subject to the \nprovisions of the present resolution, and requests the Secretary-General to ensure \ntheir full implementation; \n \n9. \nEmphasizes the importance of overall budgetary performance in \npeacekeeping operations, and requests the Secretary-General to continue to \nimplement the recommendations of the relevant oversight bodies and to report thereon \nin the context of the performance reports;  \n \n10. Also emphasizes the importance of the accountability system of the \nSecretariat, and requests the Secretary-General to continue to strengthen risk \nmanagement and internal controls in the management of peacekeeping budgets and to \nreport thereon in the context of his next report;  \n \n11. \nRequests the Secretary-General to ensure the full implementation of the \nrelevant provisions of its resolutions 59/296, 60/266, 61/276, 64/269, 65/289, 66/264, \n69/307 and 70/286;  \n \n12. Also requests the Secretary-General to take all action necessary to ensure \nthat the Force is administered with a maximum of efficiency and economy;  \n \n \n \nBudget performance report for the period from 1 July 2017 to 30 June 2018 \n \n \n13. Takes note of the report of the Secretary-General on the budget \nperformance of the Force for the period from 1 July 2017 to 30 June 2018; 3  \n \n__________________ \n \n3  A/73/610. \n\nFinancing of the United Nations Interim Security Force for Abyei \nA/RES/73/311\n \n3/4\n19-11307 \n \n \n \nBudget estimates for the period from 1 July 2019 to 30 June 2020 \n \n \n14. Decides to appropriate to the Special Account for the United Nations \nInterim Security Force for Abyei the amount of 279,136,900 dollars for the period \nfrom 1 July 2019 to 30 June 2020, inclusive of 260,177,000 dollars for the \nmaintenance of the Force, 14,737,100 dollars for the support account for \npeacekeeping operations, 2,625,700 dollars for the United Nations Logistics Base at \nBrindisi, Italy, and 1,597,100 dollars for the Regional Service Centre in Entebbe, \nUganda;  \n \n \n \nFinancing of the appropriation \n \n \n15. Decides \nto \napportion \namong \nMember \nStates \nthe \namount \nof \n104,676,338 dollars for the period from 1 July 2019 to 15 November 2019, in \naccordance with the levels updated in its resolution 73/272 of 22 December 2018, \ntaking into account the scale of assessments for 2019, as set out in its resolution \n73/271 of 22 December 2018;  \n \n16. Also decides that, in accordance with the provisions of its resolution \n973 (X) of 15 December 1955, there shall be set off against the apportionment among \nMember States, as provided for in paragraph 15 above, their respective share in the \nTax Equalization Fund of 1,629,638 dollars, comprising the estimated staff \nassessment income of 1,074,262 dollars approved for the Force, the prorated share of \n393,488 dollars of the estimated staff assessment income approved for the support \naccount, the prorated share of 104,063 dollars of the estimated staff assessment \nincome approved for the United Nations Logistics Base and the prorated share of \n57,825 dollars of the estimated staff assessment income approved for the Regional \nService Centre;  \n \n17. Further decides to apportion among Member States the amount of \n174,460,562 dollars for the period from 16 November 2019 to 30 June 2020, at a \nmonthly rate of 23,261,408 dollars, in accordance with the levels updated in its \nresolution 73/272, taking into account the scale of assessments for 2019 and 2020, as \nset out in its resolution 73/271, subject to a decision of the Security Council to extend \nthe mandate of the Force;  \n \n18. Decides that, in accordance with the provisions of its resolution 973 (X), \nthere shall be set off against the apportionment among Member States, as provided \nfor in paragraph 17 above, their respective share in the Tax Equalization Fund of \n2,716,062 dollars, comprising the estimated staff assessment income of 1,790,438 \ndollars approved for the Force, the prorated share of 655,812 dollars of the estimated \nstaff assessment income approved for the support account, the prorated share of \n173,437 dollars of the estimated staff assessment income approved for the United \nNations Logistics Base and the prorated share of 96,375 dollars of the estimated staff \nassessment income approved for the Regional Service Centre;  \n \n19. Also decides that, for Member States that have fulfilled their financial \nobligations to the Force, there shall be set off against their apportionment, as provided \nfor in paragraph 15 above, their respective share of the unencumbered balance and \nother revenue in the amount of 4,897,500 dollars in respect of the financial period \nended 30 June 2018, in accordance with the levels updated in its resolution 70/246 of \n23 December 2015, taking into account the scale of assessments for 2018, as set out \nin its resolution 70/245 of 23 December 2015;  \n \n20. Further decides that, for Member States that have not fulfilled their \nfinancial obligations to the Force, there shall be set off against their outstanding \nobligations their respective share of the unencumbered balance and other revenue in \n\nA/RES/73/311 \nFinancing of the United Nations Interim Security Force for Abyei\n \n19-11307\n4/4 \n \nthe amount of 4,897,500 dollars in respect of the financial period ended 30 June 2018, \nin accordance with the scheme set out in paragraph 19 above;  \n \n21. Decides that the increase of 397,600 dollars in the estimated staff \nassessment income in respect of the financial period ended 30 June 2018 shall be \nadded to the credits in the amount of 4,897,500 dollars referred to in paragraphs 19 \nand 20 above;  \n \n22. Encourages the Secretary-General to continue to take additional measures \nto ensure the safety and security of all personnel participating in the Force under the \nauspices of the United Nations, bearing in mind paragraphs 5 and 6 of Security \nCouncil resolution 1502 (2003) of 26 August 2003;  \n \n23. Invites voluntary contributions to the Force in cash and in the form of \nservices and supplies acceptable to the Secretary-General, to be administered, as \nappropriate, in accordance with the procedure and practices established by the \nGeneral Assembly;  \n \n24. Decides to include in the provisional agenda of its seventy-fourth session \nthe item entitled \u201cFinancing of the United Nations Interim Security Force for Abyei\u201d. \n \n97th plenary meeting \n3 July 2019 \n \n",
  "paragraphs": {
    "1": "Requests the Secretary-General to entrust the Head of Mission with the task of formulating future budget proposals in full accordance with the provisions of its resolutions 59/296 of 22 June 2005, 60/266 of 30 June 2006, 61/276 of 29 June 2007, 64/269 of 24 June 2010, 65/289 of 30 June 2011, 66/264 of 21 June 2012, 69/307 of 25 June 2015 and 70/286 of 17 June 2016, as well as other relevant resolutions;",
    "2": "Takes note of the status of contributions to the United Nations Interim Security Force for Abyei as at 30 April 2019, including the contributions outstanding in the amount of 40.1 million United States dollars, representing some 1.9 per cent of the total assessed contributions, notes with concern that only 70 Member States have paid their assessed contributions in full, and urges all other Member States, in particular those in arrears, to ensure payment of their outstanding assessed contributions;",
    "3": "Expresses its appreciation to those Member States that have paid their assessed contributions in full, and urges all other Member States to make every possible effort to ensure payment of their assessed contributions to the Force in full;",
    "4": "Expresses concern at the financial situation with regard to peacekeeping activities, in particular as regards the reimbursements to troop contributors that bear additional burdens owing to overdue payments by Member States of their assessments;",
    "5": "Emphasizes that all future and existing peacekeeping missions shall be given equal and non-discriminatory treatment in respect of financial and administrative arrangements;",
    "6": "Also emphasizes that all peacekeeping missions shall be provided with adequate resources for the effective and efficient discharge of their respective mandates;",
    "7": "Requests the Secretary-General to ensure that proposed peacekeeping budgets are based on the relevant legislative mandates;",
    "8": "Endorses the conclusions and recommendations contained in the report of the Advisory Committee on Administrative and Budgetary Questions, 2 subject to the provisions of the present resolution, and requests the Secretary-General to ensure their full implementation;",
    "9": "Emphasizes the importance of overall budgetary performance in peacekeeping operations, and requests the Secretary-General to continue to implement the recommendations of the relevant oversight bodies and to report thereon in the context of the performance reports;",
    "10": "Also emphasizes the importance of the accountability system of the Secretariat, and requests the Secretary-General to continue to strengthen risk management and internal controls in the management of peacekeeping budgets and to report thereon in the context of his next report;",
    "11": "Requests the Secretary-General to ensure the full implementation of the relevant provisions of its resolutions 59/296, 60/266, 61/276, 64/269, 65/289, 66/264, 69/307 and 70/286;",
    "12": "Also requests the Secretary-General to take all action necessary to ensure that the Force is administered with a maximum of efficiency and economy; Budget performance report for the period from 1 July 2017 to 30 June 2018",
    "13": "Takes note of the report of the Secretary-General on the budget performance of the Force for the period from 1 July 2017 to 30 June 2018; 3 Budget estimates for the period from 1 July 2019 to 30 June 2020",
    "14": "Decides to appropriate to the Special Account for the United Nations Interim Security Force for Abyei the amount of 279,136,900 dollars for the period from 1 July 2019 to 30 June 2020, inclusive of 260,177,000 dollars for the maintenance of the Force, 14,737,100 dollars for the support account for peacekeeping operations, 2,625,700 dollars for the United Nations Logistics Base at Brindisi, Italy, and 1,597,100 dollars for the Regional Service Centre in Entebbe, Uganda; Financing of the appropriation",
    "15": "Decides to apportion among Member States the amount of 104,676,338 dollars for the period from 1 July 2019 to 15 November 2019, in accordance with the levels updated in its resolution 73/272 of 22 December 2018, taking into account the scale of assessments for 2019, as set out in its resolution 73/271 of 22 December 2018;",
    "16": "Also decides that, in accordance with the provisions of its resolution 973 (X) of 15 December 1955, there shall be set off against the apportionment among Member States, as provided for in paragraph 15 above, their respective share in the Tax Equalization Fund of 1,629,638 dollars, comprising the estimated staff assessment income of 1,074,262 dollars approved for the Force, the prorated share of 393,488 dollars of the estimated staff assessment income approved for the support account, the prorated share of 104,063 dollars of the estimated staff assessment income approved for the United Nations Logistics Base and the prorated share of 57,825 dollars of the estimated staff assessment income approved for the Regional Service Centre;",
    "17": "Further decides to apportion among Member States the amount of 174,460,562 dollars for the period from 16 November 2019 to 30 June 2020, at a monthly rate of 23,261,408 dollars, in accordance with the levels updated in its resolution 73/272, taking into account the scale of assessments for 2019 and 2020, as set out in its resolution 73/271, subject to a decision of the Security Council to extend the mandate of the Force;",
    "18": "Decides that, in accordance with the provisions of its resolution 973 (X), there shall be set off against the apportionment among Member States, as provided for in paragraph 17 above, their respective share in the Tax Equalization Fund of 2,716,062 dollars, comprising the estimated staff assessment income of 1,790,438 dollars approved for the Force, the prorated share of 655,812 dollars of the estimated staff assessment income approved for the support account, the prorated share of 173,437 dollars of the estimated staff assessment income approved for the United Nations Logistics Base and the prorated share of 96,375 dollars of the estimated staff assessment income approved for the Regional Service Centre;",
    "19": "Also decides that, for Member States that have fulfilled their financial obligations to the Force, there shall be set off against their apportionment, as provided for in paragraph 15 above, their respective share of the unencumbered balance and other revenue in the amount of 4,897,500 dollars in respect of the financial period ended 30 June 2018, in accordance with the levels updated in its resolution 70/246 of 23 December 2015, taking into account the scale of assessments for 2018, as set out in its resolution 70/245 of 23 December 2015;",
    "20": " the amount of 4,897,500 dollars in respect of the financial period ended 30 June 2018, in accordance with the scheme set out in paragraph 19 above;",
    "21": "Decides that the increase of 397,600 dollars in the estimated staff assessment income in respect of the financial period ended 30 June 2018 shall be added to the credits in the amount of 4,897,500 dollars referred to in paragraphs 19 and 20 above;",
    "22": "Encourages the Secretary-General to continue to take additional measures to ensure the safety and security of all personnel participating in the Force under the auspices of the United Nations, bearing in mind paragraphs 5 and 6 of Security Council resolution 1502 (2003) of 26 August 2003;",
    "23": "Invites voluntary contributions to the Force in cash and in the form of services and supplies acceptable to the Secretary-General, to be administered, as appropriate, in accordance with the procedure and practices established by the General Assembly;",
    "24": "Decides to include in the provisional agenda of its seventy-fourth session the item entitled \u201cFinancing of the United Nations Interim Security Force for Abyei\u201d."
  },
  "agenda_items": [
    "Item 151"
  ],
  "symbol_references": []
}