{
  "symbol": "A/RES/75/316",
  "filename": "A_RES_75_316.pdf",
  "title": "75/316. Impact of rapid technological change on the achievement of the Sustainable Development Goals and targets",
  "text": "United Nations \nA/RES/75/316\n \n \nGeneral Assembly \nDistr.: General \n19 August 2021 \n \n21-11345 (E)    240821 \n*2111345* \n \n \nSeventy-fifth session \nAgenda item 136 \nImpact of rapid technological change on the achievement \nof the Sustainable Development Goals and targets \n \n \n \n \n Resolution adopted by the General Assembly \non 17 August 2021 \n \n \n \n \n[without reference to a Main Committee (A/75/L.123 and A/75/L.123/Add.1)] \n \n \n 75/316. Impact of rapid technological change on the achievement of the \nSustainable Development Goals and targets \n \n \n \nThe General Assembly, \n \nConsidering that technological change includes new and powerful tools that can \nhelp to realize the vision of the 2030 Agenda for Sustainable Development, 1 mindful \nthat the impact, opportunities and challenges of rapid technological change on \nsustainable development are being assessed in order to deepen their understanding, \nand recalling its resolution 73/17 of 26 November 2018, in which it decided to \ncontinue discussing the topic \u201cImpact of rapid technological change on the \nachievement of the Sustainable Development Goals and targets\u201d,  \n \nNoting that rapid technological change can contribute to the faster achievement \nof the 2030 Agenda by improving real incomes, enabling faster and wider deployment \nof novel solutions to economic, social and environmental obstacles, supporting more \ninclusive forms of participation in social and economic life, replacing \nenvironmentally costly modes of production with more sustainable ones and giving \npolicymakers powerful tools to design and plan development interventions, \n \nRecalling its resolutions 69/313 of 27 July 2015 and 70/1 of 25 September 2015, \nin which it established and launched a Technology Facilitation Mechanism to support \nthe Sustainable Development Goals, whose updated findings on this topic, as well as \nthose of the Commission on Science and Technology for Development, were \npresented and discussed at its sixth multi-stakeholder forum on science, technology \nand innovation for the Sustainable Development Goals,  \n \nRecalling also its resolutions 75/202 of 21 December 2020, 74/229 of \n19 December 2019, 74/247 of 27 December 2019, 75/1 of 21 September 2020, 75/176 \n__________________ \n \n1  Resolution 70/1. \n\nA/RES/75/316 \nImpact of rapid technological change on the achievement of the \nSustainable Development Goals and targets\n \n21-11345\n2/6 \n \nof 16 December 2020 and 75/267 of 25 March 2021, and other relevant resolutions, \nincluding Economic and Social Council resolution 2020/13 of 17 July 2020 on \nscience, technology and innovation for development, as well as its decision 75/564 of \n28 April 2021, and noting the developments in the work on emerging technologies by \nseveral United Nations system entities,  \n \nRecalling further the commitment on harnessing science, technology and \ninnovation with a greater focus on digital transformation for sustainable development, \nto promote research, capacity-building initiatives, innovation and technologies, \ntowards the achievement of the Goals and targets of the 2030 Agenda, and in this \nregard recognizing that rapid technological change can contribute, inter alia, to \nadvancements in health, energy, agriculture and food security, governance, education, \neconomy, finance, employment, social welfare and inclusion, gender equality and the \nempowerment of women and girls, and sustainable consumption and production \npatterns, \n \nNoting the establishment of the Office of the Secretary-General\u2019s Envoy on \nTechnology,  \n \nNoting with appreciation the convening of the annual multi-stakeholder forums \non science, technology and innovation for the Sustainable Development Goals, as \nwell as the ongoing work of the United Nations inter-agency task team on science, \ntechnology and innovation for the Sustainable Development Goals, including the \nGlobal Pilot Programme on Science, Technology and Innovation for the Sustainable \nDevelopment Goals Road Maps (STI for SDGs road maps) to support strategic tools \nfor ensuring policy coherence, linking public and private actions, and optimizing \ninvestments, and looking forward to the expanded operationalization of the 2030 \nConnect online platform as a gateway for information on existing science, technology \nand innovation initiatives, mechanisms and programmes, as the three components of \nthe Technology Facilitation Mechanism,  \n \nTaking note of the report of the High-level Panel on Digital Cooperation, entitled \n\u201cThe age of digital interdependence\u201d, submitted to the Secretary-General, the report \nof the Secretary-General entitled \u201cRoad map for digital cooperation: implementation \nof the recommendations of the High-level Panel on Digital Cooperation\u201d,2 the report \nof the Secretary-General\u2019s Task Force on Digital Financing of the Sustainable \nDevelopment Goals, entitled People\u2019s Money: Harnessing Digitalization to Finance \na Sustainable Future, the United Nations Conference on Trade and Development \nTechnology and Innovation Report 2021 and the Guiding Principles on Business and \nHuman Rights: Implementing the United Nations \u201cProtect, Respect and Remedy\u201d \nFramework,3 \n \nNoting with grave concern that almost half of the world\u2019s population, more than \nfour in five people in the least developed countries, and people in vulnerable \nsituations do not have access to the Internet, and that numerous barriers such as the \ninstallation of costly broadband connections, difficulties in financing the fibre-optic \ntechnologies required, unfavourable market dynamics, lower purchasing power in the \nleast developed countries as a limiting factor for connectivity providers and the lack \nof digital skills and digital literacy exacerbate digital divides and can limit the \nadoption of digital tools,  \n \nStressing the need to close all digital divides, which have been aggravated by \nthe coronavirus disease (COVID-19) pandemic, both between and within countries \nand including rural-urban, youth-older persons and gender digital divides, and to \npromote digital inclusion, by taking into account national and regional contexts and \n__________________ \n \n2  A/74/821. \n \n3  A/HRC/17/31, annex. \n\nImpact of rapid technological change on the achievement of the \nSustainable Development Goals and targets \nA/RES/75/316\n \n3/6\n21-11345 \n \naddressing the challenges associated with access, affordability, digital literacy and \ndigital skills and awareness and by ensuring that the benefits of new technologies are \navailable to all, taking into account the needs of those who are in vulnerable \nsituations, and noting the efforts to help to bridge digital divides and expand access, \nincluding the Connect 2030 Agenda for Global Telecommunication/Information and \nCommunication Technology, including Broadband, for Sustainable Development,  \n \nRecognizing that rapid technological change has enormous potential to support \nthe advancement of gender equality and the empowerment of all women and girls, by \nreducing the gender digital divide, providing them with opportunities to obtain and \nshare information, gain access to health and education services and to engage in \nnetworking and have their voices heard and providing women with opportunities to \ngain access to employment and to generate income, while also recognizing that it \nmight create challenges for progress, and welcoming the initiatives that focus on \naccess, skills and leadership to promote the equal participation of women and girls in \nthe digital age, and recognizing also that digital technologies can play an important \nrole for women and girls to exercise all human rights, including the right to freedom \nof opinion and expression, and in women\u2019s full, equal and effective participation in \npolitical, economic, cultural and social life,  \n \nRecognizing also the contributions of the United Nations Technology Bank for \nthe Least Developed Countries in facilitating access to and implementation of digital \ntechnologies, as well as in assisting the digital transformation of least developed \ncountries in their sustainable development, and the important role to be played by the \nBank in narrowing the digital gap between least developed countries and developed \ncountries,  \n \nReaffirming that the creation, development and diffusion of new innovations \nand technologies and associated know-how, including the transfer of technology on \nmutually agreed terms, are powerful drivers of economic growth and sustainable \ndevelopment,  \n \nReaffirming also that the same rights that people have offline must also be \nprotected online, and emphasizing that adaptation to rapid technological change \nshould be considered not only as a function of sustainable development and the \nspreading of information and communications technologies, but also with respect to \nthe realization of human rights and fundamental freedoms,  \n \nAcknowledging \nthat \nan \neffective \nInternet \nGovernance \nForum \nand \nmulti-stakeholder approaches are needed to drive the digital transition for the benefit \nof all, and to facilitate global digital cooperation,  \n \nReaffirming the value and principles of multi-stakeholder cooperation and \nengagement that have characterized the World Summit on the Information Society \nprocess since its inception, and recognizing that the effective participation, \npartnership and cooperation of all stakeholders, within their respective roles and \nresponsibilities, especially with balanced representation from developing countries, \nhave been and continue to be vital in developing the information society,  \n \nRecalling the high-level thematic debate convened by the President of the \nGeneral Assembly at its seventy-fourth session on the impact of rapid technological \nchange on the achievement of the Sustainable Development Goals on 11 June 2020, \nand noting the one-day high-level thematic debate on digital cooperation and \nconnectivity convened by the President of the General Assembly at its seventy-fifth \nsession on 27 April 2021, \n \nRecognizing the need for Governments, the private sector, international \norganizations, civil society, the technical and academic communities, along with other \nstakeholders, to be aware of the impacts of the latest developments in rapid \n\nA/RES/75/316 \nImpact of rapid technological change on the achievement of the \nSustainable Development Goals and targets\n \n21-11345\n4/6 \n \ntechnological change on achieving the Sustainable Development Goals, which \ncontinue to require international and multi-stakeholder cooperation, including in \ndiverse forums, such as the Internet Governance Forum, in order to benefit from \nopportunities brought up by the global and open Internet and address \nmultidimensional challenges, taking into account different national realities, \ncapacities and levels of development, and respecting national policies and priorities,  \n \n1. \nEncourages Member States to continue to consider the impact of key rapid \ntechnological changes on the achievement of the Sustainable Development Goals and \ntargets4 in order to benefit from opportunities and address challenges, promote the \ndevelopment of national strategies and public policies, science, technology and \ninnovation for the Sustainable Development Goals road maps (STI for SDGs road \nmaps), capacity-building and scientific engagement, and share best practices; \n \n2. \nUrges Member States and other stakeholders to take actions to bridge the \ndigital and knowledge divides, recognizing that approaches must be multidimensional \nand include an evolving understanding of what constitutes access, emphasizing the \nquality of that access, and acknowledges that speed, stability, affordability, language, \nlocal content and accessibility for persons with disabilities are now core elements and \nthat high-speed broadband is already an essential enabler of sustainable development;  \n \n3. \nStresses the need to provide universal and affordable access to the Internet \nby 2030, including meaningful use of digitally enabled services, in line with the \nSustainable Development Goals, and welcomes efforts by the United Nations to assist \nMember States, upon their request, in achieving this;  \n \n4. \nReaffirms that the same rights that people have offline must also be \nprotected online, including the right to privacy, with special regard given to the \nprotection of children;  \n \n5. \nCalls upon Member States to consider adopting or maintaining data \nprotection legislation, regulation and policies, including on digital communication \ndata, that comply with their international human rights obligations, which could \ninclude the establishment of national independent authorities with powers and \nresources to monitor data privacy practices, investigate violations and abuses and \nreceive communications from individuals and organizations, and to provide \nappropriate remedies;  \n \n6. \nUrges Member States and other stakeholders to close digital divides and \npromote digital inclusion, by taking into account national and regional contexts and \naddressing the challenges associated with access, affordability, digital literacy and \ndigital skills, including media and information literacy, and by ensuring that the \nbenefits of new technologies are available to all, taking into account the needs of \nthose who are in vulnerable situations as well as addressing intersectionality, negative \nsocial norms, language barriers, structural barriers and risks, and encourages \ncooperation between the United Nations development system and programme \ncountries, in line with their national policies and priorities, in order to promote and \nimprove digital inclusion;  \n \n7. \nEncourages Member States and all stakeholders to close the gender digital \ndivide, including by eliminating barriers to women\u2019s full, equal and effective \nparticipation both offline and in digital contexts, increasing women\u2019s and girls\u2019 access \nto digital technologies, promoting equal, safe and affordable access to information \nand communications technologies and to the Internet, enhancing women\u2019s and girls\u2019 \ndigital literacy and women\u2019s entrepreneurship, improving digital cooperation and \nharnessing the potential of rapid technological change to improve the lives of women \n__________________ \n \n4  See resolution 70/1. \n\nImpact of rapid technological change on the achievement of the \nSustainable Development Goals and targets \nA/RES/75/316\n \n5/6\n21-11345 \n \nand girls, and promoting connectivity and socioeconomic prosperity, and to address \nthe development divide, digital divides and the gender digital divide, addressing any \npotential negative impacts of digital technologies on gender equality and the \nempowerment of women and girls;  \n \n8. \nUrges Member States and other stakeholders to strengthen the role that \nrapid technological change can play in mitigating the negative impacts of the \nCOVID-19 pandemic on the achievement of the Sustainable Development Goals and \nto strengthen digital cooperation in the areas of e-commerce, financial technology, \ndigital capacity-building, affordable and reliable Internet connectivity and digital \ninfrastructure to achieve an inclusive, sustainable and resilient recovery and build \nback better after the COVID-19 pandemic and to take concerted action to further \nstrengthen scientific research, emerging technologies and new data sources and to \nbuild resilient, inclusive and integrated data and statistical systems, under the \nleadership of national statistical offices, that can respond to the increased and urgent \ndata demands in times of disaster and ensure a path towards the achievement of the \nSustainable Development Goals;  \n \n9. \nEncourages the promotion of digital solutions through access to and use \nof digital public goods, which may include open-source software, open data, open \nartificial intelligence models, open standards and open content that adhere to \ninternational and domestic laws, in unlocking the full potential of rapid technological \nchange to achieve the Sustainable Development Goals;  \n \n10. Recognizes the need for more coordinated and scaled-up global digital \ncapacity-building efforts and stronger capacity-building support at the country level, \nincluding in areas such as an appropriate enabling environment, sufficient resources, \ninfrastructure, education, investment, connectivity, growing digital economies, and \nsustainable and inclusive digital development, and thus encourages the Secretary-\nGeneral to continue working with all United Nations entities and other relevant \nstakeholders to strengthen efforts in this regard;  \n \n11. Stresses the importance of rapid technological change in ensuring food \nsecurity by 2030, and encourages the adoption of the most advanced and appropriate \ninformation technology in agriculture systems, and calls for enhanced international \ncooperation to facilitate access and promote investment in clean energy research, \ntechnology and infrastructure, in accordance with Goal 7 of the 2030 Agenda for \nSustainable Development;  \n \n12. Encourages Member States to continue and further strengthen engagement \nwith all relevant stakeholders, such as the private sector, in particular technology \ncompanies and financial institutions, civil society, the technical and research \ncommunities, including scientists and academia, recognizing that open and inclusive \nmulti-stakeholder cooperation is critical to best harness the potential of rapidly \naccelerating technologies to achieve the Sustainable Development Goals, while \naddressing their possible challenges;  \n \n13. Recognizes the need for different parts of the United Nations system to \nbetter harness digital technologies, in accordance with their respective mandates, and \nin this regard encourages the Secretary-General\u2019s Envoy on Technology to support \ncollaboration within and across the United Nations system, avoiding any duplication \nof efforts and enhancing transparency; \n \n14. Requests the Technology Facilitation Mechanism and the Commission on \nScience and Technology for Development, through the Economic and Social Council, \nto continue to consider, in a coordinated manner within their respective mandates and \nexisting resources, the impact of rapid technological changes and frontier \ntechnologies on the achievement of the Sustainable Development Goals and targets, \n\nA/RES/75/316 \nImpact of rapid technological change on the achievement of the \nSustainable Development Goals and targets\n \n21-11345\n6/6 \n \nand to align this endeavour with the follow-up cycle of the high-level political forum \non sustainable development in order to support the efforts of all countries towards the \nattainment of the Goals, including through forging partnerships with other relevant \nactors, organizations, initiatives and forums, and the dissemination of advances and \nbest practices to facilitate cooperation towards this end;  \n \n15. Reiterates the mandate of the multi-stakeholder forum on science, \ntechnology and innovation for the Sustainable Development Goals, 5 and encourages \nMember States and all stakeholders to consider its outcomes in relevant forums; \n \n16. Invites the Commission on Science and Technology for Development and \nthe Technology Facilitation Mechanism to strengthen synergies and mutually \nreinforce their work on science, technology and innovation, and requests the \nSecretariat to coordinate the dates of their meetings in order to avoid overlap and to \nensure coherence and coordination between both entities;  \n \n17. Reiterates its call for voluntary contributions for resources from both the \nprivate and the public sectors to support the full operationalization of all components \nof the Technology Facilitation Mechanism, in particular strengthening national \ncapacities in promoting the access of marginalized communities to science, \ntechnology and innovation through STI for SDGs road maps and the online platform, \nand invites Member States to provide voluntary financial and technical assistance to \nthe United Nations Technology Bank for the Least Developed Countries to enable it \nto reach its full potential, which will also bolster its effectiveness in mitigating the \nchallenges caused by the COVID-19 pandemic; \n \n18. Calls for better coordination and coherence among existing mechanisms, \nincluding the Secretary-General\u2019s Envoy on Technology, the Technology Facilitation \nMechanism, the Commission on Science and Technology for Development and other \nUnited Nations agencies and international organizations, within their respective \nmandates, in providing support to Member States in the field of rapid technological \nchange directed towards development priorities and needs;  \n \n19. Brings to the attention of the United Nations System Chief Executives \nBoard for Coordination the importance for the diverse United Nations entities, \nincluding the United Nations Sustainable Development Group, to take into \nconsideration the issue of rapid technological change, within their respective \nmandates, bearing in mind the three dimensions and the integrated and indivisible \nnature of the Sustainable Development Goals and targets; \n \n20. Decides to include in the provisional agenda of its seventy-seventh session \nthe item entitled \u201cImpact of rapid technological change on the achievement of the \nSustainable Development Goals and targets\u201d, in order to discuss the progress made in \nthe implementation of the present resolution, including the presentation of the work \nof the Technology Facilitation Mechanism, unless otherwise agreed; \n \n21. Requests the Secretary-General, in collaboration with his Envoy on \nTechnology, to submit to the General Assembly at its seventy-seventh session an \naction-oriented report, within existing resources, on the implementation of the present \nresolution, taking into account other relevant processes and documents. \n \n98th plenary meeting \n17 August 2021 \n \n__________________ \n \n5  Ibid., para. 70. \n",
  "paragraphs": {
    "1": "Encourages Member States to continue to consider the impact of key rapid technological changes on the achievement of the Sustainable Development Goals and targets4 in order to benefit from opportunities and address challenges, promote the development of national strategies and public policies, science, technology and innovation for the Sustainable Development Goals road maps (STI for SDGs road maps), capacity-building and scientific engagement, and share best practices;",
    "2": "Urges Member States and other stakeholders to take actions to bridge the digital and knowledge divides, recognizing that approaches must be multidimensional and include an evolving understanding of what constitutes access, emphasizing the quality of that access, and acknowledges that speed, stability, affordability, language, local content and accessibility for persons with disabilities are now core elements and that high-speed broadband is already an essential enabler of sustainable development;",
    "3": "Stresses the need to provide universal and affordable access to the Internet by 2030, including meaningful use of digitally enabled services, in line with the Sustainable Development Goals, and welcomes efforts by the United Nations to assist Member States, upon their request, in achieving this;",
    "4": "Reaffirms that the same rights that people have offline must also be protected online, including the right to privacy, with special regard given to the protection of children;",
    "5": "Calls upon Member States to consider adopting or maintaining data protection legislation, regulation and policies, including on digital communication data, that comply with their international human rights obligations, which could include the establishment of national independent authorities with powers and resources to monitor data privacy practices, investigate violations and abuses and receive communications from individuals and organizations, and to provide appropriate remedies;",
    "6": "Urges Member States and other stakeholders to close digital divides and promote digital inclusion, by taking into account national and regional contexts and addressing the challenges associated with access, affordability, digital literacy and digital skills, including media and information literacy, and by ensuring that the benefits of new technologies are available to all, taking into account the needs of those who are in vulnerable situations as well as addressing intersectionality, negative social norms, language barriers, structural barriers and risks, and encourages cooperation between the United Nations development system and programme countries, in line with their national policies and priorities, in order to promote and improve digital inclusion;",
    "7": "Encourages Member States and all stakeholders to close the gender digital divide, including by eliminating barriers to women\u2019s full, equal and effective participation both offline and in digital contexts, increasing women\u2019s and girls\u2019 access to digital technologies, promoting equal, safe and affordable access to information and communications technologies and to the Internet, enhancing women\u2019s and girls\u2019 digital literacy and women\u2019s entrepreneurship, improving digital cooperation and harnessing the potential of rapid technological change to improve the lives of women and girls, and promoting connectivity and socioeconomic prosperity, and to address the development divide, digital divides and the gender digital divide, addressing any potential negative impacts of digital technologies on gender equality and the empowerment of women and girls;",
    "8": "Urges Member States and other stakeholders to strengthen the role that rapid technological change can play in mitigating the negative impacts of the COVID-19 pandemic on the achievement of the Sustainable Development Goals and to strengthen digital cooperation in the areas of e-commerce, financial technology, digital capacity-building, affordable and reliable Internet connectivity and digital infrastructure to achieve an inclusive, sustainable and resilient recovery and build back better after the COVID-19 pandemic and to take concerted action to further strengthen scientific research, emerging technologies and new data sources and to build resilient, inclusive and integrated data and statistical systems, under the leadership of national statistical offices, that can respond to the increased and urgent data demands in times of disaster and ensure a path towards the achievement of the Sustainable Development Goals;",
    "9": "Encourages the promotion of digital solutions through access to and use of digital public goods, which may include open-source software, open data, open artificial intelligence models, open standards and open content that adhere to international and domestic laws, in unlocking the full potential of rapid technological change to achieve the Sustainable Development Goals;",
    "10": "Recognizes the need for more coordinated and scaled-up global digital capacity-building efforts and stronger capacity-building support at the country level, including in areas such as an appropriate enabling environment, sufficient resources, infrastructure, education, investment, connectivity, growing digital economies, and sustainable and inclusive digital development, and thus encourages the Secretary- General to continue working with all United Nations entities and other relevant stakeholders to strengthen efforts in this regard;",
    "11": "Stresses the importance of rapid technological change in ensuring food security by 2030, and encourages the adoption of the most advanced and appropriate information technology in agriculture systems, and calls for enhanced international cooperation to facilitate access and promote investment in clean energy research, technology and infrastructure, in accordance with Goal 7 of the 2030 Agenda for Sustainable Development;",
    "12": "Encourages Member States to continue and further strengthen engagement with all relevant stakeholders, such as the private sector, in particular technology companies and financial institutions, civil society, the technical and research communities, including scientists and academia, recognizing that open and inclusive multi-stakeholder cooperation is critical to best harness the potential of rapidly accelerating technologies to achieve the Sustainable Development Goals, while addressing their possible challenges;",
    "13": "Recognizes the need for different parts of the United Nations system to better harness digital technologies, in accordance with their respective mandates, and in this regard encourages the Secretary-General\u2019s Envoy on Technology to support collaboration within and across the United Nations system, avoiding any duplication of efforts and enhancing transparency;",
    "14": " and to align this endeavour with the follow-up cycle of the high-level political forum on sustainable development in order to support the efforts of all countries towards the attainment of the Goals, including through forging partnerships with other relevant actors, organizations, initiatives and forums, and the dissemination of advances and best practices to facilitate cooperation towards this end;",
    "15": "Reiterates the mandate of the multi-stakeholder forum on science, technology and innovation for the Sustainable Development Goals, 5 and encourages Member States and all stakeholders to consider its outcomes in relevant forums;",
    "16": "Invites the Commission on Science and Technology for Development and the Technology Facilitation Mechanism to strengthen synergies and mutually reinforce their work on science, technology and innovation, and requests the Secretariat to coordinate the dates of their meetings in order to avoid overlap and to ensure coherence and coordination between both entities;",
    "17": "Reiterates its call for voluntary contributions for resources from both the private and the public sectors to support the full operationalization of all components of the Technology Facilitation Mechanism, in particular strengthening national capacities in promoting the access of marginalized communities to science, technology and innovation through STI for SDGs road maps and the online platform, and invites Member States to provide voluntary financial and technical assistance to the United Nations Technology Bank for the Least Developed Countries to enable it to reach its full potential, which will also bolster its effectiveness in mitigating the challenges caused by the COVID-19 pandemic;",
    "18": "Calls for better coordination and coherence among existing mechanisms, including the Secretary-General\u2019s Envoy on Technology, the Technology Facilitation Mechanism, the Commission on Science and Technology for Development and other United Nations agencies and international organizations, within their respective mandates, in providing support to Member States in the field of rapid technological change directed towards development priorities and needs;",
    "19": "Brings to the attention of the United Nations System Chief Executives Board for Coordination the importance for the diverse United Nations entities, including the United Nations Sustainable Development Group, to take into consideration the issue of rapid technological change, within their respective mandates, bearing in mind the three dimensions and the integrated and indivisible nature of the Sustainable Development Goals and targets;",
    "20": "Decides to include in the provisional agenda of its seventy-seventh session the item entitled \u201cImpact of rapid technological change on the achievement of the Sustainable Development Goals and targets\u201d, in order to discuss the progress made in the implementation of the present resolution, including the presentation of the work of the Technology Facilitation Mechanism, unless otherwise agreed;",
    "21": "Requests the Secretary-General, in collaboration with his Envoy on Technology, to submit to the General Assembly at its seventy-seventh session an action-oriented report, within existing resources, on the implementation of the present resolution, taking into account other relevant processes and documents."
  },
  "agenda_items": [
    "Item 136"
  ],
  "symbol_references": [
    "A/75/L.123"
  ]
}