{
  "symbol": "A/RES/75/266",
  "filename": "A_RES_75_266.pdf",
  "title": "75/266. Cooperation between the United Nations and the International Fund for Saving the Aral Sea",
  "text": "United Nations \nA/RES/75/266\n \n \nGeneral Assembly \nDistr.: General \n8 March 2021 \n \n21-03046 (E)    100321 \n*2103046* \n \n \nSeventy-fifth session \nAgenda item 130 (z) \nCooperation between the United Nations and regional and \nother organizations: cooperation between the United Nations \nand the International Fund for Saving the Aral Sea \n \n \n \n \n Resolution adopted by the General Assembly \non 3 March 2021 \n \n \n \n \n[without reference to a Main Committee (A/75/L.66 and A/75/L.66/Add.1)] \n \n \n 75/266. Cooperation between the United Nations and the International \nFund for Saving the Aral Sea \n \n \n \nThe General Assembly, \n \nTaking note with satisfaction of the report of the Secretary-General on \ncooperation between the United Nations and regional and other organizations, 1 \n \nReferring to the Articles of the Charter of the United Nations that encourage \nmeasures for regional cooperation to advance the purposes and principles of the \nUnited Nations, \n \nReferring also to its resolution 63/133 of 11 December 2008, by which it granted \nthe International Fund for Saving the Aral Sea observer status in the General \nAssembly, \n \nReferring further to its resolution 73/297 of 28 May 2019 on cooperation \nbetween the United Nations and the International Fund for Saving the Aral Sea, \n \nRecalling with appreciation the joint communiqu\u00e9 adopted by the Heads of State \nof Kazakhstan, Tajikistan, Turkmenistan and Uzbekistan during a meeting of the \nCouncil of Heads of the Founding States of the International Fund for Saving the Aral \nSea, held in the Avaza national tourist area in Turkmenbashi, Turkmenistan, on \n24 August 2018,2 \n \nAcknowledging that the negative humanitarian, environmental and socioeconomic \nconsequences of the Aral Sea basin tragedy go well beyond the region and represent \na global concern, \n__________________ \n \n1 A/75/345-S/2020/898. \n \n2 A/73/444, annex. \n\nA/RES/75/266 \nCooperation between the United Nations and the \nInternational Fund for Saving the Aral Sea\n \n2/3 \n \n \nWelcoming the efforts of the States members of the International Fund for \nSaving the Aral Sea to attain objectives consistent with the purposes and principles \nof the United Nations, \n \nRecalling the creation of the multi-partner human security trust fund for the Aral \nSea region under the auspices of the United Nations, which aims to overcome the \nnegative circumstances of the ecological catastrophe in the Aral Sea region and \nimplement projects to improve the socioeconomic situation in the region, \n \nConvinced that the activities of the International Fund for Saving the Aral Sea \nand its bodies should take into account the interests and needs of all the countries of \nCentral Asia, \n \nReaffirming that achieving international cooperation in solving international \nproblems of an economic, social or humanitarian nature is one of the purposes of the \nUnited Nations, \n \nReferring to the relevant resolutions of the Security Council, including \nresolution 1631 (2005) of 17 October 2005, as well as statements by the President of \nthe Council in which the Council emphasized the importance of developing effective \npartnerships between the United Nations and regional and subregional organizations, \nin accordance with the Charter, \n \nWelcoming the commitment of the International Fund for Saving the Aral Sea to \nintensifying and deepening its cooperation with the agencies, programmes and funds \nof the United Nations system, \n \nReferring to its resolution 72/279 of 31 May 2018 on the repositioning of the \nUnited Nations development system in the context of the quadrennial comprehensive \npolicy review of operational activities for development of the United Nations system, \nand calling for more effective cooperation between Central Asian States and United \nNations agencies in support of the implementation of the 2030 Agenda for Sustainable \nDevelopment,3 \n \nConvinced that strengthening cooperation between the United Nations and the \nInternational Fund for Saving the Aral Sea will advance the purposes and principles \nof the United Nations, \n \n1. \nNotes the need for further improvement of the activities of the \nInternational Fund for Saving the Aral Sea to strengthen regional cooperation in such \nareas as social and economic development; environmental protection and response to \nnatural disasters; water resources management; adaptation to climate change and \nmitigation of its consequences; exchange of information; science and innovation; and \nother related areas; \n \n2. \nAlso notes the importance of strengthening cooperation and coordination \nbetween the United Nations system and the International Fund for Saving the Aral \nSea, and invites the Secretary-General to hold for that purpose regular consultations \nwith the Chair of the Executive Committee of the International Fund, making use of \nappropriate inter-agency forums and formats, including consultations between the \nSecretary-General and the heads of regional organizations; \n \n3. \nFurther notes the proposal on the need to consider the possibility of \ndeveloping a United Nations special programme for the Aral Sea basin and in this \nregard to hold consultations in 2022 with the Executive Committee of the International \nFund for Saving the Aral Sea, Member States and relevant United Nations agencies; \n__________________ \n \n3 Resolution 70/1. \n\nCooperation between the United Nations and the \nInternational Fund for Saving the Aral Sea \nA/RES/75/266\n \n3/3\n21-03046 \n \n \n4. \nEmphasizes \nthe \nimportance \nof \nthe \ndevelopment \nand \neffective \nimplementation of regional environmental protection programmes for sustainable \ndevelopment in Central Asia, including assistance programmes for the countries of \nthe Aral Sea basin; \n \n5. \nInvites the specialized agencies and other organizations, programmes and \nfunds of the United Nations system, as well as international financial institutions, to \ndevelop their cooperation with the International Fund for Saving the Aral Sea; \n \n6. \nRequests the Secretary-General to report to the General Assembly at its \nseventy-seventh session on the implementation of the present resolution; \n \n7. \nDecides to include in the provisional agenda of its seventy-seventh \nsession, under the item entitled \u201cCooperation between the United Nations and \nregional and other organizations\u201d, the sub-item entitled \u201cCooperation between the \nUnited Nations and the International Fund for Saving the Aral Sea\u201d. \n \n56th plenary meeting \n3 March 2021 \n \n",
  "paragraphs": {
    "1": "Notes the need for further improvement of the activities of the International Fund for Saving the Aral Sea to strengthen regional cooperation in such areas as social and economic development; environmental protection and response to natural disasters; water resources management; adaptation to climate change and mitigation of its consequences; exchange of information; science and innovation; and other related areas;",
    "2": "Also notes the importance of strengthening cooperation and coordination between the United Nations system and the International Fund for Saving the Aral Sea, and invites the Secretary-General to hold for that purpose regular consultations with the Chair of the Executive Committee of the International Fund, making use of appropriate inter-agency forums and formats, including consultations between the Secretary-General and the heads of regional organizations;",
    "3": "Further notes the proposal on the need to consider the possibility of developing a United Nations special programme for the Aral Sea basin and in this regard to hold consultations in 2022 with the Executive Committee of the International Fund for Saving the Aral Sea, Member States and relevant United Nations agencies; __________________ 3 Resolution 70/1. Cooperation between the United Nations and the International Fund for Saving the Aral Sea A/RES/75/266 3/3 21-03046",
    "4": "Emphasizes the importance of the development and effective implementation of regional environmental protection programmes for sustainable development in Central Asia, including assistance programmes for the countries of the Aral Sea basin;",
    "5": "Invites the specialized agencies and other organizations, programmes and funds of the United Nations system, as well as international financial institutions, to develop their cooperation with the International Fund for Saving the Aral Sea;",
    "6": "Requests the Secretary-General to report to the General Assembly at its seventy-seventh session on the implementation of the present resolution;",
    "7": "Decides to include in the provisional agenda of its seventy-seventh session, under the item entitled \u201cCooperation between the United Nations and regional and other organizations\u201d, the sub-item entitled \u201cCooperation between the United Nations and the International Fund for Saving the Aral Sea\u201d. 56th plenary meeting 3 March 2021"
  },
  "agenda_items": [
    "Item 130"
  ],
  "symbol_references": [
    "A/75/L.66"
  ]
}