{
  "symbol": "A/RES/73/264",
  "filename": "A_RES_73_264.pdf",
  "title": "73/264. Situation of human rights in Myanmar",
  "text": "United Nations \nA/RES/73/264\n \n \nGeneral Assembly \nDistr.: General \n22 January 2019 \n \n18-22647 (E)    240119 \n*1822647* \n \n \nSeventy-third session \nAgenda item 74 (c) \n \n \n \n \n Resolution adopted by the General Assembly \non 22 December 2018 \n \n \n \n \n[on the report of the Third Committee (A/73/589/Add.3)] \n \n \n 73/264. Situation of human rights in Myanmar \n \n \n \nThe General Assembly, \n \nGuided by the Charter of the United Nations and the Universal Declaration of \nHuman Rights,1 the International Covenants on Human Rights,2 the Convention on \nthe Rights of the Child3 and other relevant international law and human rights law \ninstruments,  \n \nNoting the importance of the role of regional organizations in efforts to achieve \npacific settlement of local disputes, as stipulated in Chapter VIII of the Charter,  \n \nReaffirming its previous resolutions on the situation of human rights in \nMyanmar, the most recent of which being resolution 72/248 of 24 December 2017, \nand recalling the resolutions and decisions of the Human Rights Council, the most \nrecent of which being resolutions 39/2 of 27 September 2018,4 37/32 of 23 March \n20185 and S-27/1 of 5 December 2017,6 and the statement by the President of the \nSecurity Council issued on 6 November 2017,7 \n \nWelcoming the appointment by the Secretary-General of a Special Envoy on \nMyanmar, the cooperation of the Government of Myanmar with the Special Envoy \nand the agreement on the opening of the office of the Special Envoy in Nay Pyi Taw, \nand commending the work of the Special Envoy since her appointment, including her \nrecent visits to the region and her consultations with a range of interlocutors,  \n__________________ \n \n1 Resolution 217 A (III). \n \n2 Resolution 2200 A (XXI), annex. \n \n3 United Nations, Treaty Series, vol. 1577, No. 27531. \n \n4 See Official Records of the General Assembly, Seventy-third Session, Supplement No. 53A \n(A/73/53/Add.1), chap. II. \n \n5 Ibid., Supplement No. 53 (A/73/53), chap. IV, sect. A. \n \n6 Ibid., chap. III. \n \n7 S/PRST/2017/22. \n\nA/RES/73/264 \nSituation of human rights in Myanmar\n \n18-22647\n2/8 \n \n \nWelcoming also the mandate of the independent international fact-finding \nmission on Myanmar, established by the Human Rights Council in its resolution 34/22 \nof 24 March 2017,8 and the decision by the Council in its resolution 39/2 to extend it, \n \nWelcoming further the decision by the Human Rights Council, in its resolution \n39/2, to establish an ongoing independent mechanism to collect, consolidate, preserve \nand analyse evidence of the most serious international crimes and violations of \ninternational law committed in Myanmar since 2011 and to prepare files in order to \nfacilitate and expedite fair and independent criminal proceedings, in accordance with \ninternational law standards, in national, regional or international courts or tribunals \nthat have, or may in the future have, jurisdiction over these crimes, in accordance \nwith international law, \n \nWelcoming the work of the independent international fact-finding mission on \nMyanmar, deeply regretting that the Government of Myanmar has not cooperated with \nthe fact-finding mission, and urging the Government to grant it and other human \nrights mechanisms full, unrestricted access to all areas and interlocutors,  \n \nStrongly regretting the decision of the Government of Myanmar to discontinue \ncooperation with the Special Rapporteur of the Human Rights Council on the situation \nof human rights in Myanmar and to deny her access to Myanmar since January 2018, \nand calling upon the Government of Myanmar to resume its cooperation with the \nSpecial Rapporteur without delay, \n \nWelcoming the report of the Special Rapporteur on the situation of human rights \nin Myanmar,9  \n \nExpressing grave concern at continuing reports of serious human rights \nviolations and abuses in Myanmar, in particular in Rakhine State, as well as in Kachin \nand northern Shan States, \n \nContinuing to underline the need for the armed forces of Myanmar to take \nimmediate steps to protect all persons within the country, including those belonging \nto the Rohingya community, by respecting international law, including human rights \nlaw, and ending the violence, and calling for urgent steps to ensure independent and \nimpartial investigations into all human rights violations and abuses and that those \ndisplaced by violence are able to voluntarily return in safety and dignity to their places \nof origin in a sustainable manner,  \n \nReiterating its deep distress at reports that unarmed Rohingya in Rakhine State \nare being subjected to the excessive use of force and violations of human rights by \nthe military and security forces, including extrajudicial, summary or arbitrary \nkillings, rape and other forms of sexual and gender-based violence, arbitrary detention \nand the enforced disappearance of Rohingya civilians in Rakhine State, and at reports \nof large-scale destruction of homes and systematic evictions in northern Rakhine \nState, including the use of arson and violence, as well as the unlawful use of force by \nnon-State actors, \n \nReiterating its grave concern that, in spite of the fact that Rohingya Muslims \nlived in Myanmar for generations prior to the independence of Myanmar, they were \nmade stateless by the enactment of the 1982 Citizenship Law and were eventually \ndisenfranchised, in 2015, from the electoral process, \n \nReaffirming that the denial of citizenship status and related rights to Rohingya \nMuslims and others, including voting rights, is a serious human rights concern,  \n__________________ \n \n8 See Official Records of the General Assembly, Seventy-second Session, Supplement No. 53 \n(A/72/53), chap. IV, sect. A. \n \n9 A/73/332. \n\nSituation of human rights in Myanmar \nA/RES/73/264\n \n3/8\n18-22647 \n \n \nNoting with deep concern that the targeted violence against the Rohingya \nMuslims and others in Rakhine State has forced over 723,000 people \u2013 most of them \nwomen and children \u2013 to flee to Bangladesh since 25 August 2017, \n \nNoting with deep concern also the security, human rights and humanitarian \nsituation in Rakhine, Kachin and Shan States and the continued serious violations and \nabuses of human rights of Rohingya Muslims and of persons belonging to other \nminorities, as well as the statelessness, disenfranchisement, economic dispossession, \nmarginalization, deprivation of livelihood and restrictions on freedom of movement \nfor persons belonging to the Rohingya community, including the confinement of \napproximately 120,000 people in camps for internally displaced persons, the majority \nof whom rely entirely on foreign aid,  \n \nNoting the stated commitment of the Government of Myanmar to implementing \nthe recommendations of the Advisory Commission on Rakhine State, regretting that \nover the past year the Government of Myanmar has not yet implemented the \nrecommendations, and calling upon the Government of Myanmar to implement fully \nthe recommendations of the Advisory Commission, including those regarding \ninclusive development, freedom of movement, human rights, security sector reform, \nhumanitarian access and access by the media, and a pathway to full citizenship for all \nindividuals without discrimination and regardless of ethnicity or religion, and to \naddress the underlying causes of the situation in Rakhine State,  \n \nAcknowledging with grave concern statements made by the Secretary-General \non 26 February 2018, the United Nations High Commissioner for Human Rights on \n7 March 2018, the Assistant Secretary-General for Human Rights on 6 March 2018 \nand the Secretary-General of the Organization of Islamic Cooperation on \n27 February 2018 on the situation of human rights in Rakhine State, in which they \nreferred to ethnic cleansing in Myanmar, and recalling the resolution adopted by the \nCouncil of Foreign Ministers of the Organization of Islamic Cooperation at its forty-\nfifth session on the establishment of an Organization of Islamic Cooperation ad hoc \nministerial committee on accountability for human rights violations against the \nRohingya and the recommendations made by the participants in the international \nconsultation meeting on the Rohingya crisis, which was held in Ankara on 6 July 2018, \n \nWelcoming the visit of the Security Council to Rohingya camps in Cox\u2019s Bazar, \nBangladesh, from 28 April to 1 May 2018, and sharing its grave concern at the scale \nof the humanitarian crisis on the ground and its emphasis on finding a solution to the \ncurrent situation of the Rohingya, \n \nWelcoming also the visit of the Secretary-General to Rohingya camps in Cox\u2019s \nBazar in July 2018, recalling his statement to the Security Council on 28 August 2018, \nin which he referred to the crisis in Rakhine State as \u201cone of the world\u2019s worst \nhumanitarian and human rights crises\u201d, and commending the Secretary-General\u2019s \ncontinued attention to this situation, \n \nExpressing concern at the reports of continued intimidation and violence against \nthe remaining Rohingya Muslim population and other minority groups in Myanmar,  \n \nRecalling the responsibility of States to comply with their relevant obligations, \nto prosecute those responsible for violations of international law, including \ninternational humanitarian law, international human rights law, international criminal \nlaw and international refugee law, as well as abuses of human rights law, and to \nprovide an effective remedy to any person whose rights have been violated, with a \nview to ending impunity,  \n \nReiterating the urgent need to ensure that all those responsible for crimes related \nto violations and abuses of international human rights law and international criminal \nlaw are held to account through credible and independent national, regional or \n\nA/RES/73/264 \nSituation of human rights in Myanmar\n \n18-22647\n4/8 \n \ninternational criminal justice mechanisms, while recalling the authority of the \nSecurity Council in this regard, \n \nNoting the establishment of an independent commission of inquiry by the \nGovernment of Myanmar on 30 July 2018 as a step towards ensuring accountability \nfor the human rights violations and abuses committed in Rakhine State, provided that \nthe commission, unlike previous national investigative mechanisms, is able to work \nwith independence, impartiality, transparency and objectivity,  \n \nNoting also the initial steps taken by the Government of Myanmar to improve \nthe situation in Rakhine State for all communities, including the setting up of the \nCentral Committee for the Implementation of Peace, Stability and Development in \nRakhine State and of the Union Enterprise for Humanitarian Assistance, Resettlement \nand Development in Rakhine, while underscoring the need for expedited \nimplementation of key reforms, including access to citizenship and freedom of \nmovement, to create the conditions necessary for refugees and other forcibly displaced \npersons to return to their places of origin voluntarily, safely and with dignity, \n \nRe-emphasizing the urgent right of all refugees and displaced persons to return \nhome in safety and dignity and in a voluntary and sustainable manner, \n \nNoting the signing, on 6 June 2018, of a memorandum of understanding between \nMyanmar and the United Nations Development Programme and the Office of the \nUnited Nations High Commissioner for Refugees on assistance in the repatriation \nprocess of displaced persons from Rakhine State, \n \nNoting also the signing of bilateral instruments between Bangladesh and \nMyanmar and the subsequent formation of the joint working group, while underlining \nthe need to create an environment conducive to the safe, voluntary, dignified and \nsustainable return of the displaced Rohingya, including assurances about the non-\noccurrence of violence, the rights related to citizenship and mobility and the \naccountability of perpetrators and justice for victims, \n \nExpressing deep concern regarding the continuing departure of members of the \nremaining Rohingya population and persons belonging to other minorities to \nBangladesh, and strongly urging the Government of Myanmar and the armed forces \nto lift the curfew order in Rakhine State, in particular to ensure freedom of movement \nand the safety and security of all persons without distinction of any kind, and to put \nan end to the extortion and intimidation of the Rohingya population,  \n \n1. \nExpresses grave concern at the findings of the independent international \nfact-finding mission on Myanmar10 that there is sufficient information to warrant \ninvestigation and prosecution so that a competent court may determine liability for \ngenocide in relation to the situation in Rakhine State, that crimes against humanity \nand war crimes have been committed in Kachin, Rakhine and Shan States, including \nmurder, imprisonment, enforced disappearance, torture, rape, sexual slavery and other \nforms of sexual violence, persecution and enslavement, that children were subjected \nto and witnessed serious human rights violations, including killing, maiming and \nsexual violence, that there are reasonable grounds to conclude that serious crimes \nunder international law have been committed that warrant criminal investigation and \nprosecution and that the military has consistently failed to respect international \nhuman rights law and international humanitarian law; \n \n2. \nStrongly condemns all violations and abuses of human rights in Myanmar, \nas set out in the report of the fact-finding mission, including the widespread, \nsystematic and gross human rights violations and abuses committed in Rakhine State, \nincluding the presence of elements of extermination and deportation and the \n__________________ \n \n10 See A/HRC/39/64. \n\nSituation of human rights in Myanmar \nA/RES/73/264\n \n5/8\n18-22647 \n \nsystematic oppression and discrimination that the fact-finding mission concluded may \namount to persecution and to the crime of apartheid, also strongly condemns the \ngrossly disproportionate response of the military and the security forces, deplores the \nserious deterioration of the security, human rights and humanitarian situation and \nthe exodus of more than 723,000 Rohingya Muslims and other minorities to \nBangladesh and the subsequent depopulation of northern Rakhine State, and calls \nupon the Myanmar authorities to ensure that those responsible for violations of \ninternational law, including human rights violations and abuses, are held accountable \nand removed from positions of power; \n \n3. \nCalls for a full and independent investigation of the human rights \nviolations and abuses committed, including against the Rohingya Muslims and \npersons belonging to other minorities, as reported by various United Nations bodies, \nincluding the Human Rights Council, the fact-finding mission and the Special \nRepresentative of the Secretary-General on Sexual Violence in Conflict, to ensure that \nthose responsible for such crimes are held accountable; \n \n4. \nNotes the establishment of an independent commission of inquiry by the \nGovernment of Myanmar as a step towards ensuring accountability for investigating \nalleged violations and abuses of human rights in Rakhine State, provided that the \ncommission, unlike preceding national investigative mechanisms, is able to work with \nindependence, impartiality, transparency and objectivity in a credible way in line with \ninternational standards, and encourages the commission to seek support and expertise \nfrom the United Nations and the international community; \n \n5. \nCalls for the expeditious entry into operation of the independent \nmechanism established by the Human Rights Council and steps to secure its effective \nfunctioning as soon as possible; \n \n6. \nNotes the recommendation by the fact-finding mission on the conduct of a \ncomprehensive, independent inquiry into the involvement of the United Nations in \nMyanmar since 2011, and encourages the United Nations system to follow up on the \nissues raised and to ensure that all engagement with Myanmar takes into account, and \naddresses, human rights concerns;  \n \n7. \nAlso notes the holding of the third session of the 21st-Century Panglong \nConference from 11 to 16 July 2018 and the progress made towards the principles of \na future democratic federal union of Myanmar, while calling for further steps, \nincluding an immediate cessation of fighting and hostilities, of targeting civilians and \nof all violations and abuses of international human rights law and international \nhumanitarian law in northern Myanmar and an inclusive and comprehensive national \npolitical dialogue ensuring the full, effective and meaningful participation of all \nethnic groups, women and young people, and persons with disabilities, as well as civil \nsociety, with the objective of achieving lasting peace;  \n \n8. \nReiterates the urgent call upon the Government of Myanmar: \n \n(a) \nTo take the necessary measures to address the spread of discrimination and \nprejudice and to combat the incitement of hatred against Rohingya Muslims and other \npersons belonging to minorities, including Kachin and Shan, by publicly condemning \nsuch acts and combating hate speech, while fully respecting international human \nrights law, as well as by promoting interfaith dialogue in cooperation with the \ninternational community and encouraging political and religious leaders in the \ncountry to work towards reconciliation among communities and national unity \nthrough dialogue;  \n \n(b) \nTo expedite efforts to eliminate statelessness and the systematic and \ninstitutionalized discrimination against members of ethnic and religious minorities, \nin particular relating to the Rohingya Muslims, by, inter alia, reviewing the 1982 \n\nA/RES/73/264 \nSituation of human rights in Myanmar\n \n18-22647\n6/8 \n \nCitizenship Law, which has led to deprivation of human rights, by ensuring equal \naccess to full citizenship through a transparent, voluntary and accessible procedure \nand to all civil and political rights, by allowing for self-identification, by amending \nor repealing all discriminatory legislation and policies, including discriminatory \nprovisions of the set of \u201cprotection of race and religion laws\u201d enacted in 2015 \ncovering religious conversion, interfaith marriage, monogamy and population \ncontrol, and by lifting all local orders restricting rights to freedom of movement and \naccess to civil registration, health and education services and livelihoods;  \n \n(c) \nTo dismantle the camps for internally displaced persons in Rakhine State, \nensuring that the return and relocation of internally displaced persons is carried out \nin accordance with international standards and best practices, including as set forth \nin the Guiding Principles on Internal Displacement;11  \n \n(d) \nTo create the conditions necessary for the safe, voluntary, dignified and \nsustainable return of refugees, to proactively apprise the prospective returnees about \ndevelopments in this regard and to formulate a time-bound road map for their \nimplementation; \n \n(e) \nTo allow full and unhindered access for the delivery of humanitarian \nassistance, including gender-responsive assistance, by humanitarian actors, including \nthe United Nations and its international partners, as well as by regional organizations, \nincluding but not limited to the Coordinating Centre for Humanitarian Assistance on \nDisaster Management of the Association of Southeast Asian Nations, to affected \npersons and communities, without fear of reprisals, intimidation or attack, and in this \nregard urges the Government of Myanmar to implement the various international \ncooperation agreements that have not yet been fully implemented for the distribution \nof humanitarian aid to all affected areas, including Rakhine, Kachin and Shan States, \nwithout discrimination;  \n \n(f) \nTo sustain the democratic transition of Myanmar by bringing all national \ninstitutions, including the military, under the democratically elected civilian \nGovernment; \n \n(g) \nTo ensure full protection of the human rights and fundamental freedoms \nof all persons in Myanmar, including Rohingya Muslims and persons belonging to \nother minorities, in an equal and dignified manner in order to prevent further \ninstability and insecurity, alleviate suffering, address the root causes of the situation \nand forge a viable, lasting and durable solution; \n \n(h) \nTo fulfil its human rights obligations and commitments to protect the rights \nto freedom of expression, association and peaceful assembly, to create and maintain \na safe and enabling environment for civil society and independent media and to ensure \nthe safety, security and freedom of journalists, media workers, civil society activists \nand human rights defenders, including while they are engaged in their work; \n \n9. \nUnderscores the importance of providing protection and assistance \nspecifically tailored to women and girls and to the victims of sexual violence; \n \n10. Reiterates its deep concern at the continued plight of Rohingya refugees \nand forcibly displaced persons living in Bangladesh and in other countries, and \nappreciates the commitment by the Government of Bangladesh to provide temporary \nshelter, humanitarian assistance and protection to them; \n \n11. \nExpresses grave concern at the potential retraumatization of survivors of \nhuman rights violations and abuses, particularly child survivors and sexual violence \nsurvivors, and calls upon all actors engaging in documentation work to follow \n__________________ \n \n11 E/CN.4/1998/53/Add.2, annex. \n\nSituation of human rights in Myanmar \nA/RES/73/264\n \n7/8\n18-22647 \n \ninternational human rights standards and the \u201cdo no harm\u201d principle for evidence-\ngathering in order to respect the dignity of survivors and to avoid retraumatization; \n \n12. Encourages further cooperation between Myanmar and Bangladesh in \norder to expedite the establishment of conditions that will allow for the safe, \nsustainable and voluntary return of Rohingya refugees and forcibly displaced persons, \nwith the full support and meaningful involvement of the international community, \nincluding the United Nations and its funds, programmes and agencies;  \n \n13. Also encourages the international community to (a) assist Bangladesh in \nproviding humanitarian assistance to Rohingya refugees and forcibly displaced \npersons until such time as they are voluntarily repatriated to Myanmar in safety and \ndignity; and (b) assist Myanmar in the provision of humanitarian assistance to \naffected persons of all communities who have been internally displaced, including \nthose in camps for internally displaced persons within Rakhine State;  \n \n14. Urges the Government of Myanmar to continue to work with the \nGovernment of Bangladesh and the United Nations, including the United Nations \nDevelopment Programme and the Office of the United Nations High Commissioner \nfor Refugees, to allow the voluntary return of all refugees and forcibly displaced \npersons in conditions of safety and dignity to their places of origin in Myanmar, \nincluding through the implementation of the memorandum of understanding signed \nbetween the Government of Myanmar and the United Nations Development \nProgramme and the Office of the High Commissioner; \n \n15. Recognizes with appreciation the assistance and support of the \ninternational community, including regional organizations, in particular the Association \nof Southeast Asian Nations, and the countries neighbouring Myanmar, and encourages \nsupport for the Government of Myanmar in the fulfilment of its international human \nrights obligations and commitments, the implementation of its democratic transition \nprocess, inclusive socioeconomic development and sustainable peace, as well as its \nnational reconciliation process involving all relevant stakeholders;  \n \n16. Emphasizes the need for the Governments of Myanmar and Bangladesh, \nas well as the United Nations, to ensure the voluntariness of the repatriation process \nand to ensure that the concerns, specific needs and requests of Rohingya refugees and \nother forcibly displaced persons are taken into account; \n \n17. Urges the international community to support the underfunded 2018 joint \nresponse plan for the Rohingya humanitarian crisis to ensure adequate resources for \naddressing the humanitarian crisis; \n \n18. Requests the Secretary-General: \n \n(a) \nTo continue to provide his good offices and to pursue his discussions \nrelating to Myanmar, involving all relevant stakeholders, and to offer assistance to \nthe Government of Myanmar; \n \n(b) \nTo extend the appointment of the Special Envoy on Myanmar and submit \nthe report of the Special Envoy covering all relevant issues addressed in the present \nresolution to the General Assembly at its seventy-fourth session; \n \n(c) \nTo provide all assistance necessary to enable the Special Envoy to \neffectively discharge her mandate and to brief Member States every six months, or as \notherwise requested or as warranted by the situation on the ground; \n \n(d) \nTo identify ways in which the existing mandates can more effectively \ndeliver in their respective areas of responsibility and can complement each other\u2019s \nwork through enhanced coordination; \n\nA/RES/73/264 \nSituation of human rights in Myanmar\n \n18-22647\n8/8 \n \n \n(e) \nTo call the continued attention of the Security Council to the situation in \nMyanmar with concrete recommendations for action towards resolving the \nhumanitarian crisis, promoting the safe, dignified, voluntary and sustainable return of \nRohingya refugees and forcibly displaced persons and ensuring accountability for \nthose responsible for human rights violations;  \n \n19. Requests that the Special Envoy participate by way of interactive dialogue \nin the seventy-fourth session of the General Assembly; \n \n20. Decides to remain seized of the matter, inter alia, on the basis of the reports \nof the Secretary-General, the fact-finding mission, the ongoing international \nmechanism, the Special Rapporteur of the Human Rights Council and the Special \nEnvoy on Myanmar. \n \n65th plenary meeting \n22 December 2018 \n \n",
  "paragraphs": {
    "1": "Expresses grave concern at the findings of the independent international fact-finding mission on Myanmar10 that there is sufficient information to warrant investigation and prosecution so that a competent court may determine liability for genocide in relation to the situation in Rakhine State, that crimes against humanity and war crimes have been committed in Kachin, Rakhine and Shan States, including murder, imprisonment, enforced disappearance, torture, rape, sexual slavery and other forms of sexual violence, persecution and enslavement, that children were subjected to and witnessed serious human rights violations, including killing, maiming and sexual violence, that there are reasonable grounds to conclude that serious crimes under international law have been committed that warrant criminal investigation and prosecution and that the military has consistently failed to respect international human rights law and international humanitarian law;",
    "2": "Strongly condemns all violations and abuses of human rights in Myanmar, as set out in the report of the fact-finding mission, including the widespread, systematic and gross human rights violations and abuses committed in Rakhine State, including the presence of elements of extermination and deportation and the systematic oppression and discrimination that the fact-finding mission concluded may amount to persecution and to the crime of apartheid, also strongly condemns the grossly disproportionate response of the military and the security forces, deplores the serious deterioration of the security, human rights and humanitarian situation and the exodus of more than 723,000 Rohingya Muslims and other minorities to Bangladesh and the subsequent depopulation of northern Rakhine State, and calls upon the Myanmar authorities to ensure that those responsible for violations of international law, including human rights violations and abuses, are held accountable and removed from positions of power;",
    "3": "Calls for a full and independent investigation of the human rights violations and abuses committed, including against the Rohingya Muslims and persons belonging to other minorities, as reported by various United Nations bodies, including the Human Rights Council, the fact-finding mission and the Special Representative of the Secretary-General on Sexual Violence in Conflict, to ensure that those responsible for such crimes are held accountable;",
    "4": "Notes the establishment of an independent commission of inquiry by the Government of Myanmar as a step towards ensuring accountability for investigating alleged violations and abuses of human rights in Rakhine State, provided that the commission, unlike preceding national investigative mechanisms, is able to work with independence, impartiality, transparency and objectivity in a credible way in line with international standards, and encourages the commission to seek support and expertise from the United Nations and the international community;",
    "5": "Calls for the expeditious entry into operation of the independent mechanism established by the Human Rights Council and steps to secure its effective functioning as soon as possible;",
    "6": "Notes the recommendation by the fact-finding mission on the conduct of a comprehensive, independent inquiry into the involvement of the United Nations in Myanmar since 2011, and encourages the United Nations system to follow up on the issues raised and to ensure that all engagement with Myanmar takes into account, and addresses, human rights concerns;",
    "7": "Also notes the holding of the third session of the 21st-Century Panglong Conference from 11 to 16 July 2018 and the progress made towards the principles of a future democratic federal union of Myanmar, while calling for further steps, including an immediate cessation of fighting and hostilities, of targeting civilians and of all violations and abuses of international human rights law and international humanitarian law in northern Myanmar and an inclusive and comprehensive national political dialogue ensuring the full, effective and meaningful participation of all ethnic groups, women and young people, and persons with disabilities, as well as civil society, with the objective of achieving lasting peace;",
    "8": " Citizenship Law, which has led to deprivation of human rights, by ensuring equal access to full citizenship through a transparent, voluntary and accessible procedure and to all civil and political rights, by allowing for self-identification, by amending or repealing all discriminatory legislation and policies, including discriminatory provisions of the set of \u201cprotection of race and religion laws\u201d enacted in 2015 covering religious conversion, interfaith marriage, monogamy and population control, and by lifting all local orders restricting rights to freedom of movement and access to civil registration, health and education services and livelihoods; (c) To dismantle the camps for internally displaced persons in Rakhine State, ensuring that the return and relocation of internally displaced persons is carried out in accordance with international standards and best practices, including as set forth in the Guiding Principles on Internal Displacement;11 (d) To create the conditions necessary for the safe, voluntary, dignified and sustainable return of refugees, to proactively apprise the prospective returnees about developments in this regard and to formulate a time-bound road map for their implementation; (e) To allow full and unhindered access for the delivery of humanitarian assistance, including gender-responsive assistance, by humanitarian actors, including the United Nations and its international partners, as well as by regional organizations, including but not limited to the Coordinating Centre for Humanitarian Assistance on Disaster Management of the Association of Southeast Asian Nations, to affected persons and communities, without fear of reprisals, intimidation or attack, and in this regard urges the Government of Myanmar to implement the various international cooperation agreements that have not yet been fully implemented for the distribution of humanitarian aid to all affected areas, including Rakhine, Kachin and Shan States, without discrimination; (f) To sustain the democratic transition of Myanmar by bringing all national institutions, including the military, under the democratically elected civilian Government; (g) To ensure full protection of the human rights and fundamental freedoms of all persons in Myanmar, including Rohingya Muslims and persons belonging to other minorities, in an equal and dignified manner in order to prevent further instability and insecurity, alleviate suffering, address the root causes of the situation and forge a viable, lasting and durable solution; (h) To fulfil its human rights obligations and commitments to protect the rights to freedom of expression, association and peaceful assembly, to create and maintain a safe and enabling environment for civil society and independent media and to ensure the safety, security and freedom of journalists, media workers, civil society activists and human rights defenders, including while they are engaged in their work;",
    "9": "Underscores the importance of providing protection and assistance specifically tailored to women and girls and to the victims of sexual violence;",
    "10": "Reiterates its deep concern at the continued plight of Rohingya refugees and forcibly displaced persons living in Bangladesh and in other countries, and appreciates the commitment by the Government of Bangladesh to provide temporary shelter, humanitarian assistance and protection to them;",
    "11": "Expresses grave concern at the potential retraumatization of survivors of human rights violations and abuses, particularly child survivors and sexual violence survivors, and calls upon all actors engaging in documentation work to follow international human rights standards and the \u201cdo no harm\u201d principle for evidence- gathering in order to respect the dignity of survivors and to avoid retraumatization;",
    "12": "Encourages further cooperation between Myanmar and Bangladesh in order to expedite the establishment of conditions that will allow for the safe, sustainable and voluntary return of Rohingya refugees and forcibly displaced persons, with the full support and meaningful involvement of the international community, including the United Nations and its funds, programmes and agencies;",
    "13": "Also encourages the international community to (a) assist Bangladesh in providing humanitarian assistance to Rohingya refugees and forcibly displaced persons until such time as they are voluntarily repatriated to Myanmar in safety and dignity; and (b) assist Myanmar in the provision of humanitarian assistance to affected persons of all communities who have been internally displaced, including those in camps for internally displaced persons within Rakhine State;",
    "14": "Urges the Government of Myanmar to continue to work with the Government of Bangladesh and the United Nations, including the United Nations Development Programme and the Office of the United Nations High Commissioner for Refugees, to allow the voluntary return of all refugees and forcibly displaced persons in conditions of safety and dignity to their places of origin in Myanmar, including through the implementation of the memorandum of understanding signed between the Government of Myanmar and the United Nations Development Programme and the Office of the High Commissioner;",
    "15": "Recognizes with appreciation the assistance and support of the international community, including regional organizations, in particular the Association of Southeast Asian Nations, and the countries neighbouring Myanmar, and encourages support for the Government of Myanmar in the fulfilment of its international human rights obligations and commitments, the implementation of its democratic transition process, inclusive socioeconomic development and sustainable peace, as well as its national reconciliation process involving all relevant stakeholders;",
    "16": "Emphasizes the need for the Governments of Myanmar and Bangladesh, as well as the United Nations, to ensure the voluntariness of the repatriation process and to ensure that the concerns, specific needs and requests of Rohingya refugees and other forcibly displaced persons are taken into account;",
    "17": "Urges the international community to support the underfunded 2018 joint response plan for the Rohingya humanitarian crisis to ensure adequate resources for addressing the humanitarian crisis;",
    "18": " (e) To call the continued attention of the Security Council to the situation in Myanmar with concrete recommendations for action towards resolving the humanitarian crisis, promoting the safe, dignified, voluntary and sustainable return of Rohingya refugees and forcibly displaced persons and ensuring accountability for those responsible for human rights violations;",
    "19": "Requests that the Special Envoy participate by way of interactive dialogue in the seventy-fourth session of the General Assembly;",
    "20": "Decides to remain seized of the matter, inter alia, on the basis of the reports of the Secretary-General, the fact-finding mission, the ongoing international mechanism, the Special Rapporteur of the Human Rights Council and the Special Envoy on Myanmar."
  },
  "agenda_items": [
    "Item 74"
  ],
  "symbol_references": []
}