{
  "symbol": "A/RES/74/196",
  "filename": "A_RES_74_196.pdf",
  "title": "74/196. Observer status for the Group of Seven Plus in the General Assembly",
  "text": "United Nations \nA/RES/74/196\n \n \nGeneral Assembly \nDistr.: General \n30 December 2019 \n \n19-22405 (E)    090120 \n*1922405* \n \n \nSeventy-fourth session \nAgenda item 171 \nObserver status for the Group of Seven Plus in the \nGeneral Assembly \n \n \n \n \n Resolution adopted by the General Assembly \non 18 December 2019 \n \n \n \n \n[on the report of the Sixth Committee (A/74/440)] \n \n \n 74/196. Observer status for the Group of Seven Plus \nin the General Assembly \n \n \n \nThe General Assembly, \n \nWishing to promote cooperation between the United Nations and the Group of \nSeven Plus, \n \n1. \nDecides to invite the Group of Seven Plus to participate in the sessions \nand the work of the General Assembly in the capacity of observer; \n \n2. \nRequests the Secretary-General to take the action necessary to implement \nthe present resolution. \n \n51st plenary meeting \n18 December 2019 \n \n",
  "paragraphs": {
    "1": "Decides to invite the Group of Seven Plus to participate in the sessions and the work of the General Assembly in the capacity of observer;",
    "2": "Requests the Secretary-General to take the action necessary to implement the present resolution."
  },
  "agenda_items": [
    "Item 171"
  ],
  "symbol_references": []
}