{
  "symbol": "A/RES/79/173",
  "filename": "A_RES_79_173.pdf",
  "title": "79/173. Missing persons",
  "text": "United Nations \nA/RES/79/173\n \n \nGeneral Assembly \nDistr.: General \n19 December 2024 \n \n24-24213 (E) \n*2424213* \n \n \nSeventy-ninth session \nAgenda item 71 (b) \nPromotion and protection of human rights: human rights \nquestions, including alternative approaches for improving \nthe effective enjoyment of human rights and \nfundamental freedoms \n \n \n \n \n Resolution adopted by the General Assembly \non 17 December 2024 \n \n \n \n \n[on the report of the Third Committee (A/79/458/Add.2, para. 99)] \n \n \n 79/173. Missing persons \n \n \n \nThe General Assembly, \n \nGuided by the purposes, principles and provisions of the Charter of the United \nNations,  \n \nGuided also by the principles and norms of international humanitarian law, in \nparticular the Geneva Conventions of 12 August 1949 1 and the Additional Protocols \nthereto of 1977,2 as well as international standards and instruments of human rights, \nin particular the Universal Declaration of Human Rights, 3 the International Covenant \non Economic, Social and Cultural Rights,4 the International Covenant on Civil and \nPolitical Rights,5 the Convention on the Elimination of All Forms of Discrimination \nagainst Women, 6  the Convention on the Rights of the Child 7  and the Vienna \nDeclaration and Programme of Action adopted by the World Conference on Human \nRights on 25 June 1993,8 \n \nRecalling the accession by 76 States to the International Convention for the \nProtection of All Persons from Enforced Disappearance, 9 and calling upon States that \nhave not yet done so to consider signing, ratifying or acceding to it as a matter of \n__________________ \n \n1 United Nations, Treaty Series, vol. 75, Nos. 970\u2013973. \n \n2 Ibid., vol. 1125, Nos. 17512 and 17513. \n \n3 Resolution 217 A (III). \n \n4 See resolution 2200 A (XXI), annex. \n \n5 Ibid. \n \n6 United Nations, Treaty Series, vol. 1249, No. 20378. \n \n7 Ibid., vol. 1577, No. 27531. \n \n8 A/CONF.157/24 (Part I), chap. III. \n \n9 United Nations, Treaty Series, vol. 2716, No. 48088. \n\nA/RES/79/173 \nMissing persons\n \n24-24213\n2/6 \n \npriority, as well as to consider the option provided for in articles 31 and 32 of the \nConvention regarding the Committee on Enforced Disappearances,  \n \nRecalling also all previous relevant resolutions on missing persons adopted by \nthe General Assembly, as well as the resolutions and decisions adopted by the \nCommission on Human Rights and the Human Rights Council, and Security Council \nresolution 2474 (2019) of 11 June 2019,  \n \nRecalling further General Assembly resolution 77/220 of 15 December 2022 as \nwell as all previous resolutions and decisions adopted by the Commission on Human \nRights and the Human Rights Council on the right to the truth,  \n \nNoting with deep concern the growing number of armed conflicts in various \nparts of the world, often involving serious violations of international humanitarian \nlaw and international human rights law,  \n \nNoting that the issue of persons reported missing in connection with \ninternational or non-international armed conflicts, in particular those who are victims \nof violations of international humanitarian law and international human rights law, \ncontinues to have a negative impact on efforts to put an end to those conflicts and to \nfacilitate peace and reconciliation, and inflicts grievous suffering on the families of \nmissing persons, and stressing in this regard the need to address the issue from, inter \nalia, a humanitarian and rule of law perspective, recalling the obligations of States \nand of parties to armed conflict to clarify the fate and whereabouts of missing persons,  \n \nExpressing its concern about the dramatic increase since 2014 in persons \nreported missing in connection with armed conflict, and recognizing that it is critical \nfor States to address the issue holistically, from prevention to the tracing, location, \nidentification and return of missing persons,  \n \nConsidering that the problem of missing persons may raise questions of \ninternational humanitarian law and international human rights law, as appropriate,  \n \nBearing in mind that cases of missing persons involve conduct that may \nconstitute criminal offences, and stressing the importance of ending impunity for \nviolations of international humanitarian law and international human rights law with \nrespect to missing persons,  \n \nExpressing its deep concern that thousands of migrants continue to die or go \nmissing each year along perilous routes on land and at sea, in transit and destination \ncountries, and recalling in this regard the adoption of the Progress Declaration of the \nInternational Migration Review Forum10 which, inter alia, requested the Secretary-\nGeneral to include actionable recommendations on strengthening cooperation on \nmissing migrants and providing humanitarian assistance,  \n \nCognizant that States that are parties to an armed conflict have a responsibility \nfor countering the phenomenon of missing persons, taking all appropriate measures \nto prevent persons from going missing, including, when appropriate, effectively \ninvestigating the conditions relating to persons going missing and determining the \nfate of missing persons, and for recognizing their accountability as regards \nimplementing the relevant mechanisms, policies and laws, while noting the \nimportance for States to take steps to ensure the forensic recovery and identification \nof remains, where possible,  \n \nNoting that accountability, including the promotion of truth, justice, reparations \nand guarantees of non-recurrence, is one of the key components of addressing the \nissue of missing persons,  \n__________________ \n \n10 Resolution 76/266, annex. \n\nMissing persons \nA/RES/79/173\n \n3/6\n24-24213 \n \n \nBearing in mind the effective search for and identification of missing persons \nusing forensic sciences and new and emerging technologies, and recognizing that \ngreat technological progress has been made in this field, including DNA forensic \nanalysis, which can significantly assist efforts to identify missing persons and to \ninvestigate violations of international humanitarian law and international human \nrights law,  \n \nRecognizing the potential offered by new and emerging technologies for the \nsearch for and identification of missing persons, and acknowledging, in this regard, \nthe opportunity to include these technologies in search activities and criminal \ninvestigations in combination with traditional approaches and techniques, while \nsafeguarding personal data protection and privacy rights,  \n \nRecognizing also that the establishment and effective work of competent \nnational institutions can play a crucial role in clarifying the fate of missing persons \nin connection with armed conflict,  \n \nBearing in mind that the question of missing persons entails consequences not \nonly for the victims themselves, but also for their families, especially women, youth, \nchildren and older persons, and in this regard recognizing the importance of \naddressing the legal situation of missing persons in connection with armed conflict, \nsupporting their family members through national policies that include a gender \nperspective, as appropriate, and ensuring their participation in relevant processes \nrelated to actions taken in response to cases of missing persons, as well as their access \nto information and effective remedies, and stressing, in this regard, the importance of \nensuring the protection of the families of missing persons and all individuals involved \nin the search, investigation and accountability processes against threats and violence, \nsuch as harassment, blackmail, ill-treatment and intimidation, including through the \nuse of information and communications technology, \n \nNoting, in this regard, the progress made by coordination mechanisms, \nestablished in different parts of the world, aiming at exchanging information and \nidentifying missing persons, which have contributed to informing families of the fate \nand whereabouts of their missing relatives,  \n \nRecognizing that respect for and implementation of international humanitarian \nlaw can reduce the number of cases of missing persons in armed conflict, and in this \nregard stressing the importance of encouraging greater understanding of and respect \nfor international humanitarian law,  \n \nStressing the importance of measures to prevent persons from going missing in \nconnection with armed conflict, which may include enacting national legislation, \nensuring the registration of detainees and notification upon their detention and \nallowing them to correspond with their families, ensuring the right to be treated with \nhumanity and respecting the human rights of all detainees and persons unaccounted \nfor, providing appropriate training for armed forces, producing and providing proper \nmeans of identification, the establishment of information bureaux, grave registration \nservices and registers of deaths, ensuring accountability in cases of missing persons \nand complying with obligations under international humanitarian law regarding \npersons deprived of their liberty,  \n \nNoting that the adequate, respectful and dignified management of the dead and \ngood practices in casualty recording can complement efforts to prevent persons from \ngoing missing and help to clarify the fate and whereabouts of persons unaccounted \nfor in armed conflict,  \n \nStressing the need to raise public awareness of the problem of missing persons \nas an important concern, as well as relevant provisions of international humanitarian \nlaw and human rights law, \n\nA/RES/79/173 \nMissing persons\n \n24-24213\n4/6 \n \n \nNoting the Agreement on the Status and Functions of the International \nCommission on Missing Persons, 11  which established the Commission as an \ninternational organization,  \n \nNoting with appreciation the ongoing international and regional efforts to \naddress the question of missing persons and the initiatives undertaken by international \nand regional organizations in this field,  \n \nNoting the work of the Global Alliance for the Missing with the aim of \ncollectively bringing to bear diplomatic, political and financial capacities and \ninfluence to improve the prevention of, and response to, the issue of missing persons,  \n \nTaking note of the report of the Secretary-General,12  \n \n1. \nUrges States to strictly observe and to respect and ensure respect for the \nrules of international humanitarian law, as set out in the Geneva Conventions of \n12 August 1949 and, where applicable, in the Additional Protocols thereto of 1977;  \n \n2. \nCalls upon States parties to an armed conflict to take all appropriate \nmeasures to prevent persons from going missing in connection with armed conflict, \nto account for persons reported missing as a result of such a situation and, in cases of \nmissing persons, to take such measures, as appropriate, in order to ensure thorough, \nprompt, impartial and effective investigations and the prosecution of offences linked \nto missing persons, consistent with their obligations under international law, with a \nview to full accountability, access to justice and adequate reparations;  \n \n3. \nCalls upon States to take measures to prevent persons from going missing \nin connection with armed conflict, including by fully implementing their obligations \nand commitments under international humanitarian law and international human \nrights law, including through the facilitation of the reunion of families dispersed as a \nresult of armed conflict, and to allow for the exchange of family news, consistent with \ntheir international obligations;  \n \n4. \nUrges States to avoid harm to civilians as an important factor in preventing \npersons from going missing in connection with armed conflict, including in \nminimizing the military use of civilian infrastructure, in accordance with applicable \ninternational law;  \n \n5. \nReaffirms the right of families to know the fate of their relatives reported \nmissing in connection with armed conflict and the importance of ensuring their \nparticipation in relevant processes related to actions taken in response to cases of \nmissing persons;  \n \n6. \nAlso reaffirms that each party to an armed conflict, as soon as \ncircumstances permit and, at the latest, from the end of active hostilities, shall search \nfor persons who have been reported missing by an adverse party and ensure that all \nrelevant information on those who died as a result of armed conflict is recorded;  \n \n7. \nCalls upon States that are parties to an armed conflict to take all necessary \nmeasures, in a timely manner, to determine the identity and fate of persons reported \nmissing in connection with the armed conflict, without any adverse distinction, and, \nto the greatest extent possible, to provide their family members, through appropriate \nchannels, with all relevant information that they have on their fate, including their \nwhereabouts or, if they are dead, the circumstances and cause of their death;  \n \n8. \nRecognizes the need for appropriate means of identification and for the \ncollection, protection and management of data on missing persons and unidentified \n__________________ \n \n11 United Nations, Treaty Series, vol. 3072, No. 53043. \n \n12 A/79/282. \n\nMissing persons \nA/RES/79/173\n \n5/6\n24-24213 \n \nremains, consistent with applicable international and national law, and urges all \nconcerned States to cooperate with each other and with other concerned actors \nworking in this area by, inter alia, providing all relevant information related to \nmissing persons, including on their fate and whereabouts;  \n \n9. \nExpresses concern at the impediments caused by landmines, explosive \nremnants of war and improvised explosive devices, in certain instances, to efforts on \nidentifying the whereabouts of missing persons, and calls upon States concerned to \ncooperate to facilitate the safe search for human remains and retrieval operations;  \n \n10. Requests States to pay the utmost attention to cases of children reported \nmissing in connection with armed conflict and to take appropriate measures to search \nfor and identify those children and to reunite them with their families;  \n \n11. \nExpresses its support for the efforts of the International Committee of the \nRed Cross in seeking access to information on persons reported missing, and calls \nupon all parties to armed conflict to comply with their commitments in respect of \nsuch access and to cooperate with the International Committee of the Red Cross and \nits Central Tracing Agency in addressing the issue of missing persons, consistent with \napplicable obligations under international humanitarian law, and to adopt a \ncomprehensive approach to this issue, including all such legal and practical measures \nand coordination mechanisms as may be necessary, based on humanitarian \nconsiderations only;  \n \n12. Urges States that are parties to an armed conflict to cooperate, consistent \nwith their international obligations, in order to effectively solve cases of missing \npersons, including by providing mutual assistance in terms of information-sharing, \nvictim assistance, location and identification of missing persons and recovery, \nidentification and return of human remains and, if possible, by identifying, mapping \nand preserving burial sites;  \n \n13. Invites States to encourage interaction between competent organizations \nand institutions, such as national commissions on missing persons, which play a \ncrucial role in clarifying the fate of persons missing in connection with armed conflict \nand providing support to the families of the missing;  \n \n14. Urges States, and encourages intergovernmental and non-governmental \norganizations, to take all necessary measures at the national, regional and \ninternational levels to address the problem of persons reported missing in connection \nwith armed conflict without any adverse distinction and to provide appropriate \nassistance, as requested by the concerned States, and welcomes in this regard the \nestablishment and efforts of commissions and working groups on missing persons;  \n \n15. Calls upon States, without prejudice to their efforts to determine the fate \nof persons reported missing in connection with armed conflict, to take appropriate \nsteps with regard to the legal situation of missing persons and the individual needs \nand accompaniment of their family members, with particular attention to the needs of \nwomen, youth, children, older persons and persons with disabilities, in such fields as \nsocial welfare, psychological and psychosocial support, financial matters, family law \nand property rights;  \n \n16. Invites States, national institutions and, as appropriate, intergovernmental, \ninternational and non-governmental organizations to further their engagement in \norder to follow forensic best practices as they apply to preventing and resolving cases \nof missing persons in connection with armed conflict;  \n \n17. Also \ninvites \nStates, \nnational \ninstitutions \nand, \nas \nappropriate, \nintergovernmental, international and non-governmental organizations to exchange \nbest practices and technical recommendations and to promote cooperation, as \n\nA/RES/79/173 \nMissing persons\n \n24-24213\n6/6 \n \nappropriate, including between relevant human rights mechanisms and procedures \nrelated to missing persons, pertaining, inter alia, to the search for and clarification of \nthe fate and whereabouts of missing persons, the use and development of digital tools, \nforensic analysis and identification and addressing the needs of families;  \n \n18. Further invites States, national institutions and, as appropriate, \nintergovernmental, international and non-governmental organizations to ensure the \ndevelopment and proper management of archives pertaining to missing persons and \nunidentified remains in connection with armed conflict, as well as access to those \narchives, in accordance with relevant applicable laws and regulations;  \n \n19. Stresses the need to address the issue of missing persons as a part of peace \nand peacebuilding processes, with reference to all justice and rule of law mechanisms, \nincluding the judiciary, parliamentary commissions and truth-finding mechanisms, on \nthe basis of transparency, accountability and public involvement and participation, \nincluding the participation of the families of missing persons in relevant processes;  \n \n20. Welcomes the progress made in clarifying the fate of missing persons in \nconnection with armed conflict;  \n \n21. Invites relevant human rights mechanisms and procedures, as appropriate, \nto address the problem of persons reported missing in connection with armed conflict \nin their forthcoming reports to the General Assembly;  \n \n22. Requests the Secretary-General to continue to seek further the views of \nMember States and relevant agencies and to submit to the Human Rights Council at \nits relevant session and to the General Assembly at its eighty-first session a \ncomprehensive report on the implementation of the present resolution, including \nrelevant practical recommendations;  \n \n23. Reiterates its invitation to the President of the General Assembly to \nconvene an informal biennial meeting of the General Assembly, and requests the \nSecretary-General to brief the Assembly during such meetings on the comprehensive \nreport on the implementation of the present resolution, to be followed by a dialogue; \n \n24. Requests the Secretary-General to bring the present resolution to the \nattention of all Governments, the competent United Nations bodies, the specialized \nagencies, regional intergovernmental organizations and international humanitarian \norganizations;  \n \n25. Decides to consider the question at its eighty-first session. \n \n53rd plenary meeting \n17 December 2024 \n \n",
  "paragraphs": {
    "1": "Urges States to strictly observe and to respect and ensure respect for the rules of international humanitarian law, as set out in the Geneva Conventions of 12 August 1949 and, where applicable, in the Additional Protocols thereto of 1977;",
    "2": "Calls upon States parties to an armed conflict to take all appropriate measures to prevent persons from going missing in connection with armed conflict, to account for persons reported missing as a result of such a situation and, in cases of missing persons, to take such measures, as appropriate, in order to ensure thorough, prompt, impartial and effective investigations and the prosecution of offences linked to missing persons, consistent with their obligations under international law, with a view to full accountability, access to justice and adequate reparations;",
    "3": "Calls upon States to take measures to prevent persons from going missing in connection with armed conflict, including by fully implementing their obligations and commitments under international humanitarian law and international human rights law, including through the facilitation of the reunion of families dispersed as a result of armed conflict, and to allow for the exchange of family news, consistent with their international obligations;",
    "4": "Urges States to avoid harm to civilians as an important factor in preventing persons from going missing in connection with armed conflict, including in minimizing the military use of civilian infrastructure, in accordance with applicable international law;",
    "5": "Reaffirms the right of families to know the fate of their relatives reported missing in connection with armed conflict and the importance of ensuring their participation in relevant processes related to actions taken in response to cases of missing persons;",
    "6": "Also reaffirms that each party to an armed conflict, as soon as circumstances permit and, at the latest, from the end of active hostilities, shall search for persons who have been reported missing by an adverse party and ensure that all relevant information on those who died as a result of armed conflict is recorded;",
    "7": "Calls upon States that are parties to an armed conflict to take all necessary measures, in a timely manner, to determine the identity and fate of persons reported missing in connection with the armed conflict, without any adverse distinction, and, to the greatest extent possible, to provide their family members, through appropriate channels, with all relevant information that they have on their fate, including their whereabouts or, if they are dead, the circumstances and cause of their death;",
    "8": "Recognizes the need for appropriate means of identification and for the collection, protection and management of data on missing persons and unidentified remains, consistent with applicable international and national law, and urges all concerned States to cooperate with each other and with other concerned actors working in this area by, inter alia, providing all relevant information related to missing persons, including on their fate and whereabouts;",
    "9": "Expresses concern at the impediments caused by landmines, explosive remnants of war and improvised explosive devices, in certain instances, to efforts on identifying the whereabouts of missing persons, and calls upon States concerned to cooperate to facilitate the safe search for human remains and retrieval operations;",
    "10": "Requests States to pay the utmost attention to cases of children reported missing in connection with armed conflict and to take appropriate measures to search for and identify those children and to reunite them with their families;",
    "11": "Expresses its support for the efforts of the International Committee of the Red Cross in seeking access to information on persons reported missing, and calls upon all parties to armed conflict to comply with their commitments in respect of such access and to cooperate with the International Committee of the Red Cross and its Central Tracing Agency in addressing the issue of missing persons, consistent with applicable obligations under international humanitarian law, and to adopt a comprehensive approach to this issue, including all such legal and practical measures and coordination mechanisms as may be necessary, based on humanitarian considerations only;",
    "12": "Urges States that are parties to an armed conflict to cooperate, consistent with their international obligations, in order to effectively solve cases of missing persons, including by providing mutual assistance in terms of information-sharing, victim assistance, location and identification of missing persons and recovery, identification and return of human remains and, if possible, by identifying, mapping and preserving burial sites;",
    "13": "Invites States to encourage interaction between competent organizations and institutions, such as national commissions on missing persons, which play a crucial role in clarifying the fate of persons missing in connection with armed conflict and providing support to the families of the missing;",
    "14": "Urges States, and encourages intergovernmental and non-governmental organizations, to take all necessary measures at the national, regional and international levels to address the problem of persons reported missing in connection with armed conflict without any adverse distinction and to provide appropriate assistance, as requested by the concerned States, and welcomes in this regard the establishment and efforts of commissions and working groups on missing persons;",
    "15": "Calls upon States, without prejudice to their efforts to determine the fate of persons reported missing in connection with armed conflict, to take appropriate steps with regard to the legal situation of missing persons and the individual needs and accompaniment of their family members, with particular attention to the needs of women, youth, children, older persons and persons with disabilities, in such fields as social welfare, psychological and psychosocial support, financial matters, family law and property rights;",
    "16": "Invites States, national institutions and, as appropriate, intergovernmental, international and non-governmental organizations to further their engagement in order to follow forensic best practices as they apply to preventing and resolving cases of missing persons in connection with armed conflict;",
    "17": " appropriate, including between relevant human rights mechanisms and procedures related to missing persons, pertaining, inter alia, to the search for and clarification of the fate and whereabouts of missing persons, the use and development of digital tools, forensic analysis and identification and addressing the needs of families;",
    "18": "Further invites States, national institutions and, as appropriate, intergovernmental, international and non-governmental organizations to ensure the development and proper management of archives pertaining to missing persons and unidentified remains in connection with armed conflict, as well as access to those archives, in accordance with relevant applicable laws and regulations;",
    "19": "Stresses the need to address the issue of missing persons as a part of peace and peacebuilding processes, with reference to all justice and rule of law mechanisms, including the judiciary, parliamentary commissions and truth-finding mechanisms, on the basis of transparency, accountability and public involvement and participation, including the participation of the families of missing persons in relevant processes;",
    "20": "Welcomes the progress made in clarifying the fate of missing persons in connection with armed conflict;",
    "21": "Invites relevant human rights mechanisms and procedures, as appropriate, to address the problem of persons reported missing in connection with armed conflict in their forthcoming reports to the General Assembly;",
    "22": "Requests the Secretary-General to continue to seek further the views of Member States and relevant agencies and to submit to the Human Rights Council at its relevant session and to the General Assembly at its eighty-first session a comprehensive report on the implementation of the present resolution, including relevant practical recommendations;",
    "23": "Reiterates its invitation to the President of the General Assembly to convene an informal biennial meeting of the General Assembly, and requests the Secretary-General to brief the Assembly during such meetings on the comprehensive report on the implementation of the present resolution, to be followed by a dialogue;",
    "24": "Requests the Secretary-General to bring the present resolution to the attention of all Governments, the competent United Nations bodies, the specialized agencies, regional intergovernmental organizations and international humanitarian organizations;",
    "25": "Decides to consider the question at its eighty-first session."
  },
  "agenda_items": [
    "Item 71"
  ],
  "symbol_references": []
}