{
  "symbol": "A/RES/76/140",
  "filename": "A_RES_76_140.pdf",
  "title": "76/140. Improvement of the situation of women and girls in rural areas",
  "text": "United Nations \nA/RES/76/140\n \n \nGeneral Assembly \nDistr.: General \n6 January 2022 \n \n21-19150 (E)    110122 \n*2119150* \n \n \nSeventy-sixth session \nAgenda item 29 (a) \nAdvancement of women: advancement of women \n \n \n \n \n Resolution adopted by the General Assembly \non 16 December 2021 \n \n \n \n \n[on the report of the Third Committee (A/76/455, para. 21)] \n \n \n 76/140. Improvement of the situation of women and girls in rural areas \n \n \n \nThe General Assembly, \n \nRecalling its resolutions 56/129 of 19 December 2001, 58/146 of 22 December \n2003, 60/138 of 16 December 2005, 62/136 of 18 December 2007, 64/140 of \n18 December 2009, 66/129 of 19 December 2011, 68/139 of 18 December 2013, 70/132 \nof 17 December 2015, 72/148 of 19 December 2017 and 74/126 of 18 December 2019, \n \nReaffirming the obligation of all States to promote and protect all human rights \nand fundamental freedoms, and also that all forms of discrimination, including \ndiscrimination against women and girls, are contrary to the Charter of the United \nNations, the Universal Declaration of Human Rights, 1 the International Covenant on \nCivil and Political Rights,2 the International Covenant on Economic, Social and \nCultural Rights,3 the Convention on the Elimination of All Forms of Discrimination \nagainst Women,4 the Convention on the Rights of the Child,5 the Convention on the \nRights of Persons with Disabilities6 and other human rights instruments, \n \nReaffirming also the commitment made to gender equality and the empowerment \nof all women and girls, including those in rural areas, contained in the outcome \ndocuments of relevant international conferences and summits, in particular the Beijing \nDeclaration and Platform for Action adopted at the Fourth World Conference on Women,7 \nthe outcome of the twenty-third special session of the General Assembly entitled \u201cWomen \n__________________ \n \n1 Resolution 217 A (III). \n \n2 See resolution 2200 A (XXI), annex. \n \n3 Ibid. \n \n4 United Nations, Treaty Series, vol. 1249, No. 20378. \n \n5 Ibid., vol. 1577, No. 27531. \n \n6 Ibid., vol. 2515, No. 44910. \n \n7 Report of the Fourth World Conference on Women, Beijing, 4\u201315 September 1995 \n(United Nations publication, Sales No. E.96.IV.13), chap. I, resolution 1, annexes I and II. \n\nA/RES/76/140 \nImprovement of the situation of women and girls in rural areas\n \n21-19150\n2/10 \n \n2000: gender equality, development and peace for the twenty-first century\u201d8 and the \noutcome document of the high-level plenary meeting of the General Assembly known as \nthe World Conference on Indigenous Peoples,9 and recalling other instruments, as \nappropriate, such as the United Nations Declaration on the Right to Development, 10 \n \nReaffirming further the outcome document of the United Nations summit for the \nadoption of the post-2015 development agenda, entitled \u201cTransforming our world: the \n2030 Agenda for Sustainable Development\u201d,11 and the Addis Ababa Action Agenda \nof the Third International Conference on Financing for Development,12 \n \nRecalling that the 2030 Agenda for Sustainable Development addresses the need \nto achieve gender equality and the empowerment of all women and girls, in order to \nensure that no one is left behind, and that the systematic mainstreaming of a gender \nperspective in the implementation of the 2030 Agenda is crucial, \n \nRecognizing that the achievement of full human potential and of sustainable \ndevelopment is not possible if one half of humanity continues to be denied its full \nhuman rights and opportunities, \n \nTaking note of the Secretary-General\u2019s High-level Panel on Women\u2019s Economic \nEmpowerment, \n \nRecalling the agreed conclusions of the Commission on the Status of Women at \nits sixty-second session13 and its priority theme \u201cChallenges and opportunities in \nachieving gender equality and the empowerment of rural women and girls\u201d, \n \nRecognizing that progress on the achievement of gender equality and the \nempowerment of women and girls, in particular in rural areas, has been held back \nowing to the persistence of historical and structural unequal power relations between \nwomen and men, poverty and inequalities and disadvantages in access to resources \nand opportunities that limit women\u2019s and girls\u2019 capabilities, and growing gaps in \nequality of opportunity, discriminatory laws, policies, social norms, attitudes, harmful \ncustomary and contemporary practices and gender stereotypes, \n \nExpressing its deep concern that discrimination and violence against women and \ngirls, including those in rural areas, continue to occur in all parts of the world and \nthat all forms of violence and discrimination, including multiple and intersecting \nforms of discrimination, that women and girls face are impediments to the \ndevelopment of their full potential as equal partners with men and boys in all aspects \nof life, as well as obstacles to the achievement of the Sustainable Development Goals, \n \nExpressing its deep concern also that, while women contribute more than 50 per \ncent of the food produced worldwide, they account for 70 per cent of the world\u2019s \nhungry, and that women and girls are disproportionately affected by hunger, food \ninsecurity and poverty, in part as a result of gender inequality and discrimination, \n \nExpressing concern that many rural women continue to be economically and \nsocially disadvantaged because of their limited access to economic resources and \nopportunities and their limited access or lack of access to quality education, health-\ncare services, justice, land, sustainable and time- and labour-saving infrastructure and \ntechnology, water and sanitation and other resources, as well as to credit, extension \nservices and agricultural inputs, and expressing concern also about their exclusion \n__________________ \n \n8 Resolution S-23/2, annex, and resolution S-23/3, annex. \n \n9 Resolution 69/2. \n \n10 Resolution 41/128, annex. \n \n11 Resolution 70/1. \n \n12 Resolution 69/313, annex. \n \n13 Official Records of the Economic and Social Council, 2018, Supplement No. 7 (E/2018/27), \nchap. I, sect. A. \n\nImprovement of the situation of women and girls in rural areas \nA/RES/76/140\n \n3/10\n21-19150 \n \nfrom planning and decision-making and their disproportionate share of unpaid care \nand domestic work, \n \nEmphasizing that rural women\u2019s poverty is directly related to the absence of \neconomic opportunities and autonomy and the lack of access to economic and productive \nresources, quality education and support services and of women\u2019s participation in the \ndecision-making process, and recognizing that rural women\u2019s poverty and lack of \nempowerment as well as their exclusion from social and economic policies can place \nthem at increased risk of violence that can impede their social and economic \ndevelopment, as well as the achievement of the Sustainable Development Goals, \n \nRecognizing that, despite gains in providing access to quality education, rural \ngirls are still more likely than rural boys to remain excluded from education and that \namong the gender-specific barriers to girls\u2019 equal enjoyment of their right to education \nare the feminization of poverty, child labour undertaken by girls, child, early and \nforced marriage, female genital mutilation, early and repeat pregnancies, all forms of \nviolence, including gender-based violence, abuse and harassment on the way to and \nfrom and at school, in their technology-mediated environment, the lack of safe and \nadequate sanitation facilities, including for menstrual hygiene management, the \ndisproportionate share of unpaid care and domestic work performed by girls and \ngender stereotypes and negative social norms that lead families and communities to \nplace less value on the education of girls than that of boys and may influence the \ndecision of parents to allow girls to attend school, \n \nRecognizing also the Voluntary Guidelines on the Responsible Governance of \nTenure of Land, Fisheries and Forests in the Context of National Food Security 14 and \nthe Principles for Responsible Investment in Agriculture and Food Systems,15 \nendorsed by the Committee on World Food Security, which embrace gender equality \nas one of the main guiding principles of implementation in order to help to address \nthe ongoing disparities with regard to access to and control of land and other natural \nresources, \n \nDeeply concerned that climate change poses a challenge to poverty eradication \nand the achievement of the Sustainable Development Goals, threatens food security \nand increases the risks of famine and adversely impacts the health and well-being of \nrural women and their families, and that rural women and girls, especially in \ndeveloping countries, are disproportionately affected by the impacts of desertification, \ndeforestation, sand and dust storms, natural disasters, persistent drought, extreme \nweather events, sea level rise, coastal erosion and ocean acidification and often have \nlimited capacities to adapt to climate change, \n \nRecognizing that women and girls in rural areas may be particularly vulnerable \nto violence because of multidimensional poverty and lack of access to social care and \nprotection services and, as applicable, employment opportunities, as well as negative \nsocial norms, \n \n1. \nTakes note of the report of the Secretary-General;16 \n \n2. \nUrges Member States, in collaboration with the organizations of the \nUnited Nations system and civil society, as appropriate, to continue their efforts to \nimplement the outcome of and to ensure an integrated and coordinated follow-up to \nthe relevant United Nations conferences and summits, including their reviews, and to \n__________________ \n \n14 Food and Agriculture Organization of the United Nations, document CL 144/9 (C 2013/20), \nappendix D. \n \n15 Food and Agriculture Organization of the United Nations, document C 2015/20, appendix D. \n \n16 A/76/241. \n\nA/RES/76/140 \nImprovement of the situation of women and girls in rural areas\n \n21-19150\n4/10 \n \nattach greater importance to the improvement of the situation of rural women and \ngirls in their national, regional and global development strategies by, inter alia: \n \n(a) \nCreating an enabling environment for improving their situation and \nensuring systematic attention to their needs, priorities and contributions, as well as \ngender equality and the empowerment of all women and girls, including through \nenhanced cooperation and a gender perspective, and the full and equal participation \nof all women in the development, implementation and follow-up of macroeconomic \npolicies, including development policies and programmes and poverty eradication \nstrategies, including poverty reduction strategy papers, where they exist, aimed at \nimplementing the 2030 Agenda for Sustainable Development; \n \n(b) \nEncouraging Member States to consider adopting and pursuing national \nfinancial inclusion strategies and gender-responsive strategies to end the structural \nbarriers to women\u2019s equal access to economic resources and to expand peer learning, \nexperience-sharing and capacity-building in rural areas; \n \n(c) \nSupporting the important role of civil society in promoting the realization \nand fulfilment of the human rights and fundamental freedoms of all women, including \nrural women; \n \n(d) \nTaking steps in the design, implementation and pursuit of fiscal policies \nand gender-responsive budgeting to promote gender equality and the empowerment \nof rural women and girls; \n \n(e) \nPursuing the political and socioeconomic empowerment of rural women \nand supporting their full and equal participation in decision-making at all levels, \nincluding through affirmative action, where appropriate, including by promoting and \nprotecting the right to vote and to be elected and the right to freedom of expression, \npeaceful assembly and association, and through support for women\u2019s and farmers\u2019 \norganizations in which subsistence and smallholder women farmers are members, \nlabour unions, cooperatives or other associations and civil society groups promoting \nrural women\u2019s rights; \n \n(f) \nPromoting consultation with and the participation of rural women and, as \nappropriate, girls, including those who are indigenous, those with disabilities and \nolder women, through their organizations and networks, in the design, development \nand implementation of and follow-up to programmes and strategies for gender \nequality, the empowerment of women and rural development; \n \n(g) \nEnsuring that the perspectives of rural women and girls are taken into \naccount and that rural women fully, meaningfully and equally participate in the \ndesign, implementation, follow-up and evaluation of policies and activities related to \nconflict prevention, the mitigation of post-conflict situations, peace mediation, the \nimpacts of climate change and emergencies, including natural disasters, humanitarian \nassistance, peacebuilding and post-conflict reconstruction, and taking appropriate \nmeasures to eliminate all forms of violence and discrimination against rural women \nand girls in this regard; \n \n(h) \nIntegrating a gender perspective into the design, implementation and \nevaluation of and follow-up to development policies, plans and programmes, \nincluding budget policies, where lacking, ensuring coordination between line \nministries, gender policymakers, gender machineries and other relevant government \norganizations and institutions with gender expertise, and paying increased attention \nto the needs of rural women and girls to ensure that they benefit from policies and \nprogrammes adopted in all spheres and that the disproportionate number of rural \nwomen living in poverty is reduced; \n\nImprovement of the situation of women and girls in rural areas \nA/RES/76/140\n \n5/10\n21-19150 \n \n \n(i) \nMainstreaming a gender perspective in decision-making processes and the \ngovernance of natural resources, leveraging the participation and influence of women \nin managing the sustainable use of natural resources, and enhancing the capacities of \nGovernments, civil society and development partners to better understand and address \ngender issues in the management and governance of natural resources; \n \n(j) \nImplementing effective, high-impact, quality-assured, people-centred, \ngender- and disability-responsive and evidence-based interventions to meet the health \nneeds of rural women and girls, particularly those in vulnerable situations, throughout \ntheir life course; \n \n(k) \nStrengthening measures, including resource generation, to improve \nwomen\u2019s health, including maternal health, by addressing the specific health, \nnutrition and basic needs of rural women and taking concrete measures to enhance \nand provide access to the highest attainable standards of physical and mental health \nfor women of all ages in rural areas, as well as quality, affordable and universally \naccessible primary health care and support services, including prenatal and postnatal \nhealth care, emergency obstetric care, family planning, information and education, \nincreasing knowledge, awareness and support for the elimination of harmful practices \nand the prevention, treatment and care of sexually transmitted infections, including \nHIV, and ensuring universal access to sexual and reproductive health and reproductive \nrights in accordance with the Programme of Action of the International Conference \non Population and Development,17 the Beijing Platform for Action18 and the outcome \ndocuments of their review conferences; \n \n(l) \nStrengthening the prevention, treatment and care of infections, such as \nHIV, in rural areas, by providing accessible information, social care services and \ninfrastructure; \n \n(m) Taking appropriate measures to ensure that women\u2019s and girls\u2019 \ndisproportionate share of unpaid care and domestic work, as well as contributions to \non-farm and off-farm production, is recognized, including by fully recognizing and \nvaluing unpaid care and domestic work through the provision of public services, \ninfrastructure and social protection policies and the promotion of shared \nresponsibility within the household and the family, and to promote nationally \nappropriate policies and initiatives supporting the reconciliation of work and family \nlife and the equal sharing of responsibilities between men and women with a view to \nreducing and equitably distributing such unpaid work, including through, inter alia, \nthe provision of infrastructure, technology and public services, such as water and \nsanitation, renewable energy, transport and information and communications \ntechnology, as well as addressing the need for accessible, affordable and quality \nchildcare and care facilities in rural areas; \n \n(n) \nPromoting sustainable, gender-responsive, quality, reliable and resilient \ninfrastructure, including by scaling up investment in health facilities in rural areas \nand by improving access to safe drinking water and sanitation, including through \nprovisions for menstrual hygiene management, and safe cooking and heating practices \nto improve the health and nutrition of rural women and girls; \n \n(o) \nInvesting in and strengthening efforts to meet the basic needs of rural \nwomen, including needs relating to their food security and nutrition and that of their \nfamilies, and to promote adequate standards of living for them, as well as decent \nconditions for work and improved access to local, regional and global markets through \n__________________ \n \n17 Report of the International Conference on Population and Development, Cairo, 5\u201313 September \n1994 (United Nations publication, Sales No. E.95.XIII.18), chap. I, resolution 1, annex. \n \n18 Report of the Fourth World Conference on Women, Beijing, 4\u201315 September 1995 \n(United Nations publication, Sales No. E.96.IV.13), chap. I, resolution 1, annex II. \n\nA/RES/76/140 \nImprovement of the situation of women and girls in rural areas\n \n21-19150\n6/10 \n \nimproved availability, access to and use of critical rural infrastructure, such as energy \nand transport, science and technology, local services, capacity-building and human \nresources development measures and the provision of a safe and reliable water supply \nand sanitation, nutritional programmes, affordable housing programmes, education \nand literacy programmes, social support measures and health care, including HIV \nprevention, treatment, care, including psychosocial aspects, and support services; \n \n(p) \nFully engaging men and boys, including community leaders, as strategic \npartners and allies in achieving gender equality and the empowerment of women and \ngirls, and eliminating all forms of discrimination and violence against them, including \nby working to counteract attitudes by which women and girls are regarded as \nsubordinate to men and boys; \n \n(q) \nEliminating all forms of violence against rural women and girls in public and \nprivate spaces through multisectoral and coordinated approaches to prevent and respond \nto violence against rural women and girls, to investigate, prosecute and punish the \nperpetrators of violence against rural women and girls and end impunity and to provide \nprotection as well as equal access to comprehensive social, health and legal services for \nall victims and survivors to support their full recovery and reintegration into society, \nincluding by providing access to psychosocial support and rehabilitation, and bearing in \nmind the importance of all women and girls living free from violence, such as gender-\nrelated killings, including femicide, and harmful practices, such as child, early and \nforced marriage and female genital mutilation, as well as of addressing the structural and \nunderlying causes of violence against women and girls through enhanced prevention \nmeasures, research and strengthened coordination and monitoring and evaluation, by, \ninter alia, encouraging awareness-raising activities; \n \n(r) \nDesigning and implementing national policies and legal frameworks that \npromote and protect the full enjoyment of human rights and fundamental freedoms \nby rural women and girls, and creating an environment that does not tolerate \nviolations or abuses of their rights, including domestic violence, sexual violence, \ngender-based violence and discrimination, including multiple and intersecting forms \nof discrimination; \n \n(s) \nPromoting safe public spaces for women and girls in rural areas and \nimproving their security and safety, including in public transportation systems and \ninfrastructure, preventing and eliminating violence and harassment against women on \ntheir journey to and from work, and protecting women and girls from being physically \nthreatened or assaulted, including from sexual violence, while collecting household \nwater and fuel and when accessing sanitation facilities outside their homes or \npractising open defecation; \n \n(t) \nEnsuring that the rights of older women in rural areas are taken into account \nwith regard to their equal access to basic social services, appropriate social protection \nand/or social security measures, equal access to and control of economic resources and \ntheir empowerment through access to financial and infrastructure services, with \nspecial focus on the provision of support to older women, including indigenous \nwomen, who often have access to few resources and are often more vulnerable; \n \n(u) \nValuing and supporting the critical role and contribution of rural women, \nincluding indigenous women in rural areas, in the conservation and sustainable use \nof traditional crops and biodiversity for present and future generations as an essential \ncontribution to food security and nutrition, recognizing that rural women are \ndisproportionately affected by biodiversity loss and land degradation and should \ntherefore be meaningfully engaged in efforts to address such matters; \n \n(v) \nPromoting the rights of women and girls with disabilities in rural areas, \nincluding by ensuring access on an equal basis to productive employment and decent \n\nImprovement of the situation of women and girls in rural areas \nA/RES/76/140\n \n7/10\n21-19150 \n \nwork, economic and financial resources and disability-sensitive infrastructure and \nservices, in particular in relation to health and education, as well as by ensuring that \ntheir priorities and needs are fully incorporated into policies and programmes, \nthrough, inter alia, their participation in decision-making processes; \n \n(w) Developing specific assistance programmes and advisory services to \npromote economic skills of rural women in banking, modern trading and financial \nprocedures, including financial literacy and consumer protection, and providing \nmicrocredit and other financial and business services to a greater number of women in \nrural areas, in particular female heads of households, for their economic empowerment; \n \n(x) \nSupporting women entrepreneurs and women smallholder farmers, including \nthose in subsistence farming, by continuing to provide public investment and to \nencourage private investment in rural women to close the gender gap in agriculture, and \nfacilitating their access to extension and financial services, agricultural inputs and land, \nwater, sanitation and irrigation, markets and innovative technologies; \n \n(y) \nMobilizing resources, including at the national level and through official \ndevelopment assistance, for increasing women\u2019s access to existing savings and credit \nschemes, as well as targeted programmes that provide women with capital, knowledge \nand tools that enhance their economic capacities; \n \n(z) \nSeeking to ensure and improve equal access for rural women to decent \nwork in agricultural and non-agricultural sectors, supporting and promoting \nopportunities in small and medium-sized enterprises, sustainable social enterprises \nand cooperatives and improving working conditions; \n \n(aa) Investing in infrastructure and in time- and labour-saving technologies, \nincluding sustainable energy, safe drinking water and sanitation and information and \ncommunications technologies, especially in rural areas, benefiting women and girls \nby reducing their burden of domestic activities, affording the opportunity for girls to \nattend school and for women to engage in self-employment or to participate in the \nlabour market; \n \n(bb) Taking appropriate measures to raise public awareness among rural \nwomen and girls about the risks of trafficking in persons, including the factors that \nmake rural women and girls vulnerable to trafficking, and eliminating the demand \nthat fosters all forms of exploitation against them, including sexual exploitation and \nforced labour; \n \n(cc) Supporting remunerative non-agricultural employment for rural women, \nincluding in the informal sector, including measures to improve working conditions, \nincrease access to productive resources, invest in relevant infrastructure, public \nservices and time- and labour-saving technologies, promote rural women\u2019s paid \nemployment in the formal economy and address the structural and underlying causes \nof the difficult conditions faced by rural women; \n \n(dd) Taking steps to build the capacities and skills of rural women and their \nenterprises and cooperatives and to design or develop and implement procurement \npolicies and measures to enable rural women and their enterprises and cooperatives \nto benefit from public and private sector procurement processes, recognizing that the \npromotion of rural women\u2019s enterprises and cooperatives can sustainably contribute \nto the economic empowerment of rural women; \n \n(ee) Promoting programmes and services to enable rural women and men to \nreconcile their work and family responsibilities and to encourage men throughout \ntheir life cycle to share, equally with women and girls, household, childcare and other \ncare responsibilities; \n\nA/RES/76/140 \nImprovement of the situation of women and girls in rural areas\n \n21-19150\n8/10 \n \n \n(ff) Developing and adopting strategies to decrease women\u2019s and girls\u2019 \nvulnerability to environmental factors, including gender-responsive strategies on \nmitigation and adaptation to climate change, to support the resilience and adaptive \ncapacities of women and girls to respond to the adverse effects of climate change, \nthrough, inter alia, the promotion of their health and well-being, as well as access to \nsustainable livelihoods, and the provision of adequate resources to ensure women\u2019s \nfull participation in decision-making at all levels on environmental issues, in \nparticular on strategies and policies related to the impacts of climate change, such as \ndesertification, deforestation, sand and dust storms and natural disasters, persistent \ndrought, extreme weather events, sea level rise, coastal erosion and ocean \nacidification and loss of biodiversity, on the lives of rural women and girls, and \nensuring the integration of their specific needs into humanitarian responses to natural \ndisasters, into the planning, delivery, implementation and monitoring of disaster risk \nreduction policies, in particular urban and rural infrastructure and land-use planning \nand resettlement and relocation planning during the aftermath of natural disasters, \nand into sustainable natural resources management; \n \n(gg) Building the resilience of rural women and girls, in particular women \nsmallholder farmers, to climate change and environmental degradation (inter alia, \ndeforestation, desertification and the loss of agricultural biodiversity), including by \npromoting appropriate use of relevant ancestral, indigenous and modern technological \npractices and knowledge and strengthening access to extension services, information \nand training; \n \n(hh) Considering the adoption, where appropriate, of national legislation to \nprotect the knowledge, innovations and practices of women in indigenous and local \ncommunities relating to traditional medicines, biodiversity and indigenous technologies; \n \n(ii) Addressing the lack of quality, accessible, timely and reliable data \ndisaggregated by sex and age and statistical information on disabilities, to help with \nthe measurement of progress and to ensure that no one is left behind, including by \nintensifying efforts to include women\u2019s unpaid work in official statistics, and \ndeveloping a systematic and comparative research base on rural women that will \ninform policy and programme decisions; \n \n(jj) Strengthening the capacity of national statistical offices and other relevant \ngovernment institutions to collect, analyse and disseminate data, disaggregated by sex \nand age, and gender statistics on time use, unpaid work, land tenure, energy, water \nand sanitation, among other things, to support policies and actions to improve the \nsituation of rural women and girls and to monitor and track the implementation of \nsuch policies and actions; \n \n(kk) Guaranteeing the universal registration of births, including in rural areas, \nand ensuring the timely registration of all marriages for individuals living in rural \nareas, including by removing physical, administrative, procedural and any other \nbarriers that impede access to registration and by providing, where lacking, \nmechanisms for the registration of customary and religious marriages, bearing in mind \nthe vital importance of birth registration for the realization of the rights of individuals; \n \n(ll) Designing, revising and implementing laws to ensure that rural women are \naccorded full and equal rights to own and lease land and other property, including \nthrough the equal rights to economic and productive resources, access to basic \nservices, ownership and control over land and other forms of property, inheritance, \nnatural resources, appropriate new technology and financial services, including \nbanking and microfinancing, and undertaking administrative reforms and all \nnecessary measures to give women the same right as men to credit, capital, finance, \n\nImprovement of the situation of women and girls in rural areas \nA/RES/76/140\n \n9/10\n21-19150 \n \nappropriate technologies and vocational training, to improve access to markets and \ninformation and to ensure their equal access to justice and legal support; \n \n(mm) Taking appropriate measures to adopt or develop legislation and policies \nthat provide rural women with access to land and support women\u2019s cooperatives and \nagricultural programmes, including for subsistence agriculture, in order to contribute \nto school feeding programmes as a pull factor to keep children, in particular girl \nchildren, in school, noting that school meals and take-home rations attract and retain \nchildren in schools and recognizing that school feeding is an incentive to enhance \nenrolment and reduce absenteeism, especially for girls; \n \n(nn) Supporting a gender-sensitive education system, including through \napproaches that attract and retain female students and teachers and that consider the \nspecific needs of rural women and girls in order to eliminate gender stereotypes and \ndiscriminatory tendencies affecting them, including through community-based \ndialogue involving women and men and girls and boys; \n \n(oo) Eliminating gender disparities in the realization of the right to education \nand ensuring full and equal participation in and completion of inclusive quality \neducation (primary, secondary and tertiary education, including vocational and \ntechnical education), as well as early childhood education, promoting lifelong \nlearning opportunities for rural women and girls and the elimination of female \nilliteracy, including through eliminating the discriminatory policies of excluding \npregnant and married girls from schools, quality teacher training, recruitment and \nretention of teachers in rural areas, especially women teachers where they are \nunderrepresented, and building gender-sensitive education facilities that provide a \nsafe, non-violent, inclusive and effective learning environment for all and facilitate \nan effective transition from education or unemployment to decent work; \n \n(pp) Promoting education, training and relevant information programmes for \nrural and farming women through the use of affordable and appropriate technologies \nand the mass media, and taking concrete measures to improve rural women\u2019s skills, \nproductivity and employment opportunities through technical, agricultural and \nvocational education and training; \n \n3. \nEncourages Member States, United Nations entities and all other relevant \nstakeholders to promote access to social protection for female-headed rural households; \n \n4. \nEncourages Member States, appropriate United Nations entities and all \nother relevant stakeholders to promote the full and equal participation of rural women, \nincluding indigenous women as well as women farmers, fishers and agricultural \nworkers, in sustainable agricultural and rural development; \n \n5. \nRequests the relevant organizations and bodies of the United Nations \nsystem, in particular those dealing with issues of development, to address and support \nthe empowerment of rural women and their specific needs in their programmes and \nstrategies; \n \n6. \nStresses the need to identify the best practices for ensuring that rural \nwomen have access to and full and equal participation in the area of information and \ncommunications technology, to address the priorities and needs of rural women and \ngirls as active users of information and to ensure their participation in developing and \nimplementing global, regional and national information and communications \ntechnology strategies, taking appropriate educational measures to eliminate gender \nstereotypes regarding women in the field of technology; \n \n7. \nEncourages Member States to consider the concluding observations and \nrecommendations of the Committee on the Elimination of Discrimination against \nWomen and of the Committee on Economic, Social and Cultural Rights concerning \n\nA/RES/76/140 \nImprovement of the situation of women and girls in rural areas\n \n21-19150\n10/10 \n \ntheir reports to those Committees when formulating policies and designing programmes \nfocused on the improvement of the situation of rural women, including those to be \ndeveloped and implemented in cooperation with relevant international organizations; \n \n8. \nInvites Governments to promote the economic empowerment of rural \nwomen, including through entrepreneurship training, and to adopt gender-responsive \nand climate-sensitive rural development strategies and agricultural production, \nincluding budget frameworks and relevant assessment measures, as well as to ensure \nthat the needs and priorities of rural women and girls are systematically addressed \nand that they can effectively contribute to poverty alleviation, hunger eradication and \nfood security and nutrition; \n \n9. \nInvites Governments, relevant international organizations, the specialized \nagencies and civil society organizations to continue to observe the International Day \nof Rural Women annually, on 15 October, as proclaimed by the General Assembly in \nits resolution 62/136; \n \n10. Requests the Secretary-General to submit to the General Assembly at its \nseventy-eighth session a report on the improvement of the situation of women and \ngirls in rural areas. \n \n53rd plenary meeting \n16 December 2021 \n \n \n",
  "paragraphs": {
    "1": "Takes note of the report of the Secretary-General;16",
    "2": "Urges Member States, in collaboration with the organizations of the United Nations system and civil society, as appropriate, to continue their efforts to implement the outcome of and to ensure an integrated and coordinated follow-up to the relevant United Nations conferences and summits, including their reviews, and to __________________ 14 Food and Agriculture Organization of the United Nations, document CL 144/9 (C 2013/20), appendix D. 15 Food and Agriculture Organization of the United Nations, document C 2015/20, appendix D. 16 A/76/241. A/RES/76/140 Improvement of the situation of women and girls in rural areas 21-19150 4/10 attach greater importance to the improvement of the situation of rural women and girls in their national, regional and global development strategies by, inter alia: (a) Creating an enabling environment for improving their situation and ensuring systematic attention to their needs, priorities and contributions, as well as gender equality and the empowerment of all women and girls, including through enhanced cooperation and a gender perspective, and the full and equal participation of all women in the development, implementation and follow-up of macroeconomic policies, including development policies and programmes and poverty eradication strategies, including poverty reduction strategy papers, where they exist, aimed at implementing the 2030 Agenda for Sustainable Development; (b) Encouraging Member States to consider adopting and pursuing national financial inclusion strategies and gender-responsive strategies to end the structural barriers to women\u2019s equal access to economic resources and to expand peer learning, experience-sharing and capacity-building in rural areas; (c) Supporting the important role of civil society in promoting the realization and fulfilment of the human rights and fundamental freedoms of all women, including rural women; (d) Taking steps in the design, implementation and pursuit of fiscal policies and gender-responsive budgeting to promote gender equality and the empowerment of rural women and girls; (e) Pursuing the political and socioeconomic empowerment of rural women and supporting their full and equal participation in decision-making at all levels, including through affirmative action, where appropriate, including by promoting and protecting the right to vote and to be elected and the right to freedom of expression, peaceful assembly and association, and through support for women\u2019s and farmers\u2019 organizations in which subsistence and smallholder women farmers are members, labour unions, cooperatives or other associations and civil society groups promoting rural women\u2019s rights; (f) Promoting consultation with and the participation of rural women and, as appropriate, girls, including those who are indigenous, those with disabilities and older women, through their organizations and networks, in the design, development and implementation of and follow-up to programmes and strategies for gender equality, the empowerment of women and rural development; (g) Ensuring that the perspectives of rural women and girls are taken into account and that rural women fully, meaningfully and equally participate in the design, implementation, follow-up and evaluation of policies and activities related to conflict prevention, the mitigation of post-conflict situations, peace mediation, the impacts of climate change and emergencies, including natural disasters, humanitarian assistance, peacebuilding and post-conflict reconstruction, and taking appropriate measures to eliminate all forms of violence and discrimination against rural women and girls in this regard; (h) Integrating a gender perspective into the design, implementation and evaluation of and follow-up to development policies, plans and programmes, including budget policies, where lacking, ensuring coordination between line ministries, gender policymakers, gender machineries and other relevant government organizations and institutions with gender expertise, and paying increased attention to the needs of rural women and girls to ensure that they benefit from policies and programmes adopted in all spheres and that the disproportionate number of rural women living in poverty is reduced; Improvement of the situation of women and girls in rural areas A/RES/76/140 5/10 21-19150 (i) Mainstreaming a gender perspective in decision-making processes and the governance of natural resources, leveraging the participation and influence of women in managing the sustainable use of natural resources, and enhancing the capacities of Governments, civil society and development partners to better understand and address gender issues in the management and governance of natural resources; (j) Implementing effective, high-impact, quality-assured, people-centred, gender- and disability-responsive and evidence-based interventions to meet the health needs of rural women and girls, particularly those in vulnerable situations, throughout their life course; (k) Strengthening measures, including resource generation, to improve women\u2019s health, including maternal health, by addressing the specific health, nutrition and basic needs of rural women and taking concrete measures to enhance and provide access to the highest attainable standards of physical and mental health for women of all ages in rural areas, as well as quality, affordable and universally accessible primary health care and support services, including prenatal and postnatal health care, emergency obstetric care, family planning, information and education, increasing knowledge, awareness and support for the elimination of harmful practices and the prevention, treatment and care of sexually transmitted infections, including HIV, and ensuring universal access to sexual and reproductive health and reproductive rights in accordance with the Programme of Action of the International Conference on Population and Development,17 the Beijing Platform for Action18 and the outcome documents of their review conferences; (l) Strengthening the prevention, treatment and care of infections, such as HIV, in rural areas, by providing accessible information, social care services and infrastructure; (m) Taking appropriate measures to ensure that women\u2019s and girls\u2019 disproportionate share of unpaid care and domestic work, as well as contributions to on-farm and off-farm production, is recognized, including by fully recognizing and valuing unpaid care and domestic work through the provision of public services, infrastructure and social protection policies and the promotion of shared responsibility within the household and the family, and to promote nationally appropriate policies and initiatives supporting the reconciliation of work and family life and the equal sharing of responsibilities between men and women with a view to reducing and equitably distributing such unpaid work, including through, inter alia, the provision of infrastructure, technology and public services, such as water and sanitation, renewable energy, transport and information and communications technology, as well as addressing the need for accessible, affordable and quality childcare and care facilities in rural areas; (n) Promoting sustainable, gender-responsive, quality, reliable and resilient infrastructure, including by scaling up investment in health facilities in rural areas and by improving access to safe drinking water and sanitation, including through provisions for menstrual hygiene management, and safe cooking and heating practices to improve the health and nutrition of rural women and girls; (o) Investing in and strengthening efforts to meet the basic needs of rural women, including needs relating to their food security and nutrition and that of their families, and to promote adequate standards of living for them, as well as decent conditions for work and improved access to local, regional and global markets through __________________ 17 Report of the International Conference on Population and Development, Cairo, 5\u201313 September 1994 (United Nations publication, Sales No. E.95.XIII.18), chap. I, resolution 1, annex. 18 Report of the Fourth World Conference on Women, Beijing, 4\u201315 September 1995 (United Nations publication, Sales No. E.96.IV.13), chap. I, resolution 1, annex II. A/RES/76/140 Improvement of the situation of women and girls in rural areas 21-19150 6/10 improved availability, access to and use of critical rural infrastructure, such as energy and transport, science and technology, local services, capacity-building and human resources development measures and the provision of a safe and reliable water supply and sanitation, nutritional programmes, affordable housing programmes, education and literacy programmes, social support measures and health care, including HIV prevention, treatment, care, including psychosocial aspects, and support services; (p) Fully engaging men and boys, including community leaders, as strategic partners and allies in achieving gender equality and the empowerment of women and girls, and eliminating all forms of discrimination and violence against them, including by working to counteract attitudes by which women and girls are regarded as subordinate to men and boys; (q) Eliminating all forms of violence against rural women and girls in public and private spaces through multisectoral and coordinated approaches to prevent and respond to violence against rural women and girls, to investigate, prosecute and punish the perpetrators of violence against rural women and girls and end impunity and to provide protection as well as equal access to comprehensive social, health and legal services for all victims and survivors to support their full recovery and reintegration into society, including by providing access to psychosocial support and rehabilitation, and bearing in mind the importance of all women and girls living free from violence, such as gender- related killings, including femicide, and harmful practices, such as child, early and forced marriage and female genital mutilation, as well as of addressing the structural and underlying causes of violence against women and girls through enhanced prevention measures, research and strengthened coordination and monitoring and evaluation, by, inter alia, encouraging awareness-raising activities; (r) Designing and implementing national policies and legal frameworks that promote and protect the full enjoyment of human rights and fundamental freedoms by rural women and girls, and creating an environment that does not tolerate violations or abuses of their rights, including domestic violence, sexual violence, gender-based violence and discrimination, including multiple and intersecting forms of discrimination; (s) Promoting safe public spaces for women and girls in rural areas and improving their security and safety, including in public transportation systems and infrastructure, preventing and eliminating violence and harassment against women on their journey to and from work, and protecting women and girls from being physically threatened or assaulted, including from sexual violence, while collecting household water and fuel and when accessing sanitation facilities outside their homes or practising open defecation; (t) Ensuring that the rights of older women in rural areas are taken into account with regard to their equal access to basic social services, appropriate social protection and/or social security measures, equal access to and control of economic resources and their empowerment through access to financial and infrastructure services, with special focus on the provision of support to older women, including indigenous women, who often have access to few resources and are often more vulnerable; (u) Valuing and supporting the critical role and contribution of rural women, including indigenous women in rural areas, in the conservation and sustainable use of traditional crops and biodiversity for present and future generations as an essential contribution to food security and nutrition, recognizing that rural women are disproportionately affected by biodiversity loss and land degradation and should therefore be meaningfully engaged in efforts to address such matters; (v) Promoting the rights of women and girls with disabilities in rural areas, including by ensuring access on an equal basis to productive employment and decent Improvement of the situation of women and girls in rural areas A/RES/76/140 7/10 21-19150 work, economic and financial resources and disability-sensitive infrastructure and services, in particular in relation to health and education, as well as by ensuring that their priorities and needs are fully incorporated into policies and programmes, through, inter alia, their participation in decision-making processes; (w) Developing specific assistance programmes and advisory services to promote economic skills of rural women in banking, modern trading and financial procedures, including financial literacy and consumer protection, and providing microcredit and other financial and business services to a greater number of women in rural areas, in particular female heads of households, for their economic empowerment; (x) Supporting women entrepreneurs and women smallholder farmers, including those in subsistence farming, by continuing to provide public investment and to encourage private investment in rural women to close the gender gap in agriculture, and facilitating their access to extension and financial services, agricultural inputs and land, water, sanitation and irrigation, markets and innovative technologies; (y) Mobilizing resources, including at the national level and through official development assistance, for increasing women\u2019s access to existing savings and credit schemes, as well as targeted programmes that provide women with capital, knowledge and tools that enhance their economic capacities; (z) Seeking to ensure and improve equal access for rural women to decent work in agricultural and non-agricultural sectors, supporting and promoting opportunities in small and medium-sized enterprises, sustainable social enterprises and cooperatives and improving working conditions; (aa) Investing in infrastructure and in time- and labour-saving technologies, including sustainable energy, safe drinking water and sanitation and information and communications technologies, especially in rural areas, benefiting women and girls by reducing their burden of domestic activities, affording the opportunity for girls to attend school and for women to engage in self-employment or to participate in the labour market; (bb) Taking appropriate measures to raise public awareness among rural women and girls about the risks of trafficking in persons, including the factors that make rural women and girls vulnerable to trafficking, and eliminating the demand that fosters all forms of exploitation against them, including sexual exploitation and forced labour; (cc) Supporting remunerative non-agricultural employment for rural women, including in the informal sector, including measures to improve working conditions, increase access to productive resources, invest in relevant infrastructure, public services and time- and labour-saving technologies, promote rural women\u2019s paid employment in the formal economy and address the structural and underlying causes of the difficult conditions faced by rural women; (dd) Taking steps to build the capacities and skills of rural women and their enterprises and cooperatives and to design or develop and implement procurement policies and measures to enable rural women and their enterprises and cooperatives to benefit from public and private sector procurement processes, recognizing that the promotion of rural women\u2019s enterprises and cooperatives can sustainably contribute to the economic empowerment of rural women; (ee) Promoting programmes and services to enable rural women and men to reconcile their work and family responsibilities and to encourage men throughout their life cycle to share, equally with women and girls, household, childcare and other care responsibilities; A/RES/76/140 Improvement of the situation of women and girls in rural areas 21-19150 8/10 (ff) Developing and adopting strategies to decrease women\u2019s and girls\u2019 vulnerability to environmental factors, including gender-responsive strategies on mitigation and adaptation to climate change, to support the resilience and adaptive capacities of women and girls to respond to the adverse effects of climate change, through, inter alia, the promotion of their health and well-being, as well as access to sustainable livelihoods, and the provision of adequate resources to ensure women\u2019s full participation in decision-making at all levels on environmental issues, in particular on strategies and policies related to the impacts of climate change, such as desertification, deforestation, sand and dust storms and natural disasters, persistent drought, extreme weather events, sea level rise, coastal erosion and ocean acidification and loss of biodiversity, on the lives of rural women and girls, and ensuring the integration of their specific needs into humanitarian responses to natural disasters, into the planning, delivery, implementation and monitoring of disaster risk reduction policies, in particular urban and rural infrastructure and land-use planning and resettlement and relocation planning during the aftermath of natural disasters, and into sustainable natural resources management; (gg) Building the resilience of rural women and girls, in particular women smallholder farmers, to climate change and environmental degradation (inter alia, deforestation, desertification and the loss of agricultural biodiversity), including by promoting appropriate use of relevant ancestral, indigenous and modern technological practices and knowledge and strengthening access to extension services, information and training; (hh) Considering the adoption, where appropriate, of national legislation to protect the knowledge, innovations and practices of women in indigenous and local communities relating to traditional medicines, biodiversity and indigenous technologies; (ii) Addressing the lack of quality, accessible, timely and reliable data disaggregated by sex and age and statistical information on disabilities, to help with the measurement of progress and to ensure that no one is left behind, including by intensifying efforts to include women\u2019s unpaid work in official statistics, and developing a systematic and comparative research base on rural women that will inform policy and programme decisions; (jj) Strengthening the capacity of national statistical offices and other relevant government institutions to collect, analyse and disseminate data, disaggregated by sex and age, and gender statistics on time use, unpaid work, land tenure, energy, water and sanitation, among other things, to support policies and actions to improve the situation of rural women and girls and to monitor and track the implementation of such policies and actions; (kk) Guaranteeing the universal registration of births, including in rural areas, and ensuring the timely registration of all marriages for individuals living in rural areas, including by removing physical, administrative, procedural and any other barriers that impede access to registration and by providing, where lacking, mechanisms for the registration of customary and religious marriages, bearing in mind the vital importance of birth registration for the realization of the rights of individuals; (ll) Designing, revising and implementing laws to ensure that rural women are accorded full and equal rights to own and lease land and other property, including through the equal rights to economic and productive resources, access to basic services, ownership and control over land and other forms of property, inheritance, natural resources, appropriate new technology and financial services, including banking and microfinancing, and undertaking administrative reforms and all necessary measures to give women the same right as men to credit, capital, finance, Improvement of the situation of women and girls in rural areas A/RES/76/140 9/10 21-19150 appropriate technologies and vocational training, to improve access to markets and information and to ensure their equal access to justice and legal support; (mm) Taking appropriate measures to adopt or develop legislation and policies that provide rural women with access to land and support women\u2019s cooperatives and agricultural programmes, including for subsistence agriculture, in order to contribute to school feeding programmes as a pull factor to keep children, in particular girl children, in school, noting that school meals and take-home rations attract and retain children in schools and recognizing that school feeding is an incentive to enhance enrolment and reduce absenteeism, especially for girls; (nn) Supporting a gender-sensitive education system, including through approaches that attract and retain female students and teachers and that consider the specific needs of rural women and girls in order to eliminate gender stereotypes and discriminatory tendencies affecting them, including through community-based dialogue involving women and men and girls and boys; (oo) Eliminating gender disparities in the realization of the right to education and ensuring full and equal participation in and completion of inclusive quality education (primary, secondary and tertiary education, including vocational and technical education), as well as early childhood education, promoting lifelong learning opportunities for rural women and girls and the elimination of female illiteracy, including through eliminating the discriminatory policies of excluding pregnant and married girls from schools, quality teacher training, recruitment and retention of teachers in rural areas, especially women teachers where they are underrepresented, and building gender-sensitive education facilities that provide a safe, non-violent, inclusive and effective learning environment for all and facilitate an effective transition from education or unemployment to decent work; (pp) Promoting education, training and relevant information programmes for rural and farming women through the use of affordable and appropriate technologies and the mass media, and taking concrete measures to improve rural women\u2019s skills, productivity and employment opportunities through technical, agricultural and vocational education and training;",
    "3": "Encourages Member States, United Nations entities and all other relevant stakeholders to promote access to social protection for female-headed rural households;",
    "4": "Encourages Member States, appropriate United Nations entities and all other relevant stakeholders to promote the full and equal participation of rural women, including indigenous women as well as women farmers, fishers and agricultural workers, in sustainable agricultural and rural development;",
    "5": "Requests the relevant organizations and bodies of the United Nations system, in particular those dealing with issues of development, to address and support the empowerment of rural women and their specific needs in their programmes and strategies;",
    "6": "Stresses the need to identify the best practices for ensuring that rural women have access to and full and equal participation in the area of information and communications technology, to address the priorities and needs of rural women and girls as active users of information and to ensure their participation in developing and implementing global, regional and national information and communications technology strategies, taking appropriate educational measures to eliminate gender stereotypes regarding women in the field of technology;",
    "7": "Encourages Member States to consider the concluding observations and recommendations of the Committee on the Elimination of Discrimination against Women and of the Committee on Economic, Social and Cultural Rights concerning A/RES/76/140 Improvement of the situation of women and girls in rural areas 21-19150 10/10 their reports to those Committees when formulating policies and designing programmes focused on the improvement of the situation of rural women, including those to be developed and implemented in cooperation with relevant international organizations;",
    "8": "Invites Governments to promote the economic empowerment of rural women, including through entrepreneurship training, and to adopt gender-responsive and climate-sensitive rural development strategies and agricultural production, including budget frameworks and relevant assessment measures, as well as to ensure that the needs and priorities of rural women and girls are systematically addressed and that they can effectively contribute to poverty alleviation, hunger eradication and food security and nutrition;",
    "9": "Invites Governments, relevant international organizations, the specialized agencies and civil society organizations to continue to observe the International Day of Rural Women annually, on 15 October, as proclaimed by the General Assembly in its resolution 62/136;",
    "10": "Requests the Secretary-General to submit to the General Assembly at its seventy-eighth session a report on the improvement of the situation of women and girls in rural areas. 53rd plenary meeting 16 December 2021"
  },
  "agenda_items": [
    "Item 29"
  ],
  "symbol_references": []
}