{
  "symbol": "A/RES/78/132",
  "filename": "A_RES_78_132.pdf",
  "title": "78/132. Information and communications technologies for sustainable development",
  "text": "United Nations \nA/RES/78/132\n \n \nGeneral Assembly \nDistr.: General \n21 December 2023 \n \n23-25902 (E)    291223     \n*2325902* \n \n \nSeventy-eighth session \nAgenda item 15 \nInformation and communications technologies for \nsustainable development \n \n \n \nResolution adopted by the General Assembly \non 19 December 2023 \n \n \n[on the report of the Second Committee (A/78/458, para. 11)] \n \n \n 78/132. Information and communications technologies for \nsustainable development \n \n \n \nThe General Assembly,  \n \nRecalling its resolution 77/150 of 14 December 2022 on information and \ncommunications technologies for sustainable development, as well as previous \nresolutions on the issue,1 \n \nRecalling also Economic and Social Council resolution 2023/3 of 7 June 2023 \non the assessment of the progress made in the implementation of and follow-up to the \noutcomes of the World Summit on the Information Society, as well as previous \nresolutions on the issue,2  \n \nReaffirming its resolution 70/1 of 25 September 2015, entitled \u201cTransforming \nour world: the 2030 Agenda for Sustainable Development\u201d, in which it adopted a \ncomprehensive, far-reaching and people-centred set of universal and transformative \nSustainable Development Goals and targets, its commitment to working tirelessly for \nthe full implementation of the Agenda by 2030, its recognition that eradicating \npoverty in all its forms and dimensions, including extreme poverty, is the greatest \nglobal challenge and an indispensable requirement for sustainable development, its \ncommitment to achieving sustainable development in its three dimensions \u2013 \neconomic, social and environmental \u2013 in a balanced and integrated manner, and to \nbuilding upon the achievements of the Millennium Development Goals and seeking \nto address their unfinished business,  \n__________________ \n \n1  Resolutions 56/183, 57/238, 59/220, 60/252, 62/182, 63/202, 64/187, 65/141, 66/184, 67/195, \n68/198, 69/204, 70/184, 71/212, 72/200, 73/218, 74/197, 75/202 and 76/189. \n \n2  Economic and Social Council resolutions 2006/46, 2008/3, 2009/7, 2010/2, 2011/16, 2012/5, \n2013/9, 2014/27, 2015/26, 2016/22, 2017/21, 2018/28, 2019/24, 2020/12, 2021/28 and 2022/15. \n\nA/RES/78/132 \nInformation and communications technologies for \nsustainable development\n \n23-25902\n2/15 \n \n \nReaffirming also its resolution 69/313 of 27 July 2015 on the Addis Ababa \nAction Agenda of the Third International Conference on Financing for Development, \nwhich is an integral part of the 2030 Agenda for Sustainable Development, supports \nand complements it, helps to contextualize its means of implementation targets with \nconcrete policies and actions, and reaffirms the strong political commitment to \naddress the challenge of financing and creating an enabling environment at all levels \nfor sustainable development in the spirit of global partnership and solidarity,  \n \nReaffirming further the New Urban Agenda, adopted at the United Nations \nConference on Housing and Sustainable Urban Development (Habitat III), held in \nQuito, Ecuador, from 17 to 20 October 2016,3  \n \nRecognizing the role of the Commission on Science and Technology for \nDevelopment as the United Nations focal point for science, technology and \ninnovation for development and as a forum in the examination of science and \ntechnology questions and the role of science and technology as enablers for the \nachievement of the 2030 Agenda, the advancement of understanding of science and \ntechnology policies, particularly in respect of developing countries, and the \nformulation of recommendations and guidelines on science and technology matters \nfor development within the United Nations system,  \n \nRecognizing also the Commission on Science and Technology for Development \nas the United Nations focal point in the system-wide follow-up to the outcomes of the \nWorld Summit on the Information Society,  \n \nRecognizing further the role of the Technology Facilitation Mechanism, which \nincludes the multi-stakeholder forum on science, technology and innovation for the \nSustainable Development Goals, the inter-agency task team on science, technology \nand innovation for the Sustainable Development Goals and the online platform, as a \ntool to facilitate multi-stakeholder collaboration and partnerships among Member \nStates, civil society, the private sector, the scientific community, United Nations \nentities and other stakeholders in order to support the implementation of the \nSustainable Development Goals, including through forging partnerships, such as the \nPartnership in Action on STI for SDGs Road Maps,  \n \nRecalling the Declaration of Principles and the Plan of Action adopted by the \nWorld Summit on the Information Society at its first phase, held in Geneva from 10 \nto 12 December 2003,4 and endorsed by the General Assembly,5 and the Tunis \nCommitment and the Tunis Agenda for the Information Society adopted by the \nSummit at its second phase, held in Tunis from 16 to 18 November 2005, 6 and \nendorsed by the Assembly,7  \n \nRecalling also the references to information and communications technologies \ncontained in the 2030 Agenda and the Addis Ababa Action Agenda, and reiterating \ncalls for close alignment between the World Summit on the Information Society \nprocess and the 2030 Agenda, as well as other relevant intergovernmental outcomes,  \n \nRecalling further the outcome document of the high-level meeting of the \nGeneral Assembly on the overall review of the implementation of the outcomes of the \nWorld Summit on the Information Society,8 held in New York on 15 and 16 December \n2015, in which it took stock of the progress made in the implementation of the \n__________________ \n \n3  Resolution 71/256, annex. \n \n4  See A/C.2/59/3, annex. \n \n5  See resolution 59/220. \n \n6  See A/60/687. \n \n7  See resolution 60/252. \n \n8  Resolution 70/125. \n\nInformation and communications technologies for \nsustainable development \nA/RES/78/132\n \n3/15\n23-25902 \n \noutcomes of the World Summit, addressed potential information and communications \ntechnology gaps and identified areas for continued focus,  \n \nRecalling its resolution 76/307 of 8 September 2022 on the modalities for the \nSummit of the Future and its decision 77/568 of 1 September 2023 on the scope of \nthe Summit, to be held on 22 and 23 September 2024, mandating a concise, action-\noriented outcome document entitled \u201cA Pact for the Future\u201d, including a chapter on \nscience, technology and innovation and digital cooperation,  \n \nReaffirming its common desire and commitment to the World Summit on the \nInformation Society vision as laid out in the Geneva Declaration of Principles,  \n \nReaffirming also the outcome of the high-level meeting of the General Assembly \non the overall review of the implementation of the outcomes of the World Summit on \nthe Information Society, which provides an overview of implementation action lines, \nchallenges, vision and priority areas, and recognizing the need for all people to have \nmedia and information literacy skills, which are important in order to fully participate \nin an inclusive information society,  \n \nRecognizing that information and communications technologies present new \nopportunities and challenges and that there is a pressing need to address the major \nimpediments that developing countries face in accessing new technologies, stressing \nthe need to close the digital divides, both between and within countries and including \nthe rural-urban, youth-older persons and gender digital divides, and to harness \ninformation and communications technologies for development, and recalling the \nneed to emphasize quality of access to bridge digital and knowledge divides, using a \nmultidimensional approach that includes speed, stability, affordability, language, \ntraining, capacity-building, local content and accessibility for persons with disabilities, \n \nTaking note of the report of the Secretary-General on the progress made in the \nimplementation of and follow-up to the outcomes of the World Summit on the \nInformation Society at the regional and international levels, 9  \n \nTaking note also of the report on the economic impact of broadband in the least \ndeveloped countries, landlocked developing countries and small island developing \nStates, jointly prepared by the Office of the High Representative for the Least \nDeveloped Countries, Landlocked Developing Countries and Small Island \nDeveloping States and the International Telecommunication Union, as well as the \nUnited Nations E-Government Survey prepared by the Department of Economic and \nSocial Affairs of the Secretariat,  \n \nNoting the call for the continuation of annual reports on the implementation of \nthe outcomes of the World Summit on the Information Society, through the \nCommission on Science and Technology for Development, to the Economic and \nSocial Council, and reaffirming the role of the Commission, as set forth in Council \nresolution 2006/46 of 28 July 2006, in assisting the Council as the focal point in the \nsystem-wide follow-up, in particular the review and assessment of progress made in \nimplementing the outcomes of the World Summit,  \n \nNoting also the holding of the twenty-sixth session of the Commission on \nScience and Technology for Development from 27 to 31 March 2023, and looking \nforward to the twenty-seventh session, which will have as priority themes \u201cData for \ndevelopment\u201d and \u201cGlobal cooperation in science, technology and innovation for \ndevelopment\u201d, thus providing a platform for all stakeholders to share experiences and \npursue partnerships for capacity-building,  \n__________________ \n \n9  A/78/62-E/2023/49. \n\nA/RES/78/132 \nInformation and communications technologies for \nsustainable development\n \n23-25902\n4/15 \n \n \nTaking note of the report of the High-level Panel on Digital Cooperation, entitled \n\u201cThe age of digital interdependence\u201d, submitted to the Secretary-General on 10 June \n2019, also taking note of the report of the Secretary-General entitled \u201cRoad map for \ndigital cooperation\u201d, presented on 11 June 2020,10 as well as the establishment of the \nOffice of the Secretary-General\u2019s Envoy on Technology, and further taking note of \nthe recommendations of the Secretary-General, in his report entitled \u201cOur Common \nAgenda\u201d,11 to improve digital cooperation, with a view to bridging digital divides and \naccelerating the positive contribution that digital technologies can play in society, \nincluding towards achieving the 2030 Agenda,  \n \nNoting the holding of the World Summit on the Information Society Forum, \njointly organized annually by the International Telecommunication Union, the United \nNations Conference on Trade and Development, the United Nations Educational, \nScientific and Cultural Organization and the United Nations Development \nProgramme, and noting also the virtual holding of the World Summit on the \nInformation Society Forum from 13 to 17 March 2023,  \n \nTaking note of the United Nations Development Programme Digital Strategy \n2022\u20132025, which seeks to assist countries, upon their request, in their efforts towards \ndigital transformation through the creation of inclusive and resilient digital \necosystems, \n \nTaking note also of the report of the Broadband Commission for Sustainable \nDevelopment entitled The State of Broadband Report 2023: Digital Connectivity \u2013 A \nTransformative Opportunity, which provides an evaluation of the progress made \ntowards achieving the Broadband Commission\u2019s advocacy targets for broadband and \nthe state of broadband development worldwide,  \n \nRecognizing the fact that information and communications technologies are \ncritical enablers of economic development and investment, with consequential \nbenefits for employment and social welfare, by lowering barriers to economic \nparticipation, and that \nthe \nincreasing \npervasiveness of information \nand \ncommunications technologies within society has had profound impacts on the ways \nin which Governments deliver services, businesses relate to consumers and citizens \nparticipate in public and private life,  \n \nNoting the outcome and agreed policy recommendations of the sixth report of \nthe Intergovernmental Group of Experts on E-commerce and the Digital Economy on \nits sixth session,12 which was held from 10 to 12 May 2023,  \n \nNoting also the holding of the United Nations Conference on Trade and \nDevelopment eWeek 2023, under the theme \u201cShaping the future of the digital \neconomy\u201d, from 4 to 8 December 2023 in Geneva,  \n \nTaking note of the Digital Economy Report 2021 of the United Nations \nConference on Trade and Development, which examines the role of cross-border data \nflows for development in maximizing equitable development gains, while minimizing \nrisks and impacts of a potential fragmentation in the digital space, and recognizing \nthe need to continue discussions on the connection between data and sustainable \ndevelopment, including data governance, while taking into account the multiple \ndimensions of data,  \n__________________ \n \n10  A/74/821. \n \n11  A/75/982. \n \n12  TD/B/EDE/6/4. \n\nInformation and communications technologies for \nsustainable development \nA/RES/78/132\n \n5/15\n23-25902 \n \n \nNoting the tax challenges arising from digitalization of the economy and the \nimportance of ensuring that tax is paid where value is created, and noting also \ninternational efforts to address this issue,  \n \nStressing, however, that recent progress notwithstanding, important and \ngrowing digital divides remain between and within developed and developing \ncountries in terms of the availability, affordability and use of information and \ncommunications technologies and access to broadband, stressing also the urgent need \nto close digital divides, including with regard to such issues as the affordability of the \nInternet, and to ensure that the benefits of information and communications \ntechnologies, including new technologies, are available to all, in this regard \nreaffirming its commitment to significantly increasing access to information and \ncommunications technologies and striving to provide universal and affordable access \nto the Internet in the least developed countries by 2020, and noting the many efforts \nto help to bridge digital divides and expand access, including the Connect 2030 \nAgenda for Global Telecommunication/Information and Communication Technology, \nincluding Broadband, for Sustainable Development,  \n \nRecalling the vision of a people-centred, inclusive and development-oriented \ninformation society, where everyone can create, access, utilize and share information \nand knowledge, enabling individuals, communities and peoples to achieve their full \npotential in promoting their sustainable development and improving their quality of \nlife, premised on the purposes and principles of the Charter of the United Nations and \nrespecting fully and upholding the Universal Declaration of Human Rights, 13  \n \nStressing the necessity for all forms of development cooperation, including aid \nflows, to promote digital transformation,  \n \nRecalling the Working Group on the Digital Gender Divide of the Broadband \nCommission for Sustainable Development and the recommendations for action in \nbridging the gender digital divide contained in its progress report, and taking note of \nthe report of the Working Group on Education of the Broadband Commission entitled \n\u201cDigital skills for life and work\u201d,  \n \nRecognizing that realizing gender equality and the empowerment of all women \nand girls will make a crucial contribution to progress across all of the Sustainable \nDevelopment Goals, and emphasizing the need to target science, technology and \ninnovation strategies to address the empowerment of women and girls and to reduce \ninequalities, including the gender digital divide,  \n \nNoting with great concern the fact that a gender digital divide persists in \nwomen\u2019s access to and use of information and communications technologies, \nincluding in education, employment and other areas of economic and social \ndevelopment, and in this regard welcoming the many initiatives that focus on access, \nskills and leadership to promote the equal participation of women and girls in the \ndigital age, such as the International Girls in ICT Day of the International \nTelecommunication Union and the Global Partnership for Gender Equality in the \nDigital Age, known as the Equals Partnership,  \n \nNoting with great concern also that many developing countries lack meaningful \nand affordable access to information and communications technologies and that, for \nthe majority of the poor, the promise of science and technology, including information \nand communications technologies, remains unfulfilled, and emphasizing the need to \neffectively harness technology, including information and communications \ntechnologies, data management, and promote inclusive digital literacy to bridge the \ndigital and knowledge divides,  \n__________________ \n \n13  Resolution 217 A (III). \n\nA/RES/78/132 \nInformation and communications technologies for \nsustainable development\n \n23-25902\n6/15 \n \n \nRecognizing the need to focus on capacity-development policies and sustainable \nsupport to further enhance the impact of activities and initiatives at the national and \nlocal levels aimed at providing advice, services and support, with a view to building \nan inclusive, people-centred and development-oriented information society,  \n \nRecognizing also that harnessing the benefits of digital technologies for \ninclusive, equitable and quality education and lifelong learning opportunities requires \nthe advancement of connectivity, capacities and content, and electricity coverage, and \nacknowledging the need for access to broadband Internet and technology devices, \ndigital inclusion and literacy, and to incorporate digital competencies into the \neducation system for the capacity-building of educators and students,  \n \nNoting that a range of topics continues to emerge on issues related to the access \nto and use and applications of information and communications technologies and their \neffects on economic, social and environmental dimensions of sustainable \ndevelopment,  \n \nRecognizing the important role that information and communications \ntechnologies can play in protecting the environment and addressing climate change,  \n \nReaffirming that the same rights that people have offline must also be protected \nonline, and emphasizing that progress towards the vision of the World Summit on the \nInformation Society should be considered not only as a function of economic \ndevelopment and the spreading of information and communications technologies but \nalso as a function of progress with respect to the realization of human rights and \nfundamental freedoms,  \n \nReaffirming also that Internet governance, including the process towards \nenhanced cooperation and the convening of the Internet Governance Forum, should \ncontinue to follow the provisions set forth in the outcomes of the summits held in \nGeneva and Tunis,  \n \nTaking note of the \u201cWSIS+20 Forum High-level Event\u201d to be held in Geneva in \n2024, co-hosted by Switzerland and the International Telecommunication Union,  \n \nRecalling the efforts undertaken by the host countries in organizing the meetings \nof the Internet Governance Forum, most recently held in Kyoto, Japan, in 2023, and \ntaking note of the meeting to be held in Saudi Arabia in 2024,  \n \nRecalling also the convening of the Working Group on Enhanced Cooperation \non Public Policy Issues Pertaining to the Internet, based on the proposal by the Chair \nof the Commission on Science and Technology for Development regarding the \nstructure and composition of the Working Group, as requested by the General \nAssembly in its resolution 70/125 of 16 December 2015 and endorsed by the \nEconomic and Social Council in its resolution 2017/21, and taking note of its work,  \n \nNoting that information and communications technologies can help to accelerate \nprogress towards the achievement of the Sustainable Development Goals, and noting \nalso that, inter alia, the International Telecommunication Union has an important role \nin supporting Member States in the implementation of the Goals,  \n \nNoting also the convening of the World Telecommunication Development \nConference by the International Telecommunication Union in Kigali from 6 to \n16 June 2022, under the theme \u201cConnecting the unconnected to achieve sustainable \ndevelopment\u201d,  \n \nNoting further the holding of the fourth United Nations World Data Forum in \nHangzhou, China, 24 to 27 April 2023,  \n \nNoting that technological change includes new and powerful tools for \ndevelopment, and mindful of its impacts, opportunities and challenges and that \n\nInformation and communications technologies for \nsustainable development \nA/RES/78/132\n \n7/15\n23-25902 \n \nGovernments, the private sector, international organizations, civil society and the \ntechnical and academic communities should take into account the social, economic, \nethical, cultural and technical issues related to rapid technological advancements in \norder to deepen their understanding of how to harness their potential to support the \nachievement of the 2030 Agenda,  \n \nReaffirming the value and principles of multi-stakeholder cooperation and \nengagement that have characterized the World Summit on the Information Society \nprocess since its inception, and recognizing that the effective participation, \npartnership and cooperation of Governments, the private sector, civil society, \ninternational organizations, the technical and academic communities and all other \nrelevant stakeholders, within their respective roles and responsibilities, especially \nwith balanced representation from developing countries, have been and continue to \nbe vital in developing the information society,  \n \nRecognizing the important contributions and full participation of all \nstakeholders to help bridge, in their roles and responsibilities, the digital divides,  \n \nAcknowledging that differences in individual stakeholders\u2019 capabilities to both \nuse and create information and communications technologies represent a knowledge \ndivide that perpetuates inequality,  \n \nConscious of the challenges faced by States in preventing and combating the \nuse of information and communications technologies for criminal purposes, including \nby terrorists, and emphasizing the need to continue international cooperation in this \nregard and to reinforce technical assistance and capacity-building activities, at their \nrequest, for the prevention, prosecution and punishment of such use in accordance \nwith national and international law,  \n \nReiterating the pledge that no one will be left behind, reaffirming the \nrecognition that the dignity of the human person is fundamental, and the wish to see \nthe Goals and targets met for all nations and peoples and for all segments of society, \nand recommitting to endeavour to reach the furthest behind first,  \n \nNoting with great concern the severe negative impact on human health, safety \nand well-being caused by the coronavirus disease (COVID-19) pandemic, as well as \nthe severe disruption to societies and economies and the devastating impact on lives \nand livelihoods, and that the poorest and most vulnerable are the hardest hit by the \npandemic, reaffirming the ambition to get back on track to achieve the Sustainable \nDevelopment Goals by designing and implementing sustainable and inclusive \nrecovery strategies to accelerate progress towards the full implementation of the 2030 \nAgenda for Sustainable Development and to help to reduce the risk of and build \nresilience to future shocks, crises and pandemics, including by strengthening health \nsystems and achieving universal health coverage, and recognizing that equitable and \ntimely access for all to safe, quality, effective and affordable COVID-19 vaccines, \ntherapeutics and diagnostics are an essential part of a global response based on unity, \nsolidarity, renewed multilateral cooperation and the principle of leaving no one \nbehind,  \n \nNoting with grave concern that approximately a third of the world\u2019s population, \nespecially women and girls, the elderly and people in vulnerable situations, as well \nas approximately two thirds of people in the least developed countries, do not have \naccess to the Internet, and noting that the impact of the COVID-19 pandemic \nexacerbates inequalities caused by the digital divides, since the poorest and the most \nvulnerable who are the hardest hit are also those who lag behind the most in access \nto information and communications technologies,  \n \nTaking note of the United Nations Educational, Scientific and Cultural \nOrganization Recommendation on the Ethics of Artificial Intelligence, \n\nA/RES/78/132 \nInformation and communications technologies for \nsustainable development\n \n23-25902\n8/15 \n \n \n1. \nRecognizes that information and communications technologies have the \npotential to provide new solutions to development challenges, particularly in the \ncontext of globalization, and can foster sustained, inclusive and equitable economic \ngrowth and sustainable development, competitiveness, access to information and \nknowledge, trade and development, poverty eradication, gender equality and social \ninclusion that will help to expedite the integration of all countries, especially \ndeveloping countries, in particular the least developed countries, into the global \neconomy;  \n \n2. \nWelcomes the remarkable evolution and diffusion of information and \ncommunications technologies, underpinned by the contributions of both the public \nand private sectors, which have seen penetration into almost all corners of the globe, \ncreated new opportunities for social interactions, enabled new business models and \ncontributed to economic growth and development in all other sectors, while noting \nthe unique and emerging challenges related to their evolution and diffusion;  \n \n3. \nRecognizes the potential of information and communications technologies \nand digital transformation to achieve the 2030 Agenda for Sustainable Development 14 \nand other internationally agreed development goals, noting that they can accelerate \nprogress across all 17 Sustainable Development Goals, accordingly urges all \nGovernments, the private sector, civil society, international organizations, the \ntechnical and academic communities and all other relevant stakeholders to integrate \ninformation and communications technologies and digital solutions into their \napproaches to implementing the Goals, and requests United Nations system entities \nfacilitating the World Summit on the Information Society action lines to review their \nreporting and workplans to support the implementation of the 2030 Agenda;  \n \n4. \nReaffirms its commitment to bridging digital and knowledge divides, \nrecognizes that its approach must be multidimensional and include an evolving \nunderstanding of what constitutes access, emphasizing the quality of that access, and \nacknowledges that speed, stability, affordability, language, local content and \naccessibility for persons with disabilities are now core elements of quality and that \nhigh-speed broadband is already an essential enabler of sustainable development;  \n \n5. \nEmphasizes, in this regard, the vital importance of multilingualism and \nlocal content in the information society, and urges all stakeholders to encourage the \ncreation of, and access to, educational, cultural and scientific content online so as to \npromote quality of access and ensure that all people and cultures can express \nthemselves and have access to the Internet in all languages, including Indigenous \nlanguages; \n \n6. \nStresses the important role played by the private sector, civil society and \ntechnical communities in information and communications technologies;  \n \n7. \nEncourages strengthened and continuing cooperation between and among \nstakeholders from both developed and developing countries, within their respective \nroles and responsibilities, to ensure the effective implementation of the outcomes of \nthe Geneva and Tunis phases of the World Summit on the Information Society, \nthrough, inter alia, the promotion of national, regional and international \nmulti-stakeholder partnerships, including public-private partnerships, and the \npromotion of national and regional multi-stakeholder thematic platforms in a joint \neffort and dialogue with developing countries, including the least developed \ncountries, development partners and actors in the information and communications \ntechnologies sector;  \n__________________ \n \n14  Resolution 70/1. \n\nInformation and communications technologies for \nsustainable development \nA/RES/78/132\n \n9/15\n23-25902 \n \n \n8. \nWelcomes the operationalization of the Technology Bank for the Least \nDeveloped Countries, invites Member States, as well as international organizations, \nfoundations and the private sector, to provide voluntary financial contributions and \ntechnical assistance to ensure its full and effective implementation;  \n \n9. \nReiterates the call for support for the full operationalization of all \ncomponents of the Technology Facilitation Mechanism and to explore a voluntary \nfunding model in collaboration with the Department of Economic and Social Affairs \nof the Secretariat and relevant United Nations entities;  \n \n10. Notes the progress that has been made by United Nations system entities \nin cooperation with national Governments, regional commissions and other \nstakeholders, including non-governmental organizations and the private sector, in the \nimplementation of the action lines contained in the outcome documents of the World \nSummit on the Information Society, and encourages the use of those action lines for \nthe implementation of the 2030 Agenda;  \n \n11. \nAlso notes that the digital economy is an important and growing part of \nthe global economy and that connectivity is correlated with increases in gross \ndomestic product, recognizes the critical importance of expanding the participation \nof all countries, in particular developing countries, in the digital economy, and further \nnotes that the Commission on Science and Technology for Development will explore \nthe connection between data and sustainable development at its twenty-seventh \nsession, in 2024;  \n \n12. Encourages countries to take advantage of capacity-building mechanisms \nand opportunities from the entire United Nations system in this regard;  \n \n13. Urges a continued focus on maximizing development gains from \ne-commerce, through initiatives such as eTrade for All, launched by the United \nNations Conference on Trade and Development, which provides a new approach to \ntrade development through electronic exchanges by allowing developing countries to \nmore easily navigate the supply of technical assistance for building capacity in \ne-commerce readiness and by enabling donors to have a clear picture of the \nprogrammes that they could fund;  \n \n14. Recognizes in this regard that the United Nations Conference on Trade and \nDevelopment has initiated and implemented rapid e-trade readiness assessments of \nthe least developed countries in cooperation with other donors and organizations in \norder to raise awareness of the opportunities and challenges related to leveraging \ne-commerce in the least developed countries;  \n \n15. Looks forward to the holding of the fourth meeting of the Working Group \non Measuring E-commerce and the Digital Economy, on 30 November and \n1 December 2023, and the seventh session of the Intergovernmental Group of Experts \non E-commerce and the Digital Economy, from 6 to 8 May 2024, which will focus on \n\u201cBuilding digital readiness: from assessments to implementation\u201d;  \n \n16. Recognizes the need for international cooperation to examine and address \nthe opportunities, risks and challenges associated with dealing with data, and the need \nfor urgent action aimed at reducing digital divides and inequalities in data generation, \naccessibility and infrastructure, within and among countries and regions, and \nencourages strengthening of international collaboration on inclusive governance of \ndata and greater interoperability in this regard, building on contributions from \ninternational organizations, including the United Nations system, and to find common \nground on these issues, ensuring no one is left behind;  \n \n17. Further calls upon the international community to enhance its support to \ndeveloping countries, including by increasing resources available, to build their \n\nA/RES/78/132 \nInformation and communications technologies for \nsustainable development\n \n23-25902\n10/15 \n \ncapacities to equally and meaningfully benefit from data and participate in the digital \neconomy;  \n \n18. Emphasizes that efforts to close all digital divides and ensure that no one \nis left behind in the digital economy must be expanded;  \n \n19. Notes the holding of the United Nations Conference on Trade and \nDevelopment eWeek 2023, under the theme \u201cShaping the future of the digital \neconomy\u201d, from 4 to 8 December 2023;  \n \n20. Welcomes the work of the Information for All Programme of the United \nNations Educational, Scientific and Cultural Organization, which aims to assist \nMember States in formulating policies to bridge digital divides and ensure equitable \nknowledge societies, and also welcomes the holding of Global Media and Information \nLiteracy Week from 23 to 25 October 2023;  \n \n21. Recognizes that, despite recent progress and significant gains, there is still \nuneven growth in access to and the use of information and communications \ntechnologies, and expresses concern over the substantial continued digital and \nbroadband divides between and within developed and developing countries, including \nthe fact that while 90 per cent of people use the Internet in developed countries, only \n57 per cent of the population of developing countries is online, and that the cost of \naccess is higher in developing countries in relation to average household income, \nresulting in a lack of affordable access to information and communications \ntechnologies;  \n \n22. Stresses the need to provide universal, meaningful and affordable access \nto the Internet by 2030, particularly in all developing countries, welcomes efforts by \nthe United Nations to assist countries, upon their request, in achieving this, and calls \nupon all stakeholders, including the international community, to support further \nactions, including investment, to improve broadband access and connectivity in \ndeveloping countries;  \n \n23. Recognizes the importance of broadband connectivity to users in rural and \nremote areas, and in this regard notes that small and non-profit community operators, \nincluding community networks and other affordable, scalable and inclusive \ntechnology and business models that provide last-mile connectivity solutions, as \nappropriate and among others, can provide these services through, inter alia, \nappropriate regulatory measures that allow them to gain access to basic infrastructure;  \n \n24. Stresses the importance of rapid technological change in ensuring food \nsecurity and nutrition by 2030, and information technology in agriculture systems \nwith due regard for sustainability;  \n \n25. Encourages research and development, and the development of viable \nstrategies that could result in further competitiveness, investment and rapid \nreductions in the cost of information and communications technologies, and urges all \nrelevant stakeholders to address the growing digital divides between and within \ncountries through, inter alia, strengthened enabling policy environments at all levels, \nlegal and regulatory frameworks conducive to increased investment and innovation, \npublic-private partnerships, universal access strategies and international cooperation \nto improve affordability, education, capacity-building, multilingualism, cultural \npreservation, investment and technology transfer on mutually agreed terms;  \n \n26. Acknowledges the importance of more inclusive and equitable access to \nthe benefits of the emerging digital economy, and recognizes that collective efforts \nare needed towards new rule-setting that not only favours large digital enterprises, \nbut also provides for an open, fair and non-discriminatory business environment, \nincluding support for the access of micro-, small and medium-sized enterprises, \n\nInformation and communications technologies for \nsustainable development \nA/RES/78/132\n \n11/15\n23-25902 \n \nincluding those owned or operated by women, to finance, information and markets, \nwhile protecting and empowering consumers;  \n \n27. Recognizes that a gender digital divide persists and that, worldwide, 69 \nper cent of men use the Internet compared with 63 per cent of women, notes that in \nthe least developed countries only 30 per cent of women use the Internet, compared \nwith 43 per cent of men, and calls upon all stakeholders to close the gender digital \ndivide, ensure the full, equal, effective and meaningful participation of all women in \nthe information society and women\u2019s access to information and communications \ntechnologies for development, including women\u2019s and girls\u2019 access to new \ntechnologies, in this respect reiterates its request for relevant United Nations system \nentities, including the United Nations Entity for Gender Equality and the \nEmpowerment of Women (UN-Women), to support the implementation and \nmonitoring of the action lines contained in the outcome documents of the World \nSummit on the Information Society by enhancing the emphasis on gender equality \nand all women\u2019s empowerment, and reaffirms the commitment to ensuring women\u2019s \nfull and meaningful participation in decision-making processes related to information \nand communications technologies, including policies and approaches to promote \nwomen\u2019s online safety to facilitate their participation in the digital world, and to \naddress any potential negative impacts of digital technologies on gender equality and \nthe empowerment of women and girls, and committing to eliminating, preventing and \nresponding to all forms of violence against women and girls;  \n \n28. Notes the implementation of the outcomes of the World Summit on the \nInformation Society at the regional level, facilitated by the regional commissions, as \nobserved in the report of the Secretary-General on the progress made in the \nimplementation of and follow-up to the outcomes of the World Summit at the regional \nand international levels;  \n \n29. Encourages the United Nations funds and programmes and the specialized \nagencies, within their respective mandates and strategic plans, to contribute to the \nimplementation of the outcomes of the World Summit on the Information Society, and \nemphasizes the importance of allocating adequate resources in this regard;  \n \n30. Acknowledges the extension of the mandate of the Internet Governance \nForum through 2025, as set out in the outcome document of the high-level meeting \nof the General Assembly on the overall review of the implementation of the outcomes \nof the World Summit on the Information Society;  \n \n31. Recognizes the importance of the Internet Governance Forum and its \nmandate as a forum for multi-stakeholder dialogue on various matters, as reflected in \nparagraph 72 of the Tunis Agenda for the Information Society, including discussion \nof public policy issues related to key elements of Internet governance, and requests \nthe Secretary-General to continue to submit, as part of his annual reporting on the \nprogress made in the implementation of and follow-up to the outcomes of the World \nSummit on the Information Society at the regional and international levels, \ninformation on the progress made in the implementation of the recommendations \ncontained in the report of the Working Group on Improvements to the Internet \nGovernance Forum,15 in particular those on enhancing the participation of developing \ncountries;  \n \n32. Stresses the need for the enhanced participation of Governments and \nstakeholders from all developing countries, in particular the least developed \ncountries, in all meetings of the Internet Governance Forum, and in this regard invites \nMember States, as well as other relevant stakeholders, to support the participation of \n__________________ \n \n15  A/67/65-E/2012/48 and A/67/65/Corr.1-E/2012/48/Corr.1. \n\nA/RES/78/132 \nInformation and communications technologies for \nsustainable development\n \n23-25902\n12/15 \n \nGovernments and all other stakeholders from developing countries in the Forum \nitself, as well as in the preparatory meetings;  \n \n33. Notes the work of the Working Group on Enhanced Cooperation, \nestablished by the Chair of the Commission on Science and Technology for \nDevelopment as requested by the General Assembly in its resolution 70/125, to \ndevelop recommendations on how to further implement enhanced cooperation as \nenvisioned in the Tunis Agenda, and also notes that the Working Group ensured the \nfull involvement of Governments and other relevant stakeholders, in particular from \ndeveloping countries, taking into account all their diverse views and expertise;  \n \n34. Also notes that the Working Group held five meetings between September \n2016 and January 2018 at which it discussed inputs from Member States and other \nstakeholders, as stipulated by the General Assembly in its resolution 70/125;  \n \n35. Recalls the report of the Chair of the Working Group,16 which includes \nreferences to the full texts of all proposals and contributions, and expresses its \ngratitude to the Chair and all participants who submitted inputs and contributed to the \nwork of the Working Group;  \n \n36. Welcomes the good progress made by the Working Group in many areas \nand the fact that consensus seemed to emerge on some issues, while significant \ndivergence of views in a number of other issues persisted, and in that regard regrets \nthat the Working Group could not find agreement on recommendations on how to \nfurther implement enhanced cooperation as envisioned in the Tunis Agenda; \n \n37. Recognizes the importance of enhanced cooperation in the future, to enable \nGovernments, on an equal footing, to carry out their roles and responsibilities in \ninternational public policy issues pertaining to the Internet, and notes the need for \ncontinued dialogue and work on the implementation of enhanced cooperation as \nenvisioned in the Tunis Agenda;  \n \n38. Encourages the use of and engagement with forums and expertise \navailable within relevant United Nations bodies, such as the Commission on Science \nand Technology for Development, by all relevant stakeholders to promote global \ndigital cooperation;  \n \n39. \nRecognizes that a lack of access to affordable and reliable technologies and \nservices remains a critical challenge in many developing countries, in particular African \ncountries, the least developed countries, landlocked developing countries, small island \ndeveloping States, middle-income countries, countries in situations of conflict, post-\nconflict countries and countries affected by natural disasters, and that all efforts should \nbe deployed to reduce the price of information and communications technologies and \nbroadband access, bearing in mind that deliberate interventions, including through \nresearch and development and technology transfer on mutually agreed terms, may be \nnecessary to spur the development of lower-cost connectivity options;  \n \n40. Also recognizes that information and communications technologies \npresent new opportunities and challenges and that there is a pressing need to address \nthe major impediments that developing countries face in engaging with and accessing \nnew technologies, such as an appropriate enabling environment, sufficient resources, \ninfrastructure, education and literacy, capacity, investment and connectivity, as well \nas issues related to technology ownership, setting standards and technology flows, \nand in this regard urges all stakeholders to consider ensuring adequate means of \nimplementation, including appropriate financing for digital development and \nstrengthened capacity-building of developing countries, particularly the least \ndeveloped countries, towards a digitally empowered society and knowledge economy, \n__________________ \n \n16  See E/CN.16/2018/CRP.3. \n\nInformation and communications technologies for \nsustainable development \nA/RES/78/132\n \n13/15\n23-25902 \n \nand in this regard welcomes efforts by United Nations entities in providing such \ncapacity-building support to countries, upon their request;  \n \n41. Further recognizes the need to harness the potential of information and \ncommunications technologies as critical enablers of sustainable development and to \novercome digital divides, and stresses that capacity-building for the productive use \nof such technologies should be given due consideration in the implementation of the \n2030 Agenda and the Addis Ababa Action Agenda of the Third International \nConference on Financing for Development;17  \n \n42. Notes that, while a solid foundation for capacity-building in information \nand communications technologies has been laid in many areas with regard to building \nthe information society, there is still a need for continuing efforts to address the \nongoing challenges, especially for developing countries and the least developed \ncountries, and draws attention to the positive impact of broadened capacity \ndevelopment that involves institutions, organizations and entities dealing with \ninformation and communications technologies and Internet governance issues;  \n \n43. Recognizes the importance of assisting developing countries, in particular \nthe least developed countries, to address the challenges and opportunities in relation \nto the use of the Internet and e-commerce to develop their international trade \ncapacities, among other things;  \n \n44. Also recognizes the importance of the free flow of information and \nknowledge, and the need to reduce disparities in information flows at all levels, as \nthe amount of information distributed worldwide grows and the role of \ncommunication becomes all the more important, and acknowledges that the \nmainstreaming of information and communications technologies in school curricula, \nopen access to data, the fostering of competition, the creation of transparent, \npredictable, independent and non-discriminatory regulatory and legal systems, \nproportionate taxation and licensing fees, access to finance, the facilitation of public-\nprivate partnerships, multi-stakeholder cooperation, national and regional broadband \nstrategies, efficient allocation of the radio frequency spectrum, infrastructure-sharing \nmodels, community-based approaches and public access facilities have in many \ncountries facilitated significant gains in connectivity and sustainable development;  \n \n45. Calls upon all stakeholders to keep the goal of bridging digital divides, in \ntheir different forms, an area of priority concern, to put into effect sound strategies \nthat contribute to the development of e-government and to continue to focus on \npro-poor information and communications technology policies and applications, \nincluding access to broadband at the grass-roots level, with a view to narrowing the \ndigital divides among and within countries and, in turn, building information and \nknowledge societies;  \n \n46. Calls for the promotion of new research, the development and transfer of \nthe technologies on mutually agreed terms, including in the areas of food and \nnutrition, health, water and sanitation, and energy, in order to contribute to the \neradication of poverty in all its forms and dimensions and the achievement of \nsustained, inclusive and equitable economic growth, human well-being and \nsustainable development;  \n \n47. Notes the commitments made in the Addis Ababa Action Agenda, and \nrecognizes that official development assistance and other concessional financial flows \nfor information and communications technologies can make significant contributions \nto development outcomes, in particular where they can reduce the risk of public and \n__________________ \n \n17  Resolution 69/313, annex. \n\nA/RES/78/132 \nInformation and communications technologies for \nsustainable development\n \n23-25902\n14/15 \n \nprivate investment, and increase the use of information and communications \ntechnologies to strengthen good governance and tax collection;  \n \n48. Invites all relevant stakeholders to support more comprehensively those \ncountries that are trailing in the digital economy in order to reduce the digital divides, \nstrengthen the international enabling environment for value creation and build \ncapacities in both the private and public sectors;  \n \n49. Recognizes the critical importance of private sector investment in \ninformation and communications technology infrastructure, content and services, \nencourages Governments to create legal and regulatory frameworks conducive to \nincreased investment and innovation, and also recognizes the importance of public-\nprivate partnerships, universal access strategies and other approaches to that end;  \n \n50. Encourages the promotion of digital solutions through access to and use \nof digital public goods, which may include open-source software, open data, open \nartificial intelligence models, open standards and open content that adhere to \ninternational and domestic laws, in unlocking the full potential of rapid technological \nchange to achieve the Sustainable Development Goals;  \n \n51. Welcomes the holding of the eighth annual Economic and Social Council \nforum on financing for development follow-up, takes note of its intergovernmentally \nagreed conclusions and recommendations,18 looks forward to further advancement in \nthe follow-up process, and welcomes the work of the Inter-Agency Task Force on \nFinancing for Development, the progress made in operationalizing the three \ncomponents of the Technology Facilitation Mechanism and the holding of the eighth \nannual multi-stakeholder forum on science, technology and innovation for the \nSustainable Development Goals;  \n \n52. Reaffirms the commitment at the very heart of the 2030 Agenda to leave \nno one behind and commit to taking more tangible steps to support people in \nvulnerable situations and the most vulnerable countries and to reach the furthest \nbehind first;  \n \n53. Recognizes the important role of information and communications \ntechnologies for attaining the Sustainable Development Goals and for a sustainable, \ninclusive and resilient recovery from the COVID-19 pandemic, and calls upon all \nstakeholders in the information and communications technologies sector, including \nGovernments and the United Nations system, to fully consider the health and \nsocioeconomic impacts of the COVID-19 pandemic as they strengthen their efforts to \nbridge the digital divides within and between developed and developing countries, \nwith particular attention to the poorest and most vulnerable, as well as women and \ngirls, and to ensuring affordable and reliable connectivity, the promotion of digital \naccess and digital inclusion, and the expansion of accessible and inclusive distance-\nlearning solutions and digital health services;  \n \n54. Notes that, as requested by the Economic and Social Council in its \nresolution 2023/3, the Commission on Science and Technology for Development will \ncollect inputs from member States, all facilitators and other relevant stakeholders and \nwill organize, during its twenty-seventh session, in 2024, and its twenty-eighth \nsession, in 2025, substantive discussions on the progress made in the implementation \nof the outcomes of the World Summit during the past 20 years, and will report thereon, \nthrough the Economic and Social Council, to the General Assembly;  \n \n55. Looks forward to the comprehensive review by the General Assembly, in \n2025, of the progress made since the World Summit on the Information Society;  \n__________________ \n \n18  See E/FFDF/2023/3. \n\nInformation and communications technologies for \nsustainable development \nA/RES/78/132\n \n15/15\n23-25902 \n \n \n56. Stresses the need to better realize the benefits and address the challenges \nof artificial intelligence, taking note of the ongoing efforts by the United Nations in \nundertaking analysis and advancing options;  \n \n57. Requests the Secretary-General to submit to the General Assembly at its \nseventy-ninth session, through the Commission on Science and Technology for \nDevelopment and the Economic and Social Council, an action-oriented report on the \nstatus of the implementation of and follow-up to the present resolution, taking into \naccount the 2030 Agenda, the Addis Ababa Action Agenda, the review process of the \nWorld Summit on the Information Society, the summary by the Co-Chairs of the \nmulti-stakeholder forum on science, technology and innovation for the Sustainable \nDevelopment Goals19 and other relevant processes, as part of his annual report on the \nprogress made in the implementation of and follow-up to the outcomes of the World \nSummit on the Information Society at the regional and international levels;  \n \n58. Invites the Co-Chairs of the multi-stakeholder forum on science, \ntechnology and innovation for the Sustainable Development Goals in 2024 to include \nan update on the midterm reviews of science, technology and innovation for the \nSustainable Development Goals in the Co-Chairs\u2019 summary;  \n \n59. Decides to include in the provisional agenda of its seventy-ninth session \nthe item entitled \u201cInformation and communications technologies for sustainable \ndevelopment\u201d, unless otherwise agreed. \n \n49th plenary meeting \n19 December 2023 \n \n__________________ \n \n19  E/HLPF/2023/6. \n",
  "paragraphs": {
    "1": "Recognizes that information and communications technologies have the potential to provide new solutions to development challenges, particularly in the context of globalization, and can foster sustained, inclusive and equitable economic growth and sustainable development, competitiveness, access to information and knowledge, trade and development, poverty eradication, gender equality and social inclusion that will help to expedite the integration of all countries, especially developing countries, in particular the least developed countries, into the global economy;",
    "2": "Welcomes the remarkable evolution and diffusion of information and communications technologies, underpinned by the contributions of both the public and private sectors, which have seen penetration into almost all corners of the globe, created new opportunities for social interactions, enabled new business models and contributed to economic growth and development in all other sectors, while noting the unique and emerging challenges related to their evolution and diffusion;",
    "3": "Recognizes the potential of information and communications technologies and digital transformation to achieve the 2030 Agenda for Sustainable Development 14 and other internationally agreed development goals, noting that they can accelerate progress across all 17 Sustainable Development Goals, accordingly urges all Governments, the private sector, civil society, international organizations, the technical and academic communities and all other relevant stakeholders to integrate information and communications technologies and digital solutions into their approaches to implementing the Goals, and requests United Nations system entities facilitating the World Summit on the Information Society action lines to review their reporting and workplans to support the implementation of the 2030 Agenda;",
    "4": "Reaffirms its commitment to bridging digital and knowledge divides, recognizes that its approach must be multidimensional and include an evolving understanding of what constitutes access, emphasizing the quality of that access, and acknowledges that speed, stability, affordability, language, local content and accessibility for persons with disabilities are now core elements of quality and that high-speed broadband is already an essential enabler of sustainable development;",
    "5": "Emphasizes, in this regard, the vital importance of multilingualism and local content in the information society, and urges all stakeholders to encourage the creation of, and access to, educational, cultural and scientific content online so as to promote quality of access and ensure that all people and cultures can express themselves and have access to the Internet in all languages, including Indigenous languages;",
    "6": "Stresses the important role played by the private sector, civil society and technical communities in information and communications technologies;",
    "7": "Encourages strengthened and continuing cooperation between and among stakeholders from both developed and developing countries, within their respective roles and responsibilities, to ensure the effective implementation of the outcomes of the Geneva and Tunis phases of the World Summit on the Information Society, through, inter alia, the promotion of national, regional and international multi-stakeholder partnerships, including public-private partnerships, and the promotion of national and regional multi-stakeholder thematic platforms in a joint effort and dialogue with developing countries, including the least developed countries, development partners and actors in the information and communications technologies sector; __________________ 14 Resolution 70/1. Information and communications technologies for sustainable development A/RES/78/132 9/15 23-25902",
    "8": "Welcomes the operationalization of the Technology Bank for the Least Developed Countries, invites Member States, as well as international organizations, foundations and the private sector, to provide voluntary financial contributions and technical assistance to ensure its full and effective implementation;",
    "9": "Reiterates the call for support for the full operationalization of all components of the Technology Facilitation Mechanism and to explore a voluntary funding model in collaboration with the Department of Economic and Social Affairs of the Secretariat and relevant United Nations entities;",
    "10": "Notes the progress that has been made by United Nations system entities in cooperation with national Governments, regional commissions and other stakeholders, including non-governmental organizations and the private sector, in the implementation of the action lines contained in the outcome documents of the World Summit on the Information Society, and encourages the use of those action lines for the implementation of the 2030 Agenda;",
    "11": "Also notes that the digital economy is an important and growing part of the global economy and that connectivity is correlated with increases in gross domestic product, recognizes the critical importance of expanding the participation of all countries, in particular developing countries, in the digital economy, and further notes that the Commission on Science and Technology for Development will explore the connection between data and sustainable development at its twenty-seventh session, in 2024;",
    "12": "Encourages countries to take advantage of capacity-building mechanisms and opportunities from the entire United Nations system in this regard;",
    "13": "Urges a continued focus on maximizing development gains from e-commerce, through initiatives such as eTrade for All, launched by the United Nations Conference on Trade and Development, which provides a new approach to trade development through electronic exchanges by allowing developing countries to more easily navigate the supply of technical assistance for building capacity in e-commerce readiness and by enabling donors to have a clear picture of the programmes that they could fund;",
    "14": "Recognizes in this regard that the United Nations Conference on Trade and Development has initiated and implemented rapid e-trade readiness assessments of the least developed countries in cooperation with other donors and organizations in order to raise awareness of the opportunities and challenges related to leveraging e-commerce in the least developed countries;",
    "15": "Looks forward to the holding of the fourth meeting of the Working Group on Measuring E-commerce and the Digital Economy, on 30 November and 1 December 2023, and the seventh session of the Intergovernmental Group of Experts on E-commerce and the Digital Economy, from 6 to 8 May 2024, which will focus on \u201cBuilding digital readiness: from assessments to implementation\u201d;",
    "16": "Recognizes the need for international cooperation to examine and address the opportunities, risks and challenges associated with dealing with data, and the need for urgent action aimed at reducing digital divides and inequalities in data generation, accessibility and infrastructure, within and among countries and regions, and encourages strengthening of international collaboration on inclusive governance of data and greater interoperability in this regard, building on contributions from international organizations, including the United Nations system, and to find common ground on these issues, ensuring no one is left behind;",
    "17": "Further calls upon the international community to enhance its support to developing countries, including by increasing resources available, to build their A/RES/78/132 Information and communications technologies for sustainable development 23-25902 10/15 capacities to equally and meaningfully benefit from data and participate in the digital economy;",
    "18": "Emphasizes that efforts to close all digital divides and ensure that no one is left behind in the digital economy must be expanded;",
    "19": "Notes the holding of the United Nations Conference on Trade and Development eWeek 2023, under the theme \u201cShaping the future of the digital economy\u201d, from 4 to 8 December 2023;",
    "20": "Welcomes the work of the Information for All Programme of the United Nations Educational, Scientific and Cultural Organization, which aims to assist Member States in formulating policies to bridge digital divides and ensure equitable knowledge societies, and also welcomes the holding of Global Media and Information Literacy Week from 23 to 25 October 2023;",
    "21": "Recognizes that, despite recent progress and significant gains, there is still uneven growth in access to and the use of information and communications technologies, and expresses concern over the substantial continued digital and broadband divides between and within developed and developing countries, including the fact that while 90 per cent of people use the Internet in developed countries, only 57 per cent of the population of developing countries is online, and that the cost of access is higher in developing countries in relation to average household income, resulting in a lack of affordable access to information and communications technologies;",
    "22": "Stresses the need to provide universal, meaningful and affordable access to the Internet by 2030, particularly in all developing countries, welcomes efforts by the United Nations to assist countries, upon their request, in achieving this, and calls upon all stakeholders, including the international community, to support further actions, including investment, to improve broadband access and connectivity in developing countries;",
    "23": "Recognizes the importance of broadband connectivity to users in rural and remote areas, and in this regard notes that small and non-profit community operators, including community networks and other affordable, scalable and inclusive technology and business models that provide last-mile connectivity solutions, as appropriate and among others, can provide these services through, inter alia, appropriate regulatory measures that allow them to gain access to basic infrastructure;",
    "24": "Stresses the importance of rapid technological change in ensuring food security and nutrition by 2030, and information technology in agriculture systems with due regard for sustainability;",
    "25": "Encourages research and development, and the development of viable strategies that could result in further competitiveness, investment and rapid reductions in the cost of information and communications technologies, and urges all relevant stakeholders to address the growing digital divides between and within countries through, inter alia, strengthened enabling policy environments at all levels, legal and regulatory frameworks conducive to increased investment and innovation, public-private partnerships, universal access strategies and international cooperation to improve affordability, education, capacity-building, multilingualism, cultural preservation, investment and technology transfer on mutually agreed terms;",
    "26": "Acknowledges the importance of more inclusive and equitable access to the benefits of the emerging digital economy, and recognizes that collective efforts are needed towards new rule-setting that not only favours large digital enterprises, but also provides for an open, fair and non-discriminatory business environment, including support for the access of micro-, small and medium-sized enterprises, Information and communications technologies for sustainable development A/RES/78/132 11/15 23-25902 including those owned or operated by women, to finance, information and markets, while protecting and empowering consumers;",
    "27": "Recognizes that a gender digital divide persists and that, worldwide, 69 per cent of men use the Internet compared with 63 per cent of women, notes that in the least developed countries only 30 per cent of women use the Internet, compared with 43 per cent of men, and calls upon all stakeholders to close the gender digital divide, ensure the full, equal, effective and meaningful participation of all women in the information society and women\u2019s access to information and communications technologies for development, including women\u2019s and girls\u2019 access to new technologies, in this respect reiterates its request for relevant United Nations system entities, including the United Nations Entity for Gender Equality and the Empowerment of Women (UN-Women), to support the implementation and monitoring of the action lines contained in the outcome documents of the World Summit on the Information Society by enhancing the emphasis on gender equality and all women\u2019s empowerment, and reaffirms the commitment to ensuring women\u2019s full and meaningful participation in decision-making processes related to information and communications technologies, including policies and approaches to promote women\u2019s online safety to facilitate their participation in the digital world, and to address any potential negative impacts of digital technologies on gender equality and the empowerment of women and girls, and committing to eliminating, preventing and responding to all forms of violence against women and girls;",
    "28": "Notes the implementation of the outcomes of the World Summit on the Information Society at the regional level, facilitated by the regional commissions, as observed in the report of the Secretary-General on the progress made in the implementation of and follow-up to the outcomes of the World Summit at the regional and international levels;",
    "29": "Encourages the United Nations funds and programmes and the specialized agencies, within their respective mandates and strategic plans, to contribute to the implementation of the outcomes of the World Summit on the Information Society, and emphasizes the importance of allocating adequate resources in this regard;",
    "30": "Acknowledges the extension of the mandate of the Internet Governance Forum through 2025, as set out in the outcome document of the high-level meeting of the General Assembly on the overall review of the implementation of the outcomes of the World Summit on the Information Society;",
    "31": "Recognizes the importance of the Internet Governance Forum and its mandate as a forum for multi-stakeholder dialogue on various matters, as reflected in paragraph 72 of the Tunis Agenda for the Information Society, including discussion of public policy issues related to key elements of Internet governance, and requests the Secretary-General to continue to submit, as part of his annual reporting on the progress made in the implementation of and follow-up to the outcomes of the World Summit on the Information Society at the regional and international levels, information on the progress made in the implementation of the recommendations contained in the report of the Working Group on Improvements to the Internet Governance Forum,15 in particular those on enhancing the participation of developing countries;",
    "32": "Stresses the need for the enhanced participation of Governments and stakeholders from all developing countries, in particular the least developed countries, in all meetings of the Internet Governance Forum, and in this regard invites Member States, as well as other relevant stakeholders, to support the participation of __________________ 15 A/67/65-E/2012/48 and A/67/65/Corr.1-E/2012/48/Corr.1. A/RES/78/132 Information and communications technologies for sustainable development 23-25902 12/15 Governments and all other stakeholders from developing countries in the Forum itself, as well as in the preparatory meetings;",
    "33": "Notes the work of the Working Group on Enhanced Cooperation, established by the Chair of the Commission on Science and Technology for Development as requested by the General Assembly in its resolution 70/125, to develop recommendations on how to further implement enhanced cooperation as envisioned in the Tunis Agenda, and also notes that the Working Group ensured the full involvement of Governments and other relevant stakeholders, in particular from developing countries, taking into account all their diverse views and expertise;",
    "34": "Also notes that the Working Group held five meetings between September 2016 and January 2018 at which it discussed inputs from Member States and other stakeholders, as stipulated by the General Assembly in its resolution 70/125;",
    "35": "Recalls the report of the Chair of the Working Group,16 which includes references to the full texts of all proposals and contributions, and expresses its gratitude to the Chair and all participants who submitted inputs and contributed to the work of the Working Group;",
    "36": "Welcomes the good progress made by the Working Group in many areas and the fact that consensus seemed to emerge on some issues, while significant divergence of views in a number of other issues persisted, and in that regard regrets that the Working Group could not find agreement on recommendations on how to further implement enhanced cooperation as envisioned in the Tunis Agenda;",
    "37": "Recognizes the importance of enhanced cooperation in the future, to enable Governments, on an equal footing, to carry out their roles and responsibilities in international public policy issues pertaining to the Internet, and notes the need for continued dialogue and work on the implementation of enhanced cooperation as envisioned in the Tunis Agenda;",
    "38": "Encourages the use of and engagement with forums and expertise available within relevant United Nations bodies, such as the Commission on Science and Technology for Development, by all relevant stakeholders to promote global digital cooperation;",
    "39": "Recognizes that a lack of access to affordable and reliable technologies and services remains a critical challenge in many developing countries, in particular African countries, the least developed countries, landlocked developing countries, small island developing States, middle-income countries, countries in situations of conflict, post- conflict countries and countries affected by natural disasters, and that all efforts should be deployed to reduce the price of information and communications technologies and broadband access, bearing in mind that deliberate interventions, including through research and development and technology transfer on mutually agreed terms, may be necessary to spur the development of lower-cost connectivity options;",
    "40": "Also recognizes that information and communications technologies present new opportunities and challenges and that there is a pressing need to address the major impediments that developing countries face in engaging with and accessing new technologies, such as an appropriate enabling environment, sufficient resources, infrastructure, education and literacy, capacity, investment and connectivity, as well as issues related to technology ownership, setting standards and technology flows, and in this regard urges all stakeholders to consider ensuring adequate means of implementation, including appropriate financing for digital development and strengthened capacity-building of developing countries, particularly the least developed countries, towards a digitally empowered society and knowledge economy, __________________ 16 See E/CN.16/2018/CRP.3. Information and communications technologies for sustainable development A/RES/78/132 13/15 23-25902 and in this regard welcomes efforts by United Nations entities in providing such capacity-building support to countries, upon their request;",
    "41": "Further recognizes the need to harness the potential of information and communications technologies as critical enablers of sustainable development and to overcome digital divides, and stresses that capacity-building for the productive use of such technologies should be given due consideration in the implementation of the 2030 Agenda and the Addis Ababa Action Agenda of the Third International Conference on Financing for Development;17",
    "42": "Notes that, while a solid foundation for capacity-building in information and communications technologies has been laid in many areas with regard to building the information society, there is still a need for continuing efforts to address the ongoing challenges, especially for developing countries and the least developed countries, and draws attention to the positive impact of broadened capacity development that involves institutions, organizations and entities dealing with information and communications technologies and Internet governance issues;",
    "43": "Recognizes the importance of assisting developing countries, in particular the least developed countries, to address the challenges and opportunities in relation to the use of the Internet and e-commerce to develop their international trade capacities, among other things;",
    "44": "Also recognizes the importance of the free flow of information and knowledge, and the need to reduce disparities in information flows at all levels, as the amount of information distributed worldwide grows and the role of communication becomes all the more important, and acknowledges that the mainstreaming of information and communications technologies in school curricula, open access to data, the fostering of competition, the creation of transparent, predictable, independent and non-discriminatory regulatory and legal systems, proportionate taxation and licensing fees, access to finance, the facilitation of public- private partnerships, multi-stakeholder cooperation, national and regional broadband strategies, efficient allocation of the radio frequency spectrum, infrastructure-sharing models, community-based approaches and public access facilities have in many countries facilitated significant gains in connectivity and sustainable development;",
    "45": "Calls upon all stakeholders to keep the goal of bridging digital divides, in their different forms, an area of priority concern, to put into effect sound strategies that contribute to the development of e-government and to continue to focus on pro-poor information and communications technology policies and applications, including access to broadband at the grass-roots level, with a view to narrowing the digital divides among and within countries and, in turn, building information and knowledge societies;",
    "46": "Calls for the promotion of new research, the development and transfer of the technologies on mutually agreed terms, including in the areas of food and nutrition, health, water and sanitation, and energy, in order to contribute to the eradication of poverty in all its forms and dimensions and the achievement of sustained, inclusive and equitable economic growth, human well-being and sustainable development;",
    "47": "Notes the commitments made in the Addis Ababa Action Agenda, and recognizes that official development assistance and other concessional financial flows for information and communications technologies can make significant contributions to development outcomes, in particular where they can reduce the risk of public and __________________ 17 Resolution 69/313, annex. A/RES/78/132 Information and communications technologies for sustainable development 23-25902 14/15 private investment, and increase the use of information and communications technologies to strengthen good governance and tax collection;",
    "48": "Invites all relevant stakeholders to support more comprehensively those countries that are trailing in the digital economy in order to reduce the digital divides, strengthen the international enabling environment for value creation and build capacities in both the private and public sectors;",
    "49": "Recognizes the critical importance of private sector investment in information and communications technology infrastructure, content and services, encourages Governments to create legal and regulatory frameworks conducive to increased investment and innovation, and also recognizes the importance of public- private partnerships, universal access strategies and other approaches to that end;",
    "50": "Encourages the promotion of digital solutions through access to and use of digital public goods, which may include open-source software, open data, open artificial intelligence models, open standards and open content that adhere to international and domestic laws, in unlocking the full potential of rapid technological change to achieve the Sustainable Development Goals;",
    "51": "Welcomes the holding of the eighth annual Economic and Social Council forum on financing for development follow-up, takes note of its intergovernmentally agreed conclusions and recommendations,18 looks forward to further advancement in the follow-up process, and welcomes the work of the Inter-Agency Task Force on Financing for Development, the progress made in operationalizing the three components of the Technology Facilitation Mechanism and the holding of the eighth annual multi-stakeholder forum on science, technology and innovation for the Sustainable Development Goals;",
    "52": "Reaffirms the commitment at the very heart of the 2030 Agenda to leave no one behind and commit to taking more tangible steps to support people in vulnerable situations and the most vulnerable countries and to reach the furthest behind first;",
    "53": "Recognizes the important role of information and communications technologies for attaining the Sustainable Development Goals and for a sustainable, inclusive and resilient recovery from the COVID-19 pandemic, and calls upon all stakeholders in the information and communications technologies sector, including Governments and the United Nations system, to fully consider the health and socioeconomic impacts of the COVID-19 pandemic as they strengthen their efforts to bridge the digital divides within and between developed and developing countries, with particular attention to the poorest and most vulnerable, as well as women and girls, and to ensuring affordable and reliable connectivity, the promotion of digital access and digital inclusion, and the expansion of accessible and inclusive distance- learning solutions and digital health services;",
    "54": "Notes that, as requested by the Economic and Social Council in its resolution 2023/3, the Commission on Science and Technology for Development will collect inputs from member States, all facilitators and other relevant stakeholders and will organize, during its twenty-seventh session, in 2024, and its twenty-eighth session, in 2025, substantive discussions on the progress made in the implementation of the outcomes of the World Summit during the past 20 years, and will report thereon, through the Economic and Social Council, to the General Assembly;",
    "55": "Looks forward to the comprehensive review by the General Assembly, in 2025, of the progress made since the World Summit on the Information Society; __________________ 18 See E/FFDF/2023/3. Information and communications technologies for sustainable development A/RES/78/132 15/15 23-25902",
    "56": "Stresses the need to better realize the benefits and address the challenges of artificial intelligence, taking note of the ongoing efforts by the United Nations in undertaking analysis and advancing options;",
    "57": "Requests the Secretary-General to submit to the General Assembly at its seventy-ninth session, through the Commission on Science and Technology for Development and the Economic and Social Council, an action-oriented report on the status of the implementation of and follow-up to the present resolution, taking into account the 2030 Agenda, the Addis Ababa Action Agenda, the review process of the World Summit on the Information Society, the summary by the Co-Chairs of the multi-stakeholder forum on science, technology and innovation for the Sustainable Development Goals19 and other relevant processes, as part of his annual report on the progress made in the implementation of and follow-up to the outcomes of the World Summit on the Information Society at the regional and international levels;",
    "58": "Invites the Co-Chairs of the multi-stakeholder forum on science, technology and innovation for the Sustainable Development Goals in 2024 to include an update on the midterm reviews of science, technology and innovation for the Sustainable Development Goals in the Co-Chairs\u2019 summary;",
    "59": "Decides to include in the provisional agenda of its seventy-ninth session the item entitled \u201cInformation and communications technologies for sustainable development\u201d, unless otherwise agreed. 49th plenary meeting 19 December 2023 __________________ 19 E/HLPF/2023/6."
  },
  "agenda_items": [
    "Item 15"
  ],
  "symbol_references": []
}