{
  "symbol": "A/RES/78/46",
  "filename": "A_RES_78_46.pdf",
  "title": "78/46. The illicit trade in small arms and light weapons in all its aspects",
  "text": "United Nations \nA/RES/78/46\n \n \nGeneral Assembly \nDistr.: General \n6 December 2023 \n \n23-24503 (E)    191223 \n*2324503* \n \n \nSeventy-eighth session \nAgenda item 99 (p) \nGeneral and complete disarmament: the illicit trade in \nsmall arms and light weapons in all its aspects  \n \n \n \n \n Resolution adopted by the General Assembly \non 4 December 2023 \n \n \n \n \n[on the report of the First Committee (A/78/409, para. 89)] \n \n \n \n78/46. The illicit trade in small arms and light weapons in all its aspects \n \n \n \nThe General Assembly, \n \nRecalling its resolution 77/71 of 7 December 2022, as well as all previous \nresolutions on the illicit trade in small arms and light weapons in all its aspects, \nincluding resolution 56/24 V of 24 December 2001, \n \nEmphasizing the importance of the continued and full implementation of the \nProgramme of Action to Prevent, Combat and Eradicate the Illicit Trade in Small \nArms and Light Weapons in All Its Aspects, adopted by the United Nations \nConference on the Illicit Trade in Small Arms and Light Weapons in All Its Aspects, 1 \nand recognizing its important contribution to international efforts on this matter, \n \nEmphasizing also the importance of the continued and full implementation of \nthe International Instrument to Enable States to Identify and Trace, in a Timely and \nReliable Manner, Illicit Small Arms and Light Weapons (the International Tracing \nInstrument),2  \n \nRecalling the commitment of States to the Programme of Action as the main \nframework for measures within the activities of the international community to \nprevent, combat and eradicate the illicit trade in small arms and light weapons in all \nits aspects, \n \nUnderlining the need for States to enhance their efforts to build national \ncapacity for the effective implementation of the Programme of Action and the \nInternational Tracing Instrument, \n__________________ \n \n1  Report of the United Nations Conference on the Illicit Trade in Small Arms and Light Weapons in \nAll Its Aspects, New York, 9\u201320 July 2001 (A/CONF.192/15), chap. IV, para. 24. \n \n2  See decision 60/519 and A/60/88 and A/60/88/Corr.2, annex. \n\nA/RES/78/46 \nThe illicit trade in small arms and light weapons in all its aspects\n \n23-24503\n2/7 \n \n \nMindful of the implementation of the outcomes adopted by the follow-up \nmeetings on the Programme of Action, \n \nWelcoming the successful conclusion of the Eighth Biennial Meeting of States \nto Consider the Implementation of the Programme of Action to Prevent, Combat and \nEradicate the Illicit Trade in Small Arms and Light Weapons in All Its Aspects, held \nin New York from 27 June to 1 July 2022, to consider the full and effective \nimplementation of the Programme of Action, and the outcome document adopted at \nthe Meeting,3  \n \nRecognizing the need for the strengthened participation of women in decision-\nmaking and implementation processes relating to the Programme of Action and the \nInternational Tracing Instrument, and reaffirming the need for States to mainstream \ngender dimensions into their implementation efforts, \n \nNoting that web-based tools developed by the Secretariat, including its \nsearchable \ndatabase \nand \nthe \nModular \nSmall-arms-control \nImplementation \nCompendium, and the tools developed by Member States could be used to assess \nprogress made in the implementation of the Programme of Action, \n \nReaffirming the decision taken by the General Assembly in its resolution 77/71 \nto establish a dedicated fellowship training programme on small arms and light \nweapons in order to strengthen technical knowledge and expertise in areas relating to \nthe implementation of the Programme of Action and the International Tracing \nInstrument, in particular in developing countries, \n \nNoting that voluntary national reports on the implementation of the Programme \nof Action can serve, inter alia, to provide a baseline for measuring progress in its \nimplementation, build confidence and promote transparency, provide a basis for \ninformation exchange and action and serve to identify needs and opportunities for \ninternational assistance and cooperation, including the matching of needs with \navailable resources and expertise, \n \nNoting with satisfaction regional and subregional efforts being undertaken in \nsupport of the implementation of the Programme of Action, and commending the \nprogress that has already been made in this regard, including the tackling of both \nsupply and demand factors that are relevant to addressing the illicit trade in small \narms and light weapons, \n \nRecognizing that sharing and applying best practices, on a voluntary basis, at \nthe regional, subregional and national levels support the full and effective \nimplementation of the Programme of Action and the International Tracing Instrument \nand should therefore be an ongoing effort, in order to address ongoing challenges \nassociated with the diversion of and illicit trade in small arms and light weapons, \n \nReaffirming that international cooperation and assistance are an essential aspect \nof the full and effective implementation of the Programme of Action and the \nInternational Tracing Instrument, \n \nRecognizing the efforts undertaken by civil society in the provision of assistance \nto States for the implementation of the Programme of Action, \n \nRecalling that Governments bear the primary responsibility for preventing, \ncombating and eradicating the illicit trade in small arms and light weapons in all its \naspects, in accordance with the sovereignty of States and their relevant international \nobligations, \n__________________ \n \n3  A/CONF.192/BMS/2022/1, annex. \n\nThe illicit trade in small arms and light weapons in all its aspects \nA/RES/78/46\n \n3/7\n23-24503 \n \n \nReiterating that illicit brokering in small arms and light weapons is a serious \nproblem that the international community should address urgently, \n \nHighlighting new challenges and potential opportunities with regard to effective \nmarking, record-keeping and tracing resulting from developments in the \nmanufacturing, technology and design of small arms and light weapons, and bearing \nin mind the different situations, capacities and priorities of States and regions, \n \nRecognizing that the opportunities and challenges associated with these \ndevelopments in the manufacturing, technology and design of small arms and light \nweapons, including polymer and modular weapons, and firearms produced using 3D \nprinting, must be addressed in a timely manner, \n \nRecalling the recommendation of the Eighth Biennial Meeting of States that the \nfourth Review Conference discuss the establishment of an open-ended technical \nexpert group, focusing on including, inter alia, realizing international cooperation in \na concrete manner, scope, objectives, participation and modalities of the group, to \ndevelop agreed recommendations by consensus to ensure the full implementation of \nthe International Tracing Instrument and the Programme of Action in the light of \nrecent developments in small arms and light weapons manufacturing, technology and \ndesign, in particular polymer and modular weapons, and firearms produced using 3D \nprinting,4  \n \nTaking note of the report of the Secretary-General,5 which contains an overview \nof recent developments in the illicit trade in small arms and light weapons and \ncontains information on the main outcomes of the Eighth Biennial Meeting of States \nand the International Tracing Instrument,  \n \nWelcoming the inclusion of small arms and light weapons in the scope of the \nArms Trade Treaty,6  \n \nAcknowledging that effective national control systems for the transfer of \nconventional arms contribute to the prevention and eradication of the illicit trade in \nsmall arms and light weapons in all its aspects, \n \nTaking note of the adoption, without a vote, of the final report7 of the open-\nended working group established pursuant to General Assembly resolution 76/233 of \n24 December 2021, and the Global Framework for Through-life Conventional \nAmmunition Management, which is a cooperative framework that is voluntary and \ncontains a set of political commitments for strengthening and promoting existing \ninitiatives on, and addressing existing gaps in, through-life conventional ammunition \nmanagement, as contained in the annex to the report,  \n \n1. \nUnderlines the fact that the issue of the illicit trade in small arms and light \nweapons in all its aspects requires concerted efforts at the national, regional and \ninternational levels to prevent, combat and eradicate the illicit manufacture, \nbrokering, transfer and circulation of small arms and light weapons, and that their \nuncontrolled proliferation in many regions of the world has a wide range of \nhumanitarian and socioeconomic consequences and poses a serious threat to peace, \nreconciliation, safety, security, stability and sustainable development at the \nindividual, local, national, regional and international levels; \n \n2. \nRecognizes the urgent need to maintain and enhance national controls, in \naccordance with the Programme of Action to Prevent, Combat and Eradicate the Illicit \nTrade in Small Arms and Light Weapons in All Its Aspects, to prevent, combat and \n__________________ \n \n4  Ibid., para. 75. \n \n5  A/78/126. \n \n6  United Nations, Treaty Series, vol. 3013, No. 52373. \n \n7  A/78/111. \n\nA/RES/78/46 \nThe illicit trade in small arms and light weapons in all its aspects\n \n23-24503\n4/7 \n \neradicate the illicit trade in small arms and light weapons, including their diversion \nto illicit trade, illegal armed groups, terrorists and other unauthorized recipients, \ntaking into account, inter alia, their adverse humanitarian and socioeconomic \nconsequences for the affected States; \n \n3. \nEmphasizes the need for States to redouble national efforts to provide for \nthe safe, secure, comprehensive and effective management of stockpiles of small arms \nand light weapons held by Governments to prevent, combat and eradicate the \ndiversion of those weapons;  \n \n4. \nCalls upon all States to implement the International Instrument to Enable \nStates to Identify and Trace, in a Timely and Reliable Manner, Illicit Small Arms and \nLight Weapons (the International Tracing Instrument) by, inter alia, including in their \nnational reports the name and contact information of the national points of contact \nand information on national marking practices used to indicate country of \nmanufacture and/or country of import, as applicable; \n \n5. \nEncourages all relevant initiatives, including those of the United Nations, \nother international organizations, regional and subregional organizations and civil \nsociety, for the successful implementation of the Programme of Action, and calls upon \nall Member States to contribute towards the continued implementation of the \nProgramme of Action at the national, regional and global levels; \n \n6. \nEncourages States to implement the recommendations contained in the \nreport of the Group of Governmental Experts established pursuant to resolution 60/81 \nof 8 December 2005 to consider further steps to enhance international cooperation in \npreventing, combating and eradicating illicit brokering in small arms and light \nweapons;8  \n \n7. \nReaffirms the outcome of the third United Nations Conference to Review \nProgress Made in the Implementation of the Programme of Action to Prevent, Combat \nand Eradicate the Illicit Trade in Small Arms and Light Weapons in All Its Aspects, \nheld in New York from 18 to 29 June 2018 (the third Review Conference); \n \n8. \nEndorses the outcome of the Eighth Biennial Meeting of States to Consider \nthe Implementation of the Programme of Action to Prevent, Combat and Eradicate \nthe Illicit Trade in Small Arms and Light Weapons in All Its Aspects, held in New \nYork from 27 June to 1 July 2022;  \n \n9. \nDecides to convene the fourth United Nations Conference to Review \nProgress Made in the Implementation of the Programme of Action to Prevent, Combat \nand Eradicate the Illicit Trade in Small Arms and Light Weapons in All Its Aspects in \nNew York from 17 to 28 June 2024, to be preceded by the meeting of the preparatory \ncommittee in New York from 12 to 16 February 2024; \n \n10. Underlines the importance of the full and effective implementation of the \nProgramme of Action and the International Tracing Instrument for attaining Goal 16 \nand target 16.4 of the 2030 Agenda for Sustainable Development; 9  \n \n11. \nEmphasizes the need for the equal, full and effective participation of \nwomen in all decision-making and implementation processes relating to the \nProgramme of Action and the International Tracing Instrument;  \n \n12. Encourages States to take into account recent developments in small arms \nand light weapons manufacturing, technology and design, in particular polymer and \nmodular weapons, in the implementation of the Programme of Action and the \nInternational Tracing Instrument and to strengthen normative frameworks, where \n__________________ \n \n8  See A/62/163 and A/62/163/Corr.1. \n \n9  Resolution 70/1. \n\nThe illicit trade in small arms and light weapons in all its aspects \nA/RES/78/46\n \n5/7\n23-24503 \n \nneeded, and cooperation between law enforcement agencies so as to prevent \nunauthorized recipients, including criminals and terrorists, from acquiring small arms \nand light weapons;  \n \n13. Emphasizes that international cooperation and assistance remain essential \nto the full and effective implementation of the Programme of Action and the \nInternational Tracing Instrument, while being mindful of the need to ensure the \nadequacy, accessibility, effectiveness and sustainability of international cooperation \nand assistance measures, including, as appropriate, improved funding arrangements, \ntechnology transfer and adequate training and support programmes, as well as strong \nnational ownership;  \n \n14. Also emphasizes the fact that initiatives by the international community \nwith respect to international cooperation and assistance remain essential and \ncomplementary to national implementation efforts, as well as to those at the regional \nand global levels; \n \n15. Recognizes the necessity for interested States to develop effective \ncoordination mechanisms, where they do not exist, in order to match the needs of \nStates with existing resources to enhance the implementation of the Programme of \nAction and to make international cooperation and assistance more effective, and in \nthis regard encourages States to make use, as appropriate, of the Programme of Action \nImplementation Support System; \n \n16. Encourages States to consider, among other mechanisms, the coherent \nidentification of needs, priorities, national plans and programmes that may require \ninternational cooperation and assistance from States and regional and international \norganizations in a position to do so; \n \n17. Encourages States, with the assistance of the Secretariat, where \napplicable, to develop options for enhancing the effectiveness of the existing \ninternational assistance frameworks in support of the effective implementation of the \nProgramme of Action and the International Tracing Instrument, including by \nestablishing, within existing resources, a structured procedure within the Secretariat \nto process requests for assistance submitted under the Programme of Action and the \nInternational Tracing Instrument, for consideration and appropriate follow-up by \nMember States at the fourth Review Conference;10 \n \n18. Also encourages States, on a voluntary basis, to make increasing use of \ntheir national reports as a tool for communicating assistance needs and information \non the resources and mechanisms available to address such needs, and encourages \nStates in a position to render such assistance to make use of those national reports; \n \n19. Encourages States, relevant international and regional organizations and \ncivil society with the capacity to do so to cooperate with and provide assistance to \nother States, upon request, in the preparation of comprehensive national reports on \ntheir implementation of the Programme of Action and the International Tracing \nInstrument; \n \n20. Encourages States to reinforce, as necessary, cross-border cooperation at \nthe national, subregional and regional levels in addressing the common problem of \nthe illicit trade in small arms and light weapons in all its aspects, with full respect for \neach State\u2019s sovereignty over its own borders; \n \n21. Also encourages States to take full advantage of the benefits of \ncooperation with the United Nations regional centres for peace and disarmament, the \nWorld Customs Organization, the International Criminal Police Organization \n__________________ \n \n10  See A/CONF.192/BMS/2022/1, annex, para. 87. \n\nA/RES/78/46 \nThe illicit trade in small arms and light weapons in all its aspects\n \n23-24503\n6/7 \n \n(INTERPOL) and the United Nations Office on Drugs and Crime, in accordance with \ntheir mandates and consistent with national priorities; \n \n22. Encourages all efforts to build national capacity for the effective \nimplementation of the Programme of Action, including those highlighted in the \noutcome document of the third Review Conference; \n \n23. Recalls its decision to establish, within the regular budget of the United \nNations, a standing dedicated fellowship training programme on small arms and light \nweapons in order to strengthen the technical and practical knowledge and expertise \nof government officials directly responsible for the implementation of the Programme \nof Action and the International Tracing Instrument, particularly in developing \ncountries, to be implemented annually starting in 2024 for a duration of four weeks \nin-person in four regions, respectively, preceded by a preparatory self-paced online \ncourse, with the participation of 15 fellows per region, and requests the Secretary-\nGeneral to operationalize this decision and to report thereon to the General Assembly \nat its eightieth session, and periodically thereafter for follow-up;11  \n \n24. Encourages States to submit, on a voluntary basis, national reports on their \nimplementation of the Programme of Action, notes that States will submit national \nreports on their implementation of the International Tracing Instrument, encourages \nthose States in a position to do so to use the reporting template made available by the \nOffice for Disarmament Affairs of the Secretariat, and reaffirms the utility of \nsynchronizing such reports with biennial meetings of States and review conferences \nas a means of increasing the submission rate and improving the utility of reports, as \nwell as contributing substantively to meeting discussions; \n \n25. Encourages States in a position to do so to provide financial assistance, \nthrough a voluntary sponsorship fund, that could be distributed, upon request, to \nStates otherwise unable to participate in meetings on the Programme of Action; \n \n26. Welcomes the establishment of the Saving Lives Entity fund to ensure \nsustained financing for coordinated, integrated small arms control measures in \ncountries most affected by the illicit trade in small arms and light weapons, and \nencourages States in a position to do so to make voluntary financial contributions to \nthe fund; \n \n27. Encourages interested States and relevant international and regional \norganizations in a position to do so to convene regional meetings to consider and \nadvance the implementation of the Programme of Action, as well as the International \nTracing Instrument, including in preparation for the meetings on the Programme of \nAction; \n \n28. Encourages civil society, industry and relevant organizations to strengthen \ntheir cooperation and work with States at the respective national and regional levels \nto achieve the implementation of the Programme of Action; \n \n29. Reaffirms the importance of States undertaking to identify, where \napplicable, groups and individuals engaged in the illegal manufacture, trade, \nstockpiling, transfer, possession, as well as financing for acquisition, of illicit small \narms and light weapons, and take action under appropriate national law against such \ngroups and individuals;12  \n \n30. Requests the Secretariat to prepare a comprehensive analysis, within \nexisting resources, of progress in the trends, challenges and opportunities related to \n__________________ \n \n11  Ibid., para. 83. \n \n12  Report of the United Nations Conference on Illicit Trade in Small Arms and Light Weapons in All \nIts Aspects, New York, 9\u201320 July 2001 (A/CONF.192/15), chap. IV, para. 24, sect. II, para. 6. \n\nThe illicit trade in small arms and light weapons in all its aspects \nA/RES/78/46\n \n7/7\n23-24503 \n \nthe implementation of the Programme of Action and the International Tracing \nInstrument, including with regard to national frameworks, based on available credible \ninformation, including information submitted and/or provided by Member States, for \npresentation at the fourth Review Conference for consideration and appropriate \nfollow-up, prior to which the findings and recommendations of the analysis will be \nshared with Member States in one or more informal meetings; 13 \n \n31. Also requests the Secretariat to report on support provided by the United \nNations system for the implementation of the Programme of Action and the \nInternational Tracing Instrument, including experiences, best practices and lessons \nlearned regarding the efficient use of available resources, for presentation at \nupcoming meetings on the Programme of Action and the International Tracing \nInstrument;  \n \n32. Encourages Member States to discuss at the fourth Review Conference the \nestablishment of an open-ended technical expert group, focusing on including, inter \nalia, realizing international cooperation in a concrete manner, scope, objectives, \nparticipation and modalities of the group, to develop agreed recommendations by \nconsensus to ensure the full implementation of the International Tracing Instrument \nand the Programme of Action in the light of recent developments in small arms and \nlight weapons manufacturing, technology and design, in particular polymer and \nmodular weapons, and firearms produced using 3D printing, and requests the \nSecretariat, within existing resources, to prepare and circulate proposals for the \nabove-mentioned focus issues and any other necessary administrative arrangements \nin a timely manner prior to the fourth Review Conference so as to facilitate its \ndiscussion and to initiate discussions on the mandate of such a group during the \npreparatory process leading up to the fourth Review Conference; 14 \n \n33. Requests the Secretary-General to report to the General Assembly at its \nseventy-ninth session on the implementation of the present resolution; \n \n34. Decides to include in the provisional agenda of its seventy-ninth session, \nunder the item entitled \u201cGeneral and complete disarmament\u201d, the sub-item entitled \n\u201cThe illicit trade in small arms and light weapons in all its aspects\u201d.  \n \n42nd plenary meeting \n4 December 2023 \n \n__________________ \n \n13  See A/CONF.192/BMS/2022/1, annex, para. 60. \n \n14  Ibid., para. 75. \n",
  "paragraphs": {
    "1": "Underlines the fact that the issue of the illicit trade in small arms and light weapons in all its aspects requires concerted efforts at the national, regional and international levels to prevent, combat and eradicate the illicit manufacture, brokering, transfer and circulation of small arms and light weapons, and that their uncontrolled proliferation in many regions of the world has a wide range of humanitarian and socioeconomic consequences and poses a serious threat to peace, reconciliation, safety, security, stability and sustainable development at the individual, local, national, regional and international levels;",
    "2": "Recognizes the urgent need to maintain and enhance national controls, in accordance with the Programme of Action to Prevent, Combat and Eradicate the Illicit Trade in Small Arms and Light Weapons in All Its Aspects, to prevent, combat and eradicate the illicit trade in small arms and light weapons, including their diversion to illicit trade, illegal armed groups, terrorists and other unauthorized recipients, taking into account, inter alia, their adverse humanitarian and socioeconomic consequences for the affected States;",
    "3": "Emphasizes the need for States to redouble national efforts to provide for the safe, secure, comprehensive and effective management of stockpiles of small arms and light weapons held by Governments to prevent, combat and eradicate the diversion of those weapons;",
    "4": "Calls upon all States to implement the International Instrument to Enable States to Identify and Trace, in a Timely and Reliable Manner, Illicit Small Arms and Light Weapons (the International Tracing Instrument) by, inter alia, including in their national reports the name and contact information of the national points of contact and information on national marking practices used to indicate country of manufacture and/or country of import, as applicable;",
    "5": "Encourages all relevant initiatives, including those of the United Nations, other international organizations, regional and subregional organizations and civil society, for the successful implementation of the Programme of Action, and calls upon all Member States to contribute towards the continued implementation of the Programme of Action at the national, regional and global levels;",
    "6": "Encourages States to implement the recommendations contained in the report of the Group of Governmental Experts established pursuant to resolution 60/81 of 8 December 2005 to consider further steps to enhance international cooperation in preventing, combating and eradicating illicit brokering in small arms and light weapons;8",
    "7": "Reaffirms the outcome of the third United Nations Conference to Review Progress Made in the Implementation of the Programme of Action to Prevent, Combat and Eradicate the Illicit Trade in Small Arms and Light Weapons in All Its Aspects, held in New York from 18 to 29 June 2018 (the third Review Conference);",
    "8": "Endorses the outcome of the Eighth Biennial Meeting of States to Consider the Implementation of the Programme of Action to Prevent, Combat and Eradicate the Illicit Trade in Small Arms and Light Weapons in All Its Aspects, held in New York from 27 June to 1 July 2022;",
    "9": "Decides to convene the fourth United Nations Conference to Review Progress Made in the Implementation of the Programme of Action to Prevent, Combat and Eradicate the Illicit Trade in Small Arms and Light Weapons in All Its Aspects in New York from 17 to 28 June 2024, to be preceded by the meeting of the preparatory committee in New York from 12 to 16 February 2024;",
    "10": "Underlines the importance of the full and effective implementation of the Programme of Action and the International Tracing Instrument for attaining Goal 16 and target 16.4 of the 2030 Agenda for Sustainable Development; 9",
    "11": "Emphasizes the need for the equal, full and effective participation of women in all decision-making and implementation processes relating to the Programme of Action and the International Tracing Instrument;",
    "12": "Encourages States to take into account recent developments in small arms and light weapons manufacturing, technology and design, in particular polymer and modular weapons, in the implementation of the Programme of Action and the International Tracing Instrument and to strengthen normative frameworks, where needed, and cooperation between law enforcement agencies so as to prevent unauthorized recipients, including criminals and terrorists, from acquiring small arms and light weapons;",
    "13": "Emphasizes that international cooperation and assistance remain essential to the full and effective implementation of the Programme of Action and the International Tracing Instrument, while being mindful of the need to ensure the adequacy, accessibility, effectiveness and sustainability of international cooperation and assistance measures, including, as appropriate, improved funding arrangements, technology transfer and adequate training and support programmes, as well as strong national ownership;",
    "14": "Also emphasizes the fact that initiatives by the international community with respect to international cooperation and assistance remain essential and complementary to national implementation efforts, as well as to those at the regional and global levels;",
    "15": "Recognizes the necessity for interested States to develop effective coordination mechanisms, where they do not exist, in order to match the needs of States with existing resources to enhance the implementation of the Programme of Action and to make international cooperation and assistance more effective, and in this regard encourages States to make use, as appropriate, of the Programme of Action Implementation Support System;",
    "16": "Encourages States to consider, among other mechanisms, the coherent identification of needs, priorities, national plans and programmes that may require international cooperation and assistance from States and regional and international organizations in a position to do so;",
    "17": "Encourages States, with the assistance of the Secretariat, where applicable, to develop options for enhancing the effectiveness of the existing international assistance frameworks in support of the effective implementation of the Programme of Action and the International Tracing Instrument, including by establishing, within existing resources, a structured procedure within the Secretariat to process requests for assistance submitted under the Programme of Action and the International Tracing Instrument, for consideration and appropriate follow-up by Member States at the fourth Review Conference;10",
    "18": "Also encourages States, on a voluntary basis, to make increasing use of their national reports as a tool for communicating assistance needs and information on the resources and mechanisms available to address such needs, and encourages States in a position to render such assistance to make use of those national reports;",
    "19": "Encourages States, relevant international and regional organizations and civil society with the capacity to do so to cooperate with and provide assistance to other States, upon request, in the preparation of comprehensive national reports on their implementation of the Programme of Action and the International Tracing Instrument;",
    "20": "Encourages States to reinforce, as necessary, cross-border cooperation at the national, subregional and regional levels in addressing the common problem of the illicit trade in small arms and light weapons in all its aspects, with full respect for each State\u2019s sovereignty over its own borders;",
    "21": "Also encourages States to take full advantage of the benefits of cooperation with the United Nations regional centres for peace and disarmament, the World Customs Organization, the International Criminal Police Organization (INTERPOL) and the United Nations Office on Drugs and Crime, in accordance with their mandates and consistent with national priorities;",
    "22": "Encourages all efforts to build national capacity for the effective implementation of the Programme of Action, including those highlighted in the outcome document of the third Review Conference;",
    "23": "Recalls its decision to establish, within the regular budget of the United Nations, a standing dedicated fellowship training programme on small arms and light weapons in order to strengthen the technical and practical knowledge and expertise of government officials directly responsible for the implementation of the Programme of Action and the International Tracing Instrument, particularly in developing countries, to be implemented annually starting in 2024 for a duration of four weeks in-person in four regions, respectively, preceded by a preparatory self-paced online course, with the participation of 15 fellows per region, and requests the Secretary- General to operationalize this decision and to report thereon to the General Assembly at its eightieth session, and periodically thereafter for follow-up;11",
    "24": "Encourages States to submit, on a voluntary basis, national reports on their implementation of the Programme of Action, notes that States will submit national reports on their implementation of the International Tracing Instrument, encourages those States in a position to do so to use the reporting template made available by the Office for Disarmament Affairs of the Secretariat, and reaffirms the utility of synchronizing such reports with biennial meetings of States and review conferences as a means of increasing the submission rate and improving the utility of reports, as well as contributing substantively to meeting discussions;",
    "25": "Encourages States in a position to do so to provide financial assistance, through a voluntary sponsorship fund, that could be distributed, upon request, to States otherwise unable to participate in meetings on the Programme of Action;",
    "26": "Welcomes the establishment of the Saving Lives Entity fund to ensure sustained financing for coordinated, integrated small arms control measures in countries most affected by the illicit trade in small arms and light weapons, and encourages States in a position to do so to make voluntary financial contributions to the fund;",
    "27": "Encourages interested States and relevant international and regional organizations in a position to do so to convene regional meetings to consider and advance the implementation of the Programme of Action, as well as the International Tracing Instrument, including in preparation for the meetings on the Programme of Action;",
    "28": "Encourages civil society, industry and relevant organizations to strengthen their cooperation and work with States at the respective national and regional levels to achieve the implementation of the Programme of Action;",
    "29": "Reaffirms the importance of States undertaking to identify, where applicable, groups and individuals engaged in the illegal manufacture, trade, stockpiling, transfer, possession, as well as financing for acquisition, of illicit small arms and light weapons, and take action under appropriate national law against such groups and individuals;12",
    "30": "Requests the Secretariat to prepare a comprehensive analysis, within existing resources, of progress in the trends, challenges and opportunities related to the implementation of the Programme of Action and the International Tracing Instrument, including with regard to national frameworks, based on available credible information, including information submitted and/or provided by Member States, for presentation at the fourth Review Conference for consideration and appropriate follow-up, prior to which the findings and recommendations of the analysis will be shared with Member States in one or more informal meetings; 13",
    "31": "Also requests the Secretariat to report on support provided by the United Nations system for the implementation of the Programme of Action and the International Tracing Instrument, including experiences, best practices and lessons learned regarding the efficient use of available resources, for presentation at upcoming meetings on the Programme of Action and the International Tracing Instrument;",
    "32": "Encourages Member States to discuss at the fourth Review Conference the establishment of an open-ended technical expert group, focusing on including, inter alia, realizing international cooperation in a concrete manner, scope, objectives, participation and modalities of the group, to develop agreed recommendations by consensus to ensure the full implementation of the International Tracing Instrument and the Programme of Action in the light of recent developments in small arms and light weapons manufacturing, technology and design, in particular polymer and modular weapons, and firearms produced using 3D printing, and requests the Secretariat, within existing resources, to prepare and circulate proposals for the above-mentioned focus issues and any other necessary administrative arrangements in a timely manner prior to the fourth Review Conference so as to facilitate its discussion and to initiate discussions on the mandate of such a group during the preparatory process leading up to the fourth Review Conference; 14",
    "33": "Requests the Secretary-General to report to the General Assembly at its seventy-ninth session on the implementation of the present resolution;",
    "34": "Decides to include in the provisional agenda of its seventy-ninth session, under the item entitled \u201cGeneral and complete disarmament\u201d, the sub-item entitled \u201cThe illicit trade in small arms and light weapons in all its aspects\u201d."
  },
  "agenda_items": [
    "Item 99"
  ],
  "symbol_references": []
}