{
  "symbol": "A/RES/76/299",
  "filename": "A_RES_76_299.pdf",
  "title": "76/299. Zone of peace, trust and cooperation of Central Asia",
  "text": "United Nations \nA/RES/76/299\n \n \nGeneral Assembly \nDistr.: General \n1 August 2022 \n \n22-11873 (E)    050822 \n*2211873* \n \n \nSeventy-sixth session \nAgenda item 66 \nPeacebuilding and sustaining peace \n \n \n \n \n Resolution adopted by the General Assembly \non 28 July 2022 \n \n \n \n \n[without reference to a Main Committee (A/76/L.74 and A/76/L.74/Add.1)] \n \n \n 76/299. Zone of peace, trust and cooperation of Central Asia \n \n \n \nThe General Assembly, \n \nRecognizing the important role of the United Nations in developing friendly \nrelations among nations, \n \nGuided by the provisions of the Charter of the United Nations that encourage \nmeasures for regional cooperation to advance the purposes and principles of the \nUnited Nations, \n \nReaffirming the Charter and its purposes and principles, and especially the \ncommitment to settle disputes through peaceful means and the determination to save \nsucceeding generations from the scourge of war, \n \nAcknowledging that the approach of multilateralism and diplomacy could \nreinforce the advancement of the three pillars of the United Nations, namely, \nsustainable development, peace and security, and human rights, which are \ninterconnected and mutually reinforcing, while observing respective mandates and \nthe Charter, \n \nRecalling its resolution 73/338 of 12 September 2019, by which it declared 2021 \nthe International Year of Peace and Trust, \n \nConsidering that the promotion of peace is the main objective of the United \nNations, noting in this regard the proclamation every five years of the United Nations \nInternational Year of Peace and Trust in order to focus the efforts of the United \nNations and its Member States, with a view to promoting the ideals of peace and trust \nand demonstrating by all possible means their commitment to peace and trust, \n \nStressing that the cost of all activities that may arise from the implementation \nof the present resolution, in which it recommends proclaiming every five years the \nUnited Nations International Year of Peace and Trust, should be met from voluntary \ncontributions, \n\nA/RES/76/299 \nZone of peace, trust and cooperation of Central Asia\n \n22-11873\n2/3 \n \n \nRecognizing the importance of the Declaration and Programme of Action on a \nCulture of Peace, 1  which serve as a universal mandate for the international \ncommunity, particularly for the United Nations system, for the promotion of a culture \nof peace and non-violence that benefits humanity, in particular future generations, \n \nRecognizing also the important role of the Central Asian countries2 in ensuring \npeace, stability and sustainable development in the region, as well as in promoting \nregional and international cooperation, \n \nBearing in mind the determination of the peoples of the States of the Central \nAsian region to preserve their independence, sovereignty and territorial integrity and \nto develop their relations in peace and liberty, \n \nConvinced of the importance of promoting peace, trust and cooperation in \nCentral Asia, including, in particular, for the benefit of the peoples of the region, \n \nReaffirming that the questions of maintenance of international peace and \nsecurity and those of development are interrelated and inseparable, and considering \nthat cooperation among States, in particular those of the region, for peace and \ndevelopment is essential for the promotion of the objectives of the zone of peace, trust \nand cooperation of Central Asia, \n \nWelcoming the efforts of the Governments of the Central Asian countries to \nimplement the 2030 Agenda for Sustainable Development 3  and the Sustainable \nDevelopment Goals contained therein at the national level, \n \nNoting with satisfaction the regional support for the initiative to convene regular \nconsultative meetings of the Heads of State of Central Asian countries, \n \nWelcoming the Central Asian Women Leaders\u2019 Caucus committed to \nstrengthening the role of all women in promoting sustainable development and \nmaintaining peace and security in the region, established with the participation of the \nUnited Nations Regional Centre for Preventive Diplomacy for Central Asia and the \nUnited Nations Development Programme, and convinced that women\u2019s active \ninvolvement in policymaking and support for their participation in the socioeconomic life \nof States will contribute to the speedier and more successful resolution of the problems that \nthey face, \n \nRecognizing the importance of preventive diplomacy, and noting in this context \nthe role of the United Nations Regional Centre for Preventive Diplomacy for Central \nAsia,4 \n \nNoting the importance of declaring a zone of peace, trust and cooperation of \nCentral Asia as a basis for promoting cooperation among the States of the region, \n \nRecalling the great potential of Central Asia for socioeconomic development \nand the strengthening of cooperation among the States of the region in such areas as \nscience and technology, education, capacity-building, the environment, the \nstrengthening \nof \nnational \ninstitutions, \ntrade, \nsports, \ntourism, \neconomy, \ncommunications, transport, culture and political dialogue, \n \nNoting with satisfaction the commitment of the Central Asian States to the \nachievement of peace, trust and cooperation in the region, \n__________________ \n \n1 Resolutions 53/243 A and B. \n \n2 Kazakhstan, Kyrgyzstan, Tajikistan, Turkmenistan and Uzbekistan. \n \n3 Resolution 70/1. \n \n4 See resolution 75/272. \n\nZone of peace, trust and cooperation of Central Asia \nA/RES/76/299\n \n3/3\n22-11873 \n \n \nConvinced that the establishment of a zone of peace, trust and cooperation in \nCentral Asia would contribute significantly to the strengthening of international peace \nand security and to promoting the purposes and principles of the Charter, \n \n1. \nDeclares the region of Central Asia a zone of peace, trust and cooperation; \n \n2. \nNotes with satisfaction the significant practical contribution of the Central \nAsian States in strengthening regional peace, trust and cooperation in achieving \nsustainable development, as well as their efforts in this regard; \n \n3. \nReaffirms that threats to stability and sustainable development in the \nregion require closer and more coordinated cooperation between the States of Central \nAsia, as well as between them and international and regional organizations, and also \nreaffirms the importance of regional cooperation involving regional and international \norganizations in addressing these threats; \n \n4. \nCalls upon the countries of the Central Asian region to make effective use \nof the platform of regular consultative meetings of Heads of State and other forums \nto promote cooperation within the region and beyond in ensuring peace, trust and \ncooperation; \n \n5. \nCalls upon all States of the Central Asian region to promote further \nregional cooperation, inter alia, for economic and social development, the protection \nof the environment and the conservation of living resources; \n \n6. \nEncourages all States of the region and all other regions to cooperate in \nefforts towards sustaining peace in the Central Asian zone, and to respect the national \nunity, sovereignty, political independence and territorial integrity of all States of the \nregion, strictly observing the Charter of the United Nations; \n \n7. \nEncourages the convening of meetings of the Ministers for Foreign Affairs \nof Central Asian States on a regular basis, as well as their annual meetings on the \nsidelines of the General Assembly by prior agreement; \n \n8. \nSupports the further strengthening of good-neighbourly and friendly \nrelations among the Central Asian States through deepening relations in the fields of \nenlightenment, science, education, technology, innovation, tourism, culture, the arts \nand sports, and for continued mutual assistance in emergency situations; \n \n9. \nEncourages the efforts of the partners of the Central Asian States and the \ninternational community as a whole to strengthen and expand cooperation with the \ncountries of the region in the fields of regional security and sustainable development; \n \n10. Decides to include in the provisional agenda of its seventy-seventh session \nan item entitled \u201cZone of peace, trust and cooperation of Central Asia\u201d. \n \n97th plenary meeting \n28 July 2022 \n \n",
  "paragraphs": {
    "1": "Declares the region of Central Asia a zone of peace, trust and cooperation;",
    "2": "Notes with satisfaction the significant practical contribution of the Central Asian States in strengthening regional peace, trust and cooperation in achieving sustainable development, as well as their efforts in this regard;",
    "3": "Reaffirms that threats to stability and sustainable development in the region require closer and more coordinated cooperation between the States of Central Asia, as well as between them and international and regional organizations, and also reaffirms the importance of regional cooperation involving regional and international organizations in addressing these threats;",
    "4": "Calls upon the countries of the Central Asian region to make effective use of the platform of regular consultative meetings of Heads of State and other forums to promote cooperation within the region and beyond in ensuring peace, trust and cooperation;",
    "5": "Calls upon all States of the Central Asian region to promote further regional cooperation, inter alia, for economic and social development, the protection of the environment and the conservation of living resources;",
    "6": "Encourages all States of the region and all other regions to cooperate in efforts towards sustaining peace in the Central Asian zone, and to respect the national unity, sovereignty, political independence and territorial integrity of all States of the region, strictly observing the Charter of the United Nations;",
    "7": "Encourages the convening of meetings of the Ministers for Foreign Affairs of Central Asian States on a regular basis, as well as their annual meetings on the sidelines of the General Assembly by prior agreement;",
    "8": "Supports the further strengthening of good-neighbourly and friendly relations among the Central Asian States through deepening relations in the fields of enlightenment, science, education, technology, innovation, tourism, culture, the arts and sports, and for continued mutual assistance in emergency situations;",
    "9": "Encourages the efforts of the partners of the Central Asian States and the international community as a whole to strengthen and expand cooperation with the countries of the region in the fields of regional security and sustainable development;",
    "10": "Decides to include in the provisional agenda of its seventy-seventh session an item entitled \u201cZone of peace, trust and cooperation of Central Asia\u201d. 97th plenary meeting 28 July 2022"
  },
  "agenda_items": [
    "Item 66"
  ],
  "symbol_references": [
    "A/76/L.74"
  ]
}