{
  "symbol": "A/RES/72/14",
  "filename": "A_RES_72_14.pdf",
  "title": "72/14. Peaceful settlement of the question of Palestine",
  "text": " \nUnited Nations \n \nA/RES/72/14\n \n \nGeneral Assembly \n \nDistr.: General \n7 December 2017 \n \n \n17-21322 (E)    301117    111217 \n*1721322* \n \n \n \n \n \nSeventy-second session \nAgenda item 38 \n \n \n \n \n Resolution adopted by the General Assembly  \non 30 November 2017 \n \n \n \n \n[without reference to a Main Committee (A/72/L.16 and A/72/L.16/Add.1)] \n \n \n \n72/14. Peaceful settlement of the question of Palestine \n \n \n \nThe General Assembly,  \n \nRecalling its relevant resolutions, including those adopted at its tenth \nemergency special session,  \n \nRecalling also its resolution 58/292 of 6 May 2004,  \n \nRecalling further relevant Security Council resolutions, including resolutions \n242 (1967) of 22 November 1967, 338 (1973) of 22 October 1973, 1397 (2002) of \n12 March 2002, 1515 (2003) of 19 November 2003, 1544 (2004) of 19 May 2004, \n1850 (2008) of 16 December 2008 and 2334 (2016) of 23 December 2016, \n \nRecalling the affirmation by the Security Council of the vision of a region \nwhere two States, Israel and Palestine, live side by side within secure and \nrecognized borders,  \n \nExpressing its deep concern that it has been 70 years since the adoption of its \nresolution 181 (II) of 29 November 1947 and 50 years since the occupation of \nPalestinian territory, including East Jerusalem, in 1967, and that a just, lasting and \ncomprehensive solution to the question of Palestine has yet to be achieved, \n \nHaving considered the report of the Secretary-General submitted pursuant to \nthe request made in its resolution 71/23 of 30 November 2016, 1 \n \nReaffirming the permanent responsibility of the United Nations with regard to \nthe question of Palestine until the question is resolved in all its aspects in \naccordance with international law and relevant resolutions,  \n \nRecalling the advisory opinion rendered on 9 July 2004 by the International \nCourt of Justice on the legal consequences of the construction of a wall in the \n__________________ \n \n1  A/72/368-S/2017/741. \n\nA/RES/72/14 \nPeaceful settlement of the question of Palestine\n \nError! No document variable supplied. \n2/10 \n \nOccupied Palestinian Territory, 2 and recalling also its resolutions ES-10/15 of \n20 July 2004 and ES-10/17 of 15 December 2006,  \n \nConvinced that achieving a just, lasting and comprehensive settlement of the \nquestion of Palestine, the core of the Arab-Israeli conflict, is imperative for the \nattainment of comprehensive and lasting peace and stability in the Middle East,  \n \nStressing that the principle of equal rights and self-determination of peoples is \namong the purposes and principles enshrined in the Charter of the United Nations,  \n \nReaffirming the principle of the inadmissibility of the acquisition of territory \nby war,  \n \nReaffirming also the applicability of the Geneva Convention relative to the \nProtection of Civilian Persons in Time of War, of 12 August 1949, 3 to the Occupied \nPalestinian Territory, including East Jerusalem,  \n \nRecalling its resolution 2625 (XXV) of 24 October 1970, and reiterating the \nimportance of maintaining and strengthening international peace founded upon \nfreedom, equality, justice and respect for fundamental human rights and of \ndeveloping friendly relations among nations irrespective of their political, economic \nand social systems or the level of their development,  \n \nBearing in mind its resolution 70/1 of 25 September 2015, entitled \n\u201cTransforming our world: the 2030 Agenda for Sustainable Development\u201d, in \nparticular Sustainable Development Goal 16, \n \nStressing the urgent need for efforts to reverse the negative trends on the \nground and to restore a political horizon for advancing and accelerating meaningful \nnegotiations aimed at the achievement of a peace agreement that will bring a \ncomplete end to the Israeli occupation that began in 1967 and the resolution of all \ncore final status issues, without exception, leading to a peaceful, just, lasting and \ncomprehensive solution of the question of Palestine,  \n \nReaffirming the illegality of the Israeli settlements in the Palestinian territory \noccupied since 1967, including East Jerusalem,  \n \nExpressing grave concern about the extremely detrimental impact of Israeli \nsettlement policies, decisions and activities in the Occupied Palestinian Territory, \nincluding East Jerusalem, including on the contiguity, integrity and viability of the \nTerritory, the viability of the two-State solution based on the pre-1967 borders and \nthe efforts to advance a peaceful settlement in the Middle East,  \n \nExpressing grave concern also about all acts of violence, intimidation and \nprovocation by Israeli settlers against Palestinian civilians, including children, and \nproperties, including homes, mosques, churches and agricultural lands, condemning \nacts of terror by several extremist Israeli settlers, and calling for accountability for \nthe illegal actions perpetrated in this regard,  \n \nReaffirming the illegality of Israeli actions aimed at changing the status of \nJerusalem, including settlement construction and expansion, home demolitions, \nevictions of Palestinian residents, excavations in and around religious and historic \nsites, and all other unilateral measures aimed at altering the character, status and \ndemographic composition of the city and of the Territory as a whole, and demanding \ntheir immediate cessation,  \n__________________ \n \n2  See A/ES-10/273 and A/ES-10/273/Corr.1. \n \n3  United Nations, Treaty Series, vol. 75, No. 973. \n\nPeaceful settlement of the question of Palestine \nA/RES/72/14\n \n3/10 \nError! No document variable supplied. \n \n \nExpressing its grave concern about tensions, provocations and incitement \nregarding the holy places of Jerusalem, including the Haram al-Sharif, and urging \nrestraint and respect for the sanctity of the holy sites by all sides,  \n \nReaffirming that the construction by Israel, the occupying Power, of a wall in \nthe Occupied Palestinian Territory, including in and around East Jerusalem, and its \nassociated regime are contrary to international law,  \n \nEncouraging all States and international organizations to continue to actively \npursue policies to ensure respect for their obligations under international law with \nregard to all illegal Israeli practices and measures in the Occupied Palestinian \nTerritory, including East Jerusalem, particularly Israeli settlements,  \n \nExpressing deep concern about the continuing Israeli policies of closures and \nsevere restrictions on the movement of persons and goods, including medical and \nhumanitarian and economic, via the imposition of prolonged closures and severe \neconomic and movement restrictions that in effect amount to a blockade, as well as \nof checkpoints and a permit regime throughout the Occupied Palestinian Territory, \nincluding East Jerusalem,  \n \nExpressing deep concern also about the consequent negative impact of such \npolicies on the contiguity of the Territory and the critical socioeconomic and \nhumanitarian situation of the Palestinian people, which remains a disastrous \nhumanitarian crisis in the Gaza Strip, as well as on the efforts aimed at \nrehabilitating and developing the damaged Palestinian economy, including reviving \nthe agricultural and productive sectors, while taking note of developments regarding \nthe situation of access there based on the trilateral agreement facilitated by the \nUnited Nations in this regard and on the resumption of some trade from Gaza to the \nWest Bank for the first time since 2007, and, while recalling Security Council \nresolution 1860 (2009) of 8 January 2009, calling for the full lifting of restrictions \non the movement and access of persons and goods, taking into account the \nAgreement on Movement and Access of November 2005, including exports, which \nare crucial for social and economic recovery,  \n \nRecalling the mutual recognition 24 years ago between the Government of the \nState of Israel and the Palestine Liberation Organization, the representative of the \nPalestinian people, 4 and stressing the urgent need for efforts to ensure full \ncompliance with the agreements concluded between the two sides,  \n \nRecalling also the endorsement by the Security Council, in its resolution \n1515 (2003), of the Quartet road map to a permanent two-State solution to the \nIsraeli-Palestinian conflict 5 and the call in Council resolution 1850 (2008) for the \nparties to fulfil their obligations under the road map and to refrain from any steps \nthat could undermine confidence or prejudice the outcome of negotiations on a final \npeace settlement,  \n \nStressing the road map obligation upon Israel to freeze settlement activity, \nincluding so-called \u201cnatural growth\u201d, and to dismantle all settlement outposts \nerected since March 2001,  \n \nUnderscoring the demand by the Security Council, most recently in its \nresolution 2334 (2016), that Israel immediately and completely cease all settlement \nactivities in the Occupied Palestinian Territory, including East Jerusalem, and that it \nfully respect all of its legal obligations in this regard, \n__________________ \n \n4  See A/48/486-S/26560, annex. \n \n5  S/2003/529, annex. \n\nA/RES/72/14 \nPeaceful settlement of the question of Palestine\n \nError! No document variable supplied. \n4/10 \n \n \nRecalling the Arab Peace Initiative, adopted by the Council of the League of \nArab States at its fourteenth session, held in Beirut on 27 and 28 March 2002,6 and \nstressing its importance in the efforts to achieve a just, lasting and comprehensive \npeace, \n \nUrging renewed and coordinated efforts by the international community aimed \nat restoring a political horizon and advancing and accelerating the conclusion of a \npeace treaty to attain without delay an end to the Israeli occupation that began in \n1967 by resolving all outstanding issues, including all core issues, without \nexception, for a just, lasting and peaceful settlement of the Israeli-Palestinian \nconflict, in accordance with the internationally recognized basis of the two-State \nsolution, and ultimately of the Arab-Israeli conflict as a whole for the realization of \na comprehensive peace in the Middle East,  \n \nWelcoming, in this regard, the initiative launched by France, and taking note of \nthe joint communiqu\u00e9 of 3 June 2016, aimed at mobilizing international support for \nPalestinian-Israeli peace and convening an international peace conference, the \nongoing efforts of the Quartet in the recent period to address the unsustainable \nsituation on the ground and to promote meaningful negotiations and the ongoing \nregional efforts to advance the Arab Peace Initiative, as well as the respective \nefforts by China, Egypt, the Russian Federation and the United States of America,  \n \nTaking note of the report of the Quartet of 1 July 2016,7 and stressing its \nrecommendations as well as its recent statements, including those of 30 September \n2015, 23 October 2015, 12 February 2016 and 23 September 2016, in which, inter \nalia, grave concerns were expressed that current trends on the ground are steadily \neroding the two-State solution and entrenching a one-State reality and in which \nrecommendations were made to reverse those trends in order to advance the \ntwo-State solution on the ground and create the conditions for successful final status \nnegotiations, \n \nReiterating support for the convening of an international conference in \nMoscow, as envisioned by the Security Council in its resolution 1850 (2008) and the \nQuartet statement of 23 September 2011, and stressing the importance of \nmultilateral support and engagement for the advancement and acceleration of peace \nefforts towards the fulfilment of a just, lasting and comprehensive solution to the \nquestion of Palestine,  \n \nNoting the important contribution to peace efforts of the United Nations \nSpecial Coordinator for the Middle East Peace Process and Personal Representative \nof the Secretary-General to the Palestine Liberation Organization and the \nPalestinian Authority, including within the framework of the activities of the \nQuartet and with regard to the trilateral agreement and recent developments \nregarding the Gaza Strip,  \n \nWelcoming the ongoing efforts of the Ad Hoc Liaison Committee for the \nCoordination of the International Assistance to Palestinians, under the chairmanship \nof Norway, and noting its recent meeting at United Nations Headquarters, on \n18 September 2017, and the ongoing efforts to generate sufficient donor support in \nthis \ncritical \nperiod \nfor \nurgently \naddressing \nthe \nimmense \nhumanitarian, \nreconstruction and recovery needs in the Gaza Strip, bearing in mind the detailed \nneeds assessment and recovery framework for Gaza developed with the support of \nthe United Nations, the World Bank and the European Union, and furthering \nPalestinian economic recovery and development,  \n__________________ \n \n6  A/56/1026-S/2002/932, annex II, resolution 14/221. \n \n7  S/2016/595, annex. \n\nPeaceful settlement of the question of Palestine \nA/RES/72/14\n \n5/10 \nError! No document variable supplied. \n \n \nRecognizing the efforts being undertaken by the Palestinian Government, with \ninternational support, to reform, develop and strengthen its institutions and \ninfrastructure, emphasizing the need to preserve and further develop Palestinian \ninstitutions and infrastructure, despite the obstacles presented by the ongoing Israeli \noccupation, and commending in this regard the ongoing efforts to develop the \ninstitutions \nof \nan \nindependent \nPalestinian \nState, \nincluding \nthrough \nthe \nimplementation of the Palestinian National Policy Agenda: National Priorities, \nPolicies and Policy Interventions (2017\u20132022),  \n \nExpressing concern about the risks posed to the significant achievements \nmade, as confirmed by the positive assessments made by international institutions \nregarding readiness for statehood, including by the World Bank, the International \nMonetary Fund, the United Nations and the Ad Hoc Liaison Committee, owing to \nthe negative impact of the current instability and financial crisis being faced by the \nPalestinian Government and the continued absence of a credible political horizon,  \n \nRecognizing the positive contribution of the United Nations Development \nAssistance Framework, which is aimed, inter alia, at enhancing development \nsupport and assistance to the Palestinian people and strengthening institutional \ncapacity in line with Palestinian national priorities,  \n \nUrging the full disbursement of pledges made at the Cairo International \nConference on Palestine: Reconstructing Gaza, on 12 October 2014, for expediting \nthe provision of humanitarian assistance and the reconstruction process,  \n \nRecalling the ministerial meetings of the Conference on Cooperation among \nEast Asian Countries for Palestinian Development convened in Tokyo in February \n2013 and Jakarta in March 2014 as a forum for the mobilization of political and \neconomic assistance, including via exchanges of expertise and lessons learned, in \nsupport of Palestinian development, and encouraging the expansion of such efforts \nand support in the light of worsening socioeconomic indicators,  \n \nRecognizing the continued efforts and tangible progress made in the \nPalestinian security sector, noting the continued cooperation that benefits both \nPalestinians and Israelis, in particular by promoting security and building \nconfidence, and expressing the hope that such progress will be extended to all major \npopulation centres,  \n \nRecognizing also that security measures alone cannot remedy the tensions, \ninstability and violence, and calling for full respect for international law, including \nfor the protection of civilian life, as well as for the promotion of human security, the \nde-escalation of the situation, the exercise of restraint, including from provocative \nactions and rhetoric, and the establishment of a stable environment conducive to the \npursuit of peace,  \n \nGravely concerned over the negative developments that have continued to \noccur in the Occupied Palestinian Territory, including East Jerusalem, including the \nescalation of violence and excessive use of force, resulting in a large number of \ndeaths and injuries, mostly among Palestinian civilians, including children and \nwomen, as well as the continued construction and expansion of settlements and the \nwall, the arbitrary arrest and detention of more Palestinian civilians, the acts of \nviolence, vandalism and brutality committed against Palestinian civilians by Israeli \nsettlers in the West Bank, the widespread destruction of public and private \nPalestinian property, including religious sites, and infrastructure and the demolition \nof homes, including if carried out as a means of collective punishment, the internal \nforced displacement of civilians, especially among the Bedouin community, and the \nconsequent deterioration of the socioeconomic and humanitarian conditions of the \nPalestinian people,  \n\nA/RES/72/14 \nPeaceful settlement of the question of Palestine\n \nError! No document variable supplied. \n6/10 \n \n \nDeploring the continuing, negative repercussions of the conflicts in and \naround the Gaza Strip, the most recent in July and August 2014, which caused \nthousands of civilian casualties, the widespread destruction of thousands of homes \nand vital civilian infrastructure and the internal displacement of hundreds of \nthousands of civilians, as well as any violations of international law, including \nhumanitarian and human rights law, in this regard, and continued delays in \nreconstruction and recovery,  \n \nTaking note of the report and findings of the independent commission of \ninquiry established pursuant to Human Rights Council resolution S-21/1,8 and \nstressing the need to ensure accountability for all violations of international \nhumanitarian law and international human rights law in order to end impunity, \nensure justice, deter further violations, protect civilians and promote peace,  \n \nExpressing grave concern over the persisting disastrous humanitarian situation \nand socioeconomic conditions in the Gaza Strip as a result of the prolonged Israeli \nclosures and severe economic and movement restrictions that in effect amount to a \nblockade,  \n \nExpressing grave concern also about the lasting consequences of such \nconflicts and measures on the civilian population and the living conditions in the \nGaza Strip, as reflected in numerous reports, including the report of 26 August 2016 \nof the United Nations country team, entitled \u201cGaza: two years after\u201d, and the report \nof 11 July 2017, entitled \u201cGaza ten years later\u201d, and stressing that the situation is \nunsustainable and that urgent efforts are required to reverse the de-development \ntrajectory in Gaza and respond adequately and immediately to the immense \nhumanitarian needs of the civilian population,  \n \nRecalling the statement of the President of the Security Council of 28 July 2014,9 \n \nStressing the need for calm and restraint by the parties, including by \nconsolidating the ceasefire agreement of 26 August 2014, achieved under the \nauspices of Egypt, to avert the deterioration of the situation,  \n \nReiterating the need for the full implementation by all parties of Security \nCouncil resolution 1860 (2009) and General Assembly resolution ES-10/18 of \n16 January 2009,  \n \nStressing that a durable ceasefire agreement must lead to a fundamental \nimprovement in the living conditions of the Palestinian people in the Gaza Strip, \nincluding through the sustained and regular opening of crossing points, and ensure \nthe safety and well-being of civilians on both sides,  \n \nExpressing grave concern about the imprisonment and detention by Israel of \nthousands of Palestinians, including children, under harsh conditions, and all \nviolations of international humanitarian law and human rights law which have \noccurred in this regard,  \n \nEmphasizing the importance of the safety, protection and well-being of all \ncivilians in the whole Middle East region, and condemning all acts of violence and \nterror against civilians on both sides, including the firing of rockets,  \n \nStressing the need for measures to be taken to guarantee the safety and \nprotection of the Palestinian civilian population throughout the Occupied \nPalestinian Territory, consistent with the provisions and obligations of international \nhumanitarian law,  \n__________________ \n \n8  A/HRC/29/52. \n \n9  S/PRST/2014/13; see Resolutions and Decisions of the Security Council, 1 August 2013\u201331 July \n2014 (S/INF/69). \n\nPeaceful settlement of the question of Palestine \nA/RES/72/14\n \n7/10 \nError! No document variable supplied. \n \n \nStressing also the need to respect the right of peaceful assembly,  \n \nWelcoming the formation of the Palestinian Government of national consensus \nunder the leadership of the President, Mahmoud Abbas, consistent with Palestine \nLiberation Organization commitments and the Quartet principles, and emphasizing \nthe need for respect for and the preservation of the territorial integrity and unity of \nthe Occupied Palestinian Territory, including East Jerusalem,  \n \nAffirming the need to support the Palestinian Government of national consensus \nin its assumption of full government responsibilities in both the West Bank and the \nGaza Strip, in all fields, as well as through its presence at Gaza\u2019s crossing points, \nwelcoming in this regard the efforts of Egypt to facilitate and support Palestinian \nunity, and taking note of the Quartet statement of 28 September 2017,  \n \nStressing the urgent need for sustained and active international involvement \nand for concerted initiatives to support the parties in building a climate for peace, to \nassist the parties in advancing and accelerating direct peace process negotiations for \nthe achievement of a just, lasting and comprehensive peace settlement that ends the \noccupation which began in 1967 and results in the independence of a democratic, \ncontiguous and viable State of Palestine living side by side in peace and security \nwith Israel and its other neighbours, on the basis of relevant United Nations \nresolutions, the terms of reference of the Madrid Conference, the Quartet road map \nand the Arab Peace Initiative,  \n \nTaking note of the application of Palestine for admission to membership in the \nUnited Nations, submitted on 23 September 2011,10 \n \nTaking note also of its resolution 67/19 of 29 November 2012, by which, inter \nalia, Palestine was accorded non-member observer State status in the United \nNations, and taking note of the follow-up report of the Secretary-General, 11 \n \nNoting the accession by Palestine to several human rights treaties and the core \nhumanitarian law conventions,  \n \nAcknowledging the efforts being undertaken by civil society to promote a \npeaceful settlement of the question of Palestine,  \n \nRecalling the findings by the International Court of Justice, in its advisory \nopinion, including on the urgent necessity for the United Nations as a whole to \nredouble its efforts to bring the Israeli-Palestinian conflict, which continues to pose \na threat to international peace and security, to a speedy conclusion, thereby \nestablishing a just and lasting peace in the region,12 \n \nStressing the urgency of achieving without delay an end to the Israeli \noccupation that began in 1967,  \n \nAffirming once again the right of all States in the region to live in peace within \nsecure and internationally recognized borders,  \n \n1. \nReaffirms the necessity of achieving a peaceful settlement of the question \nof Palestine, the core of the Arab-Israeli conflict, in all its aspects, and of \nintensifying all efforts towards that end, and stresses in this regard the urgency of \nsalvaging the prospects for realizing the two-State solution of Israel and Palestine, \nliving side by side in peace and security within recognized borders, based on the \npre-1967 borders, and making tangible progress towards implementing that solution \nand justly resolving all final status issues; \n__________________ \n \n10  A/66/371-S/2011/592, annex I. \n \n11  A/67/738. \n \n12  A/ES-10/273 and A/ES-10/273/Corr.1, advisory opinion, para. 161. \n\nA/RES/72/14 \nPeaceful settlement of the question of Palestine\n \nError! No document variable supplied. \n8/10 \n \n \n2. \nRecalls Security Council resolution 2334 (2016) and, inter alia, the call \nupon all parties to continue, in the interest of the promotion of peace and security, to \nexert collective efforts to launch credible negotiations on all final status issues in \nthe Middle East peace process and within the time frame specified by the Quartet in \nits statement of 21 September 2010, and calls for its full implementation;  \n \n3. \nCalls once more for the intensification of efforts by the parties, including \nthrough negotiations, with the support of the international community, towards the \nconclusion of a final peace settlement;  \n \n4. \nUrges the undertaking of renewed international efforts to achieve a \ncomprehensive, just and lasting peace, based on the relevant United Nations \nresolutions, the terms of reference of the Madrid Conference, including the principle \nof land for peace, the Arab Peace Initiative adopted by the Council of the League of \nArab States at its fourteenth session,6 the Quartet road map to a permanent \ntwo-State solution to the Israeli-Palestinian conflict,5 and the existing agreements \nbetween the Israeli and Palestinian sides;  \n \n5. \nStresses the need for a resumption of negotiations based on the long-\nstanding terms of reference and clear parameters and within a defined time frame \naimed at expediting the realization of a just, lasting and comprehensive settlement, \nand in this regard encourages serious efforts by all concerned international and \nregional partners, including by the United States of America, the European Union, \nthe Russian Federation and the United Nations, as members of the Quartet, and by \nthe League of Arab States;  \n \n6. \nCommends and encourages continued serious regional and international \nefforts to follow up and promote the Arab Peace Initiative, including by the \nMinisterial Committee formed at the Riyadh summit in March 2007;  \n \n7. \nWelcomes the initiative launched by France aimed at mobilizing \ninternational support for Palestinian-Israeli peace, including the efforts to organize \nan international peace conference in Paris in January 2017, and the ongoing efforts \nof the Quartet to address the unsustainable situation on the ground and to promote \nmeaningful negotiations, while stressing its recommendations, and the respective \nefforts by China, Egypt, the Russian Federation and the United States to promote \ndialogue and negotiations between the two parties;  \n \n8. \nCalls for the timely convening of an international conference in Moscow, \nas envisioned by the Security Council in its resolution 1850 (2008), for the \nadvancement and acceleration of the achievement of a just, lasting and \ncomprehensive peace settlement;  \n \n9. \nCalls upon both parties to act responsibly on the basis of international \nlaw and their previous agreements and obligations, in both their policies and \nactions, in order to urgently reverse negative trends on the ground and create the \nconditions necessary for the launching of a credible political horizon and the \nadvancement of peace efforts;  \n \n10. Calls upon the parties themselves, with the support of the Quartet and \nother interested parties, to exert all efforts necessary to halt the deterioration of the \nsituation, to reverse all unilateral and unlawful measures taken on the ground since \n28 September 2000 and to refrain from actions that undermine trust or prejudge \nfinal status issues;  \n \n11. \nCalls upon the parties to observe calm and restraint and to refrain from \nprovocative actions, incitement and inflammatory rhetoric, especially in areas of \nreligious and cultural sensitivity, including in East Jerusalem, and calls for respect \n\nPeaceful settlement of the question of Palestine \nA/RES/72/14\n \n9/10 \nError! No document variable supplied. \n \nfor the historic status quo at the holy places of Jerusalem, including the Haram \nal-Sharif, in word and in practice, and for immediate and serious efforts to defuse \ntensions;  \n \n12. Underscores the need for the parties to take confidence-building \nmeasures aimed at improving the situation on the ground, promoting stability, \nbuilding trust and fostering the peace process, and stresses the need, in particular, \nfor an immediate halt to all settlement activities and home demolitions, ending \nviolence and incitement and undertaking measures to address settler violence and \nensure accountability, and for the further release of prisoners and an end to arbitrary \narrests and detentions;  \n \n13. Stresses the need for the removal of checkpoints and other obstructions \nto the movement of persons and goods throughout the Occupied Palestinian \nTerritory, including East Jerusalem, and the need for respect and preservation of the \nterritorial unity, contiguity and integrity of all of the Occupied Palestinian Territory, \nincluding East Jerusalem;  \n \n14. Also stresses the need for an immediate and complete cessation of all \nacts of violence, including military attacks, destruction and acts of terror;  \n \n15. Reiterates its demand for the full implementation of Security Council \nresolution 1860 (2009);  \n \n16. Reiterates the need for the full implementation by both parties of the \nAgreement on Movement and Access and of the Agreed Principles for the Rafah \nCrossing, of 15 November 2005, and the need, specifically, to allow for the \nsustained opening of all crossings into and out of the Gaza Strip for humanitarian \nsupplies, movement and access of persons and goods, as well as for commercial \nflows, including exports, and all necessary construction materials, and stresses the \nurgent need to accelerate comprehensive reconstruction and to address the alarming \nunemployment rate, including among youth, including through the implementation \nof United Nations-led projects, civilian reconstruction activities and job-creation \nprogrammes, all of which are essential for alleviating the disastrous humanitarian \nsituation, including the impact of the large-scale displacement of civilians in July \nand August 2014, improving the living conditions of the Palestinian people and \npromoting the recovery of the Palestinian economy;  \n \n17. Calls upon Israel, the occupying Power, to comply strictly with its \nobligations under international law, including international humanitarian law, and to \ncease all of its measures that are contrary to international law and all unilateral \nactions in the Occupied Palestinian Territory, including East Jerusalem, that are \naimed at altering the character, status and demographic composition of the Territory, \nincluding the confiscation and de facto annexation of land, and thus at prejudging \nthe final outcome of peace negotiations, with a view to achieving without delay an \nend to the Israeli occupation that began in 1967;  \n \n18. Reiterates its demand for the complete cessation of all Israeli settlement \nactivities in the Occupied Palestinian Territory, including East Jerusalem, and in the \noccupied Syrian Golan, and calls for the full implementation of the relevant \nSecurity Council resolutions, including resolution 2334 (2016), and for the \nconsideration of measures of accountability, in accordance with international law, \nincluding without limitation in relation to the continued non-compliance with the \ndemands for a complete and immediate cessation of all settlement activities and \nstressing that compliance with and respect for international humanitarian law and \ninternational human rights law is a cornerstone for peace and security in the region; \n \n19. Underscores in this regard the affirmation by the Security Council in its \nresolution 2334 (2016) that it will not recognize any changes to the 4 June 1967 \n\nA/RES/72/14 \nPeaceful settlement of the question of Palestine\n \nError! No document variable supplied. \n10/10 \n \nlines, including with regard to Jerusalem, other than those agreed by the parties \nthrough negotiations, and its call upon States to distinguish in their relevant \ndealings between the territory of the State of Israel and the territories occupied since \n1967, as well as its determination to examine practical ways and means to secure the \nfull implementation of its relevant resolutions; \n \n20. Reiterates the need for Israel forthwith to abide by its road map \nobligation to freeze all settlement activity, including so-called \u201cnatural growth\u201d, and \nto dismantle settlement outposts erected since March 2001;  \n \n21. Calls for the cessation of all provocations, including by Israeli settlers, in \nEast Jerusalem, including in and around religious sites;  \n \n22. Demands that Israel, the occupying Power, comply with its legal \nobligations under international law, as mentioned in the advisory opinion rendered \non 9 July 2004 by the International Court of Justice2 and as demanded in General \nAssembly resolutions ES-10/13 of 21 October 2003 and ES-10/15, and, inter alia, \nthat it immediately cease its construction of the wall in the Occupied Palestinian \nTerritory, including East Jerusalem, and calls upon all States Members of the United \nNations to comply with their legal obligations, as mentioned in the advisory \nopinion;  \n \n23. Reaffirms its commitment, in accordance with international law, to the \ntwo-State solution of Israel and Palestine, living side by side in peace and security \nwithin recognized borders, based on the pre-1967 borders;  \n \n24. Calls for: \n \n(a) \nThe withdrawal of Israel from the Palestinian territory occupied since \n1967, including East Jerusalem;  \n \n(b) \nThe realization of the inalienable rights of the Palestinian people, \nprimarily the right to self-determination and the right to their independent State;  \n \n25. Stresses the need for a just resolution of the problem of Palestine \nrefugees in conformity with its resolution 194 (III) of 11 December 1948;  \n \n26. Urges Member States to expedite the provision of economic, \nhumanitarian and technical assistance to the Palestinian people and the Palestinian \nGovernment during this critical period in order to help to alleviate the serious \nhumanitarian situation in the Occupied Palestinian Territory, including East \nJerusalem, which is dire in the Gaza Strip, to rehabilitate the Palestinian economy \nand infrastructure and to support the development and strengthening of Palestinian \ninstitutions and Palestinian State-building efforts in preparation for independence;  \n \n27. Requests the Secretary-General to continue his efforts with the parties \nconcerned, and in consultation with the Security Council, including with regard to \nthe reporting required pursuant to resolution 2334 (2016), towards the attainment of \na peaceful settlement of the question of Palestine and the promotion of peace in the \nregion and to submit to the General Assembly at its seventy-third session a report on \nthese efforts and on developments on this matter.  \n \n60th plenary meeting \n30 November 2017 \n \n",
  "paragraphs": {
    "1": "Reaffirms the necessity of achieving a peaceful settlement of the question of Palestine, the core of the Arab-Israeli conflict, in all its aspects, and of intensifying all efforts towards that end, and stresses in this regard the urgency of salvaging the prospects for realizing the two-State solution of Israel and Palestine, living side by side in peace and security within recognized borders, based on the pre-1967 borders, and making tangible progress towards implementing that solution and justly resolving all final status issues; __________________ 10 A/66/371-S/2011/592, annex I. 11 A/67/738. 12 A/ES-10/273 and A/ES-10/273/Corr.1, advisory opinion, para. 161. A/RES/72/14 Peaceful settlement of the question of Palestine Error! No document variable supplied. 8/10",
    "2": "Recalls Security Council resolution 2334 (2016) and, inter alia, the call upon all parties to continue, in the interest of the promotion of peace and security, to exert collective efforts to launch credible negotiations on all final status issues in the Middle East peace process and within the time frame specified by the Quartet in its statement of 21 September 2010, and calls for its full implementation;",
    "3": "Calls once more for the intensification of efforts by the parties, including through negotiations, with the support of the international community, towards the conclusion of a final peace settlement;",
    "4": "Urges the undertaking of renewed international efforts to achieve a comprehensive, just and lasting peace, based on the relevant United Nations resolutions, the terms of reference of the Madrid Conference, including the principle of land for peace, the Arab Peace Initiative adopted by the Council of the League of Arab States at its fourteenth session,6 the Quartet road map to a permanent two-State solution to the Israeli-Palestinian conflict,5 and the existing agreements between the Israeli and Palestinian sides;",
    "5": "Stresses the need for a resumption of negotiations based on the long- standing terms of reference and clear parameters and within a defined time frame aimed at expediting the realization of a just, lasting and comprehensive settlement, and in this regard encourages serious efforts by all concerned international and regional partners, including by the United States of America, the European Union, the Russian Federation and the United Nations, as members of the Quartet, and by the League of Arab States;",
    "6": "Commends and encourages continued serious regional and international efforts to follow up and promote the Arab Peace Initiative, including by the Ministerial Committee formed at the Riyadh summit in March 2007;",
    "7": "Welcomes the initiative launched by France aimed at mobilizing international support for Palestinian-Israeli peace, including the efforts to organize an international peace conference in Paris in January 2017, and the ongoing efforts of the Quartet to address the unsustainable situation on the ground and to promote meaningful negotiations, while stressing its recommendations, and the respective efforts by China, Egypt, the Russian Federation and the United States to promote dialogue and negotiations between the two parties;",
    "8": "Calls for the timely convening of an international conference in Moscow, as envisioned by the Security Council in its resolution 1850 (2008), for the advancement and acceleration of the achievement of a just, lasting and comprehensive peace settlement;",
    "9": "Calls upon both parties to act responsibly on the basis of international law and their previous agreements and obligations, in both their policies and actions, in order to urgently reverse negative trends on the ground and create the conditions necessary for the launching of a credible political horizon and the advancement of peace efforts;",
    "10": "Calls upon the parties themselves, with the support of the Quartet and other interested parties, to exert all efforts necessary to halt the deterioration of the situation, to reverse all unilateral and unlawful measures taken on the ground since 28 September 2000 and to refrain from actions that undermine trust or prejudge final status issues;",
    "11": "Calls upon the parties to observe calm and restraint and to refrain from provocative actions, incitement and inflammatory rhetoric, especially in areas of religious and cultural sensitivity, including in East Jerusalem, and calls for respect Peaceful settlement of the question of Palestine A/RES/72/14 9/10 Error! No document variable supplied. for the historic status quo at the holy places of Jerusalem, including the Haram al-Sharif, in word and in practice, and for immediate and serious efforts to defuse tensions;",
    "12": "Underscores the need for the parties to take confidence-building measures aimed at improving the situation on the ground, promoting stability, building trust and fostering the peace process, and stresses the need, in particular, for an immediate halt to all settlement activities and home demolitions, ending violence and incitement and undertaking measures to address settler violence and ensure accountability, and for the further release of prisoners and an end to arbitrary arrests and detentions;",
    "13": "Stresses the need for the removal of checkpoints and other obstructions to the movement of persons and goods throughout the Occupied Palestinian Territory, including East Jerusalem, and the need for respect and preservation of the territorial unity, contiguity and integrity of all of the Occupied Palestinian Territory, including East Jerusalem;",
    "14": "Also stresses the need for an immediate and complete cessation of all acts of violence, including military attacks, destruction and acts of terror;",
    "15": "Reiterates its demand for the full implementation of Security Council resolution 1860 (2009);",
    "16": "Reiterates the need for the full implementation by both parties of the Agreement on Movement and Access and of the Agreed Principles for the Rafah Crossing, of 15 November 2005, and the need, specifically, to allow for the sustained opening of all crossings into and out of the Gaza Strip for humanitarian supplies, movement and access of persons and goods, as well as for commercial flows, including exports, and all necessary construction materials, and stresses the urgent need to accelerate comprehensive reconstruction and to address the alarming unemployment rate, including among youth, including through the implementation of United Nations-led projects, civilian reconstruction activities and job-creation programmes, all of which are essential for alleviating the disastrous humanitarian situation, including the impact of the large-scale displacement of civilians in July and August 2014, improving the living conditions of the Palestinian people and promoting the recovery of the Palestinian economy;",
    "17": "Calls upon Israel, the occupying Power, to comply strictly with its obligations under international law, including international humanitarian law, and to cease all of its measures that are contrary to international law and all unilateral actions in the Occupied Palestinian Territory, including East Jerusalem, that are aimed at altering the character, status and demographic composition of the Territory, including the confiscation and de facto annexation of land, and thus at prejudging the final outcome of peace negotiations, with a view to achieving without delay an end to the Israeli occupation that began in 1967;",
    "18": "Reiterates its demand for the complete cessation of all Israeli settlement activities in the Occupied Palestinian Territory, including East Jerusalem, and in the occupied Syrian Golan, and calls for the full implementation of the relevant Security Council resolutions, including resolution 2334 (2016), and for the consideration of measures of accountability, in accordance with international law, including without limitation in relation to the continued non-compliance with the demands for a complete and immediate cessation of all settlement activities and stressing that compliance with and respect for international humanitarian law and international human rights law is a cornerstone for peace and security in the region;",
    "19": "Underscores in this regard the affirmation by the Security Council in its resolution 2334 (2016) that it will not recognize any changes to the 4 June 1967 A/RES/72/14 Peaceful settlement of the question of Palestine Error! No document variable supplied. 10/10 lines, including with regard to Jerusalem, other than those agreed by the parties through negotiations, and its call upon States to distinguish in their relevant dealings between the territory of the State of Israel and the territories occupied since 1967, as well as its determination to examine practical ways and means to secure the full implementation of its relevant resolutions;",
    "20": "Reiterates the need for Israel forthwith to abide by its road map obligation to freeze all settlement activity, including so-called \u201cnatural growth\u201d, and to dismantle settlement outposts erected since March 2001;",
    "21": "Calls for the cessation of all provocations, including by Israeli settlers, in East Jerusalem, including in and around religious sites;",
    "22": "Demands that Israel, the occupying Power, comply with its legal obligations under international law, as mentioned in the advisory opinion rendered on 9 July 2004 by the International Court of Justice2 and as demanded in General Assembly resolutions ES-10/13 of 21 October 2003 and ES-10/15, and, inter alia, that it immediately cease its construction of the wall in the Occupied Palestinian Territory, including East Jerusalem, and calls upon all States Members of the United Nations to comply with their legal obligations, as mentioned in the advisory opinion;",
    "23": "Reaffirms its commitment, in accordance with international law, to the two-State solution of Israel and Palestine, living side by side in peace and security within recognized borders, based on the pre-1967 borders;",
    "24": "Calls for: (a) The withdrawal of Israel from the Palestinian territory occupied since 1967, including East Jerusalem; (b) The realization of the inalienable rights of the Palestinian people, primarily the right to self-determination and the right to their independent State;",
    "25": "Stresses the need for a just resolution of the problem of Palestine refugees in conformity with its resolution 194 (III) of 11 December 1948;",
    "26": "Urges Member States to expedite the provision of economic, humanitarian and technical assistance to the Palestinian people and the Palestinian Government during this critical period in order to help to alleviate the serious humanitarian situation in the Occupied Palestinian Territory, including East Jerusalem, which is dire in the Gaza Strip, to rehabilitate the Palestinian economy and infrastructure and to support the development and strengthening of Palestinian institutions and Palestinian State-building efforts in preparation for independence;",
    "27": "Requests the Secretary-General to continue his efforts with the parties concerned, and in consultation with the Security Council, including with regard to the reporting required pursuant to resolution 2334 (2016), towards the attainment of a peaceful settlement of the question of Palestine and the promotion of peace in the region and to submit to the General Assembly at its seventy-third session a report on these efforts and on developments on this matter. 60th plenary meeting 30 November 2017"
  },
  "agenda_items": [
    "Item 38"
  ],
  "symbol_references": [
    "A/72/L.16"
  ]
}