{
  "symbol": "A/RES/74/121",
  "filename": "A_RES_74_121.pdf",
  "title": "74/121. Policies and programmes involving youth",
  "text": "United Nations \nA/RES/74/121\n \n \nGeneral Assembly \nDistr.: General \n10 January 2020 \n \n19-22041 (E)    290120 \n*1922041* \n \n \nSeventy-fourth session \nAgenda item 25 (b) \nSocial development: social development, including \nquestions relating to the world social situation and to \nyouth, ageing, persons with disabilities and the family \n \n \n \n \n Resolution adopted by the General Assembly \non 18 December 2019 \n \n \n \n \n[on the report of the Third Committee (A/74/391)] \n \n \n 74/121. Policies and programmes involving youth \n \n \n \nThe General Assembly, \n \nRecalling the World Programme of Action for Youth, adopted by the General \nAssembly in its resolutions 50/81 of 14 December 1995 and 62/126 of 18 December \n2007, \n \nRecalling also the Universal Declaration of Human Rights 1  and relevant \ninternational human rights instruments, in particular the International Covenant on \nCivil and Political Rights, 2 the International Covenant on Economic, Social and \nCultural Rights2 and the Convention on the Rights of the Child,3 \n \nRecalling further General Assembly resolution 70/1 of 25 September 2015, \nentitled \u201cTransforming our world: the 2030 Agenda for Sustainable Development\u201d, in \nwhich, for the first time, the Assembly recognized children and youth as agents of \nchange, and recognizing that the Sustainable Development Goals are integrated, \nindivisible and global in nature, and therefore that all of them apply to youth, \n \nRecalling that youth development is not only critical to the achievement of the \n2030 Agenda for Sustainable Development, but that it is also recognized in other \ndevelopment frameworks, including the Addis Ababa Action Agenda of the Third \nInternational Conference on Financing for Development, 4 the Istanbul Declaration5 \nand the Programme of Action for the Least Developed Countries for the Decade \n__________________ \n \n1  Resolution 217 A (III). \n \n2  See resolution 2200 A (XXI), annex. \n \n3  United Nations, Treaty Series, vol. 1577, No. 27531. \n \n4  Resolution 69/313, annex. \n \n5  Report of the Fourth United Nations Conference on the Least Developed Countries, Istanbul, \nTurkey, 9\u201313 May 2011 (A/CONF.219/7), chap. I. \n\nA/RES/74/121 \nPolicies and programmes involving youth\n \n19-22041\n2/9 \n \n2011\u22122020, 6 the SIDS Accelerated Modalities of Action (SAMOA) Pathway, 7 the \nNew York Declaration for Refugees and Migrants,8 the outcome of the United Nations \nConference on Housing and Sustainable Urban Development (Habitat III), 9  the \noutcome of the high-level meeting of the General Assembly on the appraisal of the \nUnited Nations Global Plan of Action to Combat Trafficking in Persons 10 and all \nrelevant international instruments or commitments related to migrants and refugees, \n \nReaffirming that fulfilling the human rights, needs and well-being of youth, \nincluding adolescents and young women, is critical to the achievement of the 2030 \nAgenda for Sustainable Development, as well as other United Nations conferences and \nsummits, including the Vienna Declaration and Programme of Action,11 the Programme \nof Action of the International Conference on Population and Development 12 and the \nBeijing Declaration and Platform for Action,13 and their review conferences, \n \nWelcoming the effective participation of youth representatives in national \ndelegations at the General Assembly, the Economic and Social Council and its \nfunctional commissions and relevant United Nations conferences, \n \nRecognizing the importance of the participation of youth in the commemorations \nof the seventy-fifth anniversary of the United Nations, in 2020, under the theme \u201cThe \nfuture we want, the United Nations we need: reaffirming our collective commitment \nto multilateralism\u201d,14 the thirtieth anniversary of the Convention on the Rights of the \nChild, in 2019,15 and the twenty-fifth anniversary of the Fourth World Conference on \nWomen, in 2020,16 \n \nTaking note that the Year of Youth was designated by Kazakhstan and the \nCommunity of Portuguese-speaking Countries in 2019, \n \nTaking note also of the convening of the forty-fifth WorldSkills competition, \nheld in Kazan, Russian Federation, in 2019, which contributes to advanced systems \nof vocational training and provides broad opportunities for young people to engage \nin technical creativity, \n \nAcknowledging the important contributions made by the Economic and Social \nCouncil youth forum to the implementation of the 2030 Agenda for Sustainable \nDevelopment and that it serves as an important platform for substantive contributions \nof young people to share their vision with decision makers and representatives of \nGovernments and civil society, \n \nTaking note of the convening of the Youth Climate Summit by the Secretary-\nGeneral, held during the seventy-fourth session of the General Assembly, which \ngathered young people committed to climate action, together with Governments, the \nUnited Nations and the private sector, to discuss youth perspectives, as well as \nhighlight youth-led solutions to address climate challenges, and in this regard further \nnoting the launch of the Kwon-Gesh Youth Pledge, \n__________________ \n \n6  Ibid., chap. II. \n \n7  Resolution 69/15, annex. \n \n8  Resolution 71/1. \n \n9  Resolution 71/256, annex. \n \n10  Resolution 72/1. \n \n11  A/CONF.157/24 (Part I), chap. III. \n \n12  Report of the International Conference on Population and Development, Cairo, 5\u201313 September \n1994 (United Nations publication, Sales No. E.95.XIII.18), chap. I, resolution 1, annex. \n \n13  Report of the Fourth World Conference on Women, Beijing, 4\u201315 September 1995 (United \nNations publication, Sales No. E.96.IV.13), chap. I, resolution 1, annexes I and II. \n \n14  See resolution 73/299. \n \n15  See resolution 73/301. \n \n16  See resolution 73/340. \n\nPolicies and programmes involving youth \nA/RES/74/121\n \n3/9\n19-22041 \n \n \nAcknowledging that the current generation of youth is the largest one ever, and \nin this context reaffirming the importance of involving youth, and youth-led and \nyouth-focused organizations, in the work of the United Nations at the national, \nregional and international levels in all matters of concern to them, including in the \nimplementation of the World Programme of Action for Youth and the 2030 Agenda \nfor Sustainable Development, \n \nRecognizing that many countries are making progress towards achieving \nuniversal health coverage by 2030 and that the good health and well-being of young \npeople are closely intertwined with their capacity to complete their education and \nseize employment opportunities, \n \nRecognizing also that young women between the ages of 15 and 24 are most \nvulnerable to HIV, experiencing infection rates two or three times as high as those of \nyoung men, depending on the region, as well as many health-related threats and \nchallenges, \n \nRecognizing further that a youthful population creates significant opportunities \nfor development, and underlining in this regard the importance of the creation by \nMember States of appropriate policy environments, in collaboration with the United \nNations system, in order to realize a demographic dividend driven by large \nproportions of young people moving into the labour force, while adopting an inclusive \nresults-based approach to development planning and implementation in accordance \nwith national priorities and legislation, and stressing in this regard the decision of the \nAfrican Union to proclaim 2017 the Year of Harnessing the Demographic Dividend \nthrough Investment in Youth, \n \nReaffirming that generating decent work and quality employment for youth is \none of the biggest challenges that needs to be tackled, and emphasizing the priority \nareas of the World Programme of Action for Youth linked to the employability of \nyouth, including quality education and health, and access to information and \ntechnology, and bearing in mind that over 59 million young people are unemployed \nand 138 million working youth are in poverty, including extreme poverty, \n \nEmphasizing the need to empower youth, including young women and girls, in \norder to achieve sustainable development, and stressing in this regard the commitment \nin the 2030 Agenda for Sustainable Development to eradicate poverty and \nsubstantially reduce the proportion of youth not in employment, education or training \nand to develop and operationalize a global strategy for youth employment, and in this \nregard takes note of the call for action of the International Labour Organization on \nthe youth employment crisis and the Global Initiative on Decent Jobs for Youth, \n \nEmphasizing also the need to substantially increase the number of youth and \nadults who have relevant skills, including technical and vocational skills, for \nemployment, decent jobs and entrepreneurship, and to ensure, by 2030, that all youth \nand a substantial proportion of adults, both men and women, achieve literacy and \nnumeracy, \n \nRecalling that Member States have an important role in promoting and \nprotecting the rights and in meeting the needs and aspirations of youth, including \nyoung people in vulnerable situations, and recognizing that the ways in which young \npeople are able to fulfil their potential as agents of change will influence social and \neconomic conditions and the well-being and livelihood of future generations, \n \nRecognizing the important and positive contribution of young people in efforts \nfor the maintenance and promotion of peace and security, \n \nRecalling the Lisbon Declaration on Youth Policies and Programmes, adopted \nat the World Conference of Ministers Responsible for Youth, in 1998, and in this \n\nA/RES/74/121 \nPolicies and programmes involving youth\n \n19-22041\n4/9 \n \ncontext welcoming the World Conference of Ministers Responsible for Youth 2019 \nand Youth Forum Lisboa+21, held on 22 and 23 June 2019, and noting the Declaration \non Youth Policies and Programmes,17 \n \nWelcoming the role of the Envoy of the Secretary-General on Youth and her \nwork in addressing the needs of youth, as well as, inter alia, as a harmonizer with \ndifferent United Nations entities, Governments, civil society, youth organizations, \nacademia and media towards enhancing, empowering and strengthening the position \nof young people within and outside the United Nations system, \n \nNoting the launch by the Secretary-General, in September 2018, of Youth 2030: \nThe United Nations Youth Strategy, to address the needs of youth and to fulfil their \npotential as agents of change, as well as of the Generation Unlimited global \npartnership, which is aimed at ensuring that, by 2030, every young person has the \nopportunity to be in education, learning, training or employment, \n \nNoting also the development of guiding principles and tools, for consideration \nby States, on the human rights obligations of States to provide public education, \n \n1. \nTakes note with appreciation of the report of the Secretary-General;18 \n \n2. \nReaffirms the World Programme of Action for Youth, 19 and emphasizes \nthat all 15 priority areas of the Programme of Action are interrelated and mutually \nreinforcing and the role that the Commission for Social Development plays in \nimplementing it; \n \n3. \nAlso reaffirms the commitment of Heads of State and Government in the \n2030 Agenda for Sustainable Development20 to leave no one behind, including youth, \nand the importance of implementing, following up on and reviewing strategies that \nadequately address youth issues and give young people everywhere real opportunities \nfor full, effective, constructive and sustainable participation in society; \n \n4. \nReiterates that the primary responsibility for implementing the World \nProgramme of Action for Youth lies with Member States, and urges Governments, in \nconsultation with youth, youth-led and youth-focused organizations and other \nrelevant stakeholders, to develop integrated, holistic, inclusive and effective youth \npolicies and programmes, as well as coherent cross-sectoral efforts, based on the \nProgramme of Action and the 2030 Agenda for Sustainable Development, and to \nevaluate them regularly as part of the follow-up action on and implementation of the \nProgramme of Action at all levels; \n \n5. \nUrges Member States to protect, promote and fulfil the realization and full \nenjoyment by all young people of all human rights and fundamental freedoms, in \naccordance with the Universal Declaration of Human Rights1 and relevant \ninternational human rights instruments, in the implementation of the World \nProgramme of Action for Youth, while ensuring that youth policies and programmes \nand their planning, design, implementation, monitoring and review include the views, \nperspectives and priorities of youth and are adequately resourced, transparent and \naccountable; \n \n6. \nCalls upon Member States to consider, on a voluntary basis, the indicators \nproposed in the report of the Secretary-General21 for their selection and adaptation in \nmonitoring and assessing the implementation of the World Programme of Action for \nYouth, giving particular attention to young women, marginalized groups and young \n__________________ \n \n17  A/73/949, annex. \n \n18  A/74/175. \n \n19  Resolution 50/81, annex, and resolution 62/126, annex. \n \n20  Resolution 70/1. \n \n21  E/CN.5/2013/8. \n\nPolicies and programmes involving youth \nA/RES/74/121\n \n5/9\n19-22041 \n \npeople belonging to vulnerable groups or in vulnerable situations, especially those \nliving in areas of armed conflict, taking into account the national social and economic \ncircumstances in each country; \n \n7. \nStresses the need to strengthen and support the capacity of national \nstatistical offices to design, collect and analyse data disaggregated by sex and age so as \nto contribute effectively to follow-up, reporting and accountability for the achievement \nof the youth dimensions of the 2030 Agenda for Sustainable Development; \n \n8. \nUrges Member States to promote equal opportunities for all, to eliminate \nall forms of discrimination against young people, including that based on race, colour, \nsex, language, religion, political or other opinion, national or social origin, property, \nbirth or other status, and to foster social integration for social groups such as young \npersons with disabilities, young migrants and indigenous youth on an equal basis with \nothers; \n \n9. \nReiterates that the eradication of poverty, hunger and malnutrition, in \nparticular as they affect children and youth, is crucial for the implementation of the \n2030 Agenda for Sustainable Development, recalls the commitment to eradicate \npoverty in all its forms and dimensions and promote sustained economic growth, \nsustainable development and global prosperity for all, including the strengthening of \ninternational cooperation through the fulfilment of all official development assistance \ncommitments and the transfer of appropriate technology and capacity-building with \nregard to youth, and the need for urgent action on all sides, including more ambitious \nnational development strategies, efforts and investment in youth, backed by increased \ninternational support and, inter alia, by providing youth with a nurturing environment \nfor the full realization of their human rights and capabilities, in order to realize the \nopportunity of the demographic dividend offered by the largest number of young \npeople ever in the history of humankind, and calls for the increased participation of \nyouth, youth-led and youth-focused organizations and other relevant civil society \norganizations in the development of such national development strategies; \n \n10. Emphasizes the role of quality health education and literacy in improving \nhealth outcomes over a lifetime, and in this regard encourages its promotion by \nMember States among young people, including through evidence-based education \nand information strategies and programmes, both in and out of school, and through \npublic campaigns, and to increase the access of youth to affordable, safe, effective, \nsustainable and appropriate youth-friendly health-care services and social services, \nsafe drinking water and adequate and equitable sanitation and hygiene, by paying \nspecial attention to and raising awareness regarding sports and physical activity, \nnutrition, including eating disorders, obesity, mental health and well-being, the \nprevention, control and effects of communicable and non-communicable diseases, the \nprevention of adolescent pregnancies, and sexual and reproductive health care, and \nrecognizes the need to develop safe, affordable and youth-friendly counselling and \nsubstance abuse prevention programmes; \n \n11. \nAlso emphasizes the need to implement measures to promote and improve \nthe mental health and well-being of young people, including by scaling up \ncomprehensive and integrated services for the prevention of mental disorders and \nother mental health conditions, including suicide prevention, as well as treatment for \nyoung people with mental disorders and other mental health conditions as well as \nneurological disorders, providing psychosocial support, including resilience training, \nwhile raising awareness of mental health issues and tackling stigma and social \npressure, promoting well-being, strengthening the prevention and treatment of \nsubstance abuse, addressing social determinants of health and fully respecting their \nhuman rights; \n\nA/RES/74/121 \nPolicies and programmes involving youth\n \n19-22041\n6/9 \n \n \n12. Calls upon Member States to accelerate efforts to scale up scientifically \naccurate age-appropriate comprehensive education, relevant to cultural contexts, that \nprovides adolescent girls and boys and young women and men, in and out of school, \nconsistent with their evolving capacities, with information on sexual and reproductive \nhealth, gender equality and the empowerment of women, human rights, physical, \npsychological and pubertal development, and power in relationships between women \nand men, to enable them to build self-esteem and informed decision-making, \ncommunication and risk reduction skills and to develop respectful relationships, in \nfull partnership with young persons, parents, legal guardians, caregivers, educators \nand health-care providers; \n \n13. Emphasizes that addressing the specific needs of young people in the \nresponse to HIV and AIDS is a key element in efforts to achieve an AIDS-free \ngeneration, and urges Member States to develop accessible, available and affordable \nprimary health-care services of high quality, including sexual and reproductive health \ncare, as well as education programmes, including those related to sexually transmitted \ninfections, including HIV and AIDS, and to strengthen efforts in this regard, including \nby ensuring the active involvement of young people living with or affected by HIV in \nthe response; \n \n14. Also emphasizes the right to education, recognizes that investment in \nuniversal, quality and inclusive education and training is the most important policy \ninvestment that States can make to ensure the immediate and long-term development \nof youth, and reiterates that access to inclusive, equitable and quality formal and \nnon-formal education, at all levels, including, as appropriate, catch-up and literacy \neducation, including in information and communications technologies for those who \ndid not receive formal education, information and communications technologies and \nvolunteerism are important factors that enable young people to acquire the relevant \nskills and to build their capacities, including for employability and entrepreneurial \ndevelopment, and to gain decent and productive work, and calls upon Member States \nto take the actions necessary to ensure that young people, including pregnant \nadolescents and young mothers, have access to such services and opportunities, which \nwill allow them to be drivers of sustainable development; \n \n15. Recognizes the importance of a deep connection between youth and their \nrespective cultural heritage and background as a tool for the establishment of positive \nrelations based on the respect for cultural diversity, leading to peaceful integration \nalso through artistic, cultural and sports initiatives; \n \n16. Calls upon Member States to accelerate their efforts to close the digital \ndivide and promote innovation among youth by ensuring that information and \ncommunications technologies are fully and appropriately integrated into education \nand training at all levels, including in the development of curricula, teacher training \nand institutional administration and management, and in support of the concept of \nlifelong learning; \n \n17. Urges Member States to intensify efforts to address the high rates of youth \nunemployment, underemployment, vulnerable employment, informal employment \nand young people not in employment, education or training by developing and \nimplementing targeted and integrated local and national youth employment policies \nfor inclusive, sustainable and innovative job creation, improved employability, skills \ndevelopment and vocational training to facilitate the transition from school to work, \nand improving synergies between the education and employment sectors to increase \nthe prospects for integrating youth into the sustainable labour market, and through \nincreased innovation and entrepreneurship, including the development of networks of \nyoung entrepreneurs at the local, national, regional and global levels that foster \nknowledge among young people about their rights and responsibilities in society, and \n\nPolicies and programmes involving youth \nA/RES/74/121\n \n7/9\n19-22041 \n \nencourages Member States to invest in quality education, support lifelong learning \nand provide social protection for all youth and to request donors, specialized United \nNations entities and the private sector to continue to provide assistance to Member \nStates, including technical and funding support, as appropriate; \n \n18. Also urges Member States to address the challenges faced by girls and \nyoung women, as well as gender stereotypes that perpetuate all forms of \ndiscrimination and violence against girls and young women, including harmful \npractices, and the stereotypical roles of men and women that hinder social and \npersonal development, by implementing the commitments to the empowerment of \nwomen and gender equality and the human rights of all women and girls, and to \nengage, educate, encourage and support men and boys to take responsibility for their \nbehaviour in this regard, including their sexual and reproductive behaviour; \n \n19. Further urges Member States to condemn violence against girls and young \nwomen, including sexual harassment, and reaffirms that they should not invoke any \ncustom, tradition or religious consideration to avoid their obligations with respect to \nits elimination and should pursue, by all appropriate means and without delay, a \npolicy of eliminating violence against women, as set out in the Declaration on the \nElimination of Violence against Women;22 \n \n20. Urges Member States to mainstream a gender perspective into all \ndevelopment efforts, recognizing that the achievement of gender equality and the \nempowerment of all women and girls is critical for achieving sustainable development \nand for efforts to combat hunger, poverty and disease, and to strengthen policies and \nprogrammes that seek to improve, ensure and broaden the full, effective and \nstructured participation of young women in all spheres of political, economic, social \nand cultural life as equal partners, and to improve their access to all resources needed \nfor the full exercise of all of their human rights and fundamental freedoms by \nremoving persistent barriers, including by providing access to quality education at all \nlevels, ensuring equal access to full and productive employment and decent work and \nstrengthening their economic independence; \n \n21. Encourages Member States to take measures that minimize the negative \neffects of globalization and maximize its benefits, and emphasizes the importance of \na fair globalization in offering relevant education and training for young people in \norder that they may reach their full personal development and that enable their access \nto decent jobs and better employment opportunities in order to meet the needs of \nchanging labour markets and enable young migrants to enjoy their human rights; \n \n22. Recognizes that the international community faces increasing challenges \nposed by climate change and the loss of biodiversity, which have increased \nvulnerabilities and inequalities with direct and indirect implications for the well-\nbeing of youth and which could make youth, particularly in developing countries and \nsmall island developing States, vulnerable to their adverse impacts, including through \nsuffering disproportionately in labour markets in times of crisis created by climate \nchange, calls for the enhanced cooperation of and concerted action by Member States \nwith youth in order to address those challenges, taking into account the positive role \nthat the education of youth can play in that respect, and encourages Member States to \nfurther promote youth participation in climate action and to consider youth \nperspectives in decision-making processes on climate change; \n \n23. Also recognizes that the sharing of family responsibilities creates an \nenabling family environment for the empowerment of youth, which contributes to \ndevelopment, that youth make a significant contribution to the welfare of their \n__________________ \n \n22  Resolution 48/104. \n\nA/RES/74/121 \nPolicies and programmes involving youth\n \n19-22041\n8/9 \n \nfamilies and that particular attention must be paid to solutions to youth unemployment \nin order to generate the human and social capital that is essential for social and \neconomic development; \n \n24. Further recognizes the importance of strengthening intergenerational \npartnerships and solidarity among generations, and in this regard recognizes the \nimportance of opportunities for voluntary, constructive and regular interaction \nbetween young people and older generations in the family, the workplace and society \nat large; \n \n25. Recognizes all recent efforts to promote the youth and peace and security \nagenda, and calls upon Member States and relevant United Nations organs and entities \nto consider ways to increase the meaningful and inclusive participation of youth in \nconflict prevention and resolution, peacebuilding, post-conflict processes and \nhumanitarian action, as well as to take concrete measures to further assist youth in \narmed conflict situations, in accordance with the World Programme of Action for \nYouth, and to encourage the involvement of youth, where appropriate, in activities \nconcerning the protection of children and youth affected by armed conflict situations, \nand recognizes the importance of protecting schools and universities from military \nuse in contravention of international humanitarian law; \n \n26. Urges Member States to take concerted action, in conformity with \ninternational law, to remove obstacles to the full realization of the rights of young \npeople living under foreign occupation, colonial rule and in other areas of conflict or \npost-conflict situations in order to promote the achievement of the goals of the 2030 \nAgenda for Sustainable Development; \n \n27. Also urges Member States to take effective measures, in conformity with \ninternational law, to protect young people, including youth in marginalized groups \naffected or exploited by terrorism; \n \n28. Further urges Member States to address legal, administrative, social, \neconomic, digital and cultural barriers that limit young people\u2019s participation and \nrepresentation, while enabling the capacities, resources, information, technology, \nsupport, space and skills needed to empower the free, active, independent, full and \neffective participation of youth, including youth in vulnerable situations; \n \n29. Calls upon Member States to develop or maintain, in this regard, \npreventive measures and remedies for violations and abuses regarding the right to \nprivacy in the digital age that may affect all individuals, including young people, \npromote digital literacy and technical skills to effectively protect their privacy and \ntake measures to prevent cyberstalking and cyberbullying; \n \n30. Recognizes that the contributions of young people are important for the \nfull and successful implementation of the 2030 Agenda for Sustainable Development, \nand urges Member States and United Nations entities, in consultation with youth and \nyouth-led and youth-focused organizations, to explore and promote concrete new \navenues for the full, effective, structured and sustainable participation of young \npeople and youth-led organizations in relevant decision-making processes and \nmonitoring, in all spheres of political, economic, social and cultural life, including in \ndesigning and implementing policies, programmes and initiatives, in particular, while \nimplementing the 2030 Agenda; \n \n31. Encourages Member States to include youth delegates in their delegations \nat all relevant discussions in the General Assembly and its subsidiary organs, the \nEconomic and Social Council and its functional commissions and relevant United \nNations conferences, as appropriate, bearing in mind the principles of gender balance \n\nPolicies and programmes involving youth \nA/RES/74/121\n \n9/9\n19-22041 \n \nand non-discrimination, and emphasizes that such youth representatives should be \nselected through a transparent process that ensures that they have a suitable mandate \nto represent young people in their countries; \n \n32. Calls upon the Department of Economic and Social Affairs of the \nSecretariat Programme on Youth to continue to act as the focal point within the United \nNations system for promoting further collaboration and coordination on youth-related \nmatters including, inter alia, with Governments on the United Nations Youth Delegate \nProgramme; \n \n33. Calls upon donors, including Member States and intergovernmental and \nnon-governmental organizations, to actively contribute to the United Nations Youth \nFund in order to facilitate the participation of youth representatives from developing \ncountries in the activities of the United Nations, taking into account the need for \ngreater geographical balance in terms of youth representation, as well as to accelerate \nthe implementation of the World Programme of Action for Youth and to support the \nproduction of the World Youth Report, and in this regard requests the Secretary-\nGeneral to take appropriate action to encourage contributions to the Fund; \n \n34. Acknowledges the increased collaboration through the Inter-Agency \nNetwork on Youth Development in developing the United Nations System-wide \nAction Plan on Youth, requests United Nations entities, within existing resources, to \ncontinue their coordination towards a more coherent, comprehensive and integrated \napproach to youth development, calls upon United Nations entities and relevant \npartners to support national, regional and international efforts in addressing \nchallenges hindering youth development, and in this regard encourages close \ncollaboration with Member States as well as other relevant stakeholders, including \ncivil society; \n \n35. Recognizes the role of the Envoy of the Secretary-General on Youth and \nher task of bringing the voices of young people to the United Nations system in the \nareas of participation, advocacy, partnerships and harmonization identified in her \nworkplan, and encourages the Envoy to continue to work closely with Governments, \nUnited Nations entities, civil society, youth organizations, academia and the media \nby empowering and strengthening the position of young people within and outside \nthe United Nations system, including by conducting country visits, at the request of \nthe Member States concerned, and calls upon Member States and United Nations \nentities to support, as appropriate, the Envoy in her efforts to advance the situation of \nyouth globally; \n \n36. Requests the Secretary-General to submit a report to the General Assembly \nat its seventy-sixth session on the implementation of the present resolution, including \non progress that has been achieved and challenges that still remain, to be prepared in \nconsultation with Member States as well as the relevant specialized agencies, funds, \nprogrammes and regional commissions, taking into account the work done by the \nUnited Nations system, and encourages the Secretariat to consult, as appropriate, with \nyouth-led and youth-focused organizations. \n \n50th plenary meeting \n18 December 2019 \n \n",
  "paragraphs": {
    "1": "Takes note with appreciation of the report of the Secretary-General;18",
    "2": "Reaffirms the World Programme of Action for Youth, 19 and emphasizes that all 15 priority areas of the Programme of Action are interrelated and mutually reinforcing and the role that the Commission for Social Development plays in implementing it;",
    "3": "Also reaffirms the commitment of Heads of State and Government in the 2030 Agenda for Sustainable Development20 to leave no one behind, including youth, and the importance of implementing, following up on and reviewing strategies that adequately address youth issues and give young people everywhere real opportunities for full, effective, constructive and sustainable participation in society;",
    "4": "Reiterates that the primary responsibility for implementing the World Programme of Action for Youth lies with Member States, and urges Governments, in consultation with youth, youth-led and youth-focused organizations and other relevant stakeholders, to develop integrated, holistic, inclusive and effective youth policies and programmes, as well as coherent cross-sectoral efforts, based on the Programme of Action and the 2030 Agenda for Sustainable Development, and to evaluate them regularly as part of the follow-up action on and implementation of the Programme of Action at all levels;",
    "5": "Urges Member States to protect, promote and fulfil the realization and full enjoyment by all young people of all human rights and fundamental freedoms, in accordance with the Universal Declaration of Human Rights1 and relevant international human rights instruments, in the implementation of the World Programme of Action for Youth, while ensuring that youth policies and programmes and their planning, design, implementation, monitoring and review include the views, perspectives and priorities of youth and are adequately resourced, transparent and accountable;",
    "6": "Calls upon Member States to consider, on a voluntary basis, the indicators proposed in the report of the Secretary-General21 for their selection and adaptation in monitoring and assessing the implementation of the World Programme of Action for Youth, giving particular attention to young women, marginalized groups and young __________________ 17 A/73/949, annex. 18 A/74/175. 19 Resolution 50/81, annex, and resolution 62/126, annex. 20 Resolution 70/1. 21 E/CN.5/2013/8. Policies and programmes involving youth A/RES/74/121 5/9 19-22041 people belonging to vulnerable groups or in vulnerable situations, especially those living in areas of armed conflict, taking into account the national social and economic circumstances in each country;",
    "7": "Stresses the need to strengthen and support the capacity of national statistical offices to design, collect and analyse data disaggregated by sex and age so as to contribute effectively to follow-up, reporting and accountability for the achievement of the youth dimensions of the 2030 Agenda for Sustainable Development;",
    "8": "Urges Member States to promote equal opportunities for all, to eliminate all forms of discrimination against young people, including that based on race, colour, sex, language, religion, political or other opinion, national or social origin, property, birth or other status, and to foster social integration for social groups such as young persons with disabilities, young migrants and indigenous youth on an equal basis with others;",
    "9": "Reiterates that the eradication of poverty, hunger and malnutrition, in particular as they affect children and youth, is crucial for the implementation of the 2030 Agenda for Sustainable Development, recalls the commitment to eradicate poverty in all its forms and dimensions and promote sustained economic growth, sustainable development and global prosperity for all, including the strengthening of international cooperation through the fulfilment of all official development assistance commitments and the transfer of appropriate technology and capacity-building with regard to youth, and the need for urgent action on all sides, including more ambitious national development strategies, efforts and investment in youth, backed by increased international support and, inter alia, by providing youth with a nurturing environment for the full realization of their human rights and capabilities, in order to realize the opportunity of the demographic dividend offered by the largest number of young people ever in the history of humankind, and calls for the increased participation of youth, youth-led and youth-focused organizations and other relevant civil society organizations in the development of such national development strategies;",
    "10": "Emphasizes the role of quality health education and literacy in improving health outcomes over a lifetime, and in this regard encourages its promotion by Member States among young people, including through evidence-based education and information strategies and programmes, both in and out of school, and through public campaigns, and to increase the access of youth to affordable, safe, effective, sustainable and appropriate youth-friendly health-care services and social services, safe drinking water and adequate and equitable sanitation and hygiene, by paying special attention to and raising awareness regarding sports and physical activity, nutrition, including eating disorders, obesity, mental health and well-being, the prevention, control and effects of communicable and non-communicable diseases, the prevention of adolescent pregnancies, and sexual and reproductive health care, and recognizes the need to develop safe, affordable and youth-friendly counselling and substance abuse prevention programmes;",
    "11": "Also emphasizes the need to implement measures to promote and improve the mental health and well-being of young people, including by scaling up comprehensive and integrated services for the prevention of mental disorders and other mental health conditions, including suicide prevention, as well as treatment for young people with mental disorders and other mental health conditions as well as neurological disorders, providing psychosocial support, including resilience training, while raising awareness of mental health issues and tackling stigma and social pressure, promoting well-being, strengthening the prevention and treatment of substance abuse, addressing social determinants of health and fully respecting their human rights; A/RES/74/121 Policies and programmes involving youth 19-22041 6/9",
    "12": "Calls upon Member States to accelerate efforts to scale up scientifically accurate age-appropriate comprehensive education, relevant to cultural contexts, that provides adolescent girls and boys and young women and men, in and out of school, consistent with their evolving capacities, with information on sexual and reproductive health, gender equality and the empowerment of women, human rights, physical, psychological and pubertal development, and power in relationships between women and men, to enable them to build self-esteem and informed decision-making, communication and risk reduction skills and to develop respectful relationships, in full partnership with young persons, parents, legal guardians, caregivers, educators and health-care providers;",
    "13": "Emphasizes that addressing the specific needs of young people in the response to HIV and AIDS is a key element in efforts to achieve an AIDS-free generation, and urges Member States to develop accessible, available and affordable primary health-care services of high quality, including sexual and reproductive health care, as well as education programmes, including those related to sexually transmitted infections, including HIV and AIDS, and to strengthen efforts in this regard, including by ensuring the active involvement of young people living with or affected by HIV in the response;",
    "14": "Also emphasizes the right to education, recognizes that investment in universal, quality and inclusive education and training is the most important policy investment that States can make to ensure the immediate and long-term development of youth, and reiterates that access to inclusive, equitable and quality formal and non-formal education, at all levels, including, as appropriate, catch-up and literacy education, including in information and communications technologies for those who did not receive formal education, information and communications technologies and volunteerism are important factors that enable young people to acquire the relevant skills and to build their capacities, including for employability and entrepreneurial development, and to gain decent and productive work, and calls upon Member States to take the actions necessary to ensure that young people, including pregnant adolescents and young mothers, have access to such services and opportunities, which will allow them to be drivers of sustainable development;",
    "15": "Recognizes the importance of a deep connection between youth and their respective cultural heritage and background as a tool for the establishment of positive relations based on the respect for cultural diversity, leading to peaceful integration also through artistic, cultural and sports initiatives;",
    "16": "Calls upon Member States to accelerate their efforts to close the digital divide and promote innovation among youth by ensuring that information and communications technologies are fully and appropriately integrated into education and training at all levels, including in the development of curricula, teacher training and institutional administration and management, and in support of the concept of lifelong learning;",
    "17": "Urges Member States to intensify efforts to address the high rates of youth unemployment, underemployment, vulnerable employment, informal employment and young people not in employment, education or training by developing and implementing targeted and integrated local and national youth employment policies for inclusive, sustainable and innovative job creation, improved employability, skills development and vocational training to facilitate the transition from school to work, and improving synergies between the education and employment sectors to increase the prospects for integrating youth into the sustainable labour market, and through increased innovation and entrepreneurship, including the development of networks of young entrepreneurs at the local, national, regional and global levels that foster knowledge among young people about their rights and responsibilities in society, and Policies and programmes involving youth A/RES/74/121 7/9 19-22041 encourages Member States to invest in quality education, support lifelong learning and provide social protection for all youth and to request donors, specialized United Nations entities and the private sector to continue to provide assistance to Member States, including technical and funding support, as appropriate;",
    "18": "Also urges Member States to address the challenges faced by girls and young women, as well as gender stereotypes that perpetuate all forms of discrimination and violence against girls and young women, including harmful practices, and the stereotypical roles of men and women that hinder social and personal development, by implementing the commitments to the empowerment of women and gender equality and the human rights of all women and girls, and to engage, educate, encourage and support men and boys to take responsibility for their behaviour in this regard, including their sexual and reproductive behaviour;",
    "19": "Further urges Member States to condemn violence against girls and young women, including sexual harassment, and reaffirms that they should not invoke any custom, tradition or religious consideration to avoid their obligations with respect to its elimination and should pursue, by all appropriate means and without delay, a policy of eliminating violence against women, as set out in the Declaration on the Elimination of Violence against Women;22",
    "20": "Urges Member States to mainstream a gender perspective into all development efforts, recognizing that the achievement of gender equality and the empowerment of all women and girls is critical for achieving sustainable development and for efforts to combat hunger, poverty and disease, and to strengthen policies and programmes that seek to improve, ensure and broaden the full, effective and structured participation of young women in all spheres of political, economic, social and cultural life as equal partners, and to improve their access to all resources needed for the full exercise of all of their human rights and fundamental freedoms by removing persistent barriers, including by providing access to quality education at all levels, ensuring equal access to full and productive employment and decent work and strengthening their economic independence;",
    "21": "Encourages Member States to take measures that minimize the negative effects of globalization and maximize its benefits, and emphasizes the importance of a fair globalization in offering relevant education and training for young people in order that they may reach their full personal development and that enable their access to decent jobs and better employment opportunities in order to meet the needs of changing labour markets and enable young migrants to enjoy their human rights;",
    "22": "Recognizes that the international community faces increasing challenges posed by climate change and the loss of biodiversity, which have increased vulnerabilities and inequalities with direct and indirect implications for the well- being of youth and which could make youth, particularly in developing countries and small island developing States, vulnerable to their adverse impacts, including through suffering disproportionately in labour markets in times of crisis created by climate change, calls for the enhanced cooperation of and concerted action by Member States with youth in order to address those challenges, taking into account the positive role that the education of youth can play in that respect, and encourages Member States to further promote youth participation in climate action and to consider youth perspectives in decision-making processes on climate change;",
    "23": "Also recognizes that the sharing of family responsibilities creates an enabling family environment for the empowerment of youth, which contributes to development, that youth make a significant contribution to the welfare of their __________________ 22 Resolution 48/104. A/RES/74/121 Policies and programmes involving youth 19-22041 8/9 families and that particular attention must be paid to solutions to youth unemployment in order to generate the human and social capital that is essential for social and economic development;",
    "24": "Further recognizes the importance of strengthening intergenerational partnerships and solidarity among generations, and in this regard recognizes the importance of opportunities for voluntary, constructive and regular interaction between young people and older generations in the family, the workplace and society at large;",
    "25": "Recognizes all recent efforts to promote the youth and peace and security agenda, and calls upon Member States and relevant United Nations organs and entities to consider ways to increase the meaningful and inclusive participation of youth in conflict prevention and resolution, peacebuilding, post-conflict processes and humanitarian action, as well as to take concrete measures to further assist youth in armed conflict situations, in accordance with the World Programme of Action for Youth, and to encourage the involvement of youth, where appropriate, in activities concerning the protection of children and youth affected by armed conflict situations, and recognizes the importance of protecting schools and universities from military use in contravention of international humanitarian law;",
    "26": "Urges Member States to take concerted action, in conformity with international law, to remove obstacles to the full realization of the rights of young people living under foreign occupation, colonial rule and in other areas of conflict or post-conflict situations in order to promote the achievement of the goals of the 2030 Agenda for Sustainable Development;",
    "27": "Also urges Member States to take effective measures, in conformity with international law, to protect young people, including youth in marginalized groups affected or exploited by terrorism;",
    "28": "Further urges Member States to address legal, administrative, social, economic, digital and cultural barriers that limit young people\u2019s participation and representation, while enabling the capacities, resources, information, technology, support, space and skills needed to empower the free, active, independent, full and effective participation of youth, including youth in vulnerable situations;",
    "29": "Calls upon Member States to develop or maintain, in this regard, preventive measures and remedies for violations and abuses regarding the right to privacy in the digital age that may affect all individuals, including young people, promote digital literacy and technical skills to effectively protect their privacy and take measures to prevent cyberstalking and cyberbullying;",
    "30": "Recognizes that the contributions of young people are important for the full and successful implementation of the 2030 Agenda for Sustainable Development, and urges Member States and United Nations entities, in consultation with youth and youth-led and youth-focused organizations, to explore and promote concrete new avenues for the full, effective, structured and sustainable participation of young people and youth-led organizations in relevant decision-making processes and monitoring, in all spheres of political, economic, social and cultural life, including in designing and implementing policies, programmes and initiatives, in particular, while implementing the 2030 Agenda;",
    "31": "Encourages Member States to include youth delegates in their delegations at all relevant discussions in the General Assembly and its subsidiary organs, the Economic and Social Council and its functional commissions and relevant United Nations conferences, as appropriate, bearing in mind the principles of gender balance Policies and programmes involving youth A/RES/74/121 9/9 19-22041 and non-discrimination, and emphasizes that such youth representatives should be selected through a transparent process that ensures that they have a suitable mandate to represent young people in their countries;",
    "32": "Calls upon the Department of Economic and Social Affairs of the Secretariat Programme on Youth to continue to act as the focal point within the United Nations system for promoting further collaboration and coordination on youth-related matters including, inter alia, with Governments on the United Nations Youth Delegate Programme;",
    "33": "Calls upon donors, including Member States and intergovernmental and non-governmental organizations, to actively contribute to the United Nations Youth Fund in order to facilitate the participation of youth representatives from developing countries in the activities of the United Nations, taking into account the need for greater geographical balance in terms of youth representation, as well as to accelerate the implementation of the World Programme of Action for Youth and to support the production of the World Youth Report, and in this regard requests the Secretary- General to take appropriate action to encourage contributions to the Fund;",
    "34": "Acknowledges the increased collaboration through the Inter-Agency Network on Youth Development in developing the United Nations System-wide Action Plan on Youth, requests United Nations entities, within existing resources, to continue their coordination towards a more coherent, comprehensive and integrated approach to youth development, calls upon United Nations entities and relevant partners to support national, regional and international efforts in addressing challenges hindering youth development, and in this regard encourages close collaboration with Member States as well as other relevant stakeholders, including civil society;",
    "35": "Recognizes the role of the Envoy of the Secretary-General on Youth and her task of bringing the voices of young people to the United Nations system in the areas of participation, advocacy, partnerships and harmonization identified in her workplan, and encourages the Envoy to continue to work closely with Governments, United Nations entities, civil society, youth organizations, academia and the media by empowering and strengthening the position of young people within and outside the United Nations system, including by conducting country visits, at the request of the Member States concerned, and calls upon Member States and United Nations entities to support, as appropriate, the Envoy in her efforts to advance the situation of youth globally;",
    "36": "Requests the Secretary-General to submit a report to the General Assembly at its seventy-sixth session on the implementation of the present resolution, including on progress that has been achieved and challenges that still remain, to be prepared in consultation with Member States as well as the relevant specialized agencies, funds, programmes and regional commissions, taking into account the work done by the United Nations system, and encourages the Secretariat to consult, as appropriate, with youth-led and youth-focused organizations. 50th plenary meeting 18 December 2019"
  },
  "agenda_items": [
    "Item 25"
  ],
  "symbol_references": []
}