{
  "symbol": "A/RES/72/118",
  "filename": "A_RES_72_118.pdf",
  "title": "72/118. Report of the Special Committee on the Charter of the United Nations and on the Strengthening of the Role of the Organization",
  "text": "United Nations \nA/RES/72/118\n \n \nGeneral Assembly \nDistr.: General \n18 December 2017 \n \n17-22159 (E)    201217 \n*1722159* \n \n \nSeventy-second session \nAgenda item 83 \n \n \n \n \n Resolution adopted by the General Assembly \non 7 December 2017 \n \n \n \n \n[on the report of the Sixth Committee (A/72/462)] \n \n \n \n72/118. Report of the Special Committee on the Charter of the United \nNations and on the Strengthening of the Role of the Organization  \n \n \n \nThe General Assembly,  \n \nRecalling its resolution 3499 (XXX) of 15 December 1975, by which it \nestablished the Special Committee on the Charter of the United Nations and on the \nStrengthening of the Role of the Organization, and its relevant resolutions adopted \nat subsequent sessions,  \n \nRecalling also its resolution 47/233 of 17 August 1993 on the revitalization of \nthe work of the General Assembly,  \n \nRecalling further its resolution 47/62 of 11 December 1992 on the question of \nequitable representation on and increase in the membership of the Security Council,  \n \nTaking note of the report of the Open-ended Working Group on the Question \nof Equitable Representation on and Increase in the Membership of the Security \nCouncil and Other Matters related to the Security Council,1  \n \nRecalling the elements relevant to the work of the Special Committee \ncontained in its resolution 47/120 B of 20 September 1993,  \n \nRecalling also its resolution 51/241 of 31 July 1997 on the strengthening of \nthe United Nations system and its resolution 51/242 of 15 September 1997, entitled \n\u201cSupplement to an Agenda for Peace\u201d, by which it adopted the texts on coordination \nand the question of sanctions imposed by the United Nations, which are annexed to \nthat resolution,  \n \nConcerned about the special economic problems confronting certain States \narising from the carrying-out of preventive or enforcement measures taken by the \nSecurity Council against other States, and taking into account the obligation of \n__________________ \n \n1  Official Records of the General Assembly, Sixty-third Session, Supplement No. 47 (A/63/47).  \n\nA/RES/72/118 \nReport of the Special Committee on the Charter of the United Nations\nand on the Strengthening of the Role of the Organization\n \n17-22159 \n2/5 \n \nMembers of the United Nations under Article 49 of the Charter to join in affording \nmutual assistance in carrying out the measures decided upon by the Council,  \n \nRecalling the right of third States confronted with special economic problems \nof that nature to consult the Security Council with regard to a solution of those \nproblems, in accordance with Article 50 of the Charter,  \n \nRecalling also that the International Court of Justice is the principal judicial \norgan of the United Nations, and reaffirming its authority and independence,  \n \nMindful of the adoption of the revised working papers on the working methods \nof the Special Committee,2  \n \nTaking note of the report of the Secretary-General entitled \u201cRepertory of \nPractice of United Nations Organs and Repertoire of the Practice of the Security \nCouncil\u201d,3  \n \nRecalling paragraphs 106 to 110, 176 and 177 of the 2005 World Summit \nOutcome,4  \n \nMindful of the decision of the Special Committee in which it expressed its \nreadiness to engage, as appropriate, in the implementation of any decisions that \nmight be taken at the high-level plenary meeting of the sixtieth session of the \nGeneral Assembly in September 2005 that concerned the Charter and any \namendments thereto,5  \n \nRecalling the provisions of its resolutions 50/51 of 11 December 1995, 51/208 \nof 17 December 1996, 52/162 of 15 December 1997, 53/107 of 8 December 1998, \n54/107 of 9 December 1999, 55/157 of 12 December 2000, 56/87 of 12 December \n2001, 57/25 of 19 November 2002, 58/80 of 9 December 2003 and 59/45 of \n2 December 2004,  \n \nRecalling also its resolution 64/115 of 16 December 2009 and the document \nentitled \u201cIntroduction and implementation of sanctions imposed by the United \nNations\u201d annexed thereto,  \n \nHaving considered the report of the Special Committee on the work of its \nsession held in 2017,6  \n \nNoting with appreciation the work done by the Special Committee to \nencourage States to focus on the need to prevent and to settle peacefully their \ndisputes which are likely to endanger the maintenance of international peace and \nsecurity,  \n \n1. \nTakes note of the report of the Special Committee on the Charter of the \nUnited Nations and on the Strengthening of the Role of the Organization; 6  \n \n2. \nDecides that the Special Committee shall hold its next session from 20 to \n28 February 2018;  \n \n3. \nRequests the Special Committee, at its session in 2018, in accordance \nwith paragraph 5 of General Assembly resolution 50/52 of 11 December 1995:  \n \n(a) \nTo continue its consideration of all proposals concerning the question of \nthe maintenance of international peace and security in all its aspects in order to \nstrengthen the role of the United Nations and, in this context, to consider other \n__________________ \n \n2  Ibid., Sixty-first Session, Supplement No. 33 (A/61/33), para. 72.  \n \n3  A/72/184.  \n \n4  Resolution 60/1.  \n \n5  Official Records of the General Assembly, Sixtieth Session, Supplement No. 33 (A/60/33), para. 77.  \n \n6  Ibid., Seventy-second Session, Supplement No. 33 (A/72/33).  \n\nReport of the Special Committee on the Charter of the United Nations \nand on the Strengthening of the Role of the Organization \nA/RES/72/118\n \n3/5 \n17-22159 \n \nproposals relating to the maintenance of international peace and security already \nsubmitted or which may be submitted to the Special Committee at its session in \n2018, including strengthening the relationship and cooperation between the United \nNations and regional organizations or arrangements in the peaceful settlement of \ndisputes;  \n \n(b) \nTo consider, in accordance with paragraph 2 of the annex to resolution \n71/146 of 13 December 2016, in an appropriate, substantive manner and framework, \nthe question of the implementation of the provisions of the Charter of the United \nNations relating to assistance to third States affected by the application of sanctions \n(Article 50 of the Charter) based on all of the related reports of the Secretary-\nGeneral7 and the proposals submitted on the question, and requests the Secretary-\nGeneral to submit his next report on this issue to the General Assembly at its \nseventy-fourth session;  \n \n(c) \nTo keep on its agenda the question of the peaceful settlement of disputes \nbetween States;  \n \n(d) \nTo consider, as appropriate, any proposal referred to it by the General \nAssembly in the implementation of the decisions of the high-level plenary meeting \nof the sixtieth session of the Assembly in September 2005 that concern the Charter \nand any amendments thereto;  \n \n(e) \nTo continue to consider, on a priority basis, ways and means of \nimproving its working methods and enhancing its efficiency and utilization of \nresources with a view to identifying widely acceptable measures for future \nimplementation;  \n \n4. \nRequests the Secretary-General, in accordance with paragraph 3 of the \nannex to resolution 71/146, to brief the Special Committee at its next session on the \ndocument entitled \u201cIntroduction and implementation of sanctions imposed by the \nUnited Nations\u201d contained in the annex to General Assembly resolution 64/115;  \n \n5. \nAlso requests the Secretary-General to brief the Special Committee at its \nnext session on the information referred to in paragraph 12 of his report on the \nimplementation of the provisions of the Charter related to assistance to third States \naffected by the application of sanctions;8  \n \n6. \nDecides to undertake an annual thematic debate in the Special \nCommittee, under the agenda item on the peaceful settlement of disputes, to discuss \nthe means for the settlement of disputes, in accordance with Chapter VI of the \nCharter, including in particular those contained in Article 33 thereof, and consistent \nwith the Manila Declaration on the Peaceful Settlement of International Disputes, 9 \nand in that regard:  \n \n(a) \nInvites Member States to focus their comments during the thematic \ndebate, to be held at the next session of the Special Committee, at the seventy-\nsecond session of the General Assembly, on the subtopic \u201cExchange of information \non State practices regarding the use of negotiation and enquiry\u201d, while ensuring that \nthe other means of dispute settlement will be discussed at the subsequent sessions of \nthe Special Committee;  \n__________________ \n \n7  A/48/573-S/26705, A/49/356, A/50/60-S/1995/1, A/50/361, A/50/423, A/51/317, A/52/308, \nA/53/312, A/54/383 and A/54/383/Add.1, A/55/295 and A/55/295/Add.1, A/56/303, A/57/165 \nand A/57/165/Add.1, A/58/346, A/59/334, A/60/320, A/61/304, A/62/206 and A/62/206/Corr.1, \nA/63/224, A/64/225, A/65/217, A/66/213, A/67/190, A/68/226, A/69/119, A/70/119, A/71/166 \nand A/72/136.  \n \n8  A/72/136.  \n \n9  Resolution 37/10, annex.  \n\nA/RES/72/118 \nReport of the Special Committee on the Charter of the United Nations\nand on the Strengthening of the Role of the Organization\n \n17-22159 \n4/5 \n \n \n(b) \nAlso invites Member States to comment on the subtopics of the annual \ndebate in their general statements with a view to having the texts of those \nstatements posted on the website of the Special Committee;  \n \n(c) \nCalls upon the Special Committee to include a summary of the subtopics \nof the annual debate in its annual report for further consideration;  \n \n7. \nRecalls its endorsement of the decisions and recommendations adopted \nby the Special Committee at its 2016 session, in particular as set forth in \nparagraphs 2 and 3 of the annex to resolution 71/146;  \n \n8. \nInvites the Special Committee, at its session in 2018, to continue to \nidentify new subjects for consideration in its future work with a view to contributing \nto the revitalization of the work of the United Nations;  \n \n9. \nNotes the readiness of the Special Committee to provide, within its \nmandate, such assistance as may be sought at the request of other subsidiary bodies \nof the General Assembly in relation to any issues before them;  \n \n10. Requests the Special Committee to submit a report on its work to the \nGeneral Assembly at its seventy-third session;  \n \n11. \nRecognizes the important role of the International Court of Justice, the \nprincipal judicial organ of the United Nations, in adjudicating disputes among States \nand the value of its work, as well as the importance of having recourse to the Court \nin the peaceful settlement of disputes, notes that, consistent with Article 96 of the \nCharter, the Court\u2019s advisory jurisdiction may be requested by the General \nAssembly, the Security Council or other authorized organs of the United Nations \nand the specialized agencies, and requests the Secretary-General to distribute, in due \ncourse, the advisory opinions requested by the principal organs of the United \nNations as official documents of the United Nations;  \n \n12. Commends the Secretary-General for the progress made in the \npreparation of studies for the Repertory of Practice of United Nations Organs, \nincluding the use of the internship programme of the United Nations and \ncooperation with academic institutions for this purpose, as well as the progress \nmade towards updating the Repertoire of the Practice of the Security Council;  \n \n13. Welcomes the invitation made to Member States to identify academic \ninstitutions that have the capacity to contribute to the preparation of studies for the \nRepertory and to provide contact details of such institutions;  \n \n14. Notes with appreciation the contributions made by Member States to the \ntrust fund for the elimination of the backlog in the Repertory, as well as to the trust \nfund for the updating of the Repertoire;  \n \n15. Reiterates its call for voluntary contributions to the trust fund for the \nelimination of the backlog in the Repertory so as to further support the Secretariat in \ncarrying out the effective elimination of that backlog; voluntary contributions to the \ntrust fund for the updating of the Repertoire; and the sponsoring, on a voluntary \nbasis and with no cost to the United Nations, of associate experts to assist in the \nupdating of the two publications;  \n \n16. Calls upon the Secretary-General to continue his efforts towards \nupdating the two publications and making them available electronically in all their \nrespective language versions, and encourages the continued updating of the website \nfor the Repertory;10  \n__________________ \n \n10  http://legal.un.org/repertory.  \n\nReport of the Special Committee on the Charter of the United Nations \nand on the Strengthening of the Role of the Organization \nA/RES/72/118\n \n5/5 \n17-22159 \n \n \n17. Notes with concern that the backlog in the preparation of volume III of \nthe Repertory, although slightly reduced, has not been eliminated, and calls upon \nthe Secretary-General to address that issue effectively and on a priority basis, while \ncommending the Secretary-General for progress made in reducing the backlog;  \n \n18. Reiterates the responsibility of the Secretary-General for the quality of \nthe Repertory and the Repertoire, and with regard to the Repertoire calls upon the \nSecretary-General to continue to follow the modalities outlined in paragraphs 102 to \n106 of his report dated 18 September 1952;11  \n \n19. Requests the Secretary-General to submit to the General Assembly at its \nseventy-third session a report on both the Repertory and the Repertoire;  \n \n20. Decides to include in the provisional agenda of its seventy-third session \nthe item entitled \u201cReport of the Special Committee on the Charter of the United \nNations and on the Strengthening of the Role of the Organization\u201d.  \n \n67th plenary meeting  \n7 December 2017 \n \n__________________ \n \n11  A/2170.  \n",
  "paragraphs": {
    "1": "Takes note of the report of the Special Committee on the Charter of the United Nations and on the Strengthening of the Role of the Organization; 6",
    "2": "Decides that the Special Committee shall hold its next session from 20 to 28 February 2018;",
    "3": "Requests the Special Committee, at its session in 2018, in accordance with paragraph 5 of General Assembly resolution 50/52 of 11 December 1995: (a) To continue its consideration of all proposals concerning the question of the maintenance of international peace and security in all its aspects in order to strengthen the role of the United Nations and, in this context, to consider other proposals relating to the maintenance of international peace and security already submitted or which may be submitted to the Special Committee at its session in 2018, including strengthening the relationship and cooperation between the United Nations and regional organizations or arrangements in the peaceful settlement of disputes; (b) To consider, in accordance with paragraph 2 of the annex to resolution 71/146 of 13 December 2016, in an appropriate, substantive manner and framework, the question of the implementation of the provisions of the Charter of the United Nations relating to assistance to third States affected by the application of sanctions (Article 50 of the Charter) based on all of the related reports of the Secretary- General7 and the proposals submitted on the question, and requests the Secretary- General to submit his next report on this issue to the General Assembly at its seventy-fourth session; (c) To keep on its agenda the question of the peaceful settlement of disputes between States; (d) To consider, as appropriate, any proposal referred to it by the General Assembly in the implementation of the decisions of the high-level plenary meeting of the sixtieth session of the Assembly in September 2005 that concern the Charter and any amendments thereto; (e) To continue to consider, on a priority basis, ways and means of improving its working methods and enhancing its efficiency and utilization of resources with a view to identifying widely acceptable measures for future implementation;",
    "4": "Requests the Secretary-General, in accordance with paragraph 3 of the annex to resolution 71/146, to brief the Special Committee at its next session on the document entitled \u201cIntroduction and implementation of sanctions imposed by the United Nations\u201d contained in the annex to General Assembly resolution 64/115;",
    "5": "Also requests the Secretary-General to brief the Special Committee at its next session on the information referred to in paragraph 12 of his report on the implementation of the provisions of the Charter related to assistance to third States affected by the application of sanctions;8",
    "6": "Decides to undertake an annual thematic debate in the Special Committee, under the agenda item on the peaceful settlement of disputes, to discuss the means for the settlement of disputes, in accordance with Chapter VI of the Charter, including in particular those contained in Article 33 thereof, and consistent with the Manila Declaration on the Peaceful Settlement of International Disputes, 9 and in that regard: (a) Invites Member States to focus their comments during the thematic debate, to be held at the next session of the Special Committee, at the seventy- second session of the General Assembly, on the subtopic \u201cExchange of information on State practices regarding the use of negotiation and enquiry\u201d, while ensuring that the other means of dispute settlement will be discussed at the subsequent sessions of the Special Committee; (b) Also invites Member States to comment on the subtopics of the annual debate in their general statements with a view to having the texts of those statements posted on the website of the Special Committee; (c) Calls upon the Special Committee to include a summary of the subtopics of the annual debate in its annual report for further consideration;",
    "7": "Recalls its endorsement of the decisions and recommendations adopted by the Special Committee at its 2016 session, in particular as set forth in paragraphs 2 and 3 of the annex to resolution 71/146;",
    "8": "Invites the Special Committee, at its session in 2018, to continue to identify new subjects for consideration in its future work with a view to contributing to the revitalization of the work of the United Nations;",
    "9": "Notes the readiness of the Special Committee to provide, within its mandate, such assistance as may be sought at the request of other subsidiary bodies of the General Assembly in relation to any issues before them;",
    "10": "Requests the Special Committee to submit a report on its work to the General Assembly at its seventy-third session;",
    "11": "Recognizes the important role of the International Court of Justice, the principal judicial organ of the United Nations, in adjudicating disputes among States and the value of its work, as well as the importance of having recourse to the Court in the peaceful settlement of disputes, notes that, consistent with Article 96 of the Charter, the Court\u2019s advisory jurisdiction may be requested by the General Assembly, the Security Council or other authorized organs of the United Nations and the specialized agencies, and requests the Secretary-General to distribute, in due course, the advisory opinions requested by the principal organs of the United Nations as official documents of the United Nations;",
    "12": "Commends the Secretary-General for the progress made in the preparation of studies for the Repertory of Practice of United Nations Organs, including the use of the internship programme of the United Nations and cooperation with academic institutions for this purpose, as well as the progress made towards updating the Repertoire of the Practice of the Security Council;",
    "13": "Welcomes the invitation made to Member States to identify academic institutions that have the capacity to contribute to the preparation of studies for the Repertory and to provide contact details of such institutions;",
    "14": "Notes with appreciation the contributions made by Member States to the trust fund for the elimination of the backlog in the Repertory, as well as to the trust fund for the updating of the Repertoire;",
    "15": "Reiterates its call for voluntary contributions to the trust fund for the elimination of the backlog in the Repertory so as to further support the Secretariat in carrying out the effective elimination of that backlog; voluntary contributions to the trust fund for the updating of the Repertoire; and the sponsoring, on a voluntary basis and with no cost to the United Nations, of associate experts to assist in the updating of the two publications;",
    "16": "Calls upon the Secretary-General to continue his efforts towards updating the two publications and making them available electronically in all their respective language versions, and encourages the continued updating of the website for the Repertory;10",
    "17": "Notes with concern that the backlog in the preparation of volume III of the Repertory, although slightly reduced, has not been eliminated, and calls upon the Secretary-General to address that issue effectively and on a priority basis, while commending the Secretary-General for progress made in reducing the backlog;",
    "18": "Reiterates the responsibility of the Secretary-General for the quality of the Repertory and the Repertoire, and with regard to the Repertoire calls upon the Secretary-General to continue to follow the modalities outlined in paragraphs 102 to 106 of his report dated 18 September 1952;11",
    "19": "Requests the Secretary-General to submit to the General Assembly at its seventy-third session a report on both the Repertory and the Repertoire;",
    "20": "Decides to include in the provisional agenda of its seventy-third session the item entitled \u201cReport of the Special Committee on the Charter of the United Nations and on the Strengthening of the Role of the Organization\u201d."
  },
  "agenda_items": [
    "Item 83"
  ],
  "symbol_references": []
}