{
  "symbol": "A/RES/73/318",
  "filename": "A_RES_73_318.pdf",
  "title": "73/318. Financing of the United Nations Interim Administration Mission in Kosovo",
  "text": "United Nations \nA/RES/73/318 \n \n \nGeneral Assembly \nDistr.: General \n17 July 2019 \n \n19-11314 (E)    190719 \n*1911314* \n \n \nSeventy-third session \nAgenda item 159 \n \n \n \n \n Resolution adopted by the General Assembly on 3 July 2019 \n \n \n \n \n[on the report of the Fifth Committee (A/73/934)] \n \n \n 73/318. Financing of the United Nations Interim Administration Mission \nin Kosovo \n \n \n \nThe General Assembly, \n \nHaving considered the reports of the Secretary-General on the financing of the \nUnited Nations Interim Administration Mission in Kosovo1 and the related report of \nthe Advisory Committee on Administrative and Budgetary Questions,2 \n \nRecalling Security Council resolution 1244 (1999) of 10 June 1999 regarding \nthe establishment of the United Nations Interim Administration Mission in Kosovo, \n \nRecalling also its resolution 53/241 of 28 July 1999 on the financing of the \nMission and its subsequent resolutions thereon, the latest of which was resolution \n72/295 of 5 July 2018, as well as its decision 72/558 of 5 July 2018, \n \nAcknowledging the complexity of the Mission, \n \nReaffirming the general principles underlying the financing of United Nations \npeacekeeping operations, as stated in its resolutions 1874 (S-IV) of 27 June 1963, \n3101 (XXVIII) of 11 December 1973 and 55/235 of 23 December 2000, \n \nMindful of the fact that it is essential to provide the Mission with the financial \nresources necessary to enable it to fulfil its responsibilities under the relevant \nresolutions of the Security Council, \n \nMindful also of the need to ensure coordination and cooperation with the \nEuropean Union Rule of Law Mission in Kosovo, \n \n1. \nRequests the Secretary-General to entrust the Head of Mission with the \ntask of formulating future budget proposals in full accordance with the provisions of \nits resolutions 59/296 of 22 June 2005, 60/266 of 30 June 2006, 61/276 of 29 June \n__________________ \n \n1 A/73/613 and A/73/733. \n \n2 A/73/755/Add.4. \n\nA/RES/73/318 \n \n19-11314\n2/4 \n \n2007, 64/269 of 24 June 2010, 65/289 of 30 June 2011, 66/264 of 21 June 2012, \n69/307 of 25 June 2015 and 70/286 of 17 June 2016, as well as other relevant \nresolutions; \n \n2. \nTakes note of the status of contributions to the United Nations Interim \nAdministration Mission in Kosovo as at 30 April 2019, including the contributions \noutstanding in the amount of 35.8 million United States dollars, representing some \n1 per cent of the total assessed contributions, notes with concern that only 77 Member \nStates have paid their assessed contributions in full, and urges all other Member \nStates, in particular those in arrears, to ensure payment of their outstanding assessed \ncontributions; \n \n3. \nExpresses its appreciation to those Member States that have paid their \nassessed contributions in full, and urges all other Member States to make every \npossible effort to ensure payment of their assessed contributions to the Mission in full; \n \n4. \nExpresses concern at the financial situation with regard to peacekeeping \nactivities, in particular as regards the reimbursements to troop contributors that bear \nadditional burdens owing to overdue payments by Member States of their \nassessments; \n \n5. \nEmphasizes that all future and existing peacekeeping missions shall be \ngiven equal and non-discriminatory treatment in respect of financial and \nadministrative arrangements; \n \n6. \nAlso emphasizes that all peacekeeping missions shall be provided with \nadequate resources for the effective and efficient discharge of their respective \nmandates; \n \n7. \nRequests the Secretary-General to ensure that proposed peacekeeping \nbudgets are based on the relevant legislative mandates; \n \n8. \nEndorses the conclusions and recommendations contained in the report of \nthe Advisory Committee on Administrative and Budgetary Questions,2 subject to the \nprovisions of the present resolution, and requests the Secretary-General to ensure \ntheir full implementation; \n \n9. \nTakes note of paragraph 24 of the report of the Advisory Committee, and \ndecides not to abolish the D-1 Chief Legal Officer post in the Office of Legal Affairs; \n \n10. Emphasizes the importance of overall budgetary performance in \npeacekeeping operations, and requests the Secretary-General to continue to \nimplement the recommendations of the relevant oversight bodies and to report thereon \nin the context of the performance reports; \n \n11. Also emphasizes the importance of the accountability system of the \nSecretariat, and requests the Secretary-General to continue to strengthen risk \nmanagement and internal controls in the management of peacekeeping budgets and to \nreport thereon in the context of his next report; \n \n12. Requests the Secretary-General to ensure the full implementation of the \nrelevant provisions of its resolutions 59/296, 60/266, 61/276, 64/269, 65/289, 66/264, \n69/307 and 70/286; \n \n13. Also requests the Secretary-General to take all action necessary to ensure \nthat the Mission is administered with a maximum of efficiency and economy; \n \n\nA/RES/73/318\n \n3/4\n19-11314 \n \n \n \nBudget performance report for the period from 1 July 2017 to 30 June 2018 \n \n \n14. Takes note of the report of the Secretary-General on the budget \nperformance of the Mission for the period from 1 July 2017 to 30 June 2018; 3 \n \n \n \nBudget estimates for the period from 1 July 2019 to 30 June 2020 \n \n \n15. Decides to appropriate to the Special Account for the United Nations \nInterim Administration Mission in Kosovo the amount of 39,732,300 dollars for the \nperiod from 1 July 2019 to 30 June 2020, inclusive of 37,246,700 dollars for the \nmaintenance of the Mission, 2,109,700 dollars for the support account for \npeacekeeping operations and 375,900 dollars for the United Nations Logistics Base \nat Brindisi, Italy; \n \n \n \nFinancing of the appropriation \n \n \n16. Decides to apportion among Member States the amount of 39,732,300 \ndollars for the period from 1 July 2019 to 30 June 2020, in accordance with the levels \nupdated in its resolution 73/272 of 22 December 2018, taking into account the scale \nof assessments for 2019 and 2020, as set out in its resolution 73/271 of \n22 December 2018; \n \n17. Also decides that, in accordance with the provisions of its resolution \n973 (X) of 15 December 1955, there shall be set off against the apportionment among \nMember States, as provided for in paragraph 16 above, their respective share in the \nTax Equalization Fund of 3,981,900 dollars, comprising the estimated staff \nassessment income of 3,792,000 dollars approved for the Mission, the prorated share \nof 150,200 dollars of the estimated staff assessment income approved for the support \naccount and the prorated share of 39,700 dollars of the estimated staff assessment \nincome approved for the United Nations Logistics Base; \n \n18. Further decides that, for Member States that have fulfilled their financial \nobligations to the Mission, there shall be set off against the apportionment, as \nprovided for in paragraph 16 above, their respective share of the unencumbered \nbalance and other revenue in the amount of 1,500,500 dollars in respect of the \nfinancial period ended 30 June 2018, in accordance with the levels updated in its \nresolution 70/246 of 23 December 2015, taking into account the scale of assessments \nfor 2018, as set out in its resolution 70/245 of 23 December 2015; \n \n19. Decides that, for Member States that have not fulfilled their financial \nobligations to the Mission, there shall be set off against their outstanding obligations \ntheir respective share of the unencumbered balance and other revenue in the amount \nof 1,500,500 dollars in respect of the financial period ended 30 June 2018, in \naccordance with the scheme set out in paragraph 18 above; \n \n20. Also decides that the increase of 112,400 dollars in the estimated staff \nassessment income in respect of the financial period ended 30 June 2018 shall be \nadded to the credits in the amount of 1,500,500 dollars referred to in paragraphs 18 \nand 19 above; \n \n21. Encourages the Secretary-General to continue to take additional measures \nto ensure the safety and security of all personnel participating in the Mission under \nthe auspices of the United Nations, bearing in mind paragraphs 5 and 6 of Security \nCouncil resolution 1502 (2003) of 26 August 2003; \n__________________ \n \n3 A/73/613. \n\nA/RES/73/318 \n \n19-11314\n4/4 \n \n \n22. Invites voluntary contributions to the Mission in cash and in the form of \nservices and supplies acceptable to the Secretary-General, to be administered, as \nappropriate, in accordance with the procedure and practices established by the \nGeneral Assembly; \n \n23. Decides to include in the provisional agenda of its seventy-fourth session \nthe item entitled \u201cFinancing of the United Nations Interim Administration Mission in \nKosovo\u201d. \n \n97th plenary meeting \n3 July 2019 \n \n \n",
  "paragraphs": {
    "1": "Requests the Secretary-General to entrust the Head of Mission with the task of formulating future budget proposals in full accordance with the provisions of its resolutions 59/296 of 22 June 2005, 60/266 of 30 June 2006, 61/276 of 29 June 2007, 64/269 of 24 June 2010, 65/289 of 30 June 2011, 66/264 of 21 June 2012, 69/307 of 25 June 2015 and 70/286 of 17 June 2016, as well as other relevant resolutions;",
    "2": "Takes note of the status of contributions to the United Nations Interim Administration Mission in Kosovo as at 30 April 2019, including the contributions outstanding in the amount of 35.8 million United States dollars, representing some 1 per cent of the total assessed contributions, notes with concern that only 77 Member States have paid their assessed contributions in full, and urges all other Member States, in particular those in arrears, to ensure payment of their outstanding assessed contributions;",
    "3": "Expresses its appreciation to those Member States that have paid their assessed contributions in full, and urges all other Member States to make every possible effort to ensure payment of their assessed contributions to the Mission in full;",
    "4": "Expresses concern at the financial situation with regard to peacekeeping activities, in particular as regards the reimbursements to troop contributors that bear additional burdens owing to overdue payments by Member States of their assessments;",
    "5": "Emphasizes that all future and existing peacekeeping missions shall be given equal and non-discriminatory treatment in respect of financial and administrative arrangements;",
    "6": "Also emphasizes that all peacekeeping missions shall be provided with adequate resources for the effective and efficient discharge of their respective mandates;",
    "7": "Requests the Secretary-General to ensure that proposed peacekeeping budgets are based on the relevant legislative mandates;",
    "8": "Endorses the conclusions and recommendations contained in the report of the Advisory Committee on Administrative and Budgetary Questions,2 subject to the provisions of the present resolution, and requests the Secretary-General to ensure their full implementation;",
    "9": "Takes note of paragraph 24 of the report of the Advisory Committee, and decides not to abolish the D-1 Chief Legal Officer post in the Office of Legal Affairs;",
    "10": "Emphasizes the importance of overall budgetary performance in peacekeeping operations, and requests the Secretary-General to continue to implement the recommendations of the relevant oversight bodies and to report thereon in the context of the performance reports;",
    "11": "Also emphasizes the importance of the accountability system of the Secretariat, and requests the Secretary-General to continue to strengthen risk management and internal controls in the management of peacekeeping budgets and to report thereon in the context of his next report;",
    "12": "Requests the Secretary-General to ensure the full implementation of the relevant provisions of its resolutions 59/296, 60/266, 61/276, 64/269, 65/289, 66/264, 69/307 and 70/286;",
    "13": " Budget performance report for the period from 1 July 2017 to 30 June 2018",
    "14": "Takes note of the report of the Secretary-General on the budget performance of the Mission for the period from 1 July 2017 to 30 June 2018; 3 Budget estimates for the period from 1 July 2019 to 30 June 2020",
    "15": "Decides to appropriate to the Special Account for the United Nations Interim Administration Mission in Kosovo the amount of 39,732,300 dollars for the period from 1 July 2019 to 30 June 2020, inclusive of 37,246,700 dollars for the maintenance of the Mission, 2,109,700 dollars for the support account for peacekeeping operations and 375,900 dollars for the United Nations Logistics Base at Brindisi, Italy; Financing of the appropriation",
    "16": "Decides to apportion among Member States the amount of 39,732,300 dollars for the period from 1 July 2019 to 30 June 2020, in accordance with the levels updated in its resolution 73/272 of 22 December 2018, taking into account the scale of assessments for 2019 and 2020, as set out in its resolution 73/271 of 22 December 2018;",
    "17": "Also decides that, in accordance with the provisions of its resolution 973 (X) of 15 December 1955, there shall be set off against the apportionment among Member States, as provided for in paragraph 16 above, their respective share in the Tax Equalization Fund of 3,981,900 dollars, comprising the estimated staff assessment income of 3,792,000 dollars approved for the Mission, the prorated share of 150,200 dollars of the estimated staff assessment income approved for the support account and the prorated share of 39,700 dollars of the estimated staff assessment income approved for the United Nations Logistics Base;",
    "18": "Further decides that, for Member States that have fulfilled their financial obligations to the Mission, there shall be set off against the apportionment, as provided for in paragraph 16 above, their respective share of the unencumbered balance and other revenue in the amount of 1,500,500 dollars in respect of the financial period ended 30 June 2018, in accordance with the levels updated in its resolution 70/246 of 23 December 2015, taking into account the scale of assessments for 2018, as set out in its resolution 70/245 of 23 December 2015;",
    "19": "Decides that, for Member States that have not fulfilled their financial obligations to the Mission, there shall be set off against their outstanding obligations their respective share of the unencumbered balance and other revenue in the amount of 1,500,500 dollars in respect of the financial period ended 30 June 2018, in accordance with the scheme set out in paragraph 18 above;",
    "20": "Also decides that the increase of 112,400 dollars in the estimated staff assessment income in respect of the financial period ended 30 June 2018 shall be added to the credits in the amount of 1,500,500 dollars referred to in paragraphs 18 and 19 above;",
    "21": "Encourages the Secretary-General to continue to take additional measures to ensure the safety and security of all personnel participating in the Mission under the auspices of the United Nations, bearing in mind paragraphs 5 and 6 of Security Council resolution 1502 (2003) of 26 August 2003;",
    "22": "Invites voluntary contributions to the Mission in cash and in the form of services and supplies acceptable to the Secretary-General, to be administered, as appropriate, in accordance with the procedure and practices established by the General Assembly;",
    "23": "Decides to include in the provisional agenda of its seventy-fourth session the item entitled \u201cFinancing of the United Nations Interim Administration Mission in Kosovo\u201d."
  },
  "agenda_items": [
    "Item 159"
  ],
  "symbol_references": []
}