{
  "symbol": "A/RES/73/214",
  "filename": "A_RES_73_214.pdf",
  "title": "73/214.  Observer status for the International Council for the Exploration of the Sea in the General Assembly",
  "text": "United Nations \nA/RES/73/214\n \n \nGeneral Assembly \nDistr.: General \n11 January 2019 \n \n18-22533 (E)    150119     \n*1822533* \n \n \nSeventy-third session \nAgenda item 175 \n \n \n \n \n Resolution adopted by the General Assembly \non 20 December 2018 \n \n \n \n \n[on the report of the Sixth Committee (A/73/465)] \n \n \n 73/214.  Observer status for the International Council for the Exploration \nof the Sea in the General Assembly  \n \n \n \nThe General Assembly,  \n \nWishing to promote cooperation between the United Nations and the \nInternational Council for the Exploration of the Sea,  \n \n1. \nDecides to invite the International Council for the Exploration of the Sea \nto participate in the sessions and the work of the General Assembly in the capacity of \nobserver;  \n \n2. \nRequests the Secretary-General to take the action necessary to implement \nthe present resolution.  \n \n62nd plenary meeting  \n20 December 2018 \n \n",
  "paragraphs": {
    "1": "Decides to invite the International Council for the Exploration of the Sea to participate in the sessions and the work of the General Assembly in the capacity of observer;",
    "2": "Requests the Secretary-General to take the action necessary to implement the present resolution."
  },
  "agenda_items": [
    "Item 175"
  ],
  "symbol_references": []
}