{
  "symbol": "A/RES/76/13",
  "filename": "A_RES_76_13.pdf",
  "title": "76/13. Building a peaceful and better world through sport and the Olympic ideal",
  "text": "United Nations \nA/RES/76/13\n \n \nGeneral Assembly \nDistr.: General \n6 December 2021 \n \n21-17889 (E)    091221     \n*2117889* \n \n \nSeventy-sixth session \nAgenda item 12 \nSport for development and peace: building a peaceful and \nbetter world through sport and the Olympic ideal \n \n \n \n \n Resolution adopted by the General Assembly \non 2 December 2021 \n \n \n \n \n[without reference to a Main Committee (A/76/L.13 and A/76/L.13/Add.1)] \n \n \n \n76/13. Building a peaceful and better world through sport and the \nOlympic ideal \n \n \n \nThe General Assembly, \n \nRecalling its resolution 74/16 of 9 December 2019, in which it decided to \ninclude in the provisional agenda of its seventy-sixth session the sub-item entitled \n\u201cBuilding a peaceful and better world through sport and the Olympic ideal\u201d, and \nrecalling also its prior decision to consider the sub-item every two years, in advance \nof the Summer and Winter Olympic Games,  \n \nRecalling also its resolution 48/11 of 25 October 1993, which, inter alia, revived \nthe ancient Greek tradition of ekecheiria (\u201cOlympic Truce\u201d) calling for a truce during \nthe Olympic Games to encourage a peaceful environment and ensure safe passage, \naccess and participation for athletes and relevant persons at the Games, thereby \nmobilizing the youth of the world to the cause of peace,  \n \nRecalling further that the core concept of ekecheiria, historically, has been the \ncessation of hostilities from seven days before until seven days after the Olympic \nGames, which, according to the legendary oracle of Delphi, was to replace the cycle \nof conflict with a friendly athletic competition every four years,  \n \nRecognizing the valuable contribution of sport in promoting education, \nsustainable development, peace, cooperation, solidarity, fairness, social inclusion and \nhealth at the local, regional and international levels, and noting that, as declared in \nthe 2005 World Summit Outcome, 1  sports can contribute to an atmosphere of \ntolerance and understanding among peoples and nations,  \n__________________ \n \n1  Resolution 60/1. \n\nA/RES/76/13 \nBuilding a peaceful and better world through sport and the \nOlympic ideal \n \n21-17889\n2/5 \n \n \nRecognizing also the role that sports can play to prevent and counter terrorism \nand violent extremism as and when conducive to terrorism, and its contributions to \nbuilding resilience against radicalization to violence and terrorist recruitment,  \n \nWelcoming the designation of 6 April as the International Day of Sport for \nDevelopment and Peace,  \n \nRecalling the inclusion in the United Nations Millennium Declaration 2 of an \nappeal for the observance of the Olympic Truce now and in the future and for support \nfor the International Olympic Committee in its efforts to promote peace and human \nunderstanding through sport and the Olympic ideal,  \n \nRecalling also that, in the 2030 Agenda for Sustainable Development, 3 sport is \nrecognized as an important enabler of sustainable development, in particular for its \ngrowing contribution to the realization of development and peace in its promotion of \ntolerance and respect and the contributions it makes to the empowerment of women \nand of young people, individuals and communities as well as to health, education and \nsocial inclusion objectives,  \n \nAcknowledging the valuable contribution that the appeal launched by the \nInternational Olympic Committee on 21 July 1992 for an Olympic Truce could make \ntowards advancing the purposes and principles of the Charter of the United Nations,  \n \nRecalling its resolution 75/18 of 1 December 2020 on sport as an enabler of \nsustainable development, in which it called upon future hosts of the Olympic Games \nand the Paralympic Games and other Member States to include sport, as appropriate, \nin conflict prevention activities and to ensure the effective implementation of the \nOlympic Truce during the Games,  \n \nNoting that the XXIV Olympic Winter Games will be held from 4 to 20 February \n2022 and that the XIII Paralympic Winter Games will be held from 4 to 13 March \n2022, in Beijing,  \n \nNoting also that the vision of the Olympic Winter Games Beijing 2022, \u201cJoyful \nrendezvous upon pure ice and snow uniting the passion of hundreds of millions for \nwinter sports\u201d, is to inspire youth with the Olympic spirit, encourage millions to \nembrace winter sports, promote social progress and create a harmonious, peaceful and \nbetter world,  \n \nExpressing the expectation that the Olympic Winter Games Beijing 2022 will \nbe a meaningful opportunity to harness the power of sport to advance the world by \nfostering an atmosphere of peace, development, resilience, tolerance and \nunderstanding, and welcoming all the delegations of National Olympic and \nParalympic Committees to participate in the Games,  \n \nRecalling that Beijing 2022 is the third of three consecutive Olympic and \nParalympic Games to be held in Asia, following Pyeongchang 2018 and Tokyo 2020, \nthereby enhancing trilateral partnership in sports and beyond,  \n \nRecognizing that Beijing 2022 aims to ensure the delivery of Olympic Games \nthat are green, inclusive, open and clean, thereby contributing to the achievement of \nthe United Nations Sustainable Development Goals,  \n \nRecognizing also the imperative need to engage women and girls in the practice \nof sport for development and peace, and welcoming activities that aim to foster and \nencourage initiatives in this regard at the global level,  \n__________________ \n \n2  Resolution 55/2. \n \n3  Resolution 70/1. \n\nBuilding a peaceful and better world through sport and the \nOlympic ideal \nA/RES/76/13\n \n3/5\n21-17889 \n \n \nRecalling article 31 of the Convention on the Rights of the Child, 4 which \noutlines the right of the child to engage in play and recreational activities, and the \noutcome document of the twenty-seventh special session of the General Assembly on \nchildren, entitled \u201cA world fit for children\u201d, 5  which stresses the promotion of \nphysical, mental and emotional health through play and sports,  \n \nWelcoming the significant impetus that the Olympic Games, the Paralympic \nGames and the Youth Olympic Games give to the volunteer movement around the \nworld, acknowledging the contributions of volunteers to the success of the Games, \nand in this regard calling upon host countries to promote social inclusion without \ndiscrimination of any kind,  \n \nNoting the successful conclusion of the XXXII Olympiad and the XVI Paralympic \nGames, held in Tokyo from 23 July to 8 August and from 24 August and 5 September \n2021, respectively, and welcoming the Games of the XXXIII Olympiad and the \nXVII Paralympic Games, to be held in Paris from 26 July to 11 August and from \n28 August to 8 September 2024, respectively, and the XXV Olympic Winter Games \nand the XIV Paralympic Winter Games, to be held in Milano Cortina, Italy, from 6 to \n22 February and from 6 to 15 March 2026, respectively,  \n \nAcknowledging the joint endeavours of the International Olympic Committee, \nthe International Paralympic Committee and relevant United Nations entities in such \nfields as the promotion of human rights, human development, poverty alleviation, \nhumanitarian assistance, health promotion, HIV and AIDS prevention, child and \nyouth education, gender equality, peacebuilding and sustainable development,  \n \nAcknowledging also the importance of the Youth Olympic Games in inspiring \nyouth through integrated sports and cultural and educational experiences, noting in \nthis regard the successful conclusion of the third Youth Olympic Winter Games, held \nin Lausanne, Switzerland, from 9 to 22 January 2020, and welcoming the fourth \nWinter Youth Olympic Games, to be held in Gangwon, Republic of Korea, in 2024 \nand the Summer Youth Olympic Games to be held in Dakar in 2026,  \n \nRecognizing the role that the Paralympic Movement plays in showcasing the \nachievements of athletes with disabilities to a global audience and in acting as a \nprimary vehicle to promote positive perceptions and greater inclusion of persons with \ndisabilities in sport and society,  \n \nRecognizing also the important role of supporters working alongside persons \nwith disabilities to organize and develop disability-specific sports,  \n \nRecognizing further that the active involvement of persons with disabilities in \nsports and the Paralympic Games contributes to the full and equal realization of their \nhuman rights, as well as respect for their inherent dignity, recalling articles 1 and 30 \nof the Convention on the Rights of Persons with Disabilities, 6 in which States parties \nrecognized the right of persons with disabilities, including those with long-term \nphysical, mental, intellectual or sensory impairments, to take part on an equal basis \nwith others in cultural life, with a view to enabling persons with disabilities to \nparticipate on an equal basis with others in recreational, leisure and sporting \nactivities, and noting in this regard the need for appropriate instruction, training and \nresources alongside accessibility of venues, and welcoming plans to stage integrated \nand inclusive Games,  \n \nWelcoming the commitment made by various States Members of the United \nNations and other relevant stakeholders to developing national and international \n__________________ \n \n4  United Nations, Treaty Series, vol. 1577, No. 27531. \n \n5  Resolution S-27/2, annex. \n \n6  United Nations, Treaty Series, vol. 2515, No. 44910. \n\nA/RES/76/13 \nBuilding a peaceful and better world through sport and the \nOlympic ideal \n \n21-17889\n4/5 \n \nprogrammes that promote peace and conflict resolution, the Olympic and Paralympic \nvalues and the Olympic Truce ideals through sport and through culture, education, \nsustainable development and wider public engagement, and acknowledging the \ncontribution of former hosts of the Olympic and Paralympic Games in this regard,  \n \nRecognizing the humanitarian opportunities presented by the Olympic Truce and \nby other initiatives supported by the United Nations to achieve the cessation of \nconflict,  \n \nRecalling that, in its resolution 75/18, it supported the independence and \nautonomy of sport as well as the mission of the International Olympic Committee in \nleading the Olympic Movement and of the International Paralympic Committee in \nleading the Paralympic Movement, and recognized the unifying and conciliative \nnature of Olympic Games and major international sport events and that such events \nare organized in the spirit of peace, mutual understanding, friendship, tolerance and \ninadmissibility of discrimination of any kind,  \n \nRecognizing the role of sport as a tool in building global resilience to address \nthe coronavirus disease (COVID-19) impacts and the need to include sport and \nphysical activity in recovery plans at the national level,  \n \nRecognizing also that the COVID-19 pandemic has significantly affected all \naspects of life, including professional, amateur and grass-roots sports, as well as the \nmanagement of sporting events and mass gatherings, and that the Olympic and \nParalympic Winter Games Beijing 2022 will therefore be an opportunity to show the \nvalue of unity, resilience and international cooperation in overcoming the pandemic, \n \nAcknowledging the fundamental principles of the Olympic Charter, including \nprinciple 6, which states that the enjoyment of the rights and freedoms set forth in the \nOlympic Charter shall be secured for all, without discrimination of any kind,  \n \nNoting with satisfaction that the United Nations flag will be flown at the \nOlympic stadium and in the Olympic and Paralympic villages of the XXIV Olympic \nWinter Games and the XIII Paralympic Winter Games,  \n \n1. \nUrges Member States to observe the Olympic Truce individually and \ncollectively, within the framework of the Charter of the United Nations, throughout \nthe period from the seventh day before the start of the XXIV Olympic Winter Games \nuntil the seventh day following the end of the XIII Paralympic Winter Games, to be \nheld in Beijing in 2022, in particular, to ensure the safe passage, access and \nparticipation of athletes, officials and all other accredited persons taking part in the \nOlympic Winter Games and the Paralympic Winter Games, and to contribute through \nother appropriate measures to the safe organization of the Games;  \n \n2. \nUnderlines the importance of cooperation among Member States to \ncollectively implement the values of the Olympic Truce around the world, and \nemphasizes the important role of the International Olympic Committee, the \nInternational Paralympic Committee and the United Nations in this regard;  \n \n3. \nWelcomes the work of the International Olympic Committee and the \nInternational Paralympic Committee, as well as the International Olympic Truce \nCentre, in mobilizing national and international sports federations and organizations, \nNational Olympic and Paralympic Committees and associations of these \norganizations to take concrete actions at the local, national, regional and international \nlevels to promote and strengthen a culture of peace based on the spirit of the Olympic \nTruce, and invites those organizations and national committees to cooperate and share \ninformation and best practices, as appropriate;  \n \n4. \nAlso welcomes the leadership of Olympic and Paralympic athletes in \npromoting peace and human understanding through sport and the Olympic ideal;  \n\nBuilding a peaceful and better world through sport and the \nOlympic ideal \nA/RES/76/13\n \n5/5\n21-17889 \n \n \n5. \nCalls upon all Member States to cooperate with the International Olympic \nCommittee and the International Paralympic Committee in their efforts to use sport \nas a tool to promote peace, dialogue and reconciliation in areas of conflict during and \nbeyond the period of the Olympic and Paralympic Games;  \n \n6. \nRecognizes that sport and the Olympic and Paralympic Games can be used \nto promote human rights and strengthen universal respect for such rights, thus \ncontributing to their full realization;  \n \n7. \nWelcomes the cooperation among Member States, the United Nations and \nthe specialized agencies, funds and programmes, and the International Olympic \nCommittee and the International Paralympic Committee, to maximize the potential of \nsport to make a meaningful and sustainable contribution to the achievement of the \nSustainable Development Goals within the 2030 Agenda for Sustainable \nDevelopment, and encourages the Olympic and Paralympic Movements to work \nclosely with national and international sports organizations on the use of sport to this \nend;  \n \n8. \nRequests the Secretary-General and the President of the General Assembly \nto promote the observance of the Olympic Truce among Member States and support \nfor human development initiatives through sport and to continue to cooperate \neffectively with the International Olympic Committee, the International Paralympic \nCommittee and the sporting community in general in the realization of those \nobjectives;  \n \n9. \nDecides to include in the provisional agenda of its seventy-eighth session \nthe sub-item entitled \u201cBuilding a peaceful and better world through sport and the \nOlympic ideal\u201d of the item entitled \u201cSport for development and peace\u201d and to consider \nthe sub-item before the Games of the XXXIII Olympiad and the XVII Paralympic \nGames, to be held in Paris in 2024. \n \n43rd plenary meeting \n2 December 2021 \n \n",
  "paragraphs": {
    "1": "Urges Member States to observe the Olympic Truce individually and collectively, within the framework of the Charter of the United Nations, throughout the period from the seventh day before the start of the XXIV Olympic Winter Games until the seventh day following the end of the XIII Paralympic Winter Games, to be held in Beijing in 2022, in particular, to ensure the safe passage, access and participation of athletes, officials and all other accredited persons taking part in the Olympic Winter Games and the Paralympic Winter Games, and to contribute through other appropriate measures to the safe organization of the Games;",
    "2": "Underlines the importance of cooperation among Member States to collectively implement the values of the Olympic Truce around the world, and emphasizes the important role of the International Olympic Committee, the International Paralympic Committee and the United Nations in this regard;",
    "3": "Welcomes the work of the International Olympic Committee and the International Paralympic Committee, as well as the International Olympic Truce Centre, in mobilizing national and international sports federations and organizations, National Olympic and Paralympic Committees and associations of these organizations to take concrete actions at the local, national, regional and international levels to promote and strengthen a culture of peace based on the spirit of the Olympic Truce, and invites those organizations and national committees to cooperate and share information and best practices, as appropriate;",
    "4": "Also welcomes the leadership of Olympic and Paralympic athletes in promoting peace and human understanding through sport and the Olympic ideal; Building a peaceful and better world through sport and the Olympic ideal A/RES/76/13 5/5 21-17889",
    "5": "Calls upon all Member States to cooperate with the International Olympic Committee and the International Paralympic Committee in their efforts to use sport as a tool to promote peace, dialogue and reconciliation in areas of conflict during and beyond the period of the Olympic and Paralympic Games;",
    "6": "Recognizes that sport and the Olympic and Paralympic Games can be used to promote human rights and strengthen universal respect for such rights, thus contributing to their full realization;",
    "7": "Welcomes the cooperation among Member States, the United Nations and the specialized agencies, funds and programmes, and the International Olympic Committee and the International Paralympic Committee, to maximize the potential of sport to make a meaningful and sustainable contribution to the achievement of the Sustainable Development Goals within the 2030 Agenda for Sustainable Development, and encourages the Olympic and Paralympic Movements to work closely with national and international sports organizations on the use of sport to this end;",
    "8": "Requests the Secretary-General and the President of the General Assembly to promote the observance of the Olympic Truce among Member States and support for human development initiatives through sport and to continue to cooperate effectively with the International Olympic Committee, the International Paralympic Committee and the sporting community in general in the realization of those objectives;",
    "9": "Decides to include in the provisional agenda of its seventy-eighth session the sub-item entitled \u201cBuilding a peaceful and better world through sport and the Olympic ideal\u201d of the item entitled \u201cSport for development and peace\u201d and to consider the sub-item before the Games of the XXXIII Olympiad and the XVII Paralympic Games, to be held in Paris in 2024. 43rd plenary meeting 2 December 2021"
  },
  "agenda_items": [
    "Item 12"
  ],
  "symbol_references": [
    "A/76/L.13"
  ]
}