{
  "symbol": "A/RES/76/94",
  "filename": "A_RES_76_94.pdf",
  "title": "76/94. Question of the Cayman Islands",
  "text": "United Nations \nA/RES/76/94\n \n \nGeneral Assembly \nDistr.: General \n16 December 2021 \n \n \n21-18697 (E)    211221     \n*2118697* \n \n \nSeventy-sixth session \nAgenda item 63 \nImplementation of the Declaration on the Granting \nof Independence to Colonial Countries and Peoples \n \n \n \n \n Resolution adopted by the General Assembly on \n9 December 2021 \n \n \n \n \n[on the report of the Special Political and Decolonization Committee \n(Fourth Committee) (A/76/425, para. 37)] \n \n \n \n76/94. Question of the Cayman Islands \n \n \n \nThe General Assembly, \n \nHaving considered the question of the Cayman Islands and examined the report \nof the Special Committee on the Situation with regard to the Implementation of the \nDeclaration on the Granting of Independence to Colonial Countries and Peoples for \n2021,1  \n \nTaking note of the working paper prepared by the Secretariat on the Cayman \nIslands2 and other relevant information,  \n \nRecognizing that all available options for self-determination of the Territory are \nvalid as long as they are in accordance with the freely expressed wishes of the people \nof the Cayman Islands and in conformity with the clearly defined principles contained \nin General Assembly resolutions 1514 (XV) of 14 December 1960, 1541 (XV) of \n15 December 1960 and other resolutions of the Assembly,  \n \nExpressing concern that, more than 60 years after the adoption of the \nDeclaration on the Granting of Independence to Colonial Countries and Peoples, 3 \nthere still remain 17 Non-Self-Governing Territories, including the Cayman Islands,  \n \nConscious of the importance of continuing the effective implementation of the \nDeclaration, taking into account the target set by the United Nations to eradicate \ncolonialism by 2030 and the plan of action for the International Decades for the \nEradication of Colonialism,4 \n__________________ \n \n1  Official Records of the General Assembly, Seventy-sixth Session, Supplement No. 23 (A/76/23). \n \n2  A/AC.109/2021/5. \n \n3  Resolution 1514 (XV). \n \n4  A/56/61, annex. \n\nA/RES/76/94 \nQuestion of the Cayman Islands\n \n21-18697\n2/5 \n \n \nRecognizing that the specific characteristics and the aspirations of the people of \nthe Cayman Islands require flexible, practical and innovative approaches to the \noptions for self-determination, without any prejudice to territorial size, geographical \nlocation, size of population or natural resources,  \n \nConvinced that the wishes and aspirations of the people of the Territory should \ncontinue to guide the development of their future political status and that \nreferendums, free and fair elections and other forms of popular consultation play an \nimportant role in ascertaining the wishes and aspirations of the people,  \n \nConcerned by the use and exploitation of the natural resources of the Non-Self-\nGoverning Territories by the administering Powers for their benefit, by the use of the \nTerritories as international financial centres to the detriment of the world economy \nand by the consequences of any economic activities of the administering Powers that \nare contrary to the interests of the people of the Territories, as well as to resolution \n1514 (XV),  \n \nConvinced that any negotiations to determine the status of the Territory must \ntake place with the active involvement and participation of the people of the Territory, \nunder the auspices of the United Nations, on a case-by-case basis, and that the views \nof the people of the Cayman Islands in respect of their right to self-determination \nshould be ascertained,  \n \nNoting the continued cooperation of the Non-Self-Governing Territories at the \nlocal and regional levels, including participation in the work of regional \norganizations,  \n \nMindful that, in order for the Special Committee to enhance its understanding \nof the political status of the people of the Cayman Islands and to fulfil its mandate \neffectively, it is important for it to be apprised by the United Kingdom of Great Britain \nand Northern Ireland as the administering Power and to receive information from \nother appropriate sources, including the representatives of the Territory, concerning \nthe wishes and aspirations of the people of the Territory, \n \nAware of the importance both to the Cayman Islands and to the Special \nCommittee of the participation of elected and appointed representatives of the \nCayman Islands in the work of the Committee,  \n \nRecognizing the need for the Special Committee to ensure that the appropriate \nbodies of the United Nations actively pursue a public awareness campaign aimed at \nassisting the people of the Cayman Islands with their inalienable right to self-\ndetermination and in gaining a better understanding of the options for self-\ndetermination, on a case-by-case basis,  \n \nMindful, in that connection, that the holding of regional seminars in the \nCaribbean and Pacific regions and at Headquarters, with the active participation of \nrepresentatives of the Non-Self-Governing Territories, provides a helpful means for \nthe Special Committee to fulfil its mandate and that the regional nature of the \nseminars, which alternate between the Caribbean and the Pacific, is a crucial element \nin the context of a United Nations programme for ascertaining the political status of \nthe Territories,  \n \nRecalling the Caribbean regional seminar on the theme \u201cImplementation of the \nThird International Decade for the Eradication of Colonialism: accelerating \ndecolonization through renewed commitment and pragmatic measures\u201d, held by the \nSpecial Committee in Grand Anse, Grenada, and hosted by the Government of \nGrenada from 2 to 4 May 2019, as a significant and forward-looking event, which \nenabled the participants to assess progress made and address challenges faced in the \n\nQuestion of the Cayman Islands \nA/RES/76/94\n \n3/5\n21-18697 \n \ndecolonization process, review the existing working methods of the Committee and \nrenew its commitment to implementing its historic task,  \n \nRecalling also the importance of the conclusions and recommendations adopted \nby the seminar, which were annexed to the report of the Special Committee for 2019 5 \nand which outlined the findings of the seminar, including, especially, the way forward \nfor the decolonization process within the context of the proclamation by the General \nAssembly of the period 2011\u20132020 as the Third International Decade for the \nEradication of Colonialism,6  \n \nMindful that the 2021 Caribbean regional seminar, originally scheduled to be \nconvened in Dominica, from 19 to 21 May 2021, had to be rescheduled, and \nwelcoming the holding of the regional seminar in the Parish of Saint John, Dominica, \nfrom 25 to 27 August 2021, \n \nNoting with appreciation the contribution to the development of some \nTerritories by the specialized agencies and other organizations of the United Nations \nsystem, in particular the Economic Commission for Latin America and the Caribbean, \nthe Economic and Social Commission for Asia and the Pacific, the United Nations \nDevelopment Programme and the World Food Programme, as well as regional \ninstitutions such as the Caribbean Development Bank, the Caribbean Community, the \nOrganisation of Eastern Caribbean States, the Pacific Islands Forum and the agencies \nof the Council of Regional Organizations in the Pacific,  \n \nRecalling the statement made by the honorary representative of the territorial \nGovernment at the 2010 Pacific regional seminar held in Noum\u00e9a, 7  \n \nNoting with serious concern that the Territory last participated in the activities \nof the Special Committee in 2010,  \n \nAware of the work, in accordance with the 2009 Constitution, of the \nConstitutional Commission, which serves as an advisory body on constitutional \nmatters, \n \nAware also that the territorial Government proposed constitutional changes to \nthe administering Power and that subsequently the Cayman Islands Constitution \n(Amendment) Order 2020 came into force in December 2020,  \n \nStressing the importance of regional ties for the development of a small island \nTerritory,  \n \nCognizant of the Territory\u2019s membership in the Caribbean Overseas Countries \nand Territories Council,  \n \nNoting the general election that was held in April 2021,8  \n \nRecalling its resolutions 74/270 of 2 April 2020, entitled \u201cGlobal solidarity to \nfight the coronavirus disease 2019 (COVID-19)\u201d, 74/274 of 20 April 2020, entitled \n\u201cInternational cooperation to ensure global access to medicines, vaccines and medical \nequipment to face COVID-19\u201d, 74/306 of 11 September 2020, entitled \u201cComprehensive \nand coordinated response to the coronavirus disease (COVID-19) pandemic\u201d, 74/307 \nof 11 September 2020, entitled \u201cUnited response against global health threats: \ncombating COVID-19\u201d, 75/156 of 16 December 2020, entitled \u201cStrengthening \nnational and international rapid response to the impact of the coronavirus disease \n(COVID-19) on women and girls\u201d, and 75/157 of 16 December 2020, entitled \n__________________ \n \n5  Official Records of the General Assembly, Seventy-fourth Session, Supplement No. 23 (A/74/23). \n \n6  See resolution 65/119. \n \n7  Available at www.un.org/dppa/decolonization/en/c24/regional-seminars/2010. \n \n8  See A/AC.109/2021/5, \u201cThe Territory at a glance\u201d. \n\nA/RES/76/94 \nQuestion of the Cayman Islands\n \n21-18697\n4/5 \n \n\u201cWomen and girls and the response to the coronavirus disease (COVID-19)\u201d, as well \nas other relevant resolutions,  \n \n1. \nReaffirms the inalienable right of the people of the Cayman Islands to self-\ndetermination, in conformity with the Charter of the United Nations and with General \nAssembly resolution 1514 (XV), containing the Declaration on the Granting of \nIndependence to Colonial Countries and Peoples;  \n \n2. \nAlso reaffirms that, in the process of decolonization of the Cayman Islands, \nthere is no alternative to the principle of self-determination, which is also a \nfundamental human right, as recognized under the relevant human rights conventions;  \n \n3. \nFurther reaffirms that it is ultimately for the people of the Cayman Islands \nto determine freely their future political status, in accordance with the relevant \nprovisions of the Charter, the Declaration and the relevant resolutions of the General \nAssembly, and in that connection calls upon the administering Power, in cooperation \nwith the territorial Government and appropriate bodies of the United Nations system, \nto develop political education programmes for the Territory in order to foster an \nawareness among the people of their right to self-determination in conformity with \nthe legitimate political status options, based on the principles clearly defined in \nAssembly resolution 1541 (XV) and other relevant resolutions and decisions;  \n \n4. \nRecalls the 2009 Constitution of the Cayman Islands, and stresses the \nimportance of the work of the Constitutional Commission, including its work on \nhuman rights education;  \n \n5. \nRequests the administering Power to assist the Territory by facilitating its \nwork concerning public educational outreach efforts, consistent with Article 73 b of \nthe Charter, and in that regard calls upon the relevant United Nations organizations \nto provide assistance to the Territory, if requested;  \n \n6. \nWelcomes the active participation of the Territory in the work of the \nEconomic Commission for Latin America and the Caribbean;  \n \n7. \nStresses that the Territory should continue to participate in the activities of \nthe Special Committee on the Situation with regard to the Implementation of the \nDeclaration on the Granting of Independence to Colonial Countries and Peoples, \nincluding regional seminars, in order to provide the Committee with up-to-date \ninformation regarding the decolonization process;  \n \n8. \nAlso stresses the importance of the Special Committee being apprised of \nthe views and wishes of the people of the Cayman Islands and enhancing its \nunderstanding of their conditions, including the nature and scope of the existing \npolitical and constitutional arrangements between the Cayman Islands and the \nadministering Power;  \n \n9. \nCalls upon the administering Power to participate in and cooperate fully \nwith the work of the Special Committee in order to implement the provisions of \nArticle 73 e of the Charter and the Declaration and in order to advise the Committee \non the implementation of the provisions under Article 73 b of the Charter on efforts \nto promote self-government in the Cayman Islands, and encourages the administering \nPower to facilitate visiting and special missions to the Territory;  \n \n10. Reaffirms the responsibility of the administering Power under the Charter \nto promote the economic and social development and to preserve the cultural identity \nof the Territory, and requests the administering Power to take steps to enlist and make \neffective use of all possible assistance, on both a bilateral and a multilateral basis, in \nthe strengthening of the economy of the Territory; \n\nQuestion of the Cayman Islands \nA/RES/76/94\n \n5/5\n21-18697 \n \n \n11. \nTakes into account the 2030 Agenda for Sustainable Development, 9 \nincluding the Sustainable Development Goals, stresses the importance of fostering \nthe economic and social sustainable development of the Territory by promoting \nsustained, inclusive and equitable economic growth, creating greater opportunities for \nall, reducing inequalities, raising basic standards of living, fostering equitable social \ndevelopment and inclusion and promoting the integrated and sustainable management \nof natural resources and ecosystems that supports, inter alia, economic, social and \nhuman development, while facilitating ecosystem conservation, regeneration, \nrestoration and resilience in the face of new and emerging challenges, and strongly \nurges the administering Power to refrain from undertaking any kind of illicit, harmful \nand unproductive activities, including the use of the Territory as an international \nfinancial centre, that are not aligned with the interest of the people of the Territory;  \n \n12. Requests the Territory and the administering Power to take all measures \nnecessary to protect and conserve the environment of the Territory against any \ndegradation, and once again requests the specialized agencies concerned to monitor \nenvironmental conditions in the Territory and to provide assistance to the Territory, \nconsistent with their prevailing rules of procedure;  \n \n13. Requests the Special Committee to continue to examine the question of the \nCayman Islands and to report thereon to the General Assembly at its seventy-seventh \nsession and on the implementation of the present resolution. \n \n49th plenary meeting \n9 December 2021 \n \n \n__________________ \n \n9  Resolution 70/1. \n",
  "paragraphs": {
    "1": "Reaffirms the inalienable right of the people of the Cayman Islands to self- determination, in conformity with the Charter of the United Nations and with General Assembly resolution 1514 (XV), containing the Declaration on the Granting of Independence to Colonial Countries and Peoples;",
    "2": "Also reaffirms that, in the process of decolonization of the Cayman Islands, there is no alternative to the principle of self-determination, which is also a fundamental human right, as recognized under the relevant human rights conventions;",
    "3": "Further reaffirms that it is ultimately for the people of the Cayman Islands to determine freely their future political status, in accordance with the relevant provisions of the Charter, the Declaration and the relevant resolutions of the General Assembly, and in that connection calls upon the administering Power, in cooperation with the territorial Government and appropriate bodies of the United Nations system, to develop political education programmes for the Territory in order to foster an awareness among the people of their right to self-determination in conformity with the legitimate political status options, based on the principles clearly defined in Assembly resolution 1541 (XV) and other relevant resolutions and decisions;",
    "4": "Recalls the 2009 Constitution of the Cayman Islands, and stresses the importance of the work of the Constitutional Commission, including its work on human rights education;",
    "5": "Requests the administering Power to assist the Territory by facilitating its work concerning public educational outreach efforts, consistent with Article 73 b of the Charter, and in that regard calls upon the relevant United Nations organizations to provide assistance to the Territory, if requested;",
    "6": "Welcomes the active participation of the Territory in the work of the Economic Commission for Latin America and the Caribbean;",
    "7": "Stresses that the Territory should continue to participate in the activities of the Special Committee on the Situation with regard to the Implementation of the Declaration on the Granting of Independence to Colonial Countries and Peoples, including regional seminars, in order to provide the Committee with up-to-date information regarding the decolonization process;",
    "8": "Also stresses the importance of the Special Committee being apprised of the views and wishes of the people of the Cayman Islands and enhancing its understanding of their conditions, including the nature and scope of the existing political and constitutional arrangements between the Cayman Islands and the administering Power;",
    "9": "Calls upon the administering Power to participate in and cooperate fully with the work of the Special Committee in order to implement the provisions of Article 73 e of the Charter and the Declaration and in order to advise the Committee on the implementation of the provisions under Article 73 b of the Charter on efforts to promote self-government in the Cayman Islands, and encourages the administering Power to facilitate visiting and special missions to the Territory;",
    "10": "Reaffirms the responsibility of the administering Power under the Charter to promote the economic and social development and to preserve the cultural identity of the Territory, and requests the administering Power to take steps to enlist and make effective use of all possible assistance, on both a bilateral and a multilateral basis, in the strengthening of the economy of the Territory; Question of the Cayman Islands A/RES/76/94 5/5 21-18697",
    "11": "Takes into account the 2030 Agenda for Sustainable Development, 9 including the Sustainable Development Goals, stresses the importance of fostering the economic and social sustainable development of the Territory by promoting sustained, inclusive and equitable economic growth, creating greater opportunities for all, reducing inequalities, raising basic standards of living, fostering equitable social development and inclusion and promoting the integrated and sustainable management of natural resources and ecosystems that supports, inter alia, economic, social and human development, while facilitating ecosystem conservation, regeneration, restoration and resilience in the face of new and emerging challenges, and strongly urges the administering Power to refrain from undertaking any kind of illicit, harmful and unproductive activities, including the use of the Territory as an international financial centre, that are not aligned with the interest of the people of the Territory;",
    "12": "Requests the Territory and the administering Power to take all measures necessary to protect and conserve the environment of the Territory against any degradation, and once again requests the specialized agencies concerned to monitor environmental conditions in the Territory and to provide assistance to the Territory, consistent with their prevailing rules of procedure;",
    "13": "Requests the Special Committee to continue to examine the question of the Cayman Islands and to report thereon to the General Assembly at its seventy-seventh session and on the implementation of the present resolution. 49th plenary meeting 9 December 2021 __________________ 9 Resolution 70/1."
  },
  "agenda_items": [
    "Item 63"
  ],
  "symbol_references": []
}