{
  "symbol": "A/RES/75/241",
  "filename": "A_RES_75_241.pdf",
  "title": "75/241. The illicit trade in small arms and light weapons in all its aspects",
  "text": "United Nations \nA/RES/75/241\n \n \nGeneral Assembly \nDistr.: General \n4 January 2021 \n \n21-00007 (E)    050121     \n*2100007* \n \n \nSeventy-fifth session \nAgenda item 103 (p) \nGeneral and complete disarmament: the illicit trade in \nsmall arms and light weapons in all its aspects \n \n \n \n \n Resolution adopted by the General Assembly \non 31 December 2020 \n \n \n \n \n[on the report of the First Committee (A/75/399, para. 96)] \n \n \n 75/241. The illicit trade in small arms and light weapons in all its aspects \n \n \n \nThe General Assembly, \n \nRecalling its resolution 74/60 of 12 December 2019, as well as all previous \nresolutions on the illicit trade in small arms and light weapons in all its aspects, \nincluding resolution 56/24 V of 24 December 2001, \n \nEmphasizing the importance of the continued and full implementation of the \nProgramme of Action to Prevent, Combat and Eradicate the Illicit Trade in Small \nArms and Light Weapons in All Its Aspects, adopted by the United Nations \nConference on the Illicit Trade in Small Arms and Light Weapons in All Its Aspects, 1 \nand recognizing its important contribution to international efforts on this matter, \n \nEmphasizing also the importance of the continued and full implementation of \nthe International Instrument to Enable States to Identify and Trace, in a Timely and \nReliable Manner, Illicit Small Arms and Light Weapons (the International Tracing \nInstrument),2 \n \nRecalling the commitment of States to the Programme of Action as the main \nframework for measures within the activities of the international community to \nprevent, combat and eradicate the illicit trade in small arms and light weapons in all \nits aspects, \n \nUnderlining the need for States to enhance their efforts to build national \ncapacity for the effective implementation of the Programme of Action and the \nInternational Tracing Instrument, \n__________________ \n \n1 Report of the United Nations Conference on the Illicit Trade in Small Arms and Light Weapons in \nAll Its Aspects, New York, 9\u201320 July 2001 (A/CONF.192/15), chap. IV, para. 24. \n \n2 See decision 60/519 and A/60/88 and A/60/88/Corr.2, annex. \n\nA/RES/75/241 \nThe illicit trade in small arms and light weapons in all its aspects\n \n21-00007\n2/6 \n \n \nMindful of the implementation of the outcomes adopted by the follow-up \nmeetings on the Programme of Action, \n \nWelcoming the successful conclusion of the third United Nations Conference to \nReview Progress Made in the Implementation of the Programme of Action to Prevent, \nCombat and Eradicate the Illicit Trade in Small Arms and Light Weapons in All Its \nAspects (the third Review Conference), held in New York from 18 to 29 June 2018, \n \nRecognizing the need for the strengthened participation of women in decision-\nmaking and implementation processes relating to the Programme of Action and the \nInternational Tracing Instrument, and reaffirming the need for States to mainstream \ngender dimensions into their implementation efforts, \n \nNoting that web-based tools developed by the Secretariat, including its \nsearchable \ndatabase \nand \nthe \nModular \nSmall-arms-control \nImplementation \nCompendium, and the tools developed by Member States could be used to assess \nprogress made in the implementation of the Programme of Action, \n \nReaffirming the acknowledgement, by the third Review Conference in its \noutcome document,3 of the proposal on the establishment of a dedicated fellowship \ntraining programme on small arms and light weapons in order to strengthen technical \nknowledge and expertise in areas relating to the implementation of the Programme of \nAction and the International Tracing Instrument, in particular in developing countries, \n \nWelcoming the series of open, informal consultations in early 2020 held by the \nChair-designate of the Seventh Biennial Meeting of States to Consider the \nImplementation of the Programme of Action to Prevent, Combat and Eradicate the \nIllicit Trade in Small Arms and Light Weapons in All Its Aspects, \n \nNoting the decision of the General Assembly to postpone the Seventh Biennial \nMeeting of States to 2021 in response to the situation concerning the coronavirus \ndisease (COVID-19) pandemic,4 \n \nNoting also that voluntary national reports on the implementation of the \nProgramme of Action can serve, inter alia, to provide a baseline for measuring \nprogress in its implementation, build confidence and promote transparency, provide \na basis for information exchange and action and serve to identify needs and \nopportunities for international assistance and cooperation, including the matching of \nneeds with available resources and expertise, \n \nNoting with satisfaction regional and subregional efforts being undertaken in \nsupport of the implementation of the Programme of Action, and commending the \nprogress that has already been made in this regard, including the tackling of both \nsupply and demand factors that are relevant to addressing the illicit trade in small \narms and light weapons, \n \nRecognizing that sharing and applying best practices, on a voluntary basis, at \nthe regional, subregional and national levels support the full and effective \nimplementation of the Programme of Action and the International Tracing Instrument \nand should therefore be an ongoing effort, in order to address ongoing challenges \nassociated with the diversion of and illicit trade in small arms and light weapons, \n \nReaffirming that international cooperation and assistance are an essential aspect \nof the full and effective implementation of the Programme of Action and the \nInternational Tracing Instrument, \n__________________ \n \n3 A/CONF.192/2018/RC/3, annex. \n \n4 See decision 74/552. \n\nThe illicit trade in small arms and light weapons in all its aspects \nA/RES/75/241\n \n3/6\n21-00007 \n \n \nRecognizing the efforts undertaken by civil society in the provision of assistance \nto States for the implementation of the Programme of Action, \n \nRecalling that Governments bear the primary responsibility for preventing, \ncombating and eradicating the illicit trade in small arms and light weapons in all its \naspects, in accordance with the sovereignty of States and their relevant international \nobligations, \n \nReiterating that illicit brokering in small arms and light weapons is a serious \nproblem that the international community should address urgently, \n \nHighlighting new challenges and potential opportunities with regard to effective \nmarking, record-keeping and tracing resulting from developments in the \nmanufacturing, technology and design of small arms and light weapons, and bearing \nin mind the different situations, capacities and priorities of States and regions, \n \nRecognizing that the opportunities and challenges associated with these \ndevelopments in the manufacturing, technology and design of small arms and light \nweapons, including polymer and modular weapons, must be addressed in a timely \nmanner, \n \nTaking note of the report of the Secretary-General,5 which includes an overview \nof challenges related to the diversion of small arms and light weapons at the national, \nregional and international levels, as well as good practices, lessons learned and \nrecommendations on preventing and combating the diversion and illicit international \ntransfer of small arms and light weapons to unauthorized recipients, \n \nWelcoming the inclusion of small arms and light weapons in the scope of the \nArms Trade Treaty,6 \n \nAcknowledging that effective national control systems for the transfer of \nconventional arms contribute to the prevention and eradication of the illicit trade in \nsmall arms and light weapons in all its aspects, \n \n1. \nUnderlines the fact that the issue of the illicit trade in small arms and light \nweapons in all its aspects requires concerted efforts at the national, regional and \ninternational levels to prevent, combat and eradicate the illicit manufacture, transfer \nand circulation of small arms and light weapons, and that their uncontrolled spread in \nmany regions of the world has a wide range of humanitarian and socioeconomic \nconsequences and poses a serious threat to peace, reconciliation, safety, security, \nstability and sustainable development at the individual, local, national, regional and \ninternational levels; \n \n2. \nRecognizes the urgent need to maintain and enhance national controls, in \naccordance with the Programme of Action to Prevent, Combat and Eradicate the Illicit \nTrade in Small Arms and Light Weapons in All Its Aspects, to prevent, combat and \neradicate the illicit trade in small arms and light weapons, including their diversion \nto illicit trade, illegal armed groups, terrorists and other unauthorized recipients, \ntaking into account, inter alia, their adverse humanitarian and socioeconomic \nconsequences for the affected States; \n \n3. \nCalls upon all States to implement the International Instrument to Enable \nStates to Identify and Trace, in a Timely and Reliable Manner, Illicit Small Arms and \nLight Weapons (the International Tracing Instrument) by, inter alia, including in their \nnational reports the name and contact information of the national points of contact \n__________________ \n \n5 A/75/78. \n \n6 See resolution 67/234 B. \n\nA/RES/75/241 \nThe illicit trade in small arms and light weapons in all its aspects\n \n21-00007\n4/6 \n \nand information on national marking practices used to indicate country of \nmanufacture and/or country of import, as applicable; \n \n4. \nEncourages all relevant initiatives, including those of the United Nations, \nother international organizations, regional and subregional organizations and civil \nsociety, for the successful implementation of the Programme of Action, and calls upon \nall Member States to contribute towards the continued implementation of the \nProgramme of Action at the national, regional and global levels; \n \n5. \nEncourages States to implement the recommendations contained in the \nreport of the Group of Governmental Experts established pursuant to resolution 60/81 \nof 8 December 2005 to consider further steps to enhance international cooperation in \npreventing, combating and eradicating illicit brokering in small arms and light \nweapons;7 \n \n6. \nAffirms the outcome of the third United Nations Conference to Review \nProgress Made in the Implementation of the Programme of Action to Prevent, Combat \nand Eradicate the Illicit Trade in Small Arms and Light Weapons in All Its Aspects, \nheld in New York from 18 to 29 June 2018 (the third Review Conference); \n \n7. \nDecides, pursuant to decision 74/552 of 14 May 2020, to convene a one-\nweek biennial meeting of States from 26 to 30 July 2021 to consider key challenges \nand opportunities relating to the implementation of the Programme of Action and the \nInternational Tracing Instrument at the national, regional and global levels for the \npurposes of preventing and combating the diversion and the illicit international \ntransfer of small arms and light weapons to unauthorized recipients; \n \n8. \nRenews its decision, pursuant to the schedule of meetings for the period \nfrom 2018 to 2024 agreed upon at the third Review Conference, to convene a one-\nweek biennial meeting of States in 2022 and the fourth United Nations Conference to \nReview Progress Made in the Implementation of the Programme of Action to Prevent, \nCombat and Eradicate the Illicit Trade in Small Arms and Light Weapons in All Its \nAspects in 2024, to be preceded by a preparatory committee meeting in early 2024 of \nnot more than five days; \n \n9. \nUnderlines the importance of the full and effective implementation of the \nProgramme of Action and the International Tracing Instrument for attaining Goal 16 \nand target 16.4 of the Sustainable Development Goals;8 \n \n10. Emphasizes that international cooperation and assistance remain essential \nto the full and effective implementation of the Programme of Action and the \nInternational Tracing Instrument, while being mindful of the need to ensure the \nadequacy, effectiveness and sustainability of international cooperation and assistance; \n \n11. \nAlso emphasizes the fact that initiatives by the international community \nwith respect to international cooperation and assistance remain essential and \ncomplementary to national implementation efforts, as well as to those at the regional \nand global levels; \n \n12. Recognizes the necessity for interested States to develop effective \ncoordination mechanisms, where they do not exist, in order to match the needs of \nStates with existing resources to enhance the implementation of the Programme of \nAction and to make international cooperation and assistance more effective, and in \nthis regard encourages States to make use, as appropriate, of the Programme of Action \nImplementation Support System; \n__________________ \n \n7 See A/62/163 and A/62/163/Corr.1. \n \n8 See resolution 70/1. \n\nThe illicit trade in small arms and light weapons in all its aspects \nA/RES/75/241\n \n5/6\n21-00007 \n \n \n13. Encourages States to consider, among other mechanisms, the coherent \nidentification of needs, priorities, national plans and programmes that may require \ninternational cooperation and assistance from States and regional and international \norganizations in a position to do so; \n \n14. Also encourages States, on a voluntary basis, to make increasing use of \ntheir national reports as a tool for communicating assistance needs and information \non the resources and mechanisms available to address such needs, and encourages \nStates in a position to render such assistance to make use of those national reports; \n \n15. Encourages States, relevant international and regional organizations and \ncivil society with the capacity to do so to cooperate with and provide assistance to \nother States, upon request, in the preparation of comprehensive national reports on \ntheir implementation of the Programme of Action and the International Tracing \nInstrument; \n \n16. Encourages States to reinforce, as necessary, cross-border cooperation at \nthe national, subregional and regional levels in addressing the common problem of \nthe illicit trade in small arms and light weapons in all its aspects, with full respect for \neach State\u2019s sovereignty over its own borders; \n \n17. Also encourages States to take full advantage of the benefits of \ncooperation with the United Nations regional centres for peace and disarmament, the \nWorld Customs Organization, the International Criminal Police Organization \n(INTERPOL) and the United Nations Office on Drugs and Crime, in accordance with \ntheir mandates and consistent with national priorities; \n \n18. Encourages all efforts to build national capacity for the effective \nimplementation of the Programme of Action, including those highlighted in the \noutcome document of the third Review Conference; \n \n19. Encourages States to submit, on a voluntary basis, national reports on their \nimplementation of the Programme of Action, notes that States will submit national \nreports on their implementation of the International Tracing Instrument, encourages \nthose States in a position to do so to use the reporting template made available by the \nOffice for Disarmament Affairs of the Secretariat, and reaffirms the utility of \nsynchronizing such reports with biennial meetings of States and review conferences \nas a means of increasing the submission rate and improving the utility of reports, as \nwell as contributing substantively to meeting discussions; \n \n20. Encourages States in a position to do so to provide financial assistance, \nthrough a voluntary sponsorship fund, that could be distributed, upon request, to \nStates otherwise unable to participate in meetings on the Programme of Action; \n \n21. Welcomes the establishment of the Saving Lives Entity fund to ensure \nsustained financing for coordinated, integrated small arms control measures in \ncountries most affected by the illicit trade in small arms and light weapons, and \nencourages States in a position to do so to make voluntary financial contributions to \nthe fund; \n \n22. Encourages interested States and relevant international and regional \norganizations in a position to do so to convene regional meetings to consider and \nadvance the implementation of the Programme of Action, as well as the International \nTracing Instrument, including in preparation for the meetings on the Programme of \nAction; \n \n23. Encourages civil society and relevant organizations to strengthen their \ncooperation and work with States at the respective national and regional levels to \nachieve the implementation of the Programme of Action; \n\nA/RES/75/241 \nThe illicit trade in small arms and light weapons in all its aspects\n \n21-00007\n6/6 \n \n \n24. Reaffirms the importance of States undertaking to identify, where \napplicable, groups and individuals engaged in the illegal manufacture, trade, \nstockpiling, transfer, possession, as well as financing for acquisition, of illicit small \narms and light weapons, and take action under appropriate national law against such \ngroups and individuals;9 \n \n25. Requests the Secretary-General to report to the General Assembly at its \nseventy-sixth session on the implementation of the present resolution; \n \n26. Requests the Secretariat, within existing resources, to present an analysis \nof implementation trends, challenges and opportunities relating to the Programme of \nAction and the International Tracing Instrument, including needs for cooperation and \nassistance, based on information submitted by States, at the Seventh Biennial Meeting \non the Programme of Action and the International Tracing Instrument; \n \n27. Also requests the Secretariat to report on support provided by the United \nNations system for the implementation of the Programme of Action and the \nInternational Tracing Instrument, including experiences, best practices and lessons \nlearned regarding the efficient use of available resources, for presentation at \nupcoming meetings on the Programme of Action and the International Tracing \nInstrument; \n \n28. Decides to include in the provisional agenda of its seventy-sixth session, \nunder the item entitled \u201cGeneral and complete disarmament\u201d, the sub-item entitled \n\u201cThe illicit trade in small arms and light weapons in all its aspects\u201d. \n \n48th (resumed) plenary meeting \n31 December 2020 \n \n \n__________________ \n \n9 Report of the United Nations Conference on Illicit Trade in Small Arms and Light Weapons in All \nIts Aspects, New York, 9\u201320 July 2001 (A/CONF.192/15), chap. IV, para. 24, sect. II, para. 6. \n",
  "paragraphs": {
    "1": "Underlines the fact that the issue of the illicit trade in small arms and light weapons in all its aspects requires concerted efforts at the national, regional and international levels to prevent, combat and eradicate the illicit manufacture, transfer and circulation of small arms and light weapons, and that their uncontrolled spread in many regions of the world has a wide range of humanitarian and socioeconomic consequences and poses a serious threat to peace, reconciliation, safety, security, stability and sustainable development at the individual, local, national, regional and international levels;",
    "2": "Recognizes the urgent need to maintain and enhance national controls, in accordance with the Programme of Action to Prevent, Combat and Eradicate the Illicit Trade in Small Arms and Light Weapons in All Its Aspects, to prevent, combat and eradicate the illicit trade in small arms and light weapons, including their diversion to illicit trade, illegal armed groups, terrorists and other unauthorized recipients, taking into account, inter alia, their adverse humanitarian and socioeconomic consequences for the affected States;",
    "3": "Calls upon all States to implement the International Instrument to Enable States to Identify and Trace, in a Timely and Reliable Manner, Illicit Small Arms and Light Weapons (the International Tracing Instrument) by, inter alia, including in their national reports the name and contact information of the national points of contact __________________ 5 A/75/78. 6 See resolution 67/234 B. A/RES/75/241 The illicit trade in small arms and light weapons in all its aspects 21-00007 4/6 and information on national marking practices used to indicate country of manufacture and/or country of import, as applicable;",
    "4": "Encourages all relevant initiatives, including those of the United Nations, other international organizations, regional and subregional organizations and civil society, for the successful implementation of the Programme of Action, and calls upon all Member States to contribute towards the continued implementation of the Programme of Action at the national, regional and global levels;",
    "5": "Encourages States to implement the recommendations contained in the report of the Group of Governmental Experts established pursuant to resolution 60/81 of 8 December 2005 to consider further steps to enhance international cooperation in preventing, combating and eradicating illicit brokering in small arms and light weapons;7",
    "6": "Affirms the outcome of the third United Nations Conference to Review Progress Made in the Implementation of the Programme of Action to Prevent, Combat and Eradicate the Illicit Trade in Small Arms and Light Weapons in All Its Aspects, held in New York from 18 to 29 June 2018 (the third Review Conference);",
    "7": "Decides, pursuant to decision 74/552 of 14 May 2020, to convene a one- week biennial meeting of States from 26 to 30 July 2021 to consider key challenges and opportunities relating to the implementation of the Programme of Action and the International Tracing Instrument at the national, regional and global levels for the purposes of preventing and combating the diversion and the illicit international transfer of small arms and light weapons to unauthorized recipients;",
    "8": "Renews its decision, pursuant to the schedule of meetings for the period from 2018 to 2024 agreed upon at the third Review Conference, to convene a one- week biennial meeting of States in 2022 and the fourth United Nations Conference to Review Progress Made in the Implementation of the Programme of Action to Prevent, Combat and Eradicate the Illicit Trade in Small Arms and Light Weapons in All Its Aspects in 2024, to be preceded by a preparatory committee meeting in early 2024 of not more than five days;",
    "9": "Underlines the importance of the full and effective implementation of the Programme of Action and the International Tracing Instrument for attaining Goal 16 and target 16.4 of the Sustainable Development Goals;8",
    "10": "Emphasizes that international cooperation and assistance remain essential to the full and effective implementation of the Programme of Action and the International Tracing Instrument, while being mindful of the need to ensure the adequacy, effectiveness and sustainability of international cooperation and assistance;",
    "11": "Also emphasizes the fact that initiatives by the international community with respect to international cooperation and assistance remain essential and complementary to national implementation efforts, as well as to those at the regional and global levels;",
    "12": "Recognizes the necessity for interested States to develop effective coordination mechanisms, where they do not exist, in order to match the needs of States with existing resources to enhance the implementation of the Programme of Action and to make international cooperation and assistance more effective, and in this regard encourages States to make use, as appropriate, of the Programme of Action Implementation Support System; __________________ 7 See A/62/163 and A/62/163/Corr.1. 8 See resolution 70/1. The illicit trade in small arms and light weapons in all its aspects A/RES/75/241 5/6 21-00007",
    "13": "Encourages States to consider, among other mechanisms, the coherent identification of needs, priorities, national plans and programmes that may require international cooperation and assistance from States and regional and international organizations in a position to do so;",
    "14": "Also encourages States, on a voluntary basis, to make increasing use of their national reports as a tool for communicating assistance needs and information on the resources and mechanisms available to address such needs, and encourages States in a position to render such assistance to make use of those national reports;",
    "15": "Encourages States, relevant international and regional organizations and civil society with the capacity to do so to cooperate with and provide assistance to other States, upon request, in the preparation of comprehensive national reports on their implementation of the Programme of Action and the International Tracing Instrument;",
    "16": "Encourages States to reinforce, as necessary, cross-border cooperation at the national, subregional and regional levels in addressing the common problem of the illicit trade in small arms and light weapons in all its aspects, with full respect for each State\u2019s sovereignty over its own borders;",
    "17": "Also encourages States to take full advantage of the benefits of cooperation with the United Nations regional centres for peace and disarmament, the World Customs Organization, the International Criminal Police Organization (INTERPOL) and the United Nations Office on Drugs and Crime, in accordance with their mandates and consistent with national priorities;",
    "18": "Encourages all efforts to build national capacity for the effective implementation of the Programme of Action, including those highlighted in the outcome document of the third Review Conference;",
    "19": "Encourages States to submit, on a voluntary basis, national reports on their implementation of the Programme of Action, notes that States will submit national reports on their implementation of the International Tracing Instrument, encourages those States in a position to do so to use the reporting template made available by the Office for Disarmament Affairs of the Secretariat, and reaffirms the utility of synchronizing such reports with biennial meetings of States and review conferences as a means of increasing the submission rate and improving the utility of reports, as well as contributing substantively to meeting discussions;",
    "20": "Encourages States in a position to do so to provide financial assistance, through a voluntary sponsorship fund, that could be distributed, upon request, to States otherwise unable to participate in meetings on the Programme of Action;",
    "21": "Welcomes the establishment of the Saving Lives Entity fund to ensure sustained financing for coordinated, integrated small arms control measures in countries most affected by the illicit trade in small arms and light weapons, and encourages States in a position to do so to make voluntary financial contributions to the fund;",
    "22": "Encourages interested States and relevant international and regional organizations in a position to do so to convene regional meetings to consider and advance the implementation of the Programme of Action, as well as the International Tracing Instrument, including in preparation for the meetings on the Programme of Action;",
    "23": "Encourages civil society and relevant organizations to strengthen their cooperation and work with States at the respective national and regional levels to achieve the implementation of the Programme of Action; A/RES/75/241 The illicit trade in small arms and light weapons in all its aspects 21-00007 6/6",
    "24": "Reaffirms the importance of States undertaking to identify, where applicable, groups and individuals engaged in the illegal manufacture, trade, stockpiling, transfer, possession, as well as financing for acquisition, of illicit small arms and light weapons, and take action under appropriate national law against such groups and individuals;9",
    "25": "Requests the Secretary-General to report to the General Assembly at its seventy-sixth session on the implementation of the present resolution;",
    "26": "Requests the Secretariat, within existing resources, to present an analysis of implementation trends, challenges and opportunities relating to the Programme of Action and the International Tracing Instrument, including needs for cooperation and assistance, based on information submitted by States, at the Seventh Biennial Meeting on the Programme of Action and the International Tracing Instrument;",
    "27": "Also requests the Secretariat to report on support provided by the United Nations system for the implementation of the Programme of Action and the International Tracing Instrument, including experiences, best practices and lessons learned regarding the efficient use of available resources, for presentation at upcoming meetings on the Programme of Action and the International Tracing Instrument;",
    "28": "Decides to include in the provisional agenda of its seventy-sixth session, under the item entitled \u201cGeneral and complete disarmament\u201d, the sub-item entitled \u201cThe illicit trade in small arms and light weapons in all its aspects\u201d. 48th (resumed) plenary meeting 31 December 2020 __________________ 9 Report of the United Nations Conference on Illicit Trade in Small Arms and Light Weapons in All Its Aspects, New York, 9\u201320 July 2001 (A/CONF.192/15), chap. IV, para. 24, sect. II, para. 6."
  },
  "agenda_items": [
    "Item 103"
  ],
  "symbol_references": []
}