{
  "symbol": "A/RES/78/259",
  "filename": "A_RES_78_259.pdf",
  "title": "78/259. International Day of Science, Technology and Innovation for the South",
  "text": "United Nations \nA/RES/78/259\n \n \nGeneral Assembly \nDistr.: General \n16 January 2024 \n \n24-00741 (E)    190124     \n*2400741* \n \n \nSeventy-eighth session \nAgenda item 13 \nIntegrated and coordinated implementation of and follow up \nto the outcomes of the major United Nations conferences and \nsummits in the economic, social and related fields \n \n \n \n \n Resolution adopted by the General Assembly \non 9 January 2024  \n \n \n \n \n[without reference to a Main Committee (A/78/L.34)] \n \n \n 78/259. International Day of Science, Technology and Innovation for \nthe South \n \n \n \nThe General Assembly, \n \nRecalling its resolution 78/160 of 19 December 2023 on science, technology \nand innovation for sustainable development and its previous resolutions on the issue, 1 \n \nReaffirming its resolutions 53/199 of 15 December 1998 and 61/185 of \n20 December 2006 on the proclamation of international years, and Economic and \nSocial Council resolution 1980/67 of 25 July 1980 on international years and \nanniversaries, \n \nRecognizing the importance of creating synergies, developing expertise and \nboosting resources in various regions and institutions, and in this regard taking note \nof the Summit on Science, Technology and Innovation of the Group of 77 and China, \nheld in Havana on 15 and 16 September 2023, and the Havana Declaration on Current \nDevelopment Challenges: the Role of Science, Technology and Innovation, 2 as an \neffort to boost cooperation in this field, \n \nStressing the important role of science, technology and innovation to support \neconomic growth and sustainable development and to accelerate the full \nimplementation of the 2030 Agenda for Sustainable Development3 and the Addis Ababa \nAction Agenda of the Third International Conference on Financing for Development, 4 \n__________________ \n \n1  Resolutions 58/200, 59/220, 60/205, 61/207, 62/201, 64/212, 66/211, 68/220, 70/213, 72/228, \n74/229 and 76/213. \n \n2  A/78/393, annex. \n \n3  Resolution 70/1. \n \n4  Resolution 69/313, annex. \n\nA/RES/78/259 \nInternational Day of Science, Technology and Innovation \nfor the South\n \n24-00741\n2/2 \n \nas well as the political declaration of the 2023 Sustainable Development Goals \nSummit,5 \n \nNoting with deep concern the existing disparities between developed and \ndeveloping countries in terms of conditions, possibilities and capacities to produce \nnew scientific and technological knowledge,  \n \nRecognizing that science, technology and innovation cooperation and \ncollaboration with, as well as foreign direct investment in and trade with and among, \ndeveloping countries, as well as international support, are fundamental to enhancing \ndeveloping countries\u2019 ability to benefit from technological advances and to produce, \nnurture, access, comprehend, select, adapt and use science, technology and innovation \nknowledge, \n \nEmphasizing the need to encourage the promotion of North-South cooperation \nprojects and programmes to improve developing countries\u2019 access to more and better \nresources for the implementation of technical and scientific initiatives and to continue \nworking on the development of science and technology in developing countries by \nstrengthening South-South and triangular cooperation, while recalling that South-South \ncooperation is not a substitute for, but rather a complement to, North-South cooperation, \n \nWelcoming the operationalization of the Technology Bank for the Least \nDeveloped Countries, and inviting Member States and other stakeholders to provide \nvoluntary funding to the trust fund of the Technology Bank so that it can pursue its \nobjectives in the area of science, technology and innovation for the least developed \ncountries, \n \nCalling upon the international community to foster an open, fair, inclusive and \nnon-discriminatory environment for scientific and technological development and to \nsupport the efforts of the countries of the South to develop and strengthen their \nnational science, technology and innovation systems, \n \n1. \nDecides to proclaim 16 September as the International Day of Science, \nTechnology and Innovation for the South, to be observed annually; \n \n2. \nInvites all States Members of the United Nations, members of the \nspecialized agencies and observers of the General Assembly, as well as organizations \nof the United Nations system, other international and regional organizations, \nacademia, civil society, the private sector and other relevant stakeholders, to observe \nthe International Day of Science, Technology and Innovation for the South, in an \nappropriate manner, by presenting initiatives, including cooperation projects in the \nareas of science, technology and innovation that contribute to the development of \ndeveloping countries in those fields; \n \n3. \nStresses that the cost of all activities that may arise from the \nimplementation of the present resolution should be met from voluntary contributions, \nincluding from the private sector; \n \n4. \nRequests the Secretary-General to bring the present resolution to the \nattention of all States Members of the United Nations, members of the specialized \nagencies and observers of the General Assembly, as well as the organizations of the \nUnited Nations system, academia, civil society, the private sector and other relevant \nstakeholders, for appropriate observance. \n \n52nd plenary meeting \n9 January 2024 \n \n__________________ \n \n5  Political declaration of the high-level political forum on sustainable development convened \nunder the auspices of the General Assembly (resolution 78/1, annex). \n",
  "paragraphs": {
    "1": "Decides to proclaim 16 September as the International Day of Science, Technology and Innovation for the South, to be observed annually;",
    "2": "Invites all States Members of the United Nations, members of the specialized agencies and observers of the General Assembly, as well as organizations of the United Nations system, other international and regional organizations, academia, civil society, the private sector and other relevant stakeholders, to observe the International Day of Science, Technology and Innovation for the South, in an appropriate manner, by presenting initiatives, including cooperation projects in the areas of science, technology and innovation that contribute to the development of developing countries in those fields;",
    "3": "Stresses that the cost of all activities that may arise from the implementation of the present resolution should be met from voluntary contributions, including from the private sector;",
    "4": "Requests the Secretary-General to bring the present resolution to the attention of all States Members of the United Nations, members of the specialized agencies and observers of the General Assembly, as well as the organizations of the United Nations system, academia, civil society, the private sector and other relevant stakeholders, for appropriate observance. 52nd plenary meeting 9 January 2024 __________________ 5 Political declaration of the high-level political forum on sustainable development convened under the auspices of the General Assembly (resolution 78/1, annex)."
  },
  "agenda_items": [
    "Item 13"
  ],
  "symbol_references": [
    "A/78/L.34"
  ]
}