{
  "symbol": "A/RES/73/34",
  "filename": "A_RES_73_34.pdf",
  "title": "73/34. Conventional arms control at the regional and subregional levels",
  "text": "United Nations \nA/RES/73/34\n \n \nGeneral Assembly \nDistr.: General \n11 December 2018 \n \n18-21228 (E)    131218  \n*1821228* \n \n \nSeventy-third session \nAgenda item 101 (f) \n \n \n \n \n Resolution adopted by the General Assembly \non 5 December 2018 \n \n \n \n \n[on the report of the First Committee (A/73/510 and A/73/510/Corr.1)] \n \n \n \n73/34. Conventional arms control at the regional and subregional levels \n \n \n \nThe General Assembly, \n \nRecalling its resolutions 48/75 J of 16 December 1993, 49/75 O of 15 December \n1994, 50/70 L of 12 December 1995, 51/45 Q of 10 December 1996, 52/38 Q of \n9 December 1997, 53/77 P of 4 December 1998, 54/54 M of 1 December 1999, \n55/33 P of 20 November 2000, 56/24 I of 29 November 2001, 57/77 of 22 November \n2002, 58/39 of 8 December 2003, 59/88 of 3 December 2004, 60/75 of 8 December \n2005, 61/82 of 6 December 2006, 62/44 of 5 December 2007, 63/44 of 2 December \n2008, 64/42 of 2 December 2009, 65/46 of 8 December 2010, 66/37 of 2 December \n2011, 67/62 of 3 December 2012, 68/56 of 5 December 2013, 69/47 of 2 December \n2014, 70/44 of 7 December 2015, 71/41 of 5 December 2016 and 72/35 of \n4 December 2017, \n \nRecognizing the crucial role of conventional arms control in promoting regional \nand international peace and security, \n \nRecognizing also the importance of equitable representation of women in arms \ncontrol discussions and negotiations, \n \nConvinced that conventional arms control needs to be pursued primarily in the \nregional and subregional contexts since most threats to peace and security in the \npost-cold-war era arise mainly among States located in the same region or subregion, \n \nAware that the preservation of a balance in the defence capabilities of States at \nthe lowest level of armaments would contribute to peace and stability and should be \na prime objective of conventional arms control, \n \nDesirous of promoting agreements to strengthen regional peace and security at \nthe lowest possible level of armaments and military forces, \n \nNoting with particular interest the initiatives taken in this regard in different \nregions of the world, in particular the commencement of consultations among a \nnumber of Latin American countries and the proposals for conventional arms control \n\nA/RES/73/34 \nConventional arms control at the regional and subregional levels\n \n18-21228\n2/2 \n \nmade in the context of South Asia, and recognizing, in the context of this subject, the \nrelevance and value of the Treaty on Conventional Armed Forces in Europe, 1 which \nis a cornerstone of European security, \n \nBelieving that militarily significant States and States with larger military \ncapabilities have a special responsibility in promoting such agreements for regional \nsecurity, \n \nBelieving also that an important objective of conventional arms control in \nregions of tension should be to prevent the possibility of military attack launched by \nsurprise and to avoid aggression, \n \n1. \nDecides to give urgent consideration to the issues involved in conventional \narms control at the regional and subregional levels; \n \n2. \nRequests the Conference on Disarmament to consider the formulation of \nprinciples that can serve as a framework for regional agreements on conventional \narms control, and looks forward to a report of the Conference on this subject; \n \n3. \nRequests the Secretary-General, in the meantime, to seek the views of \nMember States on the subject and to submit a report to the General Assembly at its \nseventy-fourth session; \n \n4. \nDecides to include in the provisional agenda of its seventy-fourth session, \nunder the item entitled \u201cGeneral and complete disarmament\u201d, the sub-item entitled \n\u201cConventional arms control at the regional and subregional levels\u201d. \n \n45th plenary meeting  \n5 December 2018 \n \n__________________ \n \n1  See CD/1064. \n",
  "paragraphs": {
    "1": "Decides to give urgent consideration to the issues involved in conventional arms control at the regional and subregional levels;",
    "2": "Requests the Conference on Disarmament to consider the formulation of principles that can serve as a framework for regional agreements on conventional arms control, and looks forward to a report of the Conference on this subject;",
    "3": "Requests the Secretary-General, in the meantime, to seek the views of Member States on the subject and to submit a report to the General Assembly at its seventy-fourth session;",
    "4": "Decides to include in the provisional agenda of its seventy-fourth session, under the item entitled \u201cGeneral and complete disarmament\u201d, the sub-item entitled \u201cConventional arms control at the regional and subregional levels\u201d."
  },
  "agenda_items": [
    "Item 101"
  ],
  "symbol_references": []
}