{
  "symbol": "A/RES/72/20",
  "filename": "A_RES_72_20.pdf",
  "title": "72/20. Objective information on military matters, including transparency of military expenditures",
  "text": "United Nations \nA/RES/72/20\n \n \nGeneral Assembly \nDistr.: General \n11 December 2017 \n \n17-21684 (E)    131217 \n*1721684* \n \n \nSeventy-second session \nAgenda item 90 (b) \n \n \n \n \n Resolution adopted by the General Assembly \non 4 December 2017 \n \n \n \n \n[on the report of the First Committee (A/72/400)] \n \n \n \n72/20. Objective information on military matters, including transparency \nof military expenditures \n \n \n \nThe General Assembly,  \n \nRecalling its resolutions 53/72 of 4 December 1998, 54/43 of 1 December \n1999, 56/14 of 29 November 2001, 58/28 of 8 December 2003, 60/44 of \n8 December 2005, 62/13 of 5 December 2007, 64/22 of 2 December 2009, 66/20 of \n2 December 2011, 68/23 of 5 December 2013 and 70/21 of 7 December 2015 on \nobjective information on military matters, including transparency of military \nexpenditures,  \n \nRecalling also its resolution 35/142 B of 12 December 1980, which introduced \nthe United Nations system for the standardized reporting of military expenditures, \nits resolutions 48/62 of 16 December 1993, 49/66 of 15 December 1994, 51/38 of \n10 December 1996 and 52/32 of 9 December 1997, in which the General Assembly \ncalled upon all Member States to participate in the system, and its resolution \n47/54 B of 9 December 1992, in which the Assembly endorsed the guidelines and \nrecommendations for objective information on military matters and invited Member \nStates to provide the Secretary-General with relevant information regarding their \nimplementation,  \n \nNoting that, since then, national reports on military expenditures and on the \nguidelines and recommendations for objective information on military matters have \nbeen submitted by a number of Member States belonging to different geographical \nregions, \n \nConvinced that the improvement of international relations forms a sound basis \nfor promoting further openness and transparency in all military matters,  \n \nConvinced also that transparency in military matters is an essential element for \nbuilding a climate of trust and confidence between States worldwide and that a \nbetter flow of objective information on military matters can help to relieve \ninternational tension and is therefore an important contribution to conflict \nprevention,  \n\nA/RES/72/20 \nObjective information on military matters, including transparency of military expenditures\n \n17-21684 \n2/4 \n \n \nNoting the role of the standardized reporting system, as instituted through its \nresolution 35/142 B, as an important instrument to enhance transparency in military \nmatters,  \n \nConscious that the value of the standardized reporting system would be \nenhanced by a broader participation of Member States,  \n \nNoting that a periodic review of the United Nations Report on Military \nExpenditures could facilitate its further development and maintain its continued \nrelevance and operation, and recalling that, in its resolution 66/20, the General \nAssembly recommended the establishment of a process for periodic reviews,  \n \nRecalling, in that regard, the report of the Secretary-General on ways and \nmeans to implement the guidelines and recommendations for objective information \non military matters, including, in particular, on how to strengthen and broaden \nparticipation in the standardized reporting system, 1 \n \nRecalling also the report of the Group of Governmental Experts on the \nOperation and Further Development of the United Nations Standardized Instrument \nfor Reporting Military Expenditures on further ways and means to implement the \nguidelines and recommendations for objective information on military matters, \nincluding, in particular, on how to strengthen and broaden participation in the \nstandardized reporting system,2 \n \nWelcoming the work of the Secretariat on migrating data submitted on military \nexpenditures to its new, interactive web platform, which includes an online \nreporting feature, thus increasing user-friendliness and facilitating the submission of \nreports,3 in accordance with resolution 66/20,  \n \nNoting the efforts of several regional organizations to promote transparency of \nmilitary expenditures, including standardized annual exchanges of relevant \ninformation among their member States,  \n \nEmphasizing the continuing importance of the Report on Military \nExpenditures under the current political and economic circumstances,  \n \nRecalling that, in its resolution 66/20, the General Assembly recommended \nthat, for the purpose of reporting by Member States of their national military \nexpenditures in the framework of the Report on Military Expenditures, \u201cmilitary \nexpenditures\u201d be commonly understood to refer to all financial resources that a \nState spends on the uses and functions of its military forces and information on \nmilitary expenditures represents an actual outlay in current prices and domestic \ncurrency,  \n \nMindful of the provisions of the Charter of the United Nations, including its \nArticle 26,  \n \n1. \nEndorses the report of the Group of Governmental Experts to Review the \nOperation and Further Development of the United Nations Report on Military \nExpenditures;4 \n \n2. \nCalls upon Member States, with a view to achieving the broadest \npossible participation, to provide the Secretary-General, by 30 April annually, with \na report on their military expenditures for the latest fiscal year for which data are \navailable, using, preferably and to the extent possible, one of the online reporting \n__________________ \n \n1  A/54/298. \n \n2  A/66/89 and A/66/89/Corr.1, A/66/89/Corr.2 and A/66/89/Corr.3. \n \n3  Available from www.un-arm.org/Milex/home.aspx. \n \n4  A/72/293. \n\nObjective information on military matters, including transparency of military expenditures \nA/RES/72/20\n \n3/4 \n17-21684 \n \nforms, including, if appropriate, a nil report or the \u201csingle figure\u201d report on military \nexpenditures or any other format developed in the context of similar reporting on \nmilitary expenditures to other international or regional organizations;  \n \n3. \nRecommends the guidelines and recommendations for objective \ninformation on military matters to all Member States for implementation, fully \ntaking into account specific political, military and other conditions prevailing in a \nregion, on the basis of initiatives and with the agreement of the States of the region \nconcerned;  \n \n4. \nInvites Member States in a position to do so to supplement their reports, \non a voluntary basis, with explanatory remarks regarding submitted data to explain \nor clarify the figures provided in the reporting forms, such as the total military \nexpenditures as a share of gross domestic product, major changes from previous \nreports and any additional information reflecting their defence policy, military \nstrategies and doctrines;  \n \n5. \nInvites Member States to provide, preferably with their annual report, \ninformation on their national points of contact;  \n \n6. \nEncourages relevant international bodies and regional organizations to \npromote transparency of military expenditures and to enhance complementarities \namong reporting systems, taking into account the particular characteristics of each \nregion, and to consider the possibility of an exchange of information with the \nUnited Nations;  \n \n7. \nTakes note of the annual reports of the Secretary-General;5 \n \n8. \nRequests the Secretary-General, within available resources:  \n \n(a) \nTo continue the practice of sending an annual note verbale to Member \nStates requesting the submission of their report on military expenditures;  \n \n(b) \nTo circulate annually a note verbale to Member States detailing which \nreports on military expenditures were submitted and are available online;  \n \n(c) \nTo circulate to Member States the questionnaire contained in annex I to \nthe report of the Group of Governmental Experts4 and to collect the responses from \nMember States and provide a summary thereof in advance of the seventy-fourth \nsession of the General Assembly;  \n \n(d) \nTo continue consultations with relevant international bodies, with a view \nto ascertaining requirements for adjusting the present instrument in order to \nencourage wider participation, and to make recommendations, based on the outcome \nof those consultations and taking into account the views of Member States, on \nnecessary changes to the content and structure of the standardized reporting system;  \n \n(e) \nTo encourage relevant international bodies and organizations to promote \ntransparency of military expenditures and to consult with those bodies and \norganizations \nwith \nemphasis \non \nexamining \npossibilities \nfor \nenhancing \ncomplementarities among international and regional reporting systems and for \nexchanging related information between those bodies and the United Nations;  \n__________________ \n \n5  A/58/202 and A/58/202/Add.1, A/58/202/Add.2 and A/58/202/Add.3, A/59/192 and \nA/59/192/Add.1, A/60/159 and A/60/159/Add.1, A/60/159/Add.2 and A/60/159/Add.3, A/61/133 \nand A/61/133/Add.1, A/61/133/Add.2 and A/61/133/Add.3, A/62/158 and A/62/158/Add.1, \nA/62/158/Add.2 and A/62/158/Add.3, A/63/97 and A/63/97Add.1 and A/63/97/Add.2, A/64/113 \nand A/64/113/Add.1 and A/64/113/Add.2, A/65/118 and A/65/118/Corr.1 and A/65/118/Add.1 \nand A/65/118/Add.2, A/66/117 and A/66/117/Add.1, A/67/128 and A/67/128/Add.1, A/68/131 \nand A/68/131/Add.1, A/69/135 and A/69/135/Add.1, A/70/139 and A/70/139/Add.1 and A/71/115 \nand A/71/115/Add.1. \n\nA/RES/72/20 \nObjective information on military matters, including transparency of military expenditures\n \n17-21684 \n4/4 \n \n \n(f) \nTo continue to foster further cooperation with relevant regional \norganizations, with a view to raising awareness of the United Nations Report on \nMilitary Expenditures and its role as a confidence-building measure;  \n \n(g) \nTo encourage the United Nations regional centres for peace and \ndisarmament in Africa, in Asia and the Pacific and in Latin America and the \nCaribbean to assist Member States in their regions in enhancing their knowledge of \nthe standardized reporting system;  \n \n(h) \nTo promote international and regional or subregional symposiums and \ntraining seminars and to support the development of an online training course by the \nOffice for Disarmament Affairs of the Secretariat, with the financial and technical \nsupport of interested States, with a view to explaining the purpose of the \nstandardized reporting system, facilitating the electronic filing of reports and \nproviding relevant technical instructions;  \n \n(i) \nTo report on experiences gained during such symposiums and training \nseminars;  \n \n(j) \nTo provide, upon request, technical assistance to Member States lacking \nthe capacity to report data and to encourage Member States to voluntarily provide \nbilateral assistance to other Member States;  \n \n9. \nEncourages Member States:  \n \n(a) \nTo inform the Secretary-General about possible problems with the \nstandardized reporting system and their reasons for not submitting the requested data; \n \n(b) \nTo continue to provide the Secretary-General with their views and \nsuggestions on ways and means to improve the future functioning of and broadened \nparticipation in the standardized reporting system, including necessary changes to \nits content and structure, as well as recommendations to facilitate its further \ndevelopment;  \n \n(c) \nTo complete the questionnaire contained in annex I to the report of the \nGroup of Governmental Experts and to return it to the Secretary-General within the \ndeadline to be set by him;  \n \n10. Recommends that the matter of the establishment of a process of periodic \nreviews of the Report on Military Expenditures and the timing of the next review be \nconsidered at the seventy-fourth session of the General Assembly, taking into \naccount the results of the questionnaire referred to in paragraphs 8 (c) and 9 (c) \nabove; \n \n11. \nDecides to include in the provisional agenda of its seventy-fourth \nsession, under the item entitled \u201cReduction of military budgets\u201d, the sub-item \nentitled \u201cObjective information on military matters, including transparency of \nmilitary expenditures\u201d. \n \n62nd plenary meeting  \n4 December 2017 \n \n",
  "paragraphs": {
    "1": "Endorses the report of the Group of Governmental Experts to Review the Operation and Further Development of the United Nations Report on Military Expenditures;4",
    "2": "Calls upon Member States, with a view to achieving the broadest possible participation, to provide the Secretary-General, by 30 April annually, with a report on their military expenditures for the latest fiscal year for which data are available, using, preferably and to the extent possible, one of the online reporting forms, including, if appropriate, a nil report or the \u201csingle figure\u201d report on military expenditures or any other format developed in the context of similar reporting on military expenditures to other international or regional organizations;",
    "3": "Recommends the guidelines and recommendations for objective information on military matters to all Member States for implementation, fully taking into account specific political, military and other conditions prevailing in a region, on the basis of initiatives and with the agreement of the States of the region concerned;",
    "4": "Invites Member States in a position to do so to supplement their reports, on a voluntary basis, with explanatory remarks regarding submitted data to explain or clarify the figures provided in the reporting forms, such as the total military expenditures as a share of gross domestic product, major changes from previous reports and any additional information reflecting their defence policy, military strategies and doctrines;",
    "5": "Invites Member States to provide, preferably with their annual report, information on their national points of contact;",
    "6": "Encourages relevant international bodies and regional organizations to promote transparency of military expenditures and to enhance complementarities among reporting systems, taking into account the particular characteristics of each region, and to consider the possibility of an exchange of information with the United Nations;",
    "7": "Takes note of the annual reports of the Secretary-General;5",
    "8": "Requests the Secretary-General, within available resources: (a) To continue the practice of sending an annual note verbale to Member States requesting the submission of their report on military expenditures; (b) To circulate annually a note verbale to Member States detailing which reports on military expenditures were submitted and are available online; (c) To circulate to Member States the questionnaire contained in annex I to the report of the Group of Governmental Experts4 and to collect the responses from Member States and provide a summary thereof in advance of the seventy-fourth session of the General Assembly; (d) To continue consultations with relevant international bodies, with a view to ascertaining requirements for adjusting the present instrument in order to encourage wider participation, and to make recommendations, based on the outcome of those consultations and taking into account the views of Member States, on necessary changes to the content and structure of the standardized reporting system; (e) To encourage relevant international bodies and organizations to promote transparency of military expenditures and to consult with those bodies and organizations with emphasis on examining possibilities for enhancing complementarities among international and regional reporting systems and for exchanging related information between those bodies and the United Nations; (f) To continue to foster further cooperation with relevant regional organizations, with a view to raising awareness of the United Nations Report on Military Expenditures and its role as a confidence-building measure; (g) To encourage the United Nations regional centres for peace and disarmament in Africa, in Asia and the Pacific and in Latin America and the Caribbean to assist Member States in their regions in enhancing their knowledge of the standardized reporting system; (h) To promote international and regional or subregional symposiums and training seminars and to support the development of an online training course by the Office for Disarmament Affairs of the Secretariat, with the financial and technical support of interested States, with a view to explaining the purpose of the standardized reporting system, facilitating the electronic filing of reports and providing relevant technical instructions; (i) To report on experiences gained during such symposiums and training seminars; (j) To provide, upon request, technical assistance to Member States lacking the capacity to report data and to encourage Member States to voluntarily provide bilateral assistance to other Member States;",
    "9": "Encourages Member States: (a) To inform the Secretary-General about possible problems with the standardized reporting system and their reasons for not submitting the requested data; (b) To continue to provide the Secretary-General with their views and suggestions on ways and means to improve the future functioning of and broadened participation in the standardized reporting system, including necessary changes to its content and structure, as well as recommendations to facilitate its further development; (c) To complete the questionnaire contained in annex I to the report of the Group of Governmental Experts and to return it to the Secretary-General within the deadline to be set by him;",
    "10": "Recommends that the matter of the establishment of a process of periodic reviews of the Report on Military Expenditures and the timing of the next review be considered at the seventy-fourth session of the General Assembly, taking into account the results of the questionnaire referred to in paragraphs 8 (c) and 9 (c) above;",
    "11": "Decides to include in the provisional agenda of its seventy-fourth session, under the item entitled \u201cReduction of military budgets\u201d, the sub-item entitled \u201cObjective information on military matters, including transparency of military expenditures\u201d."
  },
  "agenda_items": [
    "Item 90"
  ],
  "symbol_references": []
}