{
  "symbol": "A/RES/79/69",
  "filename": "A_RES_79_69.pdf",
  "title": "79/69. United Nations Disarmament Information Programme",
  "text": "United Nations \nA/RES/79/69\n \n \nGeneral Assembly \nDistr.: General \n9 December 2024 \n \n24-23084 (E) \n*2423084* \n \n \nSeventy-ninth session \nAgenda item 99 (g) \nReview and implementation of the Concluding Document \nof the Twelfth Special Session of the General Assembly: \nUnited Nations Disarmament Information Programme \n \n \n \n \n Resolution adopted by the General Assembly \non 2 December 2024 \n \n \n \n \n[on the report of the First Committee (A/79/409, para. 21)] \n \n \n \n79/69. United Nations Disarmament Information Programme \n \n \n \nThe General Assembly, \n \nRecalling its decision taken in 1982 at its twelfth special session, the second \nspecial session devoted to disarmament, by which the World Disarmament Campaign \nwas launched,1 \n \nBearing in mind its resolution 47/53 D of 9 December 1992, in which it decided, \ninter alia, that the World Disarmament Campaign should be known thereafter as the \nUnited Nations Disarmament Information Programme and the World Disarmament \nCampaign voluntary trust fund as the voluntary trust fund for the United Nations \nDisarmament Information Programme,  \n \nRecalling its resolutions 51/46 A of 10 December 1996, 53/78 E of 4 December \n1998, 55/34 A of 20 November 2000, 57/90 of 22 November 2002, 59/103 of \n3 December 2004, 61/95 of 6 December 2006, 63/81 of 2 December 2008, 65/81 of \n8 December 2010, 67/67 of 3 December 2012, 69/71 of 2 December 2014, 71/74 of \n5 December 2016, 73/79 of 5 December 2018, 75/80 of 7 December 2020 and 77/87 \nof 7 December 2022,  \n \nWelcoming the report of the Secretary-General,2 \n \n1. \nStresses the importance of the United Nations Disarmament Information \nProgramme as a significant instrument in enabling all Member States to participate \nfully in the deliberations and negotiations on disarmament in the various United Nations \nbodies, in assisting them in complying with treaties, as required, and in contributing \nto agreed mechanisms for transparency;  \n__________________ \n \n1 See Official Records of the General Assembly, Twelfth Special Session, Plenary Meetings, \n1st meeting, paras. 110\u2013111. \n \n2 A/79/98. \n\nA/RES/79/69 \nUnited Nations Disarmament Information Programme\n \n24-23084\n2/2 \n \n \n2. \nCommends with satisfaction the launch of The United Nations \nDisarmament Yearbook for 2022 and 2023, as well as its online editions, by the Office \nfor Disarmament Affairs of the Secretariat;  \n \n3. \nNotes with appreciation the cooperation of the Department of Global \nCommunications of the Secretariat and its information centres in pursuit of the \nobjectives of the Programme;  \n \n4. \nRecommends that the Programme continue to inform, educate and generate \npublic understanding of the importance of multilateral action and support for it, \nincluding action by the United Nations and the Conference on Disarmament, in the \nfield of arms control and disarmament, in a factual, balanced and objective manner, \nand that it focus its efforts:  \n \n(a) \nTo continue to publish The United Nations Disarmament Yearbook, the \nflagship publication of the Office for Disarmament Affairs, in all official languages, \nas well as its Occasional Papers and other ad hoc information materials in accordance \nwith the current practice;  \n \n(b) \nTo continue to update the disarmament website as a part of the United \nNations website in as many official languages as feasible;  \n \n(c) \nTo promote the use of the Programme as a means to provide information \nrelated to progress in the implementation of nuclear disarmament measures;  \n \n(d) \nTo continue to intensify United Nations interaction with the public, \nprincipally non-governmental organizations and research institutes, to help to further \nan informed debate on topical issues of arms limitation, disarmament and security;  \n \n(e) \nTo continue to organize discussions on topics of interest in the field of \narms limitation and disarmament with a view to broadening understanding and \nfacilitating an exchange of views and information among Member States, civil society \nand young people;  \n \n5. \nRecognizes the importance of all support extended to the voluntary trust \nfund for the United Nations Disarmament Information Programme, and once again \ninvites all Member States to make further contributions to the fund with a view to \nsustaining a strong outreach programme;  \n \n6. \nTakes note of the recommendations contained in the report of the \nSecretary-General on disarmament and non-proliferation education,3 which reviews \nthe implementation of the recommendations made in the 2002 study on disarmament \nand non-proliferation education;4  \n \n7. \nRequests the Secretary-General to submit to the General Assembly at its \neighty-second session a report covering both the implementation of the activities of \nthe Programme by the United Nations system during the previous three years and the \nactivities of the Programme contemplated by the system for the following three years; \n \n8. \nDecides to include in the provisional agenda of its eighty-second session, \nunder the item entitled \u201cReview and implementation of the Concluding Document of \nthe Twelfth Special Session of the General Assembly\u201d, the sub-item entitled \u201cUnited \nNations Disarmament Information Programme\u201d. \n \n44th plenary meeting \n2 December 2024 \n \n__________________ \n \n3 A/79/114. \n \n4 A/57/124. \n",
  "paragraphs": {
    "1": "Stresses the importance of the United Nations Disarmament Information Programme as a significant instrument in enabling all Member States to participate fully in the deliberations and negotiations on disarmament in the various United Nations bodies, in assisting them in complying with treaties, as required, and in contributing to agreed mechanisms for transparency;",
    "2": "Commends with satisfaction the launch of The United Nations Disarmament Yearbook for 2022 and 2023, as well as its online editions, by the Office for Disarmament Affairs of the Secretariat;",
    "3": "Notes with appreciation the cooperation of the Department of Global Communications of the Secretariat and its information centres in pursuit of the objectives of the Programme;",
    "4": "Recommends that the Programme continue to inform, educate and generate public understanding of the importance of multilateral action and support for it, including action by the United Nations and the Conference on Disarmament, in the field of arms control and disarmament, in a factual, balanced and objective manner, and that it focus its efforts: (a) To continue to publish The United Nations Disarmament Yearbook, the flagship publication of the Office for Disarmament Affairs, in all official languages, as well as its Occasional Papers and other ad hoc information materials in accordance with the current practice; (b) To continue to update the disarmament website as a part of the United Nations website in as many official languages as feasible; (c) To promote the use of the Programme as a means to provide information related to progress in the implementation of nuclear disarmament measures; (d) To continue to intensify United Nations interaction with the public, principally non-governmental organizations and research institutes, to help to further an informed debate on topical issues of arms limitation, disarmament and security; (e) To continue to organize discussions on topics of interest in the field of arms limitation and disarmament with a view to broadening understanding and facilitating an exchange of views and information among Member States, civil society and young people;",
    "5": "Recognizes the importance of all support extended to the voluntary trust fund for the United Nations Disarmament Information Programme, and once again invites all Member States to make further contributions to the fund with a view to sustaining a strong outreach programme;",
    "6": "Takes note of the recommendations contained in the report of the Secretary-General on disarmament and non-proliferation education,3 which reviews the implementation of the recommendations made in the 2002 study on disarmament and non-proliferation education;4",
    "7": "Requests the Secretary-General to submit to the General Assembly at its eighty-second session a report covering both the implementation of the activities of the Programme by the United Nations system during the previous three years and the activities of the Programme contemplated by the system for the following three years;",
    "8": "Decides to include in the provisional agenda of its eighty-second session, under the item entitled \u201cReview and implementation of the Concluding Document of the Twelfth Special Session of the General Assembly\u201d, the sub-item entitled \u201cUnited Nations Disarmament Information Programme\u201d."
  },
  "agenda_items": [
    "Item 99"
  ],
  "symbol_references": []
}