{
  "symbol": "A/RES/74/69",
  "filename": "A_RES_74_69.pdf",
  "title": "74/69. United Nations Regional Centre for Peace and Disarmament in Asia and the Pacific",
  "text": "United Nations \nA/RES/74/69\n \n \nGeneral Assembly \nDistr.: General \n23 December 2019 \n \n19-21870 (E)    030120 \n*1921870* \n \n \nSeventy-fourth session \nAgenda item 99 (d) \nReview and implementation of the Concluding Document \nof the Twelfth Special Session of the General Assembly: \nUnited Nations Regional Centre for Peace and \nDisarmament in Asia and the Pacific \n \n \n \n \n Resolution adopted by the General Assembly \non 12 December 2019 \n \n \n \n \n[on the report of the First Committee (A/74/369)] \n \n \n \n74/69. United Nations Regional Centre for Peace and Disarmament \nin Asia and the Pacific \n \n \n \nThe General Assembly, \n \nRecalling its resolutions 42/39 D of 30 November 1987 and 44/117 F of \n15 December 1989, by which it established the United Nations Regional Centre for \nPeace and Disarmament in Asia and renamed it the United Nations Regional Centre \nfor Peace and Disarmament in Asia and the Pacific, with headquarters in Kathmandu, \n \nRecalling also the mandate of the Regional Centre to provide, on request, \nsubstantive support for the initiatives and other activities mutually agreed upon by \nthe Member States of the Asia-Pacific region for the implementation of measures for \npeace and disarmament, through appropriate utilization of available resources, \n \nTaking note of the report of the Secretary-General, 1  and expressing its \nappreciation to the Regional Centre for its important work in promoting confidence-\nbuilding measures through the organization of meetings, conferences and workshops \nin the region, including national and subregional workshops on the control of small \narms and light weapons; the seventeenth United Nations-Republic of Korea Joint \nConference on Disarmament and Non-Proliferation Issues, held on Jeju Island, \nRepublic of Korea, on 5 and 6 December 2018; subregional training courses for States \nof South and South-East Asia and Mongolia on conventional ammunition stockpile \nmanagement in line with the International Ammunition Technical Guidelines and the \nSaferGuard programme; a project to build capacity towards ratification of the Arms \nTrade Treaty 2  for States of Central Asia and Mongolia; and a capacity-building \n__________________ \n \n1 A/74/112. \n \n2 See resolution 67/234 B. \n\nA/RES/74/69 \nUnited Nations Regional Centre for Peace\nand Disarmament in Asia and the Pacific\n \n19-21870\n2/2 \n \nproject for States of South and South-East Asia on gun violence and illicit small arms \ntrafficking from a gender perspective, \n \nExpressing appreciation for the timely execution by Nepal of its host country \ncommitments for the physical operation of the Regional Centre, \n \nWelcoming the work by the Regional Centre in support of the achievement of the \nSustainable Development Goals,3 in particular Goal 16 on peace, justice and strong \ninstitutions, as well as target 16.4, which addresses the reduction of illicit arms flows, \n \nWelcoming also the efforts by the Regional Centre to promote the role and \nrepresentation of women in disarmament, non-proliferation and arms control activities, \n \nWelcoming further the youth-focused outreach activities undertaken by the \nRegional Centre, \n \n1. \nExpresses its satisfaction at the activities carried out over the past year by \nthe United Nations Regional Centre for Peace and Disarmament in Asia and the \nPacific, and invites all States of the region to continue to support the activities of the \nRegional Centre, including by continuing to take part in them, where possible, and by \nproposing items for inclusion in the programme of activities of the Centre, in order \nto contribute to the implementation of measures for peace and disarmament; \n \n2. \nExpresses its gratitude to the Government of Nepal for its cooperation and \nfinancial support, which has enabled the Regional Centre to operate from Kathmandu; \n \n3. \nExpresses its appreciation to the Secretary-General and the Office for \nDisarmament Affairs of the Secretariat for providing the necessary support with a \nview to ensuring the smooth operation of the Regional Centre and to enabling the \nCentre to function effectively; \n \n4. \nAppeals to Member States, in particular those within the Asia-Pacific \nregion, as well as to international governmental and non-governmental organizations \nand foundations, to make voluntary contributions, the only resources of the Regional \nCentre, to strengthen its programme of activities and the implementation thereof; \n \n5. \nReaffirms its strong support for the role of the Regional Centre in the \npromotion of activities of the United Nations at the regional level to strengthen peace, \nstability and security among its Member States; \n \n6. \nUnderlines the importance of the Kathmandu process for the development \nof the practice of region-wide security and disarmament dialogues; \n \n7. \nRequests the Secretary-General to report to the General Assembly at its \nseventy-fifth session on the implementation of the present resolution; \n \n8. \nDecides to include in the provisional agenda of its seventy-fifth session, \nunder the item entitled \u201cReview and implementation of the Concluding Document of \nthe Twelfth Special Session of the General Assembly\u201d, the sub-item entitled \u201cUnited \nNations Regional Centre for Peace and Disarmament in Asia and the Pacific\u201d. \n \n46th plenary meeting \n12 December 2019 \n \n__________________ \n \n3 See resolution 70/1. \n",
  "paragraphs": {
    "1": "Expresses its satisfaction at the activities carried out over the past year by the United Nations Regional Centre for Peace and Disarmament in Asia and the Pacific, and invites all States of the region to continue to support the activities of the Regional Centre, including by continuing to take part in them, where possible, and by proposing items for inclusion in the programme of activities of the Centre, in order to contribute to the implementation of measures for peace and disarmament;",
    "2": "Expresses its gratitude to the Government of Nepal for its cooperation and financial support, which has enabled the Regional Centre to operate from Kathmandu;",
    "3": "Expresses its appreciation to the Secretary-General and the Office for Disarmament Affairs of the Secretariat for providing the necessary support with a view to ensuring the smooth operation of the Regional Centre and to enabling the Centre to function effectively;",
    "4": "Appeals to Member States, in particular those within the Asia-Pacific region, as well as to international governmental and non-governmental organizations and foundations, to make voluntary contributions, the only resources of the Regional Centre, to strengthen its programme of activities and the implementation thereof;",
    "5": "Reaffirms its strong support for the role of the Regional Centre in the promotion of activities of the United Nations at the regional level to strengthen peace, stability and security among its Member States;",
    "6": "Underlines the importance of the Kathmandu process for the development of the practice of region-wide security and disarmament dialogues;",
    "7": "Requests the Secretary-General to report to the General Assembly at its seventy-fifth session on the implementation of the present resolution;",
    "8": "Decides to include in the provisional agenda of its seventy-fifth session, under the item entitled \u201cReview and implementation of the Concluding Document of the Twelfth Special Session of the General Assembly\u201d, the sub-item entitled \u201cUnited Nations Regional Centre for Peace and Disarmament in Asia and the Pacific\u201d."
  },
  "agenda_items": [
    "Item 99"
  ],
  "symbol_references": []
}