{
  "symbol": "A/RES/76/23",
  "filename": "A_RES_76_23.pdf",
  "title": "76/23. No first placement of weapons in outer space",
  "text": "United Nations \nA/RES/76/23\n \n \nGeneral Assembly \nDistr.: General \n8 December 2021 \n \n21-18258 (E)    131221 \n*2118258* \n \n \nSeventy-sixth session \nAgenda item 98 (b) \nPrevention of an arms race in outer space: no first \nplacement of weapons in outer space \n \n \n \n \n Resolution adopted by the General Assembly \non 6 December 2021 \n \n \n \n \n[on the report of the First Committee (A/76/442, para. 15)] \n \n \n \n76/23. No first placement of weapons in outer space \n \n \n \nThe General Assembly, \n \nRecalling its resolutions 69/32 of 2 December 2014, 70/27 of 7 December 2015, \n71/32 of 5 December 2016, 72/27 of 4 December 2017, 73/31 of 5 December 2018 \nand 74/33 of 12 December 2019, 75/37 of 7 December 2020 and its resolutions \n45/55 B of 4 December 1990 and 48/74 B of 16 December 1993, which, inter alia, \nconfirm the importance of transparency and confidence-building measures as a means \nconducive to ensuring the attainment of the objective of preventing an arms race in \nouter space, \n \nRecognizing the common interest of all humankind in the exploration and use \nof outer space for peaceful purposes, \n \nSeriously concerned about the possibility of an arms race in outer space and of \nouter space turning into an arena for military confrontation, and bearing in mind the \nimportance of articles III and IV of the Treaty on Principles Governing the Activities \nof States in the Exploration and Use of Outer Space, including the Moon and Other \nCelestial Bodies,1 \n \nConscious that the prevention of an arms race in outer space would avert a grave \ndanger to international peace and security, \n \nReaffirming that practical measures should be examined and taken in the search \nfor agreements to prevent an arms race in outer space in a common effort towards a \ncommunity of shared future for humankind, \n \nEmphasizing the paramount importance of strict compliance with the existing \nlegal regime providing for the peaceful use of outer space, \n__________________ \n \n1  United Nations, Treaty Series, vol. 610, No. 8843. \n\nA/RES/76/23 \nNo first placement of weapons in outer space\n \n21-18258\n2/2 \n \n \nReaffirming its recognition that the legal regime applicable to outer space by \nitself does not guarantee prevention of an arms race in outer space and that there is a \nneed to consolidate and reinforce that regime, \n \nConvinced that such measures could critically improve conditions for efficiently \naddressing the threat of an arms race in outer space, including the placement of \nweapons in outer space, \n \nWelcoming, in this regard, the draft treaty on the prevention of the placement of \nweapons in outer space and of the threat or use of force against outer space objects, \nintroduced by China and the Russian Federation at the Conference on Disarmament \nin 2008,2 and the submission of its updated version in 2014, 3 \n \nConsidering that transparency and confidence-building measures in outer space \nactivities are an integral part of the draft treaty referred to above, \n \nStressing the importance of the political statements made by a number of States4 \nthat they would not be the first to place weapons in outer space, \n \n1. \nReaffirms the importance and urgency of the objective of preventing an \narms race in outer space and the willingness of States to contribute to reaching this \ncommon goal; \n \n2. \nReiterates that the Conference on Disarmament, as the single multilateral \nnegotiating forum on this subject, 5  has the primary role in the negotiation of a \nmultilateral agreement, or agreements, as appropriate, on the prevention of an arms \nrace in outer space in all its aspects; \n \n3. \nUrges an early commencement of substantive work based on the updated \ndraft treaty on the prevention of the placement of weapons in outer space and of the \nthreat or use of force against outer space objects, introduced by China and the Russian \nFederation at the Conference on Disarmament in 2008, under the agenda item entitled \n\u201cPrevention of an arms race in outer space\u201d; \n \n4. \nStresses that, while such an agreement is not yet concluded, other measures \nmay contribute to ensuring that weapons are not placed in outer space; \n \n5. \nEncourages all States, especially spacefaring nations, to consider the \npossibility of upholding, as appropriate, a political commitment not to be the first to \nplace weapons in outer space; \n \n6. \nDecides to include in the provisional agenda of its seventy-seventh \nsession, under the item entitled \u201cPrevention of an arms race in outer space\u201d, the \nsub-item entitled \u201cNo first placement of weapons in outer space\u201d. \n \n45th plenary meeting \n6 December 2021 \n \n__________________ \n \n2  See CD/1839. \n \n3  See CD/1985. \n \n4  Argentina, Armenia, Belarus, Bolivia (Plurinational State of), Brazil, Burundi, Cambodia, \nCongo, Cuba, Ecuador, Guatemala, Indonesia, Kazakhstan, Kyrgyzstan, Myanmar, Nicaragua, \nPakistan, Russian Federation, Seychelles, Sierra Leone, Sri Lanka, Suriname, Syrian Arab \nRepublic, Tajikistan, Togo, Turkmenistan, Uruguay, Uzbekistan, Venezuela (Bolivarian Republic \nof) and Viet Nam. \n \n5  See resolution S-10/2. \n",
  "paragraphs": {
    "1": "Reaffirms the importance and urgency of the objective of preventing an arms race in outer space and the willingness of States to contribute to reaching this common goal;",
    "2": "Reiterates that the Conference on Disarmament, as the single multilateral negotiating forum on this subject, 5 has the primary role in the negotiation of a multilateral agreement, or agreements, as appropriate, on the prevention of an arms race in outer space in all its aspects;",
    "3": "Urges an early commencement of substantive work based on the updated draft treaty on the prevention of the placement of weapons in outer space and of the threat or use of force against outer space objects, introduced by China and the Russian Federation at the Conference on Disarmament in 2008, under the agenda item entitled \u201cPrevention of an arms race in outer space\u201d;",
    "4": "Stresses that, while such an agreement is not yet concluded, other measures may contribute to ensuring that weapons are not placed in outer space;",
    "5": "Encourages all States, especially spacefaring nations, to consider the possibility of upholding, as appropriate, a political commitment not to be the first to place weapons in outer space;",
    "6": "Decides to include in the provisional agenda of its seventy-seventh session, under the item entitled \u201cPrevention of an arms race in outer space\u201d, the sub-item entitled \u201cNo first placement of weapons in outer space\u201d. 45th plenary meeting 6 December 2021 __________________ 2 See CD/1839. 3 See CD/1985. 4 Argentina, Armenia, Belarus, Bolivia (Plurinational State of), Brazil, Burundi, Cambodia, Congo, Cuba, Ecuador, Guatemala, Indonesia, Kazakhstan, Kyrgyzstan, Myanmar, Nicaragua, Pakistan, Russian Federation, Seychelles, Sierra Leone, Sri Lanka, Suriname, Syrian Arab Republic, Tajikistan, Togo, Turkmenistan, Uruguay, Uzbekistan, Venezuela (Bolivarian Republic of) and Viet Nam. 5 See resolution S-10/2."
  },
  "agenda_items": [
    "Item 98"
  ],
  "symbol_references": []
}