{
  "symbol": "A/RES/75/208",
  "filename": "A_RES_75_208.pdf",
  "title": "75/208. Follow-up to and implementation of the outcomes of the International Conferences on Financing for Development",
  "text": "United Nations \nA/RES/75/208\n \n \nGeneral Assembly \nDistr.: General \n29 December 2020 \n \n \n20-17637 (E)    060121 \n*2017637* \n \n \nSeventy-fifth session \nAgenda item 18 \nFollow-up to and implementation of the outcomes of the \nInternational Conferences on Financing for Development\n \n \n \n \n \n Resolution adopted by the General Assembly \non 21 December 2020 \n \n \n \n \n[on the report of the Second Committee (A/75/456, para. 10)] \n \n \n 75/208. Follow-up to and implementation of the outcomes of the \nInternational Conferences on Financing for Development \n \n \n \nThe General Assembly, \n \nRecalling its resolutions 70/192 of 22 December 2015, 71/217 of 21 December \n2016, 72/208 of 20 December 2017, 73/223 of 20 December 2018 and 74/207 of \n19 December 2019 on the follow-up to and implementation of the outcomes of the \nInternational Conferences on Financing for Development and its resolution 70/299 of \n29 July 2016 on the follow-up and review of the 2030 Agenda for Sustainable \nDevelopment at the global level, \n \nReaffirming its resolution 69/313 of 27 July 2015 on the Addis Ababa Action \nAgenda of the Third International Conference on Financing for Development, which \nis an integral part of the 2030 Agenda for Sustainable Development, 1 supports and \ncomplements it, helps to contextualize its means of implementation targets with \nconcrete policies and actions, and reaffirms the strong political commitment to \naddress the challenge of financing and creating an enabling environment at all levels \nfor sustainable development in the spirit of global partnership and solidarity, \n \nRecalling the International Conference on Financing for Development, held in \nMonterrey, Mexico, from 18 to 22 March 2002, the Follow-up International \nConference on Financing for Development to Review the Implementation of the \nMonterrey Consensus, held in Doha from 29 November to 2 December 2008, and the \nthird International Conference on Financing for Development, held in Addis Ababa \nfrom 13 to 16 July 2015, \n \nReaffirming its resolution 70/1 of 25 September 2015, entitled \u201cTransforming \nour world: the 2030 Agenda for Sustainable Development\u201d, in which it adopted a \n__________________ \n \n1  Resolution 70/1. \n\nA/RES/75/208 \nFollow-up to and implementation of the outcomes of the \nInternational Conferences on Financing for Development\n \n20-17637\n2/6 \n \ncomprehensive, far-reaching and people-centred set of universal and transformative \nSustainable Development Goals and targets, its commitment to working tirelessly for \nthe full implementation of the Agenda by 2030, its recognition that eradicating \npoverty in all its forms and dimensions, including extreme poverty, is the greatest \nglobal challenge and an indispensable requirement for sustainable development, its \ncommitment to achieving sustainable development in its three dimensions \u2013 \neconomic, social and environmental \u2013 in a balanced and integrated manner, and to \nbuilding upon the achievements of the Millennium Development Goals and seeking \nto address their unfinished business, \n \nReaffirming also the Paris Agreement2 and its early entry into force, \nencouraging all its parties to fully implement the Agreement, and parties to the United \nNations Framework Convention on Climate Change3 that have not yet done so to \ndeposit their instruments of ratification, acceptance, approval or accession, where \nappropriate, as soon as possible, \n \nReiterating the affirmation in the Addis Ababa Action Agenda that achieving \ngender equality, empowering all women and girls and attaining the full realization of \ntheir human rights are essential to achieving sustained, inclusive and equitable \neconomic growth and sustainable development, \n \nNoting with great concern the threat to human health, safety and well-being \ncaused by the coronavirus disease (COVID-19) pandemic, as well as the severe \ndisruption to societies and economies and the devastating impact on lives and \nlivelihoods, and that the poorest and most vulnerable are the hardest hit by the \npandemic, reaffirming the ambition to get back on track to achieve the Sustainable \nDevelopment Goals by designing sustainable and inclusive recovery strategies to \naccelerate progress towards the full implementation of the 2030 Agenda and to help to \nreduce the risk of future shocks, and recognizing that the COVID-19 pandemic requires \na global response based on unity, solidarity and renewed multilateral cooperation, \n \nNoting with concern that the COVID-19 pandemic has triggered a profound \neconomic crisis in countries across the globe, that both developed and developing \ncountries are expected to see large drops in gross domestic product, which are likely \nto be especially severe in countries that depend on commodity exports, remittances \nand tourism, that massive losses of employment and income owing to the crisis have \nalso drastically increased global poverty and widened inequality gaps, especially in \ndeveloping countries, while at the same time the economic repercussions of the \nCOVID-19 pandemic continue to constrain the ability of many countries to respond, \nby limiting their fiscal space and worsening debt distress, and noting the three High-\nLevel Events on Financing for Development in the Era of COVID-19 and Beyond, \nco-convened by the Governments of Canada and Jamaica and the Secretary-General, \nusing a virtual platform, while recognizing that the United Nations-related informal \ninitiatives aimed at promoting dialogue on sustainable, resilient and inclusive \nrecovery on the financing for development process, seeking to foster an inclusive and \ncoordinated response to the COVID-19 pandemic, and contributing to the post-crisis \nrecovery must be coherent, inclusive, and not replace but complement the ongoing \nwork of relevant United Nations intergovernmental processes, \n \nReaffirming the importance of addressing the diverse needs of and challenges \nfaced by countries in special situations, in particular African countries, the least \ndeveloped countries, landlocked developing countries and small island developing \nStates and countries in conflict and post-conflict situations, as well as the specific \nchallenges faced by middle-income countries, \n__________________ \n \n2  Adopted under the UNFCCC in FCCC/CP/2015/10/Add.1, decision 1/CP.21. \n \n3  United Nations, Treaty Series, vol. 1771, No. 30822. \n\nFollow-up to and implementation of the outcomes of the \nInternational Conferences on Financing for Development \nA/RES/75/208\n \n3/6\n20-17637 \n \n \nTaking note of the holding of preparatory meetings for the Economic and Social \nCouncil forum on financing for development follow-up, such as the annual retreat of \nthe Group of Friends of Monterrey, \n \nWelcoming the convening of two virtual informal meetings of the Economic and \nSocial Council forum on financing for development follow-up, on 23 April and 2 June \n2020, \n \nRecalling the intergovernmentally agreed conclusions and recommendations of \nthe forum,4 which decided that the sixth Economic and Social Council forum on \nfinancing for development follow-up would convene from 12 to 15 April 2021 and \nwould include the special high-level meeting of the Council with the Bretton Woods \ninstitutions, the World Trade Organization and the United Nations Conference on \nTrade and Development, and also that the 2021 forum would consider and report in \nits outcome document on the need to hold a follow-up conference, \n \nRecalling also Economic and Social Council decision 2017/206 of 5 October \n2016, \n \nRecalling further the sixth biennial high-level meeting of the Development \nCooperation Forum, held in New York on 21 and 22 May 2018, and its outcomes, 5  \n \nRecalling the High-level Dialogue on Financing for Development held on \n26 September 2019, back-to-back with the high-level political forum on sustainable \ndevelopment under the auspices of the General Assembly, \n \nRecalling also the establishment by the Secretary-General of the Global \nInvestors for Sustainable Development Alliance and the publication of the road map \nfor financing the 2030 Agenda for Sustainable Development, and looking forward to \nfurther updates on the implementation of the strategy of the Secretary-General for \nfinancing the 2030 Agenda for Sustainable Development (2018\u20132021), \n \nReaffirming the outcome document of the second High-level United Nations \nConference on South-South Cooperation, held in Buenos Aires from 20 to 22 March 2019,6  \n \nReiterating the pledge that no one will be left behind, reaffirming the \nrecognition that the dignity of the human person is fundamental, and the wish to see \nthe Goals and targets met for all nations and peoples and for all segments of society, \nand recommitting to endeavour to reach the furthest behind first, \n \nRecommitting to ensuring that no country or person is left behind and to focusing \nour effort where the challenges are greatest, including by ensuring the inclusion and \nparticipation of those who are furthest behind, \n \n1. \nTakes note of the report of the Secretary-General;7  \n \n2. \nEmphasizes the need to work towards the full and timely implementation \nof the Addis Ababa Action Agenda of the Third International Conference on \nFinancing for Development;8  \n \n3. \nTakes note of the report of the Inter-Agency Task Force on Financing for \nDevelopment,9 and notes that progress, though uneven, has been reported in all seven \naction areas of the Addis Ababa Action Agenda, while acknowledging that many \nimplementation gaps persist; \n__________________ \n \n4  See E/FFDF/2020/3. \n \n5  See E/2018/73. \n \n6  Resolution 73/291, annex. \n \n7  A/75/146. \n \n8  Resolution 69/313, annex. \n \n9  Financing for Sustainable Development Report 2020 (United Nations publication, 2020). \n\nA/RES/75/208 \nFollow-up to and implementation of the outcomes of the \nInternational Conferences on Financing for Development\n \n20-17637\n4/6 \n \n \n4. \nWelcomes the intergovernmentally agreed conclusions and recommendations \nof the 2020 Economic and Social Council forum on financing for development \nfollow-up, urges their full, effective and timely implementation, and looks forward to \nstaying engaged so as to assess progress, identify obstacles and challenges in the \nimplementation of the financing for development outcomes and in the delivery of the \nmeans of implementation, promote the sharing of lessons learned from experiences at \nthe national and regional levels, address new and emerging topics of relevance to the \nimplementation of this agenda as the need arises and provide policy recommendations \nfor action by the international community in substantive intergovernmentally agreed \nconclusions and recommendations at the 2021 forum; \n \n5. \nAlso welcomes in this regard the further development of integrated \nnational financing frameworks, in support of nationally owned sustainable \ndevelopment strategies, in order to further implement the Addis Ababa Action \nAgenda, aimed at effectively mobilizing and aligning a wide range of financing \nsources and instruments with the 2030 Agenda for Sustainable Development and \nmaking use of the full potential of all means of implementation; \n \n6. \nTakes note of the summary by the President of the Economic and Social \nCouncil of the 2020 Economic and Social Council forum on financing for \ndevelopment follow-up,10 as well as the summary by the President of the General \nAssembly of the High-level Dialogue on Financing for Development, held on \n26 September 2019;11  \n \n7. \nEmphasizes that timely and adequate planning for the 2021 Economic and \nSocial Council forum on financing for development follow-up is of paramount \nimportance to its substantive work and outcome; \n \n8. \nInvites the President of the Economic and Social Council to take into \nconsideration the deliberations of the 2019 High-level Dialogue on Financing for \nDevelopment and the summary by the President of the Council on the 2020 forum on \nfinancing for development follow-up in the preparation of the 2021 forum; \n \n9. \nRecalls that decisions relating to the Economic and Social Council forum \non financing for development follow-up are to be contained within the forum\u2019s \nintergovernmentally agreed conclusions and recommendations; \n \n10. \nTakes note of the work of the Committee of Experts on International \nCooperation in Tax Matters and the initial contributions made by India to the voluntary \ntrust fund, by Norway to a multi-donor project aimed at supporting the work of the \nCommittee, its subcommittees and related capacity development activities, as well as the \ncontributions by the European Union and other countries in support of the Committee\u2019s \nsubsidiary bodies, and urges Member States to come forward to contribute more to the \ntrust fund in order to further support the participation of developing countries; \n \n11. \nAlso takes note of the holding of the 2020 Global Infrastructure Forum from \n6 to 8 October 2020 in a virtual setting, invites the multilateral development banks to \nprovide a briefing to Member States on the outcome of the Forum, and reiterates that \nthe Forum is mandated to identify and address infrastructure and capacity gaps in \ndeveloping countries, particularly in the least developed countries, landlocked \ndeveloping countries, small island developing States and African countries; \n \n12. Recalls the progress made in operationalizing the three components of the \nTechnology Facilitation Mechanism, and looks forward to the prompt establishment \nof the online platform as part of the Mechanism; \n__________________ \n \n10  A/75/93-E/2020/64. \n \n11  A/74/559. \n\nFollow-up to and implementation of the outcomes of the \nInternational Conferences on Financing for Development \nA/RES/75/208\n \n5/6\n20-17637 \n \n \n13. Also recalls the operationalization of the Technology Bank for the Least \nDeveloped Countries, and invites Member States, as well as international \norganizations, foundations and the private sector, to provide increased voluntary \nfinancial contributions and technical assistance to ensure its full and effective \nimplementation; \n \n14. Further recalls the convening of the fourth annual multi-stakeholder \nforum on science, technology and innovation for the Sustainable Development Goals \nin New York on 14 and 15 May 2019, whose Co-Chairs\u2019 summary12 served as an input \nto the high-level political forum on sustainable development and highlighted, inter \nalia, the promotion of networking and matchmaking among relevant stakeholders, \nespecially innovators, funders and other supporters, to bridge the technology gap for \nthe Sustainable Development Goals, and notes the postponement of the fifth annual \nmulti-stakeholder forum on science, technology and innovation for the Sustainable \nDevelopment Goals, from 12 and 13 May 2020 to 2021, owing to the COVID-19 \npandemic; \n \n15. Recalls that the Addis Ababa Action Agenda provides a global framework \nfor financing sustainable development and is an integral part of the 2030 Agenda for \nSustainable Development, supports and complements it and helps to contextualize the \nmeans of implementation targets with concrete policies and actions, the \nimplementation of which requires following up on, that relate to its seven action areas, \nnamely, domestic public resources; domestic and international private business and \nfinance; international development cooperation; international trade as an engine for \ndevelopment; debt and debt sustainability; addressing systemic issues and science, \ntechnology, innovation and capacity-building; and data, monitoring and follow-up; \n \n16. Reiterates that States will not be able to achieve the ambitious Goals and \ntargets of the 2030 Agenda without a revitalized and enhanced global partnership and \ncomparably ambitious means of implementation, and reaffirms the commitment at the \nvery heart of the 2030 Agenda to leave no one behind and commit to taking more \ntangible steps to support people in vulnerable situations and the most vulnerable \ncountries and to reach the furthest behind first; \n \n17. Notes the policy recommendations of the Intergovernmental Group of \nExperts on Financing for Development of the United Nations Conference on Trade \nand Development, and that the agreed policy recommendations serve as an input to \nthe Economic and Social Council forum on financing for development follow-up in \naccordance with the terms of reference of the Intergovernmental Group of Experts; \n \n18. Also notes that, in order to advance bold and concerted global action to \naddress the impacts on achieving sustainable development in its three dimensions \u2013 \neconomic, social and environmental \u2013 in a balanced and integrated manner, and \nachieve a sustainable, inclusive and resilient recovery, and set the world on a path \ntowards the achievement of the Sustainable Development Goals by 2030, short-term \nCOVID-19 response measures should be geared to supporting medium- and long-term \nsustainable development, both domestic efforts and multilateral action and \nmulti-stakeholder partnerships will be necessary and developing countries will need \ninternational support, and invites the President of the Economic and Social Council \nin consultation with the President of the General Assembly to consider convening a \nspecial segment during the 2021 forum on financing for development follow-up, as a \none-time event, to discuss concrete steps towards a sustainable, inclusive and resilient \nrecovery from the economic downturn caused by the COVID-19 pandemic, in relation \nto the efforts towards the achievement of the Sustainable Development Goals and the \nimplementation of the Addis Ababa Action Agenda;  \n__________________ \n \n12  See E/HLPF/2019/6.  \n\nA/RES/75/208 \nFollow-up to and implementation of the outcomes of the \nInternational Conferences on Financing for Development\n \n20-17637\n6/6 \n \n \n19. Requests the Secretary-General to submit to the General Assembly at its \nseventy-sixth session an action-oriented report, presenting emerging challenges and \nkey accelerators, for a resilient and sustainable recovery from the economic shocks \ncaused by the COVID-19 pandemic, that may be relevant for future discussion in the \nframework of the Economic and Social Council forum on financing for development \nfollow-up; \n \n20. Decides to include in the provisional agenda of its seventy-sixth session \nthe item entitled \u201cFollow-up to and implementation of the outcomes of the \nInternational Conferences on Financing for Development\u201d.  \n \n48th plenary meeting \n21 December 2020 \n \n \n",
  "paragraphs": {
    "1": "Takes note of the report of the Secretary-General;7",
    "2": "Emphasizes the need to work towards the full and timely implementation of the Addis Ababa Action Agenda of the Third International Conference on Financing for Development;8",
    "3": "Takes note of the report of the Inter-Agency Task Force on Financing for Development,9 and notes that progress, though uneven, has been reported in all seven action areas of the Addis Ababa Action Agenda, while acknowledging that many implementation gaps persist; __________________ 4 See E/FFDF/2020/3. 5 See E/2018/73. 6 Resolution 73/291, annex. 7 A/75/146. 8 Resolution 69/313, annex. 9 Financing for Sustainable Development Report 2020 (United Nations publication, 2020). A/RES/75/208 Follow-up to and implementation of the outcomes of the International Conferences on Financing for Development 20-17637 4/6",
    "4": "Welcomes the intergovernmentally agreed conclusions and recommendations of the 2020 Economic and Social Council forum on financing for development follow-up, urges their full, effective and timely implementation, and looks forward to staying engaged so as to assess progress, identify obstacles and challenges in the implementation of the financing for development outcomes and in the delivery of the means of implementation, promote the sharing of lessons learned from experiences at the national and regional levels, address new and emerging topics of relevance to the implementation of this agenda as the need arises and provide policy recommendations for action by the international community in substantive intergovernmentally agreed conclusions and recommendations at the 2021 forum;",
    "5": "Also welcomes in this regard the further development of integrated national financing frameworks, in support of nationally owned sustainable development strategies, in order to further implement the Addis Ababa Action Agenda, aimed at effectively mobilizing and aligning a wide range of financing sources and instruments with the 2030 Agenda for Sustainable Development and making use of the full potential of all means of implementation;",
    "6": "Takes note of the summary by the President of the Economic and Social Council of the 2020 Economic and Social Council forum on financing for development follow-up,10 as well as the summary by the President of the General Assembly of the High-level Dialogue on Financing for Development, held on 26 September 2019;11",
    "7": "Emphasizes that timely and adequate planning for the 2021 Economic and Social Council forum on financing for development follow-up is of paramount importance to its substantive work and outcome;",
    "8": "Invites the President of the Economic and Social Council to take into consideration the deliberations of the 2019 High-level Dialogue on Financing for Development and the summary by the President of the Council on the 2020 forum on financing for development follow-up in the preparation of the 2021 forum;",
    "9": "Recalls that decisions relating to the Economic and Social Council forum on financing for development follow-up are to be contained within the forum\u2019s intergovernmentally agreed conclusions and recommendations;",
    "10": "Takes note of the work of the Committee of Experts on International Cooperation in Tax Matters and the initial contributions made by India to the voluntary trust fund, by Norway to a multi-donor project aimed at supporting the work of the Committee, its subcommittees and related capacity development activities, as well as the contributions by the European Union and other countries in support of the Committee\u2019s subsidiary bodies, and urges Member States to come forward to contribute more to the trust fund in order to further support the participation of developing countries;",
    "11": "Also takes note of the holding of the 2020 Global Infrastructure Forum from 6 to 8 October 2020 in a virtual setting, invites the multilateral development banks to provide a briefing to Member States on the outcome of the Forum, and reiterates that the Forum is mandated to identify and address infrastructure and capacity gaps in developing countries, particularly in the least developed countries, landlocked developing countries, small island developing States and African countries;",
    "12": "Recalls the progress made in operationalizing the three components of the Technology Facilitation Mechanism, and looks forward to the prompt establishment of the online platform as part of the Mechanism; __________________ 10 A/75/93-E/2020/64. 11 A/74/559. Follow-up to and implementation of the outcomes of the International Conferences on Financing for Development A/RES/75/208 5/6 20-17637",
    "13": "Also recalls the operationalization of the Technology Bank for the Least Developed Countries, and invites Member States, as well as international organizations, foundations and the private sector, to provide increased voluntary financial contributions and technical assistance to ensure its full and effective implementation;",
    "14": "Further recalls the convening of the fourth annual multi-stakeholder forum on science, technology and innovation for the Sustainable Development Goals in New York on 14 and 15 May 2019, whose Co-Chairs\u2019 summary12 served as an input to the high-level political forum on sustainable development and highlighted, inter alia, the promotion of networking and matchmaking among relevant stakeholders, especially innovators, funders and other supporters, to bridge the technology gap for the Sustainable Development Goals, and notes the postponement of the fifth annual multi-stakeholder forum on science, technology and innovation for the Sustainable Development Goals, from 12 and 13 May 2020 to 2021, owing to the COVID-19 pandemic;",
    "15": "Recalls that the Addis Ababa Action Agenda provides a global framework for financing sustainable development and is an integral part of the 2030 Agenda for Sustainable Development, supports and complements it and helps to contextualize the means of implementation targets with concrete policies and actions, the implementation of which requires following up on, that relate to its seven action areas, namely, domestic public resources; domestic and international private business and finance; international development cooperation; international trade as an engine for development; debt and debt sustainability; addressing systemic issues and science, technology, innovation and capacity-building; and data, monitoring and follow-up;",
    "16": "Reiterates that States will not be able to achieve the ambitious Goals and targets of the 2030 Agenda without a revitalized and enhanced global partnership and comparably ambitious means of implementation, and reaffirms the commitment at the very heart of the 2030 Agenda to leave no one behind and commit to taking more tangible steps to support people in vulnerable situations and the most vulnerable countries and to reach the furthest behind first;",
    "17": "Notes the policy recommendations of the Intergovernmental Group of Experts on Financing for Development of the United Nations Conference on Trade and Development, and that the agreed policy recommendations serve as an input to the Economic and Social Council forum on financing for development follow-up in accordance with the terms of reference of the Intergovernmental Group of Experts;",
    "18": "Also notes that, in order to advance bold and concerted global action to address the impacts on achieving sustainable development in its three dimensions \u2013 economic, social and environmental \u2013 in a balanced and integrated manner, and achieve a sustainable, inclusive and resilient recovery, and set the world on a path towards the achievement of the Sustainable Development Goals by 2030, short-term COVID-19 response measures should be geared to supporting medium- and long-term sustainable development, both domestic efforts and multilateral action and multi-stakeholder partnerships will be necessary and developing countries will need international support, and invites the President of the Economic and Social Council in consultation with the President of the General Assembly to consider convening a special segment during the 2021 forum on financing for development follow-up, as a one-time event, to discuss concrete steps towards a sustainable, inclusive and resilient recovery from the economic downturn caused by the COVID-19 pandemic, in relation to the efforts towards the achievement of the Sustainable Development Goals and the implementation of the Addis Ababa Action Agenda; __________________ 12 See E/HLPF/2019/6. A/RES/75/208 Follow-up to and implementation of the outcomes of the International Conferences on Financing for Development 20-17637 6/6",
    "19": "Requests the Secretary-General to submit to the General Assembly at its seventy-sixth session an action-oriented report, presenting emerging challenges and key accelerators, for a resilient and sustainable recovery from the economic shocks caused by the COVID-19 pandemic, that may be relevant for future discussion in the framework of the Economic and Social Council forum on financing for development follow-up;",
    "20": "Decides to include in the provisional agenda of its seventy-sixth session the item entitled \u201cFollow-up to and implementation of the outcomes of the International Conferences on Financing for Development\u201d. 48th plenary meeting 21 December 2020"
  },
  "agenda_items": [
    "Item 18"
  ],
  "symbol_references": []
}