{
  "symbol": "A/RES/78/277",
  "filename": "A_RES_78_277.pdf",
  "title": "78/277. Follow-up to the Declaration and Programme of Action on a Culture of Peace",
  "text": "United Nations \nA/RES/78/277\n \n \nGeneral Assembly \nDistr.: General \n7 May 2024 \n \n24-08216 (E)    140524 \n*2408216* \n \n \nSeventy-eighth session \nAgenda item 14 \nCulture of peace \n \n \n \n \n Resolution adopted by the General Assembly \non 2 May 2024 \n \n \n \n \n[without reference to a Main Committee (A/78/L.57)] \n \n \n 78/277. Follow-up to the Declaration and Programme of Action on a \nCulture of Peace \n \n \n \nThe General Assembly, \n \nBearing in mind the Charter of the United Nations, including the purposes and \nprinciples contained therein, and especially the dedication to saving succeeding \ngenerations from the scourge of war, \n \nRecalling the Constitution of the United Nations Educational, Scientific and \nCultural Organization, which states that, \u201csince wars begin in the minds of men, it is \nin the minds of men that the defences of peace must be constructed\u201d, \n \nRecognizing the importance of the Declaration and Programme of Action on a \nCulture of Peace, adopted by the General Assembly on 13 September 1999,1 which \nserve as the universal mandate for the international community, particularly the \nUnited Nations system, for the promotion of a culture of peace and non-violence that \nbenefits humanity, in particular future generations, \n \nRecalling all its previous resolutions on a culture of peace,  \n \nRecalling also the United Nations Millennium Declaration 2  and the 2030 \nAgenda for Sustainable Development, 3 which call for the active promotion of a \nculture of peace, \n \nRecalling further its resolutions 75/201 of 21 December 2020 and 70/262 of \n27 April 2016 on the review of the United Nations peacebuilding architecture, 72/276 \nof 26 April 2018 on the follow-up to the report of the Secretary-General on \n__________________ \n \n1  Resolutions 53/243 A and B. \n \n2  Resolution 55/2. \n \n3  Resolution 70/1. \n\nA/RES/78/277 \nFollow-up to the Declaration and Programme of Action \non a Culture of Peace\n \n24-08216\n2/7 \n \npeacebuilding and sustaining peace and 76/305 of 8 September 2022 on financing for \npeacebuilding, \n \nRecalling its resolutions declaring zones of peace in Central Asia,4 the South \nAtlantic5 and the Indian Ocean,6 and emphasizing the importance of these zones in \nmaintaining stability and security in those regions,  \n \nRecalling also its resolutions on terrorism and violent extremism, as and when \nconducive to terrorism, including resolutions 72/241 of 20 December 2017 on a world \nagainst violence and violent extremism and 77/298 of 30 June 2023 on the eighth \nreview of the United Nations Global Counter-Terrorism Strategy, the Secretary-\nGeneral\u2019s Plan of Action to Prevent Violent Extremism and the establishment of the \nOffice of Counter-Terrorism under resolution 71/291 of 15 June 2017, \n \nRecalling further the 2005 World Summit Outcome adopted at the high-level \nplenary meeting of the General Assembly,7  \n \nWelcoming the observance of 10 December as Human Rights Day,8 9 December \nas the International Day of Commemoration and Dignity of the Victims of the Crime \nof Genocide and of the Prevention of This Crime,9 2 October as the International Day \nof Non-Violence,10 18 June as the International Day for Countering Hate Speech, 11 \n16 May as the International Day of Living Together in Peace, 12 21 August as the \nInternational Day of Remembrance of and Tribute to the Victims of Terrorism, 13 \n4 February as the International Day of Human Fraternity, 14  22 August as the \nInternational Day Commemorating the Victims of Acts of Violence Based on Religion \nor Belief, 15  5 April as the International Day of Conscience, 16  15 March as the \nInternational Day to Combat Islamophobia17 and 27 January as the International Day \nof Commemoration in Memory of the Victims of the Holocaust, 18 as proclaimed by \nthe United Nations, \n \nRecognizing that all efforts made by the United Nations system in general and \nthe international community at large for the prevention of conflicts, the peaceful \nsettlement of disputes, peacekeeping, peacebuilding, mediation, disarmament, \nsustainable development, the promotion of human dignity and human rights, social \ninclusion, democracy, the rule of law, good governance and gender equality at the \nnational and international levels contribute greatly to a culture of peace, \n \nTaking note of the United Nations Strategy and Plan of Action on Hate Speech, \nin which it is proposed that the United Nations system establish and strengthen \npartnerships with new and traditional media to promote the values of tolerance, \nnon-discrimination, pluralism and freedom of opinion and expression, and to address \nhate speech narratives, \n__________________ \n \n4  Resolution 76/299. \n \n5  Resolution 41/11. \n \n6  Resolution 2832 (XXVI). \n \n7  Resolution 60/1. \n \n8  Resolution 423 (V). \n \n9  Resolution 69/323. \n \n10  Resolution 61/271. \n \n11  Resolution 75/309. \n \n12  Resolution 72/130. \n \n13  Resolution 72/165. \n \n14  Resolution 75/200. \n \n15  Resolution 73/296. \n \n16  Resolution 73/329. \n \n17  Resolution 76/254. \n \n18  Resolution 60/7. \n\nFollow-up to the Declaration and Programme of Action \non a Culture of Peace \nA/RES/78/277\n \n3/7\n24-08216 \n \n \nRecognizing that efforts towards peacebuilding and sustaining peace need to \ntake into account the promotion of a culture of peace and vice versa,  \n \nRecalling its resolution 76/6 of 15 November 2021 on the report of the \nSecretary-General entitled \u201cOur Common Agenda\u201d,19 and its follow-up processes,  \n \nRecognizing that the collective well-being, safety, security and prosperity of our \nnations and peoples are deeply intertwined, which requires us to work urgently and \ntogether in accordance with the Charter to address global risks and challenges, find \nviable solutions and accelerate the implementation of agreed frameworks, including \nthe 2030 Agenda for Sustainable Development and the Sustainable Development \nGoals and the Addis Ababa Action Agenda of the Third International Conference on \nFinancing for Development,20 as well as the United Nations Framework Convention \non Climate Change21 and the Paris Agreement,22  \n \nRecognizing also that the open, constructive and respectful debate of ideas, as \nwell as interreligious, interfaith and intercultural dialogue at the local, national, \nregional and international levels, involving civil society, can play a positive role in \nfostering democratic participation, ensuring equality of access to education for \nwomen, especially girls, combating hatred, incitement and violence based on religion \nor belief as well as racism, hate speech and other forms of intolerance, and advancing \nhuman dignity, human fraternity, tolerance and solidarity,  \n \nRecognizing further the importance of respect and understanding for religious \nand cultural diversity throughout the world, of choosing dialogue and negotiations \nover confrontation and of working together and not against each other, \n \nRecalling the report of the Secretary-General,23 which provides an overview of \nthe actions taken across the United Nations system and by Member States to \nimplement the Programme of Action and to promote a culture of peace and \nnon-violence since the adoption by the General Assembly of its resolution 76/68 of \n9 December 2021, \n \nRecalling also its proclamation of the period 2022\u20132032 as the International \nDecade of Indigenous Languages, \n \nRecalling further the proclamations by the United Nations Educational, \nScientific and Cultural Organization, in particular of 21 February as International \nMother Language Day, which aims at protecting, promoting and preserving linguistic \nand cultural diversity and multilingualism, in order to foster and enrich a culture of \npeace, social harmony, cross-cultural dialogue and mutual understanding, of 30 April \nas International Jazz Day, which aims to develop and increase intercultural exchanges \nand understanding between cultures for the purpose of mutual comprehension, \ntolerance and the promotion of a culture of peace, and of 21 March as the International \nDay of Nowruz, which promotes values of peace and solidarity between generations \nand within families as well as reconciliation and neighbourliness, thus contributing to \ncultural diversity and friendship among peoples and different communities, \n \nTaking note of the Transforming Education Summit, convened by the Secretary-\nGeneral from 16 to 19 September 2022 in New York, as well as its pre-Summit, hosted \nby the United Nations Educational, Scientific and Cultural Organization from 28 to \n30 June 2022 in Paris,  \n__________________ \n \n19  A/75/982. \n \n20  Resolution 69/313, annex. \n \n21  United Nations, Treaty Series, vol. 1771, No. 30822. \n \n22  See FCCC/CP/2015/10/Add.1, decision 1/CP.21, annex. \n \n23  A/77/614. \n\nA/RES/78/277 \nFollow-up to the Declaration and Programme of Action \non a Culture of Peace\n \n24-08216\n4/7 \n \n \nTaking note also of Member States\u2019 engagement throughout the Transforming \nEducation Summit process, including through national consultations, and inviting the \nUnited Nations Educational, Scientific and Cultural Organization and relevant \nstakeholders, including the Sustainable Development Goal 4-Education 2030 High-\nlevel Steering Committee, to support Member States, upon their request, in the \ncountry-level implementation of their national commitments made during the \nTransforming Education Summit process,  \n \nWelcoming the efforts of the international community to enhance understanding \nthrough constructive dialogue among civilizations, in particular through various \ninitiatives at the local, national, regional and international levels,  \n \nExpressing its appreciation for the ongoing efforts of the United Nations \nAlliance of Civilizations in promoting a culture of peace through a number of \npractical projects in the areas of youth, education, media and migrations, in \ncollaboration with Governments, international organizations, foundations and civil \nsociety groups, as well as media and the private sector, \n \nTaking note of the ninth United Nations Alliance of Civilizations Forum, held in \nFez, Morocco, on 22 and 23 November 2022 on the theme \u201cTowards an alliance of \npeace: living together as one humanity\u201d,  \n \nRecalling the General Assembly High-level Forum held on 13 September 2019 \non the occasion of the twentieth anniversary of the adoption of the Declaration and \nProgramme of Action and the Chair\u2019s summary of the meeting on the theme \u201cThe \nCulture of Peace: empowering and transforming humanity\u201d,  \n \nWelcoming the General Assembly High-level Forum on the Culture of Peace \nheld on 31 August 2023 on the theme \u201cPromoting a Culture of Peace in the digital \nera\u201d, at which Member States and observers of the General Assembly and other \nstakeholders, such as civil society, private sector and other relevant stakeholders, \nrenewed their commitments to the full and effective implementation of the \nDeclaration and Programme of Action in the context of rapid technological change,  \n \nTaking note of the outcome document of the international conference entitled \n\u201cDialogue is a Guarantee of Peace\u201d, held in Ashgabat on 11 December 2022,24 and \nthe Declaration of the Seventh Congress of the Leaders of World and Traditional \nReligions, held in Astana on 14 and 15 September 2022,25  \n \nNoting with appreciation that the Declaration and Programme of Action \ncontinue to find relevance across the three pillars of the United Nations, which are \ninterconnected and mutually reinforcing, in addressing contemporary global \nchallenges, \n \nRecalling the high-level plenary meeting of the General Assembly, known as the \nNelson Mandela Peace Summit, convened by the President of the Assembly on \n24 September 2018, and the adoption of its political declaration,26  \n \nRecognizing the urgent need to promote and strengthen preventive diplomacy, \ninter alia, through multilateralism, international cooperation and political dialogue, \nand stressing the crucial role of the United Nations in this regard, \n \nRecognizing also the role of women and youth, as well as the contribution of \nchildren and older persons in advancing a culture of peace, and in particular the \nimportance of ensuring gender equality and the empowerment of women and girls, \nwith the aim of advancing the full, equal and meaningful participation of women in \n__________________ \n \n24  A/77/651, annex. \n \n25  A/77/360, annex. \n \n26  Resolution 73/1. \n\nFollow-up to the Declaration and Programme of Action \non a Culture of Peace \nA/RES/78/277\n \n5/7\n24-08216 \n \nthe prevention and resolution of conflicts, in peacebuilding, as well as in activities \npromoting a culture of peace, including in post-conflict situations, \n \nNoting the important and positive contribution of youth in efforts to counter \nterrorism and prevent violent extremism as and when conducive to terrorism, as well \nas for the promotion of peace and security, sustainable development and human rights, \nand the importance of the full, effective, constructive and inclusive participation of \nyouth in decision-making, and noting in this regard the establishment of the United \nNations Youth Office, \n \nRecalling the adoption by the General Conference of the United Nations \nEducational, Scientific and Cultural Organization at its thirty-sixth session of a \nprogramme of action for a culture of peace and non-violence, and noting that the \nobjectives of that programme of action are in line with the Declaration and \nProgramme of Action on a Culture of Peace adopted by the General Assembly,  \n \nRecognizing the activities of the United Nations Educational, Scientific and \nCultural Organization related to the culture of peace and non-violence and their focus \non concrete actions at the global, regional and subregional levels, and noting its \nsupport for the Member States, upon their request, in promoting the culture of peace \nat the national level,  \n \nNoting with deep concern that the coronavirus disease (COVID-19) pandemic \nhas led to a rise in hate speech, stigmatization, racism and xenophobia, exacerbated \npre-existing inequalities in income, opportunities, access to information and \ncommunications technologies, health coverage and social protection, deepened \ngender inequality, and created new challenges with regard to access to health-care \nservices and vaccines,  \n \nRecognizing that the digital sphere and its ongoing transformation are an \nimportant area for global action on building a culture of peace, \n \nNoting the initiatives of civil society, in collaboration with Governments, to \nstrengthen civilian capacities to enhance the physical safety of vulnerable populations \nunder threat of violence and to promote the peaceful settlement of disputes, \n \nEncouraging the continued and increasing efforts and activities on the part of \ncivil society organizations throughout the world in advancing a culture of peace as \nenvisaged in the Declaration and Programme of Action, \n \n1. \nReiterates that the objective of the effective implementation of the \nProgramme of Action on a Culture of Peace is to strengthen further the global \nmovement for a culture of peace, and calls upon all concerned to renew their attention \nto this objective; \n \n2. \nInvites Member States to continue to place greater emphasis on and expand \ntheir activities promoting a culture of peace at the national, regional and international \nlevels and to ensure that peace and non-violence are fostered at all levels; \n \n3. \nInvites the entities of the United Nations system, within their existing \nmandates, to integrate, as appropriate, the eight action areas of the Programme of \nAction into their programmes of activities, focusing on promoting a culture of peace \nand non-violence at the national, regional and international levels;  \n \n4. \nCommends the United Nations Educational, Scientific and Cultural \nOrganization for strengthening efforts to mobilize all relevant stakeholders within and \noutside the United Nations system in support of a culture of peace, and invites the \nOrganization to continue to enhance communication and outreach, including through \nthe culture of peace website; \n\nA/RES/78/277 \nFollow-up to the Declaration and Programme of Action \non a Culture of Peace\n \n24-08216\n6/7 \n \n \n5. \nCommends the practical initiatives and actions by relevant United Nations \nbodies, including the United Nations Children\u2019s Fund, the United Nations Entity for \nGender Equality and the Empowerment of Women (UN-Women) and the University \nfor Peace, as well as their activities in further promoting a culture of peace and \nnon-violence, in particular the promotion of peace education and activities related to \nspecific areas identified in the Programme of Action, and encourages them to continue \nand further strengthen and expand their efforts; \n \n6. \nStresses the importance of addressing the underlying drivers of violence \nand conflict to promote a culture of peace;  \n \n7. \nEncourages Member States, United Nations entities and other relevant \nactors to adopt a holistic approach to the cross-cutting dimensions of peace, \ndevelopment, humanitarian action and human rights in order to prevent the recurrence \nof conflict and violence and build lasting peace;  \n \n8. \nUnderlines that early childhood development contributes to the \ndevelopment of more peaceful societies through advancing equality, tolerance, human \ndevelopment and promoting human rights, and calls for investment in early childhood \neducation, including through effective policies and practices, towards promoting a \nculture of peace; \n \n9. \nEncourages Member States, United Nations entities, regional and \nsubregional organizations and relevant actors to consider instituting mechanisms to \ninvolve youth in the promotion of a culture of peace, tolerance and intercultural and \ninterreligious dialogue and develop, as appropriate, an understanding of respect for \nhuman dignity, pluralism and diversity, including, as appropriate, through education \nprogrammes, that could discourage their participation in acts of terrorism, violent \nextremism as and when conducive to terrorism, violence, xenophobia and all forms \nof discrimination; \n \n10. Encourages the United Nations Alliance of Civilizations to increase its \nactivities that focus on peace education and global citizenship education in order to \nenhance an understanding among young people of values such as peace, tolerance, \nopenness, inclusion and mutual respect, which are essential in developing a culture \nof peace;  \n \n11. \nEncourages the United Nations peacebuilding architecture to continue to \npromote peacebuilding and sustaining peace activities, as outlined in its resolutions \n72/276 and 75/201, and to advance a culture of peace and non-violence in post-\nconflict peacebuilding efforts at the country level, and recognizes the important role \nof the Peacebuilding Commission in this regard; \n \n12. Emphasizes the critical importance of an inclusive, resilient and \nsustainable recovery from the COVID-19 pandemic, and in this regard calls upon \nStates to promote the values of a culture of peace, inter alia, in countering rising \ninequalities, discrimination, exclusion, hate crimes and violence;  \n \n13. Urges the appropriate authorities to provide age-appropriate education in \nchildren\u2019s schools that builds a culture of peace and non-violence, including lessons \nin mutual understanding, respect, tolerance, active and global citizenship and human \nrights;  \n \n14. Encourages the involvement of media, especially the mass media, in \npromoting a culture of peace and non-violence, with particular regard to children and \nyoung people; \n \n15. Commends civil society, non-governmental organizations and young \npeople for their activities in further promoting a culture of peace and non-violence, \n\nFollow-up to the Declaration and Programme of Action \non a Culture of Peace \nA/RES/78/277\n \n7/7\n24-08216 \n \nincluding through their campaign to raise awareness on a culture of peace and the \npeaceful settlement of disputes; \n \n16. Encourages civil society and non-governmental organizations to further \nstrengthen their efforts to promote a culture of peace, inter alia, by adopting their own \nprogramme of activities to complement the initiatives of Member States, the United \nNations system and other international and regional organizations, in line with the \nDeclaration and Programme of Action; \n \n17. Invites Member States, all entities of the United Nations system and civil \nsociety organizations to accord increasing attention to their observance of the \nInternational Day of Peace on 21 September each year as a day of global ceasefire \nand non-violence, in accordance with its resolution 55/282 of 7 September 2001, and \nof the International Day of Non-Violence on 2 October, in accordance with its \nresolution 61/271 of 15 June 2007; \n \n18. Notes that 2024 will mark the twenty-fifth anniversary of the adoption of \nthe Declaration on a Culture of Peace by the United Nations at the fifty-third session \nof the General Assembly in 1999; \n \n19. Invites Member States, United Nations entities, international and regional \norganizations and other relevant stakeholders, including civil society, the private \nsector, academia and the media, to commemorate the anniversary in an appropriate \nmanner, including through educational and public awareness-raising activities; \n \n20. Requests the President of the General Assembly to convene, within \nexisting resources, a day-long high-level forum during its seventy-eighth session to \ncommemorate the twenty-fifth anniversary of the adoption of the Declaration and \nProgramme of Action on a Culture of Peace; \n \n21. Invites the Secretary-General, within existing resources, in consultation \nwith the Member States and taking into account the observations of civil society \norganizations, to explore mechanisms and strategies, in particular strategies in the \nsphere of information and communications technology, for the implementation of the \nDeclaration and Programme of Action and to initiate outreach efforts to increase \nglobal awareness of the Programme of Action and its eight areas of action aimed at \ntheir implementation, including through public information activities by the \nDepartment of Global Communications of the Secretariat; \n \n22. Requests the Secretary-General to submit to the General Assembly at its \nseventy-ninth session a report, within existing resources, on actions taken by Member \nStates, on the basis of information provided by them, and those taken system-wide by \nall concerned entities of the United Nations to implement the present resolution; \n \n23. Decides to include in the provisional agenda of its seventy-ninth session \nthe item entitled \u201cCulture of peace\u201d. \n \n77th plenary meeting \n2 May 2024 \n \n",
  "paragraphs": {
    "1": "Reiterates that the objective of the effective implementation of the Programme of Action on a Culture of Peace is to strengthen further the global movement for a culture of peace, and calls upon all concerned to renew their attention to this objective;",
    "2": "Invites Member States to continue to place greater emphasis on and expand their activities promoting a culture of peace at the national, regional and international levels and to ensure that peace and non-violence are fostered at all levels;",
    "3": "Invites the entities of the United Nations system, within their existing mandates, to integrate, as appropriate, the eight action areas of the Programme of Action into their programmes of activities, focusing on promoting a culture of peace and non-violence at the national, regional and international levels;",
    "4": "",
    "5": "Commends the practical initiatives and actions by relevant United Nations bodies, including the United Nations Children\u2019s Fund, the United Nations Entity for Gender Equality and the Empowerment of Women (UN-Women) and the University for Peace, as well as their activities in further promoting a culture of peace and non-violence, in particular the promotion of peace education and activities related to specific areas identified in the Programme of Action, and encourages them to continue and further strengthen and expand their efforts;",
    "6": "Stresses the importance of addressing the underlying drivers of violence and conflict to promote a culture of peace;",
    "7": "Encourages Member States, United Nations entities and other relevant actors to adopt a holistic approach to the cross-cutting dimensions of peace, development, humanitarian action and human rights in order to prevent the recurrence of conflict and violence and build lasting peace;",
    "8": "Underlines that early childhood development contributes to the development of more peaceful societies through advancing equality, tolerance, human development and promoting human rights, and calls for investment in early childhood education, including through effective policies and practices, towards promoting a culture of peace;",
    "9": "Encourages Member States, United Nations entities, regional and subregional organizations and relevant actors to consider instituting mechanisms to involve youth in the promotion of a culture of peace, tolerance and intercultural and interreligious dialogue and develop, as appropriate, an understanding of respect for human dignity, pluralism and diversity, including, as appropriate, through education programmes, that could discourage their participation in acts of terrorism, violent extremism as and when conducive to terrorism, violence, xenophobia and all forms of discrimination;",
    "10": "Encourages the United Nations Alliance of Civilizations to increase its activities that focus on peace education and global citizenship education in order to enhance an understanding among young people of values such as peace, tolerance, openness, inclusion and mutual respect, which are essential in developing a culture of peace;",
    "11": "Encourages the United Nations peacebuilding architecture to continue to promote peacebuilding and sustaining peace activities, as outlined in its resolutions 72/276 and 75/201, and to advance a culture of peace and non-violence in post- conflict peacebuilding efforts at the country level, and recognizes the important role of the Peacebuilding Commission in this regard;",
    "12": "Emphasizes the critical importance of an inclusive, resilient and sustainable recovery from the COVID-19 pandemic, and in this regard calls upon States to promote the values of a culture of peace, inter alia, in countering rising inequalities, discrimination, exclusion, hate crimes and violence;",
    "13": "Urges the appropriate authorities to provide age-appropriate education in children\u2019s schools that builds a culture of peace and non-violence, including lessons in mutual understanding, respect, tolerance, active and global citizenship and human rights;",
    "14": "Encourages the involvement of media, especially the mass media, in promoting a culture of peace and non-violence, with particular regard to children and young people;",
    "15": " including through their campaign to raise awareness on a culture of peace and the peaceful settlement of disputes;",
    "16": "Encourages civil society and non-governmental organizations to further strengthen their efforts to promote a culture of peace, inter alia, by adopting their own programme of activities to complement the initiatives of Member States, the United Nations system and other international and regional organizations, in line with the Declaration and Programme of Action;",
    "17": "Invites Member States, all entities of the United Nations system and civil society organizations to accord increasing attention to their observance of the International Day of Peace on 21 September each year as a day of global ceasefire and non-violence, in accordance with its resolution 55/282 of 7 September 2001, and of the International Day of Non-Violence on 2 October, in accordance with its resolution 61/271 of 15 June 2007;",
    "18": "Notes that 2024 will mark the twenty-fifth anniversary of the adoption of the Declaration on a Culture of Peace by the United Nations at the fifty-third session of the General Assembly in 1999;",
    "19": "Invites Member States, United Nations entities, international and regional organizations and other relevant stakeholders, including civil society, the private sector, academia and the media, to commemorate the anniversary in an appropriate manner, including through educational and public awareness-raising activities;",
    "20": "Requests the President of the General Assembly to convene, within existing resources, a day-long high-level forum during its seventy-eighth session to commemorate the twenty-fifth anniversary of the adoption of the Declaration and Programme of Action on a Culture of Peace;",
    "21": "Invites the Secretary-General, within existing resources, in consultation with the Member States and taking into account the observations of civil society organizations, to explore mechanisms and strategies, in particular strategies in the sphere of information and communications technology, for the implementation of the Declaration and Programme of Action and to initiate outreach efforts to increase global awareness of the Programme of Action and its eight areas of action aimed at their implementation, including through public information activities by the Department of Global Communications of the Secretariat;",
    "22": "Requests the Secretary-General to submit to the General Assembly at its seventy-ninth session a report, within existing resources, on actions taken by Member States, on the basis of information provided by them, and those taken system-wide by all concerned entities of the United Nations to implement the present resolution;",
    "23": "Decides to include in the provisional agenda of its seventy-ninth session the item entitled \u201cCulture of peace\u201d."
  },
  "agenda_items": [
    "Item 14"
  ],
  "symbol_references": [
    "A/78/L.57"
  ]
}