{
  "symbol": "A/RES/76/269",
  "filename": "A_RES_76_269.pdf",
  "title": "76/269. International Day of Women in Diplomacy",
  "text": "United Nations \nA/RES/76/269\n \n \nGeneral Assembly \nDistr.: General \n22 June 2022 \n \n22-09648 (E)    270622 \n*2209648* \n \n \nSeventy-sixth session \nAgenda item 29 \nAdvancement of women \n \n \n \n \n Resolution adopted by the General Assembly \non 20 June 2022 \n \n \n \n \n[without reference to a Main Committee (A/76/L.66 and A/76/L.66/Add.1)] \n \n \n 76/269. International Day of Women in Diplomacy \n \n \n \nThe General Assembly, \n \nRecalling its resolutions 53/199 of 15 December 1998 and 61/185 of \n20 December 2006 on the proclamation of international years and Economic and \nSocial Council resolution 1980/67 of 25 July 1980 on international years and \nanniversaries, \n \nReaffirming the 2030 Agenda for Sustainable Development and that gender \nequality and the empowerment of all women and girls will make a crucial contribution \nto progress across all the Sustainable Development Goals and targets and that the \nsystematic mainstreaming of a gender perspective in the implementation of the 2030 \nAgenda is crucial, \n \nRecognizing the important contributions that women make to diplomacy, \n \nNoting the underrepresentation of women in diplomacy, \n \nWelcoming the efforts of the United Nations system to advance gender parity, \n \nReaffirming that the active participation of women, on equal terms with men, at \nall levels of decision-making is essential to the achievement of equality, sustainable \ndevelopment, peace, democracy and diplomacy, \n \n1. \nDecides to proclaim 24 June of each year the International Day of Women \nin Diplomacy; \n \n2. \nInvites all Member States, organizations of the United Nations system, \nother international and regional organizations, and civil society, including \nnon-governmental organizations, academic institutions, associations of women \ndiplomats where they exist and other relevant stakeholders to observe the \nInternational Day of Women in Diplomacy annually in a manner that each considers \nmost appropriate, including through education and public awareness-raising \n\nA/RES/76/269 \nInternational Day of Women in Diplomacy\n \n22-09648\n2/2 \n \nactivities, in order to promote the full and equal participation of women at all levels \nof diplomacy; \n \n3. \nStresses that the cost of all activities that may arise from the \nimplementation of the present resolution should be met from voluntary contributions; \n \n4. \nRequests the Secretary-General to bring the present resolution to the \nattention of all Member States, the organizations of the United Nations system and \ncivil society organizations for appropriate observance of the International Day of \nWomen in Diplomacy. \n \n84th plenary meeting \n20 June 2022 \n \n",
  "paragraphs": {
    "1": "Decides to proclaim 24 June of each year the International Day of Women in Diplomacy;",
    "2": " activities, in order to promote the full and equal participation of women at all levels of diplomacy;",
    "3": "Stresses that the cost of all activities that may arise from the implementation of the present resolution should be met from voluntary contributions;",
    "4": "Requests the Secretary-General to bring the present resolution to the attention of all Member States, the organizations of the United Nations system and civil society organizations for appropriate observance of the International Day of Women in Diplomacy."
  },
  "agenda_items": [
    "Item 29"
  ],
  "symbol_references": [
    "A/76/L.66"
  ]
}