{
  "symbol": "A/RES/79/193",
  "filename": "A_RES_79_193.pdf",
  "title": "79/193. Proclamation of the Second International Decade for People of African Descent",
  "text": "United Nations \nA/RES/79/193\n \nGeneral Assembly \nDistr.: General \n23 December 2024 \n24-24232 (E) \n*2424232* \n \n \nSeventy-ninth session \nAgenda item 69 (b) \nElimination of racism, racial discrimination, xenophobia and \nrelated intolerance: comprehensive implementation of and \nfollow-up to the Durban Declaration and Programme of Action \n \n \n \n \n Resolution adopted by the General Assembly \non 17 December 2024 \n \n \n[without reference to a Main Committee (A/79/L.25)] \n \n \n 79/193. Proclamation of the Second International Decade for People of \nAfrican Descent \n \n \n \nThe General Assembly, \n \nReaffirming the paramount importance of universal adherence to and the full \nand effective implementation of the International Convention on the Elimination of All \nForms of Racial Discrimination,1 adopted by the General Assembly in its resolution \n2106 A (XX) of 21 December 1965, in addressing the scourges of racism and racial \ndiscrimination, \n \nRecalling its resolution 52/111 of 12 December 1997, by which it decided to \nconvene the World Conference against Racism, Racial Discrimination, Xenophobia \nand Related Intolerance, and its resolutions 56/266 of 27 March 2002, 57/195 of \n18 December 2002, 58/160 of 22 December 2003, 59/177 of 20 December 2004 and \n60/144 of 16 December 2005, which guided the comprehensive follow-up to the \nWorld Conference and the effective implementation of the Durban Declaration and \nProgramme of Action,2 \n \nReiterating that all human beings are born free and equal in dignity and rights \nand have the potential to contribute constructively to the development and well-being \nof their societies, and that any doctrine of racial superiority is scientifically false, \nmorally condemnable, socially unjust and dangerous and must be rejected, together \nwith theories that attempt to determine the existence of separate human races, \n_______________ \n \n1 United Nations, Treaty Series, vol. 660, No. 9464. \n \n2 See A/CONF.189/12 and A/CONF.189/12/Corr.1, chap. I. \n\nA/RES/79/193 \nProclamation of the Second International Decade for People of \nAfrican Descent\n \n24-24232\n2/3 \n \n \nAcknowledging the efforts and initiatives undertaken by States to prohibit \ndiscrimination, systemic and structural racism, and segregation and to engender the \nfull enjoyment of economic, social and cultural as well as civil and political rights,  \n \nEmphasizing that, despite efforts in this regard, millions of human beings \ncontinue to be victims of racism, racial discrimination, xenophobia and related \nintolerance, including their contemporary manifestations, some of which take violent \nforms,  \n \nRecalling the commitments under the Durban Declaration and Programme of \nAction that recognize the importance of enhancing national action and international \ncooperation and the calls contained in the Declaration urging the participation of \npeople of African descent in all political, civil, economic, social and cultural aspects \nof society,  \n \nRecalling with appreciation its resolution 68/237 of 23 December 2013, by \nwhich it proclaimed the International Decade for People of African Descent, and the \nprogramme of activities for the implementation of the International Decade for People \nof African Descent adopted in its resolution 69/16 of 18 November 2014,  \n \nEmphasizing its resolution 64/169 of 18 December 2009, by which it proclaimed \n2011 as the International Year for People of African Descent, \n \nRecalling its resolutions 3057 (XXVIII) of 2 November 1973, 38/14 of \n22 November 1983 and 48/91 of 20 December 1993, by which it proclaimed the three \nDecades to Combat Racism and Racial Discrimination, and conscious of the fact that \ntheir objectives are yet to be attained,  \n \nConsidering that the International Decade for People of African Descent has \nprovided a framework that fostered action by States, international and regional \norganizations, civil society, people of African descent and other stakeholders and \ncontributed to the progressive consolidation of an international agenda for people of \nAfrican descent, while noting that much remains to be done to ensure that all people \nof African descent can fully and effectively enjoy the benefits of sustainable \ndevelopment and all their human rights,  \n \nRecalling its resolution 75/170 of 16 December 2020, by which it proclaimed \n31 August as the International Day for People of African Descent, and its resolution \n78/323 of 13 August 2024, by which it proclaimed 25 July as the International Day \nof Women and Girls of African Descent,  \n \nUnderlining its resolution 78/234 of 22 December 2023, in which it requested \nthe President of the General Assembly to take into consideration the programme of \nactivities for the implementation of the International Decade for People of African \nDescent, drafted by the Intergovernmental Working Group on the Effective \nImplementation of the Durban Declaration and Programme of Action and adopted in \nresolution 69/16, and the theme of the International Decade for People of African \nDescent, \u201cPeople of African descent: recognition, justice and development\u201d, with a \nview to proclaiming the decade starting in 2025 the Second International Decade for \nPeople of African Descent,  \n \nReaffirming its resolution 75/314 of 2 August 2021, by which it established the \nPermanent Forum on People of African Descent as a consultative mechanism for \npeople of African descent and other relevant stakeholders as a platform for improving \nthe safety and quality of life and livelihoods of people of African descent, as well as \nan advisory body to the Human Rights Council, in line with paragraph 29 (i) of the \nprogramme of activities for the implementation of the International Decade for People \nof African Descent, and noting the convening of the first three sessions of the \n\nProclamation of the Second International Decade for People of \nAfrican Descent \nA/RES/79/193\n \n3/3\n24-24232 \n \nPermanent Forum on People of African Descent, in which there was large \nparticipation of civil society and people of African descent from around the world,  \n \n1. \nProclaims the Second International Decade for People of African Descent, \ncommencing on 1 January 2025 and ending on 31 December 2034, with the theme \n\u201cPeople of African descent: recognition, justice and development\u201d, to be officially \nlaunched immediately following the adoption of the present resolution by the General \nAssembly;  \n \n2. \nDecides to extend the programme of activities for the implementation of \nthe International Decade for People of African Descent adopted in resolution 69/16, \nwith a view to ensuring continuing efforts in promoting the respect, protection and \nfulfilment of all human rights and fundamental freedoms of people of African descent, \nand requests the Office of the United Nations High Commissioner for Human Rights \nto provide the necessary support in this regard;  \n \n3. \nRequests the President of the General Assembly to conduct consultations \nwith Member States and other relevant stakeholders regarding a possible update of \nthe programme of activities as contained in resolution 69/16, for consideration by the \nGeneral Assembly during its eightieth session;  \n \n4. \nRequests the continued allocation of predictable funding from the regular \nbudget of the United Nations for the effective and efficient implementation of the \nprogramme of activities and ongoing activities under the International Decade \ncontained in resolution 69/16, and invites Member States and other donors to provide \nextrabudgetary resources for this purpose; \n \n5. \nRequests the President of the General Assembly to convene a midterm \nreview to take stock of the progress made and decide on further necessary actions \nbefore the eighty-fourth session of the Assembly;  \n \n6. \nAlso requests the President of the General Assembly to convene a final \nassessment of the Second International Decade, to take place within the framework \nof a high-level international event at the eighty-eighth session of the Assembly, one \nyear before the closure of the Decade in 2034. \n \n53rd plenary meeting \n17 December 2024 \n \n",
  "paragraphs": {
    "1": "Proclaims the Second International Decade for People of African Descent, commencing on 1 January 2025 and ending on 31 December 2034, with the theme \u201cPeople of African descent: recognition, justice and development\u201d, to be officially launched immediately following the adoption of the present resolution by the General Assembly;",
    "2": "Decides to extend the programme of activities for the implementation of the International Decade for People of African Descent adopted in resolution 69/16, with a view to ensuring continuing efforts in promoting the respect, protection and fulfilment of all human rights and fundamental freedoms of people of African descent, and requests the Office of the United Nations High Commissioner for Human Rights to provide the necessary support in this regard;",
    "3": "Requests the President of the General Assembly to conduct consultations with Member States and other relevant stakeholders regarding a possible update of the programme of activities as contained in resolution 69/16, for consideration by the General Assembly during its eightieth session;",
    "4": "Requests the continued allocation of predictable funding from the regular budget of the United Nations for the effective and efficient implementation of the programme of activities and ongoing activities under the International Decade contained in resolution 69/16, and invites Member States and other donors to provide extrabudgetary resources for this purpose;",
    "5": "Requests the President of the General Assembly to convene a midterm review to take stock of the progress made and decide on further necessary actions before the eighty-fourth session of the Assembly;",
    "6": "Also requests the President of the General Assembly to convene a final assessment of the Second International Decade, to take place within the framework of a high-level international event at the eighty-eighth session of the Assembly, one year before the closure of the Decade in 2034."
  },
  "agenda_items": [
    "Item 69"
  ],
  "symbol_references": [
    "A/79/L.25"
  ]
}