{
  "symbol": "A/RES/72/18",
  "filename": "A_RES_72_18.pdf",
  "title": "72/18. Report on the activities of the Office of Internal Oversight Services",
  "text": "United Nations \nA/RES/72/18\n \n \nGeneral Assembly \nDistr.: General \n5 December 2017 \n \n17-21454 (E)    071217     \n*1721454* \n \n \nSeventy-second session \nAgenda items 134 and 145 \n \n \n \n \n Resolution adopted by the General Assembly  \non 1 December 2017 \n \n \n \n \n[on the report of the Fifth Committee (A/72/610)] \n \n \n \n72/18. Report on the activities of the Office of Internal  \nOversight Services \n \n \n \nThe General Assembly, \n \nI \nActivities of the Office of Internal Oversight Services \n \n \nRecalling its resolutions 48/218 B of 29 July 1994, 54/244 of 23 December \n1999, 59/272 of 23 December 2004, 60/259 of 8 May 2006, 63/265 of 24 December \n2008, 64/232 of 22 December 2009, 64/263 of 29 March 2010, 65/250 of \n24 December 2010, 66/236 of 24 December 2011, 67/258 of 12 April 2013, 68/21 of \n4 December 2013, 69/252 of 29 December 2014, 70/111 of 14 December 2015 and \n71/7 of 27 October 2016,  \n \nHaving considered the report of the Office of Internal Oversight Services on \nits activities for the period from 1 July 2016 to 30 June 2017,1 \n \n1. \nReaffirms its primary role in the consideration of and action taken on \nreports submitted to it;  \n \n2. \nAlso reaffirms its oversight role and the role of the Fifth Committee in \nadministrative and budgetary matters;  \n \n3. \nFurther reaffirms the independence and the separate and distinct roles of \nthe internal and external oversight mechanisms;  \n \n4. \nRecalls that the Office of Internal Oversight Services of the Secretariat \nshall exercise operational independence relating to the performance of its internal \noversight functions, under the authority of the Secretary-General, in accordance \nwith the relevant resolutions;  \n__________________ \n \n1  A/72/330 (Part I) and A/72/330 (Part I)/Add.1.  \n\nA/RES/72/18 \nReport on the activities of the Office of Internal Oversight Services\n \n17-21454 \n2/3 \n \n \n5. \nReaffirms the operational independence of the Office, which is vital for \nensuring that its internal oversight functions are carried out in a credible, factual and \nunbiased manner, and also reaffirms the authority of the Office to initiate, carry out \nand report on any action that it considers necessary to fulfil its oversight functions;  \n \n6. \nEncourages United Nations internal and external oversight bodies to \nfurther enhance the level of cooperation with one another, such as through joint \nwork-planning sessions, without prejudice to the independence of each;  \n \n7. \nRecognizes the important roles of the oversight bodies in contributing to \nimprovements in the effectiveness, transparency and accountability of the \nOrganization;  \n \n8. \nRequests the Secretary-General to continue to promote effective \ncoordination and collaboration with regard to the audit, evaluation and investigation \nfunctions of the Office in order to ensure an integrated approach to its oversight \nfunction, bearing in mind the operational independence of the Office; \n \n9. \nAlso requests the Secretary-General to ensure that the annual reports of the \nOffice continue to include a brief description of any impairment of its independence; \n \n10. Takes note of the report of the Office;1 \n \n11. \nRequests the Secretary-General to ensure that all relevant resolutions \npertaining to the work of the Office are brought to the attention of the relevant \nmanagers;  \n \n12. Also requests the Secretary-General to ensure that all relevant \nresolutions, including those of a cross-cutting nature, are brought to the attention of \nrelevant managers and that the Office also takes those resolutions into account in \nthe conduct of its activities; \n \n13. Further requests the Secretary-General to continue to ensure the full \nimplementation of the accepted recommendations of the Office, including those \nrelating to cost avoidance, recovery of overpayments, efficiency gains and other \nimprovements, in a prompt and timely manner, and to provide detailed justifications \nin cases in which recommendations of the Office are not accepted; \n \n14. Welcomes the efforts of the Office to promote the Organization\u2019s zero-\ntolerance approach to fraud and corruption, and encourages the Office to continue to \ninvestigate and audit cases of fraud and corruption;  \n \n15. Notes the role of the Office as the central intake mechanism for fraud and \ncorruption allegations in the Secretariat, and encourages the Office to consider calls \nto expand the reporting and recording of all forms of misconduct as part of renewed \nefforts to strengthen and professionalize the investigations function of the United \nNations system; \n \n16. Welcomes the progress made by the Office in reducing the average time \ntaken to complete investigations and associated reports, and encourages the Office \nto continue to reduce the average length of time to six months; \n \n17. Notes the efforts of the Office to bring clarity and transparency to the \nconclusions and recommendations of audits, and in this regard encourages the \nOffice to standardize its approach, as appropriate; \n \n18. Welcomes the efforts and progress made by the Office in reducing the \nnumber of vacant posts, and requests the Secretary-General to continue to make \nevery effort to fill the remaining vacant posts, particularly in the Investigations \nDivision and in the field, in accordance with the relevant provisions governing \nrecruitment in the United Nations; \n \n\nReport on the activities of the Office of Internal Oversight Services \nA/RES/72/18\n \n3/3 \n17-21454 \n \nII \nActivities of the Independent Audit Advisory Committee \n \n \nRecalling its resolutions 61/275 of 29 June 2007, 64/263, section II of its \nresolution 66/236, section II of its resolution 67/258, section II of its resolution \n68/21, section II of its resolution 69/252, section II of its resolution 70/111 and \nsection II of its resolution 71/7,  \n \nHaving considered the report of the Independent Audit Advisory Committee \non its activities for the period from 1 August 2016 to 31 July 2017,2  \n \n1. \nNotes with appreciation the work of the Independent Audit Advisory \nCommittee;  \n \n2. \nReaffirms the terms of reference of the Committee, as contained in the \nannex to its resolution 61/275;  \n \n3. \nEndorses the observations, comments and recommendations contained in \nparagraphs 17, 20, 23, 27, 30, 31, 33, 39, 43, 47, 55, 58, 60, 63, 66, 74, 79, 82, 86, \n92, 93, 94, 98 and 102 of the report of the Committee; 2  \n \n4. \nEncourages the Committee to continue its consultations with all relevant \nUnited Nations bodies, as appropriate;  \n \n5. \nInvites the Committee to continue to examine the operational \nindependence of the Office of Internal Oversight Services, including on budgetary \nmatters; \n \nIII \nJoint Inspection Unit \n \n \nHaving considered the reports of the Joint Inspection Unit on the state of the \ninternal audit function in the United Nations system3 and on donor-led assessments \nof the United Nations system organizations,4 as well as the related notes by the \nSecretary-General transmitting his comments and those of the United Nations \nSystem Chief Executives Board for Coordination thereon, 5 \n \nNotes with appreciation the reports of the Joint Inspection Unit.3,4 \n \n61st plenary meeting \n1 December 2017 \n \n__________________ \n \n2  A/72/295. \n \n3  A/72/120. \n \n4  A/72/298. \n \n5  A/72/120/Add.1 and A/72/298/Add.1. \n",
  "paragraphs": {
    "1": "Notes with appreciation the work of the Independent Audit Advisory Committee;",
    "2": "Reaffirms the terms of reference of the Committee, as contained in the annex to its resolution 61/275;",
    "3": "Endorses the observations, comments and recommendations contained in paragraphs 17, 20, 23, 27, 30, 31, 33, 39, 43, 47, 55, 58, 60, 63, 66, 74, 79, 82, 86, 92, 93, 94, 98 and 102 of the report of the Committee; 2",
    "4": "Encourages the Committee to continue its consultations with all relevant United Nations bodies, as appropriate;",
    "5": "Invites the Committee to continue to examine the operational independence of the Office of Internal Oversight Services, including on budgetary matters; III Joint Inspection Unit Having considered the reports of the Joint Inspection Unit on the state of the internal audit function in the United Nations system3 and on donor-led assessments of the United Nations system organizations,4 as well as the related notes by the Secretary-General transmitting his comments and those of the United Nations System Chief Executives Board for Coordination thereon, 5 Notes with appreciation the reports of the Joint Inspection Unit.3,4 61st plenary meeting 1 December 2017 __________________ 2 A/72/295. 3 A/72/120. 4 A/72/298. 5 A/72/120/Add.1 and A/72/298/Add.1.",
    "6": "Encourages United Nations internal and external oversight bodies to further enhance the level of cooperation with one another, such as through joint work-planning sessions, without prejudice to the independence of each;",
    "7": "Recognizes the important roles of the oversight bodies in contributing to improvements in the effectiveness, transparency and accountability of the Organization;",
    "8": "Requests the Secretary-General to continue to promote effective coordination and collaboration with regard to the audit, evaluation and investigation functions of the Office in order to ensure an integrated approach to its oversight function, bearing in mind the operational independence of the Office;",
    "9": "Also requests the Secretary-General to ensure that the annual reports of the Office continue to include a brief description of any impairment of its independence;",
    "10": "Takes note of the report of the Office;1",
    "11": "Requests the Secretary-General to ensure that all relevant resolutions pertaining to the work of the Office are brought to the attention of the relevant managers;",
    "12": "Also requests the Secretary-General to ensure that all relevant resolutions, including those of a cross-cutting nature, are brought to the attention of relevant managers and that the Office also takes those resolutions into account in the conduct of its activities;",
    "13": "Further requests the Secretary-General to continue to ensure the full implementation of the accepted recommendations of the Office, including those relating to cost avoidance, recovery of overpayments, efficiency gains and other improvements, in a prompt and timely manner, and to provide detailed justifications in cases in which recommendations of the Office are not accepted;",
    "14": "Welcomes the efforts of the Office to promote the Organization\u2019s zero- tolerance approach to fraud and corruption, and encourages the Office to continue to investigate and audit cases of fraud and corruption;",
    "15": "Notes the role of the Office as the central intake mechanism for fraud and corruption allegations in the Secretariat, and encourages the Office to consider calls to expand the reporting and recording of all forms of misconduct as part of renewed efforts to strengthen and professionalize the investigations function of the United Nations system;",
    "16": "Welcomes the progress made by the Office in reducing the average time taken to complete investigations and associated reports, and encourages the Office to continue to reduce the average length of time to six months;",
    "17": "Notes the efforts of the Office to bring clarity and transparency to the conclusions and recommendations of audits, and in this regard encourages the Office to standardize its approach, as appropriate;",
    "18": "Welcomes the efforts and progress made by the Office in reducing the number of vacant posts, and requests the Secretary-General to continue to make every effort to fill the remaining vacant posts, particularly in the Investigations Division and in the field, in accordance with the relevant provisions governing recruitment in the United Nations; Report on the activities of the Office of Internal Oversight Services A/RES/72/18 3/3 17-21454 II Activities of the Independent Audit Advisory Committee Recalling its resolutions 61/275 of 29 June 2007, 64/263, section II of its resolution 66/236, section II of its resolution 67/258, section II of its resolution 68/21, section II of its resolution 69/252, section II of its resolution 70/111 and section II of its resolution 71/7, Having considered the report of the Independent Audit Advisory Committee on its activities for the period from 1 August 2016 to 31 July 2017,2"
  },
  "agenda_items": [
    "Item 134"
  ],
  "symbol_references": []
}