{
  "symbol": "A/RES/78/211",
  "filename": "A_RES_78_211.pdf",
  "title": "78/211. Effective promotion of the Declaration on the Rights of Persons Belonging to National or Ethnic, Religious and Linguistic Minorities",
  "text": "United Nations \nA/RES/78/211\n \n \nGeneral Assembly \nDistr.: General \n22 December 2023 \n \n23-26016 (E)    090124   \n*2326016* \n \n \nSeventy-eighth session \nAgenda item 71 (b) \nPromotion and protection of human rights: human rights \nquestions, including alternative approaches for improving \nthe effective enjoyment of human rights and \nfundamental freedoms  \n \n \n \n \n Resolution adopted by the General Assembly \non 19 December 2023 \n \n \n \n \n[on the report of the Third Committee (A/78/481/Add.2, para. 139)] \n \n \n \n78/211. Effective promotion of the Declaration on the Rights of \nPersons Belonging to National or Ethnic, Religious and \nLinguistic Minorities \n \n \n \nThe General Assembly, \n \nRecalling its resolution 47/135 of 18 December 1992, by which it adopted the \nDeclaration on the Rights of Persons Belonging to National or Ethnic, Religious and \nLinguistic Minorities annexed to that resolution, and bearing in mind article 27 of the \nInternational Covenant on Civil and Political Rights1 as well as other relevant existing \ninternational and regional standards and national legislation, \n \nNoting with appreciation that 2023 marks the seventy-fifth anniversary of the \nUniversal Declaration of Human Rights2 and the thirtieth anniversary of the Vienna \nDeclaration and Programme of Action,3 and acknowledging the importance of these \ninstruments for the promotion and protection of the rights of persons belonging to \nnational or ethnic, religious and linguistic minorities, \n \nRecalling the thirtieth anniversary of the adoption of the Declaration on the \nRights of Persons Belonging to National or Ethnic, Religious and Linguistic \nMinorities in 2022, which served as an important opportunity to reflect on the \npromotion and protection of the rights of persons belonging to national or ethnic, \nreligious and linguistic minorities, as well as on achievements, best practices and \ncontinuing challenges with regard to the implementation of the Declaration, and \nreaffirming the principles and commitments therein, and recognizing that, while \n__________________ \n \n1  See resolution 2200 A (XXI), annex. \n \n2  Resolution 217 A (III). \n \n3  A/CONF.157/24 (Part I), chap. III. \n\nA/RES/78/211 \nEffective promotion of the Declaration on the Rights of Persons\nBelonging to National or Ethnic, Religious and Linguistic Minorities\n \n23-26016 \n2/8 \n \nprogress has been made, the situation of persons belonging to national or ethnic, \nreligious and linguistic minorities is critical in many parts of the world and many \nchallenges remain to ensure the full enjoyment of their rights, \n \nTaking note with appreciation of the high-level meeting convened by the \nPresident of the General Assembly during the general debate of the General Assembly \nat its seventy-seventh session to commemorate the thirtieth anniversary of the \nadoption of the Declaration, which served as an occasion for States to reflect on \nimplementation gaps, exchange best practices and make voluntary pledges to enhance \nthe implementation of the Declaration, \n \nTaking note of other multilateral, regional, subregional and national initiatives \nto mark the thirtieth anniversary of the Declaration and further its implementation, \n \nRecalling its subsequent resolutions on the effective promotion of the \nDeclaration and all relevant resolutions of the Human Rights Council,  \n \nRecalling also Human Rights Council resolutions 52/5 of 3 April 2023,4 which \nextended the mandate of the Special Rapporteur on minority issues, as well as 49/14 \nof 31 March 2022,5 in which the Council considered the recommendations of the \nForum on Minority Issues at its fourteenth session, held in December 2021 on the \ntheme \u201cConflict prevention and the protection of the human rights of minorities\u201d, 6  \n \nRecalling further its resolution 76/6 of 15 November 2021, which welcomed, as \na basis for further consideration by Member States, the submission of the report of \nthe Secretary-General entitled \u201cOur Common Agenda\u201d, 7  including its appeal for \naction to strengthen the inclusion of persons belonging to national or ethnic, religious \nand linguistic minorities, \n \nReaffirming that the promotion and protection of the rights of persons belonging \nto national or ethnic, religious and linguistic minorities and dialogue between these \nminorities and the rest of society, as well as the constructive and inclusive \ndevelopment of practices and institutional arrangements to accommodate diversity \nwithin societies, contribute to political and social stability and the prevention and \npeaceful resolution of conflicts involving the rights of persons belonging to national \nor ethnic, religious and linguistic minorities,  \n \nReaffirming also the 2030 Agenda for Sustainable Development, 8 of which the \nAddis Ababa Action Agenda of the Third International Conference on Financing for \nDevelopment9 is an integral part, recalling that the Sustainable Development Goals \nand targets seek to realize the human rights of all, and stressing the need for Member \nStates to integrate the 2030 Agenda into their respective national policies and \ndevelopment frameworks, as appropriate, to promote the effective implementation, \nfollow-up and review of the 2030 Agenda, in order to ensure that no one is left behind, \n \nNoting with concern that disregard for the identity of, and discrimination \nagainst, persons belonging to national or ethnic, religious and linguistic minorities, \nas well as their political and socioeconomic marginalization, hate speech and the \ndenial of the enjoyment of their human rights often precede violence and should \ntherefore serve as early warning signs of a risk of serious crimes and conflict, \n__________________ \n \n4  See Official Records of the General Assembly, Seventy-eighth Session, Supplement No. 53 \n(A/78/53), chap. V, sect. A. \n \n5  Ibid., Seventy-seventh Session, Supplement No. 53 (A/77/53), chap. VI, sect. A. \n \n6  See A/HRC/49/81. \n \n7  A/75/982. \n \n8  Resolution 70/1. \n \n9  Resolution 69/313, annex. \n\nEffective promotion of the Declaration on the Rights of Persons \nBelonging to National or Ethnic, Religious and Linguistic Minorities \nA/RES/78/211 \n \n3/8 \n23-26016 \n \n \nExpressing concern at the frequency and severity of disputes and conflicts \naffecting persons belonging to national or ethnic, religious and linguistic minorities \nin many countries and their often tragic consequences, and that such persons, \nespecially women and girls, often suffer disproportionately from the effects of \nconflicts resulting in the violation or abuse of their human rights, and are particularly \nvulnerable to forced displacement through, inter alia, population transfers, revocation \nof previously held identity documents, refugee flows and forced relocation, \n \nRecognizing that developments in certain territories or regions linked to national \nor ethnic, religious and linguistic minorities may trigger acts of violence and \ndiscrimination specifically targeting persons belonging to the same minorities \nelsewhere, \n \nEmphasizing the importance of constitutional and legal frameworks, the rule of \nlaw and equal access to justice for all without any discrimination based on language, \nethnicity, origin, religion or belief as the basis for the protection of the rights of \npersons belonging to national or ethnic, religious and linguistic minorities, \n \nReaffirming that everyone has the right to recognition everywhere as a person \nbefore the law, \n \nEmphasizing the need for reinforced efforts to realize the rights of persons \nbelonging to national or ethnic, religious and linguistic minorities, including by \naddressing economic and social conditions and marginalization, as well as to end any \ntype of discrimination against them, including by addressing multiple, aggravated and \nintersecting forms of discrimination, \n \nTaking note in this regard of the publication entitled Protecting Minority Rights: \nA Practical Guide to Developing Comprehensive Anti-Discrimination Legislation,10 \nand noting the publication of the Guidance Note on Intersectionality, Racial \nDiscrimination and Protection of Minorities prepared by the United Nations network \non racial discrimination and protection of minorities, 11  \n \nRecognizing that a vast majority of stateless persons are persons belonging to \nnational or ethnic, religious and linguistic minorities, and in this regard emphasizing \nthe need for birth registration, civil registration and national identification documents \nto be provided without discrimination on any grounds, in particular race, ethnicity, \nreligion and language, in line with the 2030 Agenda, especially the target aimed at \nproviding a legal identity for all,  \n \nEmphasizing further the fundamental importance of human rights education, \ntraining and learning as well as of dialogue, including intercultural and interfaith \ndialogue, and interaction among all relevant stakeholders and members of society on \nthe promotion and protection of the rights of persons belonging to national or ethnic, \nreligious and linguistic minorities,  \n \nRecognizing the importance of realizing the right to education for all and, \nwherever possible, providing persons belonging to national or ethnic, religious and \nlinguistic minorities with quality educational and other opportunities to learn their \nown language or to have instruction in their own language, \n \nEmphasizing the important role that national institutions can play in the \npromotion and protection of the rights of persons belonging to national or ethnic, \nreligious and linguistic minorities, and acknowledging the role that the United \nNations, its specialized agencies and other relevant organizations, and the Special \n__________________ \n \n10  Available at www.ohchr.org/en/minorities/minority-rights-equality-and-anti-discrimination-law.  \n \n11  Available at www.ohchr.org/sites/default/files/documents/issues/minorities/30th-anniversary/ \n2022-09-22/GuidanceNoteonIntersectionality.pdf.  \n\nA/RES/78/211 \nEffective promotion of the Declaration on the Rights of Persons\nBelonging to National or Ethnic, Religious and Linguistic Minorities\n \n23-26016 \n4/8 \n \nRapporteur of the Human Rights Council on minority issues, play in this regard by, \ninter alia, promoting the implementation of the Declaration,  \n \nExpressing concern about the increase of disinformation and misinformation, \nwhich may lead to the spread of hate speech, particularly on social media platforms, \nand, inter alia, through the use of artificial intelligence (AI), which can be designed, \nimplemented and used in ways that spread discrimination, including racism, \nmisogyny, xenophobia, negative stereotyping and stigmatization, particularly \naffecting persons belonging to national or ethnic, religious and linguistic minorities, \n \nExpressing concern also that these developments can lead to or exacerbate \nhuman rights violations and abuses, including of the right to privacy and the right to \nfreedom of expression, including the freedom to seek, receive and impart information, \nand can be used to incite violence, hatred, intolerance, discrimination and hostility \nagainst persons belonging to national or ethnic, religious and linguistic minorities, \nand emphasizing the important contributions of journalists, civil society and academia \nin countering these trends, \n \n1. \nReaffirms the obligation of States to ensure that persons belonging to \nnational or ethnic, religious and linguistic minorities may exercise fully and \neffectively all human rights and fundamental freedoms without any discrimination \nand in full equality before the law, as proclaimed in the Declaration on the Rights of \nPersons Belonging to National or Ethnic, Religious and Linguistic Minorities, 12 and \ndraws attention to the relevant provisions of the Durban Declaration and Programme \nof Action,13 including the provisions on forms of multiple discrimination;  \n \n2. \nUrges States and the international community to promote and protect the \nrights of persons belonging to national or ethnic, religious and linguistic minorities, \nas set out in the Declaration on the Rights of Persons Belonging to National or Ethnic, \nReligious and Linguistic Minorities, including through the encouragement of \nconditions for the promotion of their identity, the provision of quality education and \nthe facilitation of their participation in all aspects of the political, economic, social, \nreligious and cultural life of society and in the economic progress and development \nof their country, without discrimination, and to apply a gender perspective while \ndoing so; \n \n3. \nEncourages States to take appropriate measures so that, wherever possible, \npersons belonging to national or ethnic, religious and linguistic minorities may have \nadequate opportunities to learn their own language or to have instruction in their own \nlanguage;  \n \n4. \nUrges States to take all appropriate measures, inter alia, constitutional, \nlegislative, administrative and other measures, for the promotion and implementation \nof the Declaration, and appeals to States to cooperate bilaterally and multilaterally, in \nparticular on the exchange of best practices and lessons learned, consistent with the \nDeclaration, in order to promote and protect the rights of persons belonging to \nnational or ethnic, religious and linguistic minorities; \n \n5. \nEncourages States to work towards fulfilling their voluntary pledges made \nduring the high-level meeting convened by the President of the General Assembly \nduring the general debate of the General Assembly at its seventy-seventh session on \nthe promotion and protection of the rights of persons belonging to national or ethnic, \nreligious and linguistic minorities, to improve the implementation of the Declaration \nby implementing the good practices which were shared, and to further strengthen \nexisting measures in this regard; \n__________________ \n \n12  Resolution 47/135, annex. \n \n13  See A/CONF.189/12 and A/CONF.189/12/Corr.1, chap. I. \n\nEffective promotion of the Declaration on the Rights of Persons \nBelonging to National or Ethnic, Religious and Linguistic Minorities \nA/RES/78/211 \n \n5/8 \n23-26016 \n \n \n6. \nRecommends that States continue to reflect on current and emerging \nchallenges facing persons belonging to national or ethnic, religious and linguistic \nminorities, including the rise in persecution on religious and ethnic grounds, the \nprevalence of statelessness among national or ethnic, religious and linguistic \nminorities, human rights violations in law enforcement and the justice sector and \nincreasing levels of hate crimes and hate speech targeting, among others, persons \nbelonging to national or ethnic, religious and linguistic minorities; \n \n7. \nCalls upon States to undertake, as applicable, initiatives to ensure that \npersons belonging to national or ethnic, religious and linguistic minorities are aware of \nand able to exercise their rights, including, inter alia, the right of everyone to a \nnationality, as set out in article 15 of the Universal Declaration of Human Rights and \ncomplemented by the Declaration on the Rights of Persons Belonging to National or \nEthnic, Religious and Linguistic Minorities and in other international human rights law; \n \n8. \nRecommends that States ensure that all measures taken with a view to \nimplementing the Declaration are, to the fullest extent possible, developed, designed, \nimplemented and reviewed with the full, effective and equal participation of persons \nbelonging to national or ethnic, religious and linguistic minorities;  \n \n9. \nCalls upon States to undertake effective efforts to prevent and combat acts \nof violence specifically targeting persons belonging to national or ethnic, religious \nand linguistic minorities;  \n \n10. Also calls upon States to take all appropriate measures to ensure the \nprotection of children who belong to national or ethnic, religious and linguistic \nminorities, in accordance with the relevant obligations under the Convention on the \nRights of the Child;14  \n \n11. \nFurther calls upon States to take all appropriate measures to ensure the \nprotection and promote the empowerment of all women and girls who belong to \nnational or ethnic, religious and linguistic minorities and are exposed to multiple \nforms of discrimination as well as sexual and gender-based violence, and also to give \nspecial attention to the specific needs of older persons and persons with disabilities \nwho belong to national or ethnic, religious and linguistic minorities; \n \n12. Recommends that States and other relevant actors ensure to the fullest \nextent possible that the Declaration is translated into all minority languages and \ndisseminated widely; \n \n13. Expresses its appreciation for the successful completion, in December \n2022, of the fifteenth session of the Forum on Minority Issues, on the theme \u201cReview, \nrethink, reform: thirtieth anniversary of the adoption of the Declaration on the Rights \nof Persons Belonging to National or Ethnic, Religious and Linguistic Minorities\u201d, \nwhich, as part of its outcome, produced recommendations to highlight the need for \nStates to comply with their human rights obligations in relation to addressing hate \nspeech on social media,15 and encourages States to take into consideration the relevant \nrecommendations of the Forum, and notes the work of the United Nations network on \nracial discrimination and protection of minorities; \n \n14. Calls upon States, while bearing in mind the theme of the fifteenth session \nof the Forum on Minority Issues, and the summary by the President of the General \nAssembly of the high-level meeting marking the thirtieth anniversary of the adoption \nof the Declaration in September 2022, and with a view to enhancing the \nimplementation of the Declaration and ensuring the realization of the rights of persons \n__________________ \n \n14  United Nations, Treaty Series, vol. 1577, No. 27531. \n \n15  See A/HRC/52/71. \n\nA/RES/78/211 \nEffective promotion of the Declaration on the Rights of Persons\nBelonging to National or Ethnic, Religious and Linguistic Minorities\n \n23-26016 \n6/8 \n \nbelonging to national or ethnic, religious and linguistic minorities, to take appropriate \nmeasures by, inter alia: \n \n(a) \nReviewing any legislation, including constitutional provisions as \nappropriate, policy or practice that has a discriminatory or disproportionately \nnegative effect, both offline and in digital contexts, on persons belonging to national \nor ethnic, religious and linguistic minorities, with a view to considering its \namendment; \n \n(b) \nConsidering ratifying, acceding to and adhering to all relevant international \ninstruments that protect and promote the rights of persons belonging to national or \nethnic, religious and linguistic minorities with the aim of addressing and countering \nthe spread of racism, xenophobia, negative stereotyping and stigmatization;  \n \n(c) \nStrongly condemning any advocacy of national, racial or religious hatred \nthat constitutes incitement to discrimination, hostility or violence, and adopting and \nimplementing measures to criminalize incitement to imminent violence based on \nnationality, race, religion or belief, both online and offline, while respecting all \ninternationally recognized human rights and fundamental freedoms;  \n \n(d) \nEnsuring that persons belonging to national or ethnic, religious and \nlinguistic minorities have equal access without any form of discrimination to justice \nand remedies for human rights violations, abuses and/or crimes, including crimes \ncommitted on the basis of national, racial or religious hatred; \n \n(e) \nAdopting and implementing legislative anti-discrimination measures, \nwhere required, to protect and promote the rights of persons belonging to national or \nethnic, religious and linguistic minorities; \n \n(f) \nStrengthening international cooperation, including with international and \nregional organizations, and cooperation with the private sector, including technology \ncompanies, national human rights institutions and civil society in order to share \nexpertise, knowledge and effective practices in addressing and countering hate speech \nand discrimination against persons belonging to national or ethnic, religious and \nlinguistic minorities, online and offline, while respecting and promoting human \nrights, including in the development and use of digital technologies, such as artificial \nintelligence (AI);  \n \n(g) \nWorking with social media companies, as applicable, to protect persons \nbelonging to minorities by taking active measures to counter hate speech and address \nits increasing spread, enable research into measures to reduce it and promote users\u2019 \naccess to effective reporting channels, in a manner consistent with international \nhuman rights law; \n \n15. Takes note of the report of the Secretary-General on the effective \npromotion of the Declaration 16 and the reports of the Special Rapporteur of the \nHuman Rights Council on minority issues; \n \n16. Commends the Special Rapporteur for the work and the important role \nplayed in raising the level of awareness of and in giving added visibility to the rights \nof persons belonging to national or ethnic, religious and linguistic minorities;  \n \n17. Calls upon all States to cooperate with and assist the Special Rapporteur \nin the performance of the tasks and duties mandated to him, to provide him with all \nthe necessary information requested and to seriously consider responding promptly \nand favourably to the requests of the Special Rapporteur to visit their countries in \norder to enable him to fulfil his duties effectively;  \n__________________ \n \n16  A/78/306. \n\nEffective promotion of the Declaration on the Rights of Persons \nBelonging to National or Ethnic, Religious and Linguistic Minorities \nA/RES/78/211 \n \n7/8 \n23-26016 \n \n \n18. Encourages the specialized agencies, regional organizations, national \nhuman rights institutions and non-governmental organizations to develop regular \ndialogue and cooperation with the Special Rapporteur, as well as to continue to \ncontribute to the promotion and protection of the rights of persons belonging to \nnational or ethnic, religious and linguistic minorities;  \n \n19. Calls upon the United Nations High Commissioner for Human Rights to \ncontinue to promote, within his mandate, the implementation of the Declaration, and \nto engage in a dialogue with Governments for that purpose and to regularly update \nand disseminate widely the United Nations Guide for Minorities;  \n \n20. Welcomes the inter-agency cooperation among United Nations agencies, \nfunds and programmes on minority issues, notes the activities of the United Nations \nnetwork on racial discrimination and protection of minorities, and urges United \nNations agencies, funds and programmes to further increase their coordination and \ncooperation by, inter alia, developing policies on the promotion and protection of the \nrights of persons belonging to minorities, drawing also on relevant outcomes of the \nForum on Minority Issues and taking into account the work of relevant regional \norganizations, in particular in the light of the thirtieth anniversary of the adoption of \nthe Declaration on the Rights of Persons Belonging to National or Ethnic, Religious \nand Linguistic Minorities;  \n \n21. Calls upon the Secretary-General to make available, at the request of \nGovernments concerned, qualified expertise on minority issues, including in the \ncontext of efforts to address and counter hate speech while fully respecting the right \nto freedom of expression, and to assist in resolving existing or potential situations \ninvolving minorities;  \n \n22. Invites the human rights treaty bodies, as well as special procedures of the \nHuman Rights Council, to continue to give attention, within their respective \nmandates, to situations and rights of persons belonging to national or ethnic, religious \nand linguistic minorities and in this regard to take into consideration relevant \nrecommendations of the Forum on Minority Issues;  \n \n23. Invites the United Nations mechanisms and bodies, the specialized \nagencies and regional organizations, within their respective mandates, to continue to \ncontribute to the protection and the prevention of violations of the rights of persons \nbelonging to national or ethnic, religious and linguistic minorities, including by \nstrengthening cooperation in respect of information-gathering and improving the \ninformation flow between themselves and with States;  \n \n24. Encourages regional intergovernmental bodies, within their respective \nregions, to promote greater attention to the rights of persons belonging to national or \nethnic, religious and linguistic minorities by, inter alia, actively raising awareness of \nand promoting the Declaration in their work, encouraging its implementation at the \nnational level and considering the creation of thematic and/or special mechanisms on \nthis issue;  \n \n25. Encourages national human rights institutions to pay due attention to the \nrights of persons belonging to national or ethnic, religious and linguistic minorities, \nincluding by monitoring situations of potential threats for persons belonging to \nnational or ethnic, religious and linguistic minorities, and by investigating and \nreporting, in accordance with the principles relating to the status of national \ninstitutions for the promotion and protection of human rights (the Paris Principles) 17 \nand their respective mandates, episodes of targeted violence against persons belonging \nto minorities, including, when necessary, to regional and international bodies;  \n__________________ \n \n17  Resolution 48/134, annex. \n\nA/RES/78/211 \nEffective promotion of the Declaration on the Rights of Persons\nBelonging to National or Ethnic, Religious and Linguistic Minorities\n \n23-26016 \n8/8 \n \n \n26. Encourages civil society, including non-governmental organizations, to \npromote awareness of the Declaration, and to review the extent to which it integrates \nthe rights of persons belonging to national or ethnic, religious and linguistic \nminorities and the Declaration into its work, as well as to inform persons belonging \nto national or ethnic, religious and linguistic minorities about their rights; \n \n27. Requests the Special Rapporteur to report annually to the General \nAssembly and include recommendations for effective strategies for the better \nimplementation of the rights of persons belonging to national or ethnic, religious and \nlinguistic minorities;  \n \n28. Invites the Office of the United Nations High Commissioner for Human \nRights, United Nations entities and Member States to support and collaborate in the \norganization of regional forums on minority issues initiated by the Special Rapporteur \nin accordance with his mandate, in order to complement and enrich the work and \nrecommendations of the Forum on Minority Issues;  \n \n29. Requests the Secretary-General to submit to the General Assembly at its \neightieth session a report on the implementation of the present resolution, including \ninformation on activities undertaken by Member States, the Office of the High \nCommissioner, the Special Rapporteur, relevant United Nations entities and other \nrelevant stakeholders to enhance the implementation of the Declaration and to ensure \nthe realization of the rights of persons belonging to national or ethnic, religious and \nlinguistic minorities;  \n \n30. Decides to continue consideration of the question at its eightieth session \nunder the item entitled \u201cPromotion and protection of human rights\u201d. \n \n50th plenary meeting \n19 December 2023 \n \n",
  "paragraphs": {
    "1": "Reaffirms the obligation of States to ensure that persons belonging to national or ethnic, religious and linguistic minorities may exercise fully and effectively all human rights and fundamental freedoms without any discrimination and in full equality before the law, as proclaimed in the Declaration on the Rights of Persons Belonging to National or Ethnic, Religious and Linguistic Minorities, 12 and draws attention to the relevant provisions of the Durban Declaration and Programme of Action,13 including the provisions on forms of multiple discrimination;",
    "2": "Urges States and the international community to promote and protect the rights of persons belonging to national or ethnic, religious and linguistic minorities, as set out in the Declaration on the Rights of Persons Belonging to National or Ethnic, Religious and Linguistic Minorities, including through the encouragement of conditions for the promotion of their identity, the provision of quality education and the facilitation of their participation in all aspects of the political, economic, social, religious and cultural life of society and in the economic progress and development of their country, without discrimination, and to apply a gender perspective while doing so;",
    "3": "Encourages States to take appropriate measures so that, wherever possible, persons belonging to national or ethnic, religious and linguistic minorities may have adequate opportunities to learn their own language or to have instruction in their own language;",
    "4": "Urges States to take all appropriate measures, inter alia, constitutional, legislative, administrative and other measures, for the promotion and implementation of the Declaration, and appeals to States to cooperate bilaterally and multilaterally, in particular on the exchange of best practices and lessons learned, consistent with the Declaration, in order to promote and protect the rights of persons belonging to national or ethnic, religious and linguistic minorities;",
    "5": "Encourages States to work towards fulfilling their voluntary pledges made during the high-level meeting convened by the President of the General Assembly during the general debate of the General Assembly at its seventy-seventh session on the promotion and protection of the rights of persons belonging to national or ethnic, religious and linguistic minorities, to improve the implementation of the Declaration by implementing the good practices which were shared, and to further strengthen existing measures in this regard;",
    "6": "Recommends that States continue to reflect on current and emerging challenges facing persons belonging to national or ethnic, religious and linguistic minorities, including the rise in persecution on religious and ethnic grounds, the prevalence of statelessness among national or ethnic, religious and linguistic minorities, human rights violations in law enforcement and the justice sector and increasing levels of hate crimes and hate speech targeting, among others, persons belonging to national or ethnic, religious and linguistic minorities;",
    "7": "Calls upon States to undertake, as applicable, initiatives to ensure that persons belonging to national or ethnic, religious and linguistic minorities are aware of and able to exercise their rights, including, inter alia, the right of everyone to a nationality, as set out in article 15 of the Universal Declaration of Human Rights and complemented by the Declaration on the Rights of Persons Belonging to National or Ethnic, Religious and Linguistic Minorities and in other international human rights law;",
    "8": "Recommends that States ensure that all measures taken with a view to implementing the Declaration are, to the fullest extent possible, developed, designed, implemented and reviewed with the full, effective and equal participation of persons belonging to national or ethnic, religious and linguistic minorities;",
    "9": "Calls upon States to undertake effective efforts to prevent and combat acts of violence specifically targeting persons belonging to national or ethnic, religious and linguistic minorities;",
    "10": "Also calls upon States to take all appropriate measures to ensure the protection of children who belong to national or ethnic, religious and linguistic minorities, in accordance with the relevant obligations under the Convention on the Rights of the Child;14",
    "11": "Further calls upon States to take all appropriate measures to ensure the protection and promote the empowerment of all women and girls who belong to national or ethnic, religious and linguistic minorities and are exposed to multiple forms of discrimination as well as sexual and gender-based violence, and also to give special attention to the specific needs of older persons and persons with disabilities who belong to national or ethnic, religious and linguistic minorities;",
    "12": "Recommends that States and other relevant actors ensure to the fullest extent possible that the Declaration is translated into all minority languages and disseminated widely;",
    "13": "Expresses its appreciation for the successful completion, in December 2022, of the fifteenth session of the Forum on Minority Issues, on the theme \u201cReview, rethink, reform: thirtieth anniversary of the adoption of the Declaration on the Rights of Persons Belonging to National or Ethnic, Religious and Linguistic Minorities\u201d, which, as part of its outcome, produced recommendations to highlight the need for States to comply with their human rights obligations in relation to addressing hate speech on social media,15 and encourages States to take into consideration the relevant recommendations of the Forum, and notes the work of the United Nations network on racial discrimination and protection of minorities;",
    "14": "Calls upon States, while bearing in mind the theme of the fifteenth session of the Forum on Minority Issues, and the summary by the President of the General Assembly of the high-level meeting marking the thirtieth anniversary of the adoption of the Declaration in September 2022, and with a view to enhancing the implementation of the Declaration and ensuring the realization of the rights of persons belonging to national or ethnic, religious and linguistic minorities, to take appropriate measures by, inter alia: (a) Reviewing any legislation, including constitutional provisions as appropriate, policy or practice that has a discriminatory or disproportionately negative effect, both offline and in digital contexts, on persons belonging to national or ethnic, religious and linguistic minorities, with a view to considering its amendment; (b) Considering ratifying, acceding to and adhering to all relevant international instruments that protect and promote the rights of persons belonging to national or ethnic, religious and linguistic minorities with the aim of addressing and countering the spread of racism, xenophobia, negative stereotyping and stigmatization; (c) Strongly condemning any advocacy of national, racial or religious hatred that constitutes incitement to discrimination, hostility or violence, and adopting and implementing measures to criminalize incitement to imminent violence based on nationality, race, religion or belief, both online and offline, while respecting all internationally recognized human rights and fundamental freedoms; (d) Ensuring that persons belonging to national or ethnic, religious and linguistic minorities have equal access without any form of discrimination to justice and remedies for human rights violations, abuses and/or crimes, including crimes committed on the basis of national, racial or religious hatred; (e) Adopting and implementing legislative anti-discrimination measures, where required, to protect and promote the rights of persons belonging to national or ethnic, religious and linguistic minorities; (f) Strengthening international cooperation, including with international and regional organizations, and cooperation with the private sector, including technology companies, national human rights institutions and civil society in order to share expertise, knowledge and effective practices in addressing and countering hate speech and discrimination against persons belonging to national or ethnic, religious and linguistic minorities, online and offline, while respecting and promoting human rights, including in the development and use of digital technologies, such as artificial intelligence (AI); (g) Working with social media companies, as applicable, to protect persons belonging to minorities by taking active measures to counter hate speech and address its increasing spread, enable research into measures to reduce it and promote users\u2019 access to effective reporting channels, in a manner consistent with international human rights law;",
    "15": "Takes note of the report of the Secretary-General on the effective promotion of the Declaration 16 and the reports of the Special Rapporteur of the Human Rights Council on minority issues;",
    "16": "Commends the Special Rapporteur for the work and the important role played in raising the level of awareness of and in giving added visibility to the rights of persons belonging to national or ethnic, religious and linguistic minorities;",
    "17": "Calls upon all States to cooperate with and assist the Special Rapporteur in the performance of the tasks and duties mandated to him, to provide him with all the necessary information requested and to seriously consider responding promptly and favourably to the requests of the Special Rapporteur to visit their countries in order to enable him to fulfil his duties effectively;",
    "18": "Encourages the specialized agencies, regional organizations, national human rights institutions and non-governmental organizations to develop regular dialogue and cooperation with the Special Rapporteur, as well as to continue to contribute to the promotion and protection of the rights of persons belonging to national or ethnic, religious and linguistic minorities;",
    "19": "Calls upon the United Nations High Commissioner for Human Rights to continue to promote, within his mandate, the implementation of the Declaration, and to engage in a dialogue with Governments for that purpose and to regularly update and disseminate widely the United Nations Guide for Minorities;",
    "20": "Welcomes the inter-agency cooperation among United Nations agencies, funds and programmes on minority issues, notes the activities of the United Nations network on racial discrimination and protection of minorities, and urges United Nations agencies, funds and programmes to further increase their coordination and cooperation by, inter alia, developing policies on the promotion and protection of the rights of persons belonging to minorities, drawing also on relevant outcomes of the Forum on Minority Issues and taking into account the work of relevant regional organizations, in particular in the light of the thirtieth anniversary of the adoption of the Declaration on the Rights of Persons Belonging to National or Ethnic, Religious and Linguistic Minorities;",
    "21": "Calls upon the Secretary-General to make available, at the request of Governments concerned, qualified expertise on minority issues, including in the context of efforts to address and counter hate speech while fully respecting the right to freedom of expression, and to assist in resolving existing or potential situations involving minorities;",
    "22": "Invites the human rights treaty bodies, as well as special procedures of the Human Rights Council, to continue to give attention, within their respective mandates, to situations and rights of persons belonging to national or ethnic, religious and linguistic minorities and in this regard to take into consideration relevant recommendations of the Forum on Minority Issues;",
    "23": "Invites the United Nations mechanisms and bodies, the specialized agencies and regional organizations, within their respective mandates, to continue to contribute to the protection and the prevention of violations of the rights of persons belonging to national or ethnic, religious and linguistic minorities, including by strengthening cooperation in respect of information-gathering and improving the information flow between themselves and with States;",
    "24": "Encourages regional intergovernmental bodies, within their respective regions, to promote greater attention to the rights of persons belonging to national or ethnic, religious and linguistic minorities by, inter alia, actively raising awareness of and promoting the Declaration in their work, encouraging its implementation at the national level and considering the creation of thematic and/or special mechanisms on this issue;",
    "25": "Encourages national human rights institutions to pay due attention to the rights of persons belonging to national or ethnic, religious and linguistic minorities, including by monitoring situations of potential threats for persons belonging to national or ethnic, religious and linguistic minorities, and by investigating and reporting, in accordance with the principles relating to the status of national institutions for the promotion and protection of human rights (the Paris Principles) 17 and their respective mandates, episodes of targeted violence against persons belonging to minorities, including, when necessary, to regional and international bodies;",
    "26": "Encourages civil society, including non-governmental organizations, to promote awareness of the Declaration, and to review the extent to which it integrates the rights of persons belonging to national or ethnic, religious and linguistic minorities and the Declaration into its work, as well as to inform persons belonging to national or ethnic, religious and linguistic minorities about their rights;",
    "27": "Requests the Special Rapporteur to report annually to the General Assembly and include recommendations for effective strategies for the better implementation of the rights of persons belonging to national or ethnic, religious and linguistic minorities;",
    "28": "Invites the Office of the United Nations High Commissioner for Human Rights, United Nations entities and Member States to support and collaborate in the organization of regional forums on minority issues initiated by the Special Rapporteur in accordance with his mandate, in order to complement and enrich the work and recommendations of the Forum on Minority Issues;",
    "29": "Requests the Secretary-General to submit to the General Assembly at its eightieth session a report on the implementation of the present resolution, including information on activities undertaken by Member States, the Office of the High Commissioner, the Special Rapporteur, relevant United Nations entities and other relevant stakeholders to enhance the implementation of the Declaration and to ensure the realization of the rights of persons belonging to national or ethnic, religious and linguistic minorities;",
    "30": "Decides to continue consideration of the question at its eightieth session under the item entitled \u201cPromotion and protection of human rights\u201d."
  },
  "agenda_items": [
    "Item 71"
  ],
  "symbol_references": []
}