{
  "symbol": "A/RES/76/217",
  "filename": "A_RES_76_217.pdf",
  "title": "76/217. Follow-up to the second United Nations Conference on Landlocked Developing Countries",
  "text": "United Nations \nA/RES/76/217\n \n \nGeneral Assembly \nDistr.: General \n10 January 2022 \n \n21-19280 (E)    140122 \n*2119280* \n \n \nSeventy-sixth session \nAgenda item 23 (b) \nGroups of countries in special situations: follow-up to \nthe second United Nations Conference on Landlocked \nDeveloping Countries \n \n \n \n \n Resolution adopted by the General Assembly \non 17 December 2021 \n \n \n \n \n[on the report of the Second Committee (A/76/535/Add.2, para. 7)] \n \n \n 76/217. Follow-up to the second United Nations Conference on Landlocked \nDeveloping Countries \n \n \n \nThe General Assembly, \n \nRecalling the Vienna Declaration, 1  the Vienna Programme of Action for \nLandlocked Developing Countries for the Decade 2014\u201320242 and the Political \nDeclaration of the High-level Midterm Review on the Implementation of the \nVienna Programme of Action for Landlocked Developing Countries for the Decade \n2014\u20132024,3 \n \nReaffirming the overarching goal of the Vienna Programme of Action of \naddressing the special development needs and challenges of landlocked developing \ncountries arising from their landlockedness, remoteness and geographical constraints \nin a more coherent manner and thus contributing to an enhanced rate of sustainable \nand inclusive growth, which can contribute to the eradication of poverty in all its \nforms and dimensions, including extreme poverty, \n \nRecalling its resolutions 71/239 of 21 December 2016, 72/232 of 20 December \n2017, 73/243 of 20 December 2018, 74/233 of 19 December 2019 and 75/228 of \n21 December 2020, \n \nReaffirming its resolution 70/1 of 25 September 2015, entitled \u201cTransforming \nour world: the 2030 Agenda for Sustainable Development\u201d, in which it adopted a \ncomprehensive, far-reaching and people-centred set of universal and transformative \nSustainable Development Goals and targets, its commitment to working tirelessly for \nthe full implementation of the Agenda by 2030, its recognition that eradicating \n__________________ \n \n1 Resolution 69/137, annex I. \n \n2 Ibid., annex II. \n \n3 Resolution 74/15. \n\nA/RES/76/217 \nFollow-up to the second United Nations Conference on \nLandlocked Developing Countries\n \n21-19280\n2/7 \n \npoverty in all its forms and dimensions, including extreme poverty, is the greatest \nglobal challenge and an indispensable requirement for sustainable development, its \ncommitment to achieving sustainable development in its three dimensions \u2013 \neconomic, social and environmental \u2013 in a balanced and integrated manner, and to \nbuilding upon the achievements of the Millennium Development Goals and seeking \nto address their unfinished business, \n \nReaffirming also its resolution 69/313 of 27 July 2015 on the Addis Ababa \nAction Agenda of the Third International Conference on Financing for Development, \nwhich is an integral part of the 2030 Agenda for Sustainable Development, supports \nand complements it, helps to contextualize its means of implementation targets with \nconcrete policies and actions, and reaffirms the strong political commitment to \naddress the challenge of financing and creating an enabling environment at all levels \nfor sustainable development in the spirit of global partnership and solidarity, \n \nReaffirming further the Paris Agreement 4  and its early entry into force, \nencouraging all its parties to fully implement the Agreement, and parties to the United \nNations Framework Convention on Climate Change 5 that have not yet done so to \ndeposit their instruments of ratification, acceptance, approval or accession, where \nappropriate, as soon as possible, \n \nRecalling the Sendai Declaration and the Sendai Framework for Disaster Risk \nReduction 2015\u20132030,6 while recognizing that landlocked developing countries face \nsome specific disaster risk challenges, and reiterating the commitment to addressing \ndisaster risk reduction and building resilience to disasters within the context of \nsustainable development and poverty eradication, \n \nReaffirming the New Urban Agenda, adopted at the United Nations Conference \non Housing and Sustainable Urban Development (Habitat III), held in Quito from 17 \nto 20 October 2016, 7  and recognizing the importance of sustainable urban \ndevelopment for landlocked developing countries, \n \nRecognizing that the lack of territorial access to the sea, aggravated by \nremoteness from world markets and high transit costs and risks, continues to pose \nserious constraints on the overall growth and socioeconomic development of \nlandlocked developing countries, \n \nAcknowledging the importance of promoting collaboration between landlocked \ndeveloping countries and transit countries on the basis of common interest, and noting \nthat collaboration efforts need to be supported by an enabling international economic \nenvironment, taking into account different national realities, capacities and levels of \ndevelopment and respecting national priorities, while remaining consistent with \ninternational rules and commitments, \n \nRecognizing the transport infrastructure gap in landlocked developing countries \nand the need to bring the level of transport infrastructure up to global standards and, \nin this regard, the crucial importance of strong national and international partnerships \nto bridging the gap and enhancing existing transport infrastructure facilities, \n \nAcknowledging the need to promote meaningful regional integration to \nencompass cooperation among countries for the implementation of the Vienna \nProgramme of Action, \n \nRecognizing that it is important for all countries, including landlocked \ndeveloping countries, to commit to a world in which all women and girls enjoy full \n__________________ \n \n4 Adopted under the UNFCCC in FCCC/CP/2015/10/Add.1, decision 1/CP.21. \n \n5 United Nations, Treaty Series, vol. 1771, No. 30822. \n \n6 Resolution 69/283, annexes I and II. \n \n7 Resolution 71/256, annex. \n\nFollow-up to the second United Nations Conference on \nLandlocked Developing Countries \nA/RES/76/217\n \n3/7\n21-19280 \n \ngender equality with men and boys and all legal, social and economic barriers to their \nempowerment and equality have been removed, \n \nTaking note of the declaration of the annual Ministerial Meeting of Landlocked \nDeveloping Countries, which was held virtually on 23 September 2021 on the theme \n\u201cLeaving no one behind: sustainable recovery from COVID-19 in landlocked \ndeveloping countries and accelerated implementation of the Vienna Programme of \nAction and the special road map\u201d, \n \nNoting with great concern the severe negative impact on human health, safety \nand well-being caused by the coronavirus disease (COVID-19) pandemic, as well as \nthe severe disruption to societies and economies and the devastating impact on lives \nand livelihoods, and that the poorest and most vulnerable are the hardest hit by the \npandemic, reaffirming the ambition to get back on track to achieve the Sustainable \nDevelopment Goals by designing and implementing sustainable and inclusive \nrecovery strategies to accelerate progress towards the full implementation of the 2030 \nAgenda for Sustainable Development and to help to reduce the risk of and build \nresilience to future shocks, crises and pandemics, including by strengthening health \nsystems and achieving universal health coverage, and recognizing that equitable and \ntimely access for all to safe, quality, effective and affordable COVID-19 vaccines, \ntherapeutics and diagnostics are an essential part of a global response based on unity, \nsolidarity, renewed multilateral cooperation and the principle of leaving no one \nbehind, \n \nRecognizing that landlocked developing countries are highly dependent on \ntransit countries to access international markets, are particularly vulnerable to cross-\nborder restrictions in combating the spread of COVID-19 and the social and economic \nimpacts of lockdown measures related to it, the health effects of the pandemic, \ncommodity price shocks and a global recession, recognizing also that the COVID-19 \npandemic abruptly halted progress in almost all priority areas of the Vienna \nProgramme of Action and increased the challenge of achieving the Sustainable \nDevelopment Goals by 2030 as mobility restrictions amplified existing geographical \nand structural vulnerabilities and that, for landlocked developing countries, the fiscal \nimplications of the pandemic may have led to increased risk of debt distress, limiting \ntheir fiscal and policy space for critical investments in a sustainable and inclusive \nrecovery, and recalling the road map for the accelerated implementation of the Vienna \nProgramme of Action in the remaining five years adopted by the Group of Landlocked \nDeveloping Countries on 23 September 2020, \n \nRecognizing also that the Vienna Programme of Action, which is integral to the \n2030 Agenda, is based on renewed and strengthened partnerships for supporting \nlandlocked developing countries in harnessing benefits from international trade, \nstructurally transforming their economies and achieving more inclusive and \nsustainable growth, \n \nReaffirming the recognition of the special needs and challenges of landlocked \ndeveloping countries in the 2030 Agenda and in the Addis Ababa Action Agenda of \nthe Third International Conference on Financing for Development, and affirming \nfurther that their effective implementation, together with the implementation of the \nsix priority areas of the Vienna Programme of Action, which builds upon the Almaty \nProgramme of Action: Addressing the Special Needs of Landlocked Developing \nCountries within a New Global Framework for Transit Transport Cooperation for \nLandlocked and Transit Developing Countries,8 can drive the social and economic \n__________________ \n \n8 Report of the International Ministerial Conference of Landlocked and Transit Developing \nCountries and Donor Countries and International Financial and Development Institutions on \nTransit Transport Cooperation, Almaty, Kazakhstan, 28 and 29 August 2003 (A/CONF.202/3), \nannex I. \n\nA/RES/76/217 \nFollow-up to the second United Nations Conference on \nLandlocked Developing Countries\n \n21-19280\n4/7 \n \nprogress of landlocked developing countries and assist in their transformation from \nlandlocked to land-linked countries, \n \n1. \nTakes note of the report of the Secretary-General on the implementation of \nthe Vienna Programme of Action for Landlocked Developing Countries for the \nDecade 2014\u20132024;9 \n \n2. \nRecalls the convening of the comprehensive high-level midterm review of \nthe implementation of the Vienna Programme of Action for Landlocked Developing \nCountries for the Decade 2014\u20132024 in New York on 5 and 6 December 2019 and the \nhigh-level Political Declaration, in which all the relevant stakeholders are called upon \nto commit to the accelerated implementation of the Vienna Programme of Action; \n \n3. \nUnderlines the need to give particular attention to the concerns and \nspecific challenges of landlocked developing countries in all relevant major United \nNations conferences and processes; \n \n4. \nRecalls the convening of the regional review meetings in preparation for \nthe comprehensive high-level midterm review of the Vienna Programme of Action for \nthe Euro-Asia region in Bangkok on 11 and 12 February 2019, for the Africa region \nin Marrakech, Morocco, on 18 and 19 March 2019 and for the Latin America region \nin Santiago on 11 and 12 June 2019; \n \n5. \nCalls upon the landlocked developing countries and transit countries to \nenhance cross-border collaboration by minimizing disruptions to international \ntransport, eliminating trade restrictions and facilitating free movement of, primarily, \nessential goods such as food, medical supplies and personal protection equipment, \nconsistent with World Trade Organization rules, undertaking coordinated \ninterventions, in particular at the regional level, ensuring the transparency and \navailability of information about import, export and transit procedures, making use \nof trade facilitation standards and digital technologies such as the electronic exchange \nof information and paperless solutions, calls for sustainable, inclusive, affordable and \nresilient regional and global value chains and transport systems and gender-\nresponsive services to and from landlocked developing countries to help them to \nrespond effectively to the COVID-19 pandemic and prevent future disruptions of a \nsimilar nature, while recognizing that regional economic integration is an important \ndriver for sustainable development and integration into the global economy, and \ninvites development partners and relevant international, regional and subregional \norganizations to enhance support to landlocked developing countries and transit \ncountries in implementing the relevant international trade and transport facilitation \nconventions;10 \n \n6. \nInvites the landlocked developing countries, transit countries, their \ndevelopment partners, the United Nations system and all other actors to implement \nthe relevant actions, consistent with national priorities, agreed upon in the Vienna \nProgramme of Action in its six priority areas in a coordinated, coherent and \nexpeditious manner; \n \n7. \nInvites Member States that have not yet done so to mainstream the Vienna \nProgramme of Action into their national and sectoral development strategies in order \nto ensure its effective implementation, and encourages development partners, the \n__________________ \n \n9 A/76/267. \n \n10 Including the Customs Convention on Containers (Geneva, 2 December 1972), the Customs \nConvention on the Temporary Importation of Commercial Road Vehicles (Geneva, 18 May \n1956), the Customs Convention on the International Transport of Goods under Cover of TIR \nCarnets (Geneva, 14 November 1975), the International Convention on the Harmonization of \nFrontier Controls of Goods (Geneva, 21 October 1982) and the World Trade Organization \nAgreement on Trade Facilitation (2013). \n\nFollow-up to the second United Nations Conference on \nLandlocked Developing Countries \nA/RES/76/217\n \n5/7\n21-19280 \n \nUnited Nations system and the relevant international and regional organizations to \ncontinue to provide technical support, within their respective mandates, to the \nlandlocked developing countries in their efforts to mainstream the Vienna Programme \nof Action and the 2030 Agenda for Sustainable Development 11 into their national \ndevelopment strategies; \n \n8. \nStresses that the harmonization, simplification and standardization of rules \nand documentation should be promoted, including the full and effective \nimplementation of international conventions on transport and transit and bilateral, \nsubregional and regional agreements, and invites Member States that have not joined \nthe existing conventions to consider the possibility of accession; \n \n9. \nCalls upon the landlocked developing countries and transit countries, in a \ncoordinated manner, to develop and upgrade international transport and transit \ncorridors encompassing all modes of transportation, including roads, railroads, inland \nwaterways, ports and pipelines, to address the special development needs and \nchallenges of landlocked developing countries; \n \n10. Encourages multilateral financial and development institutions and \nmultilateral development banks, including regional banks, in collaboration with other \nstakeholders, including the private sector, to make investments in addressing gaps in \nrenewable energy, information and communications technology, e-commerce, trade, \ntransport and transit-related regional infrastructure; \n \n11. \nCalls for the full and timely implementation of the Agreement on Trade \nFacilitation annexed to the Protocol amending the Marrakesh Agreement Establishing \nthe World Trade Organization, and in this regard urges members and relevant \ninternational and regional organizations to continue to provide and enhance technical \nand capacity-building assistance, particularly for the effective implementation of the \nprovisions of articles on the release and clearance of goods, border agency \ncooperation, formalities connected with importation, exportation and transit, freedom \nof transit and customs cooperation; \n \n12. Also calls for renewed and strengthened partnerships to support \nlandlocked developing countries in diversifying their economic base and enhancing \nvalue addition to their exports in order to eradicate poverty and achieve sustainable, \ninclusive and sustained economic growth; \n \n13. Reiterates its invitation to development partners to provide targeted \ntechnical and financial support, as appropriate, towards the implementation of the \nspecific actions listed in the Vienna Programme of Action; \n \n14. Underlines that South-South and triangular cooperation are vital to the \nlandlocked developing countries, especially in the areas of productive capacity-\nbuilding, infrastructure, energy, science and technology, trade, investment and transit \ntransport cooperation, and in this regard highlights the importance of the second \nHigh-level United Nations Conference on South-South Cooperation in addressing the \nneeds of countries in special situations; \n \n15. Recognizes that landlocked developing countries and their transit country \nneighbours need to effectively mobilize adequate domestic and external resources for \nthe effective implementation of the Vienna Programme of Action, reaffirms that, for \nall countries, public policies and the mobilization and effective use of domestic \nresources, underlined by the principle of national ownership, are central to the \ncommon pursuit of sustainable development, including the implementation of the \nProgramme of Action, and also recognizes that international public finance plays an \n__________________ \n \n11 Resolution 70/1. \n\nA/RES/76/217 \nFollow-up to the second United Nations Conference on \nLandlocked Developing Countries\n \n21-19280\n6/7 \n \nimportant role in complementing those efforts, especially in the poorest and most \nvulnerable countries with limited domestic resources; \n \n16. \nUnderlines the prominent role that foreign direct investment plays in \naccelerating development and poverty reduction through employment, the transfer of \nmanagerial and technological know-how, on mutually agreed terms, and non-debt-\ncreating flows of capital, recognizes the considerable role and potential of private sector \ninvolvement in infrastructure development for transport, telecommunications and \nutilities for landlocked developing countries, encourages Member States to facilitate \nforeign direct investment flows to landlocked developing countries in this regard, and \ncalls upon landlocked and transit developing countries to promote an enabling \nenvironment to attract foreign direct investment and private sector involvement; \n \n17. Reiterates that the fulfilment of all official development assistance \ncommitments remains crucial, with providers of official development assistance \nreaffirming their respective commitments; \n \n18. Recognizes the essential role of the private sector in the development of \nlandlocked developing countries, and in this regard underlines the need to continue \npromoting the participation of the private sector in achieving sustainable development \nand the critical importance of mobilizing private resources, including through foreign \ndirect investment, for the development of landlocked developing countries, taking \ninto account the leading role of Member States in the implementation of the 2030 \nAgenda, the Addis Ababa Action Agenda of the Third International Conference on \nFinancing for Development12 and the Vienna Programme of Action; \n \n19. Invites development partners to effectively implement the Aid for Trade \ninitiative in assisting landlocked developing countries to address their special needs \nand requirements, including capacity-building for the formulation of trade policies, \nparticipation in trade negotiations and the implementation of trade facilitation \nmeasures, as well as the diversification of export products; \n \n20. Recognizes that landlocked developing countries are vulnerable to and \nremain negatively affected by the adverse impacts of climate change, land \ndegradation, desertification, deforestation, receding glaciers, floods, including glacial \nlake outburst floods, and droughts, recognizes the potential benefits of mutually \naddressing these challenges, and calls upon the international community to continue \nto support the efforts of landlocked developing countries towards climate change \nmitigation, adaptation, and resilience-building; \n \n21. \nTakes note of scientific research undertaken by the International Think Tank \nfor Landlocked Developing Countries, encourages the International Think Tank to \ncontinue to undertake its role of supporting the development efforts of the landlocked \ndeveloping countries, urges those landlocked developing countries that have not yet \ndone so to ratify, at their earliest convenience, the Multilateral Agreement for the \nEstablishment of an International Think Tank for Landlocked Developing Countries, \nand invites relevant stakeholders to support the International Think Tank; \n \n22. Urges that coherent and effective linkages be made between the \nimplementation, follow-up and review arrangements for the 2030 Agenda and those \nof all relevant United Nations conferences and processes, including the Vienna \nProgramme of Action; \n \n23. Calls upon relevant organizations and bodies of the United Nations \nsystem, and invites international organizations and relevant regional and subregional \norganizations, to integrate the Vienna Programme of Action into their programmes of \nwork, as appropriate, within their respective mandates, and to support landlocked and \n__________________ \n \n12 Resolution 69/313, annex. \n\nFollow-up to the second United Nations Conference on \nLandlocked Developing Countries \nA/RES/76/217\n \n7/7\n21-19280 \n \ntransit developing countries in their implementation of the Programme of Action in a \nwell-coordinated and coherent manner; \n \n24. \nStresses that, in accordance with the mandate given by the General \nAssembly, the Office of the High Representative for the Least Developed Countries, \nLandlocked Developing Countries and Small Island Developing States should continue \nto ensure the coordinated follow-up to, effective monitoring of and reporting on the \nimplementation of the Vienna Programme of Action and the outcome of its midterm \nreview and undertake advocacy efforts at the national, regional and global levels; \n \n25. Decides, in accordance with paragraph 66 of the Political Declaration of \nthe High-level Midterm Review on the Implementation of the Vienna Programme of \nAction for Landlocked Developing Countries for the Decade 2014\u20132024, to hold the \nthird United Nations Conference on Landlocked Developing Countries in 2024 with \nthe mandate to undertake a comprehensive review of the implementation of the \nVienna Programme of Action and to formulate and adopt a renewed framework for \ninternational support to address the special needs of landlocked developing countries \nand to strengthen partnerships between the landlocked developing countries and \ntransit countries and their development partners; the Conference should be preceded, \nwhere necessary, by national- and regional-level reviews, as well as thematic \npreparations, in the most effective, well-structured and broad participatory manner, \nincluding input from civil society, private sector and all other stakeholders, underlines \nthat intergovernmental mechanisms at the global and regional levels, including those \nof the United Nations regional commissions, as well as relevant substantive material \nand statistical data, should be effectively utilized in the review process, designates \nthe Office of the High Representative as the United Nations system-wide focal point \nfor the preparatory process, notes that United Nations system organizations, including \nthe resident coordinators and country teams, the United Nations Conference on Trade \nand Development, the United Nations Development Programme, the regional \ncommissions and relevant international and regional organizations, within their \nrespective mandates, should provide the support necessary in an integrated and \ncoherent manner and actively contribute to the preparatory process and the \nConference itself, stresses that the Conference and the preparatory activities should \nbe organized and carried out in the most effective and efficient manner possible, and \ndecides to take a decision, at its seventy-seventh session, on the organizational \naspects, including the venue, duration and specific dates, of the Conference and of \npossible intergovernmental preparatory committee meetings, to be held, in the most \neffective manner, before the Conference; \n \n26. Strongly encourages Governments, intergovernmental and non-governmental \norganizations, major groups and other donors to contribute in a timely manner to the \ntrust fund in support of activities undertaken by the Office of the High Representative \nto support the implementation of, follow-up to and monitoring of the Vienna \nProgramme of Action, as well as the preparations for the third United Nations \nConference on Landlocked Developing Countries and the participation of landlocked \ndeveloping countries in the Conference; \n \n27. Requests the Secretary-General to submit to the General Assembly at its \nseventy-seventh session a progress report on the implementation of the Vienna \nProgramme of Action, and decides to include in the provisional agenda of its seventy-\nseventh session, under the item entitled \u201cGroups of countries in special situations\u201d, \nthe sub-item entitled \u201cFollow-up to the second United Nations Conference on \nLandlocked Developing Countries\u201d. \n \n54th plenary meeting \n17 December 2021 \n",
  "paragraphs": {
    "1": "Takes note of the report of the Secretary-General on the implementation of the Vienna Programme of Action for Landlocked Developing Countries for the Decade 2014\u20132024;9",
    "2": "Recalls the convening of the comprehensive high-level midterm review of the implementation of the Vienna Programme of Action for Landlocked Developing Countries for the Decade 2014\u20132024 in New York on 5 and 6 December 2019 and the high-level Political Declaration, in which all the relevant stakeholders are called upon to commit to the accelerated implementation of the Vienna Programme of Action;",
    "3": "Underlines the need to give particular attention to the concerns and specific challenges of landlocked developing countries in all relevant major United Nations conferences and processes;",
    "4": "Recalls the convening of the regional review meetings in preparation for the comprehensive high-level midterm review of the Vienna Programme of Action for the Euro-Asia region in Bangkok on 11 and 12 February 2019, for the Africa region in Marrakech, Morocco, on 18 and 19 March 2019 and for the Latin America region in Santiago on 11 and 12 June 2019;",
    "5": "Calls upon the landlocked developing countries and transit countries to enhance cross-border collaboration by minimizing disruptions to international transport, eliminating trade restrictions and facilitating free movement of, primarily, essential goods such as food, medical supplies and personal protection equipment, consistent with World Trade Organization rules, undertaking coordinated interventions, in particular at the regional level, ensuring the transparency and availability of information about import, export and transit procedures, making use of trade facilitation standards and digital technologies such as the electronic exchange of information and paperless solutions, calls for sustainable, inclusive, affordable and resilient regional and global value chains and transport systems and gender- responsive services to and from landlocked developing countries to help them to respond effectively to the COVID-19 pandemic and prevent future disruptions of a similar nature, while recognizing that regional economic integration is an important driver for sustainable development and integration into the global economy, and invites development partners and relevant international, regional and subregional organizations to enhance support to landlocked developing countries and transit countries in implementing the relevant international trade and transport facilitation conventions;10",
    "6": "Invites the landlocked developing countries, transit countries, their development partners, the United Nations system and all other actors to implement the relevant actions, consistent with national priorities, agreed upon in the Vienna Programme of Action in its six priority areas in a coordinated, coherent and expeditious manner;",
    "7": "Invites Member States that have not yet done so to mainstream the Vienna Programme of Action into their national and sectoral development strategies in order to ensure its effective implementation, and encourages development partners, the __________________ 9 A/76/267. 10 Including the Customs Convention on Containers (Geneva, 2 December 1972), the Customs Convention on the Temporary Importation of Commercial Road Vehicles (Geneva, 18 May 1956), the Customs Convention on the International Transport of Goods under Cover of TIR Carnets (Geneva, 14 November 1975), the International Convention on the Harmonization of Frontier Controls of Goods (Geneva, 21 October 1982) and the World Trade Organization Agreement on Trade Facilitation (2013). Follow-up to the second United Nations Conference on Landlocked Developing Countries A/RES/76/217 5/7 21-19280 United Nations system and the relevant international and regional organizations to continue to provide technical support, within their respective mandates, to the landlocked developing countries in their efforts to mainstream the Vienna Programme of Action and the 2030 Agenda for Sustainable Development 11 into their national development strategies;",
    "8": "Stresses that the harmonization, simplification and standardization of rules and documentation should be promoted, including the full and effective implementation of international conventions on transport and transit and bilateral, subregional and regional agreements, and invites Member States that have not joined the existing conventions to consider the possibility of accession;",
    "9": "Calls upon the landlocked developing countries and transit countries, in a coordinated manner, to develop and upgrade international transport and transit corridors encompassing all modes of transportation, including roads, railroads, inland waterways, ports and pipelines, to address the special development needs and challenges of landlocked developing countries;",
    "10": "Encourages multilateral financial and development institutions and multilateral development banks, including regional banks, in collaboration with other stakeholders, including the private sector, to make investments in addressing gaps in renewable energy, information and communications technology, e-commerce, trade, transport and transit-related regional infrastructure;",
    "11": "Calls for the full and timely implementation of the Agreement on Trade Facilitation annexed to the Protocol amending the Marrakesh Agreement Establishing the World Trade Organization, and in this regard urges members and relevant international and regional organizations to continue to provide and enhance technical and capacity-building assistance, particularly for the effective implementation of the provisions of articles on the release and clearance of goods, border agency cooperation, formalities connected with importation, exportation and transit, freedom of transit and customs cooperation;",
    "12": "Also calls for renewed and strengthened partnerships to support landlocked developing countries in diversifying their economic base and enhancing value addition to their exports in order to eradicate poverty and achieve sustainable, inclusive and sustained economic growth;",
    "13": "Reiterates its invitation to development partners to provide targeted technical and financial support, as appropriate, towards the implementation of the specific actions listed in the Vienna Programme of Action;",
    "14": "Underlines that South-South and triangular cooperation are vital to the landlocked developing countries, especially in the areas of productive capacity- building, infrastructure, energy, science and technology, trade, investment and transit transport cooperation, and in this regard highlights the importance of the second High-level United Nations Conference on South-South Cooperation in addressing the needs of countries in special situations;",
    "15": "Recognizes that landlocked developing countries and their transit country neighbours need to effectively mobilize adequate domestic and external resources for the effective implementation of the Vienna Programme of Action, reaffirms that, for all countries, public policies and the mobilization and effective use of domestic resources, underlined by the principle of national ownership, are central to the common pursuit of sustainable development, including the implementation of the Programme of Action, and also recognizes that international public finance plays an __________________ 11 Resolution 70/1. A/RES/76/217 Follow-up to the second United Nations Conference on Landlocked Developing Countries 21-19280 6/7 important role in complementing those efforts, especially in the poorest and most vulnerable countries with limited domestic resources;",
    "16": "Underlines the prominent role that foreign direct investment plays in accelerating development and poverty reduction through employment, the transfer of managerial and technological know-how, on mutually agreed terms, and non-debt- creating flows of capital, recognizes the considerable role and potential of private sector involvement in infrastructure development for transport, telecommunications and utilities for landlocked developing countries, encourages Member States to facilitate foreign direct investment flows to landlocked developing countries in this regard, and calls upon landlocked and transit developing countries to promote an enabling environment to attract foreign direct investment and private sector involvement;",
    "17": "Reiterates that the fulfilment of all official development assistance commitments remains crucial, with providers of official development assistance reaffirming their respective commitments;",
    "18": "Recognizes the essential role of the private sector in the development of landlocked developing countries, and in this regard underlines the need to continue promoting the participation of the private sector in achieving sustainable development and the critical importance of mobilizing private resources, including through foreign direct investment, for the development of landlocked developing countries, taking into account the leading role of Member States in the implementation of the 2030 Agenda, the Addis Ababa Action Agenda of the Third International Conference on Financing for Development12 and the Vienna Programme of Action;",
    "19": "Invites development partners to effectively implement the Aid for Trade initiative in assisting landlocked developing countries to address their special needs and requirements, including capacity-building for the formulation of trade policies, participation in trade negotiations and the implementation of trade facilitation measures, as well as the diversification of export products;",
    "20": "Recognizes that landlocked developing countries are vulnerable to and remain negatively affected by the adverse impacts of climate change, land degradation, desertification, deforestation, receding glaciers, floods, including glacial lake outburst floods, and droughts, recognizes the potential benefits of mutually addressing these challenges, and calls upon the international community to continue to support the efforts of landlocked developing countries towards climate change mitigation, adaptation, and resilience-building;",
    "21": "Takes note of scientific research undertaken by the International Think Tank for Landlocked Developing Countries, encourages the International Think Tank to continue to undertake its role of supporting the development efforts of the landlocked developing countries, urges those landlocked developing countries that have not yet done so to ratify, at their earliest convenience, the Multilateral Agreement for the Establishment of an International Think Tank for Landlocked Developing Countries, and invites relevant stakeholders to support the International Think Tank;",
    "22": "Urges that coherent and effective linkages be made between the implementation, follow-up and review arrangements for the 2030 Agenda and those of all relevant United Nations conferences and processes, including the Vienna Programme of Action;",
    "23": "Calls upon relevant organizations and bodies of the United Nations system, and invites international organizations and relevant regional and subregional organizations, to integrate the Vienna Programme of Action into their programmes of work, as appropriate, within their respective mandates, and to support landlocked and __________________ 12 Resolution 69/313, annex. Follow-up to the second United Nations Conference on Landlocked Developing Countries A/RES/76/217 7/7 21-19280 transit developing countries in their implementation of the Programme of Action in a well-coordinated and coherent manner;",
    "24": "Stresses that, in accordance with the mandate given by the General Assembly, the Office of the High Representative for the Least Developed Countries, Landlocked Developing Countries and Small Island Developing States should continue to ensure the coordinated follow-up to, effective monitoring of and reporting on the implementation of the Vienna Programme of Action and the outcome of its midterm review and undertake advocacy efforts at the national, regional and global levels;",
    "25": "Decides, in accordance with paragraph 66 of the Political Declaration of the High-level Midterm Review on the Implementation of the Vienna Programme of Action for Landlocked Developing Countries for the Decade 2014\u20132024, to hold the third United Nations Conference on Landlocked Developing Countries in 2024 with the mandate to undertake a comprehensive review of the implementation of the Vienna Programme of Action and to formulate and adopt a renewed framework for international support to address the special needs of landlocked developing countries and to strengthen partnerships between the landlocked developing countries and transit countries and their development partners; the Conference should be preceded, where necessary, by national- and regional-level reviews, as well as thematic preparations, in the most effective, well-structured and broad participatory manner, including input from civil society, private sector and all other stakeholders, underlines that intergovernmental mechanisms at the global and regional levels, including those of the United Nations regional commissions, as well as relevant substantive material and statistical data, should be effectively utilized in the review process, designates the Office of the High Representative as the United Nations system-wide focal point for the preparatory process, notes that United Nations system organizations, including the resident coordinators and country teams, the United Nations Conference on Trade and Development, the United Nations Development Programme, the regional commissions and relevant international and regional organizations, within their respective mandates, should provide the support necessary in an integrated and coherent manner and actively contribute to the preparatory process and the Conference itself, stresses that the Conference and the preparatory activities should be organized and carried out in the most effective and efficient manner possible, and decides to take a decision, at its seventy-seventh session, on the organizational aspects, including the venue, duration and specific dates, of the Conference and of possible intergovernmental preparatory committee meetings, to be held, in the most effective manner, before the Conference;",
    "26": "Strongly encourages Governments, intergovernmental and non-governmental organizations, major groups and other donors to contribute in a timely manner to the trust fund in support of activities undertaken by the Office of the High Representative to support the implementation of, follow-up to and monitoring of the Vienna Programme of Action, as well as the preparations for the third United Nations Conference on Landlocked Developing Countries and the participation of landlocked developing countries in the Conference;",
    "27": "Requests the Secretary-General to submit to the General Assembly at its seventy-seventh session a progress report on the implementation of the Vienna Programme of Action, and decides to include in the provisional agenda of its seventy- seventh session, under the item entitled \u201cGroups of countries in special situations\u201d, the sub-item entitled \u201cFollow-up to the second United Nations Conference on Landlocked Developing Countries\u201d. 54th plenary meeting 17 December 2021"
  },
  "agenda_items": [
    "Item 23"
  ],
  "symbol_references": []
}