{
  "symbol": "A/RES/78/253",
  "filename": "A_RES_78_253.pdf",
  "title": "78/253. Special subjects relating to the proposed programme budget for 2024",
  "text": "United Nations \nA/RES/78/253\n \n \nGeneral Assembly \nDistr.: General \n28 December 2023 \n \n23-26236 (E)    050124     \n*2326236* \n \n \nSeventy-eighth session \nAgenda item 134 \nProposed programme budget for 2024 \n \n \n \n \n Resolution adopted by the General Assembly \non 22 December 2023 \n \n \n \n \n[on the report of the Fifth Committee (A/78/662, para. 83)] \n \n \n 78/253. Special subjects relating to the proposed programme budget \nfor 2024 \n \n \n \nThe General Assembly, \n \nI \nEnterprise resource planning project, Umoja \n \n \nRecalling section II of its resolution 60/283 of 7 July 2006, section II of its \nresolution 63/262 of 24 December 2008, its resolution 64/243 of 24 December 2009, \nsection II.A of its resolution 65/259 of 24 December 2010, its resolution 66/246 of \n24 December 2011, section III of its resolution 66/263 of 21 June 2012, section III of \nits resolution 67/246 of 24 December 2012, its resolution 68/246 of 27 December \n2013, sections IV and VI of its resolution 69/274 A of 2 April 2015, section XVII of \nits resolution 70/248 A of 23 December 2015, section XIV of its resolution 71/272 A \nof 23 December 2016, section XXI of its resolution 72/262 A of 24 December 2017, \nsection XVII of its resolution 73/279 A of 22 December 2018, section XVII of its \nresolution 74/263 of 27 December 2019, section V of its resolution 75/253 A of \n31 December 2020, section VI of its resolution 76/246 A of 24 December 2021 and \nsection II of its resolution 77/263 B of 18 April 2023,  \n \nHaving considered the report of the Secretary-General on the progress on the \nfunctioning and development of the Umoja system 1 and the related report of the \nAdvisory Committee on Administrative and Budgetary Questions, 2 \n \n1. \nTakes note of the report of the Secretary-General;  \n \n2. \nEndorses the conclusions and recommendations contained in the report of \nthe Advisory Committee;  \n__________________ \n \n1 A/78/505. \n \n2 A/78/7/Add.25. \n\nA/RES/78/253 \nSpecial subjects relating to the proposed programme budget \nfor 2024\n \n23-26236\n2/25 \n \nII \nFinancial performance report on the programme budget for 2022 \n \n \nRecalling its resolutions 72/266 A of 24 December 2017, 76/245, 76/246 A, \n76/247 A to C and 76/248 of 24 December 2021, 76/246 B of 13 April 2022, 76/271 \nof 29 June 2022 and section VII of its resolution 77/263 A of 30 December 2022,  \n \nHaving considered the financial performance report on the programme budget \nfor 20223 and the related report of the Advisory Committee,4 \n \n1. \nTakes note of the report of the Secretary-General;  \n \n2. \nEndorses the conclusions and recommendations contained in the report of \nthe Advisory Committee;  \n \n3. \nNotes the performance report for 2022 that provides a view of the \nimplementation of the 2022 budget, and requests the Secretary-General to continue \nits further improvement;  \n \n4. \nRecalls paragraph 13 of the report of the Advisory Committee, notes the \ncontinuous increase of the balance of the cost recovery fund, reiterates the necessity \nof a residual balance to minimize the risk of a cost recovery fund liability, requests \nthe Secretary-General to provide an update during the second part of the resumed \nseventy-eighth session and to continue the review of the fund to identify credits for \nreturn to Member States, to indicate the amount of the accumulated balance that is \nspendable, the total revenue and expenditure of cost-recovery activities as well as net \nincome and the average percentage of revenue for transactions related to cost-\nrecovery operations, while predicting growth trends and ensuring that the balance is \nkept at appropriate levels to respond to long-term staff liabilities and other operating \ncosts required for the provision of services, and also requests the Secretary-General \nto further inform on this matter in the financial performance report for 2023;  \n \n5. \nTakes note of the final expenditure in 2022 in the amount of \n3,236,269,600 United States dollars and the actual income in 2022 in the amount of \n322,169,000 dollars;  \n \n6. \nApproves the return of 113,645,900 dollars as a credit against assessments \nto Member States for 2024, resulting from:  \n \n(a) \nUnderexpenditure in the amount of 21,485,800 dollars under the \nexpenditure sections of the programme budget for 2022;  \n \n(b) \nThe cancellation of commitments pertaining to prior budget periods in the \namount of 47,873,700 dollars, as reported in volume I of the financial reports and \naudited financial statements for the year ended 31 December 2022;  \n \n(c) \nA higher collected income in the amount of 25,634,500 dollars, which \nreflects the difference between the approved income estimates of 296,534,500 dollars \nand the actual income of 322,169,000 dollars;  \n \n(d) \nAn amount of 18,651,900 dollars approved as a commitment authority for \nthe United Nations Support Mission in Libya, for which an assessment had been \napproved by the General Assembly in its resolution 76/246 B;  \n \n__________________ \n \n3 A/78/89. \n \n4 A/78/330. \n\nSpecial subjects relating to the proposed programme budget  \nfor 2024 \nA/RES/78/253\n \n3/25\n23-26236 \n \nIII \nRequest for a subvention to the Residual Special Court for Sierra Leone \n \n \nRecalling its resolution 58/284 of 8 April 2004, section VII of its resolution \n59/276 of 23 December 2004, section II of its resolution 59/294 of 22 June 2005, \nsection XII of its resolution 65/259, section IX of its resolution 66/247 of \n24 December 2011, section I of its resolution 67/246, section VII of its resolution \n70/248 A, section III of its resolution 71/272 A, section VIII of its resolution \n72/262 A, section III of its resolution 73/279 A, section VI of its resolution 74/263, \nsection XVI of its resolution 75/253 A, section XI of its resolution 76/246 A and \nsection III of its resolution 77/263 A,  \n \nHaving considered the report of the Secretary-General on the use of the \ncommitment authority and request for a subvention to the Residual Special Court for \nSierra Leone5 and the related report of the Advisory Committee,6 \n \n1. \nTakes note of the report of the Secretary-General;  \n \n2. \nEndorses the conclusions and recommendations contained in the report of \nthe Advisory Committee;  \n \n3. \nReaffirms the high priority accorded to the work of the Residual Special \nCourt for Sierra Leone;  \n \n4. \nWelcomes the support provided by several countries, including voluntary \ncontributions, pro bono annual audit of the Residual Special Court and in-kind \nsupport in enforcing sentences, relocating witnesses, housing the archives of the \nResidual Special Court as well as prisoners of the Court, and hosting fundraising \nactivities; \n \n5. \nAlso welcomes the continued in-kind multiform support provided by the \nGovernment of Sierra Leone to the Residual Special Court, including the provision \nof rent-free office space and other services at no cost;  \n \n6. \nEmphasizes that the subvention from the regular budget is a bridging \nfinancing mechanism to supplement insufficient voluntary contributions, and \nencourages all Member States to provide voluntary support for the Residual Special \nCourt;  \n \n7. \nRequests the Secretary-General to continue his efforts to seek voluntary \ncontributions, including through broadening the donor base and holding regular \nconsultations with the key stakeholders, as well as to implement innovative \nfundraising approaches, and to report thereon to the General Assembly at the main \npart of its seventy-ninth session;  \n \n8. \nRecalls paragraph 29 of the report of the Advisory Committee, and \nrequests the Secretary-General to redouble his efforts to seek alternative and \nsustainable financing arrangements for the Residual Special Court and to report \nthereon to the General Assembly at the main part of its seventy-ninth session;  \n \n9. \nAppreciates the efforts made by the Residual Special Court on cost-\nefficiency measures, encourages the Court to continue its efforts aimed at identifying \nadditional cost-efficiency and the relevant cost-savings measures to be applied in \nview of the persistent funding challenges, and requests the Secretary-General to \nreport thereon in the context of his next report;  \n \n10. Welcomes the efforts to date of the Residual Special Court to digitize \njudicial records, notes that full digitization of all records remains incomplete, and \n__________________ \n \n5 A/78/363. \n \n6 A/78/7/Add.12. \n\nA/RES/78/253 \nSpecial subjects relating to the proposed programme budget \nfor 2024\n \n23-26236\n4/25 \n \nencourages the Court to continue to work towards the completion of the full \ndigitization of archives within the existing resources; \n \n11. \nAuthorizes the Secretary-General to enter into commitments in an amount \nnot to exceed 2,820,000 dollars to supplement the voluntary financial resources of the \nResidual Special Court for the period from 1 January to 31 December 2024, and \nrequests the Secretary-General to report on the use of the commitment authority in \nthe context of his next report;  \n \nIV \nRequest for a subvention to the Extraordinary Chambers in the Courts \nof Cambodia \n \n \nRecalling section I of its resolution 68/247 B of 9 April 2014, section I of its \nresolution 69/274 A, section IV of its resolution 70/248 A, section II of its resolution \n71/272 A, section IX of its resolution 72/262 A, section IV of its resolution 73/279 A, \nsection V of its resolution 74/263, section XX of its resolution 75/253 A, section XII \nof its resolution 76/246 A and section IV of its resolution 77/263 A,  \n \nHaving considered the report of the Secretary-General on the use of the \ncommitment authority and request for a subvention to the Extraordinary Chambers in \nthe Courts of Cambodia7 and the related report of the Advisory Committee,8 \n \n1. \nTakes note of the report of the Secretary-General;  \n \n2. \nEndorses the conclusions and recommendations contained in the report of \nthe Advisory Committee, subject to the provisions of the present resolution;  \n \n3. \nReaffirms the high priority accorded to the work of the Extraordinary \nChambers in the Courts of Cambodia;  \n \n4. \nNotes with appreciation the sustained contributions of the Government of \nCambodia, as the host country, for the Extraordinary Chambers;  \n \n5. \nEncourages the Extraordinary Chambers to continue to adopt appropriate \nmeasures for achieving operational savings and efficiencies while properly carrying \nout the residual functions in a transparent, accountable, cost-effective and expeditious \nmanner, with a view to a timely completion of the residual phase;  \n \n6. \nWelcomes the completion of judicial proceedings in all cases before the \nExtraordinary Chambers;  \n \n7. \nRecalls paragraph 14 of the report of the Advisory Committee, and stresses \nthe importance of maintaining and preserving the records of the Extraordinary \nChambers in the three official languages of the Chambers and making those \ndocuments easily accessible for the general public;  \n \n8. \nAlso recalls paragraph 16 of the report of the Advisory Committee, and \nreaffirms that expenses of the international component of the Extraordinary Chambers \nshould be borne by voluntary contributions, further encourages all Member States to \nprovide continuing and additional voluntary support for the Extraordinary Chambers, \nand requests the Secretary-General to continue his intensive efforts to obtain \nadditional voluntary contributions, including by broadening the donor base;  \n \n9. \nEncourages all Member States to provide continuing and additional \nvoluntary support for both the international and national components of the \n__________________ \n \n7 A/78/515. \n \n8 A/78/7/Add.21. \n\nSpecial subjects relating to the proposed programme budget  \nfor 2024 \nA/RES/78/253\n \n5/25\n23-26236 \n \nExtraordinary Chambers in support of the expeditious completion of the mandate of \nthe Chambers;  \n \n10. Welcomes all financial and in-kind contributions to support the work of the \nExtraordinary Chambers;  \n \n11. \nAuthorizes the Secretary-General to enter into commitments in an amount \nnot exceeding 2,216,700 dollars to supplement the voluntary financial resources of \nthe international component of the Extraordinary Chambers for the period from \n1 January to 31 December 2024, so as to enable the Chambers to carry out its judicial \nmandate, and requests the Secretary-General to report on the use of the commitment \nauthority in the context of the next report; \n \nV \nCapital investment planning \n \n \nRecalling its resolution 76/245, and its decision 77/548 B of 18 April 2023,  \n \nHaving considered the reports of the Secretary-General9 and the related reports \nof the Advisory Committee,10 \n \n1. \nTakes note of the report of the Secretary-General;11 \n \n2. \nEndorses the conclusions and recommendations contained in the report of \nthe Advisory Committee,12 subject to the provisions of the present resolution; \n \n3. \nEmphasizes that the capital investment plan presents the Secretariat\u2019s \nmedium- to long-term plan for capital investment needs in the United Nations \nSecretariat for information and planning purposes, with the aim of enhancing \ntransparency, predictability, accountability and coherence of capital investment \nneeds, and encourages the Secretary-General to report on those needs on a regular \nbasis;  \n \n4. \nRequests the Secretary-General to continue to ensure that the procurement \nof goods and services for the construction project is carried out in strict compliance \nwith the existing regulations, rules and relevant provisions of General Assembly \nresolutions governing procurement in the United Nations;  \n \n5. \nRecalls paragraph 54 of the report of the Advisory Committee, 13  and \nrequests the Secretary-General to continue to explore additional innovative ways to \npromote procurement from developing countries and countries with economies in \ntransition at Headquarters and field offices, and to report on concrete measures taken \nin this regard;  \n \n6. \nAlso recalls paragraph 59 of the report of the Advisory Committee, 14 and \nrequests that best practices from previous and ongoing capital investment and \nconstruction projects, experiences and lessons learned from governance and oversight \narrangements over capital investments, as well as industry best practices and tools, \nbe included in the capital investment planning reports;  \n \n7. \nFurther recalls paragraph 12 of the report of the Advisory Committee, 15 \nand requests the Secretary-General to ensure that the report on capital investment \nplanning includes information on the Organization\u2019s phased plans with medium- and \n__________________ \n \n9 A/77/519, A/78/536 and A/78/536/Corr.1. \n \n10 A/77/7/Add.23 and A/78/7/Add.20. \n \n11 A/78/536 and A/78/536/Corr.1. \n \n12 A/78/7/Add.20. \n \n13 Ibid. \n \n14 Ibid. \n \n15 Ibid. \n\nA/RES/78/253 \nSpecial subjects relating to the proposed programme budget \nfor 2024\n \n23-26236\n6/25 \n \nlong-term perspectives on capital investment needs for information and planning \npurposes such as information and communications technology equipment standards, \nassets renewal plan, safety and security, and buildings and facilities, and encourages \nthe Secretary-General to further refine and standardize the information, analysis and \npresentation of information in terms of detail, timescale, comparability and \nintegration and thus enable better understanding, comparison and analysis of the \nstrategic needs of the Organization across all lines of capital investment;  \n \n8. \nWelcomes the application of lessons learned in designing information and \ncommunications technology infrastructures to ensure stronger connectivity and \nbackups in operations through capital investment and maintenance projects, and \nrequests the Secretary-General to continue his efforts in this regard and report thereon \nthrough the capital investment planning report on further assessments and the \nresulting strategies, including their impacts and benefits;  \n \n9. \nTrusts that the Secretary-General will ensure that all resource requirements \nrelated to the capital investment plan are and will be presented through the proposed \nprogramme budget;  \n \n10. Recalls paragraph 49 of the report of the Advisory Committee, 16  and \nrequests the Secretary-General to remain proactive in seeking both voluntary and \nin- kind contributions from Member States, in full compliance with all relevant rules \nand regulations of the Organization; \n \nVI \nAssessment of the workplace at United Nations Headquarters \n \n \nRecalling section V of its resolution 67/246, section III of its resolution \n67/254 A of 12 April 2013, section IV of its resolution 68/247 B, section VII of its \nresolution 69/274 A, section XVI of its resolution 71/272 A, section XI of its \nresolution 72/262 A, section VI of its resolution 73/279 A, section IX of its resolution \n74/263, section XIII of its resolution 75/253 A and section II of its resolution 75/253 C \nof 30 June 2021, \n \nHaving considered the report of the Secretary-General17 and the related report \nof the Advisory Committee,18 \n \nHaving also considered the report of the Office of Internal Oversight Services \non the evaluation of the implementation of a flexible workplace at United Nations \nHeadquarters,19 \n \n1. \nTakes note of the report of the Secretary-General;  \n \n2. \nEndorses the conclusions and recommendations contained in the report of \nthe Advisory Committee; \n \nVII \nAdministrative expenses of the United Nations Joint Staff Pension Fund \n \n \nRecalling its resolution 70/238 A of 23 December 2015, section XIII of its \nresolution 76/246 A and its resolution 77/258 of 30 December 2022,  \n \nHaving considered the report of the United Nations Joint Staff Pension Board \non the work of its seventy-fifth session and administrative expenses of the United \n__________________ \n \n16 Ibid. \n \n17 A/78/325. \n \n18 A/78/7/Add.15. \n \n19 A/78/225. \n\nSpecial subjects relating to the proposed programme budget  \nfor 2024 \nA/RES/78/253\n \n7/25\n23-26236 \n \nNations Joint Staff Pension Fund, 20  the report of the Secretary-General on the \nadministrative and financial implications arising from the report of the United Nations \nJoint Staff Pension Board,21 the financial report and audited financial statements for \nthe year ended 31 December 2022 and the report of the Board of Auditors on the \nFund22 and the recommendations contained therein, the report of the Chief Executive \nof Pension Administration and the Representative of the Secretary-General for the \ninvestment of the assets of the Fund on the implementation of the recommendations \nof the Board of Auditors contained in its report for the year ended 31 December 2022 \non the United Nations Joint Staff Pension Fund 23  and the related report of the \nAdvisory Committee,24 \n \n1. \nTakes note of the report of the United Nations Joint Staff Pension Board \nand the report of the Secretary-General;  \n \n2. \nAlso takes note of the report of the Chief Executive of Pension \nAdministration and the Representative of the Secretary-General for the investment of \nthe assets of the Fund on the implementation of the recommendations of the Board of \nAuditors contained in its report for the year ended 31 December 2022 on the United \nNations Joint Staff Pension Fund; \n \n3. \nEndorses the conclusions and recommendations contained in the report of \nthe Advisory Committee; \n \n4. \nAcknowledges that some members of the Pension Board were unable to \nattend the seventy-fifth session of the Board due to challenges beyond their control, \nand looks forward to the future efforts of hosting Governments and the Board\u2019s \nsecretariat in facilitating the participation of the members of the Board at its sessions, \nas needed and appropriate; \n \n5. \nRecalls paragraph 158 of the report of the Pension Board, and requests the \nBoard to examine any other circumstances where the guidelines could be extended in \nthe context of changes in national law and marital status; \n \n6. \nApproves the changes to the staffing table as set out in the table below: \n \n \nA. \nPension Administration \n \n \nAction \nTitle of post \nCategory/Level \nNumber \nNew post \nInformation Systems Officer \nP-4 \n1 \nNew post \nInformation Systems Officer \nP-3 \n1 \nNew post \nBenefits Assistant \nGS (OL) \n1 \nNew post \nAdministrative Assistant \nGS (OL) \n1 \nTotal net changes \n \n \n4 \nReclassification \nSenior Finance and Budget Officer \nP-5 \n1 \nReclassification \nBenefits Officer \nP-4 \n1 \nReclassification \nSenior Facilities Management Assistant \nGS (PL) \n1 \n__________________ \n \n20 A/78/329. \n \n21 A/C.5/78/4. \n \n22 Official Records of the General Assembly, Seventy-eighth Session, Supplement No. 5P \n(A/78/5/Add.16). \n \n23 A/78/323. \n \n24 A/78/7/Add.7. \n\nA/RES/78/253 \nSpecial subjects relating to the proposed programme budget \nfor 2024\n \n23-26236\n8/25 \n \nAction \nTitle of post \nCategory/Level \nNumber \nRedeployment from \nContracts Management \nUnit to Sourcing \nCoordination Unit \nContracts Management Officer \nP-3 \n1 \nRedeployment from \nContracts Management \nUnit to Sourcing \nCoordination Unit \nAdministrative Assistant \nGS (OL) \n1 \n \n \n \nB. \nOffice of Investment Management \n \n \nAction \nTitle of post \nCategory/Level \nNumber \nNew post \nInvestment Officer (Private Markets) \nP-4 \n1 \nNew post \nInvestment Officer (Sustainable Investing) \nP-4 \n1 \nNew post \nAssociate Legal Officer \nP-2/1 \n1 \nNew post \nSenior Information Assistant \nGS (PL) \n1 \nNew post \nInformation Technology Assistant \nGS (OL) \n1 \nNew post \nAssociate Human Resources Officer \nP-2/1 \n1 \nNew post \nProgramme Management Officer \nP-3 \n1 \nNew post \nAssociate Data Analyst \nP-2/1 \n1 \nTotal net changes \n \n \n8 \nReclassification \nSenior Human Resources Assistant \nGS (PL) \n1 \nRedeployment from Office \nof the Representative of \nthe Secretary-General to \nLegal Team \nSenior Legal Officer \nP-5 \n1 \nRedeployment from Office \nof the Representative of \nthe Secretary-General to \nLegal Team \nLegal Officer \nP-4 \n1 \nRedeployment from Office \nof the Representative of \nthe Secretary-General to \nLegal Team \nLegal Officer \nP-3 \n2 \nRedeployment from Office \nof the Representative of \nthe Secretary-General to \nLegal Team \nAssociate Legal Officer \nP-2/1 \n1 \nRedeployment from Office \nof the Representative of \nthe Secretary-General to \nLegal Team \nLegal Assistant \nGS (OL) \n1 \n \nAbbreviations: GS (OL), General Service (Other level); GS (PL), General Service (Principal level). \n \n \n \n7. \nApproves the estimates of 139,789,700 dollars for the administration of the \nFund for 2024;  \n \n8. \nAlso approves expenses, chargeable directly to the Fund, totalling \n131,366,600 dollars net for 2024;  \n\nSpecial subjects relating to the proposed programme budget  \nfor 2024 \nA/RES/78/253\n \n9/25\n23-26236 \n \n \n9. \nFurther approves the amount of 8,423,100 dollars as the cost of the \nservices provided by the United Nations Joint Staff Pension Fund to the secretariat of \nthe United Nations Staff Pension Committee for 2024, of which 5,188,600 dollars \nwould represent the share of the regular budget and the balance of 3,234,500 dollars \nwould represent the share of the funds and programmes;  \n \n10. Approves the decrease of 293,000 dollars in the United Nations share of \nthe cost of the administrative expenses of the central secretariat of the Fund under \nsection 1, Overall policymaking, direction and coordination, of the proposed \nprogramme budget for 2024;  \n \n11. \nAuthorizes the Pension Board to supplement the voluntary contributions \nto the Emergency Fund for 2024 by an amount not to exceed 112,500 dollars;  \n \nVIII \nRevised estimates relating to the proposed programme budget for 2024 under \nsection 34, Safety and security, related to strategic security resilience \n \n \nHaving considered the report of the Secretary-General25 and the related report \nof the Advisory Committee,26 \n \n1. \nTakes note of the report of the Secretary-General;  \n \n2. \nEndorses the conclusions and recommendations contained in the report of \nthe Advisory Committee, subject to the provisions of the present resolution;  \n \n3. \nApproves the establishment of 19 posts (2 P-5, 7 P-4, 5 P-3, 2 P-2 and \n3 General Service (Other level)) under section 34, Safety and security, of the proposed \nprogramme budget for 2024;  \n \n4. \nAppropriates an additional amount of 2,559,700 dollars under section 34, \nSafety and security, of the proposed programme budget for 2024, which would \nrepresent a charge against the contingency fund;  \n \n5. \nAlso appropriates an amount of 220,900 dollars under section 36, Staff \nassessment, of the proposed programme budget for 2024, to be offset by an equivalent \nincrease of 220,900 dollars under income section 1, Income from staff assessment; \n \nIX \nRevised estimates resulting from resolutions adopted by the General Assembly \nat its seventy-seventh session \n \n \nHaving considered the report of the Secretary-General27 and the related report \nof the Advisory Committee,28 \n \n1. \nTakes note of the report of the Secretary-General;  \n \n2. \nEndorses the conclusions and recommendations contained in the report of \nthe Advisory Committee;  \n \n3. \nApproves the establishment, effective 1 January 2024, of five new \ntemporary posts (2 P-4, 1 P-2, 1 GS (PL), 1 GS (OL)) under section 8, Legal affairs, \nof the proposed programme budget for 2024, to support the activities mandated by \nGeneral Assembly resolution 77/321 of 1 August 2023;  \n \n4. \nAppropriates an additional amount of 3,431,700 dollars, comprising \n825,800 dollars under section 1, Overall policymaking, direction and coordination, \n__________________ \n \n25 A/78/530. \n \n26 A/78/7/Add.22. \n \n27 A/78/550. \n \n28 A/78/7/Add.24. \n\nA/RES/78/253 \nSpecial subjects relating to the proposed programme budget \nfor 2024\n \n23-26236\n10/25 \n \n5,000 dollars under section 2, General Assembly and Economic and Social Council \naffairs and conference management, 2,503,600 dollars under section 8, Legal affairs, \n71,000 dollars under section 29B, Department of Operational Support, and \n26,300 dollars under section 29C, Office of Information and Communications \nTechnology, of the proposed programme budget for 2024, representing a charge \nagainst the contingency fund;  \n \n5. \nAlso appropriates an amount of 122,100 dollars under section 36, Staff \nassessment, of the proposed programme budget for 2024, to be offset by an equivalent \namount under income section 1, Income from staff assessment;  \n \nX \nRevised estimates resulting from resolutions and decisions adopted by the \nEconomic and Social Council at its 2023 session \n \n \nHaving considered the report of the Secretary-General29 and the related report \nof the Advisory Committee,30 \n \n1. \nTakes note of the report of the Secretary-General;  \n \n2. \nEndorses the conclusions and recommendations contained in the report of \nthe Advisory Committee;  \n \n3. \nAppropriates an additional amount of 1,442,000 dollars, comprising \n969,900 dollars under section 18, Economic and social development in Africa, \n468,300 dollars under section 20, Economic development in Europe, and \n3,800 dollars under section 29E, Administration, Geneva, of the proposed programme \nbudget for 2024, representing a charge against the contingency fund;  \n \n4. \nAlso appropriates an amount of 149,400 dollars under section 36, Staff \nassessment, of the proposed programme budget for 2024, to be offset by an equivalent \namount under income section 1, Income from staff assessment;  \n \nXI \nRevised estimates resulting from resolutions and decisions adopted by the \nHuman Rights Council at its fifty-second, fifty-third and fifty-fourth regular \nsessions, and at its thirty-sixth special session, in 2023 \n \n \nHaving considered the report of the Secretary-General31 and the related report \nof the Advisory Committee,32 \n \n1. \nTakes note of the report of the Secretary-General;  \n \n2. \nEndorses the conclusions and recommendations contained in the report of \nthe Advisory Committee;  \n \n3. \nApproves the establishment, effective 1 January 2024, of 67 posts (2 P-5, \n24 P-4, 16 P-3, 12 P-2, 7 National Professional Officer, 6 General Service (Other \nlevel), including 9 temporary posts: 6 P-4, 1 P-3, 1 P-2, 1 General Service (Other \nlevel)) under section 24, Human rights, of the proposed programme budget for 2024, \nto support the activities mandated by the Human Rights Council in its resolutions \n__________________ \n \n29 A/78/334. \n \n30 A/78/7/Add.8. \n \n31 A/78/574. \n \n32 A/78/7/Add.39. \n\nSpecial subjects relating to the proposed programme budget  \nfor 2024 \nA/RES/78/253\n \n11/25\n23-26236 \n \n52/14 of 3 April 2023,33 53/28 of 4 April 2023,34 53/29 of 14 July 2023,35 54/9 of \n11 October 202336 and 54/18,37 54/22,38 54/2639 and 54/3340 of 12 October 2023;  \n \n4. \nAppropriates an additional amount of 47,711,300 dollars, comprising \n2,784,700 dollars under section 2, General Assembly and Economic and Social \nCouncil affairs and conference management, and 44,926,600 dollars under section 24, \nHuman rights, of the proposed programme budget for 2024;  \n \n5. \nAlso appropriates an amount of 4,244,100 dollars under section 36, Staff \nassessment, of the proposed programme budget for 2024, to be offset by an equivalent \namount under income section 1, Income from staff assessment;  \n \nXII \nRevised estimates relating to the proposed programme budget for 2024 under \nsection 29A, Department of Management Strategy, Policy and Compliance, and \nsection 29B, Department of Operational Support, related to addressing racism \nand promoting dignity for all in the United Nations Secretariat \n \n \nRecalling its resolution 76/271,  \n \nHaving considered the report of the Secretary-General41 and the related report \nof the Advisory Committee,42 \n \n1. \nTakes note of the report of the Secretary-General;  \n \n2. \nEndorses the conclusions and recommendations contained in the report of \nthe Advisory Committee, subject to the provisions of the present resolution;  \n \n3. \nCondemns in the strongest possible terms acts of racism and reaffirms that \nracism and racial discrimination have no place in the United Nations and that all \nMember States must work together to eliminate racism, and requests the Secretary-\nGeneral to continue the implementation of the United Nations zero-tolerance \napproach on racism and intensify his support to the work of the Anti-Racism Office, \nin addressing racism within the Secretariat, including through encouraging staff to \nreport such abuses and by consolidating lessons learned and best practices;  \n \n4. \nNotes the long-standing efforts and initiatives by the United Nations to \ncombat racism and racial discrimination in the Secretariat, and welcomes the role \nplayed by the Special Adviser to the Secretary-General for Addressing Racism in the \nWorkplace in this regard;  \n \n5. \nRequests the Secretary-General to ensure that all future reports on this \nquestion are entitled \u201cAddressing racism and racial discrimination\u201d and focus on \ncombating racism and racial discrimination;  \n \n6. \nRecalls paragraph 28 of the report of the Advisory Committee, and further \nrequests the Secretary-General to further refine the strategic action plan, based on \nwider data sources and further analysis, and continue to implement the three-pronged \napproach for action developed by the Anti-Racism Team to focus on combating racism \nand racial discrimination, and report thereon in the context of the next report;  \n__________________ \n \n33 See Official Records of the General Assembly, Seventy-eighth Session, Supplement No. 53 \n(A/78/53), chap. V, sect. A. \n \n34 Ibid., chap. VII, sect. A. \n \n35 Ibid. \n \n36 Ibid., Supplement No. 53A (A/78/53/Add.1), chap. III, sect. A. \n \n37 Ibid., chap. II. \n \n38 Ibid., chap. III, sect A. \n \n39 Ibid. \n \n40 Ibid. \n \n41 A/78/384. \n \n42 A/78/7/Add.16. \n\nA/RES/78/253 \nSpecial subjects relating to the proposed programme budget \nfor 2024\n \n23-26236\n12/25 \n \n \n7. \nRequests the Secretary-General to ensure a system-wide zero-tolerance \npolicy on racism and racial discrimination in the workplace, and to continue to \nstrengthen policies and guidelines on addressing racism and racial discrimination, \nstresses that racism and racial discrimination have no place in the United Nations and \noffend the very principles of what the Organization stands for and undermine the core \nvalues of integrity, competence and professionalism expected of all staff, and \nemphasizes that racism and racial discrimination shall not be tolerated and that \nperpetrators must be held accountable and staff must feel safe, and further requests \nthe Secretary-General to report thereon in the next report;  \n \n8. \nAlso requests the Secretary-General to provide an update on the global \nconference of United Nations anti-racism advocates in his next report;  \n \n9. \nNotes with appreciation the work of the Anti-Racism Team in the \ncollection and analysis of data, and requests the Secretary-General to collect more \ncomprehensive and reliable data regarding racism and racial discrimination;  \n \n10. Requests the Secretary-General to make every effort to further strengthen \ncooperation and coordination of the Office of the Special Adviser with other United \nNations offices and continue his consultations with other intergovernmental and \nexpert bodies that have a mandate on racism and racial discrimination to capture \nlessons learned and best practices from the experiences, including from other \norganizations and Member States, in addressing racial discrimination;  \n \n11. \nAlso requests the Secretary-General to use the ClearCheck database in \norder to prevent the hiring and re-hiring of individuals whose working relationship \nwith an organization of the system ended because of a determination that they had \nperpetrated racism and racial discrimination, and report on progress in the next report;  \n \n12. Recalls paragraph 24 of the report of the Advisory Committee, stresses the \nimportance of the Anti-Racism Office and its role in addressing racial discrimination, \ndecides to review its structure, placement and reporting, and requests the Secretary-\nGeneral to propose options for consideration by the General Assembly at the first part \nof its resumed eightieth session;  \n \n13. Notes the distinct roles and responsibilities of the entities involved in the \nOrganization\u2019s accountability processes, and requests the Secretary-General to ensure \ncomplementarity and work towards addressing potential duplication of existing \nresources and realizing synergies, efficiencies, coordination and cooperation;  \n \n14. Requests the Secretary-General to review the policies, rules and \nprocedures on recruitment, hiring, promotion and other aspects of human resources \nmanagement of the Organization and propose measures with a view to preventing and \naddressing cases of racial bias, including at the Director and higher levels of the \nSecretariat, and to promote the implementation of the decisions of the General \nAssembly;  \n \n15. Approves the conversion of eight temporary positions to posts and the \nestablishment of three posts, as reflected in the table below: \n \nD-2 \nD-1 \nP-5 \nP-4 \nP-3 \nP-2 GS (PL) GS (OL) \nTotal \nDepartment of Management \nStrategy, Policy and Compliance \n1 \n\u2013 \n3 \n3 \n1 \n1 \n\u2013 \n1 \n10 \nDepartment of Operational Support \n\u2013 \n\u2013 \n\u2013 \n1 \n\u2013 \n\u2013 \n\u2013 \n\u2013 \n1 \nTotal \n1 \n\u2013 \n3 \n4 \n1 \n1 \n\u2013 \n1 \n11 \n \nAbbreviations: GS (OL), General Service (Other level); GS (PL), General Service (Principal level). \n \n \n\nSpecial subjects relating to the proposed programme budget  \nfor 2024 \nA/RES/78/253\n \n13/25\n23-26236 \n \n \n16. Also \napproves \nan \nadditional \nappropriation \nin \nthe \namount \nof \n1,041,000 dollars, comprising 1,011,000 dollars under section 29A, Department of \nManagement Strategy, Policy and Compliance, and 30,000 dollars under section 29B, \nDepartment of Operational Support, of the proposed programme budget for 2024, \nrepresenting a charge against the contingency fund;  \n \n17. Further approves an additional appropriation in the amount of \n60,800 dollars under section 36, Staff assessment, of the proposed programme budget \nfor 2024, to be offset by an equivalent amount under income section 1, Income from \nstaff assessment;  \n \nXIII \nSeismic mitigation retrofit and life-cycle replacements project at the Economic \nand Social Commission for Asia and the Pacific premises in Bangkok \n \n \nRecalling section XII of its resolution 70/248 A, section IV of its resolution \n71/272 A, section XIII of its resolution 72/262 A, section VII of its resolution \n73/279 A, section XII of its resolution 74/263, section XII of its resolution 75/253 A, \nsection VII of its resolution 76/246 A and section XI of its resolution 77/263 A,  \n \nHaving considered the report of the Secretary-General43 and the related report \nof the Advisory Committee,44 \n \n1. \nTakes note of the report of the Secretary-General;  \n \n2. \nEndorses the conclusions and recommendations contained in the report of \nthe Advisory Committee;  \n \n3. \nExpresses its gratitude to the Government of Thailand, as the host country, \nfor its continued efforts in supporting and facilitating the work of the Economic and \nSocial Commission for Asia and the Pacific through voluntary contributions and \ntransfer of local knowledge and expertise towards the execution of the project;  \n \n4. \nWelcomes the positive steps taken towards engaging with the host country, \nand encourages the Economic and Social Commission for Asia and the Pacific to \ncontinue to engage with the host country in this regard;  \n \n5. \nReiterates its request to the Secretary-General to remain proactive in \nseeking both voluntary and in-kind contributions from Member States, in full \ncompliance with all relevant rules and regulations of the Organization, and to provide \ndetailed information on the matter in the context of his next progress report;  \n \n6. \nRequests the Secretary-General to ensure that all activities promote cost-\nefficiency and transparency, are implemented within existing resources and in \naccordance with the United Nations legislative framework, including the Financial \nRegulations and Rules of the United Nations,45 while maintaining full accountability \nto the General Assembly;  \n \n7. \nStresses the importance of governance, effective oversight, transparency \nand accountability in the management of the project to ensure that the objectives of \nthe project are achieved within the approved budget and time schedule;  \n \n8. \nEmphasizes that the Global Asset Management Policy Service should \ncontinue to be actively involved in overseeing the project to ensure the central \nsupervision of capital projects, including risk management and alignment with \nlessons learned;  \n__________________ \n \n43 A/78/346. \n \n44 A/78/7/Add.17. \n \n45 ST/SGB/2013/4 and ST/SGB/2013/4/Amend.1. \n\nA/RES/78/253 \nSpecial subjects relating to the proposed programme budget \nfor 2024\n \n23-26236\n14/25 \n \n \n9. \nRequests the Secretary-General to continue to proactively monitor and \nmitigate all project risks, to take all measures necessary to ensure the delivery of the \nproject within the scope, budget and timeline approved by the General Assembly and \nto include in his next progress report an update on risk management and related \nmitigation measures;  \n \n10. Also requests the Secretary-General to continue to actively manage the \nowner-directed changes, and reiterates that any additional project costs resulting from \nlate-stage changes initiated by tenants, which may result in potential claims, should \nbe borne by the respective tenant, not by the Economic and Social Commission for \nAsia and the Pacific;  \n \n11. \nFurther requests the Secretary-General to continue to take into account \nlessons learned and best practices from past construction and renovation projects and, \nin particular, to draw from experience and knowledge acquired from other capital \nprojects, to ensure that the objectives of the project are achieved within budget and \nin a timely manner, and also requests the Secretary-General to provide an update on \nmeasures considered and applied in this regard in his next progress report;  \n \n12. Recalls paragraph 27 of the report of the Advisory Committee, and trusts \nthat further clarification regarding the potential benefits of upgrades to the Economic \nand Social Commission for Asia and the Pacific service building will be provided in \nfuture reports;  \n \n13. Encourages the Secretary-General to continue to intensify his efforts to \ninclude local knowledge, technology, capacity and the use of locally sourced and \nmanufactured materials, as well as local labour and expertise, throughout the \nimplementation of the construction project;  \n \n14. Notes the economies of scale achieved from the joint solicitation exercise \nof office furniture requirements with the Economic Commission for Africa, welcomes \nthe sharing of best practices and lessons learned in this regard with other capital \nprojects and United Nations entities, and encourages the Secretary-General to \ncontinue documenting best practices and lessons learned from other areas of the \nproject, including, inter alia, cost savings through value engineering and the use of \nlocal materials and knowledge;  \n \n15. Welcomes the steps taken by the Secretary-General to ensure that the \nEconomic and Social Commission for Asia and the Pacific building is compliant with \nrelevant building standards and best practices for persons with disabilities, and \nrequests the Secretary-General to provide an update on relevant progress made in his \nnext report;  \n \n16. Decides to abolish the post of Safety Project Officer (Local level);  \n \n17. Approves the revised estimated overall maximum cost of the project of \n41,260,400 dollars;  \n \n18. Appropriates an amount of 1,241,300 dollars for 2024, comprising \n253,600 dollars under section 19, Economic and social development in Asia and the \nPacific, and 987,700 dollars under section 33, Construction, alteration, improvement \nand major maintenance, of the proposed programme budget for 2024;  \n \nXIV \nProgress in the renovation of Africa Hall at the Economic Commission for \nAfrica in Addis Ababa \n \n \nRecalling section III of its resolution 65/259, section VII of its resolution \n66/247, section III of its resolution 68/247 A of 27 December 2013, section V of its \nresolution 69/262 of 29 December 2014, section IX of its resolution 70/248 A, \n\nSpecial subjects relating to the proposed programme budget  \nfor 2024 \nA/RES/78/253\n \n15/25\n23-26236 \n \nsection V of its resolution 71/272 A, section XII of its resolution 72/262 A, \nsection VIII of its resolution 73/279 A, section X of its resolution 74/263, section X \nof its resolution 75/253 A, section VIII of its resolution 76/246 A and section IX of \nits resolution 77/263 A,  \n \nHaving considered the report of the Secretary-General46 and the related report \nof the Advisory Committee,47 \n \n1. \nTakes note of the report of the Secretary-General;  \n \n2. \nEndorses the conclusions and recommendations contained in the report of \nthe Advisory Committee;  \n \n3. \nExpresses its appreciation to the Government of Ethiopia, as the host \ncountry, for its continued support for the project, and encourages the Secretary-\nGeneral to continue to engage with the host country, inter alia in protecting the \nenvironment, including the greening of the compound and public spaces in its \nvicinity;  \n \n4. \nRecalls paragraph 5 of the report of the Advisory Committee, appreciates \nthe contribution by Member States, especially the Government of Mali and other \nMember States that contributed and made pledges to the project, and reiterates its \nrequest to the Secretary-General to continue to seek both voluntary and in-kind \ncontributions from Member States, in full compliance with all relevant regulations \nand rules of the Organization, and to provide detailed information on the matter in the \ncontext of his next progress report;  \n \n5. \nEncourages the Secretary-General to engage with the member States of \nthe African Union as well as the African Union Commission, to mobilize voluntary \ncontributions to support the project and the visitors\u2019 centre, taking into consideration \nthat Africa Hall is the historical birthplace of the Organization of African Unity and \nthe African heritage it represents;  \n \n6. \nReiterates its appreciation for the continued commitment of the Secretary-\nGeneral to ensuring the preservation of the historical and architectural integrity of \nAfrica Hall, and reiterates its request that the Secretary-General enhance efforts to \nengage key stakeholders in implementing the heritage conservation objective, to raise \nglobal awareness of the historic Africa Hall and the African heritage that it represents, \nand to cultivate partnerships with regional and international academic and research \ninstitutions, including universities and museums, specializing in African history and \nculture;  \n \n7. \nRecalls paragraph 9 of the report of the Advisory Committee, and requests \nthe Secretary-General to ensure that any attempts to cut costs and employ value \nengineering methods will not have an impact on the quality and scope of the work to \nbe performed and the preservation of the heritage of Africa Hall;  \n \n8. \nStresses the importance of governance, effective oversight, transparency \nand accountability in the management of the project to ensure that the objectives of \nthe project are achieved within the approved budget and time schedule;  \n \n9. \nEmphasizes that the Global Asset Management Policy Service should \ncontinue to be actively involved in overseeing the project to ensure the central \nsupervision of capital projects, including risk management and alignment with \nlessons learned, and encourages the Secretary-General to continue to engage with the \n__________________ \n \n46 A/78/350. \n \n47 A/78/7/Add.19. \n\nA/RES/78/253 \nSpecial subjects relating to the proposed programme budget \nfor 2024\n \n23-26236\n16/25 \n \nStakeholders Committee, the Advisory Board and the host country to improve \ncoordination efforts in the implementation of the project;  \n \n10. Requests the Secretary-General to ensure that all activities promote cost-\nefficiency and transparency, are implemented within existing resources and in \naccordance with the United Nations legislative framework, including the Financial \nRegulations and Rules, while maintaining full accountability to the General \nAssembly;  \n \n11. \nReiterates its request to the Secretary-General to include an update on the \nmanagement of the main risks and the related mitigation measures, with a view to \nkeeping the approved time frame of the project, to avoiding cost overruns and to \nensuring the delivery of the project within the scope, budget and timeline, as approved \nby the General Assembly, and requests an update in the context of his next progress \nreport;  \n \n12. Welcomes the steps taken by the Secretary-General to ensure the \nconformity of Africa Hall and its visitors\u2019 centre with relevant building codes and \nstandards, as well as best practices for persons with disabilities and encourages the \nEconomic Commission for Africa to continue to pursue such efforts, and requests the \nSecretary-General to provide an update on relevant progress made in his next report;  \n \n13. Requests the Secretary-General to continue his efforts to conduct the \nnecessary analysis to finalize the establishment of an energy efficiency baseline and \nprovide a detailed update to the General Assembly in the context of the next progress \nreport;  \n \n14. Also requests the Secretary-General to continue documenting best \npractices and lessons learned from capital construction projects, including value \nengineering, multistage request for proposals and the use of local materials and \nknowledge, and to consider their application, as appropriate, to ensure that the \nobjectives of this project are achieved within the approved budget and timeline;  \n \n15. Encourages the Secretary-General to continue to utilize local knowledge, \nmaterials, technology and capacity throughout the implementation of construction \nand renovation projects at the Economic Commission for Africa in Addis Ababa, as \nappropriate;  \n \n16. Recalls paragraph 29 of the report of the Advisory Committee, and \nrequests the Secretary-General to refine the business case for the visitors\u2019 centre and \nprovide revenue projections, justifications and an assessment of options to support \nfuture financial stability of the centre, while making sure that fees for services to the \npublic are reasonable and affordable to a wide range of income groups and segments \nof society and that the centre contributes to the strengthening of awareness of the \nwork of the United Nations;  \n \n17. Appropriates a net amount of 13,475,700 dollars for project activities in \n2024 comprising 1,127,600 dollars under section 18, Economic and social \ndevelopment in Africa, 12,097,200 dollars under section 33, Construction, alteration, \nimprovement and major maintenance, and 250,900 dollars under section 34, Safety \nand security, of the proposed programme budget for 2024; \n \nXV \nAddressing the deteriorating conditions and limited capacity of the conference \nservices facilities at the United Nations Office at Nairobi \n \n \nRecalling its resolution 73/270 of 22 December 2018, section XIV of its \nresolution 74/263, section III of its resolution 75/253 B of 16 April 2021, section IV \nof its resolution 76/246 A and section VIII of its resolution 77/263 A,  \n\nSpecial subjects relating to the proposed programme budget  \nfor 2024 \nA/RES/78/253\n \n17/25\n23-26236 \n \n \nHaving considered the report of the Secretary-General48 and the related report \nof the Advisory Committee,49 \n \n1. \nTakes note of the report of the Secretary-General;  \n \n2. \nEndorses the conclusions and recommendations contained in the report of \nthe Advisory Committee;  \n \n3. \nExpresses its gratitude to the Government of Kenya for its continued \nsupport for the United Nations Office at Nairobi, and trusts that the Secretary-General \nwill continue to engage with the host country to ensure the success of the project;  \n \n4. \nAcknowledges the need to address the deteriorating conditions and limited \ncapacity of the conference services facilities at the United Nations Office at Nairobi \nand the urgent need to implement the project in a timely manner to address the \nsituation, increase its utilization and to bring the Office to a standard consistent with \nother United Nations headquarters;  \n \n5. \nReiterates its request to the Secretary-General to remain proactive in \nseeking both voluntary and in-kind contributions from Member States, in full \ncompliance with all relevant rules and regulations of the Organization, and to provide \ndetailed information on the matter in the context of his next progress report;  \n \n6. \nRequests the Secretary-General to incorporate the envisaged renewable \nenergy efficiency measures, wastewater treatment, solid waste management and water \nmanagement into the project design;  \n \n7. \nEmphasizes that the utilization and management of the conference \nfacilities of the United Nations Office at Nairobi should be in line with the applicable \ncriteria for the use of United Nations premises, and encourages the use of best \npractices and lessons learned from other United Nations conference facilities;  \n \n8. \nRecalls its resolution 77/263 A, reiterates the important role of the United \nNations Office at Nairobi as a duty station of the United Nations, requests the \nSecretary-General to continue to ensure compliance with the general principle \nestablished in the headquarters rule, encourages the Secretary-General to continue the \nefforts being made by the United Nations Office at Nairobi to attract more United \nNations intergovernmental meetings to its facilities, as appropriate, and emphasizes \nthat the intergovernmental meetings shall be given priority in using the facilities to \nfurther increase the utilization of the conference facilities;  \n \n9. \nNotes that the commencement of the design phase allows for voluntary \ncontributions and other forms of support to be sought, which may potentially \ncontribute to offsetting the overall cost of the project;  \n \n10. Decides to approve the scope of option B for the conference facilities \ncapital project at the United Nations Office at Nairobi, and requests the Secretary-\nGeneral to ensure that any change that affects the scope of the project is presented for \nthe consideration and decision of the General Assembly;  \n \n11. \nRecalls section VII of its resolution 66/247, and requests the Secretary-\nGeneral to ensure the implementation of this project and the finalization of the other \nongoing major capital project in a timely manner;  \n \n12. Decides to approve the recommended implementation strategy and \nschedule for the project;  \n__________________ \n \n48 A/78/382 and A/78/382/Corr.1. \n \n49 A/78/7/Add.10. \n\nA/RES/78/253 \nSpecial subjects relating to the proposed programme budget \nfor 2024\n \n23-26236\n18/25 \n \n \n13. Recalls paragraph 26 of the report of the Advisory Committee, and \nrequests the Secretary-General to ensure the implementation of the conference \nservices facilities project in a timely manner;  \n \n14. Also recalls paragraph 27 of the report of the Advisory Committee, and \nfurther encourages the Secretary-General to continue to identify potential linkages \nand synergies between this project and the project for the replacement of office blocks \nA to J;  \n \n15. Further recalls paragraph 29 of the report of the Advisory Committee, and \nencourages the Secretary-General to intensify his efforts to incorporate local \nknowledge, technology, capacity and the use of locally sourced and manufactured \nmaterials, as well as local labour and expertise, throughout the implementation of the \nconstruction project, and looks forward to updates thereon in future progress reports;  \n \n16. Requests the Secretary-General to ensure that all activities promote cost-\nefficiency and transparency, are implemented within existing resources and in \naccordance with the United Nations legislative framework, including the Financial \nRegulations and Rules, while maintaining full accountability to the General \nAssembly; \n \n17. Stresses the importance of governance, effective oversight, transparency \nand accountability in the management of the project to ensure that the objectives of \nthe project are achieved within the approved budget and time schedule;  \n \n18. Requests the Secretary-General to explore possible cost-sharing \narrangements that may be implemented by the United Nations Office at Nairobi \nconference facilities and to report thereon in the next progress report;  \n \n19. Also requests the Secretary-General to continue to proactively monitor and \nmitigate all project risks, to take all measures necessary to ensure the delivery of the \nproject within the scope, budget and timeline approved by the General Assembly and \nto include in his next progress report an update on risk management and related \nmitigation measures;  \n \n20. Further requests the Secretary-General, through the Global Asset \nManagement Policy Service, to take into account lessons learned and best practices \nfrom similar United Nations construction and renovation projects in the planning, \ndesign and implementation of the proposed conference services facilities;  \n \n21. Recalls its resolution 77/263 A, and requests the Secretary-General to \ncontinue to ensure conformity with relevant building codes and standards, technology \nand workplace safety, as well as best practices for persons with disabilities, in the \ndesign, construction and renovation of the United Nations Office at Nairobi facilities;  \n \n22. Affirms that the proposed dedicated project management team for the \nUnited Nations Office at Nairobi conference services facilities will be a time-limited \nand mission-specific endeavour and that the team should therefore not be a permanent \naddition to the existing organisational structure;  \n \n23. Recalls paragraph 20 of section VIII of its resolution 77/263 A, in which \nit established a multi-year construction-in-progress account for the duration of the \nproject;  \n \n24. Stresses that any increase to the maximum overall budget must be \napproved by the General Assembly before entering into corresponding financial \ncommitments;  \n \n25. Notes with concern that the projected costs for the design consultancy firm \nhave increased by 58.1 per cent since the previous report of the Secretary-General, \n\nSpecial subjects relating to the proposed programme budget  \nfor 2024 \nA/RES/78/253\n \n19/25\n23-26236 \n \nand stresses the need to achieve the full scope and objectives of the project within the \napproved overall maximum budget;  \n \n26. Notes that changes in escalation rates constitute direct changes in the \noverall project resource requirements, and stresses that such changes should be \naccurately reflected in the report of the Secretary-General to the General Assembly;  \n \n27. Decides to approve the maximum overall cost of the project in the amount \nof 265,659,200 dollars;  \n \n28. Appropriates an amount of 11,928,200 dollars for the project in 2024, \ncomprising 9,837,000 dollars under section 33, Construction, alteration, improvement \nand major maintenance, and 2,091,200 dollars under section 29D, Administration, \nNairobi, of the proposed programme budget for 2024; \n \nXVI \nProgress on the replacement of office blocks A to J at the United Nations Office \nat Nairobi \n \n \nRecalling section XIV of its resolution 72/262 A, section IX of its resolution \n73/279 A, section XIII of its resolution 74/263, section XIV of its resolution \n75/253 A, section XV of its resolution 76/246 A and section XII of its resolution \n77/263 A,  \n \nHaving considered the report of the Secretary-General50 and the related report \nof the Advisory Committee,51 \n \n1. \nTakes note of the report of the Secretary-General;  \n \n2. \nEndorses the conclusions and recommendations contained in the report of \nthe Advisory Committee;  \n \n3. \nExpresses its gratitude to the Government of Kenya for its continued \nsupport for the United Nations Office at Nairobi, and trusts that the Secretary-General \nwill continue to engage with the host country to ensure the success of the project;  \n \n4. \nReiterates its request to the Secretary-General to remain proactive in \nseeking both voluntary and in-kind contributions from Member States, in full \ncompliance with all relevant rules and regulations of the Organization, and to provide \nan update in the context of his next progress report;  \n \n5. \nStresses the importance of governance, effective oversight, transparency \nand accountability in the management of the project to ensure that the objectives of \nthe project are achieved within the approved budget and time schedule; \n \n6. \nEmphasizes that the Global Asset Management Policy Service should \ncontinue to be actively involved in overseeing the project to ensure the central \nsupervision of capital projects, including risk management and alignment with \nlessons learned;  \n \n7. \nRecalls paragraph 19 of the report of the Advisory Committee, and \nencourages the Secretary-General to intensify his efforts to incorporate local \nknowledge, technology, capacity and the use of locally sourced and manufactured \nmaterials, as well as local labour and expertise, especially throughout the \nimplementation of the construction project, and looks forward to updates thereon in \nfuture progress reports;  \n__________________ \n \n50 A/78/510 and A/78/510/Corr.1. \n \n51 A/78/7/Add.11. \n\nA/RES/78/253 \nSpecial subjects relating to the proposed programme budget \nfor 2024\n \n23-26236\n20/25 \n \n \n8. \nAlso recalls paragraph 22 of the report of the Advisory Committee, and \nrequests the Secretary-General to continue to identify any potential synergies between \nthis project and the United Nations Office at Nairobi conference facilities project, and \nalso requests him to provide further information in the context of his next report;  \n \n9. \nFurther recalls paragraph 29 of the report of the Advisory Committee, and \nrequests the Secretary-General, through the Global Asset Management Policy \nService, to take into account lessons learned and best practices from similar \nconstruction and renovation projects in the planning, design and implementation of \nthe proposed replacement of office blocks A to J;  \n \n10. Requests the Secretary-General to incorporate the envisaged renewable \nenergy efficiency measures, wastewater treatment, solid waste management and water \nmanagement into the design and construction of the project;  \n \n11. \nAlso requests the Secretary-General to ensure that all activities promote \ncost-efficiency and transparency, are implemented within existing resources and in \naccordance with the United Nations legislative framework, including the Financial \nRegulations and Rules, while maintaining full accountability to the General \nAssembly;  \n \n12. Notes with appreciation that the project is progressing in accordance with \nits approved objectives in terms of energy efficiency and in compliance with health \nand safety regulations;  \n \n13. Appropriates an amount of 15,042,900 dollars for 2024, comprising \n770,200 dollars under section 29D, Administration, Nairobi, 14,107,700 dollars under \nsection 33, Construction, alteration, improvement and major maintenance, and \n165,000 dollars under section 34, Safety and security, of the proposed programme \nbudget for the year 2024;  \n \nXVII \nEstimates in respect of special political missions, good offices and other \npolitical initiatives authorized by the General Assembly and/or the \nSecurity Council \n \n \nHaving considered the reports of the Secretary-General52 and the related reports \nof the Advisory Committee,53 \n \n1. \nTakes note of the reports of the Secretary-General; \n \n2. \nEndorses the conclusions and recommendations contained in the reports \nof the Advisory Committee, subject to the provisions of the present resolution; \n \n3. \nApproves the budgets in the amount of 717,725,500 dollars for the \n37 continuing special political missions authorized by the General Assembly and/or \nthe Security Council, and an amount of 2,128,800 dollars for the share of special \npolitical missions in the budget of the Regional Service Centre in Entebbe, Uganda, \nfor 2024, under section 3, Political affairs, of the proposed programme budget for \n2024; \n \n4. \nAuthorizes the Secretary-General to enter into commitments in an amount \nnot exceeding 21,500,000 dollars for the United Nations Integrated Transition \nAssistance Mission in the Sudan for the period from 1 January to 30 April 2024; \n \n__________________ \n \n52 A/78/6 (Sect. 3)/Add.1, A/78/6 (Sect. 3)/Add.2, A/78/6 (Sect. 3)/Add.3, A/78/6 (Sect. 3)/Add.4, \nA/78/6 (Sect. 3)/Add.5, A/78/6 (Sect. 3)/Add.6 and A/78/6 (Sect. 3)/Add.7. \n \n53 A/78/7/Add.1, A/78/7/Add.2, A/78/7/Add.3, A/78/7/Add.4, A/78/7/Add.5, A/78/7/Add.6 and \nA/78/7/Add.23. \n\nSpecial subjects relating to the proposed programme budget  \nfor 2024 \nA/RES/78/253\n \n21/25\n23-26236 \n \nXVIII \nProgress on the renovation of the North Building at the Economic Commission \nfor Latin America and the Caribbean in Santiago \n \n \nRecalling section VII of its resolution 69/274 A, section VI of its resolution \n70/248 B of 1 April 2016, section V of its resolution 72/262 A, section X of its \nresolution 73/279 A, section XI of its resolution 74/263, section XI of its resolution \n75/253 A, section XVI of its resolution 76/246 A and section X of its resolution \n77/263 A,  \n \nHaving considered the progress report of the Secretary-General54 and the related \nreport of the Advisory Committee,55 \n \n1. \nTakes note of the report of the Secretary-General;  \n \n2. \nEndorses the conclusions and recommendations contained in the report of \nthe Advisory Committee;  \n \n3. \nAcknowledges the important role played by the host countries in \nfacilitating the maintenance and construction of United Nations facilities, and stresses \nthe value of continued collaboration with host countries in this regard;  \n \n4. \nExpresses its gratitude to the Government of Chile, as the host country, \nfor its continued efforts in supporting and facilitating the work of the Economic \nCommission for Latin America and the Caribbean;  \n \n5. \nReiterates its request to the Secretary-General to remain proactive in \nseeking both voluntary and in-kind contributions from Member States, in full \ncompliance with all relevant rules and regulations of the Organization, and to provide \ndetailed information on the matter in the context of his next progress report;  \n \n6. \nRequests the Secretary-General to ensure that all activities promote cost-\nefficiency and transparency, are implemented within existing resources and in \naccordance with the United Nations legislative framework, including the Financial \nRegulations and Rules, while maintaining full accountability to the General \nAssembly;  \n \n7. \nStresses the importance of governance, effective oversight, transparency \nand accountability in the management of the project to ensure that the objectives of \nthe project are achieved within the approved budget and time schedule;  \n \n8. \nEmphasizes that the Global Asset Management Policy Service should \ncontinue to be actively involved in overseeing the project to ensure the central \nsupervision of capital projects, including risk management and alignment with \nlessons learned; \n \n9. \nRequests the Secretary-General to closely monitor and mitigate all project \nrisks and take all measures necessary to ensure the delivery of the project within the \nscope, revised budget and timeline, as approved by the General Assembly, and also \nrequests the Secretary-General to include information on risk management and \nmitigation measures taken in his next progress report;  \n \n10. Also requests the Secretary-General to continue to take into account \nlessons learned and best practices from past construction and renovation projects and, \nin particular, to draw from experience and knowledge acquired from other capital \nprojects, to ensure that the objectives of the project are achieved within budget and \n__________________ \n \n54 A/78/337. \n \n55 A/78/7/Add.14. \n\nA/RES/78/253 \nSpecial subjects relating to the proposed programme budget \nfor 2024\n \n23-26236\n22/25 \n \nin a timely manner, and further requests the Secretary-General to provide an update \non measures considered and applied in this regard in his next progress report;  \n \n11. \nNotes with appreciation that the project is progressing in accordance with \nits approved objectives in terms of seismic risk mitigation measures, energy \nefficiency and in compliance with health and safety regulations;  \n \n12. Welcomes the renovation of the North Building at the Economic \nCommission for Latin America and the Caribbean as a sustainable and energy-\nefficient building where the total amount of energy used by the building on an annual \nbasis is equal to or less than the amount of renewable energy generated on site;  \n \n13. Stresses that any increase to the maximum overall budget must be \napproved by the General Assembly before entering into corresponding financial \ncommitments;  \n \n14. Approves a revised estimated overall maximum cost of the project of \n19,137,000 dollars;  \n \n15. Also approves the continuation of the temporary position of Procurement \nOfficer (P-3) for the period from 1 January to 31 December 2024;  \n \n16. Appropriates an amount of 10,097,700 dollars for the project in 2024, \ncomprising 475,100 dollars under section 21, Economic and social development in \nLatin America and the Caribbean, and 9,622,600 dollars under section 33, \nConstruction, alteration, improvement and major maintenance, of the proposed \nprogramme budget for 2024, which would represent a charge against the contingency \nfund; \n \nXIX \nStrategic heritage plan of the United Nations Office at Geneva \n \n \nRecalling part XI of its resolution 64/243, section VII of its resolution 66/247, \nsection V of its resolution 68/247 A, sections III and VII of its resolution 69/262, \nsection X of its resolution 70/248 A, section XVIII of its resolution 71/272 A, \nsection XVI of its resolution 72/262 A, section XIII of its resolution 73/279 A, \nsection VII of its resolution 74/263, section IX of its resolution 75/253 A, section XVIII \nof its resolution 76/246 A and section VI of its resolution 77/263 A,  \n \nHaving considered the tenth annual progress report of the Secretary-General56 \nand the related report of the Advisory Committee,57 \n \n1. \nTakes note of the report of the Secretary-General;  \n \n2. \nEndorses the conclusions and recommendations contained in the report of \nthe Advisory Committee;  \n \n3. \nWelcomes the continued support of the Government of Switzerland for the \nconstruction project in Geneva;  \n \n4. \nStresses the importance of close coordination between the strategic \nheritage plan project team and the Secretariat in New York, in particular the Global \nAsset Management Policy Service, to ensure success in all aspects of the project;  \n \n5. \nAlso stresses the importance of effective governance, oversight, \ntransparency and accountability in the management of the project to ensure that the \nproject objectives are achieved on time and within budget;  \n__________________ \n \n56 A/78/503. \n \n57 A/78/7/Add.18. \n\nSpecial subjects relating to the proposed programme budget  \nfor 2024 \nA/RES/78/253\n \n23/25\n23-26236 \n \n \n6. \nReiterates its request to preserve the historical heritage of the Palais des \nNations;  \n \n7. \nNotes with appreciation the efforts of the Secretary-General for the \nprogress achieved during the reporting period and the substantial completion of the \nhistoric building D and section AC;  \n \n8. \nRequests the Secretary-General to continue documenting best practices \nand lessons learned from capital construction projects, including value engineering, \nmultistage request for proposals and the use of local materials and knowledge, and to \nconsider their application, as appropriate, to ensure that the objectives of the projects \nare achieved within the approved budget and timeline;  \n \n9. \nNotes the turnover in key staff positions and a high risk of key staff \ndeparting before the end of the project, and requests the Secretary-General to report \non efforts to mitigate the impact of staff turnover and departure on project \nimplementation;  \n \n10. Requests the Secretary-General to continue to ensure that the procurement \nof goods and services for the construction project is carried out in strict compliance \nwith the existing regulations, rules and relevant provisions of General Assembly \nresolutions governing procurement in the United Nations;  \n \n11. \nAlso requests the Secretary-General to ensure that all activities promote \ncost-efficiency and transparency, are implemented within existing resources and in \naccordance with the United Nations legislative framework, including the Financial \nRegulations and Rules, while maintaining full accountability to the General \nAssembly;  \n \n12. Further requests the Secretary-General to make every effort to avoid \nbudget increases or schedule overruns, including tight cost control, regular and \nproactive review of risks, value engineering and cost-saving measures, in order to \nensure that the cost of the project will not exceed the approved budget level, notes \nsuch measures undertaken to date, and looks forward to receiving further information \nin his next progress report;  \n \n13. Stresses that any increase to the maximum overall budget must be \napproved by the General Assembly before entering into corresponding financial \ncommitments;  \n \n14. Reaffirms the proposed project scope, schedule and estimated cost of the \nstrategic heritage plan in the maximum amount of 836,500,000 Swiss francs;  \n \n15. Requests the Secretary-General to ensure that any change that affects the \nscope of the strategic heritage plan project is presented for the consideration and \ndecision of the General Assembly;  \n \n16. Recalls section VII of its resolution 66/247, and requests the Secretary-\nGeneral to ensure the finalization of this project and implementation of the other \nongoing major capital project in a timely manner;  \n \n17. Decides to continue to use the multi-year construction-in-progress account \nestablished within the regular budget for expenditures related to the strategic heritage \nplan in 2024;  \n \n18. Also decides to revert to the establishment of an assessment scheme and \ncurrency of appropriation and assessment for the strategic heritage plan at the main \npart of its seventy-ninth session, and requests the Secretary-General to provide \nupdated detailed information on these issues;  \n\nA/RES/78/253 \nSpecial subjects relating to the proposed programme budget \nfor 2024\n \n23-26236\n24/25 \n \n \n19. Further decides to revert to the establishment of the multi-year special \naccount for the strategic heritage plan at the main part of its seventy-ninth session; \n \n20. Decides that the annual repayments of the loans to the host country will \nbe funded under the regular budget until decided otherwise by the General Assembly;  \n \n21. Encourages the Secretary-General, in attracting voluntary and in-kind \ncontributions from Member States, to give priority to those activities within the scope \nof the project;  \n \n22. Appreciates the existing voluntary contributions received from Member \nStates to finance the strategic heritage plan, and requests the Secretary-General to \nremain proactive in seeking both voluntary and in-kind contributions from Member \nStates, as well as donations by private entities, in full compliance with all relevant \nrules and regulations of the Organization and agreements related to donations for the \nstrategic heritage plan, and to provide detailed information on this matter in the \ncontext of his next progress report;  \n \n23. Requests the Secretary-General to ensure that remaining recommendations \nof the Board of Auditors are implemented fully and expeditiously;  \n \n24. Reiterates its request to the Secretary-General to ensure that works of art, \nmasterpieces and other gifts are handled appropriately during the design and \nrenovation stages of the strategic heritage plan at the Palais des Nations, and also \nrequests him to cooperate with those Member States that wish to take care of their \ngifts of works of art, masterpieces and other items;  \n \n25. Approves the extension of the temporary position of Architect (P-4) until \nthe end of 2024, and also approves the reassignment of the position of Senior \nAdministrative Officer (P-5) to a position of Senior Programme Officer (P-5);  \n \n26. Appropriates the amount of 24,776,200 dollars (equivalent to \n21,699,000 Swiss francs) for 2024, under section 33, Construction, alteration, \nimprovement and major maintenance, of the proposed programme budget for 2024;  \n \nXX \nInternational Trade Centre \n \n \nApproves resources in the amount of 21,723,500 dollars (the United Nations \nshare equivalent to 50 per cent of 38,050,400 Swiss francs at the exchange rate of \n0.8758 Swiss francs to 1 dollar) proposed for 2024 under section 13, International \nTrade Centre, of the proposed programme budget for 2024; \n \nXXI \nGross jointly financed budget of the Joint Inspection Unit \n \n \nApproves the gross budget for the Joint Inspection Unit for 2024 in the amount \nof 8,727,500 dollars; \n \nXXII \nGross jointly financed budget of the International Civil Service Commission \n \n \nApproves the gross budget for the International Civil Service Commission for \n2024 in the amount of 12,795,700 dollars; \n \n\nSpecial subjects relating to the proposed programme budget  \nfor 2024 \nA/RES/78/253\n \n25/25\n23-26236 \n \nXXIII \nGross jointly financed budget of the United Nations System Chief Executives \nBoard for Coordination \n \n \nNotes the gross budget for the United Nations System Chief Executives Board \nfor Coordination for 2024 in the amount of 4,334,600 dollars; \n \nXXIV \nGross jointly financed budget of the Department of Safety and Security \n \n \nApproves the gross jointly financed budget of the Department of Safety and \nSecurity of the Secretariat for 2024 in the amount of 165,226,300 dollars, broken \ndown as follows: \n \n(a) \nField Security Operations: 149,110,800 dollars;  \n \n(b) \nSecurity and Safety Services at the United Nations Office at Vienna: \n16,115,500 dollars; \n \nXXV \nEffects of changes in rates of exchange and inflation \n \n \nHaving considered the report of the Secretary-General on the revised estimates \nresulting from changes in rates of exchange and inflation 58 and the related report of \nthe Advisory Committee,59 \n \nTakes note of the revised estimates arising from recosting owing to changes in \nthe rates of exchange and inflation; \n \nXXVI \nContingency fund \n \n \nRecalls its resolution 77/263 A, in which the level of the contingency fund for \nthe year 2024 was set at 0.75 per cent of the approved programme budget for 2023, \nor 25,472,300 dollars,  \n \n1. \nNotes that, after a charge of 24,595,700 dollars, a balance of \n876,600 dollars remains in the contingency fund for 2024;  \n \n2. \nDecides that the contingency fund for the year 2025 shall be set at the level \nof 0.75 per cent of the approved programme budget for 2024. \n \n50th (resumed) plenary meeting \n22 December 2023 \n \n__________________ \n \n58 A/78/614. \n \n59 A/78/7/Add.42. \n",
  "paragraphs": {
    "1": "Notes that, after a charge of 24,595,700 dollars, a balance of 876,600 dollars remains in the contingency fund for 2024;",
    "2": "Decides that the contingency fund for the year 2025 shall be set at the level of 0.75 per cent of the approved programme budget for 2024. 50th (resumed) plenary meeting 22 December 2023 __________________ 58 A/78/614. 59 A/78/7/Add.42.",
    "3": "Welcomes the continued support of the Government of Switzerland for the construction project in Geneva;",
    "4": "Stresses the importance of close coordination between the strategic heritage plan project team and the Secretariat in New York, in particular the Global Asset Management Policy Service, to ensure success in all aspects of the project;",
    "5": "Also stresses the importance of effective governance, oversight, transparency and accountability in the management of the project to ensure that the project objectives are achieved on time and within budget; __________________ 56 A/78/503. 57 A/78/7/Add.18. Special subjects relating to the proposed programme budget for 2024 A/RES/78/253 23/25 23-26236",
    "6": "Reiterates its request to preserve the historical heritage of the Palais des Nations;",
    "7": "Notes with appreciation the efforts of the Secretary-General for the progress achieved during the reporting period and the substantial completion of the historic building D and section AC;",
    "8": "Requests the Secretary-General to continue documenting best practices and lessons learned from capital construction projects, including value engineering, multistage request for proposals and the use of local materials and knowledge, and to consider their application, as appropriate, to ensure that the objectives of the projects are achieved within the approved budget and timeline;",
    "9": "Notes the turnover in key staff positions and a high risk of key staff departing before the end of the project, and requests the Secretary-General to report on efforts to mitigate the impact of staff turnover and departure on project implementation;",
    "10": "Requests the Secretary-General to continue to ensure that the procurement of goods and services for the construction project is carried out in strict compliance with the existing regulations, rules and relevant provisions of General Assembly resolutions governing procurement in the United Nations;",
    "11": "Also requests the Secretary-General to ensure that all activities promote cost-efficiency and transparency, are implemented within existing resources and in accordance with the United Nations legislative framework, including the Financial Regulations and Rules, while maintaining full accountability to the General Assembly;",
    "12": "Further requests the Secretary-General to make every effort to avoid budget increases or schedule overruns, including tight cost control, regular and proactive review of risks, value engineering and cost-saving measures, in order to ensure that the cost of the project will not exceed the approved budget level, notes such measures undertaken to date, and looks forward to receiving further information in his next progress report;",
    "13": "Stresses that any increase to the maximum overall budget must be approved by the General Assembly before entering into corresponding financial commitments;",
    "14": "Reaffirms the proposed project scope, schedule and estimated cost of the strategic heritage plan in the maximum amount of 836,500,000 Swiss francs;",
    "15": "Requests the Secretary-General to ensure that any change that affects the scope of the strategic heritage plan project is presented for the consideration and decision of the General Assembly;",
    "16": "Recalls section VII of its resolution 66/247, and requests the Secretary- General to ensure the finalization of this project and implementation of the other ongoing major capital project in a timely manner;",
    "17": "Decides to continue to use the multi-year construction-in-progress account established within the regular budget for expenditures related to the strategic heritage plan in 2024;",
    "18": "Also decides to revert to the establishment of an assessment scheme and currency of appropriation and assessment for the strategic heritage plan at the main part of its seventy-ninth session, and requests the Secretary-General to provide updated detailed information on these issues; A/RES/78/253 Special subjects relating to the proposed programme budget for 2024 23-26236 24/25",
    "19": "Further decides to revert to the establishment of the multi-year special account for the strategic heritage plan at the main part of its seventy-ninth session;",
    "20": "Decides that the annual repayments of the loans to the host country will be funded under the regular budget until decided otherwise by the General Assembly;",
    "21": "Encourages the Secretary-General, in attracting voluntary and in-kind contributions from Member States, to give priority to those activities within the scope of the project;",
    "22": "Appreciates the existing voluntary contributions received from Member States to finance the strategic heritage plan, and requests the Secretary-General to remain proactive in seeking both voluntary and in-kind contributions from Member States, as well as donations by private entities, in full compliance with all relevant rules and regulations of the Organization and agreements related to donations for the strategic heritage plan, and to provide detailed information on this matter in the context of his next progress report;",
    "23": "Requests the Secretary-General to ensure that remaining recommendations of the Board of Auditors are implemented fully and expeditiously;",
    "24": "Reiterates its request to the Secretary-General to ensure that works of art, masterpieces and other gifts are handled appropriately during the design and renovation stages of the strategic heritage plan at the Palais des Nations, and also requests him to cooperate with those Member States that wish to take care of their gifts of works of art, masterpieces and other items;",
    "25": "Approves the extension of the temporary position of Architect (P-4) until the end of 2024, and also approves the reassignment of the position of Senior Administrative Officer (P-5) to a position of Senior Programme Officer (P-5);",
    "26": "Appropriates the amount of 24,776,200 dollars (equivalent to 21,699,000 Swiss francs) for 2024, under section 33, Construction, alteration, improvement and major maintenance, of the proposed programme budget for 2024; XX International Trade Centre Approves resources in the amount of 21,723,500 dollars (the United Nations share equivalent to 50 per cent of 38,050,400 Swiss francs at the exchange rate of 0.8758 Swiss francs to 1 dollar) proposed for 2024 under section 13, International Trade Centre, of the proposed programme budget for 2024; XXI Gross jointly financed budget of the Joint Inspection Unit Approves the gross budget for the Joint Inspection Unit for 2024 in the amount of 8,727,500 dollars; XXII Gross jointly financed budget of the International Civil Service Commission Approves the gross budget for the International Civil Service Commission for 2024 in the amount of 12,795,700 dollars; Special subjects relating to the proposed programme budget for 2024 A/RES/78/253 25/25 23-26236 XXIII Gross jointly financed budget of the United Nations System Chief Executives Board for Coordination Notes the gross budget for the United Nations System Chief Executives Board for Coordination for 2024 in the amount of 4,334,600 dollars; XXIV Gross jointly financed budget of the Department of Safety and Security Approves the gross jointly financed budget of the Department of Safety and Security of the Secretariat for 2024 in the amount of 165,226,300 dollars, broken down as follows: (a) Field Security Operations: 149,110,800 dollars; (b) Security and Safety Services at the United Nations Office at Vienna: 16,115,500 dollars; XXV Effects of changes in rates of exchange and inflation Having considered the report of the Secretary-General on the revised estimates resulting from changes in rates of exchange and inflation 58 and the related report of the Advisory Committee,59 Takes note of the revised estimates arising from recosting owing to changes in the rates of exchange and inflation; XXVI Contingency fund Recalls its resolution 77/263 A, in which the level of the contingency fund for the year 2024 was set at 0.75 per cent of the approved programme budget for 2023, or 25,472,300 dollars,",
    "27": "Decides to approve the maximum overall cost of the project in the amount of 265,659,200 dollars;",
    "28": "Appropriates an amount of 11,928,200 dollars for the project in 2024, comprising 9,837,000 dollars under section 33, Construction, alteration, improvement and major maintenance, and 2,091,200 dollars under section 29D, Administration, Nairobi, of the proposed programme budget for 2024; XVI Progress on the replacement of office blocks A to J at the United Nations Office at Nairobi Recalling section XIV of its resolution 72/262 A, section IX of its resolution 73/279 A, section XIII of its resolution 74/263, section XIV of its resolution 75/253 A, section XV of its resolution 76/246 A and section XII of its resolution 77/263 A, Having considered the report of the Secretary-General50 and the related report of the Advisory Committee,51"
  },
  "agenda_items": [
    "Item 134"
  ],
  "symbol_references": []
}