{
  "symbol": "A/RES/76/125",
  "filename": "A_RES_76_125.pdf",
  "title": "76/125. White Helmets Commission: participation of volunteers in the activities of the United Nations in the field of humanitarian relief, rehabilitation and technical cooperation for development",
  "text": "United Nations \nA/RES/76/125\n \n \nGeneral Assembly \nDistr.: General \n17 December 2021 \n \n21-18811 (E)    231221 \n*2118811*\n \n \n \nSeventy-sixth session \nAgenda item 75 (a) \nStrengthening of the coordination of humanitarian and \ndisaster relief assistance of the United Nations, including \nspecial economic assistance: strengthening of the \ncoordination of emergency humanitarian assistance of the \nUnited Nations \n \n \n \n \n Resolution adopted by the General Assembly \non 10 December 2021 \n \n \n \n \n[without reference to a Main Committee (A/76/L.24 and A/76/L.24/Add.1)] \n \n \n 76/125. White Helmets Commission: participation of volunteers in the \nactivities of the United Nations in the field of humanitarian relief, \nrehabilitation and technical cooperation for development \n \n \n \nThe General Assembly, \n \nReaffirming its resolutions 50/19 of 28 November 1995, 52/171 of 16 December \n1997, 54/98 of 8 December 1999, 56/102 of 14 December 2001, 58/118 of \n17 December 2003, 61/220 of 20 December 2006, 64/75 of 7 December 2009, 67/84 \nof 13 December 2012, 69/134 of 12 December 2014, 70/105 of 10 December 2015 \nand 73/138 of 14 December 2018,  \n \nReaffirming also its resolution 46/182 of 19 December 1991 and the guiding \nprinciples contained in the annex thereto, and reaffirming further other relevant \nresolutions of the General Assembly and relevant resolutions and agreed conclusions \nof the Economic and Social Council, \n \nEmphasizing the principles of humanity, neutrality, impartiality and \nindependence in the provision of humanitarian assistance, and reaffirming the need \nfor all actors engaged in the provision of humanitarian assistance in situations of \ncomplex emergencies and natural disasters to promote and fully respect these \nprinciples, \n \nEmphasizing also the need for close collaboration between relief and \ndevelopment activities in the context of humanitarian emergencies, taking into \naccount the 2030 Agenda for Sustainable Development,1 \n__________________ \n \n1 Resolution 70/1. \n\nA/RES/76/125 \nWhite Helmets Commission: participation of volunteers in the \nactivities of the United Nations in the field of humanitarian relief, \nrehabilitation and technical cooperation for development\n \n21-18811\n2/4 \n \n \nRecognizing that the international community, in addressing the growing \nmagnitude and complexity of disasters and chronic challenges, such as hunger, \nmalnutrition and poverty, must rely on the formulation of a well-coordinated global \nresponse within the framework of the United Nations and on the promotion of a \nsmooth transition from relief to rehabilitation, reconstruction and development, \n \nUnderscoring the need, in order to ensure a smooth transition from relief to \nrehabilitation and achieve development, to better align, wherever appropriate, \nhumanitarian and development assistance with national development priorities and \nstrategies, and encouraging Member States, as well as the United Nations system and \nregional organizations in supporting the efforts of Member States, to tackle the root \ncauses of humanitarian crises, including poverty and underdevelopment, to strengthen \ndisaster risk reduction, including preparedness, to build the resilience of affected \nStates, including host communities, and to reduce humanitarian needs, \n \nRecognizing the progress made by Member States, the United Nations system \nand other international organizations with regard to disaster risk management and \ncoordination in the provision of humanitarian assistance, \n \nRecognizing also that the Sendai Framework for Disaster Risk Reduction \n2015\u201320302 applies to the risk of small-scale and large-scale, frequent and infrequent, \nsudden and slow-onset disasters caused by natural or man-made hazards, as well as \nrelated environmental, technological and biological hazards and risks, \n \nRecognizing further the need for the public and private sectors and civil society \norganizations, as well as academia and scientific and research institutions, to work \nmore closely together and to create opportunities for collaboration, and for businesses \nto integrate disaster risk into their management practices, \n \nReaffirming its resolution 70/1 of 25 September 2015, entitled \u201cTransforming \nour world: the 2030 Agenda for Sustainable Development\u201d, in which it adopted a \ncomprehensive, far-reaching and people-centred set of universal and transformative \nSustainable Development Goals and targets, its commitment to working tirelessly for \nthe full implementation of the Agenda by 2030, its recognition that eradicating \npoverty in all its forms and dimensions, including extreme poverty, is the greatest \nglobal challenge and an indispensable requirement for sustainable development, its \ncommitment to achieving sustainable development in its three dimensions \u2013 \neconomic, social and environmental \u2013 in a balanced and integrated manner and to \nbuilding upon the achievements of the Millennium Development Goals and seeking \nto address their unfinished business, \n \nNoting the World Humanitarian Summit, and noting the contribution of the \nglobal, regional and subregional platforms for disaster risk reduction, 3 \n \nReaffirming the importance of continued efforts by the relevant organizations of \nthe United Nations system and, as appropriate, other relevant humanitarian actors to \nimprove the humanitarian response to natural and man-made disasters and complex \nemergencies by further strengthening humanitarian response capacities at all levels, \nby continuing to strengthen the provision and coordination of humanitarian assistance \nat the global, regional and field levels, \n \nEmphasizing the importance of global, regional, national and local policies and \nstrategies for prevention, preparedness, response and recovery in disasters and \nhumanitarian crises, with a view to integrating a gender perspective, as well as a \nperspective on the needs of children, young people, older persons and persons with \ndisabilities, in the design and implementation of all phases of disaster risk reduction, \n__________________ \n \n2 Resolution 69/283, annex II. \n \n3  See A/71/353. \n\nWhite Helmets Commission: participation of volunteers in the \nactivities of the United Nations in the field of humanitarian relief, \nrehabilitation and technical cooperation for development \nA/RES/76/125\n \n3/4\n21-18811 \n \nand reaffirming that it is essential to ensure that women are empowered to effectively \nand meaningfully participate in leadership and decision-making processes, \n \nRecognizing that the poorest and most vulnerable are the hardest hit by the \npandemic, that the impact of the crisis will reverse hard-won development gains and \nhamper progress towards achieving the Sustainable Development Goals and that the \ncoronavirus disease (COVID-19) global pandemic requires a global response based \non unity, solidarity, multilateral cooperation, equality, equity. inclusion and \nnon-discrimination, \n \n1. \nTakes note of the report of the Secretary-General on the strengthening of \nthe coordination of emergency humanitarian assistance of the United Nations, \nsubmitted in compliance with resolutions 46/182 and 75/127 of 11 December 2020,4 \nin particular paragraph 104 of the report, in which an update is provided on \ncollaboration between the White Helmets, an initiative of the Government of \nArgentina, and the United Nations, and notes that since 1994, more than 1,000 White \nHelmets volunteers have provided assistance in 73 countries and undertaken 340 \ninternational humanitarian missions, many in coordination with the United Nations, \nand strengthened links with United Nations system agencies through agreements, \njoint workplans, financial support and field missions; \n \n2. \nHighlights that the White Helmets is a volunteer corps composed entirely \nof civilians that develops its activities on the basis of cooperation, solidarity and the \nparticipation of communities; \n \n3. \nNotes with appreciation the contribution of the White Helmets to \nhumanitarian assistance, disaster risk management and the achievement of sustainable \ndevelopment; \n \n4. \nRecognizes that the White Helmets initiative has demonstrated the \npotential of regional partnerships and has encouraged the participation of affected or \nvulnerable populations in the tasks of planning, training, mobilizing and providing an \nimmediate response in disaster situations and complex emergencies, while integrating \na gender perspective into its activities; \n \n5. \nCommends national and international volunteers, including the White \nHelmets, for their contributions and their fundamental role in disaster risk reduction, \nresponse and recovery; \n \n6. \nTakes note of the memorandum of understanding, signed in 2019, between \nthe Office for the Coordination of Humanitarian Affairs and the White Helmets \nCommission to promote collaboration for humanitarian assistance and disaster risk \nmanagement in areas of cooperation, including supporting the deployment of United \nNations disaster assessment and coordination teams and the active participation as \nVice-Chair of the International Search and Rescue Advisory Group, and such recent \nactivities of the White Helmets as rendering medical services, logistical support and \ndelivery of supplies in Latin America and the Caribbean, including in response to the \nCOVID-19 pandemic; \n \n7. \nEncourages the United Nations system, including the World Health \nOrganization, and operational partners of the United Nations, in providing \npsychosocial support to the disaster-affected population in emergency and disaster \nsituations, to draw on, as appropriate, the voluntary expertise of the White Helmets, \nwhich has been successfully tested, and invites Member States to consider means of \nintegrating the White Helmets initiative into their programme activities; \n__________________ \n \n4 A/76/74-E/2021/54. \n\nA/RES/76/125 \nWhite Helmets Commission: participation of volunteers in the \nactivities of the United Nations in the field of humanitarian relief, \nrehabilitation and technical cooperation for development\n \n21-18811\n4/4 \n \n \n8. \nRecognizes the international humanitarian activities that the White \nHelmets developed in the period from 2019 to 2021 in coordination with the national \nauthorities of disaster-affected countries and the agencies of the United Nations \nsystem and its partners in the design, preparedness, organization and deployment of \nhumanitarian assistance, including response, recovery and reconstruction following \ndisasters and building of resilience, and in addressing the consequences of \nhumanitarian emergencies for migrants, in particular those in vulnerable situations; \n \n9. \nInvites the Secretary-General, on the basis of the experience acquired, to \ncontinue to consider the use of the White Helmets initiative as a resource suitable for \npreventing and mitigating the effects of disasters and other humanitarian crises; \n \n10. Invites Member States to consider means of supporting collaboration of \nthe White Helmets with their programme activities and to consider making financial \nresources available to their special voluntary funds; \n \n11. \nInvites the Secretary-General, on the basis of the work experience acquired \nby the White Helmets in the international field, as recognized in various resolutions \nof the General Assembly, and in view of the success of coordinated actions carried \nout with, inter alia, the Office for the Coordination of Humanitarian Affairs, the Office \nof the United Nations High Commissioner for Refugees, the International Strategy \nfor Disaster Reduction, the World Health Organization, the Pan American Health \nOrganization, the World Food Programme, the Food and Agriculture Organization of \nthe United Nations, the United Nations Development Programme and the United \nNations Volunteers, to suggest measures to enhance the collaboration of the White \nHelmets initiative with the United Nations system and to report thereon to the \nAssembly at its seventy-ninth session in a separate section of the annual report on the \nstrengthening of the coordination of emergency humanitarian assistance of the United \nNations. \n \n51st plenary meeting \n10 December 2021 \n \n",
  "paragraphs": {
    "1": "Takes note of the report of the Secretary-General on the strengthening of the coordination of emergency humanitarian assistance of the United Nations, submitted in compliance with resolutions 46/182 and 75/127 of 11 December 2020,4 in particular paragraph 104 of the report, in which an update is provided on collaboration between the White Helmets, an initiative of the Government of Argentina, and the United Nations, and notes that since 1994, more than 1,000 White Helmets volunteers have provided assistance in 73 countries and undertaken 340 international humanitarian missions, many in coordination with the United Nations, and strengthened links with United Nations system agencies through agreements, joint workplans, financial support and field missions;",
    "2": "Highlights that the White Helmets is a volunteer corps composed entirely of civilians that develops its activities on the basis of cooperation, solidarity and the participation of communities;",
    "3": "Notes with appreciation the contribution of the White Helmets to humanitarian assistance, disaster risk management and the achievement of sustainable development;",
    "4": "Recognizes that the White Helmets initiative has demonstrated the potential of regional partnerships and has encouraged the participation of affected or vulnerable populations in the tasks of planning, training, mobilizing and providing an immediate response in disaster situations and complex emergencies, while integrating a gender perspective into its activities;",
    "5": "Commends national and international volunteers, including the White Helmets, for their contributions and their fundamental role in disaster risk reduction, response and recovery;",
    "6": "Takes note of the memorandum of understanding, signed in 2019, between the Office for the Coordination of Humanitarian Affairs and the White Helmets Commission to promote collaboration for humanitarian assistance and disaster risk management in areas of cooperation, including supporting the deployment of United Nations disaster assessment and coordination teams and the active participation as Vice-Chair of the International Search and Rescue Advisory Group, and such recent activities of the White Helmets as rendering medical services, logistical support and delivery of supplies in Latin America and the Caribbean, including in response to the COVID-19 pandemic;",
    "7": "Encourages the United Nations system, including the World Health Organization, and operational partners of the United Nations, in providing psychosocial support to the disaster-affected population in emergency and disaster situations, to draw on, as appropriate, the voluntary expertise of the White Helmets, which has been successfully tested, and invites Member States to consider means of integrating the White Helmets initiative into their programme activities;",
    "8": "Recognizes the international humanitarian activities that the White Helmets developed in the period from 2019 to 2021 in coordination with the national authorities of disaster-affected countries and the agencies of the United Nations system and its partners in the design, preparedness, organization and deployment of humanitarian assistance, including response, recovery and reconstruction following disasters and building of resilience, and in addressing the consequences of humanitarian emergencies for migrants, in particular those in vulnerable situations;",
    "9": "Invites the Secretary-General, on the basis of the experience acquired, to continue to consider the use of the White Helmets initiative as a resource suitable for preventing and mitigating the effects of disasters and other humanitarian crises;",
    "10": "Invites Member States to consider means of supporting collaboration of the White Helmets with their programme activities and to consider making financial resources available to their special voluntary funds;",
    "11": "Invites the Secretary-General, on the basis of the work experience acquired by the White Helmets in the international field, as recognized in various resolutions of the General Assembly, and in view of the success of coordinated actions carried out with, inter alia, the Office for the Coordination of Humanitarian Affairs, the Office of the United Nations High Commissioner for Refugees, the International Strategy for Disaster Reduction, the World Health Organization, the Pan American Health Organization, the World Food Programme, the Food and Agriculture Organization of the United Nations, the United Nations Development Programme and the United Nations Volunteers, to suggest measures to enhance the collaboration of the White Helmets initiative with the United Nations system and to report thereon to the Assembly at its seventy-ninth session in a separate section of the annual report on the strengthening of the coordination of emergency humanitarian assistance of the United Nations."
  },
  "agenda_items": [
    "Item 75"
  ],
  "symbol_references": [
    "A/76/L.24"
  ]
}