{
  "symbol": "A/RES/72/65",
  "filename": "A_RES_72_65.pdf",
  "title": "72/65. Report of the Conference on Disarmament",
  "text": "United Nations \nA/RES/72/65\n \n \nGeneral Assembly \nDistr.: General \n13 December 2017 \n \n17-21756 (E)    151217 \n*1721756* \n \n \nSeventy-second session \nAgenda item 101 (a) \n \n \n \n \n Resolution adopted by the General Assembly \non 4 December 2017 \n \n \n \n \n[on the report of the First Committee (A/72/411)] \n \n \n \n72/65. Report of the Conference on Disarmament  \n \n \n \nThe General Assembly,  \n \nHaving considered the report of the Conference on Disarmament,1  \n \nConvinced that the Conference on Disarmament, as the single multilateral \ndisarmament negotiating forum of the international community, has the primary role \nin substantive negotiations on priority questions of disarmament,  \n \nRecognizing the message of the Secretary-General of the United Nations, as \nwell as the addresses of Ministers for Foreign Affairs and other high-level officials \nin the Conference on Disarmament, as expressions of support and concern for the \nendeavours of the Conference and as calls for the Conference to immediately \ncommence negotiations to advance disarmament goals through the adoption of a \nbalanced and comprehensive programme of work,  \n \nRecognizing also the need to conduct multilateral negotiations with the aim of \nreaching agreement on concrete issues, and considering that the present \ninternational climate should give additional impetus to multilateral negotiations,  \n \nNoting with renewed concern that, despite the intensive efforts by States \nmembers and Presidents of the Conference on Disarmament at its 2017 session to \nreach consensus on a programme of work on the basis of relevant proposals and \nsuggestions, the Conference did not succeed in commencing its substantive work, \nincluding negotiations, as called for by the General Assembly in its resolution 71/81 \nof 5 December 2016, or in agreeing on and implementing a programme of work,  \n \nRecalling, in this respect, that the Conference on Disarmament has a number \nof urgent and important issues for negotiation to achieve disarmament goals,  \n__________________ \n \n1  Official Records of the General Assembly, Seventy-second Session, Supplement No. 27 (A/72/27).  \n\nA/RES/72/65 \nReport of the Conference on Disarmament\n \n17-21756 \n2/3 \n \n \nWelcoming the overwhelming call for greater flexibility with respect to \ncommencing the substantive work of the Conference on Disarmament without \nfurther delay, on the basis of a balanced and comprehensive programme of work,  \n \nAppreciating the continued cooperation among the States members of the \nConference on Disarmament as well as the six successive Presidents of the \nConference at its 2017 session,  \n \nNoting with appreciation the significant contributions made at the 2017 \nsession to promote substantive discussions on issues on the agenda, including the \ninformal discussions held pursuant to the decision adopted on 17 February 2017,2 \nand noting the discussions on the functioning of the Conference on Disarmament, as \nwell as the discussions held on other issues that could also be relevant to the current \ninternational security environment,  \n \nEmphasizing the importance of the United Nations Institute for Disarmament \nResearch, as a stand-alone, autonomous institution, and the contribution that its \nresearch makes,  \n \nRecognizing the importance of engagement between civil society and the \nConference on Disarmament according to decisions taken by the Conference,  \n \nStressing the urgent need for the Conference on Disarmament to commence its \nsubstantive work at the beginning of its 2018 session,  \n \n1. \nReaffirms the role of the Conference on Disarmament as the single \nmultilateral disarmament negotiating forum of the international community;  \n \n2. \nAppreciates the strong support expressed for the Conference on \nDisarmament at its 2017 session by Ministers for Foreign Affairs and other high-\nlevel officials, while also acknowledging their concern about its ongoing impasse, \nand takes into account their calls for greater flexibility with respect to commencing \nthe substantive work of the Conference without further delay;  \n \n3. \nCalls upon the Conference on Disarmament to further intensify \nconsultations and to explore possibilities for overcoming its ongoing deadlock of \ntwo decades by adopting and implementing a balanced and comprehensive \nprogramme of work at the earliest possible date during its 2018 session, bearing in \nmind the decision on the programme of work adopted by the Conference on 29 May \n2009,3 as well as other relevant present, past and future proposals;  \n \n4. \nTakes note with appreciation of the decision of the Conference on \nDisarmament to establish the working group on the way ahead with a mandate to \ntake stock of the progress on all agenda items of the Conference, identify issues for \nsubstantive work under the agenda, identify common ground for a programme of \nwork with a negotiating mandate and consider steps for the way ahead, 2 and \nappreciates the efforts of the Chair and the facilitators of the working group;  \n \n5. \nWelcomes the decision of the Conference on Disarmament to request the \ncurrent President and the incoming President of the Conference to conduct \nconsultations during the intersessional period and, if possible, to make \nrecommendations, taking into account all relevant proposals, past, present and \nfuture, including those submitted as documents of the Conference, views presented \nand discussions held, and to endeavour to keep the membership of the Conference \ninformed, as appropriate, of their consultations;  \n__________________ \n \n2  Ibid., para. 15.  \n \n3  Ibid., Sixty-fourth Session, Supplement No. 27 (A/64/27), para. 18.  \n\nReport of the Conference on Disarmament \nA/RES/72/65\n \n3/3 \n17-21756 \n \n \n6. \nRequests all States members of the Conference on Disarmament to \ncooperate with the current President and successive Presidents in their efforts to \nguide the Conference to the early commencement of its substantive work, including \nnegotiations, at its 2018 session;  \n \n7. \nRecognizes the importance of continuing consultations in 2018 on the \nquestion of the expansion of the membership of the Conference on Disarmament;  \n \n8. \nRequests the Secretary-General to continue to ensure and to strengthen, if \nneeded, the provision to the Conference on Disarmament of all necessary \nadministrative, substantive and conference support services;  \n \n9. \nRequests the Conference on Disarmament to submit to the General \nAssembly at its seventy-third session a report on its work;  \n \n10. Decides to include in the provisional agenda of its seventy-third session, \nunder the item entitled \u201cReview of the implementation of the recommendations and \ndecisions adopted by the General Assembly at its tenth special session\u201d, the \nsub-item entitled \u201cReport of the Conference on Disarmament\u201d.  \n \n62nd plenary meeting  \n4 December 2017 \n \n",
  "paragraphs": {
    "1": "Reaffirms the role of the Conference on Disarmament as the single multilateral disarmament negotiating forum of the international community;",
    "2": "Appreciates the strong support expressed for the Conference on Disarmament at its 2017 session by Ministers for Foreign Affairs and other high- level officials, while also acknowledging their concern about its ongoing impasse, and takes into account their calls for greater flexibility with respect to commencing the substantive work of the Conference without further delay;",
    "3": "Calls upon the Conference on Disarmament to further intensify consultations and to explore possibilities for overcoming its ongoing deadlock of two decades by adopting and implementing a balanced and comprehensive programme of work at the earliest possible date during its 2018 session, bearing in mind the decision on the programme of work adopted by the Conference on 29 May 2009,3 as well as other relevant present, past and future proposals;",
    "4": "Takes note with appreciation of the decision of the Conference on Disarmament to establish the working group on the way ahead with a mandate to take stock of the progress on all agenda items of the Conference, identify issues for substantive work under the agenda, identify common ground for a programme of work with a negotiating mandate and consider steps for the way ahead, 2 and appreciates the efforts of the Chair and the facilitators of the working group;",
    "5": "Welcomes the decision of the Conference on Disarmament to request the current President and the incoming President of the Conference to conduct consultations during the intersessional period and, if possible, to make recommendations, taking into account all relevant proposals, past, present and future, including those submitted as documents of the Conference, views presented and discussions held, and to endeavour to keep the membership of the Conference informed, as appropriate, of their consultations;",
    "6": "Requests all States members of the Conference on Disarmament to cooperate with the current President and successive Presidents in their efforts to guide the Conference to the early commencement of its substantive work, including negotiations, at its 2018 session;",
    "7": "Recognizes the importance of continuing consultations in 2018 on the question of the expansion of the membership of the Conference on Disarmament;",
    "8": "Requests the Secretary-General to continue to ensure and to strengthen, if needed, the provision to the Conference on Disarmament of all necessary administrative, substantive and conference support services;",
    "9": "Requests the Conference on Disarmament to submit to the General Assembly at its seventy-third session a report on its work;",
    "10": "Decides to include in the provisional agenda of its seventy-third session, under the item entitled \u201cReview of the implementation of the recommendations and decisions adopted by the General Assembly at its tenth special session\u201d, the sub-item entitled \u201cReport of the Conference on Disarmament\u201d."
  },
  "agenda_items": [
    "Item 101"
  ],
  "symbol_references": []
}