{
  "symbol": "A/RES/75/252",
  "filename": "A_RES_75_252.pdf",
  "title": "75/252. Questions relating to the proposed programme budget for 2021",
  "text": "United Nations \nA/RES/75/252\n \n \nGeneral Assembly \nDistr.: General \n8 January 2021 \n \n21-00065 (E)    110121     \n*2100065* \n \n \nSeventy-fifth session \nAgenda item 141 \nProposed programme budget for 2021 \n \n \n \n \n Resolution adopted by the General Assembly \non 31 December 2020 \n \n \n \n \n[on the report of the Fifth Committee (A/75/682, para. 63)] \n \n \n 75/252. Questions relating to the proposed programme budget for 2021 \n \n \n \nThe General Assembly, \n \nReaffirming its resolutions 41/213 of 19 December 1986, 42/211 of \n21 December 1987, 45/248 B, section VI, of 21 December 1990, 55/231 of \n23 December 2000, 56/253 of 24 December 2001, 58/269 and 58/270 of 23 December \n2003, 59/276, section XI, of 23 December 2004, 60/283 of 7 July 2006, 61/263 of \n4 April 2007, 62/236 of 22 December 2007, 63/262 of 24 December 2008, 64/243 of \n24 December 2009, 65/259 of 24 December 2010, 66/246 of 24 December 2011, \n68/246 of 27 December 2013, 70/247 of 23 December 2015, 71/272 A of 23 December \n2016, 72/261 and 72/266 A of 24 December 2017, 72/266 B of 5 July 2018, 73/281 \nof 22 December 2018 and 74/262 and 74/263 of 27 December 2019, \n \nReaffirming also the respective mandates of the Committee for Programme and \nCoordination and the Advisory Committee on Administrative and Budgetary \nQuestions in the consideration of the proposed programme budget, \n \nReaffirming further the role of the General Assembly, through the Fifth \nCommittee, in carrying out a thorough analysis and approval of posts and financial \nresources, as well as of human resources policies, \n \nRecognizing the detrimental effect of the withholding of assessed contributions \non the administrative and financial functioning of the United Nations and its ability \nto implement mandates and programmes, \n \nRecognizing also that late payments of assessed contributions, bearing in mind \nthe special situation of certain Member States, have adversely affected the financial \nsituation of the United Nations and resulted in liquidity challenges that have affected \nthe delivery of mandates, \n\nA/RES/75/252 \nQuestions relating to the proposed programme budget for 2021\n \n21-00065\n2/8 \n \n \nHaving considered the proposed programme budget for 2021,1 the report of the \nIndependent Audit Advisory Committee on internal oversight: proposed programme \nbudget for 20212 and the related report of the Advisory Committee on Administrative \nand Budgetary Questions,3 \n \n1. \nReaffirms that the Fifth Committee is the appropriate Main Committee of \nthe General Assembly entrusted with responsibilities for administrative and budgetary \nmatters, and also reaffirms the role of the Fifth Committee in carrying out a thorough \nanalysis and approving human and financial resources and policies, with a view to \nensuring the full, effective and efficient implementation of all mandated programmes \nand activities and the implementation of policies in this regard; \n \n2. \nAlso reaffirms rule 153 of its rules of procedure; \n \n3. \nFurther reaffirms the Regulations and Rules Governing Programme \nPlanning, the Programme Aspects of the Budget, the Monitoring of Implementation \nand the Methods of Evaluation;4 \n \n4. \nReaffirms the established budgetary procedures and methodologies, based \non its resolutions 41/213 and 42/211; \n \n5. \nAlso reaffirms the Financial Regulations and Rules of the United Nations; 5 \n \n6. \nFurther reaffirms its resolution 75/243 of 31 December 2020; \n \n7. \nEndorses the conclusions and recommendations contained in the report of \nthe Advisory Committee on Administrative and Budgetary Questions, subject to the \nprovisions of the present resolution; \n \n8. \nWelcomes the increased throughput productivity of the translation services \nat all duty stations, underlines that these productivity gains, enabled over the years \nby new working methods and technologies, justify revising the current notional \nworkload standards approved in the pre-computer era by the General Assembly, and \ndecides to increase the workload standards for the translation services to 5.8 pages \nper day; \n \n9. \nNotes with serious concern that the exceptional measures put in place to \naddress the liquidity crisis have led to important disparities with regard to available \nstaff in the language services in the Department for General Assembly and Conference \nManagement of the Secretariat, recalls its resolution 73/346 of 16 September 2019, \nin which it emphasized the paramount importance of the equality of the six official \nlanguages of the United Nations, and requests the Secretary-General to take \nexpeditiously all action necessary to reduce those disparities and ensure equal and \nadequate treatment of all six official languages in this context, including by making \nexceptions to the aforementioned measures as needed; \n \n10. Recalls paragraph XI.6 of the report of the Advisory Committee, and \nrequests the Secretary-General to include indicative estimates for the major \nconstruction projects in the programme budget under section 33 for information \npurposes only; \n \n11. \nStresses the importance of aligning information and communications \ntechnology investment with the Secretary-General\u2019s vision of a digital United Nations \nand addressing the need for business continuity during the coronavirus disease \n__________________ \n \n1 A/75/6 (Foreword and introduction), sects. 1\u201336, income sects. 1\u20133 and corrigenda. \n \n2 A/75/87. \n \n3 Official Records of the General Assembly, Seventy-fifth Session, Supplement No. 7 and \ncorrigendum (A/75/7 and A/75/7/Corr.1). \n \n4 ST/SGB/2018/3. \n \n5 ST/SGB/2013/4 and ST/SGB/2013/4/Amend.1. \n\nQuestions relating to the proposed programme budget for 2021 \nA/RES/75/252\n \n3/8\n21-00065 \n \n(COVID-19) pandemic, and requests the Secretary-General to provide consolidated \ninformation regarding information and communications technology spending; \n \n12. Takes note of paragraphs 30 and 31 of the report of the Advisory \nCommittee; \n \n13. Stresses that all extrabudgetary posts must be administered and managed \nwith the same rigour as regular budget posts; \n \n14. Also stresses that extrabudgetary resources shall be used in consistency \nwith the policies, aims and activities of the Organization, and requests the Secretary-\nGeneral to provide information on the financial and human resource implications of \nthe use of extrabudgetary resources in the Organization in his next proposed \nprogramme budget; \n \n15. Bears in mind the rules governing the duration and extension of special \npost allowances and that the granting of such benefits should be restricted to \nexceptional cases only, and requests the Secretary-General to comply with those rules \nand review the existence of posts that have been vacant or encumbered through \nspecial post allowances for more than one year and to report thereon in his next budget \nproposal; \n \n16. Notes that organizational reforms should contribute to greater efficiency \nand effectiveness in delivering the Organization\u2019s mandated programmes and \nactivities without negatively affecting their full implementation, and requests the \nSecretary-General to provide results and examples in this regard in the context of his \nnext budget submission; \n \n17. Urges all Member States to fulfil their financial obligations as set out in \nthe Charter of the United Nations on time, in full and without conditions; \n \n18. Encourages the Secretary-General to make every effort to facilitate \nMember States\u2019 payments of their assessed contributions; \n \n19. Expresses the need to receive detailed and consolidated information on the \nmanagement of the liquidity situation, requests the Secretary-General to brief the \nGeneral Assembly periodically on the impact of the situation on the implementation \nof United Nations mandates and the functioning of United Nations services, and also \nrequests the Secretary-General to provide monthly expenditure data by section; \n \n20. Recalls paragraph 15 of the report of the Advisory Committee, and \nrequests the Secretary-General to report in the next budget performance report on the \nimpact of COVID-19 on the programme budget for 2020 and 2021, detailing the \nrecorded budget variances and flexible working arrangements, and to factor lessons \nlearned for the working methods of the Secretariat, without prejudice to the work of \nintergovernmental bodies, into the proposed programme budget for 2022; \n \n21. Stresses that finance serves as a foundation of and an important element \nunderpinning United Nations governance; \n \n22. Reaffirms that no changes to the budget methodology, to established \nbudgetary procedures and practices or to the financial regulations may be \nimplemented without prior review and approval by the General Assembly, in \naccordance with established budgetary procedures; \n \n23. Reiterates the need for Member States to participate fully in the budget \npreparation process, from its early stages and throughout the process; \n \n24. Emphasizes the importance of comprehensive budgetary performance in \nthe management of the programme budget, and requests the Secretary-General to \nclearly link the budget inputs to tangible results; \n\nA/RES/75/252 \nQuestions relating to the proposed programme budget for 2021\n \n21-00065\n4/8 \n \n \n25. Requests the Secretary-General to continue to strengthen internal controls \nin programme planning, budgeting, implementation, monitoring and evaluation, and \nreporting; \n \n26. Takes note of paragraph 34 of the report of the Advisory Committee, notes \nwith concern that the current overall single vacancy rate by staff category for all \nsections is inflated and may have an impact on mandate delivery, and requests the \nSecretary-General to bring the actual vacancy rate in the budget sections to the \napproved vacancy rate before applying it; \n \n27. Stresses that results-based budgeting and results-based management are \nmutually supportive management tools and that improved implementation of results-\nbased budgeting enhances both management and accountability in the Secretariat, and \nencourages the Secretary-General to continue his efforts in this regard; \n \n28. Requests the Secretary-General to review those posts that have been vacant \nfor 24 months or longer and to propose either the retention with justification of need \nor the abolishment of those posts, as applicable, in his next budget proposal; \n \n29. Decides that a vacancy rate of 9.1 per cent for Professional staff and \n7.4 per cent for General Service staff shall be used as a basis for the calculation of \nthe budget for 2021; \n \n30. Also decides that the staffing table for 2021 shall be as set out in the annex \nto the present resolution; \n \n31. Further decides to further reduce resources for experts by 2.8 million \nUnited States dollars; \n \n32. Decides to further reduce resources for consultants by 2.6 million dollars; \n \n33. Also decides to further reduce resources for travel of staff by 5.3 million \ndollars; \n \n34. Further decides to further reduce resources for hospitality by 350,000 \ndollars; \n \n35. Decides to further reduce resources for supplies and materials by 600,000 \ndollars; \n \n36. Also decides to further reduce resources for furniture and equipment by \n2.5 million dollars; \n \n37. Further decides to further reduce the resources for overtime and night \ndifferential by 1 million dollars; \n \n38. Decides to further reduce resources for licensing and software by 250,000 \ndollars; \n \n39. Also decides to further reduce resources for general operating expenditures \nby 1.6 million dollars; \n \n40. Further decides to further reduce resources for training by 300,000 \ndollars; \n \n\nQuestions relating to the proposed programme budget for 2021 \nA/RES/75/252\n \n5/8\n21-00065 \n \n \n \nPart I \n \n \nOverall policymaking, direction and coordination \n \n \n \nSection 1 \n \n \nOverall policymaking, direction and coordination \n \n \n41. Takes note of paragraphs I.10 and I.18 of the report of the Advisory \nCommittee, and decides to retain the post of Chief of Mediation Office (D-1) until \nthe current incumbent\u2019s mandatory retirement; \n \n42. Recalls paragraphs I.27, I.31, I.39, I.43 and I.47 of the report of the \nAdvisory Committee, also recalls its resolution 72/279 of 31 May 2018, reaffirms its \nrequest to the Secretary-General to report annually to the Economic and Social \nCouncil at its operational activities for development segment on the implementation \nof the reinvigorated resident coordinator system, including its funding, to ensure \naccountability towards Member States, and also reaffirms its request to the Secretary-\nGeneral to submit for the consideration of the General Assembly, before the end of \nits seventy-fifth session, a review with recommendations on the functioning of the \nreinvigorated resident coordinator system, including its funding arrangement; \n \n \n \nSection 2 \n \n \nGeneral Assembly and Economic and Social Council affairs and \nconference management \n \n \n43. Decides to establish two posts of Chinese Interpreter (P-3); \n \n \n \nPart II \n \n \nPolitical affairs \n \n \n \nSection 4 \n \n \nDisarmament \n \n \n44. Decides to abolish the post of Staff Assistant (General Service (Other \nlevel)) that has been vacant for more than two years; \n \n \n \nSection 5 \n \n \nPeacekeeping operations \n \n \n45. Recognizes the important role of peacekeeping and special political \nmissions at the national, subregional, regional and international levels, as appropriate, \nin maintaining peace and security in fulfilment of their mandates; \n \n46. Re-emphasizes the importance of improving the safety and security of \npeacekeepers and mission personnel, and requests the Secretary-General to fulfil the \nresponsibilities under relevant resolutions of the General Assembly and the Security \nCouncil to improve the safety and security of United Nations peacekeepers and \nmission personnel; \n \n \n \nPart III \n \n \nInternational justice and law \n \n \n \nSection 8 \n \n \nLegal affairs \n \n \n47. Decides not to approve the establishment of one new general temporary \nassistance position of Legal Officer (P-3) in the Independent Investigative \nMechanism for Myanmar; \n \n48. Takes note of paragraph III.54 of the report of the Advisory Committee; \n\nA/RES/75/252 \nQuestions relating to the proposed programme budget for 2021\n \n21-00065\n6/8 \n \n \n49. Decides that regular budget resources for the International, Impartial and \nIndependent Mechanism to Assist in the Investigation and Prosecution of Persons \nResponsible for the Most Serious Crimes under International Law Committed in the \nSyrian Arab Republic since March 2011 under section 8, Legal affairs, for 2021 \namount to 17 million dollars before recosting; \n \n \n \nPart IV \n \n \nInternational cooperation for development \n \n \n \nSection 10 \n \n \nLeast developed countries, landlocked developing countries and small island \ndeveloping States \n \n \n50. Decides to establish one P-4 post and one P-3 post under subprogramme 2, \nLandlocked developing countries; \n \n \n \nSection 11 \n \n \nUnited Nations support for the New Partnership for Africa\u2019s Development \n \n \n51. Recalls that the development of Africa is an established priority of the \nUnited Nations, and reaffirms its commitment to address the unique needs of Africa; \n \n \n \nSection 15 \n \n \nHuman settlements \n \n \n52. Decides to establish two posts of Programme Management Officer (P-4) \nin Nairobi; \n \n \n \nPart VI \n \n \nHuman rights and humanitarian affairs \n \n \n \nSection 24 \n \n \nHuman rights \n \n \n53. Decides to approve the establishment of one general temporary assistance \nposition of Human Rights Officer (P-3); \n \n54. Requests the Secretary-General to entrust the Office of Internal Oversight \nServices of the Secretariat with the conduct of a review and evaluation of the activity, \nperformance and results of staff support provided to the human rights treaty body \nsystem of the Office of the United Nations High Commissioner for Human Rights, to \nensure the effectiveness of the treaty body system, and requests the Secretary-General \nto report thereon in his next budget report; \n \n \n \nPart VIII \n \n \nCommon support services \n \n \n \nSection 29C \n \n \nOffice of Information and Communications Technology \n \n \n55. Takes note of paragraph VIII.57 of the report of the Advisory Committee, \nand decides not to abolish the P-5 post; \n \n56. Decides to abolish the long-vacant P-3 post; \n \n\nQuestions relating to the proposed programme budget for 2021 \nA/RES/75/252\n \n7/8\n21-00065 \n \n \n \nPart XI \n \n \nCapital expenditures \n \n \n \nSection 33 \n \n \nConstruction, alteration, improvement and major maintenance \n \n \n57. Decides to further reduce resources for alteration, improvement and major \nmaintenance projects by 1,474,400 dollars; \n \n \n \nPart XII \n \n \nSafety and security \n \n \n \nSection 34 \n \n \nSafety and security \n \n \n58. Takes note of paragraph XII.11 of the report of the Advisory Committee, \nand decides to establish the posts of Chief of Physical Security Section (P-5) and \nCompliance, Monitoring and Evaluation Officer (P-3). \n \n48th (resumed) plenary meeting \n31 December 2020 \n \n \n \n Annex \n \n \n Staffing table for 2021 \n \n \nCategory \nNumber of posts \nExpenditure sections \n \nProfessional and higher \n \nDeputy Secretary-General \n1 \nUnder-Secretary-General \n36 \nAssistant Secretary-General \n33 \nD-2 \n115 \nD-1 \n298 \nP-5 \n904 \nP-4 \n1 537 \nP-3 \n1 451 \nP-2/1 \n524 \nSubtotal \n4 899 \nGeneral Service and related \n \nPrincipal level \n270 \nOther level \n2 288 \nSubtotal \n2 558 \nOther \n \nSecurity Service \n307 \nLocal level \n1 906 \nField Service \n107 \nNational Professional Officer \n87 \nTrades and Crafts \n95 \nSubtotal \n2 502 \nExpenditure sections total \n9 959 \n \n\nA/RES/75/252 \nQuestions relating to the proposed programme budget for 2021\n \n21-00065\n8/8 \n \nCategory \nNumber of posts \nIncome section 3 \n \nProfessional and higher \n \nP-5 \n2 \nP-4 \n4 \nP-3 \n4 \nP-2/1 \n3 \nSubtotal \n13 \nGeneral Service and related \n \nPrincipal level \n7 \nOther level \n43 \nSubtotal \n50 \nOther \n \nSecurity Service \n2 \nSubtotal \n2 \nIncome section 3 total \n65 \nTotal \n10 024 \n \n \n",
  "paragraphs": {
    "1": "Reaffirms that the Fifth Committee is the appropriate Main Committee of the General Assembly entrusted with responsibilities for administrative and budgetary matters, and also reaffirms the role of the Fifth Committee in carrying out a thorough analysis and approving human and financial resources and policies, with a view to ensuring the full, effective and efficient implementation of all mandated programmes and activities and the implementation of policies in this regard;",
    "2": "Also reaffirms rule 153 of its rules of procedure;",
    "3": "Further reaffirms the Regulations and Rules Governing Programme Planning, the Programme Aspects of the Budget, the Monitoring of Implementation and the Methods of Evaluation;4",
    "4": "Reaffirms the established budgetary procedures and methodologies, based on its resolutions 41/213 and 42/211;",
    "5": "Also reaffirms the Financial Regulations and Rules of the United Nations; 5",
    "6": "Further reaffirms its resolution 75/243 of 31 December 2020;",
    "7": "Endorses the conclusions and recommendations contained in the report of the Advisory Committee on Administrative and Budgetary Questions, subject to the provisions of the present resolution;",
    "8": "Welcomes the increased throughput productivity of the translation services at all duty stations, underlines that these productivity gains, enabled over the years by new working methods and technologies, justify revising the current notional workload standards approved in the pre-computer era by the General Assembly, and decides to increase the workload standards for the translation services to 5.8 pages per day;",
    "9": "Notes with serious concern that the exceptional measures put in place to address the liquidity crisis have led to important disparities with regard to available staff in the language services in the Department for General Assembly and Conference Management of the Secretariat, recalls its resolution 73/346 of 16 September 2019, in which it emphasized the paramount importance of the equality of the six official languages of the United Nations, and requests the Secretary-General to take expeditiously all action necessary to reduce those disparities and ensure equal and adequate treatment of all six official languages in this context, including by making exceptions to the aforementioned measures as needed;",
    "10": "Recalls paragraph XI.6 of the report of the Advisory Committee, and requests the Secretary-General to include indicative estimates for the major construction projects in the programme budget under section 33 for information purposes only;",
    "11": "Stresses the importance of aligning information and communications technology investment with the Secretary-General\u2019s vision of a digital United Nations and addressing the need for business continuity during the coronavirus disease __________________ 1 A/75/6 (Foreword and introduction), sects. 1\u201336, income sects. 1\u20133 and corrigenda. 2 A/75/87. 3 Official Records of the General Assembly, Seventy-fifth Session, Supplement No. 7 and corrigendum (A/75/7 and A/75/7/Corr.1). 4 ST/SGB/2018/3. 5 ST/SGB/2013/4 and ST/SGB/2013/4/Amend.1. Questions relating to the proposed programme budget for 2021 A/RES/75/252 3/8 21-00065 (COVID-19) pandemic, and requests the Secretary-General to provide consolidated information regarding information and communications technology spending;",
    "12": "Takes note of paragraphs 30 and 31 of the report of the Advisory Committee;",
    "13": "Stresses that all extrabudgetary posts must be administered and managed with the same rigour as regular budget posts;",
    "14": "Also stresses that extrabudgetary resources shall be used in consistency with the policies, aims and activities of the Organization, and requests the Secretary- General to provide information on the financial and human resource implications of the use of extrabudgetary resources in the Organization in his next proposed programme budget;",
    "15": "Bears in mind the rules governing the duration and extension of special post allowances and that the granting of such benefits should be restricted to exceptional cases only, and requests the Secretary-General to comply with those rules and review the existence of posts that have been vacant or encumbered through special post allowances for more than one year and to report thereon in his next budget proposal;",
    "16": "Notes that organizational reforms should contribute to greater efficiency and effectiveness in delivering the Organization\u2019s mandated programmes and activities without negatively affecting their full implementation, and requests the Secretary-General to provide results and examples in this regard in the context of his next budget submission;",
    "17": "Urges all Member States to fulfil their financial obligations as set out in the Charter of the United Nations on time, in full and without conditions;",
    "18": "Encourages the Secretary-General to make every effort to facilitate Member States\u2019 payments of their assessed contributions;",
    "19": "Expresses the need to receive detailed and consolidated information on the management of the liquidity situation, requests the Secretary-General to brief the General Assembly periodically on the impact of the situation on the implementation of United Nations mandates and the functioning of United Nations services, and also requests the Secretary-General to provide monthly expenditure data by section;",
    "20": "Recalls paragraph 15 of the report of the Advisory Committee, and requests the Secretary-General to report in the next budget performance report on the impact of COVID-19 on the programme budget for 2020 and 2021, detailing the recorded budget variances and flexible working arrangements, and to factor lessons learned for the working methods of the Secretariat, without prejudice to the work of intergovernmental bodies, into the proposed programme budget for 2022;",
    "21": "Stresses that finance serves as a foundation of and an important element underpinning United Nations governance;",
    "22": "Reaffirms that no changes to the budget methodology, to established budgetary procedures and practices or to the financial regulations may be implemented without prior review and approval by the General Assembly, in accordance with established budgetary procedures;",
    "23": "Reiterates the need for Member States to participate fully in the budget preparation process, from its early stages and throughout the process;",
    "24": "Emphasizes the importance of comprehensive budgetary performance in the management of the programme budget, and requests the Secretary-General to clearly link the budget inputs to tangible results; A/RES/75/252 Questions relating to the proposed programme budget for 2021 21-00065 4/8",
    "25": "Requests the Secretary-General to continue to strengthen internal controls in programme planning, budgeting, implementation, monitoring and evaluation, and reporting;",
    "26": "Takes note of paragraph 34 of the report of the Advisory Committee, notes with concern that the current overall single vacancy rate by staff category for all sections is inflated and may have an impact on mandate delivery, and requests the Secretary-General to bring the actual vacancy rate in the budget sections to the approved vacancy rate before applying it;",
    "27": "Stresses that results-based budgeting and results-based management are mutually supportive management tools and that improved implementation of results- based budgeting enhances both management and accountability in the Secretariat, and encourages the Secretary-General to continue his efforts in this regard;",
    "28": "Requests the Secretary-General to review those posts that have been vacant for 24 months or longer and to propose either the retention with justification of need or the abolishment of those posts, as applicable, in his next budget proposal;",
    "29": "Decides that a vacancy rate of 9.1 per cent for Professional staff and 7.4 per cent for General Service staff shall be used as a basis for the calculation of the budget for 2021;",
    "30": "Also decides that the staffing table for 2021 shall be as set out in the annex to the present resolution;",
    "31": "Further decides to further reduce resources for experts by 2.8 million United States dollars;",
    "32": "Decides to further reduce resources for consultants by 2.6 million dollars;",
    "33": "Also decides to further reduce resources for travel of staff by 5.3 million dollars;",
    "34": "Further decides to further reduce resources for hospitality by 350,000 dollars;",
    "35": "Decides to further reduce resources for supplies and materials by 600,000 dollars;",
    "36": "Also decides to further reduce resources for furniture and equipment by 2.5 million dollars;",
    "37": "Further decides to further reduce the resources for overtime and night differential by 1 million dollars;",
    "38": "Decides to further reduce resources for licensing and software by 250,000 dollars;",
    "39": "Also decides to further reduce resources for general operating expenditures by 1.6 million dollars;",
    "40": "Further decides to further reduce resources for training by 300,000 dollars; Questions relating to the proposed programme budget for 2021 A/RES/75/252 5/8 21-00065 Part I Overall policymaking, direction and coordination Section 1 Overall policymaking, direction and coordination",
    "41": "Takes note of paragraphs I.10 and I.18 of the report of the Advisory Committee, and decides to retain the post of Chief of Mediation Office (D-1) until the current incumbent\u2019s mandatory retirement;",
    "42": "Recalls paragraphs I.27, I.31, I.39, I.43 and I.47 of the report of the Advisory Committee, also recalls its resolution 72/279 of 31 May 2018, reaffirms its request to the Secretary-General to report annually to the Economic and Social Council at its operational activities for development segment on the implementation of the reinvigorated resident coordinator system, including its funding, to ensure accountability towards Member States, and also reaffirms its request to the Secretary- General to submit for the consideration of the General Assembly, before the end of its seventy-fifth session, a review with recommendations on the functioning of the reinvigorated resident coordinator system, including its funding arrangement; Section 2 General Assembly and Economic and Social Council affairs and conference management",
    "43": "Decides to establish two posts of Chinese Interpreter (P-3); Part II Political affairs Section 4 Disarmament",
    "44": "Decides to abolish the post of Staff Assistant (General Service (Other level)) that has been vacant for more than two years; Section 5 Peacekeeping operations",
    "45": "Recognizes the important role of peacekeeping and special political missions at the national, subregional, regional and international levels, as appropriate, in maintaining peace and security in fulfilment of their mandates;",
    "46": "Re-emphasizes the importance of improving the safety and security of peacekeepers and mission personnel, and requests the Secretary-General to fulfil the responsibilities under relevant resolutions of the General Assembly and the Security Council to improve the safety and security of United Nations peacekeepers and mission personnel; Part III International justice and law Section 8 Legal affairs",
    "47": "Decides not to approve the establishment of one new general temporary assistance position of Legal Officer (P-3) in the Independent Investigative Mechanism for Myanmar;",
    "48": "Takes note of paragraph III.54 of the report of the Advisory Committee; A/RES/75/252 Questions relating to the proposed programme budget for 2021 21-00065 6/8",
    "49": "Decides that regular budget resources for the International, Impartial and Independent Mechanism to Assist in the Investigation and Prosecution of Persons Responsible for the Most Serious Crimes under International Law Committed in the Syrian Arab Republic since March 2011 under section 8, Legal affairs, for 2021 amount to 17 million dollars before recosting; Part IV International cooperation for development Section 10 Least developed countries, landlocked developing countries and small island developing States",
    "50": "Decides to establish one P-4 post and one P-3 post under subprogramme 2, Landlocked developing countries; Section 11 United Nations support for the New Partnership for Africa\u2019s Development",
    "51": "Recalls that the development of Africa is an established priority of the United Nations, and reaffirms its commitment to address the unique needs of Africa; Section 15 Human settlements",
    "52": "Decides to establish two posts of Programme Management Officer (P-4) in Nairobi; Part VI Human rights and humanitarian affairs Section 24 Human rights",
    "53": "Decides to approve the establishment of one general temporary assistance position of Human Rights Officer (P-3);",
    "54": "Requests the Secretary-General to entrust the Office of Internal Oversight Services of the Secretariat with the conduct of a review and evaluation of the activity, performance and results of staff support provided to the human rights treaty body system of the Office of the United Nations High Commissioner for Human Rights, to ensure the effectiveness of the treaty body system, and requests the Secretary-General to report thereon in his next budget report; Part VIII Common support services Section 29C Office of Information and Communications Technology",
    "55": "Takes note of paragraph VIII.57 of the report of the Advisory Committee, and decides not to abolish the P-5 post;",
    "56": "Decides to abolish the long-vacant P-3 post; Questions relating to the proposed programme budget for 2021 A/RES/75/252 7/8 21-00065 Part XI Capital expenditures Section 33 Construction, alteration, improvement and major maintenance",
    "57": "Decides to further reduce resources for alteration, improvement and major maintenance projects by 1,474,400 dollars; Part XII Safety and security Section 34 Safety and security",
    "58": "Takes note of paragraph XII.11 of the report of the Advisory Committee, and decides to establish the posts of Chief of Physical Security Section (P-5) and Compliance, Monitoring and Evaluation Officer (P-3). 48th (resumed) plenary meeting 31 December 2020 Annex Staffing table for 2021 Category Number of posts Expenditure sections Professional and higher Deputy Secretary-General 1 Under-Secretary-General 36 Assistant Secretary-General 33 D-2 115 D-1 298 P-5 904 P-4 1 537 P-3 1 451 P-2/1 524 Subtotal 4 899 General Service and related Principal level 270 Other level 2 288 Subtotal 2 558 Other Security Service 307 Local level 1 906 Field Service 107 National Professional Officer 87 Trades and Crafts 95 Subtotal 2 502 Expenditure sections total 9 959 A/RES/75/252 Questions relating to the proposed programme budget for 2021 21-00065 8/8 Category Number of posts Income section 3 Professional and higher P-5 2 P-4 4 P-3 4 P-2/1 3 Subtotal 13 General Service and related Principal level 7 Other level 43 Subtotal 50 Other Security Service 2 Subtotal 2 Income section 3 total 65 Total 10 024"
  },
  "agenda_items": [
    "Item 141"
  ],
  "symbol_references": []
}