{
  "symbol": "A/RES/78/303",
  "filename": "A_RES_78_303.pdf",
  "title": "78/303. Financing of the United Nations Mission in Liberia",
  "text": "United Nations \nA/RES/78/303\n \n \nGeneral Assembly \nDistr.: General \n3 July 2024 \n \n24-12156 (E)         \n*2412156* \n \n \nSeventy-eighth session \nAgenda item 154 \nFinancing of the United Nations Mission in Liberia \n \n \n \n \n Resolution adopted by the General Assembly \non 28 June 2024 \n \n \n \n \n[on the report of the Fifth Committee (A/78/927, para. 6)] \n \n \n 78/303. Financing of the United Nations Mission in Liberia \n \n \n \nThe General Assembly, \n \nHaving considered the report of the Secretary-General on the final performance \nof the United Nations Mission in Liberia 1 and the related report of the Advisory \nCommittee on Administrative and Budgetary Questions,2  \n \n1. \nTakes note of the status of contributions to the United Nations Mission in \nLiberia as at 30 April 2024, including the contributions outstanding in the amount of \n4.5 million United States dollars, representing some 0.05 per cent of the total assessed \ncontributions, notes with concern that only 183 Member States have paid their \nassessed contributions in full, and urges all other Member States, in particular those \nin arrears, to ensure payment of their outstanding assessed contributions; \n \n2. \nEndorses the conclusions and recommendations contained in the report of \nthe Advisory Committee on Administrative and Budgetary Questions, and requests \nthe Secretary-General to ensure their full implementation; \n \n3. \nTakes note of the report of the Secretary-General on the final performance \nof the United Nations Mission in Liberia; \n \n4. \nDecides that Member States that have fulfilled their financial obligations \nto the Mission shall be credited with their respective share of the net cash available \nin the special account for the United Nations Mission in Liberia in the amount of \n12,337,000 dollars as at 30 April 2024, in accordance with the levels updated in its \nresolution 70/246 of 23 December 2015, taking into account the scale of assessments \nfor 2018, as set out in its resolution 70/245 of 23 December 2015; \n__________________ \n \n1  A/75/684. \n \n2  A/75/823. \n\nA/RES/78/303 \nFinancing of the United Nations Mission in Liberia\n \n24-12156\n2/2 \n \n \n5. \nEncourages Member States that are owed credits referred to in paragraph 4 \nabove to apply those credits to any accounts where they have outstanding assessed \ncontributions; \n \n6. \nUrges all Member States to make every possible effort to ensure payment \nof their assessed contributions in full; \n \n7. \nDecides that, for Member States that have not fulfilled their financial \nobligations to the Mission, their respective share of the net cash available in the \nspecial account for the Mission in the amount of 12,337,000 dollars as at 30 April \n2024 shall be set off against their outstanding obligations, in accordance with the \nscheme set out in paragraph 4 above; \n \n8. \nAlso decides that updated information on the financial position of the \nMission shall be included in the report on the updated position of closed peacekeeping \nmissions, to be considered by the General Assembly at its seventy-ninth session under \nthe agenda item entitled \u201cAdministrative and budgetary aspects of the financing of \nthe United Nations peacekeeping operations\u201d; \n \n9. \nFurther decides to delete from its agenda the item entitled \u201cFinancing of \nthe United Nations Mission in Liberia\u201d. \n \n95th plenary meeting \n28 June 2024 \n \n",
  "paragraphs": {
    "1": "Takes note of the status of contributions to the United Nations Mission in Liberia as at 30 April 2024, including the contributions outstanding in the amount of 4.5 million United States dollars, representing some 0.05 per cent of the total assessed contributions, notes with concern that only 183 Member States have paid their assessed contributions in full, and urges all other Member States, in particular those in arrears, to ensure payment of their outstanding assessed contributions;",
    "2": "Endorses the conclusions and recommendations contained in the report of the Advisory Committee on Administrative and Budgetary Questions, and requests the Secretary-General to ensure their full implementation;",
    "3": "Takes note of the report of the Secretary-General on the final performance of the United Nations Mission in Liberia;",
    "4": "Decides that Member States that have fulfilled their financial obligations to the Mission shall be credited with their respective share of the net cash available in the special account for the United Nations Mission in Liberia in the amount of 12,337,000 dollars as at 30 April 2024, in accordance with the levels updated in its resolution 70/246 of 23 December 2015, taking into account the scale of assessments for 2018, as set out in its resolution 70/245 of 23 December 2015; __________________ 1 A/75/684. 2 A/75/823. A/RES/78/303 Financing of the United Nations Mission in Liberia 24-12156 2/2",
    "5": "Encourages Member States that are owed credits referred to in paragraph 4 above to apply those credits to any accounts where they have outstanding assessed contributions;",
    "6": "Urges all Member States to make every possible effort to ensure payment of their assessed contributions in full;",
    "7": "Decides that, for Member States that have not fulfilled their financial obligations to the Mission, their respective share of the net cash available in the special account for the Mission in the amount of 12,337,000 dollars as at 30 April 2024 shall be set off against their outstanding obligations, in accordance with the scheme set out in paragraph 4 above;",
    "8": "Also decides that updated information on the financial position of the Mission shall be included in the report on the updated position of closed peacekeeping missions, to be considered by the General Assembly at its seventy-ninth session under the agenda item entitled \u201cAdministrative and budgetary aspects of the financing of the United Nations peacekeeping operations\u201d;",
    "9": "Further decides to delete from its agenda the item entitled \u201cFinancing of the United Nations Mission in Liberia\u201d. 95th plenary meeting 28 June 2024"
  },
  "agenda_items": [
    "Item 154"
  ],
  "symbol_references": []
}