{
  "symbol": "A/RES/72/83",
  "filename": "A_RES_72_83.pdf",
  "title": "72/83. Palestine refugees\u2019 properties and their revenues",
  "text": "United Nations \nA/RES/72/83\n \n \nGeneral Assembly \nDistr.: General \n14 December 2017 \n \n17-22110 (E)    181217 \n*1722110* \n \n \nSeventy-second session \nAgenda item 53 \n \n \n \n \n Resolution adopted by the General Assembly \non 7 December 2017 \n \n \n \n \n[on the report of the Special Political and Decolonization Committee \n(Fourth Committee) (A/72/447)] \n \n \n \n72/83. Palestine refugees\u2019 properties and their revenues \n \n \n \nThe General Assembly, \n \nRecalling its resolutions 194 (III) of 11 December 1948 and 36/146 C of \n16 December 1981 and all its subsequent resolutions on the question, \n \nTaking note of the report of the Secretary-General submitted pursuant to its \nresolution 71/94 of 6 December 2016,1 as well as that of the United Nations \nConciliation Commission for Palestine for the period from 1 September 2016 to \n31 August 2017,2 \n \nRecalling that the Universal Declaration of Human Rights 3 and the principles \nof international law uphold the principle that no one shall be arbitrarily deprived of \nhis or her property, \n \nRecalling in particular its resolution 394 (V) of 14 December 1950, in which \nit directed the Conciliation Commission, in consultation with the parties concerned, \nto prescribe measures for the protection of the rights, property and interests of the \nPalestine refugees, \n \nNoting the completion of the programme of identification and evaluation of \nArab property, as announced by the Conciliation Commission in its twenty-second \nprogress report,4 and the fact that the Land Office had a schedule of Arab owners \nand a file of documents defining the location, area and other particulars of Arab \nproperty, \n__________________ \n \n1 A/72/334. \n \n2 A/72/332. \n \n3 Resolution 217 A (III). \n \n4 Official Records of the General Assembly, Nineteenth Session, Annexes, Annex No. 11, \ndocument A/5700. \n\nA/RES/72/83 \nPalestine refugees\u2019 properties and their revenues\n \n17-22110 \n2/2 \n \n \nExpressing its appreciation for the preservation and modernization of the \nexisting records, including the land records, of the Conciliation Commission, and \nstressing the importance of such records for a just resolution of the plight of the \nPalestine refugees in conformity with resolution 194 (III), \n \nRecalling that, in the framework of the Middle East peace process, the \nPalestine Liberation Organization and the Government of Israel agreed, in the \nDeclaration \nof \nPrinciples \non \nInterim \nSelf-Government \nArrangements \nof \n13 September 1993,5 to commence negotiations on permanent status issues, \nincluding the important issue of the refugees, \n \n1. \nReaffirms that the Palestine refugees are entitled to their property and to \nthe income derived therefrom, in conformity with the principles of equity and \njustice; \n \n2. \nRequests the Secretary-General to take all appropriate steps, in \nconsultation with the United Nations Conciliation Commission for Palestine, for the \nprotection of Arab property, assets and property rights in Israel; \n \n3. \nCalls once again upon Israel to render all facilities and assistance to the \nSecretary-General in the implementation of the present resolution; \n \n4. \nCalls upon all the parties concerned to provide the Secretary-General \nwith any pertinent information in their possession concerning Arab property, assets \nand property rights in Israel that would assist him in the implementation of the \npresent resolution; \n \n5. \nUrges the Palestinian and Israeli sides, as agreed between them, to deal \nwith the important issue of Palestine refugees\u2019 properties and their revenues within \nthe framework of the final status peace negotiations; \n \n6. \nRequests the Secretary-General to report to the General Assembly at its \nseventy-third session on the implementation of the present resolution. \n \n66th plenary meeting  \n7 December 2017 \n \n__________________ \n \n5 A/48/486-S/26560, annex. \n",
  "paragraphs": {
    "1": "Reaffirms that the Palestine refugees are entitled to their property and to the income derived therefrom, in conformity with the principles of equity and justice;",
    "2": "Requests the Secretary-General to take all appropriate steps, in consultation with the United Nations Conciliation Commission for Palestine, for the protection of Arab property, assets and property rights in Israel;",
    "3": "Calls once again upon Israel to render all facilities and assistance to the Secretary-General in the implementation of the present resolution;",
    "4": "Calls upon all the parties concerned to provide the Secretary-General with any pertinent information in their possession concerning Arab property, assets and property rights in Israel that would assist him in the implementation of the present resolution;",
    "5": "Urges the Palestinian and Israeli sides, as agreed between them, to deal with the important issue of Palestine refugees\u2019 properties and their revenues within the framework of the final status peace negotiations;",
    "6": "Requests the Secretary-General to report to the General Assembly at its seventy-third session on the implementation of the present resolution. 66th plenary meeting 7 December 2017 __________________ 5 A/48/486-S/26560, annex."
  },
  "agenda_items": [
    "Item 53"
  ],
  "symbol_references": []
}