{
  "symbol": "A/RES/74/267",
  "filename": "A_RES_74_267.pdf",
  "title": "74/267. Enlargement of the Advisory Committee on Administrative and Budgetary Questions: amendment to rule 155 of the rules of procedure of the General Assembly",
  "text": "United Nations \nA/RES/74/267\n \n \nGeneral Assembly \nDistr.: General \n17 January 2020 \n \n20-00744 (E)    200120    200120 \n*2000744* \n \n \nSeventy-fourth session \nAgenda item 123 \nStrengthening of the United Nations system \n \n \n \n \n Resolution adopted by the General Assembly \non 14 January 2020 \n \n \n \n \n[without reference to a Main Committee (A/74/L.5)] \n \n \n 74/267. Enlargement of the Advisory Committee on Administrative and \nBudgetary Questions: amendment to rule 155 of the rules of \nprocedure of the General Assembly \n \n \n \nThe General Assembly, \n \nRecalling its resolution 14 (I) of 13 February 1946 on the establishment of the \nAdvisory Committee on Administrative and Budgetary Questions and its resolutions \n1659 (XVI) of 28 November 1961, 2798 (XXVI) of 13 December 1971 and 32/103 \nof 14 December 1977 on the enlargement of the Advisory Committee, \n \nAcknowledging that the membership of the United Nations has increased \nsubstantially since the adoption of the last resolution enlarging the Advisory \nCommittee,  \n \nMindful of rules 156 and 157 of its rules of procedure, and desiring, accordingly, \nto increase the participation of members from developing countries in the Advisory \nCommittee in order to ensure broad geographical representation in the Committee, \n \n1. \nDecides to increase the membership of the Advisory Committee on \nAdministrative and Budgetary Questions from sixteen to twenty-one members, \nbeginning from 1 January 2021; \n \n2. \nAlso decides that seats shall be distributed as follows among regional \ngroups: Group of African States, five; Group of Asian and Pacific States, five; Group \nof Eastern European States, three; Group of Latin American and Caribbean States, \nfour; and Group of Western European and other States, four; \n \n3. \nFurther decides to amend, with effect from 1 January 2021, rule 155 of \nthe rules of procedure of the General Assembly to read: \u201cThe General Assembly shall \n\nA/RES/74/267 \nEnlargement of the Advisory Committee on Administrative\nand Budgetary Questions: amendment to rule 155\nof the rules of procedure of the General Assembly\n \n20-00744\n2/2 \n \nappoint an Advisory Committee on Administrative and Budgetary Questions \nconsisting of twenty-one members, including at least three financial experts of \nrecognized standing\u201d. \n \n53rd plenary meeting \n14 January 2020 \n \n",
  "paragraphs": {
    "1": "Decides to increase the membership of the Advisory Committee on Administrative and Budgetary Questions from sixteen to twenty-one members, beginning from 1 January 2021;",
    "2": "Also decides that seats shall be distributed as follows among regional groups: Group of African States, five; Group of Asian and Pacific States, five; Group of Eastern European States, three; Group of Latin American and Caribbean States, four; and Group of Western European and other States, four;",
    "3": "Further decides to amend, with effect from 1 January 2021, rule 155 of the rules of procedure of the General Assembly to read: \u201cThe General Assembly shall A/RES/74/267 Enlargement of the Advisory Committee on Administrative and Budgetary Questions: amendment to rule 155 of the rules of procedure of the General Assembly 20-00744 2/2 appoint an Advisory Committee on Administrative and Budgetary Questions consisting of twenty-one members, including at least three financial experts of recognized standing\u201d. 53rd plenary meeting 14 January 2020"
  },
  "agenda_items": [
    "Item 123"
  ],
  "symbol_references": [
    "A/74/L.5"
  ]
}