{
  "symbol": "A/RES/74/89",
  "filename": "A_RES_74_89.pdf",
  "title": "74/89. Israeli practices affecting the human rights of the Palestinian people in the Occupied Palestinian Territory, including East Jerusalem",
  "text": "United Nations \nA/RES/74/89*\n \n \nGeneral Assembly \nDistr.: General \n26 December 2019 \n \n19-21902* (E)    291020 \n*1921902* \n \n \nSeventy-fourth session \nAgenda item 51 \nReport of the Special Committee to Investigate Israeli \nPractices Affecting the Human Rights of the Palestinian \nPeople and Other Arabs of the Occupied Territories \n \n \n \n \n Resolution adopted by the General Assembly \non 13 December 2019 \n \n \n \n \n[on the report of the Special Political and Decolonization Committee \n(Fourth Committee) (A/74/410)] \n \n \n \n74/89. Israeli practices affecting the human rights of the Palestinian \npeople in the Occupied Palestinian Territory, including \nEast Jerusalem \n \n \n \n \nThe General Assembly, \n \nRecalling the Universal Declaration of Human Rights,1 \n \nRecalling also the International Covenant on Civil and Political Rights, 2 the \nInternational Covenant on Economic, Social and Cultural Rights2 and the Convention \non the Rights of the Child,3 and affirming that these human rights instruments must \nbe respected in the Occupied Palestinian Territory, including East Jerusalem, \n \nReaffirming its relevant resolutions, including resolution 73/99 of 7 December \n2018, as well as those adopted at its tenth emergency special session, \n \nRecalling the relevant resolutions of the Human Rights Council, \n \nRecalling also the relevant resolutions of the Security Council, and stressing the \nneed for their implementation, \n \nHaving considered the report of the Special Committee to Investigate Israeli \nPractices Affecting the Human Rights of the Palestinian People and Other Arabs of \n__________________ \n \n* Reissued for technical reasons on 29 October 2020. \n \n1  Resolution 217 A (III). \n \n2  See resolution 2200 A (XXI), annex. \n \n3  United Nations, Treaty Series, vol. 1577, No. 27531. \n\nA/RES/74/89 \nIsraeli practices affecting the human rights of the Palestinian people \nin the Occupied Palestinian Territory, including East Jerusalem\n \n19-21902\n2/8 \n \nthe Occupied Territories4 and the report of the Secretary-General on the work of the \nSpecial Committee,5 \n \nTaking note of the report of the Special Rapporteur of the Human Rights Council \non the situation of human rights in the Palestinian territories occupied since 1967, 6 as \nwell as of other relevant recent reports of the Human Rights Council, \n \nTaking note also of the report of the independent international commission of \ninquiry established pursuant to Human Rights Council resolution S-28/1,7 \n \nStressing the need to ensure accountability for all violations of international \nhumanitarian law and international human rights law in order to end impunity, ensure \njustice, deter further violations, protect civilians and promote peace, \n \nTaking note of the recent report by the Economic and Social Commission for \nWestern Asia on the economic and social repercussions of the Israeli occupation on \nthe living conditions of the Palestinian people in the Occupied Palestinian Territory, \nincluding East Jerusalem, and the Arab population in the occupied Syrian Golan, 8 \n \nDeeply regretting that 52 years have passed since the onset of the Israeli \noccupation, and stressing the urgent need for efforts to reverse the negative trends on \nthe ground and to restore a political horizon for advancing and accelerating \nmeaningful negotiations aimed at the achievement of a peace agreement that will \nbring a complete end to the Israeli occupation that began in 1967 and the resolution \nof all core final status issues, without exception, leading to a peaceful, just, lasting \nand comprehensive solution of the question of Palestine, \n \nAware of the responsibility of the international community to promote human \nrights and ensure respect for international law, and recalling in this regard its \nresolution 2625 (XXV) of 24 October 1970, \n \nRecalling the advisory opinion rendered on 9 July 2004 by the International \nCourt of Justice on the legal consequences of the construction of a wall in the Occupied \nPalestinian Territory,9 and recalling also relevant General Assembly resolutions,  \n \nNoting in particular the Court\u2019s reply, including that the construction of the wall \nbeing built by Israel, the occupying Power, in the Occupied Palestinian Territory, \nincluding in and around East Jerusalem, and its associated regime are contrary to \ninternational law, \n \nTaking note of its resolution 67/19 of 29 November 2012, \n \nNoting the accession by Palestine to several human rights treaties and the core \nhumanitarian law conventions, as well as other international treaties, \n \nReaffirming the principle of the inadmissibility of the acquisition of territory by \nforce, \n \nReaffirming also the applicability of the Geneva Convention relative to the \nProtection of Civilian Persons in Time of War, of 12 August 1949, 10 to the Occupied \nPalestinian Territory, including East Jerusalem, and other Arab territories occupied \nby Israel since 1967, \n__________________ \n \n4  A/74/356. \n \n5  A/74/468. \n \n6  A/HRC/40/73. \n \n7  A/HRC/40/74. \n \n8  A/74/88-E/2019/72. \n \n9  See A/ES-10/273 and A/ES-10/273/Corr.1. \n \n10  United Nations, Treaty Series, vol. 75, No. 973. \n\nIsraeli practices affecting the human rights of the Palestinian people \nin the Occupied Palestinian Territory, including East Jerusalem \nA/RES/74/89\n \n3/8\n19-21902 \n \n \nReaffirming further the obligation of the States parties to the Fourth Geneva \nConvention10 under articles 146, 147 and 148 with regard to penal sanctions, grave \nbreaches and responsibilities of the High Contracting Parties, \n \nRecalling the statement of 15 July 1999 and the declarations adopted on \n5 December 2001 and on 17 December 201411 by the Conference of High Contracting \nParties to the Fourth Geneva Convention on measures to enforce the Convention in the \nOccupied Palestinian Territory, including East Jerusalem, aimed at ensuring respect for \nthe Convention in the Occupied Palestinian Territory, including East Jerusalem, \n \nReaffirming that all States have the right and the duty to take actions in \nconformity with international law and international humanitarian law to counter \ndeadly acts of violence against their civilian population in order to protect the lives \nof their citizens, \n \nStressing the need for full compliance with the Israeli-Palestinian agreements \nreached within the context of the Middle East peace process, including the Sharm \nel-Sheikh understandings, and the implementation of the Quartet road map to a \npermanent two-State solution to the Israeli-Palestinian conflict,12 \n \nStressing also the need for the full implementation of the Agreement on \nMovement and Access and the Agreed Principles for the Rafah Crossing, both of \n15 November 2005, to allow for the freedom of movement of the Palestinian civilian \npopulation within and into and out of the Gaza Strip, \n \nGravely concerned by the tensions and violence in the recent period throughout \nthe Occupied Palestinian Territory, including East Jerusalem and including with \nregard to the holy places of Jerusalem, including the Haram al-Sharif, and deploring \nthe loss of innocent civilian life, \n \nReaffirming that the international community, through the United Nations, has \na legitimate interest in the question of the City of Jerusalem and in the protection of \nthe unique spiritual, religious and cultural dimensions of the city, as foreseen in \nrelevant United Nations resolutions on this matter,  \n \nReaffirming also the obligation to respect the historic status quo, the special \nsignificance of the holy sites, and the importance of the City of Jerusalem for the \nthree monotheistic religions, \n \nRecognizing that security measures alone cannot remedy the escalating tensions, \ninstability and violence, and calling for full respect for international law, including \nhumanitarian and human rights law, including for the protection of civilian life, as \nwell as for the promotion of human security, the de-escalation of the situation, the \nexercise of restraint, including from provocative actions and rhetoric, and the \nestablishment of a stable environment conducive to the pursuit of peace, \n \nExpressing grave concern about the continuing systematic violation of the \nhuman rights of the Palestinian people by Israel, the occupying Power, including that \narising from the excessive use of force and military operations causing death and \ninjury to Palestinian civilians, including children, women and non-violent, peaceful \ndemonstrators, as well as journalists, medical personnel and humanitarian personnel; \nthe arbitrary imprisonment and detention of Palestinians, some of whom have been \nimprisoned for decades; the use of collective punishment; the closure of areas; the \nconfiscation of land; the establishment and expansion of settlements; the construction \nof a wall in the Occupied Palestinian Territory in departure from the Armistice Line \nof 1949; the destruction of property and infrastructure; the forced displacement of \ncivilians, including attempts at forced transfers of Bedouin communities; and all other \n__________________ \n \n11  A/69/711-S/2015/1, annex. \n \n12  S/2003/529, annex. \n\nA/RES/74/89 \nIsraeli practices affecting the human rights of the Palestinian people \nin the Occupied Palestinian Territory, including East Jerusalem\n \n19-21902\n4/8 \n \nactions by it designed to change the legal status, geographical nature and demographic \ncomposition of the Occupied Palestinian Territory, including East Jerusalem, and \ndemanding the cessation of all such unlawful actions,  \n \nGravely concerned by the ongoing demolition by Israel, the occupying Power, \nof Palestinian homes, as well as of structures, including schools, provided as \ninternational humanitarian aid, in particular in and around Occupied East Jerusalem, \nincluding if carried out as an act of collective punishment in violation of international \nhumanitarian law, which has escalated at unprecedented rates, and by the revocation \nof residence permits and eviction of Palestinian residents of the City of Jerusalem, \n \nDeploring the continuing and negative consequences of the conflicts in and \naround the Gaza Strip and the high number of causalities among Palestinian civilians \nin the recent period, including among children, and any violations of international \nlaw, and calling for full respect for international humanitarian and human rights law \nand for the principles of legality, distinction, precaution and proportionality,  \n \nGravely concerned about the disastrous humanitarian situation and the critical \nsocioeconomic and security situation in the Gaza Strip, including that resulting from \nthe prolonged closures and severe economic and movement restrictions that in effect \namount to a blockade and deepen poverty and despair among the Palestinian civilian \npopulation, and about the short- and long-term detrimental impacts of this situation \nand the widespread destruction and continued impeding of the reconstruction process \nby Israel, the occupying Power, on the human rights situation,  \n \nRecalling with grave concern the United Nations country team report of August \n2012, entitled \u201cGaza in 2020: a liveable place?\u201d, \n \nRecalling the statement by the President of the Security Council of 28 July 2014, 13 \n \nStressing the need for the full implementation by all parties of Security Council \nresolution 1860 (2009) of 8 January 2009 and General Assembly resolution ES-10/18 \nof 16 January 2009, \n \nStressing also that the situation in the Gaza Strip is unsustainable and that a \ndurable ceasefire agreement must lead to a fundamental improvement in the living \nconditions of the Palestinian people in the Gaza Strip, including through the sustained \nand regular opening of crossing points, and ensure the safety and well-being of \ncivilians on both sides, and regretting the lack of progress made in this regard, \n \nGravely concerned by reports regarding serious human rights violations and \ngrave breaches of international humanitarian law committed during the successive \nmilitary operations in the Gaza Strip, 14  and reiterating the necessity for serious \nfollow-up by all parties of the recommendations addressed to them towards ensuring \naccountability and justice, \n \nStressing the need for protection of human rights defenders engaged in the \npromotion of human rights issues in the Occupied Palestinian Territory, including \nEast Jerusalem, to allow them to carry out their work freely and without fear of attacks \nand harassment, \n \nExpressing deep concern about the Israeli policy of closures and the imposition \nof severe restrictions, including through hundreds of obstacles to movement, \ncheckpoints and a permit regime, all of which obstruct the freedom of movement of \npersons and goods, including medical and humanitarian goods, and the follow-up and \naccess to donor-funded projects of development cooperation and humanitarian \n__________________ \n \n13  S/PRST/2014/13; see Resolutions and Decisions of the Security Council, 1 August 2013\u201331 July \n2014 (S/INF/69). \n \n14  See A/63/855-S/2009/250; S/2015/286, annex; A/HRC/12/48; and A/HRC/29/52. \n\nIsraeli practices affecting the human rights of the Palestinian people \nin the Occupied Palestinian Territory, including East Jerusalem \nA/RES/74/89\n \n5/8\n19-21902 \n \nassistance, throughout the Occupied Palestinian Territory, including East Jerusalem, \nand impair the Territory\u2019s contiguity, consequently violating the human rights of the \nPalestinian people and negatively impacting their socioeconomic and humanitarian \nsituation, which remains dire in the Gaza Strip, and the efforts aimed at rehabilitating \nand developing the Palestinian economy, and calling for the full lifting of restrictions, \n \nExpressing grave concern that thousands of Palestinians, including many \nchildren and women, as well as elected representatives, continue to be held in Israeli \nprisons or detention centres under harsh conditions, including unhygienic conditions, \nsolitary confinement, the extensive use of administrative detention of excessive \nduration without charge and denial of due process, lack of proper medical care and \nwidespread medical neglect, including for prisoners who are ill, with the risk of fatal \nconsequences, and denial of family visits, that impair their well-being, and expressing \ngrave concern also about the ill-treatment and harassment and all reports of torture of \nany Palestinian prisoners, \n \nExpressing deep concern about the hunger strikes by Palestinian prisoners in \nprotest of the harsh conditions of their imprisonment and detention by the occupying \nPower, while taking note of agreements reached on conditions of detention in Israeli \nprisons and calling for their full and immediate implementation, \n \nRecalling the United Nations Standard Minimum Rules for the Treatment of \nPrisoners (the Nelson Mandela Rules) 15  and the United Nations Rules for the \nTreatment of Women Prisoners and Non-custodial Measures for Women Offenders \n(the Bangkok Rules),16 and calling for respect for those Rules, \n \nRecalling also the prohibition under international humanitarian law of the \ndeportation of civilians from occupied territories, \n \nDeploring the practice of withholding the bodies of those killed, and calling for \nthe release of the bodies that have not yet been returned to their relatives, in line with \ninternational humanitarian law and human rights law, in order to ensure dignified \nclosure in accordance with their religious beliefs and traditions, \n \nStressing the need for the prevention of all acts of violence, harassment, \nprovocation and incitement by extremist Israeli settlers and groups of armed settlers, \nespecially against Palestinian civilians, including children, and their properties, \nincluding homes, agricultural lands and historic and religious sites, including in \nOccupied East Jerusalem, and deploring the violation of the human rights of Palestinians \nin this regard, including acts of violence leading to death and injury among civilians, \n \nConvinced of the need for an international presence to monitor the situation, to \ncontribute to ending the violence and protecting the Palestinian civilian population \nand to help the parties to implement the agreements reached, in this regard recalling \nthe importance of the mandate and the positive contribution of the Temporary \nInternational Presence in Hebron, and regretting the unilateral decision by the \nGovernment of Israel not to renew its mandate, \n \nStressing the need for an immediate and complete cessation of all acts of \nviolence, including military attacks, destruction and acts of terror, \n \nStressing also that the protection of civilians is a critical component in ensuring \npeace and security, and stressing further the need for measures to be taken to \nguarantee the safety and protection of the Palestinian civilian population throughout \nthe Occupied Palestinian Territory, consistent with the provisions and obligations of \ninternational humanitarian law,  \n__________________ \n \n15  Resolution 70/175, annex. \n \n16  Resolution 65/229, annex. \n\nA/RES/74/89 \nIsraeli practices affecting the human rights of the Palestinian people \nin the Occupied Palestinian Territory, including East Jerusalem\n \n19-21902\n6/8 \n \n \nStressing further the need to respect the right of peaceful assembly,  \n \nTaking note of the report of the Secretary-General on the protection of the \nPalestinian civilian population 17 and the observations made therein on ways and \nmeans for ensuring the safety, protection and well-being of the Palestinian civilian \npopulation under Israeli occupation, \n \nNoting the continued efforts and tangible progress made in the Palestinian \nsecurity sector, and noting also the continued cooperation that benefits both \nPalestinians and Israelis, in particular by promoting security and building confidence, \n \nUrging the parties to observe calm and restraint and to refrain from provocative \nactions, incitement and inflammatory rhetoric, especially in areas of religious and \ncultural sensitivity, including in East Jerusalem, and to take every possible step to \ndefuse tensions and promote conditions conducive to the credibility and success of \nthe peace negotiations, \n \nEmphasizing the right of all people in the region to the enjoyment of human \nrights as enshrined in the international human rights covenants, \n \n1. \nReiterates that all measures and actions taken by Israel, the occupying \nPower, in the Occupied Palestinian Territory, including East Jerusalem, in violation \nof the relevant provisions of the Geneva Convention relative to the Protection of \nCivilian Persons in Time of War, of 12 August 1949, 10 and contrary to the relevant \nresolutions of the Security Council, are illegal and have no validity; \n \n2. \nDemands that Israel, the occupying Power, cease all measures contrary to \ninternational law, as well as discriminatory legislation, policies and actions in the \nOccupied Palestinian Territory that violate the human rights of the Palestinian people, \nincluding the killing and injury of civilians, the arbitrary detention and imprisonment \nof civilians, the forced displacement of civilians, including attempts at forced \ntransfers of Bedouin communities, the destruction and confiscation of civilian \nproperty, including home demolitions, including if carried out as collective \npunishment in violation of international humanitarian law, and any obstruction of \nhumanitarian assistance, and that it fully respect human rights law and comply with \nits legal obligations in this regard, including in accordance with relevant United \nNations resolutions; \n \n3. \nAlso demands that Israel, the occupying Power, comply fully with the \nprovisions of the Fourth Geneva Convention of 1949 10 and cease immediately all \nmeasures and actions taken in violation and in breach of the Convention; \n \n4. \nCalls for urgent measures to ensure the safety and protection of the \nPalestinian civilian population in the Occupied Palestinian Territory, including East \nJerusalem, in accordance with the relevant provisions of international humanitarian law \nand as called for by the Security Council in its resolution 904 (1994) of 18 March 1994;  \n \n5. \nTakes note of the report of the Secretary-General on the protection of the \nPalestinian civilian population,17 notably the observations made therein, including the \npossible expansion of existing protection mechanisms to prevent and deter violations, \nand calls for continued efforts within the United Nations human rights framework \nregarding the legal protection and safety of the Palestinian civilian population; \n \n6. \nCalls for full cooperation by Israel with the relevant special rapporteurs \nand other relevant mechanisms and inquiries of the Human Rights Council, including \nthe facilitation of entry to the Occupied Palestinian Territory, including East \n__________________ \n \n17  A/ES-10/794. \n\nIsraeli practices affecting the human rights of the Palestinian people \nin the Occupied Palestinian Territory, including East Jerusalem \nA/RES/74/89\n \n7/8\n19-21902 \n \nJerusalem, for monitoring and reporting on the human rights situation therein \naccording to their respective mandates; \n \n7. \nDemands that Israel, the occupying Power, cease all of its settlement \nactivities, the construction of the wall and any other measures aimed at altering the \ncharacter, status and demographic composition of the Occupied Palestinian Territory, \nincluding in and around East Jerusalem, all of which, inter alia, gravely and \ndetrimentally impact the human rights of the Palestinian people, and the prospects for \nachieving without delay an end to the Israeli occupation that began in 1967 and a just, \nlasting and comprehensive peace settlement between the Palestinian and Israeli sides, \nand calls for the full respect and implementation of all relevant General Assembly \nand Security Council resolutions in this regard, including Security Council resolution \n2334 (2016) of 23 December 2016; \n \n8. \nCalls for urgent attention to the plight and the rights, in accordance with \ninternational law, of Palestinian prisoners and detainees in Israeli jails, including \nthose on hunger strike, also calls for efforts between the two sides for the further \nrelease of prisoners and detainees, and further calls for respect for the United Nations \nStandard Minimum Rules for the Treatment of Prisoners (the Nelson Mandela \nRules)15 and the United Nations Rules for the Treatment of Women Prisoners and \nNon-custodial Measures for Women Offenders (the Bangkok Rules);16  \n \n9. \nCondemns all acts of violence, including all acts of terror, provocation, \nincitement and destruction, especially any use of force by the Israeli occupying forces \nagainst Palestinian civilians in violation of international law, particularly in the Gaza \nStrip, including against journalists, medical personnel and humanitarian personnel, \nwhich have caused extensive loss of life and vast numbers of injuries, including \namong children and women; \n \n10. \nAlso condemns all acts of violence by militants and armed groups, including \nthe firing of rockets, against Israeli civilian areas, resulting in loss of life and injury; \n \n11. \nReiterates its demand for the full implementation of Security Council \nresolution 1860 (2009); \n \n12. Demands that Israel, the occupying Power, comply with its legal \nobligations under international law, as mentioned in the advisory opinion rendered on \n9 July 2004 by the International Court of Justice9 and as demanded in General \nAssembly resolutions ES-10/15 of 20 July 2004 and ES-10/13 of 21 October 2003, \nand that it immediately cease the construction of the wall in the Occupied Palestinian \nTerritory, including in and around East Jerusalem, dismantle forthwith the structure \nsituated therein, repeal or render ineffective all legislative and regulatory acts relating \nthereto, and make reparations for all damage caused by the construction of the wall, \nwhich has gravely impacted the human rights and the socioeconomic living conditions \nof the Palestinian people; \n \n13. Reiterates the need for respect for the territorial unity, contiguity and \nintegrity of all of the Occupied Palestinian Territory and for guarantees of the freedom \nof movement of persons and goods within the Palestinian territory, including \nmovement into and from East Jerusalem, into and from the Gaza Strip, between the \nWest Bank and the Gaza Strip, and to and from the outside world; \n \n14. Calls upon Israel, the occupying Power, to cease its imposition of \nprolonged closures and economic and movement restrictions, including those \namounting to a blockade on the Gaza Strip, and in this regard to fully implement the \nAgreement on Movement and Access and the Agreed Principles for the Rafah \nCrossing, both of 15 November 2005, in order to allow for the sustained and regular \nmovement of persons and goods and for the acceleration of long overdue and massive \n\nA/RES/74/89 \nIsraeli practices affecting the human rights of the Palestinian people \nin the Occupied Palestinian Territory, including East Jerusalem\n \n19-21902\n8/8 \n \nreconstruction needs and economic recovery in the Gaza Strip, while noting the \ntripartite agreement facilitated by the United Nations in this regard; \n \n15. Stresses the urgent need to address the continuing health crisis in the Gaza \nStrip, including by ensuring the provision of adequate infrastructure, medical supplies \nand equipment, alongside expertise, to deal with the increasing caseload of injuries \nrequiring complex treatment in the context of the protests in the Gaza Strip; \n \n16. Urges Member States to continue to provide emergency assistance to the \nPalestinian people to alleviate the financial crisis and the dire socioeconomic and \nhumanitarian situation, particularly in the Gaza Strip;  \n \n17. Urges all States and the specialized agencies and organizations of the \nUnited Nations system to continue to support and assist the Palestinian people in the \nearly realization of their inalienable human rights, including their right to \nself-determination, as a matter of urgency, in the light of the passage of more than \n52 years of the Israeli occupation and the continued denial and violation of the human \nrights of the Palestinian people; \n \n18. Emphasizes the need to preserve and develop the Palestinian institutions \nand infrastructure for the provision of vital public services to the Palestinian civilian \npopulation and the promotion of human rights, including civil, political, economic, \nsocial and cultural rights, and urges in this regard the implementation of the \nagreement signed in Cairo on 12 October 2017,18 which would be an important step \ntowards achieving Palestinian unity and lead to the effective functioning of the \nPalestinian Government, including in the Gaza Strip, under the leadership of \nPresident Mahmoud Abbas, consistent with the Palestine Liberation Organization \ncommitments and the Quartet principles; \n \n19. Requests the Secretary-General to report to the General Assembly at its \nseventy-fifth session on the implementation of the present resolution, including with \nregard to the applicability of the Fourth Geneva Convention to the Occupied \nPalestinian Territory, including East Jerusalem, and the other occupied Arab \nterritories. \n \n47th plenary meeting \n13 December 2019 \n \n__________________ \n \n18  S/2017/899, annex. \n",
  "paragraphs": {
    "1": "Reiterates that all measures and actions taken by Israel, the occupying Power, in the Occupied Palestinian Territory, including East Jerusalem, in violation of the relevant provisions of the Geneva Convention relative to the Protection of Civilian Persons in Time of War, of 12 August 1949, 10 and contrary to the relevant resolutions of the Security Council, are illegal and have no validity;",
    "2": "Demands that Israel, the occupying Power, cease all measures contrary to international law, as well as discriminatory legislation, policies and actions in the Occupied Palestinian Territory that violate the human rights of the Palestinian people, including the killing and injury of civilians, the arbitrary detention and imprisonment of civilians, the forced displacement of civilians, including attempts at forced transfers of Bedouin communities, the destruction and confiscation of civilian property, including home demolitions, including if carried out as collective punishment in violation of international humanitarian law, and any obstruction of humanitarian assistance, and that it fully respect human rights law and comply with its legal obligations in this regard, including in accordance with relevant United Nations resolutions;",
    "3": "Also demands that Israel, the occupying Power, comply fully with the provisions of the Fourth Geneva Convention of 1949 10 and cease immediately all measures and actions taken in violation and in breach of the Convention;",
    "4": "Calls for urgent measures to ensure the safety and protection of the Palestinian civilian population in the Occupied Palestinian Territory, including East Jerusalem, in accordance with the relevant provisions of international humanitarian law and as called for by the Security Council in its resolution 904 (1994) of 18 March 1994;",
    "5": "Takes note of the report of the Secretary-General on the protection of the Palestinian civilian population,17 notably the observations made therein, including the possible expansion of existing protection mechanisms to prevent and deter violations, and calls for continued efforts within the United Nations human rights framework regarding the legal protection and safety of the Palestinian civilian population;",
    "6": "Calls for full cooperation by Israel with the relevant special rapporteurs and other relevant mechanisms and inquiries of the Human Rights Council, including the facilitation of entry to the Occupied Palestinian Territory, including East __________________ 17 A/ES-10/794. Israeli practices affecting the human rights of the Palestinian people in the Occupied Palestinian Territory, including East Jerusalem A/RES/74/89 7/8 19-21902 Jerusalem, for monitoring and reporting on the human rights situation therein according to their respective mandates;",
    "7": "Demands that Israel, the occupying Power, cease all of its settlement activities, the construction of the wall and any other measures aimed at altering the character, status and demographic composition of the Occupied Palestinian Territory, including in and around East Jerusalem, all of which, inter alia, gravely and detrimentally impact the human rights of the Palestinian people, and the prospects for achieving without delay an end to the Israeli occupation that began in 1967 and a just, lasting and comprehensive peace settlement between the Palestinian and Israeli sides, and calls for the full respect and implementation of all relevant General Assembly and Security Council resolutions in this regard, including Security Council resolution 2334 (2016) of 23 December 2016;",
    "8": "Calls for urgent attention to the plight and the rights, in accordance with international law, of Palestinian prisoners and detainees in Israeli jails, including those on hunger strike, also calls for efforts between the two sides for the further release of prisoners and detainees, and further calls for respect for the United Nations Standard Minimum Rules for the Treatment of Prisoners (the Nelson Mandela Rules)15 and the United Nations Rules for the Treatment of Women Prisoners and Non-custodial Measures for Women Offenders (the Bangkok Rules);16",
    "9": "Condemns all acts of violence, including all acts of terror, provocation, incitement and destruction, especially any use of force by the Israeli occupying forces against Palestinian civilians in violation of international law, particularly in the Gaza Strip, including against journalists, medical personnel and humanitarian personnel, which have caused extensive loss of life and vast numbers of injuries, including among children and women;",
    "10": "Also condemns all acts of violence by militants and armed groups, including the firing of rockets, against Israeli civilian areas, resulting in loss of life and injury;",
    "11": "Reiterates its demand for the full implementation of Security Council resolution 1860 (2009);",
    "12": "Demands that Israel, the occupying Power, comply with its legal obligations under international law, as mentioned in the advisory opinion rendered on 9 July 2004 by the International Court of Justice9 and as demanded in General Assembly resolutions ES-10/15 of 20 July 2004 and ES-10/13 of 21 October 2003, and that it immediately cease the construction of the wall in the Occupied Palestinian Territory, including in and around East Jerusalem, dismantle forthwith the structure situated therein, repeal or render ineffective all legislative and regulatory acts relating thereto, and make reparations for all damage caused by the construction of the wall, which has gravely impacted the human rights and the socioeconomic living conditions of the Palestinian people;",
    "13": "Reiterates the need for respect for the territorial unity, contiguity and integrity of all of the Occupied Palestinian Territory and for guarantees of the freedom of movement of persons and goods within the Palestinian territory, including movement into and from East Jerusalem, into and from the Gaza Strip, between the West Bank and the Gaza Strip, and to and from the outside world;",
    "14": "Calls upon Israel, the occupying Power, to cease its imposition of prolonged closures and economic and movement restrictions, including those amounting to a blockade on the Gaza Strip, and in this regard to fully implement the Agreement on Movement and Access and the Agreed Principles for the Rafah Crossing, both of 15 November 2005, in order to allow for the sustained and regular movement of persons and goods and for the acceleration of long overdue and massive A/RES/74/89 Israeli practices affecting the human rights of the Palestinian people in the Occupied Palestinian Territory, including East Jerusalem 19-21902 8/8 reconstruction needs and economic recovery in the Gaza Strip, while noting the tripartite agreement facilitated by the United Nations in this regard;",
    "15": "Stresses the urgent need to address the continuing health crisis in the Gaza Strip, including by ensuring the provision of adequate infrastructure, medical supplies and equipment, alongside expertise, to deal with the increasing caseload of injuries requiring complex treatment in the context of the protests in the Gaza Strip;",
    "16": "Urges Member States to continue to provide emergency assistance to the Palestinian people to alleviate the financial crisis and the dire socioeconomic and humanitarian situation, particularly in the Gaza Strip;",
    "17": "Urges all States and the specialized agencies and organizations of the United Nations system to continue to support and assist the Palestinian people in the early realization of their inalienable human rights, including their right to self-determination, as a matter of urgency, in the light of the passage of more than 52 years of the Israeli occupation and the continued denial and violation of the human rights of the Palestinian people;",
    "18": "Emphasizes the need to preserve and develop the Palestinian institutions and infrastructure for the provision of vital public services to the Palestinian civilian population and the promotion of human rights, including civil, political, economic, social and cultural rights, and urges in this regard the implementation of the agreement signed in Cairo on 12 October 2017,18 which would be an important step towards achieving Palestinian unity and lead to the effective functioning of the Palestinian Government, including in the Gaza Strip, under the leadership of President Mahmoud Abbas, consistent with the Palestine Liberation Organization commitments and the Quartet principles;",
    "19": "Requests the Secretary-General to report to the General Assembly at its seventy-fifth session on the implementation of the present resolution, including with regard to the applicability of the Fourth Geneva Convention to the Occupied Palestinian Territory, including East Jerusalem, and the other occupied Arab territories. 47th plenary meeting 13 December 2019 __________________ 18 S/2017/899, annex."
  },
  "agenda_items": [
    "Item 51"
  ],
  "symbol_references": []
}