{
  "symbol": "A/RES/74/220",
  "filename": "A_RES_74_220.pdf",
  "title": "74/220. Implementation of the United Nations Convention to Combat Desertification in Those Countries Experiencing Serious Drought and/or Desertification, Particularly in Africa",
  "text": "United Nations \nA/RES/74/220\n \n \nGeneral Assembly \nDistr.: General \n17 January 2020 \n \n19-22489 (E)    240120 \n*1922489* \n \n \nSeventy-fourth session \nAgenda item 19 (e) \nSustainable development: implementation of the United \nNations Convention to Combat Desertification in Those \nCountries Experiencing Serious Drought and/or \nDesertification, Particularly in Africa \n \n \n \n \n Resolution adopted by the General Assembly \non 19 December 2019 \n \n \n \n \n[on the report of the Second Committee (A/74/381/Add.5)] \n \n \n 74/220. Implementation of the United Nations Convention to Combat \nDesertification in Those Countries Experiencing Serious \nDrought and/or Desertification, Particularly in Africa \n \n \n \nThe General Assembly, \n \nRecalling its resolution 73/233 of 20 December 2018, as well as other \nresolutions relating to the implementation of the United Nations Convention to \nCombat Desertification in Those Countries Experiencing Serious Drought and/or \nDesertification, Particularly in Africa,1 \n \nReaffirming its resolution 70/1 of 25 September 2015, entitled \u201cTransforming \nour world: the 2030 Agenda for Sustainable Development\u201d, in which it adopted a \ncomprehensive, far-reaching and people-centred set of universal and transformative \nSustainable Development Goals and targets, its commitment to working tirelessly for \nthe full implementation of the Agenda by 2030, its recognition that eradicating \npoverty in all its forms and dimensions, including extreme poverty, is the greatest \nglobal challenge and an indispensable requirement for sustainable development, and \nits commitment to achieving sustainable development in its three dimensions \u2013 \neconomic, social and environmental \u2013 in a balanced and integrated manner and to \nbuilding upon the achievements of the Millennium Development Goals and seeking \nto address their unfinished business, \n \nRecalling that, in the 2030 Agenda for Sustainable Development, the \ninternational community committed to combating desertification, restoring degraded \n__________________ \n \n1  United Nations, Treaty Series, vol. 1954, No. 33480. \n\nA/RES/74/220 \nImplementation of the United Nations Convention to Combat \nDesertification in Those Countries Experiencing Serious \nDrought and/or Desertification, Particularly in Africa\n \n19-22489\n2/7 \n \nland and soil, including land affected by desertification, drought and floods, and \nstriving to achieve a land degradation-neutral world by 2030,  \n \nReaffirming its resolution 69/313 of 27 July 2015 on the Addis Ababa Action \nAgenda of the Third International Conference on Financing for Development, which \nis an integral part of the 2030 Agenda for Sustainable Development, supports and \ncomplements it, helps to contextualize its means of implementation targets with \nconcrete policies and actions, and reaffirms the strong political commitment to \naddress the challenge of financing and creating an enabling environment at all levels \nfor sustainable development in the spirit of global partnership and solidarity, \n \nNoting that in its decision 3/COP.14, 2 the Conference of the Parties to the \nConvention invited parties that have committed to voluntary land degradation \nneutrality targets to implement measures to accelerate the achievement thereof, by, \ninter alia, creating an enabling environment for the achievement of land degradation \nneutrality, including the responsible governance of land and tenure security, the \nengagement of stakeholders and the improved access of smallholders to advisory and \nfinancial services,  \n \nNoting also that combating desertification, land degradation and drought, \nincluding through the sustainable management of natural resources, can contribute to \nsustainable development for all and to easing displacement flows, \n \nBearing in mind its resolution 62/195 of 19 December 2007, in which it declared \nthe decade 2010\u20132020 as the United Nations Decade for Deserts and the Fight against \nDesertification, and its resolution 64/201 of 21 December 2009, in which it designated \nthe secretariat of the United Nations Convention to Combat Desertification in Those \nCountries Experiencing Serious Drought and/or Desertification, Particularly in \nAfrica, as the focal point of the Decade, and invited States parties to the Convention, \nobservers and other relevant stakeholders to organize activities to observe the Decade, \n \nBearing in mind also its resolution 73/284 of 1 March 2019, in which it declared \nthe decade 2021\u20132030 as the United Nations Decade on Ecosystem Restoration, \n \nRecalling the adoption of the 2018\u20132030 Strategic Framework of the \nConvention,3 including a new strategic objective on drought, \n \nReaffirming the Paris Agreement4 and its early entry into force, encouraging all \nits parties to fully implement the Agreement, and parties to the United Nations \nFramework Convention on Climate Change5 that have not yet done so to deposit their \ninstruments of ratification, acceptance, approval or accession, where appropriate, as \nsoon as possible, \n \nRecognizing that climate change, unsustainable agricultural and forestry \npractices and land degradation, inter alia, are major and growing drivers of \nbiodiversity loss and ecosystem degradation, and that conservation, restoration and \nthe sustainable use of biodiversity, and ecosystem functions and services, including \nthrough nature-based solutions, contribute significantly to land degradation \nneutrality, climate change adaptation and mitigation, disaster risk reduction and food \nsecurity and nutrition, \n \nNoting with concern the findings of the Intergovernmental Science-Policy \nPlatform on Biodiversity and Ecosystem Services land degradation and restoration \nassessment and its Global Assessment Report on Biodiversity and Ecosystem Services, \nthe findings of the Intergovernmental Panel on Climate Change contained in its \n__________________ \n \n2  See ICCD/COP(14)/23/Add.1. \n \n3  ICCD/COP(13)/21/Add.1, decision 7/COP.13, annex. \n \n4  Adopted under the UNFCCC in FCCC/CP/2015/10/Add.1, decision 1/CP.21. \n \n5  United Nations, Treaty Series, vol. 1771, No. 30822. \n\nImplementation of the United Nations Convention to Combat \nDesertification in Those Countries Experiencing Serious \nDrought and/or Desertification, Particularly in Africa \nA/RES/74/220\n \n3/7\n19-22489 \n \nspecial report on climate change, desertification, land degradation, sustainable land \nmanagement, food security, and greenhouse gas fluxes in terrestrial ecosystems, as \nwell as the findings contained in the special report of the Panel entitled Global \nWarming of 1.5\u00b0C, \n \nDeeply concerned about the continuous trend in land degradation and the fact \nthat the impacts of desertification, land degradation and drought are felt most strongly \nby people in vulnerable situations, \n \nRecalling the United Nations strategic plan for forests 2017\u20132030, 6  and \nacknowledging that all types of forests provide essential ecosystem services, such as \ntimber, food, fuel, fodder, non-wood products and shelter, as well as soil and water \nconservation and clean air, that the sustainable management of forests and trees \noutside forests is vital to the integrated implementation of the 2030 Agenda for \nSustainable Development and that forests prevent land degradation and \ndesertification and reduce the risk of floods, soil erosion, landslides and avalanches, \ndroughts, sand and dust storms and other disasters, \n \nExpressing its appreciation to the Government of India for hosting the \nfourteenth session of the Conference of the Parties to the United Nations \nConvention to Combat Desertification in Those Countries Experiencing Serious \nDrought and/or Desertification, Particularly in Africa, held in New Delhi from 2 to \n13 September 2019, \n \nNoting the establishment of an intergovernmental working group on effective \npolicy and implementation measures for addressing drought under the Convention, \nwith a view to presenting its findings and recommendations to the parties for their \nconsideration at the fifteenth session of the Conference of the Parties to the \nConvention, \n \nReaffirming the importance of government leadership, multi-stakeholder \npartnerships and increasing private engagement for the sustainable management, \nrestoration and rehabilitation of ecosystems, biodiversity and land, \n \nHighlighting the importance of multi-stakeholder participation at the local, \nsubnational, national and regional levels and from all sectors of society, including \ncivil society organizations, local government and the private sector, as appropriate, in \nthe implementation of the Convention and its 2018\u20132030 Strategic Framework, \n \nRecognizing the value of knowledge, education, science and new technology to \nsustainable land management, including making use of, inter alia, the Voluntary \nGuidelines for Sustainable Soil Management of the Food and Agriculture \nOrganization of the United Nations, emphasizing the importance of science-based \ndecision-making and that science and technology to combat desertification, land \ndegradation and drought should therefore be further promoted, and acknowledging \nthe work of the Science-Policy Interface of the Convention, \n \n1. \nTakes note of the report of the Secretary-General on the implementation of \nresolution 73/233 on the United Nations Convention to Combat Desertification in \nThose Countries Experiencing Serious Drought and/or Desertification, Particularly in \nAfrica;7 \n \n2. \nWelcomes the outcomes of the fourteenth session of the Conference of the \nParties to the United Nations Convention to Combat Desertification in Those \nCountries Experiencing Serious Drought and/or Desertification, Particularly in \nAfrica,2 and stresses the importance of their effective implementation; \n__________________ \n \n6  See resolution 71/285. \n \n7  A/74/207, sect. II. \n\nA/RES/74/220 \nImplementation of the United Nations Convention to Combat \nDesertification in Those Countries Experiencing Serious \nDrought and/or Desertification, Particularly in Africa\n \n19-22489\n4/7 \n \n \n3. \nAlso welcomes the New Delhi Declaration: Investing in Land and \nUnlocking Opportunities;8 \n \n4. \nInvites Member States to support efforts to implement the strategic \nobjectives of the United Nations Convention to Combat Desertification in Those \nCountries Experiencing Serious Drought and/or Desertification, Particularly in \nAfrica;1 \n \n5. \nStrongly encourages the parties to the Convention to apply and align with \nthe 2018\u20132030 Strategic Framework of the Convention3 in their national policies, \nprogrammes, plans and processes relating to desertification, land degradation and \ndrought, and to implement the Strategic Framework, taking into account the Addis \nAbaba Action Agenda of the Third International Conference on Financing for \nDevelopment;9 \n \n6. \nReaffirms that achieving land degradation neutrality has the potential to \nact as an accelerator and integrator for achieving the Sustainable Development Goals \nand as a catalyst for attracting sustainable development financing and climate finance \nto implement the Convention, and respond to the overall objectives of the \n2030 Agenda for Sustainable Development;10 \n \n7. \nReiterates the need to combat desertification, restore degraded land and \nsoil, including land affected by desertification, drought and floods, and strive to \nachieve a land degradation-neutral world, and takes note with appreciation of the \nvoluntary land degradation neutrality target-setting programme under the Convention \nand the work of the secretariat of the Convention and partners to assist parties to the \nConvention in carrying out voluntary target-setting activities, and in this respect invites \nparties to the Convention that have not yet subscribed to the programme to do so; \n \n8. \nRecognizes that land-based solutions, as part of nature-based solutions, \nconstitute promising options to evaluate and consider in connection with sequestering \ncarbon and enhancing the resilience of people and ecosystems affected by \ndesertification, land degradation and drought, as well as the adverse effects of climate \nchange; \n \n9. \nAlso recognizes the importance of applying new and innovative \ntechnologies and enabling policies and approaches, as well as sharing best practices, \nin combating desertification, land degradation and drought, and requests the \nSecretary-General to continue to identify, as appropriate, those technologies, enabling \npolicies and best practices in his report on the implementation of the present \nresolution;  \n \n10. Encourages the entities of the United Nations system, when designing and \nimplementing their programmes and projects, to take into account the role of land \ndegradation neutrality as a potential accelerator to achieve the Sustainable \nDevelopment Goals; \n \n11. \nUnderlines the importance of comprehensive reporting, follow-up and \nreview at the global, national and regional levels, as appropriate, in order to track \nprogress in the implementation of the Convention; \n \n12. Reiterates the invitation to parties to the Convention to take measures to \nensure, as appropriate, that their relevant institutions integrate drought risk \nmanagement, climate information and climate change impact assessments into \nrelevant policymaking processes and initiatives;  \n__________________ \n \n8  ICCD/COP(14)/23/Add.1, decision 27/COP.14, annex I. \n \n9  Resolution 69/313, annex. \n \n10  Resolution 70/1. \n\nImplementation of the United Nations Convention to Combat \nDesertification in Those Countries Experiencing Serious \nDrought and/or Desertification, Particularly in Africa \nA/RES/74/220\n \n5/7\n19-22489 \n \n \n13. Invites the parties to the Convention to provide the new Executive \nSecretary of the Convention with full support in the fulfilment of his mandate and in \npromoting the implementation of the Convention;  \n \n14. Stresses the urgent need to enhance adaptive capacity, strengthen \nresilience and reduce vulnerability to climate change and extreme weather events, and \nin this regard urges Member States to continue to engage in adaptation planning \nprocesses and to enhance cooperation in disaster risk reduction; \n \n15. Invites the United Nations Coalition on Combating Sand and Dust Storms, \nwhich was formed at the twenty-fourth meeting of the senior officials of the \nEnvironment Management Group in September 2018, and other relevant United \nNations entities to continue their collaboration to assist affected country parties in \ndeveloping and implementing national and regional policies on sand and dust storms; \n \n16. Recognizes that gender equality and the empowerment of women and girls \nremains a crucial contribution to the effective implementation of the Convention, \nincluding its 2018\u20132030 Strategic Framework, and to the achievement of the Goals \nof the 2030 Agenda for Sustainable Development, stresses the importance of parties \nto the Convention and partners pursuing the equal participation of women and men in \nplanning, decision-making and implementation at all levels and further promoting \ngender equality and the empowerment of all women and girls in desertification, land \ndegradation and drought-related policies and activities, and stresses the importance \nof effective implementation of the four priority thematic areas of the Gender Action \nPlan adopted by the parties to the Convention; \n \n17. Reiterates the invitation to the secretariat and the Global Mechanism of \nthe Convention to continue to collaborate and build partnerships with the secretariats \nof the other Rio conventions, the United Nations Entity for Gender Equality and the \nEmpowerment of Women (UN-Women), other United Nations entities, international \norganizations and other relevant organizations to explore further ways of \nstrengthening awareness-raising, improving the Gender Action Plan and developing \nfurther tools and guidelines for the use of parties in the thematic areas of the Gender \nAction Plan and the gender-responsive implementation of the Convention; \n \n18. Recalls the invitation to parties to the Convention to legally recognize \nrights to equal use and ownership of land for women and the enhancement of women\u2019s \nequal access to land and land tenure security, as well as the promotion of gender-\nsensitive measures to combat desertification, land degradation and drought and \nachieve land degradation neutrality, taking into account the national context; \n \n19. Encourages parties to the Convention to follow the principles of \nimplementation of the Voluntary Guidelines on the Responsible Governance of \nTenure of Land, Fisheries and Forests in the Context of National Food Security 11 in \nthe implementation of activities to combat desertification, land degradation and \ndrought; \n \n20. Encourages the public and private sectors to continue to invest in \ndeveloping, adapting and scaling up the application of technologies, enabling \npolicies, methods and tools to combat desertification, land degradation and drought \nin different regions, and to boost knowledge exchange, including of traditional \nknowledge with the consent of the knowledge holders, capacity-building and sharing \nof technologies on mutually agreed terms; \n__________________ \n \n11  Food and Agriculture Organization of the United Nations, document CL 144/9 (C 2013/20), \nappendix D. \n\nA/RES/74/220 \nImplementation of the United Nations Convention to Combat \nDesertification in Those Countries Experiencing Serious \nDrought and/or Desertification, Particularly in Africa\n \n19-22489\n6/7 \n \n \n21. Encourages parties to the Convention to continue to promote the \nprevention of desertification, land degradation and drought with an integrated \nlandscape approach, including the rehabilitation and restoration of degraded land and \nsustainable land management; \n \n22. Encourages developed countries party to the Convention and other \nrelevant stakeholders to actively support the efforts of developing countries party to \nthe Convention in promoting sustainable land management practices and in seeking \nto achieve a land degradation-neutral world by providing substantial financial \nresources, from all sources, facilitated access to appropriate technology on mutually \nagreed terms and other forms of support, including through capacity-building \nmeasures;  \n \n23. Recognizes the benefits gained from cooperation through the sharing of \nclimate and weather information, forecasting and early warning systems related to \ndesertification, land degradation and drought, while also taking account of sand and \ndust storms, at the global, regional and subregional levels, and in this regard likewise \nrecognizes the need for further cooperation between parties to the Convention and \nrelevant organizations in the sharing of related information, forecasting and early \nwarning systems; \n \n24. Encourages all relevant entities of the United Nations system within their \nrespective mandates to harness opportunities for leveraging synergies among the \nConvention on Biological Diversity, 12 the United Nations Convention to Combat \nDesertification in Those Countries Experiencing Serious Drought and/or \nDesertification, Particularly in Africa, and the United Nations Framework Convention \non Climate Change5 and other relevant multilateral environmental agreements, as well \nas the 2030 Agenda for Sustainable Development, and in this respect welcomes the \nongoing efforts to strengthen synergies among the secretariats of the aforementioned \nconventions; \n \n25. Invites the President of the General Assembly, with the support of the \nExecutive Secretary of the United Nations Convention to Combat Desertification in \nThose Countries Experiencing Serious Drought and/or Desertification, Particularly in \nAfrica, to organize, during the seventy-fourth session of the Assembly, a high-level \ndialogue to assess the progress made in the fight against desertification, land \ndegradation and drought and to map the way forward, in the light of the United \nNations Decade for Deserts and the Fight against Desertification, which is coming to \nan end in 2020; \n \n26. Notes with appreciation the financial contributions that have been made \nby Member States and other donors towards the Land Degradation Neutrality Fund, \nand invites Member States and other donors to make further contributions to the Land \nDegradation Neutrality Fund and the Convention\u2019s drought initiative; \n \n27. Decides to include, in the United Nations calendar of conferences and \nmeetings for the year 2020 and subsequent years, the sessions of the Conference of \nthe Parties to the Convention and each of its subsidiary bodies, and requests the \nSecretary-General to continue to make provisions for those sessions in the proposed \nprogramme budgets; \n \n28. Requests the Secretary-General to submit to the General Assembly at its \nseventy-fifth session a report on the implementation of the present resolution, and \ndecides to include in the provisional agenda of its seventy-fifth session, under the \nitem entitled \u201cSustainable development\u201d, the sub-item entitled \u201cImplementation of \n__________________ \n \n12  United Nations, Treaty Series, vol. 1760, No. 30619. \n\nImplementation of the United Nations Convention to Combat \nDesertification in Those Countries Experiencing Serious \nDrought and/or Desertification, Particularly in Africa \nA/RES/74/220\n \n7/7\n19-22489 \n \nthe United Nations Convention to Combat Desertification in Those Countries \nExperiencing Serious Drought and/or Desertification, Particularly in Africa\u201d. \n \n52nd plenary meeting \n19 December 2019 \n \n",
  "paragraphs": {
    "1": "Takes note of the report of the Secretary-General on the implementation of resolution 73/233 on the United Nations Convention to Combat Desertification in Those Countries Experiencing Serious Drought and/or Desertification, Particularly in Africa;7",
    "2": "Welcomes the outcomes of the fourteenth session of the Conference of the Parties to the United Nations Convention to Combat Desertification in Those Countries Experiencing Serious Drought and/or Desertification, Particularly in Africa,2 and stresses the importance of their effective implementation; __________________ 6 See resolution 71/285. 7 A/74/207, sect. II. A/RES/74/220 Implementation of the United Nations Convention to Combat Desertification in Those Countries Experiencing Serious Drought and/or Desertification, Particularly in Africa 19-22489 4/7",
    "3": "Also welcomes the New Delhi Declaration: Investing in Land and Unlocking Opportunities;8",
    "4": "Invites Member States to support efforts to implement the strategic objectives of the United Nations Convention to Combat Desertification in Those Countries Experiencing Serious Drought and/or Desertification, Particularly in Africa;1",
    "5": "Strongly encourages the parties to the Convention to apply and align with the 2018\u20132030 Strategic Framework of the Convention3 in their national policies, programmes, plans and processes relating to desertification, land degradation and drought, and to implement the Strategic Framework, taking into account the Addis Ababa Action Agenda of the Third International Conference on Financing for Development;9",
    "6": "Reaffirms that achieving land degradation neutrality has the potential to act as an accelerator and integrator for achieving the Sustainable Development Goals and as a catalyst for attracting sustainable development financing and climate finance to implement the Convention, and respond to the overall objectives of the 2030 Agenda for Sustainable Development;10",
    "7": "Reiterates the need to combat desertification, restore degraded land and soil, including land affected by desertification, drought and floods, and strive to achieve a land degradation-neutral world, and takes note with appreciation of the voluntary land degradation neutrality target-setting programme under the Convention and the work of the secretariat of the Convention and partners to assist parties to the Convention in carrying out voluntary target-setting activities, and in this respect invites parties to the Convention that have not yet subscribed to the programme to do so;",
    "8": "Recognizes that land-based solutions, as part of nature-based solutions, constitute promising options to evaluate and consider in connection with sequestering carbon and enhancing the resilience of people and ecosystems affected by desertification, land degradation and drought, as well as the adverse effects of climate change;",
    "9": "Also recognizes the importance of applying new and innovative technologies and enabling policies and approaches, as well as sharing best practices, in combating desertification, land degradation and drought, and requests the Secretary-General to continue to identify, as appropriate, those technologies, enabling policies and best practices in his report on the implementation of the present resolution;",
    "10": "Encourages the entities of the United Nations system, when designing and implementing their programmes and projects, to take into account the role of land degradation neutrality as a potential accelerator to achieve the Sustainable Development Goals;",
    "11": "Underlines the importance of comprehensive reporting, follow-up and review at the global, national and regional levels, as appropriate, in order to track progress in the implementation of the Convention;",
    "12": "Reiterates the invitation to parties to the Convention to take measures to ensure, as appropriate, that their relevant institutions integrate drought risk management, climate information and climate change impact assessments into relevant policymaking processes and initiatives; __________________ 8 ICCD/COP(14)/23/Add.1, decision 27/COP.14, annex I. 9 Resolution 69/313, annex. 10 Resolution 70/1. Implementation of the United Nations Convention to Combat Desertification in Those Countries Experiencing Serious Drought and/or Desertification, Particularly in Africa A/RES/74/220 5/7 19-22489",
    "13": "Invites the parties to the Convention to provide the new Executive Secretary of the Convention with full support in the fulfilment of his mandate and in promoting the implementation of the Convention;",
    "14": "Stresses the urgent need to enhance adaptive capacity, strengthen resilience and reduce vulnerability to climate change and extreme weather events, and in this regard urges Member States to continue to engage in adaptation planning processes and to enhance cooperation in disaster risk reduction;",
    "15": "Invites the United Nations Coalition on Combating Sand and Dust Storms, which was formed at the twenty-fourth meeting of the senior officials of the Environment Management Group in September 2018, and other relevant United Nations entities to continue their collaboration to assist affected country parties in developing and implementing national and regional policies on sand and dust storms;",
    "16": "Recognizes that gender equality and the empowerment of women and girls remains a crucial contribution to the effective implementation of the Convention, including its 2018\u20132030 Strategic Framework, and to the achievement of the Goals of the 2030 Agenda for Sustainable Development, stresses the importance of parties to the Convention and partners pursuing the equal participation of women and men in planning, decision-making and implementation at all levels and further promoting gender equality and the empowerment of all women and girls in desertification, land degradation and drought-related policies and activities, and stresses the importance of effective implementation of the four priority thematic areas of the Gender Action Plan adopted by the parties to the Convention;",
    "17": "Reiterates the invitation to the secretariat and the Global Mechanism of the Convention to continue to collaborate and build partnerships with the secretariats of the other Rio conventions, the United Nations Entity for Gender Equality and the Empowerment of Women (UN-Women), other United Nations entities, international organizations and other relevant organizations to explore further ways of strengthening awareness-raising, improving the Gender Action Plan and developing further tools and guidelines for the use of parties in the thematic areas of the Gender Action Plan and the gender-responsive implementation of the Convention;",
    "18": "Recalls the invitation to parties to the Convention to legally recognize rights to equal use and ownership of land for women and the enhancement of women\u2019s equal access to land and land tenure security, as well as the promotion of gender- sensitive measures to combat desertification, land degradation and drought and achieve land degradation neutrality, taking into account the national context;",
    "19": "Encourages parties to the Convention to follow the principles of implementation of the Voluntary Guidelines on the Responsible Governance of Tenure of Land, Fisheries and Forests in the Context of National Food Security 11 in the implementation of activities to combat desertification, land degradation and drought;",
    "20": "Encourages the public and private sectors to continue to invest in developing, adapting and scaling up the application of technologies, enabling policies, methods and tools to combat desertification, land degradation and drought in different regions, and to boost knowledge exchange, including of traditional knowledge with the consent of the knowledge holders, capacity-building and sharing of technologies on mutually agreed terms; __________________ 11 Food and Agriculture Organization of the United Nations, document CL 144/9 (C 2013/20), appendix D. A/RES/74/220 Implementation of the United Nations Convention to Combat Desertification in Those Countries Experiencing Serious Drought and/or Desertification, Particularly in Africa 19-22489 6/7",
    "21": "Encourages parties to the Convention to continue to promote the prevention of desertification, land degradation and drought with an integrated landscape approach, including the rehabilitation and restoration of degraded land and sustainable land management;",
    "22": "Encourages developed countries party to the Convention and other relevant stakeholders to actively support the efforts of developing countries party to the Convention in promoting sustainable land management practices and in seeking to achieve a land degradation-neutral world by providing substantial financial resources, from all sources, facilitated access to appropriate technology on mutually agreed terms and other forms of support, including through capacity-building measures;",
    "23": "Recognizes the benefits gained from cooperation through the sharing of climate and weather information, forecasting and early warning systems related to desertification, land degradation and drought, while also taking account of sand and dust storms, at the global, regional and subregional levels, and in this regard likewise recognizes the need for further cooperation between parties to the Convention and relevant organizations in the sharing of related information, forecasting and early warning systems;",
    "24": "Encourages all relevant entities of the United Nations system within their respective mandates to harness opportunities for leveraging synergies among the Convention on Biological Diversity, 12 the United Nations Convention to Combat Desertification in Those Countries Experiencing Serious Drought and/or Desertification, Particularly in Africa, and the United Nations Framework Convention on Climate Change5 and other relevant multilateral environmental agreements, as well as the 2030 Agenda for Sustainable Development, and in this respect welcomes the ongoing efforts to strengthen synergies among the secretariats of the aforementioned conventions;",
    "25": "Invites the President of the General Assembly, with the support of the Executive Secretary of the United Nations Convention to Combat Desertification in Those Countries Experiencing Serious Drought and/or Desertification, Particularly in Africa, to organize, during the seventy-fourth session of the Assembly, a high-level dialogue to assess the progress made in the fight against desertification, land degradation and drought and to map the way forward, in the light of the United Nations Decade for Deserts and the Fight against Desertification, which is coming to an end in 2020;",
    "26": "Notes with appreciation the financial contributions that have been made by Member States and other donors towards the Land Degradation Neutrality Fund, and invites Member States and other donors to make further contributions to the Land Degradation Neutrality Fund and the Convention\u2019s drought initiative;",
    "27": "Decides to include, in the United Nations calendar of conferences and meetings for the year 2020 and subsequent years, the sessions of the Conference of the Parties to the Convention and each of its subsidiary bodies, and requests the Secretary-General to continue to make provisions for those sessions in the proposed programme budgets;",
    "28": "Requests the Secretary-General to submit to the General Assembly at its seventy-fifth session a report on the implementation of the present resolution, and decides to include in the provisional agenda of its seventy-fifth session, under the item entitled \u201cSustainable development\u201d, the sub-item entitled \u201cImplementation of __________________ 12 United Nations, Treaty Series, vol. 1760, No. 30619. Implementation of the United Nations Convention to Combat Desertification in Those Countries Experiencing Serious Drought and/or Desertification, Particularly in Africa A/RES/74/220 7/7 19-22489 the United Nations Convention to Combat Desertification in Those Countries Experiencing Serious Drought and/or Desertification, Particularly in Africa\u201d. 52nd plenary meeting 19 December 2019"
  },
  "agenda_items": [
    "Item 19"
  ],
  "symbol_references": []
}