{
  "symbol": "A/RES/74/207",
  "filename": "A_RES_74_207.pdf",
  "title": "74/207. Follow-up to and implementation of the outcomes of the International Conferences on Financing for Development",
  "text": "United Nations \nA/RES/74/207\n \n \nGeneral Assembly \nDistr.: General \n23 January 2020 \n \n19-22420 (E)    270120 \n*1922420* \n \n \nSeventy-fourth session \nAgenda item 18 \nFollow-up to and implementation of the outcomes of the \nInternational Conferences on Financing for Development \n \n \n \n \n Resolution adopted by the General Assembly \non 19 December 2019 \n \n \n \n \n[on the report of the Second Committee (A/74/380)] \n \n \n 74/207. Follow-up to and implementation of the outcomes of the \nInternational Conferences on Financing for Development \n \n \n \nThe General Assembly, \n \nRecalling its resolutions 70/192 of 22 December 2015, 71/217 of 21 December \n2016, 72/208 of 20 December 2017 and 73/223 of 20 December 2018 on the follow-up \nto and implementation of the outcomes of the International Conferences on Financing \nfor Development and its resolution 70/299 of 29 July 2016 on the follow-up and \nreview of the 2030 Agenda for Sustainable Development at the global level, \n \nReaffirming its resolution 69/313 of 27 July 2015 on the Addis Ababa Action \nAgenda of the Third International Conference on Financing for Development, which \nis an integral part of the 2030 Agenda for Sustainable Development, 1 supports and \ncomplements it, helps to contextualize its means of implementation targets with \nconcrete policies and actions, and reaffirms the strong political commitment to \naddress the challenge of financing and creating an enabling environment at all levels \nfor sustainable development in the spirit of global partnership and solidarity, \n \nRecalling the International Conference on Financing for Development, held in \nMonterrey, Mexico, from 18 to 22 March 2002, the Follow-up International \nConference on Financing for Development to Review the Implementation of the \nMonterrey Consensus, held in Doha from 29 November to 2 December 2008, and the \nthird International Conference on Financing for Development, held in Addis Ababa \nfrom 13 to 16 July 2015, \n \nReaffirming its resolution 70/1 of 25 September 2015, entitled \u201cTransforming \nour world: the 2030 Agenda for Sustainable Development\u201d, in which it adopted a \ncomprehensive, far-reaching and people-centred set of universal and transformative \n__________________ \n \n1  Resolution 70/1. \n\nA/RES/74/207 \nFollow-up to and implementation of the outcomes of the \nInternational Conferences on Financing for Development\n \n19-22420\n2/5 \n \nSustainable Development Goals and targets, its commitment to working tirelessly for \nthe full implementation of the Agenda by 2030, its recognition that eradicating \npoverty in all its forms and dimensions, including extreme poverty, is the greatest \nglobal challenge and an indispensable requirement for sustainable development, its \ncommitment to achieving sustainable development in its three dimensions \u2013 \neconomic, social and environmental \u2013 in a balanced and integrated manner, and to \nbuilding upon the achievements of the Millennium Development Goals and seeking \nto address their unfinished business, \n \nReaffirming also the Paris Agreement 2  and its early entry into force, \nencouraging all its parties to fully implement the Agreement, and parties to the United \nNations Framework Convention on Climate Change 3 that have not yet done so to \ndeposit their instruments of ratification, acceptance, approval or accession, where \nappropriate, as soon as possible, \n \nReiterating the affirmation in the Addis Ababa Action Agenda that achieving \ngender equality, empowering all women and girls and attaining the full realization of \ntheir human rights are essential to achieving sustained, inclusive and equitable \neconomic growth and sustainable development, \n \nReaffirming the importance of addressing the diverse needs of and challenges \nfaced by countries in special situations, in particular African countries, the least \ndeveloped countries, landlocked developing countries and small island developing \nStates and countries in conflict and post-conflict situations, as well as the specific \nchallenges faced by middle-income countries, \n \nTaking note of the holding of preparatory meetings for the Economic and Social \nCouncil forum on financing for development follow-up, such as the annual retreat of \nthe Group of Friends of Monterrey, \n \nWelcoming the convening of the fourth annual Economic and Social Council \nforum on financing for development follow-up from 15 to 18 April 2019, \n \nRecalling the intergovernmentally agreed conclusions and recommendations of \nthe forum, 4 which decided that the fifth Economic and Social Council forum on \nfinancing for development follow-up would convene from 20 to 23 April 2020 and \nwould include the special high-level meeting of the Council with the Bretton Woods \ninstitutions, the World Trade Organization and the United Nations Conference on \nTrade and Development and also that the 2020 forum would consider and report in its \noutcome document on the need to hold a follow-up conference, \n \nRecalling also Economic and Social Council decision 2017/206 of 5 October 2016, \n \nNoting the sixth biennial high-level meeting of the Development Cooperation \nForum, held in New York on 21 and 22 May 2018, and its outcomes, 5 \n \nWelcoming the High-level Dialogue on Financing for Development held on \n26 September 2019, back-to-back with the high-level political forum on sustainable \ndevelopment under the auspices of the General Assembly, \n \nTaking note of the establishment by the Secretary-General of the Global \nInvestors for Sustainable Development Alliance and the publication of the road map \nfor financing the 2030 Agenda for Sustainable Development, and looking forward to \nfurther updates on the implementation of the strategy of the Secretary-General for \nfinancing the 2030 Agenda for Sustainable Development (2018\u20132021), \n__________________ \n \n2 Adopted under the UNFCCC in FCCC/CP/2015/10/Add.1, decision 1/CP.21. \n \n3 United Nations, Treaty Series, vol. 1771, No. 30822. \n \n4 See E/FFDF/2019/3. \n \n5 See E/2018/73. \n\nFollow-up to and implementation of the outcomes of the \nInternational Conferences on Financing for Development \nA/RES/74/207\n \n3/5\n19-22420 \n \n \nWelcoming the outcome document of the second High-level United Nations \nConference on South-South Cooperation, held in Buenos Aires from 20 to \n22 March 2019,6 \n \nReiterating the pledge that no one will be left behind, reaffirming the \nrecognition that the dignity of the human person is fundamental, and the wish to see \nthe Goals and targets met for all nations and peoples and for all segments of society, \nand recommitting to endeavour to reach the furthest behind first, \n \nRecommitting to ensuring that no country or person is left behind and to focusing \nour effort where the challenges are greatest, including by ensuring the inclusion and \nparticipation of those who are furthest behind, \n \n1. \nTakes note of the report of the Secretary-General;7 \n \n2. \nEmphasizes the need to work towards the full and timely implementation \nof the Addis Ababa Action Agenda of the Third International Conference on \nFinancing for Development;8 \n \n3. \nTakes note of the report of the Inter-Agency Task Force on Financing for \nDevelopment,9 and notes that progress, though uneven, has been reported in all seven \naction areas of the Addis Ababa Action Agenda, while acknowledging that many \nimplementation gaps persist; \n \n4. \nWelcomes the intergovernmentally agreed conclusions and recommendations \nof the 2019 Economic and Social Council forum on financing for development \nfollow-up,4 urges their full, effective and timely implementation, and looks forward \nto staying engaged so as to assess progress, identify obstacles and challenges in the \nimplementation of the financing for development outcomes and in the delivery of the \nmeans of implementation, promote the sharing of lessons learned from experiences at \nthe national and regional levels, address new and emerging topics of relevance to the \nimplementation of this agenda as the need arises and provide policy recommendations \nfor action by the international community in substantive intergovernmentally agreed \nconclusions and recommendations at the 2020 forum; \n \n5. \nAlso welcomes in this regard the further development of integrated \nnational financing frameworks, in support of nationally owned sustainable \ndevelopment strategies, in order to further implement the Addis Ababa Action \nAgenda, aimed at effectively mobilizing and aligning a wide range of financing \nsources and instruments with the 2030 Agenda for Sustainable Development and \nmaking use of the full potential of all means of implementation; \n \n6. \nLooks forward to the summary by the President of the Economic and \nSocial Council of the 2020 Economic and Social Council forum on financing for \ndevelopment follow-up, as well as the summary by the President of the General \nAssembly of the High-level Dialogue on Financing for Development, held on \n26 September 2019;10 \n \n7. \nEmphasizes that timely and adequate planning for the 2020 Economic and \nSocial Council forum on financing for development follow-up is of paramount \nimportance to its substantive work and outcome; \n__________________ \n \n6 Resolution 73/291, annex. \n \n7 A/74/260. \n \n8 Resolution 69/313, annex. \n \n9 Financing for Sustainable Development Report 2019 (United Nations publications, \nSales No. E.19.I.7). \n \n10 A/74/559. \n\nA/RES/74/207 \nFollow-up to and implementation of the outcomes of the \nInternational Conferences on Financing for Development\n \n19-22420\n4/5 \n \n \n8. \nInvites the President of the Economic and Social Council to take into \nconsideration the deliberations of the 2019 High-level Dialogue on Financing for \nDevelopment, in the preparation of the 2020 Economic and Social Council forum on \nfinancing for development follow-up; \n \n9. \nRecalls that decisions relating to the Economic and Social Council forum \non financing for development follow-up are to be contained within the forum\u2019s \nintergovernmentally agreed conclusions and recommendations; \n \n10. Takes note of the work of the Committee of Experts on International \nCooperation in Tax Matters and the initial contributions made by India to the \nvoluntary trust fund, by Norway to a multi-donor project aimed at supporting the work \nof the Committee, its subcommittees and related capacity development activities, as \nwell as the contributions by the European Union and other countries in support of the \nCommittee\u2019s subsidiary bodies, and urges Member States to come forward to \ncontribute more to the trust fund in order to further support the participation of \ndeveloping countries; \n \n11. \nLooks forward to the holding of the 2020 Global Infrastructure Forum in \nWashington, D.C., on the sidelines of the annual meetings of the Boards of Governors \nof the World Bank Group and the International Monetary Fund, invites the \nmultilateral development banks to provide a briefing to Member States on the \noutcome of the Global Infrastructure Forum, and reiterates that the Global \nInfrastructure Forum is mandated to identify and address infrastructure and capacity \ngaps in developing countries, particularly in the least developed countries, landlocked \ndeveloping countries, small island developing States and African countries; \n \n12. Welcomes the progress made in operationalizing the three components of \nthe Technology Facilitation Mechanism, and looks forward to the prompt \nestablishment of the online platform as part of the Mechanism; \n \n13. Also welcomes the operationalization of the Technology Bank for the Least \nDeveloped Countries, and invites Member States, as well as international organizations, \nfoundations and the private sector, to provide increased voluntary financial \ncontributions and technical assistance to ensure its full and effective implementation; \n \n14. Notes \nwith \nappreciation \nthe \nconvening \nof \nthe \nfourth \nannual \nmulti-stakeholder forum on science, technology and innovation for the Sustainable \nDevelopment Goals in New York on 14 and 15 May 2019, whose Co-Chairs\u2019 \nsummary 11  served as an input to the high-level political forum on sustainable \ndevelopment and highlighted, inter alia, the promotion of networking and \nmatchmaking among relevant stakeholders, especially innovators, funders and other \nsupporters, to bridge the technology gap for the Sustainable Development Goals; \n \n15. Recalls that the Addis Ababa Action Agenda provides a global framework \nfor financing sustainable development and is an integral part of the 2030 Agenda for \nSustainable Development, supports and complements it and helps to contextualize the \nmeans of implementation targets with concrete policies and actions, the \nimplementation of which requires following up on, that relate to its seven action areas, \nnamely domestic public resources; domestic and international private business and \nfinance; international development cooperation; international trade as an engine for \ndevelopment; debt and debt sustainability; addressing systemic issues and science, \ntechnology, innovation and capacity-building; and data, monitoring and follow-up; \n \n16. Reiterates that States will not be able to achieve the ambitious Goals and \ntargets of the 2030 Agenda for Sustainable Development without a revitalized and \nenhanced global partnership and comparably ambitious means of implementation, and \n__________________ \n \n11 See E/HLPF/2019/6. \n\nFollow-up to and implementation of the outcomes of the \nInternational Conferences on Financing for Development \nA/RES/74/207\n \n5/5\n19-22420 \n \nreaffirms the commitment at the very heart of the 2030 Agenda to leave no one behind \nand commit to taking more tangible steps to support people in vulnerable situations \nand the most vulnerable countries and to reach the furthest behind first; \n \n17. Notes the policy recommendations of the Intergovernmental Group of \nExperts on Financing for Development of the United Nations Conference on Trade \nand Development, and that the agreed policy recommendations serve as an input to \nthe Economic and Social Council forum on financing for development follow-up in \naccordance with the terms of reference of the Intergovernmental Group of Experts; \n \n18. Requests the Secretary-General to submit to the General Assembly at its \nseventy-fifth session an action-oriented report, which also takes into account the 2019 \nHigh-level Dialogue on Financing for Development, presenting emerging challenges \nand key accelerators that may be relevant for future discussion in the framework of \nthe Economic and Social Council forum on financing for development follow-up; \n \n19. Decides to include in the provisional agenda of its seventy-fifth session \nthe item entitled \u201cFollow-up to and implementation of the outcomes of the \nInternational Conferences on Financing for Development\u201d. \n \n52nd plenary meeting \n19 December 2019 \n \n",
  "paragraphs": {
    "1": "Takes note of the report of the Secretary-General;7",
    "2": "Emphasizes the need to work towards the full and timely implementation of the Addis Ababa Action Agenda of the Third International Conference on Financing for Development;8",
    "3": "Takes note of the report of the Inter-Agency Task Force on Financing for Development,9 and notes that progress, though uneven, has been reported in all seven action areas of the Addis Ababa Action Agenda, while acknowledging that many implementation gaps persist;",
    "4": "Welcomes the intergovernmentally agreed conclusions and recommendations of the 2019 Economic and Social Council forum on financing for development follow-up,4 urges their full, effective and timely implementation, and looks forward to staying engaged so as to assess progress, identify obstacles and challenges in the implementation of the financing for development outcomes and in the delivery of the means of implementation, promote the sharing of lessons learned from experiences at the national and regional levels, address new and emerging topics of relevance to the implementation of this agenda as the need arises and provide policy recommendations for action by the international community in substantive intergovernmentally agreed conclusions and recommendations at the 2020 forum;",
    "5": "Also welcomes in this regard the further development of integrated national financing frameworks, in support of nationally owned sustainable development strategies, in order to further implement the Addis Ababa Action Agenda, aimed at effectively mobilizing and aligning a wide range of financing sources and instruments with the 2030 Agenda for Sustainable Development and making use of the full potential of all means of implementation;",
    "6": "Looks forward to the summary by the President of the Economic and Social Council of the 2020 Economic and Social Council forum on financing for development follow-up, as well as the summary by the President of the General Assembly of the High-level Dialogue on Financing for Development, held on 26 September 2019;10",
    "7": "Emphasizes that timely and adequate planning for the 2020 Economic and Social Council forum on financing for development follow-up is of paramount importance to its substantive work and outcome;",
    "8": "Invites the President of the Economic and Social Council to take into consideration the deliberations of the 2019 High-level Dialogue on Financing for Development, in the preparation of the 2020 Economic and Social Council forum on financing for development follow-up;",
    "9": "Recalls that decisions relating to the Economic and Social Council forum on financing for development follow-up are to be contained within the forum\u2019s intergovernmentally agreed conclusions and recommendations;",
    "10": "Takes note of the work of the Committee of Experts on International Cooperation in Tax Matters and the initial contributions made by India to the voluntary trust fund, by Norway to a multi-donor project aimed at supporting the work of the Committee, its subcommittees and related capacity development activities, as well as the contributions by the European Union and other countries in support of the Committee\u2019s subsidiary bodies, and urges Member States to come forward to contribute more to the trust fund in order to further support the participation of developing countries;",
    "11": "Looks forward to the holding of the 2020 Global Infrastructure Forum in Washington, D.C., on the sidelines of the annual meetings of the Boards of Governors of the World Bank Group and the International Monetary Fund, invites the multilateral development banks to provide a briefing to Member States on the outcome of the Global Infrastructure Forum, and reiterates that the Global Infrastructure Forum is mandated to identify and address infrastructure and capacity gaps in developing countries, particularly in the least developed countries, landlocked developing countries, small island developing States and African countries;",
    "12": "Welcomes the progress made in operationalizing the three components of the Technology Facilitation Mechanism, and looks forward to the prompt establishment of the online platform as part of the Mechanism;",
    "13": "Also welcomes the operationalization of the Technology Bank for the Least Developed Countries, and invites Member States, as well as international organizations, foundations and the private sector, to provide increased voluntary financial contributions and technical assistance to ensure its full and effective implementation;",
    "14": "Notes with appreciation the convening of the fourth annual multi-stakeholder forum on science, technology and innovation for the Sustainable Development Goals in New York on 14 and 15 May 2019, whose Co-Chairs\u2019 summary 11 served as an input to the high-level political forum on sustainable development and highlighted, inter alia, the promotion of networking and matchmaking among relevant stakeholders, especially innovators, funders and other supporters, to bridge the technology gap for the Sustainable Development Goals;",
    "15": "Recalls that the Addis Ababa Action Agenda provides a global framework for financing sustainable development and is an integral part of the 2030 Agenda for Sustainable Development, supports and complements it and helps to contextualize the means of implementation targets with concrete policies and actions, the implementation of which requires following up on, that relate to its seven action areas, namely domestic public resources; domestic and international private business and finance; international development cooperation; international trade as an engine for development; debt and debt sustainability; addressing systemic issues and science, technology, innovation and capacity-building; and data, monitoring and follow-up;",
    "16": "Reiterates that States will not be able to achieve the ambitious Goals and targets of the 2030 Agenda for Sustainable Development without a revitalized and enhanced global partnership and comparably ambitious means of implementation, and reaffirms the commitment at the very heart of the 2030 Agenda to leave no one behind and commit to taking more tangible steps to support people in vulnerable situations and the most vulnerable countries and to reach the furthest behind first;",
    "17": "Notes the policy recommendations of the Intergovernmental Group of Experts on Financing for Development of the United Nations Conference on Trade and Development, and that the agreed policy recommendations serve as an input to the Economic and Social Council forum on financing for development follow-up in accordance with the terms of reference of the Intergovernmental Group of Experts;",
    "18": "Requests the Secretary-General to submit to the General Assembly at its seventy-fifth session an action-oriented report, which also takes into account the 2019 High-level Dialogue on Financing for Development, presenting emerging challenges and key accelerators that may be relevant for future discussion in the framework of the Economic and Social Council forum on financing for development follow-up;",
    "19": "Decides to include in the provisional agenda of its seventy-fifth session the item entitled \u201cFollow-up to and implementation of the outcomes of the International Conferences on Financing for Development\u201d."
  },
  "agenda_items": [
    "Item 18"
  ],
  "symbol_references": []
}