{
  "symbol": "A/RES/72/142",
  "filename": "A_RES_72_142.pdf",
  "title": "72/142. Promoting social integration through social inclusion",
  "text": "United Nations \nA/RES/72/142\n \n \nGeneral Assembly \nDistr.: General \n15 January 2018 \n \n17-22930 (E)    180118 \n*1722930* \n \n \nSeventy-second session \nAgenda item 27 (b) \n \n \n \n \n Resolution adopted by the General Assembly \non 19 December 2017 \n \n \n \n \n[on the report of the Third Committee (A/72/431)] \n \n \n 72/142. Promoting social integration through social inclusion \n \n \n \nThe General Assembly, \n \nRecognizing that, in order to leave no one behind and bring everyone forward, \nactions are needed to promote equality of opportunity so that no person is denied \nbasic economic and social opportunities and the enjoyment of all human rights, \n \nRecalling the World Summit for Social Development, held in Copenhagen from \n6 to 12 March 1995, and the twenty-fourth special session of the General Assembly, \nentitled \u201cWorld Summit for Social Development and beyond: achieving social \ndevelopment for all in a globalizing world\u201d, held in Geneva from 26 June to 1 July \n2000, \n \nRecalling also Economic and Social Council resolution 2010/12 of 22 July 2010 \non promoting social integration, General Assembly resolution 70/126 of 17 December \n2015 and its previous resolutions on promoting social integration through social \ninclusion, \n \nReaffirming its resolution 70/1 of 25 September 2015, entitled \u201cTransforming \nour world: the 2030 Agenda for Sustainable Development\u201d, in which it adopted a \ncomprehensive, far-reaching and people-centred set of universal and transformative \nSustainable Development Goals and targets, its commitment to working tirelessly for \nthe full implementation of the Agenda by 2030, its recognition that eradicating \npoverty in all its forms and dimensions, including extreme poverty, is the greatest \nglobal challenge and an indispensable requirement for sustainable development, and \nits commitment to achieving sustainable development in its three dimensions \u2013 \neconomic, social and environmental \u2013 in a balanced and integrated manner, \n \nWelcoming the fact that the 2030 Agenda for Sustainable Development reflects \nthe cross-cutting nature and importance of social inclusion, through the relevant \nSustainable Development Goals and associated targets, and acknowledging that its \npromotion is required to achieve sustainable development in all of its dimensions, \n\nA/RES/72/142 \nPromoting social integration through social inclusion\n \n17-22930 \n2/5 \n \n \nRecalling that the 2030 Agenda for Sustainable Development includes, among \nthe 17 Sustainable Development Goals, which are integrated and indivisible, a goal \nto promote peaceful and inclusive societies for sustainable development, provide \naccess to justice for all and build effective, accountable and inclusive institutions at \nall levels, \n \nRecalling also that the Sustainable Development Goals and targets seek to build \non the Millennium Development Goals and complete what they did not achieve, and \nthat they seek to ensure that no one is left behind,  \n \nReaffirming its resolution 69/313 of 27 July 2015 on the Addis Ababa Action \nAgenda of the Third International Conference on Financing for Development, which \nis an integral part of the 2030 Agenda for Sustainable Development, supports and \ncomplements it, helps to contextualize its means of implementation targets with \nconcrete policies and actions, and reaffirms the strong political commitment to \naddress the challenge of financing and creating an enabling environment at all levels \nfor sustainable development in the spirit of global partnership and solidarity, \n \nWelcoming the commitment of the New Urban Agenda, adopted at the United \nNations Conference on Housing and Sustainable Urban Development (Habitat III), \nheld in Quito from 17 to 20 October 2016,1 to embracing diversity in cities and human \nsettlements, \nto \nstrengthening \nsocial \ncohesion, \nintercultural \ndialogue \nand \nunderstanding, tolerance, mutual respect, gender equality and the empowerment of \nwomen, innovation, entrepreneurship, inclusion, identity and safety, and the dignity \nof all people, as well as to fostering liveability and a vibrant urban economy while \nalso taking steps to ensure that local institutions promote pluralism and peaceful \ncoexistence within increasingly heterogeneous and multicultural societies, \n \nRecognizing the great importance of promoting comprehensive systems of \nsocial protection that provide universal access to essential social services, consistent \nwith national priorities and circumstances, in order to help meet the internationally \nagreed development goals, including the Sustainable Development Goals, \n \nTaking note with appreciation of the commitment of several United Nations \nentities to mainstream social inclusion in their work, and encouraging others to do the \nsame, \n \nReaffirming the commitment of the international community to promote \nsustained, inclusive and sustainable economic growth, full and productive \nemployment and decent work for everyone, as necessary, to eradicate poverty in all \nits forms and dimensions, including extreme poverty, which should be complemented, \nas appropriate, by effective social protection policies, including social inclusion \npolicies, \n \nReaffirming also the importance of reducing inequalities within and among \ncountries through the empowerment of all and the promotion of social, economic and \npolitical inclusion, especially for those in vulnerable or marginalized groups or \nsituations, \n \nRecognizing that the gains of economic growth should also benefit those in \nvulnerable or marginalized groups or situations, \n \nRecognizing also that social inclusion and equality are intrinsically linked and \nthat focusing on and investing in the most disadvantaged and excluded populations, \nwhich may include women, children and persons with disabilities, is critically \nimportant for the effective implementation of the Sustainable Development Goals, \n__________________ \n \n1  Resolution 71/256, annex. \n\nPromoting social integration through social inclusion \nA/RES/72/142\n \n3/5 \n17-22930 \n \n \nRecognizing further that social inclusion policies and systems play a critical role \nin promoting an inclusive society and are also crucial for fostering stable, safe, \nharmonious, peaceful and just societies and for improving social cohesion and \ninclusion so as to create an environment for development and progress, \n \nReaffirming the important role of corporate social responsibility and \naccountability in contributing to an enabling environment to promote inclusive \neconomic growth and social integration, \n \nRecognizing that social inclusion policies also strengthen the democratic \nprocess and play a critical role in progressively realizing economic, social and \ncultural rights for all, \n \nStressing that social inclusion policies should promote gender equality and the \nempowerment of women and girls and equal access to opportunities and social \nprotection for all, in particular for those in vulnerable or marginalized groups or \nsituations, including women who experience multiple and intersecting forms of \ndiscrimination and violence, \n \nReaffirming the importance of ensuring the social integration of older persons \nand the promotion and protection of their rights, as an integral part of development \npolicies at all levels, and recognizing that older persons can make a significant \ncontribution to sustainable development in its three dimensions \u2013 economic, social \nand environmental, \n \nReaffirming also that youth participation is important for development, and \nencouraging Member States to explore and promote the participation of young people \nin relevant decision-making processes and monitoring, including in designing and \nimplementing policies and programmes involving them, while implementing the 2030 \nAgenda for Sustainable Development,  \n \nRecognizing \nthe \nimportant \nrole \nplayed \nby \ncivil \nsociety, \nincluding \nnon-governmental organizations, in promoting social integration, inter alia, through \nsocial programmes and support for the development of socially inclusive policies, \n \nAcknowledging that the participation of persons in vulnerable or marginalized \ngroups or situations is crucial to formulating and implementing social inclusion \npolicies that effectively achieve social integration, as appropriate, \n \nReaffirming the important role of cooperatives, especially in developing \ncountries, in reducing inequality within and among countries and ensuring social \ninclusion while promoting more inclusive and equitable growth in order to achieve \nthe Sustainable Development Goals with the aim of leaving no one behind, \n \nRecognizing that each country has primary responsibility for its own economic \nand social development, and reaffirming the essential role of national policies and \nstrategies in promoting sustainable development in all of its forms, particularly the \npromotion of social inclusion, \n \nRecognizing also the importance of an enabling international environment, and \nstressing the importance of enhanced international cooperation to support national \nefforts towards promoting social integration through social inclusion in every country, \nincluding the fulfilment of all commitments on official development assistance, debt \nrelief, market access, financial and technical support and capacity-building, \n \nExpressing concern that, in times of economic and financial crisis and ongoing \nconcern about energy and food insecurity, social exclusion can be exacerbated, and \nstressing in this regard that sustainable and reliable social inclusion policies and \nprogrammes can play a positive role, \n\nA/RES/72/142 \nPromoting social integration through social inclusion\n \n17-22930 \n4/5 \n \n \n1. \nTakes note of the report of the Secretary-General;2  \n \n2. \nStresses that Member States, which bear the main responsibility for social \nintegration and social inclusion, should prioritize the creation of a \u201csociety for all\u201d \nbased on respect for all human rights and the principles of equality among individuals, \nnon-discrimination, access to basic social services and promotion of the active \nparticipation of every member of society, in particular those in vulnerable or \nmarginalized groups or situations, in all aspects of life, including civic, social, \neconomic, cultural and political activities, as well as participation in decision-making \nprocesses; \n \n3. \nReaffirms that social integration policies should seek to reduce inequalities \nand that equity and social inclusion are important for achieving sustainable \ndevelopment, ensuring that individuals can participate without discrimination and \ncontribute to its social, economic and environmental dimensions; \n \n4. \nStresses the importance of promoting inclusive and equitable quality \neducation and lifelong learning opportunities for all, especially for older persons and \npersons with disabilities, and of skills development and quality training, as essential \nmeans for inclusive participation and integration in society; \n \n5. \nCalls upon Member States to promote a more equitable participation in \nand access to economic growth gains, through, inter alia, policies that ensure inclusive \nlabour markets and by implementing socially responsive macroeconomic policies, in \nwhich employment has a key role, and social inclusion strategies that promote social \nintegration, ensuring social protection floors, particularly for those who are in \nvulnerable or marginalized groups or situations, as defined by each country in \naccordance with its individual circumstances, including on a demand-driven basis, \nand the promotion and protection of their social and economic rights; \n \n6. \nEncourages Member States to consider, when appropriate, the creation or \nthe strengthening of national institutions or agencies for promoting, implementing \nand evaluating social inclusion programmes and mechanisms, at the national and local \nlevels, in order to help to ensure that no one is left behind; \n \n7. \nAlso encourages Member States to consider promoting the increased civil, \npolitical and economic participation of women, youth, older persons, persons with \ndisabilities and indigenous peoples, including through promoting their involvement \nin political processes and their access to social protection, credit, vocational training \nand employment support services; \n \n8. \nFurther encourages Member States to ensure inclusive participatory and \nrepresentative decision-making processes, at all levels, and to review existing legal \nframeworks, as appropriate, with a view to removing discriminatory provisions so as \nto reduce inequalities; \n \n9. \nEncourages Member States to promote social inclusion as a matter of \nsocial justice in order to build the resilience of vulnerable populations and to help \nthem to adapt to the negative impact of economic crises, humanitarian emergencies \nand climate change, and in this regard invites relevant United Nations entities and \ninternational institutions to support such efforts; \n \n10. Invites Member States, and encourages regional organizations, to support \nnational efforts to achieve inclusive societies, in particular in developing countries, \nupon their request, by providing, inter alia, financial and technical cooperation for the \ndesign and implementation of sound social inclusion policies; \n__________________ \n \n2  A/72/189. \n\nPromoting social integration through social inclusion \nA/RES/72/142\n \n5/5 \n17-22930 \n \n \n11. \nEncourages Member States to mainstream social integration objectives \ninto social inclusion policies, promoting the participation of persons in vulnerable or \nmarginalized groups or situations in planning, implementing and monitoring \nprocesses, in collaboration, as appropriate, with relevant organizations of the United \nNations development system, regional organizations, international and regional \nfinancial institutions, development and social partners, the private sector and civil \nsociety organizations; \n \n12. Also encourages Member States to promote the inclusion of a gender \nperspective in all social inclusion strategies and initiatives, especially in terms of the \neconomic empowerment of women and the promotion of a gender-sensitive policy \nenvironment in the workplace; \n \n13. Invites Member States, relevant organizations of the United Nations \nsystem, regional organizations, international and regional financial institutions, \ndevelopment and social partners, the private sector and civil society organizations to \ncontinue to share their experience in respect of practical initiatives to promote \neconomic, civil and political participation and anti-discrimination measures and other \nmeasures for advancing social integration; \n \n14. Also invites Member States to consider a systematic exchange of good \npractices in social integration at the regional and international levels so that \npolicymakers and other stakeholders can apply them to their national circumstances \nand step up progress towards achieving a \u201csociety for all\u201d; \n \n15. Encourages Member States to improve the collection and use of data \ndisaggregated by age, sex and other relevant criteria for the formulation of policies \nand programmes aimed at achieving social inclusion, and stresses the importance of \ninternational cooperation in this regard; \n \n16. Requests the Secretary-General to submit a report, taking into account the \ninformation provided by Member States and relevant actors of the United Nations \nsystem, on the implementation of the present resolution to the General Assembly at \nits seventy-fourth session; \n \n17. Decides to consider the question further at its seventy-fourth session under \nthe item entitled \u201cSocial development\u201d. \n \n73rd plenary meeting \n19 December 2017 \n \n",
  "paragraphs": {
    "1": "Takes note of the report of the Secretary-General;2",
    "2": "Stresses that Member States, which bear the main responsibility for social integration and social inclusion, should prioritize the creation of a \u201csociety for all\u201d based on respect for all human rights and the principles of equality among individuals, non-discrimination, access to basic social services and promotion of the active participation of every member of society, in particular those in vulnerable or marginalized groups or situations, in all aspects of life, including civic, social, economic, cultural and political activities, as well as participation in decision-making processes;",
    "3": "Reaffirms that social integration policies should seek to reduce inequalities and that equity and social inclusion are important for achieving sustainable development, ensuring that individuals can participate without discrimination and contribute to its social, economic and environmental dimensions;",
    "4": "Stresses the importance of promoting inclusive and equitable quality education and lifelong learning opportunities for all, especially for older persons and persons with disabilities, and of skills development and quality training, as essential means for inclusive participation and integration in society;",
    "5": "Calls upon Member States to promote a more equitable participation in and access to economic growth gains, through, inter alia, policies that ensure inclusive labour markets and by implementing socially responsive macroeconomic policies, in which employment has a key role, and social inclusion strategies that promote social integration, ensuring social protection floors, particularly for those who are in vulnerable or marginalized groups or situations, as defined by each country in accordance with its individual circumstances, including on a demand-driven basis, and the promotion and protection of their social and economic rights;",
    "6": "Encourages Member States to consider, when appropriate, the creation or the strengthening of national institutions or agencies for promoting, implementing and evaluating social inclusion programmes and mechanisms, at the national and local levels, in order to help to ensure that no one is left behind;",
    "7": "Also encourages Member States to consider promoting the increased civil, political and economic participation of women, youth, older persons, persons with disabilities and indigenous peoples, including through promoting their involvement in political processes and their access to social protection, credit, vocational training and employment support services;",
    "8": "Further encourages Member States to ensure inclusive participatory and representative decision-making processes, at all levels, and to review existing legal frameworks, as appropriate, with a view to removing discriminatory provisions so as to reduce inequalities;",
    "9": "Encourages Member States to promote social inclusion as a matter of social justice in order to build the resilience of vulnerable populations and to help them to adapt to the negative impact of economic crises, humanitarian emergencies and climate change, and in this regard invites relevant United Nations entities and international institutions to support such efforts;",
    "10": "Invites Member States, and encourages regional organizations, to support national efforts to achieve inclusive societies, in particular in developing countries, upon their request, by providing, inter alia, financial and technical cooperation for the design and implementation of sound social inclusion policies;",
    "11": "Encourages Member States to mainstream social integration objectives into social inclusion policies, promoting the participation of persons in vulnerable or marginalized groups or situations in planning, implementing and monitoring processes, in collaboration, as appropriate, with relevant organizations of the United Nations development system, regional organizations, international and regional financial institutions, development and social partners, the private sector and civil society organizations;",
    "12": "Also encourages Member States to promote the inclusion of a gender perspective in all social inclusion strategies and initiatives, especially in terms of the economic empowerment of women and the promotion of a gender-sensitive policy environment in the workplace;",
    "13": "Invites Member States, relevant organizations of the United Nations system, regional organizations, international and regional financial institutions, development and social partners, the private sector and civil society organizations to continue to share their experience in respect of practical initiatives to promote economic, civil and political participation and anti-discrimination measures and other measures for advancing social integration;",
    "14": "Also invites Member States to consider a systematic exchange of good practices in social integration at the regional and international levels so that policymakers and other stakeholders can apply them to their national circumstances and step up progress towards achieving a \u201csociety for all\u201d;",
    "15": "Encourages Member States to improve the collection and use of data disaggregated by age, sex and other relevant criteria for the formulation of policies and programmes aimed at achieving social inclusion, and stresses the importance of international cooperation in this regard;",
    "16": "Requests the Secretary-General to submit a report, taking into account the information provided by Member States and relevant actors of the United Nations system, on the implementation of the present resolution to the General Assembly at its seventy-fourth session;",
    "17": "Decides to consider the question further at its seventy-fourth session under the item entitled \u201cSocial development\u201d."
  },
  "agenda_items": [
    "Item 27"
  ],
  "symbol_references": []
}