{
  "symbol": "A/RES/79/48",
  "filename": "A_RES_79_48.pdf",
  "title": "79/48. Measures to uphold the authority of the 1925 Geneva Protocol",
  "text": "United Nations \nA/RES/79/48\n \n \nGeneral Assembly \nDistr.: General \n9 December 2024 \n \n24-23070 (E)     \n*2423070* \n \n \nSeventy-ninth session \nAgenda item 98 (k) \nGeneral and complete disarmament: measures to uphold \nthe authority of the 1925 Geneva Protocol\n \n \n \n \n \n Resolution adopted by the General Assembly \non 2 December 2024 \n \n \n \n \n[on the report of the First Committee (A/79/408, para. 114)] \n \n \n \n79/48. Measures to uphold the authority of the 1925 Geneva Protocol \n \n \n \nThe General Assembly, \n \nRecalling its previous resolutions on the subject, in particular resolutions 71/59 \nof 5 December 2016, 73/43 of 5 December 2018, 75/46 of 7 December 2020 and 77/50 \nof 7 December 2022,  \n \nDetermined to act with a view to achieving effective progress towards general \nand complete disarmament under strict and effective international control, \n \nRecalling the long-standing determination of the international community to \nachieve the effective prohibition of the development, production, stockpiling and use \nof chemical and biological weapons, as well as the continuing support for measures \nto uphold the authority of the Protocol for the Prohibition of the Use in War of \nAsphyxiating, Poisonous or Other Gases, and of Bacteriological Methods of Warfare, \nsigned at Geneva on 17 June 1925,1 as expressed by consensus in many previous \nresolutions, \n \nEmphasizing the necessity of easing international tension and strengthening \ntrust and confidence between States, \n \n1. \nTakes note of the note by the Secretary-General;2 \n \n2. \nRenews its previous call to all States to observe strictly the principles and \nobjectives of the Protocol for the Prohibition of the Use in War of Asphyxiating, \nPoisonous or Other Gases, and of Bacteriological Methods of Warfare, and reaffirms \nthe vital necessity of upholding its provisions; \n__________________ \n \n1  League of Nations, Treaty Series, vol. XCIV, No. 2138. \n \n2  A/79/119. \n\nA/RES/79/48 \nMeasures to uphold the authority of the 1925 Geneva Protocol\n \n24-23070\n2/2 \n \n \n3. \nCalls upon those States that continue to maintain reservations to the 1925 \nGeneva Protocol to withdraw them; \n \n4. \nRequests the Secretary-General to submit to the General Assembly at its \neighty-first session a report on the implementation of the present resolution. \n \n43rd plenary meeting \n2 December 2024 \n \n",
  "paragraphs": {
    "1": "Takes note of the note by the Secretary-General;2",
    "2": "Renews its previous call to all States to observe strictly the principles and objectives of the Protocol for the Prohibition of the Use in War of Asphyxiating, Poisonous or Other Gases, and of Bacteriological Methods of Warfare, and reaffirms the vital necessity of upholding its provisions;",
    "3": "Calls upon those States that continue to maintain reservations to the 1925 Geneva Protocol to withdraw them;",
    "4": "Requests the Secretary-General to submit to the General Assembly at its eighty-first session a report on the implementation of the present resolution."
  },
  "agenda_items": [
    "Item 98"
  ],
  "symbol_references": []
}