{
  "symbol": "A/RES/72/82",
  "filename": "A_RES_72_82.pdf",
  "title": "72/82. Operations of the United Nations Relief and Works Agency for Palestine Refugees in the Near East",
  "text": "United Nations \nA/RES/72/82\n \n \nGeneral Assembly \nDistr.: General \n14 December 2017 \n \n17-22109 (E)    181217 \n*1722109* \n \n \nSeventy-second session \nAgenda item 53 \n \n \n \n \n Resolution adopted by the General Assembly \non 7 December 2017 \n \n \n \n \n[on the report of the Special Political and Decolonization Committee \n(Fourth Committee) (A/72/447)] \n \n \n \n72/82. Operations of the United Nations Relief and Works Agency \nfor Palestine Refugees in the Near East \n \n \n \nThe General Assembly, \n \nRecalling its resolutions 194 (III) of 11 December 1948, 212 (III) of \n19 November 1948, 302 (IV) of 8 December 1949 and all subsequent related \nresolutions, including its resolution 71/93 of 6 December 2016, \n \nRecalling also the relevant resolutions of the Security Council, \n \nHaving considered the report of the Commissioner-General of the United \nNations Relief and Works Agency for Palestine Refugees in the Near East covering \nthe period from 1 January to 31 December 2016,1 \n \nTaking note of the letter dated 25 May 2017 from the Chair of the Advisory \nCommission of the Agency addressed to the Commissioner-General,2 and noting the \nextraordinary meeting of the Commission held on 8 September 2016, \n \nUnderlining that, at a time of heightened conflict and instability in the Middle \nEast, the Agency continues to play a vital role in ameliorating the plight of the \nPalestine refugees through the provision of, inter alia, essential education, health, \nrelief and social services programmes and emergency assistance to a registered \npopulation of more than 5.3 million refugees whose situation has become extremely \nprecarious, in mitigating the consequences of alarming trends, including increasing \nviolence, marginalization and poverty, in the areas of operation, and in providing a \ncrucial measure of stability in the region, \n \nDeeply concerned about the extremely critical financial situation of the \nAgency, caused by the structural underfunding of the Agency, as well as by rising \n__________________ \n \n1 Official Records of the General Assembly, Seventy-second Session, Supplement No. 13 \n(A/72/13/Rev.1). \n \n2 Ibid., pp. 7\u20139. \n\nA/RES/72/82 \nOperations of the United Nations Relief and Works\nAgency for Palestine Refugees in the Near East\n \n17-22109 \n2/10 \n \nneeds and expenditures resulting from the deterioration of the socioeconomic and \nhumanitarian conditions and the conflicts and rising instability in the region and \ntheir significant negative impact on the ability of the Agency to deliver essential \nservices to the Palestine refugees, including its emergency, recovery, reconstruction \nand development programmes in all fields of operation, \n \nTaking note of the report of the Secretary-General on the operations of the \nUnited Nations Relief and Works Agency for Palestine Refugees in the Near East, 3 \nsubmitted pursuant to resolution 71/93, and the request contained therein for broad \nconsultations to explore all ways and means, including through voluntary and \nassessed contributions, to ensure that the Agency\u2019s funding is sufficient, predictable \nand sustained for the duration of its mandate, and considering the recommendations \ncontained in the report, \n \nTaking note also of the report of 30 June 2017 of the Commissioner-General, \nsubmitted pursuant to paragraph 57 of the report of the Secretary-General and in \nfollow-up to the update to the special report of 3 August 2015 of the Commissioner-\nGeneral,4 submitted pursuant to paragraph 21 of General Assembly resolution \n302 (IV), regarding the severe financial crisis of the Agency and the negative \nimplications for the continued delivery of core Agency programmes to the Palestine \nrefugees in all fields of operation, \n \nExpressing appreciation for the efforts of donors and host countries to respond \nto the Agency\u2019s financial crisis, including through continued and, where possible, \nincreased voluntary contributions, while acknowledging the steadfast support of all \nother donors to the Agency, \n \nNoting that contributions have not been predictable enough or sufficient to \nmeet growing needs and remedy the persistent shortfalls that are undermining the \nAgency\u2019s operations and efforts to promote human development and meet Palestine \nrefugees\u2019 basic needs, and stressing the need for further efforts to comprehensively \naddress the recurrent funding shortfalls affecting the Agency\u2019s operations, \n \nRecognizing the Agency\u2019s efforts to develop innovative and diversified means \nto mobilize resources, including through partnerships with international financial \ninstitutions, the private sector and civil society, \n \nCommending the Agency for the measures taken to address the financial crisis, \ndespite difficult operational circumstances, including through the implementation of \nthe medium-term strategy for 2016\u20132021 and various internal measures to contain \nexpenditures, reduce operational and administrative costs, maximize the use of \nresources and reduce the funding shortfalls, and expressing profound concern that, \ndespite such measures, the Agency\u2019s programme budget, which is funded primarily \nby \nvoluntary \ncontributions \nfrom \nMember \nStates \nand \nintergovernmental \norganizations, faces persistent shortfalls that are increasingly threatening the \ndelivery of the Agency\u2019s core programmes of assistance to the Palestine refugees, \n \nEncouraging the Agency to sustain those reform efforts, while also taking all \npossible measures to protect and improve the quality of access to and the delivery of \ncore programmes of assistance, \n \nRecalling its resolution 65/272 of 18 April 2011, in which it requested the \nSecretary-General to continue to support the institutional strengthening of the \nAgency, \n__________________ \n \n3 A/71/849. \n \n4 A/70/272, annex. \n\nOperations of the United Nations Relief and Works \nAgency for Palestine Refugees in the Near East \nA/RES/72/82\n \n3/10 \n17-22109 \n \n \nStressing the need to support the Agency\u2019s capacity to uphold its mandate and \nto avert the serious humanitarian, political and security risks that would result from \nany interruption or suspension of its vital work, \n \nRecognizing that the recurring and growing financial shortfalls directly \naffecting the sustainability of the Agency\u2019s operations need to be remedied by \nexamining new funding modalities designed to put the Agency on a stable financial \nfooting to enable it to effectively carry out its core programmes in accordance with \nits mandate and commensurate with humanitarian needs, \n \nWelcoming the affirmation in the New York Declaration for Refugees and \nMigrants, adopted by the General Assembly on 19 September 2016,5 that, inter alia, \nthe Agency, along with other relevant organizations, requires sufficient funding to \nbe able to carry out its activities effectively and in a predictable manner, \n \nBearing in mind the 2030 Agenda for Sustainable Development,6 including the \npledge that no one will be left behind, emphasizing that the Sustainable \nDevelopment Goals apply to all, including refugees, and commending the efforts of \nthe Agency\u2019s programmes to promote 10 of the 17 Goals, as indicated in the report \nof the Secretary-General, \n \nWelcoming the joint efforts of host countries and donors to mobilize support \nfor the Agency, including the ministerial meetings convened on 26 September 2015 \nand 4 May 2016, at the high-level conference convened on 2 June 2015 in \nNew York to commemorate the sixty-fifth anniversary of the commencement of the \nAgency\u2019s operations and at other high-level meetings, \n \nWelcoming also the support for the Agency affirmed at the high-level meeting \nconvened by the Organization of Islamic Cooperation, and co-sponsored by Jordan \nand Sweden, on 22 September 2017, aimed at urgently addressing the Agency\u2019s \nfunding shortfall and contributing towards the expansion of donor support for the \nAgency, \n \nRecalling Articles 100, 104 and 105 of the Charter of the United Nations and \nthe Convention on the Privileges and Immunities of the United Nations, 7 \n \nRecalling also the Convention on the Safety of United Nations and Associated \nPersonnel,8 \n \nRecalling further its resolutions 71/129 of 8 December 2016 on the safety and \nsecurity of humanitarian personnel and protection of United Nations personnel and \n71/127 of 8 December 2016 on the strengthening of the coordination of emergency \nhumanitarian assistance of the United Nations, calling upon, inter alia, all States to \nensure respect for and the protection of all humanitarian personnel and United \nNations and associated personnel, to respect the principles of humanity, neutrality, \nimpartiality and independence for the provision of humanitarian assistance and to \nrespect and ensure respect for the inviolability of United Nations premises, \n \nAffirming the applicability of the Geneva Convention relative to the Protection \nof Civilian Persons in Time of War, of 12 August 1949,9 to the Palestinian territory \noccupied since 1967, including East Jerusalem, \n__________________ \n \n5 Resolution 71/1. \n \n6 Resolution 70/1. \n \n7 Resolution 22 A (I). \n \n8 United Nations, Treaty Series, vol. 2051, No. 35457. \n \n9 Ibid., vol. 75, No. 973. \n\nA/RES/72/82 \nOperations of the United Nations Relief and Works\nAgency for Palestine Refugees in the Near East\n \n17-22109 \n4/10 \n \n \nAware of the continuing needs of the Palestine refugees in all fields of \noperation, namely Jordan, Lebanon, the Syrian Arab Republic and the Occupied \nPalestinian Territory, \n \nGravely concerned about the extremely difficult socioeconomic conditions \nbeing faced by the Palestine refugees in the Occupied Palestinian Territory, \nincluding East Jerusalem, particularly in the refugee camps in the Gaza Strip, as a \nresult of the recurrent military operations, continuing prolonged Israeli closures, the \nconstruction of settlements and the wall, evictions, the demolition of homes and \nlivelihood properties causing forced transfers of civilians, and the severe economic \nand movement restrictions that in effect amount to a blockade, which have deepened \nunemployment and poverty rates among the refugees, with potentially lasting, long-\nterm negative effects, while taking note of developments with regard to the situation \nof access there, \n \nDeploring the continuing and negative repercussions of the conflicts in and \naround the Gaza Strip, the most recent in July and August 2014, and the thousands \nof civilian casualties caused, as well as the widespread destruction of or damage to \nthousands of homes and vital civilian infrastructure, the internal displacement of \nhundreds of thousands of civilians and any violations of international law, including \nhumanitarian and human rights law, in this regard, \n \nExpressing grave concern, in this regard, about the lasting impact on the \nhumanitarian and socioeconomic situation of the Palestine refugees in the Gaza \nStrip, including high rates of food insecurity, poverty, displacement and the \ndepletion of coping capacities, and taking note in this regard of the United Nations \ncountry team reports of 26 August 2016, entitled \u201cGaza: two years after\u201d and of July \n2017, entitled \u201cGaza ten years later\u201d and the alarming conditions and figures \ndocumented therein, \n \nDeploring attacks affecting United Nations installations, including Agency \nschools sheltering displaced civilians, and all other breaches of the inviolability of \nUnited Nations premises during the conflict in the Gaza Strip in July and August \n2014, as reported in the summary by the Secretary-General of the report of the \nBoard of Inquiry10 and by the independent commission of inquiry established \npursuant to Human Rights Council resolution S-21/1,11 and stressing the imperative \nof ensuring accountability, \n \nCommending the Agency for its extraordinary efforts to provide shelter, \nemergency relief, medical, food, protection and other humanitarian assistance \nduring the military operations of July and August 2014, \n \nRecalling the temporary tripartite agreement facilitated by the United Nations \nin September 2014, and stressing the urgent need for the lifting of all Israeli \nclosures and restrictions on the Gaza Strip and for the reconstruction of destroyed \nhomes and infrastructure, \n \nRecalling also its resolution ES-10/18 of 16 January 2009 and Security \nCouncil resolution 1860 (2009) of 8 January 2009, as well as the Agreement on \nMovement and Access of 15 November 2005, \n \nCalling upon Israel to ensure the expedited and unimpeded import of all \nnecessary construction materials into the Gaza Strip and to reduce the burdensome \ncost of importation of Agency supplies, while taking note of recent developments \nwith regard to the tripartite agreement facilitated by the United Nations, \n__________________ \n \n10 S/2015/286, annex. \n \n11 See A/HRC/29/52. \n\nOperations of the United Nations Relief and Works \nAgency for Palestine Refugees in the Near East \nA/RES/72/82\n \n5/10 \n17-22109 \n \n \nExpressing concern about the continuing classroom shortage in the Gaza Strip \nand the consequent negative impact on the right to education of refugee children, \n \nStressing the urgent need for the advancement of reconstruction in the Gaza \nStrip, including by ensuring the timely facilitation of construction projects, \nincluding extensive shelter repair, and the need for the accelerated implementation \nof other urgent United Nations-led civilian reconstruction activities, \n \nWelcoming contributions made to the Agency\u2019s emergency appeals for the \nGaza Strip, and calling urgently upon the international community for continued \nsupport in accordance with the Agency\u2019s strategic response plan, \n \nUrging the full disbursement of pledges made at the Cairo International \nConference on Palestine: Reconstructing Gaza, held on 12 October 2014, for \nensuring the provision of the necessary humanitarian assistance and accelerating the \nreconstruction process, \n \nStressing that the situation in the Gaza Strip is unsustainable and that a durable \nceasefire agreement must lead to a fundamental improvement in the living \nconditions of the Palestinian people in the Gaza Strip, including through the \nsustained and regular opening of crossing points, and must ensure the safety and \nwell-being of civilians on both sides, \n \nAffirming the need to support the Palestinian national consensus Government \nin its assumption of full government responsibilities in both the West Bank and the \nGaza Strip, in all fields, as well as through its presence at Gaza\u2019s crossing points, \n \nNoting with appreciation the progress made towards rebuilding the Nahr  \nel-Bared refugee camp, commending the Government of Lebanon, donors, the \nAgency and other parties concerned for the continuing efforts to assist affected and \ndisplaced refugees, and emphasizing the need for the funding required to complete \nthe reconstruction of the camp and end without delay the displacement from the \ncamp of thousands of residents whose shelters have not been rebuilt, \n \nExpressing deep concern at the critical situation of Palestine refugees in the \nSyrian Arab Republic and at the impact of the crisis on the Agency\u2019s installations \nand its ability to deliver its services, and regretting profoundly the loss of life and \nwidespread displacement among refugees and the killing of 19 staff members of the \nAgency in the crisis since 2012, \n \nEmphasizing the continuing need for assistance to Palestine refugees in the \nSyrian Arab Republic as well as those who have fled to neighbouring countries, and \nemphasizing the necessity of ensuring open borders for Palestine refugees fleeing \nthe crisis in the Syrian Arab Republic, consistent with the principles of \nnon-discrimination and non-refoulement under international law, and recalling in \nthis regard the statement by the President of the Security Council of 2 October \n201312 and the New York Declaration for Refugees and Migrants, \n \nAware of the valuable work done by the Agency in providing protection to the \nPalestinian people, in particular Palestine refugees, and recalling the need for the \nprotection of all civilians in situations of armed conflict, \n \nDeploring the endangerment of the safety of the Agency\u2019s staff and the \ndamage and destruction caused to the facilities and properties of the Agency during \nthe period covered by the report of the Commissioner-General,1 and stressing the \nneed to maintain the neutrality and safeguard the inviolability of United Nations \npremises, installations and equipment at all times, \n__________________ \n \n12 S/PRST/2013/15; see Resolutions and Decisions of the Security Council, 1 August 2013\u201331 July \n2014 (S/INF/69). \n\nA/RES/72/82 \nOperations of the United Nations Relief and Works\nAgency for Palestine Refugees in the Near East\n \n17-22109 \n6/10 \n \n \nDeploring also the breaches of the inviolability of United Nations premises, \nthe failure to accord the property and assets of the Organization immunity from any \nform of interference and the failure to protect United Nations personnel, premises \nand property, \n \nDeploring further the killing and injury of Agency staff members by the Israeli \noccupying forces in the Occupied Palestinian Territory since September 2000, \nincluding the 11 Agency personnel killed during the military operations in the Gaza \nStrip in July and August 2014, \n \nDeploring the killing and wounding of refugee children and women sheltering \nin the Agency schools by the Israeli occupying forces during the military operations \nof July and August 2014, \n \nAffirming the need for accountability and compensation to victims of violations \nof international law in accordance with international standards by all sides, \n \nDeeply concerned about the continuing imposition of restrictions on the \nfreedom of movement and access of the Agency\u2019s staff, vehicles and goods, and the \ninjury, harassment and intimidation of the Agency\u2019s staff, which undermine and \nobstruct the work of the Agency, including its ability to provide essential basic and \nemergency services, \n \nRecalling the statement of 15 July 1999 and the declarations adopted on \n5 December 2001 and on 17 December 201413 by the Conference of High \nContracting Parties to the Fourth Geneva Convention, including the call upon \nparties to facilitate the activities of the Agency, to guarantee its protection and to \nrefrain from levying taxes and imposing undue financial burdens, \n \nAware of the agreement between the Agency and the Government of Israel, \n \nTaking note of the agreement reached on 24 June 1994, embodied in an \nexchange of letters between the Agency and the Palestine Liberation Organization, 14 \n \n1. \nReaffirms that the effective functioning of the United Nations Relief and \nWorks Agency for Palestine Refugees in the Near East remains essential in all fields \nof operation; \n \n2. \nExpresses its appreciation to the Commissioner-General of the Agency, \nas well as to all the staff of the Agency, for their tireless efforts and valuable work, \nparticularly in the light of the difficult conditions, instability and crises faced during \nthe past year; \n \n3. \nExpresses special commendation to the Agency for the essential role that \nit has played for more than 65 years since its establishment in providing vital \nservices for the well-being, human development and protection of the Palestine \nrefugees and the amelioration of their plight and for the stability of the region, and \naffirms the necessity for continuing the work of the Agency and its unimpeded \noperation and provision of services, pending the just resolution of the question of \nthe Palestine refugees; \n \n4. \nCommends the Agency for its extraordinary efforts, in cooperation with \nother United Nations agencies on the ground, to provide emergency humanitarian \nassistance, including shelter, food and medical aid, to refugees and affected civilians \nduring and since the military operations in the Gaza Strip in July and August 2014, \nand recognizes its exemplary capacity to mobilize in emergency situations while \ncontinuously carrying out its core human development programmes; \n__________________ \n \n13 A/69/711-S/2015/1, annex. \n \n14 Official Records of the General Assembly, Forty-ninth Session, Supplement No. 13 (A/49/13), \nannex I. \n\nOperations of the United Nations Relief and Works \nAgency for Palestine Refugees in the Near East \nA/RES/72/82\n \n7/10 \n17-22109 \n \n \n5. \nExpresses its appreciation for the important support and cooperation \nprovided by the host Governments to the Agency in the discharge of its duties; \n \n6. \nAlso expresses its appreciation to the Advisory Commission of the \nAgency, and requests it to continue its efforts and to keep the General Assembly \ninformed of its activities; \n \n7. \nTakes note of the report of the Working Group on the Financing of the \nUnited Nations Relief and Works Agency for Palestine Refugees in the Near East 15 \nand the efforts to assist in ensuring the financial security of the Agency, and \nrequests the Secretary-General to provide the necessary services and assistance to \nthe Working Group for the conduct of its work; \n \n8. \nCommends the Agency for its six-year medium-term strategy for  \n2016\u20132021 and the Commissioner-General for his continuing efforts to increase the \nbudgetary transparency and efficiency of the Agency, as reflected in the Agency\u2019s \nprogramme budget for the biennium 2018\u20132019;16 \n \n9. \nAlso commends the Agency for sustaining its robust internal reform \nefforts, \ndespite \ndifficult \noperational \ncircumstances, \nand \nrecognizes \nits \nimplementation of maximum efficiency procedures to contain expenditures, reduce \noperational and administrative costs, reduce its funding shortfalls and maximize the \nuse of resources; \n \n10. Takes note of the report of the Secretary-General on the operations of the \nUnited Nations Relief and Works Agency for Palestine Refugees in the Near East 3 \nand the conclusions and recommendations contained therein; \n \n11. \nAppeals to States and organizations for the maintenance of their \nvoluntary contributions to the Agency, as well as an increase in contributions where \npossible, in particular to the Agency\u2019s programme budget, including in the \nconsideration of their allocation of resources for international human rights, peace \nand stability, development and humanitarian efforts, to support the Agency\u2019s \nmandate and its ability to meet the rising needs of the Palestine refugees and \nessential associated costs of operations; \n \n12. Appeals to States and organizations not currently contributing to the \nAgency to urgently consider making voluntary contributions in response to the calls \nof the Secretary-General for expansion of the Agency\u2019s donor base, in order to \nstabilize funding and ensure greater sharing of the financial burden of supporting \nthe Agency\u2019s operations, in accordance with the continuing responsibility of the \ninternational community as a whole to assist the Palestine refugees; \n \n13. Calls for the provision by donors of early annual voluntary contributions, \nless earmarking, and multi-year funding, in line with the Grand Bargain on \nhumanitarian financing announced at the World Humanitarian Summit, held in \nIstanbul, Turkey, in May 2016, in order to enhance the Agency\u2019s ability to plan and \nimplement its operations with a greater degree of assurance regarding resource \nflows; \n \n14. Also calls for the full and timely funding by donors of the Agency\u2019s \nemergency, recovery and reconstruction programmes as set out in its appeals and \nresponse plans; \n__________________ \n \n15 A/72/326. \n \n16 Official Records of the General Assembly, Seventy-second Session, Supplement No. 13A \n(A/72/13/Add.1). \n\nA/RES/72/82 \nOperations of the United Nations Relief and Works\nAgency for Palestine Refugees in the Near East\n \n17-22109 \n8/10 \n \n \n15. Requests the Commissioner-General to continue efforts to maintain and \nincrease traditional donor support and to enhance income from non-traditional \ndonors, including through partnerships with public and private entities; \n \n16. Encourages the Agency to explore financing avenues in relation to the \nimplementation of the Sustainable Development Goals;6 \n \n17. Urges States and organizations to actively pursue partnerships with and \ninnovative support for the Agency, including as recommended in paragraphs 47, 48 \nand 50 of the report of the Secretary-General, including through the establishment \nof endowments, trust funds or revolving fund mechanisms and assistance to the \nAgency to access humanitarian, development and peace and security trust funds and \ngrants; \n \n18. Welcomes pledges by States and organizations to provide diplomatic and \ntechnical support to the Agency, including engagement with international and \nfinancial development institutions, including the World Bank and the Islamic \nDevelopment Bank, and, where appropriate, to facilitate support for the \nestablishment of financing mechanisms that can provide assistance to refugees and \nin fragile contexts, including to meet the needs of the Palestine refugees, and calls \nfor serious follow-up efforts; \n \n19. Requests the Agency to continue to implement efficiency measures \nthrough its medium-term strategy and the development of a five-year proposal for \nstabilizing the Agency\u2019s finances, including specific and time-bound measures, and \nto continue to improve its cost efficiency and resource mobilization efforts; \n \n20. Calls upon the members of the Advisory Commission and the Working \nGroup on the Financing of the United Nations Relief and Works Agency for \nPalestine Refugees in the Near East to consider the relevant recommendations in the \nreport of the Secretary-General, including to help the Agency to address resource \nmobilization challenges and to actively assist the Commissioner-General in the \nefforts to create sustainable, sufficient and predictable support for the Agency\u2019s \noperations; \n \n21. Takes note of the recommendations of the Secretary-General regarding \nthe support provided to the Agency from the regular budget of the United Nations; \n \n22. Endorses the efforts of the Commissioner-General to continue to provide \nhumanitarian assistance, as far as is practicable, on an emergency basis and as a \ntemporary measure, to persons in the area who are internally displaced and in \nserious need of continuing assistance as a result of recent crises in the Agency\u2019s \nfields of operation; \n \n23. Encourages the Agency to provide increased assistance, in accordance \nwith its mandate, to affected Palestine refugees in the Syrian Arab Republic as well \nas to those who have fled to neighbouring countries, as detailed in the Syrian \nregional crisis response plans, and calls upon donors to urgently ensure sustained \nsupport to the Agency in this regard in the light of the continuing grave \ndeterioration of the situation and the growing needs of the refugees; \n \n24. Welcomes the progress made thus far by the Agency in rebuilding the \nNahr el-Bared refugee camp in northern Lebanon, and calls for donor funding to \nenable the expeditious completion of its reconstruction, for the continued provision \nof relief assistance to those displaced following its destruction in 2007 and for the \nalleviation of their ongoing suffering through the provision of the necessary support \nand financial assistance until the reconstruction of the camp is complete; \n \n25. Encourages the Agency, in close cooperation with other relevant United \nNations entities, to continue to make progress in addressing the needs, rights and \n\nOperations of the United Nations Relief and Works \nAgency for Palestine Refugees in the Near East \nA/RES/72/82\n \n9/10 \n17-22109 \n \nprotection of children, women and persons with disabilities in its operations, \nincluding through the provision of necessary psychosocial and humanitarian \nsupport, in accordance with the Convention on the Rights of the Child, 17 the \nConvention on the Elimination of All Forms of Discrimination against Women18 and \nthe Convention on the Rights of Persons with Disabilities; 19 \n \n26. Also encourages the Agency to continue to reduce the vulnerability and \nimprove the self-reliance and resilience of Palestine refugees through its \nprogrammes; \n \n27. Recognizes the acute protection needs of Palestine refugees across the \nregion, and encourages the Agency\u2019s efforts to contribute to a coordinated and \nsustained response in accordance with international law, including the Agency\u2019s \ndevelopment of its protection framework and function in all field offices, including \nfor child protection; \n \n28. Commends the Agency for its provision of humanitarian and \npsychosocial support and other initiatives that provide recreational, cultural and \neducational activities for children in all fields, including in the Gaza Strip, and, \nrecognizing their positive contribution, calls for full support for such initiatives by \ndonor and host countries and encourages the building and strengthening of \npartnerships to facilitate and enhance the provision of these services; \n \n29. Calls upon Israel, the occupying Power, to comply fully with the \nprovisions of the Geneva Convention relative to the Protection of Civilian Persons \nin Time of War, of 12 August 1949;9 \n \n30. Also calls upon Israel to abide by Articles 100, 104 and 105 of the \nCharter of the United Nations and the Convention on the Privileges and Immunities \nof the United Nations7 in order to ensure the safety of the personnel of the Agency, \nthe protection of its institutions and the safeguarding of the security of its facilities \nin the Occupied Palestinian Territory, including East Jerusalem, at all times; \n \n31. Takes note of the investigations into the incidents affecting the Agency\u2019s \nfacilities during the conflict in the Gaza Strip in July and August 2014, and calls for \nensuring accountability for all violations of international law; \n \n32. Urges the Government of Israel to expeditiously reimburse the Agency \nfor all transit charges incurred and other financial losses sustained as a result of the \ndelays and restrictions on movement and access imposed by Israel; \n \n33. Calls upon Israel particularly to cease obstructing the movement and \naccess of the staff, vehicles and supplies of the Agency and to cease levying taxes, \nextra fees and charges, which affect the Agency\u2019s operations detrimentally; \n \n34. Reiterates its call upon Israel to fully lift the restrictions impeding or \ndelaying the import of necessary construction materials and supplies for the \nreconstruction and repair of thousands of damaged or destroyed refugee shelters, \nand for the implementation of suspended and urgently needed civilian infrastructure \nprojects in refugee camps in the Gaza Strip, noting the alarming figures reflected in \nthe United Nations country team reports of 26 August 2016, entitled \u201cGaza: two \nyears after\u201d and of July 2017, entitled \u201cGaza ten years later\u201d; \n \n35. Requests the Commissioner-General to proceed with the issuance of \nidentification cards for Palestine refugees and their descendants in the Occupied \nPalestinian Territory; \n__________________ \n \n17 United Nations, Treaty Series, vol. 1577, No. 27531. \n \n18 Ibid., vol. 1249, No. 20378. \n \n19 Ibid., vol. 2515, No. 44910. \n\nA/RES/72/82 \nOperations of the United Nations Relief and Works\nAgency for Palestine Refugees in the Near East\n \n17-22109 \n10/10 \n \n \n36. Notes with appreciation the positive contribution of the Agency\u2019s \nmicrofinance and job creation programmes, encourages efforts to enhance the \nsustainability and benefits of microfinance services to a greater number of Palestine \nrefugees, especially in view of the high unemployment rates affecting them, and \nyouth in particular, welcomes the Agency\u2019s efforts to streamline costs and increase \nmicrofinance services through internal reform efforts, and calls upon the Agency, in \nclose cooperation with the relevant agencies, to continue to contribute to the \ndevelopment of the economic and social stability of the Palestine refugees in all \nfields of operation; \n \n37. Reiterates its appeals to all States, the specialized agencies and \nnon-governmental organizations to continue and to augment their contributions to \nthe programme budget of the Agency, to increase their special allocations for grants \nand scholarships for higher education to Palestine refugees and to contribute to the \nestablishment of vocational training centres for Palestine refugees, and requests the \nAgency to act as the recipient and trustee for the special allocations for grants and \nscholarships; \n \n38. Calls upon the Commissioner-General to include, in the annual reporting \nto the General Assembly, assessments on the progress made to remedy the recurrent \nfunding shortfalls of the Agency and ensure sustained, sufficient and predictable \nsupport for the Agency\u2019s operations, including through the implementation of the \nrelevant provisions of the present resolution. \n \n66th plenary meeting  \n7 December 2017 \n \n",
  "paragraphs": {
    "1": "Reaffirms that the effective functioning of the United Nations Relief and Works Agency for Palestine Refugees in the Near East remains essential in all fields of operation;",
    "2": "Expresses its appreciation to the Commissioner-General of the Agency, as well as to all the staff of the Agency, for their tireless efforts and valuable work, particularly in the light of the difficult conditions, instability and crises faced during the past year;",
    "3": "Expresses special commendation to the Agency for the essential role that it has played for more than 65 years since its establishment in providing vital services for the well-being, human development and protection of the Palestine refugees and the amelioration of their plight and for the stability of the region, and affirms the necessity for continuing the work of the Agency and its unimpeded operation and provision of services, pending the just resolution of the question of the Palestine refugees;",
    "4": "Commends the Agency for its extraordinary efforts, in cooperation with other United Nations agencies on the ground, to provide emergency humanitarian assistance, including shelter, food and medical aid, to refugees and affected civilians during and since the military operations in the Gaza Strip in July and August 2014, and recognizes its exemplary capacity to mobilize in emergency situations while continuously carrying out its core human development programmes;",
    "5": "Expresses its appreciation for the important support and cooperation provided by the host Governments to the Agency in the discharge of its duties;",
    "6": "Also expresses its appreciation to the Advisory Commission of the Agency, and requests it to continue its efforts and to keep the General Assembly informed of its activities;",
    "7": "Takes note of the report of the Working Group on the Financing of the United Nations Relief and Works Agency for Palestine Refugees in the Near East 15 and the efforts to assist in ensuring the financial security of the Agency, and requests the Secretary-General to provide the necessary services and assistance to the Working Group for the conduct of its work;",
    "8": "Commends the Agency for its six-year medium-term strategy for 2016\u20132021 and the Commissioner-General for his continuing efforts to increase the budgetary transparency and efficiency of the Agency, as reflected in the Agency\u2019s programme budget for the biennium 2018\u20132019;16",
    "9": "Also commends the Agency for sustaining its robust internal reform efforts, despite difficult operational circumstances, and recognizes its implementation of maximum efficiency procedures to contain expenditures, reduce operational and administrative costs, reduce its funding shortfalls and maximize the use of resources;",
    "10": "Takes note of the report of the Secretary-General on the operations of the United Nations Relief and Works Agency for Palestine Refugees in the Near East 3 and the conclusions and recommendations contained therein;",
    "11": "Appeals to States and organizations for the maintenance of their voluntary contributions to the Agency, as well as an increase in contributions where possible, in particular to the Agency\u2019s programme budget, including in the consideration of their allocation of resources for international human rights, peace and stability, development and humanitarian efforts, to support the Agency\u2019s mandate and its ability to meet the rising needs of the Palestine refugees and essential associated costs of operations;",
    "12": "Appeals to States and organizations not currently contributing to the Agency to urgently consider making voluntary contributions in response to the calls of the Secretary-General for expansion of the Agency\u2019s donor base, in order to stabilize funding and ensure greater sharing of the financial burden of supporting the Agency\u2019s operations, in accordance with the continuing responsibility of the international community as a whole to assist the Palestine refugees;",
    "13": "Calls for the provision by donors of early annual voluntary contributions, less earmarking, and multi-year funding, in line with the Grand Bargain on humanitarian financing announced at the World Humanitarian Summit, held in Istanbul, Turkey, in May 2016, in order to enhance the Agency\u2019s ability to plan and implement its operations with a greater degree of assurance regarding resource flows;",
    "14": "Also calls for the full and timely funding by donors of the Agency\u2019s emergency, recovery and reconstruction programmes as set out in its appeals and response plans;",
    "15": "Requests the Commissioner-General to continue efforts to maintain and increase traditional donor support and to enhance income from non-traditional donors, including through partnerships with public and private entities;",
    "16": "Encourages the Agency to explore financing avenues in relation to the implementation of the Sustainable Development Goals;6",
    "17": "Urges States and organizations to actively pursue partnerships with and innovative support for the Agency, including as recommended in paragraphs 47, 48 and 50 of the report of the Secretary-General, including through the establishment of endowments, trust funds or revolving fund mechanisms and assistance to the Agency to access humanitarian, development and peace and security trust funds and grants;",
    "18": "Welcomes pledges by States and organizations to provide diplomatic and technical support to the Agency, including engagement with international and financial development institutions, including the World Bank and the Islamic Development Bank, and, where appropriate, to facilitate support for the establishment of financing mechanisms that can provide assistance to refugees and in fragile contexts, including to meet the needs of the Palestine refugees, and calls for serious follow-up efforts;",
    "19": "Requests the Agency to continue to implement efficiency measures through its medium-term strategy and the development of a five-year proposal for stabilizing the Agency\u2019s finances, including specific and time-bound measures, and to continue to improve its cost efficiency and resource mobilization efforts;",
    "20": "Calls upon the members of the Advisory Commission and the Working Group on the Financing of the United Nations Relief and Works Agency for Palestine Refugees in the Near East to consider the relevant recommendations in the report of the Secretary-General, including to help the Agency to address resource mobilization challenges and to actively assist the Commissioner-General in the efforts to create sustainable, sufficient and predictable support for the Agency\u2019s operations;",
    "21": "Takes note of the recommendations of the Secretary-General regarding the support provided to the Agency from the regular budget of the United Nations;",
    "22": "Endorses the efforts of the Commissioner-General to continue to provide humanitarian assistance, as far as is practicable, on an emergency basis and as a temporary measure, to persons in the area who are internally displaced and in serious need of continuing assistance as a result of recent crises in the Agency\u2019s fields of operation;",
    "23": "Encourages the Agency to provide increased assistance, in accordance with its mandate, to affected Palestine refugees in the Syrian Arab Republic as well as to those who have fled to neighbouring countries, as detailed in the Syrian regional crisis response plans, and calls upon donors to urgently ensure sustained support to the Agency in this regard in the light of the continuing grave deterioration of the situation and the growing needs of the refugees;",
    "24": "Welcomes the progress made thus far by the Agency in rebuilding the Nahr el-Bared refugee camp in northern Lebanon, and calls for donor funding to enable the expeditious completion of its reconstruction, for the continued provision of relief assistance to those displaced following its destruction in 2007 and for the alleviation of their ongoing suffering through the provision of the necessary support and financial assistance until the reconstruction of the camp is complete;",
    "25": " protection of children, women and persons with disabilities in its operations, including through the provision of necessary psychosocial and humanitarian support, in accordance with the Convention on the Rights of the Child, 17 the Convention on the Elimination of All Forms of Discrimination against Women18 and the Convention on the Rights of Persons with Disabilities; 19",
    "26": "Also encourages the Agency to continue to reduce the vulnerability and improve the self-reliance and resilience of Palestine refugees through its programmes;",
    "27": "Recognizes the acute protection needs of Palestine refugees across the region, and encourages the Agency\u2019s efforts to contribute to a coordinated and sustained response in accordance with international law, including the Agency\u2019s development of its protection framework and function in all field offices, including for child protection;",
    "28": "Commends the Agency for its provision of humanitarian and psychosocial support and other initiatives that provide recreational, cultural and educational activities for children in all fields, including in the Gaza Strip, and, recognizing their positive contribution, calls for full support for such initiatives by donor and host countries and encourages the building and strengthening of partnerships to facilitate and enhance the provision of these services;",
    "29": "Calls upon Israel, the occupying Power, to comply fully with the provisions of the Geneva Convention relative to the Protection of Civilian Persons in Time of War, of 12 August 1949;9",
    "30": "Also calls upon Israel to abide by Articles 100, 104 and 105 of the Charter of the United Nations and the Convention on the Privileges and Immunities of the United Nations7 in order to ensure the safety of the personnel of the Agency, the protection of its institutions and the safeguarding of the security of its facilities in the Occupied Palestinian Territory, including East Jerusalem, at all times;",
    "31": "Takes note of the investigations into the incidents affecting the Agency\u2019s facilities during the conflict in the Gaza Strip in July and August 2014, and calls for ensuring accountability for all violations of international law;",
    "32": "Urges the Government of Israel to expeditiously reimburse the Agency for all transit charges incurred and other financial losses sustained as a result of the delays and restrictions on movement and access imposed by Israel;",
    "33": "Calls upon Israel particularly to cease obstructing the movement and access of the staff, vehicles and supplies of the Agency and to cease levying taxes, extra fees and charges, which affect the Agency\u2019s operations detrimentally;",
    "34": "Reiterates its call upon Israel to fully lift the restrictions impeding or delaying the import of necessary construction materials and supplies for the reconstruction and repair of thousands of damaged or destroyed refugee shelters, and for the implementation of suspended and urgently needed civilian infrastructure projects in refugee camps in the Gaza Strip, noting the alarming figures reflected in the United Nations country team reports of 26 August 2016, entitled \u201cGaza: two years after\u201d and of July 2017, entitled \u201cGaza ten years later\u201d;",
    "35": "Requests the Commissioner-General to proceed with the issuance of identification cards for Palestine refugees and their descendants in the Occupied Palestinian Territory;",
    "36": "Notes with appreciation the positive contribution of the Agency\u2019s microfinance and job creation programmes, encourages efforts to enhance the sustainability and benefits of microfinance services to a greater number of Palestine refugees, especially in view of the high unemployment rates affecting them, and youth in particular, welcomes the Agency\u2019s efforts to streamline costs and increase microfinance services through internal reform efforts, and calls upon the Agency, in close cooperation with the relevant agencies, to continue to contribute to the development of the economic and social stability of the Palestine refugees in all fields of operation;",
    "37": "Reiterates its appeals to all States, the specialized agencies and non-governmental organizations to continue and to augment their contributions to the programme budget of the Agency, to increase their special allocations for grants and scholarships for higher education to Palestine refugees and to contribute to the establishment of vocational training centres for Palestine refugees, and requests the Agency to act as the recipient and trustee for the special allocations for grants and scholarships;",
    "38": "Calls upon the Commissioner-General to include, in the annual reporting to the General Assembly, assessments on the progress made to remedy the recurrent funding shortfalls of the Agency and ensure sustained, sufficient and predictable support for the Agency\u2019s operations, including through the implementation of the relevant provisions of the present resolution."
  },
  "agenda_items": [
    "Item 53"
  ],
  "symbol_references": []
}