{
  "symbol": "A/RES/75/238",
  "filename": "A_RES_75_238.pdf",
  "title": "75/238. Situation of human rights of Rohingya Muslims and other minorities in Myanmar",
  "text": "United Nations \nA/RES/75/238\n \n \nGeneral Assembly \nDistr.: General \n4 January 2021 \n \n21-00004 (E)    060121     \n*2100004* \n \n \nSeventy-fifth session \nAgenda item 72 (c) \nPromotion and protection of human rights: human \nrights situations and reports of special rapporteurs \nand representatives \n \n \n \n \n Resolution adopted by the General Assembly \non 31 December 2020 \n \n \n \n \n[on the report of the Third Committee (A/75/478/Add.3, para. 39)] \n \n \n 75/238. Situation of human rights of Rohingya Muslims and other \nminorities in Myanmar \n \n \n \nThe General Assembly, \n \nGuided by the Charter of the United Nations and the Universal Declaration of \nHuman Rights,1 the International Covenants on Human Rights2 and other relevant \ninternational law and human rights law instruments, \n \nRecalling that States have the primary responsibility to respect, protect and fulfil \nhuman rights, \n \nReaffirming its previous resolutions on the situation of human rights in \nMyanmar, the most recent of which being resolutions 74/246 of 27 December 2019, \n73/264 of 22 December 2018 and 72/248 of 24 December 2017, and recalling the \nresolutions and decisions of the Human Rights Council, the most recent of which \nbeing resolutions 43/26 of 22 June 2020,3 42/3 of 26 September 2019,4 39/2 of \n27 September 2018,5 37/32 of 23 March 20186 and S-27/1 of 5 December 2017,7 the \npresidential statement issued by the Security Council on 6 November 2017 8 and the \n__________________ \n \n1  Resolution 217 A (III). \n \n2  Resolution 2200 A (XXI). \n \n3  Official Records of the General Assembly, Seventy-fifth Session, Supplement No. 53 (A/75/53), \nchap. IV, sect. A. \n \n4  Ibid., Seventy-fourth Session, Supplement No. 53A (A/74/53/Add.1), chap. II. \n \n5  Ibid., Seventy-third Session, Supplement No. 53A (A/73/53/Add.1), chap. II. \n \n6  Ibid., Supplement No. 53 (A/73/53), chap. IV, sect. A. \n \n7  Ibid., chap. III. \n \n8  S/PRST/2017/22; see Resolutions and Decisions of the Security Council, 2017 (S/INF/72). \n\nA/RES/75/238 \nSituation of human rights of Rohingya Muslims and other \nminorities in Myanmar\n \n21-00004\n2/12 \n \nSecurity Council press statement of 9 May 2018,9 as well as Security Council \nresolution 2467 (2019) of 23 April 2019, \n \nWelcoming the work and the reports of the Special Rapporteur on the situation \nof human rights in Myanmar, while deeply regretting the non-cooperation of the \nGovernment of Myanmar with the mandate, and urging the Government of Myanmar \nto extend full cooperation to the newly appointed Special Rapporteur, \n \nWelcoming also the work of the Special Envoy of the Secretary-General on \nMyanmar, and encouraging her further engagement and dialogue with the \nGovernment of Myanmar and all other relevant stakeholders, including civil society, \nand affected populations, \n \nWelcoming further the report of the United Nations High Commissioner for \nHuman Rights on the root causes of the human rights violations and abuses the \nRohingya and other minorities in Myanmar are facing, and reiterating the importance \nof fully implementing the recommendations contained in the report, \n \nWelcoming the work done by the independent international fact-finding mission \non Myanmar, including its final report10 and all its other reports, including the reports \non the economic interests of the Myanmar military and on sexual and gender-based \nviolence in Myanmar and the gendered impact of its ethnic conflicts, and furthermore \ndeeply regretting the lack of cooperation of the Government of Myanmar with the \nfact-finding mission, \n \nAlarmed by the findings of the independent international fact-finding mission \non Myanmar of evidence of gross human rights violations and abuses suffered by \nRohingya Muslims and other minorities, perpetrated by the security and armed forces \nof Myanmar, which, according to the fact-finding mission, undoubtedly amount to the \ngravest crimes under international law, \n \nExpressing deep concern at the limited progress on the fact-finding mission\u2019s \nrecommendations to conduct prompt, effective, thorough, independent and impartial \ninvestigations and to hold perpetrators accountable for crimes committed across \nMyanmar, \n \nConcerned that, contrary to the fact-finding mission\u2019s recommendations, laws, \norders, policies and practices at all levels of Government limiting freedoms of \nmovement, expression, association and assembly, or which are discriminatory in their \napplication or impact, have not been reviewed, amended or repealed, \n \nWelcoming the work of the Independent Mechanism for Myanmar, established \nby the Human Rights Council in its resolution 39/2, to collect, consolidate, preserve \nand analyse evidence of the most serious international crimes and violations of \ninternational law committed in Myanmar since 2011, in particular in Rakhine, Kachin \nand Shan States, making use of the information handed over by the independent \ninternational fact-finding mission, and to prepare files in order to facilitate and \nexpedite fair and independent criminal proceedings, in accordance with international \nlaw standards, in national, regional or international courts or tribunals that have, or \nmay in the future have, jurisdiction over these crimes, in accordance with \ninternational law, \n \nWelcoming also the second report of the Independent Mechanism for Myanmar, \nestablished by the Human Rights Council in its resolution 39/2, to the General \nAssembly,11 \n__________________ \n \n9  SC/13331. \n \n10  A/HRC/42/50. \n \n11  A/HRC/45/60. \n\nSituation of human rights of Rohingya Muslims and other \nminorities in Myanmar \nA/RES/75/238\n \n3/12\n21-00004 \n \n \nRecognizing the complementary and mutually reinforcing work of the various \nUnited Nations mandate holders and mechanisms, including international justice and \naccountability mechanisms working on Myanmar to improve the situation of human \nrights in Myanmar, \n \nRecognizing also the importance of the role of regional organizations in efforts \nto achieve pacific settlement of local disputes, as stipulated in Chapter VIII of the \nCharter, while noting that such efforts do not preclude action under Chapter VI of the \nCharter, \n \nAcknowledging the efforts of the Organization of Islamic Cooperation, \nalongside relevant international efforts, aimed at bringing peace and stability to \nRakhine State, including through the work of its Secretary-General\u2019s special envoy \nfor Myanmar, \n \nWelcoming the report of the Secretary-General,12 \n \nTaking note of the ongoing processes to ensure justice and accountability in \nrespect of alleged crimes committed against Rohingya Muslims and other minorities \nin Myanmar, \n \nNoting that the International Criminal Court has authorized its Prosecutor to \ninvestigate alleged crimes within the Court\u2019s jurisdiction related to the situation in \nBangladesh/Myanmar, \n \nWelcoming the order of the International Court of Justice of 23 January 2020 \nindicating provisional measures in the case lodged by the Gambia against Myanmar \non the application of the Convention on the Prevention and Punishment of the Crime \nof Genocide,13 which concluded that, prima facie, the Court had jurisdiction to deal \nwith the case, which found that the Rohingya in Myanmar appeared to constitute a \n\u201cprotected group\u201d within the meaning of article 2 of the Convention, and that there \nwas a real and imminent risk of irreparable prejudice to the rights of the Rohingya in \nMyanmar, and taking note that Myanmar submitted its report in response to the \nCourt\u2019s order on 22 May 2020, and measures adopted in this regard, \n \nNoting the publication of the executive summary of the report of the \nIndependent Commission of Enquiry established by the Government of Myanmar in \n2018, which, notwithstanding its limitations, acknowledges that war crimes, serious \nhuman rights violations and violations of domestic law had been committed by \nmultiple actors and that there were reasonable grounds to believe that members of \nMyanmar security forces were involved, \n \nCondemning all violations and abuses of human rights in Myanmar, including \nagainst Rohingya Muslims and other minorities, in particular in Rakhine, Chin, \nKachin and Shan States, and expressing deep concern at the reports of ongoing human \nrights violations, as also noted by the United Nations High Commissioner for Human \nRights, \n \nReiterating its deep concern at the violence between the Myanmar armed forces \nand the Arakan Army in Rakhine and Chin States, the continuing forced displacement \nof civilians, including of ethnic minorities, the recruitment and use of children, \nabductions, arbitrary detentions and killings, and the use of facilities functioning as \nschools for military purposes and for committing crimes, as well as reports of \nviolations and abuses of human rights, including those involving the use of landmines, \nmaking conditions unsuitable for the voluntary, safe, dignified and sustainable return \nof all refugees and forcibly displaced persons, including Rohingya, \n__________________ \n \n12  A/75/295. \n \n13  Resolution 260 A (III), annex. \n\nA/RES/75/238 \nSituation of human rights of Rohingya Muslims and other \nminorities in Myanmar\n \n21-00004\n4/12 \n \n \nReiterating the urgent need to ensure that all those responsible for crimes related \nto violations and abuses of international law throughout Myanmar, including \ninternational human rights law, international humanitarian law and international \ncriminal law, are held to account through credible and independent national, regional \nor international justice mechanisms, while recalling the authority of the Security \nCouncil in this regard, \n \nExpressing deep concern at the reports of violence by the Tatmadaw, which \ndisproportionately affects the Rohingya civilians in Rakhine State, where schools, \nreligious sites and homes have been targeted, \n \nContinuing to underline the need for the security and armed forces of Myanmar \nand other armed groups to cease all actions that run counter to the protection of all \npersons within the country, including those belonging to the Rohingya community, by \nrespecting international law, including international human rights law and \ninternational humanitarian law, and ending the violence, including sexual violence, \nand calling for urgent steps to ensure justice in respect of all human rights violations \nand violations of international humanitarian law so that those displaced by violence \nare able to voluntarily return in safety and dignity to their places of origin or to a \nplace of their choice in a sustainable manner, \n \nAlarmed at the continued attacks on humanitarian actors, and calling for all sides \nto abide by international law in this matter, \n \nReiterating its deep distress at reports that unarmed individuals in Rakhine State \nhave been and continue to be subjected to the excessive use of force and violations of \nhuman rights and international humanitarian law by the military and security and \narmed forces, including extrajudicial, summary or arbitrary killings, systematic rape \nand other forms of sexual and gender-based violence, arbitrary detention, enforced \ndisappearance and government seizure of Rohingya lands from which Rohingya \nMuslims were evicted and their homes destroyed, and remaining concerned by the \nprevious large-scale destruction of homes and systematic evictions in northern \nRakhine State, including the use of arson and violence, as well as the unlawful use of \nforce by non-State actors, \n \nExpressing concern that, in northern Rakhine State, the implementation of \npolicies under the guise of economic development and reconstruction by the \nGovernment of Myanmar and the heavy militarization of the area have resulted in the \nalteration of the demographic structure, which further prevents the members of the \ndisplaced Rohingya Muslim population from returning to Rakhine State, \n \nRecalling the Secretary-General\u2019s call for a global ceasefire, as supported by \nSecurity Council resolution 2532 (2020) of 1 July 2020, and regretting that the \nMyanmar armed forces and the Arakan Army have not succeeded to date in \nestablishing a bilateral ceasefire in conflict areas in Rakhine and Chin States, while \nstressing the need for continued de-escalation and an enduring ceasefire throughout \nthe whole country, best achieved by dialogue between all parties, and encouraging \nthem to announce a new ceasefire, \n \nWelcoming the organization of the fourth session of the Union Peace Conference \nin August 2020, while calling upon the Government of Myanmar and non-State armed \ngroups to accelerate progress in the peace process, \n \nReiterating its grave concern that, in spite of the fact that Rohingya Muslims \nlived in Myanmar for generations prior to the independence of Myanmar, held full \ndocumentation and participated actively in government and civic life, they were made \nstateless by the enactment of the 1982 Citizenship Law and were eventually \ndisenfranchised, from 2015, from the electoral process, \n\nSituation of human rights of Rohingya Muslims and other \nminorities in Myanmar \nA/RES/75/238\n \n5/12\n21-00004 \n \n \nReaffirming that the denial of citizenship status and related rights to Rohingya \nMuslims and other minorities, including voting rights, is a serious human rights \nconcern, \n \nRe-emphasizing the right of all refugees and the importance of internally \ndisplaced persons being able to return home and that such returns should be in safety \nand dignity and in a voluntary and sustainable manner, \n \nExpressing concern at the recent increase in the irregular maritime movement \nof Rohingya, risking their lives in perilous conditions at the hands of exploitative \nsmugglers, which highlights their desperate situation and the urgent need to address \nthe root causes of their plight, \n \nAlarmed by the continued influx to Bangladesh over the last four decades of \n1.1 million Rohingya Muslims from Myanmar, including the 860,000 currently living \nthere, most of whom arrived since 25 August 2017 in the aftermath of atrocities \ncommitted by the security and armed forces of Myanmar, \n \nNoting the extension for one year of the memorandum of understanding between \nMyanmar and the United Nations Development Programme and the Office of the \nUnited Nations High Commissioner for Refugees on assistance in the repatriation \nprocess of displaced persons from Rakhine State, and calling upon Myanmar to grant \nUnited Nations agencies unfettered access to northern Rakhine State so that they can \ncarry out this assistance, \n \nRecalling some steps taken by the Government of Myanmar to create the \nconditions necessary for refugees and other forcibly displaced persons to return to \ntheir places of origin or to a place of their choice voluntarily, in safety and dignity, \nbut regretting, however, that the situation has not improved in Rakhine State to create \nthe conditions necessary for refugees and other forcibly displaced persons to return \nto their places of origin voluntarily, safely and with dignity, \n \nReiterating its deep concern over the continued spread of false news, hate \nspeech and inflammatory rhetoric, in particular through social media, not fully \naddressed by the authorities of Myanmar, \n \nUnderlining the urgency of the call by the Secretary-General for increased \nefforts to implement the recommendations of the Advisory Commission on Rakhine \nState, to address the root causes of the crisis, including those on access to citizenship \nfor the Rohingya, freedom of movement, the elimination of systematic segregation \nand all forms of discrimination, and inclusive and equal access to health services and \neducation, and birth registration, in full consultation with members of all ethnic and \nminority groups and persons in vulnerable situations, including on matters of \ncitizenship for the Rohingya people, \n \nWelcoming the commitment of the Secretary-General to implementing the \nrecommendations made by the independent inquiry into the involvement of the United \nNations in Myanmar from 2010 to 2018, \n \nReiterating its urgent call upon the Government of Myanmar to sustain the \ndemocratic transition of Myanmar, including by working towards bringing all \nnational institutions, including the military, under the democratically elected civilian \nGovernment, \n \nInviting the Government of Myanmar to learn from the challenges of holding \nthe 2020 election and create an ongoing system to ensure free, fair, credible, inclusive \nand transparent elections, ensuring equal opportunity for the representation and the \nfull, equal and meaningful participation of the Rohingya, other minorities and \ninternally displaced persons, candidates and voters and that all people of Myanmar \nare able to cast their vote, allowing all candidates to contest elections fairly, \n\nA/RES/75/238 \nSituation of human rights of Rohingya Muslims and other \nminorities in Myanmar\n \n21-00004\n6/12 \n \n \nWelcoming the dialogue between the Government of Myanmar and the United \nNations on addressing children and armed conflict as well as conflict-related sexual \nand gender-based violence in Myanmar, and the Myanmar National Human Rights \nCommission Strategic Plan (2020\u20132024), \n \nWelcoming also the establishment by the Government of Myanmar of a \ncommittee for the prevention of grave violations against children in armed conflict, \nlooking forward to its concrete results, including the development of a joint action \nplan to end and prevent further killing and maiming of children and rape and other \nforms of sexual violence against children, and welcoming the ratification of the \nOptional Protocol to the Convention on the Rights of the Child on the involvement of \nchildren in armed conflict,14 and calling all parties to end violations against children \nin armed conflict, \n \nCommending the ongoing humanitarian efforts and commitments that the \nGovernment of Bangladesh, in cooperation with United Nations agencies and the \ninternational community, including all humanitarian actors, has extended to those \nfleeing human rights violations and abuses in Myanmar, \n \nWelcoming the involvement of the Association of Southeast Asian Nations in \naddressing the situation in Rakhine State, including through carrying out \nhumanitarian assessments in northern Rakhine State through its Coordinating Centre \nfor Humanitarian Assistance on Disaster Management in May 2019, and its \nestablishment of an ad hoc support team to implement the recommendations of the \npreliminary needs assessment of repatriation conditions in Rakhine State, recognizing \nthe need for closer engagement with the Rohingya refugee community, while \nencouraging close cooperation with all relevant United Nations agencies and \ninternational partners to address the root causes of the conflict, so that affected \ncommunities can rebuild their lives there, \n \nNoting with concern the exacerbation of the existing humanitarian situation and \nthe negative impact on the human rights situation in Myanmar, including access to \neducation, following the global coronavirus disease (COVID-19) pandemic, stressing \nthat measures to address the COVID-19 pandemic must be targeted, necessary, \ntransparent, non-discriminatory, time-bound, proportionate and in accordance with \nobligations under applicable international human rights law, \n \nRecognizing the efforts of the Government of Myanmar to contain the spread of \nthe COVID-19 virus and to balance the severe socioeconomic effects of the pandemic \nby setting up a COVID-19 economic relief plan and providing financial assistance to \npeople especially affected by the crisis, while expressing its concern that the capacity \nof humanitarian and development actors to implement their programmes has been \nsignificantly reduced at a time when vulnerable parts of the population are in \nparticular need of assistance and that, therefore, resources may be shifted away from \nMyanmar, and stressing the need to ensure access to COVID-19-related information, \nsupplies and medical services, \n \n1. \nExpresses grave concern at continuing reports of serious human rights \nviolations and abuses by the military and security forces as well as violations of \ninternational humanitarian law in Myanmar against Rohingya and other minorities, in \nparticular in Kachin, Rakhine, southern Chin and Shan States, including those \ninvolving arbitrary arrests, deaths in detention, torture and other cruel, inhuman or \ndegrading treatment or punishment, deliberate killing and maiming of children, \nrecruitment and use of children for forced labour, indiscriminate shelling in civilian \nareas, destruction and burning of homes, deprivation of economic and social rights, \nthe forced displacement of over 860,000 Rohingya and other minorities to \n__________________ \n \n14  United Nations, Treaty Series, vol. 2173, No. 27531. \n\nSituation of human rights of Rohingya Muslims and other \nminorities in Myanmar \nA/RES/75/238\n \n7/12\n21-00004 \n \nBangladesh, rape, sexual slavery and other forms of sexual and gender-based \nviolence, as well as restrictions on exercising the rights to freedom of religion or \nbelief, expression and peaceful assembly, and restrictions on media freedom and full \nInternet access and other restrictions; \n \n2. \nStrongly condemns all violations and abuses of human rights in Myanmar, \nand emphasizes the importance of conducting international, independent, fair and \ntransparent investigations into the gross human rights violations in Myanmar, \nincluding sexual and gender-based violence and violations and abuses against women \nand children, and of holding accountable all those responsible for brutal acts and \ncrimes against all persons, including Rohingya, in order to deliver justice to victims \nusing all legal instruments and domestic, regional and international judicial \nmechanisms, including the International Court of Justice and the International \nCriminal Court, as applicable; \n \n3. \nCalls upon the security and armed forces of Myanmar and other armed \ngroups, in particular in Rakhine, Chin and Shan States, to heed the Secretary-\nGeneral\u2019s calls for a global ceasefire, end all hostilities and address grievances \nthrough political dialogue; \n \n4. \nTakes note of the order of the International Court of Justice of 23 January \n2020 indicating provisional measures, and urges the Government of Myanmar, in \naccordance with the Court\u2019s order in relation to members of the Rohingya in its \nterritory, to take all measures within its power to prevent the commission of all acts \nwithin the scope of article 2 of the Convention on the Prevention and Punishment of \nthe Crime of Genocide, to ensure that its military and any irregular armed units that \nmay be directed or supported by it and any organizations and persons that may be \nsubject to its control, direction or influence do not commit, inter alia, any such acts, \nto prevent the destruction and ensure the preservation of evidence and to report to the \nCourt as ordered on all measures taken to give effect to the order; \n \n5. \nExpresses grave concern about the ongoing restrictions on humanitarian \naccess in all conflict areas, in particular in Rakhine and Chin States, as well as the \nlimited steps taken to ensure access to health care for the Rohingya, particularly in \nthe time of COVID-19, and urges the Government of Myanmar to cooperate fully \nwith and to grant full, unrestricted and unmonitored access to all United Nations \nmandate holders and human rights mechanisms, including the Special Rapporteur on \nthe situation of human rights in Myanmar, the United Nations country task force on \nmonitoring and reporting grave violations committed against children, the \nIndependent Mechanism for Myanmar, established by the Human Rights Council in \nits resolution 39/2, and relevant United Nations agencies and international and \nregional human rights bodies to independently monitor the situation of human rights \nand to ensure that individuals can cooperate without hindrance with these mechanisms \nand without fear of reprisal, intimidation or attack, and expresses deep concern that \ninternational access to affected areas of northern Rakhine State remains severely \nrestricted for the international community, including for United Nations agencies, \nhumanitarian actors and international media; \n \n6. \nCalls upon the United Nations to ensure that the Independent Mechanism \nfor Myanmar, as established by the Human Rights Council in its resolution 39/2, is \nafforded the flexibility that it needs in terms of staffing, location and operational \nfreedom so that it can deliver as effectively as possible on its mandate, and urges \nMyanmar, Member States, judicial authorities and private entities to cooperate fully \nwith the Mechanism, including by granting it access and by providing it with every \nassistance in the execution of its mandate; \n \n7. \nExpresses grave concern at the potential retraumatization of survivors of \nhuman rights violations and abuses, particularly child survivors and sexual violence \n\nA/RES/75/238 \nSituation of human rights of Rohingya Muslims and other \nminorities in Myanmar\n \n21-00004\n8/12 \n \nsurvivors, and calls upon all actors engaging in documentation to follow the \u201cdo no \nharm\u201d principle for evidence-gathering in order to respect the dignity of survivors \nand to avoid retraumatization, and calls upon Myanmar to fully address the needs of \nvictims and survivors and their right to effective remedy, including through prompt, \neffective and independent casualty recording and guarantees of non-recurrence; \n \n8. \nReiterates the urgent call upon the Government of Myanmar: \n \n(a) \nTo end immediately all violence and all violations of international law in \nMyanmar, to ensure the protection of the human rights of all persons in Myanmar, \nincluding of Rohingya and persons belonging to other minorities, and to take all \nmeasures necessary to provide justice to victims, to ensure full accountability and to \nend impunity for all violations and abuses of human rights law and violations of \ninternational humanitarian law, starting with a full, transparent and independent \ninvestigation into reports of all these violations, and calls upon the President of \nMyanmar to release the report of the Independent Commission of Enquiry established \nby the Government of Myanmar in 2018 in full or to share its findings with relevant \ninternational mechanisms; \n \n(b) \nTo manifest clear political will supported by concrete actions for the safe, \ndignified, voluntary and sustainable return and reintegration of Rohingya Muslims in \nMyanmar; \n \n(c) \nTo create the conditions necessary for the safe, voluntary, dignified and \nsustainable return of all refugees, including Rohingya Muslim refugees, particularly \nin view of the fact that not a single Rohingya so far has returned through a bilaterally \nset up mechanism for repatriation between Bangladesh and Myanmar owing to the \nfailure of the Government of Myanmar to create such conditions in Rakhine State; \n \n(d) \nTo build trust among Rohingya Muslims in camps in Bangladesh through \nconfidence-building measures, including direct communication between the Rohingya \nrepresentatives and the Myanmar authorities and by arranging \u201cgo and see\u201d visits to \nRakhine State by Rohingya representatives; \n \n(e) \nTo ensure full protection of the human rights and fundamental freedoms \nof all persons in Myanmar, including Rohingya Muslims and other minorities, in an \nequal, non-discriminatory and dignified manner, in order to prevent further instability \nand insecurity, alleviate suffering, address the root causes of the crisis, including by \nrepealing or reforming discriminatory legislation, and forge a viable, lasting and \ndurable solution; \n \n(f) \nTo fulfil its human rights obligations and commitments to protect the right \nto freedom of expression, including online, and the rights to freedom of association \nand peaceful assembly, to create and maintain a safe and enabling environment for \ncivil society and independent media; \n \n(g) \nTo take the measures necessary to address the spread of discrimination and \nprejudice and to combat the incitement of hatred against Rohingya Muslims and \npersons belonging to other minorities, and to publicly condemn such acts and combat \nhate speech, while fully respecting international human rights law, as well as to \npromote interfaith dialogue in cooperation with the international community and \nencourage political and religious leaders in the country to work towards reconciliation \namong communities and national unity through dialogue, and to implement the \nPeacebuilding Fund project to address hate speech; \n \n(h) \nTo ensure an inclusive COVID-19 response to protect all persons and \ncommunities, in line with international humanitarian law and human rights law, \nincluding the Rohingya Muslims and other minorities; \n\nSituation of human rights of Rohingya Muslims and other \nminorities in Myanmar \nA/RES/75/238\n \n9/12\n21-00004 \n \n \n(i) \nTo expedite efforts to eliminate statelessness and the systematic and \ninstitutionalized discrimination against members of ethnic and religious minorities, \nin particular relating to Rohingya Muslims, by, inter alia, reviewing and reforming \nthe 1982 Citizenship Law, which has led to deprivation of human rights, by ensuring \nequal access to full citizenship through a transparent, voluntary and accessible \nprocedure and to all civil and political rights, by allowing for self-identification, by \namending or repealing all discriminatory legislation and policies, including \ndiscriminatory provisions of the set of \u201cprotection of race and religion laws\u201d enacted \nin 2015 covering religious conversion, interfaith marriage, monogamy and population \ncontrol, and by lifting all local orders restricting rights to freedom of movement and \naccess to civil registration, health and education services and livelihoods; \n \n(j) \nTo dismantle the camps for internally displaced persons in Rakhine State \nwith a clear timeline and without further delay, ensuring that the return and relocation \nof internally displaced persons is carried out in accordance with international \nstandards and best practices, in cooperation with the United Nations and the \ninternational community, including as set forth in the Guiding Principles on Internal \nDisplacement;15 \n \n(k) \nTo accelerate full implementation of all the recommendations of the \nAdvisory Commission on Rakhine State to address the root causes of the crisis; \n \n(l) \nTo establish an ongoing system to ensure the conduct of free, fair, credible, \ninclusive and transparent general elections that enables unimpeded participation of \nall irrespective of ethnic or religious identity or status, including Rohingya Muslims \nand other minorities; \n \n(m) To continue its collaboration with the United Nations to implement the \nremaining gaps in the joint action plan to end and prevent the recruitment and use of \nchildren by all armed forces, including by the Tatmadaw, and to address protection \ngaps by engaging with the task force on monitoring and reporting grave violations \ncommitted against children to develop a joint action plan on killing and maiming and \nrape and other forms of sexual violence committed against children, while taking note \nof the ratification by Myanmar of the Optional Protocol to the Convention on the \nRights of the Child on the involvement of children in armed conflict; \n \n(n) \nTo cooperate and engage meaningfully with the newly appointed Special \nRapporteur on the situation of human rights in Myanmar, the Independent Mechanism \nand other United Nations mandate holders and mechanisms working on Myanmar, \nincluding by facilitating visits and granting unrestricted access throughout the \ncountry; \n \n(o) \nTo take concrete steps to strengthen institution-building and structural \nreforms to uphold the rule of law, human rights and democratic principles, through a \nparticipatory and inclusive approach, including efforts to ensure the independence of \nthe judiciary, and by reforming the security sector to enhance civilian control; \n \n(p) \nTo conduct independent, impartial and thorough investigations into all \nallegations of violations of international humanitarian law, including into conduct that \nmay constitute war crimes and crimes against humanity in Rakhine and Chin States, \ncrimes of sexual violence and allegations of human rights violations, and ensure that \nthe perpetrators are brought to justice through transparent and credible processes; \n \n(q) \nTo continue to ensure access to COVID-19 pandemic-related information, \nsupplies and health-care services to all, in a targeted, necessary, transparent, \n__________________ \n \n15  E/CN.4/1998/53/Add.2, annex. \n\nA/RES/75/238 \nSituation of human rights of Rohingya Muslims and other \nminorities in Myanmar\n \n21-00004\n10/12 \n \nnon-discriminatory, time-bound, proportionate manner and in accordance with \nobligations under applicable international human rights law; \n \n9. \nEncourages the Government of Myanmar to consider acceding to \ninternational human rights conventions; \n \n10. Underscores the importance of providing protection and assistance, \nincluding non-discriminatory access to services such as medical and psychosocial \ncare, specifically tailored to women and girls, especially those who are victims of \nsexual and gender-based violence and human trafficking; \n \n11. \nReiterates its deep concern at the continued plight of Rohingya and \nforcibly displaced persons living in Bangladesh and in other countries, and \nappreciates the commitment by the Government of Bangladesh to provide temporary \nshelter, humanitarian assistance and protection to them; \n \n12. Commends the Government of Bangladesh for containing the spread of the \nCOVID-19 virus in the Rohingya camps effectively since the beginning of the \npandemic and avoiding loss of life with the support of all relevant national and \ninternational partners, including the host community; \n \n13. Encourages Myanmar to continue to work with Bangladesh, in line with \nthe bilateral instruments on repatriation signed by Bangladesh and Myanmar, in order \nto expedite the creation of a conducive environment for the voluntary, safe, dignified \nand sustainable return of the forcibly displaced Rohingya in Bangladesh, with the full \nsupport and meaningful involvement of the international community, including the \nUnited Nations and its funds, programmes and agencies, and stresses the importance \nof meaningfully engaging with civil society; \n \n14. Recognizes with appreciation the assistance and support of the \ninternational community, including regional organizations, in particular the \nAssociation of Southeast Asian Nations, and the countries neighbouring Myanmar, \nand calls upon the international community to continue to support the Government of \nMyanmar in the fulfilment of its international human rights obligations and \ncommitments, the implementation of its democratic transition process, inclusive \nsocioeconomic development and sustainable peace, as well as its national \nreconciliation process involving all relevant stakeholders; \n \n15. Calls upon the international community to effectively address increasing \nirregular maritime movements of Rohingya, in cooperation with the relevant United \nNations agencies, as well as ensure international burden- and responsibility-sharing, \nespecially by the States parties to the 1951 Convention relating to the Status of \nRefugees;16 \n \n16. Welcomes the recent extension for one year of the memorandum of \nunderstanding between the Government of Myanmar, the United Nations \nDevelopment Programme and the Office of the United Nations High Commissioner \nfor Refugees to associate them to the implementation of bilateral arrangements with \nBangladesh on the return of displaced persons from Rakhine State, and emphasizes \nthe need for the Government of Myanmar to continue to cooperate fully with the \nGovernment of Bangladesh and with the United Nations, in particular the Office of \nthe United Nations High Commissioner for Refugees, and in consultation with the \npopulations concerned to enable the safe, voluntary, dignified, sustainable and well-\ninformed return of all refugees and forcibly displaced persons and internally displaced \npersons to their places of origin in Myanmar, and to give returnees freedom of \n__________________ \n \n16  United Nations, Treaty Series, vol. 189, No. 2545. \n\nSituation of human rights of Rohingya Muslims and other \nminorities in Myanmar \nA/RES/75/238\n \n11/12\n21-00004 \n \nmovement and unimpeded access to livelihoods, social services, including health \nservices, education and shelter, and to compensate them for all losses; \n \n17. Calls for the prompt implementation of the memorandum of understanding \nsigned by the Office of the United Nations High Commissioner for Refugees and the \nUnited Nations Development Programme with the Government of Myanmar in 2018, \nas extended in 2019 and 2020, to support the creation of conditions for the return of \nrefugees from Bangladesh; \n \n18. Encourages the international community to (a) assist Bangladesh in \nproviding humanitarian assistance to Rohingya refugees and forcibly displaced \npersons until such time as they are voluntarily repatriated to Myanmar in safety and \ndignity; and (b) assist Myanmar in the provision of humanitarian assistance to \naffected persons of all communities who have been internally displaced, including \nthose in camps for internally displaced persons within Rakhine State; \n \n19. Urges the international community to support the 2020 joint response plan \nfor the Rohingya humanitarian crisis to ensure adequate resources for addressing the \nhumanitarian crisis; \n \n20. Encourages all business enterprises, including transnational corporations \nand domestic enterprises operating in Myanmar, to respect human rights in \naccordance with the Guiding Principles on Business and Human Rights17 and the \nrecommendations made by the independent international fact-finding mission in its \nreport on the economic interests of the Myanmar military; \n \n21. Requests the Secretary-General: \n \n(a) \nTo continue to provide his good offices and to pursue his discussions \nrelating to Myanmar, involving all relevant stakeholders, and to offer assistance to \nthe Government of Myanmar; \n \n(b) \nTo extend the appointment of the Special Envoy on Myanmar and submit \nthe report of the Special Envoy covering all relevant issues addressed in the present \nresolution to the General Assembly at its seventy-sixth session; \n \n(c) \nTo provide all assistance necessary to enable the Special Envoy on \nMyanmar to effectively discharge her mandate and to report to Member States every \nsix months, or as warranted by the situation on the ground; \n \n(d) \nTo identify ways in which the existing mandates can more effectively \ndeliver in their respective areas of responsibility concerning Myanmar and can \ncomplement each other\u2019s work through enhanced coordination; \n \n(e) \nTo ensure that all in-country programmes incorporate a human rights-\nbased approach and undergo due diligence processes; \n \n(f) \nTo call the continued attention of the Security Council to the situation in \nMyanmar with concrete recommendations for action towards resolving the \nhumanitarian crisis, promoting the safe, dignified, voluntary and sustainable return of \nRohingya refugees and forcibly displaced persons and ensuring accountability for \nthose responsible for mass atrocities and human rights violations and abuses; \n \n(g) \nTo support the implementation of the recommendations of the independent \ninternational fact-finding mission on Myanmar and assisting the work of the ongoing \nIndependent Mechanism; \n__________________ \n \n17  A/HRC/17/31, annex. \n\nA/RES/75/238 \nSituation of human rights of Rohingya Muslims and other \nminorities in Myanmar\n \n21-00004\n12/12 \n \n \n(h) \nTo fully implement the recommendations contained in the report of the \nindependent inquiry into the involvement of the United Nations in Myanmar from \n2010 to 2018; \n \n22. Requests that the Special Envoy continue to participate by way of \ninteractive dialogue in the seventy-sixth session of the General Assembly; \n \n23. Decides to remain seized of the matter, inter alia, on the basis of the reports \nof the Secretary-General, the independent international fact-finding mission on \nMyanmar, the Independent Mechanism, the Special Rapporteur on the situation of \nhuman rights in Myanmar and the Special Envoy of the Secretary-General on \nMyanmar. \n \n48th (resumed) plenary meeting \n31 December 2020 \n \n \n",
  "paragraphs": {
    "1": "Expresses grave concern at continuing reports of serious human rights violations and abuses by the military and security forces as well as violations of international humanitarian law in Myanmar against Rohingya and other minorities, in particular in Kachin, Rakhine, southern Chin and Shan States, including those involving arbitrary arrests, deaths in detention, torture and other cruel, inhuman or degrading treatment or punishment, deliberate killing and maiming of children, recruitment and use of children for forced labour, indiscriminate shelling in civilian areas, destruction and burning of homes, deprivation of economic and social rights, the forced displacement of over 860,000 Rohingya and other minorities to Bangladesh, rape, sexual slavery and other forms of sexual and gender-based violence, as well as restrictions on exercising the rights to freedom of religion or belief, expression and peaceful assembly, and restrictions on media freedom and full Internet access and other restrictions;",
    "2": "Strongly condemns all violations and abuses of human rights in Myanmar, and emphasizes the importance of conducting international, independent, fair and transparent investigations into the gross human rights violations in Myanmar, including sexual and gender-based violence and violations and abuses against women and children, and of holding accountable all those responsible for brutal acts and crimes against all persons, including Rohingya, in order to deliver justice to victims using all legal instruments and domestic, regional and international judicial mechanisms, including the International Court of Justice and the International Criminal Court, as applicable;",
    "3": "Calls upon the security and armed forces of Myanmar and other armed groups, in particular in Rakhine, Chin and Shan States, to heed the Secretary- General\u2019s calls for a global ceasefire, end all hostilities and address grievances through political dialogue;",
    "4": "Takes note of the order of the International Court of Justice of 23 January 2020 indicating provisional measures, and urges the Government of Myanmar, in accordance with the Court\u2019s order in relation to members of the Rohingya in its territory, to take all measures within its power to prevent the commission of all acts within the scope of article 2 of the Convention on the Prevention and Punishment of the Crime of Genocide, to ensure that its military and any irregular armed units that may be directed or supported by it and any organizations and persons that may be subject to its control, direction or influence do not commit, inter alia, any such acts, to prevent the destruction and ensure the preservation of evidence and to report to the Court as ordered on all measures taken to give effect to the order;",
    "5": "Expresses grave concern about the ongoing restrictions on humanitarian access in all conflict areas, in particular in Rakhine and Chin States, as well as the limited steps taken to ensure access to health care for the Rohingya, particularly in the time of COVID-19, and urges the Government of Myanmar to cooperate fully with and to grant full, unrestricted and unmonitored access to all United Nations mandate holders and human rights mechanisms, including the Special Rapporteur on the situation of human rights in Myanmar, the United Nations country task force on monitoring and reporting grave violations committed against children, the Independent Mechanism for Myanmar, established by the Human Rights Council in its resolution 39/2, and relevant United Nations agencies and international and regional human rights bodies to independently monitor the situation of human rights and to ensure that individuals can cooperate without hindrance with these mechanisms and without fear of reprisal, intimidation or attack, and expresses deep concern that international access to affected areas of northern Rakhine State remains severely restricted for the international community, including for United Nations agencies, humanitarian actors and international media;",
    "6": "Calls upon the United Nations to ensure that the Independent Mechanism for Myanmar, as established by the Human Rights Council in its resolution 39/2, is afforded the flexibility that it needs in terms of staffing, location and operational freedom so that it can deliver as effectively as possible on its mandate, and urges Myanmar, Member States, judicial authorities and private entities to cooperate fully with the Mechanism, including by granting it access and by providing it with every assistance in the execution of its mandate;",
    "7": " survivors, and calls upon all actors engaging in documentation to follow the \u201cdo no harm\u201d principle for evidence-gathering in order to respect the dignity of survivors and to avoid retraumatization, and calls upon Myanmar to fully address the needs of victims and survivors and their right to effective remedy, including through prompt, effective and independent casualty recording and guarantees of non-recurrence;",
    "8": " (i) To expedite efforts to eliminate statelessness and the systematic and institutionalized discrimination against members of ethnic and religious minorities, in particular relating to Rohingya Muslims, by, inter alia, reviewing and reforming the 1982 Citizenship Law, which has led to deprivation of human rights, by ensuring equal access to full citizenship through a transparent, voluntary and accessible procedure and to all civil and political rights, by allowing for self-identification, by amending or repealing all discriminatory legislation and policies, including discriminatory provisions of the set of \u201cprotection of race and religion laws\u201d enacted in 2015 covering religious conversion, interfaith marriage, monogamy and population control, and by lifting all local orders restricting rights to freedom of movement and access to civil registration, health and education services and livelihoods; (j) To dismantle the camps for internally displaced persons in Rakhine State with a clear timeline and without further delay, ensuring that the return and relocation of internally displaced persons is carried out in accordance with international standards and best practices, in cooperation with the United Nations and the international community, including as set forth in the Guiding Principles on Internal Displacement;15 (k) To accelerate full implementation of all the recommendations of the Advisory Commission on Rakhine State to address the root causes of the crisis; (l) To establish an ongoing system to ensure the conduct of free, fair, credible, inclusive and transparent general elections that enables unimpeded participation of all irrespective of ethnic or religious identity or status, including Rohingya Muslims and other minorities; (m) To continue its collaboration with the United Nations to implement the remaining gaps in the joint action plan to end and prevent the recruitment and use of children by all armed forces, including by the Tatmadaw, and to address protection gaps by engaging with the task force on monitoring and reporting grave violations committed against children to develop a joint action plan on killing and maiming and rape and other forms of sexual violence committed against children, while taking note of the ratification by Myanmar of the Optional Protocol to the Convention on the Rights of the Child on the involvement of children in armed conflict; (n) To cooperate and engage meaningfully with the newly appointed Special Rapporteur on the situation of human rights in Myanmar, the Independent Mechanism and other United Nations mandate holders and mechanisms working on Myanmar, including by facilitating visits and granting unrestricted access throughout the country; (o) To take concrete steps to strengthen institution-building and structural reforms to uphold the rule of law, human rights and democratic principles, through a participatory and inclusive approach, including efforts to ensure the independence of the judiciary, and by reforming the security sector to enhance civilian control; (p) To conduct independent, impartial and thorough investigations into all allegations of violations of international humanitarian law, including into conduct that may constitute war crimes and crimes against humanity in Rakhine and Chin States, crimes of sexual violence and allegations of human rights violations, and ensure that the perpetrators are brought to justice through transparent and credible processes; (q) To continue to ensure access to COVID-19 pandemic-related information, supplies and health-care services to all, in a targeted, necessary, transparent, non-discriminatory, time-bound, proportionate manner and in accordance with obligations under applicable international human rights law;",
    "9": "Encourages the Government of Myanmar to consider acceding to international human rights conventions;",
    "10": "Underscores the importance of providing protection and assistance, including non-discriminatory access to services such as medical and psychosocial care, specifically tailored to women and girls, especially those who are victims of sexual and gender-based violence and human trafficking;",
    "11": "Reiterates its deep concern at the continued plight of Rohingya and forcibly displaced persons living in Bangladesh and in other countries, and appreciates the commitment by the Government of Bangladesh to provide temporary shelter, humanitarian assistance and protection to them;",
    "12": "Commends the Government of Bangladesh for containing the spread of the COVID-19 virus in the Rohingya camps effectively since the beginning of the pandemic and avoiding loss of life with the support of all relevant national and international partners, including the host community;",
    "13": "Encourages Myanmar to continue to work with Bangladesh, in line with the bilateral instruments on repatriation signed by Bangladesh and Myanmar, in order to expedite the creation of a conducive environment for the voluntary, safe, dignified and sustainable return of the forcibly displaced Rohingya in Bangladesh, with the full support and meaningful involvement of the international community, including the United Nations and its funds, programmes and agencies, and stresses the importance of meaningfully engaging with civil society;",
    "14": "Recognizes with appreciation the assistance and support of the international community, including regional organizations, in particular the Association of Southeast Asian Nations, and the countries neighbouring Myanmar, and calls upon the international community to continue to support the Government of Myanmar in the fulfilment of its international human rights obligations and commitments, the implementation of its democratic transition process, inclusive socioeconomic development and sustainable peace, as well as its national reconciliation process involving all relevant stakeholders;",
    "15": "Calls upon the international community to effectively address increasing irregular maritime movements of Rohingya, in cooperation with the relevant United Nations agencies, as well as ensure international burden- and responsibility-sharing, especially by the States parties to the 1951 Convention relating to the Status of Refugees;16",
    "16": "Welcomes the recent extension for one year of the memorandum of understanding between the Government of Myanmar, the United Nations Development Programme and the Office of the United Nations High Commissioner for Refugees to associate them to the implementation of bilateral arrangements with Bangladesh on the return of displaced persons from Rakhine State, and emphasizes the need for the Government of Myanmar to continue to cooperate fully with the Government of Bangladesh and with the United Nations, in particular the Office of the United Nations High Commissioner for Refugees, and in consultation with the populations concerned to enable the safe, voluntary, dignified, sustainable and well- informed return of all refugees and forcibly displaced persons and internally displaced persons to their places of origin in Myanmar, and to give returnees freedom of movement and unimpeded access to livelihoods, social services, including health services, education and shelter, and to compensate them for all losses;",
    "17": "Calls for the prompt implementation of the memorandum of understanding signed by the Office of the United Nations High Commissioner for Refugees and the United Nations Development Programme with the Government of Myanmar in 2018, as extended in 2019 and 2020, to support the creation of conditions for the return of refugees from Bangladesh;",
    "18": "Encourages the international community to (a) assist Bangladesh in providing humanitarian assistance to Rohingya refugees and forcibly displaced persons until such time as they are voluntarily repatriated to Myanmar in safety and dignity; and (b) assist Myanmar in the provision of humanitarian assistance to affected persons of all communities who have been internally displaced, including those in camps for internally displaced persons within Rakhine State;",
    "19": "Urges the international community to support the 2020 joint response plan for the Rohingya humanitarian crisis to ensure adequate resources for addressing the humanitarian crisis;",
    "20": "Encourages all business enterprises, including transnational corporations and domestic enterprises operating in Myanmar, to respect human rights in accordance with the Guiding Principles on Business and Human Rights17 and the recommendations made by the independent international fact-finding mission in its report on the economic interests of the Myanmar military;",
    "21": "Requests the Secretary-General: (a) To continue to provide his good offices and to pursue his discussions relating to Myanmar, involving all relevant stakeholders, and to offer assistance to the Government of Myanmar; (b) To extend the appointment of the Special Envoy on Myanmar and submit the report of the Special Envoy covering all relevant issues addressed in the present resolution to the General Assembly at its seventy-sixth session; (c) To provide all assistance necessary to enable the Special Envoy on Myanmar to effectively discharge her mandate and to report to Member States every six months, or as warranted by the situation on the ground; (d) To identify ways in which the existing mandates can more effectively deliver in their respective areas of responsibility concerning Myanmar and can complement each other\u2019s work through enhanced coordination; (e) To ensure that all in-country programmes incorporate a human rights- based approach and undergo due diligence processes; (f) To call the continued attention of the Security Council to the situation in Myanmar with concrete recommendations for action towards resolving the humanitarian crisis, promoting the safe, dignified, voluntary and sustainable return of Rohingya refugees and forcibly displaced persons and ensuring accountability for those responsible for mass atrocities and human rights violations and abuses; (g) To support the implementation of the recommendations of the independent international fact-finding mission on Myanmar and assisting the work of the ongoing Independent Mechanism; (h) To fully implement the recommendations contained in the report of the independent inquiry into the involvement of the United Nations in Myanmar from 2010 to 2018;",
    "22": "Requests that the Special Envoy continue to participate by way of interactive dialogue in the seventy-sixth session of the General Assembly;",
    "23": "Decides to remain seized of the matter, inter alia, on the basis of the reports of the Secretary-General, the independent international fact-finding mission on Myanmar, the Independent Mechanism, the Special Rapporteur on the situation of human rights in Myanmar and the Special Envoy of the Secretary-General on Myanmar."
  },
  "agenda_items": [
    "Item 72"
  ],
  "symbol_references": []
}