{
  "symbol": "A/RES/79/151",
  "filename": "A_RES_79_151.pdf",
  "title": "79/151. Literacy for life: shaping future agendas",
  "text": "United Nations \nA/RES/79/151\n \n \nGeneral Assembly \nDistr.: General \n19 December 2024 \n \n24-24139 (E)     \n*2424139* \n \n \nSeventy-ninth session \nAgenda item 26 (c) \nSocial development: literacy for life: shaping \nfuture agendas \n \n \n \n \n Resolution adopted by the General Assembly \non 17 December 2024 \n \n \n \n \n[on the report of the Third Committee (A/79/450, para. 39)] \n \n \n 79/151. Literacy for life: shaping future agendas \n \n \n \nThe General Assembly, \n \nRecalling its resolution 56/116 of 19 December 2001, by which it proclaimed \nthe 10-year period beginning on 1 January 2003 the United Nations Literacy Decade, \nits resolution 57/166 of 18 December 2002, in which it welcomed the International \nPlan of Action for the United Nations Literacy Decade, 1 and its resolutions 59/149 of \n20 December 2004, 61/140 of 19 December 2006, 63/154 of 18 December 2008, \n65/183 of 21 December 2010, 68/132 of 18 December 2013, 69/141 of 18 December \n2014, 71/166 of 19 December 2016, 73/145 of 17 December 2018, 75/155 of \n16 December 2020 and 77/192 of 15 December 2022,  \n \nRecalling also the 2030 Agenda for Sustainable Development,2 which includes \nSustainable Development Goal 4 on ensuring inclusive and equitable quality \neducation and promoting lifelong learning opportunities for all, with a specific target \non ensuring that all youth and a substantial proportion of adults, both men and women, \nachieve literacy and numeracy by 2030, \n \nConvinced that literacy is crucial to the acquisition by every child, young person \nand adult of the essential knowledge, skills and competencies that will enable them \nto address the challenges that they may face in life and represents an essential \ncondition of lifelong learning, which is an indispensable means for effective \nparticipation in the knowledge societies and economies of the twenty-first century, \nand to promote inclusive and equitable societies, \n \nReaffirming the right of Indigenous Peoples to have non-discriminatory access \nto all levels and forms of education provided by States, and recognizing the \nimportance of effective measures to promote access for Indigenous individuals, in \n__________________ \n \n1  See A/57/218 and A/57/218/Corr.1. \n \n2  Resolution 70/1. \n\nA/RES/79/151 \nLiteracy for life: shaping future agendas\n \n24-24139\n2/6 \n \nparticular children, to education in their own language, whenever possible, as \naddressed in the United Nations Declaration on the Rights of Indigenous Peoples, 3  \n \nDeeply concerned that, according to the United Nations Educational, Scientific \nand Cultural Organization, an estimated 754 million adults, 4 two thirds of them \nwomen, lack basic literacy skills, and that 70 per cent of 10-year-old children in low- \nand middle-income countries are not able to read and understand a simple text, and \nthat 244 million children, adolescents and youth worldwide (or one in five) were out \nof school in 2023 \u2013 a figure that has barely changed over the past decade, \n \nStressing the importance of recovering from a learning loss and addressing \nnegative impacts, including on learners\u2019 socioemotional skills, as a consequence of \nthe coronavirus disease (COVID 19) pandemic, in particular girls, who are among \nthose disproportionately lacking access to education, \n \nRecognizing that literacy is an integral part of lifelong learning as a continuum \nof proficiency in reading, writing and numeracy that is developed throughout life and \nacross different life and work contexts, \n \nRecognizing also that substantial and efficiently spent investments are needed \nto improve the quality of education in order to enable millions of people to acquire \nliteracy skills for decent work, \n \nRecognizing further the critical role of teachers and educators in ensuring \ninclusive and equitable quality education and lifelong learning, and the importance of \nstrengthening their capacities, skills and competencies, including digital skills, by \nproviding training, support, materials and technological infrastructure, as well as the \nchallenges faced by teachers and educators in online and digital learning, while \nensuring their status and working conditions, as appropriate, and reiterating the \ncommitment to substantially increase the supply of qualified teachers, by 2030, \nincluding through international cooperation for teacher training in developing \ncountries, \n \nRecognizing that literacy is a foundation for lifelong learning, a building block \nfor achieving human rights and fundamental freedoms and a driver of sustainable \ndevelopment, and that the United Nations Literacy Decade (2003\u20132012) had a \ncatalytic effect as a global framework for sustained and focused efforts for the \npromotion of literacy and literate environments, \n \nReaffirming the need to ensure equal access to inclusive and equitable quality \neducation, including digital literacy, in order to adapt and thrive in a rapidly changing \nworld, and in this regard stressing that information and communications technologies \nand applications can create new ways to enhance education, including early childhood \neducation and lifelong learning opportunities, while recognizing the need to close all \ndigital divides and promote digital inclusion by taking into account national and \nregional contexts and addressing the challenges associated with access, connectivity, \naffordability, digital literacy and digital skills and awareness, and by ensuring that the \nbenefits of new technologies are available to all, taking into account the needs of \nthose who are in vulnerable situations, \n \nDeeply concerned that the disproportionate impacts of the unprecedented global \nschool closures during the COVID-19 pandemic have exacerbated pre-existing \ninequalities between and within countries and between and within educational \nsystems in access to quality education and lifelong learning opportunities, and that \nthe impact of the pandemic on equal learning opportunity is further exacerbated by \nthe digital divides between those who had the means to continue education remotely \n__________________ \n \n3  Resolution 61/295, annex. \n \n4  See A/77/187. \n\nLiteracy for life: shaping future agendas \nA/RES/79/151\n \n3/6\n24-24139 \n \nand those who did not, as well as the rural-urban, youth-older persons and gender \ndigital divides,  \n \nRecalling the International Conference on Girls\u2019 and Women\u2019s Literacy and \nEducation: Foundations for Sustainable Development, held in Dhaka and co-hosted \nby the Government of Bangladesh and the United Nations Educational, Scientific and \nCultural Organization, in support of the Global Education First Initiative and on the \noccasion of International Literacy Day, on 8 September 2014, and taking note with \nappreciation of the adoption of the Dhaka Declaration, \n \nTaking note of the 2024 Global Education Meeting, held on 31 October and \n1 November 2024 in Fortaleza, Brazil, and its \u201cFortaleza Declaration\u201d, \n \nAffirming that the realization of the right to education, especially for girls, \ncontributes to the promotion of human rights, gender equality, the empowerment of \nall women and girls and the eradication of poverty, as well as to development, \n \nRecalling the importance of continuing to implement national and subnational \nprogrammes and measures to advance literacy worldwide as reflected in the Dakar \nFramework for Action, adopted on 28 April 2000 at the World Education Forum,5 and \nachieve literacy consistent with Sustainable Development Goal 4, and in this regard \nrecognizing the important contribution of North-South, South-South and triangular \ncooperation through, inter alia, innovative pedagogical methods in literacy, \n \nDeeply concerned about the persistence of the gender gap in education, which \nis reflected by the fact that, according to the United Nations Educational, Scientific \nand Cultural Organization, nearly two thirds of the world\u2019s non-literate adults are \nwomen, \n \nRecalling the commitment to substantially expand globally the number of \nscholarships available to developing countries for enrolment in higher education, \nincluding vocational training and information and communications technology, \ntechnical, engineering and scientific programmes, in developed countries and other \ndeveloping countries, \n \nConcerned that, according to the United Nations Educational, Scientific and \nCultural Organization, one third of the children not attending school are children with \ndisabilities and that the literacy rate among adults with disabilities is as low as 3 per \ncent in some countries, \n \nDeeply concerned about the impact of disrupted educational services in \nhumanitarian emergencies on efforts to promote literacy skills, especially for all \nchildren and young people, \n \n1. \nTakes note with appreciation of the report of the Secretary-General entitled \n\u201cLiteracy for empowerment and transformation\u201d; 6  \n \n2. \nCommends the efforts made by Member States, their development \npartners, the international donor community, the private sector, civil society and the \nspecialized agencies and other organizations of the United Nations system, \nparticularly the United Nations Educational, Scientific and Cultural Organization, in \npromoting enjoyment of the right to education, including by making progress on the \nfive strategic axes of action for the period following the Decade; \n \n3. \nCalls upon Governments at all levels, as appropriate, to scale up literacy, \nincluding digital literacy programmes for all boys and girls, youth and adults, \n__________________ \n \n5  See United Nations Educational, Scientific and Cultural Organization, Final Report of the World \nEducation Forum, Dakar, Senegal, 26\u201328 April 2000 (Paris, 2000). \n \n6  A/79/155. \n\nA/RES/79/151 \nLiteracy for life: shaping future agendas\n \n24-24139\n4/6 \n \nincluding older persons, with particular attention to those in vulnerable situations, to \nfoster inclusive and innovative delivery of literacy services, including through further \nharnessing the innovative and transformative potential of digital technology and a \nstrengthened institutional network, to promote an intersectoral approach by linking \nliteracy learning with multiple sectors to address diverse learning needs, such as \nthrough relevant and inclusive educational resources in different languages, to \nestablish multi-stakeholder partnerships with the active participation of civil society \nand the private sector, to encourage the integration of literacy learning into vocational \neducation and training, to mobilize resources to strengthen literacy measurements and \nstatistics, and to invest in education management information systems and data \nmanagement capacities according to every State\u2019s financial and human capabilities; \n \n4. \nCalls upon Member States to continue to increase investment in inclusive \nand equitable quality education for all, early childhood care and education, youth and \nadult literacy programmes or initiatives and skills enhancement, and promote \nopportunities for lifelong learning, technical and vocational training and digital \nliteracy, allowing for the intergenerational acquisition and transfer of knowledge and \nskills to advance the prospects of future generations; \n \n5. \nEncourages Member States, United Nations organizations, multilateral \nand bilateral donors, regional organizations, civil society, academia and the private \nsector to sustain their collective efforts for the promotion of literacy and literate \nenvironments and to contribute to the implementation of the Strategies (2020\u20132025) \nof the Global Alliance for Literacy within the Framework of Lifelong Learning, as \nwell as the development of new strategies for synergistic action at the global, regional, \nnational and community levels; \n \n6. \nRecalls the adoption by the United Nations Educational, Scientific and \nCultural Organization of its Strategy for Youth and Adult Literacy (2020\u20132025) and \nits action plan; \n \n7. \nTakes note with appreciation of the adoption of the Marrakech Framework \nfor Action at the seventh International Conference on Adult Education, held from 15 \nto 17 June 2022, stressing the transformative power of adult learning and education \nfor sustainable development and lifelong learning;  \n \n8. \nUrges international development partners and Governments to cooperate \nin order to strive to ensure that sufficient and sustainable funds continue to be \nmobilized, including to address or mitigate the effects driven by the COVID-19 \npandemic, by and channelled through new and existing international financing \nmechanisms for education and that they also explicitly target and benefit youth and \nadult literacy; \n \n9. \nTakes note of the Transforming Education Summit, convened by the \nSecretary-General from 16 to 19 September 2022, as well as its Pre-Summit, hosted \nby the United Nations Educational, Scientific and Cultural Organization in Paris from \n28 to 30 June 2022, as well as the stocktake of transformative actions in education, \nhosted by the United Nations Educational, Scientific and Cultural Organization in \nParis on 17 June 2024; \n \n10. Welcomes the establishment of the United Nations Youth Office, takes note \nof its function to support ongoing efforts towards the mobilization of financial and \ntechnical support and investment to promote and upscale quality and inclusive \neducation and training, skills development, capacity-building and bridging the digital \ndivides, in tandem with job creation, for youth and creating an enabling environment \nfor harnessing their talents and abilities to contribute to their societies, and in this \n\nLiteracy for life: shaping future agendas \nA/RES/79/151\n \n5/6\n24-24139 \n \nregard recognizes its potential positive contribution towards ensuring youth and adult \nliteracy;7  \n \n11. Invites Member States, the United Nations, regional organizations and \nother relevant stakeholders to cooperate in strengthening the capacities of school \ndirectors, teachers and educators to ensure literacy, including through the \ndevelopment of intercultural and digital skills and competencies among them, as well \nas of the capacities to develop relevant pedagogical methods in literacy; \n \n12. Calls upon States, and invites other relevant stakeholders, to implement \nthe 2030 Agenda for Sustainable Development and achieve all literacy-related \nSustainable Development Goals and targets; \n \n13. Calls upon Member States to work with relevant stakeholders, including \nthe private sector and civil society, to take steps to close the digital divides, including \nthe rural-urban, youth-older persons and gender digital divides and those within and \nbetween developed and developing countries, and promote digital inclusion by \naddressing the challenges associated with access, affordability, digital literacy and \ndigital skills, ensuring that the benefits of new technologies, particularly on literacy, \nare available to all, including those living in rural and remote areas, taking into \naccount the needs of those who are in vulnerable situations, and providing distance \nlearning opportunities, especially in developing countries; \n \n14. Urges Member States and other relevant stakeholders to take measures to \nensure the proper training of teachers and other educational professionals in digital \nliteracy and the availability of and access to learning materials and remote learning \nplatforms to close all digital divides, including by removing barriers such as poor \naccess to connectivity, the lack of affordability of connection and devices, limited \ndigital skills and the absence of locally relevant digital content, in order to provide \ndistance learning opportunities, inter alia, Internet, television and radio teaching \nalternatives, especially in developing countries; \n \n15. Invites the United Nations Educational, Scientific and Cultural \nOrganization, as the specialized United Nations agency for education, to continue its \nmandated role to lead and coordinate the Education 2030 agenda, in particular through \nthe renewed global education cooperation mechanism, including the strengthened \nSustainable Development Goal 4 Education 2030 High-level Steering Committee,8 as \nan inclusive global multi-stakeholder consultation and coordination mechanism for \neducation in the 2030 Agenda in accordance with the 2030 Agenda follow-up and \nreview process; \n \n16. Requests the United Nations Educational, Scientific and Cultural \nOrganization to continue its coordinating and catalysing role through the \nimplementation of its Strategy for Youth and Adult Literacy (2020\u20132025) and the \nstrategy of the Global Alliance for Literacy and by continuing to provide support to \nMember States, in collaboration with partners, in enhancing capacities for policy \nformulation, programme implementation, monitoring and evaluation, as well as \nsharing information and knowledge on policies, programmes and progress in the \nachievement of the Sustainable Development Goal targets connected with literacy, \nespecially target 4.1 on reading skills in primary and lower secondary school \n(including in Indigenous languages) and target 4.6 on youth and adult literacy, and \ncreating synergies of action between the Alliance and other initiatives, including its \nGlobal Partnership for Girls\u2019 and Women\u2019s Education and Global Network of \nLearning Cities; \n__________________ \n \n7  Resolution 76/306, para. 3 (i). \n \n8  See A/77/187. \n\nA/RES/79/151 \nLiteracy for life: shaping future agendas\n \n24-24139\n6/6 \n \n \n17. Encourages efforts to provide quality education in safe learning \nenvironments for all, especially for boys, girls and youth, in humanitarian \nemergencies to contribute to a smooth transition from relief to development; \n \n18. Requests the Secretary-General, in cooperation with the Director General \nof the United Nations Educational, Scientific and Cultural Organization, to submit to \nthe General Assembly at its eighty-first session a report on the implementation of the \npresent resolution; \n \n19. Decides to include in the provisional agenda of its eighty-first session, \nunder the item entitled \u201cSocial development\u201d, the sub-item entitled \u201cLiteracy for life: \nshaping future agendas\u201d. \n \n53rd plenary meeting \n17 December 2024  \n \n",
  "paragraphs": {
    "1": "Takes note with appreciation of the report of the Secretary-General entitled \u201cLiteracy for empowerment and transformation\u201d; 6",
    "2": "Commends the efforts made by Member States, their development partners, the international donor community, the private sector, civil society and the specialized agencies and other organizations of the United Nations system, particularly the United Nations Educational, Scientific and Cultural Organization, in promoting enjoyment of the right to education, including by making progress on the five strategic axes of action for the period following the Decade;",
    "3": "Calls upon Governments at all levels, as appropriate, to scale up literacy, including digital literacy programmes for all boys and girls, youth and adults, including older persons, with particular attention to those in vulnerable situations, to foster inclusive and innovative delivery of literacy services, including through further harnessing the innovative and transformative potential of digital technology and a strengthened institutional network, to promote an intersectoral approach by linking literacy learning with multiple sectors to address diverse learning needs, such as through relevant and inclusive educational resources in different languages, to establish multi-stakeholder partnerships with the active participation of civil society and the private sector, to encourage the integration of literacy learning into vocational education and training, to mobilize resources to strengthen literacy measurements and statistics, and to invest in education management information systems and data management capacities according to every State\u2019s financial and human capabilities;",
    "4": "Calls upon Member States to continue to increase investment in inclusive and equitable quality education for all, early childhood care and education, youth and adult literacy programmes or initiatives and skills enhancement, and promote opportunities for lifelong learning, technical and vocational training and digital literacy, allowing for the intergenerational acquisition and transfer of knowledge and skills to advance the prospects of future generations;",
    "5": "Encourages Member States, United Nations organizations, multilateral and bilateral donors, regional organizations, civil society, academia and the private sector to sustain their collective efforts for the promotion of literacy and literate environments and to contribute to the implementation of the Strategies (2020\u20132025) of the Global Alliance for Literacy within the Framework of Lifelong Learning, as well as the development of new strategies for synergistic action at the global, regional, national and community levels;",
    "6": "Recalls the adoption by the United Nations Educational, Scientific and Cultural Organization of its Strategy for Youth and Adult Literacy (2020\u20132025) and its action plan;",
    "7": "Takes note with appreciation of the adoption of the Marrakech Framework for Action at the seventh International Conference on Adult Education, held from 15 to 17 June 2022, stressing the transformative power of adult learning and education for sustainable development and lifelong learning;",
    "8": "Urges international development partners and Governments to cooperate in order to strive to ensure that sufficient and sustainable funds continue to be mobilized, including to address or mitigate the effects driven by the COVID-19 pandemic, by and channelled through new and existing international financing mechanisms for education and that they also explicitly target and benefit youth and adult literacy;",
    "9": "Takes note of the Transforming Education Summit, convened by the Secretary-General from 16 to 19 September 2022, as well as its Pre-Summit, hosted by the United Nations Educational, Scientific and Cultural Organization in Paris from 28 to 30 June 2022, as well as the stocktake of transformative actions in education, hosted by the United Nations Educational, Scientific and Cultural Organization in Paris on 17 June 2024;",
    "10": " regard recognizes its potential positive contribution towards ensuring youth and adult literacy;7",
    "11": "Invites Member States, the United Nations, regional organizations and other relevant stakeholders to cooperate in strengthening the capacities of school directors, teachers and educators to ensure literacy, including through the development of intercultural and digital skills and competencies among them, as well as of the capacities to develop relevant pedagogical methods in literacy;",
    "12": "Calls upon States, and invites other relevant stakeholders, to implement the 2030 Agenda for Sustainable Development and achieve all literacy-related Sustainable Development Goals and targets;",
    "13": "Calls upon Member States to work with relevant stakeholders, including the private sector and civil society, to take steps to close the digital divides, including the rural-urban, youth-older persons and gender digital divides and those within and between developed and developing countries, and promote digital inclusion by addressing the challenges associated with access, affordability, digital literacy and digital skills, ensuring that the benefits of new technologies, particularly on literacy, are available to all, including those living in rural and remote areas, taking into account the needs of those who are in vulnerable situations, and providing distance learning opportunities, especially in developing countries;",
    "14": "Urges Member States and other relevant stakeholders to take measures to ensure the proper training of teachers and other educational professionals in digital literacy and the availability of and access to learning materials and remote learning platforms to close all digital divides, including by removing barriers such as poor access to connectivity, the lack of affordability of connection and devices, limited digital skills and the absence of locally relevant digital content, in order to provide distance learning opportunities, inter alia, Internet, television and radio teaching alternatives, especially in developing countries;",
    "15": "Invites the United Nations Educational, Scientific and Cultural Organization, as the specialized United Nations agency for education, to continue its mandated role to lead and coordinate the Education 2030 agenda, in particular through the renewed global education cooperation mechanism, including the strengthened Sustainable Development Goal 4 Education 2030 High-level Steering Committee,8 as an inclusive global multi-stakeholder consultation and coordination mechanism for education in the 2030 Agenda in accordance with the 2030 Agenda follow-up and review process;",
    "16": "Requests the United Nations Educational, Scientific and Cultural Organization to continue its coordinating and catalysing role through the implementation of its Strategy for Youth and Adult Literacy (2020\u20132025) and the strategy of the Global Alliance for Literacy and by continuing to provide support to Member States, in collaboration with partners, in enhancing capacities for policy formulation, programme implementation, monitoring and evaluation, as well as sharing information and knowledge on policies, programmes and progress in the achievement of the Sustainable Development Goal targets connected with literacy, especially target 4.1 on reading skills in primary and lower secondary school (including in Indigenous languages) and target 4.6 on youth and adult literacy, and creating synergies of action between the Alliance and other initiatives, including its Global Partnership for Girls\u2019 and Women\u2019s Education and Global Network of Learning Cities;",
    "17": "Encourages efforts to provide quality education in safe learning environments for all, especially for boys, girls and youth, in humanitarian emergencies to contribute to a smooth transition from relief to development;",
    "18": "Requests the Secretary-General, in cooperation with the Director General of the United Nations Educational, Scientific and Cultural Organization, to submit to the General Assembly at its eighty-first session a report on the implementation of the present resolution;",
    "19": "Decides to include in the provisional agenda of its eighty-first session, under the item entitled \u201cSocial development\u201d, the sub-item entitled \u201cLiteracy for life: shaping future agendas\u201d."
  },
  "agenda_items": [
    "Item 26"
  ],
  "symbol_references": []
}