{
  "symbol": "A/RES/73/245",
  "filename": "A_RES_73_245.pdf",
  "title": "73/245. Promotion of sustainable tourism, including ecotourism, for poverty eradication and environment protection",
  "text": "United Nations \nA/RES/73/245\n \n \nGeneral Assembly \nDistr.: General \n17 January 2019 \n \n18-22623 (E)    210119 \n*1822623* \n \n \nSeventy-third session \nAgenda item 24 \n \n \n \n \n Resolution adopted by the General Assembly \non 20 December 2018 \n \n \n \n \n[on the report of the Second Committee (A/73/542)] \n \n \n 73/245. Promotion of sustainable tourism, including ecotourism, \nfor poverty eradication and environment protection \n \n \n \nThe General Assembly, \n \nRecalling the 2005 World Summit Outcome,1  \n \nReaffirming its resolution 70/1 of 25 September 2015, entitled \u201cTransforming \nour world: the 2030 Agenda for Sustainable Development\u201d, in which it adopted a \ncomprehensive, far-reaching and people-centred set of universal and transformative \nSustainable Development Goals and targets, its commitment to working tirelessly for \nthe full implementation of the Agenda by 2030, its recognition that eradicating \npoverty in all its forms and dimensions, including extreme poverty, is the greatest \nglobal challenge and an indispensable requirement for sustainable development, its \ncommitment to achieving sustainable development in its three dimensions \u2013 \neconomic, social and environmental \u2013 in a balanced and integrated manner, and to \nbuilding upon the achievements of the Millennium Development Goals and seeking \nto address their unfinished business, \n \nReaffirming also its resolution 69/313 of 27 July 2015 on the Addis Ababa \nAction Agenda of the Third International Conference on Financing for Development, \nwhich is an integral part of the 2030 Agenda for Sustainable Development, supports \nand complements it, helps to contextualize its means of implementation targets with \nconcrete policies and actions, and reaffirms the strong political commitment to \naddress the challenge of financing and creating an enabling environment at all levels \nfor sustainable development in the spirit of global partnership and solidarity, \n \nRecalling its resolution 71/240 of 21 December 2016, entitled \u201cPromotion of \nsustainable tourism, including ecotourism, for poverty eradication and environment \nprotection\u201d, \n__________________ \n \n1  Resolution 60/1. \n\nA/RES/73/245 \nPromotion of sustainable tourism, including ecotourism,\nfor poverty eradication and environment protection\n \n18-22623\n2/8 \n \n \nRecalling also its resolutions 70/193 of 22 December 2015, entitled \n\u201cInternational Year of Sustainable Tourism for Development, 2017\u201d, 70/200 of \n22 December 2015, entitled \u201cGlobal Code of Ethics for Tourism\u201d, and 72/214 of \n20 December 2017, entitled \u201cSustainable tourism and sustainable development in \nCentral America\u201d, \n \nReaffirming its resolution 71/243 of 21 December 2016 on the quadrennial \ncomprehensive policy review of operational activities for development of the United \nNations system and its general guidelines and principles, as well as its resolution \n72/279 of 31 May 2018, and welcoming the efforts of the Secretary-General to better \nposition United Nations operational activities for development to support countries \nin their efforts to implement the 2030 Agenda for Sustainable Development, \n \nRecalling the Sendai Declaration and the Sendai Framework for Disaster Risk \nReduction 2015\u20132030,2 adopted at the Third United Nations World Conference on \nDisaster Risk Reduction, the latter of which, inter alia, highlighted the need to \npromote and integrate disaster risk management approaches throughout the tourism \nindustry, given the often heavy reliance on tourism as a key economic driver, \n \nWelcoming the Paris Agreement3 and its early entry into force, encouraging all \nits parties to fully implement the Agreement, and parties to the United Nations \nFramework Convention on Climate Change4 that have not yet done so to deposit their \ninstruments of ratification, acceptance, approval or accession, where appropriate, as \nsoon as possible, \n \nReaffirming the New Urban Agenda, adopted at the United Nations Conference \non Housing and Sustainable Urban Development (Habitat III), held in Quito from \n17 to 20 October 2016,5  \n \nRecalling the United Nations Millennium Declaration, 6  the Monterrey \nConsensus of the International Conference on Financing for Development, 7 the Rio \nDeclaration on Environment and Development,8 the Plan of Implementation of the \nWorld Summit on Sustainable Development (Johannesburg Plan of Implementation), 9 \nthe Doha Declaration on Financing for Development: outcome document of the \nFollow-up International Conference on Financing for Development to Review the \nImplementation of the Monterrey Consensus,10 the Outcome of the Conference on the \nWorld Financial and Economic Crisis and Its Impact on Development,11 the outcome \ndocument of the high-level plenary meeting of the General Assembly on the \nMillennium Development Goals, 12  the outcome document of the United Nations \nConference on Sustainable Development,13 the report of the eleventh meeting of the \n__________________ \n \n2  Resolution 69/283, annexes I and II. \n \n3  See FCCC/CP/2015/10/Add.1, decision 1/CP.21, annex. \n \n4  United Nations, Treaty Series, vol. 1771, No. 30822. \n \n5  Resolution 71/256, annex. \n \n6  Resolution 55/2. \n \n7  Report of the International Conference on Financing for Development, Monterrey, Mexico,  \n18\u201322 March 2002 (United Nations publication, Sales No. E.02.II.A.7), chap. I, resolution 1, \nannex. \n \n8  Report of the United Nations Conference on Environment and Development, Rio de Janeiro,  \n3\u201314 June 1992, vol. I, Resolutions Adopted by the Conference (United Nations publication, \nSales No. E.93.I.8 and corrigendum), resolution 1, annex I. \n \n9  Report of the World Summit on Sustainable Development, Johannesburg, South Africa, \n26 August\u20134 September 2002 (United Nations publication, Sales No. E.03.II.A.1 and \ncorrigendum), chap. I, resolution 2, annex. \n \n10  Resolution 63/239, annex. \n \n11  Resolution 63/303, annex. \n \n12  Resolution 65/1. \n \n13  Resolution 66/288, annex. \n\nPromotion of sustainable tourism, including ecotourism, \nfor poverty eradication and environment protection \nA/RES/73/245\n \n3/8\n18-22623 \n \nConference of the Parties to the Convention on Biological Diversity, 14 the outcome \ndocument of the third International Conference on Small Island Developing States, \nentitled \u201cSIDS Accelerated Modalities of Action (SAMOA) Pathway\u201d, 15  and the \noutcome document of the second United Nations Conference on Landlocked \nDeveloping Countries, the Vienna Programme of Action for Landlocked Developing \nCountries for the Decade 2014\u20132024,16  \n \nStressing that poverty is a multifaceted problem that requires a multifaceted and \nintegrated approach in addressing its economic, political, social, environmental and \ninstitutional dimensions at all levels, \n \nRecognizing that sustainable tourism, including ecotourism, is a cross-cutting \nactivity that can contribute to the three dimensions of sustainable development and \nthe achievement of the Sustainable Development Goals, including by fostering \neconomic growth, alleviating poverty, creating full and productive employment and \ndecent work for all, accelerating the change to more sustainable consumption and \nproduction patterns and promoting the sustainable use of oceans, seas and marine \nresources, promoting local culture, improving the quality of life and the economic \nempowerment of women and young people and promoting rural development and \nbetter living conditions for rural populations, \n \nWelcoming the efforts of the World Tourism Organization, the United Nations \nEnvironment Programme, the United Nations Conference on Trade and Development, \nthe United Nations Educational, Scientific and Cultural Organization, the United \nNations Industrial Development Organization and the secretariat of the Convention \non Biological Diversity to promote ecotourism and sustainable tourism worldwide, \n \nRecognizing that sustainable consumption and production in tourism is aimed at \nincreasing net welfare gains from economic activities by improving resource use and \nreducing ecosystem degradation and pollution along the entire tourism value chain, \nand that a systemic approach and cooperation among actors operating along the value \nchain, from tourism service providers, to adjacent communities, to tourists, can ensure \nthe sustainability of the sector, \n \nRecalling the adoption of the 10-Year Framework of Programmes on \nSustainable Consumption and Production Patterns by the United Nations Conference \non Sustainable Development in 2012,17 welcoming the launching of the sustainable \ntourism programme of the Framework, and encouraging further implementation \nthrough capacity-building projects and initiatives to support sustainable tourism, \n \nRecalling also the commitment contained in the Cancun Declaration on \nMainstreaming the Conservation and Sustainable Use of Biodiversity for Well-being, \nadopted at the high-level segment of the thirteenth meeting of the Conference of the \nParties to the Convention on Biological Diversity, held in Cancun, Mexico, on 2 and \n3 December 2016, in which tourism is recognized as an enabling agent of change that \ncan contribute directly to the conservation of sensitive areas and habitats through a \nvariety of activities and by raising awareness of the importance of biodiversity,18  \n \nNoting the initiatives launched and the events organized at the subregional, \nregional and international levels in the field of sustainable tourism, including \necotourism, and sustainable development, \n__________________ \n \n14  United Nations Environment Programme, document UNEP/CBD/COP/11/35. \n \n15  Resolution 69/15, annex. \n \n16  Resolution 69/137, annex II. \n \n17  A/CONF.216/5, annex. \n \n18  United Nations Environment Programme, document UNEP/CBD/COP/13/24. \n\nA/RES/73/245 \nPromotion of sustainable tourism, including ecotourism,\nfor poverty eradication and environment protection\n \n18-22623\n4/8 \n \n \nWelcoming the adoption of the first African Charter for Sustainable and \nResponsible Tourism at the meeting of African ministers of tourism held in \nMarrakech, Morocco, on 10 November 2016 on the sidelines of the twenty-second \nsession of the Conference of the Parties to the United Nations Framework Convention \non Climate Change, which outlines the way forward for the application of the \nprinciples of sustainability and accountability in the tourism sector in Africa, \n \n1. \nWelcomes the report of the Secretary-General of the World Tourism \nOrganization transmitted by the Secretary-General of the United Nations;19  \n \n2. \nRecognizes that sustainable tourism, including ecotourism, represents, in \nmany countries, an important driver of sustainable economic growth and decent job \ncreation for all, that it can have a positive impact on income generation and education, \nirrespective of age, sex, disability, race, ethnicity, origin, religion or economic or \nother status, and thus on the fight against poverty and hunger, and that it can \ncontribute directly to achieving internationally agreed development goals, including \nthe Sustainable Development Goals; \n \n3. \nAlso recognizes the potential of sustainable tourism, including ecotourism, \nto eradicate poverty by improving individual livelihoods in local communities and to \ngenerate resources for community development projects;  \n \n4. \nEmphasizes the need to optimize the economic, social, cultural and \nenvironmental benefits stemming from sustainable tourism, including ecotourism \nactivities, in all countries, including African countries, least developed countries, \nlandlocked developing countries, small island developing States and middle-income \ncountries; \n \n5. \nAlso emphasizes that sustainable tourism, including ecotourism, can \ncontribute to sustainable development, in particular to the conservation and \nsustainable use of biodiversity and natural resources, and can improve the well-being \nof indigenous peoples and local communities; \n \n6. \nRecognizes that sustainable tourism, including ecotourism, can improve \nthe well-being of indigenous peoples and local communities, including women and \nyoung people, and can create significant opportunities for the conservation and \nsustainable use of biodiversity and/or the protection of natural areas by encouraging \nindigenous peoples and local communities in host countries and tourists alike to \npreserve and respect the natural and cultural heritage; \n \n7. \nNotes that the Secretary-General of the World Tourism Organization, in \nhis report, invites Member States, international agencies and other relevant \norganizations to mainstream biodiversity conservation in the tourism sector and in \nclimate change plans and strategies, intertwining economic, social and cultural \nelements with climate change adaptation approaches and the preservation of relevant \necosystem services; \n \n8. \nEncourages all stakeholders to support, as appropriate, the participation of \nindigenous peoples and local communities in sustainable tourism, including women \nand young people in all tourism operations, including ecotourism activities, in the \nlight of their expertise and knowledge; \n \n9. \nUnderlines, in this regard, the importance of establishing, at the national \nlevel, where necessary, appropriate policies, guidelines, institutions and regulations, \nin accordance with national priorities and legislation, for promoting and supporting \nsustainable tourism, including ecotourism, and minimizing any potential negative \nimpact; \n__________________ \n \n19  A/73/274 and A/73/274/Corr.1. \n\nPromotion of sustainable tourism, including ecotourism, \nfor poverty eradication and environment protection \nA/RES/73/245\n \n5/8\n18-22623 \n \n \n10. Invites Member States to enhance institutional coherence policy that \nsupports funding mechanisms and initiatives for poverty eradication projects, \nincluding initiatives from community-based organizations and small private sector \nentities; \n \n11. \nInvites \nGovernments, \ninternational \norganizations, \nother \nrelevant \ninstitutions and other stakeholders, as appropriate, to encourage and support best \npractices in relation to the implementation of relevant policies, guidelines and \nregulations in sustainable tourism, including the ecotourism sector, and to implement \nand disseminate existing guidelines; \n \n12. Encourages Member States to use sustainable tourism, including \necotourism, as a tool to foster sustained and inclusive economic growth, social \ndevelopment and financial inclusion and enable the formalization of the informal \nsector, the promotion of domestic resource mobilization and environmental protection \nand the eradication of poverty and hunger, including the conservation and sustainable \nuse of biodiversity and natural resources and the promotion of investment and \nentrepreneurship in sustainable tourism, including ecotourism, in accordance with \ntheir national development policies and legislation, which may include promoting the \ndevelopment of small and medium-sized enterprises, promoting cooperatives and \nfacilitating access to financing through inclusive financial services, including \nmicrocredit initiatives for the poor, women and young people, indigenous peoples, \nolder persons, persons with disabilities and local communities in all areas, including \nrural areas; \n \n13. Encourages the development of tourism infrastructure and the promotion \nof tourism diversification, including through public-private partnerships, as a way to \nfoster job creation for local communities, the preservation of their way of life, culture \nand heritage and the promotion of the three dimensions of sustainable development, \nwhile simultaneously inviting Member States to take measures to protect the \nenvironment and the sociocultural heritage of a destination; \n \n14. Encourages Governments, the United Nations and the specialized agencies \nto support the coordination of regional and/or international sustainable tourism \ndevelopment frameworks, as appropriate, in order to assist countries in promoting \nsustainable tourism, including ecotourism, for poverty eradication and environmental \nprotection; \n \n15. Underlines the importance of ensuring responsible resource management, \naddressing the negative impacts of unbalanced tourism, respecting environmental and \nsociocultural capacities and conducting an environmental impact assessment that \ndoes not present additional cost commitments, in accordance with national \nlegislation, for the development of sustainable tourism, including ecotourism \nopportunities; \n \n16. Stresses the need to ensure the integration of sustainable consumption and \nproduction patterns in the tourism sector, including through identifying and adopting \ntourism-planning approaches aimed at improving efficiency in the use of resources; \n \n17. Encourages Member States and other stakeholders to make use of the \n\u201cTourism for SDGs platform\u201d launched during the 2018 high-level political forum on \nsustainable development as a partnership tool aimed at advancing the sustainable \ndevelopment of tourism and its contributions to the Sustainable Development Goals;  \n \n18. Also encourages Member States and other stakeholders to join the \nSustainable Tourism Programme of the 10-year Framework of Programmes on \nSustainable Consumption and Production Patterns17 in order to foster the integration \nof sustainable consumption and production patterns in the tourism sector; \n\nA/RES/73/245 \nPromotion of sustainable tourism, including ecotourism,\nfor poverty eradication and environment protection\n \n18-22623\n6/8 \n \n \n19. Underlines the need to foster resilient tourism development to deal with \nshocks, taking into account the vulnerability of the tourism sector to emergencies, and \ninvites Member States to develop national strategies for rehabilitation after shocks, \nincluding through private-public cooperation and the diversification of activities and \nproducts; \n \n20. Stresses that the cultures, traditions and knowledge of indigenous peoples \nand local communities, in all their aspects, are to be fully considered, respected and \npromoted, as appropriate, in policy development for sustainable tourism, including \necotourism, and underlines the importance of promoting their participation in \ndecisions that affect them and the need to ensure their free, prior and informed consent \nin the integration of their knowledge, heritage and values into sustainable tourism, \nincluding ecotourism initiatives, as appropriate; \n \n21. Emphasizes the need for effective measures, in the context of sustainable \ntourism, including ecotourism initiatives, to ensure the full empowerment of women, \nincluding the equal participation of women and men at all levels and in decision-\nmaking processes in all areas; \n \n22. Also emphasizes the need for effective measures, in the context of \nsustainable tourism, including ecotourism initiatives, to help to ensure the equal \nparticipation of young people and women, persons with disabilities and older persons \nat all levels and in decision-making processes in all areas and to promote the effective \neconomic empowerment, including through international cooperation, of women, \nyoung people, persons with disabilities and older persons in sustainable tourism, \nincluding ecotourism activities, mainly through decent job and income creation; \n \n23. Calls upon the entities of the United Nations system, in the context of the \nSustainable Development Goals, to promote sustainable tourism, including \necotourism, as an instrument that can contribute to achieving those Goals, in \nparticular when it comes to eradicating extreme poverty and ensuring environmental \nsustainability, and to support the efforts and policies of developing countries in this \nfield; \n \n24. Invites Member States and relevant stakeholders to welcome the many \nopportunities that the new digital transformation of the tourism sector offers and calls \nupon them, therefore, to foster smart solutions that integrate knowledge from \ntraditional and non-traditional data sources, supporting related capacity-building \nactivities and ensuring the long-term participation of local communities and the \noverall strengthening of a more holistic, evidence-driven approach to sustainable \ndevelopment in tourism; \n \n25. Calls upon the entities of United Nations system to provide support to \ntourism stakeholders at all levels in their efforts to acquire and utilize the expertise \nneeded for the digital transformation of their businesses and destinations and to \nsupport efforts to enhance the available data with georeferenced, spatial components \nfor the generation of more precise and timely information for tourism; \n \n26. Recognizes the importance of investment in education and training, \nfocusing on issues specific to tourism, in order to enhance competitiveness, and \nencourages regional and international institutions to provide adequate support to \nprogrammes and projects related to sustainable tourism, including ecotourism, taking \ninto account the economic, social, cultural and environmental benefits of such \nactivities; \n \n27. Invites relevant specialized agencies, in particular the World Tourism \nOrganization, United Nations bodies and other organizations, to provide technical \nassistance to Member States, upon request, and to assist, as appropriate, in \nstrengthening legislative or policy frameworks for sustainable tourism, including \n\nPromotion of sustainable tourism, including ecotourism, \nfor poverty eradication and environment protection \nA/RES/73/245\n \n7/8\n18-22623 \n \necotourism, including those for environmental protection and the conservation of \nnatural and cultural heritage; \n \n28. Invites relevant specialized agencies, United Nations bodies, other \norganizations and multilateral financial institutions to provide technical assistance to \nGovernments, upon request and as appropriate, in identifying needs as well as \nopportunities to improve the contribution of sustainable tourism, including \necotourism, to poverty eradication, including through securing wider community \nbenefits from sustainable tourism, including ecotourism activities, as a viable and \nsustainable economic development option; \n \n29. Encourages the public and private sectors, civil society and other relevant \nstakeholders to provide, upon request, assistance for capacity-building, the \ndevelopment of specific guidelines and awareness-raising materials and training for \npeople involved in sustainable tourism, including ecotourism activities, such as \nlanguage training and training in specific skills in tourism services, as well as to \ndevelop or strengthen partnerships, especially in protected areas; \n \n30. Encourages the United Nations, the specialized agencies and other \norganizations, within existing mandates and resources, the public and private sectors \nand other relevant stakeholders to develop awareness-raising materials that target \nlocal development, the empowerment of women, indigenous peoples, local \ncommunities, youth entrepreneurship and innovation, and the protection of traditional \nknowledge and traditional cultural expressions in order to ensure the sustainability of \nthe tourism sector and its contribution to a country\u2019s development objectives; \n \n31. Invites relevant stakeholders to provide, upon request and as appropriate, \ntechnical assistance to assist in building the capacity, including for marketing and \nproduct positioning, of local communities, cooperatives and micro, small and \nmedium-sized businesses involved in sustainable tourism, including ecotourism \nactivities; \n \n32. Recognizes the role of North-South cooperation in promoting sustainable \ntourism, including ecotourism, as a means to achieve economic growth, reduce \ninequalities and improve living standards in developing countries, and also recognizes \nthat South-South and triangular cooperation, as complements to North-South \ncooperation, have the potential to promote sustainable tourism, including ecotourism; \n \n33. Invites Governments and other stakeholders to consider joining the \nframework of the International Network of Sustainable Tourism Observatories of the \nWorld Tourism Organization as a way to promote socioeconomic and environmentally \nsustainable tourism, including ecotourism, and to support better informed sustainable \ntourism policies around the world, mainly through the identification and \ndissemination of best practices and enhanced awareness of and capacity-building for \nsustainability among tourism stakeholders; \n \n34. Encourages Governments, international organizations and the tourism \nsector to improve efforts to regularly measure, as appropriate, the role of sustainable \ntourism, including ecotourism, in order to allow more evidence-based decision-\nmaking, replicability and scalability at the local and national levels, especially in the \ncontext of other economic activities, and with the use of innovative technologies to \naddress sociocultural and environmental impacts, and stresses the need for capacity-\nbuilding for developing countries in this regard; \n \n35. Encourages improved marketing and communication on sustainable \npractices for sustainable tourism, including ecotourism, in order to enhance decision-\nmaking by consumers regarding their needs, in line with the objective of meeting the \nSustainable Development Goals, and to promote sustainable consumption and \nproduction patterns; \n\nA/RES/73/245 \nPromotion of sustainable tourism, including ecotourism,\nfor poverty eradication and environment protection\n \n18-22623\n8/8 \n \n \n36. Requests the Secretary-General to submit to the General Assembly, at its \nseventy-fifth session, in collaboration with the World Tourism Organization and other \nrelevant United Nations agencies and programmes, a report on the implementation of \nthe present resolution, including recommendations on ways and means to promote \nsustainable tourism, including ecotourism, as a tool for fighting poverty and \npromoting sustainable development in its three dimensions \u2013 economic, social and \nenvironmental \u2013 in a balanced and integrated manner, taking into account relevant \nreports prepared by the World Tourism Organization in this field, unless otherwise \nagreed. \n \n62nd plenary meeting  \n20 December 2018 \n \n",
  "paragraphs": {
    "1": "Welcomes the report of the Secretary-General of the World Tourism Organization transmitted by the Secretary-General of the United Nations;19",
    "2": "Recognizes that sustainable tourism, including ecotourism, represents, in many countries, an important driver of sustainable economic growth and decent job creation for all, that it can have a positive impact on income generation and education, irrespective of age, sex, disability, race, ethnicity, origin, religion or economic or other status, and thus on the fight against poverty and hunger, and that it can contribute directly to achieving internationally agreed development goals, including the Sustainable Development Goals;",
    "3": "Also recognizes the potential of sustainable tourism, including ecotourism, to eradicate poverty by improving individual livelihoods in local communities and to generate resources for community development projects;",
    "4": "Emphasizes the need to optimize the economic, social, cultural and environmental benefits stemming from sustainable tourism, including ecotourism activities, in all countries, including African countries, least developed countries, landlocked developing countries, small island developing States and middle-income countries;",
    "5": "Also emphasizes that sustainable tourism, including ecotourism, can contribute to sustainable development, in particular to the conservation and sustainable use of biodiversity and natural resources, and can improve the well-being of indigenous peoples and local communities;",
    "6": "Recognizes that sustainable tourism, including ecotourism, can improve the well-being of indigenous peoples and local communities, including women and young people, and can create significant opportunities for the conservation and sustainable use of biodiversity and/or the protection of natural areas by encouraging indigenous peoples and local communities in host countries and tourists alike to preserve and respect the natural and cultural heritage;",
    "7": "Notes that the Secretary-General of the World Tourism Organization, in his report, invites Member States, international agencies and other relevant organizations to mainstream biodiversity conservation in the tourism sector and in climate change plans and strategies, intertwining economic, social and cultural elements with climate change adaptation approaches and the preservation of relevant ecosystem services;",
    "8": "Encourages all stakeholders to support, as appropriate, the participation of indigenous peoples and local communities in sustainable tourism, including women and young people in all tourism operations, including ecotourism activities, in the light of their expertise and knowledge;",
    "9": "Underlines, in this regard, the importance of establishing, at the national level, where necessary, appropriate policies, guidelines, institutions and regulations, in accordance with national priorities and legislation, for promoting and supporting sustainable tourism, including ecotourism, and minimizing any potential negative impact;",
    "10": "Invites Member States to enhance institutional coherence policy that supports funding mechanisms and initiatives for poverty eradication projects, including initiatives from community-based organizations and small private sector entities;",
    "11": "Invites Governments, international organizations, other relevant institutions and other stakeholders, as appropriate, to encourage and support best practices in relation to the implementation of relevant policies, guidelines and regulations in sustainable tourism, including the ecotourism sector, and to implement and disseminate existing guidelines;",
    "12": "Encourages Member States to use sustainable tourism, including ecotourism, as a tool to foster sustained and inclusive economic growth, social development and financial inclusion and enable the formalization of the informal sector, the promotion of domestic resource mobilization and environmental protection and the eradication of poverty and hunger, including the conservation and sustainable use of biodiversity and natural resources and the promotion of investment and entrepreneurship in sustainable tourism, including ecotourism, in accordance with their national development policies and legislation, which may include promoting the development of small and medium-sized enterprises, promoting cooperatives and facilitating access to financing through inclusive financial services, including microcredit initiatives for the poor, women and young people, indigenous peoples, older persons, persons with disabilities and local communities in all areas, including rural areas;",
    "13": "Encourages the development of tourism infrastructure and the promotion of tourism diversification, including through public-private partnerships, as a way to foster job creation for local communities, the preservation of their way of life, culture and heritage and the promotion of the three dimensions of sustainable development, while simultaneously inviting Member States to take measures to protect the environment and the sociocultural heritage of a destination;",
    "14": "Encourages Governments, the United Nations and the specialized agencies to support the coordination of regional and/or international sustainable tourism development frameworks, as appropriate, in order to assist countries in promoting sustainable tourism, including ecotourism, for poverty eradication and environmental protection;",
    "15": "Underlines the importance of ensuring responsible resource management, addressing the negative impacts of unbalanced tourism, respecting environmental and sociocultural capacities and conducting an environmental impact assessment that does not present additional cost commitments, in accordance with national legislation, for the development of sustainable tourism, including ecotourism opportunities;",
    "16": "Stresses the need to ensure the integration of sustainable consumption and production patterns in the tourism sector, including through identifying and adopting tourism-planning approaches aimed at improving efficiency in the use of resources;",
    "17": "Encourages Member States and other stakeholders to make use of the \u201cTourism for SDGs platform\u201d launched during the 2018 high-level political forum on sustainable development as a partnership tool aimed at advancing the sustainable development of tourism and its contributions to the Sustainable Development Goals;",
    "18": "",
    "19": "Underlines the need to foster resilient tourism development to deal with shocks, taking into account the vulnerability of the tourism sector to emergencies, and invites Member States to develop national strategies for rehabilitation after shocks, including through private-public cooperation and the diversification of activities and products;",
    "20": "Stresses that the cultures, traditions and knowledge of indigenous peoples and local communities, in all their aspects, are to be fully considered, respected and promoted, as appropriate, in policy development for sustainable tourism, including ecotourism, and underlines the importance of promoting their participation in decisions that affect them and the need to ensure their free, prior and informed consent in the integration of their knowledge, heritage and values into sustainable tourism, including ecotourism initiatives, as appropriate;",
    "21": "Emphasizes the need for effective measures, in the context of sustainable tourism, including ecotourism initiatives, to ensure the full empowerment of women, including the equal participation of women and men at all levels and in decision- making processes in all areas;",
    "22": "Also emphasizes the need for effective measures, in the context of sustainable tourism, including ecotourism initiatives, to help to ensure the equal participation of young people and women, persons with disabilities and older persons at all levels and in decision-making processes in all areas and to promote the effective economic empowerment, including through international cooperation, of women, young people, persons with disabilities and older persons in sustainable tourism, including ecotourism activities, mainly through decent job and income creation;",
    "23": "Calls upon the entities of the United Nations system, in the context of the Sustainable Development Goals, to promote sustainable tourism, including ecotourism, as an instrument that can contribute to achieving those Goals, in particular when it comes to eradicating extreme poverty and ensuring environmental sustainability, and to support the efforts and policies of developing countries in this field;",
    "24": "Invites Member States and relevant stakeholders to welcome the many opportunities that the new digital transformation of the tourism sector offers and calls upon them, therefore, to foster smart solutions that integrate knowledge from traditional and non-traditional data sources, supporting related capacity-building activities and ensuring the long-term participation of local communities and the overall strengthening of a more holistic, evidence-driven approach to sustainable development in tourism;",
    "25": "Calls upon the entities of United Nations system to provide support to tourism stakeholders at all levels in their efforts to acquire and utilize the expertise needed for the digital transformation of their businesses and destinations and to support efforts to enhance the available data with georeferenced, spatial components for the generation of more precise and timely information for tourism;",
    "26": "Recognizes the importance of investment in education and training, focusing on issues specific to tourism, in order to enhance competitiveness, and encourages regional and international institutions to provide adequate support to programmes and projects related to sustainable tourism, including ecotourism, taking into account the economic, social, cultural and environmental benefits of such activities;",
    "27": " ecotourism, including those for environmental protection and the conservation of natural and cultural heritage;",
    "28": "Invites relevant specialized agencies, United Nations bodies, other organizations and multilateral financial institutions to provide technical assistance to Governments, upon request and as appropriate, in identifying needs as well as opportunities to improve the contribution of sustainable tourism, including ecotourism, to poverty eradication, including through securing wider community benefits from sustainable tourism, including ecotourism activities, as a viable and sustainable economic development option;",
    "29": "Encourages the public and private sectors, civil society and other relevant stakeholders to provide, upon request, assistance for capacity-building, the development of specific guidelines and awareness-raising materials and training for people involved in sustainable tourism, including ecotourism activities, such as language training and training in specific skills in tourism services, as well as to develop or strengthen partnerships, especially in protected areas;",
    "30": "Encourages the United Nations, the specialized agencies and other organizations, within existing mandates and resources, the public and private sectors and other relevant stakeholders to develop awareness-raising materials that target local development, the empowerment of women, indigenous peoples, local communities, youth entrepreneurship and innovation, and the protection of traditional knowledge and traditional cultural expressions in order to ensure the sustainability of the tourism sector and its contribution to a country\u2019s development objectives;",
    "31": "Invites relevant stakeholders to provide, upon request and as appropriate, technical assistance to assist in building the capacity, including for marketing and product positioning, of local communities, cooperatives and micro, small and medium-sized businesses involved in sustainable tourism, including ecotourism activities;",
    "32": "Recognizes the role of North-South cooperation in promoting sustainable tourism, including ecotourism, as a means to achieve economic growth, reduce inequalities and improve living standards in developing countries, and also recognizes that South-South and triangular cooperation, as complements to North-South cooperation, have the potential to promote sustainable tourism, including ecotourism;",
    "33": "Invites Governments and other stakeholders to consider joining the framework of the International Network of Sustainable Tourism Observatories of the World Tourism Organization as a way to promote socioeconomic and environmentally sustainable tourism, including ecotourism, and to support better informed sustainable tourism policies around the world, mainly through the identification and dissemination of best practices and enhanced awareness of and capacity-building for sustainability among tourism stakeholders;",
    "34": "Encourages Governments, international organizations and the tourism sector to improve efforts to regularly measure, as appropriate, the role of sustainable tourism, including ecotourism, in order to allow more evidence-based decision- making, replicability and scalability at the local and national levels, especially in the context of other economic activities, and with the use of innovative technologies to address sociocultural and environmental impacts, and stresses the need for capacity- building for developing countries in this regard;",
    "35": "",
    "36": "Requests the Secretary-General to submit to the General Assembly, at its seventy-fifth session, in collaboration with the World Tourism Organization and other relevant United Nations agencies and programmes, a report on the implementation of the present resolution, including recommendations on ways and means to promote sustainable tourism, including ecotourism, as a tool for fighting poverty and promoting sustainable development in its three dimensions \u2013 economic, social and environmental \u2013 in a balanced and integrated manner, taking into account relevant reports prepared by the World Tourism Organization in this field, unless otherwise agreed."
  },
  "agenda_items": [
    "Item 24"
  ],
  "symbol_references": []
}