{
  "symbol": "A/RES/79/289",
  "filename": "A_RES_79_289.pdf",
  "title": "79/289. Scope, modalities, format and organization of the high-level plenary meeting of the General Assembly to commemorate the thirtieth anniversary of the World Programme of Action for Youth",
  "text": "United Nations \nA/RES/79/289\n \nGeneral Assembly \nDistr.: General \n3 June 2025 \n25-08701 (E) \n*2508701* \n \n \nSeventy-ninth session \nAgenda item 26 (b) \nSocial development: social development, including questions \nrelating to the world social situation and to youth, ageing, \npersons with disabilities and the family \n \n \n \n \n Resolution adopted by the General Assembly \non 27 May 2025 \n \n \n[without reference to a Main Committee (A/79/L.86)] \n \n \n 79/289. Scope, modalities, format and organization of the high-level \nplenary meeting of the General Assembly to commemorate the \nthirtieth anniversary of the World Programme of Action for Youth \n \n \n \nThe General Assembly, \n \nRecalling its resolution 76/137 of 16 December 2021, entitled \u201cPolicies and \nprogrammes involving youth\u201d, in which it was decided to convene a one-day high-\nlevel plenary meeting of the General Assembly, at the level of Heads of State and \nGovernment and with the full and effective participation of youth, during the general \ndebate of the eightieth session of the General Assembly in 2025, to commemorate the \nthirtieth anniversary of the World Programme of Action for Youth, and its resolution \n78/179 of 19 December 2023, \n \nRecalling also the World Programme of Action for Youth, adopted by the \nGeneral Assembly in its resolutions 50/81 of 14 December 1995 and 62/126 of \n18 December 2007, and acknowledging that the Programme of Action provides \nMember States with a useful policy framework and practical guidelines for improving \nthe situation of youth, \n \n1. \nDecides that the one-day high-level plenary meeting to commemorate the \nthirtieth anniversary of the World Programme of Action on Youth to be convened by \nthe President of the General Assembly shall be held at United Nations Headquarters \nin New York on 25 September 2025 during the general debate of the Assembly at its \neightieth session, from 9 a.m. to 5.30 p.m., and shall consist of an opening segment, \na plenary segment for general discussion, two intergenerational multi-stakeholder \npanels and a brief closing segment; \n\nA/RES/79/289 \nScope, modalities, format and organization of the high-level \nplenary meeting of the General Assembly to commemorate the \nthirtieth anniversary of the World Programme of Action for Youth\n \n25-08701\n2/3 \n \n \n2. \nAlso decides that the overall theme of the high-level meeting will be \n\u201cWorld Programme of Action for Youth at 30: accelerating global progress through \nintergenerational collaboration\u201d; \n \n3. \nFurther decides that the organizational arrangements for the high-level \nmeeting should be as follows: \n \n(a) \nThe opening segment, to be held from 9 to 9.45 a.m., will feature \nstatements by the President of the General Assembly, the Secretary-General, the \nAssistant Secretary-General for Youth Affairs, two representatives of Member States \nat the level of Head of State or Government, and two youth champions, selected in \nconsultation with Member States by the President of the General Assembly and giving \ndue consideration to gender balance and geographical representation; \n \n(b) \nThe plenary segment, to be held from 9.45 a.m. to 12 p.m. and from 2.30 \nto 5.00 p.m., will comprise statements by Member States, members of the United \nNations specialized agencies and observers of the General Assembly; a list of speakers \nwill be established in accordance with the rules of procedure and established practices \nof the Assembly and the time limits for these statements will be three minutes for \nindividual delegations and five minutes for statements made on behalf of a group of \nStates; with the sharing of statement time with youth representatives who are \nmembers of official delegations encouraged; \n \n(c) \nThe closing segment, to be held from 5 to 5.30 p.m., will comprise \nsummaries of the intergenerational multi-stakeholder thematic panel discussions, as \nwell as concluding remarks by the President of the General Assembly and a youth \nchampion; \n \n4. \nDecides that the organizational arrangements for the two intergenerational \nmulti-stakeholder panel discussions will be as follows: \n \n(a) \nTwo intergenerational multi-stakeholder panel discussions will be held in \nparallel to the plenary segment, one from 10 a.m. to 12 p.m. and the other from 2.30 \nto 4.30 p.m.;  \n \n(b) \nThe panels will address the following themes: \n \n \n(i) \nPanel 1: Advancing implementation of the World Programme of Action for \nYouth to leave no one behind; \n \n \n(ii) Panel 2: Full, effective and meaningful youth participation, at national and \ninternational levels, for the benefit of current and future generations; \n \n(c) \nEach of the two panels will be co-chaired by two representatives, one from \na developed country and one from a developing country, to be appointed by the \nPresident of the General Assembly from among the Heads of State or Government \nattending the high-level meeting, in consultation with Member States, taking into \naccount gender balance, level of development and geographical representation;  \n \n(d) \nThe President of the General Assembly may invite parliamentarians, local \ngovernments, the heads or senior representatives of relevant United Nations entities, \nand international financial institutions, development partners, civil society, the private \nsector, academia, Indigenous Peoples, older persons, persons with disabilities and \ncommunity organizations to serve as speakers on the panels, taking into account \ngender balance, level of development, geographical representation and the \nrepresentation of youth;  \n \n5. \nRequests the President of the General Assembly to prepare a concise \nsummary of the high-level meeting and to bring the summary to the attention of \nMember States, relevant United Nations entities and other stakeholders; \n\nScope, modalities, format and organization of the high-level \nplenary meeting of the General Assembly to commemorate the \nthirtieth anniversary of the World Programme of Action for Youth \nA/RES/79/289\n \n3/3\n25-08701 \n \n \n6. \nEncourages all Member States and observers of the General Assembly and \nmembers of the United Nations specialized agencies to participate in the high-level \nmeeting, including the panels, at the level of Head of State or Government or at the \nhighest possible level;  \n \n7. \nInvites representatives of non\u2011governmental organizations with relevant \nexpertise that are in consultative status with the Economic and Social Council to \nregister with the Secretariat to attend the high-level meeting;  \n \n8. \nRequests the President of the General Assembly to draw up a list of \nrepresentatives of other relevant non\u2011governmental organizations, civil society \norganizations, academic institutions and the private sector who may participate in the \nhigh-level meeting, including its panel discussions, taking into account the principles \nof transparency and equitable geographical representation, with due regard for gender \nparity, to submit the proposed list to Member States for their consideration on a \nnon\u2011objection basis 1no later than July 2025 and to bring the list to the attention of \nthe Assembly for a final decision by the Assembly on participation in the high-level \nmeeting; \n \n9. \nInvites representatives mentioned in paragraphs 6, 7 and 8 above to \nparticipate in the intergenerational multi-stakeholder panel discussions;  \n \n10. Encourages Member States and members of the United Nations \nspecialized agencies to include in their delegations to the high-level meeting, as \nappropriate, youth, representatives of relevant stakeholders, such as parliamentarians, \nrepresentatives of civil society, including non\u2011governmental organizations, youth-led \nand youth-focused organizations, Indigenous Peoples, persons with disabilities, \npeople of African descent, community organizations and faith-based organizations, \nacademic institutions, representatives of workers and employers and the private \nsector, with due regard to gender balance; \n \n11. \nEncourages States and international donors, as well as the private sector, \nfinancial institutions, foundations and other donors, to support the participation of \nrepresentatives of developing countries in the high-level meeting, including by \nproviding financial contributions to the United Nations Youth Fund managed by the \nDepartment of Economic and Social Affairs of the Secretariat;  \n \n12. Decides that the high-level meeting shall be webcast, and encourages the \nPresident of the General Assembly and the Secretary-General to give the highest \nvisibility to the high-level meeting through all relevant media platforms and \ninformation and communications technologies. \n \n71st plenary meeting \n27 May 2025 \n \n_______________ \n \n1 The list will include proposed as well as final names. The general basis of any objections, if \nrequested by one or more States Members of the United Nations or States members of the \nspecialized agencies, will be made known to the Office of the President of the General Assembly \nand the requester.  \n",
  "paragraphs": {
    "1": "",
    "2": "Also decides that the overall theme of the high-level meeting will be \u201cWorld Programme of Action for Youth at 30: accelerating global progress through intergenerational collaboration\u201d;",
    "3": "Further decides that the organizational arrangements for the high-level meeting should be as follows: (a) The opening segment, to be held from 9 to 9.45 a.m., will feature statements by the President of the General Assembly, the Secretary-General, the Assistant Secretary-General for Youth Affairs, two representatives of Member States at the level of Head of State or Government, and two youth champions, selected in consultation with Member States by the President of the General Assembly and giving due consideration to gender balance and geographical representation; (b) The plenary segment, to be held from 9.45 a.m. to 12 p.m. and from 2.30 to 5.00 p.m., will comprise statements by Member States, members of the United Nations specialized agencies and observers of the General Assembly; a list of speakers will be established in accordance with the rules of procedure and established practices of the Assembly and the time limits for these statements will be three minutes for individual delegations and five minutes for statements made on behalf of a group of States; with the sharing of statement time with youth representatives who are members of official delegations encouraged; (c) The closing segment, to be held from 5 to 5.30 p.m., will comprise summaries of the intergenerational multi-stakeholder thematic panel discussions, as well as concluding remarks by the President of the General Assembly and a youth champion;",
    "4": "Decides that the organizational arrangements for the two intergenerational multi-stakeholder panel discussions will be as follows: (a) Two intergenerational multi-stakeholder panel discussions will be held in parallel to the plenary segment, one from 10 a.m. to 12 p.m. and the other from 2.30 to 4.30 p.m.; (b) The panels will address the following themes: (i) Panel 1: Advancing implementation of the World Programme of Action for Youth to leave no one behind; (ii) Panel 2: Full, effective and meaningful youth participation, at national and international levels, for the benefit of current and future generations; (c) Each of the two panels will be co-chaired by two representatives, one from a developed country and one from a developing country, to be appointed by the President of the General Assembly from among the Heads of State or Government attending the high-level meeting, in consultation with Member States, taking into account gender balance, level of development and geographical representation; (d) The President of the General Assembly may invite parliamentarians, local governments, the heads or senior representatives of relevant United Nations entities, and international financial institutions, development partners, civil society, the private sector, academia, Indigenous Peoples, older persons, persons with disabilities and community organizations to serve as speakers on the panels, taking into account gender balance, level of development, geographical representation and the representation of youth;",
    "5": "",
    "6": "Encourages all Member States and observers of the General Assembly and members of the United Nations specialized agencies to participate in the high-level meeting, including the panels, at the level of Head of State or Government or at the highest possible level;",
    "7": "Invites representatives of non\u2011governmental organizations with relevant expertise that are in consultative status with the Economic and Social Council to register with the Secretariat to attend the high-level meeting;",
    "8": "Requests the President of the General Assembly to draw up a list of representatives of other relevant non\u2011governmental organizations, civil society organizations, academic institutions and the private sector who may participate in the high-level meeting, including its panel discussions, taking into account the principles of transparency and equitable geographical representation, with due regard for gender parity, to submit the proposed list to Member States for their consideration on a non\u2011objection basis 1no later than July 2025 and to bring the list to the attention of the Assembly for a final decision by the Assembly on participation in the high-level meeting;",
    "9": "Invites representatives mentioned in paragraphs 6, 7 and 8 above to participate in the intergenerational multi-stakeholder panel discussions;",
    "10": "Encourages Member States and members of the United Nations specialized agencies to include in their delegations to the high-level meeting, as appropriate, youth, representatives of relevant stakeholders, such as parliamentarians, representatives of civil society, including non\u2011governmental organizations, youth-led and youth-focused organizations, Indigenous Peoples, persons with disabilities, people of African descent, community organizations and faith-based organizations, academic institutions, representatives of workers and employers and the private sector, with due regard to gender balance;",
    "11": "Encourages States and international donors, as well as the private sector, financial institutions, foundations and other donors, to support the participation of representatives of developing countries in the high-level meeting, including by providing financial contributions to the United Nations Youth Fund managed by the Department of Economic and Social Affairs of the Secretariat;",
    "12": "Decides that the high-level meeting shall be webcast, and encourages the President of the General Assembly and the Secretary-General to give the highest visibility to the high-level meeting through all relevant media platforms and information and communications technologies."
  },
  "agenda_items": [
    "Item 26"
  ],
  "symbol_references": [
    "A/79/L.86"
  ]
}