{
  "symbol": "A/RES/80/70",
  "filename": "A_RES_80_70.pdf",
  "title": "80/70. Comprehensive Nuclear-Test-Ban Treaty",
  "text": "United Nations \nA/RES/80/70 \n \nGeneral Assembly \nDistr.: General \n19 December 2025 \n25-20898 (E) \n*2520898* \n \n \nEightieth session \nAgenda item 105 \nComprehensive Nuclear-Test-Ban Treaty \n \n \n \n \n Resolution adopted by the General Assembly \non 1 December 2025 \n \n \n[on the report of the First Committee (A/80/534, para. 7)] \n \n \n \n80/70. Comprehensive Nuclear-Test-Ban Treaty \n \n \n \nThe General Assembly, \n \nReiterating that the cessation of nuclear-weapon test explosions or any other \nnuclear explosions constitutes an effective nuclear disarmament and non\u2011proliferation \nmeasure, and convinced that this is a meaningful step in the realization of a systematic \nprocess for achieving nuclear disarmament,  \n \nMindful that 2025 marks 80 years since nuclear weapons were first used with \ndevastating consequences, marking the advent of the nuclear age, \n \nRecalling that the Comprehensive Nuclear-Test-Ban Treaty, adopted by the \nGeneral Assembly by its resolution 50/245 of 10 September 1996, was opened for \nsignature on 24 September 1996,  \n \nStressing that a universal and effectively verifiable Treaty constitutes a \nfundamental instrument in the field of nuclear disarmament and non\u2011proliferation and \nwill be a major contribution to international peace and security, \n \nStressing also the vital importance and urgency of achieving the entry into force \nof the Treaty, and affirming its resolute determination, 29 years after the Treaty was \nopened for signature, to achieve its entry into force,  \n \nDeeply concerned by the long-standing lack of progress towards the ratification \nof the Treaty from the remaining nine annex 2 States, which continues to delay the \nentry into force of the Treaty, with the associated risks that nuclear testing could be \nresumed, \n \nEncouraged by the signing of the Treaty by 187 States, including 41 of the 44 \nwhose ratification is needed for its entry into force, and welcoming the ratification of \nthe Treaty by 178 States, including 35 of the 44 whose ratification is needed for its \nentry into force, among which there are 2 nuclear-weapon States,  \n\nA/RES/80/70 \nComprehensive Nuclear-Test-Ban Treaty\n \n25-20898\n2/3 \n \n \nRecognizing the sustained efforts by the Executive Secretary of the Preparatory \nCommission for the Comprehensive Nuclear-Test-Ban Treaty Organization to \npromote the universalization of the Treaty, and encouraging their continuation,  \n \nRecalling its resolution 79/77 of 2 December 2024,  \n \nRecalling also the adoption by consensus of the conclusions and \nrecommendations for follow-on actions of the 2010 Review Conference of the Parties \nto the Treaty on the Non-Proliferation of Nuclear Weapons,1 in which the Conference, \ninter alia, reaffirmed the vital importance of the entry into force of the Comprehensive \nNuclear-Test-Ban Treaty as a core element of the international nuclear disarmament \nand non\u2011proliferation regime and included specific actions to be taken in support of \nthe entry into force of the Treaty,  \n \nRecalling further the Final Declaration adopted by the fourteenth Conference on \nFacilitating the Entry into Force of the Comprehensive Nuclear-Test-Ban Treaty, held \nin New York on 26 September 2025, convened pursuant to article XIV of the Treaty, \nand recalling the Joint Ministerial Statement on the Comprehensive Nuclear-Test-Ban \nTreaty adopted at the ministerial meeting held in New York on 24 September 2024,2 \n \nNoting the contribution of diverse and inclusive participation in building and \nsustaining momentum for the universalization and entry into force of the Treaty, \nincluding through the Youth Group of the Preparatory Commission for the \nComprehensive Nuclear-Test-Ban Treaty Organization, \n \nWelcoming the sustained efforts within the Preparatory Commission for the \nComprehensive Nuclear-Test-Ban Treaty Organization for the equal participation of \nboth men and women in its staff and its capacity-building programmes, including the \nCommission\u2019s mentoring programme to empower the next generation of women in \nscience, technology, engineering and mathematics, and encouraging the continuation \nof such efforts, \n \nWelcoming also the continuing progress in the development of the Treaty\u2019s \nverification regime, which advances the Treaty\u2019s primary non\u2011proliferation and \ndisarmament objective, and the establishment of 307 certified facilities of the \nInternational Monitoring System network, \n \nWelcoming further the renewed focus on ensuring the continued operation and \nlong-term sustainability of the verification regime, \n \nRecognizing the civil and scientific benefits provided by the Treaty\u2019s global \nmonitoring system,  \n \n1. \nStresses the vital importance and urgency of signature and ratification, \nwithout delay and without conditions, in order to achieve the earliest entry into force \nof the Comprehensive Nuclear-Test-Ban Treaty;3 \n \n2. \nWelcomes the contributions by the signatory States to the work of the \nPreparatory \nCommission \nfor \nthe \nComprehensive \nNuclear-Test-Ban Treaty \nOrganization, in particular its efforts to fulfil its mandate to ensure that the \nverification regime of the Treaty will be capable of meeting the verification \nrequirements of the Treaty upon its entry into force, in accordance with article IV of \nthe Treaty, and encourages their continuation;  \n_______________ \n \n1  2010 Review Conference of the Parties to the Treaty on the Non-Proliferation of Nuclear \nWeapons, Final Document, vol. I (NPT/CONF.2010/50 (Vol. I)), part I, Conclusions and \nrecommendations for follow-on actions. \n \n2 A/79/905, annex. \n \n3 See resolution 50/245 and A/50/1027. \n\nComprehensive Nuclear-Test-Ban Treaty \nA/RES/80/70\n \n3/3\n25-20898 \n \n \n3. \nUnderlines the need to maintain momentum towards the completion of all \nelements of the verification regime and put into place plans and adequate resources \nfor its long-term sustainability;  \n \n4. \nUrges all States not to carry out nuclear-weapon test explosions or any \nother nuclear explosions, to maintain their moratoriums in this regard and to refrain \nfrom acts that would defeat the object and purpose of the Treaty, while stressing that \nthese measures do not have the same permanent and legally binding effect as the entry \ninto force of the Treaty;  \n \n5. \nReiterates its condemnation of the six nuclear tests conducted by the \nDemocratic People\u2019s Republic of Korea in violation of relevant Security Council \nresolutions, 4  urges full compliance with the obligations under those resolutions, \nincluding that the Democratic People\u2019s Republic of Korea abandon its nuclear \nweapons programme and not conduct any further nuclear tests, reaffirms its support \nfor the complete, verifiable and irreversible denuclearization of the Korean Peninsula \nin a peaceful manner, welcomes all efforts and dialogue to this end, and encourages \nall parties to continue diplomatic efforts;  \n \n6. \nUrges all States to refrain from any action that may hamper progress \ntowards the entry into force of the Treaty and its universalization; \n \n7. \nAlso urges all States that have not yet signed or ratified, or that have signed \nbut not yet ratified, the Treaty, in particular the nine whose ratification is needed for \nits entry into force, to sign and ratify it as soon as possible and to accelerate their \nratification processes with a view to ensuring their earliest successful conclusion;  \n \n8. \nEncourages further expressions from among the remaining States whose \nratification is needed for the Treaty to enter into force of their intention to pursue and \ncomplete the ratification process; \n \n9. \nWelcomes the reappointment of Robert Floyd as the Executive Secretary \nof the Preparatory Commission for the Comprehensive Nuclear-Test-Ban Treaty \nOrganization by States members of the governing body of the Preparatory \nCommission; \n \n10. Urges all States to remain seized of the issue at the highest political level \nand, where in a position to do so, to promote adherence to the Treaty through bilateral \nand joint outreach, seminars and other means; \n \n11. Decides to include in the provisional agenda of its eighty-first session the \nitem entitled \u201cComprehensive Nuclear-Test-Ban Treaty\u201d. \n \n52nd plenary meeting \n1 December 2025 \n \n_______________ \n \n4 Including Security Council resolutions 1718 (2006), 1874 (2009), 2094 (2013), 2270 (2016), \n2321 (2016) and 2375 (2017). \n",
  "paragraphs": {
    "1": "Stresses the vital importance and urgency of signature and ratification, without delay and without conditions, in order to achieve the earliest entry into force of the Comprehensive Nuclear-Test-Ban Treaty;3",
    "2": "Welcomes the contributions by the signatory States to the work of the Preparatory Commission for the Comprehensive Nuclear-Test-Ban Treaty Organization, in particular its efforts to fulfil its mandate to ensure that the verification regime of the Treaty will be capable of meeting the verification requirements of the Treaty upon its entry into force, in accordance with article IV of the Treaty, and encourages their continuation;",
    "3": "Underlines the need to maintain momentum towards the completion of all elements of the verification regime and put into place plans and adequate resources for its long-term sustainability;",
    "4": "Urges all States not to carry out nuclear-weapon test explosions or any other nuclear explosions, to maintain their moratoriums in this regard and to refrain from acts that would defeat the object and purpose of the Treaty, while stressing that these measures do not have the same permanent and legally binding effect as the entry into force of the Treaty;",
    "5": "Reiterates its condemnation of the six nuclear tests conducted by the Democratic People\u2019s Republic of Korea in violation of relevant Security Council resolutions, 4 urges full compliance with the obligations under those resolutions, including that the Democratic People\u2019s Republic of Korea abandon its nuclear weapons programme and not conduct any further nuclear tests, reaffirms its support for the complete, verifiable and irreversible denuclearization of the Korean Peninsula in a peaceful manner, welcomes all efforts and dialogue to this end, and encourages all parties to continue diplomatic efforts;",
    "6": "Urges all States to refrain from any action that may hamper progress towards the entry into force of the Treaty and its universalization;",
    "7": "Also urges all States that have not yet signed or ratified, or that have signed but not yet ratified, the Treaty, in particular the nine whose ratification is needed for its entry into force, to sign and ratify it as soon as possible and to accelerate their ratification processes with a view to ensuring their earliest successful conclusion;",
    "8": "Encourages further expressions from among the remaining States whose ratification is needed for the Treaty to enter into force of their intention to pursue and complete the ratification process;",
    "9": "Welcomes the reappointment of Robert Floyd as the Executive Secretary of the Preparatory Commission for the Comprehensive Nuclear-Test-Ban Treaty Organization by States members of the governing body of the Preparatory Commission;",
    "10": "Urges all States to remain seized of the issue at the highest political level and, where in a position to do so, to promote adherence to the Treaty through bilateral and joint outreach, seminars and other means;",
    "11": "Decides to include in the provisional agenda of its eighty-first session the item entitled \u201cComprehensive Nuclear-Test-Ban Treaty\u201d."
  },
  "agenda_items": [
    "Item 105"
  ],
  "symbol_references": []
}