{
  "symbol": "A/RES/72/123",
  "filename": "A_RES_72_123.pdf",
  "title": "72/123. Measures to eliminate international terrorism",
  "text": "United Nations \nA/RES/72/123\n \n \nGeneral Assembly \nDistr.: General \n18 December 2017 \n \n17-22167 (E)    201217     \n*1722167* \n \n \nSeventy-second session \nAgenda item 109 \n \n \n \n \n Resolution adopted by the General Assembly \non 7 December 2017 \n \n \n \n \n[on the report of the Sixth Committee (A/72/467)] \n \n \n 72/123. Measures to eliminate international terrorism \n \n \n \nThe General Assembly, \n \nGuided by the purposes and principles of the Charter of the United Nations, \n \nReaffirming, in all its aspects, the United Nations Global Counter-Terrorism \nStrategy, adopted on 8 September 2006,1 which enhances the overall framework for \nthe efforts of the international community to effectively counter the scourge of \nterrorism in all its forms and manifestations, and recalling the first, second, third, \nfourth and fifth biennial reviews of the Strategy, on 4 and 5 September 2008, \n8 September 2010, 28 and 29 June 2012, 12 and 13 June 2014 and 30 June and 1 July \n2016, respectively, and the debates that were held on those occasions, 2  \n \nRecalling its resolutions 62/272 of 5 September 2008, 64/297 of 8 September \n2010, 66/282 of 29 June 2012, 68/276 of 13 June 2014 and 70/291 of 1 July 2016, \n \nRecalling also its resolution 66/10 of 18 November 2011, \n \nRecalling further the Declaration on the Occasion of the Fiftieth Anniversary of \nthe United Nations,3  \n \nRecalling the United Nations Millennium Declaration,4  \n \nRecalling also the 2005 World Summit Outcome,5 and reaffirming, in particular, \nthe section on terrorism, \n__________________ \n \n1  Resolution 60/288. \n \n2  See A/62/PV.117, A/62/PV.118, A/62/PV.119 and A/62/PV.120, A/64/PV.116 and A/64/PV.117, \nA/66/PV.118, A/66/PV.119 and A/66/PV.120, A/68/PV.94, A/68/PV.95, A/68/PV.96 and \nA/68/PV.97, and A/70/PV.108, A/70/PV.109 and A/70/PV.110. \n \n3  Resolution 50/6. \n \n4  Resolution 55/2. \n \n5  Resolution 60/1. \n\nA/RES/72/123 \nMeasures to eliminate international terrorism\n \n17-22167 \n2/7 \n \n \nRecalling further the Declaration on Measures to Eliminate International \nTerrorism, contained in the annex to General Assembly resolution 49/60 of \n9 December 1994, and the Declaration to Supplement the 1994 Declaration on \nMeasures to Eliminate International Terrorism, contained in the annex to Assembly \nresolution 51/210 of 17 December 1996, \n \nRecalling all General Assembly resolutions on measures to eliminate \ninternational terrorism and Security Council resolutions on threats to international \npeace and security caused by terrorist acts, \n \nConvinced of the importance of the consideration of measures to eliminate \ninternational terrorism by the General Assembly as the universal organ having \ncompetence to do so, \n \nDeeply disturbed by the persistence of terrorist acts, which have been carried \nout worldwide, \n \nReaffirming its strong condemnation of the heinous acts of terrorism that have \ncaused enormous loss of human life, destruction and damage, including those which \nprompted the adoption of General Assembly resolution 56/1 of 12 September 2001, \nas well as Security Council resolutions 1368 (2001) of 12 September 2001, \n1373 (2001) of 28 September 2001 and 1377 (2001) of 12 November 2001, and those \nthat have occurred since, \n \nReaffirming also its strong condemnation of the atrocious and deliberate attacks \nthat have occurred against United Nations offices in various parts of the world, \n \nAffirming that States must ensure that any measure taken to combat terrorism \ncomplies with all their obligations under international law and must adopt such \nmeasures in accordance with international law, in particular international human \nrights, refugee and humanitarian law, \n \nStressing the need to strengthen further international cooperation among States \nand among international organizations and agencies, regional and subregional \norganizations and arrangements and the United Nations in order to prevent, combat \nand eliminate terrorism in all its forms and manifestations, wherever and by \nwhomsoever committed, in accordance with the principles of the Charter, \ninternational law and the relevant international conventions, \n \nNoting the role of the Security Council Committee established pursuant  \nto resolution 1373 (2001) concerning counter-terrorism in monitoring the \nimplementation of that resolution, including the taking of the necessary financial, \nlegal and technical measures by States and the ratification or acceptance of the \nrelevant international conventions and protocols, \n \nMindful of the need to enhance the role of the United Nations and the relevant \nspecialized agencies in combating international terrorism and of the proposals of the \nSecretary-General to enhance the role of the Organization in this respect, \n \nWelcoming the establishment of the Office of Counter-Terrorism, as decided in \nits resolution 71/291 of 15 June 2017, and the initiative of the Secretary-General to \ntransfer the Counter-Terrorism Implementation Task Force Office and the United \nNations Counter-Terrorism Centre out of the Department of Political Affairs of the \nSecretariat and into the Office of Counter-Terrorism, \n \nMindful of the essential need to strengthen international, regional and \nsubregional cooperation aimed at enhancing the national capacity of States to prevent \nand effectively suppress international terrorism in all its forms and manifestations, \n \nReiterating its call upon States to review urgently the scope of the existing \ninternational legal provisions on the prevention, repression and elimination of \n\nMeasures to eliminate international terrorism \nA/RES/72/123\n \n3/7 \n17-22167 \n \nterrorism in all its forms and manifestations, with the aim of ensuring that there is a \ncomprehensive legal framework covering all aspects of the matter, \n \nEmphasizing that tolerance and dialogue among civilizations and the \nenhancement of interfaith and intercultural understanding are among the most \nimportant elements in promoting cooperation and success in combating terrorism, and \nwelcoming the various initiatives to this end, \n \nReaffirming that no terrorist act can be justified in any circumstances, \n \nRecalling Security Council resolution 1624 (2005) of 14 September 2005, and \nbearing in mind that States must ensure that any measure taken to combat terrorism \ncomplies with their obligations under international law, in particular international \nhuman rights, refugee and humanitarian law, \n \nNoting recent developments and initiatives at the international, regional and \nsubregional levels to prevent and suppress international terrorism, \n \nNoting also regional and subregional efforts to prevent, combat and eliminate \nterrorism in all its forms and manifestations, wherever and by whomsoever \ncommitted, including through the elaboration of and adherence to regional \nconventions, \n \nRecalling its decision in resolutions 54/110 of 9 December 1999, 55/158 of \n12 December 2000, 56/88 of 12 December 2001, 57/27 of 19 November 2002, 58/81 \nof 9 December 2003, 59/46 of 2 December 2004, 60/43 of 8 December 2005, 61/40 \nof 4 December 2006, 62/71 of 6 December 2007, 63/129 of 11 December 2008, \n64/118 of 16 December 2009, 65/34 of 6 December 2010, 66/105 of 9 December 2011 \nand 67/99 of 14 December 2012 that the Ad Hoc Committee established by General \nAssembly resolution 51/210 of 17 December 1996 should address, and keep on its \nagenda, the question of convening a high-level conference under the auspices of the \nUnited Nations to formulate a joint organized response of the international \ncommunity to terrorism in all its forms and manifestations, \n \nRecalling also that, in the Final Document of the Sixteenth Conference of Heads \nof State or Government of Non-Aligned Countries, adopted in Tehran on 31 August \n2012,6 the Heads of State or Government reiterated the collective position of the \nMovement of Non-Aligned Countries on terrorism and reaffirmed its previous \ninitiative calling for an international summit conference under the auspices of the \nUnited Nations to formulate a joint organized response of the international \ncommunity to terrorism in all its forms and manifestations, 7 as well as other relevant \ninitiatives, \n \nNoting the importance of continuing to strive towards achieving a world free of \nterrorism, \n \nBearing in mind its resolutions 57/219 of 18 December 2002, 58/187 of \n22 December 2003, 59/191 of 20 December 2004, 60/158 of 16 December 2005, \n61/171 of 19 December 2006, 62/159 of 18 December 2007, 63/185 of 18 December \n2008, 64/168 of 18 December 2009, 65/221 of 21 December 2010, 66/171 of \n19 December 2011, 68/178 of 18 December 2013 and 70/148 of 17 December 2015, \n__________________ \n \n6  A/67/506-S/2012/752, annex I, paras. 225 and 226. \n \n7  A/53/667-S/1998/1071, annex I, para. 161. \n\nA/RES/72/123 \nMeasures to eliminate international terrorism\n \n17-22167 \n4/7 \n \n \nHaving examined the report of the Secretary-General8 and the oral report of the \nChair of the Working Group of the Sixth Committee on its work during the seventy-\nsecond session,9  \n \n1. \nStrongly condemns all acts, methods and practices of terrorism in all its \nforms and manifestations as criminal and unjustifiable, wherever and by whomsoever \ncommitted; \n \n2. \nCalls upon all Member States, the United Nations and other appropriate \ninternational, regional and subregional organizations to implement the United Nations \nGlobal Counter-Terrorism Strategy,1 as well as the resolutions relating to the first, \nsecond, third, fourth and fifth biennial reviews of the Strategy, 10 in all its aspects at \nthe international, regional, subregional and national levels without delay, including \nby mobilizing resources and expertise; \n \n3. \nRecalls the pivotal role of the General Assembly in following up the \nimplementation and the updating of the United Nations Global Counter-Terrorism \nStrategy, looks forward to the sixth biennial review, in 2018, and in this regard recalls \nits invitation to the Secretary-General to contribute to the future deliberations of the \nAssembly, and requests the Secretary-General when doing so to provide information \non relevant activities within the Secretariat to ensure overall coordination and \ncoherence in the counter-terrorism efforts of the United Nations system; \n \n4. \nReiterates that criminal acts intended or calculated to provoke a state of \nterror in the general public, a group of persons or particular persons for political \npurposes are in any circumstances unjustifiable, whatever the considerations of a \npolitical, philosophical, ideological, racial, ethnic, religious or other nature that may \nbe invoked to justify them; \n \n5. \nReiterates its call upon all States to adopt further measures in accordance \nwith the Charter of the United Nations and the relevant provisions of international \nlaw, including international standards of human rights, to prevent terrorism and to \nstrengthen international cooperation in combating terrorism and, to that end, to \nconsider, in particular, the implementation of the measures set out in paragraphs 3 (a) \nto (f) of General Assembly resolution 51/210; \n \n6. \nAlso reiterates its call upon all States, with the aim of enhancing the \nefficient implementation of relevant legal instruments, to intensify, as and where \nappropriate, the exchange of information on facts related to terrorism and, in so doing, \nto avoid the dissemination of inaccurate or unverified information; \n \n7. \nReiterates its call upon States to refrain from financing, encouraging, \nproviding training for or otherwise supporting terrorist activities; \n \n8. \nExpresses concern at the increase in incidents of kidnapping and hostage-\ntaking with demands for ransom and/or political concessions by terrorist groups, and \nexpresses the need to address this issue; \n \n9. \nExpresses grave concern over the acute and growing threat posed by \nforeign terrorist fighters, namely, individuals who travel to a State other than their \nStates of residence or nationality for the purpose of the perpetration, planning or \npreparation of, or participation in, terrorist acts or providing or receiving terrorist \ntraining, including in connection with armed conflict, emphasizes the need for States \nto address this issue, including through the implementation of their international \nobligations, and underlines the importance of United Nations capacity-building and \n__________________ \n \n8  A/72/111 and A/72/111/Add.1. \n \n9  See A/C.6/72/SR.28. \n \n10  Resolutions 62/272, 64/297, 66/282, 68/276 and 70/291. \n\nMeasures to eliminate international terrorism \nA/RES/72/123\n \n5/7 \n17-22167 \n \nfacilitation of capacity-building in accordance with existing mandates to assist States, \nincluding those in the most affected regions, upon their request; \n \n10. Emphasizes the need for States to cooperate resolutely against \ninternational terrorism by taking speedy and effective measures to eliminate this \nscourge, and in this regard calls upon all States, in accordance with their obligations \nunder applicable international law and the Charter, to deny safe haven and bring to \njustice or, where appropriate, extradite, on the basis of the principle of extradite or \nprosecute, the perpetrators of terrorist acts or any person who supports, facilitates or \nparticipates or attempts to participate in the financing, planning or preparation of \nterrorist acts; \n \n11. \nUrges States to ensure that their nationals or other persons and entities \nwithin their territory that wilfully provide or collect funds for the benefit of persons \nor entities who commit, or attempt to commit, facilitate or participate in the \ncommission of terrorist acts are punished by penalties consistent with the grave nature \nof such acts; \n \n12. Reminds States of their obligations under relevant international \nconventions and protocols, and Security Council resolutions, including Council \nresolution 1373 (2001), to ensure that perpetrators of terrorist acts are brought to \njustice, and recalls the General Assembly resolutions on measures to eliminate \ninternational terrorism; \n \n13. Reaffirms that international cooperation as well as actions by States to \ncombat terrorism should be conducted in conformity with the principles of the \nCharter, international law and relevant international conventions; \n \n14. Recalls the adoption of the International Convention for the Suppression \nof Acts of Nuclear Terrorism,11 the Amendment to the Convention on the Physical \nProtection of Nuclear Material,12 the Protocol of 2005 to the Convention for the \nSuppression of Unlawful Acts against the Safety of Maritime Navigation 13 and the \nProtocol of 2005 to the Protocol for the Suppression of Unlawful Acts against the \nSafety of Fixed Platforms Located on the Continental Shelf, 14 and urges all States to \nconsider, as a matter of priority, becoming parties to these instruments; \n \n15. Urges all States that have not yet done so to consider, as a matter of priority \nand in accordance with Security Council resolution 1373 (2001) and Council \nresolution 1566 (2004) of 8 October 2004, becoming parties to the relevant \nconventions and protocols as referred to in paragraph 6 of General Assembly \nresolution 51/210, as well as the International Convention for the Suppression of \nTerrorist Bombings,15 the International Convention for the Suppression of the \nFinancing of Terrorism,16 the International Convention for the Suppression of Acts of \nNuclear Terrorism and the Amendment to the Convention on the Physical Protection \nof Nuclear Material, and calls upon all States to enact, as appropriate, the national \nlegislation necessary to implement the provisions of those conventions and protocols, \nto ensure that the jurisdiction of their courts enables them to bring to trial the \n__________________ \n \n11  United Nations, Treaty Series, vol. 2445, No. 44004. \n \n12  Adopted on 8 July 2005 by the Conference to Consider and Adopt Proposed Amendments to the \nConvention on the Physical Protection of Nuclear Material (International Atomic Energy Agency, \ndocument GOV/INF/2005/10-GC(49)/INF/6, attachment). \n \n13  Adopted on 14 October 2005 by the Diplomatic Conference on the Revision of the SUA Treaties \n(International Maritime Organization, document LEG/CONF.15/21). \n \n14  Adopted on 14 October 2005 by the Diplomatic Conference on the Revision of the SUA Treaties \n(International Maritime Organization, document LEG/CONF.15/22). \n \n15  United Nations, Treaty Series, vol. 2149, No. 37517. \n \n16  Ibid., vol. 2178, No. 38349. \n\nA/RES/72/123 \nMeasures to eliminate international terrorism\n \n17-22167 \n6/7 \n \nperpetrators of terrorist acts and to cooperate with and provide support and assistance \nto other States and relevant international, regional and subregional organizations to \nthat end; \n \n16. Urges States to cooperate with the Secretary-General and with one \nanother, as well as with interested intergovernmental organizations, with a view to \nensuring, where appropriate within existing mandates, that technical and other expert \nadvice is provided to those States requiring and requesting assistance in becoming \nparties to and implementing the conventions and protocols referred to in paragraph 15 \nabove; \n \n17. Notes with appreciation and satisfaction that, consistent with the call \ncontained in paragraphs 14 and 15 of General Assembly resolution 71/151 of \n13 December 2016, a number of States became parties to the relevant conventions \nand protocols referred to therein, thereby realizing the objective of wider acceptance \nand implementation of those conventions; \n \n18. Reaffirms the Declaration on Measures to Eliminate International \nTerrorism, contained in the annex to General Assembly resolution 49/60, and the \nDeclaration to Supplement the 1994 Declaration on Measures to Eliminate \nInternational Terrorism, contained in the annex to Assembly resolution 51/210, and \ncalls upon all States to implement them; \n \n19. Calls upon all States to cooperate to prevent and suppress terrorist acts; \n \n20. Urges all States and the Secretary-General, in their efforts to prevent \ninternational terrorism, to make the best use of the existing institutions of the United \nNations; \n \n21. Welcomes the newly established Office of Counter-Terrorism;  \n \n22. Notes that the United Nations Counter-Terrorism Centre is performing its \nduties within the Office of Counter-Terrorism and that the Centre is supporting the \nimplementation of the United Nations Global Counter-Terrorism Strategy, and \nencourages all Member States to collaborate with the Centre and to contribute to the \nimplementation of its activities within the Office; \n \n23. Requests the Terrorism Prevention Branch of the United Nations Office on \nDrugs and Crime in Vienna to continue its efforts to enhance, through its mandate, \nthe capabilities of the United Nations in the prevention of terrorism, and recognizes, \nin the context of the United Nations Global Counter-Terrorism Strategy and Security \nCouncil resolution 1373 (2001), its role in assisting States in becoming parties to and \nimplementing the relevant international conventions and protocols relating to \nterrorism, including the most recent among them, and in strengthening international \ncooperation mechanisms in criminal matters related to terrorism, including through \nnational capacity-building; \n \n24. Invites regional intergovernmental organizations to submit to the \nSecretary-General information on the measures they have adopted at the regional \nlevel to eliminate international terrorism, as well as on intergovernmental meetings \nheld by those organizations; \n \n25. Decides to recommend that the Sixth Committee, at the seventy-third \nsession of the General Assembly, establish a working group with a view to finalizing \nthe process on the draft comprehensive convention on international terrorism as well \nas discussions on the item included in its agenda by Assembly resolution 54/110 \nconcerning the question of convening a high-level conference under the auspices of \nthe United Nations; \n\nMeasures to eliminate international terrorism \nA/RES/72/123\n \n7/7 \n17-22167 \n \n \n26. Recognizes the valuable dialogue and efforts of Member States towards \nresolving any outstanding issues, and encourages all Member States to redouble their \nefforts during the intersessional period; \n \n27. Decides to include in the provisional agenda of its seventy-third session \nthe item entitled \u201cMeasures to eliminate international terrorism\u201d. \n \n67th plenary meeting  \n7 December 2017 \n \n",
  "paragraphs": {
    "1": "Strongly condemns all acts, methods and practices of terrorism in all its forms and manifestations as criminal and unjustifiable, wherever and by whomsoever committed;",
    "2": "Calls upon all Member States, the United Nations and other appropriate international, regional and subregional organizations to implement the United Nations Global Counter-Terrorism Strategy,1 as well as the resolutions relating to the first, second, third, fourth and fifth biennial reviews of the Strategy, 10 in all its aspects at the international, regional, subregional and national levels without delay, including by mobilizing resources and expertise;",
    "3": "Recalls the pivotal role of the General Assembly in following up the implementation and the updating of the United Nations Global Counter-Terrorism Strategy, looks forward to the sixth biennial review, in 2018, and in this regard recalls its invitation to the Secretary-General to contribute to the future deliberations of the Assembly, and requests the Secretary-General when doing so to provide information on relevant activities within the Secretariat to ensure overall coordination and coherence in the counter-terrorism efforts of the United Nations system;",
    "4": "Reiterates that criminal acts intended or calculated to provoke a state of terror in the general public, a group of persons or particular persons for political purposes are in any circumstances unjustifiable, whatever the considerations of a political, philosophical, ideological, racial, ethnic, religious or other nature that may be invoked to justify them;",
    "5": "Reiterates its call upon all States to adopt further measures in accordance with the Charter of the United Nations and the relevant provisions of international law, including international standards of human rights, to prevent terrorism and to strengthen international cooperation in combating terrorism and, to that end, to consider, in particular, the implementation of the measures set out in paragraphs 3 (a) to (f) of General Assembly resolution 51/210;",
    "6": "Also reiterates its call upon all States, with the aim of enhancing the efficient implementation of relevant legal instruments, to intensify, as and where appropriate, the exchange of information on facts related to terrorism and, in so doing, to avoid the dissemination of inaccurate or unverified information;",
    "7": "Reiterates its call upon States to refrain from financing, encouraging, providing training for or otherwise supporting terrorist activities;",
    "8": "Expresses concern at the increase in incidents of kidnapping and hostage- taking with demands for ransom and/or political concessions by terrorist groups, and expresses the need to address this issue;",
    "9": "Expresses grave concern over the acute and growing threat posed by foreign terrorist fighters, namely, individuals who travel to a State other than their States of residence or nationality for the purpose of the perpetration, planning or preparation of, or participation in, terrorist acts or providing or receiving terrorist training, including in connection with armed conflict, emphasizes the need for States to address this issue, including through the implementation of their international obligations, and underlines the importance of United Nations capacity-building and __________________ 8 A/72/111 and A/72/111/Add.1. 9 See A/C.6/72/SR.28. 10 Resolutions 62/272, 64/297, 66/282, 68/276 and 70/291. Measures to eliminate international terrorism A/RES/72/123 5/7 17-22167 facilitation of capacity-building in accordance with existing mandates to assist States, including those in the most affected regions, upon their request;",
    "10": "Emphasizes the need for States to cooperate resolutely against international terrorism by taking speedy and effective measures to eliminate this scourge, and in this regard calls upon all States, in accordance with their obligations under applicable international law and the Charter, to deny safe haven and bring to justice or, where appropriate, extradite, on the basis of the principle of extradite or prosecute, the perpetrators of terrorist acts or any person who supports, facilitates or participates or attempts to participate in the financing, planning or preparation of terrorist acts;",
    "11": "Urges States to ensure that their nationals or other persons and entities within their territory that wilfully provide or collect funds for the benefit of persons or entities who commit, or attempt to commit, facilitate or participate in the commission of terrorist acts are punished by penalties consistent with the grave nature of such acts;",
    "12": "Reminds States of their obligations under relevant international conventions and protocols, and Security Council resolutions, including Council resolution 1373 (2001), to ensure that perpetrators of terrorist acts are brought to justice, and recalls the General Assembly resolutions on measures to eliminate international terrorism;",
    "13": "Reaffirms that international cooperation as well as actions by States to combat terrorism should be conducted in conformity with the principles of the Charter, international law and relevant international conventions;",
    "14": "Recalls the adoption of the International Convention for the Suppression of Acts of Nuclear Terrorism,11 the Amendment to the Convention on the Physical Protection of Nuclear Material,12 the Protocol of 2005 to the Convention for the Suppression of Unlawful Acts against the Safety of Maritime Navigation 13 and the Protocol of 2005 to the Protocol for the Suppression of Unlawful Acts against the Safety of Fixed Platforms Located on the Continental Shelf, 14 and urges all States to consider, as a matter of priority, becoming parties to these instruments;",
    "15": "Urges all States that have not yet done so to consider, as a matter of priority and in accordance with Security Council resolution 1373 (2001) and Council resolution 1566 (2004) of 8 October 2004, becoming parties to the relevant conventions and protocols as referred to in paragraph 6 of General Assembly resolution 51/210, as well as the International Convention for the Suppression of Terrorist Bombings,15 the International Convention for the Suppression of the Financing of Terrorism,16 the International Convention for the Suppression of Acts of Nuclear Terrorism and the Amendment to the Convention on the Physical Protection of Nuclear Material, and calls upon all States to enact, as appropriate, the national legislation necessary to implement the provisions of those conventions and protocols, to ensure that the jurisdiction of their courts enables them to bring to trial the __________________ 11 United Nations, Treaty Series, vol. 2445, No. 44004. 12 Adopted on 8 July 2005 by the Conference to Consider and Adopt Proposed Amendments to the Convention on the Physical Protection of Nuclear Material (International Atomic Energy Agency, document GOV/INF/2005/10-GC(49)/INF/6, attachment). 13 Adopted on 14 October 2005 by the Diplomatic Conference on the Revision of the SUA Treaties (International Maritime Organization, document LEG/CONF.15/21). 14 Adopted on 14 October 2005 by the Diplomatic Conference on the Revision of the SUA Treaties (International Maritime Organization, document LEG/CONF.15/22). 15 United Nations, Treaty Series, vol. 2149, No. 37517. 16 Ibid., vol. 2178, No. 38349. A/RES/72/123 Measures to eliminate international terrorism 17-22167 6/7 perpetrators of terrorist acts and to cooperate with and provide support and assistance to other States and relevant international, regional and subregional organizations to that end;",
    "16": "Urges States to cooperate with the Secretary-General and with one another, as well as with interested intergovernmental organizations, with a view to ensuring, where appropriate within existing mandates, that technical and other expert advice is provided to those States requiring and requesting assistance in becoming parties to and implementing the conventions and protocols referred to in paragraph 15 above;",
    "17": "Notes with appreciation and satisfaction that, consistent with the call contained in paragraphs 14 and 15 of General Assembly resolution 71/151 of 13 December 2016, a number of States became parties to the relevant conventions and protocols referred to therein, thereby realizing the objective of wider acceptance and implementation of those conventions;",
    "18": "Reaffirms the Declaration on Measures to Eliminate International Terrorism, contained in the annex to General Assembly resolution 49/60, and the Declaration to Supplement the 1994 Declaration on Measures to Eliminate International Terrorism, contained in the annex to Assembly resolution 51/210, and calls upon all States to implement them;",
    "19": "Calls upon all States to cooperate to prevent and suppress terrorist acts;",
    "20": "Urges all States and the Secretary-General, in their efforts to prevent international terrorism, to make the best use of the existing institutions of the United Nations;",
    "21": "Welcomes the newly established Office of Counter-Terrorism;",
    "22": "Notes that the United Nations Counter-Terrorism Centre is performing its duties within the Office of Counter-Terrorism and that the Centre is supporting the implementation of the United Nations Global Counter-Terrorism Strategy, and encourages all Member States to collaborate with the Centre and to contribute to the implementation of its activities within the Office;",
    "23": "Requests the Terrorism Prevention Branch of the United Nations Office on Drugs and Crime in Vienna to continue its efforts to enhance, through its mandate, the capabilities of the United Nations in the prevention of terrorism, and recognizes, in the context of the United Nations Global Counter-Terrorism Strategy and Security Council resolution 1373 (2001), its role in assisting States in becoming parties to and implementing the relevant international conventions and protocols relating to terrorism, including the most recent among them, and in strengthening international cooperation mechanisms in criminal matters related to terrorism, including through national capacity-building;",
    "24": "Invites regional intergovernmental organizations to submit to the Secretary-General information on the measures they have adopted at the regional level to eliminate international terrorism, as well as on intergovernmental meetings held by those organizations;",
    "25": "Decides to recommend that the Sixth Committee, at the seventy-third session of the General Assembly, establish a working group with a view to finalizing the process on the draft comprehensive convention on international terrorism as well as discussions on the item included in its agenda by Assembly resolution 54/110 concerning the question of convening a high-level conference under the auspices of the United Nations; Measures to eliminate international terrorism A/RES/72/123 7/7 17-22167",
    "26": "Recognizes the valuable dialogue and efforts of Member States towards resolving any outstanding issues, and encourages all Member States to redouble their efforts during the intersessional period;",
    "27": "Decides to include in the provisional agenda of its seventy-third session the item entitled \u201cMeasures to eliminate international terrorism\u201d. 67th plenary meeting 7 December 2017"
  },
  "agenda_items": [
    "Item 109"
  ],
  "symbol_references": []
}