{
  "symbol": "A/RES/73/296",
  "filename": "A_RES_73_296.pdf",
  "title": "73/296. International Day Commemorating the Victims of Acts of Violence Based on Religion or Belief",
  "text": "United Nations \nA/RES/73/296\n \n \nGeneral Assembly \nDistr.: General \n3 June 2019 \n \n19-08711 (E)    060619  \n*1908711* \n \n \nSeventy-third session \nAgenda item 74 \n \n \n \n \n Resolution adopted by the General Assembly \non 28 May 2019 \n \n \n \n \n[without reference to a Main Committee (A/73/L.85 and A/73/L.85/Add.1)] \n \n \n 73/296. International Day Commemorating the Victims of Acts \nof Violence Based on Religion or Belief \n \n \n \nThe General Assembly,  \n \nReaffirming the purposes and principles enshrined in the Charter of the United \nNations and the Universal Declaration of Human Rights, 1 in particular the right to \nfreedom of thought, conscience and religion,  \n \nSeriously concerned at continuing acts of intolerance and violence based on \nreligion or belief against individuals, including against persons belonging to religious \ncommunities and religious minorities around the world, and at the increasing number \nand intensity of such incidents, which are often of a criminal nature and may have \ninternational characteristics,  \n \nRecalling that States have the primary responsibility to promote and protect \nhuman rights, including the human rights of persons belonging to religious minorities, \nincluding their right to exercise their religion or belief freely, \n \nRecognizing that the open, constructive and respectful debate of ideas, as well \nas interreligious, interfaith and intercultural dialogue, at the local, national, regional \nand international levels, can play a positive role in combating religious hatred, \nincitement and violence,  \n \nReaffirming the positive role that the exercise of the right to freedom of opinion \nand expression and full respect for the freedom to seek, receive and impart \ninformation can play in strengthening democracy and combating religious \nintolerance, and reaffirming further that the exercise of the right to freedom of \nexpression carries with it special duties and responsibilities, in accordance with \narticle 19 of the International Covenant on Civil and Political Rights,2 \n__________________ \n \n1  Resolution 217 A (III). \n \n2  See resolution 2200 A (XXI), annex. \n\nA/RES/73/296 \nInternational Day Commemorating the Victims\nof Acts of Violence Based on Religion or Belief\n \n19-08711\n2/3 \n \n \nEmphasizing that freedom of religion or belief, freedom of opinion and \nexpression, the right to peaceful assembly and the right to freedom of association are \ninterdependent, interrelated and mutually reinforcing, and stressing the role that these \nrights can play in the fight against all forms of intolerance and of discrimination based \non religion or belief,  \n \nEmphasizing also that States, regional organizations, national human rights \ninstitutions, non-governmental organizations, religious bodies, the media and civil \nsociety as a whole have an important role to play in promoting tolerance and respect \nfor religious and cultural diversity and in the universal promotion and protection of \nhuman rights, including freedom of religion or belief,  \n \nAcknowledging the positive contribution of individuals and of relevant civil \nsociety organizations to the promotion of interreligious and intercultural dialogue, \nunderstanding and the culture of peace,  \n \nNoting the cooperation between the United Nations and regional and other \norganizations in the promotion of interreligious and intercultural dialogue, and noting \nalso the work of the United Nations Alliance of Civilizations in promoting \nintercultural dialogue in this respect, \n \nStrongly condemning continuing violence and acts of terrorism targeting \nindividuals, including persons belonging to religious minorities, on the basis of or in \nthe name of religion or belief, and underlining the importance of a comprehensive \nand inclusive community-based preventive approach, involving a wide set of actors, \nincluding civil society and religious communities,  \n \nReaffirming its unequivocal condemnation of all acts, methods and practices of \nterrorism and violent extremism conducive to terrorism, in all its forms and \nmanifestations, wherever and by whomsoever committed, regardless of their \nmotivation,  \n \nReiterating that terrorism and violent extremism as and when conducive to \nterrorism, in all its forms and manifestations, cannot and should not be associated \nwith any religion, nationality, civilization or ethnic group,  \n \nStrongly deploring all acts of violence against persons on the basis of their \nreligion or belief, as well as any such acts directed against their homes, businesses, \nproperties, schools, cultural centres or places of worship, as well as all attacks on and \nin religious places, sites and shrines that are in violation of international law,  \n \nRecognizing that working together to enhance the implementation of existing \nlegal regimes that protect individuals against discrimination and hate crimes, \nincreasing interreligious, interfaith and intercultural efforts and expanding human \nrights education are important first steps in combating incidents of intolerance, \ndiscrimination and violence against individuals on the basis of religion or belief,  \n \nRecognizing also the importance of providing victims of acts of violence based \non religion or belief and members of their families with appropriate support and \nassistance in accordance with applicable law,  \n \n1. \nDecides to designate 22 August as the International Day Commemorating \nthe Victims of Acts of Violence Based on Religion or Belief;  \n \n2. \nInvites all Member States, relevant organizations of the United Nations \nsystem and other international and regional organizations, as well as civil society, \nincluding non-governmental organizations, individuals and the private sector, to \nobserve the International Day in an appropriate manner;  \n\nInternational Day Commemorating the Victims \nof Acts of Violence Based on Religion or Belief \nA/RES/73/296\n \n3/3\n19-08711 \n \n \n3. \nRequests the Secretary-General to bring the present resolution to the \nattention of all Member States, the organizations of the United Nations system and \ncivil society organizations for appropriate observance.  \n \n85th plenary meeting \n28 May 2019 \n \n",
  "paragraphs": {
    "1": "Decides to designate 22 August as the International Day Commemorating the Victims of Acts of Violence Based on Religion or Belief;",
    "2": "Invites all Member States, relevant organizations of the United Nations system and other international and regional organizations, as well as civil society, including non-governmental organizations, individuals and the private sector, to observe the International Day in an appropriate manner; International Day Commemorating the Victims of Acts of Violence Based on Religion or Belief A/RES/73/296 3/3 19-08711",
    "3": "Requests the Secretary-General to bring the present resolution to the attention of all Member States, the organizations of the United Nations system and civil society organizations for appropriate observance. 85th plenary meeting 28 May 2019"
  },
  "agenda_items": [
    "Item 74"
  ],
  "symbol_references": [
    "A/73/L.85"
  ]
}