{
  "symbol": "A/RES/79/244",
  "filename": "A_RES_79_244.pdf",
  "title": "79/244. Investigation into the conditions and circumstances resulting in the tragic death of Dag Hammarskj\u00f6ld and of the members of the party accompanying him",
  "text": "United Nations \nA/RES/79/244\n \nGeneral Assembly \nDistr.: General \n31 December 2024 \n24-24622 (E) \n*2424622* \n \n \nSeventy-ninth session \nAgenda item 129 \nInvestigation into the conditions and circumstances resulting \nin the tragic death of Dag Hammarskj\u00f6ld and of the members \nof the party accompanying him \n \n \n \n \n Resolution adopted by the General Assembly \non 24 December 2024 \n \n \n[without reference to a Main Committee (A/79/L.26)] \n \n \n 79/244. Investigation into the conditions and circumstances resulting in \nthe tragic death of Dag Hammarskj\u00f6ld and of the members of the \nparty accompanying him \n \n \n \nThe General Assembly, \n \nRecalling its resolutions 1759 (XVII) of 26 October 1962, 69/246 of \n29 December 2014, 70/11 of 19 November 2015, 71/260 of 23 December 2016, \n72/252 of 24 December 2017, 74/248 of 27 December 2019 and 77/252 of \n30 December 2022, \n \nUnderlining the shared responsibility to pursue the full truth concerning the \nconditions and circumstances resulting in the tragic death of Dag Hammarskj\u00f6ld and \nof the members of the party accompanying him, \n \nRecognizing that a further inquiry or investigation would be necessary to finally \nestablish the facts of the matter, \n \nExpressing appreciation for the continuing commitment of the Secretary-\nGeneral to the search for the truth in this regard, \n \nWelcoming the report of the Eminent Person appointed pursuant to General \nAssembly resolution 77/252, 1  and recognizing the contributions to his work by \nMember States, in particular those that have appointed independent and high-ranking \nofficials, as well as by individuals and voluntary researchers, \n_______________ \n \n1 See A/78/1006. \n\nA/RES/79/244 \nInvestigation into the conditions and circumstances resulting in the \ntragic death of Dag Hammarskj\u00f6ld and of the members of the \nparty accompanying him\n \n24-24622\n2/2 \n \n \nAcknowledging the letter dated 9 September 2024 from the Secretary-General \naddressed to the President of the General Assembly, transmitting the report of the \nEminent Person, together with his assessment of the way forward, 2 \n \nNoting, in particular, the conclusion drawn by the Eminent Person that it remains \nplausible that an external attack or threat may have been the cause of the crash, \nwhether by way of a direct attack causing flight SE-BDY to crash or by distracting \nthe pilots, \n \n1. \nRequests the Secretary-General to reappoint the Eminent Person appointed \npursuant to General Assembly resolution 77/252 to continue to review the information \nreceived and possible new information made available by Member States, including \nby individuals and private entities, to assess its probative value and to draw \nconclusions from the investigations already conducted; \n \n2. \nUrges all Member States, in particular those referred to in the report, to \nrelease any relevant records in their possession and to provide to the Eminent Person \nand the Secretary-General relevant information related to the death of Dag \nHammarskj\u00f6ld and of the members of the party accompanying him, and to ensure that \nthey have conducted a full review of their archives and records; \n \n3. \nCalls upon those Member States referred to in the report to cooperate with \nand assist the Eminent Person fully, including by appointing without delay \nindependent and high-ranking officials to determine whether relevant information \nexists within their security, intelligence and defence archives, and encourages the \nEminent Person to remain engaged with all high-ranking officials, including those \nwho have concluded their work;  \n \n4. \nEncourages all Member States, as may be appropriate, to make assistance \navailable to the Eminent Person and those voluntarily assisting the Eminent Person \non a voluntary basis to assist in specific tasks that require completion at the request \nof the Eminent Person; \n \n5. \nCalls upon Member States to encourage individuals and private entities to \nensure that any relevant records related to the death of Dag Hammarskj\u00f6ld and of the \nmembers of the party accompanying him are made available for review by the \nEminent Person;  \n \n6. \nRequests the Secretary-General to continue to work towards making key \ndocuments of the Dag Hammarskj\u00f6ld investigation, as identified by the Eminent \nPerson, publicly available through a dedicated online collection; \n \n7. \nAlso requests the Secretary-General to report to the General Assembly \nbefore the end of its eightieth session on progress made; \n \n8. \nDecides to include in the provisional agenda of its eighty-first session the \nitem entitled \u201cInvestigation into the conditions and circumstances resulting in the \ntragic death of Dag Hammarskj\u00f6ld and of the members of the party accompanying \nhim\u201d. \n \n55th (resumed) plenary meeting \n24 December 2024 \n \n_______________ \n \n2 Ibid. \n",
  "paragraphs": {
    "1": "Requests the Secretary-General to reappoint the Eminent Person appointed pursuant to General Assembly resolution 77/252 to continue to review the information received and possible new information made available by Member States, including by individuals and private entities, to assess its probative value and to draw conclusions from the investigations already conducted;",
    "2": "Urges all Member States, in particular those referred to in the report, to release any relevant records in their possession and to provide to the Eminent Person and the Secretary-General relevant information related to the death of Dag Hammarskj\u00f6ld and of the members of the party accompanying him, and to ensure that they have conducted a full review of their archives and records;",
    "3": "Calls upon those Member States referred to in the report to cooperate with and assist the Eminent Person fully, including by appointing without delay independent and high-ranking officials to determine whether relevant information exists within their security, intelligence and defence archives, and encourages the Eminent Person to remain engaged with all high-ranking officials, including those who have concluded their work;",
    "4": "Encourages all Member States, as may be appropriate, to make assistance available to the Eminent Person and those voluntarily assisting the Eminent Person on a voluntary basis to assist in specific tasks that require completion at the request of the Eminent Person;",
    "5": "Calls upon Member States to encourage individuals and private entities to ensure that any relevant records related to the death of Dag Hammarskj\u00f6ld and of the members of the party accompanying him are made available for review by the Eminent Person;",
    "6": "Requests the Secretary-General to continue to work towards making key documents of the Dag Hammarskj\u00f6ld investigation, as identified by the Eminent Person, publicly available through a dedicated online collection;",
    "7": "Also requests the Secretary-General to report to the General Assembly before the end of its eightieth session on progress made;",
    "8": "Decides to include in the provisional agenda of its eighty-first session the item entitled \u201cInvestigation into the conditions and circumstances resulting in the tragic death of Dag Hammarskj\u00f6ld and of the members of the party accompanying him\u201d."
  },
  "agenda_items": [
    "Item 129"
  ],
  "symbol_references": [
    "A/79/L.26"
  ]
}