{
  "symbol": "A/RES/78/69",
  "filename": "A_RES_78_69.pdf",
  "title": "78/69. Oceans and the law of the sea",
  "text": "United Nations \nA/RES/78/69\n \n \nGeneral Assembly \nDistr.: General \n11 December 2023 \n \n23-24917 (E)    261223     \n*2324917* \n \n \nSeventy-eighth session \nAgenda item 75 (a) \nOceans and the law of the sea: oceans and the \nlaw of the sea \n \n \n \nResolution adopted by the General Assembly \non 5 December 2023  \n \n \n[without reference to a Main Committee (A/78/L.15)] \n \n \n \n78/69. Oceans and the law of the sea \n \n \n \nThe General Assembly, \n \nReaffirming its annual resolutions on the law of the sea and on oceans and the \nlaw of the sea, including resolution 77/248 of 30 December 2022, as well as other \nrelevant resolutions concerning the United Nations Convention on the Law of the Sea \n(the Convention),1 \n \nRecalling, in this regard, resolution 77/321 of 1 August 2023 on the Agreement \nunder the United Nations Convention on the Law of the Sea on the Conservation and \nSustainable Use of Marine Biological Diversity of Areas beyond National Jurisdiction, \n \nHaving considered the reports of the Secretary-General,2 the report of the \nintergovernmental conference on an international legally binding instrument under \nthe United Nations Convention on the Law of the Sea on the conservation and \nsustainable use of marine biological diversity of areas beyond national jurisdiction at \nits fifth session,3 the letter dated 30 June 2023 from the President of the conference \nto the President of the General Assembly,4 the report on the work of the Ad Hoc \nWorking Group of the Whole on the Regular Process for Global Reporting and \nAssessment of the State of the Marine Environment, including Socioeconomic \nAspects (the Regular Process),5 the report on the work of the United Nations Open-\nended Informal Consultative Process on Oceans and the Law of the Sea (the Informal \n__________________ \n \n1 United Nations, Treaty Series, vol. 1833, No. 31363. \n \n2 A/78/67 and A/78/339. \n \n3 A/CONF.232/2023/5. \n \n4 A/77/945. \n \n5 A/78/77. \n\nA/RES/78/69 \nOceans and the law of the sea\n \n23-24917\n2/57 \n \nConsultative Process) at its twenty-third meeting,6 and the reports of the thirty-third \nMeeting and the resumed thirty-third Meeting of States Parties to the Convention,7 \n \nRecognizing the pre-eminent contribution provided by the Convention to the \nstrengthening of peace, security, cooperation and friendly relations among all nations \nin conformity with the principles of justice and equal rights and to the promotion of \nthe economic and social advancement of all peoples of the world, in accordance with \nthe purposes and principles of the United Nations as set forth in the Charter of the \nUnited Nations, as well as to the sustainable development of the oceans and seas, \n \nEmphasizing the universal and unified character of the Convention, and \nreaffirming that the Convention sets out the legal framework within which all \nactivities in the oceans and seas must be carried out and is of strategic importance as \nthe basis for national, regional and global action and cooperation in the marine sector, \nand that its integrity needs to be maintained, as recognized also by the United Nations \nConference on Environment and Development in chapter 17 of Agenda 21, 8 \n \nNoting with satisfaction that, in the outcome document of the United Nations \nConference on Sustainable Development, held in Rio de Janeiro, Brazil, from 20 to \n22 June 2012, entitled \u201cThe future we want\u201d,9 as endorsed by the General Assembly \nin resolution 66/288 of 27 July 2012, States recognized that oceans, seas and coastal \nareas form an integrated and essential component of the Earth\u2019s ecosystem and are \ncritical to sustaining it, and that international law, as reflected in the Convention, \nprovides the legal framework for the conservation and sustainable use of the oceans \nand their resources, and stressed the importance of the conservation and sustainable \nuse of the oceans and seas and of their resources for sustainable development, \nincluding through their contributions to poverty eradication, sustained economic \ngrowth, food security and creation of sustainable livelihoods and decent work, while \nat the same time protecting biodiversity and the marine environment and addressing \nthe impacts of climate change, \n \nRecalling that, in \u201cThe future we want\u201d, States underscored that broad public \nparticipation and access to information and judicial and administrative proceedings \nwere essential to the promotion of sustainable development and that sustainable \ndevelopment required the meaningful involvement and active participation of \nregional, national and subnational legislatures and judiciaries, and all major groups, \nand, in this regard, that they agreed to work more closely with major groups and other \nstakeholders and encouraged their active participation, as appropriate, in processes \nthat contribute to decision-making, planning and implementation of policies and \nprogrammes for sustainable development at all levels, \n \nNoting that, in \u201cThe future we want\u201d, States stressed the importance of the \nparticipation of Indigenous Peoples in the achievement of sustainable development \nand recognized the importance of the United Nations Declaration on the Rights of \nIndigenous Peoples10 in the context of global, regional, national and subnational \nimplementation of sustainable development strategies, and in this regard recognizing \nthe importance of the United Nations Declaration on the Rights of Indigenous Peoples \nin the context of the conservation and sustainable use of the ocean and its resources, \n__________________ \n \n6 A/78/129. \n \n7 SPLOS/33/15 and SPLOS/33/19.  \n \n8 Report of the United Nations Conference on Environment and Development, Rio de Janeiro, \n3 \u2013 14 June 1992, vol. I, Resolutions Adopted by the Conference (United Nations publication, \nSales No. E.93.I.8 and corrigendum), resolution 1, annex II. \n \n9 Resolution 66/288, annex. \n \n10 Resolution 61/295, annex. \n\nOceans and the law of the sea \nA/RES/78/69\n \n3/57\n23-24917 \n \n \nGuided by the use of, where available, the relevant traditional knowledge of \nIndigenous Peoples and of local communities in the conservation and sustainable use \nof the ocean and its resources, \n \nRecalling the 2030 Agenda for Sustainable Development,11 and in this regard \nreaffirming the commitment to conserve and sustainably use the oceans, seas and \nmarine resources for sustainable development, as reflected in Goal 14 of the 2030 \nAgenda, which is important to the achievement of the Sustainable Development Goals \ncontained in the 2030 Agenda, \n \nRecalling also its resolution 76/296 of 21 July 2022, in which it endorsed the \ndeclaration entitled \u201cOur ocean, our future, our responsibility\u201d adopted by the high-\nlevel United Nations Conference to Support the Implementation of Sustainable \nDevelopment Goal 14: Conserve and sustainably use the oceans, seas and marine \nresources for sustainable development, held in Lisbon from 27 June to 1 July 2022, \nas well as its resolution 71/312 of 6 July 2017, in which it endorsed the declaration \nentitled \u201cOur ocean, our future: call for action\u201d adopted by the Conference held in \nNew York from 5 to 9 June 2017, and in this regard reaffirming the important role of \nthe declarations in demonstrating the collective determination to act decisively and \nurgently to improve the health, productivity, sustainable use and resilience of the \nocean and its ecosystem, \n \nRecalling further its decision to convene the high-level 2025 United Nations \nConference to Support the Implementation of Sustainable Development Goal 14: \nConserve and sustainably use the oceans, seas and marine resources for sustainable \ndevelopment, co-hosted by Costa Rica and France in June 2025, to support the \nimplementation of Goal 14, \n \nRecognizing the important contributions of the interactive dialogues and \nvoluntary commitments made in the context of the high-level 2022 United Nations \nConference to Support the Implementation of Sustainable Development Goal 14 to \naccelerate the effective and timely implementation of Goal 14, \n \nRecognizing also paragraphs 64 and 65 of the Addis Ababa Action Agenda of \nthe Third International Conference on Financing for Development, adopted by the \nConference, which was held from 13 to 16 July 2015, 12 \n \nWelcoming the ocean-related outcomes of the fifth session of the United Nations \nEnvironment Assembly of the United Nations Environment Programme, especially \nthe resolutions on ending plastic pollution: towards an international legally binding \ninstrument,13 on nature-based solutions for supporting sustainable development, 14 on \nthe sound management of chemicals and waste,15 on biodiversity and health,16 and on \nsustainable nitrogen management,17 \n \nConscious that the problems of ocean space are closely interrelated and need to \nbe considered as a whole through an integrated, interdisciplinary, intersectoral and \nparticipatory approach, and reaffirming the need to improve cooperation and \ncoordination at the national, regional and global levels, in accordance with the \nConvention, to support and supplement the efforts of each State in promoting the \n__________________ \n \n11 Resolution 70/1. \n \n12 Resolution 69/313, annex. \n \n13 UNEP/EA.5/Res.14. \n \n14 UNEP/EA.5/Res.5. \n \n15 UNEP/EA.5/Res.7. \n \n16 UNEP/EA.5/Res.6. \n \n17 UNEP/EA.5/Res.2. \n\nA/RES/78/69 \nOceans and the law of the sea\n \n23-24917\n4/57 \n \nimplementation and observance of the Convention and the integrated management \nand sustainable development of the oceans and seas,  \n \nRecognizing that the realization of the benefits of the Convention could be \nenhanced by international cooperation, technical assistance and advanced scientific \nknowledge, as well as by funding and capacity-building, and reiterating the essential \nneed for cooperation, in accordance with States\u2019 capabilities, including through \ncapacity-building and transfer and development of marine technology, inter alia, in \nrelation to the exploration, exploitation, conservation and management of marine \nresources, the protection and preservation of the marine environment, marine \nscientific research and other activities in the marine environment compatible with the \nConvention, to ensure that all States, especially developing countries, in particular \nthe least developed countries, landlocked developing countries and small island \ndeveloping States, as well as coastal African States, are able both to implement the \nConvention and to benefit from the sustainable development of the oceans and seas, \nas well as to participate fully in global and regional forums and processes dealing \nwith oceans and law of the sea issues, while recognizing the need to also address the \nparticular challenges faced by developing middle-income countries, \n \nEmphasizing the need to strengthen the ability of competent international \norganizations to contribute, at the global, regional, subregional and bilateral levels, \nthrough cooperation programmes with Governments, to the development of national \ncapacity in marine science and the sustainable management of the oceans and their \nresources, \n \nRecalling that marine science is important for eradicating poverty, contributing \nto food security, conserving the world\u2019s marine environment and resources, helping \nto understand, predict and respond to natural events and promoting the sustainable \ndevelopment of the oceans and seas, by improving knowledge, through sustained \nresearch efforts and the evaluation of monitoring results, and applying such \nknowledge to management and decision-making, \n \nExpressing deep concern at the adverse economic, social and environmental \nimpacts of the physical alteration and destruction of marine habitats that may result \nfrom land-based and coastal development activities, in particular those land \nreclamation activities that are carried out in a manner that has a detrimental impact \non the marine environment, \n \nReiterating its serious concern at the current and projected adverse effects of \nclimate change, including rising seawater temperature, ocean deoxygenation, and sea \nlevel rise, as well as ocean acidification, on the marine environment and marine \nbiodiversity, and emphasizing the urgency of addressing these adverse effects, \nconsidering also the importance of preserving the role of the ocean as a carbon sink, \n \nNoting with concern, in this regard, the findings by the World Meteorological \nOrganization, in its Greenhouse Gas Bulletin No. 19, that, in 2022, carbon dioxide \nlevels in the atmosphere were at 417.9 plus or minus 0.2 parts per million, which \nrepresents an increase of 2.2 parts per million, a relative increase of 0.53 per cent, \nover the period 2021\u20132022, and the findings in its State of the Global Climate 2022 \nthat the global mean temperature in 2022 was about 1.15 degrees Celsius above the \n1850 to 1900 baseline,  \n \nNoting with concern also that the World Meteorological Organization, in its \nState of the Global Climate 2022, highlighted that the past eight years, from 2015 to \n2022, were the eight warmest on record, while ocean heat content reached its highest \nrecorded levels, and that the world also continued to see increasing rising of sea \nlevels, concentrations of greenhouse gases and ocean acidification, while the \ncryosphere continued its contraction, \n\nOceans and the law of the sea \nA/RES/78/69\n \n5/57\n23-24917 \n \n \nExpressing concern that climate change continues to increase the severity and \nincidence of coral bleaching throughout tropical seas and weakens the ability of reefs \nto withstand ocean acidification, which could have serious and irreversible negative \neffects on marine organisms, particularly corals, as well as to withstand other \npressures, including overfishing and pollution, \n \nReiterating its deep concern at the vulnerability of the environment and the \nfragile ecosystems of the polar regions particularly affected by the observed and \nprojected adverse effects of climate change and ocean acidification, \n \nRecognizing the need for a more integrated and ecosystem-based approach to, \nfurther study of and the promotion of measures for enhanced cooperation, coordination \nand collaboration relating to the conservation and sustainable use of marine biological \ndiversity of areas beyond national jurisdiction,  \n \nRecognizing also that hydrographic surveys and nautical charting are critical to \nthe safety of navigation and life at sea, environmental protection, including the \nprotection of vulnerable marine ecosystems, and the economics of the global shipping \nindustry, and encouraging further efforts towards electronic charting, which not only \nprovides significantly increased benefits for safe navigation and management of ship \nmovement, but also provides data and information that can be used for sustainably \nmanaged fisheries and sustainably managed aquaculture activities and other sectoral \nuses of the marine environment, the delimitation of maritime boundaries and \nenvironmental protection, and noting that, under the International Convention for the \nSafety of Life at Sea, 1974,18 ships on international voyages are required to carry an \nelectronic chart display and information system, in accordance with the \nimplementation schedule as set out in that Convention,  \n \nNoting with concern threats to maritime safety and security, including piracy, \narmed robbery at sea, smuggling and terrorist acts against shipping, offshore \ninstallations and other maritime interests, and the continuing problem of transnational \norganized crime committed at sea, including illicit traffic in narcotic drugs and \npsychotropic substances, the smuggling of migrants, trafficking in persons and illicit \ntrafficking in firearms, and noting the deplorable loss of life and adverse impact on \ninternational trade, energy security and the global economy resulting from such \nactivities, \n \nNoting the importance of the delineation by coastal States of the outer limits of \nthe continental shelf beyond 200 nautical miles in accordance with the Convention \nand of the role of the Commission on the Limits of the Continental Shelf (the \nCommission) in that regard, \n \nReaffirming the importance of the work of the Commission for coastal States \nand for the international community, \n \nNoting with concern the projected timetable of the work of the Commission on \nthe submissions already received by it and those yet to be received, \n \nTaking note of the letter dated 11 April 2023 from the Chair of the Commission \naddressed to the President of the thirty-third Meeting of States Parties,19 \n \nRecalling its decision, in resolutions 57/141 of 12 December 2002 and 58/240 \nof 23 December 2003, to establish a regular process under the United Nations for \nglobal reporting and assessment of the state of the marine environment, including \nsocioeconomic aspects, both current and foreseeable, building on existing regional \n__________________ \n \n18 United Nations, Treaty Series, vol. 1184, No. 18961. \n \n19 SPLOS/33/10. \n\nA/RES/78/69 \nOceans and the law of the sea\n \n23-24917\n6/57 \n \nassessments, as recommended by the World Summit on Sustainable Development, 20 \nand noting the need for cooperation among all States to this end, and recalling further \nits decisions, most recently in resolution 77/248, regarding the Regular Process, as \nestablished under the United Nations and accountable to the General Assembly, \n \nReaffirming the cross-cutting role of ocean science in Sustainable Development \nGoal 14 of the 2030 Agenda, \n \nReaffirming also its decision, in resolution 72/73 of 5 December 2017, to \nproclaim the United Nations Decade of Ocean Science for Sustainable Development \nfor the 10-year period beginning on 1 January 2021, within existing structures and \navailable resources, \n \nRecognizing the importance and the contribution of the work of the Informal \nConsultative Process established by the General Assembly in its resolution 54/33 of \n24 November 1999 to facilitate the annual review of developments in ocean affairs \nby the Assembly, \n \nReaffirming the importance of the work of the International Seabed Authority \n(the Authority) in accordance with the Convention and the Agreement relating to the \nImplementation of Part XI of the United Nations Convention on the Law of the Sea \nof 10 December 1982 (the Part XI Agreement),21 \n \nReaffirming also the importance of the work of the International Tribunal for \nthe Law of the Sea (the Tribunal) in accordance with the Convention, \n \nI \nImplementation of the Convention and related agreements and instruments \n \n \n1. \nReaffirms the unified character of the Convention and the vital importance \nof preserving its integrity; \n \n2. \nCalls upon all States that have not done so, in order to fully achieve the \ngoal of universal participation, to become parties to the Convention and the Part XI \nAgreement; \n \n3. \nCalls upon States that have not done so, in order to achieve the goal of \nuniversal participation, to become parties to the Agreement for the Implementation of \nthe Provisions of the United Nations Convention on the Law of the Sea of \n10 December 1982 relating to the Conservation and Management of Straddling Fish \nStocks and Highly Migratory Fish Stocks (the Fish Stocks Agreement); 22 \n \n4. \nCalls upon States to harmonize their national legislation with the \nprovisions of the Convention and, where applicable, relevant agreements and \ninstruments, to ensure the consistent application of those provisions and to ensure \nalso that any declarations or statements that they have made or make when signing, \nratifying or acceding to the Convention do not purport to exclude or to modify the \nlegal effect of the provisions of the Convention in their application to the State \nconcerned and to withdraw any such declarations or statements;  \n \n5. \nCalls upon States Parties to the Convention that have not yet done so to \ndeposit with the Secretary-General of the United Nations and, in the case of the outer \nlimit lines of the continental shelf, also with the Secretary-General of the Authority, \n__________________ \n \n20 See Report of the World Summit on Sustainable Development, Johannesburg, South Africa, \n26 August\u20134 September 2002 (United Nations publication, Sales No. E.03.II.A.1 and \ncorrigendum), chap. I, resolution 2, annex. \n \n21 United Nations, Treaty Series, vol. 1836, No. 31364. \n \n22 Ibid., vol. 2167, No. 37924. \n\nOceans and the law of the sea \nA/RES/78/69\n \n7/57\n23-24917 \n \ncopies of charts or lists of geographical coordinates, as provided for in the \nConvention, preferably using the generally accepted and most recent geodetic datums; \n \n6. \nNotes, in this regard, the ongoing efforts of the Secretary-General of the \nUnited Nations to improve the existing geographic information system for the deposit \nby States of charts and geographical coordinates concerning maritime zones, \nincluding lines of delimitation, submitted pursuant to the Convention, and to give due \npublicity thereto, and re-emphasizes the importance of the completion of these efforts \nthrough wide participation and reviews by Member States of the technical standards \nfor the collection, storage and dissemination of the deposited information, developed \nby the International Hydrographic Organization, in cooperation with the Division for \nOcean Affairs and the law of the Sea of the Office of Legal Affairs of the Secretariat \n(the Division), which are not legally binding, in order to ensure compatibility among \ngeographic information systems, electronic nautical charts and other systems;  \n \n7. \nRecalls the note on the practice of the Secretary-General in respect of the \ndeposit of charts and/or lists of geographical coordinates of points under the \nConvention23 and the Guidelines on deposit with the Secretary-General of charts and \nlists of geographical coordinates of points under the United Nations Convention on \nthe Law of the Sea prepared by the Secretariat;24 \n \n8. \nEmphasizes that underwater archaeological, cultural and historical \nheritage needs to be protected and preserved, further emphasizes the duty of States \nunder article 303, paragraph 1, of the Convention to protect objects of an \narchaeological and historical nature found at sea and to cooperate for this purpose, \nand urges all States, in accordance with the Convention, to cooperate, directly or \nthrough competent international bodies, in taking measures to protect and preserve \nsuch objects, and calls upon States to work together on such diverse challenges and \nopportunities as the appropriate relationship between salvage law and scientific \nmanagement and conservation of underwater cultural heritage, increasing \ntechnological abilities to discover and reach underwater sites, looting, destruction, \nillicit trafficking, and growing underwater tourism; \n \n9. \nCalls upon States that have not yet done so to consider becoming parties \nto the 2001 Convention on the Protection of the Underwater Cultural Heritage, 25 and \nnotes in particular the rules annexed to that Convention, which address the \nrelationship between salvage law and scientific principles of management, \nconservation and protection of underwater cultural heritage among Parties, their \nnationals and vessels flying their flag; \n \nII \nCapacity-building \n \n \n10. Recognizes the importance of assisting developing States, in particular the \nleast developed countries, landlocked developing countries and small island \ndeveloping States, as well as coastal African States, in implementing the Convention, \nurges States, international financial institutions, donor agencies, intergovernmental \norganizations, non-governmental organizations and natural and juridical persons to \nmake voluntary financial or other contributions to the trust funds, as referred to in \nresolutions 55/7 of 30 October 2000, 57/141, and 64/71 of 4 December 2009, \n__________________ \n \n23 SPLOS/30/12. \n \n24 Available at https://www.un.org/Depts/los/doalos_publications/publicationstexts/ \nDepositGuidelinesEnglish.pdf. \n \n25 United Nations, Treaty Series, vol. 2562, No. 45694. \n\nA/RES/78/69 \nOceans and the law of the sea\n \n23-24917\n8/57 \n \nestablished for this purpose, and expresses its appreciation to those that have \ncontributed;26 \n \n11. \nEmphasizes that capacity-building is essential to ensure that States, \nespecially developing countries, in particular the least developed countries, \nlandlocked developing countries and small island developing States, as well as coastal \nAfrican States, are able to fully implement the Convention, benefit from the \nsustainable development of the oceans and seas and participate fully in global and \nregional forums on ocean affairs and the law of the sea;  \n \n12. Also emphasizes the need to address the particular challenges faced by \ndeveloping middle-income countries through capacity-building;  \n \n13. Calls for capacity-building initiatives to take into account the needs of \ndeveloping countries, and calls upon States, international organizations and donor \nagencies to make efforts to ensure the sustainability of such initiatives;  \n \n14. Recalls, in this regard, that, in \u201cThe future we want\u201d, States recognized \nthe importance of building the capacity of developing countries to be able to benefit \nfrom the conservation and sustainable use of the oceans and seas and their resources, \nand in this regard emphasized the need for cooperation in marine scientific research \nto implement the provisions of the Convention and the outcomes of the major summits \non sustainable development, as well as for the transfer of technology on mutually \nagreed terms;  \n \n15. Recognizes that promoting the voluntary transfer of technology on \nmutually agreed terms and conducted on fair and reasonable terms and conditions is \nan essential aspect of building capacity in marine science where due regard should be \ngiven to the needs and priorities of developing States, further encourages States to \nuse the Criteria and Guidelines on the Transfer of Marine Technology adopted by the \nAssembly of the Intergovernmental Oceanographic Commission of the United \nNations Educational, Scientific and Cultural Organization at its twenty-second \nsession, in 2003, and recalls the important role of the secretariat of that Commission \nin the implementation and promotion of the Criteria and Guidelines;  \n \n16. Emphasizes the need for international cooperation for capacity-building, \nincluding cross-sectoral cooperation, at national, regional and global levels, to \naddress, in particular, gaps in capacity-building in ocean affairs and the law of the \nsea, including marine science and meteorological sciences; \n \n17. Calls upon donor agencies and international financial institutions to keep \ntheir programmes systematically under review to ensure the availability in all States, \nparticularly in developing States, of the economic, legal, navigational, scientific, \ntechnical and management skills necessary for the full implementation of the \nConvention and the objectives of the present resolution, as well as the sustainable \ndevelopment of the oceans and seas nationally, regionally and globally, and in so \ndoing to bear in mind the interests and needs of landlocked developing States; \n \n18. Encourages intensified efforts to build capacity for developing countries, \nin particular for the least developed countries and small island developing States, as \nwell as coastal African States, to improve aids to navigation and search and rescue \nservices, hydrographic services and the production of nautical charts, including \nelectronic charts, as well as the mobilization of resources and building of capacity \nwith support from international financial institutions and the donor community; \n \n19. Calls upon States and international organizations, including through \nbilateral, regional and global cooperation programmes, technical partnerships and \n__________________ \n \n26 See www.un.org/depts/los/general_assembly/SGReportTrustFunds1August202231July2023.pdf.  \n\nOceans and the law of the sea \nA/RES/78/69\n \n9/57\n23-24917 \n \nfellowships, to continue in a sustainable and comprehensive way to support, promote \nand strengthen capacity-building activities, in particular in developing countries, in \nthe field of marine scientific research by, inter alia, training personnel to develop and \nenhance relevant expertise, providing the necessary equipment, facilities and vessels \nand transferring environmentally sound technologies and methodologies, taking into \naccount the need to improve capacities in the field of taxonomy; \n \n20. Calls upon States and international institutions, including through \nbilateral, regional and global cooperation programmes, technical partnerships and \nfellowships, to support and strengthen capacity-building activities in developing \ncountries, in particular least developed countries and small island developing States, \nto develop their maritime administration and appropriate legal frameworks to \nestablish or enhance the necessary infrastructure, legislative, enforcement and \nmonitoring capabilities to promote effective compliance with and implementation and \nenforcement of their responsibilities under international law;  \n \n21. Also calls upon States and international institutions, including through \nbilateral, regional and global cooperation programmes, technical partnerships and \nfellowships, to support and strengthen capacity-building activities in developing \ncountries, in particular least developed countries and small island developing States, \nin the area of mitigation of and adaptation to climate change impacts on the ocean, \nincluding protection of coasts against sea level rise and through ecosystem-based \napproaches and nature-based solutions;  \n \n22. Invites States, in particular those States with advanced technology and \nmarine capabilities, to explore prospects for improving cooperation with and \nassistance to developing States, in particular least developed countries, landlocked \ndeveloping countries and small island developing States, as well as coastal African \nStates, with a view to better integrating into national policies and programmes \nsustainable and effective development in the marine sector; \n \n23. Calls upon States and international institutions, including through \nbilateral, regional and global cooperation programmes, technical partnerships and \nfellowships, to develop and strengthen capacity-building activities in and to transfer \nto developing countries, in particular least developed countries and small island \ndeveloping States, on mutually agreed terms, and taking into account the Criteria and \nGuidelines on the Transfer of Marine Technology, environmentally sound \ntechnologies and methodologies to study and minimize the impacts of ocean \nacidification, and notes in this regard the international scientific cooperation through \nthe Ocean Acidification International Coordination Centre of the International Atomic \nEnergy Agency and within the Global Ocean Acidification Observing Network; \n \n24. Emphasizes the need to focus on strengthening South-South cooperation \nas an additional way to build capacity and as a cooperative mechanism to further \nenable countries to set their own priorities and needs and to foster actions to \nimplement such cooperation; \n \n25. Recognizes with appreciation the important contribution to capacity-\nbuilding in the field of the law of the sea by the Rhodes Academy of Oceans Law and \nPolicy, a cooperative undertaking by the University of Virginia School of Law, the \nAegean Institute of the Law of the Sea and Maritime Law, the Law of the Sea Institute \nof Iceland, the Max Planck Foundation for International Peace and the Rule of Law, \nthe Netherlands Institute for the Law of the Sea of Utrecht University, the Centre for \nInternational Law of the National University of Singapore, and the University of New \nHampshire School of Marine Science and Ocean Engineering, which enjoys associate \nsponsorship of the Korea Maritime Institute and the Ankara University National \nCenter for the Sea and Maritime Law and offers a prominent three-week summer \n\nA/RES/78/69 \nOceans and the law of the sea\n \n23-24917\n10/57 \n \ncourse annually in Rhodes, Greece, and has graduated 1,088 students from more than \n120 countries; \n \n26. Also recognizes with appreciation the important contribution to capacity-\nbuilding in the field of the law of the sea by the Summer Academy of the International \nFoundation for the Law of the Sea at the Tribunal; \n \n27. Further recognizes with appreciation the important contribution of the \nKorea Maritime Institute to the trust fund to support the internship programmes at the \nTribunal since 2011 and its continued efforts, in cooperation with the Ministry of \nOceans and Fisheries of the Republic of Korea, to provide education and training for \ncapacity-building of developing countries through the Yeosu Academy of the Law of \nthe Sea programme; \n \n28. Recognizes the holding of the regional courses on the continental shelf in \nArusha, United Republic of Tanzania, jointly organized by the African Institute of \nInternational Law and the University of the Faroe Islands, and their continuing \nimportant contribution to capacity-building, particularly in developing countries; \n \n29. Also recognizes the importance of the work of the Malta-based \nInternational Maritime Law Institute of the International Maritime Organization, as a \ncentre of education and training of specialists in maritime law, including government \nlegal advisers and other high-level officials, mainly from developing States, confirms \nits effective capacity-building role in the field of international maritime law, shipping \nlaw and marine environmental law, and urges States, intergovernmental organizations \nand financial institutions to make voluntary financial contributions to the budget of \nthe Institute which runs annually; \n \n30. Further recognizes the importance of the World Maritime University of \nthe International Maritime Organization, as a centre of excellence for maritime \neducation and research, confirms its effective capacity-building role in the field of \nmaritime transportation, policy, administration, management, safety, security and \nenvironmental protection, as well as its role in the international exchange and transfer \nof knowledge, notes the role of the World Maritime University-Sasakawa Global \nOcean Institute, and urges States, intergovernmental organizations and other bodies \nto make voluntary financial contributions to the University\u2019s Endowment Fund; \n \n31. Welcomes the efforts of the Tribunal in holding regional workshops, \nincluding the latest workshop on the role of the Tribunal in the settlement of disputes \nrelating to the law of the sea, held in France on 1 and 2 June 2023, in cooperation \nwith the Institute for Peace and Development at C\u00f4te d\u2019Azur University and with the \nsupport of Cyprus, France and the Korea Maritime Institute; \n \n32. Also welcomes the efforts of the Tribunal in holding capacity-building \nworkshops, including the latest workshop, on the settlement of disputes under the \nConvention for the legal advisers from the African region, held at the Tribunal from \n2 to 7 July 2023, sponsored by the Government of the Republic of Korea; \n \n33. Further welcomes ongoing activities for capacity-building so as to address \nmaritime security and protection of the marine environment of developing States, and \nencourages States and international financial institutions to provide additional \nfunding for capacity-building programmes, including for transfer of technology, \nincluding through the International Maritime Organization and other competent \ninternational organizations;  \n \n34. Recognizes the considerable need to provide sustained capacity-building \nassistance, including on financial and technical aspects, by relevant international \norganizations and donors to developing States, with a view to further strengthening \ntheir capacity to take effective measures against the multiple facets of international \n\nOceans and the law of the sea \nA/RES/78/69\n \n11/57\n23-24917 \n \ncriminal activities at sea, in line with the relevant international instruments, including \nthe United Nations Convention against Transnational Organized Crime and the \nProtocols thereto;27 \n \n35. Also recognizes the need to build the capacity of developing States to raise \nawareness of and support the implementation of improved waste management \npractices, noting the particular vulnerability of small island developing States to the \nimpact of marine pollution of all kinds, in particular from land-based activities and \nmarine debris and nutrient pollution;28 \n \n36. Acknowledges the importance of capacity-building for developing States, \nin particular the least developed countries, landlocked developing countries and small \nisland developing States, as well as coastal African States, for the protection of the \nmarine environment and the conservation and sustainable use of marine resources; \n \n37. Encourages States to consider additional opportunities for capacity-\nbuilding at the regional level; \n \n38. Takes note of the second edition of the Global Ocean Science Report of \nthe Intergovernmental Oceanographic Commission, which assesses the status of and \ntrends in ocean science capacity around the world; \n \n39. Also takes note of the Capacity Development Strategy (2023\u20132030) of the \nIntergovernmental \nOceanographic \nCommission, \nwhich \nrecognizes \ncapacity \ndevelopment as one of the six functions of the Intergovernmental Oceanographic \nCommission Medium-Term Strategy (2022\u20132029), enabling all Member States to \nparticipate in, and benefit from, ocean research and services that are vital to \nsustainable development and human welfare on the planet; 29 \n \n40. Calls upon States to continue to assist developing States, and especially \nthe least developed countries and small island developing States, as well as coastal \nAfrican States, at the bilateral and, where appropriate, multilateral levels, in the \npreparation of submissions to the Commission regarding the establishment of the \nouter limits of the continental shelf beyond 200 nautical miles, including the \nassessment of the nature and extent of the continental shelf of a coastal State, and \nrecalls that coastal States can make requests to the Commission for scientific and \ntechnical advice in the preparation of data for their submissions, in accordance with \narticle 3 of annex II to the Convention;  \n \n41. \nRecognizes the importance of the trust fund established pursuant to \nresolution 55/7, and referred to in annex II thereto,30 in providing developing States \nwith all relevant forms of financial and technical assistance in complying with the \nrequirements relating to their submissions to the Commission; \n \n42. Calls upon the Division to continue to disseminate information on relevant \nprocedures related to the trust fund established for the purpose of facilitating the \npreparation of submissions to the Commission and to continue its dialogue with \npotential beneficiaries with a view to providing financial support to developing \ncountries for activities to facilitate their submissions in accordance with the \n__________________ \n \n27 United Nations, Treaty Series, vols. 2225, 2237, 2241 and 2326, No. 39574. \n \n28 See 2012 Guidelines for the Development of a Regional Reception Facilities Plan, International \nMaritime Organization, resolution MEPC.221(63). \n \n29 See Intergovernmental Oceanographic Commission, document IOC/A-32/Decisions, decision \nA-32/4.3. \n \n30 See the terms of reference, guidelines and rules of the voluntary trust fund established by the \nGeneral Assembly in its resolution 55/7 for the purpose of facilitating the preparation of \nsubmissions to the Commission on the Limits of the Continental Shelf for developing States, in \nparticular the least developed countries and small island developing States, as amended by the \nAssembly in its resolutions 58/240, 70/235 and 73/124. \n\nA/RES/78/69 \nOceans and the law of the sea\n \n23-24917\n12/57 \n \nrequirements of article 76 of the Convention and with the rules of procedure 31 and the \nScientific and Technical Guidelines of the Commission; 32 \n \n43. Requests the Secretary-General, in cooperation with States and relevant \ninternational organizations and institutions, to continue to support training and other \nactivities to assist developing States in the preparation and presentation of their \nsubmissions to the Commission;  \n \n44. \nRecognizes with appreciation the contribution of the Division to capacity-\nbuilding activities at the national and regional levels, in particular the work of the \nDivision in promoting wider appreciation of the Convention and in assisting with its \nimplementation, through the provision of information, advice and assistance to States \nand intergovernmental organizations, as well as the support of the Division for \nMember State implementation of the relevant parts of the 2030 Agenda for \nSustainable Development, and the implementation by the Division of the programmes \nof assistance, funded by the Norwegian Agency for Development Cooperation, to \nmeet the strategic capacity needs of developing States in the field of ocean \ngovernance and the law of the sea; \n \n45. Notes with appreciation the joint delivery of regional online trainings for \nEast Africa, West Africa, the Pacific and the Indian Ocean region on ocean affairs and \nthe law of the sea, including the development of a self-paced e-learning platform by \nthe Division and other partners under the PROBLUE Ocean Governance Capacity-\nBuilding Training Programme (World Bank); \n \n46. Notes the partnership between the Division and the Intergovernmental \nOceanographic Commission on a training programme on marine scientific research \nunder the Convention, and encourages States, relevant international organizations and \nother donors to consider supporting the initiative;  \n \n47. Invites the Secretary-General, in cooperation with Member States, \ninternational \nfinancial \ninstitutions, \ndonor \nagencies \nand \nintergovernmental \norganizations, to endeavour to expand the capacity-building activities of the Division \nin order to meet the increased need for assistance to developing States; \n \n48. Invites States, international financial institutions, donor agencies, \nintergovernmental organizations, non-governmental organizations and natural and \njuridical persons to support the capacity-building activities of the Division, including \nby making earmarked voluntary contributions to the trust fund established by the \nSecretary-General for the Office of Legal Affairs to support the promotion of \ninternational law, and expresses its appreciation to those that have contributed; \n \n49. Recognizes with appreciation the important contribution to the capacity-\nbuilding of developing countries and the promotion of the law of the sea made by the \nHamilton Shirley Amerasinghe Memorial Fellowship on the Law of the Sea, which \nwas established by the General Assembly in 1981 in honour of the first President of \nthe Third United Nations Conference on the Law of the Sea, expresses its appreciation \nto States that have made contributions to the voluntary trust fund for the Fellowship, \nnotes that the financial state of the Fellowship remains a concern and that contributions \nare encouraged to ensure that at least one fellowship can be awarded annually, expresses \nits commitment to further promote the importance of the Fellowship, and urges States, \ninternational financial institutions, donor agencies, intergovernmental organizations, \nnon-governmental organizations and natural and juridical persons to make voluntary \nfinancial contributions in support of the Fellowship; \n__________________ \n \n31 CLCS/40/Rev.1. \n \n32 CLCS/11, CLCS/11/Corr.1, CLCS/11/Add.1 and CLCS/11/Add.1/Corr.1. \n\nOceans and the law of the sea \nA/RES/78/69\n \n13/57\n23-24917 \n \n \n50. \nAlso recognizes with appreciation the important contribution of the United \nNations-Nippon Foundation Fellowship Programme and the Strategic Needs \nFellowship Programme to human resources development for Member States, \nparticularly developing Member States, in the field of ocean affairs and the law of the \nsea and related disciplines, as well as the fostering of global interlinkages and \ncontinuing capacity development through the alumni programme; \n \n51. Encourages competent international organizations, the United Nations \nDevelopment Programme and international financial institutions and funds to \nconsider expanding their programmes within their respective fields of competence for \nassistance to developing countries and to coordinate their efforts, and recognizes the \nfunding available from the Global Environment Facility, as well as other funds \nallocated for projects relating to oceans; \n \nIII \nMeeting of States Parties \n \n \n52. Welcomes the reports of the thirty-third Meeting and the resumed thirty-\nthird Meeting of States Parties to the Convention;  \n \n53. Requests the Secretary-General to continue to provide services to the \nthirty-third Meeting of States Parties to the Convention, including documentation, to \nconvene the thirty-fourth Meeting of States Parties from 10 to 14 June 2024, with full \nconference services, including documentation, as required, and to convene the thirty-\nfifth Meeting of States Parties for five days in 2025, with full conference services, \nincluding documentation, as required; \n \nIV \nPeaceful settlement of disputes \n \n \n54. \nNotes with satisfaction the continued and significant contribution of the \nTribunal to the settlement of disputes by peaceful means in accordance with Part XV \nof the Convention, and underlines the important role and authority of the Tribunal \nconcerning the interpretation or application of the Convention and the Part XI \nAgreement; \n \n55. Pays tribute to the important and long-standing role of the International \nCourt of Justice with regard to the peaceful settlement of disputes concerning the law \nof the sea; \n \n56. \nNotes that States parties to an international agreement relating to the \npurposes of the Convention may submit to, inter alia, the Tribunal or the International \nCourt of Justice any dispute concerning the interpretation or application of that \nagreement submitted in accordance with that agreement, and also notes the possibility, \nprovided for in the Statutes of the Tribunal and the Court, to submit disputes to a \nchamber; \n \n57. Encourages States Parties to the Convention that have not yet done so to \nconsider making a written declaration, choosing from the means set out in article 287 \nof the Convention for the settlement of disputes concerning the interpretation or \napplication of the Convention and the Part XI Agreement, bearing in mind the \ncomprehensive character of the dispute settlement mechanism provided for in Part XV \nof the Convention; \n \n58. Recalls the successful completion of the first compulsory conciliation \nunder annex V to the Convention, pursuant to section 3 of Part XV, in 2018, which \nassisted the parties in reaching agreement on a treaty establishing their maritime \n\nA/RES/78/69 \nOceans and the law of the sea\n \n23-24917\n14/57 \n \nboundaries,33 and calls upon States to consider all means to peacefully settle disputes \nin accordance with international law; \n \nV \nThe Area  \n \n \n59. Reiterates the importance of the ongoing elaboration and standardization \nby the Authority, pursuant to article 145 of the Convention, of rules, regulations and \nprocedures to ensure the effective protection of the marine environment, for, inter alia, \nthe protection and conservation of the natural resources of the Area and for the \nprevention of damage to the flora and fauna of the marine environment from harmful \neffects that may arise from activities in the Area; \n \n60. Welcomes the progress of the work of the Authority on draft regulations \nfor exploitation of mineral resources in the Area, but also notes the impact of the \ncoronavirus disease (COVID-19) on the meetings within its premises in 2020 and \n2021, and in this regard encourages the Authority to continue its work on the draft \nregulations as a matter of priority and to provide sufficient opportunities and time for \nsubstantive consideration and discussion of the draft regulations as well as the \nrelevant standards and guidelines, and emphasizes the ongoing need for openness and \ntransparency and for the draft regulations to ensure that any exploitation activities \nwould take place with the effective protection of the marine environment in \naccordance with the Convention; \n \n61. \nNotes the adoption by the Council of decisions ISBA/28/C/9, \nISBA/28/C/24 and ISBA/28/C/25 at its twenty-eighth session; \n \n62. Also notes the decisions adopted to create the position of interim director \ngeneral of the Enterprise34 and the supplementary budget for the period 2023\u20132024 to \ncover the costs associated with the establishment of the position; 35  \n \n63. Further notes the conclusion of an agreement of cooperation between the \nInternational Labour Organization and the Authority, approved by the Council at the \nsecond part of its twenty-eighth session;36  \n \n64. Notes the endorsement by the Assembly, at the twenty-eighth session of \nthe Authority, of the memorandum of understanding between the Authority and the \nInternational Relations Institute of Cameroon concerning the establishment of a \ncurriculum on the law of the sea and Part XI of the Convention, 37 and of a \nmemorandum of understanding between the Authority and the National Institute of \nOceanography and Fisheries of Egypt concerning the establishment of a joint regional \ntraining and research centre;38  \n \n65. Also notes that the Council and the Assembly accepted the amendments to \nthe statute of the International Civil Service Commission adopted by the General \nAssembly at its seventy-seventh session in its resolution 77/256 A of 30 December \n2022;39  \n__________________ \n \n33 See A/73/368, para. 19. \n \n34 ISBA/28/C/10 and ISBA/28/C/23. \n \n35 See ISBA/28/A/15. \n \n36 See ISBA/28/C/16. \n \n37 See ISBA/28/A/12. \n \n38 See ISBA/28/A/13. \n \n39 See ISBA/28/A/14. \n\nOceans and the law of the sea \nA/RES/78/69\n \n15/57\n23-24917 \n \n \n66. Further notes the decisions adopted on the development of binding \nenvironmental threshold values and on the commissioning of a study on the \ninternalization of environmental costs of exploitation activities in the Area; 40 \n \n67. Recalls the relevance of the advisory opinion on the responsibilities and \nobligations of States sponsoring persons and entities with respect to activities in the \nArea, issued by the Seabed Disputes Chamber of the Tribunal on 1 February 2011; 41 \n \n68. Recognizes the importance of the responsibilities entrusted to the \nAuthority by articles 143 and 145 of the Convention, which refer to marine scientific \nresearch in the Area and protection of the marine environment, respectively; \n \n69. Notes the decision of the Assembly to extend the current strategic plan of \nthe Authority for the period 2019\u20132023 for two years, the request to the Secretary-\nGeneral of the Authority to review and update the high-level action plan for the period \n2019\u20132023 as necessary for the same period, and the decision to include the periodic \nreview of the international regime of the Area pursuant to article 154 of the \nConvention as an agenda item for the twenty-ninth session of the Assembly, in 2024, \nwith a view to adopting a decision;42  \n \n70. Also notes the Authority database (DeepData), which aims to serve as the \nprincipal repository of all data and information relating to activities in the Area; \n \n71. Encourages the Authority to continue its work towards the standardization \nof marine bathymetric information collected in the Area, in cooperation with relevant \ninternational \norganizations, including the Intergovernmental \nOceanographic \nCommission and the International Hydrographic Organization, particularly under the \nSeabed 2030 project;43 \n \n72. Notes the progress made in the development of environmental \nmanagement plans for the Area, and encourages the Authority to continue advancing \non the development of regional environmental management plans in priority areas in \nthe Area, such as the northern Mid-Atlantic Ridge, the Indian Ocean and the North-\nWest Pacific, as well as notes the efforts of the Authority to continue its work on a \nrevised standardized framework, including the standardized procedure and \ntemplate;44 \n \nVI \nEffective functioning of the Authority and the Tribunal \n \n \n73. Commends the progress in the work of the Authority; \n \n74. Also commends the work of the Tribunal since its establishment; \n \n75. Appeals to all States Parties to the Convention to pay their assessed \ncontributions to the Tribunal in full and on time, and also appeals to States Parties in \narrears with their contributions to fulfil their obligations without delay;  \n \n76. Expresses serious concern about the number of States Parties to the \nConvention in arrears with their assessed contributions to the Authority, appeals to all \nStates Parties to the Convention to pay their assessed contributions to the Authority \nin full and on time, and urges them to fulfil their obligations without delay, in \nparticular those States whose exercise of voting rights has been suspended by virtue \n__________________ \n \n40 ISBA/27/C/42 and ISBA/27/C/43. \n \n41 See ISBA/17/A/9. \n \n42 See ISBA/28/A/16. \n \n43 See ISBA/23/A/2. \n \n44 See ISBA/26/C/10, ISBA/27/C/37 and ISBA/28/C/27. \n\nA/RES/78/69 \nOceans and the law of the sea\n \n23-24917\n16/57 \n \nof article 184 of the Convention, and invites the Secretary-General of the Authority \nto continue his efforts to recover arrears, including bilateral efforts; 45  \n \n77. Notes that there remains room for improvement in the level of attendance \nat the Assembly, and urges all members of the Authority to participate in the meetings \nof the Assembly; \n \n78. Expresses its appreciation to the donors that have made contributions to \nthe voluntary trust funds of the Authority, and encourages Member States, observers, \ncontractors and other stakeholders to contribute financially to these trust funds;46 \n \n79. \nNotes with serious concern the depleted balance of the voluntary trust fund \nestablished pursuant to the decision of the Authority at its eighth session 47 for the \npurpose of defraying the cost of participation of members of the Legal and Technical \nCommission from developing countries and members of the Finance Committee from \ndeveloping countries in the meetings of the Commission and of the Committee, notes \nthe appeals to members and other possible donors to make contributions to that fund, \nand to contractors to consider making a payment of 6,000 United States dollars on a \nvoluntary basis, and expresses its appreciation to those that have made contributions \nto the voluntary trust fund;48 \n \n80. Expresses its appreciation to States that have made contributions to the \nendowment fund for marine scientific research in the Area established by the Authority \nat its twelfth session,49 for the purpose of promoting and encouraging the conduct of \ncollaborative marine scientific research in the Area, and encourages States, observers, \ncontractors and other stakeholders to make additional contributions to this fund;50 \n \n81. Emphasizes the importance of the rules and staff regulations of the \nTribunal in promoting the recruitment of a geographically representative staff in the \nProfessional and higher categories, and welcomes the actions taken by the Tribunal \nin observance of those rules and regulations;  \n \n82. Calls upon States that have not done so to consider ratifying or acceding \nto the Agreement on the Privileges and Immunities of the Tribunal 51 and to the \nProtocol on the Privileges and Immunities of the Authority;52  \n \nVII \nThe continental shelf and the work of the Commission \n \n \n83. Recalls that, in accordance with the Convention, coastal States shall \nsubmit information on the limits of the continental shelf beyond 200 nautical miles to \nthe Commission, which shall make recommendations to coastal States on matters \nrelated to the establishment of the outer limits of their continental shelf, and that such \nlimits established by the coastal State on the basis of these recommendations shall be \nfinal and binding; \n \n84. Also recalls that, in accordance with article 77, paragraph 3, of the \nConvention, the rights of the coastal State over the continental shelf do not depend \non occupation, effective or notional, or on any express proclamation; \n__________________ \n \n45 See ISBA/26/A/19. \n \n46 Ibid. \n \n47 See ISBA/8/A/11. \n \n48 See ISBA/26/A/19. \n \n49 See ISBA/12/A/11. \n \n50 See ISBA/26/A/19. \n \n51 United Nations, Treaty Series, vol. 2167, No. 37925. \n \n52 Ibid., vol. 2214, No. 39357. \n\nOceans and the law of the sea \nA/RES/78/69\n \n17/57\n23-24917 \n \n \n85. Notes with satisfaction that a considerable number of States Parties to the \nConvention have submitted information to the Commission regarding the \nestablishment of the outer limits of the continental shelf beyond 200 nautical miles, \nas well as preliminary information indicative of the outer limits of the continental \nshelf beyond 200 nautical miles and a description of the status of preparation and \nintended date of submission, and also notes with satisfaction that additional \nsubmissions referred to in preliminary information have been filed with the \nCommission; \n \n86. Also notes with satisfaction the progress in the work of the Commission 53 \nand that it is giving current consideration to a number of submissions that have been \nmade regarding the establishment of the outer limits of the continental shelf beyond \n200 nautical miles;  \n \n87. \nTakes note of the 40 recommendations made by the Commission on the \nsubmissions of 32 coastal States, and welcomes the fact that summaries of \nrecommendations are being made publicly available in accordance with paragraph 11.3 \nof annex III to the rules of procedure of the Commission; \n \n88. Notes that the consideration by the Commission of submissions by coastal \nStates in accordance with article 76 of and annex II to the Convention is without \nprejudice to the application of other parts of the Convention by States Parties; \n \n89. Calls attention to the considerable number of submissions yet to be \nconsidered by the Commission and the demands that this places on its members and \nthe secretariat as provided by the Division, and emphasizes the need to ensure that \nthe Commission can perform its functions expeditiously, efficiently and effectively \nwith its full membership and maintain its high level of quality and expertise; \n \n90. Reiterates its invitation to the Commission to continue meeting for a total \nof 21 weeks per year by holding three sessions of seven weeks each, with no two \nsessions being sequential, for the remainder of its current five-year term of office, \nand further notes that more than nine subcommissions are actively considering \nsubmissions; \n \n91. Requests the Secretary-General of the United Nations to continue to take \nappropriate measures, within overall existing resource levels, to further strengthen \nthe capacity of the Division, serving as the secretariat of the Commission, in order to \nensure enhanced support and assistance to the Commission and its subcommissions \nin their consideration of submissions, as required by paragraph 9 of annex III to the \nrules of procedure of the Commission, in particular its human resources, taking into \naccount the need for simultaneous work on several submissions; \n \n92. Urges the Secretary-General to continue to provide all necessary \nsecretariat services to the Commission in accordance with article 2, paragraph 5, of \nannex II to the Convention; \n \n93. Requests the Secretary-General to take appropriate and timely measures to \nensure secretariat services for the Commission and its subcommissions for the \nextended duration of time requested in the decisions of the twenty-first and twenty-\nsixth Meetings of States Parties to the Convention; \n \n94. Also requests the Secretary-General, consequently, to continue to allocate \nappropriate and sufficient resources to the Division to provide adequate services and \nassistance to the Commission in view of the number of its working weeks; \n__________________ \n \n53 See CLCS/55/2, CLCS/56/1, CLCS/57/2 and CLCS/58/2.  \n\nA/RES/78/69 \nOceans and the law of the sea\n \n23-24917\n18/57 \n \n \n95. Notes that the Meeting of States Parties to the Convention, in its decisions \nregarding the conditions of service of the members of the Commission, 54 reaffirmed \nthe obligation of States under the Convention whose experts were serving on the \nCommission to defray the expenses of the experts they had nominated while the \nexperts are in performance of Commission duties, including the provision of medical \ncoverage, and urged those States to do their utmost to ensure the full participation of \nthose experts in the work of the Commission, including the meetings of \nsubcommissions, in accordance with the Convention; \n \n96. Also notes the request of the thirty-third Meeting of States Parties to the \nConvention that the consideration of the conditions of service of the members of the \nCommission continue within the open-ended working group established by the \ntwenty-third Meeting of States Parties to the Convention, and emphasizes the urgency \nof finding appropriate solutions;55 \n \n97. Further notes the decision of the thirty-third Meeting of States Parties to \nthe Convention to adopt a pattern of elections and of the commencement of the term \nof office of members of the Commission, according to which the Meeting will \ncontinue holding elections of members of the Commission one year before the \nexpiration of the five-year term of office of the sitting members, in the light of the \nadministrative and logistical benefits;56 \n \n98. Emphasizes the importance of the voluntary trust funds established \npursuant to resolution 55/7, for the purpose of facilitating the preparation of \nsubmissions to the Commission and providing assistance to developing States to meet \nthe travel and daily subsistence allowance costs associated with meeting with the \nCommission, and for the purpose of facilitating the participation of members of the \nCommission from developing States in the meetings of the Commission, and \nexpresses its appreciation for the contributions made to these trust funds;  \n \n99. Reiterates its serious concern regarding the persistent underfunding of the \ntrust fund established pursuant to resolution 55/7 for the purpose of facilitating the \nparticipation of members of the Commission from developing States in the meetings \nof the Commission, and urges States, including those that have already received \nrecommendations from the Commission, in addition to international financial \ninstitutions, donor agencies, intergovernmental organizations, non-governmental \norganizations and natural and juridical persons, to make additional contributions to \nthis fund; \n \n100. Authorizes the use, as appropriate, of the trust fund referred to in paragraph \n99 above, and in accordance with the purpose of its terms of reference, to defray the \ncost of the participation of the Chair of the Commission, when nominated by a \ndeveloping country, in the Meetings of States Parties to the Convention; \n \n101. Takes note of the written information, provided by the Secretary-General \nin response to the request in paragraph 81 of resolution 69/245 of 29 December 2014, \non options for mechanisms to provide medical insurance coverage to members of the \nCommission, including costs, and the information provided by the Secretariat during \nthe twenty-seventh, twenty-eighth, twenty-ninth and thirty-first Meetings of States \nParties to the Convention; \n \n102. Recalls its decision that, on an exceptional basis and without setting a \nprecedent for other agenda items, the members of the Commission have the option to \njoin the Headquarters medical insurance scheme upon payment of the full cost of the \n__________________ \n \n54 SPLOS/276 and SPLOS/286. \n \n55 See SPLOS/33/15. \n \n56 SPLOS/33/12. \n\nOceans and the law of the sea \nA/RES/78/69\n \n19/57\n23-24917 \n \npremium, and hereby authorizes the use of the trust fund referred to in paragraph 99 \nabove by the Secretary-General to reimburse the full costs of the premium paid by \nthe members of the Commission from developing States, subject to the availability of \nfunds following the allocation of the required funds to cover the costs of travel and \ndaily subsistence allowance of the members of the Commission from developing \nStates for the sessions of the Commission during the annual insurance coverage \nperiod (1 July\u201330 June); \n \n103. Authorizes the Secretary-General, in case the full costs of the Headquarters \nmedical insurance scheme have not been reimbursed, as an interim measure and \nsubject to the availability of funds following the allocation of the required funds to \ncover the costs of travel and daily subsistence allowance of the members of the \nCommission from developing States for the sessions of the Commission in 2024, to \nreimburse those members for the costs of medical travel insurance and short-term \nmedical insurance from that trust fund on a session-by-session basis and subject to a \nreasonable limit that the Secretary-General shall determine, based on the information \nregarding medical travel insurance available; \n \n104. Expresses its intention to continue to consider options for mechanisms to \nprovide medical insurance coverage to members of the Commission and, if necessary, \nto further review the terms of reference for the trust fund referred to in paragraph 99 \nabove;  \n \n105. Emphasizes the continued need for members of the Commission to have \nsuitable working space for their work at the sessions of the Commission and its \nsubcommissions, recognizes, with regard to the long-term accommodation \ndiscussions, that, owing to its exceptional character, the Commission has special \nrequirements for its working space, including the need for fit-for-purpose working \nspace, adequate technical equipment and climate control, and needs to remain located \nwithin the same premises as the Division, and emphasizes that, in the context of any \nrelocation of the Division or any change in its working space, full regard will be paid \nto these special requirements of the Commission;  \n \n106. Takes note of the requests by the Commission for upgrades to the existing \ntechnical facilities of the Division, as contained in the annex to the letter dated \n11 April 2023 from the Chair of the Commission addressed to the President of the \nthirty-third Meeting of States Parties,57 and requests the Secretary-General to provide \nthe requested upgrades with a view to facilitating the work of the Commission; \n \n107. Approves the convening by the Secretary-General of the sixtieth, sixty-\nfirst and sixty-second sessions of the Commission, in New York, from 22 January to \n8 March 2024, from 8 July to 23 August 2024 and from 7 October to 22 November \n2024, respectively, with full conference services, including documentation, for the \nplenary parts of these sessions,58 also approves the convening by the Secretary-\nGeneral of the sixty-third, sixty-fourth and sixty-fifth sessions of the Commission in \n2025, in New York, with full conference services, including documentation, for the \nplenary parts of these sessions, as well as any resumed sessions as may be required \nby the Commission, and requests the Secretary-General to make every effort to meet \nthese requirements within overall existing resources;  \n \n108. Expresses its firm conviction about the importance of the work of the \nCommission, carried out in accordance with the Convention as well as in accordance \nwith its rules of procedure, including with respect to the participation of coastal States \n__________________ \n \n57 SPLOS/33/10. \n \n58 From 29 January to 2 February 2024 and from 26 February to 1 March 2024 during the sixtieth \nsession, and from 5 to 9 August 2024 and from 19 to 23 August 2024 during the sixty-first \nsession. \n\nA/RES/78/69 \nOceans and the law of the sea\n \n23-24917\n20/57 \n \nin relevant proceedings concerning their submissions, and recognizes the continued \nneed for active interaction between coastal States and the Commission; \n \n109. Expresses its appreciation to States that have exchanged views in order to \nincrease understanding of issues, including expenditures involved, arising from the \napplication of article 76 of the Convention, thus facilitating the preparation of \nsubmissions by States, in particular developing States, to the Commission, and \nencourages States to continue to exchange views; \n \n110. Requests the Secretary-General, in cooperation with Member States, to \ncontinue to support workshops or symposiums on scientific and technical aspects of \nthe establishment of the outer limits of the continental shelf beyond 200 nautical \nmiles, taking into account the need to strengthen capacity-building for developing \ncountries in preparing their submissions; \n \nVIII \nMaritime safety and security and flag State implementation \n \n \n111. Encourages States to ratify or accede to international agreements \naddressing the safety and security of navigation, as well as maritime labour, and to \nadopt the necessary measures consistent with the Convention and other relevant \ninternational instruments aimed at implementing and enforcing the rules contained in \nthose agreements, and emphasizes the need for capacity-building for and assistance \nto developing States; \n \n112. Recognizes that the legal regimes governing maritime safety and maritime \nsecurity may have common and mutually reinforcing objectives that may be \ninterrelated and could benefit from synergies, and encourages States to take this into \naccount in their implementation; \n \n113. Emphasizes the need for further efforts to promote a culture of safety and \nsecurity in the shipping industry and to address the shortage of adequately trained \npersonnel, and urges the development and strengthening of capacity-building activities \nand the provision of knowledge and skills through the required education and training, \npromoted in particular by the International Maritime Organization in collaboration \nwith other relevant international organizations and agencies, as appropriate; \n \n114. Also emphasizes that safety and security measures should be implemented \nin support of and with minimal negative effects on seafarers and fishers, especially in \nrelation to their working conditions, and welcomes the ongoing cooperation between \nthe Food and Agriculture Organization of the United Nations and the International \nLabour Organization in relation to decent work and employment in fisheries and \naquaculture and on child labour in fisheries and aquaculture, as well as the work that \nhas been conducted by the United Nations Office on Drugs and Crime on the issue of \ntrafficking in persons on fishing vessels and the International Labour Organization on \nthe issue of forced labour on fishing vessels;  \n \n115. Reiterates the importance of the fair treatment of crew members and its \ninfluence on maritime safety, and welcomes the consideration by the International \nMaritime Organization of the fair treatment of seafarers, recalls the adoption by the \nOrganization on 4 December 2013 of resolution A.1090(28) on the fair treatment of \ncrew members in respect of shore leave and access to shore-side facilities, and \nwelcomes the provision on shore leave, which entered into force on 1 January 2018, \nin the Convention on Facilitation of International Maritime Traffic, 59 and the adoption \n__________________ \n \n59 United Nations, Treaty Series, vol. 591, No. 8564. \n\nOceans and the law of the sea \nA/RES/78/69\n \n21/57\n23-24917 \n \nby the International Maritime Organization on 31 March 2023 of Guidelines on how \nto deal with seafarer abandonment cases;60 \n \n116. Notes the adoption by the Assembly of the International Maritime \nOrganization on 9 December 2021 of resolution A.1170(32), proclaiming an \nInternational Day for Women in Maritime, to be observed on 18 May every year; \n \n117. Invites States that have not yet done so to become parties to the \nInternational Convention on Standards of Training, Certification and Watchkeeping \nfor Seafarers, 1978,61 as amended, and the International Convention on Standards of \nTraining, Certification and Watchkeeping for Fishing Vessel Personnel, 1995; \n \n118. Encourages States that have not yet done so to consider becoming parties \nto the Work in Fishing Convention, 2007 (No. 188), the Seafarers\u2019 Identity Documents \nConvention (Revised), 2003 (No. 185)62 and the Protocol to the Forced Labour \nConvention, 1930 (No. 29) of the International Labour Organization, as well as to the \nMaritime Labour Convention, 2006,63 as amended, calls upon States to effectively \nimplement their obligations under those instruments, and emphasizes the need to \nprovide to States, at their request, technical cooperation and assistance in this regard; \n \n119. Invites States to ratify or accede to the Cape Town Agreement of 2012 on \nthe Implementation of the Provisions of the Torremolinos Protocol of 1993 relating \nto the Torremolinos International Convention for the Safety of Fishing Vessels, 1977; \n \n120. Welcomes ongoing cooperation between the Food and Agriculture \nOrganization of the United Nations, the International Maritime Organization and the \nInternational Labour Organization relating to the safety of fishers and fishing vessels, \nand underlines the urgent need for continued work in that area, and notes the revised \nterms of reference for the Food and Agriculture Organization of the United Nations, \nInternational Maritime Organization and International Labour Organization Joint \nAd Hoc Working Group on Illegal, Unreported and Unregulated Fishing and Related \nMatters;64  \n \n121. Notes the adoption by the Assembly of the International Maritime \nOrganization on 15 December 2021 of resolution A.1160(32) on comprehensive \naction to address seafarers\u2019 challenges during the COVID-19 pandemic and the \nadoption of recommendations, by the Joint Action Group to review the impact of the \nCOVID-19 pandemic on the world\u2019s transport workers and the global supply chain, \nto provide more effective means of action to the ongoing issues affecting the \ntransportation sector during the COVID-19 pandemic and in similar future public \nhealth emergencies of international concern;65 \n \n122. Also notes that the ad hoc United Nations inter-agency task force, \nconvened pursuant to a resolution of the Special Tripartite Committee of the Maritime \nLabour Convention, 2006, as amended, concerning the implementation and practical \napplication of that Convention during the COVID-19 pandemic,66 to examine the \nimplementation and practical application of that Convention during the pandemic, \nincluding its impact on seafarers\u2019 fundamental rights and on the shipping industry 67 \nhas continued to meet; \n__________________ \n \n60 Maritime Organization, document LEG 110/18/1, annex 1.  \n \n61 United Nations, Treaty Series, vol. 1361, No. 23001. \n \n62 Ibid., vol. 2304, No. 41069. \n \n63 Ibid., vol. 2952, No. 51299. \n \n64 International Labour Organization, document GB.344/POL/2(Rev.1), appendix III. \n \n65 International Labour Organization, document JAG-TSC/2023. \n \n66 International Labour Organization, document STCMLC/Part I/2021/2.  \n \n67 International Labour Organization, document GB.342/Decisions, para. 8.1 (c). \n\nA/RES/78/69 \nOceans and the law of the sea\n \n23-24917\n22/57 \n \n \n123. Recalls that, in its resolution A.1117(30) of 6 December 2017, the \nAssembly of the International Maritime Organization revised the International \nMaritime Organization Ship Identification Number Scheme to expand its voluntary \napplication to a wider scope of vessels with a view to enhancing maritime safety and \npollution prevention and to facilitate the prevention of maritime fraud; \n \n124. Also recalls that all actions taken to combat threats to maritime security \nmust be in accordance with international law, including the principles embodied in \nthe Charter of the United Nations and the Convention;  \n \n125. Recognizes the crucial role of international cooperation at the global, \nregional, subregional and bilateral levels in combating, in accordance with \ninternational law, threats to maritime security, including piracy, armed robbery \nagainst ships at sea and terrorist acts against shipping, offshore installations, \nsubmarine cables and pipelines and other critical infrastructure and maritime \ninterests, through bilateral and multilateral instruments and mechanisms aimed at \nmonitoring, preventing and responding to such threats, the enhanced sharing of \ninformation among States relevant to the detection, prevention and suppression of \nsuch threats, and the prosecution of offenders with due regard to national legislation, \nand the need for sustained capacity-building to support such objectives, and in this \nregard welcomes activities related to maritime security under the thirtieth Association \nof Southeast Asian Nations (ASEAN) Regional Forum, held on 14 July 2023; \n \n126. Encourages African Member States of the United Nations that have not \nyet done so to consider ratifying the Charter on Maritime Security and Safety and \nDevelopment in Africa (Lom\u00e9 Charter) to facilitate its entry into force; \n \n127. Acknowledges the work of the Commission on Crime Prevention and \nCriminal Justice in promoting international cooperation and strengthening capacity \nto combat the problem of transnational organized crime committed at sea; \n \n128. Notes with concern that piracy and armed robbery at sea affect a wide \nrange of vessels engaged in maritime activities, and expresses grave concern at the \nthreats posed by piracy and armed robbery at sea to the safety and welfare of seafarers \nand other persons; \n \n129. Emphasizes the importance of promptly reporting incidents to enable \naccurate information on the scope of the problem of piracy and armed robbery against \nships at sea and, in the case of armed robbery against ships at sea, by affected vessels \nto the coastal State, underlines the importance of effective information-sharing with \nStates potentially affected by incidents of piracy and armed robbery against ships at \nsea, notes with appreciation the important role of the International Maritime \nOrganization and the important contribution of the Information Sharing Centre of the \nRegional Cooperation Agreement on Combating Piracy and Armed Robbery against \nShips in Asia, based in Singapore, which aspires to be recognized as a centre of \nexcellence within its purpose and mandate, and notes the Maritime Domain \nAwareness for Trade \u2013 Gulf of Guinea mechanism, the United Kingdom Maritime \nTrade Operations covering the high-risk area, the Regional Maritime Information \nFusion Centre, based in Madagascar, and the Regional Maritime Centre for \nOperational Coordination in Seychelles; \n \n130. Urges all States, in cooperation with the International Maritime \nOrganization, to actively combat piracy and armed robbery at sea by adopting \nmeasures, including those relating to assistance with capacity-building through \ntraining of seafarers, port staff and enforcement personnel in the prevention, reporting \nand investigation of incidents, by bringing the alleged perpetrators to justice, in \naccordance with international law, and by adopting national legislation, as well as by \n\nOceans and the law of the sea \nA/RES/78/69\n \n23/57\n23-24917 \n \nproviding enforcement vessels and equipment and guarding against fraudulent ship \nregistration; \n \n131. Encourages States to ensure effective implementation of international law \napplicable to combating piracy, as reflected in the Convention, calls upon States to \ntake appropriate steps under their national law to facilitate, in accordance with \ninternational law, the apprehension and prosecution of those who are alleged to have \ncommitted acts of piracy, including the financing or facilitation of such acts, also \ntaking into account other relevant instruments that are consistent with the Convention, \nand encourages States to cooperate, as appropriate, with a view to developing their \nnational legislation in this regard; \n \n132. Invites all States, the International Maritime Organization, the International \nLabour Organization and other relevant international organizations and agencies to \nadopt or recommend, as appropriate, measures to protect the interest and welfare of \nseafarers, fishers and passengers who are victims of pirates, after their release from \ncaptivity, including their post-incident care and reintegration into society; \n \n133. Notes the compilation of national legislation on piracy on the website of \nthe Division, and encourages the United Nations Office on Drugs and Crime and the \nDivision to continue to cooperate with the International Maritime Organization with \na view to assisting Member States, upon request, in developing their national laws on \npiracy; \n \n134. Recognizes continued national, bilateral and trilateral initiatives, as well \nas regional cooperative mechanisms, in accordance with international law, to address \npiracy, including the financing or facilitation of acts of piracy, and armed robbery at \nsea, and calls upon States to give immediate attention to adopting, concluding and \nimplementing cooperation agreements at the regional level on combating piracy and \narmed robbery against ships; \n \n135. Expresses serious concern at the inhuman conditions hostages taken at sea \nface in captivity and also the adverse impact on their families, calls for the immediate \nrelease of all hostages taken at sea, and stresses the importance of cooperation among \nMember States on the issue of hostage-taking at sea; \n \n136. Welcomes the continued reduction in the number of incidents of piracy and \narmed robbery against ships as well as hijackings off the coast of Somalia since 2011 68 \nresulting from efforts at the global and regional levels; \n \n137. Notes the continued efforts within the Contact Group on Illicit Maritime \nActivities in the Western Indian Ocean following the adoption of Security Council \nresolution 1851 (2008) of 16 December 2008, including at its twenty-fifth plenary \nsession, chaired by Kenya, in May 2023, and commends the contributions of all States \nin the efforts to fight piracy off the coast of Somalia; \n \n138. Recognizes the primary responsibility of the Federal Government of \nSomalia in combating piracy and armed robbery at sea off the coast of Somalia, \nacknowledges the importance of a comprehensive and sustainable settlement of the \nsituation in Somalia, and emphasizes the need to address the underlying causes of \npiracy and to assist Somalia and States in the region, at their request, in strengthening \ninstitutional capacity to fight piracy and tackle its underlying causes, including the \nfinancing or facilitation of acts of piracy, and armed robbery against ships off the \ncoast of Somalia and to bring to justice those involved in such acts; \n__________________ \n \n68 See International Chamber of Commerce-International Maritime Bureau, \u201cPiracy and Armed \nRobbery against Ships Report\u201d, January\u2013March 2023. \n\nA/RES/78/69 \nOceans and the law of the sea\n \n23-24917\n24/57 \n \n \n139. Notes the International Maritime Organization guidelines, interim \nguidance and interim recommendations to shipowners, ship operators and \nshipmasters, private maritime security companies, as well as flag States and port and \ncoastal States on measures to prevent and mitigate Somalia-based piracy;  \n \n140. Notes with concern that the continuing limited capacity and domestic \nlegislation to facilitate the custody and prosecution of suspected pirates after their \ncapture has hindered more robust international action against pirates off the coast of \nSomalia; \n \n141. Encourages States to ensure that ships flying their flag apply ship security \nmeasures approved in accordance with national and international law;  \n \n142. Notes the efforts made by the shipping industry to cooperate with the \nefforts by States regarding piracy off the coast of Somalia, in particular in assisting \nships that navigate in that area, and also notes the holding of a high-level meeting on \nthe implementation of the Code of Conduct concerning the Repression of Piracy and \nArmed Robbery against Ships in the Western Indian Ocean and the Gulf of Aden \n(Djibouti Code of Conduct)/Jeddah Amendment, in Jeddah, Saudi Arabia, from 22 to \n24 November 2022;69  \n \n143. Remains concerned about piracy and armed robbery at sea in the Gulf of \nGuinea, with crew members kidnapped, but welcomes the decline in incidents of \npiracy and armed robbery at sea in that region,70 notes the adoption by the Security \nCouncil of resolutions 2018 (2011) of 31 October 2011, 2039 (2012) of 29 February \n2012 and 2634 (2022) of 31 May 2022 and the statement by the President of the \nCouncil of 25 April 2016,71 supports the efforts to address this problem at the global \nand regional levels, including the adoption of resolution MSC.489(103) on \nrecommended action to address piracy and armed robbery in the Gulf of Guinea, by \nthe Maritime Safety Committee of the International Maritime Organization at its \n103rd session,72 recalls the primary role of States in the region to counter the threat \nand address the underlying causes of piracy and armed robbery at sea in the Gulf of \nGuinea, welcomes the adoption in Yaound\u00e9 on 25 June 2013 of the Code of Conduct \nconcerning the Repression of Piracy, Armed Robbery against Ships and Illicit \nMaritime Activity in West and Central Africa, and calls upon States in the region to \ncontinue to strengthen implementation of the Code of Conduct as soon as possible \nand consistent with international law, in particular the Convention; \n \n144. Urges States to ensure the full implementation of resolution A.1159(32) of \n15 December 2021 of the Assembly of the International Maritime Organization on \nprevention and suppression of piracy, armed robbery against ships and illicit maritime \nactivity in the Gulf of Guinea; \n \n145. Calls upon States that have not yet done so to become parties to the \nConvention for the Suppression of Unlawful Acts against the Safety of Maritime \nNavigation73 and the Protocol for the Suppression of Unlawful Acts against the Safety \nof Fixed Platforms Located on the Continental Shelf, 74 invites States that have not yet \ndone so to consider becoming parties to the 2005 Protocol to the Convention for the \nSuppression of Unlawful Acts against the Safety of Maritime Navigation 75 and the \n__________________ \n \n69 See International Maritime Organization, document MSC 107/8. \n \n70 See International Chamber of Commerce-International Maritime Bureau, \u201cPiracy and Armed \nRobbery against Ships Report\u201d, January\u2013March 2023. \n \n71 S/PRST/2016/4; see Resolutions and Decisions of the Security Council, 1 August 2015\u2013\n31 December 2016 (S/INF/71). \n \n72 International Maritime Organization, document MSC 103/21/Add.1, annex 9. \n \n73 United Nations, Treaty Series, vol. 1678, No. 29004. \n \n74 Ibid. \n \n75 International Maritime Organization, document LEG/CONF.15/21. \n\nOceans and the law of the sea \nA/RES/78/69\n \n25/57\n23-24917 \n \n2005 Protocol to the 1988 Protocol for the Suppression of Unlawful Acts against the \nSafety of Fixed Platforms Located on the Continental Shelf, 76 and urges States parties \nto take appropriate measures to ensure the effective implementation of those \ninstruments through the adoption of legislation, where appropriate; \n \n146. Calls upon States to effectively implement the International Ship and Port \nFacility Security Code and the amendments to the International Convention for the \nSafety of Life at Sea,77 and to work with the International Maritime Organization to \npromote safe and secure shipping while ensuring freedom of navigation; \n \n147. Urges all States, in cooperation with the International Maritime \nOrganization and other relevant international organizations and agencies, to improve \nthe protection of offshore installations, submarine cables and pipelines and other \ncritical infrastructure by adopting measures related to the prevention, reporting and \ninvestigation of acts of violence against such infrastructure, in accordance with \ninternational law, and by implementing such measures through national legislation to \nensure proper and adequate enforcement; \n \n148. Emphasizes the progress in regional cooperation, including the efforts of \nlittoral States, on the enhancement of safety, security and environmental protection in \nthe Straits of Malacca and Singapore, and the effective functioning of the Cooperative \nMechanism on Safety of Navigation and Environmental Protection in the Straits of \nMalacca and Singapore (the Cooperative Mechanism) to promote dialogue and \nfacilitate close cooperation between the littoral States, user States, shipping industries \nand other stakeholders in line with article 43 of the Convention, notes with \nappreciation the convening of the fourteenth Cooperation Forum in Singapore on \n31 July and 1 August 2023, the fourteenth Project Coordination Committee Meeting \nin Singapore on 4 August 2023, the forty-sixth Tripartite Technical Experts Group \nMeeting in Singapore on 2 and 3 August 2023 and the twenty-eighth Aids to \nNavigation Fund Committee Meeting in Indonesia on 14 and 15 June 2023, also notes \nwith appreciation the important role of the Information Sharing Centre of the \nRegional Cooperation Agreement on Combating Piracy and Armed Robbery against \nShips in Asia, based in Singapore, and calls upon States to give immediate attention \nto adopting, concluding and implementing cooperation agreements at the regional \nlevel;  \n \n149. Recognizes that some transnational organized criminal activities threaten \nlegitimate uses of the oceans and endanger the lives of people at sea, as well as the \nlivelihoods and security of coastal communities; \n \n150. Notes that transnational organized criminal activities are diverse and may \nbe interrelated in some cases and that criminal organizations are adaptive and take \nadvantage of the vulnerabilities of States, in particular coastal and small island \ndeveloping States in transit areas, and calls upon States and relevant \nintergovernmental organizations to increase cooperation and coordination at all levels \nto detect and suppress the smuggling of migrants, trafficking in persons and illicit \ntrafficking in firearms, in accordance with international law; \n \n151. Recognizes the importance of enhancing international cooperation at all \nlevels to fight transnational organized criminal activities, including illicit traffic in \nnarcotic drugs and psychotropic substances, within the scope of the United Nations \ninstruments against illicit drug trafficking, as well as the smuggling of migrants, \ntrafficking in persons and illicit trafficking in firearms and criminal activities at sea \n__________________ \n \n76 International Maritime Organization, document LEG/CONF.15/22. \n \n77 International Maritime Organization, documents SOLAS/CONF.5/32 and SOLAS/CONF.5/34, \nand document MSC 81/25/Add.1, annex 2, resolution MSC.202(81), introducing the long-range \nidentification and tracking of ships system. \n\nA/RES/78/69 \nOceans and the law of the sea\n \n23-24917\n26/57 \n \nfalling within the scope of the United Nations Convention against Transnational \nOrganized Crime and the Protocols thereto; \n \n152. Encourages States to cooperate at the bilateral, regional and global levels \nto prevent, combat and eradicate illicit trafficking in protected species of wild fauna \nand flora, which contributes to biodiversity loss and damage to ecosystems and \nlivelihoods, where such trafficking occurs via maritime routes, through, inter alia, the \nuse of applicable international legal instruments as appropriate, such as the United \nNations Convention against Transnational Organized Crime, 78 the United Nations \nConvention against Corruption79 and the Convention on International Trade in \nEndangered Species of Wild Fauna and Flora,80 and reiterates its call upon Member \nStates expressed in its resolution 71/326 of 11 September 2017 to make illicit \ntrafficking in protected species of wild fauna and flora a serious crime, in accordance \nwith their national legislation and as defined in article 2 (b) and article 3, paragraph \n1 (b), of the United Nations Convention against Transnational Organized Crime, in \norder to ensure that, where the offence is transnational in nature and involves an \norganized criminal group, effective international cooperation can be afforded under \nthe United Nations Convention against Transnational Organized Crime to prevent and \ncombat transnational organized crime, and encourages States to implement the \nInternational Maritime Organization guidelines for the prevention and suppression of \nthe smuggling of wildlife on ships engaged in international maritime traffic; \n \n153. Notes with grave concern the recent proliferation of, and endangerment of \nlives through, the smuggling of migrants by sea, underscores the necessity to address \nsuch situations in accordance with applicable international law, and encourages \nStates, acting nationally or through relevant global or regional organizations, as \nappropriate, to provide technical assistance and capacity-building to flag, port and \ncoastal States, upon request, to enhance their capabilities to prevent smuggling of \nmigrants and trafficking in persons by sea; \n \n154. Calls upon States, in that context, to take measures in accordance with \nrelevant international obligations to prevent and combat all forms of trafficking in \npersons, to identify victims of human trafficking, including among migrant flows, and \nto provide trafficking victims with appropriate protection and assistance, according \nto their national law and policy; \n \n155. Calls upon States that have not yet done so to consider becoming parties \nto the Protocol against the Smuggling of Migrants by Land, Sea and Air, \nsupplementing the United Nations Convention against Transnational Organized \nCrime,81 the Protocol against the Illicit Manufacturing of and Trafficking in Firearms, \nTheir Parts and Components and Ammunition, supplementing the United Nations \nConvention against Transnational Organized Crime,82 and the Protocol to Prevent, \nSuppress and Punish Trafficking in Persons, Especially Women and Children, \nsupplementing the United Nations Convention against Transnational Organized \nCrime,83 and to take appropriate measures to ensure their effective implementation; \n \n156. Calls upon States to ensure freedom of navigation, the safety of navigation \nand the rights of transit passage, archipelagic sea lanes passage and innocent passage \nin accordance with international law, in particular the Convention; \n__________________ \n \n78 United Nations, Treaty Series, vol. 2225, No. 39574. \n \n79 Ibid., vol. 2349, No. 42146. \n \n80 Ibid., vol. 993, No. 14537. \n \n81 Ibid., vol. 2241, No. 39574. \n \n82 Ibid., vol. 2326, No. 39574. \n \n83 Ibid., vol. 2237, No. 39574. \n\nOceans and the law of the sea \nA/RES/78/69\n \n27/57\n23-24917 \n \n \n157. Welcomes the work of the International Maritime Organization relating to \nthe protection of shipping lanes of strategic importance and significance, and in \nparticular in enhancing safety, security and environmental protection in straits used \nfor international navigation, and calls upon that Organization, States bordering straits \nand user States to continue their cooperation to keep such straits safe, secure and \nenvironmentally protected and open to international navigation at all times, consistent \nwith international law, in particular the Convention; \n \n158. Calls upon user States and States bordering straits used for international \nnavigation to continue to cooperate by agreement on matters relating to navigational \nsafety, including safety aids for navigation, and the prevention, reduction and control \nof pollution from ships, and welcomes developments in this regard; \n \n159. Calls upon States that have accepted the amendments to regulation XI-1/6 \nof the International Convention for the Safety of Life at Sea, 1974, 84 to implement the \nCode of International Standards and Recommended Practices for a Safety \nInvestigation into a Marine Casualty or Marine Incident, 85 which took effect on \n1 January 2010, and, in particular, to comply with the mandatory conduct of a marine \nsafety investigation into very serious marine casualties and submission of a marine \nsafety investigation report to the International Maritime Organization to identify \ntrends and develop knowledge and risk-based recommendations; \n \n160. Recognizes the important work of the International Hydrographic \nOrganization and regional hydrographic commissions, calls upon States that have not \nyet done so to consider becoming members of that Organization, urges all its members \nto actively facilitate and consider in a timely manner, in accordance with applicable \nrules and procedures, applications of States that wish to become members of that \nOrganization and regional hydrographic commissions, and further urges all States to \nwork with that Organization, to increase the coverage of hydrographic information on \na global basis to enhance capacity-building and technical assistance and to promote \nsafe navigation, particularly through the production and use of accurate electronic \nnavigational charts, especially in areas used for international navigation, in ports and \nwhere there are vulnerable or protected marine areas; \n \n161. Also recognizes the importance of navigational and meteorological \nwarning services based on marine meteorological data for the safety of ships and lives \nat sea and the optimization of navigation routes, and notes the collaboration between \nthe World Meteorological Organization, the International Hydrographic Organization \nand the International Maritime Organization for the enhancement of these services \nand their extension to the Arctic region; \n \n162. Encourages States to continue their efforts in the implementation of all \nareas of the Action Plan for the Safety of Transport of Radioactive Material, approved \nby the Board of Governors of the International Atomic Energy Agency in March 2004; \n \n163. Also encourages States to ensure effective implementation of the \nInternational Maritime Dangerous Goods Code, the International Maritime Solid Bulk \nCargoes Code, the International Code for the Construction and Equipment of Ships \ncarrying Liquefied Gases in Bulk and the International Code for the Construction and \nEquipment of Ships carrying Dangerous Chemicals in Bulk; \n \n164. Notes that cessation of the transport of radioactive materials through the \nregions of small island developing States is an ultimate desired goal of small island \ndeveloping States and some other countries, and recognizes the right of freedom of \n__________________ \n \n84 International Maritime Organization, document MSC 84/24/Add.1, annex 3, resolution \nMSC.257(84). \n \n85 Ibid., annex 1, resolution MSC.255(84). \n\nA/RES/78/69 \nOceans and the law of the sea\n \n23-24917\n28/57 \n \nnavigation in accordance with international law; that States should maintain dialogue \nand consultation, in particular under the auspices of the International Atomic Energy \nAgency and the International Maritime Organization, with the aim of improved \nmutual understanding, confidence-building and enhanced communication in relation \nto the safe maritime transport of radioactive materials; that States involved in the \ntransport of such materials are urged to continue to engage in dialogue with small \nisland developing States and other States to address their concerns; and that these \nconcerns include the further development and strengthening, within the appropriate \nforums, of international regulatory regimes to enhance safety, disclosure, liability, \nsecurity and compensation in relation to such transport; \n \n165. Acknowledges, in the context of paragraph 164 above, the potential \nenvironmental and economic impacts of maritime incidents and accidents on coastal \nStates, in particular those related to the transport of radioactive materials, and \nemphasizes the importance of effective liability regimes in that regard; \n \n166. Invites States that have not yet done so to consider becoming parties to the \nNairobi International Convention on the Removal of Wrecks, 2007; 86 \n \n167. Requests States to take appropriate measures with regard to ships flying \ntheir flag or of their registry to address hazards that may be caused by wrecks and \ndrifting or sunken cargo to navigation or the marine environment; \n \n168. Calls upon States to ensure that masters on ships flying their flag take the \nsteps required by relevant instruments87 to provide assistance to persons in distress at \nsea, and urges States to cooperate and to take all measures necessary to ensure the \neffective implementation of the amendments to the International Convention on \nMaritime Search and Rescue88 and to the International Convention for the Safety of \nLife at Sea89 relating to the delivery of persons rescued at sea to a place of safety, as \nwell as of the associated Guidelines on the Treatment of Persons Rescued at Sea; 90 \n \n169. Urges all States to cooperate with each other in inquiries relating to \nincidents of oil spills at sea, in line with relevant international law, including as \nreflected in article 94 of the Convention, and for this purpose to share, when requested \nby the affected coastal State in the context of such inquiries, any available information \non the maritime traffic of ships that fly their flags and that sailed in the impacted \nmaritime areas; \n \n170. Recognizes that all States must fulfil their search and rescue \nresponsibilities in accordance with international law, including the Convention, and \nin that regard encourages States and relevant international organizations to strengthen \ncooperation on maritime search and rescue activities at the international and regional \nlevels in accordance with international agreements, including the International \nConvention on Maritime Search and Rescue, 1979;91 \n \n171. Reaffirms the ongoing need for the International Maritime Organization \nand other relevant organizations to assist, in particular, developing States both to \n__________________ \n \n86 International Maritime Organization, document LEG/CONF.16/19. \n \n87 Convention on International Civil Aviation, 1944, annex 12; International Convention for the \nSafety of Life at Sea, 1974; International Convention on Maritime Search and Rescue, 1979, as \namended; United Nations Convention on the Law of the Sea, 1982; and International Convention \non Salvage, 1989. \n \n88 International Maritime Organization, document MSC 78/26/Add.1, annex 5, resolution \nMSC.155(78). \n \n89 Ibid., annex 3, resolution MSC.153(78). \n \n90 International Maritime Organization, document MSC 78/26/Add.2, annex 34, resolution \nMSC.167(78). \n \n91 United Nations, Treaty Series, vol. 1405, No. 23489. \n\nOceans and the law of the sea \nA/RES/78/69\n \n29/57\n23-24917 \n \nincrease and improve their search and rescue capabilities, including, as appropriate, \nthrough the establishment of additional rescue coordination centres and regional \nsub-centres, and to take effective action to address, to the extent feasible, the issue of \nunseaworthy ships and small craft within their national jurisdiction, and emphasizes \nin this regard the importance of cooperation for these purposes, including within the \nframework of the International Convention on Maritime Search and Rescue, 1979; \n \n172. Notes the ongoing work of the International Maritime Organization, the \nOffice of the United Nations High Commissioner for Refugees and other relevant \nactors in relation to disembarkation of persons rescued at sea, underscores in this \nregard the need to implement all relevant and applicable international instruments and \nthe importance of cooperation among States as provided for in those instruments, and \nemphasizes in particular the importance of full respect for the principle of \nnon-refoulement in accordance with applicable international law; \n \n173. Invites States to implement the Revised Guidelines on the Prevention of \nAccess by Stowaways and the Allocation of Responsibilities to Seek the Successful \nResolution of Stowaway Cases, adopted by the Maritime Safety Committee of the \nInternational Maritime Organization in its resolution MSC.448(99) of 24 May 2018 \nand by the Facilitation Committee of that Organization in its resolution FAL.13(42) \nof 8 June 2018; \n \n174. Calls upon States to continue to cooperate in developing comprehensive \napproaches to international migration and development, including through dialogue \non all their aspects; \n \n175. Recognizes that submarine cables and pipelines are vitally important to the \nglobal economy and the national security of all States, conscious that these cables and \npipelines are susceptible to intentional and accidental damage, and calls upon States \nto take measures to protect submarine cables and pipelines and to fully address issues \nrelating to these cables and pipelines, in accordance with international law, as \nreflected in the Convention; \n \n176. Encourages greater dialogue and cooperation among States and the \nrelevant regional and global organizations through workshops and seminars on the \nprotection, and laying and maintenance of submarine cables and pipelines to promote \nthe security of such critical infrastructure; \n \n177. Also encourages the adoption by States of laws and regulations necessary \nto provide that the breaking or injury, or conduct calculated or likely to result in such \nbreaking or injury, of submarine cables or pipelines beneath the high seas done \nwilfully or through culpable negligence shall be a punishable offence, and further \ncalls upon States to enforce such laws against ships flying their flag or a person \nsubject to their jurisdiction, in accordance with international law, as reflected in the \nConvention;  \n \n178. Affirms the importance of the laying and maintenance, including the repair, \nof submarine cables and pipelines, undertaken in conformity with international law, as \nreflected in the Convention, and calls upon States to refrain from impeding the laying \nor maintenance of submarine cables and pipelines in a manner contrary to the \nprovisions of the Convention, and to respect the relevant rights and duties of coastal \nStates in the relevant maritime zones in this regard, as reflected in the Convention; \n \n179. Reaffirms that flag, port and coastal States all bear responsibility for \nensuring the effective implementation and enforcement of international instruments \nrelating to maritime security and safety, in accordance with international law, in \nparticular the Convention, and that flag States have primary responsibility that \nrequires further strengthening, including through increased transparency of \nownership of vessels and the monitoring of organizations authorized to carry out \n\nA/RES/78/69 \nOceans and the law of the sea\n \n23-24917\n30/57 \n \nsurveys and issue certificates on their behalf, taking into account the Code for \nRecognized Organizations;92 \n \n180. Urges flag States without an effective maritime administration and \nappropriate legal frameworks to establish or enhance the necessary infrastructure, \nlegislative and enforcement capabilities to ensure effective compliance with and \nimplementation and enforcement of their responsibilities under international law, in \nparticular the Convention, and, until such action is taken, to consider declining the \ngranting of the right to fly their flag to new vessels, suspending their registry or not \nopening a registry, and calls upon flag and port States to take all measures consistent \nwith international law necessary to prevent the operation of substandard vessels;  \n \n181. Notes the ongoing work of the International Maritime Organization on \nmeasures to prevent the fraudulent registration and fraudulent registries of ships, \nincluding its encouragement of International Maritime Organization member States \nand all relevant stakeholders to promote actions for the prevention and suppression \nof fraudulent registration and fraudulent registries of ships and other fraudulent acts \nin the maritime sector; \n \n182. Recognizes that international shipping rules and standards adopted by the \nInternational Maritime Organization in respect of maritime safety, efficiency of \nnavigation and the prevention and control of marine pollution, complemented by best \npractices of the shipping industry, have led to a significant reduction in maritime \naccidents and pollution incidents; \n \n183. Notes that audits of Member States under the International Maritime \nOrganization Member State Audit Scheme became mandatory in January 2016 under \nnine mandatory International Maritime Organization instruments and are being \ncarried out in accordance with the Framework and the Procedures for the International \nMaritime Organization Member State Audit Scheme and using the International \nMaritime Organization Instruments Implementation Code (III Code) as the audit \nstandard;93 \n \n184. Encourages States and competent international organizations and bodies \nto support the effective implementation of the requirements of the International Code \nfor Ships Operating in Polar Waters (Polar Code), adopted by the International \nMaritime Organization under the International Convention for the Safety of Life at \nSea and the International Convention for the Prevention of Pollution from Ships, \n1973, as modified by the Protocol of 1978 relating thereto, as amended, 94 including \nrelevant requirements of the International Convention on Standards of Training, \nCertification and Watchkeeping for Seafarers, 1978, as amended, 95 and notes in this \nregard the adoption by the International Maritime Organization of amendments to the \nPolar Code to incorporate new requirements for ships that are operating in polar \nwaters concerning safety of navigation and voyage planning, which are expected to \nenter into force on 1 January 2026;96 \n \n185. Notes the ongoing work of the International Maritime Organization on \nmatters related to passenger ship safety, and encourages States and competent \n__________________ \n \n92 International Maritime Organization, resolutions MSC.349(92) and MEPC.237(65). \n \n93 See International Maritime Organization, Assembly resolutions A.1018(26), A.1067(28), \nA.1068(28) and A.1070(28). \n \n94 International Maritime Organization, document MEPC 62/24/Add.1, annex 19, resolution \nMEPC.203(62). \n \n95 International Maritime Organization, resolutions MSC.385(94) and MEPC.264(68) and related \namendments to the International Convention for the Safety of Life at Sea (resolution \nMSC.386(94)) and the International Convention for the Prevention of Pollution from Ships \n(resolution MEPC.265(68)). \n \n96 International Maritime Organization, resolution MSC.538(107).  \n\nOceans and the law of the sea \nA/RES/78/69\n \n31/57\n23-24917 \n \ninternational organizations and bodies to support continued efforts, including \ntechnical cooperation activities, to improve passenger ship safety; \n \n186. Also notes the ongoing work of the International Maritime Organization \nregarding maritime autonomous surface ships, including development of a \nnon-mandatory, goal-based instrument for maritime autonomous surface ships; 97 \n \n187. Recognizes that maritime safety can also be improved through effective \nport State control, the strengthening of regional arrangements and increased \ncoordination and cooperation among them and increased transparency and \ninformation-sharing, making ample use of information systems, such as the \nInternational Maritime Organization Global Integrated Shipping Information \nSystem,98 including among safety and security sectors; \n \n188. Encourages flag States to take appropriate measures sufficient to achieve \nor maintain recognition by intergovernmental arrangements that recognize \nsatisfactory flag State performance, including, as appropriate, satisfactory port State \ncontrol examination results on a sustained basis, with a view to improving quality \nshipping and furthering flag State implementation of relevant instruments under the \nInternational Maritime Organization as well as relevant goals and objectives of the \npresent resolution; \n \n189. Notes with appreciation the important contribution of the International \nAssociation of Marine Aids to Navigation and Lighthouse Authorities to the \nimprovement and harmonization of marine aids to navigation for the reduction of \nmarine accidents, increased safety of life and property at sea and the protection of the \nmarine environment, and in this regard recalls the adoption of the Convention on the \nInternational Organization for Marine Aids to Navigation and calls upon States that \nhave not yet done so to consider becoming party to that Convention to facilitate its \nentry into force; \n \nIX \nMarine environment and marine resources \n \n \n190. Emphasizes once again the importance of the implementation of Part XII \nof the Convention in order to protect and preserve the marine environment and its \nliving marine resources against pollution and physical degradation, and calls upon all \nStates to cooperate and take measures consistent with the Convention, directly or \nthrough competent international organizations, for the protection and preservation of \nthe marine environment; \n \n191. Calls upon States to implement the 2030 Agenda, including Goal 14 to \nconserve and sustainably use the oceans, seas and marine resources for sustainable \ndevelopment, and recalls that the Goals and targets are integrated and indivisible; \n \n192. Notes the need for actions to support sustainable fisheries and sustainable \naquaculture for sufficient, safe and nutritious food, recognizing the central role of \nhealthy oceans in resilient food systems and for achieving the 2030 Agenda; \n \n193. Reiterates, in this regard, the call made in the declaration entitled \u201cOur \nocean, our future: call for action\u201d for action to be taken on an urgent basis to conserve \nand sustainably use the oceans, seas and marine resources for sustainable \ndevelopment;99 \n__________________ \n \n97 See International Maritime Organization, document MSC 105/20. \n \n98 International Maritime Organization, Assembly resolutions A.1029(26) and A.1074(28). \n \n99 Resolution 71/312, annex. \n\nA/RES/78/69 \nOceans and the law of the sea\n \n23-24917\n32/57 \n \n \n194. Recalls that, in \u201cThe future we want\u201d, States committed themselves to \nprotect and restore the health, productivity and resilience of oceans and marine \necosystems, to maintain their biodiversity, enabling their conservation and sustainable \nuse for present and future generations, and to effectively apply an ecosystem approach \nand the precautionary approach in the management, in accordance with international \nlaw, of activities having an impact on the marine environment, to deliver on all three \ndimensions of sustainable development; \n \n195. Reaffirms paragraph 119 of resolution 61/222 of 20 December 2006 \nregarding ecosystem approaches and oceans, including the proposed elements of an \necosystem approach, means to achieve implementation of an ecosystem approach and \nrequirements for improved application of an ecosystem approach, and in this regard: \n \n(a) \nNotes that continued environmental degradation in many parts of the world \nand increasing competing demands require an urgent response and the setting of \npriorities for management actions aimed at conserving ecosystem integrity; \n \n(b) \nAlso notes that ecosystem approaches to ocean management should be \nfocused on managing human activities in order to maintain and, where needed, restore \necosystem health to sustain goods and environmental services, provide social and \neconomic benefits for food security, sustain livelihoods in support of international \ndevelopment goals, including those contained in the United Nations Millennium \nDeclaration,100 and conserve marine biodiversity; \n \n(c) \nRecalls that States should be guided in the application of ecosystem \napproaches by a number of existing instruments, in particular the Convention, which \nsets out the legal framework for all activities in the oceans and seas, and its \nimplementing Agreements, as well as other commitments, such as those contained in \nthe Convention on Biological Diversity101 and the World Summit on Sustainable \nDevelopment call for the application of an ecosystem approach by 2010, and in this \ncontext encourages States to enhance their efforts towards applying such an approach; \n \n(d) \nEncourages States to cooperate and coordinate their efforts and take, \nindividually or jointly, as appropriate, all measures, in conformity with international \nlaw, including the Convention and other applicable instruments, to address impacts \non marine ecosystems within and beyond areas of national jurisdiction, taking into \naccount the integrity of the ecosystems concerned; \n \n196. Encourages competent organizations and bodies that have not yet done so \nto incorporate an ecosystem approach into their mandates, as appropriate, in order to \naddress impacts on marine ecosystems; \n \n197. Acknowledges the request by the United Nations Environment Assembly \nat its second session, in paragraph 6 of its resolution 2/10 of 27 May 2016, to the \nUnited Nations Environment Programme to step up its work, including through its \nRegional Seas Programme, on assisting countries and regions in the application of the \necosystem approach to managing the marine and coastal environment, including \nthrough enabling intersectoral cooperation in integrated coastal zone management \nand marine spatial planning;102 \n \n198. Encourages States that have not done so to become parties to regional seas \nconventions and the protocols thereto addressing the protection and preservation of \nthe marine environment, while noting the role of the United Nations Environment \nProgramme Regional Seas Programme; \n__________________ \n \n100 Resolution 55/2. \n \n101 United Nations, Treaty Series, vol. 1760, No. 30619. \n \n102 See Official Records of the General Assembly, Seventy-first Session, Supplement No. 25 \n(A/71/25), annex. \n\nOceans and the law of the sea \nA/RES/78/69\n \n33/57\n23-24917 \n \n \n199. Encourages States, directly or through competent international organizations, \nto consider the further development and application, as appropriate and consistent \nwith international law, including the Convention, of environmental impact assessment \nprocesses covering planned activities under their jurisdiction or control that may \ncause substantial pollution of or significant and harmful changes to the marine \nenvironment, and also encourages the communication of the reports of the results of \nsuch assessments to the competent international organizations in accordance with the \nConvention;  \n \n200. Notes with concern the impacts of climate change on the ocean and the \ncryosphere, including extreme sea level events and sea level rise, to which low-lying \nislands, in particular small island developing States, coasts and coastal communities \nare particularly exposed;  \n \n201. Also notes with concern the findings of the Intergovernmental Panel on \nClimate Change in its successive reports, and in this regard refers in particular to its \nSpecial Report on the Ocean and Cryosphere in a Changing Climate, which was \naccepted by the Intergovernmental Panel at its fifty-first session on 23 September \n2019, and its Sixth Assessment Report, including its synthesis report, which was \naccepted by the Intergovernmental Panel at its fifty-eighth session on 19 March 2023; \n \n202. Recognizes the importance of improving understanding of the impacts of \nclimate change on oceans and seas, and recalls that, in \u201cThe future we want\u201d, States \nnoted that sea level rise and coastal erosion are serious threats for many coastal \nregions and islands, particularly in developing countries, and in this regard called \nupon the international community to enhance its efforts to address these challenges, \nand notes the attention paid to the themes of \u201cThe effects of climate change on \noceans\u201d and \u201cSea level rise and its impacts\u201d at the eighteenth and twenty-first \nmeetings, respectively, of the Informal Consultative Process, in 2017 and 2021, \nwhich, inter alia, highlighted the urgency of sea level rise for small island developing \nStates and coastal States, including low-lying coastal areas; \n \n203. Takes note of the findings of reports of the Intergovernmental Panel on \nClimate Change, including its Special Report on Global Warming of 1.5\u00b0C, that \nincreasing warming amplifies the exposure of small islands, low-lying coastal areas \nand deltas to the risks associated with sea level rise and extreme sea level events; \n \n204. Acknowledges the ongoing work of the open-ended Study Group of the \nInternational Law Commission on the topic \u201cSea-level rise in relation to international \nlaw\u201d,103 and encourages States to share their views on the various aspects of this topic \nwith that Commission;  \n \n205. Recalls its decision in resolution 77/276 of 29 March 2023 to request the \nInternational Court of Justice to render an advisory opinion on the obligations of \nStates in respect of climate change; \n \n206. Welcomes the Paris Agreement104 and its early entry into force on \n4 November 2016, encourages all its parties to fully implement the Agreement and \nparties to the United Nations Framework Convention on Climate Change 105 that have \nnot yet done so to deposit their instruments of ratification, acceptance, approval or \naccession, as appropriate, as soon as possible, notes the entry into force of the Doha \n__________________ \n \n103 Ibid., Seventy-fourth Session, Supplement No. 10 (A/74/10); ibid., Seventy-sixth Session, \nSupplement No. 10 (A/76/10); ibid., Seventy-seventh Session, Supplement No. 10 (A/77/10); and \nibid., Seventy-eighth Session, Supplement No. 10 (A/78/10). \n \n104 See FCCC/CP/2015/10/Add.1, decision 1/CP.21, annex. \n \n105 United Nations, Treaty Series, vol. 1771, No. 30822. \n\nA/RES/78/69 \nOceans and the law of the sea\n \n23-24917\n34/57 \n \namendment106 to the Kyoto Protocol107 on 31 December 2020, and recognizes the \nimportance of raising awareness of the adverse impact of climate change on the \nmarine environment, marine biodiversity and sea level; \n \n207. Notes, in this regard, the decision at the twenty-seventh session of the \nConference of the Parties to the United Nations Framework Convention on Climate \nChange that future ocean and climate change dialogues will, from 2023, be facilitated \nby two co-facilitators, selected by Parties biennially, who will be responsible for \ndeciding the topics for and conducting the dialogue, in consultation with Parties and \nobservers, and preparing an informal summary report for consideration at the \nsubsequent session of the Conference of the Parties; \n \n208. Welcomes, in this regard, the convening of the twenty-eighth session of the \nConference of the Parties to the United Nations Framework Convention on Climate \nChange, the eighteenth session of the Conference of the Parties serving as the Meeting \nof the Parties to the Kyoto Protocol and the fifth session of the Conference of the \nParties serving as the Meeting of the Parties to the Paris Agreement in Dubai, United \nArab Emirates, from 30 November to 12 December 2023;  \n \n209. Notes with concern the severe impacts on coastal communities of extreme \nweather events, such as tropical cyclones and associated storm surges, and encourages \ncooperative actions by relevant United Nations bodies and organizations, including \nthe World Meteorological Organization and the Intergovernmental Oceanographic \nCommission with the advice of the Joint WMO-IOC Collaborative Board,108 to assist \nStates in improving forecasting, including routine and impact-based forecasting and \nsupport to decision-making for emergency management, of such events and its \napplication in multi-hazard early warning systems and risk management under a more \nintegrated approach to addressing the impacts of flooding types from multiple sources \nand severe weather;109 \n \n210. Also notes with concern the approximately 30 per cent increase in the \nacidity of ocean surface waters since the beginning of the industrial era 110 and the \nwide range of impacts associated with the continuing and alarming acidification of \nthe world\u2019s oceans, and urges States to make significant efforts to tackle the causes \nof ocean acidification, recognizing countries\u2019 national circumstances and respective \ncapabilities, and to further study and minimize its impacts, to enhance local, national, \nregional and global cooperation in this regard, including the sharing of relevant \ninformation and the development of worldwide capacity, including in developing \ncountries, to measure ocean acidification, and to take steps to make marine \necosystems healthier and, as a result, more resilient, to the extent possible, to the \nimpacts of ocean acidification; \n \n211. Recognizes the importance of improving understanding of the impacts of \nacidification on oceans and seas, and recalls that, in \u201cThe future we want\u201d, States \ncalled for support for initiatives that address ocean acidification and the impacts of \nclimate change on marine and coastal ecosystems and resources and in this regard \nreiterated the need to work collectively to prevent further ocean acidification, as well \nas to enhance the resilience of marine ecosystems and of the communities whose \nlivelihoods depend on them, and to support marine scientific research, monitoring \n__________________ \n \n106 FCCC/KP/CMP/2012/13/Add.1, decision 1/CMP.8. \n \n107 United Nations, Treaty Series, vol. 2303, No. 30822. \n \n108 Established through World Meteorological Organization resolution 9 (Cg-18) and \nIntergovernmental Oceanographic Commission resolution XXX-2, which also disbanded the \nJoint WMO-IOC Technical Commission for Oceanography and Marine Meteorology. \n \n109 See World Meteorological Organization resolution 15 (Cg-18). \n \n110 As stated in the 2013 report of Working Group I of the Intergovernmental Panel on Climate \nChange on the physical science basis of climate change. \n\nOceans and the law of the sea \nA/RES/78/69\n \n35/57\n23-24917 \n \nand observation of ocean acidification and particularly vulnerable ecosystems, \nincluding through enhanced international cooperation in this regard; \n \n212. Also recognizes the attention paid to ocean acidification at the fourteenth, \neighteenth and nineteenth meetings of the Informal Consultative Process, in 2013, \n2017 and 2018, respectively, and commits itself to continue to pay attention to this \nimportant issue, including by taking into account the first and second World Ocean \nAssessments (World Ocean Assessment I and II), the ongoing work of the Ocean \nAcidification International Coordination Centre of the International Atomic Energy \nAgency and the scientific cooperation fostered by the Global Ocean Acidification \nObserving Network; \n \n213. Notes the work of the Intergovernmental Panel on Climate Change, notes \nwith concern its findings on the acidification of the oceans and the substantial risks \nto marine ecosystems, especially polar ecosystems, coral reefs, plankton and other \norganisms which have a calcareous exoskeleton, or a shell, like crustaceans, and the \npotentially detrimental consequences for fisheries and livelihoods, as well as the \nfindings of the World Meteorological Organization contained in its annual \nGreenhouse Gas Bulletin, and notes its decision to foster collaboration with \norganizations and institutions that address the carbon budget of the ocean, 111 and in \nthis regard encourages States and competent international organizations and other \nrelevant institutions, individually and in cooperation, to urgently pursue further \nresearch on ocean acidification, especially programmes of observation and \nmeasurement, noting in particular the continued work under the Convention on \nBiological Diversity, and to increase national, regional and global efforts to address \nlevels of ocean acidity and the negative impact of such acidity on vulnerable marine \necosystems, particularly coral reefs; \n \n214. Encourages States, individually or in collaboration with relevant \ninternational organizations and bodies, to enhance their scientific activity to better \nunderstand the effects of climate change on the marine environment and marine \nbiodiversity, support continued coordination of scientific work to study and minimize \nthe impacts of ocean acidification and develop ways and means of adaptation, taking \ninto account, as appropriate, the precautionary approach and ecosystem approaches;  \n \n215. Notes the vital role that coastal blue carbon ecosystems, including \nmangroves, tidal marshes and seagrasses, play in climate adaptation and mitigation \nthrough carbon sequestration, and in increasing the resilience of coastal ecosystems \nto ocean acidification, and the range of other benefits that these ecosystems provide, \nincluding sustainable livelihoods, food security and biodiversity conservation, and \ncoastal protection, and encourages States and relevant international institutions and \norganizations to work collaboratively to protect and restore coastal blue carbon \necosystems; \n \n216. Recalls that, in \u201cThe future we want\u201d, States noted with concern that the \nhealth of oceans and marine biodiversity are negatively affected by marine pollution, \nincluding marine debris, especially plastic, persistent organic pollutants, heavy metals \nand nitrogen-based compounds, from a number of marine and land-based sources, \nincluding shipping and land run-off, and that States committed to take action to reduce \nthe incidence and impacts of such pollution on marine ecosystems, and encourages \nStates, in accordance with the commitment expressed in this regard, and based on \ncollected scientific data, to take action by 2025 to achieve significant reductions in \nmarine debris to prevent harm to the coastal and marine environment; \n \n217. Recognizes the need for better understanding of the sources, amounts, \npathways, distribution, trends, nature and impacts of marine debris, especially plastics \n__________________ \n \n111 See World Meteorological Organization resolution 46 (Cg 17). \n\nA/RES/78/69 \nOceans and the law of the sea\n \n23-24917\n36/57 \n \nand microplastics, and to examine possible measures and best available techniques and \nenvironmental practices to prevent its accumulation and minimize its levels in the \nmarine environment, and welcomes in this regard the work conducted under the Joint \nGroup of Experts on the Scientific Aspects of Marine Environmental Protection, led \nby the Intergovernmental Oceanographic Commission, and its reports entitled Sources, \nFate and Effects of Microplastics in the Marine Environment: A Global Assessment, \nGuidelines for the Monitoring and Assessment of Plastic Litter in the Ocean, and Sea-\nbased Sources of Marine Litter, and the report of the Executive Director of the United \nNations Environment Programme entitled From Pollution to Solution: A Global \nAssessment of Marine Litter and Plastic Pollution, launched on 21 October 2021; \n \n218. Notes that the UNEP Frontiers 2016 Report identifies microplastics as one \nof six key emerging environmental issues, further notes that the sixth Global \nEnvironment Outlook stresses, inter alia, the urgency of addressing ocean plastic \npollution and the proven adverse impacts of microplastics to marine ecosystems, and \ncalls upon States to implement resolution 4/6 on marine plastic litter and microplastics, \nadopted by the United Nations Environment Assembly of the United Nations \nEnvironment Programme at its fourth session, held in Nairobi from 11 to 15 March \n2019;112 \n \n219. Welcomes the request by the United Nations Environment Assembly, in \nparagraph 2 of its resolution 4/6, to the Executive Director of the United Nations \nEnvironment Programme, subject to the availability of resources and benefiting from \nthe work of existing mechanisms, to immediately strengthen scientific and \ntechnological knowledge with regard to marine litter, including marine plastic litter \nand microplastics; \n \n220. Also welcomes the decision of the United Nations Environment Assembly, \nin paragraph 1 of its resolution 5/14, to convene an intergovernmental negotiating \ncommittee to develop an international legally binding instrument on plastic pollution, \nincluding in the marine environment, with the ambition of completing its work by the \nend of 2024,113 and notes that the committee held its first, second and third sessions \nin Punta del Este, Uruguay, from 28 November to 2 December 2022, in Paris from \n29 May to 2 June 2023, and in Nairobi from 13 to 19 November 2023, respectively; \n \n221. Further welcomes the activities of relevant United Nations bodies and \norganizations, in particular the United Nations Environment Programme, the Food \nand Agriculture Organization of the United Nations and the International Maritime \nOrganization and other intergovernmental organizations, to address the sources and \nimpacts of marine debris, including through the Global Partnership on Plastic \nPollution and Marine Litter and the GloLitter Partnerships project, as well as actions \nrelating to marine debris taken under the Convention on Biological Diversity and the \nConvention on the Conservation of Migratory Species of Wild Animals, 114 in \nparticular the adoption by the Conference of the Parties to that Convention at its \ntwelfth meeting of resolution 12.20 on the management of marine debris, and notes \nthe work of the International Whaling Commission on assessing the impacts of marine \ndebris on cetaceans;  \n \n222. Encourages States to further develop partnerships with Indigenous \nPeoples, local communities, including coastal communities, industry and civil society \nto raise awareness of the extent of the impact of marine debris on the biological \ndiversity, health and productivity of the marine environment and consequent \neconomic loss and to cooperate with other States, Indigenous Peoples, local \n__________________ \n \n112 UNEP/EA.4/Res.6. \n \n113 See UNEP/EA.5/Res.14.  \n \n114 United Nations, Treaty Series, vol. 1651, No. 28395. \n\nOceans and the law of the sea \nA/RES/78/69\n \n37/57\n23-24917 \n \ncommunities, including coastal communities, industry and civil society, as \nappropriate, on environmentally sound and cost-effective measures to prevent and \nreduce, as appropriate, marine debris and microplastics in the marine environment, \nincluding through strengthened cooperation under the Global Partnership on Plastic \nPollution and Marine Litter; \n \n223. Recognizes the attention paid to the theme of \u201cMarine debris, plastics and \nmicroplastics\u201d at the seventeenth meeting of the Informal Consultative Process in \n2016, and urges States to integrate the issue of marine debris into national and, as \nappropriate, regional strategies dealing with waste management, especially in the \ncoastal zone, ports and maritime industries, including recycling, reuse, reduction and \ndisposal, to consider developing an integrated waste management infrastructure and \nto encourage the development of appropriate economic incentives with the aim of \nreducing marine debris to address this issue, including the development of cost-\nrecovery systems that provide an incentive to use port reception facilities and \ndiscourage ships from discharging marine debris at sea, and support for measures to \nprevent, reduce and control pollution from any source, including land-based sources, \nsuch as community-based coastal and waterway clean-up and monitoring activities, \nand encourages States to cooperate regionally and subregionally to identify potential \nsources and coastal and oceanic locations where marine debris aggregates and to \ndevelop and implement joint prevention programmes for marine debris and to develop \nand implement environmentally sound options for recovery programmes, as well as \nto raise awareness of the issue of marine debris and the need to consider \nenvironmentally sound options for its removal; \n \n224. Notes the activities carried out by organizations at the regional level to \ndevelop and implement regional action plans and other joint prevention and recovery \nprogrammes for marine debris, and further notes in this regard the revised Regional \nAction Plan on Marine Litter adopted at the Ministerial Meeting of the Baltic Marine \nEnvironment Protection Commission (Helsinki Commission) in October 2021, the \namendments to the Regional Plan on Marine Litter Management in the Mediterranean \nadopted at the twenty-second Meeting of the Contracting Parties to the Convention \nfor the Protection of the Marine Environment and the Coastal Region of the \nMediterranean (Barcelona Convention) and its Protocols in December 2021 in \nAntalya, T\u00fcrkiye, the Second Regional Action Plan for the Prevention and \nManagement of Marine Litter in the North-East Atlantic (2022\u20132030), adopted at the \nannual meeting of the OSPAR Commission in Copenhagen on 24 April 2022, and a \nregional plan for integrated management of marine litter in the South-East Pacific, \nadopted in April 2022 within the framework of the Protocol for the Protection of the \nSouth-East Pacific against Pollution from Land-based Sources115 and the ASEAN \nRegional Action Plan for Combating Marine Debris in the ASEAN Member States \n(2021\u20132025) launched by ASEAN in 2021; \n \n225. Also notes the work done under the Asia-Pacific Economic Cooperation \n(APEC) framework to share best practices, enable innovative waste management \nfinancing and encourage public-private partnerships in order to prevent and reduce \nmarine debris, including the development of a marine debris monitoring decision \nframework for APEC economies in January 2023; \n \n226. Welcomes the adoption of the Indian Ocean Rim Association Strategic \nFramework of Action on Marine Debris in the Indian Ocean in November 2022, and \nencourages the effective implementation by member States of the Indian Ocean Rim \nAssociation of the Strategic Framework to comprehensively combat marine plastic \n__________________ \n \n115 Ibid., vol. 1648, No. 28327. \n\nA/RES/78/69 \nOceans and the law of the sea\n \n23-24917\n38/57 \n \ndebris in the Indian Ocean, with the support of dialogue partners of the Indian Ocean \nRim Association and other international and regional organizations; \n \n227. Also welcomes the ongoing work of the members of the Group of 20 on \nthe \u201cOsaka Blue Ocean Vision\u201d, which aims to reduce additional pollution by marine \nplastic litter to zero by 2050, and calls upon other members of the international \ncommunity to also share the vision; \n \n228. Notes the release of the United Nations Conference on Trade and \nDevelopment Trade and Environment Review 2023: Building a Sustainable and \nResilient Ocean Economy beyond 2030116 and the United Nations Conference on \nTrade and Development Review of Maritime Transport 2022: Navigating Stormy \nWaters;117 \n \n229. Encourages States that have not yet done so to become parties to \ninternational agreements addressing the protection and preservation of the marine \nenvironment and its living marine resources against the introduction of harmful \naquatic organisms and pathogens and marine pollution from all sources, including the \ndumping of wastes and other matter, and other forms of physical degradation, as well \nas agreements that provide for preparedness for, response to and cooperation on \npollution incidents and that include provisions on liability and compensation for \ndamage resulting from marine pollution, and to adopt the necessary measures \nconsistent with international law, including the Convention, aimed at implementing \nand enforcing the rules contained in those agreements; \n \n230. Recalls that, in \u201cThe future we want\u201d, States noted the significant threat \nthat alien invasive species pose to marine ecosystems and resources and committed \nto implement measures to prevent the introduction and manage the adverse \nenvironmental impacts of alien invasive species, including, as appropriate, those \nadopted in the framework of the International Maritime Organization;  \n \n231. Encourages States that have not yet done so to consider ratifying or \nacceding to the International Convention for the Control and Management of Ships\u2019 \nBallast Water and Sediments, 2004,118 and also encourages States to consider \nimplementing the Guidelines for the control and management of ships\u2019 biofouling to \nminimize the transfer of invasive aquatic species, adopted by the International \nMaritime Organization in resolution MEPC.207(62) of 15 July 2011; \n \n232. Notes the activities carried out by the United Nations Environment \nProgramme/Mediterranean Action Plan and further notes in this regard the \nMediterranean Strategy for the Prevention of, Preparedness and Response to Marine \nPollution from Ships (2022\u20132031) and the Ballast Water Management Strategy for \nthe Mediterranean Sea (2022\u20132027), adopted at the twenty-second Meeting of the \nContracting Parties to the Barcelona Convention and its Protocols; \n \n233. Also notes the ongoing work of the International Maritime Organization to \nprevent pollution from ships, including through the designation of Special Areas \nunder the International Convention for the Prevention of Pollution from Ships, 1973, \nas modified by the Protocol of 1978 relating thereto, as amended, 119 as well as through \nits action plan and strategy to address marine litter from ships, and encourages the \n__________________ \n \n116 United Nations Conference on Trade and Development, document UNCTAD/DITC/TED/2023/1. \nAvailable at https://unctad.org/ter2023.  \n \n117 United Nations Conference on Trade and Development, document UNCTAD/RMT/2022. \nAvailable at https://unctad.org/rmt2022.  \n \n118 International Maritime Organization, document BWM/CONF/36, annex. \n \n119 International Convention for the Prevention of Pollution from Ships, annex IV (Regulations for \nthe prevention of pollution by sewage from ships) and annex V (Regulations for the prevention \nof pollution by garbage from ships). \n\nOceans and the law of the sea \nA/RES/78/69\n \n39/57\n23-24917 \n \nInternational Maritime Organization to continue working on the prevention of \npollution from ships; \n \n234. Further notes, in this regard, the theme for the 2023 World Maritime Day, \n\u201cMARPOL at 50 \u2013 Our commitment goes on\u201d; \n \n235. Notes that the global limit of 0.50 per cent on sulphur in fuel oil under \nannex VI to the International Convention for the Prevention of Pollution from Ships \nentered into force on 1 January 2020, encourages States that have not yet done so to \nbecome parties to the Protocol of 1997 (annex VI \u2013 Regulations for the Prevention of \nAir Pollution from Ships) to the International Convention for the Prevention of \nPollution from Ships, 1973, as modified by the Protocol of 1978 relating thereto, as \namended, and encourages the effective implementation of that Protocol; 120 \n \n236. Welcomes the designation, at the initiative of the Contracting Parties to the \nBarcelona Convention and its Protocols, of the Mediterranean Sea, as a whole, as an \nEmission Control Area for Sulphur Oxides (Med SOx ECA) pursuant to an \namendment to annex VI to the International Convention for the Prevention of \nPollution from Ships, which is expected to enter into force on 1 May 2024 and take \neffect from 1 May 2025,121 and encourages ratification of that annex across the \nMediterranean region as soon as possible; \n \n237. Notes the ongoing work of the International Maritime Organization and \nthe resolution on International Maritime Organization policies and practices related \nto the reduction of greenhouse gas emissions from ships, 122 and in this regard \nwelcomes its adoption of a revised strategy on the reduction of greenhouse gas \nemissions from ships (the 2023 IMO Strategy on Reduction of GHG Emissions from \nShips);123 \n \n238. Urges States to cooperate in correcting the shortfall in port waste reception \nfacilities in accordance with the action plan to address the inadequacy of port waste \nreception facilities developed by the International Maritime Organization; \n \n239. Emphasizes the need for the safe and environmentally sound recycling of \nships, notes that the Hong Kong International Convention for the Safe and \nEnvironmentally Sound Recycling of Ships, 2009 124 will enter into force on 26 June \n2025, and encourages States that have not yet done so to consider ratifying or \nacceding to that Convention;  \n \n240. Encourages continued cooperation between the parties to the Basel \nConvention on the Control of Transboundary Movements of Hazardous Wastes and \nTheir Disposal125 and the International Maritime Organization on regulations on the \nprevention of pollution from ships; \n \n241. Notes the role of the Basel Convention in ensuring that the management \nof hazardous wastes and other wastes, under the scope of that Convention, including \ntheir transboundary movement and disposal, is consistent with the protection of the \nmarine environment; \n \n242. Notes with concern the potential for serious environmental consequences \nresulting from oil spill incidents or pollution incidents involving hazardous or \nnoxious substances, urges States, consistent with international law, to cooperate, \n__________________ \n \n120 International Maritime Organization, document MEPC 62/24/Add.1, annex 19, resolution \nMEPC.203(62). \n \n121 International Maritime Organization, resolution MEPC.361(79). \n \n122 International Maritime Organization, Assembly resolution A.963(23). \n \n123 See International Maritime Organization, resolution MEPC.377(80). \n \n124 International Maritime Organization, document SR/CONF/45. \n \n125 United Nations, Treaty Series, vol. 1673, No. 28911. \n\nA/RES/78/69 \nOceans and the law of the sea\n \n23-24917\n40/57 \n \ndirectly or through competent international organizations, and share best practices, in \nthe fields of protection of the marine environment, human health and safety, \nprevention, emergency response and mitigation, and in this regard encourages the \nundertaking of and collaboration on scientific research, including marine scientific \nresearch, to better understand the consequences of marine oil spills or marine spills \ninvolving hazardous or noxious substances; \n \n243. Encourages States, in accordance with international law, including the \nConvention and other relevant instruments, either bilaterally or regionally, to jointly \ndevelop and promote contingency plans for responding to pollution incidents, as well \nas other incidents that are likely to have significant adverse effects on the marine \nenvironment and biodiversity; \n \n244. Encourages States that have not yet done so to consider ratifying or \nacceding to the International Convention on Oil Pollution Preparedness, Response \nand Cooperation, 1990,126 and the Protocol on Preparedness, Response and \nCooperation to Pollution Incidents by Hazardous and Noxious Substances, 2000, of \nthe International Maritime Organization, and in this regard to consider developing \nand joining regional arrangements to enhance international cooperation for combating \nmajor oil and hazardous substances pollution incidents; \n \n245. Encourages States to consider becoming parties to the 2010 Protocol to \nthe 1996 International Convention on Liability and Compensation for Damage in \nConnection with the Carriage of Hazardous and Noxious Substances by Sea;127 \n \n246. Recognizes that most of the pollution load of the oceans emanates from \nland-based activities and affects the most productive areas of the marine environment, \nand calls upon States, as a matter of priority, to implement the Global Programme of \nAction for the Protection of the Marine Environment from Land-based Activities; \n \n247. Welcomes the continued work of States, the United Nations Environment \nProgramme and regional organizations in the implementation of the Global \nProgramme of Action, and encourages increased emphasis on the link between fresh \nwater, the coastal zone and marine resources in the implementation of the 2030 \nAgenda and its Sustainable Development Goals, as well as of the Addis Ababa Action \nAgenda of the Third International Conference on Financing for Development; \n \n248. Expresses its concern regarding the spreading of hypoxic dead zones and \nharmful algal blooms in oceans as a result of eutrophication fuelled by riverine run-\noff of fertilizers, sewage outfall and reactive nitrogen resulting from the burning of \nfossil fuels and resulting in serious consequences for ecosystem functioning, and calls \nupon States to enhance their efforts to reduce eutrophication, particularly by reducing \ntotal nutrient pollution from land-based sources and, to this effect, to continue to \ncooperate within the framework of relevant international organizations, in particular \nthe Global Programme of Action and the Global Partnership on Nutrient Management \nand Global Wastewater Initiative, including through capacity-building initiatives and \nefforts to monitor, via the Global Ocean Observing System, stressors such as harmful \nalgal blooms, areas of hypoxia, sargassum seaweed invasions and jellyfish blooms, \nto assess their possible linkage to eutrophication and their potential adverse impacts \non the marine environment as well as on human health; \n \n249. Encourages States that have not yet done so to take, as soon as possible, \nthe domestic measures necessary to enable them to meet their obligations upon \n__________________ \n \n126 Ibid., vol. 1891, No. 32194. \n \n127 International Maritime Organization, document LEG/CONF.17/10. \n\nOceans and the law of the sea \nA/RES/78/69\n \n41/57\n23-24917 \n \nratification and, thereafter, to ratify, accept, approve or accede to the Minamata \nConvention on Mercury;128 \n \n250. Calls upon all States to ensure that urban and coastal development projects \nand related land-reclamation activities are carried out in a responsible manner that \nprotects the marine habitat and environment and mitigates the negative consequences \nof such activities;  \n \n251. Recalls that, in \u201cThe future we want\u201d, States stressed their concern about \nthe potential environmental impacts of ocean fertilization, recalled in this regard the \ndecisions related to ocean fertilization adopted by the relevant intergovernmental \nbodies, and resolved to continue addressing ocean fertilization with utmost caution, \nconsistent with the precautionary approach; \n \n252. Encourages States that have not yet done so to become parties to the 1996 \nProtocol to the Convention on the Prevention of Marine Pollution by Dumping of \nWastes and Other Matter, 1972 (the London Protocol); \n \n253. Recalls the resolution of the thirtieth Consultative Meeting of Contracting \nParties to the Convention on the Prevention of Marine Pollution by Dumping of \nWastes and Other Matter, 1972 (the London Convention) and the third Meeting of \nContracting Parties to the London Protocol, held from 27 to 31 October 2008, on the \nregulation of ocean fertilization,129 in which the Contracting Parties agreed, inter alia, \nthat the scope of the London Convention and Protocol includes ocean fertilization \nactivities and that, given the present state of knowledge, ocean fertilization activities \nother than for legitimate scientific research should not be allowed, and that scientific \nresearch proposals should be assessed on a case-by-case basis using an assessment \nframework that was subsequently developed and adopted in 2010 by the Contracting \nParties to the London Convention and Protocol, namely, the Assessment Framework \nfor Scientific Research Involving Ocean Fertilization,130 and also agreed that, to this \nend, such other activities should be considered as contrary to the aims of the London \nConvention and Protocol and should not currently qualify for any exemption from the \ndefinition of dumping in article III, paragraph 1 (b), of the London Convention and \narticle 1, paragraph 4.2, of the London Protocol;131 \n \n254. Notes the continued work of the Contracting Parties to the London \nConvention and Protocol towards a global, transparent and effective control and \nregulatory mechanism for ocean fertilization activities and other activities that fall \nwithin the scope of the London Convention and Protocol and have the potential to \ncause harm to the marine environment, and notes the resolution adopted by the eighth \nMeeting of Contracting Parties to the London Protocol, held from 14 to 18 October \n2013, on the amendment to the London Protocol to regulate the placement of matter \nfor ocean fertilization and other marine geoengineering activities; 132 \n \n255. Recalls decision IX/16 C, adopted at the ninth meeting of the Conference \nof the Parties to the Convention on Biological Diversity, held in Bonn, Germany, from \n19 to 30 May 2008,133 in which the Conference of the Parties, inter alia, bearing in \nmind the ongoing scientific and legal analysis occurring under the auspices of the \nLondon Convention and Protocol, requested parties and urged other Governments, in \naccordance with the precautionary approach, to ensure that ocean fertilization \n__________________ \n \n128 UNEP(DTIE)/Hg/CONF/4, annex II. \n \n129 International Maritime Organization, document LC 30/16, annex 6, resolution LC-LP.1 (2008). \n \n130 International Maritime Organization, document LC 32/15 and Corr.1, annex 5, resolution \nLC- LP.2 (2010). \n \n131 Ibid. \n \n132 International Maritime Organization, document LC 35/15, annex 4, resolution LP.4(8). \n \n133 See United Nations Environment Programme, document UNEP/CBD/COP/9/29, annex I. \n\nA/RES/78/69 \nOceans and the law of the sea\n \n23-24917\n42/57 \n \nactivities were not carried out until there was an adequate scientific basis on which to \njustify such activities, including an assessment of associated risks, and that a global, \ntransparent and effective control and regulatory mechanism was in place for those \nactivities, with the exception of small-scale scientific research studies within coastal \nwaters, and stated that such studies should be authorized only if justified by the need \nto gather specific scientific data, should be subject to a thorough prior assessment of \nthe potential impacts of the research studies on the marine environment, should be \nstrictly controlled and should not be used for generating and selling carbon offsets or \nfor any other commercial purposes, and takes note of decision X/29, adopted at the \ntenth meeting of the Conference of the Parties to the Convention on Biological \nDiversity, held in Nagoya, Japan, from 18 to 29 October 2010, 134 in which the \nConference of the Parties requested parties to implement decision IX/16 C; \n \n256. Notes resolution LP.6(17) of the forty-fourth Consultative Meeting of \nContracting Parties to the London Convention and seventeenth Meeting of \nContracting Parties to London Protocol amending annexes 1 and 2 to the Protocol to \nremove sewage sludge from the list and assessment of wastes or other matter that may \nbe considered for dumping, which entered into force on 15 January 2023; 135  \n \nX \nMarine biodiversity \n \n \n257. Reaffirms its central role relating to the conservation and sustainable use \nof marine biological diversity of areas beyond national jurisdiction; \n \n258. Underscores that the intergovernmental conference established by \nresolution 72/249 of 24 December 2017 finalized its work as reflected in resolution \n77/321 on the Agreement under the United Nations Convention on the Law of the Sea \non the Conservation and Sustainable Use of Marine Biological Diversity of Areas \nbeyond National Jurisdiction, and invites States and regional economic integration \norganizations to consider this and its implications for the ocean, in particular, on their \nefforts toward the conservation and sustainable use of marine biological diversity of \nareas beyond national jurisdiction; \n \n259. Recognizes the abundance and diversity of marine genetic resources and \ntheir value in terms of the benefits, goods and services they can provide; \n \n260. Also recognizes the importance of research on marine genetic resources \nfor the purpose of enhancing the scientific understanding, potential use and \napplication, and enhanced management of marine ecosystems; \n \n261. Notes the work under the Jakarta Mandate on Marine and Coastal \nBiological Diversity136 and the Convention on Biological Diversity elaborated \nprogramme of work on marine and coastal biological diversity, 137 and, while \nreiterating the central role of the General Assembly relating to the conservation and \nsustainable use of marine biological diversity of areas beyond national jurisdiction, \nnotes with appreciation the complementary technical and scientific work done by the \nConference of the Parties to the Convention on Biological Diversity; \n \n262. Welcomes the fifteenth meeting of the Conference of the Parties to the \nConvention on Biological Diversity and its outcomes, including the adoption of the \nKunming-Montreal Global Biodiversity Framework,138 its 2030 mission to halt and \n__________________ \n \n134 See United Nations Environment Programme, document UNEP/CBD/COP/10/27, annex. \n \n135 International Maritime Organization, document LC 44/17, annex 4, resolution LP.6(17). \n \n136 See A/51/312, annex II, decision II/10. \n \n137 United Nations Environment Programme, document UNEP/CBD/COP/7/21, annex, decision VII/5, \nannex I. \n \n138 See Conference of the Parties to the Convention on Biological Diversity decision 15/4. \n\nOceans and the law of the sea \nA/RES/78/69\n \n43/57\n23-24917 \n \nreverse biodiversity loss, and its 2050 vision of living in harmony with nature, and \nencourages the full and effective implementation of that Framework and its goals and \ntargets relevant to the ocean, and calls upon all States to increase efforts at all levels \nto achieve those goals and targets;  \n \n263. Recognizes the ongoing activities of the secretariat of the Convention on \nBiological Diversity in coordinating capacity-building efforts to support developing \nStates in achieving the goals and targets of the Kunming-Montreal Global \nBiodiversity Framework in marine and coastal areas; \n \n264. Reaffirms the need for States, individually or through competent \ninternational organizations, to urgently consider ways to integrate and improve, based \non the best available scientific information and the precautionary approach and in \naccordance with the Convention and related agreements and instruments, the \nmanagement of risks to the marine biodiversity of seamounts, cold water corals, \nhydrothermal vents and certain other underwater features; \n \n265. Invites parties to the Convention on Biological Diversity to implement the \nvoluntary specific workplan on biodiversity in cold water areas within the \njurisdictional scope of that Convention, adopted in 2016 by the thirteenth meeting of \nthe Conference of the Parties to that Convention;139 \n \n266. Reiterates its deep concern at the serious adverse impacts on the marine \nenvironment and biodiversity, in particular on vulnerable marine ecosystems and their \nphysical and biogenic structure, including coral reefs, cold water habitats, \nhydrothermal vents and seamounts, of certain human activities, and calls upon States \nand international organizations to urgently take further action to address, in \naccordance with international law, destructive practices that have adverse impacts on \nmarine biodiversity and ecosystems, including seamounts, hydrothermal vents and \ncold water corals; \n \n267. Calls upon States to strengthen, in a manner consistent with international \nlaw, in particular the Convention, the conservation and management of marine \nbiodiversity and ecosystems, and national policies in relation to area-based \nmanagement tools, including marine protected areas; \n \n268. Recalls that, in \u201cThe future we want\u201d, States reaffirmed the importance of \narea-based conservation measures, including marine protected areas, consistent with \ninternational law and based on best available scientific information, as a tool for \nconservation of biological diversity and sustainable use of its components; \n \n269. Reaffirms the need for States to continue and intensify their efforts, \ndirectly and through competent international organizations, to develop and facilitate \nthe use of diverse approaches and tools for conserving and managing vulnerable \nmarine ecosystems, including the possible establishment of marine protected areas, \nconsistent with international law, as reflected in the Convention, and based on the \nbest scientific information available;  \n \n270. Notes the work of States, relevant intergovernmental organizations and \nbodies, including the Convention on Biological Diversity, in the assessment of \nscientific information on and compilation of ecological criteria for the identification \nof marine areas that may require protection, in the light of the objective of the World \nSummit on Sustainable Development to develop and facilitate the use of diverse \napproaches and tools, such as ecosystem approaches and the establishment of marine \n__________________ \n \n139 United Nations Environment Programme, document UNEP/CBD/COP/13/25, sect. I, decision \nXIII/11, annex II. \n\nA/RES/78/69 \nOceans and the law of the sea\n \n23-24917\n44/57 \n \nprotected areas consistent with international law, as reflected in the Convention, and \nbased on scientific information, including representative networks; \n \n271. Recalls that the Conference of the Parties to the Convention on Biological \nDiversity, at its ninth meeting, adopted scientific criteria for identifying ecologically \nor biologically significant marine areas in need of protection in open-ocean waters \nand deep-sea habitats and scientific guidance for selecting areas to establish a \nrepresentative network of marine protected areas, including in open-ocean waters and \ndeep-sea habitats,140 and notes the ongoing work under the Convention on Biological \nDiversity on the application of the scientific criteria for ecologically or biologically \nsignificant marine areas through the organization of a series of regional workshops; \n \n272. Also recalls that the Food and Agriculture Organization of the United \nNations has developed guidance for the identification of vulnerable marine \necosystems and the prevention of significant adverse impacts on them through the \nInternational Guidelines for the Management of Deep-Sea Fisheries in the High Seas, \nand notes its ongoing work to support application of the Guidelines by States and \nregional fisheries management organizations and to maintain a database of vulnerable \nmarine ecosystems;  \n \n273. Notes the ongoing work of the International Maritime Organization to \nidentify and designate as Particularly Sensitive Sea Areas marine areas which are \nrecognized for their significance in terms of ecological, socioeconomic or scientific \ncriteria and are vulnerable to damage by international shipping activities,141 and \nwelcomes the decision of the Marine Environment Protection Committee of the \nInternational Maritime Organization at its eightieth session to designate the North-\nWestern Mediterranean Sea as a Particularly Sensitive Sea Area;  \n \n274. Notes with appreciation the work of the Sustainable Ocean Initiative under \nthe Convention on Biological Diversity;  \n \n275. Also notes with appreciation the work undertaken by regional seas \nconventions for the conservation and sustainable management of marine biodiversity \nand ecosystems, and further notes with appreciation the adoption of the Post-2020 \nStrategic Action Programme for the Conservation of Biodiversity and Sustainable \nManagement of Natural Resources in the Mediterranean Region (Post-2020 SAPBIO) \nand the Post-2020 Regional Strategy for marine and coastal protected areas and other \neffective area-based conservation measures in the Mediterranean, at the twenty-\nsecond Meeting of the Contracting Parties to the Barcelona Convention and its \nProtocols; \n \n276. Acknowledges the Micronesia Challenge, the Caribbean Challenge \nInitiative and the Coral Triangle Initiative, which seek to create and link domestic \nmarine protected areas to better facilitate ecosystem approaches, notes the Phoenix \nIslands Protected Area as a multinational partnership, and reaffirms the need for \nfurther international cooperation, coordination and collaboration in support of such \ninitiatives; \n \n277. Recalls that, in \u201cThe future we want\u201d, States recognized the significant \neconomic, social and environmental contributions of coral reefs, in particular to \nislands and other coastal States, as well as the significant vulnerability of coral reefs \nand mangroves to impacts, including from climate change, ocean acidification, \noverfishing, destructive fishing practices and pollution, and supported international \ncooperation with a view to conserving coral reef and mangrove ecosystems and \n__________________ \n \n140 United Nations Environment Programme, document UNEP/CBD/COP/9/29, annex I, decision \nIX/20, annexes I and II. \n \n141 International Maritime Organization, Revised Guidelines for the Identification and Designation \nof Particularly Sensitive Sea Areas, Assembly resolution A.982(24). \n\nOceans and the law of the sea \nA/RES/78/69\n \n45/57\n23-24917 \n \nrealizing their social, economic and environmental benefits, as well as facilitating \ntechnical collaboration and voluntary information-sharing; \n \n278. Emphasizes the need to mainstream sustainable coral reef management and \nintegrated watershed management into national development strategies, as well as \ninto the activities of relevant United Nations agencies and programmes, international \nfinancial institutions and the donor community; \n \n279. Reiterates its support for the International Coral Reef Initiative, notes that \nthe thirty-seventh International Coral Reef Initiative General Meeting was held in \nKailua-Kona, Hawaii, United States of America, from 20 to 23 September 2023, and \nsupports the elaborated programme of work of the Convention on Biological \nDiversity on marine and coastal biological diversity related to coral reefs under the \nJakarta Mandate on Marine and Coastal Biological Diversity;  \n \n280. Encourages States and relevant international institutions to improve \nefforts to address coral bleaching by, inter alia, improving monitoring to predict and \nidentify bleaching events, supporting and strengthening action taken during such \nevents and improving strategies to manage reefs to support their natural resilience \nand enhance their ability to withstand other pressures, including ocean acidification; \n \n281. Encourages States to cooperate, directly or through competent \ninternational bodies, in exchanging information in the event of accidents involving \nvessels on coral reefs and in promoting the development of economic assessment \ntechniques for both restoration and non-use values of coral reef systems; \n \n282. Notes that ocean noise has potential significant adverse impacts on living \nmarine resources, affirms the importance of sound scientific studies in addressing this \nmatter, encourages further research, studies and consideration of the impacts of ocean \nnoise on living marine resources, notes the work of States and competent international \norganizations in that regard, recognizes the attention paid to the theme of \nanthropogenic underwater noise at the nineteenth meeting of the Informal \nConsultative Process in 2018, and requests the Division to continue to compile the \npeer-reviewed \nscientific \nstudies \nit \nreceives \nfrom \nMember \nStates \nand \nintergovernmental organizations pursuant to paragraph 107 of resolution 61/222 and, \nas appropriate, to make them, or references and links to them, available on its website; \n \n283. Calls upon States to identify appropriate measures and approaches to \nassess and address the potential socioeconomic and environmental impacts of \nanthropogenic underwater noise, taking into account the precautionary approach and \necosystem approaches and the best available scientific information; \n \n284. Encourages further research into, and testing of, technologies to reduce \nthe impact of underwater noise on marine life; \n \n285. Encourages States to continue their work at the International Maritime \nOrganization to enhance understanding of the extent to which improved ship \ntechnology, including efficient propeller design, could lead to reduced introduction \nof underwater noise in the oceans; \n \n286. Notes the approval of revised Guidelines for the Reduction of Underwater \nNoise from Shipping to Address Adverse Impacts on Marine Life by the International \nMaritime Organization in July 2023, the endorsement of an updated workplan, to \ninclude a three-year experience-building phase for the revised Guidelines, and the \nongoing work to develop a programme of action to further prevent and reduce \nunderwater radiated noise, draws attention to the recent International Maritime \nOrganization workshop, held on 18 and 19 September 2023, on the relation between \nenergy efficiency and underwater radiated noise from ships, which highlighted \nsynergies in addressing both environmental issues, and notes with appreciation the \n\nA/RES/78/69 \nOceans and the law of the sea\n \n23-24917\n46/57 \n \nGloNoise Partnership project within the International Maritime Organization, which \nwill focus on building capacity in developing States to implement the revised \nGuidelines; \n \n287. Encourages \nStates, \nacting \nthrough \nthe \nInternational \nMaritime \nOrganization or individually, to participate in and share knowledge during the \nexperience-building phase for the revised Guidelines and implement the \nrecommended solutions to address adequately the barriers that have prevented the \nuptake and implementation of the current Guidelines by the industry; \n \nXI \nMarine science \n \n \n288. Calls upon States, individually or in collaboration with each other or with \ncompetent international organizations and bodies, to continue to strive to improve \nunderstanding and knowledge of the oceans and the deep sea, including, in particular, \nthe extent and vulnerability of deep sea biodiversity and ecosystems, by increasing \ntheir marine scientific research activities in accordance with the Convention; \n \n289. Encourages, in that regard, relevant international organizations and other \ndonors to consider supporting the Endowment Fund of the Authority in order to \npromote the conduct of collaborative marine scientific research in the international \nseabed area by supporting the participation of qualified scientists and technical \npersonnel from developing countries in relevant programmes, initiatives and activities; \n \n290. Notes with concern that human-related threats, such as marine debris, ship \nstrikes, underwater noise, persistent contaminants, coastal development activities, oil \nspills and abandoned, lost or otherwise discarded fishing gear, together or \nindividually, may have a severe impact on marine life, including at its higher trophic \nlevels, and calls upon States and competent international organizations to cooperate \nand coordinate their research efforts in this regard so as to prevent and reduce those \nimpacts and preserve the integrity of the whole marine ecosystem, while fully \nrespecting the mandates of relevant international organizations; \n \n291. Invites all relevant organizations, funds, programmes and bodies within \nthe United Nations system, in consultation with interested States, to coordinate \nrelevant activities with regional and national marine scientific and technological \ncentres in small island developing States, as appropriate, to ensure the more effective \nachievement of their objectives in accordance with relevant United Nations small \nisland developing States development programmes and strategies; \n \n292. Welcomes \nthe \nresolution \nadopted \nby \nthe \nAssembly \nof \nthe \nIntergovernmental Oceanographic Commission at its twenty-eighth session, held in \nParis from 18 to 25 June 2015, regarding the adoption of the Second International \nIndian Ocean Expedition as an important catalyst project linking Indian Ocean \nprocesses to the global ocean and atmosphere, officially launched in Goa, India, on \n4 December 2015 for an initial period of five years and continued to at least 2025, \ninvites States to participate in this initiative, and notes that two nodes of the Second \nInternational Indian Ocean Expedition Joint Project Office have been established to \ncoordinate operations of the expedition in Perth, Australia, and Hyderabad, India; \n \n293. Notes with appreciation the work of the Intergovernmental Oceanographic \nCommission, with the advice of the Advisory Body of Experts on the Law of the Sea, \non the development of procedures for the implementation of Parts XIII and XIV of \nthe Convention; \n \n294. Notes decision A-32/4.4 of the Assembly of the Intergovernmental \nOceanographic Commission, in which it recognized that the timely and unrestricted \ninternational exchange of oceanographic data is essential for the efficient acquisition, \n\nOceans and the law of the sea \nA/RES/78/69\n \n47/57\n23-24917 \n \nintegration and use of ocean observations gathered by the countries of the world for \na wide variety of purposes, as well as for the advancement of scientific understanding, \nand in which it adopted the Intergovernmental Oceanographic Commission Data \nPolicy and Terms of Use (2023), which outlines the requirements with respect to \nsharing, access, preservation and attribution to facilitate the broad use and reuse of \nocean metadata, data and products;142  \n \n295. Also notes that the depth of a significant percentage of the world\u2019s oceans, \nseas and waterways has yet to be measured directly and that bathymetric knowledge \nunderpins the safe, sustainable and cost-effective execution of almost every human \nactivity in, on or under the sea; \n \n296. Welcomes the work of the General Bathymetric Chart of the Oceans under \nthe International Hydrographic Organization and the Intergovernmental Oceanographic \nCommission and, in particular, the progress made, in collaboration with the Nippon \nFoundation, under the Seabed 2030 project towards mapping 100 per cent of the ocean \nfloor by 2030; \n \n297. Encourages Member States to consider contributing to mechanisms that \nencourage the widest possible availability of all bathymetric data, so as to support the \nsustainable development, management and governance of the marine environment; \n \n298. Notes with appreciation the contribution to marine biodiversity research \nof the Ocean Biodiversity Information System, a free and open-access data holding \nand sharing facility, hosted by the Intergovernmental Oceanographic Commission; \n \n299. Welcomes the increasing attention being focused on oceans as a potential \nsource of renewable energy, and notes in this regard the summary of discussions of \nthe Informal Consultative Process at its thirteenth meeting, in 2012; 143 \n \n300. Stresses the importance of the environmental impact assessment process \nfor ocean-based renewable energy projects; \n \n301. Also stresses the importance of increasing the scientific understanding of \nthe oceans-atmosphere interface, including through participation in ocean observing \nprogrammes and geographic information systems, such as the Global Ocean \nObserving System, sponsored by the Intergovernmental Oceanographic Commission, \nthe United Nations Environment Programme, the World Meteorological Organization \nand the International Science Council, particularly considering their role in \nmonitoring and forecasting climate change and variability, in supporting Earth system \nprediction144 and in the establishment and operation of tsunami warning systems; \n \n302. Notes the decision adopted by the Assembly of the Intergovernmental \nOceanographic Commission at its thirty-second session to establish an ad hoc \nintersessional Working Group on Ocean Observations in Areas under National \nJurisdiction;145  \n \n303. Welcomes the progress made by the Intergovernmental Oceanographic \nCommission and Member States towards the establishment and operation of regional \nand national tsunami warning and mitigation systems, also welcomes the continued \ncollaboration of the United Nations and other intergovernmental organizations in this \neffort, further welcomes the development and recent dissemination of the new \nEnhanced Tsunami Products for the Pacific Tsunami Warning and Mitigation System \n__________________ \n \n142 Intergovernmental Oceanographic Commission, document IOC/A-32/Decisions, decision \nA-32/4.4. \n \n143 See A/67/120. \n \n144 See World Meteorological Organization resolution 47 (Cg-18). \n \n145 Intergovernmental Oceanographic Commission, document IOC/A-32/Decisions, decision \nA-32/4.8.2. \n\nA/RES/78/69 \nOceans and the law of the sea\n \n23-24917\n48/57 \n \nand the development of Enhanced Tsunami Products for the Tsunami and Other \nCoastal Hazards Warning System for the Caribbean and Adjacent Regions, which will \nassist countries in the Pacific and the Caribbean to assess tsunami threats and issue \nwarnings, and encourages Member States to establish and sustain their national \nwarning and mitigation systems, within a global, ocean-related multi-hazard \napproach, as necessary, to reduce loss of life and damage to national economies and \nstrengthen the resilience of coastal communities to natural disasters, and welcomes \nthe establishment of the Intergovernmental Oceanographic Commission Tsunami \nProgramme under the United Nations Decade of Ocean Science for Sustainable \nDevelopment (2021\u20132030), its 10-Year Research, Development and Implementation \nPlan, including its Tsunami Ready Recognition Programme and Tsunami Ready \nCoalition, aimed at building resilient communities through awareness and \npreparedness strategies that will protect life, livelihoods and property from tsunamis \nin different regions;  \n \n304. Stresses the need for continued efforts in developing mitigation and \npreparedness measures for natural disasters, particularly following such tsunami \nevents as that on 11 March 2011 in Japan, those on 28 September and 22 December \n2018 in Indonesia, and that on 15 January 2022 following the Hunga Tonga-Hunga \nHa\u2019apai volcanic eruption in Tonga; \n \n305. Notes the decision adopted by the Assembly of the Intergovernmental \nOceanographic Commission at its thirty-second session that warning systems for \ntsunamis generated by volcanoes should be coordinated and considered as part of the \nUnited Nations Educational, Scientific and Cultural Organization/Intergovernmental \nOceanographic Commission Global Tsunami and other Ocean-related Hazards \nWarning and Mitigation System, and also, when possible, as part of Multi-Hazard \nEarly Warning Systems;146 \n \n306. Takes note of the sixth Global Environment Outlook, entitled Healthy \nPlanet, Healthy People, approved on 24 January 2019, which, inter alia, identifies the \nprincipal drivers of change facing oceans and coasts and their impacts; \n \n307. Recognizes that ocean data buoys deployed and operated in accordance \nwith international law are critical for improving understanding of climate and \necosystems, forecasting weather, and saving lives by detecting tsunamis, reiterates its \nserious concern at intentional and unintentional damage to such buoys, and urges \nStates to take necessary action and to cooperate in relevant organizations, including \nthe World Meteorological Organization, the Intergovernmental Oceanographic \nCommission and the Food and Agriculture Organization of the United Nations, to \naddress damage to ocean data buoys deployed and operated in accordance with \ninternational law, including through education and outreach about the importance and \npurpose of these buoys and by strengthening these buoys against such damage and \nincreasing reporting of such damage; \n \n308. Recognizes the attention paid to the themes of ocean science and ocean \nobserving at the twentieth and twenty-second meetings, respectively, of the Informal \nConsultative Process in 2019 and 2022, and welcomes the steps taken by the \nIntergovernmental Oceanographic Commission to coordinate the implementation of \nthe United Nations Decade of Ocean Science for Sustainable Development, a core \nobjective of which is to improve the scientific knowledge base through capacity-\nbuilding for developing countries with limited capacity and capabilities, in particular \nsmall island developing States, least developed countries and landlocked developing \ncountries, on the basis of its implementation plan, in consultation with Member \nStates, specialized agencies, funds, programmes and bodies of the United Nations, as \n__________________ \n \n146 Ibid., decision A-32/3.4.1. \n\nOceans and the law of the sea \nA/RES/78/69\n \n49/57\n23-24917 \n \nwell as other intergovernmental organizations, non-governmental organizations and \nrelevant stakeholders; \n \n309. Takes note of resolutions EC-55/1 of the Executive Council and A-32/3 of \nthe Assembly of the Intergovernmental Oceanographic Commission, in which these \nbodies took note of the establishment of Decade coordinating mechanisms; 147 \n \n310. Also takes note of the development of the Ocean Decade Vision 2030 \nprocess aimed at enhancing the strategic delivery of the Decade under its 10 Decade \nChallenges;148  \n \n311. Requests that the Intergovernmental Oceanographic Commission continue \nto regularly consult with, and report to, Member States on the United Nations Decade \nof Ocean Science for Sustainable Development and its implementation; \n \n312. Invites the Secretary-General to continue to inform the General Assembly \non the implementation of the United Nations Decade of Ocean Science for Sustainable \nDevelopment through his report on oceans and the law of the sea, on the basis of \ninformation to be provided by the Intergovernmental Oceanographic Commission; \n \n313. Invites UN-Oceans and its participants to continue to collaborate with the \nIntergovernmental Oceanographic Commission on the United Nations Decade of \nOcean Science for Sustainable Development, and in this regard notes the participation \nof UN-Oceans members in the Decade Advisory Board, as well as the adoption by the \nAuthority of the action plan in support of the Decade;149 \n \nXII \nRegular Process for Global Reporting and Assessment of the State of the \nMarine Environment, including Socioeconomic Aspects \n \n \n314. Reiterates the need to strengthen the regular scientific assessment of the \nstate of the marine environment in order to enhance the scientific basis for \npolicymaking; \n \n315. Reaffirms the principles guiding the Regular Process and its objective and \nscope, recalls the crucial importance of the Regular Process and its possible inputs \nfor ongoing ocean-related intergovernmental processes, and notes the importance of \ncontinuing support and cooperation between the activities of the United Nations \nDecade of Ocean Science for Sustainable Development and those of the Regular \nProcess, and the development of a regulatory regime to organize and control all \nactivities of exploration for, and exploitation of, the resources of the seabed and ocean \nfloor and subsoil thereof beyond the limits of national jurisdiction by the International \nSeabed Authority; \n \n316. Also reaffirms the importance of ensuring that assessments, such as those \nincluded in the Global Sustainable Development Report and those prepared under the \nIntergovernmental Panel on Climate Change, the Intergovernmental Science-Policy \nPlatform on Biodiversity and Ecosystem Services and the Regular Process, support \none another and avoid unnecessary duplication, and recalls the importance of \ncompatibility and synergies between such assessments and assessments at the \nregional level; \n \n317. Further reaffirms that capacity-building is one of the core objectives of \nthe Regular Process, and recalls that, during the third cycle (2021\u20132025), a coherent \n__________________ \n \n147 See Intergovernmental Oceanographic Commission, document IOC/EC-55/Decisions, resolution \nEC-55/1, and document IOC/A-32/Decisions, resolution A-32/3. \n \n148 See Intergovernmental Oceanographic Commission, document IOC/A-32/Decisions, resolution \nA-32/3. \n \n149 See ISBA/26/A/17. \n\nA/RES/78/69 \nOceans and the law of the sea\n \n23-24917\n50/57 \n \nprogramme on capacity-building will be carried out with the aim to develop the \ncapacities of States in strengthening the ocean science-policy interface at the national, \nregional and global levels; \n \n318. Recalls that the Regular Process shall be overseen and guided by the \nAd Hoc Working Group of the Whole, and that the Ad Hoc Working Group shall \nfacilitate the delivery of the outputs of the third cycle of the Regular Process as \noutlined in the programme of work for the third cycle, and endorses the \nrecommendations adopted by the Ad Hoc Working Group at its nineteenth meeting on \nthe progress in the implementation of the programme of work for the third cycle; \n \n319. Recognizes the importance of raising awareness of the second World \nOcean Assessment and the Regular Process, and welcomes the enhancement of the \nsocial media campaign on the Assessment and the wider awareness-raising campaign \nof the Regular Process; \n \n320. Recognizes with appreciation the role of the Co-Chairs and the Bureau of \nthe Ad Hoc Working Group of the Whole in putting into practice the decisions and \nguidance of the Ad Hoc Working Group during the intersessional period, requests the \nBureau to continue to provide oversight of the delivery of the programme of work for \nthe third cycle of the Regular Process, and recognizes the support provided by the \nsecretariat in that regard; \n \n321. Welcomes the designation by States of national focal points, and invites \nStates that have not yet done so to designate national focal points to facilitate the \nimplementation of the programme of work for the third cycle of the Regular Process \nand beyond; \n \n322. Also \nwelcomes \nthe \ndesignation \nof \nfocal \npoints \nfor \nrelevant \nintergovernmental organizations, and invites the secretariats of relevant United \nNations specialized agencies, programmes, funds and bodies and the secretariats of \nrelated organizations and conventions that have not yet done so to designate focal \npoints to facilitate the implementation of the programme of work for the third cycle \nof the Regular Process and beyond; \n \n323. Invites the Intergovernmental Oceanographic Commission of the United \nNations Educational, Scientific and Cultural Organization, the United Nations \nEnvironment Programme, the International Maritime Organization, the Food and \nAgriculture Organization of the United Nations, the World Meteorological \nOrganization and relevant United Nations system organizations, bodies, funds and \nprogrammes, as appropriate, to assist in the implementation of the third cycle of the \nRegular Process; \n \n324. Invites relevant intergovernmental organizations to contribute, as \nappropriate, to the activities of the third cycle of the Regular Process; \n \n325. Welcomes the constitution of the Group of Experts for the third cycle of \nthe Regular Process, which currently consists of 21 members, and notes with \nappreciation the work being carried out by the members of the Group of Experts in \nthe implementation of the programme of work for the third cycle; \n \n326. Recalls that the Group of Experts for the third cycle of the Regular Process \nshall comprise a maximum of 25 experts, with no more than five experts per regional \ngroup, and encourages regional groups that have appointed fewer than five experts to \ncontinue to appoint experts to the Group of Experts, taking into account the need to \nensure adequate expertise, gender balance and geographical distribution; \n \n327. Endorses the documents developed by the Group of Experts to support the \ndevelopment of the third World Ocean Assessment adopted by the Ad Hoc Working \nGroup of the Whole at its eighteenth meeting; \n\nOceans and the law of the sea \nA/RES/78/69\n \n51/57\n23-24917 \n \n \n328. Encourages the appointment of experts to the Pool of Experts in \naccordance with the mechanism, and requests the Bureau of the Ad Hoc Working \nGroup of the Whole to provide oversight of the establishment of the Pool of Experts; \n \n329. Welcomes the regional workshops in support of the third cycle of the \nRegular Process, held in Santos, Brazil, in May 2023, in Kingston in June 2023, in \nMahe, Seychelles, in July\u2013August 2023, in Lisbon in September 2023 and in New \nYork in November 2023, and the capacity-building symposium to be held in Paris in \nDecember 2023, which are being held to support the development of the third World \nOcean Assessment and strengthen the ocean science-policy interface; \n \n330. Encourages efforts to ensure completion of the zero draft of the third \nWorld Ocean Assessment for review by Member States in 2024 as outlined in the \nprogramme of work for the third cycle of the Regular Process; \n \n331. Urges States, international financial institutions, donor agencies, \nintergovernmental organizations, non-governmental organizations and natural and \njuridical persons to make financial contributions to the voluntary trust fund, as well \nas the special scholarship fund, and to make other contributions to the Regular \nProcess; \n \n332. Requests the Secretary-General to convene, in 2024, up to two meetings \nof the Ad Hoc Working Group of the Whole of no more than two days of total duration \neach; \n \nXIII \nRegional cooperation \n \n \n333. Notes with appreciation efforts and initiatives at the regional level, in \nvarious regions, to further the implementation of the Convention and to respond, \nincluding through capacity-building, to issues related to maritime safety and security, \nthe conservation and sustainable use of living marine resources, the protection and \npreservation of the marine environment and the conservation and sustainable use of \nmarine biodiversity; \n \n334. Invites States and international organizations to enhance their cooperation \nto better protect the marine environment; \n \n335. Notes the Caribbean-focused Assistance Fund, which is intended to \nfacilitate, mainly through technical assistance, the voluntary undertaking of maritime \ndelimitation negotiations between Caribbean States, notes once again the Fund for \nPeace: Peaceful Settlement of Territorial Disputes, established by the General \nAssembly of the Organization of American States in 2000 as a primary mechanism, \ngiven its broader regional scope, for the prevention and resolution of pending \nterritorial, land border and maritime boundary disputes, and calls upon States and \nothers in a position to do so to contribute to these funds; \n \n336. Recalls the outcome document of the third International Conference on \nSmall Island Developing States, the SIDS Accelerated Modalities of Action (SAMOA) \nPathway150 and the modalities set forth for strengthened action on a range of small \nisland developing States challenges and priorities, including challenges related to the \nconservation and sustainable use of marine resources, and the preservation of the \nmarine environment, and in this regard welcomes the convening of the high-level \nmidterm review of the SAMOA Pathway in September 2019 and the adoption of its \npolitical declaration,151 which notes the importance of oceans, seas and marine \nresources to small island developing States and acknowledges their efforts to develop \n__________________ \n \n150 Resolution 69/15, annex. \n \n151 Resolution 74/3. \n\nA/RES/78/69 \nOceans and the law of the sea\n \n23-24917\n52/57 \n \nand implement strategies for the conservation and sustainable use of the ocean and its \nresources, and reaffirms its commitment to work with small island developing States \ntowards the full implementation of the SAMOA Pathway to ensure its success; \n \n337. Encourages States and scientific communities to continue to strengthen \ntheir cooperation on new knowledge about the linkages between changes in the global \nclimate system and the environment of polar regions; \n \n338. Acknowledges the important contributions to scientific understanding of \nthe marine environment and its resources, as well as the scientific advice for their \nsustainable use, provided by the International Council for the Exploration of the Sea \nin its wide-ranging cooperation with organizations at the regional level under the \nConvention for the International Council for the Exploration of the Sea, 1964, 152 and \nby the North Pacific Marine Science Organization under the Convention for a North \nPacific Marine Science Organization, 1992; \n \n339. Welcomes regional cooperation, and in this regard notes the Pacific \nOceanscape Framework as an initiative to enhance cooperation among coastal States \nin the Pacific island region to foster marine conservation and sustainable development; \n \n340. Recalls, in this regard, the endorsement of the Pacific Islands Forum \nleaders on 6 August 2021 at the fifty-first Pacific Islands Forum of a declaration on \npreserving maritime zones in the face of climate change-related sea level rise, and of \nthe Heads of State and Government of the Alliance of Small Island States on \n22 September 2021 of the Leaders\u2019 Declaration addressing, inter alia, the relationship \nbetween climate change-related sea level rise and Forum and Alliance members\u2019 \nmaritime zones in response to long-standing concerns in the face of climate change-\nrelated sea level rise; \n \n341. Notes the endorsement of the Pacific Islands Forum leaders on \n9 November 2023 at the fifty-second Pacific Islands Forum of a declaration on the \ncontinuity of statehood and the protection of persons in the face of climate change-\nrelated sea level rise addressing, inter alia, the relationship between climate change-\nrelated sea level rise and Forum members\u2019 statehood, sovereignty and protection of \npersons; \n \n342. Notes with appreciation the various cooperative efforts displayed by States \nat the regional and subregional levels, and in this regard welcomes initiatives such as \nthe Integrated Assessment and Management of the Gulf of Mexico Large Marine \nEcosystem; \n \n343. Acknowledges the cooperation among the members of the Zone of Peace \nand Cooperation of the South Atlantic and the principles enshrined under that \ninitiative, and notes the adoption of the Mindelo Declaration and the Mindelo Plan of \nAction during the eighth ministerial meeting of the Zone of Peace and Cooperation \nof the South Atlantic, held in Cabo Verde on 17 and 18 April 2023; \n \n344. Recalls the decision of the Assembly of the African Union in January 2015 \nto adopt Agenda 2063, also recalls that the African Union launched the Decade of \nAfrican Seas and Oceans (2015\u20132025), and notes that the African Day of the Seas and \nOceans is celebrated annually on 25 July; \n \n345. Also recalls the Vienna Programme of Action for Landlocked Developing \nCountries for the Decade 2014\u20132024 adopted by the second United Nations \nConference on Landlocked Developing Countries, held in Vienna from 3 to 5 November \n2014,153 following the comprehensive 10-year review of the implementation of the \n__________________ \n \n152 United Nations, Treaty Series, vol. 652, No. 9344. \n \n153 Resolution 69/137, annex II. \n\nOceans and the law of the sea \nA/RES/78/69\n \n53/57\n23-24917 \n \nAlmaty Programme of Action: Addressing the Special Needs of Landlocked \nDeveloping Countries within a New Global Framework for Transit Transport \nCooperation for Landlocked and Transit Developing Countries, 154 notes the need for \ncooperation to address the development needs and challenges faced by landlocked \ndeveloping countries associated with, inter alia, their lack of direct territorial access \nto the sea, remoteness and isolation from world markets, in line with the objectives \nof the Vienna Programme of Action, and recalls the adoption of the road map for the \naccelerated implementation of the Vienna Programme of Action in the remaining five \nyears; \n \n346. Notes the adoption of the Leaders\u2019 Declaration on the Solidarity of the \nArchipelagic and Island States Forum at the convening of the first High-Level \nMeeting of the Archipelagic and Island States Forum in Bali, Indonesia, on \n11 October 2023, that expresses the commitment of archipelagic and island nations \nto collaborate in addressing common maritime and ocean issues, among others, \nclimate change, sustainable ocean-based economy, and the marine environment, to \nachieve sustainability of the ocean for future generations; \n \n347. Also notes the efforts of the Sargasso Sea Commission, led by the \nGovernment of Bermuda, to raise awareness of the ecological significance of the \nSargasso Sea; \n \n348. Further notes the Agreement on Enhancing International Arctic Scientific \nCooperation, negotiated under the auspices of the Arctic Council, and notes that its \nimplementation will increase the development of scientific knowledge about the \nregion; \n \n349. Notes the cooperation between the OSPAR Commission established by the \nConvention for the Protection of the Marine Environment of the North-East \nAtlantic155 and the North-East Atlantic Fisheries Commission; \n \n350. Also notes the decision adopted by the Assembly of the Intergovernmental \nOceanographic Commission at its thirty-second session to establish the \nIntergovernmental Oceanographic Commission Subcommission for the Central \nIndian Ocean with the purpose of promoting international cooperation and \ncoordinating programmes in research, services, and capacity development; 156 \n \nXIV \nOpen-ended Informal Consultative Process on Oceans and the Law of the Sea \n \n \n351. Welcomes the report of the Co-Chairs on the work of the Informal \nConsultative Process at its twenty-third meeting, which focused on the theme of new \nmaritime technologies: challenges and opportunities; \n \n352. Notes the discussions at the twenty-third meeting of the Informal \nConsultative Process, from 5 to 9 June 2023, on the theme of new maritime \ntechnologies: challenges and opportunities, during which delegations and other \nparticipants, inter alia, highlighted the potential benefits of new maritime \ntechnologies in addressing threats facing the ocean, facilitating ocean observing, \nbuilding resilient oceans and coastal communities, mitigating the impacts of climate \nchange, efforts towards reducing the greenhouse gas emissions of the shipping sector, \n__________________ \n \n154 Report of the International Ministerial Conference of Landlocked and Transit Developing \nCountries and Donor Countries and International Financial and Development Institutions on \nTransit Transport Cooperation, Almaty, Kazakhstan, 28 and 29 August 2003 (A/CONF.202/3), \nannex I. \n \n155 United Nations, Treaty Series, vol. 2354, No. 42279. \n \n156 See Intergovernmental Oceanographic Commission, document IOC/A-32/Decisions, resolution \nA-32/1. \n\nA/RES/78/69 \nOceans and the law of the sea\n \n23-24917\n54/57 \n \ncountering pollution, developing renewable energy sources, improving data \ncollection to enhance marine science and achieve the goals of the United Nations \nDecade of Ocean Science for Sustainable Development, and for meeting the targets \nof the 2030 Agenda for Sustainable Development, in particular Sustainable \nDevelopment Goal 14, noted challenges arising with respect to the introduction and \nuse of such technologies, and recognized the vital role of national, regional and global \ncooperation in ensuring that all States can benefit from the sustainable development \nof the ocean, including the crucial importance of targeted capacity-building to enable \ndeveloping States to benefit from the opportunities presented by these new \ntechnologies; \n \n353. Recognizes the role of the Informal Consultative Process as a unique forum \nfor comprehensive discussions on issues related to oceans and the law of the sea, \nconsistent with the framework provided by the Convention and chapter 17 of \nAgenda 21, and in integrating knowledge, the exchange of opinions among multiple \nstakeholders and coordination among competent agencies, and enhancing awareness \nof topics, including emerging issues, while promoting the three pillars of sustainable \ndevelopment; \n \n354. Welcomes the work of the Informal Consultative Process and its \ncontribution to improving coordination and cooperation between States and \nstrengthening the annual debate of the General Assembly on oceans and the law of \nthe sea by effectively drawing attention to key issues and current trends, and also \nwelcomes efforts to improve and focus such work; \n \n355. Recalls the need to strengthen and improve the efficiency of the Informal \nConsultative Process, and encourages States, intergovernmental organizations and \nprogrammes to provide guidance to the Co-Chairs to this effect, particularly before \nand during the preparatory meeting for the Informal Consultative Process; \n \n356. Decides to continue the Informal Consultative Process for the next four \nyears, in accordance with resolution 54/33, with a further review of its effectiveness \nat its eighty-second session;  \n \n357. Requests the Secretary-General to convene, in accordance with paragraphs 2 \nand 3 of resolution 54/33, the twenty-fourth meeting of the Informal Consultative \nProcess, in New York for eight meetings during the week of 18 to 21 June 2024, and \nto convene the twenty-fifth, twenty-sixth and twenty-seventh meetings for eight \nmeetings each in 2025, 2026 and 2027, respectively, to provide it with the facilities \nnecessary for the performance of its work, including documentation, to also convene \ninformal preparatory meetings, and to arrange for support to be provided by the \nDivision, in cooperation with other relevant parts of the Secretariat, as appropriate;  \n \n358. Also requests the Secretary-General to provide support for the convening \nof a twenty-fifth meeting of the Informal Consultative Process for eight meetings in \n2025, in accordance with paragraphs 2 and 3 of resolution 54/33, with the facilities \nnecessary for the performance of its work, including documentation;  \n \n359. Expresses its continued serious concern regarding the lack of resources \navailable in the voluntary trust fund established pursuant to resolution 55/7 for the \npurpose of assisting developing countries, in particular least developed countries, \nsmall island developing States and landlocked developing States, in attending the \nmeetings of the Informal Consultative Process, and urges States, international financial \ninstitutions, donor agencies, intergovernmental organizations, non-governmental \norganizations and natural and juridical persons to make additional contributions to \nthe trust fund; \n \n360. Decides that those representatives from developing countries who are \ninvited by the Co-Chairs, in consultation with Governments, to make presentations \n\nOceans and the law of the sea \nA/RES/78/69\n \n55/57\n23-24917 \n \nduring the meetings of the Informal Consultative Process shall receive priority \nconsideration in the disbursement of funds from the voluntary trust fund established \npursuant to resolution 55/7 in order to cover their costs of travel and daily subsistence \nallowance; \n \n361. Also decides that, in its deliberations on the report of the Secretary-\nGeneral on oceans and the law of the sea, the Informal Consultative Process shall \nfocus its discussions at its twenty-fourth meeting, in 2024, on the theme \u201cThe ocean \nas a source of sustainable food\u201d, and at its twenty-sixth meeting, in 2026, on the theme \n\u201cMarine ecosystem restoration\u201d; \n \nXV \nCoordination and cooperation \n \n \n362. Encourages States to work closely with and through international \norganizations, funds and programmes, as well as the specialized agencies of the \nUnited Nations system and relevant international conventions, to identify emerging \nareas of focus for improved coordination and cooperation and how best to address \nthese issues; \n \n363. Expresses its concern at the desecration of graves at sea and the looting of \nwrecks of ships constituting such graves, and calls upon States to cooperate, as \nappropriate, to prevent the looting and desecration of wrecks of ships constituting \ngraves in order to ensure that proper respect is given to all human remains located in \nmaritime waters, consistent with international law, including, as appropriate, the 2001 \nConvention on the Protection of the Underwater Cultural Heritage, among parties \nthereto; \n \n364. Encourages bodies established by the Convention to strengthen \ncoordination and cooperation, as appropriate, in fulfilling their respective mandates; \n \n365. Requests the Secretary-General to bring the present resolution to the \nattention of heads of intergovernmental organizations, the specialized agencies, funds \nand programmes of the United Nations engaged in activities relating to ocean affairs \nand the law of the sea, as well as funding institutions, and underlines the importance \nof their constructive and timely input for the report of the Secretary-General on \noceans and the law of the sea and of their participation in relevant meetings and \nprocesses; \n \n366. Welcomes the work done by the secretariats of relevant United Nations \nspecialized agencies, programmes, funds and bodies and the secretariats of related \norganizations and conventions to enhance inter-agency coordination and cooperation \non ocean issues, including, where appropriate, through UN-Oceans, the inter-agency \ncoordination mechanism on ocean and coastal issues within the United Nations \nsystem; \n \n367. Recognizes the work undertaken by UN-Oceans, under the revised terms of \nreference for the work of UN-Oceans, and with the United Nations Legal Counsel/the \nDivision as the focal point of UN-Oceans, requests the focal point to maintain the \nUN- Oceans website, and in this regard urges States, international financial institutions, \ndonor agencies, intergovernmental organizations, non-governmental organizations and \nnatural and juridical persons to make financial earmarked contributions to the trust \nfund established by the Secretary-General for the Office of Legal Affairs to support \nthe promotion of international law, and authorizes the Secretary-General to disburse \nfunds from such contributions to that trust fund for the purposes of the maintenance \nof the UN-Oceans website, including an online searchable database for an inventory \nof the mandates of UN-Oceans members and priorities approved by the respective \ngoverning bodies of the participating organizations of UN-Oceans, with a view to \n\nA/RES/78/69 \nOceans and the law of the sea\n \n23-24917\n56/57 \n \nidentifying possible areas of collaboration and synergy, as well as for travel associated \nwith the performance of the functions of the focal point;  \n \nXVI \nActivities of the Division for Ocean Affairs and the Law of the Sea \n \n \n368. Expresses its appreciation to the Secretary-General for the annual reports \non oceans and the law of the sea, prepared by the Division, as well as for the other \nactivities of the Division, which reflect the high standard of assistance provided to \nMember States by the Division; \n \n369. Notes with satisfaction the fifteenth observance by the United Nations of \nWorld Oceans Day, in 2023,157 recognizes with appreciation the efforts deployed by \nthe Division in this regard, invites States, international financial institutions, donor \nagencies, intergovernmental organizations, non-governmental organizations and \nnatural and juridical persons to support the future observance of World Oceans Day, \nincluding by making voluntary financial or other contributions, and invites the \nDivision to continue to promote and facilitate international cooperation on the law of \nthe sea and ocean affairs in the context of the future observance of World Oceans Day, \nas well as through its participation in other events; \n \n370. Notes the continuously growing responsibilities and functions entrusted to \nthe Secretary-General in the Convention and in the related resolutions of the General \nAssembly, and in this context the unprecedented substantial increase in activities of \nthe Division, in particular in view of the growing number of requests to the Division \nfor additional outputs and servicing of meetings, the provision of technical assistance \nand capacity-building, and requests the Secretary-General to ensure the allocation of \nappropriate resources to the Division for the performance of its activities under the \napproved budget for the Organization; \n \n371. Requests the Secretary-General to continue the publication activities of the \nDivision, and in particular to publish a combined edition of the Convention, the Part XI \nAgreement, the Fish Stocks Agreement; and the Agreement under the United Nations \nConvention on the Law of the Sea on the Conservation and Sustainable Use of Marine \nBiological Diversity of Areas beyond National Jurisdiction 158 and publish the Law of \nthe Sea Bulletin;  \n \nXVII \nSeventy-ninth session of the General Assembly \n \n \n372. Requests the Secretary-General to prepare reports for consideration by the \nGeneral Assembly at its seventy-ninth session, namely a report on developments and \nissues relating to ocean affairs and the law of the sea, including the implementation \nof the present resolution, in accordance with resolutions 49/28 of 6 December 1994, \n52/26 of 26 November 1997 and 54/33, and a report on the theme that is the focus of \nthe twenty-fourth meeting of the Informal Consultative Process; \n \n373. Emphasizes the critical role of the annual reports of the Secretary-General, \nwhich integrate information on developments relating to the implementation of the \nConvention and the work of the Organization, its specialized agencies and other \ninstitutions in the field of ocean affairs and the law of the sea at the global and regional \nlevels, and as a result constitute the basis for the annual consideration and review of \ndevelopments relating to ocean affairs and the law of the sea by the General Assembly \nas the global institution having the competence to undertake such a review;  \n__________________ \n \n157 By its resolution 63/111, the General Assembly designated 8 June as World Oceans Day. \n \n158 This replaces the publication on marine geospatial information management. \n\nOceans and the law of the sea \nA/RES/78/69\n \n57/57\n23-24917 \n \n \n374. Notes that the reports referred to in paragraph 372 above will also be \nsubmitted to States Parties pursuant to article 319 of the Convention regarding issues \nof a general nature that have arisen with respect to the Convention; \n \n375. Also notes the desire to further improve the efficiency of and effective \nparticipation of delegations in the informal consultations concerning the annual \nGeneral Assembly resolution on oceans and the law of the sea, decides that the period \nof the informal consultations on that resolution should not exceed a maximum of nine \ndays in total and that the consultations should be scheduled in such a way that the \nDivision has sufficient time to produce the report on developments and issues relating \nto ocean affairs and the law of the sea referred to in paragraph 372 above, requests \nthe Secretary-General to continue to provide support to the consultations through the \nDivision, and encourages States to submit proposals for the resolution to the \nCoordinator of the informal consultations no later than one week before the first day \nof the first round of the informal consultations; \n \n376. Decides to include in the provisional agenda of its seventy-ninth session \nthe item entitled \u201cOceans and the law of the sea\u201d. \n \n44th plenary meeting \n5 December 2023 \n \n",
  "paragraphs": {
    "1": "Reaffirms the unified character of the Convention and the vital importance of preserving its integrity;",
    "2": "Calls upon all States that have not done so, in order to fully achieve the goal of universal participation, to become parties to the Convention and the Part XI Agreement;",
    "3": "Calls upon States that have not done so, in order to achieve the goal of universal participation, to become parties to the Agreement for the Implementation of the Provisions of the United Nations Convention on the Law of the Sea of 10 December 1982 relating to the Conservation and Management of Straddling Fish Stocks and Highly Migratory Fish Stocks (the Fish Stocks Agreement); 22",
    "4": "Calls upon States to harmonize their national legislation with the provisions of the Convention and, where applicable, relevant agreements and instruments, to ensure the consistent application of those provisions and to ensure also that any declarations or statements that they have made or make when signing, ratifying or acceding to the Convention do not purport to exclude or to modify the legal effect of the provisions of the Convention in their application to the State concerned and to withdraw any such declarations or statements;",
    "5": "Calls upon States Parties to the Convention that have not yet done so to deposit with the Secretary-General of the United Nations and, in the case of the outer limit lines of the continental shelf, also with the Secretary-General of the Authority, copies of charts or lists of geographical coordinates, as provided for in the Convention, preferably using the generally accepted and most recent geodetic datums;",
    "6": "Notes, in this regard, the ongoing efforts of the Secretary-General of the United Nations to improve the existing geographic information system for the deposit by States of charts and geographical coordinates concerning maritime zones, including lines of delimitation, submitted pursuant to the Convention, and to give due publicity thereto, and re-emphasizes the importance of the completion of these efforts through wide participation and reviews by Member States of the technical standards for the collection, storage and dissemination of the deposited information, developed by the International Hydrographic Organization, in cooperation with the Division for Ocean Affairs and the law of the Sea of the Office of Legal Affairs of the Secretariat (the Division), which are not legally binding, in order to ensure compatibility among geographic information systems, electronic nautical charts and other systems;",
    "7": "Recalls the note on the practice of the Secretary-General in respect of the deposit of charts and/or lists of geographical coordinates of points under the Convention23 and the Guidelines on deposit with the Secretary-General of charts and lists of geographical coordinates of points under the United Nations Convention on the Law of the Sea prepared by the Secretariat;24",
    "8": "Emphasizes that underwater archaeological, cultural and historical heritage needs to be protected and preserved, further emphasizes the duty of States under article 303, paragraph 1, of the Convention to protect objects of an archaeological and historical nature found at sea and to cooperate for this purpose, and urges all States, in accordance with the Convention, to cooperate, directly or through competent international bodies, in taking measures to protect and preserve such objects, and calls upon States to work together on such diverse challenges and opportunities as the appropriate relationship between salvage law and scientific management and conservation of underwater cultural heritage, increasing technological abilities to discover and reach underwater sites, looting, destruction, illicit trafficking, and growing underwater tourism;",
    "9": "Calls upon States that have not yet done so to consider becoming parties to the 2001 Convention on the Protection of the Underwater Cultural Heritage, 25 and notes in particular the rules annexed to that Convention, which address the relationship between salvage law and scientific principles of management, conservation and protection of underwater cultural heritage among Parties, their nationals and vessels flying their flag; II Capacity-building",
    "10": "Recognizes the importance of assisting developing States, in particular the least developed countries, landlocked developing countries and small island developing States, as well as coastal African States, in implementing the Convention, urges States, international financial institutions, donor agencies, intergovernmental organizations, non-governmental organizations and natural and juridical persons to make voluntary financial or other contributions to the trust funds, as referred to in resolutions 55/7 of 30 October 2000, 57/141, and 64/71 of 4 December 2009, established for this purpose, and expresses its appreciation to those that have contributed;26",
    "11": "Emphasizes that capacity-building is essential to ensure that States, especially developing countries, in particular the least developed countries, landlocked developing countries and small island developing States, as well as coastal African States, are able to fully implement the Convention, benefit from the sustainable development of the oceans and seas and participate fully in global and regional forums on ocean affairs and the law of the sea;",
    "12": "Also emphasizes the need to address the particular challenges faced by developing middle-income countries through capacity-building;",
    "13": "Calls for capacity-building initiatives to take into account the needs of developing countries, and calls upon States, international organizations and donor agencies to make efforts to ensure the sustainability of such initiatives;",
    "14": "Recalls, in this regard, that, in \u201cThe future we want\u201d, States recognized the importance of building the capacity of developing countries to be able to benefit from the conservation and sustainable use of the oceans and seas and their resources, and in this regard emphasized the need for cooperation in marine scientific research to implement the provisions of the Convention and the outcomes of the major summits on sustainable development, as well as for the transfer of technology on mutually agreed terms;",
    "15": "Recognizes that promoting the voluntary transfer of technology on mutually agreed terms and conducted on fair and reasonable terms and conditions is an essential aspect of building capacity in marine science where due regard should be given to the needs and priorities of developing States, further encourages States to use the Criteria and Guidelines on the Transfer of Marine Technology adopted by the Assembly of the Intergovernmental Oceanographic Commission of the United Nations Educational, Scientific and Cultural Organization at its twenty-second session, in 2003, and recalls the important role of the secretariat of that Commission in the implementation and promotion of the Criteria and Guidelines;",
    "16": "Emphasizes the need for international cooperation for capacity-building, including cross-sectoral cooperation, at national, regional and global levels, to address, in particular, gaps in capacity-building in ocean affairs and the law of the sea, including marine science and meteorological sciences;",
    "17": "Calls upon donor agencies and international financial institutions to keep their programmes systematically under review to ensure the availability in all States, particularly in developing States, of the economic, legal, navigational, scientific, technical and management skills necessary for the full implementation of the Convention and the objectives of the present resolution, as well as the sustainable development of the oceans and seas nationally, regionally and globally, and in so doing to bear in mind the interests and needs of landlocked developing States;",
    "18": "Encourages intensified efforts to build capacity for developing countries, in particular for the least developed countries and small island developing States, as well as coastal African States, to improve aids to navigation and search and rescue services, hydrographic services and the production of nautical charts, including electronic charts, as well as the mobilization of resources and building of capacity with support from international financial institutions and the donor community;",
    "19": "Calls upon States and international organizations, including through bilateral, regional and global cooperation programmes, technical partnerships and fellowships, to continue in a sustainable and comprehensive way to support, promote and strengthen capacity-building activities, in particular in developing countries, in the field of marine scientific research by, inter alia, training personnel to develop and enhance relevant expertise, providing the necessary equipment, facilities and vessels and transferring environmentally sound technologies and methodologies, taking into account the need to improve capacities in the field of taxonomy;",
    "20": "Calls upon States and international institutions, including through bilateral, regional and global cooperation programmes, technical partnerships and fellowships, to support and strengthen capacity-building activities in developing countries, in particular least developed countries and small island developing States, to develop their maritime administration and appropriate legal frameworks to establish or enhance the necessary infrastructure, legislative, enforcement and monitoring capabilities to promote effective compliance with and implementation and enforcement of their responsibilities under international law;",
    "21": "Also calls upon States and international institutions, including through bilateral, regional and global cooperation programmes, technical partnerships and fellowships, to support and strengthen capacity-building activities in developing countries, in particular least developed countries and small island developing States, in the area of mitigation of and adaptation to climate change impacts on the ocean, including protection of coasts against sea level rise and through ecosystem-based approaches and nature-based solutions;",
    "22": "Invites States, in particular those States with advanced technology and marine capabilities, to explore prospects for improving cooperation with and assistance to developing States, in particular least developed countries, landlocked developing countries and small island developing States, as well as coastal African States, with a view to better integrating into national policies and programmes sustainable and effective development in the marine sector;",
    "23": "Calls upon States and international institutions, including through bilateral, regional and global cooperation programmes, technical partnerships and fellowships, to develop and strengthen capacity-building activities in and to transfer to developing countries, in particular least developed countries and small island developing States, on mutually agreed terms, and taking into account the Criteria and Guidelines on the Transfer of Marine Technology, environmentally sound technologies and methodologies to study and minimize the impacts of ocean acidification, and notes in this regard the international scientific cooperation through the Ocean Acidification International Coordination Centre of the International Atomic Energy Agency and within the Global Ocean Acidification Observing Network;",
    "24": "Emphasizes the need to focus on strengthening South-South cooperation as an additional way to build capacity and as a cooperative mechanism to further enable countries to set their own priorities and needs and to foster actions to implement such cooperation;",
    "25": " course annually in Rhodes, Greece, and has graduated 1,088 students from more than 120 countries;",
    "26": "Also recognizes with appreciation the important contribution to capacity- building in the field of the law of the sea by the Summer Academy of the International Foundation for the Law of the Sea at the Tribunal;",
    "27": "Further recognizes with appreciation the important contribution of the Korea Maritime Institute to the trust fund to support the internship programmes at the Tribunal since 2011 and its continued efforts, in cooperation with the Ministry of Oceans and Fisheries of the Republic of Korea, to provide education and training for capacity-building of developing countries through the Yeosu Academy of the Law of the Sea programme;",
    "28": "Recognizes the holding of the regional courses on the continental shelf in Arusha, United Republic of Tanzania, jointly organized by the African Institute of International Law and the University of the Faroe Islands, and their continuing important contribution to capacity-building, particularly in developing countries;",
    "29": "Also recognizes the importance of the work of the Malta-based International Maritime Law Institute of the International Maritime Organization, as a centre of education and training of specialists in maritime law, including government legal advisers and other high-level officials, mainly from developing States, confirms its effective capacity-building role in the field of international maritime law, shipping law and marine environmental law, and urges States, intergovernmental organizations and financial institutions to make voluntary financial contributions to the budget of the Institute which runs annually;",
    "30": "Further recognizes the importance of the World Maritime University of the International Maritime Organization, as a centre of excellence for maritime education and research, confirms its effective capacity-building role in the field of maritime transportation, policy, administration, management, safety, security and environmental protection, as well as its role in the international exchange and transfer of knowledge, notes the role of the World Maritime University-Sasakawa Global Ocean Institute, and urges States, intergovernmental organizations and other bodies to make voluntary financial contributions to the University\u2019s Endowment Fund;",
    "31": "Welcomes the efforts of the Tribunal in holding regional workshops, including the latest workshop on the role of the Tribunal in the settlement of disputes relating to the law of the sea, held in France on 1 and 2 June 2023, in cooperation with the Institute for Peace and Development at C\u00f4te d\u2019Azur University and with the support of Cyprus, France and the Korea Maritime Institute;",
    "32": "Also welcomes the efforts of the Tribunal in holding capacity-building workshops, including the latest workshop, on the settlement of disputes under the Convention for the legal advisers from the African region, held at the Tribunal from 2 to 7 July 2023, sponsored by the Government of the Republic of Korea;",
    "33": "Further welcomes ongoing activities for capacity-building so as to address maritime security and protection of the marine environment of developing States, and encourages States and international financial institutions to provide additional funding for capacity-building programmes, including for transfer of technology, including through the International Maritime Organization and other competent international organizations;",
    "34": " criminal activities at sea, in line with the relevant international instruments, including the United Nations Convention against Transnational Organized Crime and the Protocols thereto;27",
    "35": "Also recognizes the need to build the capacity of developing States to raise awareness of and support the implementation of improved waste management practices, noting the particular vulnerability of small island developing States to the impact of marine pollution of all kinds, in particular from land-based activities and marine debris and nutrient pollution;28",
    "36": "Acknowledges the importance of capacity-building for developing States, in particular the least developed countries, landlocked developing countries and small island developing States, as well as coastal African States, for the protection of the marine environment and the conservation and sustainable use of marine resources;",
    "37": "Encourages States to consider additional opportunities for capacity- building at the regional level;",
    "38": "Takes note of the second edition of the Global Ocean Science Report of the Intergovernmental Oceanographic Commission, which assesses the status of and trends in ocean science capacity around the world;",
    "39": "Also takes note of the Capacity Development Strategy (2023\u20132030) of the Intergovernmental Oceanographic Commission, which recognizes capacity development as one of the six functions of the Intergovernmental Oceanographic Commission Medium-Term Strategy (2022\u20132029), enabling all Member States to participate in, and benefit from, ocean research and services that are vital to sustainable development and human welfare on the planet; 29",
    "40": "Calls upon States to continue to assist developing States, and especially the least developed countries and small island developing States, as well as coastal African States, at the bilateral and, where appropriate, multilateral levels, in the preparation of submissions to the Commission regarding the establishment of the outer limits of the continental shelf beyond 200 nautical miles, including the assessment of the nature and extent of the continental shelf of a coastal State, and recalls that coastal States can make requests to the Commission for scientific and technical advice in the preparation of data for their submissions, in accordance with article 3 of annex II to the Convention;",
    "41": "Recognizes the importance of the trust fund established pursuant to resolution 55/7, and referred to in annex II thereto,30 in providing developing States with all relevant forms of financial and technical assistance in complying with the requirements relating to their submissions to the Commission;",
    "42": "Calls upon the Division to continue to disseminate information on relevant procedures related to the trust fund established for the purpose of facilitating the preparation of submissions to the Commission and to continue its dialogue with potential beneficiaries with a view to providing financial support to developing countries for activities to facilitate their submissions in accordance with the requirements of article 76 of the Convention and with the rules of procedure 31 and the Scientific and Technical Guidelines of the Commission; 32",
    "43": "Requests the Secretary-General, in cooperation with States and relevant international organizations and institutions, to continue to support training and other activities to assist developing States in the preparation and presentation of their submissions to the Commission;",
    "44": "Recognizes with appreciation the contribution of the Division to capacity- building activities at the national and regional levels, in particular the work of the Division in promoting wider appreciation of the Convention and in assisting with its implementation, through the provision of information, advice and assistance to States and intergovernmental organizations, as well as the support of the Division for Member State implementation of the relevant parts of the 2030 Agenda for Sustainable Development, and the implementation by the Division of the programmes of assistance, funded by the Norwegian Agency for Development Cooperation, to meet the strategic capacity needs of developing States in the field of ocean governance and the law of the sea;",
    "45": "Notes with appreciation the joint delivery of regional online trainings for East Africa, West Africa, the Pacific and the Indian Ocean region on ocean affairs and the law of the sea, including the development of a self-paced e-learning platform by the Division and other partners under the PROBLUE Ocean Governance Capacity- Building Training Programme (World Bank);",
    "46": "Notes the partnership between the Division and the Intergovernmental Oceanographic Commission on a training programme on marine scientific research under the Convention, and encourages States, relevant international organizations and other donors to consider supporting the initiative;",
    "47": "Invites the Secretary-General, in cooperation with Member States, international financial institutions, donor agencies and intergovernmental organizations, to endeavour to expand the capacity-building activities of the Division in order to meet the increased need for assistance to developing States;",
    "48": "Invites States, international financial institutions, donor agencies, intergovernmental organizations, non-governmental organizations and natural and juridical persons to support the capacity-building activities of the Division, including by making earmarked voluntary contributions to the trust fund established by the Secretary-General for the Office of Legal Affairs to support the promotion of international law, and expresses its appreciation to those that have contributed;",
    "49": "Recognizes with appreciation the important contribution to the capacity- building of developing countries and the promotion of the law of the sea made by the Hamilton Shirley Amerasinghe Memorial Fellowship on the Law of the Sea, which was established by the General Assembly in 1981 in honour of the first President of the Third United Nations Conference on the Law of the Sea, expresses its appreciation to States that have made contributions to the voluntary trust fund for the Fellowship, notes that the financial state of the Fellowship remains a concern and that contributions are encouraged to ensure that at least one fellowship can be awarded annually, expresses its commitment to further promote the importance of the Fellowship, and urges States, international financial institutions, donor agencies, intergovernmental organizations, non-governmental organizations and natural and juridical persons to make voluntary financial contributions in support of the Fellowship;",
    "50": "Also recognizes with appreciation the important contribution of the United Nations-Nippon Foundation Fellowship Programme and the Strategic Needs Fellowship Programme to human resources development for Member States, particularly developing Member States, in the field of ocean affairs and the law of the sea and related disciplines, as well as the fostering of global interlinkages and continuing capacity development through the alumni programme;",
    "51": "Encourages competent international organizations, the United Nations Development Programme and international financial institutions and funds to consider expanding their programmes within their respective fields of competence for assistance to developing countries and to coordinate their efforts, and recognizes the funding available from the Global Environment Facility, as well as other funds allocated for projects relating to oceans; III Meeting of States Parties",
    "52": "Welcomes the reports of the thirty-third Meeting and the resumed thirty- third Meeting of States Parties to the Convention;",
    "53": "Requests the Secretary-General to continue to provide services to the thirty-third Meeting of States Parties to the Convention, including documentation, to convene the thirty-fourth Meeting of States Parties from 10 to 14 June 2024, with full conference services, including documentation, as required, and to convene the thirty- fifth Meeting of States Parties for five days in 2025, with full conference services, including documentation, as required; IV Peaceful settlement of disputes",
    "54": "Notes with satisfaction the continued and significant contribution of the Tribunal to the settlement of disputes by peaceful means in accordance with Part XV of the Convention, and underlines the important role and authority of the Tribunal concerning the interpretation or application of the Convention and the Part XI Agreement;",
    "55": "Pays tribute to the important and long-standing role of the International Court of Justice with regard to the peaceful settlement of disputes concerning the law of the sea;",
    "56": "Notes that States parties to an international agreement relating to the purposes of the Convention may submit to, inter alia, the Tribunal or the International Court of Justice any dispute concerning the interpretation or application of that agreement submitted in accordance with that agreement, and also notes the possibility, provided for in the Statutes of the Tribunal and the Court, to submit disputes to a chamber;",
    "57": "Encourages States Parties to the Convention that have not yet done so to consider making a written declaration, choosing from the means set out in article 287 of the Convention for the settlement of disputes concerning the interpretation or application of the Convention and the Part XI Agreement, bearing in mind the comprehensive character of the dispute settlement mechanism provided for in Part XV of the Convention;",
    "58": " boundaries,33 and calls upon States to consider all means to peacefully settle disputes in accordance with international law; V The Area",
    "59": "Reiterates the importance of the ongoing elaboration and standardization by the Authority, pursuant to article 145 of the Convention, of rules, regulations and procedures to ensure the effective protection of the marine environment, for, inter alia, the protection and conservation of the natural resources of the Area and for the prevention of damage to the flora and fauna of the marine environment from harmful effects that may arise from activities in the Area;",
    "60": "Welcomes the progress of the work of the Authority on draft regulations for exploitation of mineral resources in the Area, but also notes the impact of the coronavirus disease (COVID-19) on the meetings within its premises in 2020 and 2021, and in this regard encourages the Authority to continue its work on the draft regulations as a matter of priority and to provide sufficient opportunities and time for substantive consideration and discussion of the draft regulations as well as the relevant standards and guidelines, and emphasizes the ongoing need for openness and transparency and for the draft regulations to ensure that any exploitation activities would take place with the effective protection of the marine environment in accordance with the Convention;",
    "61": "Notes the adoption by the Council of decisions ISBA/28/C/9, ISBA/28/C/24 and ISBA/28/C/25 at its twenty-eighth session;",
    "62": "Also notes the decisions adopted to create the position of interim director general of the Enterprise34 and the supplementary budget for the period 2023\u20132024 to cover the costs associated with the establishment of the position; 35",
    "63": "Further notes the conclusion of an agreement of cooperation between the International Labour Organization and the Authority, approved by the Council at the second part of its twenty-eighth session;36",
    "64": "Notes the endorsement by the Assembly, at the twenty-eighth session of the Authority, of the memorandum of understanding between the Authority and the International Relations Institute of Cameroon concerning the establishment of a curriculum on the law of the sea and Part XI of the Convention, 37 and of a memorandum of understanding between the Authority and the National Institute of Oceanography and Fisheries of Egypt concerning the establishment of a joint regional training and research centre;38",
    "65": "Also notes that the Council and the Assembly accepted the amendments to the statute of the International Civil Service Commission adopted by the General Assembly at its seventy-seventh session in its resolution 77/256 A of 30 December 2022;39",
    "66": "Further notes the decisions adopted on the development of binding environmental threshold values and on the commissioning of a study on the internalization of environmental costs of exploitation activities in the Area; 40",
    "67": "Recalls the relevance of the advisory opinion on the responsibilities and obligations of States sponsoring persons and entities with respect to activities in the Area, issued by the Seabed Disputes Chamber of the Tribunal on 1 February 2011; 41",
    "68": "Recognizes the importance of the responsibilities entrusted to the Authority by articles 143 and 145 of the Convention, which refer to marine scientific research in the Area and protection of the marine environment, respectively;",
    "69": "Notes the decision of the Assembly to extend the current strategic plan of the Authority for the period 2019\u20132023 for two years, the request to the Secretary- General of the Authority to review and update the high-level action plan for the period 2019\u20132023 as necessary for the same period, and the decision to include the periodic review of the international regime of the Area pursuant to article 154 of the Convention as an agenda item for the twenty-ninth session of the Assembly, in 2024, with a view to adopting a decision;42",
    "70": "Also notes the Authority database (DeepData), which aims to serve as the principal repository of all data and information relating to activities in the Area;",
    "71": "Encourages the Authority to continue its work towards the standardization of marine bathymetric information collected in the Area, in cooperation with relevant international organizations, including the Intergovernmental Oceanographic Commission and the International Hydrographic Organization, particularly under the Seabed 2030 project;43",
    "72": "Notes the progress made in the development of environmental management plans for the Area, and encourages the Authority to continue advancing on the development of regional environmental management plans in priority areas in the Area, such as the northern Mid-Atlantic Ridge, the Indian Ocean and the North- West Pacific, as well as notes the efforts of the Authority to continue its work on a revised standardized framework, including the standardized procedure and template;44 VI Effective functioning of the Authority and the Tribunal",
    "73": "Commends the progress in the work of the Authority;",
    "74": "Also commends the work of the Tribunal since its establishment;",
    "75": "Appeals to all States Parties to the Convention to pay their assessed contributions to the Tribunal in full and on time, and also appeals to States Parties in arrears with their contributions to fulfil their obligations without delay;",
    "76": "Expresses serious concern about the number of States Parties to the Convention in arrears with their assessed contributions to the Authority, appeals to all States Parties to the Convention to pay their assessed contributions to the Authority in full and on time, and urges them to fulfil their obligations without delay, in particular those States whose exercise of voting rights has been suspended by virtue of article 184 of the Convention, and invites the Secretary-General of the Authority to continue his efforts to recover arrears, including bilateral efforts; 45",
    "77": "Notes that there remains room for improvement in the level of attendance at the Assembly, and urges all members of the Authority to participate in the meetings of the Assembly;",
    "78": "Expresses its appreciation to the donors that have made contributions to the voluntary trust funds of the Authority, and encourages Member States, observers, contractors and other stakeholders to contribute financially to these trust funds;46",
    "79": "Notes with serious concern the depleted balance of the voluntary trust fund established pursuant to the decision of the Authority at its eighth session 47 for the purpose of defraying the cost of participation of members of the Legal and Technical Commission from developing countries and members of the Finance Committee from developing countries in the meetings of the Commission and of the Committee, notes the appeals to members and other possible donors to make contributions to that fund, and to contractors to consider making a payment of 6,000 United States dollars on a voluntary basis, and expresses its appreciation to those that have made contributions to the voluntary trust fund;48",
    "80": "Expresses its appreciation to States that have made contributions to the endowment fund for marine scientific research in the Area established by the Authority at its twelfth session,49 for the purpose of promoting and encouraging the conduct of collaborative marine scientific research in the Area, and encourages States, observers, contractors and other stakeholders to make additional contributions to this fund;50",
    "81": "Emphasizes the importance of the rules and staff regulations of the Tribunal in promoting the recruitment of a geographically representative staff in the Professional and higher categories, and welcomes the actions taken by the Tribunal in observance of those rules and regulations;",
    "82": "Calls upon States that have not done so to consider ratifying or acceding to the Agreement on the Privileges and Immunities of the Tribunal 51 and to the Protocol on the Privileges and Immunities of the Authority;52 VII The continental shelf and the work of the Commission",
    "83": "Recalls that, in accordance with the Convention, coastal States shall submit information on the limits of the continental shelf beyond 200 nautical miles to the Commission, which shall make recommendations to coastal States on matters related to the establishment of the outer limits of their continental shelf, and that such limits established by the coastal State on the basis of these recommendations shall be final and binding;",
    "84": "Also recalls that, in accordance with article 77, paragraph 3, of the Convention, the rights of the coastal State over the continental shelf do not depend on occupation, effective or notional, or on any express proclamation;",
    "85": "Notes with satisfaction that a considerable number of States Parties to the Convention have submitted information to the Commission regarding the establishment of the outer limits of the continental shelf beyond 200 nautical miles, as well as preliminary information indicative of the outer limits of the continental shelf beyond 200 nautical miles and a description of the status of preparation and intended date of submission, and also notes with satisfaction that additional submissions referred to in preliminary information have been filed with the Commission;",
    "86": "Also notes with satisfaction the progress in the work of the Commission 53 and that it is giving current consideration to a number of submissions that have been made regarding the establishment of the outer limits of the continental shelf beyond 200 nautical miles;",
    "87": "Takes note of the 40 recommendations made by the Commission on the submissions of 32 coastal States, and welcomes the fact that summaries of recommendations are being made publicly available in accordance with paragraph 11.3 of annex III to the rules of procedure of the Commission;",
    "88": "Notes that the consideration by the Commission of submissions by coastal States in accordance with article 76 of and annex II to the Convention is without prejudice to the application of other parts of the Convention by States Parties;",
    "89": "Calls attention to the considerable number of submissions yet to be considered by the Commission and the demands that this places on its members and the secretariat as provided by the Division, and emphasizes the need to ensure that the Commission can perform its functions expeditiously, efficiently and effectively with its full membership and maintain its high level of quality and expertise;",
    "90": "Reiterates its invitation to the Commission to continue meeting for a total of 21 weeks per year by holding three sessions of seven weeks each, with no two sessions being sequential, for the remainder of its current five-year term of office, and further notes that more than nine subcommissions are actively considering submissions;",
    "91": "Requests the Secretary-General of the United Nations to continue to take appropriate measures, within overall existing resource levels, to further strengthen the capacity of the Division, serving as the secretariat of the Commission, in order to ensure enhanced support and assistance to the Commission and its subcommissions in their consideration of submissions, as required by paragraph 9 of annex III to the rules of procedure of the Commission, in particular its human resources, taking into account the need for simultaneous work on several submissions;",
    "92": "Urges the Secretary-General to continue to provide all necessary secretariat services to the Commission in accordance with article 2, paragraph 5, of annex II to the Convention;",
    "93": "Requests the Secretary-General to take appropriate and timely measures to ensure secretariat services for the Commission and its subcommissions for the extended duration of time requested in the decisions of the twenty-first and twenty- sixth Meetings of States Parties to the Convention;",
    "94": "Also requests the Secretary-General, consequently, to continue to allocate appropriate and sufficient resources to the Division to provide adequate services and assistance to the Commission in view of the number of its working weeks;",
    "95": "Notes that the Meeting of States Parties to the Convention, in its decisions regarding the conditions of service of the members of the Commission, 54 reaffirmed the obligation of States under the Convention whose experts were serving on the Commission to defray the expenses of the experts they had nominated while the experts are in performance of Commission duties, including the provision of medical coverage, and urged those States to do their utmost to ensure the full participation of those experts in the work of the Commission, including the meetings of subcommissions, in accordance with the Convention;",
    "96": "Also notes the request of the thirty-third Meeting of States Parties to the Convention that the consideration of the conditions of service of the members of the Commission continue within the open-ended working group established by the twenty-third Meeting of States Parties to the Convention, and emphasizes the urgency of finding appropriate solutions;55",
    "97": "Further notes the decision of the thirty-third Meeting of States Parties to the Convention to adopt a pattern of elections and of the commencement of the term of office of members of the Commission, according to which the Meeting will continue holding elections of members of the Commission one year before the expiration of the five-year term of office of the sitting members, in the light of the administrative and logistical benefits;56",
    "98": "Emphasizes the importance of the voluntary trust funds established pursuant to resolution 55/7, for the purpose of facilitating the preparation of submissions to the Commission and providing assistance to developing States to meet the travel and daily subsistence allowance costs associated with meeting with the Commission, and for the purpose of facilitating the participation of members of the Commission from developing States in the meetings of the Commission, and expresses its appreciation for the contributions made to these trust funds;",
    "99": "Reiterates its serious concern regarding the persistent underfunding of the trust fund established pursuant to resolution 55/7 for the purpose of facilitating the participation of members of the Commission from developing States in the meetings of the Commission, and urges States, including those that have already received recommendations from the Commission, in addition to international financial institutions, donor agencies, intergovernmental organizations, non-governmental organizations and natural and juridical persons, to make additional contributions to this fund;",
    "100": "Authorizes the use, as appropriate, of the trust fund referred to in paragraph 99 above, and in accordance with the purpose of its terms of reference, to defray the cost of the participation of the Chair of the Commission, when nominated by a developing country, in the Meetings of States Parties to the Convention;",
    "101": "Takes note of the written information, provided by the Secretary-General in response to the request in paragraph 81 of resolution 69/245 of 29 December 2014, on options for mechanisms to provide medical insurance coverage to members of the Commission, including costs, and the information provided by the Secretariat during the twenty-seventh, twenty-eighth, twenty-ninth and thirty-first Meetings of States Parties to the Convention;",
    "102": "Recalls its decision that, on an exceptional basis and without setting a precedent for other agenda items, the members of the Commission have the option to join the Headquarters medical insurance scheme upon payment of the full cost of the premium, and hereby authorizes the use of the trust fund referred to in paragraph 99 above by the Secretary-General to reimburse the full costs of the premium paid by the members of the Commission from developing States, subject to the availability of funds following the allocation of the required funds to cover the costs of travel and daily subsistence allowance of the members of the Commission from developing States for the sessions of the Commission during the annual insurance coverage period (1 July\u201330 June);",
    "103": "Authorizes the Secretary-General, in case the full costs of the Headquarters medical insurance scheme have not been reimbursed, as an interim measure and subject to the availability of funds following the allocation of the required funds to cover the costs of travel and daily subsistence allowance of the members of the Commission from developing States for the sessions of the Commission in 2024, to reimburse those members for the costs of medical travel insurance and short-term medical insurance from that trust fund on a session-by-session basis and subject to a reasonable limit that the Secretary-General shall determine, based on the information regarding medical travel insurance available;",
    "104": "Expresses its intention to continue to consider options for mechanisms to provide medical insurance coverage to members of the Commission and, if necessary, to further review the terms of reference for the trust fund referred to in paragraph 99 above;",
    "105": "Emphasizes the continued need for members of the Commission to have suitable working space for their work at the sessions of the Commission and its subcommissions, recognizes, with regard to the long-term accommodation discussions, that, owing to its exceptional character, the Commission has special requirements for its working space, including the need for fit-for-purpose working space, adequate technical equipment and climate control, and needs to remain located within the same premises as the Division, and emphasizes that, in the context of any relocation of the Division or any change in its working space, full regard will be paid to these special requirements of the Commission;",
    "106": "Takes note of the requests by the Commission for upgrades to the existing technical facilities of the Division, as contained in the annex to the letter dated 11 April 2023 from the Chair of the Commission addressed to the President of the thirty-third Meeting of States Parties,57 and requests the Secretary-General to provide the requested upgrades with a view to facilitating the work of the Commission;",
    "107": "Approves the convening by the Secretary-General of the sixtieth, sixty- first and sixty-second sessions of the Commission, in New York, from 22 January to 8 March 2024, from 8 July to 23 August 2024 and from 7 October to 22 November 2024, respectively, with full conference services, including documentation, for the plenary parts of these sessions,58 also approves the convening by the Secretary- General of the sixty-third, sixty-fourth and sixty-fifth sessions of the Commission in 2025, in New York, with full conference services, including documentation, for the plenary parts of these sessions, as well as any resumed sessions as may be required by the Commission, and requests the Secretary-General to make every effort to meet these requirements within overall existing resources;",
    "108": "Expresses its firm conviction about the importance of the work of the Commission, carried out in accordance with the Convention as well as in accordance with its rules of procedure, including with respect to the participation of coastal States in relevant proceedings concerning their submissions, and recognizes the continued need for active interaction between coastal States and the Commission;",
    "109": "Expresses its appreciation to States that have exchanged views in order to increase understanding of issues, including expenditures involved, arising from the application of article 76 of the Convention, thus facilitating the preparation of submissions by States, in particular developing States, to the Commission, and encourages States to continue to exchange views;",
    "110": "Requests the Secretary-General, in cooperation with Member States, to continue to support workshops or symposiums on scientific and technical aspects of the establishment of the outer limits of the continental shelf beyond 200 nautical miles, taking into account the need to strengthen capacity-building for developing countries in preparing their submissions; VIII Maritime safety and security and flag State implementation",
    "111": "Encourages States to ratify or accede to international agreements addressing the safety and security of navigation, as well as maritime labour, and to adopt the necessary measures consistent with the Convention and other relevant international instruments aimed at implementing and enforcing the rules contained in those agreements, and emphasizes the need for capacity-building for and assistance to developing States;",
    "112": "Recognizes that the legal regimes governing maritime safety and maritime security may have common and mutually reinforcing objectives that may be interrelated and could benefit from synergies, and encourages States to take this into account in their implementation;",
    "113": "Emphasizes the need for further efforts to promote a culture of safety and security in the shipping industry and to address the shortage of adequately trained personnel, and urges the development and strengthening of capacity-building activities and the provision of knowledge and skills through the required education and training, promoted in particular by the International Maritime Organization in collaboration with other relevant international organizations and agencies, as appropriate;",
    "114": "Also emphasizes that safety and security measures should be implemented in support of and with minimal negative effects on seafarers and fishers, especially in relation to their working conditions, and welcomes the ongoing cooperation between the Food and Agriculture Organization of the United Nations and the International Labour Organization in relation to decent work and employment in fisheries and aquaculture and on child labour in fisheries and aquaculture, as well as the work that has been conducted by the United Nations Office on Drugs and Crime on the issue of trafficking in persons on fishing vessels and the International Labour Organization on the issue of forced labour on fishing vessels;",
    "115": "Reiterates the importance of the fair treatment of crew members and its influence on maritime safety, and welcomes the consideration by the International Maritime Organization of the fair treatment of seafarers, recalls the adoption by the Organization on 4 December 2013 of resolution A.1090(28) on the fair treatment of crew members in respect of shore leave and access to shore-side facilities, and welcomes the provision on shore leave, which entered into force on 1 January 2018, in the Convention on Facilitation of International Maritime Traffic, 59 and the adoption by the International Maritime Organization on 31 March 2023 of Guidelines on how to deal with seafarer abandonment cases;60",
    "116": "Notes the adoption by the Assembly of the International Maritime Organization on 9 December 2021 of resolution A.1170(32), proclaiming an International Day for Women in Maritime, to be observed on 18 May every year;",
    "117": "Invites States that have not yet done so to become parties to the International Convention on Standards of Training, Certification and Watchkeeping for Seafarers, 1978,61 as amended, and the International Convention on Standards of Training, Certification and Watchkeeping for Fishing Vessel Personnel, 1995;",
    "118": "Encourages States that have not yet done so to consider becoming parties to the Work in Fishing Convention, 2007 (No. 188), the Seafarers\u2019 Identity Documents Convention (Revised), 2003 (No. 185)62 and the Protocol to the Forced Labour Convention, 1930 (No. 29) of the International Labour Organization, as well as to the Maritime Labour Convention, 2006,63 as amended, calls upon States to effectively implement their obligations under those instruments, and emphasizes the need to provide to States, at their request, technical cooperation and assistance in this regard;",
    "119": "Invites States to ratify or accede to the Cape Town Agreement of 2012 on the Implementation of the Provisions of the Torremolinos Protocol of 1993 relating to the Torremolinos International Convention for the Safety of Fishing Vessels, 1977;",
    "120": "Welcomes ongoing cooperation between the Food and Agriculture Organization of the United Nations, the International Maritime Organization and the International Labour Organization relating to the safety of fishers and fishing vessels, and underlines the urgent need for continued work in that area, and notes the revised terms of reference for the Food and Agriculture Organization of the United Nations, International Maritime Organization and International Labour Organization Joint Ad Hoc Working Group on Illegal, Unreported and Unregulated Fishing and Related Matters;64",
    "121": "Notes the adoption by the Assembly of the International Maritime Organization on 15 December 2021 of resolution A.1160(32) on comprehensive action to address seafarers\u2019 challenges during the COVID-19 pandemic and the adoption of recommendations, by the Joint Action Group to review the impact of the COVID-19 pandemic on the world\u2019s transport workers and the global supply chain, to provide more effective means of action to the ongoing issues affecting the transportation sector during the COVID-19 pandemic and in similar future public health emergencies of international concern;65",
    "122": "Also notes that the ad hoc United Nations inter-agency task force, convened pursuant to a resolution of the Special Tripartite Committee of the Maritime Labour Convention, 2006, as amended, concerning the implementation and practical application of that Convention during the COVID-19 pandemic,66 to examine the implementation and practical application of that Convention during the pandemic, including its impact on seafarers\u2019 fundamental rights and on the shipping industry 67 has continued to meet;",
    "123": "Recalls that, in its resolution A.1117(30) of 6 December 2017, the Assembly of the International Maritime Organization revised the International Maritime Organization Ship Identification Number Scheme to expand its voluntary application to a wider scope of vessels with a view to enhancing maritime safety and pollution prevention and to facilitate the prevention of maritime fraud;",
    "124": "Also recalls that all actions taken to combat threats to maritime security must be in accordance with international law, including the principles embodied in the Charter of the United Nations and the Convention;",
    "125": "Recognizes the crucial role of international cooperation at the global, regional, subregional and bilateral levels in combating, in accordance with international law, threats to maritime security, including piracy, armed robbery against ships at sea and terrorist acts against shipping, offshore installations, submarine cables and pipelines and other critical infrastructure and maritime interests, through bilateral and multilateral instruments and mechanisms aimed at monitoring, preventing and responding to such threats, the enhanced sharing of information among States relevant to the detection, prevention and suppression of such threats, and the prosecution of offenders with due regard to national legislation, and the need for sustained capacity-building to support such objectives, and in this regard welcomes activities related to maritime security under the thirtieth Association of Southeast Asian Nations (ASEAN) Regional Forum, held on 14 July 2023;",
    "126": "Encourages African Member States of the United Nations that have not yet done so to consider ratifying the Charter on Maritime Security and Safety and Development in Africa (Lom\u00e9 Charter) to facilitate its entry into force;",
    "127": "Acknowledges the work of the Commission on Crime Prevention and Criminal Justice in promoting international cooperation and strengthening capacity to combat the problem of transnational organized crime committed at sea;",
    "128": "Notes with concern that piracy and armed robbery at sea affect a wide range of vessels engaged in maritime activities, and expresses grave concern at the threats posed by piracy and armed robbery at sea to the safety and welfare of seafarers and other persons;",
    "129": "Emphasizes the importance of promptly reporting incidents to enable accurate information on the scope of the problem of piracy and armed robbery against ships at sea and, in the case of armed robbery against ships at sea, by affected vessels to the coastal State, underlines the importance of effective information-sharing with States potentially affected by incidents of piracy and armed robbery against ships at sea, notes with appreciation the important role of the International Maritime Organization and the important contribution of the Information Sharing Centre of the Regional Cooperation Agreement on Combating Piracy and Armed Robbery against Ships in Asia, based in Singapore, which aspires to be recognized as a centre of excellence within its purpose and mandate, and notes the Maritime Domain Awareness for Trade \u2013 Gulf of Guinea mechanism, the United Kingdom Maritime Trade Operations covering the high-risk area, the Regional Maritime Information Fusion Centre, based in Madagascar, and the Regional Maritime Centre for Operational Coordination in Seychelles;",
    "130": " providing enforcement vessels and equipment and guarding against fraudulent ship registration;",
    "131": "Encourages States to ensure effective implementation of international law applicable to combating piracy, as reflected in the Convention, calls upon States to take appropriate steps under their national law to facilitate, in accordance with international law, the apprehension and prosecution of those who are alleged to have committed acts of piracy, including the financing or facilitation of such acts, also taking into account other relevant instruments that are consistent with the Convention, and encourages States to cooperate, as appropriate, with a view to developing their national legislation in this regard;",
    "132": "Invites all States, the International Maritime Organization, the International Labour Organization and other relevant international organizations and agencies to adopt or recommend, as appropriate, measures to protect the interest and welfare of seafarers, fishers and passengers who are victims of pirates, after their release from captivity, including their post-incident care and reintegration into society;",
    "133": "Notes the compilation of national legislation on piracy on the website of the Division, and encourages the United Nations Office on Drugs and Crime and the Division to continue to cooperate with the International Maritime Organization with a view to assisting Member States, upon request, in developing their national laws on piracy;",
    "134": "Recognizes continued national, bilateral and trilateral initiatives, as well as regional cooperative mechanisms, in accordance with international law, to address piracy, including the financing or facilitation of acts of piracy, and armed robbery at sea, and calls upon States to give immediate attention to adopting, concluding and implementing cooperation agreements at the regional level on combating piracy and armed robbery against ships;",
    "135": "Expresses serious concern at the inhuman conditions hostages taken at sea face in captivity and also the adverse impact on their families, calls for the immediate release of all hostages taken at sea, and stresses the importance of cooperation among Member States on the issue of hostage-taking at sea;",
    "136": "Welcomes the continued reduction in the number of incidents of piracy and armed robbery against ships as well as hijackings off the coast of Somalia since 2011 68 resulting from efforts at the global and regional levels;",
    "137": "Notes the continued efforts within the Contact Group on Illicit Maritime Activities in the Western Indian Ocean following the adoption of Security Council resolution 1851 (2008) of 16 December 2008, including at its twenty-fifth plenary session, chaired by Kenya, in May 2023, and commends the contributions of all States in the efforts to fight piracy off the coast of Somalia;",
    "138": "Recognizes the primary responsibility of the Federal Government of Somalia in combating piracy and armed robbery at sea off the coast of Somalia, acknowledges the importance of a comprehensive and sustainable settlement of the situation in Somalia, and emphasizes the need to address the underlying causes of piracy and to assist Somalia and States in the region, at their request, in strengthening institutional capacity to fight piracy and tackle its underlying causes, including the financing or facilitation of acts of piracy, and armed robbery against ships off the coast of Somalia and to bring to justice those involved in such acts;",
    "139": "Notes the International Maritime Organization guidelines, interim guidance and interim recommendations to shipowners, ship operators and shipmasters, private maritime security companies, as well as flag States and port and coastal States on measures to prevent and mitigate Somalia-based piracy;",
    "140": "Notes with concern that the continuing limited capacity and domestic legislation to facilitate the custody and prosecution of suspected pirates after their capture has hindered more robust international action against pirates off the coast of Somalia;",
    "141": "Encourages States to ensure that ships flying their flag apply ship security measures approved in accordance with national and international law;",
    "142": "Notes the efforts made by the shipping industry to cooperate with the efforts by States regarding piracy off the coast of Somalia, in particular in assisting ships that navigate in that area, and also notes the holding of a high-level meeting on the implementation of the Code of Conduct concerning the Repression of Piracy and Armed Robbery against Ships in the Western Indian Ocean and the Gulf of Aden (Djibouti Code of Conduct)/Jeddah Amendment, in Jeddah, Saudi Arabia, from 22 to 24 November 2022;69",
    "143": "Remains concerned about piracy and armed robbery at sea in the Gulf of Guinea, with crew members kidnapped, but welcomes the decline in incidents of piracy and armed robbery at sea in that region,70 notes the adoption by the Security Council of resolutions 2018 (2011) of 31 October 2011, 2039 (2012) of 29 February 2012 and 2634 (2022) of 31 May 2022 and the statement by the President of the Council of 25 April 2016,71 supports the efforts to address this problem at the global and regional levels, including the adoption of resolution MSC.489(103) on recommended action to address piracy and armed robbery in the Gulf of Guinea, by the Maritime Safety Committee of the International Maritime Organization at its 103rd session,72 recalls the primary role of States in the region to counter the threat and address the underlying causes of piracy and armed robbery at sea in the Gulf of Guinea, welcomes the adoption in Yaound\u00e9 on 25 June 2013 of the Code of Conduct concerning the Repression of Piracy, Armed Robbery against Ships and Illicit Maritime Activity in West and Central Africa, and calls upon States in the region to continue to strengthen implementation of the Code of Conduct as soon as possible and consistent with international law, in particular the Convention;",
    "144": "Urges States to ensure the full implementation of resolution A.1159(32) of 15 December 2021 of the Assembly of the International Maritime Organization on prevention and suppression of piracy, armed robbery against ships and illicit maritime activity in the Gulf of Guinea;",
    "145": "Calls upon States that have not yet done so to become parties to the Convention for the Suppression of Unlawful Acts against the Safety of Maritime Navigation73 and the Protocol for the Suppression of Unlawful Acts against the Safety of Fixed Platforms Located on the Continental Shelf, 74 invites States that have not yet done so to consider becoming parties to the 2005 Protocol to the Convention for the Suppression of Unlawful Acts against the Safety of Maritime Navigation 75 and the 2005 Protocol to the 1988 Protocol for the Suppression of Unlawful Acts against the Safety of Fixed Platforms Located on the Continental Shelf, 76 and urges States parties to take appropriate measures to ensure the effective implementation of those instruments through the adoption of legislation, where appropriate;",
    "146": "Calls upon States to effectively implement the International Ship and Port Facility Security Code and the amendments to the International Convention for the Safety of Life at Sea,77 and to work with the International Maritime Organization to promote safe and secure shipping while ensuring freedom of navigation;",
    "147": "Urges all States, in cooperation with the International Maritime Organization and other relevant international organizations and agencies, to improve the protection of offshore installations, submarine cables and pipelines and other critical infrastructure by adopting measures related to the prevention, reporting and investigation of acts of violence against such infrastructure, in accordance with international law, and by implementing such measures through national legislation to ensure proper and adequate enforcement;",
    "148": "Emphasizes the progress in regional cooperation, including the efforts of littoral States, on the enhancement of safety, security and environmental protection in the Straits of Malacca and Singapore, and the effective functioning of the Cooperative Mechanism on Safety of Navigation and Environmental Protection in the Straits of Malacca and Singapore (the Cooperative Mechanism) to promote dialogue and facilitate close cooperation between the littoral States, user States, shipping industries and other stakeholders in line with article 43 of the Convention, notes with appreciation the convening of the fourteenth Cooperation Forum in Singapore on 31 July and 1 August 2023, the fourteenth Project Coordination Committee Meeting in Singapore on 4 August 2023, the forty-sixth Tripartite Technical Experts Group Meeting in Singapore on 2 and 3 August 2023 and the twenty-eighth Aids to Navigation Fund Committee Meeting in Indonesia on 14 and 15 June 2023, also notes with appreciation the important role of the Information Sharing Centre of the Regional Cooperation Agreement on Combating Piracy and Armed Robbery against Ships in Asia, based in Singapore, and calls upon States to give immediate attention to adopting, concluding and implementing cooperation agreements at the regional level;",
    "149": "Recognizes that some transnational organized criminal activities threaten legitimate uses of the oceans and endanger the lives of people at sea, as well as the livelihoods and security of coastal communities;",
    "150": "Notes that transnational organized criminal activities are diverse and may be interrelated in some cases and that criminal organizations are adaptive and take advantage of the vulnerabilities of States, in particular coastal and small island developing States in transit areas, and calls upon States and relevant intergovernmental organizations to increase cooperation and coordination at all levels to detect and suppress the smuggling of migrants, trafficking in persons and illicit trafficking in firearms, in accordance with international law;",
    "151": "Recognizes the importance of enhancing international cooperation at all levels to fight transnational organized criminal activities, including illicit traffic in narcotic drugs and psychotropic substances, within the scope of the United Nations instruments against illicit drug trafficking, as well as the smuggling of migrants, trafficking in persons and illicit trafficking in firearms and criminal activities at sea falling within the scope of the United Nations Convention against Transnational Organized Crime and the Protocols thereto;",
    "152": "Encourages States to cooperate at the bilateral, regional and global levels to prevent, combat and eradicate illicit trafficking in protected species of wild fauna and flora, which contributes to biodiversity loss and damage to ecosystems and livelihoods, where such trafficking occurs via maritime routes, through, inter alia, the use of applicable international legal instruments as appropriate, such as the United Nations Convention against Transnational Organized Crime, 78 the United Nations Convention against Corruption79 and the Convention on International Trade in Endangered Species of Wild Fauna and Flora,80 and reiterates its call upon Member States expressed in its resolution 71/326 of 11 September 2017 to make illicit trafficking in protected species of wild fauna and flora a serious crime, in accordance with their national legislation and as defined in article 2 (b) and article 3, paragraph 1 (b), of the United Nations Convention against Transnational Organized Crime, in order to ensure that, where the offence is transnational in nature and involves an organized criminal group, effective international cooperation can be afforded under the United Nations Convention against Transnational Organized Crime to prevent and combat transnational organized crime, and encourages States to implement the International Maritime Organization guidelines for the prevention and suppression of the smuggling of wildlife on ships engaged in international maritime traffic;",
    "153": "Notes with grave concern the recent proliferation of, and endangerment of lives through, the smuggling of migrants by sea, underscores the necessity to address such situations in accordance with applicable international law, and encourages States, acting nationally or through relevant global or regional organizations, as appropriate, to provide technical assistance and capacity-building to flag, port and coastal States, upon request, to enhance their capabilities to prevent smuggling of migrants and trafficking in persons by sea;",
    "154": "Calls upon States, in that context, to take measures in accordance with relevant international obligations to prevent and combat all forms of trafficking in persons, to identify victims of human trafficking, including among migrant flows, and to provide trafficking victims with appropriate protection and assistance, according to their national law and policy;",
    "155": "Calls upon States that have not yet done so to consider becoming parties to the Protocol against the Smuggling of Migrants by Land, Sea and Air, supplementing the United Nations Convention against Transnational Organized Crime,81 the Protocol against the Illicit Manufacturing of and Trafficking in Firearms, Their Parts and Components and Ammunition, supplementing the United Nations Convention against Transnational Organized Crime,82 and the Protocol to Prevent, Suppress and Punish Trafficking in Persons, Especially Women and Children, supplementing the United Nations Convention against Transnational Organized Crime,83 and to take appropriate measures to ensure their effective implementation;",
    "156": "Calls upon States to ensure freedom of navigation, the safety of navigation and the rights of transit passage, archipelagic sea lanes passage and innocent passage in accordance with international law, in particular the Convention;",
    "157": "Welcomes the work of the International Maritime Organization relating to the protection of shipping lanes of strategic importance and significance, and in particular in enhancing safety, security and environmental protection in straits used for international navigation, and calls upon that Organization, States bordering straits and user States to continue their cooperation to keep such straits safe, secure and environmentally protected and open to international navigation at all times, consistent with international law, in particular the Convention;",
    "158": "Calls upon user States and States bordering straits used for international navigation to continue to cooperate by agreement on matters relating to navigational safety, including safety aids for navigation, and the prevention, reduction and control of pollution from ships, and welcomes developments in this regard;",
    "159": "Calls upon States that have accepted the amendments to regulation XI-1/6 of the International Convention for the Safety of Life at Sea, 1974, 84 to implement the Code of International Standards and Recommended Practices for a Safety Investigation into a Marine Casualty or Marine Incident, 85 which took effect on 1 January 2010, and, in particular, to comply with the mandatory conduct of a marine safety investigation into very serious marine casualties and submission of a marine safety investigation report to the International Maritime Organization to identify trends and develop knowledge and risk-based recommendations;",
    "160": "Recognizes the important work of the International Hydrographic Organization and regional hydrographic commissions, calls upon States that have not yet done so to consider becoming members of that Organization, urges all its members to actively facilitate and consider in a timely manner, in accordance with applicable rules and procedures, applications of States that wish to become members of that Organization and regional hydrographic commissions, and further urges all States to work with that Organization, to increase the coverage of hydrographic information on a global basis to enhance capacity-building and technical assistance and to promote safe navigation, particularly through the production and use of accurate electronic navigational charts, especially in areas used for international navigation, in ports and where there are vulnerable or protected marine areas;",
    "161": "Also recognizes the importance of navigational and meteorological warning services based on marine meteorological data for the safety of ships and lives at sea and the optimization of navigation routes, and notes the collaboration between the World Meteorological Organization, the International Hydrographic Organization and the International Maritime Organization for the enhancement of these services and their extension to the Arctic region;",
    "162": "Encourages States to continue their efforts in the implementation of all areas of the Action Plan for the Safety of Transport of Radioactive Material, approved by the Board of Governors of the International Atomic Energy Agency in March 2004;",
    "163": "Also encourages States to ensure effective implementation of the International Maritime Dangerous Goods Code, the International Maritime Solid Bulk Cargoes Code, the International Code for the Construction and Equipment of Ships carrying Liquefied Gases in Bulk and the International Code for the Construction and Equipment of Ships carrying Dangerous Chemicals in Bulk;",
    "164": "Notes that cessation of the transport of radioactive materials through the regions of small island developing States is an ultimate desired goal of small island developing States and some other countries, and recognizes the right of freedom of navigation in accordance with international law; that States should maintain dialogue and consultation, in particular under the auspices of the International Atomic Energy Agency and the International Maritime Organization, with the aim of improved mutual understanding, confidence-building and enhanced communication in relation to the safe maritime transport of radioactive materials; that States involved in the transport of such materials are urged to continue to engage in dialogue with small island developing States and other States to address their concerns; and that these concerns include the further development and strengthening, within the appropriate forums, of international regulatory regimes to enhance safety, disclosure, liability, security and compensation in relation to such transport;",
    "165": "Acknowledges, in the context of paragraph 164 above, the potential environmental and economic impacts of maritime incidents and accidents on coastal States, in particular those related to the transport of radioactive materials, and emphasizes the importance of effective liability regimes in that regard;",
    "166": "Invites States that have not yet done so to consider becoming parties to the Nairobi International Convention on the Removal of Wrecks, 2007; 86",
    "167": "Requests States to take appropriate measures with regard to ships flying their flag or of their registry to address hazards that may be caused by wrecks and drifting or sunken cargo to navigation or the marine environment;",
    "168": "Calls upon States to ensure that masters on ships flying their flag take the steps required by relevant instruments87 to provide assistance to persons in distress at sea, and urges States to cooperate and to take all measures necessary to ensure the effective implementation of the amendments to the International Convention on Maritime Search and Rescue88 and to the International Convention for the Safety of Life at Sea89 relating to the delivery of persons rescued at sea to a place of safety, as well as of the associated Guidelines on the Treatment of Persons Rescued at Sea; 90",
    "169": "Urges all States to cooperate with each other in inquiries relating to incidents of oil spills at sea, in line with relevant international law, including as reflected in article 94 of the Convention, and for this purpose to share, when requested by the affected coastal State in the context of such inquiries, any available information on the maritime traffic of ships that fly their flags and that sailed in the impacted maritime areas;",
    "170": "Recognizes that all States must fulfil their search and rescue responsibilities in accordance with international law, including the Convention, and in that regard encourages States and relevant international organizations to strengthen cooperation on maritime search and rescue activities at the international and regional levels in accordance with international agreements, including the International Convention on Maritime Search and Rescue, 1979;91",
    "171": "Reaffirms the ongoing need for the International Maritime Organization and other relevant organizations to assist, in particular, developing States both to increase and improve their search and rescue capabilities, including, as appropriate, through the establishment of additional rescue coordination centres and regional sub-centres, and to take effective action to address, to the extent feasible, the issue of unseaworthy ships and small craft within their national jurisdiction, and emphasizes in this regard the importance of cooperation for these purposes, including within the framework of the International Convention on Maritime Search and Rescue, 1979;",
    "172": "Notes the ongoing work of the International Maritime Organization, the Office of the United Nations High Commissioner for Refugees and other relevant actors in relation to disembarkation of persons rescued at sea, underscores in this regard the need to implement all relevant and applicable international instruments and the importance of cooperation among States as provided for in those instruments, and emphasizes in particular the importance of full respect for the principle of non-refoulement in accordance with applicable international law;",
    "173": "Invites States to implement the Revised Guidelines on the Prevention of Access by Stowaways and the Allocation of Responsibilities to Seek the Successful Resolution of Stowaway Cases, adopted by the Maritime Safety Committee of the International Maritime Organization in its resolution MSC.448(99) of 24 May 2018 and by the Facilitation Committee of that Organization in its resolution FAL.13(42) of 8 June 2018;",
    "174": "Calls upon States to continue to cooperate in developing comprehensive approaches to international migration and development, including through dialogue on all their aspects;",
    "175": "Recognizes that submarine cables and pipelines are vitally important to the global economy and the national security of all States, conscious that these cables and pipelines are susceptible to intentional and accidental damage, and calls upon States to take measures to protect submarine cables and pipelines and to fully address issues relating to these cables and pipelines, in accordance with international law, as reflected in the Convention;",
    "176": "Encourages greater dialogue and cooperation among States and the relevant regional and global organizations through workshops and seminars on the protection, and laying and maintenance of submarine cables and pipelines to promote the security of such critical infrastructure;",
    "177": "Also encourages the adoption by States of laws and regulations necessary to provide that the breaking or injury, or conduct calculated or likely to result in such breaking or injury, of submarine cables or pipelines beneath the high seas done wilfully or through culpable negligence shall be a punishable offence, and further calls upon States to enforce such laws against ships flying their flag or a person subject to their jurisdiction, in accordance with international law, as reflected in the Convention;",
    "178": "Affirms the importance of the laying and maintenance, including the repair, of submarine cables and pipelines, undertaken in conformity with international law, as reflected in the Convention, and calls upon States to refrain from impeding the laying or maintenance of submarine cables and pipelines in a manner contrary to the provisions of the Convention, and to respect the relevant rights and duties of coastal States in the relevant maritime zones in this regard, as reflected in the Convention;",
    "179": " surveys and issue certificates on their behalf, taking into account the Code for Recognized Organizations;92",
    "180": "Urges flag States without an effective maritime administration and appropriate legal frameworks to establish or enhance the necessary infrastructure, legislative and enforcement capabilities to ensure effective compliance with and implementation and enforcement of their responsibilities under international law, in particular the Convention, and, until such action is taken, to consider declining the granting of the right to fly their flag to new vessels, suspending their registry or not opening a registry, and calls upon flag and port States to take all measures consistent with international law necessary to prevent the operation of substandard vessels;",
    "181": "Notes the ongoing work of the International Maritime Organization on measures to prevent the fraudulent registration and fraudulent registries of ships, including its encouragement of International Maritime Organization member States and all relevant stakeholders to promote actions for the prevention and suppression of fraudulent registration and fraudulent registries of ships and other fraudulent acts in the maritime sector;",
    "182": "Recognizes that international shipping rules and standards adopted by the International Maritime Organization in respect of maritime safety, efficiency of navigation and the prevention and control of marine pollution, complemented by best practices of the shipping industry, have led to a significant reduction in maritime accidents and pollution incidents;",
    "183": "Notes that audits of Member States under the International Maritime Organization Member State Audit Scheme became mandatory in January 2016 under nine mandatory International Maritime Organization instruments and are being carried out in accordance with the Framework and the Procedures for the International Maritime Organization Member State Audit Scheme and using the International Maritime Organization Instruments Implementation Code (III Code) as the audit standard;93",
    "184": "Encourages States and competent international organizations and bodies to support the effective implementation of the requirements of the International Code for Ships Operating in Polar Waters (Polar Code), adopted by the International Maritime Organization under the International Convention for the Safety of Life at Sea and the International Convention for the Prevention of Pollution from Ships, 1973, as modified by the Protocol of 1978 relating thereto, as amended, 94 including relevant requirements of the International Convention on Standards of Training, Certification and Watchkeeping for Seafarers, 1978, as amended, 95 and notes in this regard the adoption by the International Maritime Organization of amendments to the Polar Code to incorporate new requirements for ships that are operating in polar waters concerning safety of navigation and voyage planning, which are expected to enter into force on 1 January 2026;96",
    "185": "Notes the ongoing work of the International Maritime Organization on matters related to passenger ship safety, and encourages States and competent international organizations and bodies to support continued efforts, including technical cooperation activities, to improve passenger ship safety;",
    "186": "Also notes the ongoing work of the International Maritime Organization regarding maritime autonomous surface ships, including development of a non-mandatory, goal-based instrument for maritime autonomous surface ships; 97",
    "187": "Recognizes that maritime safety can also be improved through effective port State control, the strengthening of regional arrangements and increased coordination and cooperation among them and increased transparency and information-sharing, making ample use of information systems, such as the International Maritime Organization Global Integrated Shipping Information System,98 including among safety and security sectors;",
    "188": "Encourages flag States to take appropriate measures sufficient to achieve or maintain recognition by intergovernmental arrangements that recognize satisfactory flag State performance, including, as appropriate, satisfactory port State control examination results on a sustained basis, with a view to improving quality shipping and furthering flag State implementation of relevant instruments under the International Maritime Organization as well as relevant goals and objectives of the present resolution;",
    "189": "Notes with appreciation the important contribution of the International Association of Marine Aids to Navigation and Lighthouse Authorities to the improvement and harmonization of marine aids to navigation for the reduction of marine accidents, increased safety of life and property at sea and the protection of the marine environment, and in this regard recalls the adoption of the Convention on the International Organization for Marine Aids to Navigation and calls upon States that have not yet done so to consider becoming party to that Convention to facilitate its entry into force; IX Marine environment and marine resources",
    "190": "Emphasizes once again the importance of the implementation of Part XII of the Convention in order to protect and preserve the marine environment and its living marine resources against pollution and physical degradation, and calls upon all States to cooperate and take measures consistent with the Convention, directly or through competent international organizations, for the protection and preservation of the marine environment;",
    "191": "Calls upon States to implement the 2030 Agenda, including Goal 14 to conserve and sustainably use the oceans, seas and marine resources for sustainable development, and recalls that the Goals and targets are integrated and indivisible;",
    "192": "Notes the need for actions to support sustainable fisheries and sustainable aquaculture for sufficient, safe and nutritious food, recognizing the central role of healthy oceans in resilient food systems and for achieving the 2030 Agenda;",
    "193": "Reiterates, in this regard, the call made in the declaration entitled \u201cOur ocean, our future: call for action\u201d for action to be taken on an urgent basis to conserve and sustainably use the oceans, seas and marine resources for sustainable development;99",
    "194": "Recalls that, in \u201cThe future we want\u201d, States committed themselves to protect and restore the health, productivity and resilience of oceans and marine ecosystems, to maintain their biodiversity, enabling their conservation and sustainable use for present and future generations, and to effectively apply an ecosystem approach and the precautionary approach in the management, in accordance with international law, of activities having an impact on the marine environment, to deliver on all three dimensions of sustainable development;",
    "195": "Reaffirms paragraph 119 of resolution 61/222 of 20 December 2006 regarding ecosystem approaches and oceans, including the proposed elements of an ecosystem approach, means to achieve implementation of an ecosystem approach and requirements for improved application of an ecosystem approach, and in this regard: (a) Notes that continued environmental degradation in many parts of the world and increasing competing demands require an urgent response and the setting of priorities for management actions aimed at conserving ecosystem integrity; (b) Also notes that ecosystem approaches to ocean management should be focused on managing human activities in order to maintain and, where needed, restore ecosystem health to sustain goods and environmental services, provide social and economic benefits for food security, sustain livelihoods in support of international development goals, including those contained in the United Nations Millennium Declaration,100 and conserve marine biodiversity; (c) Recalls that States should be guided in the application of ecosystem approaches by a number of existing instruments, in particular the Convention, which sets out the legal framework for all activities in the oceans and seas, and its implementing Agreements, as well as other commitments, such as those contained in the Convention on Biological Diversity101 and the World Summit on Sustainable Development call for the application of an ecosystem approach by 2010, and in this context encourages States to enhance their efforts towards applying such an approach; (d) Encourages States to cooperate and coordinate their efforts and take, individually or jointly, as appropriate, all measures, in conformity with international law, including the Convention and other applicable instruments, to address impacts on marine ecosystems within and beyond areas of national jurisdiction, taking into account the integrity of the ecosystems concerned;",
    "196": "Encourages competent organizations and bodies that have not yet done so to incorporate an ecosystem approach into their mandates, as appropriate, in order to address impacts on marine ecosystems;",
    "197": "Acknowledges the request by the United Nations Environment Assembly at its second session, in paragraph 6 of its resolution 2/10 of 27 May 2016, to the United Nations Environment Programme to step up its work, including through its Regional Seas Programme, on assisting countries and regions in the application of the ecosystem approach to managing the marine and coastal environment, including through enabling intersectoral cooperation in integrated coastal zone management and marine spatial planning;102",
    "198": "Encourages States that have not done so to become parties to regional seas conventions and the protocols thereto addressing the protection and preservation of the marine environment, while noting the role of the United Nations Environment Programme Regional Seas Programme;",
    "199": "Encourages States, directly or through competent international organizations, to consider the further development and application, as appropriate and consistent with international law, including the Convention, of environmental impact assessment processes covering planned activities under their jurisdiction or control that may cause substantial pollution of or significant and harmful changes to the marine environment, and also encourages the communication of the reports of the results of such assessments to the competent international organizations in accordance with the Convention;",
    "200": "Notes with concern the impacts of climate change on the ocean and the cryosphere, including extreme sea level events and sea level rise, to which low-lying islands, in particular small island developing States, coasts and coastal communities are particularly exposed;",
    "201": "Also notes with concern the findings of the Intergovernmental Panel on Climate Change in its successive reports, and in this regard refers in particular to its Special Report on the Ocean and Cryosphere in a Changing Climate, which was accepted by the Intergovernmental Panel at its fifty-first session on 23 September 2019, and its Sixth Assessment Report, including its synthesis report, which was accepted by the Intergovernmental Panel at its fifty-eighth session on 19 March 2023;",
    "202": "Recognizes the importance of improving understanding of the impacts of climate change on oceans and seas, and recalls that, in \u201cThe future we want\u201d, States noted that sea level rise and coastal erosion are serious threats for many coastal regions and islands, particularly in developing countries, and in this regard called upon the international community to enhance its efforts to address these challenges, and notes the attention paid to the themes of \u201cThe effects of climate change on oceans\u201d and \u201cSea level rise and its impacts\u201d at the eighteenth and twenty-first meetings, respectively, of the Informal Consultative Process, in 2017 and 2021, which, inter alia, highlighted the urgency of sea level rise for small island developing States and coastal States, including low-lying coastal areas;",
    "203": "Takes note of the findings of reports of the Intergovernmental Panel on Climate Change, including its Special Report on Global Warming of 1.5\u00b0C, that increasing warming amplifies the exposure of small islands, low-lying coastal areas and deltas to the risks associated with sea level rise and extreme sea level events;",
    "204": "Acknowledges the ongoing work of the open-ended Study Group of the International Law Commission on the topic \u201cSea-level rise in relation to international law\u201d,103 and encourages States to share their views on the various aspects of this topic with that Commission;",
    "205": "Recalls its decision in resolution 77/276 of 29 March 2023 to request the International Court of Justice to render an advisory opinion on the obligations of States in respect of climate change;",
    "206": "Welcomes the Paris Agreement104 and its early entry into force on 4 November 2016, encourages all its parties to fully implement the Agreement and parties to the United Nations Framework Convention on Climate Change 105 that have not yet done so to deposit their instruments of ratification, acceptance, approval or accession, as appropriate, as soon as possible, notes the entry into force of the Doha amendment106 to the Kyoto Protocol107 on 31 December 2020, and recognizes the importance of raising awareness of the adverse impact of climate change on the marine environment, marine biodiversity and sea level;",
    "207": "Notes, in this regard, the decision at the twenty-seventh session of the Conference of the Parties to the United Nations Framework Convention on Climate Change that future ocean and climate change dialogues will, from 2023, be facilitated by two co-facilitators, selected by Parties biennially, who will be responsible for deciding the topics for and conducting the dialogue, in consultation with Parties and observers, and preparing an informal summary report for consideration at the subsequent session of the Conference of the Parties;",
    "208": "Welcomes, in this regard, the convening of the twenty-eighth session of the Conference of the Parties to the United Nations Framework Convention on Climate Change, the eighteenth session of the Conference of the Parties serving as the Meeting of the Parties to the Kyoto Protocol and the fifth session of the Conference of the Parties serving as the Meeting of the Parties to the Paris Agreement in Dubai, United Arab Emirates, from 30 November to 12 December 2023;",
    "209": "Notes with concern the severe impacts on coastal communities of extreme weather events, such as tropical cyclones and associated storm surges, and encourages cooperative actions by relevant United Nations bodies and organizations, including the World Meteorological Organization and the Intergovernmental Oceanographic Commission with the advice of the Joint WMO-IOC Collaborative Board,108 to assist States in improving forecasting, including routine and impact-based forecasting and support to decision-making for emergency management, of such events and its application in multi-hazard early warning systems and risk management under a more integrated approach to addressing the impacts of flooding types from multiple sources and severe weather;109",
    "210": "Also notes with concern the approximately 30 per cent increase in the acidity of ocean surface waters since the beginning of the industrial era 110 and the wide range of impacts associated with the continuing and alarming acidification of the world\u2019s oceans, and urges States to make significant efforts to tackle the causes of ocean acidification, recognizing countries\u2019 national circumstances and respective capabilities, and to further study and minimize its impacts, to enhance local, national, regional and global cooperation in this regard, including the sharing of relevant information and the development of worldwide capacity, including in developing countries, to measure ocean acidification, and to take steps to make marine ecosystems healthier and, as a result, more resilient, to the extent possible, to the impacts of ocean acidification;",
    "211": "Recognizes the importance of improving understanding of the impacts of acidification on oceans and seas, and recalls that, in \u201cThe future we want\u201d, States called for support for initiatives that address ocean acidification and the impacts of climate change on marine and coastal ecosystems and resources and in this regard reiterated the need to work collectively to prevent further ocean acidification, as well as to enhance the resilience of marine ecosystems and of the communities whose livelihoods depend on them, and to support marine scientific research, monitoring and observation of ocean acidification and particularly vulnerable ecosystems, including through enhanced international cooperation in this regard;",
    "212": "Also recognizes the attention paid to ocean acidification at the fourteenth, eighteenth and nineteenth meetings of the Informal Consultative Process, in 2013, 2017 and 2018, respectively, and commits itself to continue to pay attention to this important issue, including by taking into account the first and second World Ocean Assessments (World Ocean Assessment I and II), the ongoing work of the Ocean Acidification International Coordination Centre of the International Atomic Energy Agency and the scientific cooperation fostered by the Global Ocean Acidification Observing Network;",
    "213": "Notes the work of the Intergovernmental Panel on Climate Change, notes with concern its findings on the acidification of the oceans and the substantial risks to marine ecosystems, especially polar ecosystems, coral reefs, plankton and other organisms which have a calcareous exoskeleton, or a shell, like crustaceans, and the potentially detrimental consequences for fisheries and livelihoods, as well as the findings of the World Meteorological Organization contained in its annual Greenhouse Gas Bulletin, and notes its decision to foster collaboration with organizations and institutions that address the carbon budget of the ocean, 111 and in this regard encourages States and competent international organizations and other relevant institutions, individually and in cooperation, to urgently pursue further research on ocean acidification, especially programmes of observation and measurement, noting in particular the continued work under the Convention on Biological Diversity, and to increase national, regional and global efforts to address levels of ocean acidity and the negative impact of such acidity on vulnerable marine ecosystems, particularly coral reefs;",
    "214": "Encourages States, individually or in collaboration with relevant international organizations and bodies, to enhance their scientific activity to better understand the effects of climate change on the marine environment and marine biodiversity, support continued coordination of scientific work to study and minimize the impacts of ocean acidification and develop ways and means of adaptation, taking into account, as appropriate, the precautionary approach and ecosystem approaches;",
    "215": "Notes the vital role that coastal blue carbon ecosystems, including mangroves, tidal marshes and seagrasses, play in climate adaptation and mitigation through carbon sequestration, and in increasing the resilience of coastal ecosystems to ocean acidification, and the range of other benefits that these ecosystems provide, including sustainable livelihoods, food security and biodiversity conservation, and coastal protection, and encourages States and relevant international institutions and organizations to work collaboratively to protect and restore coastal blue carbon ecosystems;",
    "216": "Recalls that, in \u201cThe future we want\u201d, States noted with concern that the health of oceans and marine biodiversity are negatively affected by marine pollution, including marine debris, especially plastic, persistent organic pollutants, heavy metals and nitrogen-based compounds, from a number of marine and land-based sources, including shipping and land run-off, and that States committed to take action to reduce the incidence and impacts of such pollution on marine ecosystems, and encourages States, in accordance with the commitment expressed in this regard, and based on collected scientific data, to take action by 2025 to achieve significant reductions in marine debris to prevent harm to the coastal and marine environment;",
    "217": "Recognizes the need for better understanding of the sources, amounts, pathways, distribution, trends, nature and impacts of marine debris, especially plastics and microplastics, and to examine possible measures and best available techniques and environmental practices to prevent its accumulation and minimize its levels in the marine environment, and welcomes in this regard the work conducted under the Joint Group of Experts on the Scientific Aspects of Marine Environmental Protection, led by the Intergovernmental Oceanographic Commission, and its reports entitled Sources, Fate and Effects of Microplastics in the Marine Environment: A Global Assessment, Guidelines for the Monitoring and Assessment of Plastic Litter in the Ocean, and Sea- based Sources of Marine Litter, and the report of the Executive Director of the United Nations Environment Programme entitled From Pollution to Solution: A Global Assessment of Marine Litter and Plastic Pollution, launched on 21 October 2021;",
    "218": "Notes that the UNEP Frontiers 2016 Report identifies microplastics as one of six key emerging environmental issues, further notes that the sixth Global Environment Outlook stresses, inter alia, the urgency of addressing ocean plastic pollution and the proven adverse impacts of microplastics to marine ecosystems, and calls upon States to implement resolution 4/6 on marine plastic litter and microplastics, adopted by the United Nations Environment Assembly of the United Nations Environment Programme at its fourth session, held in Nairobi from 11 to 15 March 2019;112",
    "219": "Welcomes the request by the United Nations Environment Assembly, in paragraph 2 of its resolution 4/6, to the Executive Director of the United Nations Environment Programme, subject to the availability of resources and benefiting from the work of existing mechanisms, to immediately strengthen scientific and technological knowledge with regard to marine litter, including marine plastic litter and microplastics;",
    "220": "Also welcomes the decision of the United Nations Environment Assembly, in paragraph 1 of its resolution 5/14, to convene an intergovernmental negotiating committee to develop an international legally binding instrument on plastic pollution, including in the marine environment, with the ambition of completing its work by the end of 2024,113 and notes that the committee held its first, second and third sessions in Punta del Este, Uruguay, from 28 November to 2 December 2022, in Paris from 29 May to 2 June 2023, and in Nairobi from 13 to 19 November 2023, respectively;",
    "221": "Further welcomes the activities of relevant United Nations bodies and organizations, in particular the United Nations Environment Programme, the Food and Agriculture Organization of the United Nations and the International Maritime Organization and other intergovernmental organizations, to address the sources and impacts of marine debris, including through the Global Partnership on Plastic Pollution and Marine Litter and the GloLitter Partnerships project, as well as actions relating to marine debris taken under the Convention on Biological Diversity and the Convention on the Conservation of Migratory Species of Wild Animals, 114 in particular the adoption by the Conference of the Parties to that Convention at its twelfth meeting of resolution 12.20 on the management of marine debris, and notes the work of the International Whaling Commission on assessing the impacts of marine debris on cetaceans;",
    "222": "Encourages States to further develop partnerships with Indigenous Peoples, local communities, including coastal communities, industry and civil society to raise awareness of the extent of the impact of marine debris on the biological diversity, health and productivity of the marine environment and consequent economic loss and to cooperate with other States, Indigenous Peoples, local communities, including coastal communities, industry and civil society, as appropriate, on environmentally sound and cost-effective measures to prevent and reduce, as appropriate, marine debris and microplastics in the marine environment, including through strengthened cooperation under the Global Partnership on Plastic Pollution and Marine Litter;",
    "223": "Recognizes the attention paid to the theme of \u201cMarine debris, plastics and microplastics\u201d at the seventeenth meeting of the Informal Consultative Process in 2016, and urges States to integrate the issue of marine debris into national and, as appropriate, regional strategies dealing with waste management, especially in the coastal zone, ports and maritime industries, including recycling, reuse, reduction and disposal, to consider developing an integrated waste management infrastructure and to encourage the development of appropriate economic incentives with the aim of reducing marine debris to address this issue, including the development of cost- recovery systems that provide an incentive to use port reception facilities and discourage ships from discharging marine debris at sea, and support for measures to prevent, reduce and control pollution from any source, including land-based sources, such as community-based coastal and waterway clean-up and monitoring activities, and encourages States to cooperate regionally and subregionally to identify potential sources and coastal and oceanic locations where marine debris aggregates and to develop and implement joint prevention programmes for marine debris and to develop and implement environmentally sound options for recovery programmes, as well as to raise awareness of the issue of marine debris and the need to consider environmentally sound options for its removal;",
    "224": "Notes the activities carried out by organizations at the regional level to develop and implement regional action plans and other joint prevention and recovery programmes for marine debris, and further notes in this regard the revised Regional Action Plan on Marine Litter adopted at the Ministerial Meeting of the Baltic Marine Environment Protection Commission (Helsinki Commission) in October 2021, the amendments to the Regional Plan on Marine Litter Management in the Mediterranean adopted at the twenty-second Meeting of the Contracting Parties to the Convention for the Protection of the Marine Environment and the Coastal Region of the Mediterranean (Barcelona Convention) and its Protocols in December 2021 in Antalya, T\u00fcrkiye, the Second Regional Action Plan for the Prevention and Management of Marine Litter in the North-East Atlantic (2022\u20132030), adopted at the annual meeting of the OSPAR Commission in Copenhagen on 24 April 2022, and a regional plan for integrated management of marine litter in the South-East Pacific, adopted in April 2022 within the framework of the Protocol for the Protection of the South-East Pacific against Pollution from Land-based Sources115 and the ASEAN Regional Action Plan for Combating Marine Debris in the ASEAN Member States (2021\u20132025) launched by ASEAN in 2021;",
    "225": "Also notes the work done under the Asia-Pacific Economic Cooperation (APEC) framework to share best practices, enable innovative waste management financing and encourage public-private partnerships in order to prevent and reduce marine debris, including the development of a marine debris monitoring decision framework for APEC economies in January 2023;",
    "226": "Welcomes the adoption of the Indian Ocean Rim Association Strategic Framework of Action on Marine Debris in the Indian Ocean in November 2022, and encourages the effective implementation by member States of the Indian Ocean Rim Association of the Strategic Framework to comprehensively combat marine plastic debris in the Indian Ocean, with the support of dialogue partners of the Indian Ocean Rim Association and other international and regional organizations;",
    "227": "Also welcomes the ongoing work of the members of the Group of 20 on the \u201cOsaka Blue Ocean Vision\u201d, which aims to reduce additional pollution by marine plastic litter to zero by 2050, and calls upon other members of the international community to also share the vision;",
    "228": "Notes the release of the United Nations Conference on Trade and Development Trade and Environment Review 2023: Building a Sustainable and Resilient Ocean Economy beyond 2030116 and the United Nations Conference on Trade and Development Review of Maritime Transport 2022: Navigating Stormy Waters;117",
    "229": "Encourages States that have not yet done so to become parties to international agreements addressing the protection and preservation of the marine environment and its living marine resources against the introduction of harmful aquatic organisms and pathogens and marine pollution from all sources, including the dumping of wastes and other matter, and other forms of physical degradation, as well as agreements that provide for preparedness for, response to and cooperation on pollution incidents and that include provisions on liability and compensation for damage resulting from marine pollution, and to adopt the necessary measures consistent with international law, including the Convention, aimed at implementing and enforcing the rules contained in those agreements;",
    "230": "Recalls that, in \u201cThe future we want\u201d, States noted the significant threat that alien invasive species pose to marine ecosystems and resources and committed to implement measures to prevent the introduction and manage the adverse environmental impacts of alien invasive species, including, as appropriate, those adopted in the framework of the International Maritime Organization;",
    "231": "Encourages States that have not yet done so to consider ratifying or acceding to the International Convention for the Control and Management of Ships\u2019 Ballast Water and Sediments, 2004,118 and also encourages States to consider implementing the Guidelines for the control and management of ships\u2019 biofouling to minimize the transfer of invasive aquatic species, adopted by the International Maritime Organization in resolution MEPC.207(62) of 15 July 2011;",
    "232": "Notes the activities carried out by the United Nations Environment Programme/Mediterranean Action Plan and further notes in this regard the Mediterranean Strategy for the Prevention of, Preparedness and Response to Marine Pollution from Ships (2022\u20132031) and the Ballast Water Management Strategy for the Mediterranean Sea (2022\u20132027), adopted at the twenty-second Meeting of the Contracting Parties to the Barcelona Convention and its Protocols;",
    "233": "Also notes the ongoing work of the International Maritime Organization to prevent pollution from ships, including through the designation of Special Areas under the International Convention for the Prevention of Pollution from Ships, 1973, as modified by the Protocol of 1978 relating thereto, as amended, 119 as well as through its action plan and strategy to address marine litter from ships, and encourages the International Maritime Organization to continue working on the prevention of pollution from ships;",
    "234": "Further notes, in this regard, the theme for the 2023 World Maritime Day, \u201cMARPOL at 50 \u2013 Our commitment goes on\u201d;",
    "235": "Notes that the global limit of 0.50 per cent on sulphur in fuel oil under annex VI to the International Convention for the Prevention of Pollution from Ships entered into force on 1 January 2020, encourages States that have not yet done so to become parties to the Protocol of 1997 (annex VI \u2013 Regulations for the Prevention of Air Pollution from Ships) to the International Convention for the Prevention of Pollution from Ships, 1973, as modified by the Protocol of 1978 relating thereto, as amended, and encourages the effective implementation of that Protocol; 120",
    "236": "Welcomes the designation, at the initiative of the Contracting Parties to the Barcelona Convention and its Protocols, of the Mediterranean Sea, as a whole, as an Emission Control Area for Sulphur Oxides (Med SOx ECA) pursuant to an amendment to annex VI to the International Convention for the Prevention of Pollution from Ships, which is expected to enter into force on 1 May 2024 and take effect from 1 May 2025,121 and encourages ratification of that annex across the Mediterranean region as soon as possible;",
    "237": "Notes the ongoing work of the International Maritime Organization and the resolution on International Maritime Organization policies and practices related to the reduction of greenhouse gas emissions from ships, 122 and in this regard welcomes its adoption of a revised strategy on the reduction of greenhouse gas emissions from ships (the 2023 IMO Strategy on Reduction of GHG Emissions from Ships);123",
    "238": "Urges States to cooperate in correcting the shortfall in port waste reception facilities in accordance with the action plan to address the inadequacy of port waste reception facilities developed by the International Maritime Organization;",
    "239": "Emphasizes the need for the safe and environmentally sound recycling of ships, notes that the Hong Kong International Convention for the Safe and Environmentally Sound Recycling of Ships, 2009 124 will enter into force on 26 June 2025, and encourages States that have not yet done so to consider ratifying or acceding to that Convention;",
    "240": "Encourages continued cooperation between the parties to the Basel Convention on the Control of Transboundary Movements of Hazardous Wastes and Their Disposal125 and the International Maritime Organization on regulations on the prevention of pollution from ships;",
    "241": "Notes the role of the Basel Convention in ensuring that the management of hazardous wastes and other wastes, under the scope of that Convention, including their transboundary movement and disposal, is consistent with the protection of the marine environment;",
    "242": "Notes with concern the potential for serious environmental consequences resulting from oil spill incidents or pollution incidents involving hazardous or noxious substances, urges States, consistent with international law, to cooperate, directly or through competent international organizations, and share best practices, in the fields of protection of the marine environment, human health and safety, prevention, emergency response and mitigation, and in this regard encourages the undertaking of and collaboration on scientific research, including marine scientific research, to better understand the consequences of marine oil spills or marine spills involving hazardous or noxious substances;",
    "243": "Encourages States, in accordance with international law, including the Convention and other relevant instruments, either bilaterally or regionally, to jointly develop and promote contingency plans for responding to pollution incidents, as well as other incidents that are likely to have significant adverse effects on the marine environment and biodiversity;",
    "244": "Encourages States that have not yet done so to consider ratifying or acceding to the International Convention on Oil Pollution Preparedness, Response and Cooperation, 1990,126 and the Protocol on Preparedness, Response and Cooperation to Pollution Incidents by Hazardous and Noxious Substances, 2000, of the International Maritime Organization, and in this regard to consider developing and joining regional arrangements to enhance international cooperation for combating major oil and hazardous substances pollution incidents;",
    "245": "Encourages States to consider becoming parties to the 2010 Protocol to the 1996 International Convention on Liability and Compensation for Damage in Connection with the Carriage of Hazardous and Noxious Substances by Sea;127",
    "246": "Recognizes that most of the pollution load of the oceans emanates from land-based activities and affects the most productive areas of the marine environment, and calls upon States, as a matter of priority, to implement the Global Programme of Action for the Protection of the Marine Environment from Land-based Activities;",
    "247": "Welcomes the continued work of States, the United Nations Environment Programme and regional organizations in the implementation of the Global Programme of Action, and encourages increased emphasis on the link between fresh water, the coastal zone and marine resources in the implementation of the 2030 Agenda and its Sustainable Development Goals, as well as of the Addis Ababa Action Agenda of the Third International Conference on Financing for Development;",
    "248": "Expresses its concern regarding the spreading of hypoxic dead zones and harmful algal blooms in oceans as a result of eutrophication fuelled by riverine run- off of fertilizers, sewage outfall and reactive nitrogen resulting from the burning of fossil fuels and resulting in serious consequences for ecosystem functioning, and calls upon States to enhance their efforts to reduce eutrophication, particularly by reducing total nutrient pollution from land-based sources and, to this effect, to continue to cooperate within the framework of relevant international organizations, in particular the Global Programme of Action and the Global Partnership on Nutrient Management and Global Wastewater Initiative, including through capacity-building initiatives and efforts to monitor, via the Global Ocean Observing System, stressors such as harmful algal blooms, areas of hypoxia, sargassum seaweed invasions and jellyfish blooms, to assess their possible linkage to eutrophication and their potential adverse impacts on the marine environment as well as on human health;",
    "249": "Encourages States that have not yet done so to take, as soon as possible, the domestic measures necessary to enable them to meet their obligations upon ratification and, thereafter, to ratify, accept, approve or accede to the Minamata Convention on Mercury;128",
    "250": "Calls upon all States to ensure that urban and coastal development projects and related land-reclamation activities are carried out in a responsible manner that protects the marine habitat and environment and mitigates the negative consequences of such activities;",
    "251": "Recalls that, in \u201cThe future we want\u201d, States stressed their concern about the potential environmental impacts of ocean fertilization, recalled in this regard the decisions related to ocean fertilization adopted by the relevant intergovernmental bodies, and resolved to continue addressing ocean fertilization with utmost caution, consistent with the precautionary approach;",
    "252": "Encourages States that have not yet done so to become parties to the 1996 Protocol to the Convention on the Prevention of Marine Pollution by Dumping of Wastes and Other Matter, 1972 (the London Protocol);",
    "253": "Recalls the resolution of the thirtieth Consultative Meeting of Contracting Parties to the Convention on the Prevention of Marine Pollution by Dumping of Wastes and Other Matter, 1972 (the London Convention) and the third Meeting of Contracting Parties to the London Protocol, held from 27 to 31 October 2008, on the regulation of ocean fertilization,129 in which the Contracting Parties agreed, inter alia, that the scope of the London Convention and Protocol includes ocean fertilization activities and that, given the present state of knowledge, ocean fertilization activities other than for legitimate scientific research should not be allowed, and that scientific research proposals should be assessed on a case-by-case basis using an assessment framework that was subsequently developed and adopted in 2010 by the Contracting Parties to the London Convention and Protocol, namely, the Assessment Framework for Scientific Research Involving Ocean Fertilization,130 and also agreed that, to this end, such other activities should be considered as contrary to the aims of the London Convention and Protocol and should not currently qualify for any exemption from the definition of dumping in article III, paragraph 1 (b), of the London Convention and article 1, paragraph 4.2, of the London Protocol;131",
    "254": "Notes the continued work of the Contracting Parties to the London Convention and Protocol towards a global, transparent and effective control and regulatory mechanism for ocean fertilization activities and other activities that fall within the scope of the London Convention and Protocol and have the potential to cause harm to the marine environment, and notes the resolution adopted by the eighth Meeting of Contracting Parties to the London Protocol, held from 14 to 18 October 2013, on the amendment to the London Protocol to regulate the placement of matter for ocean fertilization and other marine geoengineering activities; 132",
    "255": "Recalls decision IX/16 C, adopted at the ninth meeting of the Conference of the Parties to the Convention on Biological Diversity, held in Bonn, Germany, from 19 to 30 May 2008,133 in which the Conference of the Parties, inter alia, bearing in mind the ongoing scientific and legal analysis occurring under the auspices of the London Convention and Protocol, requested parties and urged other Governments, in accordance with the precautionary approach, to ensure that ocean fertilization activities were not carried out until there was an adequate scientific basis on which to justify such activities, including an assessment of associated risks, and that a global, transparent and effective control and regulatory mechanism was in place for those activities, with the exception of small-scale scientific research studies within coastal waters, and stated that such studies should be authorized only if justified by the need to gather specific scientific data, should be subject to a thorough prior assessment of the potential impacts of the research studies on the marine environment, should be strictly controlled and should not be used for generating and selling carbon offsets or for any other commercial purposes, and takes note of decision X/29, adopted at the tenth meeting of the Conference of the Parties to the Convention on Biological Diversity, held in Nagoya, Japan, from 18 to 29 October 2010, 134 in which the Conference of the Parties requested parties to implement decision IX/16 C;",
    "256": "Notes resolution LP.6(17) of the forty-fourth Consultative Meeting of Contracting Parties to the London Convention and seventeenth Meeting of Contracting Parties to London Protocol amending annexes 1 and 2 to the Protocol to remove sewage sludge from the list and assessment of wastes or other matter that may be considered for dumping, which entered into force on 15 January 2023; 135 X Marine biodiversity",
    "257": "Reaffirms its central role relating to the conservation and sustainable use of marine biological diversity of areas beyond national jurisdiction;",
    "258": "Underscores that the intergovernmental conference established by resolution 72/249 of 24 December 2017 finalized its work as reflected in resolution 77/321 on the Agreement under the United Nations Convention on the Law of the Sea on the Conservation and Sustainable Use of Marine Biological Diversity of Areas beyond National Jurisdiction, and invites States and regional economic integration organizations to consider this and its implications for the ocean, in particular, on their efforts toward the conservation and sustainable use of marine biological diversity of areas beyond national jurisdiction;",
    "259": "Recognizes the abundance and diversity of marine genetic resources and their value in terms of the benefits, goods and services they can provide;",
    "260": "Also recognizes the importance of research on marine genetic resources for the purpose of enhancing the scientific understanding, potential use and application, and enhanced management of marine ecosystems;",
    "261": "Notes the work under the Jakarta Mandate on Marine and Coastal Biological Diversity136 and the Convention on Biological Diversity elaborated programme of work on marine and coastal biological diversity, 137 and, while reiterating the central role of the General Assembly relating to the conservation and sustainable use of marine biological diversity of areas beyond national jurisdiction, notes with appreciation the complementary technical and scientific work done by the Conference of the Parties to the Convention on Biological Diversity;",
    "262": "Welcomes the fifteenth meeting of the Conference of the Parties to the Convention on Biological Diversity and its outcomes, including the adoption of the Kunming-Montreal Global Biodiversity Framework,138 its 2030 mission to halt and reverse biodiversity loss, and its 2050 vision of living in harmony with nature, and encourages the full and effective implementation of that Framework and its goals and targets relevant to the ocean, and calls upon all States to increase efforts at all levels to achieve those goals and targets;",
    "263": "Recognizes the ongoing activities of the secretariat of the Convention on Biological Diversity in coordinating capacity-building efforts to support developing States in achieving the goals and targets of the Kunming-Montreal Global Biodiversity Framework in marine and coastal areas;",
    "264": "Reaffirms the need for States, individually or through competent international organizations, to urgently consider ways to integrate and improve, based on the best available scientific information and the precautionary approach and in accordance with the Convention and related agreements and instruments, the management of risks to the marine biodiversity of seamounts, cold water corals, hydrothermal vents and certain other underwater features;",
    "265": "Invites parties to the Convention on Biological Diversity to implement the voluntary specific workplan on biodiversity in cold water areas within the jurisdictional scope of that Convention, adopted in 2016 by the thirteenth meeting of the Conference of the Parties to that Convention;139",
    "266": "Reiterates its deep concern at the serious adverse impacts on the marine environment and biodiversity, in particular on vulnerable marine ecosystems and their physical and biogenic structure, including coral reefs, cold water habitats, hydrothermal vents and seamounts, of certain human activities, and calls upon States and international organizations to urgently take further action to address, in accordance with international law, destructive practices that have adverse impacts on marine biodiversity and ecosystems, including seamounts, hydrothermal vents and cold water corals;",
    "267": "Calls upon States to strengthen, in a manner consistent with international law, in particular the Convention, the conservation and management of marine biodiversity and ecosystems, and national policies in relation to area-based management tools, including marine protected areas;",
    "268": "Recalls that, in \u201cThe future we want\u201d, States reaffirmed the importance of area-based conservation measures, including marine protected areas, consistent with international law and based on best available scientific information, as a tool for conservation of biological diversity and sustainable use of its components;",
    "269": "Reaffirms the need for States to continue and intensify their efforts, directly and through competent international organizations, to develop and facilitate the use of diverse approaches and tools for conserving and managing vulnerable marine ecosystems, including the possible establishment of marine protected areas, consistent with international law, as reflected in the Convention, and based on the best scientific information available;",
    "270": "Notes the work of States, relevant intergovernmental organizations and bodies, including the Convention on Biological Diversity, in the assessment of scientific information on and compilation of ecological criteria for the identification of marine areas that may require protection, in the light of the objective of the World Summit on Sustainable Development to develop and facilitate the use of diverse approaches and tools, such as ecosystem approaches and the establishment of marine protected areas consistent with international law, as reflected in the Convention, and based on scientific information, including representative networks;",
    "271": "Recalls that the Conference of the Parties to the Convention on Biological Diversity, at its ninth meeting, adopted scientific criteria for identifying ecologically or biologically significant marine areas in need of protection in open-ocean waters and deep-sea habitats and scientific guidance for selecting areas to establish a representative network of marine protected areas, including in open-ocean waters and deep-sea habitats,140 and notes the ongoing work under the Convention on Biological Diversity on the application of the scientific criteria for ecologically or biologically significant marine areas through the organization of a series of regional workshops;",
    "272": "Also recalls that the Food and Agriculture Organization of the United Nations has developed guidance for the identification of vulnerable marine ecosystems and the prevention of significant adverse impacts on them through the International Guidelines for the Management of Deep-Sea Fisheries in the High Seas, and notes its ongoing work to support application of the Guidelines by States and regional fisheries management organizations and to maintain a database of vulnerable marine ecosystems;",
    "273": "Notes the ongoing work of the International Maritime Organization to identify and designate as Particularly Sensitive Sea Areas marine areas which are recognized for their significance in terms of ecological, socioeconomic or scientific criteria and are vulnerable to damage by international shipping activities,141 and welcomes the decision of the Marine Environment Protection Committee of the International Maritime Organization at its eightieth session to designate the North- Western Mediterranean Sea as a Particularly Sensitive Sea Area;",
    "274": "Notes with appreciation the work of the Sustainable Ocean Initiative under the Convention on Biological Diversity;",
    "275": "Also notes with appreciation the work undertaken by regional seas conventions for the conservation and sustainable management of marine biodiversity and ecosystems, and further notes with appreciation the adoption of the Post-2020 Strategic Action Programme for the Conservation of Biodiversity and Sustainable Management of Natural Resources in the Mediterranean Region (Post-2020 SAPBIO) and the Post-2020 Regional Strategy for marine and coastal protected areas and other effective area-based conservation measures in the Mediterranean, at the twenty- second Meeting of the Contracting Parties to the Barcelona Convention and its Protocols;",
    "276": "Acknowledges the Micronesia Challenge, the Caribbean Challenge Initiative and the Coral Triangle Initiative, which seek to create and link domestic marine protected areas to better facilitate ecosystem approaches, notes the Phoenix Islands Protected Area as a multinational partnership, and reaffirms the need for further international cooperation, coordination and collaboration in support of such initiatives;",
    "277": "Recalls that, in \u201cThe future we want\u201d, States recognized the significant economic, social and environmental contributions of coral reefs, in particular to islands and other coastal States, as well as the significant vulnerability of coral reefs and mangroves to impacts, including from climate change, ocean acidification, overfishing, destructive fishing practices and pollution, and supported international cooperation with a view to conserving coral reef and mangrove ecosystems and realizing their social, economic and environmental benefits, as well as facilitating technical collaboration and voluntary information-sharing;",
    "278": "Emphasizes the need to mainstream sustainable coral reef management and integrated watershed management into national development strategies, as well as into the activities of relevant United Nations agencies and programmes, international financial institutions and the donor community;",
    "279": "Reiterates its support for the International Coral Reef Initiative, notes that the thirty-seventh International Coral Reef Initiative General Meeting was held in Kailua-Kona, Hawaii, United States of America, from 20 to 23 September 2023, and supports the elaborated programme of work of the Convention on Biological Diversity on marine and coastal biological diversity related to coral reefs under the Jakarta Mandate on Marine and Coastal Biological Diversity;",
    "280": "Encourages States and relevant international institutions to improve efforts to address coral bleaching by, inter alia, improving monitoring to predict and identify bleaching events, supporting and strengthening action taken during such events and improving strategies to manage reefs to support their natural resilience and enhance their ability to withstand other pressures, including ocean acidification;",
    "281": "Encourages States to cooperate, directly or through competent international bodies, in exchanging information in the event of accidents involving vessels on coral reefs and in promoting the development of economic assessment techniques for both restoration and non-use values of coral reef systems;",
    "282": "Notes that ocean noise has potential significant adverse impacts on living marine resources, affirms the importance of sound scientific studies in addressing this matter, encourages further research, studies and consideration of the impacts of ocean noise on living marine resources, notes the work of States and competent international organizations in that regard, recognizes the attention paid to the theme of anthropogenic underwater noise at the nineteenth meeting of the Informal Consultative Process in 2018, and requests the Division to continue to compile the peer-reviewed scientific studies it receives from Member States and intergovernmental organizations pursuant to paragraph 107 of resolution 61/222 and, as appropriate, to make them, or references and links to them, available on its website;",
    "283": "Calls upon States to identify appropriate measures and approaches to assess and address the potential socioeconomic and environmental impacts of anthropogenic underwater noise, taking into account the precautionary approach and ecosystem approaches and the best available scientific information;",
    "284": "Encourages further research into, and testing of, technologies to reduce the impact of underwater noise on marine life;",
    "285": "Encourages States to continue their work at the International Maritime Organization to enhance understanding of the extent to which improved ship technology, including efficient propeller design, could lead to reduced introduction of underwater noise in the oceans;",
    "286": " GloNoise Partnership project within the International Maritime Organization, which will focus on building capacity in developing States to implement the revised Guidelines;",
    "287": "Encourages States, acting through the International Maritime Organization or individually, to participate in and share knowledge during the experience-building phase for the revised Guidelines and implement the recommended solutions to address adequately the barriers that have prevented the uptake and implementation of the current Guidelines by the industry; XI Marine science",
    "288": "Calls upon States, individually or in collaboration with each other or with competent international organizations and bodies, to continue to strive to improve understanding and knowledge of the oceans and the deep sea, including, in particular, the extent and vulnerability of deep sea biodiversity and ecosystems, by increasing their marine scientific research activities in accordance with the Convention;",
    "289": "Encourages, in that regard, relevant international organizations and other donors to consider supporting the Endowment Fund of the Authority in order to promote the conduct of collaborative marine scientific research in the international seabed area by supporting the participation of qualified scientists and technical personnel from developing countries in relevant programmes, initiatives and activities;",
    "290": "Notes with concern that human-related threats, such as marine debris, ship strikes, underwater noise, persistent contaminants, coastal development activities, oil spills and abandoned, lost or otherwise discarded fishing gear, together or individually, may have a severe impact on marine life, including at its higher trophic levels, and calls upon States and competent international organizations to cooperate and coordinate their research efforts in this regard so as to prevent and reduce those impacts and preserve the integrity of the whole marine ecosystem, while fully respecting the mandates of relevant international organizations;",
    "291": "Invites all relevant organizations, funds, programmes and bodies within the United Nations system, in consultation with interested States, to coordinate relevant activities with regional and national marine scientific and technological centres in small island developing States, as appropriate, to ensure the more effective achievement of their objectives in accordance with relevant United Nations small island developing States development programmes and strategies;",
    "292": "Welcomes the resolution adopted by the Assembly of the Intergovernmental Oceanographic Commission at its twenty-eighth session, held in Paris from 18 to 25 June 2015, regarding the adoption of the Second International Indian Ocean Expedition as an important catalyst project linking Indian Ocean processes to the global ocean and atmosphere, officially launched in Goa, India, on 4 December 2015 for an initial period of five years and continued to at least 2025, invites States to participate in this initiative, and notes that two nodes of the Second International Indian Ocean Expedition Joint Project Office have been established to coordinate operations of the expedition in Perth, Australia, and Hyderabad, India;",
    "293": "Notes with appreciation the work of the Intergovernmental Oceanographic Commission, with the advice of the Advisory Body of Experts on the Law of the Sea, on the development of procedures for the implementation of Parts XIII and XIV of the Convention;",
    "294": " integration and use of ocean observations gathered by the countries of the world for a wide variety of purposes, as well as for the advancement of scientific understanding, and in which it adopted the Intergovernmental Oceanographic Commission Data Policy and Terms of Use (2023), which outlines the requirements with respect to sharing, access, preservation and attribution to facilitate the broad use and reuse of ocean metadata, data and products;142",
    "295": "Also notes that the depth of a significant percentage of the world\u2019s oceans, seas and waterways has yet to be measured directly and that bathymetric knowledge underpins the safe, sustainable and cost-effective execution of almost every human activity in, on or under the sea;",
    "296": "Welcomes the work of the General Bathymetric Chart of the Oceans under the International Hydrographic Organization and the Intergovernmental Oceanographic Commission and, in particular, the progress made, in collaboration with the Nippon Foundation, under the Seabed 2030 project towards mapping 100 per cent of the ocean floor by 2030;",
    "297": "Encourages Member States to consider contributing to mechanisms that encourage the widest possible availability of all bathymetric data, so as to support the sustainable development, management and governance of the marine environment;",
    "298": "Notes with appreciation the contribution to marine biodiversity research of the Ocean Biodiversity Information System, a free and open-access data holding and sharing facility, hosted by the Intergovernmental Oceanographic Commission;",
    "299": "Welcomes the increasing attention being focused on oceans as a potential source of renewable energy, and notes in this regard the summary of discussions of the Informal Consultative Process at its thirteenth meeting, in 2012; 143",
    "300": "Stresses the importance of the environmental impact assessment process for ocean-based renewable energy projects;",
    "301": "Also stresses the importance of increasing the scientific understanding of the oceans-atmosphere interface, including through participation in ocean observing programmes and geographic information systems, such as the Global Ocean Observing System, sponsored by the Intergovernmental Oceanographic Commission, the United Nations Environment Programme, the World Meteorological Organization and the International Science Council, particularly considering their role in monitoring and forecasting climate change and variability, in supporting Earth system prediction144 and in the establishment and operation of tsunami warning systems;",
    "302": "Notes the decision adopted by the Assembly of the Intergovernmental Oceanographic Commission at its thirty-second session to establish an ad hoc intersessional Working Group on Ocean Observations in Areas under National Jurisdiction;145",
    "303": "Welcomes the progress made by the Intergovernmental Oceanographic Commission and Member States towards the establishment and operation of regional and national tsunami warning and mitigation systems, also welcomes the continued collaboration of the United Nations and other intergovernmental organizations in this effort, further welcomes the development and recent dissemination of the new Enhanced Tsunami Products for the Pacific Tsunami Warning and Mitigation System and the development of Enhanced Tsunami Products for the Tsunami and Other Coastal Hazards Warning System for the Caribbean and Adjacent Regions, which will assist countries in the Pacific and the Caribbean to assess tsunami threats and issue warnings, and encourages Member States to establish and sustain their national warning and mitigation systems, within a global, ocean-related multi-hazard approach, as necessary, to reduce loss of life and damage to national economies and strengthen the resilience of coastal communities to natural disasters, and welcomes the establishment of the Intergovernmental Oceanographic Commission Tsunami Programme under the United Nations Decade of Ocean Science for Sustainable Development (2021\u20132030), its 10-Year Research, Development and Implementation Plan, including its Tsunami Ready Recognition Programme and Tsunami Ready Coalition, aimed at building resilient communities through awareness and preparedness strategies that will protect life, livelihoods and property from tsunamis in different regions;",
    "304": "Stresses the need for continued efforts in developing mitigation and preparedness measures for natural disasters, particularly following such tsunami events as that on 11 March 2011 in Japan, those on 28 September and 22 December 2018 in Indonesia, and that on 15 January 2022 following the Hunga Tonga-Hunga Ha\u2019apai volcanic eruption in Tonga;",
    "305": "Notes the decision adopted by the Assembly of the Intergovernmental Oceanographic Commission at its thirty-second session that warning systems for tsunamis generated by volcanoes should be coordinated and considered as part of the United Nations Educational, Scientific and Cultural Organization/Intergovernmental Oceanographic Commission Global Tsunami and other Ocean-related Hazards Warning and Mitigation System, and also, when possible, as part of Multi-Hazard Early Warning Systems;146",
    "306": "Takes note of the sixth Global Environment Outlook, entitled Healthy Planet, Healthy People, approved on 24 January 2019, which, inter alia, identifies the principal drivers of change facing oceans and coasts and their impacts;",
    "307": "Recognizes that ocean data buoys deployed and operated in accordance with international law are critical for improving understanding of climate and ecosystems, forecasting weather, and saving lives by detecting tsunamis, reiterates its serious concern at intentional and unintentional damage to such buoys, and urges States to take necessary action and to cooperate in relevant organizations, including the World Meteorological Organization, the Intergovernmental Oceanographic Commission and the Food and Agriculture Organization of the United Nations, to address damage to ocean data buoys deployed and operated in accordance with international law, including through education and outreach about the importance and purpose of these buoys and by strengthening these buoys against such damage and increasing reporting of such damage;",
    "308": "Recognizes the attention paid to the themes of ocean science and ocean observing at the twentieth and twenty-second meetings, respectively, of the Informal Consultative Process in 2019 and 2022, and welcomes the steps taken by the Intergovernmental Oceanographic Commission to coordinate the implementation of the United Nations Decade of Ocean Science for Sustainable Development, a core objective of which is to improve the scientific knowledge base through capacity- building for developing countries with limited capacity and capabilities, in particular small island developing States, least developed countries and landlocked developing countries, on the basis of its implementation plan, in consultation with Member States, specialized agencies, funds, programmes and bodies of the United Nations, as well as other intergovernmental organizations, non-governmental organizations and relevant stakeholders;",
    "309": "Takes note of resolutions EC-55/1 of the Executive Council and A-32/3 of the Assembly of the Intergovernmental Oceanographic Commission, in which these bodies took note of the establishment of Decade coordinating mechanisms; 147",
    "310": "Also takes note of the development of the Ocean Decade Vision 2030 process aimed at enhancing the strategic delivery of the Decade under its 10 Decade Challenges;148",
    "311": "Requests that the Intergovernmental Oceanographic Commission continue to regularly consult with, and report to, Member States on the United Nations Decade of Ocean Science for Sustainable Development and its implementation;",
    "312": "Invites the Secretary-General to continue to inform the General Assembly on the implementation of the United Nations Decade of Ocean Science for Sustainable Development through his report on oceans and the law of the sea, on the basis of information to be provided by the Intergovernmental Oceanographic Commission;",
    "313": "Invites UN-Oceans and its participants to continue to collaborate with the Intergovernmental Oceanographic Commission on the United Nations Decade of Ocean Science for Sustainable Development, and in this regard notes the participation of UN-Oceans members in the Decade Advisory Board, as well as the adoption by the Authority of the action plan in support of the Decade;149 XII Regular Process for Global Reporting and Assessment of the State of the Marine Environment, including Socioeconomic Aspects",
    "314": "Reiterates the need to strengthen the regular scientific assessment of the state of the marine environment in order to enhance the scientific basis for policymaking;",
    "315": "Reaffirms the principles guiding the Regular Process and its objective and scope, recalls the crucial importance of the Regular Process and its possible inputs for ongoing ocean-related intergovernmental processes, and notes the importance of continuing support and cooperation between the activities of the United Nations Decade of Ocean Science for Sustainable Development and those of the Regular Process, and the development of a regulatory regime to organize and control all activities of exploration for, and exploitation of, the resources of the seabed and ocean floor and subsoil thereof beyond the limits of national jurisdiction by the International Seabed Authority;",
    "316": "Also reaffirms the importance of ensuring that assessments, such as those included in the Global Sustainable Development Report and those prepared under the Intergovernmental Panel on Climate Change, the Intergovernmental Science-Policy Platform on Biodiversity and Ecosystem Services and the Regular Process, support one another and avoid unnecessary duplication, and recalls the importance of compatibility and synergies between such assessments and assessments at the regional level;",
    "317": "Further reaffirms that capacity-building is one of the core objectives of the Regular Process, and recalls that, during the third cycle (2021\u20132025), a coherent programme on capacity-building will be carried out with the aim to develop the capacities of States in strengthening the ocean science-policy interface at the national, regional and global levels;",
    "318": "Recalls that the Regular Process shall be overseen and guided by the Ad Hoc Working Group of the Whole, and that the Ad Hoc Working Group shall facilitate the delivery of the outputs of the third cycle of the Regular Process as outlined in the programme of work for the third cycle, and endorses the recommendations adopted by the Ad Hoc Working Group at its nineteenth meeting on the progress in the implementation of the programme of work for the third cycle;",
    "319": "Recognizes the importance of raising awareness of the second World Ocean Assessment and the Regular Process, and welcomes the enhancement of the social media campaign on the Assessment and the wider awareness-raising campaign of the Regular Process;",
    "320": "Recognizes with appreciation the role of the Co-Chairs and the Bureau of the Ad Hoc Working Group of the Whole in putting into practice the decisions and guidance of the Ad Hoc Working Group during the intersessional period, requests the Bureau to continue to provide oversight of the delivery of the programme of work for the third cycle of the Regular Process, and recognizes the support provided by the secretariat in that regard;",
    "321": "Welcomes the designation by States of national focal points, and invites States that have not yet done so to designate national focal points to facilitate the implementation of the programme of work for the third cycle of the Regular Process and beyond;",
    "322": "Also welcomes the designation of focal points for relevant intergovernmental organizations, and invites the secretariats of relevant United Nations specialized agencies, programmes, funds and bodies and the secretariats of related organizations and conventions that have not yet done so to designate focal points to facilitate the implementation of the programme of work for the third cycle of the Regular Process and beyond;",
    "323": "Invites the Intergovernmental Oceanographic Commission of the United Nations Educational, Scientific and Cultural Organization, the United Nations Environment Programme, the International Maritime Organization, the Food and Agriculture Organization of the United Nations, the World Meteorological Organization and relevant United Nations system organizations, bodies, funds and programmes, as appropriate, to assist in the implementation of the third cycle of the Regular Process;",
    "324": "Invites relevant intergovernmental organizations to contribute, as appropriate, to the activities of the third cycle of the Regular Process;",
    "325": "Welcomes the constitution of the Group of Experts for the third cycle of the Regular Process, which currently consists of 21 members, and notes with appreciation the work being carried out by the members of the Group of Experts in the implementation of the programme of work for the third cycle;",
    "326": "Recalls that the Group of Experts for the third cycle of the Regular Process shall comprise a maximum of 25 experts, with no more than five experts per regional group, and encourages regional groups that have appointed fewer than five experts to continue to appoint experts to the Group of Experts, taking into account the need to ensure adequate expertise, gender balance and geographical distribution;",
    "327": "",
    "328": "Encourages the appointment of experts to the Pool of Experts in accordance with the mechanism, and requests the Bureau of the Ad Hoc Working Group of the Whole to provide oversight of the establishment of the Pool of Experts;",
    "329": "Welcomes the regional workshops in support of the third cycle of the Regular Process, held in Santos, Brazil, in May 2023, in Kingston in June 2023, in Mahe, Seychelles, in July\u2013August 2023, in Lisbon in September 2023 and in New York in November 2023, and the capacity-building symposium to be held in Paris in December 2023, which are being held to support the development of the third World Ocean Assessment and strengthen the ocean science-policy interface;",
    "330": "Encourages efforts to ensure completion of the zero draft of the third World Ocean Assessment for review by Member States in 2024 as outlined in the programme of work for the third cycle of the Regular Process;",
    "331": "Urges States, international financial institutions, donor agencies, intergovernmental organizations, non-governmental organizations and natural and juridical persons to make financial contributions to the voluntary trust fund, as well as the special scholarship fund, and to make other contributions to the Regular Process;",
    "332": "Requests the Secretary-General to convene, in 2024, up to two meetings of the Ad Hoc Working Group of the Whole of no more than two days of total duration each; XIII Regional cooperation",
    "333": "Notes with appreciation efforts and initiatives at the regional level, in various regions, to further the implementation of the Convention and to respond, including through capacity-building, to issues related to maritime safety and security, the conservation and sustainable use of living marine resources, the protection and preservation of the marine environment and the conservation and sustainable use of marine biodiversity;",
    "334": "Invites States and international organizations to enhance their cooperation to better protect the marine environment;",
    "335": "Notes the Caribbean-focused Assistance Fund, which is intended to facilitate, mainly through technical assistance, the voluntary undertaking of maritime delimitation negotiations between Caribbean States, notes once again the Fund for Peace: Peaceful Settlement of Territorial Disputes, established by the General Assembly of the Organization of American States in 2000 as a primary mechanism, given its broader regional scope, for the prevention and resolution of pending territorial, land border and maritime boundary disputes, and calls upon States and others in a position to do so to contribute to these funds;",
    "336": "Recalls the outcome document of the third International Conference on Small Island Developing States, the SIDS Accelerated Modalities of Action (SAMOA) Pathway150 and the modalities set forth for strengthened action on a range of small island developing States challenges and priorities, including challenges related to the conservation and sustainable use of marine resources, and the preservation of the marine environment, and in this regard welcomes the convening of the high-level midterm review of the SAMOA Pathway in September 2019 and the adoption of its political declaration,151 which notes the importance of oceans, seas and marine resources to small island developing States and acknowledges their efforts to develop and implement strategies for the conservation and sustainable use of the ocean and its resources, and reaffirms its commitment to work with small island developing States towards the full implementation of the SAMOA Pathway to ensure its success;",
    "337": "Encourages States and scientific communities to continue to strengthen their cooperation on new knowledge about the linkages between changes in the global climate system and the environment of polar regions;",
    "338": "Acknowledges the important contributions to scientific understanding of the marine environment and its resources, as well as the scientific advice for their sustainable use, provided by the International Council for the Exploration of the Sea in its wide-ranging cooperation with organizations at the regional level under the Convention for the International Council for the Exploration of the Sea, 1964, 152 and by the North Pacific Marine Science Organization under the Convention for a North Pacific Marine Science Organization, 1992;",
    "339": "Welcomes regional cooperation, and in this regard notes the Pacific Oceanscape Framework as an initiative to enhance cooperation among coastal States in the Pacific island region to foster marine conservation and sustainable development;",
    "340": "Recalls, in this regard, the endorsement of the Pacific Islands Forum leaders on 6 August 2021 at the fifty-first Pacific Islands Forum of a declaration on preserving maritime zones in the face of climate change-related sea level rise, and of the Heads of State and Government of the Alliance of Small Island States on 22 September 2021 of the Leaders\u2019 Declaration addressing, inter alia, the relationship between climate change-related sea level rise and Forum and Alliance members\u2019 maritime zones in response to long-standing concerns in the face of climate change- related sea level rise;",
    "341": "Notes the endorsement of the Pacific Islands Forum leaders on 9 November 2023 at the fifty-second Pacific Islands Forum of a declaration on the continuity of statehood and the protection of persons in the face of climate change- related sea level rise addressing, inter alia, the relationship between climate change- related sea level rise and Forum members\u2019 statehood, sovereignty and protection of persons;",
    "342": "Notes with appreciation the various cooperative efforts displayed by States at the regional and subregional levels, and in this regard welcomes initiatives such as the Integrated Assessment and Management of the Gulf of Mexico Large Marine Ecosystem;",
    "343": "Acknowledges the cooperation among the members of the Zone of Peace and Cooperation of the South Atlantic and the principles enshrined under that initiative, and notes the adoption of the Mindelo Declaration and the Mindelo Plan of Action during the eighth ministerial meeting of the Zone of Peace and Cooperation of the South Atlantic, held in Cabo Verde on 17 and 18 April 2023;",
    "344": "Recalls the decision of the Assembly of the African Union in January 2015 to adopt Agenda 2063, also recalls that the African Union launched the Decade of African Seas and Oceans (2015\u20132025), and notes that the African Day of the Seas and Oceans is celebrated annually on 25 July;",
    "345": "Also recalls the Vienna Programme of Action for Landlocked Developing Countries for the Decade 2014\u20132024 adopted by the second United Nations Conference on Landlocked Developing Countries, held in Vienna from 3 to 5 November 2014,153 following the comprehensive 10-year review of the implementation of the Almaty Programme of Action: Addressing the Special Needs of Landlocked Developing Countries within a New Global Framework for Transit Transport Cooperation for Landlocked and Transit Developing Countries, 154 notes the need for cooperation to address the development needs and challenges faced by landlocked developing countries associated with, inter alia, their lack of direct territorial access to the sea, remoteness and isolation from world markets, in line with the objectives of the Vienna Programme of Action, and recalls the adoption of the road map for the accelerated implementation of the Vienna Programme of Action in the remaining five years;",
    "346": "Notes the adoption of the Leaders\u2019 Declaration on the Solidarity of the Archipelagic and Island States Forum at the convening of the first High-Level Meeting of the Archipelagic and Island States Forum in Bali, Indonesia, on 11 October 2023, that expresses the commitment of archipelagic and island nations to collaborate in addressing common maritime and ocean issues, among others, climate change, sustainable ocean-based economy, and the marine environment, to achieve sustainability of the ocean for future generations;",
    "347": "Also notes the efforts of the Sargasso Sea Commission, led by the Government of Bermuda, to raise awareness of the ecological significance of the Sargasso Sea;",
    "348": "Further notes the Agreement on Enhancing International Arctic Scientific Cooperation, negotiated under the auspices of the Arctic Council, and notes that its implementation will increase the development of scientific knowledge about the region;",
    "349": "Notes the cooperation between the OSPAR Commission established by the Convention for the Protection of the Marine Environment of the North-East Atlantic155 and the North-East Atlantic Fisheries Commission;",
    "350": "Also notes the decision adopted by the Assembly of the Intergovernmental Oceanographic Commission at its thirty-second session to establish the Intergovernmental Oceanographic Commission Subcommission for the Central Indian Ocean with the purpose of promoting international cooperation and coordinating programmes in research, services, and capacity development; 156 XIV Open-ended Informal Consultative Process on Oceans and the Law of the Sea",
    "351": "Welcomes the report of the Co-Chairs on the work of the Informal Consultative Process at its twenty-third meeting, which focused on the theme of new maritime technologies: challenges and opportunities;",
    "352": "Notes the discussions at the twenty-third meeting of the Informal Consultative Process, from 5 to 9 June 2023, on the theme of new maritime technologies: challenges and opportunities, during which delegations and other participants, inter alia, highlighted the potential benefits of new maritime technologies in addressing threats facing the ocean, facilitating ocean observing, building resilient oceans and coastal communities, mitigating the impacts of climate change, efforts towards reducing the greenhouse gas emissions of the shipping sector, countering pollution, developing renewable energy sources, improving data collection to enhance marine science and achieve the goals of the United Nations Decade of Ocean Science for Sustainable Development, and for meeting the targets of the 2030 Agenda for Sustainable Development, in particular Sustainable Development Goal 14, noted challenges arising with respect to the introduction and use of such technologies, and recognized the vital role of national, regional and global cooperation in ensuring that all States can benefit from the sustainable development of the ocean, including the crucial importance of targeted capacity-building to enable developing States to benefit from the opportunities presented by these new technologies;",
    "353": "Recognizes the role of the Informal Consultative Process as a unique forum for comprehensive discussions on issues related to oceans and the law of the sea, consistent with the framework provided by the Convention and chapter 17 of Agenda 21, and in integrating knowledge, the exchange of opinions among multiple stakeholders and coordination among competent agencies, and enhancing awareness of topics, including emerging issues, while promoting the three pillars of sustainable development;",
    "354": "Welcomes the work of the Informal Consultative Process and its contribution to improving coordination and cooperation between States and strengthening the annual debate of the General Assembly on oceans and the law of the sea by effectively drawing attention to key issues and current trends, and also welcomes efforts to improve and focus such work;",
    "355": "Recalls the need to strengthen and improve the efficiency of the Informal Consultative Process, and encourages States, intergovernmental organizations and programmes to provide guidance to the Co-Chairs to this effect, particularly before and during the preparatory meeting for the Informal Consultative Process;",
    "356": "Decides to continue the Informal Consultative Process for the next four years, in accordance with resolution 54/33, with a further review of its effectiveness at its eighty-second session;",
    "357": "Requests the Secretary-General to convene, in accordance with paragraphs 2 and 3 of resolution 54/33, the twenty-fourth meeting of the Informal Consultative Process, in New York for eight meetings during the week of 18 to 21 June 2024, and to convene the twenty-fifth, twenty-sixth and twenty-seventh meetings for eight meetings each in 2025, 2026 and 2027, respectively, to provide it with the facilities necessary for the performance of its work, including documentation, to also convene informal preparatory meetings, and to arrange for support to be provided by the Division, in cooperation with other relevant parts of the Secretariat, as appropriate;",
    "358": "Also requests the Secretary-General to provide support for the convening of a twenty-fifth meeting of the Informal Consultative Process for eight meetings in 2025, in accordance with paragraphs 2 and 3 of resolution 54/33, with the facilities necessary for the performance of its work, including documentation;",
    "359": "Expresses its continued serious concern regarding the lack of resources available in the voluntary trust fund established pursuant to resolution 55/7 for the purpose of assisting developing countries, in particular least developed countries, small island developing States and landlocked developing States, in attending the meetings of the Informal Consultative Process, and urges States, international financial institutions, donor agencies, intergovernmental organizations, non-governmental organizations and natural and juridical persons to make additional contributions to the trust fund;",
    "360": " during the meetings of the Informal Consultative Process shall receive priority consideration in the disbursement of funds from the voluntary trust fund established pursuant to resolution 55/7 in order to cover their costs of travel and daily subsistence allowance;",
    "361": "Also decides that, in its deliberations on the report of the Secretary- General on oceans and the law of the sea, the Informal Consultative Process shall focus its discussions at its twenty-fourth meeting, in 2024, on the theme \u201cThe ocean as a source of sustainable food\u201d, and at its twenty-sixth meeting, in 2026, on the theme \u201cMarine ecosystem restoration\u201d; XV Coordination and cooperation",
    "362": "Encourages States to work closely with and through international organizations, funds and programmes, as well as the specialized agencies of the United Nations system and relevant international conventions, to identify emerging areas of focus for improved coordination and cooperation and how best to address these issues;",
    "363": "Expresses its concern at the desecration of graves at sea and the looting of wrecks of ships constituting such graves, and calls upon States to cooperate, as appropriate, to prevent the looting and desecration of wrecks of ships constituting graves in order to ensure that proper respect is given to all human remains located in maritime waters, consistent with international law, including, as appropriate, the 2001 Convention on the Protection of the Underwater Cultural Heritage, among parties thereto;",
    "364": "Encourages bodies established by the Convention to strengthen coordination and cooperation, as appropriate, in fulfilling their respective mandates;",
    "365": "Requests the Secretary-General to bring the present resolution to the attention of heads of intergovernmental organizations, the specialized agencies, funds and programmes of the United Nations engaged in activities relating to ocean affairs and the law of the sea, as well as funding institutions, and underlines the importance of their constructive and timely input for the report of the Secretary-General on oceans and the law of the sea and of their participation in relevant meetings and processes;",
    "366": "Welcomes the work done by the secretariats of relevant United Nations specialized agencies, programmes, funds and bodies and the secretariats of related organizations and conventions to enhance inter-agency coordination and cooperation on ocean issues, including, where appropriate, through UN-Oceans, the inter-agency coordination mechanism on ocean and coastal issues within the United Nations system;",
    "367": " identifying possible areas of collaboration and synergy, as well as for travel associated with the performance of the functions of the focal point; XVI Activities of the Division for Ocean Affairs and the Law of the Sea",
    "368": "Expresses its appreciation to the Secretary-General for the annual reports on oceans and the law of the sea, prepared by the Division, as well as for the other activities of the Division, which reflect the high standard of assistance provided to Member States by the Division;",
    "369": "Notes with satisfaction the fifteenth observance by the United Nations of World Oceans Day, in 2023,157 recognizes with appreciation the efforts deployed by the Division in this regard, invites States, international financial institutions, donor agencies, intergovernmental organizations, non-governmental organizations and natural and juridical persons to support the future observance of World Oceans Day, including by making voluntary financial or other contributions, and invites the Division to continue to promote and facilitate international cooperation on the law of the sea and ocean affairs in the context of the future observance of World Oceans Day, as well as through its participation in other events;",
    "370": "Notes the continuously growing responsibilities and functions entrusted to the Secretary-General in the Convention and in the related resolutions of the General Assembly, and in this context the unprecedented substantial increase in activities of the Division, in particular in view of the growing number of requests to the Division for additional outputs and servicing of meetings, the provision of technical assistance and capacity-building, and requests the Secretary-General to ensure the allocation of appropriate resources to the Division for the performance of its activities under the approved budget for the Organization;",
    "371": "Requests the Secretary-General to continue the publication activities of the Division, and in particular to publish a combined edition of the Convention, the Part XI Agreement, the Fish Stocks Agreement; and the Agreement under the United Nations Convention on the Law of the Sea on the Conservation and Sustainable Use of Marine Biological Diversity of Areas beyond National Jurisdiction 158 and publish the Law of the Sea Bulletin; XVII Seventy-ninth session of the General Assembly",
    "372": "Requests the Secretary-General to prepare reports for consideration by the General Assembly at its seventy-ninth session, namely a report on developments and issues relating to ocean affairs and the law of the sea, including the implementation of the present resolution, in accordance with resolutions 49/28 of 6 December 1994, 52/26 of 26 November 1997 and 54/33, and a report on the theme that is the focus of the twenty-fourth meeting of the Informal Consultative Process;",
    "373": "Emphasizes the critical role of the annual reports of the Secretary-General, which integrate information on developments relating to the implementation of the Convention and the work of the Organization, its specialized agencies and other institutions in the field of ocean affairs and the law of the sea at the global and regional levels, and as a result constitute the basis for the annual consideration and review of developments relating to ocean affairs and the law of the sea by the General Assembly as the global institution having the competence to undertake such a review;",
    "374": "Notes that the reports referred to in paragraph 372 above will also be submitted to States Parties pursuant to article 319 of the Convention regarding issues of a general nature that have arisen with respect to the Convention;",
    "375": "Also notes the desire to further improve the efficiency of and effective participation of delegations in the informal consultations concerning the annual General Assembly resolution on oceans and the law of the sea, decides that the period of the informal consultations on that resolution should not exceed a maximum of nine days in total and that the consultations should be scheduled in such a way that the Division has sufficient time to produce the report on developments and issues relating to ocean affairs and the law of the sea referred to in paragraph 372 above, requests the Secretary-General to continue to provide support to the consultations through the Division, and encourages States to submit proposals for the resolution to the Coordinator of the informal consultations no later than one week before the first day of the first round of the informal consultations;",
    "376": "Decides to include in the provisional agenda of its seventy-ninth session the item entitled \u201cOceans and the law of the sea\u201d."
  },
  "agenda_items": [
    "Item 75"
  ],
  "symbol_references": [
    "A/78/L.15"
  ]
}