{
  "symbol": "A/RES/72/23",
  "filename": "A_RES_72_23.pdf",
  "title": "72/23. Prohibition of the development and manufacture of new types of weapons of mass destruction and new systems of such weapons: report of the Conference on Disarmament",
  "text": "United Nations \nA/RES/72/23\n \n \nGeneral Assembly \nDistr.: General \n11 December 2017 \n \n17-21691 (E)    131217 \n*1721691* \n \n \nSeventy-second session \nAgenda item 93 \n \n \n \n Resolution adopted by the General Assembly \non 4 December 2017 \n \n \n \n \n[on the report of the First Committee (A/72/403)] \n \n \n \n72/23. Prohibition of the development and manufacture of new types \nof weapons of mass destruction and new systems of such \nweapons: report of the Conference on Disarmament \n \n \n \nThe General Assembly, \n \nRecalling its previous resolutions on the prohibition of the development and \nmanufacture of new types of weapons of mass destruction and new systems of such \nweapons, \n \nRecalling also its resolutions 51/37 of 10 December 1996, 54/44 of \n1 December 1999, 57/50 of 22 November 2002, 60/46 of 8 December 2005, 63/36 \nof 2 December 2008, 66/21 of 2 December 2011 and 69/27 of 2 December 2014 \nrelating to the prohibition of the development and manufacture of new types of \nweapons of mass destruction and new systems of such weapons, \n \nRecalling further paragraph 77 of the Final Document of the Tenth Special \nSession of the General Assembly,1 \n \nDetermined to prevent the emergence of new types of weapons of mass \ndestruction that have characteristics comparable in destructive effect to those of \nweapons of mass destruction identified in the definition of weapons of mass \ndestruction adopted by the United Nations in 1948,2 \n \nNoting with appreciation the discussions which have been held in the \nConference on Disarmament under the item entitled \u201cNew types of weapons of mass \ndestruction and new systems of such weapons; radiological weapons\u201d, 3 \n__________________ \n \n1 Resolution S-10/2. \n \n2 The definition was adopted by the Commission for Conventional Armaments (see S/C.3/32/Rev.1 \nand S/C.3/32/Rev.1/Corr.1). \n \n3 Official Records of the General Assembly, Sixty-fourth Session, Supplement No. 27 (A/64/27), \nchap. III, sect. E; ibid., Sixty-fifth Session, Supplement No. 27 (A/65/27), chap. III, sect. E; ibid., \nSixty-sixth Session, Supplement No. 27 (A/66/27), chap. III, sect. E; ibid., Sixty-seventh Session, \nSupplement No. 27 (A/67/27), chap. III, sect. E; ibid., Sixty-eighth Session, Supplement No. 27 \n(A/68/27), chap. III, sect. E; ibid., Sixty-ninth Session, Supplement No. 27 (A/69/27), chap. III, \nsect. E; ibid., Seventieth Session, Supplement No. 27 (A/70/27), chap. III, sect. E; ibid., Seventy-\nfirst Session, Supplement No. 27 (A/71/27), chap. III, sect. E; and ibid., Seventy-second Session, \nSupplement No. 27 (A/72/27), chap. III, sect. E. \n\nA/RES/72/23 \nProhibition of the development and manufacture of new types of weapons of mass destruction \nand new systems of such weapons: report of the Conference on Disarmament\n \n17-21691 \n2/2 \n \n \nNoting the desirability of keeping the matter under review, as appropriate, \n \n1. \nReaffirms that effective measures should be taken to prevent the \nemergence of new types of weapons of mass destruction; \n \n2. \nRequests the Conference on Disarmament, without prejudice to further \noverview of its agenda, to keep the matter under review, as appropriate, with a view \nto making, when necessary, recommendations on undertaking specific negotiations \non identified types of such weapons; \n \n3. \nCalls upon all States, immediately following any recommendations of \nthe Conference on Disarmament, to give favourable consideration to those \nrecommendations; \n \n4. \nRequests the Secretary-General to transmit to the Conference on \nDisarmament all documents relating to the consideration of this item by the General \nAssembly at its seventy-second session; \n \n5. \nRequests the Conference on Disarmament to report the results of any \nconsideration of the matter in its annual reports to the General Assembly; \n \n6. \nDecides to include in the provisional agenda of its seventy-fifth session \nthe item entitled \u201cProhibition of the development and manufacture of new types of \nweapons of mass destruction and new systems of such weapons: report of the \nConference on Disarmament\u201d. \n \n62nd plenary meeting  \n4 December 2017 \n \n",
  "paragraphs": {
    "1": "Reaffirms that effective measures should be taken to prevent the emergence of new types of weapons of mass destruction;",
    "2": "Requests the Conference on Disarmament, without prejudice to further overview of its agenda, to keep the matter under review, as appropriate, with a view to making, when necessary, recommendations on undertaking specific negotiations on identified types of such weapons;",
    "3": "Calls upon all States, immediately following any recommendations of the Conference on Disarmament, to give favourable consideration to those recommendations;",
    "4": "Requests the Secretary-General to transmit to the Conference on Disarmament all documents relating to the consideration of this item by the General Assembly at its seventy-second session;",
    "5": "Requests the Conference on Disarmament to report the results of any consideration of the matter in its annual reports to the General Assembly;",
    "6": "Decides to include in the provisional agenda of its seventy-fifth session the item entitled \u201cProhibition of the development and manufacture of new types of weapons of mass destruction and new systems of such weapons: report of the Conference on Disarmament\u201d."
  },
  "agenda_items": [
    "Item 93"
  ],
  "symbol_references": []
}