{
  "symbol": "A/RES/75/300",
  "filename": "A_RES_75_300.pdf",
  "title": "75/300. Financing of the United Nations Organization Stabilization Mission in the Democratic Republic of the Congo",
  "text": "United Nations \nA/RES/75/300 \n \n \nGeneral Assembly \nDistr.: General \n8 July 2021 \n \n21-09014 (E)    090721     \n*2109014* \n \n \nSeventy-fifth session \nAgenda item 159 \nFinancing of the United Nations Organization Stabilization \nMission in the Democratic Republic of the Congo \n \n \n \n \n Resolution adopted by the General Assembly \non 30 June 2021 \n \n \n \n \n[on the report of the Fifth Committee (A/75/940, para. 6)]  \n \n \n 75/300. Financing of the United Nations Organization Stabilization \nMission in the Democratic Republic of the Congo \n \n \n \nThe General Assembly, \n \nHaving considered the reports of the Secretary-General on the financing of the \nUnited Nations Organization Stabilization Mission in the Democratic Republic of the \nCongo1 and the related report of the Advisory Committee on Administrative and \nBudgetary Questions,2  \n \nRecalling Security Council resolution 1925 (2010) of 28 May 2010, by which \nthe Council decided that, as from 1 July 2010, the United Nations Organization \nMission in the Democratic Republic of the Congo would bear the title \u201cUnited \nNations Organization Stabilization Mission in the Democratic Republic of the \nCongo\u201d, and recalling also the subsequent resolutions by which the Council extended \nthe mandate of the Mission, the latest of which was resolution 2556 (2020) of \n18 December 2020, by which the Council extended the mandate of the Mission until \n20 December 2021, \n \nRecalling also its resolution 54/260 A of 7 April 2000 on the financing of the \nMission and its subsequent resolutions thereon, the latest of which was resolution \n74/286 of 30 June 2020, as well as its decision 74/571 of 3 September 2020, \n \nRecalling further its resolution 58/315 of 1 July 2004, \n \nReaffirming the general principles underlying the financing of United Nations \npeacekeeping operations, as stated in its resolutions 1874 (S-IV) of 27 June 1963, \n3101 (XXVIII) of 11 December 1973 and 55/235 of 23 December 2000, \n__________________ \n \n1  A/75/605 and A/75/769. \n \n2  A/75/822/Add.6. \n\nA/RES/75/300 \nFinancing of the United Nations Organization Stabilization Mission \nin the Democratic Republic of the Congo\n \n21-09014\n2/8 \n \n \nNoting with appreciation that voluntary contributions have been made to the \nMission, \n \nMindful of the fact that it is essential to provide the Mission with the financial \nresources necessary to enable it to fulfil its responsibilities under the relevant \nresolutions of the Security Council, \n \n1. \nRequests the Secretary-General to entrust the Head of Mission with the \ntask of formulating future budget proposals in full accordance with the provisions of \nits resolutions 59/296 of 22 June 2005, 60/266 of 30 June 2006, 61/276 of 29 June \n2007, 64/269 of 24 June 2010, 65/289 of 30 June 2011, 66/264 of 21 June 2012, \n69/307 of 25 June 2015 and 70/286 of 17 June 2016, as well as other relevant \nresolutions; \n \n2. \nTakes note of the status of contributions to the United Nations Organization \nStabilization Mission in the Democratic Republic of the Congo as at 30 April 2021, \nincluding the contributions outstanding in the amount of 428,840,200 United States \ndollars, representing some 1.9 per cent of the total assessed contributions, notes with \nconcern that only 89 Member States have paid their assessed contributions in full, and \nurges all other Member States, in particular those in arrears, to ensure payment of \ntheir outstanding assessed contributions; \n \n3. \nExpresses its appreciation to those Member States that have paid their \nassessed contributions in full, and urges all other Member States to make every \npossible effort to ensure payment of their assessed contributions to the Mission in \nfull; \n \n4. \nExpresses concern at the financial situation with regard to peacekeeping \nactivities, in particular as regards the reimbursements to troop contributors that bear \nadditional burdens owing to overdue payments by Member States of their \nassessments; \n \n5. \nEmphasizes that all future and existing peacekeeping missions shall be \ngiven equal and non-discriminatory treatment in respect of financial and \nadministrative arrangements; \n \n6. \nAlso emphasizes that all peacekeeping missions shall be provided with \nadequate resources for the effective and efficient discharge of their respective \nmandates; \n \n7. \nRequests the Secretary-General to ensure that proposed peacekeeping \nbudgets are based on the relevant legislative mandates; \n \n8. \nEndorses the conclusions and recommendations contained in the report of \nthe Advisory Committee on Administrative and Budgetary Questions, subject to the \nprovisions of the present resolution, and requests the Secretary-General to ensure \ntheir full implementation; \n \n9. \nNotes with appreciation the support of the Government of the Democratic \nRepublic of the Congo in facilitating the work of the Mission; \n \n10. Recalls paragraph 29 of the report of the Advisory Committee, and decides \nto further abolish one national General Service post of Facilities Management \nAssistant in the Engineering Section that will have been vacant for 24 months or \nlonger by the end of the 2020/21 budget period;  \n \n11. Takes note of paragraph 21 of the report of the Advisory Committee, and \napproves the establishment of the D-1 position of Principal Coordination Officer in \nthe Stabilization Support Section; \n\nFinancing of the United Nations Organization Stabilization Mission \nin the Democratic Republic of the Congo \nA/RES/75/300\n \n3/8\n21-09014 \n \n \n12. Notes with concern the shortcomings in partnership operations between \nthe Mine Action Service and the United Nations Office for Project Services, and \nrequests the Secretary-General to conduct an independent review on the use of the \nservices of the Office and the partners selected to implement mine action activities, \nincluding an assessment of the comparative advantage of each mission in the delivery \nof those activities, and to submit the results of the analysis in the context of his report \nat the seventy-seventh session; \n \n13. Reiterates its grave concern about the continued threat to life, health, \nsafety and security caused by the coronavirus disease (COVID-19) pandemic and the \nimportance of ensuring the safety, security and health of peacekeeping personnel, \nincluding through the use of safe and effective vaccines for civilian and uniformed \npersonnel, maintaining the continuity of mandate delivery, including protection of \ncivilians, minimizing the risk of mission activities causing the virus to spread and, \nwhere appropriate and within mandates, supporting national authorities, upon their \nrequest, in their response to COVID-19, in collaboration with the Resident \nCoordinator and other United Nations entities in the country; \n \n14. Notes the measures adopted to mitigate the effect of the COVID-19 \npandemic on peacekeeping operations, including facilitating the continued \nimplementation of mission mandates while ensuring the health and safety of \npeacekeeping personnel and local communities in the host country, and requests the \nSecretary-General to provide updated information on the impact of the pandemic, the \nlessons learned, best practices and how the mission improved its preparedness and \nresilience and collaborated with the host Government and regional and subregional \nactors in response to the pandemic in the context of the next performance report and \nbudget submission for the Mission; \n \n15. Notes with concern the mid- and long-term impact of the COVID-19 \npandemic on countries, regions and subregions in conflict, and emphasizes the \nimportance of United Nations peacekeeping operations, where appropriate and within \ntheir respective mandates, coordinating with national authorities and other United \nNations entities in promoting post-conflict reconstruction, peacebuilding and post-\npandemic recovery of countries and regions in conflict, especially those in Africa; \n \n16. Recalls paragraphs 16 and 18 of its resolution 69/273 of 2 April 2015, and \nin this regard reiterates its request to the Secretary-General that he continue to explore \nadditional innovative ways to promote procurement from developing countries and \ncountries with economies in transition at Headquarters and field offices and to \nencourage interested local vendors to apply for registration on the Secretariat vendor \nroster, with a view to broadening its geographical base; \n \n17. Encourages the Secretary-General to utilize local materials, capacity and \nknowledge in the implementation of construction projects for peacekeeping \noperations, in compliance with the United Nations Procurement Manual; \n \n18. Requests the Secretary-General to establish clear frameworks and \nguidelines to determine the solicitation procedure, whether invitation to bid or request \nfor proposal, to be utilized for, inter alia, acquiring different types of goods and \nservices, including aviation services, and to update the United Nations Procurement \nManual accordingly; \n \n19. Also requests the Secretary-General to take measures to ensure that the \nOrganization conforms to best practices in public procurement with respect to \ntransparency, including by placing additional information in the public domain on the \noutcome of procurement exercises conducted, including in the area of aviation \nservices, so as to further increase the transparency of the procurement operations of \nthe Organization, and to update the United Nations Procurement Manual accordingly; \n\nA/RES/75/300 \nFinancing of the United Nations Organization Stabilization Mission \nin the Democratic Republic of the Congo\n \n21-09014\n4/8 \n \n \n20. Recognizes the important role played by regional and subregional actors \nfor peacekeeping operations, and in this regard encourages the Secretary-General to \ncontinue to deepen the partnership, cooperation and coordination of the United \nNations with regional and subregional actors, in accordance with relevant mandates, \nand to provide information on such deepened engagement in the context of his next \nreport; \n \n21. Underlines the important contribution that programmatic activities make \nto the implementation of the mandates of the Mission, including for the prevention \nand resolution of conflicts, and that all such activities must be directly linked to the \nmandates of the Mission; \n \n22. Requests the Secretary-General to ensure that the Mission is responsible \nand accountable for the use of its programmatic funds, in line with relevant guidance \nand bearing in mind the specific context in which the Mission operates, and to include, \nin his next budget submission and performance report, detailed information on the \nprogrammatic activities of the Mission, including on how those activities have \ncontributed to the implementation of mission mandates, on the linkage to the \nmandates, on the implementing entities and on the performance by the Mission of \nappropriate oversight; \n \n23. Reaffirms the provisions of section XVIII of its resolution 61/276, further \nrecognizes the important role played by quick-impact projects in supporting the \nimplementation of mission mandates, stresses the need for the timely, responsible and \naccountable implementation of all such projects, and requests the Secretary-General \nto enhance their impact while addressing underlying challenges; \n \n24. Reiterates that the use of external consultants should be kept to an absolute \nminimum and that the Organization should utilize its in-house capacity to perform \ncore activities or to fulfil functions that are recurrent over the long term; \n \n25. Stresses the importance of prioritizing the safety and security of United \nNations personnel as well as protection of civilians activities, in the context of \nchallenging security situations, and requests that all peacekeeping missions be \nprovided with adequate resources for the effective and efficient discharge of their \nrespective mandates, including the protection of civilians where mandated; \n \n26. Recognizes the increasing security challenges faced by United Nations \npeacekeepers, re-emphasizes the importance of improving the safety and security of \npeacekeepers and mission personnel in an integrated manner, including enhanced \ntraining and capacity-building, force protection planning for United Nations camps \nand situational awareness, requests the Secretary-General and host Governments to \nfulfil the responsibilities under relevant resolutions of the General Assembly and the \nSecurity Council to improve the safety and security of United Nations peacekeepers \nand mission personnel, and requests the Secretary-General to report thereon in his \nnext report, and notes with appreciation the efforts of Member States in promoting \nthe safety and security of United Nations peacekeepers in this regard; \n \n27. Reiterates its concern about the high number of vacancies in civilian \nstaffing, further reiterates its request to the Secretary-General to ensure that vacant \nposts are filled expeditiously, and requests the Secretary-General to review the posts \nthat have been vacant for 24 months or longer and to propose in his next budget \nsubmission either their retention, with clear justification of need, or their abolishment; \n \n28. Requests the Secretary-General to consider options for greater \nnationalization of functions when formulating budget submissions, commensurate \nwith mission mandates and requirements; \n\nFinancing of the United Nations Organization Stabilization Mission \nin the Democratic Republic of the Congo \nA/RES/75/300\n \n5/8\n21-09014 \n \n \n29. Requests that the Secretary-General continue his ongoing efforts to ensure \nthe attainment of equitable geographical distribution in the Secretariat and to ensure \nas wide a geographical distribution of staff as possible in all departments and offices \nand at all levels, including at the Director and higher levels, of the Secretariat, and \nrequests him to report thereon in his next overview report; \n \n30. Expresses its deep concern at the delay in the settlement of claims in \nrespect of death and disability, and reiterates its request to the Secretary-General to \nsettle death and disability claims as expeditiously as possible, but no later than three \nmonths from the date of submission of a claim; \n \n31. Notes the ongoing development of impact-based performance indicators \nas part of the implementation of the Comprehensive Performance Assessment System, \nand in this regard requests the Secretary-General in his next report to provide \ninformation on how the indicators will measure the performance by the Mission of \nmandated tasks and the impact of resource allocation on that performance, as well as \nhow the indicators will contribute to the identification of the resources required for \neach mandated task; \n \n32. Requests the Secretary-General to provide in his next report an execution \nplan for, and analysis of, the implementation of the new Comprehensive Performance \nAssessment System, including on its correlation with mission planning and budget \nformulation, in order to facilitate consideration by the General Assembly of resource \nrequests for implementation of the System; \n \n33. Notes the progress made in the implementation of the multi-year \nenvironmental strategy to reduce the footprint of peacekeeping operations, and \nrequests the Secretary-General to enhance measures for the implementation of the \nstrategy in all peacekeeping missions, in line with the five pillars of the strategy and \nin accordance with the legislative mandates and particular conditions on the ground \nand in full compliance with the relevant rules and regulations, and to report thereon \nin the context of his next overview report; \n \n34. Also notes the recommendations of the Advisory Committee on the use of \nvirtual platforms and cost recovery of air transportation of non-United Nations \npersonnel, and urges that their implementation should take into consideration the \nspecific contexts for each mission without impacting mandate implementation; \n \n35. Requests the Secretary-General to ensure that United Nations \npeacekeeping mission staff has the capacity to provide technical oversight of the use \nof unmanned aerial and aircraft systems technologies; \n \n36. Emphasizes the importance of the accountability system of the Secretariat, \nand requests the Secretary-General to continue to strengthen risk management, \ntransparency and internal controls in the management of peacekeeping budgets, in \norder to facilitate mandate implementation, and to report thereon in his next report; \n \n37. Also emphasizes the importance of overall budgetary performance in \npeacekeeping operations, and requests the Secretary-General to continue to improve \noversight of the activities of peacekeeping missions, and implement the \nrecommendations of the relevant oversight bodies, and in this regard to avoid \ndeficiencies in management and related economic losses with the aim of ensuring full \ncompliance with financial regulations and rules, while giving due regard to the \nguidance and recommendations of the General Assembly, and to report thereon in the \ncontext of the performance reports; \n \n38. Highlights the importance of the women and peace and security agenda, \nand underlines that full implementation of the agenda by the mission can contribute \nto achieving sustainable peace and political solutions; \n\nA/RES/75/300 \nFinancing of the United Nations Organization Stabilization Mission \nin the Democratic Republic of the Congo\n \n21-09014\n6/8 \n \n \n39. Reiterates the importance of thorough, responsive and advance planning \nfor any mission transition process based on operational drawdown and transition plans \nthat draw on lessons learned and take account of specific circumstances, in \nconsultation with all relevant United Nations system entities, relevant regional and \nsubregional organizations and the host Government, to ensure a timely, efficient and \neffective transfer of relevant roles, responsibilities and activities, the disposal of \nassets and property in full compliance with relevant regulations and rules, at minimal \nloss and at best feasible cost-effective use, when responding to changes in the \nmandate which require the mission to consider options for, prepare or commence \nmission drawdown or liquidation; \n \n40. Encourages the Office of Internal Oversight Services to continue to ensure \nthe oversight, through audits and investigations, of United Nations peacekeeping \nmissions that are closing and to report thereon in its next report; \n \n41. Expresses concern over the allegations of sexual exploitation and abuse \nreported in peacekeeping missions, and requests the Secretary-General to continue to \nimplement his zero-tolerance policy on sexual exploitation and abuse with regard to \nall civilian, military and police personnel, and to report thereon in the context of his \nnext report on cross-cutting issues;  \n \n42. Recognizes the important role of the Mission in the protection of civilians, \nand requests the Secretary-General to continue to engage with the Mission\u2019s special \nunits with the aim of helping them to effectively achieve the set objectives of the \nMission;  \n \n43. Requests the Secretary-General to ensure the full implementation of the \nrelevant provisions of its resolutions 59/296, 60/266, 61/276, 64/269, 65/289, 66/264, \n69/307 and 70/286; \n \n44. Also requests the Secretary-General to take all action necessary to ensure \nthat the Mission is administered with a maximum of efficiency and economy; \n \n \n \nBudget performance report for the period from 1 July 2019 to 30 June 2020 \n \n \n45. Takes note of the report of the Secretary-General on the budget \nperformance of the Mission for the period from 1 July 2019 to 30 June 2020; 3  \n \n46. Decides to appropriate to the special account for the United Nations \nOrganization Stabilization Mission in the Democratic Republic of the Congo the \namount of 23,839,200 dollars for the maintenance of the Mission, previously \nauthorized by the Advisory Committee for the period from 1 July 2019 to 30 June \n2020 under the terms of section VI of its resolution 64/269, in addition to the amount \nof 1,012,252,800 dollars previously approved for the same period under the terms of \nits resolution 73/315 of 3 July 2019 and its decision 73/555 of 3 July 2019; \n \n \n \nFinancing of the additional appropriation for the period from 1 July 2019 to \n30 June 2020 \n \n \n47. Decides, taking into account the amount of 1,012,252,800 dollars \npreviously apportioned under the terms of its resolution 73/315 and its decision \n73/555 for the period from 1 July 2019 to 30 June 2020, to apportion among Member \nStates the additional amount of 23,839,200 dollars for the maintenance of the Mission \nfor the same period, in accordance with the levels updated in its resolution 73/272 of \n22 December 2018, taking into account the scale of assessments for 2019 and 2020, \nas set out in its resolution 73/271 of 22 December 2018; \n__________________ \n \n3  A/75/605. \n\nFinancing of the United Nations Organization Stabilization Mission \nin the Democratic Republic of the Congo \nA/RES/75/300\n \n7/8\n21-09014 \n \n \n48. Also decides that there shall be set off against the apportionment among \nMember States, as provided for in paragraph 47 above, the amount of \n14,822,300 dollars, representing other revenue in respect of the financial period \nended 30 June 2020; \n \n49. Further decides that, in accordance with the provisions of its resolution \n973 (X) of 15 December 1955, there shall be set off against the apportionment among \nMember States, as provided for in paragraph 47 above, their respective share in the \nTax Equalization Fund of 5,933,100 dollars, representing the increase in the estimated \nstaff assessment income for the Mission in respect of the financial periods ended \n30 June 2019 and 30 June 2020; \n \n \n \nBudget estimates for the period from 1 July 2021 to 30 June 2022 \n \n \n50. Decides to appropriate to the special account the amount of \n1,123,346,000 dollars for the period from 1 July 2021 to 30 June 2022, inclusive of \n1,042,728,900 dollars for the maintenance of the Mission, 61,674,200 dollars for the \nsupport account for peacekeeping operations, 11,383,700 dollars for the United \nNations Logistics Base at Brindisi, Italy, and 7,559,200 dollars for the Regional \nService Centre in Entebbe, Uganda; \n \n \n \nFinancing of the appropriation for the period from 1 July 2021 to 30 June 2022 \n \n \n51. Decides \nto \napportion \namong \nMember \nStates \nthe \namount \nof \n528,094,723 dollars for the period from 1 July to 20 December 2021, in accordance \nwith the levels updated in its resolution 73/272, taking into account the scale of \nassessments for 2021, as set out in its resolution 73/271; \n \n52. Also decides that, in accordance with the provisions of its resolution \n973 (X), there shall be set off against the apportionment among Member States, as \nprovided for in paragraph 51 above, their respective share in the Tax Equalization \nFund of 16,133,519 dollars, comprising the estimated staff assessment income of \n12,802,329 dollars approved for the Mission, the prorated share of 2,413,491 dollars \nof the estimated staff assessment income approved for the support account, the \nprorated share of 554,822 dollars of the estimated staff assessment income approved \nfor the United Nations Logistics Base and the prorated share of 362,877 dollars of the \nestimated staff assessment income approved for the Regional Service Centre; \n \n53. Further decides to apportion among Member States the amount of \n33,578,277 dollars for the period from 21 to 31 December 2021, at a monthly rate of \n93,612,167 dollars, in accordance with the levels updated in its resolution 73/272, \ntaking into account the scale of assessments for 2021, as set out in its resolution \n73/271, subject to a decision of the Security Council to extend the mandate of the \nMission; \n \n54. Decides that, in accordance with the provisions of its resolution 973 (X), \nthere shall be set off against the apportionment among Member States, as provided \nfor in paragraph 53 above, their respective share in the Tax Equalization Fund of \n1,025,831 dollars, comprising the estimated staff assessment income of \n814,021 dollars approved for the Mission, the prorated share of 153,459 dollars of the \nestimated staff assessment income approved for the support account, the prorated \nshare of 35,278 dollars of the estimated staff assessment income approved for the \nUnited Nations Logistics Base and the prorated share of 23,073 dollars of the \nestimated staff assessment income approved for the Regional Service Centre; \n \n55. Also decides to apportion among Member States the amount of \n561,673,000 dollars for the period from 1 January to 30 June 2022, at a monthly rate \nof 93,612,167 dollars, in accordance with the scale of assessments for 2022 and the \n\nA/RES/75/300 \nFinancing of the United Nations Organization Stabilization Mission \nin the Democratic Republic of the Congo\n \n21-09014\n8/8 \n \nupdated levels,4 subject to a decision of the Security Council to extend the mandate \nof the Mission; \n \n56. Further decides that, in accordance with the provisions of its resolution \n973 (X), there shall be set off against the apportionment among Member States, as \nprovided for in paragraph 55 above, their respective share in the Tax Equalization \nFund of 17,159,350 dollars, comprising the estimated staff assessment income of \n13,616,350 dollars approved for the Mission, the prorated share of 2,566,950 dollars \nof the estimated staff assessment income approved for the support account, the \nprorated share of 590,100 dollars of the estimated staff assessment income approved \nfor the United Nations Logistics Base and the prorated share of 385,950 dollars of the \nestimated staff assessment income approved for the Regional Service Centre; \n \n57. Encourages the Secretary-General to continue to take additional measures \nto ensure the safety and security of all personnel participating in the Mission under \nthe auspices of the United Nations, bearing in mind paragraphs 5 and 6 of Security \nCouncil resolution 1502 (2003) of 26 August 2003; \n \n58. Invites voluntary contributions to the Mission in cash and in the form of \nservices and supplies acceptable to the Secretary-General, to be administered, as \nappropriate, in accordance with the procedure and practices established by the \nGeneral Assembly; \n \n59. Decides to include in the provisional agenda of its seventy-sixth session \nthe item entitled \u201cFinancing of the United Nations Organization Stabilization Mission \nin the Democratic Republic of the Congo\u201d.  \n \n88th plenary meeting \n30 June 2021 \n \n \n__________________ \n \n4  To be adopted by the General Assembly. \n",
  "paragraphs": {
    "1": "Requests the Secretary-General to entrust the Head of Mission with the task of formulating future budget proposals in full accordance with the provisions of its resolutions 59/296 of 22 June 2005, 60/266 of 30 June 2006, 61/276 of 29 June 2007, 64/269 of 24 June 2010, 65/289 of 30 June 2011, 66/264 of 21 June 2012, 69/307 of 25 June 2015 and 70/286 of 17 June 2016, as well as other relevant resolutions;",
    "2": "Takes note of the status of contributions to the United Nations Organization Stabilization Mission in the Democratic Republic of the Congo as at 30 April 2021, including the contributions outstanding in the amount of 428,840,200 United States dollars, representing some 1.9 per cent of the total assessed contributions, notes with concern that only 89 Member States have paid their assessed contributions in full, and urges all other Member States, in particular those in arrears, to ensure payment of their outstanding assessed contributions;",
    "3": "Expresses its appreciation to those Member States that have paid their assessed contributions in full, and urges all other Member States to make every possible effort to ensure payment of their assessed contributions to the Mission in full;",
    "4": "Expresses concern at the financial situation with regard to peacekeeping activities, in particular as regards the reimbursements to troop contributors that bear additional burdens owing to overdue payments by Member States of their assessments;",
    "5": "Emphasizes that all future and existing peacekeeping missions shall be given equal and non-discriminatory treatment in respect of financial and administrative arrangements;",
    "6": "Also emphasizes that all peacekeeping missions shall be provided with adequate resources for the effective and efficient discharge of their respective mandates;",
    "7": "Requests the Secretary-General to ensure that proposed peacekeeping budgets are based on the relevant legislative mandates;",
    "8": "Endorses the conclusions and recommendations contained in the report of the Advisory Committee on Administrative and Budgetary Questions, subject to the provisions of the present resolution, and requests the Secretary-General to ensure their full implementation;",
    "9": "Notes with appreciation the support of the Government of the Democratic Republic of the Congo in facilitating the work of the Mission;",
    "10": "Recalls paragraph 29 of the report of the Advisory Committee, and decides to further abolish one national General Service post of Facilities Management Assistant in the Engineering Section that will have been vacant for 24 months or longer by the end of the 2020/21 budget period;",
    "11": "",
    "12": "Notes with concern the shortcomings in partnership operations between the Mine Action Service and the United Nations Office for Project Services, and requests the Secretary-General to conduct an independent review on the use of the services of the Office and the partners selected to implement mine action activities, including an assessment of the comparative advantage of each mission in the delivery of those activities, and to submit the results of the analysis in the context of his report at the seventy-seventh session;",
    "13": "Reiterates its grave concern about the continued threat to life, health, safety and security caused by the coronavirus disease (COVID-19) pandemic and the importance of ensuring the safety, security and health of peacekeeping personnel, including through the use of safe and effective vaccines for civilian and uniformed personnel, maintaining the continuity of mandate delivery, including protection of civilians, minimizing the risk of mission activities causing the virus to spread and, where appropriate and within mandates, supporting national authorities, upon their request, in their response to COVID-19, in collaboration with the Resident Coordinator and other United Nations entities in the country;",
    "14": "Notes the measures adopted to mitigate the effect of the COVID-19 pandemic on peacekeeping operations, including facilitating the continued implementation of mission mandates while ensuring the health and safety of peacekeeping personnel and local communities in the host country, and requests the Secretary-General to provide updated information on the impact of the pandemic, the lessons learned, best practices and how the mission improved its preparedness and resilience and collaborated with the host Government and regional and subregional actors in response to the pandemic in the context of the next performance report and budget submission for the Mission;",
    "15": "Notes with concern the mid- and long-term impact of the COVID-19 pandemic on countries, regions and subregions in conflict, and emphasizes the importance of United Nations peacekeeping operations, where appropriate and within their respective mandates, coordinating with national authorities and other United Nations entities in promoting post-conflict reconstruction, peacebuilding and post- pandemic recovery of countries and regions in conflict, especially those in Africa;",
    "16": "Recalls paragraphs 16 and 18 of its resolution 69/273 of 2 April 2015, and in this regard reiterates its request to the Secretary-General that he continue to explore additional innovative ways to promote procurement from developing countries and countries with economies in transition at Headquarters and field offices and to encourage interested local vendors to apply for registration on the Secretariat vendor roster, with a view to broadening its geographical base;",
    "17": "Encourages the Secretary-General to utilize local materials, capacity and knowledge in the implementation of construction projects for peacekeeping operations, in compliance with the United Nations Procurement Manual;",
    "18": "Requests the Secretary-General to establish clear frameworks and guidelines to determine the solicitation procedure, whether invitation to bid or request for proposal, to be utilized for, inter alia, acquiring different types of goods and services, including aviation services, and to update the United Nations Procurement Manual accordingly;",
    "19": "",
    "20": "Recognizes the important role played by regional and subregional actors for peacekeeping operations, and in this regard encourages the Secretary-General to continue to deepen the partnership, cooperation and coordination of the United Nations with regional and subregional actors, in accordance with relevant mandates, and to provide information on such deepened engagement in the context of his next report;",
    "21": "Underlines the important contribution that programmatic activities make to the implementation of the mandates of the Mission, including for the prevention and resolution of conflicts, and that all such activities must be directly linked to the mandates of the Mission;",
    "22": "Requests the Secretary-General to ensure that the Mission is responsible and accountable for the use of its programmatic funds, in line with relevant guidance and bearing in mind the specific context in which the Mission operates, and to include, in his next budget submission and performance report, detailed information on the programmatic activities of the Mission, including on how those activities have contributed to the implementation of mission mandates, on the linkage to the mandates, on the implementing entities and on the performance by the Mission of appropriate oversight;",
    "23": "Reaffirms the provisions of section XVIII of its resolution 61/276, further recognizes the important role played by quick-impact projects in supporting the implementation of mission mandates, stresses the need for the timely, responsible and accountable implementation of all such projects, and requests the Secretary-General to enhance their impact while addressing underlying challenges;",
    "24": "Reiterates that the use of external consultants should be kept to an absolute minimum and that the Organization should utilize its in-house capacity to perform core activities or to fulfil functions that are recurrent over the long term;",
    "25": "Stresses the importance of prioritizing the safety and security of United Nations personnel as well as protection of civilians activities, in the context of challenging security situations, and requests that all peacekeeping missions be provided with adequate resources for the effective and efficient discharge of their respective mandates, including the protection of civilians where mandated;",
    "26": "Recognizes the increasing security challenges faced by United Nations peacekeepers, re-emphasizes the importance of improving the safety and security of peacekeepers and mission personnel in an integrated manner, including enhanced training and capacity-building, force protection planning for United Nations camps and situational awareness, requests the Secretary-General and host Governments to fulfil the responsibilities under relevant resolutions of the General Assembly and the Security Council to improve the safety and security of United Nations peacekeepers and mission personnel, and requests the Secretary-General to report thereon in his next report, and notes with appreciation the efforts of Member States in promoting the safety and security of United Nations peacekeepers in this regard;",
    "27": "Reiterates its concern about the high number of vacancies in civilian staffing, further reiterates its request to the Secretary-General to ensure that vacant posts are filled expeditiously, and requests the Secretary-General to review the posts that have been vacant for 24 months or longer and to propose in his next budget submission either their retention, with clear justification of need, or their abolishment;",
    "28": "",
    "29": "Requests that the Secretary-General continue his ongoing efforts to ensure the attainment of equitable geographical distribution in the Secretariat and to ensure as wide a geographical distribution of staff as possible in all departments and offices and at all levels, including at the Director and higher levels, of the Secretariat, and requests him to report thereon in his next overview report;",
    "30": "Expresses its deep concern at the delay in the settlement of claims in respect of death and disability, and reiterates its request to the Secretary-General to settle death and disability claims as expeditiously as possible, but no later than three months from the date of submission of a claim;",
    "31": "Notes the ongoing development of impact-based performance indicators as part of the implementation of the Comprehensive Performance Assessment System, and in this regard requests the Secretary-General in his next report to provide information on how the indicators will measure the performance by the Mission of mandated tasks and the impact of resource allocation on that performance, as well as how the indicators will contribute to the identification of the resources required for each mandated task;",
    "32": "Requests the Secretary-General to provide in his next report an execution plan for, and analysis of, the implementation of the new Comprehensive Performance Assessment System, including on its correlation with mission planning and budget formulation, in order to facilitate consideration by the General Assembly of resource requests for implementation of the System;",
    "33": "Notes the progress made in the implementation of the multi-year environmental strategy to reduce the footprint of peacekeeping operations, and requests the Secretary-General to enhance measures for the implementation of the strategy in all peacekeeping missions, in line with the five pillars of the strategy and in accordance with the legislative mandates and particular conditions on the ground and in full compliance with the relevant rules and regulations, and to report thereon in the context of his next overview report;",
    "34": "Also notes the recommendations of the Advisory Committee on the use of virtual platforms and cost recovery of air transportation of non-United Nations personnel, and urges that their implementation should take into consideration the specific contexts for each mission without impacting mandate implementation;",
    "35": "Requests the Secretary-General to ensure that United Nations peacekeeping mission staff has the capacity to provide technical oversight of the use of unmanned aerial and aircraft systems technologies;",
    "36": "Emphasizes the importance of the accountability system of the Secretariat, and requests the Secretary-General to continue to strengthen risk management, transparency and internal controls in the management of peacekeeping budgets, in order to facilitate mandate implementation, and to report thereon in his next report;",
    "37": "Also emphasizes the importance of overall budgetary performance in peacekeeping operations, and requests the Secretary-General to continue to improve oversight of the activities of peacekeeping missions, and implement the recommendations of the relevant oversight bodies, and in this regard to avoid deficiencies in management and related economic losses with the aim of ensuring full compliance with financial regulations and rules, while giving due regard to the guidance and recommendations of the General Assembly, and to report thereon in the context of the performance reports;",
    "38": "",
    "39": "Reiterates the importance of thorough, responsive and advance planning for any mission transition process based on operational drawdown and transition plans that draw on lessons learned and take account of specific circumstances, in consultation with all relevant United Nations system entities, relevant regional and subregional organizations and the host Government, to ensure a timely, efficient and effective transfer of relevant roles, responsibilities and activities, the disposal of assets and property in full compliance with relevant regulations and rules, at minimal loss and at best feasible cost-effective use, when responding to changes in the mandate which require the mission to consider options for, prepare or commence mission drawdown or liquidation;",
    "40": "Encourages the Office of Internal Oversight Services to continue to ensure the oversight, through audits and investigations, of United Nations peacekeeping missions that are closing and to report thereon in its next report;",
    "41": "Expresses concern over the allegations of sexual exploitation and abuse reported in peacekeeping missions, and requests the Secretary-General to continue to implement his zero-tolerance policy on sexual exploitation and abuse with regard to all civilian, military and police personnel, and to report thereon in the context of his next report on cross-cutting issues;",
    "42": "Recognizes the important role of the Mission in the protection of civilians, and requests the Secretary-General to continue to engage with the Mission\u2019s special units with the aim of helping them to effectively achieve the set objectives of the Mission;",
    "43": "Requests the Secretary-General to ensure the full implementation of the relevant provisions of its resolutions 59/296, 60/266, 61/276, 64/269, 65/289, 66/264, 69/307 and 70/286;",
    "44": "Also requests the Secretary-General to take all action necessary to ensure that the Mission is administered with a maximum of efficiency and economy; Budget performance report for the period from 1 July 2019 to 30 June 2020",
    "45": "Takes note of the report of the Secretary-General on the budget performance of the Mission for the period from 1 July 2019 to 30 June 2020; 3",
    "46": "Decides to appropriate to the special account for the United Nations Organization Stabilization Mission in the Democratic Republic of the Congo the amount of 23,839,200 dollars for the maintenance of the Mission, previously authorized by the Advisory Committee for the period from 1 July 2019 to 30 June 2020 under the terms of section VI of its resolution 64/269, in addition to the amount of 1,012,252,800 dollars previously approved for the same period under the terms of its resolution 73/315 of 3 July 2019 and its decision 73/555 of 3 July 2019; Financing of the additional appropriation for the period from 1 July 2019 to 30 June 2020",
    "47": "Decides, taking into account the amount of 1,012,252,800 dollars previously apportioned under the terms of its resolution 73/315 and its decision 73/555 for the period from 1 July 2019 to 30 June 2020, to apportion among Member States the additional amount of 23,839,200 dollars for the maintenance of the Mission for the same period, in accordance with the levels updated in its resolution 73/272 of 22 December 2018, taking into account the scale of assessments for 2019 and 2020, as set out in its resolution 73/271 of 22 December 2018;",
    "48": "Also decides that there shall be set off against the apportionment among Member States, as provided for in paragraph 47 above, the amount of 14,822,300 dollars, representing other revenue in respect of the financial period ended 30 June 2020;",
    "49": "Further decides that, in accordance with the provisions of its resolution 973 (X) of 15 December 1955, there shall be set off against the apportionment among Member States, as provided for in paragraph 47 above, their respective share in the Tax Equalization Fund of 5,933,100 dollars, representing the increase in the estimated staff assessment income for the Mission in respect of the financial periods ended 30 June 2019 and 30 June 2020; Budget estimates for the period from 1 July 2021 to 30 June 2022",
    "50": "Decides to appropriate to the special account the amount of 1,123,346,000 dollars for the period from 1 July 2021 to 30 June 2022, inclusive of 1,042,728,900 dollars for the maintenance of the Mission, 61,674,200 dollars for the support account for peacekeeping operations, 11,383,700 dollars for the United Nations Logistics Base at Brindisi, Italy, and 7,559,200 dollars for the Regional Service Centre in Entebbe, Uganda; Financing of the appropriation for the period from 1 July 2021 to 30 June 2022",
    "51": "Decides to apportion among Member States the amount of 528,094,723 dollars for the period from 1 July to 20 December 2021, in accordance with the levels updated in its resolution 73/272, taking into account the scale of assessments for 2021, as set out in its resolution 73/271;",
    "52": "Also decides that, in accordance with the provisions of its resolution 973 (X), there shall be set off against the apportionment among Member States, as provided for in paragraph 51 above, their respective share in the Tax Equalization Fund of 16,133,519 dollars, comprising the estimated staff assessment income of 12,802,329 dollars approved for the Mission, the prorated share of 2,413,491 dollars of the estimated staff assessment income approved for the support account, the prorated share of 554,822 dollars of the estimated staff assessment income approved for the United Nations Logistics Base and the prorated share of 362,877 dollars of the estimated staff assessment income approved for the Regional Service Centre;",
    "53": "Further decides to apportion among Member States the amount of 33,578,277 dollars for the period from 21 to 31 December 2021, at a monthly rate of 93,612,167 dollars, in accordance with the levels updated in its resolution 73/272, taking into account the scale of assessments for 2021, as set out in its resolution 73/271, subject to a decision of the Security Council to extend the mandate of the Mission;",
    "54": "Decides that, in accordance with the provisions of its resolution 973 (X), there shall be set off against the apportionment among Member States, as provided for in paragraph 53 above, their respective share in the Tax Equalization Fund of 1,025,831 dollars, comprising the estimated staff assessment income of 814,021 dollars approved for the Mission, the prorated share of 153,459 dollars of the estimated staff assessment income approved for the support account, the prorated share of 35,278 dollars of the estimated staff assessment income approved for the United Nations Logistics Base and the prorated share of 23,073 dollars of the estimated staff assessment income approved for the Regional Service Centre;",
    "55": " updated levels,4 subject to a decision of the Security Council to extend the mandate of the Mission;",
    "56": "Further decides that, in accordance with the provisions of its resolution 973 (X), there shall be set off against the apportionment among Member States, as provided for in paragraph 55 above, their respective share in the Tax Equalization Fund of 17,159,350 dollars, comprising the estimated staff assessment income of 13,616,350 dollars approved for the Mission, the prorated share of 2,566,950 dollars of the estimated staff assessment income approved for the support account, the prorated share of 590,100 dollars of the estimated staff assessment income approved for the United Nations Logistics Base and the prorated share of 385,950 dollars of the estimated staff assessment income approved for the Regional Service Centre;",
    "57": "Encourages the Secretary-General to continue to take additional measures to ensure the safety and security of all personnel participating in the Mission under the auspices of the United Nations, bearing in mind paragraphs 5 and 6 of Security Council resolution 1502 (2003) of 26 August 2003;",
    "58": "Invites voluntary contributions to the Mission in cash and in the form of services and supplies acceptable to the Secretary-General, to be administered, as appropriate, in accordance with the procedure and practices established by the General Assembly;",
    "59": "Decides to include in the provisional agenda of its seventy-sixth session the item entitled \u201cFinancing of the United Nations Organization Stabilization Mission in the Democratic Republic of the Congo\u201d."
  },
  "agenda_items": [
    "Item 159"
  ],
  "symbol_references": []
}