{
  "symbol": "A/RES/78/35",
  "filename": "A_RES_78_35.pdf",
  "title": "78/35. Treaty on the Prohibition of Nuclear Weapons",
  "text": "United Nations \nA/RES/78/35\n \n \nGeneral Assembly \nDistr.: General \n6 December 2023 \n \n23-24530 (E)    201223 \n*2324530* \n \n \nSeventy-eighth session \nAgenda item 99 (ff) \nGeneral and complete disarmament: Treaty on the \nProhibition of Nuclear Weapons  \n \n \n \n \n Resolution adopted by the General Assembly \non 4 December 2023 \n \n \n \n \n[on the report of the First Committee (A/78/409, para. 89)] \n \n \n \n78/35. Treaty on the Prohibition of Nuclear Weapons \n \n \n \nThe General Assembly, \n \nRecalling its resolutions 72/31 of 4 December 2017, 73/48 of 5 December 2018, \n74/41 of 12 December 2019, 75/40 of 7 December 2020, 76/34 of 6 December 2021 \nand 77/54 of 7 December 2022, \n \n1. \nRecalls the adoption of the Treaty on the Prohibition of Nuclear Weapons 1 \non 7 July 2017; \n \n2. \nWelcomes the entry into force of the Treaty on 22 January 2021; \n \n3. \nNotes that the Treaty has been open for signature at United Nations \nHeadquarters in New York since 20 September 2017; \n \n4. \nWelcomes that already 93 States had signed the Treaty and 69 States had \nbecome parties to it as at 9 October 2023; \n \n5. \nAlso welcomes the convening of the first Meeting of States Parties to the \nTreaty on the Prohibition of Nuclear Weapons, held in Vienna, Austria from 21 to \n23 June 2022, which examined the status and implementation of the Treaty and \nconsidered the progress towards achieving its objectives, purpose and the goal of a \nworld free from nuclear weapons; \n \n6. \nFurther welcomes the decisions taken at the first Meeting of States \nParties,2 including the adoption of the declaration entitled \u201cOur commitment to a \nworld free of nuclear weapons\u201d and the Vienna Action Plan, as well as the ongoing \ninformal intersessional work to implement it; \n__________________ \n \n1  A/CONF.229/2017/8. \n \n2  See TPNW/MSP/2022/6. \n\nA/RES/78/35 \nTreaty on the Prohibition of Nuclear Weapons\n \n23-24530\n2/2 \n \n \n7. \nWelcomes the establishment of the Treaty\u2019s Scientific Advisory Group; \n \n8. \nAlso welcomes the participation of States signatories, as well as of other \nStates not party to the Treaty, the relevant entities of the United Nations system, other \nrelevant international organizations or institutions, regional organizations, the \nInternational Committee of the Red Cross, the International Federation of Red Cross \nand Red Crescent Societies and relevant non-governmental organizations at the first \nMeeting of States Parties as observers; \n \n9. \nConfirms that the second Meeting of States Parties to the Treaty on the \nProhibition of Nuclear Weapons will be held at United Nations Headquarters in New \nYork from 27 November to 1 December 2023; \n \n10. Requests the Secretary-General to render the necessary assistance and to \nprovide such services, as may be required, for the second Meeting of States Parties \nand its informal intersessional process; \n \n11. \nCalls upon all States that have not yet done so to sign, ratify, accept, \napprove or accede to the Treaty at the earliest possible date; \n \n12. Calls upon those States in a position to do so to promote adherence to the \nTreaty through bilateral, subregional, regional and multilateral contacts, outreach and \nother means; \n \n13. Requests the Secretary-General, as depositary of the Treaty, to report to \nthe General Assembly at its seventy-ninth session on the status of signature and \nratification, acceptance, approval or accession of the Treaty; \n \n14. Decides to include in the provisional agenda of its seventy-ninth session, \nunder the item entitled \u201cGeneral and complete disarmament\u201d, the sub-item entitled \n\u201cTreaty on the Prohibition of Nuclear Weapons\u201d. \n \n42nd plenary meeting \n4 December 2023 \n \n",
  "paragraphs": {
    "1": "Recalls the adoption of the Treaty on the Prohibition of Nuclear Weapons 1 on 7 July 2017;",
    "2": "Welcomes the entry into force of the Treaty on 22 January 2021;",
    "3": "Notes that the Treaty has been open for signature at United Nations Headquarters in New York since 20 September 2017;",
    "4": "Welcomes that already 93 States had signed the Treaty and 69 States had become parties to it as at 9 October 2023;",
    "5": "Also welcomes the convening of the first Meeting of States Parties to the Treaty on the Prohibition of Nuclear Weapons, held in Vienna, Austria from 21 to 23 June 2022, which examined the status and implementation of the Treaty and considered the progress towards achieving its objectives, purpose and the goal of a world free from nuclear weapons;",
    "6": "Further welcomes the decisions taken at the first Meeting of States Parties,2 including the adoption of the declaration entitled \u201cOur commitment to a world free of nuclear weapons\u201d and the Vienna Action Plan, as well as the ongoing informal intersessional work to implement it;",
    "7": "Welcomes the establishment of the Treaty\u2019s Scientific Advisory Group;",
    "8": "Also welcomes the participation of States signatories, as well as of other States not party to the Treaty, the relevant entities of the United Nations system, other relevant international organizations or institutions, regional organizations, the International Committee of the Red Cross, the International Federation of Red Cross and Red Crescent Societies and relevant non-governmental organizations at the first Meeting of States Parties as observers;",
    "9": "Confirms that the second Meeting of States Parties to the Treaty on the Prohibition of Nuclear Weapons will be held at United Nations Headquarters in New York from 27 November to 1 December 2023;",
    "10": "Requests the Secretary-General to render the necessary assistance and to provide such services, as may be required, for the second Meeting of States Parties and its informal intersessional process;",
    "11": "Calls upon all States that have not yet done so to sign, ratify, accept, approve or accede to the Treaty at the earliest possible date;",
    "12": "Calls upon those States in a position to do so to promote adherence to the Treaty through bilateral, subregional, regional and multilateral contacts, outreach and other means;",
    "13": "Requests the Secretary-General, as depositary of the Treaty, to report to the General Assembly at its seventy-ninth session on the status of signature and ratification, acceptance, approval or accession of the Treaty;",
    "14": "Decides to include in the provisional agenda of its seventy-ninth session, under the item entitled \u201cGeneral and complete disarmament\u201d, the sub-item entitled \u201cTreaty on the Prohibition of Nuclear Weapons\u201d."
  },
  "agenda_items": [
    "Item 99"
  ],
  "symbol_references": []
}