{
  "symbol": "A/RES/74/182",
  "filename": "A_RES_74_182.pdf",
  "title": "74/182. Report of the United Nations Commission on International Trade Law on the work of its fifty-second session",
  "text": "United Nations \nA/RES/74/182\n \n \nGeneral Assembly \nDistr.: General \n27 December 2019 \n \n19-22341 (E)    090120 \n*1922341* \n \n \nSeventy-fourth session \nAgenda item 77 \nReport of the United Nations Commission on International \nTrade Law on the work of its fifty-second session \n \n \n \n \n Resolution adopted by the General Assembly \non 18 December 2019 \n \n \n \n \n[on the report of the Sixth Committee (A/74/423)] \n \n \n 74/182. Report of the United Nations Commission on International Trade \nLaw on the work of its fifty-second session \n \n \n \nThe General Assembly, \n \nRecalling its resolution 2205 (XXI) of 17 December 1966, by which it \nestablished the United Nations Commission on International Trade Law with a \nmandate to further the progressive harmonization and unification of the law of \ninternational trade and in that respect to bear in mind the interests of all peoples, in \nparticular those of developing countries, in the extensive development of international \ntrade, \n \nReaffirming its belief that the progressive modernization and harmonization of \ninternational trade law, in reducing or removing legal obstacles to the flow of \ninternational trade, especially those affecting developing countries, would contribute \nsignificantly to universal economic cooperation among all States on a basis of \nequality, equity, common interest and respect for the rule of law, to the elimination of \ndiscrimination in international trade and, thereby, to peace, stability and the well-\nbeing of all peoples, \n \nHaving considered the report of the Commission,1  \n \nReiterating its concern that activities undertaken by other bodies in the field of \ninternational trade law without adequate coordination with the Commission might \nlead to undesirable duplication of efforts and would not be in keeping with the aim of \npromoting efficiency, consistency and coherence in the unification and harmonization \nof international trade law, \n \nReaffirming the mandate of the Commission, as the core legal body within the \nUnited Nations system in the field of international trade law, to coordinate legal \n__________________ \n \n1  Official Records of the General Assembly, Seventy-fourth Session, Supplement No. 17 (A/74/17). \n\nA/RES/74/182 \nReport of the United Nations Commission on International\nTrade Law on the work of its fifty-second session\n \n19-22341\n2/7 \n \nactivities in this field, in particular to avoid duplication of efforts, including among \norganizations formulating rules of international trade, and to promote efficiency, \nconsistency and coherence in the modernization and harmonization of international \ntrade law, and to continue, through its secretariat, to maintain close cooperation with \nother international organs and organizations, including regional organizations, active \nin the field of international trade law, \n \n1. \nTakes note with appreciation of the report of the United Nations \nCommission on International Trade Law;1 \n \n2. \nCommends the Commission for the finalization and adoption of the Model \nLegislative Provisions on Public-Private Partnerships with an accompanying \nlegislative guide,2 the Model Law on Enterprise Group Insolvency and its guide to \nenactment,3 the Practice Guide to the United Nations Commission on International \nTrade Law Model Law on Secured Transactions 4 and a text on the obligations of \ndirectors of enterprise group companies in the period approaching insolvency, 5 to be \nadded to part four of the Legislative Guide on Insolvency Law of the United Nations \nCommission on International Trade Law;6  \n \n3. \nAlso commends the Commission for the finalization of the Notes on the \nMain Issues of Cloud Computing Contracts prepared by the secretariat and for \napproving them for publication, including in the form of a mobile device-friendly \nonline tool;7  \n \n4. \nWelcomes the signing ceremony, held in Singapore on 7 August 2019, for \nthe United Nations Convention on International Settlement Agreements Resulting \nfrom Mediation (Singapore Convention on Mediation), adopted by the General \nAssembly in its resolution 73/198 of 20 December 2018, and invites Governments \nand regional economic integration organizations that have not yet done so to consider \nbecoming a party to the Convention; \n \n5. \nNotes with satisfaction the contributions from the Fund for International \nDevelopment of the Organization of the Petroleum Exporting Countries and from the \nEuropean Commission, which allow the operation of the repository of published \ninformation under the Rules on Transparency in Treaty-based Investor-State \nArbitration,8 and that the Commission reiterated its strong and unanimous opinion \nthat the secretariat of the Commission should continue to operate the transparency \nrepository, which constitutes a central feature both of the Rules on Transparency and \nof the United Nations Convention on Transparency in Treaty-based Investor-State \nArbitration (Mauritius Convention on Transparency);9  \n \n6. \nRequests the Secretary-General to continue to operate, through the \nsecretariat of the Commission, the repository of published information in accordance \nwith article 8 of the Rules on Transparency, as a pilot project until the end of 2020, \nto be funded entirely by voluntary contributions, and to keep the General Assembly \ninformed of developments regarding the funding and budgetary situation of the \ntransparency repository based on its pilot operation; \n__________________ \n \n2  Ibid., chap. III, sect. C, and annex I. \n \n3  Ibid., chap. VI, sect. A, and annex II. \n \n4  Ibid., chap. IV, sect. C. \n \n5  Ibid., chap. VI, sect. B. \n \n6  United Nations publication, Sales No. E.13.V.10. \n \n7  Official Records of the General Assembly, Seventy-fourth Session, Supplement No. 17 (A/74/17), \nchap. VIII, sect. C. \n \n8  Ibid., Sixty-eighth Session, Supplement No. 17 (A/68/17), annex I. \n \n9  Resolution 69/116, annex. \n\nReport of the United Nations Commission on International \nTrade Law on the work of its fifty-second session \nA/RES/74/182\n \n3/7\n19-22341 \n \n \n7. \nTakes note with interest of the progress made by the Commission in its \nwork in the areas of micro-, small and medium-sized enterprises, dispute settlement, \ninvestor-State dispute settlement reform, electronic commerce, insolvency law and \nthe judicial sale of ships, 10 and encourages the Commission to continue to move \nforward efficiently to achieve tangible work outcomes in those areas; \n \n8. \nNotes with interest the authorization for the Secretariat to hold a \ncolloquium on civil asset tracing and recovery and a colloquium on applicable law in \ninsolvency proceedings, with the goal of advancing the exploratory work on those \ntopics, as well as other decisions taken by the Commission on future work, notes that \nthe Commission agreed to request the Secretariat to proceed with its preparatory work \non warehouse receipts and to convene a colloquium with other organizations having \nrelevant expertise, with a view to considering the questions of scope and nature of \nwork discussed at the fifty-second session and possibly advancing the preparation of \ninitial draft materials, to conduct exploratory and preparatory work on legal issues \nwhich relate to the digital economy and digital trade, including on dispute resolution \nin relation to high-technology disputes, and to start exploratory work on railway \nconsignment notes, as well as to start preparing draft materials on access to credit for \nmicro-, small and medium-sized enterprises,11 and further notes that the Commission \nwill further consider the draft United Nations Commission on International Trade Law \nmediation rules12 and the draft United Nations Commission on International Trade \nLaw notes on mediation13 at its next session, in 2020, following further comments \nand consideration from States and other interested relevant organizations, and any \nappropriate revisions to the draft texts; \n \n9. \nEndorses the efforts and initiatives of the Commission, as the core legal \nbody within the United Nations system in the field of international trade law, aimed \nat increasing coordination of and cooperation on legal activities of international and \nregional organizations active in the field of international trade law, including on legal \nissues relating to the digital economy, and at promoting the rule of law at the national \nand international levels in this field, and in this regard appeals to relevant \ninternational and regional organizations to coordinate their activities with those of the \nCommission, to avoid duplication of efforts and to promote efficiency, consistency \nand coherence in the modernization and harmonization of international trade law; \n \n10. Reaffirms the importance, in particular for developing countries, of the \nwork of the Commission concerned with technical cooperation and assistance in the \nfield of international trade law reform and development, and in this connection: \n \n(a) \nWelcomes the initiatives of the Commission towards expanding, through \nits secretariat, its technical cooperation and assistance programme, in that respect \nencourages the Secretary-General to seek partnerships with State and non-State actors \nto increase awareness about the work of the Commission and facilitate the effective \nimplementation of legal standards resulting from its work, and notes in that regard \nthe round table on technical assistance held during the fifty-second session of the \nCommission, which brought together governmental and intergovernmental \norganizations active in international development assistance to explore synergies and \ndiscuss ways to further cooperate with the secretariat of the Commission in \nimplementing sound reforms of international trade law; \n \n(b) \nExpresses its appreciation to the Commission for carrying out technical \ncooperation and assistance activities and for providing assistance with legislative \n__________________ \n \n10  See Official Records of the General Assembly, Seventy-fourth Session, Supplement No. 17 \n(A/74/17), chap. XV, sect. A. \n \n11  Ibid., sect. C. \n \n12  A/CN.9/986. \n \n13  A/CN.9/987. \n\nA/RES/74/182 \nReport of the United Nations Commission on International\nTrade Law on the work of its fifty-second session\n \n19-22341\n4/7 \n \ndrafting in the field of international trade law, and draws the attention of the \nSecretary-General to the limited resources that are made available in this field; \n \n(c) \nExpresses its appreciation to the Governments whose contributions \nenabled the technical cooperation and assistance activities to take place, and appeals \nto Governments, the relevant bodies of the United Nations system, organizations, \ninstitutions and individuals to make voluntary contributions to the United Nations \nCommission on International Trade Law trust fund for symposiums and, where \nappropriate, for the financing of special projects and otherwise to assist the secretariat \nof the Commission in carrying out technical cooperation and assistance activities, in \nparticular in developing countries; \n \n(d) \nReiterates its appeal to the United Nations Development Programme and \nother bodies responsible for development assistance, such as the World Bank and \nregional development banks, as well as to Governments in their bilateral aid \nprogrammes, to support the technical cooperation and assistance programme of the \nCommission and to cooperate with the Commission and coordinate their activities \nwith those of the Commission in the light of the relevance and importance of the work \nand programmes of the Commission for the promotion of the rule of law at the \nnational and international levels and for the implementation of the international \ndevelopment agenda, including the achievement of the 2030 Agenda for Sustainable \nDevelopment;14  \n \n(e) \nRecalls its resolutions stressing the need to strengthen support to Member \nStates, upon their request, in the domestic implementation of their respective \ninternational obligations through enhanced technical assistance and capacity-\nbuilding, and welcomes the efforts of the Secretary-General to ensure greater \ncoordination and coherence among United Nations entities and with donors and \nrecipients; \n \n11. \nRecalls the importance of adherence to the rules of procedure and methods \nof work of the Commission, including transparent and inclusive deliberations, taking \ninto account the summary of conclusions as reproduced in annex III to the report on \nthe work of its forty-third session,15 requests the Secretariat to issue, prior to meetings \nof the Commission and of its working groups, a reminder of those rules of procedure \nand methods of work with a view to ensuring the high quality of the work of the \nCommission and encouraging the assessment of its instruments, and recalls in this \nregard its previous resolutions related to this matter;  \n \n12. Notes that the Commission, during its fifty-second session, welcomed \nimprovements in the organization of that session made by the Secretariat pursuant to \na joint comprehensive proposal concerning the methods of work of the Commission \nsubmitted by several Member States at the fifty-first session of the Commission16 and \nconfirmed its understanding that two-week sessions would generally be sufficient and \nthat the duration of each annual session was to be determined on a case-by-case basis \ndepending on the expected workload;17  \n \n13. Welcomes the activities of the United Nations Commission on \nInternational Trade Law Regional Centre for Asia and the Pacific, in the Republic of \nKorea, towards providing capacity-building and technical assistance services to \nStates in the Asia-Pacific region, including to international and regional \norganizations, expresses its appreciation to the Republic of Korea and China, whose \ncontributions enabled continuing operation of the Regional Centre, notes that the \n__________________ \n \n14  Resolution 70/1. \n \n15  Official Records of the General Assembly, Sixty-fifth Session, Supplement No. 17 (A/65/17). \n \n16  Ibid., Seventy-third Session, Supplement No. 17 (A/73/17), chap. XVIII, sect. A. \n \n17  Ibid., Seventy-fourth Session, Supplement No. 17 (A/74/17), paras. 316 and 331. \n\nReport of the United Nations Commission on International \nTrade Law on the work of its fifty-second session \nA/RES/74/182\n \n5/7\n19-22341 \n \ncontinuation of the regional presence relies entirely on extrabudgetary resources, \nincluding but not limited to voluntary contributions from States, welcomes \nexpressions of interest from other States in hosting regional centres of the \nCommission, and requests the Secretary-General to keep the General Assembly \ninformed of developments regarding the establishment of regional centres, in \nparticular their funding and budgetary situation; \n \n14. Appeals to Governments, the relevant bodies of the United Nations system, \norganizations, institutions and individuals to make voluntary contributions to the trust \nfund established to provide travel assistance to developing countries that are members \nof the Commission, at their request and in consultation with the Secretary-General, \nin order to enable renewal of the provision of that assistance and to increase expert \nrepresentation from developing countries at sessions of the Commission and its \nworking groups, necessary to build local expertise and capacities in those countries \nto put in place a regulatory and enabling environment for business, trade and \ninvestment; \n \n15. Decides, in order to ensure full participation of all Member States in the \nsessions of the Commission and its working groups, to continue, in the competent \nMain Committee during the seventy-fourth session of the General Assembly, its \nconsideration of granting travel assistance to the least developed countries, at their \nrequest and in consultation with the Secretary-General, and notes the contributions \nfrom the European Union and the Swiss Agency for Development and Cooperation to \nthe trust fund, which would facilitate the participation of representatives of \ndeveloping States in the deliberations of Working Group III; \n \n16. Takes note of a proposal for the enlargement of the membership of the \nCommission submitted by Israel and Japan at the fifty-second session of the \nCommission,18 and that the Commission encouraged its member States to consult with \neach other and other interested States on the proposal during the intersessional period \nand requested the Secretariat to facilitate those intersessional consultations; 19  \n \n17. Endorses the conviction of the Commission that the implementation and \neffective use of modern private law standards in international trade are essential for \nadvancing good governance, sustained economic development and the eradication of \npoverty and hunger and that the promotion of the rule of law in commercial relations \nshould be an integral part of the broader agenda of the United Nations to promote the \nrule of law at the national and international levels, including through the Rule of Law \nCoordination and Resource Group, supported by the Rule of Law Unit in the \nExecutive Office of the Secretary-General; \n \n18. Notes the role of the Commission in promoting the rule of law, respective \ndiscussions in the Commission at its fifty-second session, 20  and the comments \ntransmitted by the Commission, pursuant to paragraph 20 of General Assembly \nresolution 73/207 of 20 December 2018, highlighting the relevance of its current work \nand of the texts finalized and adopted at the fifty-second session of the Commission \nto the promotion of the rule of law and the implementation of the Sustainable \nDevelopment Goals;21  \n \n19. Notes with satisfaction that, in paragraph 8 of the declaration of the high-\nlevel meeting of the General Assembly on the rule of law at the national and \ninternational levels, adopted by consensus as resolution 67/1 of 24 September 2012, \nMember States recognized the importance of fair, stable and predictable legal \n__________________ \n \n18  Ibid., para. 311. \n \n19  Ibid., para. 315. \n \n20  Ibid., chap. XX. \n \n21  Ibid., sect. B. \n\nA/RES/74/182 \nReport of the United Nations Commission on International\nTrade Law on the work of its fifty-second session\n \n19-22341\n6/7 \n \nframeworks for generating inclusive, sustainable and equitable development, \neconomic growth and employment, generating investment and facilitating \nentrepreneurship and, in this regard, commended the work of the Commission in \nmodernizing and harmonizing international trade law and that, in paragraph 7 of the \ndeclaration, Member States expressed their conviction that the rule of law and \ndevelopment were strongly interrelated and mutually reinforcing; \n \n20. Also notes with satisfaction that, in paragraph 89 of the Addis Ababa \nAction Agenda of the Third International Conference on Financing for Development, \nadopted by the General Assembly by consensus as resolution 69/313 of 27 July 2015, \nStates endorsed the efforts and initiatives of the Commission, as the core legal body \nwithin the United Nations system in the field of international trade law, aimed at \nincreasing coordination of and cooperation on legal activities of international and \nregional organizations active in the field of international trade law and at promoting \nthe rule of law at the national and international levels in this field; \n \n21. Reiterates its request to the Secretary-General, in conformity with \nresolutions of the General Assembly on documentation-related matters,22 which, in \nparticular, emphasize that any invitation to limit, where appropriate, the length of \ndocuments should not adversely affect either the quality of the presentation or the \nsubstance of the documents, to bear in mind the particular characteristics of the \nmandate and functions of the Commission in the progressive development and \ncodification of international trade law when implementing page limits with respect to \nthe documentation of the Commission;23  \n \n22. Requests the Secretary-General to continue the publication of Commission \nstandards and the provision of summary records of the meetings of the Commission, \nincluding committees of the whole established by the Commission for the duration of \nits annual session, relating to the formulation of normative texts;  \n \n23. Recalls paragraph 48 of its resolution 66/246 of 24 December 2011 \nregarding the rotation scheme of meetings between Vienna and New York; \n \n24. Stresses the importance of promoting the use of texts emanating from the \nwork of the Commission for the global unification and harmonization of international \ntrade law, and to this end urges States that have not yet done so to consider signing, \nratifying or acceding to conventions, enacting model laws and encouraging the use of \nother relevant texts; \n \n25. Notes with appreciation the work of the Secretariat on the system for the \ncollection and dissemination of case law on Commission texts in the six official \nlanguages of the United Nations (the CLOUT system), notes the resource-intensive \nnature of the system, acknowledges the need for further resources to sustain and \nexpand it, in this regard welcomes the renewed efforts by the Commission and its \nsecretariat towards building partnerships with interested institutions, and appeals to \nGovernments, the relevant bodies of the United Nations system, organizations, \ninstitutions and individuals to assist the secretariat of the Commission in raising \nawareness as to the availability and usefulness of the CLOUT system in professional, \nacademic and judiciary circles and in securing the funding required for the \ncoordination and expansion of the system and the establishment, within the secretariat \nof the Commission, of a pillar focused on the promotion of ways and means of \ninterpreting Commission texts in a uniform manner; \n__________________ \n \n22  Resolutions 52/214, sect. B, 57/283 B, sect. III, and 58/250, sect. III. \n \n23  See resolutions 59/39, para. 9, and 65/21, para. 18; see also Official Records of the General \nAssembly, Fifty-ninth Session, Supplement No. 17 (A/59/17), paras. 124\u2013128. \n\nReport of the United Nations Commission on International \nTrade Law on the work of its fifty-second session \nA/RES/74/182\n \n7/7\n19-22341 \n \n \n26. Welcomes the continuing work of the Secretariat on digests of case law \nrelated to Commission texts, including their wide dissemination, as well as the \ncontinuing increase in the number of abstracts available through the CLOUT system, \nin view of the role of the digests and the CLOUT system as important tools for the \npromotion of the uniform interpretation of international trade law, in particular by \nbuilding local capacity of judges, arbitrators and other legal practitioners to interpret \nthose standards in the light of their international character and the need to promote \nuniformity in their application and the observance of good faith in international trade, \nand notes the satisfaction of the Commission with the performance of the New York \nConvention website24 and the successful coordination between that website and the \nCLOUT system; \n \n27. Recalls its resolutions affirming the importance of high-quality, user-\nfriendly and cost-effective United Nations websites and the need for their multilingual \ndevelopment, maintenance and enrichment,25 commends the fact that the website of \nthe Commission has been migrated to a mobile device-friendly platform and that it \ncontinues to be published simultaneously in the six official languages of the United \nNations, and welcomes the continuous efforts of the Commission to maintain and \nimprove its website, and to enhance the visibility of its work by utilizing social media \nfeatures in accordance with the applicable guidelines. 26 \n \n51st plenary meeting \n18 December 2019 \n \n__________________ \n \n24  www.newyorkconvention1958.org.  \n \n25  Resolutions 52/214, sect. C, para. 3; 55/222, sect. III, para. 12; 56/64 B, sect. X; 57/130 B, sect. X; \n58/101 B, sect. V, paras. 61\u201376; 59/126 B, sect. V, paras. 76\u201395; 60/109 B, sect. IV, paras. 66\u201380; \nand 61/121 B, sect. IV, paras. 65\u201377. \n \n26  See resolution 63/120, para. 20. \n",
  "paragraphs": {
    "1": "Takes note with appreciation of the report of the United Nations Commission on International Trade Law;1",
    "2": "Commends the Commission for the finalization and adoption of the Model Legislative Provisions on Public-Private Partnerships with an accompanying legislative guide,2 the Model Law on Enterprise Group Insolvency and its guide to enactment,3 the Practice Guide to the United Nations Commission on International Trade Law Model Law on Secured Transactions 4 and a text on the obligations of directors of enterprise group companies in the period approaching insolvency, 5 to be added to part four of the Legislative Guide on Insolvency Law of the United Nations Commission on International Trade Law;6",
    "3": "Also commends the Commission for the finalization of the Notes on the Main Issues of Cloud Computing Contracts prepared by the secretariat and for approving them for publication, including in the form of a mobile device-friendly online tool;7",
    "4": "Welcomes the signing ceremony, held in Singapore on 7 August 2019, for the United Nations Convention on International Settlement Agreements Resulting from Mediation (Singapore Convention on Mediation), adopted by the General Assembly in its resolution 73/198 of 20 December 2018, and invites Governments and regional economic integration organizations that have not yet done so to consider becoming a party to the Convention;",
    "5": "Notes with satisfaction the contributions from the Fund for International Development of the Organization of the Petroleum Exporting Countries and from the European Commission, which allow the operation of the repository of published information under the Rules on Transparency in Treaty-based Investor-State Arbitration,8 and that the Commission reiterated its strong and unanimous opinion that the secretariat of the Commission should continue to operate the transparency repository, which constitutes a central feature both of the Rules on Transparency and of the United Nations Convention on Transparency in Treaty-based Investor-State Arbitration (Mauritius Convention on Transparency);9",
    "6": "Requests the Secretary-General to continue to operate, through the secretariat of the Commission, the repository of published information in accordance with article 8 of the Rules on Transparency, as a pilot project until the end of 2020, to be funded entirely by voluntary contributions, and to keep the General Assembly informed of developments regarding the funding and budgetary situation of the transparency repository based on its pilot operation; __________________ 2 Ibid., chap. III, sect. C, and annex I. 3 Ibid., chap. VI, sect. A, and annex II. 4 Ibid., chap. IV, sect. C. 5 Ibid., chap. VI, sect. B. 6 United Nations publication, Sales No. E.13.V.10. 7 Official Records of the General Assembly, Seventy-fourth Session, Supplement No. 17 (A/74/17), chap. VIII, sect. C. 8 Ibid., Sixty-eighth Session, Supplement No. 17 (A/68/17), annex I. 9 Resolution 69/116, annex. Report of the United Nations Commission on International Trade Law on the work of its fifty-second session A/RES/74/182 3/7 19-22341",
    "7": "Takes note with interest of the progress made by the Commission in its work in the areas of micro-, small and medium-sized enterprises, dispute settlement, investor-State dispute settlement reform, electronic commerce, insolvency law and the judicial sale of ships, 10 and encourages the Commission to continue to move forward efficiently to achieve tangible work outcomes in those areas;",
    "8": "Notes with interest the authorization for the Secretariat to hold a colloquium on civil asset tracing and recovery and a colloquium on applicable law in insolvency proceedings, with the goal of advancing the exploratory work on those topics, as well as other decisions taken by the Commission on future work, notes that the Commission agreed to request the Secretariat to proceed with its preparatory work on warehouse receipts and to convene a colloquium with other organizations having relevant expertise, with a view to considering the questions of scope and nature of work discussed at the fifty-second session and possibly advancing the preparation of initial draft materials, to conduct exploratory and preparatory work on legal issues which relate to the digital economy and digital trade, including on dispute resolution in relation to high-technology disputes, and to start exploratory work on railway consignment notes, as well as to start preparing draft materials on access to credit for micro-, small and medium-sized enterprises,11 and further notes that the Commission will further consider the draft United Nations Commission on International Trade Law mediation rules12 and the draft United Nations Commission on International Trade Law notes on mediation13 at its next session, in 2020, following further comments and consideration from States and other interested relevant organizations, and any appropriate revisions to the draft texts;",
    "9": "Endorses the efforts and initiatives of the Commission, as the core legal body within the United Nations system in the field of international trade law, aimed at increasing coordination of and cooperation on legal activities of international and regional organizations active in the field of international trade law, including on legal issues relating to the digital economy, and at promoting the rule of law at the national and international levels in this field, and in this regard appeals to relevant international and regional organizations to coordinate their activities with those of the Commission, to avoid duplication of efforts and to promote efficiency, consistency and coherence in the modernization and harmonization of international trade law;",
    "10": "Reaffirms the importance, in particular for developing countries, of the work of the Commission concerned with technical cooperation and assistance in the field of international trade law reform and development, and in this connection: (a) Welcomes the initiatives of the Commission towards expanding, through its secretariat, its technical cooperation and assistance programme, in that respect encourages the Secretary-General to seek partnerships with State and non-State actors to increase awareness about the work of the Commission and facilitate the effective implementation of legal standards resulting from its work, and notes in that regard the round table on technical assistance held during the fifty-second session of the Commission, which brought together governmental and intergovernmental organizations active in international development assistance to explore synergies and discuss ways to further cooperate with the secretariat of the Commission in implementing sound reforms of international trade law; (b) Expresses its appreciation to the Commission for carrying out technical cooperation and assistance activities and for providing assistance with legislative __________________ 10 See Official Records of the General Assembly, Seventy-fourth Session, Supplement No. 17 (A/74/17), chap. XV, sect. A. 11 Ibid., sect. C. 12 A/CN.9/986. 13 A/CN.9/987. A/RES/74/182 Report of the United Nations Commission on International Trade Law on the work of its fifty-second session 19-22341 4/7 drafting in the field of international trade law, and draws the attention of the Secretary-General to the limited resources that are made available in this field; (c) Expresses its appreciation to the Governments whose contributions enabled the technical cooperation and assistance activities to take place, and appeals to Governments, the relevant bodies of the United Nations system, organizations, institutions and individuals to make voluntary contributions to the United Nations Commission on International Trade Law trust fund for symposiums and, where appropriate, for the financing of special projects and otherwise to assist the secretariat of the Commission in carrying out technical cooperation and assistance activities, in particular in developing countries; (d) Reiterates its appeal to the United Nations Development Programme and other bodies responsible for development assistance, such as the World Bank and regional development banks, as well as to Governments in their bilateral aid programmes, to support the technical cooperation and assistance programme of the Commission and to cooperate with the Commission and coordinate their activities with those of the Commission in the light of the relevance and importance of the work and programmes of the Commission for the promotion of the rule of law at the national and international levels and for the implementation of the international development agenda, including the achievement of the 2030 Agenda for Sustainable Development;14 (e) Recalls its resolutions stressing the need to strengthen support to Member States, upon their request, in the domestic implementation of their respective international obligations through enhanced technical assistance and capacity- building, and welcomes the efforts of the Secretary-General to ensure greater coordination and coherence among United Nations entities and with donors and recipients;",
    "11": "Recalls the importance of adherence to the rules of procedure and methods of work of the Commission, including transparent and inclusive deliberations, taking into account the summary of conclusions as reproduced in annex III to the report on the work of its forty-third session,15 requests the Secretariat to issue, prior to meetings of the Commission and of its working groups, a reminder of those rules of procedure and methods of work with a view to ensuring the high quality of the work of the Commission and encouraging the assessment of its instruments, and recalls in this regard its previous resolutions related to this matter;",
    "12": "Notes that the Commission, during its fifty-second session, welcomed improvements in the organization of that session made by the Secretariat pursuant to a joint comprehensive proposal concerning the methods of work of the Commission submitted by several Member States at the fifty-first session of the Commission16 and confirmed its understanding that two-week sessions would generally be sufficient and that the duration of each annual session was to be determined on a case-by-case basis depending on the expected workload;17",
    "13": "Welcomes the activities of the United Nations Commission on International Trade Law Regional Centre for Asia and the Pacific, in the Republic of Korea, towards providing capacity-building and technical assistance services to States in the Asia-Pacific region, including to international and regional organizations, expresses its appreciation to the Republic of Korea and China, whose contributions enabled continuing operation of the Regional Centre, notes that the __________________ 14 Resolution 70/1. 15 Official Records of the General Assembly, Sixty-fifth Session, Supplement No. 17 (A/65/17). 16 Ibid., Seventy-third Session, Supplement No. 17 (A/73/17), chap. XVIII, sect. A. 17 Ibid., Seventy-fourth Session, Supplement No. 17 (A/74/17), paras. 316 and 331. Report of the United Nations Commission on International Trade Law on the work of its fifty-second session A/RES/74/182 5/7 19-22341 continuation of the regional presence relies entirely on extrabudgetary resources, including but not limited to voluntary contributions from States, welcomes expressions of interest from other States in hosting regional centres of the Commission, and requests the Secretary-General to keep the General Assembly informed of developments regarding the establishment of regional centres, in particular their funding and budgetary situation;",
    "14": "Appeals to Governments, the relevant bodies of the United Nations system, organizations, institutions and individuals to make voluntary contributions to the trust fund established to provide travel assistance to developing countries that are members of the Commission, at their request and in consultation with the Secretary-General, in order to enable renewal of the provision of that assistance and to increase expert representation from developing countries at sessions of the Commission and its working groups, necessary to build local expertise and capacities in those countries to put in place a regulatory and enabling environment for business, trade and investment;",
    "15": "Decides, in order to ensure full participation of all Member States in the sessions of the Commission and its working groups, to continue, in the competent Main Committee during the seventy-fourth session of the General Assembly, its consideration of granting travel assistance to the least developed countries, at their request and in consultation with the Secretary-General, and notes the contributions from the European Union and the Swiss Agency for Development and Cooperation to the trust fund, which would facilitate the participation of representatives of developing States in the deliberations of Working Group III;",
    "16": "Takes note of a proposal for the enlargement of the membership of the Commission submitted by Israel and Japan at the fifty-second session of the Commission,18 and that the Commission encouraged its member States to consult with each other and other interested States on the proposal during the intersessional period and requested the Secretariat to facilitate those intersessional consultations; 19",
    "17": "Endorses the conviction of the Commission that the implementation and effective use of modern private law standards in international trade are essential for advancing good governance, sustained economic development and the eradication of poverty and hunger and that the promotion of the rule of law in commercial relations should be an integral part of the broader agenda of the United Nations to promote the rule of law at the national and international levels, including through the Rule of Law Coordination and Resource Group, supported by the Rule of Law Unit in the Executive Office of the Secretary-General;",
    "18": "Notes the role of the Commission in promoting the rule of law, respective discussions in the Commission at its fifty-second session, 20 and the comments transmitted by the Commission, pursuant to paragraph 20 of General Assembly resolution 73/207 of 20 December 2018, highlighting the relevance of its current work and of the texts finalized and adopted at the fifty-second session of the Commission to the promotion of the rule of law and the implementation of the Sustainable Development Goals;21",
    "19": "Notes with satisfaction that, in paragraph 8 of the declaration of the high- level meeting of the General Assembly on the rule of law at the national and international levels, adopted by consensus as resolution 67/1 of 24 September 2012, Member States recognized the importance of fair, stable and predictable legal __________________ 18 Ibid., para. 311. 19 Ibid., para. 315. 20 Ibid., chap. XX. 21 Ibid., sect. B. A/RES/74/182 Report of the United Nations Commission on International Trade Law on the work of its fifty-second session 19-22341 6/7 frameworks for generating inclusive, sustainable and equitable development, economic growth and employment, generating investment and facilitating entrepreneurship and, in this regard, commended the work of the Commission in modernizing and harmonizing international trade law and that, in paragraph 7 of the declaration, Member States expressed their conviction that the rule of law and development were strongly interrelated and mutually reinforcing;",
    "20": "Also notes with satisfaction that, in paragraph 89 of the Addis Ababa Action Agenda of the Third International Conference on Financing for Development, adopted by the General Assembly by consensus as resolution 69/313 of 27 July 2015, States endorsed the efforts and initiatives of the Commission, as the core legal body within the United Nations system in the field of international trade law, aimed at increasing coordination of and cooperation on legal activities of international and regional organizations active in the field of international trade law and at promoting the rule of law at the national and international levels in this field;",
    "21": "Reiterates its request to the Secretary-General, in conformity with resolutions of the General Assembly on documentation-related matters,22 which, in particular, emphasize that any invitation to limit, where appropriate, the length of documents should not adversely affect either the quality of the presentation or the substance of the documents, to bear in mind the particular characteristics of the mandate and functions of the Commission in the progressive development and codification of international trade law when implementing page limits with respect to the documentation of the Commission;23",
    "22": "Requests the Secretary-General to continue the publication of Commission standards and the provision of summary records of the meetings of the Commission, including committees of the whole established by the Commission for the duration of its annual session, relating to the formulation of normative texts;",
    "23": "Recalls paragraph 48 of its resolution 66/246 of 24 December 2011 regarding the rotation scheme of meetings between Vienna and New York;",
    "24": "Stresses the importance of promoting the use of texts emanating from the work of the Commission for the global unification and harmonization of international trade law, and to this end urges States that have not yet done so to consider signing, ratifying or acceding to conventions, enacting model laws and encouraging the use of other relevant texts;",
    "25": "Notes with appreciation the work of the Secretariat on the system for the collection and dissemination of case law on Commission texts in the six official languages of the United Nations (the CLOUT system), notes the resource-intensive nature of the system, acknowledges the need for further resources to sustain and expand it, in this regard welcomes the renewed efforts by the Commission and its secretariat towards building partnerships with interested institutions, and appeals to Governments, the relevant bodies of the United Nations system, organizations, institutions and individuals to assist the secretariat of the Commission in raising awareness as to the availability and usefulness of the CLOUT system in professional, academic and judiciary circles and in securing the funding required for the coordination and expansion of the system and the establishment, within the secretariat of the Commission, of a pillar focused on the promotion of ways and means of interpreting Commission texts in a uniform manner; __________________ 22 Resolutions 52/214, sect. B, 57/283 B, sect. III, and 58/250, sect. III. 23 See resolutions 59/39, para. 9, and 65/21, para. 18; see also Official Records of the General Assembly, Fifty-ninth Session, Supplement No. 17 (A/59/17), paras. 124\u2013128. Report of the United Nations Commission on International Trade Law on the work of its fifty-second session A/RES/74/182 7/7 19-22341",
    "26": "Welcomes the continuing work of the Secretariat on digests of case law related to Commission texts, including their wide dissemination, as well as the continuing increase in the number of abstracts available through the CLOUT system, in view of the role of the digests and the CLOUT system as important tools for the promotion of the uniform interpretation of international trade law, in particular by building local capacity of judges, arbitrators and other legal practitioners to interpret those standards in the light of their international character and the need to promote uniformity in their application and the observance of good faith in international trade, and notes the satisfaction of the Commission with the performance of the New York Convention website24 and the successful coordination between that website and the CLOUT system;",
    "27": "Recalls its resolutions affirming the importance of high-quality, user- friendly and cost-effective United Nations websites and the need for their multilingual development, maintenance and enrichment,25 commends the fact that the website of the Commission has been migrated to a mobile device-friendly platform and that it continues to be published simultaneously in the six official languages of the United Nations, and welcomes the continuous efforts of the Commission to maintain and improve its website, and to enhance the visibility of its work by utilizing social media features in accordance with the applicable guidelines. 26 51st plenary meeting 18 December 2019 __________________ 24 www.newyorkconvention1958.org. 25 Resolutions 52/214, sect. C, para. 3; 55/222, sect. III, para. 12; 56/64 B, sect. X; 57/130 B, sect. X; 58/101 B, sect. V, paras. 61\u201376; 59/126 B, sect. V, paras. 76\u201395; 60/109 B, sect. IV, paras. 66\u201380; and 61/121 B, sect. IV, paras. 65\u201377. 26 See resolution 63/120, para. 20."
  },
  "agenda_items": [
    "Item 77"
  ],
  "symbol_references": []
}