{
  "symbol": "A/RES/76/236",
  "filename": "A_RES_76_236.pdf",
  "title": "76/236. Programme planning",
  "text": "United Nations \nA/RES/76/236\n \n \nGeneral Assembly \nDistr.: General \n31 December 2021 \n \n21-19690 (E)    070122 \n*2119690* \n \n \nSeventy-sixth session \nAgenda item 139 \nProgramme planning \n \n \n \n \n Resolution adopted by the General Assembly \non 24 December 2021 \n \n \n \n \n[on the report of the Fifth Committee (A/76/615, para. 15)] \n \n \n 76/236. Programme planning \n \n \n \nThe General Assembly, \n \nRecalling its resolutions 37/234 of 21 December 1982, 38/227 A of 20 December \n1983, 41/213 of 19 December 1986, 55/234 of 23 December 2000, 56/253 of \n24 December 2001, 57/282 of 20 December 2002, 58/268 and 58/269 of 23 December \n2003, 59/275 of 23 December 2004, 60/257 of 8 May 2006, 61/235 of 22 December \n2006, 62/224 of 22 December 2007, 63/247 of 24 December 2008, 64/229 of \n22 December 2009, 65/244 of 24 December 2010, 66/8 of 11 November 2011, 67/236 \nof 24 December 2012, 68/20 of 4 December 2013, 69/17 of 18 November 2014, 70/8 \nof 13 November 2015, 71/6 of 27 October 2016, 72/9 of 17 November 2017, 72/266 A \nof 24 December 2017, 72/266 B of 5 July 2018, section III of its resolution 72/262 C \nof 5 July 2018 and its resolutions 73/269 of 22 December 2018, 74/251 of \n27 December 2019 and 75/243 of 31 December 2020, \n \nRecalling also the terms of reference of the Committee for Programme and \nCoordination, as outlined in the annex to Economic and Social Council resolution \n2008 (LX) of 14 May 1976, \n \nRecalling further the Regulations and Rules Governing Programme Planning, \nthe Programme Aspects of the Budget, the Monitoring of Implementation and the \nMethods of Evaluation,1 by which the relevant programmes and subprogrammes of \nthe proposed strategic framework shall be reviewed by the relevant sectoral, \nfunctional and regional intergovernmental bodies, if possible during the regular cycle \nof their meetings, \n \nHaving considered the report of the Committee for Programme and \nCoordination on the work of its sixty-first session, 2 the reports of the Secretary-\nGeneral on the proposed programme budget for 2022: part II, proposed programme \n__________________ \n \n1 ST/SGB/2018/3. \n \n2 Official Records of the General Assembly, Seventy-sixth Session, Supplement No. 16 (A/76/16). \n\nA/RES/76/236 \nProgramme planning\n \n21-19690\n2/4 \n \nplan for 2022 and programme performance for 2020, 3 and the letters and the annexes \nthereto from the Chairs of the Economic and Financial Committee (Second \nCommittee) dated 19 November 2021, 4  the Social, Humanitarian and Cultural \nCommittee (Third Committee) dated 16 November 2021 5 and the Special Political \nand Decolonization Committee (Fourth Committee) dated 12 November 2021 6 \naddressed to the Chair of the Fifth Committee, \n \nHaving also considered the report of the Office of Internal Oversight Services \non strengthening the role of evaluation and the application of evaluation findings on \nprogramme design, delivery and policy directives, 7 \n \n1. \nReaffirms the role of the Committee for Programme and Coordination as \nthe main subsidiary organ of the General Assembly and the Economic and Social \nCouncil for planning, programming and coordination; \n \n2. \nAlso reaffirms the role of the Committee for Programme and Coordination \nin verifying that the programmes of activities of the Organization are implemented in \nline with the legislative mandates and that the full implementation of regulations and \nrules is ensured; \n \n3. \nRe-emphasizes the role of the plenary and the Main Committees of the \nGeneral Assembly \nin \nreviewing \nand \ntaking \naction \non \nthe \nappropriate \nrecommendations of the Committee for Programme and Coordination relevant to their \nwork, in accordance with regulation 4.10 of the Regulations and Rules Governing \nProgramme Planning, the Programme Aspects of the Budget, the Monitoring of \nImplementation and the Methods of Evaluation; \n \n4. \nStresses that setting the priorities of the United Nations is the prerogative \nof the Member States, as reflected in legislative mandates; \n \n5. \nReiterates the need for Member States to participate fully in the budget \npreparation process, from its early stages and throughout the process; \n \n6. \nRecalls regulation 3.2, paragraphs 4 and 5, of the Regulations and Rules \nGoverning Programme Planning, the Programme Aspects of the Budget, the \nMonitoring of Implementation and the Methods of Evaluation, reaffirms that the Fifth \nCommittee is the appropriate Main Committee of the General Assembly entrusted \nwith responsibilities for administrative and budgetary matters, and stresses the \nimportance that the Fifth Committee make decisions on the programme budget in a \ntimely manner; \n \n7. \nRecommends that the Committee for Programme and Coordination, in \naccordance with its mandate, provide recommendations on all programmes of the \nproposed programme budget; \n \n8. \nRecalls that the Committee for Programme and Coordination shall \nconsider the proposed programme plans in accordance with its terms of reference, and \n__________________ \n \n3 A/76/6 (Sect. 2), A/76/6 (Sect. 3), A/76/6 (Sect. 3)/Corr.1, A/76/6 (Sect. 4), A/76/6 (Sect. 5), \nA/76/6 (Sect. 6), A/76/6 (Sect. 8), A/76/6 (Sect. 9), A/76/6 (Sect. 10), A/76/6 (Sect. 11), A/76/6 \n(Sect. 12), A/76/6 (Sect. 13), A/76/6 (Sect. 14), A/76/6 (Sect. 15), A/76/6 (Sect. 16), A/76/6 \n(Sect. 17), A/76/6 (Sect. 17)/Corr.1, A/76/6 (Sect. 18), A/76/6 (Sect. 19), A/76/6 (Sect. 20), \nA/76/6 (Sect. 21), A/76/6 (Sect. 22), A/76/6 (Sect. 24), A/76/6 (Sect. 25), A/76/6 (Sect. 26), \nA/76/6 (Sect. 27), A/76/6 (Sect. 27)/Corr.1, A/76/6 (Sect. 28), A/76/6 (Sect. 29), A/76/6 \n(Sect. 29A), A/76/6 (Sect. 29A)/Corr.1, A/76/6 (Sect. 29B), A/76/6 (Sect. 29C), A/76/6 \n(Sect. 29E), A/76/6 (Sect. 29F), A/76/6 (Sect. 29G), A/76/6 (Sect. 30), A/76/6 (Sect. 30)/Corr.1, \nA/76/6 (Sect. 31) and A/76/6 (Sect. 34). \n \n4 A/C.5/76/21. \n \n5 A/C.5/76/17. \n \n6 A/C.5/76/14. \n \n7 A/76/69. \n\nProgramme planning \nA/RES/76/236\n \n3/4\n21-19690 \n \nappreciates the continuous efforts of the Committee to reach consensus on all \nprogrammes of the proposed programme budget; \n \n9. \nAlso recalls its resolution 72/266 A, in which it approved the change from \na biennial to an annual budget period on a trial basis, beginning with the programme \nbudget for 2020; \n \n10. Requests the Secretary-General to engage with Member States and other \nrelevant stakeholders, including programme managers and the Advisory Committee \non Administrative and Budgetary Questions, when preparing the report on the review \nof the changes to the budgetary cycle, including on the sequence of budgetary \nprocedures and practices; \n \n11. \nReaffirms that no changes to the budget methodology, established \nbudgetary procedures and practices or the financial regulations may be implemented \nwithout prior review and approval by the General Assembly in accordance with \nestablished budgetary procedures; \n \n12. Expresses its support for the efforts of the Secretariat to better engage and \nsupport programme managers with the aim of making the Organization more effective \nand results-oriented, and welcomes the commitment and ongoing efforts of the \nSecretariat to improve and update the programmatic aspects, including planned \nresults, performance measures and external factors, of the programme budget; \n \n13. Reiterates its request to the Secretary-General to ensure that results and, \nwhere possible, performance measures actually reflect achievements and impacts in \nthe implementation of the programmes of the Organization and not those of individual \nMember States; \n \n14. Recalls paragraph 15 of its resolution 74/251, and reiterates its guidance \nto the Secretary-General to ensure that the terms and expressions referenced in the \nproposed programme plan have been intergovernmentally agreed; \n \n15. Notes that decisions by the General Assembly regarding the approval of \nthe programmes during the seventy-fourth and seventy-fifth sessions were issued as \naddenda to the main reports, and requests the Secretary-General to use cost-effective \nways to display the approved versions of the programme plans; \n \n16. Reiterates that whenever the Committee for Programme and Coordination \ncannot provide conclusions and recommendations on a given subprogramme or \nprogramme of the proposed programme budget, the plenary or the relevant Main \nCommittee or Main Committees of the General Assembly responsible for those \nmandates will consider the said subprogramme or programme at the very start of its \nsession in order to provide any conclusions and recommendations to the Fifth \nCommittee, at the earliest opportunity, and no later than four weeks after the start of \nthe session, for timely consideration by the Fifth Committee; \n \n17. Notes the increased size and volume of documentation that forms the \nproposed programme budget, and notes with appreciation that the Secretary-General \ncontinues his efforts to enhance the quality, clarity and usability of the proposed \nprogramme budget in consultation with Member States, while maintaining the level \nof information provided to Member States; \n \n18. Requests the Secretary-General to ensure that all the Main Committees \nhave access on their Committee Places of the e-deleGATE portal, for information \npurposes, before the start of the session, to the latest report of the Committee for \nProgramme and Coordination; \n \n19. Also requests the Secretary-General to identify possible measures to \nenhance and support more effective work of the Committee for Programme and \n\nA/RES/76/236 \nProgramme planning\n \n21-19690\n4/4 \n \nCoordination, including in terms of the duration of its sessions and the capacity of the \nsecretariat of the Fifth Committee and the Committee for Programme and \nCoordination, for the consideration of the General Assembly, and decides that the \nsixty-second session of the Committee for Programme and Coordination shall be \nextended to five weeks; \n \n20. Endorses the conclusions and recommendations of the Committee for \nProgramme and Coordination on the proposed programme plan for 2022 and \nprogramme performance for 20208 and on evaluation,9 contained in its report on the \nwork of its sixty-first session, and requests the Secretary-General to ensure the timely \nimplementation of the recommendations; \n \n21. Approves, on an exceptional basis and without creating a precedent, for \nprogrammes 3, 7, 14, 20 and 23 of the proposed programme budget for 2022, a \nprogramme narrative that is composed solely of the list of mandates at the programme \nlevel and the objectives approved by the General Assembly in its resolution 71/6 and \nthe deliverables for 2022 at the subprogramme level; \n \n22. Also approves, on an exceptional basis and without creating a precedent, \nfor programmes 1, 4, 24 and 28 of the proposed programme budget for 2022, a \nprogramme narrative that is composed solely of the list of mandates at the programme \nlevel and the objectives approved by the General Assembly in its resolution 75/243 \nand the deliverables for 2022 at the subprogramme level; \n \n23. Further approves the programme plan for programme 6, Legal affairs, of \nthe proposed programme budget for 2022, as contained in the report of the Secretary-\nGeneral;10 \n \n24. Endorses the conclusions and recommendations of the Committee for \nProgramme and Coordination on the annual overview report of the United Nations \nSystem Chief Executives Board for Coordination for 2020, 11  on United Nations \nsystem support for the New Partnership for Africa\u2019s Development12 and on the report \nof the Joint Inspection Unit.13 \n \n54th (resumed) plenary meeting \n24 December 2021 \n \n__________________ \n \n8 See Official Records of the General Assembly, Seventy-sixth Session, Supplement No. 16 \n(A/76/16), chap. II, sect. A. \n \n9 Ibid., sect. B. \n \n10 A/76/6 (Sect. 8). \n \n11 See Official Records of the General Assembly, Seventy-sixth Session, Supplement No. 16 \n(A/76/16), chap. III, sect. A. \n \n12 Ibid., sect. B. \n \n13 Ibid., chap. IV. \n",
  "paragraphs": {
    "1": "Reaffirms the role of the Committee for Programme and Coordination as the main subsidiary organ of the General Assembly and the Economic and Social Council for planning, programming and coordination;",
    "2": "Also reaffirms the role of the Committee for Programme and Coordination in verifying that the programmes of activities of the Organization are implemented in line with the legislative mandates and that the full implementation of regulations and rules is ensured;",
    "3": "Re-emphasizes the role of the plenary and the Main Committees of the General Assembly in reviewing and taking action on the appropriate recommendations of the Committee for Programme and Coordination relevant to their work, in accordance with regulation 4.10 of the Regulations and Rules Governing Programme Planning, the Programme Aspects of the Budget, the Monitoring of Implementation and the Methods of Evaluation;",
    "4": "Stresses that setting the priorities of the United Nations is the prerogative of the Member States, as reflected in legislative mandates;",
    "5": "Reiterates the need for Member States to participate fully in the budget preparation process, from its early stages and throughout the process;",
    "6": "Recalls regulation 3.2, paragraphs 4 and 5, of the Regulations and Rules Governing Programme Planning, the Programme Aspects of the Budget, the Monitoring of Implementation and the Methods of Evaluation, reaffirms that the Fifth Committee is the appropriate Main Committee of the General Assembly entrusted with responsibilities for administrative and budgetary matters, and stresses the importance that the Fifth Committee make decisions on the programme budget in a timely manner;",
    "7": "Recommends that the Committee for Programme and Coordination, in accordance with its mandate, provide recommendations on all programmes of the proposed programme budget;",
    "8": "Recalls that the Committee for Programme and Coordination shall consider the proposed programme plans in accordance with its terms of reference, and __________________ 3 A/76/6 (Sect. 2), A/76/6 (Sect. 3), A/76/6 (Sect. 3)/Corr.1, A/76/6 (Sect. 4), A/76/6 (Sect. 5), A/76/6 (Sect. 6), A/76/6 (Sect. 8), A/76/6 (Sect. 9), A/76/6 (Sect. 10), A/76/6 (Sect. 11), A/76/6 (Sect. 12), A/76/6 (Sect. 13), A/76/6 (Sect. 14), A/76/6 (Sect. 15), A/76/6 (Sect. 16), A/76/6 (Sect. 17), A/76/6 (Sect. 17)/Corr.1, A/76/6 (Sect. 18), A/76/6 (Sect. 19), A/76/6 (Sect. 20), A/76/6 (Sect. 21), A/76/6 (Sect. 22), A/76/6 (Sect. 24), A/76/6 (Sect. 25), A/76/6 (Sect. 26), A/76/6 (Sect. 27), A/76/6 (Sect. 27)/Corr.1, A/76/6 (Sect. 28), A/76/6 (Sect. 29), A/76/6 (Sect. 29A), A/76/6 (Sect. 29A)/Corr.1, A/76/6 (Sect. 29B), A/76/6 (Sect. 29C), A/76/6 (Sect. 29E), A/76/6 (Sect. 29F), A/76/6 (Sect. 29G), A/76/6 (Sect. 30), A/76/6 (Sect. 30)/Corr.1, A/76/6 (Sect. 31) and A/76/6 (Sect. 34). 4 A/C.5/76/21. 5 A/C.5/76/17. 6 A/C.5/76/14. 7 A/76/69. Programme planning A/RES/76/236 3/4 21-19690 appreciates the continuous efforts of the Committee to reach consensus on all programmes of the proposed programme budget;",
    "9": "Also recalls its resolution 72/266 A, in which it approved the change from a biennial to an annual budget period on a trial basis, beginning with the programme budget for 2020;",
    "10": "Requests the Secretary-General to engage with Member States and other relevant stakeholders, including programme managers and the Advisory Committee on Administrative and Budgetary Questions, when preparing the report on the review of the changes to the budgetary cycle, including on the sequence of budgetary procedures and practices;",
    "11": "Reaffirms that no changes to the budget methodology, established budgetary procedures and practices or the financial regulations may be implemented without prior review and approval by the General Assembly in accordance with established budgetary procedures;",
    "12": "Expresses its support for the efforts of the Secretariat to better engage and support programme managers with the aim of making the Organization more effective and results-oriented, and welcomes the commitment and ongoing efforts of the Secretariat to improve and update the programmatic aspects, including planned results, performance measures and external factors, of the programme budget;",
    "13": "Reiterates its request to the Secretary-General to ensure that results and, where possible, performance measures actually reflect achievements and impacts in the implementation of the programmes of the Organization and not those of individual Member States;",
    "14": "Recalls paragraph 15 of its resolution 74/251, and reiterates its guidance to the Secretary-General to ensure that the terms and expressions referenced in the proposed programme plan have been intergovernmentally agreed;",
    "15": "Notes that decisions by the General Assembly regarding the approval of the programmes during the seventy-fourth and seventy-fifth sessions were issued as addenda to the main reports, and requests the Secretary-General to use cost-effective ways to display the approved versions of the programme plans;",
    "16": "Reiterates that whenever the Committee for Programme and Coordination cannot provide conclusions and recommendations on a given subprogramme or programme of the proposed programme budget, the plenary or the relevant Main Committee or Main Committees of the General Assembly responsible for those mandates will consider the said subprogramme or programme at the very start of its session in order to provide any conclusions and recommendations to the Fifth Committee, at the earliest opportunity, and no later than four weeks after the start of the session, for timely consideration by the Fifth Committee;",
    "17": "Notes the increased size and volume of documentation that forms the proposed programme budget, and notes with appreciation that the Secretary-General continues his efforts to enhance the quality, clarity and usability of the proposed programme budget in consultation with Member States, while maintaining the level of information provided to Member States;",
    "18": "Requests the Secretary-General to ensure that all the Main Committees have access on their Committee Places of the e-deleGATE portal, for information purposes, before the start of the session, to the latest report of the Committee for Programme and Coordination;",
    "19": "Also requests the Secretary-General to identify possible measures to enhance and support more effective work of the Committee for Programme and A/RES/76/236 Programme planning 21-19690 4/4 Coordination, including in terms of the duration of its sessions and the capacity of the secretariat of the Fifth Committee and the Committee for Programme and Coordination, for the consideration of the General Assembly, and decides that the sixty-second session of the Committee for Programme and Coordination shall be extended to five weeks;",
    "20": "Endorses the conclusions and recommendations of the Committee for Programme and Coordination on the proposed programme plan for 2022 and programme performance for 20208 and on evaluation,9 contained in its report on the work of its sixty-first session, and requests the Secretary-General to ensure the timely implementation of the recommendations;",
    "21": "Approves, on an exceptional basis and without creating a precedent, for programmes 3, 7, 14, 20 and 23 of the proposed programme budget for 2022, a programme narrative that is composed solely of the list of mandates at the programme level and the objectives approved by the General Assembly in its resolution 71/6 and the deliverables for 2022 at the subprogramme level;",
    "22": "Also approves, on an exceptional basis and without creating a precedent, for programmes 1, 4, 24 and 28 of the proposed programme budget for 2022, a programme narrative that is composed solely of the list of mandates at the programme level and the objectives approved by the General Assembly in its resolution 75/243 and the deliverables for 2022 at the subprogramme level;",
    "23": "Further approves the programme plan for programme 6, Legal affairs, of the proposed programme budget for 2022, as contained in the report of the Secretary- General;10",
    "24": "Endorses the conclusions and recommendations of the Committee for Programme and Coordination on the annual overview report of the United Nations System Chief Executives Board for Coordination for 2020, 11 on United Nations system support for the New Partnership for Africa\u2019s Development12 and on the report of the Joint Inspection Unit.13 54th (resumed) plenary meeting 24 December 2021 __________________ 8 See Official Records of the General Assembly, Seventy-sixth Session, Supplement No. 16 (A/76/16), chap. II, sect. A. 9 Ibid., sect. B. 10 A/76/6 (Sect. 8). 11 See Official Records of the General Assembly, Seventy-sixth Session, Supplement No. 16 (A/76/16), chap. III, sect. A. 12 Ibid., sect. B. 13 Ibid., chap. IV."
  },
  "agenda_items": [
    "Item 139"
  ],
  "symbol_references": []
}