{
  "symbol": "A/RES/79/120",
  "filename": "A_RES_79_120.pdf",
  "title": "79/120. United Nations Programme of Assistance in the Teaching, Study, Dissemination and Wider Appreciation of International Law",
  "text": "United Nations \nA/RES/79/120\n \n \nGeneral Assembly \nDistr.: General \n12 December 2024 \n \n24-23512 (E)     \n*2423512* \n \n \nSeventy-ninth session \nAgenda item 78 \nUnited Nations Programme of Assistance in the Teaching, \nStudy, Dissemination and Wider Appreciation of \nInternational Law \n \n \n \n \n Resolution adopted by the General Assembly \non 4 December 2024 \n \n \n \n \n[on the report of the Sixth Committee (A/79/468, para. 7)] \n \n \n 79/120. United Nations Programme of Assistance in the Teaching, Study, \nDissemination and Wider Appreciation of International Law \n \n \n \nThe General Assembly, \n \nRecalling its resolution 2099 (XX) of 20 December 1965, in which the General \nAssembly established the United Nations Programme of Assistance in the Teaching, \nStudy, Dissemination and Wider Appreciation of International Law to contribute \ntowards a better knowledge of international law as a means of strengthening \ninternational peace and security and promoting friendly relations and cooperation \namong States, \n \nReaffirming that the Programme of Assistance is a core activity of the United \nNations and that it has provided the foundation for the efforts of the United Nations \nto promote a better knowledge of international law for more than half a century, \n \nRecognizing the major contribution of the Programme of Assistance to the \nteaching and dissemination of international law for the benefit of lawyers in all \ncountries, legal systems and regions of the world for more than half a century and the \nimportance of ensuring the successful continuation of the Programme for the benefit \nof present and future generations of lawyers, \n \nEmphasizing the important contribution of the Programme of Assistance, in \nparticular the United Nations Regional Courses in International Law and the United \nNations Audiovisual Library of International Law, to the furtherance of United \nNations rule of law programmes and activities, \n \nReaffirming that the increasing demand for international law training and \ndissemination activities creates new challenges for the Programme of Assistance, \n\nA/RES/79/120 \nUnited Nations Programme of Assistance in the Teaching, Study, \nDissemination and Wider Appreciation of International Law\n \n24-23512\n2/5 \n \n \nRecognizing the importance of the Programme of Assistance effectively \nreaching its beneficiaries, including with regard to languages, while bearing in mind \nlimitations on available resources, \n \nTaking note with appreciation of the report of the Secretary-General on the \nimplementation of the Programme of Assistance 1 and the views of the Advisory \nCommittee on the United Nations Programme of Assistance in the Teaching, Study, \nDissemination and Wider Appreciation of International Law, which are contained in \nthe report, \n \nNoting with satisfaction that resources have been provided under the programme \nbudget for the organization of the United Nations Regional Courses in International \nLaw on an annual basis and the further development of the United Nations \nAudiovisual Library of International Law, \n \nWelcoming the organization, for the sixth time in the history of the Programme \nof Assistance, of all three of the United Nations Regional Courses in International \nLaw, for Africa, for Asia-Pacific and for Latin America and the Caribbean, in the same \ncalendar year, \n \nNoting with satisfaction that the Hamilton Shirley Amerasinghe Memorial \nFellowship on the Law of the Sea was awarded in 2024, \n \nConsidering that international law should occupy an appropriate place in the \nteaching of legal disciplines at all universities, \n \nConvinced that States, international and regional organizations, universities and \ninstitutions should be encouraged to give further support to the Programme of \nAssistance and to increase their activities to promote the teaching, study, dissemination \nand wider appreciation of international law, in particular those activities that are of \nspecial benefit to persons from developing countries, \n \nReaffirming that in the conduct of the Programme of Assistance it would be \ndesirable to use as far as possible the resources and facilities made available by \nMember States, international and regional organizations, universities, institutions and \nothers, \n \nReaffirming also the hope that, in appointing highly qualified lecturers for the \nseminars to be held within the framework of the fellowship programmes in \ninternational law, account would be taken of the need to secure the representation of \nmajor legal systems and balance among various geographical regions, and \nemphasizing the need to continue to diversify the pool of lecturers, \n \n1. \nReiterates its approval of the guidelines and recommendations contained \nin section III of the reports of the Secretary-General,2 in particular those designed to \nstrengthen and revitalize the United Nations Programme of Assistance in the Teaching, \nStudy, Dissemination and Wider Appreciation of International Law in response to the \nincreasing demand for international law training and dissemination activities; \n \n2. \nAuthorizes the Secretary-General to carry out the activities specified in his \nreport3 in 2025, including the following activities to be financed from provisions in \nthe regular budget: \n \n(a) \nThe International Law Fellowship Programme, with a minimum of 20 \nfellowships; \n__________________ \n \n1  A/79/496. \n \n2  A/70/423, A/71/432, A/72/517, A/72/517/Corr.1, A/73/415, A/74/496, A/75/389, A/76/404, \nA/77/515, A/78/514 and A/79/496. \n \n3  A/79/496. \n\nUnited Nations Programme of Assistance in the Teaching, Study, \nDissemination and Wider Appreciation of International Law \nA/RES/79/120\n \n3/5\n24-23512 \n \n \n(b) \nThe United Nations Regional Courses in International Law for Africa, for \nAsia-Pacific and for Latin America and the Caribbean, with a minimum of 20 \nfellowships, preferably, and as appropriate, for a period of four weeks for each course; \n \n(c) \nThe continuation and further development of the United Nations \nAudiovisual Library of International Law, including the availability of its Historic \nArchives in the official languages of the United Nations; \n \n(d) \nThe dissemination of legal publications and lectures of the Audiovisual \nLibrary to developing countries to the extent that there are sufficient resources; \n \n3. \nAlso authorizes the Secretary-General to further expand the activities \nreferred to in paragraph 2 above, to be financed from voluntary contributions received \npursuant to paragraphs 16, 25 and 26 below; \n \n4. \nCommends the Codification Division of the Office of Legal Affairs of the \nSecretariat for the cost-saving measures undertaken with regard to the International \nLaw Fellowship Programme and the United Nations Regional Courses in International \nLaw to increase the number of fellowships for the training programmes financed from \nprovisions in the regular budget, taking into account the number of applications for \nthese programmes; \n \n5. \nAuthorizes the Secretary-General to award additional fellowships for the \ntraining programmes from available resources under the programme budget for the \nProgramme of Assistance and from voluntary contributions received pursuant to \nparagraph 26 below; \n \n6. \nRequests the Secretary-General to consider admitting, for participation in \nthe training programmes, self-funded candidates present in the host country or from \ncountries willing to bear the entire cost of their participation; \n \n7. \nAuthorizes the Secretary-General to award a minimum of one scholarship \nin 2025 under the Hamilton Shirley Amerasinghe Memorial Fellowship on the Law \nof the Sea, subject to the availability of funds from voluntary contributions; \n \n8. \nRequests the Secretary-General to continue to include resources under the \nproposed programme budget for 2026 for the International Law Fellowship \nProgramme, the United Nations Regional Courses in International Law for Africa, for \nAsia-Pacific and for Latin America and the Caribbean and for the continuation and \nfurther development of the United Nations Audiovisual Library of International Law; \n \n9. \nExpresses its appreciation to the Secretary-General for the activities \nconducted under the Programme of Assistance and, in particular, for the efforts to \nstrengthen, expand and enhance the international law training and dissemination \nactivities within the framework of the Programme in 2024; \n \n10. Also expresses its appreciation to the Secretary-General for supporting the \nestablishment of an alumni network of participants of the training programmes \norganized under the Programme of Assistance; \n \n11. \nCommends the Secretary-General for the continuation and further \ndevelopment of the United Nations Audiovisual Library of International Law as a \nmajor contribution to the teaching and dissemination of international law around the \nworld, and notes with appreciation the efforts of the Codification Division to enhance \nthe accessibility of the Audiovisual Library by making all lectures in the Lecture \nSeries available as podcasts; \n \n12. Recognizes the importance of the United Nations legal publications \nprepared by the Office of Legal Affairs, and once again requests the Secretary-General \n\nA/RES/79/120 \nUnited Nations Programme of Assistance in the Teaching, Study, \nDissemination and Wider Appreciation of International Law\n \n24-23512\n4/5 \n \nto issue the publications referred to in his previous report 4  in various formats, \nincluding hard copy publications, which are essential for developing countries; \n \n13. Expresses its appreciation for the efforts undertaken by the Codification \nDivision to bring up to date the United Nations legal publications, which greatly \nenhanced the timely issuance thereof and made possible the preparation of legal \ntraining materials, and encourages the Division to continue to explore ways of \nsustaining such efforts into the next budget cycle, subject to the availability of \nresources; \n \n14. Notes with satisfaction the issuance of publications by the Codification \nDivision, as specified in the report of the Secretary-General;  \n \n15. Expresses its appreciation for the issuance of the English-language edition \nof the International Law Handbook: Collection of Instruments as a valuable resource \nfor international law education on a broad range of core subjects of international law \nin its training programmes and for academic institutions in developing countries to \npromote international law education in those countries; \n \n16. Also expresses its appreciation for the issuance of the Recueil de droit \ninternational: Collection d\u2019instruments, the French language equivalent of the \nInternational Law Handbook, and requests Member States to provide the voluntary \ncontributions necessary to ensure the completion of such a handbook in the other \nofficial languages of the United Nations, as well as its dissemination in developing \ncountries; \n \n17. Requests the Codification Division to continue to maintain and expand its \nwebsites listed in the annex to the report of the Secretary-General as an invaluable \ntool for the dissemination of international law materials, as well as for advanced legal \nresearch; \n \n18. Requests that interns and research assistants be enlisted for the preparation \nof materials for the United Nations Audiovisual Library of International Law; \n \n19. Welcomes the efforts of the Codification Division to revitalize and conduct \nthe United Nations Regional Courses in International Law as an important training \nactivity; \n \n20. Expresses its appreciation to Ethiopia, Chile and Thailand for hosting the \nUnited Nations Regional Courses in International Law for Africa, for Latin America \nand the Caribbean and for Asia-Pacific in 2024; \n \n21. Expresses its appreciation to the African Union for the valuable \ncontribution that it continues to make to the United Nations Regional Course in \nInternational Law for Africa; \n \n22. \nOnce again encourages the Codification Division to cooperate with the \nAfrican Institute of International Law, dedicated to offering higher learning and \nresearch in international law needed for the development of Africa, in the \nimplementation of the relevant activities under the Programme of Assistance, including \nthe second International Law Seminar for African Universities, to be held in Ethiopia \nin 2025 in furtherance of paragraph 20 of its resolution 71/139 of 13 December 2016, \nsubject to any available resources, or through partnerships with United Nations \nentities, and encourages Member States and interested organizations to make voluntary \ncontributions to the International Law Seminar for African Universities; \n \n23. Expresses its appreciation to the Hague Academy of International Law for \nthe valuable contribution it continues to make to the Programme of Assistance, which \n__________________ \n \n4  A/70/423, para. 45. \n\nUnited Nations Programme of Assistance in the Teaching, Study, \nDissemination and Wider Appreciation of International Law \nA/RES/79/120\n \n5/5\n24-23512 \n \nhas enabled candidates under the International Law Fellowship Programme to attend \nand participate in the Fellowship Programme in conjunction with courses at the \nAcademy; \n \n24. Notes with appreciation the contributions of the Hague Academy to the \nteaching, study, dissemination and wider appreciation of international law, and calls \nupon Member States and interested organizations to give favourable consideration to \nthe appeal of the Academy for a continuation of support and a possible increase in \ntheir financial contributions, to enable the Academy to carry out its activities, \nparticularly those relating to the summer and winter courses, regional courses and \nprogrammes of the Centre for Studies and Research in International Law and \nInternational Relations; \n \n25. Requests the Secretary-General to continue to publicize the Programme of \nAssistance and periodically to invite Member States, universities, philanthropic \nfoundations and other interested national and international institutions and \norganizations, as well as individuals, to make voluntary contributions towards the \nfinancing of the Programme or otherwise to assist in its implementation and possible \nexpansion; \n \n26. Reiterates its request to Member States and interested organizations, \ninstitutions and individuals to make voluntary contributions for the United Nations \nAudiovisual Library of International Law and for the United Nations Regional \nCourses in International Law organized by the Codification Division as an important \ncomplement to the International Law Fellowship Programme; \n \n27. Expresses its appreciation to those Member States that have made \nvoluntary contributions to support the Programme of Assistance; \n \n28. Requests the Secretary-General to report to the General Assembly at its \neightieth session on the implementation of the Programme of Assistance in 2025 and, \nfollowing consultations with the Advisory Committee on the Programme of \nAssistance, to submit recommendations regarding the Programme in subsequent \nyears; \n \n29. Decides to include in the provisional agenda of its eightieth session the \nitem entitled \u201cUnited Nations Programme of Assistance in the Teaching, Study, \nDissemination and Wider Appreciation of International Law\u201d. \n \n47th plenary meeting \n4 December 2024 \n \n",
  "paragraphs": {
    "1": "Reiterates its approval of the guidelines and recommendations contained in section III of the reports of the Secretary-General,2 in particular those designed to strengthen and revitalize the United Nations Programme of Assistance in the Teaching, Study, Dissemination and Wider Appreciation of International Law in response to the increasing demand for international law training and dissemination activities;",
    "2": "Authorizes the Secretary-General to carry out the activities specified in his report3 in 2025, including the following activities to be financed from provisions in the regular budget: (a) The International Law Fellowship Programme, with a minimum of 20 fellowships; (b) The United Nations Regional Courses in International Law for Africa, for Asia-Pacific and for Latin America and the Caribbean, with a minimum of 20 fellowships, preferably, and as appropriate, for a period of four weeks for each course; (c) The continuation and further development of the United Nations Audiovisual Library of International Law, including the availability of its Historic Archives in the official languages of the United Nations; (d) The dissemination of legal publications and lectures of the Audiovisual Library to developing countries to the extent that there are sufficient resources;",
    "3": "Also authorizes the Secretary-General to further expand the activities referred to in paragraph 2 above, to be financed from voluntary contributions received pursuant to paragraphs 16, 25 and 26 below;",
    "4": "Commends the Codification Division of the Office of Legal Affairs of the Secretariat for the cost-saving measures undertaken with regard to the International Law Fellowship Programme and the United Nations Regional Courses in International Law to increase the number of fellowships for the training programmes financed from provisions in the regular budget, taking into account the number of applications for these programmes;",
    "5": "Authorizes the Secretary-General to award additional fellowships for the training programmes from available resources under the programme budget for the Programme of Assistance and from voluntary contributions received pursuant to paragraph 26 below;",
    "6": "Requests the Secretary-General to consider admitting, for participation in the training programmes, self-funded candidates present in the host country or from countries willing to bear the entire cost of their participation;",
    "7": "Authorizes the Secretary-General to award a minimum of one scholarship in 2025 under the Hamilton Shirley Amerasinghe Memorial Fellowship on the Law of the Sea, subject to the availability of funds from voluntary contributions;",
    "8": "Requests the Secretary-General to continue to include resources under the proposed programme budget for 2026 for the International Law Fellowship Programme, the United Nations Regional Courses in International Law for Africa, for Asia-Pacific and for Latin America and the Caribbean and for the continuation and further development of the United Nations Audiovisual Library of International Law;",
    "9": "Expresses its appreciation to the Secretary-General for the activities conducted under the Programme of Assistance and, in particular, for the efforts to strengthen, expand and enhance the international law training and dissemination activities within the framework of the Programme in 2024;",
    "10": "Also expresses its appreciation to the Secretary-General for supporting the establishment of an alumni network of participants of the training programmes organized under the Programme of Assistance;",
    "11": "Commends the Secretary-General for the continuation and further development of the United Nations Audiovisual Library of International Law as a major contribution to the teaching and dissemination of international law around the world, and notes with appreciation the efforts of the Codification Division to enhance the accessibility of the Audiovisual Library by making all lectures in the Lecture Series available as podcasts;",
    "12": " to issue the publications referred to in his previous report 4 in various formats, including hard copy publications, which are essential for developing countries;",
    "13": "Expresses its appreciation for the efforts undertaken by the Codification Division to bring up to date the United Nations legal publications, which greatly enhanced the timely issuance thereof and made possible the preparation of legal training materials, and encourages the Division to continue to explore ways of sustaining such efforts into the next budget cycle, subject to the availability of resources;",
    "14": "Notes with satisfaction the issuance of publications by the Codification Division, as specified in the report of the Secretary-General;",
    "15": "Expresses its appreciation for the issuance of the English-language edition of the International Law Handbook: Collection of Instruments as a valuable resource for international law education on a broad range of core subjects of international law in its training programmes and for academic institutions in developing countries to promote international law education in those countries;",
    "16": "Also expresses its appreciation for the issuance of the Recueil de droit international: Collection d\u2019instruments, the French language equivalent of the International Law Handbook, and requests Member States to provide the voluntary contributions necessary to ensure the completion of such a handbook in the other official languages of the United Nations, as well as its dissemination in developing countries;",
    "17": "Requests the Codification Division to continue to maintain and expand its websites listed in the annex to the report of the Secretary-General as an invaluable tool for the dissemination of international law materials, as well as for advanced legal research;",
    "18": "Requests that interns and research assistants be enlisted for the preparation of materials for the United Nations Audiovisual Library of International Law;",
    "19": "Welcomes the efforts of the Codification Division to revitalize and conduct the United Nations Regional Courses in International Law as an important training activity;",
    "20": "Expresses its appreciation to Ethiopia, Chile and Thailand for hosting the United Nations Regional Courses in International Law for Africa, for Latin America and the Caribbean and for Asia-Pacific in 2024;",
    "21": "Expresses its appreciation to the African Union for the valuable contribution that it continues to make to the United Nations Regional Course in International Law for Africa;",
    "22": "Once again encourages the Codification Division to cooperate with the African Institute of International Law, dedicated to offering higher learning and research in international law needed for the development of Africa, in the implementation of the relevant activities under the Programme of Assistance, including the second International Law Seminar for African Universities, to be held in Ethiopia in 2025 in furtherance of paragraph 20 of its resolution 71/139 of 13 December 2016, subject to any available resources, or through partnerships with United Nations entities, and encourages Member States and interested organizations to make voluntary contributions to the International Law Seminar for African Universities;",
    "23": "Expresses its appreciation to the Hague Academy of International Law for the valuable contribution it continues to make to the Programme of Assistance, which has enabled candidates under the International Law Fellowship Programme to attend and participate in the Fellowship Programme in conjunction with courses at the Academy;",
    "24": "Notes with appreciation the contributions of the Hague Academy to the teaching, study, dissemination and wider appreciation of international law, and calls upon Member States and interested organizations to give favourable consideration to the appeal of the Academy for a continuation of support and a possible increase in their financial contributions, to enable the Academy to carry out its activities, particularly those relating to the summer and winter courses, regional courses and programmes of the Centre for Studies and Research in International Law and International Relations;",
    "25": "Requests the Secretary-General to continue to publicize the Programme of Assistance and periodically to invite Member States, universities, philanthropic foundations and other interested national and international institutions and organizations, as well as individuals, to make voluntary contributions towards the financing of the Programme or otherwise to assist in its implementation and possible expansion;",
    "26": "Reiterates its request to Member States and interested organizations, institutions and individuals to make voluntary contributions for the United Nations Audiovisual Library of International Law and for the United Nations Regional Courses in International Law organized by the Codification Division as an important complement to the International Law Fellowship Programme;",
    "27": "Expresses its appreciation to those Member States that have made voluntary contributions to support the Programme of Assistance;",
    "28": "Requests the Secretary-General to report to the General Assembly at its eightieth session on the implementation of the Programme of Assistance in 2025 and, following consultations with the Advisory Committee on the Programme of Assistance, to submit recommendations regarding the Programme in subsequent years;",
    "29": "Decides to include in the provisional agenda of its eightieth session the item entitled \u201cUnited Nations Programme of Assistance in the Teaching, Study, Dissemination and Wider Appreciation of International Law\u201d."
  },
  "agenda_items": [
    "Item 78"
  ],
  "symbol_references": []
}