{
  "symbol": "A/RES/80/139",
  "filename": "A_RES_80_139.pdf",
  "title": "80/139. Implementation of the United Nations Convention to Combat Desertification in Those Countries Experiencing Serious Drought and/or Desertification, Particularly in Africa",
  "text": "United Nations \nA/RES/80/139 \n \nGeneral Assembly \nDistr.: General \n18 December 2025 \n25-20764 (E) \n*2520764* \n \n \nEightieth session \nAgenda item 18 (e) \nSustainable development: implementation of the \nUnited Nations Convention to Combat Desertification \nin Those Countries Experiencing Serious Drought \nand/or Desertification, Particularly in Africa \n \n \n \n \n Resolution adopted by the General Assembly \non 15 December 2025 \n \n \n[on the report of the Second Committee (A/80/555, para. 7)] \n \n \n 80/139. Implementation of the United Nations Convention to Combat \nDesertification in Those Countries Experiencing Serious Drought \nand/or Desertification, Particularly in Africa \n \n \n \nThe General Assembly, \n \nRecalling its resolution 79/207 of 19 December 2024, as well as other \nresolutions relating to the implementation of the United Nations Convention to \nCombat Desertification in Those Countries Experiencing Serious Drought and/or \nDesertification, Particularly in Africa,1 \n \nReaffirming its resolution 70/1 of 25 September 2015, entitled \u201cTransforming \nour world: the 2030 Agenda for Sustainable Development\u201d, in which it adopted a \ncomprehensive, far-reaching and people-centred set of universal and transformative \nSustainable Development Goals and targets, its commitment to working tirelessly for \nthe full implementation of the Agenda by 2030, its recognition that eradicating \npoverty in all its forms and dimensions, including extreme poverty, is the greatest \nglobal challenge and an indispensable requirement for sustainable development, and \nits commitment to achieving sustainable development in its three dimensions \u2013 \neconomic, social and environmental \u2013 in a balanced and integrated manner and to \nbuilding upon the achievements of the Millennium Development Goals and seeking \nto address their unfinished business,  \n \nRecalling that, in the 2030 Agenda, the international community committed to \ncombating desertification, restoring degraded land and soil, including land affected \n_______________ \n \n1 United Nations, Treaty Series, vol. 1954, No. 33480. \n\nA/RES/80/139 \nImplementation of the United Nations Convention to Combat \nDesertification in Those Countries Experiencing Serious Drought \nand/or Desertification, Particularly in Africa\n \n25-20764\n2/11 \n \nby desertification, drought and floods, and striving to achieve a land degradation-\nneutral world by 2030,  \n \nRecognizing that Sustainable Development Goal targets 15.3, 6.1 and 6.6 and \nthe setting of voluntary Land Degradation Neutrality targets have created strong \nmomentum for accelerating the implementation of the Convention,  \n \nReaffirming its resolution 69/313 of 27 July 2015 on the Addis Ababa Action \nAgenda of the Third International Conference on Financing for Development, which \nis an integral part of the 2030 Agenda for Sustainable Development, supports and \ncomplements it, helps to contextualize its means of implementation targets with \nconcrete policies and actions, and reaffirms the strong political commitment to \naddress the challenge of financing and creating an enabling environment at all levels \nfor sustainable development in the spirit of global partnership and solidarity,  \n \nWelcoming the convening of the Fourth International Conference on Financing \nfor Development from 30 June to 3 July 2025 in Sevilla, Spain, and reaffirming its \noutcome document, the Sevilla Commitment, endorsed by the General Assembly in \nits resolution 79/323 of 25 August 2025, which sets forth a renewed global framework \nfor financing for development, building on the 2015 Addis Ababa Action Agenda, 2 to \nclose with urgency the estimated annual 4 trillion United States dollar financing gap, 3 \nand catalyse sustainable development investments at scale in developing countries \nand continue the reform of the international financial architecture through continued \nand strong commitment to multilateralism, international cooperation, and global \nsolidarity,  \n \nRecalling the Sendai Declaration4 and the Sendai Framework for Disaster Risk \nReduction 2015\u201320305 and the high-level meeting of the General Assembly on the \nmidterm review of the implementation of the Sendai Framework for Disaster Risk \nReduction 2015\u20132030, held in New York on 18 and 19 May 2023 at which the General \nAssembly adopted the political declaration on the midterm review of the Sendai \nFramework,6 \n \nNoting with concern that up to 40 per cent of the world\u2019s land is degraded, \nnegatively affecting over 3.2 billion people and causing annual economic losses of \n878 billion United States dollars, including 307 billion dollars attributable to drought \ndamages, and recognizing the need to close the estimated substantial financial gap of \n278 billion dollars needed annually to meet the objectives of the Convention, \n \nRecognizing that drought is a global concern with increasing impacts on people \nin vulnerable situations, particularly those dependent on agriculture, and noting the \ngrowing importance of proactive and prospective drought management, strengthened \ncollaboration, capacity-building and knowledge exchange to enhance drought \nresilience, especially in developing countries,  \n \nNoting that combating desertification, land degradation and drought, including \nthrough conservation, protection, sustainable management and restoration of natural \nresources, can contribute to sustainable development for all and to easing \ndisplacement flows, \n \nNoting also that restoring degraded lands generates benefits for agriculture \nproduction and food security, with benefits for populations, brings more food to the \n_______________ \n \n2 General Assembly resolution 69/313, annex. \n \n3 Financing for Sustainable Development Report 2024 (United Nations publication, 2024), \nfigure I.1. \n \n4 Resolution 69/283, annex I. \n \n5 Ibid., annex II. \n \n6 Resolution 77/289, annex. \n\nImplementation of the United Nations Convention to Combat \nDesertification in Those Countries Experiencing Serious Drought \nand/or Desertification, Particularly in Africa \nA/RES/80/139\n \n3/11\n25-20764 \n \nhungry and to the markets, restores ecosystems and biodiversity and enhances \nresilience to climate change impacts, including by sequestering huge quantities of \ncarbon from the atmosphere and bringing carbon into the soil,  \n \nRecalling that, in its decision 3/COP.15,7 the Conference of the Parties to the \nConvention invited Parties that have committed to voluntary Land Degradation \nNeutrality Targets to implement measures to accelerate the achievement thereof, by, \ninter alia, creating an enabling environment for the achievement of land degradation \nneutrality, including the responsible governance of land and tenure security, the \nengagement of stakeholders and the improved access of smallholders to advisory and \nfinancial services, in particular for women and those in vulnerable situations, \ntherefore, taking note with appreciation of the pledge made by 131 countries to \nestablish national voluntary targets and relevant measures to achieve land degradation \nneutrality by 2030, while 112 Parties have successfully completed this voluntary \nprocess and 106 have already published their national reports on the website of the \nConvention,  \n \nBearing in mind its resolution 73/284 of 1 March 2019, in which it declared the \ndecade 2021\u20132030 as the United Nations Decade on Ecosystem Restoration,  \n \nRecalling the adoption of the 2018\u20132030 Strategic Framework of the \nConvention,8 including a new strategic objective on drought, \n \nTaking note of resolution 6/14 of 1 March 2024 of the United Nations \nEnvironment Assembly, entitled \u201cStrengthening international efforts to combat \ndesertification and land degradation, restore degraded land, promote land \nconservation and sustainable land management, contribute to land degradation \nneutrality, and enhance drought resilience\u201d,9 \n \nReaffirming the Paris Agreement and its early entry into force, encouraging all \nits Parties to fully implement the Agreement, and Parties to the United Nations \nFramework Convention on Climate Change10 that have not yet done so to deposit their \ninstruments of ratification, acceptance, approval or accession, where appropriate, as \nsoon as possible, \n \nRecognizing that climate change, unsustainable agricultural and forestry \npractices, and land degradation, inter alia, are major and growing drivers of \nbiodiversity loss and ecosystem degradation, and that conservation, restoration and \nthe sustainable use of biodiversity, and ecosystem functions and services, sustainable \nland and water management approaches and technologies, including through nature-\nbased solutions, ecosystem-based approaches and other management and \nconservation approaches, in line with resolution 5/5 of 2 March 2022 of the United \nNations Environment Assembly, 11  contribute significantly to land degradation \nneutrality, climate change adaptation and mitigation, disaster risk reduction and food \nsecurity and nutrition,  \n \nNoting with concern the findings of the second edition of Global Land Outlook \nand the findings of the Intergovernmental Science-Policy Platform on Biodiversity \nand Ecosystem Services Assessment Report on Land Degradation and Restoration \nand its Global Assessment Report on Biodiversity and Ecosystem Services,  \n_______________ \n \n7 See ICCD/COP(15)/23/Add.1. \n \n8 ICCD/COP(13)/21/Add.1, decision 7/COP.13, annex, and ICCD/COP(15)/23/Add.1, decision \n7/COP.15. \n \n9 UNEP/EA.6/Res.14. \n \n10 United Nations, Treaty Series, vol. 1771, No. 30822. \n \n11 UNEP/EA.5/Res.5. \n\nA/RES/80/139 \nImplementation of the United Nations Convention to Combat \nDesertification in Those Countries Experiencing Serious Drought \nand/or Desertification, Particularly in Africa\n \n25-20764\n4/11 \n \n \nNoting the findings of the Intergovernmental Panel on Climate Change in An \nIPCC Special Report on Climate Change, Desertification, Land Degradation, \nSustainable Land Management, Food Security, and Greenhouse Gas Fluxes in \nTerrestrial Ecosystems, that climate change creates additional stresses on land, \nexacerbating existing risks to livelihoods, biodiversity, human and ecosystem health, \ninfrastructure and food systems, and that many land-related responses that contribute \nto climate change adaptation and mitigation, such as agroforestry and other \nagroecological and ecosystem-based adaptation practices, among others, can also \ncombat desertification, land degradation and drought and enhance food security,  \n \nRecognizing the interdependencies between biodiversity loss, pollution, water \nscarcity, climate change, desertification, land degradation and drought, and their \ninterlinkages with food security and human well-being, including health,  \n \nDeeply concerned about the continuous trend in land degradation and the fact \nthat the impacts of desertification, land degradation and drought are felt most strongly \nby people in vulnerable situations,  \n \nRecognizing the important contribution of the sustainable management of lakes \nand other freshwater ecosystems in tackling environmental challenges,  \n \nWelcoming the convening of the United Nations Conference on the Midterm \nComprehensive Review of the Implementation of the Objectives of the International \nDecade for Action, \u201cWater for Sustainable Development\u201d, 2018\u20132028, in New York \nfrom 22 to 24 March 2023, and looking forward to the 2026 United Nations Water \nConference to Accelerate the Implementation of Sustainable Development Goal 6: \nEnsure availability and sustainable management of water and sanitation for all, to be \nco-hosted by Senegal and the United Arab Emirates, and the 2028 United Nations \nConference on the Final Comprehensive Review of the Implementation of the \nObjectives of the International Decade for Action, \u201cWater for Sustainable \nDevelopment\u201d, 2018\u20132028, to be hosted by Tajikistan,  \n \nRecognizing that combating desertification, land degradation and drought is \nimportant for sustainable, inclusive and climate-resilient recovery from the \ncoronavirus disease (COVID\u201119) pandemic and other health emergencies, that it is \nimportant to integrate land conservation, protection and restoration, sustainable land \nmanagement, degraded soil and terrestrial ecosystems restoration, combating \ndesertification and the aim of land degradation neutrality into the global agenda for \nsustainable development, and that careful targeting of the COVID\u201119 recovery \ninvestments, including land restoration, creates economic opportunities that \ncontribute to environmental sustainability and poverty eradication,  \n \nRecalling the United Nations strategic plan for forests 2017\u20132030, 12  and \nacknowledging that all types of forests provide essential ecosystem services, such as \ntimber, food, fuel, fodder, non\u2011wood products and shelter, as well as soil and water \nconservation and clean air, that the sustainable management of forests and trees \noutside forests is vital to the integrated implementation of the 2030 Agenda and that \nforests prevent land degradation and desertification and reduce the risk of floods, soil \nerosion, landslides and avalanches, droughts, sand and dust storms and other disasters,  \n \nRecalling also the decisions of the sixteenth session of the Conference of the \nParties to the United Nations Convention to Combat Desertification in Those \nCountries Experiencing Serious Drought and/or Desertification, Particularly in \nAfrica, 13  stressing the importance of their effective implementation, noting the \nRiyadh Political Declaration, which urged the need to address desertification, land \n_______________ \n \n12 See resolution 71/285. \n \n13 ICCD/COP(16)/24/Add.1. \n\nImplementation of the United Nations Convention to Combat \nDesertification in Those Countries Experiencing Serious Drought \nand/or Desertification, Particularly in Africa \nA/RES/80/139\n \n5/11\n25-20764 \n \ndegradation and drought, recognizing the importance of proactive drought \nmanagement, resilience-building and impact mitigation, the continued importance of \nachieving land degradation neutrality by 2030 and enhancing sustainable and resilient \nagriculture, and taking note of the commitment to mobilize large-scale investments in \nland restoration projects and programmes, while highlighting the need to strengthen \ninternational cooperation in support of developing countries and communities most \nvulnerable to desertification, land degradation and drought,  \n \nTaking note with appreciation of the launch of the Riyadh Global Drought \nResilience Partnership, which attracted significant financial commitments,  \n \nTaking note also of the establishment of the International Drought Resilience \nObservatory, an artificial intelligence-driven global platform developed with the \nsupport of the International Drought Resilience Alliance to assist countries in \nassessing and enhancing their capacity to cope with increasingly severe droughts, as \nmajor steps towards strengthening proactive drought management, building resilience \nand mitigating impacts,  \n \nRecalling the work and taking note of the report of the Intergovernmental \nWorking Group on Drought during the triennium 2022\u20132024, tasked with identifying \nand evaluating all options, including, inter alia, global policy instruments and regional \npolicy frameworks, and linking, where relevant, to national plans, as appropriate, to \neffectively manage drought under the Convention, including supporting a shift from \nreactive to proactive drought management,  \n \nReaffirming the importance of government leadership and multi-stakeholder \npartnerships and increasing private engagement for the sustainable management, \nrestoration and rehabilitation of ecosystems, biodiversity and degraded land,  \n \nTaking note of the creation of a Caucus for Indigenous Peoples and a Caucus for \nLocal Communities, which contributes to ensuring an approach that guarantees its \nrepresentativeness and the unique perspectives and priorities of Indigenous Peoples \nas well as of local communities, and in alignment with the principles of the \nConvention,  \n \nTaking note also of the ongoing efforts of the Gender Caucus, which contributes \nto fostering an inclusive approach in the implementation of the Convention, the \nGender Action Plan and its road map, by promoting the active participation and \nleadership of all women in addressing desertification, land degradation and drought \nin alignment with the principles of the Convention,  \n \nRecognizing the Global Initiative on Reducing Land Degradation and Enhancing \nConservation of Terrestrial Habitats to prevent, halt and reverse land degradation \nadopted by the leaders of the Group of 20 in Riyadh in 2020, as well as the Riyadh \nLeaders\u2019 Declaration, and noted in the subsequent Group of 20 Leaders\u2019 Declarations,  \n \nHighlighting the work of the Convention secretariat through the Land \nDegradation Neutrality Target Setting Programme, which has supported 113 countries \nand is currently implementing Land Degradation Neutrality Target Setting \nProgramme 2.0, assisting 18 of these countries to refine targets, enhance monitoring \nsystems and develop integrated land-use plans and investment frameworks, as well as \nan Integrated Land Use Planning project that is also being implanted with funding \nfrom the Global Environment Facility to support countries in spatial planning that \naligns with voluntary Land Degradation Neutrality targets and large-scale land \nrestoration initiatives across multiple regions which, by mid-2024, had mobilized \n946 million dollars for 29 projects,  \n\nA/RES/80/139 \nImplementation of the United Nations Convention to Combat \nDesertification in Those Countries Experiencing Serious Drought \nand/or Desertification, Particularly in Africa\n \n25-20764\n6/11 \n \n \nRecognizing the launch of the International Drought Resilience Alliance with a \nview to enhancing drought resilience and the celebration of its first plenary on the \nmargins of the sixteenth session of the Conference of the Parties, in Riyadh,  \n \nNoting the Drought Resilience +10 Conference, held in Geneva from \n30 September to 2 October 2024, \n \nHighlighting the importance of multi-stakeholder participation at the local, \nsubnational, national and regional levels and from all sectors of society, including \ncivil society organizations, local government and the private sector, as appropriate, in \nthe implementation of the Convention and its 2018\u20132030 Strategic Framework,  \n \nRecognizing the value of knowledge, education, science and new technology to \nsustainable land management, including making use of, inter alia, the Voluntary \nGuidelines for Sustainable Soil Management of the Food and Agriculture \nOrganization of the United Nations, emphasizing the importance of science-based \ndecision-making and that science and technology to combat desertification, land \ndegradation and drought should therefore be further promoted, and acknowledging \nthe work of the Science-Policy Interface of the Convention,  \n \nWelcoming the convening of the global observance of the World Day to Combat \nDesertification and Drought under the theme \u201cRestore the Land. Unlock the \nopportunities\u201d, by the Government of Colombia, in Bogot\u00e1 on 17 June 2025,  \n \n1. \nTakes note of the report of the Secretary-General on the implementation of \nresolution 79/207 on the United Nations Convention to Combat Desertification in \nThose Countries Experiencing Serious Drought and/or Desertification, Particularly in \nAfrica;14 \n \n2. \nNotes the recent appointment of the new Executive Secretary of the United \nNations Convention to Combat Desertification and expresses its support for her \ntenure;  \n \n3. \nWelcomes the convening of the sixteenth session of the Conference of the \nParties to the United Nations Convention to Combat Desertification in Those \nCountries Experiencing Serious Drought and/or Desertification, Particularly in \nAfrica, held in Riyadh from 2 to 13 December 2024, under the theme \u201cOur land. Our \nfuture\u201d, and the adoption of its decisions and calls for their full implementation, and \nlooks forward to the convening of the seventeenth session of the Conference of the \nParties, to be held in Ulaanbaatar, from 17 to 28 August 2026;  \n \n4. \nAlso welcomes the convening of the sixteenth meeting of the Conference \nof the Parties to the Convention on Biological Diversity, as well as the Meetings of \nthe Parties to the Protocols to the Convention, held in Cali, Colombia, from \n21 October to 1 November 2024, under the theme \u201cPeace with nature\u201d, as well as the \ntwo resumed sessions of the sixteenth meeting of the Conference of the Parties to the \nConvention, held online from 3 to 6 December 2024 and in Rome, Italy, from 25 to \n27 February 2025, takes note of their adopted decisions, and looks forward to the \nseventeenth meeting of the Conference of the Parties and the meetings of the \nConference of the Parties serving as the Meetings of the Parties to the Protocols to \nthe Convention, to be held in Yerevan, Armenia, from 18 to 30 October 2026;  \n \n5. \nFurther \nwelcomes \nthe \nKunming-Montreal \nGlobal \nBiodiversity \nFramework, and urges its early, inclusive and effective implementation;  \n_______________ \n \n14 A/80/373, sect. II. \n\nImplementation of the United Nations Convention to Combat \nDesertification in Those Countries Experiencing Serious Drought \nand/or Desertification, Particularly in Africa \nA/RES/80/139\n \n7/11\n25-20764 \n \n \n6. \nUrges the implementation of the Paris Agreement and the agreed \nintergovernmentally negotiated outcomes and decisions of the subsequent United \nNations climate change conferences; \n \n7. \nInvites Member States to support efforts to implement the strategic \nobjectives of the United Nations Convention to Combat Desertification in Those \nCountries Experiencing Serious Drought and/or Desertification, Particularly in \nAfrica;  \n \n8. \nWelcomes the voluntary commitment of the Parties to the Convention to \naccelerate the restoration of 1 billion hectares of degraded land by 2030 by improving \ndata gathering and monitoring to track progress against the achievement of land \nrestoration commitments and establishing a new partnership model for large-scale \nintegrated landscape investment programmes;  \n \n9. \nStrongly encourages the Parties to the Convention to apply and align with \nthe 2018\u20132030 Strategic Framework of the Convention, to consider refining their \nvoluntary Land Degradation Neutrality targets, as appropriate, and mainstream those \ntargets in their national policies, programmes, plans and processes relating to \ndesertification, land degradation and drought, and to implement the Strategic \nFramework, taking into account the Addis Ababa Action Agenda of the Third \nInternational Conference on Financing for Development;15 \n \n10. Welcomes the work of the Intergovernmental Working Group to oversee \nthe midterm evaluation process related to the 2018\u20132030 Strategic Framework of the \nConvention, takes note of its recommendations from the sixteenth session of the \nConference of the Parties, and encourages Parties, with the support of the Convention \nsecretariat, to consider its findings, implement its recommendations and strengthen \nmonitoring, reporting, resource mobilization and access to funding from multiple \nsources to advance actions, including for the development of large-scale projects to \ncombat desertification and land degradation and mitigate the effect of drought;  \n \n11. Reaffirms that reducing land degradation and achieving land degradation \nneutrality has the potential to act as an accelerator and integrator for achieving the \nSustainable Development Goals and respond to the overall objectives of the 2030 \nAgenda for Sustainable Development;16 \n \n12. Encourages Member States to pursue considering target 15.3 of the \nSustainable Development Goals as an integrator and accelerator to achieve other \nSustainable Development Goals;  \n \n13. Reiterates the need to combat desertification, reduce land degradation, \nrestore degraded land and soil, including land affected by desertification, drought and \nfloods, and strive to achieve a land degradation-neutral world, recalls with \nappreciation the voluntary Land Degradation Neutrality Target Setting Programme \nconsistent with the Convention and the work of the secretariat of the Convention and \npartners to assist Parties to the Convention in carrying out voluntary target-setting \nactivities, emphasizes the need for capacity-building and opportunities for Parties that \nhave yet to set land degradation neutrality targets, and in this respect reiterates its \ninvitation to Parties to the Convention that have not yet subscribed to the programme \nto do so;  \n \n14. Recognizes \nthat \nsustainable \nland \nmanagement \napproaches \nand \ntechnologies, including through nature-based solutions, ecosystem-based approaches \nand other management and conservation approaches, in line with resolution 5/5 of the \n_______________ \n \n15 Resolution 69/313, annex. \n \n16 Resolution 70/1. \n\nA/RES/80/139 \nImplementation of the United Nations Convention to Combat \nDesertification in Those Countries Experiencing Serious Drought \nand/or Desertification, Particularly in Africa\n \n25-20764\n8/11 \n \nUnited Nations Environment Assembly, constitute promising options to evaluate and \nconsider in connection with sequestering carbon and enhancing the resilience of \npeople and ecosystems affected by desertification, land degradation and drought, as \nwell as the adverse effects of climate change and biodiversity loss;  \n \n15. Also recognizes the launch of the Communities of Learning and Practice \non Drought Management, aimed at engaging national focal points and drought experts \nacross countries and regions, promoting bottom-up approaches, utilizing the \nintegrated components of the Convention\u2019s Drought Toolbox and supporting the \ndissemination of lessons learned to national, regional, and global processes; \n \n16. Further recognizes the importance of applying new and innovative \ntechnologies and enabling policies and approaches, as well as sharing best practices, \nin combating desertification, land degradation and drought, as well as enhancing \ndrought resilience, and requests the Secretary-General to continue to identify, as \nappropriate, those technologies, enabling policies and best practices in his report on \nthe implementation of the present resolution;  \n \n17. Encourages the entities of the United Nations system, when designing and \nimplementing their programmes and projects, to take into account the role of \nachieving land degradation neutrality as a potential accelerator to achieve the \nSustainable Development Goals;  \n \n18. Underlines the importance of comprehensive reporting, follow-up and \nreview at the global, national and regional levels, as appropriate, in order to track \nprogress in the implementation of the Convention, welcomes in this regard the \nconvening of the twenty second session of the Committee for the Review of the \nImplementation of the Convention in Riyadh, from 2 to 13 December 2024, and looks \nforward to the convening of the twenty-third session of the Committee for the Review \nof the Implementation of the Convention in Panama City from 1 to 5 December 2025;  \n \n19. Reiterates the invitation to Parties to the Convention to take measures to \nensure, as appropriate, that their relevant institutions adopt a proactive approach to \ndrought management and integrate drought resilience and risk management, \nsustainable livestock and agricultural policies, drought forecasting work, sustainable \nwater management and climate information and climate change impact assessments \ninto relevant policymaking processes and initiatives; \n \n20. Takes note of the Riyadh Global Drought Resilience Partnership, with a \nview to ensuring its timely and effective support to countries vulnerable to drought \nand land degradation;  \n \n21. Reiterates its invitation to the Parties to the Convention to provide the \nExecutive Secretary of the Convention with full support in the fulfilment of her \nmandate and in promoting the implementation of the Convention;  \n \n22. Stresses the urgent need to enhance adaptive capacity, strengthen resilience \nand reduce vulnerability to climate change, extreme weather events and sand and dust \nstorms, and in this regard urges Member States to continue to engage in adaptation \nplanning processes and to enhance cooperation in disaster risk reduction;  \n \n23. Recognizes the contributions of Indigenous Peoples and of local \ncommunities, including their knowledge, to combating desertification, land \ndegradation and drought;  \n \n24. Invites the United Nations Coalition on Combating Sand and Dust Storms, \nwhich was formed at the twenty-fourth meeting of the senior officials of the \nEnvironment Management Group, in September 2018, and other relevant United \n\nImplementation of the United Nations Convention to Combat \nDesertification in Those Countries Experiencing Serious Drought \nand/or Desertification, Particularly in Africa \nA/RES/80/139\n \n9/11\n25-20764 \n \nNations entities to continue their collaboration to assist affected country Parties in \ndeveloping and implementing national and regional policies on sand and dust storms;  \n \n25. Recalls its resolution 78/314 of 10 July 2024, in which it proclaimed 2025\u2013\n2034 the United Nations Decade on Combating Sand and Dust Storms, within existing \nstructures and available resources, with the aim of enhancing international and \nregional cooperation and supporting and scaling up efforts to prevent, halt and \nmitigate the negative effects of sand and dust storms, especially on affected countries;  \n \n26. Recognizes that gender equality and the empowerment of all women and \ngirls remain a crucial contribution to the effective implementation of the Convention, \nincluding its 2018\u20132030 Strategic Framework, and to the achievement of the Goals \nof the 2030 Agenda, stresses the importance of Parties to the Convention and partners \nstriving to ensure the equal participation of women and men in planning, decision-\nmaking and implementation at all levels and further achieving gender equality and \nthe empowerment of all women and girls, as well as women\u2019s full, equal, effective \nand meaningful participation in desertification, land degradation and drought-related \npolicies and activities, and also stresses the importance of the effective \nimplementation of the four priority thematic areas of the Gender Action Plan adopted \nby the parties to the Convention;  \n \n27. Reiterates the invitation to the secretariat and the Global Mechanism of \nthe Convention to continue to collaborate and build partnerships with the secretariats \nof the other Rio conventions, the United Nations Entity for Gender Equality and the \nEmpowerment of Women (UN-Women), other United Nations entities, international \norganizations and other relevant organizations to explore further ways of \nstrengthening awareness-raising, improving the Gender Action Plan and developing \nfurther tools and guidelines for the use of Parties in the thematic areas of the Gender \nAction Plan and the gender-responsive implementation of the Convention;  \n \n28. Recalls the invitation to Parties to the Convention to legally recognize \nrights to equal use and ownership of land for women and the enhancement of women\u2019s \nequal access to land and land tenure security, as well as the promotion of gender-\nsensitive measures to combat desertification, land degradation and drought and \nachieve land degradation neutrality, taking into account the national context, and in \nthis context notes the Abidjan Declaration on Achieving Gender Equality for \nSuccessful Land Restoration, which promotes all measures necessary to identify and \neliminate all forms of discrimination against women, with particular attention to the \nrights of older women, widows, women with disabilities and young women;  \n \n29. Encourages Parties to the Convention to follow the principles of \nimplementation of the Voluntary Guidelines on the Responsible Governance of Tenure \nof Land, Fisheries and Forests in the Context of National Food Security 17 in the \nimplementation of activities to combat desertification, land degradation and drought;  \n \n30. Encourages the public and private sectors to continue to invest in \ndeveloping, adapting and scaling up the application of technologies, enabling \npolicies, methods and tools to combat desertification, land degradation and drought \nin different regions, and to boost knowledge exchange, including of traditional \nknowledge with the consent of the knowledge holders, skills training, capacity-\nbuilding and sharing of technologies on mutually agreed terms;  \n \n31. Encourages Parties to the Convention to continue to promote the \nprevention of desertification, land degradation and drought with an integrated \n_______________ \n \n17 Food and Agriculture Organization of the United Nations, document CL 144/9 (C 2013/20), \nappendix D. \n\nA/RES/80/139 \nImplementation of the United Nations Convention to Combat \nDesertification in Those Countries Experiencing Serious Drought \nand/or Desertification, Particularly in Africa\n \n25-20764\n10/11 \n \nlandscape approach by sustainably managing land and water resources, avoiding \npractices that degrade land and rehabilitating and restoring already degraded land;  \n \n32. Encourages also developed countries Party to the Convention and other \nrelevant stakeholders to actively support the efforts of developing countries Party to \nthe Convention in promoting sustainable land management practices and in seeking \nto achieve a land degradation-neutral world by providing substantial financial \nresources from all sources, facilitated access to appropriate technology on mutually \nagreed terms and other forms of support, including through capacity-building \nmeasures;  \n \n33. Recognizes the benefits gained from cooperation through the sharing of \nclimate and weather information, forecasting and early warning systems related to \ndesertification, land degradation and drought, while also taking account of sand and \ndust storms, at the global, regional and subregional levels, and in this regard likewise \nrecognizes the need for further cooperation between Parties to the Convention and \nrelevant organizations in the sharing of related information, forecasting and early \nwarning systems;  \n \n34. Calls upon the United Nations entities to mainstream drought resilience in \ntheir programmes when supporting countries prone to droughts or already affected, \nwith an emphasis on enhancing preparation and resilience, noting the need for drought \nmanagement through, inter alia, impactful policies, early warning systems, \npreparedness and mitigation, land restoration, sustainable agricultural and livestock \npolicies and related actions to advance the neutrality of land degradation, in countries \naffected by drought and/or desertification;  \n \n35. Encourages all relevant entities of the United Nations system, within their \nrespective mandates, to harness opportunities for leveraging synergies among the \nConvention on Biological Diversity, the United Nations Convention to Combat \nDesertification in Those Countries Experiencing Serious Drought and/or \nDesertification, Particularly in Africa, and the United Nations Framework Convention \non Climate Change and other relevant multilateral environmental agreements, as well \nas the 2030 Agenda, and in this respect welcomes the ongoing efforts to strengthen \nsynergies among the secretariats of the aforementioned conventions;  \n \n36. Takes note of the United Nations Decade for Deserts and the Fight against \nDesertification and the United Nations Decade on Ecosystem Restoration, and calls \nfor measures to explore and promote consumption and production patterns that \nconserve and protect land;  \n \n37. Welcomes the convening of the thirtieth session of the Conference of the \nParties to the United Nations Framework Convention on Climate Change, held in \nBel\u00e9m, Brazil, from 10 to 21 November 2025, and looks forward to the convening of \nthe thirty-first session of the Conference of the Parties to the United Nations \nFramework Convention on Climate Change, to be held in 2026;  \n \n38. Notes with appreciation the financial contributions that have been made \nby Member States and other donors towards the Land Degradation Neutrality Fund, \nand invites Member States and other donors to make further contributions to the Land \nDegradation Neutrality Fund and the drought initiative of the United Nations \nConvention to Combat Desertification in Those Countries Experiencing Serious \nDrought and/or Desertification, Particularly in Africa;  \n \n39. Decides to include, in the United Nations calendar of conferences and \nmeetings for the year 2026 and subsequent years, the sessions of the Conference of \nthe Parties to the Convention and each of its subsidiary bodies, and requests the \n\nImplementation of the United Nations Convention to Combat \nDesertification in Those Countries Experiencing Serious Drought \nand/or Desertification, Particularly in Africa \nA/RES/80/139\n \n11/11\n25-20764 \n \nSecretary-General to continue to make provisions for those sessions in the proposed \nprogramme budgets;  \n \n40. Acknowledges the commitment of the Parties to the Convention to boost \ndrought resilience by identifying the expansion of arid, semi-arid, dry subhumid areas \nand drylands, improving national policies and early warning systems linked to early \naction, learning and sharing knowledge, building partnerships and coordinating \naction, and mobilizing drought finance to support a shift from reactive to proactive \ndrought management, and recognizes the ongoing efforts of the Coalition for Disaster-\nResilient Infrastructure, the Risk-Informed Early Action Partnership, the Early \nWarnings for All initiative and the Climate Risk and Early Warning Systems \n(CREWS) initiative;  \n \n41. Also acknowledges the decision of the Conference of the Parties at its \nfifteenth session with respect to promoting decent land-based jobs for youth and land-\nbased youth entrepreneurship and strengthening youth participation in the processes \nrelating to the Convention;  \n \n42. Reaffirms the continuation, for a further five-year period, of the current \ninstitutional linkage and related administrative arrangements with the United Nations \nSecretariat, to be reviewed by both the General Assembly and the Conference of the \nParties no later than 31 December 2026;  \n \n43. Requests the Secretary-General to submit to the General Assembly, at its \neighty-first session, a report on the implementation of the present resolution, and \ndecides to include in the provisional agenda of its eighty-first session, under the item \nentitled \u201cSustainable development\u201d, the sub-item entitled \u201cImplementation of the \nUnited Nations Convention to Combat Desertification in Those Countries Experiencing \nSerious Drought and/or Desertification, Particularly in Africa\u201d.  \n \n64th plenary meeting \n15 December 2025 \n \n",
  "paragraphs": {
    "1": "Takes note of the report of the Secretary-General on the implementation of resolution 79/207 on the United Nations Convention to Combat Desertification in Those Countries Experiencing Serious Drought and/or Desertification, Particularly in Africa;14",
    "2": "Notes the recent appointment of the new Executive Secretary of the United Nations Convention to Combat Desertification and expresses its support for her tenure;",
    "3": "Welcomes the convening of the sixteenth session of the Conference of the Parties to the United Nations Convention to Combat Desertification in Those Countries Experiencing Serious Drought and/or Desertification, Particularly in Africa, held in Riyadh from 2 to 13 December 2024, under the theme \u201cOur land. Our future\u201d, and the adoption of its decisions and calls for their full implementation, and looks forward to the convening of the seventeenth session of the Conference of the Parties, to be held in Ulaanbaatar, from 17 to 28 August 2026;",
    "4": "Also welcomes the convening of the sixteenth meeting of the Conference of the Parties to the Convention on Biological Diversity, as well as the Meetings of the Parties to the Protocols to the Convention, held in Cali, Colombia, from 21 October to 1 November 2024, under the theme \u201cPeace with nature\u201d, as well as the two resumed sessions of the sixteenth meeting of the Conference of the Parties to the Convention, held online from 3 to 6 December 2024 and in Rome, Italy, from 25 to 27 February 2025, takes note of their adopted decisions, and looks forward to the seventeenth meeting of the Conference of the Parties and the meetings of the Conference of the Parties serving as the Meetings of the Parties to the Protocols to the Convention, to be held in Yerevan, Armenia, from 18 to 30 October 2026;",
    "5": "Further welcomes the Kunming-Montreal Global Biodiversity Framework, and urges its early, inclusive and effective implementation;",
    "6": "Urges the implementation of the Paris Agreement and the agreed intergovernmentally negotiated outcomes and decisions of the subsequent United Nations climate change conferences;",
    "7": "Invites Member States to support efforts to implement the strategic objectives of the United Nations Convention to Combat Desertification in Those Countries Experiencing Serious Drought and/or Desertification, Particularly in Africa;",
    "8": "Welcomes the voluntary commitment of the Parties to the Convention to accelerate the restoration of 1 billion hectares of degraded land by 2030 by improving data gathering and monitoring to track progress against the achievement of land restoration commitments and establishing a new partnership model for large-scale integrated landscape investment programmes;",
    "9": "Strongly encourages the Parties to the Convention to apply and align with the 2018\u20132030 Strategic Framework of the Convention, to consider refining their voluntary Land Degradation Neutrality targets, as appropriate, and mainstream those targets in their national policies, programmes, plans and processes relating to desertification, land degradation and drought, and to implement the Strategic Framework, taking into account the Addis Ababa Action Agenda of the Third International Conference on Financing for Development;15",
    "10": "Welcomes the work of the Intergovernmental Working Group to oversee the midterm evaluation process related to the 2018\u20132030 Strategic Framework of the Convention, takes note of its recommendations from the sixteenth session of the Conference of the Parties, and encourages Parties, with the support of the Convention secretariat, to consider its findings, implement its recommendations and strengthen monitoring, reporting, resource mobilization and access to funding from multiple sources to advance actions, including for the development of large-scale projects to combat desertification and land degradation and mitigate the effect of drought;",
    "11": "Reaffirms that reducing land degradation and achieving land degradation neutrality has the potential to act as an accelerator and integrator for achieving the Sustainable Development Goals and respond to the overall objectives of the 2030 Agenda for Sustainable Development;16",
    "12": "Encourages Member States to pursue considering target 15.3 of the Sustainable Development Goals as an integrator and accelerator to achieve other Sustainable Development Goals;",
    "13": "Reiterates the need to combat desertification, reduce land degradation, restore degraded land and soil, including land affected by desertification, drought and floods, and strive to achieve a land degradation-neutral world, recalls with appreciation the voluntary Land Degradation Neutrality Target Setting Programme consistent with the Convention and the work of the secretariat of the Convention and partners to assist Parties to the Convention in carrying out voluntary target-setting activities, emphasizes the need for capacity-building and opportunities for Parties that have yet to set land degradation neutrality targets, and in this respect reiterates its invitation to Parties to the Convention that have not yet subscribed to the programme to do so;",
    "14": "Recognizes that sustainable land management approaches and technologies, including through nature-based solutions, ecosystem-based approaches and other management and conservation approaches, in line with resolution 5/5 of the United Nations Environment Assembly, constitute promising options to evaluate and consider in connection with sequestering carbon and enhancing the resilience of people and ecosystems affected by desertification, land degradation and drought, as well as the adverse effects of climate change and biodiversity loss;",
    "15": "Also recognizes the launch of the Communities of Learning and Practice on Drought Management, aimed at engaging national focal points and drought experts across countries and regions, promoting bottom-up approaches, utilizing the integrated components of the Convention\u2019s Drought Toolbox and supporting the dissemination of lessons learned to national, regional, and global processes;",
    "16": "Further recognizes the importance of applying new and innovative technologies and enabling policies and approaches, as well as sharing best practices, in combating desertification, land degradation and drought, as well as enhancing drought resilience, and requests the Secretary-General to continue to identify, as appropriate, those technologies, enabling policies and best practices in his report on the implementation of the present resolution;",
    "17": "Encourages the entities of the United Nations system, when designing and implementing their programmes and projects, to take into account the role of achieving land degradation neutrality as a potential accelerator to achieve the Sustainable Development Goals;",
    "18": "Underlines the importance of comprehensive reporting, follow-up and review at the global, national and regional levels, as appropriate, in order to track progress in the implementation of the Convention, welcomes in this regard the convening of the twenty second session of the Committee for the Review of the Implementation of the Convention in Riyadh, from 2 to 13 December 2024, and looks forward to the convening of the twenty-third session of the Committee for the Review of the Implementation of the Convention in Panama City from 1 to 5 December 2025;",
    "19": "Reiterates the invitation to Parties to the Convention to take measures to ensure, as appropriate, that their relevant institutions adopt a proactive approach to drought management and integrate drought resilience and risk management, sustainable livestock and agricultural policies, drought forecasting work, sustainable water management and climate information and climate change impact assessments into relevant policymaking processes and initiatives;",
    "20": "Takes note of the Riyadh Global Drought Resilience Partnership, with a view to ensuring its timely and effective support to countries vulnerable to drought and land degradation;",
    "21": "Reiterates its invitation to the Parties to the Convention to provide the Executive Secretary of the Convention with full support in the fulfilment of her mandate and in promoting the implementation of the Convention;",
    "22": "Stresses the urgent need to enhance adaptive capacity, strengthen resilience and reduce vulnerability to climate change, extreme weather events and sand and dust storms, and in this regard urges Member States to continue to engage in adaptation planning processes and to enhance cooperation in disaster risk reduction;",
    "23": "Recognizes the contributions of Indigenous Peoples and of local communities, including their knowledge, to combating desertification, land degradation and drought;",
    "24": " Nations entities to continue their collaboration to assist affected country Parties in developing and implementing national and regional policies on sand and dust storms;",
    "25": "Recalls its resolution 78/314 of 10 July 2024, in which it proclaimed 2025\u2013 2034 the United Nations Decade on Combating Sand and Dust Storms, within existing structures and available resources, with the aim of enhancing international and regional cooperation and supporting and scaling up efforts to prevent, halt and mitigate the negative effects of sand and dust storms, especially on affected countries;",
    "26": "Recognizes that gender equality and the empowerment of all women and girls remain a crucial contribution to the effective implementation of the Convention, including its 2018\u20132030 Strategic Framework, and to the achievement of the Goals of the 2030 Agenda, stresses the importance of Parties to the Convention and partners striving to ensure the equal participation of women and men in planning, decision- making and implementation at all levels and further achieving gender equality and the empowerment of all women and girls, as well as women\u2019s full, equal, effective and meaningful participation in desertification, land degradation and drought-related policies and activities, and also stresses the importance of the effective implementation of the four priority thematic areas of the Gender Action Plan adopted by the parties to the Convention;",
    "27": "Reiterates the invitation to the secretariat and the Global Mechanism of the Convention to continue to collaborate and build partnerships with the secretariats of the other Rio conventions, the United Nations Entity for Gender Equality and the Empowerment of Women (UN-Women), other United Nations entities, international organizations and other relevant organizations to explore further ways of strengthening awareness-raising, improving the Gender Action Plan and developing further tools and guidelines for the use of Parties in the thematic areas of the Gender Action Plan and the gender-responsive implementation of the Convention;",
    "28": "Recalls the invitation to Parties to the Convention to legally recognize rights to equal use and ownership of land for women and the enhancement of women\u2019s equal access to land and land tenure security, as well as the promotion of gender- sensitive measures to combat desertification, land degradation and drought and achieve land degradation neutrality, taking into account the national context, and in this context notes the Abidjan Declaration on Achieving Gender Equality for Successful Land Restoration, which promotes all measures necessary to identify and eliminate all forms of discrimination against women, with particular attention to the rights of older women, widows, women with disabilities and young women;",
    "29": "Encourages Parties to the Convention to follow the principles of implementation of the Voluntary Guidelines on the Responsible Governance of Tenure of Land, Fisheries and Forests in the Context of National Food Security 17 in the implementation of activities to combat desertification, land degradation and drought;",
    "30": "Encourages the public and private sectors to continue to invest in developing, adapting and scaling up the application of technologies, enabling policies, methods and tools to combat desertification, land degradation and drought in different regions, and to boost knowledge exchange, including of traditional knowledge with the consent of the knowledge holders, skills training, capacity- building and sharing of technologies on mutually agreed terms;",
    "31": "Encourages Parties to the Convention to continue to promote the prevention of desertification, land degradation and drought with an integrated landscape approach by sustainably managing land and water resources, avoiding practices that degrade land and rehabilitating and restoring already degraded land;",
    "32": "Encourages also developed countries Party to the Convention and other relevant stakeholders to actively support the efforts of developing countries Party to the Convention in promoting sustainable land management practices and in seeking to achieve a land degradation-neutral world by providing substantial financial resources from all sources, facilitated access to appropriate technology on mutually agreed terms and other forms of support, including through capacity-building measures;",
    "33": "Recognizes the benefits gained from cooperation through the sharing of climate and weather information, forecasting and early warning systems related to desertification, land degradation and drought, while also taking account of sand and dust storms, at the global, regional and subregional levels, and in this regard likewise recognizes the need for further cooperation between Parties to the Convention and relevant organizations in the sharing of related information, forecasting and early warning systems;",
    "34": "Calls upon the United Nations entities to mainstream drought resilience in their programmes when supporting countries prone to droughts or already affected, with an emphasis on enhancing preparation and resilience, noting the need for drought management through, inter alia, impactful policies, early warning systems, preparedness and mitigation, land restoration, sustainable agricultural and livestock policies and related actions to advance the neutrality of land degradation, in countries affected by drought and/or desertification;",
    "35": "Encourages all relevant entities of the United Nations system, within their respective mandates, to harness opportunities for leveraging synergies among the Convention on Biological Diversity, the United Nations Convention to Combat Desertification in Those Countries Experiencing Serious Drought and/or Desertification, Particularly in Africa, and the United Nations Framework Convention on Climate Change and other relevant multilateral environmental agreements, as well as the 2030 Agenda, and in this respect welcomes the ongoing efforts to strengthen synergies among the secretariats of the aforementioned conventions;",
    "36": "Takes note of the United Nations Decade for Deserts and the Fight against Desertification and the United Nations Decade on Ecosystem Restoration, and calls for measures to explore and promote consumption and production patterns that conserve and protect land;",
    "37": "Welcomes the convening of the thirtieth session of the Conference of the Parties to the United Nations Framework Convention on Climate Change, held in Bel\u00e9m, Brazil, from 10 to 21 November 2025, and looks forward to the convening of the thirty-first session of the Conference of the Parties to the United Nations Framework Convention on Climate Change, to be held in 2026;",
    "38": "Notes with appreciation the financial contributions that have been made by Member States and other donors towards the Land Degradation Neutrality Fund, and invites Member States and other donors to make further contributions to the Land Degradation Neutrality Fund and the drought initiative of the United Nations Convention to Combat Desertification in Those Countries Experiencing Serious Drought and/or Desertification, Particularly in Africa;",
    "39": " Secretary-General to continue to make provisions for those sessions in the proposed programme budgets;",
    "40": "Acknowledges the commitment of the Parties to the Convention to boost drought resilience by identifying the expansion of arid, semi-arid, dry subhumid areas and drylands, improving national policies and early warning systems linked to early action, learning and sharing knowledge, building partnerships and coordinating action, and mobilizing drought finance to support a shift from reactive to proactive drought management, and recognizes the ongoing efforts of the Coalition for Disaster- Resilient Infrastructure, the Risk-Informed Early Action Partnership, the Early Warnings for All initiative and the Climate Risk and Early Warning Systems (CREWS) initiative;",
    "41": "Also acknowledges the decision of the Conference of the Parties at its fifteenth session with respect to promoting decent land-based jobs for youth and land- based youth entrepreneurship and strengthening youth participation in the processes relating to the Convention;",
    "42": "Reaffirms the continuation, for a further five-year period, of the current institutional linkage and related administrative arrangements with the United Nations Secretariat, to be reviewed by both the General Assembly and the Conference of the Parties no later than 31 December 2026;",
    "43": "Requests the Secretary-General to submit to the General Assembly, at its eighty-first session, a report on the implementation of the present resolution, and decides to include in the provisional agenda of its eighty-first session, under the item entitled \u201cSustainable development\u201d, the sub-item entitled \u201cImplementation of the United Nations Convention to Combat Desertification in Those Countries Experiencing Serious Drought and/or Desertification, Particularly in Africa\u201d."
  },
  "agenda_items": [
    "Item 18"
  ],
  "symbol_references": []
}