{
  "symbol": "A/RES/78/319",
  "filename": "A_RES_78_319.pdf",
  "title": "78/319. Scope, modalities, format and organization of the high-level plenary meeting on addressing the existential threats posed by sea level rise",
  "text": "United Nations \nA/RES/78/319\n \n \nGeneral Assembly \nDistr.: General \n2 August 2024 \n \n24-14122 (E)         \n*2414122* \n \n \nSeventy-eighth session \nAgenda items 13 and 117 \n \nIntegrated and coordinated implementation of and \nfollow-up to the outcomes of the major United Nations \nconferences and summits in the economic, social and \nrelated fields \n \nFollow-up to the outcome of the Millennium Summit \n \n \n \n \n Resolution adopted by the General Assembly \non 1 August 2024 \n \n \n \n \n[without reference to a Main Committee (A/78/L.100)] \n \n \n 78/319. Scope, modalities, format and organization of the high-level \nplenary meeting on addressing the existential threats posed \nby sea level rise \n \n \n \nThe General Assembly, \n \nRecalling its decision 78/544 of 16 January 2024, in which it decided to hold a \nhigh-level plenary meeting of the General Assembly on addressing the existential \nthreats posed by sea level rise, in New York on 25 September 2024, during the high-\nlevel week of the seventy-ninth session of the Assembly, \n \nRecalling also the outcome document of the United Nations Conference on \nSustainable Development, held in Rio de Janeiro, Brazil, from 20 to 22 June 2012, \nentitled \u201cThe future we want\u201d,1 \n \nReaffirming its resolution 70/1 of 25 September 2015, entitled \u201cTransforming \nour world: the 2030 Agenda for Sustainable Development\u201d, in which it adopted a \ncomprehensive, far-reaching and people-centred set of universal and transformative \nSustainable Development Goals and targets, and its commitment to working tirelessly \nfor the full implementation of the Agenda by 2030,  \n \nRecalling its resolution 78/153 of 19 December 2023 on the protection of global \nclimate for present and future generations of humankind, \n__________________ \n \n1 Resolution 66/288, annex. \n\nA/RES/78/319 \nScope, modalities, format and organization of the high-level \nplenary meeting on addressing the existential threats posed \nby sea level rise\n \n24-14122\n2/5 \n \n \nRecalling also its resolution 78/69 of 5 December 2023 on oceans and the law \nof the sea, \n \nRecalling further its resolution 78/155 of 19 December 2023 on the \nimplementation of the Convention on Biological Diversity and its contribution to \nsustainable development, \n \nAcknowledging the ongoing work of the open-ended Study Group of the \nInternational Law Commission on the topic \u201cSea-level rise in relation to international \nlaw\u201d,2 and encouraging States to share their views on the various aspects of this topic \nwith that Commission, \n \nTaking note with concern of the findings contained in the recent reports of the \nIntergovernmental Panel on Climate Change, including the synthesis report of the \nSixth Assessment Report and the special reports entitled Global Warming of 1.5\u00b0C, \nClimate Change and Land, and The Ocean and Cryosphere in a Changing Climate, \nand also noting, among other things, that increasing warming amplifies the exposure \nof small islands, low-lying coastal areas and deltas to the risks associated with sea \nlevel rise and extreme sea level events, \n \nTaking note of the recent global and regional reports of the World \nMeteorological Organization on the state of the climate, that find, among other things, \nthat global mean sea level reached a record high, including the finding that the rate \nof sea level rise in the past 10 years (2014\u20132023) has more than doubled since the \nfirst decade of the satellite record (1993\u20132002), \n \nRecognizing the importance of improving understanding of the impacts of \nclimate change on oceans and seas, and recalling that, in \u201cThe future we want\u201d, States \nnoted that sea level rise and coastal erosion are serious threats for many coastal \nregions and islands, particularly in developing countries, and in this regard called \nupon the international community to enhance its efforts to address these challenges, \nand noting the attention paid to the themes of \u201cThe effects of climate change on \noceans\u201d and \u201cSea level rise and its impacts\u201d at the eighteenth and twenty-first \nmeetings, respectively, of the United Nations Open-ended Informal Consultative \nProcess on Oceans and the Law of the Sea, in 2017 and 2021, which, inter alia, \nhighlighted the urgency of sea level rise for small island developing States and coastal \nStates, including low-lying coastal areas, \n \nRecalling the endorsement of the Pacific Islands Forum leaders on 6 August \n2021 at the fifty-first Pacific Islands Forum of a declaration on preserving maritime \nzones in the face of climate change-related sea level rise, and of the Heads of State \nand Government of the Alliance of Small Island States on 22 September 2021 of the \nLeaders\u2019 Declaration addressing, inter alia, the relationship between climate change-\nrelated sea level rise and Forum and Alliance members\u2019 maritime zones in response \nto long-standing concerns in the face of climate change-related sea level rise, \n \nRecalling also the endorsement of the Pacific Islands Forum leaders on \n9 November 2023 at the fifty-second Pacific Islands Forum of a declaration on the \ncontinuity of statehood and the protection of persons in the face of climate change-\nrelated sea level rise addressing, inter alia, the relationship between climate change-\nrelated sea level rise and Forum members\u2019 statehood, sovereignty and protection of \npersons, \n__________________ \n \n2 See Official Records of the General Assembly, Seventy-fourth Session, Supplement No. 10 \n(A/74/10); ibid., Seventy-sixth Session, Supplement No. 10 (A/76/10); ibid., Seventy-seventh \nSession, Supplement No. 10 (A/77/10); and ibid., Seventy-eighth Session, Supplement No. 10 \n(A/78/10). \n\nScope, modalities, format and organization of the high-level \nplenary meeting on addressing the existential threats posed  \nby sea level rise \nA/RES/78/319\n \n3/5\n24-14122 \n \n \nTaking note of the ocean and climate change dialogue, first established at the \ntwenty-fifth session of the Conference of the Parties to the United Nations Framework \nConvention on Climate Change, \n \nAcknowledging the important role of the United Nations Decade of Ocean \nScience for Sustainable Development (2021\u20132030) in supporting the efforts and \ncommitments necessary for delivering the science we need, for the ocean we want, \n \nRecognizing the importance of enhanced international cooperation and \ncollective action to address sea level rise, and determined to strengthen the global \nresponse and support to developing countries, especially those that are particularly \nvulnerable to the adverse effects of climate change, and coastal communities, to build \nresilience and adapt to its consequences, \n \n1. \nDecides that the overall theme of the high-level plenary meeting of the \nGeneral Assembly to be held on 25 September 2024 will be \u201cAddressing the threats \nposed by sea level rise\u201d; \n \n2. \nAlso decides that the high-level meeting will focus on building common \nunderstanding, mobilizing political leadership and promoting multisectoral and \nmulti-stakeholder collaboration and international cooperation towards the objective \nof addressing the threats posed by sea level rise; \n \n3. \nFurther decides that the organizational arrangements for the high-level \nmeeting should be as follows;  \n \n(a) \nThe high-level meeting will comprise an opening segment, a plenary \nsegment, four multi-stakeholder thematic panel discussions and a brief closing \nsegment; \n \n(b) \nThe opening segment, to be held from 10 to 10.20 a.m., will feature \nstatements by the President of the General Assembly at its seventy-ninth session, the \nSecretary-General, the President of the General Assembly at its seventy-eighth \nsession and a representative of a Member State affected by the adverse effects of sea \nlevel rise;  \n \n(c) \nThe plenary segment, to be held from 10.20 a.m. to 1 p.m. and from 3 to \n5.40 p.m., will comprise statements by Member States and observers of the General \nAssembly and members of the United Nations specialized agencies; a list of speakers \nwill be established in accordance with the rules of procedure and established practices \nof the Assembly and the time limits for these statements will be three minutes for \nindividual delegations and five minutes for statements made on behalf of a group of \nStates; \n \n(d) \nThe closing segment, to be held from 5.40 to 6 p.m., will comprise \nsummaries of the multi-stakeholder thematic panel discussions presented by the \nCo-Chairs of the panels and concluding remarks by the President of the General \nAssembly at its seventy-ninth session; \n \n4. \nDecides \nthat \nthe \norganizational \narrangements \nfor \nthe \nfour \nmulti-stakeholder thematic panel discussions will be as follows: \n \n(a) \nTwo multi-stakeholder panels will be held consecutively from 10.30 to \n11.45 a.m. and from 11.45 a.m. to 1 p.m. and two multi-stakeholder panels will be \nheld consecutively from 3 to 4.15 p.m. and from 4.15 to 5.30 p.m., in parallel with \nthe plenary meeting; \n \n(b) \nEach of the four multi-stakeholder panel discussions will be co-chaired by \ntwo representatives, one from a developing country and one from a developed country, \nto be appointed by the President of the General Assembly from among the \n\nA/RES/78/319 \nScope, modalities, format and organization of the high-level \nplenary meeting on addressing the existential threats posed \nby sea level rise\n \n24-14122\n4/5 \n \nrepresentatives attending the high-level meeting, in consultation with Member States, \ntaking into account gender balance and geographical representation; \n \n(c) \nThe discussions in and summaries of the Co-Chairs of the four \nmulti-stakeholder panels will be without prejudice to existing processes and the \npanels will be entitled: \n (i) \n\u201cKnowledge, data and science to inform sea level rise risk assessments and \ndecision-making\u201d; \n (ii) \u201cAdaptation, finance and resilience in relation to sea level rise\u201d; \n (iii) \u201cLivelihoods, socioeconomic challenges and culture and heritage in \nrelation to sea level rise\u201d; \n (iv) \u201cSea level rise and its legal dimensions\u201d; \n \n(d) \nThe President of the General Assembly should consider inviting the heads \nor senior representatives of Member States, parliamentarians or local governments of \nMember States, relevant United Nations entities, development partners, civil society, \nregional \nand \nsubregional \norganizations, \nnon-governmental \norganizations, \nrepresentatives of Indigenous Peoples, representatives of local communities, the \nprivate sector, philanthropic organizations, academia, the science community, youth-\nled organizations and community organizations to serve as speakers in the panel \ndiscussions, taking into account their relevant expertise, as well as gender balance, \nlevel of development and geographical representation; \n \n5. \nRequests the Secretary-General to prepare a concise summary of the high-\nlevel meeting;  \n \n6. \nEncourages all Member States and observers of the General Assembly and \nmembers of the United Nations specialized agencies to be represented at the level of \nHead of State or Government or at the highest possible level; \n \n7. \nInvites the United Nations system, including funds, programmes, \nspecialized agencies and regional commissions, to participate in the high-level \nmeeting and to support the meeting, including its preparations, particularly with \nregard to sharing evidence and good practices, challenges and lessons learned, and to \ndemonstrate ambition to accelerate action on the overall theme of the meeting; \n \n8. \nInvites representatives of non-governmental organizations that are in \nconsultative status with the Economic and Social Council to participate in the high-\nlevel meeting in accordance with relevant rules and procedures of the General \nAssembly; \n \n9. \nRequests the President of the General Assembly to draw up a list of \nrepresentatives of other relevant non-governmental organizations, civil society \norganizations, academic institutions and the private sector who may participate in the \nhigh-level meeting, including its panel discussions, taking into account the principles \nof transparency and equitable geographical representation, with due regard for gender \nparity, to submit the proposed list to Member States for their consideration on a \nnon-objection basis3 and to bring the list to the attention of the Assembly for a final \ndecision by the Assembly on participation in the high-level meeting; \n \n10. Invites representatives mentioned in paragraphs 6, 7, 8 and 9 above to \nparticipate in the multi-stakeholder thematic panel discussions; \n__________________ \n \n3 The list will include proposed as well as final names. The general basis of any objections, if \nrequested by one or more States Members of the United Nations or States members of the \nspecialized agencies, will be made known to the Office of the President of the General Assembly \nand the requester. \n\nScope, modalities, format and organization of the high-level \nplenary meeting on addressing the existential threats posed  \nby sea level rise \nA/RES/78/319\n \n5/5\n24-14122 \n \n \n11. \nEncourages all Member States and observers of the General Assembly and \nmembers of the United Nations specialized agencies to facilitate the participation of \nyouth in the high-level meeting; \n \n12. Encourages all representatives invited in paragraphs 7, 8 and 9 above to \nfacilitate the participation of youth, of Indigenous Peoples and of local communities \nin the high-level meeting; \n \n13. Requests the President of the General Assembly and the Secretary-General \nto provide adequate support to the organization and preparation of the high-level \nmeeting; \n \n14. Recalls rule 52 of the rules of procedure of the General Assembly, \nreaffirms multilingualism as a core and fundamental value of the Organization, \nre-emphasizes the paramount importance of the equality of the six official languages \nof the United Nations, and requests the Secretary-General to provide interpretation \ninto the six official languages of the United Nations for the high-level meeting; \n \n15. Encourages States and international donors, as well as the private sector, \nfinancial institutions, foundations and other donors, to support the participation of \nrepresentatives of developing countries in the high-level meeting; \n \n16. Decides that the proceedings of the high-level meeting will be webcast, \nand encourages the President of the General Assembly and the Secretary-General to \ngive the highest visibility to the high-level meeting, including its preparations, \nthrough all relevant media platforms and information and communications \ntechnologies. \n \n102nd plenary meeting \n1 August 2024 \n \n",
  "paragraphs": {
    "1": "Decides that the overall theme of the high-level plenary meeting of the General Assembly to be held on 25 September 2024 will be \u201cAddressing the threats posed by sea level rise\u201d;",
    "2": "Also decides that the high-level meeting will focus on building common understanding, mobilizing political leadership and promoting multisectoral and multi-stakeholder collaboration and international cooperation towards the objective of addressing the threats posed by sea level rise;",
    "3": "Further decides that the organizational arrangements for the high-level meeting should be as follows; (a) The high-level meeting will comprise an opening segment, a plenary segment, four multi-stakeholder thematic panel discussions and a brief closing segment; (b) The opening segment, to be held from 10 to 10.20 a.m., will feature statements by the President of the General Assembly at its seventy-ninth session, the Secretary-General, the President of the General Assembly at its seventy-eighth session and a representative of a Member State affected by the adverse effects of sea level rise; (c) The plenary segment, to be held from 10.20 a.m. to 1 p.m. and from 3 to 5.40 p.m., will comprise statements by Member States and observers of the General Assembly and members of the United Nations specialized agencies; a list of speakers will be established in accordance with the rules of procedure and established practices of the Assembly and the time limits for these statements will be three minutes for individual delegations and five minutes for statements made on behalf of a group of States; (d) The closing segment, to be held from 5.40 to 6 p.m., will comprise summaries of the multi-stakeholder thematic panel discussions presented by the Co-Chairs of the panels and concluding remarks by the President of the General Assembly at its seventy-ninth session;",
    "4": "Decides that the organizational arrangements for the four multi-stakeholder thematic panel discussions will be as follows: (a) Two multi-stakeholder panels will be held consecutively from 10.30 to 11.45 a.m. and from 11.45 a.m. to 1 p.m. and two multi-stakeholder panels will be held consecutively from 3 to 4.15 p.m. and from 4.15 to 5.30 p.m., in parallel with the plenary meeting; (b) Each of the four multi-stakeholder panel discussions will be co-chaired by two representatives, one from a developing country and one from a developed country, to be appointed by the President of the General Assembly from among the A/RES/78/319 Scope, modalities, format and organization of the high-level plenary meeting on addressing the existential threats posed by sea level rise 24-14122 4/5 representatives attending the high-level meeting, in consultation with Member States, taking into account gender balance and geographical representation; (c) The discussions in and summaries of the Co-Chairs of the four multi-stakeholder panels will be without prejudice to existing processes and the panels will be entitled: (i) \u201cKnowledge, data and science to inform sea level rise risk assessments and decision-making\u201d; (ii) \u201cAdaptation, finance and resilience in relation to sea level rise\u201d; (iii) \u201cLivelihoods, socioeconomic challenges and culture and heritage in relation to sea level rise\u201d; (iv) \u201cSea level rise and its legal dimensions\u201d; (d) The President of the General Assembly should consider inviting the heads or senior representatives of Member States, parliamentarians or local governments of Member States, relevant United Nations entities, development partners, civil society, regional and subregional organizations, non-governmental organizations, representatives of Indigenous Peoples, representatives of local communities, the private sector, philanthropic organizations, academia, the science community, youth- led organizations and community organizations to serve as speakers in the panel discussions, taking into account their relevant expertise, as well as gender balance, level of development and geographical representation;",
    "5": "Requests the Secretary-General to prepare a concise summary of the high- level meeting;",
    "6": "Encourages all Member States and observers of the General Assembly and members of the United Nations specialized agencies to be represented at the level of Head of State or Government or at the highest possible level;",
    "7": "Invites the United Nations system, including funds, programmes, specialized agencies and regional commissions, to participate in the high-level meeting and to support the meeting, including its preparations, particularly with regard to sharing evidence and good practices, challenges and lessons learned, and to demonstrate ambition to accelerate action on the overall theme of the meeting;",
    "8": "Invites representatives of non-governmental organizations that are in consultative status with the Economic and Social Council to participate in the high- level meeting in accordance with relevant rules and procedures of the General Assembly;",
    "9": "Requests the President of the General Assembly to draw up a list of representatives of other relevant non-governmental organizations, civil society organizations, academic institutions and the private sector who may participate in the high-level meeting, including its panel discussions, taking into account the principles of transparency and equitable geographical representation, with due regard for gender parity, to submit the proposed list to Member States for their consideration on a non-objection basis3 and to bring the list to the attention of the Assembly for a final decision by the Assembly on participation in the high-level meeting;",
    "10": "Invites representatives mentioned in paragraphs 6, 7, 8 and 9 above to participate in the multi-stakeholder thematic panel discussions; __________________ 3 The list will include proposed as well as final names. The general basis of any objections, if requested by one or more States Members of the United Nations or States members of the specialized agencies, will be made known to the Office of the President of the General Assembly and the requester. Scope, modalities, format and organization of the high-level plenary meeting on addressing the existential threats posed by sea level rise A/RES/78/319 5/5 24-14122",
    "11": "Encourages all Member States and observers of the General Assembly and members of the United Nations specialized agencies to facilitate the participation of youth in the high-level meeting;",
    "12": "Encourages all representatives invited in paragraphs 7, 8 and 9 above to facilitate the participation of youth, of Indigenous Peoples and of local communities in the high-level meeting;",
    "13": "Requests the President of the General Assembly and the Secretary-General to provide adequate support to the organization and preparation of the high-level meeting;",
    "14": "Recalls rule 52 of the rules of procedure of the General Assembly, reaffirms multilingualism as a core and fundamental value of the Organization, re-emphasizes the paramount importance of the equality of the six official languages of the United Nations, and requests the Secretary-General to provide interpretation into the six official languages of the United Nations for the high-level meeting;",
    "15": "Encourages States and international donors, as well as the private sector, financial institutions, foundations and other donors, to support the participation of representatives of developing countries in the high-level meeting;",
    "16": "Decides that the proceedings of the high-level meeting will be webcast, and encourages the President of the General Assembly and the Secretary-General to give the highest visibility to the high-level meeting, including its preparations, through all relevant media platforms and information and communications technologies. 102nd plenary meeting 1 August 2024"
  },
  "agenda_items": [
    "Item 13"
  ],
  "symbol_references": [
    "A/78/L.100"
  ]
}