{
  "symbol": "A/RES/79/312",
  "filename": "A_RES_79_312.pdf",
  "title": "79/312. Financing of the activities arising from Security Council resolution 1863 (2009)",
  "text": "United Nations \nA/RES/79/312\n \n \nGeneral Assembly \nDistr.: General \n1 July 2025 \n \n25-10822 (E) \n*2510822* \n \n \nSeventy-ninth session \nAgenda item 167 \nFinancing of the activities arising from Security Council \nresolution 1863 (2009) \n \n \n \n \n Resolution adopted by the General Assembly \non 30 June 2025 \n \n \n \n \n[on the report of the Fifth Committee (A/79/937, para. 6)] \n \n \n 79/312. Financing of the activities arising from Security Council resolution \n1863 (2009) \n \n \n \nThe General Assembly, \n \nHaving considered the reports of the Secretary-General on the financing of the \nUnited Nations Support Office in Somalia 1 and the related report of the Advisory \nCommittee on Administrative and Budgetary Questions,2  \n \nRecalling Security Council resolution 1863 (2009) of 16 January 2009, in which \nthe Council expressed its intent to establish a United Nations peacekeeping operation \nin Somalia as a follow-on force to the African Union Mission in Somalia, subject to \na further decision of the Council by 1 June 2009, and requested the Secretary-General, \nin order for the forces of the Mission to be incorporated into a United Nations \npeacekeeping operation, to provide a United Nations logistical support package to the \nMission, including equipment and services, \n \nRecalling also the subsequent resolutions of the Security Council by which the \nlogistical support package for the Mission was extended, the latest of which was \nresolution 2767 (2024) of 27 December 2024, by which the Council extended the \nlogistical support package until 31 December 2025, \n \nRecalling further its resolution 63/275 A of 7 April 2009 on the financing of the \nactivities arising from Security Council resolution 1863 (2009) and its subsequent \nresolutions thereon, the latest of which was resolution 78/309 of 28 June 2024,  \n__________________ \n \n1  A/79/618 and A/79/755. \n \n2  A/79/724/Add.10. \n\nA/RES/79/312 \nFinancing of the activities arising from Security Council \nresolution 1863 (2009)\n \n25-10822\n2/3 \n \n \nReaffirming the general principles underlying the financing of United Nations \npeacekeeping operations, as stated in its resolutions 1874 (S-IV) of 27 June 1963, \n3101 (XXVIII) of 11 December 1973 and 55/235 of 23 December 2000, \n \nNoting with appreciation that voluntary contributions have been made to the \nUnited Nations trust fund established to support the African Union Mission in \nSomalia, \n \n1. \nTakes note of the status of contributions to the United Nations Support \nOffice in Somalia as at 30 April 2025, including the contributions outstanding in the \namount of 274.8 million United States dollars, representing some 3.4 per cent of the \ntotal assessed contributions, notes with concern that only 85 Member States have paid \ntheir assessed contributions in full, and urges all other Member States, in particular \nthose in arrears, to ensure payment of their outstanding assessed contributions; \n \n2. \nEndorses the conclusions and recommendations contained in the report of \nthe Advisory Committee on Administrative and Budgetary Questions, subject to the \nprovisions of the present resolution, and requests the Secretary-General to ensure \ntheir full implementation;  \n \n3. \nDecides to abolish the post of Associate Procurement Officer (National \nProfessional Officer, level B) in the Procurement Section that has been vacant for \nmore than 24 months; \n \n4. \nRequests the Secretary-General to ensure the full implementation of the \nrelevant provisions of its resolutions 59/296 of 22 June 2005, 60/266 of 30 June 2006, \n61/276 of 29 June 2007, 64/269 of 24 June 2010, 65/289 of 30 June 2011, 66/264 of \n21 June 2012, 69/307 of 25 June 2015, 70/286 of 17 June 2016 and 76/274 of 29 June \n2022, as well as other relevant resolutions; \n \n \n \nBudget performance report for the period from 1 July 2023 to 30 June 2024 \n \n \n5. \nTakes note of the report of the Secretary-General on the budget \nperformance of the Support Office for the period from 1 July 2023 to 30 June 2024; 3 \n \n \n \nBudget estimates for the period from 1 July 2025 to 30 June 2026 \n \n \n6. \nDecides to appropriate to the special account for the United Nations \nSupport Office in Somalia the amount of 575,514,100 dollars for the period from \n1 July 2025 to 30 June 2026, inclusive of 520,627,900 dollars for the maintenance of \nthe Support Office, 43,407,800 dollars for the support account for peacekeeping \noperations, 6,031,500 dollars for the United Nations Logistics Base at Brindisi, Italy, \nand 5,446,900 dollars for the Regional Service Centre in Entebbe, Uganda; \n \n \n \nFinancing of the appropriation for the period from 1 July 2025 to 30 June 2026 \n \n \n7. \nDecides to apportion among Member States the amount of 287,757,100 \ndollars for the period from 1 July to 31 December 2025 in accordance with the levels \nupdated in its resolution 79/250 of 24 December 2024, taking into account the scale \nof assessments for 2025, as set out in its resolution 79/249 of 24 December 2024; \n \n8. \nAlso decides that, in accordance with the provisions of its resolution 973 (X) \nof 15 December 1955, there shall be set off against the apportionment among Member \nStates, as provided for in paragraph 7 above, their respective share in the Tax \nEqualization Fund of 7,257,800 dollars, comprising the estimated staff assessment \nincome of 4,589,000 dollars approved for the Support Office, the prorated share of \n1,994,100 dollars of the estimated staff assessment income approved for the support \n__________________ \n \n3  A/79/618. \n\nFinancing of the activities arising from Security Council \nresolution 1863 (2009) \nA/RES/79/312\n \n3/3\n25-10822 \n \naccount, the prorated share of 343,900 dollars of the estimated staff assessment \nincome approved for the United Nations Logistics Base and the prorated share of \n330,800 dollars of the estimated staff assessment income approved for the Regional \nService Centre; \n \n9. \nFurther decides to apportion among Member States the amount of \n287,757,000 dollars for the period from 1 January to 30 June 2026, at a monthly rate \nof 47,959,500 dollars, in accordance with the levels updated in its resolution 79/250, \ntaking into account the scale of assessments for 2026, as set out in its resolution \n79/249, subject to a decision of the Security Council to extend the logistical support \npackage; \n \n10. Decides that, in accordance with the provisions of its resolution 973 (X), \nthere shall be set off against the apportionment among Member States, as provided \nfor in paragraph 9 above, their respective share in the Tax Equalization Fund of \n7,257,500 dollars, comprising the estimated staff assessment income of 4,588,900 \ndollars approved for the Support Office, the prorated share of 1,994,100 dollars of the \nestimated staff assessment income approved for the support account, the prorated \nshare of 343,800 dollars of the estimated staff assessment income approved for the \nUnited Nations Logistics Base and the prorated share of 330,700 dollars of the \nestimated staff assessment income approved for the Regional Service Centre; \n \n11. \nAlso decides that, for Member States that have fulfilled their financial \nobligations to the Support Office, there shall be set off against their apportionment, as \nprovided for in paragraphs 7 and 9 above, their respective share of the unencumbered \nbalance and other revenue in the amount of 30,272,700 dollars in respect of the \nfinancial period ended 30 June 2024, in accordance with the levels updated in its \nresolution 76/239 of 24 December 2021, taking into account the scale of assessments \nfor 2024, as set out in its resolution 76/238 of 24 December 2021; \n \n12. Further decides that, for Member States that have not fulfilled their \nfinancial obligations to the Support Office, there shall be set off against their \noutstanding obligations their respective share of the unencumbered balance and other \nrevenue in the amount of 30,272,700 dollars in respect of the financial period ended \n30 June 2024, in accordance with the scheme set out in paragraph 11 above; \n \n13. Decides that the increase of 917,300 dollars in the estimated staff \nassessment income in respect of the financial period ended 30 June 2024 shall be \nadded to the credits in the amount of 30,272,700 dollars referred to in paragraphs 11 \nand 12 above; \n \n14. Invites voluntary contributions to the United Nations trust fund established \nto support the African Union Transition Mission in Somalia; \n \n15. Decides to include in the provisional agenda of its eightieth session the \nitem entitled \u201cFinancing of the activities arising from Security Council resolution \n1863 (2009)\u201d.  \n \n81st plenary meeting \n30 June 2025 \n \n",
  "paragraphs": {
    "1": "Takes note of the status of contributions to the United Nations Support Office in Somalia as at 30 April 2025, including the contributions outstanding in the amount of 274.8 million United States dollars, representing some 3.4 per cent of the total assessed contributions, notes with concern that only 85 Member States have paid their assessed contributions in full, and urges all other Member States, in particular those in arrears, to ensure payment of their outstanding assessed contributions;",
    "2": "Endorses the conclusions and recommendations contained in the report of the Advisory Committee on Administrative and Budgetary Questions, subject to the provisions of the present resolution, and requests the Secretary-General to ensure their full implementation;",
    "3": "Decides to abolish the post of Associate Procurement Officer (National Professional Officer, level B) in the Procurement Section that has been vacant for more than 24 months;",
    "4": "Requests the Secretary-General to ensure the full implementation of the relevant provisions of its resolutions 59/296 of 22 June 2005, 60/266 of 30 June 2006, 61/276 of 29 June 2007, 64/269 of 24 June 2010, 65/289 of 30 June 2011, 66/264 of 21 June 2012, 69/307 of 25 June 2015, 70/286 of 17 June 2016 and 76/274 of 29 June 2022, as well as other relevant resolutions; Budget performance report for the period from 1 July 2023 to 30 June 2024",
    "5": "Takes note of the report of the Secretary-General on the budget performance of the Support Office for the period from 1 July 2023 to 30 June 2024; 3 Budget estimates for the period from 1 July 2025 to 30 June 2026",
    "6": "Decides to appropriate to the special account for the United Nations Support Office in Somalia the amount of 575,514,100 dollars for the period from 1 July 2025 to 30 June 2026, inclusive of 520,627,900 dollars for the maintenance of the Support Office, 43,407,800 dollars for the support account for peacekeeping operations, 6,031,500 dollars for the United Nations Logistics Base at Brindisi, Italy, and 5,446,900 dollars for the Regional Service Centre in Entebbe, Uganda; Financing of the appropriation for the period from 1 July 2025 to 30 June 2026",
    "7": "Decides to apportion among Member States the amount of 287,757,100 dollars for the period from 1 July to 31 December 2025 in accordance with the levels updated in its resolution 79/250 of 24 December 2024, taking into account the scale of assessments for 2025, as set out in its resolution 79/249 of 24 December 2024;",
    "8": "Also decides that, in accordance with the provisions of its resolution 973 (X) of 15 December 1955, there shall be set off against the apportionment among Member States, as provided for in paragraph 7 above, their respective share in the Tax Equalization Fund of 7,257,800 dollars, comprising the estimated staff assessment income of 4,589,000 dollars approved for the Support Office, the prorated share of 1,994,100 dollars of the estimated staff assessment income approved for the support account, the prorated share of 343,900 dollars of the estimated staff assessment income approved for the United Nations Logistics Base and the prorated share of 330,800 dollars of the estimated staff assessment income approved for the Regional Service Centre;",
    "9": "Further decides to apportion among Member States the amount of 287,757,000 dollars for the period from 1 January to 30 June 2026, at a monthly rate of 47,959,500 dollars, in accordance with the levels updated in its resolution 79/250, taking into account the scale of assessments for 2026, as set out in its resolution 79/249, subject to a decision of the Security Council to extend the logistical support package;",
    "10": "Decides that, in accordance with the provisions of its resolution 973 (X), there shall be set off against the apportionment among Member States, as provided for in paragraph 9 above, their respective share in the Tax Equalization Fund of 7,257,500 dollars, comprising the estimated staff assessment income of 4,588,900 dollars approved for the Support Office, the prorated share of 1,994,100 dollars of the estimated staff assessment income approved for the support account, the prorated share of 343,800 dollars of the estimated staff assessment income approved for the United Nations Logistics Base and the prorated share of 330,700 dollars of the estimated staff assessment income approved for the Regional Service Centre;",
    "11": "Also decides that, for Member States that have fulfilled their financial obligations to the Support Office, there shall be set off against their apportionment, as provided for in paragraphs 7 and 9 above, their respective share of the unencumbered balance and other revenue in the amount of 30,272,700 dollars in respect of the financial period ended 30 June 2024, in accordance with the levels updated in its resolution 76/239 of 24 December 2021, taking into account the scale of assessments for 2024, as set out in its resolution 76/238 of 24 December 2021;",
    "12": "Further decides that, for Member States that have not fulfilled their financial obligations to the Support Office, there shall be set off against their outstanding obligations their respective share of the unencumbered balance and other revenue in the amount of 30,272,700 dollars in respect of the financial period ended 30 June 2024, in accordance with the scheme set out in paragraph 11 above;",
    "13": "Decides that the increase of 917,300 dollars in the estimated staff assessment income in respect of the financial period ended 30 June 2024 shall be added to the credits in the amount of 30,272,700 dollars referred to in paragraphs 11 and 12 above;",
    "14": "Invites voluntary contributions to the United Nations trust fund established to support the African Union Transition Mission in Somalia;",
    "15": "Decides to include in the provisional agenda of its eightieth session the item entitled \u201cFinancing of the activities arising from Security Council resolution 1863 (2009)\u201d."
  },
  "agenda_items": [
    "Item 167"
  ],
  "symbol_references": []
}