{
  "symbol": "A/RES/72/69",
  "filename": "A_RES_72_69.pdf",
  "title": "72/69. Strengthening of security and cooperation in the Mediterranean region",
  "text": "United Nations \nA/RES/72/69\n \n \nGeneral Assembly \nDistr.: General \n13 December 2017 \n \n17-21812 (E)    151217 \n*1721812* \n \n \nSeventy-second session \nAgenda item 104 \n \n \n \n \n Resolution adopted by the General Assembly \non 4 December 2017 \n \n \n \n \n[on the report of the First Committee (A/72/414)] \n \n \n \n72/69. Strengthening of security and cooperation \nin the Mediterranean region \n \n \n \nThe General Assembly, \n \nRecalling its previous resolutions on the subject, including resolution 71/85 of \n5 December 2016,  \n \nReaffirming the primary role of the Mediterranean countries in strengthening \nand promoting peace, security and cooperation in the Mediterranean region,  \n \nWelcoming the efforts deployed by the Euro-Mediterranean countries to \nstrengthen their cooperation in combating terrorism, in particular through the adoption \nof the Euro-Mediterranean Code of Conduct on Countering Terrorism by the Euro-\nMediterranean Summit, held in Barcelona, Spain, on 27 and 28 November 2005,  \n \nBearing in mind all the previous declarations and commitments, as well as all \nthe initiatives taken by the riparian countries at the recent summits, ministerial \nmeetings and various forums concerning the question of the Mediterranean region,  \n \nRecalling, in this regard, the adoption on 13 July 2008 of the Joint Declaration \nof the Paris Summit for the Mediterranean, which launched a reinforced partnership, \nnamed the \u201cBarcelona Process: Union for the Mediterranean\u201d, and the common \npolitical will to revive efforts to transform the Mediterranean into an area of peace, \ndemocracy, cooperation and prosperity,  \n \nWelcoming the entry into force of the African Nuclear-Weapon-Free Zone \nTreaty (Treaty of Pelindaba)1 as a contribution to the strengthening of peace and \nsecurity both regionally and internationally,  \n \nRecognizing the indivisible character of security in the Mediterranean and that \nthe enhancement of cooperation among Mediterranean countries with a view to \n__________________ \n \n1  A/50/426, annex. \n\nA/RES/72/69 \nStrengthening of security and cooperation in the Mediterranean region\n \n17-21812 \n2/3 \n \npromoting the economic and social development of all peoples of the region will \ncontribute significantly to stability, peace and security in the region,  \n \nRecognizing also the efforts made so far and the determination of the \nMediterranean countries to intensify the process of dialogue and consultations with \na view to resolving the problems existing in the Mediterranean region and to \neliminating the causes of tension and the consequent threat to peace and security, as \nwell as their growing awareness of the need for further joint efforts to strengthen \neconomic, social, cultural and environmental cooperation in the region,  \n \nRecognizing further that prospects for closer Euro-Mediterranean cooperation \nin all spheres can be enhanced by positive developments worldwide, in particular in \nEurope, in the Maghreb and in the Middle East,  \n \nReaffirming the responsibility of all States to contribute to the stability and \nprosperity of the Mediterranean region and their commitment to respecting the \npurposes and principles of the Charter of the United Nations as well as the \nprovisions of the Declaration on Principles of International Law concerning \nFriendly Relations and Cooperation among States in accordance with the Charter of \nthe United Nations,2  \n \nNoting the peace negotiations in the Middle East, which should be of a \ncomprehensive nature and represent an appropriate framework for the peaceful \nsettlement of contentious issues in the region,  \n \nExpressing concern at the persistent tension and continuing military activities \nin parts of the Mediterranean that hinder efforts to strengthen security and \ncooperation in the region,  \n \nTaking note of the report of the Secretary-General,3  \n \n1. \nReaffirms that security in the Mediterranean is closely linked to \nEuropean security as well as to international peace and security;  \n \n2. \nExpresses its satisfaction at the continuing efforts by Mediterranean \ncountries to contribute actively to the elimination of all causes of tension in the \nregion and to the promotion of just and lasting solutions to the persistent problems \nof the region through peaceful means, thus ensuring the withdrawal of foreign \nforces of occupation and respecting the sovereignty, independence and territorial \nintegrity of all countries of the Mediterranean and the right of peoples to self-\ndetermination, and therefore calls for full adherence to the principles of \nnon-interference, non-intervention, non-use of force or threat of use of force and the \ninadmissibility of the acquisition of territory by force, in accordance with the \nCharter and the relevant resolutions of the United Nations;  \n \n3. \nCommends the Mediterranean countries for their efforts in meeting \ncommon challenges through coordinated overall responses, based on a spirit of \nmultilateral partnership, towards the general objective of turning the Mediterranean \nbasin into an area of dialogue, exchanges and cooperation, guaranteeing peace, \nstability and prosperity, encourages them to strengthen such efforts through, inter \nalia, a lasting multilateral and action-oriented cooperative dialogue among States of \nthe region, and recognizes the role of the United Nations in promoting regional and \ninternational peace and security;  \n \n4. \nRecognizes that the elimination of the economic and social disparities in \nlevels of development and other obstacles, as well as respect and greater \n__________________ \n \n2  Resolution 2625 (XXV), annex. \n \n3  A/72/320. \n\nStrengthening of security and cooperation in the Mediterranean region \nA/RES/72/69\n \n3/3 \n17-21812 \n \nunderstanding among cultures in the Mediterranean area, will contribute to \nenhancing peace, security and cooperation among Mediterranean countries through \nthe existing forums;  \n \n5. \nCalls upon all States of the Mediterranean region that have not yet done \nso to adhere to all the multilaterally negotiated legal instruments in force related to \nthe field of disarmament and non-proliferation, thus creating the conditions \nnecessary for strengthening peace and cooperation in the region;  \n \n6. \nEncourages all States of the region to favour the conditions necessary for \nstrengthening the confidence-building measures among them by promoting genuine \nopenness and transparency on all military matters, by participating, inter alia, in the \nUnited Nations Report on Military Expenditures and by providing accurate data and \ninformation to the United Nations Register of Conventional Arms;  \n \n7. \nEncourages the Mediterranean countries to strengthen further their \ncooperation in combating terrorism in all its forms and manifestations, including the \npossible resort by terrorists to weapons of mass destruction, taking into account the \nrelevant resolutions of the United Nations, and in combating international crime and \nillicit arms transfers and illicit drug production, consumption and trafficking, which \npose a serious threat to peace, security and stability in the region and therefore to \nthe improvement of the current political, economic and social situation and which \njeopardize friendly relations among States, hinder the development of international \ncooperation and result in the destruction of human rights, fundamental freedoms and \nthe democratic basis of pluralistic society;  \n \n8. \nRequests the Secretary-General to submit a report on means to strengthen \nsecurity and cooperation in the Mediterranean region;  \n \n9. \nDecides to include in the provisional agenda of its seventy-third session \nthe item entitled \u201cStrengthening of security and cooperation in the Mediterranean \nregion\u201d. \n \n62nd plenary meeting  \n4 December 2017 \n \n",
  "paragraphs": {
    "1": "Reaffirms that security in the Mediterranean is closely linked to European security as well as to international peace and security;",
    "2": "Expresses its satisfaction at the continuing efforts by Mediterranean countries to contribute actively to the elimination of all causes of tension in the region and to the promotion of just and lasting solutions to the persistent problems of the region through peaceful means, thus ensuring the withdrawal of foreign forces of occupation and respecting the sovereignty, independence and territorial integrity of all countries of the Mediterranean and the right of peoples to self- determination, and therefore calls for full adherence to the principles of non-interference, non-intervention, non-use of force or threat of use of force and the inadmissibility of the acquisition of territory by force, in accordance with the Charter and the relevant resolutions of the United Nations;",
    "3": "Commends the Mediterranean countries for their efforts in meeting common challenges through coordinated overall responses, based on a spirit of multilateral partnership, towards the general objective of turning the Mediterranean basin into an area of dialogue, exchanges and cooperation, guaranteeing peace, stability and prosperity, encourages them to strengthen such efforts through, inter alia, a lasting multilateral and action-oriented cooperative dialogue among States of the region, and recognizes the role of the United Nations in promoting regional and international peace and security;",
    "4": "Recognizes that the elimination of the economic and social disparities in levels of development and other obstacles, as well as respect and greater __________________ 2 Resolution 2625 (XXV), annex. 3 A/72/320. Strengthening of security and cooperation in the Mediterranean region A/RES/72/69 3/3 17-21812 understanding among cultures in the Mediterranean area, will contribute to enhancing peace, security and cooperation among Mediterranean countries through the existing forums;",
    "5": "Calls upon all States of the Mediterranean region that have not yet done so to adhere to all the multilaterally negotiated legal instruments in force related to the field of disarmament and non-proliferation, thus creating the conditions necessary for strengthening peace and cooperation in the region;",
    "6": "Encourages all States of the region to favour the conditions necessary for strengthening the confidence-building measures among them by promoting genuine openness and transparency on all military matters, by participating, inter alia, in the United Nations Report on Military Expenditures and by providing accurate data and information to the United Nations Register of Conventional Arms;",
    "7": "Encourages the Mediterranean countries to strengthen further their cooperation in combating terrorism in all its forms and manifestations, including the possible resort by terrorists to weapons of mass destruction, taking into account the relevant resolutions of the United Nations, and in combating international crime and illicit arms transfers and illicit drug production, consumption and trafficking, which pose a serious threat to peace, security and stability in the region and therefore to the improvement of the current political, economic and social situation and which jeopardize friendly relations among States, hinder the development of international cooperation and result in the destruction of human rights, fundamental freedoms and the democratic basis of pluralistic society;",
    "8": "Requests the Secretary-General to submit a report on means to strengthen security and cooperation in the Mediterranean region;",
    "9": "Decides to include in the provisional agenda of its seventy-third session the item entitled \u201cStrengthening of security and cooperation in the Mediterranean region\u201d. 62nd plenary meeting 4 December 2017"
  },
  "agenda_items": [
    "Item 104"
  ],
  "symbol_references": []
}