{
  "symbol": "A/RES/74/120",
  "filename": "A_RES_74_120.pdf",
  "title": "74/120. Promoting social integration through social inclusion",
  "text": "United Nations \nA/RES/74/120\n \n \nGeneral Assembly \nDistr.: General \n10 January 2020 \n \n19-22040 (E)    140120 \n*1922040* \n \n \nSeventy-fourth session \nAgenda item 25 (b) \nSocial development: social development, including \nquestions relating to the world social situation and to \nyouth, ageing, persons with disabilities and the family \n \n \n \n \n Resolution adopted by the General Assembly \non 18 December 2019 \n \n \n \n \n[on the report of the Third Committee (A/74/391)] \n \n \n 74/120. Promoting social integration through social inclusion \n \n \n \nThe General Assembly, \n \nRecalling the World Summit for Social Development, held in Copenhagen from \n6 to 12 March 1995, and the twenty-fourth special session of the General Assembly, \nentitled \u201cWorld Summit for Social Development and beyond: achieving social \ndevelopment for all in a globalizing world\u201d, held in Geneva from 26 June to 1 July \n2000, and noting the role of the Commission for Social Development, \n \nRecalling also Economic and Social Council resolution 2010/12 of 22 July 2010 \non promoting social integration and General Assembly resolution 72/142 of \n19 December 2017 and its previous resolutions on promoting social integration \nthrough social inclusion, \n \nReaffirming its resolution 70/1 of 25 September 2015, entitled \u201cTransforming \nour world: the 2030 Agenda for Sustainable Development\u201d, in which it adopted a \ncomprehensive, far-reaching and people-centred set of universal and transformative \nSustainable Development Goals and targets, its commitment to working tirelessly for \nthe full implementation of the Agenda by 2030, its recognition that eradicating \npoverty in all its forms and dimensions, including extreme poverty, is the greatest \nglobal challenge and an indispensable requirement for sustainable development, and \nits commitment to achieving sustainable development in its three dimensions \u2013 \neconomic, social and environmental \u2013 in a balanced and integrated manner, and to \nbuilding upon the achievements of the Millennium Development Goals and seeking \nto address their unfinished business,  \n \nRecalling its resolution 74/4 of 15 October 2019, in which it endorsed the \npolitical declaration in the annex thereto entitled \u201cGearing up for a decade of action \n\nA/RES/74/120 \nPromoting social integration through social inclusion\n \n19-22040\n2/7 \n \nand delivery for sustainable development: political declaration of the Sustainable \nDevelopment Goals Summit\u201d,  \n \nWelcoming the fact that the 2030 Agenda for Sustainable Development reflects \nthe cross-cutting nature and importance of social inclusion, through the relevant \nSustainable Development Goals and associated targets, and acknowledging that its \npromotion is required to achieve sustainable development in all its dimensions, \n \nReiterating the pledge that no one will be left behind, reaffirming the \nrecognition that the dignity of the human person is fundamental, and the wish to see \nthe Goals and targets met for all nations and peoples and for all segments of society, \nand recommitting to focusing our effort where the challenges are greatest, including \nby ensuring the inclusion and participation of those who are furthest behind,  \n \nRecalling that the 2030 Agenda for Sustainable Development includes, among \nthe 17 Sustainable Development Goals, which are integrated and indivisible, a goal \nto promote peaceful and inclusive societies for sustainable development, provide \naccess to justice for all and build effective, accountable and inclusive institutions at \nall levels, \n \nReaffirming its resolution 69/313 of 27 July 2015 on the Addis Ababa Action \nAgenda of the Third International Conference on Financing for Development, which \nis an integral part of the 2030 Agenda for Sustainable Development, supports and \ncomplements it, helps to contextualize its means of implementation targets with \nconcrete policies and actions, and reaffirms the strong political commitment to \naddress the challenge of financing and creating an enabling environment at all levels \nfor sustainable development in the spirit of global partnership and solidarity, \n \nReaffirming also that empowerment, participation and social protection are \nessential for social development, as well as for social inclusion, and that sustainable \ndevelopment requires the meaningful, full and equal participation of all,  \n \nRecognizing the great importance of promoting comprehensive systems of \nsocial protection that provide universal access to essential social services, consistent \nwith national priorities and circumstances, in order to help to meet the internationally \nagreed development goals, including the Sustainable Development Goals, \n \nTaking note with appreciation of the commitment of several United Nations \nentities to mainstream social inclusion into their work, and encouraging others to do \nthe same,  \n \nReaffirming the commitment of the international community to promote \nsustained, inclusive and sustainable economic growth, full and productive employment \nand decent work for everyone, as necessary, to eradicate poverty in all its forms and \ndimensions, including extreme poverty, which should be complemented, as appropriate, \nby effective social protection policies, including social inclusion policies, \n \nReaffirming also the importance of reducing inequalities within and among \ncountries through the empowerment of all and the promotion of social, economic and \npolitical inclusion, especially for those in vulnerable or marginalized groups or \nsituations, \n \nRecognizing that the gains of economic growth should also benefit those in \nvulnerable or marginalized groups or situations, \n \nAffirming its strong support for fair globalization and the need to translate \ngrowth into the reduction of inequalities, eradication of poverty and strategies and \npolicies that promote full, freely chosen and productive employment and decent work \nfor all and that these strategies and policies should constitute fundamental \ncomponents of relevant national and international policies and national development \n\nPromoting social integration through social inclusion \nA/RES/74/120\n \n3/7\n19-22040 \n \nstrategies, including inequality and poverty reduction strategies, and reaffirming that \nemployment creation and decent work for all should be incorporated into \nmacroeconomic policies, taking fully into account the impact and social dimension \nof globalization, the benefits and costs of which are often unevenly shared and \ndistributed,  \n \nRecognizing that the three core themes of social development, namely, poverty \neradication, full and productive employment and decent work for all and social \nintegration, are interrelated and mutually reinforcing, and that an enabling environment \ntherefore needs to be created so that all three objectives can be pursued simultaneously,  \n \nReaffirming its resolution 73/342 of 16 September 2019 on the International \nLabour Organization Centenary Declaration for the Future of Work, in which it \nreaffirmed that full and productive employment and decent work for all are key \nelements of sustainable development, \n \nRecognizing that social inclusion and equality are intrinsically linked and that \nfocusing on and investing in the most disadvantaged and excluded populations, which \nmay include children, women, youth, persons with disabilities, older persons, \nmigrants and indigenous peoples, is critically important for the effective achievement \nof the Sustainable Development Goals, \n \nRecognizing also that social inclusion policies and systems play a critical role \nin promoting an inclusive society and are also crucial for fostering stable, safe, \nharmonious, peaceful and just societies and for improving social cohesion and \ninclusion so as to create an environment for development and progress, \n \nReaffirming the important role of corporate social responsibility and \naccountability in contributing to an enabling environment to promote inclusive \neconomic growth and social integration, \n \nRecognizing that social inclusion policies also strengthen the democratic \nprocess and play a critical role in progressively realizing economic, social and \ncultural rights for all, \n \nStressing that social inclusion policies should promote gender equality and the \nempowerment of women and girls and equal access to opportunities and social \nprotection for all, in particular for those in vulnerable or marginalized groups or \nsituations, including women and girls who experience multiple and intersecting forms \nof discrimination and violence, considering that the empowerment of women and girls \nwill make a crucial contribution to progress across all the Goals and targets of the \n2030 Agenda for Sustainable Development,  \n \nReaffirming the importance of ensuring the social integration of older persons \nand the promotion and protection of their rights, as an integral part of development \npolicies at all levels, and recognizing that older persons can make a significant \ncontribution to sustainable development in its three dimensions \u2013 economic, social \nand environmental, \n \nRecognizing persons with disabilities as both agents and beneficiaries of \ndevelopment, stressing the need to promote the rights of persons with disabilities and \ntheir participation, including through their representative organizations, in \nimplementing the 2030 Agenda for Sustainable Development, and in that regard \nnoting with appreciation the 2018 Disability and Development Report: Realizing the \nSustainable Development Goals by, for and with Persons with Disabilities,1 the first \nprogress report on disability inclusion in the context of the 2030 Agenda, which is \naimed at advancing efforts to remove barriers and empower persons with disabilities,  \n__________________ \n \n1  United Nations publication, Sales No. 19.IV.4. \n\nA/RES/74/120 \nPromoting social integration through social inclusion\n \n19-22040\n4/7 \n \n \nReaffirming that youth participation is important for development, and \nencouraging Member States to explore and promote the participation of young people \nin relevant decision-making processes and monitoring, including in designing and \nimplementing policies and programmes involving them, while implementing the 2030 \nAgenda for Sustainable Development,  \n \nRecognizing \nthe \nimportant \nrole \nplayed \nby \ncivil \nsociety, \nincluding \nnon-governmental organizations, in promoting social integration, inter alia, through \nsocial programmes and support for the development of socially inclusive policies, \n \nAcknowledging that the participation of persons in vulnerable or marginalized \ngroups or situations is crucial to formulating and implementing social inclusion \npolicies that effectively achieve social integration, as appropriate, \n \nReaffirming the important role of cooperatives, especially in developing \ncountries, in reducing inequality within and among countries and ensuring social \ninclusion while promoting more inclusive and equitable growth in order to achieve \nthe Sustainable Development Goals with the aim of leaving no one behind, \n \nRecognizing that each country has primary responsibility for its own economic \nand social development, and reaffirming the essential role of national policies and \nstrategies in promoting sustainable development in all its forms, particularly the \npromotion of social inclusion, \n \nRecognizing also the importance of an enabling international environment, and \nstressing the importance of enhanced international cooperation to support national \nefforts towards promoting social integration through social inclusion in every country, \nincluding the fulfilment of all commitments on official development assistance, debt \nrelief, market access, financial and technical support and capacity-building, \n \nExpressing concern that, in times of economic and financial crisis and ongoing \nconcern about energy and food insecurity, social exclusion can be exacerbated, and \nstressing in this regard that sustainable and reliable social inclusion policies and \nprogrammes can play a positive role, \n \nRecalling its resolution 72/206 of 20 December 2017 on financial inclusion for \nsustainable development, in which it recognized the importance of financial inclusion \nfor achieving sustainable development,  \n \nConsidering that bridging the digital divide is essential for all to gain access to, \namong other things, new jobs requiring relevant digital skills, in order to build an \ninclusive digital economy and knowledge society, and that information and \ncommunications technology is a tool through which all can substantively contribute \nto participate in and leverage their social and economic development and inclusion,  \n \nRecalling its resolution 73/218 of 20 December 2018 on information and \ncommunications technologies for sustainable development, \n \nRecognizing that, in order to leave no one behind and bring everyone forward, \nactions are needed for the promotion of equality of opportunity so that no person is \ndenied basic economic and social opportunities, and recognizing also that the \npromotion of equality of opportunity contributes significantly to the enjoyment of all \nhuman rights, \n \n1. \nTakes note of the report of the Secretary-General;2 \n \n2. \nStresses that Member States, which bear the main responsibility for social \nintegration and social inclusion, should prioritize the creation of a \u201csociety for all\u201d \nbased on respect for all human rights and the principles of equality among individuals, \n__________________ \n \n2  A/74/133. \n\nPromoting social integration through social inclusion \nA/RES/74/120\n \n5/7\n19-22040 \n \nnon-discrimination, access to basic social services and promotion of the active \nparticipation of every member of society, in particular those in vulnerable or \nmarginalized groups or situations, in all aspects of life, including civic, social, \neconomic, cultural and political activities, as well as participation in decision-making \nprocesses; \n \n3. \nReaffirms that social integration policies should seek to reduce inequalities \nand that equity and social inclusion are important for achieving sustainable \ndevelopment, ensuring that individuals can participate without discrimination and \ncontribute to its social, economic and environmental dimensions; \n \n4. \nAcknowledges that investment in human capital and social protection has \nbeen proven to be effective in reducing poverty and inequality, and invites Member \nStates to mobilize additional innovative sources of financing, as appropriate, \nincluding through public-private partnerships, to secure adequate levels of social \nexpenditure necessary for expanding coverage towards universal access to health, \neducation, innovation, new technologies and basic social protection, and to address \nthe issues of illicit financial flows and corruption; \n \n5. \nStresses the importance of promoting inclusive and equitable quality \neducation that is age-, disability- and gender-sensitive, as well as lifelong learning \nopportunities for all, especially for children, women, youth, persons with disabilities, \nolder persons, migrants, indigenous peoples and persons belonging to national or \nethnic, religious and linguistic minorities, and of skills development and quality \ntraining as essential means for inclusive participation and integration in society;  \n \n6. \nCalls upon Member States to promote a more equitable participation in \nand access to economic growth gains, through, inter alia, policies that ensure inclusive \nlabour markets and by implementing socially responsive macroeconomic policies, in \nwhich employment has a key role, and social inclusion strategies that promote social \nintegration, implementing nationally appropriate social protection systems and \nmeasures for all, including floors, particularly for those who are in vulnerable or \nmarginalized groups or situations, as defined by each country in accordance with its \nindividual circumstances, including on a demand-driven basis, and the promotion and \nprotection of their social and economic rights; \n \n7. \nEncourages Member States to consider, when appropriate, the creation or \nthe strengthening of national institutions or agencies for promoting, implementing \nand evaluating social inclusion programmes and mechanisms, at the national and local \nlevels, in order to help to ensure that no one is left behind; \n \n8. \nAlso encourages Member States to consider promoting the increased civil, \npolitical and economic participation of women, young people, older persons, persons \nwith disabilities, indigenous peoples and persons belonging to national or ethnic, \nreligious and linguistic minorities, including through promoting their involvement in \npolitical processes and their access to social protection, credit, vocational training and \nemployment support services; \n \n9. \nFurther encourages Member States to ensure inclusive participatory and \nrepresentative decision-making processes, at all levels, and to review existing legal \nframeworks, as appropriate, with a view to removing discriminatory provisions so as \nto reduce inequalities; \n \n10. Encourages Member States to promote social inclusion as a matter of \nsocial justice in order to build the resilience of vulnerable populations and to help \nthem to adapt to the negative impact of economic crises, humanitarian emergencies, \nnatural disasters and climate change, and in this regard invites relevant United \nNations entities and international institutions to support such efforts; \n\nA/RES/74/120 \nPromoting social integration through social inclusion\n \n19-22040\n6/7 \n \n \n11. \nInvites Member States, and encourages regional organizations, to support \nnational efforts to achieve inclusive societies, in particular in developing countries, \nupon their request, by providing, inter alia, financial and technical cooperation for the \ndesign and implementation of sound social inclusion policies; \n \n12. Encourages Member States to mainstream social integration objectives \ninto social inclusion policies, promoting the participation of persons in vulnerable or \nmarginalized groups or situations in planning, implementing and monitoring \nprocesses, in collaboration, as appropriate, with relevant organizations of the United \nNations development system, regional organizations, international and regional \nfinancial institutions, development and social partners, the private sector and civil \nsociety organizations; \n \n13. Also encourages Member States, recognizing that all legal, social and \neconomic barriers to the empowerment of all women and girls have to be removed, \nto promote the systematic mainstreaming and inclusion of a gender perspective in all \nsocial inclusion strategies or initiatives, while giving special consideration to the \npromotion of a gender-responsive policy environment in the workplace for the \nempowerment of women in the workplace; \n \n14. Further encourages Member States to consider adopting and pursuing \nnational financial inclusion strategies or initiatives that take into account a gender \nperspective and comprise, inter alia, measures for promoting full and equal access to \nformal financial services and financial literacy, as a way to increase the capacity of \nyoung people, women, persons with disabilities, older persons and indigenous peoples \nto leverage various types of opportunities for their full participation in society, such \nas entrepreneurs;  \n \n15. Recognizes that information and communications technologies have the \npotential to provide new solutions to development challenges, particularly in the \ncontext of globalization, and can foster sustained, inclusive and equitable economic \ngrowth and sustainable development, competitiveness, access to information and \nknowledge, trade and development, poverty eradication and social inclusion, \naccordingly reaffirms its commitment to bridging the digital divide, and calls upon \nMember States to implement policies and to accelerate their efforts to close the digital \ndivide, as a measure to attain the social inclusion of all, with a focus on children, \nyouth, women, persons with disabilities and older persons, without any discrimination;  \n \n16. Reaffirms the commitment of the New Urban Agenda, adopted at the \nUnited Nations Conference on Housing and Sustainable Urban Development \n(Habitat III), held in Quito from 17 to 20 October 2016,3 to embracing diversity in \ncities and human settlements, to strengthening social cohesion, intercultural dialogue \nand understanding, tolerance, mutual respect, gender equality, innovation, \nentrepreneurship, inclusion, identity and safety, and the dignity of all people, as well \nas to fostering liveability and a vibrant urban economy and to taking steps to ensure \nthat local institutions promote pluralism and peaceful coexistence within increasingly \nheterogeneous and multicultural societies;  \n \n17. Invites Member States, relevant organizations of the United Nations \nsystem, regional organizations, international and regional financial institutions, \ndevelopment and social partners, the private sector and civil society organizations to \ncontinue to share their experience in respect of practical initiatives to promote \neconomic, civil and political participation and non-discrimination measures and other \nmeasures for advancing social integration; \n__________________ \n \n3  Resolution 71/256, annex. \n\nPromoting social integration through social inclusion \nA/RES/74/120\n \n7/7\n19-22040 \n \n \n18. Invites Member States to consider a systematic exchange of good practices \nin social integration at the regional and international levels so that policymakers and \nother stakeholders can apply them to their national circumstances and step up progress \ntowards achieving a \u201csociety for all\u201d; \n \n19. Encourages Member States to improve the collection and use of high-\nquality, timely, reliable, disaggregated data and statistics for the formulation of \npolicies and programmes aimed at achieving social inclusion, and stresses the \nimportance of international cooperation in this regard; \n \n20. Requests the Secretary-General to submit a report, taking into account the \ninformation provided by Member States and relevant actors of the United Nations \nsystem, on the implementation of the present resolution to the General Assembly at \nits seventy-sixth session; \n \n21. Decides to consider the question further at its seventy-sixth session under \nthe item entitled \u201cSocial development\u201d.  \n \n50th plenary meeting \n18 December 2019 \n \n",
  "paragraphs": {
    "1": "Takes note of the report of the Secretary-General;2",
    "2": "Stresses that Member States, which bear the main responsibility for social integration and social inclusion, should prioritize the creation of a \u201csociety for all\u201d based on respect for all human rights and the principles of equality among individuals, non-discrimination, access to basic social services and promotion of the active participation of every member of society, in particular those in vulnerable or marginalized groups or situations, in all aspects of life, including civic, social, economic, cultural and political activities, as well as participation in decision-making processes;",
    "3": "Reaffirms that social integration policies should seek to reduce inequalities and that equity and social inclusion are important for achieving sustainable development, ensuring that individuals can participate without discrimination and contribute to its social, economic and environmental dimensions;",
    "4": "Acknowledges that investment in human capital and social protection has been proven to be effective in reducing poverty and inequality, and invites Member States to mobilize additional innovative sources of financing, as appropriate, including through public-private partnerships, to secure adequate levels of social expenditure necessary for expanding coverage towards universal access to health, education, innovation, new technologies and basic social protection, and to address the issues of illicit financial flows and corruption;",
    "5": "Stresses the importance of promoting inclusive and equitable quality education that is age-, disability- and gender-sensitive, as well as lifelong learning opportunities for all, especially for children, women, youth, persons with disabilities, older persons, migrants, indigenous peoples and persons belonging to national or ethnic, religious and linguistic minorities, and of skills development and quality training as essential means for inclusive participation and integration in society;",
    "6": "Calls upon Member States to promote a more equitable participation in and access to economic growth gains, through, inter alia, policies that ensure inclusive labour markets and by implementing socially responsive macroeconomic policies, in which employment has a key role, and social inclusion strategies that promote social integration, implementing nationally appropriate social protection systems and measures for all, including floors, particularly for those who are in vulnerable or marginalized groups or situations, as defined by each country in accordance with its individual circumstances, including on a demand-driven basis, and the promotion and protection of their social and economic rights;",
    "7": "Encourages Member States to consider, when appropriate, the creation or the strengthening of national institutions or agencies for promoting, implementing and evaluating social inclusion programmes and mechanisms, at the national and local levels, in order to help to ensure that no one is left behind;",
    "8": "Also encourages Member States to consider promoting the increased civil, political and economic participation of women, young people, older persons, persons with disabilities, indigenous peoples and persons belonging to national or ethnic, religious and linguistic minorities, including through promoting their involvement in political processes and their access to social protection, credit, vocational training and employment support services;",
    "9": "Further encourages Member States to ensure inclusive participatory and representative decision-making processes, at all levels, and to review existing legal frameworks, as appropriate, with a view to removing discriminatory provisions so as to reduce inequalities;",
    "10": "",
    "11": "Invites Member States, and encourages regional organizations, to support national efforts to achieve inclusive societies, in particular in developing countries, upon their request, by providing, inter alia, financial and technical cooperation for the design and implementation of sound social inclusion policies;",
    "12": "Encourages Member States to mainstream social integration objectives into social inclusion policies, promoting the participation of persons in vulnerable or marginalized groups or situations in planning, implementing and monitoring processes, in collaboration, as appropriate, with relevant organizations of the United Nations development system, regional organizations, international and regional financial institutions, development and social partners, the private sector and civil society organizations;",
    "13": "Also encourages Member States, recognizing that all legal, social and economic barriers to the empowerment of all women and girls have to be removed, to promote the systematic mainstreaming and inclusion of a gender perspective in all social inclusion strategies or initiatives, while giving special consideration to the promotion of a gender-responsive policy environment in the workplace for the empowerment of women in the workplace;",
    "14": "Further encourages Member States to consider adopting and pursuing national financial inclusion strategies or initiatives that take into account a gender perspective and comprise, inter alia, measures for promoting full and equal access to formal financial services and financial literacy, as a way to increase the capacity of young people, women, persons with disabilities, older persons and indigenous peoples to leverage various types of opportunities for their full participation in society, such as entrepreneurs;",
    "15": "Recognizes that information and communications technologies have the potential to provide new solutions to development challenges, particularly in the context of globalization, and can foster sustained, inclusive and equitable economic growth and sustainable development, competitiveness, access to information and knowledge, trade and development, poverty eradication and social inclusion, accordingly reaffirms its commitment to bridging the digital divide, and calls upon Member States to implement policies and to accelerate their efforts to close the digital divide, as a measure to attain the social inclusion of all, with a focus on children, youth, women, persons with disabilities and older persons, without any discrimination;",
    "16": "Reaffirms the commitment of the New Urban Agenda, adopted at the United Nations Conference on Housing and Sustainable Urban Development (Habitat III), held in Quito from 17 to 20 October 2016,3 to embracing diversity in cities and human settlements, to strengthening social cohesion, intercultural dialogue and understanding, tolerance, mutual respect, gender equality, innovation, entrepreneurship, inclusion, identity and safety, and the dignity of all people, as well as to fostering liveability and a vibrant urban economy and to taking steps to ensure that local institutions promote pluralism and peaceful coexistence within increasingly heterogeneous and multicultural societies;",
    "17": "Invites Member States, relevant organizations of the United Nations system, regional organizations, international and regional financial institutions, development and social partners, the private sector and civil society organizations to continue to share their experience in respect of practical initiatives to promote economic, civil and political participation and non-discrimination measures and other measures for advancing social integration;",
    "18": "Invites Member States to consider a systematic exchange of good practices in social integration at the regional and international levels so that policymakers and other stakeholders can apply them to their national circumstances and step up progress towards achieving a \u201csociety for all\u201d;",
    "19": "Encourages Member States to improve the collection and use of high- quality, timely, reliable, disaggregated data and statistics for the formulation of policies and programmes aimed at achieving social inclusion, and stresses the importance of international cooperation in this regard;",
    "20": "Requests the Secretary-General to submit a report, taking into account the information provided by Member States and relevant actors of the United Nations system, on the implementation of the present resolution to the General Assembly at its seventy-sixth session;",
    "21": "Decides to consider the question further at its seventy-sixth session under the item entitled \u201cSocial development\u201d."
  },
  "agenda_items": [
    "Item 25"
  ],
  "symbol_references": []
}