{
  "symbol": "A/RES/75/237",
  "filename": "A_RES_75_237.pdf",
  "title": "75/237. A global call for concrete action for the elimination of racism, racial discrimination, xenophobia and related intolerance and the comprehensive implementation of and follow-up to the Durban Declaration and Programme of Action",
  "text": "United Nations \nA/RES/75/237\n \n \nGeneral Assembly \nDistr.: General \n4 January 2021 \n \n \n21-00003 (E)    060121     \n*2100003* \n \n \nSeventy-fifth session \nAgenda item 70 (b) \nElimination of racism, racial discrimination, xenophobia \nand related intolerance: comprehensive implementation of \nand follow-up to the Durban Declaration and Programme \nof Action \n \n \n \n \n Resolution adopted by the General Assembly \non 31 December 2020 \n \n \n \n \n[on the report of the Third Committee (A/75/476, para. 23)] \n \n \n 75/237. A global call for concrete action for the elimination of racism, \nracial discrimination, xenophobia and related intolerance and the \ncomprehensive implementation of and follow-up to the Durban \nDeclaration and Programme of Action \n \n \n \nThe General Assembly, \n \nRecalling all its previous resolutions on the comprehensive follow-up to the \nWorld Conference against Racism, Racial Discrimination, Xenophobia and Related \nIntolerance and the effective implementation of the Durban Declaration and \nProgramme of Action adopted by the World Conference,1 in particular its resolutions \n66/144 of 19 December 2011, 67/155 of 20 December 2012 and 74/137 of \n18 December 2019, and in this regard underlining the imperative need for their full \nand effective implementation, \n \nRecalling also the suffering of the victims of racism, racial discrimination, \nxenophobia and related intolerance, and the need to honour their memory, \n \nCalling upon States to honour the memory of victims of the historical injustices \nof slavery, the slave trade, including the transatlantic slave trade, colonialism and \napartheid, \n \nStressing that the outcome of the World Conference against Racism, Racial \nDiscrimination, Xenophobia and Related Intolerance has the same status as the \noutcomes of all the major United Nations conferences, summits and special sessions \nin the human rights and social fields, and that the Durban Declaration and Programme \nof Action remains a solid basis and the only instructive outcome of the World \n__________________ \n \n1  See A/CONF.189/12 and A/CONF.189/12/Corr.1, chap. I. \n\nA/RES/75/237 \nA global call for concrete action for the elimination of racism, racial \ndiscrimination, xenophobia and related intolerance and the \ncomprehensive implementation of and follow-up to the Durban \nDeclaration and Programme of Action\n \n21-00003\n2/9 \n \nConference, which prescribes comprehensive measures for combating all the scourges \nof racism and adequate remedies for victims, and noting with concern the lack of \neffective implementation thereof, \n \nAlarmed at the global rise in hate speech, constituting incitement to racial \ndiscrimination, hostility and violence, stressing the importance of addressing it, and \nin this regard noting the launch of the United Nations Strategy and Plan of Action on \nHate Speech in June 2019, \n \nUnderlining the need to promote tolerance, inclusion and respect for diversity \nand the need to seek common ground among and within civilizations in order to \naddress common challenges to humanity that threaten shared values, universal human \nrights and the fight against racism, racial discrimination, xenophobia and related \nintolerance, through cooperation, partnership and inclusion, \n \nAlarmed at the spread in many parts of the world of various racist extremist \nmovements based on ideologies that seek to promote nationalist, right-wing agendas \nand racial superiority, and stressing that these practices fuel racism, racial \ndiscrimination, xenophobia and related intolerance, \n \nDeploring the ongoing and resurgent scourges of racism, racial discrimination, \nxenophobia and related intolerance in many regions of the world, often targeting \nmigrants and refugees, as well as people of African descent, expressing concern that \nsome political leaders and parties have supported such an environment, and in this \ncontext expressing its support for migrants and refugees in the context of the severe \ndiscrimination that they may face, \n \nDeploring also the recent incidents of excessive use of force and other human \nrights violations by law enforcement officers against peaceful demonstrators \ndefending the rights of Africans and of people of African descent, and recalling \nHuman Rights Council resolution 43/1 of 19 June 2020,2 in which the Council \nstrongly condemns the continuing racially discriminatory and violent practices \nperpetrated by law enforcement agencies against Africans and people of African \ndescent, \n \nRecognizing that racism, racial discrimination, xenophobia and related \nintolerance have a deep negative impact on the enjoyment of human rights, and \ntherefore require a united and comprehensive response from the international \ncommunity, \n \nRecalling the three Decades for Action to Combat Racism and Racial \nDiscrimination previously declared by the General Assembly, and regretting that the \nProgrammes of Action for those Decades were not fully implemented and that their \nobjectives have yet to be attained, \n \nReiterating that all human beings are born free and equal in dignity and rights \nand have the potential to contribute constructively to the development and well-being \nof their societies, and that any doctrine of racial superiority is scientifically false, \nmorally condemnable, socially unjust and dangerous and must be rejected, together \nwith theories that attempt to determine the existence of separate human races, \n \nUnderlining the intensity, magnitude and organized nature of slavery and the \nslave trade, including the transatlantic slave trade, and the associated historical \ninjustices, as well as the untold suffering caused by colonialism and apartheid, and \nthat Africans and people of African descent, Asians and people of Asian descent and \n__________________ \n \n2  See Official Records of the General Assembly, Seventy-fifth Session, Supplement No. 53 \n(A/75/53), chap. IV, sect. A. \n\nA global call for concrete action for the elimination of racism, racial \ndiscrimination, xenophobia and related intolerance and the \ncomprehensive implementation of and follow-up to the Durban \nDeclaration and Programme of Action \nA/RES/75/237\n \n3/9\n21-00003 \n \nindigenous peoples continue to be victims, and acknowledging that the ongoing \neffects must be remedied, \n \nAcknowledging the efforts and initiatives undertaken by States to prohibit racial \ndiscrimination and racial segregation and to engender the full enjoyment of economic, \nsocial and cultural rights, as well as civil and political rights, \n \nEmphasizing that, despite efforts in this regard, millions of human beings \ncontinue to be victims of racism, racial discrimination, xenophobia and related \nintolerance, including their contemporary forms and manifestations, some of which \nmanifest in violent forms, \n \nWelcoming the efforts made by civil society in support of the follow-up \nmechanisms in the implementation of the Durban Declaration and Programme of \nAction, \n \nRecalling the appointment of the five independent eminent experts by the \nSecretary-General on 16 June 2003, pursuant to General Assembly resolution 56/266 \nof 27 March 2002, with the mandate to follow up on the implementation of the \nprovisions of the Durban Declaration and Programme of Action and to make \nappropriate recommendations thereon, \n \nUnderlining the primacy of the political will, international cooperation and \nadequate funding at the national, regional and international levels needed to address \nall forms and manifestations of racism, racial discrimination, xenophobia and related \nintolerance for the successful implementation of the Durban Declaration and \nProgramme of Action, \n \nRecalling its resolution 2142 (XXI) of 26 October 1966, in which it proclaimed \n21 March as the International Day for the Elimination of Racial Discrimination, \n \nRecalling also its resolution 62/122 of 17 December 2007, in which it \ndesignated 25 March as the annual International Day of Remembrance of the Victims \nof Slavery and the Transatlantic Slave Trade, \n \nRecalling further, in the above context, the erection of the permanent memorial \nfor the victims of slavery and the slave trade, including the transatlantic slave trade, \nthe Ark of Return, based on the theme \u201cAcknowledge the tragedy, consider the legacy, \nlest we forget\u201d, \n \nWelcoming the call upon all the former colonial Powers for reparations, \nconsistent with paragraphs 157 and 158 of the Durban Programme of Action, to \nredress the historical injustices of slavery and the slave trade, including the \ntransatlantic slave trade, \n \nRecognizing and affirming that the global fight against racism, racial \ndiscrimination, xenophobia and related intolerance and all their abhorrent and \ncontemporary forms and manifestations is a matter of priority for the international \ncommunity, \n \n \n \nI \n \n \nInternational Convention on the Elimination of All Forms of Racial Discrimination \n \n \n1. \nReaffirms the paramount importance of universal adherence to and the full \nand effective implementation of the International Convention on the Elimination of \nAll Forms of Racial Discrimination,3 adopted by the General Assembly in its \nresolution 2106 A (XX) of 21 December 1965, in addressing the scourges of racism \nand racial discrimination; \n__________________ \n \n3  United Nations, Treaty Series, vol. 660, No. 9464. \n\nA/RES/75/237 \nA global call for concrete action for the elimination of racism, racial \ndiscrimination, xenophobia and related intolerance and the \ncomprehensive implementation of and follow-up to the Durban \nDeclaration and Programme of Action\n \n21-00003\n4/9 \n \n \n2. \nCalls upon States that have not done so to accede to and/or ratify the \nConvention, and States parties to consider making the declaration under article 14 of \nthe Convention, as well as to consider withdrawing reservations to article 4 of the \nConvention, as a matter of urgency, and to consider withdrawing reservations that are \nincompatible with the object and purpose of the Convention; \n \n3. \nUnderlines, in the above context, that the provisions of the Convention do \nnot respond effectively to contemporary manifestations of racial discrimination, in \nparticular in relation to xenophobia and related intolerance, which is recognized as \nthe rationale behind the convening of the World Conference against Racism, Racial \nDiscrimination, Xenophobia and Related Intolerance in 2001; \n \n4. \nTakes note of the acknowledgement by the Human Rights Council and its \nsubsidiary structures of the existence of both procedural and substantive gaps in the \nConvention, which must be filled as a matter of urgency, necessity and priority; \n \n5. \nExpresses its concern at the lack of progress in the elaboration of \ncomplementary standards to the Convention to fill existing gaps through the \ndevelopment of new normative standards aimed at combating all forms of \ncontemporary and resurgent scourges of racism; \n \n6. \nRecalls Human Rights Council resolution 34/36 of 24 March 2017,4 in \nwhich the Council requested the Chair-Rapporteur of the Ad Hoc Committee on the \nElaboration of Complementary Standards to the International Convention on the \nElimination of All Forms of Racial Discrimination to ensure the commencement of \nthe negotiations on the draft additional protocol to the Convention criminalizing acts \nof a racist and xenophobic nature during the tenth session of the Ad Hoc Committee; \n \n7. \nRequests the Chair-Rapporteur of the Ad Hoc Committee on the \nElaboration of Complementary Standards to present a progress report to the General \nAssembly at its seventy-sixth session; \n \n \n \nII \n \n \nInternational Decade for People of African Descent \n \n \n8. \nWelcomes the proclamation of the International Decade for People of \nAfrican Descent, as contained in its resolution 68/237 of 23 December 2013, and the \ncelebratory launch of the Decade on 10 December 2014; \n \n9. \nAlso welcomes the programme of activities for the International Decade \nfor People of African Descent, in which it was recommended that a forum on people \nof African descent be established and that consideration be given to the elaboration \nof a draft United Nations declaration on the promotion and full respect of the human \nrights of people of African descent; \n \n10. Recalls the draft programme of action for the International Decade for \nPeople of African Descent as an instructive framework in which all the initiatives \naimed at improving the quality of life of people of African descent are anchored and \nwhich, if adopted, would contribute to the programme of activities for the \nimplementation of the International Decade for People of African Descent; \n \n11. \nTakes note of the reports of the Secretary-General on the programme of \nactivities for the implementation of the International Decade for People of African \nDescent5 and on a global call for concrete action for the total elimination of racism, \nracial discrimination, xenophobia and related intolerance and the comprehensive \n__________________ \n \n4  See Official Records of the General Assembly, Seventy-second Session, Supplement No. 53 \n(A/72/53), chap. IV, sect. A. \n \n5  A/75/363. \n\nA global call for concrete action for the elimination of racism, racial \ndiscrimination, xenophobia and related intolerance and the \ncomprehensive implementation of and follow-up to the Durban \nDeclaration and Programme of Action \nA/RES/75/237\n \n5/9\n21-00003 \n \nimplementation of and follow-up to the Durban Declaration and Programme of \nAction;6 \n \n12. Also takes note of the report of the Working Group of Experts on People \nof African Descent,7 invites the Human Rights Council, through the Chair of the \nWorking Group, to continue to submit a report on the work of the Working Group to \nthe General Assembly, and in this regard invites the Chair of the Working Group to \nengage in an interactive dialogue with the Assembly under the item entitled \n\u201cElimination of racism, racial discrimination, xenophobia and related intolerance\u201d at \nits seventy-sixth session; \n \n13. Welcomes the decision to establish the Permanent Forum on People of \nAfrican Descent, which will serve as a consultation mechanism for people of African \ndescent and other interested stakeholders as a platform for improving the quality of \nlife and livelihoods of people of African descent and to contribute to elaborating a \nUnited Nations declaration on the promotion and full respect of human rights of \npeople of African descent, and that the modalities, format and substantive and \nprocedural aspects of the Permanent Forum will be concluded by Member States and \nobserver States, with further consultations with people of African descent; \n \n14. Also welcomes the convening of regional meetings by the Office of the \nUnited Nations High Commissioner for Human Rights to effectively implement the \nprogramme of activities of the International Decade for People of African Descent, \nencourages Member States and other stakeholders to adopt action-oriented \nrecommendations at the meetings, and calls upon States, regional organizations and \nother stakeholders to facilitate the participation of civil society from their respective \ncountries and regions at the meetings; \n \n15. Further welcomes the constructive discussions held in Geneva on the \nmodalities of the Permanent Forum on People of African Descent, regrets that the \nmodalities, format and substantive and procedural aspects of the Permanent Forum \non People of African Descent could not be defined during its seventy-fourth session \nowing to the coronavirus disease (COVID-19) pandemic, decides to define them, with \nno further delay, at its seventy-fifth session, and requests the President of the General \nAssembly to appoint co-facilitators in that regard; \n \n16. Requests the Office of the United Nations High Commissioner for Human \nRights and the Department of Global Communications of the Secretariat to continue \nawareness-raising efforts and public information campaigns in support of the \nInternational Decade for People of African Descent through the use of social networks \nand digital media, including the wide distribution of user-friendly, concise and \naccessible versions of material in this regard; \n \n17. Welcomes the efforts undertaken by the Human Rights Council with regard \nto the preparatory process for the midterm review of the International Decade for \nPeople of African Descent; \n \n18. Reaffirms its commitment to eliminating contemporary forms of racism, \nracial discrimination, xenophobia and related intolerance, and in this regard notes in \nparticular 2020 as the midterm review of the International Decade for People of \nAfrican Descent, 2015 to 2024, and its programme of activities; \n \n__________________ \n \n6  A/75/561. \n \n7  A/75/275. \n\nA/RES/75/237 \nA global call for concrete action for the elimination of racism, racial \ndiscrimination, xenophobia and related intolerance and the \ncomprehensive implementation of and follow-up to the Durban \nDeclaration and Programme of Action\n \n21-00003\n6/9 \n \n \n \nIII \n \n \nOffice of the United Nations High Commissioner for Human Rights \n \n \n19. Requests the Secretary-General and the Office of the United Nations High \nCommissioner for Human Rights to provide the resources necessary for the effective \nfulfilment of the mandates of the Intergovernmental Working Group on the Effective \nImplementation of the Durban Declaration and Programme of Action, the Working \nGroup of Experts on People of African Descent, the Group of Independent Eminent \nExperts on the Implementation of the Durban Declaration and Programme of Action \nand the Ad Hoc Committee on the Elaboration of Complementary Standards, and in \nthis regard to ensure the participation of experts in each session of those follow-up \nmechanisms in order to provide advice on the specific issues under discussion and \nassist the mechanisms in their deliberations and the adoption of action-oriented \nrecommendations in relation to the implementation of the Declaration and Programme \nof Action; \n \n20. Recalls Human Rights Council resolution 43/1, in which the Council \nrequested the United Nations High Commissioner for Human Rights, with the \nassistance of relevant special procedure mandate holders, to prepare a report on \nsystemic racism, violations of international human rights law against Africans and \npeople of African descent by law enforcement agencies to contribute to accountability \nand redress for victims; \n \n \n \nIV \n \n \nGroup of Independent Eminent Experts on the Implementation of the Durban \nDeclaration and Programme of Action \n \n \n21. Takes note of the report of the Group of Independent Eminent Experts on \nthe Implementation of the Durban Declaration and Programme of Action on its sixth \nsession,8 and in this regard notes that the session, which included private and public \nsessions, was held in Geneva from 6 to 10 May 2019; \n \n \n \nV \n \n \nTrust fund for the Programme for the Decade for Action to Combat Racism and \nRacial Discrimination \n \n \n22. Recalls the establishment by the Secretary-General, in 1973, of the trust \nfund for the Programme for the Decade for Action to Combat Racism and Racial \nDiscrimination as a funding mechanism that has been utilized for the implementation \nof the activities of the three Decades for Action to Combat Racism and Racial \nDiscrimination declared by the General Assembly, and in this regard appreciates the \nfact that the trust fund has also been utilized for the subsequent programmes and \noperational activities transcending the three Decades; \n \n23. Requests the Secretary-General to include, in his report on the \nimplementation of the present resolution to the General Assembly at its seventy-sixth \nsession, a section outlining the progress in the implementation of paragraph 18 of its \nresolution 68/151 of 18 December 2013 regarding the revitalization of the trust fund \nfor the purpose of ensuring the successful implementation of the activities of the \nInternational Decade for People of African Descent and enhancing the effectiveness \nof the comprehensive follow-up to the World Conference against Racism, Racial \nDiscrimination, \nXenophobia \nand \nRelated \nIntolerance \nand \nthe \neffective \nimplementation of the Durban Declaration and Programme of Action; \n__________________ \n \n8  See A/74/173. \n\nA global call for concrete action for the elimination of racism, racial \ndiscrimination, xenophobia and related intolerance and the \ncomprehensive implementation of and follow-up to the Durban \nDeclaration and Programme of Action \nA/RES/75/237\n \n7/9\n21-00003 \n \n \n24. Strongly \nappeals \nto \nall \nGovernments, \nintergovernmental \nand \nnon-governmental organizations and individuals, as well as other donors in a position \nto do so, to contribute generously to the trust fund, and to that end requests the \nSecretary-General to continue to undertake appropriate contacts and initiatives to \nencourage contributions; \n \n \n \nVI \n \n \nSpecial Rapporteur of the Human Rights Council on contemporary forms of \nracism, racial discrimination, xenophobia and related intolerance \n \n \n25. Takes note of the report of the Special Rapporteur of the Human Rights \nCouncil on contemporary forms of racism, racial discrimination, xenophobia and \nrelated intolerance,9 and encourages the Special Rapporteur, within her mandate, to \ncontinue to focus on the issues of racism, racial discrimination, xenophobia and \nrelated intolerance and incitement to hatred, which impede peaceful coexistence and \nharmony within societies, and to submit reports in this regard to the Human Rights \nCouncil and the General Assembly; \n \n26. Reiterates its previous requests to the Special Rapporteur to consider \nexamining national models of mechanisms that measure racial equality and their value \nadded in the eradication of racial discrimination and to report on such challenges, \nsuccesses and best practices in her next report, and expresses concern at the lack of \nprogress in this regard; \n \n \n \nVII \n \n \nCommemoration of the twentieth anniversary of the adoption of the Durban \nDeclaration and Programme of Action \n \n \n27. Decides to hold a one-day high-level meeting of the General Assembly to \ncommemorate the twentieth anniversary of the adoption of the Durban Declaration \nand Programme of Action, at the level of Heads of State and Government, on the \nsecond day of the general debate of the seventy-sixth session, on the theme \n\u201cReparations, racial justice and equality for people of African descent\u201d, consisting of \nan opening plenary meeting, consecutive round tables and/or thematic panels and a \nclosing plenary meeting; \n \n28. Also decides that the meeting will adopt a short and concise political \ndeclaration aimed at mobilizing political will at the national, regional and \ninternational levels for the full and effective implementation of the Durban \nDeclaration and Programme of Action and its follow-up processes; \n \n29. Requests the President of the General Assembly, consistent with the rules \nof procedure of the General Assembly, to carry out consultations on the modalities of \nthe high-level meeting and to appoint co-facilitators for the political declaration; \n \n30. Emphasizes the critical importance of increasing public support for the \nDurban Declaration and Programme of Action and the participation of civil society \nand other relevant stakeholders in its realization; \n \n31. Invites Member States, United Nations entities, international and regional \norganizations, civil society, including non-governmental organizations, and other \nstakeholders to organize and support various high-visibility initiatives, aimed at \neffectively increasing awareness at all levels, to commemorate the twentieth \nanniversary of the adoption of the Durban Declaration and Programme of Action; \n \n32. Requests the Secretary-General to establish a programme of outreach, with \nthe involvement of Member States and United Nations funds and programmes, as well \n__________________ \n \n9  See A/75/590. \n\nA/RES/75/237 \nA global call for concrete action for the elimination of racism, racial \ndiscrimination, xenophobia and related intolerance and the \ncomprehensive implementation of and follow-up to the Durban \nDeclaration and Programme of Action\n \n21-00003\n8/9 \n \nas civil society, including non-governmental organizations, to appropriately \ncommemorate the twentieth anniversary of the adoption of the Durban Declaration \nand Programme of Action; \n \n33. Calls upon Member States and the United Nations system to intensify \nefforts to widely distribute copies of the Durban Declaration and Programme of \nAction, and encourages efforts to ensure its translation and wide dissemination; \n \n34. Requests the Office of the United Nations High Commissioner for Human \nRights and the Department of Global Communications of the Secretariat to launch a \npublic information campaign for the commemoration of the twentieth anniversary of \nthe adoption of the Durban Declaration and Programme of Action, including the wide \ndistribution of user-friendly information materials through the United Nations system, \ninter alia, through United Nations information centres; \n \n35. Expresses its appreciation for the continuing work of the mechanisms \nmandated to follow up on the World Conference and the Durban Review Conference; \n \n \n \nVIII \n \n \nFollow-up and implementation activities \n \n \n36. Acknowledges the guidance and leadership role of the Human Rights \nCouncil, and encourages it to continue to oversee the implementation of the Durban \nDeclaration and Programme of Action and the outcome document of the Durban \nReview Conference; \n \n37. Requests the Office of the United Nations High Commissioner for Human \nRights to continue to provide the Human Rights Council with all the support \nnecessary for it to achieve its objectives in this regard; \n \n38. Requests the Human Rights Council to consider, at its forty-sixth session, \nthe question of developing a multi-year programme of activities to provide for the \nrenewed and strengthened outreach activities needed to inform and mobilize the \nglobal public in support of the Durban Declaration and Programme of Action and to \nstrengthen awareness of the contribution that they have made in the struggle against \nracism, racial discrimination, xenophobia and related intolerance, in consultation with \nMember States, national human rights institutions, relevant civil society organizations \nand United Nations agencies, funds and programmes; \n \n39. Welcomes the efforts undertaken by the Human Rights Council, through \nits Advisory Committee, in preparing a study on appropriate ways and means of \nassessing the situation regarding racial equality, while identifying possible gaps and \noverlaps; \n \n40. Also welcomes the commemorative plenary meeting of the General \nAssembly held on 25 March 2019 to mark the International Day for the Elimination \nof Racial Discrimination, on the mitigation and countering of rising nationalist \npopulism and extreme supremacist ideologies; \n \n41. Requests the Secretary-General to submit to the General Assembly at its \nseventy-sixth session a report on the implementation of the present resolution; \n \n42. Requests the President of the General Assembly and the President of the \nHuman Rights Council to continue to convene annual commemorative meetings of \nthe Assembly and the Council during the commemoration of the International Day for \nthe Elimination of Racial Discrimination, with the appropriate focus and themes, and \nto hold a debate on the midterm review of the International Decade for People of \nAfrican Descent with the participation of the Secretary-General and the United \nNations High Commissioner for Human Rights, and in this context encourages the \nparticipation of eminent personalities active in the struggle against racial \n\nA global call for concrete action for the elimination of racism, racial \ndiscrimination, xenophobia and related intolerance and the \ncomprehensive implementation of and follow-up to the Durban \nDeclaration and Programme of Action \nA/RES/75/237\n \n9/9\n21-00003 \n \ndiscrimination, Member States and civil society organizations in accordance with the \nrules of procedure of the Assembly and the Council, respectively; \n \n43. Decides to remain seized of this priority matter at its seventy-sixth session \nunder the item entitled \u201cElimination of racism, racial discrimination, xenophobia and \nrelated intolerance\u201d. \n \n48th (resumed) plenary meeting \n31 December 2020 \n \n",
  "paragraphs": {
    "1": "Reaffirms the paramount importance of universal adherence to and the full and effective implementation of the International Convention on the Elimination of All Forms of Racial Discrimination,3 adopted by the General Assembly in its resolution 2106 A (XX) of 21 December 1965, in addressing the scourges of racism and racial discrimination; __________________ 3 United Nations, Treaty Series, vol. 660, No. 9464. A/RES/75/237 A global call for concrete action for the elimination of racism, racial discrimination, xenophobia and related intolerance and the comprehensive implementation of and follow-up to the Durban Declaration and Programme of Action 21-00003 4/9",
    "2": "Calls upon States that have not done so to accede to and/or ratify the Convention, and States parties to consider making the declaration under article 14 of the Convention, as well as to consider withdrawing reservations to article 4 of the Convention, as a matter of urgency, and to consider withdrawing reservations that are incompatible with the object and purpose of the Convention;",
    "3": "Underlines, in the above context, that the provisions of the Convention do not respond effectively to contemporary manifestations of racial discrimination, in particular in relation to xenophobia and related intolerance, which is recognized as the rationale behind the convening of the World Conference against Racism, Racial Discrimination, Xenophobia and Related Intolerance in 2001;",
    "4": "Takes note of the acknowledgement by the Human Rights Council and its subsidiary structures of the existence of both procedural and substantive gaps in the Convention, which must be filled as a matter of urgency, necessity and priority;",
    "5": "Expresses its concern at the lack of progress in the elaboration of complementary standards to the Convention to fill existing gaps through the development of new normative standards aimed at combating all forms of contemporary and resurgent scourges of racism;",
    "6": "Recalls Human Rights Council resolution 34/36 of 24 March 2017,4 in which the Council requested the Chair-Rapporteur of the Ad Hoc Committee on the Elaboration of Complementary Standards to the International Convention on the Elimination of All Forms of Racial Discrimination to ensure the commencement of the negotiations on the draft additional protocol to the Convention criminalizing acts of a racist and xenophobic nature during the tenth session of the Ad Hoc Committee;",
    "7": "Requests the Chair-Rapporteur of the Ad Hoc Committee on the Elaboration of Complementary Standards to present a progress report to the General Assembly at its seventy-sixth session; II International Decade for People of African Descent",
    "8": "Welcomes the proclamation of the International Decade for People of African Descent, as contained in its resolution 68/237 of 23 December 2013, and the celebratory launch of the Decade on 10 December 2014;",
    "9": "Also welcomes the programme of activities for the International Decade for People of African Descent, in which it was recommended that a forum on people of African descent be established and that consideration be given to the elaboration of a draft United Nations declaration on the promotion and full respect of the human rights of people of African descent;",
    "10": "Recalls the draft programme of action for the International Decade for People of African Descent as an instructive framework in which all the initiatives aimed at improving the quality of life of people of African descent are anchored and which, if adopted, would contribute to the programme of activities for the implementation of the International Decade for People of African Descent;",
    "11": "Takes note of the reports of the Secretary-General on the programme of activities for the implementation of the International Decade for People of African Descent5 and on a global call for concrete action for the total elimination of racism, racial discrimination, xenophobia and related intolerance and the comprehensive __________________ 4 See Official Records of the General Assembly, Seventy-second Session, Supplement No. 53 (A/72/53), chap. IV, sect. A. 5 A/75/363. A global call for concrete action for the elimination of racism, racial discrimination, xenophobia and related intolerance and the comprehensive implementation of and follow-up to the Durban Declaration and Programme of Action A/RES/75/237 5/9 21-00003 implementation of and follow-up to the Durban Declaration and Programme of Action;6",
    "12": "Also takes note of the report of the Working Group of Experts on People of African Descent,7 invites the Human Rights Council, through the Chair of the Working Group, to continue to submit a report on the work of the Working Group to the General Assembly, and in this regard invites the Chair of the Working Group to engage in an interactive dialogue with the Assembly under the item entitled \u201cElimination of racism, racial discrimination, xenophobia and related intolerance\u201d at its seventy-sixth session;",
    "13": "Welcomes the decision to establish the Permanent Forum on People of African Descent, which will serve as a consultation mechanism for people of African descent and other interested stakeholders as a platform for improving the quality of life and livelihoods of people of African descent and to contribute to elaborating a United Nations declaration on the promotion and full respect of human rights of people of African descent, and that the modalities, format and substantive and procedural aspects of the Permanent Forum will be concluded by Member States and observer States, with further consultations with people of African descent;",
    "14": "Also welcomes the convening of regional meetings by the Office of the United Nations High Commissioner for Human Rights to effectively implement the programme of activities of the International Decade for People of African Descent, encourages Member States and other stakeholders to adopt action-oriented recommendations at the meetings, and calls upon States, regional organizations and other stakeholders to facilitate the participation of civil society from their respective countries and regions at the meetings;",
    "15": "Further welcomes the constructive discussions held in Geneva on the modalities of the Permanent Forum on People of African Descent, regrets that the modalities, format and substantive and procedural aspects of the Permanent Forum on People of African Descent could not be defined during its seventy-fourth session owing to the coronavirus disease (COVID-19) pandemic, decides to define them, with no further delay, at its seventy-fifth session, and requests the President of the General Assembly to appoint co-facilitators in that regard;",
    "16": "Requests the Office of the United Nations High Commissioner for Human Rights and the Department of Global Communications of the Secretariat to continue awareness-raising efforts and public information campaigns in support of the International Decade for People of African Descent through the use of social networks and digital media, including the wide distribution of user-friendly, concise and accessible versions of material in this regard;",
    "17": "Welcomes the efforts undertaken by the Human Rights Council with regard to the preparatory process for the midterm review of the International Decade for People of African Descent;",
    "18": "Reaffirms its commitment to eliminating contemporary forms of racism, racial discrimination, xenophobia and related intolerance, and in this regard notes in particular 2020 as the midterm review of the International Decade for People of African Descent, 2015 to 2024, and its programme of activities; __________________ 6 A/75/561. 7 A/75/275. A/RES/75/237 A global call for concrete action for the elimination of racism, racial discrimination, xenophobia and related intolerance and the comprehensive implementation of and follow-up to the Durban Declaration and Programme of Action 21-00003 6/9 III Office of the United Nations High Commissioner for Human Rights",
    "19": "Requests the Secretary-General and the Office of the United Nations High Commissioner for Human Rights to provide the resources necessary for the effective fulfilment of the mandates of the Intergovernmental Working Group on the Effective Implementation of the Durban Declaration and Programme of Action, the Working Group of Experts on People of African Descent, the Group of Independent Eminent Experts on the Implementation of the Durban Declaration and Programme of Action and the Ad Hoc Committee on the Elaboration of Complementary Standards, and in this regard to ensure the participation of experts in each session of those follow-up mechanisms in order to provide advice on the specific issues under discussion and assist the mechanisms in their deliberations and the adoption of action-oriented recommendations in relation to the implementation of the Declaration and Programme of Action;",
    "20": "Recalls Human Rights Council resolution 43/1, in which the Council requested the United Nations High Commissioner for Human Rights, with the assistance of relevant special procedure mandate holders, to prepare a report on systemic racism, violations of international human rights law against Africans and people of African descent by law enforcement agencies to contribute to accountability and redress for victims; IV Group of Independent Eminent Experts on the Implementation of the Durban Declaration and Programme of Action",
    "21": "Takes note of the report of the Group of Independent Eminent Experts on the Implementation of the Durban Declaration and Programme of Action on its sixth session,8 and in this regard notes that the session, which included private and public sessions, was held in Geneva from 6 to 10 May 2019; V Trust fund for the Programme for the Decade for Action to Combat Racism and Racial Discrimination",
    "22": "Recalls the establishment by the Secretary-General, in 1973, of the trust fund for the Programme for the Decade for Action to Combat Racism and Racial Discrimination as a funding mechanism that has been utilized for the implementation of the activities of the three Decades for Action to Combat Racism and Racial Discrimination declared by the General Assembly, and in this regard appreciates the fact that the trust fund has also been utilized for the subsequent programmes and operational activities transcending the three Decades;",
    "23": "Requests the Secretary-General to include, in his report on the implementation of the present resolution to the General Assembly at its seventy-sixth session, a section outlining the progress in the implementation of paragraph 18 of its resolution 68/151 of 18 December 2013 regarding the revitalization of the trust fund for the purpose of ensuring the successful implementation of the activities of the International Decade for People of African Descent and enhancing the effectiveness of the comprehensive follow-up to the World Conference against Racism, Racial Discrimination, Xenophobia and Related Intolerance and the effective implementation of the Durban Declaration and Programme of Action; __________________ 8 See A/74/173. A global call for concrete action for the elimination of racism, racial discrimination, xenophobia and related intolerance and the comprehensive implementation of and follow-up to the Durban Declaration and Programme of Action A/RES/75/237 7/9 21-00003",
    "24": "Strongly appeals to all Governments, intergovernmental and non-governmental organizations and individuals, as well as other donors in a position to do so, to contribute generously to the trust fund, and to that end requests the Secretary-General to continue to undertake appropriate contacts and initiatives to encourage contributions; VI Special Rapporteur of the Human Rights Council on contemporary forms of racism, racial discrimination, xenophobia and related intolerance",
    "25": "Takes note of the report of the Special Rapporteur of the Human Rights Council on contemporary forms of racism, racial discrimination, xenophobia and related intolerance,9 and encourages the Special Rapporteur, within her mandate, to continue to focus on the issues of racism, racial discrimination, xenophobia and related intolerance and incitement to hatred, which impede peaceful coexistence and harmony within societies, and to submit reports in this regard to the Human Rights Council and the General Assembly;",
    "26": "Reiterates its previous requests to the Special Rapporteur to consider examining national models of mechanisms that measure racial equality and their value added in the eradication of racial discrimination and to report on such challenges, successes and best practices in her next report, and expresses concern at the lack of progress in this regard; VII Commemoration of the twentieth anniversary of the adoption of the Durban Declaration and Programme of Action",
    "27": "Decides to hold a one-day high-level meeting of the General Assembly to commemorate the twentieth anniversary of the adoption of the Durban Declaration and Programme of Action, at the level of Heads of State and Government, on the second day of the general debate of the seventy-sixth session, on the theme \u201cReparations, racial justice and equality for people of African descent\u201d, consisting of an opening plenary meeting, consecutive round tables and/or thematic panels and a closing plenary meeting;",
    "28": "Also decides that the meeting will adopt a short and concise political declaration aimed at mobilizing political will at the national, regional and international levels for the full and effective implementation of the Durban Declaration and Programme of Action and its follow-up processes;",
    "29": "Requests the President of the General Assembly, consistent with the rules of procedure of the General Assembly, to carry out consultations on the modalities of the high-level meeting and to appoint co-facilitators for the political declaration;",
    "30": "Emphasizes the critical importance of increasing public support for the Durban Declaration and Programme of Action and the participation of civil society and other relevant stakeholders in its realization;",
    "31": "Invites Member States, United Nations entities, international and regional organizations, civil society, including non-governmental organizations, and other stakeholders to organize and support various high-visibility initiatives, aimed at effectively increasing awareness at all levels, to commemorate the twentieth anniversary of the adoption of the Durban Declaration and Programme of Action;",
    "32": "Requests the Secretary-General to establish a programme of outreach, with the involvement of Member States and United Nations funds and programmes, as well __________________ 9 See A/75/590. A/RES/75/237 A global call for concrete action for the elimination of racism, racial discrimination, xenophobia and related intolerance and the comprehensive implementation of and follow-up to the Durban Declaration and Programme of Action 21-00003 8/9 as civil society, including non-governmental organizations, to appropriately commemorate the twentieth anniversary of the adoption of the Durban Declaration and Programme of Action;",
    "33": "Calls upon Member States and the United Nations system to intensify efforts to widely distribute copies of the Durban Declaration and Programme of Action, and encourages efforts to ensure its translation and wide dissemination;",
    "34": "Requests the Office of the United Nations High Commissioner for Human Rights and the Department of Global Communications of the Secretariat to launch a public information campaign for the commemoration of the twentieth anniversary of the adoption of the Durban Declaration and Programme of Action, including the wide distribution of user-friendly information materials through the United Nations system, inter alia, through United Nations information centres;",
    "35": "Expresses its appreciation for the continuing work of the mechanisms mandated to follow up on the World Conference and the Durban Review Conference; VIII Follow-up and implementation activities",
    "36": "Acknowledges the guidance and leadership role of the Human Rights Council, and encourages it to continue to oversee the implementation of the Durban Declaration and Programme of Action and the outcome document of the Durban Review Conference;",
    "37": "Requests the Office of the United Nations High Commissioner for Human Rights to continue to provide the Human Rights Council with all the support necessary for it to achieve its objectives in this regard;",
    "38": "Requests the Human Rights Council to consider, at its forty-sixth session, the question of developing a multi-year programme of activities to provide for the renewed and strengthened outreach activities needed to inform and mobilize the global public in support of the Durban Declaration and Programme of Action and to strengthen awareness of the contribution that they have made in the struggle against racism, racial discrimination, xenophobia and related intolerance, in consultation with Member States, national human rights institutions, relevant civil society organizations and United Nations agencies, funds and programmes;",
    "39": "Welcomes the efforts undertaken by the Human Rights Council, through its Advisory Committee, in preparing a study on appropriate ways and means of assessing the situation regarding racial equality, while identifying possible gaps and overlaps;",
    "40": "Also welcomes the commemorative plenary meeting of the General Assembly held on 25 March 2019 to mark the International Day for the Elimination of Racial Discrimination, on the mitigation and countering of rising nationalist populism and extreme supremacist ideologies;",
    "41": "Requests the Secretary-General to submit to the General Assembly at its seventy-sixth session a report on the implementation of the present resolution;",
    "42": "Requests the President of the General Assembly and the President of the Human Rights Council to continue to convene annual commemorative meetings of the Assembly and the Council during the commemoration of the International Day for the Elimination of Racial Discrimination, with the appropriate focus and themes, and to hold a debate on the midterm review of the International Decade for People of African Descent with the participation of the Secretary-General and the United Nations High Commissioner for Human Rights, and in this context encourages the participation of eminent personalities active in the struggle against racial A global call for concrete action for the elimination of racism, racial discrimination, xenophobia and related intolerance and the comprehensive implementation of and follow-up to the Durban Declaration and Programme of Action A/RES/75/237 9/9 21-00003 discrimination, Member States and civil society organizations in accordance with the rules of procedure of the Assembly and the Council, respectively;",
    "43": "Decides to remain seized of this priority matter at its seventy-sixth session under the item entitled \u201cElimination of racism, racial discrimination, xenophobia and related intolerance\u201d. 48th (resumed) plenary meeting 31 December 2020"
  },
  "agenda_items": [
    "Item 70"
  ],
  "symbol_references": []
}