{
  "symbol": "A/RES/76/107",
  "filename": "A_RES_76_107.pdf",
  "title": "76/107. Mediation Rules of the United Nations Commission on International Trade Law",
  "text": "United Nations \nA/RES/76/107\n \n \nGeneral Assembly \nDistr.: General \n17 December 2021 \n \n21-18655 (E)    271221 \n*2118655* \n \n \nSeventy-sixth session \nAgenda item 80 \nReport of the United Nations Commission on International \nTrade Law on the work of its fifty-fourth session \n \n \n \n \n Resolution adopted by the General Assembly \non 9 December 2021 \n \n \n \n \n[on the report of the Sixth Committee (A/76/471, para. 13)] \n \n \n 76/107. Mediation Rules of the United Nations Commission on \nInternational Trade Law \n \n \n \nThe General Assembly, \n \nRecalling its resolution 2205 (XXI) of 17 December 1966, by which it established \nthe United Nations Commission on International Trade Law with a mandate to further \nthe progressive harmonization and unification of the law of international trade and in \nthat respect to bear in mind the interests of all peoples, in particular those of developing \ncountries, in the extensive development of international trade, \n \nRecalling also the resolutions on instruments on dispute settlement methods \nreferred to by expressions such as mediation, conciliation and expressions of similar \nimport, namely resolution 35/52 of 4 December 1980 on the Conciliation Rules of the \nCommission,1 and resolutions 73/198 and 73/199 of 20 December 2018 on the United \nNations Convention on International Settlement Agreements Resulting from Mediation2 \nand the Model Law on International Commercial Mediation and International Settlement \nAgreements Resulting from Mediation of the Commission,3 respectively, \n \nMindful of the value of such dispute settlement methods as a means of amicably \nsettling disputes arising in the context of international commercial relations, and of \nthe fact that such dispute settlement methods are increasingly used in international \nand domestic commercial practice as an alternative to litigation, to reach a final \nresolution of the dispute in a cost- and time-effective manner, \n \nAware that the use of such dispute settlement methods results in significant \nbenefits, such as reducing the instances where a dispute leads to the termination of a \n__________________ \n \n1  Official Records of the General Assembly, Thirty-fifth Session, Supplement No. 17 (A/35/17), \npara. 106. \n \n2  Ibid., Seventy-third Session, Supplement No. 17 (A/73/17), annex I. \n \n3  Ibid., annex II. \n\nA/RES/76/107 \nMediation Rules of the United Nations Commission \non International Trade Law\n \n21-18655\n2/2 \n \ncommercial relationship, facilitating the administration of international transactions by \ncommercial parties and producing savings in the administration of justice by States,  \n \nRecognizing the developments in such dispute settlement methods since the \nadoption of the Conciliation Rules,  \n \nNoting that the preparation of the UNCITRAL Mediation Rules benefited \ngreatly from consultations with Governments and interested intergovernmental and \ninternational non-governmental organizations, \n \nNoting also that the UNCITRAL Mediation Rules were adopted by the United \nNations Commission on International Trade Law at its fifty-fourth session, after due \ndeliberations,4 \n \n1. \nExpresses its appreciation to the United Nations Commission on \nInternational Trade Law for having formulated and adopted the Mediation Rules, the \ntext of which is contained in annex III to the report of the United Nations Commission \non International Trade Law on the work of its fifty-fourth session;5 \n \n2. \nRecommends the use of the UNCITRAL Mediation Rules in the settlement \nof disputes arising in the context of international commercial relations;  \n \n3. \nRequests the Secretary-General to make all efforts to ensure that the \nUNCITRAL Mediation Rules become generally known and available. \n \n49th plenary meeting \n9 December 2021 \n \n \n__________________ \n \n4  Ibid., Seventy-sixth Session, Supplement No. 17 (A/76/17), chap. VI, sect. B. \n \n5  Ibid., annex III. \n",
  "paragraphs": {
    "1": "Expresses its appreciation to the United Nations Commission on International Trade Law for having formulated and adopted the Mediation Rules, the text of which is contained in annex III to the report of the United Nations Commission on International Trade Law on the work of its fifty-fourth session;5",
    "2": "Recommends the use of the UNCITRAL Mediation Rules in the settlement of disputes arising in the context of international commercial relations;",
    "3": "Requests the Secretary-General to make all efforts to ensure that the UNCITRAL Mediation Rules become generally known and available."
  },
  "agenda_items": [
    "Item 80"
  ],
  "symbol_references": []
}