{
  "symbol": "A/RES/72/275",
  "filename": "A_RES_72_275.pdf",
  "title": "72/275. International Association of Permanent Representatives to the United Nations",
  "text": "United Nations \nA/RES/72/275\n \n \nGeneral Assembly \nDistr.: General \n16 April 2018 \n \n18-05870 (E)    180418  \n*1805870* \n \n \nSeventy-second session \nAgenda item 123 \n \n \n \n \n Resolution adopted by the General Assembly \non 12 April 2018 \n \n \n \n \n[without reference to a Main Committee (A/72/L.45 and A/72/L.45/Add.1)] \n \n \n 72/275. International Association of Permanent Representatives \nto the United Nations \n \n \n \nThe General Assembly, \n \nGuided by the Charter of the United Nations, \n \nMindful of the importance of the atmosphere of trusting and respectful dialogue \nand interaction among the permanent representatives of States Members of the United \nNations for the successful promotion of the noble principles and purposes of the \nCharter of the United Nations, \n \nWilling to facilitate the exchange and proliferation of good diplomatic practices, \nexperience and insight, as well as the preservation of the institutional memory of the \nUnited Nations diplomatic community, \n \nRecalling that the International Association of Permanent Representatives to the \nUnited Nations was established on 2 February 1988 in New York upon the initiative \nof the Permanent Representative of Saudi Arabia to the United Nations, Mr. Samir \nShihabi, as an informal forum and a framework for regular communication and \nconsultation among former and current permanent representatives to the United \nNations, \n \nBearing in mind the close personal ties of amity and friendship that are forged \nbetween permanent representatives to the United Nations in their common pursuit of \nthe shared objectives of the United Nations, \n \nWishing to promote informal interpersonal communication among former and \ncurrent permanent representatives to the United Nations and to ensure the continuity \nthereof, \n \n1. \nAcknowledges with appreciation the role played by the former Permanent \nRepresentative of Saudi Arabia to the United Nations, Mr. Samir Shihabi, and all \nsubsequent presidents of the International Association of Permanent Representatives \nto the United Nations in leading and developing the Association and guiding it \ntowards the achievement of its goals and objectives; \n\nA/RES/72/275 \nInternational Association of Permanent Representatives to the United Nations\n \n18-05870\n2/2 \n \n \n2. \nRecognizes the important role played by the Association and its positive \ncontribution to the activity of the Organization through the promotion of better \ninterpersonal connectedness and a climate of trust and openness, as well as the \nexchange of good practices and experience; \n \n3. \nInvites the States Members of the United Nations to support the work of \nthe Association and encourage the participation of former and current permanent \nrepresentatives to the United Nations in the events and forums of the Association; \n \n4. \nAuthorizes the Secretary-General to continue to provide the Association, \nfrom within existing resources, with facilities on a non-remuneration basis and to \nreplace its current office with a more suitable space to enable the Association to \nconvene its meetings; \n \n5. \nCalls upon the Secretary-General to provide the Association with a \nseparate web page, to be hosted on the delegates section of the United Nations web \nsite, with content provided by the Association and updated from time to time with \ninformation on its recent activities; \n \n6. \nAuthorizes the use by the Association of the United Nations emblem \nalongside the emblem of the Association, provided that guidelines for the use thereof \nare followed. \n \n82nd plenary meeting \n12 April 2018 \n \n",
  "paragraphs": {
    "1": "",
    "2": "Recognizes the important role played by the Association and its positive contribution to the activity of the Organization through the promotion of better interpersonal connectedness and a climate of trust and openness, as well as the exchange of good practices and experience;",
    "3": "Invites the States Members of the United Nations to support the work of the Association and encourage the participation of former and current permanent representatives to the United Nations in the events and forums of the Association;",
    "4": "Authorizes the Secretary-General to continue to provide the Association, from within existing resources, with facilities on a non-remuneration basis and to replace its current office with a more suitable space to enable the Association to convene its meetings;",
    "5": "Calls upon the Secretary-General to provide the Association with a separate web page, to be hosted on the delegates section of the United Nations web site, with content provided by the Association and updated from time to time with information on its recent activities;",
    "6": "Authorizes the use by the Association of the United Nations emblem alongside the emblem of the Association, provided that guidelines for the use thereof are followed."
  },
  "agenda_items": [
    "Item 123"
  ],
  "symbol_references": [
    "A/72/L.45"
  ]
}