{
  "symbol": "A/RES/72/127",
  "filename": "A_RES_72_127.pdf",
  "title": "72/127. Observer status for the Eurasian Group on Combating Money Laundering and Financing of Terrorism in the General Assembly",
  "text": "United Nations \nA/RES/72/127\n \n \nGeneral Assembly \nDistr.: General \n18 December 2017 \n \n17-22172 (E)    201217     \n*1722172* \n \n \nSeventy-second session \nAgenda item 172 \n \n \n \n \n Resolution adopted by the General Assembly \non 7 December 2017 \n \n \n \n \n[on the report of the Sixth Committee (A/72/475)] \n \n \n 72/127. Observer status for the Eurasian Group on Combating Money \nLaundering and Financing of Terrorism in the General Assembly \n \n \n \nThe General Assembly, \n \nWishing to promote cooperation between the United Nations and the Eurasian \nGroup on Combating Money Laundering and Financing of Terrorism, \n \n1. \nDecides to invite the Eurasian Group on Combating Money Laundering \nand Financing of Terrorism to participate in the sessions and the work of the General \nAssembly in the capacity of observer; \n \n2. \nRequests the Secretary-General to take the action necessary to implement \nthe present resolution. \n \n67th plenary meeting  \n7 December 2017 \n \n",
  "paragraphs": {
    "1": "Decides to invite the Eurasian Group on Combating Money Laundering and Financing of Terrorism to participate in the sessions and the work of the General Assembly in the capacity of observer;",
    "2": "Requests the Secretary-General to take the action necessary to implement the present resolution. 67th plenary meeting 7 December 2017"
  },
  "agenda_items": [
    "Item 172"
  ],
  "symbol_references": []
}