{
  "symbol": "A/RES/76/69",
  "filename": "A_RES_76_69.pdf",
  "title": "76/69. Promotion of interreligious and intercultural dialogue, understanding and cooperation for peace",
  "text": "United Nations \nA/RES/76/69\n \n \nGeneral Assembly \nDistr.: General \n16 December 2021 \n \n21-18573 (E)    221221     \n*2118573* \n \n \nSeventy-sixth session \nAgenda item 16 \nCulture of peace \n \n \n \n \n Resolution adopted by the General Assembly \non 9 December 2021 \n \n \n \n \n[without reference to a Main Committee (A/76/L.21 and A/76/L.21/Add.1)] \n \n \n \n76/69. Promotion of interreligious and intercultural dialogue, \nunderstanding and cooperation for peace \n \n \n \nThe General Assembly, \n \nReaffirming the purposes and principles enshrined in the Charter of the United \nNations and the Universal Declaration of Human Rights, 1 in particular the right to \nfreedom of thought, conscience and religion, \n \nRecalling its resolution 75/26 of 2 December 2020 on the promotion of \ninterreligious and intercultural dialogue, understanding and cooperation for peace, \nand its other related resolutions, \n \nRecalling also its resolution 53/243 of 13 September 1999 on the Declaration \nand Programme of Action on a Culture of Peace, which serves as a universal mandate \nfor the international community for the promotion of a culture of peace and \nnon-violence that benefits humanity, in particular future generations, and welcoming \nthe convening of the High-level Forum on the Culture of Peace by the President of \nthe General Assembly on 7 September 2021,  \n \nRecalling further that, in its resolution 67/104 of 17 December 2012, it \nproclaimed the period 2013\u20132022 the International Decade for the Rapprochement of \nCultures and invited the United Nations Educational, Scientific and Cultural \nOrganization, in that context, to be the lead agency in the United Nations system, \n \nEncouraging, in this regard, activities aimed at promoting interreligious and \nintercultural dialogue in order to enhance peace and social stability, respect for \ndiversity and mutual respect and to create, at the global level, and also at the regional, \nnational and local levels, an environment conducive to peace and mutual \nunderstanding, \n__________________ \n \n1  Resolution 217 A (III). \n\nA/RES/76/69 \nPromotion of interreligious and intercultural dialogue, \nunderstanding and cooperation for peace\n \n21-18573\n2/7 \n \n \nRecalling its resolution 69/312 of 6 July 2015 on the United Nations Alliance of \nCivilizations, in which it reaffirmed its support for the Alliance and reiterated the \nvaluable role of the Alliance in promoting greater understanding and respect among \ncivilizations, cultures, religions and beliefs, \n \nRecalling also its resolution 36/55 of 25 November 1981, by which it \nproclaimed the Declaration on the Elimination of All Forms of Intolerance and of \nDiscrimination Based on Religion or Belief, and its resolutions 72/241 of \n20 December 2017 on a world against violence and violent extremism, 73/285 of \n2 April 2019 on combating terrorism and other acts of violence based on religion or \nbelief, 75/258 of 21 January 2021 on promoting a culture of peace and tolerance to \nsafeguard religious sites, 75/291 of 30 June 2021, entitled \u201cThe United Nations \nGlobal Counter-Terrorism Strategy: seventh review\u201d, and 75/309 of 21 July 2021 on \npromoting interreligious and intercultural dialogue and tolerance in countering hate \nspeech, \n \nRecalling further its resolution 72/130 of 8 December 2017, by which it \nproclaimed the International Day of Living Together in Peace and underlined that it \nconstitutes a means of mobilizing the efforts of the international community to \npromote peace, tolerance, inclusion, understanding and solidarity, \n \nWelcoming the observance of 10 December as Human Rights Day,2 9 December \nas the International Day of Commemoration and Dignity of the Victims of the Crime \nof Genocide and of the Prevention of This Crime,3 2 October as the International Day \nof Non-Violence,4 18 June as the International Day for Countering Hate Speech, 5 \n21 August as the International Day of Remembrance of and Tribute to the Victims of \nTerrorism 6  and 4 February as the International Day of Human Fraternity, 7  as \nproclaimed by the United Nations,  \n \nRecalling its resolution 74/306 of 11 September 2020, in which it recognized \nthat the coronavirus disease (COVID-19) is one of the greatest global challenges in \nthe history of the United Nations, expressed deep concern about the rise in \ndiscrimination, hate speech, stigmatization, racism and xenophobia related to the \npandemic and stressed the need to counter them as part of the COVID-19 response, \n \nNoting the Secretary-General\u2019s special appeal to religious leaders to join forces, \nwork for peace and focus on the world\u2019s common battle to defeat COVID-19, the \nUnited Nations Guidance Note on Addressing and Countering COVID-19-related \nHate Speech and the statement entitled \u201cA call for mutual respect\u201d by the High \nRepresentative for the United Nations Alliance of Civilizations, \n \nBearing in mind the valuable contribution that interreligious and intercultural \ndialogue can make to an improved awareness and understanding of the common \nvalues shared by all humankind, \n \nNoting that interreligious and intercultural dialogue has made significant \ncontributions to mutual understanding, tolerance and respect, as well as to the \npromotion of a culture of peace and an improvement of overall relations among \npeople from different cultural and religious backgrounds and among nations, \n__________________ \n \n2  Resolution 423 (V). \n \n3  Resolution 69/323. \n \n4  Resolution 61/271. \n \n5  Resolution 75/309. \n \n6  Resolution 72/165. \n \n7  Resolution 75/200. \n\nPromotion of interreligious and intercultural dialogue, \nunderstanding and cooperation for peace \nA/RES/76/69\n \n3/7\n21-18573 \n \n \nNoting also the growing importance of interreligious and intercultural dialogue \nin the context of the global phenomenon of migration, which increases interaction \namong persons and communities from various traditions, cultures and religions, \n \nConvinced that the full enjoyment of human rights by all persons, the promotion \nof cultural pluralism and tolerance towards and dialogue among various cultures and \ncivilizations would contribute to the efforts of all peoples and nations to enrich their \ncultures and traditions by engaging in a mutually beneficial exchange of knowledge \nand intellectual, moral and material achievements, \n \nNoting the launch by the Secretary-General of the United Nations Strategy and \nPlan of Action on Hate Speech, and noting the role of the Special Adviser to the \nSecretary-General on the Prevention of Genocide in this regard, \n \nNoting also the leading role played by the United Nations Alliance of \nCivilizations in preparing the United Nations Plan of Action to Safeguard Religious \nSites, noting further the launch of the Plan of Action by the Secretary-General on \n12 September 2019, and inviting Member States to consider implementing the \nrelevant recommendations addressed to them, in collaboration with other \nstakeholders, as appropriate, \n \nNoting further the Unite for Heritage campaign launched by the United Nations \nEducational, Scientific and Cultural Organization in March 2015, which is aimed at \ncelebrating and safeguarding cultural heritage and diversity around the world, and the \nConference on Safeguarding Endangered Cultural Heritage, held in Abu Dhabi on \n2 and 3 December 2016, and the declaration adopted at the Conference, \n \nRecalling that States have the primary responsibility to promote and protect \nhuman rights, including the human rights of persons belonging to religious minorities, \nincluding their right to exercise their religion or belief freely, \n \nRecalling also its resolution 73/296 of 28 May 2019, in which it decided to \ndesignate 22 August as the International Day Commemorating the Victims of Acts of \nViolence Based on Religion or Belief, \n \nRecognizing that individuals in many religions and societies accord significance \nto religious symbols, and in this regard underscoring the importance of promoting \nmutual respect, tolerance and peaceful coexistence, \n \nReaffirming that violence can and should never be a justifiable or acceptable \nresponse to acts of intolerance on the basis of religion or belief and that such violence \nshould not be attributed to any religion, nationality, civilization or ethnic group, \n \nReaffirming also the positive role that the exercise of the right to freedom of \nopinion and expression and full respect for the freedom to seek, receive and impart \ninformation can play in strengthening democracy and combating religious \nintolerance, and reaffirming further that the exercise of the right to freedom of \nexpression carries with it special duties and responsibilities, in accordance with \narticle 19 of the International Covenant on Civil and Political Rights, 8 \n \nRecalling article 20 (2) of the International Covenant on Civil and Political \nRights, which states that any advocacy of national, racial or religious hatred that \nconstitutes incitement to discrimination, hostility or violence shall be prohibited by \nlaw, \n \nRecalling also its resolution 73/329 of 25 July 2019, in which it declared 5 April \nthe International Day of Conscience, \n__________________ \n \n8  See resolution 2200 A (XXI), annex. \n\nA/RES/76/69 \nPromotion of interreligious and intercultural dialogue, \nunderstanding and cooperation for peace\n \n21-18573\n4/7 \n \n \nBearing in mind that tolerance of cultural, ethnic, religious and linguistic \ndiversities contributes towards peace, mutual understanding and friendship among \npeople of different cultures and nations and that these diversities should be made part \nof intercultural and interreligious dialogue efforts, as appropriate, \n \nReaffirming \nthe \n2030 Agenda \nfor \nSustainable \nDevelopment,\n9  and \nacknowledging that the 2030 Agenda includes the promotion of peaceful and \ninclusive societies for sustainable development,  \n \nNoting the various initiatives at the local, national, regional and international \nlevels for enhancing interreligious and intercultural dialogue, understanding and \ncooperation, and for strengthening people-to-people bonds, which are mutually \nreinforcing and interrelated, such as the establishment of the Hamad bin Khalifa \nCivilization Center in Copenhagen in 2014, the African Initiative on Education for \nPeace and Development through Interreligious and Intercultural Dialogue, launched \nin Cotonou, Benin, in May 2015, the thirteenth Doha Conference on Interfaith \nDialogue, held in Qatar, the sixth Congress of Leaders of World and Traditional \nReligions, held in Astana in October 2018, the third World Nomad Games, held in \nIssyk-Kul, Kyrgyzstan, and organized under the patronage of the United Nations \nEducational, Scientific and Cultural Organization in September 2018, the \nestablishment of the International Institute for Tolerance and the Muslim Council of \nElders in the United Arab Emirates, in 2017, and the launch of the World Tolerance \nSummit, in Abu Dhabi, all of which contribute to promoting social cohesion and \ninclusion, peace and development, and noting the preparations under way in the \nRussian Federation by the Inter-Parliamentary Union, in cooperation with the United \nNations, to organize the World Conference on Intercultural and Interreligious \nDialogue, \n \nNoting the cooperation between the United Nations and regional and other \norganizations in the promotion of interreligious and intercultural dialogue, \n \nNoting also the adoption of the Yerevan Declaration of the seventeenth Summit \nof Heads of State and Government of la Francophonie, on the theme \u201cLiving \ntogether\u201d, held in Yerevan on 11 and 12 October 2018, \n \nWelcoming the leading role of the United Nations Educational, Scientific and \nCultural Organization, as well as the work of the United Nations Alliance of \nCivilizations, in promoting intercultural dialogue, \n \nWelcoming also the work of the Anna Lindh Foundation and the ongoing work \nof the King Abdullah Bin Abdulaziz International Centre for Interreligious and \nIntercultural Dialogue in Vienna, \n \nNoting the declaration of the Forum on the Role of Religious Leaders in \nPreventing Incitement that could Lead to Atrocity Crimes, held in Fez, Morocco, on \n23 and 24 April 2015, and further efforts that build on the Rabat Plan of Action on \nthe prohibition of advocacy of national, racial or religious hatred that constitutes \nincitement to discrimination, hostility or violence 10 and the Istanbul Process for \nCombating Intolerance, Discrimination and Incitement to Hatred and/or Violence on \nthe Basis of Religion or Belief, \n \nWelcoming the Declaration on Promoting Cultural Pluralism and Peace through \nInterfaith and Inter-ethnic Dialogue, endorsed by the 137th Assembly of the \nInter-Parliamentary Union, held in Saint Petersburg, Russian Federation, from 14 to \n18 October 2017, \n__________________ \n \n9  Resolution 70/1. \n \n10  A/HRC/22/17/Add.4, appendix. \n\nPromotion of interreligious and intercultural dialogue, \nunderstanding and cooperation for peace \nA/RES/76/69\n \n5/7\n21-18573 \n \n \nReferring to the World Forum on Intercultural Dialogue, organized biennially \nby Azerbaijan in cooperation with the United Nations Educational, Scientific and \nCultural Organization, the United Nations Alliance of Civilizations, the World \nTourism Organization, the Council of Europe and the Islamic Educational, Scientific \nand Cultural Organization, as a key global platform for promoting intercultural \ndialogue, \n \nAcknowledging the positive contribution of individuals and of relevant civil \nsociety organizations to the promotion of interreligious and intercultural dialogue, \nunderstanding and the culture of peace, \n \nUnderlining the importance of education, including education on culture, peace, \ntolerance, mutual understanding and human rights, in promoting interreligious and \nintercultural dialogue, respect for diversity, and the elimination of discrimination \nbased on religion or belief, \n \nRecognizing the contributions of the media and of new information and \ncommunications technologies to promoting peoples\u2019 understanding of different \ncultures and religions, including through the promotion of dialogue, \n \nReaffirming the importance of sustaining the process of engaging all \nstakeholders, including young men and women as relevant actors, in interreligious \nand intercultural dialogue within the appropriate initiatives at various levels, which \nis aimed at challenging prejudices, improving mutual understanding and fostering \ncooperation, \n \nRecognizing the commitment of all religions to peace and the contribution that \ninterreligious and intercultural dialogue among religions, groups and individuals, in \nparticular religious leaders, can make towards an improved awareness and \nunderstanding of the common values shared by all humankind, \n \nNoting the Appeal for Peace, signed by religious leaders during the World Day \nof Prayer for Peace, held in Assisi, Italy, on 20 September 2016, \n \nTaking note of the document entitled \u201cHuman fraternity for world peace and \nliving together\u201d, which was signed by Pope Francis and the Grand Imam of Al-Azhar, \nAhmad al-Tayyib, on 4 February 2019 in Abu Dhabi, \n \n1. \nReaffirms that mutual understanding and interreligious and intercultural \ndialogue constitute important dimensions of the dialogue among civilizations and of \nthe culture of peace; \n \n2. \nRecognizes that the open public debate of ideas, as well as interfaith and \nintercultural dialogue, at the local, national and international levels can be among the \nbest protections against religious intolerance and can play a positive role in \nstrengthening democracy and combating religious hatred, and convinced that a \ncontinuing dialogue on these issues can help to overcome existing misperceptions; \n \n3. \nTakes note of the report of the Secretary-General on the promotion of a \nculture of peace and interreligious and intercultural dialogue, understanding and \ncooperation for peace;11 \n \n4. \nRecognizes the importance of interreligious and intercultural dialogue and \nits valuable contribution to promoting social cohesion and inclusion, peace and \ndevelopment, and calls upon Member States to consider, as appropriate and where \napplicable, interreligious and intercultural dialogue as an important tool in efforts \naimed at achieving peace and social stability and the full realization of the Sustainable \nDevelopment Goals; \n__________________ \n \n11  A/76/357. \n\nA/RES/76/69 \nPromotion of interreligious and intercultural dialogue, \nunderstanding and cooperation for peace\n \n21-18573\n6/7 \n \n \n5. \nAlso recognizes the efforts by relevant stakeholders to foster peaceful and \nharmonious coexistence within societies by promoting respect for religious and \ncultural diversity, including by engendering sustained and robust interaction among \nvarious segments of society; \n \n6. \nFurther recognizes the leading role of the United Nations Educational, \nScientific and Cultural Organization on intercultural dialogue and its contribution to \ninterreligious dialogue, as well as its activities related to the culture of peace and \nnon-violence and its focus on concrete actions at the global, regional and subregional \nlevels, and recognizes the contribution by the United Nations Alliance of Civilizations \nin this regard;  \n \n7. \nWelcomes the declarations adopted by the Global Forums of the United \nNations Alliance of Civilizations, and invites relevant stakeholders to continue their \nefforts to promote mutual understanding among different civilizations, cultures, \nreligions and beliefs;  \n \n8. \nAlso welcomes the efforts undertaken by the High Representative for the \nUnited Nations Alliance of Civilizations in promoting intercultural and interreligious \ndialogue, strengthening social cohesion and promoting a culture of peace; \n \n9. \nTakes note with concern the rise in discrimination, hate speech, \nstigmatization, racism and xenophobia related to the COVID-19 pandemic; \n \n10. Calls upon Member States, which have the primary responsibility to \ncounter discrimination and hate speech, and all relevant actors, including political \nand religious leaders, to promote inclusion and unity in response to the COVID-19 \npandemic and to combat racism, xenophobia, hate speech, violence and \ndiscrimination; \n \n11. \nReaffirms the solemn commitment of all States to fulfil their obligations \nand commitments to promote universal respect for and observance and protection of \nall human rights and fundamental freedoms for all in accordance with the Charter of \nthe United Nations, the Universal Declaration of Human Rights and other instruments \nrelating to human rights and international law, the universal nature of these rights and \nfreedoms being beyond question; \n \n12. Recalls the initiative to open up the Kartarpur Sahib Corridor in the spirit \nof interfaith harmony and peaceful neighbourhood, and appreciates the agreement \nbetween the Governments of India and Pakistan to allow visa-free access to pilgrims \nof all faiths, especially Nanak Naam Levas and the Sikh community from across the \nworld, as a landmark initiative for interreligious and intercultural cooperation for \npeace; \n \n13. Welcomes the joint statement issued by Spain and Turkey as co-sponsors \nof the United Nations Alliance of Civilizations after the successful conclusion of the \neighth Global Forum of the Alliance, on the theme \u201c#Commit2Dialogue: partnerships \nfor prevention and sustaining peace\u201d, held in New York on 19 and 20 November 2018, \nand invites relevant stakeholders to continue their efforts to promote cross-cultural \ndialogue and mutual understanding among different civilizations, cultures, religions \nand beliefs; \n \n14. Underlines the importance of moderation as a value within societies for \ncountering violent extremism as and when conducive to terrorism, while respecting \nhuman rights and fundamental freedoms, and for further contributing to the promotion \nof interreligious and intercultural dialogue, tolerance, understanding and cooperation, \nand encourages efforts, as appropriate, to enable voices of moderation to work \ntogether in order to build a more secure, inclusive and peaceful world; \n \n15. Welcomes the efforts by the media to promote interreligious and \nintercultural dialogue, encourages the further promotion of dialogue among the media \nfrom all cultures and civilizations, emphasizes that everyone has the right to freedom \n\nPromotion of interreligious and intercultural dialogue, \nunderstanding and cooperation for peace \nA/RES/76/69\n \n7/7\n21-18573 \n \nof expression, and reaffirms that the exercise of this right carries with it special duties \nand responsibilities and may therefore be subject to certain restrictions, but that these \ncan be only such as are provided by law and necessary for respect of the rights or \nreputations of others, and protection of national security or of public order, or of \npublic health and morals, and are non-discriminatory and that all measures taken \nshould be in full compliance with international human rights law; \n \n16. Also welcomes the efforts to use information and communications \ntechnologies, including the Internet, to promote interreligious and intercultural \ndialogue, including through the Interfaith Dialogue ePortal established following the \nSpecial Non-Aligned Movement Ministerial Meeting on Interfaith Dialogue and \nCooperation for Peace and Development, held in Manila in 2010, as well as the Peace \nand Dialogue ePortal of the United Nations Educational, Scientific and Cultural \nOrganization, and encourages relevant stakeholders to utilize the opportunity to \ndisseminate their best practices and experiences on interreligious and intercultural \ndialogue by contributing to the Interfaith Dialogue ePortal and to the Peace and \nDialogue ePortal; \n \n17. Encourages Member States to consider, as and where appropriate, \ninitiatives that identify areas for practical action in all sectors and levels of society \nfor the promotion of interreligious and intercultural dialogue, tolerance, \nunderstanding and cooperation, inter alia, the ideas suggested during the High-level \nDialogue on Interreligious and Intercultural Understanding and Cooperation for \nPeace, held in New York in October 2007, including the idea of an enhanced process \nof dialogue among world religions, as well as the ideas suggested during the third \nHigh Panel on Peace and Dialogue among Cultures, held in Paris in November 2012; \n \n18. Acknowledges the active engagement of the United Nations system with \nfaith-based and cultural organizations and other relevant non-governmental \norganizations in the promotion of interreligious and intercultural dialogue and in \nbringing together people of different cultures, religions, faiths or beliefs to discuss \ncommon issues and objectives;  \n \n19. Also acknowledges the important role of civil society, including academia, \nin fostering interreligious and intercultural dialogue, and encourages support for \npractical measures that mobilize civil society, including building capacities, \nopportunities and frameworks for cooperation; \n \n20. Invites Member States to further promote reconciliation to help to ensure \ndurable peace, and sustained development, including by working with faith leaders \nand communities and through reconciliatory measures and acts of service and by \nencouraging forgiveness and compassion among individuals; \n \n21. Also invites Member States to disseminate values of religious tolerance \nand interreligious dialogue through educational programmes; \n \n22. Recognizes that the Office of Intergovernmental Support and Coordination \nfor Sustainable Development in the Department of Economic and Social Affairs of \nthe Secretariat plays a valuable role as focal point within the Secretariat on the issue, \nand encourages it to continue to interact and coordinate with the relevant entities of \nthe United Nations system and coordinate their contribution to the intergovernmental \nprocess aimed at promoting interreligious and intercultural dialogue; \n \n23. Requests the Secretary-General to report to the General Assembly at its \nseventy-eighth session on the implementation of the present resolution.  \n \n48th plenary meeting \n9 December 2021 \n \n \n",
  "paragraphs": {
    "1": "Reaffirms that mutual understanding and interreligious and intercultural dialogue constitute important dimensions of the dialogue among civilizations and of the culture of peace;",
    "2": "Recognizes that the open public debate of ideas, as well as interfaith and intercultural dialogue, at the local, national and international levels can be among the best protections against religious intolerance and can play a positive role in strengthening democracy and combating religious hatred, and convinced that a continuing dialogue on these issues can help to overcome existing misperceptions;",
    "3": "Takes note of the report of the Secretary-General on the promotion of a culture of peace and interreligious and intercultural dialogue, understanding and cooperation for peace;11",
    "4": "Recognizes the importance of interreligious and intercultural dialogue and its valuable contribution to promoting social cohesion and inclusion, peace and development, and calls upon Member States to consider, as appropriate and where applicable, interreligious and intercultural dialogue as an important tool in efforts aimed at achieving peace and social stability and the full realization of the Sustainable Development Goals; __________________ 11 A/76/357. A/RES/76/69 Promotion of interreligious and intercultural dialogue, understanding and cooperation for peace 21-18573 6/7",
    "5": "Also recognizes the efforts by relevant stakeholders to foster peaceful and harmonious coexistence within societies by promoting respect for religious and cultural diversity, including by engendering sustained and robust interaction among various segments of society;",
    "6": "Further recognizes the leading role of the United Nations Educational, Scientific and Cultural Organization on intercultural dialogue and its contribution to interreligious dialogue, as well as its activities related to the culture of peace and non-violence and its focus on concrete actions at the global, regional and subregional levels, and recognizes the contribution by the United Nations Alliance of Civilizations in this regard;",
    "7": "Welcomes the declarations adopted by the Global Forums of the United Nations Alliance of Civilizations, and invites relevant stakeholders to continue their efforts to promote mutual understanding among different civilizations, cultures, religions and beliefs;",
    "8": "Also welcomes the efforts undertaken by the High Representative for the United Nations Alliance of Civilizations in promoting intercultural and interreligious dialogue, strengthening social cohesion and promoting a culture of peace;",
    "9": "Takes note with concern the rise in discrimination, hate speech, stigmatization, racism and xenophobia related to the COVID-19 pandemic;",
    "10": "Calls upon Member States, which have the primary responsibility to counter discrimination and hate speech, and all relevant actors, including political and religious leaders, to promote inclusion and unity in response to the COVID-19 pandemic and to combat racism, xenophobia, hate speech, violence and discrimination;",
    "11": "Reaffirms the solemn commitment of all States to fulfil their obligations and commitments to promote universal respect for and observance and protection of all human rights and fundamental freedoms for all in accordance with the Charter of the United Nations, the Universal Declaration of Human Rights and other instruments relating to human rights and international law, the universal nature of these rights and freedoms being beyond question;",
    "12": "Recalls the initiative to open up the Kartarpur Sahib Corridor in the spirit of interfaith harmony and peaceful neighbourhood, and appreciates the agreement between the Governments of India and Pakistan to allow visa-free access to pilgrims of all faiths, especially Nanak Naam Levas and the Sikh community from across the world, as a landmark initiative for interreligious and intercultural cooperation for peace;",
    "13": "Welcomes the joint statement issued by Spain and Turkey as co-sponsors of the United Nations Alliance of Civilizations after the successful conclusion of the eighth Global Forum of the Alliance, on the theme \u201c#Commit2Dialogue: partnerships for prevention and sustaining peace\u201d, held in New York on 19 and 20 November 2018, and invites relevant stakeholders to continue their efforts to promote cross-cultural dialogue and mutual understanding among different civilizations, cultures, religions and beliefs;",
    "14": "Underlines the importance of moderation as a value within societies for countering violent extremism as and when conducive to terrorism, while respecting human rights and fundamental freedoms, and for further contributing to the promotion of interreligious and intercultural dialogue, tolerance, understanding and cooperation, and encourages efforts, as appropriate, to enable voices of moderation to work together in order to build a more secure, inclusive and peaceful world;",
    "15": "Welcomes the efforts by the media to promote interreligious and intercultural dialogue, encourages the further promotion of dialogue among the media from all cultures and civilizations, emphasizes that everyone has the right to freedom Promotion of interreligious and intercultural dialogue, understanding and cooperation for peace A/RES/76/69 7/7 21-18573 of expression, and reaffirms that the exercise of this right carries with it special duties and responsibilities and may therefore be subject to certain restrictions, but that these can be only such as are provided by law and necessary for respect of the rights or reputations of others, and protection of national security or of public order, or of public health and morals, and are non-discriminatory and that all measures taken should be in full compliance with international human rights law;",
    "16": "Also welcomes the efforts to use information and communications technologies, including the Internet, to promote interreligious and intercultural dialogue, including through the Interfaith Dialogue ePortal established following the Special Non-Aligned Movement Ministerial Meeting on Interfaith Dialogue and Cooperation for Peace and Development, held in Manila in 2010, as well as the Peace and Dialogue ePortal of the United Nations Educational, Scientific and Cultural Organization, and encourages relevant stakeholders to utilize the opportunity to disseminate their best practices and experiences on interreligious and intercultural dialogue by contributing to the Interfaith Dialogue ePortal and to the Peace and Dialogue ePortal;",
    "17": "Encourages Member States to consider, as and where appropriate, initiatives that identify areas for practical action in all sectors and levels of society for the promotion of interreligious and intercultural dialogue, tolerance, understanding and cooperation, inter alia, the ideas suggested during the High-level Dialogue on Interreligious and Intercultural Understanding and Cooperation for Peace, held in New York in October 2007, including the idea of an enhanced process of dialogue among world religions, as well as the ideas suggested during the third High Panel on Peace and Dialogue among Cultures, held in Paris in November 2012;",
    "18": "Acknowledges the active engagement of the United Nations system with faith-based and cultural organizations and other relevant non-governmental organizations in the promotion of interreligious and intercultural dialogue and in bringing together people of different cultures, religions, faiths or beliefs to discuss common issues and objectives;",
    "19": "Also acknowledges the important role of civil society, including academia, in fostering interreligious and intercultural dialogue, and encourages support for practical measures that mobilize civil society, including building capacities, opportunities and frameworks for cooperation;",
    "20": "Invites Member States to further promote reconciliation to help to ensure durable peace, and sustained development, including by working with faith leaders and communities and through reconciliatory measures and acts of service and by encouraging forgiveness and compassion among individuals;",
    "21": "Also invites Member States to disseminate values of religious tolerance and interreligious dialogue through educational programmes;",
    "22": "Recognizes that the Office of Intergovernmental Support and Coordination for Sustainable Development in the Department of Economic and Social Affairs of the Secretariat plays a valuable role as focal point within the Secretariat on the issue, and encourages it to continue to interact and coordinate with the relevant entities of the United Nations system and coordinate their contribution to the intergovernmental process aimed at promoting interreligious and intercultural dialogue;",
    "23": "Requests the Secretary-General to report to the General Assembly at its seventy-eighth session on the implementation of the present resolution. 48th plenary meeting 9 December 2021"
  },
  "agenda_items": [
    "Item 16"
  ],
  "symbol_references": [
    "A/76/L.21"
  ]
}