{
  "symbol": "A/RES/72/9",
  "filename": "A_RES_72_9.pdf",
  "title": "72/9. Programme planning",
  "text": " \nUnited Nations \n \nA/RES/72/9\n \n \nGeneral Assembly \n \nDistr.: General \n21 November 2017 \n \n \n17-20524 (E)    241117 \n*1720524* \n \n \n \n \nSeventy-second session  \nAgenda item 137  \n \n \n \n \n Resolution adopted by the General Assembly \non 17 November 2017  \n \n \n \n \n[on the report of the Fifth Committee (A/72/524)]  \n \n \n \n72/9. Programme planning  \n \n \n \nThe General Assembly,  \n \nRecalling its resolutions 37/234 of 21 December 1982, 38/227 A of \n20 December 1983, 41/213 of 19 December 1986, 55/234 of 23 December 2000, \n56/253 of 24 December 2001, 57/282 of 20 December 2002, 58/268 and 58/269 of \n23 December 2003, 59/275 of 23 December 2004, 60/257 of 8 May 2006, 61/235 of \n22 December 2006, 62/224 of 22 December 2007, 63/247 of 24 December 2008, \n64/229 of 22 December 2009, 65/244 of 24 December 2010, 66/8 of 11 November \n2011, 67/236 of 24 December 2012, 68/20 of 4 December 2013, 69/17 of \n18 November 2014, 70/8 of 13 November 2015 and 71/6 of 27 October 2016,  \n \nRecalling also the terms of reference of the Committee for Programme and \nCoordination, as outlined in the annex to Economic and Social Council \nresolution 2008 (LX) of 14 May 1976,  \n \nHaving considered the report of the Committee for Programme and \nCoordination on the work of its fifty-seventh session,1  \n \nHaving also considered the report of the Office of Internal Oversight Services \non strengthening the role of evaluation and the application of evaluation findings on \nprogramme design, delivery and policy directives 2 and the report of the Secretary-\nGeneral on the proposed revisions to the Regulations and Rules Governing \nProgramme Planning, the Programme Aspects of the Budget, the Monitoring of \nImplementation and the Methods of Evaluation (article VII and annex),3  \n \n1. \nReaffirms the role of the Committee for Programme and Coordination as \nthe main subsidiary organ of the General Assembly and the Economic and Social \nCouncil for planning, programming and coordination;  \n__________________ \n \n1 Official Records of the General Assembly, Seventy-second Session, Supplement No. 16 (A/72/16).  \n \n2 A/72/72.  \n \n3 A/72/73/Rev.1.  \n\nA/RES/72/9 \nProgramme planning\n \nError! No document variable supplied. \n2/2 \n \n \n2. \nRe-emphasizes the role of the plenary and the Main Committees of the \nGeneral Assembly \nin \nreviewing \nand \ntaking \naction \non \nthe \nappropriate \nrecommendations of the Committee for Programme and Coordination relevant to \ntheir work, in accordance with regulation 4.10 of the Regulations and Rules \nGoverning Programme Planning, the Programme Aspects of the Budget, the \nMonitoring of Implementation and the Methods of Evaluation;4  \n \n3. \nStresses that setting the priorities of the United Nations is the prerogative \nof the Member States, as reflected in legislative mandates;  \n \n4. \nAlso stresses the need for Member States to participate fully in the \nbudget preparation process, from its early stages and throughout the process;  \n \n5. \nEndorses the conclusions and recommendations of the Committee for \nProgramme and Coordination on proposed revisions to the Regulations and Rules \nGoverning Programme Planning, the Programme Aspects of the Budget, the \nMonitoring of Implementation and the Methods of Evaluation (article VII and \nannex),5 on evaluation,6 on the annual overview report of the United Nations \nSystem Chief Executives Board for Coordination for 2016 7 and on the United \nNations system support for the New Partnership for Africa\u2019s Development.8  \n \n55th plenary meeting  \n17 November 2017  \n \n__________________ \n \n4 ST/SGB/2016/6.  \n \n5  See Official Records of the General Assembly, Seventy-second Session, Supplement No. 16 \n(A/72/16), chap. II, sect. A.  \n \n6  Ibid., chap. II, sect. B.  \n \n7  Ibid., chap. III, sect. A.  \n \n8  Ibid., chap. III, sect. B.  \n",
  "paragraphs": {
    "1": "Reaffirms the role of the Committee for Programme and Coordination as the main subsidiary organ of the General Assembly and the Economic and Social Council for planning, programming and coordination; __________________ 1 Official Records of the General Assembly, Seventy-second Session, Supplement No. 16 (A/72/16). 2 A/72/72. 3 A/72/73/Rev.1. A/RES/72/9 Programme planning Error! No document variable supplied. 2/2",
    "2": "Re-emphasizes the role of the plenary and the Main Committees of the General Assembly in reviewing and taking action on the appropriate recommendations of the Committee for Programme and Coordination relevant to their work, in accordance with regulation 4.10 of the Regulations and Rules Governing Programme Planning, the Programme Aspects of the Budget, the Monitoring of Implementation and the Methods of Evaluation;4",
    "3": "Stresses that setting the priorities of the United Nations is the prerogative of the Member States, as reflected in legislative mandates;",
    "4": "Also stresses the need for Member States to participate fully in the budget preparation process, from its early stages and throughout the process;",
    "5": "Endorses the conclusions and recommendations of the Committee for Programme and Coordination on proposed revisions to the Regulations and Rules Governing Programme Planning, the Programme Aspects of the Budget, the Monitoring of Implementation and the Methods of Evaluation (article VII and annex),5 on evaluation,6 on the annual overview report of the United Nations System Chief Executives Board for Coordination for 2016 7 and on the United Nations system support for the New Partnership for Africa\u2019s Development.8 55th plenary meeting 17 November 2017 __________________ 4 ST/SGB/2016/6. 5 See Official Records of the General Assembly, Seventy-second Session, Supplement No. 16 (A/72/16), chap. II, sect. A. 6 Ibid., chap. II, sect. B. 7 Ibid., chap. III, sect. A. 8 Ibid., chap. III, sect. B."
  },
  "agenda_items": [
    "Item 137"
  ],
  "symbol_references": []
}