{
  "symbol": "A/RES/74/307",
  "filename": "A_RES_74_307.pdf",
  "title": "74/307. United response against global health threats: combating COVID-19",
  "text": "United Nations \nA/RES/74/307\n \n \nGeneral Assembly \nDistr.: General \n15 September 2020 \n \n20-11864 (E)    160920     \n*2011864* \n \n \nSeventy-fourth session \nAgenda item 123 \nStrengthening of the United Nations system \n \n \n \n \n Resolution adopted by the General Assembly \non 11 September 2020 \n \n \n \n \n[without reference to a Main Committee (A/74/L.57 and A/74/L.57/Add.1)] \n \n \n 74/307. United response against global health threats: combating COVID-19 \n \n \n \nThe General Assembly,  \n \nExpressing grave concern and deep sadness at the global crisis triggered by the \nnovel disease COVID-19 pandemic and its unprecedented negative health, economic \nand social impacts on the international community,  \n \nAcknowledging that the unprecedented COVID-19 pandemic is a powerful \nreminder of our interconnectedness and vulnerabilities, as the virus respects no \nborders, and that combating this pandemic calls for an open, transparent, robust, \ncoordinated, large-scale, science-based and inclusive global response in the spirit of \nsolidarity,  \n \nNoting the importance of utilizing all available policy tools to safeguard the \nglobal economy, financial markets, trade and global supply chains in order to \nminimize the economic damage from the pandemic, restore global growth and \nmaintain market stability,  \n \nRecognizing the essential role of the United Nations as the body that can \neffectively bring together a global response to control and contain the spread of \nCOVID-19 and address the critical interlinkages between health, trade, finance and \neconomic and social development, and acknowledging that the disease will negatively \nimpact endeavours aimed at achieving the Sustainable Development Goals by 2030,  \n \nRecognizing also the great effort undertaken by people around the world to \nfollow the measures recommended by the World Health Organization and national \nauthorities in order to control and fight the spread of the pandemic,  \n \nExpressing deep concern about the serious risks posed to all countries, in \nparticular developing and least developed countries, and notably African countries \nand small island developing States, where health systems and economies may be less \n\nA/RES/74/307 \nUnited response against global health \nthreats: combating COVID-19\n \n20-11864\n2/3 \n \nable to cope with the challenge, as well as the particular risk faced by refugees and \ndisplaced persons,  \n \nCommending the United Nations for its recommitment to the timely \nimplementation of the 2030 Agenda for Sustainable Development 1 and its \ndetermination to lead a recovery that is inclusive and sustainable,  \n \nEmphasizing the urgent need for initiatives, on a voluntary basis, that focus on \npreventing threats from emerging pandemics and on building an effective global \ndefence against outbreaks of deadly infectious diseases should such threats emerge,  \n \nWelcoming the initiative taken by the Secretary-General, noting the initiatives \nby the International Monetary Fund and the World Bank Group, and acknowledging \nthe role of the World Health Organization, \n \nRecalling the high-level meeting on universal health coverage, held in New York \non 23 September 2019, and reaffirming its political declaration, entitled \u201cUniversal \nhealth coverage: moving together to build a healthier world\u201d 2 as a means of \nstrengthening health systems, and recalling also its resolution 74/270 of 2 April 2020, \nentitled \u201cGlobal solidarity to fight the coronavirus disease 2019 (COVID-19)\u201d,  \n \nExpressing profound gratitude to all front-line health-care workers as the fight \nagainst the pandemic continues, and emphasizing the importance of providing them \nwith the necessary protection and support, \n \nWelcoming the outcomes of the virtual Extraordinary Summit of the Group \nof 20, chaired by the Kingdom of Saudi Arabia, President of the Group for 2020, on \n26 March 2020, and the call therein for effective and coordinated action to fight this \nglobal health crisis,  \n \n1. \nCalls for intensified international cooperation and multilateral efforts in \nhandling disease outbreaks, including by sharing timely, accurate and transparent \ninformation, exchanging epidemiological and clinical data, sharing materials \nnecessary for research and development, and implementing the International Health \nRegulations (IHR 2005)3 and relevant guidance;  \n \n2. \nEmphasizes the need for the United Nations system, as well as relevant \nregional and international organizations and financial institutions, to collaborate in \norder to ensure that the adverse social, economic, humanitarian and financial impacts \nof COVID-19 are addressed in a timely and non-discriminatory manner;  \n \n3. \nAlso emphasizes the need for full respect for human rights, and stresses \nfurther that there is no place for any form of discrimination, racism and xenophobia \nin the response to the pandemic;  \n \n4. \nStresses the necessity of urgent short-term actions to step up the global \nefforts to fight global health crises and pandemics and maintain economic stability, \nincluding by taking the following steps:  \n \n(a) \nSwift delivery of medical supplies, especially diagnostic tools, treatments, \nmedicines and vaccines;  \n \n(b) \nIncreasing research and development funding for vaccines and medicines, \nleveraging digital technologies and strengthening scientific international cooperation;  \n__________________ \n \n1  Resolution 70/1. \n \n2  Resolution 74/2. \n \n3  World Health Organization, document WHA58/2005/REC/1, resolution 58.3, annex. \n\nUnited response against global health  \nthreats: combating COVID-19 \nA/RES/74/307\n \n3/3\n20-11864 \n \n \n(c) \nExpanding manufacturing capacity to meet the increasing needs for \nmedical supplies and ensuring that these are made widely available, at an affordable \nprice, on an equitable basis, where they are most needed and as quickly as possible;  \n \n(d) \nEngaging with the front-line international organizations, notably the \nUnited Nations, the World Health Organization, the International Monetary Fund, the \nWorld Bank Group and multilateral and regional development banks, to deploy \nrobust, coherent, coordinated and rapid financial packages to strengthen global \nfinancial safety nets;  \n \n5. \nReaffirms the necessity to support economies, protect workers, businesses, \nespecially micro-, small and medium-sized enterprises, and the sectors most affected, \nand shield the vulnerable through adequate social protection, and in this context \nwelcomes the statement by the leaders of the Group of 20 on injecting 5 trillion United \nStates dollars into the global economy, as part of targeted fiscal policy, economic \nmeasures and guarantee schemes to counteract the social, economic and financial \nimpacts of the pandemic;  \n \n6. \nCalls upon the international community, regional and international \norganizations and relevant stakeholders to give high priority to people, particularly \nthe elderly, women and girls, displaced persons and refugees and persons with \ndisabilities, and areas that are most vulnerable, particularly developing and least \ndeveloped countries, in order to mitigate any drawback towards achieving the \nSustainable Development Goals, and highlights the need to address risks of debt \nvulnerabilities in developing countries, including least developed countries, \nlandlocked developing countries, small island developing States and African \ncountries, as well as middle-income countries, due to the pandemic; \n \n7. \nCalls upon Member States to enhance coordination on public health and \nfinancial measures as well as cooperation at the national, regional and international \nlevels to confront and combat this pandemic;  \n \n8. \nStresses the need to give appropriate consideration to the issue of halting \nand reversing the global threats posed by epidemics through the implementation of \nthe 2030 Agenda for Sustainable Development;1  \n \n9. \nUrges Member States, in conjunction with the United Nations, the World \nHealth Organization, the International Monetary Fund, the World Bank Group and \nother regional and international organizations, working within their existing \nmandates, to embark on sustainable pandemic preparedness, response and recovery \nplanning, taking into account strengthening the capacity of health sector institutions \nin developing countries;  \n \n10. Requests the Secretary-General to mobilize the United Nations system in \nsupport of global action towards sustainable recovery, including through the work of \nthe United Nations resident coordinators and United Nations country teams, \nespecially in the most vulnerable countries;  \n \n11. \nDecides to remain seized of the matter, and requests the Secretary-General \nto coordinate and follow up on the various relevant initiatives and to report to the \nGeneral Assembly on the implementation of the present resolution in a timely manner. \n \n64th plenary meeting \n11 September 2020 \n \n",
  "paragraphs": {
    "1": "Calls for intensified international cooperation and multilateral efforts in handling disease outbreaks, including by sharing timely, accurate and transparent information, exchanging epidemiological and clinical data, sharing materials necessary for research and development, and implementing the International Health Regulations (IHR 2005)3 and relevant guidance;",
    "2": "Emphasizes the need for the United Nations system, as well as relevant regional and international organizations and financial institutions, to collaborate in order to ensure that the adverse social, economic, humanitarian and financial impacts of COVID-19 are addressed in a timely and non-discriminatory manner;",
    "3": "Also emphasizes the need for full respect for human rights, and stresses further that there is no place for any form of discrimination, racism and xenophobia in the response to the pandemic;",
    "4": "Stresses the necessity of urgent short-term actions to step up the global efforts to fight global health crises and pandemics and maintain economic stability, including by taking the following steps: (a) Swift delivery of medical supplies, especially diagnostic tools, treatments, medicines and vaccines; (b) Increasing research and development funding for vaccines and medicines, leveraging digital technologies and strengthening scientific international cooperation; (c) Expanding manufacturing capacity to meet the increasing needs for medical supplies and ensuring that these are made widely available, at an affordable price, on an equitable basis, where they are most needed and as quickly as possible; (d) Engaging with the front-line international organizations, notably the United Nations, the World Health Organization, the International Monetary Fund, the World Bank Group and multilateral and regional development banks, to deploy robust, coherent, coordinated and rapid financial packages to strengthen global financial safety nets;",
    "5": "Reaffirms the necessity to support economies, protect workers, businesses, especially micro-, small and medium-sized enterprises, and the sectors most affected, and shield the vulnerable through adequate social protection, and in this context welcomes the statement by the leaders of the Group of 20 on injecting 5 trillion United States dollars into the global economy, as part of targeted fiscal policy, economic measures and guarantee schemes to counteract the social, economic and financial impacts of the pandemic;",
    "6": "Calls upon the international community, regional and international organizations and relevant stakeholders to give high priority to people, particularly the elderly, women and girls, displaced persons and refugees and persons with disabilities, and areas that are most vulnerable, particularly developing and least developed countries, in order to mitigate any drawback towards achieving the Sustainable Development Goals, and highlights the need to address risks of debt vulnerabilities in developing countries, including least developed countries, landlocked developing countries, small island developing States and African countries, as well as middle-income countries, due to the pandemic;",
    "7": "Calls upon Member States to enhance coordination on public health and financial measures as well as cooperation at the national, regional and international levels to confront and combat this pandemic;",
    "8": "Stresses the need to give appropriate consideration to the issue of halting and reversing the global threats posed by epidemics through the implementation of the 2030 Agenda for Sustainable Development;1",
    "9": "Urges Member States, in conjunction with the United Nations, the World Health Organization, the International Monetary Fund, the World Bank Group and other regional and international organizations, working within their existing mandates, to embark on sustainable pandemic preparedness, response and recovery planning, taking into account strengthening the capacity of health sector institutions in developing countries;",
    "10": "Requests the Secretary-General to mobilize the United Nations system in support of global action towards sustainable recovery, including through the work of the United Nations resident coordinators and United Nations country teams, especially in the most vulnerable countries;",
    "11": "Decides to remain seized of the matter, and requests the Secretary-General to coordinate and follow up on the various relevant initiatives and to report to the General Assembly on the implementation of the present resolution in a timely manner."
  },
  "agenda_items": [
    "Item 123"
  ],
  "symbol_references": [
    "A/74/L.57"
  ]
}