{
  "symbol": "A/RES/76/68",
  "filename": "A_RES_76_68.pdf",
  "title": "76/68. Follow-up to the Declaration and Programme of Action on a Culture of Peace",
  "text": "United Nations \nA/RES/76/68\n \n \nGeneral Assembly \nDistr.: General \n16 December 2021 \n \n21-18572 (E)    221221 \n*2118572* \n \n \nSeventy-sixth session \nAgenda item 16 \nCulture of peace \n \n \n \n \n Resolution adopted by the General Assembly on \n9 December 2021 \n \n \n \n \n[without reference to a Main Committee (A/76/L.19 and A/76/L.19/Add.1)] \n \n \n \n76/68. Follow-up to the Declaration and Programme of Action on a \nCulture of Peace \n \n \n \nThe General Assembly, \n \nBearing in mind the Charter of the United Nations, including the purposes and \nprinciples contained therein, and especially the dedication to saving succeeding \ngenerations from the scourge of war, \n \nRecalling the Constitution of the United Nations Educational, Scientific and \nCultural Organization, which states that, \u201csince wars begin in the minds of men, it is \nin the minds of men that the defences of peace must be constructed\u201d, \n \nRecognizing the importance of the Declaration and Programme of Action on a \nCulture of Peace, adopted by the General Assembly on 13 September 1999, 1 which \nserve as the universal mandate for the international community, particularly the \nUnited Nations system, for the promotion of a culture of peace and non-violence that \nbenefits humanity, in particular future generations, \n \nRecalling its previous resolutions on a culture of peace, in particular resolution \n52/15 of 20 November 1997 proclaiming 2000 the International Year for the Culture \nof Peace, resolution 53/25 of 10 November 1998 proclaiming the period 2001\u20132010 \nthe International Decade for a Culture of Peace and Non-Violence for the Children of \nthe World, and resolutions 56/5 of 5 November 2001, 57/6 of 4 November 2002, 58/11 \nof 10 November 2003, 59/143 of 15 December 2004, 60/3 of 20 October 2005, 61/45 \nof 4 December 2006, 62/89 of 17 December 2007, 63/113 of 5 December 2008, 64/80 \nof 7 December 2009, 65/11 of 23 November 2010, 66/116 of 12 December 2011, \n67/106 of 17 December 2012, 68/125 of 18 December 2013, 69/139 of 15 December \n2014, 70/20 of 3 December 2015, 71/252 of 23 December 2016, 72/137 of \n__________________ \n \n1 Resolutions 53/243 A and B. \n\nA/RES/76/68 \nFollow-up to the Declaration and Programme \nof Action on a Culture of Peace\n \n21-18572\n2/6 \n \n11 December 2017, 73/126 of 12 December 2018, 74/21 of 12 December 2019 and \n75/25 of 2 December 2020 adopted under its agenda item entitled \u201cCulture of peace\u201d, \n \nRecalling also the United Nations Millennium Declaration,2 which calls for the \nactive promotion of a culture of peace, \n \nReaffirming its resolution 70/1 of 25 September 2015, entitled \u201cTransforming \nour world: the 2030 Agenda for Sustainable Development\u201d, \n \nRecalling its resolutions 75/201 of 21 December 2020 and 70/262 of 27 April \n2016 on the review of the United Nations peacebuilding architecture and 72/276 of \n26 April 2018 on the follow-up to the report of the Secretary-General on \npeacebuilding and sustaining peace, \n \nRecalling also its resolutions 72/241 of 20 December 2017 on a world against \nviolence and violent extremism, 75/291 of 30 June 2021 on the seventh review of the \nUnited Nations Global Counter-Terrorism Strategy and 70/254 of 12 February 2016 \non the Secretary-General\u2019s Plan of Action to Prevent Violent Extremism, and recalling \nfurther the establishment of the Office of Counter-Terrorism under resolution 71/291 \nof 15 June 2017, \n \nRecalling further its resolution 75/309 of 21 July 2021 on promoting \ninterreligious and intercultural dialogue and tolerance in countering hate speech, \n \nRecalling the 2005 World Summit Outcome adopted at the high-level plenary \nmeeting of the General Assembly,3 \n \nWelcoming the observance of 10 December as Human Rights Day,4 9 December \nas the International Day of Commemoration and Dignity of the Victims of the Crime \nof Genocide and of the Prevention of This Crime,5 2 October as the International Day \nof Non-Violence,6 18 June as the International Day for Countering Hate Speech,7 \n16 May as the International Day of Living Together in Peace, 8 21 August as the \nInternational Day of Remembrance of and Tribute to the Victims of Terrorism, 9 \n4 February as the International Day of Human Fraternity 10 and 22 August as the \nInternational Day Commemorating the Victims of Acts of Violence Based on Religion \nor Belief,11 as proclaimed by the United Nations, \n \nRecognizing that all efforts made by the United Nations system in general and \nthe international community at large for the prevention of conflicts, the peaceful \nsettlement of disputes, peacekeeping, peacebuilding, mediation, disarmament, \nsustainable development, the promotion of human dignity and human rights, social \ninclusion, democracy, the rule of law, good governance and gender equality at the \nnational and international levels contribute greatly to a culture of peace, \n \nTaking note of the United Nations Strategy and Plan of Action on Hate Speech, \nin which it is proposed that the United Nations system establish and strengthen \npartnerships with new and traditional media to promote the values of tolerance, \nnon-discrimination, pluralism and freedom of opinion and expression, and to address \nhate speech narratives, \n__________________ \n \n2 Resolution 55/2. \n \n3 Resolution 60/1. \n \n4 Resolution 423 (V). \n \n5 Resolution 69/323. \n \n6 Resolution 61/271. \n \n7 Resolution 75/309. \n \n8 Resolution 72/130. \n \n9 Resolution 72/165. \n \n10 Resolution 75/200. \n \n11 Resolution 73/296. \n\nFollow-up to the Declaration and Programme \nof Action on a Culture of Peace \nA/RES/76/68\n \n3/6\n21-18572 \n \n \nRecognizing that efforts towards peacebuilding and sustaining peace need to \ntake into account the promotion of a culture of peace and vice versa, \n \nRecognizing also the importance of respect and understanding for religious and \ncultural diversity throughout the world, of choosing dialogue and negotiations over \nconfrontation and of working together and not against each other, \n \nTaking note of the report of the Secretary-General, 12  which provides an \noverview of the activities that have been carried out by the main United Nations \nentities working in the areas of a culture of peace as well as interreligious and \nintercultural dialogue, understanding and cooperation for peace since the adoption by \nthe General Assembly of its resolutions 75/25 and 75/26 of 2 December 2020, \n \nRecalling the proclamation by the United Nations Educational, Scientific and \nCultural Organization of 21 February as International Mother Language Day, which \naims at protecting, promoting and preserving linguistic and cultural diversity and \nmultilingualism, in order to foster and enrich a culture of peace, social harmony, \ncross-cultural dialogue and mutual understanding, \n \nRecalling also the proclamation by the United Nations Educational, Scientific \nand Cultural Organization of 30 April as International Jazz Day, which aims to \ndevelop and increase intercultural exchanges and understanding between cultures for \nthe purpose of mutual comprehension, tolerance and the promotion of a culture of \npeace, \n \nWelcoming the efforts of the international community to enhance understanding \nthrough constructive dialogue among civilizations, in particular through various \ninitiatives at the local, national, regional and international levels, \n \nExpressing its appreciation for the ongoing efforts of the United Nations \nAlliance of Civilizations in promoting a culture of peace through a number of \npractical projects in the areas of youth, education, media and migrations, in \ncollaboration with Governments, international organizations, foundations and civil \nsociety groups, as well as media and the private sector, \n \nRecalling the eighth United Nations Alliance of Civilizations Forum, held at \nUnited Nations Headquarters on 19 and 20 November 2018 under the theme \n\u201c#Commit2Dialogue: partnerships for prevention and sustaining peace\u201d, \n \nRecalling also the meeting of the Group of Friends of the United Nations \nAlliance of Civilizations, held at United Nations Headquarters on 29 September 2020 \nat the level of Ministers for Foreign Affairs and heads of international organizations, \non the theme \u201cShaping a better world: building cohesive and inclusive societies in a \nchallenging COVID-19 environment\u201d, \n \nRecalling further the successful holding on 13 September 2019 of the General \nAssembly High-level Forum on the Culture of Peace, on the twentieth anniversary of \nthe adoption of the Declaration and Programme of Action, convened by the President \nof the Assembly, at which Member States emphasized a wide-ranging partnership and \ninclusive collaboration among Member States, international organizations and civil \nsociety for the implementation of the Declaration and Programme of Action, and \nrecalling with appreciation the Chair\u2019s summary of the meeting on the theme \u201cThe \nCulture of Peace: empowering and transforming humanity\u201d, \n \nWelcoming the successful holding on 7 September 2021 of the General \nAssembly High-level Forum on the Culture of Peace, convened by the President of \nthe Assembly, at which Member States and observers of the General Assembly and \nother stakeholders renewed their commitments to the full and effective \n__________________ \n \n12 A/76/357. \n\nA/RES/76/68 \nFollow-up to the Declaration and Programme \nof Action on a Culture of Peace\n \n21-18572\n4/6 \n \nimplementation of the Declaration and Programme of Action, with particular \nemphasis on tackling the multidimensional impacts of the ongoing coronavirus \ndisease (COVID-19) pandemic, and towards a resilient and inclusive recovery, and \ntaking note with appreciation of the Chair\u2019s summary of the meeting and panel \ndiscussion on the theme \u201cTransformative role of the Culture of Peace: promoting \nresilience and inclusion in post-COVID recovery,\u201d with the active participation of \ncivil society, in particular substantive support from the Global Movement for the \nCulture of Peace, \n \nNoting with appreciation that the Declaration and Programme of Action on a \nCulture of Peace continues to find relevance across the three pillars of the United \nNations, which are interconnected and mutually reinforcing, in addressing \ncontemporary global challenges, \n \nRecalling the high-level plenary meeting of the General Assembly, known as the \nNelson Mandela Peace Summit, convened by the President of the Assembly on \n24 September 2018, and the adoption of its political declaration, 13 \n \nRecognizing the role of women and youth, as well as the contribution of children \nand older persons in advancing a culture of peace, and in particular the importance of \ngreater involvement of women in the prevention and resolution of conflicts and in \nactivities promoting a culture of peace, including in post-conflict situations, \n \nNoting the important and positive contribution of youth in efforts to counter \nterrorism and prevent violent extremism as and when conducive to terrorism, as well \nas for the promotion of peace and security, \n \nWelcoming the adoption by the General Conference of the United Nations \nEducational, Scientific and Cultural Organization at its thirty-sixth session of a \nprogramme of action for a culture of peace and non-violence, and noting that the \nobjectives of that programme of action are in line with the Declaration and \nProgramme of Action on a Culture of Peace adopted by the General Assembly, \n \nRecognizing the activities of the United Nations Educational, Scientific and \nCultural Organization related to the culture of peace and non-violence and their focus \non concrete actions at the global, regional and subregional levels, and noting its \nsupport for the Member States, upon their request, in promoting the culture of peace \nat the national level, \n \nNoting with deep concern that the COVID-19 pandemic is one of the greatest \nglobal challenges in the history of the United Nations, which has led to a rise in hate \nspeech, stigmatization, racism and xenophobia, exacerbated pre-existing inequalities \nin income, opportunities, access to information and communications technologies, \nhealth coverage and social protection, deepened gender inequality, and created new \nchallenges with regard to access to health-care services and vaccines, \n \nNoting the initiatives of civil society, in collaboration with Governments, to \nstrengthen civilian capacities to enhance the physical safety of vulnerable populations \nunder threat of violence and to promote the peaceful settlement of disputes, \n \nEncouraging the continued and increasing efforts and activities on the part of \ncivil society organizations throughout the world in advancing a culture of peace as \nenvisaged in the Declaration and Programme of Action, \n \n1. \nReiterates that the objective of the effective implementation of the \nProgramme of Action on a Culture of Peace is to strengthen further the global \nmovement for a culture of peace following the observance of the International Decade \n__________________ \n \n13 Resolution 73/1. \n\nFollow-up to the Declaration and Programme \nof Action on a Culture of Peace \nA/RES/76/68\n \n5/6\n21-18572 \n \nfor a Culture of Peace and Non-Violence for the Children of the World, 2001\u20132010, \nand calls upon all concerned to renew their attention to this objective; \n \n2. \nWelcomes the inclusion of the promotion of a culture of peace in the 2030 \nAgenda for Sustainable Development;14 \n \n3. \nInvites Member States to continue to place greater emphasis on and expand \ntheir activities promoting a culture of peace at the national, regional and international \nlevels and to ensure that peace and non-violence are fostered at all levels; \n \n4. \nInvites the entities of the United Nations system, within their existing \nmandates, to integrate, as appropriate, the eight action areas of the Programme of \nAction into their programmes of activities, focusing on promoting a culture of peace \nand non-violence at the national, regional and international levels; \n \n5. \nCommends the United Nations Educational, Scientific and Cultural \nOrganization for strengthening efforts to mobilize all relevant stakeholders within and \noutside the United Nations system in support of a culture of peace, and invites the \nOrganization to continue to enhance communication and outreach, including through \nthe culture of peace website; \n \n6. \nCommends the practical initiatives and actions by relevant United Nations \nbodies, including the United Nations Children\u2019s Fund, the United Nations Entity for \nGender Equality and the Empowerment of Women (UN-Women) and the University \nfor Peace, as well as their activities in further promoting a culture of peace and \nnon-violence, in particular the promotion of peace education and activities related to \nspecific areas identified in the Programme of Action, and encourages them to continue \nand further strengthen and expand their efforts; \n \n7. \nUnderlines that early childhood development contributes to the \ndevelopment of more peaceful societies through advancing equality, tolerance, human \ndevelopment and promoting human rights, and calls for investment in early childhood \neducation, including through effective policies and practices, towards promoting a \nculture of peace; \n \n8. \nEncourages Member States, United Nations entities, regional and \nsubregional organizations and relevant actors to consider instituting mechanisms to \ninvolve youth in the promotion of a culture of peace, tolerance and intercultural and \ninterreligious dialogue and develop, as appropriate, an understanding of respect for \nhuman dignity, pluralism and diversity, including, as appropriate, through education \nprogrammes, that could discourage their participation in acts of terrorism, violent \nextremism as and when conducive to terrorism, violence, xenophobia and all forms \nof discrimination; \n \n9. \nEncourages the United Nations Alliance of Civilizations to increase its \nactivities that focus on peace education and global citizenship education in order to \nenhance an understanding among young people of values such as peace, tolerance, \nopenness, inclusion and mutual respect, which are essential in developing a culture \nof peace; \n \n10. Encourages the United Nations peacebuilding architecture to continue to \npromote peacebuilding and sustaining peace activities, as outlined in its resolutions \n72/276 and 75/201, and to advance a culture of peace and non-violence in post-\nconflict peacebuilding efforts at the country level; \n \n11. \nEmphasizes the critical importance of an inclusive, resilient and \nsustainable recovery from the COVID-19 pandemic, and in this regard calls upon \n__________________ \n \n14 Resolution 70/1. \n\nA/RES/76/68 \nFollow-up to the Declaration and Programme \nof Action on a Culture of Peace\n \n21-18572\n6/6 \n \nStates to promote the values of culture of peace, inter alia, in countering rising \ninequalities, discrimination, exclusion, hate crimes and violence; \n \n12. Urges the appropriate authorities to provide age-appropriate education in \nchildren\u2019s schools that builds a culture of peace and non-violence, including lessons \nin mutual understanding, respect, tolerance, active and global citizenship and human \nrights; \n \n13. Encourages the involvement of media, especially the mass media, in \npromoting a culture of peace and non-violence, with particular regard to children and \nyoung people; \n \n14. Commends civil society, non-governmental organizations and young \npeople for their activities in further promoting a culture of peace and non-violence, \nincluding through their campaign to raise awareness on a culture of peace and the \npeaceful settlement of disputes; \n \n15. Encourages civil society and non-governmental organizations to further \nstrengthen their efforts to promote a culture of peace, inter alia, by adopting their own \nprogramme of activities to complement the initiatives of Member States, the United \nNations system and other international and regional organizations, in line with the \nDeclaration and Programme of Action; \n \n16. Invites Member States, all entities of the United Nations system and civil \nsociety organizations to accord increasing attention to their observance of the \nInternational Day of Peace on 21 September each year as a day of global ceasefire \nand non-violence, in accordance with its resolution 55/282 of 7 September 2001, and \nof the International Day of Non-Violence on 2 October, in accordance with its \nresolution 61/271 of 15 June 2007; \n \n17. Reiterates its request to the President of the General Assembly to consider \nconvening a high-level forum, as appropriate and within existing resources, devoted \nto the implementation of the Programme of Action on the occasion of the anniversary \nof its adoption, on or around 13 September, and requests the Secretariat to provide \nrequired logistical support for its effective organization within their respective \nmandates and existing resources; \n \n18. Invites the Secretary-General, within existing resources, in consultation \nwith the Member States and taking into account the observations of civil society \norganizations, to explore mechanisms and strategies, in particular strategies in the \nsphere of information and communications technology, for the implementation of the \nDeclaration and Programme of Action and to initiate outreach efforts to increase \nglobal awareness of the Programme of Action and its eight areas of action aimed at \ntheir implementation, including through public information activities by the \nDepartment of Global Communications of the Secretariat; \n \n19. Requests the Secretary-General to submit to the General Assembly at its \nseventy-seventh session a report, within existing resources, on actions taken by \nMember States, on the basis of information provided by them, and those taken system-\nwide by all concerned entities of the United Nations to implement the present \nresolution and on heightened activities by the Organization and its affiliated agencies \nto implement the Programme of Action and to promote a culture of peace and \nnon-violence; \n \n20. Decides to include in the provisional agenda of its seventy-seventh session \nthe item entitled \u201cCulture of peace\u201d. \n \n48th plenary meeting \n9 December 2021 \n",
  "paragraphs": {
    "1": "Reiterates that the objective of the effective implementation of the Programme of Action on a Culture of Peace is to strengthen further the global movement for a culture of peace following the observance of the International Decade __________________ 13 Resolution 73/1. Follow-up to the Declaration and Programme of Action on a Culture of Peace A/RES/76/68 5/6 21-18572 for a Culture of Peace and Non-Violence for the Children of the World, 2001\u20132010, and calls upon all concerned to renew their attention to this objective;",
    "2": "Welcomes the inclusion of the promotion of a culture of peace in the 2030 Agenda for Sustainable Development;14",
    "3": "Invites Member States to continue to place greater emphasis on and expand their activities promoting a culture of peace at the national, regional and international levels and to ensure that peace and non-violence are fostered at all levels;",
    "4": "Invites the entities of the United Nations system, within their existing mandates, to integrate, as appropriate, the eight action areas of the Programme of Action into their programmes of activities, focusing on promoting a culture of peace and non-violence at the national, regional and international levels;",
    "5": "Commends the United Nations Educational, Scientific and Cultural Organization for strengthening efforts to mobilize all relevant stakeholders within and outside the United Nations system in support of a culture of peace, and invites the Organization to continue to enhance communication and outreach, including through the culture of peace website;",
    "6": "Commends the practical initiatives and actions by relevant United Nations bodies, including the United Nations Children\u2019s Fund, the United Nations Entity for Gender Equality and the Empowerment of Women (UN-Women) and the University for Peace, as well as their activities in further promoting a culture of peace and non-violence, in particular the promotion of peace education and activities related to specific areas identified in the Programme of Action, and encourages them to continue and further strengthen and expand their efforts;",
    "7": "Underlines that early childhood development contributes to the development of more peaceful societies through advancing equality, tolerance, human development and promoting human rights, and calls for investment in early childhood education, including through effective policies and practices, towards promoting a culture of peace;",
    "8": "Encourages Member States, United Nations entities, regional and subregional organizations and relevant actors to consider instituting mechanisms to involve youth in the promotion of a culture of peace, tolerance and intercultural and interreligious dialogue and develop, as appropriate, an understanding of respect for human dignity, pluralism and diversity, including, as appropriate, through education programmes, that could discourage their participation in acts of terrorism, violent extremism as and when conducive to terrorism, violence, xenophobia and all forms of discrimination;",
    "9": "Encourages the United Nations Alliance of Civilizations to increase its activities that focus on peace education and global citizenship education in order to enhance an understanding among young people of values such as peace, tolerance, openness, inclusion and mutual respect, which are essential in developing a culture of peace;",
    "10": "Encourages the United Nations peacebuilding architecture to continue to promote peacebuilding and sustaining peace activities, as outlined in its resolutions 72/276 and 75/201, and to advance a culture of peace and non-violence in post- conflict peacebuilding efforts at the country level;",
    "11": "Emphasizes the critical importance of an inclusive, resilient and sustainable recovery from the COVID-19 pandemic, and in this regard calls upon __________________ 14 Resolution 70/1. A/RES/76/68 Follow-up to the Declaration and Programme of Action on a Culture of Peace 21-18572 6/6 States to promote the values of culture of peace, inter alia, in countering rising inequalities, discrimination, exclusion, hate crimes and violence;",
    "12": "Urges the appropriate authorities to provide age-appropriate education in children\u2019s schools that builds a culture of peace and non-violence, including lessons in mutual understanding, respect, tolerance, active and global citizenship and human rights;",
    "13": "Encourages the involvement of media, especially the mass media, in promoting a culture of peace and non-violence, with particular regard to children and young people;",
    "14": "Commends civil society, non-governmental organizations and young people for their activities in further promoting a culture of peace and non-violence, including through their campaign to raise awareness on a culture of peace and the peaceful settlement of disputes;",
    "15": "Encourages civil society and non-governmental organizations to further strengthen their efforts to promote a culture of peace, inter alia, by adopting their own programme of activities to complement the initiatives of Member States, the United Nations system and other international and regional organizations, in line with the Declaration and Programme of Action;",
    "16": "Invites Member States, all entities of the United Nations system and civil society organizations to accord increasing attention to their observance of the International Day of Peace on 21 September each year as a day of global ceasefire and non-violence, in accordance with its resolution 55/282 of 7 September 2001, and of the International Day of Non-Violence on 2 October, in accordance with its resolution 61/271 of 15 June 2007;",
    "17": "Reiterates its request to the President of the General Assembly to consider convening a high-level forum, as appropriate and within existing resources, devoted to the implementation of the Programme of Action on the occasion of the anniversary of its adoption, on or around 13 September, and requests the Secretariat to provide required logistical support for its effective organization within their respective mandates and existing resources;",
    "18": "Invites the Secretary-General, within existing resources, in consultation with the Member States and taking into account the observations of civil society organizations, to explore mechanisms and strategies, in particular strategies in the sphere of information and communications technology, for the implementation of the Declaration and Programme of Action and to initiate outreach efforts to increase global awareness of the Programme of Action and its eight areas of action aimed at their implementation, including through public information activities by the Department of Global Communications of the Secretariat;",
    "19": "Requests the Secretary-General to submit to the General Assembly at its seventy-seventh session a report, within existing resources, on actions taken by Member States, on the basis of information provided by them, and those taken system- wide by all concerned entities of the United Nations to implement the present resolution and on heightened activities by the Organization and its affiliated agencies to implement the Programme of Action and to promote a culture of peace and non-violence;",
    "20": "Decides to include in the provisional agenda of its seventy-seventh session the item entitled \u201cCulture of peace\u201d. 48th plenary meeting 9 December 2021"
  },
  "agenda_items": [
    "Item 16"
  ],
  "symbol_references": [
    "A/76/L.19"
  ]
}