{
  "symbol": "A/RES/75/199",
  "filename": "A_RES_75_199.pdf",
  "title": "75/199. Education for democracy",
  "text": "United Nations \nA/RES/75/199\n \n \nGeneral Assembly \nDistr.: General \n28 December 2020 \n \n20-17538 (E)    040121     \n*2017538* \n \n \nSeventy-fifth session \nAgenda item 14 \nIntegrated and coordinated implementation of and \nfollow-up to the outcomes of the major United Nations \nconferences and summits in the economic, social and \nrelated fields \n \n \n \n \n Resolution adopted by the General Assembly \non 21 December 2020 \n \n \n \n \n[without reference to a Main Committee (A/75/L.46/Rev.1  \nand A/75/L.46/Rev.1/Add.1)] \n \n \n 75/199. Education for democracy \n \n \n \nThe General Assembly,  \n \nReaffirming the Charter of the United Nations, including the principles and \npurposes contained therein, and recognizing that human rights, the rule of law and \ndemocracy are interlinked and mutually reinforcing and that they belong to the \nuniversal and indivisible core values and principles of the United Nations,  \n \nReaffirming also the right of everyone to education, which is enshrined in the \nUniversal Declaration of Human Rights,1 the International Covenant on Economic, \nSocial and Cultural Rights,2 the Convention on the Rights of the Child,3 the \nConvention on the Elimination of All Forms of Discrimination against Women, 4 the \nConvention on the Rights of Persons with Disabilities5 and other relevant instruments,  \n \nRecalling its resolutions 67/18 of 28 November 2012, 69/268 of 5 March 2015, \n71/8 of 16 November 2016 and 73/134 of 13 December 2018 and the results of the \nplan of action for the third phase (2015\u20132019) of the World Programme for Human \nRights Education,6 recalling also Human Rights Council resolutions 39/3 of \n__________________ \n \n1  Resolution 217 A (III). \n \n2  See resolution 2200 A (XXI), annex. \n \n3  United Nations, Treaty Series, vol. 1577, No. 27531. \n \n4  Ibid., vol. 1249, No. 20378. \n \n5  Ibid., vol. 2515, No. 44910. \n \n6  See Official Records of the General Assembly, Sixty-ninth Session, Supplement No. 53A and \ncorrigenda (A/69/53/Add.1, A/69/53/Add.1/Corr.1 and A/69/53/Add.1/Corr.2), chap. IV, sect. A, \nresolution 27/12. \n\nA/RES/75/199 \nEducation for democracy\n \n20-17538\n2/4 \n \n27 September 20187 and 42/7 of 26 September 20198 on the World Programme for \nHuman Rights Education, and taking note with appreciation of the plan of action for \nthe fourth phase (2020\u20132024) of the World Programme,9 \n \nTaking note of section VII, entitled \u201cSupporting the global citizenship agenda \nthrough education for democracy\u201d, of resolution 1 adopted on 20 November 2013 by \nthe General Conference of the United Nations Educational, Scientific and Cultural \nOrganization at its thirty-seventh session,10 \n \nRecalling that the Sustainable Development Goals and targets, as set out in the \n2030 Agenda for Sustainable Development,11 are integrated and indivisible and \nbalance the three dimensions of sustainable development, and acknowledging the \nimportance of taking measures to ensure inclusive and equitable quality education and \npromoting lifelong learning opportunities for all, including expanded opportunities for \nall children, particularly girls, to access quality education, as well as the need to \npromote peaceful and inclusive societies for sustainable development, provide access \nto justice for all and build effective, accountable and inclusive institutions at all levels,  \n \nStressing the complementarity and mutual reinforcement of human rights \neducation, training and learning and education for democracy,  \n \nReaffirming that democracy is a universal value based on the freely expressed \nwill of people to determine their own political, economic, social and cultural systems \nand their full participation in all aspects of their lives,12 \n \nRecognizing that education for democracy nurtures responsible and active \nlearners, capable of contributing effectively to peace and prosperity in their societies \nand beyond, \n \nTaking note of the Incheon Declaration: Education 2030 \u2013 towards inclusive and \nequitable quality education and lifelong learning for all, adopted at the World \nEducation Forum 2015, held in Incheon, Republic of Korea, from 19 to 22 May \n2015,13 which affirmed the understanding of education as a main driver of \ndevelopment that is essential for peace, tolerance, human fulfilment and sustainable \ndevelopment, as well as key to achieving full employment and poverty eradication,  \n \nTaking note also of the Global Education Monitoring Reports, which monitor \nprogress towards the education targets within the Sustainable Development Goals \nframework, and affirming that education can encourage constructive and inclusive \npolitical participation,  \n \nRecognizing that, while democracies share common features, there is no single \nmodel of democracy and that democracy does not belong to any country or region,  \n \nMindful of the Vienna Declaration and Programme of Action of the World \nConference on Human Rights,14 the Beijing Declaration and Platform for Action \nadopted at the Fourth World Conference on Women,15 the World Plan of Action on \n__________________ \n \n7  Ibid., Seventy-third Session, Supplement No. 53A (A/73/53/Add.1), chap. III. \n \n8  Ibid., Seventy-fourth Session, Supplement No. 53A (A/74/53/Add.1), chap. III. \n \n9  A/HRC/42/23. \n \n10  See United Nations Educational, Scientific and Cultural Organization, Records of the General \nConference, Thirty-seventh Session, Paris, 5\u201320 November 2013, vol. 1 and corrigendum, \nResolutions, sect. IV. \n \n11  Resolution 70/1. \n \n12  Resolution 60/1, para. 135. \n \n13  See United Nations Educational, Scientific and Cultural Organization, Final Report of the World \nEducation Forum 2015, Incheon, Republic of Korea, 19\u201322 May 2015 (Paris, 2015). \n \n14  A/CONF.157/24 (Part I), chap. III. \n \n15  Report of the Fourth World Conference on Women, Beijing, 4\u201315 September 1995 (United \nNations publication, Sales No. E.96.IV.13), chap. I, resolution 1, annexes I and II. \n\nEducation for democracy \nA/RES/75/199\n \n3/4\n20-17538 \n \nEducation for Human Rights and Democracy adopted by the International Congress \non Education for Human Rights and Democracy,16 the World Programme for Human \nRights Education proclaimed by the General Assembly in its resolution 59/113 A of \n10 December 2004 and the United Nations Declaration on Human Rights Education \nand Training,17 \n \nRecalling the establishment of the United Nations Democracy Fund and the \nefforts of the Fund to advance the United Nations democracy agenda, as well as \nthe operational activities in support of democratization processes carried out by the \nUnited Nations system, including by the Department of Political and Peacebuilding \nAffairs of the Secretariat, the Office of the United Nations High Commissioner for \nHuman Rights and the United Nations Development Programme,  \n \nAcknowledging the important role of international, regional and other \nintergovernmental organizations, civil society, academia, the private sector and other \nstakeholders in support of democracy and education for democracy,  \n \nRecognizing that education contributes to the strengthening of democracy, good \ngovernance and the rule of law at all levels, the reduction of economic inequality, the \nrealization of human rights, gender equality and the empowerment of women and \ngirls, the achievement of all internationally agreed development goals, including the \nSustainable Development Goals, the development of human potential, the eradication \nof poverty and the fostering of greater understanding among peoples,  \n \n1. \nTakes note with appreciation of the report entitled \u201cLiteracy for life, work, \nlifelong learning and education for democracy\u201d, submitted by the Secretary-General \nin cooperation with the Director General of the United Nations Educational, Scientific \nand Cultural Organization;18 \n \n2. \nReaffirms the fundamental link between democratic governance, peace, \ndevelopment and the promotion and protection of all human rights and fundamental \nfreedoms, which are interdependent and mutually reinforcing;  \n \n3. \nRecalls the Global Education First initiative, launched by the Secretary-\nGeneral on 26 September 2012, in particular its third priority area on fostering global \ncitizenship;  \n \n4. \nAlso recalls the 2030 Agenda for Sustainable Development, in which \nMember States committed themselves to the Sustainable Development Goals and \ntargets, including to ensure that all learners acquire the knowledge and skills needed to \npromote sustainable development, including, among others, through education for \nsustainable development and sustainable lifestyles, human rights, gender equality, \npromotion of a culture of peace and non-violence, global citizenship and appreciation of \ncultural diversity and of culture\u2019s contribution to sustainable development, and further \nrecalls the importance of measuring progress towards the achievement of the Goals;  \n \n5. \nEncourages the Secretary-General, United Nations agencies such as the \nUnited Nations Educational, Scientific and Cultural Organization, the United Nations \nChildren\u2019s Fund, the United Nations Population Fund, the United Nations \nDevelopment Programme, the United Nations Office on Drugs and Crime, the United \nNations Entity for Gender Equality and the Empowerment of Women (UN-Women) \nand other relevant stakeholders to strengthen their efforts to promote the values of \npeace, human rights, democracy, respect for religious and cultural diversity, and \njustice and the rule of law through education;  \n__________________ \n \n16  A/CONF.157/PC/42/Add.6. \n \n17  Resolution 66/137, annex. \n \n18  A/75/188. \n\nA/RES/75/199 \nEducation for democracy\n \n20-17538\n4/4 \n \n \n6. \nStrongly encourages Member States and national, regional and local \neducation authorities, as appropriate, to integrate education for democracy, along with \ncivic education, human rights education and education for sustainable development \ninto their education standards and to develop and strengthen programmes, curricula \nand curricular and extracurricular educational activities aimed at the promotion and \nconsolidation of democratic values and democratic governance and human rights, \ntaking into account innovative approaches and best practices in the field, in order to \nfacilitate the empowerment of citizens and their participation in political life and \npolicymaking at all levels;  \n \n7. \nEncourages Member States and national, regional and local education \nauthorities, as appropriate, to further efforts to strengthen, through education, the \nconnections between democratic governance, peace, sustainable development and the \npromotion of human rights and fundamental freedoms; \n \n8. \nEncourages Member States to intensify their efforts towards educating and \nempowering young people, in particular to shape, in the aftermath of the coronavirus \ndisease (COVID-19), societies that are anchored in respect for human rights and the \nrule of law; \n \n9. \nAlso encourages Member States to further their efforts to develop and \nstrengthen educational policies and initiatives that contribute to combating \ndisinformation, misinformation, stigmatization, racism, xenophobia, hate speech, \ndiscrimination, exclusion and violence, in particular through accessible media and \ninformation literacy, to improve education for democracy in the emerging digital \nenvironment;  \n \n10. Invites United Nations agencies, funds and programmes, including the \nUnited Nations Democracy Fund, the United Nations Development Programme, the \nUnited Nations Children\u2019s Fund, the Office of the United Nations High Commissioner \nfor Human Rights and the United Nations Educational, Scientific and Cultural \nOrganization, to provide appropriate expertise and resources for the development of \nrelevant educational programmes and materials for democracy;  \n \n11. \nEncourages \ninternational, \nregional \nand \nother \nintergovernmental \norganizations, within their respective mandates, to share their best practices and \nexperiences in the field of education for democracy, including but not limited to civic \neducation, with each other and with the United Nations system, as appropriate;  \n \n12. Decides to continue its consideration of the issue of education for \ndemocracy at its seventy-seventh session, under the agenda item entitled \u201cIntegrated \nand coordinated implementation of and follow-up to the outcomes of the major United \nNations conferences and summits in the economic, social and related fields\u201d;  \n \n13. Invites Governments, the agencies and organizations of the United Nations \nsystem and intergovernmental and non-governmental organizations to intensify their \nefforts to promote education for democracy, requests the Secretary-General, in \ncooperation with the Director General of the United Nations Educational, Scientific \nand Cultural Organization, within existing reporting obligations, to report to the \nGeneral Assembly at its seventy-seventh session on the implementation of the present \nresolution, and invites the Special Rapporteur of the Human Rights Council on the \nright to education, within her existing mandate, to contribute to the report of the \nSecretary-General.  \n \n47th plenary meeting \n21 December 2020 \n \n",
  "paragraphs": {
    "1": "Takes note with appreciation of the report entitled \u201cLiteracy for life, work, lifelong learning and education for democracy\u201d, submitted by the Secretary-General in cooperation with the Director General of the United Nations Educational, Scientific and Cultural Organization;18",
    "2": "Reaffirms the fundamental link between democratic governance, peace, development and the promotion and protection of all human rights and fundamental freedoms, which are interdependent and mutually reinforcing;",
    "3": "Recalls the Global Education First initiative, launched by the Secretary- General on 26 September 2012, in particular its third priority area on fostering global citizenship;",
    "4": "Also recalls the 2030 Agenda for Sustainable Development, in which Member States committed themselves to the Sustainable Development Goals and targets, including to ensure that all learners acquire the knowledge and skills needed to promote sustainable development, including, among others, through education for sustainable development and sustainable lifestyles, human rights, gender equality, promotion of a culture of peace and non-violence, global citizenship and appreciation of cultural diversity and of culture\u2019s contribution to sustainable development, and further recalls the importance of measuring progress towards the achievement of the Goals;",
    "5": "Encourages the Secretary-General, United Nations agencies such as the United Nations Educational, Scientific and Cultural Organization, the United Nations Children\u2019s Fund, the United Nations Population Fund, the United Nations Development Programme, the United Nations Office on Drugs and Crime, the United Nations Entity for Gender Equality and the Empowerment of Women (UN-Women) and other relevant stakeholders to strengthen their efforts to promote the values of peace, human rights, democracy, respect for religious and cultural diversity, and justice and the rule of law through education; __________________ 16 A/CONF.157/PC/42/Add.6. 17 Resolution 66/137, annex. 18 A/75/188. A/RES/75/199 Education for democracy 20-17538 4/4",
    "6": "Strongly encourages Member States and national, regional and local education authorities, as appropriate, to integrate education for democracy, along with civic education, human rights education and education for sustainable development into their education standards and to develop and strengthen programmes, curricula and curricular and extracurricular educational activities aimed at the promotion and consolidation of democratic values and democratic governance and human rights, taking into account innovative approaches and best practices in the field, in order to facilitate the empowerment of citizens and their participation in political life and policymaking at all levels;",
    "7": "Encourages Member States and national, regional and local education authorities, as appropriate, to further efforts to strengthen, through education, the connections between democratic governance, peace, sustainable development and the promotion of human rights and fundamental freedoms;",
    "8": "Encourages Member States to intensify their efforts towards educating and empowering young people, in particular to shape, in the aftermath of the coronavirus disease (COVID-19), societies that are anchored in respect for human rights and the rule of law;",
    "9": "Also encourages Member States to further their efforts to develop and strengthen educational policies and initiatives that contribute to combating disinformation, misinformation, stigmatization, racism, xenophobia, hate speech, discrimination, exclusion and violence, in particular through accessible media and information literacy, to improve education for democracy in the emerging digital environment;",
    "10": "Invites United Nations agencies, funds and programmes, including the United Nations Democracy Fund, the United Nations Development Programme, the United Nations Children\u2019s Fund, the Office of the United Nations High Commissioner for Human Rights and the United Nations Educational, Scientific and Cultural Organization, to provide appropriate expertise and resources for the development of relevant educational programmes and materials for democracy;",
    "11": "Encourages international, regional and other intergovernmental organizations, within their respective mandates, to share their best practices and experiences in the field of education for democracy, including but not limited to civic education, with each other and with the United Nations system, as appropriate;",
    "12": "Decides to continue its consideration of the issue of education for democracy at its seventy-seventh session, under the agenda item entitled \u201cIntegrated and coordinated implementation of and follow-up to the outcomes of the major United Nations conferences and summits in the economic, social and related fields\u201d;",
    "13": "Invites Governments, the agencies and organizations of the United Nations system and intergovernmental and non-governmental organizations to intensify their efforts to promote education for democracy, requests the Secretary-General, in cooperation with the Director General of the United Nations Educational, Scientific and Cultural Organization, within existing reporting obligations, to report to the General Assembly at its seventy-seventh session on the implementation of the present resolution, and invites the Special Rapporteur of the Human Rights Council on the right to education, within her existing mandate, to contribute to the report of the Secretary-General. 47th plenary meeting 21 December 2020"
  },
  "agenda_items": [
    "Item 14"
  ],
  "symbol_references": [
    "A/75/L.46"
  ]
}