{
  "symbol": "A/RES/76/290",
  "filename": "A_RES_76_290.pdf",
  "title": "76/290. Financing of the United Nations Interim Force in Lebanon",
  "text": "United Nations \nA/RES/76/290\n \n \nGeneral Assembly \nDistr.: General \n7 July 2022 \n \n22-10350 (E)    070722     \n*2210350* \n \n \nSeventy-sixth session \nAgenda item 162 (b) \nFinancing of the United Nations peacekeeping forces in the \nMiddle East: United Nations Interim Force in Lebanon \n \n \n \nResolution adopted by the General Assembly \non 29 June 2022 \n \n \n[on the report of the Fifth Committee (A/76/885, para. 12)] \n \n \n 76/290. Financing of the United Nations Interim Force in Lebanon \n \n \n \nThe General Assembly, \n \nHaving considered the reports of the Secretary-General on the financing of the \nUnited Nations Interim Force in Lebanon1 and the related report of the Advisory \nCommittee on Administrative and Budgetary Questions,2 \n \nRecalling Security Council resolution 425 (1978) of 19 March 1978 regarding \nthe establishment of the United Nations Interim Force in Lebanon and the subsequent \nresolutions by which the Council extended the mandate of the Force, the latest of \nwhich was resolution 2591 (2021) of 30 August 2021, by which the Council extended \nthe mandate of the Force until 31 August 2022, \n \nRecalling also its resolution S-8/2 of 21 April 1978 on the financing of the Force \nand its subsequent resolutions thereon, the latest of which was resolution 75/250 B of \n30 June 2021, \n \nReaffirming its resolutions 51/233 of 13 June 1997, 52/237 of 26 June 1998, \n53/227 of 8 June 1999, 54/267 of 15 June 2000, 55/180 A of 19 December 2000, \n55/180 B of 14 June 2001, 56/214 A of 21 December 2001, 56/214 B of 27 June 2002, \n57/325 of 18 June 2003, 58/307 of 18 June 2004, 59/307 of 22 June 2005, 60/278 of \n30 June 2006, 61/250 A of 22 December 2006, 61/250 B of 2 April 2007, 61/250 C of \n29 June 2007, 62/265 of 20 June 2008, 63/298 of 30 June 2009, 64/282 of 24 June \n2010, 65/303 of 30 June 2011, 66/277 of 21 June 2012, 67/279 of 28 June 2013, \n68/292 of 30 June 2014, 69/302 of 25 June 2015, 70/280 of 15 July 2016, 71/307 of \n30 June 2017, 72/299 of 5 July 2018, 73/322 of 3 July 2019, 75/250 A of 31 December \n2020 and 75/250 B, \n__________________ \n \n1 A/76/562 and A/76/700. \n \n2 A/76/760/Add.1. \n\nA/RES/76/290 \nFinancing of the United Nations Interim Force in Lebanon\n \n22-10350\n2/4 \n \n \nReaffirming also the general principles underlying the financing of United \nNations peacekeeping operations, as stated in its resolutions 1874 (S-IV) of 27 June \n1963, 3101 (XXVIII) of 11 December 1973 and 55/235 of 23 December 2000, \n \nNoting with appreciation that voluntary contributions have been made to the \nForce, \n \nMindful of the fact that it is essential to provide the Force with the financial \nresources necessary to enable it to fulfil its responsibilities under the relevant \nresolutions of the Security Council, \n \n1. \nRequests the Secretary-General to entrust the Head of Mission with the \ntask of formulating future budget proposals in full accordance with the provisions of \nits resolutions 59/296 of 22 June 2005, 60/266 of 30 June 2006, 61/276 of 29 June \n2007, 64/269 of 24 June 2010, 65/289 of 30 June 2011, 66/264 of 21 June 2012, \n69/307 of 25 June 2015, 70/286 of 17 June 2016 and 76/274 of 29 June 2022, as well \nas other relevant resolutions; \n \n2. \nTakes note of the status of contributions to the United Nations Interim \nForce in Lebanon as at 30 April 2022, including the contributions outstanding in the \namount of 185.7 million United States dollars, representing some 1.7 per cent of the \ntotal assessed contributions, notes with concern that only 82 Member States have paid \ntheir assessed contributions in full, and urges all other Member States, in particular \nthose in arrears, to ensure payment of their outstanding assessed contributions; \n \n3. \nExpresses its appreciation to those Member States that have paid their \nassessed contributions in full, and urges all other Member States to make every \npossible effort to ensure payment of their assessed contributions to the Force in full; \n \n4. \nExpresses deep concern that Israel did not comply with resolutions 51/233, \n52/237, 53/227, 54/267, 55/180 A, 55/180 B, 56/214 A, 56/214 B, 57/325, 58/307, \n59/307, 60/278, 61/250 A, 61/250 B, 61/250 C, 62/265, 63/298, 64/282, 65/303, \n66/277, 67/279, 68/292, 69/302, 70/280, 71/307, 72/299, 73/322, 75/250 A and 75/250 B; \n \n5. \nStresses once again that Israel should strictly abide by resolutions 51/233, \n52/237, 53/227, 54/267, 55/180 A, 55/180 B, 56/214 A, 56/214 B, 57/325, 58/307, \n59/307, 60/278, 61/250 A, 61/250 B, 61/250 C, 62/265, 63/298, 64/282, 65/303, \n66/277, 67/279, 68/292, 69/302, 70/280, 71/307, 72/299, 73/322, 75/250 A and 75/250 B; \n \n6. \nExpresses concern at the financial situation with regard to peacekeeping \nactivities, in particular as regards the reimbursements to troop contributors that bear \nadditional burdens owing to overdue payments by Member States of their \nassessments; \n \n7. \nEmphasizes that all future and existing peacekeeping missions shall be \ngiven equal and non-discriminatory treatment in respect of financial and \nadministrative arrangements; \n \n8. \nAlso emphasizes that all peacekeeping missions shall be provided with \nadequate resources for the effective and efficient discharge of their respective \nmandates; \n \n9. \nRequests the Secretary-General to ensure that proposed peacekeeping \nbudgets are based on the relevant legislative mandates; \n \n10. Endorses the conclusions and recommendations contained in the report of \nthe Advisory Committee on Administrative and Budgetary Questions, subject to the \nprovisions of the present resolution, and requests the Secretary-General to ensure \ntheir full implementation; \n\nFinancing of the United Nations Interim Force in Lebanon \nA/RES/76/290\n \n3/4\n22-10350 \n \n \n11. Takes note of paragraph 21 of the report of the Advisory Committee, and \ndecides to approve the establishment of one post of Senior Coordination Officer (P-5) \nin the Office of the Principal Coordinator; \n \n12. Also takes note of paragraph 23 of the report of the Advisory Committee, \nand approves the establishment of one temporary position of Programme Management \nOfficer (P-4); \n \n13. Requests the Secretary-General to ensure the full implementation of the \nrelevant provisions of its resolutions 59/296, 60/266, 61/276, 64/269, 65/289, 66/264, \n69/307, 70/286 and 76/274; \n \n14. Also requests the Secretary-General to take all action necessary to ensure \nthat the Force is administered with a maximum of efficiency and economy; \n \n15. Reiterates its request to the Secretary-General to take the measures \nnecessary to ensure the full implementation of paragraph 8 of resolution 51/233, \nparagraph 5 of resolution 52/237, paragraph 11 of resolution 53/227, paragraph 14 of \nresolution 54/267, paragraph 14 of resolution 55/180 A, paragraph 15 of resolution \n55/180 B, paragraph 13 of resolution 56/214 A, paragraph 13 of resolution 56/214 B, \nparagraph 14 of resolution 57/325, paragraph 13 of resolution 58/307, paragraph 13 \nof resolution 59/307, paragraph 17 of resolution 60/278, paragraph 21 of resolution \n61/250 A, paragraph 20 of resolution 61/250 B, paragraph 20 of resolution 61/250 C, \nparagraph 21 of resolution 62/265, paragraph 19 of resolution 63/298, paragraph 18 \nof resolution 64/282, paragraph 15 of resolution 65/303, paragraph 13 of resolution \n66/277, paragraph 13 of resolution 67/279, paragraph 13 of resolution 68/292, \nparagraph 14 of resolution 69/302, paragraph 13 of resolution 70/280, paragraph 14 \nof resolution 71/307, paragraph 14 of resolution 72/299, paragraph 16 of resolution \n73/322, paragraph 3 of resolution 75/250 A and paragraph 39 of resolution 75/250 B, \nstresses once again that Israel shall pay the amount of 1,117,005 dollars resulting \nfrom the incident at Qana on 18 April 1996, and requests the Secretary-General to \nreport on this matter to the General Assembly at its seventy-seventh session; \n \nBudget performance report for the period from 1 July 2020 to 30 June 2021 \n \n \n16. Takes note of the report of the Secretary-General on the budget \nperformance of the Force for the period from 1 July 2020 to 30 June 2021; 3 \n \nBudget estimates for the period from 1 July 2022 to 30 June 2023 \n \n \n17. Decides to appropriate to the special account for the United Nations \nInterim Force in Lebanon the amount of 539,175,500 dollars for the period from \n1 July 2022 to 30 June 2023, inclusive of 502,920,500 dollars for the maintenance of \nthe Force, 30,723,500 dollars for the support account for peacekeeping operations and \n5,531,500 dollars for the United Nations Logistics Base at Brindisi, Italy; \n \nFinancing of the appropriation for the period from 1 July 2022 to 30 June 2023 \n \n \n18. Decides \nto \napportion \namong \nMember \nStates \nthe \namount \nof \n89,862,600 dollars for the period from 1 July to 31 August 2022 in accordance with the \nlevels updated in its resolution 76/239 of 24 December 2021, taking into account the \nscale of assessments for 2022, as set out in its resolution 76/238 of 24 December 2021; \n \n19. Also decides that, in accordance with the provisions of its resolution \n973 (X) of 15 December 1955, there shall be set off against the apportionment among \nMember States, as provided for in paragraph 18 above, their respective share in the \nTax Equalization Fund of 2,980,300 dollars, comprising the estimated staff \n__________________ \n \n3 A/76/562. \n\nA/RES/76/290 \nFinancing of the United Nations Interim Force in Lebanon\n \n22-10350\n4/4 \n \nassessment income of 2,460,100 dollars approved for the Force, the prorated share of \n413,100 dollars of the estimated staff assessment income approved for the support \naccount and the prorated share of 107,100 dollars of the estimated staff assessment \nincome approved for the United Nations Logistics Base; \n \n20. Further decides to apportion among Member States the amount of \n449,312,900 dollars for the period from 1 September 2022 to 30 June 2023, at a \nmonthly rate of 44,931,290 dollars, in accordance with the levels updated in its \nresolution 76/239, taking into account the scale of assessments for 2022 and 2023, as \nset out in its resolution 76/238, subject to a decision of the Security Council to extend \nthe mandate of the Force; \n \n21. Decides that, in accordance with the provisions of its resolution 973 (X), \nthere shall be set off against the apportionment among Member States, as provided \nfor in paragraph 20 above, their respective share in the Tax Equalization Fund of \n14,901,600 dollars, comprising the estimated staff assessment income of \n12,300,500 dollars approved for the Force, the prorated share of 2,065,400 dollars of \nthe estimated staff assessment income approved for the support account and the \nprorated share of 535,700 dollars of the estimated staff assessment income approved \nfor the United Nations Logistics Base; \n \n22. Also decides that, for Member States that have fulfilled their financial \nobligations to the Force, there shall be set off against the apportionment, as provided \nfor in paragraphs 18 and 20 above, their respective share of the unencumbered balance \nand other revenue in the amount of 15,826,500 dollars in respect of the financial \nperiod ended 30 June 2021, in accordance with the levels updated in its resolution \n73/272 of 22 December 2018, taking into account the scale of assessments for 2021, \nas set out in its resolution 73/271 of 22 December 2018; \n \n23. Further decides that, for Member States that have not fulfilled their \nfinancial obligations to the Force, there shall be set off against their outstanding \nobligations their respective share of the unencumbered balance and other revenue in \nthe total amount of 15,826,500 dollars in respect of the financial period ended 30 June \n2021, in accordance with the scheme set out in paragraph 22 above; \n \n24. Decides that the increase of 355,600 dollars in the estimated staff \nassessment income in respect of the financial period ended 30 June 2021 shall be \nadded to the credits in the amount of 15,826,500 dollars referred to in paragraphs 22 \nand 23 above; \n \n25. Encourages the Secretary-General to continue to take additional measures \nto ensure the safety and security of all personnel participating in the Force under the \nauspices of the United Nations, bearing in mind paragraphs 5 and 6 of Security \nCouncil resolution 1502 (2003) of 26 August 2003; \n \n26. Invites voluntary contributions to the Force in cash and in the form of \nservices and supplies acceptable to the Secretary-General, to be administered, as \nappropriate, in accordance with the procedure and practices established by the \nGeneral Assembly; \n \n27. Decides to include in the provisional agenda of its seventy-seventh \nsession, under the item entitled \u201cFinancing of the United Nations peacekeeping forces \nin the Middle East\u201d, the sub-item entitled \u201cUnited Nations Interim Force in Lebanon\u201d. \n \n89th plenary meeting \n29 June 2022 \n \n",
  "paragraphs": {
    "1": "Requests the Secretary-General to entrust the Head of Mission with the task of formulating future budget proposals in full accordance with the provisions of its resolutions 59/296 of 22 June 2005, 60/266 of 30 June 2006, 61/276 of 29 June 2007, 64/269 of 24 June 2010, 65/289 of 30 June 2011, 66/264 of 21 June 2012, 69/307 of 25 June 2015, 70/286 of 17 June 2016 and 76/274 of 29 June 2022, as well as other relevant resolutions;",
    "2": "Takes note of the status of contributions to the United Nations Interim Force in Lebanon as at 30 April 2022, including the contributions outstanding in the amount of 185.7 million United States dollars, representing some 1.7 per cent of the total assessed contributions, notes with concern that only 82 Member States have paid their assessed contributions in full, and urges all other Member States, in particular those in arrears, to ensure payment of their outstanding assessed contributions;",
    "3": "Expresses its appreciation to those Member States that have paid their assessed contributions in full, and urges all other Member States to make every possible effort to ensure payment of their assessed contributions to the Force in full;",
    "4": "Expresses deep concern that Israel did not comply with resolutions 51/233, 52/237, 53/227, 54/267, 55/180 A, 55/180 B, 56/214 A, 56/214 B, 57/325, 58/307, 59/307, 60/278, 61/250 A, 61/250 B, 61/250 C, 62/265, 63/298, 64/282, 65/303, 66/277, 67/279, 68/292, 69/302, 70/280, 71/307, 72/299, 73/322, 75/250 A and 75/250 B;",
    "5": "Stresses once again that Israel should strictly abide by resolutions 51/233, 52/237, 53/227, 54/267, 55/180 A, 55/180 B, 56/214 A, 56/214 B, 57/325, 58/307, 59/307, 60/278, 61/250 A, 61/250 B, 61/250 C, 62/265, 63/298, 64/282, 65/303, 66/277, 67/279, 68/292, 69/302, 70/280, 71/307, 72/299, 73/322, 75/250 A and 75/250 B;",
    "6": "Expresses concern at the financial situation with regard to peacekeeping activities, in particular as regards the reimbursements to troop contributors that bear additional burdens owing to overdue payments by Member States of their assessments;",
    "7": "Emphasizes that all future and existing peacekeeping missions shall be given equal and non-discriminatory treatment in respect of financial and administrative arrangements;",
    "8": "Also emphasizes that all peacekeeping missions shall be provided with adequate resources for the effective and efficient discharge of their respective mandates;",
    "9": "Requests the Secretary-General to ensure that proposed peacekeeping budgets are based on the relevant legislative mandates;",
    "10": "Endorses the conclusions and recommendations contained in the report of the Advisory Committee on Administrative and Budgetary Questions, subject to the provisions of the present resolution, and requests the Secretary-General to ensure their full implementation; Financing of the United Nations Interim Force in Lebanon A/RES/76/290 3/4 22-10350",
    "11": "Takes note of paragraph 21 of the report of the Advisory Committee, and decides to approve the establishment of one post of Senior Coordination Officer (P-5) in the Office of the Principal Coordinator;",
    "12": "Also takes note of paragraph 23 of the report of the Advisory Committee, and approves the establishment of one temporary position of Programme Management Officer (P-4);",
    "13": "Requests the Secretary-General to ensure the full implementation of the relevant provisions of its resolutions 59/296, 60/266, 61/276, 64/269, 65/289, 66/264, 69/307, 70/286 and 76/274;",
    "14": "Also requests the Secretary-General to take all action necessary to ensure that the Force is administered with a maximum of efficiency and economy;",
    "15": "Reiterates its request to the Secretary-General to take the measures necessary to ensure the full implementation of paragraph 8 of resolution 51/233, paragraph 5 of resolution 52/237, paragraph 11 of resolution 53/227, paragraph 14 of resolution 54/267, paragraph 14 of resolution 55/180 A, paragraph 15 of resolution 55/180 B, paragraph 13 of resolution 56/214 A, paragraph 13 of resolution 56/214 B, paragraph 14 of resolution 57/325, paragraph 13 of resolution 58/307, paragraph 13 of resolution 59/307, paragraph 17 of resolution 60/278, paragraph 21 of resolution 61/250 A, paragraph 20 of resolution 61/250 B, paragraph 20 of resolution 61/250 C, paragraph 21 of resolution 62/265, paragraph 19 of resolution 63/298, paragraph 18 of resolution 64/282, paragraph 15 of resolution 65/303, paragraph 13 of resolution 66/277, paragraph 13 of resolution 67/279, paragraph 13 of resolution 68/292, paragraph 14 of resolution 69/302, paragraph 13 of resolution 70/280, paragraph 14 of resolution 71/307, paragraph 14 of resolution 72/299, paragraph 16 of resolution 73/322, paragraph 3 of resolution 75/250 A and paragraph 39 of resolution 75/250 B, stresses once again that Israel shall pay the amount of 1,117,005 dollars resulting from the incident at Qana on 18 April 1996, and requests the Secretary-General to report on this matter to the General Assembly at its seventy-seventh session; Budget performance report for the period from 1 July 2020 to 30 June 2021",
    "16": "Takes note of the report of the Secretary-General on the budget performance of the Force for the period from 1 July 2020 to 30 June 2021; 3 Budget estimates for the period from 1 July 2022 to 30 June 2023",
    "17": "Decides to appropriate to the special account for the United Nations Interim Force in Lebanon the amount of 539,175,500 dollars for the period from 1 July 2022 to 30 June 2023, inclusive of 502,920,500 dollars for the maintenance of the Force, 30,723,500 dollars for the support account for peacekeeping operations and 5,531,500 dollars for the United Nations Logistics Base at Brindisi, Italy; Financing of the appropriation for the period from 1 July 2022 to 30 June 2023",
    "18": "Decides to apportion among Member States the amount of 89,862,600 dollars for the period from 1 July to 31 August 2022 in accordance with the levels updated in its resolution 76/239 of 24 December 2021, taking into account the scale of assessments for 2022, as set out in its resolution 76/238 of 24 December 2021;",
    "19": "Also decides that, in accordance with the provisions of its resolution 973 (X) of 15 December 1955, there shall be set off against the apportionment among Member States, as provided for in paragraph 18 above, their respective share in the Tax Equalization Fund of 2,980,300 dollars, comprising the estimated staff __________________ 3 A/76/562. A/RES/76/290 Financing of the United Nations Interim Force in Lebanon 22-10350 4/4 assessment income of 2,460,100 dollars approved for the Force, the prorated share of 413,100 dollars of the estimated staff assessment income approved for the support account and the prorated share of 107,100 dollars of the estimated staff assessment income approved for the United Nations Logistics Base;",
    "20": "Further decides to apportion among Member States the amount of 449,312,900 dollars for the period from 1 September 2022 to 30 June 2023, at a monthly rate of 44,931,290 dollars, in accordance with the levels updated in its resolution 76/239, taking into account the scale of assessments for 2022 and 2023, as set out in its resolution 76/238, subject to a decision of the Security Council to extend the mandate of the Force;",
    "21": "Decides that, in accordance with the provisions of its resolution 973 (X), there shall be set off against the apportionment among Member States, as provided for in paragraph 20 above, their respective share in the Tax Equalization Fund of 14,901,600 dollars, comprising the estimated staff assessment income of 12,300,500 dollars approved for the Force, the prorated share of 2,065,400 dollars of the estimated staff assessment income approved for the support account and the prorated share of 535,700 dollars of the estimated staff assessment income approved for the United Nations Logistics Base;",
    "22": "Also decides that, for Member States that have fulfilled their financial obligations to the Force, there shall be set off against the apportionment, as provided for in paragraphs 18 and 20 above, their respective share of the unencumbered balance and other revenue in the amount of 15,826,500 dollars in respect of the financial period ended 30 June 2021, in accordance with the levels updated in its resolution 73/272 of 22 December 2018, taking into account the scale of assessments for 2021, as set out in its resolution 73/271 of 22 December 2018;",
    "23": "Further decides that, for Member States that have not fulfilled their financial obligations to the Force, there shall be set off against their outstanding obligations their respective share of the unencumbered balance and other revenue in the total amount of 15,826,500 dollars in respect of the financial period ended 30 June 2021, in accordance with the scheme set out in paragraph 22 above;",
    "24": "Decides that the increase of 355,600 dollars in the estimated staff assessment income in respect of the financial period ended 30 June 2021 shall be added to the credits in the amount of 15,826,500 dollars referred to in paragraphs 22 and 23 above;",
    "25": "Encourages the Secretary-General to continue to take additional measures to ensure the safety and security of all personnel participating in the Force under the auspices of the United Nations, bearing in mind paragraphs 5 and 6 of Security Council resolution 1502 (2003) of 26 August 2003;",
    "26": "Invites voluntary contributions to the Force in cash and in the form of services and supplies acceptable to the Secretary-General, to be administered, as appropriate, in accordance with the procedure and practices established by the General Assembly;",
    "27": "Decides to include in the provisional agenda of its seventy-seventh session, under the item entitled \u201cFinancing of the United Nations peacekeeping forces in the Middle East\u201d, the sub-item entitled \u201cUnited Nations Interim Force in Lebanon\u201d. 89th plenary meeting 29 June 2022"
  },
  "agenda_items": [
    "Item 162"
  ],
  "symbol_references": []
}