{
  "symbol": "A/RES/75/325",
  "filename": "A_RES_75_325.pdf",
  "title": "75/325. Revitalization of the work of the General Assembly",
  "text": "United Nations \nA/RES/75/325\n \n \nGeneral Assembly \nDistr.: General \n15 September 2021 \n \n21-12804 (E)    200921 \n*2112804* \n \n \nSeventy-fifth session \nAgenda item 126 \nRevitalization of the work of the General Assembly \n \n \n \n \n Resolution adopted by the General Assembly \non 10 September 2021 \n \n \n \n \n[without reference to a Main Committee (A/75/973, para. 27)] \n \n \n 75/325. Revitalization of the work of the General Assembly \n \n \n \nThe General Assembly, \n \nBearing in mind the role and authority of the General Assembly as a principal \norgan of the United Nations and the importance of its effectiveness and efficiency in \nfulfilling its functions under the Charter of the United Nations, \n \nReiterating that the revitalization of the work of the General Assembly is a \ncritical component of the overall reform of the United Nations, \n \nWelcoming the calls to increase the efficiency of the work of the General \nAssembly through streamlining its agenda, including by elimination of duplication \nand overlap of agenda items,  \n \nWelcoming also the efforts of the President of the General Assembly to provide \nimpetus to and promote the process of revitalization of the work of the Assembly \nduring its seventy-fifth session in favour of strengthening multilateralism and \ninternational cooperation, \n \nRecalling the declaration on the commemoration of the seventy-fifth \nanniversary of the United Nations, adopted as resolution 75/1 of 21 September 2020, \nwhich reaffirms overarching priorities for the work of the General Assembly, \nincluding the commitment to multilateralism and to continue to work to revitalize the \nAssembly, \n \nRecognizing the impact of the coronavirus disease (COVID-19) pandemic on \nthe work of the General Assembly during its seventy-fourth and seventy-fifth \nsessions, and welcoming the efforts of the Presidents of the General Assembly at its \nseventy-fourth and seventy-fifth sessions to ensure the continued functioning of the \nAssembly despite the limitations as a consequence of the pandemic, \n \nMindful of the importance of the rules of procedure of the General Assembly, \nwhich continue to guide its work, \n\nA/RES/75/325 \nRevitalization of the work of the General Assembly\n \n21-12804\n2/12 \n \n \nRecognizing the temporary adjustments that were carried out by the Secretariat \nwithout setting a precedent due to the COVID-19 pandemic, which demonstrated its \nadaptability and resilience under exceptional circumstances, and taking note of the \nanalysis of the Secretary-General on the impact of the COVID-19 pandemic on the \nwork of the General Assembly and the briefing thereon provided to the Ad Hoc \nWorking Group on the Revitalization of the Work of the General Assembly during the \nseventy-fifth session, \n \nRecognizing also that multilingualism, as a core value of the Organization, \ncontributes to the achievement of the goals of the United Nations, as set out in Article 1 \nof the Charter, \n \nUnderlining the need to further enhance the role, authority, effectiveness and \nefficiency of the General Assembly to address the evolving global challenges,  \n \n1. \nReaffirms its resolutions 73/341 of 12 September 2019 and 74/303 of \n4 September 2020 and all other previous resolutions adopted by consensus relating to \nthe revitalization of the work of the General Assembly; \n \n2. \nWelcomes the report of the Ad Hoc Working Group on the Revitalization \nof the Work of the General Assembly issued during the seventy-fifth session and the \nupdated inventory of Assembly resolutions on revitalization annexed thereto,1 which \ncontinues to form a basis for the deliberations of Member States under the item on \nthe revitalization of the work of the General Assembly;  \n \n3. \nRequests the Secretariat to continue updating regularly and equally the \nmultilingual web page devoted to the revitalization of the work of the General \nAssembly in all six official languages and its substantive content within existing \nresources in a cost-effective manner, including through the use of existing capabilities \nsuch as automation of translation, while ensuring the accuracy of translation;  \n \n4. \nDecides to establish, at its seventy-sixth and seventy-seventh sessions, an \nad hoc working group on the revitalization of the work of the General Assembly, open \nto all Member States: \n \n(a) \nTo identify further ways to enhance the role, authority, effectiveness and \nefficiency of the Assembly, inter alia, by building on the progress achieved in past \nsessions as well as on previous resolutions, including evaluating the status of their \nimplementation, with the primary focus on: \n \n(i) \nDuring the seventy-sixth session: role and authority of the General \nAssembly, and working methods;  \n \n(ii) During the seventy-seventh session: strengthening the accountability, \ntransparency and institutional memory of the Office of the President of the \nGeneral Assembly and selection and appointment of the Secretary-General and \nother executive heads;  \n \n(b) \nTo also place the primary focus on implementation of the present \nresolution during the seventy-sixth session, and to submit a report thereon to the \nAssembly at its seventy-seventh session; \n \n5. \nAlso decides that the next resolution shall be considered during the \nseventy-seventh session and biennially thereafter; \n \n6. \nFurther decides that the Ad Hoc Working Group shall continue its review \nof the inventory of General Assembly resolutions on revitalization annexed to the \nreport of the Ad Hoc Working Group submitted at the seventy-fifth session and, as a \nresult, continue to update the inventory to be attached to the reports to be submitted \n__________________ \n \n1 A/75/973. \n\nRevitalization of the work of the General Assembly \nA/RES/75/325\n \n3/12\n21-12804 \n \nat the seventy-sixth and seventy-seventh sessions of the Assembly, including the \nseparate indication of relevant provisions that were not implemented, with reasons \ntherefor; \n \n7. \nRequests the Secretary-General to submit an update on the provisions of \nthe General Assembly resolutions on revitalization addressed to the Secretariat for \nimplementation that have not been implemented, with an indication of the constraints \nand reasons behind any lack of implementation, for further consideration by the \nAd Hoc Working Group at the seventy-sixth and seventy-seventh sessions; \n \n8. \nReiterates its decision to hold annually an interactive and comprehensive \ndialogue between the Permanent Missions and the Secretariat as mandated in \nresolution 71/323 of 8 September 2017, during the work of the Ad Hoc Working \nGroup, and strongly emphasizes the importance of the follow-up on issues raised \nduring the dialogue aimed at improving the work of the Secretariat in its interaction \nwith Permanent Missions, including the circulation of these follow-up measures to \nPermanent Missions; \n \nRole and authority of the General Assembly \n \n \n9. \nReaffirms the role and authority of the General Assembly and the strict \nrespect of the Charter-based prerogatives and division of work among the principal \norgans of the United Nations;  \n \n10. Welcomes the decision of the President of the General Assembly at its \nseventy-fifth session to select \u201cThe future we want, the United Nations we need: \nreaffirming our collective commitment to multilateralism \u2013 confronting COVID-19 \nthrough effective multilateral action\u201d as the theme of the general debate, and also \nwelcomes the decision of the President-elect of the General Assembly to select \n\u201cBuilding resilience through hope \u2013 to recover from COVID-19, rebuild sustainably, \nrespond to the needs of the planet, respect the rights of people, and revitalize the \nUnited Nations\u201d as the theme of the general debate of the seventy-sixth session of the \nAssembly; \n \n11. \nStresses the importance of implementing the resolutions of the General \nAssembly on a non-selective basis, including those related to the revitalization of its \nwork that require a follow-up or further actions, as shown in the updated inventory of \nAssembly resolutions on revitalization annexed to the report of the Ad Hoc Working \nGroup;  \n \n12. Welcomes the efforts of the President of the General Assembly to reinforce \nsynergy, coherence and complementarity between the agendas of the Assembly and \nits Main Committees and the Economic and Social Council and its subsidiary bodies, \nand encourages regular interaction and continued coordination between the Presidents \nof the General Assembly, the Security Council and the Economic and Social Council \nin this regard; \n \n13. Stresses the need for United Nations intergovernmental bodies to \neffectively address the 2030 Agenda for Sustainable Development 2  as a whole, \nincluding its Sustainable Development Goals, in order to effectively and efficiently \nsupport its accelerated implementation during the decade of action and delivery for \nsustainable development; \n \n14. Takes into account the respective mandates and distinct functions of each \nintergovernmental body, recognizes that it is necessary to further align the agendas of \nthe General Assembly and its Main Committees and the Economic and Social Council \nand its subsidiary bodies with the 2030 Agenda, considering a comprehensive and \n__________________ \n \n2 Resolution 70/1. \n\nA/RES/75/325 \nRevitalization of the work of the General Assembly\n \n21-12804\n4/12 \n \nholistic view of the agendas, and also recognizes the need for the Assembly process \non alignment to identify and simultaneously address gaps, overlaps and duplication \nin a balanced manner and on a case-by-case basis; \n \n15. Underlines that the work of the General Assembly on the alignment of \nagendas does not undermine the sovereign right of any Member State to introduce a \nnew agenda item or resolution, taking into account the alignment-related principles \nand objectives of the present resolution; \n \n16. Invites delegations proposing draft resolutions, where possible, to consider \nincluding provisions to accelerate the implementation of the 2030 Agenda in the \nresolutions, and also invites them to take into consideration the principles and \nobjectives agreed during the alignment process; \n \n17. Invites the General Assembly and its Main Committees and the Economic \nand Social Council and its subsidiary bodies to consider ways to address those \nSustainable Development Goals that have limited or no coverage, and ways to avoid \noverlaps and duplication, bearing in mind their respective mandates, and to make \nrecommendations to Member States for their consideration; \n \n18. Invites the main sponsors of draft resolutions that are submitted for the \nconsideration of delegations to consider the procedural practices applied during \nprevious sessions with the aim of enhancing the efficiency of the work of the General \nAssembly and its Main Committees and the Economic and Social Council and its \nsubsidiary bodies; \n \n19. Underlines the urgent need to preserve the primacy, significance and \nestablished practice of the general debate of the General Assembly, and: \n \n(a) \nStresses the need to limit the number of high-level events held in the \nmargins of the general debate to those of key significance that require immediate \nattention from Heads of State and Government, and calls upon the President of the \nGeneral Assembly, Member States, in close coordination with the Secretary-General \nand heads of other relevant United Nations bodies, to be very mindful of these aspects \nwhen planning the events of the high-level week in September and to be guided by \nthe existing mandates agreed upon by Member States; \n \n(b) \nEncourages Member States and the United Nations system to singly and \ncollectively limit the number of side events held in parallel with or in the margins of \nthe general debate, as well as other high-level sessions, including by consulting one \nanother to identify side events on similar topics in an effort to minimize overlap and \ninforming the Secretariat of the details of planned side events; \n \n(c) \nRequests the Secretariat to upload information on the side events, when \nindicated by the organizers, in the Journal of the United Nations; \n \n(d) \nInvites Member States to continue discussions on efforts to limit the \nnumber of side events held in parallel with or in the margins of the general debate \nand other high-level sessions, with a view to taking stock and exploring further \nimprovements, as necessary, during the seventy-eighth session of the General \nAssembly; \n \n20. Recognizes the value of holding interactive inclusive thematic debates on \ncurrent issues of critical importance to the international community, calls for the \nrationalizing of such debates to ensure high-level attendance, calls upon the President \nof the General Assembly to be mindful of the regular agenda of the Assembly when \norganizing such debates, and urges Member States to be mindful of existing mandates \nwhen considering new mandates for meetings of the Assembly and, in this regard, to \nrefrain from mandating recurring high-level and commemorative meetings where \npossible;  \n\nRevitalization of the work of the General Assembly \nA/RES/75/325\n \n5/12\n21-12804 \n \n \n21. Encourages the President of the General Assembly, supported by the \nmembership, to achieve gender parity among invited speakers and panellists for high-\nlevel and other relevant meetings of the General Assembly; \n \n22. Requests the President of the General Assembly to continue scheduling the \nplenary meetings of the Assembly on the report of the Secretary-General on the work \nof the Organization and on the report of the Security Council in close coordination \nwith the Secretary-General and the President of the Security Council, so that \ndiscussions of these important reports are not conducted in a perfunctory manner;  \n \n23. Recognizes the timely submission of the report of the Security Council to \nthe General Assembly in accordance with Article 24, paragraph 3, of the Charter of \nthe United Nations, recalls resolution 69/321 of 11 September 2015 and other relevant \nresolutions of the Assembly, and reiterates the importance of the Security Council \ncontinuing its efforts to provide its annual report to the Assembly in accordance with \nresolutions 51/193 of 17 December 1996 and 58/126 of 19 December 2003;  \n \n24. Notes the progress aimed at increasing the visibility of the General \nAssembly in the media and in bringing the priorities of the Assembly to a wider \naudience, including during the COVID-19 pandemic with a view to ensuring \nrelevance and providing accurate and reliable information to the global public in a \ntimely manner, requests the Department of Global Communications of the Secretariat \nto continue to take appropriate measures to further enhance public awareness of the \nrole and activities of the Assembly throughout its session in all six official languages, \nincluding on as many platforms as possible, requests the Secretary-General and the \nPresident of the General Assembly to continue to make efforts to ensure that \nmultilingualism is not undermined by the measures taken in response to the liquidity \nsituation and the COVID-19 pandemic, and requests the Secretariat to continue to \nexplore cost-neutral options to that effect; \n \nWorking methods \n \n \n25. Stresses the desirability of the General Assembly further streamlining its \nagenda and dedicating more time for dialogue as well as the review of the \nimplementation of the resolutions it adopts;  \n \n26. Reaffirms existing relevant mandates related to the improvement of the \nworking methods of the Main Committees;  \n \n27. Notes the important role of information and communications technologies \nin carrying out the work of the United Nations, including the General Assembly, on \nan exceptional basis, during the COVID-19 pandemic, and: \n \n(a) \nRecognizes the use of information and communications technologies in \nholding interactive inclusive thematic debates during the COVID-19 pandemic, and \nencourages the President of the General Assembly to be mindful of the proper use of \nsuch technologies to ensure full and equal participation of Member States when \norganizing such events; \n \n(b) \nRequests the Secretariat to brief the Ad Hoc Working Group at the seventy-\nsixth session of the General Assembly on lessons learned from the COVID-19 \npandemic, including the use of information and communications technologies, with a \nview to ensuring better preparedness in exceptional circumstances; \n \n28. Requests the Secretariat to brief the Ad Hoc Working Group at the seventy-\nsixth session of the General Assembly on the implementation of past decisions \nregarding the streamlining of the agenda of the Assembly to further address the issue \nof the increasingly overloaded agenda of the Assembly; \n\nA/RES/75/325 \nRevitalization of the work of the General Assembly\n \n21-12804\n6/12 \n \n \n29. Requests each Main Committee to further discuss its working methods, \nand in this regard invites the Chairs of the Main Committees to continue briefing the \nAd Hoc Working Group during the seventy-sixth session on any best practices and \nlessons learned with a view to improving working methods, and to coordinate their \nbriefings through, inter alia, possible identification of commonalities in the working \nmethods and the lessons learned; \n \n30. Emphasizes that the General Assembly and its Main Committees, at the \nseventy-sixth session, in consultation with Member States, should continue their \nconsideration of and make concrete proposals for the further biennialization, \ntriennialization, clustering and elimination of items on the agenda of the Assembly, \nincluding through the introduction of a sunset clause, with the clear consent of the \nsponsoring State or States, taking into account the relevant recommendations of the \nAd Hoc Working Group, during the seventy-sixth session of the Assembly, and \nencourages the General Committee to play a more active role in this regard, in line \nwith the rules of procedure of the Assembly; \n \n31. Requests each Main Committee to submit to the Ad Hoc Working Group \nduring the seventy-sixth session a written update on progress achieved so far in the \nefforts aimed at improving the working methods of the Committees, taking into \naccount recommendations of the Ad Hoc Working Group as appropriate, and \nencourages the Ad Hoc Working Group during the seventy-sixth session to appoint \ntwo focal points who would work closely with the Chairs and Bureaux of the Main \nCommittees, the President of the General Assembly and the Secretariat to assist the \nCo-Chairs of the Ad Hoc Working Group in elaborating practical proposals for \nconsideration by the Working Group for the implementation of paragraphs 29 and 30 \nof the present resolution and of reports submitted by the Main Committees; \n \n32. Notes the pilot analysis on Sustainable Development Goal 2 carried out \nduring the seventy-fifth session to examine in depth the coverage of Goal 2 (zero \nhunger) and the mapping developed during the seventy-third session of the Assembly, \nalong with the pilot analysis, which remain relevant reference documents for the \nconsideration of Member States during the seventy-eighth session of the Assembly; \n \n33. Recognizes that, when considering Sustainable Development Goals that \nare not fully covered by intergovernmental bodies, due consideration should be given \nto addressing these through an integrated approach across the intergovernmental \nbodies, and not in silos; \n \n34. Highlights that the COVID-19 pandemic is impacting all Sustainable \nDevelopment Goals and that dedicated attention by intergovernmental bodies is \nrequired to address these impacts, notably on the most affected Goals and resulting \ngaps, and that it will be important to closely monitor various aspects of the 2030 \nAgenda to enable governments to respond to the pandemic and its impacts and \nestablish the way forward to build back better and to strengthen international \ncooperation; \n \n35. Invites the General Committee, within its mandate, to consider the best \npossible way to conduct the discussions on the impacts of the COVID-19 pandemic \nwithin the agenda of the General Assembly and make recommendations to Member \nStates for their consideration; \n \n36. Emphasizes that addressing overlaps and duplication in the agendas of the \nGeneral Assembly and its Main Committees and the Economic and Social Council \nand its subsidiary bodies will free up time and create space in the agendas and allow \nresources to be applied effectively, and that this will also allow these bodies to better \nand more comprehensively address the 2030 Agenda as a whole as well as emerging \nglobal issues of an important and urgent nature; \n\nRevitalization of the work of the General Assembly \nA/RES/75/325\n \n7/12\n21-12804 \n \n \n37. Notes that identifying duplication and overlaps in the agendas of the \nintergovernmental bodies should entail encouraging the General Assembly and its \nMain Committees and the Economic and Social Council and its subsidiary bodies to \nexamine, on a case-by-case basis, all the resolutions and agenda items that focus on \nthe same area, based on their purpose, relevance and content; \n \n38. Recognizes, at the same time, that some issues may need to be addressed \nby different intergovernmental bodies from their own specific perspective and based \non their respective mandates, which should be reflected in setting agendas and in the \nreporting of the Secretary-General, taking due consideration of synergies and \nmandates of respective resolutions; \n \n39. Invites the General Assembly and its Main Committees and the Economic \nand Social Council and its subsidiary bodies to strengthen synergies and \ncomplementarities in their respective work and outcomes, in line with resolution \n73/341, when covering interrelated issues, as appropriate; \n \n40. Reaffirms the respective mandates of the Main Committees of the General \nAssembly, and on that basis, calls upon those Committees to continue their \nconsideration, in consultation with all relevant bodies, of addressing gaps, overlaps \nand duplication in their respective agendas as they relate to the 2030 Agenda as a \nwhole and, in this regard, invites the Bureaux of the relevant Main Committees of the \nAssembly and the Economic and Social Council and its subsidiary bodies to facilitate \nthe consideration of the alignment principles by their respective intergovernmental \nbodies and to present concrete proposals for the consideration of Member States; \n \n41. Requests the General Committee, while exercising its functions under \nrule 40 of the rules of procedure of the General Assembly, and within its mandate, to \nalso consider discussing gaps, overlaps and duplication and make recommendations \nto Member States for consideration; \n \n42. Encourages the President of the General Assembly and the President of \nthe Economic and Social Council to continue to convene an annual joint briefing, \nhighlighting the connection between agenda items and their interlinkages across the \n2030 Agenda; \n \n43. Also encourages the President of the General Assembly and the President \nof the Economic and Social Council to facilitate informal joint meetings of the \nBureaux of the Main Committees of the Assembly and the Bureau of the Economic \nand Social Council to discuss how their respective work relates to the implementation \nof the 2030 Agenda and to ensure synergies among their work and outcomes, as \nstipulated in resolution 73/341 and the present resolution, on an ongoing basis and in \nfull transparency, including regular reporting on those meetings to the entire \nmembership; \n \n44. Requests the President of the General Assembly at its seventy-eighth \nsession to draw lessons learned from the implementation of the provisions contained \nin paragraphs 13 to 18 and 32 to 44 of the present resolution on the revitalization of \nthe work of the Assembly and identify further proposals on alignment, and, in the \ninterim, requests the Ad Hoc Working Group, during both the seventy-sixth and the \nseventy-seventh sessions, to hold one or two dedicated meetings, as required, on the \nprogress of the implementation of the aforementioned provisions; \n \n45. Welcomes the increasing number of women candidates nominated for the \nsubsidiary organs of the General Assembly in seeking to promote gender balance, and \nencourages Member States to continue to do so;  \n \n46. Reiterates the need to continue to produce the Journal of the United \nNations in all six official languages in strict compliance with rule 55 of the rules of \n\nA/RES/75/325 \nRevitalization of the work of the General Assembly\n \n21-12804\n8/12 \n \nprocedure of the General Assembly, and in that regard emphasizes the importance of \nthe extension of the information in the Journal published in the six official languages, \nreiterates its request to the Secretary-General to brief the Ad Hoc Working Group, on \na yearly basis, on the progress achieved in this regard, and requests the Secretariat to \ncontinue to explore cost-neutral options to that effect;  \n \n47. Requests the Secretariat to continue to improve, harmonize and unify \ne-services provided to Member States under e-deleGATE with a view to creating a \nfull-fledged delegates\u2019 online workplace in all six official languages in order to save \ncosts, reduce the environmental impact and improve the distribution of documents; \n \n48. Recognizes the need to have open access to the archive of past statements, \nand requests the Secretariat to ensure open access, by the end of the seventy-sixth \nsession, to all documents uploaded to PaperSmart and, further, to ensure its \nreplacement with the eStatements module of the Journal of the United Nations; \n \n49. Reaffirms paragraphs 33 to 37 of resolution 73/341, and requests the \nSecretariat to brief the Ad Hoc Working Group during the seventy-sixth session of the \nGeneral Assembly on the progress reached so far and on ways to improve the \naccessibility of the United Nations Headquarters premises for persons with \ndisabilities;  \n \n50. Recalls the report of the Secretary-General entitled \u201cOpening of the \nregular sessions of the General Assembly\u201d, submitted pursuant to resolution 72/313 \nof 17 September 2018,3 and decides, in order to allow more time for the incoming \nPresident of the General Assembly and his/her Office to prepare for the general \ndebate, to amend rule 1 of the rules of procedure of the General Assembly to read, \neffective from the opening of the seventy-eighth session:  \n \nThe General Assembly shall meet every year in regular session \ncommencing on the Tuesday of the second week in September, counting from \nthe first week that contains at least one working day.  \n \nThe general debate in the General Assembly shall open on the Tuesday of \nthe fourth week in September, counting from the first week that contains at least \none working day, and shall be held without interruption over a period of nine \nworking days; \n \nSelection and appointment of the Secretary-General and other executive heads \n \n \n51. Reaffirms the important role played by the Secretary-General in the \ncontext of current global challenges and in the implementation of the three pillars of \nthe United Nations, namely, peace and security, human rights and sustainable \ndevelopment;  \n \n52. Reaffirms its commitment to continue, in the Ad Hoc Working Group, in \naccordance with the provisions of Article 97 of the Charter, its thorough consideration \nof the issues under the third thematic cluster of the Working Group, on the \nrevitalization of the work of the General Assembly, including the examination of \ninnovative ways to improve the process of selecting and appointing the Secretary-\nGeneral and other executive heads in all its aspects, and recalls all relevant \nresolutions, including resolutions 11 (I) of 24 January 1946, 46/77 of 12 December \n1991, 47/233 of 17 August 1993, 48/264 of 29 July 1994, 51/241 of 31 July 1997, \n52/163 of 15 December 1997, 55/14 of 3 November 2000, 55/285 of 7 September \n2001, 56/509 of 8 July 2002, 57/300 of 20 December 2002, 57/301 of 13 March 2003, \n58/126 of 19 December 2003, 58/316 of 1 July 2004, 59/313 of 12 September 2005, \n60/286 of 8 September 2006, 61/292 of 2 August 2007, 62/276 of 15 September 2008, \n__________________ \n \n3 A/73/723. \n\nRevitalization of the work of the General Assembly \nA/RES/75/325\n \n9/12\n21-12804 \n \n63/309 of 14 September 2009, 64/301 of 13 September 2010, 65/315 of 12 September \n2011, 66/294 of 17 September 2012, 67/297 of 29 August 2013, 68/307 of \n10 September 2014, 69/321 of 11 September 2015, 70/305 of 13 September 2016, \n71/323 of 8 September 2017, 72/313 of 17 September 2018 and 73/341 of \n12 September 2019, reaffirming the applicable procedures set out in the rules of \nprocedure of the Assembly, in particular rule 141, and acknowledging existing \nrelevant practices of the Assembly;  \n \n53. Encourages future Presidents of the General Assembly to actively \ncontribute to the implementation of provisions guiding the selection and appointment \nof the next Secretary-General, as contained in all relevant resolutions, in particular \nresolutions 69/321 and 70/305, and stresses the need for the selection and \nappointment process of the Secretary-General and other executive heads to be guided \nby the principles of transparency and inclusiveness; \n \n54. Welcomes the progress achieved in the selection and appointment process \nof the Secretary-General in the consensual resolutions 69/321, 70/305, 71/323 and \n72/313, in full compliance with the General Assembly mandate under Article 97 of \nthe Charter, and reaffirms previous resolutions referring to gender balance and \nregional rotation in the course of the identification and appointment of the best well-\nqualified and experienced candidate for the post of Secretary-General;  \n \n55. Recommends that the President of the General Assembly and the President \nof the Security Council, in future joint letters on the selection and appointment \nprocess of the Secretary-General, encourage Member States to publicize the call for \nnominations, including with civil society and other stakeholders with the aim of \nidentifying potential candidates;  \n \n56. Decides that, in order to be circulated in a joint letter by the President of \nthe General Assembly and the President of the Security Council pursuant to the \nprocess established in resolution 69/321, nominations of candidates must be \nsubmitted by at least one Member State, in accordance with the ongoing practice;  \n \n57. Also decides to further assess during the seventy-seventh session of the \nGeneral Assembly the selection and appointment process of the Secretary-General, to \nconsolidate the advances gained in the relevant Assembly resolutions and to explore \npossible steps to improve future processes, including the collaboration between the \nAssembly and the Security Council, consistent with Article 97 of the Charter;  \n \n58. Notes with appreciation the presentation of a vision statement by the \nincumbent Secretary-General, and the informal dialogue with Member States and \nobservers4 of the General Assembly on its content, including the engagement of civil \nsociety in line with the letter dated 26 April 2021 from the President of the General \nAssembly, and encourages the continuation of such practices;  \n \n59. Reiterates the possibility of providing the process of selection and \nappointment of the Secretary-General with provisional timelines in accordance with \nparagraph 72 of its resolution 72/313, and decides to further discuss this issue during \nits seventy-seventh session in the Ad Hoc Working Group; \n \n60. Notes that the Secretary-General-designate shall take an oath of office \nbefore the General Assembly during a swearing-in ceremony, as detailed in the annex \nto the present resolution;  \n \n61. Welcomes again the ongoing efforts of the Secretary-General towards \nachieving equal and fair distribution in terms of the gender and geographical balance \nof the executive heads of the United Nations system and the Senior Management \n__________________ \n \n4 See A/INF/75/3/Rev.1. \n\nA/RES/75/325 \nRevitalization of the work of the General Assembly\n \n21-12804\n10/12 \n \nGroup of the Organization, while securing the highest standards of efficiency, \ncompetence and integrity, in accordance with Article 101 of the Charter and its \nresolutions 46/232 of 2 March 1992, 51/241, and 71/263 of 23 December 2016, \ncommends in particular the fact that gender parity was achieved in the Senior \nManagement Group, and requests that further effective measures be taken in this \nregard;  \n \n62. Supports the request of the Secretary-General for Member States to submit \nthe names and r\u00e9sum\u00e9s of nationals who may be considered for positions of executive \nheads and senior management of the Secretariat;  \n \n63. Reiterates the need to follow best practices in all senior appointments, \nincluding a public call for candidates, including women; \n \n64. Reaffirms that no post should be considered the exclusive preserve of any \nMember State or group of States and that the Secretary-General should ensure that \nthis principle is applied faithfully in accordance with the principle of equitable \ngeographical distribution; \n \n65. Welcomes the fact that gender parity has already been reached in the Senior \nManagement Group, and commends the Secretary-General\u2019s commitment to reach \ngender parity and to recruit staff on as wide a geographical basis as possible across \nthe United Nations Organization; \n \n66. Reiterates its request to the Secretary-General that he continue his ongoing \nefforts to ensure the attainment of equitable geographical distribution in the \nSecretariat and to ensure as wide a geographical distribution of staff as possible in all \ndepartments and offices and at all levels, including at the Director and higher levels, \nof the Secretariat; \n \n67. Reiterates the need to ensure equal and fair distribution based on gender \nbalance and as wide a geographical basis as possible, while also being diverse from a \nmultilingual perspective, and in this regard recalls its resolutions 46/232 and 51/241, \nadopted without a vote, which contain the principles that the highest standards of \nefficiency, competence and integrity are the paramount considerations in the \nrecruitment and performance of international civil servants, and that candidates\u2019 \nindependence should be considered; \n \n68. Notes that there is yet to be a woman Secretary-General, and invites \nMember States to bear this in mind in the future, when nominating candidates for the \nposition of Secretary-General; \n \n69. Requests the Office of Human Resources of the Secretariat to continue \nwith the practice of providing a briefing to the Ad Hoc Working Group, during the \nseventy-seventh session of the General Assembly, on the gender and geographical \nbalance of the executive heads of the United Nations system and the Senior \nManagement Group of the Organization, as well as with a breakdown showing those \noriginating from the States that are permanent members of the Security Council;  \n \nStrengthening the accountability, transparency and institutional memory of the \nOffice of the President of the General Assembly \n \n \n70. Emphasizes the important role of the President of the General Assembly \nwithin the United Nations Organization, as well as in the overall success of the work \nof the Assembly;  \n \n71. Invites Member States to equally consider women as candidates for the \nposition of President of the General Assembly, and encourages Presidents-elect to \ncontinue to strive for both gender and geographical balance within the Office of the \nPresident of the General Assembly;  \n\nRevitalization of the work of the General Assembly \nA/RES/75/325\n \n11/12\n21-12804 \n \n \n72. Recalls with appreciation the decision of Member States to fund the \ntransition period, the trust fund in support of the Office of the President of the General \nAssembly, seconding national staff as well as the convening of annual retreats;  \n \n73. Welcomes the induction programme delivered to the Office of the President \nof the General Assembly, and calls upon the Secretariat to strengthen the programme \nthrough enhanced content and increased delivery time;  \n \n74. Also welcomes the initiatives by Member States to support the \nstrengthening of the efficiency and effectiveness of the Office of the President of the \nGeneral Assembly, including through the annual General Assembly retreat and a \ntransition workshop that includes the revitalization of the work of the Assembly \namong its central components; \n \n75. Recognizes the heavy reliance of the Office of the President of the General \nAssembly on voluntary contributions to deliver on a growing number of mandates \nentrusted to it by the Assembly; \n \n76. Requests the Secretary-General to continue to provide to the President of \nthe General Assembly, within existing resources, adequate administrative, technical, \nlogistical and protocol-related support necessary to effectively execute his or her \nmandates as president of a principal organ of the United Nations;  \n \n77. Recalls that the activities of the President of the General Assembly have \nincreased continuously and markedly in recent years, also recalls the provisions \nregarding the support for the Office of the President of the General Assembly in \nprevious resolutions, and expresses continued interest in seeking ways to further \nsupport and strengthen the Office in accordance with existing procedures, in \nparticular rule 153 of the rules of procedure of the Assembly;  \n \n78. Requests the Secretariat to provide to the Ad Hoc Working Group during \nthe seventy-seventh session of the General Assembly a written update with \nrecommendations, and a briefing on the functioning of the Office of the President of \nthe General Assembly, as a follow-up to the report of the Task Force convened by the \nSecretary-General in November 2015 and circulated in the annex to the letter dated \n11 March 2016 from the Secretary-General addressed to the President of the General \nAssembly,5 taking into consideration its previous relevant resolutions; \n \n79. Requests the Secretary-General to take the measures necessary to preserve \nand further strengthen the institutional memory of the Office of the President of the \nGeneral Assembly and the General Assembly revitalization process, through utilizing \nexisting United Nations record-keeping and archiving facilities, in particular in the \nDag Hammarskj\u00f6ld Library and the Department of General Assembly and Conference \nManagement and the Department of Global Communications of the Secretariat; \n \n80. Requests the Secretariat to issue, during the seventy-seventh session, \nwithin existing resources, in coordination with the Office of the President of the \nGeneral Assembly, a compendium of best practices of past Presidents that could serve \nto contribute to strengthening the institutional memory of the Office; \n \n81. Emphasizes the importance of a handover report for the institutional \nmemory of the Office of the President of the General Assembly in accordance with \nresolution 69/321 and other relevant mandates contained in resolutions on the \nrevitalization of the work of the Assembly;  \n \n82. Welcomes the good practice of the organization by the President of the \nGeneral Assembly of informal interactive dialogues of the Member States, with the \n__________________ \n \n5 A/70/783. \n\nA/RES/75/325 \nRevitalization of the work of the General Assembly\n \n21-12804\n12/12 \n \nengagement of civil society, with the candidate(s) for the position of President of the \nGeneral Assembly based on his or her vision statement. \n \n103rd plenary meeting \n10 September 2021 \n \n \n \n \nAnnex \n \n \n \nOath of office of the Secretary-General \n \n \nI, [name], solemnly swear to exercise in all loyalty, discretion and conscience \nthe functions entrusted to me as Secretary-General of the United Nations, to discharge \nthese functions and regulate my conduct with the interests of the United Nations only \nin view and in accordance with the Charter of the United Nations, without seeking or \naccepting any instructions in regard to the performance of my duties from any \nGovernment or other authority external to the Organization. \n \n",
  "paragraphs": {
    "1": "Reaffirms its resolutions 73/341 of 12 September 2019 and 74/303 of 4 September 2020 and all other previous resolutions adopted by consensus relating to the revitalization of the work of the General Assembly;",
    "2": "Welcomes the report of the Ad Hoc Working Group on the Revitalization of the Work of the General Assembly issued during the seventy-fifth session and the updated inventory of Assembly resolutions on revitalization annexed thereto,1 which continues to form a basis for the deliberations of Member States under the item on the revitalization of the work of the General Assembly;",
    "3": "Requests the Secretariat to continue updating regularly and equally the multilingual web page devoted to the revitalization of the work of the General Assembly in all six official languages and its substantive content within existing resources in a cost-effective manner, including through the use of existing capabilities such as automation of translation, while ensuring the accuracy of translation;",
    "4": "Decides to establish, at its seventy-sixth and seventy-seventh sessions, an ad hoc working group on the revitalization of the work of the General Assembly, open to all Member States: (a) To identify further ways to enhance the role, authority, effectiveness and efficiency of the Assembly, inter alia, by building on the progress achieved in past sessions as well as on previous resolutions, including evaluating the status of their implementation, with the primary focus on: (i) During the seventy-sixth session: role and authority of the General Assembly, and working methods; (ii) During the seventy-seventh session: strengthening the accountability, transparency and institutional memory of the Office of the President of the General Assembly and selection and appointment of the Secretary-General and other executive heads; (b) To also place the primary focus on implementation of the present resolution during the seventy-sixth session, and to submit a report thereon to the Assembly at its seventy-seventh session;",
    "5": "Also decides that the next resolution shall be considered during the seventy-seventh session and biennially thereafter;",
    "6": "Further decides that the Ad Hoc Working Group shall continue its review of the inventory of General Assembly resolutions on revitalization annexed to the report of the Ad Hoc Working Group submitted at the seventy-fifth session and, as a result, continue to update the inventory to be attached to the reports to be submitted __________________ 1 A/75/973. Revitalization of the work of the General Assembly A/RES/75/325 3/12 21-12804 at the seventy-sixth and seventy-seventh sessions of the Assembly, including the separate indication of relevant provisions that were not implemented, with reasons therefor;",
    "7": "Requests the Secretary-General to submit an update on the provisions of the General Assembly resolutions on revitalization addressed to the Secretariat for implementation that have not been implemented, with an indication of the constraints and reasons behind any lack of implementation, for further consideration by the Ad Hoc Working Group at the seventy-sixth and seventy-seventh sessions;",
    "8": "Reiterates its decision to hold annually an interactive and comprehensive dialogue between the Permanent Missions and the Secretariat as mandated in resolution 71/323 of 8 September 2017, during the work of the Ad Hoc Working Group, and strongly emphasizes the importance of the follow-up on issues raised during the dialogue aimed at improving the work of the Secretariat in its interaction with Permanent Missions, including the circulation of these follow-up measures to Permanent Missions; Role and authority of the General Assembly",
    "9": "Reaffirms the role and authority of the General Assembly and the strict respect of the Charter-based prerogatives and division of work among the principal organs of the United Nations;",
    "10": "Welcomes the decision of the President of the General Assembly at its seventy-fifth session to select \u201cThe future we want, the United Nations we need: reaffirming our collective commitment to multilateralism \u2013 confronting COVID-19 through effective multilateral action\u201d as the theme of the general debate, and also welcomes the decision of the President-elect of the General Assembly to select \u201cBuilding resilience through hope \u2013 to recover from COVID-19, rebuild sustainably, respond to the needs of the planet, respect the rights of people, and revitalize the United Nations\u201d as the theme of the general debate of the seventy-sixth session of the Assembly;",
    "11": "Stresses the importance of implementing the resolutions of the General Assembly on a non-selective basis, including those related to the revitalization of its work that require a follow-up or further actions, as shown in the updated inventory of Assembly resolutions on revitalization annexed to the report of the Ad Hoc Working Group;",
    "12": "Welcomes the efforts of the President of the General Assembly to reinforce synergy, coherence and complementarity between the agendas of the Assembly and its Main Committees and the Economic and Social Council and its subsidiary bodies, and encourages regular interaction and continued coordination between the Presidents of the General Assembly, the Security Council and the Economic and Social Council in this regard;",
    "13": "Stresses the need for United Nations intergovernmental bodies to effectively address the 2030 Agenda for Sustainable Development 2 as a whole, including its Sustainable Development Goals, in order to effectively and efficiently support its accelerated implementation during the decade of action and delivery for sustainable development;",
    "14": "Takes into account the respective mandates and distinct functions of each intergovernmental body, recognizes that it is necessary to further align the agendas of the General Assembly and its Main Committees and the Economic and Social Council and its subsidiary bodies with the 2030 Agenda, considering a comprehensive and __________________ 2 Resolution 70/1. A/RES/75/325 Revitalization of the work of the General Assembly 21-12804 4/12 holistic view of the agendas, and also recognizes the need for the Assembly process on alignment to identify and simultaneously address gaps, overlaps and duplication in a balanced manner and on a case-by-case basis;",
    "15": "Underlines that the work of the General Assembly on the alignment of agendas does not undermine the sovereign right of any Member State to introduce a new agenda item or resolution, taking into account the alignment-related principles and objectives of the present resolution;",
    "16": "Invites delegations proposing draft resolutions, where possible, to consider including provisions to accelerate the implementation of the 2030 Agenda in the resolutions, and also invites them to take into consideration the principles and objectives agreed during the alignment process;",
    "17": "Invites the General Assembly and its Main Committees and the Economic and Social Council and its subsidiary bodies to consider ways to address those Sustainable Development Goals that have limited or no coverage, and ways to avoid overlaps and duplication, bearing in mind their respective mandates, and to make recommendations to Member States for their consideration;",
    "18": "Invites the main sponsors of draft resolutions that are submitted for the consideration of delegations to consider the procedural practices applied during previous sessions with the aim of enhancing the efficiency of the work of the General Assembly and its Main Committees and the Economic and Social Council and its subsidiary bodies;",
    "19": "Underlines the urgent need to preserve the primacy, significance and established practice of the general debate of the General Assembly, and: (a) Stresses the need to limit the number of high-level events held in the margins of the general debate to those of key significance that require immediate attention from Heads of State and Government, and calls upon the President of the General Assembly, Member States, in close coordination with the Secretary-General and heads of other relevant United Nations bodies, to be very mindful of these aspects when planning the events of the high-level week in September and to be guided by the existing mandates agreed upon by Member States; (b) Encourages Member States and the United Nations system to singly and collectively limit the number of side events held in parallel with or in the margins of the general debate, as well as other high-level sessions, including by consulting one another to identify side events on similar topics in an effort to minimize overlap and informing the Secretariat of the details of planned side events; (c) Requests the Secretariat to upload information on the side events, when indicated by the organizers, in the Journal of the United Nations; (d) Invites Member States to continue discussions on efforts to limit the number of side events held in parallel with or in the margins of the general debate and other high-level sessions, with a view to taking stock and exploring further improvements, as necessary, during the seventy-eighth session of the General Assembly;",
    "20": "Recognizes the value of holding interactive inclusive thematic debates on current issues of critical importance to the international community, calls for the rationalizing of such debates to ensure high-level attendance, calls upon the President of the General Assembly to be mindful of the regular agenda of the Assembly when organizing such debates, and urges Member States to be mindful of existing mandates when considering new mandates for meetings of the Assembly and, in this regard, to refrain from mandating recurring high-level and commemorative meetings where possible; Revitalization of the work of the General Assembly A/RES/75/325 5/12 21-12804",
    "21": "Encourages the President of the General Assembly, supported by the membership, to achieve gender parity among invited speakers and panellists for high- level and other relevant meetings of the General Assembly;",
    "22": "Requests the President of the General Assembly to continue scheduling the plenary meetings of the Assembly on the report of the Secretary-General on the work of the Organization and on the report of the Security Council in close coordination with the Secretary-General and the President of the Security Council, so that discussions of these important reports are not conducted in a perfunctory manner;",
    "23": "Recognizes the timely submission of the report of the Security Council to the General Assembly in accordance with Article 24, paragraph 3, of the Charter of the United Nations, recalls resolution 69/321 of 11 September 2015 and other relevant resolutions of the Assembly, and reiterates the importance of the Security Council continuing its efforts to provide its annual report to the Assembly in accordance with resolutions 51/193 of 17 December 1996 and 58/126 of 19 December 2003;",
    "24": "Notes the progress aimed at increasing the visibility of the General Assembly in the media and in bringing the priorities of the Assembly to a wider audience, including during the COVID-19 pandemic with a view to ensuring relevance and providing accurate and reliable information to the global public in a timely manner, requests the Department of Global Communications of the Secretariat to continue to take appropriate measures to further enhance public awareness of the role and activities of the Assembly throughout its session in all six official languages, including on as many platforms as possible, requests the Secretary-General and the President of the General Assembly to continue to make efforts to ensure that multilingualism is not undermined by the measures taken in response to the liquidity situation and the COVID-19 pandemic, and requests the Secretariat to continue to explore cost-neutral options to that effect; Working methods",
    "25": "Stresses the desirability of the General Assembly further streamlining its agenda and dedicating more time for dialogue as well as the review of the implementation of the resolutions it adopts;",
    "26": "Reaffirms existing relevant mandates related to the improvement of the working methods of the Main Committees;",
    "27": "Notes the important role of information and communications technologies in carrying out the work of the United Nations, including the General Assembly, on an exceptional basis, during the COVID-19 pandemic, and: (a) Recognizes the use of information and communications technologies in holding interactive inclusive thematic debates during the COVID-19 pandemic, and encourages the President of the General Assembly to be mindful of the proper use of such technologies to ensure full and equal participation of Member States when organizing such events; (b) Requests the Secretariat to brief the Ad Hoc Working Group at the seventy- sixth session of the General Assembly on lessons learned from the COVID-19 pandemic, including the use of information and communications technologies, with a view to ensuring better preparedness in exceptional circumstances;",
    "28": "Requests the Secretariat to brief the Ad Hoc Working Group at the seventy- sixth session of the General Assembly on the implementation of past decisions regarding the streamlining of the agenda of the Assembly to further address the issue of the increasingly overloaded agenda of the Assembly; A/RES/75/325 Revitalization of the work of the General Assembly 21-12804 6/12",
    "29": "Requests each Main Committee to further discuss its working methods, and in this regard invites the Chairs of the Main Committees to continue briefing the Ad Hoc Working Group during the seventy-sixth session on any best practices and lessons learned with a view to improving working methods, and to coordinate their briefings through, inter alia, possible identification of commonalities in the working methods and the lessons learned;",
    "30": "Emphasizes that the General Assembly and its Main Committees, at the seventy-sixth session, in consultation with Member States, should continue their consideration of and make concrete proposals for the further biennialization, triennialization, clustering and elimination of items on the agenda of the Assembly, including through the introduction of a sunset clause, with the clear consent of the sponsoring State or States, taking into account the relevant recommendations of the Ad Hoc Working Group, during the seventy-sixth session of the Assembly, and encourages the General Committee to play a more active role in this regard, in line with the rules of procedure of the Assembly;",
    "31": "Requests each Main Committee to submit to the Ad Hoc Working Group during the seventy-sixth session a written update on progress achieved so far in the efforts aimed at improving the working methods of the Committees, taking into account recommendations of the Ad Hoc Working Group as appropriate, and encourages the Ad Hoc Working Group during the seventy-sixth session to appoint two focal points who would work closely with the Chairs and Bureaux of the Main Committees, the President of the General Assembly and the Secretariat to assist the Co-Chairs of the Ad Hoc Working Group in elaborating practical proposals for consideration by the Working Group for the implementation of paragraphs 29 and 30 of the present resolution and of reports submitted by the Main Committees;",
    "32": "Notes the pilot analysis on Sustainable Development Goal 2 carried out during the seventy-fifth session to examine in depth the coverage of Goal 2 (zero hunger) and the mapping developed during the seventy-third session of the Assembly, along with the pilot analysis, which remain relevant reference documents for the consideration of Member States during the seventy-eighth session of the Assembly;",
    "33": "Recognizes that, when considering Sustainable Development Goals that are not fully covered by intergovernmental bodies, due consideration should be given to addressing these through an integrated approach across the intergovernmental bodies, and not in silos;",
    "34": "Highlights that the COVID-19 pandemic is impacting all Sustainable Development Goals and that dedicated attention by intergovernmental bodies is required to address these impacts, notably on the most affected Goals and resulting gaps, and that it will be important to closely monitor various aspects of the 2030 Agenda to enable governments to respond to the pandemic and its impacts and establish the way forward to build back better and to strengthen international cooperation;",
    "35": "Invites the General Committee, within its mandate, to consider the best possible way to conduct the discussions on the impacts of the COVID-19 pandemic within the agenda of the General Assembly and make recommendations to Member States for their consideration;",
    "36": "Emphasizes that addressing overlaps and duplication in the agendas of the General Assembly and its Main Committees and the Economic and Social Council and its subsidiary bodies will free up time and create space in the agendas and allow resources to be applied effectively, and that this will also allow these bodies to better and more comprehensively address the 2030 Agenda as a whole as well as emerging global issues of an important and urgent nature; Revitalization of the work of the General Assembly A/RES/75/325 7/12 21-12804",
    "37": "Notes that identifying duplication and overlaps in the agendas of the intergovernmental bodies should entail encouraging the General Assembly and its Main Committees and the Economic and Social Council and its subsidiary bodies to examine, on a case-by-case basis, all the resolutions and agenda items that focus on the same area, based on their purpose, relevance and content;",
    "38": "Recognizes, at the same time, that some issues may need to be addressed by different intergovernmental bodies from their own specific perspective and based on their respective mandates, which should be reflected in setting agendas and in the reporting of the Secretary-General, taking due consideration of synergies and mandates of respective resolutions;",
    "39": "Invites the General Assembly and its Main Committees and the Economic and Social Council and its subsidiary bodies to strengthen synergies and complementarities in their respective work and outcomes, in line with resolution 73/341, when covering interrelated issues, as appropriate;",
    "40": "Reaffirms the respective mandates of the Main Committees of the General Assembly, and on that basis, calls upon those Committees to continue their consideration, in consultation with all relevant bodies, of addressing gaps, overlaps and duplication in their respective agendas as they relate to the 2030 Agenda as a whole and, in this regard, invites the Bureaux of the relevant Main Committees of the Assembly and the Economic and Social Council and its subsidiary bodies to facilitate the consideration of the alignment principles by their respective intergovernmental bodies and to present concrete proposals for the consideration of Member States;",
    "41": "Requests the General Committee, while exercising its functions under rule 40 of the rules of procedure of the General Assembly, and within its mandate, to also consider discussing gaps, overlaps and duplication and make recommendations to Member States for consideration;",
    "42": "Encourages the President of the General Assembly and the President of the Economic and Social Council to continue to convene an annual joint briefing, highlighting the connection between agenda items and their interlinkages across the 2030 Agenda;",
    "43": "Also encourages the President of the General Assembly and the President of the Economic and Social Council to facilitate informal joint meetings of the Bureaux of the Main Committees of the Assembly and the Bureau of the Economic and Social Council to discuss how their respective work relates to the implementation of the 2030 Agenda and to ensure synergies among their work and outcomes, as stipulated in resolution 73/341 and the present resolution, on an ongoing basis and in full transparency, including regular reporting on those meetings to the entire membership;",
    "44": "Requests the President of the General Assembly at its seventy-eighth session to draw lessons learned from the implementation of the provisions contained in paragraphs 13 to 18 and 32 to 44 of the present resolution on the revitalization of the work of the Assembly and identify further proposals on alignment, and, in the interim, requests the Ad Hoc Working Group, during both the seventy-sixth and the seventy-seventh sessions, to hold one or two dedicated meetings, as required, on the progress of the implementation of the aforementioned provisions;",
    "45": "Welcomes the increasing number of women candidates nominated for the subsidiary organs of the General Assembly in seeking to promote gender balance, and encourages Member States to continue to do so;",
    "46": "Reiterates the need to continue to produce the Journal of the United Nations in all six official languages in strict compliance with rule 55 of the rules of A/RES/75/325 Revitalization of the work of the General Assembly 21-12804 8/12 procedure of the General Assembly, and in that regard emphasizes the importance of the extension of the information in the Journal published in the six official languages, reiterates its request to the Secretary-General to brief the Ad Hoc Working Group, on a yearly basis, on the progress achieved in this regard, and requests the Secretariat to continue to explore cost-neutral options to that effect;",
    "47": "Requests the Secretariat to continue to improve, harmonize and unify e-services provided to Member States under e-deleGATE with a view to creating a full-fledged delegates\u2019 online workplace in all six official languages in order to save costs, reduce the environmental impact and improve the distribution of documents;",
    "48": "Recognizes the need to have open access to the archive of past statements, and requests the Secretariat to ensure open access, by the end of the seventy-sixth session, to all documents uploaded to PaperSmart and, further, to ensure its replacement with the eStatements module of the Journal of the United Nations;",
    "49": "Reaffirms paragraphs 33 to 37 of resolution 73/341, and requests the Secretariat to brief the Ad Hoc Working Group during the seventy-sixth session of the General Assembly on the progress reached so far and on ways to improve the accessibility of the United Nations Headquarters premises for persons with disabilities;",
    "50": "Recalls the report of the Secretary-General entitled \u201cOpening of the regular sessions of the General Assembly\u201d, submitted pursuant to resolution 72/313 of 17 September 2018,3 and decides, in order to allow more time for the incoming President of the General Assembly and his/her Office to prepare for the general debate, to amend rule 1 of the rules of procedure of the General Assembly to read, effective from the opening of the seventy-eighth session: The General Assembly shall meet every year in regular session commencing on the Tuesday of the second week in September, counting from the first week that contains at least one working day. The general debate in the General Assembly shall open on the Tuesday of the fourth week in September, counting from the first week that contains at least one working day, and shall be held without interruption over a period of nine working days; Selection and appointment of the Secretary-General and other executive heads",
    "51": "Reaffirms the important role played by the Secretary-General in the context of current global challenges and in the implementation of the three pillars of the United Nations, namely, peace and security, human rights and sustainable development;",
    "52": "Reaffirms its commitment to continue, in the Ad Hoc Working Group, in accordance with the provisions of Article 97 of the Charter, its thorough consideration of the issues under the third thematic cluster of the Working Group, on the revitalization of the work of the General Assembly, including the examination of innovative ways to improve the process of selecting and appointing the Secretary- General and other executive heads in all its aspects, and recalls all relevant resolutions, including resolutions 11 (I) of 24 January 1946, 46/77 of 12 December 1991, 47/233 of 17 August 1993, 48/264 of 29 July 1994, 51/241 of 31 July 1997, 52/163 of 15 December 1997, 55/14 of 3 November 2000, 55/285 of 7 September 2001, 56/509 of 8 July 2002, 57/300 of 20 December 2002, 57/301 of 13 March 2003, 58/126 of 19 December 2003, 58/316 of 1 July 2004, 59/313 of 12 September 2005, 60/286 of 8 September 2006, 61/292 of 2 August 2007, 62/276 of 15 September 2008, __________________ 3 A/73/723. Revitalization of the work of the General Assembly A/RES/75/325 9/12 21-12804 63/309 of 14 September 2009, 64/301 of 13 September 2010, 65/315 of 12 September 2011, 66/294 of 17 September 2012, 67/297 of 29 August 2013, 68/307 of 10 September 2014, 69/321 of 11 September 2015, 70/305 of 13 September 2016, 71/323 of 8 September 2017, 72/313 of 17 September 2018 and 73/341 of 12 September 2019, reaffirming the applicable procedures set out in the rules of procedure of the Assembly, in particular rule 141, and acknowledging existing relevant practices of the Assembly;",
    "53": "Encourages future Presidents of the General Assembly to actively contribute to the implementation of provisions guiding the selection and appointment of the next Secretary-General, as contained in all relevant resolutions, in particular resolutions 69/321 and 70/305, and stresses the need for the selection and appointment process of the Secretary-General and other executive heads to be guided by the principles of transparency and inclusiveness;",
    "54": "Welcomes the progress achieved in the selection and appointment process of the Secretary-General in the consensual resolutions 69/321, 70/305, 71/323 and 72/313, in full compliance with the General Assembly mandate under Article 97 of the Charter, and reaffirms previous resolutions referring to gender balance and regional rotation in the course of the identification and appointment of the best well- qualified and experienced candidate for the post of Secretary-General;",
    "55": "Recommends that the President of the General Assembly and the President of the Security Council, in future joint letters on the selection and appointment process of the Secretary-General, encourage Member States to publicize the call for nominations, including with civil society and other stakeholders with the aim of identifying potential candidates;",
    "56": "Decides that, in order to be circulated in a joint letter by the President of the General Assembly and the President of the Security Council pursuant to the process established in resolution 69/321, nominations of candidates must be submitted by at least one Member State, in accordance with the ongoing practice;",
    "57": "Also decides to further assess during the seventy-seventh session of the General Assembly the selection and appointment process of the Secretary-General, to consolidate the advances gained in the relevant Assembly resolutions and to explore possible steps to improve future processes, including the collaboration between the Assembly and the Security Council, consistent with Article 97 of the Charter;",
    "58": "Notes with appreciation the presentation of a vision statement by the incumbent Secretary-General, and the informal dialogue with Member States and observers4 of the General Assembly on its content, including the engagement of civil society in line with the letter dated 26 April 2021 from the President of the General Assembly, and encourages the continuation of such practices;",
    "59": "Reiterates the possibility of providing the process of selection and appointment of the Secretary-General with provisional timelines in accordance with paragraph 72 of its resolution 72/313, and decides to further discuss this issue during its seventy-seventh session in the Ad Hoc Working Group;",
    "60": "Notes that the Secretary-General-designate shall take an oath of office before the General Assembly during a swearing-in ceremony, as detailed in the annex to the present resolution;",
    "61": "Welcomes again the ongoing efforts of the Secretary-General towards achieving equal and fair distribution in terms of the gender and geographical balance of the executive heads of the United Nations system and the Senior Management __________________ 4 See A/INF/75/3/Rev.1. A/RES/75/325 Revitalization of the work of the General Assembly 21-12804 10/12 Group of the Organization, while securing the highest standards of efficiency, competence and integrity, in accordance with Article 101 of the Charter and its resolutions 46/232 of 2 March 1992, 51/241, and 71/263 of 23 December 2016, commends in particular the fact that gender parity was achieved in the Senior Management Group, and requests that further effective measures be taken in this regard;",
    "62": "Supports the request of the Secretary-General for Member States to submit the names and r\u00e9sum\u00e9s of nationals who may be considered for positions of executive heads and senior management of the Secretariat;",
    "63": "Reiterates the need to follow best practices in all senior appointments, including a public call for candidates, including women;",
    "64": "Reaffirms that no post should be considered the exclusive preserve of any Member State or group of States and that the Secretary-General should ensure that this principle is applied faithfully in accordance with the principle of equitable geographical distribution;",
    "65": "Welcomes the fact that gender parity has already been reached in the Senior Management Group, and commends the Secretary-General\u2019s commitment to reach gender parity and to recruit staff on as wide a geographical basis as possible across the United Nations Organization;",
    "66": "Reiterates its request to the Secretary-General that he continue his ongoing efforts to ensure the attainment of equitable geographical distribution in the Secretariat and to ensure as wide a geographical distribution of staff as possible in all departments and offices and at all levels, including at the Director and higher levels, of the Secretariat;",
    "67": "Reiterates the need to ensure equal and fair distribution based on gender balance and as wide a geographical basis as possible, while also being diverse from a multilingual perspective, and in this regard recalls its resolutions 46/232 and 51/241, adopted without a vote, which contain the principles that the highest standards of efficiency, competence and integrity are the paramount considerations in the recruitment and performance of international civil servants, and that candidates\u2019 independence should be considered;",
    "68": "Notes that there is yet to be a woman Secretary-General, and invites Member States to bear this in mind in the future, when nominating candidates for the position of Secretary-General;",
    "69": "Requests the Office of Human Resources of the Secretariat to continue with the practice of providing a briefing to the Ad Hoc Working Group, during the seventy-seventh session of the General Assembly, on the gender and geographical balance of the executive heads of the United Nations system and the Senior Management Group of the Organization, as well as with a breakdown showing those originating from the States that are permanent members of the Security Council; Strengthening the accountability, transparency and institutional memory of the Office of the President of the General Assembly",
    "70": "Emphasizes the important role of the President of the General Assembly within the United Nations Organization, as well as in the overall success of the work of the Assembly;",
    "71": "Invites Member States to equally consider women as candidates for the position of President of the General Assembly, and encourages Presidents-elect to continue to strive for both gender and geographical balance within the Office of the President of the General Assembly; Revitalization of the work of the General Assembly A/RES/75/325 11/12 21-12804",
    "72": "Recalls with appreciation the decision of Member States to fund the transition period, the trust fund in support of the Office of the President of the General Assembly, seconding national staff as well as the convening of annual retreats;",
    "73": "Welcomes the induction programme delivered to the Office of the President of the General Assembly, and calls upon the Secretariat to strengthen the programme through enhanced content and increased delivery time;",
    "74": "Also welcomes the initiatives by Member States to support the strengthening of the efficiency and effectiveness of the Office of the President of the General Assembly, including through the annual General Assembly retreat and a transition workshop that includes the revitalization of the work of the Assembly among its central components;",
    "75": "Recognizes the heavy reliance of the Office of the President of the General Assembly on voluntary contributions to deliver on a growing number of mandates entrusted to it by the Assembly;",
    "76": "Requests the Secretary-General to continue to provide to the President of the General Assembly, within existing resources, adequate administrative, technical, logistical and protocol-related support necessary to effectively execute his or her mandates as president of a principal organ of the United Nations;",
    "77": "Recalls that the activities of the President of the General Assembly have increased continuously and markedly in recent years, also recalls the provisions regarding the support for the Office of the President of the General Assembly in previous resolutions, and expresses continued interest in seeking ways to further support and strengthen the Office in accordance with existing procedures, in particular rule 153 of the rules of procedure of the Assembly;",
    "78": "Requests the Secretariat to provide to the Ad Hoc Working Group during the seventy-seventh session of the General Assembly a written update with recommendations, and a briefing on the functioning of the Office of the President of the General Assembly, as a follow-up to the report of the Task Force convened by the Secretary-General in November 2015 and circulated in the annex to the letter dated 11 March 2016 from the Secretary-General addressed to the President of the General Assembly,5 taking into consideration its previous relevant resolutions;",
    "79": "Requests the Secretary-General to take the measures necessary to preserve and further strengthen the institutional memory of the Office of the President of the General Assembly and the General Assembly revitalization process, through utilizing existing United Nations record-keeping and archiving facilities, in particular in the Dag Hammarskj\u00f6ld Library and the Department of General Assembly and Conference Management and the Department of Global Communications of the Secretariat;",
    "80": "Requests the Secretariat to issue, during the seventy-seventh session, within existing resources, in coordination with the Office of the President of the General Assembly, a compendium of best practices of past Presidents that could serve to contribute to strengthening the institutional memory of the Office;",
    "81": "Emphasizes the importance of a handover report for the institutional memory of the Office of the President of the General Assembly in accordance with resolution 69/321 and other relevant mandates contained in resolutions on the revitalization of the work of the Assembly;",
    "82": "Welcomes the good practice of the organization by the President of the General Assembly of informal interactive dialogues of the Member States, with the __________________ 5 A/70/783. A/RES/75/325 Revitalization of the work of the General Assembly 21-12804 12/12 engagement of civil society, with the candidate(s) for the position of President of the General Assembly based on his or her vision statement. 103rd plenary meeting 10 September 2021 Annex Oath of office of the Secretary-General I, [name], solemnly swear to exercise in all loyalty, discretion and conscience the functions entrusted to me as Secretary-General of the United Nations, to discharge these functions and regulate my conduct with the interests of the United Nations only in view and in accordance with the Charter of the United Nations, without seeking or accepting any instructions in regard to the performance of my duties from any Government or other authority external to the Organization."
  },
  "agenda_items": [
    "Item 126"
  ],
  "symbol_references": []
}