{
  "symbol": "A/RES/79/113",
  "filename": "A_RES_79_113.pdf",
  "title": "79/113. Dissemination of information on decolonization",
  "text": "United Nations \nA/RES/79/113\n \n \nGeneral Assembly \nDistr.: General \n12 December 2024 \n \n24-23523 (E)     \n*2423523* \n \n \nSeventy-ninth session \nAgenda item 58 \nImplementation of the Declaration on the Granting of \nIndependence to Colonial Countries and Peoples \n \n \n \n \n Resolution adopted by the General Assembly \non 4 December 2024 \n \n \n \n \n[on the report of the Special Political and Decolonization Committee \n(Fourth Committee) (A/79/431, para. 33)] \n \n \n \n79/113. Dissemination of information on decolonization \n \n \n \nThe General Assembly, \n \nHaving examined the report of the Special Committee on the Situation with \nregard to the Implementation of the Declaration on the Granting of Independence to \nColonial Countries and Peoples for 2024,1  \n \nRecalling its resolution 1514 (XV) of 14 December 1960, containing the \nDeclaration on the Granting of Independence to Colonial Countries and Peoples, and \nother resolutions and decisions of the United Nations concerning the dissemination \nof information on decolonization, in particular General Assembly resolution 78/100 \nof 7 December 2023, \n \nRecognizing the need for flexible, practical and innovative approaches towards \nreviewing the options for self-determination for the peoples of Non-Self-Governing \nTerritories, with a view to implementing the plan of action for the Fourth International \nDecade for the Eradication of Colonialism, \n \nReiterating the importance of dissemination of information as an instrument for \nfurthering the aims of the Declaration, and mindful of the role of world public opinion \nin effectively assisting the peoples of Non-Self-Governing Territories to achieve self-\ndetermination, \n \nRecognizing the role played by the administering Powers in transmitting \ninformation to the Secretary-General, in accordance with the terms of Article 73 e of \nthe Charter of the United Nations, \n__________________ \n \n1  Official Records of the General Assembly, Seventy-ninth Session, Supplement No. 23 (A/79/23). \n\nA/RES/79/113 \nDissemination of information on decolonization\n \n24-23523\n2/3 \n \n \nStressing the importance of the visiting missions of the Special Committee in \ncontributing substantially to the dissemination of information on decolonization, \n \nRecognizing that the Department of Global Communications of the Secretariat, \nthrough the United Nations information centres, must play a bigger role, in \naccordance with resolutions and decisions of the United Nations, in the dissemination \nof information at the regional level on the activities of the United Nations, \n \nRecalling the issuance by the Department of Public Information of the \nSecretariat, in consultation with the United Nations Development Programme, the \nspecialized agencies and the Special Committee, of an information leaflet on \nassistance programmes available to the Non-Self-Governing Territories, \n \nAware of the role of non-governmental organizations in the dissemination of \ninformation on decolonization, \n \n1. \nApproves the activities in the field of dissemination of information on \ndecolonization undertaken by the Department of Global Communications and the \nDepartment of Political and Peacebuilding Affairs of the Secretariat, in accordance \nwith the relevant resolutions of the United Nations on decolonization, and encourages \nthe continued updating and wide dissemination of the information leaflet on what the \nUnited Nations can do to assist Non-Self-Governing Territories, published in \naccordance with General Assembly resolution 61/129 of 14 December 2006, and \nupdated for the United Nations website on decolonization; \n \n2. \nConsiders it important to continue and expand its efforts to ensure the widest \npossible dissemination of information on decolonization, with particular emphasis on \nthe options for self-determination available for the peoples of Non-Self-Governing \nTerritories, and to this end requests the Department of Global Communications, \nthrough the United Nations information centres in the relevant regions, to actively \nengage and seek new and innovative ways to disseminate material to the Non-Self-\nGoverning Territories; \n \n3. \nRequests the Secretary-General to further enhance the information \nprovided on the United Nations decolonization website and to continue to include the \nfull series of reports of the regional seminars on decolonization, the statements and \nscholarly papers presented at those seminars and links to the full series of reports of \nthe Special Committee on the Situation with regard to the Implementation of the \nDeclaration on the Granting of Independence to Colonial Countries and Peoples, and \nstresses that the Department of Global Communications and the Department of \nPolitical and Peacebuilding Affairs continue to be jointly responsible for maintaining \nand enhancing the United Nations decolonization website; \n \n4. \nRequests the Department of Global Communications to continue its efforts \nto update web-based information on the assistance programmes available to the \nNon-Self-Governing Territories; \n \n5. \nRequests the Department of Global Communications and the Department \nof Political and Peacebuilding Affairs to implement the recommendations of the \nSpecial Committee and to continue their efforts to take measures through all of the \nmedia available, including publications, radio, television, the Internet and social \nmedia, to give publicity to the work of the United Nations in the field of \ndecolonization and, inter alia: \n \n(a) \nTo develop procedures to collect, prepare and disseminate, particularly to \nthe Non-Self-Governing Territories, basic material on the issue of self-determination \nof the peoples of the Territories; \n \n(b) \nTo seek the full cooperation of the administering Powers in the discharge \nof the tasks referred to above; \n\nDissemination of information on decolonization \nA/RES/79/113\n \n3/3\n24-23523 \n \n \n(c) \nTo explore further the idea of a programme of collaboration with the \ndecolonization focal points of territorial Governments, particularly in the Pacific and \nCaribbean regions, to help to improve the exchange of information; \n \n(d) \nTo encourage the involvement of non-governmental organizations in the \ndissemination of information on decolonization; \n \n(e) \nTo encourage the involvement of the Non-Self-Governing Territories in \nthe dissemination of information on decolonization; \n \n(f) \nTo report to the Special Committee on measures taken in the \nimplementation of the present resolution; \n \n6. \nRequests the Department of Global Communications to webcast the formal \nmeetings of the Special Committee; \n \n7. \nRequests all States, including the administering Powers, to accelerate the \ndissemination of information referred to in paragraph 2 above; \n \n8. \nRequests the Special Committee to continue to examine this question and \nto report to the General Assembly at its eightieth session on the implementation of \nthe present resolution. \n \n47th plenary meeting \n4 December 2024 \n \n",
  "paragraphs": {
    "1": "Approves the activities in the field of dissemination of information on decolonization undertaken by the Department of Global Communications and the Department of Political and Peacebuilding Affairs of the Secretariat, in accordance with the relevant resolutions of the United Nations on decolonization, and encourages the continued updating and wide dissemination of the information leaflet on what the United Nations can do to assist Non-Self-Governing Territories, published in accordance with General Assembly resolution 61/129 of 14 December 2006, and updated for the United Nations website on decolonization;",
    "2": "Considers it important to continue and expand its efforts to ensure the widest possible dissemination of information on decolonization, with particular emphasis on the options for self-determination available for the peoples of Non-Self-Governing Territories, and to this end requests the Department of Global Communications, through the United Nations information centres in the relevant regions, to actively engage and seek new and innovative ways to disseminate material to the Non-Self- Governing Territories;",
    "3": "Requests the Secretary-General to further enhance the information provided on the United Nations decolonization website and to continue to include the full series of reports of the regional seminars on decolonization, the statements and scholarly papers presented at those seminars and links to the full series of reports of the Special Committee on the Situation with regard to the Implementation of the Declaration on the Granting of Independence to Colonial Countries and Peoples, and stresses that the Department of Global Communications and the Department of Political and Peacebuilding Affairs continue to be jointly responsible for maintaining and enhancing the United Nations decolonization website;",
    "4": "Requests the Department of Global Communications to continue its efforts to update web-based information on the assistance programmes available to the Non-Self-Governing Territories;",
    "5": " (c) To explore further the idea of a programme of collaboration with the decolonization focal points of territorial Governments, particularly in the Pacific and Caribbean regions, to help to improve the exchange of information; (d) To encourage the involvement of non-governmental organizations in the dissemination of information on decolonization; (e) To encourage the involvement of the Non-Self-Governing Territories in the dissemination of information on decolonization; (f) To report to the Special Committee on measures taken in the implementation of the present resolution;",
    "6": "Requests the Department of Global Communications to webcast the formal meetings of the Special Committee;",
    "7": "Requests all States, including the administering Powers, to accelerate the dissemination of information referred to in paragraph 2 above;",
    "8": "Requests the Special Committee to continue to examine this question and to report to the General Assembly at its eightieth session on the implementation of the present resolution."
  },
  "agenda_items": [
    "Item 58"
  ],
  "symbol_references": []
}