{
  "symbol": "A/RES/73/232",
  "filename": "A_RES_73_232.pdf",
  "title": "73/232. Protection of global climate for present and future generations of humankind",
  "text": "United Nations \nA/RES/73/232\n \n \nGeneral Assembly \nDistr.: General \n11 January 2019 \n \n18-22555 (E)    150119 \n*1822555* \n \n \nSeventy-third session \nAgenda item 20 (d) \n \n \n \n \n Resolution adopted by the General Assembly \non 20 December 2018 \n \n \n \n \n[on the report of the Second Committee (A/73/538/Add.4)] \n \n \n 73/232. Protection of global climate for present and future generations \nof humankind \n \n \n \nThe General Assembly, \n \nRecalling its resolutions 43/53 of 6 December 1988, 54/222 of 22 December \n1999, 62/86 of 10 December 2007, 63/32 of 26 November 2008, 64/73 of 7 December \n2009, 65/159 of 20 December 2010, 66/200 of 22 December 2011, 67/210 of \n21 December 2012, 68/212 of 20 December 2013, 69/220 of 19 December 2014, \n70/205 of 22 December 2015, 71/228 of 21 December 2016 and 72/219 of \n20 December 2017 and other resolutions and decisions relating to the protection of \nthe global climate for present and future generations of humankind, \n \nRecalling also the United Nations Framework Convention on Climate Change 1 \nand the Paris Agreement adopted under the Convention, 2 acknowledging that they are \nthe primary international, intergovernmental forums for negotiating the global \nresponse to climate change, expressing determination to address decisively the threat \nposed by climate change and environmental degradation, recognizing that the global \nnature of climate change calls for the widest possible international cooperation aimed \nat accelerating the reduction of global greenhouse gas emissions and addressing \nadaptation to the adverse impacts of climate change, and noting with concern the \nsignificant gap between the aggregate effect of parties\u2019 mitigation pledges, in \nparticular their nationally determined contributions, as appropriate, and aggregate \nemission pathways, \n \nRecalling further the Paris Agreement, which, pursuant to article 2, paragraph 2, \nthereof, will be implemented to reflect equity and the principle of common but \ndifferentiated responsibilities and respective capabilities, in the light of different \nnational circumstances, \n__________________ \n \n1 United Nations, Treaty Series, vol. 1771, No. 30822. \n \n2 See FCCC/CP/2015/10/Add.1, decision 1/CP.21, annex. \n\nA/RES/73/232 \nProtection of global climate for present and future generations of humankind\n \n18-22555\n2/7 \n \n \nAcknowledging that action on adaptation to climate change is an urgent priority \nand a global challenge faced by all countries, in particular developing countries, \nespecially those that are particularly vulnerable to the adverse effects of climate \nchange, recognizing that the current need for adaptation is significant and that greater \nlevels of mitigation can reduce the need for additional adaptation efforts, and bearing \nin mind that the provision of scaled-up financial resources should aim to achieve a \nbalance between adaptation and mitigation, \n \nWelcoming the convening of the twenty-fourth session of the Conference of the \nParties to the United Nations Framework Convention on Climate Change, the \nfourteenth session of the Conference of the Parties serving as the Meeting of the \nParties to the Kyoto Protocol and the third part of the first session of the Conference \nof the Parties serving as the Meeting of the Parties to the Paris Agreement, in \nKatowice, Poland, from 2 to 14 December 2018, \n \nRecalling the United Nations Millennium Declaration, 3  the Johannesburg \nDeclaration on Sustainable Development 4 and the Plan of Implementation of the \nWorld Summit on Sustainable Development (Johannesburg Plan of Implementation),5 \nthe 2005 World Summit Outcome, 6 the outcome document of the United Nations \nConference on Sustainable Development, held in Rio de Janeiro, Brazil, from 20 to \n22 June 2012, entitled \u201cThe future we want\u201d,7 the outcomes of the sessions of the \nConference of the Parties to the United Nations Framework Convention on Climate \nChange and of the sessions of the Conference of the Parties serving as the Meeting of \nthe Parties to the Kyoto Protocol, the Programme of Action for the Least Developed \nCountries for the Decade 2011\u20132020, adopted at the Fourth United Nations \nConference on the Least Developed Countries, held in Istanbul, Turkey, from 9 to \n13 May 2011,8 the Political Declaration of the Comprehensive High-level Midterm \nReview of the Implementation of the Istanbul Programme of Action for the Least \nDeveloped Countries for the Decade 2011\u20132020, held in Antalya, Turkey, from 27 to \n29 May 2016, 9  the Vienna Programme of Action for Landlocked Developing \nCountries for the Decade 2014\u20132024, adopted at the second United Nations \nConference on Landlocked Developing Countries, held in Vienna from 3 to \n5 November 2014,10 the Programme of Action for the Sustainable Development of \nSmall Island Developing States, 11  the Mauritius Declaration 12  and the Mauritius \nStrategy for the Further Implementation of the Programme of Action for the \nSustainable Development of Small Island Developing States, 13 the SIDS Accelerated \nModalities of Action (SAMOA) Pathway,14 the Sendai Declaration and the Sendai \n__________________ \n \n3 Resolution 55/2. \n \n4 Report of the World Summit on Sustainable Development, Johannesburg, South Africa, \n26 August\u20134 September 2002 (United Nations publication, Sales No. E.03.II.A.1 and \ncorrigendum), chap. I, resolution 1, annex. \n \n5 Ibid., resolution 2, annex. \n \n6 Resolution 60/1. \n \n7 Resolution 66/288, annex. \n \n8 Report of the Fourth United Nations Conference on the Least Developed Countries, Istanbul, \nTurkey, 9\u201313 May 2011 (A/CONF.219/7), chap. II. \n \n9 Resolution 70/294, annex. \n \n10 Resolution 69/137, annex II. \n \n11 Report of the Global Conference on the Sustainable Development of Small Island Developing \nStates, Bridgetown, Barbados, 25 April\u20136 May 1994 (United Nations publication, Sales \nNo. E.94.I.18 and corrigenda), chap. I, resolution 1, annex II. \n \n12 Report of the International Meeting to Review the Implementation of the Programme of Action \nfor the Sustainable Development of Small Island Developing States, Port Louis, Mauritius, \n10\u221214 January 2005 (United Nations publication, Sales No. E.05.II.A.4 and corrigendum), \nchap. I, resolution 1, annex I. \n \n13 Ibid., annex II. \n \n14 Resolution 69/15, annex. \n\nProtection of global climate for present and future generations of humankind \nA/RES/73/232\n \n3/7\n18-22555 \n \nFramework for Disaster Risk Reduction 2015\u20132030,15 the Beijing Declaration and \nPlatform for Action,16 and the New Urban Agenda, adopted at the United Nations \nConference on Housing and Sustainable Urban Development (Habitat III), held in \nQuito from 17 to 20 October 2016,17 \n \nReaffirming its resolution 70/1 of 25 September 2015, entitled \u201cTransforming \nour world: the 2030 Agenda for Sustainable Development\u201d, in which it adopted a \ncomprehensive, far-reaching and people-centred set of universal and transformative \nSustainable Development Goals and targets, its commitment to working tirelessly for \nthe full implementation of the Agenda by 2030, its recognition that eradicating \npoverty in all its forms and dimensions, including extreme poverty, is the greatest \nglobal challenge and an indispensable requirement for sustainable development, its \ncommitment to achieving sustainable development in its three dimensions \u2014 \neconomic, social and environmental \u2014 in a balanced and integrated manner, and to \nbuilding upon the achievements of the Millennium Development Goals and seeking \nto address their unfinished business, \n \nReaffirming also its resolution 69/313 of 27 July 2015 on the Addis Ababa \nAction Agenda of the Third International Conference on Financing for Development, \nwhich is an integral part of the 2030 Agenda for Sustainable Development, supports \nand complements it, helps to contextualize its means of implementation targets with \nconcrete policies and actions, and reaffirms the strong political commitment to \naddress the challenge of financing and creating an enabling environment at all levels \nfor sustainable development in the spirit of global partnership and solidarity, \n \nNoting with concern the findings contained in the special report of the \nIntergovernmental Panel on Climate Change on the impacts of global warming of \n1.5 degrees Celsius above pre-industrial levels and related global greenhouse gas \nemission pathways, in the context of strengthening the global response to the threat \nof climate change, sustainable development and efforts to eradicate poverty, \n \nTaking note of the Green Climate Fund and its initial resource mobilization \nprocess, making it the largest dedicated climate fund, and its approval of 4.6 billion \nUnited States dollars in funding to support the implementation of 93 climate change \nadaptation and mitigation projects and programmes in 96 developing countries, \nreiterating the objectives and guiding principles of the Fund, including a gender-\nsensitive approach in its process and operations, stressing its goal of ensuring efficient \naccess to its resources through simplified approval procedures and enhancing \nreadiness support, which will help to deliver outcomes in developing countries so as \nto limit or reduce greenhouse gas emissions and help them adapt to the impacts of \nclimate change, recognizing that the Board of the Fund decided to launch the process \nfor the first formal replenishment, and emphasizing the importance of having a timely, \nwell-managed and successful process so that the Fund continues to be one of the main \nchannels to enable the flow of financial resources to developing countries under the \nParis Agreement and the United Nations Framework Convention on Climate Change, \n \nRecalling the United Nations strategic plan for forests, 2017\u20132030, 18  and \nacknowledging that all types of forests contribute substantially to climate change \nmitigation and adaptation, \n \nNoting that forests are addressed under the United Nations Framework \nConvention on Climate Change, and noting also article 5 of the Paris Agreement, \n__________________ \n \n15 Resolution 69/283, annexes I and II. \n \n16 Report of the Fourth World Conference on Women, Beijing, 4\u201315 September 1995 (United \nNations publication, Sales No. E.96.IV.13), chap. I, resolution 1, annexes I and II. \n \n17 Resolution 71/256, annex. \n \n18 See resolution 71/285. \n\nA/RES/73/232 \nProtection of global climate for present and future generations of humankind\n \n18-22555\n4/7 \n \n \nNoting the need for enhanced coordination and cooperation at all levels among \nthe parties to and secretariats of the United Nations Framework Convention on \nClimate Change, the United Nations Convention to Combat Desertification in Those \nCountries Experiencing Serious Drought and/or Desertification, Particularly in \nAfrica, 19  and the Convention on Biological Diversity, 20  as appropriate, while \nrespecting their individual mandates, \n \nNoting also the contribution of the United Nations Environment Assembly to \naddressing the challenge of, inter alia, climate change, within its mandate and in \ncollaboration with other relevant organizations and stakeholders, \n \nRecalling its resolution 71/312 of 6 July 2017, entitled \u201cOur ocean, our future: \ncall for action\u201d, \n \nRecognizing that, in undertaking its work, the United Nations should promote \nthe protection of the global climate for the well-being of present and future \ngenerations of humankind, \n \nWelcoming the entry into force on 1 January 2019 of the Kigali Amendment to \nthe Montreal Protocol on Substances that Deplete the Ozone Layer, 21 welcoming also \nits ratification by 59 countries and one regional economic integration organization, \nwhile encouraging further ratifications as soon as possible, and welcoming further the \nThirtieth Meeting of the Parties to the Montreal Protocol, held from 5 to 9 November \n2018 in Quito, \n \nNoting the contribution of the International Civil Aviation Organization to \nglobal efforts to combat climate change, and noting also the contribution of the \nInternational Maritime Organization in this regard, \n \n1. \nReaffirms that climate change is one of the greatest challenges of our time, \nexpresses profound alarm that the emissions of greenhouse gases continue to rise \nglobally, remains deeply concerned that all countries, particularly developing \ncountries, are vulnerable to the adverse impacts of climate change and are already \nexperiencing an increase in such impacts, including persistent drought and extreme \nweather events, land degradation, sea level rise, coastal erosion, ocean acidification \nand the retreat of mountain glaciers, further threatening food security, water \navailability and livelihoods, and efforts to eradicate poverty in all its forms and \ndimensions and achieve sustainable development, recognizes the substantial risks \nposed by climate change to health, and emphasizes in this regard that mitigation of \nand adaptation to climate change represent an immediate and urgent global priority; \n \n2. \nWelcomes the first two sessions of the Conference of the Parties to the \nUnited Nations Framework Convention on Climate Change after the adoption of the \nParis Agreement,2 including the twenty-third session of the Conference of the Parties, \npresided over by the Government of Fiji, in Bonn, Germany, from 6 to 17 November \n2017, and the twenty-second session of the Conference of the Parties to the United \nNations Framework Convention on Climate Change, hosted by the Government of \nMorocco in Marrakech from 7 to 18 November 2016; \n \n3. \nAlso welcomes the Paris Agreement and its early entry into force, on \n4 November 2016, encourages all parties to the Agreement to fully implement the \nAgreement and parties to the United Nations Framework Convention on Climate \nChange1 that have not yet done so to deposit their instruments of ratification, \nacceptance, approval or accession, where appropriate, as soon as possible, and \n__________________ \n \n19 United Nations, Treaty Series, vol. 1954, No. 33480. \n \n20 Ibid., vol. 1760, No. 30619. \n \n21 UNEP/OzL.Pro.28/12, annex I. \n\nProtection of global climate for present and future generations of humankind \nA/RES/73/232\n \n5/7\n18-22555 \n \nhighlights the synergies between the implementation of the 2030 Agenda for \nSustainable Development22 and the Paris Agreement; \n \n4. \nRecalls that the Paris Agreement, in enhancing the implementation of the \nConvention, including its objective, aims to strengthen the global response to the \nthreat of climate change, in the context of sustainable development and efforts to \neradicate poverty, including by holding the increase in the global average temperature \nto well below 2 degrees Celsius above pre-industrial levels and pursuing efforts to \nlimit the temperature increase to 1.5 degrees Celsius above pre-industrial levels, \nrecognizing that this would significantly reduce the risks and impacts of climate \nchange, increasing the ability to adapt to the adverse impacts of climate change and \nfoster climate resilience and low greenhouse gas emissions development in a manner \nthat does not threaten food production, and making finance flows consistent with a \npathway towards low greenhouse gas emissions and climate-resilient development; \n \n5. \nWelcomes the nationally determined contributions submitted to date, and \nrecalls that the regular updating of such contributions will reflect the highest possible \nlevel of ambition, in the light of different national circumstances, and provide the \ninformation necessary for clarity, transparency and understanding, in accordance with \nthe relevant decisions; \n \n6. \nNotes with concern that the nationally determined contributions presented \nthus far by the parties to the Paris Agreement are not sufficient to achieve the long-\nterm temperature goal in article 2, paragraph 1 (a), of the Agreement; \n \n7. \nUrges the completion of the Paris Agreement work programme at the \ntwenty-fourth session of the Conference of the Parties to the United Nations \nFramework Convention on Climate Change, and recognizes the importance of the \nfacilitative dialogue of 2018, known as the Talanoa Dialogue, at the twenty-fourth \nsession as an opportunity to take stock of the collective efforts of parties in relation \nto progress towards the long-term goal referred to in article 4, paragraph 1, of the \nAgreement and to inform the preparation of nationally determined contributions; \n \n8. \nEmphasizes the need for collective efforts to promote sustainable \ndevelopment in its three dimensions in an innovative, coordinated, environmentally \nsound, open and shared manner; \n \n9. \nUnderlines the need to address the economic, social and environmental \nimpacts of climate change, and emphasizes the need for action at all levels, to enhance \nefforts to build resilience through, inter alia, the sustainable management of \necosystems, and to build resilience to reduce the impacts and costs of natural disasters; \n \n10. Recognizes that enhanced access to international climate finance is \nimportant to support mitigation and adaptation efforts in developing countries, \nespecially those that are particularly vulnerable to the adverse effects of climate \nchange, and also recognizes the ongoing efforts in this regard; \n \n11. \nAcknowledges the work undertaken under the auspices of the Marrakech \nPartnership for Global Climate Action,23 and encourages non-party stakeholders to \nscale up their efforts to address and respond to climate change; \n \n12. Looks forward to the climate summit called for by the Secretary-General, \nto be held in New York in 2019, to accelerate global action on climate change; \n \n13. Also looks forward to the convening by the President of the General \nAssembly of the high-level meeting during the seventy-third session of the General \nAssembly on the issue of the protection of the global climate for present and future \n__________________ \n \n22 Resolution 70/1. \n \n23 See FCCC/CP/2016/10/Add.1. \n\nA/RES/73/232 \nProtection of global climate for present and future generations of humankind\n \n18-22555\n6/7 \n \ngenerations of humankind in the context of the economic, social and environmental \ndimensions of the 2030 Agenda for Sustainable Development; \n \n14. Reiterates the resolve of the Conference of the Parties to the Convention, \nas set out in paragraphs 3 and 4 of its decision 1/CP.19, 24 to accelerate the full \nimplementation of the decisions constituting the agreed outcome pursuant to its \ndecision 1/CP.1325 and to enhance ambition in the pre-2020 period in order to ensure \nthe highest possible mitigation efforts under the Convention by all parties; \n \n15. Welcomes the further acceptance or ratification of the Doha Amendment \nto the Kyoto Protocol26 by 117 countries, up from 95 countries one year ago, expresses \nconcern that the Doha Amendment has not yet entered into force, and welcomes the \nefforts of those parties that are already implementing the Doha Amendment prior to \nits entry into force; \n \n16. Takes note of the report of the Executive Secretary of the United Nations \nFramework Convention on Climate Change on the twenty-third session of the \nConference of the Parties to the Convention;27 \n \n17. Recognizes the importance for all countries of averting, minimizing and \naddressing loss and damage associated with the adverse effects of climate change, \nincluding extreme weather events and slow-onset events, and the role of sustainable \ndevelopment in reducing the risk of loss and damage, and in that regard takes note of \nthe establishment of the Warsaw International Mechanism for Loss and Damage \nassociated with Climate Change Impacts, relevant consecutive decisions of the \nConference of the Parties to the Convention and article 8 of the Paris Agreement; \n \n18. Notes with appreciation the hosting by the Government of Poland of the \ntwenty-fourth session of the Conference of the Parties to the Convention, the \nfourteenth session of the Conference of the Parties serving as the Meeting of \nthe Parties to the Kyoto Protocol and the third part of the first session of the \nConference of the Parties serving as the Meeting of the Parties to the Paris Agreement, \nin Katowice, Poland, from 2 to 14 December 2018; \n \n19. Urges Member States, taking into account that women and girls are often \ndisproportionately affected by climate change owing to gender inequalities and the \ndependence of many women on natural resources for their livelihoods, to promote the \nintegration of a gender perspective into environmental and climate change policies \nand to strengthen mechanisms and provide adequate resources towards achieving the \nfull and equal participation of women in decision-making at all levels on \nenvironmental issues, and stresses the need to address the challenges posed by climate \nchange that affect women and girls in particular, including through the \nimplementation of the first gender action plan adopted by the Conference of the \nParties to the United Nations Framework Convention on Climate Change at its \ntwenty-third session, with a view to advancing towards the goal of mainstreaming a \ngender perspective into climate action; \n \n20. Recalls the action plan for integrating sustainable development practices \ninto Secretariat-wide operations and facilities management submitted by the \nSecretary-General28 and endorsed in resolution 72/219, and requests the Secretary-\nGeneral to report on its implementation and improvements achieved to the General \nAssembly at its seventy-fourth session; \n__________________ \n \n24 See FCCC/CP/2013/10/Add.1. \n \n25 See FCCC/CP/2007/6/Add.1. \n \n26 See FCCC/KP/CMP/2012/13/Add.1. \n \n27 A/73/255, sect. I. \n \n28 A/72/82. \n\nProtection of global climate for present and future generations of humankind \nA/RES/73/232\n \n7/7\n18-22555 \n \n \n21. Notes the ongoing work and potential of the local communities and \nindigenous peoples platform of the United Nations Framework Convention on \nClimate Change, established for the exchange of experiences and sharing of best \npractices on mitigation and adaptation in a holistic and integrated manner, and recalls \ndecision 2/CP.23 of the twenty-third session of the Conference of the Parties to the \nConvention on the platform\u2019s purpose and functions;29 \n \n22. Invites the secretariat of the Convention to report, through the Secretary-\nGeneral, to the General Assembly at its seventy-fourth session on the work of the \nConference of the Parties to the Convention, and decides to include, under the item \nentitled \u201cSustainable development\u201d, the sub-item entitled \u201cProtection of global \nclimate for present and future generations of humankind\u201d in the provisional agenda \nof its seventy-fourth session, unless otherwise agreed. \n \n62nd plenary meeting  \n20 December 2018 \n \n__________________ \n \n29 FCCC/CP/2017/11/Add.1. \n",
  "paragraphs": {
    "1": "Reaffirms that climate change is one of the greatest challenges of our time, expresses profound alarm that the emissions of greenhouse gases continue to rise globally, remains deeply concerned that all countries, particularly developing countries, are vulnerable to the adverse impacts of climate change and are already experiencing an increase in such impacts, including persistent drought and extreme weather events, land degradation, sea level rise, coastal erosion, ocean acidification and the retreat of mountain glaciers, further threatening food security, water availability and livelihoods, and efforts to eradicate poverty in all its forms and dimensions and achieve sustainable development, recognizes the substantial risks posed by climate change to health, and emphasizes in this regard that mitigation of and adaptation to climate change represent an immediate and urgent global priority;",
    "2": "Welcomes the first two sessions of the Conference of the Parties to the United Nations Framework Convention on Climate Change after the adoption of the Paris Agreement,2 including the twenty-third session of the Conference of the Parties, presided over by the Government of Fiji, in Bonn, Germany, from 6 to 17 November 2017, and the twenty-second session of the Conference of the Parties to the United Nations Framework Convention on Climate Change, hosted by the Government of Morocco in Marrakech from 7 to 18 November 2016;",
    "3": "Also welcomes the Paris Agreement and its early entry into force, on 4 November 2016, encourages all parties to the Agreement to fully implement the Agreement and parties to the United Nations Framework Convention on Climate Change1 that have not yet done so to deposit their instruments of ratification, acceptance, approval or accession, where appropriate, as soon as possible, and highlights the synergies between the implementation of the 2030 Agenda for Sustainable Development22 and the Paris Agreement;",
    "4": "Recalls that the Paris Agreement, in enhancing the implementation of the Convention, including its objective, aims to strengthen the global response to the threat of climate change, in the context of sustainable development and efforts to eradicate poverty, including by holding the increase in the global average temperature to well below 2 degrees Celsius above pre-industrial levels and pursuing efforts to limit the temperature increase to 1.5 degrees Celsius above pre-industrial levels, recognizing that this would significantly reduce the risks and impacts of climate change, increasing the ability to adapt to the adverse impacts of climate change and foster climate resilience and low greenhouse gas emissions development in a manner that does not threaten food production, and making finance flows consistent with a pathway towards low greenhouse gas emissions and climate-resilient development;",
    "5": "Welcomes the nationally determined contributions submitted to date, and recalls that the regular updating of such contributions will reflect the highest possible level of ambition, in the light of different national circumstances, and provide the information necessary for clarity, transparency and understanding, in accordance with the relevant decisions;",
    "6": "Notes with concern that the nationally determined contributions presented thus far by the parties to the Paris Agreement are not sufficient to achieve the long- term temperature goal in article 2, paragraph 1 (a), of the Agreement;",
    "7": "Urges the completion of the Paris Agreement work programme at the twenty-fourth session of the Conference of the Parties to the United Nations Framework Convention on Climate Change, and recognizes the importance of the facilitative dialogue of 2018, known as the Talanoa Dialogue, at the twenty-fourth session as an opportunity to take stock of the collective efforts of parties in relation to progress towards the long-term goal referred to in article 4, paragraph 1, of the Agreement and to inform the preparation of nationally determined contributions;",
    "8": "Emphasizes the need for collective efforts to promote sustainable development in its three dimensions in an innovative, coordinated, environmentally sound, open and shared manner;",
    "9": "Underlines the need to address the economic, social and environmental impacts of climate change, and emphasizes the need for action at all levels, to enhance efforts to build resilience through, inter alia, the sustainable management of ecosystems, and to build resilience to reduce the impacts and costs of natural disasters;",
    "10": "Recognizes that enhanced access to international climate finance is important to support mitigation and adaptation efforts in developing countries, especially those that are particularly vulnerable to the adverse effects of climate change, and also recognizes the ongoing efforts in this regard;",
    "11": "Acknowledges the work undertaken under the auspices of the Marrakech Partnership for Global Climate Action,23 and encourages non-party stakeholders to scale up their efforts to address and respond to climate change;",
    "12": "Looks forward to the climate summit called for by the Secretary-General, to be held in New York in 2019, to accelerate global action on climate change;",
    "13": "Also looks forward to the convening by the President of the General Assembly of the high-level meeting during the seventy-third session of the General Assembly on the issue of the protection of the global climate for present and future generations of humankind in the context of the economic, social and environmental dimensions of the 2030 Agenda for Sustainable Development;",
    "14": "Reiterates the resolve of the Conference of the Parties to the Convention, as set out in paragraphs 3 and 4 of its decision 1/CP.19, 24 to accelerate the full implementation of the decisions constituting the agreed outcome pursuant to its decision 1/CP.1325 and to enhance ambition in the pre-2020 period in order to ensure the highest possible mitigation efforts under the Convention by all parties;",
    "15": "Welcomes the further acceptance or ratification of the Doha Amendment to the Kyoto Protocol26 by 117 countries, up from 95 countries one year ago, expresses concern that the Doha Amendment has not yet entered into force, and welcomes the efforts of those parties that are already implementing the Doha Amendment prior to its entry into force;",
    "16": "Takes note of the report of the Executive Secretary of the United Nations Framework Convention on Climate Change on the twenty-third session of the Conference of the Parties to the Convention;27",
    "17": "Recognizes the importance for all countries of averting, minimizing and addressing loss and damage associated with the adverse effects of climate change, including extreme weather events and slow-onset events, and the role of sustainable development in reducing the risk of loss and damage, and in that regard takes note of the establishment of the Warsaw International Mechanism for Loss and Damage associated with Climate Change Impacts, relevant consecutive decisions of the Conference of the Parties to the Convention and article 8 of the Paris Agreement;",
    "18": "Notes with appreciation the hosting by the Government of Poland of the twenty-fourth session of the Conference of the Parties to the Convention, the fourteenth session of the Conference of the Parties serving as the Meeting of the Parties to the Kyoto Protocol and the third part of the first session of the Conference of the Parties serving as the Meeting of the Parties to the Paris Agreement, in Katowice, Poland, from 2 to 14 December 2018;",
    "19": "Urges Member States, taking into account that women and girls are often disproportionately affected by climate change owing to gender inequalities and the dependence of many women on natural resources for their livelihoods, to promote the integration of a gender perspective into environmental and climate change policies and to strengthen mechanisms and provide adequate resources towards achieving the full and equal participation of women in decision-making at all levels on environmental issues, and stresses the need to address the challenges posed by climate change that affect women and girls in particular, including through the implementation of the first gender action plan adopted by the Conference of the Parties to the United Nations Framework Convention on Climate Change at its twenty-third session, with a view to advancing towards the goal of mainstreaming a gender perspective into climate action;",
    "20": "Recalls the action plan for integrating sustainable development practices into Secretariat-wide operations and facilities management submitted by the Secretary-General28 and endorsed in resolution 72/219, and requests the Secretary- General to report on its implementation and improvements achieved to the General Assembly at its seventy-fourth session;",
    "21": "Notes the ongoing work and potential of the local communities and indigenous peoples platform of the United Nations Framework Convention on Climate Change, established for the exchange of experiences and sharing of best practices on mitigation and adaptation in a holistic and integrated manner, and recalls decision 2/CP.23 of the twenty-third session of the Conference of the Parties to the Convention on the platform\u2019s purpose and functions;29",
    "22": "Invites the secretariat of the Convention to report, through the Secretary- General, to the General Assembly at its seventy-fourth session on the work of the Conference of the Parties to the Convention, and decides to include, under the item entitled \u201cSustainable development\u201d, the sub-item entitled \u201cProtection of global climate for present and future generations of humankind\u201d in the provisional agenda of its seventy-fourth session, unless otherwise agreed."
  },
  "agenda_items": [
    "Item 20"
  ],
  "symbol_references": []
}