{
  "symbol": "A/RES/74/195",
  "filename": "A_RES_74_195.pdf",
  "title": "74/195. Report of the Committee on Relations with the Host Country",
  "text": "United Nations \nA/RES/74/195\n \n \nGeneral Assembly \nDistr.: General \n30 December 2019 \n \n19-22404 (E)    090120 \n*1922404* \n \n \nSeventy-fourth session \nAgenda item 165 \nReport of the Committee on Relations with the Host \nCountry \n \n \n \n \n Resolution adopted by the General Assembly \non 18 December 2019 \n \n \n \n \n[on the report of the Sixth Committee (A/74/434)] \n \n \n 74/195. Report of the Committee on Relations with the Host Country \n \n \n \nThe General Assembly, \n \nHaving considered the report of the Committee on Relations with the Host \nCountry,1 \n \nRecalling Article 105 of the Charter of the United Nations, the Convention on \nthe Privileges and Immunities of the United Nations, 2 the Agreement between the \nUnited Nations and the United States of America regarding the Headquarters of the \nUnited Nations, 3  the Vienna Convention on Diplomatic Relations 4  and the \nresponsibilities of the host country, \n \nRecalling also that, in accordance with paragraph 7 of General Assembly \nresolution 2819 (XXVI) of 15 December 1971, the Committee should consider, and \nadvise the host country on, issues arising in connection with the implementation of \nthe Headquarters Agreement, \n \nRecognizing that effective measures should continue to be taken by the \ncompetent authorities of the host country, in particular to prevent any acts violating \nthe security of missions and the safety of their personnel, \n \nRecognizing also that the Headquarters Agreement provides that it shall be \nconstrued in the light of its primary purpose to enable the United Nations at its \nheadquarters in the United States, fully and efficiently, to discharge its responsibilities \nand fulfil its purposes, \n__________________ \n \n1  Official Records of the General Assembly, Seventy-fourth Session, Supplement No. 26 (A/74/26). \n \n2  Resolution 22 A (I). \n \n3  See resolution 169 (II). \n \n4  United Nations, Treaty Series, vol. 500, No. 7310. \n\nA/RES/74/195 \nReport of the Committee on Relations with the Host Country\n \n19-22404\n2/4 \n \n \nEmphasizing that the Convention on the Privileges and Immunities of the United \nNations does not distinguish between permanent and visiting representatives, \n \n1. \nEndorses the recommendations and conclusions of the Committee on \nRelations with the Host Country contained in paragraph 165 of its report; 1 \n \n2. \nConsiders that the maintenance of appropriate conditions for the normal \nwork of the delegations and the missions accredited to the United Nations and the \nobservance of their privileges and immunities, which cannot be subject to any \nrestrictions arising from the bilateral relations of the host country, are in the interest \nof the United Nations and all Member States, takes seriously the increasing number \nof concerns raised by permanent missions regarding the normal performance of their \nfunctions, notes that the Committee expresses its readiness to effectively address them \nand expects that all issues raised at its meetings will be duly settled expeditiously, in \na spirit of cooperation and in accordance with international law, requests the host \ncountry to continue to solve, through negotiations, problems that might arise and to \ntake all measures necessary to prevent any interference with the functioning of \nmissions, and urges the host country to continue to take appropriate action, such as \nthe training of police, security, customs and border control officers, with a view to \nmaintaining respect for diplomatic privileges and immunities and, if violations occur, \nto ensure that such cases are properly investigated and remedied, in accordance with \napplicable law; \n \n3. \nRecalls the privileges and immunities applicable to the premises of the \npermanent missions to the United Nations enjoyed under international law, in \nparticular the instruments listed in paragraph 165 (a) of the report of the Committee, \nand the obligations of the host country to observe such privileges and immunities, \ntakes note of the alleged ongoing violations thereof by the host country and of the \nrepeated concerns expressed thereon, urges the host country to remove without delay \nany restrictions applied to the premises of a Permanent Mission inconsistent with \nthose privileges and immunities, and in that regard to ensure respect for such \nprivileges and immunities, takes seriously the lack of resolution of these matters and \nthe concerns expressed about such lack of resolution, remains seized of these matters, \nand anticipates that they shall be duly addressed in a spirit of cooperation and in \naccordance with international law; \n \n4. \nAlso recalls that, prior to the institution by the host country of any \nproceedings that require any person referred to in article IV, section 11, of the \nAgreement between the United Nations and the United States of America regarding \nthe Headquarters of the United Nations,3 including representatives of a Member State, \nto leave the host country, article IV, section 13 (b) (1) of the Headquarters Agreement, \ninter alia, requires the host country to consult with the Member State, the Secretary-\nGeneral or other principal executive officer, as appropriate, and considers that, given \nthe seriousness of any such measure being exercised by the host country, the \nconsultation should be meaningful; \n \n5. \nNotes the problems experienced by some permanent missions to the United \nNations in connection with the implementation of the Parking Programme for \nDiplomatic Vehicles,5 and notes that the Committee shall remain seized of the matter, \nwith a view to continuing to maintain the proper implementation of the Parking \nProgramme in a manner that is fair, non-discriminatory, effective and therefore \nconsistent with international law; \n \n6. \nUrges the host country to remove all remaining travel restrictions imposed \nby it on staff of certain missions and staff members of the Secretariat of certain \nnationalities, and in this regard takes seriously the more stringent travel restrictions \n__________________ \n \n5  A/AC.154/355, annex. \n\nReport of the Committee on Relations with the Host Country \nA/RES/74/195\n \n3/4\n19-22404 \n \nimposed on the permanent and visiting representatives of two Missions and the \nstatements of affected delegations that travel restrictions impede their ability to carry \nout their functions, restrict their access to services and their choice of residence, and \nnegatively impact their families, and notes the long-standing positions of affected \nStates, of the Secretary-General as set out in the statement of the Legal Counsel, in \ndocument A/AC.154/415, according to which, inter alia, \u201cthere is no room for the \napplication of measures based on reciprocity in the treatment accorded to permanent \nmissions accredited to the United Nations in New York\u201d, and of the host country; \n \n7. \nRecalls article IV of the Headquarters Agreement, notes the concerns \nexpressed by some delegations concerning the denial and delay of entry visas to \nrepresentatives of Member States, and further notes that the Committee remains \nseized of an increasing number of entry visa-related issues raised at its meetings and \nstresses that these issues should be duly resolved in a spirit of cooperation and in \naccordance with international law, including the Headquarters Agreement; \n \n8. \nExpresses serious concern regarding the non-issuance of entry visas to \ncertain representatives of certain Member States and takes note of the statement of \nthe Legal Counsel at the emergency, 295th, meeting of the Committee, set out in \ndocument A/AC.154/415, where he confirmed that the legal position regarding the \nhost country\u2019s obligations with respect to the issuance of visas to persons covered by \nthe Headquarters Agreement remains unchanged from that which was provided by the \nthen Legal Counsel to the Committee in 1988, set out in document A/C.6/43/7, \naccording to which, inter alia, \u201cthe Headquarters Agreement makes it clear that there \nis an unrestricted right of persons mentioned in section 11 to enter the United States \nfor the purpose of proceeding to the Headquarters district\u201d; \n \n9. \nExpects the prompt issuance by the host country of entry visas to all \nrepresentatives of Member States and members of the Secretariat pursuant to \narticle IV, section 11, of the Headquarters Agreement, in a timely manner, to enable \npersons assigned as members of permanent missions or recruited to serve in the \nSecretariat to take up their assignments as promptly as possible and to enable \nrepresentatives of Member States to travel to New York on United Nations business, \nand notes that the Committee anticipates that the host country will continue to \nenhance efforts, including visa issuance, to facilitate the participation of \nrepresentatives of Member States in other United Nations meetings, as appropriate; \n \n10. Notes that a number of delegations have requested shortening the time \nframe applied by the host country for issuance of entry visas to representatives of \nMember States since the time frame poses difficulties for the full-fledged \nparticipation of Member States in United Nations meetings, and invites the host \ncountry to inform the Committee, as appropriate, of efforts to address such \ndifficulties, and also notes that the Committee calls upon the host country to review \nits differing processes of granting visas to the personnel of certain missions, with \nparticular attention to single-entry visas; \n \n11. \nNotes with concern the difficulties experienced by some permanent \nmissions to the United Nations in obtaining suitable banking services, and welcomes \nthe continued efforts of the host country to facilitate the opening of bank accounts for \nthose permanent missions; \n \n12. Stresses the need for the permanent missions and the United Nations to \nbenefit from appropriate banking services, and anticipates that the host country will \ncontinue to assist the permanent missions accredited to the United Nations and their \nstaff in obtaining such services; \n\nA/RES/74/195 \nReport of the Committee on Relations with the Host Country\n \n19-22404\n4/4 \n \n \n13. Expresses its appreciation for the efforts made, and expects that the issues \nraised at the meetings of the Committee will be resolved in a spirit of cooperation and \nin accordance with international law, including the Headquarters Agreement; \n \n14. Affirms the importance of the Committee being in a position to fulfil its \nmandate and meet on short notice to deal with urgent and important matters \nconcerning the relations between the United Nations and the host country, and in that \nconnection requests the Secretariat and the Committee on Conferences to accord \npriority to requests from the Committee on Relations with the Host Country for \nconference-servicing facilities for meetings of that Committee that must be held while \nthe General Assembly and its Main Committees are meeting, without prejudice to the \nrequirements of those bodies and on an \u201cas available\u201d basis; \n \n15. Requests the Secretary-General to remain actively engaged in all aspects \nof the relations of the United Nations with the host country and to more actively \nengage in the work of the Committee with a view to ensuring the representation of \nthe interests concerned, in accordance with General Assembly resolution \n2819 (XXVI), and in this regard takes note of the statement of the Legal Counsel at \nthe emergency, 295th, meeting of the Committee, as set out in document \nA/AC.154/415, and considers that if the issues raised in the report of the Committee \non Relations with the Host Country1 are not resolved in a reasonable and finite period \nof time, serious consideration will be given to taking steps under section 21 of the \nHeadquarters Agreement, and further recalls that the Secretary-General may bring to \nthe attention of the Committee issues of mutual concern relating to the \nimplementation of the Headquarters Agreement and the Convention on the Privileges \nand Immunities of the United Nations;2 \n \n16. Requests the Committee to continue its work in conformity with General \nAssembly resolution 2819 (XXVI) and, in this framework, to continue to consider \nadditional appropriate measures to enhance the work of the Committee and its \neffectiveness and to make recommendations in its report to the General Assembly at \nits seventy-fifth session; \n \n17. Decides to include in the provisional agenda of its seventy-fifth session \nthe item entitled \u201cReport of the Committee on Relations with the Host Country\u201d. \n \n51st plenary meeting \n18 December 2019 \n \n",
  "paragraphs": {
    "1": "Endorses the recommendations and conclusions of the Committee on Relations with the Host Country contained in paragraph 165 of its report; 1",
    "2": "Considers that the maintenance of appropriate conditions for the normal work of the delegations and the missions accredited to the United Nations and the observance of their privileges and immunities, which cannot be subject to any restrictions arising from the bilateral relations of the host country, are in the interest of the United Nations and all Member States, takes seriously the increasing number of concerns raised by permanent missions regarding the normal performance of their functions, notes that the Committee expresses its readiness to effectively address them and expects that all issues raised at its meetings will be duly settled expeditiously, in a spirit of cooperation and in accordance with international law, requests the host country to continue to solve, through negotiations, problems that might arise and to take all measures necessary to prevent any interference with the functioning of missions, and urges the host country to continue to take appropriate action, such as the training of police, security, customs and border control officers, with a view to maintaining respect for diplomatic privileges and immunities and, if violations occur, to ensure that such cases are properly investigated and remedied, in accordance with applicable law;",
    "3": "Recalls the privileges and immunities applicable to the premises of the permanent missions to the United Nations enjoyed under international law, in particular the instruments listed in paragraph 165 (a) of the report of the Committee, and the obligations of the host country to observe such privileges and immunities, takes note of the alleged ongoing violations thereof by the host country and of the repeated concerns expressed thereon, urges the host country to remove without delay any restrictions applied to the premises of a Permanent Mission inconsistent with those privileges and immunities, and in that regard to ensure respect for such privileges and immunities, takes seriously the lack of resolution of these matters and the concerns expressed about such lack of resolution, remains seized of these matters, and anticipates that they shall be duly addressed in a spirit of cooperation and in accordance with international law;",
    "4": "Also recalls that, prior to the institution by the host country of any proceedings that require any person referred to in article IV, section 11, of the Agreement between the United Nations and the United States of America regarding the Headquarters of the United Nations,3 including representatives of a Member State, to leave the host country, article IV, section 13 (b) (1) of the Headquarters Agreement, inter alia, requires the host country to consult with the Member State, the Secretary- General or other principal executive officer, as appropriate, and considers that, given the seriousness of any such measure being exercised by the host country, the consultation should be meaningful;",
    "5": "Notes the problems experienced by some permanent missions to the United Nations in connection with the implementation of the Parking Programme for Diplomatic Vehicles,5 and notes that the Committee shall remain seized of the matter, with a view to continuing to maintain the proper implementation of the Parking Programme in a manner that is fair, non-discriminatory, effective and therefore consistent with international law;",
    "6": "Urges the host country to remove all remaining travel restrictions imposed by it on staff of certain missions and staff members of the Secretariat of certain nationalities, and in this regard takes seriously the more stringent travel restrictions imposed on the permanent and visiting representatives of two Missions and the statements of affected delegations that travel restrictions impede their ability to carry out their functions, restrict their access to services and their choice of residence, and negatively impact their families, and notes the long-standing positions of affected States, of the Secretary-General as set out in the statement of the Legal Counsel, in document A/AC.154/415, according to which, inter alia, \u201cthere is no room for the application of measures based on reciprocity in the treatment accorded to permanent missions accredited to the United Nations in New York\u201d, and of the host country;",
    "7": "Recalls article IV of the Headquarters Agreement, notes the concerns expressed by some delegations concerning the denial and delay of entry visas to representatives of Member States, and further notes that the Committee remains seized of an increasing number of entry visa-related issues raised at its meetings and stresses that these issues should be duly resolved in a spirit of cooperation and in accordance with international law, including the Headquarters Agreement;",
    "8": "Expresses serious concern regarding the non-issuance of entry visas to certain representatives of certain Member States and takes note of the statement of the Legal Counsel at the emergency, 295th, meeting of the Committee, set out in document A/AC.154/415, where he confirmed that the legal position regarding the host country\u2019s obligations with respect to the issuance of visas to persons covered by the Headquarters Agreement remains unchanged from that which was provided by the then Legal Counsel to the Committee in 1988, set out in document A/C.6/43/7, according to which, inter alia, \u201cthe Headquarters Agreement makes it clear that there is an unrestricted right of persons mentioned in section 11 to enter the United States for the purpose of proceeding to the Headquarters district\u201d;",
    "9": "Expects the prompt issuance by the host country of entry visas to all representatives of Member States and members of the Secretariat pursuant to article IV, section 11, of the Headquarters Agreement, in a timely manner, to enable persons assigned as members of permanent missions or recruited to serve in the Secretariat to take up their assignments as promptly as possible and to enable representatives of Member States to travel to New York on United Nations business, and notes that the Committee anticipates that the host country will continue to enhance efforts, including visa issuance, to facilitate the participation of representatives of Member States in other United Nations meetings, as appropriate;",
    "10": "Notes that a number of delegations have requested shortening the time frame applied by the host country for issuance of entry visas to representatives of Member States since the time frame poses difficulties for the full-fledged participation of Member States in United Nations meetings, and invites the host country to inform the Committee, as appropriate, of efforts to address such difficulties, and also notes that the Committee calls upon the host country to review its differing processes of granting visas to the personnel of certain missions, with particular attention to single-entry visas;",
    "11": "Notes with concern the difficulties experienced by some permanent missions to the United Nations in obtaining suitable banking services, and welcomes the continued efforts of the host country to facilitate the opening of bank accounts for those permanent missions;",
    "12": "",
    "13": "Expresses its appreciation for the efforts made, and expects that the issues raised at the meetings of the Committee will be resolved in a spirit of cooperation and in accordance with international law, including the Headquarters Agreement;",
    "14": "Affirms the importance of the Committee being in a position to fulfil its mandate and meet on short notice to deal with urgent and important matters concerning the relations between the United Nations and the host country, and in that connection requests the Secretariat and the Committee on Conferences to accord priority to requests from the Committee on Relations with the Host Country for conference-servicing facilities for meetings of that Committee that must be held while the General Assembly and its Main Committees are meeting, without prejudice to the requirements of those bodies and on an \u201cas available\u201d basis;",
    "15": "Requests the Secretary-General to remain actively engaged in all aspects of the relations of the United Nations with the host country and to more actively engage in the work of the Committee with a view to ensuring the representation of the interests concerned, in accordance with General Assembly resolution 2819 (XXVI), and in this regard takes note of the statement of the Legal Counsel at the emergency, 295th, meeting of the Committee, as set out in document A/AC.154/415, and considers that if the issues raised in the report of the Committee on Relations with the Host Country1 are not resolved in a reasonable and finite period of time, serious consideration will be given to taking steps under section 21 of the Headquarters Agreement, and further recalls that the Secretary-General may bring to the attention of the Committee issues of mutual concern relating to the implementation of the Headquarters Agreement and the Convention on the Privileges and Immunities of the United Nations;2",
    "16": "Requests the Committee to continue its work in conformity with General Assembly resolution 2819 (XXVI) and, in this framework, to continue to consider additional appropriate measures to enhance the work of the Committee and its effectiveness and to make recommendations in its report to the General Assembly at its seventy-fifth session;",
    "17": "Decides to include in the provisional agenda of its seventy-fifth session the item entitled \u201cReport of the Committee on Relations with the Host Country\u201d."
  },
  "agenda_items": [
    "Item 165"
  ],
  "symbol_references": []
}