{
  "symbol": "A/RES/74/50",
  "filename": "A_RES_74_50.pdf",
  "title": "74/50. Nuclear disarmament verification",
  "text": "United Nations \nA/RES/74/50\n \n \nGeneral Assembly \nDistr.: General \n19 December 2019 \n \n19-21838 (E)    311219 \n*1921838* \n \n \nSeventy-fourth session \nAgenda item 98 (hh) \nGeneral and complete disarmament: nuclear \ndisarmament verification \n \n \n \n \n Resolution adopted by the General Assembly \non 12 December 2019 \n \n \n \n \n[on the report of the First Committee (A/74/368)] \n \n \n \n74/50. Nuclear disarmament verification \n \n \n \nThe General Assembly, \n \nRecalling the fundamental principles for disarmament negotiations set forth in \nthe Final Document of the Tenth Special Session of the General Assembly, the first \nspecial session devoted to disarmament,1 and the general principles of verification set \nforth in the United Nations Disarmament Commission principles of verification of \n1988,2 without prejudice to the mandate of the Conference on Disarmament, \n \nRecalling also its resolution 71/67 of 5 December 2016, in which it, inter alia, \nrequested the Secretary-General to seek the views of Member States and to establish \na group of governmental experts to consider the role of verification in advancing \nnuclear disarmament, \n \nReaffirming the shared commitment to further progress in nuclear disarmament \nand non-proliferation, \n \nConvinced that, while verification is not an aim in itself, further development \nof the multilateral disarmament verification capabilities will be required to provide \nassurance of compliance with multilateral nuclear disarmament agreements for the \nachievement and maintenance of a world without nuclear weapons, \n \nWelcoming the report of the Secretary-General,3 \n \nRecognizing the pioneering nature of the work of the Group of Governmental \nExperts on Nuclear Disarmament Verification, as this represents the first time that the \nGeneral Assembly established a body specifically to discuss nuclear disarmament \n__________________ \n \n1 Resolution S-10/2. \n \n2 See Official Records of the General Assembly, Fifteenth Special Session, Supplement No. 3 \n(A/S-15/3), para. 60 (para. 6, sect. I, of the quoted text). \n \n3 A/72/304. \n\nA/RES/74/50 \nNuclear disarmament verification\n \n19-21838\n2/3 \n \nverification, and recognizing also the need for further work related to the role of \nverification in advancing nuclear disarmament, taking into account the report of the \nGroup,4 \n \nNoting that a credible multilateral verification regime in which all States have \nconfidence will also be essential for achieving and maintaining a world without \nnuclear weapons, \n \nNoting also that capacity-building on nuclear disarmament verification is a \nvaluable component in the nuclear disarmament process and also one of the \nfundamental factors determining whether the goal of verification could be effectively \nupheld, and noting further that building capacity on nuclear disarmament verification \nin a sustainable manner is not only of great significance, but also faced with practical \nchallenges, \n \nRecognizing that nuclear disarmament verification must be balanced against \nlegitimate sovereignty-, security-, safety- and proliferation-related concerns of the \nparties to or participants in an agreement or arrangement in this area, \n \nNoting the contribution of representatives of civil society from the \nnon-governmental, academic and research communities, \n \n1. \nWelcomes the adoption by consensus of the report of the Group of \nGovernmental Experts on Nuclear Disarmament Verification, mandated in \nresolution 71/67;4 \n \n2. \nRequests the Secretary-General to seek the substantive views of Member \nStates on the report of the Group of Governmental Experts on Nuclear Disarmament \nVerification and to report back to the General Assembly at its seventy-fifth session; \n \n3. \nEncourages the Conference on Disarmament and the Disarmament \nCommission to address nuclear disarmament verification, including through \nsubstantive consideration of the report of the Group of Governmental Experts on \nNuclear Disarmament Verification; \n \n4. \nWelcomes efforts for capacity-building on nuclear disarmament \nverification; \n \n5. \nEncourages further work on nuclear disarmament verification, taking into \naccount the report of the Group of Governmental Experts on Nuclear Disarmament \nVerification; \n \n6. \nRequests the Secretary-General to establish a group of governmental \nexperts of up to 25 participants, chosen on the basis of equitable geographical \nrepresentation and equitable representation of women and men, which will meet in \nGeneva for four sessions of one week each in 2021 and 2022, to further consider \nnuclear disarmament verification issues, including, inter alia, the concept of a Group \nof Scientific and Technical Experts, building on the report of the Group of \nGovernmental Experts on Nuclear Disarmament Verification4 and the views of \nMember States referred to in paragraph 2 above; \n \n7. \nRequests the Chair of the group of governmental experts to organize, in \nNew York, two informal intersessional consultative meetings, open-ended so that all \nMember States can engage in interactive discussions and share their views, which the \nChair shall convey to the group of governmental experts for its consideration; \n__________________ \n \n4 A/74/90. \n\nNuclear disarmament verification \nA/RES/74/50\n \n3/3\n19-21838 \n \n \n8. \nRequests the Secretary-General to render all necessary assistance to the \ngroup of governmental experts and its Chair, including the provision of relevant \ndocuments; \n \n9. \nCalls upon the Secretary-General to transmit the report of the group of \ngovernmental experts to the General Assembly at its seventy-seventh session and to \nthe Conference on Disarmament; \n \n10. Decides to include in the provisional agenda of its seventy-fifth session, \nunder the item entitled \u201cGeneral and complete disarmament\u201d, the sub-item entitled \n\u201cNuclear disarmament verification\u201d. \n \n46th plenary meeting \n12 December 2019 \n \n",
  "paragraphs": {
    "1": "Welcomes the adoption by consensus of the report of the Group of Governmental Experts on Nuclear Disarmament Verification, mandated in resolution 71/67;4",
    "2": "Requests the Secretary-General to seek the substantive views of Member States on the report of the Group of Governmental Experts on Nuclear Disarmament Verification and to report back to the General Assembly at its seventy-fifth session;",
    "3": "Encourages the Conference on Disarmament and the Disarmament Commission to address nuclear disarmament verification, including through substantive consideration of the report of the Group of Governmental Experts on Nuclear Disarmament Verification;",
    "4": "Welcomes efforts for capacity-building on nuclear disarmament verification;",
    "5": "Encourages further work on nuclear disarmament verification, taking into account the report of the Group of Governmental Experts on Nuclear Disarmament Verification;",
    "6": "Requests the Secretary-General to establish a group of governmental experts of up to 25 participants, chosen on the basis of equitable geographical representation and equitable representation of women and men, which will meet in Geneva for four sessions of one week each in 2021 and 2022, to further consider nuclear disarmament verification issues, including, inter alia, the concept of a Group of Scientific and Technical Experts, building on the report of the Group of Governmental Experts on Nuclear Disarmament Verification4 and the views of Member States referred to in paragraph 2 above;",
    "7": "Requests the Chair of the group of governmental experts to organize, in New York, two informal intersessional consultative meetings, open-ended so that all Member States can engage in interactive discussions and share their views, which the Chair shall convey to the group of governmental experts for its consideration; __________________ 4 A/74/90. Nuclear disarmament verification A/RES/74/50 3/3 19-21838",
    "8": "Requests the Secretary-General to render all necessary assistance to the group of governmental experts and its Chair, including the provision of relevant documents;",
    "9": "Calls upon the Secretary-General to transmit the report of the group of governmental experts to the General Assembly at its seventy-seventh session and to the Conference on Disarmament;",
    "10": "Decides to include in the provisional agenda of its seventy-fifth session, under the item entitled \u201cGeneral and complete disarmament\u201d, the sub-item entitled \u201cNuclear disarmament verification\u201d. 46th plenary meeting 12 December 2019"
  },
  "agenda_items": [
    "Item 98"
  ],
  "symbol_references": []
}