{
  "symbol": "A/RES/72/115",
  "filename": "A_RES_72_115.pdf",
  "title": "72/115. United Nations Programme of Assistance in the Teaching, Study, Dissemination and Wider Appreciation of International Law",
  "text": "United Nations \nA/RES/72/115\n \n \nGeneral Assembly \nDistr.: General \n18 December 2017 \n \n17-22153 (E)    201217 \n*1722153* \n \n \nSeventy-second session \nAgenda item 80 \n \n \n \n \n Resolution adopted by the General Assembly \non 7 December 2017 \n \n \n \n \n[on the report of the Sixth Committee (A/72/459)] \n \n \n \n72/115. United Nations Programme of Assistance in the Teaching, Study, \nDissemination and Wider Appreciation of International Law  \n \n \n \nThe General Assembly,  \n \nRecalling its resolution 2099 (XX) of 20 December 1965, in which the General \nAssembly established the United Nations Programme of Assistance in the Teaching, \nStudy, Dissemination and Wider Appreciation of International Law to contribute \ntowards a better knowledge of international law as a means of strengthening \ninternational peace and security and promoting friendly relations and cooperation \namong States,  \n \nReaffirming that the Programme of Assistance is a core activity of the United \nNations and that it has provided the foundation for the efforts of the United Nations \nto promote a better knowledge of international law for more than half a century,  \n \nRecognizing the major contribution of the Programme of Assistance to the \nteaching and dissemination of international law for the benefit of lawyers in all \ncountries, legal systems and regions of the world for more than half a century and \nthe importance of ensuring the successful continuation of the Programme for the \nbenefit of present and future generations of lawyers,  \n \nEmphasizing the important contribution of the Programme of Assistance, in \nparticular the United Nations Regional Courses in International Law and the United \nNations Audiovisual Library of International Law, to the furtherance of United \nNations rule of law programmes and activities,  \n \nReaffirming that the increasing demand for international law training and \ndissemination activities creates new challenges for the Programme of Assistance,  \n \nRecognizing the importance of the Programme of Assistance effectively \nreaching its beneficiaries, including with regard to languages, while bearing in mind \nlimitations on available resources,  \n\nA/RES/72/115 \nUnited Nations Programme of Assistance in the Teaching, Study,\nDissemination and Wider Appreciation of International Law\n \n17-22153 \n2/5 \n \n \nTaking note with appreciation of the report of the Secretary-General on the \nimplementation of the Programme of Assistance1 and the views of the Advisory \nCommittee on the United Nations Programme of Assistance in the Teaching, Study, \nDissemination and Wider Appreciation of International Law, which are contained in \nthe report,  \n \nNoting with satisfaction that resources have been provided under the \nprogramme budget for the organization of the United Nations Regional Courses in \nInternational Law on an annual basis and the further development of the United \nNations Audiovisual Library of International Law,  \n \nWelcoming the organization, for the first time in the history of the Programme \nof Assistance, of all three of the United Nations Regional Courses in International \nLaw for Africa, for Asia-Pacific and for Latin America and the Caribbean in two \nconsecutive years,  \n \nNoting with regret that, owing to insufficient voluntary contributions to the \nHamilton Shirley Amerasinghe Memorial Fellowship on the Law of the Sea, in 2017 \nan abbreviated award was made, consisting of a placement at the Division for Ocean \nAffairs and the Law of the Sea of the Office of Legal Affairs of the Secretariat, \nwithout the traditional subsequent six-month research/study phase at an institution \nof higher learning,  \n \nConsidering that international law should occupy an appropriate place in the \nteaching of legal disciplines at all universities,  \n \nConvinced that States, international and regional organizations, universities \nand institutions should be encouraged to give further support to the Programme of \nAssistance and to increase their activities to promote the teaching, study, \ndissemination and wider appreciation of international law, in particular those \nactivities which are of special benefit to persons from developing countries,  \n \nReaffirming that in the conduct of the Programme of Assistance it would be \ndesirable to use as far as possible the resources and facilities made available by \nMember States, international and regional organizations, universities, institutions \nand others,  \n \nReaffirming also the hope that, in appointing highly qualified lecturers for the \nseminars to be held within the framework of the fellowship programmes in \ninternational law, account would be taken of the need to secure the representation of \nmajor legal systems and balance among various geographical regions,  \n \n1. \nReiterates its approval of the guidelines and recommendations contained \nin section III of the reports of the Secretary-General,2 in particular those designed to \nstrengthen and revitalize the United Nations Programme of Assistance in the \nTeaching, Study, Dissemination and Wider Appreciation of International Law in \nresponse to the increasing demand for international law training and dissemination \nactivities;  \n \n2. \nAuthorizes the Secretary-General to carry out the activities specified in \nhis report1 in 2018 and 2019, including the following activities to be financed from \nprovisions in the regular budget:  \n \n(a) \nThe International Law Fellowship Programme, with a minimum of \n20 fellowships;  \n__________________ \n \n1  A/72/517.  \n \n2  A/70/423, A/71/432 and A/72/517.  \n\nUnited Nations Programme of Assistance in the Teaching, Study, \nDissemination and Wider Appreciation of International Law \nA/RES/72/115\n \n3/5 \n17-22153 \n \n \n(b) \nThe United Nations Regional Courses in International Law for Africa, for \nAsia-Pacific and for Latin America and the Caribbean, with a minimum of \n20 fellowships for each course;  \n \n(c) \nThe United Nations Audiovisual Library of International Law, including \nits continuation and further development;  \n \n(d) \nThe dissemination of legal publications and lectures of the Audiovisual \nLibrary to developing countries to the extent that there are sufficient resources;  \n \n3. \nAlso authorizes the Secretary-General to further expand the activities \nreferred to in paragraph 2 above, to be financed from voluntary contributions \nreceived pursuant to paragraphs 15, 24 and 25 below;  \n \n4. \nCommends the Codification Division of the Office of Legal Affairs of the \nSecretariat for the cost-saving measures undertaken with regard to the International \nLaw Fellowship Programme and the United Nations Regional Courses in \nInternational Law to increase the number of fellowships for the training courses \nfinanced from provisions in the regular budget, taking into account the number of \napplications for these courses;  \n \n5. \nAuthorizes the Secretary-General to award additional fellowships for the \ntraining courses from available resources under the programme budget for the \nProgramme of Assistance and from voluntary contributions received pursuant to \nparagraph 25 below;  \n \n6. \nRequests the Secretary-General to consider admitting, for participation in \nthe training courses, self-funded candidates present in the host country or from \ncountries willing to bear the entire cost of their participation;  \n \n7. \nAuthorizes the Secretary-General to award a minimum of one scholarship \nin 2018 and one in 2019 under the Hamilton Shirley Amerasinghe Memorial \nFellowship on the Law of the Sea;  \n \n8. \nRequests the Secretary-General to include in the regular budget, for \nconsideration by the General Assembly, the necessary funding for the Hamilton \nShirley Amerasinghe Memorial Fellowship on the Law of the Sea for the biennium \n2018\u20132019, should voluntary contributions be insufficient for granting at least one \nfellowship a year;  \n \n9. \nAlso requests the Secretary-General to continue to include resources \nunder the proposed programme budget for the biennium 2020\u20132021 for the \nInternational Law Fellowship Programme, the United Nations Regional Courses in \nInternational Law for Africa, for Asia-Pacific and for Latin America and the \nCaribbean each year and for the continuation and further development of the United \nNations Audiovisual Library of International Law;  \n \n10. Expresses its appreciation to the Secretary-General for the activities \nconducted under the Programme of Assistance and, in particular, for the efforts to \nstrengthen, expand and enhance the international law training and dissemination \nactivities within the framework of the Programme in 2017;  \n \n11. \nCommends the Secretary-General for the continuation and further \ndevelopment of the United Nations Audiovisual Library of International Law as a \nmajor contribution to the teaching and dissemination of international law around the \nworld;  \n \n12. \nRecognizes the importance of the United Nations legal publications \nprepared by the Office of Legal Affairs, and once again requests the Secretary-General \n\nA/RES/72/115 \nUnited Nations Programme of Assistance in the Teaching, Study,\nDissemination and Wider Appreciation of International Law\n \n17-22153 \n4/5 \n \nto issue the publications referred to in his previous report3 in various formats, \nincluding hard copy publications, which are essential for developing countries;  \n \n13. Expresses its appreciation for the efforts undertaken by the Codification \nDivision to bring up to date the United Nations legal publications, which greatly \nenhanced the timely issuance thereof and made possible the preparation of legal \ntraining materials, and encourages the Division to continue to explore ways of \nsustaining such efforts into the next biennium, subject to the availability of \nresources;  \n \n14. Notes with satisfaction the issuance of the ninth edition of The Work of \nthe International Law Commission and of the United Nations Juridical \nYearbook 2013;  \n \n15. Expresses its appreciation for the issuance of the English-language \nedition of the International Law Handbook as a valuable resource for international \nlaw education on a broad range of core subjects of international law in its training \ncourses and for academic institutions in developing countries to promote \ninternational law education in those countries, and requests Member States to \nprovide the voluntary contributions necessary to ensure the completion of this \neducational resource in French and, subject to the availability of funds, in the other \nofficial languages of the United Nations, as well as its dissemination in developing \ncountries;  \n \n16. Requests the Codification Division to continue to maintain and expand \nits websites listed in the annex to the report of the Secretary-General as an \ninvaluable tool for the dissemination of international law materials as well as for \nadvanced legal research;  \n \n17. Requests that interns and research assistants be enlisted for the \npreparation of materials for the United Nations Audiovisual Library of International \nLaw as well as the International Law Handbook;  \n \n18. Welcomes the efforts of the Codification Division to revitalize and \nconduct the United Nations Regional Courses in International Law as an important \ntraining activity;  \n \n19. Expresses its appreciation to Ethiopia, Chile and Thailand for hosting the \nUnited Nations Regional Courses in International Law for Africa, for Latin America \nand the Caribbean and for Asia-Pacific in 2017;  \n \n20. Expresses its appreciation to the African Union for the valuable \ncontribution it continues to make to the United Nations Regional Course in \nInternational Law for Africa;  \n \n21. Once again encourages the Codification Division to cooperate with the \nAfrican Institute of International Law, dedicated to offering higher learning and \nresearch in international law needed for the development of Africa, in the \nimplementation of the relevant activities under the Programme of Assistance;  \n \n22. Expresses its appreciation to the Hague Academy of International Law \nfor the valuable contribution it continues to make to the Programme of Assistance, \nwhich has enabled candidates under the International Law Fellowship Programme to \nattend and participate in the Fellowship Programme in conjunction with courses at \nthe Academy;  \n \n23. Notes with appreciation the contributions of the Hague Academy to the \nteaching, study, dissemination and wider appreciation of international law, and calls \n__________________ \n \n3  A/70/423, para. 45.  \n\nUnited Nations Programme of Assistance in the Teaching, Study, \nDissemination and Wider Appreciation of International Law \nA/RES/72/115\n \n5/5 \n17-22153 \n \nupon Member States and interested organizations to give favourable consideration \nto the appeal of the Academy for a continuation of support and a possible increase \nin their financial contributions, to enable the Academy to carry out its activities, \nparticularly those relating to the summer courses, regional courses and programmes \nof the Centre for Studies and Research in International Law and International \nRelations;  \n \n24. Requests the Secretary-General to continue to publicize the Programme \nof Assistance and periodically to invite Member States, universities, philanthropic \nfoundations and other interested national and international institutions and \norganizations, as well as individuals, to make voluntary contributions towards the \nfinancing of the Programme or otherwise to assist in its implementation and \npossible expansion;  \n \n25. Reiterates its request to Member States and interested organizations, \ninstitutions and individuals to make voluntary contributions for the United Nations \nAudiovisual Library of International Law and for the United Nations Regional \nCourses in International Law organized by the Codification Division as an \nimportant complement to the International Law Fellowship Programme;  \n \n26. Expresses its appreciation to those Member States that have made \nvoluntary contributions to support the Programme of Assistance;  \n \n27. Requests the Secretary-General to report to the General Assembly at its \nseventy-third session on the implementation of the Programme of Assistance in \n2018 and, following consultations with the Advisory Committee on the Programme \nof Assistance, to submit recommendations regarding the Programme in subsequent \nyears;  \n \n28. Decides to include in the provisional agenda of its seventy-third session \nthe item entitled \u201cUnited Nations Programme of Assistance in the Teaching, Study, \nDissemination and Wider Appreciation of International Law\u201d.  \n \n67th plenary meeting  \n7 December 2017 \n \n",
  "paragraphs": {
    "1": "Reiterates its approval of the guidelines and recommendations contained in section III of the reports of the Secretary-General,2 in particular those designed to strengthen and revitalize the United Nations Programme of Assistance in the Teaching, Study, Dissemination and Wider Appreciation of International Law in response to the increasing demand for international law training and dissemination activities;",
    "2": "Authorizes the Secretary-General to carry out the activities specified in his report1 in 2018 and 2019, including the following activities to be financed from provisions in the regular budget: (a) The International Law Fellowship Programme, with a minimum of 20 fellowships; (b) The United Nations Regional Courses in International Law for Africa, for Asia-Pacific and for Latin America and the Caribbean, with a minimum of 20 fellowships for each course; (c) The United Nations Audiovisual Library of International Law, including its continuation and further development; (d) The dissemination of legal publications and lectures of the Audiovisual Library to developing countries to the extent that there are sufficient resources;",
    "3": "Also authorizes the Secretary-General to further expand the activities referred to in paragraph 2 above, to be financed from voluntary contributions received pursuant to paragraphs 15, 24 and 25 below;",
    "4": "Commends the Codification Division of the Office of Legal Affairs of the Secretariat for the cost-saving measures undertaken with regard to the International Law Fellowship Programme and the United Nations Regional Courses in International Law to increase the number of fellowships for the training courses financed from provisions in the regular budget, taking into account the number of applications for these courses;",
    "5": "Authorizes the Secretary-General to award additional fellowships for the training courses from available resources under the programme budget for the Programme of Assistance and from voluntary contributions received pursuant to paragraph 25 below;",
    "6": "Requests the Secretary-General to consider admitting, for participation in the training courses, self-funded candidates present in the host country or from countries willing to bear the entire cost of their participation;",
    "7": "Authorizes the Secretary-General to award a minimum of one scholarship in 2018 and one in 2019 under the Hamilton Shirley Amerasinghe Memorial Fellowship on the Law of the Sea;",
    "8": "Requests the Secretary-General to include in the regular budget, for consideration by the General Assembly, the necessary funding for the Hamilton Shirley Amerasinghe Memorial Fellowship on the Law of the Sea for the biennium 2018\u20132019, should voluntary contributions be insufficient for granting at least one fellowship a year;",
    "9": "Also requests the Secretary-General to continue to include resources under the proposed programme budget for the biennium 2020\u20132021 for the International Law Fellowship Programme, the United Nations Regional Courses in International Law for Africa, for Asia-Pacific and for Latin America and the Caribbean each year and for the continuation and further development of the United Nations Audiovisual Library of International Law;",
    "10": "Expresses its appreciation to the Secretary-General for the activities conducted under the Programme of Assistance and, in particular, for the efforts to strengthen, expand and enhance the international law training and dissemination activities within the framework of the Programme in 2017;",
    "11": "Commends the Secretary-General for the continuation and further development of the United Nations Audiovisual Library of International Law as a major contribution to the teaching and dissemination of international law around the world;",
    "12": " to issue the publications referred to in his previous report3 in various formats, including hard copy publications, which are essential for developing countries;",
    "13": "Expresses its appreciation for the efforts undertaken by the Codification Division to bring up to date the United Nations legal publications, which greatly enhanced the timely issuance thereof and made possible the preparation of legal training materials, and encourages the Division to continue to explore ways of sustaining such efforts into the next biennium, subject to the availability of resources;",
    "14": "Notes with satisfaction the issuance of the ninth edition of The Work of the International Law Commission and of the United Nations Juridical Yearbook 2013;",
    "15": "Expresses its appreciation for the issuance of the English-language edition of the International Law Handbook as a valuable resource for international law education on a broad range of core subjects of international law in its training courses and for academic institutions in developing countries to promote international law education in those countries, and requests Member States to provide the voluntary contributions necessary to ensure the completion of this educational resource in French and, subject to the availability of funds, in the other official languages of the United Nations, as well as its dissemination in developing countries;",
    "16": "Requests the Codification Division to continue to maintain and expand its websites listed in the annex to the report of the Secretary-General as an invaluable tool for the dissemination of international law materials as well as for advanced legal research;",
    "17": "Requests that interns and research assistants be enlisted for the preparation of materials for the United Nations Audiovisual Library of International Law as well as the International Law Handbook;",
    "18": "Welcomes the efforts of the Codification Division to revitalize and conduct the United Nations Regional Courses in International Law as an important training activity;",
    "19": "Expresses its appreciation to Ethiopia, Chile and Thailand for hosting the United Nations Regional Courses in International Law for Africa, for Latin America and the Caribbean and for Asia-Pacific in 2017;",
    "20": "Expresses its appreciation to the African Union for the valuable contribution it continues to make to the United Nations Regional Course in International Law for Africa;",
    "21": "Once again encourages the Codification Division to cooperate with the African Institute of International Law, dedicated to offering higher learning and research in international law needed for the development of Africa, in the implementation of the relevant activities under the Programme of Assistance;",
    "22": "Expresses its appreciation to the Hague Academy of International Law for the valuable contribution it continues to make to the Programme of Assistance, which has enabled candidates under the International Law Fellowship Programme to attend and participate in the Fellowship Programme in conjunction with courses at the Academy;",
    "23": "Notes with appreciation the contributions of the Hague Academy to the teaching, study, dissemination and wider appreciation of international law, and calls upon Member States and interested organizations to give favourable consideration to the appeal of the Academy for a continuation of support and a possible increase in their financial contributions, to enable the Academy to carry out its activities, particularly those relating to the summer courses, regional courses and programmes of the Centre for Studies and Research in International Law and International Relations;",
    "24": "Requests the Secretary-General to continue to publicize the Programme of Assistance and periodically to invite Member States, universities, philanthropic foundations and other interested national and international institutions and organizations, as well as individuals, to make voluntary contributions towards the financing of the Programme or otherwise to assist in its implementation and possible expansion;",
    "25": "Reiterates its request to Member States and interested organizations, institutions and individuals to make voluntary contributions for the United Nations Audiovisual Library of International Law and for the United Nations Regional Courses in International Law organized by the Codification Division as an important complement to the International Law Fellowship Programme;",
    "26": "Expresses its appreciation to those Member States that have made voluntary contributions to support the Programme of Assistance;",
    "27": "Requests the Secretary-General to report to the General Assembly at its seventy-third session on the implementation of the Programme of Assistance in 2018 and, following consultations with the Advisory Committee on the Programme of Assistance, to submit recommendations regarding the Programme in subsequent years;",
    "28": "Decides to include in the provisional agenda of its seventy-third session the item entitled \u201cUnited Nations Programme of Assistance in the Teaching, Study, Dissemination and Wider Appreciation of International Law\u201d."
  },
  "agenda_items": [
    "Item 80"
  ],
  "symbol_references": []
}