{
  "symbol": "A/RES/74/252",
  "filename": "A_RES_74_252.pdf",
  "title": "74/252. Pattern of conferences",
  "text": "United Nations \nA/RES/74/252\n \n \nGeneral Assembly \nDistr.: General \n13 January 2020 \n \n19-22680 (E)    160120 \n*1922680* \n \n \nSeventy-fourth session \nAgenda item 138 \nPattern of conferences \n \n \n \n \n Resolution adopted by the General Assembly \non 27 December 2019 \n \n \n \n \n[on the report of the Fifth Committee (A/74/602)] \n \n \n 74/252. Pattern of conferences \n \n \n \nThe General Assembly, \n \nRecalling its previous resolutions on the pattern of conferences, including \nresolution 73/270 of 22 December 2018, \n \nRecalling also its previous resolutions on multilingualism, in particular \nresolution 73/346 of 16 September 2019, reaffirming the provisions relating to \nconference services, and recognizing that multilingualism, as a core value of the \nOrganization, contributes to the achievement of the goals of the United Nations, as \nset out in Article 1 of the Charter of the United Nations, \n \nReaffirming its resolution 42/207 C of 11 December 1987, in which it requested \nthe Secretary-General to ensure the equal treatment of the official languages of the \nUnited Nations, \n \nHaving considered the report of the Committee on Conferences for 2019 1 and \nthe relevant report of the Secretary-General,2 \n \nHaving also considered the report of the Advisory Committee on Administrative \nand Budgetary Questions,3 \n \nReaffirming the role of the Fifth Committee of the General Assembly in \nadministrative and budgetary matters, \n \nRecalling its resolution 14 (I) of 13 February 1946 and the role of the Advisory \nCommittee as a subsidiary body of the General Assembly, \n__________________ \n \n1 Official Records of the General Assembly, Seventy-fourth Session, Supplement No. 32 (A/74/32). \n \n2 A/74/121. \n \n3 A/74/538. \n\nA/RES/74/252 \nPattern of conferences\n \n19-22680\n2/13 \n \n \n \nI \nCalendar of conferences and meetings \n \n \n1. \nWelcomes the report of the Committee on Conferences for 2019;1 \n \n2. \nApproves the draft calendar of conferences and meetings of the United \nNations for 2020, as submitted by the Committee on Conferences, 4  taking into \naccount the observations of the Committee and subject to the provisions of the present \nresolution; \n \n3. \nAuthorizes the Committee on Conferences to make any adjustments to the \nrevised calendar of conferences and meetings of the United Nations for 2020 that may \nbecome necessary as a result of actions and decisions taken by the General Assembly \nat its seventy-fourth session; \n \n4. \nRecalls paragraph 40 of its resolution 71/323 of 8 September 2017 and \nparagraph 40 of its resolution 72/313 of 17 September 2018 on the revitalization of \nthe work of the General Assembly; \n \n5. \nNotes with satisfaction that the Secretariat has taken into account the \narrangements referred to in General Assembly resolutions on the pattern of \nconferences, including resolutions 53/208 A of 18 December 1998, 54/248 of \n23 December 1999, 55/222 of 23 December 2000, 56/242 of 24 December 2001, \n57/283 B of 15 April 2003, 58/250 of 23 December 2003, 59/265 of 23 December \n2004, 60/236 A of 23 December 2005, 61/236 of 22 December 2006, 62/225 of \n22 December 2007, 63/248 of 24 December 2008, 64/230 of 22 December 2009, \n65/245 of 24 December 2010, 66/233 of 24 December 2011, 67/237 of 24 December \n2012, 68/251 of 27 December 2013, 72/19 of 1 December 2017 and 73/270, \nconcerning Orthodox Good Friday and the official holidays of Eid al-Fitr and Eid \nal-Adha, and requests all intergovernmental bodies to observe those decisions when \nplanning their meetings; \n \n6. \nAlso notes with satisfaction that the Secretariat has taken into account the \narrangements referred to in relevant resolutions of the General Assembly regarding \nthe pattern of conferences, including resolution 69/250 of 29 December 2014, \nconcerning Yom Kippur, the Day of Vesak, Diwali, Gurpurab, Orthodox Christmas \nand Nowruz, and requests all relevant intergovernmental bodies to continue to \nobserve the applicable decisions when planning their meetings; \n \n7. \nRequests the Secretary-General to continue to ensure that any modification \nto the calendar of conferences and meetings is implemented strictly in accordance \nwith the mandate of the Committee on Conferences and other relevant resolutions of \nthe General Assembly; \n \n8. \nInvites Member States to include in new legislative mandates adequate \ninformation on the modalities for the organization of conferences or meetings; \n \n9. \nRecalls rule 153 of its rules of procedure, and, for resolutions involving \nexpenditure, requests the Secretary-General to include the modalities of conferences, \ntaking into account the trends of similar meetings, with a view to mobilizing \nconference and documentation services in the most efficient and cost-effective \nmanner possible; \n \n10. Reaffirms the need to address the issue of duplications and redundancies \nin conference servicing, and notes Economic and Social Council resolution 2018/30 \nof 24 July 2018; \n__________________ \n \n4 See Official Records of the General Assembly, Seventy-fourth Session, Supplement No. 32 \n(A/74/32), annex II. \n\nPattern of conferences \nA/RES/74/252\n \n3/13\n19-22680 \n \n \n11. \nExpresses concern regarding the recurring extension of the work of the \nFifth Committee during the second part of the resumed session of the General \nAssembly and the impact of such an extension on the services provided by the \nSecretariat, including the availability of conference rooms and language services; \n \n \n \nII \nUtilization of conference-servicing resources \n \n \n12. Reaffirms the practice that, in the use of conference rooms, priority must \nbe given to meetings of Member States; \n \n13. Calls upon the Secretary-General and Member States to adhere to the \nguidelines and procedures contained in the administrative instruction for the \nauthorization of the use of United Nations premises for meetings, conferences, special \nevents and exhibits;5 \n \n14. Notes that ST/AI/416 of 26 April 1996, which regulates the use of United \nNations premises, has been updated and superseded at Headquarters in New York by \nST/AI/2019/4 of 23 September 2019, and encourages the Directors-General of other \nconference-servicing duty stations to review and update as necessary their \ninformation circulars governing the use of United Nations premises; \n \n15. Emphasizes that such meetings, conferences, special events and exhibits \nmust be consistent with the purposes and principles of the United Nations; \n \n16. Notes that the overall interpretation utilization factor for all calendar \nbodies at the four main duty stations was 82 per cent in 2018, 81 per cent in 2017 \nand 80 per cent in 2016, 2015 and 2014, which met the established benchmark of \n80 per cent; \n \n17. Urges those intergovernmental bodies whose average interpretation \nutilization factor has for the past six years been below the benchmark of 80 per cent \nto take that factor into account when planning their future sessions in order to achieve \nthat benchmark; \n \n18. Reiterates its request to intergovernmental bodies to review their meeting \nentitlements and to plan and adjust their programmes of work on the basis of their \nactual utilization of conference-servicing resources in order to improve their efficient \nuse and to achieve optimum utilization of conference services; \n \n19. Urges the secretariats and bureaux of bodies that underutilize their \nconference-servicing resources to work more closely with the Department for General \nAssembly and Conference Management of the Secretariat and to consider changes to \ntheir programmes of work, as appropriate, including adjustments based on previous \npatterns of recurring agenda items, with a view to making improvements in their \ninterpretation utilization factors; \n \n20. Recognizes that late starts and unplanned early endings seriously affect the \ninterpretation utilization factor of those bodies, invites the secretariats and bureaux \nof the bodies to pay adequate attention in this regard, and welcomes their efforts to \ninform the Secretariat in a timely manner of any such changes in order to allow \nconference services to be smoothly redeployed to other meetings; \n \n21. Requests the Committee on Conferences to consult those bodies that have \nconsistently utilized less than the applicable benchmark of their allocated resources \nfor the past six years, with a view to making appropriate recommendations in order \nto achieve the optimum utilization of conference-servicing resources; \n__________________ \n \n5 ST/AI/416. \n\nA/RES/74/252 \nPattern of conferences\n \n19-22680\n4/13 \n \n \n22. Welcomes the efforts undertaken by the Secretary-General to increase the \nutilization of conference-servicing resources, and in this regard encourages the \nSecretary-General to enhance the efficiency of conference servicing and to report \nthereon to the General Assembly at its seventy-fifth session; \n \n23. Requests the Secretary-General to consult Member States on initiatives \nthat affect the utilization of conference services and conference facilities; \n \n24. Also requests the Secretary-General to continue to impress upon bodies \nentitled to meet \u201cas required\u201d the need to further improve the utilization of conference \nservices, and further requests the Secretary-General to report on the provision of such \nservices to those bodies to the General Assembly at its seventy-fifth session; \n \n25. Recognizes the importance of meetings of regional and other major \ngroupings of Member States for the smooth functioning of the sessions of \nintergovernmental bodies, requests the Secretary-General to ensure that, as far as \npossible, all requests for conference services for the meetings of regional and other \nmajor groupings of Member States are met, and requests the Department for General \nAssembly and Conference Management to inform the requesters as early as possible \nabout the availability of conference services, including interpretation, as well as about \nany changes that might occur before the holding of meetings; \n \n26. Notes the overall increase in the percentage of meetings held by regional \nand other major groupings of Member States that were provided with interpretation \nservices at the four main duty stations in 2018, and requests the Secretary-General to \nfurther employ innovative means to address the difficulties arising from the lack of \ninterpretation services for such meetings and to report thereon to the General \nAssembly at its seventy-fifth session; \n \n27. Once again urges intergovernmental bodies at the planning stage to take \ninto account the meetings of regional and other major groupings of Member States, \nto make provision for such meetings in their programmes of work and to notify the \nDepartment for General Assembly and Conference Management, well in advance, of \nany cancellations so that unutilized conference-servicing resources may, to the extent \npossible, be reassigned to meetings of regional and other major groupings of Member \nStates; \n \n28. Recognizes the improvement in the rate of room utilization of the \nconference centre of the Economic Commission for Africa and the ongoing efforts \naimed at improving the conference facilities at the Commission; \n \n29. Looks forward to receiving the proposal aimed at addressing the \ndeteriorating conditions and the limited capacity of the conference services facility at \nthe United Nations Office at Nairobi; \n \n30. Recognizes the proactive efforts of the Secretary-General to identify ways \nto enhance efficiency and effectiveness in conference services, commends the \nDepartment for General Assembly and Conference Management for its innovative \napproaches in providing technical secretariat support and in managing meetings and \ndocuments, and encourages the Department to continue its efforts to preserve the high \nquality of its services while achieving efficiencies; \n \n31. Requests the Secretary-General to continue his efforts aimed at improving \nconference servicing at the four main duty stations, including by addressing or \neliminating possible duplication, overlap and redundancy, and identifying innovative \nideas, potential synergies and other cost-saving measures, without compromising \nquality or affecting the provision of services, and to report thereon to the General \nAssembly at its seventy-fifth session; \n\nPattern of conferences \nA/RES/74/252\n \n5/13\n19-22680 \n \n \n32. Reiterates the need to continue to improve all conference facilities, \nincluding the videoconferencing infrastructure, at all four main duty stations, and in \nthis regard requests the Secretary-General to report thereon no later than at the \nseventy-fifth session of the General Assembly; \n \n33. Welcomes the measures taken to ensure access to and use of conference \nservices and conference facilities for persons with disabilities, including the \nestablishment of the Accessibility Centre, and requests the Secretary-General to \ncontinue to address issues related to the accessibility of conference facilities in all \nfour main conference-servicing duty stations as a matter of priority and to report \nthereon to the General Assembly at its seventy-fifth session; \n \n34. Also welcomes the integrated global management rule as an efficient \napproach, where feasible, to servicing meetings away from duty stations, and in this \nregard requests the Secretary-General to continue his efforts to realize further \nefficiencies by rigorously applying the integrated global management rule to \napplicable meetings, without jeopardizing the quality of services, and to continue to \nreport thereon to the Committee on Conferences; \n \n \n \nIII \nEnhancing integrated global management, leveraging technology \nand measuring the quality of conference services \n \n \n35. Recalls paragraph 24 of the report of the Secretary-General on the pattern \nof conferences 6  also recalls that, in paragraph 81 of its resolution 56/253 of \n24 December 2001, it requested the Secretary-General to ensure that conference \nservices were managed in an integrated manner throughout all duty stations in the \nOrganization, stresses again that the Department for General Assembly and \nConference Management is responsible for the implementation of policy, the \nformulation of standards and guidelines, overseeing and coordinating United Nations \nconference services and the overall management of resources under the relevant \nbudget section, while the United Nations Offices at Geneva, Vienna and Nairobi \nremain responsible and accountable for day-to-day operational activities, as indicated \nin section II.B, paragraph 7, of its resolution 57/283 B; \n \n36. Notes the completion of the internal reviews concerning accountability \nmechanisms and the clear delineation of responsibility between the Under-Secretary-\nGeneral for General Assembly and Conference Management and the Directors-\nGeneral of the United Nations Offices at Geneva, Nairobi and Vienna for conference \nmanagement policies, operations and resource utilization, requests the Secretary-\nGeneral to report on the outcome of the internal reviews to the General Assembly at \nits seventy-fifth session, and in this regard recalls, inter alia, paragraph 36 of its \nresolution 73/270; \n \n37. Welcomes the innovative efforts of the Department for General Assembly \nand Conference Management to improve conference services with a view to \nfacilitating the decision-making process by intergovernmental bodies, and requests \nthe Secretary-General to continue to explore technological and other innovations that \nadvance effectiveness and efficiency in this regard and to report on these efforts \nduring the seventy-fifth session; \n \n38. Notes the initiatives undertaken in the context of the integrated global \nmanagement concept aimed at streamlining procedures, achieving economies of scale \nand improving the quality of conference services, and in this regard stresses the \n__________________ \n \n6 A/70/122. \n\nA/RES/74/252 \nPattern of conferences\n \n19-22680\n6/13 \n \nimportance of ensuring the equal treatment of conference-servicing staff, as well as \nthe principle of equal grade for equal work at the four main duty stations; \n \n39. Acknowledges that the concept of integrated global management has been \nfully mainstreamed into all areas of conference services across the four main \nconference-servicing duty stations, and requests the Secretary-General to keep the \nGeneral Assembly and the Committee on Conferences apprised of progress made in \nensuring integrated global management and to provide accurate and up-to-date \ninformation on new initiatives falling under the purview of the Committee; \n \n40. Notes with appreciation the progress made in the development and \nimplementation of conference management software such as gData, gDoc, gMeets \nand gText, and requests the Secretary-General to ensure that they are implemented as \nenterprise systems in the context of the Secretariat-wide information and \ncommunications technology strategy, as welcomed by the General Assembly in its \nresolution 69/262 of 29 December 2014, and to report on progress made regarding \noperations, maintenance and harmonization with existing systems, as appropriate; \n \n41. Underlines that all the initiatives on leveraging technology, including \nthose introduced on a trial basis, shall comply with the principle of parity among the \nofficial languages of the Organization, with a view to preserving and enhancing the \nquality and scope of the services provided by the Secretariat; \n \n42. Reiterates that the satisfaction of Member States is a key performance \nindicator in conference management and conference services; \n \n43. Requests the Secretary-General to continue to ensure that measures taken \nby the Department for General Assembly and Conference Management to seek the \nevaluation by Member States of the quality of the conference services provided to \nthem, as a key performance indicator of the Department, provide equal opportunities \nto Member States to present their evaluations in the six official languages of the \nUnited Nations and are in full compliance with relevant resolutions of the General \nAssembly, and also requests the Secretary-General to report to the Assembly, through \nthe Committee on Conferences, on progress made in this regard; \n \n44. Also requests the Secretary-General to continue to explore best practices \nand techniques in client satisfaction evaluations, to seek a larger rate of response to \nsurveys on quality and to report regularly to the General Assembly on the results \nachieved; \n \n45. Welcomes the efforts made by the Department for General Assembly and \nConference Management to seek the evaluation by Member States of the quality of \nthe conference services provided to them, taking into consideration comments and \ncomplaints raised by Member States either in writing or during meetings, and requests \nthe Secretary-General to intensify his exploration of innovative ways to \nsystematically capture and analyse feedback from Member States and Chairs and \nSecretaries of committees on the quality of conference services and to report thereon \nto the General Assembly at its seventy-fifth session; \n \n46. Requests the Secretary-General to continue to seek evaluation of the \nquality of the conference services provided by the Secretariat through meetings held \nat least once a year, but not exceeding twice a year, guaranteeing that Member States \nare able to present their evaluations and seek information equally in any of the six \nofficial languages of the United Nations on any conference-related or language-\nspecific matter; \n\nPattern of conferences \nA/RES/74/252\n \n7/13\n19-22680 \n \n \n \nIV \nMatters related to documentation and publications \n \n \n47. Emphasizes the paramount importance of the equality of the six official \nlanguages of the United Nations; \n \n48. Underlines that all the initiatives on the evolution of working methods, \nincluding those introduced on a trial basis, shall comply with the principle of parity \namong the official languages of the Organization, with a view to preserving or \nenhancing the quality and scope of the services provided by the Secretariat; \n \n49. Emphasizes the importance of multilingualism in the activities of the \nUnited Nations, and requests the Secretary-General to continue his efforts to ensure \nfull parity among the six official languages in accordance with General Assembly \nresolution 73/346 and to report thereon to the Assembly at its seventy-fifth session; \n \n50. Also emphasizes the importance of making use of all the official languages \nof the United Nations, ensuring their full and equitable treatment in all the activities \nof the Department of Global Communications of the Secretariat, with the aim of \neliminating the disparity between the use of English and the use of the five other \nofficial languages, and in this regard reaffirms its request that the Secretary-General \nensure the archiving of official meetings webcasts in all six official languages on the \nUnited Nations website; \n \n51. Welcomes the appointment by the Secretary-General of the Coordinator for \nMultilingualism, \nwho \nis \nresponsible \nfor \nthe \noverall \nimplementation \nof \nmultilingualism Secretariat-wide, and calls upon all departments and offices within \nthe Secretariat to fully support the work of the Coordinator in the implementation of \nthe relevant mandates on multilingualism; \n \n52. Emphasizes that multilingualism, as a core value of the Organization, \nentails the active involvement and commitment of all stakeholders, including all \nUnited Nations duty stations and offices away from Headquarters; \n \n53. Welcomes the submission by the Secretary-General, in his report on \nmultilingualism,\n7  of detailed terms of reference for the Coordinator for \nMultilingualism, as requested in resolution 70/9 of 13 November 2015, recalls its \nendorsement, in resolution 71/328 of 11 September 2017, of the terms of reference \nproposed by the Secretary-General, requests that subsequent updates to the terms of \nreference be made available to all Member States and Secretariat entities, and \nwelcomes the efforts made by the Coordinator in this regard; \n \n54. Requests the Secretary-General to ensure the consistent and effective \nimplementation of the terms of reference for the Coordinator for Multilingualism and \nto report thereon to the General Assembly at its seventy-fifth session; \n \n55. Emphasizes the role of Member States and their intergovernmental bodies \nin determining the policies on conference management; \n \n56. Stresses that proposals to change such policies are to be approved by \nMember States in their relevant intergovernmental bodies; \n \n57. Also stresses that matters related to conference management, including \ndocumentation, fall within the purview of the Fifth Committee; \n \n58. Reiterates the importance of the timely submission and issuance of \ndocuments for all intergovernmental bodies, including the Fifth Committee; \n__________________ \n \n7 A/71/757. \n\nA/RES/74/252 \nPattern of conferences\n \n19-22680\n8/13 \n \n \n59. Notes with concern the recurring late issuance of documents for the Fifth \nCommittee, recalls paragraph 29 of its resolution 70/247 of 23 December 2015, and \nrequests the Secretary-General to continue to take actions for its effective \nimplementation, taking into account the responsibilities of all stakeholders involved, \nand to report thereon in the context of his next report on the pattern of conferences; \n \n60. Welcomes the efforts made by the Secretariat, in particular the Department \nfor General Assembly and Conference Management, regarding the timely issuance of \npre-session documentation for the Fifth Committee in the six official languages of the \nUnited Nations, and encourages continued efforts by all stakeholders in this regard; \n \n61. Encourages the Chairs of the Fifth Committee and the Advisory \nCommittee on Administrative and Budgetary Questions to continue to promote \ncooperation between the two bodies in the sphere of documentation; \n \n62. Notes that accurate, timely and consistent information provided by the \nSecretariat to the Fifth Committee during its informal consultations facilitates the \ndecision-making process in the Committee; \n \n63. Reaffirms its decision, in section IV of its resolution 64/230, that all \nreports adopted by the Working Group on the Universal Periodic Review of the \nHuman Rights Council shall be issued as documents in all official languages of the \nUnited Nations in a timely manner before their consideration by the Council, in \naccordance with General Assembly resolutions 36/117 A of 10 December 1981, \n51/211 A to E of 18 December 1996, 52/214 of 22 December 1997, 53/208 A to E of \n18 December 1998 and 59/265, and requests the Secretary-General to ensure the \nsupport necessary to that effect and to report thereon to the Assembly at its seventy-\nfifth session; \n \n64. Reiterates paragraph 8 of the annex to its resolution 2 (I) of 1 February \n1946 on the rules of procedure concerning languages, whereby all resolutions and \nother important documents shall be made available in all six official languages and, \nupon the request of any representative, any other document shall be made available \nin any or all of the official languages; \n \n65. Also reiterates the importance of the simultaneous issuance of documents \nin all official languages and welcomes the 100 per cent compliance in 2018 with the \nissuance of documents by all duty stations, and reiterates its request that the \nSecretary-General ensure strict respect for the rules concerning the simultaneous \nissuance of documents in all six official languages as regards both the distribution of \nprinted copies and the posting of parliamentary documentation on the Official \nDocument System and the United Nations website; \n \n66. Requests the Secretary-General to continue to take action on providing the \ntimely and simultaneous issuance of documents in all six official languages; \n \n67. Notes that workload-sharing has expanded to include text-processing in \naddition to translation and editing, and requests the Secretary-General to continue to \nseek ways to promote workload-sharing among the four main duty stations and to \nreport thereon to the General Assembly at its seventy-fifth session; \n \n68. Emphasizes that the major goals of the Department for General Assembly \nand Conference Management are to provide high-quality documents in a timely \nmanner in all official languages, in accordance with established regulations, as well \nas high-quality conference services to Member States at all headquarters duty \nstations, and to achieve those aims as efficiently and cost-effectively as possible, in \naccordance with the relevant resolutions of the General Assembly; \n \n69. Also emphasizes the importance of enhancing accountability within the \nSecretariat for the timely submission and issuance of documents; \n\nPattern of conferences \nA/RES/74/252\n \n9/13\n19-22680 \n \n \n70. Requests the Secretary-General to continue to include in the senior \nmanagers\u2019 compacts the new standard managerial indicator related to the timely \nsubmission of official documentation for intergovernmental and expert bodies and to \nreport thereon in future progress reports on accountability; \n \n71. Also requests the Secretary-General to include, in future budget proposals, \ninformation related to the timely submission of documentation needed for meetings \nof relevant intergovernmental and expert bodies; \n \n72. Reaffirms its decision in section III, paragraph 9, of its resolution 59/265 \nthat the issuance of documents in all six official languages on planning, budgetary \nand administrative matters requiring urgent consideration by the General Assembly \nshall be accorded priority; \n \n73. Reiterates its request that the Secretary-General direct all departments of \nthe Secretariat to include the following elements in their reports: \n \n(a) \nA summary of the report; \n \n(b) \nConsolidated conclusions, recommendations and other proposed actions; \n \n(c) \nRelevant background information; \nand its request that all documents submitted to legislative organs, including the \nCommittee on Conferences, by the Secretariat and intergovernmental and expert \nbodies for consideration and action have conclusions and recommendations in bold \nprint; \n \n74. Notes with concern that only 76 per cent of the author departments reached \nthe compliance rate of 90 per cent in the timely submission of their reports to the \nDepartment for General Assembly and Conference Management, reiterates its request \nto the Secretary-General to enforce the slotting system more rigorously through a \ndedicated focus, such as the interdepartmental task force on documentation, and to \nreport thereon to the General Assembly at its seventy-fifth session, urges author \ndepartments to fully adhere to deadlines for document submission, and requests the \nSecretary-General to continue to report on concrete measures taken; \n \n75. Notes with appreciation the work of the interdepartmental task force on \ndocumentation, chaired by the Department for General Assembly and Conference \nManagement, to facilitate the submission of documents by author departments of the \nSecretariat; \n \n76. Reiterates its request in paragraph 77 of its resolution 73/270 that the \nSecretary-General provide information on the waiver process for documents that are \nsubmitted over the word limit; \n \n77. Notes that the Official Document System is the official digital repository \nof the United Nations, welcomes its modernization, including the introduction of a \nportable Official Document System, and its accessibility in all six official languages \nof the United Nations, and encourages the Secretary-General to continue his efforts \nin this regard; \n \n78. Requests the Secretary-General to continue his efforts to upload all \nimportant older United Nations documents on to the United Nations website in all six \nofficial languages on a priority basis so that those archives will also be available to \nMember States and the general public; \n \n79. Also requests the Secretary-General to take all measures necessary to \nensure that the digitization of key documents in the Dag Hammarskj\u00f6ld Library and \nin the main duty stations is completed in a timely manner, as appropriate; \n\nA/RES/74/252 \nPattern of conferences\n \n19-22680\n10/13 \n \n \n80. Recalls paragraph 82 of its resolution 73/270, and in this regard requests \nthe Secretary-General to entrust the Department of Global Communications with \npresenting a proposal for the digitization of important older United Nations \ndocuments stored at the United Nations Headquarters Dag Hammarskj\u00f6ld Library for \nconsideration by the General Assembly through the Committee on Information no \nlater than at the main part of its seventy-fifth session, outlining, inter alia, the \ndefinition of important older United Nations documents, as well as the scope and \nestimated quantity, cost and time frame; \n \n81. Expresses concern that the anticipated lengthy digitization project may \njeopardize the retention of historical knowledge and information in view of the \ndelicate state and risk of breakage of many of the related documents; \n \n82. Requests the Secretary-General to seek additional voluntary contributions \nfor the digitization of important older United Nations documents, including by \nbroadening the donor base, and to report thereon in the context of the report requested \nin paragraph 80 above; \n \n83. Welcomes with appreciation the additional contribution from the \nGovernment of Qatar to support the digitization project; \n \n84. Recalls paragraph 85 of its resolution 73/270, notes the increased use of \ndigital recordings by other intergovernmental bodies, including the United Nations \nCommission on International Trade Law and the United Nations Industrial \nDevelopment Organization, and requests the Secretary-General to continue to report \nto the General Assembly in this regard; \n \n85. Stresses that verbatim and summary records remain the only official \nrecords of the meetings of United Nations bodies; \n \n86. Reiterates paragraph 87 of its resolution 73/270 related to the transition to \ndigital recordings of meetings in the six official languages of the Organization as a \ncost-saving measure; \n \n87. Recalls paragraph 5 of its resolution 49/221 B of 23 December 1994, and \nstresses that the timely issuance of verbatim records constitutes an important part of \nthe services provided to Member States; \n \n \n \nV \nMatters related to language services \n \n \n88. Requests the Secretary-General to continue his efforts to ensure the highest \nquality of interpretation and translation services in all six official languages; \n \n89. Welcomes the efforts of the Secretary-General to continue to improve the \nquality of the simultaneous interpretation and translation services provided, and \nrequests the Secretary-General to take action in this regard; \n \n90. Underlines that the translation of official documents of the Organization \nmust be provided in all required languages and in due time, in full compliance with \nthe rules of procedure of the respective legislative bodies; \n \n91. Requests the Secretary-General to continue to improve the quality of \ntranslation of documents into the six official languages, giving particular significance \nto the accuracy of translation; \n \n92. Also requests the Secretary-General to continue to ensure that the \nterminology used in the translation and interpretation services reflects the latest \nlinguistic norms and terminology of the official languages in order to ensure the \nhighest quality; \n\nPattern of conferences \nA/RES/74/252\n \n11/13\n19-22680 \n \n \n93. Further requests the Secretary-General to continue to maintain and update \nthe global terminology portal in order to ensure its availability to United Nations staff, \nMember States and the general public, with a view to achieving harmonization of the \nterminology used at all United Nations duty stations; \n \n94. Requests the Secretary-General, as the Chair of the United Nations System \nChief Executives Board for Coordination, to continue to invite the heads of \nparticipating funds, programmes and specialized agencies of the United Nations \nsystem to consider using official United Nations terminology and to report thereon to \nthe General Assembly at its seventy-fifth session; \n \n95. Notes that the pool of language professionals at duty stations is uneven in \nterms of language combinations, and requests the Secretary-General to continue his \nefforts to develop recruitment, subcontracting and outreach policies that take full \naccount of those imbalances and to report thereon to the General Assembly at its \nseventy-fifth session; \n \n96. Requests the Secretary-General to ensure that all language services are \ngiven equal treatment and are provided with equally favourable working conditions \nand resources, with a view to achieving the maximum quality of services, with full \nrespect for the specificities of the six official languages and taking into account their \nrespective workloads; \n \n97. Also requests the Secretary-General to take measures to ensure equal \ntreatment of all six official languages and equal quality of service for Member States, \nwhile fully respecting the specificities of each official language and different levels \nof benefit from information technology advances for different languages, including \nby addressing workload inequities arising from staffing structures and specificities of \nlanguage, and to report thereon to the General Assembly at its seventy-fifth session; \n \n98. Reiterates the need for the Secretary-General to ensure the compatibility \nof technologies used in all duty stations and to ensure that they are user-friendly in \nall official languages; \n \n99. Welcomes the development of the computer-assisted translation and \nmachine translation system (eLUNa), and requests the Secretary-General to report on \nupdates, including cost-benefit analysis and quality preservation and control, to this \nsystem to the General Assembly at its seventy-fifth session; \n \n100. Recalls section VII of its resolution 69/274 A of 2 April 2015, and requests \nthe Secretary-General to ensure that the implementation of flexible workplace \nstrategies and other potential changes in logistical arrangements take into account the \nneeds of language staff in order to continue to ensure that the services provided to \nMember States meet the highest standard of quality; \n \n101. Reaffirms paragraph 102 of its resolution 73/270, and reiterates its request \nthat the Secretary-General, when recruiting temporary assistance in the language \nservices, including through the use of international or local contracts, as appropriate, \nensure that all language services are given equal treatment and are provided with \nequally favourable working conditions and resources, with a view to achieving \nmaximum quality of their services, with full respect for the specificities of each of \nthe six official languages and taking into account their respective workloads; \n \n102. Recalls section IV of its resolution 69/274 A, and requests the Secretary-\nGeneral to keep the working conditions of interpreters under review; \n \n103. Requests the Secretary-General to fill vacancies in the language services, \nin particular in the translation services and interpretation services, in a timely manner \n\nA/RES/74/252 \nPattern of conferences\n \n19-22680\n12/13 \n \nand in full compliance with relevant provisions of the General Assembly resolutions \ngoverning recruitment for language staff, and to report thereon to the Assembly at its \nseventy-fifth session; \n \n104. Also requests the Secretary-General to continue his efforts to hold \ncompetitive examinations for the recruitment of language staff sufficiently in advance \nin order to fill current and future vacancies in the language services in a timely manner \nand to inform the General Assembly at its future sessions of efforts in this regard; \n \n105. Further requests the Secretary-General to continue to make every effort to \nenhance access to competitive examinations for applicants in all regions, including \nby organizing remote examinations and by bringing, to the extent possible, \nexamination sites closer to their locations in order to allow the greatest number of \npotentially qualified candidates to participate in them, and to report to the General \nAssembly at its future sessions on progress made in this regard; \n \n106. Stresses the need to fully ensure the highest possible quality of contractual \nand in-house translation, and freelance and in-house interpretation, and requests the \nSecretary-General to report on measures taken in this regard; \n \n107. Reiterates its request that the Secretary-General provide, at all duty \nstations, adequate staff at the appropriate level, with a view to ensuring appropriate \nquality control for external translation; \n \n108. Requests the Secretary-General to apply common standards for the quality \ncontrol of documents processed by external translators in all four duty stations in \norder to ensure high-quality translations in the six official languages of the United \nNations, and to report thereon to the General Assembly at its future sessions; \n \n109. Also requests the Secretary-General to ensure that the experience, lessons \nlearned and best practices of the main duty stations in performing quality control of \ncontractual and in-house translations, including on requirements relating to the \nnumber and appropriate level of staff needed to carry out this function, are shared \namong duty stations and regional commissions, as appropriate; \n \n110. Notes that the Secretary-General has established globally standardized \nperformance indicators and costing models aimed at a more cost-effective strategy \nfor the in-house processing of documents, and requests the Secretary-General to \nensure their effective application at the four main duty stations; \n \n111. Notes with appreciation the measures taken by the Secretary-General, in \naccordance with its resolutions, to address the issue of the replacement of retiring \nstaff in the language services, and requests the Secretary-General to maintain and \nintensify those efforts, including the strengthening of cooperation with institutions \nthat train language specialists, in order to meet the needs in the six official languages \nof the United Nations; \n \n112. Requests the Secretary-General to continue to improve the internship \nprogramme, including through partnerships with organizations that promote the \nofficial languages of the United Nations; \n \n113. Welcomes the existing memorandums of understanding between the \nOrganization and 23 universities as a way to strengthen the training of language \nprofessionals in order to improve the recruitment of qualified language staff, and \nrequests the Secretary-General to continue his efforts to assess the appropriate \nnumber of memorandums of understanding in order to fulfil the needs of the \nOrganization; \n \n114. Requests the Secretary-General to make further concerted efforts to \npromote outreach programmes, such as traineeships and internships, and to introduce \n\nPattern of conferences \nA/RES/74/252\n \n13/13\n19-22680 \n \ninnovative methods to increase awareness of the programmes, including through \npartnerships with Member States, relevant international organizations and language \ninstitutions in all regions, in particular to close the wide gap of qualified candidates \nfrom Africa and from the Latin American and Caribbean region, and to report thereon \nto the General Assembly at its seventy-fifth session; \n \n115. Notes with appreciation the positive experience with language traineeships \nin training young professionals and in attracting them to the United Nations, while \nenhancing the pool of qualified language professionals in language combinations that \nare critical for succession-planning purposes, and encourages the Secretary-General \nto continue his efforts in this regard; \n \n116. Notes that the \u201cAfrican project\u201d has the aim of establishing postgraduate \nuniversity programmes in translation, conference interpreting and public service \ninterpreting through centres of excellence on the African continent, and requests the \nSecretary-General to continue to report on the achievements of this project; \n \n117. Also notes the difficulties encountered in identifying and retaining \nqualified language professionals and the need to replenish the pool of language \nexperts at the main duty stations, particularly New York and Nairobi, in order to \nprevent further negative impact on the capacity of the Secretariat to provide services \nin the six official languages of the United Nations; \n \n118. Welcomes the efforts made by the Secretary-General to raise awareness \namong all Member States and the general public of career opportunities in conference \nservices, including through the increased use of social media; \n \n119. Notes the update provided by the Secretary-General regarding the pilot \nproject related to the outposting to Vienna of translators from the French Translation \nService in New York, and requests the Secretary-General to provide to the General \nAssembly at its seventy-fifth session further updates on this matter, including on the \nquality of services, a cost-benefit analysis, information on workload-sharing and \nlessons learned; \n \n120. Requests the Secretary-General to continue to improve and strengthen his \ninitiatives related to training and replenishing the language capacity of the \nOrganization, including through the outreach programmes, in order to ensure \nsufficient capacity to address the interpretation and translation requirements of the \nOrganization; \n \n121. Also requests the Secretary-General to continue to liaise with permanent \nmissions to identify outreach opportunities with universities, educational institutions \nand language learning centres located worldwide in order to ensure the continued \navailability of high-quality professional language services in the six official \nlanguages of the United Nations; \n \n122. Further requests the Secretary-General to continue to improve and expand \nthe list of universities having memorandums of understanding and other collaborative \narrangements with the United Nations, ensuring the inclusion of universities, \neducational institutions and language learning centres located in all geographical \nregions, whenever possible. \n \n52nd (resumed) plenary meeting \n27 December 2019 \n \n",
  "paragraphs": {
    "1": "Welcomes the report of the Committee on Conferences for 2019;1",
    "2": "Approves the draft calendar of conferences and meetings of the United Nations for 2020, as submitted by the Committee on Conferences, 4 taking into account the observations of the Committee and subject to the provisions of the present resolution;",
    "3": "Authorizes the Committee on Conferences to make any adjustments to the revised calendar of conferences and meetings of the United Nations for 2020 that may become necessary as a result of actions and decisions taken by the General Assembly at its seventy-fourth session;",
    "4": "Recalls paragraph 40 of its resolution 71/323 of 8 September 2017 and paragraph 40 of its resolution 72/313 of 17 September 2018 on the revitalization of the work of the General Assembly;",
    "5": "Notes with satisfaction that the Secretariat has taken into account the arrangements referred to in General Assembly resolutions on the pattern of conferences, including resolutions 53/208 A of 18 December 1998, 54/248 of 23 December 1999, 55/222 of 23 December 2000, 56/242 of 24 December 2001, 57/283 B of 15 April 2003, 58/250 of 23 December 2003, 59/265 of 23 December 2004, 60/236 A of 23 December 2005, 61/236 of 22 December 2006, 62/225 of 22 December 2007, 63/248 of 24 December 2008, 64/230 of 22 December 2009, 65/245 of 24 December 2010, 66/233 of 24 December 2011, 67/237 of 24 December 2012, 68/251 of 27 December 2013, 72/19 of 1 December 2017 and 73/270, concerning Orthodox Good Friday and the official holidays of Eid al-Fitr and Eid al-Adha, and requests all intergovernmental bodies to observe those decisions when planning their meetings;",
    "6": "Also notes with satisfaction that the Secretariat has taken into account the arrangements referred to in relevant resolutions of the General Assembly regarding the pattern of conferences, including resolution 69/250 of 29 December 2014, concerning Yom Kippur, the Day of Vesak, Diwali, Gurpurab, Orthodox Christmas and Nowruz, and requests all relevant intergovernmental bodies to continue to observe the applicable decisions when planning their meetings;",
    "7": "Requests the Secretary-General to continue to ensure that any modification to the calendar of conferences and meetings is implemented strictly in accordance with the mandate of the Committee on Conferences and other relevant resolutions of the General Assembly;",
    "8": "Invites Member States to include in new legislative mandates adequate information on the modalities for the organization of conferences or meetings;",
    "9": "Recalls rule 153 of its rules of procedure, and, for resolutions involving expenditure, requests the Secretary-General to include the modalities of conferences, taking into account the trends of similar meetings, with a view to mobilizing conference and documentation services in the most efficient and cost-effective manner possible;",
    "10": "Reaffirms the need to address the issue of duplications and redundancies in conference servicing, and notes Economic and Social Council resolution 2018/30 of 24 July 2018; __________________ 4 See Official Records of the General Assembly, Seventy-fourth Session, Supplement No. 32 (A/74/32), annex II. Pattern of conferences A/RES/74/252 3/13 19-22680",
    "11": "Expresses concern regarding the recurring extension of the work of the Fifth Committee during the second part of the resumed session of the General Assembly and the impact of such an extension on the services provided by the Secretariat, including the availability of conference rooms and language services; II Utilization of conference-servicing resources",
    "12": "Reaffirms the practice that, in the use of conference rooms, priority must be given to meetings of Member States;",
    "13": "Calls upon the Secretary-General and Member States to adhere to the guidelines and procedures contained in the administrative instruction for the authorization of the use of United Nations premises for meetings, conferences, special events and exhibits;5",
    "14": "Notes that ST/AI/416 of 26 April 1996, which regulates the use of United Nations premises, has been updated and superseded at Headquarters in New York by ST/AI/2019/4 of 23 September 2019, and encourages the Directors-General of other conference-servicing duty stations to review and update as necessary their information circulars governing the use of United Nations premises;",
    "15": "Emphasizes that such meetings, conferences, special events and exhibits must be consistent with the purposes and principles of the United Nations;",
    "16": "Notes that the overall interpretation utilization factor for all calendar bodies at the four main duty stations was 82 per cent in 2018, 81 per cent in 2017 and 80 per cent in 2016, 2015 and 2014, which met the established benchmark of 80 per cent;",
    "17": "Urges those intergovernmental bodies whose average interpretation utilization factor has for the past six years been below the benchmark of 80 per cent to take that factor into account when planning their future sessions in order to achieve that benchmark;",
    "18": "Reiterates its request to intergovernmental bodies to review their meeting entitlements and to plan and adjust their programmes of work on the basis of their actual utilization of conference-servicing resources in order to improve their efficient use and to achieve optimum utilization of conference services;",
    "19": "Urges the secretariats and bureaux of bodies that underutilize their conference-servicing resources to work more closely with the Department for General Assembly and Conference Management of the Secretariat and to consider changes to their programmes of work, as appropriate, including adjustments based on previous patterns of recurring agenda items, with a view to making improvements in their interpretation utilization factors;",
    "20": "Recognizes that late starts and unplanned early endings seriously affect the interpretation utilization factor of those bodies, invites the secretariats and bureaux of the bodies to pay adequate attention in this regard, and welcomes their efforts to inform the Secretariat in a timely manner of any such changes in order to allow conference services to be smoothly redeployed to other meetings;",
    "21": "Requests the Committee on Conferences to consult those bodies that have consistently utilized less than the applicable benchmark of their allocated resources for the past six years, with a view to making appropriate recommendations in order to achieve the optimum utilization of conference-servicing resources; __________________ 5 ST/AI/416. A/RES/74/252 Pattern of conferences 19-22680 4/13",
    "22": "Welcomes the efforts undertaken by the Secretary-General to increase the utilization of conference-servicing resources, and in this regard encourages the Secretary-General to enhance the efficiency of conference servicing and to report thereon to the General Assembly at its seventy-fifth session;",
    "23": "Requests the Secretary-General to consult Member States on initiatives that affect the utilization of conference services and conference facilities;",
    "24": "Also requests the Secretary-General to continue to impress upon bodies entitled to meet \u201cas required\u201d the need to further improve the utilization of conference services, and further requests the Secretary-General to report on the provision of such services to those bodies to the General Assembly at its seventy-fifth session;",
    "25": "Recognizes the importance of meetings of regional and other major groupings of Member States for the smooth functioning of the sessions of intergovernmental bodies, requests the Secretary-General to ensure that, as far as possible, all requests for conference services for the meetings of regional and other major groupings of Member States are met, and requests the Department for General Assembly and Conference Management to inform the requesters as early as possible about the availability of conference services, including interpretation, as well as about any changes that might occur before the holding of meetings;",
    "26": "Notes the overall increase in the percentage of meetings held by regional and other major groupings of Member States that were provided with interpretation services at the four main duty stations in 2018, and requests the Secretary-General to further employ innovative means to address the difficulties arising from the lack of interpretation services for such meetings and to report thereon to the General Assembly at its seventy-fifth session;",
    "27": "Once again urges intergovernmental bodies at the planning stage to take into account the meetings of regional and other major groupings of Member States, to make provision for such meetings in their programmes of work and to notify the Department for General Assembly and Conference Management, well in advance, of any cancellations so that unutilized conference-servicing resources may, to the extent possible, be reassigned to meetings of regional and other major groupings of Member States;",
    "28": "Recognizes the improvement in the rate of room utilization of the conference centre of the Economic Commission for Africa and the ongoing efforts aimed at improving the conference facilities at the Commission;",
    "29": "Looks forward to receiving the proposal aimed at addressing the deteriorating conditions and the limited capacity of the conference services facility at the United Nations Office at Nairobi;",
    "30": "Recognizes the proactive efforts of the Secretary-General to identify ways to enhance efficiency and effectiveness in conference services, commends the Department for General Assembly and Conference Management for its innovative approaches in providing technical secretariat support and in managing meetings and documents, and encourages the Department to continue its efforts to preserve the high quality of its services while achieving efficiencies;",
    "31": "Requests the Secretary-General to continue his efforts aimed at improving conference servicing at the four main duty stations, including by addressing or eliminating possible duplication, overlap and redundancy, and identifying innovative ideas, potential synergies and other cost-saving measures, without compromising quality or affecting the provision of services, and to report thereon to the General Assembly at its seventy-fifth session; Pattern of conferences A/RES/74/252 5/13 19-22680",
    "32": "Reiterates the need to continue to improve all conference facilities, including the videoconferencing infrastructure, at all four main duty stations, and in this regard requests the Secretary-General to report thereon no later than at the seventy-fifth session of the General Assembly;",
    "33": "Welcomes the measures taken to ensure access to and use of conference services and conference facilities for persons with disabilities, including the establishment of the Accessibility Centre, and requests the Secretary-General to continue to address issues related to the accessibility of conference facilities in all four main conference-servicing duty stations as a matter of priority and to report thereon to the General Assembly at its seventy-fifth session;",
    "34": "Also welcomes the integrated global management rule as an efficient approach, where feasible, to servicing meetings away from duty stations, and in this regard requests the Secretary-General to continue his efforts to realize further efficiencies by rigorously applying the integrated global management rule to applicable meetings, without jeopardizing the quality of services, and to continue to report thereon to the Committee on Conferences; III Enhancing integrated global management, leveraging technology and measuring the quality of conference services",
    "35": "Recalls paragraph 24 of the report of the Secretary-General on the pattern of conferences 6 also recalls that, in paragraph 81 of its resolution 56/253 of 24 December 2001, it requested the Secretary-General to ensure that conference services were managed in an integrated manner throughout all duty stations in the Organization, stresses again that the Department for General Assembly and Conference Management is responsible for the implementation of policy, the formulation of standards and guidelines, overseeing and coordinating United Nations conference services and the overall management of resources under the relevant budget section, while the United Nations Offices at Geneva, Vienna and Nairobi remain responsible and accountable for day-to-day operational activities, as indicated in section II.B, paragraph 7, of its resolution 57/283 B;",
    "36": "Notes the completion of the internal reviews concerning accountability mechanisms and the clear delineation of responsibility between the Under-Secretary- General for General Assembly and Conference Management and the Directors- General of the United Nations Offices at Geneva, Nairobi and Vienna for conference management policies, operations and resource utilization, requests the Secretary- General to report on the outcome of the internal reviews to the General Assembly at its seventy-fifth session, and in this regard recalls, inter alia, paragraph 36 of its resolution 73/270;",
    "37": "Welcomes the innovative efforts of the Department for General Assembly and Conference Management to improve conference services with a view to facilitating the decision-making process by intergovernmental bodies, and requests the Secretary-General to continue to explore technological and other innovations that advance effectiveness and efficiency in this regard and to report on these efforts during the seventy-fifth session;",
    "38": "Notes the initiatives undertaken in the context of the integrated global management concept aimed at streamlining procedures, achieving economies of scale and improving the quality of conference services, and in this regard stresses the __________________ 6 A/70/122. A/RES/74/252 Pattern of conferences 19-22680 6/13 importance of ensuring the equal treatment of conference-servicing staff, as well as the principle of equal grade for equal work at the four main duty stations;",
    "39": "Acknowledges that the concept of integrated global management has been fully mainstreamed into all areas of conference services across the four main conference-servicing duty stations, and requests the Secretary-General to keep the General Assembly and the Committee on Conferences apprised of progress made in ensuring integrated global management and to provide accurate and up-to-date information on new initiatives falling under the purview of the Committee;",
    "40": "Notes with appreciation the progress made in the development and implementation of conference management software such as gData, gDoc, gMeets and gText, and requests the Secretary-General to ensure that they are implemented as enterprise systems in the context of the Secretariat-wide information and communications technology strategy, as welcomed by the General Assembly in its resolution 69/262 of 29 December 2014, and to report on progress made regarding operations, maintenance and harmonization with existing systems, as appropriate;",
    "41": "Underlines that all the initiatives on leveraging technology, including those introduced on a trial basis, shall comply with the principle of parity among the official languages of the Organization, with a view to preserving and enhancing the quality and scope of the services provided by the Secretariat;",
    "42": "Reiterates that the satisfaction of Member States is a key performance indicator in conference management and conference services;",
    "43": "Requests the Secretary-General to continue to ensure that measures taken by the Department for General Assembly and Conference Management to seek the evaluation by Member States of the quality of the conference services provided to them, as a key performance indicator of the Department, provide equal opportunities to Member States to present their evaluations in the six official languages of the United Nations and are in full compliance with relevant resolutions of the General Assembly, and also requests the Secretary-General to report to the Assembly, through the Committee on Conferences, on progress made in this regard;",
    "44": "Also requests the Secretary-General to continue to explore best practices and techniques in client satisfaction evaluations, to seek a larger rate of response to surveys on quality and to report regularly to the General Assembly on the results achieved;",
    "45": "Welcomes the efforts made by the Department for General Assembly and Conference Management to seek the evaluation by Member States of the quality of the conference services provided to them, taking into consideration comments and complaints raised by Member States either in writing or during meetings, and requests the Secretary-General to intensify his exploration of innovative ways to systematically capture and analyse feedback from Member States and Chairs and Secretaries of committees on the quality of conference services and to report thereon to the General Assembly at its seventy-fifth session;",
    "46": "Requests the Secretary-General to continue to seek evaluation of the quality of the conference services provided by the Secretariat through meetings held at least once a year, but not exceeding twice a year, guaranteeing that Member States are able to present their evaluations and seek information equally in any of the six official languages of the United Nations on any conference-related or language- specific matter; Pattern of conferences A/RES/74/252 7/13 19-22680 IV Matters related to documentation and publications",
    "47": "Emphasizes the paramount importance of the equality of the six official languages of the United Nations;",
    "48": "Underlines that all the initiatives on the evolution of working methods, including those introduced on a trial basis, shall comply with the principle of parity among the official languages of the Organization, with a view to preserving or enhancing the quality and scope of the services provided by the Secretariat;",
    "49": "Emphasizes the importance of multilingualism in the activities of the United Nations, and requests the Secretary-General to continue his efforts to ensure full parity among the six official languages in accordance with General Assembly resolution 73/346 and to report thereon to the Assembly at its seventy-fifth session;",
    "50": "Also emphasizes the importance of making use of all the official languages of the United Nations, ensuring their full and equitable treatment in all the activities of the Department of Global Communications of the Secretariat, with the aim of eliminating the disparity between the use of English and the use of the five other official languages, and in this regard reaffirms its request that the Secretary-General ensure the archiving of official meetings webcasts in all six official languages on the United Nations website;",
    "51": "Welcomes the appointment by the Secretary-General of the Coordinator for Multilingualism, who is responsible for the overall implementation of multilingualism Secretariat-wide, and calls upon all departments and offices within the Secretariat to fully support the work of the Coordinator in the implementation of the relevant mandates on multilingualism;",
    "52": "Emphasizes that multilingualism, as a core value of the Organization, entails the active involvement and commitment of all stakeholders, including all United Nations duty stations and offices away from Headquarters;",
    "53": "Welcomes the submission by the Secretary-General, in his report on multilingualism, 7 of detailed terms of reference for the Coordinator for Multilingualism, as requested in resolution 70/9 of 13 November 2015, recalls its endorsement, in resolution 71/328 of 11 September 2017, of the terms of reference proposed by the Secretary-General, requests that subsequent updates to the terms of reference be made available to all Member States and Secretariat entities, and welcomes the efforts made by the Coordinator in this regard;",
    "54": "Requests the Secretary-General to ensure the consistent and effective implementation of the terms of reference for the Coordinator for Multilingualism and to report thereon to the General Assembly at its seventy-fifth session;",
    "55": "Emphasizes the role of Member States and their intergovernmental bodies in determining the policies on conference management;",
    "56": "Stresses that proposals to change such policies are to be approved by Member States in their relevant intergovernmental bodies;",
    "57": "Also stresses that matters related to conference management, including documentation, fall within the purview of the Fifth Committee;",
    "58": "Reiterates the importance of the timely submission and issuance of documents for all intergovernmental bodies, including the Fifth Committee; __________________ 7 A/71/757. A/RES/74/252 Pattern of conferences 19-22680 8/13",
    "59": "Notes with concern the recurring late issuance of documents for the Fifth Committee, recalls paragraph 29 of its resolution 70/247 of 23 December 2015, and requests the Secretary-General to continue to take actions for its effective implementation, taking into account the responsibilities of all stakeholders involved, and to report thereon in the context of his next report on the pattern of conferences;",
    "60": "Welcomes the efforts made by the Secretariat, in particular the Department for General Assembly and Conference Management, regarding the timely issuance of pre-session documentation for the Fifth Committee in the six official languages of the United Nations, and encourages continued efforts by all stakeholders in this regard;",
    "61": "Encourages the Chairs of the Fifth Committee and the Advisory Committee on Administrative and Budgetary Questions to continue to promote cooperation between the two bodies in the sphere of documentation;",
    "62": "Notes that accurate, timely and consistent information provided by the Secretariat to the Fifth Committee during its informal consultations facilitates the decision-making process in the Committee;",
    "63": "Reaffirms its decision, in section IV of its resolution 64/230, that all reports adopted by the Working Group on the Universal Periodic Review of the Human Rights Council shall be issued as documents in all official languages of the United Nations in a timely manner before their consideration by the Council, in accordance with General Assembly resolutions 36/117 A of 10 December 1981, 51/211 A to E of 18 December 1996, 52/214 of 22 December 1997, 53/208 A to E of 18 December 1998 and 59/265, and requests the Secretary-General to ensure the support necessary to that effect and to report thereon to the Assembly at its seventy- fifth session;",
    "64": "Reiterates paragraph 8 of the annex to its resolution 2 (I) of 1 February 1946 on the rules of procedure concerning languages, whereby all resolutions and other important documents shall be made available in all six official languages and, upon the request of any representative, any other document shall be made available in any or all of the official languages;",
    "65": "Also reiterates the importance of the simultaneous issuance of documents in all official languages and welcomes the 100 per cent compliance in 2018 with the issuance of documents by all duty stations, and reiterates its request that the Secretary-General ensure strict respect for the rules concerning the simultaneous issuance of documents in all six official languages as regards both the distribution of printed copies and the posting of parliamentary documentation on the Official Document System and the United Nations website;",
    "66": "Requests the Secretary-General to continue to take action on providing the timely and simultaneous issuance of documents in all six official languages;",
    "67": "Notes that workload-sharing has expanded to include text-processing in addition to translation and editing, and requests the Secretary-General to continue to seek ways to promote workload-sharing among the four main duty stations and to report thereon to the General Assembly at its seventy-fifth session;",
    "68": "Emphasizes that the major goals of the Department for General Assembly and Conference Management are to provide high-quality documents in a timely manner in all official languages, in accordance with established regulations, as well as high-quality conference services to Member States at all headquarters duty stations, and to achieve those aims as efficiently and cost-effectively as possible, in accordance with the relevant resolutions of the General Assembly;",
    "69": "Also emphasizes the importance of enhancing accountability within the Secretariat for the timely submission and issuance of documents; Pattern of conferences A/RES/74/252 9/13 19-22680",
    "70": "Requests the Secretary-General to continue to include in the senior managers\u2019 compacts the new standard managerial indicator related to the timely submission of official documentation for intergovernmental and expert bodies and to report thereon in future progress reports on accountability;",
    "71": "Also requests the Secretary-General to include, in future budget proposals, information related to the timely submission of documentation needed for meetings of relevant intergovernmental and expert bodies;",
    "72": "Reaffirms its decision in section III, paragraph 9, of its resolution 59/265 that the issuance of documents in all six official languages on planning, budgetary and administrative matters requiring urgent consideration by the General Assembly shall be accorded priority;",
    "73": "Reiterates its request that the Secretary-General direct all departments of the Secretariat to include the following elements in their reports: (a) A summary of the report; (b) Consolidated conclusions, recommendations and other proposed actions; (c) Relevant background information; and its request that all documents submitted to legislative organs, including the Committee on Conferences, by the Secretariat and intergovernmental and expert bodies for consideration and action have conclusions and recommendations in bold print;",
    "74": "Notes with concern that only 76 per cent of the author departments reached the compliance rate of 90 per cent in the timely submission of their reports to the Department for General Assembly and Conference Management, reiterates its request to the Secretary-General to enforce the slotting system more rigorously through a dedicated focus, such as the interdepartmental task force on documentation, and to report thereon to the General Assembly at its seventy-fifth session, urges author departments to fully adhere to deadlines for document submission, and requests the Secretary-General to continue to report on concrete measures taken;",
    "75": "Notes with appreciation the work of the interdepartmental task force on documentation, chaired by the Department for General Assembly and Conference Management, to facilitate the submission of documents by author departments of the Secretariat;",
    "76": "Reiterates its request in paragraph 77 of its resolution 73/270 that the Secretary-General provide information on the waiver process for documents that are submitted over the word limit;",
    "77": "Notes that the Official Document System is the official digital repository of the United Nations, welcomes its modernization, including the introduction of a portable Official Document System, and its accessibility in all six official languages of the United Nations, and encourages the Secretary-General to continue his efforts in this regard;",
    "78": "Requests the Secretary-General to continue his efforts to upload all important older United Nations documents on to the United Nations website in all six official languages on a priority basis so that those archives will also be available to Member States and the general public;",
    "79": "Also requests the Secretary-General to take all measures necessary to ensure that the digitization of key documents in the Dag Hammarskj\u00f6ld Library and in the main duty stations is completed in a timely manner, as appropriate; A/RES/74/252 Pattern of conferences 19-22680 10/13",
    "80": "Recalls paragraph 82 of its resolution 73/270, and in this regard requests the Secretary-General to entrust the Department of Global Communications with presenting a proposal for the digitization of important older United Nations documents stored at the United Nations Headquarters Dag Hammarskj\u00f6ld Library for consideration by the General Assembly through the Committee on Information no later than at the main part of its seventy-fifth session, outlining, inter alia, the definition of important older United Nations documents, as well as the scope and estimated quantity, cost and time frame;",
    "81": "Expresses concern that the anticipated lengthy digitization project may jeopardize the retention of historical knowledge and information in view of the delicate state and risk of breakage of many of the related documents;",
    "82": "Requests the Secretary-General to seek additional voluntary contributions for the digitization of important older United Nations documents, including by broadening the donor base, and to report thereon in the context of the report requested in paragraph 80 above;",
    "83": "Welcomes with appreciation the additional contribution from the Government of Qatar to support the digitization project;",
    "84": "Recalls paragraph 85 of its resolution 73/270, notes the increased use of digital recordings by other intergovernmental bodies, including the United Nations Commission on International Trade Law and the United Nations Industrial Development Organization, and requests the Secretary-General to continue to report to the General Assembly in this regard;",
    "85": "Stresses that verbatim and summary records remain the only official records of the meetings of United Nations bodies;",
    "86": "Reiterates paragraph 87 of its resolution 73/270 related to the transition to digital recordings of meetings in the six official languages of the Organization as a cost-saving measure;",
    "87": "Recalls paragraph 5 of its resolution 49/221 B of 23 December 1994, and stresses that the timely issuance of verbatim records constitutes an important part of the services provided to Member States; V Matters related to language services",
    "88": "Requests the Secretary-General to continue his efforts to ensure the highest quality of interpretation and translation services in all six official languages;",
    "89": "Welcomes the efforts of the Secretary-General to continue to improve the quality of the simultaneous interpretation and translation services provided, and requests the Secretary-General to take action in this regard;",
    "90": "Underlines that the translation of official documents of the Organization must be provided in all required languages and in due time, in full compliance with the rules of procedure of the respective legislative bodies;",
    "91": "Requests the Secretary-General to continue to improve the quality of translation of documents into the six official languages, giving particular significance to the accuracy of translation;",
    "92": "Also requests the Secretary-General to continue to ensure that the terminology used in the translation and interpretation services reflects the latest linguistic norms and terminology of the official languages in order to ensure the highest quality; Pattern of conferences A/RES/74/252 11/13 19-22680",
    "93": "Further requests the Secretary-General to continue to maintain and update the global terminology portal in order to ensure its availability to United Nations staff, Member States and the general public, with a view to achieving harmonization of the terminology used at all United Nations duty stations;",
    "94": "Requests the Secretary-General, as the Chair of the United Nations System Chief Executives Board for Coordination, to continue to invite the heads of participating funds, programmes and specialized agencies of the United Nations system to consider using official United Nations terminology and to report thereon to the General Assembly at its seventy-fifth session;",
    "95": "Notes that the pool of language professionals at duty stations is uneven in terms of language combinations, and requests the Secretary-General to continue his efforts to develop recruitment, subcontracting and outreach policies that take full account of those imbalances and to report thereon to the General Assembly at its seventy-fifth session;",
    "96": "Requests the Secretary-General to ensure that all language services are given equal treatment and are provided with equally favourable working conditions and resources, with a view to achieving the maximum quality of services, with full respect for the specificities of the six official languages and taking into account their respective workloads;",
    "97": "Also requests the Secretary-General to take measures to ensure equal treatment of all six official languages and equal quality of service for Member States, while fully respecting the specificities of each official language and different levels of benefit from information technology advances for different languages, including by addressing workload inequities arising from staffing structures and specificities of language, and to report thereon to the General Assembly at its seventy-fifth session;",
    "98": "Reiterates the need for the Secretary-General to ensure the compatibility of technologies used in all duty stations and to ensure that they are user-friendly in all official languages;",
    "99": "Welcomes the development of the computer-assisted translation and machine translation system (eLUNa), and requests the Secretary-General to report on updates, including cost-benefit analysis and quality preservation and control, to this system to the General Assembly at its seventy-fifth session;",
    "100": "Recalls section VII of its resolution 69/274 A of 2 April 2015, and requests the Secretary-General to ensure that the implementation of flexible workplace strategies and other potential changes in logistical arrangements take into account the needs of language staff in order to continue to ensure that the services provided to Member States meet the highest standard of quality;",
    "101": "Reaffirms paragraph 102 of its resolution 73/270, and reiterates its request that the Secretary-General, when recruiting temporary assistance in the language services, including through the use of international or local contracts, as appropriate, ensure that all language services are given equal treatment and are provided with equally favourable working conditions and resources, with a view to achieving maximum quality of their services, with full respect for the specificities of each of the six official languages and taking into account their respective workloads;",
    "102": "Recalls section IV of its resolution 69/274 A, and requests the Secretary- General to keep the working conditions of interpreters under review;",
    "103": "Requests the Secretary-General to fill vacancies in the language services, in particular in the translation services and interpretation services, in a timely manner A/RES/74/252 Pattern of conferences 19-22680 12/13 and in full compliance with relevant provisions of the General Assembly resolutions governing recruitment for language staff, and to report thereon to the Assembly at its seventy-fifth session;",
    "104": "Also requests the Secretary-General to continue his efforts to hold competitive examinations for the recruitment of language staff sufficiently in advance in order to fill current and future vacancies in the language services in a timely manner and to inform the General Assembly at its future sessions of efforts in this regard;",
    "105": "Further requests the Secretary-General to continue to make every effort to enhance access to competitive examinations for applicants in all regions, including by organizing remote examinations and by bringing, to the extent possible, examination sites closer to their locations in order to allow the greatest number of potentially qualified candidates to participate in them, and to report to the General Assembly at its future sessions on progress made in this regard;",
    "106": "Stresses the need to fully ensure the highest possible quality of contractual and in-house translation, and freelance and in-house interpretation, and requests the Secretary-General to report on measures taken in this regard;",
    "107": "Reiterates its request that the Secretary-General provide, at all duty stations, adequate staff at the appropriate level, with a view to ensuring appropriate quality control for external translation;",
    "108": "Requests the Secretary-General to apply common standards for the quality control of documents processed by external translators in all four duty stations in order to ensure high-quality translations in the six official languages of the United Nations, and to report thereon to the General Assembly at its future sessions;",
    "109": "Also requests the Secretary-General to ensure that the experience, lessons learned and best practices of the main duty stations in performing quality control of contractual and in-house translations, including on requirements relating to the number and appropriate level of staff needed to carry out this function, are shared among duty stations and regional commissions, as appropriate;",
    "110": "Notes that the Secretary-General has established globally standardized performance indicators and costing models aimed at a more cost-effective strategy for the in-house processing of documents, and requests the Secretary-General to ensure their effective application at the four main duty stations;",
    "111": "Notes with appreciation the measures taken by the Secretary-General, in accordance with its resolutions, to address the issue of the replacement of retiring staff in the language services, and requests the Secretary-General to maintain and intensify those efforts, including the strengthening of cooperation with institutions that train language specialists, in order to meet the needs in the six official languages of the United Nations;",
    "112": "Requests the Secretary-General to continue to improve the internship programme, including through partnerships with organizations that promote the official languages of the United Nations;",
    "113": "Welcomes the existing memorandums of understanding between the Organization and 23 universities as a way to strengthen the training of language professionals in order to improve the recruitment of qualified language staff, and requests the Secretary-General to continue his efforts to assess the appropriate number of memorandums of understanding in order to fulfil the needs of the Organization;",
    "114": "Requests the Secretary-General to make further concerted efforts to promote outreach programmes, such as traineeships and internships, and to introduce Pattern of conferences A/RES/74/252 13/13 19-22680 innovative methods to increase awareness of the programmes, including through partnerships with Member States, relevant international organizations and language institutions in all regions, in particular to close the wide gap of qualified candidates from Africa and from the Latin American and Caribbean region, and to report thereon to the General Assembly at its seventy-fifth session;",
    "115": "Notes with appreciation the positive experience with language traineeships in training young professionals and in attracting them to the United Nations, while enhancing the pool of qualified language professionals in language combinations that are critical for succession-planning purposes, and encourages the Secretary-General to continue his efforts in this regard;",
    "116": "Notes that the \u201cAfrican project\u201d has the aim of establishing postgraduate university programmes in translation, conference interpreting and public service interpreting through centres of excellence on the African continent, and requests the Secretary-General to continue to report on the achievements of this project;",
    "117": "Also notes the difficulties encountered in identifying and retaining qualified language professionals and the need to replenish the pool of language experts at the main duty stations, particularly New York and Nairobi, in order to prevent further negative impact on the capacity of the Secretariat to provide services in the six official languages of the United Nations;",
    "118": "Welcomes the efforts made by the Secretary-General to raise awareness among all Member States and the general public of career opportunities in conference services, including through the increased use of social media;",
    "119": "Notes the update provided by the Secretary-General regarding the pilot project related to the outposting to Vienna of translators from the French Translation Service in New York, and requests the Secretary-General to provide to the General Assembly at its seventy-fifth session further updates on this matter, including on the quality of services, a cost-benefit analysis, information on workload-sharing and lessons learned;",
    "120": "Requests the Secretary-General to continue to improve and strengthen his initiatives related to training and replenishing the language capacity of the Organization, including through the outreach programmes, in order to ensure sufficient capacity to address the interpretation and translation requirements of the Organization;",
    "121": "Also requests the Secretary-General to continue to liaise with permanent missions to identify outreach opportunities with universities, educational institutions and language learning centres located worldwide in order to ensure the continued availability of high-quality professional language services in the six official languages of the United Nations;",
    "122": "Further requests the Secretary-General to continue to improve and expand the list of universities having memorandums of understanding and other collaborative arrangements with the United Nations, ensuring the inclusion of universities, educational institutions and language learning centres located in all geographical regions, whenever possible. 52nd (resumed) plenary meeting 27 December 2019"
  },
  "agenda_items": [
    "Item 138"
  ],
  "symbol_references": []
}