{
  "symbol": "A/RES/72/137",
  "filename": "A_RES_72_137.pdf",
  "title": "72/137. Follow-up to the Declaration and Programme of Action on a Culture of Peace",
  "text": "United Nations \nA/RES/72/137\n \n \nGeneral Assembly \nDistr.: General \n15 January 2018 \n \n17-22364 (E)    180118  \n*1722364* \n \n \nSeventy-second session \nAgenda item 15 \n \n \n \n \n Resolution adopted by the General Assembly \non 11 December 2017 \n \n \n \n \n[without reference to a Main Committee (A/72/L.30 and A/72/L.30/Add.1)] \n \n \n 72/137. Follow-up to the Declaration and Programme of Action \non a Culture of Peace \n \n \n \nThe General Assembly, \n \nBearing in mind the Charter of the United Nations, including the purposes and \nprinciples contained therein, and especially the dedication to saving succeeding \ngenerations from the scourge of war, \n \nRecalling the Constitution of the United Nations Educational, Scientific and \nCultural Organization, which states that, \u201csince wars begin in the minds of men, it is \nin the minds of men that the defences of peace must be constructed\u201d, \n \nRecognizing the importance of the Declaration1 and Programme of Action2 on a \nCulture of Peace, adopted by the General Assembly on 13 September 1999, which \nserve as the universal mandate for the international community, particularly the \nUnited Nations system, for the promotion of a culture of peace and non-violence that \nbenefits humanity, in particular future generations, \n \nRecalling its previous resolutions on a culture of peace, in particular resolution \n52/15 of 20 November 1997 proclaiming 2000 the International Year for the Culture \nof Peace, resolution 53/25 of 10 November 1998 proclaiming the period 2001\u20132010 \nthe International Decade for a Culture of Peace and Non-Violence for the Children of \nthe World, and resolutions 56/5 of 5 November 2001, 57/6 of 4 November 2002, 58/11 \nof 10 November 2003, 59/143 of 15 December 2004, 60/3 of 20 October 2005, 61/45 \nof 4 December 2006, 62/89 of 17 December 2007, 63/113 of 5 December 2008, 64/80 \nof 7 December 2009, 65/11 of 23 November 2010, 66/116 of 12 December 2011, \n67/106 of 17 December 2012, 68/125 of 18 December 2013, 69/139 of 15 December \n2014, 70/20 of 3 December 2015 and 71/252 of 23 December 2016, adopted under its \nagenda item entitled \u201cCulture of peace\u201d, \n__________________ \n \n1 Resolution 53/243 A. \n \n2 Resolution 53/243 B. \n\nA/RES/72/137 \nFollow-up to the Declaration and Programme of Action on a Culture of Peace\n \n17-22364 \n2/5 \n \n \nRecalling also its resolutions 70/109 of 10 December 2015 on a world against \nviolence and violent extremism and 70/291 of 1 July 2016 on the United Nations \nGlobal Counter-Terrorism Strategy Review, and noting the establishment of the \nUnited Nations Office of Counter-Terrorism under resolution 71/291 of 15 June 2017, \n \nReaffirming the United Nations Millennium Declaration,3 which calls for the \nactive promotion of a culture of peace, \n \nReaffirming also its resolution 70/1 of 25 September 2015, entitled \n\u201cTransforming our world: the 2030 Agenda for Sustainable Development\u201d, \n \nRecalling its resolution 70/262 on the review of the United Nations \npeacebuilding architecture, \n \nTaking note of the 2005 World Summit Outcome adopted at the high-level \nplenary meeting of the General Assembly,4 \n \nWelcoming the observance of 10 December as Human Rights Day,5 9 December \nas the International Day of Commemoration and Dignity of the Victims of the Crime \nof Genocide and of the Prevention of This Crime 6 and 2 October as the International \nDay of Non-Violence,7 as proclaimed by the United Nations, \n \nRecognizing that all efforts made by the United Nations system in general and \nthe international community at large for peacekeeping, peacebuilding, mediation, the \nprevention of conflicts, disarmament, sustainable development, the promotion of \nhuman dignity and human rights, democracy, the rule of law, good governance and \ngender equality at the national and international levels contribute greatly to a culture \nof peace, \n \nRecognizing also that efforts towards peacebuilding and sustaining peace need \nto take into account the promotion of a culture of peace, \n \nRecognizing further the importance of respect and understanding for religious \nand cultural diversity throughout the world, of choosing dialogue and negotiations \nover confrontation and of working together and not against each other, \n \nTaking note of the report of the Secretary-General,8 which provides an overview \nof the activities that have been carried out by the main United Nations entities \nworking in the areas of a culture of peace as well as interreligious and intercultural \ndialogue, understanding and cooperation for peace since the adoption by the General \nAssembly of its resolutions 71/249 of 22 December 2016 and 71/252, \n \nRecalling the proclamation by the United Nations Educational, Scientific and \nCultural Organization of 21 February as International Mother Language Day, which \naims at protecting, promoting and preserving linguistic and cultural diversity and \nmultilingualism, in order to foster and enrich a culture of peace, social harmony, \ncross-cultural dialogue and mutual understanding, \n \nRecalling also the proclamation by the United Nations Educational, Scientific \nand Cultural Organization of 30 April as International Jazz Day, which aims to \ndevelop and increase intercultural exchanges and understanding between cultures for \nthe purpose of mutual comprehension, tolerance and the promotion of a culture of \npeace, \n__________________ \n \n3 Resolution 55/2. \n \n4 Resolution 60/1. \n \n5 Resolution 423 (V). \n \n6 Resolution 69/323. \n \n7 Resolution 61/271. \n \n8 A/72/488. \n\nFollow-up to the Declaration and Programme of Action on a Culture of Peace \nA/RES/72/137\n \n3/5 \n17-22364 \n \n \nWelcoming the efforts of the international community to enhance understanding \nthrough constructive dialogue among civilizations, in particular through various \ninitiatives at the local, national, regional and international levels, \n \nExpressing its appreciation for the ongoing efforts of the United Nations \nAlliance of Civilizations in promoting a culture of peace through a number of \npractical projects in the areas of youth, education, media and migrations, in \ncollaboration with Governments, international organizations, foundations and civil \nsociety groups, as well as media and the private sector, \n \nTaking note of the meeting of the Group of Friends of the United Nations \nAlliance of Civilizations, held at United Nations Headquarters on 22 September 2017 \nat the level of Ministers for Foreign Affairs and heads of international organizations, \non the theme \u201cYouth engagement: the nexus to building inclusive societies and \nsustaining peace\u201d, and highlighting the role of youth in its programmes and policy \nwork advancing the culture of peace, \n \nWelcoming the successful holding on 7 September 2017 of the General \nAssembly High-level Forum on the Culture of Peace, convened by the President of \nthe Assembly, and noting the focus, relevance and importance of early childhood \ndevelopment in promoting a culture of peace, \n \nRecognizing the role of women and youth, as well as the contribution of \nchildren, in advancing a culture of peace, and in particular the importance of greater \ninvolvement of women in the prevention and resolution of conflicts and in activities \npromoting a culture of peace, including in post-conflict situations, \n \nWelcoming the adoption by the General Conference of the United Nations \nEducational, Scientific and Cultural Organization at its thirty-sixth session of a \nprogramme of action for a culture of peace and non-violence, and noting that the \nobjectives of that programme of action are in line with the Declaration and \nProgramme of Action on a Culture of Peace adopted by the General Assembly, \n \nNoting the initiatives of civil society, in collaboration with Governments, to \nstrengthen civilian capacities to enhance the physical safety of vulnerable populations \nunder threat of violence and to promote the peaceful settlement of disputes, \n \nEncouraging the continued and increasing efforts and activities on the part of \ncivil society organizations throughout the world in advancing a culture of peace as \nenvisaged in the Declaration and Programme of Action, \n \n1. \nReiterates that the objective of the effective implementation of the \nProgramme of Action on a Culture of Peace2 is to strengthen further the global \nmovement for a culture of peace following the observance of the International Decade \nfor a Culture of Peace and Non-Violence for the Children of the World, 2001\u20132010, \nand calls upon all concerned to renew their attention to this objective; \n \n2. \nWelcomes the inclusion of the promotion of a culture of peace in the 2030 \nAgenda for Sustainable Development;9 \n \n3. \nInvites Member States to continue to place greater emphasis on and expand \ntheir activities promoting a culture of peace at the national, regional and international \nlevels and to ensure that peace and non-violence are fostered at all levels; \n \n4. \nInvites the entities of the United Nations system, within their existing \nmandates, to integrate, as appropriate, the eight action areas of the Programme of \nAction into their programmes of activities, focusing on promoting a culture of peace \nand non-violence at the national, regional and international levels; \n__________________ \n \n9 Resolution 70/1. \n\nA/RES/72/137 \nFollow-up to the Declaration and Programme of Action on a Culture of Peace\n \n17-22364 \n4/5 \n \n \n5. \nCommends the United Nations Educational, Scientific and Cultural \nOrganization for strengthening efforts to mobilize all relevant stakeholders within and \noutside the United Nations system in support of a culture of peace, and invites the \nOrganization to continue to enhance communication and outreach, including through \nthe culture of peace website; \n \n6. \nCommends the practical initiatives and actions by relevant United Nations \nbodies, including the United Nations Children\u2019s Fund, the United Nations Entity for \nGender Equality and the Empowerment of Women (UN-Women) and the University \nfor Peace, as well as their activities in further promoting a culture of peace and \nnon-violence, in particular the promotion of peace education and activities related to \nspecific areas identified in the Programme of Action, and encourages them to continue \nand further strengthen and expand their efforts; \n \n7. \nUnderlines that early childhood development contributes to the \ndevelopment of more peaceful societies through advancing equality, tolerance, human \ndevelopment and promoting human rights, and calls for investment in early childhood \neducation, including through effective policies and practices, towards promoting a \nculture of peace; \n \n8. \nEncourages the United Nations Alliance of Civilizations to increase its \nactivities that focus on peace education and global citizenship education in order to \nenhance an understanding among young people of values such as peace, tolerance, \nopenness, inclusion and mutual respect, which are essential in developing a culture \nof peace; \n \n9. \nEncourages the United Nations peacebuilding architecture to continue to \npromote peacebuilding activities and to advance a culture of peace and non-violence \nin post-conflict peacebuilding efforts at the country level; \n \n10. Urges the appropriate authorities to provide age-appropriate education in \nchildren\u2019s schools that builds a culture of peace, including lessons in mutual \nunderstanding, tolerance, active and global citizenship and human rights; \n \n11. \nEncourages the involvement of media, especially the mass media, in \npromoting a culture of peace and non-violence, with particular regard to children and \nyoung people; \n \n12. Commends civil society, non-governmental organizations and young \npeople for their activities in further promoting a culture of peace and non-violence, \nincluding through their campaign to raise awareness on a culture of peace and the \npeaceful settlement of disputes; \n \n13. Encourages civil society and non-governmental organizations to further \nstrengthen their efforts to promote a culture of peace, inter alia, by adopting their own \nprogramme of activities to complement the initiatives of Member States, the \norganizations of the United Nations system and other international and regional \norganizations, in line with the Declaration1 and Programme of Action on a Culture of \nPeace; \n \n14. Invites Member States, all parts of the United Nations system and civil \nsociety organizations to accord increasing attention to their observance of the \nInternational Day of Peace on 21 September each year as a day of global ceasefire \nand non-violence, in accordance with its resolution 55/282 of 7 September 2001, and \nof the International Day of Non-Violence on 2 October, in accordance with its \nresolution 61/271 of 15 June 2007; \n \n15. Reiterates its request to the President of the General Assembly to consider \nconvening a high-level forum, as appropriate and within existing resources, devoted \nto the implementation of the Programme of Action on the occasion of the anniversary \n\nFollow-up to the Declaration and Programme of Action on a Culture of Peace \nA/RES/72/137\n \n5/5 \n17-22364 \n \nof its adoption, on or around 13 September, and requests the Secretariat to support its \neffective organization within their respective mandates and existing resources; \n \n16. Invites the Secretary-General, within existing resources, in consultation \nwith the Member States and taking into account the observations of civil society \norganizations, to explore mechanisms and strategies, in particular strategies in the \nsphere of information and communications technology, for the implementation of the \nDeclaration and Programme of Action and to initiate outreach efforts to increase \nglobal awareness of the Programme of Action and its eight areas of action aimed at \ntheir implementation; \n \n17. Requests the Secretary-General to submit to the General Assembly at its \nseventy-third session a report, within existing resources, on actions taken by Member \nStates, on the basis of information provided by them, and those taken system-wide by \nall concerned entities of the United Nations to implement the present resolution and \non heightened activities by the Organization and its affiliated agencies to implement \nthe Programme of Action and to promote a culture of peace and non-violence; \n \n18. Decides to include in the provisional agenda of its seventy-third session \nthe item entitled \u201cCulture of peace\u201d. \n \n71st plenary meeting  \n11 December 2017 \n \n",
  "paragraphs": {
    "1": "Reiterates that the objective of the effective implementation of the Programme of Action on a Culture of Peace2 is to strengthen further the global movement for a culture of peace following the observance of the International Decade for a Culture of Peace and Non-Violence for the Children of the World, 2001\u20132010, and calls upon all concerned to renew their attention to this objective;",
    "2": "Welcomes the inclusion of the promotion of a culture of peace in the 2030 Agenda for Sustainable Development;9",
    "3": "Invites Member States to continue to place greater emphasis on and expand their activities promoting a culture of peace at the national, regional and international levels and to ensure that peace and non-violence are fostered at all levels;",
    "4": "Invites the entities of the United Nations system, within their existing mandates, to integrate, as appropriate, the eight action areas of the Programme of Action into their programmes of activities, focusing on promoting a culture of peace and non-violence at the national, regional and international levels; __________________ 9 Resolution 70/1. A/RES/72/137 Follow-up to the Declaration and Programme of Action on a Culture of Peace 17-22364 4/5",
    "5": "Commends the United Nations Educational, Scientific and Cultural Organization for strengthening efforts to mobilize all relevant stakeholders within and outside the United Nations system in support of a culture of peace, and invites the Organization to continue to enhance communication and outreach, including through the culture of peace website;",
    "6": "Commends the practical initiatives and actions by relevant United Nations bodies, including the United Nations Children\u2019s Fund, the United Nations Entity for Gender Equality and the Empowerment of Women (UN-Women) and the University for Peace, as well as their activities in further promoting a culture of peace and non-violence, in particular the promotion of peace education and activities related to specific areas identified in the Programme of Action, and encourages them to continue and further strengthen and expand their efforts;",
    "7": "Underlines that early childhood development contributes to the development of more peaceful societies through advancing equality, tolerance, human development and promoting human rights, and calls for investment in early childhood education, including through effective policies and practices, towards promoting a culture of peace;",
    "8": "Encourages the United Nations Alliance of Civilizations to increase its activities that focus on peace education and global citizenship education in order to enhance an understanding among young people of values such as peace, tolerance, openness, inclusion and mutual respect, which are essential in developing a culture of peace;",
    "9": "Encourages the United Nations peacebuilding architecture to continue to promote peacebuilding activities and to advance a culture of peace and non-violence in post-conflict peacebuilding efforts at the country level;",
    "10": "Urges the appropriate authorities to provide age-appropriate education in children\u2019s schools that builds a culture of peace, including lessons in mutual understanding, tolerance, active and global citizenship and human rights;",
    "11": "Encourages the involvement of media, especially the mass media, in promoting a culture of peace and non-violence, with particular regard to children and young people;",
    "12": "Commends civil society, non-governmental organizations and young people for their activities in further promoting a culture of peace and non-violence, including through their campaign to raise awareness on a culture of peace and the peaceful settlement of disputes;",
    "13": "Encourages civil society and non-governmental organizations to further strengthen their efforts to promote a culture of peace, inter alia, by adopting their own programme of activities to complement the initiatives of Member States, the organizations of the United Nations system and other international and regional organizations, in line with the Declaration1 and Programme of Action on a Culture of Peace;",
    "14": "Invites Member States, all parts of the United Nations system and civil society organizations to accord increasing attention to their observance of the International Day of Peace on 21 September each year as a day of global ceasefire and non-violence, in accordance with its resolution 55/282 of 7 September 2001, and of the International Day of Non-Violence on 2 October, in accordance with its resolution 61/271 of 15 June 2007;",
    "15": "Reiterates its request to the President of the General Assembly to consider convening a high-level forum, as appropriate and within existing resources, devoted to the implementation of the Programme of Action on the occasion of the anniversary Follow-up to the Declaration and Programme of Action on a Culture of Peace A/RES/72/137 5/5 17-22364 of its adoption, on or around 13 September, and requests the Secretariat to support its effective organization within their respective mandates and existing resources;",
    "16": "Invites the Secretary-General, within existing resources, in consultation with the Member States and taking into account the observations of civil society organizations, to explore mechanisms and strategies, in particular strategies in the sphere of information and communications technology, for the implementation of the Declaration and Programme of Action and to initiate outreach efforts to increase global awareness of the Programme of Action and its eight areas of action aimed at their implementation;",
    "17": "Requests the Secretary-General to submit to the General Assembly at its seventy-third session a report, within existing resources, on actions taken by Member States, on the basis of information provided by them, and those taken system-wide by all concerned entities of the United Nations to implement the present resolution and on heightened activities by the Organization and its affiliated agencies to implement the Programme of Action and to promote a culture of peace and non-violence;",
    "18": "Decides to include in the provisional agenda of its seventy-third session the item entitled \u201cCulture of peace\u201d. 71st plenary meeting 11 December 2017"
  },
  "agenda_items": [
    "Item 15"
  ],
  "symbol_references": [
    "A/72/L.30"
  ]
}