{
  "symbol": "A/RES/73/324",
  "filename": "A_RES_73_324.pdf",
  "title": "73/324. Financing of the United Nations Mission for the Referendum in Western Sahara",
  "text": "United Nations \nA/RES/73/324\n \n \nGeneral Assembly \nDistr.: General \n18 July 2019 \n \n19-11320 (E)    220719     \n*1911320* \n \n \nSeventy-third session \nAgenda item 164 \n \n \n \n \n Resolution adopted by the General Assembly on 3 July 2019 \n \n \n \n \n[on the report of the Fifth Committee (A/73/927)] \n \n \n 73/324. Financing of the United Nations Mission for the Referendum \nin Western Sahara \n \n \n \nThe General Assembly, \n \nHaving considered the reports of the Secretary-General on the financing of the \nUnited Nations Mission for the Referendum in Western Sahara 1 and the related report \nof the Advisory Committee on Administrative and Budgetary Questions,2  \n \nRecalling Security Council resolution 690 (1991) of 29 April 1991, by which \nthe Council established the United Nations Mission for the Referendum in Western \nSahara, and the subsequent resolutions by which the Council extended the mandate \nof the Mission, the latest of which was resolution 2468 (2019) of 30 April 2019, by \nwhich the Council extended the mandate of the Mission until 31 October 2019,  \n \nRecalling also its resolution 45/266 of 17 May 1991 on the financing of the \nMission and its subsequent resolutions thereon, the latest of which was resolution \n72/301 of 5 July 2018, as well as its decision 72/558 of 5 July 2018,  \n \nReaffirming the general principles underlying the financing of United Nations \npeacekeeping operations, as stated in its resolutions 1874 (S-IV) of 27 June 1963, \n3101 (XXVIII) of 11 December 1973 and 55/235 of 23 December 2000,  \n \nNoting with appreciation that voluntary contributions have been made to the \nMission,  \n \nMindful of the fact that it is essential to provide the Mission with the financial \nresources necessary to enable it to fulfil its responsibilities under the relevant \nresolutions of the Security Council,  \n \n1. \nRequests the Secretary-General to entrust the Head of Mission with the \ntask of formulating future budget proposals in full accordance with the provisions of \nits resolutions 59/296 of 22 June 2005, 60/266 of 30 June 2006, 61/276 of 29 June \n__________________ \n \n1  A/73/617 and A/73/737.  \n \n2  A/73/755/Add.1. \n\nA/RES/73/324 \nFinancing of the United Nations Mission\nfor the Referendum in Western Sahara\n \n19-11320\n2/4 \n \n2007, 64/269 of 24 June 2010, 65/289 of 30 June 2011, 66/264 of 21 June 2012, \n69/307 of 25 June 2015 and 70/286 of 17 June 2016, as well as other relevant \nresolutions;  \n \n2. \nTakes note of the status of contributions to the United Nations Mission for \nthe Referendum in Western Sahara as at 30 April 2019, including the contributions \noutstanding in the amount of 43.3 million United States dollars, representing some \n3.4 per cent of the total assessed contributions, notes with concern that only \n86 Member States have paid their assessed contributions in full, and urges all other \nMember States, in particular those in arrears, to ensure payment of their outstanding \nassessed contributions;  \n \n3. \nExpresses its appreciation to those Member States that have paid their \nassessed contributions in full, and urges all other Member States to make every \npossible effort to ensure payment of their assessed contributions to the Mission in full; \n \n4. \nExpresses concern at the financial situation with regard to peacekeeping \nactivities, in particular as regards the reimbursements to troop contributors that bear \nadditional burdens owing to overdue payments by Member States of their \nassessments;  \n \n5. \nEmphasizes that all future and existing peacekeeping missions shall be \ngiven equal and non-discriminatory treatment in respect of financial and \nadministrative arrangements;  \n \n6. \nAlso emphasizes that all peacekeeping missions shall be provided with \nadequate resources for the effective and efficient discharge of their respective \nmandates;  \n \n7. \nRequests the Secretary-General to ensure that proposed peacekeeping \nbudgets are based on the relevant legislative mandates;  \n \n8. \nEndorses the conclusions and recommendations contained in the report of \nthe Advisory Committee on Administrative and Budgetary Questions,2 and requests \nthe Secretary-General to ensure their full implementation;  \n \n9. \nEmphasizes the importance of overall budgetary performance in \npeacekeeping operations, and requests the Secretary-General to continue to \nimplement the recommendations of the relevant oversight bodies and to report thereon \nin the context of the performance reports; \n \n10. Also emphasizes the importance of the accountability system of the \nSecretariat, and requests the Secretary-General to continue to strengthen risk \nmanagement and internal controls in the management of peacekeeping budgets and to \nreport thereon in the context of his next report; \n \n11. \nRequests the Secretary-General to ensure the full implementation of the \nrelevant provisions of its resolutions 59/296, 60/266, 61/276, 64/269, 65/289, 66/264, \n69/307 and 70/286;  \n \n12. Also requests the Secretary-General to take all action necessary to ensure \nthat the Mission is administered with a maximum of efficiency and economy;  \n \n \n \nBudget performance report for the period from 1 July 2017 to 30 June 2018 \n \n \n13. Takes note of the report of the Secretary-General on the budget \nperformance of the Mission for the period from 1 July 2017 to 30 June 2018; 3  \n \n__________________ \n \n3  A/73/617.  \n\nFinancing of the United Nations Mission \nfor the Referendum in Western Sahara \nA/RES/73/324\n \n3/4\n19-11320 \n \n \n \nBudget estimates for the period from 1 July 2019 to 30 June 2020  \n \n \n14. Decides to appropriate to the Special Account for the United Nations \nMission for the Referendum in Western Sahara the amount of 60,453,700 dollars for \nthe period from 1 July 2019 to 30 June 2020, inclusive of 56,347,400 dollars for the \nmaintenance of the Mission, 3,191,700 dollars for the support account for peacekeeping \noperations, 568,700 dollars for the United Nations Logistics Base at Brindisi, Italy, \nand 345,900 dollars for the Regional Service Centre in Entebbe, Uganda;  \n \n \n \nFinancing of the appropriation  \n \n \n15. Decides to apportion among Member States the amount of 20,151,234 \ndollars for the period from 1 July to 31 October 2019, in accordance with the levels \nupdated in its resolution 73/272 of 22 December 2018, taking into account the scale \nof assessments for 2019, as set out in its resolution 73/271 of 22 December 2018;  \n \n16. Also decides that, in accordance with the provisions of its resolution \n973 (X) of 15 December 1955, there shall be set off against the apportionment among \nMember States, as provided for in paragraph 15 above, their respective share in the \nTax Equalization Fund of 901,466 dollars, comprising the estimated staff assessment \nincome of 794,533 dollars approved for the Mission, the prorated share of \n75,767 dollars of the estimated staff assessment income approved for the support \naccount, the prorated share of 20,033 dollars of the estimated staff assessment income \napproved for the United Nations Logistics Base and the prorated share of \n11,133 dollars of the estimated staff assessment income approved for the Regional \nService Centre;  \n \n17. Further decides to apportion among Member States the amount of \n40,302,466 dollars for the period from 1 November 2019 to 30 June 2020, at a \nmonthly rate of 5,037,808 dollars, in accordance with the levels updated in its \nresolution 73/272, taking into account the scale of assessments for 2019 and 2020, as \nset out in its resolution 73/271, subject to a decision of the Security Council to extend \nthe mandate of the Mission;  \n \n18. Decides that, in accordance with the provisions of its resolution 973 (X), \nthere shall be set off against the apportionment among Member States, as provided \nfor in paragraph 17 above, their respective share in the Tax Equalization Fund of \n1,802,934 dollars, comprising the estimated staff assessment income of 1,589,067 \ndollars approved for the Mission, the prorated share of 151,533 dollars of the \nestimated staff assessment income approved for the support account, the prorated \nshare of 40,067 dollars of the estimated staff assessment income approved for the \nUnited Nations Logistics Base and the prorated share of 22,267 dollars of the \nestimated staff assessment income approved for the Regional Service Centre;  \n \n19. Also decides that, for Member States that have fulfilled their financial \nobligations to the Mission, there shall be set off against their apportionment, as \nprovided for in paragraph 15 above, their respective share of the unencumbered \nbalance and other revenue in the amount of 1,085,600 dollars in respect of the \nfinancial period ended 30 June 2018, in accordance with the levels updated in its \nresolution 70/246 of 23 December 2015, taking into account the scale of assessments \nfor 2018, as set out in its resolution 70/245 of 23 December 2015;  \n \n20. Further decides that, for Member States that have not fulfilled their \nfinancial obligations to the Mission, there shall be set off against their outstanding \nobligations their respective share of the unencumbered balance and other revenue in \nthe amount of 1,085,600 dollars in respect of the financial period ended 30 June 2018, \nin accordance with the scheme set out in paragraph 19 above;  \n\nA/RES/73/324 \nFinancing of the United Nations Mission\nfor the Referendum in Western Sahara\n \n19-11320\n4/4 \n \n \n21. Decides that the increase of 109,400 dollars in the estimated staff \nassessment income in respect of the financial period ended 30 June 2018 shall be \nadded to the credits in the amount of 1,085,600 dollars referred to in paragraphs 19 \nand 20 above;  \n \n22. Encourages the Secretary-General to continue to take additional measures \nto ensure the safety and security of all personnel participating in the Mission under \nthe auspices of the United Nations, bearing in mind paragraphs 5 and 6 of Security \nCouncil resolution 1502 (2003) of 26 August 2003;  \n \n23. Invites voluntary contributions to the Mission in cash and in the form of \nservices and supplies acceptable to the Secretary-General, to be administered, as \nappropriate, in accordance with the procedure and practices established by the \nGeneral Assembly;  \n \n24. Decides to include in the provisional agenda of its seventy-fourth session \nthe item entitled \u201cFinancing of the United Nations Mission for the Referendum in \nWestern Sahara\u201d.  \n \n97th plenary meeting \n3 July 2019 \n \n",
  "paragraphs": {
    "1": "Requests the Secretary-General to entrust the Head of Mission with the task of formulating future budget proposals in full accordance with the provisions of its resolutions 59/296 of 22 June 2005, 60/266 of 30 June 2006, 61/276 of 29 June 2007, 64/269 of 24 June 2010, 65/289 of 30 June 2011, 66/264 of 21 June 2012, 69/307 of 25 June 2015 and 70/286 of 17 June 2016, as well as other relevant resolutions;",
    "2": "Takes note of the status of contributions to the United Nations Mission for the Referendum in Western Sahara as at 30 April 2019, including the contributions outstanding in the amount of 43.3 million United States dollars, representing some 3.4 per cent of the total assessed contributions, notes with concern that only 86 Member States have paid their assessed contributions in full, and urges all other Member States, in particular those in arrears, to ensure payment of their outstanding assessed contributions;",
    "3": "Expresses its appreciation to those Member States that have paid their assessed contributions in full, and urges all other Member States to make every possible effort to ensure payment of their assessed contributions to the Mission in full;",
    "4": "Expresses concern at the financial situation with regard to peacekeeping activities, in particular as regards the reimbursements to troop contributors that bear additional burdens owing to overdue payments by Member States of their assessments;",
    "5": "Emphasizes that all future and existing peacekeeping missions shall be given equal and non-discriminatory treatment in respect of financial and administrative arrangements;",
    "6": "Also emphasizes that all peacekeeping missions shall be provided with adequate resources for the effective and efficient discharge of their respective mandates;",
    "7": "Requests the Secretary-General to ensure that proposed peacekeeping budgets are based on the relevant legislative mandates;",
    "8": "Endorses the conclusions and recommendations contained in the report of the Advisory Committee on Administrative and Budgetary Questions,2 and requests the Secretary-General to ensure their full implementation;",
    "9": "Emphasizes the importance of overall budgetary performance in peacekeeping operations, and requests the Secretary-General to continue to implement the recommendations of the relevant oversight bodies and to report thereon in the context of the performance reports;",
    "10": "Also emphasizes the importance of the accountability system of the Secretariat, and requests the Secretary-General to continue to strengthen risk management and internal controls in the management of peacekeeping budgets and to report thereon in the context of his next report;",
    "11": "Requests the Secretary-General to ensure the full implementation of the relevant provisions of its resolutions 59/296, 60/266, 61/276, 64/269, 65/289, 66/264, 69/307 and 70/286;",
    "12": "Also requests the Secretary-General to take all action necessary to ensure that the Mission is administered with a maximum of efficiency and economy; Budget performance report for the period from 1 July 2017 to 30 June 2018",
    "13": "Takes note of the report of the Secretary-General on the budget performance of the Mission for the period from 1 July 2017 to 30 June 2018; 3 Budget estimates for the period from 1 July 2019 to 30 June 2020",
    "14": "Decides to appropriate to the Special Account for the United Nations Mission for the Referendum in Western Sahara the amount of 60,453,700 dollars for the period from 1 July 2019 to 30 June 2020, inclusive of 56,347,400 dollars for the maintenance of the Mission, 3,191,700 dollars for the support account for peacekeeping operations, 568,700 dollars for the United Nations Logistics Base at Brindisi, Italy, and 345,900 dollars for the Regional Service Centre in Entebbe, Uganda; Financing of the appropriation",
    "15": "Decides to apportion among Member States the amount of 20,151,234 dollars for the period from 1 July to 31 October 2019, in accordance with the levels updated in its resolution 73/272 of 22 December 2018, taking into account the scale of assessments for 2019, as set out in its resolution 73/271 of 22 December 2018;",
    "16": "Also decides that, in accordance with the provisions of its resolution 973 (X) of 15 December 1955, there shall be set off against the apportionment among Member States, as provided for in paragraph 15 above, their respective share in the Tax Equalization Fund of 901,466 dollars, comprising the estimated staff assessment income of 794,533 dollars approved for the Mission, the prorated share of 75,767 dollars of the estimated staff assessment income approved for the support account, the prorated share of 20,033 dollars of the estimated staff assessment income approved for the United Nations Logistics Base and the prorated share of 11,133 dollars of the estimated staff assessment income approved for the Regional Service Centre;",
    "17": "Further decides to apportion among Member States the amount of 40,302,466 dollars for the period from 1 November 2019 to 30 June 2020, at a monthly rate of 5,037,808 dollars, in accordance with the levels updated in its resolution 73/272, taking into account the scale of assessments for 2019 and 2020, as set out in its resolution 73/271, subject to a decision of the Security Council to extend the mandate of the Mission;",
    "18": "Decides that, in accordance with the provisions of its resolution 973 (X), there shall be set off against the apportionment among Member States, as provided for in paragraph 17 above, their respective share in the Tax Equalization Fund of 1,802,934 dollars, comprising the estimated staff assessment income of 1,589,067 dollars approved for the Mission, the prorated share of 151,533 dollars of the estimated staff assessment income approved for the support account, the prorated share of 40,067 dollars of the estimated staff assessment income approved for the United Nations Logistics Base and the prorated share of 22,267 dollars of the estimated staff assessment income approved for the Regional Service Centre;",
    "19": "Also decides that, for Member States that have fulfilled their financial obligations to the Mission, there shall be set off against their apportionment, as provided for in paragraph 15 above, their respective share of the unencumbered balance and other revenue in the amount of 1,085,600 dollars in respect of the financial period ended 30 June 2018, in accordance with the levels updated in its resolution 70/246 of 23 December 2015, taking into account the scale of assessments for 2018, as set out in its resolution 70/245 of 23 December 2015;",
    "20": "",
    "21": "Decides that the increase of 109,400 dollars in the estimated staff assessment income in respect of the financial period ended 30 June 2018 shall be added to the credits in the amount of 1,085,600 dollars referred to in paragraphs 19 and 20 above;",
    "22": "Encourages the Secretary-General to continue to take additional measures to ensure the safety and security of all personnel participating in the Mission under the auspices of the United Nations, bearing in mind paragraphs 5 and 6 of Security Council resolution 1502 (2003) of 26 August 2003;",
    "23": "Invites voluntary contributions to the Mission in cash and in the form of services and supplies acceptable to the Secretary-General, to be administered, as appropriate, in accordance with the procedure and practices established by the General Assembly;",
    "24": "Decides to include in the provisional agenda of its seventy-fourth session the item entitled \u201cFinancing of the United Nations Mission for the Referendum in Western Sahara\u201d."
  },
  "agenda_items": [
    "Item 164"
  ],
  "symbol_references": []
}