{
  "symbol": "A/RES/78/51",
  "filename": "A_RES_78_51.pdf",
  "title": "78/51. Radiological weapons",
  "text": "United Nations \nA/RES/78/51\n \n \nGeneral Assembly \nDistr.: General \n6 December 2023 \n \n23-24492 (E)    181223     \n*2324492* \n \n \nSeventy-eighth session \nAgenda item 99 \nGeneral and complete disarmament  \n \n \n \n \n Resolution adopted by the General Assembly \non 4 December 2023 \n \n \n \n \n[on the report of the First Committee (A/78/409, para. 89)] \n \n \n \n78/51. Radiological weapons \n \n \n \nThe General Assembly, \n \nRecalling its resolutions related to a prohibition of the development, production, \nstockpiling and use of radiological weapons, including resolutions 2602 C (XXIV) of \n16 December 1969, 34/87 A of 11 December 1979, 35/156 G of 12 December 1980, \n36/97 B of 9 December 1981, 37/99 C of 13 December 1982, 38/188 D of \n20 December 1983, 39/151 J of 17 December 1984, 40/94 D of 12 December 1985, \n41/59 I of 3 December 1986, 42/38 F of 30 November 1987, 43/75 J of 7 December \n1988, 44/116 T of 15 November 1989, 45/58 F of 4 December 1990, 46/36 E of \n6 December 1991 and 47/52 B of 9 December 1992, \n \nReaffirming that the Conference on Disarmament, as the single multilateral \ndisarmament negotiating forum of the international community, has the primary role \nin substantive negotiations on priority questions of disarmament, \n \nWelcoming the work, in 1980, of the ad hoc committees of the Conference on \nDisarmament established with a view to reaching an agreement on a convention \nprohibiting the development, production, stockpiling and use of radiological \nweapons1 and the work of the related ad hoc committees undertaken as recently as \n1992 in this regard, and welcoming also the extensive work done in the years \nfollowing on this topic at the Conference under the long-standing agenda item entitled \n\u201cNew types of weapons of mass destruction and new systems of such weapons; \nradiological weapons\u201d, \n \nBearing in mind the Final Document of the Tenth Special Session of the General \nAssembly, the first special session devoted to disarmament, which was adopted by \nconsensus, and wherein it was noted that progress towards the goal of general and \ncomplete disarmament can be achieved through the implementation of a programme \n__________________ \n \n1  CD/133. \n\nA/RES/78/51 \nRadiological weapons\n \n23-24492\n2/2 \n \nof action on disarmament, and included in that programme of action was a measure \nthat a convention should be concluded prohibiting the development, production, \nstockpiling, and use of radiological weapons,2 and expressing interest in taking steps \ntowards this end, \n \nSeriously concerned that the use of radiological weapons could have significant \nhealth and economic impacts on civilian populations, \n \nNoting the extensive existing frameworks to address radiological threats with a \nfocus on non-State actors, 3 including, among other instruments, the International \nAtomic Energy Agency Code of Conduct on the Safety and Security of Radioactive \nSources, its supplementary Guidance on the Import and Export of Radioactive \nSources and its supplementary Guidance on the Management of Disused Radioactive \nSources, and wishing to complement, rather than duplicate, these existing measures,  \n \nSeeking to add to the landmark agreements that States have successfully \nconcluded on nuclear, chemical and biological weapons through renewed efforts to \naddress radiological weapons as a means to enhance international peace and security, \n \nReaffirming the need to ensure the equal, full and meaningful participation of \nunderrepresented groups and reflect gender perspectives and diverse participant \nperspectives in the negotiation process, \n \n1. \nCalls upon all States not to use radiological weapons;  \n \n2. \nAlso calls upon all States not to develop, produce or stockpile devices or \nmaterials for use as radiological weapons, while desiring to avoid interfering with the \nlegitimate uses of radioactive materials;  \n \n3. \nEmphasizes that radiological weapons are a unique category of weapons \ndistinct and separate from nuclear, chemical and biological weapons; \n \n4. \nUrges the Conference on Disarmament to adopt, in 2024, a comprehensive \nand balanced programme of work that includes the commencement of negotiations to \nconclude, as an initial step on this issue, a legally binding multilateral prohibition of \nthe use of radiological weapons by States. \n \n42nd plenary meeting \n4 December 2023 \n \n__________________ \n \n2  Resolution S-10/2. \n \n3  For the purposes of the present resolution, the General Assembly understands \u201cnon-State actor\u201d \nto mean an individual or entity not acting under the lawful authority of any State in conducting \nactivities that come within the scope of the present resolution. \n",
  "paragraphs": {
    "1": "Calls upon all States not to use radiological weapons;",
    "2": "Also calls upon all States not to develop, produce or stockpile devices or materials for use as radiological weapons, while desiring to avoid interfering with the legitimate uses of radioactive materials;",
    "3": "Emphasizes that radiological weapons are a unique category of weapons distinct and separate from nuclear, chemical and biological weapons;",
    "4": "Urges the Conference on Disarmament to adopt, in 2024, a comprehensive and balanced programme of work that includes the commencement of negotiations to conclude, as an initial step on this issue, a legally binding multilateral prohibition of the use of radiological weapons by States. 42nd plenary meeting 4 December 2023 __________________ 2 Resolution S-10/2. 3 For the purposes of the present resolution, the General Assembly understands \u201cnon-State actor\u201d to mean an individual or entity not acting under the lawful authority of any State in conducting activities that come within the scope of the present resolution."
  },
  "agenda_items": [
    "Item 99"
  ],
  "symbol_references": []
}