{
  "symbol": "A/RES/79/278",
  "filename": "A_RES_79_278.pdf",
  "title": "79/278. Scope, modalities, format and organization of the High-level Conference on the Situation of Rohingya Muslims and Other Minorities in Myanmar",
  "text": "United Nations \nA/RES/79/278\n \nGeneral Assembly \nDistr.: General \n27 March 2025 \n25-04978 (E) \n*2504978* \n \n \nSeventy-ninth session \nAgenda item 71 (c) \nPromotion and protection of human rights: human \nrights situations and reports of special rapporteurs \nand representatives \n \n \n \n \n Resolution adopted by the General Assembly \non 25 March 2025 \n \n \n[without reference to a Main Committee (A/79/L.67)] \n \n \n 79/278. Scope, modalities, format and organization of the High-level \nConference on the Situation of Rohingya Muslims and Other \nMinorities in Myanmar \n \n \n \nThe General Assembly, \n \nGuided by the purposes and principles of the Charter of the United Nations and \nthe Universal Declaration of Human Rights,1 international humanitarian law and other \nrelevant international law and human rights law instruments, \n \nRecalling its previous resolutions on the situation in Myanmar, the most recent \nof which being resolution 79/182 of 17 December 2024, and recalling also all relevant \nSecurity Council resolutions, presidential statements and press statements, and the \nresolutions and decisions of the Human Rights Council,  \n \nReiterating its deep concern over the continued violence, violations and abuses \nof human rights against and forced displacement of Rohingya Muslims and other \nminorities, and in this regard stressing the need to address the root causes of the crisis \nin Rakhine State,  \n \nExpressing its deep concern over the sharp rise in serious human rights \nviolations and abuses since the declaration and subsequent extensions of the state of \nemergency by the Myanmar military, which pose further serious challenges to the \nvoluntary, safe, dignified and sustainable return of all forcibly displaced persons, \nincluding Rohingya Muslims,  \n \nAlarmed at the hardening of conflict in Rakhine State and at the recent reports \nof increased hatred, hate speech and violence against Rohingya, the burning of \nRohingya villages, and the destruction of Rohingya homes and livelihoods, leading \n_______________ \n \n1 Resolution 217 A (III). \n\nA/RES/79/278 \nScope, modalities, format and organization of the High-level \nConference on the Situation of Rohingya Muslims and Other \nMinorities in Myanmar\n \n25-04978\n2/4 \n \nto the reported killing, wounding and forced internal displacement of Rohingya \nMuslims and other minorities, which have aggravated the already precarious human \nrights and humanitarian situation in Rakhine State and pose serious challenges for \ncreating a conducive environment for the voluntary, safe, dignified and sustainable \nreturn of Rohingya Muslims, and expressing grave concern that prolonged uncertainty \nover the repatriation has been leading Rohingya Muslims temporarily sheltered in \nBangladesh to despair, and may be having spillover effects on regional peace and \nstability,  \n \nExpressing deep concern at the dramatic increase of humanitarian needs, \nreduction in food aid for Rohingya temporarily sheltered in Bangladesh, both in Cox\u2019s \nBazar and in Bhashan Char, and reiterating in this regard its grave concern that, \ndespite the unprecedented generosity of host countries and donors, the gap between \nhumanitarian needs on the ground and availability of funding continues to grow, \nrecalling in this context the need for more equitable burden- and responsibility-\nsharing, and encouraging in this regard Member States and other actors to leverage \nthe follow-up process of the second Global Refugee Forum, held in 2023, to \ndemonstrate commitment to easing the pressure on the host countries and work \ntowards sustainable solutions,  \n \nExpressing its unequivocal support for the people of Myanmar, including \nRohingya Muslims and other minorities, and their democratic will, interests and \naspirations for peace, as well as for the need to rebuild and strengthen democratic \ninstitutions and processes and to respect fully human rights, fundamental freedoms \nand the rule of law,  \n \nUnderlining \nthe importance of increased efforts to implement the \nrecommendations of the Advisory Commission on Rakhine State, to address the root \ncauses of the crisis, including those on access to citizenship for Rohingya, freedom \nof movement, the elimination of systematic segregation and all forms of \ndiscrimination, and inclusive and equal access to health services and education, and \nbirth registration, in full consultation with members of all ethnic and minority groups \nand persons in vulnerable situations, including on matters of citizenship for Rohingya,  \n \nNoting with appreciation the appointment of the new Special Envoy of the \nSecretary-General on Myanmar, reiterating the importance of her mandate and \nencouraging her to continue the work, engagement and inclusive dialogue with all \nrelevant stakeholders, including civil society and affected populations, in particular \nwomen and youth, including Rohingya Muslims and other minorities, and urging the \nMyanmar military and encouraging all Member States to extend full cooperation with \nthe Special Envoy,  \n \nRecognizing the important role of the Association of Southeast Asian Nations in \nfacilitating a peaceful solution to the crisis in Myanmar in the interests of the people \nof Myanmar and in supporting efforts that can contribute to the creation of an \nenvironment in Myanmar that is conducive to the voluntary, safe, dignified and \nsustainable return of forcibly displaced persons, including Rohingya Muslims, to \nMyanmar, and reiterating the need to work in close coordination and in full \nconsultation with Rohingya Muslims, as well as with all relevant United Nations \nagencies and international partners, and to address the root causes of the crisis and \ndisplacement so that affected communities can rebuild their lives after their return to \nMyanmar,  \n \nAcknowledging the efforts of the Organization of Islamic Cooperation, alongside \nrelevant international efforts, aimed at bringing peace and stability to Rakhine State \nand other states and regions of Myanmar, including through the work of the previous \n\nScope, modalities, format and organization of the High-level \nConference on the Situation of Rohingya Muslims and Other \nMinorities in Myanmar \nA/RES/79/278\n \n3/4\n25-04978 \n \nSpecial Envoy for Myanmar of the Secretary-General of the Organization of Islamic \nCooperation,  \n \nStressing the need for an immediate end to all forms of violence, de-escalation \nand an enduring ceasefire throughout Myanmar, best achieved by dialogue between \nall parties, \n \nUnderlining the need for the resumption of peacebuilding efforts and their \nrelevance for inclusive State- and nation-building, \n \nReaffirming its resolution 79/182, in which it decided to hold a high-level \nconference, at the earliest possible time in 2025, on the situation of Rohingya Muslims \nand other minorities in Myanmar, within existing resources, inviting relevant \nstakeholders, including Member States, international and regional organizations, \nspecialized agencies and civil society, to review the overall crisis and share \nperspectives on the situation on the ground in order to propose a comprehensive, \ninnovative, concrete and time-bound plan for a sustainable resolution of the crisis, \nincluding the voluntary, safe and dignified return of Rohingya Muslims to Myanmar, \n \n1. \nDecides to hold the High-level Conference on the Situation of Rohingya \nMuslims and Other Minorities in Myanmar, mandated in resolution 79/182, in the \nform of a one-day high-level plenary meeting of the General Assembly, to be \nconvened by the President of the General Assembly in New York on 30 September \n2025, from 10 a.m. to 1 p.m. and from 3 to 6 p.m.; \n \n2. \nAlso decides that the objectives of the High-level Conference are to \nmobilize political support, sustain international attention on the crisis, review the \noverall crisis and address its root causes, including human rights issues, and share \nperspectives on the situation on the ground, including challenges faced by Rohingya \nand other minorities in Myanmar, as well as humanitarian issues within Myanmar and \nthe region, in order to propose a comprehensive, innovative and concrete plan for a \nsustainable resolution of the crisis, including efforts to create a conducive \nenvironment for the voluntary, safe, sustainable and dignified return of Rohingya \nMuslims and other members of minority groups to Myanmar in a timely manner; \n \n3. \nFurther decides that the organizational arrangements of the High-level \nConference will be as follows: \n \n(a) \nThe Conference will be composed of an opening segment, a plenary \nmeeting and a closing segment; \n \n(b) \nThe opening segment will feature statements by the President of the \nGeneral Assembly, the Secretary-General, the Special Envoy of the Secretary-General \non Myanmar, the United Nations High Commissioner for Refugees, the United \nNations High Commissioner for Human Rights and other relevant stakeholder \nrepresentatives, including from regional organizations and civil society, to be selected \nin consultation with Member States by the President of the General Assembly;  \n \n(c) \nThe plenary segment will comprise statements by Member States, \nobservers of the General Assembly, civil society representatives and other relevant \nstakeholders, in accordance with resolution 79/182, ensuring the meaningful \nparticipation of women and youth, as well as Rohingya and other minorities in \nMyanmar; a list of speakers will be established in accordance with established \npractices of the Assembly, and the time limits for these statements will be three \nminutes for individual delegations and five minutes for statements made on behalf of \na group of States;  \n \n(d) \nThe closing segment will comprise concluding remarks by the President \nof the General Assembly; \n\nA/RES/79/278 \nScope, modalities, format and organization of the High-level \nConference on the Situation of Rohingya Muslims and Other \nMinorities in Myanmar\n \n25-04978\n4/4 \n \n \n4. \nCalls upon Member States, entities of the United Nations system, civil \nsociety organizations and others to support initiatives to engage stakeholders, \nincluding Rohingya and other members of minority groups of Myanmar, prior to the \nHigh-level Conference, as well as to hold panel discussions as side events at the \nmargins of the High-level Conference, in order to provide a meaningful contribution \nto the objectives of the High-level Conference; \n \n5. \nInvites the United Nations system, including agencies, funds and \nprogrammes, to actively engage in the process leading to the High-level Conference, \nwith a view to improving the United Nations system\u2019s overall efficiency and ability \nto provide support and assistance, including humanitarian assistance, with regard to \nthe situation impacting Rohingya Muslims and other minorities in Myanmar; \n \n6. \nDecides that the President of the General Assembly will produce a concise \nand action-oriented summary of the High-level Conference based on the discussion \namong the participants of the Conference;  \n \n7. \nEncourages all Member States and observers of the General Assembly to \nparticipate in the High-level Conference at the highest possible level, preferably at \nthe level of Heads of State and Government;  \n \n8. \nInvites non\u2011governmental organizations that are in consultative status with \nthe Economic and Social Council to register with the Secretariat to attend the High-\nlevel Conference;  \n \n9. \nRequests the President of the General Assembly to draw up a list of \nrepresentatives of other relevant non\u2011governmental organizations, civil society \norganizations, think tanks and academic institutions, who may participate in the High-\nlevel Conference, taking into account the principle of transparency, with due regard \nfor gender parity and youth representation, to submit the proposed list to Member \nStates for their consideration on a non\u2011objection basis2 and to bring the list to the \nattention of the Assembly for a final decision by the Assembly on participation in the \nHigh-level Conference; \n \n10. Decides that the proceedings of the High-level Conference will be webcast, \nand encourages the President of the General Assembly, the Secretary-General and the \nUnited Nations system to give the highest visibility to the High-level Conference, \nthrough all relevant media platforms and information and communications \ntechnologies. \n \n62nd plenary meeting \n25 March 2025 \n \n_______________ \n \n2 The list will include proposed as well as final names. The general basis of any objections, if \nrequested by one or more States Members of the United Nations or States members of the \nspecialized agencies, will be made known to the Office of the President of the General Assembly \nand the requester. \n",
  "paragraphs": {
    "1": "Decides to hold the High-level Conference on the Situation of Rohingya Muslims and Other Minorities in Myanmar, mandated in resolution 79/182, in the form of a one-day high-level plenary meeting of the General Assembly, to be convened by the President of the General Assembly in New York on 30 September 2025, from 10 a.m. to 1 p.m. and from 3 to 6 p.m.;",
    "2": "Also decides that the objectives of the High-level Conference are to mobilize political support, sustain international attention on the crisis, review the overall crisis and address its root causes, including human rights issues, and share perspectives on the situation on the ground, including challenges faced by Rohingya and other minorities in Myanmar, as well as humanitarian issues within Myanmar and the region, in order to propose a comprehensive, innovative and concrete plan for a sustainable resolution of the crisis, including efforts to create a conducive environment for the voluntary, safe, sustainable and dignified return of Rohingya Muslims and other members of minority groups to Myanmar in a timely manner;",
    "3": "Further decides that the organizational arrangements of the High-level Conference will be as follows: (a) The Conference will be composed of an opening segment, a plenary meeting and a closing segment; (b) The opening segment will feature statements by the President of the General Assembly, the Secretary-General, the Special Envoy of the Secretary-General on Myanmar, the United Nations High Commissioner for Refugees, the United Nations High Commissioner for Human Rights and other relevant stakeholder representatives, including from regional organizations and civil society, to be selected in consultation with Member States by the President of the General Assembly; (c) The plenary segment will comprise statements by Member States, observers of the General Assembly, civil society representatives and other relevant stakeholders, in accordance with resolution 79/182, ensuring the meaningful participation of women and youth, as well as Rohingya and other minorities in Myanmar; a list of speakers will be established in accordance with established practices of the Assembly, and the time limits for these statements will be three minutes for individual delegations and five minutes for statements made on behalf of a group of States; (d) The closing segment will comprise concluding remarks by the President of the General Assembly; A/RES/79/278 Scope, modalities, format and organization of the High-level Conference on the Situation of Rohingya Muslims and Other Minorities in Myanmar 25-04978 4/4",
    "4": "Calls upon Member States, entities of the United Nations system, civil society organizations and others to support initiatives to engage stakeholders, including Rohingya and other members of minority groups of Myanmar, prior to the High-level Conference, as well as to hold panel discussions as side events at the margins of the High-level Conference, in order to provide a meaningful contribution to the objectives of the High-level Conference;",
    "5": "Invites the United Nations system, including agencies, funds and programmes, to actively engage in the process leading to the High-level Conference, with a view to improving the United Nations system\u2019s overall efficiency and ability to provide support and assistance, including humanitarian assistance, with regard to the situation impacting Rohingya Muslims and other minorities in Myanmar;",
    "6": "Decides that the President of the General Assembly will produce a concise and action-oriented summary of the High-level Conference based on the discussion among the participants of the Conference;",
    "7": "Encourages all Member States and observers of the General Assembly to participate in the High-level Conference at the highest possible level, preferably at the level of Heads of State and Government;",
    "8": "Invites non\u2011governmental organizations that are in consultative status with the Economic and Social Council to register with the Secretariat to attend the High- level Conference;",
    "9": "Requests the President of the General Assembly to draw up a list of representatives of other relevant non\u2011governmental organizations, civil society organizations, think tanks and academic institutions, who may participate in the High- level Conference, taking into account the principle of transparency, with due regard for gender parity and youth representation, to submit the proposed list to Member States for their consideration on a non\u2011objection basis2 and to bring the list to the attention of the Assembly for a final decision by the Assembly on participation in the High-level Conference;",
    "10": "Decides that the proceedings of the High-level Conference will be webcast, and encourages the President of the General Assembly, the Secretary-General and the United Nations system to give the highest visibility to the High-level Conference, through all relevant media platforms and information and communications technologies. 62nd plenary meeting 25 March 2025 _______________ 2 The list will include proposed as well as final names. The general basis of any objections, if requested by one or more States Members of the United Nations or States members of the specialized agencies, will be made known to the Office of the President of the General Assembly and the requester."
  },
  "agenda_items": [
    "Item 71"
  ],
  "symbol_references": [
    "A/79/L.67"
  ]
}