{
  "symbol": "A/RES/72/290",
  "filename": "A_RES_72_290.pdf",
  "title": "72/290. Financing of the United Nations Multidimensional Integrated Stabilization Mission in the Central African Republic",
  "text": "0 \nUnited Nations \nA/RES/72/290\n \n \nGeneral Assembly \nDistr.: General \n19 July 2018 \n \n18-11306 (E)    200718 \n*1811306* \n \n \nSeventy-second session \nAgenda item 151 \n \n \n \n \n Resolution adopted by the General Assembly on 5 July 2018 \n \n \n \n \n[on the report of the Fifth Committee (A/72/916)] \n \n \n 72/290. Financing of the United Nations Multidimensional Integrated \nStabilization Mission in the Central African Republic  \n \n \n \nThe General Assembly, \n \nHaving considered the reports of the Secretary-General on the financing of the \nUnited Nations Multidimensional Integrated Stabilization Mission in the Central \nAfrican Republic, 1  and the related report of the Advisory Committee on \nAdministrative and Budgetary Questions,2  \n \nRecalling Security Council resolution 2149 (2014) of 10 April 2014, by which \nthe Council established the United Nations Multidimensional Integrated Stabilization \nMission in the Central African Republic as from 10 April 2014 for an initial period \nuntil 30 April 2015, and the subsequent resolutions by which the Council extended \nthe mandate of the Mission, the latest of which was resolution 2387 (2017) of \n15 November 2017, by which the Council extended the mandate of the Mission until \n15 November 2018,  \n \nRecalling also its resolution 68/299 of 30 June 2014 on the financing of the \nMission and its subsequent resolutions thereon, the latest of which was resolution \n71/299 of 30 June 2017,  \n \nReaffirming the general principles underlying the financing of United Nations \npeacekeeping operations, as stated in its resolutions 1874 (S\u2013IV) of 27 June 1963, \n3101 (XXVIII) of 11 December 1973 and 55/235 of 23 December 2000,  \n \nMindful of the fact that it is essential to provide the Mission with the financial \nresources necessary to enable it to fulfil its responsibilities under the relevant \nresolutions of the Security Council,  \n \n1. \nRequests the Secretary-General to entrust the Head of Mission with the \ntask of formulating future budget proposals in full accordance with the provisions of \nits resolutions 59/296 of 22 June 2005, 60/266 of 30 June 2006, 61/276 of 29 June \n__________________ \n \n1  A/72/637 and A/72/779. \n \n2  A/72/789/Add.8. \n\nA/RES/72/290 \nFinancing of the United Nations Multidimensional Integrated\nStabilization Mission in the Central African Republic\n \n18-11306\n2/4 \n \n2007, 64/269 of 24 June 2010, 65/289 of 30 June 2011, 66/264 of 21 June 2012, \n69/307 of 25 June 2015 and 70/286 of 17 June 2016, as well as other relevant \nresolutions;  \n \n2. \nTakes note of the status of contributions to the United Nations \nMultidimensional Integrated Stabilization Mission in the Central African Republic as \nat 30 April 2018, including the contributions outstanding in the amount of \n232.1 million United States dollars, representing some 6.8 per cent of the total \nassessed contributions, notes with concern that only 82 Member States have paid their \nassessed contributions in full, and urges all other Member States, in particular those \nin arrears, to ensure payment of their outstanding assessed contributions;  \n \n3. \nExpresses its appreciation to those Member States that have paid their \nassessed contributions in full, and urges all other Member States to make every \npossible effort to ensure payment of their assessed contributions to the Mission in full;  \n \n4. \nExpresses concern at the financial situation with regard to peacekeeping \nactivities, in particular as regards the reimbursements to troop contributors that bear \nadditional burdens owing to overdue payments by Member States of their \nassessments;  \n \n5. \nEmphasizes that all future and existing peacekeeping missions shall be \ngiven equal and non-discriminatory treatment in respect of financial and \nadministrative arrangements;  \n \n6. \nAlso emphasizes that all peacekeeping missions shall be provided with \nadequate resources for the effective and efficient discharge of their respective \nmandates;  \n \n7. \nRequests the Secretary-General to ensure that proposed peacekeeping \nbudgets are based on the relevant legislative mandates;  \n \n8. \nEndorses the conclusions and recommendations contained in the report of \nthe Advisory Committee on Administrative and Budgetary Questions, 2 subject to the \nprovisions of the present resolution, and requests the Secretary-General to ensure \ntheir full implementation;  \n \n9. \nDecides to allocate an amount of 60,515,400 dollars for air operations \nfrom the overall resources for the Mission;  \n \n10. Recalls paragraph 20 of the report of the Advisory Committee, decides to \nmaintain the heads of Sectors East and Centre at the D-1 level, and requests the \nSecretary-General to keep these posts under review;  \n \n11. \nEncourages the Secretary-General to continue his efforts to develop an \naccountability framework for the performance of entities that are not a part of the \nUnited Nations Secretariat when they perform activities funded by the Mission \nresources, excluding the provision of goods and services through contractual \narrangements;  \n \n12. Underlines the critical contribution that programmatic activities make to \nthe implementation of the mandates of the Mission and that all such activities must \nbe directly linked to the mandates of the Mission;  \n \n13. Requests the Secretary-General to ensure the full implementation of the \nrelevant provisions of its resolutions 59/296, 60/266, 61/276, 64/269, 65/289, 66/264, \n69/307 and 70/286;  \n \n14. Also requests the Secretary-General to take all action necessary to ensure \nthat the Mission is administered with a maximum of efficiency and economy;  \n \n\nFinancing of the United Nations Multidimensional Integrated \nStabilization Mission in the Central African Republic \nA/RES/72/290\n \n3/4\n18-11306 \n \n \n \nBudget performance report for the period from 1 July 2016 to 30 June 2017 \n \n \n15. Takes note of the report of the Secretary-General on the budget \nperformance of the Mission for the period from 1 July 2016 to 30 June 2017;3  \n \n \n \nBudget estimates for the period from 1 July 2018 to 30 June 2019 \n \n \n16. Decides to appropriate to the Special Account for the United Nations \nMultidimensional Integrated Stabilization Mission in the Central African Republic \nthe amount of 995,011,800 dollars for the period from 1 July 2018 to 30 June 2019, \ninclusive of 930,211,900 dollars for the maintenance of the Mission, 48,012,800 \ndollars for the support account for peacekeeping operations, 12,079,000 dollars for \nthe United Nations Logistics Base at Brindisi, Italy, and 4,708,100 dollars for the \nRegional Service Centre in Entebbe, Uganda;  \n \n \n \nFinancing of the appropriation for the period from 1 July 2018 to 30 June 2019  \n \n \n17. Decides to apportion among Member States the amount of 373,129,425 \ndollars for the period from 1 July to 15 November 2018, in accordance with the levels \nupdated in its resolution 70/246 of 23 December 2015, taking into account the scale \nof assessments for 2018, as set out in its resolution 70/245 of 23 December 2015;  \n \n18. Also decides that, in accordance with the provisions of its resolution \n973 (X) of 15 December 1955, there shall be set off against the apportionment among \nMember States, as provided for in paragraph 17 above, their respective share in the \nTax Equalization Fund of 7,542,675 dollars, comprising the estimated staff \nassessment income of 5,522,512 dollars approved for the Mission, the prorated share \nof 1,454,850 dollars of the estimated staff assessment income approved for the \nsupport account, the prorated share of 388,350 dollars of the estimated staff \nassessment income approved for the United Nations Logistics Base and the prorated \nshare of 176,963 dollars of the estimated staff assessment income approved for the \nRegional Service Centre;  \n \n19. Further decides to apportion among Member States the amount of \n124,376,475 dollars for the period from 16 November to 31 December 2018, at a \nmonthly rate of 82,917,650 dollars, in accordance with the levels updated in its \nresolution 70/246, taking into account the scale of assessments for 2018, as set out in \nits resolution 70/245, subject to a decision of the Security Council to extend the \nmandate of the Mission;  \n \n20. Decides that, in accordance with the provisions of its resolution 973 (X), \nthere shall be set off against the apportionment among Member States, as provided \nfor in paragraph 19 above, their respective share in the Tax Equalization Fund of \n2,514,225 dollars, comprising the estimated staff assessment income of 1,840,838 \ndollars approved for the Mission, the prorated share of 484,950 dollars of the \nestimated staff assessment income approved for the support account, the prorated \nshare of 129,450 dollars of the estimated staff assessment income approved for the \nUnited Nations Logistics Base and the prorated share of 58,987 dollars of the \nestimated staff assessment income approved for the Regional Service Centre;  \n \n21. Also decides to apportion among Member States the amount of \n497,505,900 dollars for the period from 1 January to 30 June 2019, at a monthly rate \nof 82,917,650 dollars, in accordance with the scale of assessments for 2019 and the \nupdated levels,4 subject to a decision of the Security Council to extend the mandate \nof the Mission;  \n__________________ \n \n3  A/72/637. \n \n4  To be adopted by the General Assembly.  \n\nA/RES/72/290 \nFinancing of the United Nations Multidimensional Integrated\nStabilization Mission in the Central African Republic\n \n18-11306\n4/4 \n \n \n22. Further decides that, in accordance with the provisions of its \nresolution 973 (X), there shall be set off against the apportionment among Member \nStates, as provided for in paragraph 21 above, their respective share in the Tax \nEqualization Fund of 10,056,900 dollars, comprising the estimated staff assessment \nincome of 7,363,350 dollars approved for the Mission, the prorated share of 1,939,800 \ndollars of the estimated staff assessment income approved for the support account, \nthe prorated share of 517,800 dollars of the estimated staff assessment income \napproved for the United Nations Logistics Base and the prorated share of 235,950 \ndollars of the estimated staff assessment income approved for the Regional Service \nCentre;  \n \n23. Decides that, for Member States that have fulfilled their financial \nobligations to the Mission, there shall be set off against the apportionment, as \nprovided for in paragraphs 17, 19 and 21 above, their respective share of the \nunencumbered balance and other revenue in the amount of 82,788,300 dollars in \nrespect of the financial period ended 30 June 2017, in accordance with the levels \nupdated in its resolution 70/246, taking into account the scale of assessments for 2017, \nas set out in its resolution 70/245;  \n \n24. Also decides that, for Member States that have not fulfilled their financial \nobligations to the Mission, there shall be set off against their outstanding obligations \ntheir respective share of the unencumbered balance and other revenue in the amount \nof 82,788,300 dollars, in respect of the financial period ended 30 June 2017, in \naccordance with the scheme set out in paragraph 23 above;  \n \n25. Further decides that the increase of 777,100 dollars in the estimated staff \nassessment income in respect of the financial period ended 30 June 2017 shall be \nadded to the credits in the amount of 82,788,300 dollars referred to in paragraphs 23 \nand 24 above;  \n \n26. Emphasizes that no peacekeeping mission shall be financed by borrowing \nfunds from other active peacekeeping missions;  \n \n27. Encourages the Secretary-General to continue to take additional measures \nto ensure the safety and security of all personnel participating in the Mission under \nthe auspices of the United Nations, bearing in mind paragraphs 5 and 6 of Security \nCouncil resolution 1502 (2003) of 26 August 2003;  \n \n28. Invites voluntary contributions to the Mission in cash and in the form of \nservices and supplies acceptable to the Secretary-General, to be administered, as \nappropriate, in accordance with the procedure and practices established by the \nGeneral Assembly;  \n \n29. Decides to include in the provisional agenda of its seventy-third session \nthe item entitled \u201cFinancing of the United Nations Multidimensional Integrated \nStabilization Mission in the Central African Republic\u201d.  \n \n104th plenary meeting  \n5 July 2018 \n \n",
  "paragraphs": {
    "1": "Requests the Secretary-General to entrust the Head of Mission with the task of formulating future budget proposals in full accordance with the provisions of its resolutions 59/296 of 22 June 2005, 60/266 of 30 June 2006, 61/276 of 29 June 2007, 64/269 of 24 June 2010, 65/289 of 30 June 2011, 66/264 of 21 June 2012, 69/307 of 25 June 2015 and 70/286 of 17 June 2016, as well as other relevant resolutions;",
    "2": "Takes note of the status of contributions to the United Nations Multidimensional Integrated Stabilization Mission in the Central African Republic as at 30 April 2018, including the contributions outstanding in the amount of 232.1 million United States dollars, representing some 6.8 per cent of the total assessed contributions, notes with concern that only 82 Member States have paid their assessed contributions in full, and urges all other Member States, in particular those in arrears, to ensure payment of their outstanding assessed contributions;",
    "3": "Expresses its appreciation to those Member States that have paid their assessed contributions in full, and urges all other Member States to make every possible effort to ensure payment of their assessed contributions to the Mission in full;",
    "4": "Expresses concern at the financial situation with regard to peacekeeping activities, in particular as regards the reimbursements to troop contributors that bear additional burdens owing to overdue payments by Member States of their assessments;",
    "5": "Emphasizes that all future and existing peacekeeping missions shall be given equal and non-discriminatory treatment in respect of financial and administrative arrangements;",
    "6": "Also emphasizes that all peacekeeping missions shall be provided with adequate resources for the effective and efficient discharge of their respective mandates;",
    "7": "Requests the Secretary-General to ensure that proposed peacekeeping budgets are based on the relevant legislative mandates;",
    "8": "Endorses the conclusions and recommendations contained in the report of the Advisory Committee on Administrative and Budgetary Questions, 2 subject to the provisions of the present resolution, and requests the Secretary-General to ensure their full implementation;",
    "9": "Decides to allocate an amount of 60,515,400 dollars for air operations from the overall resources for the Mission;",
    "10": "Recalls paragraph 20 of the report of the Advisory Committee, decides to maintain the heads of Sectors East and Centre at the D-1 level, and requests the Secretary-General to keep these posts under review;",
    "11": "Encourages the Secretary-General to continue his efforts to develop an accountability framework for the performance of entities that are not a part of the United Nations Secretariat when they perform activities funded by the Mission resources, excluding the provision of goods and services through contractual arrangements;",
    "12": "Underlines the critical contribution that programmatic activities make to the implementation of the mandates of the Mission and that all such activities must be directly linked to the mandates of the Mission;",
    "13": "Requests the Secretary-General to ensure the full implementation of the relevant provisions of its resolutions 59/296, 60/266, 61/276, 64/269, 65/289, 66/264, 69/307 and 70/286;",
    "14": " Budget performance report for the period from 1 July 2016 to 30 June 2017",
    "15": "Takes note of the report of the Secretary-General on the budget performance of the Mission for the period from 1 July 2016 to 30 June 2017;3 Budget estimates for the period from 1 July 2018 to 30 June 2019",
    "16": "Decides to appropriate to the Special Account for the United Nations Multidimensional Integrated Stabilization Mission in the Central African Republic the amount of 995,011,800 dollars for the period from 1 July 2018 to 30 June 2019, inclusive of 930,211,900 dollars for the maintenance of the Mission, 48,012,800 dollars for the support account for peacekeeping operations, 12,079,000 dollars for the United Nations Logistics Base at Brindisi, Italy, and 4,708,100 dollars for the Regional Service Centre in Entebbe, Uganda; Financing of the appropriation for the period from 1 July 2018 to 30 June 2019",
    "17": "Decides to apportion among Member States the amount of 373,129,425 dollars for the period from 1 July to 15 November 2018, in accordance with the levels updated in its resolution 70/246 of 23 December 2015, taking into account the scale of assessments for 2018, as set out in its resolution 70/245 of 23 December 2015;",
    "18": "Also decides that, in accordance with the provisions of its resolution 973 (X) of 15 December 1955, there shall be set off against the apportionment among Member States, as provided for in paragraph 17 above, their respective share in the Tax Equalization Fund of 7,542,675 dollars, comprising the estimated staff assessment income of 5,522,512 dollars approved for the Mission, the prorated share of 1,454,850 dollars of the estimated staff assessment income approved for the support account, the prorated share of 388,350 dollars of the estimated staff assessment income approved for the United Nations Logistics Base and the prorated share of 176,963 dollars of the estimated staff assessment income approved for the Regional Service Centre;",
    "19": "Further decides to apportion among Member States the amount of 124,376,475 dollars for the period from 16 November to 31 December 2018, at a monthly rate of 82,917,650 dollars, in accordance with the levels updated in its resolution 70/246, taking into account the scale of assessments for 2018, as set out in its resolution 70/245, subject to a decision of the Security Council to extend the mandate of the Mission;",
    "20": "Decides that, in accordance with the provisions of its resolution 973 (X), there shall be set off against the apportionment among Member States, as provided for in paragraph 19 above, their respective share in the Tax Equalization Fund of 2,514,225 dollars, comprising the estimated staff assessment income of 1,840,838 dollars approved for the Mission, the prorated share of 484,950 dollars of the estimated staff assessment income approved for the support account, the prorated share of 129,450 dollars of the estimated staff assessment income approved for the United Nations Logistics Base and the prorated share of 58,987 dollars of the estimated staff assessment income approved for the Regional Service Centre;",
    "21": "Also decides to apportion among Member States the amount of 497,505,900 dollars for the period from 1 January to 30 June 2019, at a monthly rate of 82,917,650 dollars, in accordance with the scale of assessments for 2019 and the updated levels,4 subject to a decision of the Security Council to extend the mandate of the Mission;",
    "22": "Further decides that, in accordance with the provisions of its resolution 973 (X), there shall be set off against the apportionment among Member States, as provided for in paragraph 21 above, their respective share in the Tax Equalization Fund of 10,056,900 dollars, comprising the estimated staff assessment income of 7,363,350 dollars approved for the Mission, the prorated share of 1,939,800 dollars of the estimated staff assessment income approved for the support account, the prorated share of 517,800 dollars of the estimated staff assessment income approved for the United Nations Logistics Base and the prorated share of 235,950 dollars of the estimated staff assessment income approved for the Regional Service Centre;",
    "23": "Decides that, for Member States that have fulfilled their financial obligations to the Mission, there shall be set off against the apportionment, as provided for in paragraphs 17, 19 and 21 above, their respective share of the unencumbered balance and other revenue in the amount of 82,788,300 dollars in respect of the financial period ended 30 June 2017, in accordance with the levels updated in its resolution 70/246, taking into account the scale of assessments for 2017, as set out in its resolution 70/245;",
    "24": "Also decides that, for Member States that have not fulfilled their financial obligations to the Mission, there shall be set off against their outstanding obligations their respective share of the unencumbered balance and other revenue in the amount of 82,788,300 dollars, in respect of the financial period ended 30 June 2017, in accordance with the scheme set out in paragraph 23 above;",
    "25": "Further decides that the increase of 777,100 dollars in the estimated staff assessment income in respect of the financial period ended 30 June 2017 shall be added to the credits in the amount of 82,788,300 dollars referred to in paragraphs 23 and 24 above;",
    "26": "Emphasizes that no peacekeeping mission shall be financed by borrowing funds from other active peacekeeping missions;",
    "27": "Encourages the Secretary-General to continue to take additional measures to ensure the safety and security of all personnel participating in the Mission under the auspices of the United Nations, bearing in mind paragraphs 5 and 6 of Security Council resolution 1502 (2003) of 26 August 2003;",
    "28": "Invites voluntary contributions to the Mission in cash and in the form of services and supplies acceptable to the Secretary-General, to be administered, as appropriate, in accordance with the procedure and practices established by the General Assembly;",
    "29": "Decides to include in the provisional agenda of its seventy-third session the item entitled \u201cFinancing of the United Nations Multidimensional Integrated Stabilization Mission in the Central African Republic\u201d."
  },
  "agenda_items": [
    "Item 151"
  ],
  "symbol_references": []
}