{
  "symbol": "A/RES/75/162",
  "filename": "A_RES_75_162.pdf",
  "title": "75/162. Enlargement of the Executive Committee of the Programme of the United Nations High Commissioner for Refugees",
  "text": "United Nations \nA/RES/75/162\n \n \nGeneral Assembly \nDistr.: General \n23 December 2020 \n \n \n20-17299 (E)    301220 \n*2017299* \n \n \nSeventy-fifth session \nAgenda item 63 \nReport of the United Nations High Commissioner for \nRefugees, questions relating to refugees, returnees and \ndisplaced persons and humanitarian questions  \n \n \n \n \n Resolution adopted by the General Assembly \non 16 December 2020 \n \n \n \n \n[on the report of the Third Committee (A/75/472, para. 17)] \n \n \n 75/162. Enlargement of the Executive Committee of the Programme of the \nUnited Nations High Commissioner for Refugees \n \n \n \nThe General Assembly, \n \nTaking note of Economic and Social Council decision 2021/208 of 14 September \n2020 concerning the enlargement of the Executive Committee of the Programme of \nthe United Nations High Commissioner for Refugees, \n \nTaking note also of the request regarding the enlargement of the Executive \nCommittee contained in the note verbale dated 31 August 2020 from the Permanent \nMission of Malawi to the United Nations addressed to the Secretary-General,1 \n \n1. \nDecides to increase the number of members of the Executive Committee \nof the Programme of the United Nations High Commissioner for Refugees from \n106 States to 107 States; \n \n2. \nRequests the Economic and Social Council to elect the additional member \nat a meeting of its management segment in 2021. \n \n46th plenary meeting \n16 December 2020 \n \n \n__________________ \n \n1 E/2021/3. \n",
  "paragraphs": {
    "1": "Decides to increase the number of members of the Executive Committee of the Programme of the United Nations High Commissioner for Refugees from 106 States to 107 States;",
    "2": "Requests the Economic and Social Council to elect the additional member at a meeting of its management segment in 2021. 46th plenary meeting 16 December 2020 __________________ 1 E/2021/3."
  },
  "agenda_items": [
    "Item 63"
  ],
  "symbol_references": []
}