{
  "symbol": "A/RES/73/184",
  "filename": "A_RES_73_184.pdf",
  "title": "73/184.  Follow-up to the Thirteenth United Nations Congress on Crime Prevention and Criminal Justice and preparations for the Fourteenth United Nations Congress on Crime Prevention and Criminal Justice",
  "text": "United Nations \nA/RES/73/184\n \n \nGeneral Assembly \nDistr.: General \n16 January 2019 \n \n18-22280 (E)    180119     \n*1822280* \n \n \nSeventy-third session \nAgenda item 109 \n \n \n \n \n Resolution adopted by the General Assembly \non 17 December 2018 \n \n \n \n \n[on the report of the Third Committee (A/73/590)] \n \n \n 73/184.  Follow-up to the Thirteenth United Nations Congress on Crime \nPrevention and Criminal Justice and preparations for the \nFourteenth United Nations Congress on Crime Prevention \nand Criminal Justice \n \n \n \nThe General Assembly, \n \nRecalling its resolution 56/119 of 19 December 2001 on the role, function, \nperiodicity and duration of the United Nations congresses on the prevention of crime \nand the treatment of offenders, in which it stipulated the guidelines in accordance \nwith which, beginning in 2005, the congresses, pursuant to paragraphs 29 and 30 of \nthe statement of principles and programme of action of the United Nations crime \nprevention and criminal justice programme,1 should be held, \n \nEmphasizing the responsibility assumed by the United Nations in the field of \ncrime prevention and criminal justice in pursuance of Economic and Social Council \nresolution 155 C (VII) of 13 August 1948 and General Assembly resolution 415 (V) \nof 1 December 1950, \n \nAcknowledging that the United Nations congresses on crime prevention and \ncriminal justice, as major intergovernmental forums, have influenced national \npolicies and practices and promoted international cooperation in that field by \nfacilitating the exchange of views and experience, mobilizing public opinion and \nrecommending policy options at the national, regional and international levels, \n \nEmphasizing the important role played by the United Nations congresses on \ncrime prevention and criminal justice in recognizing that crime prevention and \ncriminal justice, with due regard to the observance of human rights, make a direct \ncontribution to the maintenance of peace and security, \n__________________ \n \n1 Resolution 46/152, annex. \n\nA/RES/73/184 \nFollow-up to the Thirteenth United Nations Congress on Crime Prevention\nand Criminal Justice and preparations for the Fourteenth United\nNations Congress on Crime Prevention and Criminal Justice\n \n18-22280\n2/5 \n \n \nRecognizing the significant contributions of the United Nations congresses on \ncrime prevention and criminal justice to promoting the exchange of experience in \nresearch, law and policy development and the identification of emerging trends and \nissues in crime prevention and criminal justice among States, intergovernmental \norganizations and individual experts representing various professions and disciplines, \n \nRecalling its resolution 57/270 B of 23 June 2003 on the integrated and \ncoordinated implementation of and follow-up to the outcomes of the major United \nNations conferences and summits in the economic and social fields, in which it \nstressed that all countries should promote policies consistent and coherent with the \ncommitments of the major United Nations conferences and summits, emphasized that \nthe United Nations system had an important responsibility to assist Governments to \nstay fully engaged in the follow-up to and implementation of agreements and \ncommitments reached at the major United Nations conferences and summits and \ninvited its intergovernmental bodies to further promote the implementation of the \noutcomes of the major United Nations conferences and summits, \n \nRecalling also its resolution 62/173 of 18 December 2007, in which it endorsed \nthe recommendations made by the Intergovernmental Group of Experts on Lessons \nLearned from United Nations Congresses on Crime Prevention and Criminal Justice \nat its meeting held in Bangkok from 15 to 18 August 2006,2 \n \nRecalling further its resolution 70/174 of 17 December 2015, in which it \nendorsed the Doha Declaration on Integrating Crime Prevention and Criminal Justice \ninto the Wider United Nations Agenda to Address Social and Economic Challenges \nand to Promote the Rule of Law at the National and International Levels, and Public \nParticipation, adopted by the Thirteenth United Nations Congress on Crime \nPrevention and Criminal Justice, and welcomed with appreciation the offer of the \nGovernment of Japan to act as host to the Fourteenth United Nations Congress on \nCrime Prevention and Criminal Justice, in 2020, \n \nRecalling its resolution 72/192 of 19 December 2017, in which it approved the \nagenda items and decided upon the main theme and the topics for the workshops of \nthe Fourteenth Congress and also decided that the duration of the Fourteenth Congress \nshould not exceed eight days, \n \nRecalling also its resolution 70/1 of 25 September 2015, in which it adopted the \n2030 Agenda for Sustainable Development, \n \nRecognizing the importance of the substantive contributions that the Fourteenth \nCongress can make to the implementation of the 2030 Agenda, \n \nEncouraged by the success of the Thirteenth Congress as one of the largest and \nmost diverse forums for the exchange of views on and experiences in research, law \nand policy and programme development between States, intergovernmental and non-\ngovernmental organizations and individual experts representing various professions \nand disciplines, \n \nStressing the importance of undertaking all preparatory activities for the \nFourteenth Congress in a timely and concerted manner, \n \nHaving considered the report of the Secretary-General,3 \n \n1. \nReiterates its invitation to Governments to take into consideration the \nDoha Declaration on Integrating Crime Prevention and Criminal Justice into the \nWider United Nations Agenda to Address Social and Economic Challenges and to \nPromote the Rule of Law at the National and International Levels, and Public \n__________________ \n \n2 See E/CN.15/2007/6, chap. IV. \n \n3 E/CN.15/2018/11. \n\nFollow-up to the Thirteenth United Nations Congress on Crime Prevention \nand Criminal Justice and preparations for the Fourteenth United \nNations Congress on Crime Prevention and Criminal Justice \nA/RES/73/184\n \n3/5\n18-22280 \n \nParticipation, adopted by the Thirteenth United Nations Congress on Crime \nPrevention and Criminal Justice,4 when formulating legislation and policy directives \nand to make all efforts, where appropriate, to implement the principles contained \ntherein in conformity with the purposes and principles of the Charter of the United \nNations; \n \n2. \nWelcomes the work undertaken by the United Nations Office on Drugs and \nCrime in following up on the implementation of the Doha Declaration; \n \n3. \nNotes with appreciation the progress made thus far in the preparations for \nthe Fourteenth United Nations Congress on Crime Prevention and Criminal Justice; \n \n4. \nDecides to hold the Fourteenth Congress in Kyoto, Japan, from 20 to \n27 April 2020, with pre-Congress consultations to be held on 19 April 2020;  \n \n5. \nAlso decides that the high-level segment of the Fourteenth Congress shall \nbe held during the first two days of the Congress in order to allow Heads of State or \nGovernment and government ministers to focus on the main theme of the Congress \nand to enhance the possibility of generating useful feedback;  \n \n6. \nFurther decides that, in accordance with its resolution 56/119, the \nFourteenth Congress shall adopt a single declaration, to be submitted to the \nCommission on Crime Prevention and Criminal Justice for its consideration; \n \n7. \nTakes note with appreciation of the draft discussion guide prepared by the \nSecretary-General, in cooperation with the institutes of the United Nations crime \nprevention and criminal justice programme network, for the regional preparatory \nmeetings and for the Fourteenth Congress; \n \n8. \nRequests the Secretary-General to finalize the discussion guide in a timely \nmanner, taking into account the recommendations of the Commission on Crime \nPrevention and Criminal Justice, as well as additional comments and feedback from \nMember States, in order to enable the regional preparatory meetings for the \nFourteenth Congress to be held as early as possible in 2019; \n \n9. \nReiterates its request to the Secretary-General to proceed with the \norganization of the four regional preparatory meetings for the Fourteenth Congress \nand to make available the necessary resources for the participation of the least \ndeveloped countries in those meetings and in the Congress itself, in accordance with \npast practice, as well as making a special effort to organize the regional preparatory \nmeeting for European and other States so as to benefit from their input; \n \n10. Urges Governments to actively participate in the regional preparatory \nmeetings, where appropriate, and invite their representatives to examine the \nsubstantive items on the agenda and the topics of the workshops of the Fourteenth \nCongress and to make action-oriented recommendations for consideration by the \nCongress; \n \n11. \nInvites Governments to undertake preparations for the Fourteenth \nCongress at an early stage by all appropriate means, including, where appropriate, the \nestablishment of national preparatory committees; \n \n12. Reiterates its invitation to Member States to be represented at the \nFourteenth Congress at the highest possible level, for example, by Heads of State or \nGovernment, government ministers or attorneys general, and to make statements on \nthe theme and topics of the Congress; \n__________________ \n \n4 Resolution 70/174, annex. \n\nA/RES/73/184 \nFollow-up to the Thirteenth United Nations Congress on Crime Prevention\nand Criminal Justice and preparations for the Fourteenth United\nNations Congress on Crime Prevention and Criminal Justice\n \n18-22280\n4/5 \n \n \n13. Also reiterates its invitation to Member States to play an active role in the \nFourteenth Congress by sending legal and policy experts, including practitioners with \nspecial training and practical experience in crime prevention and criminal justice; \n \n14. Requests the Secretary-General to encourage the participation of \nrepresentatives from relevant entities of the United Nations system in the Fourteenth \nCongress, bearing in mind the main theme, agenda items and workshop topics of the \nCongress; \n \n15. Also requests the Secretary-General, subject to the availability of \nextrabudgetary resources, to facilitate the participation of developing countries in the \nworkshops, and encourages States, the institutes of the United Nations crime \nprevention and criminal justice programme network, other concerned entities and the \nSecretary-General to work together in order to ensure that the workshops are well \nfocused and achieve practical results, leading to technical cooperation ideas and \nprojects and documents for enhancing bilateral and multilateral technical assistance \nactivities in crime prevention and criminal justice; \n \n16. Reiterates its request to the Secretary-General to facilitate the organization \nof ancillary meetings of non-governmental and professional organizations \nparticipating in the Fourteenth Congress, in accordance with past practice, as well as \nmeetings of professional and geographical interest groups, and to take appropriate \nmeasures to encourage the participation of the academic and research community in \nthe Congress, and encourages Member States to actively participate in the above-\nmentioned meetings, as they provide an opportunity to develop and maintain a strong \npartnership with the private sector and civil society organizations; \n \n17. Requests the Secretary-General to prepare a plan for the documentation \nfor the Fourteenth Congress, in consultation with the extended Bureau of the \nCommission on Crime Prevention and Criminal Justice; \n \n18. Again encourages the relevant specialized agencies and programmes of \nthe United Nations and intergovernmental and non-governmental organizations, as \nwell as other professional organizations, to cooperate with the United Nations Office \non Drugs and Crime in the preparations for the Fourteenth Congress; \n \n19. Requests the Secretary-General to appoint a Secretary-General and an \nExecutive Secretary of the Fourteenth Congress, in accordance with past practice, to \nperform their functions under the rules of procedure for United Nations congresses \non crime prevention and criminal justice; \n \n20. Also requests the Secretary-General to provide the United Nations Office \non Drugs and Crime with the necessary resources, from within the overall \nappropriations of the programme budget for the biennium 2018\u20132019 and the \nprogramme budget for 2020, to support the preparations for and holding of the \nFourteenth Congress; \n \n21. Further requests the Secretary-General to ensure, in collaboration with \nMember States, a wide and effective programme of public information relating to the \npreparations for the Fourteenth Congress, to the Congress itself and to the follow-up \nto and implementation of its recommendations; \n \n22. Requests the Commission on Crime Prevention and Criminal Justice to \naccord sufficient time at its twenty-eighth session to reviewing the progress made in \nthe preparations for the Fourteenth Congress, to finalize in a timely manner all \noutstanding organizational and substantive arrangements and to make its \nrecommendations to the General Assembly through the Economic and Social Council; \n\nFollow-up to the Thirteenth United Nations Congress on Crime Prevention \nand Criminal Justice and preparations for the Fourteenth United \nNations Congress on Crime Prevention and Criminal Justice \nA/RES/73/184\n \n5/5\n18-22280 \n \n \n23. Requests the Secretary-General to ensure proper follow-up to the present \nresolution and to report thereon to the General Assembly through the Commission on \nCrime Prevention and Criminal Justice at its twenty-eighth session. \n \n56th plenary meeting  \n17 December 2018 \n \n",
  "paragraphs": {
    "1": "Reiterates its invitation to Governments to take into consideration the Doha Declaration on Integrating Crime Prevention and Criminal Justice into the Wider United Nations Agenda to Address Social and Economic Challenges and to Promote the Rule of Law at the National and International Levels, and Public Participation, adopted by the Thirteenth United Nations Congress on Crime Prevention and Criminal Justice,4 when formulating legislation and policy directives and to make all efforts, where appropriate, to implement the principles contained therein in conformity with the purposes and principles of the Charter of the United Nations;",
    "2": "Welcomes the work undertaken by the United Nations Office on Drugs and Crime in following up on the implementation of the Doha Declaration;",
    "3": "Notes with appreciation the progress made thus far in the preparations for the Fourteenth United Nations Congress on Crime Prevention and Criminal Justice;",
    "4": "Decides to hold the Fourteenth Congress in Kyoto, Japan, from 20 to 27 April 2020, with pre-Congress consultations to be held on 19 April 2020;",
    "5": "Also decides that the high-level segment of the Fourteenth Congress shall be held during the first two days of the Congress in order to allow Heads of State or Government and government ministers to focus on the main theme of the Congress and to enhance the possibility of generating useful feedback;",
    "6": "Further decides that, in accordance with its resolution 56/119, the Fourteenth Congress shall adopt a single declaration, to be submitted to the Commission on Crime Prevention and Criminal Justice for its consideration;",
    "7": "Takes note with appreciation of the draft discussion guide prepared by the Secretary-General, in cooperation with the institutes of the United Nations crime prevention and criminal justice programme network, for the regional preparatory meetings and for the Fourteenth Congress;",
    "8": "Requests the Secretary-General to finalize the discussion guide in a timely manner, taking into account the recommendations of the Commission on Crime Prevention and Criminal Justice, as well as additional comments and feedback from Member States, in order to enable the regional preparatory meetings for the Fourteenth Congress to be held as early as possible in 2019;",
    "9": "Reiterates its request to the Secretary-General to proceed with the organization of the four regional preparatory meetings for the Fourteenth Congress and to make available the necessary resources for the participation of the least developed countries in those meetings and in the Congress itself, in accordance with past practice, as well as making a special effort to organize the regional preparatory meeting for European and other States so as to benefit from their input;",
    "10": "Urges Governments to actively participate in the regional preparatory meetings, where appropriate, and invite their representatives to examine the substantive items on the agenda and the topics of the workshops of the Fourteenth Congress and to make action-oriented recommendations for consideration by the Congress;",
    "11": "Invites Governments to undertake preparations for the Fourteenth Congress at an early stage by all appropriate means, including, where appropriate, the establishment of national preparatory committees;",
    "12": "Reiterates its invitation to Member States to be represented at the Fourteenth Congress at the highest possible level, for example, by Heads of State or Government, government ministers or attorneys general, and to make statements on the theme and topics of the Congress;",
    "13": "Also reiterates its invitation to Member States to play an active role in the Fourteenth Congress by sending legal and policy experts, including practitioners with special training and practical experience in crime prevention and criminal justice;",
    "14": "Requests the Secretary-General to encourage the participation of representatives from relevant entities of the United Nations system in the Fourteenth Congress, bearing in mind the main theme, agenda items and workshop topics of the Congress;",
    "15": "Also requests the Secretary-General, subject to the availability of extrabudgetary resources, to facilitate the participation of developing countries in the workshops, and encourages States, the institutes of the United Nations crime prevention and criminal justice programme network, other concerned entities and the Secretary-General to work together in order to ensure that the workshops are well focused and achieve practical results, leading to technical cooperation ideas and projects and documents for enhancing bilateral and multilateral technical assistance activities in crime prevention and criminal justice;",
    "16": "Reiterates its request to the Secretary-General to facilitate the organization of ancillary meetings of non-governmental and professional organizations participating in the Fourteenth Congress, in accordance with past practice, as well as meetings of professional and geographical interest groups, and to take appropriate measures to encourage the participation of the academic and research community in the Congress, and encourages Member States to actively participate in the above- mentioned meetings, as they provide an opportunity to develop and maintain a strong partnership with the private sector and civil society organizations;",
    "17": "Requests the Secretary-General to prepare a plan for the documentation for the Fourteenth Congress, in consultation with the extended Bureau of the Commission on Crime Prevention and Criminal Justice;",
    "18": "Again encourages the relevant specialized agencies and programmes of the United Nations and intergovernmental and non-governmental organizations, as well as other professional organizations, to cooperate with the United Nations Office on Drugs and Crime in the preparations for the Fourteenth Congress;",
    "19": "Requests the Secretary-General to appoint a Secretary-General and an Executive Secretary of the Fourteenth Congress, in accordance with past practice, to perform their functions under the rules of procedure for United Nations congresses on crime prevention and criminal justice;",
    "20": "Also requests the Secretary-General to provide the United Nations Office on Drugs and Crime with the necessary resources, from within the overall appropriations of the programme budget for the biennium 2018\u20132019 and the programme budget for 2020, to support the preparations for and holding of the Fourteenth Congress;",
    "21": "Further requests the Secretary-General to ensure, in collaboration with Member States, a wide and effective programme of public information relating to the preparations for the Fourteenth Congress, to the Congress itself and to the follow-up to and implementation of its recommendations;",
    "22": "",
    "23": "Requests the Secretary-General to ensure proper follow-up to the present resolution and to report thereon to the General Assembly through the Commission on Crime Prevention and Criminal Justice at its twenty-eighth session."
  },
  "agenda_items": [
    "Item 109"
  ],
  "symbol_references": []
}