{
  "symbol": "A/RES/75/147",
  "filename": "A_RES_75_147.pdf",
  "title": "75/147. Observer status for the Small Island Developing States Dock (SIDS DOCK) in the General Assembly",
  "text": "United Nations \nA/RES/75/147\n \n \nGeneral Assembly \nDistr.: General \n22 December 2020 \n \n20-17235 (E)    291220 \n*2017235* \n \n \nSeventy-fifth session \nAgenda item 180 \nObserver status for the Small Island Developing States \nDock (SIDS DOCK) in the General Assembly  \n \n \n \n \n Resolution adopted by the General Assembly \non 15 December 2020 \n \n \n \n \n[on the report of the Sixth Committee (A/75/448, para. 8)] \n \n \n 75/147. Observer status for the Small Island Developing States Dock \n(SIDS DOCK) in the General Assembly \n \n \n \nThe General Assembly, \n \nWishing to promote cooperation between the United Nations and the Small \nIsland Developing States Dock (SIDS DOCK), \n \n1. \nDecides to invite the Small Island Developing States Dock (SIDS DOCK) \nto participate in the sessions and the work of the General Assembly in the capacity of \nobserver;  \n \n2. \nRequests the Secretary-General to take the action necessary to implement \nthe present resolution. \n \n45th plenary meeting \n15 December 2020 \n \n \n",
  "paragraphs": {
    "1": "Decides to invite the Small Island Developing States Dock (SIDS DOCK) to participate in the sessions and the work of the General Assembly in the capacity of observer;",
    "2": "Requests the Secretary-General to take the action necessary to implement the present resolution."
  },
  "agenda_items": [
    "Item 180"
  ],
  "symbol_references": []
}