{
  "symbol": "A/RES/79/291",
  "filename": "A_RES_79_291.pdf",
  "title": "79/291. World Horse Day",
  "text": "United Nations \nA/RES/79/291 \n \nGeneral Assembly \nDistr.: General \n9 June 2025 \n25-08974 (E) \n*2508974* \n \n \nSeventy-ninth session \nAgenda item 13 \nIntegrated and coordinated implementation of and follow-up \nto the outcomes of the major United Nations conferences and \nsummits in the economic, social and related fields \n \n \n \n \n Resolution adopted by the General Assembly \non 3 June 2025 \n \n \n[without reference to a Main Committee (A/79/L.89)] \n \n \n 79/291. World Horse Day \n \n \n \nThe General Assembly, \n \nReaffirming its resolution 70/1 of 25 September 2015, entitled \u201cTransforming \nour world: the 2030 Agenda for Sustainable Development\u201d, in which it adopted a \ncomprehensive, far-reaching and people-centred set of universal and transformative \nSustainable Development Goals and targets,  \n \nReaffirming also its resolutions 53/199 of 15 December 1998 and 61/185 of \n20 December 2006 on the proclamation of international years, and Economic and \nSocial Council resolution 1980/67 of 25 July 1980 on international years and \nanniversaries, in particular paragraphs 1 to 10 of the annex thereto on the agreed \ncriteria for the proclamation of international years, as well as paragraphs 13 and 14, \nin which it is stated that an international day or year should not be proclaimed before \nthe basic arrangements for its organization and financing have been made,  \n \nEmphasizing that at present there are over 57 million horses in the world and \nthat in many countries the horse industry plays an important role in the socioeconomic \ndevelopment and well-being of people and the promotion of equine welfare and \nspecifically contributes to the daily lives and economic empowerment of the rural \npopulation and local communities through riding, transportation, horse racing, \nequestrian sports, tourism and recreational activities, as well as employment \ngeneration, food production and other businesses,  \n \nRecognizing the efforts of Member States to preserve and develop horse culture \nand heritage as well as the conservation of pastoral nomadic lifestyles,  \n \nAcknowledging that both the number of horses and the equine industry are \ndeclining worldwide to some extent due to changes in lifestyles, pressure on the \nindustry from economic fluctuations, climate change, and environmental and other \nfactors,  \n\nA/RES/79/291 \nWorld Horse Day\n \n25-08974\n2/2 \n \n \nTrusting that the designation of a World Horse Day would create a global \nplatform for the international community to raise awareness of the importance of the \nhorse and the equine industry in sustainable agriculture development,  \n \n1. \nDecides to proclaim 11 July World Horse Day;  \n \n2. \nInvites all Member States, organizations of the United Nations system, \nother international and regional organizations and other relevant stakeholders, \nincluding civil society, the private sector and academia, as well as schools, to observe \nWorld Horse Day, in an appropriate manner and in accordance with national priorities, \nthrough activities aimed at raising awareness among the public of the economic and \nsocial importance of the horse and the equine industry, encouraging the development \nof professional training, scientific research, the dissemination of best practices in the \nequine sector, and the promotion of equine welfare, preserving horse culture and \nheritage, and sharing knowledge, information, best practices and other collaborative \napproaches in this regard;  \n \n3. \nStresses that the cost of all activities that may arise from the \nimplementation of the present resolution should be met by voluntary contributions \nand that such activities would be subject to the availability and provision of voluntary \ncontributions;  \n \n4. \nRequests the Secretary-General to bring the present resolution to the \nattention of all Member States, the organizations of the United Nations system and \nother relevant stakeholders, including civil society, Indigenous Peoples, the private \nsector and academia, for appropriate observance. \n \n73rd plenary meeting \n3 June 2025 \n \n",
  "paragraphs": {
    "1": "Decides to proclaim 11 July World Horse Day;",
    "2": "Invites all Member States, organizations of the United Nations system, other international and regional organizations and other relevant stakeholders, including civil society, the private sector and academia, as well as schools, to observe World Horse Day, in an appropriate manner and in accordance with national priorities, through activities aimed at raising awareness among the public of the economic and social importance of the horse and the equine industry, encouraging the development of professional training, scientific research, the dissemination of best practices in the equine sector, and the promotion of equine welfare, preserving horse culture and heritage, and sharing knowledge, information, best practices and other collaborative approaches in this regard;",
    "3": "Stresses that the cost of all activities that may arise from the implementation of the present resolution should be met by voluntary contributions and that such activities would be subject to the availability and provision of voluntary contributions;",
    "4": "Requests the Secretary-General to bring the present resolution to the attention of all Member States, the organizations of the United Nations system and other relevant stakeholders, including civil society, Indigenous Peoples, the private sector and academia, for appropriate observance. 73rd plenary meeting 3 June 2025"
  },
  "agenda_items": [
    "Item 13"
  ],
  "symbol_references": [
    "A/79/L.89"
  ]
}