{
  "symbol": "A/RES/72/132",
  "filename": "A_RES_72_132.pdf",
  "title": "72/132. International cooperation on humanitarian assistance in the field of natural disasters, from relief to development",
  "text": "United Nations \nA/RES/72/132\n \n \nGeneral Assembly \nDistr.: General \n15 January 2018 \n \n17-22355 (E)    190118 \n*1722355* \n \n \nSeventy-second session \nAgenda item 73 (a) \n \n \n \n \n Resolution adopted by the General Assembly \non 11 December 2017 \n \n \n \n \n[without reference to a Main Committee (A/72/L.23 and A/72/L.23/Add.1)] \n \n \n 72/132. International cooperation on humanitarian assistance in the field \nof natural disasters, from relief to development \n \n \n \nThe General Assembly, \n \nReaffirming its resolution 46/182 of 19 December 1991, the annex to which \ncontains the guiding principles for the strengthening of the coordination of emergency \nhumanitarian assistance of the United Nations system, as well as all its resolutions on \ninternational cooperation on humanitarian assistance in the field of natural disasters, \nfrom relief to development, and recalling the resolutions of the humanitarian \nsegments of the substantive sessions of the Economic and Social Council,  \n \nReaffirming also the principles of humanity, neutrality, impartiality and \nindependence for the provision of humanitarian assistance,  \n \nRecalling the Sendai Declaration1 and the Sendai Framework for Disaster Risk \nReduction 2015\u20132030,2 adopted by the Third United Nations World Conference on \nDisaster Risk Reduction, held in Sendai, Japan, from 14 to 18 March 2015,  \n \nRecognizing that the Sendai Framework applies to the risk of small-scale and \nlarge-scale, frequent and infrequent, sudden and slow-onset disasters caused by \nnatural or man-made hazards, as well as related environmental, technological and \nbiological hazards and risks,  \n \nNoting with concern that slow-onset disasters such as droughts are on the rise \nin many places and can have significant impacts on affected populations and lead to \nincreased vulnerability to other hazards,  \n__________________ \n \n1  Resolution 69/283, annex I. \n \n2  Ibid., annex II. \n\nA/RES/72/132 \nInternational cooperation on humanitarian assistance in\nthe field of natural disasters, from relief to development\n \n17-22355 \n2/15 \n \n \nRecognizing the Global Platform for Disaster Risk Reduction as the main forum \nat the global level for strategic advice coordination and partnership development for \ndisaster risk reduction, and recognizing also the contribution of the regional \nplatforms,  \n \nWelcoming the Paris Agreement3 and its early entry into force, encouraging all \nits parties to fully implement the Agreement, and parties to the United Nations \nFramework Convention on Climate Change4 that have not yet done so to deposit their \ninstruments of ratification, acceptance, approval or accession, where appropriate, as \nsoon as possible, \n \nNoting with appreciation the hosting by the Government of Morocco of the \ntwenty-second session of the Conference of the Parties to the United Nations \nFramework Convention on Climate Change, the twelfth session of the Conference of \nthe Parties serving as the Meeting of the Parties to the Kyoto Protocol and the first \npart of the first session of the Conference of the Parties serving as the Meeting of the \nParties to the Paris Agreement, held in Marrakech, Morocco, from 7 to 18 November \n2016, and noting with appreciation also the convening by the Government of Fiji, \nwith the technical assistance of the Government of Germany, of the twenty-third \nsession of the Conference of the Parties, the thirteenth session of the Conference of \nthe Parties serving as the Meeting of the Parties to the Kyoto Protocol and the second \npart of the first session of the Conference of the Parties serving as the Meeting of the \nParties to the Paris Agreement, held in Bonn, Germany, from 6 to 17 November 2017, \n \nNoting with appreciation also the hosting by the Government of Mexico of the \nfifth session of the Global Platform for Disaster Risk Reduction, held in Cancun, \nMexico, from 22 to 26 May 2017, and looking forward to the upcoming sixth session \nof the Global Platform, to be hosted by Switzerland in Geneva in 2019,  \n \nTaking note of its resolution 71/1 of 19 September 2016, in which the General \nAssembly adopted the New York Declaration for Refugees and Migrants and the \nannexes thereto, \n \nEmphasizing the fundamentally civilian character of humanitarian assistance, \nreaffirming, in situations in which military capacity and assets are used as a last resort \nto support the implementation of humanitarian assistance in the field of natural \ndisasters, the need for their use to be undertaken with the consent of the affected State \nand in conformity with international law, including international humanitarian law, as \nwell as humanitarian principles, and emphasizing also in this regard the need for \nMember States to coordinate with all relevant actors early on in a disaster response \nso as to ensure the predictable, coherent and needs-based deployment of military \nassets and personnel supporting humanitarian assistance,  \n \nEmphasizing also that the affected State has the primary responsibility in the \ninitiation, organization, coordination and implementation of humanitarian assistance \nwithin its territory and in the facilitation of the work of humanitarian organizations \nin mitigating the consequences of natural disasters,  \n \nEmphasizing further the primary responsibility of each State to undertake \ndisaster risk reduction and management, including through the voluntary \nimplementation of and follow-up to the Sendai Framework, as well as response and \nearly recovery efforts, in order to minimize the impact of disasters, while recognizing \nthe importance of international cooperation in support of the efforts of affected \ncountries which may have limited capacities in this regard, \n__________________ \n \n3  See FCCC/CP/2015/10/Add.1, decision 1/CP.21, annex. \n \n4  United Nations, Treaty Series, vol. 1771, No. 30822. \n\nInternational cooperation on humanitarian assistance in \nthe field of natural disasters, from relief to development \nA/RES/72/132\n \n3/15 \n17-22355 \n \n \nNoting the convening of the International Conference on the Implementation of \nthe Health Aspects of the Sendai Framework for Disaster Risk Reduction  \n2015\u20132030, in Bangkok on 10 and 11 March 2016, which adopted the Bangkok \nPrinciples for the implementation of the health aspects of the Sendai Framework as a \ncontribution to the Sendai Framework to build resilient health systems, \n \nRecognizing the primary role of Member States in preparing for and responding \nto outbreaks of infectious disease, including those that become humanitarian crises, \nin compliance with the International Health Regulations (2005) adopted by the World \nHealth Assembly,5 highlighting the critical role played by Member States, the World \nHealth Organization as the directing and coordinating authority on international \nhealth work, the United Nations humanitarian system, regional organizations, \nnon-governmental organizations, the private sector and other humanitarian actors in \nproviding financial, technical and in-kind support in order to bring epidemics or \npandemics under control, and recognizing also the need to strengthen local and \nnational health systems, early reporting and early warning systems, preparedness, \ncross-sectoral response capacities, and resilience linked to outbreaks of infectious \ndisease, including through capacity-building for developing countries, \n \nExpressing its deep concern at the increasing challenges to Member States and \nto the United Nations humanitarian response capacity to deal with the consequences \nof natural disasters, given the effects of global challenges, including the impact of \nclimate change, the adverse impacts of the global financial and economic crisis and \nvolatile food prices on food security and nutrition, and other key factors that \nexacerbate the vulnerability of populations and exposure to natural hazards and the \nimpact of natural disasters,  \n \nExpressing its deep concern also that rural and urban poor communities in the \ndeveloping world are the hardest hit by the effects of increased disaster risk,  \n \nNoting with concern that persons with disabilities, older persons, women and \nchildren are disproportionately affected in natural disasters,  \n \nAcknowledging the impacts of rapid urbanization in the context of natural \ndisasters and the adverse effects of climate change and that urban disaster \npreparedness and responses require appropriate disaster risk reduction strategies, \nincluding in urban planning, and early recovery strategies implemented from the \ninitial stage of relief operations, as well as mitigation, rehabilitation and sustainable \ndevelopment strategies, giving special attention to the needs and capacities of persons \nin vulnerable situations, and that action by humanitarian and development actors in \nurban areas needs to recognize the complexity of cities and build urban resilience, \nwith improved urban expertise and capacities within organizations, while building on \nthe capabilities, opportunities and potential new partnerships present in cities and \nother human settlements,  \n \nWelcoming the adoption of the outcome document entitled \u201cNew Urban Agenda\u201d \nat the United Nations Conference on Housing and Sustainable Urban Development \n(Habitat III), held in Quito from 17 to 20 October 2016,6 and in this regard noting the \ncommitments therein undertaken by Member States regarding affected populations in \nurban areas, and noting also the importance of implementing policies to ensure more \neffective disaster risk reduction and disaster risk management,  \n \nNoting that local communities are the first responders in most disasters, \nunderlining the critical role played by in-country capacities in disaster risk reduction, \nincluding preparedness, as well as response and recovery, and acknowledging the \n__________________ \n \n5  World Health Organization, document WHA58/2005/REC/1, resolution 58.3, annex. \n \n6  Resolution 71/256, annex. \n\nA/RES/72/132 \nInternational cooperation on humanitarian assistance in\nthe field of natural disasters, from relief to development\n \n17-22355 \n4/15 \n \nneed to support efforts of Member States to develop and enhance national and local \ncapacities which are fundamental to improving the overall delivery of humanitarian \nassistance,  \n \nStressing the need for all relevant actors involved in international responses to \nnatural disasters to ensure that such responses are tailored to context, make use of \nappropriate tools and support local systems, including by building on local expertise \nand capacities, \n \nRecognizing the adverse effects of climate change as contributors to \nenvironmental degradation and extreme weather events, which may, in certain \ninstances, among other factors, contribute to disaster-induced human mobility,  \n \nRecognizing also the high numbers of persons affected by natural disasters, \nincluding in this respect displaced persons, \n \nReaffirming the importance of international cooperation in support of the efforts \nof the affected States in dealing with natural disasters in all their phases, in particular \nin preparedness, response and the early recovery phase, and of strengthening the \nresponse capacity of countries affected by disaster,  \n \nRecognizing the importance of sharing and making use of effective practices as \npart of transboundary cooperation in preparation for cross-border disaster situations, \nsuch as simulation exercises or preparedness or evacuation drills, \n \nRecognizing also that scientific advancements can contribute to the effective \nforecasting of extreme weather events, which allows for a more accurate prediction \nof such events, \n \nRecognizing further the progress made by the United Nations Platform for \nSpace-based Information for Disaster Management and Emergency Response \n(UN-SPIDER) in its mission, \n \nNoting the progress of the Global Framework for Climate Services in \ndeveloping and providing science-based climate information and prediction for \nclimate risk management and for adaptation to climate variability and change, and \nlooking forward to continued implementation,  \n \nWelcoming the important role played by Member States, including developing \ncountries, that have granted necessary and continued generous assistance to countries \nand peoples stricken by natural disasters,  \n \nRecognizing the significant role played by national Red Cross and Red Crescent \nsocieties, as part of the International Red Cross and Red Crescent Movement, in \ndisaster preparedness and risk reduction, disaster response, rehabilitation and \ndevelopment,  \n \nRecognizing also the significant achievements of the Central Emergency \nResponse Fund in facilitating life-saving assistance to crisis-affected people by \nproviding \ntimely \nfunding, enabling \nhumanitarian organizations and \ntheir \nimplementing partners to act quickly when tragedy strikes and steer resources to \ncrises that do not receive the attention that they need and deserve, emphasizing the \nneed to broaden and diversify the income base of the Fund, and welcoming in this \nregard the call by the Secretary-General to achieve an annual funding level of \n1 billion United States dollars by 2018, \n \nEmphasizing the need to address vulnerability and to integrate disaster risk \nreduction, including prevention, mitigation and preparedness, into all phases of \nnatural disaster management, post-natural disaster recovery and development \nplanning through close collaboration of all relevant actors and sectors,  \n\nInternational cooperation on humanitarian assistance in \nthe field of natural disasters, from relief to development \nA/RES/72/132\n \n5/15 \n17-22355 \n \n \nReaffirming that strengthening resilience contributes to withstanding, adapting \nto and quickly recovering from disasters,  \n \nReaffirming also the importance of considering increasing investment in \nbuilding the resilience of communities, which can be the first line of response, \n \nRecognizing the changing scope, scale and complexity of humanitarian crises, \nincluding natural disasters, and their adverse impact on efforts to achieve economic \ngrowth, sustainable development and internationally agreed development goals, in \nparticular the Sustainable Development Goals,7 and noting the positive contribution \nthat these efforts can make in strengthening the resilience and preparedness of \npopulations to such disasters and reducing displacement risk in the context of \ndisasters, \n \nRecognizing also the clear relationship between emergency response, \nrehabilitation and development, and reaffirming that, in order to ensure a smooth \ntransition from relief to rehabilitation and development, emergency assistance must \nbe provided in ways that will be supportive of short-term and medium-term recovery, \nleading to long-term development, and that certain emergency measures should be \nseen as a step towards sustainable development,  \n \nEmphasizing, in this context, the important role of development organizations, \ninternational financial institutions and other relevant stakeholders in supporting \nnational efforts to prepare for and mitigate the consequences of natural disasters,  \n \n1. \nTakes note with appreciation of the report of the Secretary-General;8  \n \n2. \nExpresses its deep concern at the increasing impact of natural disasters, \nresulting in massive losses of life and property worldwide and, in some instances, \ndisplacement, in particular in vulnerable societies lacking adequate capacity to \nmitigate effectively the long-term negative social, economic and environmental \nconsequences of natural disasters; \n \n3. \nReaffirms the importance of implementing the Sendai Framework for \nDisaster Risk Reduction 2015\u20132030,2 to ensure the substantial reduction of disaster \nrisk and losses in lives, livelihoods and health and in the economic, physical, social, \ncultural and environmental assets of persons, businesses, communities and countries, \nand underlines the importance of tackling the underlying disaster risk drivers and of \nintegrating a disaster risk reduction perspective into humanitarian assistance and \ndevelopment assistance programmes, as appropriate, to prevent new and reduce \nexisting disaster risk;  \n \n4. \nEncourages the United Nations to continue to increase its support for \nMember States in their prioritized implementation of the Sendai Framework, \nincluding through the revised United Nations Plan of Action on Disaster Risk \nReduction for Resilience: Towards a Risk-informed and Integrated Approach to \nSustainable Development, in line with the Sendai Framework, to ensure that the \nimplementation of the Sendai Framework most effectively contributes to a risk-\ninformed and integrated approach to the achievement of the 2030 Agenda for \nSustainable Development,7 in particular through building resilience against disasters, \nreducing displacement risk in the context of disasters and supporting national and \nlocal preparedness and response capacities; \n \n5. \nEmphasizes the need to promote and strengthen disaster risk reduction and \npreparedness activities at all levels, in particular in hazard-prone areas, and \nencourages Member States, the United Nations system and other relevant \n__________________ \n \n7  See resolution 70/1. \n \n8  A/72/348. \n\nA/RES/72/132 \nInternational cooperation on humanitarian assistance in\nthe field of natural disasters, from relief to development\n \n17-22355 \n6/15 \n \nhumanitarian and development actors to continue to increase funding and cooperation \nfor disaster risk reduction activities, including the strengthening of preparedness and \nmitigation, as well as for responding to disasters; \n \n6. \nEncourages Member States, in line with the call in the Sendai Framework, \nto promote disaster risk reduction, including prevention, mitigation and preparedness, \nresponse and recovery with a view to ensuring a rapid and effective response to \ndisasters and to promoting international cooperation to build resilience and reduce \ndisaster risk; \n \n7. \nAlso encourages Member States to provide dedicated financial \ncontributions to disaster risk reduction, including prevention, mitigation and \npreparedness, as well as response and recovery efforts, in a harmonized, flexible and \ncomplementary approach that fully utilizes and helps to coordinate humanitarian and \ndevelopment funding options and potential; \n \n8. \nCalls upon all States to adopt, where required, and to continue to \nimplement effectively, necessary legislative and other appropriate measures to \nmitigate the effects of natural disasters and integrate disaster risk reduction strategies \ninto development planning, as well as to incorporate a gender perspective into \npolicies, planning and funding, and in this regard requests the international \ncommunity to continue to assist developing countries as well as countries with \neconomies in transition, as appropriate;  \n \n9. \nAcknowledges that climate change, among other factors, contributes to \nenvironmental degradation and to the increase in the intensity and frequency of \nclimate and extreme weather events, both of which amplify disaster risk and disaster-\ninduced human mobility, and in this regard encourages Member States, as well as \nrelevant international, regional and subregional organizations, in accordance with \ntheir specific mandates, to support adaptation to the adverse effects of climate change, \nto strengthen disaster risk reduction and to substantially increase the availability of \nand access to multi-hazard early warning systems in order to minimize the \nhumanitarian consequences of natural disasters, including through the provision of \ntechnology and support for capacity-building in developing countries;  \n \n10. Urges the United Nations, relevant humanitarian and development \norganizations, international financial institutions and other relevant stakeholders to \nstrengthen the capacity and resilience of Member States, including through the \napplication of new science and technology and through investments in the context of \ndisasters and climate change; \n \n11. \nEncourages Member States to address the humanitarian and development \nneeds arising from natural disaster-induced displacement, including through national \npolicies and resilience-building, and in this regard encourages Member States, \nsupported by the United Nations, to develop national laws and policies on internal \ndisplacement, as appropriate, which address such displacement, detail responsibilities \nand measures to minimize the impact of disasters, protect and assist internally \ndisplaced persons following disasters and identify, promote and support safe, \ndignified and durable solutions, and in this respect encourages Member States to \nadopt standards, as appropriate, in line with the Guiding Principles on Internal \nDisplacement,9 the Framework on Durable Solutions for Internally Displaced Persons \nof the Inter-Agency Standing Committee10 and the basic principles and guidelines on \ndevelopment-based evictions and displacement;11  \n__________________ \n \n9  E/CN.4/1998/53/Add.2, annex. \n \n10  A/HRC/13/21/Add.4. \n \n11  A/HRC/4/18, annex I. \n\nInternational cooperation on humanitarian assistance in \nthe field of natural disasters, from relief to development \nA/RES/72/132\n \n7/15 \n17-22355 \n \n \n12. Calls upon Member States, the United Nations and humanitarian and \ndevelopment organizations to integrate the building of resilience and human mobility \ninto relevant strategies, plans and legal frameworks, in particular regarding disaster \nrisk management and climate change adaptation, as integral elements of sustainable \ndevelopment at the national and regional levels so as to help to prevent and mitigate \ndisplacement in the context of disasters and the adverse effects of climate change, \nincluding in urban settings where displaced persons have particular needs, \nrequirements and vulnerabilities, and to enhance cooperation and coordination, where \nappropriate, to comprehensively respond to such displacement, including by \npreventing, preparing for and addressing it; \n \n13. Recognizes the increase in the number and scale of natural disasters, \nincluding those related to the adverse effects of climate change, which in certain \ninstances may contribute to displacement and to additional pressure on host \ncommunities, encourages Member States, the United Nations and relevant \norganizations and actors to further strengthen the efforts aimed at addressing the \nneeds of persons displaced in the context of disasters, including those induced by \nclimate change, and notes in this regard the importance of sharing best practices to \nprevent and prepare for such displacements;  \n \n14. Encourages Member States, the United Nations, relevant humanitarian \nand development organizations and other relevant stakeholders, as appropriate, to \nenhance understanding, analysis, monitoring and assessment of the drivers, scale, \ndynamics, effects, patterns and duration of displacement in the context of slow-onset \ndisasters, gradual environmental degradation and climate change, to strengthen the \nsystematic, impartial and timely collection and sharing of data disaggregated by sex, \nage and disability and to strengthen evidence-based policy and operational responses \nat all levels in this regard, including to address the root causes of such displacement \nand strengthen the resilience of displaced persons and their host communities;  \n \n15. Encourages Member States to strengthen operational and legal \nframeworks for international disaster relief, to adopt and implement national laws and \nregulations, as appropriate, to reduce the impact of the underlying drivers of disaster \nrisk and vulnerability, and to adopt comprehensive rules and procedures for the \nfacilitation and regulation of international disaster assistance, drawing, as \nappropriate, from the Guidelines for the Domestic Facilitation and Regulation of \nInternational Disaster Relief and Initial Recovery Assistance, and calls upon the \nInternational Red Cross and Red Crescent Movement, relevant United Nations \norganizations and other partners for technical support in achieving these aims; \n \n16. Welcomes the effective cooperation among the affected States, relevant \nbodies of the United Nations system, donor countries, regional and international \nfinancial institutions and other relevant stakeholders, such as the International Red \nCross and Red Crescent Movement, municipalities, civil society and the private \nsector, in the coordination and delivery of emergency relief, and stresses the need to \ncontinue such cooperation and delivery throughout relief operations and medium- and \nlong-term rehabilitation and reconstruction efforts, in a manner that reduces \nvulnerability to future natural hazards;  \n \n17. Reiterates the commitment to support, as a matter of priority, the efforts \nof countries, in particular developing countries, to strengthen their capacities at all \nlevels in order to assess and reduce risks, prepare for and respond rapidly to natural \ndisasters and mitigate their impact;  \n \n18. Also reiterates the need to build the capacities of governments to manage \nand respond to disaster and climate risks, including by providing support for and \nstrengthening national and, as appropriate, local preparedness and response \n\nA/RES/72/132 \nInternational cooperation on humanitarian assistance in\nthe field of natural disasters, from relief to development\n \n17-22355 \n8/15 \n \ncapacities, and to build resilience, taking into account the differing needs of women, \ngirls, boys and men of all ages; \n \n19. Urges Member States to develop, update and strengthen early warning \nsystems, disaster preparedness and risk reduction measures at all levels, in accordance \nwith the Sendai Framework, taking into account their own circumstances and \ncapacities and in coordination with relevant actors, as appropriate, and to improve \ntheir response to early warning information in order to ensure that early warning leads \nto early action, implemented effectively in a timely manner, including through \nscaled-up, predictable and multi-year support, such as forecast-based financing, and \nencourages all stakeholders to support the efforts of Member States in this regard; \n \n20. Urges Member States, the United Nations and humanitarian and \ndevelopment organizations to continue to support early warning and early action \nefforts, including through forecast-based financing at the global, regional and national \nlevels, including for multi-hazard early warning systems, climate services, exposure \nand vulnerability mapping, new technologies and communication protocols, so that \npersons in vulnerable situations who are exposed to natural hazards, including in \ngeographically remote locations, receive timely, reliable, accurate and actionable \nearly warning information, and encourages the international community to further \nsupport national efforts in this regard; \n \n21. Encourages Member States to develop or enhance forecast-based \npreparedness and response systems, including through the establishment and \nnetworking of risk management centres, as well as the coordination of existing \nnetworks, ensure that comprehensive procedures are in place and make resources \navailable for actions in anticipation of natural disasters, and invites relevant bodies \nof the United Nations system and other stakeholders to engage in these efforts; \n \n22. Also encourages Member States to consider elaborating and presenting to \nthe International Strategy for Disaster Reduction secretariat their national platforms \nfor disaster risk reduction in accordance with the Sendai Framework, and encourages \nStates to cooperate with each other to reach this objective; \n \n23. Recognizes the importance of applying a multi-hazard approach to \npreparedness, and encourages Member States, taking into account their specific \ncircumstances, and the United Nations system to continue to apply the approach to \ntheir preparedness activities, including by giving due regard to, inter alia, secondary \nenvironmental hazards stemming from industrial and technological accidents;  \n \n24. Stresses that, to increase further the effectiveness of humanitarian \nassistance, particular international cooperation efforts should be undertaken to \nenhance and broaden further the utilization of national and local capacities and, where \nappropriate, of regional and subregional capacities for disaster preparedness and \nresponse, which may be made available in closer proximity to the site of a disaster, \nand more efficiently and at lower cost;  \n \n25. Encourages Member States, the United Nations and other relevant \nstakeholders to continue to support the localization of disaster preparedness and \nresponse and work to ensure that national and local actors are enabled to respond to \ncommunity-level needs and priorities; \n \n26. Encourages Member States and regional organizations to work together to \nstrengthen regional cooperation to improve national and regional capacity to \nunderstand and reduce risks and prepare for and respond to disasters in support of \nnational efforts, including by exchanging experiences and best practices;  \n \n27. Encourages Member States to move from reactive to more proactive risk-\nbased, all-hazards and all-of-society approaches, such as the promotion of ex ante \n\nInternational cooperation on humanitarian assistance in \nthe field of natural disasters, from relief to development \nA/RES/72/132\n \n9/15 \n17-22355 \n \ninvestments to prevent disaster risks and build resilience, the promotion of \nenvironmental and spatial measures and the integration of lessons from past disasters, \nas well as awareness of new risks, into future planning;  \n \n28. Encourages innovative practices that draw on the knowledge of people \naffected by natural disasters to develop locally sustainable solutions and to produce \nlifesaving items locally, with minimal logistical and infrastructure implications;  \n \n29. Stresses, in this context, the importance of strengthening international \ncooperation, particularly through the effective use of multilateral mechanisms, in the \ntimely provision of humanitarian assistance through all phases of a disaster, from \nrelief and recovery to development, including the provision of adequate resources;  \n \n30. Encourages all relevant stakeholders, including Member States, to take \nappropriate measures to reduce and discourage the sending of unsolicited, unneeded \nor inappropriate relief goods in response to disasters;  \n \n31. Encourages all Member States to facilitate, to the extent possible, the \ntransit of emergency humanitarian assistance and development assistance and the \nentry of humanitarian personnel and supplies, provided in the context of international \nefforts, including in the phase from relief to development, in full accordance with the \nprovisions of resolution 46/182 and the annex thereto, and in full respect of the \nhumanitarian principles of humanity, neutrality, impartiality and independence, and \ntheir obligations under international law, including international humanitarian law;  \n \n32. Encourages Member States to put in place, as appropriate, customs \nmeasures to improve effectiveness in responding to natural disasters;  \n \n33. Reaffirms the leading role of the Office for the Coordination of \nHumanitarian Affairs of the Secretariat as the focal point within the overall United \nNations system for the advocacy for and coordination of humanitarian assistance \namong United Nations humanitarian organizations and other humanitarian partners;  \n \n34. Welcomes the important contribution of the United Nations Disaster \nAssessment and Coordination system to the effectiveness of humanitarian assistance \nin supporting Member States, upon their request, and the United Nations system in \npreparedness and humanitarian response, and encourages the continued incorporation \ninto this mechanism of experts from developing countries that are prone to natural \ndisasters;  \n \n35. Also welcomes the important contribution of the International Search and \nRescue Advisory Group to the effectiveness of international urban search and rescue \nassistance, and encourages Member States to continue to support the Advisory Group, \nin line with General Assembly resolution 57/150 of 16 December 2002;  \n \n36. Urges Member States, the United Nations system and other humanitarian \nactors to consider the specific and differentiated consequences of natural disasters in \nboth rural and urban areas when designing and implementing disaster risk reduction, \nprevention and mitigation, preparedness, humanitarian assistance and early recovery \nstrategies, giving special emphasis to addressing the needs of those living in rural and \nurban poor areas prone to natural disasters;  \n \n37. Encourages Member States, the United Nations and humanitarian and \ndevelopment organizations, in accordance with their respective mandates, and other \nrelevant stakeholders to continue to take concrete action for the effective \nimplementation of the New Urban Agenda,6 in order to strengthen resilience to \ndisasters and the adverse effects of climate change, and ensure that sustainable \ndevelopment in urban settings is informed by disaster risk, giving special attention to \nthe needs and capacities of persons in vulnerable situations; \n\nA/RES/72/132 \nInternational cooperation on humanitarian assistance in\nthe field of natural disasters, from relief to development\n \n17-22355 \n10/15 \n \n \n38. Welcomes the continued efforts of the Office for the Coordination of \nHumanitarian Affairs to build partnerships with regional organizations, traditional \nand non-traditional donors and the private sector, and encourages Member States and \nthe United Nations system to continue to strengthen partnerships at the global, \nregional, national and local levels in support of national efforts in situations of natural \ndisasters, in order to cooperate effectively in providing humanitarian assistance to \nthose in need and ensure that their collaborative efforts adhere to the principles of \nhumanity, neutrality, impartiality and independence;  \n \n39. Recognizes that information and telecommunications technology can play \nan important role in disaster response, encourages Member States to develop \nemergency response telecommunications capacities, encourages the international \ncommunity to assist the efforts of developing countries in this area, where needed, \nincluding in the recovery phase, and in this regard encourages Member States that \nhave not acceded to or ratified the Tampere Convention on the Provision of \nTelecommunication Resources for Disaster Mitigation and Relief Operations 12 to \nconsider doing so;  \n \n40. Encourages the further use of space-based and ground-based remote-\nsensing technologies, including as provided by the United Nations Platform for \nSpace-based Information for Disaster Management and Emergency Response \n(UN-SPIDER), as well as the sharing of geographical data, for the forecasting, \nprevention, mitigation and management of natural disasters, where appropriate, and \ninvites Member States to continue to provide their support to the consolidation of the \nUnited Nations capability in the area of satellite-derived geographical information for \nearly warning, preparedness, response and early recovery; \n \n41. Encourages Member States to provide all support necessary, on a \nvoluntary basis, to UN-SPIDER, including financial support, to enable it to carry out \nits workplan for 2018\u20132019, and reiterates the importance of enhancing international \ncoordination and cooperation at the global level in disaster management and \nemergency response through greater access to and use of space-based services for all \ncountries and by facilitating capacity-building and institutional strengthening for \ndisaster management, in particular in developing countries;  \n \n42. Recognizes the opportunities for new technologies, when utilized in a \ncoordinated fashion and based on humanitarian principles, potentially to improve the \neffectiveness and accountability of humanitarian response, and encourages Member \nStates, the United Nations and its humanitarian partners to consider engaging, inter \nalia, with the volunteer and technical communities, as appropriate, in order to make \nuse of the variety of data and information available during emergencies and disaster \nrisk efforts; \n \n43. Encourages the United Nations to continue to strengthen its provision of \ndata-related services and policy advice and build the data skills of its humanitarian \nstaff, in order to improve the effectiveness of disaster preparedness and response; \n \n44. Encourages Member States, relevant United Nations organizations and \ninternational financial institutions to enhance the global capacity for sustainable \npost-disaster recovery in areas such as coordination with traditional and \nnon-traditional partners, identification and dissemination of lessons learned, \ndevelopment of common tools and mechanisms for recovery needs assessment, \nstrategy development and programming, and incorporation of risk reduction into all \nrecovery processes, and welcomes the ongoing efforts to this end;  \n__________________ \n \n12  United Nations, Treaty Series, vol. 2296, No. 40906. \n\nInternational cooperation on humanitarian assistance in \nthe field of natural disasters, from relief to development \nA/RES/72/132\n \n11/15 \n17-22355 \n \n \n45. Encourages Member States and the United Nations system to support \nnational initiatives that address the differentiated impacts of natural disasters on the \naffected population, including through the collection and analysis of data \ndisaggregated, inter alia, by sex, age and disability, using, inter alia, the existing \ninformation provided by States, and through the development of tools, methods and \nprocedures that will result in more timely and useful initial needs assessments that \nlead to targeted and more effective assistance, and taking into account the \nenvironmental impact;  \n \n46. Calls upon United Nations humanitarian organizations, in consultation \nwith Member States, as appropriate, to strengthen the evidence base for effective \nhumanitarian assistance by further developing common mechanisms to improve the \nquality, transparency and reliability of, and make further progress towards, common \nhumanitarian needs assessments, to assess their performance in assistance and to \nensure the most effective use of humanitarian resources by these organizations;  \n \n47. Encourages Member States to take steps to develop or to improve data \ncollection and analysis and to facilitate the exchange of relevant non-sensitive \ninformation with humanitarian and development organizations of the United Nations, \nincluding through shared platforms and a common approach, in order to inform policy \nand measures designed to address disaster risks and their consequences, to support \npreparedness efforts, including forecast-based action and financing, and to improve \nthe effectiveness and accountability of a needs-based humanitarian response, and \nencourages the United Nations system, as appropriate, and other relevant actors to \ncontinue to assist developing countries in their efforts to build local and national \ncapacities for data collection and analysis; \n \n48. Also encourages Member States, with support from the United Nations \nupon request, to establish and strengthen national disaster loss databases, risk profiles \nand available capacities and to continue to collect, share and use such data to inform \nrelevant policies and strategies; \n \n49. Encourages Member States, regional organizations, the United Nations \nand humanitarian and development organizations to continue to improve the \nidentification, mapping and analysis of risks and vulnerabilities, including the local \nimpact of future disaster risk drivers, and the development and implementation of \nappropriate strategies and programmes to address them, and in this regard encourages \nall the relevant stakeholders to support Governments in capacity development, \nincluding at the regional and local levels, through the sharing of expertise and tools \nand the provision of necessary resources, as appropriate, to ensure that effective \ndisaster management plans and capacities are in place in accordance with national \npriorities for disaster risk management;  \n \n50. Stresses the importance of the full and equal participation of women in \ndecision-making and of gender mainstreaming in developing and implementing \ndisaster risk reduction, preparedness, response and recovery strategies, and in this \nregard requests the Secretary-General to continue to ensure that gender \nmainstreaming is better taken into account in all aspects of humanitarian responses \nand activities, including the analysis of allocations and programme implementation, \nand through greater use of the gender marker;  \n \n51. Encourages Member States, in cooperation with relevant United Nations \nhumanitarian organizations, to promote women\u2019s leadership, empowerment and full \nand effective participation in the planning and implementation of natural disaster \nresponse strategies, including through strengthening partnerships with, and building \nthe capacities of, national and local institutions, including national and local women\u2019s \norganizations and civil society actors, as appropriate; \n\nA/RES/72/132 \nInternational cooperation on humanitarian assistance in\nthe field of natural disasters, from relief to development\n \n17-22355 \n12/15 \n \n \n52. Encourages Governments, local authorities, the United Nations system \nand regional organizations, and invites donors and other assisting countries, to \naddress the vulnerabilities and capacities of women and girls through gender-\nresponsive programming, including with regard to sexual and reproductive health \nneeds and means to address sexual and gender-based violence and various forms of \nexploitation during emergencies and in post-disaster environments, and the allocation \nof resources in their disaster risk reduction, response and recovery efforts in \ncoordination with the Governments of affected countries;  \n \n53. Emphasizes the importance of mainstreaming the perspective of persons \nwith disabilities in disaster risk reduction, recognizes the importance of \nnon-discrimination and their inclusive and active participation in and contribution to \ndisaster risk reduction, preparedness, emergency response, recovery and transition \nfrom relief to development, as well as the implementation of policies and programmes \nthat are inclusive of and accessible to persons with disabilities, recognizing that \npersons with disabilities are disproportionately affected in humanitarian emergencies \nand face multiple obstacles in accessing humanitarian assistance, and recalls the \nCharter on Inclusion of Persons with Disabilities in Humanitarian Action;  \n \n54. Encourages efforts to provide safe and enabling learning environments \nand access to quality education for all, especially for girls and boys, in humanitarian \nemergencies caused by natural disasters, including in order to contribute to a smooth \ntransition from relief to development; \n \n55. Encourages Member States and relevant regional and international \norganizations to identify and improve the dissemination of best practices for \nimproving disaster preparedness, response and early recovery and to scale up \nsuccessful local initiatives, as appropriate;  \n \n56. Requests the United Nations humanitarian and development organizations \nto improve their coordination of disaster recovery efforts, from relief to development, \ninter alia, by strengthening institutional, coordination and strategic planning efforts \nin disaster preparedness, resilience-building and recovery, in support of national \nauthorities, and by ensuring that development actors participate in strategic planning \nat an early stage;  \n \n57. Encourages the United Nations and humanitarian and development \norganizations to support national, subnational and local governments and \ncommunities in their responsibility to develop long-term strategies, forecast-based \nfinancing and preparedness systems and multi-year operational plans for preparedness \nthat are embedded within disaster risk reduction and resilience strategies in line with \nthe Sendai Framework; \n \n58. Calls upon the United Nations system and other humanitarian actors to \nimprove the dissemination of tools and services to support enhanced disaster risk \nreduction, in particular preparedness, and early recovery;  \n \n59. Calls upon relevant United Nations humanitarian and development \norganizations, in consultation with Member States, to strengthen tools and \nmechanisms to ensure that early recovery needs and support are integrated into the \nplanning and implementation of disaster preparedness, humanitarian response and \ndevelopment cooperation activities, as appropriate;  \n \n60. Encourages the United Nations system and humanitarian organizations to \ncontinue their efforts to mainstream early recovery into humanitarian programming, \nacknowledges that early recovery is an important step towards resilience-building and \nshould receive further funding, and encourages the provision of timely, flexible and \npredictable funding for early recovery, including through established and \ncomplementary humanitarian and development instruments;  \n\nInternational cooperation on humanitarian assistance in \nthe field of natural disasters, from relief to development \nA/RES/72/132\n \n13/15 \n17-22355 \n \n \n61. Urges Member States, the United Nations and humanitarian and \ndevelopment organizations to prioritize risk management and shift towards an \nanticipatory approach to humanitarian crises in order to prevent and reduce human \nsuffering and economic losses;  \n \n62. Urges Member States, humanitarian and development organizations and \nother stakeholders to ensure a comprehensive and coherent approach at the global, \nregional, national and local levels to El Ni\u00f1o and La Ni\u00f1a phenomena and similar or \nrelated events, including by strengthening forecasting, early warning, prevention, \npreparedness, resilience-building and timely response, supported by effective \nleadership and predictable, adequate and early funding, when feasible, in regions, \ncountries and communities likely to be affected, and notes the work of the Special \nEnvoys of the Secretary-General on El Ni\u00f1o and Climate and the blueprint for action \nprepared by them, and the standard operating procedures for El Ni\u00f1o/Southern \nOscillation events of the Inter-Agency Standing Committee;  \n \n63. Encourages Member States and the United Nations to enhance the use of \ncommon risk analysis, including the use of the Index for Risk Management, to \nestablish the evidence base for short-, medium- and long-term planning and joint \nstrategies for disaster and climate risk management, capacity development and \nresilience-building, allowing for greater prioritization of resources where the risk is \ngreatest;  \n \n64. Encourages the United Nations and humanitarian and development \norganizations to work towards a common understanding of underlying risks, clarify \nroles and responsibilities according to their respective mandates and establish joint \nobjectives and programmes informed by affected people, data and analysis to \nstrengthen coordination, collaboration and coherence among short-, medium- and \nlong-term activities to progressively reduce needs and vulnerability, build resilience \nand manage the risk related to climate change and of disasters and development \nsetbacks over multi-year planning cycles, including through integrating risk \nmanagement into national sustainable development plans and ensuring the \nconnectivity of humanitarian plans with the longer-term sustainable development \npriorities of Member States, with a view to achieving the Sustainable Development \nGoals;7  \n \n65. Stresses the need to strengthen resilience at all levels, and in this regard \nencourages Member States, the United Nations system and other relevant actors to \nsupport efforts, as appropriate, to integrate resilience into humanitarian and \ndevelopment programming, and encourages humanitarian and development actors to \npursue, where appropriate, common resilience and risk management objectives, \nachievable through joint analysis, planning, programming and funding;  \n \n66. Encourages Member States, international financial institutions and the \nprivate sector to mobilize predictable and multi-year support and to work collectively \ntowards common results in order to reduce need, risk and vulnerability, making use \nof a wide range of financing flows and instruments and partnerships to mobilize \nadditional resources in the field of natural disasters;  \n \n67. Calls upon Member States, the United Nations and humanitarian \norganizations to provide emergency assistance in ways that are supportive of recovery \nand long-term development, as appropriate, including by prioritizing humanitarian \ntools that strengthen resilience and support livelihoods, such as, but not limited to, \ncash transfers, vouchers, local procurement of food and services and social safety \nnets;  \n \n68. Encourages the United Nations system and other relevant humanitarian \nand development actors to support humanitarian coordinators and resident \n\nA/RES/72/132 \nInternational cooperation on humanitarian assistance in\nthe field of natural disasters, from relief to development\n \n17-22355 \n14/15 \n \ncoordinators in order to strengthen their capacity, inter alia, to support the host \nGovernment in implementing preparedness measures and to coordinate preparedness \nactivities of country teams in support of national efforts, and encourages the United \nNations system and other relevant humanitarian actors to further strengthen the ability \nto quickly and flexibly deploy humanitarian professionals to support Governments \nand country teams in the immediate aftermath of a disaster;  \n \n69. Encourages Member States, the United Nations and humanitarian and \ndevelopment organizations to identify ways to improve the current financing \narchitecture in order to better provide coherent, predictable and flexible longer-term \nfunding for risk management in multi-year strategies and forecasting, in particular \npreparedness, on the basis of a global assessment of risk, allowing for better \nprioritization of resources where the risk is greatest; \n \n70. Emphasizes the need to mobilize adequate, flexible and sustainable \nresources for recovery, preparedness and disaster risk reduction activities in order to \nensure predictable and timely access to resources for humanitarian assistance in \nemergencies resulting from disasters associated with natural hazards;  \n \n71. Welcomes the important achievements of the Central Emergency Response \nFund in ensuring a more timely and predictable response to humanitarian \nemergencies, stresses the importance of continuing to improve the functioning of the \nFund, and in this regard encourages the United Nations funds and programmes and \nthe specialized agencies to review and evaluate, where necessary, their partnership \npolicies and practices in order to ensure the timely disbursement of funds from the \nFund to implementing partners in order to ensure that resources are used in the most \nefficient, effective, accountable and transparent manner possible;  \n \n72. Calls upon all Member States, and invites the private sector and all \nconcerned individuals and institutions, to consider increasing their voluntary \ncontributions to the Central Emergency Response Fund in order to achieve an annual \nfunding level of 1 billion United States dollars by 2018, and to continue to reinforce \nand strengthen the Fund as the global emergency response fund, and emphasizes that \ncontributions should be additional to current commitments to humanitarian \nprogramming and should not be to the detriment of resources made available for \ninternational cooperation for development;  \n \n73. Invites Member States, the private sector and all other relevant \nstakeholders to harness their differentiated skills, capacities and resources, and also \nto consider voluntary contributions to humanitarian funding mechanisms;  \n \n74. Strongly encourages giving appropriate consideration to disaster risk \nreduction and the building of resilience to disasters as integral elements of sustainable \ndevelopment and in the implementation of the 2030 Agenda for Sustainable \nDevelopment and the Addis Ababa Action Agenda of the Third International \nConference on Financing for Development13 and promoting a complementary and \ncoherent approach between these agendas and the Sendai Framework; \n \n75. Strongly encourages all relevant actors to work to ensure a comprehensive, \ncoherent, systematic and people-centred approach to managing risks, including \nthrough, as appropriate, the 2030 Agenda for Sustainable Development, the Sendai \nFramework, the Paris Agreement3 and the New Urban Agenda; \n__________________ \n \n13  Resolution 69/313, annex. \n\nInternational cooperation on humanitarian assistance in \nthe field of natural disasters, from relief to development \nA/RES/72/132\n \n15/15 \n17-22355 \n \n \n76. Takes note of the World Humanitarian Summit, held in Istanbul, Turkey, \non 23 and 24 May 2016, and takes note of the report of the Secretary-General on the \noutcome of the World Humanitarian Summit;14  \n \n77. Requests the Secretary-General to continue to improve the international \nresponse to natural disasters and to report thereon to the General Assembly at its \nseventy-third session and to include in his report recommendations on how to ensure \nthat humanitarian assistance is provided in ways supportive of the transition from \nrelief to development. \n \n70th plenary meeting  \n11 December 2017 \n \n__________________ \n \n14  A/71/353. \n",
  "paragraphs": {
    "1": "Takes note with appreciation of the report of the Secretary-General;8",
    "2": "Expresses its deep concern at the increasing impact of natural disasters, resulting in massive losses of life and property worldwide and, in some instances, displacement, in particular in vulnerable societies lacking adequate capacity to mitigate effectively the long-term negative social, economic and environmental consequences of natural disasters;",
    "3": "Reaffirms the importance of implementing the Sendai Framework for Disaster Risk Reduction 2015\u20132030,2 to ensure the substantial reduction of disaster risk and losses in lives, livelihoods and health and in the economic, physical, social, cultural and environmental assets of persons, businesses, communities and countries, and underlines the importance of tackling the underlying disaster risk drivers and of integrating a disaster risk reduction perspective into humanitarian assistance and development assistance programmes, as appropriate, to prevent new and reduce existing disaster risk;",
    "4": "Encourages the United Nations to continue to increase its support for Member States in their prioritized implementation of the Sendai Framework, including through the revised United Nations Plan of Action on Disaster Risk Reduction for Resilience: Towards a Risk-informed and Integrated Approach to Sustainable Development, in line with the Sendai Framework, to ensure that the implementation of the Sendai Framework most effectively contributes to a risk- informed and integrated approach to the achievement of the 2030 Agenda for Sustainable Development,7 in particular through building resilience against disasters, reducing displacement risk in the context of disasters and supporting national and local preparedness and response capacities;",
    "5": "Emphasizes the need to promote and strengthen disaster risk reduction and preparedness activities at all levels, in particular in hazard-prone areas, and encourages Member States, the United Nations system and other relevant humanitarian and development actors to continue to increase funding and cooperation for disaster risk reduction activities, including the strengthening of preparedness and mitigation, as well as for responding to disasters;",
    "6": "Encourages Member States, in line with the call in the Sendai Framework, to promote disaster risk reduction, including prevention, mitigation and preparedness, response and recovery with a view to ensuring a rapid and effective response to disasters and to promoting international cooperation to build resilience and reduce disaster risk;",
    "7": "Also encourages Member States to provide dedicated financial contributions to disaster risk reduction, including prevention, mitigation and preparedness, as well as response and recovery efforts, in a harmonized, flexible and complementary approach that fully utilizes and helps to coordinate humanitarian and development funding options and potential;",
    "8": "Calls upon all States to adopt, where required, and to continue to implement effectively, necessary legislative and other appropriate measures to mitigate the effects of natural disasters and integrate disaster risk reduction strategies into development planning, as well as to incorporate a gender perspective into policies, planning and funding, and in this regard requests the international community to continue to assist developing countries as well as countries with economies in transition, as appropriate;",
    "9": "Acknowledges that climate change, among other factors, contributes to environmental degradation and to the increase in the intensity and frequency of climate and extreme weather events, both of which amplify disaster risk and disaster- induced human mobility, and in this regard encourages Member States, as well as relevant international, regional and subregional organizations, in accordance with their specific mandates, to support adaptation to the adverse effects of climate change, to strengthen disaster risk reduction and to substantially increase the availability of and access to multi-hazard early warning systems in order to minimize the humanitarian consequences of natural disasters, including through the provision of technology and support for capacity-building in developing countries;",
    "10": "Urges the United Nations, relevant humanitarian and development organizations, international financial institutions and other relevant stakeholders to strengthen the capacity and resilience of Member States, including through the application of new science and technology and through investments in the context of disasters and climate change;",
    "11": "Encourages Member States to address the humanitarian and development needs arising from natural disaster-induced displacement, including through national policies and resilience-building, and in this regard encourages Member States, supported by the United Nations, to develop national laws and policies on internal displacement, as appropriate, which address such displacement, detail responsibilities and measures to minimize the impact of disasters, protect and assist internally displaced persons following disasters and identify, promote and support safe, dignified and durable solutions, and in this respect encourages Member States to adopt standards, as appropriate, in line with the Guiding Principles on Internal Displacement,9 the Framework on Durable Solutions for Internally Displaced Persons of the Inter-Agency Standing Committee10 and the basic principles and guidelines on development-based evictions and displacement;11",
    "12": "Calls upon Member States, the United Nations and humanitarian and development organizations to integrate the building of resilience and human mobility into relevant strategies, plans and legal frameworks, in particular regarding disaster risk management and climate change adaptation, as integral elements of sustainable development at the national and regional levels so as to help to prevent and mitigate displacement in the context of disasters and the adverse effects of climate change, including in urban settings where displaced persons have particular needs, requirements and vulnerabilities, and to enhance cooperation and coordination, where appropriate, to comprehensively respond to such displacement, including by preventing, preparing for and addressing it;",
    "13": "Recognizes the increase in the number and scale of natural disasters, including those related to the adverse effects of climate change, which in certain instances may contribute to displacement and to additional pressure on host communities, encourages Member States, the United Nations and relevant organizations and actors to further strengthen the efforts aimed at addressing the needs of persons displaced in the context of disasters, including those induced by climate change, and notes in this regard the importance of sharing best practices to prevent and prepare for such displacements;",
    "14": "Encourages Member States, the United Nations, relevant humanitarian and development organizations and other relevant stakeholders, as appropriate, to enhance understanding, analysis, monitoring and assessment of the drivers, scale, dynamics, effects, patterns and duration of displacement in the context of slow-onset disasters, gradual environmental degradation and climate change, to strengthen the systematic, impartial and timely collection and sharing of data disaggregated by sex, age and disability and to strengthen evidence-based policy and operational responses at all levels in this regard, including to address the root causes of such displacement and strengthen the resilience of displaced persons and their host communities;",
    "15": "Encourages Member States to strengthen operational and legal frameworks for international disaster relief, to adopt and implement national laws and regulations, as appropriate, to reduce the impact of the underlying drivers of disaster risk and vulnerability, and to adopt comprehensive rules and procedures for the facilitation and regulation of international disaster assistance, drawing, as appropriate, from the Guidelines for the Domestic Facilitation and Regulation of International Disaster Relief and Initial Recovery Assistance, and calls upon the International Red Cross and Red Crescent Movement, relevant United Nations organizations and other partners for technical support in achieving these aims;",
    "16": "Welcomes the effective cooperation among the affected States, relevant bodies of the United Nations system, donor countries, regional and international financial institutions and other relevant stakeholders, such as the International Red Cross and Red Crescent Movement, municipalities, civil society and the private sector, in the coordination and delivery of emergency relief, and stresses the need to continue such cooperation and delivery throughout relief operations and medium- and long-term rehabilitation and reconstruction efforts, in a manner that reduces vulnerability to future natural hazards;",
    "17": "Reiterates the commitment to support, as a matter of priority, the efforts of countries, in particular developing countries, to strengthen their capacities at all levels in order to assess and reduce risks, prepare for and respond rapidly to natural disasters and mitigate their impact;",
    "18": " capacities, and to build resilience, taking into account the differing needs of women, girls, boys and men of all ages;",
    "19": "Urges Member States to develop, update and strengthen early warning systems, disaster preparedness and risk reduction measures at all levels, in accordance with the Sendai Framework, taking into account their own circumstances and capacities and in coordination with relevant actors, as appropriate, and to improve their response to early warning information in order to ensure that early warning leads to early action, implemented effectively in a timely manner, including through scaled-up, predictable and multi-year support, such as forecast-based financing, and encourages all stakeholders to support the efforts of Member States in this regard;",
    "20": "Urges Member States, the United Nations and humanitarian and development organizations to continue to support early warning and early action efforts, including through forecast-based financing at the global, regional and national levels, including for multi-hazard early warning systems, climate services, exposure and vulnerability mapping, new technologies and communication protocols, so that persons in vulnerable situations who are exposed to natural hazards, including in geographically remote locations, receive timely, reliable, accurate and actionable early warning information, and encourages the international community to further support national efforts in this regard;",
    "21": "Encourages Member States to develop or enhance forecast-based preparedness and response systems, including through the establishment and networking of risk management centres, as well as the coordination of existing networks, ensure that comprehensive procedures are in place and make resources available for actions in anticipation of natural disasters, and invites relevant bodies of the United Nations system and other stakeholders to engage in these efforts;",
    "22": "Also encourages Member States to consider elaborating and presenting to the International Strategy for Disaster Reduction secretariat their national platforms for disaster risk reduction in accordance with the Sendai Framework, and encourages States to cooperate with each other to reach this objective;",
    "23": "Recognizes the importance of applying a multi-hazard approach to preparedness, and encourages Member States, taking into account their specific circumstances, and the United Nations system to continue to apply the approach to their preparedness activities, including by giving due regard to, inter alia, secondary environmental hazards stemming from industrial and technological accidents;",
    "24": "Stresses that, to increase further the effectiveness of humanitarian assistance, particular international cooperation efforts should be undertaken to enhance and broaden further the utilization of national and local capacities and, where appropriate, of regional and subregional capacities for disaster preparedness and response, which may be made available in closer proximity to the site of a disaster, and more efficiently and at lower cost;",
    "25": "Encourages Member States, the United Nations and other relevant stakeholders to continue to support the localization of disaster preparedness and response and work to ensure that national and local actors are enabled to respond to community-level needs and priorities;",
    "26": "Encourages Member States and regional organizations to work together to strengthen regional cooperation to improve national and regional capacity to understand and reduce risks and prepare for and respond to disasters in support of national efforts, including by exchanging experiences and best practices;",
    "27": " investments to prevent disaster risks and build resilience, the promotion of environmental and spatial measures and the integration of lessons from past disasters, as well as awareness of new risks, into future planning;",
    "28": "Encourages innovative practices that draw on the knowledge of people affected by natural disasters to develop locally sustainable solutions and to produce lifesaving items locally, with minimal logistical and infrastructure implications;",
    "29": "Stresses, in this context, the importance of strengthening international cooperation, particularly through the effective use of multilateral mechanisms, in the timely provision of humanitarian assistance through all phases of a disaster, from relief and recovery to development, including the provision of adequate resources;",
    "30": "Encourages all relevant stakeholders, including Member States, to take appropriate measures to reduce and discourage the sending of unsolicited, unneeded or inappropriate relief goods in response to disasters;",
    "31": "Encourages all Member States to facilitate, to the extent possible, the transit of emergency humanitarian assistance and development assistance and the entry of humanitarian personnel and supplies, provided in the context of international efforts, including in the phase from relief to development, in full accordance with the provisions of resolution 46/182 and the annex thereto, and in full respect of the humanitarian principles of humanity, neutrality, impartiality and independence, and their obligations under international law, including international humanitarian law;",
    "32": "Encourages Member States to put in place, as appropriate, customs measures to improve effectiveness in responding to natural disasters;",
    "33": "Reaffirms the leading role of the Office for the Coordination of Humanitarian Affairs of the Secretariat as the focal point within the overall United Nations system for the advocacy for and coordination of humanitarian assistance among United Nations humanitarian organizations and other humanitarian partners;",
    "34": "Welcomes the important contribution of the United Nations Disaster Assessment and Coordination system to the effectiveness of humanitarian assistance in supporting Member States, upon their request, and the United Nations system in preparedness and humanitarian response, and encourages the continued incorporation into this mechanism of experts from developing countries that are prone to natural disasters;",
    "35": "Also welcomes the important contribution of the International Search and Rescue Advisory Group to the effectiveness of international urban search and rescue assistance, and encourages Member States to continue to support the Advisory Group, in line with General Assembly resolution 57/150 of 16 December 2002;",
    "36": "Urges Member States, the United Nations system and other humanitarian actors to consider the specific and differentiated consequences of natural disasters in both rural and urban areas when designing and implementing disaster risk reduction, prevention and mitigation, preparedness, humanitarian assistance and early recovery strategies, giving special emphasis to addressing the needs of those living in rural and urban poor areas prone to natural disasters;",
    "37": "",
    "38": "Welcomes the continued efforts of the Office for the Coordination of Humanitarian Affairs to build partnerships with regional organizations, traditional and non-traditional donors and the private sector, and encourages Member States and the United Nations system to continue to strengthen partnerships at the global, regional, national and local levels in support of national efforts in situations of natural disasters, in order to cooperate effectively in providing humanitarian assistance to those in need and ensure that their collaborative efforts adhere to the principles of humanity, neutrality, impartiality and independence;",
    "39": "Recognizes that information and telecommunications technology can play an important role in disaster response, encourages Member States to develop emergency response telecommunications capacities, encourages the international community to assist the efforts of developing countries in this area, where needed, including in the recovery phase, and in this regard encourages Member States that have not acceded to or ratified the Tampere Convention on the Provision of Telecommunication Resources for Disaster Mitigation and Relief Operations 12 to consider doing so;",
    "40": "Encourages the further use of space-based and ground-based remote- sensing technologies, including as provided by the United Nations Platform for Space-based Information for Disaster Management and Emergency Response (UN-SPIDER), as well as the sharing of geographical data, for the forecasting, prevention, mitigation and management of natural disasters, where appropriate, and invites Member States to continue to provide their support to the consolidation of the United Nations capability in the area of satellite-derived geographical information for early warning, preparedness, response and early recovery;",
    "41": "Encourages Member States to provide all support necessary, on a voluntary basis, to UN-SPIDER, including financial support, to enable it to carry out its workplan for 2018\u20132019, and reiterates the importance of enhancing international coordination and cooperation at the global level in disaster management and emergency response through greater access to and use of space-based services for all countries and by facilitating capacity-building and institutional strengthening for disaster management, in particular in developing countries;",
    "42": "Recognizes the opportunities for new technologies, when utilized in a coordinated fashion and based on humanitarian principles, potentially to improve the effectiveness and accountability of humanitarian response, and encourages Member States, the United Nations and its humanitarian partners to consider engaging, inter alia, with the volunteer and technical communities, as appropriate, in order to make use of the variety of data and information available during emergencies and disaster risk efforts;",
    "43": "Encourages the United Nations to continue to strengthen its provision of data-related services and policy advice and build the data skills of its humanitarian staff, in order to improve the effectiveness of disaster preparedness and response;",
    "44": "Encourages Member States, relevant United Nations organizations and international financial institutions to enhance the global capacity for sustainable post-disaster recovery in areas such as coordination with traditional and non-traditional partners, identification and dissemination of lessons learned, development of common tools and mechanisms for recovery needs assessment, strategy development and programming, and incorporation of risk reduction into all recovery processes, and welcomes the ongoing efforts to this end;",
    "45": "Encourages Member States and the United Nations system to support national initiatives that address the differentiated impacts of natural disasters on the affected population, including through the collection and analysis of data disaggregated, inter alia, by sex, age and disability, using, inter alia, the existing information provided by States, and through the development of tools, methods and procedures that will result in more timely and useful initial needs assessments that lead to targeted and more effective assistance, and taking into account the environmental impact;",
    "46": "Calls upon United Nations humanitarian organizations, in consultation with Member States, as appropriate, to strengthen the evidence base for effective humanitarian assistance by further developing common mechanisms to improve the quality, transparency and reliability of, and make further progress towards, common humanitarian needs assessments, to assess their performance in assistance and to ensure the most effective use of humanitarian resources by these organizations;",
    "47": "Encourages Member States to take steps to develop or to improve data collection and analysis and to facilitate the exchange of relevant non-sensitive information with humanitarian and development organizations of the United Nations, including through shared platforms and a common approach, in order to inform policy and measures designed to address disaster risks and their consequences, to support preparedness efforts, including forecast-based action and financing, and to improve the effectiveness and accountability of a needs-based humanitarian response, and encourages the United Nations system, as appropriate, and other relevant actors to continue to assist developing countries in their efforts to build local and national capacities for data collection and analysis;",
    "48": "Also encourages Member States, with support from the United Nations upon request, to establish and strengthen national disaster loss databases, risk profiles and available capacities and to continue to collect, share and use such data to inform relevant policies and strategies;",
    "49": "Encourages Member States, regional organizations, the United Nations and humanitarian and development organizations to continue to improve the identification, mapping and analysis of risks and vulnerabilities, including the local impact of future disaster risk drivers, and the development and implementation of appropriate strategies and programmes to address them, and in this regard encourages all the relevant stakeholders to support Governments in capacity development, including at the regional and local levels, through the sharing of expertise and tools and the provision of necessary resources, as appropriate, to ensure that effective disaster management plans and capacities are in place in accordance with national priorities for disaster risk management;",
    "50": "Stresses the importance of the full and equal participation of women in decision-making and of gender mainstreaming in developing and implementing disaster risk reduction, preparedness, response and recovery strategies, and in this regard requests the Secretary-General to continue to ensure that gender mainstreaming is better taken into account in all aspects of humanitarian responses and activities, including the analysis of allocations and programme implementation, and through greater use of the gender marker;",
    "51": "",
    "52": "Encourages Governments, local authorities, the United Nations system and regional organizations, and invites donors and other assisting countries, to address the vulnerabilities and capacities of women and girls through gender- responsive programming, including with regard to sexual and reproductive health needs and means to address sexual and gender-based violence and various forms of exploitation during emergencies and in post-disaster environments, and the allocation of resources in their disaster risk reduction, response and recovery efforts in coordination with the Governments of affected countries;",
    "53": "Emphasizes the importance of mainstreaming the perspective of persons with disabilities in disaster risk reduction, recognizes the importance of non-discrimination and their inclusive and active participation in and contribution to disaster risk reduction, preparedness, emergency response, recovery and transition from relief to development, as well as the implementation of policies and programmes that are inclusive of and accessible to persons with disabilities, recognizing that persons with disabilities are disproportionately affected in humanitarian emergencies and face multiple obstacles in accessing humanitarian assistance, and recalls the Charter on Inclusion of Persons with Disabilities in Humanitarian Action;",
    "54": "Encourages efforts to provide safe and enabling learning environments and access to quality education for all, especially for girls and boys, in humanitarian emergencies caused by natural disasters, including in order to contribute to a smooth transition from relief to development;",
    "55": "Encourages Member States and relevant regional and international organizations to identify and improve the dissemination of best practices for improving disaster preparedness, response and early recovery and to scale up successful local initiatives, as appropriate;",
    "56": "Requests the United Nations humanitarian and development organizations to improve their coordination of disaster recovery efforts, from relief to development, inter alia, by strengthening institutional, coordination and strategic planning efforts in disaster preparedness, resilience-building and recovery, in support of national authorities, and by ensuring that development actors participate in strategic planning at an early stage;",
    "57": "Encourages the United Nations and humanitarian and development organizations to support national, subnational and local governments and communities in their responsibility to develop long-term strategies, forecast-based financing and preparedness systems and multi-year operational plans for preparedness that are embedded within disaster risk reduction and resilience strategies in line with the Sendai Framework;",
    "58": "Calls upon the United Nations system and other humanitarian actors to improve the dissemination of tools and services to support enhanced disaster risk reduction, in particular preparedness, and early recovery;",
    "59": "Calls upon relevant United Nations humanitarian and development organizations, in consultation with Member States, to strengthen tools and mechanisms to ensure that early recovery needs and support are integrated into the planning and implementation of disaster preparedness, humanitarian response and development cooperation activities, as appropriate;",
    "60": "",
    "61": "Urges Member States, the United Nations and humanitarian and development organizations to prioritize risk management and shift towards an anticipatory approach to humanitarian crises in order to prevent and reduce human suffering and economic losses;",
    "62": "Urges Member States, humanitarian and development organizations and other stakeholders to ensure a comprehensive and coherent approach at the global, regional, national and local levels to El Ni\u00f1o and La Ni\u00f1a phenomena and similar or related events, including by strengthening forecasting, early warning, prevention, preparedness, resilience-building and timely response, supported by effective leadership and predictable, adequate and early funding, when feasible, in regions, countries and communities likely to be affected, and notes the work of the Special Envoys of the Secretary-General on El Ni\u00f1o and Climate and the blueprint for action prepared by them, and the standard operating procedures for El Ni\u00f1o/Southern Oscillation events of the Inter-Agency Standing Committee;",
    "63": "Encourages Member States and the United Nations to enhance the use of common risk analysis, including the use of the Index for Risk Management, to establish the evidence base for short-, medium- and long-term planning and joint strategies for disaster and climate risk management, capacity development and resilience-building, allowing for greater prioritization of resources where the risk is greatest;",
    "64": "Encourages the United Nations and humanitarian and development organizations to work towards a common understanding of underlying risks, clarify roles and responsibilities according to their respective mandates and establish joint objectives and programmes informed by affected people, data and analysis to strengthen coordination, collaboration and coherence among short-, medium- and long-term activities to progressively reduce needs and vulnerability, build resilience and manage the risk related to climate change and of disasters and development setbacks over multi-year planning cycles, including through integrating risk management into national sustainable development plans and ensuring the connectivity of humanitarian plans with the longer-term sustainable development priorities of Member States, with a view to achieving the Sustainable Development Goals;7",
    "65": "Stresses the need to strengthen resilience at all levels, and in this regard encourages Member States, the United Nations system and other relevant actors to support efforts, as appropriate, to integrate resilience into humanitarian and development programming, and encourages humanitarian and development actors to pursue, where appropriate, common resilience and risk management objectives, achievable through joint analysis, planning, programming and funding;",
    "66": "Encourages Member States, international financial institutions and the private sector to mobilize predictable and multi-year support and to work collectively towards common results in order to reduce need, risk and vulnerability, making use of a wide range of financing flows and instruments and partnerships to mobilize additional resources in the field of natural disasters;",
    "67": "Calls upon Member States, the United Nations and humanitarian organizations to provide emergency assistance in ways that are supportive of recovery and long-term development, as appropriate, including by prioritizing humanitarian tools that strengthen resilience and support livelihoods, such as, but not limited to, cash transfers, vouchers, local procurement of food and services and social safety nets;",
    "68": " coordinators in order to strengthen their capacity, inter alia, to support the host Government in implementing preparedness measures and to coordinate preparedness activities of country teams in support of national efforts, and encourages the United Nations system and other relevant humanitarian actors to further strengthen the ability to quickly and flexibly deploy humanitarian professionals to support Governments and country teams in the immediate aftermath of a disaster;",
    "69": "Encourages Member States, the United Nations and humanitarian and development organizations to identify ways to improve the current financing architecture in order to better provide coherent, predictable and flexible longer-term funding for risk management in multi-year strategies and forecasting, in particular preparedness, on the basis of a global assessment of risk, allowing for better prioritization of resources where the risk is greatest;",
    "70": "Emphasizes the need to mobilize adequate, flexible and sustainable resources for recovery, preparedness and disaster risk reduction activities in order to ensure predictable and timely access to resources for humanitarian assistance in emergencies resulting from disasters associated with natural hazards;",
    "71": "Welcomes the important achievements of the Central Emergency Response Fund in ensuring a more timely and predictable response to humanitarian emergencies, stresses the importance of continuing to improve the functioning of the Fund, and in this regard encourages the United Nations funds and programmes and the specialized agencies to review and evaluate, where necessary, their partnership policies and practices in order to ensure the timely disbursement of funds from the Fund to implementing partners in order to ensure that resources are used in the most efficient, effective, accountable and transparent manner possible;",
    "72": "Calls upon all Member States, and invites the private sector and all concerned individuals and institutions, to consider increasing their voluntary contributions to the Central Emergency Response Fund in order to achieve an annual funding level of 1 billion United States dollars by 2018, and to continue to reinforce and strengthen the Fund as the global emergency response fund, and emphasizes that contributions should be additional to current commitments to humanitarian programming and should not be to the detriment of resources made available for international cooperation for development;",
    "73": "Invites Member States, the private sector and all other relevant stakeholders to harness their differentiated skills, capacities and resources, and also to consider voluntary contributions to humanitarian funding mechanisms;",
    "74": "Strongly encourages giving appropriate consideration to disaster risk reduction and the building of resilience to disasters as integral elements of sustainable development and in the implementation of the 2030 Agenda for Sustainable Development and the Addis Ababa Action Agenda of the Third International Conference on Financing for Development13 and promoting a complementary and coherent approach between these agendas and the Sendai Framework;",
    "75": "Strongly encourages all relevant actors to work to ensure a comprehensive, coherent, systematic and people-centred approach to managing risks, including through, as appropriate, the 2030 Agenda for Sustainable Development, the Sendai Framework, the Paris Agreement3 and the New Urban Agenda;",
    "76": "Takes note of the World Humanitarian Summit, held in Istanbul, Turkey, on 23 and 24 May 2016, and takes note of the report of the Secretary-General on the outcome of the World Humanitarian Summit;14",
    "77": "Requests the Secretary-General to continue to improve the international response to natural disasters and to report thereon to the General Assembly at its seventy-third session and to include in his report recommendations on how to ensure that humanitarian assistance is provided in ways supportive of the transition from relief to development."
  },
  "agenda_items": [
    "Item 73"
  ],
  "symbol_references": [
    "A/72/L.23"
  ]
}