{
  "symbol": "A/RES/78/61",
  "filename": "A_RES_78_61.pdf",
  "title": "78/61. Report of the Conference on Disarmament",
  "text": "United Nations \nA/RES/78/61\n \n \nGeneral Assembly \nDistr.: General \n6 December 2023 \n \n23-24466 (E)    141223     \n*2324466* \n \n \nSeventy-eighth session \nAgenda item 101 (a) \nReview of the implementation of the recommendations and \ndecisions adopted by the General Assembly at its tenth \nspecial session: report of the Conference on Disarmament\n \n \n \n \n \n Resolution adopted by the General Assembly \non 4 December 2023 \n \n \n \n \n[on the report of the First Committee (A/78/576, para. 9)] \n \n \n \n78/61. Report of the Conference on Disarmament \n \n \n \nThe General Assembly, \n \nHaving considered the report of the Conference on Disarmament,1 \n \nRecalling its resolution 77/89 of 7 December 2022, \n \nConvinced that the Conference on Disarmament, as the single multilateral \ndisarmament negotiating forum of the international community, has the primary role \nin substantive negotiations on priority questions of disarmament, \n \nRecognizing the addresses of the Ministers for Foreign Affairs and other high-\nlevel officials in the Conference on Disarmament, and referring to their various \nexpressions of support for and concern about the endeavours of the Conference and \ncalls for the Conference to commence negotiations without delay to advance \ndisarmament goals through the adoption of a balanced and comprehensive programme \nof work, \n \nRecognizing also the need to conduct multilateral negotiations with the aim of \nreaching agreement on concrete issues, and emphasizing the importance of effective \nmultilateralism in the context of the changing international climate, \n \nNoting with renewed concern that, despite the intensive efforts by States \nmembers and Presidents of the Conference on Disarmament at its 2023 session to \nreach consensus on a programme of work on the basis of relevant proposals and \nsuggestions, the Conference did not succeed in commencing its substantive work by \nmeans of negotiations or agree to a programme of work, although the Conference did \nhold substantive thematic discussions on its agenda items, \n__________________ \n \n1  Official Records of the General Assembly, Seventy-eighth Session, Supplement No. 27 (A/78/27). \n\nA/RES/78/61 \nReport of the Conference on Disarmament\n \n23-24466\n2/3 \n \n \nRecalling, in this respect, that the Conference on Disarmament has a number of \npriority issues for negotiation to achieve disarmament goals, \n \nWelcoming the overwhelming call for greater flexibility with respect to \nimplementing the mandate of the Conference on Disarmament on the basis of a \nbalanced and comprehensive programme of work, \n \nUnderlining the need for continued cooperation among the States members of \nthe Conference on Disarmament as well as among the successive Presidents of the \nConference, \n \nNoting with appreciation the efforts and contributions made at the 2023 session \nto promote substantive discussions on issues on the agenda, \n \nReaffirming the importance of multilateralism and the principle of inclusivity in \nthe work of the Conference on Disarmament, and noting with regret that the latter has \nnot always been sufficiently ensured,2 while recalling in this regard the rules of \nprocedure of the Conference, \n \nAcknowledging the United Nations Institute for Disarmament Research, as a \nstand-alone, autonomous institution, and the contribution that its research makes, \n \nRecognizing the importance of engagement between civil society and the \nConference on Disarmament according to decisions taken by the Conference, \n \n1. \nReaffirms the role of the Conference on Disarmament as the single \nmultilateral disarmament negotiating forum of the international community; \n \n2. \nAppreciates the strong support expressed for the Conference on \nDisarmament at its 2023 session by Ministers for Foreign Affairs and other high-level \nofficials, while also acknowledging their concern about its ongoing impasse of more \nthan two decades, and takes into account their calls for greater flexibility with respect \nto commencing the substantive work of the Conference without further delay; \n \n3. \nCalls upon the Conference on Disarmament to further intensify \nconsultations and to explore possibilities for overcoming its ongoing deadlock by \nadopting and implementing a balanced and comprehensive programme of work at the \nearliest possible date during its 2024 session, bearing in mind the decision on the \nprogramme of work adopted by the Conference on 29 May 2009, 3 as well as other \nrelevant present, past and future proposals; \n \n4. \nEncourages the current President and the incoming President of the \nConference on Disarmament to conduct consultations on the activities of the \nConference in fulfilling its mandate during the intersessional period and, if possible, \nto make recommendations, taking into account all relevant proposals, past, present \nand future, including those submitted as documents of the Conference, views \npresented and discussions held, and to endeavour to keep the membership of the \nConference informed, as appropriate, of their consultations; \n \n5. \nRequests the current President and successive Presidents of the Conference \non Disarmament to cooperate with the States members of the Conference in the effort \nto guide the Conference to the early commencement of its substantive work, including \nnegotiations, at its 2024 session; \n \n6. \nRecognizes the importance of continuing consultations in 2024 on the \nquestion of the expansion of the membership of the Conference on Disarmament; \n__________________ \n \n2  Ibid., para. 9. \n \n3  Ibid., Sixty-fourth Session, Supplement No. 27 (A/64/27), para. 18. \n\nReport of the Conference on Disarmament \nA/RES/78/61\n \n3/3\n23-24466 \n \n \n7. \nCalls upon the Conference on Disarmament to undertake efforts to ensure \ninclusivity and multilateralism in its work, including through participation at its \nsessions, in accordance with its rules of procedure;4 \n \n8. \nRequests the Secretary-General to continue to ensure and to strengthen, if \nneeded, the provision to the Conference on Disarmament of all necessary \nadministrative, substantive and conference support services; \n \n9. \nRequests the Conference on Disarmament to submit to the General \nAssembly at its seventy-ninth session a report on its work; \n \n10. Decides to include in the provisional agenda of its seventy-ninth session, \nunder the item entitled \u201cReview of the implementation of the recommendations and \ndecisions adopted by the General Assembly at its tenth special session\u201d, the sub-item \nentitled \u201cReport of the Conference on Disarmament\u201d. \n \n42nd plenary meeting \n4 December 2023 \n \n__________________ \n \n4  CD/8/Rev.10, paras. 32\u201336. \n",
  "paragraphs": {
    "1": "Reaffirms the role of the Conference on Disarmament as the single multilateral disarmament negotiating forum of the international community;",
    "2": "Appreciates the strong support expressed for the Conference on Disarmament at its 2023 session by Ministers for Foreign Affairs and other high-level officials, while also acknowledging their concern about its ongoing impasse of more than two decades, and takes into account their calls for greater flexibility with respect to commencing the substantive work of the Conference without further delay;",
    "3": "Calls upon the Conference on Disarmament to further intensify consultations and to explore possibilities for overcoming its ongoing deadlock by adopting and implementing a balanced and comprehensive programme of work at the earliest possible date during its 2024 session, bearing in mind the decision on the programme of work adopted by the Conference on 29 May 2009, 3 as well as other relevant present, past and future proposals;",
    "4": "Encourages the current President and the incoming President of the Conference on Disarmament to conduct consultations on the activities of the Conference in fulfilling its mandate during the intersessional period and, if possible, to make recommendations, taking into account all relevant proposals, past, present and future, including those submitted as documents of the Conference, views presented and discussions held, and to endeavour to keep the membership of the Conference informed, as appropriate, of their consultations;",
    "5": "Requests the current President and successive Presidents of the Conference on Disarmament to cooperate with the States members of the Conference in the effort to guide the Conference to the early commencement of its substantive work, including negotiations, at its 2024 session;",
    "6": "Recognizes the importance of continuing consultations in 2024 on the question of the expansion of the membership of the Conference on Disarmament;",
    "7": "Calls upon the Conference on Disarmament to undertake efforts to ensure inclusivity and multilateralism in its work, including through participation at its sessions, in accordance with its rules of procedure;4",
    "8": "Requests the Secretary-General to continue to ensure and to strengthen, if needed, the provision to the Conference on Disarmament of all necessary administrative, substantive and conference support services;",
    "9": "Requests the Conference on Disarmament to submit to the General Assembly at its seventy-ninth session a report on its work;",
    "10": "Decides to include in the provisional agenda of its seventy-ninth session, under the item entitled \u201cReview of the implementation of the recommendations and decisions adopted by the General Assembly at its tenth special session\u201d, the sub-item entitled \u201cReport of the Conference on Disarmament\u201d."
  },
  "agenda_items": [
    "Item 101"
  ],
  "symbol_references": []
}