{
  "symbol": "A/RES/79/207",
  "filename": "A_RES_79_207.pdf",
  "title": "79/207. Implementation of the United Nations Convention to Combat Desertification in Those Countries Experiencing Serious Drought and/or Desertification, Particularly in Africa",
  "text": "United Nations \nA/RES/79/207\n \n \nGeneral Assembly \nDistr.: General \n23 December 2024 \n \n24-24353 (E)     \n*2424353* \n \n \nSeventy-ninth session \nAgenda item 18 (e) \nSustainable development: implementation of the \nUnited Nations Convention to Combat Desertification \nin Those Countries Experiencing Serious Drought \nand/or Desertification, Particularly in Africa\n \n \n \n \n \n Resolution adopted by the General Assembly \non 19 December 2024 \n \n \n \n \n[on the report of the Second Committee (A/79/437/Add.5, para. 6)] \n \n \n 79/207. Implementation of the United Nations Convention to Combat \nDesertification in Those Countries Experiencing Serious Drought \nand/or Desertification, Particularly in Africa \n \n \n \nThe General Assembly, \n \nRecalling its resolution 78/154 of 19 December 2023, as well as other \nresolutions relating to the implementation of the United Nations Convention to \nCombat Desertification in Those Countries Experiencing Serious Drought and/or \nDesertification, Particularly in Africa,1  \n \nReaffirming its resolution 70/1 of 25 September 2015, entitled \u201cTransforming \nour world: the 2030 Agenda for Sustainable Development\u201d, in which it adopted a \ncomprehensive, far-reaching and people-centred set of universal and transformative \nSustainable Development Goals and targets, its commitment to working tirelessly for \nthe full implementation of the Agenda by 2030, its recognition that eradicating \npoverty in all its forms and dimensions, including extreme poverty, is the greatest \nglobal challenge and an indispensable requirement for sustainable development, and \nits commitment to achieving sustainable development in its three dimensions \u2013 \neconomic, social and environmental \u2013 in a balanced and integrated manner and to \nbuilding upon the achievements of the Millennium Development Goals and seeking \nto address their unfinished business, \n \nRecalling that, in the 2030 Agenda, the international community committed to \ncombating desertification, restoring degraded land and soil, including land affected \n__________________ \n \n1  United Nations, Treaty Series, vol. 1954, No. 33480. \n\nA/RES/79/207 \nImplementation of the United Nations Convention to Combat \nDesertification in Those Countries Experiencing Serious Drought \nand/or Desertification, Particularly in Africa\n \n24-24353\n2/9 \n \nby desertification, drought and floods, and striving to achieve a land degradation-\nneutral world by 2030,  \n \nReaffirming its resolution 69/313 of 27 July 2015 on the Addis Ababa Action \nAgenda of the Third International Conference on Financing for Development, which \nis an integral part of the 2030 Agenda for Sustainable Development, supports and \ncomplements it, helps to contextualize its means of implementation targets with \nconcrete policies and actions, and reaffirms the strong political commitment to \naddress the challenge of financing and creating an enabling environment at all levels \nfor sustainable development in the spirit of global partnership and solidarity,  \n \nRecognizing that Sustainable Development Goal targets 15.3, 6.1 and 6.6 and \nthe setting of voluntary land degradation neutrality targets have created strong \nmomentum for accelerating the implementation of the Convention, \n \nNoting that restoring degraded lands generates benefits for agriculture \nproduction and food security, with benefits for poor populations, brings more food to \nthe hungry and to the markets, restores ecosystems and biodiversity and enhances \nresilience to climate change impacts, including by sequestering huge quantities of \ncarbon from the atmosphere and bringing carbon into the soil,  \n \nRecalling that, in its decision 3/COP.15,2 the Conference of the Parties to the \nConvention invited parties that have committed to voluntary land degradation \nneutrality targets to implement measures to accelerate the achievement thereof, by, \ninter alia, creating an enabling environment for the achievement of land degradation \nneutrality, including the responsible governance of land and tenure security, the \nengagement of stakeholders and the improved access of smallholders to advisory and \nfinancial services, in particular for women and those in vulnerable situations, \ntherefore, taking note with appreciation of the pledge made by 131 countries to establish \nnational voluntary targets and relevant measures to achieve land degradation neutrality \nby 2030, while 112 parties have successfully completed this voluntary process and 106 \nhave already published their national reports on the website of the Convention,  \n \nNoting that combating desertification, land degradation and drought, including \nthrough conservation, protection, sustainable management and restoration of natural \nresources, can contribute to sustainable development for all and to easing displacement \nflows,  \n \nBearing in mind its resolution 73/284 of 1 March 2019, in which it declared the \ndecade 2021\u20132030 as the United Nations Decade on Ecosystem Restoration, \n \nRecalling the adoption of the 2018\u20132030 Strategic Framework of the \nConvention,3 including a new strategic objective on drought,  \n \nTaking note of resolution 6/14 of 1 March 2024 of the United Nations \nEnvironment Assembly, entitled \u201cStrengthening international efforts to combat \ndesertification and land degradation, restore degraded land, promote land conservation \nand sustainable land management, contribute to land degradation neutrality, and \nenhance drought resilience\u201d,4 \n \nReaffirming the Paris Agreement and its early entry into force, encouraging all \nits parties to fully implement the Agreement, and parties to the United Nations \nFramework Convention on Climate Change5 that have not yet done so to deposit their \n__________________ \n \n2 See ICCD/COP(15)/23/Add.1. \n \n3 ICCD/COP(13)/21/Add.1, decision 7/COP.13, annex, and ICCD/COP(15)/23/Add.1, decision \n7/COP.15. \n \n4 UNEP/EA.6/Res.14. \n \n5 United Nations, Treaty Series, vol. 1771, No. 30822. \n\nImplementation of the United Nations Convention to Combat \nDesertification in Those Countries Experiencing Serious Drought \nand/or Desertification, Particularly in Africa \nA/RES/79/207\n \n3/9\n24-24353 \n \ninstruments of ratification, acceptance, approval or accession, where appropriate, as \nsoon as possible,  \n \nRecognizing that climate change, unsustainable agricultural and forestry practices, \nand land degradation, inter alia, are major and growing drivers of biodiversity loss \nand ecosystem degradation, and that conservation, restoration and the sustainable use \nof biodiversity, and ecosystem functions and services, sustainable land management \napproaches and technologies, including through nature-based solutions, ecosystem-\nbased approaches and other management and conservation approaches, in line with \nresolution 5/5 of 2 March 2022 of the United Nations Environment Assembly, 6 \ncontribute significantly to land degradation neutrality, climate change adaptation and \nmitigation, disaster risk reduction and food security and nutrition,  \n \nNoting with concern the findings of the second edition of Global Land Outlook \nand the findings of the Intergovernmental Science-Policy Platform on Biodiversity \nand Ecosystem Services land degradation and restoration assessment and its Global \nAssessment Report on Biodiversity and Ecosystem Services, the findings of the \nIntergovernmental Panel on Climate Change contained in its special report on climate \nchange, desertification, land degradation, sustainable land management, food \nsecurity, and greenhouse gas fluxes in terrestrial ecosystems, as well as the findings \ncontained in the special report of the Panel entitled Global Warming of 1.5\u00b0C,  \n \nRecognizing the interdependencies between biodiversity loss, pollution, water \nscarcity, climate change, desertification, land degradation and drought and their \ninterlinkages with food security and human well-being, including health,  \n \nDeeply concerned about the continuous trend in land degradation and the fact \nthat the impacts of desertification, land degradation and drought are felt most strongly \nby people in vulnerable situations,  \n \nWelcoming the convening of the United Nations Conference on the Midterm \nComprehensive Review of the Implementation of the Objectives of the International \nDecade for Action, \u201cWater for Sustainable Development\u201d, 2018\u20132028, in New York \nfrom 22 to 24 March 2023, and looking forward to the 2026 United Nations Water \nConference to Accelerate the Implementation of Sustainable Development Goal 6: \nEnsure availability and sustainable management of water and sanitation for all, to be \nco-hosted by Senegal and the United Arab Emirates, and the 2028 United Nations \nConference on the Final Comprehensive Review of the Implementation of the \nObjectives of the International Decade for Action, \u201cWater for Sustainable \nDevelopment\u201d, 2018\u20132028, to be hosted by Tajikistan,  \n \nNoting with great concern the severe negative impact on human health, safety \nand well-being caused by the coronavirus disease (COVID-19) pandemic, as well as \nthe severe disruption to societies and economies and the devastating impact on lives \nand livelihoods, and that the poorest and most vulnerable are the hardest hit by the \npandemic, reaffirming the ambition to get back on track to achieve the Sustainable \nDevelopment Goals by designing and implementing sustainable and inclusive \nrecovery strategies to accelerate progress towards the full implementation of the 2030 \nAgenda for Sustainable Development and to help to reduce the risk of and build \nresilience to future shocks, crises and pandemics, including by strengthening health \nsystems and achieving universal health coverage, and recognizing that equitable and \ntimely access for all to safe, quality, effective and affordable COVID-19 vaccines, \ntherapeutics and diagnostics are an essential part of a global response based on unity, \nsolidarity, renewed multilateral cooperation and the principle of leaving no one \nbehind,  \n__________________ \n \n6 UNEP/EA.5/Res.5. \n\nA/RES/79/207 \nImplementation of the United Nations Convention to Combat \nDesertification in Those Countries Experiencing Serious Drought \nand/or Desertification, Particularly in Africa\n \n24-24353\n4/9 \n \n \nRecognizing that combating desertification, land degradation and drought is \nimportant for sustainable, inclusive and climate-resilient recovery from the \nCOVID-19 crisis, that it is important to integrate land conservation, protection and \nrestoration, sustainable land management, degraded soil and terrestrial ecosystems \nrestoration, combating desertification and the aim of land degradation neutrality into \nthe global agenda for sustainable development, and that careful targeting of the \nCOVID-19 recovery investments, including land restoration, creates economic \nopportunities that contribute to environmental sustainability and poverty eradication,  \n \nRecalling the United Nations strategic plan for forests 2017\u20132030, 7  and \nacknowledging that all types of forests provide essential ecosystem services, such as \ntimber, food, fuel, fodder, non-wood products and shelter, as well as soil and water \nconservation and clean air, that the sustainable management of forests and trees \noutside forests is vital to the integrated implementation of the 2030 Agenda and that \nforests prevent land degradation and desertification and reduce the risk of floods, soil \nerosion, landslides and avalanches, droughts, sand and dust storms and other disasters, \n \nReiterating its appreciation to the Government of C\u00f4te d\u2019Ivoire for hosting the \nfifteenth session of the Conference of the Parties to the United Nations Convention \nto Combat Desertification in Those Countries Experiencing Serious Drought and/or \nDesertification, Particularly in Africa, held in Abidjan from 9 to 20 May 2022,  \n \nRecalling the decisions of the fifteenth session of the Conference of the Parties \nto the United Nations Convention to Combat Desertification in Those Countries \nExperiencing Serious Drought and/or Desertification, Particularly in Africa, and \nstresses the importance of their effective implementation, and noting the Abidjan Call, \nwhich urged giving the highest priority to the issue of drought prevention, resilience, \nimpact mitigation and accelerating the implementation of existing national \ncommitments, towards achieving land degradation neutrality by 2030 and raising \nambition for investments in large-scale land restoration projects and programmes, \nwhich also help countries and communities to prepare for and mitigate the impacts of \ndrought,  \n \nRecalling also the work and taking note of the report of the new \nIntergovernmental Working Group on Drought during the triennium 2022\u20132024, \ntasked with identifying and evaluating all options, including, inter alia, global policy \ninstruments and regional policy frameworks, and linking, where relevant, to national \nplans, as appropriate, to effectively manage drought under the Convention, including \nsupporting a shift from reactive to proactive drought management,  \n \nReaffirming the importance of government leadership, multi-stakeholder \npartnerships and increasing private engagement for the sustainable management, \nrestoration and rehabilitation of ecosystems, biodiversity and degraded land,  \n \nRecognizing the Global Initiative on Reducing Land Degradation and Enhancing \nConservation of Terrestrial Habitats to prevent, halt and reverse land degradation \nadopted by the leaders of the Group of 20 in Riyadh in 2020, as well as the Riyadh \nLeaders\u2019 Declaration, and noted in the subsequent Group of 20 Leaders\u2019 Declarations, \n \nRecognizing also the launch of the International Drought Resilience Alliance \nwith a view to enhancing drought resilience,  \n \nNoting the Drought Resilience +10 Conference, held in Geneva from \n30 September to 2 October 2024,  \n \nHighlighting the importance of multi-stakeholder participation at the local, \nsubnational, national and regional levels and from all sectors of society, including \n__________________ \n \n7  See resolution 71/285. \n\nImplementation of the United Nations Convention to Combat \nDesertification in Those Countries Experiencing Serious Drought \nand/or Desertification, Particularly in Africa \nA/RES/79/207\n \n5/9\n24-24353 \n \ncivil society organizations, local government and the private sector, as appropriate, in \nthe implementation of the Convention and its 2018\u20132030 Strategic Framework,  \n \nRecognizing the value of knowledge, education, science and new technology to \nsustainable land management, including making use of, inter alia, the Voluntary \nGuidelines for Sustainable Soil Management of the Food and Agriculture \nOrganization of the United Nations, emphasizing the importance of science-based \ndecision-making and that science and technology to combat desertification, land \ndegradation and drought should therefore be further promoted, and acknowledging \nthe work of the Science-Policy Interface of the Convention,  \n \nTaking note with appreciation of the global celebrations of the 2024 World Day \nto Combat Desertification and Drought, under the theme \u201cUnited for land. Our legacy. \nOur future\u201d, on 17 June 2024, marking the thirtieth anniversary of the Convention,  \n \n1. \nTakes note of the report of the Secretary-General on the implementation of \nresolution 78/154 on the United Nations Convention to Combat Desertification in \nThose Countries Experiencing Serious Drought and/or Desertification, Particularly in \nAfrica;8  \n \n2. \nLooks forward to the convening of the sixteenth session of the Conference \nof the Parties to the United Nations Convention to Combat Desertification in Those \nCountries Experiencing Serious Drought and/or Desertification, Particularly in \nAfrica, to be held in Riyadh from 2 to 13 December 2024, under the theme \u201cOur land. \nOur future\u201d, and looks forward to its outcome;  \n \n3. \nWelcomes the convening of the sixteenth meeting of the Conference of the \nParties to the Convention on Biological Diversity, as well as the Meetings of the \nParties to the Protocols to the Convention, held in Cali, Colombia, from 21 October \nto 1 November 2024, under the theme \u201cPeace with nature\u201d, takes note of its adopted \ndecisions, and looks forward to the seventeenth meeting of the Conference of the \nParties and the meetings of the Conference of the Parties serving as the Meetings of \nthe Parties to the Protocols to the Convention, to be held in Yerevan in 2026; \n \n4. \nAlso welcomes the Kunming-Montreal Global Biodiversity Framework, \nand urges its early, inclusive and effective implementation; \n \n5. \nUrges the implementation of the Paris Agreement and the agreed \nintergovernmentally negotiated outcomes and decisions of the subsequent United \nNations climate change conferences;  \n \n6. \nInvites Member States to support efforts to implement the strategic \nobjectives of the United Nations Convention to Combat Desertification in Those \nCountries Experiencing Serious Drought and/or Desertification, Particularly in Africa;  \n \n7. \nWelcomes the voluntary commitment of the parties to the Convention to \naccelerate the restoration of 1 billion hectares of degraded land by 2030 by improving \ndata gathering and monitoring to track progress against the achievement of land \nrestoration commitments and establishing a new partnership model for large-scale \nintegrated landscape investment programmes;  \n \n8. \nStrongly encourages the parties to the Convention to apply and align with \nthe 2018\u20132030 Strategic Framework of the Convention, to consider refining their \nvoluntary land degradation neutrality targets, as appropriate, and mainstream those \ntargets in their national policies, programmes, plans and processes relating to \ndesertification, land degradation and drought, and to implement the Strategic \n__________________ \n \n8 A/79/273, sect. II. \n\nA/RES/79/207 \nImplementation of the United Nations Convention to Combat \nDesertification in Those Countries Experiencing Serious Drought \nand/or Desertification, Particularly in Africa\n \n24-24353\n6/9 \n \nFramework, taking into account the Addis Ababa Action Agenda of the Third \nInternational Conference on Financing for Development; 9  \n \n9. \nWelcomes the work of the Intergovernmental Working Group to oversee \nthe midterm evaluation process related to the 2018\u20132030 Strategic Framework of the \nConvention and to provide recommendations to the parties for their consideration at \nthe sixteenth session of the Conference of the Parties;  \n \n10. Reaffirms that reducing land degradation and achieving land degradation \nneutrality has the potential to act as an accelerator and integrator for achieving the \nSustainable Development Goals, and respond to the overall objectives of the 2030 \nAgenda for Sustainable Development;10  \n \n11. Encourages Member States to pursue considering target 15.3 of the \nSustainable Development Goals as an integrator and accelerator to achieve other \nSustainable Development Goals;  \n \n12. Reiterates the need to combat desertification, reduce land degradation, \nrestore degraded land and soil, including land affected by desertification, drought and \nfloods, and strive to achieve a land degradation-neutral world, recalls with appreciation \nthe voluntary land degradation neutrality target-setting programme consistent with \nthe Convention and the work of the secretariat of the Convention and partners to assist \nparties to the Convention in carrying out voluntary target-setting activities, \nemphasizes the need for capacity-building and opportunities for parties that have yet \nto set land degradation neutrality targets, and in this respect reiterates its invitation to \nparties to the Convention that have not yet subscribed to the programme to do so;  \n \n13. Recognizes that sustainable land management approaches and technologies, \nincluding through nature-based solutions, ecosystem-based approaches and other \nmanagement and conservation approaches, in line with resolution 5/5 of the United \nNations Environment Assembly, constitute promising options to evaluate and \nconsider in connection with sequestering carbon and enhancing the resilience of \npeople and ecosystems affected by desertification, land degradation and drought, as \nwell as the adverse effects of climate change and biodiversity loss;  \n \n14. Also recognizes the importance of applying new and innovative \ntechnologies and enabling policies and approaches, as well as sharing best practices, \nin combating desertification, land degradation and drought, as well as enhancing \ndrought resilience, and requests the Secretary-General to continue to identify, as \nappropriate, those technologies, enabling policies and best practices in his report on \nthe implementation of the present resolution;  \n \n15. Encourages the entities of the United Nations system, when designing and \nimplementing their programmes and projects, to take into account the role of \nachieving land degradation neutrality as a potential accelerator to achieve the \nSustainable Development Goals; \n \n16. Underlines the importance of comprehensive reporting, follow-up and \nreview at the global, national and regional levels, as appropriate, in order to track \nprogress in the implementation of the Convention, and welcomes in this regard the \nconvening of the twenty-first session of the Committee for the Review of the \nImplementation of the Convention in Samarkand, Uzbekistan, from 13 to \n17 November 2023;  \n \n17. Reiterates the invitation to parties to the Convention to take measures to \nensure, as appropriate, that their relevant institutions adopt a proactive approach to \n__________________ \n \n9 Resolution 69/313, annex. \n \n10 Resolution 70/1. \n\nImplementation of the United Nations Convention to Combat \nDesertification in Those Countries Experiencing Serious Drought \nand/or Desertification, Particularly in Africa \nA/RES/79/207\n \n7/9\n24-24353 \n \ndrought management and integrate drought resilience and risk management, \nsustainable livestock and agricultural policies, drought forecasting work, sustainable \nwater management and climate information and climate change impact assessments \ninto relevant policymaking processes and initiatives;  \n \n18. Reiterates its invitation to the parties to the Convention to provide the \nExecutive Secretary of the Convention with full support in the fulfilment of his \nmandate and in promoting the implementation of the Convention;  \n \n19. Stresses the urgent need to enhance adaptive capacity, strengthen \nresilience and reduce vulnerability to climate change, extreme weather events, and \nsand and dust storms, and in this regard urges Member States to continue to engage \nin adaptation planning processes and to enhance cooperation in disaster risk reduction;  \n \n20. Recognizes the contributions of Indigenous Peoples and of local \ncommunities, including their knowledge, to combating desertification, land degradation \nand drought;  \n \n21. Invites the United Nations Coalition on Combating Sand and Dust Storms, \nwhich was formed at the twenty-fourth meeting of the senior officials of the \nEnvironment Management Group, in September 2018, and other relevant United \nNations entities to continue their collaboration to assist affected country parties in \ndeveloping and implementing national and regional policies on sand and dust storms;  \n \n22. Recalls its resolution 78/314 of 10 July 2024, in which it proclaimed 2025\u2013\n2034 the United Nations Decade on Combating Sand and Dust Storms, within existing \nstructures and available resources, with the aim of enhancing international and \nregional cooperation and supporting and scaling up efforts to prevent, halt and \nmitigate the negative effects of sand and dust storms, especially on affected countries;  \n \n23. Recognizes that gender equality and the empowerment of all women and \ngirls remain a crucial contribution to the effective implementation of the Convention, \nincluding its 2018\u20132030 Strategic Framework, and to the achievement of the Goals \nof the 2030 Agenda, stresses the importance of parties to the Convention and partners \nstriving to ensure the equal participation of women and men in planning, decision-\nmaking and implementation at all levels and further achieving gender equality and \nthe empowerment of all women and girls, as well as women\u2019s full, equal, effective \nand meaningful participation in desertification, land degradation and drought-related \npolicies and activities, and also stresses the importance of the effective \nimplementation of the four priority thematic areas of the Gender Action Plan adopted \nby the parties to the Convention;  \n \n24. Reiterates the invitation to the secretariat and the Global Mechanism of \nthe Convention to continue to collaborate and build partnerships with the secretariats \nof the other Rio conventions, the United Nations Entity for Gender Equality and the \nEmpowerment of Women (UN-Women), other United Nations entities, international \norganizations and other relevant organizations to explore further ways of \nstrengthening awareness-raising, improving the Gender Action Plan and developing \nfurther tools and guidelines for the use of parties in the thematic areas of the Gender \nAction Plan and the gender-responsive implementation of the Convention;  \n \n25. Recalls the invitation to parties to the Convention to legally recognize \nrights to equal use and ownership of land for women and the enhancement of women\u2019s \nequal access to land and land tenure security, as well as the promotion of gender-\nsensitive measures to combat desertification, land degradation and drought and \nachieve land degradation neutrality, taking into account the national context, and in \nthis context notes the Abidjan Declaration on Achieving Gender Equality for \nSuccessful Land Restoration, which promotes all measures necessary to identify and \n\nA/RES/79/207 \nImplementation of the United Nations Convention to Combat \nDesertification in Those Countries Experiencing Serious Drought \nand/or Desertification, Particularly in Africa\n \n24-24353\n8/9 \n \neliminate all forms of discrimination against women, with particular attention to the \nrights of older women, widows, women with disabilities and young women; \n \n26. Encourages parties to the Convention to follow the principles of \nimplementation of the Voluntary Guidelines on the Responsible Governance of \nTenure of Land, Fisheries and Forests in the Context of National Food Security 11 in \nthe implementation of activities to combat desertification, land degradation and \ndrought;  \n \n27. Encourages the public and private sectors to continue to invest in \ndeveloping, adapting and scaling up the application of technologies, enabling \npolicies, methods and tools to combat desertification, land degradation and drought \nin different regions, and to boost knowledge exchange, including of traditional \nknowledge with the consent of the knowledge holders, capacity-building and sharing \nof technologies on mutually agreed terms;  \n \n28. Encourages parties to the Convention to continue to promote the \nprevention of desertification, land degradation and drought with an integrated \nlandscape approach by sustainably managing land and water resources, avoiding \npractices that degrade land and rehabilitating and restoring already degraded land;  \n \n29. Encourages developed countries party to the Convention and other \nrelevant stakeholders to actively support the efforts of developing countries party to \nthe Convention in promoting sustainable land management practices and in seeking \nto achieve a land degradation-neutral world by providing substantial financial resources \nfrom all sources facilitated access to appropriate technology on mutually agreed terms \nand other forms of support, including through capacity-building measures;  \n \n30. Recognizes the benefits gained from cooperation through the sharing of \nclimate and weather information, forecasting and early warning systems related to \ndesertification, land degradation and drought, while also taking account of sand and \ndust storms, at the global, regional and subregional levels, and in this regard likewise \nrecognizes the need for further cooperation between parties to the Convention and \nrelevant organizations in the sharing of related information, forecasting and early \nwarning systems;  \n \n31. Calls upon the United Nations entities to mainstream drought resilience in \ntheir programmes when supporting countries prone to droughts or already affected, \nwith an emphasis on enhancing preparation and resilience, noting the need for drought \nmanagement through, inter alia, impactful policies, early warning systems, \npreparedness and mitigation, land restoration, sustainable agricultural and livestock \npolicies and related actions to advance the neutrality of land degradation, in countries \naffected by drought and/or desertification;  \n \n32. Encourages all relevant entities of the United Nations system, within their \nrespective mandates, to harness opportunities for leveraging synergies among the \nConvention on Biological Diversity, 12 the United Nations Convention to Combat \nDesertification in Those Countries Experiencing Serious Drought and/or \nDesertification, Particularly in Africa, and the United Nations Framework Convention \non Climate Change and other relevant multilateral environmental agreements, as well \nas the 2030 Agenda, and in this respect welcomes the ongoing efforts to strengthen \nsynergies among the secretariats of the aforementioned conventions;  \n \n33. Takes note of the United Nations Decade for Deserts and the Fight against \nDesertification and the United Nations Decade on Ecosystem Restoration, and calls \n__________________ \n \n11 Food and Agriculture Organization of the United Nations, document CL 144/9 (C 2013/20), \nappendix D. \n \n12 United Nations, Treaty Series, vol. 1760, No. 30619. \n\nImplementation of the United Nations Convention to Combat \nDesertification in Those Countries Experiencing Serious Drought \nand/or Desertification, Particularly in Africa \nA/RES/79/207\n \n9/9\n24-24353 \n \nfor measures to explore and promote consumption and production patterns that \nconserve and protect land;  \n \n34. Welcomes the convening of the twenty-ninth session of the Conference of \nthe Parties to the United Nations Framework Convention on Climate Change, held in \nBaku from 11 to 22 November 2024;  \n \n35. Notes with appreciation the financial contributions that have been made \nby Member States and other donors towards the Land Degradation Neutrality Fund, \nand invites Member States and other donors to make further contributions to the Land \nDegradation Neutrality Fund and the drought initiative of the United Nations \nConvention to Combat Desertification in Those Countries Experiencing Serious \nDrought and/or Desertification, Particularly in Africa; \n \n36. Decides to include, in the United Nations calendar of conferences and \nmeetings for the year 2024 and subsequent years, the sessions of the Conference of \nthe Parties to the Convention and each of its subsidiary bodies, and requests the \nSecretary-General to continue to make provisions for those sessions in the proposed \nprogramme budgets;  \n \n37. Acknowledges the commitment of the parties to the Convention to boost \ndrought resilience by identifying the expansion of arid, semi-arid, dry subhumid areas \nand drylands, improving national policies and early warning systems linked to early \naction, learning and sharing knowledge, building partnerships and coordinating \naction, and mobilizing drought finance to support a shift from reactive to proactive \ndrought management, and recognizes the ongoing efforts of the Coalition for Disaster-\nResilient Infrastructure, the Risk-Informed Early Action Partnership, the Early \nWarnings for All initiative and the Climate Risk and Early Warning Systems \n(CREWS) initiative;  \n \n38. Also acknowledges the decision of the Conference of the Parties at its \nfifteenth session with respect to promoting decent land-based jobs for youth and land-\nbased youth entrepreneurship and strengthening youth participation in the processes \nrelating to the Convention;  \n \n39. Reaffirms the continuation, for a further five-year period, of the current \ninstitutional linkage and related administrative arrangements with the United Nations \nSecretariat, to be reviewed by both the General Assembly and the Conference of the \nParties no later than 31 December 2026;  \n \n40. Requests the Secretary-General to submit to the General Assembly at its \neightieth session a report on the implementation of the present resolution, and decides \nto include in the provisional agenda of its eightieth session, under the item entitled \n\u201cSustainable development\u201d, the sub-item entitled \u201cImplementation of the United \nNations Convention to Combat Desertification in Those Countries Experiencing \nSerious Drought and/or Desertification, Particularly in Africa\u201d. \n \n54th plenary meeting \n19 December 2024 \n \n",
  "paragraphs": {
    "1": "Takes note of the report of the Secretary-General on the implementation of resolution 78/154 on the United Nations Convention to Combat Desertification in Those Countries Experiencing Serious Drought and/or Desertification, Particularly in Africa;8",
    "2": "Looks forward to the convening of the sixteenth session of the Conference of the Parties to the United Nations Convention to Combat Desertification in Those Countries Experiencing Serious Drought and/or Desertification, Particularly in Africa, to be held in Riyadh from 2 to 13 December 2024, under the theme \u201cOur land. Our future\u201d, and looks forward to its outcome;",
    "3": "Welcomes the convening of the sixteenth meeting of the Conference of the Parties to the Convention on Biological Diversity, as well as the Meetings of the Parties to the Protocols to the Convention, held in Cali, Colombia, from 21 October to 1 November 2024, under the theme \u201cPeace with nature\u201d, takes note of its adopted decisions, and looks forward to the seventeenth meeting of the Conference of the Parties and the meetings of the Conference of the Parties serving as the Meetings of the Parties to the Protocols to the Convention, to be held in Yerevan in 2026;",
    "4": "Also welcomes the Kunming-Montreal Global Biodiversity Framework, and urges its early, inclusive and effective implementation;",
    "5": "Urges the implementation of the Paris Agreement and the agreed intergovernmentally negotiated outcomes and decisions of the subsequent United Nations climate change conferences;",
    "6": "Invites Member States to support efforts to implement the strategic objectives of the United Nations Convention to Combat Desertification in Those Countries Experiencing Serious Drought and/or Desertification, Particularly in Africa;",
    "7": "Welcomes the voluntary commitment of the parties to the Convention to accelerate the restoration of 1 billion hectares of degraded land by 2030 by improving data gathering and monitoring to track progress against the achievement of land restoration commitments and establishing a new partnership model for large-scale integrated landscape investment programmes;",
    "8": "Strongly encourages the parties to the Convention to apply and align with the 2018\u20132030 Strategic Framework of the Convention, to consider refining their voluntary land degradation neutrality targets, as appropriate, and mainstream those targets in their national policies, programmes, plans and processes relating to desertification, land degradation and drought, and to implement the Strategic Framework, taking into account the Addis Ababa Action Agenda of the Third International Conference on Financing for Development; 9",
    "9": "Welcomes the work of the Intergovernmental Working Group to oversee the midterm evaluation process related to the 2018\u20132030 Strategic Framework of the Convention and to provide recommendations to the parties for their consideration at the sixteenth session of the Conference of the Parties;",
    "10": "Reaffirms that reducing land degradation and achieving land degradation neutrality has the potential to act as an accelerator and integrator for achieving the Sustainable Development Goals, and respond to the overall objectives of the 2030 Agenda for Sustainable Development;10",
    "11": "Encourages Member States to pursue considering target 15.3 of the Sustainable Development Goals as an integrator and accelerator to achieve other Sustainable Development Goals;",
    "12": "Reiterates the need to combat desertification, reduce land degradation, restore degraded land and soil, including land affected by desertification, drought and floods, and strive to achieve a land degradation-neutral world, recalls with appreciation the voluntary land degradation neutrality target-setting programme consistent with the Convention and the work of the secretariat of the Convention and partners to assist parties to the Convention in carrying out voluntary target-setting activities, emphasizes the need for capacity-building and opportunities for parties that have yet to set land degradation neutrality targets, and in this respect reiterates its invitation to parties to the Convention that have not yet subscribed to the programme to do so;",
    "13": "Recognizes that sustainable land management approaches and technologies, including through nature-based solutions, ecosystem-based approaches and other management and conservation approaches, in line with resolution 5/5 of the United Nations Environment Assembly, constitute promising options to evaluate and consider in connection with sequestering carbon and enhancing the resilience of people and ecosystems affected by desertification, land degradation and drought, as well as the adverse effects of climate change and biodiversity loss;",
    "14": "Also recognizes the importance of applying new and innovative technologies and enabling policies and approaches, as well as sharing best practices, in combating desertification, land degradation and drought, as well as enhancing drought resilience, and requests the Secretary-General to continue to identify, as appropriate, those technologies, enabling policies and best practices in his report on the implementation of the present resolution;",
    "15": "Encourages the entities of the United Nations system, when designing and implementing their programmes and projects, to take into account the role of achieving land degradation neutrality as a potential accelerator to achieve the Sustainable Development Goals;",
    "16": "Underlines the importance of comprehensive reporting, follow-up and review at the global, national and regional levels, as appropriate, in order to track progress in the implementation of the Convention, and welcomes in this regard the convening of the twenty-first session of the Committee for the Review of the Implementation of the Convention in Samarkand, Uzbekistan, from 13 to 17 November 2023;",
    "17": "Reiterates the invitation to parties to the Convention to take measures to ensure, as appropriate, that their relevant institutions adopt a proactive approach to drought management and integrate drought resilience and risk management, sustainable livestock and agricultural policies, drought forecasting work, sustainable water management and climate information and climate change impact assessments into relevant policymaking processes and initiatives;",
    "18": "Reiterates its invitation to the parties to the Convention to provide the Executive Secretary of the Convention with full support in the fulfilment of his mandate and in promoting the implementation of the Convention;",
    "19": "Stresses the urgent need to enhance adaptive capacity, strengthen resilience and reduce vulnerability to climate change, extreme weather events, and sand and dust storms, and in this regard urges Member States to continue to engage in adaptation planning processes and to enhance cooperation in disaster risk reduction;",
    "20": "Recognizes the contributions of Indigenous Peoples and of local communities, including their knowledge, to combating desertification, land degradation and drought;",
    "21": "Invites the United Nations Coalition on Combating Sand and Dust Storms, which was formed at the twenty-fourth meeting of the senior officials of the Environment Management Group, in September 2018, and other relevant United Nations entities to continue their collaboration to assist affected country parties in developing and implementing national and regional policies on sand and dust storms;",
    "22": "Recalls its resolution 78/314 of 10 July 2024, in which it proclaimed 2025\u2013 2034 the United Nations Decade on Combating Sand and Dust Storms, within existing structures and available resources, with the aim of enhancing international and regional cooperation and supporting and scaling up efforts to prevent, halt and mitigate the negative effects of sand and dust storms, especially on affected countries;",
    "23": "Recognizes that gender equality and the empowerment of all women and girls remain a crucial contribution to the effective implementation of the Convention, including its 2018\u20132030 Strategic Framework, and to the achievement of the Goals of the 2030 Agenda, stresses the importance of parties to the Convention and partners striving to ensure the equal participation of women and men in planning, decision- making and implementation at all levels and further achieving gender equality and the empowerment of all women and girls, as well as women\u2019s full, equal, effective and meaningful participation in desertification, land degradation and drought-related policies and activities, and also stresses the importance of the effective implementation of the four priority thematic areas of the Gender Action Plan adopted by the parties to the Convention;",
    "24": "Reiterates the invitation to the secretariat and the Global Mechanism of the Convention to continue to collaborate and build partnerships with the secretariats of the other Rio conventions, the United Nations Entity for Gender Equality and the Empowerment of Women (UN-Women), other United Nations entities, international organizations and other relevant organizations to explore further ways of strengthening awareness-raising, improving the Gender Action Plan and developing further tools and guidelines for the use of parties in the thematic areas of the Gender Action Plan and the gender-responsive implementation of the Convention;",
    "25": " eliminate all forms of discrimination against women, with particular attention to the rights of older women, widows, women with disabilities and young women;",
    "26": "Encourages parties to the Convention to follow the principles of implementation of the Voluntary Guidelines on the Responsible Governance of Tenure of Land, Fisheries and Forests in the Context of National Food Security 11 in the implementation of activities to combat desertification, land degradation and drought;",
    "27": "Encourages the public and private sectors to continue to invest in developing, adapting and scaling up the application of technologies, enabling policies, methods and tools to combat desertification, land degradation and drought in different regions, and to boost knowledge exchange, including of traditional knowledge with the consent of the knowledge holders, capacity-building and sharing of technologies on mutually agreed terms;",
    "28": "Encourages parties to the Convention to continue to promote the prevention of desertification, land degradation and drought with an integrated landscape approach by sustainably managing land and water resources, avoiding practices that degrade land and rehabilitating and restoring already degraded land;",
    "29": "Encourages developed countries party to the Convention and other relevant stakeholders to actively support the efforts of developing countries party to the Convention in promoting sustainable land management practices and in seeking to achieve a land degradation-neutral world by providing substantial financial resources from all sources facilitated access to appropriate technology on mutually agreed terms and other forms of support, including through capacity-building measures;",
    "30": "Recognizes the benefits gained from cooperation through the sharing of climate and weather information, forecasting and early warning systems related to desertification, land degradation and drought, while also taking account of sand and dust storms, at the global, regional and subregional levels, and in this regard likewise recognizes the need for further cooperation between parties to the Convention and relevant organizations in the sharing of related information, forecasting and early warning systems;",
    "31": "Calls upon the United Nations entities to mainstream drought resilience in their programmes when supporting countries prone to droughts or already affected, with an emphasis on enhancing preparation and resilience, noting the need for drought management through, inter alia, impactful policies, early warning systems, preparedness and mitigation, land restoration, sustainable agricultural and livestock policies and related actions to advance the neutrality of land degradation, in countries affected by drought and/or desertification;",
    "32": "Encourages all relevant entities of the United Nations system, within their respective mandates, to harness opportunities for leveraging synergies among the Convention on Biological Diversity, 12 the United Nations Convention to Combat Desertification in Those Countries Experiencing Serious Drought and/or Desertification, Particularly in Africa, and the United Nations Framework Convention on Climate Change and other relevant multilateral environmental agreements, as well as the 2030 Agenda, and in this respect welcomes the ongoing efforts to strengthen synergies among the secretariats of the aforementioned conventions;",
    "33": "Takes note of the United Nations Decade for Deserts and the Fight against Desertification and the United Nations Decade on Ecosystem Restoration, and calls for measures to explore and promote consumption and production patterns that conserve and protect land;",
    "34": "Welcomes the convening of the twenty-ninth session of the Conference of the Parties to the United Nations Framework Convention on Climate Change, held in Baku from 11 to 22 November 2024;",
    "35": "Notes with appreciation the financial contributions that have been made by Member States and other donors towards the Land Degradation Neutrality Fund, and invites Member States and other donors to make further contributions to the Land Degradation Neutrality Fund and the drought initiative of the United Nations Convention to Combat Desertification in Those Countries Experiencing Serious Drought and/or Desertification, Particularly in Africa;",
    "36": "Decides to include, in the United Nations calendar of conferences and meetings for the year 2024 and subsequent years, the sessions of the Conference of the Parties to the Convention and each of its subsidiary bodies, and requests the Secretary-General to continue to make provisions for those sessions in the proposed programme budgets;",
    "37": "Acknowledges the commitment of the parties to the Convention to boost drought resilience by identifying the expansion of arid, semi-arid, dry subhumid areas and drylands, improving national policies and early warning systems linked to early action, learning and sharing knowledge, building partnerships and coordinating action, and mobilizing drought finance to support a shift from reactive to proactive drought management, and recognizes the ongoing efforts of the Coalition for Disaster- Resilient Infrastructure, the Risk-Informed Early Action Partnership, the Early Warnings for All initiative and the Climate Risk and Early Warning Systems (CREWS) initiative;",
    "38": "Also acknowledges the decision of the Conference of the Parties at its fifteenth session with respect to promoting decent land-based jobs for youth and land- based youth entrepreneurship and strengthening youth participation in the processes relating to the Convention;",
    "39": "Reaffirms the continuation, for a further five-year period, of the current institutional linkage and related administrative arrangements with the United Nations Secretariat, to be reviewed by both the General Assembly and the Conference of the Parties no later than 31 December 2026;",
    "40": "Requests the Secretary-General to submit to the General Assembly at its eightieth session a report on the implementation of the present resolution, and decides to include in the provisional agenda of its eightieth session, under the item entitled \u201cSustainable development\u201d, the sub-item entitled \u201cImplementation of the United Nations Convention to Combat Desertification in Those Countries Experiencing Serious Drought and/or Desertification, Particularly in Africa\u201d."
  },
  "agenda_items": [
    "Item 18"
  ],
  "symbol_references": []
}