{
  "symbol": "A/RES/80/126",
  "filename": "A_RES_80_126.pdf",
  "title": "80/126. Promotion of international cooperation to combat illicit financial flows and strengthen good practices on assets return to foster sustainable development",
  "text": "United Nations \nA/RES/80/126 \n \nGeneral Assembly \nDistr.: General \n18 December 2025 \n25-20739 (E) \n*2520739* \n \n \nEightieth session \nAgenda item 16 (f) \nMacroeconomic policy questions: promotion of \ninternational cooperation to combat illicit financial flows \nand strengthen good practices on assets return to foster \nsustainable development \n \n \n \n \n Resolution adopted by the General Assembly \non 15 December 2025 \n \n \n[on the report of the Second Committee (A/80/555, para. 7)] \n \n \n 80/126. Promotion of international cooperation to combat illicit financial \nflows and strengthen good practices on assets return to foster \nsustainable development \n \n \n \nThe General Assembly, \n \nGuided by the purposes and principles enshrined in the Charter of the United \nNations,  \n \nReaffirming its resolution 70/1 of 25 September 2015, entitled \u201cTransforming \nour world: the 2030 Agenda for Sustainable Development\u201d, in which it adopted a \ncomprehensive, far-reaching and people-centred set of universal and transformative \nSustainable Development Goals and targets, its commitment to working tirelessly for \nthe full implementation of the Agenda by 2030, its recognition that eradicating \npoverty in all its forms and dimensions, including extreme poverty, is the greatest \nglobal challenge and an indispensable requirement for sustainable development, its \ncommitment to achieving sustainable development in its three dimensions \u2013 \neconomic, social and environmental \u2013 in a balanced and integrated manner, and to \nbuilding upon the achievements of the Millennium Development Goals and seeking \nto address their unfinished business,  \n \nReaffirming also its resolution 69/313 of 27 July 2015 on the Addis Ababa \nAction Agenda of the Third International Conference on Financing for Development, \nwhich is an integral part of the 2030 Agenda for Sustainable Development, supports \nand complements it, helps to contextualize its means of implementation targets with \nconcrete policies and actions, and reaffirms the strong political commitment to \naddress the challenge of financing and creating an enabling environment at all levels \nfor sustainable development in the spirit of global partnership and solidarity,  \n\nA/RES/80/126 \nPromotion of international cooperation to combat \nillicit financial flows and strengthen good practices \non assets return to foster sustainable development\n \n25-20739\n2/12 \n \n \nWelcoming the convening of the Fourth International Conference on Financing \nfor Development from 30 June to 3 July 2025 in Sevilla, Spain, and reaffirming its \noutcome document, the Sevilla Commitment, endorsed by the General Assembly in \nits resolution 79/323 of 25 August 2025, which sets forth a renewed global framework \nfor financing for development, building on the 2015 Addis Ababa Action Agenda, 1 to \nclose with urgency the estimated annual 4 trillion United States dollar financing gap, 2 \nand catalyse sustainable development investments at scale in developing countries \nand continue the reform of the international financial architecture through continued \nand strong commitment to multilateralism, international cooperation, and global \nsolidarity, \n \nReaffirming the United Nations Convention against Corruption,3 which is the \nmost comprehensive and universal instrument on corruption, and recognizing the need \nfor the full and effective implementation by States Parties of their obligations under \nthe Convention, to continue to promote its ratification or accession thereto, and its \nfull support for the Mechanism for the Review of Implementation of the Convention,  \n \nRecalling its resolution S-32/1 of 2 June 2021 containing the political \ndeclaration entitled \u201cOur common commitment to effectively addressing challenges \nand implementing measures to prevent and combat corruption and strengthen \ninternational cooperation\u201d, and recalling also the resolutions and decisions adopted \nby the Conference of the States Parties to the United Nations Convention against \nCorruption at its tenth session, held in Atlanta, United States of America, from 11 to \n15 December 2023,4 \n \nReaffirming the United Nations Convention against Transnational Organized \nCrime,5 \n \nRecalling its resolutions 65/169 of 20 December 2010, 71/213 of 21 December \n2016, 72/207 of 20 December 2017, 73/222 of 20 December 2018, 74/206 of \n19 December 2019, 75/206 of 21 December 2020 and 76/196 of 17 December 2021, \n77/154 of 14 December 2022, 78/140 of 19 December 2023 and 79/234 of \n24 December 2024,  \n \nRecalling also its resolutions 71/208 of 19 December 2016, 72/196 of \n19 December 2017, 73/186 of 17 December 2018, 74/177 of 18 December 2019, \n74/276 of 1 June 2020, 75/194 of 16 December 2020, 77/235 of 15 December 2022 \nand 79/190 of 17 December 2024,  \n \nRecalling further the 2024 report of the Inter-Agency Task Force on Financing \nfor Development 6 and its policy recommendations for combating illicit financial \nflows,  \n \nRecognizing that making progress on reducing illicit financial flows as \nfacilitated through strengthened international tax cooperation could contribute to \ndomestic resource mobilization and the achievement of other goals and targets in the \n2030 Agenda,  \n \nRecalling the report of the High-level Panel on Illicit Financial Flows from \nAfrica and its relevant contributions in increasing knowledge of the sources of illicit \n_______________ \n \n1 General Assembly resolution 69/313, annex. \n \n2 Financing for Sustainable Development Report 2024 (United Nations publication, 2024), figure I.1.  \n \n3 United Nations, Treaty Series, vol. 2349, No. 42146. \n \n4 CAC/COSP/2023/11, sect. I.  \n \n5 United Nations, Treaty Series, vol. 2225, No. 39574. \n \n6 Financing for Sustainable Development Report 2024 (United Nations publication, 2024). \n\nPromotion of international cooperation to combat \nillicit financial flows and strengthen good practices \non assets return to foster sustainable development \nA/RES/80/126\n \n3/12\n25-20739 \n \nfinancial flows, and reiterating its invitation to other regions to carry out similar \nexercises,  \n \nRecalling also the high-level meeting on international cooperation to combat \nillicit financial flows and strengthen good practices on assets return, convened by the \nPresident of the General Assembly at Headquarters on 16 May 2019, and taking note \nof the Chair\u2019s summary,  \n \nRecalling further the focus on combating illicit financial flows at the High-level \nDialogue on Financing for Development, held on 26 September 2019, as well as the \nHigh-level Dialogue on Financing for Development, held on 20 September 2023,  \n \nWelcoming the convening of the Summit of the Future on 22\u201323 September 2024 \nat the United Nations Headquarters in New York at which resolution 79/1 entitled \n\u201cThe Pact for the Future\u201d and its annexes were adopted, \n \nTaking note of the policy recommendations of the sixth Intergovernmental \nGroup of Experts on Financing for Development of the United Nations Conference \non Trade and Development,7 and recalling the 2020 publication of the Conference on \ntackling illicit financial flows for sustainable development in Africa, 8 \n \nTaking note also of the report of the High-level Panel on International Financial \nAccountability, Transparency and Integrity for Achieving the 2030 Agenda, 9 and \ntaking note of the recommendations by independent experts contained therein for \nfurther consideration, as appropriate,  \n \nRecalling the conceptual framework for the statistical measurement of illicit \nfinancial flows of the United Nations Conference on Trade and Development and the \nUnited Nations Office on Drugs and Crime, recalling further that it was endorsed by \nthe Statistical Commission at its fifty-third session for global use as indicator 16.4.1 \nto measure illicit financial flows in the context of the 2030 Agenda and its indicator \nframework, and noting the availability of the first official estimates of illicit financial \nflows based on the endorsed methodology and reported for that indicator,  \n \nTaking note of the South African Group of 20 (G20) Presidency\u2019s efforts in the \nadvancement of combating illicit financial flows as an essential means to step up the \ndomestic resource mobilization necessary for financing sustainable development that \nbuilds on the foundations of the Addis Ababa Action Agenda and complements the \nSevilla Commitment, while stressing the need to strengthen the role of the United \nNations in promoting coordinated and inclusive global action in this regard, \n \nReiterating its deep concern about the impact of illicit financial flows, in \nparticular those caused by tax evasion, corruption and transnational organized crime, \non the economic, social and political stability and development of societies, and \nespecially on developing countries and their progress in financing the 2030 Agenda,  \n \nRecalling paragraph 29 (h) of the Sevilla Commitment to promote measures to \neliminate safe havens, aggressive tax practices, and loopholes that create incentives \nfor illicit financial flows. We commit to take effective steps to prevent illicit financial \nflows from entering our jurisdictions,  \n \nExpressing its concern about the consequences of the smuggling of commercial \ngoods carried out by transnational organized criminal groups and about linkages \n_______________ \n \n7 See TD/B/EFD/6/3. \n \n8 Economic Development in Africa Report 2020: Tackling Illicit Financial Flows for Sustainable \nDevelopment in Africa (United Nations publication, 2020). \n \n9 A/75/810/Rev.1, annex. \n\nA/RES/80/126 \nPromotion of international cooperation to combat \nillicit financial flows and strengthen good practices \non assets return to foster sustainable development\n \n25-20739\n4/12 \n \nbetween that crime and corruption and other forms of transnational organized crimes, \nsuch as money-laundering and drug trafficking, \n \nAcknowledging that the coronavirus disease (COVID\u201119) pandemic has put a \nspotlight on the limitations of the Governments of developing countries to marshal \nresources in times of crisis, reiterating the need to enhance and strengthen effective \ndomestic resource mobilization, including accountable and transparent public \nexpenditure systems, and strengthen domestic regulatory and legal frameworks, as \nnecessary, to more effectively counter the harm resulting from illicit financial flows, \nand that the harm done by such flows in straining the limited resources of developing \ncountries evidently affects their ability to address the Sustainable Development Goal \nfinancing gap and to mobilize domestic resources for longer-term sustainable \ndevelopment,  \n \nEncouraging Member States to use and strengthen appropriate focal points to \nfacilitate information exchange among one another, acknowledging the Riyadh \ninitiative for enhancing international anti\u2011corruption law enforcement cooperation \nand its Global Operational Network of Anti-Corruption Law Enforcement Authorities, \nas well as existing agreements, formal forums, law enforcement bodies or networks, \nincluding the International Criminal Police Organization (INTERPOL) Global Focal \nPoint Network on Asset Recovery,  \n \nBearing in mind that there are different sources and channels of illicit financial \nflows and that a separate analysis of each source and channel is more beneficial in \ndesigning policy responses to prevent illicit financial flows,  \n \nNoting with appreciation the ongoing efforts by regional organizations and other \nrelevant international forums to strengthen cooperation in preventing and combating \nillicit financial flows, as well as new initiatives taken by Governments and the private \nsector to mobilize the financial sector in the collective fight against illicit financial \nflows,  \n \nNoting the essential work of relevant initiatives of regional, interregional and \nmultilateral organizations in their efforts to prevent and combat money-laundering,  \n \nRecalling paragraph 29 (g) of the Sevilla Commitment to identify, assess and \nact on money-laundering risks, including through effective implementation of the \nFinancial Action Task Force standards on anti\u2011money-laundering/countering the \nfinancing of terrorism, encourages the Financial Action Task Force to continue to \nmitigate unintended consequences of anti\u2011money-laundering/countering the financing \nof terrorism measures and ensure meaningful inclusion of developing countries in its \ndecision-making processes, to ensure that their voices are heard and that the work and \nprocesses of the Financial Action Task Force take into account the unique contexts \nand capacities of developing countries, \n \nRecognizing that combating illicit financial flows is an essential development \nchallenge, noting that developing countries are particularly susceptible to the negative \nimpact of illicit financial flows, and emphasizing that illicit financial flows reduce \nthe availability of valuable resources for financing for development,  \n \nRecognizing also the importance of studying the potential relationship between \ncombating illicit financial flows and attaining debt sustainability,  \n \nRecognizing further the challenge posed by the increasing scope and complexity \nof illicit financial flows, and recognizing also that the need for the recovery and return \nof stolen assets in accordance with the United Nations Convention against Corruption \nrequires strengthened international cooperation,  \n\nPromotion of international cooperation to combat \nillicit financial flows and strengthen good practices \non assets return to foster sustainable development \nA/RES/80/126\n \n5/12\n25-20739 \n \n \nRecognizing that global knowledge of the importance of combating illicit \nfinancial flows and enhancing the recovery and return of assets is rapidly increasing, \nas is the political will to recover illicitly acquired assets by both requesting and \nrequested States, and noting that, while many challenges remain unresolved, tackling \nthem effectively requires a holistic approach that recognizes the different types of \nillicit financial flows and their impact on sustainable development, \n \nRecognizing also that the loss of resources caused by corruption, including \ncomplex cases such as those involving multiple national jurisdictions and vast \nquantities of assets, may constitute a substantial proportion of the resources of States, \nand has a particularly negative impact on developing countries,  \n \nReaffirming the importance of chapter V of the United Nations Convention \nagainst Corruption, and underlining that the recovery and return of stolen assets \npursuant to that chapter is a fundamental principle of the Convention,  \n \nRecognizing the work carried out by the Conference of the States Parties to the \nUnited Nations Convention against Corruption, and in particular its Open-ended \nIntergovernmental Working Group on Asset Recovery, to advance the effective \nimplementation of chapter V of the Convention,  \n \nNoting the efforts to promote the exchange of information and synergies \nbetween the open-ended intergovernmental expert meetings to enhance international \ncooperation under the United Nations Convention against Corruption and the Working \nGroup on International Cooperation established by the Conference of the Parties to \nthe United Nations Convention against Transnational Organized Crime,  \n \nRecalling the fourth International Expert Meeting on the Return of Stolen \nAssets, held in Addis Ababa from 11 to 13 December 2024,  \n \nRecalling also the holding of the second session of the Illicit Trade Forum, in \nGeneva on 6 and 7 September 2022, which highlighted the negative impact of illicit \ntrade, including related illicit financial flows, on the implementation of the \nSustainable Development Goals, revenue generation and economic activity, \n \nRecalling further the work of the Platform for Collaboration on Tax, which is to \nintensify collaboration and coordination on tax issues between the United Nations, \nthe International Monetary Fund, the World Bank Group and the Organisation for \nEconomic Co-operation and Development, including on formalizing regular \ndiscussions among the four international organizations and other relevant \nstakeholders on the implementation of standards for international tax matters and on \nthe strengthening of their ability to provide capacity-building support to developing \ncountries,  \n \nNoting the ongoing efforts of the joint Organisation for Economic Co-operation \nand Development/United Nations Development Programme initiative, Tax Inspectors \nWithout Borders, to support developing countries through targeted tax audit \nassistance programmes,  \n \nRecognizing the important work undertaken by academia and civil society in \nassisting Member States in understanding the challenges associated with the return of \nstolen assets under chapter V of the United Nations Convention against Corruption,  \n \nNoting the work of the 147 members of the Organisation for Economic \nCo\u2011operation and Development/Group of 20 Inclusive Framework on Base Erosion \nand Profit Shifting, which provides a forum for collaboration for tackling tax \navoidance, improving the coherence of international tax rules and ensuring a more \ntransparent and fair tax environment,  \n\nA/RES/80/126 \nPromotion of international cooperation to combat \nillicit financial flows and strengthen good practices \non assets return to foster sustainable development\n \n25-20739\n6/12 \n \n \nNoting also international developments on the implementation of the Standard \nfor Automatic Exchange of Financial Account Information in Tax Matters under a \ncommon reporting standard developed by the Organisation for Economic Co-operation \nand Development, which 123 members have already committed to implementing by \n2026, as well as the role of the 173 members of the Global Forum on Transparency \nand Exchange of Information for Tax Purposes, which enables cooperation on an \nequal footing,  \n \nReiterating the pledge that no one will be left behind, reaffirming the \nrecognition that the dignity of the human person is fundamental, and the wish to see \nthe Goals and targets met for all nations and peoples and for all segments of society, \nand recommitting to endeavour to reach the furthest behind first,  \n \n1. \nAcknowledges that preventing and combating illicit financial flows \ncontributes to domestic resource mobilization, which is essential to finance policies \naiming to achieve the Sustainable Development Goals;  \n \n2. \nTakes note of the report of the Secretary-General;10 \n \n3. \nReiterates its commitment to financial integrity for sustainable \ndevelopment, through national efforts and international cooperation to combat illicit \nfinancial flows and promote good practices on assets return to foster sustainable \ndevelopment, including through existing relevant international frameworks, such as \nthe United Nations Convention against Corruption, while noting the ongoing work of \nthe United Nations Office on Drugs and Crime, the United Nations Conference on \nTrade and Development and the Group of 20;  \n \n4. \nReaffirms its commitment to strengthen regulatory frameworks at all levels \nin line with international standards and to further increase the transparency and \naccountability of financial institutions and the corporate sector, as well as public \nadministrations;  \n \n5. \nReaffirms paragraph 29 (b) of the Sevilla Commitment11 to support the role \nthat the media and civil society play in fairly, transparently and ethically exposing \nillicit financial flows;  \n \n6. \nCalls upon States Parties to the United Nations Convention against \nCorruption to ensure that all relevant protections are available to those who report \ncorruption and suspected wrongdoing, noting the role that individuals and groups \noutside of the public sector play in preventing and detecting corruption;  \n \n7. \nWelcomes the ongoing efforts of Member States to enhance knowledge and \nbroaden understanding of the challenges and opportunities involved in international \ncooperation to combat illicit financial flows and strengthen good practices on assets \nrecovery and return consistent with the United Nations Convention against Corruption \nso as to foster sustainable development;  \n \n8. \nAcknowledges that combating illicit financial flows requires a range of \nactions that includes preventing, detecting, investigating, prosecuting and recovering, \nto counter such flows in source, transit and destination countries, including through \nexpeditious and effective law enforcement action and cooperation, including through \nthe International Criminal Police Organization (INTERPOL), where appropriate;  \n \n9. \nAlso acknowledges the need to combat illicit financial flows and \nstrengthen good practices on the identification, freezing, confiscation, recovery and \nreturn of assets as one of the sources of financing for development in a broad range \n_______________ \n \n10 A/80/224. \n \n11 Resolution 79/323, annex.  \n\nPromotion of international cooperation to combat \nillicit financial flows and strengthen good practices \non assets return to foster sustainable development \nA/RES/80/126\n \n7/12\n25-20739 \n \nof areas, such as poverty eradication, food security, health, education, investment in \nsocial programmes or adaptation to climate change, and may contribute to improved \nsustainable development outcomes;  \n \n10. Recognizes that combating illicit financial flows requires a coordinated, \nwhole-of-government approach and therefore encourages Member States to create \ndomestic institutional mechanisms as appropriate and necessary, including those \nrelated to digitalization or other appropriate measures to ensure information-sharing \nand whole-of-government coordination, in this regard invites those Member States \nwilling to prepare integrated national financing frameworks to include plans for \ncombating illicit financial flows, including through the transfer and sharing of data, \nwhere appropriate, and with the necessary safeguards, and looks forward to the \nformulation by the Inter-Agency Task Force on Financing for Development of \nguidance on how countries can incorporate financial integrity actions into their \nfinancing frameworks;  \n \n11. Notes that international cooperation in combating illicit financial flows is \na work in progress that must continue to be pursued, and encourages all countries to \ndevelop effective tools and create a policy environment for combating illicit financial \nflows, in accordance with the existing relevant international frameworks, including \nthe United Nations Convention against Corruption;  \n \n12. Recognizes that measures aimed at combating illicit financial flows require \ncross-border cooperation between law enforcement agencies without undue political \ninfluence and that, where requested, technical assistance can also contribute to better \ninternational cooperation, and encourages Member States, where applicable and \nsubject to their domestic legal systems, and in line with their treaty obligations, to \ncooperate and exchange information and best practices in this regard;  \n \n13. Encourages countries and relevant multilateral and international \norganizations to continue and strengthen their efforts to provide, upon request, \ntechnical assistance and capacity-building assistance to developing countries, as well \nas to support African and other regional initiatives, to prevent, detect and combat \nillicit financial flows and to strengthen good practices on the identification, freezing, \nconfiscation, recovery and return of assets to foster sustainable development in line \nwith the 2030 Agenda for Sustainable Development;12 \n \n14. Commits to strengthening efforts in preventing, deterring, detecting and \ncountering corruption, increasing transparency and promoting good governance;  \n \n15. Calls upon Member States, within their means and in accordance with the \nfundamental principles of their domestic law, to promote the active participation of \nindividuals and groups outside the public sector, such as civil society, \nnon\u2011governmental organizations and community-based organizations, in the \nprevention of and the fight against corruption and to raise public awareness regarding \nthe existence, causes and gravity of the threat posed by corruption;  \n \n16. Urges Member States that have not yet done so to consider ratifying or \nacceding to the United Nations Convention against Corruption and the United Nations \nConvention against Transnational Organized Crime and the Protocols thereto, 13 and \nurges States Parties to those Conventions and Protocols to make efforts towards their \neffective implementation;  \n_______________ \n \n12 Resolution 70/1. \n \n13 United Nations, Treaty Series, vols. 2225, 2237, 2241 and 2326, No. 39574. \n\nA/RES/80/126 \nPromotion of international cooperation to combat \nillicit financial flows and strengthen good practices \non assets return to foster sustainable development\n \n25-20739\n8/12 \n \n \n17. Reaffirms the need for Member States to effectively implement and \nenforce all existing obligations under the United Nations Convention against \nCorruption as a critical part of combating illicit financial flows;  \n \n18. Urges Member States to increase their efforts to prevent and counter \ncorruption that involves vast quantities of assets and related illicit financial flows, \nnoting that no country alone can effectively combat complex cases involving multiple \njurisdictions and that international cooperation and technical assistance, including \nthrough INTERPOL, where appropriate, are needed in the prevention of and fight \nagainst corruption, including in asset recovery;  \n \n19. Urges enhanced global efforts to trace, seize, confiscate and return \ncriminal proceeds, in line with international obligations and domestic legal \nframeworks; \n \n20. Stresses that anti\u2011corruption measures should be an integral part of \nnational development policies and strategies and therefore invites countries \ndeveloping integrated national financing frameworks to include anti\u2011corruption \ncomponents and standards therein, as appropriate, and further stresses that all \njurisdictions should consider undertaking further research, policy development and \nprogramming, as appropriate, to address corruption;  \n \n21. Encourages closer public-private sector collaboration to better tackle \ncorruption, and stresses that further research, policy development and programming \nshould help in reaching this goal;  \n \n22. Notes with concern that proceeds derived from offences established under \nthe United Nations Convention against Corruption have yet to be disposed of in favour \nof the requesting States Parties, their prior legitimate owners and victims of the \ncrimes, and decides to prevent, deter, detect and counter corruption, increase \ntransparency and promote good governance;  \n \n23. Reaffirms paragraph 29 (e) of the Sevilla Commitment to ensure that assets \nconfiscated pursuant to the United Nations Convention against Corruption are \nreturned to countries of origin, in accordance with the provisions of the Convention, \nand are used transparently;  \n \n24. Reiterates its invitation to the Conference of the States Parties to the \nUnited Nations Convention against Corruption, in the future, after the conclusion and \nevaluation of the findings from the second review cycle, to organize a special session \nof the Conference on all aspects of the asset recovery and return process, with a view \nto considering all options available under the Convention, including exploring \npossible areas for improvement of the international asset recovery framework;  \n \n25. Encourages States Parties to the United Nations Convention against \nCorruption to make full use of the asset recovery tools set forth in chapter V of the \nConvention, including mechanisms for the enforcement of foreign restraining and \nconfiscation orders;  \n \n26. Calls upon all States Parties to the United Nations Convention against \nCorruption, in particular requesting and requested States Parties, to cooperate to \nrecover the proceeds of crime as defined in the Convention, and to fulfil their \nobligation defined in the Convention to ensure the return or disposal of such proceeds, \nin accordance with article 57 of the Convention, and invites States Parties, in \naccordance with their respective domestic laws, to consider allocating recovered \nresources to finance the achievement of the Sustainable Development Goals and to \nstrengthening the implementation of existing multilateral legal instruments for the \npurpose of asset recovery and return;  \n\nPromotion of international cooperation to combat \nillicit financial flows and strengthen good practices \non assets return to foster sustainable development \nA/RES/80/126\n \n9/12\n25-20739 \n \n \n27. Requests the United Nations Office on Drugs and Crime, in coordination \nwith the Stolen Asset Recovery Initiative, to continue to expand global knowledge \nand data collection on asset recovery and return by gathering and sharing information \non challenges and good practices, as well as on volumes of assets frozen, seized, \nconfiscated and returned in relation to corruption offences, and the number and types \nof cases, as appropriate, while ensuring the protection of personal data and privacy \nrights, drawing upon existing efforts, within existing resources;14 \n \n28. Urges States Parties to consider, when applicable, using the international \ncooperation provisions of the United Nations Convention against Transnational \nOrganized Crime and the United Nations Convention against Corruption, in \nappropriate cases, to investigate and prosecute the smuggling of commercial goods;  \n \n29. Urges Member States to strengthen the capacity of customs \nadministrations for the detection of illicit financial flows at the borders, and to \nenhance accurate and timely trade data exchange, as appropriate, to address \nsmuggling of commercial goods and trade misinvoicing, including by supporting \ndeveloping countries to upgrade technology in their ports;  \n \n30. Stresses that efforts in international tax cooperation should be universal in \napproach and scope and fully take into account the different needs and capacities of \nall countries, in particular the least developed countries, landlocked developing \ncountries, small island developing States and African countries;  \n \n31. Encourages further efforts by relevant national and international actors to \nmitigate transfer pricing not in line with the arm\u2019s length principle and trade \nmisinvoicing;  \n \n32. Calls upon all countries to work together to eliminate base erosion and \nprofit shifting and to ensure that all companies, including multinational enterprises, \npay taxes to the Governments of countries where economic activity occurs and value \nis created, in accordance with national and international laws and policies;  \n \n33. Also calls upon all countries to cooperate, in accordance with applicable \nbilateral or multilateral agreements, in the areas of mutual legal assistance, \nadministrative assistance and the exchange of information in tax matters, as well as \nthe automatic exchange of financial account information;  \n \n34. Notes with concern that developing countries face obstacles in receiving \ninformation, and calls upon existing parties to information-exchange agreements to \nstrengthen the cooperation necessary to assist interested developing countries that are \nparties to such agreements in accessing and using, in a timely manner, relevant \ninformation provided under such agreements, and provide capacity-building, where \npossible, to developing countries to meet the relevant standards;  \n \n35. Invites signatories to bilateral or multilateral tax transparency agreements \nto consider allowing information exchanged pursuant to those agreements to be used \nwhere permitted under such agreements and when written consent is provided, having \nregard to confidentiality and domestic law limitations;  \n \n36. Recalls paragraph 28 (f) of the Sevilla Commitment, on country-by-\ncountry reporting of multinational enterprises, when applicable;  \n \n37. Invites the Economic and Social Council to update and strengthen the \nUnited Nations code of conduct on cooperation in combating international tax \nevasion 15  in response to new international agreements and to emphasize the \n_______________ \n \n14 CAC/COSP/2021/17, sect. I.A, resolution 9/2, para. 15.  \n \n15 Economic and Social Council resolution 2017/3. \n\nA/RES/80/126 \nPromotion of international cooperation to combat \nillicit financial flows and strengthen good practices \non assets return to foster sustainable development\n \n25-20739\n10/12 \n \nimportance of developing countries being able to benefit from international tax \ncooperation;  \n \n38. Recognizes the importance of the consideration of international tax \ncooperation at the United Nations, and in that regard takes note with appreciation of \nthe work of the Intergovernmental Negotiating Committee on the United Nations \nFramework Convention on International Tax Cooperation and of the Committee of \nExperts on International Cooperation in Tax Matters;  \n \n39. Takes note of the ongoing work on the implementation of the Organisation \nfor Economic Co-operation and Development/Group of 20 two-pillar solution to \naddress the tax challenges arising from the digitalization of the economy, \nacknowledges the need for a careful analysis of the implications for developing \ncountries, and encourages a special focus on their unique needs and capacities;  \n \n40. Recalls the analysis, in the Financing for Sustainable Development Report \n2022, the Trade and Development Report 2021 of the United Nations Conference on \nTrade and Development and World Economic Situation and Prospects 2022 of the \nDepartment of Economic and Social Affairs of the Secretariat, of the Organisation for \nEconomic Co-operation and Development/Group of 20 two-pillar solution, and calls \nfor inclusive discussions to address the uncertainties and implications for developing \ncountries, including their capacity-building needs;  \n \n41. Also recalls that new technologies can both increase efficiency in revenue \ncollection and strengthen the efforts to combat illicit financial flows, expresses \nconcern that virtual assets are being used for illicit activities, and in this regard \nencourages Member States and other relevant organizations to take measures in line \nwith international standards, where applicable, to prevent and counter their illicit use;  \n \n42. Notes that various jurisdictions have introduced mechanisms to increase \nbeneficial ownership transparency, including beneficial ownership registries of legal \nentities and legal arrangements, such as companies, trusts and limited liability \npartnerships, encourages all jurisdictions to consider establishing appropriate \nmechanisms through either a registry of beneficial ownership or an alternative \nmechanism, in line with domestic law and applicable international standards, and \nencourages Member States to facilitate the timely availability of adequate, accurate \nand up-to-date beneficial ownership information;  \n \n43. Also notes that a wide variety of individuals and entities are involved in \nthe transactions that comprise an illicit financial flow, recognizes the need to consider \nappropriate business regulatory policies, taking into account national circumstances, \nurges Member States to effectively regulate professional service providers, as \nappropriate, at the national level and, building on existing standards, commits to \npromoting global discussions on standardizing regulatory regimes of professional \nservice providers involved in illicit financial flows, and reiterates its request to the \nDepartment of Economic and Social Affairs, the United Nations Office on Drugs and \nCrime and the United Nations Conference on Trade and Development to jointly \nprepare a global mapping of existing standards and guidelines, in consultation with \nall relevant stakeholders, taking into account national circumstances, and to submit \nthese to the Economic and Social Council for intergovernmental discussion;  \n \n44. Calls upon States to effectively investigate and refer for prosecution \nprofessional service providers who are involved in or enable criminal activities \nrelated to illicit financial flows, including corruption, tax evasion and money-\nlaundering in accordance with national legislation, and to scale up international \ncooperation in this regard;  \n\nPromotion of international cooperation to combat \nillicit financial flows and strengthen good practices \non assets return to foster sustainable development \nA/RES/80/126\n \n11/12\n25-20739 \n \n \n45. Recognizes the significant progress and availability of concepts and tested \nmethods to measure illicit financial flows, notes the outcomes of pilot studies across \nthree continents showing that measurement of these flows is possible, while \nchallenging, and requires strengthened support, and calls for increased transparency \nand the strengthening of efforts to enhance the capacity of national authorities for data \ncollection and analysis to combat illicit financial flows with more informed and \ntargeted policy efforts, emphasizing the need to strengthen national capacity to \nmeasure illicit financial flows in the context of the 2030 Agenda and increase the \nexchange of data within national government institutions as well as from international \ninstitutions;  \n \n46. Reiterates its request to the United Nations Office on Drugs and Crime \nand the United Nations Conference on Trade and Development, as custodian agencies \nof Sustainable Development Goal indicator 16.4.1 on the total value of inward and \noutward illicit financial flows, to urgently strengthen support to Member States, \nespecially developing countries, provide technical guidance and tools for data \ncompilation and reporting, establish a platform to refine concepts and methods and \nempower national authorities to inform efforts to publish, track and curb the flows \nand exchange their good practices, and invites all Member States to engage with the \ncustodian agencies towards more informed and effective policy action and reporting \nof data on the indicator, so as to overcome the substantial and persistent challenges to \neffectively combating illicit financial flows;  \n \n47. Invites all institutions involved in measuring and reporting on illicit \nfinancial flows to use the statistical concepts and methods to estimate illicit financial \nflows, encourages all Member States to report on Sustainable Development Goal \nindicator 16.4.1, using the methodology adopted by the Statistical Commission, and \ncalls upon the United Nations system entities, international organizations and donors \nto work in coordination with the custodian agencies to train national statistical offices \nand other entities in charge of reporting and publishing results on illicit financial \nflows on these methods adopted by the Statistical Commission;  \n \n48. Invites the President of the General Assembly, the President of the \nEconomic and Social Council, the Secretary-General and the United Nations Office \non Drugs and Crime to give appropriate consideration to the importance of combating \nillicit financial flows and strengthening good practices on asset return to foster \nsustainable development, calls upon the relevant organizations of the United Nations \nsystem, within their respective mandates and resources, to continue their \nconsideration of the negative impact of illicit financial flows on financing the 2030 \nAgenda based on its indicator 16.4.1 and to coordinate their efforts to further explore \npolicy responses to the phenomenon, and in this regard invites all other relevant \ninternational institutions to support these efforts, in accordance with their respective \nmandates;  \n \n49. Reaffirms the commitment at the very heart of the 2030 Agenda to leave \nno one behind and commit to taking more tangible steps to support people in \nvulnerable situations and the most vulnerable countries and to reach the furthest \nbehind first;  \n \n50. Looks forward to the special meeting of the Economic and Social Council \non financial integrity to foster dialogue on financial integrity at a systemic level, \ndiscuss unintended consequences of financial integrity policies and exchange best \npractices, including on the use of technologies to effectively combat illicit financial \nflows;  \n \n51. Requests the Secretary-General to submit to the General Assembly at its \neighty-first session a report, within existing resources, in relation to progress made \n\nA/RES/80/126 \nPromotion of international cooperation to combat \nillicit financial flows and strengthen good practices \non assets return to foster sustainable development\n \n25-20739\n12/12 \n \non combating illicit financial flows and the implementation of assets return and \nrecovery based on existing mechanisms, and to elaborate on strengthening \ninternational coordination in this regard, and requests the United Nations Conference \non Trade and Development and the United Nations Office on Drugs and Crime to \ninform the General Assembly at its eighty-first session about the implementation of \nthe present resolution, through a dedicated section of the Sustainable Development \nGoals Pulse report, to be introduced to the Second Committee by the Secretariat, \nelaborating in particular on the progress in testing, refining and applying the \nmethodology to report on indicator 16.4.1;  \n \n52. Decides to include in the provisional agenda of its eighty-first session, \nunder the item entitled \u201cMacroeconomic policy questions\u201d, the sub-item entitled \n\u201cPromotion of international cooperation to combat illicit financial flows and \nstrengthen good practices on assets return to foster sustainable development\u201d.  \n \n64th plenary meeting \n15 December 2025 \n \n",
  "paragraphs": {
    "1": "Acknowledges that preventing and combating illicit financial flows contributes to domestic resource mobilization, which is essential to finance policies aiming to achieve the Sustainable Development Goals;",
    "2": "Takes note of the report of the Secretary-General;10",
    "3": "Reiterates its commitment to financial integrity for sustainable development, through national efforts and international cooperation to combat illicit financial flows and promote good practices on assets return to foster sustainable development, including through existing relevant international frameworks, such as the United Nations Convention against Corruption, while noting the ongoing work of the United Nations Office on Drugs and Crime, the United Nations Conference on Trade and Development and the Group of 20;",
    "4": "Reaffirms its commitment to strengthen regulatory frameworks at all levels in line with international standards and to further increase the transparency and accountability of financial institutions and the corporate sector, as well as public administrations;",
    "5": "Reaffirms paragraph 29 (b) of the Sevilla Commitment11 to support the role that the media and civil society play in fairly, transparently and ethically exposing illicit financial flows;",
    "6": "Calls upon States Parties to the United Nations Convention against Corruption to ensure that all relevant protections are available to those who report corruption and suspected wrongdoing, noting the role that individuals and groups outside of the public sector play in preventing and detecting corruption;",
    "7": "Welcomes the ongoing efforts of Member States to enhance knowledge and broaden understanding of the challenges and opportunities involved in international cooperation to combat illicit financial flows and strengthen good practices on assets recovery and return consistent with the United Nations Convention against Corruption so as to foster sustainable development;",
    "8": "Acknowledges that combating illicit financial flows requires a range of actions that includes preventing, detecting, investigating, prosecuting and recovering, to counter such flows in source, transit and destination countries, including through expeditious and effective law enforcement action and cooperation, including through the International Criminal Police Organization (INTERPOL), where appropriate;",
    "9": "Also acknowledges the need to combat illicit financial flows and strengthen good practices on the identification, freezing, confiscation, recovery and return of assets as one of the sources of financing for development in a broad range of areas, such as poverty eradication, food security, health, education, investment in social programmes or adaptation to climate change, and may contribute to improved sustainable development outcomes;",
    "10": "Recognizes that combating illicit financial flows requires a coordinated, whole-of-government approach and therefore encourages Member States to create domestic institutional mechanisms as appropriate and necessary, including those related to digitalization or other appropriate measures to ensure information-sharing and whole-of-government coordination, in this regard invites those Member States willing to prepare integrated national financing frameworks to include plans for combating illicit financial flows, including through the transfer and sharing of data, where appropriate, and with the necessary safeguards, and looks forward to the formulation by the Inter-Agency Task Force on Financing for Development of guidance on how countries can incorporate financial integrity actions into their financing frameworks;",
    "11": "Notes that international cooperation in combating illicit financial flows is a work in progress that must continue to be pursued, and encourages all countries to develop effective tools and create a policy environment for combating illicit financial flows, in accordance with the existing relevant international frameworks, including the United Nations Convention against Corruption;",
    "12": "Recognizes that measures aimed at combating illicit financial flows require cross-border cooperation between law enforcement agencies without undue political influence and that, where requested, technical assistance can also contribute to better international cooperation, and encourages Member States, where applicable and subject to their domestic legal systems, and in line with their treaty obligations, to cooperate and exchange information and best practices in this regard;",
    "13": "Encourages countries and relevant multilateral and international organizations to continue and strengthen their efforts to provide, upon request, technical assistance and capacity-building assistance to developing countries, as well as to support African and other regional initiatives, to prevent, detect and combat illicit financial flows and to strengthen good practices on the identification, freezing, confiscation, recovery and return of assets to foster sustainable development in line with the 2030 Agenda for Sustainable Development;12",
    "14": "Commits to strengthening efforts in preventing, deterring, detecting and countering corruption, increasing transparency and promoting good governance;",
    "15": "Calls upon Member States, within their means and in accordance with the fundamental principles of their domestic law, to promote the active participation of individuals and groups outside the public sector, such as civil society, non\u2011governmental organizations and community-based organizations, in the prevention of and the fight against corruption and to raise public awareness regarding the existence, causes and gravity of the threat posed by corruption;",
    "16": "Urges Member States that have not yet done so to consider ratifying or acceding to the United Nations Convention against Corruption and the United Nations Convention against Transnational Organized Crime and the Protocols thereto, 13 and urges States Parties to those Conventions and Protocols to make efforts towards their effective implementation;",
    "17": "Reaffirms the need for Member States to effectively implement and enforce all existing obligations under the United Nations Convention against Corruption as a critical part of combating illicit financial flows;",
    "18": "Urges Member States to increase their efforts to prevent and counter corruption that involves vast quantities of assets and related illicit financial flows, noting that no country alone can effectively combat complex cases involving multiple jurisdictions and that international cooperation and technical assistance, including through INTERPOL, where appropriate, are needed in the prevention of and fight against corruption, including in asset recovery;",
    "19": "Urges enhanced global efforts to trace, seize, confiscate and return criminal proceeds, in line with international obligations and domestic legal frameworks;",
    "20": "Stresses that anti\u2011corruption measures should be an integral part of national development policies and strategies and therefore invites countries developing integrated national financing frameworks to include anti\u2011corruption components and standards therein, as appropriate, and further stresses that all jurisdictions should consider undertaking further research, policy development and programming, as appropriate, to address corruption;",
    "21": "Encourages closer public-private sector collaboration to better tackle corruption, and stresses that further research, policy development and programming should help in reaching this goal;",
    "22": "Notes with concern that proceeds derived from offences established under the United Nations Convention against Corruption have yet to be disposed of in favour of the requesting States Parties, their prior legitimate owners and victims of the crimes, and decides to prevent, deter, detect and counter corruption, increase transparency and promote good governance;",
    "23": "Reaffirms paragraph 29 (e) of the Sevilla Commitment to ensure that assets confiscated pursuant to the United Nations Convention against Corruption are returned to countries of origin, in accordance with the provisions of the Convention, and are used transparently;",
    "24": "Reiterates its invitation to the Conference of the States Parties to the United Nations Convention against Corruption, in the future, after the conclusion and evaluation of the findings from the second review cycle, to organize a special session of the Conference on all aspects of the asset recovery and return process, with a view to considering all options available under the Convention, including exploring possible areas for improvement of the international asset recovery framework;",
    "25": "Encourages States Parties to the United Nations Convention against Corruption to make full use of the asset recovery tools set forth in chapter V of the Convention, including mechanisms for the enforcement of foreign restraining and confiscation orders;",
    "26": "",
    "27": "Requests the United Nations Office on Drugs and Crime, in coordination with the Stolen Asset Recovery Initiative, to continue to expand global knowledge and data collection on asset recovery and return by gathering and sharing information on challenges and good practices, as well as on volumes of assets frozen, seized, confiscated and returned in relation to corruption offences, and the number and types of cases, as appropriate, while ensuring the protection of personal data and privacy rights, drawing upon existing efforts, within existing resources;14",
    "28": "Urges States Parties to consider, when applicable, using the international cooperation provisions of the United Nations Convention against Transnational Organized Crime and the United Nations Convention against Corruption, in appropriate cases, to investigate and prosecute the smuggling of commercial goods;",
    "29": "Urges Member States to strengthen the capacity of customs administrations for the detection of illicit financial flows at the borders, and to enhance accurate and timely trade data exchange, as appropriate, to address smuggling of commercial goods and trade misinvoicing, including by supporting developing countries to upgrade technology in their ports;",
    "30": "Stresses that efforts in international tax cooperation should be universal in approach and scope and fully take into account the different needs and capacities of all countries, in particular the least developed countries, landlocked developing countries, small island developing States and African countries;",
    "31": "Encourages further efforts by relevant national and international actors to mitigate transfer pricing not in line with the arm\u2019s length principle and trade misinvoicing;",
    "32": "Calls upon all countries to work together to eliminate base erosion and profit shifting and to ensure that all companies, including multinational enterprises, pay taxes to the Governments of countries where economic activity occurs and value is created, in accordance with national and international laws and policies;",
    "33": "Also calls upon all countries to cooperate, in accordance with applicable bilateral or multilateral agreements, in the areas of mutual legal assistance, administrative assistance and the exchange of information in tax matters, as well as the automatic exchange of financial account information;",
    "34": "Notes with concern that developing countries face obstacles in receiving information, and calls upon existing parties to information-exchange agreements to strengthen the cooperation necessary to assist interested developing countries that are parties to such agreements in accessing and using, in a timely manner, relevant information provided under such agreements, and provide capacity-building, where possible, to developing countries to meet the relevant standards;",
    "35": "Invites signatories to bilateral or multilateral tax transparency agreements to consider allowing information exchanged pursuant to those agreements to be used where permitted under such agreements and when written consent is provided, having regard to confidentiality and domestic law limitations;",
    "36": "Recalls paragraph 28 (f) of the Sevilla Commitment, on country-by- country reporting of multinational enterprises, when applicable;",
    "37": "Invites the Economic and Social Council to update and strengthen the United Nations code of conduct on cooperation in combating international tax evasion 15 in response to new international agreements and to emphasize the importance of developing countries being able to benefit from international tax cooperation;",
    "38": "Recognizes the importance of the consideration of international tax cooperation at the United Nations, and in that regard takes note with appreciation of the work of the Intergovernmental Negotiating Committee on the United Nations Framework Convention on International Tax Cooperation and of the Committee of Experts on International Cooperation in Tax Matters;",
    "39": "Takes note of the ongoing work on the implementation of the Organisation for Economic Co-operation and Development/Group of 20 two-pillar solution to address the tax challenges arising from the digitalization of the economy, acknowledges the need for a careful analysis of the implications for developing countries, and encourages a special focus on their unique needs and capacities;",
    "40": "Recalls the analysis, in the Financing for Sustainable Development Report 2022, the Trade and Development Report 2021 of the United Nations Conference on Trade and Development and World Economic Situation and Prospects 2022 of the Department of Economic and Social Affairs of the Secretariat, of the Organisation for Economic Co-operation and Development/Group of 20 two-pillar solution, and calls for inclusive discussions to address the uncertainties and implications for developing countries, including their capacity-building needs;",
    "41": "Also recalls that new technologies can both increase efficiency in revenue collection and strengthen the efforts to combat illicit financial flows, expresses concern that virtual assets are being used for illicit activities, and in this regard encourages Member States and other relevant organizations to take measures in line with international standards, where applicable, to prevent and counter their illicit use;",
    "42": "Notes that various jurisdictions have introduced mechanisms to increase beneficial ownership transparency, including beneficial ownership registries of legal entities and legal arrangements, such as companies, trusts and limited liability partnerships, encourages all jurisdictions to consider establishing appropriate mechanisms through either a registry of beneficial ownership or an alternative mechanism, in line with domestic law and applicable international standards, and encourages Member States to facilitate the timely availability of adequate, accurate and up-to-date beneficial ownership information;",
    "43": "Also notes that a wide variety of individuals and entities are involved in the transactions that comprise an illicit financial flow, recognizes the need to consider appropriate business regulatory policies, taking into account national circumstances, urges Member States to effectively regulate professional service providers, as appropriate, at the national level and, building on existing standards, commits to promoting global discussions on standardizing regulatory regimes of professional service providers involved in illicit financial flows, and reiterates its request to the Department of Economic and Social Affairs, the United Nations Office on Drugs and Crime and the United Nations Conference on Trade and Development to jointly prepare a global mapping of existing standards and guidelines, in consultation with all relevant stakeholders, taking into account national circumstances, and to submit these to the Economic and Social Council for intergovernmental discussion;",
    "44": "",
    "45": "Recognizes the significant progress and availability of concepts and tested methods to measure illicit financial flows, notes the outcomes of pilot studies across three continents showing that measurement of these flows is possible, while challenging, and requires strengthened support, and calls for increased transparency and the strengthening of efforts to enhance the capacity of national authorities for data collection and analysis to combat illicit financial flows with more informed and targeted policy efforts, emphasizing the need to strengthen national capacity to measure illicit financial flows in the context of the 2030 Agenda and increase the exchange of data within national government institutions as well as from international institutions;",
    "46": "Reiterates its request to the United Nations Office on Drugs and Crime and the United Nations Conference on Trade and Development, as custodian agencies of Sustainable Development Goal indicator 16.4.1 on the total value of inward and outward illicit financial flows, to urgently strengthen support to Member States, especially developing countries, provide technical guidance and tools for data compilation and reporting, establish a platform to refine concepts and methods and empower national authorities to inform efforts to publish, track and curb the flows and exchange their good practices, and invites all Member States to engage with the custodian agencies towards more informed and effective policy action and reporting of data on the indicator, so as to overcome the substantial and persistent challenges to effectively combating illicit financial flows;",
    "47": "Invites all institutions involved in measuring and reporting on illicit financial flows to use the statistical concepts and methods to estimate illicit financial flows, encourages all Member States to report on Sustainable Development Goal indicator 16.4.1, using the methodology adopted by the Statistical Commission, and calls upon the United Nations system entities, international organizations and donors to work in coordination with the custodian agencies to train national statistical offices and other entities in charge of reporting and publishing results on illicit financial flows on these methods adopted by the Statistical Commission;",
    "48": "Invites the President of the General Assembly, the President of the Economic and Social Council, the Secretary-General and the United Nations Office on Drugs and Crime to give appropriate consideration to the importance of combating illicit financial flows and strengthening good practices on asset return to foster sustainable development, calls upon the relevant organizations of the United Nations system, within their respective mandates and resources, to continue their consideration of the negative impact of illicit financial flows on financing the 2030 Agenda based on its indicator 16.4.1 and to coordinate their efforts to further explore policy responses to the phenomenon, and in this regard invites all other relevant international institutions to support these efforts, in accordance with their respective mandates;",
    "49": "Reaffirms the commitment at the very heart of the 2030 Agenda to leave no one behind and commit to taking more tangible steps to support people in vulnerable situations and the most vulnerable countries and to reach the furthest behind first;",
    "50": "Looks forward to the special meeting of the Economic and Social Council on financial integrity to foster dialogue on financial integrity at a systemic level, discuss unintended consequences of financial integrity policies and exchange best practices, including on the use of technologies to effectively combat illicit financial flows;",
    "51": " on combating illicit financial flows and the implementation of assets return and recovery based on existing mechanisms, and to elaborate on strengthening international coordination in this regard, and requests the United Nations Conference on Trade and Development and the United Nations Office on Drugs and Crime to inform the General Assembly at its eighty-first session about the implementation of the present resolution, through a dedicated section of the Sustainable Development Goals Pulse report, to be introduced to the Second Committee by the Secretariat, elaborating in particular on the progress in testing, refining and applying the methodology to report on indicator 16.4.1;",
    "52": "Decides to include in the provisional agenda of its eighty-first session, under the item entitled \u201cMacroeconomic policy questions\u201d, the sub-item entitled \u201cPromotion of international cooperation to combat illicit financial flows and strengthen good practices on assets return to foster sustainable development\u201d."
  },
  "agenda_items": [
    "Item 16"
  ],
  "symbol_references": []
}