{
  "symbol": "A/RES/79/295",
  "filename": "A_RES_79_295.pdf",
  "title": "79/295. Cooperation between the United Nations and the Gulf Cooperation Council",
  "text": "United Nations \nA/RES/79/295 \n \n \nGeneral Assembly \nDistr.: General \n18 June 2025 \n \n25-09824 (E) \n*2509824* \n \n \nSeventy-ninth session \nAgenda item 125 \nCooperation between the United Nations and regional and \nother organizations \n \n \n \n \n Resolution adopted by the General Assembly \non 16 June 2025 \n \n \n \n \n[without reference to a Main Committee (A/79/L.91)] \n \n \n 79/295. Cooperation between the United Nations and the Gulf \nCooperation Council \n \n \n \nThe General Assembly, \n \nRecalling its previous resolutions on cooperation between the United Nations \nand regional and other organizations, particularly those highlighting the role of \npartnerships in maintaining international peace and security,  \n \nRecalling also Article 52 of the Charter of the United Nations, which recognizes \nthe existence of regional arrangements or agencies for dealing with such matters \nrelating to the maintenance of international peace and security as are appropriate for \nregional action, provided that such arrangements or agencies and their activities are \nconsistent with the purposes and principles of the United Nations,  \n \nRecognizing Security Council resolutions 1631 (2005) of 17 October 2005 and \n2167 (2014) of 28 July 2014, which underscore the critical role of regional \norganizations in maintaining international peace and security, and the necessity of \neffective partnerships between the United Nations and such entities,  \n \nRecalling the Charter of the Cooperation Council for the Arab States of the Gulf1 \n(Gulf Cooperation Council), which emphasizes the importance of effective \ncoordination, integration and interconnection among its member States in all fields,  \n \nUnderscoring the importance of the contributions of the Gulf Cooperation \nCouncil in understanding the root causes of conflicts within its region and in conflict \nprevention, resolution and peacebuilding efforts, \n \nEmphasizing the importance of a coordinated approach to peace and security, as \nhighlighted in the report of the Secretary-General on the United Nations and conflict \n__________________ \n \n1  United Nations, Treaty Series, vol. 1288, No. 21244. \n\nA/RES/79/295 \nCooperation between the United Nations and the \nGulf Cooperation Council\n \n25-09824\n2/3 \n \nprevention: a collective recommitment,2 which provides an overview of the efforts to \nstrengthen United Nations prevention tools and initiatives, highlighting cooperation \nwith regional and subregional organizations,  \n \nTaking note of the report of the Secretary-General entitled \u201cAn Agenda for \nPeace\u201d,3 particularly section VII concerning cooperation with regional organizations, \nas well as the reports of the Secretary-General entitled \u201cSupplement to an Agenda for \nPeace\u201d4 and \u201cOur Common Agenda\u201d,5 and the outcomes of the Summit of the Future, \nincluding the Pact for the Future,6 \n \nWelcoming the convening of the Summit of the Future on 22\u201323 September 2024 \nat the United Nations Headquarters in New York at which resolution 79/1 entitled \n\u201cThe Pact for the Future\u201d and its annexes were adopted, in which the need to \nstrengthen partnerships to address global challenges was reaffirmed,  \n \nConsidering the recommendations of the high-level meetings convened \nbiennially by the Secretary-General with the heads of regional and subregional \norganizations,  \n \nRecognizing the need to strengthen cooperation between the United Nations and \nthe Gulf Cooperation Council with a view to achieving shared goals and objectives \nwithin the Charter of the United Nations in maintaining regional peace and security,  \n \nExpressing its deep appreciation to the Secretary-General for his steadfast \ncommitment and leadership in promoting partnerships for sustainable development, \nincluding addressing environmental challenges, and fostering regional cooperation in \nsupport of international peace and security,  \n \n1. \nWelcomes the enhanced partnership between the United Nations and the \nGulf Cooperation Council in the areas of conflict prevention and resolution and \nmediation;  \n \n2. \nEmphasizes the importance of high-level consultations between the \nSecretary-General of the United Nations and the Secretary-General of the Gulf \nCooperation Council, and encourages the continuation of annual strategic dialogue \nmeetings;  \n \n3. \nRequests the United Nations Secretariat, within existing resources and, \nwhere appropriate, through voluntary contributions: \n \n(a) \nTo support capacity-building initiatives within the conflict prevention and \nresolution mechanisms of the Gulf Cooperation Council; \n \n(b) \nTo provide technical assistance in developing early warning systems and \npreventive diplomacy capabilities; \n \n(c) \nTo share best practices and expertise in preventive diplomacy, mediation \nand dialogue facilitation;  \n \n4. \nEncourages the establishment of a joint working group, within existing \nresources and, where appropriate, through voluntary contributions, on regional peace \nand security: \n \n(a) \nTo develop coordinated approaches to addressing regional emerging \nthreats and challenges;  \n__________________ \n \n2  S/2015/730. \n \n3  A/47/277-S/24111. \n \n4  A/50/60-S/1995/1. \n \n5  A/75/982. \n \n6  Resolution 79/1. \n\nCooperation between the United Nations and the \nGulf Cooperation Council \nA/RES/79/295\n \n3/3\n25-09824 \n \n \n(b) \nTo enhance information-sharing and analysis of regional developments; \n \n(c) \nTo strengthen cooperation in preventive diplomacy and mediation efforts \nas well as post-conflict peacebuilding and reconciliation;  \n \n5. \nCalls for the organization of regular expert-level meetings between the \nUnited Nations and the Gulf Cooperation Council, within existing resources and, \nwhere appropriate, through voluntary contributions: \n \n(a) \nTo exchange views on regional security developments; \n \n(b) \nTo coordinate responses to regional common challenges; \n \n(c) \nTo develop joint initiatives for conflict prevention and resolution;  \n \n6. \nRequests relevant specialized United Nations agencies, programmes and \ninstitutions, within existing resources and, where appropriate, through voluntary \ncontributions, in accordance with their mandates: \n \n(a) \nTo strengthen their engagement with the Gulf Cooperation Council \nsecretariat; \n \n(b) \nTo provide technical support for capacity-building in conflict prevention \nand resolution; \n \n(c) \nTo assist in developing regional mechanisms for crisis management;  \n \n7. \nEncourages, within existing resources and, where appropriate, through \nvoluntary contributions, the development of joint training programmes and \nworkshops to enhance the institutional capacity of the Gulf Cooperation Council in: \n \n(a) \nConflict analysis and early warning; \n \n(b) \nPreventive diplomacy and mediation; \n \n(c) \nPost-conflict peacebuilding and reconciliation;  \n \n8. \nRequests the Secretary-General of the United Nations to submit to the \nGeneral Assembly, at its eightieth session, a report on the implementation of the \npresent resolution, within existing resources and, where appropriate, through \nvoluntary contributions;  \n \n9. \nDecides to include in the provisional agenda of its eightieth session, under \nthe item entitled \u201cCooperation between the United Nations and regional and other \norganizations\u201d, a sub-item entitled \u201cCooperation between the United Nations and the \nGulf Cooperation Council\u201d and to consider the sub-item again at its eighty-first \nsession and thereafter on a biennial basis. \n \n79th plenary meeting \n16 June 2025 \n \n",
  "paragraphs": {
    "1": "Welcomes the enhanced partnership between the United Nations and the Gulf Cooperation Council in the areas of conflict prevention and resolution and mediation;",
    "2": "Emphasizes the importance of high-level consultations between the Secretary-General of the United Nations and the Secretary-General of the Gulf Cooperation Council, and encourages the continuation of annual strategic dialogue meetings;",
    "3": "Requests the United Nations Secretariat, within existing resources and, where appropriate, through voluntary contributions: (a) To support capacity-building initiatives within the conflict prevention and resolution mechanisms of the Gulf Cooperation Council; (b) To provide technical assistance in developing early warning systems and preventive diplomacy capabilities; (c) To share best practices and expertise in preventive diplomacy, mediation and dialogue facilitation;",
    "4": "Encourages the establishment of a joint working group, within existing resources and, where appropriate, through voluntary contributions, on regional peace and security: (a) To develop coordinated approaches to addressing regional emerging threats and challenges; (b) To enhance information-sharing and analysis of regional developments; (c) To strengthen cooperation in preventive diplomacy and mediation efforts as well as post-conflict peacebuilding and reconciliation;",
    "5": "Calls for the organization of regular expert-level meetings between the United Nations and the Gulf Cooperation Council, within existing resources and, where appropriate, through voluntary contributions: (a) To exchange views on regional security developments; (b) To coordinate responses to regional common challenges; (c) To develop joint initiatives for conflict prevention and resolution;",
    "6": "Requests relevant specialized United Nations agencies, programmes and institutions, within existing resources and, where appropriate, through voluntary contributions, in accordance with their mandates: (a) To strengthen their engagement with the Gulf Cooperation Council secretariat; (b) To provide technical support for capacity-building in conflict prevention and resolution; (c) To assist in developing regional mechanisms for crisis management;",
    "7": "Encourages, within existing resources and, where appropriate, through voluntary contributions, the development of joint training programmes and workshops to enhance the institutional capacity of the Gulf Cooperation Council in: (a) Conflict analysis and early warning; (b) Preventive diplomacy and mediation; (c) Post-conflict peacebuilding and reconciliation;",
    "8": "Requests the Secretary-General of the United Nations to submit to the General Assembly, at its eightieth session, a report on the implementation of the present resolution, within existing resources and, where appropriate, through voluntary contributions;",
    "9": "Decides to include in the provisional agenda of its eightieth session, under the item entitled \u201cCooperation between the United Nations and regional and other organizations\u201d, a sub-item entitled \u201cCooperation between the United Nations and the Gulf Cooperation Council\u201d and to consider the sub-item again at its eighty-first session and thereafter on a biennial basis."
  },
  "agenda_items": [
    "Item 125"
  ],
  "symbol_references": [
    "A/79/L.91"
  ]
}