{
  "symbol": "A/RES/75/253",
  "filename": "A_RES_75_253.pdf",
  "title": "75/253. Special subjects relating to the proposed programme budget for 2021",
  "text": "United Nations \nA/RES/75/253 \n \n \nGeneral Assembly \nDistr.: General \n11 January 2021 \n \n21-00067 (E)    120121 \n*2100067* \n \n \nSeventy-fifth session \nAgenda item 141 \nProposed programme budget for 2021 \n \n \n \n \n Resolution adopted by the General Assembly \non 31 December 2020 \n \n \n \n \n[on the report of the Fifth Committee (A/75/682, para. 63)] \n \n \n 75/253. Special subjects relating to the proposed programme budget for 2021 \n \n \n \nThe General Assembly,  \n \n \n \nI \n \n \nRequest for a subvention to the United Nations Institute for Disarmament \nResearch resulting from the recommendations of the Board of Trustees of the \nInstitute on the work programme of the Institute for 2021 \n \n \nHaving considered the note by the Secretary-General on the request for a \nsubvention to the United Nations Institute for Disarmament Research resulting from \nthe recommendations of the Board of Trustees of the Institute1 and the related report \nof the Advisory Committee on Administrative and Budgetary Questions,2 \n \n1. \nTakes note of the note by the Secretary-General; \n \n2. \nEndorses the conclusions and recommendations contained in the report of \nthe Advisory Committee on Administrative and Budgetary Questions; \n \n3. \nApproves the request for a subvention to the United Nations Institute for \nDisarmament Research of 276,200 United States dollars (before recosting) from the \nregular budget of the United Nations, for which the provision has already been \nincluded under section 4, Disarmament, of the proposed programme budget for 2021; \n \n \n \nII \n \n \nRevised estimates resulting from resolutions and decisions adopted by the \nEconomic and Social Council at its 2020 session \n \n \nHaving considered the report of the Secretary-General3 and the related report of \nthe Advisory Committee,4 \n__________________ \n \n1 A/75/83. \n \n2 A/75/7/Add.1. \n \n3 A/75/333. \n \n4 A/75/7/Add.9. \n\nA/RES/75/253 \nSpecial subjects relating to the proposed programme budget for 2021\n \n21-00067\n2/17 \n \n \n1. \nTakes note of the report of the Secretary-General; \n \n2. \nEndorses the conclusions and recommendations contained in the report of \nthe Advisory Committee;  \n \n \n \nIII \n \n \nRevised estimates resulting from resolutions and decisions adopted by the \nEconomic and Social Council at its 2021 session \n \n \nHaving considered the report of the Secretary-General5 and the related report of \nthe Advisory Committee,6 \n \n1. \nTakes note of the report of the Secretary-General;  \n \n2. \nEndorses the conclusions and recommendations contained in the report of \nthe Advisory Committee;  \n \n3. \nAppropriates an additional amount of 78,000 dollars (net of staff \nassessment) under section 2, General Assembly and Economic and Social Council \naffairs and conference management, of the proposed programme budget for 2021, \nwhich would represent a charge against the contingency fund;  \n \n4. \nAlso appropriates an amount of 9,400 dollars under section 36, Staff \nassessment, to be offset by an equivalent amount under income section 1, Income \nfrom staff assessment, of the proposed programme budget for 2021;  \n \n \n \nIV \n \n \nRevised estimates resulting from resolutions and decisions adopted by the \nGeneral Assembly at its seventy-fourth session  \n \n \nHaving considered the report of the Secretary-General7 and the related report of \nthe Advisory Committee,8 \n \n1. \nTakes note of the report of the Secretary-General;  \n \n2. \nEndorses the conclusions and recommendations contained in the report of \nthe Advisory Committee;  \n \n3. \nAppropriates an additional amount of 1,590,700 dollars (non-recurrent), \ncomprising 1,024,600 dollars under section 2, General Assembly and Economic and \nSocial Council affairs and conference management, and 566,100 dollars under section \n16, International drug control, crime and terrorism prevention and criminal justice, of \nthe proposed programme budget for 2021, representing a charge against the \ncontingency fund;  \n \n4. \nAlso appropriates an amount of 3,300 dollars under section 36, Staff \nassessment, to be offset by an equivalent amount under income section 1, Income \nfrom staff assessment, of the proposed programme budget for 2021;  \n \n \n \nV \n \n \nEnterprise resource planning project, Umoja \n \n \nRecalling section II of its resolution 60/283 of 7 July 2006, section II of its \nresolution 63/262 of 24 December 2008, its resolution 64/243 of 24 December 2009, \nsection II.A of its resolution 65/259 of 24 December 2010, its resolution 66/246 of \n24 December 2011, section III of its resolution 66/263 of 21 June 2012, section III of \n__________________ \n \n5 A/75/608. \n \n6 A/75/7/Add.24. \n \n7 A/75/556. \n \n8 A/75/7/Add.22. \n\nSpecial subjects relating to the proposed programme budget for 2021 \nA/RES/75/253\n \n3/17\n21-00067 \n \nits resolution 67/246 of 24 December 2012, its resolution 68/246 of 27 December \n2013, sections IV and VI of its resolution 69/274 A of 2 April 2015, section XVII of \nits resolution 70/248 A of 23 December 2015, section XIV of its resolution 71/272 A \nof 23 December 2016, section XXI of its resolution 72/262 A of 24 December 2017, \nsection XVII of its resolution 73/279 A of 22 December 2018 and section XVII of its \nresolution 74/263 of 27 December 2019, \n \nHaving considered the twelfth and final progress report of the Secretary-General \non the enterprise resource planning project,9 the note by the Secretary-General \ntransmitting the ninth annual progress report of the Board of Auditors on the \nimplementation of the United Nations enterprise resource planning system10 and the \nrelated report of the Advisory Committee,11 \n \n1. \nTakes note of the report of the Secretary-General and the note by the \nSecretary-General; \n \n2. \nAlso takes note of the findings of the report of the Board of Auditors, and \nendorses the recommendations contained therein; \n \n3. \nEndorses the conclusions and recommendations contained in the report of \nthe Advisory Committee; \n \n4. \nApproves the resource requirements of 25,483,100 dollars for 2021 for the \nEnterprise Resource Planning Solution Division; \n \n5. \nAlso approves an amount of 3,822,500 dollars under the proposed \nprogramme budget for 2021 under subprogramme 1, component 1, Enterprise \nresource planning solution, of section 29A, Department of Management Strategy, \nPolicy and Compliance, representing the regular budget share for the costs of the \nDivision for 2021; \n \n6. \nRevises the appropriation under the proposed programme budget for 2021 \nby reducing the provisions under section 29A, Department of Management Strategy, \nPolicy and Compliance, by an amount of 77,500 dollars; \n \n7. \nNotes that resource requirements in the amount of 15,799,500 dollars will \nbe included in the subsequent requirements for the support account for peacekeeping \noperations for the financial period from 1 July 2021 to 30 June 2022; \n \n8. \nAlso notes that requirements in the amount of 5,861,100 dollars will be \nfunded from extrabudgetary resources in the financial year 2021; \n \n9. \nApproves the resource requirements of 3,695,400 dollars for 2021 for the \nbusiness support activities, to be funded from the unused balance at the end of 2020, \ncurrently estimated at 12,082,200 dollars;  \n \n \nVI \n \n \nAdministrative and financial implications of the decisions and recommendations \ncontained in the report of the International Civil Service Commission for 2020 \n \n \nHaving considered the statement submitted by the Secretary-General in \naccordance with rule 153 of the rules of procedure of the General Assembly12 and the \nrelated report of the Advisory Committee,13 \n \n1. \nRecalls its resolution 75/245 of 31 December 2020;  \n__________________ \n \n9 A/75/386. \n \n10 A/75/159. \n \n11 A/75/7/Add.14. \n \n12 A/C.5/75/11. \n \n13 A/75/7/Add.21.  \n\nA/RES/75/253 \nSpecial subjects relating to the proposed programme budget for 2021\n \n21-00067\n4/17 \n \n \n2. \nTakes note of the statement submitted by the Secretary-General; \n \n3. \nEndorses the conclusions and recommendations contained in the report of \nthe Advisory Committee; \n \n \n \nVII \n \n \nRevised estimates resulting from resolutions and decisions adopted by the \nHuman Rights Council at its forty-third, forty-fourth and forty-fifth sessions \nand revised estimates resulting from decision OS/14/101, adopted at the \norganizational session for the fifteenth cycle of the Council  \n \n \nHaving considered the reports of the Secretary-General14 and the related reports \nof the Advisory Committee,15 \n \n1. \nTakes note of the reports of the Secretary-General; \n \n2. \nEndorses the conclusions and recommendations contained in the reports \nof the Advisory Committee; \n \n3. \nAppropriates an additional amount of 25,046,200 dollars (of which \n24,198,300 dollars is non-recurrent), comprising 2,456,900 dollars (of which \n2,315,600 dollars is non-recurrent) under section 2, General Assembly and Economic \nand Social Council affairs and conference management, 22,507,900 dollars (of which \n21,812,700 dollars is non-recurrent) under section 24, Human rights, 9,300 dollars \nunder section 28, Global communications, and 72,100 dollars (of which 70,000 \ndollars is non-recurrent) under section 29E, Administration, Geneva, of the proposed \nprogramme budget for 2021;  \n \n4. \nAlso appropriates an amount of 2,291,900 dollars under section 36, Staff \nassessment, to be offset by an equivalent amount under income section 1, Income \nfrom staff assessment, of the proposed programme budget for 2021; \n \n \n \nVIII \n \n \nRevised estimates relating to the proposed programme budget for 2021 under \nsection 27, Humanitarian assistance, and section 36, Staff assessment, for the \nUnited Nations Monitoring Mechanism for the Syrian Arab Republic \n \n \nHaving considered the report of the Secretary-General16 and the related report \nof the Advisory Committee,17 \n \n1. \nTakes note of the report of the Secretary-General; \n \n2. \nEndorses the conclusions and recommendations contained in the report of \nthe Advisory Committee; \n \n3. \nApproves the continuation of 19 positions (1 D-1, 2 P-4, 3 P-3, 3 P-2, \n1 National Professional Officer, 6 Local level and 3 United Nations Volunteers) under \nsection 27, Humanitarian assistance, of the proposed programme budget for 2021, for \nthe period from 1 January to 31 December 2021;  \n \n4. \nAppropriates an additional amount of 1,922,600 dollars (net of staff \nassessment) for the United Nations Monitoring Mechanism for the Syrian Arab \nRepublic for the period from 1 January to 31 December 2021, under section 27, \nHumanitarian assistance, of the proposed programme budget for 2021, which would \nrepresent a charge against the contingency fund;  \n__________________ \n \n14 A/75/588 and A/75/588/Add.1. \n \n15 A/75/7/Add.30 and A/75/7/Add.31.  \n \n16 A/75/372. \n \n17 A/75/7/Add.17. \n\nSpecial subjects relating to the proposed programme budget for 2021 \nA/RES/75/253\n \n5/17\n21-00067 \n \n \n5. \nAlso appropriates an amount of 194,900 dollars under section 36, Staff \nassessment, to be offset by an equivalent amount under income section 1, Income \nfrom staff assessment, of the proposed programme budget for 2021;  \n \n \n \nIX \n \n \nStrategic heritage plan of the United Nations Office at Geneva \n \n \nRecalling part XI of its resolution 64/243, section VII of its resolution 66/247 \nof 24 December 2011, section V of its resolution 68/247 A of 27 December 2013, \nsections III and VII of its resolution 69/262 of 29 December 2014, section X of its \nresolution 70/248 A, section XVIII of its resolution 71/272 A, section XVI of its \nresolution 72/262 A, section XIII of its resolution 73/279 A and section VII of its \nresolution 74/263,  \n \nHaving considered the seventh annual progress report of the Secretary-General \non the strategic heritage plan of the United Nations Office at Geneva, 18 the note by \nthe Secretary-General transmitting the report of the Board of Auditors on the strategic \nheritage plan of the United Nations Office at Geneva19 and the related report of the \nAdvisory Committee,20 \n \n1. \nTakes note of the report of the Secretary-General;  \n \n2. \nAlso takes note of the findings of the report of the Board of Auditors, and \nendorses the recommendations contained therein;  \n \n3. \nEndorses the conclusions and recommendations contained in the report of \nthe Advisory Committee;  \n \n4. \nWelcomes the continued support of the Government of Switzerland for the \nconstruction project in Geneva;  \n \n5. \nStresses the importance of close coordination between the strategic \nheritage plan project team and the Secretariat in New York, in particular the Global \nAsset Management Policy Service, to ensure success in all aspects of the project;  \n \n6. \nAlso stresses the importance of effective governance, oversight, \ntransparency and accountability in the management of the project to ensure that the \nproject objectives are achieved on time and within budget;  \n \n7. \nRequests \nthe \nSecretary-General \nto \nensure \nthat \nthe \nremaining \nrecommendations of the Board of Auditors are implemented fully and expeditiously;  \n \n8. \nReiterates its request to preserve the historical heritage of the Palais des \nNations;  \n \n9. \nNotes with concern that it is very unlikely that the full baseline project \nscope will be achieved within the approved maximum overall cost, and in this regard \nrequests the Secretary-General to make every effort to avoid budget increases through \nthe application of sound project management practices and to ensure that the project \nis completed within the project scope and overall cost approved in its resolution \n70/248 A;  \n \n10. Also notes with concern the increased risks to the project schedule and cost \nas well as the continuously decreasing level of confidence, currently at 2 per cent, \nand requests the Secretary-General to take all necessary mitigation measures in a \ntimely manner, in order to alleviate potential risks of delays;  \n__________________ \n \n18 A/75/355. \n \n19 A/75/135. \n \n20 A/75/7/Add.12. \n\nA/RES/75/253 \nSpecial subjects relating to the proposed programme budget for 2021\n \n21-00067\n6/17 \n \n \n11. Reaffirms the proposed project scope, schedule and estimated cost of the \nstrategic heritage plan in the maximum amount of 836,500,000 Swiss francs;  \n \n12. Requests the Secretary-General to ensure that any change that affects the \nscope of the strategic heritage plan project is presented for the consideration and \ndecision of the General Assembly;  \n \n13. Recalls paragraph 9 of the report of the Advisory Committee, and regrets \nthat the project started suffering delays and cost escalation before the onset of the \ncoronavirus disease (COVID-19) pandemic; \n \n14. Commends the United Nations Office at Geneva for ensuring the business \ncontinuity of conferences throughout the duration of the renovation works by \ncompleting a modular temporary conference facility;  \n \n15. Requests the Secretary-General to continue to ensure that the procurement \nof goods and services for the construction project is carried out in strict compliance \nwith the existing regulations, rules and relevant provisions of General Assembly \nresolutions governing procurement in the United Nations;  \n \n16. Recalls paragraph 16 of its resolution 69/273 of 2 April 2015, reaffirms \nthe importance of transparency in the procurement process, and requests the \nSecretary-General to ensure that the project team takes vendors from developing \ncountries and countries with economies in transition fully into account when \ncontracting and subcontracting and to report on the specific steps taken and progress \nachieved in the context of increasing procurement opportunities for vendors from \ndeveloping countries and countries with economies in transition in the \nimplementation of the strategic heritage plan;  \n \n17. Recalls the project\u2019s objective to lower energy consumption at the Palais \ndes Nations by at least 25 per cent compared with the 2010 baseline;  \n \n18. Stresses the need to gather sound and reliable baseline data on energy \nconsumption and energy costs that can be used to measure actual improvements \nachieved after completion of the renovation of the Palais des Nations, and requests \nthe Secretary-General to provide comprehensive information on energy usage and \nconsumption and costs of utilities as early as available;  \n \n19. Decides to continue to use the multi-year construction-in-progress account \nestablished within the regular budget for expenditures related to the strategic heritage \nplan in 2021; \n \n20. Also decides to revert to the establishment of an assessment scheme and \ncurrency of appropriation and assessment for the strategic heritage plan at the main \npart of its seventy-sixth session, and requests the Secretary-General to provide \nupdated detailed information on these issues;  \n \n21. Further decides to revert to the establishment of the multi-year special \naccount for the strategic heritage plan at the main part of its seventy-sixth session;  \n \n22. Decides that the annual repayments of the loans to the host country will \nbe funded under the regular budget until decided otherwise by the General Assembly;  \n \n23. Appreciates the existing voluntary contributions received from Member \nStates to finance the strategic heritage plan, and requests the Secretary-General to \nremain proactive in seeking both voluntary and in-kind contributions from Member \nStates, as well as donations by private entities, in full compliance with all relevant \nrules and regulations of the Organization and agreements related to donations for the \nstrategic heritage plan, and to provide detailed information on this matter in the \ncontext of his next progress report;  \n\nSpecial subjects relating to the proposed programme budget for 2021 \nA/RES/75/253\n \n7/17\n21-00067 \n \n \n24. Encourages the Secretary-General, in attracting voluntary and in-kind \ncontributions from Member States, to give priority to those activities within the scope \nof the project; \n \n25. Appropriates the amount of 53,121,200 dollars (equivalent to 47,596,600 \nSwiss francs) for 2021, under section 33, Construction, alteration, improvement and \nmajor maintenance, of the proposed programme budget for 2021; \n \n \n \nX \n \n \nProgress in the renovation of Africa Hall at the Economic Commission for \nAfrica in Addis Ababa \n \n \nRecalling section III of its resolution 65/259, section VII of its resolution \n66/247, section III of its resolution 68/247 A, section V of its resolution 69/262, \nsection IX of its resolution 70/248 A, section V of its resolution 71/272 A, section XII \nof its resolution 72/262 A, section VIII of its resolution 73/279 A and section X of its \nresolution 74/263, \n \nHaving considered the report of the Secretary-General21 and the related report \nof the Advisory Committee,22  \n \n1. \nTakes note of the report of the Secretary-General; \n \n2. \nEndorses the conclusions and recommendations contained in the report of \nthe Advisory Committee; \n \n3. \nExpresses gratitude to the Government of Ethiopia, as the host country, \nfor its continued support for the project, notes with appreciation the signature of two \nagreements with the city of Addis Ababa and the Government of Ethiopia for the use \nof parcels of land adjoining the compound of the Economic Commission for Africa \nin Addis Ababa by the Commission at no cost, and encourages the Secretary-General \nto continue to engage with the host country, inter alia in protecting the environment, \nincluding the greening of the compound and public spaces in its vicinity; \n \n4. \nAppreciates the contributions by the Government of Mali and the \nGovernment of Ethiopia and the pledge by the Government of Switzerland, and \nreiterates its request to the Secretary-General to continue to seek both voluntary and \nin-kind contributions from Member States, in full compliance with all relevant \nregulations and rules of the Organization, and to provide detailed information on the \nmatter in the context of his next progress report; \n \n5. \nStresses the importance of governance, effective oversight, transparency \nand accountability in the management of the project to ensure that the objectives of \nthe project are achieved within the approved budget and time schedule; \n \n6. \nEmphasizes that the Global Asset Management Policy Service should \ncontinue to be actively involved in overseeing the project to ensure the central \nsupervision of capital projects, including risk management and alignment with \nlessons learned, and encourages the Secretary-General to continue to engage with the \nStakeholders Committee, the Advisory Board and the host country to improve \ncoordination efforts in the implementation of the project; \n \n7. \nAlso emphasizes the need for the Office of Internal Oversight Services to \ncontinue to provide oversight on the renovation of Africa Hall, as appropriate, and to \ncontinue to include information on key findings; \n__________________ \n \n21 A/75/319. \n \n22 A/75/7/Add.15. \n\nA/RES/75/253 \nSpecial subjects relating to the proposed programme budget for 2021\n \n21-00067\n8/17 \n \n \n8. \nReiterates its request to the Secretary-General to include an update on the \nmanagement of the main risks and the related mitigation measures, with a view to \nkeeping the approved time frame of the project, to avoiding cost overruns and to \nensuring the delivery of the project within the scope, budget and timeline, as approved \nby the General Assembly, and requests an update in the context of his next progress \nreport; \n \n9. \nStresses the importance of working with tenderers and contractors to \nensure early and clear warning indicators of any financial distress affecting \ncontractors and subcontractors, which may affect the project, and requests the \nSecretary-General to complete the hiring of a new contractor for the main renovation \nworks in compliance with the United Nations legislative framework on procurement \nand availing of the lessons learned and good practices from other similar construction \nprojects; \n \n10. Encourages the Secretary-General to continue to utilize local knowledge, \nmaterial, technology and capacity throughout the implementation of construction and \nrenovation projects at the Economic Commission for Africa in Addis Ababa, as \nappropriate; \n \n11. Expresses appreciation for the continued commitment of the Secretary-\nGeneral to ensure the preservation of the historical and architectural integrity of \nAfrica Hall, and reiterates its request that the Secretary-General enhance efforts to \nengage key stakeholders in implementing the heritage conservation objective, to raise \nglobal awareness of the historic Africa Hall and the African heritage that it represents, \nand to cultivate partnerships with regional and international academic and research \ninstitutions, including universities and museums, specializing in African history and \nculture; \n \n12. Recalls its request in section X of resolution 74/263 on admission options, \nincluding fee exemptions and an outreach strategy, and requests the Secretary-General \nto report thereon in his next progress report; \n \n13. Recalls paragraph 20 of the report of the Advisory Committee, and \nrequests the Secretary-General to provide the updated information requested in \nsection VIII of resolution 73/279 A and section X of resolution 74/263 on the \nenvisaged energy efficiency gains and resulting cost savings, and encourages the \napplication of best practices and lessons from other similar United Nations \nconstruction projects, as appropriate; \n \n14. Welcomes the steps taken by the Secretary-General to ensure conformity \nof Africa Hall and its visitors\u2019 centre with relevant building codes and standards, as \nwell as best practices for persons with disabilities; \n \n15. Requests the Secretary-General to submit, at the main part of the seventy-\nsixth session, a progress report on the renovation of Africa Hall and the construction \nof conference facilities, the visitors\u2019 centre and the parking lot outlining, inter alia, \nproject expenditures and total costs; \n \n16. Approves the establishment of one new temporary project position \n(Contracts Manager, P-3), beginning in 2021; \n \n \n \nXI \n \n \nProgress on the renovation of the North Building at the Economic Commission \nfor Latin America and the Caribbean in Santiago \n \n \nRecalling section VII of its resolution 69/274 A, section VI of its resolution \n70/248 B of 1 April 2016, section V of its resolution 72/262 A, section X of its \nresolution 73/279 A and section XI of its resolution 74/263, \n\nSpecial subjects relating to the proposed programme budget for 2021 \nA/RES/75/253\n \n9/17\n21-00067 \n \n \nHaving considered the report of the Secretary-General23 and the related report \nof the Advisory Committee,24 \n \n1. \nTakes note of the report of the Secretary-General; \n \n2. \nEndorses the conclusions and recommendations contained in the report of \nthe Advisory Committee, subject to the provisions of the present resolution; \n \n3. \nAcknowledges the important role played by the host countries in \nfacilitating the maintenance and construction of United Nations facilities, and stresses \nthe value of continued collaboration with host countries in this regard; \n \n4. \nExpresses its gratitude to the Government of Chile, as the host country, \nfor its continued efforts in supporting and facilitating the work of the Economic \nCommission for Latin America and the Caribbean; \n \n5. \nRequests the Secretary-General to remain proactive in seeking both \nvoluntary and in-kind contributions from Member States, in full compliance with all \nrelevant regulations and rules of the Organization, and to provide detailed information \non the matter in the context of his next progress report; \n \n6. \nStresses the importance of governance, effective oversight, transparency \nand accountability in the management of the project to ensure that its objectives are \nachieved within the scope, budget and timeline approved by the General Assembly; \n \n7. \nEmphasizes that the Global Asset Management Policy Service should \ncontinue to be actively involved in overseeing the project to ensure the central \nsupervision of capital projects, including risk management and alignment with \nlessons learned; \n \n8. \nRecalls paragraph 13 of the report of the Advisory Committee, requests \nthe Secretary-General to closely monitor and mitigate all project risks and take all \nmeasures necessary to ensure the delivery of the project within the scope, budget and \ntimeline, as approved by the General Assembly, and also requests the Secretary-\nGeneral to include information on risk management and mitigation measures taken in \nhis next progress report; \n \n9. \nReiterates its request to the Secretary-General to ensure that the project \ndelivers renovation works that conform to relevant building codes and standards, \nincluding provisions for persons with disabilities concerning accessibility, technology \nand workplace safety; \n \n10. Takes note of paragraph 16 of the report of the Advisory Committee; \n \n11. Recalls paragraph 18 of the report of the Advisory Committee, and \nrequests the Secretary-General to provide more detailed information regarding the \nseismic mitigation measures in his future reports on the renovation of the North \nBuilding at the Economic Commission for Latin America and the Caribbean; \n \n12. Also recalls paragraph 22 of the report of the Advisory Committee, \nwelcomes the planned renovation of the North Building at the Economic Commission \nfor Latin America and the Caribbean as a sustainable and energy-efficient building \nwhere the total amount of energy used by the building on an annual basis is equal to \nor less than the amount of renewable energy generated on site; \n \n13. Requests the Secretary-General to continue the annual review of the role \nand funding ratio of the position of Project Coordinator (P-3) jointly funded by the \n__________________ \n \n23 A/75/347. \n \n24 A/75/7/Add.11. \n\nA/RES/75/253 \nSpecial subjects relating to the proposed programme budget for 2021\n \n21-00067\n10/17 \n \nEconomic Commission for Latin America and the Caribbean and the United Nations \nOffice at Nairobi, and to provide detailed information in his next report; \n \n14. Appropriates an amount of 1,583,000 dollars for the project in 2021, \ncomprising 158,500 dollars under section 21, Economic and social development in \nLatin America and the Caribbean, and 1,424,500 dollars under section 33, \nConstruction, alteration, improvement and major maintenance, of the proposed \nprogramme budget for 2021, which would represent a charge against the contingency \nfund;  \n \n \n \nXII \n \n \nSeismic mitigation retrofit and life-cycle replacements project at the Economic \nand Social Commission for Asia and the Pacific premises in Bangkok \n \n \nRecalling section XII of its resolution 70/248 A, section IV of its resolution \n71/272 A, section XIII of its resolution 72/262 A, section VII of its resolution 73/279 \nA and section XII of its resolution 74/263, \n \nHaving considered the report of the Secretary-General25 and the related report \nof the Advisory Committee,26 \n \n1. \nTakes note of the report of the Secretary-General; \n \n2. \nEndorses the conclusions and recommendations contained in the report of \nthe Advisory Committee, subject to the provisions of the present resolution; \n \n3. \nExpresses its gratitude to the Government of Thailand, as the host country, \nfor its continued efforts in supporting and facilitating the work of the Economic and \nSocial Commission for Asia and the Pacific; \n \n4. \nWelcomes the positive steps taken towards engaging with the host country, \nand encourages the Economic and Social Commission for Asia and the Pacific to \ncontinue to engage with the host country in this regard; \n \n5. \nReiterates its request to the Secretary-General to remain proactive in \nseeking both voluntary and in-kind contributions from Member States, in full \ncompliance with all relevant rules and regulations of the Organization, and to provide \ndetailed information on the matter in the context of his next progress report; \n \n6. \nStresses the importance of governance, effective oversight, transparency \nand accountability in the management of the project to ensure that the objectives of \nthe project are achieved within budget and in a timely manner; \n \n7. \nEmphasizes that the Global Asset Management Policy Service should \ncontinue to be actively involved in overseeing the project to ensure the central \nsupervision of capital projects, including risk management and alignment with \nlessons learned; \n \n8. \nRecalls paragraph 7 of section XII of its resolution 74/263, and requests \nthe Secretary-General to incorporate, in the next progress report, best practices, \nstrategies and lessons learned, and to continue to draw from experience and \nknowledge acquired from other capital projects to ensure that the objectives of the \nproject are achieved within budget and in a timely manner; \n \n9. \nRequests the Secretary-General to continue to take into account lessons \nlearned and best practices from past construction and renovation projects and, in \nparticular, to draw from experience and knowledge acquired from other capital projects; \n__________________ \n \n25 A/75/235. \n \n26 A/75/7/Add.10. \n\nSpecial subjects relating to the proposed programme budget for 2021 \nA/RES/75/253\n \n11/17\n21-00067 \n \n \n10. Recalls paragraph 12 of the report of the Advisory Committee, and \nrequests the Secretary-General to proactively monitor and mitigate all project risks, \nto take all measures necessary to ensure the delivery of the project within the scope, \nbudget and timeline approved by the General Assembly and to include in his next \nprogress report an update on risk management and related mitigation measures; \n \n11. Welcomes the steps taken by the Secretary-General to ensure that the \nEconomic and Social Commission for Asia and the Pacific building is compliant with \nrelevant building standards and best practices for persons with disabilities, and \nrequests the Secretary-General to provide an update on relevant progress made in his \nnext report; \n \n12. Takes note of paragraph 14 of the report of the Advisory Committee; \n \n13. Encourages the Secretary-General to continue his efforts to include the \nuse of local materials, labour and expertise throughout the implementation of the \nconstruction project, as appropriate; \n \n14. Appropriates an amount of 6,321,600 dollars for project activities in 2021, \ncomprising 1,083,800 dollars under section 19, Economic and social development in \nAsia and the Pacific, and 5,237,800 dollars under section 33, Construction, alteration, \nimprovement and major maintenance, of the proposed programme budget for 2021, \nwhich would represent a charge against the contingency fund; \n \n \n \nXIII \n \n \nProgress on the implementation of a flexible workplace at \nUnited Nations Headquarters  \n \n \nRecalling section V of its resolution 67/246, section III of its resolution 67/254 \nA of 12 April 2013, section IV of its resolution 68/247 B of 9 April 2014, section VII \nof its resolution 69/274 A, section XVI of its resolution 71/272 A, section XI of its \nresolution 72/262 A, section VI of its resolution 73/279 A and section IX of its \nresolution 74/263,  \n \nHaving considered the report of the Secretary-General27 and the related report \nof the Advisory Committee,28 \n \n1. \nTakes note of the report of the Secretary-General;  \n \n2. \nEndorses the conclusions and recommendations contained in the report of \nthe Advisory Committee;  \n \n3. \nApproves the continuation of two temporary positions (1 P-5 and 1 General \nService (Other level)) for the project team in 2021 for six months;  \n \n4. \nAppropriates an amount of 145,700 dollars for the project costs under \nsection 29B, Department of Operational Support, of the proposed programme budget \nfor 2021, for project supervision and management for a period of up to six months, \nwhich would represent a charge against the contingency fund; \n \n \n \nXIV \n \n \nProgress on the replacement of office blocks A to J at the United Nations Office \nat Nairobi \n \n \nRecalling section XIV of its resolution 72/262 A, section IX of its resolution \n73/279 A and section XIII of its resolution 74/263,  \n__________________ \n \n27 A/75/342. \n \n28 A/75/7/Add.13. \n\nA/RES/75/253 \nSpecial subjects relating to the proposed programme budget for 2021\n \n21-00067\n12/17 \n \n \nHaving considered the report of the Secretary-General29 and the related report \nof the Advisory Committee,30 \n \n1. \nTakes note of the report of the Secretary-General;  \n \n2. \nEndorses the conclusions and recommendations contained in the report of \nthe Advisory Committee, subject to the provisions of the present resolution;  \n \n3. \nAcknowledges the important role played by the host country in facilitating \nthe maintenance and construction of United Nations facilities in Nairobi, and stresses \nthe value of continued collaboration with the host country in this regard;  \n \n4. \nExpresses its gratitude to the host country for its continued support for the \nUnited Nations Office at Nairobi, and trusts that the Secretary-General will continue \nto engage, as appropriate, with the host country as has been the practice with respect \nto other construction projects at the Office;  \n \n5. \nReiterates its request to the Secretary-General to remain proactive in \nseeking both voluntary and in-kind contributions from Member States, in full \ncompliance with all relevant rules and regulations of the Organization, and to provide \ndetailed information on the matter in the context of his next progress report;  \n \n6. \nStresses the importance of governance, effective oversight, transparency \nand accountability in the management of the project to ensure that the objectives of \nthe project are achieved within the approved budget and time schedule;  \n \n7. \nRequests the Secretary-General, through the Global Asset Management \nPolicy Service, to take into account lessons learned and best practices from similar \npast United Nations construction and renovation projects in the planning, design and \nimplementation of the proposed replacement of office blocks A to J;  \n \n8. \nEmphasizes that the Global Asset Management Policy Service should \ncontinue to be actively involved in overseeing the project to ensure the central \nsupervision of capital projects, including risk management and alignment with \nlessons learned;  \n \n9. \nEncourages the Secretary-General to continue to make every effort in \nimplementing measures against slippages in the timeline of the project, and to \nmitigate their potential impact on project costs and completion time;  \n \n10. Takes note of paragraph 13 of the report of the Advisory Committee;  \n \n11. Recalls paragraph 11 of section XIII of its resolution 74/263, and reiterates \nits request to the Secretary-General for an updated proposal, including refined \ninformation on the full scope, maximum overall cost and implementation strategy;  \n \n12. \nAlso recalls paragraph 23 of the report of the Advisory Committee, and \nrequests the Secretary-General to also provide complete details of potential cost-sharing \narrangements regarding design, construction, project management and operational costs \nwith the Office of the United Nations High Commissioner for Refugees and the \nInternational Organization for Migration in the context of the next progress report;  \n \n13. \nEncourages the Secretary-General to continue his efforts to include local \nknowledge, technology, material and capacity, in particular the use of materials available \nand/or manufactured locally throughout the implementation of the replacement of office \nblocks A to J at the United Nations Office at Nairobi, as appropriate;  \n \n14. \nRequests the Secretary-General to incorporate the envisaged renewable \nenergy efficiency measures, wastewater treatment, solid waste management and water \n__________________ \n \n29 A/75/331. \n \n30 A/75/7/Add.16. \n\nSpecial subjects relating to the proposed programme budget for 2021 \nA/RES/75/253\n \n13/17\n21-00067 \n \nmanagement into the design and construction of the United Nations Office at Nairobi \nproject on office blocks A to J, including lessons learned from other construction projects;  \n \n15. Also requests the Secretary-General to ensure conformity with relevant \nbuilding codes and standards, as well as best practices for persons with disabilities, in \nthe design, construction and renovation of United Nations Office at Nairobi facilities;  \n \n16. Appropriates an amount of 7,974,500 dollars, comprising 765,600 dollars \nunder section 29G, Administration, Nairobi, 7,157,300 dollars under section 33, \nConstruction, alteration, improvement and major maintenance, and 51,600 dollars \nunder section 34, Safety and security, of the proposed programme budget for 2021, \nwhich would represent a charge against the contingency fund;  \n \n \n \nXV \n \n \nGlobal service delivery model for the United Nations Secretariat  \n \n \nRecalling section III of its resolution 67/246, paragraph 13 of section VII of its \nresolution 69/262, paragraph 19 of its resolution 69/273, section XIX of its resolution \n70/248 A, section XVII of its resolution 71/272 A, section IV of its resolution \n72/262 C of 5 July 2018 and its resolution 74/296 of 13 July 2020,  \n \nHaving considered the report of the Secretary-General31 and the related report \nof the Advisory Committee,32 \n \nDecides to keep the question of the global service delivery model under review \nand to revert on the status of the above-mentioned reports at the main part of its \nseventy-sixth session;33 \n \n \n \nXVI \n \n \nRequest for a subvention to the Residual Special Court for Sierra Leone  \n \n \nRecalling its resolution 58/284 of 8 April 2004, section VII of its resolution \n59/276 of 23 December 2004, section II of its resolution 59/294 of 22 June 2005, \nsection XII of its resolution 65/259, section IX of its resolution 66/247, section I of \nits resolution 67/246, section VII of its resolution 70/248 A, section III of its \nresolution 71/272 A, section VIII of its resolution 72/262 A, section III of its \nresolution 73/279 A and section VI of its resolution 74/263,  \n \nHaving considered the report of the Secretary-General on the use of the \ncommitment authority and request for a subvention to the Residual Special Court for \nSierra Leone34 and the related report of the Advisory Committee,35 \n \n1. \nTakes note of the report of the Secretary-General; \n \n2. \nEndorses the conclusions and recommendations contained in the report of \nthe Advisory Committee; \n \n3. \nReaffirms the high priority accorded to the work of the Residual Special \nCourt for Sierra Leone;  \n \n4. \nWelcomes the in-kind multiform support provided by the Government of Sierra \nLeone to the Residual Special Court, including the provision of rent-free office space;  \n__________________ \n \n31 A/73/706. \n \n32 A/73/791. \n \n33 Postponement of the decision on whether the reports should continue to be considered, whether \nthe General Assembly should request the Secretary-General to submit a new, updated or revised \nreport or whether no action should be taken on the reports. \n \n34 A/75/343. \n \n35 A/75/7/Add.20. \n\nA/RES/75/253 \nSpecial subjects relating to the proposed programme budget for 2021\n \n21-00067\n14/17 \n \n \n5. \nAlso welcomes the support provided by several countries, including \nvoluntary contributions, pro bono annual audit of the Residual Special Court and in-\nkind support in enforcing sentences, relocating witnesses, housing the archives of the \nResidual Special Court and hosting fundraising activities;  \n \n6. \nEncourages all Member States to provide voluntary support for the \nResidual Special Court;  \n \n7. \nAuthorizes the Secretary-General to enter into commitments in an amount \nnot to exceed 2,537,000 dollars to supplement the voluntary financial resources of the \nResidual Special Court for the period from 1 January to 31 December 2021, and \nrequests the Secretary-General to report on the use of the commitment authority in \nthe context of his next report; \n \n \n \nXVII \n \n \nInternational Trade Centre \n \n \nRecalling its resolution 75/252 of 31 December 2020 on questions relating to \nthe proposed programme budget for 2021;  \n \nApproves resources in the amount of 20,641,500 dollars (the United Nations \nshare equivalent to 50 per cent of 36,996,100 Swiss francs at the exchange rate of \n0.896 Swiss francs to 1 dollar) proposed for 2021 under section 13, International \nTrade Centre, of the proposed programme budget for 2021;  \n \n \n \nXVIII \n \n \nEstimates in respect of special political missions, good offices and other political \ninitiatives authorized by the General Assembly and/or the Security Council \n \n \nHaving considered the reports of the Secretary-General36 and the related reports \nof the Advisory Committee,37 \n \n1. \nTakes note of the reports of the Secretary-General; \n \n2. \nEndorses the conclusions and recommendations contained in the reports \nof the Advisory Committee; \n \n3. \nApproves the budgets in the amount of 728,212,200 dollars for the 40 \ncontinuing special political missions authorized by the General Assembly and/or the \nSecurity Council, and an amount of 1,412,400 dollars for the share of special political \nmissions in the budget of the Regional Service Centre in Entebbe, Uganda, for 2021;  \n \n4. \nAppropriates, under the procedures provided for in paragraph 11 of annex I \nto resolution 41/213 of 19 December 1986, an additional amount of 34,070,400 dollars \nunder section 3, Political affairs, of the proposed programme budget for 2021, for the \nUnited Nations Integrated Transition Assistance Mission in the Sudan;  \n \n5. \nAlso appropriates the related staff assessment portion in the amount of \n1,944,200 dollars under section 36, Staff assessment, to be offset by a corresponding \namount under income section 1, Income from staff assessment, of the proposed \nprogramme budget for 2021;  \n \n__________________ \n \n36 A/75/6 (Sect. 3)/Add.1, A/75/6 (Sect. 3)/Add.2, A/75/6 (Sect. 3)/Add.3, A/75/6 (Sect. 3)/Add.4, \nA/75/6 (Sect. 3)/Add.5, A/75/6 (Sect. 3)/Add.6, A/75/6 (Sect. 3)/Add.6/Corr.1 and A/75/6 \n(Sect. 3)/Add.7.  \n \n37 A/75/7/Add.2, A/75/7/Add.3, A/75/7/Add.4, A/75/7/Add.5, A/75/7/Add.6, A/75/7/Add.7 and \nA/75/7/Add.8. \n\nSpecial subjects relating to the proposed programme budget for 2021 \nA/RES/75/253\n \n15/17\n21-00067 \n \n \n \nXIX \n \n \nRevised estimates relating to the proposed programme budget for 2021 under \nsection 11, United Nations support for the New Partnership for Africa\u2019s \nDevelopment, and section 36, Staff assessment, for the Office of the Special \nAdviser on Africa  \n \n \nHaving considered the report of the Secretary-General38 and the related report \nof the Advisory Committee,39 \n \n1. \nTakes note of the report of the Secretary-General; \n \n2. \nEndorses the conclusions and recommendations contained in the report of \nthe Advisory Committee; \n \n3. \nReaffirms that the development of Africa is an established priority of the \nUnited Nations, and recalls its commitment to address the unique needs of Africa;  \n \n4. \nRecalls paragraph 9 of the report of the Advisory Committee, and stresses \nthat while it is the prerogative of the General Assembly to consider and approve \nproposals, reaffirms that the Committee for Programme and Coordination is mandated \nto review the plan outline and programme plan of the proposed programme budget \nand to make recommendations thereon to the Assembly;  \n \n5. \nRequests the Secretary-General to submit, through the Committee for \nProgramme and Coordination and the Advisory Committee, for its consideration, a \nrevised proposal with programmatic narratives and structure of the Office of the \nSpecial Adviser on Africa, during its seventy-sixth session;  \n \n \n \nXX \n \n \nRequest for a subvention to the Extraordinary Chambers in the Courts \nof Cambodia \n \n \nRecalling section I of its resolution 68/247 B, section I of its resolution \n69/274 A, section IV of its resolution 70/248 A, section II of its resolution 71/272 A, \nsection IX of its resolution 72/262 A, section IV of its resolution 73/279 A and \nsection V of its resolution 74/263,  \n \nHaving considered the report of the Secretary-General40 and the related report \nof the Advisory Committee,41 \n \n1. \nTakes note of the report of the Secretary-General; \n \n2. \nEndorses the conclusions and recommendations contained in the report of \nthe Advisory Committee, subject to the provisions for the present resolution;  \n \n3. \nReaffirms the high priority accorded to the work of the Extraordinary \nChambers in the Courts of Cambodia;  \n \n4. \nNotes with appreciation the sustained contributions of the Government of \nCambodia, as the host country, for the Extraordinary Chambers;  \n \n5. \nEncourages the Extraordinary Chambers to continue adopting appropriate \nmeasures for achieving operational savings and efficiencies, and to properly complete \nthe judicial mandate in a transparent, accountable and cost-effective manner;  \n \n6. \nNotes the steps taken by the Secretary-General to develop a framework for \nthe completion of the work of the Extraordinary Chambers and the identification of \n__________________ \n \n38 A/75/541. \n \n39 A/75/7/Add.23. \n \n40 A/75/242. \n \n41 A/75/7/Add.19. \n\nA/RES/75/253 \nSpecial subjects relating to the proposed programme budget for 2021\n \n21-00067\n16/17 \n \npossible residual functions, and requests the Secretary-General to expedite the \nfinalization of the framework;  \n \n7. \nRecalls paragraph 17 of the report of the Advisory Committee, and \nrequests the Secretary-General to continue his intensive efforts to obtain additional \nvoluntary contributions, including by broadening the donor base;  \n \n8. \nEncourages all Member States to provide continuing and additional \nvoluntary support for both the international and national components of the \nExtraordinary Chambers in support of the expeditious completion of the mandate of \nthe Chambers;  \n \n9. \nRequests the Secretary-General to provide additional and detailed \ninformation on the final expenditures and unencumbered balance, as well as its return \nto Member States, in the context of the financial performance report on the \nprogramme budget for 2020 during the main part of the seventy-sixth session of the \nGeneral Assembly;  \n \n10. Recalls paragraph 37 of the report of the Advisory Committee, and \nrequests the Secretary-General to conduct a review of the proposed change in the \nterms and conditions of international judges of the Extraordinary Chambers and to \nreport thereon in his next report;  \n \n11. Authorizes the Secretary-General, as an exceptional measure, to enter into \ncommitments in an amount not exceeding 7 million dollars to supplement the \nvoluntary financial resources of the international component of the Extraordinary \nChambers for the period from 1 January to 31 December 2021, so as to enable the \nChambers to carry out its judicial mandate, and requests the Secretary-General to \nreport on the use of the commitment authority in the context of the next report;  \n \n \n \nXXI \n \n \nGross jointly financed budget of the Joint Inspection Unit  \n \n \nApproves the gross budget for the Joint Inspection Unit for 2021 in the amount \nof 7,512,000 dollars;  \n \n \n \nXXII \n \n \nGross jointly financed budget of the International Civil Service Commission \n \n \nApproves the gross budget for the International Civil Service Commission for \n2021 in the amount of 10,311,800 dollars;  \n \n \n \nXXIII \n \n \nGross jointly financed budget of the United Nations System Chief Executives \nBoard for Coordination \n \n \nNotes the gross budget for the United Nations System Chief Executives Board \nfor Coordination for 2021 in the amount of 3,572,400 dollars; \n \n \n \nXXIV \n \n \nGross jointly financed budget of the Department of Safety and Security \n \n \nApproves the gross jointly financed budget of the Department of Safety and \nSecurity of the Secretariat for 2021 in the amount of 153,908,400 dollars, broken \ndown as follows: \n \n(a) \nField Security Operations: 138,264,000 dollars;  \n \n(b) \nSecurity and Safety Services at the United Nations Office at Vienna: \n15,644,400 dollars; \n \n\nSpecial subjects relating to the proposed programme budget for 2021 \nA/RES/75/253\n \n17/17\n21-00067 \n \n \n \nXXV \n \n \nEffects of changes in rates of exchange and inflation \n \n \nHaving considered the report of the Secretary-General on the revised estimates \nresulting from changes in rates of exchange and inflation42 and the related report of \nthe Advisory Committee,43 \n \nTakes note of the revised estimates arising from recosting owing to changes in \nthe rates of exchange and inflation; \n \n \n \nXXVI \n \n \nContingency fund \n \n \n1. \nDecides that the contingency fund for the year 2021 shall be set at the level \nof 0.75 per cent of the approved programme budget for 2020, namely at 23,053,700 \ndollars;  \n \n2. \nNotes that, after a charge of 22,400,500 dollars, a balance of 653,200 \ndollars remains in the contingency fund for 2021;  \n \n3. \nDecides that the contingency fund for the year 2022 shall be set at the level \nof 0.75 per cent of the approved programme budget for 2021.  \n \n48th (resumed) plenary meeting \n31 December 2020 \n \n__________________ \n \n42  A/75/638. \n \n43  A/75/7/Add.33. \n",
  "paragraphs": {
    "1": "Decides that the contingency fund for the year 2021 shall be set at the level of 0.75 per cent of the approved programme budget for 2020, namely at 23,053,700 dollars;",
    "2": "Notes that, after a charge of 22,400,500 dollars, a balance of 653,200 dollars remains in the contingency fund for 2021;",
    "3": "Decides that the contingency fund for the year 2022 shall be set at the level of 0.75 per cent of the approved programme budget for 2021. 48th (resumed) plenary meeting 31 December 2020 __________________ 42 A/75/638. 43 A/75/7/Add.33.",
    "4": "Notes with appreciation the sustained contributions of the Government of Cambodia, as the host country, for the Extraordinary Chambers;",
    "5": "Encourages the Extraordinary Chambers to continue adopting appropriate measures for achieving operational savings and efficiencies, and to properly complete the judicial mandate in a transparent, accountable and cost-effective manner;",
    "6": "Notes the steps taken by the Secretary-General to develop a framework for the completion of the work of the Extraordinary Chambers and the identification of __________________ 38 A/75/541. 39 A/75/7/Add.23. 40 A/75/242. 41 A/75/7/Add.19. A/RES/75/253 Special subjects relating to the proposed programme budget for 2021 21-00067 16/17 possible residual functions, and requests the Secretary-General to expedite the finalization of the framework;",
    "7": "Recalls paragraph 17 of the report of the Advisory Committee, and requests the Secretary-General to continue his intensive efforts to obtain additional voluntary contributions, including by broadening the donor base;",
    "8": "Encourages all Member States to provide continuing and additional voluntary support for both the international and national components of the Extraordinary Chambers in support of the expeditious completion of the mandate of the Chambers;",
    "9": "Requests the Secretary-General to provide additional and detailed information on the final expenditures and unencumbered balance, as well as its return to Member States, in the context of the financial performance report on the programme budget for 2020 during the main part of the seventy-sixth session of the General Assembly;",
    "10": "Recalls paragraph 37 of the report of the Advisory Committee, and requests the Secretary-General to conduct a review of the proposed change in the terms and conditions of international judges of the Extraordinary Chambers and to report thereon in his next report;",
    "11": "Authorizes the Secretary-General, as an exceptional measure, to enter into commitments in an amount not exceeding 7 million dollars to supplement the voluntary financial resources of the international component of the Extraordinary Chambers for the period from 1 January to 31 December 2021, so as to enable the Chambers to carry out its judicial mandate, and requests the Secretary-General to report on the use of the commitment authority in the context of the next report; XXI Gross jointly financed budget of the Joint Inspection Unit Approves the gross budget for the Joint Inspection Unit for 2021 in the amount of 7,512,000 dollars; XXII Gross jointly financed budget of the International Civil Service Commission Approves the gross budget for the International Civil Service Commission for 2021 in the amount of 10,311,800 dollars; XXIII Gross jointly financed budget of the United Nations System Chief Executives Board for Coordination Notes the gross budget for the United Nations System Chief Executives Board for Coordination for 2021 in the amount of 3,572,400 dollars; XXIV Gross jointly financed budget of the Department of Safety and Security Approves the gross jointly financed budget of the Department of Safety and Security of the Secretariat for 2021 in the amount of 153,908,400 dollars, broken down as follows: (a) Field Security Operations: 138,264,000 dollars; (b) Security and Safety Services at the United Nations Office at Vienna: 15,644,400 dollars; Special subjects relating to the proposed programme budget for 2021 A/RES/75/253 17/17 21-00067 XXV Effects of changes in rates of exchange and inflation Having considered the report of the Secretary-General on the revised estimates resulting from changes in rates of exchange and inflation42 and the related report of the Advisory Committee,43 Takes note of the revised estimates arising from recosting owing to changes in the rates of exchange and inflation; XXVI Contingency fund",
    "12": "Also recalls paragraph 23 of the report of the Advisory Committee, and requests the Secretary-General to also provide complete details of potential cost-sharing arrangements regarding design, construction, project management and operational costs with the Office of the United Nations High Commissioner for Refugees and the International Organization for Migration in the context of the next progress report;",
    "13": "Encourages the Secretary-General to continue his efforts to include local knowledge, technology, material and capacity, in particular the use of materials available and/or manufactured locally throughout the implementation of the replacement of office blocks A to J at the United Nations Office at Nairobi, as appropriate;",
    "14": "Requests the Secretary-General to incorporate the envisaged renewable energy efficiency measures, wastewater treatment, solid waste management and water __________________ 29 A/75/331. 30 A/75/7/Add.16. Special subjects relating to the proposed programme budget for 2021 A/RES/75/253 13/17 21-00067 management into the design and construction of the United Nations Office at Nairobi project on office blocks A to J, including lessons learned from other construction projects;",
    "15": "Also requests the Secretary-General to ensure conformity with relevant building codes and standards, as well as best practices for persons with disabilities, in the design, construction and renovation of United Nations Office at Nairobi facilities;",
    "16": "Appropriates an amount of 7,974,500 dollars, comprising 765,600 dollars under section 29G, Administration, Nairobi, 7,157,300 dollars under section 33, Construction, alteration, improvement and major maintenance, and 51,600 dollars under section 34, Safety and security, of the proposed programme budget for 2021, which would represent a charge against the contingency fund; XV Global service delivery model for the United Nations Secretariat Recalling section III of its resolution 67/246, paragraph 13 of section VII of its resolution 69/262, paragraph 19 of its resolution 69/273, section XIX of its resolution 70/248 A, section XVII of its resolution 71/272 A, section IV of its resolution 72/262 C of 5 July 2018 and its resolution 74/296 of 13 July 2020, Having considered the report of the Secretary-General31 and the related report of the Advisory Committee,32 Decides to keep the question of the global service delivery model under review and to revert on the status of the above-mentioned reports at the main part of its seventy-sixth session;33 XVI Request for a subvention to the Residual Special Court for Sierra Leone Recalling its resolution 58/284 of 8 April 2004, section VII of its resolution 59/276 of 23 December 2004, section II of its resolution 59/294 of 22 June 2005, section XII of its resolution 65/259, section IX of its resolution 66/247, section I of its resolution 67/246, section VII of its resolution 70/248 A, section III of its resolution 71/272 A, section VIII of its resolution 72/262 A, section III of its resolution 73/279 A and section VI of its resolution 74/263, Having considered the report of the Secretary-General on the use of the commitment authority and request for a subvention to the Residual Special Court for Sierra Leone34 and the related report of the Advisory Committee,35",
    "17": "Recalls the project\u2019s objective to lower energy consumption at the Palais des Nations by at least 25 per cent compared with the 2010 baseline;",
    "18": "Stresses the need to gather sound and reliable baseline data on energy consumption and energy costs that can be used to measure actual improvements achieved after completion of the renovation of the Palais des Nations, and requests the Secretary-General to provide comprehensive information on energy usage and consumption and costs of utilities as early as available;",
    "19": "Decides to continue to use the multi-year construction-in-progress account established within the regular budget for expenditures related to the strategic heritage plan in 2021;",
    "20": "Also decides to revert to the establishment of an assessment scheme and currency of appropriation and assessment for the strategic heritage plan at the main part of its seventy-sixth session, and requests the Secretary-General to provide updated detailed information on these issues;",
    "21": "Further decides to revert to the establishment of the multi-year special account for the strategic heritage plan at the main part of its seventy-sixth session;",
    "22": "Decides that the annual repayments of the loans to the host country will be funded under the regular budget until decided otherwise by the General Assembly;",
    "23": "Appreciates the existing voluntary contributions received from Member States to finance the strategic heritage plan, and requests the Secretary-General to remain proactive in seeking both voluntary and in-kind contributions from Member States, as well as donations by private entities, in full compliance with all relevant rules and regulations of the Organization and agreements related to donations for the strategic heritage plan, and to provide detailed information on this matter in the context of his next progress report; Special subjects relating to the proposed programme budget for 2021 A/RES/75/253 7/17 21-00067",
    "24": "Encourages the Secretary-General, in attracting voluntary and in-kind contributions from Member States, to give priority to those activities within the scope of the project;",
    "25": "Appropriates the amount of 53,121,200 dollars (equivalent to 47,596,600 Swiss francs) for 2021, under section 33, Construction, alteration, improvement and major maintenance, of the proposed programme budget for 2021; X Progress in the renovation of Africa Hall at the Economic Commission for Africa in Addis Ababa Recalling section III of its resolution 65/259, section VII of its resolution 66/247, section III of its resolution 68/247 A, section V of its resolution 69/262, section IX of its resolution 70/248 A, section V of its resolution 71/272 A, section XII of its resolution 72/262 A, section VIII of its resolution 73/279 A and section X of its resolution 74/263, Having considered the report of the Secretary-General21 and the related report of the Advisory Committee,22"
  },
  "agenda_items": [
    "Item 141"
  ],
  "symbol_references": []
}