{
  "symbol": "A/RES/73/51",
  "filename": "A_RES_73_51.pdf",
  "title": "73/51. Information on confidence-building measures in the field of conventional arms",
  "text": "United Nations \nA/RES/73/51\n \n \nGeneral Assembly \nDistr.: General \n12 December 2018 \n \n18-21253 (E)    141218  \n*1821253* \n \n \nSeventy-third session \nAgenda item 101 (z) \n \n \n \n \n Resolution adopted by the General Assembly \non 5 December 2018 \n \n \n \n \n[on the report of the First Committee (A/73/510 and A/73/510/Corr.1)] \n \n \n \n73/51. Information on confidence-building measures in the field \nof conventional arms \n \n \n \nThe General Assembly, \n \nGuided by the purposes and principles enshrined in the Charter of the United \nNations, \n \nBearing in mind the contribution of confidence-building measures in the field \nof conventional arms, adopted on the initiative and with the agreement of the States \nconcerned, to the improvement of the overall international peace and security situation, \n \nConvinced that the relationship between the development of confidence-\nbuilding measures in the field of conventional arms and the international security \nenvironment can also be mutually reinforcing, \n \nConsidering the important role that confidence-building measures in the field \nof conventional arms can also play in creating favourable conditions for progress in \nthe field of disarmament, \n \nRecognizing that the exchange of information on confidence-building measures \nin the field of conventional arms contributes to mutual understanding and confidence \namong Member States, \n \nUnderlining that confidence-building measures in the field of conventional arms \nare key tools in strengthening conflict prevention and reducing armed violence, \nthereby contributing to the achievement of Sustainable Development Goal 16 of the \n2030 Agenda for Sustainable Development,1  \n \nRecalling its resolutions 59/92 of 3 December 2004, 60/82 of 8 December 2005, \n61/79 of 6 December 2006, 63/57 of 2 December 2008, 65/63 of 8 December 2010, \n67/49 of 3 December 2012, 69/64 of 2 December 2014 and 71/35 of 5 December 2016, \n__________________ \n \n1  Resolution 70/1. \n\nA/RES/73/51 \nInformation on confidence-building measures in the field of conventional arms\n \n18-21253\n2/2 \n \n \n1. \nWelcomes all confidence-building measures in the field of conventional \narms already undertaken by Member States; \n \n2. \nEncourages Member States to continue to adopt and apply confidence-\nbuilding measures in the field of conventional arms; \n \n3. \nInvites Member States to submit to the Secretariat, on a voluntary basis, \ninformation on confidence-building measures in the field of conventional arms; \n \n4. \nEncourages Member States to establish or continue dialogues on \nconfidence-building measures in the field of conventional arms; \n \n5. \nAppreciates the continuing operation of the Secretariat database \ncontaining information provided by Member States, 2 and requests the Secretary-\nGeneral to keep the database updated and to assist Member States, at their request, in \nconfidence-building activities and in the organization of seminars, courses and \nworkshops aimed at enhancing the knowledge of new developments in this field; \n \n6. \nWelcomes the adoption by the Disarmament Commission in April 2017 \nof recommendations on practical confidence-building measures in the field of \nconventional weapons;3  \n \n7. \nNotes that, in those recommendations, Member States are encouraged, as \nappropriate, and on a voluntary basis, to exchange information on confidence-\nbuilding measures in the field of conventional weapons at the bilateral, subregional, \nregional and international levels and to draw lessons learned from other mechanisms; \n \n8. \nDecides to include in the provisional agenda of its seventy-fifth session, \nunder the item entitled \u201cGeneral and complete disarmament\u201d, the sub-item entitled \n\u201cInformation on confidence-building measures in the field of conventional arms\u201d. \n \n45th plenary meeting  \n5 December 2018 \n \n__________________ \n \n2  See www.un.org/disarmament/cbms.  \n \n3  Official Records of the General Assembly, Seventy-second Session, Supplement No. 42 (A/72/42), \nannex. \n",
  "paragraphs": {
    "1": "Welcomes all confidence-building measures in the field of conventional arms already undertaken by Member States;",
    "2": "Encourages Member States to continue to adopt and apply confidence- building measures in the field of conventional arms;",
    "3": "Invites Member States to submit to the Secretariat, on a voluntary basis, information on confidence-building measures in the field of conventional arms;",
    "4": "Encourages Member States to establish or continue dialogues on confidence-building measures in the field of conventional arms;",
    "5": "Appreciates the continuing operation of the Secretariat database containing information provided by Member States, 2 and requests the Secretary- General to keep the database updated and to assist Member States, at their request, in confidence-building activities and in the organization of seminars, courses and workshops aimed at enhancing the knowledge of new developments in this field;",
    "6": "Welcomes the adoption by the Disarmament Commission in April 2017 of recommendations on practical confidence-building measures in the field of conventional weapons;3",
    "7": "Notes that, in those recommendations, Member States are encouraged, as appropriate, and on a voluntary basis, to exchange information on confidence- building measures in the field of conventional weapons at the bilateral, subregional, regional and international levels and to draw lessons learned from other mechanisms;",
    "8": "Decides to include in the provisional agenda of its seventy-fifth session, under the item entitled \u201cGeneral and complete disarmament\u201d, the sub-item entitled \u201cInformation on confidence-building measures in the field of conventional arms\u201d. 45th plenary meeting 5 December 2018 __________________ 2 See www.un.org/disarmament/cbms. 3 Official Records of the General Assembly, Seventy-second Session, Supplement No. 42 (A/72/42), annex."
  },
  "agenda_items": [
    "Item 101"
  ],
  "symbol_references": []
}