{
  "symbol": "A/RES/76/254",
  "filename": "A_RES_76_254.pdf",
  "title": "76/254. International Day to Combat Islamophobia",
  "text": "United Nations \nA/RES/76/254\n \n \nGeneral Assembly \nDistr.: General \n17 March 2022 \n \n22-03841 (E)    220322 \n*2203841* \n \n \nSeventy-sixth session \nAgenda item 16 \nCulture of peace \n \n \n \n \n Resolution adopted by the General Assembly on \n15 March 2022 \n \n \n \n \n[without reference to a Main Committee (A/76/L.41 and A/76/L.41/Add.1)] \n \n \n 76/254. International Day to Combat Islamophobia \n \n \n \nThe General Assembly, \n \nReaffirming the purposes and principles of the Charter of the United Nations \nand the Universal Declaration of Human Rights,1 for the promotion and protection of \nall human rights and fundamental freedoms for all persons,  \n \nRecalling its relevant resolutions, including resolution 75/187 of 16 December \n2020 on combating intolerance, negative stereotyping, stigmatization, discrimination, \nincitement to violence and violence against persons, based on religion or belief, and \nresolution 75/188 of 16 December 2020 on freedom of religion or belief,  \n \nRecalling also its resolution 36/55 of 25 November 1981, by which it \nproclaimed the Declaration on the Elimination of All Forms of Intolerance and of \nDiscrimination Based on Religion or Belief, and its resolution 73/296 of 28 May \n2019, in which it decided to designate 22 August as the International Day \nCommemorating the Victims of Acts of Violence Based on Religion or Belief, \n \nEmphasizing that freedom of religion or belief, freedom of opinion and \nexpression, the right to peaceful assembly and the right to freedom of association are \ninterdependent, interrelated and mutually reinforcing, and stressing the role that these \nrights can play in the fight against all forms of intolerance and of discrimination based \non religion or belief,  \n \nRecognizing with deep concern the overall rise in instances of discrimination, \nintolerance and violence, regardless of the actors, directed against members of many \nreligious and other communities in various parts of the world, including cases \nmotivated by Islamophobia, antisemitism and Christianophobia and prejudices \nagainst persons of other religions or beliefs,  \n__________________ \n \n1  Resolution 217 A (III). \n\nA/RES/76/254 \nInternational Day to Combat Islamophobia\n \n22-03841\n2/2 \n \n \nEncouraging activities aimed at promoting interreligious and intercultural \ndialogue in order to enhance peace and social stability, respect for diversity and \nmutual respect and to create, at the global level, and also at the regional, national and \nlocal levels, an environment conducive to peace and mutual understanding,  \n \nReiterating that terrorism and violent extremism as and when conducive to \nterrorism, in all its forms and manifestations, cannot and should not be associated \nwith any religion, nationality, civilization or ethnic group,  \n \nTaking note of the statement entitled \u201cA call for mutual respect\u201d by the High \nRepresentative of the United Nations Alliance of Civilizations,  \n \nRecalling all the heinous and cowardly terrorist attacks and acts of violence, \nincitement to violence and discrimination against people of all religions or beliefs, \nincluding Muslims, in various parts of the world, and expressing deep condolences to \nthe families of the victims and appreciation for the sympathetic response of several \nGovernments, communities and civil society organizations, \n \n1. \nDecides to proclaim 15 March the International Day to Combat \nIslamophobia; \n \n2. \nCalls for strengthened international efforts to foster a global dialogue on \nthe promotion of a culture of tolerance and peace at all levels, based on respect for \nhuman rights and for the diversity of religions and beliefs, and strongly deplores all \nacts of violence against persons on the basis of their religion or belief and such acts \ndirected against their places of worship, as well as all attacks on and in religious \nplaces, sites and shrines that are in violation of international law;  \n \n3. \nInvites all Member States, relevant organizations of the United Nations \nsystem, other international and regional organizations, and civil society, private sector \nand faith-based organizations to observe the International Day in an appropriate \nmanner; \n \n4. \nStresses that the cost of all activities that may arise from the \nimplementation of the present resolution should be met from voluntary contributions;  \n \n5. \nRequests the Secretary-General to bring the present resolution to the \nattention of all Member States, the organizations of the United Nations system and \ncivil society organizations for appropriate observance. \n \n61st plenary meeting \n15 March 2022 \n \n",
  "paragraphs": {
    "1": "Decides to proclaim 15 March the International Day to Combat Islamophobia;",
    "2": "Calls for strengthened international efforts to foster a global dialogue on the promotion of a culture of tolerance and peace at all levels, based on respect for human rights and for the diversity of religions and beliefs, and strongly deplores all acts of violence against persons on the basis of their religion or belief and such acts directed against their places of worship, as well as all attacks on and in religious places, sites and shrines that are in violation of international law;",
    "3": "Invites all Member States, relevant organizations of the United Nations system, other international and regional organizations, and civil society, private sector and faith-based organizations to observe the International Day in an appropriate manner;",
    "4": "Stresses that the cost of all activities that may arise from the implementation of the present resolution should be met from voluntary contributions;",
    "5": "Requests the Secretary-General to bring the present resolution to the attention of all Member States, the organizations of the United Nations system and civil society organizations for appropriate observance."
  },
  "agenda_items": [
    "Item 16"
  ],
  "symbol_references": [
    "A/76/L.41"
  ]
}