{
  "symbol": "A/RES/78/59",
  "filename": "A_RES_78_59.pdf",
  "title": "78/59. Regional confidence-building measures: activities of the United Nations Standing Advisory Committee on Security Questions in Central Africa",
  "text": "United Nations \nA/RES/78/59\n \n \nGeneral Assembly \nDistr.: General \n6 December 2023 \n \n23-24474 (E)    141223     \n*2324474* \n \n \nSeventy-eighth session \nAgenda item 100 (e) \nReview and implementation of the Concluding Document \nof the Twelfth Special Session of the General Assembly: \nregional confidence-building measures: activities of the \nUnited Nations Standing Advisory Committee on \nSecurity Questions in Central Africa \n \n \n \n \n Resolution adopted by the General Assembly \non 4 December 2023 \n \n \n \n \n[on the report of the First Committee (A/78/410, para. 17)] \n \n \n \n78/59. Regional confidence-building measures: activities of the \nUnited Nations Standing Advisory Committee on Security \nQuestions in Central Africa \n \n \n \nThe General Assembly, \n \nRecalling its previous relevant resolutions, in particular its resolution 77/86 of \n7 December 2022, \n \nRecalling also the guidelines for general and complete disarmament adopted at \nits tenth special session, the first special session devoted to disarmament, \n \nBearing in mind the establishment by the Secretary-General on 28 May 1992 of \nthe United Nations Standing Advisory Committee on Security Questions in Central \nAfrica, the purpose of which is to encourage arms limitation, disarmament, \nnon- proliferation and development in the Central Africa subregion, \n \nRecalling that the purpose of the Standing Advisory Committee is to conduct \nreconstruction and confidence-building activities in Central Africa among its member \nStates, including through confidence-building and arms limitation measures, \n \nConsidering the importance and effectiveness of confidence-building measures \ntaken on the initiative and with the participation of all States concerned and taking \ninto account the specific characteristics of each region, since such measures can \ncontribute to regional stability and to international peace and security, \n \nConvinced that development can be achieved only in a climate of peace, security \nand mutual confidence both within and among States, \n\nA/RES/78/59 \nRegional confidence-building measures: activities of the \nUnited Nations Standing Advisory Committee on \nSecurity Questions in Central Africa\n \n23-24474\n2/9 \n \n \nReaffirming the importance and relevance of the Standing Advisory Committee \nas an instrument of preventive diplomacy in the subregional architecture for the \npromotion of peace and security in Central Africa, \n \nBearing in mind the revitalization of the activities of the Standing Advisory \nCommittee decided upon at the forty-fourth ministerial meeting of the Committee, \nheld in Yaound\u00e9 from 29 May to 2 June 2017, with a view to enhancing its \ncontribution to the achievement of the objectives of peace, security and development \nin Central Africa, \n \nTaking note of the conclusions of the scientific symposium, held to mark the \nthirtieth anniversary of the Standing Advisory Committee, on its substantial \ncontribution in the service of preventive diplomacy, as well as the recommendations \nand the road map for their implementation, \n \nRecalling the entry into force of the Central African Convention for the Control \nof Small Arms and Light Weapons, Their Ammunition and All Parts and Components \nThat Can Be Used for Their Manufacture, Repair and Assembly (Kinshasa \nConvention) on 8 March 20171 and the ninth Conference of States Parties to the Arms \nTrade Treaty, held in Geneva from 21 to 23 August 2023, \n \nConvinced that the resources released by disarmament, including regional \ndisarmament, can be devoted to economic and social development and to the \nprotection of the environment for the benefit of all peoples, in particular those of \ndeveloping countries, \n \nReaffirming the Libreville Declaration on the Adoption and Implementation of \nthe Regional Strategy and Plan of Action for Combating Terrorism and the Trafficking \nin Small Arms and Light Weapons in Central Africa, adopted by the States members \nof the Standing Advisory Committee on 26 November 2015 at their forty-first \nministerial meeting, held in Libreville from 23 to 27 November 2015, 2 \n \nRecalling the communiqu\u00e9s of the forty-eighth 3  and forty-ninth ministerial \nmeetings of the Standing Advisory Committee, held from 27 to 31 May and from 25 to \n29 November 2019 in Kinshasa and Luanda, respectively, the Brazzaville Declaration \non Cooperation for Peace and Security in Central Africa,4 the Bata Declaration for the \nPromotion of Lasting Democracy, Peace and Development in Central Africa5 and the \nYaound\u00e9 Declaration on Peace, Security and Stability in Central Africa, 6 \n \nBearing in mind resolutions 1196 (1998) and 1197 (1998), adopted by the \nSecurity Council on 16 and 18 September 1998, respectively, following its \nconsideration of the report of the Secretary-General on the causes of conflict and the \npromotion of durable peace and sustainable development in Africa, 7 \n \nRecalling Security Council resolution 2634 (2022) of 31 May 2022 on maritime \nsecurity in the Gulf of Guinea, \n \nRecalling also the successful conclusion of the Summit of Heads of State and \nGovernment on Maritime Safety and Security in the Gulf of Guinea, held in Yaound\u00e9 \non 24 and 25 June 2013, and the decision taken at the Summit to establish the Code \nof Conduct concerning the Repression of Piracy, Armed Robbery against Ships and \nIllicit Maritime Activity in West and Central Africa (Yaound\u00e9 Code of Conduct), the \n__________________ \n \n1  See A/65/517-S/2010/534, annex. \n \n2  See A/70/682-S/2016/39, annex 3. \n \n3  A/73/967-S/2019/613, annex, enclosure I. \n \n4  A/50/474, annex I. \n \n5  A/53/258-S/1998/763, annex II, appendix I. \n \n6  A/53/868-S/1999/303, annex II. \n \n7  A/52/871-S/1998/318. \n\nRegional confidence-building measures: activities of the \nUnited Nations Standing Advisory Committee on \nSecurity Questions in Central Africa \nA/RES/78/59\n \n3/9\n23-24474 \n \ntenth anniversary of which is being celebrated in 2023, and recalling also the \ninauguration in Yaound\u00e9, on 11 September 2014, of the Interregional Coordination \nCentre for Maritime Security in the Gulf of Guinea, the effective commencement of \nits activities with the installation of its statutory officials in Yaound\u00e9 on 22 February \n2017, the inauguration of new offices of the Regional Centre for Maritime Security \nin Central Africa in Pointe Noire, Congo, on 20 October 2014, and the launch of the \nMultinational Maritime Coordination Centre in Cotonou, Benin, in March 2015, and \nalso the conclusion of the African Union Extraordinary Summit of Heads of State and \nGovernment on Maritime Security and Safety and Development in Africa, held in \nLom\u00e9 on 15 October 2016, \n \nRecalling further its resolution 69/314 of 30 July 2015, the first such resolution \non tackling illicit trafficking in wildlife, and also its resolutions 70/301 of \n9 September 2016, 71/326 of 11 September 2017, 73/343 of 16 September 2019, \n75/311 of 23 July 2021 and 77/325 of 25 August 2023, and reaffirming the outcome \nof the high-level meetings on poaching and illicit wildlife trafficking, hosted by \nGabon and Germany and held on the margins of the high-level segments of the sixty-\neighth and sixty-ninth sessions of the General Assembly, \n \nEmphasizing the need to strengthen the capacity for early warning, conflict \nprevention and peacekeeping in Africa, and recalling in this regard the concrete \nconflict prevention initiatives facilitated by the Department of Political and \nPeacebuilding Affairs of the Secretariat, \n \nWelcoming the establishment of the Commission of the Economic Community \nof Central African States and the close cooperation between the United Nations \nRegional Office for Central Africa and the Economic Community, as well as the \nsigning of the framework cooperation agreement between the two entities on 14 June \n2016, \n \nTaking note of the decisions adopted by the Conference of Heads of State and \nGovernment of the Economic Community of Central African States at its eighteenth \nordinary session, held in Libreville on 27 November 2020; at its nineteenth ordinary \nsession, held virtually on 30 July 2021; at its twentieth session, held on 19 January \n2022 in Brazzaville; at its twenty-first session, held on 25 July 2022 in Kinshasa; at \nits twenty-second session, held on 25 February 2023 in Kinshasa; and at its twenty-\nthird session, held on 1 July 2023 in Libreville,  \n \nWelcoming the continued implementation of the institutional reform of the \nEconomic Community of Central African States and the installation of the Committee \nof the Wise, \n \nBearing in mind the increased focus of the Standing Advisory Committee on \nhuman security questions, such as trafficking in persons, especially women and \nchildren, as an important consideration for subregional peace, stability and conflict \nprevention, and recalling the adoption by the General Assembly at its seventy-second \nsession of the political declaration on the implementation of the United Nations \nGlobal Plan of Action to Combat Trafficking in Persons8 following the high-level \nmeeting of the Assembly on the appraisal of the Global Plan of Action, \n \nExpressing continued concern about the fragile situation in the Central African \nRepublic and the country\u2019s vulnerability to regional instability, and noting the \nimportance of promoting the political process through the joint road map for peace in \nthe Central African Republic of the International Conference on the Great Lakes \nRegion, harmonized with the Political Agreement for Peace and Reconciliation in the \n__________________ \n \n8  Resolution 72/1. \n\nA/RES/78/59 \nRegional confidence-building measures: activities of the \nUnited Nations Standing Advisory Committee on \nSecurity Questions in Central Africa\n \n23-24474\n4/9 \n \nCentral African Republic, and of addressing the root causes of conflict in the country \nto ensure lasting peace, \n \nWelcoming the efforts of the Government of the Central African Republic to \nstrengthen the authority of the State, coupled with the extension of political and peace \nprocesses to the local level, creating a window of opportunity to foster inclusive \ndialogue, revitalize the architecture of the Political Agreement for Peace and \nReconciliation, and disassociate armed groups from violent struggle through \nmediation and political participation, \n \nWelcoming the appointment of the President of the Central African Republic, \nFaustin-Archange Touad\u00e9ra, as facilitator of the Economic Community of Central \nAfrican States for the situation in Gabon, on 31 August, and the commitments that he \nsubsequently made to various Gabonese political actors on a road map for dialogue \nand a return to constitutional order, \n \nHighlighting the regional security implications of the situation in the Central \nAfrican Republic, and reiterating the commitment of the region and the international \ncommunity to supporting the parties in the effective implementation of the Political \nAgreement, including through the provision of political, security, technical and \nfinancial support, \n \nWelcoming the signature of a memorandum on cross-border security between \nthe Central African Republic and South Sudan, on 1 September 2023, and the \nadoption of the national policy for the management of border areas in the Central \nAfrican Republic on 11 September 2023, as well as the conclusion, on 28 September \n2023, of the voluntary repatriation of elements of the Lord\u2019s Resistance Army to \nUganda, thanks in particular to the support of the United Nations Multidimensional \nIntegrated Stabilization Mission in the Central African Republic, \n \nWelcoming the signature by the Central African Republic and its neighbouring \ncountries, in Yaound\u00e9 on 27 April 2022, of a joint declaration on the dignified return \nof refugees of the Central African Republic to their country,  \n \nRecalling the Brazzaville Declaration on Confidence-Building Measures,9 and \nexpressing concern that the issue of mercenaries has become a major security concern, \nundermining trust and creating tensions among States members of the Standing \nAdvisory Committee,  \n \nWelcoming the adoption of the declaration on democratic and peaceful elections \nas a means of strengthening stability and achieving the Sustainable Development \nGoals in Central Africa at the fiftieth ministerial meeting of the Standing Advisory \nCommittee,10 \n \nWelcoming the call by States members of the Economic Community of Central \nAfrican States during the forty-ninth ministerial meeting of the Standing Advisory \nCommittee, in Luanda, on the need to strengthen partnership with the United Nations \nto address the impact of climate change on peace and security in Central Africa, and \nstrengthened by the fifty-fifth ministerial meeting, held in Sao Tome, \n \nExpressing concern about the impact of cross-border criminality, in particular \nthe activities of the Lord\u2019s Resistance Army, the terrorist attacks by groups affiliated \nwith Boko Haram in the Lake Chad basin region and incidents of piracy in the Gulf \nof Guinea, the illegal exploitation of natural resources, and the issue of transhumance \nand its cross-border security implications for peace, security and development in \nCentral Africa, \n__________________ \n \n9  A/73/224, annex IV. \n \n10  A/76/274, annex I. \n\nRegional confidence-building measures: activities of the \nUnited Nations Standing Advisory Committee on \nSecurity Questions in Central Africa \nA/RES/78/59\n \n5/9\n23-24474 \n \n \nWelcoming the progress made by the States members of the Lake Chad Basin \nCommission and Benin in making the Multinational Joint Task Force operational in \norder to combat effectively the threat posed by the Boko Haram terrorist group to the \nLake Chad basin region, \n \nRecalling the adoption by the Lake Chad Basin Commission, with the support \nof the African Union, of the Regional Stabilization, Recovery and Resilience Strategy \nfor Areas Affected by Boko Haram in the Lake Chad Basin Region, in Abuja on \n30 August 2018, \n \nBearing in mind Security Council resolution 2349 (2017) of 31 March 2017, in \nwhich the Council called for, inter alia, increased assistance to the countries of the \nregion, \n \nConsidering the urgent need to prevent the possible movement of illicit \nweapons, mercenaries and combatants involved in conflicts in the Sahel and in \nneighbouring countries in the Central African subregion, \n \nConcerned by the persistence of the humanitarian crisis due to the displacement \nof populations in several Member States, the resurgence of inter-community conflicts \ndue in particular to the scarcity of resources, the use of transhumance for criminal \npurposes, now identified as a phenomenon of emerging insecurity in Central Africa, \nas well as the rise of hate speech, especially during electoral processes, \n \nRecalling the conclusions of the fifty-fourth and fifty-fifth ministerial meetings \nof the Standing Advisory Committee, held in Kint\u00e9l\u00e9, Congo, from 12 to 16 January \n2023 and in Sao Tome from 15 to 19 May 2023, respectively, \n \n1. \nReaffirms its support for efforts aimed at promoting confidence-building \nmeasures at the regional and subregional levels in order to ease tensions and conflicts \nin Central Africa and to further sustainable peace, stability and development in the \nsubregion; \n \n2. \nWelcomes and encourages the initiative of the States members of the \nUnited Nations Standing Advisory Committee on Security Questions in Central \nAfrica to further develop collaboration and synergies with the Economic Community \nof Central African States; \n \n3. \nWelcomes the role played by the Standing Advisory Committee throughout \nthe 30 years of its existence, which has enabled the creation of institutions, such as \nthe Subregional Centre for Human Rights and Democracy in Central Africa and the \nCouncil for Peace and Security in Central Africa and its organs, including the early \nwarning mechanism for Central Africa and the Central Africa Multinational Force, \nwhich have contributed towards the establishment of lasting peace in the subregion; \n \n4. \nInvites the Standing Advisory Committee and the Economic Community \nof Central African States to continue discussions on the relationship between the two \nentities in the light of the institutional reform of the Economic Community, and urges \nthem to consider how to harmonize their views and actions so as to avoid overlap and \nduplication in the implementation of their respective mandates; \n \n5. \nEncourages the Standing Advisory Committee, in view of the \nrepositioning of the Economic Community of Central African States and the \nstrengthening of the United Nations Regional Office for Central Africa, to continue \nto serve within the United Nations as a high-level body for continuous monitoring, \nreflection and the fostering of solutions, with regard to the concerns and needs of the \nCentral African subregion in the area of peace and security; \n \n6. \nWelcomes efforts under way by the Standing Advisory Committee and its \nsecretariat to implement the communication strategy adopted at the forty-fifth \n\nA/RES/78/59 \nRegional confidence-building measures: activities of the \nUnited Nations Standing Advisory Committee on \nSecurity Questions in Central Africa\n \n23-24474\n6/9 \n \nministerial meeting of the Committee, held in Kigali from 4 to 8 December 2017, and \nencourages member States and other partners to support initiatives aimed at \nincreasing the visibility of the Committee, including among the populations of the \nsubregion, in cooperation with civil society; \n \n7. \nReaffirms the importance of disarmament and arms control programmes in \nCentral Africa carried out by the States of the subregion with the support of the United \nNations, the African Union and other international partners; \n \n8. \nEncourages Member States to provide assistance to those States members \nof the Standing Advisory Committee that have ratified the Arms Trade Treaty, and \nencourages those that have not yet done so to ratify the Treaty; 11 \n \n9. \nEncourages States members of the Standing Advisory Committee and \nother interested States to provide financial support for the implementation of the \nCentral African Convention for the Control of Small Arms and Light Weapons, Their \nAmmunition and All Parts and Components That Can Be Used for Their Manufacture, \nRepair and Assembly (Kinshasa Convention), and encourages signatories that have \nnot yet done so to ratify the Convention; \n \n10. Welcomes the holding of the first Conference of States Parties to the \nCentral African Convention for the Control of Small Arms and Light Weapons, Their \nAmmunition and All Parts and Components That Can Be Used for Their Manufacture, \nRepair and Assembly, in Yaound\u00e9 from 11 to 13 June 2018, in accordance with \narticle 34, paragraph 3, of the Kinshasa Convention, and requests the Secretary-\nGeneral to convene the review conference of the Kinshasa Convention, in accordance \nwith article 34, paragraph 5, of the Convention, at the earliest opportunity, working \nclosely with the Economic Community of Central African States; \n \n11. \nEncourages Member States to assist States parties to the Kinshasa \nConvention with coordination activities for the control of small arms and light \nweapons at the regional and national levels, including funding thereof, as \nexpeditiously as possible; \n \n12. Urges Member States to increase financing for the Saving Lives Entity \nfund and to support the projects and activities of Member States, in particular by \nsupporting the establishment and strengthening of national commissions for the \ncontrol of small arms and light weapons, the establishment of a platform for the \nexchange of experiences among the national commissions, and the establishment and \noperationalization of the Convention secretariat; \n \n13. Reaffirms its support for the United Nations Global Counter-Terrorism \nStrategy12 and its four pillars, which constitute an ongoing effort, and calls upon \nMember States, the United Nations and other appropriate international, regional and \nsubregional organizations to step up their efforts to implement the Strategy in an \nintegrated and balanced manner and in all aspects;  \n \n14. Welcomes the adoption, by the Conference of Heads of State and \nGovernment of the Economic Community of Central African States at its seventeenth \nordinary session, on 30 July 2020, of the strategy on preventing and combating \nterrorism in Central Africa, and requests a review thereof to strengthen the strategy \nin the light of the conclusions of the African Union Extraordinary Summit, held in \nMalabo on 28 May 2022; \n \n15. Welcomes the joint summit of the Heads of State and Government of the \nEconomic Community of West African States and the Economic Community of \n__________________ \n \n11  United Nations, Treaty Series, vol. 3013, No. 52373. \n \n12  Resolution 60/288. \n\nRegional confidence-building measures: activities of the \nUnited Nations Standing Advisory Committee on \nSecurity Questions in Central Africa \nA/RES/78/59\n \n7/9\n23-24474 \n \nCentral African States, in coordination with the African Union Commission, on peace, \nsecurity, stability and the fight against terrorism and violent extremism, held in Lom\u00e9 \non 30 July 2018, and recalls the Lom\u00e9 Declaration on Peace, Security, Stability and \nthe Fight against Terrorism and Violent Extremism adopted at that summit; \n \n16. Encourages the Economic Community of Central African States and the \nEconomic Community of West African States to work together towards the \nimplementation of the Lom\u00e9 Declaration; \n \n17. Encourages the States members of the Standing Advisory Committee to \ncarry out the programmes of activities adopted at their ministerial meetings, and \nrequests the United Nations Regional Office for Central Africa to continue to provide \nsupport; \n \n18. Appeals to the international community to support the efforts undertaken \nby the States concerned to implement disarmament, demobilization and reintegration \nprogrammes, as well as security sector reforms, and urges the States concerned to \nensure that such programmes take into consideration the needs of women and children \nassociated with former combatants; \n \n19. Welcomes the efforts of Cameroon and the Congo in providing assistance \nto the Interregional Coordination Centre for Maritime Security in the Gulf of Guinea \nand the Regional Centre for Maritime Security in Central Africa, respectively, and \nurges other member States to honour their financial commitments in order to ensure \nthe predictable and sustainable operation of the two Centres, and encourages the \nEconomic Community of Central African States, in the context of the tenth \nanniversary of the Yaound\u00e9 Code of Conduct, to strengthen maritime security \nmeasures, particularly in the Gulf of Guinea, and also in the context of climate change \nand the increased vulnerability of island States, to strengthen maritime security \nmeasures in relation to border countries; \n \n20. Encourages Member States to continue to implement the outcomes of the \nSummit of Heads of State and Government on Maritime Safety and Security in the \nGulf of Guinea by operationalizing the Interregional Coordination Centre for \nMaritime Security in the Gulf of Guinea and activities of the Regional Centre for \nMaritime Security in Central Africa, and also encourages the implementation of the \nCharter on Maritime Security and Safety and Development in Africa adopted at the \nAfrican Union Extraordinary Summit of Heads of State and Government on Maritime \nSecurity and Safety and Development in Africa; \n \n21. Calls upon Member States and subregional bodies to take immediate \nconcerted action to counter the phenomenon of poaching and trafficking in wildlife \nand natural resources, including through the implementation of the provisions of its \nresolutions 69/314, 70/301, 71/326, 73/343, 75/311 and 77/325;  \n \n22. Welcomes the progress made by the Economic Community of Central \nAfrican States and the Economic Community of West African States in initiating \ncommon policies and joint programmes on the management of pastoralism and cross-\nborder transhumance, and encourages the Economic Community of Central African \nStates to adopt the protocol on pastoralism and cross-border transhumance in Central \nAfrica; \n \n23. Encourages the development of mechanisms for regulation by the \nEconomic Community of Central African States, and calls for the holding of a high-\nlevel conference to discuss issues relating to pastoralism and cross-border \ntranshumance with a view to ensuring joint and integrated management thereof; \n \n24. Welcomes the adoption by the Standing Advisory Committee, at its fifty-\nfifth ministerial meeting, of the Kint\u00e9l\u00e9 Declaration on hate speech in Central \n\nA/RES/78/59 \nRegional confidence-building measures: activities of the \nUnited Nations Standing Advisory Committee on \nSecurity Questions in Central Africa\n \n23-24474\n8/9 \n \nAfrica, 13 on 16 January 2023 in Kint\u00e9l\u00e9, Congo, welcomes also the adoption in \nKinshasa, on 24 June 2022, of the draft regional strategy and plan of action for \npreventing and combating hate speech in written, audiovisual and digital \ncommunication media in Central Africa, and encourages its political endorsement \nwithout delay by the States members of the Standing Advisory Committee, with a \nview to the development of a common approach for deconstructing such discourse \nand promoting coexistence in the countries of the Economic Community of Central \nAfrican States; \n \n25. Requests the United Nations Regional Office for Central Africa, in \ncollaboration with the United Nations Regional Centre for Peace and Disarmament in \nAfrica, to facilitate the efforts undertaken by the States members of the Standing \nAdvisory Committee, in particular for their execution of the Implementation Plan for \nthe Kinshasa Convention;14 \n \n26. Requests the Secretary-General and the Office of the United Nations High \nCommissioner for Refugees, with the support of the international community, to \ncontinue to assist the countries of Central Africa in tackling the issues of refugees and \ndisplaced persons in their territories, recalling the Sao Tome Declaration on refugees \nand internally displaced persons,15 adopted at the fifty-fifth ministerial meeting of the \nStanding Advisory Committee; \n \n27. Also requests the Secretary-General and the Office of the United Nations \nHigh Commissioner for Refugees to help the countries of Central Africa to tackle the \nissue of youth emigration, especially the emigration of qualified young people due to \na lack of opportunities, which threatens to undermine the development process of \nthese countries in the long term; \n \n28. Requests the Secretary-General and the Office of the United Nations High \nCommissioner for Human Rights to continue to provide their full assistance to the \nSubregional Centre for Human Rights and Democracy in Central Africa; \n \n29. Welcomes the increased contributions made by several Member States to \nthe trust fund of the United Nations Standing Advisory Committee on Security \nQuestions in Central Africa, reminds the States members of the Standing Advisory \nCommittee of the commitments that they undertook on the adoption of the Declaration \non the Trust Fund of the United Nations Standing Advisory Committee on Security \nQuestions in Central Africa on 8 May 200916 and the Bangui Declaration on 10 June \n2016,17 and invites those States members of the Committee that have not already done \nso to contribute to the trust fund; \n \n30. Urges other Member States and intergovernmental and non-governmental \norganizations to support the activities of the Standing Advisory Committee effectively \nthrough voluntary contributions to the trust fund; \n \n31. Urges the States members of the Standing Advisory Committee, in \naccordance with Security Council resolution 1325 (2000) of 31 October 2000, to \nstrengthen the gender component of the various meetings of the Committee relating \nto disarmament and international security, in line with the Sao Tome Declaration on \nthe Participation of Women in the Statutory Meetings of the United Nations Standing \nAdvisory Committee on Security Questions in Central Africa, adopted on 1 December \n2016,18 in which member States were invited to increase the representation of women \n__________________ \n \n13  A/78/266, annex II. \n \n14  See A/65/717-S/2011/53, annex. \n \n15  A/78/266, annex III. \n \n16  A/64/85-S/2009/288, annex I. \n \n17  A/71/293, annex I. \n \n18  A/72/363, annex II. \n\nRegional confidence-building measures: activities of the \nUnited Nations Standing Advisory Committee on \nSecurity Questions in Central Africa \nA/RES/78/59\n \n9/9\n23-24474 \n \nin delegations participating in the statutory meetings of the Committee, and strongly \nencourages the States members of the Committee to ensure that gender-related \nconsiderations are taken into account in the activities of the Committee; \n \n32. Expresses its satisfaction to the Secretary-General for his support to the \nStanding Advisory Committee, expresses appreciation for the role played by the \nUnited Nations Regional Office for Central Africa and strongly encourages the States \nmembers of the Standing Advisory Committee and international partners to support \nthe work of the Office; \n \n33. Welcomes the efforts of the Standing Advisory Committee towards \naddressing cross-border security threats in Central Africa, including activities of \ngroups affiliated with Boko Haram and the Lord\u2019s Resistance Army, and acts of piracy \nand armed robbery at sea in the Gulf of Guinea, the issue of transhumance and its \ncross-border security implications, as well as the fallout from the situation in the \nCentral African Republic, and also welcomes the role of the United Nations Regional \nOffice for Central Africa in coordinating those efforts, working closely with the \nEconomic Community of Central African States, the African Union and all relevant \nregional and international partners; \n \n34. Expresses its satisfaction to the Secretary-General for his support for the \nrevitalization of the activities of the Standing Advisory Committee, and requests him \nto continue to provide the assistance needed to ensure the success of its regular \nmeetings; \n \n35. Calls upon the Secretary-General to submit to the General Assembly at its \nseventy-ninth session a report on the implementation of the present resolution; \n \n36. Decides to include in the provisional agenda of its seventy-ninth session, \nunder the item entitled \u201cReview and implementation of the Concluding Document of \nthe Twelfth Special Session of the General Assembly\u201d, the sub-item entitled \n\u201cRegional confidence-building measures: activities of the United Nations Standing \nAdvisory Committee on Security Questions in Central Africa\u201d. \n \n42nd plenary meeting \n4 December 2023 \n \n",
  "paragraphs": {
    "1": "Reaffirms its support for efforts aimed at promoting confidence-building measures at the regional and subregional levels in order to ease tensions and conflicts in Central Africa and to further sustainable peace, stability and development in the subregion;",
    "2": "Welcomes and encourages the initiative of the States members of the United Nations Standing Advisory Committee on Security Questions in Central Africa to further develop collaboration and synergies with the Economic Community of Central African States;",
    "3": "Welcomes the role played by the Standing Advisory Committee throughout the 30 years of its existence, which has enabled the creation of institutions, such as the Subregional Centre for Human Rights and Democracy in Central Africa and the Council for Peace and Security in Central Africa and its organs, including the early warning mechanism for Central Africa and the Central Africa Multinational Force, which have contributed towards the establishment of lasting peace in the subregion;",
    "4": "Invites the Standing Advisory Committee and the Economic Community of Central African States to continue discussions on the relationship between the two entities in the light of the institutional reform of the Economic Community, and urges them to consider how to harmonize their views and actions so as to avoid overlap and duplication in the implementation of their respective mandates;",
    "5": "Encourages the Standing Advisory Committee, in view of the repositioning of the Economic Community of Central African States and the strengthening of the United Nations Regional Office for Central Africa, to continue to serve within the United Nations as a high-level body for continuous monitoring, reflection and the fostering of solutions, with regard to the concerns and needs of the Central African subregion in the area of peace and security;",
    "6": "Welcomes efforts under way by the Standing Advisory Committee and its secretariat to implement the communication strategy adopted at the forty-fifth A/RES/78/59 Regional confidence-building measures: activities of the United Nations Standing Advisory Committee on Security Questions in Central Africa 23-24474 6/9 ministerial meeting of the Committee, held in Kigali from 4 to 8 December 2017, and encourages member States and other partners to support initiatives aimed at increasing the visibility of the Committee, including among the populations of the subregion, in cooperation with civil society;",
    "7": "Reaffirms the importance of disarmament and arms control programmes in Central Africa carried out by the States of the subregion with the support of the United Nations, the African Union and other international partners;",
    "8": "Encourages Member States to provide assistance to those States members of the Standing Advisory Committee that have ratified the Arms Trade Treaty, and encourages those that have not yet done so to ratify the Treaty; 11",
    "9": "Encourages States members of the Standing Advisory Committee and other interested States to provide financial support for the implementation of the Central African Convention for the Control of Small Arms and Light Weapons, Their Ammunition and All Parts and Components That Can Be Used for Their Manufacture, Repair and Assembly (Kinshasa Convention), and encourages signatories that have not yet done so to ratify the Convention;",
    "10": "Welcomes the holding of the first Conference of States Parties to the Central African Convention for the Control of Small Arms and Light Weapons, Their Ammunition and All Parts and Components That Can Be Used for Their Manufacture, Repair and Assembly, in Yaound\u00e9 from 11 to 13 June 2018, in accordance with article 34, paragraph 3, of the Kinshasa Convention, and requests the Secretary- General to convene the review conference of the Kinshasa Convention, in accordance with article 34, paragraph 5, of the Convention, at the earliest opportunity, working closely with the Economic Community of Central African States;",
    "11": "Encourages Member States to assist States parties to the Kinshasa Convention with coordination activities for the control of small arms and light weapons at the regional and national levels, including funding thereof, as expeditiously as possible;",
    "12": "Urges Member States to increase financing for the Saving Lives Entity fund and to support the projects and activities of Member States, in particular by supporting the establishment and strengthening of national commissions for the control of small arms and light weapons, the establishment of a platform for the exchange of experiences among the national commissions, and the establishment and operationalization of the Convention secretariat;",
    "13": "Reaffirms its support for the United Nations Global Counter-Terrorism Strategy12 and its four pillars, which constitute an ongoing effort, and calls upon Member States, the United Nations and other appropriate international, regional and subregional organizations to step up their efforts to implement the Strategy in an integrated and balanced manner and in all aspects;",
    "14": "Welcomes the adoption, by the Conference of Heads of State and Government of the Economic Community of Central African States at its seventeenth ordinary session, on 30 July 2020, of the strategy on preventing and combating terrorism in Central Africa, and requests a review thereof to strengthen the strategy in the light of the conclusions of the African Union Extraordinary Summit, held in Malabo on 28 May 2022;",
    "15": "Welcomes the joint summit of the Heads of State and Government of the Economic Community of West African States and the Economic Community of __________________ 11 United Nations, Treaty Series, vol. 3013, No. 52373. 12 Resolution 60/288. Regional confidence-building measures: activities of the United Nations Standing Advisory Committee on Security Questions in Central Africa A/RES/78/59 7/9 23-24474 Central African States, in coordination with the African Union Commission, on peace, security, stability and the fight against terrorism and violent extremism, held in Lom\u00e9 on 30 July 2018, and recalls the Lom\u00e9 Declaration on Peace, Security, Stability and the Fight against Terrorism and Violent Extremism adopted at that summit;",
    "16": "Encourages the Economic Community of Central African States and the Economic Community of West African States to work together towards the implementation of the Lom\u00e9 Declaration;",
    "17": "Encourages the States members of the Standing Advisory Committee to carry out the programmes of activities adopted at their ministerial meetings, and requests the United Nations Regional Office for Central Africa to continue to provide support;",
    "18": "Appeals to the international community to support the efforts undertaken by the States concerned to implement disarmament, demobilization and reintegration programmes, as well as security sector reforms, and urges the States concerned to ensure that such programmes take into consideration the needs of women and children associated with former combatants;",
    "19": "Welcomes the efforts of Cameroon and the Congo in providing assistance to the Interregional Coordination Centre for Maritime Security in the Gulf of Guinea and the Regional Centre for Maritime Security in Central Africa, respectively, and urges other member States to honour their financial commitments in order to ensure the predictable and sustainable operation of the two Centres, and encourages the Economic Community of Central African States, in the context of the tenth anniversary of the Yaound\u00e9 Code of Conduct, to strengthen maritime security measures, particularly in the Gulf of Guinea, and also in the context of climate change and the increased vulnerability of island States, to strengthen maritime security measures in relation to border countries;",
    "20": "Encourages Member States to continue to implement the outcomes of the Summit of Heads of State and Government on Maritime Safety and Security in the Gulf of Guinea by operationalizing the Interregional Coordination Centre for Maritime Security in the Gulf of Guinea and activities of the Regional Centre for Maritime Security in Central Africa, and also encourages the implementation of the Charter on Maritime Security and Safety and Development in Africa adopted at the African Union Extraordinary Summit of Heads of State and Government on Maritime Security and Safety and Development in Africa;",
    "21": "Calls upon Member States and subregional bodies to take immediate concerted action to counter the phenomenon of poaching and trafficking in wildlife and natural resources, including through the implementation of the provisions of its resolutions 69/314, 70/301, 71/326, 73/343, 75/311 and 77/325;",
    "22": "Welcomes the progress made by the Economic Community of Central African States and the Economic Community of West African States in initiating common policies and joint programmes on the management of pastoralism and cross- border transhumance, and encourages the Economic Community of Central African States to adopt the protocol on pastoralism and cross-border transhumance in Central Africa;",
    "23": "Encourages the development of mechanisms for regulation by the Economic Community of Central African States, and calls for the holding of a high- level conference to discuss issues relating to pastoralism and cross-border transhumance with a view to ensuring joint and integrated management thereof;",
    "24": "Welcomes the adoption by the Standing Advisory Committee, at its fifty- fifth ministerial meeting, of the Kint\u00e9l\u00e9 Declaration on hate speech in Central A/RES/78/59 Regional confidence-building measures: activities of the United Nations Standing Advisory Committee on Security Questions in Central Africa 23-24474 8/9 Africa, 13 on 16 January 2023 in Kint\u00e9l\u00e9, Congo, welcomes also the adoption in Kinshasa, on 24 June 2022, of the draft regional strategy and plan of action for preventing and combating hate speech in written, audiovisual and digital communication media in Central Africa, and encourages its political endorsement without delay by the States members of the Standing Advisory Committee, with a view to the development of a common approach for deconstructing such discourse and promoting coexistence in the countries of the Economic Community of Central African States;",
    "25": "Requests the United Nations Regional Office for Central Africa, in collaboration with the United Nations Regional Centre for Peace and Disarmament in Africa, to facilitate the efforts undertaken by the States members of the Standing Advisory Committee, in particular for their execution of the Implementation Plan for the Kinshasa Convention;14",
    "26": "Requests the Secretary-General and the Office of the United Nations High Commissioner for Refugees, with the support of the international community, to continue to assist the countries of Central Africa in tackling the issues of refugees and displaced persons in their territories, recalling the Sao Tome Declaration on refugees and internally displaced persons,15 adopted at the fifty-fifth ministerial meeting of the Standing Advisory Committee;",
    "27": "Also requests the Secretary-General and the Office of the United Nations High Commissioner for Refugees to help the countries of Central Africa to tackle the issue of youth emigration, especially the emigration of qualified young people due to a lack of opportunities, which threatens to undermine the development process of these countries in the long term;",
    "28": "Requests the Secretary-General and the Office of the United Nations High Commissioner for Human Rights to continue to provide their full assistance to the Subregional Centre for Human Rights and Democracy in Central Africa;",
    "29": "Welcomes the increased contributions made by several Member States to the trust fund of the United Nations Standing Advisory Committee on Security Questions in Central Africa, reminds the States members of the Standing Advisory Committee of the commitments that they undertook on the adoption of the Declaration on the Trust Fund of the United Nations Standing Advisory Committee on Security Questions in Central Africa on 8 May 200916 and the Bangui Declaration on 10 June 2016,17 and invites those States members of the Committee that have not already done so to contribute to the trust fund;",
    "30": "Urges other Member States and intergovernmental and non-governmental organizations to support the activities of the Standing Advisory Committee effectively through voluntary contributions to the trust fund;",
    "31": "Urges the States members of the Standing Advisory Committee, in accordance with Security Council resolution 1325 (2000) of 31 October 2000, to strengthen the gender component of the various meetings of the Committee relating to disarmament and international security, in line with the Sao Tome Declaration on the Participation of Women in the Statutory Meetings of the United Nations Standing Advisory Committee on Security Questions in Central Africa, adopted on 1 December 2016,18 in which member States were invited to increase the representation of women __________________ 13 A/78/266, annex II. 14 See A/65/717-S/2011/53, annex. 15 A/78/266, annex III. 16 A/64/85-S/2009/288, annex I. 17 A/71/293, annex I. 18 A/72/363, annex II. Regional confidence-building measures: activities of the United Nations Standing Advisory Committee on Security Questions in Central Africa A/RES/78/59 9/9 23-24474 in delegations participating in the statutory meetings of the Committee, and strongly encourages the States members of the Committee to ensure that gender-related considerations are taken into account in the activities of the Committee;",
    "32": "Expresses its satisfaction to the Secretary-General for his support to the Standing Advisory Committee, expresses appreciation for the role played by the United Nations Regional Office for Central Africa and strongly encourages the States members of the Standing Advisory Committee and international partners to support the work of the Office;",
    "33": "Welcomes the efforts of the Standing Advisory Committee towards addressing cross-border security threats in Central Africa, including activities of groups affiliated with Boko Haram and the Lord\u2019s Resistance Army, and acts of piracy and armed robbery at sea in the Gulf of Guinea, the issue of transhumance and its cross-border security implications, as well as the fallout from the situation in the Central African Republic, and also welcomes the role of the United Nations Regional Office for Central Africa in coordinating those efforts, working closely with the Economic Community of Central African States, the African Union and all relevant regional and international partners;",
    "34": "Expresses its satisfaction to the Secretary-General for his support for the revitalization of the activities of the Standing Advisory Committee, and requests him to continue to provide the assistance needed to ensure the success of its regular meetings;",
    "35": "Calls upon the Secretary-General to submit to the General Assembly at its seventy-ninth session a report on the implementation of the present resolution;",
    "36": "Decides to include in the provisional agenda of its seventy-ninth session, under the item entitled \u201cReview and implementation of the Concluding Document of the Twelfth Special Session of the General Assembly\u201d, the sub-item entitled \u201cRegional confidence-building measures: activities of the United Nations Standing Advisory Committee on Security Questions in Central Africa\u201d. 42nd plenary meeting 4 December 2023"
  },
  "agenda_items": [
    "Item 100"
  ],
  "symbol_references": []
}