{
  "symbol": "A/RES/78/292",
  "filename": "A_RES_78_292.pdf",
  "title": "78/292. Seconded active-duty military and police personnel",
  "text": "United Nations \nA/RES/78/292\n \n \nGeneral Assembly \nDistr.: General \n3 July 2024 \n \n \n24-12053 (E)     \n*2412053* \n \n \nSeventy-eighth session \nAgenda item 139 \nHuman resources management \n \n \n \n \n Resolution adopted by the General Assembly \non 28 June 2024 \n \n \n \n \n[on the report of the Fifth Committee (A/78/825/Add.1, para. 6)] \n \n \n 78/292. Seconded active-duty military and police personnel \n \n \n \nThe General Assembly, \n \nRecalling its resolutions 67/287 of 28 June 2013, 68/252 of 27 December 2013, \n71/263 of 23 December 2016, 74/254 A of 27 December 2019, 74/254 B of 6 August \n2020 and 75/292 of 30 June 2021 as well as its decision 78/542 C of 24 April 2024, \n \nHaving considered the report of the Secretary-General on seconded active-duty \nmilitary and police personnel1 and the related report of the Advisory Committee on \nAdministrative and Budgetary Questions,2  \n \n1. \nTakes note of the report of the Secretary-General;  \n \n2. \nEndorses the conclusions and recommendations contained in the report of \nthe Advisory Committee on Administrative and Budgetary Questions, subject to the \nprovisions of the present resolution;  \n \n3. \nRecognizes the importance of the roles carried out and the expertise \nprovided by seconded active-duty military and police personnel in fulfilling United \nNations mandates, and requests the Secretary-General to continue to actively engage \nin the efforts to improve their timely onboarding, using the various tools at his \ndisposal to address challenges beyond the control of the selected active-duty military \nand police personnel and which prevent their timely onboarding; \n \n4. \nRequests the Secretary General to continue his efforts to engage with \nMember States to identify the best way to address duplication of remuneration or \nbenefits, including through bilateral agreements;  \n \n5. \nRecognizes the challenges in the implementation of the staff regulations \nand rules with respect to seconded active-duty military and police personnel, and \n__________________ \n \n1  A/78/602. \n \n2  A/78/762. \n\nA/RES/78/292 \nSeconded active-duty military and police personnel \n \n24-12053\n2/2 \n \ninvites the Secretary-General to consider options for additional measures to ensure \nthe impartiality and mitigate conflicts of interest of seconded active-duty military and \npolice personnel in accordance with regulation 1.2 (m);  \n \n6. \nTakes note of paragraph 32 of the report of the Advisory Committee, and \ndecides to authorize the Secretary-General to extend the exceptional measures \nregarding seconded active-duty military and police personnel until 1 July 2027, and \nrequests the Secretary-General to report to the General Assembly at its eighty-first \nsession on viable options to resolve the conflict between the Staff Regulations and \nRules of the United Nations and the national legislation or practices of some Member \nStates with respect to their active-duty military and police personnel seconded to the \nSecretariat; \n \n7. \nRequests the Secretary-General to consider placing the selected active-\nduty military and police personnel who cannot report to duty promptly owing to \nonboarding challenges beyond their control against similar positions at the same duty \nstation once the challenges are addressed or, on an exceptional and temporary basis \nand without setting a precedent, at an alternative duty station.  \n \n95th plenary meeting \n28 June 2024 \n \n",
  "paragraphs": {
    "1": "Takes note of the report of the Secretary-General;",
    "2": "Endorses the conclusions and recommendations contained in the report of the Advisory Committee on Administrative and Budgetary Questions, subject to the provisions of the present resolution;",
    "3": "Recognizes the importance of the roles carried out and the expertise provided by seconded active-duty military and police personnel in fulfilling United Nations mandates, and requests the Secretary-General to continue to actively engage in the efforts to improve their timely onboarding, using the various tools at his disposal to address challenges beyond the control of the selected active-duty military and police personnel and which prevent their timely onboarding;",
    "4": "Requests the Secretary General to continue his efforts to engage with Member States to identify the best way to address duplication of remuneration or benefits, including through bilateral agreements;",
    "5": "Recognizes the challenges in the implementation of the staff regulations and rules with respect to seconded active-duty military and police personnel, and invites the Secretary-General to consider options for additional measures to ensure the impartiality and mitigate conflicts of interest of seconded active-duty military and police personnel in accordance with regulation 1.2 (m);",
    "6": "Takes note of paragraph 32 of the report of the Advisory Committee, and decides to authorize the Secretary-General to extend the exceptional measures regarding seconded active-duty military and police personnel until 1 July 2027, and requests the Secretary-General to report to the General Assembly at its eighty-first session on viable options to resolve the conflict between the Staff Regulations and Rules of the United Nations and the national legislation or practices of some Member States with respect to their active-duty military and police personnel seconded to the Secretariat;",
    "7": "Requests the Secretary-General to consider placing the selected active- duty military and police personnel who cannot report to duty promptly owing to onboarding challenges beyond their control against similar positions at the same duty station once the challenges are addressed or, on an exceptional and temporary basis and without setting a precedent, at an alternative duty station."
  },
  "agenda_items": [
    "Item 139"
  ],
  "symbol_references": []
}