{
  "symbol": "A/RES/74/270",
  "filename": "A_RES_74_270.pdf",
  "title": "74/270. Global solidarity to fight the coronavirus disease 2019 (COVID-19)",
  "text": "United Nations \nA/RES/74/270\n \n \nGeneral Assembly \nDistr.: General \n3 April 2020 \n \n20-05146 (E)    070420     \n*2005146*\n \n \n \nSeventy-fourth session \nAgenda item 123 \nStrengthening of the United Nations system \n \n \n \n \n Resolution adopted by the General Assembly \non 2 April 2020 \n \n \n \n \n[without reference to a Main Committee (A/74/L.52 and A/74/L.52/Add.1)] \n \n \n 74/270. Global solidarity to fight the coronavirus disease 2019 (COVID-19) \n \n \n \nThe General Assembly, \n \nNoting with great concern the threat to human health, safety and well-being \ncaused by the coronavirus disease 2019 (COVID-19) pandemic, which continues to \nspread globally, \n \nRecognizing the unprecedented effects of the pandemic, including the severe \ndisruption to societies and economies, as well as to global travel and commerce, and \nthe devastating impact on the livelihood of people, \n \nRecognizing also that the poorest and most vulnerable are the hardest hit by the \npandemic and that the impact of the crisis will reverse hard-won development gains \nand hamper progress towards achieving the Sustainable Development Goals, 1 \n \nRecognizing further the central role of the United Nations system in catalysing and \ncoordinating the global response to control and contain the spread of COVID-19, and \nacknowledging in this regard the crucial role played by the World Health Organization, \n \nWelcoming the call by the Secretary-General to tackle the health emergency and \nfocus on the social impact and economic response measures and his emphasis on the \nneed for a sustainable and inclusive recovery, \n \nRecognizing the efforts made by Governments as well as health-care workers and \nother essential workers around the world to deal with the pandemic through measures \nto protect the health, safety and well-being of their people, \n \nAcknowledging the need for all relevant stakeholders to work together at the \nnational, regional and global levels to ensure that no one is left behind, \n__________________ \n \n1 See resolution 70/1. \n\n \n2/2 \n \n \nRecognizing that the COVID-19 pandemic requires a global response based on \nunity, solidarity and renewed multilateral cooperation, \n \n1. \nReaffirms its commitment to international cooperation and multilateralism \nand its strong support for the central role of the United Nations system in the global \nresponse to the coronavirus disease 2019 (COVID-19) pandemic; \n \n2. \nEmphasizes the need for full respect for human rights, and stresses that \nthere is no place for any form of discrimination, racism and xenophobia in the response \nto the pandemic; \n \n3. \nExpresses its profound condolences to and solidarity with the families and \nsocieties whose people have lost their lives to the disease, those who are battling for \ntheir survival and those whose lives and livelihoods have been affected by the crisis; \n \n4. \nExpresses its gratitude and support to all frontline health-care workers, \nmedical professionals, scientists and researchers, as well as other essential workers \naround the world who are working under difficult and challenging circumstances to \ndeal with the pandemic; \n \n5. \nCalls for intensified international cooperation to contain, mitigate and \ndefeat the pandemic, including by exchanging information, scientific knowledge and \nbest practices and by applying the relevant guidelines recommended by the World \nHealth Organization; \n \n6. \nRenews its commitment to help people and societies in special situations, \nespecially the weakest and most vulnerable, and recognizes that many Governments \nhave offered their assistance and support to others in a spirit of solidarity and mutual \nsupport; \n \n7. \nReaffirms its full commitment to the decade of action and delivery for \nsustainable development, and in this regard underlines the need for the United Nations \nsystem to work as one to support all Governments; \n \n8. \nExpresses optimism that the unprecedented crisis caused by the COVID-19 \npandemic can be mitigated and successfully reversed through leadership and sustained \nglobal cooperation and solidarity; \n \n9. \nCalls upon the United Nations system, under the leadership of the \nSecretary-General, to work with all relevant actors in order to mobilize a coordinated \nglobal response to the pandemic and its adverse social, economic and financial impact \non all societies. \n \n2 April 2020 \n \n",
  "paragraphs": {
    "1": "Reaffirms its commitment to international cooperation and multilateralism and its strong support for the central role of the United Nations system in the global response to the coronavirus disease 2019 (COVID-19) pandemic;",
    "2": "Emphasizes the need for full respect for human rights, and stresses that there is no place for any form of discrimination, racism and xenophobia in the response to the pandemic;",
    "3": "Expresses its profound condolences to and solidarity with the families and societies whose people have lost their lives to the disease, those who are battling for their survival and those whose lives and livelihoods have been affected by the crisis;",
    "4": "Expresses its gratitude and support to all frontline health-care workers, medical professionals, scientists and researchers, as well as other essential workers around the world who are working under difficult and challenging circumstances to deal with the pandemic;",
    "5": "Calls for intensified international cooperation to contain, mitigate and defeat the pandemic, including by exchanging information, scientific knowledge and best practices and by applying the relevant guidelines recommended by the World Health Organization;",
    "6": "Renews its commitment to help people and societies in special situations, especially the weakest and most vulnerable, and recognizes that many Governments have offered their assistance and support to others in a spirit of solidarity and mutual support;",
    "7": "Reaffirms its full commitment to the decade of action and delivery for sustainable development, and in this regard underlines the need for the United Nations system to work as one to support all Governments;",
    "8": "Expresses optimism that the unprecedented crisis caused by the COVID-19 pandemic can be mitigated and successfully reversed through leadership and sustained global cooperation and solidarity;",
    "9": "Calls upon the United Nations system, under the leadership of the Secretary-General, to work with all relevant actors in order to mobilize a coordinated global response to the pandemic and its adverse social, economic and financial impact on all societies. 2 April 2020"
  },
  "agenda_items": [
    "Item 123"
  ],
  "symbol_references": [
    "A/74/L.52"
  ]
}