{
  "symbol": "A/RES/73/7",
  "filename": "A_RES_73_7.pdf",
  "title": "73/7. Report of the International Criminal Court",
  "text": "United Nations \nA/RES/73/7\n \n \nGeneral Assembly \nDistr.: General \n31 October 2018 \n \n18-18142 (E)    021118     \n*1818142* \n \n \nSeventy-third session \nAgenda item 77 \n \n \n \n \n Resolution adopted by the General Assembly on \n29 October 2018 \n \n \n[without reference to a Main Committee (A/73/L.8 and A/73/L.8/Add.1)] \n \n \n73/7. Report of the International Criminal Court \n \n \n \nThe General Assembly, \n \nRecalling its resolution 72/3 of 30 October 2017 and all its previous relevant \nresolutions, \n \nRecalling also that the Rome Statute of the International Criminal Court 1 \nreaffirms the purposes and principles of the Charter of the United Nations, \n \nRecognizing the International Criminal Court as an independent permanent \njudicial institution and, in this regard, that the United Nations and the Court respect \neach other\u2019s status and mandate, \n \nReiterating the historic significance of the adoption of the Rome Statute, \n \nEmphasizing that justice, especially transitional justice in conflict and post-\nconflict societies, is a fundamental building block of sustainable peace, \n \nConvinced that ending impunity is essential for coming to terms with any past \ncrimes committed and preventing such crimes in the future, \n \nAcknowledging the fact that the International Criminal Court has achieved \nconsiderable progress in its investigations and judicial proceedings in various \nsituations and cases which were referred to it by States parties to the Rome Statute \nand by the Security Council, and which the Prosecutor of the Court has initiated \nproprio motu, in accordance with the Rome Statute, \n \nRecalling that effective and comprehensive cooperation and assistance in all \naspects of its mandate by States, the United Nations and other international and \nregional organizations remain essential for the International Criminal Court to carry \nout its activities, \n__________________ \n \n1  United Nations, Treaty Series, vol. 2187, No. 38544. \n\nA/RES/73/7 \n \n18-18142\n2/5 \n \n \nExpressing its appreciation to the Secretary-General for providing effective and \nefficient assistance to the International Criminal Court in accordance with the \nRelationship Agreement between the United Nations and the International Criminal \nCourt,2 \n \nAcknowledging the Relationship Agreement as approved by the General \nAssembly in its resolution 58/318 of 13 September 2004, including paragraph 3 of \nthe resolution, with respect to the payment in full of expenses accruing to the United \nNations as a result of the implementation of the Relationship Agreement, 3 which \nprovides a framework for continued cooperation between the International Criminal \nCourt and the United Nations, which enables, inter alia, facilitation by the United \nNations of the Court\u2019s field activities, and encouraging the conclusion of \nsupplementary arrangements and agreements, as necessary, \n \nNoting the need for funding of expenses related to investigations or prosecutions \nof the International Criminal Court, including in connection with situations referred \nto the Court by the Security Council, \n \nWelcoming the continuous support given by civil society to the International \nCriminal Court, \n \nStressing the importance that the Rome Statute accords to the rights and needs \nof victims, in particular their right to participate in judicial proceedings and to claim \nreparations, and emphasizing the importance of informing and involving victims and \naffected communities in order to give effect to the mandate of the International \nCriminal Court towards victims, \n \n1. \nWelcomes the report of the International Criminal Court for 2017/18;4 \n \n2. \nAlso welcomes the States that have become parties to the Rome Statute of \nthe International Criminal Court,1 and calls upon all States in all regions of the world \nthat are not yet parties to the Rome Statute to consider ratifying, accepting, approving \nor acceding to it without delay; \n \n3. \nFurther welcomes the States parties as well as States not parties to the \nRome Statute that are parties to the Agreement on the Privileges and Immunities of \nthe International Criminal Court,5 and calls upon all States that have not yet done so \nto consider becoming parties to that Agreement; \n \n4. \nNotes the recent ratifications and acceptances of the amendments adopted \nat the Review Conference of the Rome Statute of the International Criminal Court, \nheld in Kampala from 31 May to 11 June 2010; \n \n5. \nUnderlines, bearing in mind that in accordance with the Rome Statute the \nInternational Criminal Court is complementary to national criminal jurisdictions, that \nStates need to adopt appropriate measures within their national legal systems for those \ncrimes for which they are required under international law to exercise their \nresponsibility to investigate and prosecute; \n \n6. \nEncourages further efforts by the United Nations, other international and \nregional organizations and States, as well as civil society, to appropriately assist \nStates, upon their request, in strengthening their domestic capacity to investigate and \nprosecute crimes, and in this regard underlines the importance of national ownership; \n__________________ \n \n2  A/58/874 and A/58/874/Add.1. \n \n3  Articles 10 and 13 of the Relationship Agreement. \n \n4  A/73/334. \n \n5  United Nations, Treaty Series, vol. 2271, No. 40446. \n\nA/RES/73/7\n \n3/5\n18-18142 \n \n \n7. \nEmphasizes the importance of international cooperation and judicial \nassistance in conducting effective investigations and prosecutions; \n \n8. \nAcknowledges the role of the International Criminal Court in a multilateral \nsystem that aims to end impunity, promote the rule of law, promote and encourage \nrespect for human rights, achieve sustainable peace and further the development of \nnations, in accordance with international law and the purposes and principles of the \nCharter of the United Nations; \n \n9. \nCalls upon States parties to the Rome Statute that have not yet done so to \nadopt national legislation to implement obligations emanating from the Rome Statute \nand to cooperate with the International Criminal Court in the exercise of its functions, \nand recalls the provision of technical assistance by States parties in this respect; \n \n10. Welcomes the cooperation and assistance provided thus far to the \nInternational Criminal Court by States parties as well as States not parties, the United \nNations and other international and regional organizations, and calls upon those States \nthat are under an obligation to cooperate to provide such cooperation and assistance \nin the future, in particular with regard to arrest and surrender, the provision of \nevidence, the protection and relocation of victims and witnesses and the enforcement \nof sentences; \n \n11. \nNotes the efforts of the Secretary-General in promoting cooperation \nbetween the United Nations and the International Criminal Court in accordance with \nthe Relationship Agreement between the United Nations and the International \nCriminal Court,2 and also notes in this regard that the Office of Legal Affairs of the \nSecretariat has a specific role within the United Nations; \n \n12. Recalls article 3 of the Relationship Agreement, according to which, with \na view to facilitating the effective discharge of their respective responsibilities, the \nUnited Nations and the International Criminal Court shall cooperate closely, \nwhenever appropriate, with each other and consult each other on matters of mutual \ninterest pursuant to the provisions of the Relationship Agreement and in conformity \nwith the respective provisions of the Charter and the Rome Statute, and shall respect \neach other\u2019s status and mandate,6 and requests the Secretary-General to continue to \ninclude information relevant to the implementation of article 3 of the Relationship \nAgreement in a report to be submitted to the General Assembly at its seventy-fourth \nsession; \n \n13. Recalls the guidance issued by the Secretary-General on contacts with \npersons who are the subject of arrest warrants or summonses issued by the \nInternational Criminal Court, 7  and in this regard takes note of the information \nincluded in the report of the Secretary-General on the implementation of article 3 of \nthe Relationship Agreement;8  \n \n14. Recalls the Relationship Agreement, and notes that expenses related to \ninvestigations or prosecutions incurred by the International Criminal Court in \nconnection with situations referred by the Security Council or otherwise continue to \nbe borne exclusively by States parties to the Rome Statute; \n \n15. Emphasizes the importance of cooperation with States that are not parties \nto the Rome Statute; \n \n16. Invites regional organizations to consider concluding cooperation \nagreements with the International Criminal Court; \n__________________ \n \n6  Article 2, paragraph 3, of the Relationship Agreement. \n \n7  A/67/828 S/2013/210, annex. \n \n8  A/73/335. \n\nA/RES/73/7 \n \n18-18142\n4/5 \n \n \n17. Recalls that, by virtue of article 12, paragraph 3, of the Rome Statute, if \nthe acceptance of a State which is not a party to the Rome Statute is required under \narticle 12, paragraph 2, of the Rome Statute, that State may, by declaration lodged \nwith the Registrar of the International Criminal Court, accept the exercise of \njurisdiction by the Court with respect to the crime in question; \n \n18. Urges all States parties to take the interests, needs for assistance and \nmandate of the International Criminal Court into account when relevant matters are \nbeing discussed in the United Nations, and invites all other States to consider doing \nthe same, as appropriate; \n \n19. Emphasizes the importance of the full implementation of all aspects of the \nRelationship Agreement, which forms a framework for close cooperation between the \ntwo organizations and for consultation on matters of mutual interest pursuant to the \nprovisions of that Agreement and in conformity with the respective provisions of the \nCharter and the Rome Statute, as well as the need for the Secretary-General to \ncontinue to inform the General Assembly at its seventy-fourth session of the expenses \nincurred and reimbursements received by the United Nations in connection with \nassistance provided to the International Criminal Court; \n \n20. Encourages further dialogue between the United Nations and the \nInternational Criminal Court, and welcomes in this regard the increased interaction \nof the Security Council with the Court under various formats, including the holding \nof open debates on peace and justice and working methods, with a special focus on \nthe role of the Court; \n \n21. Continues to welcome the statement by the President of the Security \nCouncil of 12 February 2013 9  in which the Council reiterated its previous call \nregarding the importance of State cooperation with the International Criminal Court, \nin accordance with the respective obligations of States, and expressed its commitment \nto effective follow-up of Council decisions in this regard; \n \n22. Expresses its appreciation for the work undertaken by the International \nCriminal Court liaison office to United Nations Headquarters, and encourages the \nSecretary-General to continue to work closely with that office; \n \n23. Encourages States to contribute to the trust fund established for the benefit \nof victims of crimes within the jurisdiction of the International Criminal Court and \nthe families of such victims, and acknowledges with appreciation contributions made \nto that trust fund thus far; \n \n24. Recalls that, at the Review Conference of the Rome Statute, which was \nconvened and opened by the Secretary-General, States parties reaffirmed their \ncommitment to the Rome Statute and its full implementation, as well as its \nuniversality and integrity, and that the Review Conference undertook a stocktaking \nexercise of international criminal justice, considering the impact of the Rome Statute \non victims and affected communities, peace and justice, complementarity and \ncooperation, called for the strengthening of the enforcement of sentences, adopted \namendments to the Rome Statute to expand the jurisdiction of the Court to cover three \nadditional war crimes when committed in armed conflicts not of an international \ncharacter, and adopted amendments to the Rome Statute to define the crime of \naggression and to establish conditions under which the Court could exercise \njurisdiction with respect to that crime; \n__________________ \n \n9  S/PRST/2013/2; see Resolutions and Decisions of the Security Council, 1 August 2012\u201331 July \n2013 (S/INF/68). \n\nA/RES/73/7\n \n5/5\n18-18142 \n \n \n25. Acknowledges the report of the Secretary-General on the work of the \nOrganization;  \n \n26. Takes note of the decision of the Assembly of States Parties to the Rome \nStatute of the International Criminal Court at its fifteenth session, while recalling that, \naccording to article 112, paragraph 6, of the Rome Statute, the Assembly of States \nParties shall meet at the seat of the Court or at United Nations Headquarters, to hold \nits seventeenth session in The Hague, looks forward to the seventeenth session, which \nis to be held from 5 to 12 December 2018, and requests the Secretary-General to \nprovide the necessary services and facilities in accordance with the Relationship \nAgreement and resolution 58/318; \n \n27. Encourages the widest possible participation of States in the Assembly of \nStates Parties, invites States to contribute to the trust fund for the participation of \nleast developed countries, and acknowledges with appreciation contributions made to \nthat trust fund thus far; \n \n28. Invites the International Criminal Court to submit, if it deems it \nappropriate, in accordance with article 6 of the Relationship Agreement, a report on \nits activities for 2019/20, for consideration by the General Assembly at its seventy-\nfourth session. \n \n \n28th plenary meeting \n29 October 2018 \n",
  "paragraphs": {
    "1": "Welcomes the report of the International Criminal Court for 2017/18;4",
    "2": "Also welcomes the States that have become parties to the Rome Statute of the International Criminal Court,1 and calls upon all States in all regions of the world that are not yet parties to the Rome Statute to consider ratifying, accepting, approving or acceding to it without delay;",
    "3": "Further welcomes the States parties as well as States not parties to the Rome Statute that are parties to the Agreement on the Privileges and Immunities of the International Criminal Court,5 and calls upon all States that have not yet done so to consider becoming parties to that Agreement;",
    "4": "Notes the recent ratifications and acceptances of the amendments adopted at the Review Conference of the Rome Statute of the International Criminal Court, held in Kampala from 31 May to 11 June 2010;",
    "5": "Underlines, bearing in mind that in accordance with the Rome Statute the International Criminal Court is complementary to national criminal jurisdictions, that States need to adopt appropriate measures within their national legal systems for those crimes for which they are required under international law to exercise their responsibility to investigate and prosecute;",
    "6": "Encourages further efforts by the United Nations, other international and regional organizations and States, as well as civil society, to appropriately assist States, upon their request, in strengthening their domestic capacity to investigate and prosecute crimes, and in this regard underlines the importance of national ownership;",
    "7": "Emphasizes the importance of international cooperation and judicial assistance in conducting effective investigations and prosecutions;",
    "8": "Acknowledges the role of the International Criminal Court in a multilateral system that aims to end impunity, promote the rule of law, promote and encourage respect for human rights, achieve sustainable peace and further the development of nations, in accordance with international law and the purposes and principles of the Charter of the United Nations;",
    "9": "Calls upon States parties to the Rome Statute that have not yet done so to adopt national legislation to implement obligations emanating from the Rome Statute and to cooperate with the International Criminal Court in the exercise of its functions, and recalls the provision of technical assistance by States parties in this respect;",
    "10": "Welcomes the cooperation and assistance provided thus far to the International Criminal Court by States parties as well as States not parties, the United Nations and other international and regional organizations, and calls upon those States that are under an obligation to cooperate to provide such cooperation and assistance in the future, in particular with regard to arrest and surrender, the provision of evidence, the protection and relocation of victims and witnesses and the enforcement of sentences;",
    "11": "Notes the efforts of the Secretary-General in promoting cooperation between the United Nations and the International Criminal Court in accordance with the Relationship Agreement between the United Nations and the International Criminal Court,2 and also notes in this regard that the Office of Legal Affairs of the Secretariat has a specific role within the United Nations;",
    "12": "Recalls article 3 of the Relationship Agreement, according to which, with a view to facilitating the effective discharge of their respective responsibilities, the United Nations and the International Criminal Court shall cooperate closely, whenever appropriate, with each other and consult each other on matters of mutual interest pursuant to the provisions of the Relationship Agreement and in conformity with the respective provisions of the Charter and the Rome Statute, and shall respect each other\u2019s status and mandate,6 and requests the Secretary-General to continue to include information relevant to the implementation of article 3 of the Relationship Agreement in a report to be submitted to the General Assembly at its seventy-fourth session;",
    "13": "Recalls the guidance issued by the Secretary-General on contacts with persons who are the subject of arrest warrants or summonses issued by the International Criminal Court, 7 and in this regard takes note of the information included in the report of the Secretary-General on the implementation of article 3 of the Relationship Agreement;8",
    "14": "Recalls the Relationship Agreement, and notes that expenses related to investigations or prosecutions incurred by the International Criminal Court in connection with situations referred by the Security Council or otherwise continue to be borne exclusively by States parties to the Rome Statute;",
    "15": "Emphasizes the importance of cooperation with States that are not parties to the Rome Statute;",
    "16": "Invites regional organizations to consider concluding cooperation agreements with the International Criminal Court;",
    "17": "Recalls that, by virtue of article 12, paragraph 3, of the Rome Statute, if the acceptance of a State which is not a party to the Rome Statute is required under article 12, paragraph 2, of the Rome Statute, that State may, by declaration lodged with the Registrar of the International Criminal Court, accept the exercise of jurisdiction by the Court with respect to the crime in question;",
    "18": "Urges all States parties to take the interests, needs for assistance and mandate of the International Criminal Court into account when relevant matters are being discussed in the United Nations, and invites all other States to consider doing the same, as appropriate;",
    "19": "Emphasizes the importance of the full implementation of all aspects of the Relationship Agreement, which forms a framework for close cooperation between the two organizations and for consultation on matters of mutual interest pursuant to the provisions of that Agreement and in conformity with the respective provisions of the Charter and the Rome Statute, as well as the need for the Secretary-General to continue to inform the General Assembly at its seventy-fourth session of the expenses incurred and reimbursements received by the United Nations in connection with assistance provided to the International Criminal Court;",
    "20": "Encourages further dialogue between the United Nations and the International Criminal Court, and welcomes in this regard the increased interaction of the Security Council with the Court under various formats, including the holding of open debates on peace and justice and working methods, with a special focus on the role of the Court;",
    "21": "Continues to welcome the statement by the President of the Security Council of 12 February 2013 9 in which the Council reiterated its previous call regarding the importance of State cooperation with the International Criminal Court, in accordance with the respective obligations of States, and expressed its commitment to effective follow-up of Council decisions in this regard;",
    "22": "Expresses its appreciation for the work undertaken by the International Criminal Court liaison office to United Nations Headquarters, and encourages the Secretary-General to continue to work closely with that office;",
    "23": "Encourages States to contribute to the trust fund established for the benefit of victims of crimes within the jurisdiction of the International Criminal Court and the families of such victims, and acknowledges with appreciation contributions made to that trust fund thus far;",
    "24": "Recalls that, at the Review Conference of the Rome Statute, which was convened and opened by the Secretary-General, States parties reaffirmed their commitment to the Rome Statute and its full implementation, as well as its universality and integrity, and that the Review Conference undertook a stocktaking exercise of international criminal justice, considering the impact of the Rome Statute on victims and affected communities, peace and justice, complementarity and cooperation, called for the strengthening of the enforcement of sentences, adopted amendments to the Rome Statute to expand the jurisdiction of the Court to cover three additional war crimes when committed in armed conflicts not of an international character, and adopted amendments to the Rome Statute to define the crime of aggression and to establish conditions under which the Court could exercise jurisdiction with respect to that crime;",
    "25": "Acknowledges the report of the Secretary-General on the work of the Organization;",
    "26": "Takes note of the decision of the Assembly of States Parties to the Rome Statute of the International Criminal Court at its fifteenth session, while recalling that, according to article 112, paragraph 6, of the Rome Statute, the Assembly of States Parties shall meet at the seat of the Court or at United Nations Headquarters, to hold its seventeenth session in The Hague, looks forward to the seventeenth session, which is to be held from 5 to 12 December 2018, and requests the Secretary-General to provide the necessary services and facilities in accordance with the Relationship Agreement and resolution 58/318;",
    "27": "Encourages the widest possible participation of States in the Assembly of States Parties, invites States to contribute to the trust fund for the participation of least developed countries, and acknowledges with appreciation contributions made to that trust fund thus far;",
    "28": "Invites the International Criminal Court to submit, if it deems it appropriate, in accordance with article 6 of the Relationship Agreement, a report on its activities for 2019/20, for consideration by the General Assembly at its seventy- fourth session."
  },
  "agenda_items": [
    "Item 77"
  ],
  "symbol_references": [
    "A/73/L.8"
  ]
}