{
  "symbol": "A/RES/74/262",
  "filename": "A_RES_74_262.pdf",
  "title": "74/262. Questions relating to the proposed programme budget for 2020",
  "text": "United Nations \nA/RES/74/262\n \n \nGeneral Assembly \nDistr.: General \n14 January 2020 \n \n19-22728 (E)    170120 \n*1922728* \n \n \nSeventy-fourth session \nAgenda item 135 \nProposed programme budget for 2020 \n \n \n \n \n Resolution adopted by the General Assembly \non 27 December 2019 \n \n \n \n \n[on the report of the Fifth Committee (A/74/614)] \n \n \n 74/262. Questions relating to the proposed programme budget for 2020 \n \n \n \nThe General Assembly, \n \nReaffirming its resolutions 41/213 of 19 December 1986, 42/211 of \n21 December 1987, 45/248 B, section VI, of 21 December 1990, 55/231 of \n23 December 2000, 56/253 of 24 December 2001, 58/269 and 58/270 of 23 December \n2003, 59/276, section XI, of 23 December 2004, 60/283 of 7 July 2006, 61/263 of \n4 April 2007, 62/236 of 22 December 2007, 63/262 of 24 December 2008, 64/243 of \n24 December 2009, 65/259 of 24 December 2010, 66/246 of 24 December 2011, \n68/246 of 27 December 2013, 70/247 of 23 December 2015, 71/272 A of 23 December \n2016, 72/261 and 72/266 A of 24 December 2017, 72/266 B of 5 July 2018 and 73/281 \nof 22 December 2018, \n \nReaffirming also the respective mandates of the Committee for Programme and \nCoordination and the Advisory Committee on Administrative and Budgetary \nQuestions in the consideration of the proposed programme budget, \n \nReaffirming further the role of the General Assembly, through the Fifth \nCommittee, in carrying out a thorough analysis and approval of posts and financial \nresources, as well as of human resources policies, \n \nRecognizing the detrimental effect of the withholding of assessed contributions \non the administrative and financial functioning of the United Nations and its ability \nto implement mandates and programmes, \n \nRecognizing also that late payments of assessed contributions, bearing in mind \nthe special situation of certain Member States, have adversely affected the financial \nsituation of the United Nations and resulted in a liquidity crisis that has affected the \ndelivery of mandates, \n \nRecalling its resolution 72/266 A and the decision of the General Assembly to \napprove the proposed change from a biennial to an annual budget period on a trial \nbasis, \n\nA/RES/74/262 \nQuestions relating to the proposed programme budget for 2020\n \n19-22728\n2/10 \n \n \nHaving considered the proposed programme budget for 2020, 1 the eleventh \nprogress report of the Secretary-General on the implementation of projects financed \nfrom the Development Account, 2  the report of the Independent Audit Advisory \nCommittee on internal oversight: proposed programme budget for 2020 3 and the \nrelated report of the Advisory Committee on Administrative and Budgetary \nQuestions,4 \n \n1. \nReaffirms that the Fifth Committee is the appropriate Main Committee of \nthe General Assembly entrusted with responsibilities for administrative and budgetary \nmatters, and reaffirms the role of the Fifth Committee in carrying out a thorough \nanalysis and approving human and financial resources and policies, with a view to \nensuring full, effective and efficient implementation of all mandated programmes and \nactivities and the implementation of policies in this regard; \n \n2. \nAlso reaffirms rule 153 of its rules of procedure; \n \n3. \nFurther reaffirms the Regulations and Rules Governing Programme \nPlanning, the Programme Aspects of the Budget, the Monitoring of Implementation \nand the Methods of Evaluation;5 \n \n4. \nReaffirms the established budgetary procedures and methodologies, based \non its resolutions 41/213 and 42/211; \n \n5. \nAlso reaffirms the Financial Regulations and Rules of the United Nations; 6 \n \n6. \nFurther reaffirms its resolution 74/251 of 27 December 2019; \n \n7. \nStresses that finance serves as a foundation of and an important element \nunderpinning United Nations governance; \n \n8. \nEndorses the conclusions and recommendations contained in the report of \nthe Advisory Committee on Administrative and Budgetary Questions, 4 subject to the \nprovisions of the present resolution; \n \n9. \nStresses that all Member States should fulfil their financial obligations as \nset out in the Charter of the United Nations on time, in full and without conditions; \n \n10. Notes the progress made in implementing the management reforms agreed \nin resolutions 72/266 A, 72/266 B and 73/281 on shifting the management paradigm \nin the United Nations; \n \n11. \nAlso notes that organizational reforms should contribute to greater \nefficiency and effectiveness in delivering on the Organization\u2019s mandated \nprogrammes and activities without negatively affecting their full implementation, and \n__________________ \n \n1 A/74/6 (Introduction), A/74/6 (Sect. 1), A/74/6 (Sect. 2), A/74/6 (Sect. 3), A/74/6 (Sect. 4), \nA/74/6 (Sect. 5), A/74/6 (Sect. 5)/Corr.1, A/74/6 (Sect. 6), A/74/6 (Sect. 7), A/74/6 (Sect. 8), \nA/74/6 (Sect. 8)/Corr.1, A/74/6 (Sect. 9), A/74/6 (Sect. 10), A/74/6 (Sect. 11), A/74/6 (Sect. 12), \nA/74/6 (Sect. 13), A/74/6 (Sect. 14), A/74/6 (Sect. 15), A/74/6 (Sect. 16), A/74/6 (Sect. 17), \nA/74/6 (Sect. 18), A/74/6 (Sect. 19), A/74/6 (Sect. 20), A/74/6 (Sect. 21), A/74/6 (Sect. 22), \nA/74/6 (Sect. 23), A/74/6 (Sect. 24), A/74/6 (Sect. 25), A/74/6 (Sect. 26), A/74/6 (Sect. 27), \nA/74/6 (Sect. 28), A/74/6 (Sect. 29), A/74/6 (Sect. 29A), A/74/6 (Sect. 29B), A/74/6 (Sect. 29C), \nA/74/6 (Sect. 29E), A/74/6 (Sect. 29F), A/74/6 (Sect. 29G), A/74/6 (Sect. 29H), A/74/6 (Sect. 30), \nA/74/6 (Sect. 31), A/74/6 (Sect. 32), A/74/6 (Sect. 33), A/74/6 (Sect. 34), A/74/6 (Sect .35), \nA/74/6 (Sect. 36), A/74/6 (Income sect. 1), A/74/6 (Income sect. 2) and A/74/6 (Income sect. 3). \n \n2 A/74/85. \n \n3 A/74/92. \n \n4 Official Records of the General Assembly, Seventy-fourth Session, Supplement No. 7 (A/74/7). \n \n5 ST/SGB/2018/3. \n \n6 ST/SGB/2013/4 and ST/SGB/2013/4/Amend.1. \n\nQuestions relating to the proposed programme budget for 2020 \nA/RES/74/262\n \n3/10\n19-22728 \n \nrequests the Secretary-General to provide results and examples in this regard in the \ncontext of his next budget submission; \n \n12. Reaffirms that no changes to the budget methodology, to established \nbudgetary procedures and practices or to the financial regulations may be \nimplemented without prior review and approval by the General Assembly, in \naccordance with established budgetary procedures; \n \n13. Reiterates the need for Member States to participate fully in the budget \npreparation process, from its early stages and throughout the process; \n \n14. Requests the Secretary-General to continue to strengthen internal controls \nin programme planning, budgeting, implementation, monitoring and evaluation, and \nreporting; \n \n15. Emphasizes the importance of comprehensive budgetary performance in \nthe management of the programme budget, and requests the Secretary-General to \nclearly link the budget inputs to tangible results; \n \n16. Stresses that results-based budgeting and results-based management are \nmutually supportive management tools and that improved implementation of results-\nbased budgeting enhances both management and accountability in the Secretariat, and \nencourages the Secretary-General to continue his efforts in this regard; \n \n17. Decides that a vacancy rate of 9.1 per cent for Professional staff and \n7.4 per cent for General Service staff shall be used as a basis for the calculation of \nthe budget for 2020; \n \n18. Also decides that the staffing table for 2020 shall be as set out in the annex \nto the present resolution; \n \n19. Bears in mind the rules governing the duration and extension of special \npost allowances and that the granting of such benefits should be restricted to \nexceptional cases only, and requests the Secretary-General to comply with those rules \nand review the existence of posts that have been vacant or encumbered through \nspecial post allowances for more than one year and to report thereon in his next budget \nproposal; \n \n20. Decides to reduce non-post resources for programme support components \nby 2 per cent; \n \n21. Also decides to reduce the budget for information and communications \ntechnology capital expenditures by 4 million United States dollars; \n \n22. Further decides to reduce resources for furniture and equipment by \n12.5 per cent; \n \n23. Reiterates that the use of consultants should be kept to a minimum and \nthat the Organization should use its in-house capacity to perform core activities or to \nfulfil functions that are recurrent over the long term; \n \n24. Recalls paragraph 70 of its resolution 65/247 of 24 December 2010, notes \nthe continued use of consultants in the core activities of the Organization, and in this \nregard decides to reduce the proposed resources for consultants by 10 per cent, in \naddition to the reductions recommended by the Advisory Committee; \n \n25. Decides to reduce resources for contractual services by 5 per cent; \n \n26. Also decides to reduce resources for travel of staff by 10 per cent; \n \n27. Expresses concern at the low rate of compliance with the advance purchase \npolicy directive, and requests the Secretary-General to make stronger efforts to \nfurther enhance the rate of compliance with the advance purchase policy directive \n\nA/RES/74/262 \nQuestions relating to the proposed programme budget for 2020\n \n19-22728\n4/10 \n \nacross all travel categories, taking into account the patterns and nature of official \ntravel and the reasons for non-compliance by each department, office and field \nmission; \n \n28. Decides that only the Secretary-General, the President of the General \nAssembly, the President of the International Court of Justice and heads of delegations \nof least developed countries shall be entitled to first-class accommodation for air \ntravel; \n \n29. Also decides to modify the Travel and Subsistence Regulations of the \nInternational Court of Justice contained in the annex to its resolution 37/240 of \n21 December 1982 by replacing \u201cfirst-class accommodation\u201d with \u201caccommodation \nin the class immediately below first class\u201d in article 1, paragraph 2 (a), and requests \nthe Secretary-General to further extend the scope of the advance purchase policy to \ninclude the International Court of Justice to secure further savings from business-\nclass bookings; \n \n30. Notes the efforts of the Secretary-General to strengthen training and \ndevelopment provided to staff in support of the decentralization and delegation of \ndecision-making authority; \n \n31. Stresses that all extrabudgetary posts must be administered and managed \nwith the same rigour as regular budget posts; \n \n32. Also stresses that extrabudgetary resources shall be used in consistency \nwith the policies, aims and activities of the Organization, and requests the Secretary-\nGeneral to provide information on the financial and human resource implications of \nthe use of extrabudgetary resources in the Organization in his next proposed \nprogramme budget; \n \n33. Decides to reduce resources for document printing for the formal meetings \nof the Fifth Committee by 5 million dollars in the respective sections, to contribute \nto greening the United Nations; \n \n \n \nPart I \n \n \nOverall policymaking, direction and coordination \n \n \n \nSection 1 \n \n \nOverall policymaking, direction and coordination \n \n \n34. Decides that answers provided to the Advisory Committee by the \nSecretariat shall be made available to the General Assembly, as supplementary \ninformation; \n \n35. Recalls paragraph I.23 of the report of the Advisory Committee, and looks \nforward to the annual report of the Secretary-General foreseen in resolution 72/279 \nof 31 May 2018; \n \n36. Takes note of paragraphs I.15 and I.16 of the report of the Advisory \nCommittee, decides not to approve the proposed establishment of one P-5 post to \nsupport the office of the President of the General Assembly, and decides to maintain \nthe transitionary period of one month; \n \n \n \nSection 2 \n \n \nGeneral Assembly and Economic and Social Council affairs and \nconference management \n \n \n37. Emphasizes the importance of the initiatives related to the accessibility of \npersons with disabilities to conference services and facilities; \n\nQuestions relating to the proposed programme budget for 2020 \nA/RES/74/262\n \n5/10\n19-22728 \n \n \n38. Recalls paragraph I.48 of the report of the Advisory Committee, and \ndecides to establish one P-4 post and one P-3 post (Translator) in the Chinese \nTranslation Section in Geneva; \n \n \n \nPart II \n \n \nPolitical affairs \n \n \n \nSection 3 \n \n \nPolitical affairs \n \n \n39. Recalls paragraphs 87, 88 and II.15 of the report of the Advisory \nCommittee, and decides not to abolish the post of Political Affairs Officer (P-3) in the \nCentral and Southern Africa Division in the Department of Political and \nPeacebuilding Affairs; \n \n \n \nSection 5 \n \n \nPeacekeeping operations \n \n \n40. Recognizes the important role of peacekeeping and special political \nmissions at the national, subregional, regional and international levels, as appropriate, \nin maintaining peace and security in fulfilment of their mandates; \n \n \n \nSection 6 \n \n \nPeaceful uses of outer space \n \n \n41. Notes the increased workload in the Office for Outer Space Affairs, and \nrequests the Secretary-General to review resourcing for the Office in future budget \nproposals; \n \n \n \nPart III \n \n \nInternational justice and law \n \n \n \nSection 7 \n \n \nInternational Court of Justice \n \n \n42. Decides not to approve upward reclassifications in the International Court \nof Justice; \n \n43. Also decides to reduce the resources for consultants for members of the \nCourt by 143,300 dollars; \n \n \n \nSection 8 \n \n \nLegal affairs \n \n \n44. Recalls paragraph III.35 of the report of the Advisory Committee, decides \nnot to approve the conversion of 58 general temporary assistance positions to \ntemporary posts, and decides to reduce resources accordingly; \n \n45. Takes note of paragraphs III.47, III.48, III.49, III.52, III.53, III.54, III.55 \nand III.56 of the report of the Advisory Committee; \n \n46. Decides that regular budget resources for the International, Impartial and \nIndependent Mechanism to Assist in the Investigation and Prosecution of Persons \nResponsible for the Most Serious Crimes under International Law Committed in the \nSyrian Arab Republic since March 2011 under section 8, Legal affairs, for 2020 \namount to 17,806,200 dollars before recosting; \n\nA/RES/74/262 \nQuestions relating to the proposed programme budget for 2020\n \n19-22728\n6/10 \n \n \n \nPart IV \n \n \nInternational cooperation for development \n \n \n \nSection 10 \n \n \nLeast developed countries, landlocked developing countries and small island \ndeveloping States \n \n \n47. Reaffirms the importance of the SIDS Accelerated Modalities of Action \n(SAMOA) Pathway, 7  the 2030 Agenda for Sustainable Development 8  and other \nintergovernmentally agreed outcomes, including the political declaration of the high-\nlevel midterm review of the Samoa Pathway adopted on 10 October 2019, 9 and \nencourages the Secretary-General to continue to support small island developing \nStates through the Small Island Developing States Unit in the Department of \nEconomic and Social Affairs and the Office of the High Representative for the Least \nDeveloped Countries, Landlocked Developing Countries and Small Island \nDeveloping States; \n \n48. Notes the planned deliverables of subprogramme 2, Landlocked \ndeveloping countries, and subprogramme 3, Small island developing States, for the \nperiod 2018\u20132020, regrets the inadequate resources for these subprogrammes, and in \nthis regard requests the Secretary-General to take the action necessary to ensure that \nadditional post and non-post resources are allocated to these subprogrammes in the \ncontext of the proposed programme budget for 2021 to enable them to effectively \ncarry out their increased mandates; \n \n \n \nSection 11 \n \n \nUnited Nations support for the New Partnership for Africa\u2019s Development \n \n \n49. Recalls that the development of Africa is an established priority of the \nUnited Nations, and reaffirms its commitment to address the unique needs of Africa; \n \n50. Requests the Secretary-General to fill the four vacant posts in the Office \nof the Special Adviser on Africa as expeditiously as possible; \n \n \n \nSection 14 \n \n \nEnvironment \n \n \n51. Reaffirms the mandate contained in its resolution 2997 (XXVII) of \n15 December 1972, by which it established the United Nations Environment \nProgramme, and other relevant resolutions that reinforce its mandate, as well as the \nNairobi Declaration on the Role and Mandate of the United Nations Environment \nProgramme of 7 February 1997, 10 the Malm\u00f6 Ministerial Declaration of 31 May \n200011 and the Nusa Dua Declaration of 26 February 2010;12 \n \n \n \nSection 16 \n \n \nInternational drug control, crime and terrorism prevention and \ncriminal justice \n \n \n52. Decides to establish one post of Legal Adviser (P-3) in the secretariat of \nthe International Narcotics Control Board; \n \n__________________ \n \n7 Resolution 69/15, annex. \n \n8 Resolution 70/1. \n \n9 Resolution 74/3. \n \n10 Official Records of the General Assembly, Fifty-second Session, Supplement No. 25 (A/52/25), \nannex, decision 19/1, annex. \n \n11 Ibid., Fifty-fifth Session, Supplement No. 25 (A/55/25), annex I, decision SS.VI/1, annex. \n \n12 Ibid., Sixty-fifth Session, Supplement No. 25 (A/65/25), annex I, decision SS.XI/9. \n\nQuestions relating to the proposed programme budget for 2020 \nA/RES/74/262\n \n7/10\n19-22728 \n \n \n \nPart V \n \n \nRegional cooperation for development \n \n \n \nSection 20 \n \n \nEconomic development in Europe \n \n \n53. Takes note of paragraph V.49 of the report of the Advisory Committee, and \ndecides not to establish one post of Chief of Service (D-1); \n \n54. Also takes note of paragraphs V.50 and V.54 of the report of the Advisory \nCommittee, and decides to retain one post of Associate Population Affairs Officer \n(P-2), one post of Senior Administrative Assistant (General Service (Principal level)) \nand one post of Team Assistant (General Service (Other level)); \n \n \n \nSection 21 \n \n \nEconomic and social development in Latin America and the Caribbean \n \n \n55. Welcomes the initiative of the Economic Commission for Latin America \nand the Caribbean to digitize its library and documentation systems, as well as the \napproach taken to increase the electronic distribution of its publications while \nensuring the availability of alternatives in areas with limited Internet access; \n \n56. Also welcomes the efforts of the Commission in reducing the costs of \nprinting and disseminating publications as well as the progress made in expanding \noutreach and increasing the dissemination of its publications, and encourages the \nSecretary-General to conduct an analysis to determine whether the systems and \nstrategies of the Commission can be replicated at other regional commissions and in \nUnited Nations departments and offices, and to provide an update on the matter in his \nnext budget proposal; \n \n57. Recalls paragraphs 88 and V.69 of the report of the Advisory Committee, \nand decides not to abolish one post of Associate Programme Management Officer \n(P-2) in subprogramme 3, Macroeconomic policies and growth, and one post of \nAssociate Programme Management Officer (P-2) in subprogramme 8, Natural \nresources and infrastructure, at the Commission; \n \n \n \nPart VI \n \n \nHuman rights and humanitarian affairs \n \n \n \nSection 24 \n \n \nHuman rights \n \n \n58. Recalls its resolution 68/268 of 9 April 2014, and decides to allocate a \nmaximum of four official working languages for the work of the human rights treaty \nbodies, with the inclusion, on an exceptional basis, of a fifth official language, when \nnecessary to facilitate communication among the members, as determined by the \ncommittee concerned, taking into account that these measures will not constitute a \nprecedent, given the special nature of the treaty bodies, and without prejudice to the \nright of each State party to interact with the treaty bodies in any of the six official \nlanguages of the United Nations; \n \n59. Decides not to redeploy one post of Human Rights Officer (P-3); \n \n \n \nPart VII \n \n \nGlobal communications \n \n \n \nSection 28 \n \n \nGlobal communications \n \n \n60. Notes the ongoing reform of the Department of Global Communications, \nand requests the Secretary-General to report on how the reform can contribute to \n\nA/RES/74/262 \nQuestions relating to the proposed programme budget for 2020\n \n19-22728\n8/10 \n \nimproving the full, effective and efficient implementation of its mandate both at \nHeadquarters and in the field; \n \n61. Recalls paragraph 165 of its resolution 72/261, requests the Secretary-\nGeneral to report on the maintenance and improvement of the quality and accuracy \nof official meeting coverage and press releases, and also requests the Secretary-\nGeneral to report on the qualitative and quantitative benefits of those efforts in the \ncontext of the next budget proposals; \n \n62. Takes note of paragraph VII.11 of the report of the Advisory Committee, \ndecides to establish six general temporary assistance positions in the United Nations \nInformation Service at Geneva, comprising one post of Webcast Officer (P-3), one \npost of Associate Webcast Officer (P-2) and four posts of Webcast Assistant (General \nService (Other level)), and decides not to establish one post of National Professional \nOfficer in the United Nations Information Centre in Colombo; \n \n63. Decides to establish one P-3 post in the Hindi Unit of UN News; \n \n64. Also decides to establish one P-3 post in the Urdu Unit of United Nations \nRadio; \n \n65. \nFurther decides to reduce the proposed non-post resources by 600,000 dollars; \n \n \n \nPart VIII \n \n \nCommon support services \n \n \n \nSection 29A \n \n \nDepartment of Management Strategy, Policy and Compliance \n \n \n66. Recalls paragraphs 9, 10 and 11 of its resolution 72/266 B, underlines the \ncrucial role of training in accompanying reform through organizational and cultural \nchange, takes note of paragraphs VIII.16, VIII.17 and VIII.20 of the report of the \nAdvisory Committee, and decides to reduce the proposed training resources by \n700,000 dollars; \n \n \n \nSection 29B \n \n \nDepartment of Operational Support \n \n \n67. Recalls paragraphs 9 and 10 of its resolution 72/266 B, and underlines the \ncrucial role of training in accompanying reform through organizational and cultural \nchange; \n \n68. Takes note of paragraph VIII.33 of the report of the Advisory Committee; \n \n \n \nSection 29C \n \n \nOffice of Information and Communications Technology \n \n \n69. Approves an additional appropriation in the amount of 199,500 dollars for \nimproving accessibility for persons with disabilities and others to United Nations \npremises in New York through the development of a way-finder program, under \nsection 29C, Office of Information and Communications Technology; \n \n \n \nSection 29E \n \n \nAdministration, Geneva \n \n \n70. Recalls paragraph VIII.70 of the report of the Advisory Committee, and \ndecides not to approve the upward classification of one post of Chief of the \nInformation and Communications Technology Service (P-5) as a D-1 in \nsubprogramme 4, Information and communications technology operations; \n \n71. Decides to further reduce resources by 100,100 dollars; \n\nQuestions relating to the proposed programme budget for 2020 \nA/RES/74/262\n \n9/10\n19-22728 \n \n \n \nSection 29G \n \n \nAdministration, Nairobi \n \n \n72. Recalls paragraph VIII.98 of the report of the Advisory Committee, and \ndecides not to approve the reclassification of one post of Procurement Officer (P-3) \nas a P-4 post and one post of Travel Officer (P-2) as a P-3 post; \n \n73. Decides not to abolish one post of Procurement Assistant (Local level) \n(subprogramme 3, Support services); \n \n \n \nPart IX \n \n \nInternal oversight \n \n \n \nSection 30 \n \n \nInternal oversight \n \n \n74. Takes note of paragraph IX.12 of the Advisory Committee, and decides to \nestablish three general temporary assistance positions of Investigator (1 P-4 and \n2 P-3) in the Vienna Investigations Office; \n \n \n \nPart XII \n \n \nSafety and security \n \n \n \nSection 34 \n \n \nSafety and security \n \n \n75. Decides not to abolish 10 posts of Security Officer (Local level) in the \nSecurity and Safety Service in Beirut and to apply a 50 per cent vacancy rate; \n \n76. Recalls paragraph XII.22 of the report of the Advisory Committee, and \ndecides to approve resources for the malicious acts insurance policy for 2020 in the \namount 3,996,107 dollars; \n \n \n \nIncome section 3 \n \n \nServices to the public \n \n \n77. Decides to reduce non-post resources for catering operations by 250,000 \ndollars, and also decides not to allocate resources for the renovation of the Vienna \nCaf\u00e9. \n \n52nd (resumed) plenary meeting \n27 December 2019 \n \n \n\nA/RES/74/262 \nQuestions relating to the proposed programme budget for 2020\n \n19-22728\n10/10 \n \nAnnex \n \n \n Staffing table for 2020 \n \n \nCategory \nNumber of posts \nProfessional and higher \n \nDeputy Secretary-General \n1 \nUnder-Secretary-General \n36 \nAssistant Secretary-General \n32 \nD-2 \n116 \nD-1 \n298 \nP-5 \n902 \nP-4 \n1 532 \nP-3 \n1 445 \nP-2/1 \n522 \nSubtotal \n4 884 \nGeneral Service and related \n \nPrincipal level \n271 \nOther level \n2 313 \nSubtotal \n2 584 \nOther \n \nSecurity Service \n307 \nLocal level \n1 908 \nField Service \n107 \nNational Professional Officer \n87 \nTrades and Crafts \n95 \nSubtotal \n2 504 \nTotal \n9 972 \n \n",
  "paragraphs": {
    "1": "Reaffirms that the Fifth Committee is the appropriate Main Committee of the General Assembly entrusted with responsibilities for administrative and budgetary matters, and reaffirms the role of the Fifth Committee in carrying out a thorough analysis and approving human and financial resources and policies, with a view to ensuring full, effective and efficient implementation of all mandated programmes and activities and the implementation of policies in this regard;",
    "2": "Also reaffirms rule 153 of its rules of procedure;",
    "3": "Further reaffirms the Regulations and Rules Governing Programme Planning, the Programme Aspects of the Budget, the Monitoring of Implementation and the Methods of Evaluation;5",
    "4": "Reaffirms the established budgetary procedures and methodologies, based on its resolutions 41/213 and 42/211;",
    "5": "Also reaffirms the Financial Regulations and Rules of the United Nations; 6",
    "6": "Further reaffirms its resolution 74/251 of 27 December 2019;",
    "7": "Stresses that finance serves as a foundation of and an important element underpinning United Nations governance;",
    "8": "Endorses the conclusions and recommendations contained in the report of the Advisory Committee on Administrative and Budgetary Questions, 4 subject to the provisions of the present resolution;",
    "9": "Stresses that all Member States should fulfil their financial obligations as set out in the Charter of the United Nations on time, in full and without conditions;",
    "10": "Notes the progress made in implementing the management reforms agreed in resolutions 72/266 A, 72/266 B and 73/281 on shifting the management paradigm in the United Nations;",
    "11": "Also notes that organizational reforms should contribute to greater efficiency and effectiveness in delivering on the Organization\u2019s mandated programmes and activities without negatively affecting their full implementation, and __________________ 1 A/74/6 (Introduction), A/74/6 (Sect. 1), A/74/6 (Sect. 2), A/74/6 (Sect. 3), A/74/6 (Sect. 4), A/74/6 (Sect. 5), A/74/6 (Sect. 5)/Corr.1, A/74/6 (Sect. 6), A/74/6 (Sect. 7), A/74/6 (Sect. 8), A/74/6 (Sect. 8)/Corr.1, A/74/6 (Sect. 9), A/74/6 (Sect. 10), A/74/6 (Sect. 11), A/74/6 (Sect. 12), A/74/6 (Sect. 13), A/74/6 (Sect. 14), A/74/6 (Sect. 15), A/74/6 (Sect. 16), A/74/6 (Sect. 17), A/74/6 (Sect. 18), A/74/6 (Sect. 19), A/74/6 (Sect. 20), A/74/6 (Sect. 21), A/74/6 (Sect. 22), A/74/6 (Sect. 23), A/74/6 (Sect. 24), A/74/6 (Sect. 25), A/74/6 (Sect. 26), A/74/6 (Sect. 27), A/74/6 (Sect. 28), A/74/6 (Sect. 29), A/74/6 (Sect. 29A), A/74/6 (Sect. 29B), A/74/6 (Sect. 29C), A/74/6 (Sect. 29E), A/74/6 (Sect. 29F), A/74/6 (Sect. 29G), A/74/6 (Sect. 29H), A/74/6 (Sect. 30), A/74/6 (Sect. 31), A/74/6 (Sect. 32), A/74/6 (Sect. 33), A/74/6 (Sect. 34), A/74/6 (Sect .35), A/74/6 (Sect. 36), A/74/6 (Income sect. 1), A/74/6 (Income sect. 2) and A/74/6 (Income sect. 3). 2 A/74/85. 3 A/74/92. 4 Official Records of the General Assembly, Seventy-fourth Session, Supplement No. 7 (A/74/7). 5 ST/SGB/2018/3. 6 ST/SGB/2013/4 and ST/SGB/2013/4/Amend.1. Questions relating to the proposed programme budget for 2020 A/RES/74/262 3/10 19-22728 requests the Secretary-General to provide results and examples in this regard in the context of his next budget submission;",
    "12": "Reaffirms that no changes to the budget methodology, to established budgetary procedures and practices or to the financial regulations may be implemented without prior review and approval by the General Assembly, in accordance with established budgetary procedures;",
    "13": "Reiterates the need for Member States to participate fully in the budget preparation process, from its early stages and throughout the process;",
    "14": "Requests the Secretary-General to continue to strengthen internal controls in programme planning, budgeting, implementation, monitoring and evaluation, and reporting;",
    "15": "Emphasizes the importance of comprehensive budgetary performance in the management of the programme budget, and requests the Secretary-General to clearly link the budget inputs to tangible results;",
    "16": "Stresses that results-based budgeting and results-based management are mutually supportive management tools and that improved implementation of results- based budgeting enhances both management and accountability in the Secretariat, and encourages the Secretary-General to continue his efforts in this regard;",
    "17": "Decides that a vacancy rate of 9.1 per cent for Professional staff and 7.4 per cent for General Service staff shall be used as a basis for the calculation of the budget for 2020;",
    "18": "Also decides that the staffing table for 2020 shall be as set out in the annex to the present resolution;",
    "19": "Bears in mind the rules governing the duration and extension of special post allowances and that the granting of such benefits should be restricted to exceptional cases only, and requests the Secretary-General to comply with those rules and review the existence of posts that have been vacant or encumbered through special post allowances for more than one year and to report thereon in his next budget proposal;",
    "20": "Decides to reduce non-post resources for programme support components by 2 per cent;",
    "21": "Also decides to reduce the budget for information and communications technology capital expenditures by 4 million United States dollars;",
    "22": "Further decides to reduce resources for furniture and equipment by 12.5 per cent;",
    "23": "Reiterates that the use of consultants should be kept to a minimum and that the Organization should use its in-house capacity to perform core activities or to fulfil functions that are recurrent over the long term;",
    "24": "Recalls paragraph 70 of its resolution 65/247 of 24 December 2010, notes the continued use of consultants in the core activities of the Organization, and in this regard decides to reduce the proposed resources for consultants by 10 per cent, in addition to the reductions recommended by the Advisory Committee;",
    "25": "Decides to reduce resources for contractual services by 5 per cent;",
    "26": "Also decides to reduce resources for travel of staff by 10 per cent;",
    "27": "Expresses concern at the low rate of compliance with the advance purchase policy directive, and requests the Secretary-General to make stronger efforts to further enhance the rate of compliance with the advance purchase policy directive A/RES/74/262 Questions relating to the proposed programme budget for 2020 19-22728 4/10 across all travel categories, taking into account the patterns and nature of official travel and the reasons for non-compliance by each department, office and field mission;",
    "28": "Decides that only the Secretary-General, the President of the General Assembly, the President of the International Court of Justice and heads of delegations of least developed countries shall be entitled to first-class accommodation for air travel;",
    "29": "Also decides to modify the Travel and Subsistence Regulations of the International Court of Justice contained in the annex to its resolution 37/240 of 21 December 1982 by replacing \u201cfirst-class accommodation\u201d with \u201caccommodation in the class immediately below first class\u201d in article 1, paragraph 2 (a), and requests the Secretary-General to further extend the scope of the advance purchase policy to include the International Court of Justice to secure further savings from business- class bookings;",
    "30": "Notes the efforts of the Secretary-General to strengthen training and development provided to staff in support of the decentralization and delegation of decision-making authority;",
    "31": "Stresses that all extrabudgetary posts must be administered and managed with the same rigour as regular budget posts;",
    "32": "Also stresses that extrabudgetary resources shall be used in consistency with the policies, aims and activities of the Organization, and requests the Secretary- General to provide information on the financial and human resource implications of the use of extrabudgetary resources in the Organization in his next proposed programme budget;",
    "33": "Decides to reduce resources for document printing for the formal meetings of the Fifth Committee by 5 million dollars in the respective sections, to contribute to greening the United Nations; Part I Overall policymaking, direction and coordination Section 1 Overall policymaking, direction and coordination",
    "34": "Decides that answers provided to the Advisory Committee by the Secretariat shall be made available to the General Assembly, as supplementary information;",
    "35": "Recalls paragraph I.23 of the report of the Advisory Committee, and looks forward to the annual report of the Secretary-General foreseen in resolution 72/279 of 31 May 2018;",
    "36": "Takes note of paragraphs I.15 and I.16 of the report of the Advisory Committee, decides not to approve the proposed establishment of one P-5 post to support the office of the President of the General Assembly, and decides to maintain the transitionary period of one month; Section 2 General Assembly and Economic and Social Council affairs and conference management",
    "37": "Emphasizes the importance of the initiatives related to the accessibility of persons with disabilities to conference services and facilities; Questions relating to the proposed programme budget for 2020 A/RES/74/262 5/10 19-22728",
    "38": "Recalls paragraph I.48 of the report of the Advisory Committee, and decides to establish one P-4 post and one P-3 post (Translator) in the Chinese Translation Section in Geneva; Part II Political affairs Section 3 Political affairs",
    "39": "Recalls paragraphs 87, 88 and II.15 of the report of the Advisory Committee, and decides not to abolish the post of Political Affairs Officer (P-3) in the Central and Southern Africa Division in the Department of Political and Peacebuilding Affairs; Section 5 Peacekeeping operations",
    "40": "Recognizes the important role of peacekeeping and special political missions at the national, subregional, regional and international levels, as appropriate, in maintaining peace and security in fulfilment of their mandates; Section 6 Peaceful uses of outer space",
    "41": "Notes the increased workload in the Office for Outer Space Affairs, and requests the Secretary-General to review resourcing for the Office in future budget proposals; Part III International justice and law Section 7 International Court of Justice",
    "42": "Decides not to approve upward reclassifications in the International Court of Justice;",
    "43": "Also decides to reduce the resources for consultants for members of the Court by 143,300 dollars; Section 8 Legal affairs",
    "44": "Recalls paragraph III.35 of the report of the Advisory Committee, decides not to approve the conversion of 58 general temporary assistance positions to temporary posts, and decides to reduce resources accordingly;",
    "45": "Takes note of paragraphs III.47, III.48, III.49, III.52, III.53, III.54, III.55 and III.56 of the report of the Advisory Committee;",
    "46": "Decides that regular budget resources for the International, Impartial and Independent Mechanism to Assist in the Investigation and Prosecution of Persons Responsible for the Most Serious Crimes under International Law Committed in the Syrian Arab Republic since March 2011 under section 8, Legal affairs, for 2020 amount to 17,806,200 dollars before recosting; A/RES/74/262 Questions relating to the proposed programme budget for 2020 19-22728 6/10 Part IV International cooperation for development Section 10 Least developed countries, landlocked developing countries and small island developing States",
    "47": "Reaffirms the importance of the SIDS Accelerated Modalities of Action (SAMOA) Pathway, 7 the 2030 Agenda for Sustainable Development 8 and other intergovernmentally agreed outcomes, including the political declaration of the high- level midterm review of the Samoa Pathway adopted on 10 October 2019, 9 and encourages the Secretary-General to continue to support small island developing States through the Small Island Developing States Unit in the Department of Economic and Social Affairs and the Office of the High Representative for the Least Developed Countries, Landlocked Developing Countries and Small Island Developing States;",
    "48": "Notes the planned deliverables of subprogramme 2, Landlocked developing countries, and subprogramme 3, Small island developing States, for the period 2018\u20132020, regrets the inadequate resources for these subprogrammes, and in this regard requests the Secretary-General to take the action necessary to ensure that additional post and non-post resources are allocated to these subprogrammes in the context of the proposed programme budget for 2021 to enable them to effectively carry out their increased mandates; Section 11 United Nations support for the New Partnership for Africa\u2019s Development",
    "49": "Recalls that the development of Africa is an established priority of the United Nations, and reaffirms its commitment to address the unique needs of Africa;",
    "50": "Requests the Secretary-General to fill the four vacant posts in the Office of the Special Adviser on Africa as expeditiously as possible; Section 14 Environment",
    "51": "Reaffirms the mandate contained in its resolution 2997 (XXVII) of 15 December 1972, by which it established the United Nations Environment Programme, and other relevant resolutions that reinforce its mandate, as well as the Nairobi Declaration on the Role and Mandate of the United Nations Environment Programme of 7 February 1997, 10 the Malm\u00f6 Ministerial Declaration of 31 May 200011 and the Nusa Dua Declaration of 26 February 2010;12 Section 16 International drug control, crime and terrorism prevention and criminal justice",
    "52": "Decides to establish one post of Legal Adviser (P-3) in the secretariat of the International Narcotics Control Board; __________________ 7 Resolution 69/15, annex. 8 Resolution 70/1. 9 Resolution 74/3. 10 Official Records of the General Assembly, Fifty-second Session, Supplement No. 25 (A/52/25), annex, decision 19/1, annex. 11 Ibid., Fifty-fifth Session, Supplement No. 25 (A/55/25), annex I, decision SS.VI/1, annex. 12 Ibid., Sixty-fifth Session, Supplement No. 25 (A/65/25), annex I, decision SS.XI/9. Questions relating to the proposed programme budget for 2020 A/RES/74/262 7/10 19-22728 Part V Regional cooperation for development Section 20 Economic development in Europe",
    "53": "Takes note of paragraph V.49 of the report of the Advisory Committee, and decides not to establish one post of Chief of Service (D-1);",
    "54": "Also takes note of paragraphs V.50 and V.54 of the report of the Advisory Committee, and decides to retain one post of Associate Population Affairs Officer (P-2), one post of Senior Administrative Assistant (General Service (Principal level)) and one post of Team Assistant (General Service (Other level)); Section 21 Economic and social development in Latin America and the Caribbean",
    "55": "Welcomes the initiative of the Economic Commission for Latin America and the Caribbean to digitize its library and documentation systems, as well as the approach taken to increase the electronic distribution of its publications while ensuring the availability of alternatives in areas with limited Internet access;",
    "56": "Also welcomes the efforts of the Commission in reducing the costs of printing and disseminating publications as well as the progress made in expanding outreach and increasing the dissemination of its publications, and encourages the Secretary-General to conduct an analysis to determine whether the systems and strategies of the Commission can be replicated at other regional commissions and in United Nations departments and offices, and to provide an update on the matter in his next budget proposal;",
    "57": "Recalls paragraphs 88 and V.69 of the report of the Advisory Committee, and decides not to abolish one post of Associate Programme Management Officer (P-2) in subprogramme 3, Macroeconomic policies and growth, and one post of Associate Programme Management Officer (P-2) in subprogramme 8, Natural resources and infrastructure, at the Commission; Part VI Human rights and humanitarian affairs Section 24 Human rights",
    "58": "Recalls its resolution 68/268 of 9 April 2014, and decides to allocate a maximum of four official working languages for the work of the human rights treaty bodies, with the inclusion, on an exceptional basis, of a fifth official language, when necessary to facilitate communication among the members, as determined by the committee concerned, taking into account that these measures will not constitute a precedent, given the special nature of the treaty bodies, and without prejudice to the right of each State party to interact with the treaty bodies in any of the six official languages of the United Nations;",
    "59": "Decides not to redeploy one post of Human Rights Officer (P-3); Part VII Global communications Section 28 Global communications",
    "60": "Notes the ongoing reform of the Department of Global Communications, and requests the Secretary-General to report on how the reform can contribute to A/RES/74/262 Questions relating to the proposed programme budget for 2020 19-22728 8/10 improving the full, effective and efficient implementation of its mandate both at Headquarters and in the field;",
    "61": "Recalls paragraph 165 of its resolution 72/261, requests the Secretary- General to report on the maintenance and improvement of the quality and accuracy of official meeting coverage and press releases, and also requests the Secretary- General to report on the qualitative and quantitative benefits of those efforts in the context of the next budget proposals;",
    "62": "Takes note of paragraph VII.11 of the report of the Advisory Committee, decides to establish six general temporary assistance positions in the United Nations Information Service at Geneva, comprising one post of Webcast Officer (P-3), one post of Associate Webcast Officer (P-2) and four posts of Webcast Assistant (General Service (Other level)), and decides not to establish one post of National Professional Officer in the United Nations Information Centre in Colombo;",
    "63": "Decides to establish one P-3 post in the Hindi Unit of UN News;",
    "64": "Also decides to establish one P-3 post in the Urdu Unit of United Nations Radio;",
    "65": "Further decides to reduce the proposed non-post resources by 600,000 dollars; Part VIII Common support services Section 29A Department of Management Strategy, Policy and Compliance",
    "66": "Recalls paragraphs 9, 10 and 11 of its resolution 72/266 B, underlines the crucial role of training in accompanying reform through organizational and cultural change, takes note of paragraphs VIII.16, VIII.17 and VIII.20 of the report of the Advisory Committee, and decides to reduce the proposed training resources by 700,000 dollars; Section 29B Department of Operational Support",
    "67": "Recalls paragraphs 9 and 10 of its resolution 72/266 B, and underlines the crucial role of training in accompanying reform through organizational and cultural change;",
    "68": "Takes note of paragraph VIII.33 of the report of the Advisory Committee; Section 29C Office of Information and Communications Technology",
    "69": "Approves an additional appropriation in the amount of 199,500 dollars for improving accessibility for persons with disabilities and others to United Nations premises in New York through the development of a way-finder program, under section 29C, Office of Information and Communications Technology; Section 29E Administration, Geneva",
    "70": "Recalls paragraph VIII.70 of the report of the Advisory Committee, and decides not to approve the upward classification of one post of Chief of the Information and Communications Technology Service (P-5) as a D-1 in subprogramme 4, Information and communications technology operations;",
    "71": "Decides to further reduce resources by 100,100 dollars; Questions relating to the proposed programme budget for 2020 A/RES/74/262 9/10 19-22728 Section 29G Administration, Nairobi",
    "72": "Recalls paragraph VIII.98 of the report of the Advisory Committee, and decides not to approve the reclassification of one post of Procurement Officer (P-3) as a P-4 post and one post of Travel Officer (P-2) as a P-3 post;",
    "73": "Decides not to abolish one post of Procurement Assistant (Local level) (subprogramme 3, Support services); Part IX Internal oversight Section 30 Internal oversight",
    "74": "Takes note of paragraph IX.12 of the Advisory Committee, and decides to establish three general temporary assistance positions of Investigator (1 P-4 and 2 P-3) in the Vienna Investigations Office; Part XII Safety and security Section 34 Safety and security",
    "75": "Decides not to abolish 10 posts of Security Officer (Local level) in the Security and Safety Service in Beirut and to apply a 50 per cent vacancy rate;",
    "76": "Recalls paragraph XII.22 of the report of the Advisory Committee, and decides to approve resources for the malicious acts insurance policy for 2020 in the amount 3,996,107 dollars; Income section 3 Services to the public",
    "77": "Decides to reduce non-post resources for catering operations by 250,000 dollars, and also decides not to allocate resources for the renovation of the Vienna Caf\u00e9. 52nd (resumed) plenary meeting 27 December 2019 A/RES/74/262 Questions relating to the proposed programme budget for 2020 19-22728 10/10 Annex Staffing table for 2020 Category Number of posts Professional and higher Deputy Secretary-General 1 Under-Secretary-General 36 Assistant Secretary-General 32 D-2 116 D-1 298 P-5 902 P-4 1 532 P-3 1 445 P-2/1 522 Subtotal 4 884 General Service and related Principal level 271 Other level 2 313 Subtotal 2 584 Other Security Service 307 Local level 1 908 Field Service 107 National Professional Officer 87 Trades and Crafts 95 Subtotal 2 504 Total 9 972"
  },
  "agenda_items": [
    "Item 135"
  ],
  "symbol_references": []
}