{
  "symbol": "A/RES/77/17",
  "filename": "A_RES_77_17.pdf",
  "title": "77/17. Cooperation between the United Nations and the League of Arab States",
  "text": "United Nations \nA/RES/77/17\n \n \nGeneral Assembly \nDistr.: General \n28 November 2022 \n \n22-26539 (E)    011222     \n*2226539* \n \n \nSeventy-seventh session \nAgenda item 127 (d) \nCooperation between the United Nations and regional \nand other organizations: cooperation between the \nUnited Nations and the League of Arab States \n \n \n \n \n Resolution adopted by the General Assembly \non 21 November 2022 \n \n \n \n \n[without reference to a Main Committee (A/77/L.17)] \n \n \n \n77/17. Cooperation between the United Nations and the League of \nArab States \n \n \n \nThe General Assembly, \n \nRecalling its previous resolutions on cooperation between the United Nations \nand the League of Arab States, \n \nRecalling also article 3 of the Charter of the League of Arab States, 1 which \nentrusts the Council of the League of Arab States with the function of identifying the \nmeans whereby it will collaborate with international organizations to maintain \ninternational peace and security and to promote, organize and strengthen relations in \nall fields, \n \nTaking into consideration the report of the Secretary-General entitled \u201cAn \nAgenda for Peace\u201d,2 in particular section VII concerning cooperation with regional \norganizations, and the report of the Secretary-General entitled \u201cSupplement to an \nAgenda for Peace\u201d,3 \n \nRecognizing the need for further strengthening of cooperation between the \nUnited Nations and the League of Arab States for the realization of the common goals \nand objectives of the two organizations, \n__________________ \n \n1  United Nations, Treaty Series, vol. 70, No. 241. \n \n2  A/47/277-S/24111. \n \n3  A/50/60-S/1995/1. \n\nA/RES/77/17 \nCooperation between the United Nations and the League of \nArab States\n \n22-26539\n2/3 \n \n \nRecalling the statements by the President of the Security Council of 13 June \n2019,4 29 January 20215 and 23 March 20226 that, inter alia, focused on developing \ncooperation between the United Nations and the League of Arab States, welcomed \nthe opening of the United Nations Liaison Office to the League of Arab States in \nCairo and commended the work of the Liaison Office to strengthen institutional \nrelations and cooperation to enhance strategic and operational partnership between \nthe two organizations, \n \nTaking into consideration the provisions of the protocol of amendment of the \ntext of the cooperation agreement between the United Nations and the League of Arab \nStates signed in September 2016, which call for strengthening cooperation between \nthe two organizations in new areas, including conflict resolution and prevention, in \naddition to peacebuilding and sustaining peace, \n \nWelcoming the outcome of the fifteenth general cooperation meeting between \nthe United Nations and the League of Arab States, which was convened at the United \nNations Office at Geneva on 13 and 14 July 2022, during which cooperation in various \nfields was discussed, including in political, security, economic and social areas and \nother relevant issues, \n \n1. \nRequests the secretariats of the United Nations and the League of Arab \nStates to follow up on the implementation of the recommendations and resolutions of \nthe fifteenth general cooperation meeting to assist the Arab States in confronting \nexisting and emerging challenges, including overcoming the economic, social and \nother repercussions resulting from the outbreak of the coronavirus disease \n(COVID-19) pandemic in the region; \n \n2. \nCalls upon both secretariats to exert further efforts to enhance existing \ncooperation in all areas of common interest, and requests the Secretariat of the United \nNations to promote and build the capacities of the staff members of organs of the \nLeague of Arab States dealing with peacekeeping, peacemaking and peacebuilding, \nas well as sustaining peace and building national capacities in the post-conflict phase, \nand to strengthen further cooperation between the two sides in this regard through \ntheir accredited representations; \n \n3. \nStresses the importance of the two secretariats continuing periodic \nconsultations, at all levels, including United Nations envoys and special \nrepresentatives of the Secretary-General, on the topics of the agenda of the Council \nof the League of Arab States, to reach effective common solutions to the crises in the \nArab region, through the exchange of information and the strengthening of \ncoordination, consultation and follow-up mechanisms; \n \n4. \nLooks forward to both secretariats convening the fifteenth sectoral meeting \nbetween the two organizations and their specialized agencies on \u201cCooperation in \nclimate change\u201d in Cairo at the beginning of 2023, and the sixteenth general \ncooperation meeting between the two systems in 2024 at the United Nations Office at \nGeneva; \n \n5. \nRequests the United Nations specialized agencies, programmes and \ninstitutions to continue their interaction with their counterparts in the organizations \nand institutions of the League of Arab States and to improve their consultation \nmechanisms for the implementation of the projects and programmes agreed upon \nbetween both sides, taking into consideration their expertise in various fields; \n__________________ \n \n4  S/PRST/2019/5. \n \n5  S/PRST/2021/2. \n \n6  S/PRST/2022/1. \n\nCooperation between the United Nations and the League of \nArab States \nA/RES/77/17\n \n3/3\n22-26539 \n \n \n6. \nCalls upon the United Nations specialized agencies, institutions and \nprogrammes to inform the Secretary-General, no later than January 2024, of the \nprogress achieved in their cooperation with the League of Arab States, particularly in \nimplementing the multilateral decisions and programmes approved by the fifteenth \ngeneral cooperation meeting between the two organizations; \n \n7. \nRequests the Secretary-General to submit a report on the implementation \nof the present resolution to the General Assembly at its seventy-ninth session. \n \n39th plenary meeting \n21 November 2022 \n \n",
  "paragraphs": {
    "1": "Requests the secretariats of the United Nations and the League of Arab States to follow up on the implementation of the recommendations and resolutions of the fifteenth general cooperation meeting to assist the Arab States in confronting existing and emerging challenges, including overcoming the economic, social and other repercussions resulting from the outbreak of the coronavirus disease (COVID-19) pandemic in the region;",
    "2": "Calls upon both secretariats to exert further efforts to enhance existing cooperation in all areas of common interest, and requests the Secretariat of the United Nations to promote and build the capacities of the staff members of organs of the League of Arab States dealing with peacekeeping, peacemaking and peacebuilding, as well as sustaining peace and building national capacities in the post-conflict phase, and to strengthen further cooperation between the two sides in this regard through their accredited representations;",
    "3": "Stresses the importance of the two secretariats continuing periodic consultations, at all levels, including United Nations envoys and special representatives of the Secretary-General, on the topics of the agenda of the Council of the League of Arab States, to reach effective common solutions to the crises in the Arab region, through the exchange of information and the strengthening of coordination, consultation and follow-up mechanisms;",
    "4": "Looks forward to both secretariats convening the fifteenth sectoral meeting between the two organizations and their specialized agencies on \u201cCooperation in climate change\u201d in Cairo at the beginning of 2023, and the sixteenth general cooperation meeting between the two systems in 2024 at the United Nations Office at Geneva;",
    "5": "Requests the United Nations specialized agencies, programmes and institutions to continue their interaction with their counterparts in the organizations and institutions of the League of Arab States and to improve their consultation mechanisms for the implementation of the projects and programmes agreed upon between both sides, taking into consideration their expertise in various fields;",
    "6": "Calls upon the United Nations specialized agencies, institutions and programmes to inform the Secretary-General, no later than January 2024, of the progress achieved in their cooperation with the League of Arab States, particularly in implementing the multilateral decisions and programmes approved by the fifteenth general cooperation meeting between the two organizations;",
    "7": "Requests the Secretary-General to submit a report on the implementation of the present resolution to the General Assembly at its seventy-ninth session."
  },
  "agenda_items": [
    "Item 127"
  ],
  "symbol_references": [
    "A/77/L.17"
  ]
}