{
  "symbol": "A/RES/72/262",
  "filename": "A_RES_72_262.pdf",
  "title": "72/262. Special subjects relating to the proposed programme budget for the biennium 2018\u20132019",
  "text": "United Nations \nA/RES/72/262\n \n \nGeneral Assembly \nDistr.: General \n16 January 2018 \n \n17-23363 (E)    190118  \n*1723363* \n \n \nSeventy-second session \nAgenda item 136 \n \n \n \n \n Resolution adopted by the General Assembly \non 24 December 2017 \n \n \n \n \n[on the report of the Fifth Committee (A/72/681 and A/72/681/Corr.1)] \n \n \n 72/262. Special subjects relating to the proposed programme budget \nfor the biennium 2018\u20132019 \n \n \n \nThe General Assembly, \n \nI \nInternational Public Sector Accounting Standards \n \n \nRecalling section IV of its resolution 60/283 of 7 July 2006, section V of its \nresolution 63/262 of 24 December 2008, its resolution 64/243 of 24 December 2009, \nits resolution 65/243 A and section II.B of its resolution 65/259 of 24 December 2010, \nsection I of its resolution 66/232 B of 21 June 2012, its resolution 66/246 of \n24 December 2011, section IV of its resolution 67/246 of 24 December 2012, its \nresolution 68/246 of 27 December 2013, section II of its resolution 68/247 A of \n27 December 2013, section I of its resolution 69/262 of 29 December 2014, section I \nof its resolution 70/248 A of 23 December 2015 and section I of its resolution \n71/272 A of 23 December 2016, \n \nHaving considered the tenth and final progress report of the Secretary-General \non the adoption of the International Public Sector Accounting Standards by the United \nNations1 and the related report of the Advisory Committee on Administrative and \nBudgetary Questions,2  \n \n1. \nTakes note of the report of the Secretary-General;1 \n \n2. \nEndorses the conclusions and recommendations contained in the report of \nthe Advisory Committee on Administrative and Budgetary Questions; 2 \n \n__________________ \n \n1  A/72/213. \n \n2  A/72/7/Add.4. \n\nA/RES/72/262 \nSpecial subjects relating to the proposed programme budget for the biennium 2018\u20132019\n \n17-23363 \n2/27 \n \nII \nConditions of service and compensation for officials, other than Secretariat \nofficials, serving the General Assembly: full-time members of the International \nCivil Service Commission and the Chair of the Advisory Committee  \non Administrative and Budgetary Questions \n \n \nRecalling its resolution 35/221 of 17 December 1980, section VII of its \nresolution 55/238 of 23 December 2000, its resolution 58/266 of 23 December 2003, \nsection III of its resolution 65/268 of 4 April 2011 and its resolution 68/247 A, \n \nHaving considered the report of the Secretary-General,3  \n \nTakes note of the report of the Secretary-General;3 \n \nIII \nStrategic capital review \n \n \nRecalling section III of its resolution 65/259, section V of its resolution \n68/247 B of 9 April 2014, section VII of its resolution 69/262, section II of its \nresolution 69/274 A of 2 April 2015, section VI of its resolution 70/248 B of 1 April \n2016 and section XVI of its resolution 71/272 A,  \n \nHaving considered the report of the Secretary-General4 and the related report of \nthe Advisory Committee,5  \n \n1. \nTakes note of the report of the Secretary-General;4  \n \n2. \nEndorses the conclusions and recommendations contained in the report of \nthe Advisory Committee;5 \n \n3. \nRequests the Secretary-General to ensure that the largest and most \ncomplex capital expenditure projects are not implemented simultaneously, in order to \nprevent the need to finance them at the same time; \n \n4. \nRecalls paragraph 6 of section V of its resolution 68/247 B, and reaffirms \nthat any potential proposals stemming from the strategic capital review with \nbudgetary implications should follow the procedure set out in the Financial \nRegulations and Rules of the United Nations;6  \n \nIV \nRevised estimates relating to the Office of Counter-Terrorism under section 3, \nPolitical affairs, section 29D, Office of Central Support Services, and \nsection 36, Staff assessment \n \n \nHaving considered the report of the Secretary-General7 and the related report of \nthe Advisory Committee,8  \n \n1. \nTakes note of the report of the Secretary-General;7 \n \n2. \nEndorses the conclusions and recommendations contained in the report of \nthe Advisory Committee;8 \n \n3. \nApproves the additional resources proposed in the amount of 1,097,700 \nUnited States dollars (net of staff assessment);  \n__________________ \n \n3  A/72/366. \n \n4  A/72/393. \n \n5  A/72/7/Add.9. \n \n6  ST/SGB/2013/4. \n \n7  A/72/117. \n \n8  A/72/7/Add.1. \n\nSpecial subjects relating to the proposed programme budget for the biennium 2018\u20132019 \nA/RES/72/262\n \n3/27 \n17-23363 \n \n \n4. \nAppropriates an additional amount of 1,097,700 dollars (net of staff \nassessment) under section 3, Political affairs (1,034,100 dollars), and section 29D, \nOffice of Central Support Services (63,600 dollars) of the proposed programme \nbudget for the biennium 2018\u20132019, which would represent a charge against the \ncontingency fund;  \n \n5. \nAlso appropriates the amount of 124,200 dollars under section 36, Staff \nassessment, to be offset by an equivalent amount under income section 1, Income from \nstaff assessment, of the proposed programme budget for the biennium \n2018\u20132019;  \n \nV \nProposal for the renovation of the North Building at the Economic Commission \nfor Latin America and the Caribbean in Santiago \n \n \nRecalling section VII of its resolution 69/274 A and section VI of its resolution \n70/248 B, \n \nHaving considered the report of the Secretary-General9 and the related report of \nthe Advisory Committee,10  \n \n1. \nTakes note of the report of the Secretary-General;9 \n \n2. \nEndorses the conclusions and recommendations contained in the report of \nthe Advisory Committee,10 subject to the provisions of the present resolution;  \n \n3. \nAcknowledges the important role played by the host countries in \nfacilitating the maintenance and construction of United Nations facilities, and stresses \nthe value of continued collaboration with host countries in this regard;  \n \n4. \nExpresses its gratitude to the Government of Chile, as the host country, \nfor the continued efforts in supporting and facilitating the work of the Economic \nCommission for Latin America and the Caribbean;  \n \n5. \nRecalls paragraph 22 of the report of the Advisory Committee, and stresses \nthe necessity to ensure compliance with all relevant regulations, including provisions \nfor persons with disabilities concerning accessibility and technology;  \n \n6. \nTakes note of paragraph 29 of the report of the Advisory Committee, and \ndecides to approve the scope of the project as it relates to seismic mitigation;  \n \n7. \nRecalls paragraph 33 of the report of the Advisory Committee, takes note \nof the overall scope and maximum estimated cost of the project, and requests the \nSecretary-General to refine the proposal and present it during the main part of the \nseventy-third session of the General Assembly;  \n \n8. \nRequests that the Secretary-General present a detailed analysis of the range \nof possible options to meet the objectives set out in his report, in particular those \nrelating to energy efficiency and reducing the environmental impact of the building\u2019s \noperation;  \n \n9. \nApproves the establishment of one National Officer position effective \n1 January 2018, related to the dedicated project team, under section 21, Economic \nand social development in Latin America and the Caribbean, of the proposed \nprogramme budget for the biennium 2018\u20132019;  \n \n10. Appropriates an amount of 160,000 dollars for the project in 2018 \ncomprising 80,000 dollars under section 21, Economic and social development in \n__________________ \n \n9  A/72/367. \n \n10  A/72/7/Add.8. \n\nA/RES/72/262 \nSpecial subjects relating to the proposed programme budget for the biennium 2018\u20132019\n \n17-23363 \n4/27 \n \nLatin America and the Caribbean, and 80,000 dollars under section 33, Construction, \nalteration, improvement and major maintenance, of the proposed programme budget \nfor the biennium 2018\u20132019, which would represent a charge against the contingency \nfund;  \n \n11. \nDefers consideration of the proposal to establish a multi-year construction-\nin-progress account until the Secretary-General presents the further options analysis \nrequested in his next progress report;  \n \nVI \nFinancial implications relating to the administration of justice at the United \nNations \n \n \nRecalling its resolution 72/256 of 24 December 2017 on the administration of \njustice at the United Nations, \n \n1. \nAppropriates an additional amount of 1,862,700 dollars (net of staff \nassessment) under section 1, Overall policymaking, direction and coordination \n(1,563,900 dollars), section 29A, Office of the Under-Secretary-General for \nManagement (177,600 dollars) and section 29D, Office of Central Support Services \n(121,200 dollars) of the proposed programme budget for the biennium 2018\u20132019, \nwhich would represent a charge against the contingency fund; \n \n2. \nAlso appropriates the amount of 125,600 dollars under section 36, Staff \nassessment, to be offset by an equivalent amount under income section 1, Income \nfrom staff assessment, of the proposed programme budget for the biennium  \n2018\u20132019; \n \nVII \nAdministrative and financial implications of the decisions and \nrecommendations contained in the report of the International  \nCivil Service Commission for the year 2017 \n \n \nHaving considered the statement submitted by the Secretary-General in \naccordance with rule 153 of the rules of procedure of the General Assembly 11 and the \nrelated report of the Advisory Committee,12  \n \n1. \nRecalls its resolution 72/255 of 24 December 2017;  \n \n2. \nTakes note of the statement submitted by the Secretary-General;11 \n \n3. \nEndorses the conclusions and recommendations contained in the report of \nthe Advisory Committee;12 \n \nVIII \nRequest for a subvention to the Residual Special Court for Sierra Leone \n \n \nRecalling its resolution 58/284 of 8 April 2004, section VII of its resolution \n59/276 of 23 December 2004, section II of its resolution 59/294 of 22 June 2005, \nsection XII of its resolution 65/259, section IX of its resolution 66/247 of \n24 December 2011, section I of its resolution 67/246, section VII of its resolution \n70/248 A and section III of its resolution 71/272 A, \n__________________ \n \n11  A/C.5/72/3 and A/C.5/72/3/Corr.1. \n \n12  A/72/7/Add.21. \n\nSpecial subjects relating to the proposed programme budget for the biennium 2018\u20132019 \nA/RES/72/262\n \n5/27 \n17-23363 \n \n \nHaving considered the report of the Secretary-General on the use of the \ncommitment authority and request for a subvention to the Residual Special Court for \nSierra Leone13 and the related report of the Advisory Committee,14  \n \n1. \nTakes note of the report of the Secretary-General;13 \n \n2. \nEndorses the conclusions and recommendations contained in the report of \nthe Advisory Committee;14 \n \n3. \nReaffirms the high priority accorded to the work of the Residual Special \nCourt for Sierra Leone; \n \n4. \nWelcomes the in-kind support provided by the Government of Sierra Leone \nto the Residual Special Court, including support for the sub-office of the Court in \nFreetown and for the provision of security personnel; \n \n5. \nStresses the need for a realistic approach to budgeting reflecting actual \nneeds, and encourages further efforts to identify efficiencies, without prejudice to the \njudicial requirements of the Residual Special Court; \n \n6. \nAuthorizes the Secretary-General to enter into commitments in an amount \nnot to exceed 2,300,000 dollars to supplement the voluntary financial resources of the \nResidual Special Court for the period from 1 January to 31 December 2018 as a \nbridging financial mechanism, and requests the Secretary-General to report, at the \nmain part of the seventy-third session of the General Assembly, on the use of the \ncommitment authority; \n \n7. \nRequests the Secretary-General to ensure that the International Residual \nMechanism for Criminal Tribunals continues to provide logistical and administrative \nsupport to the Residual Special Court, on a cost-reimbursable basis, as appropriate, \nwithout prejudice to the mandate of each of the entities, and to report, at the main part \nof the seventy-third session, on the modalities for the future support of the \nInternational Residual Mechanism for the Residual Special Court; \n \n8. \nEncourages all Member States to provide voluntary support for the \nResidual Special Court; \n \n9. \nExpresses serious concern over the adverse financial situation facing the \nResidual Special Court, and in this regard requests the Secretary-General to redouble \nhis efforts to seek voluntary contributions, including through broadening the donor \nbase and holding regular consultations with the key stakeholders, and to report \nthereon to the General Assembly at the main part of its seventy-third session; \n \nIX \nSubvention to the international component of the Extraordinary Chambers  \nin the Courts of Cambodia \n \n \nRecalling section I of its resolution 68/247 B, section I of its resolution \n69/274 A, section IV of its resolution 70/248 A and section II of its resolution \n71/272 A, \n \nHaving considered the report of the Secretary-General on the request for a \nsubvention to the Extraordinary Chambers in the Courts of Cambodia 15 and the related \nreport of the Advisory Committee,16  \n \n1. \nTakes note of the report of the Secretary-General;15 \n__________________ \n \n13  A/72/384. \n \n14  A/72/7/Add.20. \n \n15  A/72/341. \n \n16  A/72/7/Add.7. \n\nA/RES/72/262 \nSpecial subjects relating to the proposed programme budget for the biennium 2018\u20132019\n \n17-23363 \n6/27 \n \n \n2. \nEndorses the conclusions and recommendations contained in the report of \nthe Advisory Committee,16 subject to the provisions of the present resolution; \n \n3. \nReaffirms the high priority accorded to the work of the Extraordinary \nChambers in the Courts of Cambodia; \n \n4. \nTakes note of paragraph 30 of the report of the Advisory Committee; \n \n5. \nAuthorizes the Secretary-General, as an exceptional measure, to enter into \ncommitments in an amount not exceeding 8 million dollars to supplement the \nvoluntary financial resources of the international component of the Extraordinary \nChambers for the period from 1 January to 31 December 2018, so as to enable the \nExtraordinary Chambers to carry out its judicial mandate, and requests the Secretary-\nGeneral to report on the use of the commitment authority in the context of the next \nreport; \n \n6. \nEncourages all Member States to provide voluntary support for both the \ninternational and national components of the Extraordinary Chambers, and requests \nthe Secretary-General to continue his intensive efforts to obtain additional voluntary \ncontributions, including by broadening the donor base, for funding the future \nactivities of the Extraordinary Chambers; \n \nX \nRevised estimates relating to the Office of the Victims\u2019 Rights Advocate under \nsection 1, Overall policymaking, direction and coordination, section 29D,  \nOffice of Central Support Services, and section 36, Staff assessment \n \n \nRecalling its resolution 71/297 of 30 June 2017, \n \nHaving considered the report of the Secretary-General17 and the related report \nof the Advisory Committee,18  \n \n1. \nTakes note of the report of the Secretary-General;17 \n \n2. \nEndorses the conclusions and recommendations contained in the report of \nthe Advisory Committee;18 \n \n3. \nReaffirms the collective and unanimous position that one substantiated \ncase of sexual exploitation and abuse is one case too many; \n \n4. \nApproves the additional resources proposed in the amount of 612,500 \ndollars (net of staff assessment); \n \n5. \nAlso approves the establishment of four positions (1 Assistant Secretary-\nGeneral, 1 P-4, 1 P-3 and 1 General Service (Other level)) under section 1, Overall \npolicymaking, direction and coordination, for the period from 1 January to \n31 December 2018; \n \n6. \nAppropriates an additional amount of 612,500 dollars (net of staff \nassessment) under section 1, Overall policymaking, direction and coordination \n(504,000 dollars), and section 29D, Office of Central Support Services (108,500 \ndollars) of the proposed programme budget for the biennium 2018\u20132019, which \nwould represent a charge against the contingency fund; \n \n7. \nAlso appropriates an additional amount of 52,500 dollars under section 36, \nStaff assessment, to be offset by an equivalent amount under income section 1, \nIncome from staff assessment, of the proposed programme budget for the biennium \n2018\u20132019; \n \n__________________ \n \n17  A/72/373. \n \n18  A/72/7/Add.27. \n\nSpecial subjects relating to the proposed programme budget for the biennium 2018\u20132019 \nA/RES/72/262\n \n7/27 \n17-23363 \n \nXI \nProgress on the implementation of a flexible workplace  \nat United Nations Headquarters \n \n \nRecalling section V of its resolution 67/246, section III of its resolution \n67/254 A of 12 April 2013, section IV of its resolution 68/247 B, section VII of its \nresolution 69/274 A and section XVI of its resolution 71/272 A,  \n \nHaving considered the report of the Secretary-General19 and the related report \nof the Advisory Committee,20  \n \n1. \nTakes note of the report of the Secretary-General;19 \n \n2. \nEndorses the conclusions and recommendations contained in the report of \nthe Advisory Committee,20 subject to the provisions of the present resolution; \n \n3. \nReaffirms that flexible workplace strategies in the United Nations should \nbe aimed at improving the overall productivity and efficiency of the Organization, as \nwell as the staff workplace environment;  \n \n4. \nRequests the Secretary-General to ensure full compliance with its \ndecisions and full cooperation with the implementation plan for the project, while \nmeeting the needs of staff and ensuring their well-being and productivity;  \n \n5. \nRecalls paragraph 5 of section XVI of its resolution 71/272 A, and \nreiterates its request that the Office of Human Resources Management of the \nSecretariat assess in detail the impact of the flexible workplace on productivity and \nprovide reliable qualitative and quantitative benefit indicators as well as other factors \nfor the improvement of overall productivity and staff well-being, and report thereon \nin the context of the next progress report;  \n \n6. \nRequests the Secretary-General to continue with the implementation of \nflexible workplace strategies in New York in 2018, with a maximum number of \n140 staff per floor, and to report thereon at the main part of the seventy-third session \nof the General Assembly;  \n \n7. \nRecalls paragraph 4 of the report of the Advisory Committee, and \nreiterates its requests that the Secretary-General carefully analyse and apply the \nlessons learned from the outcome of the pilot programme and report thereon in the \nnext progress report;  \n \n8. \nNotes the decrease in the current revised project costs, requests the \nSecretary-General to revisit his cost estimates for the implementation of the project \nand to review the methodology and underlying assumptions so as to arrive at a reliable \ncost estimate for the project and to provide updated information in this regard in his \nnext report;  \n \n9. \nRecalls paragraph 9 of the report of the Advisory Committee, and requests \nthe Secretary-General to include relevant data in his next report; \n \n10. Reiterates its request to the Secretary-General to seek complementarities \nbetween flexible workplace strategies and flexible working arrangements, and in this \nregard requests him, under the guidance of the interdisciplinary working group, to \nprovide information on arrangements for staff to work in remote locations, including \nfrom home, with an emphasis on addressing the requirements of staff with special \nneeds, including those with disabilities, the elderly, expecting parents and parents \nwith newborn or young children;  \n__________________ \n \n19  A/72/379. \n \n20  A/72/7/Add.29. \n\nA/RES/72/262 \nSpecial subjects relating to the proposed programme budget for the biennium 2018\u20132019\n \n17-23363 \n8/27 \n \n \n11. \nRecalls paragraph 14 of section XVI of its resolution 71/272 A and decides \nthat flexible working arrangements shall be an integral part of all flexible workplace \nstrategies, and requests the Secretary-General to update his bulletin on flexible \nworking arrangements and to report thereon in his next report;  \n \n12. Emphasizes the central coordination and oversight role of the Office of \nCentral Support Services of the Department of Management of the Secretariat in the \nmanagement of rental properties;  \n \n13. Requests the Secretary-General to explore options for the self-financing of \nthe project and to report thereon in the context of his next report to the General \nAssembly for its consideration;  \n \n14. Decides that project and swing space costs for 2018 will be absorbed \nwithin the proposed programme budget for the biennium 2018\u20132019;  \n \n15. Approves the continuation of three temporary positions (1 P-5, 1 P-4 and \n1 General Service (Other level)) for the project team;  \n \nXII \nProgress in the construction of new office facilities at the Economic \nCommission for Africa in Addis Ababa, and update on the renovation \nof conference facilities, including Africa Hall \n \n \nRecalling its resolution 56/270 of 27 March 2002, section IX of its resolution \n62/238 of 22 December 2007, section I of its resolution 63/263 of 24 December 2008, \nits resolution 64/243, section III of its resolution 65/259, section VII of its resolution \n66/247, section II of its resolution 67/246, section III of its resolution 68/247 A, \nsection V of its resolution 69/262, section IX of its resolution 70/248 A and section \nV of its resolution 71/272 A,  \n \nHaving considered the report of the Secretary-General21 and the related report \nof the Advisory Committee,22  \n \n1. \nTakes note of the report of the Secretary-General;21 \n \n2. \nEndorses the conclusions and recommendations contained in the report of \nthe Advisory Committee,22 subject to the provisions of the present resolution;  \n \n3. \nAppreciates the continued efforts of the Government of Ethiopia, as the \nhost country, in facilitating the construction of new office facilities and the renovation \nof the conference facilities, including Africa Hall, at the Economic Commission for \nAfrica in Addis Ababa; \n \n4. \nEncourages the Secretary-General to continue his efforts to include local \nknowledge, material, technology and capacity throughout the implementation of \nconstruction and renovation projects at the Economic Commission for Africa, as \nappropriate;  \n \n5. \nRequests the Secretary-General to continue to update Member States, \nthrough the Office of Central Support Services, on the progress of the construction \nprojects;  \n \n6. \nStresses that the Secretary-General must ensure that the renovation of \nAfrica Hall takes into account the preservation of the historical and architectural \nintegrity of the facility, and underlines the need to liaise with key stakeholders, \nincluding the host Government, the African Union and the United Nations \n__________________ \n \n21  A/72/374. \n \n22  A/72/7/Add.26. \n\nSpecial subjects relating to the proposed programme budget for the biennium 2018\u20132019 \nA/RES/72/262\n \n9/27 \n17-23363 \n \nEducational, Scientific and Cultural Organization, in safeguarding the heritage \nconservation objective;  \n \n7. \nAlso stresses the importance of including energy efficiencies in project \nplanning and implementation, and in this regard requests the Secretary-General to \ncontinue his efforts within the scope of the project with a view to, inter alia, \nminimizing utility consumption and to report thereon in the context of future progress \nreports;  \n \n8. \nRecalls paragraph 23 of section IX of its resolution 70/248 A, notes the \nrevised business case for the visitors\u2019 centre, and encourages the Secretary-General \nto refine the underlying assumptions and the calculation for the projected number of \nvisitors to Africa Hall and to report thereon in the context of future progress reports; \n \n9. \nRequests the Secretary-General to continue in his efforts to conduct wide-\nranging outreach activities and to report thereon in the context of future progress \nreports;  \n \n10. Recalls paragraph 22 of the report of the Advisory Committee, and in this \nregard requests the Secretary-General, in the context of future progress reports, to \ninclude an update on the different admission options that could allow access to Africa \nHall to a larger number of visitors, especially students, academicians, residents and \nguests; \n \n11. \nAlso recalls paragraph 14 of the report of the Advisory Committee, and \nencourages the Secretary-General to expedite the completion of the project\u2019s Monte \nCarlo risk analysis, present the refined contingency estimate and take appropriate \nmeasures to mitigate potential risks that may affect the project implementation \ntimeline, and to include the update in the context of the next report;  \n \n12. Emphasizes the need for the Office of Internal Oversight Services to \ncontinue to provide oversight of the construction projects at the Economic \nCommission for Africa, in particular the renovation of Africa Hall, and to continue to \ninclude information on key findings in the context of the annual reports of the Office \non its activities;  \n \n13. Welcomes with appreciation the voluntary contributions of the host \ncountry, Mali and Switzerland to Africa Hall, and requests that the Secretary-General \ncontinue to seek both voluntary and in-kind contributions from Member States, in full \ncompliance with all relevant regulations and rules of the Organization, and provide \ndetailed information on the matter in the context of the next progress report;  \n \n14. Notes the importance of developing a comprehensive and sustainable \nresource mobilization strategy with regard to operations in Africa Hall, pending the \nreview of admission options;  \n \n15. Requests the Secretary-General to ensure that resource requirements at \neach stage of the project are based on a thorough review of actual and up-to-date \nneeds on the ground and to provide detailed information in the context of future \nprogress reports;  \n \n16. Encourages the Secretary-General to take prudent measures to control cost \noverruns, such as expenses relating to official travel, so that expenditures would \nremain within the planned operational budget of the project in compliance with the \nrelevant Financial Regulations and Rules of the United Nations;6 \n \n17. Approves an appropriation in the amount of 5,700,300 dollars for the \nproject for 2018, comprising 905,400 dollars under section 18, Economic and social \ndevelopment for Africa, 4,644,700 dollars under section 33, Construction, alteration, \nimprovement and major maintenance, and 150,200 dollars under section 34, Safety \n\nA/RES/72/262 \nSpecial subjects relating to the proposed programme budget for the biennium 2018\u20132019\n \n17-23363 \n10/27 \n \nand \nsecurity, \nof \nthe \nproposed \nprogramme \nbudget \nfor \nthe \nbiennium \n2018\u20132019, which would represent a charge against the contingency fund;  \n \n18. Requests the Secretary-General to submit to the General Assembly, at the \nmain part of its seventy-third session, a progress report on the implementation of the \nconstruction projects and the renovation of the conference facilities, including Africa \nHall and the visitors\u2019 centre, outlining, inter alia, project expenditure and total costs;  \n \nXIII \nSeismic mitigation retrofit and life-cycle replacements project at the Economic \nand Social Commission for Asia and the Pacific premises in Bangkok \n \n \nRecalling section XII of its resolution 70/248 A and section IV of its resolution \n71/272 A,  \n \nHaving considered the report of the Secretary-General23 and the related report \nof the Advisory Committee,24 \n \n1. \nTakes note of the report of the Secretary-General;23 \n \n2. \nEndorses the conclusions and recommendations contained in the report of \nthe Advisory Committee,24 subject to the provisions of the present resolution;  \n \n3. \nNotes with appreciation the continued efforts of the Government of \nThailand, as the host country, in facilitating the work of the Economic and Social \nCommission for Asia and the Pacific in Bangkok;  \n \n4. \nWelcomes the positive steps taken towards engaging with the host country, \nand encourages the Economic and Social Commission for Asia and the Pacific to \ncontinue the discussions on cooperation with the host country in this regard;  \n \n5. \nAlso welcomes the advice of the host country on swing space options, and \nencourages the Secretary-General to continue his discussions with the host country \non the most suitable option;  \n \n6. \nEncourages the Secretary-General to continue his efforts to include local \nknowledge, technology and capacity throughout the implementation of the \nconstruction project, as appropriate; \n \n7. \nRecalls paragraph 7 of section IV of its resolution 71/272 A, and requests \nthe Secretary-General to include more information on the results of the accessibility \nassessment, road map and staff survey in the context of his next progress report; \n \n8. \nStresses the importance of governance, effective oversight, transparency \nand accountability in the management of the project to ensure that the objectives of \nthe project are achieved within budget and in a timely manner;  \n \n9. \nEmphasizes that the Office of Central Support Services should be actively \ninvolved in overseeing the project to ensure the central supervision of capital projects, \nincluding risk management and alignment with lessons learned;  \n \n10. Recalls paragraph 6 of section XII of its resolution 70/248 A, and requests \nthe Secretary-General to report on specific and cost-effective measures undertaken to \nminimize disruption to tenant operations and other factors in his next report;  \n \n11. \nAlso recalls paragraph 16 of section IV of its resolution 71/272 A, and \nreiterates that unused contingency funds must be carried over to subsequent years, \n__________________ \n \n23  A/72/338 and A/72/338/Corr.1. \n \n24  A/72/7/Add.6. \n\nSpecial subjects relating to the proposed programme budget for the biennium 2018\u20132019 \nA/RES/72/262\n \n11/27 \n17-23363 \n \nand that all remaining unused contingency funds be returned to Member States at the \nconclusion of the project, in 2023;  \n \n12. Takes note of paragraph 19 of the report of the Advisory Committee, and \nencourages the Secretary-General to continue to respond flexibly to changes from \ninternal and external factors in order to implement the project within the scope, \nbudget and timeline approved by the General Assembly;  \n \n13. Recalls paragraph 13 of the report of the Advisory Committee;  \n \n14. Requests the Secretary-General to remain proactive in seeking both \nvoluntary and in-kind contributions from Member States, in full compliance with all \nrelevant rules and regulations of the Organization, and to provide detailed information \non the matter in the context of the next progress report;  \n \n15. Approves an appropriation in the amount of 4,057,200 dollars for the \nproject for 2018, comprising 615,000 dollars under section 19, Economic and social \ndevelopment in Asia and the Pacific, and 3,442,200 dollars under section 33, \nConstruction, alteration, improvement and major maintenance, of the proposed \nprogramme budget for the biennium 2018\u20132019, which would represent a charge \nagainst the contingency fund;  \n \n16. Requests the Secretary-General to submit to the General Assembly, at the \nmain part of its seventy-third session, a progress report on the implementation of the \nproject;  \n \nXIV \nProposal for the replacement of office blocks A to J at the United Nations  \nOffice at Nairobi \n \n \nHaving considered the report of the Secretary-General25 and the related report \nof the Advisory Committee,26  \n \n1. \nTakes note of the report of the Secretary-General;25 \n \n2. \nEndorses the conclusions and recommendations contained in the report of \nthe Advisory Committee,26 subject to the provisions of the present resolution;  \n \n3. \nAcknowledges the important role played by the host country in facilitating \nthe maintenance and construction of United Nations facilities in Nairobi, and stresses \nthe value of continued collaboration with the host country in this regard;  \n \n4. \nExpresses its gratitude to the host country for its continued support to the \nUnited Nations Office at Nairobi, and trusts that the Secretary-General will continue \nto engage, as appropriate, with the host country as has been the practice with respect \nto other construction projects at the United Nations Office at Nairobi; \n \n5. \nEncourages the Secretary-General to continue his efforts to include local \nknowledge, technology and capacity throughout the implementation of the proposed \nreplacement of office blocks A to J at the United Nations Office at Nairobi, as \nappropriate;  \n \n6. \nRequests the Secretary-General, through the Office of Central Support \nServices, to take into account lessons learned and best practices from similar past \nconstruction and renovation projects in the planning, design and implementation of \nthe proposed replacement of office blocks A to J;  \n__________________ \n \n25  A/72/375. \n \n26  A/72/7/Add.28. \n\nA/RES/72/262 \nSpecial subjects relating to the proposed programme budget for the biennium 2018\u20132019\n \n17-23363 \n12/27 \n \n \n7. \nStresses the importance of governance, effective oversight, transparency \nand accountability in the implementation of the proposed replacement of office blocks \nA to J, and requests the Secretary-General to put in place appropriate mechanisms in \nthis regard;  \n \n8. \nRecalls paragraph 23 of the report of the Advisory Committee, and decides \nto consider the implementation strategy during the main part of the seventy-third \nsession of the General Assembly;  \n \n9. \nRecognizes the importance of and need for the implementation of a project \nto develop the accommodation and facilities to replace office blocks A to J in order \nto, inter alia, ensure safety and compliance with all required security, information \ntechnology and life-safety standards;  \n \n10. Takes note of paragraph 35 of the report of the Advisory Committee, \napproves the scope of activities for 2018 as it relates to the refinement of the project \nproposal, preparatory work and integrated risk management, takes note of the \nproposed maximum estimated cost of the project for the replacement of office blocks \nA to J, and requests the Secretary-General to present a refined proposal during the \nmain part of the seventy-third session;  \n \n11. \nRequests the Secretary-General, as part of his refined proposal, to \nincorporate outcomes of comprehensive analyses regarding the implementation of \nflexible workplace strategies at the complex, to include rental income and related \nexpenditures;  \n \n12. Approves the establishment of two temporary positions (consisting of \n1 P-4 Space Planner/Coordinator and 1 P-3 Structural/Civil Engineer) related to the \ndedicated project management team and project support team, under section 29H, \nUnited Nations Office at Nairobi, as from 1 January 2018;  \n \n13. Appropriates an amount of 503,400 dollars for the independent risk \nmanagement and design of the project for 2018, comprising 165,400 dollars under \nsection 29H, United Nations Office at Nairobi, and 338,000 dollars under section 33, \nConstruction, alteration, improvement and major maintenance, of the proposed \nprogramme budget for the biennium 2018\u20132019, which would represent a charge \nagainst the contingency fund; \n \nXV \nAdministrative expenses of the United Nations Joint Staff Pension Fund \n \n \nRecalling its resolution 70/238 A of 23 December 2015, section VI of its \nresolution 70/248 A and its resolution 71/265 of 23 December 2016, \n \nHaving considered the report of the United Nations Joint Staff Pension Board \non the administrative expenses of the United Nations Joint Staff Pension Fund, 27 the \nreport of the Secretary-General on the administrative and financial implications \narising from the report of the Pension Board,28 the financial report and audited \nfinancial statements for the year ended 31 December 2016 and the report of the Board \nof Auditors on the United Nations Joint Staff Pension Fund 29 and the \nrecommendations contained therein, the report of the Secretary of the United Nations \nJoint Staff Pension Board on the implementation of the recommendations of the Board \n__________________ \n \n27  A/72/383. \n \n28  A/C.5/72/2. \n \n29  Official Records of the General Assembly, Seventy-second Session, Supplement No. 5P \n(A/72/5/Add.16). \n\nSpecial subjects relating to the proposed programme budget for the biennium 2018\u20132019 \nA/RES/72/262\n \n13/27 \n17-23363 \n \nof Auditors contained in its report for the year ended 31 December 2016 on the Fund30 \nand the related report of the Advisory Committee,31  \n \n1. \nTakes note of the report of the United Nations Joint Staff Pension Board27 \nand the report of the Secretary-General;28 \n \n2. \nAlso takes note of the report of the Secretary of the United Nations Joint \nStaff Pension Board on the implementation of the recommendations of the Board of \nAuditors contained in its report for the year ended 31 December 2016 on the United \nNations Joint Staff Pension Fund;30 \n \n3. \nEndorses the conclusions and recommendations contained in the report of \nthe Advisory Committee,31 subject to the provisions of the present resolution;  \n \n4. \nNotes that the Board of Auditors issued an unqualified audit opinion on \nthe financial statements of the Fund for the year ended 31 December 2016; \n \n5. \nWelcomes the findings and recommendations contained in the report of the \nBoard of Auditors on the Fund,29 and notes with serious concern the need to address \nall of the shortcomings identified by the Board, including the need to ensure the \navailability of accurate data for the actuarial valuation, and in particular the need to \nstrengthen the internal control procedures, ensure the timely and accurate processing \nof benefits and create a client grievance redressal mechanism;  \n \n6. \nNotes with concern the slow progress of implementation of the \nrecommendations of the Board of Auditors, and urges the Secretary-General and the \nPension Board to take appropriate measures expeditiously to address this issue; \n \n7. \nNotes the overexpenditure under other staff costs for the biennium  \n2016\u20132017, and stresses the importance of effective and efficient management of \nhuman and financial resources by the Fund;  \n \n8. \nRequests the Secretary-General to entrust the Office of Internal Oversight \nServices with the conduct of a comprehensive audit of the governance structure of the \nPension Board, including a review of the checks and balances between the Board and \nthe leadership of the Fund, and requests the Office to submit a report with key findings \nto the General Assembly at its seventy-third session, to be considered in the context \nof the United Nations Joint Staff Pension Fund; \n \n9. \nNotes with concern the issues identified in the report of the Board of \nAuditors regarding the implementation of the Integrated Pension Administration \nSystem, requests the Pension Board to address these issues, and looks forward to \nreceiving an update on progress thereon in the context of the next report of the \nPension Board; \n \n10. Requests the Pension Board to ensure that the cost and scope of the \nIntegrated Pension Administration System project are kept within approved budgetary \nlimits; \n \n11. \nNotes the progress made with regard to the processing time of benefits \npayments in 2016, expresses concern at the continued delays in the receipt of \npayments by some new beneficiaries and retirees of the Fund, once again stresses the \nneed for the Pension Board to take appropriate steps to ensure that the Fund addresses \nthe causes of such delays, and in this regard requests an update in the context of the \nnext report of the Pension Board;  \n__________________ \n \n30  A/72/364. \n \n31  A/72/7/Add.23. \n\nA/RES/72/262 \nSpecial subjects relating to the proposed programme budget for the biennium 2018\u20132019\n \n17-23363 \n14/27 \n \n \n12. Notes with concern the high number of vacant posts, and in this regard \nrequests the Secretary-General and the Pension Board to take appropriate measures \nto fill all of the vacant posts in the Fund, in full compliance with relevant provisions \ngoverning recruitment;  \n \n13. Welcomes the establishment of the pilot service centre in Nairobi, as well \nas the proposed establishment of a regional service centre in Asia, and requests the \nsecretariat of the Fund to present to the General Assembly at the main part of its \nseventy-third session a comprehensive strategy to bring the service centres to full \nfunctionality; \n \n14. Emphasizes the importance of the Fund meeting its target annual real rate \nof return of 3.5 per cent, and in this regard requests the Secretary-General to continue \nto improve the investment performance of the Fund and to report thereon in the \ncontext of future reports on the investments of the Fund;  \n \n15. Welcomes the review conducted by the Secretary-General of the \ngovernance and compliance procedures of the Investment Management Division with \nregard to its trading activities, and in this regard encourages the Secretary-General to \nundertake a review of the research and trading activities of the Division, in particular \nits selection of brokers and dealers, and to report thereon in the context of the report \nof the Pension Board no later than at the seventy-fourth session of the General \nAssembly; \n \n16. Expresses concern that for the calendar year 2016, the Fund suffered \ncurrency losses of 679,900,000 dollars, and that the Fund has incurred cumulative \nlosses of 4,680,000,000 dollars since 2013, and urges the Secretary-General to \ncontinue to employ suitable procedures and tools to mitigate risks related to foreign \nexchange losses; \n \n17. Reaffirms that, in accordance with article 19 of the regulations of the Fund, \nthe Secretary-General serves as fiduciary for the investment of the assets of the Fund \nand has fiduciary responsibility for deciding upon the investment of the assets of the \nFund; \n \n18. Stresses the need to avoid any action that would compromise the fiduciary \nresponsibilities and long-term sustainability of the Fund;  \n \n19. Requests the Secretary-General, as fiduciary for the investment of the \nassets of the Fund, to continue to diversify its investments between developed, \ndeveloping and emerging markets, wherever this serves the interests of the \nparticipants and the beneficiaries of the Fund, and also requests the Secretary-General \nto ensure that decisions concerning the investments of the Fund in any market are \nimplemented prudently, taking fully into account the four main criteria for \ninvestment, namely safety, profitability, liquidity and convertibility;  \n \n20. Requests the Fund to incorporate provisions on the duration of contracts \nand formalize the method of evaluation before awarding contracts to or renewing the \ncontracts of the Fund managers; \n \n21. Recalls paragraph 29 of its resolution 69/113 of 10 December 2014, and \nrequests the Secretary-General to continue to explore cost-saving measures additional \nto the reduction in the use of non-discretionary advisory fees, as appropriate;  \n \n22. Also recalls paragraph 21 (c) of the terms of reference of the Investments \nCommittee of the Fund, and requests the Secretary-General to increase efforts to \nidentify potential candidates for the Investments Committee from all regional groups; \n\nSpecial subjects relating to the proposed programme budget for the biennium 2018\u20132019 \nA/RES/72/262\n \n15/27 \n17-23363 \n \n \n23. Decides to reduce non-post resources for the administration of the Fund \nby 5 per cent; \n \n24. Takes note of paragraph 31 of the report of the Advisory Committee; \n \n25. Decides to establish the four additional posts set out in the table below: \n \nOrganizational unit \nTitle of post \nNumber of posts \nCategory/level \nAdministration \n \n \n \nProgramme of work \n \n \n \nOperations (New York) \nDeputy Chief of Section, \nPension Entitlements \n1 \nP-4 \nClient services and outreach \nProgramme Officer \n1 \nP-4 \nFinancial services \nChief of Section, Accounts \n1 \nP-5 \nChief of Unit, Payroll \n1 \nP-4 \nTotal \n \n4 \n \n \n \n \n26. Also decides to postpone consideration of the proposed reclassification of \nthree posts, and requests the secretariat of the Fund to provide further information in \nthe context of the next report of the Pension Board; \n \n27. Approves the revised estimates of 174,964,300 dollars for the biennium \n2016\u20132017 for the administration of the Fund;  \n \n28. Also approves expenses, chargeable directly to the Fund, totalling \n169,467,900 dollars net for the biennium 2018\u20132019;  \n \n29. Further approves the amount of 22,191,900 dollars as the United Nations \nshare of the cost of the administrative expenses of the Fund for the biennium  \n2018\u20132019, of which 14,114,000 dollars would represent the share of the regular \nbudget and the balance of 8,077,900 dollars would represent the share of the funds \nand programmes;  \n \n30. Approves the reduction of 390,400 dollars in the United Nations share of \nthe cost of the administrative expenses of the central secretariat of the Fund under \nsection 1, Overall policymaking, direction and coordination, of the proposed \nprogramme budget for the biennium 2018\u20132019, which would represent a charge \nagainst the contingency fund;  \n \n31. Authorizes the Pension Board to supplement the voluntary contributions \nto the Emergency Fund for the biennium 2018\u20132019 by an amount not to exceed \n225,000 dollars;  \n \nXVI \nStrategic heritage plan of the United Nations Office at Geneva \n \n \nRecalling part XI of its resolution 64/243, section VII of its resolution 66/247, \nsection V of its resolution 68/247 A, sections III and VII of its resolution 69/262, \nsection X of its resolution 70/248 A and section XVIII of its resolution 71/272 A,  \n \nHaving considered the fourth annual progress report of the Secretary-General \non the strategic heritage plan of the United Nations Office at Geneva32 and the related \nreport of the Advisory Committee,33  \n__________________ \n \n32  A/72/521. \n \n33  A/72/7/Add.25. \n\nA/RES/72/262 \nSpecial subjects relating to the proposed programme budget for the biennium 2018\u20132019\n \n17-23363 \n16/27 \n \n \n1. \nTakes note of the report of the Secretary-General;32 \n \n2. \nEndorses the conclusions and recommendations contained in the report of \nthe Advisory Committee,33 subject to the provisions of the present resolution;  \n \n3. \nWelcomes the continued support of the Government of Switzerland for the \nconstruction project in Geneva;  \n \n4. \nReaffirms the proposed project scope, schedule and estimated cost of the \nstrategic heritage plan in the maximum amount of 836,500,000 Swiss francs for the \nperiod from 2014 to 2023;  \n \n5. \nStresses the importance of effective governance, oversight, transparency \nand accountability in the management of the project to ensure that the project \nobjectives are achieved on time and within budget;  \n \n6. \nRecalls paragraph 11 of the report of the Advisory Committee, notes with \nconcern the potential adverse impact of slippages on the project, and requests the \nSecretary-General to ensure that the strategic heritage plan is fully completed within \nthe project scope, schedule and overall cost approved in its resolution 70/248 A;  \n \n7. \nRequests the Secretary-General to continue to ensure that the procurement \nof goods and services for the construction project is carried out in strict compliance \nwith the existing regulations, rules and relevant provisions of General Assembly \nresolutions governing procurement in the United Nations;  \n \n8. \nRecalls paragraph 16 of its resolution 69/273 of 2 April 2015, reaffirms \nthe importance of transparency in the procurement process, and requests the \nSecretary-General to ensure that the project team takes vendors from developing \ncountries and countries with economies in transition fully into account when \ncontracting and subcontracting and to report on the specific steps taken and progress \nachieved in the context of increasing procurement opportunities for vendors from \ndeveloping countries and countries with economies in transition in the \nimplementation of the strategic heritage plan;  \n \n9. \nRequests the Secretary-General to ensure that the application of flexible \nworkplace strategies at the Palais des Nations takes into account staff welfare and \nproductivity, the physical characteristics and the specific heritage preservation needs, \nas well as ongoing business transformation initiatives, in a cost-effective manner;  \n \n10. Also requests the Secretary-General to continue to ensure that the \nimplementation of the strategic heritage plan takes into account measures to eliminate \nphysical, communications and technical barriers to persons with disabilities, taking \ninto account relevant resolutions adopted by the General Assembly, while ensuring \ncompliance with the Convention on the Rights of Persons with Disabilities, 34 and to \nreport on this subject in future annual progress reports;  \n \n11. \nFurther requests the Secretary-General to make every effort to avoid \nbudget increases through sound project management practices and to ensure that the \nstrategic heritage plan is completed within the approved budget and the envisaged \nschedule;  \n \n12. Requests the Secretary-General to continue to take appropriate measures \nto mitigate risks, including those associated with currency exchange rates, and to \ninclude relevant information in this regard in the context of future progress reports;  \n \n13. Recalls paragraph 23, of section XVIII of its resolution 71/272 A, and \nreiterates that the valorization of real estate owned by the Organization in Geneva \n__________________ \n \n34  United Nations, Treaty Series, vol. 2515, No. 44910. \n\nSpecial subjects relating to the proposed programme budget for the biennium 2018\u20132019 \nA/RES/72/262\n \n17/27 \n17-23363 \n \nshould preserve the long-term interests of the United Nations in Geneva through long-\nterm community-oriented leasing arrangements;  \n \n14. Also recalls paragraph 30 of the report of the Advisory Committee, and \ndecides that all income from the rental or valorization of land owned by the \nOrganization in Geneva will be reflected under income section 2, General income, of \nthe proposed programme budget for the biennium 2018\u20132019; \n \n15. Appreciates the existing voluntary contributions received from Member \nStates to finance the strategic heritage plan, and requests the Secretary-General to \nremain proactive in seeking both voluntary and in-kind contributions from Member \nStates, as well as donations by private entities, in full compliance with all relevant \nrules and regulations of the Organization and agreements related to donations for the \nstrategic heritage plan, in order to reduce the overall assessments on Member States;  \n \n16. Reiterates its request to the Secretary-General to continue to explore the \npossibility of attracting additional United Nations entities to be accommodated at the \nrenovated Palais des Nations;  \n \n17. Also reiterates its request to the Secretary-General to ensure that works of \nart, masterpieces and other gifts are handled appropriately during the design and \nrenovation stages of the strategic heritage plan at the Palais des Nations, and also \nrequests him to cooperate with those Member States that wish to take care of their \ngifts of works of art, masterpieces and other items;  \n \n18. Approves the establishment of one new temporary position of Senior \nProcurement Officer (P-5), to be based in the Office of Central Support Services at \nHeadquarters, effective 1 January 2018, for an initial period of one year, to be funded \nwithin existing project resources;  \n \n19. Decides to continue to use the multi-year construction-in-progress account \nestablished within the regular budget for expenditures related to the strategic heritage \nplan in 2018;  \n \n20. Also decides to revert to the establishment of an assessment scheme and \ncurrency of appropriation and assessment for the strategic heritage plan at the main \npart of its seventy-third session, and requests the Secretary-General to provide \nupdated detailed information on these issues;  \n \n21. Further decides to revert to the establishment of the multi-year special \naccount for the strategic heritage plan at the main part of its seventy-third session;  \n \n22. Decides to appropriate the amount of 25,400,000 dollars (equivalent to \n24,600,000 Swiss francs) for 2018, under section 33, Construction, alteration, \nimprovement and major maintenance, of the proposed programme budget for the \nbiennium 2018\u20132019;  \n \nXVII \nRevised estimates resulting from resolutions and decisions adopted  \nby the Economic and Social Council during its 2017 session \n \n \nHaving considered the report of the Secretary-General35 and the related report \nof the Advisory Committee,36  \n \n1. \nTakes note of the report of the Secretary-General;35 \n__________________ \n \n35  A/72/398. \n \n36  A/72/7/Add.22. \n\nA/RES/72/262 \nSpecial subjects relating to the proposed programme budget for the biennium 2018\u20132019\n \n17-23363 \n18/27 \n \n \n2. \nEndorses the conclusions and recommendations contained in the report of \nthe Advisory Committee;36 \n \n3. \nApproves an additional appropriation in the amount of 247,200 dollars \nunder section 16, International drug control, crime and terrorism prevention and \ncriminal justice, of the proposed programme budget for the biennium 2018\u20132019, \nwhich would represent a charge against the contingency fund;  \n \n4. \nAlso approves the amount of 32,800 dollars under section 36, Staff \nassessment, of the proposed programme budget for the biennium 2018\u20132019, to be \noffset by an equivalent amount under income section 1, Income from staff assessment; \n \nXVIII \nInternational Trade Centre \n \n \nHaving considered the proposed programme budget for the International Trade \nCentre for the biennium 2018\u2013201937 and the related reports of the Advisory \nCommittee,38  \n \n1. \nEndorses the conclusions and recommendations contained in the reports \nof the Advisory Committee;38 \n \n2. \nDecides to approve resources in the amount of 37,354,000 dollars (the \nUnited Nations share equivalent to 50 per cent of 72,392,100 Swiss francs at the \nexchange rate of 0.969 Swiss francs to 1 dollar) proposed for the biennium  \n2018\u20132019 under section 13, International Trade Centre, of the proposed programme \nbudget for the biennium 2018\u20132019; \n \nXIX \nRevised estimates resulting from resolutions and decisions adopted by the \nHuman Rights Council at its thirty-fourth, thirty-fifth and thirty-sixth  \nsessions and twenty-sixth and twenty-seventh special sessions \n \n \nHaving considered the report of the Secretary-General39 and the related report \nof the Advisory Committee,40  \n \n1. \nTakes note of the report of the Secretary-General;39 \n \n2. \nEndorses the conclusions and recommendations contained in the report of \nthe Advisory Committee;40 \n \n3. \nApproves the establishment of three posts (P-3) under section 24, Human \nrights, of the proposed programme budget for the biennium 2018\u20132019, with effect \nfrom 1 January 2018;  \n \n4. \nAlso approves an additional appropriation in the amount of 19,946,000 \ndollars, comprising 1,700,600 dollars under section 2, General Assembly and \nEconomic and Social Council affairs and conference management, 18,233,900 dollars \nunder section 24, Human rights, 10,100 dollars under section 28, Public information, \nand 17,000 dollars under section 34, Safety and security, and offset in part by a \nreduction in the amount of 15,600 dollars under section 29F, Administration, Geneva, \nof \nthe \nproposed \nprogramme \nbudget \nfor \nthe \nbiennium  \n2018\u20132019, which would represent a charge against the contingency fund;  \n__________________ \n \n37  A/72/6 (Sect. 13), A/72/6 (Sect. 13)/Corr.1 and A/72/646. \n \n38  A/72/7/Add.3/Rev.1 and A/72/7/Add.36. \n \n39  A/72/602 and A/72/602/Add.1. \n \n40  A/72/7/Add.35. \n\nSpecial subjects relating to the proposed programme budget for the biennium 2018\u20132019 \nA/RES/72/262\n \n19/27 \n17-23363 \n \n \n5. \nFurther approves the amount of 52,800 dollars under section 36, Staff \nassessment, of the proposed programme budget for the biennium 2018\u20132019, to be \noffset by an equivalent amount under income section 1, Income from staff assessment; \n \nXX \nRequest for a subvention to the United Nations Institute for Disarmament \nResearch resulting from the recommendations of the Board of Trustees  \nof the Institute on the work programme of the Institute for 2018\u20132019 \n \n \nHaving considered the note by the Secretary-General41 and the related report of \nthe Advisory Committee,42  \n \n1. \nTakes note of the note by the Secretary-General;41 \n \n2. \nEndorses the conclusions and recommendations contained in the report of \nthe Advisory Committee,42 subject to the provisions of the present resolution; \n \n3. \nApproves the request for a subvention to the United Nations Institute for \nDisarmament Research of 750,000 dollars (before recosting) from the regular budget \nof the United Nations, for which the provision has already been included under \nsection 4, Disarmament, of the proposed programme budget for the biennium 2018\u2013\n2019;  \n \nXXI \nEnterprise resource planning project, Umoja \n \n \nRecalling section II of its resolution 60/283, section II of its resolution 63/262, \nits resolution 64/243, section II.A of its resolution 65/259, its resolution 66/246, \nsection III of its resolution 66/263 of 21 June 2012, section III of its resolution \n67/246, its resolution 68/246, sections IV and VI of its resolution 69/274 A, \nsection XVII of its resolution 70/248 A and section XIV of its resolution 71/272 A,  \n \nHaving considered the ninth progress report of the Secretary-General on the \nenterprise resource planning project,43 the note by the Secretary-General transmitting \nthe sixth annual progress report of the Board of Auditors on the implementation of \nthe United Nations enterprise resource planning system44 and the related report of the \nAdvisory Committee,45  \n \n1. \nTakes note of the report of the Secretary-General43 and the note by the \nSecretary-General;44 \n \n2. \nAlso takes note of the findings of the report of the Board of Auditors,44 and \nendorses the recommendations contained therein;  \n \n3. \nEndorses the conclusions and recommendations contained in the report of \nthe Advisory Committee,45 subject to the provisions of the present resolution;  \n \n4. \nWelcomes the implementation of Umoja globally across more than 40,000 \nstaff in 400 locations, and notes that this is a significant achievement;  \n \n5. \nNotes the conclusion of the Board of Auditors in paragraph 17 of the \nsummary of its report that Umoja remains central to the successful reform and \nmodernization of the administration of the United Nations;  \n__________________ \n \n41  A/72/369. \n \n42  A/72/7/Add.2. \n \n43  A/72/397. \n \n44  A/72/157. \n \n45  A/72/7/Add.31. \n\nA/RES/72/262 \nSpecial subjects relating to the proposed programme budget for the biennium 2018\u20132019\n \n17-23363 \n20/27 \n \n \n6. \nRecognizes the progress made in the implementation of Umoja since the \nprevious progress report, and the effort of staff and managers in the implementation \nof Umoja Foundation and Extension 1 to date;  \n \n7. \nRequests the Secretary-General to closely monitor key milestones and the \noverall timeline for the complete implementation of Umoja by identifying and \nproactively managing current as well as any emerging key risks to the achievement \nof the project\u2019s objectives and full implementation, as approved by the General \nAssembly;  \n \n8. \nRegrets the delay in the full implementation of Umoja Extension 2, and in \nthis regard requests the Secretary-General to continue to implement the project within \nthe approved timeline and budget and to provide detailed information on the full \nimplementation of the Umoja solution no later than at the seventy-third session of the \nGeneral Assembly;  \n \n9. \nRecalls paragraph 19 of the report of the Advisory Committee, and in this \nregard reiterates the need for strict project planning and management in order to \nensure that the Umoja project remains on track without further disruption and delay; \n \n10. Reiterates the importance of ensuring that lessons learned from previous \ndeployments continue to be fully taken into account in preparing future roll-outs in \norder to ensure smoother deployments and avoid extensive stabilization efforts that \nwould result in further delays, cost escalation and other risks, and encourages the \nSecretary-General to incorporate such lessons learned in his planning and \npreparations for future phases of the project;  \n \n11. \nRequests the Secretary-General in his roll-out plan for the implementation \nof Umoja to conduct a thorough and objective assessment of the Organization\u2019s \nreadiness for business change in order to avoid unforeseen impacts and unnecessary \nadditional post-implementation reviews that could lead to deviations from the \nproject\u2019s plans, cost projections and expected benefits, and in this regard to report on \nthe findings of this assessment to the General Assembly at its seventy-third session;  \n \n12. Reiterates that the successful implementation of Umoja requires the full \nsupport and commitment of senior management, as well as close and continuous \nengagement with key stakeholders, and requests the Secretary-General to ensure this \nthrough performance management and accountability mechanisms, especially at \nsenior levels;  \n \n13. Reiterates its request to the Secretary-General, in developing realistic \nbenefit realization plans for implementing entities, to use a common methodology \nand provide details on both qualitative and quantitative benefits, and to report thereon \nto the General Assembly at the main part of its seventy-third session;  \n \n14. Recalls paragraph 29 of the report of the Advisory Committee, notes the \ninsufficient progress made in the development of a benefit realization plan, stresses \nthe need to establish a clear and transparent record of the realization of qualitative \nand quantitative Umoja benefits, taking fully into account the relevant \nrecommendations of the Board of Auditors, and requests the Secretary-General to \nreport thereon in the next progress report, without prejudice to established budgetary \nprocedures and the prerogative of the Fifth Committee, which is entrusted with \nresponsibility for administrative and budgetary matters;  \n \n15. Regrets the inability of the Secretariat to provide sufficient information \nquantifying Umoja-related efficiencies and benefits, and requests the Advisory \nCommittee to request the Board of Auditors to undertake a detailed verification \nexercise, with a view to validating a statement of quantifiable Umoja-related benefits, \nand to report thereon in the seventh annual progress report of the Board of Auditors;  \n\nSpecial subjects relating to the proposed programme budget for the biennium 2018\u20132019 \nA/RES/72/262\n \n21/27 \n17-23363 \n \n \n16. Reiterates its request to the Secretary-General to strengthen in-house \ncapacity and expertise on the enterprise resource planning system and to develop, as \na matter of priority, a detailed action plan to ensure the transfer of knowledge from \nconsultants to programme and project staff, ensuring that knowledge acquired is \nmaintained within the Organization and reducing dependency on and resource \nrequirements for contractual services, which represent a large proportion of project \ncosts, and to provide detailed information thereon in the context of his next report;  \n \n17. Notes the steps taken thus far to address gaps in training, stresses the \nimportance of effective and high-quality training for the successful implementation \nof Umoja, requests the Secretary-General to ensure that senior managers adopt a \ncomprehensive and sustained approach to training and capacity development in their \nwork units and make certain that all users are properly trained before the deployment \nof any functionality of the project, and in this regard requests the Secretary-General \nto adopt appropriate qualitative and quantitative indicators of achievement to assess \nthe effectiveness of the training received;  \n \n18. Also notes the effort made to estimate, for the first time, the indirect costs \nand total cost of ownership of the project, and in this regard requests the Secretary-\nGeneral to submit to the General Assembly, at the main part of its seventy-third \nsession, an updated business case for the Umoja project, and also requests the \nSecretary-General to continue his efforts to refine the estimates of the total cost of \nownership of the project;  \n \n19. Reiterates its request to the Secretary-General to make every effort to \neliminate cost overruns through efficiency measures and sound project management \nand to avoid any further upward revision of the budget during the remaining project \nschedule, up to the time at which Umoja is fully deployed;  \n \n20. Recalls paragraph 43 of the report of the Advisory Committee, and \nwelcomes the proposals of the Secretary-General for the restructuring and gradual \ndownsizing of the Umoja project team;  \n \n21. Decides to approve the establishment of seven posts (3 P-3, 3 P-2 and \n1 General Service (Principal level)); \n \n22. Also decides that the total project expenditure by 31 December 2018 \nshould not exceed 516,738,500 dollars;  \n \n23. Approves the resource requirements of the project until 31 December 2019 \nin the amount of 62,062,600 dollars;  \n \n24. Also approves the amount of 9,309,400 dollars under the proposed \nprogramme budget for the biennium 2018\u20132019, representing the regular budget \nshare for the Umoja project costs, and requests the Secretary-General to absorb \n4,654,700 dollars of the regular budget share within the proposed programme budget \nfor the biennium 2018\u20132019;  \n \n25. Notes that resource requirements in the amount of 28,859,100 dollars will \nbe included in the subsequent requirements for the support account for peacekeeping \noperations for the financial period from 1 July 2018 to 30 June 2019, and \nrequirements in the amount of 9,619,700 dollars for the financial period from 1 July \n2019 to 30 June 2020;  \n \n26. Also notes that requirements in the amount of 14,274,400 dollars will be \nfunded from extrabudgetary resources in the financial period from 1 January 2018 to \n31 December 2019;  \n \nXXII \nEstimates in respect of special political missions, good offices and other \n\nA/RES/72/262 \nSpecial subjects relating to the proposed programme budget for the biennium 2018\u20132019\n \n17-23363 \n22/27 \n \npolitical initiatives authorized by the General Assembly and/or the \nSecurity Council \n \n \nRecalling section XX of its resolution 70/248 A, section V of its resolution \n70/248 B, section XIX of its resolution 71/272 A and section VII of its resolution \n71/272 B of 6 April 2017,  \n \nHaving considered the reports of the Secretary-General46 and the related reports \nof the Advisory Committee on Administrative and Budgetary Questions, 47  \n \n1. \nTakes note of the reports of the Secretary-General;46 \n \n2. \nEndorses the conclusions and recommendations contained in the reports \nof the Advisory Committee,47 subject to the provisions of the present resolution; \n \n3. \nReaffirms its commitment to consider the review of the arrangements on \nthe funding and backstopping of the special political missions and recommendations \nof the Advisory Committee, and expresses its commitment to consider this matter, \nwith a view to making a decision, without prejudging the outcome, at the main part \nof its seventy-third session; \n \n4. \nReiterates its request to the Secretary-General to present future budget \nproposals for the special political missions no later than the last week of October;  \n \n5. \nReiterates that the Secretary-General has to ensure that the highest \nstandards of efficiency, competence and integrity serve as the paramount \nconsideration in the employment of staff, with due regard to the principle of equitable \ngeographical distribution, in accordance with Article 101, paragraph 3, of the Charter \nof the United Nations;  \n \n6. \nNotes that the continuing requirement for posts that have been vacant for \ntwo years or longer should be reviewed and justifications provided for their retention, \nor those posts should be proposed for abolishment; \n \n7. \nRecalls its stipulation that the use of external consultants should be kept \nto an absolute minimum and that the Organization should use its in-house capacity \nto perform core activities or to fulfil functions that are recurrent over the long term;  \n \n8. \nRequests the Secretary-General to take measures to improve transparency \nin the use of extrabudgetary funding in special political missions;  \n \n9. \nReaffirms that the Fifth Committee is the appropriate Main Committee of \nthe General Assembly entrusted with responsibilities for administrative and budgetary \nmatters;  \n \n10. Decides to reduce the resources for operational requirements for special \npolitical missions by 1 per cent; \n \n__________________ \n \n46  A/72/371, A/72/371/Add.1, A/72/371/Add.2, A/72/371/Add.3, A/72/371/Add.4, A/72/371/Add.5, \nA/72/371/Add.6, A/72/371/Add.7 and A/72/371/Add.8. \n \n47  A/72/7/Add.10, A/72/7/Add.11, A/72/7/Add.12, A/72/7/Add.13, A/72/7/Add.14, A/72/7/Add.15, \nA/72/7/Add.16, A/72/7/Add.17 and A/72/7/Add.18. \n\nSpecial subjects relating to the proposed programme budget for the biennium 2018\u20132019 \nA/RES/72/262\n \n23/27 \n17-23363 \n \n \n \nThematic cluster I: special and personal envoys, advisers and representatives of \nthe Secretary-General  \n \n \n \nOffice of the Special Adviser to the Secretary-General on Yemen \n \n \n11. \nDecides not to establish one position of Principal Security Sector Reform \nOfficer (D-1) and one position of Political Affairs Officer (P-4); \n \n \n \nOffice of the Special Envoy of the Secretary-General for Syria \n \n \n12. Recalls paragraph 23 of the report of the Advisory Committee,48 and \ndecides to abolish one position (P-4); \n \n \n \nOffice of the Special Envoy of the Secretary-General (Burundi) \n \n \n13. Commends the work of the East African Community in facilitating \nmediation under the Inter-Burundi Dialogue to address the political challenges, \nsupports the need for continued ownership by the East African Community of this \nprocess, and encourages the international community to continue to provide support, \nas appropriate;  \n \n14. Decides to approve the redeployment of one position of Special Assistant \n(P-3) to Ouagadougou; \n \n15. Also decides to abolish one position of Senior Information Analyst (P-5); \n \n \n \nThematic cluster II: sanctions monitoring teams, groups and panels, and other \nentities and mechanisms \n \n \n \nPanel of Experts on the Democratic People\u2019s Republic of Korea \n \n \n16. Takes note of paragraph 31 of the report of the Advisory Committee,49 and \ndecides to reduce resources for the additional subscriptions to global databases by \n20 per cent; \n \n \nAnalytical Support and Sanctions Monitoring Team pursuant to resolutions \n1526 (2004) and 2253 (2015) concerning ISIL (Da\u2019esh), Al-Qaida and the \nTaliban and associated individuals and entities; and the Office of the \nOmbudsperson established pursuant to resolution 1904 (2009) \n \n \n17. Expresses concern about the combined presentation of the budgets of the \nAnalytical Support and Sanctions Monitoring Team and the Office of the \nOmbudsperson established pursuant to Security Council resolution 1904 (2009) of \n17 December 2009, and requests the Secretary-General to report on the budgets \nseparately in the context of the next budget submission; \n \n18. Decides to apply a 50 per cent vacancy rate for the Office of the \nOmbudsperson; \n \n \n \nImplementation of Security Council resolution 2231 (2015) \n \n \n19. Takes note of paragraph 35 of the report of the Advisory Committee,49 and \ndecides to approve an additional 25 per cent reduction for official travel for the \nimplementation of Security Council resolution 2231 (2015) of 20 July 2015; \n \n20. Decides to reclassify two P-4 positions as P-3 positions; \n \n__________________ \n \n48  A/72/7/Add.11. \n \n49  A/72/7/Add.12. \n\nA/RES/72/262 \nSpecial subjects relating to the proposed programme budget for the biennium 2018\u20132019\n \n17-23363 \n24/27 \n \n \n \nOrganisation for the Prohibition of Chemical Weapons-United Nations Joint \nInvestigative Mechanism \n \n \n21. Notes that the proposed budget for the Organisation for the Prohibition of \nChemical Weapons-United Nations Joint Investigative Mechanism is no longer \nmandated, and decides not to approve the funding requested; \n \n \n \nCounter-Terrorism Committee Executive Directorate \n \n \n22. Takes note of paragraph 13 of the report of the Advisory Committee,49 and \ndecides to establish four positions of Legal Officer (P-4), one position of \nCommunications Officer (P-4) and one position of Political Affairs Officer (P-3); \n \n \n \nPanel of Experts on Mali \n \n \n23. Recalls paragraph 11 of the report of the Advisory Committee,50 and \ndecides to only establish one position (P-3) for the Panel of Experts on Mali; \n \n \n \nThematic cluster III: regional offices, offices in support of political processes \nand other missions \n \n \n \nUnited Nations Integrated Peacebuilding Office in Guinea-Bissau \n \n \n24. Decides not to approve the proposed establishment of one position of \nSenior Political/Electoral Officer (P-5) in the United Nations Integrated \nPeacebuilding Office in Guinea-Bissau; \n \n25. Also decides not to abolish one position of Rule of Law Officer (P-4); \n \n \n \nUnited Nations Assistance Mission in Somalia \n \n \n26. Takes note of paragraph 16 of the report of the Advisory Committee,51 and \ndecides not to establish four positions of Human Rights Officer (National \nProfessional Officer); \n \n27. Also takes note of paragraph 17 of the report of the Advisory Committee, 51 \nand decides to retain the positions of Special Assistant (P-5), Child Protection Officer \n(P-4) and Administrative Assistant (Local level); \n \n28. Approves the redeployment of the following six positions: Senior Political \nAffairs Officer (P-5), Political Affairs Officer (P-3), Political Affairs Officer (P-4), \nSenior Political Affairs Officer (P-5), Senior Coordination Officer (P-5) and \nAdministrative Officer (Field Service); \n \n \n \nUnited Nations Regional Centre for Preventive Diplomacy for Central Asia \n \n \n29. Decides not to approve the proposal that the position of Human Rights \nOfficer (P-4) report directly to the Special Representative of the Secretary-General \nand the day-to-day supervision of the Public Information Unit be placed under the \nresponsibilities of the Human Rights Officer; \n \n \n \nUnited Nations Support Mission in Libya \n \n \n30. Takes note of paragraph 14 of the report of the Advisory Committee,52 and \ndecides to establish one position of Senior Political Affairs Officer (P-5) in the \n__________________ \n \n50  A/72/7/Add.16. \n \n51  A/72/7/Add.13. \n \n52  A/72/7/Add.18. \n\nSpecial subjects relating to the proposed programme budget for the biennium 2018\u20132019 \nA/RES/72/262\n \n25/27 \n17-23363 \n \nDepartment of Political Affairs of the Secretariat to strengthen the team working on \nLibya; \n \n31. Decides to establish one position of Assistant Political Officer (Field \nService); \n \n \n \nUnited Nations Verification Mission in Colombia \n \n \n32. Notes with appreciation the successful conclusion of the United Nations \nMission in Colombia, and recognizes the contribution made to it by unarmed \nobservers, primarily from member countries of the Community of Latin American \nand Caribbean States; \n \n33. Decides not to allocate any resources for programmatic activities; \n \n34. Also decides to reduce the allocation for operational costs by an additional \n1,712,000 dollars; \n \n \n \nUnited Nations Assistance Mission in Afghanistan \n \n \n35. Takes note of paragraph 36 of the report of the Advisory Committee,53 and \ndecides not to approve the budget proposal for the United Nations Assistance Mission \nin Afghanistan;  \n \n36. Authorizes the Secretary-General to enter into commitments for the \nMission in the amount of up to 82,900,000 dollars for the period from 1 January to \n30 June 2018, and requests the Secretary-General to present an updated budget \nproposal for the Mission for 2018 at the second resumed part of its seventy-second \nsession;  \n \n37. Decides to apportion among Member States the amount of 82,900,000 \ndollars for the period from 1 January to 30 June 2018, taking into account the scale \nof assessments for 2018, as set out in its resolution 70/245 of 23 December 2015; \n \n \n \nUnited Nations Assistance Mission for Iraq \n \n \n38. Decides not to establish one position of Women\u2019s Protection Adviser \n(National Professional Officer); \n \n39. Recalls paragraph 13 of the report of the Advisory Committee, 54 \nrecognizes the importance of technical expertise and capacity to strengthen efforts to \naddress conflict-related sexual violence and gender-based violence, welcomes efforts \nby the Mission\u2019s Gender Unit in this regard, and decides to establish one position of \nSenior Women\u2019s Protection Adviser (P-5);  \n \n40. Decides to abolish one position of Human Rights Officer (P-4), which has \nbeen vacant since 10 May 2017; \n \n41. Takes note of paragraph 17 of the report of the Advisory Committee,54 and \ndecides to authorize the Secretary-General to enter into commitments, with \ncorresponding appropriation, in an amount not exceeding 50,000,000 dollars for the \nUnited Nations Assistance Mission for Iraq for the period from 1 January to \n30 June 2018;  \n \n42. Approves the budgets in the amount of 508,490,000 dollars for the \n34 special political missions authorized by the General Assembly and/or the Security \nCouncil, including the commitment authorities for the United Nations Assistance \n__________________ \n \n53  A/72/7/Add.14. \n \n54  A/72/7/Add.15. \n\nA/RES/72/262 \nSpecial subjects relating to the proposed programme budget for the biennium 2018\u20132019\n \n17-23363 \n26/27 \n \nMission in Afghanistan and the United Nations Assistance Mission for Iraq, and an \namount of 686,900 dollars for the share of special political missions in the budget of \nthe Regional Service Centre in Entebbe, Uganda, for the biennium 2018\u20132019; \n \n43. Also approves a charge of 510,030,700 dollars, including an amount of \n853,800 dollars for the Office of the Special Envoy of the Secretary-General on \nMyanmar, against the provision for special political missions proposed under section \n3, Political affairs, of the proposed programme budget for the biennium 2018\u20132019; \n \nXXIII \nLimited budgetary discretion \n \n \nRecalling its resolution 60/246 of 23 December 2005, section III of its \nresolution 60/283, its resolution 64/243, section III of its resolution 64/260 of \n29 March 2010, paragraph 115 of its resolution 66/246, section I of its resolution \n66/258 of 9 April 2012, its resolution 68/246 and section II of its resolution 70/248 A, \n \nHaving considered the report of the Secretary-General55 and the related report \nof the Advisory Committee,56  \n \n1. \nTakes note of the report of the Secretary-General;55 \n \n2.  \nEndorses the conclusions and recommendations contained in the report of \nthe Advisory Committee;56 \n \nXXIV \nGross jointly financed budget of the International Civil Service Commission \n \n \nApproves the gross budget for the International Civil Service Commission for \nthe biennium 2018\u20132019 in the amount of 18,764,300 dollars; \n \nXXV \nGross jointly financed budget of the United Nations System Chief Executives \nBoard for Coordination \n \n \nNotes the gross budget for the United Nations System Chief Executives Board \nfor Coordination for the biennium 2018\u20132019 in the amount of 6,276,800 dollars; \n \nXXVI \nGross jointly financed budget of the Department of Safety and Security \n \n \nApproves the gross jointly financed budget of the Department of Safety and \nSecurity of the Secretariat for the biennium 2018\u20132019 in the amount of 271,090,400 \ndollars, broken down as follows: \n \n(a) \nField Security Operations: 240,446,800 dollars; \n \n(b) \nSecurity and Safety Services at the United Nations Office at Vienna: \n30,643,600 dollars; \n \n__________________ \n \n55  A/72/497. \n \n56  A/72/7/Add.30. \n\nSpecial subjects relating to the proposed programme budget for the biennium 2018\u20132019 \nA/RES/72/262\n \n27/27 \n17-23363 \n \nXXVII \nEffects of changes in rates of exchange and inflation \n \n \nHaving considered the report of the Secretary-General on the revised estimates \nresulting from changes in rates of exchange and inflation 57 and the related report of \nthe Advisory Committee,58 \n \nTakes note of the revised estimates arising from recosting owing to changes in \nthe rates of exchange and inflation; \n \nXXVIII \nContingency fund \n \n \nNotes that a balance of 1,100,000 dollars remains in the contingency fund. \n \nXXIX  \nGross jointly financed budget of the Joint Inspection Unit  \n \n \nApproves the gross budget for the Joint Inspection Unit for the biennium  \n2018\u20132019 in the amount of 13,090,100 dollars. \n \n76th plenary meeting  \n24 December 2017 \n \n__________________ \n \n57  A/72/646. \n \n58  A/72/7/Add.36. \n",
  "paragraphs": {
    "1": "Takes note of the report of the Secretary-General;55",
    "2": "Endorses the conclusions and recommendations contained in the report of the Advisory Committee;56 XXIV Gross jointly financed budget of the International Civil Service Commission Approves the gross budget for the International Civil Service Commission for the biennium 2018\u20132019 in the amount of 18,764,300 dollars; XXV Gross jointly financed budget of the United Nations System Chief Executives Board for Coordination Notes the gross budget for the United Nations System Chief Executives Board for Coordination for the biennium 2018\u20132019 in the amount of 6,276,800 dollars; XXVI Gross jointly financed budget of the Department of Safety and Security Approves the gross jointly financed budget of the Department of Safety and Security of the Secretariat for the biennium 2018\u20132019 in the amount of 271,090,400 dollars, broken down as follows: (a) Field Security Operations: 240,446,800 dollars; (b) Security and Safety Services at the United Nations Office at Vienna: 30,643,600 dollars; XXVII Effects of changes in rates of exchange and inflation Having considered the report of the Secretary-General on the revised estimates resulting from changes in rates of exchange and inflation 57 and the related report of the Advisory Committee,58 Takes note of the revised estimates arising from recosting owing to changes in the rates of exchange and inflation; XXVIII Contingency fund Notes that a balance of 1,100,000 dollars remains in the contingency fund. XXIX Gross jointly financed budget of the Joint Inspection Unit Approves the gross budget for the Joint Inspection Unit for the biennium 2018\u20132019 in the amount of 13,090,100 dollars.",
    "3": "Reaffirms its commitment to consider the review of the arrangements on the funding and backstopping of the special political missions and recommendations of the Advisory Committee, and expresses its commitment to consider this matter, with a view to making a decision, without prejudging the outcome, at the main part of its seventy-third session;",
    "4": "Reiterates its request to the Secretary-General to present future budget proposals for the special political missions no later than the last week of October;",
    "5": "Reiterates that the Secretary-General has to ensure that the highest standards of efficiency, competence and integrity serve as the paramount consideration in the employment of staff, with due regard to the principle of equitable geographical distribution, in accordance with Article 101, paragraph 3, of the Charter of the United Nations;",
    "6": "Notes that the continuing requirement for posts that have been vacant for two years or longer should be reviewed and justifications provided for their retention, or those posts should be proposed for abolishment;",
    "7": "Recalls its stipulation that the use of external consultants should be kept to an absolute minimum and that the Organization should use its in-house capacity to perform core activities or to fulfil functions that are recurrent over the long term;",
    "8": "Requests the Secretary-General to take measures to improve transparency in the use of extrabudgetary funding in special political missions;",
    "9": "Reaffirms that the Fifth Committee is the appropriate Main Committee of the General Assembly entrusted with responsibilities for administrative and budgetary matters;",
    "10": "Decides to reduce the resources for operational requirements for special political missions by 1 per cent; Thematic cluster I: special and personal envoys, advisers and representatives of the Secretary-General Office of the Special Adviser to the Secretary-General on Yemen",
    "11": "Decides not to establish one position of Principal Security Sector Reform Officer (D-1) and one position of Political Affairs Officer (P-4); Office of the Special Envoy of the Secretary-General for Syria",
    "12": "Recalls paragraph 23 of the report of the Advisory Committee,48 and decides to abolish one position (P-4); Office of the Special Envoy of the Secretary-General (Burundi)",
    "13": "Commends the work of the East African Community in facilitating mediation under the Inter-Burundi Dialogue to address the political challenges, supports the need for continued ownership by the East African Community of this process, and encourages the international community to continue to provide support, as appropriate;",
    "14": "Decides to approve the redeployment of one position of Special Assistant (P-3) to Ouagadougou;",
    "15": "Also decides to abolish one position of Senior Information Analyst (P-5); Thematic cluster II: sanctions monitoring teams, groups and panels, and other entities and mechanisms Panel of Experts on the Democratic People\u2019s Republic of Korea",
    "16": "Takes note of paragraph 31 of the report of the Advisory Committee,49 and decides to reduce resources for the additional subscriptions to global databases by 20 per cent; Analytical Support and Sanctions Monitoring Team pursuant to resolutions 1526 (2004) and 2253 (2015) concerning ISIL (Da\u2019esh), Al-Qaida and the Taliban and associated individuals and entities; and the Office of the Ombudsperson established pursuant to resolution 1904 (2009)",
    "17": "Expresses concern about the combined presentation of the budgets of the Analytical Support and Sanctions Monitoring Team and the Office of the Ombudsperson established pursuant to Security Council resolution 1904 (2009) of 17 December 2009, and requests the Secretary-General to report on the budgets separately in the context of the next budget submission;",
    "18": "Decides to apply a 50 per cent vacancy rate for the Office of the Ombudsperson; Implementation of Security Council resolution 2231 (2015)",
    "19": "Takes note of paragraph 35 of the report of the Advisory Committee,49 and decides to approve an additional 25 per cent reduction for official travel for the implementation of Security Council resolution 2231 (2015) of 20 July 2015;",
    "20": "Decides to reclassify two P-4 positions as P-3 positions; Organisation for the Prohibition of Chemical Weapons-United Nations Joint Investigative Mechanism",
    "21": "Notes that the proposed budget for the Organisation for the Prohibition of Chemical Weapons-United Nations Joint Investigative Mechanism is no longer mandated, and decides not to approve the funding requested; Counter-Terrorism Committee Executive Directorate",
    "22": "Takes note of paragraph 13 of the report of the Advisory Committee,49 and decides to establish four positions of Legal Officer (P-4), one position of Communications Officer (P-4) and one position of Political Affairs Officer (P-3); Panel of Experts on Mali",
    "23": "Recalls paragraph 11 of the report of the Advisory Committee,50 and decides to only establish one position (P-3) for the Panel of Experts on Mali; Thematic cluster III: regional offices, offices in support of political processes and other missions United Nations Integrated Peacebuilding Office in Guinea-Bissau",
    "24": "Decides not to approve the proposed establishment of one position of Senior Political/Electoral Officer (P-5) in the United Nations Integrated Peacebuilding Office in Guinea-Bissau;",
    "25": "Also decides not to abolish one position of Rule of Law Officer (P-4); United Nations Assistance Mission in Somalia",
    "26": "Takes note of paragraph 16 of the report of the Advisory Committee,51 and decides not to establish four positions of Human Rights Officer (National Professional Officer);",
    "27": "Also takes note of paragraph 17 of the report of the Advisory Committee, 51 and decides to retain the positions of Special Assistant (P-5), Child Protection Officer (P-4) and Administrative Assistant (Local level);",
    "28": "Approves the redeployment of the following six positions: Senior Political Affairs Officer (P-5), Political Affairs Officer (P-3), Political Affairs Officer (P-4), Senior Political Affairs Officer (P-5), Senior Coordination Officer (P-5) and Administrative Officer (Field Service); United Nations Regional Centre for Preventive Diplomacy for Central Asia",
    "29": "Decides not to approve the proposal that the position of Human Rights Officer (P-4) report directly to the Special Representative of the Secretary-General and the day-to-day supervision of the Public Information Unit be placed under the responsibilities of the Human Rights Officer; United Nations Support Mission in Libya",
    "30": "Takes note of paragraph 14 of the report of the Advisory Committee,52 and decides to establish one position of Senior Political Affairs Officer (P-5) in the Department of Political Affairs of the Secretariat to strengthen the team working on Libya;",
    "31": "Decides to establish one position of Assistant Political Officer (Field Service); United Nations Verification Mission in Colombia",
    "32": "Notes with appreciation the successful conclusion of the United Nations Mission in Colombia, and recognizes the contribution made to it by unarmed observers, primarily from member countries of the Community of Latin American and Caribbean States;",
    "33": "Decides not to allocate any resources for programmatic activities;",
    "34": "Also decides to reduce the allocation for operational costs by an additional 1,712,000 dollars; United Nations Assistance Mission in Afghanistan",
    "35": "Takes note of paragraph 36 of the report of the Advisory Committee,53 and decides not to approve the budget proposal for the United Nations Assistance Mission in Afghanistan;",
    "36": "Authorizes the Secretary-General to enter into commitments for the Mission in the amount of up to 82,900,000 dollars for the period from 1 January to 30 June 2018, and requests the Secretary-General to present an updated budget proposal for the Mission for 2018 at the second resumed part of its seventy-second session;",
    "37": "Decides to apportion among Member States the amount of 82,900,000 dollars for the period from 1 January to 30 June 2018, taking into account the scale of assessments for 2018, as set out in its resolution 70/245 of 23 December 2015; United Nations Assistance Mission for Iraq",
    "38": "Decides not to establish one position of Women\u2019s Protection Adviser (National Professional Officer);",
    "39": "Recalls paragraph 13 of the report of the Advisory Committee, 54 recognizes the importance of technical expertise and capacity to strengthen efforts to address conflict-related sexual violence and gender-based violence, welcomes efforts by the Mission\u2019s Gender Unit in this regard, and decides to establish one position of Senior Women\u2019s Protection Adviser (P-5);",
    "40": "Decides to abolish one position of Human Rights Officer (P-4), which has been vacant since 10 May 2017;",
    "41": "Takes note of paragraph 17 of the report of the Advisory Committee,54 and decides to authorize the Secretary-General to enter into commitments, with corresponding appropriation, in an amount not exceeding 50,000,000 dollars for the United Nations Assistance Mission for Iraq for the period from 1 January to 30 June 2018;",
    "42": "Approves the budgets in the amount of 508,490,000 dollars for the 34 special political missions authorized by the General Assembly and/or the Security Council, including the commitment authorities for the United Nations Assistance Mission in Afghanistan and the United Nations Assistance Mission for Iraq, and an amount of 686,900 dollars for the share of special political missions in the budget of the Regional Service Centre in Entebbe, Uganda, for the biennium 2018\u20132019;",
    "43": "Also approves a charge of 510,030,700 dollars, including an amount of 853,800 dollars for the Office of the Special Envoy of the Secretary-General on Myanmar, against the provision for special political missions proposed under section 3, Political affairs, of the proposed programme budget for the biennium 2018\u20132019; XXIII Limited budgetary discretion Recalling its resolution 60/246 of 23 December 2005, section III of its resolution 60/283, its resolution 64/243, section III of its resolution 64/260 of 29 March 2010, paragraph 115 of its resolution 66/246, section I of its resolution 66/258 of 9 April 2012, its resolution 68/246 and section II of its resolution 70/248 A, Having considered the report of the Secretary-General55 and the related report of the Advisory Committee,56"
  },
  "agenda_items": [
    "Item 136"
  ],
  "symbol_references": []
}