{
  "symbol": "A/RES/77/20",
  "filename": "A_RES_77_20.pdf",
  "title": "77/20. Cooperation between the United Nations and the International Criminal Police Organization (INTERPOL)",
  "text": "United Nations \nA/RES/77/20\n \n \nGeneral Assembly \nDistr.: General \n25 November 2022 \n \n22-26542 (E)    011222 \n*2226542* \n \n \nSeventy-seventh session \nAgenda item 127 (y) \nCooperation between the United Nations and regional \nand other organizations: cooperation between the \nUnited Nations and the International Criminal Police \nOrganization (INTERPOL) \n \n \n \n \n Resolution adopted by the General Assembly \non 21 November 2022 \n \n \n \n \n[without reference to a Main Committee (A/77/L.20)] \n \n \n \n77/20. Cooperation between the United Nations and the International \nCriminal Police Organization (INTERPOL) \n \n \n \nThe General Assembly, \n \nRecalling its resolution 51/1 of 15 October 1996, in which it invited the \nInternational Criminal Police Organization (INTERPOL) to participate as an observer \nin its sessions and work, and its resolutions 71/19 of 21 November 2016, 73/11 of \n26 November 2018 and 75/10 of 23 November 2020 concerning the cooperation \nbetween the United Nations and INTERPOL, and calling for the strengthening of \ncooperation between the United Nations and INTERPOL,  \n \nRecalling also the cooperation agreement of 1997 between the United Nations \nand INTERPOL1 and all other relevant cooperation agreements between them,  \n \nRecalling further all relevant United Nations resolutions recognizing that \ncooperation between the United Nations and international organizations such as \nINTERPOL can contribute to preventing and combating transnational crime, in \nparticular transnational organized crime, and preventing and countering terrorism,  \n \nAcknowledging the cooperation between the United Nations and INTERPOL in \nassisting the States Members of the United Nations that are also member countries of \nINTERPOL in preventing and responding to crime and in improving their law \nenforcement capabilities, upon their request,  \n__________________ \n \n1  United Nations, Treaty Series, vol. 1996, No. 1200. \n\nA/RES/77/20 \nCooperation between the United Nations and the International \nCriminal Police Organization (INTERPOL)\n \n22-26542\n2/8 \n \n \nRecognizing that INTERPOL, in accordance with the Constitution of \nINTERPOL, is an apolitical2 and neutral international organization entrusted with the \nmandate of ensuring and promoting mutual assistance among criminal police \nauthorities, in full respect of the sovereignty of Member States and consistent with \ntheir obligations under international law and the domestic laws and regulations of \neach Member State, and in accordance with the rules and regulations of INTERPOL, \n \nAcknowledging that INTERPOL has been a key actor since 1923 in enabling and \npromoting international police cooperation in order to prevent and combat \ntransnational crime, in particular transnational organized crime, through enhanced \npolice cooperation among its member countries as well as in fostering innovation in \npolice and law enforcement matters, and in this regard takes further note of the three \nglobal crime programmes of INTERPOL dedicated to counter-terrorism, cybercrime \nand organized and emerging crime,  \n \nAcknowledging also the contributions derived from the global structure of the \nGeneral Secretariat of INTERPOL, consisting of its seat in Lyon, France, its Global \nComplex for Innovation located in Singapore, its regional bureaux around the world \nand its Offices of the Special Representative at the United Nations, the European \nUnion and the African Union,  \n \nWelcoming the role of the national central bureaux of INTERPOL, present in \nevery member country, as the cornerstone of cooperation to enhance cohesion, \nstability and security and as the primary international policing hub, which links \nnational police forces through its global network,  \n \nWelcoming also the cooperation between the United Nations Global Counter-\nTerrorism Coordination Compact entities and INTERPOL in preventing and \ncountering terrorism by assisting Member States, upon their request, in implementing \nthe United Nations Global Counter-Terrorism Strategy, 3  including through \ninformation-sharing on foreign terrorist fighters, including those returning or \nrelocating, in particular from terrorist combat or training areas, and on improvements \nin border security,4 with a view to maximizing synergies, promoting transparency and \ngreater efficiencies and avoiding duplication of their work,  \n \nWelcoming further the cooperation and coordination efforts undertaken in \naccordance with the arrangement on cooperation of 21 July 2017 between the United \nNations and INTERPOL, in relation to the Counter-Terrorism Committee Executive \nDirectorate, supplementary to the cooperation agreement of 1997 between the United \nNations and INTERPOL,  \n \nWelcoming the cooperation and coordination efforts undertaken between the \nOffice of Counter-Terrorism and INTERPOL, taking note with appreciation of the \nparticipation of INTERPOL in the implementation of joint projects, in accordance \nwith the arrangement on cooperation of 27 June 2018 between the United Nations and \nINTERPOL, in relation to the activities of the United Nations Office of Counter-\nTerrorism, supplementary to the cooperation agreement of 1997 between the United \nNations and INTERPOL, and in this regard taking note of the cooperation and \ncoordination efforts between INTERPOL and the United Nations Office of Counter-\nTerrorism, including the programmes of the United Nations Counter-Terrorism Centre \non border security and management and on countering and preventing the travel of \nforeign terrorist fighters,  \n__________________ \n \n2  Constitution of the International Criminal Police Organization (INTERPOL), article 3.  \n \n3  Resolution 60/288. \n \n4  See resolution 72/284. \n\nCooperation between the United Nations and the International \nCriminal Police Organization (INTERPOL) \nA/RES/77/20\n \n3/8\n22-26542 \n \n \nNoting the cooperation and coordination efforts undertaken in accordance with \nexisting arrangements between the Department of Peace Operations of the Secretariat \nand INTERPOL, and recalling the joint effort of INTERPOL and the Department of \nPeace Operations pertaining to interim law enforcement, security support and support \nfor the development of national police and other law enforcement agencies in mission \nsettings, in accordance with respective and specific mandates,  \n \nWelcoming the cooperation between the United Nations police and INTERPOL, \nin particular the specialized police teams and serious and organized crime teams of \nthe United Nations Police Division in the development of joint programmes and \ninitiatives, within their respective mandates, including through the provision of \ntechnical expertise and assistance to national police and law enforcement institutions, \nwith a view to maximizing synergies, promoting transparency and greater efficiencies \nand avoiding duplication of their work, \n \nNoting the cooperation and coordination efforts undertaken in accordance with \nthe cooperation agreement of 5 October 1999 between the United Nations \nEducational, Scientific and Cultural Organization and INTERPOL, and its special \narrangement of 8 July 2003 in accordance with article 4 (4) of the said cooperation \nagreement,  \n \nWelcoming the cooperation and coordination efforts undertaken in accordance \nwith the memorandum of understanding on cooperation of 22 May 2000 between the \nInternational Civil Aviation Organization and INTERPOL,  \n \nRecognizing the contribution of the cooperation between the United Nations and \nINTERPOL towards the implementation of the 2030 Agenda for Sustainable \nDevelopment, 5 through joint activities, capacity-building and targeted support of \nMember States in the fight against all forms of transnational crime and terrorism, and \ntaking note of the contribution of the INTERPOL Global Policing Goals to support \nthe implementation of the 2030 Agenda by Member States,  \n \nAcknowledging the need to strengthen the cooperation between the United \nNations and INTERPOL in mainstreaming a gender perspective throughout all \nrelevant areas of cooperation, including in training, workshops, capacity-building and \nleadership training programmes, in order to strengthen their effectiveness, \n \nRecalling the political declaration on the implementation of the United Nations \nGlobal Plan of Action to Combat Trafficking in Persons,6 in which, inter alia, the \nGeneral Assembly reaffirmed the important contribution of INTERPOL to the global \nfight against trafficking in persons, especially women and children, \n \nRecognizing the contribution of the cooperation between the United Nations and \nINTERPOL in combating the illicit trade in small arms and light weapons, and \nacknowledging the contribution of INTERPOL to the third United Nations \nConference to Review Progress Made in the Implementation of the Programme of \nAction to Prevent, Combat and Eradicate the Illicit Trade in Small Arms and Light \nWeapons in All Its Aspects, and the relevant role of INTERPOL in the International \nInstrument to Enable States to Identify and Trace, in a Timely and Reliable Manner, \nIllicit Small Arms and Light Weapons,7 \n \nNoting the cooperation between the United Nations and INTERPOL in assisting \nMember States, upon their request, in addressing the illicit trafficking in chemical, \nbiological, radiological and nuclear materials by non-State actors, \n__________________ \n \n5  Resolution 70/1. \n \n6  Resolution 72/1. \n \n7  See decision 60/519 and A/60/88 and A/60/88/Corr.2, annex. \n\nA/RES/77/20 \nCooperation between the United Nations and the International \nCriminal Police Organization (INTERPOL)\n \n22-26542\n4/8 \n \n \nConcerned at the growing trend of cybercrime and the criminal misuse of \ninformation and communications technologies in multiple forms of crime, recalling \nits resolutions 73/187 of 17 December 2018, 74/247 of 27 December 2019 and 75/282 \nof 26 May 2021, as well as Economic and Social Council resolutions 2019/19 and \n2019/20 of 23 July 2019, and noting the need to enhance coordination and cooperation \nbetween the United Nations, in particular the Global Programme on Cybercrime of \nthe United Nations Office on Drugs and Crime, INTERPOL and Member States in \ncombating cybercrime, including through technical assistance, particularly to \ndeveloping countries, upon request, in order to enhance the capacity of national \nauthorities to deal with cybercrime in all its forms, including its prevention, detection, \ninvestigation and prosecution,  \n \nNoting the continued efforts and progress made by INTERPOL to serve as a \ntrusted global law enforcement hub for the exchange of actionable information and \nanalysis, and the contribution of INTERPOL to the promotion and achievement of the \nhighest level of professionalism and innovation in law enforcement, including \nthrough the provision and delivery of training and training resources and analytical \nproducts and the creation of networks of law enforcement expert groups and education \ninstitutions, including the INTERPOL Virtual Academy, aimed at increasing the \nefficiency of law enforcement agencies in combating transnational organized crime \nthrough international police cooperation,  \n \nNoting also international efforts that contribute to raising awareness of and \npreparedness for the use of unmanned aerial systems (UAS) for terrorist purposes as \nthe technology has become more accessible, and in this regard taking particular note \nof the publication by the Counter-Terrorism Committee Executive Directorate, Office \nof Counter-Terrorism and INTERPOL, The Protection of Critical Infrastructure \nagainst Terrorist Attacks: Compendium of Good Practices, and also noting the Global \nCounterterrorism Forum (GCTF) and its Berlin Memorandum on Good Practices for \nCountering Terrorist Use of UAS,  \n \nAcknowledging the unprecedented public health and socioeconomic damage and \nthe continued impact of the public health crisis caused by the coronavirus disease \n(COVID-19) pandemic, requiring a coordinated international response, including a \nlaw enforcement response, to the vulnerabilities that drive, enable and perpetuate \ncriminal activity,  \n \nConvinced that increased and enhanced cooperation between the United Nations \nand INTERPOL in accordance with the Charter of the United Nations and the \nConstitution of INTERPOL, as well as applicable international law, will contribute to \nachieving the respective purposes and principles of both organizations,  \n \n1. \nCalls for the strengthening of cooperation between the United Nations and \nthe International Criminal Police Organization (INTERPOL), within their respective \nmandates, in accordance with applicable international law, in (a) preventing and \ncombating transnational crime, including illicit maritime activities, in particular \ntransnational organized crime, including the smuggling of migrants, trafficking in \npersons, drug trafficking, piracy, the illicit manufacturing of and trafficking in small \narms and light weapons and ammunitions, illicit trafficking in chemical, biological, \nradiological and nuclear materials, the criminal misuse of information and \ncommunications technologies, including the Internet and social media, corruption and \nmoney-laundering, trafficking in illicit and counterfeit goods and crimes that affect \nthe environment, including illicit trafficking in endangered and, where applicable, \nprotected species of wild flora and fauna; and (b) preventing and countering terrorism, \nincluding through preventing and disrupting terrorist travel, countering the use of \ninformation and communications technologies, including the Internet and social \nmedia, for terrorist purposes, while respecting human rights and fundamental \n\nCooperation between the United Nations and the International \nCriminal Police Organization (INTERPOL) \nA/RES/77/20\n \n5/8\n22-26542 \n \nfreedoms, preventing and interdicting access to weapons necessary for terrorist \nactivities, including small arms and light weapons and improvised explosive devices, \nas well as to chemical, biological, radiological and nuclear materials, countering the \nfinancing of terrorism, including financing through the use of new and emerging \ntechnologies and methods, preventing and disrupting financial support for foreign \nterrorist fighters and preventing and combating the intentional and unlawful \ndestruction and looting of cultural heritage and trafficking in cultural property \nperpetrated by criminal and terrorist groups; \n \n2. \nEmphasizes the importance of optimal coordination and cooperation \nbetween the United Nations and INTERPOL in countering terrorism, with particular \nregard to the threat posed by the travel of foreign terrorist fighters, including those \nwho return or relocate, and in strengthening international efforts to ensure that refugee \nstatus is not abused by the perpetrators, organizers and facilitators of terrorist acts, \nconsistent with the obligations of Member States under international law, and in this \ncontext stresses the importance of information-sharing, as appropriate, including \nbiometric data, which could encompass fingerprints and photographs, in order to \nincrease the chances of the positive identification of terrorists and their affiliates, in \naddition to information from battlefields, counter-terrorism military operations and \nnational prison systems, while respecting human rights and fundamental freedoms, \nand also stresses the importance of Member States making full use of INTERPOL \ncapabilities in this regard, notably the Stolen and Lost Travel Document Database, \nthe Nominal Database, the Foreign Terrorist Fighter Criminal Analysis File, the \nFingerprint Database, the DNA Profile Database and the facial recognition system, \nand of promoting international cooperation efforts to assist Member States, upon their \nrequest, in strengthening cooperation between their law enforcement agencies in \norder to bring suspected terrorists to justice;  \n \n3. \nRecognizes the potential for strengthening the cooperation between \nINTERPOL and the Department of Peace Operations of the Secretariat to provide \ntimely capacity-building and technical assistance, including by organizing training \nactivities, to enhance the capacity of national police services and other law \nenforcement organizations, upon request, and in accordance with their respective \nmandates;  \n \n4. \nEncourages the United Nations and INTERPOL to deepen their \ncooperation to advance gender equality in law enforcement, including through the \nmainstreaming of a gender perspective, including in capacity-building programmes, \nas well as equal opportunities for employment, leadership positions and decision-\nmaking at all levels of law enforcement agencies, with a view to the empowerment of \nwomen and their full enjoyment of all human rights;  \n \n5. \nEmphasizes the importance of optimal coordination and cooperation \nbetween the United Nations and INTERPOL to create synergies within their \nrespective mandates in the fight against transnational crime, in particular \ntransnational organized crime;  \n \n6. \nReaffirms the importance of close cooperation between the United Nations \nand INTERPOL in the global fight against trafficking in persons, including through \nthe Inter-Agency Coordination Group against Trafficking in Persons, as well as any \nsexual exploitation, including of women and children, and in this context stresses the \nimportance of Member States making use of readily available INTERPOL \ncapabilities, such as the International Child Sexual Exploitation Database, the Stolen \nand Lost Travel Document Database, the I-Familia database, the Travel Documents \nAssociated with Notices system and the Nominal Database, as well as the INTERPOL \nHuman Trafficking Expert Group, and also stresses the importance of Member States \n\nA/RES/77/20 \nCooperation between the United Nations and the International \nCriminal Police Organization (INTERPOL)\n \n22-26542\n6/8 \n \nenhancing their capability to fight such crimes using the training curricula facilitated \nby INTERPOL;  \n \n7. \nAlso reaffirms the importance of close cooperation between the United \nNations and INTERPOL to combat the smuggling of migrants, and in this context \nstresses the importance of Member States making use of readily available INTERPOL \ncapabilities, including the Stolen and Lost Travel Document Database and the \nNominal Database, as well as the INTERPOL Human Trafficking Expert Group;  \n \n8. \nEmphasizes the importance of optimal cooperation between the United \nNations and INTERPOL to provide, upon request, complementary support to \npeacekeeping and peacebuilding efforts in accordance with existing mandates, \nincluding in assisting Member States in strengthening the national central bureaux of \nINTERPOL through training and technical assistance in order to fight transnational \norganized crime more effectively, and supporting the reinforcement of national police \nand other law enforcement agencies, as demonstrated by joint Department of Peace \nOperations and INTERPOL projects at United Nations peacekeeping missions;  \n \n9. \nEncourages the United Nations to take full advantage of the benefits of \ncooperation with INTERPOL, in accordance with their respective mandates and \nconsistent with the national priorities of Member States, to prevent, combat and \neradicate the illicit trade in small arms and light weapons and to implement the \nProgramme of Action to Prevent, Combat and Eradicate the Illicit Trade in Small \nArms and Light Weapons in All Its Aspects8 and its International Instrument to Enable \nStates to Identify and Trace, in a Timely and Reliable Manner, Illicit Small Arms and \nLight Weapons, including through making use of the readily available INTERPOL \ncapabilities to facilitate the tracing of weapons, notably the INTERPOL Illicit Arms \nRecords and Tracing Management System, the INTERPOL Ballistic Information \nNetwork and the INTERPOL Firearms Reference Table; \n \n10. Encourages further cooperation between the United Nations, in particular \nthe United Nations Office on Drugs and Crime, and INTERPOL in addressing the \nchallenges faced by Member States in combating cybercrime and the criminal misuse \nof information and communications technologies, including through technical \nassistance and capacity-building activities made available by INTERPOL and \nrelevant United Nations entities, upon request and based on national needs, taking \ninto account specific challenges faced by developing countries;  \n \n11. Calls upon the United Nations system, in particular the United Nations \nEducational, Scientific and Cultural Organization, and INTERPOL, as appropriate \nand within their existing mandates, to continue to strengthen cooperation and \nsynergies in order to assist Member States in their efforts to prevent and counter the \nunlawful destruction and looting of cultural heritage and the trafficking in cultural \nproperty in all forms, including through the INTERPOL Stolen Works of Art Database \nand ID-Art mobile application;  \n \n12. Welcomes the steps that INTERPOL and the United Nations, in particular \nthe United Nations Office on Drugs and Crime, have taken to analyse and respond to \nthe effects of the COVID-19 pandemic on crime, encourages relevant United Nations \nagencies to make use of resources and expertise provided by INTERPOL to enhance \ninternational law enforcement cooperation to address these effects, including the \nCOVID-19 global threat assessment and recommended health protocols for police \nofficers, and calls upon the two organizations to collaborate on and coordinate their \nanalysis and responses, within their respective mandates, to make use of lessons \nlearned to address future public health challenges and to build mechanisms to detect \n__________________ \n \n8  Report of the United Nations Conference on the Illicit Trade in Small Arms and Light Weapons in \nAll Its Aspects, New York, 9\u201320 July 2001 (A/CONF.192/15), chap. IV, para. 24. \n\nCooperation between the United Nations and the International \nCriminal Police Organization (INTERPOL) \nA/RES/77/20\n \n7/8\n22-26542 \n \nand disrupt the sale and supply of illicit and counterfeit pharmaceuticals and medical \nproducts;  \n \n13. Emphasizes the importance of enhanced cooperation between the United \nNations system, in particular the World Health Organization, and INTERPOL, \nincluding through capacity-building and training activities, with a view to \nstrengthening collaboration between health and security sectors, and further seizes \nthe opportunity to encourage Member States to make full use of the secure \ncommunication channels of INTERPOL, including BioTracker, to exchange \ninformation on biological incidents of natural, accidental or deliberate origin;  \n \n14. Calls upon the United Nations, in particular the United Nations Office on \nDrugs and Crime, and INTERPOL, as appropriate and within their existing mandates, \nto enhance coordination and cooperation on matters related to maritime security, and \nto encourage law enforcement agencies to make full use of capabilities made available \nby INTERPOL and relevant United Nations entities, including the Global Maritime \nSecurity Database, as well as training, equipment and capacity-building, upon request \nand based on national needs, taking into account specific challenges faced by \ndeveloping countries;  \n \n15. Recognizes the potential for strengthened collaboration between the \nUnited Nations, in particular the United Nations Office on Drugs and Crime, and \nINTERPOL, as appropriate and within their existing mandates, in order to assist \nMember States that are also member countries of INTERPOL in preventing and \ncombating transnational financial crime and corruption, and in this regard also \nstresses the importance of the use of INTERPOL Notices and Diffusions to circulate \ndetails of new and existing crime trends related to financial crime, money-laundering \nand corruption, as well as the INTERPOL global stop-payment mechanism using the \nI-24/7 global police secure communications system, and accordingly calls on Member \nStates to extend access to I-24/7 to financial intelligence units;  \n \n16. Strongly condemns the continued flow of unmanned aerial systems and \ntheir components to, by and between terrorist and organized criminal groups, \nexpresses deep concern at the increasing global use of unmanned aerial systems by \nterrorists to launch attacks or to traffic drugs and arms, expresses its determination to \naddress this growing threat, and stresses the importance of close cooperation between \nthe United Nations, including the United Nations police, the Office of Counter-\nTerrorism and the United Nations Interregional Crime and Justice Research Institute, \nand INTERPOL to support Member States, upon their request, to design \ncomprehensive policies and guidance to assist law enforcement entities, to effectively \nprevent and respond to the acquisition and use of unmanned aerial systems and their \ncomponents and other emerging technologies and methods, such as artificial \nintelligence and virtual assets, for criminal and terrorist purposes; \n \n17. Encourages increased cooperation between the United Nations and \nINTERPOL to assist Member States, upon their request, in effectively using the \nfollowing resources readily available to Member States that are also member \ncountries of INTERPOL, through their national central bureaux:  \n \n(a) \nThe INTERPOL I-24/7 global police secure communications system, \nwhich enables authorized users to share sensitive and urgent police information with \ntheir counterparts around the globe for the primary purpose of assisting in the \nprevention, detection and investigation of crime, in accordance with the INTERPOL \nmandate;  \n\nA/RES/77/20 \nCooperation between the United Nations and the International \nCriminal Police Organization (INTERPOL)\n \n22-26542\n8/8 \n \n \n(b) \nINTERPOL databases, by populating, updating and querying them, as \nappropriate, with a view to sharing accurate information between Member States in a \ntimely manner in accordance with INTERPOL rules and regulations, in full respect \nof national sovereignty and operational priorities, through full access to them;  \n \n(c) \nPublication of INTERPOL notices and diffusions to alert, request \nassistance from and provide assistance to law enforcement agencies of other Member \nStates;  \n \n(d) \nCriminal information analysis, namely, INTERPOL analytical products, to \nsupport national operational activities and investigations by sharing information with \nINTERPOL for inclusion in the INTERPOL Criminal Analysis Files;  \n \n(e) \nINTERPOL support for the operations of the law enforcement agencies of \nMember States as well as training and capacity-building programmes and initiatives \ndesigned to improve national police capabilities;  \n \n18. Acknowledges the importance of extending real-time access to the I-24/7 \nglobal police secure communications system from the national central bureaux of \nMember States that are also member countries of INTERPOL to their other national \nlaw enforcement entities at strategic locations, such as border crossings, airports and \ncustoms and immigration posts, with a view to increasing the security of their borders \nby implementing INTERPOL technical solutions, inter alia, by integrating the most \nrecent versions of the Fixed INTERPOL Network Database into border crossing \npoints and systematically and automatically checking all incoming and outgoing \ntravellers and conducting anticipated checks through advance passenger information \nand passenger name records mechanisms, thereby promoting increased cooperation \nbetween the United Nations and INTERPOL, including through the United Nations \nCountering Terrorist Travel Programme, in which INTERPOL is a partner;  \n \n19. Requests the Secretary-General to submit to the General Assembly at its \nseventy-ninth session a report on the implementation of the present resolution;  \n \n20. Decides to include in the provisional agenda of its seventy-ninth session, \nunder the item entitled \u201cCooperation between the United Nations and regional and \nother organizations\u201d, the sub-item entitled \u201cCooperation between the United Nations \nand the International Criminal Police Organization (INTERPOL)\u201d. \n \n39th plenary meeting \n21 November 2022 \n \n \n",
  "paragraphs": {
    "1": "Calls for the strengthening of cooperation between the United Nations and the International Criminal Police Organization (INTERPOL), within their respective mandates, in accordance with applicable international law, in (a) preventing and combating transnational crime, including illicit maritime activities, in particular transnational organized crime, including the smuggling of migrants, trafficking in persons, drug trafficking, piracy, the illicit manufacturing of and trafficking in small arms and light weapons and ammunitions, illicit trafficking in chemical, biological, radiological and nuclear materials, the criminal misuse of information and communications technologies, including the Internet and social media, corruption and money-laundering, trafficking in illicit and counterfeit goods and crimes that affect the environment, including illicit trafficking in endangered and, where applicable, protected species of wild flora and fauna; and (b) preventing and countering terrorism, including through preventing and disrupting terrorist travel, countering the use of information and communications technologies, including the Internet and social media, for terrorist purposes, while respecting human rights and fundamental Cooperation between the United Nations and the International Criminal Police Organization (INTERPOL) freedoms, preventing and interdicting access to weapons necessary for terrorist activities, including small arms and light weapons and improvised explosive devices, as well as to chemical, biological, radiological and nuclear materials, countering the financing of terrorism, including financing through the use of new and emerging technologies and methods, preventing and disrupting financial support for foreign terrorist fighters and preventing and combating the intentional and unlawful destruction and looting of cultural heritage and trafficking in cultural property perpetrated by criminal and terrorist groups;",
    "2": "Emphasizes the importance of optimal coordination and cooperation between the United Nations and INTERPOL in countering terrorism, with particular regard to the threat posed by the travel of foreign terrorist fighters, including those who return or relocate, and in strengthening international efforts to ensure that refugee status is not abused by the perpetrators, organizers and facilitators of terrorist acts, consistent with the obligations of Member States under international law, and in this context stresses the importance of information-sharing, as appropriate, including biometric data, which could encompass fingerprints and photographs, in order to increase the chances of the positive identification of terrorists and their affiliates, in addition to information from battlefields, counter-terrorism military operations and national prison systems, while respecting human rights and fundamental freedoms, and also stresses the importance of Member States making full use of INTERPOL capabilities in this regard, notably the Stolen and Lost Travel Document Database, the Nominal Database, the Foreign Terrorist Fighter Criminal Analysis File, the Fingerprint Database, the DNA Profile Database and the facial recognition system, and of promoting international cooperation efforts to assist Member States, upon their request, in strengthening cooperation between their law enforcement agencies in order to bring suspected terrorists to justice;",
    "3": "Recognizes the potential for strengthening the cooperation between INTERPOL and the Department of Peace Operations of the Secretariat to provide timely capacity-building and technical assistance, including by organizing training activities, to enhance the capacity of national police services and other law enforcement organizations, upon request, and in accordance with their respective mandates;",
    "4": "Encourages the United Nations and INTERPOL to deepen their cooperation to advance gender equality in law enforcement, including through the mainstreaming of a gender perspective, including in capacity-building programmes, as well as equal opportunities for employment, leadership positions and decision- making at all levels of law enforcement agencies, with a view to the empowerment of women and their full enjoyment of all human rights;",
    "5": "Emphasizes the importance of optimal coordination and cooperation between the United Nations and INTERPOL to create synergies within their respective mandates in the fight against transnational crime, in particular transnational organized crime;",
    "6": "Reaffirms the importance of close cooperation between the United Nations and INTERPOL in the global fight against trafficking in persons, including through the Inter-Agency Coordination Group against Trafficking in Persons, as well as any sexual exploitation, including of women and children, and in this context stresses the importance of Member States making use of readily available INTERPOL capabilities, such as the International Child Sexual Exploitation Database, the Stolen and Lost Travel Document Database, the I-Familia database, the Travel Documents Associated with Notices system and the Nominal Database, as well as the INTERPOL Human Trafficking Expert Group, and also stresses the importance of Member States enhancing their capability to fight such crimes using the training curricula facilitated by INTERPOL;",
    "7": "Also reaffirms the importance of close cooperation between the United Nations and INTERPOL to combat the smuggling of migrants, and in this context stresses the importance of Member States making use of readily available INTERPOL capabilities, including the Stolen and Lost Travel Document Database and the Nominal Database, as well as the INTERPOL Human Trafficking Expert Group;",
    "8": "Emphasizes the importance of optimal cooperation between the United Nations and INTERPOL to provide, upon request, complementary support to peacekeeping and peacebuilding efforts in accordance with existing mandates, including in assisting Member States in strengthening the national central bureaux of INTERPOL through training and technical assistance in order to fight transnational organized crime more effectively, and supporting the reinforcement of national police and other law enforcement agencies, as demonstrated by joint Department of Peace Operations and INTERPOL projects at United Nations peacekeeping missions;",
    "9": "Encourages the United Nations to take full advantage of the benefits of cooperation with INTERPOL, in accordance with their respective mandates and consistent with the national priorities of Member States, to prevent, combat and eradicate the illicit trade in small arms and light weapons and to implement the Programme of Action to Prevent, Combat and Eradicate the Illicit Trade in Small Arms and Light Weapons in All Its Aspects8 and its International Instrument to Enable States to Identify and Trace, in a Timely and Reliable Manner, Illicit Small Arms and Light Weapons, including through making use of the readily available INTERPOL capabilities to facilitate the tracing of weapons, notably the INTERPOL Illicit Arms Records and Tracing Management System, the INTERPOL Ballistic Information Network and the INTERPOL Firearms Reference Table;",
    "10": "Encourages further cooperation between the United Nations, in particular the United Nations Office on Drugs and Crime, and INTERPOL in addressing the challenges faced by Member States in combating cybercrime and the criminal misuse of information and communications technologies, including through technical assistance and capacity-building activities made available by INTERPOL and relevant United Nations entities, upon request and based on national needs, taking into account specific challenges faced by developing countries;",
    "11": "Calls upon the United Nations system, in particular the United Nations Educational, Scientific and Cultural Organization, and INTERPOL, as appropriate and within their existing mandates, to continue to strengthen cooperation and synergies in order to assist Member States in their efforts to prevent and counter the unlawful destruction and looting of cultural heritage and the trafficking in cultural property in all forms, including through the INTERPOL Stolen Works of Art Database and ID-Art mobile application;",
    "12": "Welcomes the steps that INTERPOL and the United Nations, in particular the United Nations Office on Drugs and Crime, have taken to analyse and respond to the effects of the COVID-19 pandemic on crime, encourages relevant United Nations agencies to make use of resources and expertise provided by INTERPOL to enhance international law enforcement cooperation to address these effects, including the COVID-19 global threat assessment and recommended health protocols for police officers, and calls upon the two organizations to collaborate on and coordinate their analysis and responses, within their respective mandates, to make use of lessons learned to address future public health challenges and to build mechanisms to detect and disrupt the sale and supply of illicit and counterfeit pharmaceuticals and medical products;",
    "13": "Emphasizes the importance of enhanced cooperation between the United Nations system, in particular the World Health Organization, and INTERPOL, including through capacity-building and training activities, with a view to strengthening collaboration between health and security sectors, and further seizes the opportunity to encourage Member States to make full use of the secure communication channels of INTERPOL, including BioTracker, to exchange information on biological incidents of natural, accidental or deliberate origin;",
    "14": "Calls upon the United Nations, in particular the United Nations Office on Drugs and Crime, and INTERPOL, as appropriate and within their existing mandates, to enhance coordination and cooperation on matters related to maritime security, and to encourage law enforcement agencies to make full use of capabilities made available by INTERPOL and relevant United Nations entities, including the Global Maritime Security Database, as well as training, equipment and capacity-building, upon request and based on national needs, taking into account specific challenges faced by developing countries;",
    "15": "Recognizes the potential for strengthened collaboration between the United Nations, in particular the United Nations Office on Drugs and Crime, and INTERPOL, as appropriate and within their existing mandates, in order to assist Member States that are also member countries of INTERPOL in preventing and combating transnational financial crime and corruption, and in this regard also stresses the importance of the use of INTERPOL Notices and Diffusions to circulate details of new and existing crime trends related to financial crime, money-laundering and corruption, as well as the INTERPOL global stop-payment mechanism using the I-24/7 global police secure communications system, and accordingly calls on Member States to extend access to I-24/7 to financial intelligence units;",
    "16": "Strongly condemns the continued flow of unmanned aerial systems and their components to, by and between terrorist and organized criminal groups, expresses deep concern at the increasing global use of unmanned aerial systems by terrorists to launch attacks or to traffic drugs and arms, expresses its determination to address this growing threat, and stresses the importance of close cooperation between the United Nations, including the United Nations police, the Office of Counter- Terrorism and the United Nations Interregional Crime and Justice Research Institute, and INTERPOL to support Member States, upon their request, to design comprehensive policies and guidance to assist law enforcement entities, to effectively prevent and respond to the acquisition and use of unmanned aerial systems and their components and other emerging technologies and methods, such as artificial intelligence and virtual assets, for criminal and terrorist purposes;",
    "17": "Encourages increased cooperation between the United Nations and INTERPOL to assist Member States, upon their request, in effectively using the following resources readily available to Member States that are also member countries of INTERPOL, through their national central bureaux: (a) The INTERPOL I-24/7 global police secure communications system, which enables authorized users to share sensitive and urgent police information with their counterparts around the globe for the primary purpose of assisting in the prevention, detection and investigation of crime, in accordance with the INTERPOL mandate; (b) INTERPOL databases, by populating, updating and querying them, as appropriate, with a view to sharing accurate information between Member States in a timely manner in accordance with INTERPOL rules and regulations, in full respect of national sovereignty and operational priorities, through full access to them; (c) Publication of INTERPOL notices and diffusions to alert, request assistance from and provide assistance to law enforcement agencies of other Member States; (d) Criminal information analysis, namely, INTERPOL analytical products, to support national operational activities and investigations by sharing information with INTERPOL for inclusion in the INTERPOL Criminal Analysis Files; (e) INTERPOL support for the operations of the law enforcement agencies of Member States as well as training and capacity-building programmes and initiatives designed to improve national police capabilities;",
    "18": "Acknowledges the importance of extending real-time access to the I-24/7 global police secure communications system from the national central bureaux of Member States that are also member countries of INTERPOL to their other national law enforcement entities at strategic locations, such as border crossings, airports and customs and immigration posts, with a view to increasing the security of their borders by implementing INTERPOL technical solutions, inter alia, by integrating the most recent versions of the Fixed INTERPOL Network Database into border crossing points and systematically and automatically checking all incoming and outgoing travellers and conducting anticipated checks through advance passenger information and passenger name records mechanisms, thereby promoting increased cooperation between the United Nations and INTERPOL, including through the United Nations Countering Terrorist Travel Programme, in which INTERPOL is a partner;",
    "19": "Requests the Secretary-General to submit to the General Assembly at its seventy-ninth session a report on the implementation of the present resolution;",
    "20": "Decides to include in the provisional agenda of its seventy-ninth session, under the item entitled \u201cCooperation between the United Nations and regional and other organizations\u201d, the sub-item entitled \u201cCooperation between the United Nations and the International Criminal Police Organization (INTERPOL)\u201d."
  },
  "agenda_items": [
    "Item 127"
  ],
  "symbol_references": [
    "A/77/L.20"
  ]
}