{
  "symbol": "A/RES/79/131",
  "filename": "A_RES_79_131.pdf",
  "title": "79/131. Observer status for the International Coffee Organization in the General Assembly",
  "text": "United Nations \nA/RES/79/131\n \n \nGeneral Assembly \nDistr.: General \n12 December 2024 \n \n24-23488 (E)     \n*2423488* \n \n \nSeventy-ninth session \nAgenda item 179 \nObserver status for the International Coffee Organization \nin the General Assembly \n \n \n \n \n Resolution adopted by the General Assembly \non 4 December 2024 \n \n \n \n \n[on the report of the Sixth Committee (A/79/490, para. 7)] \n \n \n 79/131. Observer status for the International Coffee Organization in the \nGeneral Assembly \n \n \n \nThe General Assembly, \n \nWishing to promote cooperation between the United Nations and the \nInternational Coffee Organization, \n \n1. \nDecides to invite the International Coffee Organization to participate in \nthe sessions and the work of the General Assembly in the capacity of observer;  \n \n2. \nRequests the Secretary-General to take the action necessary to implement \nthe present resolution. \n \n47th plenary meeting \n4 December 2024 \n \n",
  "paragraphs": {
    "1": "Decides to invite the International Coffee Organization to participate in the sessions and the work of the General Assembly in the capacity of observer;",
    "2": "Requests the Secretary-General to take the action necessary to implement the present resolution. 47th plenary meeting 4 December 2024"
  },
  "agenda_items": [
    "Item 179"
  ],
  "symbol_references": []
}