{
  "symbol": "A/RES/74/236",
  "filename": "A_RES_74_236.pdf",
  "title": "74/236. Human resources development",
  "text": "United Nations \nA/RES/74/236\n \n \nGeneral Assembly \nDistr.: General \n17 January 2020 \n \n19-22509 (E)    220120 \n*1922509* \n \n \nSeventy-fourth session \nAgenda item 22 (c) \nEradication of poverty and other development issues: \nhuman resources development \n \n \n \n \n Resolution adopted by the General Assembly \non 19 December 2019 \n \n \n \n \n[on the report of the Second Committee (A/74/384/Add.3)] \n \n \n 74/236. Human resources development \n \n \n \nThe General Assembly,  \n \nRecalling its resolutions 52/196 of 18 December 1997, 54/211 of 22 December \n1999, 56/189 of 21 December 2001, 58/207 of 23 December 2003, 60/211 of \n22 December 2005, 62/207 of 19 December 2007, 64/218 of 21 December 2009, \n66/217 of 22 December 2011, 68/228 of 20 December 2013, 70/220 of 22 December \n2015 and 72/235 of 20 December 2017,  \n \nReaffirming its resolution 70/1 of 25 September 2015, entitled \u201cTransforming \nour world: the 2030 Agenda for Sustainable Development\u201d, in which it adopted a \ncomprehensive, far-reaching and people-centred set of universal and transformative \nSustainable Development Goals and targets, its commitment to working tirelessly for \nthe full implementation of the Agenda by 2030, its recognition that eradicating \npoverty in all its forms and dimensions, including extreme poverty, is the greatest \nglobal challenge and an indispensable requirement for sustainable development, its \ncommitment to achieving sustainable development in its three dimensions \u2013 \neconomic, social and environmental \u2013 in a balanced and integrated manner, and to \nbuilding upon the achievements of the Millennium Development Goals and seeking \nto address their unfinished business,  \n \nReaffirming also its resolution 69/313 of 27 July 2015 on the Addis Ababa \nAction Agenda of the Third International Conference on Financing for Development, \nwhich is an integral part of the 2030 Agenda for Sustainable Development, supports \nand complements it, helps to contextualize its means of implementation targets with \nconcrete policies and actions, and reaffirms the strong political commitment to \naddress the challenge of financing and creating an enabling environment at all levels \nfor sustainable development in the spirit of global partnership and solidarity,  \n\nA/RES/74/236 \nHuman resources development\n \n19-22509\n2/8 \n \n \nReaffirming its resolution 73/342 of 16 September 2019, in which it welcomed \nthe adoption by the International Labour Conference, at its 108th session, of the \nInternational Labour Organization Centenary Declaration for the Future of Work,1 \nand encouraged its implementation,  \n \nStressing that human resources development lies at the heart of sustainable \ndevelopment in its three dimensions and that health and education are at the core of \nhuman resources development,  \n \nStressing also that human resources development is vital to the efforts to achieve \nthe internationally agreed sustainable development goals, and to expand opportunities \nfor people, in particular, for people in vulnerable situations,  \n \nWelcoming the considerable efforts made over the years, yet recognizing that \nmany countries continue to face formidable challenges in developing a sufficient pool \nof human resources capable of meeting national economic and social needs and that \nthe formulation and implementation of effective human resources strategies often \nrequire resources and capacities not always available in developing countries, and \nrecognizing also the need for new ways to address human resources development,  \n \nStressing that climate change is a significant development challenge and that \nimproving educational and institutional capacities to tackle climate change is linked \nto human resources development efforts to ensure that populations can lead healthy \nand prosperous lives, including investing in teacher training and ensuring that all \nlearners acquire the knowledge and skills needed to promote sustainable \ndevelopment,  \n \nStressing also that technological changes and breakthroughs are expanding at a \nrapid pace and having an impact on the world of work and that, in this regard, the \ndevelopment of human resources needs to keep pace and be supported by proactive \nstrategies, investments and normative frameworks to address emerging issues relating \nto the future of work, education and training,  \n \nRecognizing that the ongoing digital revolution has an impact on the nature, \nquality and productivity of work and affects the organization and the choice of \nlocation of production, and thus the quantity, quality and distribution of jobs,  \n \nNoting that technological change can lead to both highly skilled employment \nopportunities as well as disruptions in labour markets, which can have adverse \ndistributional effects, including rising inequality among and within countries,  \n \nRecognizing the uneven status of access to and development of digital \ninfrastructure within and among countries and the barriers faced by developing \ncountries, such as the lack of electricity and broadband Internet connection, to \nbridging the digital divide and leapfrogging to frontier technologies,  \n \nRecognizing also that the benefits of human resources development are best \nrealized in national and international environments that support full and productive \nemployment and decent work for all women and men, young people and persons with \ndisabilities, equal pay for work of equal value and equality of opportunity and \ntreatment, access to education and non-discrimination and that maintain an enabling \nenvironment for job creation,  \n \nRecognizing further the evidence of an uneven recovery and the ongoing \nadverse impacts, particularly on development, of the world financial and economic \ncrisis that continue to diminish the ability of many countries, especially developing \n__________________ \n \n1  A/73/918, annex. \n\nHuman resources development \nA/RES/74/236\n \n3/8\n19-22509 \n \ncountries, to cope with and address human resources development challenges and to \nformulate and implement effective strategies for poverty eradication and sustainable \ndevelopment,  \n \nAcknowledging the important synergies between international migration and \ndevelopment and the need to deal with the challenges and opportunities that migration \npresents to countries of origin, transit and destination, recognizing that migration \nbrings benefits as well as challenges to the global community, recognizing also the \nrole that migrants returning to their country of origin can play through the utilization \nof their skills, and stressing that the brain drain continues to be a severe problem in \nmany developing and transitioning countries, undermining efforts in the area of \nhuman resources development,  \n \nRecognizing the emergence of new types of employment based on sharing-\neconomy models, and the need to extend social protection rights and benefits that are \naccessible and portable to workers whose conditions of employment are non-standard, \nas appropriate and in accordance with national circumstances,  \n \nRecognizing also the need to align science, technological knowledge and \ninnovation systems with national development objectives, fully integrated with \nnational human resources development, labour needs and poverty eradication \nstrategies and supported by appropriate institutional and policy frameworks, which \ncan lead to positive transformations in people\u2019s lives,  \n \nNoting that science, technological knowledge and innovation policies should \ntake into account the specific features of the economy in developing countries, \nincluding the size of the traditional sector, indigenous knowledge, the limited access \nto skilled labour and capital, weak infrastructure and inadequate institutional \nframeworks, in order to generate solutions that address the specific challenges of \nthose countries and to foster synergies between modern science and technology and \nindigenous and local knowledge,  \n \nReaffirming that gender equality and the empowerment of all women and girls \nare of fundamental importance for achieving sustained economic growth, poverty \neradication and sustainable development, in accordance with the relevant General \nAssembly resolutions and United Nations conferences, and that investing in the \ndevelopment of women and girls has a multiplier effect, in particular on productivity, \nefficiency and sustained economic growth, in all sectors of the economy, especially \nin key areas such as agriculture, industry and services, including health,  \n \nRecognizing that education is the key to promoting the development of human \npotential, equality and understanding among peoples, as well as to sustaining \neconomic growth and eradicating poverty, and recognizing also that, to achieve those \nends, it is essential that quality education be available to all, including indigenous \npeoples, girls and women, rural inhabitants and persons with disabilities,  \n \nStressing that Governments have the primary responsibility for defining and \nimplementing appropriate policies for human resources development, and the need \nfor continued support from the international community for the national efforts of \ndeveloping countries,  \n \nReiterating the pledge that no one will be left behind, reaffirming the \nrecognition that the dignity of the human person is fundamental, and the wish to see \nthe Goals and targets met for all nations and peoples and for all segments of society, \nand recommitting to endeavour to reach the furthest behind first, \n \n1. \nTakes note with appreciation of the report of the Secretary-General;2  \n__________________ \n \n2  A/74/284. \n\nA/RES/74/236 \nHuman resources development\n \n19-22509\n4/8 \n \n \n2. \nCalls upon the international community to place human resources \ndevelopment at the core of economic and social development and to develop short-, \nmedium- and long-term strategies to effectively enhance human resources capacities, \nas educated, skilled, healthy, capable, productive and adaptable workforces are the \nfoundation for achieving sustained, inclusive and equitable economic growth and \ndevelopment;  \n \n3. \nEncourages giving appropriate consideration to human resources \ndevelopment strategies in the implementation of the 2030 Agenda for Sustainable \nDevelopment;3  \n \n4. \nStresses the need for Member States to emphasize and integrate human \nresources development into national development strategies, including national \ndevelopment policies and strategies to eradicate poverty and achieve the Sustainable \nDevelopment Goals, in order to address structural and multidimensional challenges \nto enhancing national productive capacities and to ensure that human resources \ndevelopment implications are taken into account by all national development \nstakeholders;  \n \n5. \nRecognizes that comprehensive approaches to human resources \ndevelopment that address poverty eradication and the creation of a skilled workforce \nare also critical in reducing unemployment and brain drain and in promoting greater \nsocial inclusion;  \n \n6. \nAlso recognizes that the future of work, affected by progress in science \nand technology, requires adaptability and faster learning and relearning of new skills, \nwhich, in turn, require a shift towards early childhood education, work-based \nlearning, lifelong learning and a comprehensive life-cycle approach to education and \ntraining, enabled, inter alia, through enhanced investment in teacher training and \nprofessional development and improved access to digital learning resources, \nespecially in developing countries;  \n \n7. \nEncourages States, the private sector and other relevant stakeholders to \ntake appropriate steps, in accordance with their plans and policies, to help individuals \nto make well-informed choices in education, training and careers, develop an \nintegrated system of quality education and training that responds to constantly \nevolving needs, promote employer recognition and career development based on \nskills and foster a culture that supports and celebrates lifelong learning, in order to \nprovide opportunities for all to develop their fullest potential throughout life, \nregardless of their starting points, thereby improving their chances of staying \ngainfully employed, and calls for more effective support for developing countries in \nthis regard, including from the United Nations system;  \n \n8. \nEncourages Member States to adopt and implement comprehensive human \nresources development strategies premised on national development objectives that \nensure a strong link between quality education, training and employment, help to \nmaintain a productive and competitive workforce and are responsive to the needs of \nthe economy;  \n \n9. \nStresses that human resources development policies should focus on \nsupporting the emergence of a sufficiently wide and flexible pool of skilled human \nresources, especially among women and youth, to support all sectors of the economy \nand be matched with present and future workforce needs, which requires well-\nsequenced investments in basic education, vocational training, on-the-job training and \n__________________ \n \n3  Resolution 70/1. \n\nHuman resources development \nA/RES/74/236\n \n5/8\n19-22509 \n \nmore advanced managerial, engineering and scientific education to increase the \nsupply of technological knowledge that can be absorbed by national innovation \nsystems;  \n \n10. Emphasizes the need to adopt cross-sectoral approaches and mechanisms \nto identify human resources development needs in the medium and long term for all \nsectors of the economy, to formulate and implement policies and programmes to \naddress those needs and to acknowledge the role of the private sector in training, \neducation and employment;  \n \n11. \nRecognizes the need for comprehensive and flexible science, technological \nknowledge and innovation strategies that encompass all sectors of the economy, \nwhich are critical to ensuring that skills are matched with labour market demand and \nready to adapt to and benefit from a constantly evolving technology landscape;  \n \n12. Acknowledges the need to promote and support quality education and \nlifelong learning to ensure that all children, youth and adults are empowered with the \nrelevant knowledge and skills to shape more resilient, inclusive and sustainable \nsocieties that are able to adapt to rapid technological change, and stresses the need to \nfoster international cooperation to support developing countries in addressing their \nconstraints in access to technologies and education;  \n \n13. Emphasizes that, when science, technological knowledge and innovation \nand human resources development approaches are mutually reinforcing, they can help \nto implement sustainable development in its three dimensions;  \n \n14. Encourages the international community to bridge the technological \ndivide, which is an important precondition for closing the economic divide within and \namong countries, including through appropriate ecosystems for innovation and \ntargeted support for enabling access for all to appropriate digital infrastructure;  \n \n15. Calls for proactively responding to the opportunities offered by and the \nadverse impacts of technological changes on the labour market, as appropriate and in \naccordance with national circumstances, by adopting effective social protection \nsystems, the recognition and credentialing of non-formal and informal learning, \ntargeted support for disadvantaged groups and support for adaptation during transition \nperiods;  \n \n16. Stresses that investment in human resources development should be an \nintegral part of national development policies and strategies, and in this regard calls \nfor the adoption of policies to facilitate investment focused on physical and social \ninfrastructure, including education, in particular skills upgrading and vocational \ntraining in areas such as science and technology, including information and \ncommunications technology, as well as in capacity development, health and \nsustainable development;  \n \n17. Encourages Member States, as appropriate, to continue to implement \nnationally appropriate social protection systems and measures for all, including social \nprotection floors, to adopt policies that strengthen existing safety nets and protect \npeople in vulnerable situations and to take other appropriate actions, including \nboosting national economic performance, recognizes that social protection floors, \ndefined according to national priorities and the individual circumstances of States, \ncan provide systemic approaches to addressing poverty and vulnerability and can \ncontribute significantly to successful human resources development strategies, \nacknowledges, in this regard, that many developing countries lack the necessary \nfinancial resources and capacity to implement such countercyclical measures, and in \nthis regard recognizes the need for continued mobilization of additional domestic and \ninternational resources, as appropriate;  \n\nA/RES/74/236 \nHuman resources development\n \n19-22509\n6/8 \n \n \n18. Encourages States to consider policies consistent with the International \nLabour Organization Declaration on Fundamental Principles and Rights at Work and \ntheir obligations under all relevant ratified conventions of the International Labour \nOrganization, and recalls the importance of promoting decent work for all and of \nincreasing quality jobs, including through measures aimed at ensuring occupational \nhealth and safety and through working relationships based on effective social \ndialogue;  \n \n19. Stresses that human resources development strategies should include \nmeasures aimed at reducing unemployment and underemployment among young men \nand women and the long-term unemployed, who have been disproportionately \naffected by slow growth in jobs recovery and by labour-displacing technological \nchanges, and to integrate underutilized human resources into the labour market \nthrough policies that promote skills development and productivity, facilitate \nadaptation during transition periods and reduce barriers to employment, including \ngender barriers, including by providing incentives, as appropriate, for recruiting, \nretaining and retooling, assistance in job-finding, job-matching and vocational and \non-the-job training, and by promoting, inter alia, youth entrepreneurship;  \n \n20. Recognizes that an ageing workforce can have positive and negative \nimplications for labour markets, and stresses the importance of lifelong learning to \nensure the inclusion of older workers in the future of work;  \n \n21. Emphasizes the need for development-oriented policies that support \nproductive activities, decent job creation, entrepreneurship, creativity and innovation, \nand encourages the formalization and growth of micro-, small- and medium-sized \nenterprises, including through access to financial services; \n \n22. Stresses the need for Member States to retain and further enhance national \nhuman resources by boosting job-rich recovery and promoting decent work, including \nby adopting policies and incentives that enhance labour productivity and stimulate \nprivate investment and entrepreneurship and strengthen the role of labour \nadministration and institutions in order to foster job creation, address the gender wage \ngap, reduce occupational segregation and increase the participation of people in \nvulnerable situations, including workers in the informal economy;  \n \n23. Emphasizes the need to address the interlinkages among human resources \ndevelopment, energy and food security, agriculture and rural development, and \nencourages countries to strengthen capacity in agriculture and rural development;  \n \n24. Encourages Member States to facilitate access to and apply \nenvironmentally sound technologies, and notes with appreciation the launch of the \nTechnology Facilitation Mechanism established in the Addis Ababa Action Agenda of \nthe Third International Conference on Financing for Development, 4  based on a \nmulti-stakeholder collaboration among States, civil society, the private sector, the \nscientific community, United Nations entities and other stakeholders, in order to \nsupport the implementation of the Sustainable Development Goals;  \n \n25. Stresses that sustainable development is dependent, inter alia, on healthy \npeople, calls upon Governments to continue their efforts to strengthen national health \nsystems, urges the further strengthening of international cooperation in the area of \nhealth, inter alia, by considering the promotion of universal health coverage and \nthrough the exchange of best practices in the areas of strengthening health systems, \naccess to medicines, expanding and transforming the health workforce, recruitment, \ntraining and development of health personnel, transfer of technology on mutually \nagreed terms and production of affordable, safe, effective and good-quality medicine, \n__________________ \n \n4  Resolution 69/313, annex, para. 123. \n\nHuman resources development \nA/RES/74/236\n \n7/8\n19-22509 \n \nand in this regard also stresses that international cooperation and assistance, including \nfunding, need to become more predictable and to be better aligned with national \npriorities and channelled to recipient countries in ways that strengthen national health \nsystems; \n \n26. Calls upon the international community, including the relevant entities of \nthe United Nations system, to support the efforts of developing countries to address \nthe adverse effects of HIV and AIDS, malaria, tuberculosis and other infectious \ndiseases and to halt the spread of epidemic diseases, as well as the prevention and \ncontrol of non-communicable diseases in Africa, Asia and other regions, and their \neffects on human resources;  \n \n27. Encourages Governments to facilitate investments in education, skills and \ndecent job creation in the health and social sectors by taking note of the \nrecommendations of the Secretary-General\u2019s High-level Commission on Health \nEmployment and Economic Growth and to avert the shortfall of 18 million health \nworkers by 2030, building the human capital required to accelerate universal health \ncoverage and global health security, recognizes that these actions are not only \nessential to the achievement of the health-related Sustainable Development Goals but \nwill also generate benefits across the Goals, including the creation of decent jobs, the \nreduction of youth unemployment, the enhancement of women\u2019s economic \nempowerment and participation and inclusive growth;  \n \n28. Calls upon relevant United Nations entities to support national efforts to \nbuild institutional capacities to address long-term national human resources \ndevelopment needs in addition to providing training to individuals;  \n \n29. Calls upon the international community to assist developing countries in \nthe implementation of national human resources development strategies and \nencourages the international community, including the private sector and relevant \ncivil society actors, to provide and mobilize financial resources, capacity-building, \ntechnical assistance and technology transfer on mutually agreed terms and to supply \nexpertise from all sources, as available;  \n \n30. Calls for steps to integrate a gender perspective into human resources \ndevelopment, including through policies, strategies and targeted actions aimed at \npromoting women\u2019s capacities and access to productive activities, and in this regard \nemphasizes the need to ensure the full participation of women in the formulation and \nimplementation of such policies, strategies and actions;  \n \n31. Stresses the important contributions of the public and private sectors, \nrespectively, in meeting national training and education needs to support the efficient \nfunctioning of enterprises and matching the needs of a rapidly changing economy, \nand encourages the integration of those contributions, including through the greater \nuse of public-private partnerships and incentives;  \n \n32. Calls for actions at the national, regional and international levels that will \ngive high priority to improving and expanding literacy, as well as science proficiency, \nincluding by providing tertiary, technical vocational and adult education, and stresses \nthe need to ensure that, by 2030, children everywhere, girls and boys alike, will be \nable to complete free, equitable and quality primary and secondary education, leading \nto relevant and effective learning outcomes;  \n \n33. Encourages Governments to consider appropriate measures at the national \nlevel, such as upgrading human skills, better aligning educational and training \nsystems to labour market needs and strengthening labour institutions and regulations \nto respond to economic fluctuations;  \n\nA/RES/74/236 \nHuman resources development\n \n19-22509\n8/8 \n \n \n34. Encourages countries to maintain or consider enhancing measures to boost \njob-rich recovery, such as policies and incentives to enhance labour productivity and \nstimulate private investment;  \n \n35. Encourages efforts by Member States and the international community to \npromote a balanced, coherent and comprehensive approach to international migration \nand development, in particular by building partnerships and ensuring coordinated \naction to develop capacities, including for the management of migration, and in this \nregard reiterates the need to consider innovative measures to maximize the benefits \nof migration while minimizing the negative effects on origin, transit and destination \ncountries of the migration of both highly skilled and low-skilled workers from \ndeveloping countries, taking into account the principle of national sovereignty;  \n \n36. Reaffirms the commitment at the very heart of the 2030 Agenda to leave \nno one behind and commit to taking more tangible steps to support people in \nvulnerable situations and the most vulnerable countries and to reach the furthest \nbehind first; \n \n37. Requests the Secretary-General to submit to the General Assembly, at its \nseventy-sixth session, an action-oriented report on the implementation of the present \nresolution in line with the 2030 Agenda, and decides to include in the provisional \nagenda of its seventy-sixth session, under the item entitled \u201cEradication of poverty and \nother development issues\u201d, the sub-item entitled \u201cHuman resources development\u201d. \n \n52nd plenary meeting \n19 December 2019 \n \n",
  "paragraphs": {
    "1": "Takes note with appreciation of the report of the Secretary-General;2",
    "2": "Calls upon the international community to place human resources development at the core of economic and social development and to develop short-, medium- and long-term strategies to effectively enhance human resources capacities, as educated, skilled, healthy, capable, productive and adaptable workforces are the foundation for achieving sustained, inclusive and equitable economic growth and development;",
    "3": "Encourages giving appropriate consideration to human resources development strategies in the implementation of the 2030 Agenda for Sustainable Development;3",
    "4": "Stresses the need for Member States to emphasize and integrate human resources development into national development strategies, including national development policies and strategies to eradicate poverty and achieve the Sustainable Development Goals, in order to address structural and multidimensional challenges to enhancing national productive capacities and to ensure that human resources development implications are taken into account by all national development stakeholders;",
    "5": "Recognizes that comprehensive approaches to human resources development that address poverty eradication and the creation of a skilled workforce are also critical in reducing unemployment and brain drain and in promoting greater social inclusion;",
    "6": "Also recognizes that the future of work, affected by progress in science and technology, requires adaptability and faster learning and relearning of new skills, which, in turn, require a shift towards early childhood education, work-based learning, lifelong learning and a comprehensive life-cycle approach to education and training, enabled, inter alia, through enhanced investment in teacher training and professional development and improved access to digital learning resources, especially in developing countries;",
    "7": "Encourages States, the private sector and other relevant stakeholders to take appropriate steps, in accordance with their plans and policies, to help individuals to make well-informed choices in education, training and careers, develop an integrated system of quality education and training that responds to constantly evolving needs, promote employer recognition and career development based on skills and foster a culture that supports and celebrates lifelong learning, in order to provide opportunities for all to develop their fullest potential throughout life, regardless of their starting points, thereby improving their chances of staying gainfully employed, and calls for more effective support for developing countries in this regard, including from the United Nations system;",
    "8": "Encourages Member States to adopt and implement comprehensive human resources development strategies premised on national development objectives that ensure a strong link between quality education, training and employment, help to maintain a productive and competitive workforce and are responsive to the needs of the economy;",
    "9": "Stresses that human resources development policies should focus on supporting the emergence of a sufficiently wide and flexible pool of skilled human resources, especially among women and youth, to support all sectors of the economy and be matched with present and future workforce needs, which requires well- sequenced investments in basic education, vocational training, on-the-job training and more advanced managerial, engineering and scientific education to increase the supply of technological knowledge that can be absorbed by national innovation systems;",
    "10": "Emphasizes the need to adopt cross-sectoral approaches and mechanisms to identify human resources development needs in the medium and long term for all sectors of the economy, to formulate and implement policies and programmes to address those needs and to acknowledge the role of the private sector in training, education and employment;",
    "11": "Recognizes the need for comprehensive and flexible science, technological knowledge and innovation strategies that encompass all sectors of the economy, which are critical to ensuring that skills are matched with labour market demand and ready to adapt to and benefit from a constantly evolving technology landscape;",
    "12": "Acknowledges the need to promote and support quality education and lifelong learning to ensure that all children, youth and adults are empowered with the relevant knowledge and skills to shape more resilient, inclusive and sustainable societies that are able to adapt to rapid technological change, and stresses the need to foster international cooperation to support developing countries in addressing their constraints in access to technologies and education;",
    "13": "Emphasizes that, when science, technological knowledge and innovation and human resources development approaches are mutually reinforcing, they can help to implement sustainable development in its three dimensions;",
    "14": "Encourages the international community to bridge the technological divide, which is an important precondition for closing the economic divide within and among countries, including through appropriate ecosystems for innovation and targeted support for enabling access for all to appropriate digital infrastructure;",
    "15": "Calls for proactively responding to the opportunities offered by and the adverse impacts of technological changes on the labour market, as appropriate and in accordance with national circumstances, by adopting effective social protection systems, the recognition and credentialing of non-formal and informal learning, targeted support for disadvantaged groups and support for adaptation during transition periods;",
    "16": "Stresses that investment in human resources development should be an integral part of national development policies and strategies, and in this regard calls for the adoption of policies to facilitate investment focused on physical and social infrastructure, including education, in particular skills upgrading and vocational training in areas such as science and technology, including information and communications technology, as well as in capacity development, health and sustainable development;",
    "17": "",
    "18": "Encourages States to consider policies consistent with the International Labour Organization Declaration on Fundamental Principles and Rights at Work and their obligations under all relevant ratified conventions of the International Labour Organization, and recalls the importance of promoting decent work for all and of increasing quality jobs, including through measures aimed at ensuring occupational health and safety and through working relationships based on effective social dialogue;",
    "19": "Stresses that human resources development strategies should include measures aimed at reducing unemployment and underemployment among young men and women and the long-term unemployed, who have been disproportionately affected by slow growth in jobs recovery and by labour-displacing technological changes, and to integrate underutilized human resources into the labour market through policies that promote skills development and productivity, facilitate adaptation during transition periods and reduce barriers to employment, including gender barriers, including by providing incentives, as appropriate, for recruiting, retaining and retooling, assistance in job-finding, job-matching and vocational and on-the-job training, and by promoting, inter alia, youth entrepreneurship;",
    "20": "Recognizes that an ageing workforce can have positive and negative implications for labour markets, and stresses the importance of lifelong learning to ensure the inclusion of older workers in the future of work;",
    "21": "Emphasizes the need for development-oriented policies that support productive activities, decent job creation, entrepreneurship, creativity and innovation, and encourages the formalization and growth of micro-, small- and medium-sized enterprises, including through access to financial services;",
    "22": "Stresses the need for Member States to retain and further enhance national human resources by boosting job-rich recovery and promoting decent work, including by adopting policies and incentives that enhance labour productivity and stimulate private investment and entrepreneurship and strengthen the role of labour administration and institutions in order to foster job creation, address the gender wage gap, reduce occupational segregation and increase the participation of people in vulnerable situations, including workers in the informal economy;",
    "23": "Emphasizes the need to address the interlinkages among human resources development, energy and food security, agriculture and rural development, and encourages countries to strengthen capacity in agriculture and rural development;",
    "24": "Encourages Member States to facilitate access to and apply environmentally sound technologies, and notes with appreciation the launch of the Technology Facilitation Mechanism established in the Addis Ababa Action Agenda of the Third International Conference on Financing for Development, 4 based on a multi-stakeholder collaboration among States, civil society, the private sector, the scientific community, United Nations entities and other stakeholders, in order to support the implementation of the Sustainable Development Goals;",
    "25": "Stresses that sustainable development is dependent, inter alia, on healthy people, calls upon Governments to continue their efforts to strengthen national health systems, urges the further strengthening of international cooperation in the area of health, inter alia, by considering the promotion of universal health coverage and through the exchange of best practices in the areas of strengthening health systems, access to medicines, expanding and transforming the health workforce, recruitment, training and development of health personnel, transfer of technology on mutually agreed terms and production of affordable, safe, effective and good-quality medicine, and in this regard also stresses that international cooperation and assistance, including funding, need to become more predictable and to be better aligned with national priorities and channelled to recipient countries in ways that strengthen national health systems;",
    "26": "Calls upon the international community, including the relevant entities of the United Nations system, to support the efforts of developing countries to address the adverse effects of HIV and AIDS, malaria, tuberculosis and other infectious diseases and to halt the spread of epidemic diseases, as well as the prevention and control of non-communicable diseases in Africa, Asia and other regions, and their effects on human resources;",
    "27": "Encourages Governments to facilitate investments in education, skills and decent job creation in the health and social sectors by taking note of the recommendations of the Secretary-General\u2019s High-level Commission on Health Employment and Economic Growth and to avert the shortfall of 18 million health workers by 2030, building the human capital required to accelerate universal health coverage and global health security, recognizes that these actions are not only essential to the achievement of the health-related Sustainable Development Goals but will also generate benefits across the Goals, including the creation of decent jobs, the reduction of youth unemployment, the enhancement of women\u2019s economic empowerment and participation and inclusive growth;",
    "28": "Calls upon relevant United Nations entities to support national efforts to build institutional capacities to address long-term national human resources development needs in addition to providing training to individuals;",
    "29": "Calls upon the international community to assist developing countries in the implementation of national human resources development strategies and encourages the international community, including the private sector and relevant civil society actors, to provide and mobilize financial resources, capacity-building, technical assistance and technology transfer on mutually agreed terms and to supply expertise from all sources, as available;",
    "30": "Calls for steps to integrate a gender perspective into human resources development, including through policies, strategies and targeted actions aimed at promoting women\u2019s capacities and access to productive activities, and in this regard emphasizes the need to ensure the full participation of women in the formulation and implementation of such policies, strategies and actions;",
    "31": "Stresses the important contributions of the public and private sectors, respectively, in meeting national training and education needs to support the efficient functioning of enterprises and matching the needs of a rapidly changing economy, and encourages the integration of those contributions, including through the greater use of public-private partnerships and incentives;",
    "32": "Calls for actions at the national, regional and international levels that will give high priority to improving and expanding literacy, as well as science proficiency, including by providing tertiary, technical vocational and adult education, and stresses the need to ensure that, by 2030, children everywhere, girls and boys alike, will be able to complete free, equitable and quality primary and secondary education, leading to relevant and effective learning outcomes;",
    "33": "",
    "34": "Encourages countries to maintain or consider enhancing measures to boost job-rich recovery, such as policies and incentives to enhance labour productivity and stimulate private investment;",
    "35": "Encourages efforts by Member States and the international community to promote a balanced, coherent and comprehensive approach to international migration and development, in particular by building partnerships and ensuring coordinated action to develop capacities, including for the management of migration, and in this regard reiterates the need to consider innovative measures to maximize the benefits of migration while minimizing the negative effects on origin, transit and destination countries of the migration of both highly skilled and low-skilled workers from developing countries, taking into account the principle of national sovereignty;",
    "36": "Reaffirms the commitment at the very heart of the 2030 Agenda to leave no one behind and commit to taking more tangible steps to support people in vulnerable situations and the most vulnerable countries and to reach the furthest behind first;",
    "37": "Requests the Secretary-General to submit to the General Assembly, at its seventy-sixth session, an action-oriented report on the implementation of the present resolution in line with the 2030 Agenda, and decides to include in the provisional agenda of its seventy-sixth session, under the item entitled \u201cEradication of poverty and other development issues\u201d, the sub-item entitled \u201cHuman resources development\u201d."
  },
  "agenda_items": [
    "Item 22"
  ],
  "symbol_references": []
}