{
  "symbol": "A/RES/74/279",
  "filename": "A_RES_74_279.pdf",
  "title": "74/279. Triennial review of the rates and standards for reimbursement to Member States for contingent-owned equipment",
  "text": "United Nations \nA/RES/74/279\n \n \nGeneral Assembly \nDistr.: General \n9 July 2020 \n \n \n20-08787 (E)    140720     \n*2008787* \n \n \nSeventy-fourth session \nAgenda item 148 \nAdministrative and budgetary aspects of the financing of the \nUnited Nations peacekeeping operations \n \n \n \n \n Resolution adopted by the General Assembly on \n30 June 2020 \n \n \n \n \n[on the report of the Fifth Committee (A/74/910)] \n \n \n 74/279. Triennial review of the rates and standards for reimbursement to \nMember States for contingent-owned equipment  \n \n \n \nThe General Assembly, \n \nRecalling its resolution 71/296 of 30 June 2017, \n \nHaving considered the letter dated 10 February 2020 from the Chair of the 2020 \nWorking Group on Contingent-Owned Equipment to the Chair of the Fifth Committee \ntransmitting the report of the Working Group,1 the report of the Secretary-General on \nthe triennial review of the rates and standards for reimbursement to Member States \nfor contingent-owned equipment2 and the related report of the Advisory Committee \non Administrative and Budgetary Questions,3  \n \n1. \nTakes note of the report of the 2020 Working Group on Contingent-Owned \nEquipment1 and the report of the Secretary-General;2 \n \n2. \nAcknowledges with appreciation the work of the Working Group on \nContingent-Owned Equipment and the guidance and advice provided by the \nSecretariat during its substantive 2020 session; \n \n3. \nEndorses the conclusions and recommendations contained in the report of \nthe Advisory Committee on Administrative and Budgetary Questions, 3 and requests \nthe Secretary-General to ensure their full implementation. \n \n30 June 2020 \n \n__________________ \n \n1  A/74/689. \n \n2  A/74/698. \n \n3  A/74/754. \n",
  "paragraphs": {
    "1": "Takes note of the report of the 2020 Working Group on Contingent-Owned Equipment1 and the report of the Secretary-General;2",
    "2": "Acknowledges with appreciation the work of the Working Group on Contingent-Owned Equipment and the guidance and advice provided by the Secretariat during its substantive 2020 session;",
    "3": "Endorses the conclusions and recommendations contained in the report of the Advisory Committee on Administrative and Budgetary Questions, 3 and requests the Secretary-General to ensure their full implementation. 30 June 2020 __________________ 1 A/74/689. 2 A/74/698. 3 A/74/754."
  },
  "agenda_items": [
    "Item 148"
  ],
  "symbol_references": []
}