{
  "symbol": "A/RES/74/165",
  "filename": "A_RES_74_165.pdf",
  "title": "74/165. Effective promotion of the Declaration on the Rights of Persons Belonging to National or Ethnic, Religious and Linguistic Minorities",
  "text": "United Nations \nA/RES/74/165 \n \n \nGeneral Assembly \nDistr.: General \n16 January 2020 \n \n19-22293 (E)    170120 \n*1922293* \n \n \nSeventy-fourth session \nAgenda item 70 (b) \nPromotion and protection of human rights: human rights \nquestions, including alternative approaches for improving \nthe effective enjoyment of human rights and fundamental \nfreedoms \n \n \n \n \n Resolution adopted by the General Assembly \non 18 December 2019 \n \n \n \n \n[on the report of the Third Committee (A/74/399/Add.2)] \n \n \n 74/165. Effective promotion of the Declaration on the Rights of Persons \nBelonging to National or Ethnic, Religious and Linguistic Minorities \n \n \n \nThe General Assembly, \n \nRecalling its resolution 47/135 of 18 December 1992, by which it adopted the \nDeclaration on the Rights of Persons Belonging to National or Ethnic, Religious and \nLinguistic Minorities annexed to that resolution, and bearing in mind article 27 of the \nInternational Covenant on Civil and Political Rights1 as well as other relevant existing \ninternational and regional standards and national legislation, \n \nRecalling also its subsequent resolutions on the effective promotion of the \nDeclaration and all relevant resolutions of the Human Rights Council, \n \nRecalling further Human Rights Council resolution 32/5 of 30 June 2016, \nentitled \u201cHuman rights and arbitrary deprivation of nationality\u201d,2 and all previous \nresolutions adopted by the Human Rights Council and the Commission on Human \nRights on the issue of human rights and the arbitrary deprivation of nationality, \n \nRecalling Human Rights Council resolution 37/14 of 22 March 2018,3 in which \nthe Council considered the recommendations of the Forum on Minority Issues at its \ntenth session, held in December 2017, on the rights of minority youth,4 \n__________________ \n \n1  See resolution 2200 A (XXI), annex. \n \n2  See Official Records of the General Assembly, Seventy-first Session, Supplement No. 53 \n(A/71/53), chap. V, sect. A. \n \n3  Ibid., Seventy-third Session, Supplement No. 53 (A/73/53), chap. IV, sect. A. \n \n4  A/HRC/37/73. \n\nA/RES/74/165 \nEffective promotion of the Declaration on the Rights of Persons Belonging \nto National or Ethnic, Religious and Linguistic Minorities\n \n19-22293\n2/6 \n \n \nAffirming that the promotion and protection of the rights of persons belonging \nto national or ethnic, religious and linguistic minorities and dialogue between these \nminorities and the rest of society, as well as the constructive and inclusive \ndevelopment of practices and institutional arrangements to accommodate diversity \nwithin societies, contribute to political and social stability and the prevention and \npeaceful resolution of conflicts involving the rights of persons belonging to national \nor ethnic, religious and linguistic minorities, \n \nWelcoming the adoption of the 2030 Agenda for Sustainable Development,5 of \nwhich the Addis Ababa Action Agenda of the Third International Conference on \nFinancing for Development 6  is an integral part, recalling that the Sustainable \nDevelopment Goals and targets seek to realize the human rights of all, and stressing \nthe need for Member States to integrate the 2030 Agenda into their respective national \npolicies and development frameworks, as appropriate, to promote the effective \nimplementation, follow-up and review of the 2030 Agenda, in order to ensure that no \none is left behind, \n \nExpressing concern at the frequency and severity of disputes and conflicts \ninvolving persons belonging to national or ethnic, religious and linguistic minorities \nin many countries and their often tragic consequences, and that such persons often \nsuffer disproportionately from the effects of conflicts resulting in the violation of their \nhuman rights and are particularly vulnerable to forced displacement through, \ninter alia, population transfers, revocation of previously held identity documents, \nrefugee flows and forced relocation, \n \nEmphasizing the need for reinforced efforts to realize the rights of persons \nbelonging to national or ethnic, religious and linguistic minorities, including by \naddressing economic and social conditions and marginalization, as well as to end any \ntype of discrimination against them, including by addressing multiple, aggravated and \nintersecting forms of discrimination, \n \nEmphasizing also the fundamental importance of human rights education, \ntraining and learning as well as of dialogue, including intercultural and interfaith \ndialogue, and interaction among all relevant stakeholders and members of society on \nthe promotion and protection of the rights of persons belonging to national or ethnic, \nreligious and linguistic minorities, \n \nRecognizing the importance of realizing the right to education for all and, \nwherever possible, providing persons belonging to national or ethnic, religious and \nlinguistic minorities with adequate opportunities to learn their own language or to \nhave instruction in their own language, \n \nEmphasizing the important role that national institutions can play in the \npromotion and protection of the rights of persons belonging to national or ethnic, \nreligious and linguistic minorities, and acknowledging the role that the United \nNations, its specialized agencies and other relevant organizations, and the Special \nRapporteur of the Human Rights Council on minority issues, play in this regard by, \ninter alia, promoting the implementation of the Declaration, \n \nRecognizing that a vast majority of stateless persons are persons belonging to \nnational or ethnic, religious and linguistic minorities, \n \n1. \nReaffirms the obligation of States to ensure that persons belonging to \nnational or ethnic, religious and linguistic minorities may exercise fully and \neffectively all human rights and fundamental freedoms without any discrimination \nand in full equality before the law, as proclaimed in the Declaration on the Rights of \n__________________ \n \n5  Resolution 70/1. \n \n6  Resolution 69/313, annex. \n\nEffective promotion of the Declaration on the Rights of Persons Belonging \nto National or Ethnic, Religious and Linguistic Minorities \nA/RES/74/165\n \n3/6\n19-22293 \n \nPersons Belonging to National or Ethnic, Religious and Linguistic Minorities, 7 and \ndraws attention to the relevant provisions of the Durban Declaration and Programme \nof Action,8 including the provisions on forms of multiple discrimination; \n \n2. \nUrges States and the international community to promote and protect the \nrights of persons belonging to national or ethnic, religious and linguistic minorities, \nas set out in the Declaration on the Rights of Persons Belonging to National or Ethnic, \nReligious and Linguistic Minorities, including through the encouragement of \nconditions for the promotion of their identity, the provision of adequate education and \nthe facilitation of their participation in all aspects of the political, economic, social, \nreligious and cultural life of society and in the economic progress and development \nof their country, without discrimination, and to apply a gender perspective while \ndoing so; \n \n3. \nEncourages States to take appropriate measures so that, wherever possible, \npersons belonging to national or ethnic, religious and linguistic minorities may have \nadequate opportunities to learn their own language or to have instruction in their own \nlanguage; \n \n4. \nUrges States to take all appropriate measures, inter alia, constitutional, \nlegislative, administrative and other measures, for the promotion and implementation \nof the Declaration, and appeals to States to cooperate bilaterally and multilaterally, in \nparticular on the exchange of best practices and lessons learned, in accordance with \nthe Declaration, in order to promote and protect the rights of persons belonging to \nnational or ethnic, religious and linguistic minorities; \n \n5. \nRecommends that States continue to reflect on current and emerging \nchallenges facing persons belonging to national or ethnic, religious and linguistic \nminorities, including the rise in persecution on religious and ethnic grounds and \nincreasing levels of hate crimes and hate speech targeting, among others, persons \nbelonging to national or ethnic, religious and linguistic minorities; \n \n6. \nAlso recommends that States ensure that all measures taken with a view to \nimplementing the Declaration are, to the fullest extent possible, developed, designed, \nimplemented and reviewed with the full, effective and equal participation of persons \nbelonging to national or ethnic, religious and linguistic minorities; \n \n7. \nCalls upon States to undertake effective efforts to prevent and combat acts \nof violence specifically targeting persons belonging to national or ethnic, religious \nand linguistic minorities; \n \n8. \nAlso calls upon States to take all appropriate measures to ensure the \nprotection of children who belong to national or ethnic, religious and linguistic \nminorities and who are at risk of becoming or have become stateless, in accordance \nwith the relevant obligations under the Convention on the Rights of the Child;9 \n \n9. \nFurther calls upon States to take all appropriate measures to ensure the \nprotection of women and girls who belong to national or ethnic, religious and \nlinguistic minorities and are exposed to discrimination on the grounds of being \nstateless, and also to give special attention to the specific needs of older persons and \npersons with disabilities who belong to national or ethnic, religious and linguistic \nminorities and who are stateless; \n__________________ \n \n7  Resolution 47/135, annex. \n \n8  See A/CONF.189/12 and A/CONF.189/12/Corr.1, chap. I. \n \n9  United Nations, Treaty Series, vol. 1577, No. 27531. \n\nA/RES/74/165 \nEffective promotion of the Declaration on the Rights of Persons Belonging \nto National or Ethnic, Religious and Linguistic Minorities\n \n19-22293\n4/6 \n \n \n10. Recommends that States and other relevant actors ensure to the fullest \nextent possible that the Declaration is translated into all minority languages and \ndisseminated widely; \n \n11. Expresses its appreciation for the successful completion, in November \n2018, of the eleventh session of the Forum on Minority Issues, on the theme \n\u201cStatelessness: a minority issue\u201d, which, through the widespread participation of \nstakeholders, provided an important platform for the promotion of dialogue on this \ntopic and, as part of its outcome, produced recommendations to highlight the need for \nStates to prevent and reduce statelessness by promoting the human rights of persons \nbelonging to national or ethnic, religious and linguistic minorities and to stress the \nimportance of inclusion of stateless persons belonging to national or ethnic, religious \nand linguistic minorities and their representatives in policy and decision-making \nprocesses affecting them, 10  and encourages States to take into consideration the \nrelevant recommendations of the Forum; \n \n12. Calls upon States, while bearing in mind the theme of the eleventh session \nof the Forum on Minority Issues and with a view to enhancing the implementation of \nthe Declaration and ensuring the realization of the rights of persons belonging to \nnational or ethnic, religious and linguistic minorities, to take appropriate measures \nby, inter alia: \n \n(a) \nReviewing any legislation, policy or practice that has a discriminatory or \ndisproportionately negative effect on persons belonging to national or ethnic, \nreligious and linguistic minorities and that may render them vulnerable, with a view \nto considering its amendment; \n \n(b) \nConsidering ratifying, acceding to and adhering to all relevant \ninternational instruments that protect and promote the rights of persons belonging to \nnational or ethnic, religious and linguistic minorities and those aiming to eliminate \nstatelessness; \n \n(c) \nRefraining from arbitrary and discriminatory denial or deprivation of \nnationality of persons belonging to national or ethnic, religious and linguistic \nminorities; \n \n(d) \nEnsuring that human rights protection is provided to stateless persons \nbelonging to national or ethnic, religious and linguistic minorities, as human rights \nare universal and apply to everyone; \n \n(e) \nEnsuring that birth registration, civil registration and national \nidentification documents are provided without discrimination on any ground, in \nparticular race, ethnicity, religion and language, in line with the 2030 Agenda for \nSustainable Development,5 especially the target aimed at providing a legal identity \nfor all; \n \n(f) \nEnsuring that stateless persons belonging to national or ethnic, religious \nand linguistic minorities have access to justice and remedy for human rights violations \nand that these persons can appeal to relevant judicial and administrative bodies in \ncase of denial or deprivation of nationality; \n \n(g) \nEnsuring full compliance with the Convention on the Rights of the Child, \nin particular articles 7 and 8 thereof, and considering removing all their reservations \nto them; \n__________________ \n \n10  A/HRC/40/71. \n\nEffective promotion of the Declaration on the Rights of Persons Belonging \nto National or Ethnic, Religious and Linguistic Minorities \nA/RES/74/165\n \n5/6\n19-22293 \n \n \n(h) \nEnsuring that women enjoy equal rights with men to acquire, change or \nretain their nationality, as well as equal rights with men to confer their nationality \nupon their children; \n \n13. Takes note of the report of the Secretary-General on the effective \npromotion of the Declaration 11 and the reports of the Special Rapporteur of the \nHuman Rights Council on minority issues and their special focus on statelessness as \nan issue affecting persons belonging to national or ethnic, religious and linguistic \nminorities;12 \n \n14. Commends the Special Rapporteur for the work that has been done and the \nimportant role played in raising the level of awareness of and in giving added \nvisibility to the rights of persons belonging to national or ethnic, religious and \nlinguistic minorities; \n \n15. Calls upon all States to cooperate with and assist the Special Rapporteur \nin the performance of the tasks and duties mandated to him, to provide him with all \nthe necessary information requested and to seriously consider responding promptly \nand favourably to the requests of the Special Rapporteur to visit their countries in \norder to enable him to fulfil his duties effectively; \n \n16. Encourages the specialized agencies, regional organizations, national \nhuman rights institutions and non-governmental organizations to develop regular \ndialogue and cooperation with the Special Rapporteur, as well as to continue to \ncontribute to the promotion and protection of the rights of persons belonging to \nnational or ethnic, religious and linguistic minorities; \n \n17. Calls upon the United Nations High Commissioner for Human Rights to \ncontinue to promote, within her mandate, the implementation of the Declaration, and \nto engage in a dialogue with Governments for that purpose and regularly update and \ndisseminate widely the United Nations Guide for Minorities; \n \n18. Welcomes the inter-agency cooperation among United Nations agencies, \nfunds and programmes on minority issues, led by the Office of the United Nations \nHigh Commissioner for Human Rights, and urges them to further increase their \ncoordination and cooperation by, inter alia, developing policies on the promotion and \nprotection of the rights of persons belonging to minorities, drawing also on relevant \noutcomes of the Forum on Minority Issues and taking into account the work of \nrelevant regional organizations; \n \n19. Calls upon the Secretary-General to make available, at the request of \nGovernments concerned, qualified expertise on minority issues, including in the \ncontext of the prevention of and efforts to combat statelessness, to assist in resolving \nexisting or potential situations involving minorities; \n \n20. Invites the human rights treaty bodies, as well as special procedures of the \nHuman Rights Council, to continue to give attention, within their respective \nmandates, to situations and rights of persons belonging to national or ethnic, religious \nand linguistic minorities and in this regard to take into consideration relevant \nrecommendations of the Forum on Minority Issues; \n \n21. Invites the United Nations mechanisms and bodies, the specialized \nagencies and regional organizations, within their respective mandates, to continue to \ncontribute to the protection and the prevention of violations of the rights of persons \nbelonging to national or ethnic, religious and linguistic minorities, including by \n__________________ \n \n11  A/74/215. \n \n12  A/73/205 and A/74/160. \n\nA/RES/74/165 \nEffective promotion of the Declaration on the Rights of Persons Belonging \nto National or Ethnic, Religious and Linguistic Minorities\n \n19-22293\n6/6 \n \nstrengthening cooperation in respect of information-gathering and improving the \ninformation flow between themselves and with States; \n \n22. Encourages regional intergovernmental bodies, within their respective \nregions, to promote greater attention to the rights of persons belonging to national or \nethnic, religious and linguistic minorities by, inter alia, actively raising awareness of \nand promoting the Declaration in their work, encouraging its implementation at the \nnational level and considering the creation of thematic and/or special mechanisms on \nthis issue; \n \n23. Encourages national human rights institutions to pay due attention to the \nrights of persons belonging to national or ethnic, religious and linguistic minorities, \nincluding by monitoring situations of potential threats for persons belonging to \nnational or ethnic, religious and linguistic minorities, and by investigating and \nreporting, in accordance with the principles relating to the status of national \ninstitutions for the promotion and protection of human rights (the Paris Principles) 13 \nand their respective mandates, episodes of targeted violence against persons \nbelonging to minorities, including, when necessary, to regional and international \nbodies; \n \n24. Encourages civil society, including non-governmental organizations, to \npromote awareness of the Declaration and to review the extent to which it integrates \nthe rights of persons belonging to national or ethnic, religious and linguistic \nminorities and the Declaration into its work, as well as to inform persons belonging \nto national or ethnic, religious and linguistic minorities about their rights; \n \n25. Requests the Special Rapporteur to report annually to the General \nAssembly and include recommendations for effective strategies for the better \nimplementation of the rights of persons belonging to national or ethnic, religious and \nlinguistic minorities; \n \n26. Invites the Office of the High Commissioner, United Nations entities and \nMember States to support and collaborate in the organization of regional forums on \nminority issues initiated by the Special Rapporteur in accordance with his mandate, \nin order to complement and enrich the work and recommendations of the Forum on \nMinority Issues; \n \n27. Requests the Secretary-General to submit to the General Assembly at its \nseventy-sixth session a report on the implementation of the present resolution, \nincluding information on activities undertaken by Member States, the Office of the \nHigh Commissioner, the Special Rapporteur, relevant United Nations entities and \nother relevant stakeholders to enhance the implementation of the Declaration and to \nensure the realization of the rights of persons belonging to national or ethnic, religious \nand linguistic minorities; \n \n28. Decides to continue consideration of the question at its seventy-sixth \nsession under the item entitled \u201cPromotion and protection of human rights\u201d. \n \n50th plenary meeting \n18 December 2019 \n \n__________________ \n \n13  Resolution 48/134, annex. \n",
  "paragraphs": {
    "1": "Reaffirms the obligation of States to ensure that persons belonging to national or ethnic, religious and linguistic minorities may exercise fully and effectively all human rights and fundamental freedoms without any discrimination and in full equality before the law, as proclaimed in the Declaration on the Rights of __________________ 5 Resolution 70/1. 6 Resolution 69/313, annex. Effective promotion of the Declaration on the Rights of Persons Belonging to National or Ethnic, Religious and Linguistic Minorities A/RES/74/165 3/6 19-22293 Persons Belonging to National or Ethnic, Religious and Linguistic Minorities, 7 and draws attention to the relevant provisions of the Durban Declaration and Programme of Action,8 including the provisions on forms of multiple discrimination;",
    "2": "Urges States and the international community to promote and protect the rights of persons belonging to national or ethnic, religious and linguistic minorities, as set out in the Declaration on the Rights of Persons Belonging to National or Ethnic, Religious and Linguistic Minorities, including through the encouragement of conditions for the promotion of their identity, the provision of adequate education and the facilitation of their participation in all aspects of the political, economic, social, religious and cultural life of society and in the economic progress and development of their country, without discrimination, and to apply a gender perspective while doing so;",
    "3": "Encourages States to take appropriate measures so that, wherever possible, persons belonging to national or ethnic, religious and linguistic minorities may have adequate opportunities to learn their own language or to have instruction in their own language;",
    "4": "Urges States to take all appropriate measures, inter alia, constitutional, legislative, administrative and other measures, for the promotion and implementation of the Declaration, and appeals to States to cooperate bilaterally and multilaterally, in particular on the exchange of best practices and lessons learned, in accordance with the Declaration, in order to promote and protect the rights of persons belonging to national or ethnic, religious and linguistic minorities;",
    "5": "Recommends that States continue to reflect on current and emerging challenges facing persons belonging to national or ethnic, religious and linguistic minorities, including the rise in persecution on religious and ethnic grounds and increasing levels of hate crimes and hate speech targeting, among others, persons belonging to national or ethnic, religious and linguistic minorities;",
    "6": "Also recommends that States ensure that all measures taken with a view to implementing the Declaration are, to the fullest extent possible, developed, designed, implemented and reviewed with the full, effective and equal participation of persons belonging to national or ethnic, religious and linguistic minorities;",
    "7": "Calls upon States to undertake effective efforts to prevent and combat acts of violence specifically targeting persons belonging to national or ethnic, religious and linguistic minorities;",
    "8": "Also calls upon States to take all appropriate measures to ensure the protection of children who belong to national or ethnic, religious and linguistic minorities and who are at risk of becoming or have become stateless, in accordance with the relevant obligations under the Convention on the Rights of the Child;9",
    "9": "Further calls upon States to take all appropriate measures to ensure the protection of women and girls who belong to national or ethnic, religious and linguistic minorities and are exposed to discrimination on the grounds of being stateless, and also to give special attention to the specific needs of older persons and persons with disabilities who belong to national or ethnic, religious and linguistic minorities and who are stateless; __________________ 7 Resolution 47/135, annex. 8 See A/CONF.189/12 and A/CONF.189/12/Corr.1, chap. I. 9 United Nations, Treaty Series, vol. 1577, No. 27531. A/RES/74/165 Effective promotion of the Declaration on the Rights of Persons Belonging to National or Ethnic, Religious and Linguistic Minorities 19-22293 4/6",
    "10": "Recommends that States and other relevant actors ensure to the fullest extent possible that the Declaration is translated into all minority languages and disseminated widely;",
    "11": "Expresses its appreciation for the successful completion, in November 2018, of the eleventh session of the Forum on Minority Issues, on the theme \u201cStatelessness: a minority issue\u201d, which, through the widespread participation of stakeholders, provided an important platform for the promotion of dialogue on this topic and, as part of its outcome, produced recommendations to highlight the need for States to prevent and reduce statelessness by promoting the human rights of persons belonging to national or ethnic, religious and linguistic minorities and to stress the importance of inclusion of stateless persons belonging to national or ethnic, religious and linguistic minorities and their representatives in policy and decision-making processes affecting them, 10 and encourages States to take into consideration the relevant recommendations of the Forum;",
    "12": "Calls upon States, while bearing in mind the theme of the eleventh session of the Forum on Minority Issues and with a view to enhancing the implementation of the Declaration and ensuring the realization of the rights of persons belonging to national or ethnic, religious and linguistic minorities, to take appropriate measures by, inter alia: (a) Reviewing any legislation, policy or practice that has a discriminatory or disproportionately negative effect on persons belonging to national or ethnic, religious and linguistic minorities and that may render them vulnerable, with a view to considering its amendment; (b) Considering ratifying, acceding to and adhering to all relevant international instruments that protect and promote the rights of persons belonging to national or ethnic, religious and linguistic minorities and those aiming to eliminate statelessness; (c) Refraining from arbitrary and discriminatory denial or deprivation of nationality of persons belonging to national or ethnic, religious and linguistic minorities; (d) Ensuring that human rights protection is provided to stateless persons belonging to national or ethnic, religious and linguistic minorities, as human rights are universal and apply to everyone; (e) Ensuring that birth registration, civil registration and national identification documents are provided without discrimination on any ground, in particular race, ethnicity, religion and language, in line with the 2030 Agenda for Sustainable Development,5 especially the target aimed at providing a legal identity for all; (f) Ensuring that stateless persons belonging to national or ethnic, religious and linguistic minorities have access to justice and remedy for human rights violations and that these persons can appeal to relevant judicial and administrative bodies in case of denial or deprivation of nationality; (g) Ensuring full compliance with the Convention on the Rights of the Child, in particular articles 7 and 8 thereof, and considering removing all their reservations to them; __________________ 10 A/HRC/40/71. Effective promotion of the Declaration on the Rights of Persons Belonging to National or Ethnic, Religious and Linguistic Minorities A/RES/74/165 5/6 19-22293 (h) Ensuring that women enjoy equal rights with men to acquire, change or retain their nationality, as well as equal rights with men to confer their nationality upon their children;",
    "13": "Takes note of the report of the Secretary-General on the effective promotion of the Declaration 11 and the reports of the Special Rapporteur of the Human Rights Council on minority issues and their special focus on statelessness as an issue affecting persons belonging to national or ethnic, religious and linguistic minorities;12",
    "14": "Commends the Special Rapporteur for the work that has been done and the important role played in raising the level of awareness of and in giving added visibility to the rights of persons belonging to national or ethnic, religious and linguistic minorities;",
    "15": "Calls upon all States to cooperate with and assist the Special Rapporteur in the performance of the tasks and duties mandated to him, to provide him with all the necessary information requested and to seriously consider responding promptly and favourably to the requests of the Special Rapporteur to visit their countries in order to enable him to fulfil his duties effectively;",
    "16": "Encourages the specialized agencies, regional organizations, national human rights institutions and non-governmental organizations to develop regular dialogue and cooperation with the Special Rapporteur, as well as to continue to contribute to the promotion and protection of the rights of persons belonging to national or ethnic, religious and linguistic minorities;",
    "17": "Calls upon the United Nations High Commissioner for Human Rights to continue to promote, within her mandate, the implementation of the Declaration, and to engage in a dialogue with Governments for that purpose and regularly update and disseminate widely the United Nations Guide for Minorities;",
    "18": "Welcomes the inter-agency cooperation among United Nations agencies, funds and programmes on minority issues, led by the Office of the United Nations High Commissioner for Human Rights, and urges them to further increase their coordination and cooperation by, inter alia, developing policies on the promotion and protection of the rights of persons belonging to minorities, drawing also on relevant outcomes of the Forum on Minority Issues and taking into account the work of relevant regional organizations;",
    "19": "Calls upon the Secretary-General to make available, at the request of Governments concerned, qualified expertise on minority issues, including in the context of the prevention of and efforts to combat statelessness, to assist in resolving existing or potential situations involving minorities;",
    "20": "Invites the human rights treaty bodies, as well as special procedures of the Human Rights Council, to continue to give attention, within their respective mandates, to situations and rights of persons belonging to national or ethnic, religious and linguistic minorities and in this regard to take into consideration relevant recommendations of the Forum on Minority Issues;",
    "21": "Invites the United Nations mechanisms and bodies, the specialized agencies and regional organizations, within their respective mandates, to continue to contribute to the protection and the prevention of violations of the rights of persons belonging to national or ethnic, religious and linguistic minorities, including by __________________ 11 A/74/215. 12 A/73/205 and A/74/160. A/RES/74/165 Effective promotion of the Declaration on the Rights of Persons Belonging to National or Ethnic, Religious and Linguistic Minorities 19-22293 6/6 strengthening cooperation in respect of information-gathering and improving the information flow between themselves and with States;",
    "22": "Encourages regional intergovernmental bodies, within their respective regions, to promote greater attention to the rights of persons belonging to national or ethnic, religious and linguistic minorities by, inter alia, actively raising awareness of and promoting the Declaration in their work, encouraging its implementation at the national level and considering the creation of thematic and/or special mechanisms on this issue;",
    "23": "Encourages national human rights institutions to pay due attention to the rights of persons belonging to national or ethnic, religious and linguistic minorities, including by monitoring situations of potential threats for persons belonging to national or ethnic, religious and linguistic minorities, and by investigating and reporting, in accordance with the principles relating to the status of national institutions for the promotion and protection of human rights (the Paris Principles) 13 and their respective mandates, episodes of targeted violence against persons belonging to minorities, including, when necessary, to regional and international bodies;",
    "24": "Encourages civil society, including non-governmental organizations, to promote awareness of the Declaration and to review the extent to which it integrates the rights of persons belonging to national or ethnic, religious and linguistic minorities and the Declaration into its work, as well as to inform persons belonging to national or ethnic, religious and linguistic minorities about their rights;",
    "25": "Requests the Special Rapporteur to report annually to the General Assembly and include recommendations for effective strategies for the better implementation of the rights of persons belonging to national or ethnic, religious and linguistic minorities;",
    "26": "Invites the Office of the High Commissioner, United Nations entities and Member States to support and collaborate in the organization of regional forums on minority issues initiated by the Special Rapporteur in accordance with his mandate, in order to complement and enrich the work and recommendations of the Forum on Minority Issues;",
    "27": "Requests the Secretary-General to submit to the General Assembly at its seventy-sixth session a report on the implementation of the present resolution, including information on activities undertaken by Member States, the Office of the High Commissioner, the Special Rapporteur, relevant United Nations entities and other relevant stakeholders to enhance the implementation of the Declaration and to ensure the realization of the rights of persons belonging to national or ethnic, religious and linguistic minorities;",
    "28": "Decides to continue consideration of the question at its seventy-sixth session under the item entitled \u201cPromotion and protection of human rights\u201d. 50th plenary meeting 18 December 2019 __________________ 13 Resolution 48/134, annex."
  },
  "agenda_items": [
    "Item 70"
  ],
  "symbol_references": []
}