{
  "symbol": "A/RES/74/131",
  "filename": "A_RES_74_131.pdf",
  "title": "74/131. Assistance to refugees, returnees and displaced persons in Africa",
  "text": "United Nations \nA/RES/74/131\n \n \nGeneral Assembly \nDistr.: General \n16 January 2020 \n \n19-22226 (E)    200120 \n*1922226* \n \n \nSeventy-fourth session \nAgenda item 61 \nReport of the United Nations High Commissioner for \nRefugees, questions relating to refugees, returnees and \ndisplaced persons and humanitarian questions \n \n \n \n \n Resolution adopted by the General Assembly \non 18 December 2019 \n \n \n \n \n[on the report of the Third Committee (A/74/393)] \n \n \n 74/131. Assistance to refugees, returnees and displaced persons in Africa \n \n \n \nThe General Assembly, \n \nRecalling the Organization of African Unity Convention governing the specific \naspects of refugee problems in Africa of 19691 and the African Charter on Human and \nPeoples\u2019 Rights,2 \n \nReaffirming that the 1951 Convention relating to the Status of Refugees, 3 \ntogether with the 1967 Protocol thereto,4 as complemented by the Organization of \nAfrican Unity Convention of 1969, remains the foundation of the international \nrefugee protection regime in Africa,  \n \nWelcoming the entry into force on 6 December 2012 and the ongoing process of \nratification of the African Union Convention for the Protection and Assistance of \nInternally Displaced Persons in Africa, which marks a significant step towards \nstrengthening the national and regional normative frameworks for the protection of \nand assistance to internally displaced persons,  \n \nWelcoming the decision of the African Union to declare 2019 as the African Year \nof Refugees, Returnees and Internally Displaced Persons: Towards Durable Solutions \nto Forced Displacement in Africa,  \n \nRecognizing the particular vulnerability of women and children, as well as older \npersons and persons with disabilities, among refugees and displaced persons, \nincluding exposure to discrimination, sexual exploitation and abuse, physical abuse, \n__________________ \n \n1  United Nations, Treaty Series, vol. 1001, No. 14691. \n \n2  Ibid., vol. 1520, No. 26363. \n \n3  Ibid., vol. 189, No. 2545. \n \n4  Ibid., vol. 606, No. 8791. \n\nA/RES/74/131 \nAssistance to refugees, returnees and displaced persons in Africa\n \n19-22226\n2/10 \n \nviolence and exploitation and the recruitment and use of children by parties to armed \nconflict in violation of applicable international law, and in this regard acknowledging \nthe importance of preventing, responding to and addressing sexual and gender-based \nviolence as well as violations and abuses committed against refugee, returnee and \ndisplaced children,  \n \nGravely concerned about the continued rising number of refugees and displaced \npersons in various parts of the continent,  \n \nAcknowledging the efforts of Member States, the United Nations High \nCommissioner for Refugees and other stakeholders in improving the situation of \nrefugees and their host communities,  \n \nExpressing grave concern about funding gaps in the budgets of the Office of the \nUnited Nations High Commissioner for Refugees and the World Food Programme, \nwhich are among the most underfunded, in responding to various refugee situations \nin different parts of Africa, which are a major factor leading to the deterioration in \nliving conditions in many refugee camps in Africa,  \n \nEmphasizing the need to develop a holistic approach in addressing large \nmovements of population that takes into account the underlying causes of displacement,  \n \nRecognizing that refugees, internally displaced persons and, in particular, \nwomen and children are at an increased risk of exposure to HIV and AIDS, malaria \nand other diseases,  \n \nRecalling the high-level segment on the theme \u201cEnhancing international \ncooperation, solidarity, local capacities and humanitarian action for refugees in Africa\u201d \nof the sixty-fifth session of the Executive Committee of the Programme of the United \nNations High Commissioner for Refugees, held in Geneva from 29 September to \n3 October 2014, and the statement adopted on 30 September 2014 by States members \nof the Executive Committee,5 and expressing deep concern that this particular event \nhas not mobilized the necessary support for refugees and their hosting countries and \ncommunities,  \n \nWelcoming progress made in the implementation of the Nairobi Declaration on \nDurable Solutions for Somali Refugees and the Reintegration of Returnees in Somalia, \nwelcoming also the nomination of the Special Envoy of the United Nations High \nCommissioner for Refugees for the Horn of Africa, the adoption of the Djibouti \ndeclaration on refugee education in December 2017 and the Kampala Declaration on \nJobs, Livelihoods and Self-Reliance for Refugees, Returnees and Host Communities in \nthe Intergovernmental Authority on Development Region, adopted on 28 March 2019, \nand welcoming further the reaffirmation by Member States of the commitment to \npromote inclusive policies towards refugees, as noted in the communiqu\u00e9 of the second \ninterministerial stocktaking meeting on the Nairobi Declaration and Action Plan,  \n \nRecalling the Pact on Security, Stability and Development in the Great Lakes \nRegion, adopted by the International Conference on the Great Lakes Region in 2006, \nand its instruments, in particular two of the protocols to the Pact that are relevant to \nthe protection of displaced persons, namely, the Protocol on the Protection of and \nAssistance to Internally Displaced Persons and the Protocol on the Property Rights of \nReturning Persons,  \n \nAcknowledging with appreciation the generosity, hospitality and spirit of \nsolidarity of African States, including host communities, that, despite their limited \nresources, continue to host a large number of refugees, owing to humanitarian crises \n__________________ \n \n5  Official Records of the General Assembly, Sixty-ninth Session, Supplement No. 12A \n(A/69/12/Add.1), annex I. \n\nAssistance to refugees, returnees and displaced persons in Africa \nA/RES/74/131\n \n3/10\n19-22226 \n \nand protracted refugee situations, and in this regard expressing particular appreciation \nfor the commitment and efforts of neighbouring countries in the recent humanitarian \ncrises on the continent,  \n \nWelcoming efforts by African States that endeavour to facilitate the voluntary \nrepatriation, local integration, resettlement and rehabilitation of refugees and to \npromote conditions conducive to the voluntary return and sustainable reintegration of \nrefugees in their country of origin, acknowledging with appreciation the coordination \nof humanitarian assistance by the United Nations as well as the continuing efforts of \ndonors, the United Nations system, including the Office of the High Commissioner, \nregional organizations, international agencies, non-governmental organizations and \nother partners,  \n \nWelcoming also efforts made with regard to durable solutions for addressing the \nplight of refugees during emergencies, and recalling that those solutions include \nvoluntary repatriation and, where appropriate and feasible, local integration and \nresettlement in a third country, while reaffirming that voluntary repatriation, \nsupported, as necessary, by rehabilitation and development assistance to facilitate \nsustainable reintegration, remains the preferred solution,  \n \nRecognizing that host States have the primary responsibility for the protection \nof and assistance to refugees on their territory, recognizing also the need to redouble \nefforts to develop and implement comprehensive durable solution strategies, in \nappropriate cooperation with the international community and with regard to burden- \nand responsibility-sharing, and recognizing further the efforts of all States in this \nregard,  \n \nEmphasizing that States have the primary responsibility to provide protection \nand assistance to internally displaced persons within their jurisdiction, as well as to \naddress the root causes of the displacement problem, in appropriate cooperation with \nthe international community,  \n \nExpressing concern regarding the decreasing trend in resettlement opportunities, \nand recognizing the need to expand resettlement opportunities,  \n \nRecognizing the need to encourage increased efforts to facilitate and assist \nvoluntary return and local integration,  \n \nWelcoming the ongoing implementation of pledges made by States at the \nintergovernmental ministerial event held in 2011 to mark the sixtieth anniversary of \nthe 1951 Convention relating to the Status of Refugees and the fiftieth anniversary of \nthe 1961 Convention on the Reduction of Statelessness, 6 \n \nAcknowledging the efforts made by States and regional groups since the launch \nof the #IBelong campaign to eradicate statelessness and to afford protection to \nstateless people, as well as the commitments made during the high-level segment on \nstatelessness convened by the Office of the High Commissioner, as well as the \noutcomes of the fifth Conference of African Ministers Responsible for Civil \nRegistration, both held in October 2019,  \n \nReaffirming its resolution 69/313 of 27 July 2015 on the Addis Ababa Action \nAgenda of the Third International Conference on Financing for Development, which \nis an integral part of the 2030 Agenda for Sustainable Development, 7 supports and \ncomplements it, helps to contextualize its means of implementation targets with \nconcrete policies and actions, and reaffirms the strong political commitment to \n__________________ \n \n6  United Nations, Treaty Series, vol. 989, No. 14458. \n \n7  Resolution 70/1. \n\nA/RES/74/131 \nAssistance to refugees, returnees and displaced persons in Africa\n \n19-22226\n4/10 \n \naddress the challenges of financing and creating an enabling environment at all levels \nfor sustainable development in the spirit of global partnership and solidarity,  \n \nTaking note of the World Humanitarian Summit, held in Istanbul, Turkey, on \n23 and 24 May 2016, while recognizing that it did not have an intergovernmentally \nagreed outcome, and welcoming the commitment of the African Heads of State and \nGovernment, adopted by the African Union, on the theme \u201cOne Africa, One Voice, \nOne Message at the World Humanitarian Summit\u201d,  \n \n1. \nTakes note of the reports of the Secretary-General8 and the United Nations \nHigh Commissioner for Refugees;9 \n \n2. \nCalls upon African States that have not yet signed or ratified the African \nUnion Convention for the Protection and Assistance of Internally Displaced Persons \nin Africa to consider doing so as early as possible in order to ensure its wider \nimplementation;  \n \n3. \nNotes the need for African States, with the support and collaboration of \nthe international community, to resolutely address the root causes of all forms of \nforced displacement in Africa and to foster peace, stability and prosperity throughout \nthe African continent;  \n \n4. \nRecalls the global compact on refugees as set out in the High \nCommissioner\u2019s annual report (part II) of 2018,10 affirmed on 17 December 2018,11 \nand calls upon the international community as a whole, including States and other \nrelevant stakeholders, to implement the compact in order to achieve its four objectives \non an equal footing based on the principle of burden- and responsibility-sharing, and \nin accordance with the guiding principles and paragraph 4 of the global compact on \nrefugees, through concrete actions, pledges and contributions, including at the first \nGlobal Refugee Forum in December 2019, and requests the High Commissioner to \nreport regularly on the progress being made;  \n \n5. \nWelcomes the important outcomes of the six continental consultative \nmeetings that were organized under the 2019 theme of the African Union, \u201cYear of \nrefugees, returnees and internally displaced persons: towards durable solutions to \nforced displacement in Africa\u201d, with regard to global responsibility-sharing, the role of \nparliamentarians in preventing and resolving forced displacement, statelessness, the \nmixed movements of refugees and migrants, and the ratification and implementation of \nthe Organization of African Unity Convention governing the specific aspects of refugee \nproblems in Africa of 19691 and the African Union Convention for the Protection and \nAssistance of Internally Displaced Persons in Africa (Kampala Convention) of 2009;  \n \n6. \nReaffirms the central role played by the Heads of State and Government \nof the Intergovernmental Authority on Development towards the successful \nnegotiations in Khartoum and the eventual signing of the final Revitalized Agreement \non the Resolution of the Conflict in South Sudan between the Government and the \nopposition movements during the thirty-third extraordinary summit, held in Addis \nAbaba on 12 September 2018, and encourages ongoing efforts to fully implement this \nagreement in order to achieve a sustainable and lasting peace;  \n \n7. \nCommends the continued efforts and commitment by the regional \nGovernments towards resolving conflicts in the region, including the ongoing \nmediation by the Sudan between the parties to the conflict in the Central African \n__________________ \n \n8  A/74/322. \n \n9  Official Records of the General Assembly, Seventy-fourth Session, Supplement No. 12 (A/74/12). \n \n10  See A/73/12 (Part II). \n \n11  See resolution 73/151. \n\nAssistance to refugees, returnees and displaced persons in Africa \nA/RES/74/131\n \n5/10\n19-22226 \n \nRepublic under the umbrella of the African Initiative for Peace and Reconciliation in \nthe Central African Republic;  \n \n8. \nWelcomes the outcome of the second regional protection dialogue on the \nLake Chad basin, held in Nigeria in January 2019, as well as the signing of the Abuja \nAction Statement by the Governments of Cameroon, Chad, the Niger and Nigeria, \nwith a view to enhancing the response to the urgent needs of refugees, internally \ndisplaced persons, returnees and host communities;  \n \n9. \nAlso welcomes the regional dialogue on protection and solutions related to \nthe situation of forced displacement in the Sahel, held in Bamako on 11 and \n12 September 2019, hosted by the Government of Mali, with the participation of \ngovernment officials from Burkina Faso, Chad, Mauritania and the Niger, and further \nwelcomes the outcome of the dialogue, namely, the Bamako conclusions and \nministerial declaration adopted in Geneva on 9 October 2019;  \n \n10. Notes with great concern that, despite all the efforts made so far by the \nUnited Nations, the African Union and others, the situation of refugees and displaced \npersons in Africa remains precarious and the number of refugees and internally \ndisplaced persons has dramatically increased, and calls upon States and other parties \nto armed conflict to observe scrupulously the letter and spirit of, and respect and \nensure respect for, international humanitarian law, bearing in mind that armed conflict \nis one of the principal causes of forced displacement in Africa;  \n \n11. \nWelcomes decision Assembly/AU/Decl. 8 (XXXII), adopted by the Assembly \nof Heads of State and Government of the African Union at its thirty-second ordinary \nsession, held in Addis Ababa on 10 and 11 February 2019, in which the 2019 theme \nof the African Union was declared to be the \u201cYear of refugees, returnees and internally \ndisplaced persons: towards durable solutions to forced displacement in Africa\u201d;  \n \n12. Expresses its appreciation for the leadership shown by the Office of the \nUnited Nations High Commissioner for Refugees, and commends the Office for its \nongoing efforts, with the support of the international community, to assist African \nStates hosting large numbers of refugees, including by providing support to \nvulnerable local host communities, and to respond to the protection and assistance \nneeds of refugees, returnees and displaced persons in Africa;  \n \n13. Notes with appreciation the ongoing initiatives taken by the African \nUnion, the Subcommittee on Refugees, Returnees and Internally Displaced Persons \nof its Permanent Representatives Committee and the African Commission on Human \nand Peoples\u2019 Rights, in particular the role of its Special Rapporteur on Refugees, \nAsylum Seekers, Migrants and Internally Displaced Persons in Africa, to ensure the \nprotection of and assistance to refugees, returnees and displaced persons in Africa;  \n \n14. Underlines the need to provide an efficient humanitarian response to \ninternally displaced persons, and recognizes in this regard the importance of the \nAfrican Union Convention for the Protection and Assistance of Internally Displaced \nPersons in Africa;  \n \n15. Acknowledges the important contribution of age, gender and diversity \nmainstreaming in identifying, through the full participation of women, children, older \npersons and persons with disabilities, the protection risks faced by the different \nmembers of the refugee communities, in particular the non-discriminatory treatment \nand protection of women, children, older persons and persons with disabilities;  \n \n16. Affirms that children, because of their age, social status and physical and \nmental development, are often more vulnerable than adults in situations of forced \ndisplacement, recognizes that forced displacement, return to post-conflict situations, \nintegration into new societies, protracted situations of displacement and statelessness \ncan increase child protection risks, taking into account the particular vulnerability of \n\nA/RES/74/131 \nAssistance to refugees, returnees and displaced persons in Africa\n \n19-22226\n6/10 \n \ndisplaced children to forcible exposure to the risks of physical and psychological \ninjury, exploitation and death in connection with armed conflict, as well as the \nrecruitment and use of children by parties to armed conflict in violation of applicable \ninternational law, and acknowledges that wider environmental factors and individual \nrisk factors, particularly when combined, may generate different protection needs;  \n \n17. Recognizes that no solution to forced displacement can be durable unless \nit is sustainable, and therefore encourages the Office of the High Commissioner to \nsupport the sustainability of durable solutions, and recalls that those solutions include \nvoluntary repatriation and, where appropriate and feasible, local integration and \nresettlement in a third country, while reaffirming that voluntary repatriation, \nsupported, as necessary, by rehabilitation and development assistance to facilitate \nsustainable reintegration, remains the preferred solution;  \n \n18. Reaffirms the conclusion on civil registration adopted by the Executive \nCommittee of the Programme of the United Nations High Commissioner for Refugees \nat its sixty-fourth session, held in Geneva from 30 September to 4 October 2013, 12 \nand recognizes the importance of early registration and effective registration systems \nand censuses as a tool of protection and as a means to the quantification and \nassessment of needs for the provision and distribution of humanitarian assistance and \nto implement appropriate durable solutions;  \n \n19. Also reaffirms the conclusion on registration of refugees and asylum \nseekers adopted by the Executive Committee of the Programme of the High \nCommissioner at its fifty-second session,13 notes the many forms of harassment faced \nby refugees and asylum seekers who remain without any form of documentation \nattesting to their status, recalls the responsibility of States to register refugees on their \nterritories and, as appropriate, the responsibility of the Office of the High \nCommissioner or mandated international bodies to do so, reiterates in this context the \ncentral role that early and effective registration and documentation can play, guided \nby protection considerations, in enhancing protection and supporting efforts to find \ndurable solutions, and calls upon the Office, as appropriate, to help States to conduct \nthis procedure should they be unable to register refugees on their territory;  \n \n20. Appreciates the ongoing efforts undertaken by Member States to \nimplement the conclusion on machine-readable travel documents for refugees and \nstateless persons adopted by the Executive Committee at its sixty-eighth session;14 \n \n21. Calls upon the international community, including States and the Office of \nthe High Commissioner and other relevant United Nations organizations, within their \nrespective mandates, to take concrete action to meet the protection and assistance \nneeds of refugees, returnees and displaced persons and to contribute generously to \nprojects and programmes aimed at alleviating their plight, facilitating durable \nsolutions and supporting vulnerable local host communities;  \n \n22. Acknowledges the efforts made by the African countries applying the \ncomprehensive refugee response framework, and underscores the importance for the \ninternational community of ensuring adequate, timely and predictable support;  \n \n23. Reaffirms the importance of timely and adequate assistance and protection \nfor refugees, returnees and displaced persons, also reaffirms that assistance and \nprotection are mutually reinforcing and that inadequate material assistance and food \nshortages undermine protection, notes the importance of a rights- and community-\nbased approach in engaging constructively with individual refugees, returnees and \ndisplaced persons and their communities so as to achieve fair and equitable access to \n__________________ \n \n12  Official Records of the General Assembly, Sixty-eighth Session, Supplement No. 12A \n(A/68/12/Add.1), chap. III, sect. A. \n \n13  Ibid., Fifty-sixth Session, Supplement No. 12A (A/56/12/Add.1), chap. III, sect. B. \n \n14  Ibid., Seventy-second Session, Supplement No. 12A (A/72/12/Add.1), chap. III, sect. A. \n\nAssistance to refugees, returnees and displaced persons in Africa \nA/RES/74/131\n \n7/10\n19-22226 \n \nfood and other forms of material assistance, and expresses concern with regard to \nsituations in which minimum standards of assistance are not met, including those in \nwhich adequate needs assessments have yet to be undertaken;  \n \n24. Also reaffirms that respect by States for their protection responsibilities \ntowards refugees is strengthened by international solidarity involving all members of \nthe international community and that the refugee protection regime is enhanced \nthrough committed international cooperation in a spirit of solidarity and burden- and \nresponsibility-sharing among all States;  \n \n25. Further reaffirms that host States have the primary responsibility to ensure \nthe civilian and humanitarian character of asylum, calls upon States, in cooperation \nwith international organizations, within their mandates, to take all measures necessary \nto ensure respect for the principles of refugee protection and, in particular, to ensure \nthat the civilian and humanitarian nature of refugee camps is not compromised by the \npresence or the activities of armed elements or used for purposes that are incompatible \nwith their civilian character, and encourages the High Commissioner to continue \nefforts, in consultation with States and other relevant actors, to ensure the civilian and \nhumanitarian character of camps;  \n \n26. Condemns all acts that pose a threat to the personal security and well-being \nof refugees and asylum seekers, such as refoulement, unlawful expulsion and physical \nattacks, calls upon States of refuge, in cooperation with international organizations, \nwhere appropriate, to take all measures necessary to ensure respect for the principles \nof refugee protection, including the humane treatment of asylum seekers, notes with \ninterest that the High Commissioner has continued to take steps to encourage the \ndevelopment of measures to better ensure the civilian and humanitarian character of \nasylum, and encourages the High Commissioner to continue those efforts, in \nconsultation with States and other relevant actors;  \n \n27. Deplores the continuing violence and insecurity, which constitute an \nongoing threat to the safety and security of staff members of the Office of the High \nCommissioner and other humanitarian organizations and an obstacle to the effective \nfulfilment of the mandate of the Office and the ability of its implementing partners \nand other humanitarian personnel to discharge their respective humanitarian \nfunctions, urges States, parties to conflict and all other relevant actors to take all \nmeasures necessary to protect activities related to humanitarian assistance, prevent \nattacks on and kidnapping of national and international humanitarian workers and \nensure the safety and security of the personnel and property of the Office and that of \nall humanitarian organizations discharging functions mandated by the Office, and \ncalls upon States to investigate fully any crime committed against humanitarian \npersonnel and bring to justice the persons responsible for such crimes;  \n \n28. Calls upon the Office of the High Commissioner, the African Union, \nsubregional organizations and all African States, in conjunction with agencies of the \nUnited Nations system, intergovernmental and non-governmental organizations and \nthe international community, to strengthen and revitalize existing partnerships and \nforge new ones in support of the protection system for refugees, asylum seekers and \ninternally displaced persons, and encourages African States that have not yet done so \nto consider ratifying and enforcing the Convention on the Safety of United Nations \nand Associated Personnel;15 \n \n29. Calls upon the Office of the High Commissioner, the international \ncommunity, donors and other entities concerned to continue and, where appropriate, \nto intensify their support to African Governments through appropriate capacity-\nbuilding activities, including training of relevant officers, disseminating information \n__________________ \n \n15  United Nations, Treaty Series, vol. 2051, No. 35457. \n\nA/RES/74/131 \nAssistance to refugees, returnees and displaced persons in Africa\n \n19-22226\n8/10 \n \nabout refugee instruments and principles, providing financial, technical, legal and \nadvisory services to accelerate the enactment or amendment and implementation of \nlegislation relating to refugees, strengthening emergency response and enhancing \ncapacities for the coordination of humanitarian activities, in particular to those \nGovernments that have received large numbers of refugees and asylum seekers;  \n \n30. \nReaffirms the right of return, in accordance with international law, and the \nprinciple of voluntary repatriation, appeals to countries of origin and countries of \nasylum to create conditions that are conducive to voluntary repatriation, and recognizes \nthat, while voluntary repatriation remains the pre-eminent solution, local integration \nand third-country resettlement, where appropriate and feasible, are also viable options \nfor dealing with the situation of African refugees who, owing to prevailing \ncircumstances in their respective countries of origin, are unable to return home;  \n \n31. Also reaffirms that voluntary repatriation should not necessarily be \nconditioned on the accomplishment of political solutions in the country of origin in \norder not to impede the exercise of the refugees\u2019 right to return, recognizes that the \nvoluntary repatriation and reintegration process is normally guided by the conditions \nin the country of origin, in particular that voluntary repatriation can be accomplished \nin conditions of safety and dignity, urges the High Commissioner to promote \nsustainable return through the development of durable and lasting solutions, \nparticularly in protracted refugee situations, and encourages States and other relevant \nactors to continue to support these efforts through, inter alia, the allocation of funds;  \n \n32. Calls upon the international donor community to provide financial and \nmaterial assistance which allows for the implementation of community-based \ndevelopment programmes that benefit both refugees and host communities, as \nappropriate, in agreement with host countries and consistent with humanitarian \nobjectives;  \n \n33. Recognizes the increase in the number and scale of disasters, including \nthose related to the adverse effects of climate change, which in certain circumstances \nmay contribute to displacement and additional pressure on host communities, \nencourages the United Nations and all relevant actors to strengthen the efforts aimed \nat addressing the needs of persons displaced within the context of such disasters, and \nnotes in this regard the importance of sharing best practices to prevent and prepare \nfor such displacements;  \n \n34. Appeals to the international community to respond positively, in the spirit \nof solidarity and burden- and responsibility-sharing, to the third-country resettlement \nneeds of African refugees, notes in this regard the importance of using resettlement \nstrategically, as part of situation-specific comprehensive responses to refugee \nsituations, and to this end encourages States, the Office of the High Commissioner \nand other relevant partners to make full use of the Multilateral Framework of \nUnderstandings on Resettlement, where appropriate and feasible;  \n \n35. \nExpresses serious concern about the chronic underfunding for humanitarian \nassistance to refugees and internally displaced persons in Africa;  \n \n36. Calls upon the international donor community to provide assistance for \nmaterial, financial and technical support intended for the rehabilitation of the \nenvironment and infrastructure affected by refugees in countries of asylum as well as \ninternally displaced persons, where appropriate, and notes with concern the \nenvironmental degradation in these areas;  \n \n37. Urges the international community, in line with the principles of \ninternational solidarity and burden-sharing, to continue to fund generously the refugee \nprogrammes of the Office of the High Commissioner and other relevant humanitarian \norganizations and, taking into account the substantially increased needs of \nprogrammes in Africa, inter alia, as a result of repatriation possibilities, to ensure that \n\nAssistance to refugees, returnees and displaced persons in Africa \nA/RES/74/131\n \n9/10\n19-22226 \n \nAfrica receives a fair and equitable share of the resources designated for refugees, and \nrecognizes the importance of increased, flexible, predictable and multi-year funding;  \n \n38. Encourages the Office of the High Commissioner and interested States to \nidentify protracted refugee situations which might lend themselves to resolution \nthrough the development of specific, multilateral, comprehensive and practical \napproaches to resolving such refugee situations, including the improvement of \ninternational burden- and responsibility-sharing and the realization of durable \nsolutions, within a multilateral context, and recalls that those solutions include \nvoluntary repatriation and, where appropriate and feasible, local integration and \nresettlement in a third country, while reaffirming that voluntary repatriation, \nsupported, as necessary, by rehabilitation and development assistance to facilitate \nsustainable reintegration, remains the preferred solution;  \n \n39. Recalls the need to reflect on effective strategies to ensure adequate \nprotection and assistance for internally displaced persons and to prevent and reduce \nsuch displacement, and in this regard encourages the Secretary-General to work with \nMember States and the United Nations system to explore ways to better address the \nlong-term needs of internally displaced persons, support communities that host them \nand improve the lives of the many millions of internally displaced persons;  \n \n40. Expresses grave concern about the plight of internally displaced persons \nin Africa, welcomes the efforts of African States in strengthening the regional \nmechanisms for the protection of and assistance to internally displaced persons, calls \nupon States to take concrete action to pre-empt internal displacement and to meet the \nprotection and assistance needs of internally displaced persons, recalls in that regard \nthe Guiding Principles on Internal Displacement,16 notes the current activities of the \nOffice of the High Commissioner related to the protection of and assistance to \ninternally displaced persons, including in the context of inter-agency arrangements in \nthis field, emphasizes that such activities should be consistent with relevant General \nAssembly resolutions and should not undermine the refugee mandate of the Office \nand the institution of asylum, and encourages the High Commissioner to continue his \ndialogue with States on the role of his Office in this regard;  \n \n41. Welcomes the efforts by the High Commissioner to improve coordination \nwith Member States and other United Nations agencies;  \n \n42. Also welcomes the efforts by the High Commissioner towards \nregionalization and decentralization, including to ensure that decision-making is \ncloser to the point of delivery, and towards efficiency gains as efforts continue to \nadvance refugee protection and solutions; \n \n43. Encourages African States, together with development and humanitarian \nactors, to work closely on multi-year strategies for refugees and internally displaced \npersons, factoring in the subregional dimension of many forced displacement crises;  \n \n44. Invites the Special Rapporteur of the Human Rights Council on the human \nrights of internally displaced persons to continue the ongoing dialogue with Member \nStates and the intergovernmental and non-governmental organizations concerned, in \naccordance with the Council\u2019s mandate, and to include information thereon in all \nreports to the Council and the General Assembly;  \n \n45. Requests the Secretary-General to submit a comprehensive report on \nassistance to refugees, returnees and displaced persons in Africa to the General \nAssembly at its seventy-fifth session, taking fully into account, inter alia, the situation \nof their host communities, refugee camps and the efforts expended by countries of \nasylum and those aimed at bridging funding gaps, under the item entitled \u201cReport of \n__________________ \n \n16  E/CN.4/1998/53/Add.2, annex. \n\nA/RES/74/131 \nAssistance to refugees, returnees and displaced persons in Africa\n \n19-22226\n10/10 \n \nthe United Nations High Commissioner for Refugees, questions relating to refugees, \nreturnees and displaced persons and humanitarian questions\u201d. \n \n50th plenary meeting \n18 December 2019 \n \n",
  "paragraphs": {
    "1": "Takes note of the reports of the Secretary-General8 and the United Nations High Commissioner for Refugees;9",
    "2": "Calls upon African States that have not yet signed or ratified the African Union Convention for the Protection and Assistance of Internally Displaced Persons in Africa to consider doing so as early as possible in order to ensure its wider implementation;",
    "3": "Notes the need for African States, with the support and collaboration of the international community, to resolutely address the root causes of all forms of forced displacement in Africa and to foster peace, stability and prosperity throughout the African continent;",
    "4": "Recalls the global compact on refugees as set out in the High Commissioner\u2019s annual report (part II) of 2018,10 affirmed on 17 December 2018,11 and calls upon the international community as a whole, including States and other relevant stakeholders, to implement the compact in order to achieve its four objectives on an equal footing based on the principle of burden- and responsibility-sharing, and in accordance with the guiding principles and paragraph 4 of the global compact on refugees, through concrete actions, pledges and contributions, including at the first Global Refugee Forum in December 2019, and requests the High Commissioner to report regularly on the progress being made;",
    "5": "Welcomes the important outcomes of the six continental consultative meetings that were organized under the 2019 theme of the African Union, \u201cYear of refugees, returnees and internally displaced persons: towards durable solutions to forced displacement in Africa\u201d, with regard to global responsibility-sharing, the role of parliamentarians in preventing and resolving forced displacement, statelessness, the mixed movements of refugees and migrants, and the ratification and implementation of the Organization of African Unity Convention governing the specific aspects of refugee problems in Africa of 19691 and the African Union Convention for the Protection and Assistance of Internally Displaced Persons in Africa (Kampala Convention) of 2009;",
    "6": "Reaffirms the central role played by the Heads of State and Government of the Intergovernmental Authority on Development towards the successful negotiations in Khartoum and the eventual signing of the final Revitalized Agreement on the Resolution of the Conflict in South Sudan between the Government and the opposition movements during the thirty-third extraordinary summit, held in Addis Ababa on 12 September 2018, and encourages ongoing efforts to fully implement this agreement in order to achieve a sustainable and lasting peace;",
    "7": "Commends the continued efforts and commitment by the regional Governments towards resolving conflicts in the region, including the ongoing mediation by the Sudan between the parties to the conflict in the Central African Republic under the umbrella of the African Initiative for Peace and Reconciliation in the Central African Republic;",
    "8": "Welcomes the outcome of the second regional protection dialogue on the Lake Chad basin, held in Nigeria in January 2019, as well as the signing of the Abuja Action Statement by the Governments of Cameroon, Chad, the Niger and Nigeria, with a view to enhancing the response to the urgent needs of refugees, internally displaced persons, returnees and host communities;",
    "9": "Also welcomes the regional dialogue on protection and solutions related to the situation of forced displacement in the Sahel, held in Bamako on 11 and 12 September 2019, hosted by the Government of Mali, with the participation of government officials from Burkina Faso, Chad, Mauritania and the Niger, and further welcomes the outcome of the dialogue, namely, the Bamako conclusions and ministerial declaration adopted in Geneva on 9 October 2019;",
    "10": "Notes with great concern that, despite all the efforts made so far by the United Nations, the African Union and others, the situation of refugees and displaced persons in Africa remains precarious and the number of refugees and internally displaced persons has dramatically increased, and calls upon States and other parties to armed conflict to observe scrupulously the letter and spirit of, and respect and ensure respect for, international humanitarian law, bearing in mind that armed conflict is one of the principal causes of forced displacement in Africa;",
    "11": "Welcomes decision Assembly/AU/Decl. 8 (XXXII), adopted by the Assembly of Heads of State and Government of the African Union at its thirty-second ordinary session, held in Addis Ababa on 10 and 11 February 2019, in which the 2019 theme of the African Union was declared to be the \u201cYear of refugees, returnees and internally displaced persons: towards durable solutions to forced displacement in Africa\u201d;",
    "12": "Expresses its appreciation for the leadership shown by the Office of the United Nations High Commissioner for Refugees, and commends the Office for its ongoing efforts, with the support of the international community, to assist African States hosting large numbers of refugees, including by providing support to vulnerable local host communities, and to respond to the protection and assistance needs of refugees, returnees and displaced persons in Africa;",
    "13": "Notes with appreciation the ongoing initiatives taken by the African Union, the Subcommittee on Refugees, Returnees and Internally Displaced Persons of its Permanent Representatives Committee and the African Commission on Human and Peoples\u2019 Rights, in particular the role of its Special Rapporteur on Refugees, Asylum Seekers, Migrants and Internally Displaced Persons in Africa, to ensure the protection of and assistance to refugees, returnees and displaced persons in Africa;",
    "14": "Underlines the need to provide an efficient humanitarian response to internally displaced persons, and recognizes in this regard the importance of the African Union Convention for the Protection and Assistance of Internally Displaced Persons in Africa;",
    "15": "Acknowledges the important contribution of age, gender and diversity mainstreaming in identifying, through the full participation of women, children, older persons and persons with disabilities, the protection risks faced by the different members of the refugee communities, in particular the non-discriminatory treatment and protection of women, children, older persons and persons with disabilities;",
    "16": " displaced children to forcible exposure to the risks of physical and psychological injury, exploitation and death in connection with armed conflict, as well as the recruitment and use of children by parties to armed conflict in violation of applicable international law, and acknowledges that wider environmental factors and individual risk factors, particularly when combined, may generate different protection needs;",
    "17": "Recognizes that no solution to forced displacement can be durable unless it is sustainable, and therefore encourages the Office of the High Commissioner to support the sustainability of durable solutions, and recalls that those solutions include voluntary repatriation and, where appropriate and feasible, local integration and resettlement in a third country, while reaffirming that voluntary repatriation, supported, as necessary, by rehabilitation and development assistance to facilitate sustainable reintegration, remains the preferred solution;",
    "18": "Reaffirms the conclusion on civil registration adopted by the Executive Committee of the Programme of the United Nations High Commissioner for Refugees at its sixty-fourth session, held in Geneva from 30 September to 4 October 2013, 12 and recognizes the importance of early registration and effective registration systems and censuses as a tool of protection and as a means to the quantification and assessment of needs for the provision and distribution of humanitarian assistance and to implement appropriate durable solutions;",
    "19": "Also reaffirms the conclusion on registration of refugees and asylum seekers adopted by the Executive Committee of the Programme of the High Commissioner at its fifty-second session,13 notes the many forms of harassment faced by refugees and asylum seekers who remain without any form of documentation attesting to their status, recalls the responsibility of States to register refugees on their territories and, as appropriate, the responsibility of the Office of the High Commissioner or mandated international bodies to do so, reiterates in this context the central role that early and effective registration and documentation can play, guided by protection considerations, in enhancing protection and supporting efforts to find durable solutions, and calls upon the Office, as appropriate, to help States to conduct this procedure should they be unable to register refugees on their territory;",
    "20": "Appreciates the ongoing efforts undertaken by Member States to implement the conclusion on machine-readable travel documents for refugees and stateless persons adopted by the Executive Committee at its sixty-eighth session;14",
    "21": "Calls upon the international community, including States and the Office of the High Commissioner and other relevant United Nations organizations, within their respective mandates, to take concrete action to meet the protection and assistance needs of refugees, returnees and displaced persons and to contribute generously to projects and programmes aimed at alleviating their plight, facilitating durable solutions and supporting vulnerable local host communities;",
    "22": "Acknowledges the efforts made by the African countries applying the comprehensive refugee response framework, and underscores the importance for the international community of ensuring adequate, timely and predictable support;",
    "23": "Reaffirms the importance of timely and adequate assistance and protection for refugees, returnees and displaced persons, also reaffirms that assistance and protection are mutually reinforcing and that inadequate material assistance and food shortages undermine protection, notes the importance of a rights- and community- based approach in engaging constructively with individual refugees, returnees and displaced persons and their communities so as to achieve fair and equitable access to food and other forms of material assistance, and expresses concern with regard to situations in which minimum standards of assistance are not met, including those in which adequate needs assessments have yet to be undertaken;",
    "24": "Also reaffirms that respect by States for their protection responsibilities towards refugees is strengthened by international solidarity involving all members of the international community and that the refugee protection regime is enhanced through committed international cooperation in a spirit of solidarity and burden- and responsibility-sharing among all States;",
    "25": "Further reaffirms that host States have the primary responsibility to ensure the civilian and humanitarian character of asylum, calls upon States, in cooperation with international organizations, within their mandates, to take all measures necessary to ensure respect for the principles of refugee protection and, in particular, to ensure that the civilian and humanitarian nature of refugee camps is not compromised by the presence or the activities of armed elements or used for purposes that are incompatible with their civilian character, and encourages the High Commissioner to continue efforts, in consultation with States and other relevant actors, to ensure the civilian and humanitarian character of camps;",
    "26": "Condemns all acts that pose a threat to the personal security and well-being of refugees and asylum seekers, such as refoulement, unlawful expulsion and physical attacks, calls upon States of refuge, in cooperation with international organizations, where appropriate, to take all measures necessary to ensure respect for the principles of refugee protection, including the humane treatment of asylum seekers, notes with interest that the High Commissioner has continued to take steps to encourage the development of measures to better ensure the civilian and humanitarian character of asylum, and encourages the High Commissioner to continue those efforts, in consultation with States and other relevant actors;",
    "27": "Deplores the continuing violence and insecurity, which constitute an ongoing threat to the safety and security of staff members of the Office of the High Commissioner and other humanitarian organizations and an obstacle to the effective fulfilment of the mandate of the Office and the ability of its implementing partners and other humanitarian personnel to discharge their respective humanitarian functions, urges States, parties to conflict and all other relevant actors to take all measures necessary to protect activities related to humanitarian assistance, prevent attacks on and kidnapping of national and international humanitarian workers and ensure the safety and security of the personnel and property of the Office and that of all humanitarian organizations discharging functions mandated by the Office, and calls upon States to investigate fully any crime committed against humanitarian personnel and bring to justice the persons responsible for such crimes;",
    "28": "Calls upon the Office of the High Commissioner, the African Union, subregional organizations and all African States, in conjunction with agencies of the United Nations system, intergovernmental and non-governmental organizations and the international community, to strengthen and revitalize existing partnerships and forge new ones in support of the protection system for refugees, asylum seekers and internally displaced persons, and encourages African States that have not yet done so to consider ratifying and enforcing the Convention on the Safety of United Nations and Associated Personnel;15",
    "29": "Calls upon the Office of the High Commissioner, the international community, donors and other entities concerned to continue and, where appropriate, to intensify their support to African Governments through appropriate capacity- building activities, including training of relevant officers, disseminating information about refugee instruments and principles, providing financial, technical, legal and advisory services to accelerate the enactment or amendment and implementation of legislation relating to refugees, strengthening emergency response and enhancing capacities for the coordination of humanitarian activities, in particular to those Governments that have received large numbers of refugees and asylum seekers;",
    "30": "Reaffirms the right of return, in accordance with international law, and the principle of voluntary repatriation, appeals to countries of origin and countries of asylum to create conditions that are conducive to voluntary repatriation, and recognizes that, while voluntary repatriation remains the pre-eminent solution, local integration and third-country resettlement, where appropriate and feasible, are also viable options for dealing with the situation of African refugees who, owing to prevailing circumstances in their respective countries of origin, are unable to return home;",
    "31": "Also reaffirms that voluntary repatriation should not necessarily be conditioned on the accomplishment of political solutions in the country of origin in order not to impede the exercise of the refugees\u2019 right to return, recognizes that the voluntary repatriation and reintegration process is normally guided by the conditions in the country of origin, in particular that voluntary repatriation can be accomplished in conditions of safety and dignity, urges the High Commissioner to promote sustainable return through the development of durable and lasting solutions, particularly in protracted refugee situations, and encourages States and other relevant actors to continue to support these efforts through, inter alia, the allocation of funds;",
    "32": "Calls upon the international donor community to provide financial and material assistance which allows for the implementation of community-based development programmes that benefit both refugees and host communities, as appropriate, in agreement with host countries and consistent with humanitarian objectives;",
    "33": "Recognizes the increase in the number and scale of disasters, including those related to the adverse effects of climate change, which in certain circumstances may contribute to displacement and additional pressure on host communities, encourages the United Nations and all relevant actors to strengthen the efforts aimed at addressing the needs of persons displaced within the context of such disasters, and notes in this regard the importance of sharing best practices to prevent and prepare for such displacements;",
    "34": "Appeals to the international community to respond positively, in the spirit of solidarity and burden- and responsibility-sharing, to the third-country resettlement needs of African refugees, notes in this regard the importance of using resettlement strategically, as part of situation-specific comprehensive responses to refugee situations, and to this end encourages States, the Office of the High Commissioner and other relevant partners to make full use of the Multilateral Framework of Understandings on Resettlement, where appropriate and feasible;",
    "35": "Expresses serious concern about the chronic underfunding for humanitarian assistance to refugees and internally displaced persons in Africa;",
    "36": "Calls upon the international donor community to provide assistance for material, financial and technical support intended for the rehabilitation of the environment and infrastructure affected by refugees in countries of asylum as well as internally displaced persons, where appropriate, and notes with concern the environmental degradation in these areas;",
    "37": " Africa receives a fair and equitable share of the resources designated for refugees, and recognizes the importance of increased, flexible, predictable and multi-year funding;",
    "38": "Encourages the Office of the High Commissioner and interested States to identify protracted refugee situations which might lend themselves to resolution through the development of specific, multilateral, comprehensive and practical approaches to resolving such refugee situations, including the improvement of international burden- and responsibility-sharing and the realization of durable solutions, within a multilateral context, and recalls that those solutions include voluntary repatriation and, where appropriate and feasible, local integration and resettlement in a third country, while reaffirming that voluntary repatriation, supported, as necessary, by rehabilitation and development assistance to facilitate sustainable reintegration, remains the preferred solution;",
    "39": "Recalls the need to reflect on effective strategies to ensure adequate protection and assistance for internally displaced persons and to prevent and reduce such displacement, and in this regard encourages the Secretary-General to work with Member States and the United Nations system to explore ways to better address the long-term needs of internally displaced persons, support communities that host them and improve the lives of the many millions of internally displaced persons;",
    "40": "Expresses grave concern about the plight of internally displaced persons in Africa, welcomes the efforts of African States in strengthening the regional mechanisms for the protection of and assistance to internally displaced persons, calls upon States to take concrete action to pre-empt internal displacement and to meet the protection and assistance needs of internally displaced persons, recalls in that regard the Guiding Principles on Internal Displacement,16 notes the current activities of the Office of the High Commissioner related to the protection of and assistance to internally displaced persons, including in the context of inter-agency arrangements in this field, emphasizes that such activities should be consistent with relevant General Assembly resolutions and should not undermine the refugee mandate of the Office and the institution of asylum, and encourages the High Commissioner to continue his dialogue with States on the role of his Office in this regard;",
    "41": "Welcomes the efforts by the High Commissioner to improve coordination with Member States and other United Nations agencies;",
    "42": "Also welcomes the efforts by the High Commissioner towards regionalization and decentralization, including to ensure that decision-making is closer to the point of delivery, and towards efficiency gains as efforts continue to advance refugee protection and solutions;",
    "43": "Encourages African States, together with development and humanitarian actors, to work closely on multi-year strategies for refugees and internally displaced persons, factoring in the subregional dimension of many forced displacement crises;",
    "44": "Invites the Special Rapporteur of the Human Rights Council on the human rights of internally displaced persons to continue the ongoing dialogue with Member States and the intergovernmental and non-governmental organizations concerned, in accordance with the Council\u2019s mandate, and to include information thereon in all reports to the Council and the General Assembly;",
    "45": "Requests the Secretary-General to submit a comprehensive report on assistance to refugees, returnees and displaced persons in Africa to the General Assembly at its seventy-fifth session, taking fully into account, inter alia, the situation of their host communities, refugee camps and the efforts expended by countries of asylum and those aimed at bridging funding gaps, under the item entitled \u201cReport of the United Nations High Commissioner for Refugees, questions relating to refugees, returnees and displaced persons and humanitarian questions\u201d."
  },
  "agenda_items": [
    "Item 61"
  ],
  "symbol_references": []
}