{
  "symbol": "A/RES/74/35",
  "filename": "A_RES_74_35.pdf",
  "title": "74/35. Role of science and technology in the context of international security and disarmament",
  "text": "United Nations \nA/RES/74/35\n \n \nGeneral Assembly \nDistr.: General \n18 December 2019 \n \n19-21728 (E)    231219 \n*1921728* \n \n \nSeventy-fourth session \nAgenda item 97 \nRole of science and technology in the context of \ninternational security and disarmament \n \n \n \n \n Resolution adopted by the General Assembly \non 12 December 2019 \n \n \n \n \n[on the report of the First Committee (A/74/367)] \n \n \n \n74/35. Role of science and technology in the context of international \nsecurity and disarmament  \n \n \n \nThe General Assembly, \n \nRecognizing that scientific and technological developments can have both \ncivilian and military applications and that progress in science and technology for \ncivilian applications needs to be maintained and encouraged, \n \nUnderlining the keen interest of the international community to keep abreast of \nthe latest developments in science and technology of relevance to international \nsecurity and disarmament and to channel scientific and technological developments \nfor beneficial purposes, \n \nMindful of the need to regulate the transfer of technologies for peaceful uses, in \naccordance with relevant international obligations, to address the risk of proliferation \nby States or non-State actors, \n \nAcknowledging the need to continue the exchange of technologies for peaceful \nuses, including in accordance with relevant international obligations, \n \nMindful of the rights of States, reflected in relevant international agreements, \nregarding the development, production, transfer and use of technologies for peaceful \npurposes, in accordance with relevant international obligations, as well as the need \nfor all Member States to fulfil their obligations in relation to arms control and \ndisarmament and to prevent proliferation in all its aspects of all weapons of mass \ndestruction and their means of delivery, \n \nCognizant of the discussions on developments in science and technology at the \nInternational Atomic Energy Agency and the Organisation for the Prohibition of \nChemical Weapons and within the meetings of experts on science and technology \nunder the 2018\u20132020 intersessional programme established by the 2017 Meeting of \n\nA/RES/74/35 \nRole of science and technology in the context\nof international security and disarmament\n \n19-21728\n2/3 \n \nthe States Parties to the Convention on the Prohibition of the Development, \nProduction and Stockpiling of Bacteriological (Biological) and Toxin Weapons and \non Their Destruction, \n \nCognizant also of the discussions in the Conference on Disarmament in 2018 \nunder its subsidiary body 5, \n \nMindful of the discussions in other forums, such as the Committee on the \nPeaceful Uses of Outer Space, on the long-term sustainability of outer space activities \nand on the prevention of an arms race in outer space in the United Nations \ndisarmament machinery,  \n \nNoting the discussions on various dimensions of emerging technologies under \nthe framework of the Convention on Prohibitions or Restrictions on the Use of Certain \nConventional Weapons Which May Be Deemed to Be Excessively Injurious or to \nHave Indiscriminate Effects,1 and welcoming the discussions and progress made by \nthe Group of Governmental Experts on lethal autonomous weapons systems during \nits 2018 and 2019 sessions, \n \nNoting also the discussions within the United Nations and the specialized \nagencies on developments in the field of information and communications \ntechnologies, including in the context of international security, \n \nAcknowledging that the accelerating pace of technological change necessitates \na system-wide assessment of the potential impact of developments in science and \ntechnology on international security and disarmament, with due regard to avoiding \nduplication and complementing efforts already under way in United Nations entities \nand in the framework of the relevant international conventions, \n \nNoting the discussions on current developments in science and technology and \ntheir potential impact on international security and disarmament efforts in the \nAdvisory Board on Disarmament Matters during its sixty-ninth and seventieth \nsessions, in 2018, \n \n1. \nInvites Member States to continue efforts to apply developments in science \nand technology for disarmament-related purposes, including the verification of \ndisarmament, arms control and non-proliferation instruments, and to make \ndisarmament-related technologies available to interested States; \n \n2. \nCalls upon Member States to remain vigilant in understanding new and \nemerging developments in science and technology that could imperil international \nsecurity, and underlines the importance of Member States engaging with experts from \nindustry, the research community and civil society in addressing this challenge; \n \n3. \nWelcomes the convening, from voluntary contributions, of a one-day \nfocused seminar on the role of science and technology in the context of international \nsecurity and disarmament, by the United Nations Institute for Disarmament \nResearch in Geneva in 2019, as mandated in General Assembly resolution 73/32 of \n5 December 2018; \n \n4. \nTakes note of the updated report of the Secretary-General on current \ndevelopments in science and technology and their potential impact on international \nsecurity and disarmament efforts, 2  with a section containing submissions from \nMember States giving their views on the matter; \n \n5. \nRequests the Secretary-General to submit to the General Assembly at its \nseventy-fifth session an updated report on the matter; \n__________________ \n \n1  United Nations, Treaty Series, vol. 1342, No. 22495. \n \n2  A/74/122 and A/74/122/Add.1. \n\nRole of science and technology in the context \nof international security and disarmament \nA/RES/74/35\n \n3/3\n19-21728 \n \n \n6. \nEncourages the Advisory Board on Disarmament Matters to continue its \ndiscussions on current developments in science and technology and their potential \nimpact on international security and disarmament efforts; \n \n7. \nEncourages Member States to organize events such as conferences, \nseminars, workshops and exhibitions, at the national, regional and international \nlevels, on the role of science and technology in the context of international security \nand disarmament, in order to facilitate multilateral dialogue, as well as dialogue \namong relevant stakeholders, on current developments in science and technology and \ntheir potential impact on international security and disarmament efforts; \n \n8. \nDecides to include in the provisional agenda of its seventy-fifth session \nthe item entitled \u201cRole of science and technology in the context of international \nsecurity and disarmament\u201d. \n \n46th plenary meeting \n12 December 2019 \n \n",
  "paragraphs": {
    "1": "Invites Member States to continue efforts to apply developments in science and technology for disarmament-related purposes, including the verification of disarmament, arms control and non-proliferation instruments, and to make disarmament-related technologies available to interested States;",
    "2": "Calls upon Member States to remain vigilant in understanding new and emerging developments in science and technology that could imperil international security, and underlines the importance of Member States engaging with experts from industry, the research community and civil society in addressing this challenge;",
    "3": "Welcomes the convening, from voluntary contributions, of a one-day focused seminar on the role of science and technology in the context of international security and disarmament, by the United Nations Institute for Disarmament Research in Geneva in 2019, as mandated in General Assembly resolution 73/32 of 5 December 2018;",
    "4": "Takes note of the updated report of the Secretary-General on current developments in science and technology and their potential impact on international security and disarmament efforts, 2 with a section containing submissions from Member States giving their views on the matter;",
    "5": "Requests the Secretary-General to submit to the General Assembly at its seventy-fifth session an updated report on the matter;",
    "6": "Encourages the Advisory Board on Disarmament Matters to continue its discussions on current developments in science and technology and their potential impact on international security and disarmament efforts;",
    "7": "Encourages Member States to organize events such as conferences, seminars, workshops and exhibitions, at the national, regional and international levels, on the role of science and technology in the context of international security and disarmament, in order to facilitate multilateral dialogue, as well as dialogue among relevant stakeholders, on current developments in science and technology and their potential impact on international security and disarmament efforts;",
    "8": "Decides to include in the provisional agenda of its seventy-fifth session the item entitled \u201cRole of science and technology in the context of international security and disarmament\u201d."
  },
  "agenda_items": [
    "Item 97"
  ],
  "symbol_references": []
}