{
  "symbol": "A/RES/78/301",
  "filename": "A_RES_78_301.pdf",
  "title": "78/301. Financing of the United Nations Organization Stabilization Mission in the Democratic Republic of the Congo",
  "text": "United Nations \nA/RES/78/301 \n \n \nGeneral Assembly \nDistr.: General \n3 July 2024 \n \n24-12149 (E)     \n*2412149* \n \n \nSeventy-eighth session \nAgenda item 151 \nFinancing of the United Nations Organization Stabilization \nMission in the Democratic Republic of the Congo \n \n \n \n \n Resolution adopted by the General Assembly \non 28 June 2024 \n \n \n \n \n[on the report of the Fifth Committee (A/78/925, para. 6)] \n \n \n 78/301. Financing of the United Nations Organization Stabilization \nMission in the Democratic Republic of the Congo \n \n \n \nThe General Assembly, \n \nHaving considered the reports of the Secretary-General on the financing of the \nUnited Nations Organization Stabilization Mission in the Democratic Republic of the \nCongo1 and the related report of the Advisory Committee on Administrative and \nBudgetary Questions,2  \n \nRecalling Security Council resolution 1925 (2010) of 28 May 2010, by which \nthe Council decided that, as from 1 July 2010, the United Nations Organization \nMission in the Democratic Republic of the Congo would bear the title \u201cUnited \nNations Organization Stabilization Mission in the Democratic Republic of the \nCongo\u201d, and recalling also the subsequent resolutions by which the Council extended \nthe mandate of the Mission, the latest of which was resolution 2717 (2023) of \n19 December 2023, by which the Council extended the mandate of the Mission until \n20 December 2024, \n \nRecalling also its resolution 54/260 A of 7 April 2000 on the financing of the \nMission and its subsequent resolutions thereon, the latest of which was resolution \n77/309 of 30 June 2023, \n \nRecalling further its resolution 58/315 of 1 July 2004, \n \nReaffirming the general principles underlying the financing of United Nations \npeacekeeping operations, as stated in its resolutions 1874 (S-IV) of 27 June 1963, \n3101 (XXVIII) of 11 December 1973 and 55/235 of 23 December 2000, \n__________________ \n \n1 A/78/640 and A/78/741. \n \n2 A/78/744/Add.9. \n\nA/RES/78/301 \nFinancing of the United Nations Organization Stabilization Mission \nin the Democratic Republic of the Congo\n \n24-12149\n2/4 \n \n \nNoting with appreciation that voluntary contributions have been made to the \nMission, \n \nMindful of the fact that it is essential to provide the Mission with the financial \nresources necessary to enable it to fulfil its responsibilities under the relevant \nresolutions of the Security Council, \n \n1. \nRequests the Secretary General to entrust the Head of Mission with the \ntask of formulating future budget proposals in full accordance with the provisions of \nits resolutions 59/296 of 22 June 2005, 60/266 of 30 June 2006, 61/276 of 29 June \n2007, 64/269 of 24 June 2010, 65/289 of 30 June 2011, 66/264 of 21 June 2012, \n69/307 of 25 June 2015, 70/286 of 17 June 2016 and 76/274 of 29 June 2022, as well \nas other relevant resolutions; \n \n2. \nTakes note of the status of contributions to the United Nations \nOrganization Stabilization Mission in the Democratic Republic of the Congo as at \n30 April 2024, including the contributions outstanding in the amount of 407.0 million \nUnited States dollars, representing some 1.6 per cent of the total assessed \ncontributions, notes with concern that only 101 Member States have paid their \nassessed contributions in full, and urges all other Member States, in particular those \nin arrears, to ensure payment of their outstanding assessed contributions; \n \n3. \nExpresses its appreciation to those Member States that have paid their \nassessed contributions in full, and urges all other Member States to make every \npossible effort to ensure payment of their assessed contributions to the Mission in \nfull; \n \n4. \nExpresses concern at the financial situation with regard to peacekeeping \nactivities, in particular as regards the reimbursements to troop contributors that bear \nadditional burdens owing to overdue payments by Member States of their \nassessments; \n \n5. \nEmphasizes that all future and existing peacekeeping missions shall be \ngiven equal and non-discriminatory treatment in respect of financial and \nadministrative arrangements; \n \n6. \nAlso emphasizes that all peacekeeping missions shall be provided with \nadequate resources for the effective and efficient discharge of their respective \nmandates; \n \n7. \nRequests the Secretary-General to ensure that proposed peacekeeping \nbudgets are based on the relevant legislative mandates; \n \n8. \nEndorses the conclusions and recommendations contained in the report of \nthe Advisory Committee on Administrative and Budgetary Questions, subject to the \nprovisions of the present resolution, and requests the Secretary-General to ensure \ntheir full implementation; \n \n9. \nNotes the extensive mandate of the Mission for the protection of civilians, \nand requests the Secretary-General to continue to deploy, within its mandate, its \nspecial units, with the aim of effectively implementing the mandate; \n \n10. Also notes the abolishment of a large number of national posts in South \nKivu due to the Mission\u2019s withdrawal, and requests the Secretary-General to assist \nnational staff in their transition to future professional careers, including through \nemployment in vacant positions in the Mission and by collaborating with the United \nNations country team, as well as with other international agencies present in the \ncountry;  \n \n11. Further notes the complex environment in which the Mission operates, \nand encourages the Secretary-General, to continue to strengthen his engagement and \n\nFinancing of the United Nations Organization Stabilization Mission \nin the Democratic Republic of the Congo \nA/RES/78/301\n \n3/4\n24-12149 \n \nliaison with relevant regional and subregional organizations, and to ensure coherence \nand coordination with the Mission in compliance with the Mission\u2019s mandate; \n \n12. Requests the Secretary-General to ensure the full implementation of the \nrelevant provisions of its resolutions 59/296, 60/266, 61/276, 64/269, 65/289, 66/264, \n69/307, 70/286 and 76/274; \n \n13. Also requests the Secretary-General to take all action necessary to ensure \nthat the Mission is administered with a maximum of efficiency and economy; \n \nBudget performance report for the period from 1 July 2022 to 30 June 2023 \n \n \n14. Takes note of the report of the Secretary-General on the budget \nperformance of the Mission for the period from 1 July 2022 to 30 June 2023; 3 \n \nBudget estimates for the period from 1 July 2024 to 30 June 2025 \n \n \n15. Decides to appropriate to the special account for the United Nations \nOrganization Stabilization Mission in the Democratic Republic of the Congo the \namount of 994,544,400 dollars for the period from 1 July 2024 to 30 June 2025, \ninclusive of 907,983,500 dollars for the maintenance of the Mission, 65,980,100 dollars \nfor the support account for peacekeeping operations, 11,516,600 dollars for the United \nNations Logistics Base at Brindisi, Italy, and 9,064,200 dollars for the Regional \nService Centre in Entebbe, Uganda; \n \nFinancing of the appropriation for the period from 1 July 2024 to 30 June 2025 \n \n \n16. Decides \nto \napportion \namong \nMember \nStates \nthe \namount \nof \n467,544,000 dollars for the period from 1 July to 20 December 2024, in accordance \nwith the levels updated in its resolution 76/239 of 24 December 2021, taking into \naccount the scale of assessments for 2024, as set out in its resolution 76/238 of \n24 December 2021; \n \n17. Also decides that, in accordance with the provisions of its resolution 973 (X) \nof 15 December 1955, there shall be set off against the apportionment among Member \nStates, as provided for in paragraph 16 above, their respective share in the Tax \nEqualization Fund of 14,836,800 dollars, comprising the estimated staff assessment \nincome of 11,310,700 dollars approved for the Mission, the prorated share of \n2,528,400 dollars of the estimated staff assessment income approved for the support \naccount, the prorated share of 493,700 dollars of the estimated staff assessment \nincome approved for the United Nations Logistics Base and the prorated share of \n504,000 dollars of the estimated staff assessment income approved for the Regional \nService Centre; \n \n18. Further decides to apportion among Member States the amount of \n29,728,200 dollars for the period from 21 to 31 December 2024, at a monthly rate of \n82,878,700 dollars, in accordance with the levels updated in its resolution 76/239, \ntaking into account the scale of assessments for 2024, as set out in its resolution \n76/238, subject to a decision of the Security Council to extend the mandate of the \nMission;  \n \n19. Decides that, in accordance with the provisions of its resolution 973 (X), \nthere shall be set off against the apportionment among Member States, as provided \nfor in paragraph 18 above, their respective share in the Tax Equalization Fund of \n943,400 dollars, comprising the estimated staff assessment income of 719,200 dollars \napproved for the Mission, the prorated share of 160,800 dollars of the estimated staff \nassessment income approved for the support account, the prorated share of \n__________________ \n \n3 A/78/640. \n\nA/RES/78/301 \nFinancing of the United Nations Organization Stabilization Mission \nin the Democratic Republic of the Congo\n \n24-12149\n4/4 \n \n31,400 dollars of the estimated staff assessment income approved for the United \nNations Logistics Base and the prorated share of 32,000 dollars of the estimated staff \nassessment income approved for the Regional Service Centre; \n \n20. Also decides to apportion among Member States the amount of \n497,272,200 dollars for the period from 1 January to 30 June 2025, at a monthly rate \nof 82,878,700 dollars, in accordance with the scale of assessments for 2025 and the \nupdated levels,4 subject to a decision of the Security Council to extend the mandate \nof the Mission; \n \n21. Further decides that, in accordance with the provisions of its resolution \n973 (X), there shall be set off against the apportionment among Member States, as \nprovided for in paragraph 20 above, their respective share in the Tax Equalization \nFund of 15,780,100 dollars, comprising the estimated staff assessment income of \n12,029,900 dollars approved for the Mission, the prorated share of 2,689,100 dollars \nof the estimated staff assessment income approved for the support account, the \nprorated share of 525,100 dollars of the estimated staff assessment income approved \nfor the United Nations Logistics Base and the prorated share of 536,000 dollars of the \nestimated staff assessment income approved for the Regional Service Centre; \n \n22. Decides that, for Member States that have fulfilled their financial \nobligations to the Mission, there shall be set off against their apportionment, as \nprovided for in paragraphs 16, 18 and 20 above, their respective share of the \nunencumbered balance and other revenue in the amount of 55,662,100 dollars in \nrespect of the financial period ended 30 June 2023, in accordance with the levels \nupdated in its resolution 76/239, taking into account the scale of assessments for 2023, \nas set out in its resolution 76/238; \n \n23. Also decides that, for Member States that have not fulfilled their financial \nobligations to the Mission, there shall be set off against their outstanding obligations \ntheir respective share of the unencumbered balance and other revenue in the amount \nof 55,662,100 dollars in respect of the financial period ended 30 June 2023, in \naccordance with the scheme set out in paragraph 22 above; \n \n24. Further decides that the decrease of 560,100 dollars in the estimated staff \nassessment income in respect of the financial period ended 30 June 2023 shall be set \noff against the credits in the amount of 55,662,100 dollars referred to in paragraphs \n22 and 23 above; \n \n25. Encourages the Secretary-General to continue to take additional measures \nto ensure the safety and security of all personnel participating in the Mission under \nthe auspices of the United Nations, bearing in mind paragraphs 5 and 6 of Security \nCouncil resolution 1502 (2003) of 26 August 2003; \n \n26. Invites voluntary contributions to the Mission in cash and in the form of \nservices and supplies acceptable to the Secretary-General, to be administered, as \nappropriate, in accordance with the procedure and practices established by the \nGeneral Assembly; \n \n27. Decides to include in the provisional agenda of its seventy-ninth session \nthe item entitled \u201cFinancing of the United Nations Organization Stabilization Mission \nin the Democratic Republic of the Congo\u201d. \n \n95th plenary meeting \n28 June 2024 \n \n__________________ \n \n4 To be adopted by the General Assembly. \n",
  "paragraphs": {
    "1": "Requests the Secretary General to entrust the Head of Mission with the task of formulating future budget proposals in full accordance with the provisions of its resolutions 59/296 of 22 June 2005, 60/266 of 30 June 2006, 61/276 of 29 June 2007, 64/269 of 24 June 2010, 65/289 of 30 June 2011, 66/264 of 21 June 2012, 69/307 of 25 June 2015, 70/286 of 17 June 2016 and 76/274 of 29 June 2022, as well as other relevant resolutions;",
    "2": "Takes note of the status of contributions to the United Nations Organization Stabilization Mission in the Democratic Republic of the Congo as at 30 April 2024, including the contributions outstanding in the amount of 407.0 million United States dollars, representing some 1.6 per cent of the total assessed contributions, notes with concern that only 101 Member States have paid their assessed contributions in full, and urges all other Member States, in particular those in arrears, to ensure payment of their outstanding assessed contributions;",
    "3": "Expresses its appreciation to those Member States that have paid their assessed contributions in full, and urges all other Member States to make every possible effort to ensure payment of their assessed contributions to the Mission in full;",
    "4": "Expresses concern at the financial situation with regard to peacekeeping activities, in particular as regards the reimbursements to troop contributors that bear additional burdens owing to overdue payments by Member States of their assessments;",
    "5": "Emphasizes that all future and existing peacekeeping missions shall be given equal and non-discriminatory treatment in respect of financial and administrative arrangements;",
    "6": "Also emphasizes that all peacekeeping missions shall be provided with adequate resources for the effective and efficient discharge of their respective mandates;",
    "7": "Requests the Secretary-General to ensure that proposed peacekeeping budgets are based on the relevant legislative mandates;",
    "8": "Endorses the conclusions and recommendations contained in the report of the Advisory Committee on Administrative and Budgetary Questions, subject to the provisions of the present resolution, and requests the Secretary-General to ensure their full implementation;",
    "9": "Notes the extensive mandate of the Mission for the protection of civilians, and requests the Secretary-General to continue to deploy, within its mandate, its special units, with the aim of effectively implementing the mandate;",
    "10": "Also notes the abolishment of a large number of national posts in South Kivu due to the Mission\u2019s withdrawal, and requests the Secretary-General to assist national staff in their transition to future professional careers, including through employment in vacant positions in the Mission and by collaborating with the United Nations country team, as well as with other international agencies present in the country;",
    "11": "Further notes the complex environment in which the Mission operates, and encourages the Secretary-General, to continue to strengthen his engagement and Financing of the United Nations Organization Stabilization Mission in the Democratic Republic of the Congo A/RES/78/301 3/4 24-12149 liaison with relevant regional and subregional organizations, and to ensure coherence and coordination with the Mission in compliance with the Mission\u2019s mandate;",
    "12": "Requests the Secretary-General to ensure the full implementation of the relevant provisions of its resolutions 59/296, 60/266, 61/276, 64/269, 65/289, 66/264, 69/307, 70/286 and 76/274;",
    "13": "Also requests the Secretary-General to take all action necessary to ensure that the Mission is administered with a maximum of efficiency and economy; Budget performance report for the period from 1 July 2022 to 30 June 2023",
    "14": "Takes note of the report of the Secretary-General on the budget performance of the Mission for the period from 1 July 2022 to 30 June 2023; 3 Budget estimates for the period from 1 July 2024 to 30 June 2025",
    "15": "Decides to appropriate to the special account for the United Nations Organization Stabilization Mission in the Democratic Republic of the Congo the amount of 994,544,400 dollars for the period from 1 July 2024 to 30 June 2025, inclusive of 907,983,500 dollars for the maintenance of the Mission, 65,980,100 dollars for the support account for peacekeeping operations, 11,516,600 dollars for the United Nations Logistics Base at Brindisi, Italy, and 9,064,200 dollars for the Regional Service Centre in Entebbe, Uganda; Financing of the appropriation for the period from 1 July 2024 to 30 June 2025",
    "16": "Decides to apportion among Member States the amount of 467,544,000 dollars for the period from 1 July to 20 December 2024, in accordance with the levels updated in its resolution 76/239 of 24 December 2021, taking into account the scale of assessments for 2024, as set out in its resolution 76/238 of 24 December 2021;",
    "17": "Also decides that, in accordance with the provisions of its resolution 973 (X) of 15 December 1955, there shall be set off against the apportionment among Member States, as provided for in paragraph 16 above, their respective share in the Tax Equalization Fund of 14,836,800 dollars, comprising the estimated staff assessment income of 11,310,700 dollars approved for the Mission, the prorated share of 2,528,400 dollars of the estimated staff assessment income approved for the support account, the prorated share of 493,700 dollars of the estimated staff assessment income approved for the United Nations Logistics Base and the prorated share of 504,000 dollars of the estimated staff assessment income approved for the Regional Service Centre;",
    "18": "Further decides to apportion among Member States the amount of 29,728,200 dollars for the period from 21 to 31 December 2024, at a monthly rate of 82,878,700 dollars, in accordance with the levels updated in its resolution 76/239, taking into account the scale of assessments for 2024, as set out in its resolution 76/238, subject to a decision of the Security Council to extend the mandate of the Mission;",
    "19": "Decides that, in accordance with the provisions of its resolution 973 (X), there shall be set off against the apportionment among Member States, as provided for in paragraph 18 above, their respective share in the Tax Equalization Fund of 943,400 dollars, comprising the estimated staff assessment income of 719,200 dollars approved for the Mission, the prorated share of 160,800 dollars of the estimated staff assessment income approved for the support account, the prorated share of __________________ 3 A/78/640. A/RES/78/301 Financing of the United Nations Organization Stabilization Mission in the Democratic Republic of the Congo 24-12149 4/4 31,400 dollars of the estimated staff assessment income approved for the United Nations Logistics Base and the prorated share of 32,000 dollars of the estimated staff assessment income approved for the Regional Service Centre;",
    "20": "Also decides to apportion among Member States the amount of 497,272,200 dollars for the period from 1 January to 30 June 2025, at a monthly rate of 82,878,700 dollars, in accordance with the scale of assessments for 2025 and the updated levels,4 subject to a decision of the Security Council to extend the mandate of the Mission;",
    "21": "Further decides that, in accordance with the provisions of its resolution 973 (X), there shall be set off against the apportionment among Member States, as provided for in paragraph 20 above, their respective share in the Tax Equalization Fund of 15,780,100 dollars, comprising the estimated staff assessment income of 12,029,900 dollars approved for the Mission, the prorated share of 2,689,100 dollars of the estimated staff assessment income approved for the support account, the prorated share of 525,100 dollars of the estimated staff assessment income approved for the United Nations Logistics Base and the prorated share of 536,000 dollars of the estimated staff assessment income approved for the Regional Service Centre;",
    "22": "Decides that, for Member States that have fulfilled their financial obligations to the Mission, there shall be set off against their apportionment, as provided for in paragraphs 16, 18 and 20 above, their respective share of the unencumbered balance and other revenue in the amount of 55,662,100 dollars in respect of the financial period ended 30 June 2023, in accordance with the levels updated in its resolution 76/239, taking into account the scale of assessments for 2023, as set out in its resolution 76/238;",
    "23": "Also decides that, for Member States that have not fulfilled their financial obligations to the Mission, there shall be set off against their outstanding obligations their respective share of the unencumbered balance and other revenue in the amount of 55,662,100 dollars in respect of the financial period ended 30 June 2023, in accordance with the scheme set out in paragraph 22 above;",
    "24": "Further decides that the decrease of 560,100 dollars in the estimated staff assessment income in respect of the financial period ended 30 June 2023 shall be set off against the credits in the amount of 55,662,100 dollars referred to in paragraphs 22 and 23 above;",
    "25": "Encourages the Secretary-General to continue to take additional measures to ensure the safety and security of all personnel participating in the Mission under the auspices of the United Nations, bearing in mind paragraphs 5 and 6 of Security Council resolution 1502 (2003) of 26 August 2003;",
    "26": "Invites voluntary contributions to the Mission in cash and in the form of services and supplies acceptable to the Secretary-General, to be administered, as appropriate, in accordance with the procedure and practices established by the General Assembly;",
    "27": "Decides to include in the provisional agenda of its seventy-ninth session the item entitled \u201cFinancing of the United Nations Organization Stabilization Mission in the Democratic Republic of the Congo\u201d. 95th plenary meeting 28 June 2024 __________________ 4 To be adopted by the General Assembly."
  },
  "agenda_items": [
    "Item 151"
  ],
  "symbol_references": []
}