{
  "symbol": "A/RES/79/247",
  "filename": "A_RES_79_247.pdf",
  "title": "79/247. Programme planning",
  "text": "United Nations \nA/RES/79/247\n \n \nGeneral Assembly \nDistr.: General \n31 December 2024 \n \n24-24686 (E)     \n*2424686* \n \n \nSeventy-ninth session \nAgenda item 140 \nProgramme planning \n \n \n \n \n Resolution adopted by the General Assembly \non 24 December 2024 \n \n \n \n \n[on the report of the Fifth Committee (A/79/642, para. 11)] \n \n \n 79/247. Programme planning \n \n \n \nThe General Assembly, \n \nRecalling its resolutions 37/234 of 21 December 1982, 38/227 A of 20 December \n1983, 41/213 of 19 December 1986, 55/234 of 23 December 2000, 56/253 of \n24 December 2001, 57/282 of 20 December 2002, 58/268 and 58/269 of 23 December \n2003, 59/275 of 23 December 2004, 60/257 of 8 May 2006, 61/235 of 22 December \n2006, 62/224 of 22 December 2007, 63/247 of 24 December 2008, 64/229 of \n22 December 2009, 65/244 of 24 December 2010, 66/8 of 11 November 2011, 67/236 \nof 24 December 2012, 68/20 of 4 December 2013, 69/17 of 18 November 2014, 70/8 \nof 13 November 2015, 71/6 of 27 October 2016, 72/9 of 17 November 2017, 72/266 A \nof 24 December 2017, 72/266 B of 5 July 2018, section III of its resolution 72/262 C \nof 5 July 2018 and its resolutions 73/269 of 22 December 2018, 74/251 of \n27 December 2019, 75/243 of 31 December 2020, 76/236 of 24 December 2021, \n77/254 of 30 December 2022 and 78/244 of 22 December 2023, \n \nRecalling also the terms of reference of the Committee for Programme and \nCoordination, as outlined in the annex to Economic and Social Council resolution \n2008 (LX) of 14 May 1976, \n \nRecalling further the Regulations and Rules Governing Programme Planning, \nthe Programme Aspects of the Budget, the Monitoring of Implementation and the \nMethods of Evaluation,1 by which the relevant programmes and subprogrammes of \nthe proposed strategic framework shall be reviewed by the relevant sectoral, \nfunctional and regional intergovernmental bodies, if possible during the regular cycle \nof their meetings, \n \nHaving considered the report of the Committee for Programme and Coordination \non the work of its sixty-fourth session,2 the reports of the Secretary-General on the \n__________________ \n \n1  ST/SGB/2018/3. \n \n2 Official Records of the General Assembly, Seventy-ninth Session, Supplement No. 16 (A/79/16). \n\nA/RES/79/247 \nProgramme planning\n \n24-24686\n2/3 \n \nproposed programme budget for 2025: part II, proposed programme plan for 2025 and \nprogramme performance for 2023,3 and the letters and the annexes thereto from the \nChairs of the Disarmament and International Security Committee (First Committee) \ndated 22 October 2024,4 the Economic and Financial Committee (Second Committee) \ndated 25 October 2024,5 the Social, Humanitarian and Cultural Committee (Third \nCommittee) dated 21 October 2024 6 and the Special Political and Decolonization \nCommittee (Fourth Committee) dated 23 October 2024 7 addressed to the Chair of the \nFifth Committee, \n \n1. \nReaffirms the role of the Committee for Programme and Coordination as \nthe main subsidiary organ of the General Assembly and the Economic and Social \nCouncil for planning, programming and coordination; \n \n2. \nAlso reaffirms the role of the Committee for Programme and Coordination \nin verifying that the programmes of activities of the Organization are implemented in \nline with the legislative mandates and that the full implementation of regulations and \nrules is ensured; \n \n3. \nRe-emphasizes the role of the plenary and the Main Committees of the \nGeneral Assembly \nin \nreviewing \nand \ntaking \naction \non \nthe \nappropriate \nrecommendations of the Committee for Programme and Coordination relevant to their \nwork, in accordance with regulation 4.10 of the Regulations and Rules Governing \nProgramme Planning, the Programme Aspects of the Budget, the Monitoring of \nImplementation and the Methods of Evaluation; \n \n4. \nStresses that setting the priorities of the United Nations is the prerogative \nof the Member States, as reflected in legislative mandates; \n \n5. \nReiterates the need for Member States to participate fully in the budget \npreparation process, from its early stages and throughout the process; \n \n6. \nTakes note with appreciation of the work of the Committee for Programme \nand Coordination, and welcomes its report; \n \n7. \nReiterates that whenever the Committee for Programme and Coordination \ncannot provide conclusions and recommendations on a given subprogramme or \nprogramme of the proposed programme budget, the plenary or the relevant Main \nCommittee or Main Committees of the General Assembly responsible for those \nmandates will consider the said subprogramme or programme at the very start of its \nsession in order to provide any conclusions and recommendations to the Fifth \nCommittee, at the earliest opportunity, and no later than four weeks after the start of \nthe session, for timely consideration by the Fifth Committee; \n \n8. \nRecognizes the efforts of the President of the General Assembly and the \nChair of the Fifth Committee in following up with the Chairs of the relevant Main \nCommittees on the consideration of the programmes without recommendations from \nthe Committee for Programme and Coordination, in accordance with paragraph 8 of \n__________________ \n \n3  A/79/6 (Sect. 2), A/79/6 (Sect. 3), A/79/6 (Sect. 4), A/79/6 (Sect. 5), A/79/6 (Sect. 6), A/79/6 \n(Sect. 8), A/79/6 (Sect. 9), A/79/6 (Sect. 10), A/79/6 (Sect. 11), A/79/6 (Sect. 12), A/79/6 \n(Sect. 13), A/79/6 (Sect. 14), A/79/6 (Sect. 15), A/79/6 (Sect. 16), A/79/6 (Sect. 17), A/79/6 \n(Sect. 18), A/79/6 (Sect. 19), A/79/6 (Sect. 20), A/79/6 (Sect. 21), A/79/6 (Sect. 22), A/79/6 \n(Sect. 24), A/79/6 (Sect. 24)/Corr.1, A/79/6 (Sect. 25), A/79/6 (Sect. 26), A/79/6 (Sect. 27), \nA/79/6 (Sect. 27)/Corr.1, A/79/6 (Sect. 28), A/79/6 (Sect. 29), A/79/6 (Sect. 29A), A/79/6 \n(Sect. 29B), A/79/6 (Sect. 29C), A/79/6 (Sect. 29D), A/79/6 (Sect. 29E), A/79/6 (Sect. 29F), \nA/79/6 (Sect. 30), A/79/6 (Sect. 31), and A/79/6 (Sect. 34). \n \n4  A/C.5/79/12. \n \n5  A/C.5/79/14. \n \n6  A/C.5/79/11. \n \n7  A/C.5/79/13. \n\nProgramme planning \nA/RES/79/247\n \n3/3\n24-24686 \n \nits resolution 78/244, and reiterates that incoming Presidents of the General Assembly \nand Chairs of the Fifth Committee shall reach out to and support the Chairs of the \nMain Committees to ensure that conclusions and recommendations are issued on time; \n \n9. \nEndorses the conclusions and recommendations of the Committee for \nProgramme and Coordination on the proposed programme plan for 2025 and \nprogramme performance for 20238 and on evaluation,9 contained in its report on the \nwork of its sixty-fourth session, and requests the Secretary-General to ensure the \ntimely implementation of the recommendations; \n \n10. Approves, on an exceptional basis and without creating a precedent, for \nprogrammes 3 and 20 of the proposed programme budget for 2025, a programme \nnarrative that is composed solely of the list of mandates at the programme level and \nthe objectives approved by the General Assembly in its resolution 71/6 and the \ndeliverables for 2025 at the subprogramme level; \n \n11. \nAlso approves, on an exceptional basis and without creating a precedent, \nfor programmes 13 and 21 of the proposed programme budget for 2025, a programme \nnarrative that is composed solely of the list of mandates at the programme level and \nthe objectives approved by the General Assembly in its resolution 76/236 and the \ndeliverables for 2025 at the subprogramme level; \n \n12. Further approves, on an exceptional basis and without creating a \nprecedent, for programmes 2, 10, 17, 25 and 26 of the proposed programme budget \nfor 2025, a programme narrative that is composed solely of the list of mandates at the \nprogramme level and the objectives approved by the General Assembly in its \nresolution 77/254 and the deliverables for 2025 at the subprogramme level; \n \n13. Approves, on an exceptional basis and without creating a precedent, for \nprogrammes 4, 11, 14, 23, 24 and 28 of the proposed programme budget for 2025, a \nprogramme narrative that is composed solely of the list of mandates at the programme \nlevel and the objectives approved by the General Assembly in its resolution 78/244 \nand the deliverables for 2025 at the subprogramme level; \n \n14. Also approves the programme plan for programme 6, Legal affairs, of the \nproposed programme budget for 2025 as contained in the report of the Secretary-\nGeneral;10 \n \n15. Endorses the conclusions and recommendations of the Committee for \nProgramme and Coordination on United Nations system support for Agenda 2063: \nThe Africa We Want.11 \n \n55th (resumed) plenary meeting \n24 December 2024 \n \n__________________ \n \n8  See Official Records of the General Assembly, Seventy-ninth Session, Supplement No. 16 \n(A/79/16), chap. II, sect. A. \n \n9  Ibid., sect. B. \n \n10  A/79/6 (Sect. 8). \n \n11  See Official Records of the General Assembly, Seventy-ninth Session, Supplement No. 16 \n(A/79/16), chap. II, sect. B. \n",
  "paragraphs": {
    "1": "Reaffirms the role of the Committee for Programme and Coordination as the main subsidiary organ of the General Assembly and the Economic and Social Council for planning, programming and coordination;",
    "2": "Also reaffirms the role of the Committee for Programme and Coordination in verifying that the programmes of activities of the Organization are implemented in line with the legislative mandates and that the full implementation of regulations and rules is ensured;",
    "3": "Re-emphasizes the role of the plenary and the Main Committees of the General Assembly in reviewing and taking action on the appropriate recommendations of the Committee for Programme and Coordination relevant to their work, in accordance with regulation 4.10 of the Regulations and Rules Governing Programme Planning, the Programme Aspects of the Budget, the Monitoring of Implementation and the Methods of Evaluation;",
    "4": "Stresses that setting the priorities of the United Nations is the prerogative of the Member States, as reflected in legislative mandates;",
    "5": "Reiterates the need for Member States to participate fully in the budget preparation process, from its early stages and throughout the process;",
    "6": "Takes note with appreciation of the work of the Committee for Programme and Coordination, and welcomes its report;",
    "7": "Reiterates that whenever the Committee for Programme and Coordination cannot provide conclusions and recommendations on a given subprogramme or programme of the proposed programme budget, the plenary or the relevant Main Committee or Main Committees of the General Assembly responsible for those mandates will consider the said subprogramme or programme at the very start of its session in order to provide any conclusions and recommendations to the Fifth Committee, at the earliest opportunity, and no later than four weeks after the start of the session, for timely consideration by the Fifth Committee;",
    "8": "Recognizes the efforts of the President of the General Assembly and the Chair of the Fifth Committee in following up with the Chairs of the relevant Main Committees on the consideration of the programmes without recommendations from the Committee for Programme and Coordination, in accordance with paragraph 8 of its resolution 78/244, and reiterates that incoming Presidents of the General Assembly and Chairs of the Fifth Committee shall reach out to and support the Chairs of the Main Committees to ensure that conclusions and recommendations are issued on time;",
    "9": "Endorses the conclusions and recommendations of the Committee for Programme and Coordination on the proposed programme plan for 2025 and programme performance for 20238 and on evaluation,9 contained in its report on the work of its sixty-fourth session, and requests the Secretary-General to ensure the timely implementation of the recommendations;",
    "10": "Approves, on an exceptional basis and without creating a precedent, for programmes 3 and 20 of the proposed programme budget for 2025, a programme narrative that is composed solely of the list of mandates at the programme level and the objectives approved by the General Assembly in its resolution 71/6 and the deliverables for 2025 at the subprogramme level;",
    "11": "Also approves, on an exceptional basis and without creating a precedent, for programmes 13 and 21 of the proposed programme budget for 2025, a programme narrative that is composed solely of the list of mandates at the programme level and the objectives approved by the General Assembly in its resolution 76/236 and the deliverables for 2025 at the subprogramme level;",
    "12": "Further approves, on an exceptional basis and without creating a precedent, for programmes 2, 10, 17, 25 and 26 of the proposed programme budget for 2025, a programme narrative that is composed solely of the list of mandates at the programme level and the objectives approved by the General Assembly in its resolution 77/254 and the deliverables for 2025 at the subprogramme level;",
    "13": "Approves, on an exceptional basis and without creating a precedent, for programmes 4, 11, 14, 23, 24 and 28 of the proposed programme budget for 2025, a programme narrative that is composed solely of the list of mandates at the programme level and the objectives approved by the General Assembly in its resolution 78/244 and the deliverables for 2025 at the subprogramme level;",
    "14": "Also approves the programme plan for programme 6, Legal affairs, of the proposed programme budget for 2025 as contained in the report of the Secretary- General;10",
    "15": "Endorses the conclusions and recommendations of the Committee for Programme and Coordination on United Nations system support for Agenda 2063: The Africa We Want.11"
  },
  "agenda_items": [
    "Item 140"
  ],
  "symbol_references": []
}