{
  "symbol": "A/RES/76/116",
  "filename": "A_RES_76_116.pdf",
  "title": "76/116. Fortieth anniversary of the Manila Declaration on the Peaceful Settlement of International Disputes",
  "text": "United Nations \nA/RES/76/116\n \n \nGeneral Assembly \nDistr.: General \n17 December 2021 \n \n21-18673 (E)    271221 \n*2118673* \n \n \nSeventy-sixth session \nAgenda item 84 \nReport of the Special Committee on the Charter of the \nUnited Nations and on the Strengthening of the Role of \nthe Organization \n \n \n \n \n Resolution adopted by the General Assembly \non 9 December 2021 \n \n \n \n \n[on the report of the Sixth Committee (A/76/475, para. 12)] \n \n \n \n76/116. Fortieth anniversary of the Manila Declaration on the Peaceful \nSettlement of International Disputes \n \n \n \nThe General Assembly,  \n \nAcknowledging that 15 November 2022 will mark the fortieth anniversary of the \nManila Declaration on the Peaceful Settlement of International Disputes, as approved \nby the General Assembly in its resolution 37/10 of 15 November 1982, which was \nadopted without a vote, \n \nRecalling that the Manila Declaration was negotiated on the initiative of Egypt, \nIndonesia, Mexico, Nigeria, the Philippines, Romania, Sierra Leone and Tunisia and \non the basis of a text prepared by the Special Committee on the Charter of the United \nNations and on the Strengthening of the Role of the Organization, \n \nRecalling also that the Manila Declaration was the first instrument adopted by \nthe General Assembly as a result of the work of the Special Committee, \n \nRecalling further that the Manila Declaration is a landmark declaration on the \npeaceful settlement of international disputes, building upon the Charter of the United \nNations, in particular its Article 33, \n \nRecalling that the International Court of Justice is the principal judicial organ \nof the United Nations, \n \n1. \nRecognizes the Manila Declaration on the Peaceful Settlement of \nInternational Disputes1 as a concrete accomplishment of the Special Committee on \nthe Charter of the United Nations and on the Strengthening of the Role of the \n__________________ \n \n1 Resolution 37/10, annex. \n\nA/RES/76/116 \nFortieth anniversary of the Manila Declaration on \nthe Peaceful Settlement of International Disputes\n \n21-18673\n2/2 \n \nOrganization, and welcomes the fortieth anniversary of the adoption of the \nDeclaration; \n \n2. \nReiterates its call to all States to observe and promote in good faith the \nManila Declaration in the peaceful settlement of their international disputes; \n \n3. \nEncourages the United Nations and all Member States to commemorate \nthe fortieth anniversary of the adoption of the Manila Declaration through appropriate \nactivities; \n \n4. \nStresses that the cost of all activities that may arise from the \nimplementation of the present resolution shall be met from voluntary contributions; \n \n5. \nRequests the Secretary-General to bring the present resolution to the \nattention of Member States, the organizations of the United Nations system and all \nrelevant stakeholders for observance. \n \n49th plenary meeting \n9 December 2021 \n \n \n",
  "paragraphs": {
    "1": "Recognizes the Manila Declaration on the Peaceful Settlement of International Disputes1 as a concrete accomplishment of the Special Committee on the Charter of the United Nations and on the Strengthening of the Role of the Organization, and welcomes the fortieth anniversary of the adoption of the Declaration;",
    "2": "Reiterates its call to all States to observe and promote in good faith the Manila Declaration in the peaceful settlement of their international disputes;",
    "3": "Encourages the United Nations and all Member States to commemorate the fortieth anniversary of the adoption of the Manila Declaration through appropriate activities;",
    "4": "Stresses that the cost of all activities that may arise from the implementation of the present resolution shall be met from voluntary contributions;",
    "5": "Requests the Secretary-General to bring the present resolution to the attention of Member States, the organizations of the United Nations system and all relevant stakeholders for observance."
  },
  "agenda_items": [
    "Item 84"
  ],
  "symbol_references": []
}