{
  "symbol": "A/RES/74/232",
  "filename": "A_RES_74_232.pdf",
  "title": "74/232. Follow-up to the Fourth United Nations Conference on the Least Developed Countries",
  "text": "United Nations \nA/RES/74/232\n \n \nGeneral Assembly \nDistr.: General \n23 January 2020 \n \n19-22505 (E)    280120 \n*1922505* \n \n \nSeventy-fourth session \nAgenda item 21 (a) \nGroups of countries in special situations: follow-up to the \nFourth United Nations Conference on the Least Developed \nCountries \n \n \n \n \n Resolution adopted by the General Assembly \non 19 December 2019 \n \n \n \n \n[on the report of the Second Committee (A/74/383/Add.1)] \n \n \n 74/232. Follow-up to the Fourth United Nations Conference on the Least \nDeveloped Countries \n \n \n \nThe General Assembly, \n \nRecalling the Istanbul Declaration1 and the Programme of Action for the Least \nDeveloped Countries for the Decade 2011\u20132020, 2  adopted at the Fourth United \nNations Conference on the Least Developed Countries, held in Istanbul, Turkey, from \n9 to 13 May 2011, and endorsed by the General Assembly in its resolution 65/280 of \n17 June 2011, in which the Assembly called upon all the relevant stakeholders to \ncommit to implementing the Programme of Action, and recalling also the Political \nDeclaration adopted at the Comprehensive High-level Midterm Review of the \nImplementation of the Istanbul Programme of Action for the Least Developed \nCountries for the Decade 2011\u20132020, held in Antalya, Turkey, from 27 to 29 May \n2016, and endorsed by the Assembly in its resolution 70/294 of 25 July 2016, \n \nReaffirming the overarching goal of the Istanbul Programme of Action of \novercoming the structural challenges faced by the least developed countries to \neradicate poverty, achieve the internationally agreed development goals and enable \ngraduation from the least developed country category, \n \nReaffirming also its resolution 70/1 of 25 September 2015, entitled \n\u201cTransforming our world: the 2030 Agenda for Sustainable Development\u201d, in which \nit adopted a comprehensive, far-reaching and people-centred set of universal and \ntransformative Sustainable Development Goals and targets, its commitment to \nworking tirelessly for the full implementation of the Agenda by 2030, its recognition \n__________________ \n \n1  Report of the Fourth United Nations Conference on the Least Developed Countries, Istanbul, \nTurkey, 9\u201313 May 2011 (A/CONF.219/7), chap. I. \n \n2  Ibid., chap. II. \n\nA/RES/74/232 \nFollow-up to the Fourth United Nations Conference\non the Least Developed Countries\n \n19-22505\n2/11 \n \nthat eradicating poverty in all its forms and dimensions, including extreme poverty, \nis the greatest global challenge and an indispensable requirement for sustainable \ndevelopment, its commitment to achieving sustainable development in its three \ndimensions \u2013 economic, social and environmental \u2013 in a balanced and integrated \nmanner, and to building upon the achievements of the Millennium Development \nGoals and seeking to address their unfinished business, \n \nReaffirming further its resolution 69/313 of 27 July 2015 on the Addis Ababa \nAction Agenda of the Third International Conference on Financing for Development, \nwhich is an integral part of the 2030 Agenda for Sustainable Development, supports \nand complements it, helps to contextualize its means of implementation targets with \nconcrete policies and actions, and reaffirms the strong political commitment to \naddress the challenge of financing and creating an enabling environment at all levels \nfor sustainable development in the spirit of global partnership and solidarity, \n \nReaffirming the Paris Agreement3 and its early entry into force, encouraging all its \nparties to fully implement the Agreement, and parties to the United Nations Framework \nConvention on Climate Change4 that have not yet done so to deposit their instruments \nof ratification, acceptance, approval or accession, where appropriate, as soon as possible, \n \nReaffirming also the New Urban Agenda, adopted at the United Nations \nConference on Housing and Sustainable Urban Development (Habitat III), held in \nQuito, Ecuador, from 17 to 20 October 2016, 5  and acknowledging that, in \nimplementing the New Urban Agenda, particular attention should be given to the \nunique and emerging urban challenges by the least developed countries, \n \nRecalling the Sendai Framework for Disaster Risk Reduction 2015\u201320306 and \nits guiding principles, recalling also its promotion of regular disaster preparedness, \nresponse and recovery exercises, at the national and local levels, with a view to \nensuring a rapid and effective response to disasters and related displacement, \nincluding access to essential food and non-food relief supplies, as appropriate to local \nneeds, and acknowledging that its implementation can contribute to the achievement \nof the goals and objectives of the Programme of Action for the Least Developed \nCountries for the Decade 2011\u20132020, \n \nHighlighting the synergies between the implementation of the 2030 Agenda for \nSustainable Development, the Addis Ababa Action Agenda and the Paris Agreement, \nand noting with concern the findings contained in the special report of the \nIntergovernmental Panel on Climate Change on the impacts of global warming of \n1.5 degrees Celsius above pre-industrial levels and related global greenhouse gas \nemission pathways, in the context of strengthening the global response to the threat \nof climate change, sustainable development and efforts to eradicate poverty, \n \nRecalling its resolution 73/242 of 20 December 2018 on the follow-up to the \nFourth United Nations Conference on the Least Developed Countries, \n \nRecalling also Economic and Social Council resolution 2019/3 of 6 June 2019 on \nthe Programme of Action for the Least Developed Countries for the Decade 2011\u20132020, \n \nTaking note of the 2019 Ministerial Declaration of the Least Developed Countries,7 \n__________________ \n \n3  Adopted under the UNFCCC in FCCC/CP/2015/10/Add.1, decision 1/CP.21. \n \n4  United Nations, Treaty Series, vol. 1771, No. 30822. \n \n5  Resolution 71/256, annex. \n \n6  Resolution 69/283, annex II. \n \n7  A/74/475, annex. \n\nFollow-up to the Fourth United Nations Conference \non the Least Developed Countries \nA/RES/74/232\n \n3/11\n19-22505 \n \n \nRecalling its resolutions 59/209 of 20 December 2004 and 67/221 of \n21 December 2012 on a smooth transition for countries graduating from the list of \nleast developed countries, \n \nReaffirming its resolution 71/243 of 21 December 2016 on the quadrennial \ncomprehensive policy review of operational activities for development of the United \nNations system, as well its resolution 72/279 of 31 May 2018 on the repositioning of \nthe United Nations development system in the context of the quadrennial \ncomprehensive policy review of operational activities for development of the United \nNations system, and emphasizing the importance of their full and timely \nimplementation, \n \n1. \nTakes note of the report of the Secretary-General on the implementation of \nthe Programme of Action for the Least Developed Countries for the Decade 2011\u20132020;8 \n \n2. \nCalls upon the least developed countries, their development partners, the \nUnited Nations system and all other actors to further strengthen the Global \nPartnership for Sustainable Development for the least developed countries in all \npriority areas of the Istanbul Programme of Action2 in order to ensure the timely, \neffective and full implementation of the Programme of Action during the remainder \nof the decade, in the context of the 2030 Agenda for Sustainable Development, 9 the \nAddis Ababa Action Agenda of the Third International Conference on Financing for \nDevelopment, 10  which is an integral part of the 2030 Agenda, supports and \ncomplements it and helps to contextualize its means of implementation targets with \nconcrete policies and actions, the Paris Agreement3 adopted under the United Nations \nFramework Convention on Climate Change,4 the Sendai Framework for Disaster Risk \nReduction 2015\u201320306 and the New Urban Agenda;5 \n \n3. \nInvites the private sector, civil society, academia and foundations to \ncontribute to the implementation of the Istanbul Programme of Action in their \nrespective areas of competence, in line with the national priorities of the least \ndeveloped countries; \n \n4. \nRecalls the agreement contained in the 2030 Agenda for Sustainable \nDevelopment that effective linkages will be made with the follow-up and review \narrangements of all relevant United Nations conferences and processes, including on \nthe least developed countries, underlines the importance of strong synergy in the \nimplementation of the recently adopted agendas and the Istanbul Programme of \nAction at all levels, and encourages coordination and coherence in the follow-up of \ntheir implementation; \n \n5. \nReaffirms that the least developed countries, as the most vulnerable group \nof countries, need enhanced global support to overcome the structural challenges that \nthey face in implementing the 2030 Agenda for Sustainable Development, and in this \nregard calls upon the international community to prioritize and strengthen support \nfrom all sources to facilitate the coordinated implementation and coherent follow-up \nand monitoring of the Istanbul Programme of Action, the 2030 Agenda and the Addis \nAbaba Action Agenda in the least developed countries; \n \n6. \nCalls upon the United Nations Conference on Trade and Development to \nfocus, within existing resources, its analytical work on the least developed countries, \nwith an emphasis on productive capacities, and their measurement, on structural \ntransformation and on their trade and development linkages, as a contribution to the \n__________________ \n \n8  A/74/69-E/2019/12. \n \n9  Resolution 70/1. \n \n10  Resolution 69/313, annex. \n\nA/RES/74/232 \nFollow-up to the Fourth United Nations Conference\non the Least Developed Countries\n \n19-22505\n4/11 \n \nunderstanding of the fundamental mechanisms leading the least developed countries \nto overcome their structural handicaps and reach their development goals; \n \n7. \nRecognizes that significant additional domestic public and private \nresources, including at the subnational level, supplemented by international \nassistance and foreign direct investment, as appropriate, will be critical for the \nrealization of sustainable development and the achievement of the Sustainable \nDevelopment Goals, and that the 2030 Agenda for Sustainable Development and the \nAddis Ababa Action Agenda acknowledge the centrality of domestic resource \nmobilization, underscored by the principle of national ownership; \n \n8. \nAlso recognizes that, while the least developed countries have made \nconsiderable efforts to mobilize domestic resources and attract private investment, \nfurther progress is needed; \n \n9. \nExpresses its concern that, while the least developed countries are in need \nof increased global support, bilateral official development assistance to those \ncountries declined by 3 per cent in real terms in 2018 compared with 2017 after \nincreasing by 4 per cent in 2017 compared with 2016, and, expressing its appreciation \nto those countries that have met or surpassed their commitments to providing at least \n0.7 per cent of gross national income for official development assistance to \ndeveloping countries and the target of 0.15 to 0.20 per cent of gross national income \nfor official development assistance to the least developed countries, urges all others \nto step up efforts to increase their official development assistance and to make \nadditional concrete efforts towards the official development assistance targets, \nreiterates that the fulfilment of all official development assistance commitments \nremains crucial, calls upon developed countries to fulfil their respective official \ndevelopment assistance commitments to the least developed countries, and \nencourages official development assistance providers to consider setting a target to \nprovide at least 0.2 per cent of gross national income for official development \nassistance to the least developed countries, while reiterating that an important use of \ninternational public finance, including official development assistance, is to catalyse \nadditional resource mobilization from other sources, public and private; \n \n10. Is encouraged by those countries that are allocating at least 50 per cent of \ntheir official development assistance to the least developed countries; \n \n11. \nWelcomes continued efforts to improve the quality, impact and effectiveness \nof development cooperation and other international efforts in public finance, including \nadherence to agreed development cooperation effectiveness principles; \n \n12. Calls upon the developing countries, guided by the spirit of solidarity and \nconsistent with their capabilities, to provide support for the effective implementation \nof the Istanbul Programme of Action in mutually agreed areas of cooperation within \nthe framework of South-South cooperation, which is a complement to but not a \nsubstitute for North-South cooperation; \n \n13. Notes that exports of goods and services of the least developed countries \nincreased by 12 per cent in 2018 compared with 2017, expresses its concern that the \nshare of goods and services exports, which stood at 0.94 per cent in 2018, remains far \nfrom the target of 2 per cent of global exports called for in the Istanbul Programme \nof Action and target 17.11 of the Sustainable Development Goals, also expresses its \nconcern that the overall trade deficit of the least developed countries continues to \nincrease and has doubled since 2011, and calls upon the least developed countries and \ntheir development partners to take the measures necessary to further accelerate \nprogress, with a view to achieving the targets of the Programme of Action and the \n2030 Agenda for Sustainable Development; \n\nFollow-up to the Fourth United Nations Conference \non the Least Developed Countries \nA/RES/74/232\n \n5/11\n19-22505 \n \n \n14. Urges the least developed countries and their development partners to \nmake use of existing initiatives and programmes, such as the relevant ministerial \ndecisions of the World Trade Organization on duty-free and quota-free market access \nfor the least developed countries and on preferential rules of origin for those \ncountries, as well as aid for trade, reiterates its commitment to increasing aid-for-\ntrade support, in particular for the least developed countries, striving to allocate an \nincreasing proportion of aid for trade to the least developed countries, in accordance \nwith development cooperation effectiveness principles, welcomes additional \ncooperation among developing countries to that end, and encourages the least \ndeveloped countries to mainstream trade in their national development plans; \n \n15. Recognizes that the \nleast developed \ncountries \nface \nsignificant \ninfrastructure gaps, including in the areas of transport, energy, water, sanitation and \ninformation and communications technology, and reaffirms the need to promote \nquality, reliable, sustainable and resilient infrastructure and to enhance infrastructure \nconnectivity with concrete actions, maximizing synergies in infrastructure planning \nand development; \n \n16. Emphasizes that the acute energy gap faced by the least developed \ncountries is a severe constraint on their structural transformation, and stresses that \nspecial attention should be given to the least developed countries, focusing on the \nspecific sustainable energy challenges of the least developed countries with specific \nprogrammes and multi-stakeholder partnerships tailored to meet the needs of those \ncountries, throughout the United Nations Decade of Sustainable Energy for All \n(2014\u20132024), including UN-Energy, with a view to ensuring the realization of the \nobjective of access to affordable, reliable, sustainable and modern energy for all by \n2030 and to addressing the infrastructure needs of the least developed countries; \n \n17. Recognizes the significant potential of regional economic integration and \ninterconnectivity to promote trade, inclusive growth and sustainable development in \nthe least developed countries, and stresses the need to strengthen regional cooperation \nto improve connectivity and competitiveness, increase productivity, lower transaction \ncosts, expand markets and enable the least developed countries to integrate into \nregional and global value chains; \n \n18. Also recognizes that maintaining sustainable debt levels is the \nresponsibility of the borrowing countries, while acknowledging that lenders also have \na responsibility to lend in such a way that does not undermine a country\u2019s debt \nsustainability, recalls the need to strengthen information-sharing and transparency to \nmake sure that debt sustainability assessments are based on comprehensive, objective \nand reliable data, encourages Member States to work towards global consensus and \nbest practices on guidelines for debtor and creditor responsibilities in borrowing by \nand lending to sovereigns, building on existing initiatives, and underlines that the \ndebt sustainability framework for the least developed countries should systematically \ntake into account their structural constraints and longer-term investment requirements \nfor the implementation of the Sustainable Development Goals; \n \n19. Expresses its deep concern that a number of the least developed countries \nare in debt distress or at high risk of debt distress11 and that the ratio of debt service \nto exports has worsened sharply, rising from 4.2 per cent in 2008 to 9.4 per cent in \n2018, underlines the urgent need to address the debt problems of the least developed \ncountries, stresses the need for the international community to remain vigilant in \nmonitoring the debt situation of the least developed countries and to continue to take \neffective measures, preferably within existing frameworks, when applicable, to \naddress the debt problem of those countries, including through coordinated policies \n__________________ \n \n11  See International Monetary Fund, Debt Sustainability Analysis: Low-Income Countries. \n\nA/RES/74/232 \nFollow-up to the Fourth United Nations Conference\non the Least Developed Countries\n \n19-22505\n6/11 \n \naimed at fostering debt financing, debt relief, debt restructuring and sound debt \nmanagement, as appropriate, for the multilateral and bilateral debt owed by the least \ndeveloped countries to creditors, both public and private, reiterates its commitment \nto working through existing initiatives, such as the Heavily Indebted Poor Countries \nInitiative and the Multilateral Debt Relief Initiative, and reaffirms the importance of \ntransparency in debt management; \n \n20. Notes that foreign direct investment flows to the least developed countries \nincreased by 15 per cent in 2018 compared with 2017, after two consecutive years of \ndecline, by 17 per cent in 2017 and 13 per cent in 2016, and continued to concentrate \non extractive and related industries, and underlines the need to take the measures \nnecessary at all levels to further accelerate foreign direct investment in the least \ndeveloped countries; \n \n21. Encourages the least developed countries, in accordance with their \nnational plans and priorities and with the full support of their development partners, \nto develop their capacities to track financial transactions, administer taxation and \nregulate customs and to redouble their efforts to substantially reduce illicit financial \nflows by 2030, with a view to eventually eliminating them, including by combating \ntax evasion and corruption through strengthened national regulation, and also \nencourages the United Nations and other relevant international bodies to help to \nsupport these efforts, in accordance with their respective mandates; \n \n22. Recalls target 17.5 of the Sustainable Development Goals, in which the \nGeneral Assembly decided to adopt and implement investment promotion regimes for \nthe least developed countries, and underlines the need for its early implementation, \ninvites the Secretary-General, in his capacity as the Chair of the United Nations \nSystem Chief Executives Board for Coordination, to retain the issue of investment \npromotion regimes for the least developed countries on the agenda of the Board, with \na view to enhancing the overall effectiveness of the support provided by the United \nNations system to increase the flow of foreign direct investment to the least developed \ncountries and the ability of those countries to attract such investment, and in that \ncontext recalls the initiative of the Office of the High Representative for the Least \nDeveloped Countries, Landlocked Developing Countries and Small Island \nDeveloping States, jointly with the United Nations Conference on Trade and \nDevelopment, the United Nations Industrial Development Organization, the \nInternational Labour Organization, the Enhanced Integrated Framework and the \nWorld Association of Investment Promotion Agencies, to set up a capacity-\ndevelopment programme for the investment promotion agencies of the least \ndeveloped countries, and calls for financial support to operationalize this programme; \n \n23. Notes the importance of the work of the Technology Bank for the Least \nDeveloped Countries in improving the scientific research and innovation base of such \ncountries, promoting networking among researchers and research institutions, helping \nsuch countries to access and utilize critical technologies, and drawing together \nbilateral initiatives and support by multilateral institutions and the private sector, and \nimplementing projects contributing to the use of science, technology and innovation \nfor economic development in the least developed countries, takes note with \nappreciation of the contributions that Bangladesh, Guinea, India, Norway and Turkey \nhave made, as well as the pledges made by the Sudan, and invites Member States, as \nwell as international organizations, foundations and the private sector, to provide \nvoluntary financial contributions and technical assistance to the Technology Bank to \nensure its effective operation; \n \n24. Expresses its deep concern that the least developed countries are facing \nunprecedented challenges owing to rapidly escalating climate risks and significant \ncapacity constraints and are disproportionately affected by the adverse impacts of \n\nFollow-up to the Fourth United Nations Conference \non the Least Developed Countries \nA/RES/74/232\n \n7/11\n19-22505 \n \nclimate change as well as the impact and the rise in frequency of natural and human-\nmade disasters, which further threaten food security, health and efforts to eradicate \npoverty and achieve the Sustainable Development Goals, and expresses its concern \nthat women and girls are often disproportionately affected by the impacts of climate \nchange and other environmental issues; \n \n25. Welcomes the 2019 Climate Action Summit convened by the Secretary-\nGeneral on 23 September, and notes the multi-partner initiatives and commitments \npresented during the Summit; \n \n26. Recognizes that disasters, many of which are exacerbated by climate \nchange, and which are increasing in frequency and intensity, significantly impede \nprogress towards sustainable development, and also recognizes the synergies between \nthe implementation of the Paris Agreement and the 2030 Agenda for Sustainable \nDevelopment, acknowledges the importance of continued support for and \ninternational cooperation on adaptation and mitigation efforts and on strengthening \nresilience, stresses the necessity of adequate and predictable financial resources from \na variety of sources, including public and private ones, highlights the specific needs \nand special circumstances of developing countries, especially those that are \nparticularly vulnerable to the adverse effects of climate change, recognizes that \neffective disaster risk management contributes to sustainable development, and in this \nregard underlines the importance of strengthening disaster risk reduction and early \nwarning systems in order to minimize the consequences of disasters; \n \n27. Underlines the need to reduce the vulnerability of the least developed \ncountries to economic, natural and environmental shocks and disasters, as well as \nclimate change, and to enhance their ability to meet these and other challenges by \nstrengthening their resilience, and in this regard stresses that it is important that all \ncountries and other actors work together to further develop and implement concrete \nmeasures, on an urgent basis, at the national and international levels so as to build the \nresilience of the least developed countries to withstand economic shocks and mitigate \ntheir adverse effects, to withstand and overcome the adverse effects of climate \nchange, to enhance sustainable growth and protect biodiversity and to withstand \nnatural hazards in order to reduce the risk of disasters, as agreed upon in the Istanbul \nProgramme of Action; \n \n28. Also underlines the need to address the economic, social and \nenvironmental impacts of climate change, and emphasizes the need for national and \ninternational action to enhance efforts to build resilience, especially for the most \nvulnerable, including by mainstreaming resilience into investment decision-making, \nbuilding resilience through the sustainable management of ecosystems and value \nchains, building the resilience of health systems and building resilience to reduce the \nimpact and cost of natural disasters; \n \n29. Further underlines the importance of improving the coordination and \neffectiveness of resilience-building initiatives for the least developed countries by \nleveraging existing measures at the national, regional and global levels to respond to \nvarious types of disasters and shocks, as elaborated in the report of the Secretary-\nGeneral on crisis mitigation and resilience-building for the least developed countries;12 \n \n30. Encourages countries to develop national and local disaster risk reduction \nstrategies by 2020 in accordance with target (e) of the Sendai Framework, recognizes \nthe importance of promoting their alignment and integration with sustainable \ndevelopment and climate change adaptation strategies, also recognizes that the \ndevelopment of climate change adaptation and national disaster risk reduction \nstrategies by 2020 is an opportunity to maximize synergies across the Sustainable \n__________________ \n \n12  A/72/270. \n\nA/RES/74/232 \nFollow-up to the Fourth United Nations Conference\non the Least Developed Countries\n \n19-22505\n8/11 \n \nDevelopment Goals, the Paris Agreement and the Sendai Framework, and in this \nregard calls for disaster risk reduction to be considered in the review of and follow-up \nto the Istanbul Programme of Action; \n \n31. Reiterates the call to substantially enhance international cooperation with \ndeveloping countries through adequate and sustainable support to complement their \nnational actions for the implementation of the Sendai Framework by 2030; \n \n32. Underlines the importance of peaceful and inclusive societies for the \nachievement of the Sustainable Development Goals, and recalls the objectives of the \nIstanbul Programme of Action of enhancing good governance at all levels by \nstrengthening democratic processes, building effective, accountable and inclusive \ninstitutions and the rule of law; increasing efficiency, coherence, transparency and \nparticipation; advancing gender equality and the empowerment of women and girls; \nprotecting and promoting human rights and fundamental freedoms; reducing \ncorruption and curbing illicit financial flows; and strengthening the capacity of the \nGovernments of the least developed countries to play an effective role in their \neconomic and social development; \n \n33. Recognizes the importance of developing domestic capital markets in the \nleast developed countries, which can help to channel the growing pool of domestic \nsavings towards productive investments, reaffirms its commitment to enhancing \ninternational support in developing domestic capital markets in developing countries, \nin particular in the least developed countries, and reaffirms its commitment to \nworking to strengthen capacity-building in this area, including through regional, \ninterregional and global forums for knowledge-sharing, technical assistance and data-\nsharing, on mutually agreed terms; \n \n34. Reaffirms that achieving gender equality, the empowerment of all women \nand girls and the full realization of the human rights of all people is essential to \nachieving sustained, inclusive and equitable economic growth and sustainable \ndevelopment, and reiterates the need for gender mainstreaming, including targeted \nactions and investments in the formulation and implementation of all financial, \neconomic, environmental and social policies in the least developed countries; \n \n35. Notes with concern that continued rapid population growth in the least \ndeveloped countries, which is currently 2.3 per cent annually, is projected to double \nthe population of many of them between 2019 and 2050, notes that, in the least \ndeveloped countries, the number of adolescents and youth aged from 15 to 24 years \nis projected to grow from 207 million in 2019 to 336 million in 2050, and underlines \nthe importance of integrating population dynamics into national development \nstrategies and plans to facilitate targeted investment in the health and modern science-\nbased education of the young people who will soon join the labour force, with a view \nto ensuring their successful integration into the labour market and leveraging the \nopportunities presented by the demographic dividend; \n \n36. Recognizes that particular efforts are needed to ensure that all young \npeople, including girls, enjoy access to lifelong learning opportunities and equal \naccess to quality education at all levels, inclusive of early childhood, primary, \nsecondary and tertiary education, as well as technical and vocational training, notes \nwith concern, in this regard, the lack of progress in closing gender gaps in access to, \nretention in and completion of secondary education, recognizes the need to continue \nto provide and encourage, as appropriate, institutes of higher education to allocate \nplaces and scholarships for students and trainees from the least developed countries, \nin particular in the fields of science, technology, business management and economics, \nand to strengthen support for institutions in relation to gender equality and the \nempowerment of women at the global, regional and national levels, and recognizes \n\nFollow-up to the Fourth United Nations Conference \non the Least Developed Countries \nA/RES/74/232\n \n9/11\n19-22505 \n \nthat the least developed countries have the most to gain from sustainable development \nand utilizing the full skills and talents of their people, including women and girls; \n \n37. Also recognizes that increasing participation, supporting the empowerment \nof civil society, youth and women and strengthening collective action will contribute \nto the eradication of poverty and the achievement of sustainable development; \n \n38. Congratulates those countries that have met the criteria for graduation \nfrom least developed country status, notes with appreciation that several of the least \ndeveloped countries have expressed their intention to reach the status of graduation \nby 2020, invites those countries to start the preparations for their graduation and \ntransition strategy, and requests all relevant organizations of the United Nations \nsystem, led by the Office of the High Representative, to extend the necessary support \nin this regard, in a coordinated manner; \n \n39. Acknowledges that the graduation of a country symbolizes its considerable \nlong-term socioeconomic progress, prevailing over the structural handicaps to \nsocioeconomic development, and that it also presents many challenges for graduated \ncountries, which continue to face vulnerabilities to various shocks and crises; \n \n40. Invites the least developed countries and development partners to integrate \ngraduation and smooth transition strategies into their respective national development \nand aid strategies, as appropriate, including capacity-building and technical \nassistance to diversify sources of financing; \n \n41. Notes with appreciation that some development partners have extended \nsome of the benefits specific to the least developed countries to countries that have \ngraduated, taking into account the challenges that they continue to face, and invites \nall development partners to strengthen their support for graduation and smooth \ntransition so that graduating and recently graduated countries can minimize disruption \nin their development trajectory; \n \n42. Invites countries that are found eligible for graduation to establish a \nconsultative mechanism, in line with General Assembly resolution 67/221, to prepare \nthe transition strategy as early as possible, engaging all relevant donors and \nstakeholders; \n \n43. Recognizes that the activities relating to the least developed countries \ncarried out within the Secretariat need to be further coordinated and consolidated in \norder to ensure the effective monitoring and follow-up of the Istanbul Programme of \nAction, led by the Office of the High Representative, and to provide well-coordinated \nsupport to realizing the goal of enabling half of the least developed countries to meet \nthe criteria for graduation by 2020; \n \n44. Welcomes the work of the Inter-Agency Consultative Group for Least \nDeveloped Countries, led by the Office of the High Representative, notes the steps \ntaken by the United Nations System Chief Executives Board for Coordination and the \nHigh-level Committee on Programmes in supporting the coordination and follow-up \nof the implementation of the Istanbul Programme of Action on a system-wide basis, \nand reiterates its invitation to the Secretary-General, in his capacity as Chair of the \nChief Executives Board, to include the implementation of the Programme of Action \nin the agenda of the Board; \n \n45. Welcomes and accepts with appreciation the generous offer of the \nGovernment of Qatar to host the Fifth United Nations Conference on the Least \nDeveloped Countries in Doha; \n\nA/RES/74/232 \nFollow-up to the Fourth United Nations Conference\non the Least Developed Countries\n \n19-22505\n10/11 \n \n \n46. Decides to convene the Fifth United Nations Conference on the Least \nDeveloped Countries in Doha from 21 to 25 March 2021 at the highest possible level, \nincluding Heads of State and Government, in line with the mandate specified in its \nresolution 73/242; \n \n47. Also decides that the meeting of the intergovernmental preparatory \ncommittee agreed upon in paragraph 43 of its resolution 73/242 shall be organized in \nNew York in two parts, from 27 to 30 July 2020 and from 11 to 15 January 2021, of \nno more than five working days each; \n \n48. Further decides to establish the bureau of the Preparatory Committee, \nconsisting of two members of each regional group, that Qatar, as the host country, and \nMalawi, as the Chair of the Group of Least Developed Countries, will serve as \nex officio members of the bureau and that the bureau will be co-chaired by two \nMember States, one a developed State and one a developing State; \n \n49. Invites Qatar to host, with the assistance of the Office of the High \nRepresentative, within its existing mandate and resources, a segment during the \nConference to commemorate the fiftieth anniversary of the establishment of the \nGroup of Least Developed Countries, and encourages relevant representatives of \nMember States to participate therein; \n \n50. Invites the Secretary-General to convene a United Nations system high-\nlevel event during the Conference, with a view to ensuring the full mobilization of \nthe United Nations system in support of the least developed countries; \n \n51. Requests the President of the General Assembly and the President of the \nEconomic and Social Council to organize a half-day dedicated thematic event in the \nfirst semester of 2020 in order to provide substantive input to the Conference; \n \n52. Stresses the importance of the effective participation of all relevant \nstakeholders, including parliamentarians, civil society and the private sector, in the \nConference and its preparatory process, and decides: \n \n(a) \nTo invite non-governmental organizations that are in consultative status \nwith the Economic and Social Council to register with the Secretariat in order to \nparticipate in the Conference and its preparatory process; \n \n(b) \nTo request the President of the General Assembly to draw up a list of \nrepresentatives of other relevant non-governmental organizations, civil society \norganizations, academic institutions and the private sector who may participate in the \nConference and its preparatory process as observers, taking into account the \nprinciples of transparency and of equitable geographical representation and with due \nregard for the participation of women, and to submit the proposed list to Member \nStates for their consideration on a non-objection basis and bring the list to the \nattention of the Assembly;13 \n \n53. \nRequests the organs, organizations, funds and programmes of the United \nNations system to undertake sectoral appraisals in their respective fields of competence \non the implementation of the Istanbul Programme of Action, with special emphasis on \nareas where implementation has remained insufficient, and to make proposals for new \nmeasures, as necessary, as further inputs to the preparation for the Conference, and in \nthis regard affirms that appropriate inter-agency meetings should be convened in order \nto ensure the full mobilization and coordination of the entire United Nations system, \nincluding the United Nations Development Programme, the United Nations Conference \n__________________ \n \n13  The list of proposed as well as final names will be brought to the attention of the General Assembly. \nWhere a name is objected to, the objecting Member State will, on a voluntary basis, make known to \nthe Office of the President of the General Assembly the general basis of its objections and the Office \nwill share any information received with any Member State upon its request. \n\nFollow-up to the Fourth United Nations Conference \non the Least Developed Countries \nA/RES/74/232\n \n11/11\n19-22505 \n \non Trade and Development, the World Bank Group, the International Monetary Fund \nand regional bodies according to their respective mandates; \n \n54. Decides that the Office of the High Representative shall be the focal point \nfor the substantive and organizational preparations for the Conference, in accordance \nwith mandates given in General Assembly resolution 56/227 of 24 December 2001, \nto ensure that those preparations are carried out effectively and to mobilize and \ncoordinate the active involvement of the entire United Nations system; \n \n55. Also decides that the Under-Secretary-General and High Representative \nfor the Least Developed Countries, Landlocked Developing Countries and Small \nIsland Developing States shall serve as the Secretary-General of the Conference, and \nbe responsible for making the arrangements necessary for carrying out the work of \nthe Conference; \n \n56. Reiterates the critical importance of the full and effective participation of \nthe least developed countries in the Conference and its preparatory processes at the \nnational, regional and global levels, stresses that adequate resources should be \nprovided, and in this regard requests the Secretary-General to mobilize voluntary \ncontributions in order to cover the cost of the participation of government \nrepresentatives from the least developed countries; \n \n57. Invites \nGovernments, \nintergovernmental \nand \nnon-governmental \norganizations, major groups and other donors to contribute in a timely manner to the \ntrust fund in support of activities undertaken by the Office of the High Representative \nto support the implementation, follow-up and monitoring of the Istanbul Programme \nof Action and the participation of the representatives from the least developed \ncountries in the high-level political forum on sustainable development of the \nEconomic and Social Council as well as in other relevant forums and the Conference \nand its preparatory process, and in this regard expresses its appreciation to those \ncountries that have made voluntary contributions to the trust fund; \n \n58. Requests the Secretary-General, with the assistance of relevant \norganizations and bodies of the United Nations system, including the Department of \nGlobal Communications of the Secretariat, in collaboration with the Office of the \nHigh Representative, to take the measures necessary to intensify their public \ninformation efforts and other appropriate initiatives to enhance public awareness of \nthe Conference, including by highlighting its objectives and its significance; \n \n59. Also requests the Secretary-General to submit to the General Assembly at \nits seventy-fifth session a report on the implementation of the Istanbul Programme of \nAction over the past 10 years, identifying, inter alia, progress made, lessons learned \nand best practices, as well as structural constraints and handicaps encountered in \nachieving the objectives of the Programme of Action, and decides to include in the \nprovisional agenda of its seventy-fifth session, under the item entitled \u201cGroups of \ncountries in special situations\u201d, the sub-item entitled \u201cFollow-up to the Fourth United \nNations Conference on the Least Developed Countries\u201d. \n \n52nd plenary meeting \n19 December 2019 \n \n",
  "paragraphs": {
    "1": "Takes note of the report of the Secretary-General on the implementation of the Programme of Action for the Least Developed Countries for the Decade 2011\u20132020;8",
    "2": "Calls upon the least developed countries, their development partners, the United Nations system and all other actors to further strengthen the Global Partnership for Sustainable Development for the least developed countries in all priority areas of the Istanbul Programme of Action2 in order to ensure the timely, effective and full implementation of the Programme of Action during the remainder of the decade, in the context of the 2030 Agenda for Sustainable Development, 9 the Addis Ababa Action Agenda of the Third International Conference on Financing for Development, 10 which is an integral part of the 2030 Agenda, supports and complements it and helps to contextualize its means of implementation targets with concrete policies and actions, the Paris Agreement3 adopted under the United Nations Framework Convention on Climate Change,4 the Sendai Framework for Disaster Risk Reduction 2015\u201320306 and the New Urban Agenda;5",
    "3": "Invites the private sector, civil society, academia and foundations to contribute to the implementation of the Istanbul Programme of Action in their respective areas of competence, in line with the national priorities of the least developed countries;",
    "4": "Recalls the agreement contained in the 2030 Agenda for Sustainable Development that effective linkages will be made with the follow-up and review arrangements of all relevant United Nations conferences and processes, including on the least developed countries, underlines the importance of strong synergy in the implementation of the recently adopted agendas and the Istanbul Programme of Action at all levels, and encourages coordination and coherence in the follow-up of their implementation;",
    "5": "Reaffirms that the least developed countries, as the most vulnerable group of countries, need enhanced global support to overcome the structural challenges that they face in implementing the 2030 Agenda for Sustainable Development, and in this regard calls upon the international community to prioritize and strengthen support from all sources to facilitate the coordinated implementation and coherent follow-up and monitoring of the Istanbul Programme of Action, the 2030 Agenda and the Addis Ababa Action Agenda in the least developed countries;",
    "6": "Calls upon the United Nations Conference on Trade and Development to focus, within existing resources, its analytical work on the least developed countries, with an emphasis on productive capacities, and their measurement, on structural transformation and on their trade and development linkages, as a contribution to the understanding of the fundamental mechanisms leading the least developed countries to overcome their structural handicaps and reach their development goals;",
    "7": "Recognizes that significant additional domestic public and private resources, including at the subnational level, supplemented by international assistance and foreign direct investment, as appropriate, will be critical for the realization of sustainable development and the achievement of the Sustainable Development Goals, and that the 2030 Agenda for Sustainable Development and the Addis Ababa Action Agenda acknowledge the centrality of domestic resource mobilization, underscored by the principle of national ownership;",
    "8": "Also recognizes that, while the least developed countries have made considerable efforts to mobilize domestic resources and attract private investment, further progress is needed;",
    "9": "Expresses its concern that, while the least developed countries are in need of increased global support, bilateral official development assistance to those countries declined by 3 per cent in real terms in 2018 compared with 2017 after increasing by 4 per cent in 2017 compared with 2016, and, expressing its appreciation to those countries that have met or surpassed their commitments to providing at least 0.7 per cent of gross national income for official development assistance to developing countries and the target of 0.15 to 0.20 per cent of gross national income for official development assistance to the least developed countries, urges all others to step up efforts to increase their official development assistance and to make additional concrete efforts towards the official development assistance targets, reiterates that the fulfilment of all official development assistance commitments remains crucial, calls upon developed countries to fulfil their respective official development assistance commitments to the least developed countries, and encourages official development assistance providers to consider setting a target to provide at least 0.2 per cent of gross national income for official development assistance to the least developed countries, while reiterating that an important use of international public finance, including official development assistance, is to catalyse additional resource mobilization from other sources, public and private;",
    "10": "Is encouraged by those countries that are allocating at least 50 per cent of their official development assistance to the least developed countries;",
    "11": "Welcomes continued efforts to improve the quality, impact and effectiveness of development cooperation and other international efforts in public finance, including adherence to agreed development cooperation effectiveness principles;",
    "12": "Calls upon the developing countries, guided by the spirit of solidarity and consistent with their capabilities, to provide support for the effective implementation of the Istanbul Programme of Action in mutually agreed areas of cooperation within the framework of South-South cooperation, which is a complement to but not a substitute for North-South cooperation;",
    "13": "",
    "14": "Urges the least developed countries and their development partners to make use of existing initiatives and programmes, such as the relevant ministerial decisions of the World Trade Organization on duty-free and quota-free market access for the least developed countries and on preferential rules of origin for those countries, as well as aid for trade, reiterates its commitment to increasing aid-for- trade support, in particular for the least developed countries, striving to allocate an increasing proportion of aid for trade to the least developed countries, in accordance with development cooperation effectiveness principles, welcomes additional cooperation among developing countries to that end, and encourages the least developed countries to mainstream trade in their national development plans;",
    "15": "Recognizes that the least developed countries face significant infrastructure gaps, including in the areas of transport, energy, water, sanitation and information and communications technology, and reaffirms the need to promote quality, reliable, sustainable and resilient infrastructure and to enhance infrastructure connectivity with concrete actions, maximizing synergies in infrastructure planning and development;",
    "16": "Emphasizes that the acute energy gap faced by the least developed countries is a severe constraint on their structural transformation, and stresses that special attention should be given to the least developed countries, focusing on the specific sustainable energy challenges of the least developed countries with specific programmes and multi-stakeholder partnerships tailored to meet the needs of those countries, throughout the United Nations Decade of Sustainable Energy for All (2014\u20132024), including UN-Energy, with a view to ensuring the realization of the objective of access to affordable, reliable, sustainable and modern energy for all by 2030 and to addressing the infrastructure needs of the least developed countries;",
    "17": "Recognizes the significant potential of regional economic integration and interconnectivity to promote trade, inclusive growth and sustainable development in the least developed countries, and stresses the need to strengthen regional cooperation to improve connectivity and competitiveness, increase productivity, lower transaction costs, expand markets and enable the least developed countries to integrate into regional and global value chains;",
    "18": "Also recognizes that maintaining sustainable debt levels is the responsibility of the borrowing countries, while acknowledging that lenders also have a responsibility to lend in such a way that does not undermine a country\u2019s debt sustainability, recalls the need to strengthen information-sharing and transparency to make sure that debt sustainability assessments are based on comprehensive, objective and reliable data, encourages Member States to work towards global consensus and best practices on guidelines for debtor and creditor responsibilities in borrowing by and lending to sovereigns, building on existing initiatives, and underlines that the debt sustainability framework for the least developed countries should systematically take into account their structural constraints and longer-term investment requirements for the implementation of the Sustainable Development Goals;",
    "19": "Expresses its deep concern that a number of the least developed countries are in debt distress or at high risk of debt distress11 and that the ratio of debt service to exports has worsened sharply, rising from 4.2 per cent in 2008 to 9.4 per cent in 2018, underlines the urgent need to address the debt problems of the least developed countries, stresses the need for the international community to remain vigilant in monitoring the debt situation of the least developed countries and to continue to take effective measures, preferably within existing frameworks, when applicable, to address the debt problem of those countries, including through coordinated policies aimed at fostering debt financing, debt relief, debt restructuring and sound debt management, as appropriate, for the multilateral and bilateral debt owed by the least developed countries to creditors, both public and private, reiterates its commitment to working through existing initiatives, such as the Heavily Indebted Poor Countries Initiative and the Multilateral Debt Relief Initiative, and reaffirms the importance of transparency in debt management;",
    "20": "Notes that foreign direct investment flows to the least developed countries increased by 15 per cent in 2018 compared with 2017, after two consecutive years of decline, by 17 per cent in 2017 and 13 per cent in 2016, and continued to concentrate on extractive and related industries, and underlines the need to take the measures necessary at all levels to further accelerate foreign direct investment in the least developed countries;",
    "21": "Encourages the least developed countries, in accordance with their national plans and priorities and with the full support of their development partners, to develop their capacities to track financial transactions, administer taxation and regulate customs and to redouble their efforts to substantially reduce illicit financial flows by 2030, with a view to eventually eliminating them, including by combating tax evasion and corruption through strengthened national regulation, and also encourages the United Nations and other relevant international bodies to help to support these efforts, in accordance with their respective mandates;",
    "22": "Recalls target 17.5 of the Sustainable Development Goals, in which the General Assembly decided to adopt and implement investment promotion regimes for the least developed countries, and underlines the need for its early implementation, invites the Secretary-General, in his capacity as the Chair of the United Nations System Chief Executives Board for Coordination, to retain the issue of investment promotion regimes for the least developed countries on the agenda of the Board, with a view to enhancing the overall effectiveness of the support provided by the United Nations system to increase the flow of foreign direct investment to the least developed countries and the ability of those countries to attract such investment, and in that context recalls the initiative of the Office of the High Representative for the Least Developed Countries, Landlocked Developing Countries and Small Island Developing States, jointly with the United Nations Conference on Trade and Development, the United Nations Industrial Development Organization, the International Labour Organization, the Enhanced Integrated Framework and the World Association of Investment Promotion Agencies, to set up a capacity- development programme for the investment promotion agencies of the least developed countries, and calls for financial support to operationalize this programme;",
    "23": "Notes the importance of the work of the Technology Bank for the Least Developed Countries in improving the scientific research and innovation base of such countries, promoting networking among researchers and research institutions, helping such countries to access and utilize critical technologies, and drawing together bilateral initiatives and support by multilateral institutions and the private sector, and implementing projects contributing to the use of science, technology and innovation for economic development in the least developed countries, takes note with appreciation of the contributions that Bangladesh, Guinea, India, Norway and Turkey have made, as well as the pledges made by the Sudan, and invites Member States, as well as international organizations, foundations and the private sector, to provide voluntary financial contributions and technical assistance to the Technology Bank to ensure its effective operation;",
    "24": " climate change as well as the impact and the rise in frequency of natural and human- made disasters, which further threaten food security, health and efforts to eradicate poverty and achieve the Sustainable Development Goals, and expresses its concern that women and girls are often disproportionately affected by the impacts of climate change and other environmental issues;",
    "25": "Welcomes the 2019 Climate Action Summit convened by the Secretary- General on 23 September, and notes the multi-partner initiatives and commitments presented during the Summit;",
    "26": "Recognizes that disasters, many of which are exacerbated by climate change, and which are increasing in frequency and intensity, significantly impede progress towards sustainable development, and also recognizes the synergies between the implementation of the Paris Agreement and the 2030 Agenda for Sustainable Development, acknowledges the importance of continued support for and international cooperation on adaptation and mitigation efforts and on strengthening resilience, stresses the necessity of adequate and predictable financial resources from a variety of sources, including public and private ones, highlights the specific needs and special circumstances of developing countries, especially those that are particularly vulnerable to the adverse effects of climate change, recognizes that effective disaster risk management contributes to sustainable development, and in this regard underlines the importance of strengthening disaster risk reduction and early warning systems in order to minimize the consequences of disasters;",
    "27": "Underlines the need to reduce the vulnerability of the least developed countries to economic, natural and environmental shocks and disasters, as well as climate change, and to enhance their ability to meet these and other challenges by strengthening their resilience, and in this regard stresses that it is important that all countries and other actors work together to further develop and implement concrete measures, on an urgent basis, at the national and international levels so as to build the resilience of the least developed countries to withstand economic shocks and mitigate their adverse effects, to withstand and overcome the adverse effects of climate change, to enhance sustainable growth and protect biodiversity and to withstand natural hazards in order to reduce the risk of disasters, as agreed upon in the Istanbul Programme of Action;",
    "28": "Also underlines the need to address the economic, social and environmental impacts of climate change, and emphasizes the need for national and international action to enhance efforts to build resilience, especially for the most vulnerable, including by mainstreaming resilience into investment decision-making, building resilience through the sustainable management of ecosystems and value chains, building the resilience of health systems and building resilience to reduce the impact and cost of natural disasters;",
    "29": "Further underlines the importance of improving the coordination and effectiveness of resilience-building initiatives for the least developed countries by leveraging existing measures at the national, regional and global levels to respond to various types of disasters and shocks, as elaborated in the report of the Secretary- General on crisis mitigation and resilience-building for the least developed countries;12",
    "30": "Encourages countries to develop national and local disaster risk reduction strategies by 2020 in accordance with target (e) of the Sendai Framework, recognizes the importance of promoting their alignment and integration with sustainable development and climate change adaptation strategies, also recognizes that the development of climate change adaptation and national disaster risk reduction strategies by 2020 is an opportunity to maximize synergies across the Sustainable Development Goals, the Paris Agreement and the Sendai Framework, and in this regard calls for disaster risk reduction to be considered in the review of and follow-up to the Istanbul Programme of Action;",
    "31": "Reiterates the call to substantially enhance international cooperation with developing countries through adequate and sustainable support to complement their national actions for the implementation of the Sendai Framework by 2030;",
    "32": "Underlines the importance of peaceful and inclusive societies for the achievement of the Sustainable Development Goals, and recalls the objectives of the Istanbul Programme of Action of enhancing good governance at all levels by strengthening democratic processes, building effective, accountable and inclusive institutions and the rule of law; increasing efficiency, coherence, transparency and participation; advancing gender equality and the empowerment of women and girls; protecting and promoting human rights and fundamental freedoms; reducing corruption and curbing illicit financial flows; and strengthening the capacity of the Governments of the least developed countries to play an effective role in their economic and social development;",
    "33": "Recognizes the importance of developing domestic capital markets in the least developed countries, which can help to channel the growing pool of domestic savings towards productive investments, reaffirms its commitment to enhancing international support in developing domestic capital markets in developing countries, in particular in the least developed countries, and reaffirms its commitment to working to strengthen capacity-building in this area, including through regional, interregional and global forums for knowledge-sharing, technical assistance and data- sharing, on mutually agreed terms;",
    "34": "Reaffirms that achieving gender equality, the empowerment of all women and girls and the full realization of the human rights of all people is essential to achieving sustained, inclusive and equitable economic growth and sustainable development, and reiterates the need for gender mainstreaming, including targeted actions and investments in the formulation and implementation of all financial, economic, environmental and social policies in the least developed countries;",
    "35": "Notes with concern that continued rapid population growth in the least developed countries, which is currently 2.3 per cent annually, is projected to double the population of many of them between 2019 and 2050, notes that, in the least developed countries, the number of adolescents and youth aged from 15 to 24 years is projected to grow from 207 million in 2019 to 336 million in 2050, and underlines the importance of integrating population dynamics into national development strategies and plans to facilitate targeted investment in the health and modern science- based education of the young people who will soon join the labour force, with a view to ensuring their successful integration into the labour market and leveraging the opportunities presented by the demographic dividend;",
    "36": " that the least developed countries have the most to gain from sustainable development and utilizing the full skills and talents of their people, including women and girls;",
    "37": "Also recognizes that increasing participation, supporting the empowerment of civil society, youth and women and strengthening collective action will contribute to the eradication of poverty and the achievement of sustainable development;",
    "38": "Congratulates those countries that have met the criteria for graduation from least developed country status, notes with appreciation that several of the least developed countries have expressed their intention to reach the status of graduation by 2020, invites those countries to start the preparations for their graduation and transition strategy, and requests all relevant organizations of the United Nations system, led by the Office of the High Representative, to extend the necessary support in this regard, in a coordinated manner;",
    "39": "Acknowledges that the graduation of a country symbolizes its considerable long-term socioeconomic progress, prevailing over the structural handicaps to socioeconomic development, and that it also presents many challenges for graduated countries, which continue to face vulnerabilities to various shocks and crises;",
    "40": "Invites the least developed countries and development partners to integrate graduation and smooth transition strategies into their respective national development and aid strategies, as appropriate, including capacity-building and technical assistance to diversify sources of financing;",
    "41": "Notes with appreciation that some development partners have extended some of the benefits specific to the least developed countries to countries that have graduated, taking into account the challenges that they continue to face, and invites all development partners to strengthen their support for graduation and smooth transition so that graduating and recently graduated countries can minimize disruption in their development trajectory;",
    "42": "Invites countries that are found eligible for graduation to establish a consultative mechanism, in line with General Assembly resolution 67/221, to prepare the transition strategy as early as possible, engaging all relevant donors and stakeholders;",
    "43": "Recognizes that the activities relating to the least developed countries carried out within the Secretariat need to be further coordinated and consolidated in order to ensure the effective monitoring and follow-up of the Istanbul Programme of Action, led by the Office of the High Representative, and to provide well-coordinated support to realizing the goal of enabling half of the least developed countries to meet the criteria for graduation by 2020;",
    "44": "Welcomes the work of the Inter-Agency Consultative Group for Least Developed Countries, led by the Office of the High Representative, notes the steps taken by the United Nations System Chief Executives Board for Coordination and the High-level Committee on Programmes in supporting the coordination and follow-up of the implementation of the Istanbul Programme of Action on a system-wide basis, and reiterates its invitation to the Secretary-General, in his capacity as Chair of the Chief Executives Board, to include the implementation of the Programme of Action in the agenda of the Board;",
    "45": "",
    "46": "Decides to convene the Fifth United Nations Conference on the Least Developed Countries in Doha from 21 to 25 March 2021 at the highest possible level, including Heads of State and Government, in line with the mandate specified in its resolution 73/242;",
    "47": "Also decides that the meeting of the intergovernmental preparatory committee agreed upon in paragraph 43 of its resolution 73/242 shall be organized in New York in two parts, from 27 to 30 July 2020 and from 11 to 15 January 2021, of no more than five working days each;",
    "48": "Further decides to establish the bureau of the Preparatory Committee, consisting of two members of each regional group, that Qatar, as the host country, and Malawi, as the Chair of the Group of Least Developed Countries, will serve as ex officio members of the bureau and that the bureau will be co-chaired by two Member States, one a developed State and one a developing State;",
    "49": "Invites Qatar to host, with the assistance of the Office of the High Representative, within its existing mandate and resources, a segment during the Conference to commemorate the fiftieth anniversary of the establishment of the Group of Least Developed Countries, and encourages relevant representatives of Member States to participate therein;",
    "50": "Invites the Secretary-General to convene a United Nations system high- level event during the Conference, with a view to ensuring the full mobilization of the United Nations system in support of the least developed countries;",
    "51": "Requests the President of the General Assembly and the President of the Economic and Social Council to organize a half-day dedicated thematic event in the first semester of 2020 in order to provide substantive input to the Conference;",
    "52": "Stresses the importance of the effective participation of all relevant stakeholders, including parliamentarians, civil society and the private sector, in the Conference and its preparatory process, and decides: (a) To invite non-governmental organizations that are in consultative status with the Economic and Social Council to register with the Secretariat in order to participate in the Conference and its preparatory process; (b) To request the President of the General Assembly to draw up a list of representatives of other relevant non-governmental organizations, civil society organizations, academic institutions and the private sector who may participate in the Conference and its preparatory process as observers, taking into account the principles of transparency and of equitable geographical representation and with due regard for the participation of women, and to submit the proposed list to Member States for their consideration on a non-objection basis and bring the list to the attention of the Assembly;13",
    "53": "Requests the organs, organizations, funds and programmes of the United Nations system to undertake sectoral appraisals in their respective fields of competence on the implementation of the Istanbul Programme of Action, with special emphasis on areas where implementation has remained insufficient, and to make proposals for new measures, as necessary, as further inputs to the preparation for the Conference, and in this regard affirms that appropriate inter-agency meetings should be convened in order to ensure the full mobilization and coordination of the entire United Nations system, including the United Nations Development Programme, the United Nations Conference on Trade and Development, the World Bank Group, the International Monetary Fund and regional bodies according to their respective mandates;",
    "54": "Decides that the Office of the High Representative shall be the focal point for the substantive and organizational preparations for the Conference, in accordance with mandates given in General Assembly resolution 56/227 of 24 December 2001, to ensure that those preparations are carried out effectively and to mobilize and coordinate the active involvement of the entire United Nations system;",
    "55": "Also decides that the Under-Secretary-General and High Representative for the Least Developed Countries, Landlocked Developing Countries and Small Island Developing States shall serve as the Secretary-General of the Conference, and be responsible for making the arrangements necessary for carrying out the work of the Conference;",
    "56": "Reiterates the critical importance of the full and effective participation of the least developed countries in the Conference and its preparatory processes at the national, regional and global levels, stresses that adequate resources should be provided, and in this regard requests the Secretary-General to mobilize voluntary contributions in order to cover the cost of the participation of government representatives from the least developed countries;",
    "57": "Invites Governments, intergovernmental and non-governmental organizations, major groups and other donors to contribute in a timely manner to the trust fund in support of activities undertaken by the Office of the High Representative to support the implementation, follow-up and monitoring of the Istanbul Programme of Action and the participation of the representatives from the least developed countries in the high-level political forum on sustainable development of the Economic and Social Council as well as in other relevant forums and the Conference and its preparatory process, and in this regard expresses its appreciation to those countries that have made voluntary contributions to the trust fund;",
    "58": "Requests the Secretary-General, with the assistance of relevant organizations and bodies of the United Nations system, including the Department of Global Communications of the Secretariat, in collaboration with the Office of the High Representative, to take the measures necessary to intensify their public information efforts and other appropriate initiatives to enhance public awareness of the Conference, including by highlighting its objectives and its significance;",
    "59": "Also requests the Secretary-General to submit to the General Assembly at its seventy-fifth session a report on the implementation of the Istanbul Programme of Action over the past 10 years, identifying, inter alia, progress made, lessons learned and best practices, as well as structural constraints and handicaps encountered in achieving the objectives of the Programme of Action, and decides to include in the provisional agenda of its seventy-fifth session, under the item entitled \u201cGroups of countries in special situations\u201d, the sub-item entitled \u201cFollow-up to the Fourth United Nations Conference on the Least Developed Countries\u201d."
  },
  "agenda_items": [
    "Item 21"
  ],
  "symbol_references": []
}