{
  "symbol": "A/RES/79/319",
  "filename": "A_RES_79_319.pdf",
  "title": "79/319. Interaction between the United Nations, national parliaments and the Inter-Parliamentary Union",
  "text": "United Nations \nA/RES/79/319 \n \nGeneral Assembly \nDistr.: General \n29 July 2025 \n25-12359 (E) \n*2512359* \n \n \nSeventy-ninth session \nAgenda item 126 \nInteraction between the United Nations, national parliaments and \nthe Inter\u2011Parliamentary Union \n \n \n \n \n Resolution adopted by the General Assembly \non 25 July 2025 \n \n \n[without reference to a Main Committee (A/79/L.104)] \n \n \n 79/319. Interaction between the United Nations, national parliaments and \nthe Inter-Parliamentary Union \n \n \n \nThe General Assembly, \n \nRecalling the 2005 World Summit Outcome, 1 in which Heads of State and \nGovernment resolved to strengthen further cooperation between the United Nations \nand national parliaments through their world organization, the Inter-Parliamentary \nUnion, in all fields of the work of the United Nations, and considering the evolving \npolitical landscape over the past few years,  \n \nRecalling also its resolution 57/32 of 19 November 2002, in which the \nInter\u2011Parliamentary Union was invited to participate in the work of the General \nAssembly in the capacity of observer, and recalling further its resolution 72/278 of \n22 May 2018, in which the Assembly, inter alia, decided to strengthen the modalities \nof the cooperation between United Nations entities and the global parliamentary \ncommunity, \n \nTaking note of action 55 of the Pact for the Future adopted on 22 September \n2024,2 in which Member States pledge to deepen United Nations engagement with \nnational parliaments in United Nations intergovernmental bodies and processes, in \naccordance with national legislation, including through building on the efforts of the \nUnited Nations and the Inter-Parliamentary Union to engage parliamentarians to \nmaintain support for the implementation of relevant United Nations agreements and \nresolutions, \n \nTaking into consideration the Cooperation Agreement between the United \nNations and the Inter-Parliamentary Union of 1996,3 which laid the foundation for \n_______________ \n \n1 Resolution 60/1. \n \n2 Resolution 79/1. \n \n3 A/51/402, annex. \n\nA/RES/79/319 \nInteraction between the United Nations, national parliaments and \nthe Inter-Parliamentary Union\n \n25-12359\n2/7 \n \ncooperation between the two organizations, and recalling the revised Cooperation \nAgreement of 2016, \n \nTaking note of the resolutions adopted by the Inter-Parliamentary Union, as well \nas the many activities undertaken by that organization in support of the United \nNations, \n \nNoting the outcomes of the World Conferences of Speakers of Parliament held \nin 2000, 2005, 2010 and 2015, and in 2021 (preceded by a virtual segment in 2020), \nwhich affirm the commitment of national parliaments and the Inter-Parliamentary \nUnion to support the work of the United Nations, strengthen multilateralism and \ncontinue efforts to bridge the democracy gap in international relations, and further \nwelcoming the organization of the Sixth World Conference of Speakers of Parliament \nfrom 29 to 31 July 2025, as a high-level opportunity to engage parliamentarians on \nissues that are high on the United Nations agenda,  \n \nWelcoming the annual parliamentary hearings at the United Nations, as well as \nother specialized parliamentary meetings organized by the Inter-Parliamentary Union \nin cooperation with the United Nations to correspond to major United Nations \nconferences and events, \n \nRecognizing the work of the Inter-Parliamentary Union in mobilizing \nparliamentary action towards the implementation of the 2030 Agenda for Sustainable \nDevelopment,4 the Addis Ababa Action Agenda of the Third International Conference \non Financing for Development5 and the follow-up Fourth International Conference on \nFinancing for Development, held in Sevilla, Spain, the Sendai Framework for Disaster \nRisk Reduction 2015\u20132030,6 the Paris Agreement adopted under the United Nations \nFramework Convention on Climate Change7 the Beijing Declaration and Platform for \nAction,8 and relevant provisions in the Pact for the Future,  \n \nRecognizing also the work of the Inter-Parliamentary Union Standing \nCommittee on United Nations Affairs to provide a platform for regular interaction \nbetween parliamentarians and United Nations officials, including on the 2030 \nAgenda, implementation of international commitments and facilitate closer ties \nbetween the United Nations country teams and national parliaments,   \n \nRecognizing further the work of the Inter-Parliamentary Union in the areas of \ndemocracy and the rule of law, human rights, gender equality, the empowerment of \nall women and girls and eliminating all forms of violence against women and girls, \nyouth \nempowerment, \npeace \nand \nsecurity, \ndisarmament, \nnon\u2011proliferation, \nhumanitarian assistance, sustainable development, poverty eradication, food security \nand nutrition, climate change, health, interfaith and inter-ethnic dialogue, and \nartificial intelligence, as well as countering and preventing terrorism and violent \nextremism as and when conducive to terrorism,  \n \nDeeply concerned about all acts of sexual and gender-based violence, including \nsexual harassment, in political and in public life, including in digital contexts, as well \nas in parliaments and in leadership positions, and recognizing the work of the \nInter\u2011Parliamentary Union in combating such violence, \n \nHighlighting the importance of women\u2019s full, equal and meaningful \nparticipation in parliaments, including in leadership positions and in decision-making \n_______________ \n \n4 Resolution 70/1. \n \n5 Resolution 69/313, annex. \n \n6 Resolution 69/283, annex II. \n \n7 See FCCC/CP/2015/10/Add.1, decision 1/CP.21, annex. \n \n8 Report of the Fourth World Conference on Women, Beijing, 4\u201315 September 1995 (United \nNations publication, Sales No. E.96.IV.13), chap. I, resolution 1, annexes I and II. \n\nInteraction between the United Nations, national parliaments and \nthe Inter-Parliamentary Union \nA/RES/79/319\n \n3/7\n25-12359 \n \nat all levels, and the importance for parliaments to mainstream a gender perspective \nin their work, \n \nRecognizing multi-stakeholder efforts towards the achievement of gender \nequality and the empowerment of all women and girls, as well as the realization of \ntheir human rights, noting all relevant international, regional and national initiatives \nin this regard, and recognizing the participation of the Inter-Parliamentary Union in \nsuch initiatives, \n \nRecognizing and affirming that the global fight against racism, racial \ndiscrimination, xenophobia and related intolerance and all their abhorrent and \ncontemporary forms and manifestations is a matter of priority for the international \ncommunity, and recalling the launch of the United Nations Strategy and Plan of \nAction on Hate Speech in June 2019, \n \nInviting, in this regard, the Inter-Parliamentary Union to observe, in \ncollaboration with other relevant organizations, the international days aimed at \neliminating all forms of discrimination, addressing and countering hate speech and \npromoting interreligious and intercultural dialogue and the values of living together \nin peace, \n \nReaffirming the collective commitment to the purposes and principles of the \nCharter of the United Nations, calling for a reinvigorated multilateralism, including \nthrough respect for international humanitarian law, and recognizing the outcome of \nthe Fifth World Conference of Speakers of Parliament,9 which expresses support for \na reinvigorated United Nations system and for effective multilateral solutions to \ncurrent global challenges, \n \nMindful that rapid technological change includes new and powerful tools that \ncan help to realize the vision of the 2030 Agenda, and that the spread of information \nand communications technologies and global interconnectedness has great potential \nto accelerate human development and bridge all digital divides, among and within \ncountries, including the gender digital divide, and recognizing that national \nparliaments, among others, play an important role in addressing the impact, \nopportunities and challenges of rapid technological change, including artificial \nintelligence, \n \nRecognizing the efforts and the potential of the Technology Bank for the Least \nDeveloped Countries in helping those countries to implement the 2030 Agenda \nthrough strengthening their science, technology and innovation capacity, and \nacknowledging the important role of parliaments in developing strategies in these \nareas as well as overseeing their implementation, \n \nNoting the work carried out upon the request of Member States by agencies and \nprogrammes of the United Nations system, including the United Nations Sustainable \nDevelopment Group, in support of national parliaments around the world, \n \nAcknowledging the role and responsibility of national parliaments in regard to \nnational plans and strategies, as well as in ensuring greater transparency and \naccountability at both the national and the global levels, \n \n1. \nWelcomes the actions taken by the Inter-Parliamentary Union to continue \nto pursue a more systematic and meaningful engagement with the United Nations, and \nencourages both organizations to enhance their cooperation in meeting their common \nobjectives, focused on a number of thematic issues as well as the overarching goal of \n_______________ \n \n9 A/74/1011, enclosure. \n\nA/RES/79/319 \nInteraction between the United Nations, national parliaments and \nthe Inter-Parliamentary Union\n \n25-12359\n4/7 \n \nstrengthening multilateralism by bringing the people, through their parliamentary \nrepresentatives, closer to the United Nations;  \n \n2. \nEncourages the United Nations and the Inter-Parliamentary Union to \ncontinue to work closely in various fields, including the three dimensions of \nsustainable development \u2013 the economic, social and environmental \u2013 peacebuilding \nand sustaining peace, countering and preventing terrorism and violent extremism as \nand when conducive to terrorism, international law, human rights and fundamental \nfreedoms, combating racism, racial discrimination, xenophobia and related \nintolerance, promoting gender equality and the empowerment of all women and girls, \nyouth empowerment, democracy and good governance, poverty eradication, the use \nof information and communications technologies, including artificial intelligence, \nhealth, international migration, climate change, biodiversity, disaster risk reduction, \ncapacity-building and financing for development;  \n \n3. \nAlso encourages the United Nations and the Inter-Parliamentary Union to \nstrengthen cooperation by engaging parliamentarians in efforts to maintain support \nfor the implementation of relevant United Nations agreements and resolutions; \n \n4. \nWelcomes the work of the Inter-Parliamentary Union Standing Committee \non United Nations Affairs, inter alia, to familiarize parliamentarians with United \nNations reforms; \n \n5. \nEncourages the continued active involvement of the Inter-Parliamentary \nUnion in promoting the enhanced contribution of parliaments at the national, regional \nand global levels, including through multi-stakeholder partnerships, in support of the \naccelerated implementation and achievement of the Sustainable Development Goals \nby 2030; \n \n6. \nInvites parliaments and Governments to support the Technology Bank for \nthe Least Developed Countries in its efforts towards bridging digital divides, and \nencourages the Inter-Parliamentary Union to facilitate inter-parliamentary dialogue \non the role of science and technology in building a more peaceful and sustainable \nfuture and in the implementation of the 2030 Agenda for Sustainable Development;  \n \n7. \nWelcomes the efforts of the Inter-Parliamentary Union to work with \nnational parliaments to further accelerate climate action, as noted most recently in the \nNusa Dua Declaration of 24 March 2022 entitled \u201cGetting to zero: mobilizing \nparliaments to act on climate change\u201d, and encourages the secretariat of the United \nNations Framework Convention on Climate Change to engage closely with the \nInter\u2011Parliamentary Union in this area, as appropriate; \n \n8. \nAlso welcomes the efforts of the Inter-Parliamentary Union to promote \nuniversal health coverage and to address public health emergencies, such as the \nemergence of a new pandemic, and invites the World Health Organization, as the \nUnited Nations specialized agency for health, and other relevant agencies, funds and \nprogrammes of the United Nations system to enhance cooperation with the \nInter\u2011Parliamentary Union in this regard;  \n \n9. \nNotes the contribution of the Sixth World Conference of Speakers of \nParliament, organized by the Inter-Parliamentary Union in close cooperation with the \nUnited Nations, entitled \u201cA world in turmoil: parliamentary cooperation and \nmultilateralism for peace, justice and progress for all\u201d in the context of the eightieth \nanniversary of the United Nations in 2025;  \n \n10. Welcomes the practice of including parliamentarians as members of \nnational delegations to major United Nations meetings and events, as appropriate, and \ninvites Member States to continue this practice in a more regular and systematic \n\nInteraction between the United Nations, national parliaments and \nthe Inter-Parliamentary Union \nA/RES/79/319\n \n5/7\n25-12359 \n \nmanner, and with due consideration given to achieving gender balance within such \ndelegations; \n \n11. Invites Member States to further consider ways to work regularly with the \nInter-Parliamentary Union in facilitating a parliamentary component to major United \nNations conferences so as to help to inform such deliberations from a parliamentary \nperspective; \n \n12. Welcomes the contribution of the joint United Nations-Inter-Parliamentary \nUnion parliamentary hearing at the United Nations to ongoing United Nations \nprocesses, and invites the President of the General Assembly to include this annual \nmeeting in the official calendar of informal meetings organized under the auspices of \nthe General Assembly;  \n \n13. Encourages Member States to further extend the practice of holding \nparliamentary meetings in conjunction with major United Nations conferences and \nprocesses, with a view to including the outcome of these parliamentary meetings as a \nformal contribution to the respective United Nations processes; \n \n14. Welcomes \nthe \nenhanced \ncontribution \nof \nparliaments \nand \nthe \nInter\u2011Parliamentary Union to the work of the Human Rights Council and the human \nrights treaty bodies, and encourages parliaments to strengthen their role in the \npromotion and protection of human rights, with a view to translating international \ncommitments into national policies and laws; \n \n15. Encourages the United Nations Entity for Gender Equality and the \nEmpowerment of Women (UN-Women) and other relevant bodies of the United \nNations system to work closely with national parliaments and the Inter-Parliamentary \nUnion in accordance with their respective mandates and, upon request, in such areas \nas gender equality and the empowerment of women, including in conflict prevention \nand peace processes, institutional gender mainstreaming, support to parliaments in \npromoting gender-sensitive legislation, increasing the representation and full, equal \nand meaningful participation of women in parliaments, combating violence against \nwomen, including women in politics, and implementing relevant United Nations \nresolutions; \n \n16. Welcomes the contributions of the Inter-Parliamentary Union to the high-\nlevel political forum on sustainable development through the participation of \nparliamentarians, in convening the annual Parliamentary Forum at the high-level \npolitical forum to help to mobilize parliamentary action to advance the Sustainable \nDevelopment Goals, as well as through its efforts to encourage parliaments to engage \nin the voluntary national reviews of participating countries;  \n \n17. Encourages Member States to engage parliaments consistently and \nthroughout the voluntary national review process with a view to enhancing national \nownership of the Sustainable Development Goals and stepping up their \nimplementation by 2030;  \n \n18. Invites the Inter-Parliamentary Union and the relevant bodies of the United \nNations system to continue and enhance their cooperation in supporting Governments \nin facilitating the orderly, safe, regular and responsible migration and mobility of \npeople, including through the implementation of planned and well-managed \nmigration policies, and recalls the contribution of the Inter-Parliamentary Union in \nthe follow\u2011up process for the Global Compact for Safe, Orderly and Regular \nMigration;10 \n_______________ \n \n10 Resolution 73/195, annex. \n\nA/RES/79/319 \nInteraction between the United Nations, national parliaments and \nthe Inter-Parliamentary Union\n \n25-12359\n6/7 \n \n \n19. Welcomes the joint activities carried out by the Inter-Parliamentary Union, \nthe United Nations Office on Drugs and Crime and the Office of Counter-Terrorism \naimed at mobilizing parliamentary action to combat terrorism and violent extremism \nas and when conducive to terrorism, develop relevant good practices and counter-\nterrorism legislation, and support the victims of terrorism, in accordance with national \ncontext and international law; \n \n20. Takes note with appreciation of the work of the Inter-Parliamentary Union \nwith its member parliaments to facilitate the ratification and implementation of United \nNations disarmament and non\u2011proliferation treaties and conventions; \n \n21. Encourages the United Nations and the Inter-Parliamentary Union to \ndevelop closer cooperation with parliaments at the national and regional levels, \nincluding in terms of strengthening parliamentary capacities, inter alia, in regard to \nthe allocation of budgetary resources for the implementation of the 2030 Agenda and, \nas appropriate, the Pact for the Future, in reinforcing the rule of law and helping to \nalign national legislation with international commitments, and to facilitate, within \nexisting resources, greater South-South and triangular cooperation between \nparliaments and parliamentarians;  \n \n22. Encourages the United Nations to work with Member States, upon their \nrequest, to strengthen the institutional capacity of national parliaments through \ntechnical support, legal analysis, specific advice, training, monitoring and evaluation \nin all relevant areas; \n \n23. Recognizes that the contributions of young people are important for the \nfull and successful implementation of the 2030 Agenda, and urges Member States and \nUnited Nations entities, in consultation with youth, youth-led and youth-focused and \nyoung women\u2019s organizations, to explore and promote concrete new avenues for the \nfull, effective, structured, increased and sustainable participation of young people, \nyouth-led and young women\u2019s organizations in relevant decision-making processes \nand monitoring, in all spheres of political, economic, social and cultural life, \nincluding in designing and implementing policies, programmes and initiatives, in \nparticular when implementing the 2030 Agenda; \n \n24. Takes note of the Common Principles for Support to Parliaments pioneered \nby the Inter-Parliamentary Union and the United Nations Development Programme \nand endorsed by 153 national parliaments, 12 parliamentary assemblies and 21 partner \norganizations with a view to further strengthening the capacity of parliaments to \nperform their functions;  \n \n25. Calls upon United Nations country teams to develop, within their \nmandates and at the request of national authorities, a more structured and integrated \nmanner of working with national parliaments, through appropriate mechanisms, \nincluding reports on lessons learned and gaps to be filled, inter alia, by involving \nparliaments in consultations on national development strategies and on development \naid effectiveness, where applicable;  \n \n26. Calls upon United Nations entities to avail themselves more systematically \nof the unique expertise of the Inter-Parliamentary Union and its member parliaments \nin strengthening parliamentary institutions, particularly in countries emerging from \nconflict and/or in transition to democracy; \n \n27. Encourages the Secretary-General to include members of parliament, \nparticularly from the developing countries, in multi-stakeholder high-level advisory \ngroups as well as in mediation teams and other such exercises where a multiplicity of \nperspectives can help to ensure fair and lasting solutions to specific challenges; \n\nInteraction between the United Nations, national parliaments and \nthe Inter-Parliamentary Union \nA/RES/79/319\n \n7/7\n25-12359 \n \n \n28. Calls for regular annual exchanges and meetings at both the political and \nthe operational levels between senior officials of the United Nations and of the \nInter\u2011Parliamentary Union, with a view to building greater coherence in the work of \nthe two organizations and helping to forge a more robust strategic partnership between \nthem; \n \n29. Encourages the United Nations system to reflect more systematically the \nrole and contribution of parliaments in its reports and draft strategic plans; \n \n30. Recalls the decision to observe 30 June of each year as the International \nDay of Parliamentarism, and 15 September of each year as the International Day of \nDemocracy, and invites all Member States, national parliaments, organizations of the \nUnited Nations system and other relevant international organizations, civil society, \nincluding non\u2011governmental organizations, and all other relevant stakeholders to \nobserve these Days and to promote awareness of them, while stressing that the cost \nof all activities that may arise from the observance of the Days by the United Nations \nshould be met from voluntary contributions;  \n \n31. Takes note of the report of the Secretary-General,11 and requests that he \nsubmit to the General Assembly at its eighty-second session a report under the item \nentitled \u201cInteraction between the United Nations, national parliaments and the \nInter\u2011Parliamentary Union\u201d with a special focus on the implementation of the shared \nglobal objectives of United Nations entities and the Inter-Parliamentary Union, \nincluding best practices and contributions of Member States, national parliaments, the \nUnited Nations and the Inter-Parliamentary Union to strengthen multilateralism and \nadvance peace and security, human rights and sustainable development. \n \n86th plenary meeting \n25 July 2025 \n \n_______________ \n \n11 A/79/837. \n",
  "paragraphs": {
    "1": "Welcomes the actions taken by the Inter-Parliamentary Union to continue to pursue a more systematic and meaningful engagement with the United Nations, and encourages both organizations to enhance their cooperation in meeting their common objectives, focused on a number of thematic issues as well as the overarching goal of strengthening multilateralism by bringing the people, through their parliamentary representatives, closer to the United Nations;",
    "2": "Encourages the United Nations and the Inter-Parliamentary Union to continue to work closely in various fields, including the three dimensions of sustainable development \u2013 the economic, social and environmental \u2013 peacebuilding and sustaining peace, countering and preventing terrorism and violent extremism as and when conducive to terrorism, international law, human rights and fundamental freedoms, combating racism, racial discrimination, xenophobia and related intolerance, promoting gender equality and the empowerment of all women and girls, youth empowerment, democracy and good governance, poverty eradication, the use of information and communications technologies, including artificial intelligence, health, international migration, climate change, biodiversity, disaster risk reduction, capacity-building and financing for development;",
    "3": "Also encourages the United Nations and the Inter-Parliamentary Union to strengthen cooperation by engaging parliamentarians in efforts to maintain support for the implementation of relevant United Nations agreements and resolutions;",
    "4": "Welcomes the work of the Inter-Parliamentary Union Standing Committee on United Nations Affairs, inter alia, to familiarize parliamentarians with United Nations reforms;",
    "5": "Encourages the continued active involvement of the Inter-Parliamentary Union in promoting the enhanced contribution of parliaments at the national, regional and global levels, including through multi-stakeholder partnerships, in support of the accelerated implementation and achievement of the Sustainable Development Goals by 2030;",
    "6": "Invites parliaments and Governments to support the Technology Bank for the Least Developed Countries in its efforts towards bridging digital divides, and encourages the Inter-Parliamentary Union to facilitate inter-parliamentary dialogue on the role of science and technology in building a more peaceful and sustainable future and in the implementation of the 2030 Agenda for Sustainable Development;",
    "7": "Welcomes the efforts of the Inter-Parliamentary Union to work with national parliaments to further accelerate climate action, as noted most recently in the Nusa Dua Declaration of 24 March 2022 entitled \u201cGetting to zero: mobilizing parliaments to act on climate change\u201d, and encourages the secretariat of the United Nations Framework Convention on Climate Change to engage closely with the Inter\u2011Parliamentary Union in this area, as appropriate;",
    "8": "Also welcomes the efforts of the Inter-Parliamentary Union to promote universal health coverage and to address public health emergencies, such as the emergence of a new pandemic, and invites the World Health Organization, as the United Nations specialized agency for health, and other relevant agencies, funds and programmes of the United Nations system to enhance cooperation with the Inter\u2011Parliamentary Union in this regard;",
    "9": "Notes the contribution of the Sixth World Conference of Speakers of Parliament, organized by the Inter-Parliamentary Union in close cooperation with the United Nations, entitled \u201cA world in turmoil: parliamentary cooperation and multilateralism for peace, justice and progress for all\u201d in the context of the eightieth anniversary of the United Nations in 2025;",
    "10": " manner, and with due consideration given to achieving gender balance within such delegations;",
    "11": "Invites Member States to further consider ways to work regularly with the Inter-Parliamentary Union in facilitating a parliamentary component to major United Nations conferences so as to help to inform such deliberations from a parliamentary perspective;",
    "12": "Welcomes the contribution of the joint United Nations-Inter-Parliamentary Union parliamentary hearing at the United Nations to ongoing United Nations processes, and invites the President of the General Assembly to include this annual meeting in the official calendar of informal meetings organized under the auspices of the General Assembly;",
    "13": "Encourages Member States to further extend the practice of holding parliamentary meetings in conjunction with major United Nations conferences and processes, with a view to including the outcome of these parliamentary meetings as a formal contribution to the respective United Nations processes;",
    "14": "Welcomes the enhanced contribution of parliaments and the Inter\u2011Parliamentary Union to the work of the Human Rights Council and the human rights treaty bodies, and encourages parliaments to strengthen their role in the promotion and protection of human rights, with a view to translating international commitments into national policies and laws;",
    "15": "Encourages the United Nations Entity for Gender Equality and the Empowerment of Women (UN-Women) and other relevant bodies of the United Nations system to work closely with national parliaments and the Inter-Parliamentary Union in accordance with their respective mandates and, upon request, in such areas as gender equality and the empowerment of women, including in conflict prevention and peace processes, institutional gender mainstreaming, support to parliaments in promoting gender-sensitive legislation, increasing the representation and full, equal and meaningful participation of women in parliaments, combating violence against women, including women in politics, and implementing relevant United Nations resolutions;",
    "16": "Welcomes the contributions of the Inter-Parliamentary Union to the high- level political forum on sustainable development through the participation of parliamentarians, in convening the annual Parliamentary Forum at the high-level political forum to help to mobilize parliamentary action to advance the Sustainable Development Goals, as well as through its efforts to encourage parliaments to engage in the voluntary national reviews of participating countries;",
    "17": "Encourages Member States to engage parliaments consistently and throughout the voluntary national review process with a view to enhancing national ownership of the Sustainable Development Goals and stepping up their implementation by 2030;",
    "18": "Invites the Inter-Parliamentary Union and the relevant bodies of the United Nations system to continue and enhance their cooperation in supporting Governments in facilitating the orderly, safe, regular and responsible migration and mobility of people, including through the implementation of planned and well-managed migration policies, and recalls the contribution of the Inter-Parliamentary Union in the follow\u2011up process for the Global Compact for Safe, Orderly and Regular Migration;10",
    "19": "Welcomes the joint activities carried out by the Inter-Parliamentary Union, the United Nations Office on Drugs and Crime and the Office of Counter-Terrorism aimed at mobilizing parliamentary action to combat terrorism and violent extremism as and when conducive to terrorism, develop relevant good practices and counter- terrorism legislation, and support the victims of terrorism, in accordance with national context and international law;",
    "20": "Takes note with appreciation of the work of the Inter-Parliamentary Union with its member parliaments to facilitate the ratification and implementation of United Nations disarmament and non\u2011proliferation treaties and conventions;",
    "21": "Encourages the United Nations and the Inter-Parliamentary Union to develop closer cooperation with parliaments at the national and regional levels, including in terms of strengthening parliamentary capacities, inter alia, in regard to the allocation of budgetary resources for the implementation of the 2030 Agenda and, as appropriate, the Pact for the Future, in reinforcing the rule of law and helping to align national legislation with international commitments, and to facilitate, within existing resources, greater South-South and triangular cooperation between parliaments and parliamentarians;",
    "22": "Encourages the United Nations to work with Member States, upon their request, to strengthen the institutional capacity of national parliaments through technical support, legal analysis, specific advice, training, monitoring and evaluation in all relevant areas;",
    "23": "Recognizes that the contributions of young people are important for the full and successful implementation of the 2030 Agenda, and urges Member States and United Nations entities, in consultation with youth, youth-led and youth-focused and young women\u2019s organizations, to explore and promote concrete new avenues for the full, effective, structured, increased and sustainable participation of young people, youth-led and young women\u2019s organizations in relevant decision-making processes and monitoring, in all spheres of political, economic, social and cultural life, including in designing and implementing policies, programmes and initiatives, in particular when implementing the 2030 Agenda;",
    "24": "Takes note of the Common Principles for Support to Parliaments pioneered by the Inter-Parliamentary Union and the United Nations Development Programme and endorsed by 153 national parliaments, 12 parliamentary assemblies and 21 partner organizations with a view to further strengthening the capacity of parliaments to perform their functions;",
    "25": "Calls upon United Nations country teams to develop, within their mandates and at the request of national authorities, a more structured and integrated manner of working with national parliaments, through appropriate mechanisms, including reports on lessons learned and gaps to be filled, inter alia, by involving parliaments in consultations on national development strategies and on development aid effectiveness, where applicable;",
    "26": "Calls upon United Nations entities to avail themselves more systematically of the unique expertise of the Inter-Parliamentary Union and its member parliaments in strengthening parliamentary institutions, particularly in countries emerging from conflict and/or in transition to democracy;",
    "27": "",
    "28": "Calls for regular annual exchanges and meetings at both the political and the operational levels between senior officials of the United Nations and of the Inter\u2011Parliamentary Union, with a view to building greater coherence in the work of the two organizations and helping to forge a more robust strategic partnership between them;",
    "29": "Encourages the United Nations system to reflect more systematically the role and contribution of parliaments in its reports and draft strategic plans;",
    "30": "Recalls the decision to observe 30 June of each year as the International Day of Parliamentarism, and 15 September of each year as the International Day of Democracy, and invites all Member States, national parliaments, organizations of the United Nations system and other relevant international organizations, civil society, including non\u2011governmental organizations, and all other relevant stakeholders to observe these Days and to promote awareness of them, while stressing that the cost of all activities that may arise from the observance of the Days by the United Nations should be met from voluntary contributions;",
    "31": "Takes note of the report of the Secretary-General,11 and requests that he submit to the General Assembly at its eighty-second session a report under the item entitled \u201cInteraction between the United Nations, national parliaments and the Inter\u2011Parliamentary Union\u201d with a special focus on the implementation of the shared global objectives of United Nations entities and the Inter-Parliamentary Union, including best practices and contributions of Member States, national parliaments, the United Nations and the Inter-Parliamentary Union to strengthen multilateralism and advance peace and security, human rights and sustainable development."
  },
  "agenda_items": [
    "Item 126"
  ],
  "symbol_references": [
    "A/79/L.104"
  ]
}