{
  "symbol": "A/RES/76/26",
  "filename": "A_RES_76_26.pdf",
  "title": "76/26. Implementation of the Convention on the Prohibition of the Use, Stockpiling, Production and Transfer of Anti-Personnel Mines and on Their Destruction",
  "text": "United Nations \nA/RES/76/26\n \n \nGeneral Assembly \nDistr.: General \n8 December 2021 \n \n21-18263 (E)    131221     \n*2118263* \n \n \nSeventy-sixth session \nAgenda item 100 (m) \nGeneral and complete disarmament: implementation of the \nConvention on the Prohibition of the Use, Stockpiling, \nProduction and Transfer of Anti-Personnel Mines and on \nTheir Destruction \n \n \n \n \n Resolution adopted by the General Assembly \non 6 December 2021 \n \n \n \n \n[on the report of the First Committee (A/76/444, para. 93)] \n \n \n \n76/26. Implementation of the Convention on the Prohibition of the Use, \nStockpiling, Production and Transfer of Anti-Personnel Mines and \non Their Destruction \n \n \n \nThe General Assembly, \n \nRecalling its resolutions 54/54 B of 1 December 1999, 55/33 V of 20 November \n2000, 56/24 M of 29 November 2001, 57/74 of 22 November 2002, 58/53 of 8 December \n2003, 59/84 of 3 December 2004, 60/80 of 8 December 2005, 61/84 of 6 December 2006, \n62/41 of 5 December 2007, 63/42 of 2 December 2008, 64/56 of 2 December 2009, 65/48 \nof 8 December 2010, 66/29 of 2 December 2011, 67/32 of 3 December 2012, 68/30 of \n5 December 2013, 69/34 of 2 December 2014, 70/55 of 7 December 2015, 71/34 of \n5 December 2016, 72/53 of 4 December 2017, 73/61 of 5 December 2018, 74/61 of \n12 December 2019 and 75/52 of 7 December 2020, \n \nReaffirming its determination to put an end to the suffering and casualties \ncaused by anti-personnel mines, which kill or injure thousands of people \u2013 women, \ngirls, boys and men \u2013 every year, and which place people living in affected areas at \nrisk and hinder the development of their communities, \n \nBelieving it necessary to do the utmost to contribute in an efficient and \ncoordinated manner to facing the challenge of removing anti-personnel mines placed \nthroughout the world and to assure their destruction, \n \nWishing to do the utmost to ensure assistance for the care and rehabilitation, \nincluding the social and economic reintegration, of mine victims, \n \nNoting with satisfaction the work undertaken to implement the Convention on \nthe Prohibition of the Use, Stockpiling, Production and Transfer of Anti-Personnel \n\nA/RES/76/26 \nImplementation of the Convention on the Prohibition of the Use, \nStockpiling, Production and Transfer of Anti-Personnel Mines and \non Their Destruction\n \n21-18263\n2/3 \n \nMines and on Their Destruction 1  and the substantial progress made towards \naddressing the global anti-personnel landmine problem, \n \nRecalling the first to eighteenth meetings of the States parties to the Convention, \nheld in Maputo (1999), Geneva (2000), Managua (2001), Geneva (2002), Bangkok \n(2003), Zagreb (2005), Geneva (2006), the Dead Sea (2007), Geneva (2008 and \n2010), Phnom Penh (2011), Geneva (2012, 2013 and 2015), Santiago (2016), Vienna \n(2017) and Geneva (2018 and 2020), and the First, Second, Third and Fourth Review \nConferences of the States Parties to the Convention, held in Nairobi (2004), \nCartagena, Colombia (2009), Maputo (2014) and Oslo (2019), \n \nRecalling also that, at the Fourth Review Conference of the States Parties to the \nConvention, the international community reviewed the implementation of the \nConvention and the States parties adopted a declaration and an action plan for the period \n2020\u20132024 to support the enhanced implementation and promotion of the Convention, \n \nUnderlining the importance of cooperation and assistance in the implementation \nof the Convention, including through the so-called individualized approach, which \noffers mine-affected countries a platform for presenting their challenges, \n \nStressing the need to take into account gender aspects in mine action, \n \nNoting with satisfaction that 164 States have ratified or acceded to the \nConvention and have formally accepted the obligations of the Convention, \n \nEmphasizing the desirability of attracting the adherence of all States to the \nConvention, and determined to work strenuously towards the promotion of its \nuniversalization and norms, \n \nNoting with regret that anti-personnel mines continue to be used in some \nconflicts around the world, causing human suffering and impeding post-conflict \ndevelopment, \n \n1. \nInvites all States that have not signed the Convention on the Prohibition of \nthe Use, Stockpiling, Production and Transfer of Anti-Personnel Mines and on Their \nDestruction to accede to it without delay; \n \n2. \nUrges the one remaining State that has signed but has not ratified the \nConvention to ratify it without delay; \n \n3. \nStresses the importance of the full and effective implementation of and \ncompliance with the Convention, including through the continued implementation of \nthe action plans under the Convention; \n \n4. \nExpresses strong concern regarding the use of anti-personnel mines in \nvarious parts of the world, including use highlighted in recent allegations, reports and \ndocumented evidence; \n \n5. \nUrges all States parties to provide the Secretary-General with complete \nand timely information as required under article 7 of the Convention in order to \npromote transparency and compliance with the Convention; \n \n6. \nInvites all States that have not ratified the Convention or acceded to it to \nprovide, on a voluntary basis, information to make global mine action efforts more \neffective; \n \n7. \nRenews its call upon all States and other relevant parties to work together \nto promote, support and advance the care, rehabilitation and social and economic \nreintegration of mine victims, mine risk education and reduction programmes and the \n__________________ \n \n1  United Nations, Treaty Series, vol. 2056, No. 35597. \n\nImplementation of the Convention on the Prohibition of the Use, \nStockpiling, Production and Transfer of Anti-Personnel Mines and \non Their Destruction \nA/RES/76/26\n \n3/3\n21-18263 \n \nremoval and destruction of anti-personnel mines placed or stockpiled throughout the \nworld; \n \n8. \nUrges all States to remain seized of the issue at the highest political level and, \nwhere in a position to do so, to promote adherence to the Convention through bilateral, \nsubregional, regional and multilateral contacts, outreach, seminars and other means; \n \n9. \nInvites and encourages all interested States, the United Nations, other \nrelevant international organizations or institutions, regional organizations, the \nInternational Committee of the Red Cross and relevant non-governmental \norganizations to attend the Nineteenth Meeting of the States Parties to the \nConvention, to be held in The Hague from 15 to 19 November 2021, and to participate \nin the future programme of meetings of the States parties to the Convention; \n \n10. Requests the Secretary-General, in accordance with article 12, \nparagraph 1, of the Convention, to undertake the preparations necessary to convene \nthe Twentieth Meeting of the States Parties to the Convention and, on behalf of the \nStates parties and in accordance with article 12, paragraph 3, of the Convention, to \ninvite States not parties to the Convention, as well as the United Nations, other \nrelevant international organizations or institutions, regional organizations, the \nInternational Committee of the Red Cross and relevant non-governmental \norganizations, to attend the Twentieth Meeting of the States Parties as observers; \n \n11. \nCalls upon States parties and States participating in meetings to address \nissues arising from outstanding dues and to proceed promptly with the payment of \ntheir share of the estimated costs; \n \n12. \nDecides to include in the provisional agenda of its seventy-seventh session, \nunder the item entitled \u201cGeneral and complete disarmament\u201d, the sub-item entitled \n\u201cImplementation of the Convention on the Prohibition of the Use, Stockpiling, \nProduction and Transfer of Anti-Personnel Mines and on Their Destruction\u201d. \n \n45th plenary meeting \n6 December 2021 \n \n",
  "paragraphs": {
    "1": "Invites all States that have not signed the Convention on the Prohibition of the Use, Stockpiling, Production and Transfer of Anti-Personnel Mines and on Their Destruction to accede to it without delay;",
    "2": "Urges the one remaining State that has signed but has not ratified the Convention to ratify it without delay;",
    "3": "Stresses the importance of the full and effective implementation of and compliance with the Convention, including through the continued implementation of the action plans under the Convention;",
    "4": "Expresses strong concern regarding the use of anti-personnel mines in various parts of the world, including use highlighted in recent allegations, reports and documented evidence;",
    "5": "Urges all States parties to provide the Secretary-General with complete and timely information as required under article 7 of the Convention in order to promote transparency and compliance with the Convention;",
    "6": "Invites all States that have not ratified the Convention or acceded to it to provide, on a voluntary basis, information to make global mine action efforts more effective;",
    "7": "Renews its call upon all States and other relevant parties to work together to promote, support and advance the care, rehabilitation and social and economic reintegration of mine victims, mine risk education and reduction programmes and the __________________ 1 United Nations, Treaty Series, vol. 2056, No. 35597. Implementation of the Convention on the Prohibition of the Use, Stockpiling, Production and Transfer of Anti-Personnel Mines and on Their Destruction A/RES/76/26 3/3 21-18263 removal and destruction of anti-personnel mines placed or stockpiled throughout the world;",
    "8": "Urges all States to remain seized of the issue at the highest political level and, where in a position to do so, to promote adherence to the Convention through bilateral, subregional, regional and multilateral contacts, outreach, seminars and other means;",
    "9": "Invites and encourages all interested States, the United Nations, other relevant international organizations or institutions, regional organizations, the International Committee of the Red Cross and relevant non-governmental organizations to attend the Nineteenth Meeting of the States Parties to the Convention, to be held in The Hague from 15 to 19 November 2021, and to participate in the future programme of meetings of the States parties to the Convention;",
    "10": "Requests the Secretary-General, in accordance with article 12, paragraph 1, of the Convention, to undertake the preparations necessary to convene the Twentieth Meeting of the States Parties to the Convention and, on behalf of the States parties and in accordance with article 12, paragraph 3, of the Convention, to invite States not parties to the Convention, as well as the United Nations, other relevant international organizations or institutions, regional organizations, the International Committee of the Red Cross and relevant non-governmental organizations, to attend the Twentieth Meeting of the States Parties as observers;",
    "11": "Calls upon States parties and States participating in meetings to address issues arising from outstanding dues and to proceed promptly with the payment of their share of the estimated costs;",
    "12": "Decides to include in the provisional agenda of its seventy-seventh session, under the item entitled \u201cGeneral and complete disarmament\u201d, the sub-item entitled \u201cImplementation of the Convention on the Prohibition of the Use, Stockpiling, Production and Transfer of Anti-Personnel Mines and on Their Destruction\u201d. 45th plenary meeting 6 December 2021"
  },
  "agenda_items": [
    "Item 100"
  ],
  "symbol_references": []
}