{
  "symbol": "A/RES/76/280",
  "filename": "A_RES_76_280.pdf",
  "title": "76/280. Closed peacekeeping missions",
  "text": "United Nations \nA/RES/76/280\n \n \nGeneral Assembly \nDistr.: General \n6 July 2022 \n \n22-10336 (E)    070722     \n*2210336* \n \n \nSeventy-sixth session \nAgenda item 150 \nAdministrative and budgetary aspects of the financing of the \nUnited Nations peacekeeping operations \n \n \n \n \n Resolution adopted by the General Assembly on \n29 June 2022 \n \n \n[on the report of the Fifth Committee (A/76/874, para. 21)] \n \n \n 76/280. Closed peacekeeping missions \n \n \n \nThe General Assembly, \n \nRecalling its resolution 75/296 of 30 June 2021,  \n \nHaving considered the report of the Secretary-General on the updated financial \nposition of closed peacekeeping missions as at 30 June 2021 1 and the related report \nof the Advisory Committee on Administrative and Budgetary Questions, 2  \n \n1. \nTakes note of the report of the Secretary-General;  \n \n2. \nEndorses the conclusions and recommendations contained in the report of \nthe Advisory Committee on Administrative and Budgetary Questions, subject to the \nprovisions of the present resolution;  \n \n3. \nUrges all Member States to fulfil their financial obligations as set out in \nthe Charter of the United Nations on time, in full and without conditions;  \n \n4. \nNotes that the use of unreturned balances to cover temporary liquidity \nneeds of the Organization is not an established mechanism, and emphasizes that this \npractice is not sustainable;  \n \n5. \nDecides to return cash assets in closed peacekeeping missions to Member \nStates, subject to sufficient and concomitant action being taken regarding the \nfinancial situation of the Organization, as follows:  \n \n(a) \nTo return by 31 March 2023 all cash assets as of 31 December 2022 in \nmissions with cash surpluses, excluding only cash necessary to cover claims of troop- \nand police-contributing countries in those missions, to Member States that have paid \n__________________ \n \n1  A/76/553. \n \n2  A/76/738. \n\nA/RES/76/280 \nClosed peacekeeping missions\n \n22-10336\n2/2 \n \ntheir assessed contributions in full to the closed peacekeeping missions as of \n31 December 2022, based on the scale applicable to each mission\u2019s last assessment;  \n \n(b) \nTo cross-borrow the remaining cash available in all closed missions to pay \nby 31 March 2023 all outstanding claims of troop- and police-contributing countries \nin closed peacekeeping missions, prioritizing the claims by countries without arrears \nin closed peacekeeping missions. \n \n89th plenary meeting \n29 June 2022 \n \n",
  "paragraphs": {
    "1": "Takes note of the report of the Secretary-General;",
    "2": "Endorses the conclusions and recommendations contained in the report of the Advisory Committee on Administrative and Budgetary Questions, subject to the provisions of the present resolution;",
    "3": "Urges all Member States to fulfil their financial obligations as set out in the Charter of the United Nations on time, in full and without conditions;",
    "4": "Notes that the use of unreturned balances to cover temporary liquidity needs of the Organization is not an established mechanism, and emphasizes that this practice is not sustainable;",
    "5": "Decides to return cash assets in closed peacekeeping missions to Member States, subject to sufficient and concomitant action being taken regarding the financial situation of the Organization, as follows: (a) To return by 31 March 2023 all cash assets as of 31 December 2022 in missions with cash surpluses, excluding only cash necessary to cover claims of troop- and police-contributing countries in those missions, to Member States that have paid __________________ 1 A/76/553. 2 A/76/738. A/RES/76/280 Closed peacekeeping missions 22-10336 2/2 their assessed contributions in full to the closed peacekeeping missions as of 31 December 2022, based on the scale applicable to each mission\u2019s last assessment; (b) To cross-borrow the remaining cash available in all closed missions to pay by 31 March 2023 all outstanding claims of troop- and police-contributing countries in closed peacekeeping missions, prioritizing the claims by countries without arrears in closed peacekeeping missions. 89th plenary meeting 29 June 2022"
  },
  "agenda_items": [
    "Item 150"
  ],
  "symbol_references": []
}