{
  "symbol": "A/RES/78/224",
  "filename": "A_RES_78_224.pdf",
  "title": "78/224. Reducing reoffending through rehabilitation and reintegration",
  "text": "United Nations \nA/RES/78/224\n \n \nGeneral Assembly \nDistr.: General \n22 December 2023 \n \n23-25987 (E)    100124     \n*2325987* \n \n \nSeventy-eighth session \nAgenda item 107 \nCrime prevention and criminal justice  \n \n \n \n \n Resolution adopted by the General Assembly \non 19 December 2023 \n \n \n \n \n[on the report of the Third Committee (A/78/482, para. 29)] \n \n \n 78/224. Reducing reoffending through rehabilitation and reintegration \n \n \n \nThe General Assembly, \n \nRecalling the outcome of the Fourteenth United Nations Congress on Crime \nPrevention and Criminal Justice, held in Kyoto, Japan, from 7 to 12 March 2021, as \nreflected in the report of the Congress1 and in the Kyoto Declaration on Advancing \nCrime Prevention, Criminal Justice and the Rule of Law: Towards the Achievement \nof the 2030 Agenda for Sustainable Development,2  \n \nReaffirming the commitment expressed in the Kyoto Declaration to reduce \nreoffending through rehabilitation and social reintegration, \n \nNoting the deliberations of the Fourteenth Congress under the agenda item \nentitled \u201cIntegrated approaches to challenges facing the criminal justice system\u201d, \nduring which, inter alia, the need for practical guidance for national criminal justice \nsystems on reducing reoffending and the recommendation to develop new United \nNations standards and norms on the issue of reducing reoffending were raised by \nsome Member States, \n \nNoting also the discussions held at the workshop on the topic \u201cReducing \nreoffending: identifying risks and developing solutions\u201d and the three subtopics, as \nreflected in the report of Committee II of the Fourteenth Congress, in particular the \nencouragement given by some participants to Member States to share information on \npromising practices and consider the development, under the auspices of the \nCommission on Crime Prevention and Criminal Justice and with the support of the \nUnited Nations Office on Drugs and Crime, of model strategies to reduce reoffending \nthat reflect, among others, the good practices discussed during the workshop,3  \n__________________ \n \n1  A/CONF.234/16. \n \n2  Resolution 76/181, annex. \n \n3  A/CONF.234/16, chap. VII, sect. B. \n\nA/RES/78/224 \nReducing reoffending through rehabilitation and reintegration\n \n23-25987\n2/3 \n \n \nNoting further the efforts taken by the United Nations Office on Drugs and \nCrime to implement General Assembly resolution 76/182 of 16 December 2021, \nnamely through convening, with the support of the Government of Japan, an online \nexpert group meeting, during which a limited number of experts, participating in their \nindividual capacity, met from 6 to 8 April 2022 to share information on promising \npractices and to identify a set of key elements to be considered for inclusion in draft \nmodel strategies on reducing reoffending, \n \nRecalling its resolution 77/232 of 15 December 2022, in which it requested the \nUnited Nations Office on Drugs and Crime to convene a meeting of an open-ended \nintergovernmental expert group, with interpretation in all official languages of the \nUnited Nations, with a view to developing model strategies on reducing reoffending \nthat could serve as useful tools for Member States, taking into consideration relevant \nprovisions in the existing United Nations standards and norms in crime prevention \nand criminal justice, current developments, research and tools, written contributions \nfrom Member States and, without prejudice, the output of the expert group meeting \nheld from 6 to 8 April 2022, \n \nRecalling also the standards and norms in crime prevention and criminal justice \nadopted or recommended by the General Assembly, including the United Nations \nStandard Minimum Rules for the Treatment of Prisoners (the Nelson Mandela \nRules), 4  the United Nations Rules for the Treatment of Women Prisoners and \nNon-custodial Measures for Women Offenders (the Bangkok Rules) 5 and the United \nNations Standard Minimum Rules for Non-custodial Measures (the Tokyo Rules),6 \nand at the same time acknowledging the need for standards and norms specifically \nfocusing on reducing reoffending, \n \n1. \nEncourages Member States to develop comprehensive strategies or action \nplans to reduce reoffending through effective interventions for the rehabilitation and \nreintegration of offenders; \n \n2. \nAlso encourages Member States to promote a rehabilitative environment \nin correctional facilities, including through designing and implementing effective \ntreatment programmes based on an individual assessment of the needs of and risks \nfaced by offenders, and to provide offenders with access to vocational and technical \ntraining and educational programmes to support them in developing the skills \nnecessary for reintegration; \n \n3. \nFurther encourages Member States, as appropriate and in line with \ndomestic legislation, to take into account the relevant and appropriate United Nations \nstandards and norms in crime prevention and criminal justice, mainstream a gender \nperspective into their criminal justice systems, support the development of necessary \nskills among offenders in correctional facilities and facilitate working opportunities, \nwhere appropriate, to promote the social rehabilitation and reintegration of offenders; \n \n4. \nRecognizes the benefit that may be derived from incorporating respect for \ncultural diversity, based on respect for the rule of law, into rehabilitation and \nreintegration programmes; \n \n5. \nEncourages Member States to promote rehabilitation approaches and \nprogrammes within their judicial systems empowered to deal with specific problems, \nsuch as social or mental health issues; \n \n6. \nAlso encourages Member States to promote a rehabilitative environment \nin the community to facilitate the social reintegration of offenders with the active \n__________________ \n \n4  Resolution 70/175, annex. \n \n5  Resolution 65/229, annex. \n \n6  Resolution 45/110, annex. \n\nReducing reoffending through rehabilitation and reintegration \nA/RES/78/224\n \n3/3\n23-25987 \n \ninvolvement of local communities, giving due regard to the need to protect society \nand individuals and the rights of victims and offenders; \n \n7. \nFurther encourages Member States to promote multi-stakeholder \npartnerships to reduce reoffending by fostering inter-agency coordination among \nrelevant government authorities, such as employment and social welfare agencies and \nlocal governments, as well as public-private partnerships between those authorities \nand the community, including cooperating employers and community volunteers who \nsupport the long-term and social reintegration of offenders; \n \n8. \nExpresses appreciation to Member States that shared with the United \nNations Office on Drugs and Crime, through written contributions, information on \npromising practices for possible inclusion in draft model strategies on reducing \nreoffending, for consideration by the open-ended intergovernmental expert group to \nbe convened pursuant to its resolution 77/232; \n \n9. \nTakes note of the working paper prepared by the Secretariat examining \npreliminary areas for consideration by the open-ended intergovernmental expert \ngroup;7 \n \n10. Strongly encourages Member States to actively participate in the meeting \nof the open-ended intergovernmental expert group and to include in their delegations \nexperts from a variety of relevant disciplines; \n \n11. \nRequests the United Nations Office on Drugs and Crime, subject to the \navailability of extrabudgetary resources, to support the efforts of Member States to \nreduce reoffending through the promotion of rehabilitative environments and \nreintegration by providing technical assistance, including material support, upon \nrequest, to Member States, in particular developing countries, taking into account \ntheir needs and priorities, as well as challenges and restrictions; \n \n12. Invites Member States and other donors to provide extrabudgetary \nresources for the purposes outlined in the present resolution, in accordance with the \nrules and procedures of the United Nations. \n \n50th plenary meeting \n19 December 2023 \n \n__________________ \n \n7  E/CN.15/2023/13. \n",
  "paragraphs": {
    "1": "Encourages Member States to develop comprehensive strategies or action plans to reduce reoffending through effective interventions for the rehabilitation and reintegration of offenders;",
    "2": "Also encourages Member States to promote a rehabilitative environment in correctional facilities, including through designing and implementing effective treatment programmes based on an individual assessment of the needs of and risks faced by offenders, and to provide offenders with access to vocational and technical training and educational programmes to support them in developing the skills necessary for reintegration;",
    "3": "Further encourages Member States, as appropriate and in line with domestic legislation, to take into account the relevant and appropriate United Nations standards and norms in crime prevention and criminal justice, mainstream a gender perspective into their criminal justice systems, support the development of necessary skills among offenders in correctional facilities and facilitate working opportunities, where appropriate, to promote the social rehabilitation and reintegration of offenders;",
    "4": "Recognizes the benefit that may be derived from incorporating respect for cultural diversity, based on respect for the rule of law, into rehabilitation and reintegration programmes;",
    "5": "Encourages Member States to promote rehabilitation approaches and programmes within their judicial systems empowered to deal with specific problems, such as social or mental health issues;",
    "6": "Also encourages Member States to promote a rehabilitative environment in the community to facilitate the social reintegration of offenders with the active involvement of local communities, giving due regard to the need to protect society and individuals and the rights of victims and offenders;",
    "7": "Further encourages Member States to promote multi-stakeholder partnerships to reduce reoffending by fostering inter-agency coordination among relevant government authorities, such as employment and social welfare agencies and local governments, as well as public-private partnerships between those authorities and the community, including cooperating employers and community volunteers who support the long-term and social reintegration of offenders;",
    "8": "Expresses appreciation to Member States that shared with the United Nations Office on Drugs and Crime, through written contributions, information on promising practices for possible inclusion in draft model strategies on reducing reoffending, for consideration by the open-ended intergovernmental expert group to be convened pursuant to its resolution 77/232;",
    "9": "Takes note of the working paper prepared by the Secretariat examining preliminary areas for consideration by the open-ended intergovernmental expert group;7",
    "10": "Strongly encourages Member States to actively participate in the meeting of the open-ended intergovernmental expert group and to include in their delegations experts from a variety of relevant disciplines;",
    "11": "Requests the United Nations Office on Drugs and Crime, subject to the availability of extrabudgetary resources, to support the efforts of Member States to reduce reoffending through the promotion of rehabilitative environments and reintegration by providing technical assistance, including material support, upon request, to Member States, in particular developing countries, taking into account their needs and priorities, as well as challenges and restrictions;",
    "12": "Invites Member States and other donors to provide extrabudgetary resources for the purposes outlined in the present resolution, in accordance with the rules and procedures of the United Nations."
  },
  "agenda_items": [
    "Item 107"
  ],
  "symbol_references": []
}