{
  "symbol": "A/RES/73/180",
  "filename": "A_RES_73_180.pdf",
  "title": "73/180. Situation of human rights in the Democratic People\u2019s Republic of Korea",
  "text": "United Nations \nA/RES/73/180\n \n \nGeneral Assembly \nDistr.: General \n23 January 2019 \n \n18-22276 (E)    250119     \n*1822276* \n \n \nSeventy-third session \nAgenda item 74 (c) \n \n \n \n \n Resolution adopted by the General Assembly \non 17 December 2018 \n \n \n \n \n[on the report of the Third Committee (A/73/589/Add.3)] \n \n \n 73/180. Situation of human rights in the Democratic People\u2019s Republic \nof Korea \n \n \n \nThe General Assembly, \n \nReaffirming that all States have an obligation to promote and protect human \nrights and fundamental freedoms and to fulfil the obligations that they have \nundertaken under the various international instruments, \n \nRecalling all previous resolutions adopted by the General Assembly, the \nCommission on Human Rights and the Human Rights Council on the situation of \nhuman rights in the Democratic People\u2019s Republic of Korea, including Assembly \nresolution 72/188 of 19 December 2017 and Council resolution 37/28 of 23 March \n2018,1 and mindful of the need for the international community to strengthen its \ncoordinated efforts aimed at achieving the implementation of those resolutions, \n \nDeeply concerned at the grave human rights situation, the pervasive culture of \nimpunity and the lack of accountability for human rights violations in the Democratic \nPeople\u2019s Republic of Korea, \n \nStressing the importance of following up on the recommendations contained in \nthe report of the commission of inquiry on human rights in the Democratic People\u2019s \nRepublic of Korea,2 and expressing grave concern at the detailed findings contained \ntherein, \n \nWelcoming the decision of the Security Council to add the situation in the \nDemocratic People\u2019s Republic of Korea to the list of issues of which the Council is \nseized and the holding of an open meeting of the Council on 11 December 2017, \nsubsequent to the ones held in 2014, 2015 and 2016, during which the situation of \nhuman rights in the Democratic People\u2019s Republic of Korea was discussed, \n__________________ \n \n1 See Official Records of the General Assembly, Seventy-third Session, Supplement No. 53 \n(A/73/53), chap. IV, sect. A. \n \n2 A/HRC/25/63. \n\nA/RES/73/180 \nSituation of human rights in the Democratic People\u2019s Republic of Korea\n \n18-22276\n2/10 \n \n \nRecalling the responsibility of the Democratic People\u2019s Republic of Korea to \nprotect its population from crimes against humanity, and recalling also that the \ncommission of inquiry urged the leadership of the Democratic People\u2019s Republic of \nKorea to prevent and suppress crimes against humanity and to ensure that perpetrators \nare prosecuted and brought to justice, \n \nTaking note of the report of the Special Rapporteur of the Human Rights Council \non the situation of human rights in the Democratic People\u2019s Republic of Korea, 3 \nregretting that he still has not been allowed to visit the country and that he has \nreceived no cooperation from the authorities of the Democratic People\u2019s Republic of \nKorea, and taking note also of the comprehensive report of the Secretary-General on \nthe situation of human rights in the Democratic People\u2019s Republic of Korea submitted \nin accordance with resolution 72/188,4 \n \nMindful that the Democratic People\u2019s Republic of Korea is a party to the \nInternational Covenant on Civil and Political Rights, 5 the International Covenant on \nEconomic, Social and Cultural Rights,5 the Convention on the Rights of the Child, 6 \nthe Convention on the Elimination of All Forms of Discrimination against Women 7 \nand the Convention on the Rights of Persons with Disabilities, 8 and recalling the \nconcluding observations of the treaty bodies under the treaties and the importance of \ngiving them consideration, \n \nRecalling the submission, in April 2016, by the Democratic People\u2019s Republic \nof Korea of its combined second, third and fourth periodic reports on the \nimplementation of the Convention on the Elimination of All Forms of Discrimination \nagainst Women 9  and of its combined fifth and sixth periodic reports on the \nimplementation of the Convention on the Rights of the Child 10 and the subsequent \nreviews in 2017 by the relevant committees, and urging full implementation of these \nConventions, including the recommendations contained in the concluding \nobservations from the aforementioned reviews, \n \nNoting the visit of the Special Rapporteur of the Human Rights Council on the \nrights of persons with disabilities to the Democratic People\u2019s Republic of Korea in \n2017, encouraging the Democratic People\u2019s Republic of Korea to implement all of \nthe recommendations contained in the report of the Special Rapporteur on her visit to \nthe Democratic People\u2019s Republic of Korea submitted to the Human Rights Council \nat its thirty-seventh session,11 and noting the participation of the Democratic People\u2019s \nRepublic of Korea in the Paralympic Winter Games held in Pyeongchang, Republic \nof Korea, \n \nStressing the importance of extending the cooperation of the Government of the \nDemocratic People\u2019s Republic of Korea also to other United Nations special \nprocedures and human rights mechanisms, including the Special Rapporteur on the \nsituation of human rights in the Democratic People\u2019s Republic of Korea, in \naccordance with their terms of reference, \n \nAcknowledging the participation of the Democratic People\u2019s Republic of Korea \nin the second universal periodic review process, noting the acceptance by the \nGovernment of the Democratic People\u2019s Republic of Korea of 113 out of the \n__________________ \n \n3 A/73/386. \n \n4 A/73/308. \n \n5 See resolution 2200 A (XXI), annex. \n \n6 United Nations, Treaty Series, vol. 1577, No. 27531. \n \n7 Ibid., vol. 1249, No. 20378. \n \n8 Ibid., vol. 2515, No. 44910. \n \n9 CEDAW/C/PRK/2\u20134. \n \n10 CRC/C/PRK/5. \n \n11 A/HRC/37/56/Add.1. \n\nSituation of human rights in the Democratic People\u2019s Republic of Korea \nA/RES/73/180\n \n3/10\n18-22276 \n \n268 recommendations contained in the outcome of the review 12  and its stated \ncommitment to implement them and look into the possibility of implementing a \nfurther 58 recommendations, while expressing its concern that the recommendations \nhave not been implemented thus far, \n \nNoting the collaboration established between the Government of the Democratic \nPeople\u2019s Republic of Korea and the United Nations Children\u2019s Fund and the World \nHealth Organization in order to improve the health situation in the country, \n \nNoting also the collaboration established between the Government of the \nDemocratic People\u2019s Republic of Korea and the United Nations Children\u2019s Fund to \nimprove the nutritional status of children and the quality of children\u2019s education, \n \nNoting further the activities undertaken by the United Nations Development \nProgramme, on a modest scale, in the Democratic People\u2019s Republic of Korea, and \nencouraging the engagement of the Government of the Democratic People\u2019s Republic \nof Korea with the international community to ensure that the programmes benefit the \npersons in need of assistance, \n \nNoting the cooperation between the Government of the Democratic People\u2019s \nRepublic of Korea and the World Food Programme, the United Nations Children\u2019s \nFund and the Food and Agriculture Organization of the United Nations on food \nsecurity assessments, underscoring the importance of those assessments in analysing \nchanges in the national, household and individual food security and nutritional \nsituation and thereby in supporting donor confidence in the targeting of aid \nprogrammes, noting also the letter of understanding signed by the Government and \nthe World Food Programme and the importance of further improvements in operating \nconditions, bringing access and monitoring arrangements closer to international \nstandards for all United Nations entities, and noting with appreciation the work of \ninternational aid operators, \n \nTaking note of the United Nations humanitarian report entitled \u201cDemocratic \nPeople\u2019s Republic of Korea 2018: needs and priorities\u201d and its call to address the \ncritical humanitarian needs in the Democratic People\u2019s Republic of Korea, \n \nTaking note also of the strategic framework for cooperation between the United \nNations and the Government of the Democratic People\u2019s Republic of Korea for the \nperiod 2017\u20132021 and the Government\u2019s commitment in accordance with the \nprinciples, goals and targets of the Sustainable Development Goals 13 and in line with \nits commitments to international agreements and conventions, \n \nNoting with concern the findings of the United Nations that over 10 million \npeople in the Democratic People\u2019s Republic of Korea are estimated to be \nundernourished and that most children under 24 months of age and 50 per cent of \npregnant and breastfeeding women have insufficient dietary diversity, leading to \nmicronutrient deficiencies and an unacceptably high prevalence of chronic and acute \nmalnutrition, condemning the Democratic People\u2019s Republic of Korea for diverting \nits resources into pursuing nuclear weapons and ballistic missiles over the welfare of \nits people, and emphasizing the necessity for the Democratic People\u2019s Republic of \nKorea to respect and ensure the welfare and inherent dignity of the people in the \ncountry, as referred to by the Security Council in its resolutions 2321 (2016) of \n30 November 2016, 2371 (2017) of 5 August 2017, 2375 (2017) of 11 September \n2017 and 2397 (2017) of 22 December 2017, \n__________________ \n \n12 A/HRC/27/10. \n \n13 See resolution 70/1. \n\nA/RES/73/180 \nSituation of human rights in the Democratic People\u2019s Republic of Korea\n \n18-22276\n4/10 \n \n \nNoting the urgency and importance of the issue of international abductions and \nof the immediate return of all abductees, as well as the long years of suffering \nexperienced by abductees and their families, expressing grave concern at the lack of \npositive action by the Democratic People\u2019s Republic of Korea since the \ninvestigations on all the Japanese nationals commenced on the basis of the \ngovernment-level consultations held between the Democratic People\u2019s Republic of \nKorea and Japan in May 2014, and expecting the resolution of all issues related to \nthe Japanese nationals, in particular the return of all abductees, to be achieved at the \nearliest possible date, \n \nNoting also the urgency and importance of the issue of separated families, and \nin this regard welcoming the resumption of the reunions of separated families across \nthe border in August 2018 and the commitments made on this issue at the inter-Korean \nsummit held on 19 September 2018 to strengthen humanitarian cooperation to \nfundamentally resolve the issue of separated families, \n \nWelcoming and further encouraging the efforts of Member States to raise \ninternational awareness about the human rights situation in the Democratic People\u2019s \nRepublic of Korea, and noting that human rights, including gender equality, are \nintrinsically linked to peace and security, \n \nWelcoming the ongoing diplomatic efforts, and noting the importance of \ndialogue and engagements for the improvement of the human rights and humanitarian \nsituation in the country, \n \nUnderlining the efforts of the Secretary-General to contribute to improving \ninter-Korean relations and promoting reconciliation and stability on the Korean \nPeninsula and the well-being of the Korean people, \n \n1. \nCondemns the long-standing and ongoing systematic, widespread and \ngross violations of human rights in and by the Democratic People\u2019s Republic of \nKorea, including those which the commission of inquiry on human rights in the \nDemocratic People\u2019s Republic of Korea, established by the Human Rights Council in \nits resolution 22/13 of 21 March 2013, 14 has said may amount to crimes against \nhumanity, and the continuing impunity for such violations; \n \n2. \nExpresses its very serious concern at: \n \n(a) \nThe persistence of continuing reports of violations of human rights, \nincluding the detailed findings made by the commission of inquiry in its report, 2 \nsuch as: \n \n(i) \nTorture and other cruel, inhuman or degrading treatment or punishment, \nincluding inhuman conditions of detention; rape; public executions; \nextrajudicial and arbitrary detention; the absence of due process and the rule of \nlaw, including fair trial guarantees and an independent judiciary; extrajudicial, \nsummary and arbitrary executions; the imposition of the death penalty for \npolitical and religious reasons; collective punishments extending up to three \ngenerations; and the extensive use of forced labour; \n \n(ii) The existence of an extensive system of political prison camps, where a \nvast number of persons are deprived of their liberty and subjected to deplorable \nconditions, including forced labour, and where alarming violations of human \nrights are perpetrated; \n__________________ \n \n14 See Official Records of the General Assembly, Sixty-eighth Session, Supplement No. 53 \n(A/68/53), chap. IV, sect. A. \n\nSituation of human rights in the Democratic People\u2019s Republic of Korea \nA/RES/73/180\n \n5/10\n18-22276 \n \n \n(iii) The forcible transfer of populations and the limitations imposed on every \nperson who wishes to move freely within the country and travel abroad, \nincluding the punishment of those who leave or try to leave the country without \npermission, or their families, as well as punishment of persons who are \nreturned; \n \n(iv) The situation of refugees and asylum seekers expelled or returned to the \nDemocratic People\u2019s Republic of Korea and retaliations against citizens of the \nDemocratic People\u2019s Republic of Korea who have been repatriated from abroad, \nleading to punishments of internment, torture, other cruel, inhuman or degrading \ntreatment, sexual violence or the death penalty, and in this regard strongly urges \nall States to respect the fundamental principle of non-refoulement, to treat those \nwho seek refuge humanely and to ensure unhindered access to the United \nNations High Commissioner for Refugees and his Office, with a view to \nprotecting the human rights of those who seek refuge, and once again urges \nStates parties to comply with their obligations under the 1951 Convention \nrelating to the Status of Refugees15 and the 1967 Protocol thereto16 in relation \nto refugees from the Democratic People\u2019s Republic of Korea who are covered \nby those instruments; \n \n(v) \nAll-pervasive and severe restrictions, both online and offline, on the \nfreedoms of thought, conscience, religion or belief, opinion and expression, \npeaceful assembly and association, the right to privacy and equal access to \ninformation, by such means as the unlawful and arbitrary surveillance, \npersecution, torture, imprisonment and, in some instances, summary executions \nof individuals exercising their freedom of opinion and expression, religion or \nbelief, and their families, and the right of everyone, including women, to take \npart in the conduct of public affairs, directly or through freely chosen \nrepresentatives, of his or her country; \n \n(vi) Violations of economic, social and cultural rights, which have led to food \ninsecurity, severe hunger, malnutrition, widespread health problems and other \nhardship for the population in the Democratic People\u2019s Republic of Korea, in \nparticular for women, children, persons with disabilities, older persons and \npolitical prisoners; \n \n(vii) Violations of the human rights and fundamental freedoms of women and \ngirls, in particular the creation of internal conditions that force women and girls \nto leave the country and make them extremely vulnerable to trafficking in \npersons for the purpose of prostitution, domestic servitude or forced marriage \nand the subjection of women and girls to gender-based discrimination, including \nin the political and social spheres, forced abortions and other forms of sexual \nand gender-based violence; \n \n(viii) Violations of the human rights and fundamental freedoms of children, in \nparticular the continued lack of access to basic economic, social and cultural \nrights for many children, and in this regard notes the particularly vulnerable \nsituation faced by, inter alia, returned or repatriated children, street children, \nchildren with disabilities, children whose parents are detained, children living \nin detention or in institutions and children in conflict with the law; \n \n(ix) Violations of the human rights and fundamental freedoms of persons with \ndisabilities, especially violations involving the use of collective camps and \ncoercive measures that target the rights of persons with disabilities to decide \n__________________ \n \n15 United Nations, Treaty Series, vol. 189, No. 2545. \n \n16 Ibid., vol. 606, No. 8791. \n\nA/RES/73/180 \nSituation of human rights in the Democratic People\u2019s Republic of Korea\n \n18-22276\n6/10 \n \nfreely and responsibly on the number and spacing of their children and \nallegations of the possible use of persons with disabilities in medical testing, \nforced relocation to rural areas and separation of children with disabilities from \ntheir parents; \n \n(x) \nViolations of workers\u2019 rights, including the right to freedom of association \nand effective recognition of the right to collective bargaining, the right to strike \nas defined by the obligations of the Democratic People\u2019s Republic of Korea \nunder the International Covenant on Economic, Social and Cultural Rights,5 and \nthe prohibition of the economic exploitation of children and of any harmful or \nhazardous work of children as defined by the obligations of the Democratic \nPeople\u2019s Republic of Korea under the Convention on the Rights of the Child, 6 \nas well as the exploitation of workers sent abroad from the Democratic People\u2019s \nRepublic of Korea to work under conditions that reportedly amount to forced \nlabour, recalling paragraph 11 of Security Council resolution 2371 (2017) and \nparagraph 17 of resolution 2375 (2017), in which the Council decided that \nMember States shall not provide work authorizations for nationals of the \nDemocratic People\u2019s Republic of Korea in their jurisdictions, and also recalling \nparagraph 8 of Council resolution 2397 (2017), in which the Council decided \nthat Member States shall repatriate to the Democratic People\u2019s Republic of \nKorea all nationals from the Democratic People\u2019s Republic of Korea earning \nincome in that Member State\u2019s jurisdiction and all government safety oversight \nattach\u00e9s of the Democratic People\u2019s Republic of Korea monitoring workers \nfrom the Democratic People\u2019s Republic of Korea abroad immediately, but not \nlater than 24 months from 22 December 2017, unless the Member State \ndetermines that a Democratic People\u2019s Republic of Korea national is a national \nof that Member State or a Democratic People\u2019s Republic of Korea national\u2019s \nrepatriation is prohibited, subject to applicable national and international law, \nincluding international refugee law and international human rights law, the \nAgreement between the United Nations and the United States of America \nregarding the Headquarters of the United Nations17 and the Convention on the \nPrivileges and Immunities of the United Nations,18 and urges the Democratic \nPeople\u2019s Republic of Korea to promote, respect and protect the human rights of \nworkers, including workers repatriated to the Democratic People\u2019s Republic \nof Korea; \n \n(xi) Discrimination based on the songbun system, which classifies people on \nthe basis of State-assigned social class and birth and also includes consideration \nof political opinions and religion; \n \n(xii) Violence and discrimination against women, including unequal access to \nemployment, discriminatory laws and regulations; \n \n(b) \nThe continued refusal of the Government of the Democratic People\u2019s \nRepublic of Korea to extend an invitation to the Special Rapporteur of the Human \nRights Council on the situation of human rights in the Democratic People\u2019s Republic \nof Korea or to extend cooperation to the Special Rapporteur and several other United \nNations special procedures in accordance with their terms of reference, as well as to \nother United Nations human rights mechanisms; \n \n(c) \nThe continued lack of acknowledgement by the Government of the \nDemocratic People\u2019s Republic of Korea of the grave human rights situation in the \ncountry and its consequential lack of action to report on the state of implementation \n__________________ \n \n17 See resolution 169 (II). \n \n18 Resolution 22 A (I). \n\nSituation of human rights in the Democratic People\u2019s Republic of Korea \nA/RES/73/180\n \n7/10\n18-22276 \n \nof the recommendations contained in the outcome of its first universal periodic \nreview19 and to give consideration to the concluding observations of the treaty bodies; \n \n3. \nCondemns the systematic abduction, denial of repatriation and subsequent \nenforced disappearance of persons, including those from other countries, on a large \nscale and as a matter of State policy, and in this regard strongly calls upon the \nGovernment of the Democratic People\u2019s Republic of Korea urgently to resolve these \nissues of international concern, in a transparent manner, including by ensuring the \nimmediate return of abductees; \n \n4. \nUnderscores its very serious concern regarding reports of torture, \nsummary executions, arbitrary detention, abductions and other forms of human rights \nviolations and abuses that the Democratic People\u2019s Republic of Korea commits \nagainst citizens of other countries within and outside of its territory; \n \n5. \nExpresses its very deep concern at the precarious humanitarian situation \nin the country, which could rapidly deteriorate owing to limited resilience to natural \ndisasters and to government policies causing limitations in the availability of and \naccess to adequate food, compounded by structural weaknesses in agricultural \nproduction resulting in significant shortages of diversified food and the State \nrestrictions on the cultivation of and trade in foodstuffs, as well as the prevalence of \nchronic and acute malnutrition, particularly among the most vulnerable groups, \npregnant and lactating women, children, persons with disabilities, older persons and \npolitical prisoners, and urges the Government of the Democratic People\u2019s Republic \nof Korea, in this regard, to take preventive and remedial action, cooperating with \ninternational donor agencies and in accordance with international standards for \nmonitoring humanitarian assistance; \n \n6. \nWelcomes the latest report to the Human Rights Council of the Special \nRapporteur on the situation of human rights in the Democratic People\u2019s Republic \nof Korea;20 \n \n7. \nReiterates its appreciation for the report of the group of independent \nexperts on accountability for human rights violations in the Democratic People\u2019s \nRepublic of Korea21 established pursuant to Human Rights Council resolution 31/18 \nof 23 March 2016,22 including options to seek accountability and secure truth and \njustice for all victims; \n \n8. \nWelcomes steps taken pursuant to Human Rights Council resolution \n34/24 of 24 March 2017 23 to strengthen the capacity of the Office of the United \nNations High Commissioner for Human Rights, including its field-based structure in \nSeoul, to allow the implementation of relevant recommendations made by the group \nof independent experts on accountability aimed at strengthening current monitoring \nand documentation efforts, establishing a central repository for information and \nevidence and having experts in legal accountability assess all information and \ntestimonies with a view to developing possible strategies to be used in any future \naccountability process, and strongly encourages the Office of the High Commissioner \nto expedite the process for strengthening the capacity of the Office; \n \n9. \nReiterates its appreciation for the work of the commission of inquiry, \nrecognizes the continuing importance of its report, and regrets that the commission \n__________________ \n \n19 A/HRC/13/13. \n \n20 A/HRC/37/69. \n \n21 A/HRC/34/66/Add.1. \n \n22 See Official Records of the General Assembly, Seventy-first Session, Supplement No. 53 \n(A/71/53), chap. IV, sect. A. \n \n23 Ibid., Seventy-second Session, Supplement No. 53 (A/72/53), chap. IV, sect. A. \n\nA/RES/73/180 \nSituation of human rights in the Democratic People\u2019s Republic of Korea\n \n18-22276\n8/10 \n \nreceived no cooperation from the authorities of the Democratic People\u2019s Republic of \nKorea, including with regard to access to the country; \n \n10. Acknowledges the commission\u2019s finding that the body of testimony \ngathered and the information received provide reasonable grounds to believe that \ncrimes against humanity have been committed in the Democratic People\u2019s Republic \nof Korea, pursuant to policies established at the highest level of the State for decades \nand by institutions under the effective control of its leadership; \n \n11. \nExpresses its concern at the failure of the authorities of the Democratic \nPeople\u2019s Republic of Korea to prosecute those responsible for human rights \nviolations, including violations which the commission of inquiry has said may amount \nto crimes against humanity, and encourages the international community to cooperate \nwith accountability efforts and to ensure that such crimes do not remain unpunished; \n \n12. Encourages the Security Council to continue its consideration of the \nrelevant conclusions and recommendations of the commission of inquiry and take \nappropriate action to ensure accountability, including through consideration of \nreferral of the situation in the Democratic People\u2019s Republic of Korea to the \nInternational Criminal Court and consideration of the further development of \nsanctions in order to target effectively those who appear to be most responsible for \nhuman rights violations that the commission has said may constitute crimes against \nhumanity; \n \n13. Also encourages the Security Council to continue to discuss the situation \nin the Democratic People\u2019s Republic of Korea, including the country\u2019s human rights \nsituation, in the light of the serious concerns expressed in the present resolution, and \nlooks forward to its continued and more active engagement on this matter; \n \n14. Encourages the continuing endeavours of the Office of the United Nations \nHigh Commissioner for Human Rights field-based structure in Seoul, and welcomes \nits regular reporting to the Human Rights Council; \n \n15. Calls upon Member States to undertake to ensure that the field-based \nstructure of the Office of the High Commissioner can function with independence, \nhas sufficient resources and support to fulfil its mandate, enjoys full cooperation with \nrelevant Member States and is not subjected to any reprisals or threats; \n \n16. Strongly urges the Government of the Democratic People\u2019s Republic of \nKorea to respect fully all human rights and fundamental freedoms and, in this regard: \n \n(a) \nTo immediately put an end to the systematic, widespread and grave \nviolations of human rights emphasized above, inter alia, by implementing fully \nthe measures set out in the above-mentioned resolutions of the General Assembly, the \nCommission on Human Rights and the Human Rights Council, and the \nrecommendations addressed to the Democratic People\u2019s Republic of Korea by \nthe Council in the context of the universal periodic review and by the commission of \ninquiry, the United Nations special procedures and treaty bodies; \n \n(b) \nTo immediately close the political prison camps and to release all political \nprisoners unconditionally and without any delay; \n \n(c) \nTo protect its inhabitants, address the issue of impunity and ensure that \nthose responsible for crimes involving violations of human rights are brought to \njustice before an independent judiciary; \n \n(d) \nTo tackle the root causes leading to refugee outflows and prosecute those \nwho exploit refugees through migrant smuggling, trafficking in human beings and \nextortion, while not criminalizing refugees and the victims of trafficking; \n\nSituation of human rights in the Democratic People\u2019s Republic of Korea \nA/RES/73/180\n \n9/10\n18-22276 \n \n \n(e) \nTo ensure that everyone within the territory of the Democratic People\u2019s \nRepublic of Korea enjoys the right to liberty of movement and is free to leave the \ncountry, including for the purpose of seeking asylum outside the Democratic People\u2019s \nRepublic of Korea, without interference by the authorities of the Democratic People\u2019s \nRepublic of Korea; \n \n(f) \nTo ensure that citizens of the Democratic People\u2019s Republic of Korea who \nare expelled or returned to the Democratic People\u2019s Republic of Korea are able to \nreturn in safety and dignity, are treated humanely and are not subjected to any kind \nof punishment, and to provide information on their status and treatment; \n \n(g) \nTo provide citizens of other countries detained in the Democratic People\u2019s \nRepublic of Korea with protections, including freedom of communication with, and \naccess to, consular officers in accordance with the Vienna Convention on Consular \nRelations,24 to which the Democratic People\u2019s Republic of Korea is a party, and any \nother necessary arrangements to confirm their status and to communicate with their \nfamilies; \n \n(h) \nTo extend its full cooperation to the Special Rapporteur, including by \ngranting him full, free and unimpeded access to the Democratic People\u2019s Republic of \nKorea, and to other special procedures of the Human Rights Council as well as to \nother United Nations human rights mechanisms so that a full needs assessment of the \nhuman rights situation may be made; \n \n(i) \nTo engage in technical cooperation activities in the field of human rights \nwith the United Nations High Commissioner for Human Rights and her Office, as \npursued by the High Commissioner in recent years, with a view to improving the \nsituation of human rights in the country; \n \n(j) \nTo implement the accepted recommendations stemming from the universal \nperiodic review and to consider positively those recommendations which are still \nunder consideration, and to submit a report to the Human Rights Council for \nconsideration during the third review cycle; \n \n(k) \nTo become a member of the International Labour Organization, to enact \nlegislation and adopt practices to comply with international labour standards and to \nconsider ratifying all the relevant conventions, in particular the core labour \nconventions of the International Labour Organization; \n \n(l) \nTo continue and reinforce its cooperation with United Nations \nhumanitarian agencies; \n \n(m) To ensure full, safe and unhindered access to humanitarian aid, as well as \nto critical data, and take measures to allow humanitarian agencies to secure the \nimpartial delivery of such aid to all parts of the country, including detention facilities, \non the basis of need in accordance with humanitarian principles, as it pledged to do, \nto ensure access to adequate food and implement more effective food security and \nnutrition policies, including through sustainable agriculture, sound food production \nand distribution measures and the allocation of more funds to the food sector, and to \nensure adequate monitoring of humanitarian assistance; \n \n(n) \nTo further improve cooperation with the United Nations country team \nmembers and development agencies so that they can directly contribute to improving \nthe living conditions of the civilian population, including progress towards the \nachievement of the Sustainable Development Goals;13 \n \n(o) \nTo consider ratifying and acceding to the remaining international human \nrights treaties, which would enable a dialogue with the human rights treaty bodies, to \n__________________ \n \n24 United Nations, Treaty Series, vol. 596, No. 8638. \n\nA/RES/73/180 \nSituation of human rights in the Democratic People\u2019s Republic of Korea\n \n18-22276\n10/10 \n \nresume reporting to monitoring bodies on treaties to which it is a party, to participate \nmeaningfully in treaty body reviews, and to give consideration to the concluding \nobservations of such bodies in order to improve the human rights situation in the \ncountry; \n \n17. Urges the Government of the Democratic People\u2019s Republic of Korea to \nimplement the recommendations of the commission of inquiry without delay; \n \n18. Reiterates the importance of maintaining high on the international agenda \nthe grave human rights situation in the Democratic People\u2019s Republic of Korea, \nincluding through sustained communications, advocacy and outreach initiatives, and \nrequests the Office of the United Nations High Commissioner for Human Rights to \nstrengthen those activities; \n \n19. Encourages all Member States, the General Assembly, the Human Rights \nCouncil, the Office of the High Commissioner, the United Nations Secretariat, \nrelevant specialized agencies, regional intergovernmental organizations and forums, \ncivil society organizations, foundations and engaged business enterprises and other \nstakeholders towards which the commission of inquiry has directed recommendations \nto implement or take forward those recommendations; \n \n20. Encourages the United Nations system as a whole to continue to address \nthe grave human rights situation in the Democratic People\u2019s Republic of Korea in a \ncoordinated and unified manner; \n \n21 \nEncourages the relevant United Nations programmes, funds, specialized \nagencies and other related organizations to assist the Government of the Democratic \nPeople\u2019s Republic of Korea in the implementation of recommendations stemming \nfrom the universal periodic review and from the report of the commission of inquiry;  \n \n22. Calls upon the Democratic People\u2019s Republic of Korea to engage \nconstructively with international interlocutors with a view to promoting concrete \nimprovements in the human rights situation on the ground, including through human \nrights dialogues, official visits to the country that include adequate access to fully \nassess human rights conditions, cooperation initiatives and more people-to-people \ncontact as a matter of priority; \n \n23. Decides to continue its examination of the situation of human rights in the \nDemocratic People\u2019s Republic of Korea at its seventy-fourth session, and to this end \nrequests the Secretary-General to submit a comprehensive report on the situation of \nhuman rights in the Democratic People\u2019s Republic of Korea, and requests the Special \nRapporteur to continue to report his findings and recommendations, as well as to \nreport on the follow-up to the implementation of the recommendations of the \ncommission of inquiry. \n \n56th plenary meeting  \n17 December 2018 \n \n",
  "paragraphs": {
    "1": "Condemns the long-standing and ongoing systematic, widespread and gross violations of human rights in and by the Democratic People\u2019s Republic of Korea, including those which the commission of inquiry on human rights in the Democratic People\u2019s Republic of Korea, established by the Human Rights Council in its resolution 22/13 of 21 March 2013, 14 has said may amount to crimes against humanity, and the continuing impunity for such violations;",
    "2": "Expresses its very serious concern at: (a) The persistence of continuing reports of violations of human rights, including the detailed findings made by the commission of inquiry in its report, 2 such as: (i) Torture and other cruel, inhuman or degrading treatment or punishment, including inhuman conditions of detention; rape; public executions; extrajudicial and arbitrary detention; the absence of due process and the rule of law, including fair trial guarantees and an independent judiciary; extrajudicial, summary and arbitrary executions; the imposition of the death penalty for political and religious reasons; collective punishments extending up to three generations; and the extensive use of forced labour; (ii) The existence of an extensive system of political prison camps, where a vast number of persons are deprived of their liberty and subjected to deplorable conditions, including forced labour, and where alarming violations of human rights are perpetrated; __________________ 14 See Official Records of the General Assembly, Sixty-eighth Session, Supplement No. 53 (A/68/53), chap. IV, sect. A. Situation of human rights in the Democratic People\u2019s Republic of Korea A/RES/73/180 5/10 18-22276 (iii) The forcible transfer of populations and the limitations imposed on every person who wishes to move freely within the country and travel abroad, including the punishment of those who leave or try to leave the country without permission, or their families, as well as punishment of persons who are returned; (iv) The situation of refugees and asylum seekers expelled or returned to the Democratic People\u2019s Republic of Korea and retaliations against citizens of the Democratic People\u2019s Republic of Korea who have been repatriated from abroad, leading to punishments of internment, torture, other cruel, inhuman or degrading treatment, sexual violence or the death penalty, and in this regard strongly urges all States to respect the fundamental principle of non-refoulement, to treat those who seek refuge humanely and to ensure unhindered access to the United Nations High Commissioner for Refugees and his Office, with a view to protecting the human rights of those who seek refuge, and once again urges States parties to comply with their obligations under the 1951 Convention relating to the Status of Refugees15 and the 1967 Protocol thereto16 in relation to refugees from the Democratic People\u2019s Republic of Korea who are covered by those instruments; (v) All-pervasive and severe restrictions, both online and offline, on the freedoms of thought, conscience, religion or belief, opinion and expression, peaceful assembly and association, the right to privacy and equal access to information, by such means as the unlawful and arbitrary surveillance, persecution, torture, imprisonment and, in some instances, summary executions of individuals exercising their freedom of opinion and expression, religion or belief, and their families, and the right of everyone, including women, to take part in the conduct of public affairs, directly or through freely chosen representatives, of his or her country; (vi) Violations of economic, social and cultural rights, which have led to food insecurity, severe hunger, malnutrition, widespread health problems and other hardship for the population in the Democratic People\u2019s Republic of Korea, in particular for women, children, persons with disabilities, older persons and political prisoners; (vii) Violations of the human rights and fundamental freedoms of women and girls, in particular the creation of internal conditions that force women and girls to leave the country and make them extremely vulnerable to trafficking in persons for the purpose of prostitution, domestic servitude or forced marriage and the subjection of women and girls to gender-based discrimination, including in the political and social spheres, forced abortions and other forms of sexual and gender-based violence; (viii) Violations of the human rights and fundamental freedoms of children, in particular the continued lack of access to basic economic, social and cultural rights for many children, and in this regard notes the particularly vulnerable situation faced by, inter alia, returned or repatriated children, street children, children with disabilities, children whose parents are detained, children living in detention or in institutions and children in conflict with the law; (ix) Violations of the human rights and fundamental freedoms of persons with disabilities, especially violations involving the use of collective camps and coercive measures that target the rights of persons with disabilities to decide __________________ 15 United Nations, Treaty Series, vol. 189, No. 2545. 16 Ibid., vol. 606, No. 8791. A/RES/73/180 Situation of human rights in the Democratic People\u2019s Republic of Korea 18-22276 6/10 freely and responsibly on the number and spacing of their children and allegations of the possible use of persons with disabilities in medical testing, forced relocation to rural areas and separation of children with disabilities from their parents; (x) Violations of workers\u2019 rights, including the right to freedom of association and effective recognition of the right to collective bargaining, the right to strike as defined by the obligations of the Democratic People\u2019s Republic of Korea under the International Covenant on Economic, Social and Cultural Rights,5 and the prohibition of the economic exploitation of children and of any harmful or hazardous work of children as defined by the obligations of the Democratic People\u2019s Republic of Korea under the Convention on the Rights of the Child, 6 as well as the exploitation of workers sent abroad from the Democratic People\u2019s Republic of Korea to work under conditions that reportedly amount to forced labour, recalling paragraph 11 of Security Council resolution 2371 (2017) and paragraph 17 of resolution 2375 (2017), in which the Council decided that Member States shall not provide work authorizations for nationals of the Democratic People\u2019s Republic of Korea in their jurisdictions, and also recalling paragraph 8 of Council resolution 2397 (2017), in which the Council decided that Member States shall repatriate to the Democratic People\u2019s Republic of Korea all nationals from the Democratic People\u2019s Republic of Korea earning income in that Member State\u2019s jurisdiction and all government safety oversight attach\u00e9s of the Democratic People\u2019s Republic of Korea monitoring workers from the Democratic People\u2019s Republic of Korea abroad immediately, but not later than 24 months from 22 December 2017, unless the Member State determines that a Democratic People\u2019s Republic of Korea national is a national of that Member State or a Democratic People\u2019s Republic of Korea national\u2019s repatriation is prohibited, subject to applicable national and international law, including international refugee law and international human rights law, the Agreement between the United Nations and the United States of America regarding the Headquarters of the United Nations17 and the Convention on the Privileges and Immunities of the United Nations,18 and urges the Democratic People\u2019s Republic of Korea to promote, respect and protect the human rights of workers, including workers repatriated to the Democratic People\u2019s Republic of Korea; (xi) Discrimination based on the songbun system, which classifies people on the basis of State-assigned social class and birth and also includes consideration of political opinions and religion; (xii) Violence and discrimination against women, including unequal access to employment, discriminatory laws and regulations; (b) The continued refusal of the Government of the Democratic People\u2019s Republic of Korea to extend an invitation to the Special Rapporteur of the Human Rights Council on the situation of human rights in the Democratic People\u2019s Republic of Korea or to extend cooperation to the Special Rapporteur and several other United Nations special procedures in accordance with their terms of reference, as well as to other United Nations human rights mechanisms; (c) The continued lack of acknowledgement by the Government of the Democratic People\u2019s Republic of Korea of the grave human rights situation in the country and its consequential lack of action to report on the state of implementation __________________ 17 See resolution 169 (II). 18 Resolution 22 A (I). Situation of human rights in the Democratic People\u2019s Republic of Korea A/RES/73/180 7/10 18-22276 of the recommendations contained in the outcome of its first universal periodic review19 and to give consideration to the concluding observations of the treaty bodies;",
    "3": "Condemns the systematic abduction, denial of repatriation and subsequent enforced disappearance of persons, including those from other countries, on a large scale and as a matter of State policy, and in this regard strongly calls upon the Government of the Democratic People\u2019s Republic of Korea urgently to resolve these issues of international concern, in a transparent manner, including by ensuring the immediate return of abductees;",
    "4": "Underscores its very serious concern regarding reports of torture, summary executions, arbitrary detention, abductions and other forms of human rights violations and abuses that the Democratic People\u2019s Republic of Korea commits against citizens of other countries within and outside of its territory;",
    "5": "Expresses its very deep concern at the precarious humanitarian situation in the country, which could rapidly deteriorate owing to limited resilience to natural disasters and to government policies causing limitations in the availability of and access to adequate food, compounded by structural weaknesses in agricultural production resulting in significant shortages of diversified food and the State restrictions on the cultivation of and trade in foodstuffs, as well as the prevalence of chronic and acute malnutrition, particularly among the most vulnerable groups, pregnant and lactating women, children, persons with disabilities, older persons and political prisoners, and urges the Government of the Democratic People\u2019s Republic of Korea, in this regard, to take preventive and remedial action, cooperating with international donor agencies and in accordance with international standards for monitoring humanitarian assistance;",
    "6": "Welcomes the latest report to the Human Rights Council of the Special Rapporteur on the situation of human rights in the Democratic People\u2019s Republic of Korea;20",
    "7": "Reiterates its appreciation for the report of the group of independent experts on accountability for human rights violations in the Democratic People\u2019s Republic of Korea21 established pursuant to Human Rights Council resolution 31/18 of 23 March 2016,22 including options to seek accountability and secure truth and justice for all victims;",
    "8": "Welcomes steps taken pursuant to Human Rights Council resolution 34/24 of 24 March 2017 23 to strengthen the capacity of the Office of the United Nations High Commissioner for Human Rights, including its field-based structure in Seoul, to allow the implementation of relevant recommendations made by the group of independent experts on accountability aimed at strengthening current monitoring and documentation efforts, establishing a central repository for information and evidence and having experts in legal accountability assess all information and testimonies with a view to developing possible strategies to be used in any future accountability process, and strongly encourages the Office of the High Commissioner to expedite the process for strengthening the capacity of the Office;",
    "9": "Reiterates its appreciation for the work of the commission of inquiry, recognizes the continuing importance of its report, and regrets that the commission __________________ 19 A/HRC/13/13. 20 A/HRC/37/69. 21 A/HRC/34/66/Add.1. 22 See Official Records of the General Assembly, Seventy-first Session, Supplement No. 53 (A/71/53), chap. IV, sect. A. 23 Ibid., Seventy-second Session, Supplement No. 53 (A/72/53), chap. IV, sect. A. A/RES/73/180 Situation of human rights in the Democratic People\u2019s Republic of Korea 18-22276 8/10 received no cooperation from the authorities of the Democratic People\u2019s Republic of Korea, including with regard to access to the country;",
    "10": "Acknowledges the commission\u2019s finding that the body of testimony gathered and the information received provide reasonable grounds to believe that crimes against humanity have been committed in the Democratic People\u2019s Republic of Korea, pursuant to policies established at the highest level of the State for decades and by institutions under the effective control of its leadership;",
    "11": "Expresses its concern at the failure of the authorities of the Democratic People\u2019s Republic of Korea to prosecute those responsible for human rights violations, including violations which the commission of inquiry has said may amount to crimes against humanity, and encourages the international community to cooperate with accountability efforts and to ensure that such crimes do not remain unpunished;",
    "12": "Encourages the Security Council to continue its consideration of the relevant conclusions and recommendations of the commission of inquiry and take appropriate action to ensure accountability, including through consideration of referral of the situation in the Democratic People\u2019s Republic of Korea to the International Criminal Court and consideration of the further development of sanctions in order to target effectively those who appear to be most responsible for human rights violations that the commission has said may constitute crimes against humanity;",
    "13": "Also encourages the Security Council to continue to discuss the situation in the Democratic People\u2019s Republic of Korea, including the country\u2019s human rights situation, in the light of the serious concerns expressed in the present resolution, and looks forward to its continued and more active engagement on this matter;",
    "14": "Encourages the continuing endeavours of the Office of the United Nations High Commissioner for Human Rights field-based structure in Seoul, and welcomes its regular reporting to the Human Rights Council;",
    "15": "Calls upon Member States to undertake to ensure that the field-based structure of the Office of the High Commissioner can function with independence, has sufficient resources and support to fulfil its mandate, enjoys full cooperation with relevant Member States and is not subjected to any reprisals or threats;",
    "16": "Strongly urges the Government of the Democratic People\u2019s Republic of Korea to respect fully all human rights and fundamental freedoms and, in this regard: (a) To immediately put an end to the systematic, widespread and grave violations of human rights emphasized above, inter alia, by implementing fully the measures set out in the above-mentioned resolutions of the General Assembly, the Commission on Human Rights and the Human Rights Council, and the recommendations addressed to the Democratic People\u2019s Republic of Korea by the Council in the context of the universal periodic review and by the commission of inquiry, the United Nations special procedures and treaty bodies; (b) To immediately close the political prison camps and to release all political prisoners unconditionally and without any delay; (c) To protect its inhabitants, address the issue of impunity and ensure that those responsible for crimes involving violations of human rights are brought to justice before an independent judiciary; (d) To tackle the root causes leading to refugee outflows and prosecute those who exploit refugees through migrant smuggling, trafficking in human beings and extortion, while not criminalizing refugees and the victims of trafficking; Situation of human rights in the Democratic People\u2019s Republic of Korea A/RES/73/180 9/10 18-22276 (e) To ensure that everyone within the territory of the Democratic People\u2019s Republic of Korea enjoys the right to liberty of movement and is free to leave the country, including for the purpose of seeking asylum outside the Democratic People\u2019s Republic of Korea, without interference by the authorities of the Democratic People\u2019s Republic of Korea; (f) To ensure that citizens of the Democratic People\u2019s Republic of Korea who are expelled or returned to the Democratic People\u2019s Republic of Korea are able to return in safety and dignity, are treated humanely and are not subjected to any kind of punishment, and to provide information on their status and treatment; (g) To provide citizens of other countries detained in the Democratic People\u2019s Republic of Korea with protections, including freedom of communication with, and access to, consular officers in accordance with the Vienna Convention on Consular Relations,24 to which the Democratic People\u2019s Republic of Korea is a party, and any other necessary arrangements to confirm their status and to communicate with their families; (h) To extend its full cooperation to the Special Rapporteur, including by granting him full, free and unimpeded access to the Democratic People\u2019s Republic of Korea, and to other special procedures of the Human Rights Council as well as to other United Nations human rights mechanisms so that a full needs assessment of the human rights situation may be made; (i) To engage in technical cooperation activities in the field of human rights with the United Nations High Commissioner for Human Rights and her Office, as pursued by the High Commissioner in recent years, with a view to improving the situation of human rights in the country; (j) To implement the accepted recommendations stemming from the universal periodic review and to consider positively those recommendations which are still under consideration, and to submit a report to the Human Rights Council for consideration during the third review cycle; (k) To become a member of the International Labour Organization, to enact legislation and adopt practices to comply with international labour standards and to consider ratifying all the relevant conventions, in particular the core labour conventions of the International Labour Organization; (l) To continue and reinforce its cooperation with United Nations humanitarian agencies; (m) To ensure full, safe and unhindered access to humanitarian aid, as well as to critical data, and take measures to allow humanitarian agencies to secure the impartial delivery of such aid to all parts of the country, including detention facilities, on the basis of need in accordance with humanitarian principles, as it pledged to do, to ensure access to adequate food and implement more effective food security and nutrition policies, including through sustainable agriculture, sound food production and distribution measures and the allocation of more funds to the food sector, and to ensure adequate monitoring of humanitarian assistance; (n) To further improve cooperation with the United Nations country team members and development agencies so that they can directly contribute to improving the living conditions of the civilian population, including progress towards the achievement of the Sustainable Development Goals;13 (o) To consider ratifying and acceding to the remaining international human rights treaties, which would enable a dialogue with the human rights treaty bodies, to __________________ 24 United Nations, Treaty Series, vol. 596, No. 8638. A/RES/73/180 Situation of human rights in the Democratic People\u2019s Republic of Korea 18-22276 10/10 resume reporting to monitoring bodies on treaties to which it is a party, to participate meaningfully in treaty body reviews, and to give consideration to the concluding observations of such bodies in order to improve the human rights situation in the country;",
    "17": "Urges the Government of the Democratic People\u2019s Republic of Korea to implement the recommendations of the commission of inquiry without delay;",
    "18": "Reiterates the importance of maintaining high on the international agenda the grave human rights situation in the Democratic People\u2019s Republic of Korea, including through sustained communications, advocacy and outreach initiatives, and requests the Office of the United Nations High Commissioner for Human Rights to strengthen those activities;",
    "19": "Encourages all Member States, the General Assembly, the Human Rights Council, the Office of the High Commissioner, the United Nations Secretariat, relevant specialized agencies, regional intergovernmental organizations and forums, civil society organizations, foundations and engaged business enterprises and other stakeholders towards which the commission of inquiry has directed recommendations to implement or take forward those recommendations;",
    "20": "Encourages the United Nations system as a whole to continue to address the grave human rights situation in the Democratic People\u2019s Republic of Korea in a coordinated and unified manner; 21 Encourages the relevant United Nations programmes, funds, specialized agencies and other related organizations to assist the Government of the Democratic People\u2019s Republic of Korea in the implementation of recommendations stemming from the universal periodic review and from the report of the commission of inquiry;",
    "22": "Calls upon the Democratic People\u2019s Republic of Korea to engage constructively with international interlocutors with a view to promoting concrete improvements in the human rights situation on the ground, including through human rights dialogues, official visits to the country that include adequate access to fully assess human rights conditions, cooperation initiatives and more people-to-people contact as a matter of priority;",
    "23": "Decides to continue its examination of the situation of human rights in the Democratic People\u2019s Republic of Korea at its seventy-fourth session, and to this end requests the Secretary-General to submit a comprehensive report on the situation of human rights in the Democratic People\u2019s Republic of Korea, and requests the Special Rapporteur to continue to report his findings and recommendations, as well as to report on the follow-up to the implementation of the recommendations of the commission of inquiry. 56th plenary meeting 17 December 2018"
  },
  "agenda_items": [
    "Item 74"
  ],
  "symbol_references": []
}