{
  "symbol": "A/RES/74/17",
  "filename": "A_RES_74_17.pdf",
  "title": "74/17. Problem of the militarization of the Autonomous Republic of Crimea and the city of Sevastopol, Ukraine, as well as parts of the Black Sea and the Sea of Azov",
  "text": "United Nations \nA/RES/74/17\n \n \nGeneral Assembly \nDistr.: General \n13 December 2019 \n \n19-21186 (E)    171219     \n*1921186* \n \n \nSeventy-fourth session \nAgenda item 31 (a) \nPrevention of armed conflict: prevention of armed conflict \n \n \n \n \n Resolution adopted by the General Assembly \non 9 December 2019 \n \n \n \n \n[without reference to a Main Committee (A/74/L.12/Rev.1 and \nA/74/L.12/Rev.1/Add.1)] \n \n \n \n74/17. Problem of the militarization of the Autonomous Republic \nof Crimea and the city of Sevastopol, Ukraine, as well as \nparts of the Black Sea and the Sea of Azov \n \n \n \nThe General Assembly, \n \nRecalling the Charter of the United Nations, in which it is stated, inter alia, that \nall Members of the United Nations shall refrain in their international relations from \nthe threat or use of force against the territorial integrity or political independence of \nany State, or in any other manner inconsistent with the purposes of the United \nNations, \n \nRecalling also its resolution 68/262 of 27 March 2014 on the territorial integrity \nof Ukraine, in which it affirmed its commitment to the sovereignty, political \nindependence, unity and territorial integrity of Ukraine within its internationally \nrecognized borders, \n \nRecalling further its resolution 73/194 of 17 December 2018 on the problem of \nthe militarization of the Autonomous Republic of Crimea and the city of Sevastopol, \nUkraine, as well as parts of the Black Sea and the Sea of Azov, \n \nRecalling its resolutions 71/205 of 19 December 2016, 72/190 of 19 December \n2017 and 73/263 of 22 December 2018 on the situation of human rights in the \nAutonomous Republic of Crimea and the city of Sevastopol, Ukraine, \n \nDeeply concerned that the provisions of those resolutions and relevant decisions \nof international organizations, specialized agencies and bodies within the United \nNations system have not been implemented by the Russian Federation, \n \nRecalling its resolution 3314 (XXIX) of 14 December 1974, \n \nCondemning the ongoing temporary occupation of part of the territory of \nUkraine, namely, the Autonomous Republic of Crimea and the city of Sevastopol \n\nA/RES/74/17 \nProblem of the militarization of the Autonomous Republic\nof Crimea and the city of Sevastopol, Ukraine, as well as\nparts of the Black Sea and the Sea of Azov\n \n19-21186\n2/4 \n \n(hereinafter referred to as \u201cCrimea\u201d), by the Russian Federation, and reaffirming the \nnon-recognition of its annexation, \n \nRecalling that the temporary occupation of Crimea and the threat or use of \nforce against the territorial integrity or political independence of Ukraine by the \nRussian Federation is in contravention of commitments made under the \nMemorandum on Security Assurances in Connection with Ukraine\u2019s Accession to \nthe Treaty on the Non-Proliferation of Nuclear Weapons (Budapest Memorandum) \nof 5 December 1994,1 in which, inter alia, the obligations to refrain from the threat or \nuse of force against the territorial integrity or political independence of Ukraine and \nthe commitment to respect the independence and sovereignty and the existing borders \nof Ukraine were reaffirmed, \n \nExpressing concern over the efforts of the Russian Federation to extend its \njurisdiction over the nuclear facilities and material in Crimea, \n \nAffirming that the seizure of Crimea by force is illegal and a violation of \ninternational law, and affirming also that those territories must be immediately \nreturned, \n \nRecalling the prohibition, in accordance with international humanitarian law, \nfor the occupying Power to compel protected persons to serve in its armed or auxiliary \nforces, including through pressure or propaganda that is aimed at securing voluntary \nenlistment, and condemning the ongoing recruitment campaign in Crimea and \ncriminal prosecutions of Crimean residents for draft evasion, \n \nConcerned by efforts to use the education of children in Crimea in order to \nindoctrinate them to join the Russian military forces, \n \nTaking note of the order of the International Tribunal for the Law of the Sea of \n25 May 2019 on provisional measures in the Case concerning the detention of three \nUkrainian naval vessels (Ukraine v. Russian Federation) and Procedural Order No. 1 \nof the Arbitral Tribunal Constituted under Annex VII to the 1982 United Nations \nConvention on the Law of the Sea between Ukraine and the Russian Federation in \nrespect of a Dispute concerning the Detention of Ukrainian Naval Vessels and \nServicemen of 22 November 2019, \n \nNoting the fact that security concerns and the build-up of forces in the Black \nSea and the Sea of Azov regions further destabilize the economy and social services, \nparticularly in the coastal regions of Ukraine, \n \nSupporting the commitment by Ukraine to adhere to international law in its \nefforts to put an end to the temporary Russian occupation of Crimea, \n \n1. \nStresses that the presence of Russian troops in Crimea is contrary to the \nnational sovereignty, political independence and territorial integrity of Ukraine and \nundermines the security and stability of neighbouring countries and the European \nregion; \n \n2. \nExpresses its grave concern over the progressive militarization of Crimea \nby the Russian Federation as the occupying Power, and also expresses concern over \nreports of the continuing destabilization of Crimea owing to transfers by the Russian \nFederation of weapon systems, including nuclear-capable aircraft and missiles, \nweapons, ammunition and military personnel to the territory of Ukraine, and urges \nthe Russian Federation to stop such activity; \n \n3. \nExpresses its deep concern over the use of seized Ukrainian military \nindustry enterprises in the occupied Crimea by the Russian Federation; \n__________________ \n \n1  A/49/765-S/1994/1399, annex I. \n\nProblem of the militarization of the Autonomous Republic \nof Crimea and the city of Sevastopol, Ukraine, as well as \nparts of the Black Sea and the Sea of Azov \nA/RES/74/17\n \n3/4\n19-21186 \n \n \n4. \nCalls upon the Russian Federation to refrain from efforts to extend its \njurisdiction over the nuclear facilities and material in Crimea; \n \n5. \nExpresses its deep concern over the conscription by the Russian \nFederation of the residents of Crimea into its armed forces, including assignment to \nmilitary bases in the Russian Federation, and urges the Russian Federation to stop \nsuch illegal activity; \n \n6. \nExpresses its concern regarding multiple military exercises of Russian \narmed forces held in Crimea, which undermine regional security and entail \nconsiderable long-term negative environmental consequences in the region; \n \n7. \nAlso expresses its concern over the ongoing actions of the Russian \nFederation in parts of the Black Sea surrounding Crimea, in the Sea of Azov and in \nthe Kerch Strait, including their militarization, which pose further threats to Ukraine \nand undermine the stability of the broader region; \n \n8. \nExpresses its utmost concern about the dangerous increase in tensions and \nthe unjustified use of force by the Russian Federation against Ukraine, including \nagainst three vessels of the naval forces of Ukraine, namely, the Berdyansk, the \nNikopol and the tugboat Yani Kapu, on 25 November 2018 in the Black Sea, which \ninvolved the serious wounding of some of their crew members and the intentional \nobstruction of traffic through the Kerch Strait; \n \n9. \nWelcomes the release by the Russian Federation of 24 crew members of \nthree vessels of the naval forces of Ukraine, namely, the Berdyansk, the Nikopol and \nthe tugboat Yani Kapu; \n \n10. Calls upon the Russian Federation to return unconditionally and without \ndelay all equipment and weapons seized from the released vessels, the Berdyansk, the \nNikopol and the tugboat Yani Kapu, to the custody of Ukraine; \n \n11. \nEncourages further negotiations to ensure the release by the Russian \nFederation of all illegally detained Ukrainian citizens and their safe return to Ukraine; \n \n12. Calls upon the Russian Federation to refrain from impeding the lawful \nexercise of navigational rights and freedoms, including but not limited to closure of \nsea areas under the pretext of military exercises, in the Black Sea, the Sea of Azov \nand the Kerch Strait in accordance with applicable international law, including \nprovisions of the 1982 United Nations Convention on the Law of the Sea; 2  \n \n13. Condemns the construction and opening by the Russian Federation of the \nKerch Strait bridge between the Russian Federation and temporarily occupied \nCrimea, which facilitates the further militarization of Crimea and restricts the size of \nships that can reach the Ukrainian ports on the Azov coast, and also condemns the \nincreasing military presence of the Russian Federation in parts of the Black Sea and \nthe Sea of Azov, including the Kerch Strait, and the harassment of commercial vessels \nby the Russian Federation and its restriction of international shipping there, which \nfurther aggravates the economic and social situation in the broader Donetsk region \nalready affected by the temporary occupation of Crimea; \n \n14. Also condemns visits of Russian officials to the temporarily occupied \nCrimea, including those in connection with conducting military exercises; \n \n15. Calls upon all Member States, as well as international organizations and \nspecialized agencies, to refrain from any visits to Crimea that are not agreed with \nUkraine; \n__________________ \n \n2  United Nations, Treaty Series, vol. 1833, No. 31363. \n\nA/RES/74/17 \nProblem of the militarization of the Autonomous Republic\nof Crimea and the city of Sevastopol, Ukraine, as well as\nparts of the Black Sea and the Sea of Azov\n \n19-21186\n4/4 \n \n \n16. Urges the Russian Federation, as the occupying Power, to withdraw its \nmilitary forces from Crimea and to end its temporary occupation of Ukrainian \nterritory without delay; \n \n17. Calls upon all Member States to cooperate with the United Nations to \nencourage and support efforts to put an end to the Russian occupation of Crimea as \nrapidly as possible and to refrain from any dealings with the Russian Federation \nregarding Crimea that are inconsistent with this aim; \n \n18. Decides to continue its consideration of the matter at its seventy-fifth \nsession. \n \n41st plenary meeting \n9 December 2019 \n \n",
  "paragraphs": {
    "1": "Stresses that the presence of Russian troops in Crimea is contrary to the national sovereignty, political independence and territorial integrity of Ukraine and undermines the security and stability of neighbouring countries and the European region;",
    "2": "Expresses its grave concern over the progressive militarization of Crimea by the Russian Federation as the occupying Power, and also expresses concern over reports of the continuing destabilization of Crimea owing to transfers by the Russian Federation of weapon systems, including nuclear-capable aircraft and missiles, weapons, ammunition and military personnel to the territory of Ukraine, and urges the Russian Federation to stop such activity;",
    "3": "Expresses its deep concern over the use of seized Ukrainian military industry enterprises in the occupied Crimea by the Russian Federation; __________________ 1 A/49/765-S/1994/1399, annex I. Problem of the militarization of the Autonomous Republic of Crimea and the city of Sevastopol, Ukraine, as well as parts of the Black Sea and the Sea of Azov A/RES/74/17 3/4 19-21186",
    "4": "Calls upon the Russian Federation to refrain from efforts to extend its jurisdiction over the nuclear facilities and material in Crimea;",
    "5": "Expresses its deep concern over the conscription by the Russian Federation of the residents of Crimea into its armed forces, including assignment to military bases in the Russian Federation, and urges the Russian Federation to stop such illegal activity;",
    "6": "Expresses its concern regarding multiple military exercises of Russian armed forces held in Crimea, which undermine regional security and entail considerable long-term negative environmental consequences in the region;",
    "7": "Also expresses its concern over the ongoing actions of the Russian Federation in parts of the Black Sea surrounding Crimea, in the Sea of Azov and in the Kerch Strait, including their militarization, which pose further threats to Ukraine and undermine the stability of the broader region;",
    "8": "Expresses its utmost concern about the dangerous increase in tensions and the unjustified use of force by the Russian Federation against Ukraine, including against three vessels of the naval forces of Ukraine, namely, the Berdyansk, the Nikopol and the tugboat Yani Kapu, on 25 November 2018 in the Black Sea, which involved the serious wounding of some of their crew members and the intentional obstruction of traffic through the Kerch Strait;",
    "9": "Welcomes the release by the Russian Federation of 24 crew members of three vessels of the naval forces of Ukraine, namely, the Berdyansk, the Nikopol and the tugboat Yani Kapu;",
    "10": "Calls upon the Russian Federation to return unconditionally and without delay all equipment and weapons seized from the released vessels, the Berdyansk, the Nikopol and the tugboat Yani Kapu, to the custody of Ukraine;",
    "11": "Encourages further negotiations to ensure the release by the Russian Federation of all illegally detained Ukrainian citizens and their safe return to Ukraine;",
    "12": "Calls upon the Russian Federation to refrain from impeding the lawful exercise of navigational rights and freedoms, including but not limited to closure of sea areas under the pretext of military exercises, in the Black Sea, the Sea of Azov and the Kerch Strait in accordance with applicable international law, including provisions of the 1982 United Nations Convention on the Law of the Sea; 2",
    "13": "Condemns the construction and opening by the Russian Federation of the Kerch Strait bridge between the Russian Federation and temporarily occupied Crimea, which facilitates the further militarization of Crimea and restricts the size of ships that can reach the Ukrainian ports on the Azov coast, and also condemns the increasing military presence of the Russian Federation in parts of the Black Sea and the Sea of Azov, including the Kerch Strait, and the harassment of commercial vessels by the Russian Federation and its restriction of international shipping there, which further aggravates the economic and social situation in the broader Donetsk region already affected by the temporary occupation of Crimea;",
    "14": "Also condemns visits of Russian officials to the temporarily occupied Crimea, including those in connection with conducting military exercises;",
    "15": "Calls upon all Member States, as well as international organizations and specialized agencies, to refrain from any visits to Crimea that are not agreed with Ukraine; __________________ 2 United Nations, Treaty Series, vol. 1833, No. 31363. A/RES/74/17 Problem of the militarization of the Autonomous Republic of Crimea and the city of Sevastopol, Ukraine, as well as parts of the Black Sea and the Sea of Azov 19-21186 4/4",
    "16": "Urges the Russian Federation, as the occupying Power, to withdraw its military forces from Crimea and to end its temporary occupation of Ukrainian territory without delay;",
    "17": "Calls upon all Member States to cooperate with the United Nations to encourage and support efforts to put an end to the Russian occupation of Crimea as rapidly as possible and to refrain from any dealings with the Russian Federation regarding Crimea that are inconsistent with this aim;",
    "18": "Decides to continue its consideration of the matter at its seventy-fifth session. 41st plenary meeting 9 December 2019"
  },
  "agenda_items": [
    "Item 31"
  ],
  "symbol_references": [
    "A/74/L.12"
  ]
}