{
  "symbol": "A/RES/72/124",
  "filename": "A_RES_72_124.pdf",
  "title": "72/124. Report of the Committee on Relations with the Host Country",
  "text": "United Nations \nA/RES/72/124\n \n \nGeneral Assembly \nDistr.: General \n18 December 2017 \n \n17-22168 (E)    201217     \n*1722168* \n \n \nSeventy-second session \nAgenda item 166 \n \n \n \n \n Resolution adopted by the General Assembly \non 7 December 2017 \n \n \n \n \n[on the report of the Sixth Committee (A/72/469)] \n \n \n 72/124. Report of the Committee on Relations with the Host Country \n \n \n \nThe General Assembly, \n \nHaving considered the report of the Committee on Relations with the Host \nCountry,1 \n \nRecalling Article 105 of the Charter of the United Nations, the Convention on \nthe Privileges and Immunities of the United Nations,2 the Agreement between the \nUnited Nations and the United States of America regarding the Headquarters of the \nUnited Nations3 and the responsibilities of the host country, \n \nRecalling also that, in accordance with paragraph 7 of General Assembly \nresolution 2819 (XXVI) of 15 December 1971, the Committee should consider, and \nadvise the host country on, issues arising in connection with the implementation of \nthe Headquarters Agreement, \n \nRecognizing that effective measures should continue to be taken by the \ncompetent authorities of the host country, in particular to prevent any acts violating \nthe security of missions and the safety of their personnel, \n \n1. \nEndorses the recommendations and conclusions of the Committee on \nRelations with the Host Country contained in paragraph 89 of its report;1 \n \n2. \nConsiders that the maintenance of appropriate conditions for the normal \nwork of the delegations and the missions accredited to the United Nations and the \nobservance of their privileges and immunities, which cannot be subject to any \nrestrictions arising from the bilateral relations of the host country, are in the interest \nof the United Nations and all Member States, requests the host country to continue to \nsolve, through negotiations, problems that might arise and to take all measures \nnecessary to prevent any interference with the functioning of missions, and urges the \n__________________ \n \n1  Official Records of the General Assembly, Seventy-second Session, Supplement No. 26 (A/72/26). \n \n2  Resolution 22 A (I). \n \n3  See resolution 169 (II). \n\nA/RES/72/124 \nReport of the Committee on Relations with the Host Country\n \n17-22168 \n2/3 \n \nhost country to continue to take appropriate action, such as training of police, security, \ncustoms and border control officers, with a view to maintaining respect for diplomatic \nprivileges and immunities and if violations occur to ensure that such cases are \nproperly investigated and remedied, in accordance with applicable law; \n \n3. \nRecalls the privileges and immunities applicable to the premises of the \npermanent missions to the United Nations enjoyed under international law, in particular \nthe instruments listed in paragraph 89 (a) of the report of the Committee on Relations \nwith the Host Country, and the obligations of the host country to observe such \nprivileges and immunities, takes note of the alleged violations thereof by the host \ncountry and of the concerns expressed thereon and urges the host country to address \nsuch alleged violations and to remove any restrictions inconsistent with those \nprivileges and immunities applied to the premises of a Permanent Mission, and in that \nregard ensure respect for such privileges and immunities, and remains seized of these \nmatters and anticipates that these issues shall be duly addressed in a spirit of \ncooperation and in accordance with international law; \n \n4. \nNotes the problems experienced by some permanent missions to the United \nNations in connection with the implementation of the Parking Programme for \nDiplomatic Vehicles,4 and notes that the Committee shall remain seized of the matter, \nwith a view to continuing to maintain the proper implementation of the Parking \nProgramme in a manner that is fair, non-discriminatory, effective and therefore \nconsistent with international law; \n \n5. \nRequests the host country to consider removing the remaining travel \nrestrictions imposed by it on staff of certain missions and staff members of the \nSecretariat of certain nationalities, and in this regard notes the long-standing positions \nof affected States, of the Secretary-General and of the host country; \n \n6. \nRecalls article IV of the Agreement between the United Nations and the \nUnited States of America regarding the Headquarters of the United Nations, 3 and \nnotes the concerns expressed by some delegations concerning the denial and delay of \nentry visas to representatives of Member States; \n \n7. \nNotes that the Committee anticipates that the host country will continue to \nenhance its efforts to ensure the issuance of entry visas to representatives of Member \nStates pursuant to article IV, section 11, of the Headquarters Agreement and in a \ntimely manner, to enable travel to New York on United Nations business and that the \nCommittee anticipates that the host country will continue to enhance efforts, \nincluding visa issuance, to facilitate the participation of representatives of Member \nStates in other United Nations meetings, as appropriate; \n \n8. \nAlso notes that a number of delegations have requested shortening the time \nframe applied by the host country for issuance of entry visas to representatives of \nMember States since the time frame poses difficulties for the full-fledged participation \nof Member States in United Nations meetings, and invites the host country to inform \nthe Committee, as appropriate, of efforts to address such difficulties; \n \n9. \nNotes with concern the difficulties experienced by some permanent \nmissions to the United Nations in obtaining suitable banking services, and welcomes \nthe continued efforts of the host country to facilitate the opening of bank accounts for \nthose permanent missions; \n \n10. Stresses the need for the permanent missions and the United Nations to \nbenefit from appropriate banking services, and anticipates that the host country will \n__________________ \n \n4  A/AC.154/355, annex. \n\nReport of the Committee on Relations with the Host Country \nA/RES/72/124\n \n3/3 \n17-22168 \n \ncontinue to assist the permanent missions accredited to the United Nations and their \nstaff in obtaining such services;  \n \n11. \nExpresses its appreciation for the efforts made by the host country, and \nexpects that the issues raised at the meetings of the Committee will be resolved in a \nspirit of cooperation and in accordance with international law, including the \nHeadquarters Agreement; \n \n12. Affirms the importance of the Committee being in a position to fulfil its \nmandate and meet on short notice to deal with urgent and important matters \nconcerning the relations between the United Nations and the host country, and in that \nconnection requests the Secretariat and the Committee on Conferences to accord \npriority to requests from the Committee on Relations with the Host Country for \nconference-servicing facilities for meetings of that Committee that must be held while \nthe General Assembly and its Main Committees are meeting, without prejudice to the \nrequirements of those bodies and on an \u201cas available\u201d basis; \n \n13. Requests the Secretary-General to remain actively engaged in all aspects \nof the relations of the United Nations with the host country, and recalls that the \nSecretary-General may bring to the attention of the Committee issues of mutual \nconcern relating to the implementation of the Headquarters Agreement and the \nConvention on the Privileges and Immunities of the United Nations; 2 \n \n14. Requests the Committee to continue its work in conformity with General \nAssembly resolution 2819 (XXVI) and, in this framework, to continue to consider \nadditional appropriate measures to enhance the work of the Committee and its \neffectiveness; \n \n15. Decides to include in the provisional agenda of its seventy-third session \nthe item entitled \u201cReport of the Committee on Relations with the Host Country\u201d. \n \n67th plenary meeting  \n7 December 2017 \n \n",
  "paragraphs": {
    "1": "Endorses the recommendations and conclusions of the Committee on Relations with the Host Country contained in paragraph 89 of its report;1",
    "2": "Considers that the maintenance of appropriate conditions for the normal work of the delegations and the missions accredited to the United Nations and the observance of their privileges and immunities, which cannot be subject to any restrictions arising from the bilateral relations of the host country, are in the interest of the United Nations and all Member States, requests the host country to continue to solve, through negotiations, problems that might arise and to take all measures necessary to prevent any interference with the functioning of missions, and urges the host country to continue to take appropriate action, such as training of police, security, customs and border control officers, with a view to maintaining respect for diplomatic privileges and immunities and if violations occur to ensure that such cases are properly investigated and remedied, in accordance with applicable law;",
    "3": "Recalls the privileges and immunities applicable to the premises of the permanent missions to the United Nations enjoyed under international law, in particular the instruments listed in paragraph 89 (a) of the report of the Committee on Relations with the Host Country, and the obligations of the host country to observe such privileges and immunities, takes note of the alleged violations thereof by the host country and of the concerns expressed thereon and urges the host country to address such alleged violations and to remove any restrictions inconsistent with those privileges and immunities applied to the premises of a Permanent Mission, and in that regard ensure respect for such privileges and immunities, and remains seized of these matters and anticipates that these issues shall be duly addressed in a spirit of cooperation and in accordance with international law;",
    "4": "Notes the problems experienced by some permanent missions to the United Nations in connection with the implementation of the Parking Programme for Diplomatic Vehicles,4 and notes that the Committee shall remain seized of the matter, with a view to continuing to maintain the proper implementation of the Parking Programme in a manner that is fair, non-discriminatory, effective and therefore consistent with international law;",
    "5": "Requests the host country to consider removing the remaining travel restrictions imposed by it on staff of certain missions and staff members of the Secretariat of certain nationalities, and in this regard notes the long-standing positions of affected States, of the Secretary-General and of the host country;",
    "6": "Recalls article IV of the Agreement between the United Nations and the United States of America regarding the Headquarters of the United Nations, 3 and notes the concerns expressed by some delegations concerning the denial and delay of entry visas to representatives of Member States;",
    "7": "Notes that the Committee anticipates that the host country will continue to enhance its efforts to ensure the issuance of entry visas to representatives of Member States pursuant to article IV, section 11, of the Headquarters Agreement and in a timely manner, to enable travel to New York on United Nations business and that the Committee anticipates that the host country will continue to enhance efforts, including visa issuance, to facilitate the participation of representatives of Member States in other United Nations meetings, as appropriate;",
    "8": "Also notes that a number of delegations have requested shortening the time frame applied by the host country for issuance of entry visas to representatives of Member States since the time frame poses difficulties for the full-fledged participation of Member States in United Nations meetings, and invites the host country to inform the Committee, as appropriate, of efforts to address such difficulties;",
    "9": "Notes with concern the difficulties experienced by some permanent missions to the United Nations in obtaining suitable banking services, and welcomes the continued efforts of the host country to facilitate the opening of bank accounts for those permanent missions;",
    "10": "Stresses the need for the permanent missions and the United Nations to benefit from appropriate banking services, and anticipates that the host country will continue to assist the permanent missions accredited to the United Nations and their staff in obtaining such services;",
    "11": "Expresses its appreciation for the efforts made by the host country, and expects that the issues raised at the meetings of the Committee will be resolved in a spirit of cooperation and in accordance with international law, including the Headquarters Agreement;",
    "12": "Affirms the importance of the Committee being in a position to fulfil its mandate and meet on short notice to deal with urgent and important matters concerning the relations between the United Nations and the host country, and in that connection requests the Secretariat and the Committee on Conferences to accord priority to requests from the Committee on Relations with the Host Country for conference-servicing facilities for meetings of that Committee that must be held while the General Assembly and its Main Committees are meeting, without prejudice to the requirements of those bodies and on an \u201cas available\u201d basis;",
    "13": "Requests the Secretary-General to remain actively engaged in all aspects of the relations of the United Nations with the host country, and recalls that the Secretary-General may bring to the attention of the Committee issues of mutual concern relating to the implementation of the Headquarters Agreement and the Convention on the Privileges and Immunities of the United Nations; 2",
    "14": "Requests the Committee to continue its work in conformity with General Assembly resolution 2819 (XXVI) and, in this framework, to continue to consider additional appropriate measures to enhance the work of the Committee and its effectiveness;",
    "15": "Decides to include in the provisional agenda of its seventy-third session the item entitled \u201cReport of the Committee on Relations with the Host Country\u201d."
  },
  "agenda_items": [
    "Item 166"
  ],
  "symbol_references": []
}