{
  "symbol": "A/RES/75/272",
  "filename": "A_RES_75_272.pdf",
  "title": "75/272. Role of the United Nations Regional Centre for Preventive Diplomacy for Central Asia",
  "text": "United Nations \nA/RES/75/272\n \n \nGeneral Assembly \nDistr.: General \n20 April 2021 \n \n21-05140 (E)    220421 \n*2105140* \n \n \nSeventy-fifth session \nAgenda item 64 \nPeacebuilding and sustaining peace \n \n \n \n \n Resolution adopted by the General Assembly \non 16 April 2021 \n \n \n \n \n[without reference to a Main Committee (A/75/L.72 and A/75/L.72/Add.1)] \n \n \n 75/272. Role of the United Nations Regional Centre for Preventive \nDiplomacy for Central Asia \n \n \n \nThe General Assembly, \n \nGuided by the Charter of the United Nations, \n \nRecalling its resolution 72/7 of 17 November 2017, \n \nRecalling also the exchange of letters between the Secretary-General and the \nPresident of the Security Council on the establishment of a United Nations Regional \nCentre for Preventive Diplomacy for Central Asia in Ashgabat, 1 \n \nNoting that preventive diplomacy is a core function of the United Nations and \noccupies the central place among the functions of the Secretary-General, and in this \nregard recognizing the important role of the special political missions of the United \nNations and the good offices of the Secretary-General in the fields of peacemaking, \npeacekeeping and peacebuilding, \n \nReaffirming the importance of preventive diplomacy in supporting United \nNations efforts to assist in the peaceful settlement of disputes, and acknowledging in \nthis context the role of the Regional Centre in assisting the Central Asian States, in \naccordance with its mandate and through enhanced regional cooperation, to respond \nto transnational threats to peace and in supporting sustainable development in the \nregion, \n \nRecognizing the important role of the Central Asian countries in ensuring peace, \nstability and sustainable development in the region as well as in promoting regional \nand international cooperation, \n \nUnderstanding the importance of the creation and preservation of the most \nstable and secure Central Asian space, supporting the aspiration of the countries of \n__________________ \n \n1  S/2007/279 and S/2007/280. \n\nA/RES/75/272 \nRole of the United Nations Regional Centre for Preventive \nDiplomacy for Central Asia\n \n21-05140\n2/3 \n \nthe region to establish a model of a Central Asian regional zone of peace, security, \ncooperation and development, taking into account the experience gained in regional \ncooperation, as well as the assistance of the international community, represented by \nthe United Nations, \n \nNoting the focus of the Regional Centre on supporting cooperation among the \nCentral Asian States in the areas of counter-terrorism and prevention of violent \nextremism conducive to terrorism, with a view to the integrated and balanced \nimplementation of all pillars of the United Nations Global Counter-Terrorism \nStrategy2 in the region, \n \nRecalling the Ashgabat Declaration of the high-level United Nations-Central \nAsia dialogue on implementing the United Nations Global Counter-Terrorism \nStrategy in Central Asia, adopted on 13 June 2017, 3 and the Joint Plan of Action for \nthe Implementation of the United Nations Global Counter-Terrorism Strategy in \nCentral Asia, adopted on 30 November 2011, \n \nWelcoming the efforts of the Regional Centre aimed at strengthening \ncooperation between the Central Asian States and Afghanistan, \n \nWelcoming also the readiness of the Central Asian countries to make efforts to \nreach mutually beneficial agreements on the integrated use of water and energy \nresources in the region, \n \nWelcoming further the close interaction of the Regional Centre with United \nNations country teams, as well as the Peacebuilding Fund, in the areas of conflict \nprevention and peacebuilding, and noting the necessity of its further strengthening, \n \nRecognizing the efforts of the Regional Centre in providing a political \nframework and leadership for the preventive activities of the United Nations country \nteams in the region, and supporting the efforts of the Resident Coordinators and those \nof the United Nations system, including the Bretton Woods institutions, in promoting \nan integrated approach to preventive development and humanitarian assistance, \n \nUnderlining the necessity of countering illicit drug production and trafficking \nin the region, and in this regard commending the efforts being made by the Regional \nCentre, jointly with the United Nations Office on Drugs and Crime through its \nRegional Office for Central Asia, in Tashkent, and the Central Asian Regional \nInformation and Coordination Centre for combating the illicit trafficking of narcotic \ndrugs, psychotropic substances and their precursors, in Almaty, Kazakhstan, \n \nNoting the initiatives of the Regional Centre aimed at empowering women and \nyouth, such as the Preventive Diplomacy Academy to train young people in \npreventive diplomacy, and the Central Asian Women Leaders\u2019 Caucus, dedicated to \npromoting and fostering the role of all women in advancing sustainable development \nand supporting peace and security in the region and to promoting the participation of \nwomen at all levels of politics, society and the economy, \n \nWelcoming efforts of the Central Asian countries in coordinating joint \npreventive measures in the face of the coronavirus disease (COVID-19) pandemic and \nits consequences and the contribution of the Regional Centre in this regard, \n \n1. \nEncourages the United Nations Regional Centre for Preventive Diplomacy \nfor Central Asia to continue to liaise with the Governments of the region and, with \ntheir concurrence, with other parties concerned on issues relevant to preventive \ndiplomacy; \n__________________ \n \n2  Resolution 60/288. \n \n3  A/71/982\u2013S/2017/600, annex. \n\nRole of the United Nations Regional Centre for Preventive \nDiplomacy for Central Asia \nA/RES/75/272\n \n3/3\n21-05140 \n \n \n2. \nWelcomes the assistance of the Regional Centre in implementing the \ninitiatives of the Central Asian countries towards a stable, peaceful and prosperous \nregion; \n \n3. \nNotes the need to continue the cooperation of the Regional Centre with the \nCentral Asian countries within its mandate to mitigate the impacts of the COVID-19 \npandemic in the region; \n \n4. \nEncourages the Regional Centre to continue close cooperation with the \nGovernments of the region to strengthen the capacity of the region to overcome \nchallenges to peace, stability and sustainable development through preventive \ndiplomacy and dialogue. \n \n59th plenary meeting \n16 April 2021 \n \n",
  "paragraphs": {
    "1": "Encourages the United Nations Regional Centre for Preventive Diplomacy for Central Asia to continue to liaise with the Governments of the region and, with their concurrence, with other parties concerned on issues relevant to preventive diplomacy; __________________ 2 Resolution 60/288. 3 A/71/982\u2013S/2017/600, annex. Role of the United Nations Regional Centre for Preventive Diplomacy for Central Asia A/RES/75/272 3/3 21-05140",
    "2": "Welcomes the assistance of the Regional Centre in implementing the initiatives of the Central Asian countries towards a stable, peaceful and prosperous region;",
    "3": "Notes the need to continue the cooperation of the Regional Centre with the Central Asian countries within its mandate to mitigate the impacts of the COVID-19 pandemic in the region;",
    "4": "Encourages the Regional Centre to continue close cooperation with the Governments of the region to strengthen the capacity of the region to overcome challenges to peace, stability and sustainable development through preventive diplomacy and dialogue. 59th plenary meeting 16 April 2021"
  },
  "agenda_items": [
    "Item 64"
  ],
  "symbol_references": [
    "A/75/L.72"
  ]
}