{
  "symbol": "A/RES/74/292",
  "filename": "A_RES_74_292.pdf",
  "title": "74/292. Financing of the United Nations Interim Force in Lebanon",
  "text": "United Nations \nA/RES/74/292\n \n \nGeneral Assembly \nDistr.: General \n15 July 2020 \n \n20-08803 (E)    200720 \n*2008803*\n \n \n \nSeventy-fourth session \nAgenda item 160 (b) \nFinancing of the United Nations peacekeeping forces in the \nMiddle East: United Nations Interim Force in Lebanon \n \n \n \n \n Resolution adopted by the General Assembly \non 30 June 2020 \n \n \n \n \n[on the report of the Fifth Committee (A/74/920)] \n \n \n 74/292. Financing of the United Nations Interim Force in Lebanon  \n \n \n \nThe General Assembly, \n \nHaving considered the reports of the Secretary-General on the financing of the \nUnited Nations Interim Force in Lebanon 1 and the related report of the Advisory \nCommittee on Administrative and Budgetary Questions,2  \n \nRecalling Security Council resolution 425 (1978) of 19 March 1978 regarding \nthe establishment of the United Nations Interim Force in Lebanon and the subsequent \nresolutions by which the Council extended the mandate of the Force, the latest of \nwhich was resolution 2485 (2019) of 29 August 2019, by which the Council extended \nthe mandate of the Force until 31 August 2020,  \n \nRecalling also its resolution S-8/2 of 21 April 1978 on the financing of the Force \nand its subsequent resolutions thereon, the latest of which was resolution 73/322 of \n3 July 2019, as well as its decision 73/555 of 3 July 2019,  \n \nReaffirming the general principles underlying the financing of United Nations \npeacekeeping operations, as stated in its resolutions 1874 (S-IV) of 27 June 1963, \n3101 (XXVIII) of 11 December 1973 and 55/235 of 23 December 2000,  \n \nNoting with appreciation that voluntary contributions have been made to the \nForce,  \n \nMindful of the fact that it is essential to provide the Force with the financial \nresources necessary to enable it to fulfil its responsibilities under the relevant \nresolutions of the Security Council,  \n__________________ \n \n1  A/74/675 and A/74/713. \n \n2  A/74/737/Add.9. \n\nA/RES/74/292 \nFinancing of the United Nations Interim Force in Lebanon\n \n20-08803\n2/6 \n \n \n1. \nRequests the Secretary-General to entrust the Head of Mission with the \ntask of formulating future budget proposals in full accordance with the provisions of \nits resolutions 59/296 of 22 June 2005, 60/266 of 30 June 2006, 61/276 of 29 June \n2007, 64/269 of 24 June 2010, 65/289 of 30 June 2011, 66/264 of 21 June 2012, \n69/307 of 25 June 2015 and 70/286 of 17 June 2016, as well as other relevant \nresolutions;  \n \n2. \nTakes note of the status of contributions to the United Nations Interim \nForce in Lebanon as at 30 April 2020, including the contributions outstanding in the \namount of 106.1 million United States dollars, representing some 1.1 per cent of the \ntotal assessed contributions, notes with concern that only 100 Member States have \npaid their assessed contributions in full, and urges all other Member States, in \nparticular those in arrears, to ensure payment of their outstanding assessed \ncontributions;  \n \n3. \nExpresses its appreciation to those Member States that have paid their \nassessed contributions in full, and urges all other Member States to make every \npossible effort to ensure payment of their assessed contributions to the Force in full;  \n \n4. \nExpresses concern at the financial situation with regard to peacekeeping \nactivities, in particular as regards the reimbursements to troop contributors that bear \nadditional burdens owing to overdue payments by Member States of their \nassessments;  \n \n5. \nEmphasizes that all future and existing peacekeeping missions shall be \ngiven equal and non-discriminatory treatment in respect of financial and \nadministrative arrangements;  \n \n6. \nAlso emphasizes that all peacekeeping missions shall be provided with \nadequate resources for the effective and efficient discharge of their respective \nmandates;  \n \n7. \nRequests the Secretary-General to ensure that proposed peacekeeping \nbudgets are based on the relevant legislative mandates;  \n \n8. \nEndorses the conclusions and recommendations contained in the report of \nthe Advisory Committee on Administrative and Budgetary Questions,2 subject to the \nprovisions of the present resolution, and requests the Secretary-General to ensure \ntheir full implementation;  \n \n9. \nRequests the Secretary-General to establish clear frameworks and \nguidelines to determine the solicitation procedure, whether invitation to bid or request \nfor proposal, to be utilized for, inter alia, acquiring different types of goods and \nservices, including aviation services, and to update the United Nations Procurement \nManual accordingly;  \n \n10. Also requests the Secretary-General to take measures to ensure that the \nOrganization conforms to best practices in public procurement with respect to \ntransparency, including by placing additional information in the public domain on the \noutcome of procurement exercises conducted, including in the area of aviation \nservices, so as to further increase the transparency of the procurement operations of \nthe Organization, and to update the United Nations Procurement Manual accordingly;  \n \n11. \nNotes the ongoing development of impact-based performance indicators \nas part of the implementation of the Comprehensive Performance Assessment System, \nand in this regard requests the Secretary-General in his next report to provide \ninformation on how the indicators will measure the performance by the Force of \nmandated tasks and the impact of resource allocation on that performance, as well as \nhow the indicators will contribute to the identification of the resources required for \neach mandated task;  \n\nFinancing of the United Nations Interim Force in Lebanon \nA/RES/74/292A/RES/74/292\n \n3/6\n20-08803 \n \n \n12. Requests the Secretary-General to provide in his next report an execution \nplan for, and analysis of, the implementation of the new Comprehensive Performance \nAssessment System, including on its correlation with mission planning and budget \nformulation, in order to facilitate consideration by the General Assembly of resource \nrequests for implementation of the System;  \n \n13. Emphasizes the importance of the accountability system of the Secretariat, \nand requests the Secretary-General to continue to strengthen risk management and \ninternal controls in the management of peacekeeping budgets, in order to facilitate \nmandate implementation and increase transparency, and to report thereon in his next \nreport;  \n \n14. Also emphasizes the importance of overall budgetary performance in \npeacekeeping operations, and requests the Secretary-General to continue to \nimplement the recommendations of the relevant oversight bodies, while giving due \nregard to the guidance and recommendations of the General Assembly, and to report \nthereon in the context of the performance reports;  \n \n15. Notes with grave concern the threat to life, health, safety and security \ncaused by the coronavirus disease (COVID-19) pandemic and the importance of \nensuring the safety, security and health of peacekeeping personnel, maintaining the \ncontinuity of critical mandate delivery, including protection of civilians, minimizing \nthe risk of mission activities causing the virus to spread and, where appropriate and \nwithin mandates, supporting national authorities, upon their request, in their response \nto COVID-19, in collaboration with the Resident Coordinator and other United \nNations entities in the country;  \n \n16. Requests the Secretary-General to include in his next performance report \ninformation on how the Force has responded and on lessons learned from past and \npresent epidemics and pandemics, and to propose options for improving future \npreparedness for epidemics and pandemics, including for business continuity;  \n \n17. Notes the progress made in the implementation of the multi-year \nenvironmental strategy to reduce the footprint of peacekeeping operations, and \nrequests the Secretary-General to enhance measures for the implementation of the \nstrategy in all peacekeeping missions, in line with the five pillars of the strategy, in \naccordance with particular conditions on the ground and in full compliance with the \nrelevant rules and regulations, and to report thereon in the context of his next \noverview report;  \n \n18. Expresses concern over the allegations of sexual exploitation and abuse \nreported in peacekeeping missions, and requests the Secretary-General to continue to \nimplement his zero-tolerance policy on sexual exploitation and abuse with regard to \nall civilian, military and police personnel, and to report thereon in the context of his \nnext report on cross-cutting issues;  \n \n19. Recognizes the increasing security challenges faced by United Nations \npeacekeepers, reaffirms its commitment to the improvement of the safety and security \nof Force personnel, in particular uniformed personnel, and requests the Secretary-\nGeneral to further strengthen the measures in this regard and to report thereon to the \nGeneral Assembly in the context of the next budget submission for the Force;  \n \n20. Reaffirms the provisions of section XVIII of its resolution 61/276, further \nrecognizes the important role played by quick-impact projects in supporting the \nimplementation of mission mandates, stresses the need for the timely, responsible and \naccountable implementation of all such projects, and requests the Secretary-General \nto enhance their impact while addressing underlying challenges;  \n\nA/RES/74/292 \nFinancing of the United Nations Interim Force in Lebanon\n \n20-08803\n4/6 \n \n \n21. Requests the Secretary-General to consider options for greater \nnationalization of functions when formulating budget submissions, commensurate \nwith mission mandates and requirements;  \n \n22. Reiterates its concern about the high number of vacancies in civilian \nstaffing, and further reiterates its request to the Secretary-General to ensure that \nvacant posts are filled expeditiously;  \n \n23. Requests the Secretary-General to ensure that vacant posts are filled \nexpeditiously, and decides not to abolish the posts that have been vacant for 24 months \nor longer during the current budget period;  \n \n24. Also requests the Secretary-General to review the posts that have been \nvacant for 24 months or longer and to propose in his next budget submission either \ntheir retention, with clear justification of need, or their abolishment;  \n \n25. Further requests the Secretary-General to conduct a comparative \nassessment of the services provided by respective entities for mine action activities \nand to provide the results in the context of his next report;  \n \n26. Recognizes the important role played by regional and subregional actors \nfor peacekeeping operations, and in this regard encourages the Secretary-General to \ndeepen the partnership, cooperation and coordination of the United Nations with \nregional and subregional actors, in accordance with relevant mandates, and to provide \ninformation on such deepened engagement in the context of his next report;  \n \n27. Requests the Secretary-General to ensure the full implementation of the \nrelevant provisions of its resolutions 59/296, 60/266, 61/276, 64/269, 65/289, 66/264, \n69/307 and 70/286;  \n \n28. Also requests the Secretary-General to take all action necessary to ensure \nthat the Force is administered with a maximum of efficiency and economy;  \n \n \n \nBudget performance report for the period from 1 July 2018 to 30 June 2019 \n \n \n29. Takes note of the report of the Secretary-General on the budget \nperformance of the Force for the period from 1 July 2018 to 30 June 2019, 3 \n \n \n \nFinancing arrangements for the period from 1 July 2020 to 30 June 2021 \n \n \n30. Takes into account the special circumstances created by the COVID-19 \npandemic, and authorizes the Secretary-General to enter into commitments for the \nperiod from 1 July 2020 to 30 June 2021 in an amount not exceeding \n480,649,100 dollars for the maintenance of the Force;  \n \n \n \nFinancing of the commitment authority for the period from 1 July 2020  \nto 30 June 2021 \n \n \n31. Decides \nto \napportion \namong \nMember \nStates \nthe \namount \nof \n80,108,200 dollars for the period from 1 July to 31 August 2020 in accordance with the \nlevels updated in its resolution 73/272 of 22 December 2018, taking into account the \nscale of assessments for 2020, as set out in its resolution 73/271 of 22 December 2018;  \n \n32. \nAlso decides that, in accordance with the provisions of its resolution 973 (X) \nof 15 December 1955, there shall be set off against the apportionment among Member \nStates, as provided for in paragraph 31 above, their respective share in the Tax \nEqualization Fund of 2,301,400 dollars, representing the estimated staff assessment \nincome approved for the Force for the period from 1 July to 31 August 2020;  \n__________________ \n \n3  A/74/675. \n\nFinancing of the United Nations Interim Force in Lebanon \nA/RES/74/292A/RES/74/292\n \n5/6\n20-08803 \n \n \n33. Further decides to apportion among Member States the amount of \n400,540,900 dollars for the period from 1 September 2020 to 30 June 2021, at a \nmonthly rate of 40,054,090 dollars, in accordance with the levels updated in its \nresolution 73/272, taking into account the scale of assessments for 2020 and 2021, as \nset out in its resolution 73/271, subject to a decision of the Security Council to extend \nthe mandate of the Force;  \n \n34. Decides that, in accordance with the provisions of its resolution 973 (X), \nthere shall be set off against the apportionment among Member States, as provided \nfor in paragraph 33 above, their respective share in the Tax Equalization Fund of \n11,507,300 dollars, representing the estimated staff assessment income approved for \nthe Force for the period from 1 September 2020 to 30 June 2021;  \n \n \n \nEstimates for the support account for peacekeeping operations and the \nUnited Nations Logistics Base at Brindisi, Italy, for the period from 1 July \n2020 to 30 June 2021 \n \n \n35. Decides to appropriate to the special account for the United Nations \nInterim Force in Lebanon the amount of 32,105,600 dollars for the period from 1 July \n2020 to 30 June 2021, comprising 27,474,400 dollars for the support account for \npeacekeeping operations and 4,631,200 dollars for the United Nations Logistics Base \nat Brindisi, Italy;  \n \n \n \nFinancing of the estimates for the support account for peacekeeping operations \nand the United Nations Logistics Base \n \n \n36. Decides \nto \napportion \namong \nMember \nStates \nthe \namount \nof \n5,351,000 dollars for the period from 1 July to 31 August 2020, in accordance with \nthe levels updated in its resolution 73/272, taking into account the scale of \nassessments for 2020, as set out in its resolution 73/271;  \n \n37. Also decides that, in accordance with the provisions of its resolution \n973 (X), there shall be set off against the apportionment among Member States, as \nprovided for in paragraph 36 above, their respective share in the Tax Equalization \nFund of 443,200 dollars, comprising the prorated share of 368,000 dollars of the \nestimated staff assessment income approved for the support account and the prorated \nshare of 75,200 dollars of the estimated staff assessment income approved for the \nUnited Nations Logistics Base;  \n \n38. Further decides to apportion among Member States the amount of \n26,754,600 dollars for the period from 1 September 2020 to 30 June 2021, in \naccordance with the levels updated in its resolution 73/272, taking into account the \nscale of assessments for 2020 and 2021, as set out in its resolution 73/271, subject to \na decision of the Security Council to extend the mandate of the Force;  \n \n39. Decides that, in accordance with the provisions of its resolution 973 (X), \nthere shall be set off against the apportionment among Member States, as provided \nfor in paragraph 38 above, their respective share in the Tax Equalization Fund of \n2,216,000 dollars, comprising the prorated share of 1,840,200 dollars of the estimated \nstaff assessment income approved for the support account and the prorated share of \n375,800 dollars of the estimated staff assessment income approved for the United \nNations Logistics Base;  \n \n40. Also decides that, for Member States that have fulfilled their financial \nobligations to the Force, there shall be set off against the apportionment, as provided \nfor in paragraphs 36 and 38 above, their respective share of the unencumbered balance \nand other revenue in the amount of 8,543,400 dollars in respect of the financial period \nended 30 June 2019, in accordance with the levels updated in its resolution 73/272, \n\nA/RES/74/292 \nFinancing of the United Nations Interim Force in Lebanon\n \n20-08803\n6/6 \n \ntaking into account the scale of assessments for 2019, as set out in its resolution \n73/271;  \n \n41. Further decides that, for Member States that have not fulfilled their \nfinancial obligations to the Force, there shall be set off against their outstanding \nobligations their respective share of the unencumbered balance and other revenue in \nthe total amount of 8,543,400 dollars in respect of the financial period ended 30 June \n2019, in accordance with the scheme set out in paragraph 40 above;  \n \n42. Decides that the increase of 909,400 dollars in the estimated staff \nassessment income in respect of the financial period ended 30 June 2019 shall be \nadded to the credits in the amount of 8,543,400 dollars referred to in paragraphs 40 \nand 41 above;  \n \n43. Encourages the Secretary-General to continue to take additional measures \nto ensure the safety and security of all personnel participating in the Force under the \nauspices of the United Nations, bearing in mind paragraphs 5 and 6 of Security \nCouncil resolution 1502 (2003) of 26 August 2003;  \n \n44. Invites voluntary contributions to the Force in cash and in the form of \nservices and supplies acceptable to the Secretary-General, to be administered, as \nappropriate, in accordance with the procedure and practices established by the \nGeneral Assembly;  \n \n45. Decides to include in the provisional agenda of its seventy-fifth session, \nunder the item entitled \u201cFinancing of the United Nations peacekeeping forces in the \nMiddle East\u201d, the sub-item entitled \u201cUnited Nations Interim Force in Lebanon\u201d;  \n \n46. Also decides to revert to the financing of the United Nations Interim Force \nin Lebanon as soon as possible during its seventy-fifth session. \n \n30 June 2020 \n \n",
  "paragraphs": {
    "1": "Requests the Secretary-General to entrust the Head of Mission with the task of formulating future budget proposals in full accordance with the provisions of its resolutions 59/296 of 22 June 2005, 60/266 of 30 June 2006, 61/276 of 29 June 2007, 64/269 of 24 June 2010, 65/289 of 30 June 2011, 66/264 of 21 June 2012, 69/307 of 25 June 2015 and 70/286 of 17 June 2016, as well as other relevant resolutions;",
    "2": "Takes note of the status of contributions to the United Nations Interim Force in Lebanon as at 30 April 2020, including the contributions outstanding in the amount of 106.1 million United States dollars, representing some 1.1 per cent of the total assessed contributions, notes with concern that only 100 Member States have paid their assessed contributions in full, and urges all other Member States, in particular those in arrears, to ensure payment of their outstanding assessed contributions;",
    "3": "Expresses its appreciation to those Member States that have paid their assessed contributions in full, and urges all other Member States to make every possible effort to ensure payment of their assessed contributions to the Force in full;",
    "4": "Expresses concern at the financial situation with regard to peacekeeping activities, in particular as regards the reimbursements to troop contributors that bear additional burdens owing to overdue payments by Member States of their assessments;",
    "5": "Emphasizes that all future and existing peacekeeping missions shall be given equal and non-discriminatory treatment in respect of financial and administrative arrangements;",
    "6": "Also emphasizes that all peacekeeping missions shall be provided with adequate resources for the effective and efficient discharge of their respective mandates;",
    "7": "Requests the Secretary-General to ensure that proposed peacekeeping budgets are based on the relevant legislative mandates;",
    "8": "Endorses the conclusions and recommendations contained in the report of the Advisory Committee on Administrative and Budgetary Questions,2 subject to the provisions of the present resolution, and requests the Secretary-General to ensure their full implementation;",
    "9": "Requests the Secretary-General to establish clear frameworks and guidelines to determine the solicitation procedure, whether invitation to bid or request for proposal, to be utilized for, inter alia, acquiring different types of goods and services, including aviation services, and to update the United Nations Procurement Manual accordingly;",
    "10": "Also requests the Secretary-General to take measures to ensure that the Organization conforms to best practices in public procurement with respect to transparency, including by placing additional information in the public domain on the outcome of procurement exercises conducted, including in the area of aviation services, so as to further increase the transparency of the procurement operations of the Organization, and to update the United Nations Procurement Manual accordingly;",
    "11": "Notes the ongoing development of impact-based performance indicators as part of the implementation of the Comprehensive Performance Assessment System, and in this regard requests the Secretary-General in his next report to provide information on how the indicators will measure the performance by the Force of mandated tasks and the impact of resource allocation on that performance, as well as how the indicators will contribute to the identification of the resources required for each mandated task; Financing of the United Nations Interim Force in Lebanon A/RES/74/292A/RES/74/292 3/6 20-08803",
    "12": "Requests the Secretary-General to provide in his next report an execution plan for, and analysis of, the implementation of the new Comprehensive Performance Assessment System, including on its correlation with mission planning and budget formulation, in order to facilitate consideration by the General Assembly of resource requests for implementation of the System;",
    "13": "Emphasizes the importance of the accountability system of the Secretariat, and requests the Secretary-General to continue to strengthen risk management and internal controls in the management of peacekeeping budgets, in order to facilitate mandate implementation and increase transparency, and to report thereon in his next report;",
    "14": "Also emphasizes the importance of overall budgetary performance in peacekeeping operations, and requests the Secretary-General to continue to implement the recommendations of the relevant oversight bodies, while giving due regard to the guidance and recommendations of the General Assembly, and to report thereon in the context of the performance reports;",
    "15": "Notes with grave concern the threat to life, health, safety and security caused by the coronavirus disease (COVID-19) pandemic and the importance of ensuring the safety, security and health of peacekeeping personnel, maintaining the continuity of critical mandate delivery, including protection of civilians, minimizing the risk of mission activities causing the virus to spread and, where appropriate and within mandates, supporting national authorities, upon their request, in their response to COVID-19, in collaboration with the Resident Coordinator and other United Nations entities in the country;",
    "16": "Requests the Secretary-General to include in his next performance report information on how the Force has responded and on lessons learned from past and present epidemics and pandemics, and to propose options for improving future preparedness for epidemics and pandemics, including for business continuity;",
    "17": "Notes the progress made in the implementation of the multi-year environmental strategy to reduce the footprint of peacekeeping operations, and requests the Secretary-General to enhance measures for the implementation of the strategy in all peacekeeping missions, in line with the five pillars of the strategy, in accordance with particular conditions on the ground and in full compliance with the relevant rules and regulations, and to report thereon in the context of his next overview report;",
    "18": "Expresses concern over the allegations of sexual exploitation and abuse reported in peacekeeping missions, and requests the Secretary-General to continue to implement his zero-tolerance policy on sexual exploitation and abuse with regard to all civilian, military and police personnel, and to report thereon in the context of his next report on cross-cutting issues;",
    "19": "Recognizes the increasing security challenges faced by United Nations peacekeepers, reaffirms its commitment to the improvement of the safety and security of Force personnel, in particular uniformed personnel, and requests the Secretary- General to further strengthen the measures in this regard and to report thereon to the General Assembly in the context of the next budget submission for the Force;",
    "20": "Reaffirms the provisions of section XVIII of its resolution 61/276, further recognizes the important role played by quick-impact projects in supporting the implementation of mission mandates, stresses the need for the timely, responsible and accountable implementation of all such projects, and requests the Secretary-General to enhance their impact while addressing underlying challenges; A/RES/74/292 Financing of the United Nations Interim Force in Lebanon 20-08803 4/6",
    "21": "Requests the Secretary-General to consider options for greater nationalization of functions when formulating budget submissions, commensurate with mission mandates and requirements;",
    "22": "Reiterates its concern about the high number of vacancies in civilian staffing, and further reiterates its request to the Secretary-General to ensure that vacant posts are filled expeditiously;",
    "23": "Requests the Secretary-General to ensure that vacant posts are filled expeditiously, and decides not to abolish the posts that have been vacant for 24 months or longer during the current budget period;",
    "24": "Also requests the Secretary-General to review the posts that have been vacant for 24 months or longer and to propose in his next budget submission either their retention, with clear justification of need, or their abolishment;",
    "25": "Further requests the Secretary-General to conduct a comparative assessment of the services provided by respective entities for mine action activities and to provide the results in the context of his next report;",
    "26": "Recognizes the important role played by regional and subregional actors for peacekeeping operations, and in this regard encourages the Secretary-General to deepen the partnership, cooperation and coordination of the United Nations with regional and subregional actors, in accordance with relevant mandates, and to provide information on such deepened engagement in the context of his next report;",
    "27": "Requests the Secretary-General to ensure the full implementation of the relevant provisions of its resolutions 59/296, 60/266, 61/276, 64/269, 65/289, 66/264, 69/307 and 70/286;",
    "28": "Also requests the Secretary-General to take all action necessary to ensure that the Force is administered with a maximum of efficiency and economy; Budget performance report for the period from 1 July 2018 to 30 June 2019",
    "29": "Takes note of the report of the Secretary-General on the budget performance of the Force for the period from 1 July 2018 to 30 June 2019, 3 Financing arrangements for the period from 1 July 2020 to 30 June 2021",
    "30": "Takes into account the special circumstances created by the COVID-19 pandemic, and authorizes the Secretary-General to enter into commitments for the period from 1 July 2020 to 30 June 2021 in an amount not exceeding 480,649,100 dollars for the maintenance of the Force; Financing of the commitment authority for the period from 1 July 2020 to 30 June 2021",
    "31": "Decides to apportion among Member States the amount of 80,108,200 dollars for the period from 1 July to 31 August 2020 in accordance with the levels updated in its resolution 73/272 of 22 December 2018, taking into account the scale of assessments for 2020, as set out in its resolution 73/271 of 22 December 2018;",
    "32": "Also decides that, in accordance with the provisions of its resolution 973 (X) of 15 December 1955, there shall be set off against the apportionment among Member States, as provided for in paragraph 31 above, their respective share in the Tax Equalization Fund of 2,301,400 dollars, representing the estimated staff assessment income approved for the Force for the period from 1 July to 31 August 2020; __________________ 3 A/74/675. Financing of the United Nations Interim Force in Lebanon A/RES/74/292A/RES/74/292 5/6 20-08803",
    "33": "Further decides to apportion among Member States the amount of 400,540,900 dollars for the period from 1 September 2020 to 30 June 2021, at a monthly rate of 40,054,090 dollars, in accordance with the levels updated in its resolution 73/272, taking into account the scale of assessments for 2020 and 2021, as set out in its resolution 73/271, subject to a decision of the Security Council to extend the mandate of the Force;",
    "34": "Decides that, in accordance with the provisions of its resolution 973 (X), there shall be set off against the apportionment among Member States, as provided for in paragraph 33 above, their respective share in the Tax Equalization Fund of 11,507,300 dollars, representing the estimated staff assessment income approved for the Force for the period from 1 September 2020 to 30 June 2021; Estimates for the support account for peacekeeping operations and the United Nations Logistics Base at Brindisi, Italy, for the period from 1 July 2020 to 30 June 2021",
    "35": "Decides to appropriate to the special account for the United Nations Interim Force in Lebanon the amount of 32,105,600 dollars for the period from 1 July 2020 to 30 June 2021, comprising 27,474,400 dollars for the support account for peacekeeping operations and 4,631,200 dollars for the United Nations Logistics Base at Brindisi, Italy; Financing of the estimates for the support account for peacekeeping operations and the United Nations Logistics Base",
    "36": "Decides to apportion among Member States the amount of 5,351,000 dollars for the period from 1 July to 31 August 2020, in accordance with the levels updated in its resolution 73/272, taking into account the scale of assessments for 2020, as set out in its resolution 73/271;",
    "37": "Also decides that, in accordance with the provisions of its resolution 973 (X), there shall be set off against the apportionment among Member States, as provided for in paragraph 36 above, their respective share in the Tax Equalization Fund of 443,200 dollars, comprising the prorated share of 368,000 dollars of the estimated staff assessment income approved for the support account and the prorated share of 75,200 dollars of the estimated staff assessment income approved for the United Nations Logistics Base;",
    "38": "Further decides to apportion among Member States the amount of 26,754,600 dollars for the period from 1 September 2020 to 30 June 2021, in accordance with the levels updated in its resolution 73/272, taking into account the scale of assessments for 2020 and 2021, as set out in its resolution 73/271, subject to a decision of the Security Council to extend the mandate of the Force;",
    "39": "Decides that, in accordance with the provisions of its resolution 973 (X), there shall be set off against the apportionment among Member States, as provided for in paragraph 38 above, their respective share in the Tax Equalization Fund of 2,216,000 dollars, comprising the prorated share of 1,840,200 dollars of the estimated staff assessment income approved for the support account and the prorated share of 375,800 dollars of the estimated staff assessment income approved for the United Nations Logistics Base;",
    "40": "Also decides that, for Member States that have fulfilled their financial obligations to the Force, there shall be set off against the apportionment, as provided for in paragraphs 36 and 38 above, their respective share of the unencumbered balance and other revenue in the amount of 8,543,400 dollars in respect of the financial period ended 30 June 2019, in accordance with the levels updated in its resolution 73/272, A/RES/74/292 Financing of the United Nations Interim Force in Lebanon 20-08803 6/6 taking into account the scale of assessments for 2019, as set out in its resolution 73/271;",
    "41": "Further decides that, for Member States that have not fulfilled their financial obligations to the Force, there shall be set off against their outstanding obligations their respective share of the unencumbered balance and other revenue in the total amount of 8,543,400 dollars in respect of the financial period ended 30 June 2019, in accordance with the scheme set out in paragraph 40 above;",
    "42": "Decides that the increase of 909,400 dollars in the estimated staff assessment income in respect of the financial period ended 30 June 2019 shall be added to the credits in the amount of 8,543,400 dollars referred to in paragraphs 40 and 41 above;",
    "43": "Encourages the Secretary-General to continue to take additional measures to ensure the safety and security of all personnel participating in the Force under the auspices of the United Nations, bearing in mind paragraphs 5 and 6 of Security Council resolution 1502 (2003) of 26 August 2003;",
    "44": "Invites voluntary contributions to the Force in cash and in the form of services and supplies acceptable to the Secretary-General, to be administered, as appropriate, in accordance with the procedure and practices established by the General Assembly;",
    "45": "Decides to include in the provisional agenda of its seventy-fifth session, under the item entitled \u201cFinancing of the United Nations peacekeeping forces in the Middle East\u201d, the sub-item entitled \u201cUnited Nations Interim Force in Lebanon\u201d;",
    "46": "Also decides to revert to the financing of the United Nations Interim Force in Lebanon as soon as possible during its seventy-fifth session. 30 June 2020"
  },
  "agenda_items": [
    "Item 160"
  ],
  "symbol_references": []
}