{
  "symbol": "A/RES/78/116",
  "filename": "A_RES_78_116.pdf",
  "title": "78/116. Report of the Committee on Relations with the Host Country",
  "text": "United Nations \nA/RES/78/116\n \n \nGeneral Assembly \nDistr.: General \n11 December 2023 \n \n \n23-24923 (E)    211223 \n*2324923* \n \n \nSeventy-eighth session \nAgenda item 161 \nReport of the Committee on Relations with the Host Country \n \n \n \nResolution adopted by the General Assembly on \n7 December 2023 \n \n \n \n \n[on the report of the Sixth Committee (A/78/447, para. 8)] \n \n \n \n78/116. Report of the Committee on Relations with the Host Country \n \n \n \nThe General Assembly, \n \nHaving considered the report of the Committee on Relations with the Host \nCountry,1 \n \nRecalling Article 105 of the Charter of the United Nations, the Convention on the \nPrivileges and Immunities of the United Nations,2 the Agreement between the United \nNations and the United States of America regarding the Headquarters of the United \nNations,3 the Vienna Convention on Diplomatic Relations4 and the responsibilities of \nthe host country, \n \nRecalling also that, in accordance with paragraph 7 of General Assembly \nresolution 2819 (XXVI) of 15 December 1971, the Committee should consider, and \nadvise the host country on, issues arising in connection with the implementation of \nthe Headquarters Agreement, and noting that bringing issues to the attention of the \nhost country may in some cases help to have them be expeditiously resolved, \n \nRecognizing that effective measures should continue to be taken by the \ncompetent authorities of the host country, in particular to prevent any acts violating \nthe security of missions and the safety of their personnel, \n \nRecognizing also that the Headquarters Agreement provides that it shall be \nconstrued in the light of its primary purpose to enable the United Nations at its \nheadquarters in the United States, fully and efficiently, to discharge its responsibilities \nand fulfil its purposes, \n \nEmphasizing that the Convention on the Privileges and Immunities of the United \nNations does not distinguish between permanent and visiting representatives, \n__________________ \n \n1 Official Records of the General Assembly, Seventy-eighth Session, Supplement No. 26 (A/78/26). \n \n2 Resolution 22 A (I). \n \n3 See resolution 169 (II). \n \n4 United Nations, Treaty Series, vol. 500, No. 7310. \n\nA/RES/78/116 \nReport of the Committee on Relations with the Host Country\n \n23-24923\n2/5 \n \n \n1. \nEndorses the recommendations and conclusions of the Committee on \nRelations with the Host Country contained in paragraph 146 of its report; \n \n2. \nConsiders that the maintenance of appropriate conditions for ensuring \nnormal functioning of the delegations and the missions accredited to the United Nations \nand the observance of their privileges and immunities, which cannot be subject to any \nrestrictions arising from the bilateral relations of the host country, are in the interest of \nthe United Nations and all Member States, notes the efforts made by the host country \nto this end and also notes with concern that numerous issues raised before the \nCommittee continue to remain unresolved, takes seriously concerns raised by \npermanent missions regarding the normal performance of their functions, notes that the \nCommittee expresses its readiness to effectively address them and expects that all issues \nraised at its meetings that remain unresolved will be duly settled expeditiously, in a \nspirit of cooperation and in accordance with international law, notes that the Committee \nencourages Member States to bring issues to the attention of the host country and the \nCommittee as soon as they occur, requests the host country to continue to solve, \npreferably through negotiations, problems that might arise and to take all appropriate \nsteps to protect the premises of missions against any intrusion or damage and to prevent \nany disturbance of the peace of missions or impairment of their dignity, and urges the \nhost country to continue to take appropriate action, such as the training of police, \nsecurity, customs and border control officers, with a view to maintaining respect for \ndiplomatic privileges and immunities, and to continue efforts to ensure that diplomats \ntransiting to and from United Nations Headquarters are treated respectfully, and, if \nviolations occur, to ensure that such cases are properly investigated and remedied, in \naccordance with applicable law, and in this regard that the Committee notes the serious \nconcerns raised by a Member State expressing the inappropriate treatment and \nscreening of certain of its high-ranking officials by host country Customs and Border \nProtection officers and requests the host country to carefully investigate these concerns \nand take the necessary preventive and remedial action, as appropriate; \n \n3. \nRecalls the privileges and immunities applicable to the premises of the \npermanent missions to the United Nations enjoyed under international law, in \nparticular the instruments listed in paragraph 146 (a) of the report of the Committee, \nand the obligations of the host country to observe such privileges and immunities, \ntakes note of the alleged ongoing violations thereof by the host country and of the \nrepeated concerns expressed thereon, urges the host country to remove without delay \nany restrictions applied to the premises of a Permanent Mission inconsistent with \nthose privileges and immunities, and in that regard to ensure respect for such \nprivileges and immunities, expresses concern regarding the lack of resolution of these \nmatters, remains seized of these matters, and anticipates that they shall be duly \naddressed in a spirit of cooperation and in accordance with international law; \n \n4. \nAlso recalls that, prior to the institution by the host country of any \nproceedings that require any person referred to in article IV, section 11, of the \nAgreement between the United Nations and the United States of America regarding \nthe Headquarters of the United Nations, including representatives of a Member State, \nto leave the host country, article IV, section 13 (b) (1) of the Headquarters Agreement, \ninter alia, requires the host country to consult with the Member State, the Secretary-\nGeneral or other principal executive officer, as appropriate, and considers that, given \nthe seriousness of any such measure being exercised by the host country, the \nconsultation should be meaningful; \n \n5. \nNotes the problems experienced by some permanent missions to the United \nNations in connection with the implementation of the Parking Programme for \nDiplomatic Vehicles,5 and notes that the Committee shall remain seized of the matter, \n__________________ \n \n5 A/AC.154/355, annex. \n\nReport of the Committee on Relations with the Host Country \nA/RES/78/116\n \n3/5\n23-24923 \n \nwith a view to continuing to maintain the proper implementation of the Parking \nProgramme in a manner that is fair, non-discriminatory, effective and therefore \nconsistent with international law; \n \n6. \nStrongly urges the host country to remove all travel restrictions imposed \nby it on staff of certain missions and staff members of the Secretariat of certain \nnationalities, and, recalling privileges and immunities enjoyed by the representatives \nof Member States and staff members of the Secretariat under applicable international \nlaw, notes the easing in 2023 of travel restrictions on two Missions as well as the \nmodification of restrictions for Secretariat staff by increasing authorized ports of \nentry and recalls the lifting in 2021 of the more stringent travel restrictions applicable \nto one Mission, while remaining concerned about the more stringent travel restrictions \napplied to a Mission in 2021 and additional restrictions applied to the same Mission in \nlate 2022 and extremely narrow implementation thereof, and the statements of affected \ndelegations that travel restrictions impede their ability to carry out their functions and \nnegatively impact their staff and families, and notes the positions of affected States, as \nreflected in the report of the Secretary-General, of the host country and of the Legal \nCounsel, as set out in document A/AC.154/415, according to which, inter alia, \u201cthere is \nno room for the application of measures based on reciprocity in the treatment accorded \nto permanent missions accredited to the United Nations in New York\u201d; \n \n7. \nRecalls article IV of the Headquarters Agreement, notes the concerns \nexpressed by some delegations concerning the denial and delay of entry visas to \nrepresentatives of Member States, and further notes a relative decrease in the percentage \nof visas not issued and at the same time that the Committee remains seized of a range \nof visa issues that should be expeditiously resolved in a spirit of cooperation and in \naccordance with international law, including the Headquarters Agreement; \n \n8. \nExpresses serious concern regarding multiple cases of denial and \nnon-issuance of entry visas, including in particular to delegates participating in high-\nlevel events and in the work of the Main Committees at the seventy-seventh session \nof the General Assembly, emphasizes the importance of the full participation of all \ndelegations in the work of the United Nations, and takes note of the statements of the \nLegal Counsel at the 297th and 298th meetings of the Committee, reiterating his \nstatement at the emergency, 295th, meeting of the Committee, set out in document \nA/AC.154/415, where he confirmed that the legal position regarding the host \ncountry\u2019s obligations with respect to the issuance of visas to persons covered by the \nHeadquarters Agreement remains unchanged from that which was provided by the \nthen Legal Counsel to the Committee in 1988, set out in document A/C.6/43/7, \naccording to which, inter alia, \u201cthe Headquarters Agreement makes it clear that there \nis an unrestricted right of persons mentioned in section 11 to enter the United States \nfor the purpose of proceeding to the Headquarters district\u201d; \n \n9. \nAnticipates that the host country will ensure the issuance of entry visas to \nall representatives of Member States and members of the Secretariat pursuant to \narticle IV, sections 11 and 13, of the Headquarters Agreement, in a timely manner, to \nenable persons recruited to serve in the Secretariat or assigned as members of \npermanent missions to take up their assignments as promptly as possible and to enable \nrepresentatives of Member States to travel, in a timely manner, to New York on United \nNations business, including to attend official United Nations meetings, and notes that \nthe Committee anticipates that the host country will continue to enhance efforts, \nincluding visa issuance, to facilitate the participation of representatives of Member \nStates in other United Nations meetings, as appropriate; \n \n10. Notes that a number of delegations have requested shortening the time \nframe applied by the host country for issuance and renewal of visas to representatives \nof Member States and members of their families, since the present time frame poses \n\nA/RES/78/116 \nReport of the Committee on Relations with the Host Country\n \n23-24923\n4/5 \n \ndifficulties for the full-fledged participation of Member States in United Nations \nmeetings, and invites the host country to inform the Committee, as appropriate, of \nefforts to address such difficulties, and while acknowledging that action taken in 2023 \nled to a relative reduction in processing times for certain Missions, remains seriously \nconcerned that other Missions and Secretariat staff members of certain nationalities \ncontinue to be adversely impacted by processing times, and also notes that the \nCommittee calls upon the host country to review its differing processes of granting \nvisas to the personnel of certain missions, including single-entry visas, and the \nwaiting time for issuance, with a view to ensuring that delegations are able to \nparticipate fully in the work of the United Nations; \n \n11. \nNotes with concern the difficulties experienced by some permanent \nmissions to the United Nations in obtaining suitable banking services, and welcomes \nthe continued efforts of the host country to facilitate the opening of bank accounts for \nthose permanent missions; \n \n12. Stresses the need for the permanent missions and the United Nations to \nbenefit from appropriate banking services, and anticipates that the host country will \ncontinue to assist the permanent missions accredited to the United Nations and their \nstaff in obtaining such services; \n \n13. Expresses its appreciation for the efforts made by the United States \nMission to the United Nations, including to respond to requests from the diplomatic \ncommunity in the challenging circumstances caused by the coronavirus disease \n(COVID-19) pandemic since March 2020, and expects that the issues raised at the \nmeetings of the Committee will be resolved in a spirit of cooperation and in \naccordance with international law, including the Headquarters Agreement; \n \n14. Affirms the importance of the Committee being in a position to fulfil its \nmandate and meet on short notice to deal with urgent and important matters \nconcerning the relations between the United Nations and the host country, and in that \nconnection requests the Secretariat and the Committee on Conferences to accord \npriority to requests from the Committee on Relations with the Host Country for \nconference-servicing facilities for meetings of that Committee that must be held while \nthe General Assembly and its Main Committees are meeting, without prejudice to the \nrequirements of those bodies and on an \u201cas available\u201d basis; \n \n15. Requests the Secretary-General to remain actively engaged in all aspects \nof the relations of the United Nations with the host country at various levels in order \nto resolve the issues raised in the report of the Committee on Relations with the Host \nCountry, and to more actively engage in the work of the Committee with a view to \nensuring the representation of the interests concerned, in accordance with General \nAssembly resolution 2819 (XXVI), and in this regard recalls the statements of the \nLegal Counsel at the emergency, 295th, meeting of the Committee, as set out in \ndocument A/AC.154/415, and also at its online informal meeting on 17 September \n2020, recalls the position of the Committee as set out in paragraph 144 (p) of its \nprevious report6 and that of the General Assembly as set out in paragraph 15 of its \nresolution 77/114 of 7 December 2022, notes the resourceful engagement of the Legal \nCounsel and the Secretary-General in discussions that have been formalized since the \ninclusion of subparagraph (p) in chapter IV of the report of the Committee in 2019 7 \nwith the competent authorities of the host country regarding unresolved issues and \nthe Legal Counsel\u2019s reports on the outcome of these discussions, most recently at its \n309th and 310th meetings, and further notes with concern that serious issues still \npersist without effective resolution, recalls in this regard, once more, that serious \n__________________ \n \n6 Official Records of the General Assembly, Seventy-seventh Session, Supplement No. 26 (A/77/26). \n \n7 Ibid., Seventy-fourth Session, Supplement No. 26 (A/74/26). \n\nReport of the Committee on Relations with the Host Country \nA/RES/78/116\n \n5/5\n23-24923 \n \nconsideration should be given to taking steps under section 21 of the Headquarters \nAgreement if certain issues raised in the report of the Committee remained unresolved \nfollowing a reasonable and finite period of time, and accordingly once again reiterates \nits request to the Secretary-General to now give the most serious consideration and \ntake any appropriate steps under section 21 of the Headquarters Agreement and \nintensify efforts to expedite resolution of the issues; \n \n16. Requests the Committee to continue its work in conformity with General \nAssembly resolution 2819 (XXVI) and, in this framework, to continue to consider \nadditional appropriate measures to enhance the work of the Committee and its \neffectiveness and to make recommendations in its report to the Assembly at its \nseventy-ninth session; \n \n17. Decides to include in the provisional agenda of its seventy-ninth session \nthe item entitled \u201cReport of the Committee on Relations with the Host Country\u201d. \n \n \n45th plenary meeting \n7 December 2023 \n \n",
  "paragraphs": {
    "1": "Endorses the recommendations and conclusions of the Committee on Relations with the Host Country contained in paragraph 146 of its report;",
    "2": "Considers that the maintenance of appropriate conditions for ensuring normal functioning of the delegations and the missions accredited to the United Nations and the observance of their privileges and immunities, which cannot be subject to any restrictions arising from the bilateral relations of the host country, are in the interest of the United Nations and all Member States, notes the efforts made by the host country to this end and also notes with concern that numerous issues raised before the Committee continue to remain unresolved, takes seriously concerns raised by permanent missions regarding the normal performance of their functions, notes that the Committee expresses its readiness to effectively address them and expects that all issues raised at its meetings that remain unresolved will be duly settled expeditiously, in a spirit of cooperation and in accordance with international law, notes that the Committee encourages Member States to bring issues to the attention of the host country and the Committee as soon as they occur, requests the host country to continue to solve, preferably through negotiations, problems that might arise and to take all appropriate steps to protect the premises of missions against any intrusion or damage and to prevent any disturbance of the peace of missions or impairment of their dignity, and urges the host country to continue to take appropriate action, such as the training of police, security, customs and border control officers, with a view to maintaining respect for diplomatic privileges and immunities, and to continue efforts to ensure that diplomats transiting to and from United Nations Headquarters are treated respectfully, and, if violations occur, to ensure that such cases are properly investigated and remedied, in accordance with applicable law, and in this regard that the Committee notes the serious concerns raised by a Member State expressing the inappropriate treatment and screening of certain of its high-ranking officials by host country Customs and Border Protection officers and requests the host country to carefully investigate these concerns and take the necessary preventive and remedial action, as appropriate;",
    "3": "Recalls the privileges and immunities applicable to the premises of the permanent missions to the United Nations enjoyed under international law, in particular the instruments listed in paragraph 146 (a) of the report of the Committee, and the obligations of the host country to observe such privileges and immunities, takes note of the alleged ongoing violations thereof by the host country and of the repeated concerns expressed thereon, urges the host country to remove without delay any restrictions applied to the premises of a Permanent Mission inconsistent with those privileges and immunities, and in that regard to ensure respect for such privileges and immunities, expresses concern regarding the lack of resolution of these matters, remains seized of these matters, and anticipates that they shall be duly addressed in a spirit of cooperation and in accordance with international law;",
    "4": "Also recalls that, prior to the institution by the host country of any proceedings that require any person referred to in article IV, section 11, of the Agreement between the United Nations and the United States of America regarding the Headquarters of the United Nations, including representatives of a Member State, to leave the host country, article IV, section 13 (b) (1) of the Headquarters Agreement, inter alia, requires the host country to consult with the Member State, the Secretary- General or other principal executive officer, as appropriate, and considers that, given the seriousness of any such measure being exercised by the host country, the consultation should be meaningful;",
    "5": "Notes the problems experienced by some permanent missions to the United Nations in connection with the implementation of the Parking Programme for Diplomatic Vehicles,5 and notes that the Committee shall remain seized of the matter, __________________ 5 A/AC.154/355, annex. Report of the Committee on Relations with the Host Country A/RES/78/116 3/5 23-24923 with a view to continuing to maintain the proper implementation of the Parking Programme in a manner that is fair, non-discriminatory, effective and therefore consistent with international law;",
    "6": "Strongly urges the host country to remove all travel restrictions imposed by it on staff of certain missions and staff members of the Secretariat of certain nationalities, and, recalling privileges and immunities enjoyed by the representatives of Member States and staff members of the Secretariat under applicable international law, notes the easing in 2023 of travel restrictions on two Missions as well as the modification of restrictions for Secretariat staff by increasing authorized ports of entry and recalls the lifting in 2021 of the more stringent travel restrictions applicable to one Mission, while remaining concerned about the more stringent travel restrictions applied to a Mission in 2021 and additional restrictions applied to the same Mission in late 2022 and extremely narrow implementation thereof, and the statements of affected delegations that travel restrictions impede their ability to carry out their functions and negatively impact their staff and families, and notes the positions of affected States, as reflected in the report of the Secretary-General, of the host country and of the Legal Counsel, as set out in document A/AC.154/415, according to which, inter alia, \u201cthere is no room for the application of measures based on reciprocity in the treatment accorded to permanent missions accredited to the United Nations in New York\u201d;",
    "7": "Recalls article IV of the Headquarters Agreement, notes the concerns expressed by some delegations concerning the denial and delay of entry visas to representatives of Member States, and further notes a relative decrease in the percentage of visas not issued and at the same time that the Committee remains seized of a range of visa issues that should be expeditiously resolved in a spirit of cooperation and in accordance with international law, including the Headquarters Agreement;",
    "8": "Expresses serious concern regarding multiple cases of denial and non-issuance of entry visas, including in particular to delegates participating in high- level events and in the work of the Main Committees at the seventy-seventh session of the General Assembly, emphasizes the importance of the full participation of all delegations in the work of the United Nations, and takes note of the statements of the Legal Counsel at the 297th and 298th meetings of the Committee, reiterating his statement at the emergency, 295th, meeting of the Committee, set out in document A/AC.154/415, where he confirmed that the legal position regarding the host country\u2019s obligations with respect to the issuance of visas to persons covered by the Headquarters Agreement remains unchanged from that which was provided by the then Legal Counsel to the Committee in 1988, set out in document A/C.6/43/7, according to which, inter alia, \u201cthe Headquarters Agreement makes it clear that there is an unrestricted right of persons mentioned in section 11 to enter the United States for the purpose of proceeding to the Headquarters district\u201d;",
    "9": "Anticipates that the host country will ensure the issuance of entry visas to all representatives of Member States and members of the Secretariat pursuant to article IV, sections 11 and 13, of the Headquarters Agreement, in a timely manner, to enable persons recruited to serve in the Secretariat or assigned as members of permanent missions to take up their assignments as promptly as possible and to enable representatives of Member States to travel, in a timely manner, to New York on United Nations business, including to attend official United Nations meetings, and notes that the Committee anticipates that the host country will continue to enhance efforts, including visa issuance, to facilitate the participation of representatives of Member States in other United Nations meetings, as appropriate;",
    "10": "Notes that a number of delegations have requested shortening the time frame applied by the host country for issuance and renewal of visas to representatives of Member States and members of their families, since the present time frame poses A/RES/78/116 Report of the Committee on Relations with the Host Country 23-24923 4/5 difficulties for the full-fledged participation of Member States in United Nations meetings, and invites the host country to inform the Committee, as appropriate, of efforts to address such difficulties, and while acknowledging that action taken in 2023 led to a relative reduction in processing times for certain Missions, remains seriously concerned that other Missions and Secretariat staff members of certain nationalities continue to be adversely impacted by processing times, and also notes that the Committee calls upon the host country to review its differing processes of granting visas to the personnel of certain missions, including single-entry visas, and the waiting time for issuance, with a view to ensuring that delegations are able to participate fully in the work of the United Nations;",
    "11": "Notes with concern the difficulties experienced by some permanent missions to the United Nations in obtaining suitable banking services, and welcomes the continued efforts of the host country to facilitate the opening of bank accounts for those permanent missions;",
    "12": "Stresses the need for the permanent missions and the United Nations to benefit from appropriate banking services, and anticipates that the host country will continue to assist the permanent missions accredited to the United Nations and their staff in obtaining such services;",
    "13": "Expresses its appreciation for the efforts made by the United States Mission to the United Nations, including to respond to requests from the diplomatic community in the challenging circumstances caused by the coronavirus disease (COVID-19) pandemic since March 2020, and expects that the issues raised at the meetings of the Committee will be resolved in a spirit of cooperation and in accordance with international law, including the Headquarters Agreement;",
    "14": "Affirms the importance of the Committee being in a position to fulfil its mandate and meet on short notice to deal with urgent and important matters concerning the relations between the United Nations and the host country, and in that connection requests the Secretariat and the Committee on Conferences to accord priority to requests from the Committee on Relations with the Host Country for conference-servicing facilities for meetings of that Committee that must be held while the General Assembly and its Main Committees are meeting, without prejudice to the requirements of those bodies and on an \u201cas available\u201d basis;",
    "15": "Requests the Secretary-General to remain actively engaged in all aspects of the relations of the United Nations with the host country at various levels in order to resolve the issues raised in the report of the Committee on Relations with the Host Country, and to more actively engage in the work of the Committee with a view to ensuring the representation of the interests concerned, in accordance with General Assembly resolution 2819 (XXVI), and in this regard recalls the statements of the Legal Counsel at the emergency, 295th, meeting of the Committee, as set out in document A/AC.154/415, and also at its online informal meeting on 17 September 2020, recalls the position of the Committee as set out in paragraph 144 (p) of its previous report6 and that of the General Assembly as set out in paragraph 15 of its resolution 77/114 of 7 December 2022, notes the resourceful engagement of the Legal Counsel and the Secretary-General in discussions that have been formalized since the inclusion of subparagraph (p) in chapter IV of the report of the Committee in 2019 7 with the competent authorities of the host country regarding unresolved issues and the Legal Counsel\u2019s reports on the outcome of these discussions, most recently at its 309th and 310th meetings, and further notes with concern that serious issues still persist without effective resolution, recalls in this regard, once more, that serious __________________ 6 Official Records of the General Assembly, Seventy-seventh Session, Supplement No. 26 (A/77/26). 7 Ibid., Seventy-fourth Session, Supplement No. 26 (A/74/26). Report of the Committee on Relations with the Host Country A/RES/78/116 5/5 23-24923 consideration should be given to taking steps under section 21 of the Headquarters Agreement if certain issues raised in the report of the Committee remained unresolved following a reasonable and finite period of time, and accordingly once again reiterates its request to the Secretary-General to now give the most serious consideration and take any appropriate steps under section 21 of the Headquarters Agreement and intensify efforts to expedite resolution of the issues;",
    "16": "Requests the Committee to continue its work in conformity with General Assembly resolution 2819 (XXVI) and, in this framework, to continue to consider additional appropriate measures to enhance the work of the Committee and its effectiveness and to make recommendations in its report to the Assembly at its seventy-ninth session;",
    "17": "Decides to include in the provisional agenda of its seventy-ninth session the item entitled \u201cReport of the Committee on Relations with the Host Country\u201d. 45th plenary meeting 7 December 2023"
  },
  "agenda_items": [
    "Item 161"
  ],
  "symbol_references": []
}