{
  "symbol": "A/RES/79/12",
  "filename": "A_RES_79_12.pdf",
  "title": "79/12. Cooperation between the United Nations and the League of Arab States",
  "text": "United Nations \nA/RES/79/12\n \nGeneral Assembly \nDistr.: General \n19 November 2024 \n24-21670 (E) \n*2421670* \n \n \nSeventy-ninth session \nAgenda item 125 (d) \nCooperation between the United Nations and regional and \nother organizations: cooperation between the United Nations \nand the League of Arab States \n \n \n \n \n Resolution adopted by the General Assembly \non 18 November 2024 \n \n \n[without reference to a Main Committee (A/79/L.13)] \n \n \n \n79/12. Cooperation between the United Nations and the League of \nArab States \n \n \n \nThe General Assembly, \n \nRecalling its previous resolutions on cooperation between the United Nations \nand the League of Arab States, \n \nRecalling also article 3 of the Charter of the League of Arab States, 1 which \nentrusts the Council of the League of Arab States with the function of identifying the \nmeans whereby it will collaborate with international organizations to maintain \ninternational peace and security and to promote, organize and strengthen relations in \nall fields, \n \nTaking into consideration the report of the Secretary-General entitled \u201cAn \nAgenda for Peace\u201d,2 particularly section VII concerning cooperation with regional \norganizations, as well as the reports of the Secretary-General entitled \u201cSupplement to \nan Agenda for Peace\u201d3 and \u201cOur Common Agenda\u201d,4 and the outcomes of the Summit \nof the Future, including the Pact for the Future, 5 \n \nConsidering the recommendations of the high-level meetings convened \nbiennially by the Secretary-General with the heads of regional and subregional \norganizations, \n_______________ \n \n1 United Nations, Treaty Series, vol. 70, No. 241. \n \n2 A/47/277-S/24111. \n \n3 A/50/60-S/1995/1. \n \n4 A/75/982. \n \n5 Resolution 79/1. \n\nA/RES/79/12 \nCooperation between the United Nations and the League of \nArab States \n \n24-21670\n2/3 \n \n \nRecalling the statements by the President of the Security Council issued \nfollowing the high-level meetings of the Council held under the standing item entitled \n\u201cCooperation between the United Nations and regional and subregional organizations \nin maintaining international peace and security: cooperation between the Security \nCouncil and the League of Arab States\u201d, \n \nConsidering the provisions of the Protocol of amendment of the text of the \nAgreement of Cooperation between the United Nations and the League of Arab States, \nsigned in September 2016,6 which calls for strengthening cooperation in new areas, \nincluding conflict resolution and prevention, in addition to peacebuilding and \nsustaining peace, \n \nRecognizing the need to further strengthen cooperation between the United \nNations and the League of Arab States with a view to achieving the shared goals and \nobjectives of the two organizations, \n \nWelcoming the resolutions and recommendations issued during both the fifteenth \nsectoral cooperation meeting between the League of Arab States and the United \nNations and their specialized agencies, held at the headquarters of the League of Arab \nStates in Cairo on 27 and 28 February 2023, under the theme \u201cCooperation in the field \nof climate change\u201d, and the sixteenth general cooperation meeting between the United \nNations and the League of Arab States, held at the United Nations Office at Geneva \nfrom 17 to 19 July 2024, where discussions encompassed cooperation in various \nareas, including political, security, economic, social and related issues, \n \n1. \nRequests the secretariats of the United Nations and the League of Arab \nStates to follow up on the implementation of the recommendations and resolutions of \nthe sixteenth general cooperation meeting to assist Arab States in addressing and \nconfronting current and emerging challenges; \n \n2. \nEmphasizes the importance of the two secretariats continuing their efforts \nto enhance the mechanisms of cooperation between the two organizations in all areas \nof mutual interest, and also emphasizes the need for further measures to continue \nongoing consultations at all levels, including with the United Nations envoys and \nspecial representatives of the Secretary-General regarding issues on the agenda of the \nCouncil of the League of Arab States, to achieve effective joint solutions to the crises \nin the Arab region, while continuing to exchange information and reviewing the \ncoordination and follow-up mechanisms among the relevant parties in both \nsecretariats to ensure a cohesive approach in the Arab region; \n \n3. \nRequests the United Nations Secretariat to support and enhance the \ncapacities of personnel within the structures and bodies of the League of Arab States \ndealing with peacekeeping, peacebuilding and sustaining peace, as well as national \ncapacity-building in the post-conflict phase; \n \n4. \nRecommends the continuation and strengthening of cooperation between \nthe secretariat of the League of Arab States and the United Nations Liaison Office to \nthe League of Arab States in Cairo; \n \n5. \nLooks forward to convening the sixteenth sectoral cooperation meeting \nbetween the United Nations and the League of Arab States and their specialized \nagencies, on the theme \u201cCooperation in the field of women\u2019s rights and child \nprotection in armed conflict\u201d, in Cairo after the first quarter of 2025, as well as the \nseventeenth general cooperation meeting between the two organizations, at the United \nNations Office at Geneva in 2026; \n_______________ \n \n6 United Nations, Treaty Series, vol. 3146, No. 1030. \n\nCooperation between the United Nations and the League of \nArab States \nA/RES/79/12\n \n3/3\n24-21670 \n \n \n6. \nRequests the United Nations specialized agencies, programmes and \ninstitutions to continue their interaction with their counterparts in the organizations \nand institutions of the League of Arab States and improve their consultation \nmechanisms for the effective implementation of the agreed joint projects and \nprogrammes, taking in consideration their expertise in various fields; \n \n7. \nCalls upon the specialized United Nations agencies, institutions and \nprogrammes to inform the Secretary-General, no later than January 2026, of the \nprogress achieved in their cooperation with the League of Arab States, particularly on \nimplementing the multilateral decisions, resolutions and programmes approved by the \nsixteenth general cooperation meeting between the two organizations; \n \n8. \nRequests the Secretary-General to submit a report on the implementation \nof the present resolution to the General Assembly at its eighty-first session. \n \n39th plenary meeting \n18 November 2024 \n \n",
  "paragraphs": {
    "1": "Requests the secretariats of the United Nations and the League of Arab States to follow up on the implementation of the recommendations and resolutions of the sixteenth general cooperation meeting to assist Arab States in addressing and confronting current and emerging challenges;",
    "2": "Emphasizes the importance of the two secretariats continuing their efforts to enhance the mechanisms of cooperation between the two organizations in all areas of mutual interest, and also emphasizes the need for further measures to continue ongoing consultations at all levels, including with the United Nations envoys and special representatives of the Secretary-General regarding issues on the agenda of the Council of the League of Arab States, to achieve effective joint solutions to the crises in the Arab region, while continuing to exchange information and reviewing the coordination and follow-up mechanisms among the relevant parties in both secretariats to ensure a cohesive approach in the Arab region;",
    "3": "Requests the United Nations Secretariat to support and enhance the capacities of personnel within the structures and bodies of the League of Arab States dealing with peacekeeping, peacebuilding and sustaining peace, as well as national capacity-building in the post-conflict phase;",
    "4": "Recommends the continuation and strengthening of cooperation between the secretariat of the League of Arab States and the United Nations Liaison Office to the League of Arab States in Cairo;",
    "5": "Looks forward to convening the sixteenth sectoral cooperation meeting between the United Nations and the League of Arab States and their specialized agencies, on the theme \u201cCooperation in the field of women\u2019s rights and child protection in armed conflict\u201d, in Cairo after the first quarter of 2025, as well as the seventeenth general cooperation meeting between the two organizations, at the United Nations Office at Geneva in 2026; _______________ 6 United Nations, Treaty Series, vol. 3146, No. 1030. Cooperation between the United Nations and the League of Arab States A/RES/79/12 3/3 24-21670",
    "6": "Requests the United Nations specialized agencies, programmes and institutions to continue their interaction with their counterparts in the organizations and institutions of the League of Arab States and improve their consultation mechanisms for the effective implementation of the agreed joint projects and programmes, taking in consideration their expertise in various fields;",
    "7": "Calls upon the specialized United Nations agencies, institutions and programmes to inform the Secretary-General, no later than January 2026, of the progress achieved in their cooperation with the League of Arab States, particularly on implementing the multilateral decisions, resolutions and programmes approved by the sixteenth general cooperation meeting between the two organizations;",
    "8": "Requests the Secretary-General to submit a report on the implementation of the present resolution to the General Assembly at its eighty-first session. 39th plenary meeting 18 November 2024"
  },
  "agenda_items": [
    "Item 125"
  ],
  "symbol_references": [
    "A/79/L.13"
  ]
}