{
  "symbol": "A/RES/73/162",
  "filename": "A_RES_73_162.pdf",
  "title": "73/162. Human rights treaty body system",
  "text": "United Nations \nA/RES/73/162\n \n \nGeneral Assembly \nDistr.: General \n8 January 2019 \n \n18-22257 (E)    100119 \n*1822257* \n \n \nSeventy-third session \nAgenda item 74 (a) \n \n \n \n \n Resolution adopted by the General Assembly \non 17 December 2018 \n \n \n \n \n[on the report of the Third Committee (A/73/589/Add.1)] \n \n \n 73/162. Human rights treaty body system \n \n \n \nThe General Assembly,  \n \nRecalling the International Covenant on Civil and Political Rights, 1  the \nInternational Covenant on Economic, Social and Cultural Rights, 1 the Convention on \nthe Rights of Persons with Disabilities, 2  the International Convention for the \nProtection of All Persons from Enforced Disappearance, 3  the International \nConvention on the Protection of the Rights of All Migrant Workers and Members of \nTheir Families,4 the Convention on the Elimination of All Forms of Discrimination \nagainst Women, 5  the Convention on the Rights of the Child, 6  the International \nConvention on the Elimination of All Forms of Racial Discrimination, 7  the \nConvention against Torture and Other Cruel, Inhuman or Degrading Treatment or \nPunishment8 and the Optional Protocol to the Convention against Torture and Other \nCruel, Inhuman or Degrading Treatment or Punishment, 9  \n \nRecalling also Economic and Social Council resolution 1985/17 of 28 May 1985, \n \nRecalling further its resolution 68/268 of 9 April 2014 on strengthening and \nenhancing the effective functioning of the human rights treaty body system,  \n \nRecalling its resolution 71/185 of 19 December 2016 on the human rights treaty \nbody system, \n__________________ \n \n1  See resolution 2200 A (XXI), annex. \n \n2  United Nations, Treaty Series, vol. 2515, No. 44910. \n \n3  Ibid., vol. 2716, No. 48088. \n \n4  Ibid., vol. 2220, No. 39481. \n \n5  Ibid., vol. 1249, No. 20378. \n \n6  Ibid., vol. 1577, No. 27531. \n \n7  Ibid., vol. 660, No. 9464. \n \n8  Ibid., vol. 1465, No. 24841. \n \n9  Ibid., vol. 2375, No. 24841. \n\nA/RES/73/162 \nHuman rights treaty body system\n \n18-22257\n2/3 \n \n \nReaffirming that the full and effective implementation of international human \nrights instruments by States parties is of major importance to the efforts of the United \nNations to promote universal respect for and observance of human rights and \nfundamental freedoms, and that the effective functioning of the human rights treaty \nbody system is indispensable for the full and effective implementation of such \ninstruments,  \n \nRecognizing the important, valuable and unique role and contribution of each of \nthe human rights treaty bodies in the promotion and protection of human rights and \nfundamental freedoms, including through their examination of the progress made by \nStates parties to the respective human rights treaties in fulfilling their relevant \nobligations and their provision of recommendations to States parties on the \nimplementation of such treaties,  \n \nEmphasizing the importance of multilingualism in the activities of the United \nNations, including those linked to the promotion and protection of human rights, and \nreaffirming the paramount importance of the equality of the six official languages of \nthe United Nations for the effective functioning of the human rights treaty bodies, \n \n1. \nTakes note of the report of the Secretary-General on the status of the human \nrights treaty body system;10  \n \n2. \nWelcomes the annual reports of the human rights treaty bodies submitted \nto the General Assembly at its seventy-second11 and seventy-third12 sessions and to \nthe Economic and Social Council at its 201713 and 2018 sessions;14 \n \n3. \nInvites the Chairs of the human rights treaty bodies to address and engage \nin an interactive dialogue with the General Assembly at its seventy-fourth and \nseventy-fifth sessions under the item relevant to the work of the treaty body;  \n \n4. \nEncourages all stakeholders to continue their efforts for the full \nimplementation of resolution 68/268;  \n \n5. \nReaffirms paragraphs 26 to 28 of its resolution 68/268, in which it set out \nhow the allocation of meeting time to the treaty bodies would be identified and \nrequested the Secretary-General to provide the corresponding financial and human \nresources, decided that the meeting time allocated would be reviewed biennially and \namended on that basis at the request of the Secretary-General in line with established \nbudgetary procedures, and requested the Secretary-General accordingly to take into \naccount the meeting time needed by the human rights treaty body system in his future \nbiennial programme budget;  \n \n6. \nRecalls paragraph 22 of its resolution 68/268, in which it decided, in \nprinciple, with the aim of enhancing the accessibility and visibility of the human \nrights treaty bodies, to webcast, as soon as feasible, the public meetings of the treaty \nbodies, and decides in this regard to provide, as of 2020, in all the official languages \nused in the respective committees, live webcasts and video archives of relevant \n__________________ \n \n10  A/73/309. \n \n11 Official Records of the General Assembly, Seventy-second Session, Supplement No. 18 (A/72/18); ibid., \nSupplement No. 38 (A/72/38); ibid., Supplement No. 40 (A/72/40); ibid., Supplement No. 44 (A/72/44); \nibid., Supplement No. 48 (A/72/48); ibid., Supplement No. 55 (A/72/55); and ibid., Supplement No. 56 \n(A/72/56); see also A/72/168. \n \n12 Official Records of the General Assembly, Seventy-third Session, Supplement No. 18 (A/73/18); ibid., \nSupplement No. 38 (A/73/38); ibid., Supplement No. 41 (A/73/41); ibid., Supplement No. 44 (A/73/44); \nibid., Supplement No. 48 (A/73/48); and ibid., Supplement No. 56 (A/73/56). \n \n13 Official Records of the Economic and Social Council, 2017, Supplement No. 2 (E/2017/22). \n \n14 Ibid., 2018, Supplement No. 2 (E/2018/22). \n\nHuman rights treaty body system \nA/RES/73/162\n \n3/3\n18-22257 \n \nmeetings of the treaty bodies that are available, accessible, searchable and secure, \nincluding from cyberattacks; \n \n7. \nExpresses appreciation for the organization of discussions on matters \nrelated to the implementation of each human rights treaty at meetings of the States \nparties thereto, and requests the Secretary-General to continue to support such \npractices;  \n \n8. \nAlso expresses appreciation for the opportunity to interact with the Chairs \nof the treaty bodies during their annual meetings, and requests the Secretary-General \nto continue to support such opportunities;  \n \n9. \nFurther expresses appreciation for the advisory services, capacity-\nbuilding and technical assistance provided by the Secretary-General to support States \nparties in building their capacity to implement their treaty obligations, and requests \nthe Secretary-General to continue his efforts in this regard;  \n \n10. Reiterates its request, made in paragraph 40 of its resolution 68/268, that \nthe Secretary-General submit to it a comprehensive report on the status of the human \nrights treaty body system, and, in view of the decision, in paragraph 41 of that \nresolution, to consider the state of the human rights treaty body system no later than \n2020, requests the Secretary-General to submit that report in January 2020, in advance \nof the review of the human rights treaty body system. \n \n55th plenary meeting  \n17 December 2018 \n \n",
  "paragraphs": {
    "1": "Takes note of the report of the Secretary-General on the status of the human rights treaty body system;10",
    "2": "Welcomes the annual reports of the human rights treaty bodies submitted to the General Assembly at its seventy-second11 and seventy-third12 sessions and to the Economic and Social Council at its 201713 and 2018 sessions;14",
    "3": "Invites the Chairs of the human rights treaty bodies to address and engage in an interactive dialogue with the General Assembly at its seventy-fourth and seventy-fifth sessions under the item relevant to the work of the treaty body;",
    "4": "Encourages all stakeholders to continue their efforts for the full implementation of resolution 68/268;",
    "5": "Reaffirms paragraphs 26 to 28 of its resolution 68/268, in which it set out how the allocation of meeting time to the treaty bodies would be identified and requested the Secretary-General to provide the corresponding financial and human resources, decided that the meeting time allocated would be reviewed biennially and amended on that basis at the request of the Secretary-General in line with established budgetary procedures, and requested the Secretary-General accordingly to take into account the meeting time needed by the human rights treaty body system in his future biennial programme budget;",
    "6": "Recalls paragraph 22 of its resolution 68/268, in which it decided, in principle, with the aim of enhancing the accessibility and visibility of the human rights treaty bodies, to webcast, as soon as feasible, the public meetings of the treaty bodies, and decides in this regard to provide, as of 2020, in all the official languages used in the respective committees, live webcasts and video archives of relevant __________________ 10 A/73/309. 11 Official Records of the General Assembly, Seventy-second Session, Supplement No. 18 (A/72/18); ibid., Supplement No. 38 (A/72/38); ibid., Supplement No. 40 (A/72/40); ibid., Supplement No. 44 (A/72/44); ibid., Supplement No. 48 (A/72/48); ibid., Supplement No. 55 (A/72/55); and ibid., Supplement No. 56 (A/72/56); see also A/72/168. 12 Official Records of the General Assembly, Seventy-third Session, Supplement No. 18 (A/73/18); ibid., Supplement No. 38 (A/73/38); ibid., Supplement No. 41 (A/73/41); ibid., Supplement No. 44 (A/73/44); ibid., Supplement No. 48 (A/73/48); and ibid., Supplement No. 56 (A/73/56). 13 Official Records of the Economic and Social Council, 2017, Supplement No. 2 (E/2017/22). 14 Ibid., 2018, Supplement No. 2 (E/2018/22). Human rights treaty body system A/RES/73/162 3/3 18-22257 meetings of the treaty bodies that are available, accessible, searchable and secure, including from cyberattacks;",
    "7": "Expresses appreciation for the organization of discussions on matters related to the implementation of each human rights treaty at meetings of the States parties thereto, and requests the Secretary-General to continue to support such practices;",
    "8": "Also expresses appreciation for the opportunity to interact with the Chairs of the treaty bodies during their annual meetings, and requests the Secretary-General to continue to support such opportunities;",
    "9": "Further expresses appreciation for the advisory services, capacity- building and technical assistance provided by the Secretary-General to support States parties in building their capacity to implement their treaty obligations, and requests the Secretary-General to continue his efforts in this regard;",
    "10": "Reiterates its request, made in paragraph 40 of its resolution 68/268, that the Secretary-General submit to it a comprehensive report on the status of the human rights treaty body system, and, in view of the decision, in paragraph 41 of that resolution, to consider the state of the human rights treaty body system no later than 2020, requests the Secretary-General to submit that report in January 2020, in advance of the review of the human rights treaty body system. 55th plenary meeting 17 December 2018"
  },
  "agenda_items": [
    "Item 74"
  ],
  "symbol_references": []
}