{
  "symbol": "A/RES/80/129",
  "filename": "A_RES_80_129.pdf",
  "title": "80/129. Follow-up to and implementation of the outcomes of the International Conferences on Financing for Development",
  "text": "United Nations \nA/RES/80/129 \n \nGeneral Assembly \nDistr.: General \n18 December 2025 \n25-20742 (E) \n*2520742* \n \n \nEightieth session \nAgenda item 17 \nFollow-up to and implementation of the outcomes of the \nInternational Conferences on Financing for Development \n \n \n \n \n Resolution adopted by the General Assembly \non 15 December 2025 \n \n \n[on the report of the Second Committee (A/80/555, para. 7)] \n \n \n 80/129. Follow-up to and implementation of the outcomes of the \nInternational Conferences on Financing for Development \n \n \n \nThe General Assembly, \n \nWelcoming the convening of the Fourth International Conference on Financing \nfor Development from 30 June to 3 July 2025 in Sevilla, Spain, and reaffirming its \noutcome document, the Sevilla Commitment, endorsed by the General Assembly in \nits resolution 79/323 of 25 August 2025, which sets forth a renewed global framework \nfor financing for development, building on the 2015 Addis Ababa Action Agenda, 1 to \nclose with urgency the estimated annual 4 trillion United States dollar financing gap, 2 \nand catalyse sustainable development investments at scale in developing countries \nand continue the reform of the international financial architecture through continued \nand strong commitment to multilateralism, international cooperation, and global \nsolidarity,  \n \nRecalling its resolution 79/199 of 19 December 2024 and all previous \nresolutions 3on the follow-up to and implementation of the outcomes of the \nInternational Conferences on Financing for Development and its resolution 70/299 of \n29 July 2016 on the follow-up and review of the 2030 Agenda for Sustainable \nDevelopment at the global level,  \n \nReaffirming its resolution 69/313 of 27 July 2015 on the Addis Ababa Action \nAgenda of the Third International Conference on Financing for Development, which \nis an integral part of the 2030 Agenda for Sustainable Development, 4 supports and \ncomplements it, helps to contextualize its means of implementation targets with \n_______________ \n \n1 General Assembly resolution 69/313, annex. \n \n2  Financing for Sustainable Development Report 2024 (United Nations publication, 2024), figure I.1. \n \n3 Resolutions 70/192, 71/217, 72/208, 73/223, 74/207, 75/208, 76/198, 77/156 and 78/231. \n \n4 Resolution 70/1. \n\nA/RES/80/129 \nFollow-up to and implementation of the outcomes of the \nInternational Conferences on Financing for Development\n \n25-20742\n2/4 \n \nconcrete policies and actions, and reaffirms the strong political commitment to \naddress the challenge of financing and creating an enabling environment at all levels \nfor sustainable development in the spirit of global partnership and solidarity,  \n \nRecalling the International Conference on Financing for Development, held in \nMonterrey, Mexico, from 18 to 22 March 2002, the Follow-up International \nConference on Financing for Development to Review the Implementation of the \nMonterrey Consensus, held in Doha from 29 November to 2 December 2008, and the \nThird International Conference on Financing for Development, held in Addis Ababa \nfrom 13 to 16 July 2015,  \n \nReaffirming its resolution 70/1 of 25 September 2015, entitled \u201cTransforming \nour world: the 2030 Agenda for Sustainable Development\u201d, in which it adopted a \ncomprehensive, far-reaching and people-centred set of universal and transformative \nSustainable Development Goals and targets, its commitment to working tirelessly for \nthe full implementation of the Agenda by 2030, its recognition that eradicating \npoverty in all its forms and dimensions, including extreme poverty, is the greatest \nglobal challenge and an indispensable requirement for sustainable development, its \ncommitment to achieving sustainable development in its three dimensions \u2013 \neconomic, social and environmental \u2013 in a balanced and integrated manner, and to \nbuilding upon the achievements of the Millennium Development Goals and seeking \nto address their unfinished business,  \n \nReaffirming also the Paris Agreement 5and its early entry into force, encouraging \nall its Parties to fully implement the Agreement, and Parties to the United Nations \nFramework Convention on Climate Change 6that have not yet done so to deposit their \ninstruments of ratification, acceptance, approval or accession, where appropriate, as \nsoon as possible, \n \nReiterating the pledge that no one will be left behind, reaffirming the \nrecognition that the dignity of the human person is fundamental, and the wish to see \nthe Goals and targets met for all nations and peoples and for all segments of society, \nand recommitting to endeavour to reach the furthest behind first, \n \nRecommitting to ensuring that no country or person is left behind and to focusing \nour effort where the challenges are greatest, including by ensuring the inclusion and \nparticipation of those who are furthest behind,  \n \nReaffirming the Sevilla Commitment on the imperative of achieving gender \nequality and the empowerment of all women and girls, ensuring their full and equal \nenjoyment of all their human rights and fundamental freedoms, and reaffirming that \ngender equality and the empowerment of all women and girls bring proven economic \nbenefits and have the potential to contribute to financing for development,  \n \nReaffirming the importance of addressing the diverse needs of and challenges \nfaced by countries in special situations, in particular African countries, the least \ndeveloped countries, landlocked developing countries and small island developing \nStates, as well as the specific challenges faced by middle-income countries and \ncountries in conflict and post-conflict situations,  \n \nNoting with concern the fragile and highly uncertain global socioeconomic \noutlook, persisting negative effects of the COVID\u201119 pandemic, geopolitical tensions \nand conflicts and current multiple crises, which have increased pressure on food, \nenergy and finance, affecting many countries around the world, and their ability to \nachieve the Sustainable Development Goals,  \n_______________ \n \n5 Adopted under the UNFCCC in FCCC/CP/2015/10/Add.1, decision 1/CP.21. \n \n6 United Nations, Treaty Series, vol. 1771, No. 30822. \n\nFollow-up to and implementation of the outcomes of the \nInternational Conferences on Financing for Development \nA/RES/80/129\n \n3/4\n25-20742 \n \n \nTaking note of the convening of the ninth annual retreat of the Group of Friends \nof Monterrey to exchange informal views on financing for development issues,  \n \nWelcoming the convening of the Economic and Social Council forum on \nfinancing for development follow-up, held on 28 and 29 April 2025, \n \nWelcoming the convening of the Summit of the Future on 22\u201323 September 2024 \nat the United Nations Headquarters in New York, at which resolution 79/1 entitled \n\u201cThe Pact for the Future\u201d and its annexes were adopted, \n \n1. \nTakes note of the report of the Secretary-General on the outcome of the \nFourth International Conference on Financing for Development; 7 \n \n2. \nWelcomes the outcome document of the Fourth International Conference \non Financing for Development, the Sevilla Commitment,8 and calls for its timely and \neffective implementation; \n \n3. \nReaffirms that the Sevilla Commitment provides a renewed global \nframework for financing for development to realize sustainable development and the \n2030 Agenda, with concrete policies and actions, the implementation of which \nrequires following up on, that relate to its seven action areas, namely, domestic public \nresources; domestic and international private business and finance; international \ndevelopment cooperation and development effectiveness; international trade as an \nengine for development; debt and debt sustainability; international financial \narchitecture and systemic issues; science, technology, innovation and capacity-\nbuilding; and data, monitoring and follow-up; \n \n4. \nTakes note with appreciation of the Sevilla Platform for Action launched \nat the Fourth International Conference on Financing for Development; \n \n5. \nUrges the United Nations system, and encourages international financial \ninstitutions, multilateral development banks, regional development banks and other \nrelevant stakeholders, to integrate the actions of the Sevilla Commitment into their \nrelevant strategic and operational programmatic documents and frameworks, in \naccordance with their respective mandates, while enhancing coordination and \ncooperation among them for its effective implementation; \n \n6. \nRecalls the report of the Inter-Agency Task Force on Financing for \nDevelopment entitled Financing for Sustainable Development Report 2024: \nFinancing for Development at a Crossroads,9 calls upon the Inter-Agency Task Force \non Financing for Development to continue to report annually on progress in \nimplementing the financing for development outcomes and the means of \nimplementation of the 2030 Agenda for Sustainable Development and its Sustainable \nDevelopment Goals and advise the intergovernmental follow-up thereto on progress, \nimplementation gaps and recommendations for corrective action, while taking into \nconsideration the national and regional dimensions, including to consider options to \npresent its findings in a more interactive and user-friendly manner, and looks forward \nto the Financing for Sustainable Development Report 2026, with deeper reporting on \nthe action areas under in-depth review in line with the biennial cycle at the Economic \nand Social Council forum on financing for development follow-up; \n \n7. \nReaffirms paragraph 65 (b) of the Sevilla Commitment to deepen \nsubstantive discussions at the Economic and Social Council forum on financing for \ndevelopment follow-up through an in-depth review of and reporting on national and \nglobal commitments in the action areas of the financing for development outcomes in \n_______________ \n \n7 A/80/387. \n \n8 Resolution 79/323, annex. \n \n9  Financing for Sustainable Development Report 2024 (United Nations publication, 2024). \n\nA/RES/80/129 \nFollow-up to and implementation of the outcomes of the \nInternational Conferences on Financing for Development\n \n25-20742\n4/4 \n \na biennial cycle, to allow for deeper reporting by the Inter-Agency Task Force on \nFinancing for Development, more emphasis on the negotiations on the outcome \ndocument of the forum, and more in-depth and meaningful discussion at the forum; \n \n8. \nAlso looks forward to continuing to hold the annual special high-level \nmeeting with the Bretton Woods institutions and a special high-level meeting that \nengages with the World Trade Organization and the United Nations Conference on \nTrade and Development, in the year that trade is under in-depth review; \n \n9. \nReaffirms that the deliberations of the special meeting of the Economic \nand Social Council on international cooperation in tax matters, the Development \nCooperation Forum, a special meeting of the Economic and Social Council on \nfinancial integrity, the multi-stakeholder forum on science, technology and innovation \nfor the Sustainable Development Goals and a high-level special meeting of the \nEconomic and Social Council with credit rating agencies, among others, as well as \nongoing engagements with the private sector through mechanisms such as the \nFinancing for Development Business Sector Steering Committee and the Global \nInvestors for Sustainable Development Alliance, will be taken into account by the \nforum on financing for development follow-up on an appropriate cycle; \n \n10. Reiterates that States will not be able to achieve the ambitious Goals and \ntargets of the 2030 Agenda without a revitalized and enhanced global partnership and \ncomparably ambitious means of implementation, and reaffirms the commitment at the \nvery heart of the 2030 Agenda to end poverty and hunger everywhere, leaving no one \nbehind and commit to taking more tangible steps to support people in vulnerable \nsituations and the most vulnerable countries and to reach the furthest behind first; \n \n11. Recalls paragraph 65 (d) of the Sevilla Commitment, which encourages \nMember States to appoint national focal points for financing for development in \nfinance and other relevant ministries, and invites the Department of Economic and \nSocial Affairs of the Secretariat, within existing resources, to facilitate the \nestablishment of a network of voluntary national focal points for financing for \ndevelopment to strengthen national follow-up; \n \n12. Reiterates its appeal to Member States and other potential donors to \nconsider contributing generously to the trust fund to support activities for the follow \nup to the International Conference on Financing for Development, which would \nfacilitate the implementation of a strengthened and more effective inclusive, \nintergovernmental process for carrying out the financing for development follow-up; \n \n13. Recognizes the work of the Financing for Sustainable Development Office, \nand encourages the Office, in collaboration with experts from the public and private \nsectors, academia, civil society and other multilateral organizations who work in the \nfield of financing for development, to continue its work in accordance with its \nmandate; \n \n14. Requests the Secretary-General to submit a report to the General Assembly \nat its eighty-first session on the follow-up to and implementation of the Sevilla \nCommitment, including on progress made and continuing challenges faced, and on \nthe implementation of the present resolution; \n \n15. Decides to include in the provisional agenda of its eighty-first session the \nitem entitled \u201cFollow-up to and implementation of the outcomes of the International \nConferences on Financing for Development\u201d. \n \n64th plenary meeting \n15 December 2025 \n \n",
  "paragraphs": {
    "1": "Takes note of the report of the Secretary-General on the outcome of the Fourth International Conference on Financing for Development; 7",
    "2": "Welcomes the outcome document of the Fourth International Conference on Financing for Development, the Sevilla Commitment,8 and calls for its timely and effective implementation;",
    "3": "Reaffirms that the Sevilla Commitment provides a renewed global framework for financing for development to realize sustainable development and the 2030 Agenda, with concrete policies and actions, the implementation of which requires following up on, that relate to its seven action areas, namely, domestic public resources; domestic and international private business and finance; international development cooperation and development effectiveness; international trade as an engine for development; debt and debt sustainability; international financial architecture and systemic issues; science, technology, innovation and capacity- building; and data, monitoring and follow-up;",
    "4": "Takes note with appreciation of the Sevilla Platform for Action launched at the Fourth International Conference on Financing for Development;",
    "5": "Urges the United Nations system, and encourages international financial institutions, multilateral development banks, regional development banks and other relevant stakeholders, to integrate the actions of the Sevilla Commitment into their relevant strategic and operational programmatic documents and frameworks, in accordance with their respective mandates, while enhancing coordination and cooperation among them for its effective implementation;",
    "6": "Recalls the report of the Inter-Agency Task Force on Financing for Development entitled Financing for Sustainable Development Report 2024: Financing for Development at a Crossroads,9 calls upon the Inter-Agency Task Force on Financing for Development to continue to report annually on progress in implementing the financing for development outcomes and the means of implementation of the 2030 Agenda for Sustainable Development and its Sustainable Development Goals and advise the intergovernmental follow-up thereto on progress, implementation gaps and recommendations for corrective action, while taking into consideration the national and regional dimensions, including to consider options to present its findings in a more interactive and user-friendly manner, and looks forward to the Financing for Sustainable Development Report 2026, with deeper reporting on the action areas under in-depth review in line with the biennial cycle at the Economic and Social Council forum on financing for development follow-up;",
    "7": "Reaffirms paragraph 65 (b) of the Sevilla Commitment to deepen substantive discussions at the Economic and Social Council forum on financing for development follow-up through an in-depth review of and reporting on national and global commitments in the action areas of the financing for development outcomes in a biennial cycle, to allow for deeper reporting by the Inter-Agency Task Force on Financing for Development, more emphasis on the negotiations on the outcome document of the forum, and more in-depth and meaningful discussion at the forum;",
    "8": "Also looks forward to continuing to hold the annual special high-level meeting with the Bretton Woods institutions and a special high-level meeting that engages with the World Trade Organization and the United Nations Conference on Trade and Development, in the year that trade is under in-depth review;",
    "9": "Reaffirms that the deliberations of the special meeting of the Economic and Social Council on international cooperation in tax matters, the Development Cooperation Forum, a special meeting of the Economic and Social Council on financial integrity, the multi-stakeholder forum on science, technology and innovation for the Sustainable Development Goals and a high-level special meeting of the Economic and Social Council with credit rating agencies, among others, as well as ongoing engagements with the private sector through mechanisms such as the Financing for Development Business Sector Steering Committee and the Global Investors for Sustainable Development Alliance, will be taken into account by the forum on financing for development follow-up on an appropriate cycle;",
    "10": "Reiterates that States will not be able to achieve the ambitious Goals and targets of the 2030 Agenda without a revitalized and enhanced global partnership and comparably ambitious means of implementation, and reaffirms the commitment at the very heart of the 2030 Agenda to end poverty and hunger everywhere, leaving no one behind and commit to taking more tangible steps to support people in vulnerable situations and the most vulnerable countries and to reach the furthest behind first;",
    "11": "Recalls paragraph 65 (d) of the Sevilla Commitment, which encourages Member States to appoint national focal points for financing for development in finance and other relevant ministries, and invites the Department of Economic and Social Affairs of the Secretariat, within existing resources, to facilitate the establishment of a network of voluntary national focal points for financing for development to strengthen national follow-up;",
    "12": "Reiterates its appeal to Member States and other potential donors to consider contributing generously to the trust fund to support activities for the follow up to the International Conference on Financing for Development, which would facilitate the implementation of a strengthened and more effective inclusive, intergovernmental process for carrying out the financing for development follow-up;",
    "13": "Recognizes the work of the Financing for Sustainable Development Office, and encourages the Office, in collaboration with experts from the public and private sectors, academia, civil society and other multilateral organizations who work in the field of financing for development, to continue its work in accordance with its mandate;",
    "14": "Requests the Secretary-General to submit a report to the General Assembly at its eighty-first session on the follow-up to and implementation of the Sevilla Commitment, including on progress made and continuing challenges faced, and on the implementation of the present resolution;",
    "15": "Decides to include in the provisional agenda of its eighty-first session the item entitled \u201cFollow-up to and implementation of the outcomes of the International Conferences on Financing for Development\u201d."
  },
  "agenda_items": [
    "Item 17"
  ],
  "symbol_references": []
}