{
  "symbol": "A/RES/75/198",
  "filename": "A_RES_75_198.pdf",
  "title": "75/198. International cooperation to address and counter the world drug problem",
  "text": "United Nations \nA/RES/75/198\n \n \nGeneral Assembly \nDistr.: General \n28 December 2020 \n \n20-17359 (E)    050121 \n*2017359* \n \n \nSeventy-fifth session \nAgenda item 113 \nInternational drug control  \n \n \n \n \n Resolution adopted by the General Assembly \non 16 December 2020 \n \n \n \n \n[on the report of the Third Committee (A/75/481, para. 10)] \n \n \n 75/198. International cooperation to address and counter the world \ndrug problem \n \n \n \nThe General Assembly, \n \nReaffirming the outcome document of the thirtieth special session of the General \nAssembly, entitled \u201cOur joint commitment to effectively addressing and countering \nthe world drug problem\u201d,1 in its entirety, and reiterating that the operational \nrecommendations contained therein are integrated, indivisible, multidisciplinary and \nmutually reinforcing and are aimed at a comprehensive, integrated and balanced \napproach to addressing and countering the world drug problem, \n \nWelcoming the 2019 Ministerial Declaration on Strengthening Our Actions at \nthe National, Regional and International Levels to Accelerate the Implementation of \nOur Joint Commitments to Address and Counter the World Drug Problem 2 adopted at \nthe ministerial segment of the sixty-second session of the Commission on Narcotic \nDrugs, which was held to take stock of the implementation of the commitments made \nover the past decade to jointly address and counter the world drug problem, \n \nReaffirming the 2009 Political Declaration and Plan of Action on International \nCooperation towards an Integrated and Balanced Strategy to Counter the World Drug \nProblem3 and the Joint Ministerial Statement of the 2014 high-level review by the \nCommission on Narcotic Drugs of the implementation by Member States of the \nPolitical Declaration and Plan of Action,4 and recalling the resolutions adopted at the \ntwentieth special session of the General Assembly,5  \n__________________ \n \n1  Resolution S-30/1, annex. \n \n2  See Official Records of the Economic and Social Council, 2019, Supplement No. 8 (E/2019/28), \nchap. I, sect. B. \n \n3  Ibid., 2009, Supplement No. 8 (E/2009/28), chap. I, sect. C. \n \n4  Ibid., 2014, Supplement No. 8 (E/2014/28), chap. I, sect. C. \n \n5  Resolutions S-20/1, S-20/2, S-20/3 and S-20/4 A\u2013E. \n\nA/RES/75/198 \nInternational cooperation to address \nand counter the world drug problem\n \n20-17359\n2/22 \n \n \nRecalling other relevant United Nations resolutions, including General \nAssembly resolution 74/178 of 18 December 2019, \n \nRecalling also all resolutions and decisions adopted by the Commission on \nNarcotic Drugs at its sixty-third session,6  \n \nUnderscoring that the Single Convention on Narcotic Drugs of 1961 as amended \nby the 1972 Protocol,7 the Convention on Psychotropic Substances of 1971,8 the \nUnited Nations Convention against Illicit Traffic in Narcotic Drugs and Psychotropic \nSubstances of 19889 and other relevant international instruments constitute the \ncornerstone of the international drug control system, \n \nReaffirming the 2030 Agenda for Sustainable Development,10 and noting that \nefforts to achieve the Sustainable Development Goals and to effectively address the \nworld drug problem are complementary and mutually reinforcing, \n \nReaffirming its commitment to the goals and objectives of the three international \ndrug control conventions, including concern about the health and welfare of \nhumankind as well as the individual and public health-related, social and safety \nproblems resulting from the abuse of narcotic drugs and psychotropic substances, in \nparticular among children and young people, and drug-related crime, and reaffirming \nits determination to prevent and treat the abuse of such substances and prevent and \ncounter their illicit cultivation, production, manufacturing and trafficking, \n \nReaffirming its unwavering commitment to ensuring that all aspects of demand \nreduction and related measures, supply reduction and related measures, and \ninternational cooperation are addressed in full conformity with the purposes and \nprinciples of the Charter of the United Nations, international law and the Universal \nDeclaration of Human Rights,11 with full respect for the sovereignty and territorial \nintegrity of States, the principle of non-intervention in the internal affairs of States, \nall human rights, fundamental freedoms, the inherent dignity of all individuals and \nthe principles of equal rights and mutual respect among States, \n \nRecognizing that the world drug problem remains a common and shared \nresponsibility that should be addressed in a multilateral setting through effective and \nincreased international cooperation and demands an integrated, multidisciplinary, \nmutually reinforcing, balanced, scientific evidence-based and comprehensive approach, \n \nReaffirming the crucial role of Member States in developing an effective and \ncomprehensive approach to addressing and countering the world drug problem, \n \nReaffirming also the principal role of the Commission on Narcotic Drugs as the \npolicymaking body of the United Nations with prime responsibility for drug control \nmatters, as well as the treaty-mandated functions of the Commission to consider and \nmake recommendations relating to all matters pertaining to the aims and provisions \nof the United Nations drug conventions, reaffirming further the support and \nappreciation of the General Assembly for the efforts of the United Nations, in \nparticular those of the United Nations Office on Drugs and Crime as the leading entity \nin the United Nations system for addressing and countering the world drug problem, \nand reaffirming the treaty-mandated roles of the International Narcotics Control \nBoard and the World Health Organization, \n__________________ \n \n6  See Official Records of the Economic and Social Council, 2020, Supplement No. 8 (E/2020/28), \nchap. I, sect. B. \n \n7  United Nations, Treaty Series, vol. 976, No. 14152. \n \n8  Ibid., vol. 1019, No. 14956. \n \n9  Ibid., vol. 1582, No. 27627. \n \n10  Resolution 70/1. \n \n11  Resolution 217 A (III). \n\nInternational cooperation to address \nand counter the world drug problem \nA/RES/75/198\n \n3/22\n20-17359 \n \n \nRecognizing the role of the United Nations Development Programme and the \nJoint United Nations Programme on HIV/AIDS, among other agencies, within their \nrespective mandates, \n \nRecognizing also that civil society, as well as the scientific community and \nacademia, play an important role in addressing and countering the world drug \nproblem, noting that affected populations and representatives of civil society entities, \nwhere appropriate, should be enabled to play a participatory role in the formulation, \nimplementation and provision of relevant scientific evidence in support of, as \nappropriate, the evaluation of drug control policies and programmes, and recognizing \nthe importance of cooperation with the private sector in this regard, \n \nReaffirming the determination of Member States to tackle the world drug \nproblem and to actively promote a society free of drug abuse in order to help to ensure \nthat all people can live in health, dignity and peace, with security and prosperity, and \nreaffirming also the determination of Member States to address public health, safety \nand social problems resulting from drug abuse, \n \nReaffirming also the need to address the key causes and consequences of the \nworld drug problem, including those in the health, social, human rights, economic, \njustice, public security and law enforcement fields, in line with the principle of \ncommon and shared responsibility, and recognizing the value of comprehensive and \nbalanced policy interventions, including those in the field of promotion of sustainable \nand viable livelihoods, \n \nTaking note of Human Rights Council resolution 37/42 of 23 March 2018, \nentitled \u201cContribution to the implementation of the joint commitment to effectively \naddressing and countering the world drug problem with regard to human rights\u201d,12  \n \nExpressing its appreciation for the results already achieved by the initiatives at \nthe bilateral, regional and international levels, and recognizing that further positive \nresults can be achieved with sustained and collective efforts through international \ncooperation in reducing the demand and supply of illicit drugs, \n \nRecognizing that, while tangible progress has been achieved in some fields, the \nworld drug problem continues to present challenges to the health, safety and well-\nbeing of all humanity, and resolving to reinforce national and international efforts and \nfurther increase international cooperation to face those challenges, \n \nRecognizing also, as part of a comprehensive, integrated and balanced approach \nto addressing and countering the world drug problem, that appropriate emphasis \nshould be placed on individuals, families, communities and society as a whole, with \na view to promoting and protecting the health, safety and well-being of all humanity, \n \nRecognizing further the need to enhance efforts to strengthen the prevention of \ndrug abuse among children and youth, also in educational settings, including by \npromoting the exchange of experiences and good practices, as well as technical \nassistance, and recalling Commission on Narcotic Drugs resolution 61/2 of 16 March \n2018 on strengthening efforts to prevent drug abuse in educational settings, 13  \n \nExpressing deep concern at the high price paid by society and by individuals \nand their families as a result of the world drug problem, and paying special tribute to \nthose who have sacrificed their lives, including law enforcement and judicial \n__________________ \n \n12  See Official Records of the General Assembly, Seventy-third Session, Supplement No. 53 \n(A/73/53), chap. IV, sect. A. \n \n13  See Official Records of the Economic and Social Council, 2018, Supplement No. 8 (E/2018/28), \nchap. I, sect. B. \n\nA/RES/75/198 \nInternational cooperation to address \nand counter the world drug problem\n \n20-17359\n4/22 \n \npersonnel, and to the health-care and civil society personnel and volunteers whose \nwork is dedicated to countering and addressing this phenomenon, \n \nNoting with concern that the availability of internationally controlled drugs for \nmedical and scientific purposes, including for the relief of pain and suffering, remains \nlow to non-existent in many countries, and highlighting the need to enhance national \nefforts and international cooperation at all levels to address that situation by \npromoting measures to ensure their availability, affordability and accessibility for \nmedical and scientific purposes, within the framework of national legal systems, \nwhile simultaneously preventing their diversion, abuse and trafficking, in order to \nfulfil the aims and objectives of the three international drug control conventions, \n \nReaffirming equally that reducing drug abuse requires efforts to reduce demand, \nwhich must be demonstrated by sustained widespread demand reduction initiatives \nthat are age- and gender-sensitive and integrate a comprehensive public health \napproach spanning the spectrum of prevention, education, early detection and \nintervention, treatment, care and related support services, recovery support and the \nrehabilitation and social reintegration of drug users, in full compliance with the three \ninternational drug control conventions, \n \nWelcoming continued efforts to enhance coherence within the United Nations \nsystem at all levels, \n \nReaffirming the need to strengthen cooperation between the United Nations \nOffice on Drugs and Crime and other United Nations entities, within their respective \nmandates, in their efforts to support Member States in the implementation of \ninternational drug control treaties in accordance with applicable human rights \nobligations and to promote protection of and respect for human rights and the dignity \nof all individuals in the context of drug programmes, strategies and policies, \n \nTaking note of the various contributions made by Member States, United \nNations entities, United Nations inter-agency initiatives aimed at strengthening \ncoordination within the United Nations system, intergovernmental organizations and \nother relevant stakeholders to the sixty-second session of the Commission on Narcotic \nDrugs, \n \nRecognizing that successfully addressing and countering the world drug \nproblem requires close cooperation and coordination among domestic authorities at \nall levels, particularly in the health, education, justice and law enforcement sectors, \ntaking into account their respective areas of competence under national legislation, \n \nStressing the importance of enhancing international cooperation in the \nidentification and voluntary reporting of and response to new psychoactive substances \nand incidents involving such substances, \n \nNoting with grave concern the increased abuse of certain drugs and the \nproliferation of new substances worldwide, which are a possible threat to public \nhealth and are not controlled under the three international drug control conventions, \n \nNoting with grave concern also the increasing sophistication of the transnational \ncriminal groups engaged in the illicit manufacture and distribution of amphetamine-\ntype stimulants worldwide, as well as the proliferation and diversion of chemical \nprecursors used in the illicit manufacture of narcotic drugs and psychotropic \nsubstances, \n \nRecognizing the importance of appropriately mainstreaming gender and age \nperspectives into drug-related policies and programmes, \n \nExpressing concern that aspects of the world drug problem associated with illicit \ndrug production can cause serious harm to the environment, including deforestation, \n\nInternational cooperation to address \nand counter the world drug problem \nA/RES/75/198\n \n5/22\n20-17359 \n \nsoil erosion and degradation, the loss of endemic species, contamination of the soil, \ngroundwater and waterways, and the release of greenhouse gases, \n \nReaffirming that alternative development policies are an important component \nin enhancing development in States affected by, or in some cases at risk of, the illicit \ncultivation of crops used for illicit drug production and manufacture, and that they \nplay an important role in national, regional and international development policies \nand in comprehensive policies of poverty reduction and cooperation, \n \nReaffirming also the commitment to addressing drug-related socioeconomic \nissues related to the illicit cultivation of narcotic plants and the illicit manufacture \nand production of and trafficking in drugs through the implementation of long-term, \ncomprehensive and sustainable development-oriented and balanced drug control \npolicies and programmes, including alternative development and, as appropriate, \npreventive alternative development programmes, which are part of sustainable crop \ncontrol strategies, \n \nReaffirming further the need to mobilize adequate resources to address and \ncounter the world drug problem, and calling for the enhancement of assistance to \ndeveloping countries, upon request, in effectively implementing the Political \nDeclaration and Plan of Action on International Cooperation towards an Integrated \nand Balanced Strategy to Counter the World Drug Problem and the operational \nrecommendations contained in the annex to resolution S-30/1 of 19 April 2016, \n \nRecognizing that there are persistent, new and evolving challenges that should \nbe addressed in conformity with the three international drug control conventions, \nwhich allow for sufficient flexibility for States parties to design and implement \nnational drug policies according to their priorities and needs, consistent with the \nprinciple of common and shared responsibility and applicable international law, \n \nEncouraging Member States to develop and strengthen, as appropriate, \nmechanisms of domestic coordination and timely and efficient information-sharing \nbetween authorities involved in identifying and countering drug trafficking, diversion \nof precursors and related money-laundering, to integrate financial investigations more \nthoroughly into interdiction operations so as to identify individuals and companies \ninvolved in such activities, and to encourage, in accordance with national legislation, \ncooperation with the private sector, including financial institutions, designated \nnon-financial businesses and professions, as well as providers of money or value \ntransfer services, to identify suspicious transactions, with a view to further \ninvestigating and disrupting the drug trafficking business model, \n \nRecognizing the important challenges posed by the coronavirus disease \n(COVID-19) pandemic at the international, regional and national levels, which have \nthe potential to generate new trends and dynamics with regard to the world drug \nproblem, and stressing the importance of international cooperation to comprehensively \naddress and counter these challenges based on common and shared responsibility,  \n \n1. \nReaffirms the 2019 Ministerial Declaration on Strengthening Our Actions \nat the National, Regional and International Levels to Accelerate the Implementation \nof Our Joint Commitments to Address and Counter the World Drug Problem, and \nemphasizes that the 2009 Political Declaration and Plan of Action on International \nCooperation towards an Integrated and Balanced Strategy to Counter the World Drug \nProblem, the Joint Ministerial Statement of the 2014 high-level review by the \nCommission on Narcotic Drugs of the implementation by Member States of the \nPolitical Declaration and Plan of Action and the outcome document of the thirtieth \nspecial session of the General Assembly, entitled \u201cOur joint commitment to \neffectively addressing and countering the world drug problem\u201d, represent the \ncommitments made by the international community over the preceding decade to \n\nA/RES/75/198 \nInternational cooperation to address \nand counter the world drug problem\n \n20-17359\n6/22 \n \ncounter the world drug problem and address, in a balanced manner, all aspects of \ndemand reduction and related measures, supply reduction and related measures, and \ninternational cooperation identified in the 2009 Political Declaration, as well as \nadditional issues elaborated upon and identified in the outcome document of the \nthirtieth special session of the Assembly, held in 2016, and recognizes that those \ndocuments are complementary and mutually reinforcing; \n \n2. \nRecalls the thirtieth special session of the General Assembly, held at \nUnited Nations Headquarters from 19 to 21 April 2016, at which the Assembly \nreviewed the progress in the implementation of the Political Declaration and Plan of \nAction on International Cooperation towards an Integrated and Balanced Strategy to \nCounter the World Drug Problem, including an assessment of the achievements and \nchallenges in countering the world drug problem, within the framework of the three \ninternational drug control conventions and other relevant United Nations instruments, \ntakes note of the discussions held during the session, and reaffirms in its entirety the \noutcome document entitled \u201cOur joint commitment to effectively addressing and \ncountering the world drug problem\u201d; \n \n3. \nReaffirms the shared commitment to effectively addressing and countering \nthe world drug problem, which requires concerted and sustained action at the national \nand international levels, including accelerating the implementation of existing drug \npolicy commitments; \n \n4. \nReiterates its call upon Member States to take, in a timely manner, the \nmeasures necessary to implement the actions and attain the goals and targets set out \nin the Political Declaration and Plan of Action on International Cooperation towards \nan Integrated and Balanced Strategy to Counter the World Drug Problem, adopted by \nthe General Assembly at its sixty-fourth session, and to address the general challenges \nand priorities for action identified in the Joint Ministerial Statement of the 2014 high-\nlevel review by the Commission on Narcotic Drugs of the implementation by Member \nStates of the Political Declaration and Plan of Action; \n \n5. \nReaffirms that addressing and countering the world drug problem is a \ncommon and shared responsibility that must be addressed in a multilateral setting, \nthat it requires an integrated and balanced approach and that it must be carried out in \nfull conformity with the purposes and principles of the Charter of the United Nations \nand other provisions of international law, the Universal Declaration of Human Rights \nand the Vienna Declaration and Programme of Action 14 on human rights and, in \nparticular, with full respect for the sovereignty and territorial integrity of States, for \nthe principle of non-intervention in the internal affairs of States and for all human \nrights and fundamental freedoms, and on the basis of the principles of equal rights \nand mutual respect; \n \n6. \nReiterates that the efforts to achieve the Sustainable Development Goals \nand to effectively address and counter the world drug problem are complementary \nand mutually reinforcing, recognizes the role of the Commission on Narcotic Drugs \nin contributing to the global follow-up and in supporting the thematic review of \nprogress on the Goals related to its mandate, and in this regard encourages the \nCommission to continue to provide input to the high-level political forum on \nsustainable development, including by providing relevant data, as the implementation \nof the recommendations contained in the outcome document of the thirtieth special \nsession of the General Assembly may contribute to the attainment of the related \nGoals; \n__________________ \n \n14  A/CONF.157/24 (Part I), chap. III. \n\nInternational cooperation to address \nand counter the world drug problem \nA/RES/75/198\n \n7/22\n20-17359 \n \n \n7. \nCalls upon Member States to engage in effective cooperation and practical \naction aimed at addressing and countering the world drug problem on the basis of the \nprinciple of common and shared responsibility; \n \n8. \nEncourages Member States to enhance North-South, South-South and \ntriangular cooperation, in cooperation with the international development community \nand other key stakeholders, in order to effectively address and counter the world drug \nproblem; \n \n9. \nReiterates its commitment to promoting the health, welfare and well-being \nof all individuals, families, communities and society as a whole and to facilitating \nhealthy lifestyles through effective, comprehensive, scientific evidence-based \ndemand reduction initiatives at all levels, covering, in accordance with national \nlegislation and the three international drug control conventions, prevention, early \nintervention, treatment, care, recovery, rehabilitation and social reintegration \nmeasures, as well as initiatives and measures aimed at minimizing the adverse public \nhealth and social consequences of drug abuse; \n \n10. Also reiterates its commitment to protect the safety and assure the security \nof individuals, societies and communities by intensifying efforts to prevent and \ncounter the illicit cultivation, production and manufacture of and trafficking in \nnarcotic drugs and psychotropic substances, as well as drug-related crime and \nviolence, through, inter alia, more effective drug-related crime prevention and law \nenforcement measures, as well as by addressing links with other forms of organized \ncrime, including money-laundering, corruption and other criminal activities, mindful \nof their social and economic causes and consequences; \n \n11. \nUnderlines the need for Member States to cooperate closely with the \nUnited Nations Office on Drugs and Crime, the World Health Organization, the \nInternational Narcotics Control Board and other international and regional \norganizations, as well as the scientific community, including academia, in \ncontributing to the scientific assessment of drug demand and supply reduction \npolicies, drug markets and drug-related crime; \n \n12. Recognizes that transit States continue to face multifaceted challenges, and \nreaffirms the continuing need for cooperation and support, including the provision of \ntechnical assistance, to, inter alia, enhance their capacities to effectively address and \ncounter the world drug problem, in conformity with the United Nations Convention \nagainst Illicit Traffic in Narcotic Drugs and Psychotropic Substances of 1988; \n \n13. Urges Member States to address the relevant socioeconomic factors that \nrelate to the world drug problem through a comprehensive, integrated and balanced \napproach that incorporates drug policies into a broader socioeconomic development \nagenda, in compliance with the three international drug control conventions; \n \n14. Invites Member States to consider strengthening a development \nperspective as part of comprehensive, integrated and balanced national drug policies \nand programmes so as to tackle the related causes and consequences of the illicit \ncultivation, manufacture and production of and trafficking in drugs by, inter alia, \naddressing risk factors affecting individuals, communities and society, which may \ninclude a lack of services, infrastructure needs, drug-related violence, exclusion, \nmarginalization and social disintegration, in order to contribute to the promotion of \npeaceful and inclusive societies; \n \n15. Encourages the development of viable economic alternatives, particularly \nfor communities affected by or at risk of illicit cultivation of drug crops and other \nillicit drug-related activities in urban and rural areas, including through \ncomprehensive alternative development programmes, and to this end encourages \nMember States to consider development-oriented interventions, while ensuring that \n\nA/RES/75/198 \nInternational cooperation to address \nand counter the world drug problem\n \n20-17359\n8/22 \n \nboth men and women benefit equally from them, including through job opportunities, \nimproved infrastructure and basic public services and, as appropriate, access and legal \ntitles to land for farmers and local communities, which will also contribute to \npreventing, reducing or eliminating illicit cultivation and other drug-related activities; \n \n16. Emphasizes the need to strengthen, including through the Commission on \nNarcotic Drugs and, as appropriate, its subsidiary bodies, the regular exchange of \ninformation, good practices and lessons learned among national practitioners from \ndifferent fields and at all levels to effectively implement an integrated and balanced \napproach to the world drug problem and its various aspects and the need to consider \nadditional measures to further facilitate meaningful discussion among those \npractitioners; \n \n17. Reiterates its call to mainstream a gender perspective into and ensure the \nfull and effective participation of women in all stages of the development, \nimplementation, monitoring and evaluation of drug policies and programmes, to \ndevelop and disseminate gender-sensitive and age-appropriate measures that take into \naccount the specific needs and circumstances faced by women and girls with regard \nto the world drug problem and, as States parties, implement the Convention on the \nElimination of All Forms of Discrimination against Women;15 \n \n18. Requests the United Nations Office on Drugs and Crime to continue to \nsupport Member States, upon request, in mainstreaming a gender perspective into \ntheir policies and programmes related to the world drug problem, and invites the \nUnited Nations Entity for Gender Equality and the Empowerment of Women \n(UN-Women) and other relevant United Nations entities, within their mandates, to \ncooperate with the Office in this regard; \n \n19. Urges Member States to increase the availability, coverage and quality of \nscientific evidence-based prevention measures and tools that target relevant age and \nrisk groups in multiple settings, reaching youth in school as well as out of school, among \nothers, through drug abuse prevention programmes and public awareness-raising \ncampaigns, including by using the Internet, social media and other online platforms, to \ndevelop and implement prevention curricula and early intervention programmes for use \nin the education system at all levels, as well as in vocational training, including in the \nworkplace, and to enhance the capacity of teachers and other relevant professionals to \nprovide or recommend counselling, prevention and care services; \n \n20. Encourages Member States to identify and take advantage of opportunities \nto conduct collaborative research and continuously share the latest scientific research, \ntaking into account the contributions of the national, regional and international \nscientific community, including academia, on the most effective demand and supply \nreduction strategies, and to develop improved best practices on interventions to \nreduce demand for drugs, in accordance with the three international drug control \nconventions and other drug policy commitments; \n \n21. Invites Member States to consider enhancing cooperation among public \nhealth, education and law enforcement authorities when developing prevention \ninitiatives; \n \n22. Urges Member States, as part of their comprehensive drug demand \nreduction measures at the national level, to strengthen efforts, as appropriate, to \nprevent drug abuse in educational settings, in both the public and private sectors, \nincluding by providing children and youth with information regarding drug abuse and \nits harmful effects and consequences as well as drug use prevention, counselling and \n__________________ \n \n15  United Nations, Treaty Series, vol. 1249, No. 20378. \n\nInternational cooperation to address \nand counter the world drug problem \nA/RES/75/198\n \n9/22\n20-17359 \n \nskills, resilience and opportunities to choose healthy lifestyles, and to promote safe \nand drug-free environments in educational settings; \n \n23. Invites Member States to promote and improve the systematic collection \nof information and gathering of evidence as well as the sharing, at the national and \ninternational levels, of reliable and comparable data on drug use and epidemiology, \nincluding on social, economic and other risk factors, to promote, as appropriate, \nthrough the Commission on Narcotic Drugs and the World Health Assembly, the use \nof internationally recognized standards, such as the International Standards on Drug \nUse Prevention, and the exchange of best practices, and to formulate effective drug \nuse prevention strategies and programmes in cooperation with the United Nations \nOffice on Drugs and Crime, the World Health Organization and other relevant United \nNations entities; \n \n24. Encourages Member States, in their promotion and improvement of the \nsystematic collection of information and gathering of evidence, to gather scientific data \non any damage to health that may be caused by consuming drugs in vaporized form, and \nto take appropriate steps to exchange best practices and formulate effective drug use \nprevention strategies and programmes, with a particular focus on children and youth; \n \n25. Invites Member States to provide the United Nations Office on Drugs and \nCrime with information on best practices and programmes recently implemented, \nconsistent with the three international drug control conventions, in order to assess \nrecent developments and current and future challenges; \n \n26. Recognizes drug dependence as a complex, multifactorial health disorder \ncharacterized by a chronic and relapsing nature, with social causes and consequences, \nthat can be prevented and treated through, inter alia, effective scientific evidence-\nbased drug treatment, care and rehabilitation programmes, including community-\nbased programmes, and also recognizes the need to strengthen capacity for aftercare \nfor and the rehabilitation, recovery and social reintegration of individuals with \nsubstance use disorders, including, as appropriate, through assistance for effective \nreintegration into the labour market and other support services; \n \n27. Encourages Member States to promote the prevention and treatment of \ndrug use disorders, using scientific evidence-based practices, such as those outlined \nin the International Standards for the Treatment of Drug Use Disorders, that reflect \nrespect for human rights and dignity, including the right to enjoy the highest attainable \nstandard of physical and mental health and well-being, promoting, as appropriate, \nwithin national and regional contexts, non-stigmatizing attitudes in the development \nand implementation of scientific evidence-based policies; \n \n28. Also encourages Member States to promote the inclusion in national drug \npolicies, in accordance with national legislation and as appropriate, of elements for the \nprevention and treatment of drug overdose, in particular opioid overdose, including the \nuse of opioid receptor antagonists, such as naloxone, to reduce drug-related mortality; \n \n29. Invites Member States to promote cooperation with and technical \nassistance to the States most affected by the world drug problem in developing and \nimplementing comprehensive and integrated policies to address, where appropriate, \nthe impact of illicit drug trafficking on increasing drug use in such States, including \nby reinforcing national programmes aimed at prevention, early intervention, \ntreatment, care, rehabilitation and social reintegration; \n \n30. Encourages the United Nations Office on Drugs and Crime and the \nInternational Narcotics Control Board to continue to strengthen cooperation with the \nWorld Health Organization and other competent United Nations entities, within their \nrespective mandates, as part of a comprehensive, integrated and balanced approach to \nstrengthening health and social welfare measures in addressing the world drug \n\nA/RES/75/198 \nInternational cooperation to address \nand counter the world drug problem\n \n20-17359\n10/22 \n \nproblem, including through effective prevention, early intervention, treatment, care, \nrecovery, rehabilitation and social reintegration, in cooperation, as appropriate, with \ncivil society and the scientific community, and to keep the Commission on Narcotic \nDrugs appropriately updated; \n \n31. Recalls the signing of the memorandum of understanding between the \nUnited Nations Office on Drugs and Crime and the World Health Organization in \nFebruary 2017, which will continue to facilitate increased collaboration and \ncoordination between these two entities, within their mandates, in advancing efforts \nto address and counter the world drug problem, and encourages the Office to continue \nto strengthen its collaboration with the World Health Organization and to explore, as \nappropriate, cooperation arrangements with other relevant United Nations agencies \nand entities and to keep the Commission on Narcotic Drugs appropriately updated; \n \n32. Encourages the United Nations Office on Drugs and Crime and the World \nHealth Organization to continue their collaboration to address and counter the world \ndrug problem in accordance with their relevant mandates, and takes note of the input \nof the World Health Organization, within its treaty-based mandate, in addressing and \ncountering the world drug problem from a public health dimension; \n \n33. Encourages Member States to involve, as appropriate, policymakers, \nparliamentarians, educators, civil society, the scientific community, academia, target \npopulations, individuals in recovery from substance use disorders and their peer \ngroups, families and other co-dependent people, as well as the private sector, in the \ndevelopment of prevention programmes aimed at raising public awareness of the \ndangers and risks associated with drug abuse, and involve, inter alia, parents, care \nservices providers, teachers, peer groups, health professionals, religious communities, \ncommunity leaders, social workers, sports associations, media professionals and \nentertainment industries, as appropriate, in their implementation; \n \n34. Also encourages Member States to consider alternatives to incarceration, \nconviction and punishment, where appropriate and in accordance with the three \ninternational drug control conventions, noting that, in appropriate cases of a minor \nnature, States may provide, as alternatives to conviction or punishment, measures \nsuch as education, rehabilitation or social reintegration, as well as, when the offender \nhas a drug use disorder, treatment and aftercare, as well as support for recovery; \n \n35. Encourages the development, adoption and implementation, with due \nregard for national, constitutional, legal and administrative systems, of alternative or \nadditional measures with regard to conviction or punishment in cases of an \nappropriate nature, in accordance with the three international drug control \nconventions and taking into account, as appropriate, relevant United Nations \nstandards and norms in crime prevention and criminal justice, such as the United \nNations Standard Minimum Rules for Non-custodial Measures (the Tokyo Rules);16 \n \n36. Also encourages the consideration of the specific needs and possible \nmultiple vulnerabilities of women drug offenders when imprisoned, in line with the \nUnited Nations Rules for the Treatment of Women Prisoners and Non-custodial \nMeasures for Women Offenders (the Bangkok Rules);17 \n \n37. Invites Member States to consider reviewing their drug sentencing policies \nand practices in order to facilitate collaboration between justice, education and public \nhealth authorities in the development and implementation of initiatives that utilize \nalternative measures to conviction or punishment for appropriate drug-related \noffences of a minor nature, subject to the legal frameworks of Member States; \n__________________ \n \n16  Resolution 45/110, annex. \n \n17  Resolution 65/229, annex. \n\nInternational cooperation to address \nand counter the world drug problem \nA/RES/75/198\n \n11/22\n20-17359 \n \n \n38. Emphasizes the need to enhance the knowledge of policymakers and the \ncapacity, as appropriate, of relevant national authorities on various aspects of the \nworld drug problem in order to ensure that national drug policies, as part of a \ncomprehensive, integrated and balanced approach, fully respect all human rights and \nfundamental freedoms and protect the health, safety and well-being of individuals, \nfamilies, vulnerable members of society, communities and society as a whole, and to \nthat end encourages the cooperation of Member States with, and cooperation among, \nthe United Nations Office on Drugs and Crime, the International Narcotics Control \nBoard, the World Health Organization and other relevant United Nations entities, \nwithin their respective mandates, including those relevant to the above-mentioned \nissues, and relevant regional and international organizations, as well as with civil \nsociety and the private sector, as appropriate; \n \n39. Urges Member States to ensure non-discriminatory access to health, care \nand social services in prevention, primary care and treatment programmes, including \nthose offered to persons in prison or pretrial detention, which are to be on a level \nequal to those available in the community, and to ensure that women, including \ndetained women, have access to adequate health services and counselling, including \nthose particularly needed during pregnancy; \n \n40. Encourages Member States to promote effective supervision of drug \ntreatment and rehabilitation facilities by competent domestic authorities so as to \nensure adequate quality of drug treatment and rehabilitation services, promote \nnon-stigmatizing attitudes and prevent any possible acts of cruel, inhuman or \ndegrading treatment or punishment, in accordance with domestic legislation and \napplicable international law; \n \n41. Calls upon Member States to enhance access to treatment for drug use \ndisorders for those who are incarcerated and promote effective oversight and \nencourage, as appropriate, self-assessments of confinement facilities, taking into \nconsideration the United Nations standards and norms in crime prevention and \ncriminal justice, including the United Nations Standard Minimum Rules for the \nTreatment of Prisoners (the Nelson Mandela Rules),18 implement, where appropriate, \nmeasures aimed at addressing and eliminating prison overcrowding and violence, and \nprovide capacity-building to relevant national authorities; \n \n42. Encourages Member States to promote proportionate national sentencing \npolicies, practices and guidelines for drug-related offences, whereby the severity of \npenalties is proportionate to the gravity of offences and both mitigating and \naggravating factors are taken into account, including the circumstances enumerated \nin article 3 of the 1988 Convention and other relevant and applicable international \nlaw, and in accordance with national legislation; \n \n43. Calls for the promotion of bilateral, regional and international cooperation, \nincluding through intelligence-sharing and cross-border cooperation, aimed at \naddressing and countering the world drug problem more effectively, in particular by \nencouraging and supporting such cooperation by those States most directly affected by \nillicit crop cultivation and the illicit production, manufacture, transit, trafficking, \ndistribution and abuse of narcotic drugs and psychotropic substances; \n \n44. Encourages Member States to develop and implement, as appropriate, \ncomprehensive policies and programmes that, by fostering social and sustainable \ndevelopment, are aimed at the prevention of crime and violence and that address the \nmultiple factors that contribute to marginalization, crime and victimization, in close \n__________________ \n \n18  Resolution 70/175, annex. \n\nA/RES/75/198 \nInternational cooperation to address \nand counter the world drug problem\n \n20-17359\n12/22 \n \ncooperation with relevant stakeholders, including civil society, and based on scientific \nevidence and taking into account good practices; \n \n45. Reaffirms the need for Member States to review and, if necessary, \nstrengthen coordinated measures, enhance capacity-building to counter money-\nlaundering arising from drug trafficking and improve legal cooperation, including \njudicial cooperation, where appropriate, at the national, regional and international \nlevels, to dismantle organized criminal groups involved in drug trafficking, in order \nto provide for the prevention, detection, investigation and prosecution of the \nperpetrators of such crimes, including cooperation to the fullest extent possible to \nsuppress illicit traffic by sea in conformity with the international law of the sea; \n \n46. Underlines the need to strengthen regional, subregional and international \ncooperation in criminal matters, as appropriate, including judicial cooperation in the \nareas of, inter alia, extradition, mutual legal assistance and transfer of proceedings, \nin accordance with the three international drug control conventions and other \ninternational legal instruments and national legislation, and to strive to provide \nappropriate resources to national competent authorities, including through the \nprovision of targeted technical assistance to requesting countries; \n \n47. Reaffirms the importance of an integrated approach in drug policies, \nincluding by strengthening partnerships between the public health, development, \nhuman rights, justice and law enforcement fields and by facilitating inter-agency \ncooperation and communication, where appropriate; \n \n48. Encourages the promotion, where appropriate, in the framework of \ninternational cooperation, of the use of law enforcement techniques, consistent with \nnational legislation and international law, including applicable human rights \nobligations, in order to ensure that drug traffickers are brought to justice and that \nmajor criminal organizations are disrupted and dismantled; \n \n49. Reiterates the strong commitment of Member States to improving access \nto controlled substances for medical and scientific purposes by appropriately \naddressing existing barriers in this regard, including those related to legislation, \nregulatory systems, health-care systems, affordability, the training of health-care \nprofessionals, education, awareness-raising, estimates, assessment and reporting, \nbenchmarks for consumption of substances under control and international \ncooperation and coordination, while concurrently preventing the diversion and abuse \nof and trafficking in such substances; \n \n50. Recognizes the effectiveness of law enforcement measures against \norganized criminal groups and individuals involved in drug-related crimes, and the \nneed to place appropriate focus within the respective jurisdictions of Member States \non those responsible for illicit activities of a larger scale or more serious nature; \n \n51. Recalls the Political Declaration on HIV and AIDS: On the Fast Track to \nAccelerating the Fight against HIV and to Ending the AIDS Epidemic by 2030, \nadopted by the General Assembly on 8 June 2016;19 \n \n52. Invites relevant national authorities to consider, in accordance with their \nnational legislation and the three international drug control conventions, including in \nnational prevention, treatment, care, recovery, rehabilitation and social reintegration \nmeasures and programmes, in the context of comprehensive and balanced drug \ndemand reduction efforts, effective measures aimed at minimizing the adverse public \nhealth and social consequences of drug abuse, including appropriate medication-\nassisted therapy programmes, injecting equipment programmes as well as \nantiretroviral therapy and other relevant interventions that prevent the transmission \n__________________ \n \n19  Resolution 70/266, annex. \n\nInternational cooperation to address \nand counter the world drug problem \nA/RES/75/198\n \n13/22\n20-17359 \n \nof HIV, viral hepatitis and other blood-borne diseases associated with drug use, and \nto consider ensuring access to such interventions, including in treatment and outreach \nservices, prisons and other custodial settings, and promoting in that regard the use, as \nappropriate, of the technical guide for countries to set targets for universal access to \nHIV prevention, treatment and care for injecting drug users, issued by the World \nHealth Organization, the United Nations Office on Drugs and Crime and the Joint \nUnited Nations Programme on HIV/AIDS; \n \n53. Urges Member States and other donors to continue to provide bilateral and \nother funding for the global drug problem response, including in particular the \nHIV/AIDS response, including to the Joint United Nations Programme on HIV/AIDS, \nand to strive to ensure that such funding contributes to addressing the growing \nHIV/AIDS epidemic among people who inject drugs, and HIV/AIDS in prison \nsettings, in the spirit of the pledge made in the 2030 Agenda for Sustainable \nDevelopment to leave no one behind; \n \n54. Acknowledges the continuing efforts made and the progress achieved in \ncountering the world drug problem, and stresses the need to strengthen and intensify \njoint efforts at the national, regional and international levels to tackle the global \nchallenges related to the world drug problem in a more comprehensive manner, in \naccordance with the principle of common and shared responsibility, including by \nmeans of enhanced and better-coordinated technical and financial assistance; \n \n55. Takes note of the 2019 report of the International Narcotics Control \nBoard20 and the supplementary reports thereto, and in this regard reaffirms \nCommission on Narcotic Drugs resolution 62/8 of 22 March 2019 on supporting the \nInternational Narcotics Control Board in fulfilling its treaty-mandated functions in \ncooperation with Member States and in collaboration with the Commission on \nNarcotic Drugs and the World Health Organization;21 \n \n56. Invites Member States to strengthen, as appropriate, the proper functioning \nof national drug control systems and domestic assessment mechanisms and \nprogrammes, in cooperation with the International Narcotics Control Board, the United \nNations Office on Drugs and Crime, the World Health Organization and other relevant \nUnited Nations system agencies, to identify, analyse and remove impediments to the \navailability and accessibility of controlled substances for medical and scientific \npurposes, within appropriate control mechanisms, as required by the three international \ndrug control conventions and taking into account the publication entitled Ensuring \nBalance in National Policies on Controlled Substances: Guidance for Availability and \nAccessibility of Controlled Medicines, and, for that purpose, to consider the provision \nof technical and financial assistance, upon request, to developing countries; \n \n57. Urges all Member States to enact comprehensive measures aimed at \nstemming the abuse, diversion and misuse of prescription drugs, in particular through \nthe establishment of awareness-raising initiatives targeting the general public and \nhealth-care providers; \n \n58. Recognizes that it is necessary for Member States, under the three \ninternational drug control conventions and the fundamental principles of their \ndomestic legal systems and national legislation, to consider, where appropriate: \n \n(a) \nRegularly reviewing and assessing their drug control policies, ensuring \nthat they are effective, comprehensive, balanced and aimed at promoting the health \nand well-being of individuals, families, communities and society as a whole; \n__________________ \n \n20  International Narcotics Control Board, document E/INCB/2019/1. \n \n21  See Official Records of the Economic and Social Council, 2019, Supplement No. 8 (E/2019/28), \nchap. I, sect. B. \n\nA/RES/75/198 \nInternational cooperation to address \nand counter the world drug problem\n \n20-17359\n14/22 \n \n \n(b) \nProviding, as appropriate, comprehensive, integrated drug demand \nreduction programmes, based on scientific evidence and covering a range of \nmeasures, including primary prevention, early intervention, treatment, care, \nrehabilitation, social reintegration and measures aimed at minimizing the negative \npublic health and social impact of drug abuse, aimed at promoting health and social \nwell-being among individuals, families and communities and reducing the adverse \nconsequences of drug abuse for individuals and society as a whole; \n \n59. Also recognizes the continued efforts to promote coordination and \ncooperation on drug-related matters within the United Nations system; \n \n60. Calls upon the United Nations Office on Drugs and Crime, the \nCommission on Narcotic Drugs, the International Narcotics Control Board, the World \nHealth Organization and other United Nations entities with pertinent technical and \noperational expertise, within their mandates, to continue to provide, upon request, \nadvice and assistance to States that are reviewing and updating their drug policies, in \ncompliance with the three international drug control conventions, taking into account \ntheir national priorities and needs through, among other things, the promotion of the \nexchange of information and best practices on scientific evidence-based policies \nadopted by States; \n \n61. Calls upon Member States to promote and strengthen the exchange of \ninformation and, as appropriate, drug-related criminal intelligence among law \nenforcement and border control agencies, including through the United Nations \nOffice on Drugs and Crime multilateral portals and regional information centres and \nnetworks, and to promote joint investigations and coordinate operations, in \nconformity with national legislation, and training programmes at all levels, in order \nto identify, disrupt and dismantle organized criminal groups operating transnationally \nthat are involved in any activities related to the illicit production of and trafficking in \nnarcotic drugs and psychotropic substances and the diversion of their precursors and \nrelated money-laundering; \n \n62. Reiterates the commitment of Member States to share relevant information \nwith, as appropriate, and strengthen the capacity of the World Health Organization, \nthe United Nations Office on Drugs and Crime, the International Narcotics Control \nBoard and other relevant international and regional organizations to prioritize the \nreview of the most prevalent, persistent and harmful new psychoactive substances and \nto facilitate informed scheduling decisions by the Commission on Narcotic Drugs; \n \n63. \nEncourages Member States to fully support the efforts of the World Health \nOrganization to review substances, within its mandate under the three international drug \ncontrol conventions, particularly through its Expert Committee on Drug Dependence; \n \n64. Also encourages Member States to enhance the capacity of law \nenforcement agencies to detect and identify new psychoactive substances and \namphetamine-type stimulants, including methamphetamine, and promote cross-\nborder cooperation and information-sharing to prevent their abuse and diversion, \nincluding through the use of existing International Narcotics Control Board and \nUnited Nations Office on Drugs and Crime tools and projects; \n \n65. Further encourages Member States to establish and strengthen \npartnerships and information exchange with industries, in particular with chemical \nand pharmaceutical industries and other relevant private sector entities, and \nencourage the use of the Guidelines for a Voluntary Code of Practice for the Chemical \nIndustry, issued by the International Narcotics Control Board, and the Board\u2019s model \nmemorandum of understanding between Governments and private sector partners, as \nand where appropriate, bearing in mind the important role that these industries can \nplay in addressing and countering the world drug problem; \n\nInternational cooperation to address \nand counter the world drug problem \nA/RES/75/198\n \n15/22\n20-17359 \n \n \n66. Calls upon Member States to commit themselves to implementing timely, \nscientific evidence-based control or regulatory measures within national legislative \nand administrative systems to tackle and manage the challenge of new psychoactive \nsubstances, and to consider the use of interim steps while substances are under review, \nsuch as provisional measures of control, or to make public health announcements, as \nwell as share information and expertise on those measures; \n \n67. Invites Member States to support existing research, collection and \nscientific analysis of data related to amphetamine-type stimulants through the global \nSynthetics Monitoring: Analysis, Reporting and Trends (SMART) programme and \nrelevant International Narcotics Control Board tools, such as Project Prism, and \nstrengthen cooperation at all levels in tackling synthetic opioids and amphetamine-\ntype stimulants, including methamphetamine; \n \n68. Also invites Member States to promote the use, as appropriate, of relevant \nexisting programmes, mechanisms and coordinated operations at all levels and \ncontinue the development and sharing of best practices and lessons learned among \npractitioners with regard to a balanced and integrated approach to the evolving threat \nof amphetamine-type stimulants; \n \n69. Calls upon Member States to continue efforts to identify and monitor trends \nin the composition, production, prevalence and distribution of new psychoactive \nsubstances, as well as patterns of use and adverse consequences, and assess the risks to \nthe health and safety of individuals and society as a whole and the potential uses of new \npsychoactive substances for medical and scientific purposes, and on that basis to \ndevelop and strengthen domestic and national legislative, regulatory, administrative and \noperational responses and practices by domestic and national legislative, law \nenforcement, judiciary, social and welfare, educational and health authorities; \n \n70. Invites Member States to target the illicit cultivation of crops used for the \nillicit production and manufacture of drugs and address related factors by \nimplementing comprehensive strategies aimed at alleviating poverty and \nstrengthening the rule of law, accountable, effective and inclusive institutions and \npublic services and institutional frameworks, as appropriate, and by promoting \nsustainable development aimed at enhancing the welfare of the affected and \nvulnerable population through licit alternatives; \n \n71. Encourages the promotion of inclusive economic growth and support for \ninitiatives that contribute to poverty eradication and the sustainability of social and \neconomic development, and encourages Member States to develop measures for rural \ndevelopment, improving infrastructure and social inclusion and protection, addressing \nthe consequences of illicit crop cultivation and the manufacture and production of \nnarcotic drugs and psychotropic substances on the environment, with the incorporation \nand participation of local communities, and to consider taking voluntary measures to \npromote products stemming from alternative development, including preventive \nalternative development, as appropriate, to gain access to markets, consistent with \napplicable multilateral trade rules and with national and international law, within the \nframework of comprehensive and balanced drug control strategies; \n \n72. Expresses concern that the illicit cultivation of crops and illicit \nmanufacture, distribution and trafficking remain serious challenges in addressing and \ncountering the world drug problem, and recognizes the need for strengthening \nsustainable crop control strategies that may include, inter alia, alternative \ndevelopment, eradication and law enforcement measures, for the purpose of \npreventing and significantly and measurably reducing the illicit cultivation of crops, \nand the need to intensify joint efforts at the national, regional and international levels \nin a more comprehensive manner, in accordance with the principle of common and \nshared responsibility, including by means of appropriate preventive tools and \n\nA/RES/75/198 \nInternational cooperation to address \nand counter the world drug problem\n \n20-17359\n16/22 \n \nmeasures, enhanced and better-coordinated financial and technical assistance and \naction-oriented programmes, in order to tackle those challenges; \n \n73. Invites Member States to consider elaborating and implementing \ncomprehensive and sustainable alternative development programmes, including \npreventive alternative development, as appropriate, that support sustainable crop control \nstrategies to prevent and significantly, durably and measurably reduce illicit crop \ncultivation and other illicit drug-related activities, ensuring the empowerment, ownership \nand responsibility of affected local communities, including farmers and their \ncooperatives, by taking into account the vulnerabilities and specific needs of communities \naffected by or at risk of illicit cultivation, in cooperation with the United Nations Office \non Drugs and Crime, the Food and Agriculture Organization of the United Nations, the \nInternational Labour Organization, the United Nations Development Programme and \nother relevant international organizations, bearing in mind national and regional \ndevelopment policies and action plans, with a view to contributing to the building of \npeaceful, inclusive and just societies, consistent with the Sustainable Development Goals \nand in compliance with relevant and applicable international and national law; \n \n74. Also invites Member States to strengthen subregional, regional and \ninternational cooperation to support comprehensive and sustainable alternative \ndevelopment programmes, including, as appropriate, preventive alternative \ndevelopment, as an essential part of successful prevention and crop control strategies \nto increase the positive outcome of such programmes, especially in the areas affected \nby and at risk of illicit cultivation of crops used for the production of narcotic drugs \nand psychotropic substances, taking into account the United Nations Guiding \nPrinciples on Alternative Development;22 \n \n75. Urges relevant international financial institutions, United Nations entities, \nnon-governmental organizations and the private sector, as appropriate, to consider \nincreasing their support, including through long-term and flexible funding, for the \nimplementation of comprehensive and balanced development-oriented drug control \nprogrammes and viable economic alternatives, in particular alternative development, \nincluding, as appropriate, preventive alternative development programmes, based on \nidentified needs and national priorities, for areas and populations affected by or \nvulnerable to the illicit cultivation of drug crops, with a view to its prevention, \nreduction and elimination, and encourages States to the extent possible to stay \nstrongly committed to financing such programmes; \n \n76. Urges Member States to promote partnerships and innovative cooperation \ninitiatives with the private sector, civil society and international financial institutions \nto create conditions more conducive to productive investments targeted at job creation \nin areas and among communities affected by or at risk of illicit drug cultivation, \nproduction, manufacturing, trafficking and other illicit drug-related activities in order \nto prevent, reduce or eliminate them, and share best practices, lessons learned, \nexpertise and skills in this regard; \n \n77. Encourages Member States to ensure that measures to prevent the illicit \ncultivation of and to eradicate plants containing narcotic and psychotropic substances \nrespect fundamental human rights, take due account of traditional licit uses, where \nthere is historical evidence of such use, and of the protection of the environment, in \naccordance with the three international drug control conventions, and also take into \naccount, as appropriate and in accordance with national legislation, the United \nNations Declaration on the Rights of Indigenous Peoples; 23 \n__________________ \n \n22  Resolution 68/196, annex. \n \n23  Resolution 61/295, annex. \n\nInternational cooperation to address \nand counter the world drug problem \nA/RES/75/198\n \n17/22\n20-17359 \n \n \n78. Reiterates its commitment to strengthen regional and international \ncooperation to support sustainable alternative development programmes, including, \nas appropriate, preventive alternative development, in close collaboration with all \nrelevant stakeholders at the local, national and international levels, and to develop \nand share best practices towards implementing the United Nations Guiding Principles \non Alternative Development, taking into account all the lessons learned and good \npractices, in particular by countries with extensive expertise in alternative development; \n \n79. Welcomes its resolution 72/197 of 19 December 2017, entitled \u201cPromoting \nthe implementation of the United Nations Guiding Principles on Alternative \nDevelopment and related commitments on alternative development and regional, \ninterregional and international cooperation on development-oriented, balanced drug \ncontrol policy addressing socioeconomic issues\u201d; \n \n80. Urges Member States to increase cooperation at all levels and enhance \nmeasures to prevent and significantly and measurably reduce or eliminate the illicit \ncultivation of opium poppy, coca bush and cannabis plant used for the production of \nnarcotic drugs and psychotropic substances, including through eradication, within the \nframework of sustainable crop control strategies and measures; \n \n81. Reiterates its commitment to strengthen specialized, targeted, effective and \nsustainable technical assistance, including, where appropriate, adequate financial \nassistance, training, capacity-building, equipment and technological know-how, to \nrequesting countries, including transit countries, through and in cooperation with the \nUnited Nations Office on Drugs and Crime, as well as the World Health Organization \nand other relevant United Nations entities and international and regional \norganizations, within their respective mandates, so as to help Member States to \neffectively address the health, socioeconomic, human rights, justice and law \nenforcement aspects of the world drug problem; \n \n82. Encourages Member States to fully implement international commitments \non the promotion of the rule of law at the national and international levels, health and \nrespect for human rights in their drug policies; \n \n83. Calls upon Member States to respond to the serious challenges posed by \nthe increasing links between drug trafficking, corruption and other forms of organized \ncrime, including trafficking in persons, trafficking in firearms, cybercrime and \nmoney-laundering, and, in some cases, terrorism, including money-laundering in \nconnection with the financing of terrorism, by using an integrated, multidisciplinary \napproach, such as through promoting and supporting reliable data collection, research \nand, as appropriate, intelligence- and analysis-sharing to ensure effective \npolicymaking and interventions; \n \n84. Invites Member States to strengthen and utilize existing and relevant \nregional and, as appropriate, subregional and international networks for the exchange \nof operational information to prevent and counter money-laundering, illicit financial \nflows and terrorist financing; \n \n85. Encourages Member States to enhance national, regional, subregional, \ninterregional and international capacity to prevent and counter money-laundering and \nillicit financial flows stemming from drug trafficking and related crimes, including, \nas appropriate, through the detection, investigation and prosecution of such activities, \nwith a view to effectively addressing safe havens, and to identify and mitigate money-\nlaundering risks linked to new technologies, as well as emerging money-laundering \nmethods and techniques, by using, inter alia, existing United Nations Office on Drugs \nand Crime technical assistance tools; \n \n86. Also encourages Member States to strengthen coordinated border \nmanagement strategies, as well as the capacity of border control and law enforcement \n\nA/RES/75/198 \nInternational cooperation to address \nand counter the world drug problem\n \n20-17359\n18/22 \n \nand prosecutorial agencies, including through technical assistance, upon request, \nincluding, and where appropriate, the provision of equipment and technology, along \nwith necessary training and maintenance support, in order to prevent, monitor and \ncounter trafficking in drugs, trafficking in precursors and other drug-related crimes, \nsuch as trafficking in firearms, illicit financial flows, smuggling of bulk cash and \nmoney-laundering; \n \n87. Further encourages Member States to use existing subregional, regional \nand international cooperation mechanisms to combat all forms of drug-related crime, \nwherever committed, including, in some cases, violent crimes related to gangs, \nincluding by enhancing international cooperation to successfully counter and \ndismantle organized criminal groups, including those operating transnationally; \n \n88. Calls upon Member States to also consider, when developing \ncomprehensive policies to tackle the world drug problem, measures, programmes and \nactions that address the needs of those affected by drug-related violence and crime; \n \n89. Reaffirms the importance of the United Nations Office on Drugs and Crime \nand its field offices in building capacity at the local level in the fight against \ntransnational organized crime and drug trafficking, and encourages the Office to \nmaintain an effective level of support for national and regional efforts in countering \nand addressing the world drug problem; \n \n90. Requests the United Nations Office on Drugs and Crime to continue to \ncollaborate with relevant intergovernmental, international and regional organizations \ninvolved in addressing and countering the world drug problem, as appropriate, in \norder to share best practices and scientific standards and to maximize the benefits \nfrom their unique comparative advantage; \n \n91. Also requests the United Nations Office on Drugs and Crime, in close \ncooperation with Member States and pertinent United Nations entities, \nintergovernmental and regional organizations and, when appropriate, the scientific \ncommunity and civil society, to continue to support Member States, upon request, in \nstrengthening their capacity to develop their reporting mechanisms, including by \nidentifying gaps in the current drug statistics and by exploring possibilities to \nstrengthen existing data-collection and analysis tools at the national level; \n \n92. Notes with appreciation the adoption of Commission on Narcotic Drugs \ndecision 63/15 of 4 March 2020 on the improved and streamlined annual report \nquestionnaire,24 and invites Member States to provide extrabudgetary resources for \nthe purposes described in subparagraph (c) of that decision; \n \n93. Recalls Statistical Commission decision 48/110 of 10 March 2017 on \nstatistics on drugs and drug use,25 encourages collaboration between the Statistical \nCommission and the Commission on Narcotic Drugs, within their mandates, to exchange \ninformation on the latest data trends on the world drug problem, stresses the need for \nnational statistical capacity-building to support Member States in improving the quality \nand availability of drug statistics and to respond effectively to data-collection requests \nfrom the United Nations Office on Drugs and Crime, and invites international and \nregional organizations to support Member States in this regard, upon their request; \n \n94. Invites Member States to invest, where necessary and taking into account \nspecific needs and available resources, in capacity-building and quality-enhancing \nactivities for the collection and reporting of information, to participate in joint \ncooperation efforts organized by the United Nations Office on Drugs and Crime and \n__________________ \n \n24  See Official Records of the Economic and Social Council, 2020, Supplement No. 8 (E/2020/28), \nchap. I, sect. B. \n \n25  Ibid., 2017, Supplement No. 4 (E/2017/24), chap. I, sect. C. \n\nInternational cooperation to address \nand counter the world drug problem \nA/RES/75/198\n \n19/22\n20-17359 \n \nby other national, regional or international organizations and bodies, aimed at the \nexchange of technical knowledge of experts in the area of data collection, analysis \nand evaluation and of practical experience in the area of drug data, and to regularly \nreport data and information relating to all aspects of the world drug problem to the \nOffice through the annual report questionnaires, and invites the Commission on \nNarcotic Drugs, as the central policymaking body of the United Nations system on \ndrug-related matters, to strengthen the capacity of the Office to collect, analyse, use \nand disseminate accurate, reliable, objective and comparable data and to reflect such \ninformation in the World Drug Report; \n \n95. Encourages Member States to promote data collection, research and the \nsharing of information, as well as the exchange of best practices on preventing and \ncountering drug-related crime and on drug supply reduction measures and practices, \nin order to enhance the effectiveness of criminal justice responses, within the \nframework of applicable law; \n \n96. Invites Member States to consider the need to review the set of national \ndrug policy metrics and tools for the collection and analysis of accurate, reliable, \ndisaggregated, comprehensive and comparable data to measure the effectiveness of \nprogrammes to address all relevant aspects of the world drug problem, including, as \nappropriate, as related to the 2030 Agenda; \n \n97. Reiterates the commitment of Member States to improve the availability \nand quality of statistical information and analysis of illicit drug cultivation, \nproduction and manufacturing, drug trafficking, money-laundering and illicit \nfinancial flows, including for appropriate reflection in reports of the United Nations \nOffice on Drugs and Crime and the International Narcotics Control Board, in order to \nbetter measure and evaluate the impact of such crimes and to further enhance the \neffectiveness of criminal justice responses in that regard; \n \n98. Encourages the United Nations Office on Drugs and Crime to continue its \nefforts to support States in establishing, upon request, the operational frameworks \nessential for communication within and across national borders and to facilitate the \nexchange of information on and analysis of drug trafficking trends, with a view to \nincreasing knowledge about the world drug problem at the national, regional and \ninternational levels, recognizes the importance of integrating laboratories and \nproviding scientific support to drug control frameworks and of treating quality \nanalytical data as a primary source of information worldwide, and urges coordination \nwith other international entities, including the International Criminal Police \nOrganization (INTERPOL); \n \n99. Requests all Member States to provide the fullest possible financial and \npolitical support to the United Nations Office on Drugs and Crime by widening its \ndonor base, as appropriate, and increasing voluntary contributions, in particular \ngeneral-purpose contributions, so as to enable it to continue, expand, improve and \nstrengthen, within its mandates, its operational and technical cooperation activities, \nincluding with a view to assisting Member States with the full implementation of the \nPolitical Declaration and Plan of Action on International Cooperation towards an \nIntegrated and Balanced Strategy to Counter the World Drug Problem, relevant \nresolutions adopted by the Commission on Narcotic Drugs and the outcome document \nof the thirtieth special session of the General Assembly; \n \n100. Expresses concern regarding the overall financial situation of the United \nNations Office on Drugs and Crime, emphasizes the need to provide the Office with \nadequate, predictable and stable resources and to ensure their cost-effective \nutilization, and requests the Secretary-General to continue to report, within existing \nreporting obligations, on the financial situation of the Office and to continue to ensure \nthat the Office has sufficient resources to carry out its mandates fully and effectively; \n\nA/RES/75/198 \nInternational cooperation to address \nand counter the world drug problem\n \n20-17359\n20/22 \n \n \n101. Encourages Member States and the United Nations Office on Drugs and \nCrime to continue to address the above-mentioned issues within the mandate of the \nstanding open-ended intergovernmental working group on improving the governance \nand financial situation of the Office in order for the Office to fulfil its mandate \neffectively, efficiently and with the appropriate resources; \n \n102. Encourages the Commission on Narcotic Drugs, as the principal \npolicymaking organ of the United Nations on matters of international drug control \nand as the governing body of the drug programme of the United Nations Office on \nDrugs and Crime, and the International Narcotics Control Board to continue to \nstrengthen their work on the control of precursors and other chemicals used in the \nillicit manufacture of narcotic drugs and psychotropic substances; \n \n103. Calls upon Member States to strengthen national and international action \nto address the emerging challenge of new psychoactive substances, including their \nadverse health consequences, and the evolving threat of amphetamine-type \nstimulants, including methamphetamine, underscores the importance of enhancing \ninformation-sharing and early warning networks, developing appropriate national \nlegislative, prevention and treatment models and supporting scientific evidence-based \nreview and scheduling of the most prevalent, persistent and harmful substances, and \nnotes the importance of preventing the diversion and misuse of pharmaceuticals \ncontaining narcotic drugs and psychotropic substances and precursors, while ensuring \ntheir availability for legitimate purposes; \n \n104. Urges States that have not done so to consider ratifying or acceding to, and \nStates parties to implement, as a matter of priority, all the provisions of the Single \nConvention on Narcotic Drugs of 1961 as amended by the 1972 Protocol, the \nConvention on Psychotropic Substances of 1971, the United Nations Convention \nagainst Illicit Traffic in Narcotic Drugs and Psychotropic Substances of 1988, the \nUnited Nations Convention against Transnational Organized Crime and the Protocols \nthereto26 and the United Nations Convention against Corruption; 27 \n \n105. Requests the United Nations Office on Drugs and Crime to continue to provide, \nin close collaboration with the International Narcotics Control Board, as appropriate, \nadequate support and technical assistance to Governments in all regions so as to enable \nthem to implement and fully meet their obligations under conventions and give adequate \nfollow-up to subsequent resolutions of the Commission on Narcotic Drugs, the Economic \nand Social Council and the General Assembly, including for the strengthening of \nregulatory authorities and controls, provision of information and fulfilment of reporting \nrequirements, and urges donors to contribute to the Office for those purposes; \n \n106. Takes note of the resolutions and decisions adopted by the Commission on \nNarcotic Drugs at its sixty-third session and of the World Drug Report 2020; \n \n107. Also takes note of the request of the Human Rights Council to the Working \nGroup on Arbitrary Detention, within its mandate, to prepare a study on arbitrary \ndetention related to drug policies, through its resolution 42/22 of 26 September 2019;28 \n \n108. Calls upon Member States to strengthen international and regional \ncooperation and coordination to counter the threat to the international community \ncaused by the illicit production of and trafficking in drugs, especially those in the \nopioid group, as well as other aspects of the world drug problem, and to continue to \ntake concerted measures within the framework of the Paris Pact 29 and other relevant \n__________________ \n \n26  United Nations, Treaty Series, vols. 2225, 2237, 2241 and 2326, No. 39574. \n \n27  Ibid., vol. 2349, No. 42146. \n \n28  See Official Records of the General Assembly, Seventy-fourth Session, Supplement No. 53A \n(A/74/53/Add.1), chap. III. \n \n29  See S/2003/641, annex. \n\nInternational cooperation to address \nand counter the world drug problem \nA/RES/75/198\n \n21/22\n20-17359 \n \nregional and international initiatives and mechanisms, in order to strengthen cross-\nborder cooperation and information exchange, with a view to countering drug \ntrafficking, with the support of the United Nations Office on Drugs and Crime and \nother international and regional organizations; \n \n109. Urges Member States to continue to actively cooperate with the \nInternational Narcotics Control Board in the exercise of its mandate, and reiterates \nthe need to ensure that an appropriate level of resources is made available to the Board \nto enable it to engage with Governments to effectively monitor compliance by States \nparties with the three international drug control conventions; \n \n110. Encourages the continued contribution of the meetings of heads of \nnational drug law enforcement agencies and of the Subcommission on Illicit Drug \nTraffic and Related Matters in the Near and Middle East of the Commission on \nNarcotic Drugs to the strengthening of regional and international cooperation, and in \nthis regard welcomes the extraordinary sessions of the subsidiary bodies, held in an \nonline format on 1 and 2 October 2020; \n \n111. Welcomes the ongoing efforts to strengthen cooperation in addressing the \nworld drug problem and to seek effectiveness and comprehensiveness in the strategies \nand policies undertaken by regional and subregional organizations and transregional \ninitiatives; \n \n112. Reiterates its call upon the relevant United Nations agencies and entities \nand other international organizations, and invites international financial institutions, \nincluding regional development banks, to mainstream efforts to address and counter \nthe world drug problem into their programmes, and calls upon the United Nations \nOffice on Drugs and Crime to maintain its leading role by providing relevant \ninformation and technical assistance; \n \n113. Calls upon Member States to take the steps necessary to accelerate the \nimplementation of all the joint commitments to address and counter the world drug \nproblem, consistent with the 2019 Ministerial Declaration on Strengthening Our \nActions at the National, Regional and International Levels to Accelerate the \nImplementation of Our Joint Commitments to Address and Counter the World Drug \nProblem, and reiterates its call upon Member States to take the steps necessary to \nfurther implement the operational recommendations set out in the outcome document \nof the thirtieth special session of the General Assembly, in close partnership with the \nUnited Nations and other intergovernmental organizations and civil society, the \nscientific community and academia, and to share with the Commission on Narcotic \nDrugs, as the policymaking body of the United Nations with prime responsibility for \ndrug control matters, timely information on progress made in the implementation of \nthe recommendations and international commitments; \n \n114. Encourages all relevant United Nations bodies and specialized agencies to \nidentify operational recommendations in the outcome document of the thirtieth \nspecial session of the General Assembly that fall within their area of specialization \nand to commence implementing the recommendations made in the outcome document \nthat are within their existing mandates, in collaboration and cooperation with the \nUnited Nations Office on Drugs and Crime and the International Narcotics Control \nBoard, keeping the Commission on Narcotic Drugs informed of programmes and \nprogress made to achieve goals set out in the outcome document, and requests the \nOffice to include, within its existing reporting obligations, a chapter regarding \ncollaboration and coordination across the United Nations system in the global efforts \nto implement the recommendations adopted at the thirtieth special session; \n \n115. Encourages the Commission on Narcotic Drugs and the United Nations \nOffice on Drugs and Crime to further increase cooperation and collaboration with all \nrelevant United Nations entities and international financial institutions, within their \n\nA/RES/75/198 \nInternational cooperation to address \nand counter the world drug problem\n \n20-17359\n22/22 \n \nrespective mandates, when assisting Member States in designing and implementing \ncomprehensive, integrated and balanced national drug strategies, policies and \nprogrammes; \n \n116. Invites the United Nations Office on Drugs and Crime to increase efforts \nto pursue joint initiatives at the policy and programmatic levels with other relevant \nUnited Nations agencies and entities, within their existing mandates, as well as \nregional organizations, and to update and report to the Commission on Narcotic Drugs \non progress, including on joint initiatives, at its upcoming sessions; \n \n117. Welcomes the follow-up to the implementation of all commitments to \naddress and counter the world drug problem made since 2009, including the \nrecommendations set out in the outcome document of the thirtieth special session of \nthe General Assembly, through the intersessional process of the Commission on \nNarcotic Drugs, encourages the Commission to continue to work on and support \nMember States in their implementation and sharing of scientific and evidence-based \nbest practices in addressing and countering the world drug problem, and invites the \nCommission to continue to examine how its subsidiary bodies can better contribute \nto the implementation of, inter alia, the outcome document by ensuring that the \nCommission is informed of regional and domestic concerns, developments and best \npractices arising from all stakeholders, including contributions from the scientific \ncommunity, academia and civil society; \n \n118. Encourages the Commission on Narcotic Drugs to keep the General \nAssembly informed of developments in the follow-up to the 2019 Ministerial \nDeclaration on Strengthening Our Actions At The National, Regional And \nInternational Levels To Accelerate The Implementation Of Our Joint Commitments \nTo Address And Counter The World Drug Problem, and welcomes the briefings and \nupdates provided by the Commission to Member States and all relevant stakeholders; \n \n119. Calls upon all Member States to actively participate in the discussions of \nthe Commission on Narcotic Drugs in preparation for its sixty-fourth session in 2021 \nto foster an in-depth exchange of information and expertise on efforts, achievements, \nchallenges and best practices to address and counter the world drug problem, \nincluding the challenges posed by the COVID-19 pandemic, and encourages all other \nrelevant stakeholders to make contributions in this regard; \n \n120. Takes note of the report of the Secretary-General,30 and requests that he \nsubmit to the General Assembly at its seventy-sixth session a report on the \nimplementation of the present resolution. \n \n46th plenary meeting \n16 December 2020 \n \n__________________ \n \n30  A/75/99. \n",
  "paragraphs": {
    "1": "Reaffirms the 2019 Ministerial Declaration on Strengthening Our Actions at the National, Regional and International Levels to Accelerate the Implementation of Our Joint Commitments to Address and Counter the World Drug Problem, and emphasizes that the 2009 Political Declaration and Plan of Action on International Cooperation towards an Integrated and Balanced Strategy to Counter the World Drug Problem, the Joint Ministerial Statement of the 2014 high-level review by the Commission on Narcotic Drugs of the implementation by Member States of the Political Declaration and Plan of Action and the outcome document of the thirtieth special session of the General Assembly, entitled \u201cOur joint commitment to effectively addressing and countering the world drug problem\u201d, represent the commitments made by the international community over the preceding decade to A/RES/75/198 International cooperation to address and counter the world drug problem 20-17359 6/22 counter the world drug problem and address, in a balanced manner, all aspects of demand reduction and related measures, supply reduction and related measures, and international cooperation identified in the 2009 Political Declaration, as well as additional issues elaborated upon and identified in the outcome document of the thirtieth special session of the Assembly, held in 2016, and recognizes that those documents are complementary and mutually reinforcing;",
    "2": "Recalls the thirtieth special session of the General Assembly, held at United Nations Headquarters from 19 to 21 April 2016, at which the Assembly reviewed the progress in the implementation of the Political Declaration and Plan of Action on International Cooperation towards an Integrated and Balanced Strategy to Counter the World Drug Problem, including an assessment of the achievements and challenges in countering the world drug problem, within the framework of the three international drug control conventions and other relevant United Nations instruments, takes note of the discussions held during the session, and reaffirms in its entirety the outcome document entitled \u201cOur joint commitment to effectively addressing and countering the world drug problem\u201d;",
    "3": "Reaffirms the shared commitment to effectively addressing and countering the world drug problem, which requires concerted and sustained action at the national and international levels, including accelerating the implementation of existing drug policy commitments;",
    "4": "Reiterates its call upon Member States to take, in a timely manner, the measures necessary to implement the actions and attain the goals and targets set out in the Political Declaration and Plan of Action on International Cooperation towards an Integrated and Balanced Strategy to Counter the World Drug Problem, adopted by the General Assembly at its sixty-fourth session, and to address the general challenges and priorities for action identified in the Joint Ministerial Statement of the 2014 high- level review by the Commission on Narcotic Drugs of the implementation by Member States of the Political Declaration and Plan of Action;",
    "5": "Reaffirms that addressing and countering the world drug problem is a common and shared responsibility that must be addressed in a multilateral setting, that it requires an integrated and balanced approach and that it must be carried out in full conformity with the purposes and principles of the Charter of the United Nations and other provisions of international law, the Universal Declaration of Human Rights and the Vienna Declaration and Programme of Action 14 on human rights and, in particular, with full respect for the sovereignty and territorial integrity of States, for the principle of non-intervention in the internal affairs of States and for all human rights and fundamental freedoms, and on the basis of the principles of equal rights and mutual respect;",
    "6": "Reiterates that the efforts to achieve the Sustainable Development Goals and to effectively address and counter the world drug problem are complementary and mutually reinforcing, recognizes the role of the Commission on Narcotic Drugs in contributing to the global follow-up and in supporting the thematic review of progress on the Goals related to its mandate, and in this regard encourages the Commission to continue to provide input to the high-level political forum on sustainable development, including by providing relevant data, as the implementation of the recommendations contained in the outcome document of the thirtieth special session of the General Assembly may contribute to the attainment of the related Goals; __________________ 14 A/CONF.157/24 (Part I), chap. III. International cooperation to address and counter the world drug problem A/RES/75/198 7/22 20-17359",
    "7": "Calls upon Member States to engage in effective cooperation and practical action aimed at addressing and countering the world drug problem on the basis of the principle of common and shared responsibility;",
    "8": "Encourages Member States to enhance North-South, South-South and triangular cooperation, in cooperation with the international development community and other key stakeholders, in order to effectively address and counter the world drug problem;",
    "9": "Reiterates its commitment to promoting the health, welfare and well-being of all individuals, families, communities and society as a whole and to facilitating healthy lifestyles through effective, comprehensive, scientific evidence-based demand reduction initiatives at all levels, covering, in accordance with national legislation and the three international drug control conventions, prevention, early intervention, treatment, care, recovery, rehabilitation and social reintegration measures, as well as initiatives and measures aimed at minimizing the adverse public health and social consequences of drug abuse;",
    "10": "Also reiterates its commitment to protect the safety and assure the security of individuals, societies and communities by intensifying efforts to prevent and counter the illicit cultivation, production and manufacture of and trafficking in narcotic drugs and psychotropic substances, as well as drug-related crime and violence, through, inter alia, more effective drug-related crime prevention and law enforcement measures, as well as by addressing links with other forms of organized crime, including money-laundering, corruption and other criminal activities, mindful of their social and economic causes and consequences;",
    "11": "Underlines the need for Member States to cooperate closely with the United Nations Office on Drugs and Crime, the World Health Organization, the International Narcotics Control Board and other international and regional organizations, as well as the scientific community, including academia, in contributing to the scientific assessment of drug demand and supply reduction policies, drug markets and drug-related crime;",
    "12": "Recognizes that transit States continue to face multifaceted challenges, and reaffirms the continuing need for cooperation and support, including the provision of technical assistance, to, inter alia, enhance their capacities to effectively address and counter the world drug problem, in conformity with the United Nations Convention against Illicit Traffic in Narcotic Drugs and Psychotropic Substances of 1988;",
    "13": "Urges Member States to address the relevant socioeconomic factors that relate to the world drug problem through a comprehensive, integrated and balanced approach that incorporates drug policies into a broader socioeconomic development agenda, in compliance with the three international drug control conventions;",
    "14": "Invites Member States to consider strengthening a development perspective as part of comprehensive, integrated and balanced national drug policies and programmes so as to tackle the related causes and consequences of the illicit cultivation, manufacture and production of and trafficking in drugs by, inter alia, addressing risk factors affecting individuals, communities and society, which may include a lack of services, infrastructure needs, drug-related violence, exclusion, marginalization and social disintegration, in order to contribute to the promotion of peaceful and inclusive societies;",
    "15": "Encourages the development of viable economic alternatives, particularly for communities affected by or at risk of illicit cultivation of drug crops and other illicit drug-related activities in urban and rural areas, including through comprehensive alternative development programmes, and to this end encourages Member States to consider development-oriented interventions, while ensuring that A/RES/75/198 International cooperation to address and counter the world drug problem 20-17359 8/22 both men and women benefit equally from them, including through job opportunities, improved infrastructure and basic public services and, as appropriate, access and legal titles to land for farmers and local communities, which will also contribute to preventing, reducing or eliminating illicit cultivation and other drug-related activities;",
    "16": "Emphasizes the need to strengthen, including through the Commission on Narcotic Drugs and, as appropriate, its subsidiary bodies, the regular exchange of information, good practices and lessons learned among national practitioners from different fields and at all levels to effectively implement an integrated and balanced approach to the world drug problem and its various aspects and the need to consider additional measures to further facilitate meaningful discussion among those practitioners;",
    "17": "Reiterates its call to mainstream a gender perspective into and ensure the full and effective participation of women in all stages of the development, implementation, monitoring and evaluation of drug policies and programmes, to develop and disseminate gender-sensitive and age-appropriate measures that take into account the specific needs and circumstances faced by women and girls with regard to the world drug problem and, as States parties, implement the Convention on the Elimination of All Forms of Discrimination against Women;15",
    "18": "Requests the United Nations Office on Drugs and Crime to continue to support Member States, upon request, in mainstreaming a gender perspective into their policies and programmes related to the world drug problem, and invites the United Nations Entity for Gender Equality and the Empowerment of Women (UN-Women) and other relevant United Nations entities, within their mandates, to cooperate with the Office in this regard;",
    "19": "Urges Member States to increase the availability, coverage and quality of scientific evidence-based prevention measures and tools that target relevant age and risk groups in multiple settings, reaching youth in school as well as out of school, among others, through drug abuse prevention programmes and public awareness-raising campaigns, including by using the Internet, social media and other online platforms, to develop and implement prevention curricula and early intervention programmes for use in the education system at all levels, as well as in vocational training, including in the workplace, and to enhance the capacity of teachers and other relevant professionals to provide or recommend counselling, prevention and care services;",
    "20": "Encourages Member States to identify and take advantage of opportunities to conduct collaborative research and continuously share the latest scientific research, taking into account the contributions of the national, regional and international scientific community, including academia, on the most effective demand and supply reduction strategies, and to develop improved best practices on interventions to reduce demand for drugs, in accordance with the three international drug control conventions and other drug policy commitments;",
    "21": "Invites Member States to consider enhancing cooperation among public health, education and law enforcement authorities when developing prevention initiatives;",
    "22": "Urges Member States, as part of their comprehensive drug demand reduction measures at the national level, to strengthen efforts, as appropriate, to prevent drug abuse in educational settings, in both the public and private sectors, including by providing children and youth with information regarding drug abuse and its harmful effects and consequences as well as drug use prevention, counselling and __________________ 15 United Nations, Treaty Series, vol. 1249, No. 20378. International cooperation to address and counter the world drug problem A/RES/75/198 9/22 20-17359 skills, resilience and opportunities to choose healthy lifestyles, and to promote safe and drug-free environments in educational settings;",
    "23": "Invites Member States to promote and improve the systematic collection of information and gathering of evidence as well as the sharing, at the national and international levels, of reliable and comparable data on drug use and epidemiology, including on social, economic and other risk factors, to promote, as appropriate, through the Commission on Narcotic Drugs and the World Health Assembly, the use of internationally recognized standards, such as the International Standards on Drug Use Prevention, and the exchange of best practices, and to formulate effective drug use prevention strategies and programmes in cooperation with the United Nations Office on Drugs and Crime, the World Health Organization and other relevant United Nations entities;",
    "24": "Encourages Member States, in their promotion and improvement of the systematic collection of information and gathering of evidence, to gather scientific data on any damage to health that may be caused by consuming drugs in vaporized form, and to take appropriate steps to exchange best practices and formulate effective drug use prevention strategies and programmes, with a particular focus on children and youth;",
    "25": "Invites Member States to provide the United Nations Office on Drugs and Crime with information on best practices and programmes recently implemented, consistent with the three international drug control conventions, in order to assess recent developments and current and future challenges;",
    "26": "Recognizes drug dependence as a complex, multifactorial health disorder characterized by a chronic and relapsing nature, with social causes and consequences, that can be prevented and treated through, inter alia, effective scientific evidence- based drug treatment, care and rehabilitation programmes, including community- based programmes, and also recognizes the need to strengthen capacity for aftercare for and the rehabilitation, recovery and social reintegration of individuals with substance use disorders, including, as appropriate, through assistance for effective reintegration into the labour market and other support services;",
    "27": "Encourages Member States to promote the prevention and treatment of drug use disorders, using scientific evidence-based practices, such as those outlined in the International Standards for the Treatment of Drug Use Disorders, that reflect respect for human rights and dignity, including the right to enjoy the highest attainable standard of physical and mental health and well-being, promoting, as appropriate, within national and regional contexts, non-stigmatizing attitudes in the development and implementation of scientific evidence-based policies;",
    "28": "Also encourages Member States to promote the inclusion in national drug policies, in accordance with national legislation and as appropriate, of elements for the prevention and treatment of drug overdose, in particular opioid overdose, including the use of opioid receptor antagonists, such as naloxone, to reduce drug-related mortality;",
    "29": "Invites Member States to promote cooperation with and technical assistance to the States most affected by the world drug problem in developing and implementing comprehensive and integrated policies to address, where appropriate, the impact of illicit drug trafficking on increasing drug use in such States, including by reinforcing national programmes aimed at prevention, early intervention, treatment, care, rehabilitation and social reintegration;",
    "30": "Encourages the United Nations Office on Drugs and Crime and the International Narcotics Control Board to continue to strengthen cooperation with the World Health Organization and other competent United Nations entities, within their respective mandates, as part of a comprehensive, integrated and balanced approach to strengthening health and social welfare measures in addressing the world drug A/RES/75/198 International cooperation to address and counter the world drug problem 20-17359 10/22 problem, including through effective prevention, early intervention, treatment, care, recovery, rehabilitation and social reintegration, in cooperation, as appropriate, with civil society and the scientific community, and to keep the Commission on Narcotic Drugs appropriately updated;",
    "31": "Recalls the signing of the memorandum of understanding between the United Nations Office on Drugs and Crime and the World Health Organization in February 2017, which will continue to facilitate increased collaboration and coordination between these two entities, within their mandates, in advancing efforts to address and counter the world drug problem, and encourages the Office to continue to strengthen its collaboration with the World Health Organization and to explore, as appropriate, cooperation arrangements with other relevant United Nations agencies and entities and to keep the Commission on Narcotic Drugs appropriately updated;",
    "32": "Encourages the United Nations Office on Drugs and Crime and the World Health Organization to continue their collaboration to address and counter the world drug problem in accordance with their relevant mandates, and takes note of the input of the World Health Organization, within its treaty-based mandate, in addressing and countering the world drug problem from a public health dimension;",
    "33": "Encourages Member States to involve, as appropriate, policymakers, parliamentarians, educators, civil society, the scientific community, academia, target populations, individuals in recovery from substance use disorders and their peer groups, families and other co-dependent people, as well as the private sector, in the development of prevention programmes aimed at raising public awareness of the dangers and risks associated with drug abuse, and involve, inter alia, parents, care services providers, teachers, peer groups, health professionals, religious communities, community leaders, social workers, sports associations, media professionals and entertainment industries, as appropriate, in their implementation;",
    "34": "Also encourages Member States to consider alternatives to incarceration, conviction and punishment, where appropriate and in accordance with the three international drug control conventions, noting that, in appropriate cases of a minor nature, States may provide, as alternatives to conviction or punishment, measures such as education, rehabilitation or social reintegration, as well as, when the offender has a drug use disorder, treatment and aftercare, as well as support for recovery;",
    "35": "Encourages the development, adoption and implementation, with due regard for national, constitutional, legal and administrative systems, of alternative or additional measures with regard to conviction or punishment in cases of an appropriate nature, in accordance with the three international drug control conventions and taking into account, as appropriate, relevant United Nations standards and norms in crime prevention and criminal justice, such as the United Nations Standard Minimum Rules for Non-custodial Measures (the Tokyo Rules);16",
    "36": "Also encourages the consideration of the specific needs and possible multiple vulnerabilities of women drug offenders when imprisoned, in line with the United Nations Rules for the Treatment of Women Prisoners and Non-custodial Measures for Women Offenders (the Bangkok Rules);17",
    "37": "Invites Member States to consider reviewing their drug sentencing policies and practices in order to facilitate collaboration between justice, education and public health authorities in the development and implementation of initiatives that utilize alternative measures to conviction or punishment for appropriate drug-related offences of a minor nature, subject to the legal frameworks of Member States; __________________ 16 Resolution 45/110, annex. 17 Resolution 65/229, annex. International cooperation to address and counter the world drug problem A/RES/75/198 11/22 20-17359",
    "38": "Emphasizes the need to enhance the knowledge of policymakers and the capacity, as appropriate, of relevant national authorities on various aspects of the world drug problem in order to ensure that national drug policies, as part of a comprehensive, integrated and balanced approach, fully respect all human rights and fundamental freedoms and protect the health, safety and well-being of individuals, families, vulnerable members of society, communities and society as a whole, and to that end encourages the cooperation of Member States with, and cooperation among, the United Nations Office on Drugs and Crime, the International Narcotics Control Board, the World Health Organization and other relevant United Nations entities, within their respective mandates, including those relevant to the above-mentioned issues, and relevant regional and international organizations, as well as with civil society and the private sector, as appropriate;",
    "39": "Urges Member States to ensure non-discriminatory access to health, care and social services in prevention, primary care and treatment programmes, including those offered to persons in prison or pretrial detention, which are to be on a level equal to those available in the community, and to ensure that women, including detained women, have access to adequate health services and counselling, including those particularly needed during pregnancy;",
    "40": "Encourages Member States to promote effective supervision of drug treatment and rehabilitation facilities by competent domestic authorities so as to ensure adequate quality of drug treatment and rehabilitation services, promote non-stigmatizing attitudes and prevent any possible acts of cruel, inhuman or degrading treatment or punishment, in accordance with domestic legislation and applicable international law;",
    "41": "Calls upon Member States to enhance access to treatment for drug use disorders for those who are incarcerated and promote effective oversight and encourage, as appropriate, self-assessments of confinement facilities, taking into consideration the United Nations standards and norms in crime prevention and criminal justice, including the United Nations Standard Minimum Rules for the Treatment of Prisoners (the Nelson Mandela Rules),18 implement, where appropriate, measures aimed at addressing and eliminating prison overcrowding and violence, and provide capacity-building to relevant national authorities;",
    "42": "Encourages Member States to promote proportionate national sentencing policies, practices and guidelines for drug-related offences, whereby the severity of penalties is proportionate to the gravity of offences and both mitigating and aggravating factors are taken into account, including the circumstances enumerated in article 3 of the 1988 Convention and other relevant and applicable international law, and in accordance with national legislation;",
    "43": "Calls for the promotion of bilateral, regional and international cooperation, including through intelligence-sharing and cross-border cooperation, aimed at addressing and countering the world drug problem more effectively, in particular by encouraging and supporting such cooperation by those States most directly affected by illicit crop cultivation and the illicit production, manufacture, transit, trafficking, distribution and abuse of narcotic drugs and psychotropic substances;",
    "44": "Encourages Member States to develop and implement, as appropriate, comprehensive policies and programmes that, by fostering social and sustainable development, are aimed at the prevention of crime and violence and that address the multiple factors that contribute to marginalization, crime and victimization, in close __________________ 18 Resolution 70/175, annex. A/RES/75/198 International cooperation to address and counter the world drug problem 20-17359 12/22 cooperation with relevant stakeholders, including civil society, and based on scientific evidence and taking into account good practices;",
    "45": "Reaffirms the need for Member States to review and, if necessary, strengthen coordinated measures, enhance capacity-building to counter money- laundering arising from drug trafficking and improve legal cooperation, including judicial cooperation, where appropriate, at the national, regional and international levels, to dismantle organized criminal groups involved in drug trafficking, in order to provide for the prevention, detection, investigation and prosecution of the perpetrators of such crimes, including cooperation to the fullest extent possible to suppress illicit traffic by sea in conformity with the international law of the sea;",
    "46": "Underlines the need to strengthen regional, subregional and international cooperation in criminal matters, as appropriate, including judicial cooperation in the areas of, inter alia, extradition, mutual legal assistance and transfer of proceedings, in accordance with the three international drug control conventions and other international legal instruments and national legislation, and to strive to provide appropriate resources to national competent authorities, including through the provision of targeted technical assistance to requesting countries;",
    "47": "Reaffirms the importance of an integrated approach in drug policies, including by strengthening partnerships between the public health, development, human rights, justice and law enforcement fields and by facilitating inter-agency cooperation and communication, where appropriate;",
    "48": "Encourages the promotion, where appropriate, in the framework of international cooperation, of the use of law enforcement techniques, consistent with national legislation and international law, including applicable human rights obligations, in order to ensure that drug traffickers are brought to justice and that major criminal organizations are disrupted and dismantled;",
    "49": "Reiterates the strong commitment of Member States to improving access to controlled substances for medical and scientific purposes by appropriately addressing existing barriers in this regard, including those related to legislation, regulatory systems, health-care systems, affordability, the training of health-care professionals, education, awareness-raising, estimates, assessment and reporting, benchmarks for consumption of substances under control and international cooperation and coordination, while concurrently preventing the diversion and abuse of and trafficking in such substances;",
    "50": "Recognizes the effectiveness of law enforcement measures against organized criminal groups and individuals involved in drug-related crimes, and the need to place appropriate focus within the respective jurisdictions of Member States on those responsible for illicit activities of a larger scale or more serious nature;",
    "51": "Recalls the Political Declaration on HIV and AIDS: On the Fast Track to Accelerating the Fight against HIV and to Ending the AIDS Epidemic by 2030, adopted by the General Assembly on 8 June 2016;19",
    "52": "Invites relevant national authorities to consider, in accordance with their national legislation and the three international drug control conventions, including in national prevention, treatment, care, recovery, rehabilitation and social reintegration measures and programmes, in the context of comprehensive and balanced drug demand reduction efforts, effective measures aimed at minimizing the adverse public health and social consequences of drug abuse, including appropriate medication- assisted therapy programmes, injecting equipment programmes as well as antiretroviral therapy and other relevant interventions that prevent the transmission __________________ 19 Resolution 70/266, annex. International cooperation to address and counter the world drug problem A/RES/75/198 13/22 20-17359 of HIV, viral hepatitis and other blood-borne diseases associated with drug use, and to consider ensuring access to such interventions, including in treatment and outreach services, prisons and other custodial settings, and promoting in that regard the use, as appropriate, of the technical guide for countries to set targets for universal access to HIV prevention, treatment and care for injecting drug users, issued by the World Health Organization, the United Nations Office on Drugs and Crime and the Joint United Nations Programme on HIV/AIDS;",
    "53": "Urges Member States and other donors to continue to provide bilateral and other funding for the global drug problem response, including in particular the HIV/AIDS response, including to the Joint United Nations Programme on HIV/AIDS, and to strive to ensure that such funding contributes to addressing the growing HIV/AIDS epidemic among people who inject drugs, and HIV/AIDS in prison settings, in the spirit of the pledge made in the 2030 Agenda for Sustainable Development to leave no one behind;",
    "54": "Acknowledges the continuing efforts made and the progress achieved in countering the world drug problem, and stresses the need to strengthen and intensify joint efforts at the national, regional and international levels to tackle the global challenges related to the world drug problem in a more comprehensive manner, in accordance with the principle of common and shared responsibility, including by means of enhanced and better-coordinated technical and financial assistance;",
    "55": "Takes note of the 2019 report of the International Narcotics Control Board20 and the supplementary reports thereto, and in this regard reaffirms Commission on Narcotic Drugs resolution 62/8 of 22 March 2019 on supporting the International Narcotics Control Board in fulfilling its treaty-mandated functions in cooperation with Member States and in collaboration with the Commission on Narcotic Drugs and the World Health Organization;21",
    "56": "Invites Member States to strengthen, as appropriate, the proper functioning of national drug control systems and domestic assessment mechanisms and programmes, in cooperation with the International Narcotics Control Board, the United Nations Office on Drugs and Crime, the World Health Organization and other relevant United Nations system agencies, to identify, analyse and remove impediments to the availability and accessibility of controlled substances for medical and scientific purposes, within appropriate control mechanisms, as required by the three international drug control conventions and taking into account the publication entitled Ensuring Balance in National Policies on Controlled Substances: Guidance for Availability and Accessibility of Controlled Medicines, and, for that purpose, to consider the provision of technical and financial assistance, upon request, to developing countries;",
    "57": "Urges all Member States to enact comprehensive measures aimed at stemming the abuse, diversion and misuse of prescription drugs, in particular through the establishment of awareness-raising initiatives targeting the general public and health-care providers;",
    "58": "Recognizes that it is necessary for Member States, under the three international drug control conventions and the fundamental principles of their domestic legal systems and national legislation, to consider, where appropriate: (a) Regularly reviewing and assessing their drug control policies, ensuring that they are effective, comprehensive, balanced and aimed at promoting the health and well-being of individuals, families, communities and society as a whole; __________________ 20 International Narcotics Control Board, document E/INCB/2019/1. 21 See Official Records of the Economic and Social Council, 2019, Supplement No. 8 (E/2019/28), chap. I, sect. B. A/RES/75/198 International cooperation to address and counter the world drug problem 20-17359 14/22 (b) Providing, as appropriate, comprehensive, integrated drug demand reduction programmes, based on scientific evidence and covering a range of measures, including primary prevention, early intervention, treatment, care, rehabilitation, social reintegration and measures aimed at minimizing the negative public health and social impact of drug abuse, aimed at promoting health and social well-being among individuals, families and communities and reducing the adverse consequences of drug abuse for individuals and society as a whole;",
    "59": "Also recognizes the continued efforts to promote coordination and cooperation on drug-related matters within the United Nations system;",
    "60": "Calls upon the United Nations Office on Drugs and Crime, the Commission on Narcotic Drugs, the International Narcotics Control Board, the World Health Organization and other United Nations entities with pertinent technical and operational expertise, within their mandates, to continue to provide, upon request, advice and assistance to States that are reviewing and updating their drug policies, in compliance with the three international drug control conventions, taking into account their national priorities and needs through, among other things, the promotion of the exchange of information and best practices on scientific evidence-based policies adopted by States;",
    "61": "Calls upon Member States to promote and strengthen the exchange of information and, as appropriate, drug-related criminal intelligence among law enforcement and border control agencies, including through the United Nations Office on Drugs and Crime multilateral portals and regional information centres and networks, and to promote joint investigations and coordinate operations, in conformity with national legislation, and training programmes at all levels, in order to identify, disrupt and dismantle organized criminal groups operating transnationally that are involved in any activities related to the illicit production of and trafficking in narcotic drugs and psychotropic substances and the diversion of their precursors and related money-laundering;",
    "62": "Reiterates the commitment of Member States to share relevant information with, as appropriate, and strengthen the capacity of the World Health Organization, the United Nations Office on Drugs and Crime, the International Narcotics Control Board and other relevant international and regional organizations to prioritize the review of the most prevalent, persistent and harmful new psychoactive substances and to facilitate informed scheduling decisions by the Commission on Narcotic Drugs;",
    "63": "Encourages Member States to fully support the efforts of the World Health Organization to review substances, within its mandate under the three international drug control conventions, particularly through its Expert Committee on Drug Dependence;",
    "64": "Also encourages Member States to enhance the capacity of law enforcement agencies to detect and identify new psychoactive substances and amphetamine-type stimulants, including methamphetamine, and promote cross- border cooperation and information-sharing to prevent their abuse and diversion, including through the use of existing International Narcotics Control Board and United Nations Office on Drugs and Crime tools and projects;",
    "65": "Further encourages Member States to establish and strengthen partnerships and information exchange with industries, in particular with chemical and pharmaceutical industries and other relevant private sector entities, and encourage the use of the Guidelines for a Voluntary Code of Practice for the Chemical Industry, issued by the International Narcotics Control Board, and the Board\u2019s model memorandum of understanding between Governments and private sector partners, as and where appropriate, bearing in mind the important role that these industries can play in addressing and countering the world drug problem; International cooperation to address and counter the world drug problem A/RES/75/198 15/22 20-17359",
    "66": "Calls upon Member States to commit themselves to implementing timely, scientific evidence-based control or regulatory measures within national legislative and administrative systems to tackle and manage the challenge of new psychoactive substances, and to consider the use of interim steps while substances are under review, such as provisional measures of control, or to make public health announcements, as well as share information and expertise on those measures;",
    "67": "Invites Member States to support existing research, collection and scientific analysis of data related to amphetamine-type stimulants through the global Synthetics Monitoring: Analysis, Reporting and Trends (SMART) programme and relevant International Narcotics Control Board tools, such as Project Prism, and strengthen cooperation at all levels in tackling synthetic opioids and amphetamine- type stimulants, including methamphetamine;",
    "68": "Also invites Member States to promote the use, as appropriate, of relevant existing programmes, mechanisms and coordinated operations at all levels and continue the development and sharing of best practices and lessons learned among practitioners with regard to a balanced and integrated approach to the evolving threat of amphetamine-type stimulants;",
    "69": "Calls upon Member States to continue efforts to identify and monitor trends in the composition, production, prevalence and distribution of new psychoactive substances, as well as patterns of use and adverse consequences, and assess the risks to the health and safety of individuals and society as a whole and the potential uses of new psychoactive substances for medical and scientific purposes, and on that basis to develop and strengthen domestic and national legislative, regulatory, administrative and operational responses and practices by domestic and national legislative, law enforcement, judiciary, social and welfare, educational and health authorities;",
    "70": "Invites Member States to target the illicit cultivation of crops used for the illicit production and manufacture of drugs and address related factors by implementing comprehensive strategies aimed at alleviating poverty and strengthening the rule of law, accountable, effective and inclusive institutions and public services and institutional frameworks, as appropriate, and by promoting sustainable development aimed at enhancing the welfare of the affected and vulnerable population through licit alternatives;",
    "71": "Encourages the promotion of inclusive economic growth and support for initiatives that contribute to poverty eradication and the sustainability of social and economic development, and encourages Member States to develop measures for rural development, improving infrastructure and social inclusion and protection, addressing the consequences of illicit crop cultivation and the manufacture and production of narcotic drugs and psychotropic substances on the environment, with the incorporation and participation of local communities, and to consider taking voluntary measures to promote products stemming from alternative development, including preventive alternative development, as appropriate, to gain access to markets, consistent with applicable multilateral trade rules and with national and international law, within the framework of comprehensive and balanced drug control strategies;",
    "72": "Expresses concern that the illicit cultivation of crops and illicit manufacture, distribution and trafficking remain serious challenges in addressing and countering the world drug problem, and recognizes the need for strengthening sustainable crop control strategies that may include, inter alia, alternative development, eradication and law enforcement measures, for the purpose of preventing and significantly and measurably reducing the illicit cultivation of crops, and the need to intensify joint efforts at the national, regional and international levels in a more comprehensive manner, in accordance with the principle of common and shared responsibility, including by means of appropriate preventive tools and A/RES/75/198 International cooperation to address and counter the world drug problem 20-17359 16/22 measures, enhanced and better-coordinated financial and technical assistance and action-oriented programmes, in order to tackle those challenges;",
    "73": "Invites Member States to consider elaborating and implementing comprehensive and sustainable alternative development programmes, including preventive alternative development, as appropriate, that support sustainable crop control strategies to prevent and significantly, durably and measurably reduce illicit crop cultivation and other illicit drug-related activities, ensuring the empowerment, ownership and responsibility of affected local communities, including farmers and their cooperatives, by taking into account the vulnerabilities and specific needs of communities affected by or at risk of illicit cultivation, in cooperation with the United Nations Office on Drugs and Crime, the Food and Agriculture Organization of the United Nations, the International Labour Organization, the United Nations Development Programme and other relevant international organizations, bearing in mind national and regional development policies and action plans, with a view to contributing to the building of peaceful, inclusive and just societies, consistent with the Sustainable Development Goals and in compliance with relevant and applicable international and national law;",
    "74": "Also invites Member States to strengthen subregional, regional and international cooperation to support comprehensive and sustainable alternative development programmes, including, as appropriate, preventive alternative development, as an essential part of successful prevention and crop control strategies to increase the positive outcome of such programmes, especially in the areas affected by and at risk of illicit cultivation of crops used for the production of narcotic drugs and psychotropic substances, taking into account the United Nations Guiding Principles on Alternative Development;22",
    "75": "Urges relevant international financial institutions, United Nations entities, non-governmental organizations and the private sector, as appropriate, to consider increasing their support, including through long-term and flexible funding, for the implementation of comprehensive and balanced development-oriented drug control programmes and viable economic alternatives, in particular alternative development, including, as appropriate, preventive alternative development programmes, based on identified needs and national priorities, for areas and populations affected by or vulnerable to the illicit cultivation of drug crops, with a view to its prevention, reduction and elimination, and encourages States to the extent possible to stay strongly committed to financing such programmes;",
    "76": "Urges Member States to promote partnerships and innovative cooperation initiatives with the private sector, civil society and international financial institutions to create conditions more conducive to productive investments targeted at job creation in areas and among communities affected by or at risk of illicit drug cultivation, production, manufacturing, trafficking and other illicit drug-related activities in order to prevent, reduce or eliminate them, and share best practices, lessons learned, expertise and skills in this regard;",
    "77": "Encourages Member States to ensure that measures to prevent the illicit cultivation of and to eradicate plants containing narcotic and psychotropic substances respect fundamental human rights, take due account of traditional licit uses, where there is historical evidence of such use, and of the protection of the environment, in accordance with the three international drug control conventions, and also take into account, as appropriate and in accordance with national legislation, the United Nations Declaration on the Rights of Indigenous Peoples; 23 __________________ 22 Resolution 68/196, annex. 23 Resolution 61/295, annex. International cooperation to address and counter the world drug problem A/RES/75/198 17/22 20-17359",
    "78": "Reiterates its commitment to strengthen regional and international cooperation to support sustainable alternative development programmes, including, as appropriate, preventive alternative development, in close collaboration with all relevant stakeholders at the local, national and international levels, and to develop and share best practices towards implementing the United Nations Guiding Principles on Alternative Development, taking into account all the lessons learned and good practices, in particular by countries with extensive expertise in alternative development;",
    "79": "Welcomes its resolution 72/197 of 19 December 2017, entitled \u201cPromoting the implementation of the United Nations Guiding Principles on Alternative Development and related commitments on alternative development and regional, interregional and international cooperation on development-oriented, balanced drug control policy addressing socioeconomic issues\u201d;",
    "80": "Urges Member States to increase cooperation at all levels and enhance measures to prevent and significantly and measurably reduce or eliminate the illicit cultivation of opium poppy, coca bush and cannabis plant used for the production of narcotic drugs and psychotropic substances, including through eradication, within the framework of sustainable crop control strategies and measures;",
    "81": "Reiterates its commitment to strengthen specialized, targeted, effective and sustainable technical assistance, including, where appropriate, adequate financial assistance, training, capacity-building, equipment and technological know-how, to requesting countries, including transit countries, through and in cooperation with the United Nations Office on Drugs and Crime, as well as the World Health Organization and other relevant United Nations entities and international and regional organizations, within their respective mandates, so as to help Member States to effectively address the health, socioeconomic, human rights, justice and law enforcement aspects of the world drug problem;",
    "82": "Encourages Member States to fully implement international commitments on the promotion of the rule of law at the national and international levels, health and respect for human rights in their drug policies;",
    "83": "Calls upon Member States to respond to the serious challenges posed by the increasing links between drug trafficking, corruption and other forms of organized crime, including trafficking in persons, trafficking in firearms, cybercrime and money-laundering, and, in some cases, terrorism, including money-laundering in connection with the financing of terrorism, by using an integrated, multidisciplinary approach, such as through promoting and supporting reliable data collection, research and, as appropriate, intelligence- and analysis-sharing to ensure effective policymaking and interventions;",
    "84": "Invites Member States to strengthen and utilize existing and relevant regional and, as appropriate, subregional and international networks for the exchange of operational information to prevent and counter money-laundering, illicit financial flows and terrorist financing;",
    "85": "Encourages Member States to enhance national, regional, subregional, interregional and international capacity to prevent and counter money-laundering and illicit financial flows stemming from drug trafficking and related crimes, including, as appropriate, through the detection, investigation and prosecution of such activities, with a view to effectively addressing safe havens, and to identify and mitigate money- laundering risks linked to new technologies, as well as emerging money-laundering methods and techniques, by using, inter alia, existing United Nations Office on Drugs and Crime technical assistance tools;",
    "86": "Also encourages Member States to strengthen coordinated border management strategies, as well as the capacity of border control and law enforcement A/RES/75/198 International cooperation to address and counter the world drug problem 20-17359 18/22 and prosecutorial agencies, including through technical assistance, upon request, including, and where appropriate, the provision of equipment and technology, along with necessary training and maintenance support, in order to prevent, monitor and counter trafficking in drugs, trafficking in precursors and other drug-related crimes, such as trafficking in firearms, illicit financial flows, smuggling of bulk cash and money-laundering;",
    "87": "Further encourages Member States to use existing subregional, regional and international cooperation mechanisms to combat all forms of drug-related crime, wherever committed, including, in some cases, violent crimes related to gangs, including by enhancing international cooperation to successfully counter and dismantle organized criminal groups, including those operating transnationally;",
    "88": "Calls upon Member States to also consider, when developing comprehensive policies to tackle the world drug problem, measures, programmes and actions that address the needs of those affected by drug-related violence and crime;",
    "89": "Reaffirms the importance of the United Nations Office on Drugs and Crime and its field offices in building capacity at the local level in the fight against transnational organized crime and drug trafficking, and encourages the Office to maintain an effective level of support for national and regional efforts in countering and addressing the world drug problem;",
    "90": "Requests the United Nations Office on Drugs and Crime to continue to collaborate with relevant intergovernmental, international and regional organizations involved in addressing and countering the world drug problem, as appropriate, in order to share best practices and scientific standards and to maximize the benefits from their unique comparative advantage;",
    "91": "Also requests the United Nations Office on Drugs and Crime, in close cooperation with Member States and pertinent United Nations entities, intergovernmental and regional organizations and, when appropriate, the scientific community and civil society, to continue to support Member States, upon request, in strengthening their capacity to develop their reporting mechanisms, including by identifying gaps in the current drug statistics and by exploring possibilities to strengthen existing data-collection and analysis tools at the national level;",
    "92": "Notes with appreciation the adoption of Commission on Narcotic Drugs decision 63/15 of 4 March 2020 on the improved and streamlined annual report questionnaire,24 and invites Member States to provide extrabudgetary resources for the purposes described in subparagraph (c) of that decision;",
    "93": "Recalls Statistical Commission decision 48/110 of 10 March 2017 on statistics on drugs and drug use,25 encourages collaboration between the Statistical Commission and the Commission on Narcotic Drugs, within their mandates, to exchange information on the latest data trends on the world drug problem, stresses the need for national statistical capacity-building to support Member States in improving the quality and availability of drug statistics and to respond effectively to data-collection requests from the United Nations Office on Drugs and Crime, and invites international and regional organizations to support Member States in this regard, upon their request;",
    "94": "Invites Member States to invest, where necessary and taking into account specific needs and available resources, in capacity-building and quality-enhancing activities for the collection and reporting of information, to participate in joint cooperation efforts organized by the United Nations Office on Drugs and Crime and __________________ 24 See Official Records of the Economic and Social Council, 2020, Supplement No. 8 (E/2020/28), chap. I, sect. B. 25 Ibid., 2017, Supplement No. 4 (E/2017/24), chap. I, sect. C. International cooperation to address and counter the world drug problem A/RES/75/198 19/22 20-17359 by other national, regional or international organizations and bodies, aimed at the exchange of technical knowledge of experts in the area of data collection, analysis and evaluation and of practical experience in the area of drug data, and to regularly report data and information relating to all aspects of the world drug problem to the Office through the annual report questionnaires, and invites the Commission on Narcotic Drugs, as the central policymaking body of the United Nations system on drug-related matters, to strengthen the capacity of the Office to collect, analyse, use and disseminate accurate, reliable, objective and comparable data and to reflect such information in the World Drug Report;",
    "95": "Encourages Member States to promote data collection, research and the sharing of information, as well as the exchange of best practices on preventing and countering drug-related crime and on drug supply reduction measures and practices, in order to enhance the effectiveness of criminal justice responses, within the framework of applicable law;",
    "96": "Invites Member States to consider the need to review the set of national drug policy metrics and tools for the collection and analysis of accurate, reliable, disaggregated, comprehensive and comparable data to measure the effectiveness of programmes to address all relevant aspects of the world drug problem, including, as appropriate, as related to the 2030 Agenda;",
    "97": "Reiterates the commitment of Member States to improve the availability and quality of statistical information and analysis of illicit drug cultivation, production and manufacturing, drug trafficking, money-laundering and illicit financial flows, including for appropriate reflection in reports of the United Nations Office on Drugs and Crime and the International Narcotics Control Board, in order to better measure and evaluate the impact of such crimes and to further enhance the effectiveness of criminal justice responses in that regard;",
    "98": "Encourages the United Nations Office on Drugs and Crime to continue its efforts to support States in establishing, upon request, the operational frameworks essential for communication within and across national borders and to facilitate the exchange of information on and analysis of drug trafficking trends, with a view to increasing knowledge about the world drug problem at the national, regional and international levels, recognizes the importance of integrating laboratories and providing scientific support to drug control frameworks and of treating quality analytical data as a primary source of information worldwide, and urges coordination with other international entities, including the International Criminal Police Organization (INTERPOL);",
    "99": "Requests all Member States to provide the fullest possible financial and political support to the United Nations Office on Drugs and Crime by widening its donor base, as appropriate, and increasing voluntary contributions, in particular general-purpose contributions, so as to enable it to continue, expand, improve and strengthen, within its mandates, its operational and technical cooperation activities, including with a view to assisting Member States with the full implementation of the Political Declaration and Plan of Action on International Cooperation towards an Integrated and Balanced Strategy to Counter the World Drug Problem, relevant resolutions adopted by the Commission on Narcotic Drugs and the outcome document of the thirtieth special session of the General Assembly;",
    "100": "Expresses concern regarding the overall financial situation of the United Nations Office on Drugs and Crime, emphasizes the need to provide the Office with adequate, predictable and stable resources and to ensure their cost-effective utilization, and requests the Secretary-General to continue to report, within existing reporting obligations, on the financial situation of the Office and to continue to ensure that the Office has sufficient resources to carry out its mandates fully and effectively; A/RES/75/198 International cooperation to address and counter the world drug problem 20-17359 20/22",
    "101": "Encourages Member States and the United Nations Office on Drugs and Crime to continue to address the above-mentioned issues within the mandate of the standing open-ended intergovernmental working group on improving the governance and financial situation of the Office in order for the Office to fulfil its mandate effectively, efficiently and with the appropriate resources;",
    "102": "Encourages the Commission on Narcotic Drugs, as the principal policymaking organ of the United Nations on matters of international drug control and as the governing body of the drug programme of the United Nations Office on Drugs and Crime, and the International Narcotics Control Board to continue to strengthen their work on the control of precursors and other chemicals used in the illicit manufacture of narcotic drugs and psychotropic substances;",
    "103": "Calls upon Member States to strengthen national and international action to address the emerging challenge of new psychoactive substances, including their adverse health consequences, and the evolving threat of amphetamine-type stimulants, including methamphetamine, underscores the importance of enhancing information-sharing and early warning networks, developing appropriate national legislative, prevention and treatment models and supporting scientific evidence-based review and scheduling of the most prevalent, persistent and harmful substances, and notes the importance of preventing the diversion and misuse of pharmaceuticals containing narcotic drugs and psychotropic substances and precursors, while ensuring their availability for legitimate purposes;",
    "104": "Urges States that have not done so to consider ratifying or acceding to, and States parties to implement, as a matter of priority, all the provisions of the Single Convention on Narcotic Drugs of 1961 as amended by the 1972 Protocol, the Convention on Psychotropic Substances of 1971, the United Nations Convention against Illicit Traffic in Narcotic Drugs and Psychotropic Substances of 1988, the United Nations Convention against Transnational Organized Crime and the Protocols thereto26 and the United Nations Convention against Corruption; 27",
    "105": "Requests the United Nations Office on Drugs and Crime to continue to provide, in close collaboration with the International Narcotics Control Board, as appropriate, adequate support and technical assistance to Governments in all regions so as to enable them to implement and fully meet their obligations under conventions and give adequate follow-up to subsequent resolutions of the Commission on Narcotic Drugs, the Economic and Social Council and the General Assembly, including for the strengthening of regulatory authorities and controls, provision of information and fulfilment of reporting requirements, and urges donors to contribute to the Office for those purposes;",
    "106": "Takes note of the resolutions and decisions adopted by the Commission on Narcotic Drugs at its sixty-third session and of the World Drug Report 2020;",
    "107": "Also takes note of the request of the Human Rights Council to the Working Group on Arbitrary Detention, within its mandate, to prepare a study on arbitrary detention related to drug policies, through its resolution 42/22 of 26 September 2019;28",
    "108": "Calls upon Member States to strengthen international and regional cooperation and coordination to counter the threat to the international community caused by the illicit production of and trafficking in drugs, especially those in the opioid group, as well as other aspects of the world drug problem, and to continue to take concerted measures within the framework of the Paris Pact 29 and other relevant __________________ 26 United Nations, Treaty Series, vols. 2225, 2237, 2241 and 2326, No. 39574. 27 Ibid., vol. 2349, No. 42146. 28 See Official Records of the General Assembly, Seventy-fourth Session, Supplement No. 53A (A/74/53/Add.1), chap. III. 29 See S/2003/641, annex. International cooperation to address and counter the world drug problem A/RES/75/198 21/22 20-17359 regional and international initiatives and mechanisms, in order to strengthen cross- border cooperation and information exchange, with a view to countering drug trafficking, with the support of the United Nations Office on Drugs and Crime and other international and regional organizations;",
    "109": "Urges Member States to continue to actively cooperate with the International Narcotics Control Board in the exercise of its mandate, and reiterates the need to ensure that an appropriate level of resources is made available to the Board to enable it to engage with Governments to effectively monitor compliance by States parties with the three international drug control conventions;",
    "110": "Encourages the continued contribution of the meetings of heads of national drug law enforcement agencies and of the Subcommission on Illicit Drug Traffic and Related Matters in the Near and Middle East of the Commission on Narcotic Drugs to the strengthening of regional and international cooperation, and in this regard welcomes the extraordinary sessions of the subsidiary bodies, held in an online format on 1 and 2 October 2020;",
    "111": "Welcomes the ongoing efforts to strengthen cooperation in addressing the world drug problem and to seek effectiveness and comprehensiveness in the strategies and policies undertaken by regional and subregional organizations and transregional initiatives;",
    "112": "Reiterates its call upon the relevant United Nations agencies and entities and other international organizations, and invites international financial institutions, including regional development banks, to mainstream efforts to address and counter the world drug problem into their programmes, and calls upon the United Nations Office on Drugs and Crime to maintain its leading role by providing relevant information and technical assistance;",
    "113": "Calls upon Member States to take the steps necessary to accelerate the implementation of all the joint commitments to address and counter the world drug problem, consistent with the 2019 Ministerial Declaration on Strengthening Our Actions at the National, Regional and International Levels to Accelerate the Implementation of Our Joint Commitments to Address and Counter the World Drug Problem, and reiterates its call upon Member States to take the steps necessary to further implement the operational recommendations set out in the outcome document of the thirtieth special session of the General Assembly, in close partnership with the United Nations and other intergovernmental organizations and civil society, the scientific community and academia, and to share with the Commission on Narcotic Drugs, as the policymaking body of the United Nations with prime responsibility for drug control matters, timely information on progress made in the implementation of the recommendations and international commitments;",
    "114": "Encourages all relevant United Nations bodies and specialized agencies to identify operational recommendations in the outcome document of the thirtieth special session of the General Assembly that fall within their area of specialization and to commence implementing the recommendations made in the outcome document that are within their existing mandates, in collaboration and cooperation with the United Nations Office on Drugs and Crime and the International Narcotics Control Board, keeping the Commission on Narcotic Drugs informed of programmes and progress made to achieve goals set out in the outcome document, and requests the Office to include, within its existing reporting obligations, a chapter regarding collaboration and coordination across the United Nations system in the global efforts to implement the recommendations adopted at the thirtieth special session;",
    "115": "Encourages the Commission on Narcotic Drugs and the United Nations Office on Drugs and Crime to further increase cooperation and collaboration with all relevant United Nations entities and international financial institutions, within their A/RES/75/198 International cooperation to address and counter the world drug problem 20-17359 22/22 respective mandates, when assisting Member States in designing and implementing comprehensive, integrated and balanced national drug strategies, policies and programmes;",
    "116": "Invites the United Nations Office on Drugs and Crime to increase efforts to pursue joint initiatives at the policy and programmatic levels with other relevant United Nations agencies and entities, within their existing mandates, as well as regional organizations, and to update and report to the Commission on Narcotic Drugs on progress, including on joint initiatives, at its upcoming sessions;",
    "117": "Welcomes the follow-up to the implementation of all commitments to address and counter the world drug problem made since 2009, including the recommendations set out in the outcome document of the thirtieth special session of the General Assembly, through the intersessional process of the Commission on Narcotic Drugs, encourages the Commission to continue to work on and support Member States in their implementation and sharing of scientific and evidence-based best practices in addressing and countering the world drug problem, and invites the Commission to continue to examine how its subsidiary bodies can better contribute to the implementation of, inter alia, the outcome document by ensuring that the Commission is informed of regional and domestic concerns, developments and best practices arising from all stakeholders, including contributions from the scientific community, academia and civil society;",
    "118": "Encourages the Commission on Narcotic Drugs to keep the General Assembly informed of developments in the follow-up to the 2019 Ministerial Declaration on Strengthening Our Actions At The National, Regional And International Levels To Accelerate The Implementation Of Our Joint Commitments To Address And Counter The World Drug Problem, and welcomes the briefings and updates provided by the Commission to Member States and all relevant stakeholders;",
    "119": "Calls upon all Member States to actively participate in the discussions of the Commission on Narcotic Drugs in preparation for its sixty-fourth session in 2021 to foster an in-depth exchange of information and expertise on efforts, achievements, challenges and best practices to address and counter the world drug problem, including the challenges posed by the COVID-19 pandemic, and encourages all other relevant stakeholders to make contributions in this regard;",
    "120": "Takes note of the report of the Secretary-General,30 and requests that he submit to the General Assembly at its seventy-sixth session a report on the implementation of the present resolution. 46th plenary meeting 16 December 2020 __________________ 30 A/75/99."
  },
  "agenda_items": [
    "Item 113"
  ],
  "symbol_references": []
}