{
  "symbol": "A/RES/80/106",
  "filename": "A_RES_80_106.pdf",
  "title": "80/106. International Day against Colonialism in All Its Forms and Manifestations",
  "text": "United Nations \nA/RES/80/106 \n \nGeneral Assembly \nDistr.: General \n8 December 2025 \n25-20110 (E) \n*2520110* \n \n \nEightieth session \nAgenda item 59 \nEradicating colonialism in all its forms and manifestations \n \n \n \n \n Resolution adopted by the General Assembly \non 5 December 2025 \n \n \n[on the report of the Special Political and Decolonization Committee \n(Fourth Committee) (A/80/537, para. 15)] \n \n \n 80/106. International Day against Colonialism in All Its Forms \nand Manifestations \n \n \n \nThe General Assembly, \n \nReaffirming the purposes and principles of the Charter of the United Nations,  \n \nRecalling the perennial validity of its resolutions 1514 (XV) of 14 December \n1960, containing the Declaration on the Granting of Independence to Colonial \nCountries and Peoples, 1541 (XV) of 15 December 1960, containing the principles \nwhich should guide Members in determining whether or not an obligation exists to \ntransmit the information called for under Article 73 e of the Charter, and 2625 (XXV) \nof 24 October 1970, containing the Declaration on Principles of International Law \nconcerning Friendly Relations and Cooperation among States in accordance with the \nCharter of the United Nations, and recalling also its resolutions on the International \nDecades for the Eradication of Colonialism,  \n \nExpressing concern that, more than 60 years after the adoption of the \nDeclaration on the Granting of Independence to Colonial Countries and Peoples, the \nprovisions contained in the Declaration have not been fully implemented,  \n \nRecognizing how little is known about the 500-year-long period of colonialism, \nthe transatlantic slave trade and its lasting consequences, felt throughout the world, \nand condemning in the strongest terms the crimes committed during the colonial era,  \n \nReaffirming that the continued existence of colonialism in all its forms and \nmanifestations is incompatible with the Charter of the United Nations, the Declaration \non the Granting of Independence to Colonial Countries and Peoples and the Universal \nDeclaration of Human Rights 1  and prevents the development of international \n_______________ \n \n1 Resolution 217 A (III). \n\nA/RES/80/106 \nInternational Day against Colonialism in All Its Forms \nand Manifestations\n \n25-20110\n2/3 \n \neconomic cooperation, impedes social, cultural and economic development and goes \nagainst the United Nations ideal of universal peace,  \n \nNoting the increasing willingness and emerging practice to address the \ncontinuing impacts of, inter alia, colonialism, through a plurality of measures and \nreparatory justice, including formal apologies, truth-telling processes, reconciliation \nin various forms and, where appropriate, the pursuit of reparations,  \n \nRecognizing that the eradication of colonialism has been and continues to be one \nof the priorities of the United Nations, particularly for the Fourth International Decade \nfor the Eradication of Colonialism, \n \nSolemnly proclaiming the necessity of bringing to a speedy and unconditional \nend colonialism in all its forms and manifestations, and reaffirming its determination \nto implement the Declaration on the Granting of Independence to Colonial Countries \nand Peoples and all its subsequent resolutions and decisions, and to take all necessary \nsteps in this regard,  \n \nReaffirming that any attempt aimed at the partial or total disruption of the \nnational unity and the territorial integrity of a country is incompatible with the \npurposes and principles of the Charter of the United Nations,  \n \nUrging in this regard the full and expeditious implementation of the relevant \nGeneral Assembly resolutions and decisions, and reiterating the determination of the \nUnited Nations and the international community to fulfil their promise of equal rights \nand self-determination of peoples subject to foreign subjugation, domination and \nexploitation, as well as of freedom and justice, as contained in the Charter of the \nUnited Nations,  \n \n1. \nDecides to proclaim, in line with both the spirit and the letter of the \nDeclaration on the Granting of Independence to Colonial Countries and Peoples 2 and \nthe principles enshrined in the Charter of the United Nations, 14 December as the \nInternational Day against Colonialism in All Its Forms and Manifestations, to be \nobserved annually beginning in 2025; \n \n2. \nRequests the Secretary-General to bring the present resolution to the \nattention of all Member States, organizations of the United Nations system and other \ninternational and regional organizations, as well as civil society; \n \n3. \nAlso requests the Secretary-General to take the necessary measures and \narrangements for the United Nations to commemorate and promote the International \nDay;  \n \n4. \nInvites all Member States and observers of the United Nations, \norganizations of the United Nations system and other international and regional \norganizations, as well as civil society, to observe the International Day in an \nappropriate manner; \n \n5. \nRequests the President of the General Assembly to organize, on \n18 December 2025, a one-day high-level plenary meeting of the General Assembly to \ncommemorate the sixty-fifth anniversary of the Declaration on the Granting of \nIndependence to Colonial Countries and Peoples, with the participation of Member \nStates and observers, as well as of the President of the General Assembly, the \nPresident of the Economic and Social Council and the Secretary-General, as part of \nactivities to mark the observance of the International Day for the first time;  \n \n6. \nInvites the President of the General Assembly to organize, each \n14 December thereafter, should it not fall on a weekend, an informal plenary meeting \n_______________ \n \n2 Resolution 1514 (XV). \n\nInternational Day against Colonialism in All Its Forms \nand Manifestations \nA/RES/80/106\n \n3/3\n25-20110 \n \nof the General Assembly to commemorate and promote the International Day, with \nthe participation of Member States and observers, as well as of the President of the \nGeneral Assembly, the President of the Economic and Social Council and the \nSecretary-General;  \n \n7. \nStresses that the cost of all activities that may arise from the \nimplementation of the present resolution should be met from voluntary contributions;  \n \n8. \nDecides to include in the provisional agenda of its eighty-first session the \nitem entitled \u201cEradicating colonialism in all its forms and manifestations\u201d and to \nconsider it on an annual basis thereafter, in order to continue to advance discussions \non this matter.  \n \n55th plenary meeting \n5 December 2025 \n \n",
  "paragraphs": {
    "1": "Decides to proclaim, in line with both the spirit and the letter of the Declaration on the Granting of Independence to Colonial Countries and Peoples 2 and the principles enshrined in the Charter of the United Nations, 14 December as the International Day against Colonialism in All Its Forms and Manifestations, to be observed annually beginning in 2025;",
    "2": "Requests the Secretary-General to bring the present resolution to the attention of all Member States, organizations of the United Nations system and other international and regional organizations, as well as civil society;",
    "3": "Also requests the Secretary-General to take the necessary measures and arrangements for the United Nations to commemorate and promote the International Day;",
    "4": "Invites all Member States and observers of the United Nations, organizations of the United Nations system and other international and regional organizations, as well as civil society, to observe the International Day in an appropriate manner;",
    "5": "Requests the President of the General Assembly to organize, on 18 December 2025, a one-day high-level plenary meeting of the General Assembly to commemorate the sixty-fifth anniversary of the Declaration on the Granting of Independence to Colonial Countries and Peoples, with the participation of Member States and observers, as well as of the President of the General Assembly, the President of the Economic and Social Council and the Secretary-General, as part of activities to mark the observance of the International Day for the first time;",
    "6": "Invites the President of the General Assembly to organize, each 14 December thereafter, should it not fall on a weekend, an informal plenary meeting of the General Assembly to commemorate and promote the International Day, with the participation of Member States and observers, as well as of the President of the General Assembly, the President of the Economic and Social Council and the Secretary-General;",
    "7": "Stresses that the cost of all activities that may arise from the implementation of the present resolution should be met from voluntary contributions;",
    "8": "Decides to include in the provisional agenda of its eighty-first session the item entitled \u201cEradicating colonialism in all its forms and manifestations\u201d and to consider it on an annual basis thereafter, in order to continue to advance discussions on this matter."
  },
  "agenda_items": [
    "Item 59"
  ],
  "symbol_references": []
}