{
  "symbol": "A/RES/72/235",
  "filename": "A_RES_72_235.pdf",
  "title": "72/235. Human resources development",
  "text": "United Nations \nA/RES/72/235\n \n \nGeneral Assembly \nDistr.: General \n18 January 2018 \n \n17-23313 (E)    230118  \n*1723313* \n \n \nSeventy-second session \nAgenda item 23 (c) \n \n \n \n \n Resolution adopted by the General Assembly \non 20 December 2017 \n \n \n \n \n[on the report of the Second Committee (A/72/424/Add.3)] \n \n \n 72/235. Human resources development \n \n \n \nThe General Assembly, \n \nRecalling its resolutions 52/196 of 18 December 1997, 54/211 of 22 December \n1999, 56/189 of 21 December 2001, 58/207 of 23 December 2003, 60/211 of \n22 December 2005, 62/207 of 19 December 2007, 64/218 of 21 December 2009, \n66/217 of 22 December 2011, 68/228 of 20 December 2013 and 70/220 of \n22 December 2015, \n \nReaffirming its resolution 70/1 of 25 September 2015, entitled \u201cTransforming \nour world: the 2030 Agenda for Sustainable Development\u201d, in which it adopted a \ncomprehensive, far-reaching and people-centred set of universal and transformative \nSustainable Development Goals and targets, its commitment to working tirelessly for \nthe full implementation of this Agenda by 2030, its recognition that eradicating \npoverty in all its forms and dimensions, including extreme poverty, is the greatest \nglobal challenge and an indispensable requirement for sustainable development, its \ncommitment to achieving sustainable development in its three dimensions \u2014 \neconomic, social and environmental \u2014 in a balanced and integrated manner, and to \nbuilding upon the achievements of the Millennium Development Goals and seeking \nto address their unfinished business, \n \nReaffirming also its resolution 69/313 of 27 July 2015 on the Addis Ababa \nAction Agenda of the Third International Conference on Financing for Development, \nwhich is an integral part of the 2030 Agenda for Sustainable Development, supports \nand complements it, helps to contextualize its means of implementation targets with \nconcrete policies and actions, and reaffirms the strong political commitment to \naddress the challenge of financing and creating an enabling environment at all levels \nfor sustainable development in the spirit of global partnership and solidarity, \n \nStressing that human resources development lies at the heart of economic, social \nand environmental development and that health and education are at the core of \nhuman resources development, \n\nA/RES/72/235 \nHuman resources development\n \n17-23313 \n2/7 \n \n \nStressing also that human resources development is vital to the efforts to achieve \nthe internationally agreed development goals, including the Sustainable Development \nGoals, and to expand opportunities for people, in particular for the most vulnerable \ngroups of the population, \n \nWelcoming the considerable efforts made over the years, yet recognizing that \nmany countries continue to face formidable challenges in developing a sufficient pool \nof human resources capable of meeting national economic and social needs and that \nthe formulation and implementation of effective human resources strategies often \nrequire resources and capacities not always available in developing countries, and \nrecognizing also the need for new ways to address human resources development, \n \nStressing that climate change is a significant development challenge and that \nimproving educational and institutional capacities to tackle climate change is closely \nlinked to human resources development efforts to ensure that populations can lead \nhealthy and prosperous lives, \n \nRecognizing that the benefits of human resources development are best realized \nin national and international environments that support equality of opportunity and \ntreatment, access to education and non-discrimination and maintain an enabling \nenvironment for job creation, \n \nRecognizing also that despite evidence of an uneven and fragile recovery, the \nongoing adverse impacts, particularly on development, of the world financial and \neconomic crisis continue to diminish the ability of many countries, especially \ndeveloping countries, to cope with and address human resources development \nchallenges and to formulate and implement effective strategies for poverty eradication \nand sustainable development, \n \nAcknowledging the important nexus between international migration and \ndevelopment and the need to deal with the challenges and opportunities that migration \npresents to countries of origin, transit and destination, recognizing that migration \nbrings benefits as well as challenges to the global community, recognizing also the \nrole that migrants returning to their country of origin can play through the utilization \nof their skills, and stressing that the brain drain continues to be a severe problem in \nmany developing and transitioning countries, undermining efforts in the area of \nhuman resources development, \n \nRecognizing the need to align science, technological knowledge and innovation \nsystems with national development objectives, fully integrated with national human \nresources development, labour needs and poverty eradication strategies and supported \nby appropriate institutional and policy frameworks, which can lead to positive \ntransformations in people\u2019s lives, \n \nAcknowledging that science, technological knowledge and innovation policies \nshould take into account the specific features of the economy in developing countries, \nincluding the size of the traditional sector, the importance of indigenous knowledge, \nthe limited access to skilled labour and capital, weak infrastructure and inadequate \ninstitutional frameworks, in order to generate solutions that address the specific \nchallenges of those countries and to foster synergies between modern science and \ntechnology and indigenous and local knowledge, \n \nStressing that technological changes and breakthroughs are expanding at a rapid \npace and impacting the world of work and that, in this regard, the development of \nhuman resources needs to keep pace and be supported by proactive strategies, \ninvestments and normative frameworks to address emerging issues relating to the \nfuture of work, education and training, \n\nHuman resources development \nA/RES/72/235\n \n3/7 \n17-23313 \n \n \nReaffirming that gender equality is of fundamental importance for achieving \nsustained economic growth, poverty eradication and sustainable development, in \naccordance with the relevant General Assembly resolutions and United Nations \nconferences, and that investing in the development of women and girls has a \nmultiplier effect, in particular on productivity, efficiency and sustained economic \ngrowth, in all sectors of the economy, especially in key areas such as agriculture, \nindustry and services, including health, \n \nRecognizing that education is the key to promoting the development of human \npotential, equality and understanding among peoples, as well as to sustaining \neconomic growth and eradicating poverty, and recognizing also that, to achieve those \nends, it is essential that quality education be available to all, including indigenous \npeoples, girls and women, rural inhabitants and persons with disabilities, \n \nStressing that Governments have the primary responsibility for defining and \nimplementing appropriate policies for human resources development, and the need \nfor continued support from the international community for the national efforts of \ndeveloping countries, \n \n1. \nTakes note of the report of the Secretary-General;1 \n \n2. \nCalls upon the international community to place human resources \ndevelopment at the core of economic and social development and to develop short-, \nmedium- and long-term strategies to effectively enhance human resources capacities, \nas educated, skilled, healthy, capable, productive and adaptable workforces are the \nfoundation for achieving sustained, inclusive and equitable economic growth and \ndevelopment; \n \n3. \nEncourages giving appropriate consideration to human resources \ndevelopment strategies in the implementation of the 2030 Agenda for Sustainable \nDevelopment;2 \n \n4. \nStresses the need for Member States to emphasize and integrate human \nresources development into national development strategies, including national \ndevelopment policies and strategies to eradicate poverty and achieve the Sustainable \nDevelopment Goals, in order to address structural and multidimensional challenges \nto enhancing national productive capacities and to ensure that human resources \ndevelopment implications are taken into account by all national development \nstakeholders; \n \n5. \nRecognizes that comprehensive approaches to human resources \ndevelopment that address poverty eradication and the creation of a skilled workforce \nare also critical in reducing unemployment and brain drain and in promoting greater \nsocial inclusion; \n \n6. \nAlso recognizes that the future of work, impacted by progress in science \nand technology, requires adaptability and faster learning of new skills, which, in turn, \nrequire a shift towards early childhood education, lifelong learning and a \ncomprehensive life-cycle approach to education and training, enabled, inter alia, \nthrough increased investment in teacher training and improved access to digital \nlearning resources, especially in developing countries; \n \n7. \nTakes note with appreciation of the establishment of the Global \nCommission on the Future of Work by the International Labour Organization; \n \n8. \nEncourages States, the private sector and other relevant stakeholders to \ntake appropriate steps, in accordance with their plans and policies, to help individuals \n__________________ \n \n1 A/72/292. \n \n2 Resolution 70/1. \n\nA/RES/72/235 \nHuman resources development\n \n17-23313 \n4/7 \n \nto make well-informed choices in education, training and careers, develop an \nintegrated system of quality education and training that responds to constantly \nevolving needs, promote employer recognition and career development based on \nskills and mastery and foster a culture that supports and celebrates lifelong learning, \nin order to provide opportunities for all to develop their fullest potential throughout \nlife, regardless of their starting points, thereby improving their chances of staying \ngainfully employed, and calls for more effective support for developing countries in \nthis regard, including from the United Nations system; \n \n9. \nEncourages Member States to adopt and implement comprehensive human \nresources development strategies premised on national development objectives that \nensure a strong link between quality education, training and employment, help to \nmaintain a productive and competitive workforce and are responsive to the needs of \nthe economy; \n \n10. Stresses that human resources development policies should focus on \nsupporting the emergence of a sufficiently wide and flexible pool of skilled human \nresources, especially among women and youth, to support all sectors of the economy \nand be matched with present and future workforce needs, which requires well-\nsequenced investments in basic education, vocational training, on-the-job training and \nmore advanced managerial, engineering and scientific education to increase the \nsupply of technological knowledge that can be absorbed by national innovation \nsystems; \n \n11. \nEmphasizes the need to adopt cross-sectoral approaches and mechanisms \nto identify human resources development needs in the medium and long term for all \nsectors of the economy and to formulate and implement policies and programmes to \naddress those needs; \n \n12. Recognizes that comprehensive and flexible science, technological \nknowledge and innovation strategies that encompass all sectors of the economy are \ncritical to ensuring that skills are matched with labour market demand and ready to \nadapt to and benefit from a constantly evolving technology landscape; \n \n13. Emphasizes that, when science, technological knowledge and innovation \nand human resources development approaches are mutually reinforcing, they can lead \nto a virtuous circle of economic growth, human progress and sustainable \ndevelopment; \n \n14. Stresses that investment in human resources development should be an \nintegral part of national development policies and strategies, and in this regard calls \nfor the adoption of policies to facilitate investment focused on physical and social \ninfrastructure, including education, in particular skills upgrading and vocational \ntraining in areas such as science and technology, including information and \ncommunications technology, as well as in capacity development, health and \nsustainable development; \n \n15. Encourages Member States, as appropriate, to continue to implement \nnationally appropriate social protection systems and measures for all, including social \nprotection floors, to adopt policies that strengthen existing safety nets and protect \nvulnerable groups and to take other appropriate actions, including boosting national \neconomic performance, recognizes that social protection floors, defined according to \nnational priorities and the individual circumstances of States, can provide systemic \napproaches to addressing poverty and vulnerability and can contribute significantly \nto successful human resources development strategies, acknowledges, in this regard, \nthat many developing countries lack the necessary financial resources and capacity to \nimplement such countercyclical measures, and in this regard recognizes the need for \n\nHuman resources development \nA/RES/72/235\n \n5/7 \n17-23313 \n \ncontinued mobilization of additional domestic and international resources, as \nappropriate; \n \n16. Encourages States to consider policies consistent with the International \nLabour Organization Declaration on Fundamental Principles and Rights at Work and \ntheir obligations under all relevant ratified conventions of the International Labour \nOrganization, and recalls the importance of promoting decent work for all and of \nincreasing quality jobs, including through measures aimed at ensuring occupational \nhealth and safety and through working relationships based on effective social \ndialogue; \n \n17. Stresses that human resources development strategies should include \nmeasures aimed at reducing unemployment and underemployment among young men \nand women and the long-term unemployed, who have been disproportionately \naffected by slow growth in jobs recovery, and to integrate underutilized human \nresources into the labour market through policies that promote skills development and \nproductivity and reduce barriers to employment, including gender barriers, including \nby providing incentives, as appropriate, for recruiting, retaining and retooling, \nassistance in job-finding, job-matching and vocational and on-the-job training, and \nby promoting, inter alia, youth entrepreneurship, noting in this regard the call for \naction by the International Labour Conference in 2012; \n \n18. Also stresses the need for Member States to retain and further enhance \nnational human resources by boosting job-rich recovery and promoting decent work, \nincluding by adopting policies and incentives that enhance labour productivity and \nstimulate private investment and entrepreneurship and strengthen the role of labour \nadministration and institutions in order to foster job creation, address the gender wage \ngap, reduce occupational segregation and increase the participation of vulnerable \ngroups, including workers in the informal economy; \n \n19. Emphasizes the need to address the interlinkages among human resources \ndevelopment, energy and food security, agriculture and rural development, and \nencourages countries to strengthen capacity in agriculture and rural development; \n \n20. Encourages Member States to facilitate access to and apply \nenvironmentally sound technologies, and welcomes the launch of the Technology \nFacilitation Mechanism established in the Addis Ababa Action Agenda, 3 based on a \nmulti-stakeholder collaboration among States, civil society, the private sector, the \nscientific community, United Nations entities and other stakeholders, in order to \nsupport the implementation of the Sustainable Development Goals; \n \n21. Stresses that sustainable development is dependent, inter alia, on healthy \nhuman resources, calls upon Governments to continue their efforts to strengthen \nnational health systems, urges the further strengthening of international cooperation \nin the area of health, inter alia, by considering the promotion of universal health \ncoverage and through the exchange of best practices in the areas of strengthening \nhealth systems, access to medicines, expanding and transforming the health \nworkforce, recruitment, training and development of health personnel, transfer of \ntechnology on mutually agreed terms and production of affordable, safe, effective and \ngood-quality medicine, and in this regard also stresses that international cooperation \nand assistance, in particular funding, need to become more predictable and to be better \naligned with national priorities and channelled to recipient countries in ways that \nstrengthen national health systems; \n \n22. Calls upon the international community, including the relevant entities of \nthe United Nations system, to support the efforts of developing countries to address \n__________________ \n \n3 Resolution 69/313, annex, para. 123. \n\nA/RES/72/235 \nHuman resources development\n \n17-23313 \n6/7 \n \nthe adverse effects of HIV and AIDS, malaria, tuberculosis and other infectious \ndiseases and to halt the spread of epidemic diseases, as well as the prevention and \ncontrol of non-communicable diseases in Africa, Asia and other regions, and their \neffects on human resources; \n \n23. Encourages Governments to facilitate investments in education, skills and \ndecent job creation in the health and social sectors by taking note of the \nrecommendations of the Secretary-General\u2019s High-level Commission on Health \nEmployment and Economic Growth and to avert the shortfall of 18 million health \nworkers by 2030, building the human capital required to accelerate universal health \ncoverage and global health security, recognizes that these actions are not only \nessential to the achievement of the health-related Sustainable Development Goals but \nwill also generate benefits across the Goals, including the creation of decent jobs, the \nreduction of youth unemployment, the enhancement of women\u2019s economic \nempowerment and participation and inclusive growth; \n \n24. Calls upon relevant United Nations entities to support national efforts to \nbuild institutional capacities to address long-term national human resources \ndevelopment needs in addition to providing training to individuals; \n \n25. Calls upon the international community to assist developing countries in \nthe implementation of national human resources development strategies and \nencourages the international community, including the private sector and relevant \ncivil society actors, to provide and mobilize financial resources, capacity-building, \ntechnical assistance and technology transfer on mutually agreed terms and to supply \nexpertise from all sources, as available; \n \n26. Calls for steps to integrate gender perspectives into human resources \ndevelopment, including through policies, strategies and targeted actions aimed at \npromoting women\u2019s capacities and access to productive activities, and in this regard \nemphasizes the need to ensure the full participation of women in the formulation and \nimplementation of such policies, strategies and actions; \n \n27. Stresses the important contributions of the public and private sectors, \nrespectively, in meeting national training and education needs to support the efficient \nfunctioning of enterprises and matching the needs of a rapidly changing economy, \nand encourages the integration of those contributions, including through the greater \nuse of public-private partnerships and incentives; \n \n28. Calls for actions at the national, regional and international levels that will \ngive high priority to improving and expanding literacy, as well as science proficiency, \nincluding by providing tertiary, technical vocational and adult education, and stresses \nthe need to ensure that, by 2030, children everywhere, girls and boys alike, will be \nable to complete free, equitable and quality primary and secondary education, leading \nto relevant and effective learning outcomes; \n \n29. Encourages Governments to consider appropriate measures at the national \nlevel, such as upgrading human skills, better aligning educational and training \nsystems to labour market needs and strengthening labour institutions and regulations \nto respond to economic downturns; \n \n30. Encourages countries to maintain or consider enhancing measures to boost \njob-rich recovery, such as policies and incentives to enhance labour productivity and \nstimulate private investment, in addition to efforts to reduce budget deficits in the \nlong term, as appropriate; \n \n31. Encourages efforts by Member States and the international community to \npromote a balanced, coherent and comprehensive approach to international migration \nand development, in particular by building partnerships and ensuring coordinated \n\nHuman resources development \nA/RES/72/235\n \n7/7 \n17-23313 \n \naction to develop capacities, including for the management of migration, and in this \nregard reiterates the need to consider innovative measures to maximize the benefits \nof migration while minimizing the negative effects of the migration of both highly \nskilled and low-skilled workers from developing countries; \n \n32. Requests the Secretary-General to submit to the General Assembly, at its \nseventy-fourth session, a report on the implementation of the present resolution, and \ndecides to include in the provisional agenda of its seventy-fourth session, under the \nitem entitled \u201cEradication of poverty and other development issues\u201d, the sub-item \nentitled \u201cHuman resources development\u201d. \n \n74th plenary meeting  \n20 December 2017 \n \n",
  "paragraphs": {
    "1": "Takes note of the report of the Secretary-General;1",
    "2": "Calls upon the international community to place human resources development at the core of economic and social development and to develop short-, medium- and long-term strategies to effectively enhance human resources capacities, as educated, skilled, healthy, capable, productive and adaptable workforces are the foundation for achieving sustained, inclusive and equitable economic growth and development;",
    "3": "Encourages giving appropriate consideration to human resources development strategies in the implementation of the 2030 Agenda for Sustainable Development;2",
    "4": "Stresses the need for Member States to emphasize and integrate human resources development into national development strategies, including national development policies and strategies to eradicate poverty and achieve the Sustainable Development Goals, in order to address structural and multidimensional challenges to enhancing national productive capacities and to ensure that human resources development implications are taken into account by all national development stakeholders;",
    "5": "Recognizes that comprehensive approaches to human resources development that address poverty eradication and the creation of a skilled workforce are also critical in reducing unemployment and brain drain and in promoting greater social inclusion;",
    "6": "Also recognizes that the future of work, impacted by progress in science and technology, requires adaptability and faster learning of new skills, which, in turn, require a shift towards early childhood education, lifelong learning and a comprehensive life-cycle approach to education and training, enabled, inter alia, through increased investment in teacher training and improved access to digital learning resources, especially in developing countries;",
    "7": "Takes note with appreciation of the establishment of the Global Commission on the Future of Work by the International Labour Organization;",
    "8": "Encourages States, the private sector and other relevant stakeholders to take appropriate steps, in accordance with their plans and policies, to help individuals to make well-informed choices in education, training and careers, develop an integrated system of quality education and training that responds to constantly evolving needs, promote employer recognition and career development based on skills and mastery and foster a culture that supports and celebrates lifelong learning, in order to provide opportunities for all to develop their fullest potential throughout life, regardless of their starting points, thereby improving their chances of staying gainfully employed, and calls for more effective support for developing countries in this regard, including from the United Nations system;",
    "9": "Encourages Member States to adopt and implement comprehensive human resources development strategies premised on national development objectives that ensure a strong link between quality education, training and employment, help to maintain a productive and competitive workforce and are responsive to the needs of the economy;",
    "10": "Stresses that human resources development policies should focus on supporting the emergence of a sufficiently wide and flexible pool of skilled human resources, especially among women and youth, to support all sectors of the economy and be matched with present and future workforce needs, which requires well- sequenced investments in basic education, vocational training, on-the-job training and more advanced managerial, engineering and scientific education to increase the supply of technological knowledge that can be absorbed by national innovation systems;",
    "11": "Emphasizes the need to adopt cross-sectoral approaches and mechanisms to identify human resources development needs in the medium and long term for all sectors of the economy and to formulate and implement policies and programmes to address those needs;",
    "12": "Recognizes that comprehensive and flexible science, technological knowledge and innovation strategies that encompass all sectors of the economy are critical to ensuring that skills are matched with labour market demand and ready to adapt to and benefit from a constantly evolving technology landscape;",
    "13": "Emphasizes that, when science, technological knowledge and innovation and human resources development approaches are mutually reinforcing, they can lead to a virtuous circle of economic growth, human progress and sustainable development;",
    "14": "Stresses that investment in human resources development should be an integral part of national development policies and strategies, and in this regard calls for the adoption of policies to facilitate investment focused on physical and social infrastructure, including education, in particular skills upgrading and vocational training in areas such as science and technology, including information and communications technology, as well as in capacity development, health and sustainable development;",
    "15": " continued mobilization of additional domestic and international resources, as appropriate;",
    "16": "Encourages States to consider policies consistent with the International Labour Organization Declaration on Fundamental Principles and Rights at Work and their obligations under all relevant ratified conventions of the International Labour Organization, and recalls the importance of promoting decent work for all and of increasing quality jobs, including through measures aimed at ensuring occupational health and safety and through working relationships based on effective social dialogue;",
    "17": "Stresses that human resources development strategies should include measures aimed at reducing unemployment and underemployment among young men and women and the long-term unemployed, who have been disproportionately affected by slow growth in jobs recovery, and to integrate underutilized human resources into the labour market through policies that promote skills development and productivity and reduce barriers to employment, including gender barriers, including by providing incentives, as appropriate, for recruiting, retaining and retooling, assistance in job-finding, job-matching and vocational and on-the-job training, and by promoting, inter alia, youth entrepreneurship, noting in this regard the call for action by the International Labour Conference in 2012;",
    "18": "Also stresses the need for Member States to retain and further enhance national human resources by boosting job-rich recovery and promoting decent work, including by adopting policies and incentives that enhance labour productivity and stimulate private investment and entrepreneurship and strengthen the role of labour administration and institutions in order to foster job creation, address the gender wage gap, reduce occupational segregation and increase the participation of vulnerable groups, including workers in the informal economy;",
    "19": "Emphasizes the need to address the interlinkages among human resources development, energy and food security, agriculture and rural development, and encourages countries to strengthen capacity in agriculture and rural development;",
    "20": "Encourages Member States to facilitate access to and apply environmentally sound technologies, and welcomes the launch of the Technology Facilitation Mechanism established in the Addis Ababa Action Agenda, 3 based on a multi-stakeholder collaboration among States, civil society, the private sector, the scientific community, United Nations entities and other stakeholders, in order to support the implementation of the Sustainable Development Goals;",
    "21": "Stresses that sustainable development is dependent, inter alia, on healthy human resources, calls upon Governments to continue their efforts to strengthen national health systems, urges the further strengthening of international cooperation in the area of health, inter alia, by considering the promotion of universal health coverage and through the exchange of best practices in the areas of strengthening health systems, access to medicines, expanding and transforming the health workforce, recruitment, training and development of health personnel, transfer of technology on mutually agreed terms and production of affordable, safe, effective and good-quality medicine, and in this regard also stresses that international cooperation and assistance, in particular funding, need to become more predictable and to be better aligned with national priorities and channelled to recipient countries in ways that strengthen national health systems;",
    "22": "Calls upon the international community, including the relevant entities of the United Nations system, to support the efforts of developing countries to address the adverse effects of HIV and AIDS, malaria, tuberculosis and other infectious diseases and to halt the spread of epidemic diseases, as well as the prevention and control of non-communicable diseases in Africa, Asia and other regions, and their effects on human resources;",
    "23": "Encourages Governments to facilitate investments in education, skills and decent job creation in the health and social sectors by taking note of the recommendations of the Secretary-General\u2019s High-level Commission on Health Employment and Economic Growth and to avert the shortfall of 18 million health workers by 2030, building the human capital required to accelerate universal health coverage and global health security, recognizes that these actions are not only essential to the achievement of the health-related Sustainable Development Goals but will also generate benefits across the Goals, including the creation of decent jobs, the reduction of youth unemployment, the enhancement of women\u2019s economic empowerment and participation and inclusive growth;",
    "24": "Calls upon relevant United Nations entities to support national efforts to build institutional capacities to address long-term national human resources development needs in addition to providing training to individuals;",
    "25": "Calls upon the international community to assist developing countries in the implementation of national human resources development strategies and encourages the international community, including the private sector and relevant civil society actors, to provide and mobilize financial resources, capacity-building, technical assistance and technology transfer on mutually agreed terms and to supply expertise from all sources, as available;",
    "26": "Calls for steps to integrate gender perspectives into human resources development, including through policies, strategies and targeted actions aimed at promoting women\u2019s capacities and access to productive activities, and in this regard emphasizes the need to ensure the full participation of women in the formulation and implementation of such policies, strategies and actions;",
    "27": "Stresses the important contributions of the public and private sectors, respectively, in meeting national training and education needs to support the efficient functioning of enterprises and matching the needs of a rapidly changing economy, and encourages the integration of those contributions, including through the greater use of public-private partnerships and incentives;",
    "28": "Calls for actions at the national, regional and international levels that will give high priority to improving and expanding literacy, as well as science proficiency, including by providing tertiary, technical vocational and adult education, and stresses the need to ensure that, by 2030, children everywhere, girls and boys alike, will be able to complete free, equitable and quality primary and secondary education, leading to relevant and effective learning outcomes;",
    "29": "Encourages Governments to consider appropriate measures at the national level, such as upgrading human skills, better aligning educational and training systems to labour market needs and strengthening labour institutions and regulations to respond to economic downturns;",
    "30": "Encourages countries to maintain or consider enhancing measures to boost job-rich recovery, such as policies and incentives to enhance labour productivity and stimulate private investment, in addition to efforts to reduce budget deficits in the long term, as appropriate;",
    "31": " action to develop capacities, including for the management of migration, and in this regard reiterates the need to consider innovative measures to maximize the benefits of migration while minimizing the negative effects of the migration of both highly skilled and low-skilled workers from developing countries;",
    "32": "Requests the Secretary-General to submit to the General Assembly, at its seventy-fourth session, a report on the implementation of the present resolution, and decides to include in the provisional agenda of its seventy-fourth session, under the item entitled \u201cEradication of poverty and other development issues\u201d, the sub-item entitled \u201cHuman resources development\u201d."
  },
  "agenda_items": [
    "Item 23"
  ],
  "symbol_references": []
}