{
  "symbol": "A/RES/78/175",
  "filename": "A_RES_78_175.pdf",
  "title": "78/175. Cooperatives in social development",
  "text": "United Nations \nA/RES/78/175\n \n \nGeneral Assembly \nDistr.: General \n22 December 2023 \n \n23-25977 (E)    040124     \n*2325977* \n \n \nSeventy-eighth session \nAgenda item 24 (b) \nSocial development: social development, including \nquestions relating to the world social situation and to \nyouth, ageing, persons with disabilities and the family\n \n \n \n \n \n Resolution adopted by the General Assembly \non 19 December 2023 \n \n \n \n \n[on the report of the Third Committee (A/78/472, para. 57)] \n \n \n 78/175. Cooperatives in social development \n \n \n \nThe General Assembly, \n \nRecalling its resolutions 47/90 of 16 December 1992, 49/155 of 23 December \n1994, 51/58 of 12 December 1996, 54/123 of 17 December 1999, 56/114 of \n19 December 2001, 58/131 of 22 December 2003, 60/132 of 16 December 2005, \n62/128 of 18 December 2007, 64/136 of 18 December 2009, 65/184 of 21 December \n2010, 66/123 of 19 December 2011, 68/133 of 18 December 2013, 70/128 of \n17 December 2015, 72/143 of 19 December 2017, 74/119 of 18 December 2019 and \n76/135 of 16 December 2021 concerning cooperatives in social development, \n \nRecognizing that cooperatives, in their various forms, promote the fullest \npossible participation in the economic and social development of local communities \nand all people, including women, young people, older persons, persons with \ndisabilities and Indigenous Peoples, whose inclusion strengthens economic and social \ndevelopment, and contribute to the eradication of poverty and hunger, \n \nRecognizing also that, as cooperative enterprises often serve the socially \nexcluded and vulnerable sectors of the population that traditional profit-driven \nbusinesses may not be best placed to address, they are therefore important for the \nsupport of socially inclusive policies that drive inclusive development, particularly in \ndeveloping countries, \n \nRecognizing further that cooperatives and other social organizations can be \ninstrumental in promoting a just transition while working on climate change \nadaptation and mitigation, \n \nReaffirming the adoption of the outcome document of the United Nations \nsummit for the adoption of the post-2015 development agenda, entitled \n\nA/RES/78/175 \nCooperatives in social development\n \n23-25977\n2/4 \n \n\u201cTransforming our world: the 2030 Agenda for Sustainable Development\u201d, 1 and the \nAddis Ababa Action Agenda of the Third International Conference on Financing for \nDevelopment,2 and noting the acknowledgement therein of the role of cooperatives in \nthe implementation of the 2030 Agenda and in relation to financing for development, \n \nRecalling its resolution 77/281 of 18 April 2023, entitled \u201cPromoting the social \nand solidarity economy for sustainable development\u201d, in which it recognized that the \nsocial and solidarity economy encompasses enterprises, organizations and other \nentities that are engaged in economic, social and environmental activities to serve the \ncollective and/or general interest, which are based on the principles of voluntary \ncooperation and mutual aid, democratic and/or participatory governance, autonomy \nand independence and the primacy of people and social purpose over capital in the \ndistribution and use of surpluses and/or profits, as well as assets, \n \nRecognizing the important contribution and potential of all forms of cooperatives \nto the follow-up to the World Summit for Social Development and the Fourth World \nConference on Women, including their five-year reviews, the United Nations \nConference on Housing and Sustainable Urban Development (Habitat III), the World \nFood Summit, the Second World Assembly on Ageing, the International Conference \non Financing for Development, the World Summit on Sustainable Development and \nthe United Nations summit for the adoption of the post-2015 development agenda, \n \nRecognizing also that cooperatives can make important contributions towards \nand benefit from improved global food security through their role as stakeholders in \nnational pathways of transformation toward sustainable, resilient and inclusive food \nsystems, \n \nNoting that, globally, there are about 3 million cooperatives, and 10 per cent of \nworkers worldwide are either employed by a cooperative or are worker-owners within \na cooperative,  \n \nRecognizing that cooperatives may contribute to the economic status of women, \nas well as to their capacity-building, including education and training in key skills, \nand promote the social and economic development of all persons, including young \npeople, older persons and persons with disabilities, \n \nNoting with appreciation the potential role of cooperative development in the \nimprovement of the social and economic conditions of Indigenous Peoples and rural \ncommunities, \n \nNoting the proposal contained in the report of the Secretary-General entitled \n\u201cOur Common Agenda\u201d to convene a world social summit in 2025, to be discussed \nand agreed upon by Member States, including its modalities, title, objectives, scope \nand possible outcomes, and emphasizing that the possible summit\u2019s outcome should \nhave a social development approach and give momentum towards the implementation \nof the 2030 Agenda,  \n \nWelcoming the efforts of the Food and Agriculture Organization of the United \nNations to showcase the role of agricultural cooperatives, including in improving food \nsecurity and nutrition, particularly in rural areas, promoting sustainable agricultural \npractices, improving the agricultural productivity of farmers, including by providing \ncapacity-building and training, and facilitating access to markets, savings, credit, \ninsurance and technology, and in so doing strengthen sustainable food systems, \n \n1. \nTakes note of the report of the Secretary-General;3 \n__________________ \n \n1  Resolution 70/1. \n \n2  Resolution 69/313, annex. \n \n3  A/78/187. \n\nCooperatives in social development \nA/RES/78/175\n \n3/4\n23-25977 \n \n \n2. \nNotes with appreciation the celebration of the International Year of \nCooperatives, in 2012; \n \n3. \nCalls for the proclamation of another International Year of Cooperatives \nin 2025, and encourages all Member States, as well as the United Nations and all \nother relevant stakeholders, to take advantage of the International Year of \nCooperatives as a way of promoting cooperatives and raising awareness of their \ncontribution to the implementation of the Sustainable Development Goals and to \noverall social and economic development; \n \n4. \nEncourages all Member States, as well as the United Nations and all other \nrelevant stakeholders, to share best practices identified through activities \nimplemented during the International Year of Cooperatives and to continue those \nactivities, as appropriate; \n \n5. \nEncourages Governments, as appropriate, to consult with cooperatives as \npart of their preparations for their voluntary national reviews for the high-level \npolitical forum on sustainable development; \n \n6. \nDraws the attention of Governments to the recommendations contained in \nthe report of the Secretary-General to focus support on cooperatives as sustainable \nand successful business enterprises by strengthening the entrepreneurial ecosystem \nfor cooperatives, enabling them to further contribute directly to decent employment \ngeneration, poverty and hunger eradication, education, social protection, including \nuniversal health coverage, financial inclusion and the creation of affordable housing \noptions across a variety of economic sectors in urban and rural areas and to review \nexisting legislation and regulations to make the national legal and regulatory \nenvironment more conducive to the creation and growth of cooperatives by improving \nexisting laws and regulations and/or by establishing new ones, especially in the areas \nof access to capital, autonomy, competitiveness and fair taxation; \n \n7. \nInvites Governments and international organizations, in partnership with \ncooperatives and cooperative organizations, to strengthen and build the capacity of \nall forms of cooperatives, especially those run by the poor, young people, women, \nolder persons, Indigenous Peoples, persons with disabilities and those in vulnerable \nsituations, so that they can empower people to transform their lives and communities \npositively and build inclusive societies, and to ensure the full, equal and meaningful \nparticipation of women and young people in cooperatives, in particular in their \ndecision-making processes; \n \n8. \nInvites Governments to strengthen efforts to enhance food security and \nnutrition to foster sustainable production and consumption, to promote the \nprogressive realization of the right to adequate food and to focus efforts on \nsmallholders and women farmers, as well as on agricultural and food cooperatives \nand farmers\u2019 networks, supported by measures to improve access to markets and \nfinancial capital, create enabling domestic and international environments and \nstrengthen collaboration across the many initiatives in this area, including regional \ninitiatives; \n \n9. \nEncourages Governments to promote access to information and \ncommunications technologies as a vital channel for collaboration and the expansion \nof cooperatives, especially in rural areas, working towards closing the digital divides, \nincluding for all women and girls, persons with disabilities and older persons; \n \n10. Also encourages Governments to intensify and expand the availability, \naccessibility and dissemination of evidence-based research on the operations and \ncontribution of cooperatives, to develop a statistical framework for the systematic \ncollection of comprehensive and disaggregated data on and the best practices of \ncooperative enterprises, taking into consideration available methodologies, such as \n\nA/RES/78/175 \nCooperatives in social development\n \n23-25977\n4/4 \n \nthe guidelines concerning statistics of cooperatives, in collaboration with all \nstakeholders, and to raise public awareness of the linkages between cooperatives and \nsustainable development, especially in the areas of social inclusion, decent \nemployment creation, poverty eradication in all its forms and dimensions, inequality \nreduction, gender equality and the empowerment of women and girls, and peacebuilding; \n \n11. \nInvites Governments, relevant international organizations, the specialized \nagencies and local, national and international cooperative organizations to continue \nto observe the International Day of Cooperatives annually, on the first Saturday of \nJuly, as proclaimed by the General Assembly in its resolution 47/90; \n \n12. Invites Governments, in collaboration with the cooperative movement, to \ndevelop programmes aimed at enhancing the capacity-building of cooperatives, \nincluding by strengthening the organizational, management and financial skills of \ntheir members, while respecting the principles of gender equality and the \nempowerment of women and girls, and to introduce and support programmes to \nimprove the access of cooperatives to new technologies; \n \n13. \nEncourages Governments to take appropriate measures to adopt or develop \nlegislation and policies that provide women with equal access to land and support \nwomen\u2019s cooperatives and agricultural programmes and enable women\u2019s cooperatives \nto benefit from public and private sector procurement processes and increase trade; \n \n14. Requests the Secretary-General, in cooperation with the relevant United \nNations and other international organizations and national, regional and international \ncooperative organizations, to continue to render support to Member States, as \nappropriate, in their efforts to create a supportive environment for the development \nof cooperatives, integrating cooperative values, principles and business models into \neducational programming, including school curricula, as appropriate, providing \nassistance for human resources development, technical advice and training and \npromoting an exchange of experience and best practices through, inter alia, \nconferences, workshops and seminars at the national and regional levels, within \nexisting resources; \n \n15. Also requests the Secretary-General to submit to the General Assembly at \nits eightieth session a report on the implementation of the present resolution. \n \n50th plenary meeting \n19 December 2023 \n \n",
  "paragraphs": {
    "1": "Takes note of the report of the Secretary-General;3",
    "2": "Notes with appreciation the celebration of the International Year of Cooperatives, in 2012;",
    "3": "Calls for the proclamation of another International Year of Cooperatives in 2025, and encourages all Member States, as well as the United Nations and all other relevant stakeholders, to take advantage of the International Year of Cooperatives as a way of promoting cooperatives and raising awareness of their contribution to the implementation of the Sustainable Development Goals and to overall social and economic development;",
    "4": "Encourages all Member States, as well as the United Nations and all other relevant stakeholders, to share best practices identified through activities implemented during the International Year of Cooperatives and to continue those activities, as appropriate;",
    "5": "Encourages Governments, as appropriate, to consult with cooperatives as part of their preparations for their voluntary national reviews for the high-level political forum on sustainable development;",
    "6": "Draws the attention of Governments to the recommendations contained in the report of the Secretary-General to focus support on cooperatives as sustainable and successful business enterprises by strengthening the entrepreneurial ecosystem for cooperatives, enabling them to further contribute directly to decent employment generation, poverty and hunger eradication, education, social protection, including universal health coverage, financial inclusion and the creation of affordable housing options across a variety of economic sectors in urban and rural areas and to review existing legislation and regulations to make the national legal and regulatory environment more conducive to the creation and growth of cooperatives by improving existing laws and regulations and/or by establishing new ones, especially in the areas of access to capital, autonomy, competitiveness and fair taxation;",
    "7": "Invites Governments and international organizations, in partnership with cooperatives and cooperative organizations, to strengthen and build the capacity of all forms of cooperatives, especially those run by the poor, young people, women, older persons, Indigenous Peoples, persons with disabilities and those in vulnerable situations, so that they can empower people to transform their lives and communities positively and build inclusive societies, and to ensure the full, equal and meaningful participation of women and young people in cooperatives, in particular in their decision-making processes;",
    "8": "Invites Governments to strengthen efforts to enhance food security and nutrition to foster sustainable production and consumption, to promote the progressive realization of the right to adequate food and to focus efforts on smallholders and women farmers, as well as on agricultural and food cooperatives and farmers\u2019 networks, supported by measures to improve access to markets and financial capital, create enabling domestic and international environments and strengthen collaboration across the many initiatives in this area, including regional initiatives;",
    "9": "Encourages Governments to promote access to information and communications technologies as a vital channel for collaboration and the expansion of cooperatives, especially in rural areas, working towards closing the digital divides, including for all women and girls, persons with disabilities and older persons;",
    "10": " the guidelines concerning statistics of cooperatives, in collaboration with all stakeholders, and to raise public awareness of the linkages between cooperatives and sustainable development, especially in the areas of social inclusion, decent employment creation, poverty eradication in all its forms and dimensions, inequality reduction, gender equality and the empowerment of women and girls, and peacebuilding;",
    "11": "Invites Governments, relevant international organizations, the specialized agencies and local, national and international cooperative organizations to continue to observe the International Day of Cooperatives annually, on the first Saturday of July, as proclaimed by the General Assembly in its resolution 47/90;",
    "12": "Invites Governments, in collaboration with the cooperative movement, to develop programmes aimed at enhancing the capacity-building of cooperatives, including by strengthening the organizational, management and financial skills of their members, while respecting the principles of gender equality and the empowerment of women and girls, and to introduce and support programmes to improve the access of cooperatives to new technologies;",
    "13": "Encourages Governments to take appropriate measures to adopt or develop legislation and policies that provide women with equal access to land and support women\u2019s cooperatives and agricultural programmes and enable women\u2019s cooperatives to benefit from public and private sector procurement processes and increase trade;",
    "14": "Requests the Secretary-General, in cooperation with the relevant United Nations and other international organizations and national, regional and international cooperative organizations, to continue to render support to Member States, as appropriate, in their efforts to create a supportive environment for the development of cooperatives, integrating cooperative values, principles and business models into educational programming, including school curricula, as appropriate, providing assistance for human resources development, technical advice and training and promoting an exchange of experience and best practices through, inter alia, conferences, workshops and seminars at the national and regional levels, within existing resources;",
    "15": "Also requests the Secretary-General to submit to the General Assembly at its eightieth session a report on the implementation of the present resolution."
  },
  "agenda_items": [
    "Item 24"
  ],
  "symbol_references": []
}