{
  "symbol": "A/RES/78/312",
  "filename": "A_RES_78_312.pdf",
  "title": "78/312.  World Kiswahili Language Day",
  "text": "United Nations \nA/RES/78/312 \n \n \nGeneral Assembly \nDistr.: General \n5 July 2024 \n \n24-12316 (E)    120724     \n*2412316* \n \n \nSeventy-eighth session \nAgenda item 124 \nMultilingualism \n \n \n \nResolution adopted by the General Assembly on 1 July 2024 \n \n \n \n \n[without reference to a Main Committee (A/78/L.83)]  \n \n \n 78/312.  World Kiswahili Language Day \n \n \n \nThe General Assembly, \n \nReaffirming its resolution 70/1 of 25 September 2015, entitled \u201cTransforming \nour world: the 2030 Agenda for Sustainable Development\u201d, in which it adopted a \ncomprehensive, far-reaching and people-centred set of universal and transformative \nSustainable Development Goals and targets, its commitment to working tirelessly for \nthe full implementation of the Agenda by 2030, its recognition that eradicating \npoverty in all its forms and dimensions, including extreme poverty, is the greatest \nglobal challenge and an indispensable requirement for sustainable development, its \ncommitment to achieving sustainable development in its three dimensions \u2013 \neconomic, social and environmental \u2013 in a balanced and integrated manner, and to \nbuilding upon the achievements of the Millennium Development Goals and seeking \nto address their unfinished business,  \n \nRecognizing that multilingualism, as a core value of the Organization, \ncontributes to the achievement of the goals of the United Nations, as set out in \nArticle 1 of the Charter of the United Nations,  \n \nRecognizing also that the United Nations pursues multilingualism as a means of \npromoting, protecting and preserving diversity of languages and cultures globally,  \n \nReaffirming its resolutions 53/199 of 15 December 1998 and 61/185 of \n20 December 2006 on the proclamation of international years, and Economic and \nSocial Council resolution 1980/67 of 25 July 1980 on international years and \nanniversaries, in particular paragraphs 1 to 10 of the annex thereto on the agreed \ncriteria for the proclamation of international years, as well as paragraphs 13 and 14, \nin which it is stated that an international year should not be proclaimed before the \nbasic arrangements for its organization and financing have been made, \n \nReaffirming also its resolution 76/268 of 10 June 2022 on multilingualism, in \nwhich it encouraged the Secretary-General to enhance support for non-official \n\nA/RES/78/312 \nWorld Kiswahili Language Day\n \n24-12316\n2/2 \n \nlanguages spoken throughout the world, in a cost-neutral manner, with the aim of \ninforming and raising awareness of the history, culture and use of those languages,  \n \nRecalling resolution 41C/53 adopted by the General Conference of the United \nNations Educational, Scientific and Cultural Organization on 23 November 2021, in \nwhich it proclaimed 7 July of each year as World Kiswahili Language Day, 1  \n \nNoting that Kiswahili is among the 10 most widely spoken languages in the \nworld, with more than 200 million speakers, being the lingua franca in many countries \nwithin East, Central and Southern Africa as well as the Middle East, and recognizing \nthe role it plays in promoting peace, unity and cultural diversity, creating awareness \nand fostering dialogues among peoples,  \n \nTaking note of the approval and adoption of Kiswahili as an official and working \nlanguage of the African Union, the Southern African Development Community and \nthe East African Community as an important tool in fostering regional integration,  \n \nRecognizing the need to raise awareness of the multiple economic and cultural \nvalues of the Kiswahili language and its contribution as a catalyst for peace, unity \nand socioeconomic development, with a view to implementing the 2030 Agenda for \nSustainable Development,  \n \n1. \nDecides to proclaim 7 July of each year as World Kiswahili Language Day, \nto be observed each year beginning in 2024;  \n \n2. \nInvites all Member States, organizations and agencies of the United \nNations system, other international and regional organizations and other relevant \nstakeholders, including civil society organizations, non-governmental organizations, \nacademic institutions, the private sector and individuals, to observe World Kiswahili \nLanguage Day, as appropriate, in order to raise awareness of the history, culture and \nuse of the language;  \n \n3. \nInvites the United Nations Educational, Scientific and Cultural \nOrganization and the Department of Global Communications of the Secretariat to \nfacilitate the observance of World Kiswahili Language Day, in collaboration with \nother relevant organizations of the United Nations system, mindful of the provisions \ncontained in the annex to Economic and Social Council resolution 1980/67;  \n \n4. \nStresses that the costs of all the activities that may arise from the \nimplementation of the present resolution should be met through voluntary \ncontributions, including from the private sector, and invites all relevant stakeholders \nto contribute to and support the observance of World Kiswahili Language Day;  \n \n5. \nRequests the Secretary-General to bring the present resolution to the \nattention of all Member States, the organizations of the United Nations system and \nother relevant stakeholders, including civil society, the private sector and academia, \nfor appropriate observance. \n \n97th plenary meeting \n1 July 2024 \n \n__________________ \n \n1  United Nations Educational, Scientific and Cultural Organization, Records of the General \nConference, Forty-first Session, Paris, 9\u201324 November 2021, vol. 1, Resolutions, sect. VIII, \nresolution 53. \n",
  "paragraphs": {
    "1": "Decides to proclaim 7 July of each year as World Kiswahili Language Day, to be observed each year beginning in 2024;",
    "2": "Invites all Member States, organizations and agencies of the United Nations system, other international and regional organizations and other relevant stakeholders, including civil society organizations, non-governmental organizations, academic institutions, the private sector and individuals, to observe World Kiswahili Language Day, as appropriate, in order to raise awareness of the history, culture and use of the language;",
    "3": "Invites the United Nations Educational, Scientific and Cultural Organization and the Department of Global Communications of the Secretariat to facilitate the observance of World Kiswahili Language Day, in collaboration with other relevant organizations of the United Nations system, mindful of the provisions contained in the annex to Economic and Social Council resolution 1980/67;",
    "4": "Stresses that the costs of all the activities that may arise from the implementation of the present resolution should be met through voluntary contributions, including from the private sector, and invites all relevant stakeholders to contribute to and support the observance of World Kiswahili Language Day;",
    "5": "Requests the Secretary-General to bring the present resolution to the attention of all Member States, the organizations of the United Nations system and other relevant stakeholders, including civil society, the private sector and academia, for appropriate observance."
  },
  "agenda_items": [
    "Item 124"
  ],
  "symbol_references": [
    "A/78/L.83"
  ]
}