{
  "symbol": "A/RES/73/241",
  "filename": "A_RES_73_241.pdf",
  "title": "73/241. International migration and development",
  "text": "United Nations \nA/RES/73/241\n \n \nGeneral Assembly \nDistr.: General \n18 January 2019 \n \n18-22619 (E)    220119 \n*1822619* \n \n \nSeventy-third session \nAgenda item 22 (b) \n \n \n \n \n Resolution adopted by the General Assembly \non 20 December 2018 \n \n \n \n \n[on the report of the Second Committee (A/73/540/Add.2)] \n \n \n 73/241. International migration and development \n \n \n \nThe General Assembly, \n \nRecalling its resolutions 58/208 of 23 December 2003, 59/241 of 22 December \n2004, 60/227 of 23 December 2005, 61/208 of 20 December 2006, 63/225 of \n19 December 2008, 65/170 of 20 December 2010, 67/219 of 21 December 2012, \n69/229 of 19 December 2014 and 71/237 of 21 December 2016 on international \nmigration and development, its resolution 68/4 of 3 October 2013, by which it \nadopted the Declaration of the High-level Dialogue on International Migration and \nDevelopment, its resolution 60/206 of 22 December 2005 on the facilitation and \nreduction of the cost of transfer of migrant remittances, its resolutions 62/156 of \n18 December 2007, 64/166 of 18 December 2009, 66/172 of 19 December 2011, \n68/179 of 18 December 2013, 69/167 of 18 December 2014 and 70/147 of \n17 December 2015 on the protection of migrants and its resolution 62/270 of 20 June \n2008 on the Global Forum on Migration and Development, and recalling also \nchapter X of the Programme of Action of the International Conference on Population \nand Development 1  and Commission on Population and Development resolutions \n2006/2 of 10 May 2006,2 2008/1 of 11 April 2008,3 2013/1 of 26 April 20134 and \n2014/1 of 11 April 2014,5  \n \nReaffirming its resolution 70/1 of 25 September 2015, entitled \u201cTransforming \nour world: the 2030 Agenda for Sustainable Development\u201d, in which it adopted a \ncomprehensive, far-reaching and people-centred set of universal and transformative \nSustainable Development Goals and targets, its commitment to working tirelessly for \n__________________ \n \n1  Report of the International Conference on Population and Development, Cairo, 5\u201313 September \n1994 (United Nations publication, Sales No. E.95.XIII.18), chap. I, resolution 1, annex. \n \n2  See Official Records of the Economic and Social Council, 2006, Supplement No. 5 (E/2006/25), \nchap. I, sect. B. \n \n3  Ibid., 2008, Supplement No. 5 (E/2008/25), chap. I, sect. B. \n \n4  Ibid., 2013, Supplement No. 5 (E/2013/25), chap. I, sect. B. \n \n5  Ibid., 2014, Supplement No. 5 (E/2014/25), chap. I, sect. B. \n\nA/RES/73/241 \nInternational migration and development\n \n18-22619\n2/4 \n \nthe full implementation of the Agenda by 2030, its recognition that eradicating \npoverty in all its forms and dimensions, including extreme poverty, is the greatest \nglobal challenge and an indispensable requirement for sustainable development, its \ncommitment to achieving sustainable development in its three dimensions \u2014 \neconomic, social and environmental \u2014 in a balanced and integrated manner, and to \nbuilding upon the achievements of the Millennium Development Goals and seeking \nto address their unfinished business,  \n \nReaffirming also its resolution 69/313 of 27 July 2015 on the Addis Ababa \nAction Agenda of the Third International Conference on Financing for Development, \nwhich is an integral part of the 2030 Agenda for Sustainable Development, supports \nand complements it, helps to contextualize its means of implementation targets with \nconcrete policies and actions, and reaffirms the strong political commitment to \naddress the challenge of financing and creating an enabling environment at all levels \nfor sustainable development in the spirit of global partnership and solidarity,  \n \nReaffirming further the New York Declaration for Refugees and Migrants, \nadopted at the high-level plenary meeting of the General Assembly on addressing \nlarge movements of refugees and migrants, held at United Nations Headquarters on \n19 September 2016,6  \n \nReaffirming the New Urban Agenda, which was adopted at the United Nations \nConference on Housing and Sustainable Urban Development (Habitat III), held in \nQuito from 17 to 20 October 2016,7 and recognizing the linkages between migration \nand sustainable urbanization and sustainable urban development,  \n \nReaffirming also the Paris Agreement,8 and encouraging all its parties to fully \nimplement the Agreement, and parties to the United Nations Framework Convention \non Climate Change 9  that have not yet done so to deposit their instruments of \nratification, acceptance, approval or accession, where appropriate, as soon as \npossible,  \n \nRecalling the Sendai Declaration and the Sendai Framework for Disaster Risk \nReduction 2015\u20132030, adopted at the Third United Nations World Conference on \nDisaster Risk Reduction,10 and those provisions that are applicable to migrants,  \n \nRecalling also the second High-level Dialogue on International Migration and \nDevelopment, held in New York on 3 and 4 October 2013, which addressed \nconstructively the issue of international migration and development and explored the \nopportunities and the challenges that international migration presents, including the \nprotection of the human rights of migrants and the contribution of migrants to \ndevelopment,  \n \nRecalling further the Declaration of the High-level Dialogue on International \nMigration and Development adopted on 3 October 2013 on the occasion of the \nHigh-level Dialogue,  \n \nReaffirming the Universal Declaration of Human Rights, 11  recalling the \nInternational Covenant on Civil and Political Rights, 12 the International Covenant on \nEconomic, Social and Cultural Rights,12 the International Convention on the \nElimination of All Forms of Racial Discrimination, 13  the Convention on the \n__________________ \n \n6  Resolution 71/1. \n \n7  Resolution 71/256, annex. \n \n8  Adopted under the UNFCCC in FCCC/CP/2015/10/Add.1, decision 1/CP.21. \n \n9  United Nations, Treaty Series, vol. 1771, No. 30822. \n \n10  Resolution 69/283, annexes I and II. \n \n11  Resolution 217 A (III). \n \n12  See resolution 2200 A (XXI), annex. \n \n13  United Nations, Treaty Series, vol. 660, No. 9464. \n\nInternational migration and development \nA/RES/73/241\n \n3/4\n18-22619 \n \nElimination of All Forms of Discrimination against Women,14 the Convention on the \nRights of the Child15 and the Convention on the Rights of Persons with Disabilities,16 \nand recalling also the Declaration on the Right to Development, 17  \n \nEncouraging States that have not done so to consider ratifying or acceding to \nthe International Convention on the Protection of the Rights of All Migrant Workers \nand Members of Their Families18 and to consider acceding to relevant conventions of \nthe International Labour Organization, as appropriate,  \n \nRecalling the importance of the decent work agenda of the International Labour \nOrganization, including for migrant workers, the eight fundamental Conventions of \nthat Organization and the Global Jobs Pact adopted by the International Labour \nConference at its ninety-eighth session as a general framework within which each \ncountry can formulate policy packages specific to its situation and national priorities \nin order to promote a job-intensive recovery and sustainable development,  \n \nRecognizing the valuable contribution of the Global Forum on Migration and \nDevelopment to addressing the multidimensional nature of international migration \nand promoting balanced and comprehensive approaches and dialogue on migration \nand development, and acknowledging that it has proved to be a valuable forum for \nholding frank and open discussions, including through multi-stakeholder dialogues, \nand that it has helped to build trust among participating stakeholders through the \nexchange of experiences and good practices and by virtue of its voluntary, \nintergovernmental, non-binding and informal character and the engagement of civil \nsociety actors as well as the private sector,  \n \nAcknowledging the important and complex interrelationship between \ninternational migration and development and the need to deal with the challenges and \nopportunities that migration presents to countries of origin, transit and destination, \nrecognizing that migration brings benefits and challenges to the global community, \nand confirming the importance of including the matter in relevant debates and \ndiscussions held at the global, regional and national levels, as appropriate, including \nat the level of the United Nations and other international organizations, in relation to \ndevelopment,  \n \n1. \nTakes note of the report of the Secretary-General;19  \n \n2. \nRecognizes the need to strengthen synergies between international \nmigration and development at all levels, including the global, regional, national and \nlocal levels, as appropriate;  \n \n3. \nRecommits to ensuring full respect for the human rights and fundamental \nfreedoms of all migrants, regardless of their migration status, and supporting \ncountries of origin, transit and destination in the spirit of international cooperation, \ntaking into account national circumstances;  \n \n4. \nNotes the convening of the Intergovernmental Conference to Adopt the \nGlobal Compact for Safe, Orderly and Regular Migration in Marrakech, Morocco, on \n10 and 11 December 2018;  \n__________________ \n \n14  Ibid., vol. 1249, No. 20378. \n \n15  Ibid., vol. 1577, No. 27531. \n \n16  Ibid., vol. 2515, No. 44910. \n \n17  Resolution 41/128, annex. \n \n18  United Nations, Treaty Series, vol. 2220, No. 39481. \n \n19  A/73/286. \n\nA/RES/73/241 \nInternational migration and development\n \n18-22619\n4/4 \n \n \n5. \nAlso notes that the Global Compact for Safe, Orderly and Regular \nMigration20 is the first intergovernmentally negotiated outcome, prepared under the \nauspices of the United Nations, to cover international migration in all its dimensions; \n \n6. \nRecognizes that the High-level Dialogues on International Migration and \nDevelopment have served as forums to advance discussions on the multidimensional \naspects of international migration and development in order to identify appropriate \nways and means to maximize its development benefits and minimize its negative \nimpacts;  \n \n7. \nNotes that, with the adoption of the Global Compact, the High-level \nDialogue on International Migration and Development shall be repurposed into the \nInternational Migration Review Forum, which will serve as the primary \nintergovernmental global platform for Member States to discuss and share progress \non the implementation of all aspects of the Global Compact, including as it relates to \nthe 2030 Agenda for Sustainable Development, 21 and with the participation of all \nrelevant stakeholders, and that the Forum is to be held every four years, beginning \nin 2022;  \n \n8. \nDecides to convene, in the first half of 2019, a one-day high-level debate \non international migration and development, under the auspices of the President of \nthe General Assembly, in lieu of the 2019 High-level Dialogue, to inform the \nhigh-level political forum on sustainable development, which will review the Goals \nand targets relevant to migration of the 2030 Agenda for Sustainable Development, \ntaking into consideration the outcomes of other processes related to international \nmigration and development;  \n \n9. \nWelcomes the decision of the Secretary-General to establish a United \nNations network on migration;  \n \n10. Requests the Secretary-General to submit to the General Assembly, at its \nseventy-fifth session, a report on the implementation of the present resolution;  \n \n11. \nDecides to include in the provisional agenda of its seventy-fifth session, \nunder the item entitled \u201cGlobalization and interdependence\u201d, the sub-item entitled \n\u201cInternational migration and development\u201d.  \n \n62nd plenary meeting  \n20 December 2018 \n \n__________________ \n \n20 Resolution 73/195, annex. \n \n21  Resolution 70/1. \n",
  "paragraphs": {
    "1": "Takes note of the report of the Secretary-General;19",
    "2": "Recognizes the need to strengthen synergies between international migration and development at all levels, including the global, regional, national and local levels, as appropriate;",
    "3": "Recommits to ensuring full respect for the human rights and fundamental freedoms of all migrants, regardless of their migration status, and supporting countries of origin, transit and destination in the spirit of international cooperation, taking into account national circumstances;",
    "4": "Notes the convening of the Intergovernmental Conference to Adopt the Global Compact for Safe, Orderly and Regular Migration in Marrakech, Morocco, on 10 and 11 December 2018;",
    "5": "Also notes that the Global Compact for Safe, Orderly and Regular Migration20 is the first intergovernmentally negotiated outcome, prepared under the auspices of the United Nations, to cover international migration in all its dimensions;",
    "6": "Recognizes that the High-level Dialogues on International Migration and Development have served as forums to advance discussions on the multidimensional aspects of international migration and development in order to identify appropriate ways and means to maximize its development benefits and minimize its negative impacts;",
    "7": "Notes that, with the adoption of the Global Compact, the High-level Dialogue on International Migration and Development shall be repurposed into the International Migration Review Forum, which will serve as the primary intergovernmental global platform for Member States to discuss and share progress on the implementation of all aspects of the Global Compact, including as it relates to the 2030 Agenda for Sustainable Development, 21 and with the participation of all relevant stakeholders, and that the Forum is to be held every four years, beginning in 2022;",
    "8": "Decides to convene, in the first half of 2019, a one-day high-level debate on international migration and development, under the auspices of the President of the General Assembly, in lieu of the 2019 High-level Dialogue, to inform the high-level political forum on sustainable development, which will review the Goals and targets relevant to migration of the 2030 Agenda for Sustainable Development, taking into consideration the outcomes of other processes related to international migration and development;",
    "9": "Welcomes the decision of the Secretary-General to establish a United Nations network on migration;",
    "10": "Requests the Secretary-General to submit to the General Assembly, at its seventy-fifth session, a report on the implementation of the present resolution;",
    "11": "Decides to include in the provisional agenda of its seventy-fifth session, under the item entitled \u201cGlobalization and interdependence\u201d, the sub-item entitled \u201cInternational migration and development\u201d."
  },
  "agenda_items": [
    "Item 22"
  ],
  "symbol_references": []
}