{
  "symbol": "A/RES/80/220",
  "filename": "A_RES_80_220.pdf",
  "title": "80/220. Situation of human rights in the Democratic People\u2019s Republic of Korea",
  "text": "United Nations \nA/RES/80/220\n \nGeneral Assembly \nDistr.: General \n22 December 2025 \n25-20980 (E) \n*2520980* \n \n \nEightieth session \nAgenda item 71 (c) \nPromotion and protection of human rights: human \nrights situations and reports of special rapporteurs \nand representatives \n \n \n \n \n Resolution adopted by the General Assembly \non 18 December 2025 \n \n \n[on the report of the Third Committee (A/80/545, para. 5)] \n \n \n 80/220. Situation of human rights in the Democratic People\u2019s Republic \nof Korea \n \n \n \nThe General Assembly, \n \nReaffirming that all States have an obligation to respect, protect and fulfil human \nrights and fundamental freedoms and to fulfil the obligations that they have \nundertaken under the various international instruments, \n \nRecalling all previous resolutions adopted by the General Assembly, the \nCommission on Human Rights and the Human Rights Council on the situation of \nhuman rights in the Democratic People\u2019s Republic of Korea, including Assembly \nresolution 79/181 of 17 December 2024 and Council resolution 58/17 of 3 April \n2025,1 and mindful of the need for the international community to strengthen its \ncoordinated efforts aimed at achieving the implementation of those resolutions, \n \nDeeply concerned at the grave human rights situation, the pervasive culture of \nimpunity and the lack of accountability for human rights violations and abuses in the \nDemocratic People\u2019s Republic of Korea, \n \nReiterating the importance of following up on the recommendations contained \nin the report of the commission of inquiry on human rights in the Democratic People\u2019s \nRepublic of Korea,2 and reiterating also its grave concern at the detailed findings \ncontained therein and the fact that the majority of the 19 recommendations made by \nthe commission of inquiry to the Democratic People\u2019s Republic of Korea have not \n_______________ \n \n1 See Official Records of the General Assembly, Eightieth Session, Supplement No. 53 (A/80/53), \nchap. V, sect. A. \n \n2 A/HRC/25/63. \n\nA/RES/80/220 \nSituation of human rights in the Democratic People\u2019s Republic \nof Korea\n \n25-20980\n2/14 \n \nbeen implemented, according to the report of the United Nations High Commissioner \nfor Human Rights containing an update on the situation of human rights since 2014, 3 \n \nRecalling the responsibility of the Democratic People\u2019s Republic of Korea to \nprotect its population from crimes against humanity, and recalling also that the \ncommission of inquiry urged the leadership of the Democratic People\u2019s Republic of \nKorea to prevent and suppress crimes against humanity and to ensure that perpetrators \nare prosecuted and brought to justice in accordance with international law, \n \nTaking note of the report of the Special Rapporteur on the situation of human \nrights in the Democratic People\u2019s Republic of Korea, 4 regretting that the Special \nRapporteur has still not been allowed to visit the country and that she has received no \ncooperation from the authorities of the Democratic People\u2019s Republic of Korea, and \ntaking note also of the comprehensive report of the Secretary-General on the situation \nof human rights in the Democratic People\u2019s Republic of Korea submitted in \naccordance with resolution 79/181,5 \n \nMindful that the Democratic People\u2019s Republic of Korea is a Party to the \nInternational Covenant on Civil and Political Rights, 6 the International Covenant on \nEconomic, Social and Cultural Rights,7 the Convention on the Rights of the Child, 8 \nthe Convention on the Elimination of All Forms of Discrimination against Women 9 \nand the Convention on the Rights of Persons with Disabilities, 10  and that the \nDemocratic People\u2019s Republic of Korea last submitted periodic reports to the Human \nRights Committee and the Committee on Economic, Social and Cultural Rights on \n20 March 2000 and 12 April 2002, respectively, and urging full implementation of \nthese Conventions and of the recommendations contained in the concluding \nobservations from treaty body reviews and the submission of all overdue periodic \nreports to the respective treaty bodies, in particular the fourth periodic review to the \nHuman Rights Committee under the list of issues prior to reporting sent by the \nCommittee, \n \nTaking note with appreciation of the submission by the Government of the \nDemocratic People\u2019s Republic of Korea in December 2023 of the written replies 11 to \nthe list of issues sent by the Committee on the Rights of Persons with Disabilities, 12 \nand the Committee\u2019s findings in September 2025 on the implementation by the \nDemocratic People\u2019s Republic of Korea of the Convention on the Rights of Persons \nwith Disabilities,  \n \nRecalling the participation of the Democratic People\u2019s Republic of Korea in the \nfourth universal periodic review process, and emphasizing the importance of the \nimplementation of the recommendations in order to address the human rights situation \nin the country, \n \nNoting again with regret that independent civil society organizations cannot \noperate in the Democratic People\u2019s Republic of Korea and that, as a result, no civil \nsociety organization based in the Democratic People\u2019s Republic of Korea is able to \n_______________ \n \n3 A/HRC/60/58. \n \n4 A/80/149. \n \n5 A/80/312. \n \n6 See resolution 2200 A (XXI), annex. \n \n7 Ibid. \n \n8 United Nations, Treaty Series, vol. 1577, No. 27531. \n \n9 Ibid., vol. 1249, No. 20378. \n \n10 Ibid., vol. 2515, No. 44910. \n \n11 CRPD/C/PRK/RQ/1. \n \n12 CRPD/C/PRK/Q/1. \n\nSituation of human rights in the Democratic People\u2019s Republic \nof Korea \nA/RES/80/220\n \n3/14\n25-20980 \n \nindependently monitor, document and report on human rights violations in the \ncountry, \n \nRecalling the collaboration established between the Government of the \nDemocratic People\u2019s Republic of Korea and the Office of the United Nations High \nCommissioner for Human Rights in providing human rights briefings to a small \nnumber of government officials in Geneva in May 2019, November 2024 and August \n2025, and urging that such technical cooperation be resumed and broadened, \n \nStressing the importance of extending the cooperation of the Government of the \nDemocratic People\u2019s Republic of Korea to the field-based structure of the Office of \nthe United Nations High Commissioner for Human Rights in the region, \n \nNoting the record of cooperation between the Government of the Democratic \nPeople\u2019s Republic of Korea and the United Nations Development Programme, the \nWorld Food Programme, the United Nations Children\u2019s Fund, the United Nations \nPopulation Fund, the Food and Agriculture Organization of the United Nations and \nthe World Health Organization in order to improve the food security, nutrition, health, \nwater and sanitation situation in the country, noting with appreciation the role of \ninternational aid, and encouraging the Government of the Democratic People\u2019s \nRepublic of Korea to ensure that assistance benefiting persons in need can be \nresumed, \n \nNoting with grave concern the adverse impact of the humanitarian situation on \nthe human rights situation in the Democratic People\u2019s Republic of Korea, \n \nNoting with grave concern also the exacerbation of the humanitarian situation \nin the Democratic People\u2019s Republic of Korea due to the policies and practices of the \nGovernment, and their adverse impacts, including malnutrition, resulting from \ngovernment limits on access to adequate food, health services, water and sanitation, \n \nCondemning the Democratic People\u2019s Republic of Korea for continuing to divert \na disproportionate amount of its resources into military spending and the pursuit of \nits unlawful nuclear weapons and ballistic missile programmes over the welfare of its \npeople, and emphasizing the necessity for the Democratic People\u2019s Republic of Korea \nto respect and ensure the welfare and inherent dignity of the people in the country, as \nreferred to by the Security Council in its resolutions 2321 (2016) of 30 November \n2016, 2371 (2017) of 5 August 2017, 2375 (2017) of 11 September 2017 and 2397 \n(2017) of 22 December 2017, \n \nNoting with concern the government restrictions that have compelled the \ninternational staff of humanitarian agencies to leave the country and suspend \nassistance projects and the effect that these restrictions may have had on the levels of \nmalnutrition and access to health services, water and sanitation, \n \nUrging the Government of the Democratic People\u2019s Republic of Korea to allow \nfull, safe, rapid and unhindered international access for the purpose of carrying out \nindependent needs assessments, to inform any decision to return international staff to \nthe country, \n \nStressing that the human rights situation in the Democratic People\u2019s Republic of \nKorea, including with respect to gender equality and the rights of all women and girls, \nincluding adolescent girls, is intrinsically linked to international peace and security, \nsince the Government of the Democratic People\u2019s Republic of Korea funds its \nunlawful nuclear weapons and ballistic missile programmes through human rights \nviolations and abuses, \n \nExpressing grave concern at the institutionalized use of forced labour, including \nthe exploitation of workers sent abroad, and urging all States to comply with \n\nA/RES/80/220 \nSituation of human rights in the Democratic People\u2019s Republic \nof Korea\n \n25-20980\n4/14 \n \nSecurity Council resolutions 2375 (2017) and 2397 (2017) regarding repatriation and \nprohibition of work authorizations, \n \nTaking note of the ongoing strategic framework for cooperation between the \nUnited Nations and the Government of the Democratic People\u2019s Republic of Korea \nand the Government\u2019s commitment in accordance with the principles, goals and \ntargets of the Sustainable Development Goals13 and in line with its commitments to \ninternational agreements and conventions, \n \nStressing again with grave concern the ever-growing urgency and importance \nof the issue of international abductions, which involves a serious violation of human \nrights, and of the immediate return of all abductees, as they and their family members \nare ageing and there is no time to lose, expressing grave concern at the long years of \nsevere suffering experienced by abductees and their families as a result of their forced \nor involuntary separation, and the lack of any concrete or positive action by the \nDemocratic People\u2019s Republic of Korea, notably since the investigations on all the \nJapanese nationals commenced on the basis of the government-level consultations \nheld between the Democratic People\u2019s Republic of Korea and Japan in May 2014 and \nthe identical and non\u2011substantive replies by the Democratic People\u2019s Republic of \nKorea to the numerous communications transmitted by the Working Group on \nEnforced or Involuntary Disappearances and the Working Group on Arbitrary \nDetention, and strongly demanding again that the Democratic People\u2019s Republic of \nKorea sincerely listen to the voices of the victims and their families to address all \nallegations of enforced disappearances, clarify the fate and whereabouts of \ndisappeared persons and faithfully provide accurate, detailed and full information \npromptly to the families of the victims, and resolve immediately all issues relating to \nall abductees, in particular the immediate return of all abductees of Japan and the \nRepublic of Korea, \n \nNoting with concern the allegations of continued violations of the human rights \nof unrepatriated prisoners of war and their descendants, and the continued failure of \nthe Democratic People\u2019s Republic of Korea in its obligations to repatriate under the \nGeneva Convention relative to the Treatment of Prisoners of War, of \n12 August 1949, 14  and noting with concern also the issue of nationals of other \nMember States arbitrarily detained in the Democratic People\u2019s Republic of Korea with \nno information available regarding their health or the conditions of their detention, \n \nStressing the urgency and importance of the issue of separated families, \nincluding affected Koreans worldwide, and urging the resumption of the reunions of \nseparated families, considering the advanced age of the family members concerned, \nincluding the implementation of the commitments made on this issue at the inter-\nKorean summit of 19 September 2018 to strengthen humanitarian cooperation to \nfundamentally resolve the issue of separated families, to end their forced separation, \nand allow permanent regular reunions and contact between separated families, \nincluding through meetings at an easily accessible location and regular facility, \nregular written correspondence, video reunions and the exchange of video messages, \nin accordance with relevant Security Council resolutions, \n \nNoting with concern the possible negative impact on the human rights situation, \nincluding that of separated families, following the announcement of the Democratic \nPeople\u2019s Republic of Korea in January 2024 that it would no longer pursue \nreunification with the Republic of Korea, \n_______________ \n \n13 See resolution 70/1. \n \n14 United Nations, Treaty Series, vol. 75, No. 972. \n\nSituation of human rights in the Democratic People\u2019s Republic \nof Korea \nA/RES/80/220\n \n5/14\n25-20980 \n \n \nNoting the gradual reopening of the country\u2019s borders, and calling upon the \nGovernment of the Democratic People\u2019s Republic of Korea to meet its responsibilities \nin facilitating the further return on a non\u2011discriminatory basis of the diplomatic \ncommunity, agencies, funds and programmes of the United Nations system, and civil \nsociety organizations, as well as for the resumption of a meaningful dialogue with the \ninternational community, \n \nEncouraging diplomatic efforts, and stressing the importance of dialogue and \nengagement, including inter-Korean dialogue, to seek improvement of the human \nrights and the humanitarian situation in the country, \n \nWelcoming the efforts of the Secretary-General to contribute to improving inter-\nKorean relations and promoting reconciliation and stability on the Korean Peninsula \nand the well-being of the Korean people, \n \n1. \nCondemns in the strongest terms the long-standing and ongoing \nsystematic, widespread and gross violations of human rights in and by the Democratic \nPeople\u2019s Republic of Korea, including those that may amount to crimes against \nhumanity according to the commission of inquiry on human rights in the Democratic \nPeople\u2019s Republic of Korea, established by the Human Rights Council in its resolution \n22/13 of 21 March 2013,15 and those identified by the group of independent experts \non accountability for human rights violations in the Democratic People\u2019s Republic of \nKorea,16 established pursuant to Council resolution 31/18 of 23 March 2016,17 and by \nthe Office of the United Nations High Commissioner for Human Rights, including its \nfield-based structure in Seoul, and the continuing impunity for such violations; \n \n2. \nExpresses its very serious concern about: \n \n(a) \nContinuing reports of persistent violations of human rights, including the \ndetailed findings made by the commission of inquiry in its report, by the Office of the \nUnited Nations High Commissioner for Human Rights in its ongoing monitoring and \ndocumentation work and by the Special Rapporteur on the situation of human rights \nin the Democratic People\u2019s Republic of Korea, such as: \n \n(i) \nTorture and other cruel, inhuman or degrading treatment or punishment, \nincluding inhuman conditions of detention; all forms of sexual and gender-based \nviolence, including rape, in particular against women and girls; extrajudicial, \nsummary and arbitrary executions; the imposition of the death penalty for \npolitical and religious reasons, which is now more widely allowed by law and \nimplemented in practice; public executions; extrajudicial and arbitrary \ndetention; the absence of fair trial guarantees and the rule of law, including an \nindependent and corruption-free judiciary; and collective punishments \nextending up to three generations; \n \n(ii) The existence of an extensive penal system including political prison \ncamps, re-education camps, labour training camps, labour training centres, \ndetention centres, holding centres and waiting rooms, where a vast number of \npersons are deprived of their liberty and subjected to deplorable conditions, \nincluding forced labour, and where alarming violations of human rights are \nperpetrated; \n \n(iii) Enforced and involuntary disappearances of persons by arrest, detention \nor abduction against their will; refusal to disclose the fate and whereabouts of \n_______________ \n \n15 See Official Records of the General Assembly, Sixty-eighth Session, Supplement No. 53 \n(A/68/53), chap. IV, sect. A. \n \n16 See A/HRC/34/66/Add.1. \n \n17 See Official Records of the General Assembly, Seventy-first Session, Supplement No. 53 \n(A/71/53), chap. IV, sect. A.  \n\nA/RES/80/220 \nSituation of human rights in the Democratic People\u2019s Republic \nof Korea\n \n25-20980\n6/14 \n \nthe persons concerned; and refusal to acknowledge the deprivation of their \nliberty, which places them outside the protection of the law and which has \ninflicted severe suffering on them and their families; \n \n(iv) The forcible transfer of populations and the limitations imposed on persons \nwishing to move freely within the country or abroad, with even greater \nrestrictions now compared to a decade ago, including harming or punishing \nthose who leave or try to leave the country without permission, or their families; \n \n(v) \nThe situation of refugees and asylum-seekers expelled or returned to the \nDemocratic People\u2019s Republic of Korea, including where the Government of the \nDemocratic People\u2019s Republic of Korea exerts pressure on returning States to \neffectuate such returns, and retaliation by the Government of the Democratic \nPeople\u2019s Republic of Korea against its citizens who have been repatriated, \nincluding punishment by internment, torture, other cruel, inhuman or degrading \ntreatment or punishment, sexual and gender-based violence, or the death penalty, \nand in this regard strongly urges all Member States to respect the fundamental \nprinciple of non\u2011refoulement, to take action to counter acts of transnational \nrepression by the Democratic People\u2019s Republic of Korea, to treat humanely \nthose who seek refuge and to ensure unhindered access to the United Nations \nHigh Commissioner for Refugees and his Office, and the Office of the United \nNations High Commissioner for Human Rights, with a view to protecting the \nhuman rights of those who seek refuge, and to refrain from sharing information \nabout the contacts and conduct of refugees, asylum-seekers and other citizens \nof the Democratic People\u2019s Republic of Korea with the Government of the \nDemocratic People\u2019s Republic of Korea, and once again urges States Parties to \ncomply with their obligations under the 1951 Convention relating to the Status \nof Refugees18 and the 1967 Protocol thereto19 in relation to refugees from the \nDemocratic People\u2019s Republic of Korea who are covered by those instruments, \nas well as under the Convention against Torture and Other Cruel, Inhuman or \nDegrading Treatment or Punishment20 and the Protocol to Prevent, Suppress and \nPunish Trafficking in Persons, Especially Women and Children, supplementing \nthe United Nations Convention against Transnational Organized Crime; 21 \n \n(vi) All-pervasive and severe restrictions, including an absolute monopoly on \ninformation and total control over organized social life, further tightened by \nrecent laws which provide for severe punishments, including the death penalty, \nnamely the Law on Rejecting Reactionary Thought and Culture (2020), the \nYouth Education Guarantee Law (2021) and the Law on Protecting the \nPyongyang Cultural Language (2023), on the rights to freedom of thought, \nconscience, religion or belief, opinion and expression, peaceful assembly and \nassociation, including the freedom to seek, receive and impart information and \nideas of all kinds, regardless of frontiers, the right not to be subjected to arbitrary \nor unlawful interference with individual privacy, torture and other cruel, \ninhuman or degrading treatment or punishment, or imprisonment of individuals \nexercising their rights to freedom of opinion and expression and religion or \nbelief, and the right of everyone, including women, to take part without \nunreasonable restriction in the conduct of public affairs, directly or through \nfreely chosen representatives, of their country; \n \n(vii) Violations of economic, social and cultural rights, exacerbated by the \ncontinued border restrictions of the Democratic People\u2019s Republic of Korea, \n_______________ \n \n18 United Nations, Treaty Series, vol. 189, No. 2545. \n \n19 Ibid., vol. 606, No. 8791. \n \n20 Ibid., vol. 1465, No. 24841. \n \n21 Ibid., vol. 2237, No. 39574. \n\nSituation of human rights in the Democratic People\u2019s Republic \nof Korea \nA/RES/80/220\n \n7/14\n25-20980 \n \nwhich have led to food insecurity, severe hunger, malnutrition, widespread \nhealth problems and other hardship for the population in the Democratic \nPeople\u2019s Republic of Korea; \n \n(viii) Violations of the human rights and fundamental freedoms of all women \nand girls, including unequal access to employment and discriminatory laws and \nregulations, domestic violence, as well as the creation of internal conditions that \nforce women and girls to leave the country, making them extremely vulnerable \nto trafficking in persons for the purpose of sexual exploitation, forced labour, \ndomestic servitude or forced marriage, and their subjection to sexual and \ngender-based discrimination and violence, including in the political and social \nspheres and by law enforcement officials, as well as throughout the entire penal \nsystem, including through forced abortions, invasive body cavity searches and \nother forms of sexual and gender-based violence; \n \n(ix) Violations of the human rights and fundamental freedoms of children, in \nparticular the continued lack of access to basic economic, social and cultural \nrights for many children, and notes the particularly vulnerable situation faced \nby returned or repatriated children, children without housing, children with \ndisabilities, children whose parents are detained, deceased or otherwise absent, \nchildren living in detention or in institutions and children in conflict with the \nlaw, and further notes with concern the reports of harsh and disproportionate \npunishment inflicted upon children; \n \n(x) \nViolations of the human rights and fundamental freedoms of persons with \ndisabilities, especially violations involving the use of collective camps and \ncoercive measures that target the rights of persons with disabilities to decide \nfreely and responsibly on the number and spacing of their children and \nallegations of the possible use of persons with disabilities in medical testing, \nforced relocation to rural areas and separation of children with disabilities from \ntheir parents; \n \n(xi) Widespread use of forced labour,\n22  which has become deeply \ninstitutionalized, and violations of workers\u2019 rights, including the right to \nfreedom of association and effective recognition of the right to collective \nbargaining, the right to strike as defined by the obligations of the Democratic \nPeople\u2019s Republic of Korea under the International Covenant on Economic, \nSocial and Cultural Rights, and the prohibition of the economic exploitation of \nchildren and of any harmful or hazardous work of children as defined by the \nobligations of the Democratic People\u2019s Republic of Korea under the Convention \non the Rights of the Child, as well as the exploitation of workers sent abroad \nfrom the Democratic People\u2019s Republic of Korea to work under conditions that \namount to forced labour, often for the purpose of generating income for the \nGovernment, and emphasizing the importance, in order to avoid any risk of \nMember States contributing to practices that may be inconsistent with \ninternational human rights standards, including those associated with reports of \nforced labour involving workers sent abroad by the Government of the \nDemocratic People\u2019s Republic of Korea, of full implementation of the \nrequirement that nationals of the Democratic People\u2019s Republic of Korea \nearning income overseas be repatriated, subject to applicable national and \ninternational law, as soon as possible pursuant to paragraph 8 of Security \nCouncil resolution 2397 (2017), the provision of final reports as soon as possible \npursuant to the same resolution and the prohibition on providing work \n_______________ \n \n22 See Office of the United Nations High Commissioner for Human Rights, Forced Labour by the \nDemocratic People\u2019s Republic of Korea, available at www.ohchr.org/en/documents/country-\nreports/forced-labour-democratic-peoples-republic-korea. \n\nA/RES/80/220 \nSituation of human rights in the Democratic People\u2019s Republic \nof Korea\n \n25-20980\n8/14 \n \nauthorizations pursuant to paragraph 17 of resolution 2375 (2017), and urges the \nDemocratic People\u2019s Republic of Korea to promote, respect and protect the \nhuman rights of workers, including workers repatriated to the Democratic \nPeople\u2019s Republic of Korea; \n \n(xii) Discrimination based on the songbun system, which classifies people on \nthe basis of State-assigned social class and birth and also includes consideration \nof political opinions and religion, and the practice of guilt by association; \n \n(b) \nThe continued refusal of the Government of the Democratic People\u2019s \nRepublic of Korea to extend an invitation to the Special Rapporteur on the situation \nof human rights in the Democratic People\u2019s Republic of Korea, to engage and give \nconsideration to the reports and recommendations of the Special Rapporteur, or to \nextend cooperation to the Special Rapporteur and several other United Nations special \nprocedures, in accordance with their terms of reference, as well as to other United \nNations human rights mechanisms; \n \n(c) \nThe continued lack of acknowledgement by the Government of the \nDemocratic People\u2019s Republic of Korea of the grave human rights situation in the \ncountry and its consequential lack of action to report on the state of implementation \nof the recommendations contained in the outcome of its first, 23 second,24 third25 and \nfourth 26  universal periodic reviews and to give consideration to the concluding \nobservations of the treaty bodies; \n \n3. \nCondemns the systematic abduction, denial of repatriation and subsequent \nenforced disappearance of persons, including those from other Member States, on a \nlarge scale and as a matter of State policy, including beyond the borders of the \nDemocratic People\u2019s Republic of Korea, as well as denial of repatriation of prisoners \nof war, and in this regard strongly urges the Government of the Democratic People\u2019s \nRepublic of Korea to engage in constructive dialogues with the parties concerned and \nto urgently resolve these issues of international grave concern, by clarifying their \nwhereabouts in good faith and with credibility and transparency, including by taking \nconcrete measures towards the realization of the immediate return of all abductees, \ndetainees and unrepatriated prisoners of war, and in relevant cases to return the \nremains of the deceased, including those of deceased service personnel; \n \n4. \nUnderscores its very serious concern regarding reports of torture and other \ncruel, inhuman or degrading treatment or punishment, summary executions, arbitrary \ndetention, abductions and other forms of human rights violations and abuses that the \nDemocratic People\u2019s Republic of Korea commits against citizens of other Member \nStates within and outside of its territory, and urges the Democratic People\u2019s Republic \nof Korea to disclose all relevant information to bereaved families and relevant \nentities; \n \n5. \nExpresses its very deep concern about the prevalence of chronic and acute \nmalnutrition, in particular among persons in the most vulnerable situations, including \npregnant and lactating women and adolescent girls, children, persons with disabilities, \nolder persons and prisoners, including throughout the entire penal system and in all \nplaces of detention, which is exacerbated by a lack of access to basic services, \nincluding healthcare, clean water, sanitation and hygiene services, structural \nweaknesses in agricultural production that result in shortages of diversified food, \nlimitations in the capacity of the Government to respond to natural disasters and \ngovernment policies that limit access to and availability of adequate food, including \n_______________ \n \n23 A/HRC/13/13. \n \n24 A/HRC/27/10. \n \n25 A/HRC/42/10. \n \n26 A/HRC/58/11. \n\nSituation of human rights in the Democratic People\u2019s Republic \nof Korea \nA/RES/80/220\n \n9/14\n25-20980 \n \nthrough restrictions on the cultivation of and trade in foodstuffs and severe border \nrestrictions, and urges the Government of the Democratic People\u2019s Republic of Korea \nto end such harmful policies and practices and remove obstacles to the return of \ninternational donor and humanitarian agencies and allow them access to people in \nvulnerable situations in order to implement humanitarian assistance programmes, \nmonitored in a manner consistent with international standards; \n \n6. \nWelcomes the latest report to the Human Rights Council of the Special \nRapporteur on the situation of human rights in the Democratic People\u2019s Republic of \nKorea;27 \n \n7. \nReiterates its appreciation for the report of the group of independent \nexperts on accountability for human rights violations in the Democratic People\u2019s \nRepublic of Korea,28 established pursuant to Human Rights Council resolution 31/18, \nincluding options to seek accountability and secure truth and justice for all victims; \n \n8. \nWelcomes the latest report of the United Nations High Commissioner for \nHuman Rights29 on steps taken pursuant to Human Rights Council resolutions 34/24 \nof 24 March 2017,30 40/20 of 22 March 201931 and 46/17 of 23 March 2021,32 and \nalso welcomes Council resolutions 52/28 of 4 April 2023,33 55/21 of 4 April 202434 \nand 58/17, which continue to strengthen the capacity of the Office of the United \nNations High Commissioner for Human Rights, including its field-based structure in \nSeoul, to allow the implementation of relevant recommendations made by the group \nof independent experts on accountability aimed at strengthening current monitoring \nand documentation efforts, establishing a central repository for information and \nevidence and having experts in legal accountability assess all information and \ntestimonies with a view to developing possible strategies to be used in any future \naccountability process; \n \n9. \nExpresses strong support for the work being undertaken by the Office of \nthe United Nations High Commissioner for Human Rights, including its field-based \nstructure in Seoul, in furtherance of Human Rights Council resolution 58/17, with the \naim of ensuring accountability for suspected violations of international law \ncommitted in and by the Democratic People\u2019s Republic of Korea, and calls upon all \nStates to support such efforts; \n \n10. Reiterates its appreciation for the work of the commission of inquiry and \nacknowledges the importance of its report and the finding that the body of testimony \ngathered and the information received provide reasonable grounds to believe that \ncrimes against humanity have been committed in the Democratic People\u2019s Republic \nof Korea, pursuant to policies established at the highest level of the State for decades \nand by institutions under the effective control of its leadership, which was confirmed \nby the United Nations High Commissioner for Human Rights in the report to the \nHuman Rights Council submitted pursuant to resolutions 52/28 and 55/21; \n \n11. \nWelcomes the comprehensive report of the United Nations High \nCommissioner for Human Rights containing an update on the situation of human \nrights in the Democratic People\u2019s Republic of Korea since 2014, in which it was found \n_______________ \n \n27 A/HRC/58/65. \n \n28 A/HRC/34/66/Add.1. \n \n29 A/HRC/58/61. \n \n30 See Official Records of the General Assembly, Seventy-second Session, Supplement No. 53 \n(A/72/53), chap. IV, sect. A. \n \n31 Ibid., Seventy-fourth Session, Supplement No. 53 (A/74/53), chap. IV, sect. A. \n \n32 Ibid., Seventy-sixth Session, Supplement No. 53 (A/76/53), chap. V, sect. A.  \n \n33 Ibid., Seventy-eighth Session, Supplement No. 53 (A/78/53), chap. V, sect. A. \n \n34 Ibid., Seventy-ninth Session, Supplement No. 53 (A/79/53), chap. IV, sect. A. \n\nA/RES/80/220 \nSituation of human rights in the Democratic People\u2019s Republic \nof Korea\n \n25-20980\n10/14 \n \nthat the overall human rights situation had not improved since 2014 and in many \ninstances had degraded, and urges the Democratic People\u2019s Republic of Korea and \nMember States to fulfil the recommendations contained therein; \n \n12. Expresses its concern at the failure of the authorities of the Democratic \nPeople\u2019s Republic of Korea to hold accountable those responsible for human rights \nviolations, including violations which the commission of inquiry has said may amount \nto crimes against humanity, and encourages the international community to cooperate \nwith accountability efforts and to ensure that such crimes do not remain unpunished; \n \n13. Encourages the Security Council to take appropriate action to ensure \naccountability, including through consideration of referral of the situation in the \nDemocratic People\u2019s Republic of Korea to the International Criminal Court and \nconsideration of further targeted sanctions against those responsible for human rights \nviolations that the commission of inquiry has said may constitute crimes against \nhumanity; \n \n14. Welcomes the resumption of the Security Council discussion on the \nsituation in the Democratic People\u2019s Republic of Korea and reiterates its appreciation \nto the United Nations High Commissioner for Human Rights and the Special \nRapporteur on the situation of human rights in the Democratic People\u2019s Republic of \nKorea for briefing the Council on the country\u2019s human rights situation, in the light of \nthe serious concerns expressed in the present resolution, and looks forward to its \ncontinued and more active engagement on this matter; \n \n15. Encourages the continuing endeavours of the Office of the United Nations \nHigh Commissioner for Human Rights, including through its field-based structure in \nSeoul, in organizing consultations and outreach activities with victims and survivors, \naffected communities and other relevant stakeholders with a view to ensuring a \nvictim- and survivor-centred approach to accountability, compiling a central \nrepository to consolidate the information and evidence relating to suspected violations \nof international law, and assessing all such evidence and information in order to \ndevelop possible strategies to be used in any future accountability process, and also \nencourages the cooperation of the Office with a wide range of stakeholders in the \nprocurement of evidence that could be used in future criminal proceedings; \n \n16. Calls upon Member States to support efforts to strengthen legal \naccountability mechanisms, including the compilation of evidence for future criminal \nproceedings and the establishment of a central repository;  \n \n17. Also calls upon Member States to continue to support the Office of the \nUnited Nations High Commissioner for Human Rights, including its field-based \nstructure in Seoul, for the endeavours listed in paragraph 15 above;  \n \n18. Further calls upon Member States to undertake to ensure that the field-\nbased structure of the Office of the United Nations High Commissioner for Human \nRights can function with independence, has sufficient resources and support to fulfil \nits mandate, enjoys full cooperation with relevant Member States and is not subjected \nto any reprisals or threats; \n \n19. Calls upon Member States to engage with the Office of the United Nations \nHigh Commissioner for Human Rights to continue to explore options to strengthen, \ninstitutionalize and further advance work on accountability and undertake, where \npossible, the investigation and prosecution of persons suspected of committing \ninternational crimes in the Democratic People\u2019s Republic of Korea, in accordance \nwith international law; \n\nSituation of human rights in the Democratic People\u2019s Republic \nof Korea \nA/RES/80/220\n \n11/14\n25-20980 \n \n \n20. Strongly urges the Government of the Democratic People\u2019s Republic of \nKorea to respect, protect and fulfil all human rights and fundamental freedoms and, \nin this regard: \n \n(a) \nTo immediately put an end to the systematic, widespread and grave \nviolations and abuses of human rights emphasized above;  \n \n(b) \nTo immediately close the political prison camps and to release all political \nprisoners unconditionally and without any delay, and to immediately conduct a \ncomprehensive review of conditions in all places of detention, including in prison \ncamps, re-education camps, labour training camps, labour training centres, detention \ncentres, holding centres and waiting rooms, and take steps to ensure that conditions \nin those facilities are in compliance with relevant obligations and commitments \nrelating to the humane treatment of persons in detention, as outlined in the relevant \nprovisions of the International Covenant on Civil and Political Rights and the \nInternational Covenant on Economic, Social and Cultural Rights, as well as the United \nNations Standard Minimum Rules for the Treatment of Prisoners (the Nelson Mandela \nRules),35 and to accept technical assistance by the Office of the United Nations High \nCommissioner for Human Rights on upholding rights in detention; \n \n(c) \nTo immediately cease the use of torture and other cruel, inhumane and \ndegrading treatment or punishment, including in places of detention, as well as the \npractice of forced labour and sexual and gender-based violence; \n \n(d) \nTo protect its inhabitants, address the issue of impunity and ensure that \nthose responsible for crimes involving violations and abuses of human rights are \nbrought to justice before an independent judiciary; \n \n(e) \nTo tackle the root causes leading to outflows of migrants and refugees and \nto prosecute, in trials that meet international human rights standards for fair trial, \nthose involved in migrant smuggling, trafficking in human beings and extortion, while \nnot criminalizing the victims and survivors of trafficking; \n \n(f) \nTo ensure that everyone within the territory of the Democratic People\u2019s \nRepublic of Korea enjoys the right to liberty of movement, the freedom to leave the \ncountry and freedom to choose their residence, including for the purpose of seeking \nasylum outside the Democratic People\u2019s Republic of Korea, without interference by \nthe authorities of the Democratic People\u2019s Republic of Korea; \n \n(g) \nTo ensure that refugees, asylum-seekers and other citizens of the \nDemocratic People\u2019s Republic of Korea who are expelled or returned to the \nDemocratic People\u2019s Republic of Korea, including women and girls who are victims \nand survivors of trafficking, are able to return in safety and dignity, are treated \nhumanely, receive appropriate support and are not subjected to any kind of human \nrights violations and abuses, including enforced disappearances, arbitrary or unlawful \ndetention in prisons or labour camps, arbitrary executions, torture and ill-treatment, \nsexual and gender-based violence including forced abortions and infanticide against \nrepatriated mothers, arbitrary invasive body cavity searches and trials that do not \nconform with international fair trial guarantees, and to provide information on their \nstatus and treatment; \n \n(h) \nTo provide citizens of other Member States detained in the Democratic \nPeople\u2019s Republic of Korea with protections, including freedom of communication \nwith, and access to, consular officers in accordance with the Vienna Convention on \nConsular Relations,36 to which the Democratic People\u2019s Republic of Korea is a Party, \n_______________ \n \n35 Resolution 70/175, annex. \n \n36 United Nations, Treaty Series, vol. 596, No. 8638. \n\nA/RES/80/220 \nSituation of human rights in the Democratic People\u2019s Republic \nof Korea\n \n25-20980\n12/14 \n \nand any other necessary arrangements to confirm their status and to communicate \nwith their families; \n \n(i) \nTo extend its full cooperation to the Special Rapporteur on the situation of \nhuman rights in the Democratic People\u2019s Republic of Korea, including by granting \nher full, free and unimpeded access to the Democratic People\u2019s Republic of Korea, \nand to other special procedures of the Human Rights Council, as well as to other \nUnited Nations human rights mechanisms, so that a full assessment of the human \nrights situation may be made; \n \n(j) \nTo extend an invitation to the Office of the United Nations High \nCommissioner for Human Rights to visit the country; \n \n(k) \nTo engage in technical cooperation activities in the field of human rights \nwith the United Nations High Commissioner for Human Rights and his Office, \nincluding the field-based structure in the region, as pursued by the previous High \nCommissioner in recent years, with a view to improving the situation of human rights \nin the country; \n \n(l) \nTo implement the accepted recommendations stemming from the universal \nperiodic reviews and to provide comprehensive information detailing progress on the \nimplementation of the recommendations accepted from the fourth cycle; \n \n(m) To become a member of the International Labour Organization, to enact \nlegislation and adopt practices to comply with international labour standards and to \nconsider ratifying all the relevant conventions, in particular the core labour \nconventions of the International Labour Organization; \n \n(n) \nTo cease policies and practices that cause its people to endure avoidable \nhardship and suffering and to clear the way for the return of international and \nhumanitarian staff; \n \n(o) \nTo ensure full, safe, timely and unhindered access to persons in need of \nhumanitarian aid, and take measures to allow humanitarian agencies to survey and \nassess the needs of persons in vulnerable situations, including the unhindered and \nimpartial delivery of such humanitarian aid to all parts of the country, on the basis of \nneed consistent with international standards and humanitarian principles, as it pledged \nto do, and to furthermore ensure access to adequate basic services and implement \nmore effective food security and nutrition policies, including through sustainable \nagriculture, sound food production and distribution measures and the allocation of \nmore funds to the food sector, to allow adequate monitoring of humanitarian \nassistance; \n \n(p) \nTo ensure for its people access to adequate basic services and implement \neffective food security and nutrition policies, sound food production and distribution \nmeasures and the allocation of adequate funds to the food sector; to establish an \noperating environment conducive to the return of international and humanitarian staff; \nand to improve cooperation with the United Nations country team members and \nhumanitarian agencies, including by allowing for the immediate return of their \ninternational staff, so that they can directly contribute to improving the living \nconditions of the civilian population, including progress towards the achievement of \nthe Sustainable Development Goals; \n \n(q) \nTo consider ratifying and acceding to the remaining international human \nrights treaties, which would enable a dialogue with the human rights treaty bodies, to \nprioritize reporting to monitoring bodies on treaties to which it is a Party, to submit \nall overdue reports, including to the Human Rights Committee and the Committee on \nthe Elimination of Racial Discrimination, to participate meaningfully in treaty body \n\nSituation of human rights in the Democratic People\u2019s Republic \nof Korea \nA/RES/80/220\n \n13/14\n25-20980 \n \nreviews, and to give consideration to the concluding observations of such bodies in \norder to improve the human rights situation in the country; \n \n(r) \nTo ensure the right to freedom of thought, conscience and religion or belief \nand the rights to freedom of opinion, expression and association, both online and \noffline, including by permitting the establishment of independent newspapers and \nother media and repealing or reforming all practices and laws suppressing the \naforementioned rights, including the Law on Rejecting Reactionary Thought and \nCulture, the Youth Education Guarantee Law and the Law on Protecting the \nPyongyang Cultural Language, and to distribute information about human rights to \nthe population; \n \n21. Urges the Government of the Democratic People\u2019s Republic of Korea to \nimplement the recommendations of the commission of inquiry, the group of \nindependent experts, the Special Rapporteur on the situation of human rights in the \nDemocratic People\u2019s Republic of Korea, the Special Rapporteur on the rights of \npersons with disabilities, the Secretary-General and the Office of the United Nations \nHigh Commissioner for Human Rights without delay; \n \n22. Reiterates the importance of maintaining high on the international agenda \nthe grave human rights situation in the Democratic People\u2019s Republic of Korea, \nincluding through sustained communications, advocacy and outreach initiatives, and \nrequests the Office of the United Nations High Commissioner for Human Rights to \nstrengthen those activities; \n \n23. Encourages all Member States that engage in dialogue with the \nDemocratic People\u2019s Republic of Korea to continue to advocate for the establishment \nof lasting peace and security in the Korean Peninsula, to engage with United Nations \nhuman rights mechanisms and to address the human rights situation; \n \n24. Encourages all Member States, the General Assembly, the Human Rights \nCouncil, the Office of the United Nations High Commissioner for Human Rights, the \nUnited Nations Secretariat, relevant specialized agencies, regional intergovernmental \norganizations and forums, civil society organizations, foundations and engaged \nbusiness enterprises, and other stakeholders towards which the commission of inquiry \nhas directed recommendations to implement or take forward those recommendations, \nincluding to provide more support for the work of civil society organizations to \nimprove the situation of human rights in the Democratic People\u2019s Republic of Korea, \nand to also support efforts aimed at resuming and improving dialogue, including \ninter\u2011Korean dialogue, and to address the humanitarian and human rights situation, \nincluding enforced disappearances, international abductions and the forced or \ninvoluntary separation of families in the Democratic People\u2019s Republic of Korea; \n \n25. Encourages the United Nations system as a whole to continue to address \nthe grave human rights situation in the Democratic People\u2019s Republic of Korea in a \ncoordinated and unified manner; \n \n26. Encourages the relevant United Nations programmes, funds, specialized \nagencies and other related organizations to assist the Government of the Democratic \nPeople\u2019s Republic of Korea in the implementation of recommendations stemming \nfrom the United Nations human rights mechanisms; \n \n27. Calls upon the Democratic People\u2019s Republic of Korea to engage \nconstructively with international interlocutors with a view to promoting concrete \nimprovements in the human rights situation on the ground, including through human \nrights dialogues, official visits to the country that include adequate access to fully \nassess human rights conditions, cooperation initiatives and more people-to-people \ncontact; \n\nA/RES/80/220 \nSituation of human rights in the Democratic People\u2019s Republic \nof Korea\n \n25-20980\n14/14 \n \n \n28. Decides to continue its examination of the situation of human rights in the \nDemocratic People\u2019s Republic of Korea at its eighty-first session, and to this end \nrequests the Secretary-General to submit a comprehensive report on the situation of \nhuman rights in the Democratic People\u2019s Republic of Korea, and requests the Special \nRapporteur to continue to report her findings and recommendations, as well as to \nreport on the follow-up to the implementation of the recommendations of the \ncommission of inquiry. \n \n69th plenary meeting \n18 December 2025 \n \n",
  "paragraphs": {
    "1": "Condemns in the strongest terms the long-standing and ongoing systematic, widespread and gross violations of human rights in and by the Democratic People\u2019s Republic of Korea, including those that may amount to crimes against humanity according to the commission of inquiry on human rights in the Democratic People\u2019s Republic of Korea, established by the Human Rights Council in its resolution 22/13 of 21 March 2013,15 and those identified by the group of independent experts on accountability for human rights violations in the Democratic People\u2019s Republic of Korea,16 established pursuant to Council resolution 31/18 of 23 March 2016,17 and by the Office of the United Nations High Commissioner for Human Rights, including its field-based structure in Seoul, and the continuing impunity for such violations;",
    "2": "Expresses its very serious concern about: (a) Continuing reports of persistent violations of human rights, including the detailed findings made by the commission of inquiry in its report, by the Office of the United Nations High Commissioner for Human Rights in its ongoing monitoring and documentation work and by the Special Rapporteur on the situation of human rights in the Democratic People\u2019s Republic of Korea, such as: (i) Torture and other cruel, inhuman or degrading treatment or punishment, including inhuman conditions of detention; all forms of sexual and gender-based violence, including rape, in particular against women and girls; extrajudicial, summary and arbitrary executions; the imposition of the death penalty for political and religious reasons, which is now more widely allowed by law and implemented in practice; public executions; extrajudicial and arbitrary detention; the absence of fair trial guarantees and the rule of law, including an independent and corruption-free judiciary; and collective punishments extending up to three generations; (ii) The existence of an extensive penal system including political prison camps, re-education camps, labour training camps, labour training centres, detention centres, holding centres and waiting rooms, where a vast number of persons are deprived of their liberty and subjected to deplorable conditions, including forced labour, and where alarming violations of human rights are perpetrated; (iii) Enforced and involuntary disappearances of persons by arrest, detention or abduction against their will; refusal to disclose the fate and whereabouts of _______________ 15 See Official Records of the General Assembly, Sixty-eighth Session, Supplement No. 53 (A/68/53), chap. IV, sect. A. 16 See A/HRC/34/66/Add.1. 17 See Official Records of the General Assembly, Seventy-first Session, Supplement No. 53 (A/71/53), chap. IV, sect. A. A/RES/80/220 Situation of human rights in the Democratic People\u2019s Republic of Korea 25-20980 6/14 the persons concerned; and refusal to acknowledge the deprivation of their liberty, which places them outside the protection of the law and which has inflicted severe suffering on them and their families; (iv) The forcible transfer of populations and the limitations imposed on persons wishing to move freely within the country or abroad, with even greater restrictions now compared to a decade ago, including harming or punishing those who leave or try to leave the country without permission, or their families; (v) The situation of refugees and asylum-seekers expelled or returned to the Democratic People\u2019s Republic of Korea, including where the Government of the Democratic People\u2019s Republic of Korea exerts pressure on returning States to effectuate such returns, and retaliation by the Government of the Democratic People\u2019s Republic of Korea against its citizens who have been repatriated, including punishment by internment, torture, other cruel, inhuman or degrading treatment or punishment, sexual and gender-based violence, or the death penalty, and in this regard strongly urges all Member States to respect the fundamental principle of non\u2011refoulement, to take action to counter acts of transnational repression by the Democratic People\u2019s Republic of Korea, to treat humanely those who seek refuge and to ensure unhindered access to the United Nations High Commissioner for Refugees and his Office, and the Office of the United Nations High Commissioner for Human Rights, with a view to protecting the human rights of those who seek refuge, and to refrain from sharing information about the contacts and conduct of refugees, asylum-seekers and other citizens of the Democratic People\u2019s Republic of Korea with the Government of the Democratic People\u2019s Republic of Korea, and once again urges States Parties to comply with their obligations under the 1951 Convention relating to the Status of Refugees18 and the 1967 Protocol thereto19 in relation to refugees from the Democratic People\u2019s Republic of Korea who are covered by those instruments, as well as under the Convention against Torture and Other Cruel, Inhuman or Degrading Treatment or Punishment20 and the Protocol to Prevent, Suppress and Punish Trafficking in Persons, Especially Women and Children, supplementing the United Nations Convention against Transnational Organized Crime; 21 (vi) All-pervasive and severe restrictions, including an absolute monopoly on information and total control over organized social life, further tightened by recent laws which provide for severe punishments, including the death penalty, namely the Law on Rejecting Reactionary Thought and Culture (2020), the Youth Education Guarantee Law (2021) and the Law on Protecting the Pyongyang Cultural Language (2023), on the rights to freedom of thought, conscience, religion or belief, opinion and expression, peaceful assembly and association, including the freedom to seek, receive and impart information and ideas of all kinds, regardless of frontiers, the right not to be subjected to arbitrary or unlawful interference with individual privacy, torture and other cruel, inhuman or degrading treatment or punishment, or imprisonment of individuals exercising their rights to freedom of opinion and expression and religion or belief, and the right of everyone, including women, to take part without unreasonable restriction in the conduct of public affairs, directly or through freely chosen representatives, of their country; (vii) Violations of economic, social and cultural rights, exacerbated by the continued border restrictions of the Democratic People\u2019s Republic of Korea, _______________ 18 United Nations, Treaty Series, vol. 189, No. 2545. 19 Ibid., vol. 606, No. 8791. 20 Ibid., vol. 1465, No. 24841. 21 Ibid., vol. 2237, No. 39574. Situation of human rights in the Democratic People\u2019s Republic of Korea A/RES/80/220 7/14 25-20980 which have led to food insecurity, severe hunger, malnutrition, widespread health problems and other hardship for the population in the Democratic People\u2019s Republic of Korea; (viii) Violations of the human rights and fundamental freedoms of all women and girls, including unequal access to employment and discriminatory laws and regulations, domestic violence, as well as the creation of internal conditions that force women and girls to leave the country, making them extremely vulnerable to trafficking in persons for the purpose of sexual exploitation, forced labour, domestic servitude or forced marriage, and their subjection to sexual and gender-based discrimination and violence, including in the political and social spheres and by law enforcement officials, as well as throughout the entire penal system, including through forced abortions, invasive body cavity searches and other forms of sexual and gender-based violence; (ix) Violations of the human rights and fundamental freedoms of children, in particular the continued lack of access to basic economic, social and cultural rights for many children, and notes the particularly vulnerable situation faced by returned or repatriated children, children without housing, children with disabilities, children whose parents are detained, deceased or otherwise absent, children living in detention or in institutions and children in conflict with the law, and further notes with concern the reports of harsh and disproportionate punishment inflicted upon children; (x) Violations of the human rights and fundamental freedoms of persons with disabilities, especially violations involving the use of collective camps and coercive measures that target the rights of persons with disabilities to decide freely and responsibly on the number and spacing of their children and allegations of the possible use of persons with disabilities in medical testing, forced relocation to rural areas and separation of children with disabilities from their parents; (xi) Widespread use of forced labour, 22 which has become deeply institutionalized, and violations of workers\u2019 rights, including the right to freedom of association and effective recognition of the right to collective bargaining, the right to strike as defined by the obligations of the Democratic People\u2019s Republic of Korea under the International Covenant on Economic, Social and Cultural Rights, and the prohibition of the economic exploitation of children and of any harmful or hazardous work of children as defined by the obligations of the Democratic People\u2019s Republic of Korea under the Convention on the Rights of the Child, as well as the exploitation of workers sent abroad from the Democratic People\u2019s Republic of Korea to work under conditions that amount to forced labour, often for the purpose of generating income for the Government, and emphasizing the importance, in order to avoid any risk of Member States contributing to practices that may be inconsistent with international human rights standards, including those associated with reports of forced labour involving workers sent abroad by the Government of the Democratic People\u2019s Republic of Korea, of full implementation of the requirement that nationals of the Democratic People\u2019s Republic of Korea earning income overseas be repatriated, subject to applicable national and international law, as soon as possible pursuant to paragraph 8 of Security Council resolution 2397 (2017), the provision of final reports as soon as possible pursuant to the same resolution and the prohibition on providing work _______________ 22 See Office of the United Nations High Commissioner for Human Rights, Forced Labour by the Democratic People\u2019s Republic of Korea, available at www.ohchr.org/en/documents/country- reports/forced-labour-democratic-peoples-republic-korea. A/RES/80/220 Situation of human rights in the Democratic People\u2019s Republic of Korea 25-20980 8/14 authorizations pursuant to paragraph 17 of resolution 2375 (2017), and urges the Democratic People\u2019s Republic of Korea to promote, respect and protect the human rights of workers, including workers repatriated to the Democratic People\u2019s Republic of Korea; (xii) Discrimination based on the songbun system, which classifies people on the basis of State-assigned social class and birth and also includes consideration of political opinions and religion, and the practice of guilt by association; (b) The continued refusal of the Government of the Democratic People\u2019s Republic of Korea to extend an invitation to the Special Rapporteur on the situation of human rights in the Democratic People\u2019s Republic of Korea, to engage and give consideration to the reports and recommendations of the Special Rapporteur, or to extend cooperation to the Special Rapporteur and several other United Nations special procedures, in accordance with their terms of reference, as well as to other United Nations human rights mechanisms; (c) The continued lack of acknowledgement by the Government of the Democratic People\u2019s Republic of Korea of the grave human rights situation in the country and its consequential lack of action to report on the state of implementation of the recommendations contained in the outcome of its first, 23 second,24 third25 and fourth 26 universal periodic reviews and to give consideration to the concluding observations of the treaty bodies;",
    "3": "Condemns the systematic abduction, denial of repatriation and subsequent enforced disappearance of persons, including those from other Member States, on a large scale and as a matter of State policy, including beyond the borders of the Democratic People\u2019s Republic of Korea, as well as denial of repatriation of prisoners of war, and in this regard strongly urges the Government of the Democratic People\u2019s Republic of Korea to engage in constructive dialogues with the parties concerned and to urgently resolve these issues of international grave concern, by clarifying their whereabouts in good faith and with credibility and transparency, including by taking concrete measures towards the realization of the immediate return of all abductees, detainees and unrepatriated prisoners of war, and in relevant cases to return the remains of the deceased, including those of deceased service personnel;",
    "4": "Underscores its very serious concern regarding reports of torture and other cruel, inhuman or degrading treatment or punishment, summary executions, arbitrary detention, abductions and other forms of human rights violations and abuses that the Democratic People\u2019s Republic of Korea commits against citizens of other Member States within and outside of its territory, and urges the Democratic People\u2019s Republic of Korea to disclose all relevant information to bereaved families and relevant entities;",
    "5": "Expresses its very deep concern about the prevalence of chronic and acute malnutrition, in particular among persons in the most vulnerable situations, including pregnant and lactating women and adolescent girls, children, persons with disabilities, older persons and prisoners, including throughout the entire penal system and in all places of detention, which is exacerbated by a lack of access to basic services, including healthcare, clean water, sanitation and hygiene services, structural weaknesses in agricultural production that result in shortages of diversified food, limitations in the capacity of the Government to respond to natural disasters and government policies that limit access to and availability of adequate food, including _______________ 23 A/HRC/13/13. 24 A/HRC/27/10. 25 A/HRC/42/10. 26 A/HRC/58/11. Situation of human rights in the Democratic People\u2019s Republic of Korea A/RES/80/220 9/14 25-20980 through restrictions on the cultivation of and trade in foodstuffs and severe border restrictions, and urges the Government of the Democratic People\u2019s Republic of Korea to end such harmful policies and practices and remove obstacles to the return of international donor and humanitarian agencies and allow them access to people in vulnerable situations in order to implement humanitarian assistance programmes, monitored in a manner consistent with international standards;",
    "6": "Welcomes the latest report to the Human Rights Council of the Special Rapporteur on the situation of human rights in the Democratic People\u2019s Republic of Korea;27",
    "7": "Reiterates its appreciation for the report of the group of independent experts on accountability for human rights violations in the Democratic People\u2019s Republic of Korea,28 established pursuant to Human Rights Council resolution 31/18, including options to seek accountability and secure truth and justice for all victims;",
    "8": "Welcomes the latest report of the United Nations High Commissioner for Human Rights29 on steps taken pursuant to Human Rights Council resolutions 34/24 of 24 March 2017,30 40/20 of 22 March 201931 and 46/17 of 23 March 2021,32 and also welcomes Council resolutions 52/28 of 4 April 2023,33 55/21 of 4 April 202434 and 58/17, which continue to strengthen the capacity of the Office of the United Nations High Commissioner for Human Rights, including its field-based structure in Seoul, to allow the implementation of relevant recommendations made by the group of independent experts on accountability aimed at strengthening current monitoring and documentation efforts, establishing a central repository for information and evidence and having experts in legal accountability assess all information and testimonies with a view to developing possible strategies to be used in any future accountability process;",
    "9": "Expresses strong support for the work being undertaken by the Office of the United Nations High Commissioner for Human Rights, including its field-based structure in Seoul, in furtherance of Human Rights Council resolution 58/17, with the aim of ensuring accountability for suspected violations of international law committed in and by the Democratic People\u2019s Republic of Korea, and calls upon all States to support such efforts;",
    "10": "Reiterates its appreciation for the work of the commission of inquiry and acknowledges the importance of its report and the finding that the body of testimony gathered and the information received provide reasonable grounds to believe that crimes against humanity have been committed in the Democratic People\u2019s Republic of Korea, pursuant to policies established at the highest level of the State for decades and by institutions under the effective control of its leadership, which was confirmed by the United Nations High Commissioner for Human Rights in the report to the Human Rights Council submitted pursuant to resolutions 52/28 and 55/21;",
    "11": "Welcomes the comprehensive report of the United Nations High Commissioner for Human Rights containing an update on the situation of human rights in the Democratic People\u2019s Republic of Korea since 2014, in which it was found _______________ 27 A/HRC/58/65. 28 A/HRC/34/66/Add.1. 29 A/HRC/58/61. 30 See Official Records of the General Assembly, Seventy-second Session, Supplement No. 53 (A/72/53), chap. IV, sect. A. 31 Ibid., Seventy-fourth Session, Supplement No. 53 (A/74/53), chap. IV, sect. A. 32 Ibid., Seventy-sixth Session, Supplement No. 53 (A/76/53), chap. V, sect. A. 33 Ibid., Seventy-eighth Session, Supplement No. 53 (A/78/53), chap. V, sect. A. 34 Ibid., Seventy-ninth Session, Supplement No. 53 (A/79/53), chap. IV, sect. A. A/RES/80/220 Situation of human rights in the Democratic People\u2019s Republic of Korea 25-20980 10/14 that the overall human rights situation had not improved since 2014 and in many instances had degraded, and urges the Democratic People\u2019s Republic of Korea and Member States to fulfil the recommendations contained therein;",
    "12": "Expresses its concern at the failure of the authorities of the Democratic People\u2019s Republic of Korea to hold accountable those responsible for human rights violations, including violations which the commission of inquiry has said may amount to crimes against humanity, and encourages the international community to cooperate with accountability efforts and to ensure that such crimes do not remain unpunished;",
    "13": "Encourages the Security Council to take appropriate action to ensure accountability, including through consideration of referral of the situation in the Democratic People\u2019s Republic of Korea to the International Criminal Court and consideration of further targeted sanctions against those responsible for human rights violations that the commission of inquiry has said may constitute crimes against humanity;",
    "14": "Welcomes the resumption of the Security Council discussion on the situation in the Democratic People\u2019s Republic of Korea and reiterates its appreciation to the United Nations High Commissioner for Human Rights and the Special Rapporteur on the situation of human rights in the Democratic People\u2019s Republic of Korea for briefing the Council on the country\u2019s human rights situation, in the light of the serious concerns expressed in the present resolution, and looks forward to its continued and more active engagement on this matter;",
    "15": "Encourages the continuing endeavours of the Office of the United Nations High Commissioner for Human Rights, including through its field-based structure in Seoul, in organizing consultations and outreach activities with victims and survivors, affected communities and other relevant stakeholders with a view to ensuring a victim- and survivor-centred approach to accountability, compiling a central repository to consolidate the information and evidence relating to suspected violations of international law, and assessing all such evidence and information in order to develop possible strategies to be used in any future accountability process, and also encourages the cooperation of the Office with a wide range of stakeholders in the procurement of evidence that could be used in future criminal proceedings;",
    "16": "Calls upon Member States to support efforts to strengthen legal accountability mechanisms, including the compilation of evidence for future criminal proceedings and the establishment of a central repository;",
    "17": "Also calls upon Member States to continue to support the Office of the United Nations High Commissioner for Human Rights, including its field-based structure in Seoul, for the endeavours listed in paragraph 15 above;",
    "18": "Further calls upon Member States to undertake to ensure that the field- based structure of the Office of the United Nations High Commissioner for Human Rights can function with independence, has sufficient resources and support to fulfil its mandate, enjoys full cooperation with relevant Member States and is not subjected to any reprisals or threats;",
    "19": "Calls upon Member States to engage with the Office of the United Nations High Commissioner for Human Rights to continue to explore options to strengthen, institutionalize and further advance work on accountability and undertake, where possible, the investigation and prosecution of persons suspected of committing international crimes in the Democratic People\u2019s Republic of Korea, in accordance with international law; Situation of human rights in the Democratic People\u2019s Republic of Korea A/RES/80/220 11/14 25-20980",
    "20": "Strongly urges the Government of the Democratic People\u2019s Republic of Korea to respect, protect and fulfil all human rights and fundamental freedoms and, in this regard: (a) To immediately put an end to the systematic, widespread and grave violations and abuses of human rights emphasized above; (b) To immediately close the political prison camps and to release all political prisoners unconditionally and without any delay, and to immediately conduct a comprehensive review of conditions in all places of detention, including in prison camps, re-education camps, labour training camps, labour training centres, detention centres, holding centres and waiting rooms, and take steps to ensure that conditions in those facilities are in compliance with relevant obligations and commitments relating to the humane treatment of persons in detention, as outlined in the relevant provisions of the International Covenant on Civil and Political Rights and the International Covenant on Economic, Social and Cultural Rights, as well as the United Nations Standard Minimum Rules for the Treatment of Prisoners (the Nelson Mandela Rules),35 and to accept technical assistance by the Office of the United Nations High Commissioner for Human Rights on upholding rights in detention; (c) To immediately cease the use of torture and other cruel, inhumane and degrading treatment or punishment, including in places of detention, as well as the practice of forced labour and sexual and gender-based violence; (d) To protect its inhabitants, address the issue of impunity and ensure that those responsible for crimes involving violations and abuses of human rights are brought to justice before an independent judiciary; (e) To tackle the root causes leading to outflows of migrants and refugees and to prosecute, in trials that meet international human rights standards for fair trial, those involved in migrant smuggling, trafficking in human beings and extortion, while not criminalizing the victims and survivors of trafficking; (f) To ensure that everyone within the territory of the Democratic People\u2019s Republic of Korea enjoys the right to liberty of movement, the freedom to leave the country and freedom to choose their residence, including for the purpose of seeking asylum outside the Democratic People\u2019s Republic of Korea, without interference by the authorities of the Democratic People\u2019s Republic of Korea; (g) To ensure that refugees, asylum-seekers and other citizens of the Democratic People\u2019s Republic of Korea who are expelled or returned to the Democratic People\u2019s Republic of Korea, including women and girls who are victims and survivors of trafficking, are able to return in safety and dignity, are treated humanely, receive appropriate support and are not subjected to any kind of human rights violations and abuses, including enforced disappearances, arbitrary or unlawful detention in prisons or labour camps, arbitrary executions, torture and ill-treatment, sexual and gender-based violence including forced abortions and infanticide against repatriated mothers, arbitrary invasive body cavity searches and trials that do not conform with international fair trial guarantees, and to provide information on their status and treatment; (h) To provide citizens of other Member States detained in the Democratic People\u2019s Republic of Korea with protections, including freedom of communication with, and access to, consular officers in accordance with the Vienna Convention on Consular Relations,36 to which the Democratic People\u2019s Republic of Korea is a Party, _______________ 35 Resolution 70/175, annex. 36 United Nations, Treaty Series, vol. 596, No. 8638. A/RES/80/220 Situation of human rights in the Democratic People\u2019s Republic of Korea 25-20980 12/14 and any other necessary arrangements to confirm their status and to communicate with their families; (i) To extend its full cooperation to the Special Rapporteur on the situation of human rights in the Democratic People\u2019s Republic of Korea, including by granting her full, free and unimpeded access to the Democratic People\u2019s Republic of Korea, and to other special procedures of the Human Rights Council, as well as to other United Nations human rights mechanisms, so that a full assessment of the human rights situation may be made; (j) To extend an invitation to the Office of the United Nations High Commissioner for Human Rights to visit the country; (k) To engage in technical cooperation activities in the field of human rights with the United Nations High Commissioner for Human Rights and his Office, including the field-based structure in the region, as pursued by the previous High Commissioner in recent years, with a view to improving the situation of human rights in the country; (l) To implement the accepted recommendations stemming from the universal periodic reviews and to provide comprehensive information detailing progress on the implementation of the recommendations accepted from the fourth cycle; (m) To become a member of the International Labour Organization, to enact legislation and adopt practices to comply with international labour standards and to consider ratifying all the relevant conventions, in particular the core labour conventions of the International Labour Organization; (n) To cease policies and practices that cause its people to endure avoidable hardship and suffering and to clear the way for the return of international and humanitarian staff; (o) To ensure full, safe, timely and unhindered access to persons in need of humanitarian aid, and take measures to allow humanitarian agencies to survey and assess the needs of persons in vulnerable situations, including the unhindered and impartial delivery of such humanitarian aid to all parts of the country, on the basis of need consistent with international standards and humanitarian principles, as it pledged to do, and to furthermore ensure access to adequate basic services and implement more effective food security and nutrition policies, including through sustainable agriculture, sound food production and distribution measures and the allocation of more funds to the food sector, to allow adequate monitoring of humanitarian assistance; (p) To ensure for its people access to adequate basic services and implement effective food security and nutrition policies, sound food production and distribution measures and the allocation of adequate funds to the food sector; to establish an operating environment conducive to the return of international and humanitarian staff; and to improve cooperation with the United Nations country team members and humanitarian agencies, including by allowing for the immediate return of their international staff, so that they can directly contribute to improving the living conditions of the civilian population, including progress towards the achievement of the Sustainable Development Goals; (q) To consider ratifying and acceding to the remaining international human rights treaties, which would enable a dialogue with the human rights treaty bodies, to prioritize reporting to monitoring bodies on treaties to which it is a Party, to submit all overdue reports, including to the Human Rights Committee and the Committee on the Elimination of Racial Discrimination, to participate meaningfully in treaty body Situation of human rights in the Democratic People\u2019s Republic of Korea A/RES/80/220 13/14 25-20980 reviews, and to give consideration to the concluding observations of such bodies in order to improve the human rights situation in the country; (r) To ensure the right to freedom of thought, conscience and religion or belief and the rights to freedom of opinion, expression and association, both online and offline, including by permitting the establishment of independent newspapers and other media and repealing or reforming all practices and laws suppressing the aforementioned rights, including the Law on Rejecting Reactionary Thought and Culture, the Youth Education Guarantee Law and the Law on Protecting the Pyongyang Cultural Language, and to distribute information about human rights to the population;",
    "21": "Urges the Government of the Democratic People\u2019s Republic of Korea to implement the recommendations of the commission of inquiry, the group of independent experts, the Special Rapporteur on the situation of human rights in the Democratic People\u2019s Republic of Korea, the Special Rapporteur on the rights of persons with disabilities, the Secretary-General and the Office of the United Nations High Commissioner for Human Rights without delay;",
    "22": "Reiterates the importance of maintaining high on the international agenda the grave human rights situation in the Democratic People\u2019s Republic of Korea, including through sustained communications, advocacy and outreach initiatives, and requests the Office of the United Nations High Commissioner for Human Rights to strengthen those activities;",
    "23": "Encourages all Member States that engage in dialogue with the Democratic People\u2019s Republic of Korea to continue to advocate for the establishment of lasting peace and security in the Korean Peninsula, to engage with United Nations human rights mechanisms and to address the human rights situation;",
    "24": "Encourages all Member States, the General Assembly, the Human Rights Council, the Office of the United Nations High Commissioner for Human Rights, the United Nations Secretariat, relevant specialized agencies, regional intergovernmental organizations and forums, civil society organizations, foundations and engaged business enterprises, and other stakeholders towards which the commission of inquiry has directed recommendations to implement or take forward those recommendations, including to provide more support for the work of civil society organizations to improve the situation of human rights in the Democratic People\u2019s Republic of Korea, and to also support efforts aimed at resuming and improving dialogue, including inter\u2011Korean dialogue, and to address the humanitarian and human rights situation, including enforced disappearances, international abductions and the forced or involuntary separation of families in the Democratic People\u2019s Republic of Korea;",
    "25": "Encourages the United Nations system as a whole to continue to address the grave human rights situation in the Democratic People\u2019s Republic of Korea in a coordinated and unified manner;",
    "26": "Encourages the relevant United Nations programmes, funds, specialized agencies and other related organizations to assist the Government of the Democratic People\u2019s Republic of Korea in the implementation of recommendations stemming from the United Nations human rights mechanisms;",
    "27": "Calls upon the Democratic People\u2019s Republic of Korea to engage constructively with international interlocutors with a view to promoting concrete improvements in the human rights situation on the ground, including through human rights dialogues, official visits to the country that include adequate access to fully assess human rights conditions, cooperation initiatives and more people-to-people contact; A/RES/80/220 Situation of human rights in the Democratic People\u2019s Republic of Korea 25-20980 14/14",
    "28": "Decides to continue its examination of the situation of human rights in the Democratic People\u2019s Republic of Korea at its eighty-first session, and to this end requests the Secretary-General to submit a comprehensive report on the situation of human rights in the Democratic People\u2019s Republic of Korea, and requests the Special Rapporteur to continue to report her findings and recommendations, as well as to report on the follow-up to the implementation of the recommendations of the commission of inquiry. 69th plenary meeting 18 December 2025"
  },
  "agenda_items": [
    "Item 71"
  ],
  "symbol_references": []
}