{
  "symbol": "A/RES/75/144",
  "filename": "A_RES_75_144.pdf",
  "title": "75/144. Strengthening and promoting the international treaty framework",
  "text": "United Nations \nA/RES/75/144 \n \n \nGeneral Assembly \nDistr.: General \n22 December 2020 \n \n20-17231 (E)    291220 \n*2017231* \n \n \nSeventy-fifth session \nAgenda item 90 \nStrengthening and promoting the international \ntreaty framework  \n \n \n \n \n Resolution adopted by the General Assembly \non 15 December 2020 \n \n \n \n \n[on the report of the Sixth Committee (A/75/436, para. 8)] \n \n \n 75/144. Strengthening and promoting the international treaty framework \n \n \n \nThe General Assembly, \n \nRecalling its resolutions 23 (I) of 10 February 1946, 97 (I) of 14 December \n1946, 364 B (IV) of 1 December 1949, 482 (V) of 12 December 1950, 32/144 of \n16 December 1977, 33/141 A of 19 December 1978, 51/158 of 16 December 1996 \nand 73/210 of 20 December 2018, \n \nRecalling also its resolutions 71/328 of 11 September 2017 and 73/346 of \n16 September 2019, which reaffirm that multilingualism is a core value of the \nOrganization that contributes to the achievement of the goals of the United Nations, \nand requesting the Secretary-General to continue to make efforts to ensure that \nmultilingualism is not undermined by the measures taken in response to the liquidity \nsituation and the coronavirus disease (COVID-19), \n \nConscious of the obligations resulting from Article 102 of the Charter of the \nUnited Nations and the importance of treaties in the development of international law \nand the international legal order,  \n \nNoting with appreciation the role of the Secretariat, in particular the Treaty \nSection of the Office of Legal Affairs, in the implementation of Article 102 of the \nCharter,  \n \nNoting that the considerable increase in the number of treaties submitted for \nregistration over the past years has led to the growth in the volume of work carried \nout by the Treaty Section, contributing to the accumulation of unpublished treaties, \n \nNoting also that, while the authentic texts of registered treaties are promptly \nmade available online through the electronic treaty database, there is currently a \nsignificant backlog in the publication of the United Nations Treaty Series due to \n\nA/RES/75/144 \nStrengthening and promoting the international treaty framework\n \n20-17231\n2/3 \n \ngrowing delays in the translation of treaties related, inter alia, to the limited resources \navailable for the publication process,  \n \nRecognizing the importance of the expeditious processing, registration and \npublication of treaties and treaty-related actions,  \n \nSupporting the efforts of the Secretary-General to increase the efficiency of the \nregistration and publication process within available resources and to enhance the role \nplayed by the Treaty Section in assisting Member States in this area, \n \nWelcoming the measures taken by the Treaty Section to expedite the publication \nof the United Nations Treaty Series and to provide electronic access to all of its \npublications on the website of the United Nations Treaty Collection, and recognizing \nthe role that new technology can play in the accessibility of the United Nations Treaty \nSeries, \n \nRecognizing that practice and technology have developed considerably over the \npast years, and acknowledging the importance of maintaining consistency with treaty-\nmaking practice in the international community, \n \nBearing in mind the provisions of the Vienna Convention on the Law of \nTreaties,1 and considering its adoption on 22 May 1969 by the United Nations \nConference on the Law of Treaties, \n \nConvinced of the need to further gather and exchange views on practice relating \nto the strengthening and promoting of the international treaty framework, \n \n1. \nRecalls Article 102 of the Charter of the United Nations, reaffirms the \nimportance of the registration and publication of treaties, as well as their accessibility, \nand stresses that the regulations to give effect to Article 102 should be useful and \nrelevant to Member States and should be kept updated to assist States in implementing \ntheir obligations thereunder; \n \n2. \nTakes note of the report of the Secretary-General entitled \u201cReview of the \nregulations to give effect to Article 102 of the Charter of the United Nations\u201d,2 \nsubmitted pursuant to its resolution 73/210, and of the recommendations contained \ntherein for consideration by the General Assembly; \n \n3. \nNotes that some Member States continue to consider that there remain \noutstanding issues where the regulations may need further consideration or possible \nupdating; \n \n4. \nReaffirms its support for the annual treaty event organized by the \nSecretary-General;  \n \n5. \nWelcomes the organization of workshops on treaty law and practice by the \nTreaty Section at Headquarters and at the national and regional levels as an important \ncapacity-building initiative, encourages the Treaty Section to continue to organize \nthese workshops as regularly as possible, including through the use of information \nand communications technology when necessary owing to extraordinary \ncircumstances, and invites States and interested international organizations and \ninstitutions to continue to support this activity; \n \n6. \nAlso welcomes efforts to build the capacity of States in treaty law and \npractice, and invites Member States to consider providing targeted technical \nassistance, upon request, at the bilateral, regional and multilateral levels, in particular \n__________________ \n \n1  United Nations, Treaty Series, vol. 1155, No. 18232. \n \n2  A/75/136. \n\nStrengthening and promoting the international treaty framework \nA/RES/75/144\n \n3/3\n20-17231 \n \nto developing countries, in order to develop and enhance their treaty practice, \nincluding in the use of information and communications technology; \n \n7. \nFurther welcomes the efforts made to develop and enhance the United \nNations electronic treaty database, which provides online access to comprehensive \ninformation on the depositary functions of the Secretary-General and the registration \nand publication of treaties under Article 102 of the Charter, and encourages the \ncontinuation of such efforts in the future, while bearing in mind the challenges that \nmany developing countries face in accessing information and communications \ntechnology; \n \n8. \nNotes that most submissions of treaties for registration are in electronic \nformat, and encourages the Secretary-General to develop, in consultation with and on \nthe basis of feedback from Member States and within existing resources, an online \ntreaty registration system to facilitate submissions of treaties for registration, as an \nadditional option to the existing ways of submission in electronic or hard-copy \nformat; \n \n9. \nRecognizes the importance of the legal publications prepared by the Treaty \nSection, and stresses the need to update the Summary of Practice of the Secretary-\nGeneral as Depositary of Multilateral Treaties in the light of new developments and \npractices; \n \n10. Acknowledges the efforts of the depositaries in the registration of treaties \nunder Article 102 of the Charter, and encourages the continuation of such efforts in \nthe future; \n \n11. Calls upon the Secretary-General to ensure the expedited publication of \nthe United Nations Treaty Series, in accordance with the regulations, through the \nprompt provision of editorial and translation services, to enable effective \ndissemination of and access to treaties; \n \n12. Decides to defer consideration of proposals on the regulations to the \nseventy-sixth session, taking into account the limitations on meetings within the \nUnited Nations premises as precautionary measures aimed at containing the spread of \nCOVID-19; \n \n13. Takes note of the proposals made by Member States on the regulations, \nencourages Member States to submit to the Secretariat any additional proposals \nbefore 30 June 2021, and requests the Secretariat to transmit all the proposals it has \nreceived to Member States; \n \n14. Decides to include in the provisional agenda of its seventy-sixth session \nthe item entitled \u201cStrengthening and promoting the international treaty framework\u201d. \n \n45th plenary meeting \n15 December 2020 \n \n",
  "paragraphs": {
    "1": "Recalls Article 102 of the Charter of the United Nations, reaffirms the importance of the registration and publication of treaties, as well as their accessibility, and stresses that the regulations to give effect to Article 102 should be useful and relevant to Member States and should be kept updated to assist States in implementing their obligations thereunder;",
    "2": "Takes note of the report of the Secretary-General entitled \u201cReview of the regulations to give effect to Article 102 of the Charter of the United Nations\u201d,2 submitted pursuant to its resolution 73/210, and of the recommendations contained therein for consideration by the General Assembly;",
    "3": "Notes that some Member States continue to consider that there remain outstanding issues where the regulations may need further consideration or possible updating;",
    "4": "Reaffirms its support for the annual treaty event organized by the Secretary-General;",
    "5": "Welcomes the organization of workshops on treaty law and practice by the Treaty Section at Headquarters and at the national and regional levels as an important capacity-building initiative, encourages the Treaty Section to continue to organize these workshops as regularly as possible, including through the use of information and communications technology when necessary owing to extraordinary circumstances, and invites States and interested international organizations and institutions to continue to support this activity;",
    "6": "Also welcomes efforts to build the capacity of States in treaty law and practice, and invites Member States to consider providing targeted technical assistance, upon request, at the bilateral, regional and multilateral levels, in particular __________________ 1 United Nations, Treaty Series, vol. 1155, No. 18232. 2 A/75/136. Strengthening and promoting the international treaty framework A/RES/75/144 3/3 20-17231 to developing countries, in order to develop and enhance their treaty practice, including in the use of information and communications technology;",
    "7": "Further welcomes the efforts made to develop and enhance the United Nations electronic treaty database, which provides online access to comprehensive information on the depositary functions of the Secretary-General and the registration and publication of treaties under Article 102 of the Charter, and encourages the continuation of such efforts in the future, while bearing in mind the challenges that many developing countries face in accessing information and communications technology;",
    "8": "Notes that most submissions of treaties for registration are in electronic format, and encourages the Secretary-General to develop, in consultation with and on the basis of feedback from Member States and within existing resources, an online treaty registration system to facilitate submissions of treaties for registration, as an additional option to the existing ways of submission in electronic or hard-copy format;",
    "9": "Recognizes the importance of the legal publications prepared by the Treaty Section, and stresses the need to update the Summary of Practice of the Secretary- General as Depositary of Multilateral Treaties in the light of new developments and practices;",
    "10": "Acknowledges the efforts of the depositaries in the registration of treaties under Article 102 of the Charter, and encourages the continuation of such efforts in the future;",
    "11": "Calls upon the Secretary-General to ensure the expedited publication of the United Nations Treaty Series, in accordance with the regulations, through the prompt provision of editorial and translation services, to enable effective dissemination of and access to treaties;",
    "12": "Decides to defer consideration of proposals on the regulations to the seventy-sixth session, taking into account the limitations on meetings within the United Nations premises as precautionary measures aimed at containing the spread of COVID-19;",
    "13": "Takes note of the proposals made by Member States on the regulations, encourages Member States to submit to the Secretariat any additional proposals before 30 June 2021, and requests the Secretariat to transmit all the proposals it has received to Member States;",
    "14": "Decides to include in the provisional agenda of its seventy-sixth session the item entitled \u201cStrengthening and promoting the international treaty framework\u201d. 45th plenary meeting 15 December 2020"
  },
  "agenda_items": [
    "Item 90"
  ],
  "symbol_references": []
}