{
  "symbol": "A/RES/76/256",
  "filename": "A_RES_76_256.pdf",
  "title": "76/256. International Day of Plant Health",
  "text": "United Nations \nA/RES/76/256\n \n \nGeneral Assembly \nDistr.: General \n31 March 2022 \n \n22-04678 (E)    040422     \n*2204678* \n \n \nSeventy-sixth session \nAgenda item 15 \nIntegrated and coordinated implementation of and follow-\nup to the outcomes of the major United Nations conferences \nand summits in the economic, social and related fields \n \n \n \n \n Resolution adopted by the General Assembly \non 29 March 2022 \n \n \n \n \n[without reference to a Main Committee (A/76/L.42 and A/76/L.42/Add.1)] \n \n \n 76/256. International Day of Plant Health \n \n \n \nThe General Assembly,  \n \nReaffirming its resolution 70/1 of 25 September 2015, entitled \u201cTransforming \nour world: the 2030 Agenda for Sustainable Development\u201d, in which it adopted a \ncomprehensive, far-reaching and people-centred set of universal and transformative \nSustainable Development Goals and targets, its commitment to working tirelessly for \nthe full implementation of the Agenda by 2030, its recognition that eradicating \npoverty in all its forms and dimensions, including extreme poverty, is the greatest \nglobal challenge and an indispensable requirement for sustainable development, its \ncommitment to achieving sustainable development in its three dimensions \u2013 \neconomic, social and environmental \u2013 in a balanced and integrated manner, and to \nbuilding upon the achievements of the Millennium Development Goals and seeking \nto address their unfinished business, \n \nReaffirming also its resolutions 53/199 of 15 December 1998 and 61/185 of \n20 December 2006 on the proclamation of international years, and Economic and \nSocial Council resolution 1980/67 of 25 July 1980 on international years and \nanniversaries, in particular paragraphs 1 to 10 of the annex thereto on the agreed \ncriteria for the proclamation of international years, as well as paragraphs 13 and 14, \nin which it is stated that an international year should not be proclaimed before the \nbasic arrangements for its organization and financing have been made, \n \nRecalling resolution 6/2021 of 18 June 2021, adopted by the Conference of the \nFood and Agriculture Organization of the United Nations at its forty-second session,1  \n__________________ \n \n1  Food and Agriculture Organization of the United Nations, document C 2021/REP, appendix E. \n\nA/RES/76/256 \nInternational Day of Plant Health\n \n22-04678\n2/3 \n \n \nRecognizing the success of the International Year of Plant Health, 2020, declared \nby the General Assembly in its resolution 73/252 of 20 December 2018, which raised \nglobal awareness of the role of plant health in reducing hunger and poverty, protecting \nthe environment and boosting economic development, \n \nRecalling the endorsement by the Commission on Phytosanitary Measures, at its \ntwelfth session, of the proclamation of an International Day of Plant Health as one of the \nkey legacies of the International Year of Plant Health, as also endorsed by the \nInternational Steering Committee of the International Year at its second meeting and the \nBureau of the Commission on Phytosanitary Measures at its meeting of December 2019,  \n \nNoting that healthy plants constitute the foundation for all life on Earth, as well \nas ecosystem functions, food security and nutrition, which are key to sustaining life \non Earth,  \n \nRecognizing that plant health is key to the sustainable development of \nagriculture to feed the growing global population by 2050, \n \nRecognizing also that sustaining plant health protects the environment, forests \nand biodiversity from plant pests, addresses the effects of climate change, and \nsupports efforts to end hunger, malnutrition and poverty and boosts economic \ndevelopment, and that the protection of plant health from pests is a key factor in \nstrategies to eliminate hunger and rural poverty,  \n \nStressing the urgent need to raise awareness of and to promote and facilitate \nactions towards the management of plant health in order to contribute to the \nimplementation of the 2030 Agenda,  \n \nTrusting that the observance of an international day will encourage actions to \npromote and implement activities in favour of preserving and sustaining global plant \nresources and raise awareness of the importance of plant health in addressing issues \nof global concern, including hunger, poverty and threats to the environment, \n \nRecognizing that the observance of an International Day of Plant Health on \n12 May every year by the international community will contribute significantly to \nraising awareness of these issues, while building on the momentum gained through \nthe International Year of Plant Health,  \n \nl. \nDecides to designate 12 May as the International Day of Plant Health;  \n \n2. \nInvites all Member States, organizations of the United Nations system, \nother international and regional organizations and other relevant stakeholders, \nincluding civil society, the private sector and academia, as well as schools, to observe \nthe International Day, as appropriate, through activities aimed at raising awareness of \nthe importance of plant health and its economic, social and environmental impact on \nfood security and nutrition and ecosystem functions, and to share best practices in \nthis regard; \n \n3. \nInvites the Food and Agriculture Organization of the United Nations, in \ncollaboration with the International Plant Protection Convention, to facilitate the \nobservance of the International Day, mindful of the provisions contained in the annex \nto Economic and Social Council resolution 1980/67;  \n \n4. \nStresses that the costs of all the activities that may arise from the \nimplementation of the present resolution should be met through voluntary \ncontributions, including from the private sector;  \n \n5. \nInvites all relevant stakeholders to contribute to and support the \nInternational Day;  \n\nInternational Day of Plant Health \nA/RES/76/256\n \n3/3\n22-04678 \n \n \n6. \nRequests the Secretary-General to bring the present resolution to the \nattention of all Member States, the organizations of the United Nations system and \nother relevant stakeholders, including civil society, the private sector and academia, \nfor appropriate observance. \n \n63rd plenary meeting \n29 March 2022 \n \n",
  "paragraphs": {
    "2": "Invites all Member States, organizations of the United Nations system, other international and regional organizations and other relevant stakeholders, including civil society, the private sector and academia, as well as schools, to observe the International Day, as appropriate, through activities aimed at raising awareness of the importance of plant health and its economic, social and environmental impact on food security and nutrition and ecosystem functions, and to share best practices in this regard;",
    "3": "Invites the Food and Agriculture Organization of the United Nations, in collaboration with the International Plant Protection Convention, to facilitate the observance of the International Day, mindful of the provisions contained in the annex to Economic and Social Council resolution 1980/67;",
    "4": "Stresses that the costs of all the activities that may arise from the implementation of the present resolution should be met through voluntary contributions, including from the private sector;",
    "5": "Invites all relevant stakeholders to contribute to and support the International Day; International Day of Plant Health A/RES/76/256 3/3 22-04678",
    "6": "Requests the Secretary-General to bring the present resolution to the attention of all Member States, the organizations of the United Nations system and other relevant stakeholders, including civil society, the private sector and academia, for appropriate observance. 63rd plenary meeting 29 March 2022"
  },
  "agenda_items": [
    "Item 15"
  ],
  "symbol_references": [
    "A/76/L.42"
  ]
}