{
  "symbol": "A/RES/74/191",
  "filename": "A_RES_74_191.pdf",
  "title": "74/191. The rule of law at the national and international levels",
  "text": "United Nations \nA/RES/74/191\n \n \nGeneral Assembly \nDistr.: General \n30 December 2019 \n \n19-22399 (E)    090120 \n*1922399* \n \n \nSeventy-fourth session \nAgenda item 83 \nThe rule of law at the national and international levels \n \n \n \n \n Resolution adopted by the General Assembly \non 18 December 2019 \n \n \n \n \n[on the report of the Sixth Committee (A/74/429)] \n \n \n 74/191. The rule of law at the national and international levels \n \n \n \nThe General Assembly, \n \nRecalling its resolution 73/207 of 20 December 2018, \n \nReaffirming its commitment to the purposes and principles of the Charter of the \nUnited Nations and international law, which are indispensable foundations of a more \npeaceful, prosperous and just world, and reiterating its determination to foster strict \nrespect for them and to establish a just and lasting peace all over the world, \n \nReaffirming that human rights, the rule of law and democracy are interlinked \nand mutually reinforcing and that they belong to the universal and indivisible core \nvalues and principles of the United Nations, \n \nReaffirming also the need for universal adherence to and implementation of the \nrule of law at both the national and international levels and its solemn commitment \nto an international order based on the rule of law and international law, which, \ntogether with the principles of justice, is essential for peaceful coexistence and \ncooperation among States, \n \nBearing in mind that the activities of the United Nations carried out in support \nof efforts of Governments to promote and consolidate the rule of law are undertaken \nin accordance with the Charter, and stressing the need to strengthen support to \nMember States, upon their request, in the domestic implementation of their respective \ninternational obligations through enhanced technical assistance and capacity-\nbuilding, \n \nConvinced that the advancement of the rule of law at the national and \ninternational levels is essential for the realization of sustained economic growth, \nsustainable development, the eradication of poverty and hunger and the protection of \nall human rights and fundamental freedoms, and acknowledging that collective \n\nA/RES/74/191 \nThe rule of law at the national and international levels\n \n19-22399\n2/4 \n \nsecurity depends on effective cooperation, in accordance with the Charter and \ninternational law, against transnational threats, \n \nReaffirming the duty of all States to refrain in their international relations from \nthe threat or use of force in any manner inconsistent with the purposes and principles \nof the United Nations and to settle their international disputes by peaceful means in \nsuch a manner that international peace and security and justice are not endangered, in \naccordance with Chapter VI of the Charter, and calling upon States that have not yet \ndone so to consider accepting the jurisdiction of the International Court of Justice in \naccordance with its Statute, \n \nConvinced that the promotion of and respect for the rule of law at the national \nand international levels, as well as justice and good governance, should guide the \nactivities of the United Nations and its Member States, \n \nRecalling paragraph 134 (e) of the 2005 World Summit Outcome, 1  \n \n1. \nRecalls the high-level meeting of the General Assembly on the rule of law \nat the national and international levels, held during the high-level segment of its sixty-\nseventh session, and the declaration adopted at that meeting, 2 takes note of the report \nof the Secretary-General submitted pursuant to paragraph 41 of the declaration, 3 and \nrequests the Sixth Committee to continue its consideration of ways and means of \nfurther developing the linkages between the rule of law and the three pillars of the \nUnited Nations; \n \n2. \nAcknowledges the efforts to strengthen the rule of law through voluntary \npledges, encourages all States to consider making pledges, individually or jointly, \nbased on their national priorities, and also encourages those States that have made \npledges to continue to exchange information, knowledge and best practices in this \nregard; \n \n3. \nTakes note of the annual report of the Secretary-General on strengthening \nand coordinating United Nations rule of law activities; 4  \n \n4. \nEncourages the Secretary-General and the United Nations system to \naccord high priority to rule of law activities; \n \n5. \nReaffirms the role of the General Assembly in encouraging the progressive \ndevelopment of international law and its codification, and further reaffirms that States \nshall abide by all of their obligations under international law; \n \n6. \nAlso reaffirms the imperative of upholding and promoting the rule of law \nat the international level in accordance with the principles of the Charter of the United \nNations; \n \n7. \nFurther reaffirms its commitment to working tirelessly for the full \nimplementation of the 2030 Agenda for Sustainable Development, 5 and recalls that \nthe goals and targets are integrated and indivisible and balance the three dimensions \nof sustainable development; \n \n8. \nRecognizes the role of multilateral and bilateral treaties and treaty \nprocesses in advancing the rule of law, and encourages States to further consider the \npromotion of treaties in areas where international cooperation could benefit from \ntreaties; \n__________________ \n \n1  Resolution 60/1. \n \n2  Resolution 67/1. \n \n3  A/68/213/Add.1. \n \n4  A/74/139. \n \n5  Resolution 70/1. \n\nThe rule of law at the national and international levels \nA/RES/74/191\n \n3/4\n19-22399 \n \n \n9. \nWelcomes the dialogue initiated by the Rule of Law Coordination and \nResource Group and the Rule of Law Unit in the Executive Office of the Secretary-\nGeneral with Member States on the topic \u201cPromoting the rule of law at the \ninternational level\u201d, and calls for the continuation of this dialogue with a view to \nfostering the rule of law at the international level; \n \n10. Recognizes the importance of the United Nations Programme of Assistance \nin the Teaching, Study, Dissemination and Wider Appreciation of International Law \nto the furtherance of United Nations rule of law programmes and activities, \nemphasizes that further technical assistance and capacity-building initiatives, focused \non increasing and improving the participation of Member States in the multilateral \ntreaty process, should be examined, and invites States to support these activities; \n \n11. \nStresses the importance of adherence to the rule of law at the national level \nand the need to strengthen support to Member States, upon their request, in the \ndomestic implementation of their respective international obligations through \nenhanced technical assistance and capacity-building in order to develop, reinforce \nand maintain domestic institutions active in the promotion of rule of law at the \nnational and international levels, subject to national ownership, strategies and \npriorities; \n \n12. Reiterates its request to the Secretary-General to ensure greater \ncoordination and coherence among the United Nations entities and with donors and \nrecipients, and reiterates its call for greater evaluation of the effectiveness of such \nactivities, including possible measures to improve the effectiveness of those capacity-\nbuilding activities; \n \n13. Calls, in this context, for dialogue to be enhanced among all stakeholders, \nwith a view to placing national perspectives at the centre of rule of law assistance in \norder to strengthen national ownership, while recognizing that rule of law activities \nmust be anchored in a national context and that States have different national \nexperiences in the development of their systems of the rule of law, taking into account \ntheir legal, political, socioeconomic, cultural, religious and other local specificities, \nwhile also recognizing that there are common features founded on international norms \nand standards; \n \n14. Calls upon the Secretary-General and the United Nations system to \nsystematically address, as appropriate, aspects of the rule of law in relevant activities, \nincluding the participation of women in rule of law-related activities, recognizing the \nimportance of the rule of law to virtually all areas of United Nations engagement; \n \n15. Expresses full support for the overall coordination and coherence role of \nthe Rule of Law Coordination and Resource Group within the United Nations system, \nwithin existing mandates, supported by the Rule of Law Unit and under the leadership \nof the Deputy Secretary-General; \n \n16. Requests the Secretary-General to submit, in a timely manner, his next \nannual report on United Nations rule of law activities, in accordance with paragraph 5 \nof its resolution 63/128 of 11 December 2008, addressing, in a balanced manner, the \nnational and international dimensions of the rule of law; \n \n17. Recognizes the importance of restoring confidence in the rule of law as a \nkey element of transitional justice; \n \n18. Recalls the commitment of Member States to take all necessary steps to \nprovide fair, transparent, effective, non-discriminatory and accountable services that \npromote access to justice for all, including legal aid, encourages further dialogue and \nthe sharing of national practices and expertise in strengthening the rule of law through \naccess to justice, including with regard to the provision of birth registration for all, \n\nA/RES/74/191 \nThe rule of law at the national and international levels\n \n19-22399\n4/4 \n \nappropriate registration and documentation of refugees, migrants, asylum seekers and \nstateless persons, and legal aid, where appropriate, in both criminal and civil \nproceedings, and in this regard recognizes the role of knowledge and technology, \nincluding in judicial systems, and stresses the need to intensify the assistance \nextended to Governments upon their request; \n \n19. Stresses the importance of promoting the sharing of national practices and \nof inclusive dialogue, welcomes the proposals made by the Secretary-General, \ninviting Member States to voluntarily exchange national best practices on the rule of \nlaw in informal meetings and on an electronic depository of best practices on the \nUnited Nations rule of law website, and invites Member States to do so; \n \n20. Invites the International Court of Justice, the United Nations Commission \non International Trade Law and the International Law Commission to continue to \ncomment, in their respective reports to the General Assembly, on their current roles \nin promoting the rule of law; \n \n21. Invites the Rule of Law Coordination and Resource Group and the Rule of \nLaw Unit to continue their dialogue with all Member States by interacting with them \nin a regular, transparent and inclusive manner, in particular in informal briefings; \n \n22. Stresses the need for the Rule of Law Unit to carry out its tasks in an \neffective and sustainable manner and the need to provide it with reasonable means \nrequired to that effect; \n \n23. Decides to include in the provisional agenda of its seventy-fifth session \nthe item entitled \u201cThe rule of law at the national and international levels\u201d, and invites \nMember States to focus their comments during the upcoming Sixth Committee debate \non the subtopic \u201cMeasures to prevent and combat corruption\u201d. \n \n51st plenary meeting \n18 December 2019 \n \n",
  "paragraphs": {
    "1": "Recalls the high-level meeting of the General Assembly on the rule of law at the national and international levels, held during the high-level segment of its sixty- seventh session, and the declaration adopted at that meeting, 2 takes note of the report of the Secretary-General submitted pursuant to paragraph 41 of the declaration, 3 and requests the Sixth Committee to continue its consideration of ways and means of further developing the linkages between the rule of law and the three pillars of the United Nations;",
    "2": "Acknowledges the efforts to strengthen the rule of law through voluntary pledges, encourages all States to consider making pledges, individually or jointly, based on their national priorities, and also encourages those States that have made pledges to continue to exchange information, knowledge and best practices in this regard;",
    "3": "Takes note of the annual report of the Secretary-General on strengthening and coordinating United Nations rule of law activities; 4",
    "4": "Encourages the Secretary-General and the United Nations system to accord high priority to rule of law activities;",
    "5": "Reaffirms the role of the General Assembly in encouraging the progressive development of international law and its codification, and further reaffirms that States shall abide by all of their obligations under international law;",
    "6": "Also reaffirms the imperative of upholding and promoting the rule of law at the international level in accordance with the principles of the Charter of the United Nations;",
    "7": "Further reaffirms its commitment to working tirelessly for the full implementation of the 2030 Agenda for Sustainable Development, 5 and recalls that the goals and targets are integrated and indivisible and balance the three dimensions of sustainable development;",
    "8": "Recognizes the role of multilateral and bilateral treaties and treaty processes in advancing the rule of law, and encourages States to further consider the promotion of treaties in areas where international cooperation could benefit from treaties; __________________ 1 Resolution 60/1. 2 Resolution 67/1. 3 A/68/213/Add.1. 4 A/74/139. 5 Resolution 70/1. The rule of law at the national and international levels A/RES/74/191 3/4 19-22399",
    "9": "Welcomes the dialogue initiated by the Rule of Law Coordination and Resource Group and the Rule of Law Unit in the Executive Office of the Secretary- General with Member States on the topic \u201cPromoting the rule of law at the international level\u201d, and calls for the continuation of this dialogue with a view to fostering the rule of law at the international level;",
    "10": "Recognizes the importance of the United Nations Programme of Assistance in the Teaching, Study, Dissemination and Wider Appreciation of International Law to the furtherance of United Nations rule of law programmes and activities, emphasizes that further technical assistance and capacity-building initiatives, focused on increasing and improving the participation of Member States in the multilateral treaty process, should be examined, and invites States to support these activities;",
    "11": "Stresses the importance of adherence to the rule of law at the national level and the need to strengthen support to Member States, upon their request, in the domestic implementation of their respective international obligations through enhanced technical assistance and capacity-building in order to develop, reinforce and maintain domestic institutions active in the promotion of rule of law at the national and international levels, subject to national ownership, strategies and priorities;",
    "12": "Reiterates its request to the Secretary-General to ensure greater coordination and coherence among the United Nations entities and with donors and recipients, and reiterates its call for greater evaluation of the effectiveness of such activities, including possible measures to improve the effectiveness of those capacity- building activities;",
    "13": "Calls, in this context, for dialogue to be enhanced among all stakeholders, with a view to placing national perspectives at the centre of rule of law assistance in order to strengthen national ownership, while recognizing that rule of law activities must be anchored in a national context and that States have different national experiences in the development of their systems of the rule of law, taking into account their legal, political, socioeconomic, cultural, religious and other local specificities, while also recognizing that there are common features founded on international norms and standards;",
    "14": "Calls upon the Secretary-General and the United Nations system to systematically address, as appropriate, aspects of the rule of law in relevant activities, including the participation of women in rule of law-related activities, recognizing the importance of the rule of law to virtually all areas of United Nations engagement;",
    "15": "Expresses full support for the overall coordination and coherence role of the Rule of Law Coordination and Resource Group within the United Nations system, within existing mandates, supported by the Rule of Law Unit and under the leadership of the Deputy Secretary-General;",
    "16": "Requests the Secretary-General to submit, in a timely manner, his next annual report on United Nations rule of law activities, in accordance with paragraph 5 of its resolution 63/128 of 11 December 2008, addressing, in a balanced manner, the national and international dimensions of the rule of law;",
    "17": "Recognizes the importance of restoring confidence in the rule of law as a key element of transitional justice;",
    "18": "Recalls the commitment of Member States to take all necessary steps to provide fair, transparent, effective, non-discriminatory and accountable services that promote access to justice for all, including legal aid, encourages further dialogue and the sharing of national practices and expertise in strengthening the rule of law through access to justice, including with regard to the provision of birth registration for all, A/RES/74/191 The rule of law at the national and international levels 19-22399 4/4 appropriate registration and documentation of refugees, migrants, asylum seekers and stateless persons, and legal aid, where appropriate, in both criminal and civil proceedings, and in this regard recognizes the role of knowledge and technology, including in judicial systems, and stresses the need to intensify the assistance extended to Governments upon their request;",
    "19": "Stresses the importance of promoting the sharing of national practices and of inclusive dialogue, welcomes the proposals made by the Secretary-General, inviting Member States to voluntarily exchange national best practices on the rule of law in informal meetings and on an electronic depository of best practices on the United Nations rule of law website, and invites Member States to do so;",
    "20": "Invites the International Court of Justice, the United Nations Commission on International Trade Law and the International Law Commission to continue to comment, in their respective reports to the General Assembly, on their current roles in promoting the rule of law;",
    "21": "Invites the Rule of Law Coordination and Resource Group and the Rule of Law Unit to continue their dialogue with all Member States by interacting with them in a regular, transparent and inclusive manner, in particular in informal briefings;",
    "22": "Stresses the need for the Rule of Law Unit to carry out its tasks in an effective and sustainable manner and the need to provide it with reasonable means required to that effect;",
    "23": "Decides to include in the provisional agenda of its seventy-fifth session the item entitled \u201cThe rule of law at the national and international levels\u201d, and invites Member States to focus their comments during the upcoming Sixth Committee debate on the subtopic \u201cMeasures to prevent and combat corruption\u201d. 51st plenary meeting 18 December 2019"
  },
  "agenda_items": [
    "Item 83"
  ],
  "symbol_references": []
}