{
  "symbol": "A/RES/75/148",
  "filename": "A_RES_75_148.pdf",
  "title": "75/148. Observer status for the Central Asia Regional Economic Cooperation Institute in the General Assembly",
  "text": "United Nations \nA/RES/75/148 \n \n \nGeneral Assembly \nDistr.: General \n22 December 2020 \n \n20-17236 (E)    291220 \n*2017236* \n \n \nSeventy-fifth session \nAgenda item 181 \nObserver status for the Central Asia Regional Economic \nCooperation Institute in the General Assembly  \n \n \n \n \n Resolution adopted by the General Assembly \non 15 December 2020 \n \n \n \n \n[on the report of the Sixth Committee (A/75/449, para. 7)] \n \n \n 75/148. Observer status for the Central Asia Regional Economic \nCooperation Institute in the General Assembly \n \n \n \nThe General Assembly, \n \nWishing to promote cooperation between the United Nations and the Central \nAsia Regional Economic Cooperation Institute, \n \n1. \nDecides to invite the Central Asia Regional Economic Cooperation \nInstitute to participate in the sessions and the work of the General Assembly in the \ncapacity of observer; \n \n2. \nRequests the Secretary-General to take the action necessary to implement \nthe present resolution. \n \n45th plenary meeting \n15 December 2020 \n \n \n",
  "paragraphs": {
    "1": "Decides to invite the Central Asia Regional Economic Cooperation Institute to participate in the sessions and the work of the General Assembly in the capacity of observer;",
    "2": "Requests the Secretary-General to take the action necessary to implement the present resolution. 45th plenary meeting 15 December 2020"
  },
  "agenda_items": [
    "Item 181"
  ],
  "symbol_references": []
}