{
  "symbol": "A/RES/76/70",
  "filename": "A_RES_76_70.pdf",
  "title": "76/70. Problem of the militarization of the Autonomous Republic of Crimea and the city of Sevastopol, Ukraine, as well as parts of the Black Sea and the Sea of Azov",
  "text": "United Nations \nA/RES/76/70\n \n \nGeneral Assembly \nDistr.: General \n16 December 2021 \n \n21-18574 (E)    221221 \n*2118574* \n \n \nSeventy-sixth session \nAgenda item 35 (a) \nPrevention of armed conflict: prevention of armed conflict \n \n \n \n \n Resolution adopted by the General Assembly on \n9 December 2021 \n \n \n \n \n[without reference to a Main Committee (A/76/L.22 and A/76/L.22/Add.1)] \n \n \n \n76/70. Problem of the militarization of the Autonomous Republic of \nCrimea and the city of Sevastopol, Ukraine, as well as parts of the \nBlack Sea and the Sea of Azov \n \n \n \nThe General Assembly, \n \nRecalling the Charter of the United Nations, in which it was stated, inter alia, \nthat all Members of the United Nations shall refrain in their international relations \nfrom the threat or use of force against the territorial integrity or political independence \nof any State, or in any other manner inconsistent with the purposes of the United \nNations, \n \nRecalling also its resolution 2625 (XXV) of 24 October 1970, in which it \napproved the Declaration on Principles of International Law concerning Friendly \nRelations and Cooperation among States in accordance with the Charter of the United \nNations, and the principles contained therein, \n \nMindful of the 1975 Helsinki Final Act of the Conference on Security and \nCooperation in Europe and the Declaration on Principles Guiding Relations between \nParticipating States contained therein, \n \nRecalling its resolution 68/262 of 27 March 2014 on the territorial integrity of \nUkraine, in which it affirmed its commitment to the sovereignty, political \nindependence, unity and territorial integrity of Ukraine within its internationally \nrecognized borders, \n \nRecalling also its resolutions 73/194 of 17 December 2018, 74/17 of \n9  December 2019 and 75/29 of 7 December 2020 on the problem of the militarization \nof the Autonomous Republic of Crimea and the city of Sevastopol, Ukraine, as well \nas parts of the Black Sea and the Sea of Azov, \n \nRecalling further its resolutions 71/205 of 19 December 2016, 72/190 of \n19  December 2017, 73/263 of 22 December 2018, 74/168 of 18 December 2019 and \n\nA/RES/76/70 \nProblem of the militarization of the Autonomous Republic of \nCrimea and the city of Sevastopol, Ukraine, as well as parts of the \nBlack Sea and the Sea of Azov\n \n21-18574\n2/5 \n \n75/192 of 16 December 2020 on the situation of human rights in the Autonomous \nRepublic of Crimea and the city of Sevastopol, Ukraine, \n \nGravely concerned that the provisions of those resolutions and relevant \ndecisions of international organizations, specialized agencies and bodies within the \nUnited Nations system have not been implemented by the Russian Federation, \n \nRecalling its resolution 3314 (XXIX) of 14 December 1974, in the annex to \nwhich it was stated, inter alia, that no territorial acquisition or special advantage \nresulting from aggression is or shall be recognized as lawful, \n \nCondemning the ongoing temporary occupation of part of the territory of \nUkraine, namely, the Autonomous Republic of Crimea and the city of Sevastopol \n(hereinafter referred to as \u201cCrimea\u201d), by the Russian Federation, and reaffirming the \nnon-recognition of its annexation, \n \nRecalling that the temporary occupation of Crimea and the threat or use of force \nagainst the territorial integrity or political independence of Ukraine by the Russian \nFederation is in contravention of commitments made in the Memorandum on Security \nAssurances in Connection with Ukraine\u2019s Accession to the Treaty on the \nNon- Proliferation of Nuclear Weapons (Budapest Memorandum) of 5 December \n1994,1 in which, inter alia, the obligations to refrain from the threat or use of force \nagainst the territorial integrity or political independence of Ukraine and the \ncommitment to respect the independence and sovereignty and the existing borders of \nUkraine were reaffirmed, \n \nDeeply concerned by the illegal seizure and establishment of control by the \nRussian Federation over the former nuclear weapons storage sites in Crimea, which \nmay pose a threat to regional and global security, \n \nExpressing concern over the efforts of the Russian Federation to extend its \njurisdiction over the nuclear facilities and material in Crimea, in respect of which the \nAgreement between Ukraine and the International Atomic Energy Agency for the \nApplication of Safeguards in connection with the Treaty on the Non-Proliferation of \nNuclear Weapons and the Additional Protocol thereto continue to apply, \n \nExpressing concern also about the ongoing deterioration of the international \nsecurity and arms control architecture, including as a result of the temporary \noccupation by the Russian Federation of the territories of the Autonomous Republic \nof Crimea and the city of Sevastopol, which has had a destabilizing impact on the \ninternational arms control regimes and confidence- and security-building measures, \nincluding those established by the Treaty on Open Skies, the Treaty on Conventional \nArmed Forces in Europe 2  and the Vienna Document 2011 on Confidence- and \nSecurity-Building Measures, and rejecting the attempts by the Russian Federation to \nadvance its narrative about its actions in the temporarily occupied Crimea through the \nimplementation of international arms control regimes,  \n \nAffirming that the seizure of Crimea by force is illegal and a violation of \ninternational law, and affirming also that those territories must be immediately \nreturned, \n \nRecalling the prohibition, under international humanitarian law, for the \noccupying Power to compel protected persons to serve in its armed or auxiliary forces, \nincluding through pressure or propaganda that is aimed at securing voluntary \nenlistment, and condemning the ongoing recruitment and conscription campaigns in \n__________________ \n \n1 A/49/765-S/1994/1399, annex I. \n \n2 See CD/1064. \n\nProblem of the militarization of the Autonomous Republic of \nCrimea and the city of Sevastopol, Ukraine, as well as parts of the \nBlack Sea and the Sea of Azov \nA/RES/76/70\n \n3/5\n21-18574 \n \nCrimea and criminal prosecutions, which include fines, correctional labour and \nimprisonment of Crimean residents for draft evasion, \n \nConcerned by efforts to use the education of children in Crimea in order to \nindoctrinate them to join the Russian military forces, \n \nRecalling the order of the International Tribunal for the Law of the Sea of \n25  May 2019 on provisional measures in the Case concerning the detention of three \nUkrainian naval vessels (Ukraine v. Russian Federation) and Procedural Order No. 1 \nof the Arbitral Tribunal Constituted under Annex VII to the 1982 United Nations \nConvention on the Law of the Sea between Ukraine and the Russian Federation in \nrespect of a Dispute concerning the Detention of Ukrainian Naval Vessels and \nServicemen of 22 November 2019, \n \nNoting the fact that security concerns, the unprovoked build-up of forces in and \naround Ukraine and the holding of Russian military exercises in the Black Sea and \nthe Sea of Azov regions, accompanied by closures and restrictions of the lawful \nexercise of navigational rights and freedoms, further destabilize the economy and \nsocial services, particularly in the coastal regions of Ukraine, \n \nSupporting the commitment by Ukraine to adhere to international law in its \nefforts to put an end to the temporary Russian occupation of Crimea, \n \nNoting the establishment of the International Crimea Platform and the adoption \nof the Joint Declaration of the International Crimea Platform Participants,3  \n \n1. \nUrges the Russian Federation, as the occupying Power, immediately, \ncompletely and unconditionally to withdraw its military forces from Crimea and end \nits temporary occupation of the territory of Ukraine without delay; \n \n2. \nCalls upon all Member States and relevant international organizations to \ncooperate with the United Nations to encourage and support efforts to put an end to \nthe Russian occupation of Crimea as rapidly as possible and to refrain from any action \nor dealing with the Russian Federation regarding Crimea that is inconsistent with this \naim; \n \n3. \nSupports commitments and concerted efforts by the international \ncommunity, including within international frameworks and the International Crimea \nPlatform, to address existing and emerging challenges resulting from the progressive \nmilitarization of Crimea and parts of the Black Sea and the Sea of Azov, which \nundermines security and stability in the region and beyond, and supports the peaceful \nde-occupation of Crimea; \n \n4. \nStresses that the presence of Russian troops in Crimea is contrary to the \nnational sovereignty, political independence and territorial integrity of Ukraine and \nundermines the security and stability of neighbouring countries and the European \nregion; \n \n5. \nReiterates its grave concern over the progressive militarization of Crimea \nby the Russian Federation, as the occupying Power, namely the continuing \ndestabilization of Crimea owing to transfers by the Russian Federation of \nconventional weapons, including advanced weapon systems, battle tanks, armoured \ncombat vehicles, nuclear-capable aircraft, helicopters and missiles, as well as small \narms and light weapons, ammunition and military personnel, to the territory of \nUkraine, and urges the Russian Federation to stop such activity without delay; \n \n6. \nCalls upon the Russian Federation to engage constructively with \nconfidence- and security-building and risk reduction mechanisms to build \n__________________ \n \n3 A/76/503-S/2021/908, annex. \n\nA/RES/76/70 \nProblem of the militarization of the Autonomous Republic of \nCrimea and the city of Sevastopol, Ukraine, as well as parts of the \nBlack Sea and the Sea of Azov\n \n21-18574\n4/5 \n \ntransparency over its regular military activity in Crimea, which undermines stability, \nmilitary predictability and trust in the broader region; \n \n7. \nCondemns the use of seized Ukrainian military industry enterprises in the \noccupied Crimea by the Russian Federation, including for further development and \nbuild-up of forces; \n \n8. \nCalls upon the Russian Federation to refrain from efforts to extend its \njurisdiction over the nuclear facilities and material in Crimea; \n \n9. \nExpresses its deep concern over the continued conscription by the Russian \nFederation of the residents of Crimea, including those holding Ukrainian citizenship, \ninto its armed forces, including assignment to military bases in the Russian \nFederation, and urges the Russian Federation to stop such activity, which contradicts \ninternational humanitarian law, without delay; \n \n10. Calls upon the Russian Federation to refrain from establishing educational \ninstitutions that provide combat training to Crimean children with the stated aim of \ntraining for military service in the Russian armed forces, to refrain from establishing \ncombat training courses at Crimean schools and to cease efforts to formally \nincorporate Crimean educational institutions into the \u201cmilitary-patriotic\u201d education \nsystem of the Russian Federation; \n \n11. \nReiterates its concern regarding multiple military exercises of Russian \narmed forces held in Crimea and parts of the Black Sea and the Sea of Azov, which \nundermine regional security and entail considerable long-term negative environmental \nconsequences in the region; \n \n12. Calls upon the Russian Federation to refrain from unlawful activities in \nCrimea and parts of the Black Sea and the Sea of Azov, including but not limited to \ninterfering and blocking navigation both for commercial vessels going to and from \nports of Ukraine and for government ships sailing under various flags, which further \nexacerbate tensions in the region and beyond; \n \n13. Condemns the construction by the Russian Federation of navy vessels at \nthe seized shipyards in the temporarily occupied Crimea, which further contributes to \nthe build-up of forces and poses a threat to regional security and stability; \n \n14. Expresses its concern over the extension of naval bases for the Black Sea \nfleet of the Russian Federation in Crimea; \n \n15. Also expresses its concern about the adoption by the Russian Federation \nof legislation that grants its National Guard the right to block areas adjacent to certain \ninfrastructure facilities in Crimea and parts of the Black Sea, the Sea of Azov and the \nKerch Strait, and which therefore may be used to interfere with navigational rights in \nviolation of international law; \n \n16. Further expresses its concern over the deployment by the Russian \nFederation of military and security forces for the protection of the offshore oil \nplatforms located in the Black Sea, which are the property of Ukraine and which have \nbeen seized by the Russian Federation, thus excluding Ukraine from its maritime \nareas, the exploitation by the Russian Federation of the underlying natural resources \nin those areas and its usurpation of the jurisdiction of Ukraine there; \n \n17. Expresses its utmost concern about the dangerous increase in tensions and \nthe unjustified use of force by the Russian Federation against Ukraine, in the Black \nSea, the Sea of Azov and the Kerch Strait, including the intentional obstruction of \ntraffic; \n \n18. Calls upon the Russian Federation to return to Ukraine unconditionally \nand without delay all equipment and weapons seized from the vessels Berdyansk, \n\nProblem of the militarization of the Autonomous Republic of \nCrimea and the city of Sevastopol, Ukraine, as well as parts of the \nBlack Sea and the Sea of Azov \nA/RES/76/70\n \n5/5\n21-18574 \n \nNikopol and the tugboat Yani Kapu during the unjustified use of force by the Russian \nFederation on 25 November 2018; \n \n19. Encourages further negotiations to ensure the release by the Russian \nFederation of all illegally detained Ukrainian citizens and their safe return to Ukraine; \n \n20. Calls upon the Russian Federation to refrain from impeding the lawful \nexercise of navigational rights and freedoms, exercised in accordance with applicable \ninternational law, including provisions of the 1982 United Nations Convention on the \nLaw of the Sea,4 including but not limited to closure of sea areas under the pretext of \nmilitary exercises, in the Black Sea, the Sea of Azov and the Kerch Strait; \n \n21. Condemns the construction and opening by the Russian Federation of the \nKerch Strait bridge and the railway bridge, which form a part of the Tavrida highway \nproject, between the Russian Federation and the temporarily occupied Crimea, which \nfacilitates the further militarization of Crimea and restricts the size of vessels that can \nreach the Ukrainian ports on the Azov coast; \n \n22. Also condemns the increasing military presence of the Russian Federation \nin parts of the Black Sea and the Sea of Azov, including the Kerch Strait, and the \nharassment by the Russian Federation of commercial vessels and its restriction of \ninternational shipping there, which further aggravates the economic and social \nsituation in the broader Donetsk region already affected by the temporary occupation \nof Crimea and subsequent ongoing destabilizing acts by the Russian Federation; \n \n23. Further condemns visits of Russian officials to the temporarily occupied \nCrimea, including those in connection with conducting military exercises, military \nparades and other activities; \n \n24. Calls upon all Member States, as well as international organizations and \nspecialized agencies, to refrain from any visits to Crimea that are not agreed with \nUkraine; \n \n25. Decides to continue its consideration of the matter at its seventy-seventh \nsession. \n \n48th plenary meeting \n9 December 2021 \n \n__________________ \n \n4 United Nations, Treaty Series, vol. 1833, No. 31363. \n",
  "paragraphs": {
    "1": "Urges the Russian Federation, as the occupying Power, immediately, completely and unconditionally to withdraw its military forces from Crimea and end its temporary occupation of the territory of Ukraine without delay;",
    "2": "Calls upon all Member States and relevant international organizations to cooperate with the United Nations to encourage and support efforts to put an end to the Russian occupation of Crimea as rapidly as possible and to refrain from any action or dealing with the Russian Federation regarding Crimea that is inconsistent with this aim;",
    "3": "Supports commitments and concerted efforts by the international community, including within international frameworks and the International Crimea Platform, to address existing and emerging challenges resulting from the progressive militarization of Crimea and parts of the Black Sea and the Sea of Azov, which undermines security and stability in the region and beyond, and supports the peaceful de-occupation of Crimea;",
    "4": "Stresses that the presence of Russian troops in Crimea is contrary to the national sovereignty, political independence and territorial integrity of Ukraine and undermines the security and stability of neighbouring countries and the European region;",
    "5": "Reiterates its grave concern over the progressive militarization of Crimea by the Russian Federation, as the occupying Power, namely the continuing destabilization of Crimea owing to transfers by the Russian Federation of conventional weapons, including advanced weapon systems, battle tanks, armoured combat vehicles, nuclear-capable aircraft, helicopters and missiles, as well as small arms and light weapons, ammunition and military personnel, to the territory of Ukraine, and urges the Russian Federation to stop such activity without delay;",
    "6": "Calls upon the Russian Federation to engage constructively with confidence- and security-building and risk reduction mechanisms to build transparency over its regular military activity in Crimea, which undermines stability, military predictability and trust in the broader region;",
    "7": "Condemns the use of seized Ukrainian military industry enterprises in the occupied Crimea by the Russian Federation, including for further development and build-up of forces;",
    "8": "Calls upon the Russian Federation to refrain from efforts to extend its jurisdiction over the nuclear facilities and material in Crimea;",
    "9": "Expresses its deep concern over the continued conscription by the Russian Federation of the residents of Crimea, including those holding Ukrainian citizenship, into its armed forces, including assignment to military bases in the Russian Federation, and urges the Russian Federation to stop such activity, which contradicts international humanitarian law, without delay;",
    "10": "Calls upon the Russian Federation to refrain from establishing educational institutions that provide combat training to Crimean children with the stated aim of training for military service in the Russian armed forces, to refrain from establishing combat training courses at Crimean schools and to cease efforts to formally incorporate Crimean educational institutions into the \u201cmilitary-patriotic\u201d education system of the Russian Federation;",
    "11": "Reiterates its concern regarding multiple military exercises of Russian armed forces held in Crimea and parts of the Black Sea and the Sea of Azov, which undermine regional security and entail considerable long-term negative environmental consequences in the region;",
    "12": "Calls upon the Russian Federation to refrain from unlawful activities in Crimea and parts of the Black Sea and the Sea of Azov, including but not limited to interfering and blocking navigation both for commercial vessels going to and from ports of Ukraine and for government ships sailing under various flags, which further exacerbate tensions in the region and beyond;",
    "13": "Condemns the construction by the Russian Federation of navy vessels at the seized shipyards in the temporarily occupied Crimea, which further contributes to the build-up of forces and poses a threat to regional security and stability;",
    "14": "Expresses its concern over the extension of naval bases for the Black Sea fleet of the Russian Federation in Crimea;",
    "15": "Also expresses its concern about the adoption by the Russian Federation of legislation that grants its National Guard the right to block areas adjacent to certain infrastructure facilities in Crimea and parts of the Black Sea, the Sea of Azov and the Kerch Strait, and which therefore may be used to interfere with navigational rights in violation of international law;",
    "16": "Further expresses its concern over the deployment by the Russian Federation of military and security forces for the protection of the offshore oil platforms located in the Black Sea, which are the property of Ukraine and which have been seized by the Russian Federation, thus excluding Ukraine from its maritime areas, the exploitation by the Russian Federation of the underlying natural resources in those areas and its usurpation of the jurisdiction of Ukraine there;",
    "17": "Expresses its utmost concern about the dangerous increase in tensions and the unjustified use of force by the Russian Federation against Ukraine, in the Black Sea, the Sea of Azov and the Kerch Strait, including the intentional obstruction of traffic;",
    "18": " Nikopol and the tugboat Yani Kapu during the unjustified use of force by the Russian Federation on 25 November 2018;",
    "19": "Encourages further negotiations to ensure the release by the Russian Federation of all illegally detained Ukrainian citizens and their safe return to Ukraine;",
    "20": "Calls upon the Russian Federation to refrain from impeding the lawful exercise of navigational rights and freedoms, exercised in accordance with applicable international law, including provisions of the 1982 United Nations Convention on the Law of the Sea,4 including but not limited to closure of sea areas under the pretext of military exercises, in the Black Sea, the Sea of Azov and the Kerch Strait;",
    "21": "Condemns the construction and opening by the Russian Federation of the Kerch Strait bridge and the railway bridge, which form a part of the Tavrida highway project, between the Russian Federation and the temporarily occupied Crimea, which facilitates the further militarization of Crimea and restricts the size of vessels that can reach the Ukrainian ports on the Azov coast;",
    "22": "Also condemns the increasing military presence of the Russian Federation in parts of the Black Sea and the Sea of Azov, including the Kerch Strait, and the harassment by the Russian Federation of commercial vessels and its restriction of international shipping there, which further aggravates the economic and social situation in the broader Donetsk region already affected by the temporary occupation of Crimea and subsequent ongoing destabilizing acts by the Russian Federation;",
    "23": "Further condemns visits of Russian officials to the temporarily occupied Crimea, including those in connection with conducting military exercises, military parades and other activities;",
    "24": "Calls upon all Member States, as well as international organizations and specialized agencies, to refrain from any visits to Crimea that are not agreed with Ukraine;",
    "25": "Decides to continue its consideration of the matter at its seventy-seventh session."
  },
  "agenda_items": [
    "Item 35"
  ],
  "symbol_references": [
    "A/76/L.22"
  ]
}