{
  "symbol": "A/RES/72/6",
  "filename": "A_RES_72_6.pdf",
  "title": "72/6. Building a peaceful and better world through sport and the Olympic ideal",
  "text": "United Nations \nA/RES/72/6\n \n \nGeneral Assembly \nDistr.: General \n16 November 2017 \n \n17-20079 (E)    201117     \n*1720079* \n \n \nSeventy-second session \nAgenda item 11 \n \n \n \n \n Resolution adopted by the General Assembly \non 13 November 2017 \n \n \n \n \n[without reference to a Main Committee (A/72/L.5 and A/72/L.5/Add.1)] \n \n \n \n72/6. Building a peaceful and better world through sport \nand the Olympic ideal \n \n \n \nThe General Assembly, \n \nRecalling its resolution 70/4 of 26 October 2015, in which it decided to \ninclude in the provisional agenda of its seventy-second session the sub-item entitled \n\u201cBuilding a peaceful and better world through sport and the Olympic ideal\u201d, and \nrecalling also its prior decision to consider the sub-item every two years, in advance \nof the Summer and Winter Olympic Games, \n \nRecalling also its resolution 48/11 of 25 October 1993, which, inter alia, \nrevived the ancient Greek tradition of ekecheiria (\u201cOlympic Truce\u201d) calling for a \ntruce during the Olympic Games to encourage a peaceful environment and ensure \nsafe passage, access and participation for athletes and relevant persons at the \nGames, thereby mobilizing the youth of the world to the cause of peace, \n \nRecalling further that the core concept of ekecheiria, historically, has been the \ncessation of hostilities from seven days before until seven days after the Olympic \nGames, which, according to the legendary oracle of Delphi, was to replace the cycle \nof conflict with a friendly athletic competition every four years, \n \nRecognizing the valuable contribution of sport in promoting education, \nsustainable development, peace, cooperation, solidarity, fairness, social inclusion \nand health at the local, regional and international levels, and noting that, as declared \nin the 2005 World Summit Outcome,1 sports can contribute to an atmosphere of \ntolerance and understanding among peoples and nations, \n \nWelcoming the designation of 6 April as the International Day of Sport for \nDevelopment and Peace, \n__________________ \n \n1  Resolution 60/1. \n\nA/RES/72/6 \nBuilding a peaceful and better world through sport and the Olympic ideal\n \n17-20079 \n2/5 \n \n \nRecalling the inclusion in the United Nations Millennium Declaration 2 of an \nappeal for the observance of the Olympic Truce now and in the future and for \nsupport for the International Olympic Committee in its efforts to promote peace and \nhuman understanding through sport and the Olympic ideal, \n \nRecalling also that, in the 2030 Agenda for Sustainable Development, 3 sport is \nrecognized as an important enabler of sustainable development, in particular for its \ngrowing contribution to the realization of development and peace in its promotion \nof tolerance and respect and the contributions it makes to the empowerment of \nwomen and of young people, individuals and communities as well as to health, \neducation and social inclusion objectives, \n \nAcknowledging the valuable contribution that the appeal launched by the \nInternational Olympic Committee on 21 July 1992 for an Olympic Truce could \nmake towards advancing the purposes and principles of the Charter of the United \nNations, \n \nRecalling its resolution 71/160 of 16 December 2016 on sport as a means to \npromote education, health, development and peace, in which it called upon future \nhosts of the Olympic Games and the Paralympic Games and other Member States to \ninclude sport, as appropriate, in conflict prevention activities and to ensure the \neffective implementation of the Olympic Truce during the Games, \n \nNoting that the XXIII Olympic Winter Games will be held from 9 to \n25 February 2018 and that the XII Paralympic Winter Games will be held from 9 to \n18 March 2018, in Pyeongchang, Republic of Korea,  \n \nNoting also that Pyeongchang 2018 strives to open and expand new horizons \nfor winter sports in Asia and across the world, fully harnessing the power of sports \nto encourage inclusion and to overcome barriers of all kinds, \n \nRecalling that Pyeongchang 2018 marks the first of three consecutive Olympic \nand Paralympic Games to be held in Asia, to be followed by Tokyo 2020 and \nBeijing 2022, offering possibilities of new partnership in sport and beyond for the \nRepublic of Korea, Japan and China,  \n \nExpressing its expectation that Pyeongchang 2018 will be a meaningful \nopportunity to foster an atmosphere of peace, development, tolerance and \nunderstanding on the Korean Peninsula and in North-East Asia,  \n \nRecognizing the efforts of Pyeongchang 2018 to promote and further develop \nwinter sports across the world through initiatives such as the \u201cDream Programme\u201d \nfor youth from regions without winter sports infrastructure,  \n \nRecognizing also the imperative need to engage women and girls in the \npractice of sport for development and peace, and welcoming activities that aim to \nfoster and encourage initiatives in this regard at the global level,  \n \nRecalling article 31 of the Convention on the Rights of the Child,4 which \noutlines the right of the child to engage in play and recreational activities, and the \noutcome document of the twenty-seventh special session of the General Assembly \non children, entitled \u201cA world fit for children\u201d,5 which stresses the promotion of \nphysical, mental and emotional health through play and sports,  \n__________________ \n \n2  Resolution 55/2. \n \n3  Resolution 70/1. \n \n4  United Nations, Treaty Series, vol. 1577, No. 27531. \n \n5  Resolution S-27/2, annex. \n\nBuilding a peaceful and better world through sport and the Olympic ideal \nA/RES/72/6\n \n3/5 \n17-20079 \n \n \nWelcoming the significant impetus that the Olympic Games, the Paralympic \nGames and the Youth Olympic Games give to the volunteer movement around the \nworld, acknowledging the contributions of volunteers to the success of the Games, \nand in this regard calling upon host countries to promote social inclusion without \ndiscrimination of any kind, \n \nNoting the successful conclusion of the XXXI Olympic Summer Games and \nthe XV Paralympic Summer Games, held in Rio de Janeiro, Brazil, from 5 to \n21 August and from 7 to 18 September 2016, respectively, and welcoming the \nXXXII Olympic Summer Games and the XVI Paralympic Summer Games, to be \nheld in Tokyo from 24 July to 9 August and from 25 August to 6 September 2020, \nrespectively, the XXIV Olympic Winter Games and the XIII Paralympic Winter \nGames, to be held in Beijing from 4 to 20 February and from 4 to 13 March 2022, \nrespectively, and the XXXIII Olympic Summer Games and the XVII Paralympic \nSummer Games, to be held in Paris from 2 to 18 August and from 4 to \n15 September 2024, respectively, \n \nAcknowledging the joint endeavours of the International Olympic Committee, \nthe International Paralympic Committee and relevant United Nations entities in such \nfields as the promotion of human rights, human development, poverty alleviation, \nhumanitarian assistance, health promotion, HIV and AIDS prevention, child and \nyouth education, gender equality, peacebuilding and sustainable development, \n \nAcknowledging also the importance of the Youth Olympic Games in inspiring \nyouth through integrated sports and cultural and educational experiences, noting in \nthis regard the successful conclusion of the second Youth Winter Olympic Games, \nheld in Lillehammer, Norway, from 12 to 21 February 2016, and welcoming the \nthird Youth Summer Olympic Games, to be held in Buenos Aires from 6 to \n18 October 2018, \n \nRecognizing the role that the Paralympic movement plays in showcasing the \nachievements of athletes with disabilities to a global audience and in acting as a \nprimary vehicle to promote positive perceptions and greater inclusion of persons \nwith disabilities in sport and society, \n \nRecognizing also that the active involvement of persons with disabilities in \nsports and the Paralympic Games contributes to the full and equal realization of their \nhuman rights, as well as respect for their inherent dignity, recalling articles 1 and 30 \nof the Convention on the Rights of Persons with Disabilities,6 in which States parties \nrecognized the right of persons with disabilities, including those with long-term \nphysical, mental, intellectual or sensory impairments, to take part on an equal basis \nwith others in cultural life, with a view to enabling persons with disabilities to \nparticipate on an equal basis with others in recreational, leisure and sporting \nactivities, and noting in this regard plans to stage integrated and inclusive Games, \n \nWelcoming the commitment made by various States Members of the United \nNations and other relevant stakeholders to developing national and international \nprogrammes that promote peace and conflict resolution, the Olympic and Paralympic \nvalues and the Olympic Truce ideals through sport and through culture, education, \nsustainable development and wider public engagement, and acknowledging the \ncontribution of former hosts of the Olympic and Paralympic Games in this regard, \n \nRecognizing the humanitarian opportunities presented by the Olympic Truce \nand by other initiatives supported by the United Nations to achieve the cessation of \nconflict, \n__________________ \n \n6  United Nations, Treaty Series, vol. 2515, No. 44910. \n\nA/RES/72/6 \nBuilding a peaceful and better world through sport and the Olympic ideal\n \n17-20079 \n4/5 \n \n \nRecalling that, in its resolution 71/160, it supported the independence and \nautonomy of sport as well as the mission of the International Olympic Committee in \nleading the Olympic movement and of the International Paralympic Committee in \nleading the Paralympic movement, and recognized the unifying and conciliative \nnature of major international sport events and that such events should be organized \nin the spirit of peace, mutual understanding, friendship, tolerance and inadmissibility \nof discrimination of any kind, \n \nAcknowledging the fundamental principles of the Olympic Charter, including \nprinciple 6, which states that the enjoyment of the rights and freedoms set forth in \nthe Olympic Charter shall be secured for all, without discrimination of any kind, \n \nNoting with satisfaction that the United Nations flag will be flown at the \nOlympic stadium and in the Olympic villages of the XXIII Olympic Winter Games \nand the XII Paralympic Winter Games, \n \n1. \nUrges Member States to observe the Olympic Truce individually and \ncollectively, within the framework of the Charter of the United Nations, throughout \nthe period from the seventh day before the start of the XXIII Olympic Winter \nGames until the seventh day following the end of the XII Paralympic Winter \nGames, to be held in Pyeongchang, Republic of Korea, in 2018, in particular, to \nensure the safe passage, access and participation of athletes, officials and all other \naccredited persons taking part in the Olympic Winter Games and Paralympic \nWinter Games, and to contribute through other appropriate measures to the safe \norganization of the Games;  \n \n2. \nUnderlines the importance of cooperation among Member States to \ncollectively implement the values of the Olympic Truce around the world, and \nemphasizes the important role of the International Olympic Committee, the \nInternational Paralympic Committee and the United Nations in this regard; \n \n3. \nWelcomes the work of the International Olympic Committee and the \nInternational Paralympic Committee, as well as the International Olympic Truce \nFoundation and the International Olympic Truce Centre, in mobilizing national and \ninternational sports federations and organizations, National Olympic and \nParalympic Committees and associations of National Olympic Committees to take \nconcrete actions at the local, national, regional and international levels to promote \nand strengthen a culture of peace based on the spirit of the Olympic Truce, and \ninvites those organizations and national committees to cooperate and share \ninformation and best practices, as appropriate; \n \n4. \nAlso welcomes the leadership of Olympic and Paralympic athletes in \npromoting peace and human understanding through sport and the Olympic ideal; \n \n5. \nCalls upon all Member States to cooperate with the International \nOlympic Committee and the International Paralympic Committee in their efforts to \nuse sport as a tool to promote peace, dialogue and reconciliation in areas of conflict \nduring and beyond the period of the Olympic and Paralympic Games; \n \n6. \nRecognizes that sport and the Olympic and Paralympic Games can be \nused to promote human rights and strengthen universal respect for such rights, thus \ncontributing to their full realization; \n \n7. \nWelcomes the cooperation among Member States, the United Nations and \nthe specialized agencies, funds and programmes, and the International Olympic \nCommittee and the International Paralympic Committee, to maximize the potential \nof sport to make a meaningful and sustainable contribution to the achievement of \nthe Sustainable Development Goals within the 2030 Agenda for Sustainable \n\nBuilding a peaceful and better world through sport and the Olympic ideal \nA/RES/72/6\n \n5/5 \n17-20079 \n \nDevelopment,3 and encourages the Olympic and Paralympic movements to work \nclosely with national and international sports organizations on the use of sport to \nthis end; \n \n8. \nRequests the Secretary-General and the President of the General \nAssembly to promote the observance of the Olympic Truce among Member States \nand support for human development initiatives through sport and to continue to \ncooperate effectively with the International Olympic Committee, the International \nParalympic Committee and the sporting community in general in the realization of \nthose objectives; \n \n9. \nDecides to include in the provisional agenda of its seventy-fourth session \nthe sub-item entitled \u201cBuilding a peaceful and better world through sport and the \nOlympic ideal\u201d of the item entitled \u201cSport for development and peace\u201d and to \nconsider the sub-item before the XXXII Olympic Summer Games and the \nXVI Paralympic Summer Games, to be held in Tokyo in 2020. \n \n48th plenary meeting \n13 November 2017 \n \n",
  "paragraphs": {
    "1": "Urges Member States to observe the Olympic Truce individually and collectively, within the framework of the Charter of the United Nations, throughout the period from the seventh day before the start of the XXIII Olympic Winter Games until the seventh day following the end of the XII Paralympic Winter Games, to be held in Pyeongchang, Republic of Korea, in 2018, in particular, to ensure the safe passage, access and participation of athletes, officials and all other accredited persons taking part in the Olympic Winter Games and Paralympic Winter Games, and to contribute through other appropriate measures to the safe organization of the Games;",
    "2": "Underlines the importance of cooperation among Member States to collectively implement the values of the Olympic Truce around the world, and emphasizes the important role of the International Olympic Committee, the International Paralympic Committee and the United Nations in this regard;",
    "3": "Welcomes the work of the International Olympic Committee and the International Paralympic Committee, as well as the International Olympic Truce Foundation and the International Olympic Truce Centre, in mobilizing national and international sports federations and organizations, National Olympic and Paralympic Committees and associations of National Olympic Committees to take concrete actions at the local, national, regional and international levels to promote and strengthen a culture of peace based on the spirit of the Olympic Truce, and invites those organizations and national committees to cooperate and share information and best practices, as appropriate;",
    "4": "Also welcomes the leadership of Olympic and Paralympic athletes in promoting peace and human understanding through sport and the Olympic ideal;",
    "5": "Calls upon all Member States to cooperate with the International Olympic Committee and the International Paralympic Committee in their efforts to use sport as a tool to promote peace, dialogue and reconciliation in areas of conflict during and beyond the period of the Olympic and Paralympic Games;",
    "6": "Recognizes that sport and the Olympic and Paralympic Games can be used to promote human rights and strengthen universal respect for such rights, thus contributing to their full realization;",
    "7": " Development,3 and encourages the Olympic and Paralympic movements to work closely with national and international sports organizations on the use of sport to this end;",
    "8": "Requests the Secretary-General and the President of the General Assembly to promote the observance of the Olympic Truce among Member States and support for human development initiatives through sport and to continue to cooperate effectively with the International Olympic Committee, the International Paralympic Committee and the sporting community in general in the realization of those objectives;",
    "9": "Decides to include in the provisional agenda of its seventy-fourth session the sub-item entitled \u201cBuilding a peaceful and better world through sport and the Olympic ideal\u201d of the item entitled \u201cSport for development and peace\u201d and to consider the sub-item before the XXXII Olympic Summer Games and the XVI Paralympic Summer Games, to be held in Tokyo in 2020."
  },
  "agenda_items": [
    "Item 11"
  ],
  "symbol_references": [
    "A/72/L.5"
  ]
}