{
  "symbol": "A/RES/78/231",
  "filename": "A_RES_78_231.pdf",
  "title": "78/231. Follow-up to and implementation of the outcomes of the International Conferences on Financing for Development",
  "text": "United Nations \nA/RES/78/231\n \n \nGeneral Assembly \nDistr.: General \n28 December 2023 \n \n23-26233 (E)    080124     \n*2326233* \n \n \nSeventy-eighth session \nAgenda item 17 \nFollow-up to and implementation of the outcomes of the \nInternational Conferences on Financing for Development \n \n \n \n \n Resolution adopted by the General Assembly \non 22 December 2023 \n \n \n \n \n[on the report of the Second Committee (A/78/460, para. 12)] \n \n \n 78/231. Follow-up to and implementation of the outcomes of the \nInternational Conferences on Financing for Development \n \n \n \nThe General Assembly, \n \nRecalling its resolutions 70/192 of 22 December 2015, 71/217 of 21 December \n2016, 72/208 of 20 December 2017, 73/223 of 20 December 2018, 74/207 of \n19 December 2019, 75/208 of 21 December 2020, 76/198 of 17 December 2021 and \n77/156 of 14 December 2022 on the follow-up to and implementation of the outcomes \nof the International Conferences on Financing for Development and its resolution \n70/299 of 29 July 2016 on the follow-up and review of the 2030 Agenda for \nSustainable Development at the global level,  \n \nReaffirming its resolution 69/313 of 27 July 2015 on the Addis Ababa Action \nAgenda of the Third International Conference on Financing for Development, which \nis an integral part of the 2030 Agenda for Sustainable Development,1 supports and \ncomplements it, helps to contextualize its means of implementation targets with \nconcrete policies and actions, and reaffirms the strong political commitment to \naddress the challenge of financing and creating an enabling environment at all levels \nfor sustainable development in the spirit of global partnership and solidarity,  \n \nRecalling the International Conference on Financing for Development, held in \nMonterrey, Mexico, from 18 to 22 March 2002, the Follow-up International \nConference on Financing for Development to Review the Implementation of the \nMonterrey Consensus, held in Doha from 29 November to 2 December 2008, and the \nthird International Conference on Financing for Development, held in Addis Ababa \nfrom 13 to 16 July 2015,  \n__________________ \n \n1  Resolution 70/1. \n\nA/RES/78/231 \nFollow-up to and implementation of the outcomes of the \nInternational Conferences on Financing for Development\n \n23-26233\n2/10 \n \n \nReaffirming its resolution 70/1 of 25 September 2015, entitled \u201cTransforming \nour world: the 2030 Agenda for Sustainable Development\u201d, in which it adopted a \ncomprehensive, far-reaching and people-centred set of universal and transformative \nSustainable Development Goals and targets, its commitment to working tirelessly for \nthe full implementation of the Agenda by 2030, its recognition that eradicating \npoverty in all its forms and dimensions, including extreme poverty, is the greatest \nglobal challenge and an indispensable requirement for sustainable development, its \ncommitment to achieving sustainable development in its three dimensions \u2013 \neconomic, social and environmental \u2013 in a balanced and integrated manner, and to \nbuilding upon the achievements of the Millennium Development Goals and seeking \nto address their unfinished business,  \n \nReaffirming also the Paris Agreement2 and its early entry into force, encouraging \nall its parties to fully implement the Agreement, and parties to the United Nations \nFramework Convention on Climate Change3 that have not yet done so to deposit their \ninstruments of ratification, acceptance, approval or accession, where appropriate, as \nsoon as possible,  \n \nReiterating the affirmation in the Addis Ababa Action Agenda that achieving \ngender equality, empowering all women and girls and attaining the full realization of \ntheir human rights are essential to achieving sustained, inclusive and equitable \neconomic growth and sustainable development,  \n \nRecalling the Sendai Framework for Disaster Risk Reduction 2015\u201320304 and \nits goal to prevent new and reduce existing disaster risk and the commitment \ncontained in the Addis Ababa Action Agenda to strengthen the capacity of national \nand local actors to manage and finance disaster risk, as part of national sustainable \ndevelopment strategies, and to ensure that countries can draw on international \nassistance when needed,  \n \nNoting with great concern the severe negative impact on human health, safety \nand well-being caused by the coronavirus disease (COVID-19) pandemic, as well as \nthe severe disruption to societies and economies and the devastating impact on lives \nand livelihoods, and that the poorest and most vulnerable are the hardest hit by the \npandemic, reaffirming the ambition to get back on track to achieve the Sustainable \nDevelopment Goals by designing and implementing sustainable and inclusive \nrecovery strategies to accelerate progress towards the full implementation of the 2030 \nAgenda for Sustainable Development and to help to reduce the risk of and build \nresilience to future shocks, crises and pandemics, including by strengthening health \nsystems and achieving universal health coverage, and recognizing that equitable and \ntimely access for all to safe, quality, effective and affordable COVID-19 vaccines, \ntherapeutics and diagnostics are an essential part of a global response based on unity, \nsolidarity, renewed multilateral cooperation and the principle of leaving no one behind,  \n \nNoting with concern the fragile and highly uncertain global socioeconomic \noutlook, persisting negative effects of the COVID-19 pandemic, geopolitical tensions \nand conflicts and current multiple crises, which have increased pressure on food, \nenergy and finance, affecting many countries around the world, and their ability to \nachieve the Sustainable Development Goals,  \n \nRecognizing the need to introduce systemic solutions to address the \nsocioeconomic impacts of the COVID-19 pandemic and overcome the inequalities \nbetween and within countries exacerbated by the pandemic and current multiple \ncrises, noting that many developing countries are faced with significantly higher \n__________________ \n \n2  Adopted under the UNFCCC in FCCC/CP/2015/10/Add.1, decision 1/CP.21. \n \n3  United Nations, Treaty Series, vol. 1771, No. 30822. \n \n4  Resolution 69/283, annex II. \n\nFollow-up to and implementation of the outcomes of the \nInternational Conferences on Financing for Development \nA/RES/78/231\n \n3/10\n23-26233 \n \nborrowing costs to finance their response to the pandemic, contributing to a great \nfinance divide which further undermines the achievement of a sustainable, inclusive \nand resilient recovery, while turbocharging the full implementation of the Sustainable \nDevelopment Goals,  \n \nReaffirming the call on the United Nations system, in consultation with the \ninternational financial institutions, to develop transparent measurements of progress \non sustainable development that go beyond per capita income, building on existing \ninitiatives as appropriate, and noting that these should recognize poverty in all of its \nforms and dimensions, and the social, economic and environmental dimensions of \ndomestic output and structural gaps at all levels,  \n \nEmphasizing the urgent need to develop measures of progress on sustainable \ndevelopment that complement or go beyond gross domestic product in order to work \ntowards a more inclusive approach to international cooperation,  \n \nWelcoming the work advanced by the High-level Panel on the Development of \na Multidimensional Vulnerability Index for Small Island Developing States,  \n \nReaffirming the importance of addressing the diverse needs of and challenges \nfaced by countries in special situations, in particular African countries, the least \ndeveloped countries, landlocked developing countries and small island developing \nStates and countries in conflict and post-conflict situations, as well as the specific \nchallenges faced by middle-income countries,  \n \nTaking note of the holding of preparatory meetings for the Economic and Social \nCouncil forum on financing for development follow-up, such as the annual retreat of \nthe Group of Friends of Monterrey,  \n \nTaking note also of the convening of the seventh retreat of the Group of Friends \nof Monterrey to exchange informal views on financing for development issues,  \n \nWelcoming the convening of the Economic and Social Council forum on \nfinancing for development follow-up, from 17 to 20 April 2023,  \n \nRecalling the intergovernmentally agreed conclusions and recommendations of \nthe forum,5 in which it was decided that the ninth Economic and Social Council forum \non financing for development follow-up would convene from 22 to 25 April 2024 and \nwould include the special high-level meeting of the Council with the Bretton Woods \ninstitutions, the World Trade Organization and the United Nations Conference on \nTrade and Development, and which looked forward to deliberations on convening a \nfourth international conference on financing for development in 2025, as well as the \ndevelopment of the corresponding modalities for this conference by the General \nAssembly, while bearing in mind the commitments of past United Nations \ninternational conferences on financing for development,  \n \nRecalling also the adoption by the Statistical Commission of indicator 17.3.1 \nunder Sustainable Development Goal target 17.3, Mobilize additional financial \nresources for developing countries from multiple sources, and welcoming new data \nbeing reported under the indicator, and the continuation of discussions on the \nmodernization of measurement of official development assistance and the new \nmeasure of \u201ctotal official support for sustainable development\u201d, while affirming that \nany such measure will not dilute commitments already made,  \n \nRecalling further Economic and Social Council decision 2017/206 of 5 October \n2016,  \n__________________ \n \n5  See E/FFDF/2023/3. \n\nA/RES/78/231 \nFollow-up to and implementation of the outcomes of the \nInternational Conferences on Financing for Development\n \n23-26233\n4/10 \n \n \nRecalling the eighth biennial high-level meeting of the Development \nCooperation Forum, held on 14 and 15 March 2023,  \n \nTaking note with appreciation of the fifth annual meeting of the Global Investors \nfor Sustainable Development Alliance, on 31 October 2023, and the ongoing work on \nits key deliverables, and looking forward to continued efforts by the Alliance to support \nthe channelling of finance and investment towards the Sustainable Development Goals,  \n \nReaffirming the outcome document of the second High-level United Nations \nConference on South-South Cooperation, held in Buenos Aires from 20 to 22 March \n2019,6  \n \nReiterating the pledge that no one will be left behind, reaffirming the \nrecognition that the dignity of the human person is fundamental, and the wish to see \nthe Goals and targets met for all nations and peoples and for all segments of society, \nand recommitting to endeavour to reach the furthest behind first,  \n \nRecommitting to ensuring that no country or person is left behind and to focusing \nour effort where the challenges are greatest, including by ensuring the inclusion and \nparticipation of those who are furthest behind,  \n \nWelcoming the convening of the High-level Dialogue on Financing for \nDevelopment in New York on 20 September 2023,  \n \nWelcoming the Secretary-General\u2019s efforts to address the Sustainable \nDevelopment Goal financing gap through a Sustainable Development Goal stimulus, \nand will advance the Secretary-General\u2019s proposal, in a timely manner, through \ndiscussions at the United Nations as well as other relevant forums and institutions, to \ntackle the high cost of debt and rising risks of debt distress, to enhance support to \ndeveloping countries and to massively scale up affordable long-term financing for \ndevelopment and expand contingency financing to countries in need, \n \n1. \nTakes note of the report of the Secretary-General,7 notes with concern the \nlack of progress made on financing for development commitments since the adoption \nof the Addis Ababa Action Agenda of the Third International Conference on \nFinancing for Development 8 and the Sustainable Development Goals, as well as \nseveral emerging trends that have contributed to the finance divide and risk further \nexacerbating it, while acknowledging that the challenges of the moment merit the \nattention and focus of policymakers at the highest level, and expresses concern that \nthe mobilization of sufficient financing from all sources, including official \ndevelopment assistance, remains a major challenge in the implementation of the 2030 \nAgenda for Sustainable Development;  \n \n2. \nEmphasizes the need to work towards the full and timely implementation \nof the Addis Ababa Action Agenda, including to reaffirm and build on the \nachievements of the Doha Declaration9 and the Monterrey Consensus;10  \n \n3. \nWelcomes the political declaration adopted by the high-level political \nforum on sustainable development convened under the auspices of the General \nAssembly (Sustainable Development Goals Summit),11 held in New York on 18 and \n19 September 2023, and urges timely action to ensure its full implementation;  \n__________________ \n \n6  Resolution 73/291, annex. \n \n7  A/78/190. \n \n8  Resolution 69/313, annex. \n \n9  Resolution 63/239, annex. \n \n10  Report of the International Conference on Financing for Development, Monterrey, Mexico, \n18\u2013 22 March 2002 (United Nations publication, Sales No. E.02.II.A.7), chap. I, resolution 1, \nannex. \n \n11  Resolution 78/1, annex. \n\nFollow-up to and implementation of the outcomes of the \nInternational Conferences on Financing for Development \nA/RES/78/231\n \n5/10\n23-26233 \n \n \n4. \nTakes note of the 2023 report of the Inter-Agency Task Force on Financing \nfor Development, 12 and notes with concern the report\u2019s key message that global \nsustainable development prospects continue to diverge and if left unaddressed, the \nfinance divide will translate into a lasting sustainable development divide;  \n \n5. \nWelcomes the special drawing rights allocation of the equivalent of \n650 billion United States dollars of 23 August 2021, recommends the exploration of \nfurther voluntary options related to special drawing rights that could serve the needs \nof developing member countries of the International Monetary Fund, calls for the \nurgent voluntary rechannelling of special drawing rights for countries most in need, \nincluding through multilateral development banks, while respecting relevant legal \nframeworks and preserving the reserve asset character of special drawing rights, and \nwill explore ways for future allocations of special drawing rights to benefit those \ncountries most in need;  \n \n6.  \nNotes with appreciation the operationalization of the Resilience and \nSustainability Trust of the International Monetary Fund to help eligible countries \naddress longer-term structural challenges that pose macroeconomic risks, looks \nforward to the upcoming interim review of the Trust, and notes that debt sustainability \nand liquidity can play an important role in achieving a sustainable, inclusive and \nresilient recovery and the Sustainable Development Goals;  \n \n7. \nWelcomes the intergovernmentally agreed conclusions and recommendations \nof the 2023 Economic and Social Council forum on financing for development \nfollow-up and urges their full, effective and timely implementation, and looks forward \nto staying engaged so as to assess progress, identify obstacles and challenges in the \nimplementation of the financing for development outcomes and in the delivery of the \nmeans of implementation, promote the sharing of lessons learned from experiences at \nthe national and regional levels, address new and emerging topics of relevance to the \nimplementation of this agenda as the need arises and provide policy recommendations \nfor action by the international community in substantive intergovernmentally agreed \nconclusions and recommendations at the 2024 forum;  \n \n8. \nNotes in this regard the further development of integrated national \nfinancing frameworks, in support of nationally owned sustainable development \nstrategies, including disaster risk reduction strategies, in order to further implement \nthe Addis Ababa Action Agenda, aimed at effectively mobilizing and aligning a wide \nrange of financing sources and instruments with the 2030 Agenda for Sustainable \nDevelopment and making use of the full potential of all means of implementation;  \n \n9. \nTakes note of the summary by the President of the Economic and Social \nCouncil of the 2023 Economic and Social Council forum on financing for \ndevelopment follow-up;13  \n \n10. Emphasizes that timely and adequate planning for the 2024 Economic and \nSocial Council forum on financing for development follow-up is of paramount \nimportance to its substantive work and outcome;  \n \n11. \nInvites the President of the Economic and Social Council to take into \nconsideration the summary by the President of the Council of the 2023 forum on \nfinancing for development follow-up in the preparation of the 2024 forum;  \n \n12. Recalls that decisions relating to the Economic and Social Council forum \non financing for development follow-up are to be contained within the forum\u2019s \nintergovernmentally agreed conclusions and recommendations;  \n__________________ \n \n12  Financing for Sustainable Development Report 2023 (United Nations publication, 2023). \n \n13  A/78/93-E/2023/90. \n\nA/RES/78/231 \nFollow-up to and implementation of the outcomes of the \nInternational Conferences on Financing for Development\n \n23-26233\n6/10 \n \n \n13. Takes note of the work of the Committee of Experts on International \nCooperation in Tax Matters and the initial contributions made by India to the \nvoluntary trust fund, by Norway to a multi-donor project aimed at supporting the work \nof the Committee, its subcommittees and related capacity development activities, as \nwell as the contributions by the European Union and other countries in support of the \nCommittee\u2019s subsidiary bodies, and urges Member States to come forward to \ncontribute more to the trust fund in order to further support the participation of \ndeveloping countries;  \n \n14. Recalls the holding of the 2020 Global Infrastructure Forum from 6 to \n8 October 2020, in a virtual setting, and reiterates that the Forum is mandated to \nidentify and address infrastructure and capacity gaps in developing countries, \nparticularly in the least developed countries, landlocked developing countries, small \nisland developing States and African countries;  \n \n15. Also recalls the progress made in operationalizing the three components \nof the Technology Facilitation Mechanism, and welcomes the establishment of the \n2030 Connect online platform as part of the Mechanism;  \n \n16. Further recalls the operationalization of the Technology Bank for the \nLeast Developed Countries, and invites Member States, as well as international \norganizations, foundations and the private sector, to provide increased voluntary \nfinancial contributions and technical assistance to ensure its full and effective \nimplementation;  \n \n17. Highlights the need to provide universal and affordable access to the \nInternet by 2030 as an essential step towards an inclusive and sustainable digital \neconomy that empowers people in vulnerable situations to narrow digital divides, and \nto build on financial technology to support financial inclusion; \n \n18. Recalls the convening of the eighth annual multi-stakeholder forum on \nscience, technology and innovation for the Sustainable Development Goals in New \nYork on 3 and 4 May 2023, whose Co-Chairs\u2019 summary14 served as an input to the \nhigh-level political forum on sustainable development and highlighted, inter alia, the \npromotion of networking and matchmaking among relevant stakeholders, especially \ninnovators, funders and other supporters, to bridge the technology gap for the \nSustainable Development Goals;  \n \n19. Also recalls that the Addis Ababa Action Agenda provides a global \nframework for financing sustainable development and is an integral part of the 2030 \nAgenda, supports and complements it and helps to contextualize the means of \nimplementation targets with concrete policies and actions, the implementation of \nwhich requires following up on, that relate to its seven action areas, namely, domestic \npublic resources; domestic and international private business and finance; \ninternational development cooperation; international trade as an engine for \ndevelopment; debt and debt sustainability; addressing systemic issues; science, \ntechnology, innovation and capacity-building; and data, monitoring and follow-up;  \n \n20. Reiterates that States will not be able to achieve the ambitious Goals and \ntargets of the 2030 Agenda without a revitalized and enhanced global partnership and \ncomparably ambitious means of implementation, and reaffirms the commitment at the \nvery heart of the 2030 Agenda to leave no one behind and commit to taking more \ntangible steps to support people in vulnerable situations and the most vulnerable \ncountries and to reach the furthest behind first;  \n \n21. Urges developed countries to scale up and fulfil their respective official \ndevelopment assistance commitments, including the commitment by many developed \ncountries to achieve the targets of 0.7 per cent of gross national income for official \n__________________ \n \n14  See E/HLPF/2023/6. \n\nFollow-up to and implementation of the outcomes of the \nInternational Conferences on Financing for Development \nA/RES/78/231\n \n7/10\n23-26233 \n \ndevelopment assistance to developing countries and 0.15 to 0.20 per cent to the least \ndeveloped countries;  \n \n22. Encourages \nstrengthening \nthe \nlending \ncapacity \nof \nmultilateral \ndevelopment banks, in that regard urges them to make the most efficient use of their \nbalance sheets in order to optimize their lending while preserving their robust credit \nratings, financial sustainability and preferred creditor status, and takes note of the \nindependent review of the banks\u2019 capital adequacy frameworks and ongoing balance \nsheet optimization efforts, commissioned by the Group of 20;  \n \n23. Notes the policy recommendations of the Intergovernmental Group of \nExperts on Financing for Development of the United Nations Conference on Trade \nand Development, and that the agreed policy recommendations serve as an input to \nthe Economic and Social Council forum on financing for development follow-up in \naccordance with the terms of reference of the Intergovernmental Group of Experts;  \n \n24. Also notes that, in order to advance bold and concerted global action to \nachieve sustainable development in its three dimensions \u2013 economic, social and \nenvironmental \u2013 in a balanced and integrated manner, and achieve a sustainable, \ninclusive and resilient recovery, and set the world on a path towards the achievement \nof the Sustainable Development Goals by 2030, both domestic efforts and multilateral \naction, as well as multi-stakeholder partnerships that include the private sector, should \nbe geared to supporting medium- and long-term sustainable development, particularly \nin developing countries, emphasizes the importance of improving investment and \nfinancing in sectors that are critical to accelerating the achievement of the 2030 \nAgenda, the Addis Ababa Action Agenda and other agreed commitments to support \ncountries in special situations, stresses the need to promote quality, reliable, \nsustainable and resilient infrastructure, particularly in developing countries, in a \nmanner that has the greatest social, economic and environmental benefits, in order to \nbuild resilience against shocks for an inclusive, sustainable and resilient recovery and \nachieve the Sustainable Development Goals, and recognizes the important role of the \nUnited Nations development system, the World Bank and other multilateral \ninstitutions in addressing the capacity gaps and funding requirements for developing \nquality, reliable, sustainable and resilient infrastructure projects, especially in \ndeveloping countries, working through existing initiatives; \n \n25. Calls for advancing the elaboration of a specific inter-agency, \ncomprehensive system-wide response plan, taking note of the mapping exercise \nconducted by the Secretary-General and his recommendations, aimed at better \naddressing the multidimensional nature of sustainable development and facilitating \nsustainable development cooperation and coordinated and inclusive support to \nmiddle-income countries based on their specific challenges and diverse needs;  \n \n26. Calls upon all Member States to continue to engage in discussions in \nconsultation with relevant stakeholders, including international financial institutions, \nmultilateral development banks and regional commissions, on measures of progress \non sustainable development that complement or go beyond gross domestic product, \ntaking into account existing initiatives, to have a more inclusive approach to \ninternational cooperation; \n \n27. Emphasizes the need to urgently develop measures of progress on \nsustainable development that complement or go beyond gross domestic product in \norder to have a more inclusive approach to international cooperation, including in the \nconsideration of informing access to development finance and technical cooperation, \nand in this regard:  \n \n(a) \nNotes all the proposals presented by the Secretary-General regarding \nmeasures of progress that complement or go beyond gross domestic product, building \n\nA/RES/78/231 \nFollow-up to and implementation of the outcomes of the \nInternational Conferences on Financing for Development\n \n23-26233\n8/10 \n \nupon complementary measures already in place, for the consideration of the General \nAssembly;  \n \n(b) \nStresses the call for a United Nations-led intergovernmental process in \nconsultation with relevant stakeholders, including the UN Statistical Commission, \ninternational financial institutions, multilateral development banks and regional \ncommissions, in line with their respective mandates, on measures of progress on \nsustainable development that complement or go beyond gross domestic product;  \n \n(c) \nRequests the Secretary-General to convene additional briefings on his \nproposals, in consultation with the General Assembly, so as to inform the United \nNations-led process;  \n \n(d) \nCalls upon the international community to increase the provision of \nresources for and capacity-building on statistics and data collection, including \ndisaggregated data, to support developing countries in their efforts and to fill gaps in \nreporting on the Goals;  \n \n(e) \nRecognizing the importance of designing robust and technically sound \nmeasures of progress while also recognizing the value of evidence-based approaches \nto evaluate progress to date towards the Sustainable Development Goals; \n \n28. Welcomes the work of the High-level Panel on the Development of a \nMultidimensional Vulnerability Index for Small Island Developing States, which was \nco-chaired by the Prime Minister of Antigua and Barbuda, Gaston Browne, and the \nformer Prime Minister of Norway, Erna Solberg, including its consultations with \nMember States, and in this regard takes note of the Panel\u2019s final report and the \nrecommendations contained therein;  \n \n29. Decides to convene, in 2025, a fourth international conference on \nfinancing for development to, inter alia, assess the progress made in the \nimplementation of the Monterrey Consensus, the Doha Declaration and the Addis \nAbaba Action Agenda, identifying obstacles and constraints encountered in the \nachievement of the goals and objectives agreed therein, as well as actions and \ninitiatives to overcome these constraints, and to address new and emerging issues, \nincluding in the context of the urgent need to accelerate the implementation of the \n2030 Agenda and the achievement of the Sustainable Development Goals and to \nsupport reform of the international financial architecture; \n \n30. Welcomes the offer by the Government of Spain to host the Fourth \nInternational Conference on Financing for Development; \n \n31. Decides to establish an intergovernmental preparatory committee to make \nthe organizational, procedural and substantive preparations for the Conference, which \nwill hold a one day organizational session in the first quarter of 2024 and up to three \nsessions, of no more than five days each, in 2024 and up to two sessions, of no more \nthan five days each, in 2025, with the last session taking place in New York, on dates \nto be decided at the organizational session of the intergovernmental preparatory \ncommittee;  \n \n32. Also decides that the intergovernmental preparatory committee shall have \na Bureau consisting of three members from each regional group and that the \ncommittee shall elect two Co-Chairs from among the nominated Bureau members, \none from a developed State and one from a developing State, and that the host country \nand the Chair of the Group of 77 and China shall serve as ex officio members of the \nBureau;  \n \n33. Invites regional groups to nominate their candidates for the 15-member \nBureau of the intergovernmental preparatory committee no later than 15 January \n\nFollow-up to and implementation of the outcomes of the \nInternational Conferences on Financing for Development \nA/RES/78/231\n \n9/10\n23-26233 \n \n2024, so that they can be involved in the preparations for the first meeting of the \ncommittee;  \n \n34. Decides that the intergovernmental preparatory committee, during its \norganizational session in the first quarter of 2024, will adopt decisions and, as \nappropriate, make recommendations to the General Assembly on the dates of the \nsessions of the intergovernmental preparatory committee, additional modalities, \nincluding inclusive participation, and format of the Conference and how it can be \norganized in the most efficient and effective manner;  \n \n35. Welcomes the offer by the Government of Ethiopia to host one of the \nsessions of the intergovernmental preparatory committee in 2024 in Addis Ababa as \npart of the preparatory process of the Fourth International Conference on Financing \nfor Development to review the progress and the gaps in the implementation of the \nAddis Ababa Action Agenda as an integral part of the 2030 Agenda, and identify \nactions and ideas to accelerate the implementation of the Sustainable Development \nGoals;  \n \n36. Also welcomes the offer by the Government of Mexico to host one of the \nsessions of the intergovernmental preparatory committee as part of the preparatory \nprocess of the Fourth International Conference on Financing for Development; \n \n37. Invites the Bureau to convene further meetings of the intergovernmental \npreparatory committee on an informal basis in New York, as required and in the most \nefficient and effective manner, to conclude discussions on the modalities and draft \noutcome document of the Conference;  \n \n38. Reiterates its appeal to Member States and other potential donors to \nconsider contributing generously to the Trust Fund for the Follow-up to the \nInternational Conference on Financing for Development, which would facilitate the \nimplementation of a strengthened and more effective inclusive, intergovernmental \nprocess for carrying out the financing for development follow-up;  \n \n39. Recognizes the work of the Financing for Sustainable Development Office, \nand encourages the Office, in collaboration with experts from the public and private \nsectors, academia, civil society and other multilateral organizations who work in the \nfield of financing for development, to continue its work in accordance with its \nmandate;  \n \n40. Requests the Secretary-General to submit to the General Assembly at its \nseventy-ninth session an action-oriented report, presenting emerging challenges and \nkey accelerators for financing for development that may be relevant for future \ndiscussions in the framework of the Economic and Social Council forum on financing \nfor development follow-up and the Fourth International Conference on Financing for \nDevelopment; \n \n41.  Looks forward to the 2024 report of the Inter-Agency Task Force on \nFinancing for Development, namely its assessment on progress made in the \nimplementation of the Monterrey Consensus, the Doha Declaration and the Addis \nAbaba Action Agenda, identifying obstacles and constraints encountered in the \nachievement of the goals and objectives agreed therein, with a view to informing an \ninclusive informal dialogue on all issues related to the Fourth International \nConference on Financing for Development;  \n\nA/RES/78/231 \nFollow-up to and implementation of the outcomes of the \nInternational Conferences on Financing for Development\n \n23-26233\n10/10 \n \n \n42. Decides to include in the provisional agenda of its seventy-ninth session \nthe item entitled \u201cFollow-up to and implementation of the outcomes of the \nInternational Conferences on Financing for Development\u201d.  \n \n50th (resumed) plenary meeting \n22 December 2023 \n \n",
  "paragraphs": {
    "1": "Takes note of the report of the Secretary-General,7 notes with concern the lack of progress made on financing for development commitments since the adoption of the Addis Ababa Action Agenda of the Third International Conference on Financing for Development 8 and the Sustainable Development Goals, as well as several emerging trends that have contributed to the finance divide and risk further exacerbating it, while acknowledging that the challenges of the moment merit the attention and focus of policymakers at the highest level, and expresses concern that the mobilization of sufficient financing from all sources, including official development assistance, remains a major challenge in the implementation of the 2030 Agenda for Sustainable Development;",
    "2": "Emphasizes the need to work towards the full and timely implementation of the Addis Ababa Action Agenda, including to reaffirm and build on the achievements of the Doha Declaration9 and the Monterrey Consensus;10",
    "3": "Welcomes the political declaration adopted by the high-level political forum on sustainable development convened under the auspices of the General Assembly (Sustainable Development Goals Summit),11 held in New York on 18 and 19 September 2023, and urges timely action to ensure its full implementation;",
    "4": "Takes note of the 2023 report of the Inter-Agency Task Force on Financing for Development, 12 and notes with concern the report\u2019s key message that global sustainable development prospects continue to diverge and if left unaddressed, the finance divide will translate into a lasting sustainable development divide;",
    "5": "Welcomes the special drawing rights allocation of the equivalent of 650 billion United States dollars of 23 August 2021, recommends the exploration of further voluntary options related to special drawing rights that could serve the needs of developing member countries of the International Monetary Fund, calls for the urgent voluntary rechannelling of special drawing rights for countries most in need, including through multilateral development banks, while respecting relevant legal frameworks and preserving the reserve asset character of special drawing rights, and will explore ways for future allocations of special drawing rights to benefit those countries most in need;",
    "6": "Notes with appreciation the operationalization of the Resilience and Sustainability Trust of the International Monetary Fund to help eligible countries address longer-term structural challenges that pose macroeconomic risks, looks forward to the upcoming interim review of the Trust, and notes that debt sustainability and liquidity can play an important role in achieving a sustainable, inclusive and resilient recovery and the Sustainable Development Goals;",
    "7": "Welcomes the intergovernmentally agreed conclusions and recommendations of the 2023 Economic and Social Council forum on financing for development follow-up and urges their full, effective and timely implementation, and looks forward to staying engaged so as to assess progress, identify obstacles and challenges in the implementation of the financing for development outcomes and in the delivery of the means of implementation, promote the sharing of lessons learned from experiences at the national and regional levels, address new and emerging topics of relevance to the implementation of this agenda as the need arises and provide policy recommendations for action by the international community in substantive intergovernmentally agreed conclusions and recommendations at the 2024 forum;",
    "8": "Notes in this regard the further development of integrated national financing frameworks, in support of nationally owned sustainable development strategies, including disaster risk reduction strategies, in order to further implement the Addis Ababa Action Agenda, aimed at effectively mobilizing and aligning a wide range of financing sources and instruments with the 2030 Agenda for Sustainable Development and making use of the full potential of all means of implementation;",
    "9": "Takes note of the summary by the President of the Economic and Social Council of the 2023 Economic and Social Council forum on financing for development follow-up;13",
    "10": "Emphasizes that timely and adequate planning for the 2024 Economic and Social Council forum on financing for development follow-up is of paramount importance to its substantive work and outcome;",
    "11": "Invites the President of the Economic and Social Council to take into consideration the summary by the President of the Council of the 2023 forum on financing for development follow-up in the preparation of the 2024 forum;",
    "12": "Recalls that decisions relating to the Economic and Social Council forum on financing for development follow-up are to be contained within the forum\u2019s intergovernmentally agreed conclusions and recommendations;",
    "13": "Takes note of the work of the Committee of Experts on International Cooperation in Tax Matters and the initial contributions made by India to the voluntary trust fund, by Norway to a multi-donor project aimed at supporting the work of the Committee, its subcommittees and related capacity development activities, as well as the contributions by the European Union and other countries in support of the Committee\u2019s subsidiary bodies, and urges Member States to come forward to contribute more to the trust fund in order to further support the participation of developing countries;",
    "14": "Recalls the holding of the 2020 Global Infrastructure Forum from 6 to 8 October 2020, in a virtual setting, and reiterates that the Forum is mandated to identify and address infrastructure and capacity gaps in developing countries, particularly in the least developed countries, landlocked developing countries, small island developing States and African countries;",
    "15": "Also recalls the progress made in operationalizing the three components of the Technology Facilitation Mechanism, and welcomes the establishment of the 2030 Connect online platform as part of the Mechanism;",
    "16": "Further recalls the operationalization of the Technology Bank for the Least Developed Countries, and invites Member States, as well as international organizations, foundations and the private sector, to provide increased voluntary financial contributions and technical assistance to ensure its full and effective implementation;",
    "17": "Highlights the need to provide universal and affordable access to the Internet by 2030 as an essential step towards an inclusive and sustainable digital economy that empowers people in vulnerable situations to narrow digital divides, and to build on financial technology to support financial inclusion;",
    "18": "Recalls the convening of the eighth annual multi-stakeholder forum on science, technology and innovation for the Sustainable Development Goals in New York on 3 and 4 May 2023, whose Co-Chairs\u2019 summary14 served as an input to the high-level political forum on sustainable development and highlighted, inter alia, the promotion of networking and matchmaking among relevant stakeholders, especially innovators, funders and other supporters, to bridge the technology gap for the Sustainable Development Goals;",
    "19": "Also recalls that the Addis Ababa Action Agenda provides a global framework for financing sustainable development and is an integral part of the 2030 Agenda, supports and complements it and helps to contextualize the means of implementation targets with concrete policies and actions, the implementation of which requires following up on, that relate to its seven action areas, namely, domestic public resources; domestic and international private business and finance; international development cooperation; international trade as an engine for development; debt and debt sustainability; addressing systemic issues; science, technology, innovation and capacity-building; and data, monitoring and follow-up;",
    "20": "Reiterates that States will not be able to achieve the ambitious Goals and targets of the 2030 Agenda without a revitalized and enhanced global partnership and comparably ambitious means of implementation, and reaffirms the commitment at the very heart of the 2030 Agenda to leave no one behind and commit to taking more tangible steps to support people in vulnerable situations and the most vulnerable countries and to reach the furthest behind first;",
    "21": "Urges developed countries to scale up and fulfil their respective official development assistance commitments, including the commitment by many developed countries to achieve the targets of 0.7 per cent of gross national income for official development assistance to developing countries and 0.15 to 0.20 per cent to the least developed countries;",
    "22": "Encourages strengthening the lending capacity of multilateral development banks, in that regard urges them to make the most efficient use of their balance sheets in order to optimize their lending while preserving their robust credit ratings, financial sustainability and preferred creditor status, and takes note of the independent review of the banks\u2019 capital adequacy frameworks and ongoing balance sheet optimization efforts, commissioned by the Group of 20;",
    "23": "Notes the policy recommendations of the Intergovernmental Group of Experts on Financing for Development of the United Nations Conference on Trade and Development, and that the agreed policy recommendations serve as an input to the Economic and Social Council forum on financing for development follow-up in accordance with the terms of reference of the Intergovernmental Group of Experts;",
    "24": "Also notes that, in order to advance bold and concerted global action to achieve sustainable development in its three dimensions \u2013 economic, social and environmental \u2013 in a balanced and integrated manner, and achieve a sustainable, inclusive and resilient recovery, and set the world on a path towards the achievement of the Sustainable Development Goals by 2030, both domestic efforts and multilateral action, as well as multi-stakeholder partnerships that include the private sector, should be geared to supporting medium- and long-term sustainable development, particularly in developing countries, emphasizes the importance of improving investment and financing in sectors that are critical to accelerating the achievement of the 2030 Agenda, the Addis Ababa Action Agenda and other agreed commitments to support countries in special situations, stresses the need to promote quality, reliable, sustainable and resilient infrastructure, particularly in developing countries, in a manner that has the greatest social, economic and environmental benefits, in order to build resilience against shocks for an inclusive, sustainable and resilient recovery and achieve the Sustainable Development Goals, and recognizes the important role of the United Nations development system, the World Bank and other multilateral institutions in addressing the capacity gaps and funding requirements for developing quality, reliable, sustainable and resilient infrastructure projects, especially in developing countries, working through existing initiatives;",
    "25": "Calls for advancing the elaboration of a specific inter-agency, comprehensive system-wide response plan, taking note of the mapping exercise conducted by the Secretary-General and his recommendations, aimed at better addressing the multidimensional nature of sustainable development and facilitating sustainable development cooperation and coordinated and inclusive support to middle-income countries based on their specific challenges and diverse needs;",
    "26": "Calls upon all Member States to continue to engage in discussions in consultation with relevant stakeholders, including international financial institutions, multilateral development banks and regional commissions, on measures of progress on sustainable development that complement or go beyond gross domestic product, taking into account existing initiatives, to have a more inclusive approach to international cooperation;",
    "27": " upon complementary measures already in place, for the consideration of the General Assembly; (b) Stresses the call for a United Nations-led intergovernmental process in consultation with relevant stakeholders, including the UN Statistical Commission, international financial institutions, multilateral development banks and regional commissions, in line with their respective mandates, on measures of progress on sustainable development that complement or go beyond gross domestic product; (c) Requests the Secretary-General to convene additional briefings on his proposals, in consultation with the General Assembly, so as to inform the United Nations-led process; (d) Calls upon the international community to increase the provision of resources for and capacity-building on statistics and data collection, including disaggregated data, to support developing countries in their efforts and to fill gaps in reporting on the Goals; (e) Recognizing the importance of designing robust and technically sound measures of progress while also recognizing the value of evidence-based approaches to evaluate progress to date towards the Sustainable Development Goals;",
    "28": "Welcomes the work of the High-level Panel on the Development of a Multidimensional Vulnerability Index for Small Island Developing States, which was co-chaired by the Prime Minister of Antigua and Barbuda, Gaston Browne, and the former Prime Minister of Norway, Erna Solberg, including its consultations with Member States, and in this regard takes note of the Panel\u2019s final report and the recommendations contained therein;",
    "29": "Decides to convene, in 2025, a fourth international conference on financing for development to, inter alia, assess the progress made in the implementation of the Monterrey Consensus, the Doha Declaration and the Addis Ababa Action Agenda, identifying obstacles and constraints encountered in the achievement of the goals and objectives agreed therein, as well as actions and initiatives to overcome these constraints, and to address new and emerging issues, including in the context of the urgent need to accelerate the implementation of the 2030 Agenda and the achievement of the Sustainable Development Goals and to support reform of the international financial architecture;",
    "30": "Welcomes the offer by the Government of Spain to host the Fourth International Conference on Financing for Development;",
    "31": "Decides to establish an intergovernmental preparatory committee to make the organizational, procedural and substantive preparations for the Conference, which will hold a one day organizational session in the first quarter of 2024 and up to three sessions, of no more than five days each, in 2024 and up to two sessions, of no more than five days each, in 2025, with the last session taking place in New York, on dates to be decided at the organizational session of the intergovernmental preparatory committee;",
    "32": "Also decides that the intergovernmental preparatory committee shall have a Bureau consisting of three members from each regional group and that the committee shall elect two Co-Chairs from among the nominated Bureau members, one from a developed State and one from a developing State, and that the host country and the Chair of the Group of 77 and China shall serve as ex officio members of the Bureau;",
    "33": " 2024, so that they can be involved in the preparations for the first meeting of the committee;",
    "34": "Decides that the intergovernmental preparatory committee, during its organizational session in the first quarter of 2024, will adopt decisions and, as appropriate, make recommendations to the General Assembly on the dates of the sessions of the intergovernmental preparatory committee, additional modalities, including inclusive participation, and format of the Conference and how it can be organized in the most efficient and effective manner;",
    "35": "Welcomes the offer by the Government of Ethiopia to host one of the sessions of the intergovernmental preparatory committee in 2024 in Addis Ababa as part of the preparatory process of the Fourth International Conference on Financing for Development to review the progress and the gaps in the implementation of the Addis Ababa Action Agenda as an integral part of the 2030 Agenda, and identify actions and ideas to accelerate the implementation of the Sustainable Development Goals;",
    "36": "Also welcomes the offer by the Government of Mexico to host one of the sessions of the intergovernmental preparatory committee as part of the preparatory process of the Fourth International Conference on Financing for Development;",
    "37": "Invites the Bureau to convene further meetings of the intergovernmental preparatory committee on an informal basis in New York, as required and in the most efficient and effective manner, to conclude discussions on the modalities and draft outcome document of the Conference;",
    "38": "Reiterates its appeal to Member States and other potential donors to consider contributing generously to the Trust Fund for the Follow-up to the International Conference on Financing for Development, which would facilitate the implementation of a strengthened and more effective inclusive, intergovernmental process for carrying out the financing for development follow-up;",
    "39": "Recognizes the work of the Financing for Sustainable Development Office, and encourages the Office, in collaboration with experts from the public and private sectors, academia, civil society and other multilateral organizations who work in the field of financing for development, to continue its work in accordance with its mandate;",
    "40": "Requests the Secretary-General to submit to the General Assembly at its seventy-ninth session an action-oriented report, presenting emerging challenges and key accelerators for financing for development that may be relevant for future discussions in the framework of the Economic and Social Council forum on financing for development follow-up and the Fourth International Conference on Financing for Development;",
    "41": "",
    "42": "Decides to include in the provisional agenda of its seventy-ninth session the item entitled \u201cFollow-up to and implementation of the outcomes of the International Conferences on Financing for Development\u201d."
  },
  "agenda_items": [
    "Item 17"
  ],
  "symbol_references": []
}