{
  "symbol": "A/RES/72/60",
  "filename": "A_RES_72_60.pdf",
  "title": "72/60. United Nations Regional Centre for Peace and Disarmament in Africa",
  "text": "United Nations \nA/RES/72/60\n \n \nGeneral Assembly \nDistr.: General \n13 December 2017 \n \n17-21747 (E)    151217 \n*1721747* \n \n \nSeventy-second session \nAgenda item 100 (b) \n \n \n \n \n Resolution adopted by the General Assembly \non 4 December 2017 \n \n \n \n \n[on the report of the First Committee (A/72/410)] \n \n \n \n72/60. United Nations Regional Centre for Peace and Disarmament \nin Africa \n \n \n \nThe General Assembly,  \n \nMindful of the provisions of Article 11, paragraph 1, of the Charter of the \nUnited Nations, in which it is stipulated that a function of the General Assembly is \nto consider the general principles of cooperation in the maintenance of international \npeace and security, including the principles governing disarmament and arms \nlimitation,  \n \nRecalling its resolutions 40/151 G of 16 December 1985, 41/60 D of \n3 December 1986, 42/39 J of 30 November 1987 and 43/76 D of 7 December 1988 \non the United Nations Regional Centre for Peace and Disarmament in Africa and its \nresolutions 46/36 F of 6 December 1991 and 47/52 G of 9 December 1992 on \nregional disarmament, including confidence-building measures,  \n \nRecalling also its subsequent resolutions on the Regional Centre, the most \nrecent of which is resolution 71/76 of 5 December 2016,  \n \nRecalling further its resolution 71/56 of 5 December 2016, in which the \nGeneral Assembly recognized the role of women in disarmament, non-proliferation \nand arms control,  \n \nReaffirming the role of the Regional Centre in promoting disarmament, peace \nand security at the regional level,  \n \nWelcoming the continuing and deepening cooperation between the Regional \nCentre, the African Union and African subregional organizations in the context of \nthe adoption of Agenda 2063 by the Assembly of Heads of State and Government \nof the African Union, and in particular the objective of silencing the guns in Africa \nby 2020,  \n\nA/RES/72/60 \nUnited Nations Regional Centre for Peace and Disarmament in Africa\n \n17-21747 \n2/3 \n \n \nWelcoming also the work of the Regional Centre in support of the achievement \nof the Sustainable Development Goals,1 in particular Goal 16 on peace, justice and \nstrong institutions, and target 16.4, which addresses the reduction of illicit arms \nflows, \n \nRecalling the decision taken by the Executive Council of the African Union at \nits eighth ordinary session, held in Khartoum from 16 to 21 January 2006,2 in which \nthe Council called upon member States to make voluntary contributions to the \nRegional Centre to maintain its operations,  \n \nRecalling also the call by the Secretary-General for continued financial and \nin-kind support from Member States, which would enable the Regional Centre to \ndischarge its mandate in full and to respond more effectively to requests for \nassistance from African States,  \n \n1. \nTakes note of the report of the Secretary-General;3  \n \n2. \nCommends the United Nations Regional Centre for Peace and \nDisarmament in Africa for its sustained support to Member States in implementing \ndisarmament, arms control and non-proliferation activities through seminars and \nconferences, capacity-building and training, policy and technical expertise, and \ninformation and advocacy at the regional and national levels;  \n \n3. \nWelcomes the continental dimension of the activities of the Regional \nCentre in response to the evolving needs of African Member States and the region\u2019s \nnew and emerging challenges in the areas of disarmament, peace and security, \nincluding maritime security;  \n \n4. \nAlso welcomes the undertaking by the Regional Centre to deepen its \npartnership with the African Union Commission in the context of the Joint United \nNations-African Union Framework for Enhanced Partnership in Peace and Security, \nsigned on 19 April 2017, as well as with African subregional organizations, and \nrequests the Secretary-General to continue to facilitate close cooperation between \nthe Regional Centre and the African Union, in particular in the areas of \ndisarmament, peace and security; \n \n5. \nFurther welcomes the contribution of the Regional Centre to continental \ndisarmament, peace and security, in particular its contribution to the implementation \nof Agenda 2063 adopted by the Assembly of Heads of State and Government of the \nAfrican Union, the objective of silencing the guns in Africa and its master road map \nof practical steps to silence the guns in Africa by the year 2020, as well as its \nassistance to the African Commission on Nuclear Energy in its implementation of \nthe African Nuclear-Weapon-Free Zone Treaty (Treaty of Pelindaba);4 \n \n6. \nWelcomes efforts by the Regional Centre to promote the role and \nrepresentation of women in disarmament, non-proliferation and arms control \nactivities;  \n \n7. \nNotes with appreciation the tangible achievements of the Regional \nCentre and the impact of the assistance that it provided to African States, in \nparticular in Central Africa and the Sahel, to control small arms and light weapons \nthrough capacity-building for national commissions on small arms and light \nweapons, defence and security forces, and United Nations peacekeeping mission \npersonnel, as well as the support that the Centre provided to States in preventing the \ndiversion of such weapons, in particular to non-State armed groups and terrorist \n__________________ \n \n1  See resolution 70/1. \n \n2  A/60/693, annex II, decision EX.CL/Dec.263 (VIII). \n \n3  A/72/97. \n \n4  A/50/426, annex. \n\nUnited Nations Regional Centre for Peace and Disarmament in Africa \nA/RES/72/60\n \n3/3 \n17-21747 \n \ngroups,5 and also notes with appreciation the assistance provided by the Centre in \nthe implementation of the Central African Convention for the Control of Small \nArms and Light Weapons, Their Ammunition and All Parts and Components That \nCan Be Used for Their Manufacture, Repair and Assembly (Kinshasa Convention), 6 \nwhich entered into force on 8 March 2017, and its substantive support to the United \nNations Standing Advisory Committee on Security Questions in Central Africa, in \nthe implementation of the Economic Community of West African States Convention \non Small Arms and Light Weapons, Their Ammunition and Other Related Materials \nand on security sector reform initiatives, and to East Africa on programmes to \ncontrol brokering of small arms and light weapons, including the additional \nassistance provided by the Centre to African Member States in the implementation \nof Security Council resolution 1540 (2004) of 28 April 2004 and the Convention on \nthe Prohibition of the Development, Production and Stockpiling of Bacteriological \n(Biological) and Toxin Weapons and on Their Destruction;7 \n \n8. \nCommends the Regional Centre for the support and assistance that it \nprovided to African States, upon request, on the Arms Trade Treaty, 8 including \nthrough the organization of subregional and regional seminars and workshops;  \n \n9. \nUrges \nall \nStates, \nas \nwell \nas \ninternational, \ngovernmental \nand \nnon-governmental organizations and foundations, to make voluntary contributions \nto enable the Regional Centre to carry out its programmes and activities and meet \nthe needs of African States;  \n \n10. Urges, in particular, States members of the African Union to make \nvoluntary contributions to the trust fund for the United Nations Regional Centre for \nPeace and Disarmament in Africa, in conformity with the decision taken by the \nExecutive Council of the African Union in Khartoum in January 2006;2 \n \n11. \nRequests the Secretary-General to continue to provide the Regional \nCentre with the support necessary for greater achievements and results;  \n \n12. Also requests the Secretary-General to report to the General Assembly at \nits seventy-third session on the implementation of the present resolution;  \n \n13. Decides to include in the provisional agenda of its seventy-third session, \nunder the item entitled \u201cReview and implementation of the Concluding Document \nof the Twelfth Special Session of the General Assembly\u201d, the sub-item entitled \n\u201cUnited Nations Regional Centre for Peace and Disarmament in Africa\u201d. \n \n62nd plenary meeting  \n4 December 2017 \n \n__________________ \n \n5  Security Council resolution 2370 (2017). \n \n6  See A/65/517-S/2010/534, annex. \n \n7  United Nations, Treaty Series, vol. 1015, No. 14860. \n \n8  See resolution 67/234 B. \n",
  "paragraphs": {
    "1": "Takes note of the report of the Secretary-General;3",
    "2": "Commends the United Nations Regional Centre for Peace and Disarmament in Africa for its sustained support to Member States in implementing disarmament, arms control and non-proliferation activities through seminars and conferences, capacity-building and training, policy and technical expertise, and information and advocacy at the regional and national levels;",
    "3": "Welcomes the continental dimension of the activities of the Regional Centre in response to the evolving needs of African Member States and the region\u2019s new and emerging challenges in the areas of disarmament, peace and security, including maritime security;",
    "4": "Also welcomes the undertaking by the Regional Centre to deepen its partnership with the African Union Commission in the context of the Joint United Nations-African Union Framework for Enhanced Partnership in Peace and Security, signed on 19 April 2017, as well as with African subregional organizations, and requests the Secretary-General to continue to facilitate close cooperation between the Regional Centre and the African Union, in particular in the areas of disarmament, peace and security;",
    "5": "Further welcomes the contribution of the Regional Centre to continental disarmament, peace and security, in particular its contribution to the implementation of Agenda 2063 adopted by the Assembly of Heads of State and Government of the African Union, the objective of silencing the guns in Africa and its master road map of practical steps to silence the guns in Africa by the year 2020, as well as its assistance to the African Commission on Nuclear Energy in its implementation of the African Nuclear-Weapon-Free Zone Treaty (Treaty of Pelindaba);4",
    "6": "Welcomes efforts by the Regional Centre to promote the role and representation of women in disarmament, non-proliferation and arms control activities;",
    "7": "Notes with appreciation the tangible achievements of the Regional Centre and the impact of the assistance that it provided to African States, in particular in Central Africa and the Sahel, to control small arms and light weapons through capacity-building for national commissions on small arms and light weapons, defence and security forces, and United Nations peacekeeping mission personnel, as well as the support that the Centre provided to States in preventing the diversion of such weapons, in particular to non-State armed groups and terrorist groups,5 and also notes with appreciation the assistance provided by the Centre in the implementation of the Central African Convention for the Control of Small Arms and Light Weapons, Their Ammunition and All Parts and Components That Can Be Used for Their Manufacture, Repair and Assembly (Kinshasa Convention), 6 which entered into force on 8 March 2017, and its substantive support to the United Nations Standing Advisory Committee on Security Questions in Central Africa, in the implementation of the Economic Community of West African States Convention on Small Arms and Light Weapons, Their Ammunition and Other Related Materials and on security sector reform initiatives, and to East Africa on programmes to control brokering of small arms and light weapons, including the additional assistance provided by the Centre to African Member States in the implementation of Security Council resolution 1540 (2004) of 28 April 2004 and the Convention on the Prohibition of the Development, Production and Stockpiling of Bacteriological (Biological) and Toxin Weapons and on Their Destruction;7",
    "8": "Commends the Regional Centre for the support and assistance that it provided to African States, upon request, on the Arms Trade Treaty, 8 including through the organization of subregional and regional seminars and workshops;",
    "9": "Urges all States, as well as international, governmental and non-governmental organizations and foundations, to make voluntary contributions to enable the Regional Centre to carry out its programmes and activities and meet the needs of African States;",
    "10": "Urges, in particular, States members of the African Union to make voluntary contributions to the trust fund for the United Nations Regional Centre for Peace and Disarmament in Africa, in conformity with the decision taken by the Executive Council of the African Union in Khartoum in January 2006;2",
    "11": "Requests the Secretary-General to continue to provide the Regional Centre with the support necessary for greater achievements and results;",
    "12": "Also requests the Secretary-General to report to the General Assembly at its seventy-third session on the implementation of the present resolution;",
    "13": "Decides to include in the provisional agenda of its seventy-third session, under the item entitled \u201cReview and implementation of the Concluding Document of the Twelfth Special Session of the General Assembly\u201d, the sub-item entitled \u201cUnited Nations Regional Centre for Peace and Disarmament in Africa\u201d."
  },
  "agenda_items": [
    "Item 100"
  ],
  "symbol_references": []
}