{
  "symbol": "A/RES/76/190",
  "filename": "A_RES_76_190.pdf",
  "title": "76/190. International trade and development",
  "text": "United Nations \nA/RES/76/190\n \n \nGeneral Assembly \nDistr.: General \n10 January 2022 \n \n21-19240 (E)    140122     \n*2119240* \n \n \nSeventy-sixth session \nAgenda item 18 (a) \nMacroeconomic policy questions: international trade \nand development \n \n \n \n \n Resolution adopted by the General Assembly \non 17 December 2021 \n \n \n \n \n[on the report of the Second Committee (A/76/531/Add.1, para. 13)] \n \n \n 76/190. International trade and development \n \n \n \nThe General Assembly, \n \nRecalling its resolutions 56/178 of 21 December 2001, 57/235 of 20 December \n2002, 58/197 of 23 December 2003, 59/221 of 22 December 2004, 60/184 of \n22 December 2005, 61/186 of 20 December 2006, 62/184 of 19 December 2007, \n63/203 of 19 December 2008, 64/188 of 21 December 2009, 65/142 of 20 December \n2010, 66/185 of 22 December 2011, 67/196 of 21 December 2012, 68/199 of \n20 December 2013, 69/205 of 19 December 2014, 70/187 of 22 December 2015, \n71/214 of 21 December 2016, 72/202 of 20 December 2017, 73/219 of 20 December \n2018, 74/201 of 19 December 2019 and 75/203 of 21 December 2020,  \n \nReaffirming its resolution 70/1 of 25 September 2015, entitled \u201cTransforming \nour world: the 2030 Agenda for Sustainable Development\u201d, in which it adopted a \ncomprehensive, far-reaching and people-centred set of universal and transformative \nSustainable Development Goals and targets, its commitment to working tirelessly for \nthe full implementation of the Agenda by 2030, its recognition that eradicating \npoverty in all its forms and dimensions, including extreme poverty, is the greatest \nglobal challenge and an indispensable requirement for sustainable development, its \ncommitment to achieving sustainable development in its three dimensions \u2013 \neconomic, social and environmental \u2013 in a balanced and integrated manner, and to \nbuilding upon the achievements of the Millennium Development Goals and seeking \nto address their unfinished business,  \n \nReaffirming also its resolution 69/313 of 27 July 2015 on the Addis Ababa \nAction Agenda of the Third International Conference on Financing for Development, \nwhich is an integral part of the 2030 Agenda for Sustainable Development, supports \nand complements it, helps to contextualize its means of implementation targets with \nconcrete policies and actions, and reaffirms the strong political commitment to \n \n\nA/RES/76/190 \nInternational trade and development\n \n21-19240\n2/5 \n \naddress the challenge of financing and creating an enabling environment at all levels \nfor sustainable development in the spirit of global partnership and solidarity,  \n \nRecognizing the need to ensure that the benefits of trade are more widely shared,  \n \nReaffirming World Trade Organization decision WT/MIN(15)/48-WT/L/982 of \n19 December 2015 on the implementation of preferential treatment in favour of \nservices and service suppliers of the least developed countries and increasing their \nparticipation in services trade and decision WT/L/508/Add.1 of 25 July 2012 on \naccession by the least developed countries, encouraging progress on the \nimplementation of the World Trade Organization work programme on small \neconomies, which supports their efforts towards sustainable development, as also \nreflected in the outcome document of the third International Conference on Small \nIsland Developing States, the SIDS Accelerated Modalities of Action (SAMOA) \nPathway,1 and stressing that Aid for Trade and targeted trade-related capacity-\nbuilding are essential to integrating developing countries, in particular the least \ndeveloped countries, landlocked developing countries and small island developing \nStates, into the international trading system,  \n \nRecognizing the critical role of women as producers and traders and the need to \naddress their specific challenges in order to facilitate their equal and active \nparticipation in domestic, regional and international trade,  \n \nRecognizing also that multilateral rules and disciplines are the best guarantee \nagainst protectionism and are fundamental to the transparency, predictability and \nstability of international trade,  \n \nNoting the commitments to working to ensure that bilateral, regional and \nplurilateral trade agreements complement the multilateral trading system, recognizing \nthat they can play an important role in complementing global liberalization initiatives, \nand in this regard recalling the entry into force of the Agreement Establishing the \nAfrican Continental Free Trade Area, on 30 May 2019,  \n \nNoting with great concern the severe negative impact on human health, safety \nand well-being caused by the coronavirus disease (COVID-19) pandemic, as well as \nthe severe disruption to societies and economies and the devastating impact on lives \nand livelihoods, and that the poorest and most vulnerable are the hardest hit by the \npandemic, reaffirming the ambition to get back on track to achieve the Sustainable \nDevelopment Goals by designing and implementing sustainable and inclusive \nrecovery strategies to accelerate progress towards the full implementation of the 2030 \nAgenda for Sustainable Development and to help to reduce the risk of and build \nresilience to future shocks, crises and pandemics, including by strengthening health \nsystems and achieving universal health coverage, and recognizing that equitable and \ntimely access for all to safe, quality, effective and affordable COVID-19 vaccines, \ntherapeutics and diagnostics are an essential part of a global response based on unity, \nsolidarity, renewed multilateral cooperation and the principle of leaving no one \nbehind, \n \nDeeply concerned that the COVID-19 pandemic has disrupted trade, transport, \ntourism, cross-border travel, commodity markets, investment, debt service and \nfinancial flows, including remittances, with significant impacts on traditionally \nunderrepresented groups and the operation of global value chains, affecting all sectors \nof the economy, including micro-, small and medium-sized enterprises and people\u2019s \nlives, especially in developing and least developed countries, compounding the \nchallenges posed by climate change, which have had a devastating impact on \nsustainable development and humanitarian needs, including on poverty eradication, \n__________________ \n \n1 Resolution 69/15, annex. \n\nInternational trade and development \nA/RES/76/190\n \n3/5\n21-19240 \n \non the reduction of inequalities, including gender inequality, and on livelihoods, \nending hunger, food security and nutrition, education, environmentally sound waste \nmanagement and access to health care, especially for the poorest and the most \nvulnerable, particularly in developing countries, including countries in special \nsituations, as well as countries facing specific challenges and those most affected by \nthe pandemic and its socioeconomic consequences, and that restrictive trade measures \nand the lack of transparency and cooperation within the multilateral trading system \nhave affected access for all to safe, quality, effective and affordable COVID-19 \nvaccines, other essential goods and basic foodstuffs, \n \nReiterating the pledge that no one will be left behind, reaffirming the \nrecognition that the dignity of the human person is fundamental, and the wish to see \nthe Goals and targets met for all nations and peoples and for all segments of society, \nand recommitting to endeavour to reach the furthest behind first, \n \n1. \nTakes note of the report of the Trade and Development Board of the United \nNations Conference on Trade and Development2 and the note by the Secretary-\nGeneral;3  \n \n2. \nReaffirms that international trade is an engine for inclusive growth and \npoverty eradication and that it contributes to the promotion of sustainable \ndevelopment, structural transformation and industrialization, particularly in \ndeveloping countries;  \n \n3. \nReiterates that States will not be able to achieve the ambitious Goals and \ntargets of the 2030 Agenda for Sustainable Development4 without a revitalized and \nenhanced global partnership and comparably ambitious means of implementation, and \nthat a revitalized global partnership will facilitate an intensive global engagement in \nsupport of the implementation of the 2030 Agenda, bringing together Governments, \ncivil society, the private sector, the United Nations system and other actors and \nmobilizing all available resources;  \n \n4. \nReaffirms the commitments made through the adoption of the Addis Ababa \nAction Agenda of the Third International Conference on Financing for Development 5 \nin, inter alia, international trade as an important action area for sustainable \ndevelopment;  \n \n5. \nNotes with concern that the World Trade Organization is increasingly \naffected by insufficient progress in multilateral trade negotiations and that it is \nimperative for the World Trade Organization to address issues that are at the heart of \ncurrent problems in international trade, and recognizes in this regard the need to \nstrengthen the World Trade Organization, with a view to ensuring the continued \nviability and effectiveness of its dispute settlement, negotiating and monitoring \nfunctions;  \n \n6. \nRecommits firmly to promoting a universal, rules-based, open, transparent, \npredictable, inclusive, non-discriminatory and equitable multilateral trading system \nunder the World Trade Organization, as well as meaningful trade liberalization;  \n \n7. \nEmphasizes the urgent need to combat protectionism in all its forms and \nto rectify any trade-distorting measures that are inconsistent with World Trade \nOrganization rules, recognizing the right of countries, in particular developing \ncountries, to fully utilize flexibilities consistent with their World Trade Organization \ncommitments and obligations, and also emphasizes that the work of the World Trade \n__________________ \n \n2 A/76/15 (Part I), A/76/15 (Part II) and A/76/15 (Part III). \n \n3 A/76/213. \n \n4 Resolution 70/1. \n \n5 Resolution 69/313, annex. \n\nA/RES/76/190 \nInternational trade and development\n \n21-19240\n4/5 \n \nOrganization shall maintain development at its centre, with provisions for special and \ndifferential treatment remaining integral;  \n \n8. \nAlso emphasizes the critical need for globally coordinated actions to \nensure timely, affordable and equitable distribution of and access for all to safe, \nquality, effective and affordable COVID-19 vaccines and to ensure that emergency \ntrade measures are targeted, proportionate, transparent and temporary, do not create \nunnecessary barriers to trade or disruptions to global supply chains and are consistent \nwith World Trade Organization rules, calls for enhancing the capacity of the \nmultilateral trading system to increase pandemic and disaster preparedness and \nresilience through a multifaceted response, including by strengthening the resilience \nof global supply chains, including short-term measures such as trade facilitation, \ntransparency and restraint in relation to export restrictions on vaccines, therapeutics \nand diagnostics supplies, as well as the rapid scaling up and expansion of vaccine \nproduction globally, including in developing countries, through appropriate \ndissemination of technology and know-how in accordance with World Trade \nOrganization rules, for example, licensing, using Trade-Related Aspects of \nIntellectual Property Rights (TRIPS) flexibilities if necessary, sharing knowledge and \ndata related to COVID-19 health technologies and supporting ongoing discussion at \nthe World Trade Organization on how the multilateral rules-based trade system can \ncontribute to enhancing access to equitable distribution of COVID-19 vaccines, as \nwell as ensuring the normal functioning of open markets and global supply chain \nconnectivity and cross-border travel for essential purposes, and calls upon Member \nStates to highlight the critical role of digital technologies in sustaining business \ncontinuity and supply chains throughout the COVID-19 pandemic and to strengthen \ncooperation between the United Nations Conference on Trade and Development and \nother trade-related organizations and forums, including the World Trade \nOrganization, as well as to promote further economic integration through regional \ntrade agreements to ensure faster trade recovery and development as an important \nsource of world economic growth, and in this regard continue to support the \noperationalization of the African Continental Free Trade Area; \n \n9. \nUrges the international community to adopt urgent and effective measures \nto eliminate the use of unilateral economic, financial or trade measures that are not \nauthorized by relevant organs of the United Nations, that are inconsistent with the \nprinciples of international law or the Charter of the United Nations or that contravene \nthe basic principles of the multilateral trading system and that affect, in particular, \nbut not exclusively, developing countries; \n \n10. Calls upon all members of the World Trade Organization to urgently \nconclude negotiations on fisheries subsidies by the conclusion of the twelfth \nMinisterial Conference of the World Trade Organization, consistent with the decision \nof its eleventh Ministerial Conference and with a view to meeting the Sustainable \nDevelopment Goals;  \n \n11. \nRecognizes the importance of preventing trade restrictions and distortions \nin world agricultural markets and of contributing to the facilitation of market access \nfor products from developing countries, in accordance with World Trade Organization \ncommitments;  \n \n12. Underlines the importance of the Agreement on Trade Facilitation annexed \nto the Protocol amending the Marrakesh Agreement Establishing the World Trade \nOrganization in improving transparency, expediting the movement, release and \nclearance of goods, including goods in transit, and thereby reducing trade costs, and \nin this regard encourages its full and effective implementation, including through \nenhanced support towards its implementation; \n\nInternational trade and development \nA/RES/76/190\n \n5/5\n21-19240 \n \n \n13. Welcomes the convening of the fifteenth session of the United Nations \nConference on Trade and Development, in Bridgetown, from 3 to 7 October 2021, \nunder the theme \u201cFrom inequality and vulnerability to prosperity for all\u201d, and also \nwelcomes the adoption of its outcome document entitled \u201cBridgetown Covenant\u201d;  \n \n14. Also welcomes the convening of the twelfth Ministerial Conference of the \nWorld Trade Organization, from 30 November to 3 December 2021 in Geneva, under \nthe presidency of the Government of Kazakhstan;  \n \n15. Reiterates the important role of the United Nations Conference on Trade \nand Development as the focal point within the United Nations system for the \nintegrated treatment of trade and development and interrelated issues in the areas of \nfinance, technology, investment and sustainable development, and in contributing to \nsupporting the implementation of the 2030 Agenda;  \n \n16. Reaffirms the commitment at the very heart of the 2030 Agenda to leave \nno one behind and commit to taking more tangible steps to support people in \nvulnerable situations and the most vulnerable countries and to reach the furthest \nbehind first;  \n \n17. Requests the Secretary-General, in collaboration with the secretariat of the \nUnited Nations Conference on Trade and Development, to submit to the General \nAssembly at its seventy-seventh session a report on the implementation of the present \nresolution and on developments in the international trading system, including \nconcrete recommendations to accelerate the implementation of the Addis Ababa \nAction Agenda in this regard, and decides to include in the provisional agenda of its \nseventy-seventh session, under the item entitled \u201cMacroeconomic policy questions\u201d, \nthe sub-item entitled \u201cInternational trade and development\u201d. \n \n54th plenary meeting \n17 December 2021 \n \n",
  "paragraphs": {
    "1": "Takes note of the report of the Trade and Development Board of the United Nations Conference on Trade and Development2 and the note by the Secretary- General;3",
    "2": "Reaffirms that international trade is an engine for inclusive growth and poverty eradication and that it contributes to the promotion of sustainable development, structural transformation and industrialization, particularly in developing countries;",
    "3": "Reiterates that States will not be able to achieve the ambitious Goals and targets of the 2030 Agenda for Sustainable Development4 without a revitalized and enhanced global partnership and comparably ambitious means of implementation, and that a revitalized global partnership will facilitate an intensive global engagement in support of the implementation of the 2030 Agenda, bringing together Governments, civil society, the private sector, the United Nations system and other actors and mobilizing all available resources;",
    "4": "Reaffirms the commitments made through the adoption of the Addis Ababa Action Agenda of the Third International Conference on Financing for Development 5 in, inter alia, international trade as an important action area for sustainable development;",
    "5": "Notes with concern that the World Trade Organization is increasingly affected by insufficient progress in multilateral trade negotiations and that it is imperative for the World Trade Organization to address issues that are at the heart of current problems in international trade, and recognizes in this regard the need to strengthen the World Trade Organization, with a view to ensuring the continued viability and effectiveness of its dispute settlement, negotiating and monitoring functions;",
    "6": "Recommits firmly to promoting a universal, rules-based, open, transparent, predictable, inclusive, non-discriminatory and equitable multilateral trading system under the World Trade Organization, as well as meaningful trade liberalization;",
    "7": "Emphasizes the urgent need to combat protectionism in all its forms and to rectify any trade-distorting measures that are inconsistent with World Trade Organization rules, recognizing the right of countries, in particular developing countries, to fully utilize flexibilities consistent with their World Trade Organization commitments and obligations, and also emphasizes that the work of the World Trade __________________ 2 A/76/15 (Part I), A/76/15 (Part II) and A/76/15 (Part III). 3 A/76/213. 4 Resolution 70/1. 5 Resolution 69/313, annex. A/RES/76/190 International trade and development 21-19240 4/5 Organization shall maintain development at its centre, with provisions for special and differential treatment remaining integral;",
    "8": "Also emphasizes the critical need for globally coordinated actions to ensure timely, affordable and equitable distribution of and access for all to safe, quality, effective and affordable COVID-19 vaccines and to ensure that emergency trade measures are targeted, proportionate, transparent and temporary, do not create unnecessary barriers to trade or disruptions to global supply chains and are consistent with World Trade Organization rules, calls for enhancing the capacity of the multilateral trading system to increase pandemic and disaster preparedness and resilience through a multifaceted response, including by strengthening the resilience of global supply chains, including short-term measures such as trade facilitation, transparency and restraint in relation to export restrictions on vaccines, therapeutics and diagnostics supplies, as well as the rapid scaling up and expansion of vaccine production globally, including in developing countries, through appropriate dissemination of technology and know-how in accordance with World Trade Organization rules, for example, licensing, using Trade-Related Aspects of Intellectual Property Rights (TRIPS) flexibilities if necessary, sharing knowledge and data related to COVID-19 health technologies and supporting ongoing discussion at the World Trade Organization on how the multilateral rules-based trade system can contribute to enhancing access to equitable distribution of COVID-19 vaccines, as well as ensuring the normal functioning of open markets and global supply chain connectivity and cross-border travel for essential purposes, and calls upon Member States to highlight the critical role of digital technologies in sustaining business continuity and supply chains throughout the COVID-19 pandemic and to strengthen cooperation between the United Nations Conference on Trade and Development and other trade-related organizations and forums, including the World Trade Organization, as well as to promote further economic integration through regional trade agreements to ensure faster trade recovery and development as an important source of world economic growth, and in this regard continue to support the operationalization of the African Continental Free Trade Area;",
    "9": "Urges the international community to adopt urgent and effective measures to eliminate the use of unilateral economic, financial or trade measures that are not authorized by relevant organs of the United Nations, that are inconsistent with the principles of international law or the Charter of the United Nations or that contravene the basic principles of the multilateral trading system and that affect, in particular, but not exclusively, developing countries;",
    "10": "Calls upon all members of the World Trade Organization to urgently conclude negotiations on fisheries subsidies by the conclusion of the twelfth Ministerial Conference of the World Trade Organization, consistent with the decision of its eleventh Ministerial Conference and with a view to meeting the Sustainable Development Goals;",
    "11": "Recognizes the importance of preventing trade restrictions and distortions in world agricultural markets and of contributing to the facilitation of market access for products from developing countries, in accordance with World Trade Organization commitments;",
    "12": "Underlines the importance of the Agreement on Trade Facilitation annexed to the Protocol amending the Marrakesh Agreement Establishing the World Trade Organization in improving transparency, expediting the movement, release and clearance of goods, including goods in transit, and thereby reducing trade costs, and in this regard encourages its full and effective implementation, including through enhanced support towards its implementation; International trade and development A/RES/76/190 5/5 21-19240",
    "13": "Welcomes the convening of the fifteenth session of the United Nations Conference on Trade and Development, in Bridgetown, from 3 to 7 October 2021, under the theme \u201cFrom inequality and vulnerability to prosperity for all\u201d, and also welcomes the adoption of its outcome document entitled \u201cBridgetown Covenant\u201d;",
    "14": "Also welcomes the convening of the twelfth Ministerial Conference of the World Trade Organization, from 30 November to 3 December 2021 in Geneva, under the presidency of the Government of Kazakhstan;",
    "15": "Reiterates the important role of the United Nations Conference on Trade and Development as the focal point within the United Nations system for the integrated treatment of trade and development and interrelated issues in the areas of finance, technology, investment and sustainable development, and in contributing to supporting the implementation of the 2030 Agenda;",
    "16": "Reaffirms the commitment at the very heart of the 2030 Agenda to leave no one behind and commit to taking more tangible steps to support people in vulnerable situations and the most vulnerable countries and to reach the furthest behind first;",
    "17": "Requests the Secretary-General, in collaboration with the secretariat of the United Nations Conference on Trade and Development, to submit to the General Assembly at its seventy-seventh session a report on the implementation of the present resolution and on developments in the international trading system, including concrete recommendations to accelerate the implementation of the Addis Ababa Action Agenda in this regard, and decides to include in the provisional agenda of its seventy-seventh session, under the item entitled \u201cMacroeconomic policy questions\u201d, the sub-item entitled \u201cInternational trade and development\u201d. 54th plenary meeting 17 December 2021"
  },
  "agenda_items": [
    "Item 18"
  ],
  "symbol_references": []
}