{
  "symbol": "A/RES/74/287",
  "filename": "A_RES_74_287.pdf",
  "title": "74/287. Financing of the United Nations Stabilization Mission in Haiti",
  "text": "United Nations \nA/RES/74/287 \n \n \nGeneral Assembly \nDistr.: General \n13 July 2020 \n \n20-08795 (E)    160720     \n*2008795* \n \n \nSeventy-fourth session \nAgenda item 155 \nFinancing of the United Nations Stabilization Mission in Haiti \n \n \n \n \n Resolution adopted by the General Assembly \non 30 June 2020 \n \n \n \n \n[on the report of the Fifth Committee (A/74/915)] \n \n \n 74/287. Financing of the United Nations Stabilization Mission in Haiti \n \n \n \nThe General Assembly, \n \nHaving considered the report of the Secretary-General on the financing of the \nUnited Nations Stabilization Mission in Haiti1 and the related report of the Advisory \nCommittee on Administrative and Budgetary Questions,2  \n \nRecalling Security Council resolution 1529 (2004) of 29 February 2004, by \nwhich the Council declared its readiness to establish a United Nations stabilization \nforce to support continuation of a peaceful and constitutional political process and \nthe maintenance of a secure and stable environment in Haiti, \n \nRecalling also Security Council resolution 1542 (2004) of 30 April 2004, by \nwhich the Council established the United Nations Stabilization Mission in Haiti for \nan initial period of six months, and the subsequent resolutions by which the Council \nextended the mandate of the Mission, the latest of which was resolution 2350 (2017) \nof 13 April 2017, by which the Council extended the mandate of the Mission for a \nfinal period of six months until 15 October 2017, \n \nRecalling further its resolution 58/315 of 1 July 2004, \n \nRecalling its resolution 58/311 of 18 June 2004 on the financing of the Mission \nand its subsequent resolutions thereon, the latest of which was resolution 73/316 of \n3 July 2019, as well as its decision 73/555 of 3 July 2019, \n \nReaffirming the general principles underlying the financing of United Nations \npeacekeeping operations, as stated in its resolutions 1874 (S-IV) of 27 June 1963, \n3101 (XXVIII) of 11 December 1973 and 55/235 of 23 December 2000, \n__________________ \n \n1  A/74/729. \n \n2  A/74/829. \n\nA/RES/74/287 \nFinancing of the United Nations Stabilization Mission in Haiti\n \n20-08795\n2/2 \n \n \n1. \nTakes note of the status of contributions to the United Nations Stabilization \nMission in Haiti as at 30 April 2020, including the contributions outstanding in the \namount of 7.3 million United States dollars, representing some 0.1 per cent of the \ntotal assessed contributions, notes with concern that only 174 Member States have \npaid their assessed contributions in full, and urges all other Member States, in \nparticular those in arrears, to ensure payment of their outstanding assessed \ncontributions; \n \n2. \nExpresses its appreciation to those Member States that have paid their \nassessed contributions in full, and urges all other Member States to make every \npossible effort to ensure payment of their assessed contributions to the Mission in \nfull; \n \n3. \nEndorses the conclusions and recommendations contained in the report of \nthe Advisory Committee on Administrative and Budgetary Questions,2 and requests \nthe Secretary-General to ensure their full implementation; \n \n \n \nFinal disposition of the assets of the United Nations Stabilization Mission \nin Haiti \n \n \n4. \nTakes note of the report of the Secretary-General on the final disposition \nof the assets of the United Nations Stabilization Mission in Haiti; 1 \n \n5. \nEncourages the Secretary-General to continue to draw on lessons learned \nand best practices for future drawdowns and closures; \n \n6. \nDecides to include in the provisional agenda of its seventy-fifth session \nthe item entitled \u201cFinancing of the United Nations Stabilization Mission in Haiti\u201d. \n \n30 June 2020 \n \n \n",
  "paragraphs": {
    "1": "Takes note of the status of contributions to the United Nations Stabilization Mission in Haiti as at 30 April 2020, including the contributions outstanding in the amount of 7.3 million United States dollars, representing some 0.1 per cent of the total assessed contributions, notes with concern that only 174 Member States have paid their assessed contributions in full, and urges all other Member States, in particular those in arrears, to ensure payment of their outstanding assessed contributions;",
    "2": "Expresses its appreciation to those Member States that have paid their assessed contributions in full, and urges all other Member States to make every possible effort to ensure payment of their assessed contributions to the Mission in full;",
    "3": "Endorses the conclusions and recommendations contained in the report of the Advisory Committee on Administrative and Budgetary Questions,2 and requests the Secretary-General to ensure their full implementation; Final disposition of the assets of the United Nations Stabilization Mission in Haiti",
    "4": "Takes note of the report of the Secretary-General on the final disposition of the assets of the United Nations Stabilization Mission in Haiti; 1",
    "5": "Encourages the Secretary-General to continue to draw on lessons learned and best practices for future drawdowns and closures;",
    "6": "Decides to include in the provisional agenda of its seventy-fifth session the item entitled \u201cFinancing of the United Nations Stabilization Mission in Haiti\u201d. 30 June 2020"
  },
  "agenda_items": [
    "Item 155"
  ],
  "symbol_references": []
}