{
  "symbol": "A/RES/73/285",
  "filename": "A_RES_73_285.pdf",
  "title": "73/285. Combating terrorism and other acts of violence based on religion or belief",
  "text": "United Nations \nA/RES/73/285\n \n \nGeneral Assembly \nDistr.: General \n4 April 2019 \n \n19-05485 (E)    080419     \n*1905485* \n \n \nSeventy-third session \nAgenda item 72 \n \n \n \n \n Resolution adopted by the General Assembly \non 2 April 2019 \n \n \n \n \n[without reference to a Main Committee (A/73/L.79 and A/73/L.79/Add.1)] \n \n \n 73/285. Combating terrorism and other acts of violence based on religion \nor belief \n \n \n \nThe General Assembly, \n \nRecalling that all States have pledged themselves, under the Charter of the \nUnited Nations and the Universal Declaration of Human Rights, 1 to promote universal \nrespect for, and observance of, human rights and fundamental freedoms for all, \n \nRecalling also its relevant resolutions, including resolution 73/164 of \n17 December 2018 on combating intolerance, negative stereotyping, stigmatization, \ndiscrimination, incitement to violence and violence against persons, based on religion \nor belief, and resolution 73/176 of 17 December 2018 on freedom of religion or belief, \n \nReaffirming that discrimination against human beings on the grounds of religion \nor belief constitutes an affront to human dignity and a disavowal of the principles of \nthe Charter, \n \nReaffirming also the obligation of States to prohibit discrimination and violence \non the basis of religion or belief and to implement measures to guarantee the equal \nand effective protection of the law, \n \nRecalling that States have the primary responsibility to promote and protect \nhuman rights, including the human rights of persons belonging to religious minorities, \nincluding their right to exercise their religion or belief freely, \n \nExpressing deep concern at the instances of intolerance and discrimination and \nacts of violence occurring in the world, including cases motivated by discrimination \nagainst persons belonging to religious minorities, in addition to the negative \nprojection of the followers of religions and the enforcement of measures that \nspecifically discriminate against persons on the basis of religion or belief, \n__________________ \n \n1  Resolution 217 A (III). \n\nA/RES/73/285 \nCombating terrorism and other acts of violence based on religion or belief\n \n19-05485\n2/2 \n \n \nNoting the Secretary General\u2019s call upon the United Nations Alliance of \nCivilizations \u201cto reach out to governments and faith-based organizations, religious \nleaders and others, and explore actions to prevent attacks against, and guarantee the \nsanctity of, religious sites\u201d, \n \nReiterating that terrorism and violent extremism as and when conducive to \nterrorism, in all its forms and manifestations, cannot and should not be associated \nwith any religion, nationality, civilization or ethnic group, \n \nDeeply alarmed by all terrorist attacks against places of worship that are \nmotivated by religious hatred, including Islamophobia, anti-Semitism and \nChristianophobia, \n \n1. \nCondemns in the strongest terms the heinous, cowardly terrorist attack \naimed at Muslim worshippers in Christchurch, New Zealand, on 15 March 2019, and \nexpresses its deepest condolences to the families of the victims and to the Government \nand the people of New Zealand; \n \n2. \nStrongly condemns continuing violence and acts of terrorism targeting \nindividuals, including persons belonging to religious minorities, on the basis of or in \nthe name of religion or belief; \n \n3. \nUnderlines the need to hold perpetrators, organizers, financiers and \nsponsors of these acts of terrorism accountable and to bring them to justice; \n \n4. \nStrongly deplores all acts of violence against persons on the basis of their \nreligion or belief and such acts directed against their homes, businesses, properties, \nschools, cultural centres and places of worship, as well as all attacks on and in \nreligious places, sites and shrines that are in violation of international law; \n \n5. \nUrges all States to work together to protect individuals against acts of \nviolence, discrimination and hate crimes based on racism, racial discrimination, \nxenophobia and related intolerance; \n \n6. \nUrges States to protect and promote freedom of religion and belief and to \nfoster a domestic environment of religious tolerance, peace and respect by countering \nincitement to religious hatred and violence and by strategizing and harmonizing \nactions at the local, national, regional and international levels through education and \nawareness-building; \n \n7. \nCalls for strengthened international efforts to foster a global dialogue on \nthe promotion of a culture of tolerance and peace at all levels, based on respect for \nhuman rights and for the diversity of religions and beliefs, emphasizing that States, \nregional organizations, national human rights institutions, non-governmental \norganizations, religious bodies, the media and civil society as a whole have an \nimportant role to play in such efforts. \n \n73rd plenary meeting \n2 April 2019 \n \n",
  "paragraphs": {
    "1": "Condemns in the strongest terms the heinous, cowardly terrorist attack aimed at Muslim worshippers in Christchurch, New Zealand, on 15 March 2019, and expresses its deepest condolences to the families of the victims and to the Government and the people of New Zealand;",
    "2": "Strongly condemns continuing violence and acts of terrorism targeting individuals, including persons belonging to religious minorities, on the basis of or in the name of religion or belief;",
    "3": "Underlines the need to hold perpetrators, organizers, financiers and sponsors of these acts of terrorism accountable and to bring them to justice;",
    "4": "Strongly deplores all acts of violence against persons on the basis of their religion or belief and such acts directed against their homes, businesses, properties, schools, cultural centres and places of worship, as well as all attacks on and in religious places, sites and shrines that are in violation of international law;",
    "5": "Urges all States to work together to protect individuals against acts of violence, discrimination and hate crimes based on racism, racial discrimination, xenophobia and related intolerance;",
    "6": "Urges States to protect and promote freedom of religion and belief and to foster a domestic environment of religious tolerance, peace and respect by countering incitement to religious hatred and violence and by strategizing and harmonizing actions at the local, national, regional and international levels through education and awareness-building;",
    "7": "Calls for strengthened international efforts to foster a global dialogue on the promotion of a culture of tolerance and peace at all levels, based on respect for human rights and for the diversity of religions and beliefs, emphasizing that States, regional organizations, national human rights institutions, non-governmental organizations, religious bodies, the media and civil society as a whole have an important role to play in such efforts."
  },
  "agenda_items": [
    "Item 72"
  ],
  "symbol_references": [
    "A/73/L.79"
  ]
}