{
  "symbol": "A/RES/80/122",
  "filename": "A_RES_80_122.pdf",
  "title": "80/122. International financial system and development",
  "text": "United Nations \nA/RES/80/122 \n \nGeneral Assembly \nDistr.: General \n18 December 2025 \n25-20751 (E) \n*2520751* \n \n \nEightieth session \nAgenda item 16 (b) \nMacroeconomic policy questions: international financial \nsystem and development \n \n \n \n \n Resolution adopted by the General Assembly \non 15 December 2025 \n \n \n[on the report of the Second Committee (A/80/555, para. 7)] \n \n \n 80/122. International financial system and development \n \n \n \nThe General Assembly, \n \nRecalling its resolutions 55/186 of 20 December 2000 and 56/181 of \n21 December 2001, entitled \u201cTowards a strengthened and stable international \nfinancial architecture responsive to the priorities of growth and development, \nespecially in developing countries, and to the promotion of economic and social \nequity\u201d, as well as its resolution 79/196 of 19 December 2024 and its previous \nresolutions,  \n \nReaffirming its resolution 70/1 of 25 September 2015, entitled \u201cTransforming \nour world: the 2030 Agenda for Sustainable Development\u201d, in which it adopted a \ncomprehensive, far-reaching and people-centred set of universal and transformative \nSustainable Development Goals and targets, its commitment to working tirelessly for \nthe full implementation of the Agenda by 2030, its recognition that eradicating \npoverty in all its forms and dimensions, including extreme poverty, is the greatest \nglobal challenge and an indispensable requirement for sustainable development, its \ncommitment to achieving sustainable development in its three dimensions \u2013 \neconomic, social and environmental \u2013 in a balanced and integrated manner, and to \nbuilding upon the achievements of the Millennium Development Goals and seeking \nto address their unfinished business,  \n \nWelcoming the convening of the Fourth International Conference on Financing \nfor Development from 30 June to 3 July 2025 in Sevilla, Spain, and reaffirming its \noutcome document, the Sevilla Commitment, endorsed by the General Assembly in \nits resolution 79/323 of 25 August 2025, which sets forth a renewed global framework \nfor financing for development, building on the 2015 Addis Ababa Action Agenda, 1 to \n_______________ \n \n1 General Assembly resolution 69/313, annex. \n\nA/RES/80/122 \nInternational financial system and development\n \n25-20751\n2/13 \n \nclose with urgency the estimated annual 4 trillion United States dollar financing gap, 2 \nand catalyse sustainable development investments at scale in developing countries \nand continue the reform of the international financial architecture through continued \nand strong commitment to multilateralism, international cooperation, and global \nsolidarity, \n \nReaffirming its resolution 69/313 of 27 July 2015 on the Addis Ababa Action \nAgenda of the Third International Conference on Financing for Development, which \nis an integral part of the 2030 Agenda for Sustainable Development, supports and \ncomplements it, helps to contextualize its means of implementation targets with \nconcrete policies and actions, and reaffirms the strong political commitment to \naddress the challenge of financing and creating an enabling environment at all levels \nfor sustainable development in the spirit of global partnership and solidarity, \n \nWelcoming the convening of the Summit of the Future on 22 and 23 September \n2024 at the United Nations Headquarters in New York at which resolution 79/1 \nentitled \u201cThe Pact for the Future\u201d and its annexes were adopted,  \n \nRecalling the adoption of General Assembly resolution 78/322 of 13 August \n2024 on the multidimensional vulnerability index and the call for the full and effective \nimplementation of its mandate, \n \nRecognizing the important role of the Group of 20 in supporting the global \nimplementation of the 2030 Agenda for Sustainable Development, and \nacknowledging the sustained engagement of the Group of 20 through its Action Plan \non the 2030 Agenda for Sustainable Development and subsequent updates, recalling \nthat the Summit of the Group of 20 held in Rio de Janeiro, Brazil, on 19 and \n20 November 2024 called for speedy implementation of the Group of 20 2023 Action \nPlan to Accelerate Progress on the Sustainable Development Goals, and looking \nforward to their implementation, while urging the Group of 20 to continue to engage \nin an inclusive and transparent manner with other States Members of the United \nNations in its work in order to ensure that the initiatives of the Group of 20 \ncomplement or strengthen the United Nations system, \n \nNoting the holding of the twenty-eighth Saint Petersburg International \nEconomic Forum in Saint Petersburg, Russian Federation, from 18 to 21 June 2025,  \n \nExpressing appreciation for the convening of the Biennial Summit for a \nSustainable, Inclusive and Resilient Global Economy, on 24 September 2025, at the \nlevel of Heads of State and Government to strengthen existing systematic links to \npromote coordination between the United Nations and the international financial \ninstitutions, stressing the importance of inclusive participation, and looking forward \nto such coordination, including through a Biennial Summit, as appropriate,  \n \nRecalling the establishment of the Global Crisis Response Group on Food, \nEnergy and Finance, chaired and convened by the Secretary-General, and taking note \nof its briefs on the three-dimensional crisis,  \n \nNoting with concern that the coronavirus disease (COVID\u201119) pandemic, \nalongside ongoing trade and geopolitical tensions, climate change, conflicts and other \nglobal crises and challenges, has exacerbated underlying vulnerabilities in the \ninternational financial system and disproportionately affected women, youth, \ninformal and low-skilled workers, and micro-, small and medium-sized enterprises, \nparticularly in developing countries with limited fiscal and monetary capacity, thereby \nincreasing debt and liquidity constraints which could make it more difficult to access \n_______________ \n \n2 Financing for Sustainable Development Report 2024 (United Nations publication, 2024), \nfigure I.1.  \n\nInternational financial system and development \nA/RES/80/122\n \n3/13\n25-20751 \n \nthe resources needed to recover from external shocks and achieve the Sustainable \nDevelopment Goals, recognizing the efforts undertaken by the international \ncommunity, including the International Monetary Fund, the World Bank, the Group \nof 20, regional financial arrangements and development banks, to provide liquidity \nsupport and debt relief to the poorest countries, acknowledging, however, that gaps \nand vulnerabilities remain and continued reform of the global financial architecture \nis needed to enhance its resilience, coherence and effectiveness in responding to \npresent and future challenges and crises,  \n \nNoting that the scale and duration of current crises underscore the need to further \nensure that the global financial safety net has sufficient depth and coverage and \npromote a more inclusive, sustainable and resilient global economy, and emphasizing \nthe importance of addressing the lessons learned, enhancing crisis preparedness, \ninvesting in resilience and decent work for all, and implementing institutional reforms \nto support debt sustainability, economic stability and the achievement of the \nSustainable Development Goals,  \n \nExpressing concern about the adverse impact of the continuing fragility of the \nglobal economy, the slow pace of the restoration of global growth and trade, \nincreasing protectionism and inward-looking policies, persistent inflation in some \ncountries, high interest rates, declines in capital inflows, with capital outflows in \nmany developing countries, and heightened debt vulnerabilities, with increasing \nsystemic risks that threaten financial stability, including in developing countries,  \n \nWelcoming the growing usage of local currencies in cross-border payments, \nincluding for trade and investment, from the standpoint that it can contribute to \nreducing vulnerabilities,  \n \nExpressing concern at the continued decline in correspondent banking \nrelationships, impacting the ability to send and receive international payments, with \npotential consequences for the cost of remittances, which remain high, affecting those \nin vulnerable situations, such as migrants, financial inclusion and international trade, \namong other areas, and thus for the achievement of the Sustainable Development \nGoals,  \n \nReaffirming the purposes and principles of the United Nations, as set forth in its \nCharter, including, inter alia, to achieve international cooperation in solving \ninternational problems of an economic, social, cultural or humanitarian character, and \nto be a centre for harmonizing the actions of nations in the attainment of common \nends, and reiterating the need to strengthen the leadership role of the United Nations \nin promoting development,  \n \nRecognizing that adequate incentives for international and private investors to \nadopt longer-term investment strategies can support the achievement of sustainable \ndevelopment and potentially reduce capital market volatility,  \n \nEmphasizing that the international financial system should continue to bolster \ninclusive and sustained economic growth, sustainable development and job creation, \npromote financial inclusion and support efforts to eradicate poverty in all its forms \nand dimensions, including extreme poverty, and hunger, in particular in developing \ncountries, while allowing for the coherent mobilization of all sources of financing for \ndevelopment,  \n \nRecognizing that multilateral development banks are a key source of stable, \naffordable, long-term finance for developing countries,  \n \nRecalling that additional measures are needed to ensure that private credit \nratings effectively perform the important function of providing accurate and long \nterm-oriented information to financial markets, \n\nA/RES/80/122 \nInternational financial system and development\n \n25-20751\n4/13 \n \n \nNoting with concern that some countries stated that the fear of a credit rating \ndowngrade discouraged them from accessing the Group of 20 and Paris Club Debt \nService Suspension Initiative, and recalling that Member States may consider the \nfeasibility of establishing public rating agencies, \n \nAcknowledging the 2016 implementation of quota and governance reforms at \nthe International Monetary Fund and the 2018 agreement on shareholding reforms at \nthe World Bank Group, including a general capital increase, a selective capital \nincrease and a financial sustainability framework, the quota increase agreed through \nthe sixteenth general quota review by the Board of Governors of the Fund in \nDecember 2023, the twentieth replenishment of the International Development \nAssociation, with a financing package amounting to 93 billion United States dollars, \nand the conclusion of the Fund\u2019s facilities reviews in 2023 and 2024, \n \nWelcoming steps to improve the voice and representation of developing \ncountries, and the creation of a twenty-fifth chair on the International Monetary Fund \nExecutive Board for sub-Saharan Africa and recent changes to quotas and voting \npower, \n \n1. \nTakes note of the report of the Secretary-General;3 \n \n2. \nEmphasizes the importance of continuing to reform global economic \ngovernance and strengthen the United Nations leadership role in promoting \ndevelopment to arrive at a stronger, more coherent and more inclusive international \neconomic and financial architecture, and that the international financial architecture \nmust continuously adapt to changing global realities, align with sustainable \ndevelopment and respond to the needs, evolving challenges and vulnerabilities facing \nall countries, especially developing countries; \n \n3. \nWelcomes the outcome document of the Fourth International Conference \non Financing for Development, the Sevilla Commitment,4 and calls for its timely and \neffective implementation;  \n \n4. \nRecognizes the need to continue and intensify efforts to enhance the \ncoherence and consistency of the international monetary, financial and trading \nsystems, reiterates the importance of ensuring their openness, fairness and \ninclusiveness in order to complement national efforts to ensure sustainable \ndevelopment, including strong, sustained, balanced, inclusive and equitable economic \ngrowth, and that all people, in particular the poor and vulnerable, have equal rights to \neconomic resources and appropriate financial services, and the achievement of the \ninternationally agreed development goals, including the Sustainable Development \nGoals and the Paris Agreement, 5  and encourages the international financial \ninstitutions to align their programmes and policies with the 2030 Agenda for \nSustainable Development6 in accordance with their mandates; \n \n5. \nAlso recognizes that the twenty-first century requires an international \ndevelopment finance system that is fit for purpose, including for the scale of need and \ndepth of the shocks facing developing countries, in particular the poorest and most \nvulnerable, keeping pace with a changing global landscape characterized by deeply \nintegrated financial markets, multiple crises with cascading effects, systemic risks, \nthe adverse impacts of climate change, shifting trade and financial relations, and rapid \ntechnological change, recognizes in this regard the urgent need for bold and ambitious \nreforms to create a stable, sustainable and inclusive international financial \n_______________ \n \n3 A/80/331. \n \n4 Resolution 79/323, annex. \n \n5 See FCCC/CP/2015/10/Add.1, decision 1/CP.21, annex. \n \n6 Resolution 70/1. \n\nInternational financial system and development \nA/RES/80/122\n \n5/13\n25-20751 \n \narchitecture, and reiterates that the international financial architecture, including its \nbusiness models and financing capacities, must be made more fit for purpose, \nequitable and responsive to the financing needs of developing countries, to broaden \nand strengthen the voice and participation of developing countries in international \neconomic decision-making, norm-setting and global economic governance;  \n \n6. \nNotes that the United Nations, on the basis of its universal membership \nand legitimacy, provides a unique and key forum for discussing international \neconomic issues and their impact on development, and reaffirms that the United \nNations is well positioned to participate in various reform processes aimed at \nimproving and strengthening the effective functioning of the international financial \nsystem and architecture, while recognizing that the United Nations and the \ninternational financial institutions have complementary mandates that make the \ncoordination of their actions crucial;  \n \n7. \nReiterates the Sevilla Commitment to support developing countries and \nreach people and communities more quickly to reduce the cost of action and accelerate \nrecovery in response to shocks and disasters;  \n \n8. \nAcknowledges that growing risks from more frequent and interconnected \nshocks require new and innovative timely financing instruments to boost the \navailability of resources for all countries in need;  \n \n9. \nCalls upon the international community to support developing countries in \nensuring predictable, adequate and uninterrupted funding on appropriate terms of \nsocial protection and other essential social spending during shocks and crises;  \n \n10. Emphasizes the need to take concrete measures to reduce the cost of capital \nand external borrowing costs for developing countries, including by promoting \nsustainable debt management and preserving financial stability;  \n \n11. Calls for the global financial safety net to be strengthened, have better \ncoverage and be more reliable;  \n \n12. Recognizes the role of special drawing rights as an international reserve \nasset, acknowledges that special drawing rights allocations helped to supplement \ninternational reserves ins response to the world financial and economic crisis, as well \nas to the COVID\u201119 pandemic, thus contributing to the stability of the international \nfinancial system and global economic resilience, and supports the continued \nexamination of the broader use of special drawing rights as a way to enhance the \nresilience of the international monetary system, including with reference to their \npotential role in the international reserve system;  \n \n13. Encourages the International Monetary Fund to continue to seek to meet \nthe long-term global need, as and when it arises, to supplement existing reserve assets \nthrough allocations of special drawing rights and to review the role of special drawing \nrights and their place in the international monetary system;  \n \n14. Recognizes the role of special drawing rights in strengthening the global \nfinancial safety net, welcomes the special drawing rights allocation of the equivalent \nof 650 billion United States dollars of 23 August 2021, also welcomes the \nrechannelling of special drawing rights through International Monetary Fund facilities \nthat have already been disbursed, calls for promptly delivering on the already made \nspecial drawing rights rechannelling pledges, encourages additional countries to join \nthe voluntary special drawing rights rechannelling effort, and calls upon countries in \na position to do so to voluntarily rechannel at least half of their special drawing rights \nto developing countries, including through multilateral development banks, while \nrespecting relevant legal frameworks and preserving the liquidity and reserve asset \ncharacter of special drawing rights;  \n\nA/RES/80/122 \nInternational financial system and development\n \n25-20751\n6/13 \n \n \n15. Encourages the International Monetary Fund to explore all options to \ncontinue to strengthen the global financial safety net to support developing countries \nto better respond to macroeconomic shocks; \n \n16. Invites the International Monetary Fund Executive Board to consider \ndesigning a special drawing rights playbook that provides operational guidance and \nstrengthens the role of special drawing rights during crises and shocks, in line with \nthe Articles of Agreement of the International Monetary Fund;  \n \n17. Takes note with appreciation of the operationalization of the Resilience \nand Sustainability Trust of the International Monetary Fund to help eligible countries \naddress longer-term structural challenges that pose macroeconomic risks, looks \nforward to the upcoming comprehensive review of the Trust to ensure its \neffectiveness, encourages the International Monetary Fund Executive Board to further \nenhance effectiveness of and ease access to the Trust in that review, and notes that \ndebt sustainability and liquidity can play an important role in achieving a sustainable, \ninclusive and resilient recovery and the Sustainable Development Goals;  \n \n18. Welcomes the recent Poverty Reduction and Growth Trust review, calls for \nits quick implementation, and encourages the International Monetary Fund Executive \nBoard to consider working to further increase the Trust\u2019s self-sustaining capacity to \nlend concessional resources;  \n \n19. Reaffirms the political commitment to implement fully and in a timely \nmanner the commitments contained in resolution 79/1 to establish measures of \nprogress on sustainable development that complement or go beyond gross domestic \nproduct to have a more inclusive approach to international cooperation and inform \naccess to development finance, welcomes the establishment of an independent high-\nlevel expert group to develop recommendations for a limited number of country-\nowned and universally applicable indicators of sustainable development that \ncomplement and go beyond gross domestic product, and looks forward to a \nsubsequent United Nations-led intergovernmental process;  \n \n20. Stresses that multilateral development banks are a key component of the \nreform of the international financial system, also stresses the need to strengthen \nmultilateral development banks, and encourages multilateral development banks to \nfurther increase and optimize their annual lending and long-term concessional finance \ncapacity, including lending and borrowing in local currencies, as well as the design, \nfinancing and scaling up of country-owned and -driven innovative mechanisms, with \na view to potentially tripling it while ensuring their financial sustainability and \nsafeguarding robust credit ratings, taking note of the recommendations under the \nCapital Adequacy Framework review;  \n \n21. Encourages multilateral development banks to continue to develop further \ninnovative measures, including hybrid capital, including from private investors, \nguarantee platforms, and studying ways to expand the use of originate-to-distribute \nmodels with adequate risk management, which would free up capital for additional \nlending, also encourages countries in a position to do so to contribute to the special \ndrawing rights-based hybrid-capital channelling solutions by the African \nDevelopment Bank and the Inter-American Development Bank, while respecting \nrelevant legal frameworks and preserving the reserve asset character of special \ndrawing rights, and supports exploring other voluntary special drawing rights \nrechannelling initiatives through multilateral development banks;  \n \n22. Recognizes that the Board of each multilateral development bank is best \nplaced to make this decision, encourages multilateral development banks to consider \nscheduling future capital increases, if needed, and also encourages multilateral \n\nInternational financial system and development \nA/RES/80/122\n \n7/13\n25-20751 \n \ndevelopment banks to work on improving the quality of projects and increasing their \noperational effectiveness and efficiency;  \n \n23. Commends recent replenishments to concessional windows of multilateral \ndevelopment banks, especially the International Development Association twenty-\nfirst replenishment package, which includes commitments from both new and existing \ndonors, commits to establishing sustainable pathways to further replenish \nconcessional windows at the multilateral development banks, and looks forward to a \nrobust and successful replenishment of the African Development Fund;  \n \n24. Calls upon boards of directors of the multilateral development banks to \nreview as well as further enhance and optimize lending terms, including consideration \nof longer loan tenors, extended grace periods, lower lending spreads and other fees, \nwhile ensuring the financial sustainability of multilateral development banks and \nsafeguarding the financial capacity of their concessional windows;  \n \n25. Urges governing bodies of the multilateral development banks to explore \nscaling up local currency lending, to help to better meet local development needs and \nreduce recipient countries\u2019 exposure to exchange rate risks, encourages the \ndevelopment of tools at the multilateral development banks to facilitate local currency \nlending and support efforts to strengthen their capacity to issue local currency bonds, \nwhich can also contribute to the development of local capital markets, and takes note \nof ongoing discussions among multilateral development banks and public \ndevelopment banks on platforms to improve liquidity management and risk \ndiversification in local currency lending;  \n \n26. Encourages multilateral development banks to strengthen and align impact \nmeasurement frameworks with the Sustainable Development Goals and work towards \nharmonized approaches, measuring both positive and negative impacts, and ensuring \nadherence to social and environmental safeguards in all operations;  \n \n27. Supports enhancing the ability of multilateral development banks and \nother public development banks to work better as a system, aligned with country-led \ndevelopment priorities and strategies, encourages synergies based on comparative \nadvantages, including through enhanced operational cooperation, joint programming \nand co-financing arrangements, capacity-building and peer learning, takes note of \nongoing discussions on the establishment of a framework to incentivize and monitor \nthe quality of cooperation between multilateral development banks and other public \ndevelopment banks, acknowledging existing initiatives such as the Finance in \nCommon network, and encourages multilateral development banks to consider mutual \nreliance frameworks to minimize overlap and duplication of efforts, acknowledging \nexisting frameworks;  \n \n28. Welcomes, in this regard, the ongoing work of international financial \ninstitutions, including the more recently established New Development Bank and the \nAsian Infrastructure Investment Bank, in the global development finance architecture, \nand encourages enhanced regional and subregional cooperation, including through \nregional and subregional development banks, commercial and reserve currency \narrangements and other regional and subregional initiatives;  \n \n29. Invites international financial institutions, multilateral development banks \nand international organizations to consider the use of the multidimensional \nvulnerability index, as a complement to their existing practices and policies, to inform \ntheir development cooperation policies and practices;  \n \n30. Encourages the multilateral development banks, within their respective \nmandates and in a coordinated way, to continue to expand technical assistance, \ndisseminate and share their knowledge and best practices, as well as foster a deeper \n\nA/RES/80/122 \nInternational financial system and development\n \n25-20751\n8/13 \n \nunderstanding of financial capacity and capital needs, in order to enhance the \nmultiplier effect of their financing by leveraging more resources and diversifying their \nsources, including by mobilizing long-term and sustainable private investment, from \ndomestic and international actors, to provide innovative and integral solutions to \nmultidimensional development problems, in particular in developing and emerging \neconomies;  \n \n31. Welcomes ongoing reform efforts of the multilateral development banks to \nmobilize greater financing for the 2030 Agenda, recognizing that further reforms of \nthe banks are urgently needed to accelerate investment in poverty eradication;  \n \n32. Urges multilateral development banks to accelerate the pace of reforms to \ntheir missions and visions, incentive structures, operational approaches and financial \ncapacity, and to consider additional steps to increase the availability of finance, \nprovide policy support and technical assistance to developing countries to address \nglobal challenges and to achieve the Sustainable Development Goals;  \n \n33. Stresses the critical importance of a stable, inclusive and enabling global \neconomic environment for the advancement of sustainable development, for the \nreliable and effective financing of development and for the implementation of the \n2030 Agenda, mobilizing public and private, as well as domestic and international \nresources;  \n \n34. Invites, in this regard, the President of the General Assembly and the \nSecretary-General to give appropriate consideration to the central role of maintaining \nand facilitating the financial and macroeconomic stability of developing countries, \nincluding debt sustainability, and of supporting an appropriately enabling domestic \nand international economic, financial and regulatory environment for the means of \nimplementation of the 2030 Agenda, including financial inclusion, and in this regard \ninvites all major institutional stakeholders, including the International Monetary \nFund, the World Bank and the United Nations Conference on Trade and Development, \nto support these efforts, in accordance with their respective mandates;  \n \n35. Resolves to strengthen the coherence and consistency of multilateral \nfinancial, investment, trade and development policy and environment institutions and \nplatforms and to increase cooperation between major international institutions, while \nrespecting mandates and governance structures, and commits itself to taking better \nadvantage of relevant United Nations forums for promoting universal and holistic \ncoherence and international commitments to sustainable development, building on the \nvision of the Addis Ababa Action Agenda, with a view to supporting the \nimplementation of the Sevilla Commitment and the 2030 Agenda; \n \n36. Recalls that countries must have, in accordance with their specific needs \nand circumstances, the flexibility necessary to implement countercyclical measures \nand pursue tailored and targeted responses to the various types of shocks, including \neconomic and financial crises, and calls for the International Monetary Fund to build \non recent progress to further prioritize reforms and streamline conditions to ensure \nthat they are timely, tailored and targeted, in accordance with national circumstances \nand priorities, and that they support developing countries in the face of financial, \neconomic and development challenges;  \n \n37. Notes, in this regard, the strategy of the International Monetary Fund for \nengagement on social spending, 7 welcomes the Fund\u2019s recognition of the adverse \nimpacts that fiscal adjustment could have on the vulnerable, for whom social spending \nis critical to achieving the commitments under the 2030 Agenda, including nationally \n_______________ \n \n7 International Monetary Fund, \u201cA Strategy for IMF engagement on social spending\u201d, Policy Paper \nNo. 16 (June 2019). \n\nInternational financial system and development \nA/RES/80/122\n \n9/13\n25-20751 \n \nappropriate social protection systems and measures for all, including floors, \nencourages greater collaboration on social protection finance among all international \ndevelopment institutions, and also encourages further efforts to strengthen the \nconsideration of social protection and social spending in International Monetary \nFund-supported macroeconomic adjustment programmes;  \n \n38. Recognizes the need for the international financial institutions, as \nappropriate, to promote gender mainstreaming in their policies and programmes, \nincluding macroeconomic, fiscal, job creation and structural reform policies and \nprogrammes, in accordance with relevant national priorities and strategies;  \n \n39. Urges multilateral donors and invites the international financial \ninstitutions and regional development banks, within their respective mandates, to \nreview and implement policies that support national efforts to ensure that a higher \nproportion of resources reach women and girls, in particular in rural and remote areas, \nand invites multilateral and regional development banks to agree on common \nindicators for analysing the gender impact of their lending;  \n \n40. Recognizes that it is important that all international financial institutions \nand multilateral development banks continue to be adequately resourced, and \nreiterates the importance of further governance reform in order to adapt to changes in \nthe global economy;  \n \n41. Underscores, while recognizing and building on recent efforts, the need to \nbroaden and enhance the voice and representation of developing countries in norm-\nsetting, global economic governance, and decision-making in international economic \nand financial institutions to deliver more effective, equitable, inclusive, credible, \naccountable and legitimate institutions;  \n \n42. Recalls paragraph 53 (c) of the Sevilla Commitment, recognizes the \nimportance of continuing to pursue governance reforms at the World Bank, and notes \nthe technical preparations for the World Bank 2025 shareholding review;  \n \n43. Also recalls the commitment to ensuring the primary role of quotas in \nInternational Monetary Fund resources, and that any adjustment in quota shares would \nbe expected to result in increases in the quota shares of dynamic economies in line \nwith their relative positions in the world economy and hence likely in the share of \nemerging market and developing countries as a whole, while protecting the voice and \nrepresentation of the poorest members, and recommits itself to the broadening and \nstrengthening of the voice and participation of developing countries, including \nAfrican countries, the least developed countries, landlocked developing countries, \nsmall island developing States, middle-income countries and countries in conflict and \npost-conflict situations, in international economic decision-making, norm-setting and \nglobal economic governance;  \n \n44. Reaffirms the commitment to a strong, quota-based and adequately \nresourced International Monetary Fund at the centre of the global financial safety net, \nand encourages Member States to work together to strengthen and improve a system \nin which different layers of the global financial safety net are closely coordinated and \nhave clear assignments of responsibilities, and consider enhancing, and creation of, \nregional financial arrangements where possible, and to help countries to weather \nshocks, and strengthen their capacities to detect risks;  \n \n45. Also reaffirms support for the operationalization of the African Financing \nStability Mechanism, aimed at promoting financial stability and preventing debt \ncrises in Africa by providing concessional lending and liquidity support, and invites \ndevelopment finance institutions and international financial institutions to also \nsupport this initiative;  \n\nA/RES/80/122 \nInternational financial system and development\n \n25-20751\n10/13 \n \n \n46. Welcomes the recent review of the International Monetary Fund surcharge \npolicy, and encourages the Executive Board of the Fund to consider the appropriate \ncharges policy in accordance with the Fund\u2019s credit risk management framework, and \nalso consider in the future adopting a policy for adjusting surcharges in response to \ndisasters and exogenous shocks, while preserving the revolving nature and \nsustainability of Fund resources;  \n \n47. Encourages the consideration of adjusting borrowing limits in all layers of \nthe safety net, where appropriate, to ensure that emergency resources can meet needs, \nwhile taking into account institutions\u2019 financial sustainability; \n \n48. Acknowledges the importance of the international financial institutions \nsupporting, in line with their mandates, the policy space of each country, while \nremaining consistent with relevant international rules and commitments, in particular \ndeveloping countries; \n \n49. Reaffirms that cohesive, nationally owned sustainable development \nstrategies, supported by integrated national financing frameworks, will be at the heart \nof efforts, reiterates that each country has primary responsibility for its own economic \nand social development and that the role of national policies and development \nstrategies cannot be overemphasized, expresses respect for each country\u2019s policy \nspace and leadership to implement policies for the eradication of poverty in all its \nforms and dimensions and for sustainable development, while remaining consistent \nwith relevant international rules and commitments, at the same time recognizes that \nnational development efforts need to be supported by an enabling international \neconomic environment, including coherent and mutually supporting world trade, \nmonetary and financial systems and strengthened and enhanced global economic \ngovernance, and that processes to develop and facilitate the availability of appropriate \nknowledge and technologies globally, as well as capacity-building, are also critical, \nand commits to pursuing policy coherence and an enabling environment for \nsustainable development at all levels and by all actors, and to reinvigorating the \nGlobal Partnership for Sustainable Development;  \n \n50. Notes that rapid developments in digital financial technology, further \naccelerated by the COVID\u201119 pandemic, have transformed the provision of financial \nservices and created a new ecosystem of digital assets, recognizes the relevance of \ncarefully monitoring domestic and global developments, reviewing and updating \nregulatory frameworks when necessary and cooperating across sectors and borders to \nsupport enabling environments that take due account of opportunities and risks to \nensure a more balanced view of digital financial innovations, while still fostering \ncompetition and innovations in the financial system, and requests the United Nations \nsystem to continue to support developing countries through knowledge-sharing, \ntechnology transfer on mutually agreed terms and capacity-building in order to better \naddress the opportunities, challenges and implications of emerging digital financial \ntechnologies, including digital inequality;  \n \n51. Also notes the development of central bank digital currencies, and \nencourages regulators to consider potential opportunities and risks for the \ninternational and domestic financial system;  \n \n52. Further notes the recommendations by the Financial Stability Board on \ninternational regulation and supervision of cryptoasset activities, of 17 July 2023, \nunderlining that stablecoins should be covered by robust regulations and supervision \nby relevant authorities if they are to be adopted as a widely used means of payment \nor otherwise play an important role in the financial system, in line with their national \nregulations and policies;  \n\nInternational financial system and development \nA/RES/80/122\n \n11/13\n25-20751 \n \n \n53. Encourages the Bank for International Settlements, the International \nMonetary Fund and other relevant institutions to provide capacity-building to support \ndeveloping countries to make robust design and implementation decisions about \nupgrading payments infrastructure, potentially including adoption of central bank \ndigital currencies and other platforms or technologies for interoperable settlement \nsystems, while managing potential risks from digital assets;  \n \n54. Expresses appreciation for the work of the Financial Stability Board and \nother relevant international organizations and standard-setting bodies to maintain the \nfinancial stability-focused, robust, effective, risk-based approach of international \nbanking and financial standards, commits itself to sustaining or strengthening \nframeworks for macroprudential regulation and countercyclical buffers, reaffirms the \ncommitment to hastening the completion of the reform agenda on financial market \nregulation, including assessing and if necessary reducing the systemic risks associated \nwith non\u2011bank financial intermediation, markets for derivatives, securities lending \nand repurchase agreements, and also reaffirms the commitment to addressing the risk \ncreated by \u201ctoo-big-to-fail\u201d financial institutions and to addressing cross-border \nelements in the effective resolution of troubled, systemically important financial \ninstitutions; \n \n55. Invites relevant international organizations and standard-setting bodies to \nprepare a report on risk weightings, assessing how they take into account the risk \nreductions from innovative finance mechanisms such as guarantees and blended \nfinance, and also invites those organizations to present findings, including policy \nimplications if appropriate, at the Economic and Social Council forum on financing \nfor development follow-up; \n \n56. Invites further research and analysis on the potential impact of risk \nweightings on finance, such as for micro-, small and medium-sized enterprises, \ninfrastructure and trade finance; \n \n57. Notes that there are growing risks outside the regulatory framework, \nincluding through non\u2011bank financial institutions and financial technology, calls upon \nfinancial regulators to increasingly shift towards examining the underlying risks \nassociated with financial activity rather than the type of financial institution, and \nencourages the Financial Stability Board to present policy proposals and \nrecommendations to enhance the resilience of non\u2011bank financial intermediation, \nincluding the asset management industry, at the forum on financing for development \nfollow-up;  \n \n58. Calls upon financial regulators to encourage financial institutions to \nexplore new opportunities to improve their ability to better manage risks, including \nthrough anti\u2011money-laundering and countering the financing of terrorism measures, \nas well as through the greater use of technology to help to address the costs and risks \nof operating correspondent banking relationships; \n \n59. Emphasizes the relevance of inclusion in the international financial system \nat all levels and the importance of considering financial inclusion as a policy objective \nin financial regulation, in accordance with national priorities and legislation;  \n \n60. Reiterates that effective, inclusive multilateral surveillance should be at \nthe centre of crisis prevention efforts, stresses the need to continue to strengthen \nsurveillance of the financial policies of countries, in this regard notes the current \nefforts to update the surveillance approach of the International Monetary Fund in line \nwith its mandate to better integrate bilateral and multilateral surveillance, along with \ncross-border and cross-sectoral linkages with macroeconomic and macroprudential \npolicies, while paying closer attention to the spillover effects from national economic \nand financial policies on to the global economy, and encourages continued \n\nA/RES/80/122 \nInternational financial system and development\n \n25-20751\n12/13 \n \nstrengthening of global macroeconomic coordination and policy coherence while \nrespecting domestic legal frameworks and policy mandates to enhance global \nfinancial and macroeconomic stability and reduce negative spillover effects;  \n \n61. Notes the potential for source countries of capital flows to use appropriate \ncombinations of macroeconomic, macroprudential and regulatory policies that avoid \nexcessive leverage and large international spillovers in the form of capital flow \nvolatility, while still meeting domestic macroeconomic objectives, encourages source \ncountries to consider such policies, while clearly communicating monetary policy \ndecisions, and calls for greater macroeconomic coordination among systemically \nimportant economies, which can also help to address global financial market \nvolatility;  \n \n62. Invites the international financial and banking institutions, in consultation \nwith national Governments, to develop tailored guidelines on how countries can \nattract long-term international investments, guided by the 2030 Agenda, in line with \nnational plans and policies, and with a view to minimizing the adverse effects of \ncapital market volatility;  \n \n63. Welcomes the establishment of the Africa Credit Rating Agency, and looks \nforward to its full operationalization;  \n \n64. Invites the international financial and banking institutions to continue to \nenhance the transparency and analytical rigour of risk-rating mechanisms, noting that \nsovereign risk assessments should maximize the use of objective and transparent \nparameters, which can be facilitated by high-quality data and analysis, and encourages \nrelevant institutions, including the United Nations Conference on Trade and \nDevelopment, to continue their work on the issue, including the potential impact of \nthe role, both positive and negative, played by private credit-rating agencies on the \ndevelopment prospects of developing countries, in accordance with their mandates;  \n \n65. Encourages countries to consider national regulatory frameworks related \nto credit ratings, where appropriate, to reduce overreliance on credit ratings, increase \ntransparency regarding the issuing of sovereign debt ratings, improve the quality of \nthe rating process and make credit rating agencies more accountable for their actions, \nand reduce conflicts of interest and encourage a greater number of actors to operate \nin the credit rating market;  \n \n66. Looks forward to the 2026 special high-level meeting on credit ratings \nunder the auspices of the Economic and Social Council for dialogue among Member \nStates, credit rating agencies, regulators, standard setters, long-term investors and \npublic institutions that publish independent debt sustainability analysis, and recalls \nthat the meeting will include updates on the Secretary-General\u2019s efforts to engage \nwith credit rating agencies, discussion on the use of credit assessments, exchanges on \ngood practices for regulation of credit rating agencies, and sharing of perspectives on \ncredit assessment methodologies;  \n \n67. Recommits itself to enabling women\u2019s full, equal and meaningful \nparticipation and equal opportunities in the economy and their equal access to \ndecision-making processes and leadership;  \n \n68. Encourages all development banks to establish or maintain social and \nenvironmental safeguard systems, including on sustainable infrastructure, human \nrights, gender equality and women\u2019s empowerment, that are transparent, effective, \nefficient and time-sensitive, and engage affected communities in project design and \nimplementation;  \n \n69. Reiterates that States are strongly urged to refrain from promulgating and \napplying any unilateral economic, financial or trade measures not in accordance with \n\nInternational financial system and development \nA/RES/80/122\n \n13/13\n25-20751 \n \ninternational law and the Charter of the United Nations that impede the full \nachievement of economic and social development, particularly in developing \ncountries;  \n \n70. Requests, in this regard, the Secretary-General to submit to the General \nAssembly at its eighty-first session an action-oriented report on the implementation \nof the present resolution, with a particular focus on reform of the international \nfinancial system;  \n \n71. Decides to include in the provisional agenda of its eighty-first session, \nunder the item entitled \u201cMacroeconomic policy questions\u201d, the sub-item entitled \n\u201cInternational financial system and development\u201d. \n \n64th plenary meeting \n15 December 2025 \n \n",
  "paragraphs": {
    "1": "Takes note of the report of the Secretary-General;3",
    "2": "Emphasizes the importance of continuing to reform global economic governance and strengthen the United Nations leadership role in promoting development to arrive at a stronger, more coherent and more inclusive international economic and financial architecture, and that the international financial architecture must continuously adapt to changing global realities, align with sustainable development and respond to the needs, evolving challenges and vulnerabilities facing all countries, especially developing countries;",
    "3": "Welcomes the outcome document of the Fourth International Conference on Financing for Development, the Sevilla Commitment,4 and calls for its timely and effective implementation;",
    "4": "Recognizes the need to continue and intensify efforts to enhance the coherence and consistency of the international monetary, financial and trading systems, reiterates the importance of ensuring their openness, fairness and inclusiveness in order to complement national efforts to ensure sustainable development, including strong, sustained, balanced, inclusive and equitable economic growth, and that all people, in particular the poor and vulnerable, have equal rights to economic resources and appropriate financial services, and the achievement of the internationally agreed development goals, including the Sustainable Development Goals and the Paris Agreement, 5 and encourages the international financial institutions to align their programmes and policies with the 2030 Agenda for Sustainable Development6 in accordance with their mandates;",
    "5": "Also recognizes that the twenty-first century requires an international development finance system that is fit for purpose, including for the scale of need and depth of the shocks facing developing countries, in particular the poorest and most vulnerable, keeping pace with a changing global landscape characterized by deeply integrated financial markets, multiple crises with cascading effects, systemic risks, the adverse impacts of climate change, shifting trade and financial relations, and rapid technological change, recognizes in this regard the urgent need for bold and ambitious reforms to create a stable, sustainable and inclusive international financial architecture, and reiterates that the international financial architecture, including its business models and financing capacities, must be made more fit for purpose, equitable and responsive to the financing needs of developing countries, to broaden and strengthen the voice and participation of developing countries in international economic decision-making, norm-setting and global economic governance;",
    "6": "Notes that the United Nations, on the basis of its universal membership and legitimacy, provides a unique and key forum for discussing international economic issues and their impact on development, and reaffirms that the United Nations is well positioned to participate in various reform processes aimed at improving and strengthening the effective functioning of the international financial system and architecture, while recognizing that the United Nations and the international financial institutions have complementary mandates that make the coordination of their actions crucial;",
    "7": "Reiterates the Sevilla Commitment to support developing countries and reach people and communities more quickly to reduce the cost of action and accelerate recovery in response to shocks and disasters;",
    "8": "Acknowledges that growing risks from more frequent and interconnected shocks require new and innovative timely financing instruments to boost the availability of resources for all countries in need;",
    "9": "Calls upon the international community to support developing countries in ensuring predictable, adequate and uninterrupted funding on appropriate terms of social protection and other essential social spending during shocks and crises;",
    "10": "Emphasizes the need to take concrete measures to reduce the cost of capital and external borrowing costs for developing countries, including by promoting sustainable debt management and preserving financial stability;",
    "11": "Calls for the global financial safety net to be strengthened, have better coverage and be more reliable;",
    "12": "Recognizes the role of special drawing rights as an international reserve asset, acknowledges that special drawing rights allocations helped to supplement international reserves ins response to the world financial and economic crisis, as well as to the COVID\u201119 pandemic, thus contributing to the stability of the international financial system and global economic resilience, and supports the continued examination of the broader use of special drawing rights as a way to enhance the resilience of the international monetary system, including with reference to their potential role in the international reserve system;",
    "13": "Encourages the International Monetary Fund to continue to seek to meet the long-term global need, as and when it arises, to supplement existing reserve assets through allocations of special drawing rights and to review the role of special drawing rights and their place in the international monetary system;",
    "14": "",
    "15": "Encourages the International Monetary Fund to explore all options to continue to strengthen the global financial safety net to support developing countries to better respond to macroeconomic shocks;",
    "16": "Invites the International Monetary Fund Executive Board to consider designing a special drawing rights playbook that provides operational guidance and strengthens the role of special drawing rights during crises and shocks, in line with the Articles of Agreement of the International Monetary Fund;",
    "17": "Takes note with appreciation of the operationalization of the Resilience and Sustainability Trust of the International Monetary Fund to help eligible countries address longer-term structural challenges that pose macroeconomic risks, looks forward to the upcoming comprehensive review of the Trust to ensure its effectiveness, encourages the International Monetary Fund Executive Board to further enhance effectiveness of and ease access to the Trust in that review, and notes that debt sustainability and liquidity can play an important role in achieving a sustainable, inclusive and resilient recovery and the Sustainable Development Goals;",
    "18": "Welcomes the recent Poverty Reduction and Growth Trust review, calls for its quick implementation, and encourages the International Monetary Fund Executive Board to consider working to further increase the Trust\u2019s self-sustaining capacity to lend concessional resources;",
    "19": "Reaffirms the political commitment to implement fully and in a timely manner the commitments contained in resolution 79/1 to establish measures of progress on sustainable development that complement or go beyond gross domestic product to have a more inclusive approach to international cooperation and inform access to development finance, welcomes the establishment of an independent high- level expert group to develop recommendations for a limited number of country- owned and universally applicable indicators of sustainable development that complement and go beyond gross domestic product, and looks forward to a subsequent United Nations-led intergovernmental process;",
    "20": "Stresses that multilateral development banks are a key component of the reform of the international financial system, also stresses the need to strengthen multilateral development banks, and encourages multilateral development banks to further increase and optimize their annual lending and long-term concessional finance capacity, including lending and borrowing in local currencies, as well as the design, financing and scaling up of country-owned and -driven innovative mechanisms, with a view to potentially tripling it while ensuring their financial sustainability and safeguarding robust credit ratings, taking note of the recommendations under the Capital Adequacy Framework review;",
    "21": "Encourages multilateral development banks to continue to develop further innovative measures, including hybrid capital, including from private investors, guarantee platforms, and studying ways to expand the use of originate-to-distribute models with adequate risk management, which would free up capital for additional lending, also encourages countries in a position to do so to contribute to the special drawing rights-based hybrid-capital channelling solutions by the African Development Bank and the Inter-American Development Bank, while respecting relevant legal frameworks and preserving the reserve asset character of special drawing rights, and supports exploring other voluntary special drawing rights rechannelling initiatives through multilateral development banks;",
    "22": " development banks to work on improving the quality of projects and increasing their operational effectiveness and efficiency;",
    "23": "Commends recent replenishments to concessional windows of multilateral development banks, especially the International Development Association twenty- first replenishment package, which includes commitments from both new and existing donors, commits to establishing sustainable pathways to further replenish concessional windows at the multilateral development banks, and looks forward to a robust and successful replenishment of the African Development Fund;",
    "24": "Calls upon boards of directors of the multilateral development banks to review as well as further enhance and optimize lending terms, including consideration of longer loan tenors, extended grace periods, lower lending spreads and other fees, while ensuring the financial sustainability of multilateral development banks and safeguarding the financial capacity of their concessional windows;",
    "25": "Urges governing bodies of the multilateral development banks to explore scaling up local currency lending, to help to better meet local development needs and reduce recipient countries\u2019 exposure to exchange rate risks, encourages the development of tools at the multilateral development banks to facilitate local currency lending and support efforts to strengthen their capacity to issue local currency bonds, which can also contribute to the development of local capital markets, and takes note of ongoing discussions among multilateral development banks and public development banks on platforms to improve liquidity management and risk diversification in local currency lending;",
    "26": "Encourages multilateral development banks to strengthen and align impact measurement frameworks with the Sustainable Development Goals and work towards harmonized approaches, measuring both positive and negative impacts, and ensuring adherence to social and environmental safeguards in all operations;",
    "27": "Supports enhancing the ability of multilateral development banks and other public development banks to work better as a system, aligned with country-led development priorities and strategies, encourages synergies based on comparative advantages, including through enhanced operational cooperation, joint programming and co-financing arrangements, capacity-building and peer learning, takes note of ongoing discussions on the establishment of a framework to incentivize and monitor the quality of cooperation between multilateral development banks and other public development banks, acknowledging existing initiatives such as the Finance in Common network, and encourages multilateral development banks to consider mutual reliance frameworks to minimize overlap and duplication of efforts, acknowledging existing frameworks;",
    "28": "Welcomes, in this regard, the ongoing work of international financial institutions, including the more recently established New Development Bank and the Asian Infrastructure Investment Bank, in the global development finance architecture, and encourages enhanced regional and subregional cooperation, including through regional and subregional development banks, commercial and reserve currency arrangements and other regional and subregional initiatives;",
    "29": "Invites international financial institutions, multilateral development banks and international organizations to consider the use of the multidimensional vulnerability index, as a complement to their existing practices and policies, to inform their development cooperation policies and practices;",
    "30": " understanding of financial capacity and capital needs, in order to enhance the multiplier effect of their financing by leveraging more resources and diversifying their sources, including by mobilizing long-term and sustainable private investment, from domestic and international actors, to provide innovative and integral solutions to multidimensional development problems, in particular in developing and emerging economies;",
    "31": "Welcomes ongoing reform efforts of the multilateral development banks to mobilize greater financing for the 2030 Agenda, recognizing that further reforms of the banks are urgently needed to accelerate investment in poverty eradication;",
    "32": "Urges multilateral development banks to accelerate the pace of reforms to their missions and visions, incentive structures, operational approaches and financial capacity, and to consider additional steps to increase the availability of finance, provide policy support and technical assistance to developing countries to address global challenges and to achieve the Sustainable Development Goals;",
    "33": "Stresses the critical importance of a stable, inclusive and enabling global economic environment for the advancement of sustainable development, for the reliable and effective financing of development and for the implementation of the 2030 Agenda, mobilizing public and private, as well as domestic and international resources;",
    "34": "Invites, in this regard, the President of the General Assembly and the Secretary-General to give appropriate consideration to the central role of maintaining and facilitating the financial and macroeconomic stability of developing countries, including debt sustainability, and of supporting an appropriately enabling domestic and international economic, financial and regulatory environment for the means of implementation of the 2030 Agenda, including financial inclusion, and in this regard invites all major institutional stakeholders, including the International Monetary Fund, the World Bank and the United Nations Conference on Trade and Development, to support these efforts, in accordance with their respective mandates;",
    "35": "Resolves to strengthen the coherence and consistency of multilateral financial, investment, trade and development policy and environment institutions and platforms and to increase cooperation between major international institutions, while respecting mandates and governance structures, and commits itself to taking better advantage of relevant United Nations forums for promoting universal and holistic coherence and international commitments to sustainable development, building on the vision of the Addis Ababa Action Agenda, with a view to supporting the implementation of the Sevilla Commitment and the 2030 Agenda;",
    "36": "Recalls that countries must have, in accordance with their specific needs and circumstances, the flexibility necessary to implement countercyclical measures and pursue tailored and targeted responses to the various types of shocks, including economic and financial crises, and calls for the International Monetary Fund to build on recent progress to further prioritize reforms and streamline conditions to ensure that they are timely, tailored and targeted, in accordance with national circumstances and priorities, and that they support developing countries in the face of financial, economic and development challenges;",
    "37": "Notes, in this regard, the strategy of the International Monetary Fund for engagement on social spending, 7 welcomes the Fund\u2019s recognition of the adverse impacts that fiscal adjustment could have on the vulnerable, for whom social spending is critical to achieving the commitments under the 2030 Agenda, including nationally appropriate social protection systems and measures for all, including floors, encourages greater collaboration on social protection finance among all international development institutions, and also encourages further efforts to strengthen the consideration of social protection and social spending in International Monetary Fund-supported macroeconomic adjustment programmes;",
    "38": "Recognizes the need for the international financial institutions, as appropriate, to promote gender mainstreaming in their policies and programmes, including macroeconomic, fiscal, job creation and structural reform policies and programmes, in accordance with relevant national priorities and strategies;",
    "39": "Urges multilateral donors and invites the international financial institutions and regional development banks, within their respective mandates, to review and implement policies that support national efforts to ensure that a higher proportion of resources reach women and girls, in particular in rural and remote areas, and invites multilateral and regional development banks to agree on common indicators for analysing the gender impact of their lending;",
    "40": "Recognizes that it is important that all international financial institutions and multilateral development banks continue to be adequately resourced, and reiterates the importance of further governance reform in order to adapt to changes in the global economy;",
    "41": "Underscores, while recognizing and building on recent efforts, the need to broaden and enhance the voice and representation of developing countries in norm- setting, global economic governance, and decision-making in international economic and financial institutions to deliver more effective, equitable, inclusive, credible, accountable and legitimate institutions;",
    "42": "Recalls paragraph 53 (c) of the Sevilla Commitment, recognizes the importance of continuing to pursue governance reforms at the World Bank, and notes the technical preparations for the World Bank 2025 shareholding review;",
    "43": "Also recalls the commitment to ensuring the primary role of quotas in International Monetary Fund resources, and that any adjustment in quota shares would be expected to result in increases in the quota shares of dynamic economies in line with their relative positions in the world economy and hence likely in the share of emerging market and developing countries as a whole, while protecting the voice and representation of the poorest members, and recommits itself to the broadening and strengthening of the voice and participation of developing countries, including African countries, the least developed countries, landlocked developing countries, small island developing States, middle-income countries and countries in conflict and post-conflict situations, in international economic decision-making, norm-setting and global economic governance;",
    "44": "Reaffirms the commitment to a strong, quota-based and adequately resourced International Monetary Fund at the centre of the global financial safety net, and encourages Member States to work together to strengthen and improve a system in which different layers of the global financial safety net are closely coordinated and have clear assignments of responsibilities, and consider enhancing, and creation of, regional financial arrangements where possible, and to help countries to weather shocks, and strengthen their capacities to detect risks;",
    "45": "",
    "46": "Welcomes the recent review of the International Monetary Fund surcharge policy, and encourages the Executive Board of the Fund to consider the appropriate charges policy in accordance with the Fund\u2019s credit risk management framework, and also consider in the future adopting a policy for adjusting surcharges in response to disasters and exogenous shocks, while preserving the revolving nature and sustainability of Fund resources;",
    "47": "Encourages the consideration of adjusting borrowing limits in all layers of the safety net, where appropriate, to ensure that emergency resources can meet needs, while taking into account institutions\u2019 financial sustainability;",
    "48": "Acknowledges the importance of the international financial institutions supporting, in line with their mandates, the policy space of each country, while remaining consistent with relevant international rules and commitments, in particular developing countries;",
    "49": "Reaffirms that cohesive, nationally owned sustainable development strategies, supported by integrated national financing frameworks, will be at the heart of efforts, reiterates that each country has primary responsibility for its own economic and social development and that the role of national policies and development strategies cannot be overemphasized, expresses respect for each country\u2019s policy space and leadership to implement policies for the eradication of poverty in all its forms and dimensions and for sustainable development, while remaining consistent with relevant international rules and commitments, at the same time recognizes that national development efforts need to be supported by an enabling international economic environment, including coherent and mutually supporting world trade, monetary and financial systems and strengthened and enhanced global economic governance, and that processes to develop and facilitate the availability of appropriate knowledge and technologies globally, as well as capacity-building, are also critical, and commits to pursuing policy coherence and an enabling environment for sustainable development at all levels and by all actors, and to reinvigorating the Global Partnership for Sustainable Development;",
    "50": "Notes that rapid developments in digital financial technology, further accelerated by the COVID\u201119 pandemic, have transformed the provision of financial services and created a new ecosystem of digital assets, recognizes the relevance of carefully monitoring domestic and global developments, reviewing and updating regulatory frameworks when necessary and cooperating across sectors and borders to support enabling environments that take due account of opportunities and risks to ensure a more balanced view of digital financial innovations, while still fostering competition and innovations in the financial system, and requests the United Nations system to continue to support developing countries through knowledge-sharing, technology transfer on mutually agreed terms and capacity-building in order to better address the opportunities, challenges and implications of emerging digital financial technologies, including digital inequality;",
    "51": "Also notes the development of central bank digital currencies, and encourages regulators to consider potential opportunities and risks for the international and domestic financial system;",
    "52": "",
    "53": "Encourages the Bank for International Settlements, the International Monetary Fund and other relevant institutions to provide capacity-building to support developing countries to make robust design and implementation decisions about upgrading payments infrastructure, potentially including adoption of central bank digital currencies and other platforms or technologies for interoperable settlement systems, while managing potential risks from digital assets;",
    "54": "Expresses appreciation for the work of the Financial Stability Board and other relevant international organizations and standard-setting bodies to maintain the financial stability-focused, robust, effective, risk-based approach of international banking and financial standards, commits itself to sustaining or strengthening frameworks for macroprudential regulation and countercyclical buffers, reaffirms the commitment to hastening the completion of the reform agenda on financial market regulation, including assessing and if necessary reducing the systemic risks associated with non\u2011bank financial intermediation, markets for derivatives, securities lending and repurchase agreements, and also reaffirms the commitment to addressing the risk created by \u201ctoo-big-to-fail\u201d financial institutions and to addressing cross-border elements in the effective resolution of troubled, systemically important financial institutions;",
    "55": "Invites relevant international organizations and standard-setting bodies to prepare a report on risk weightings, assessing how they take into account the risk reductions from innovative finance mechanisms such as guarantees and blended finance, and also invites those organizations to present findings, including policy implications if appropriate, at the Economic and Social Council forum on financing for development follow-up;",
    "56": "Invites further research and analysis on the potential impact of risk weightings on finance, such as for micro-, small and medium-sized enterprises, infrastructure and trade finance;",
    "57": "Notes that there are growing risks outside the regulatory framework, including through non\u2011bank financial institutions and financial technology, calls upon financial regulators to increasingly shift towards examining the underlying risks associated with financial activity rather than the type of financial institution, and encourages the Financial Stability Board to present policy proposals and recommendations to enhance the resilience of non\u2011bank financial intermediation, including the asset management industry, at the forum on financing for development follow-up;",
    "58": "Calls upon financial regulators to encourage financial institutions to explore new opportunities to improve their ability to better manage risks, including through anti\u2011money-laundering and countering the financing of terrorism measures, as well as through the greater use of technology to help to address the costs and risks of operating correspondent banking relationships;",
    "59": "Emphasizes the relevance of inclusion in the international financial system at all levels and the importance of considering financial inclusion as a policy objective in financial regulation, in accordance with national priorities and legislation;",
    "60": " strengthening of global macroeconomic coordination and policy coherence while respecting domestic legal frameworks and policy mandates to enhance global financial and macroeconomic stability and reduce negative spillover effects;",
    "61": "Notes the potential for source countries of capital flows to use appropriate combinations of macroeconomic, macroprudential and regulatory policies that avoid excessive leverage and large international spillovers in the form of capital flow volatility, while still meeting domestic macroeconomic objectives, encourages source countries to consider such policies, while clearly communicating monetary policy decisions, and calls for greater macroeconomic coordination among systemically important economies, which can also help to address global financial market volatility;",
    "62": "Invites the international financial and banking institutions, in consultation with national Governments, to develop tailored guidelines on how countries can attract long-term international investments, guided by the 2030 Agenda, in line with national plans and policies, and with a view to minimizing the adverse effects of capital market volatility;",
    "63": "Welcomes the establishment of the Africa Credit Rating Agency, and looks forward to its full operationalization;",
    "64": "Invites the international financial and banking institutions to continue to enhance the transparency and analytical rigour of risk-rating mechanisms, noting that sovereign risk assessments should maximize the use of objective and transparent parameters, which can be facilitated by high-quality data and analysis, and encourages relevant institutions, including the United Nations Conference on Trade and Development, to continue their work on the issue, including the potential impact of the role, both positive and negative, played by private credit-rating agencies on the development prospects of developing countries, in accordance with their mandates;",
    "65": "Encourages countries to consider national regulatory frameworks related to credit ratings, where appropriate, to reduce overreliance on credit ratings, increase transparency regarding the issuing of sovereign debt ratings, improve the quality of the rating process and make credit rating agencies more accountable for their actions, and reduce conflicts of interest and encourage a greater number of actors to operate in the credit rating market;",
    "66": "Looks forward to the 2026 special high-level meeting on credit ratings under the auspices of the Economic and Social Council for dialogue among Member States, credit rating agencies, regulators, standard setters, long-term investors and public institutions that publish independent debt sustainability analysis, and recalls that the meeting will include updates on the Secretary-General\u2019s efforts to engage with credit rating agencies, discussion on the use of credit assessments, exchanges on good practices for regulation of credit rating agencies, and sharing of perspectives on credit assessment methodologies;",
    "67": "Recommits itself to enabling women\u2019s full, equal and meaningful participation and equal opportunities in the economy and their equal access to decision-making processes and leadership;",
    "68": "Encourages all development banks to establish or maintain social and environmental safeguard systems, including on sustainable infrastructure, human rights, gender equality and women\u2019s empowerment, that are transparent, effective, efficient and time-sensitive, and engage affected communities in project design and implementation;",
    "69": " international law and the Charter of the United Nations that impede the full achievement of economic and social development, particularly in developing countries;",
    "70": "Requests, in this regard, the Secretary-General to submit to the General Assembly at its eighty-first session an action-oriented report on the implementation of the present resolution, with a particular focus on reform of the international financial system;",
    "71": "Decides to include in the provisional agenda of its eighty-first session, under the item entitled \u201cMacroeconomic policy questions\u201d, the sub-item entitled \u201cInternational financial system and development\u201d."
  },
  "agenda_items": [
    "Item 16"
  ],
  "symbol_references": []
}