{
  "symbol": "A/RES/76/142",
  "filename": "A_RES_76_142.pdf",
  "title": "76/142. Follow-up to the Fourth World Conference on Women and full implementation of the Beijing Declaration and Platform for Action and the outcome of the twenty-third special session of the General Assembly",
  "text": "United Nations \nA/RES/76/142\n \n \nGeneral Assembly \nDistr.: General \n6 January 2022 \n \n21-19159 (E)    120122 \n*2119159* \n \n \nSeventy-sixth session \nAgenda item 29 (b) \nAdvancement of women: implementation of the outcome of \nthe Fourth World Conference on Women and of the \ntwenty-third special session of the General Assembly \n \n \n \n \n Resolution adopted by the General Assembly \non 16 December 2021 \n \n \n \n \n[on the report of the Third Committee (A/76/455, para. 21)] \n \n \n 76/142. Follow-up to the Fourth World Conference on Women and full \nimplementation of the Beijing Declaration and Platform for Action \nand the outcome of the twenty-third special session of the \nGeneral Assembly \n \n \n \nThe General Assembly, \n \nRecalling its previous resolutions on the question, including resolution 74/128 \nof 18 December 2019, and recalling also the section of resolution 64/289 of 2 July \n2010 entitled \u201cStrengthening the institutional arrangements for support of gender \nequality and the empowerment of women\u201d,  \n \nDeeply convinced that the Beijing Declaration and Platform for Action 1 and the \noutcome of the twenty-third special session of the General Assembly, entitled \n\u201cWomen 2000: gender equality, development and peace for the twenty-first century\u201d,2 \nare important contributions to the achievement of gender equality and the \nempowerment of women and must be translated into effective action by all States, the \nUnited Nations system and other organizations concerned,  \n \nReaffirming the commitments to gender equality and the advancement of women \nmade at the Millennium Summit,3 the 2005 World Summit,4 the high-level plenary \nmeeting of the General Assembly on the Millennium Development Goals, 5 the special \nevent of the General Assembly to follow up efforts made towards achieving the \n__________________ \n \n1  Report of the Fourth World Conference on Women, Beijing, 4\u201315 September 1995 \n(United Nations publication, Sales No. E.96.IV.13), chap. I, resolution 1, annexes I and II. \n \n2  Resolution S-23/2, annex, and resolution S-23/3, annex.  \n \n3  See resolution 55/2.  \n \n4  See resolution 60/1. \n \n5  See resolution 65/1.  \n\nA/RES/76/142 \nFollow-up to the Fourth World Conference on Women and \nfull implementation of the Beijing Declaration and \nPlatform for Action and the outcome of the twenty-third \nspecial session of the General Assembly\n \n21-19159\n2/11 \n \nMillennium Development Goals,6 the United Nations summit for the adoption of the \npost-2015 development agenda7 and other major United Nations summits, \nconferences and special sessions, and reaffirming also that their full, effective and \naccelerated implementation is integral to achieving the internationally agreed \ndevelopment goals, including the Sustainable Development Goals,  \n \nReaffirming also the commitments in regard to gender equality and the \nempowerment of women in the Doha Declaration on Financing for Development: \noutcome document of the Follow-up International Conference on Financing for \nDevelopment to Review the Implementation of the Monterrey Consensus 8 and the \nAddis Ababa Action Agenda of the Third International Conference on Financing for \nDevelopment,9  \n \nRecalling its resolution 75/233 of 21 December 2020 on the quadrennial \ncomprehensive policy review of operational activities for development of the United \nNations system, in which it called upon all entities of the United Nations development \nsystem to continue to promote gender equality and the empowerment of all women \nand girls by enhancing and accelerating gender mainstreaming through the full \nimplementation of the United Nations System-wide Action Plan on Gender Equality \nand the Empowerment of Women, developed under the leadership of the United \nNations Entity for Gender Equality and the Empowerment of Women (UN-Women), \n \nReaffirming the Declaration of Commitment on HIV/AIDS10 and the Political \nDeclaration on HIV and AIDS: Ending Inequalities and Getting on Track to End AIDS \nby 2030, adopted at the high-level plenary meeting of the General Assembly on \nHIV/AIDS, held in New York from 8 to 10 June 2021, 11 which, inter alia, addressed \nthe pursuit of transformative AIDS responses to contribute to gender equality and the \nempowerment of all women and girls, and reaffirming also the political declaration \non the implementation of the United Nations Global Plan of Action to Combat \nTrafficking in Persons, adopted at the high-level meeting of the General Assembly \nheld in New York on 27 and 28 September 2017,12  \n \nWelcoming progress made towards achieving gender equality and the \nempowerment of women, but stressing that challenges and obstacles remain in the \nimplementation of the Beijing Declaration and Platform for Action and the outcome \nof the twenty-third special session,  \n \nNoting with appreciation that 2020 marked the twenty-fifth anniversary of the \nFourth World Conference on Women and the adoption of the Beijing Declaration and \nPlatform for Action, noting with appreciation also, in this regard, the review activities \nundertaken by Governments, and noting the contributions of all other relevant \nstakeholders to these review activities,  \n \nRecalling Security Council resolutions 1325 (2000) of 31 October 2000, 1820 \n(2008) of 19 June 2008, 1888 (2009) of 30 September 2009, 1889 (2009) of 5 October \n2009, 1960 (2010) of 16 December 2010, 2106 (2013) of 24 June 2013, 2122 (2013) \nof 18 October 2013, 2242 (2015) of 13 October 2015, 2467 (2019) of 23 April 2019 \nand 2493 (2019) of 29 October 2019 on women and peace and security and resolutions \n1882 (2009) of 4 August 2009, 2225 (2015) of 18 June 2015 and 2427 (2018) of 9 July \n2018 on children and armed conflict,  \n__________________ \n \n6  See resolution 68/6. \n \n7  See resolution 70/1.  \n \n8  Resolution 63/239, annex.  \n \n9  Resolution 69/313, annex.  \n \n10  Resolution S-26/2, annex.  \n \n11  Resolution 75/284, annex.  \n \n12  Resolution 72/1. \n\nFollow-up to the Fourth World Conference on Women and \nfull implementation of the Beijing Declaration and \nPlatform for Action and the outcome of the twenty-third \nspecial session of the General Assembly \nA/RES/76/142\n \n3/11\n21-19159 \n \n \nReaffirming the important role of all women in the prevention and resolution of \nconflicts and in peacebuilding, stressing the need for their participation therein, \nincluding at decision-making levels, and noting in this regard that 2020 marked the \ntwentieth anniversary of the adoption of Security Council resolution 1325 (2000) on \nwomen and peace and security, \n \nRecalling the Global Leaders\u2019 Meeting on Gender Equality and Women\u2019s \nEmpowerment: A Commitment to Action, held in New York on 27 September 2015, \nand the pledges and commitments to gender equality and the empowerment of all \nwomen and girls made by Governments at that meeting,  \n \nTaking note of the Secretary-General\u2019s High-level Panel on Women\u2019s Economic \nEmpowerment,  \n \nRecognizing that the responsibility for the implementation of the Beijing \nDeclaration and Platform for Action and the outcome of the twenty-third special \nsession rests primarily at the national level and that strengthened efforts are necessary \nin this respect, and reiterating that enhanced international cooperation is essential for \nfull, effective and accelerated implementation,  \n \nRecognizing also the primary role of the Commission on the Status of Women \nin the follow-up to the Beijing Declaration and Platform of Action, in which the work \nof the Commission is grounded, and stressing that it is critical to address and integrate \ngender equality and the empowerment of women and girls throughout national, \nregional and global reviews of the implementation of the 2030 Agenda for Sustainable \nDevelopment13 and to ensure synergies between the follow-up to the Beijing Platform \nfor Action and the gender-responsive follow-up to the 2030 Agenda,  \n \nWelcoming the work of the Commission on the Status of Women in reviewing \nthe implementation of the Beijing Declaration and Platform for Action, taking note \nwith appreciation of all its agreed conclusions, and acknowledging the need for their \nimplementation,  \n \nRecalling the sixty-fourth session of the Commission on the Status of Women, \nin 2020, when the Commission undertook a review and appraisal of the \nimplementation of the Beijing Declaration and Platform for Action and the outcome \nof the twenty-third special session of the General Assembly,  \n \nRecalling also the high-level meeting of the General Assembly on the twenty-\nfifth anniversary of the Fourth World Conference on Women, held in New York on \n1 October 2020, which demonstrated commitment to the full and accelerated \nimplementation of the Beijing Declaration and Platform for Action and the outcome \ndocuments of its reviews, \n \nWelcoming the political declaration on the occasion of the twenty-fifth \nanniversary of the Fourth World Conference on Women, 14 \n \nWelcoming also efforts on the empowerment of women and girls, and taking \nnote of all international, regional and national initiatives, such as the Generation \nEquality Forum, which was convened by UN-Women and co-chaired by France and \nMexico, in partnership with civil society, \n \nWelcoming further the strengthening of the capacity of UN-Women and its \nexperience in achieving its mandate,  \n__________________ \n \n13  Resolution 70/1. \n \n14  Official Records of the Economic and Social Council, 2020, Supplement No. 7 (E/2020/27), \nchap. I, sect. C, resolution 59/1, annex. \n\nA/RES/76/142 \nFollow-up to the Fourth World Conference on Women and \nfull implementation of the Beijing Declaration and \nPlatform for Action and the outcome of the twenty-third \nspecial session of the General Assembly\n \n21-19159\n4/11 \n \n \nCommending \nUN-Women \nfor \nthe \ncontinued \nsupport \nprovided \nto \nintergovernmental processes, including on the linkages between sustainable \ndevelopment, financing for development, migration, climate change and the \nachievement of gender equality and the empowerment of women and girls,  \n \nRecalling its resolution 64/289, in which it decided that the resources required \nto service the normative intergovernmental processes should be funded from the \nregular budget,  \n \nTaking note of the ongoing work of the fund for gender equality and the United \nNations trust fund in support of actions to eliminate violence against women,  \n \nRecognizing that the participation and contribution of civil society, in particular \nwomen\u2019s groups and organizations and other non-governmental organizations, are \nimportant to the successful implementation of the Beijing Declaration and Platform \nfor Action and the outcome of the twenty-third special session, as well as to the \ngender-responsive implementation of the 2030 Agenda,  \n \nReaffirming that gender mainstreaming is a globally accepted strategy for \npromoting the empowerment of women and achieving gender equality by \ntransforming structures of inequality, which is relevant to all issues considered by its \nMain Committees and subsidiary bodies, including in resolutions dealing with issues \nbeyond social, humanitarian, cultural, economic and financial matters,  \n \nReaffirming also the commitment to actively promote the mainstreaming of a \ngender perspective into the design, implementation, monitoring and evaluation of \npolicies and programmes in all political, economic and social spheres, as well as the \ncommitment to strengthen the capabilities of the United Nations system in the area of \ngender equality,  \n \nBearing in mind the challenges and obstacles to changing discriminatory \nattitudes and gender stereotypes, which perpetuate discrimination against women and \ngirls and stereotypical roles of girls and boys and women and men, and stressing that \nchallenges and obstacles remain in the implementation of international standards and \nnorms to address inequality between women and men,  \n \nRecognizing the importance of fully engaging men and boys, as agents and \nbeneficiaries of change, in the achievement of gender equality and the empowerment \nof all women and girls and as allies in the elimination of all forms of discrimination \nand violence against women and girls, as well as in the full, effective and accelerated \nimplementation of the Beijing Declaration and Platform for Action and the gender-\nresponsive implementation of the 2030 Agenda,  \n \nExpressing serious concern that the urgent goal of 50/50 gender balance in the \nUnited Nations system, especially at higher professional grade levels and in \nnon-headquarters locations, with full respect for the principle of equitable \ngeographical distribution, in conformity with Article 101, paragraph 3, of the Charter \nof the United Nations, remains unmet, that the representation of women decreases \nprogressively at higher professional grade levels and that the gap in representation is \ngreatest and the rate of change slowest at non-headquarters locations, including in \npeacekeeping missions, as reflected in the report of the Secretary-General on \nimprovement in the status of women in the United Nations system, 15  \n \nTaking note with appreciation of the creation of the United Nations system-wide \ndashboard on gender parity by UN-Women and the United Nations Development \nProgramme to strengthen system-wide monitoring and data collection by providing \n__________________ \n \n15  A/76/115. \n\nFollow-up to the Fourth World Conference on Women and \nfull implementation of the Beijing Declaration and \nPlatform for Action and the outcome of the twenty-third \nspecial session of the General Assembly \nA/RES/76/142\n \n5/11\n21-19159 \n \nthe latest available data, in support of the Secretary-General\u2019s system-wide strategy \non gender parity, \n \n1. \nTakes note with appreciation of the report of the Secretary-General on the \nmeasures taken and progress achieved in follow-up to and implementation of the \nBeijing Declaration and Platform for Action and the outcome of the twenty-third \nspecial session of the General Assembly16 and of the report of the Secretary-General \non improvement in the status of women in the United Nations system;  \n \n2. \nReaffirms the Beijing Declaration and Platform for Action adopted at the \nFourth World Conference on Women and the outcome of the twenty-third special \nsession of the General Assembly, also reaffirms the political declaration on the \noccasion of the twenty-fifth anniversary of the Fourth World Conference on Women \nadopted by the Commission on the Status of Women at its sixty-fourth session, and \naffirms its commitment to their full, effective and accelerated implementation;  \n \n3. \nAlso reaffirms the primary and essential role of the General Assembly and \nthe Economic and Social Council, as well as the catalytic role of the Commission on \nthe Status of Women, in promoting gender equality and the empowerment of all \nwomen and girls, based on the full implementation of the Beijing Declaration and \nPlatform for Action and the outcome of the twenty-third special session, and in \npromoting and monitoring gender mainstreaming within the United Nations system, \nand encourages the Commission to contribute to the follow-up to the 2030 Agenda \nfor Sustainable Development in order to accelerate the realization of gender equality \nand the empowerment of all women and girls, as well as the enjoyment of all human \nrights by women and girls;  \n \n4. \nCalls upon Governments and all other stakeholders to systematically \nmainstream a gender perspective into the implementation of the 2030 Agenda in order \nto, inter alia, contribute to the full, effective and accelerated implementation of the \nBeijing Declaration and Platform for Action, and stresses in this regard the \nimportance of ensuring synergies between the follow-up to the Beijing Declaration \nand Platform for Action and the gender-responsive follow-up to the 2030 Agenda;  \n \n5. \nReiterates that the full, effective and accelerated implementation of the \nBeijing Declaration and Platform for Action and the outcome of the twenty-third \nspecial session is essential to achieving the Sustainable Development Goals;  \n \n6. \nRecognizes that the implementation of the Beijing Declaration and \nPlatform for Action and the fulfilment of the obligations of States parties under the \nConvention on the Elimination of All Forms of Discrimination against Women 17 are \nmutually reinforcing in respect of achieving gender equality and the empowerment of \nwomen, and welcomes in this regard the contributions of the Committee on the \nElimination of Discrimination against Women to promoting the implementation of \nthe Platform for Action and the outcome of the twenty-third special session;  \n \n7. \nCalls upon States parties to comply fully with their obligations under the \nConvention on the Elimination of All Forms of Discrimination against Women and \nthe Optional Protocol thereto18 and to take into consideration the concluding \nobservations as well as the general recommendations of the Committee, urges States \nparties to consider limiting the extent of any reservations that they lodge to the \nConvention, to formulate any reservations as precisely and narrowly as possible and \nto regularly review such reservations with a view to withdrawing them so as to ensure \nthat no reservation is incompatible with the object and purpose of the Convention, \n__________________ \n \n16  A/76/185. \n \n17  United Nations, Treaty Series, vol. 1249, No. 20378. \n \n18  Ibid., vol. 2131, No. 20378. \n\nA/RES/76/142 \nFollow-up to the Fourth World Conference on Women and \nfull implementation of the Beijing Declaration and \nPlatform for Action and the outcome of the twenty-third \nspecial session of the General Assembly\n \n21-19159\n6/11 \n \nurges all Member States that have not yet ratified or acceded to the Convention to \nconsider doing so, and calls upon those Member States that have not yet done so to \nconsider signing and ratifying or acceding to the Optional Protocol;  \n \n8. \nReaffirms that States have an obligation to exercise due diligence to \nprevent and combat all forms of violence against women and girls, provide protection \nto the victims and investigate, prosecute and punish the perpetrators of violence \nagainst women and girls, and that failure to do so violates and impairs or nullifies the \nenjoyment of their human rights and fundamental freedoms, calls upon Governments \nto elaborate and implement laws and strategies to eliminate violence against women \nand girls, encourages and supports men and boys to take an active part in the \nprevention and elimination of all forms of violence, encourages increased \nunderstanding among men and boys of how violence harms girls, boys, women and \nmen and undermines gender equality, encourages all actors to speak out against any \nform of violence against women, and in this regard encourages Member States to \ncontinue to support the Secretary-General\u2019s ongoing campaign, \u201cUNiTE to End \nViolence against Women\u201d, its social mobilization and advocacy platform, \u201cOrange \nthe World: End Violence against Women\u201d, and the \u201cHeforShe\u201d campaign of the \nUnited Nations Entity for Gender Equality and the Empowerment of Women \n(UN-Women), as well as to support the Secretary-General\u2019s voluntary compact on \npreventing and addressing sexual exploitation and abuse;  \n \n9. \nReiterates the importance and value of the mandate of UN-Women, and \nwelcomes the Entity\u2019s leadership in providing a strong voice for women and girls at \nall levels and its efforts to support intergovernmental processes so that they fully \ncontribute to the achievement of gender equality and the empowerment of women and \ngirls and the realization of their human rights;  \n \n10. Notes with concern that UN-Women continues to draw on voluntary \ncontributions in order to enable it to carry out its mandate of servicing normative \nintergovernmental processes, and emphasizes the need for the full implementation of \nresolution 64/289 in this regard;  \n \n11. \nReaffirms the important role of UN-Women in leading, coordinating and \npromoting accountability of the United Nations system in its work on gender equality \nand the empowerment of women; \n \n12. Notes with appreciation the important and extensive work of UN-Women \nfor more effective and coherent gender mainstreaming across the United Nations \nsystem, and calls upon UN-Women to continue to support gender mainstreaming \nacross the United Nations system as an integral part of its work and of its efforts to \naccelerate action across the United Nations system;  \n \n13. Welcomes the commitment of UN-Women to support Member States in \ntheir efforts to develop and strengthen norms, policies and standards on gender \nequality and the empowerment of women, as well as to integrate gender perspectives \ninto sectoral policy and normative frameworks, in line with its mandate, and \nencourages the Entity to continue to promote the need to mainstream and strengthen \na gender perspective in the work of intergovernmental bodies and processes, to raise \nawareness of the opportunities therein and to provide policy analysis, knowledge, \nevidence and information in support of intergovernmental deliberations in order to \nprovide technical assistance, at the request of Member States, in strengthening a \ngender perspective in resolutions and other outcomes; \n \n14. Recognizes the need to continue to strengthen the capacity of UN-Women \nto fully implement its normative support function; \n\nFollow-up to the Fourth World Conference on Women and \nfull implementation of the Beijing Declaration and \nPlatform for Action and the outcome of the twenty-third \nspecial session of the General Assembly \nA/RES/76/142\n \n7/11\n21-19159 \n \n \n15. Also recognizes the important role of UN-Women in promoting gender \nequality and the empowerment of women and the central role that it plays in \nsupporting Member States, in coordinating the United Nations system and in \nmobilizing civil society, the private sector and other relevant stakeholders, at all \nlevels, in support of the implementation of the Beijing Declaration and Platform for \nAction, and calls upon UN-Women and the United Nations system, within their \nrespective mandates, to continue to support the full, effective and accelerated \nimplementation of the Beijing Declaration and Platform for Action at the \ninternational, regional, national and local levels, including through systematic gender \nmainstreaming, the mobilization of resources to deliver results and the monitoring of \nprogress with data and robust accountability systems;  \n \n16. Urges Member States to increase funding for the budget of UN-Women by \nproviding, when legislative and budgetary provisions allow, core, multi-year, \npredictable, stable and sustainable voluntary contributions, recognizing the \nimportance of adequate funding in enabling UN-Women to implement its strategic \nplan promptly and effectively, and that the mobilization of financial resources for \nachieving its goals still remains a challenge;  \n \n17. Also urges Member States and encourages stakeholders, where applicable, \nto address gaps and challenges, take specific, measurable, time-bound actions and \nmobilize adequate financial resources for the full, effective and accelerated \nimplementation of the Beijing Declaration and Platform for Action, in line with the \ncommitments made in the political declaration on the occasion of the twenty-fifth \nanniversary of the Fourth World Conference on Women, including by: \n \n(a) \nEliminating all discriminatory laws and ensuring that laws, policies and \nprogrammes benefit all women and girls and that they are fully and effectively \nimplemented and systematically evaluated to ensure their effectiveness and that they \ndo not create and reinforce inequalities and marginalization;  \n \n(b) \nEliminating structural barriers, discriminatory social norms and gender \nstereotypes, and promoting social norms and practices that empower all women and \ngirls and that recognize their contributions and eliminate discrimination and violence \nagainst them, including through their balanced and non-stereotyped portrayal in the \nmedia; \n \n(c) \nStrengthening the effectiveness and accountability of institutions at all \nlevels to promote gender equality and the empowerment of all women and girls, as \nwell as ensuring equal access to justice and public services; \n \n(d) \nMainstreaming a gender perspective across the economic, social and \nenvironmental dimensions of sustainable development, for the realization of the \nhuman rights of all and the achievement of gender equality and the empowerment of \nall women and girls; \n \n(e) \nMatching commitments to gender equality and the empowerment of \nwomen and girls with adequate financing through the mobilization of financial \nresources from all sources; \n \n(f) \nStrengthening accountability for the implementation of commitments to \ngender equality and the empowerment of women and girls; \n \n(g) \nHarnessing the potential of technology and innovation to improve \nwomen\u2019s and girls\u2019 lives and to close the development divide and the digital divide, \nincluding the gender digital divide, as well as addressing the risks and challenges \nemerging from the use of technologies; \n\nA/RES/76/142 \nFollow-up to the Fourth World Conference on Women and \nfull implementation of the Beijing Declaration and \nPlatform for Action and the outcome of the twenty-third \nspecial session of the General Assembly\n \n21-19159\n8/11 \n \n \n(h) \nClosing data and evidence gaps through improved regular collection, \nanalysis and use of gender statistics, including through strengthening national \nstatistical capacities, to strengthen the implementation and evaluation of policies and \nprogrammes; \n \n(i) \nStrengthening international cooperation, including North-South, South-\nSouth and triangular cooperation, as well as public-private partnerships, to implement \ncommitments to achieve gender equality and the empowerment of all women and \ngirls; \n \n18. Calls upon Governments and the organs, relevant funds and programmes \nand specialized agencies of the United Nations system, within their respective \nmandates, other international and regional organizations, including financial \ninstitutions, and all relevant actors of civil society, including non-governmental \norganizations, to intensify and accelerate action to achieve the full and effective \nimplementation of the Beijing Declaration and Platform for Action and of the \noutcome of the twenty-third special session;  \n \n19. Encourages all Member States to make ambitious commitments on gender \nequality and the empowerment of all women and girls; \n \n20. Encourages all actors, including Governments, the United Nations system, \nother international organizations and civil society, to continue to support the work of \nthe Commission on the Status of Women in fulfilling its central role in the follow-up \nto and review of the implementation of the Beijing Declaration and Platform for \nAction and the outcome of the twenty-third special session and, as applicable, to carry \nout the recommendations of the Commission, welcomes in this regard the \nCommission\u2019s continued sharing of experiences, lessons learned and good practices \nin overcoming challenges to the full implementation at the national and international \nlevels and the evaluation of progress in the implementation of priority themes, and \nencourages the intergovernmental bodies of the United Nations system, as \nappropriate, to incorporate the outcomes of the Commission into their work;  \n \n21. Requests the entities of the United Nations system to systematically and \nstrategically incorporate the outcomes of the Commission on the Status of Women \ninto their work, within their mandates, and, inter alia, to ensure effective support for \nthe efforts of Member States towards the achievement of gender equality and the \nempowerment of women and girls, and in this regard encourages UN-Women to \ncontinue to use concrete results-based reporting mechanisms and to ensure coherence, \nconsistency and coordination between the normative and operational aspects of its \nwork;  \n \n22. Encourages States and all stakeholders to strengthen the mainstreaming of \na gender perspective into all sectors and in all areas of development;  \n \n23. Reiterates its call upon the United Nations system, including the main \norgans, their main committees and subsidiary bodies, through forums such as the \nhigh-level political forum on sustainable development and functions such as the \nannual ministerial review and the Development Cooperation Forum of the Economic \nand Social Council and the funds and programmes and the specialized agencies, to \nincrease efforts to fully mainstream a gender perspective into all issues under their \nconsideration and within their mandates, as well as into all United Nations summits, \nconferences and special sessions and their follow-up processes;  \n \n24. Calls upon States to ensure that intergovernmental processes consistently \naddress gender perspectives in their preparatory processes and outcomes;  \n \n25. Commits to intensifying efforts to further integrate a gender perspective \ninto the work of the General Assembly, including in plenary and high-level meetings; \n\nFollow-up to the Fourth World Conference on Women and \nfull implementation of the Beijing Declaration and \nPlatform for Action and the outcome of the twenty-third \nspecial session of the General Assembly \nA/RES/76/142\n \n9/11\n21-19159 \n \n \n26. Encourages its Main Committees and subsidiary bodies, as well as the \nEconomic and Social Council and its functional commissions, particularly in the light \nof the analysis contained in the report of the Secretary-General19 and of the cross-\ncutting nature of gender equality and the empowerment of women, to intensify their \nefforts to make further progress in the integration of a gender perspective into their \nwork, including, as appropriate, into their resolutions within the respective mandates \nof the General Assembly and each of its Main Committees and subsidiary bodies and \nthe Economic and Social Council and each of its functional commissions, and invites \nthe Bureaux, as appropriate, to encourage such efforts;  \n \n27. Strongly encourages Governments to continue to support the role and \ncontribution of civil society, in particular non-governmental organizations and \nwomen\u2019s organizations, in the full, effective and accelerated implementation of the \nBeijing Declaration and Platform for Action and the outcome of the twenty-third \nspecial session and in the gender-responsive implementation of the 2030 Agenda;  \n \n28. Calls upon Governments and the United Nations system to encourage \nwomen\u2019s groups and other non-governmental organizations specializing in gender \nequality and the empowerment of women to participate in intergovernmental \nprocesses, including through increased outreach, funding and capacity-building; \n \n29. Calls upon the intergovernmental bodies of the United Nations system to \nsystematically request the inclusion of a gender perspective in reports of the \nSecretary-General and other inputs to intergovernmental processes;  \n \n30. Requests that reports of the Secretary-General submitted to the General \nAssembly and the Economic and Social Council and their subsidiary bodies continue \nto systematically address gender perspectives through gender-sensitive analysis, the \nprovision of data disaggregated by sex, age and disability and the reflection of the \ncontribution of women and girls as agents of change and of the impact of proposed \npolicies and programmes on gender equality and the empowerment of women and \ngirls, and that conclusions and recommendations for further action address the \ndifferent situations and needs of women and men and girls and boys in order to \nfacilitate gender-responsive policy development, and in this regard requests the \nSecretary-General to convey the importance of reflecting a gender perspective to all \nstakeholders who provide input to his reports;  \n \n31. Encourages Member States, with the support of, as appropriate, United \nNations entities, including UN-Women, international and regional organizations and \nother relevant actors, to prioritize the strengthening of national data collection and \nmonitoring capacities with regard to statistics disaggregated by sex and age, as well \nas national tracking indicators for gender equality and the empowerment of women, \nthrough multisectoral efforts and partnerships;  \n \n32. Calls upon all parts of the United Nations system to continue to play an \nactive role in ensuring the full, effective and accelerated implementation of the \nBeijing Declaration and Platform for Action and the outcome of the twenty-third \nspecial session through, inter alia, the maintenance of gender specialists in all entities \nof the United Nations system, as well as by ensuring that all personnel, especially \nthose in the field, receive training and appropriate follow-up, including tools, \nguidance and support, for accelerated gender mainstreaming, and reaffirms the need \nto strengthen the capabilities of the United Nations system in the area of gender;  \n \n33. Commends the Secretary-General for his leadership and efforts towards \ncreating an enabling working environment and accelerating progress towards the goal \nof 50/50 gender balance at all levels throughout the United Nations system, including \n__________________ \n \n19  A/76/115. \n\nA/RES/76/142 \nFollow-up to the Fourth World Conference on Women and \nfull implementation of the Beijing Declaration and \nPlatform for Action and the outcome of the twenty-third \nspecial session of the General Assembly\n \n21-19159\n10/11 \n \nthe goal of reaching parity at the highest levels by 2021 and at all levels throughout \nthe United Nations system by 2028, as set out in his system-wide strategy on gender \nparity;  \n \n34. Also commends the Secretary-General for encouraging the entities of the \nUnited Nations to update and regularly monitor entity-specific implementation plans \nto achieve and maintain the goal of gender parity, and in this regard encourages \nUN-Women to continue to regularly report on the implementation of and progress \nmade on gender parity through such plans;  \n \n35. Requests the Secretary-General to further accelerate his efforts to achieve \nthe goal of 50/50 gender balance at all levels throughout the United Nations system, \nincluding in the field and in peacekeeping missions, with full respect for the principle \nof equitable geographical distribution, in conformity with Article 101, paragraph 3, \nof the Charter of the United Nations, considering, in particular, women from the \ndeveloping and the least developed countries, countries with economies in transition \nand unrepresented or largely underrepresented Member States, and to ensure the \nimplementation of measures with clear targets and timelines, including temporary \nspecial measures, as well as the strengthening of the implementation of policies and \nmeasures related to creating enabling working environments, including for work-life \nbalance, and to prevent and address all forms of discrimination, racism, harassment, \nincluding sexual harassment, abuse of authority in the workplace and sexual \nexploitation and abuse, so as to accelerate progress, and managerial and departmental \naccountability, inter alia, through leadership compacts and performance appraisal \nsystems, with respect to attaining gender parity within the shortest feasible period;  \n \n36. Requests the entities of the United Nations to closely monitor the impact \nof the coronavirus disease (COVID-19) pandemic on women personnel and their \nhealth and well-being, and share the information with UN-Women for its continued \nsystem-wide reporting on the improvement in the status of women; \n \n37. Also requests the entities of the United Nations to strengthen efforts to \nprevent, address and eliminate sexual harassment, in full alignment with the work of \nthe United Nations System Chief Executives Board for Coordination Task Force on \nAddressing Sexual Harassment within the Organizations of the United Nations \nSystem, apply a victim-centred approach to all forms of misconduct, as well as \nencourage the implementation of accountability mechanisms; \n \n38. Calls upon the entities of the United Nations system to significantly \nincrease their efforts towards achieving the goal of 50/50 gender balance in all \nlocations, including at the United Nations country team level, through a \ncomprehensive range of actions, inter alia, as outlined in the Secretary-General\u2019s \nsystem-wide strategy on gender parity, as well as the recommendations contained in \nthe Enabling Environment Guidelines for the United Nations System and the Field-\nspecific Enabling Environment Guidelines, to continue to collaborate with \nUN-Women and with the active support of system-wide gender focal points and to \nprovide sufficient financial and human resources for organizational change and for \novercoming identified impediments to progress on gender balance, including setbacks \nfrom the COVID-19 pandemic;  \n \n39. Requests the entities of the United Nations, at both headquarters and \nnon-headquarters levels, to continue to appoint gender focal points to provide support \nfor the advancement of gender parity, led and coordinated by UN-Women; \n \n40. Strongly encourages Member States to identify and regularly submit more \nwomen candidates for appointment to positions in the United Nations system, \nespecially at more senior, decision-making and policymaking levels, including in \npeacekeeping operations;  \n\nFollow-up to the Fourth World Conference on Women and \nfull implementation of the Beijing Declaration and \nPlatform for Action and the outcome of the twenty-third \nspecial session of the General Assembly \nA/RES/76/142\n \n11/11\n21-19159 \n \n \n41. Encourages increased efforts by Governments and the United Nations \nsystem to enhance accountability for the implementation of commitments to gender \nequality and the empowerment of women at the international, regional, national and \nlocal levels, including through improved monitoring and reporting on progress in \nrelation to policies, strategies, resource allocations and programmes and by achieving \ngender balance;  \n \n42. Reaffirms that Governments bear the primary responsibility for the \nachievement of gender equality and the empowerment of women and that \ninternational cooperation has an essential role in assisting developing countries in \nprogressing towards the full implementation of the Beijing Declaration and Platform \nfor Action;  \n \n43. Encourages the Secretary-General to bring to the attention of the United \nNations system the findings of his reports in order to strengthen follow-up on these \nfindings and to accelerate the implementation of the present resolution;  \n \n44. Requests the Secretary-General to provide an oral report to the \nCommission on the Status of Women at its sixty-sixth and sixty-seventh sessions and \nto report to the General Assembly at its seventy-eighth session on the improvement \nin the status of women in the United Nations system and on progress made and \nobstacles encountered in achieving gender balance, under the item entitled \n\u201cAdvancement of women\u201d;  \n \n45. Also requests the Secretary-General to report to the General Assembly at \nits seventy-eighth session, under the item entitled \u201cAdvancement of women\u201d, on the \nfollow-up to and progress made in the implementation of the Beijing Declaration and \nPlatform for Action and the outcome of the twenty-third special session. \n \n53rd plenary meeting \n16 December 2021 \n \n \n",
  "paragraphs": {
    "1": "Takes note with appreciation of the report of the Secretary-General on the measures taken and progress achieved in follow-up to and implementation of the Beijing Declaration and Platform for Action and the outcome of the twenty-third special session of the General Assembly16 and of the report of the Secretary-General on improvement in the status of women in the United Nations system;",
    "2": "Reaffirms the Beijing Declaration and Platform for Action adopted at the Fourth World Conference on Women and the outcome of the twenty-third special session of the General Assembly, also reaffirms the political declaration on the occasion of the twenty-fifth anniversary of the Fourth World Conference on Women adopted by the Commission on the Status of Women at its sixty-fourth session, and affirms its commitment to their full, effective and accelerated implementation;",
    "3": "Also reaffirms the primary and essential role of the General Assembly and the Economic and Social Council, as well as the catalytic role of the Commission on the Status of Women, in promoting gender equality and the empowerment of all women and girls, based on the full implementation of the Beijing Declaration and Platform for Action and the outcome of the twenty-third special session, and in promoting and monitoring gender mainstreaming within the United Nations system, and encourages the Commission to contribute to the follow-up to the 2030 Agenda for Sustainable Development in order to accelerate the realization of gender equality and the empowerment of all women and girls, as well as the enjoyment of all human rights by women and girls;",
    "4": "Calls upon Governments and all other stakeholders to systematically mainstream a gender perspective into the implementation of the 2030 Agenda in order to, inter alia, contribute to the full, effective and accelerated implementation of the Beijing Declaration and Platform for Action, and stresses in this regard the importance of ensuring synergies between the follow-up to the Beijing Declaration and Platform for Action and the gender-responsive follow-up to the 2030 Agenda;",
    "5": "Reiterates that the full, effective and accelerated implementation of the Beijing Declaration and Platform for Action and the outcome of the twenty-third special session is essential to achieving the Sustainable Development Goals;",
    "6": "Recognizes that the implementation of the Beijing Declaration and Platform for Action and the fulfilment of the obligations of States parties under the Convention on the Elimination of All Forms of Discrimination against Women 17 are mutually reinforcing in respect of achieving gender equality and the empowerment of women, and welcomes in this regard the contributions of the Committee on the Elimination of Discrimination against Women to promoting the implementation of the Platform for Action and the outcome of the twenty-third special session;",
    "7": "Calls upon States parties to comply fully with their obligations under the Convention on the Elimination of All Forms of Discrimination against Women and the Optional Protocol thereto18 and to take into consideration the concluding observations as well as the general recommendations of the Committee, urges States parties to consider limiting the extent of any reservations that they lodge to the Convention, to formulate any reservations as precisely and narrowly as possible and to regularly review such reservations with a view to withdrawing them so as to ensure that no reservation is incompatible with the object and purpose of the Convention, __________________ 16 A/76/185. 17 United Nations, Treaty Series, vol. 1249, No. 20378. 18 Ibid., vol. 2131, No. 20378. A/RES/76/142 Follow-up to the Fourth World Conference on Women and full implementation of the Beijing Declaration and Platform for Action and the outcome of the twenty-third special session of the General Assembly 21-19159 6/11 urges all Member States that have not yet ratified or acceded to the Convention to consider doing so, and calls upon those Member States that have not yet done so to consider signing and ratifying or acceding to the Optional Protocol;",
    "8": "Reaffirms that States have an obligation to exercise due diligence to prevent and combat all forms of violence against women and girls, provide protection to the victims and investigate, prosecute and punish the perpetrators of violence against women and girls, and that failure to do so violates and impairs or nullifies the enjoyment of their human rights and fundamental freedoms, calls upon Governments to elaborate and implement laws and strategies to eliminate violence against women and girls, encourages and supports men and boys to take an active part in the prevention and elimination of all forms of violence, encourages increased understanding among men and boys of how violence harms girls, boys, women and men and undermines gender equality, encourages all actors to speak out against any form of violence against women, and in this regard encourages Member States to continue to support the Secretary-General\u2019s ongoing campaign, \u201cUNiTE to End Violence against Women\u201d, its social mobilization and advocacy platform, \u201cOrange the World: End Violence against Women\u201d, and the \u201cHeforShe\u201d campaign of the United Nations Entity for Gender Equality and the Empowerment of Women (UN-Women), as well as to support the Secretary-General\u2019s voluntary compact on preventing and addressing sexual exploitation and abuse;",
    "9": "Reiterates the importance and value of the mandate of UN-Women, and welcomes the Entity\u2019s leadership in providing a strong voice for women and girls at all levels and its efforts to support intergovernmental processes so that they fully contribute to the achievement of gender equality and the empowerment of women and girls and the realization of their human rights;",
    "10": "Notes with concern that UN-Women continues to draw on voluntary contributions in order to enable it to carry out its mandate of servicing normative intergovernmental processes, and emphasizes the need for the full implementation of resolution 64/289 in this regard;",
    "11": "Reaffirms the important role of UN-Women in leading, coordinating and promoting accountability of the United Nations system in its work on gender equality and the empowerment of women;",
    "12": "Notes with appreciation the important and extensive work of UN-Women for more effective and coherent gender mainstreaming across the United Nations system, and calls upon UN-Women to continue to support gender mainstreaming across the United Nations system as an integral part of its work and of its efforts to accelerate action across the United Nations system;",
    "13": "Welcomes the commitment of UN-Women to support Member States in their efforts to develop and strengthen norms, policies and standards on gender equality and the empowerment of women, as well as to integrate gender perspectives into sectoral policy and normative frameworks, in line with its mandate, and encourages the Entity to continue to promote the need to mainstream and strengthen a gender perspective in the work of intergovernmental bodies and processes, to raise awareness of the opportunities therein and to provide policy analysis, knowledge, evidence and information in support of intergovernmental deliberations in order to provide technical assistance, at the request of Member States, in strengthening a gender perspective in resolutions and other outcomes;",
    "14": "Recognizes the need to continue to strengthen the capacity of UN-Women to fully implement its normative support function; Follow-up to the Fourth World Conference on Women and full implementation of the Beijing Declaration and Platform for Action and the outcome of the twenty-third special session of the General Assembly A/RES/76/142 7/11 21-19159",
    "15": "Also recognizes the important role of UN-Women in promoting gender equality and the empowerment of women and the central role that it plays in supporting Member States, in coordinating the United Nations system and in mobilizing civil society, the private sector and other relevant stakeholders, at all levels, in support of the implementation of the Beijing Declaration and Platform for Action, and calls upon UN-Women and the United Nations system, within their respective mandates, to continue to support the full, effective and accelerated implementation of the Beijing Declaration and Platform for Action at the international, regional, national and local levels, including through systematic gender mainstreaming, the mobilization of resources to deliver results and the monitoring of progress with data and robust accountability systems;",
    "16": "Urges Member States to increase funding for the budget of UN-Women by providing, when legislative and budgetary provisions allow, core, multi-year, predictable, stable and sustainable voluntary contributions, recognizing the importance of adequate funding in enabling UN-Women to implement its strategic plan promptly and effectively, and that the mobilization of financial resources for achieving its goals still remains a challenge;",
    "17": "Also urges Member States and encourages stakeholders, where applicable, to address gaps and challenges, take specific, measurable, time-bound actions and mobilize adequate financial resources for the full, effective and accelerated implementation of the Beijing Declaration and Platform for Action, in line with the commitments made in the political declaration on the occasion of the twenty-fifth anniversary of the Fourth World Conference on Women, including by: (a) Eliminating all discriminatory laws and ensuring that laws, policies and programmes benefit all women and girls and that they are fully and effectively implemented and systematically evaluated to ensure their effectiveness and that they do not create and reinforce inequalities and marginalization; (b) Eliminating structural barriers, discriminatory social norms and gender stereotypes, and promoting social norms and practices that empower all women and girls and that recognize their contributions and eliminate discrimination and violence against them, including through their balanced and non-stereotyped portrayal in the media; (c) Strengthening the effectiveness and accountability of institutions at all levels to promote gender equality and the empowerment of all women and girls, as well as ensuring equal access to justice and public services; (d) Mainstreaming a gender perspective across the economic, social and environmental dimensions of sustainable development, for the realization of the human rights of all and the achievement of gender equality and the empowerment of all women and girls; (e) Matching commitments to gender equality and the empowerment of women and girls with adequate financing through the mobilization of financial resources from all sources; (f) Strengthening accountability for the implementation of commitments to gender equality and the empowerment of women and girls; (g) Harnessing the potential of technology and innovation to improve women\u2019s and girls\u2019 lives and to close the development divide and the digital divide, including the gender digital divide, as well as addressing the risks and challenges emerging from the use of technologies; A/RES/76/142 Follow-up to the Fourth World Conference on Women and full implementation of the Beijing Declaration and Platform for Action and the outcome of the twenty-third special session of the General Assembly 21-19159 8/11 (h) Closing data and evidence gaps through improved regular collection, analysis and use of gender statistics, including through strengthening national statistical capacities, to strengthen the implementation and evaluation of policies and programmes; (i) Strengthening international cooperation, including North-South, South- South and triangular cooperation, as well as public-private partnerships, to implement commitments to achieve gender equality and the empowerment of all women and girls;",
    "18": "Calls upon Governments and the organs, relevant funds and programmes and specialized agencies of the United Nations system, within their respective mandates, other international and regional organizations, including financial institutions, and all relevant actors of civil society, including non-governmental organizations, to intensify and accelerate action to achieve the full and effective implementation of the Beijing Declaration and Platform for Action and of the outcome of the twenty-third special session;",
    "19": "Encourages all Member States to make ambitious commitments on gender equality and the empowerment of all women and girls;",
    "20": "Encourages all actors, including Governments, the United Nations system, other international organizations and civil society, to continue to support the work of the Commission on the Status of Women in fulfilling its central role in the follow-up to and review of the implementation of the Beijing Declaration and Platform for Action and the outcome of the twenty-third special session and, as applicable, to carry out the recommendations of the Commission, welcomes in this regard the Commission\u2019s continued sharing of experiences, lessons learned and good practices in overcoming challenges to the full implementation at the national and international levels and the evaluation of progress in the implementation of priority themes, and encourages the intergovernmental bodies of the United Nations system, as appropriate, to incorporate the outcomes of the Commission into their work;",
    "21": "Requests the entities of the United Nations system to systematically and strategically incorporate the outcomes of the Commission on the Status of Women into their work, within their mandates, and, inter alia, to ensure effective support for the efforts of Member States towards the achievement of gender equality and the empowerment of women and girls, and in this regard encourages UN-Women to continue to use concrete results-based reporting mechanisms and to ensure coherence, consistency and coordination between the normative and operational aspects of its work;",
    "22": "Encourages States and all stakeholders to strengthen the mainstreaming of a gender perspective into all sectors and in all areas of development;",
    "23": "Reiterates its call upon the United Nations system, including the main organs, their main committees and subsidiary bodies, through forums such as the high-level political forum on sustainable development and functions such as the annual ministerial review and the Development Cooperation Forum of the Economic and Social Council and the funds and programmes and the specialized agencies, to increase efforts to fully mainstream a gender perspective into all issues under their consideration and within their mandates, as well as into all United Nations summits, conferences and special sessions and their follow-up processes;",
    "24": "Calls upon States to ensure that intergovernmental processes consistently address gender perspectives in their preparatory processes and outcomes;",
    "25": "Commits to intensifying efforts to further integrate a gender perspective into the work of the General Assembly, including in plenary and high-level meetings; Follow-up to the Fourth World Conference on Women and full implementation of the Beijing Declaration and Platform for Action and the outcome of the twenty-third special session of the General Assembly A/RES/76/142 9/11 21-19159",
    "26": "Encourages its Main Committees and subsidiary bodies, as well as the Economic and Social Council and its functional commissions, particularly in the light of the analysis contained in the report of the Secretary-General19 and of the cross- cutting nature of gender equality and the empowerment of women, to intensify their efforts to make further progress in the integration of a gender perspective into their work, including, as appropriate, into their resolutions within the respective mandates of the General Assembly and each of its Main Committees and subsidiary bodies and the Economic and Social Council and each of its functional commissions, and invites the Bureaux, as appropriate, to encourage such efforts;",
    "27": "Strongly encourages Governments to continue to support the role and contribution of civil society, in particular non-governmental organizations and women\u2019s organizations, in the full, effective and accelerated implementation of the Beijing Declaration and Platform for Action and the outcome of the twenty-third special session and in the gender-responsive implementation of the 2030 Agenda;",
    "28": "Calls upon Governments and the United Nations system to encourage women\u2019s groups and other non-governmental organizations specializing in gender equality and the empowerment of women to participate in intergovernmental processes, including through increased outreach, funding and capacity-building;",
    "29": "Calls upon the intergovernmental bodies of the United Nations system to systematically request the inclusion of a gender perspective in reports of the Secretary-General and other inputs to intergovernmental processes;",
    "30": "Requests that reports of the Secretary-General submitted to the General Assembly and the Economic and Social Council and their subsidiary bodies continue to systematically address gender perspectives through gender-sensitive analysis, the provision of data disaggregated by sex, age and disability and the reflection of the contribution of women and girls as agents of change and of the impact of proposed policies and programmes on gender equality and the empowerment of women and girls, and that conclusions and recommendations for further action address the different situations and needs of women and men and girls and boys in order to facilitate gender-responsive policy development, and in this regard requests the Secretary-General to convey the importance of reflecting a gender perspective to all stakeholders who provide input to his reports;",
    "31": "Encourages Member States, with the support of, as appropriate, United Nations entities, including UN-Women, international and regional organizations and other relevant actors, to prioritize the strengthening of national data collection and monitoring capacities with regard to statistics disaggregated by sex and age, as well as national tracking indicators for gender equality and the empowerment of women, through multisectoral efforts and partnerships;",
    "32": "Calls upon all parts of the United Nations system to continue to play an active role in ensuring the full, effective and accelerated implementation of the Beijing Declaration and Platform for Action and the outcome of the twenty-third special session through, inter alia, the maintenance of gender specialists in all entities of the United Nations system, as well as by ensuring that all personnel, especially those in the field, receive training and appropriate follow-up, including tools, guidance and support, for accelerated gender mainstreaming, and reaffirms the need to strengthen the capabilities of the United Nations system in the area of gender;",
    "33": "Commends the Secretary-General for his leadership and efforts towards creating an enabling working environment and accelerating progress towards the goal of 50/50 gender balance at all levels throughout the United Nations system, including __________________ 19 A/76/115. A/RES/76/142 Follow-up to the Fourth World Conference on Women and full implementation of the Beijing Declaration and Platform for Action and the outcome of the twenty-third special session of the General Assembly 21-19159 10/11 the goal of reaching parity at the highest levels by 2021 and at all levels throughout the United Nations system by 2028, as set out in his system-wide strategy on gender parity;",
    "34": "Also commends the Secretary-General for encouraging the entities of the United Nations to update and regularly monitor entity-specific implementation plans to achieve and maintain the goal of gender parity, and in this regard encourages UN-Women to continue to regularly report on the implementation of and progress made on gender parity through such plans;",
    "35": "Requests the Secretary-General to further accelerate his efforts to achieve the goal of 50/50 gender balance at all levels throughout the United Nations system, including in the field and in peacekeeping missions, with full respect for the principle of equitable geographical distribution, in conformity with Article 101, paragraph 3, of the Charter of the United Nations, considering, in particular, women from the developing and the least developed countries, countries with economies in transition and unrepresented or largely underrepresented Member States, and to ensure the implementation of measures with clear targets and timelines, including temporary special measures, as well as the strengthening of the implementation of policies and measures related to creating enabling working environments, including for work-life balance, and to prevent and address all forms of discrimination, racism, harassment, including sexual harassment, abuse of authority in the workplace and sexual exploitation and abuse, so as to accelerate progress, and managerial and departmental accountability, inter alia, through leadership compacts and performance appraisal systems, with respect to attaining gender parity within the shortest feasible period;",
    "36": "Requests the entities of the United Nations to closely monitor the impact of the coronavirus disease (COVID-19) pandemic on women personnel and their health and well-being, and share the information with UN-Women for its continued system-wide reporting on the improvement in the status of women;",
    "37": "Also requests the entities of the United Nations to strengthen efforts to prevent, address and eliminate sexual harassment, in full alignment with the work of the United Nations System Chief Executives Board for Coordination Task Force on Addressing Sexual Harassment within the Organizations of the United Nations System, apply a victim-centred approach to all forms of misconduct, as well as encourage the implementation of accountability mechanisms;",
    "38": "Calls upon the entities of the United Nations system to significantly increase their efforts towards achieving the goal of 50/50 gender balance in all locations, including at the United Nations country team level, through a comprehensive range of actions, inter alia, as outlined in the Secretary-General\u2019s system-wide strategy on gender parity, as well as the recommendations contained in the Enabling Environment Guidelines for the United Nations System and the Field- specific Enabling Environment Guidelines, to continue to collaborate with UN-Women and with the active support of system-wide gender focal points and to provide sufficient financial and human resources for organizational change and for overcoming identified impediments to progress on gender balance, including setbacks from the COVID-19 pandemic;",
    "39": "Requests the entities of the United Nations, at both headquarters and non-headquarters levels, to continue to appoint gender focal points to provide support for the advancement of gender parity, led and coordinated by UN-Women;",
    "40": "Strongly encourages Member States to identify and regularly submit more women candidates for appointment to positions in the United Nations system, especially at more senior, decision-making and policymaking levels, including in peacekeeping operations; Follow-up to the Fourth World Conference on Women and full implementation of the Beijing Declaration and Platform for Action and the outcome of the twenty-third special session of the General Assembly A/RES/76/142 11/11 21-19159",
    "41": "Encourages increased efforts by Governments and the United Nations system to enhance accountability for the implementation of commitments to gender equality and the empowerment of women at the international, regional, national and local levels, including through improved monitoring and reporting on progress in relation to policies, strategies, resource allocations and programmes and by achieving gender balance;",
    "42": "Reaffirms that Governments bear the primary responsibility for the achievement of gender equality and the empowerment of women and that international cooperation has an essential role in assisting developing countries in progressing towards the full implementation of the Beijing Declaration and Platform for Action;",
    "43": "Encourages the Secretary-General to bring to the attention of the United Nations system the findings of his reports in order to strengthen follow-up on these findings and to accelerate the implementation of the present resolution;",
    "44": "Requests the Secretary-General to provide an oral report to the Commission on the Status of Women at its sixty-sixth and sixty-seventh sessions and to report to the General Assembly at its seventy-eighth session on the improvement in the status of women in the United Nations system and on progress made and obstacles encountered in achieving gender balance, under the item entitled \u201cAdvancement of women\u201d;",
    "45": "Also requests the Secretary-General to report to the General Assembly at its seventy-eighth session, under the item entitled \u201cAdvancement of women\u201d, on the follow-up to and progress made in the implementation of the Beijing Declaration and Platform for Action and the outcome of the twenty-third special session. 53rd plenary meeting 16 December 2021"
  },
  "agenda_items": [
    "Item 29"
  ],
  "symbol_references": []
}