{
  "symbol": "A/RES/76/245",
  "filename": "A_RES_76_245.pdf",
  "title": "76/245. Questions relating to the proposed programme budget for 2022",
  "text": "United Nations \nA/RES/76/245\n \n \nGeneral Assembly \nDistr.: General \n6 January 2022 \n \n21-19712 (E)    070122     \n*2119712* \n \n \nSeventy-sixth session \nAgenda item 138 \nProposed programme budget for 2022 \n \n \n \n \n Resolution adopted by the General Assembly \non 24 December 2021 \n \n \n \n \n[on the report of the Fifth Committee (A/76/633, para. 60)] \n \n \n 76/245. Questions relating to the proposed programme budget for 2022 \n \n \n \nThe General Assembly, \n \nReaffirming its resolutions 41/213 of 19 December 1986, 42/211 of \n21 December 1987, 45/248 B, section VI, of 21 December 1990, 55/231 of \n23 December 2000, 56/253 of 24 December 2001, 58/269 and 58/270 of 23 December \n2003, 59/276, section XI, of 23 December 2004, 60/283 of 7 July 2006, 61/263 of \n4 April 2007, 62/236 of 22 December 2007, 63/262 of 24 December 2008, 64/243 of \n24 December 2009, 65/259 of 24 December 2010, 66/246 of 24 December 2011, \n68/246 of 27 December 2013, 70/247 of 23 December 2015, 71/272 A of 23 December \n2016, 72/261 and 72/266 A of 24 December 2017, 72/266 B of 5 July 2018, 73/281 \nof 22 December 2018, 74/262 of 27 December 2019, 75/252 and 75/253 A of \n31 December 2020, 75/253 B of 16 April 2021 and 75/253 C of 30 June 2021, \n \nReaffirming also the respective mandates of the Committee for Programme and \nCoordination and the Advisory Committee on Administrative and Budgetary \nQuestions in the consideration of the proposed programme budget, \n \nReaffirming further the role of the General Assembly, through the Fifth \nCommittee, in carrying out a thorough analysis and approval of posts and financial \nresources, as well as of human resources policies, \n \nExpressing deep concern about the detrimental effect of the withholding of \nassessed contributions on the administrative and financial functioning of the United \nNations and its ability to implement mandates and programmes, \n \nHaving considered the proposed programme budget for 2022,1 the report of the \nIndependent Audit Advisory Committee on internal oversight: proposed programme \n__________________ \n \n1 A/76/6 (Introduction), sects. 1\u201336, income sects. 1\u20133 and corrigenda. \n\nA/RES/76/245 \nQuestions relating to the proposed programme budget for 2022\n \n21-19712\n2/9 \n \nbudget for 20222 and the related report of the Advisory Committee on Administrative \nand Budgetary Questions,3 \n \nHaving also considered the report of the Office of Internal Oversight Services \non the audit of the activities, performance and results of staff support provided to the \nhuman rights treaty body system of the Office of the United Nations High \nCommissioner for Human Rights,4 \n \nHaving further considered the notes by the Secretary-General drawing attention \nto the reports of the Joint Inspection Unit entitled \u201cUnited Nations common premises: \ncurrent practices and future prospects\u201d5 and \u201cBlockchain applications in the United \nNations system: towards a state of readiness\u201d6 and the notes by the Secretary-General \ntransmitting his comments and those of the United Nations System Chief Executives \nBoard for Coordination thereon,7 \n \n1. \nReaffirms that the Fifth Committee is the appropriate Main Committee of \nthe General Assembly entrusted with responsibilities for administrative and budgetary \nmatters, and also reaffirms the role of the Fifth Committee in carrying out a thorough \nanalysis and approving human and financial resources and policies, with a view to \nensuring full, effective and efficient implementation of all mandated programmes and \nactivities and the implementation of policies in this regard; \n \n2. \nAlso reaffirms rule 153 of its rules of procedure; \n \n3. \nFurther reaffirms the Regulations and Rules Governing Programme \nPlanning, the Programme Aspects of the Budget, the Monitoring of Implementation \nand the Methods of Evaluation;8 \n \n4. \nReaffirms the established budgetary procedures and methodologies, based \non its resolutions 41/213 and 42/211; \n \n5. \nAlso reaffirms the Financial Regulations and Rules of the United Nations;9 \n \n6. \nFurther reaffirms its resolution 76/236 of 24 December 2021; \n \n7. \nEndorses the conclusions and recommendations contained in the report of \nthe Advisory Committee on Administrative and Budgetary Questions, subject to the \nprovisions of the present resolution; \n \n8. \nStresses that finance serves as a foundation of and an important element \nunderpinning United Nations governance; \n \n9. \nRecalls paragraph 8 of the report of the Advisory Committee, and requests \nthe Secretary-General to ensure the full, effective and efficient implementation of \nmandated programmes and activities; \n \n10. Emphasizes the importance of full implementation of the 2030 Agenda for \nSustainable Development,10 and notes with appreciation the efforts of the Secretary-\nGeneral to ensure adequate, sustainable and predictable resources for development, \nwith the aim of leaving no one behind; \n__________________ \n \n2 A/76/81. \n \n3 Official Records of the General Assembly, Seventy-sixth Session, Supplement No. 7 and \ncorrigendum (A/76/7 and A/76/7/Corr.1). \n \n4 A/76/197. \n \n5 A/75/730. \n \n6 A/76/325. \n \n7 A/75/730/Add.1 and A/76/325/Add.1. \n \n8 ST/SGB/2018/3. \n \n9 ST/SGB/2013/4 and ST/SGB/2013/4/Amend.1. \n \n10 Resolution 70/1. \n\nQuestions relating to the proposed programme budget for 2022 \nA/RES/76/245\n \n3/9\n21-19712 \n \n \n11. \nAlso emphasizes the importance of promoting sustainable development at \nthe global and regional levels in a balanced and integrated manner in order to tackle \ncurrent challenges and accelerate post-coronavirus disease (COVID-19) recovery, and \nlooks forward to the Secretariat and other United Nations bodies continuing to support \nefforts by Member States in this regard; \n \n12. Requests the Secretary-General to further report in the next budget \nperformance report on the impact of COVID-19 on the programme budget for 2021, \ndetailing the recorded budget variances and flexible working arrangements, and to \nfactor lessons learned for the working methods of the Secretariat, without prejudice \nto the work of intergovernmental bodies, into the next proposed programme budget; \n \n13. Urges all Member States to fulfil their financial obligations as set out in \nthe Charter of the United Nations on time, in full and without conditions; \n \n14. Encourages the Secretary-General to make every effort to facilitate \nMember States\u2019 payments of their assessed contributions; \n \n15. Recalls that adequate resources must be provided to ensure the effective \nand efficient delivery of mandates; \n \n16. Notes that organizational reforms should contribute to greater efficiency \nand effectiveness in delivering the Organization\u2019s mandated programmes and \nactivities without negatively affecting their full implementation, and requests the \nSecretary-General to provide results and examples in this regard in the context of his \nnext budget submission; \n \n17. Encourages the Secretary-General to continue to provide more budget-\nrelated information online and in supplementary documentation; \n \n18. Notes the increased size and volume of documentation that forms the \nproposed programme budget, and notes with appreciation that the Secretary-General \ncontinues his efforts to enhance the quality, clarity and usability of the proposed \nprogramme budget in consultation with Member States, while maintaining the level \nof information provided to Member States; \n \n19. Requests the Secretary-General to continue his efforts in producing more \nrealistic budget assumptions and accurate resource estimates, adapting faster to \nchanges in mandates and actual programme performance, with a view to ensuring a \ngreater focus on results and mandate delivery; \n \n20. Stresses that results-based budgeting and results-based management are \nmutually supportive management tools and that improved implementation of results-\nbased budgeting enhances both management and accountability in the Secretariat, and \nencourages the Secretary-General to continue his efforts in this regard; \n \n21. Emphasizes the importance of comprehensive budgetary performance in \nthe management of the programme plan and programme budget, and requests the \nSecretary-General to clearly link the budget inputs to tangible results; \n \n22. Requests the Secretary-General to include in future proposed programme \nbudgets the indicative cost estimates of major construction projects in the top-line \nbudget figure in the introductory section of the budget, for information purposes only; \n \n23. Reiterates the paramount importance of the equality of the six official \nlanguages of the United Nations, underlines that the COVID-19 pandemic has \nhampered the equal treatment of the six official languages, and requests the Secretary-\nGeneral to propose concrete measures to improve multilingualism in the next \nprogramme budget submission; \n\nA/RES/76/245 \nQuestions relating to the proposed programme budget for 2022\n \n21-19712\n4/9 \n \n \n24. Recalls paragraph 24 of the report of the Advisory Committee, and \nrequests the Secretary-General to continue to improve upon the common staff cost \nmethodology and improve the accuracy of common staff cost forecasts; \n \n25. Requests the Secretary-General to continue to strengthen internal controls \nin programme planning, budgeting, implementation, monitoring and evaluation, and \nreporting; \n \n26. Decides that a vacancy rate of 10 per cent for Professional staff and 9.2 per \ncent for General Service staff shall be used as a basis for the calculation of the budget \nfor 2022; \n \n27. Notes with concern that the current overall single vacancy rate by staff \ncategory for all sections is inflated and may have an impact on mandate delivery, and \nrequests the Secretary-General to bring the actual vacancy rate in the budget sections \nto the approved vacancy rate before applying it; \n \n28. Requests the Secretary-General to review those posts that have been vacant \nfor 24 months or longer and to propose either the retention with clear justification of \nneed or the abolishment of those posts in his next budget proposal; \n \n29. Decides that the staffing table for 2022 shall be as set out in the annex to \nthe present resolution; \n \n30. Also decides to reduce resources for consultants by 10 per cent; \n \n31. Further decides to reduce resources for travel of staff by 5 per cent; \n \n32. Takes note of paragraph 70 of the report of the Advisory Committee, and \ndecides not to reduce information and communications technology-related resources \nby 1 million United States dollars; \n \n33. Recalls paragraph 73 of the report of the Advisory Committee, and decides \nto further reduce resources proposed under supplies and materials by 5 per cent; \n \n34. Decides to reduce resources for general operating expenses by 0.1 per \ncent; \n \n35. Stresses that all extrabudgetary posts must be administered and managed \nwith the same rigour as regular budget posts; \n \n \n \nPart I \n \n \nOverall policymaking, direction and coordination \n \n \n \nSection 1 \n \n \nOverall policymaking, direction and coordination \n \n \n36. Takes note of paragraph I.15 of the report of the Advisory Committee, and \nrequests the Secretary-General to examine the need to reclassify the three posts, in \nclose consultation with the Advisory Committee, and to report thereon in the next \nbudget proposal; \n \n \n \nSection 2 \n \n \nGeneral Assembly and Economic and Social Council affairs and \nconference management \n \n \n37. Recalls paragraph 8 of its resolution 75/252, commends the increased \nthroughput productivity of the translation services across all duty stations and the \nachievements made by language staff to meet the revised workload standards, and in \nthis regard requests the Secretary-General to ensure adequate training and technical \nsupport in order to ensure equal treatment of all official languages; \n\nQuestions relating to the proposed programme budget for 2022 \nA/RES/76/245\n \n5/9\n21-19712 \n \n \n38. Decides to establish one post of Russian Interpreter (P-3) in New York; \n \n \n \nPart II \n \n \nPolitical affairs \n \n \n \nSection 3 \n \n \nPolitical affairs \n \n \n39. Notes the ongoing reforms of the United Nations, and requests the \nSecretary-General to ensure greater coordination and collaboration between the \nUnited Nations and regional and subregional entities, with the ultimate purpose of \ndelivering on the 2030 Agenda for Sustainable Development and Agenda 2063 of the \nAfrican Union; \n \n \n \nSection 5 \n \n \nPeacekeeping operations \n \n \n40. Recognizes the important role of peacekeeping and special political \nmissions at the national, subregional, regional and international levels, as appropriate, \nin maintaining peace and security in fulfilment of their mandates; \n \n41. Re-emphasizes the importance of improving the safety and security of \npeacekeepers and mission personnel, and requests the Secretary-General to fulfil the \nresponsibilities under relevant resolutions of the General Assembly and the Security \nCouncil to improve the safety and security of United Nations peacekeepers and \nmission personnel; \n \n \n \nPart III \n \n \nInternational justice and law \n \n \n \nSection 8 \n \n \nLegal affairs \n \n \n42. Takes note of paragraphs III.60, III.61 and III.62 of the report of the \nAdvisory Committee; \n \n43. Decides that regular budget resources for the International, Impartial and \nIndependent Mechanism to Assist in the Investigation and Prosecution of Persons \nResponsible for the Most Serious Crimes under International Law Committed in the \nSyrian Arab Republic since March 2011 under section 8, Legal affairs, for 2022 \namount to 17,159,700 dollars before recosting; \n \n \n \nPart IV \n \n \nInternational cooperation for development \n \n \n \nSection 9 \n \n \nEconomic and social affairs \n \n \n44. Takes note of paragraph IV.5 of the report of the Advisory Committee, and \ndecides to approve the reclassification of the post of Senior Programme Management \nOfficer, Forest Affairs (P-5) to Deputy Director, Forest Affairs (D-1); \n \n45. Decides to reclassify the P-4 post in the Programme on Ageing Unit to a \nP-5 post and establish a new P-3 post in the same unit; \n \n\nA/RES/76/245 \nQuestions relating to the proposed programme budget for 2022\n \n21-19712\n6/9 \n \n \n \nSection 10 \n \n \nLeast developed countries, landlocked developing countries and small island \ndeveloping States \n \n \n46. Takes note of paragraph IV.24 of the report of the Advisory Committee, \nand decides to establish one post of Associate Data Analyst (P-2) in the Office of the \nHigh Representative for the Least Developed Countries, Landlocked Developing \nCountries and Small Island Developing States; \n \n \n \nSection 11 \n \n \nUnited Nations support for the New Partnership for Africa\u2019s Development \n \n \n47. Recalls that the development of Africa is an established priority of the \nUnited Nations, and reaffirms its commitment to address the unique needs of Africa; \n \n48. Decides to establish one post of Data Analyst (P-3) under subprogramme 1, \nCoordination of global advocacy of and support for the New Partnership for Africa\u2019s \nDevelopment; \n \n \n \nSection 12 \n \n \nTrade and development \n \n \n49. Welcomes the adoption of the Bridgetown Covenant at the fifteenth session \nof the United Nations Conference on Trade and Development, on 7 October 2021, \ntakes note that, owing to its recent adoption, no provisions are included in the \nproposed programme budget for 2022 for implementation of the relevant mandates, \nand therefore requests the Secretary-General to include relevant proposals for \nimplementation of the Covenant in the next proposed programme budget; \n \n \n \nSection 15 \n \n \nHuman settlements \n \n \n50. Takes note of paragraph IV.124 of the report of the Advisory Committee; \n \n \n \nPart V \n \n \nRegional cooperation for development \n \n \n \nSection 18 \n \n \nEconomic and social development in Africa \n \n \n51. Takes note of paragraph V.3 of the report of the Advisory Committee, \ndecides not to abolish the two posts (P-3 and P-4) under programme support in the \nEconomic Commission for Africa, and requests the Secretary-General to expedite and \nfinalize the recruitment process; \n \n \n \nSection 20 \n \n \nEconomic development in Europe \n \n \n52. Approves the proposal of the Secretary-General for non-post resources; \n \n \n \nPart VI \n \n \nHuman rights and humanitarian affairs \n \n \n \nSection 24 \n \n \nHuman rights \n \n \n53. Takes note of paragraph VI.20 of the report of the Advisory Committee; \n \n\nQuestions relating to the proposed programme budget for 2022 \nA/RES/76/245\n \n7/9\n21-19712 \n \n \n \nSection 26 \n \n \nPalestine refugees \n \n \n54. Calls upon the United Nations Relief and Works Agency for Palestine \nRefugees in the Near East to further enhance its internal governance and oversight \nmechanisms to ensure that its management is delivering on the Agency\u2019s mandate \nwith transparency and accountability, while preserving the Agency\u2019s agility and \noperational response capacity, and to provide an update on progress made in its next \nbudget submission; \n \n55. Decides to approve resources at the Secretary-General level; \n \n \n \nSection 27 \n \n \nHumanitarian assistance \n \n \n56. Requests the Secretary-General to explore strengthening his collaboration \nwith regional and subregional organizations, where appropriate, to support \nhumanitarian work; \n \n \n \nPart VII \n \n \nGlobal communications \n \n \n \nSection 28 \n \n \nGlobal communications \n \n \n57. Encourages the Secretary-General to continue to explore liaising with \nregional and subregional organizations in Africa so as to increase knowledge and \nawareness of the opportunities and activities of the United Nations; \n \n58. Decides to abolish one General Service (Other level) post and one P-3 post \nunder subprogramme 1, Strategic communications services, that have been vacant for \nmore than two years; \n \n \n \nPart VIII \n \n \nCommon support services \n \n \n \nSection 29A \n \n \nDepartment of Management Strategy, Policy and Compliance \n \n \n59. Takes note of paragraph VIII.17 of the report of the Advisory Committee, \nand decides to reduce resources under contractual services related to training by \n363,300 dollars; \n \n \n \nSection 29B \n \n \nDepartment of Operational Support \n \n \n60. Decides to abolish one General Service (Other level) post that has been \nvacant for more than two years; \n \n \n \nSection 29E \n \n \nAdministration, Geneva \n \n \n61. Takes note of paragraph VIII.83 (c) of the report of the Advisory \nCommittee, and approves the proposal of the Secretary-General for non-post \nresources; \n \n \n \nSection 29G \n \n \nAdministration, Nairobi \n \n \n62. Takes note of paragraph VIII.140 of the report of the Advisory Committee; \n\nA/RES/76/245 \nQuestions relating to the proposed programme budget for 2022\n \n21-19712\n8/9 \n \n \n \nPart IX \n \n \nInternal oversight \n \n \n \nSection 30 \n \n \nInternal oversight \n \n \n63. Takes note of paragraph IX.8 of the report of the Advisory Committee, and \ndecides to establish one post of Deputy Director (D-1) and one post of Evaluation \nOfficer (P-4) under subprogramme 2, Inspection and evaluation; \n \n \n \nPart XI \n \n \nCapital expenditures \n \n \n \nSection 33 \n \n \nConstruction, alteration, improvement and major maintenance \n \n \n64. Decides to further reduce resources for alteration, improvement and major \nmaintenance projects by 200,000 dollars; \n \n65. Takes note of paragraph XI.20 of the report of the Advisory Committee, \nand decides to reduce the provision under section 33 for the United Nations Office at \nGeneva by 5 per cent; \n \n66. Also takes note of paragraph XI.22 of the report of the Advisory \nCommittee; \n \n67. Further takes note of paragraph XI.23 of the report of the Advisory \nCommittee; \n \n \n \nPart XIII \n \n \nDevelopment Account \n \n \n \nSection 35 \n \n \nDevelopment account \n \n \n68. Decides to increase, on a non-recurrent basis, the Development Account \nfor 2022 by 1 million dollars. \n \n54th (resumed) plenary meeting \n24 December 2021 \n \n \n \n Annex \n \n Staffing table for 2022 \n \n \nCategory \nNumber of posts \nExpenditure sections \n \nProfessional and higher \n \nDeputy Secretary-General \n1 \nUnder-Secretary-General \n36 \nAssistant Secretary-General \n33 \nD-2 \n114 \nD-1 \n304 \nP-5 \n911 \nP-4 \n1 568 \nP-3 \n1 485 \n\nQuestions relating to the proposed programme budget for 2022 \nA/RES/76/245\n \n9/9\n21-19712 \n \nCategory \nNumber of posts \nP-2/1 \n530 \nSubtotal \n4 982 \nGeneral Service and related \n \nPrincipal level \n272 \nOther level \n2 279 \nSubtotal \n2 551 \nOther \n \nSecurity Service \n306 \nLocal level \n1 901 \nField Service \n106 \nNational Professional Officer \n88 \nTrades and Crafts \n93 \nSubtotal \n2 494 \nExpenditure sections total \n10 027 \nIncome section 3 \n \nProfessional and higher \n \nP-5 \n2 \nP-4 \n4 \nP-3 \n4 \nP-2/1 \n3 \nSubtotal \n13 \nGeneral Service and related \n \nPrincipal level \n7 \nOther level \n42 \nSubtotal \n49 \nOther \n \nSecurity Service \n2 \nSubtotal \n2 \nIncome section 3 total \n64 \nTotal \n10 091 \n \n \n",
  "paragraphs": {
    "1": "Reaffirms that the Fifth Committee is the appropriate Main Committee of the General Assembly entrusted with responsibilities for administrative and budgetary matters, and also reaffirms the role of the Fifth Committee in carrying out a thorough analysis and approving human and financial resources and policies, with a view to ensuring full, effective and efficient implementation of all mandated programmes and activities and the implementation of policies in this regard;",
    "2": "Also reaffirms rule 153 of its rules of procedure;",
    "3": "Further reaffirms the Regulations and Rules Governing Programme Planning, the Programme Aspects of the Budget, the Monitoring of Implementation and the Methods of Evaluation;8",
    "4": "Reaffirms the established budgetary procedures and methodologies, based on its resolutions 41/213 and 42/211;",
    "5": "Also reaffirms the Financial Regulations and Rules of the United Nations;9",
    "6": "Further reaffirms its resolution 76/236 of 24 December 2021;",
    "7": "Endorses the conclusions and recommendations contained in the report of the Advisory Committee on Administrative and Budgetary Questions, subject to the provisions of the present resolution;",
    "8": "Stresses that finance serves as a foundation of and an important element underpinning United Nations governance;",
    "9": "Recalls paragraph 8 of the report of the Advisory Committee, and requests the Secretary-General to ensure the full, effective and efficient implementation of mandated programmes and activities;",
    "10": "Emphasizes the importance of full implementation of the 2030 Agenda for Sustainable Development,10 and notes with appreciation the efforts of the Secretary- General to ensure adequate, sustainable and predictable resources for development, with the aim of leaving no one behind;",
    "11": "Also emphasizes the importance of promoting sustainable development at the global and regional levels in a balanced and integrated manner in order to tackle current challenges and accelerate post-coronavirus disease (COVID-19) recovery, and looks forward to the Secretariat and other United Nations bodies continuing to support efforts by Member States in this regard;",
    "12": "Requests the Secretary-General to further report in the next budget performance report on the impact of COVID-19 on the programme budget for 2021, detailing the recorded budget variances and flexible working arrangements, and to factor lessons learned for the working methods of the Secretariat, without prejudice to the work of intergovernmental bodies, into the next proposed programme budget;",
    "13": "Urges all Member States to fulfil their financial obligations as set out in the Charter of the United Nations on time, in full and without conditions;",
    "14": "Encourages the Secretary-General to make every effort to facilitate Member States\u2019 payments of their assessed contributions;",
    "15": "Recalls that adequate resources must be provided to ensure the effective and efficient delivery of mandates;",
    "16": "Notes that organizational reforms should contribute to greater efficiency and effectiveness in delivering the Organization\u2019s mandated programmes and activities without negatively affecting their full implementation, and requests the Secretary-General to provide results and examples in this regard in the context of his next budget submission;",
    "17": "Encourages the Secretary-General to continue to provide more budget- related information online and in supplementary documentation;",
    "18": "Notes the increased size and volume of documentation that forms the proposed programme budget, and notes with appreciation that the Secretary-General continues his efforts to enhance the quality, clarity and usability of the proposed programme budget in consultation with Member States, while maintaining the level of information provided to Member States;",
    "19": "Requests the Secretary-General to continue his efforts in producing more realistic budget assumptions and accurate resource estimates, adapting faster to changes in mandates and actual programme performance, with a view to ensuring a greater focus on results and mandate delivery;",
    "20": "Stresses that results-based budgeting and results-based management are mutually supportive management tools and that improved implementation of results- based budgeting enhances both management and accountability in the Secretariat, and encourages the Secretary-General to continue his efforts in this regard;",
    "21": "Emphasizes the importance of comprehensive budgetary performance in the management of the programme plan and programme budget, and requests the Secretary-General to clearly link the budget inputs to tangible results;",
    "22": "Requests the Secretary-General to include in future proposed programme budgets the indicative cost estimates of major construction projects in the top-line budget figure in the introductory section of the budget, for information purposes only;",
    "23": "",
    "24": "Recalls paragraph 24 of the report of the Advisory Committee, and requests the Secretary-General to continue to improve upon the common staff cost methodology and improve the accuracy of common staff cost forecasts;",
    "25": "Requests the Secretary-General to continue to strengthen internal controls in programme planning, budgeting, implementation, monitoring and evaluation, and reporting;",
    "26": "Decides that a vacancy rate of 10 per cent for Professional staff and 9.2 per cent for General Service staff shall be used as a basis for the calculation of the budget for 2022;",
    "27": "Notes with concern that the current overall single vacancy rate by staff category for all sections is inflated and may have an impact on mandate delivery, and requests the Secretary-General to bring the actual vacancy rate in the budget sections to the approved vacancy rate before applying it;",
    "28": "Requests the Secretary-General to review those posts that have been vacant for 24 months or longer and to propose either the retention with clear justification of need or the abolishment of those posts in his next budget proposal;",
    "29": "Decides that the staffing table for 2022 shall be as set out in the annex to the present resolution;",
    "30": "Also decides to reduce resources for consultants by 10 per cent;",
    "31": "Further decides to reduce resources for travel of staff by 5 per cent;",
    "32": "Takes note of paragraph 70 of the report of the Advisory Committee, and decides not to reduce information and communications technology-related resources by 1 million United States dollars;",
    "33": "Recalls paragraph 73 of the report of the Advisory Committee, and decides to further reduce resources proposed under supplies and materials by 5 per cent;",
    "34": "Decides to reduce resources for general operating expenses by 0.1 per cent;",
    "35": "Stresses that all extrabudgetary posts must be administered and managed with the same rigour as regular budget posts; Part I Overall policymaking, direction and coordination Section 1 Overall policymaking, direction and coordination",
    "36": "Takes note of paragraph I.15 of the report of the Advisory Committee, and requests the Secretary-General to examine the need to reclassify the three posts, in close consultation with the Advisory Committee, and to report thereon in the next budget proposal; Section 2 General Assembly and Economic and Social Council affairs and conference management",
    "37": "",
    "38": "Decides to establish one post of Russian Interpreter (P-3) in New York; Part II Political affairs Section 3 Political affairs",
    "39": "Notes the ongoing reforms of the United Nations, and requests the Secretary-General to ensure greater coordination and collaboration between the United Nations and regional and subregional entities, with the ultimate purpose of delivering on the 2030 Agenda for Sustainable Development and Agenda 2063 of the African Union; Section 5 Peacekeeping operations",
    "40": "Recognizes the important role of peacekeeping and special political missions at the national, subregional, regional and international levels, as appropriate, in maintaining peace and security in fulfilment of their mandates;",
    "41": "Re-emphasizes the importance of improving the safety and security of peacekeepers and mission personnel, and requests the Secretary-General to fulfil the responsibilities under relevant resolutions of the General Assembly and the Security Council to improve the safety and security of United Nations peacekeepers and mission personnel; Part III International justice and law Section 8 Legal affairs",
    "42": "Takes note of paragraphs III.60, III.61 and III.62 of the report of the Advisory Committee;",
    "43": "Decides that regular budget resources for the International, Impartial and Independent Mechanism to Assist in the Investigation and Prosecution of Persons Responsible for the Most Serious Crimes under International Law Committed in the Syrian Arab Republic since March 2011 under section 8, Legal affairs, for 2022 amount to 17,159,700 dollars before recosting; Part IV International cooperation for development Section 9 Economic and social affairs",
    "44": "Takes note of paragraph IV.5 of the report of the Advisory Committee, and decides to approve the reclassification of the post of Senior Programme Management Officer, Forest Affairs (P-5) to Deputy Director, Forest Affairs (D-1);",
    "45": " Section 10 Least developed countries, landlocked developing countries and small island developing States",
    "46": "Takes note of paragraph IV.24 of the report of the Advisory Committee, and decides to establish one post of Associate Data Analyst (P-2) in the Office of the High Representative for the Least Developed Countries, Landlocked Developing Countries and Small Island Developing States; Section 11 United Nations support for the New Partnership for Africa\u2019s Development",
    "47": "Recalls that the development of Africa is an established priority of the United Nations, and reaffirms its commitment to address the unique needs of Africa;",
    "48": "Decides to establish one post of Data Analyst (P-3) under subprogramme 1, Coordination of global advocacy of and support for the New Partnership for Africa\u2019s Development; Section 12 Trade and development",
    "49": "Welcomes the adoption of the Bridgetown Covenant at the fifteenth session of the United Nations Conference on Trade and Development, on 7 October 2021, takes note that, owing to its recent adoption, no provisions are included in the proposed programme budget for 2022 for implementation of the relevant mandates, and therefore requests the Secretary-General to include relevant proposals for implementation of the Covenant in the next proposed programme budget; Section 15 Human settlements",
    "50": "Takes note of paragraph IV.124 of the report of the Advisory Committee; Part V Regional cooperation for development Section 18 Economic and social development in Africa",
    "51": "Takes note of paragraph V.3 of the report of the Advisory Committee, decides not to abolish the two posts (P-3 and P-4) under programme support in the Economic Commission for Africa, and requests the Secretary-General to expedite and finalize the recruitment process; Section 20 Economic development in Europe",
    "52": "Approves the proposal of the Secretary-General for non-post resources; Part VI Human rights and humanitarian affairs Section 24 Human rights",
    "53": " Section 26 Palestine refugees",
    "54": "Calls upon the United Nations Relief and Works Agency for Palestine Refugees in the Near East to further enhance its internal governance and oversight mechanisms to ensure that its management is delivering on the Agency\u2019s mandate with transparency and accountability, while preserving the Agency\u2019s agility and operational response capacity, and to provide an update on progress made in its next budget submission;",
    "55": "Decides to approve resources at the Secretary-General level; Section 27 Humanitarian assistance",
    "56": "Requests the Secretary-General to explore strengthening his collaboration with regional and subregional organizations, where appropriate, to support humanitarian work; Part VII Global communications Section 28 Global communications",
    "57": "Encourages the Secretary-General to continue to explore liaising with regional and subregional organizations in Africa so as to increase knowledge and awareness of the opportunities and activities of the United Nations;",
    "58": "Decides to abolish one General Service (Other level) post and one P-3 post under subprogramme 1, Strategic communications services, that have been vacant for more than two years; Part VIII Common support services Section 29A Department of Management Strategy, Policy and Compliance",
    "59": "Takes note of paragraph VIII.17 of the report of the Advisory Committee, and decides to reduce resources under contractual services related to training by 363,300 dollars; Section 29B Department of Operational Support",
    "60": "Decides to abolish one General Service (Other level) post that has been vacant for more than two years; Section 29E Administration, Geneva",
    "61": "Takes note of paragraph VIII.83 (c) of the report of the Advisory Committee, and approves the proposal of the Secretary-General for non-post resources; Section 29G Administration, Nairobi",
    "62": " Part IX Internal oversight Section 30 Internal oversight",
    "63": "Takes note of paragraph IX.8 of the report of the Advisory Committee, and decides to establish one post of Deputy Director (D-1) and one post of Evaluation Officer (P-4) under subprogramme 2, Inspection and evaluation; Part XI Capital expenditures Section 33 Construction, alteration, improvement and major maintenance",
    "64": "Decides to further reduce resources for alteration, improvement and major maintenance projects by 200,000 dollars;",
    "65": "Takes note of paragraph XI.20 of the report of the Advisory Committee, and decides to reduce the provision under section 33 for the United Nations Office at Geneva by 5 per cent;",
    "66": "Also takes note of paragraph XI.22 of the report of the Advisory Committee;",
    "67": "Further takes note of paragraph XI.23 of the report of the Advisory Committee; Part XIII Development Account Section 35 Development account",
    "68": " Category Number of posts P-2/1 530 Subtotal 4 982 General Service and related Principal level 272 Other level 2 279 Subtotal 2 551 Other Security Service 306 Local level 1 901 Field Service 106 National Professional Officer 88 Trades and Crafts 93 Subtotal 2 494 Expenditure sections total 10 027 Income section 3 Professional and higher P-5 2 P-4 4 P-3 4 P-2/1 3 Subtotal 13 General Service and related Principal level 7 Other level 42 Subtotal 49 Other Security Service 2 Subtotal 2 Income section 3 total 64 Total 10 091"
  },
  "agenda_items": [
    "Item 138"
  ],
  "symbol_references": []
}