{
  "symbol": "A/RES/78/274",
  "filename": "A_RES_78_274.pdf",
  "title": "78/274. Revised estimates relating to the programme budget for 2024 under section 3, Political affairs, and section 36, Staff assessment: special political missions \u2013 thematic cluster III: regional offices, offices in support of political processes and other missions \u2013 United Nations Integrated Transition Assistance Mission in the Sudan",
  "text": "United Nations \nA/RES/78/274\n \n \nGeneral Assembly \nDistr.: General \n1 May 2024 \n \n24-07847 (E)    070524 \n*2407847* \n \n \nSeventy-eighth session \nAgenda item 134 \nProgramme budget for 2024 \n \n \n \n \n Resolution adopted by the General Assembly \non 24 April 2024 \n \n \n \n \n[on the report of the Fifth Committee (A/78/662/Add.1, para. 15)] \n \n \n 78/274. Revised estimates relating to the programme budget for 2024 under \nsection 3, Political affairs, and section 36, Staff assessment: special \npolitical missions \u2013 thematic cluster III: regional offices, offices in \nsupport of political processes and other missions \u2013 United Nations \nIntegrated Transition Assistance Mission in the Sudan \n \n \n \nThe General Assembly, \n \nHaving considered the report of the Secretary-General1 and the related report of \nthe Advisory Committee on Administrative and Budgetary Questions,2  \n \n1. \nTakes note of the report of the Secretary-General;  \n \n2. \nEndorses the conclusions and recommendations contained in the report of \nthe Advisory Committee on Administrative and Budgetary Questions;  \n \n3. \nApproves resources in the amount of 22,162,600 United States dollars for \nthe transition and liquidation of the United Nations Integrated Transition Assistance \nMission in the Sudan, which would supersede the commitment authority in the amount \nof 21,500,000 dollars approved, with assessment, by the General Assembly in \nsection XVII, paragraph 4, of its resolution 78/253 of 22 December 2023 and \nparagraph 2 of its resolution 78/254 C of 22 December 2023;  \n \n4. \nAppropriates an additional amount of 22,162,600 dollars under section 3, \nPolitical affairs, of the programme budget for 2024;  \n \n5. \nAlso appropriates an additional amount of 1,021,400 dollars under \nsection 36, Staff assessment, to be offset by an equivalent amount under income \nsection 1, Income from staff assessment, of the programme budget for 2024. \n \n73rd plenary meeting \n24 April 2024 \n__________________ \n \n1 A/78/6 (Sect. 3)/Add.8.  \n \n2 A/78/7/Add.44. \n",
  "paragraphs": {
    "1": "Takes note of the report of the Secretary-General;",
    "2": "Endorses the conclusions and recommendations contained in the report of the Advisory Committee on Administrative and Budgetary Questions;",
    "3": "Approves resources in the amount of 22,162,600 United States dollars for the transition and liquidation of the United Nations Integrated Transition Assistance Mission in the Sudan, which would supersede the commitment authority in the amount of 21,500,000 dollars approved, with assessment, by the General Assembly in section XVII, paragraph 4, of its resolution 78/253 of 22 December 2023 and paragraph 2 of its resolution 78/254 C of 22 December 2023;",
    "4": "Appropriates an additional amount of 22,162,600 dollars under section 3, Political affairs, of the programme budget for 2024;",
    "5": "Also appropriates an additional amount of 1,021,400 dollars under section 36, Staff assessment, to be offset by an equivalent amount under income section 1, Income from staff assessment, of the programme budget for 2024. 73rd plenary meeting 24 April 2024 __________________ 1 A/78/6 (Sect. 3)/Add.8. 2 A/78/7/Add.44."
  },
  "agenda_items": [
    "Item 134"
  ],
  "symbol_references": []
}