{
  "symbol": "A/RES/75/128",
  "filename": "A_RES_75_128.pdf",
  "title": "75/128. Graduation of Vanuatu from the least developed country category",
  "text": "United Nations \nA/RES/75/128\n \n \nGeneral Assembly \nDistr.: General \n21 December 2020 \n \n20-17075 (E)    231220 \n*2017075* \n \n \nSeventy-fifth session \nAgenda item 9 \nReport of the Economic and Social Council \n \n \n \n \n Resolution adopted by the General Assembly \non 14 December 2020 \n \n \n \n \n[without reference to a Main Committee (A/75/L.14/Rev.1 and \nA/75/L.14/Rev.1/Add.1)] \n \n \n 75/128. Graduation of Vanuatu from the least developed country category \n \n \n \nThe General Assembly, \n \nRecalling its resolutions 59/209 of 20 December 2004, 67/221 of 21 December \n2012, 68/18 of 4 December 2013 and 70/78 of 9 December 2015,  \n \nReaffirming its commitment to the process of graduation from least developed \ncountry status and to encouraging smooth transition measures for graduating \ncountries beyond graduation and towards achieving sustainable development and the \n2030 Agenda for Sustainable Development,1 \n \nGiving due consideration to the destruction caused on the northern islands of \nVanuatu in early April 2020 by Cyclone Harold, the second category-5 storm to hit \nthe country in five years, adding to the immense challenges of rebuilding that Vanuatu \nhas been facing, \n \nNoting with concern the negative consequences for the vulnerable small island \ndeveloping economy of Vanuatu due to the closure of its borders, under a state of \nemergency, aimed at keeping the coronavirus disease (COVID-19) at bay, \n \nInviting the international community to continue to generously support the \nrehabilitation and disaster preparedness efforts undertaken by the Government of \nVanuatu as well as its recovery plan,  \n \n1. \nCommends the commitment of Vanuatu to graduate from the category of \nleast developed countries on 4 December 2020, and in this regard welcomes the \nadoption by the Government of the Vanuatu smooth transition strategy; \n__________________ \n \n1 Resolution 70/1. \n\nA/RES/75/128 \nGraduation of Vanuatu from the least developed country category\n \n20-17075\n2/2 \n \n \n2. \nExpresses its deep concern at the severe consequences for Vanuatu of both \nCyclone Harold in early April 2020 and the closure of its borders due to the \nCOVID-19 pandemic; \n \n3. \nInvites bilateral, regional and multilateral development and trading \npartners to provide full support to the implementation of the Vanuatu smooth \ntransition strategy, including by extending international support measures, in \nparticular those related to trade, as appropriate, aid for trade and participation in \ninternational forums, until 4 December 2025; \n \n4. \nUnderlines the exceptional nature of this decision, taken in the context of \nthe unique disruption caused to the economic and social progress of Vanuatu by \nCyclone Harold and the COVID-19 pandemic. \n \n44th plenary meeting \n14 December 2020 \n \n \n",
  "paragraphs": {
    "1": "Commends the commitment of Vanuatu to graduate from the category of least developed countries on 4 December 2020, and in this regard welcomes the adoption by the Government of the Vanuatu smooth transition strategy; __________________ 1 Resolution 70/1. A/RES/75/128 Graduation of Vanuatu from the least developed country category 20-17075 2/2",
    "2": "Expresses its deep concern at the severe consequences for Vanuatu of both Cyclone Harold in early April 2020 and the closure of its borders due to the COVID-19 pandemic;",
    "3": "Invites bilateral, regional and multilateral development and trading partners to provide full support to the implementation of the Vanuatu smooth transition strategy, including by extending international support measures, in particular those related to trade, as appropriate, aid for trade and participation in international forums, until 4 December 2025;",
    "4": "Underlines the exceptional nature of this decision, taken in the context of the unique disruption caused to the economic and social progress of Vanuatu by Cyclone Harold and the COVID-19 pandemic. 44th plenary meeting 14 December 2020"
  },
  "agenda_items": [
    "Item 9"
  ],
  "symbol_references": [
    "A/75/L.14"
  ]
}