{
  "symbol": "A/RES/80/136",
  "filename": "A_RES_80_136.pdf",
  "title": "80/136. Follow-up to and implementation of the Antigua and Barbuda Agenda for Small Island Developing States: A Renewed Declaration for Resilient Prosperity",
  "text": "United Nations \nA/RES/80/136\n \nGeneral Assembly \nDistr.: General \n18 December 2025 \n25-20752 (E) \n*2520752* \n \n \nEightieth session \nAgenda item 18 (b) \nSustainable development: follow-up to and implementation of \nthe Antigua and Barbuda Agenda for Small Island Developing \nStates: A Renewed Declaration for Resilient Prosperity \n \n \n \n \n Resolution adopted by the General Assembly \non 15 December 2025 \n \n \n[on the report of the Second Committee (A/80/555, para. 7)] \n \n \n 80/136. Follow-up to and implementation of the Antigua and Barbuda \nAgenda for Small Island Developing States: A Renewed \nDeclaration for Resilient Prosperity \n \n \n \nThe General Assembly, \n \nReaffirming the Antigua and Barbuda Agenda for Small Island Developing \nStates: A Renewed Declaration for Resilient Prosperity, 1  which sets out the \nsustainable development priorities of small island developing States and which will \nguide the international community\u2019s collaboration and partnership with small island \ndeveloping States over the next decade,  \n \nReaffirming also the continued applicability of the SIDS Accelerated Modalities \nof Action (SAMOA) Pathway,2 the Mauritius Strategy for the Further Implementation \nof the Programme of Action for the Sustainable Development of Small Island \nDeveloping States 3  and the Barbados Programme of Action for the Sustainable \nDevelopment of Small Island Developing States, 4  and noting that, despite the \nconsiderable progress small island developing States have made over the past three \ndecades, the vision of these programmes of action remains unmet,  \n_______________ \n \n1 Resolution 78/317, annex. \n \n2 Resolution 69/15, annex. \n \n3 Report of the International Meeting to Review the Implementation of the Programme of Action \nfor the Sustainable Development of Small Island Developing States, Port Louis, Mauritius, \n10\u201314 January 2005 (United Nations publication, Sales No. E.05.II.A.4 and corrigendum), \nchap. I, resolution 1, annex II. \n \n4 Report of the Global Conference on the Sustainable Development of Small Island Developing \nStates, Bridgetown, Barbados, 25 April\u20136 May 1994 (United Nations publication, Sales No. E.94.I.18 \nand corrigenda), chap. I, resolution 1, annex II. \n\nA/RES/80/136 \nFollow-up to and implementation of the Antigua and Barbuda \nAgenda for Small Island Developing States: A Renewed \nDeclaration for Resilient Prosperity\n \n25-20752\n2/7 \n \n \nRecognizing that the Antigua and Barbuda Agenda for Small Island Developing \nStates is consistent with the 2030 Agenda for Sustainable Development, 5 the Addis \nAbaba Action Agenda of the Third International Conference on Financing for \nDevelopment,6 the Sevilla Commitment of the Fourth International Conference on \nFinancing For Development,7 the United Nations Framework Convention on Climate \nChange8 and the Paris Agreement,9 as well as the Sendai Framework for Disaster Risk \nReduction 2015\u20132030,10 the New Urban Agenda11 and the Kunming-Montreal Global \nBiodiversity Framework, 12  and that implementation of the Antigua and Barbuda \nAgenda for Small Island Developing States will enable small island developing States \nto make progress towards these agendas,  \n \nWelcoming the convening of the Fourth International Conference on Financing \nfor Development from 30 June to 3 July 2025 in Sevilla, Spain, and reaffirming its \noutcome document, the Sevilla Commitment, endorsed by the General Assembly in \nits resolution 79/323 of 25 August 2025, which sets forth a renewed global framework \nfor financing for development, building on the 2015 Addis Ababa Action Agenda, 13 \nto close with urgency the estimated annual 4 trillion United States dollar financing \ngap, 14  and catalyse sustainable development investments at scale in developing \ncountries and continue the reform of the international financial architecture through \ncontinued and strong commitment to multilateralism, international cooperation, and \nglobal solidarity,  \n \nReaffirming that small island developing States remain a special case for \nsustainable development due to their unique vulnerability to exogenous shocks owing \nto, inter alia, their small size, geographical remoteness, highly dispersed populations, \nthe limited scale and undiversified nature of their economies, high dependence on \nexternal markets, and extreme exposure to disasters and natural hazards and the \neffects of climate change,  \n \nNoting with concern that, owing in part to their vulnerabilities to the ongoing \nnegative impacts of multiple crises, in particular environmental challenges and \nexternal economic and financial shocks, small island developing States have not \nachieved sustained high levels of economic growth, which has fallen from 4.5 per \ncent in 2022 to approximately 3.8 per cent in 2024, and while their external debt and \npublic debt sustainability improved slightly in 2024 to 19.6 per cent and 17.6 per cent \nrespectively, the total external debt of small island developing States reached \n1.2 billion dollars, a 2.7 per cent increase, with total debt service increasing by \n31.4 per cent as a result of principal repayments due in 2023,  \n \nAcknowledging the need for urgent action to address the adverse impacts of \nclimate change, including those related to sea level rise and extreme weather events, \nwhich continue to pose a significant risk to small island developing States and to their \nefforts to achieve sustainable development,  \n \nNoting the importance of oceans, seas and marine resources to small island \ndeveloping States, owing to their unique characteristics, dependence on and particular \n_______________ \n \n5 Resolution 70/1. \n \n6 Resolution 69/313, annex. \n \n7 Resolution 79/323, annex. \n \n8 United Nations, Treaty Series, vol. 1771, No. 30822. \n \n9 Adopted under the UNFCCC in FCCC/CP/2015/10/Add.1, decision 1/CP.21. \n \n10 Resolution 69/283, annex II. \n \n11 Resolution 71/256, annex. \n \n12 United Nations Environment Programme, document CBD/COP/15/17, decision 15/4, annex. \n \n13 General Assembly resolution 69/313, annex. \n \n14 Financing for Sustainable Development Report 2024 (United Nations publication, 2024), \nfigure I.1. \n\nFollow-up to and implementation of the Antigua and Barbuda \nAgenda for Small Island Developing States: A Renewed \nDeclaration for Resilient Prosperity \nA/RES/80/136\n \n3/7\n25-20752 \n \nexposure to the ocean and its biodiversity, and noting also the central role of the ocean \nin the culture, livelihoods and sustainable development of the peoples of small island \ndeveloping States,  \n \nNoting with concern the uneven progress towards achieving sustainable \ndevelopment and that, with five years remaining to implement the 2030 Agenda, small \nisland developing States, which are inherently and uniquely vulnerable, are off track \nto achieve the Sustainable Development Goals, and therefore reaffirming the \naspiration of small island developing States to achieve a resilient form of prosperity, \nwhere economic growth and well-being are sustained and their economies are robust, \ndiversified, adaptable and able to withstand shocks, ensuring social equity and \npromoting environmental sustainability,  \n \nAcknowledging the importance of advancing small island developing States\u2019 \npriorities in all relevant United Nations conferences and processes, including the \nsessions of the Conference of the Parties to the United Nations Framework \nConvention on Climate Change, including the thirtieth session of the Conference of \nthe Parties to the United Nations Framework Convention on Climate Change, the \ntwentieth session of the Conference of the Parties serving as the Meeting of the Parties \nto the Kyoto Protocol and the seventh session of the Conference of the Parties serving \nas the Meeting of the Parties to the Paris Agreement, held in Belem, Brazil, from 10 to \n21 November 2025, and the meetings of the Conference of the Parties to the United \nNations Convention on Biological Diversity, including the seventeenth meeting of the \nConference of the Parties to the Convention on Biological Diversity, to be held in \nYerevan from 19 to 30 October 2026, the 2026 United Nations Water Conference to \nAccelerate the Implementation of Sustainable Development Goal 6: Ensure \navailability and sustainable management of water and sanitation for all, co\u2011hosted by \nSenegal and the United Arab Emirates, to be held in the United Arab Emirates from 2 \nto 4 December 2026, and the 2028 United Nations Conference on the Final \nComprehensive Review of the Implementation of the Objectives of the International \nDecade for Action, \u201cWater for Sustainable Development\u201d, 2018\u20132028, to be hosted \nby Tajikistan, and noting the convening of the intergovernmental negotiating \ncommittee to develop an international legally binding instrument on plastic pollution, \nincluding in the marine environment,  \n \nRecalling its resolution 79/203 of 19 December 2024,  \n \n1. \nTakes note of the report of the Secretary-General;15 \n \n2. \nCalls for the full, timely and effective implementation of the Antigua and \nBarbuda Agenda for Small Island Developing States: A Renewed Declaration for \nResilient Prosperity;  \n \n3. \nTakes note with appreciation of the call to action on mobilization of \nresources for small island developing States16 and its call on leaders of international \nfinancial institutions, development banks, United Nations entities, the private sector \nand donor partners to take concerted and urgent action to enable small island \ndeveloping States to finance implementation of the Antigua and Barbuda Agenda for \nSmall Island Developing States;  \n \n4. \nCalls upon the international community to take urgent and concrete action \nto address the vulnerabilities of small island developing States and to continue to seek \nsolutions to the major challenges facing them in a concerted manner, in line with their \n_______________ \n \n15 A/80/411. \n \n16 Launched by the Secretary-General of the United Nations and the Prime Minister of Antigua and \nBarbuda on 28 May 2024 in Antigua and Barbuda. \n\nA/RES/80/136 \nFollow-up to and implementation of the Antigua and Barbuda \nAgenda for Small Island Developing States: A Renewed \nDeclaration for Resilient Prosperity\n \n25-20752\n4/7 \n \ncommitments to support the implementation of the Antigua and Barbuda Agenda for \nSmall Island Developing States;  \n \n5. \nEncourages the international and regional financial institutions and other \nmultilateral development partners to incorporate the priorities of small island \ndeveloping States, as outlined in the Antigua and Barbuda Agenda for Small Island \nDeveloping States and the Sevilla Commitment, into their relevant strategic and \nprogrammatic documents, in line with their respective mandates, and to ensure \nrepresentation and participation of small island developing States, as well as other \ndeveloping countries, in decision-making in their institutions;  \n \n6. \nWelcomes the outcome document of the Fourth International Conference \non Financing for Development, the Sevilla Commitment, and calls for its timely and \neffective implementation;  \n \n7. \nCalls upon the relevant entities of the United Nations development system \nto ensure the mainstreaming of the Antigua and Barbuda Agenda for Small Island \nDeveloping States and issues related to small island developing States in their work, \nincluding at the national, regional and global levels, and to continue to support small \nisland developing States, upon their request, in addressing their particular economic, \nsocial and environmental vulnerabilities, as outlined in the Antigua and Barbuda \nAgenda for Small Island Developing States, by strengthening technical assistance \ninitiatives, policy guidance and programme development, in line with their respective \nmandates and in cooperation with relevant institutions, funds and facilities;  \n \n8. \nUnderlines the need to give due consideration to the issues and concerns \nof small island developing States in all relevant major United Nations conferences \nand processes and the relevant work of the United Nations development system, and \ncalls for the elaboration of information specific to small island developing States in a \ndisaggregated manner in all major United Nations reports, where appropriate; \n \n9. \nWelcomes the convening of the 2025 United Nations Conference to \nSupport the Implementation of Sustainable Development Goal 14: Conserve and \nsustainably use the oceans, seas and marine resources for sustainable development, \nco-hosted by Costa Rica and France, held in Nice, France, from 9 to 13 June 2025, at \nwhich its political declaration17 was adopted; \n \n10. Also welcomes the progress on the operationalization of the Centre of \nExcellence,18 and reiterates the call for the Centre to collaborate with universities, \nacademic institutions, regional organizations and the private sector to avoid \nduplication and ensure coordinated and coherent support for small island developing \nStates;  \n \n11. \nInvites the United Nations system, international and regional financial \ninstitutions, development partners and the private sector to contribute technical \nassistance, capacity-building and expertise, as well as financial resources, to support \nthe operationalization of the Centre of Excellence;  \n \n12. Invites the international community to support the operationalization of \nthe Centre\u2019s dedicated small island developing States debt sustainability support \nservice to enable sound debt management and devise effective solutions for small \nisland developing States in relation to debt vulnerability in the immediate term and \n_______________ \n \n17 Resolution 79/314, annex. \n \n18 The Centre of Excellence includes a small island developing States data hub, a technology and \ninnovation mechanism and an Island Investment Forum, and the global small island developing \nStates debt sustainability support service. \n\nFollow-up to and implementation of the Antigua and Barbuda \nAgenda for Small Island Developing States: A Renewed \nDeclaration for Resilient Prosperity \nA/RES/80/136\n \n5/7\n25-20752 \n \ndebt sustainability in the long term, building on and avoiding duplication with \nrelevant dedicated initiatives;  \n \n13. Endorses the monitoring and evaluation framework of the Antigua and \nBarbuda Agenda for Small Island Developing States, developed by the inter-agency \ntask force, as a voluntary and country-led instrument that should promote national \nownership of the Agenda;  \n \n14. Encourages small island developing States to utilize the monitoring and \nevaluation framework for reporting progress, on a voluntary basis, on the \nimplementation of the Antigua and Barbuda Agenda for Small Island Developing \nStates, and in this regard reiterates the call on the Department of Economic and Social \nAffairs of the Secretariat and the Office of the High Representative for the Least \nDeveloped Countries, Landlocked Developing Countries and Small Island \nDeveloping States to conduct workshops to familiarize small island developing States \nwith the application of the framework and build capacity to collect and submit their \ndata;  \n \n15. Welcomes the progress on establishing a coordination mechanism for the \nAtlantic, Indian Ocean and South China Sea small island developing States to support \nthe implementation of the Antigua and Barbuda Agenda for Small Island Developing \nStates, at the high-level meeting of small island developing States of the Atlantic, \nIndian Ocean and South China Sea, held in Praia on 15 and 16 May 2025, and looks \nforward to the early establishment of the Atlantic, Indian Ocean and South China Sea \nsmall island developing States coordination mechanism;  \n \n16. Reiterates the request to the Economic and Social Commission for Asia \nand the Pacific and the Economic Commission for Africa to establish dedicated small \nisland developing States divisions, within existing resources, to coordinate \nmonitoring, evaluation and reporting for the Atlantic, Indian Ocean and South China \nSea small island developing States, in accordance with paragraph 41 of the Antigua \nand Barbuda Agenda for Small Island Developing States;  \n \n17. Continues to be concerned about the transition challenges encountered by \nsmall island developing States that have graduated or are about to graduate, including \nfrom least developed country status, reiterates that graduation must not disrupt a \ncountry\u2019s development progress, and stresses the need for the development and \nimplementation of a viable multiannual transition strategy to facilitate each small \nisland developing State\u2019s graduation, with the support of the international community \nwhere appropriate, to mitigate against, inter alia, the possible loss of concessionary \nfinancing, to reduce the risks of falling heavily into debt and to ensure macrofinancial \nstability;  \n \n18. Welcomes the adoption of resolution 78/322 of 13 August 2024 on the \nmultidimensional vulnerability index, calls for the full and effective implementation \nof its mandate, and in this regard notes that small island developing States look \nforward to participating in the piloting of the index, and encourages the participation \nof other interested developing countries as well;  \n \n19. Also welcomes the upcoming entry into force on 17 January 2026 of the \nAgreement under the United Nations Convention on the Law of the Sea on the \nConservation and Sustainable Use of Marine Biological Diversity of Areas beyond \nNational Jurisdiction,19 and in this regard recalls the commitment in the Antigua and \nBarbuda Agenda for Small Island Developing States to support small island \n_______________ \n \n19 A/CONF.232/2023/4. \n\nA/RES/80/136 \nFollow-up to and implementation of the Antigua and Barbuda \nAgenda for Small Island Developing States: A Renewed \nDeclaration for Resilient Prosperity\n \n25-20752\n6/7 \n \ndeveloping States in building their capacity to ratify and implement the provisions of \nthe Agreement;  \n \n20. Notes with appreciation the Partnership for Action on small island \ndeveloping States between the Development Assistance Committee of the \nOrganisation for Economic Co-operation and Development and the Alliance of Small \nIsland States launched at the Fourth International Conference on Small Island \nDeveloping States aimed at delivering solutions to some priority areas for small island \ndeveloping States, and encourages other new, innovative and bold approaches to \npartnership to support the implementation of the Antigua and Barbuda Agenda for \nSmall Island Developing States;  \n \n21. Takes note with appreciation of the recommendations for the strengthening \nof the Small Island Developing States Partnership Framework and the inputs on \nstrengthening the Small Island Developing States Global Business Network and its \nForum, and in this regard:  \n \n(a) \nReaffirms the important role of the Small Island Developing States \nPartnership Framework and the Steering Committee on Partnerships for Small Island \nDeveloping States, in line with resolution 70/202 of 22 December 2015 and the \nAntigua and Barbuda Agenda for Small Island Developing States;  \n \n(b) \nEncourages the Steering Committee to increase its stakeholder \nengagement and awareness of the Small Island Developing States Partnership \nFramework, as appropriate, including exploring the designation of Small Island \nDeveloping State Partnership champions to raise awareness of and advocacy for \npartnerships aligned with the Antigua and Barbuda Agenda for Small Island \nDeveloping States;  \n \n(c) \nAlso encourages small island developing State-led national and regional \nmulti-stakeholder dialogues to identify gaps, opportunities and challenges in building \npartnerships aligned with the Antigua and Barbuda Agenda for Small Island \nDeveloping States, promote best practices and foster knowledge exchange;  \n \n(d) \nInvites the Steering Committee to consider measures to enhance the value \nand impact of the Global Multi-stakeholder Small Island Developing States \nPartnership Dialogue to better align with the priorities of the Antigua and Barbuda \nAgenda for Small Island Developing States and provide more targeted opportunities \nfor engagement, sharing of experiences and catalysing new partnerships;  \n \n(e) \nRequests the Secretary-General to strengthen Secretariat support for the \nimplementation of the Small Island Developing States Partnership Framework, \nincluding through the allocation of sufficient resources;  \n \n(f) \nInvites the Office of the High Representative for the Least Developed \nCountries, Landlocked Developing Countries and Small Island Developing States to \nfurther analyse the inputs on strengthening the Small Island Developing States Global \nBusiness Network and its Forum and to present concrete proposals for the \nconsideration of the General Assembly;  \n \n22. Reiterates the request to the Secretary-General, beginning from 2026, to \nsubmit an annual report to the Economic and Social Council, and to the subsequent \nsession of the General Assembly, on the follow-up to and implementation of the \nAntigua and Barbuda Agenda for Small Island Developing States, including on \nprogress made and continuing challenges faced, for their further consideration;  \n \n23. Also reiterates the request to the Secretary-General, within his annual \nreport to the Economic and Social Council and to the General Assembly at its eighty-\nfirst session on the implementation of the Antigua and Barbuda Agenda for Small \n\nFollow-up to and implementation of the Antigua and Barbuda \nAgenda for Small Island Developing States: A Renewed \nDeclaration for Resilient Prosperity \nA/RES/80/136\n \n7/7\n25-20752 \n \nIsland Developing States, to present proposals to ensure a coordinated, coherent and \neffective United Nations system-wide capacity development approach to small island \ndeveloping States and to enhance the implementation, monitoring and evaluation of \nthe Antigua and Barbuda Agenda for Small Island Developing States, including a \npotential single entity dedicated to small island developing States in the Secretariat;  \n \n24. Requests the Secretary-General to submit to the General Assembly at its \neighty-first session a report on the follow-up to and implementation of the Antigua \nand Barbuda Agenda for Small Island Developing States, including on progress made \nand continuing challenges faced, and on the implementation of the present resolution;  \n \n25. Decides to include in the provisional agenda of its eighty-first session, \nunder the item entitled \u201cSustainable development\u201d, the sub-item entitled \u201cFollow-up \nto and implementation of the Antigua and Barbuda Agenda for Small Island \nDeveloping States: A Renewed Declaration for Resilient Prosperity\u201d.  \n \n64th plenary meeting \n15 December 2025 \n \n",
  "paragraphs": {
    "1": "Takes note of the report of the Secretary-General;15",
    "2": "Calls for the full, timely and effective implementation of the Antigua and Barbuda Agenda for Small Island Developing States: A Renewed Declaration for Resilient Prosperity;",
    "3": "Takes note with appreciation of the call to action on mobilization of resources for small island developing States16 and its call on leaders of international financial institutions, development banks, United Nations entities, the private sector and donor partners to take concerted and urgent action to enable small island developing States to finance implementation of the Antigua and Barbuda Agenda for Small Island Developing States;",
    "4": "Calls upon the international community to take urgent and concrete action to address the vulnerabilities of small island developing States and to continue to seek solutions to the major challenges facing them in a concerted manner, in line with their commitments to support the implementation of the Antigua and Barbuda Agenda for Small Island Developing States;",
    "5": "Encourages the international and regional financial institutions and other multilateral development partners to incorporate the priorities of small island developing States, as outlined in the Antigua and Barbuda Agenda for Small Island Developing States and the Sevilla Commitment, into their relevant strategic and programmatic documents, in line with their respective mandates, and to ensure representation and participation of small island developing States, as well as other developing countries, in decision-making in their institutions;",
    "6": "Welcomes the outcome document of the Fourth International Conference on Financing for Development, the Sevilla Commitment, and calls for its timely and effective implementation;",
    "7": "Calls upon the relevant entities of the United Nations development system to ensure the mainstreaming of the Antigua and Barbuda Agenda for Small Island Developing States and issues related to small island developing States in their work, including at the national, regional and global levels, and to continue to support small island developing States, upon their request, in addressing their particular economic, social and environmental vulnerabilities, as outlined in the Antigua and Barbuda Agenda for Small Island Developing States, by strengthening technical assistance initiatives, policy guidance and programme development, in line with their respective mandates and in cooperation with relevant institutions, funds and facilities;",
    "8": "Underlines the need to give due consideration to the issues and concerns of small island developing States in all relevant major United Nations conferences and processes and the relevant work of the United Nations development system, and calls for the elaboration of information specific to small island developing States in a disaggregated manner in all major United Nations reports, where appropriate;",
    "9": "Welcomes the convening of the 2025 United Nations Conference to Support the Implementation of Sustainable Development Goal 14: Conserve and sustainably use the oceans, seas and marine resources for sustainable development, co-hosted by Costa Rica and France, held in Nice, France, from 9 to 13 June 2025, at which its political declaration17 was adopted;",
    "10": "Also welcomes the progress on the operationalization of the Centre of Excellence,18 and reiterates the call for the Centre to collaborate with universities, academic institutions, regional organizations and the private sector to avoid duplication and ensure coordinated and coherent support for small island developing States;",
    "11": "Invites the United Nations system, international and regional financial institutions, development partners and the private sector to contribute technical assistance, capacity-building and expertise, as well as financial resources, to support the operationalization of the Centre of Excellence;",
    "12": "Invites the international community to support the operationalization of the Centre\u2019s dedicated small island developing States debt sustainability support service to enable sound debt management and devise effective solutions for small island developing States in relation to debt vulnerability in the immediate term and debt sustainability in the long term, building on and avoiding duplication with relevant dedicated initiatives;",
    "13": "Endorses the monitoring and evaluation framework of the Antigua and Barbuda Agenda for Small Island Developing States, developed by the inter-agency task force, as a voluntary and country-led instrument that should promote national ownership of the Agenda;",
    "14": "Encourages small island developing States to utilize the monitoring and evaluation framework for reporting progress, on a voluntary basis, on the implementation of the Antigua and Barbuda Agenda for Small Island Developing States, and in this regard reiterates the call on the Department of Economic and Social Affairs of the Secretariat and the Office of the High Representative for the Least Developed Countries, Landlocked Developing Countries and Small Island Developing States to conduct workshops to familiarize small island developing States with the application of the framework and build capacity to collect and submit their data;",
    "15": "Welcomes the progress on establishing a coordination mechanism for the Atlantic, Indian Ocean and South China Sea small island developing States to support the implementation of the Antigua and Barbuda Agenda for Small Island Developing States, at the high-level meeting of small island developing States of the Atlantic, Indian Ocean and South China Sea, held in Praia on 15 and 16 May 2025, and looks forward to the early establishment of the Atlantic, Indian Ocean and South China Sea small island developing States coordination mechanism;",
    "16": "Reiterates the request to the Economic and Social Commission for Asia and the Pacific and the Economic Commission for Africa to establish dedicated small island developing States divisions, within existing resources, to coordinate monitoring, evaluation and reporting for the Atlantic, Indian Ocean and South China Sea small island developing States, in accordance with paragraph 41 of the Antigua and Barbuda Agenda for Small Island Developing States;",
    "17": "Continues to be concerned about the transition challenges encountered by small island developing States that have graduated or are about to graduate, including from least developed country status, reiterates that graduation must not disrupt a country\u2019s development progress, and stresses the need for the development and implementation of a viable multiannual transition strategy to facilitate each small island developing State\u2019s graduation, with the support of the international community where appropriate, to mitigate against, inter alia, the possible loss of concessionary financing, to reduce the risks of falling heavily into debt and to ensure macrofinancial stability;",
    "18": "Welcomes the adoption of resolution 78/322 of 13 August 2024 on the multidimensional vulnerability index, calls for the full and effective implementation of its mandate, and in this regard notes that small island developing States look forward to participating in the piloting of the index, and encourages the participation of other interested developing countries as well;",
    "19": "Also welcomes the upcoming entry into force on 17 January 2026 of the Agreement under the United Nations Convention on the Law of the Sea on the Conservation and Sustainable Use of Marine Biological Diversity of Areas beyond National Jurisdiction,19 and in this regard recalls the commitment in the Antigua and Barbuda Agenda for Small Island Developing States to support small island developing States in building their capacity to ratify and implement the provisions of the Agreement;",
    "20": "Notes with appreciation the Partnership for Action on small island developing States between the Development Assistance Committee of the Organisation for Economic Co-operation and Development and the Alliance of Small Island States launched at the Fourth International Conference on Small Island Developing States aimed at delivering solutions to some priority areas for small island developing States, and encourages other new, innovative and bold approaches to partnership to support the implementation of the Antigua and Barbuda Agenda for Small Island Developing States;",
    "21": "Takes note with appreciation of the recommendations for the strengthening of the Small Island Developing States Partnership Framework and the inputs on strengthening the Small Island Developing States Global Business Network and its Forum, and in this regard: (a) Reaffirms the important role of the Small Island Developing States Partnership Framework and the Steering Committee on Partnerships for Small Island Developing States, in line with resolution 70/202 of 22 December 2015 and the Antigua and Barbuda Agenda for Small Island Developing States; (b) Encourages the Steering Committee to increase its stakeholder engagement and awareness of the Small Island Developing States Partnership Framework, as appropriate, including exploring the designation of Small Island Developing State Partnership champions to raise awareness of and advocacy for partnerships aligned with the Antigua and Barbuda Agenda for Small Island Developing States; (c) Also encourages small island developing State-led national and regional multi-stakeholder dialogues to identify gaps, opportunities and challenges in building partnerships aligned with the Antigua and Barbuda Agenda for Small Island Developing States, promote best practices and foster knowledge exchange; (d) Invites the Steering Committee to consider measures to enhance the value and impact of the Global Multi-stakeholder Small Island Developing States Partnership Dialogue to better align with the priorities of the Antigua and Barbuda Agenda for Small Island Developing States and provide more targeted opportunities for engagement, sharing of experiences and catalysing new partnerships; (e) Requests the Secretary-General to strengthen Secretariat support for the implementation of the Small Island Developing States Partnership Framework, including through the allocation of sufficient resources; (f) Invites the Office of the High Representative for the Least Developed Countries, Landlocked Developing Countries and Small Island Developing States to further analyse the inputs on strengthening the Small Island Developing States Global Business Network and its Forum and to present concrete proposals for the consideration of the General Assembly;",
    "22": "Reiterates the request to the Secretary-General, beginning from 2026, to submit an annual report to the Economic and Social Council, and to the subsequent session of the General Assembly, on the follow-up to and implementation of the Antigua and Barbuda Agenda for Small Island Developing States, including on progress made and continuing challenges faced, for their further consideration;",
    "23": " Island Developing States, to present proposals to ensure a coordinated, coherent and effective United Nations system-wide capacity development approach to small island developing States and to enhance the implementation, monitoring and evaluation of the Antigua and Barbuda Agenda for Small Island Developing States, including a potential single entity dedicated to small island developing States in the Secretariat;",
    "24": "Requests the Secretary-General to submit to the General Assembly at its eighty-first session a report on the follow-up to and implementation of the Antigua and Barbuda Agenda for Small Island Developing States, including on progress made and continuing challenges faced, and on the implementation of the present resolution;",
    "25": "Decides to include in the provisional agenda of its eighty-first session, under the item entitled \u201cSustainable development\u201d, the sub-item entitled \u201cFollow-up to and implementation of the Antigua and Barbuda Agenda for Small Island Developing States: A Renewed Declaration for Resilient Prosperity\u201d."
  },
  "agenda_items": [
    "Item 18"
  ],
  "symbol_references": []
}