{
  "symbol": "A/RES/72/68",
  "filename": "A_RES_72_68.pdf",
  "title": "72/68. Convention on Prohibitions or Restrictions on the Use of Certain Conventional Weapons Which May Be Deemed to Be Excessively Injurious or to Have Indiscriminate Effects",
  "text": "United Nations \nA/RES/72/68\n \n \nGeneral Assembly \nDistr.: General \n13 December 2017 \n \n17-21810 (E)    151217 \n*1721810* \n \n \nSeventy-second session \nAgenda item 103 \n \n \n \n \n Resolution adopted by the General Assembly \non 4 December 2017 \n \n \n \n \n[on the report of the First Committee (A/72/413)] \n \n \n \n72/68. Convention on Prohibitions or Restrictions on the Use of Certain \nConventional Weapons Which May Be Deemed to Be Excessively \nInjurious or to Have Indiscriminate Effects  \n \n \n \nThe General Assembly,  \n \nRecalling its resolution 71/84 of 5 December 2016,  \n \nRecalling with satisfaction the adoption and entry into force of the Convention \non Prohibitions or Restrictions on the Use of Certain Conventional Weapons Which \nMay Be Deemed to Be Excessively Injurious or to Have Indiscriminate Effects 1 and \nits amended article 1,2 the Protocol on Non-Detectable Fragments (Protocol I),1 the \nProtocol on Prohibitions or Restrictions on the Use of Mines, Booby Traps and \nOther Devices (Protocol II)1 and its amended version,3 the Protocol on Prohibitions \nor Restrictions on the Use of Incendiary Weapons (Protocol III),1 the Protocol on \nBlinding Laser Weapons (Protocol IV)4 and the Protocol on Explosive Remnants of \nWar (Protocol V),5  \n \nWelcoming the results of the Fifth Review Conference of the High Contracting \nParties to the Convention, held in Geneva from 12 to 16 December 2016,  \n \nWelcoming also the results of the Eighteenth Annual Conference of the High \nContracting Parties to Amended Protocol II, held in Geneva on 30 August 2016,  \n \nWelcoming further the results of the Tenth Conference of the High Contracting \nParties to Protocol V, held in Geneva on 29 August 2016,  \n \nRegretting that in 2017 the Meeting of the Group of Experts of the High \nContracting Parties to Amended Protocol II, the Meeting of Experts of the High \n__________________ \n \n1  United Nations, Treaty Series, vol. 1342, No. 22495.  \n \n2  Ibid., vol. 2260, No. 22495.  \n \n3  Ibid., vol. 2048, No. 22495.  \n \n4  Ibid., vol. 2024, No. 22495. \n \n5  Ibid., vol. 2399, No. 22495.  \n\nA/RES/72/68 \nConvention on Prohibitions or Restrictions on the Use of Certain Conventional Weapons \nWhich May Be Deemed to Be Excessively Injurious or to Have Indiscriminate Effects\n \n17-21810 \n2/4 \n \nContracting Parties to Protocol V and the first session of the Group of \nGovernmental Experts related to emerging technologies in the area of lethal \nautonomous weapons systems of the High Contracting Parties to the Convention \ncould not take place owing to lack of adequate funding to hold all meetings, and \nnoting the importance of addressing issues arising from the outstanding dues of \nHigh Contracting Parties and participating States and from the financial and \naccounting practices recently implemented by the United Nations,  \n \nRecalling the role played by the International Committee of the Red Cross in \nthe elaboration of the Convention and the Protocols thereto, and welcoming the \nparticular efforts of various international, non-governmental and other organizations \nin raising awareness of the humanitarian consequences of various categories of \nconventional weapons which may be deemed to be excessively injurious or to have \nindiscriminate effects,  \n \n1. \nCalls upon all States that have not yet done so to take all measures to \nbecome parties, as soon as possible, to the Convention on Prohibitions or \nRestrictions on the Use of Certain Conventional Weapons Which May Be Deemed \nto Be Excessively Injurious or to Have Indiscriminate Effects 1 and the Protocols \nthereto, as amended, with a view to achieving the widest possible adherence to these \ninstruments at an early date and so as to ultimately achieve their universality;  \n \n2. \nCalls upon all High Contracting Parties to the Convention that have not \nyet done so to express their consent to be bound by the Protocols to the Convention \nand the amendment extending the scope of the Convention and the Protocols thereto \nto include armed conflicts of a non-international character;  \n \n3. \nEmphasizes the importance of the universalization of the Protocol on \nExplosive Remnants of War (Protocol V);5  \n \n4. \nWelcomes the additional ratifications and acceptances of or accessions to \nthe Convention, as well as the consents to be bound by the Protocols thereto;  \n \n5. \nAcknowledges the continued efforts of the Secretary-General, as \ndepositary of the Convention and the Protocols thereto, and of the respective office \nholders of the conferences of the High Contracting Parties to the Convention, \nProtocol V and Amended Protocol II, on behalf of the High Contracting Parties, to \nachieve the goal of universality;  \n \n6. \nRecalls the following decisions by the Fifth Review Conference of the \nHigh Contracting Parties to the Convention:  \n \n(a) \nTo establish an open-ended Group of Governmental Experts related to \nemerging technologies in the area of lethal autonomous weapons systems in the \ncontext of the objectives and purposes of the Convention, adhering to the agreed \nrecommendations contained in document CCW/CONF.V/2, and to submit a report to \nthe 2017 Meeting of the High Contracting Parties to the Convention consistent with \nthose recommendations;  \n \n(b) \nTo add to the agenda of the next Meeting of the High Contracting Parties \nin 2017 the item \u201cProtocol III\u201d;  \n \n(c) \nTo add to the agenda of the next Meeting of the High Contracting Parties \nin 2017 the item \u201cMines other than anti-personnel mines\u201d;  \n \n(d) \nTo add to the agenda of the next Meeting of the High Contracting Parties \nin 2017 the item for informal discussion \u201cConsideration of how developments in the \nfield of science and technology relevant to the Convention may be addressed under \nthe Convention\u201d;  \n\nConvention on Prohibitions or Restrictions on the Use of Certain Conventional Weapons \nWhich May Be Deemed to Be Excessively Injurious or to Have Indiscriminate Effects \nA/RES/72/68\n \n3/4 \n17-21810 \n \n \n(e) \nTo invite the Chairperson-elect to conduct consultations with a view to \nincluding on the agenda of the 2017 annual Meeting of the High Contracting Parties \nthe item \u201cStrengthening the respect for international humanitarian law and \naddressing, in the context and objectives of the Convention and its annexed \nProtocols, the challenges presented by the use of conventional weapons in armed \nconflicts and their impact on civilians, particularly in areas where there are \nconcentrations of civilians\u201d;  \n \n(f) \nTo include on the agenda of the annual Meetings of the High Contracting \nParties the item \u201cFinancial issues related to the Convention and its annexed \nProtocols\u201d and to consider at the next such meeting efficiency and cost-saving \nmeasures and a report to be prepared by the Chairperson-elect;  \n \n(g) \nTo retain the practice of keeping summary records only for the final \nsessions of the future Review Conferences, the meetings of the High Contracting \nParties to the Convention, and the Conferences of the High Contracting Parties to \nAmended Protocol II and Protocol V;  \n \n(h) \nTo continue the Sponsorship Programme;  \n \n7. \nWelcomes the commitment by High Contracting Parties to continue to \ncontribute to the further development of international humanitarian law and in this \ncontext to keep under review both the development of new weapons and uses of \nweapons, which may have indiscriminate effects or cause unnecessary suffering;  \n \n8. \nCalls upon all High Contracting Parties to ensure full and prompt \ncompliance with their financial obligations under the Convention and its annexed \nProtocols;  \n \n9. \nAlso calls upon all High Contracting Parties to explore options to \nimprove the financial situation and ways to ensure financial stability for the \noperation of the Convention and its annexed Protocols;  \n \n10. Welcomes the commitment of High Contracting Parties to Protocol V to \nthe effective and efficient implementation of the Protocol and the implementation of \nthe decisions of the First and Second Conferences of the High Contracting Parties to \nthe Protocol establishing a comprehensive framework for the exchange of \ninformation and cooperation;  \n \n11. \nNotes that, in conformity with article 8 of the Convention, conferences \nmay be convened to examine amendments to the Convention or to any of the \nProtocols thereto, to examine additional protocols concerning other categories of \nconventional weapons not covered by existing Protocols or to review the scope and \napplication of the Convention and the Protocols thereto and to examine any \nproposed amendments or additional protocols;  \n \n12. Acknowledges the work of the Implementation Support Unit within the \nGeneva Branch of the Office for Disarmament Affairs of the Secretariat, which was \nestablished following a decision by the 2009 Meeting of the High Contracting \nParties to the Convention;  \n \n13. Requests the Secretary-General to render the assistance necessary and to \nprovide such services as may be required for the annual conferences and expert \nmeetings of the High Contracting Parties to the Convention and of the High \nContracting Parties to Amended Protocol II and Protocol V, as well as for any \ncontinuation of the work after the meetings;  \n \n14. Also requests the Secretary-General, in his capacity as depositary of the \nConvention and the Protocols thereto, to continue to inform the General Assembly \n\nA/RES/72/68 \nConvention on Prohibitions or Restrictions on the Use of Certain Conventional Weapons \nWhich May Be Deemed to Be Excessively Injurious or to Have Indiscriminate Effects\n \n17-21810 \n4/4 \n \nperiodically, by electronic means, of ratifications and acceptances of and accessions \nto the Convention, its amended article 12 and the Protocols;  \n \n15. Decides to include in the provisional agenda of its seventy-third session \nthe item entitled \u201cConvention on Prohibitions or Restrictions on the Use of Certain \nConventional Weapons Which May Be Deemed to Be Excessively Injurious or to \nHave Indiscriminate Effects\u201d.  \n \n62nd plenary meeting  \n4 December 2017 \n \n",
  "paragraphs": {
    "1": "Calls upon all States that have not yet done so to take all measures to become parties, as soon as possible, to the Convention on Prohibitions or Restrictions on the Use of Certain Conventional Weapons Which May Be Deemed to Be Excessively Injurious or to Have Indiscriminate Effects 1 and the Protocols thereto, as amended, with a view to achieving the widest possible adherence to these instruments at an early date and so as to ultimately achieve their universality;",
    "2": "Calls upon all High Contracting Parties to the Convention that have not yet done so to express their consent to be bound by the Protocols to the Convention and the amendment extending the scope of the Convention and the Protocols thereto to include armed conflicts of a non-international character;",
    "3": "Emphasizes the importance of the universalization of the Protocol on Explosive Remnants of War (Protocol V);5",
    "4": "Welcomes the additional ratifications and acceptances of or accessions to the Convention, as well as the consents to be bound by the Protocols thereto;",
    "5": "Acknowledges the continued efforts of the Secretary-General, as depositary of the Convention and the Protocols thereto, and of the respective office holders of the conferences of the High Contracting Parties to the Convention, Protocol V and Amended Protocol II, on behalf of the High Contracting Parties, to achieve the goal of universality;",
    "6": " (e) To invite the Chairperson-elect to conduct consultations with a view to including on the agenda of the 2017 annual Meeting of the High Contracting Parties the item \u201cStrengthening the respect for international humanitarian law and addressing, in the context and objectives of the Convention and its annexed Protocols, the challenges presented by the use of conventional weapons in armed conflicts and their impact on civilians, particularly in areas where there are concentrations of civilians\u201d; (f) To include on the agenda of the annual Meetings of the High Contracting Parties the item \u201cFinancial issues related to the Convention and its annexed Protocols\u201d and to consider at the next such meeting efficiency and cost-saving measures and a report to be prepared by the Chairperson-elect; (g) To retain the practice of keeping summary records only for the final sessions of the future Review Conferences, the meetings of the High Contracting Parties to the Convention, and the Conferences of the High Contracting Parties to Amended Protocol II and Protocol V; (h) To continue the Sponsorship Programme;",
    "7": "Welcomes the commitment by High Contracting Parties to continue to contribute to the further development of international humanitarian law and in this context to keep under review both the development of new weapons and uses of weapons, which may have indiscriminate effects or cause unnecessary suffering;",
    "8": "Calls upon all High Contracting Parties to ensure full and prompt compliance with their financial obligations under the Convention and its annexed Protocols;",
    "9": "Also calls upon all High Contracting Parties to explore options to improve the financial situation and ways to ensure financial stability for the operation of the Convention and its annexed Protocols;",
    "10": "Welcomes the commitment of High Contracting Parties to Protocol V to the effective and efficient implementation of the Protocol and the implementation of the decisions of the First and Second Conferences of the High Contracting Parties to the Protocol establishing a comprehensive framework for the exchange of information and cooperation;",
    "11": "Notes that, in conformity with article 8 of the Convention, conferences may be convened to examine amendments to the Convention or to any of the Protocols thereto, to examine additional protocols concerning other categories of conventional weapons not covered by existing Protocols or to review the scope and application of the Convention and the Protocols thereto and to examine any proposed amendments or additional protocols;",
    "12": "Acknowledges the work of the Implementation Support Unit within the Geneva Branch of the Office for Disarmament Affairs of the Secretariat, which was established following a decision by the 2009 Meeting of the High Contracting Parties to the Convention;",
    "13": "Requests the Secretary-General to render the assistance necessary and to provide such services as may be required for the annual conferences and expert meetings of the High Contracting Parties to the Convention and of the High Contracting Parties to Amended Protocol II and Protocol V, as well as for any continuation of the work after the meetings;",
    "14": " periodically, by electronic means, of ratifications and acceptances of and accessions to the Convention, its amended article 12 and the Protocols;",
    "15": "Decides to include in the provisional agenda of its seventy-third session the item entitled \u201cConvention on Prohibitions or Restrictions on the Use of Certain Conventional Weapons Which May Be Deemed to Be Excessively Injurious or to Have Indiscriminate Effects\u201d."
  },
  "agenda_items": [
    "Item 103"
  ],
  "symbol_references": []
}