{
  "symbol": "A/RES/79/238",
  "filename": "A_RES_79_238.pdf",
  "title": "79/238. Nuclear war effects and scientific research",
  "text": "United Nations \nA/RES/79/238\n \n \nGeneral Assembly \nDistr.: General \n31 December 2024 \n \n24-24616 (E)     \n*2424616* \n \n \nSeventy-ninth session \nAgenda item 98 \nGeneral and complete disarmament \n \n \n \n \n Resolution adopted by the General Assembly \non 24 December 2024 \n \n \n \n \n[on the report of the First Committee (A/79/408, para. 114)] \n \n \n 79/238. Nuclear war effects and scientific research \n \n \n \nThe General Assembly, \n \nGravely concerned by the devastation that would be visited upon humankind by \na nuclear war, and recognizing the consequent need to make every effort to avert the \ndanger of such a war, \n \nAlarmed at the renewed prospect of a nuclear war, and gravely concerned by the \ncatastrophic humanitarian and environmental consequences that would result from it, \n \nAcknowledging the accumulated scientific evidence that exists for nuclear war \nto result in long-term, large-scale, environmental, physical and socioeconomic \neffects, due to radiation, blast, fire and other phenomena, \n \nRecalling its resolutions 40/152 G of 16 December 1985 and 41/86 H of \n4 December 1986 and the subsequent publication in 1989 of the Study on the Climatic \nand Other Global Effects of Nuclear War,1 \n \nNoting the ongoing major advances in climatic and scientific modelling, and the \nconsequent need for updated information on the potential effects of a nuclear war, \nincluding to provide policymakers with an updated, comprehensive scientific \nassessment of nuclear war effects and its consequences, and to determine where there \nis agreement among the scientific community, and where more research is needed, \n \nRecognizing today\u2019s level of interconnectedness and the likelihood of global \nevents having complex, cascading impacts on global systems and societies, and \nmindful of the fragility of those systems and our planetary boundaries, \n \nNoting the affirmation that a nuclear war cannot be won and must never be \nfought,  \n__________________ \n \n1 United Nations publication, Sales No. E.89.IX.1. \n\nA/RES/79/238 \nNuclear war effects and scientific research\n \n24-24616\n2/3 \n \n \nReaffirming the central role and primary responsibility of the United Nations, \nin accordance with its Charter, in the sphere of disarmament,  \n \nRecalling the report of the Secretary-General on the United Nations study on \ndisarmament and non-proliferation education,2 which acknowledged the need to raise \nawareness of new challenges to international peace and security and the process of \nnuclear disarmament, in particular among future generations, and called for new \nthinking to address those urgent challenges, \n \nRecognizing the importance of the nuclear disarmament, non-proliferation and \narms control instruments in achieving a world free of nuclear weapons, \n \nReaffirming that the most effective guarantee against the danger of nuclear war \nand the use of nuclear weapons is nuclear disarmament and the total elimination of \nnuclear weapons, and recalling that removing the threat of a nuclear war is the most \nacute and urgent task of the present day, \n \n1. \nCalls upon all States to renew their commitment to nuclear disarmament \nand non-proliferation, given the devastation that would be visited upon humankind \nby a nuclear war; \n \n2. \nDecides to establish an independent Scientific Panel on the Effects of \nNuclear War, consisting of 21 members, participating in their personal capacity, to be \nappointed by the Secretary-General on the basis of a public call for candidates, with \na Chair selected from among this group, and encourages nominations from Member \nStates, scientific and academic institutions, and from qualified individuals with \nspecific expertise related to the work of the Panel;  \n \n3. \nAlso decides that the Panel shall be tasked with examining the physical \neffects and societal consequences of a nuclear war on a local, regional and planetary \nscale, including, inter alia, the climatic, environmental and radiological effects, and \ntheir impacts on public health, global socioeconomic systems, agriculture and \necosystems, in the days, weeks and decades following a nuclear war, and that it shall \nreview and commission relevant studies, including modelling where appropriate, and \npublish a comprehensive report, make key conclusions and identify areas requiring \nfuture research; \n \n4. \nRequests the Secretary-General to convene the Panel and provide full \nsupport to it in the fulfilment of its mandate, with the Panel members, participating \non a voluntary basis, to be selected by the Secretary-General drawing on the expertise \nof relevant United Nations agencies, on the basis of their leading scientific expertise \nacross relevant disciplines, while ensuring impartiality, and equitable geographical \nand gender balance; \n \n5. \nDecides that the members of the Panel shall meet virtually at least \nquarterly to advance their work, with participation arrangements facilitated by the \nSecretary-General, keeping Member States periodically updated on progress, while \nmaintaining their objectivity and impartiality, and operating free from political \ninfluence, on the basis of scientific peer review, drawing on lessons learned from \nother international expert mechanisms; \n \n6. \nCalls upon the Panel to consult with the widest range of scientists and \nexperts, and for the Secretary-General to facilitate those consultations, including \nthrough the provision, as required, of virtual meeting spaces, webcast and meeting \nroom facilities at United Nations premises, for up to 10 days in 2025, and a further \n10 days in 2026, and encourages these experts to contribute presentations, written \nreports and published material to assist the Panel in its work; \n__________________ \n \n2 A/57/124. \n\nNuclear war effects and scientific research \nA/RES/79/238\n \n3/3\n24-24616 \n \n \n7. \nCalls upon the United Nations system and relevant agencies, including the \nInternational Atomic Energy Agency, the Preparatory Commission for the \nComprehensive Nuclear-Test-Ban Treaty Organization, the United Nations Scientific \nCommittee on the Effects of Atomic Radiation, the World Health Organization, the \nUnited Nations Environment Programme, the World Meteorological Organization, the \nOffice for the Coordination of Humanitarian Affairs of the Secretariat, the World Food \nProgramme, the Food and Agricultural Organization of the United Nations, the World \nTrade Organization and others, to support the work of the Panel, including by \ncontributing expertise, commissioned studies, data and papers; \n \n8. \nEncourages Member States, relevant international and regional \norganizations and others to support the work of the Panel, including by providing \nrelevant information, scientific data and analyses; facilitating and hosting Panel \nmeetings, \nincluding \nregional \nmeetings; \nand \nmaking \nvoluntary \nbudgetary \ncontributions, or in-kind contributions; \n \n9. \nDecides that the Panel shall engage and receive inputs from the widest \npossible range of stakeholders, including international and regional organizations, the \nInternational Committee of the Red Cross, civil society, affected communities, and \npeoples from around the world, in order to understand local, regional and global \nperspectives on the effects of a nuclear war; \n \n10. Also decides that the present resolution shall serve as the terms of \nreference of the Panel; \n \n11. \nFurther decides to include in the provisional agenda of its eightieth \nsession, under the item entitled \u201cGeneral and complete disarmament\u201d, a sub-item \nentitled \u201cNuclear war effects and scientific research\u201d; \n \n12. Requests the Chair of the Panel to brief the General Assembly at its \neightieth and eighty-first sessions on progress in the work of the Panel; \n \n13. Decides to consider the final report of the Panel on nuclear war effects at \nits eighty-second session, in 2027. \n \n55th (resumed) plenary meeting \n24 December 2024 \n \n",
  "paragraphs": {
    "1": "Calls upon all States to renew their commitment to nuclear disarmament and non-proliferation, given the devastation that would be visited upon humankind by a nuclear war;",
    "2": "Decides to establish an independent Scientific Panel on the Effects of Nuclear War, consisting of 21 members, participating in their personal capacity, to be appointed by the Secretary-General on the basis of a public call for candidates, with a Chair selected from among this group, and encourages nominations from Member States, scientific and academic institutions, and from qualified individuals with specific expertise related to the work of the Panel;",
    "3": "Also decides that the Panel shall be tasked with examining the physical effects and societal consequences of a nuclear war on a local, regional and planetary scale, including, inter alia, the climatic, environmental and radiological effects, and their impacts on public health, global socioeconomic systems, agriculture and ecosystems, in the days, weeks and decades following a nuclear war, and that it shall review and commission relevant studies, including modelling where appropriate, and publish a comprehensive report, make key conclusions and identify areas requiring future research;",
    "4": "Requests the Secretary-General to convene the Panel and provide full support to it in the fulfilment of its mandate, with the Panel members, participating on a voluntary basis, to be selected by the Secretary-General drawing on the expertise of relevant United Nations agencies, on the basis of their leading scientific expertise across relevant disciplines, while ensuring impartiality, and equitable geographical and gender balance;",
    "5": "Decides that the members of the Panel shall meet virtually at least quarterly to advance their work, with participation arrangements facilitated by the Secretary-General, keeping Member States periodically updated on progress, while maintaining their objectivity and impartiality, and operating free from political influence, on the basis of scientific peer review, drawing on lessons learned from other international expert mechanisms;",
    "6": "Calls upon the Panel to consult with the widest range of scientists and experts, and for the Secretary-General to facilitate those consultations, including through the provision, as required, of virtual meeting spaces, webcast and meeting room facilities at United Nations premises, for up to 10 days in 2025, and a further 10 days in 2026, and encourages these experts to contribute presentations, written reports and published material to assist the Panel in its work;",
    "7": "Calls upon the United Nations system and relevant agencies, including the International Atomic Energy Agency, the Preparatory Commission for the Comprehensive Nuclear-Test-Ban Treaty Organization, the United Nations Scientific Committee on the Effects of Atomic Radiation, the World Health Organization, the United Nations Environment Programme, the World Meteorological Organization, the Office for the Coordination of Humanitarian Affairs of the Secretariat, the World Food Programme, the Food and Agricultural Organization of the United Nations, the World Trade Organization and others, to support the work of the Panel, including by contributing expertise, commissioned studies, data and papers;",
    "8": "Encourages Member States, relevant international and regional organizations and others to support the work of the Panel, including by providing relevant information, scientific data and analyses; facilitating and hosting Panel meetings, including regional meetings; and making voluntary budgetary contributions, or in-kind contributions;",
    "9": "Decides that the Panel shall engage and receive inputs from the widest possible range of stakeholders, including international and regional organizations, the International Committee of the Red Cross, civil society, affected communities, and peoples from around the world, in order to understand local, regional and global perspectives on the effects of a nuclear war;",
    "10": "Also decides that the present resolution shall serve as the terms of reference of the Panel;",
    "11": "Further decides to include in the provisional agenda of its eightieth session, under the item entitled \u201cGeneral and complete disarmament\u201d, a sub-item entitled \u201cNuclear war effects and scientific research\u201d;",
    "12": "Requests the Chair of the Panel to brief the General Assembly at its eightieth and eighty-first sessions on progress in the work of the Panel;",
    "13": "Decides to consider the final report of the Panel on nuclear war effects at its eighty-second session, in 2027."
  },
  "agenda_items": [
    "Item 98"
  ],
  "symbol_references": []
}