{
  "symbol": "A/RES/76/244",
  "filename": "A_RES_76_244.pdf",
  "title": "76/244. Financing of the African Union-United Nations Hybrid Operation in Darfur",
  "text": "United Nations \nA/RES/76/244\n \n \nGeneral Assembly \nDistr.: General \n4 January 2022 \n \n21-19711 (E)    070122     \n*2119711* \n \n \nSeventy-sixth session \nAgenda item 165 \nFinancing of the African Union-United Nations Hybrid \nOperation in Darfur \n \n \n \n \n Resolution adopted by the General Assembly \non 24 December 2021 \n \n \n \n \n[on the report of the Fifth Committee (A/76/619, para. 6)] \n \n \n 76/244. Financing of the African Union-United Nations Hybrid Operation \nin Darfur \n \n \n \nThe General Assembly, \n \nHaving considered the report of the Secretary-General on the financing of the \nAfrican Union-United Nations Hybrid Operation in Darfur1 and the related report of \nthe Advisory Committee on Administrative and Budgetary Questions,2  \n \nRecalling Security Council resolution 1769 (2007) of 31 July 2007, by which \nthe Council established the African Union-United Nations Hybrid Operation in Darfur \nfor an initial period of 12 months from 31 July 2007, and the subsequent resolutions \nby which the Council extended the mandate of the Operation, the latest of which was \nresolution 2559 (2020) of 22 December 2020, by which the Council decided to \nterminate the mandate of the Operation as of 31 December 2020,  \n \nRecalling also its resolution 62/232 A of 22 December 2007 on the financing of \nthe Operation and its subsequent resolutions thereon, the latest of which was \nresolution 75/251 C of 30 June 2021,  \n \n1. \nEndorses the conclusions and recommendations contained in the report of \nthe Advisory Committee on Administrative and Budgetary Questions, and requests \nthe Secretary-General to ensure their full implementation;  \n \n__________________ \n \n1  A/76/504. \n \n2  A/76/585. \n\nA/RES/76/244 \nFinancing of the African Union-United Nations Hybrid Operation \nin Darfur\n \n21-19711\n2/2 \n \n \n \nDonation of assets of the African Union-United Nations Hybrid Operation \nin Darfur  \n \n \n2. \nTakes note of the report of the Secretary-General on the financing of the \nOperation;  \n \n3. \nApproves the donation of assets of the Operation, with an acquisition cost \nof 145,456,300 United States dollars and a net book value of 55,291,700 dollars, to \nthe Government of the Sudan;  \n \n4. \nDecides to keep under review, during its seventy-sixth session, the item \nentitled \u201cFinancing of the African Union-United Nations Hybrid Operation in \nDarfur\u201d.  \n \n54th (resumed) plenary meeting \n24 December 2021 \n \n",
  "paragraphs": {
    "1": "Endorses the conclusions and recommendations contained in the report of the Advisory Committee on Administrative and Budgetary Questions, and requests the Secretary-General to ensure their full implementation; Donation of assets of the African Union-United Nations Hybrid Operation in Darfur",
    "2": "Takes note of the report of the Secretary-General on the financing of the Operation;",
    "3": "Approves the donation of assets of the Operation, with an acquisition cost of 145,456,300 United States dollars and a net book value of 55,291,700 dollars, to the Government of the Sudan;",
    "4": "Decides to keep under review, during its seventy-sixth session, the item entitled \u201cFinancing of the African Union-United Nations Hybrid Operation in Darfur\u201d."
  },
  "agenda_items": [
    "Item 165"
  ],
  "symbol_references": []
}