{
  "symbol": "A/RES/79/237",
  "filename": "A_RES_79_237.pdf",
  "title": "79/237. Open-ended working group on security of and in the use of information and communications technologies 2021\u20132025 established pursuant to General Assembly resolution 75/240",
  "text": "United Nations \nA/RES/79/237\n \n \nGeneral Assembly \nDistr.: General \n31 December 2024 \n \n24-24615 (E)     \n*2424615* \n \n \nSeventy-ninth session \nAgenda item 93 \nDevelopments in the field of information and \ntelecommunications in the context of international security \n \n \n \n \n Resolution adopted by the General Assembly \non 24 December 2024 \n \n \n \n \n[on the report of the First Committee (A/79/403, para. 8)] \n \n \n 79/237. Open-ended working group on security of and in the use of \ninformation and communications technologies 2021\u20132025 \nestablished pursuant to General Assembly resolution 75/240 \n \n \n \nThe General Assembly, \n \nRecalling its resolutions 75/240 of 31 December 2020 and 76/19 of 6 December \n2021, and noting that the open-ended working group on security of and in the use of \ninformation and communications technologies established pursuant to resolution \n75/240 (OEWG) held its organizational session and its first substantive session in \n2021, its second and third substantive sessions in 2022, its fourth, fifth and sixth \nsubstantive sessions in 2023 and its seventh and eighth substantive sessions in 2024, \n \nRecalling also its decisions 77/512 of 7 December 2022 and 78/541 of \n22 December 2023, including to convene additional intersessional meetings across \n2024 and 2025, \n \nRecalling further that, at its eighth substantive session, on 12 July 2024, the \nopen-ended working group considered its third annual progress report, decided to \ninclude in its report the outcome of the substantive discussions of the working group \nas contained in the annex to document A/79/214 and subsequently issued a \ncompendium of statements in explanation of position on the adoption of the third \nannual progress report as document A/AC.292/2024/INF/5, \n \n1. \nDecides to endorse the third annual progress report of the OEWG as \ncontained in document A/79/214; \n \n2. \nWelcomes the consensus achieved within the OEWG to: \n \n(a) \nRecommend the establishment of the future permanent mechanism based \non the consensus elements contained in the paper entitled \u201cElements for the Open-\nEnded Action-Oriented Permanent Mechanism on ICT Security in the context of \n\nA/RES/79/237 \nOpen-ended working group on security of and in the use of \ninformation and communications technologies 2021\u20132025 \nestablished pursuant to General Assembly resolution 75/240 \n \n24-24615\n2/2 \n \ninternational security\u201d as contained in document A/79/214 in order to ensure a \nseamless transition from the OEWG to the future permanent mechanism; \n \n(b) \nContinue discussions within the current OEWG and to submit \nrecommendations in the Final Report of the OEWG to be adopted in July 2025 on: \n(i) modalities on the participation of other interested parties and stakeholders, \nincluding businesses, non-governmental organizations and academia, in the future \npermanent mechanism; (ii) dedicated thematic groups of the future permanent \nmechanism; and (iii) other elements as required; \n \n(c) \nRecommend that the future permanent mechanism would facilitate the \ncontinued operationalization and further development of all existing initiatives set up \nunder the auspices of the OEWG 2021\u20132025 and/or other previous processes, \nincluding, inter alia, the Global POC Directory and the Global Roundtable on ICT \nsecurity capacity-building; \n \n3. \nEmphasizes that the open-ended working group itself serves as a \nconfidence-building measure, and in this regard recognizes the need to facilitate \ninclusive participation, including the participation of all delegations in an inclusive \nmanner and on equal footing; \n \n4. \nDecides to convene additional intersessional meetings of up to 10 days \nacross 2024 and 2025, to advance discussions, build on the annual progress reports, \nand support the continued work of the open-ended working group in accordance with \nits mandate pursuant to resolution 75/240; \n \n5. \nAlso decides to include in the provisional agenda of its eightieth session \nthe item entitled \u201cDevelopments in the field of information and telecommunications \nin the context of international security\u201d. \n \n55th (resumed) plenary meeting \n24 December 2024 \n \n",
  "paragraphs": {
    "1": "Decides to endorse the third annual progress report of the OEWG as contained in document A/79/214;",
    "2": " international security\u201d as contained in document A/79/214 in order to ensure a seamless transition from the OEWG to the future permanent mechanism; (b) Continue discussions within the current OEWG and to submit recommendations in the Final Report of the OEWG to be adopted in July 2025 on: (i) modalities on the participation of other interested parties and stakeholders, including businesses, non-governmental organizations and academia, in the future permanent mechanism; (ii) dedicated thematic groups of the future permanent mechanism; and (iii) other elements as required; (c) Recommend that the future permanent mechanism would facilitate the continued operationalization and further development of all existing initiatives set up under the auspices of the OEWG 2021\u20132025 and/or other previous processes, including, inter alia, the Global POC Directory and the Global Roundtable on ICT security capacity-building;",
    "3": "Emphasizes that the open-ended working group itself serves as a confidence-building measure, and in this regard recognizes the need to facilitate inclusive participation, including the participation of all delegations in an inclusive manner and on equal footing;",
    "4": "Decides to convene additional intersessional meetings of up to 10 days across 2024 and 2025, to advance discussions, build on the annual progress reports, and support the continued work of the open-ended working group in accordance with its mandate pursuant to resolution 75/240;",
    "5": "Also decides to include in the provisional agenda of its eightieth session the item entitled \u201cDevelopments in the field of information and telecommunications in the context of international security\u201d."
  },
  "agenda_items": [
    "Item 93"
  ],
  "symbol_references": []
}