{
  "symbol": "A/RES/78/176",
  "filename": "A_RES_78_176.pdf",
  "title": "78/176. Preparations for and observance of the thirtieth anniversary of the International Year of the Family",
  "text": "United Nations \nA/RES/78/176\n \n \nGeneral Assembly \nDistr.: General \n22 December 2023 \n \n23-25979 (E)    040124     \n*2325979* \n \n \nSeventy-eighth session \nAgenda item 24 (b) \nSocial development: social development, including \nquestions relating to the world social situation and to \nyouth, ageing, persons with disabilities and the family  \n \n \n \n \n Resolution adopted by the General Assembly \non 19 December 2023 \n \n \n \n \n[on the report of the Third Committee (A/78/472, para. 57)] \n \n \n 78/176. Preparations for and observance of the thirtieth anniversary of the \nInternational Year of the Family \n \n \n \nThe General Assembly, \n \nRecalling its resolutions 44/82 of 8 December 1989, 50/142 of 21 December \n1995, 52/81 of 12 December 1997, 54/124 of 17 December 1999, 56/113 of \n19 December 2001, 57/164 of 18 December 2002, 58/15 of 3 December 2003, 59/111 \nof 6 December 2004, 59/147 of 20 December 2004, 60/133 of 16 December 2005, \n62/129 of 18 December 2007, 64/133 of 18 December 2009, 66/126 of 19 December \n2011, 67/142 of 20 December 2012, 68/136 of 18 December 2013, 69/144 of \n18 December 2014, 71/163 of 19 December 2016, 72/145 of 19 December 2017, \n73/144 of 17 December 2018, 74/124 of 18 December 2019, 75/153 of 16 December \n2020, 76/139 of 16 December 2021 and 77/191 of 15 December 2022, concerning the \nproclamation of, preparations for and observance of the International Year of the \nFamily and its tenth, twentieth and thirtieth anniversaries,  \n \nRecognizing that the preparations for and observance of the thirtieth anniversary \nof the International Year of the Family in 2024 provide a useful opportunity to \ncontinue to raise awareness of the objectives of the International Year for increasing \ncooperation on family issues at all levels and for undertaking concerted action to \nstrengthen family-oriented policies and programmes as part of an integrated \ncomprehensive approach to development,  \n \nRecognizing also that the objectives of the International Year and its follow-up \nprocesses, especially those relating to family-oriented policies in the areas of poverty, \nwork-family balance and intergenerational issues, with attention given to the rights \nand responsibilities of all family members, can contribute to ending poverty, ending \nhunger, ensuring a healthy life and promoting well-being for all at all ages, promoting \nlifelong learning opportunities for all, ensuring better education outcomes for \n\nA/RES/78/176 \nPreparations for and observance of the thirtieth anniversary of the \nInternational Year of the Family\n \n23-25979\n2/6 \n \nchildren, including early childhood development and education, enabling access to \nemployment opportunities and decent work for parents and caregivers, achieving \ngender equality and the empowerment of all women and girls and eliminating all \nforms of violence, in particular against women and girls, and supporting the overall \nquality of life of families, including families in vulnerable situations, so that family \nmembers can realize their full potential, as part of an integrated comprehensive \napproach to development,  \n \nAcknowledging that the family-related provisions of the outcomes of the major \nUnited Nations conferences and summits and their follow-up processes continue to \nprovide policy guidance on ways to strengthen family-oriented components of policies \nand programmes as part of an integrated comprehensive approach to development,  \n \nAcknowledging also that the International Year and its follow-up processes have \nserved as catalysts for initiatives at the national, regional and international levels, \nincluding family-oriented policies and programmes to reduce poverty and hunger and \npromote the well-being of all at all ages, and can boost development efforts, \ncontribute to better outcomes for children and help to break the intergenerational \ntransfer of poverty in support of the implementation of the 2030 Agenda for \nSustainable Development,1 \n \nExpressing concern over the continuous socioeconomic impacts of the \ncoronavirus disease (COVID 19) pandemic on families, and recognizing the need to \nbuild more effective, inclusive, resilient and gender-sensitive systems to protect and \nsupport families, in particular those families in vulnerable situations, inter alia, by \nproviding access to full and productive employment and decent work, as well as \neffective, inclusive and resilient social protection systems and public services, and \nmeasures to ensure work-family and work-life balance, while also acknowledging that \nwomen and girls undertake a disproportionate share of unpaid care and domestic \nwork, and while also stressing the need to recognize and adopt measures to reduce, \nredistribute and value unpaid care and domestic work by promoting the equal sharing \nof responsibilities between women and men within the household, \n \nAcknowledging that strengthening intergenerational relations, through such \nmeasures as promoting intergenerational living arrangements and encouraging \nextended family members to live in close proximity to each other, has been found to \npromote the autonomy, security and well-being of children and older persons and that \ninitiatives to promote involved and positive parenting and to support the role of \ngrandparents have been found to be beneficial in advancing social integration and \nsolidarity between generations, as well as in promoting and protecting the human \nrights of all family members,  \n \nAcknowledging also that the preparations for the observance of the thirtieth \nanniversary of the International Year of the Family in 2024 should offer an \nopportunity to focus on megatrends, such as technological change, urbanization, \nmigration, demographic change and climate change and their impact on families and \ntheir well-being,  \n \n1. \nTakes note with appreciation of the report of the Secretary-General;2 \n \n2. \nEncourages Governments to continue their efforts to implement the \nobjectives of the International Year of the Family and its follow-up processes and to \ndevelop strategies and programmes aimed at strengthening national capacities to \naddress national priorities relating to family issues and to step up their efforts, in \ncollaboration with relevant stakeholders, to implement those objectives, in particular \n__________________ \n \n1  Resolution 70/1. \n \n2  A/78/61-E/2023/7. \n\nPreparations for and observance of the thirtieth anniversary of the \nInternational Year of the Family \nA/RES/78/176\n \n3/6\n23-25979 \n \nin the areas of fighting poverty and hunger, to prevent the intergenerational transfer \nand feminization of poverty and ensure the well-being of all at all ages in order to \nachieve the 2030 Agenda for Sustainable Development;  \n \n3. \nCalls upon Member States, United Nations entities, within their respective \nmandates, and other relevant stakeholders, to offer support to family members, \nincluding working parents, and provide access to full and productive employment and \ndecent work, as well as effective, inclusive, resilient and gender-responsive social \nprotection systems and public services, expanded child and family benefits, paid \nparental leave and sick leave, improved flexibility of working arrangements and \ninvestments in parenting education; \n \n4. \nCalls upon Member States, United Nations entities and relevant \nstakeholders to promote the preparations for the observance of the thirtieth \nanniversary of the International Year of the Family in 2024 at the national, regional \nand international levels through practical initiatives, including family-oriented \npolicies and programmes responding to the needs of all families;  \n \n5. \nInvites relevant stakeholders, as part of the preparations for the thirtieth \nanniversary of the International Year of the Family, to support research and \nawareness-raising activities at the national, regional and international levels on the \nimpact of technological, urbanization, migration, demographic and climate change \ntrends on families;  \n \n6. \nInvites Member States and relevant stakeholders, as part of the \npreparations for the thirtieth anniversary of the International Year of the Family, \nwithin the area of technological change and its impact on families, to bridge the digital \ndivide, including between developed and developing countries, as well as the gender \ndigital divide, to enable equal access to risk-informed information, knowledge and \ncommunications, by taking concrete measures to promote equal access for all to \ndigital training, capacity-building, through equal access to information and \ncommunications technologies, mobile devices and the Internet, so as to promote their \nempowerment and digital literacy, and to improve access to the Internet, higher-speed \nInternet and digital devices for families, especially those in vulnerable situations, \ninvest in the digital literacy skills of all family members, invest in parenting \neducation, including through the use of technology, as a valuable preventive strategy \nagainst cyberbullying and violence against children in digital contexts and for \nreducing child neglect, and support the healthy development of children, as part of \nchild-focused policies and as a component of wider family-oriented policies and \nprogrammes;  \n \n7. \nEncourages Member States, as part of the preparations for the thirtieth \nanniversary of the International Year of the Family, to integrate a family-oriented \napproach to relevant policymaking;  \n \n8. \nInvites relevant stakeholders, including Member States, to promote work-\nfamily balance in the digital world, grant workers with family responsibilities \nflexibility in work schedules to enable them to meet the needs of work and family and \ninvest in reliable technology support and education;  \n \n9. \nInvites Member States and relevant stakeholders, as part of the \npreparations for the thirtieth anniversary of the International Year of the Family, \nwithin the area of urbanization and its impact on families, to invest in sustainable \nurbanization, including through the provision of adequate infrastructure, accessible \ntransportation, affordable housing and intergenerational living arrangements;  \n \n10. Invites Member States to further invest in services for families, social \nservice centres and transportation, to benefit families and prevent family \nhomelessness and address its causes, including poverty, domestic violence and the \n\nA/RES/78/176 \nPreparations for and observance of the thirtieth anniversary of the \nInternational Year of the Family\n \n23-25979\n4/6 \n \nlack of affordable housing, and to build inclusive and sustainable communities free \nfrom discrimination;  \n \n11. \nInvites all relevant stakeholders to incorporate into urban planning a wide \nrange of stakeholders, including low-income households, female-headed households, \nwomen, youth, older persons, persons with disabilities, those experiencing \nhomelessness, those living in poverty, including extreme poverty, and those in \nvulnerable situations, and to promote planned and well-managed urbanization \nthrough effective coordination between local and state governments and long-term \npublic-private financial partnerships;  \n \n12. Invites Member States and all relevant stakeholders to promote \nreunification policies under national law related to migration, with the best interest \nof the child as the basic concern, while also taking into consideration the overall well-\nbeing of the family; \n \n13. Encourages Member States to promote social protection systems for all, \nin line with national policies, and to target families in vulnerable situations, such as \nmigrant families, those in precarious housing situations, those living in conflict zones \nor areas susceptible to natural disasters induced by climate change, Indigenous \nfamilies and families with a member with disabilities;  \n \n14. Invites Member States and other stakeholders to invest in awareness-\nraising and media campaigns to disseminate information on the availability of \nhousing, employment, educational opportunities and social services for families and \ntheir members;  \n \n15. Encourages Member States to integrate and maintain a gender perspective \nin family-related policies, in particular in the context of migration and homelessness; \n \n16. Encourages Member States and other relevant stakeholders to expand \nevidence-based research on the impact of rapid technological change, demographic \nchange, migration, urbanization and climate change, in order to develop adequate \npolicies supporting migrant and urban families in these contexts, as part of the \npreparations for the observance of the thirtieth anniversary of the International Year \nof the Family;  \n \n17. Invites Member States to invest in a variety of inclusive, family-oriented \ngender-sensitive policies and programmes, which take into account the different \nneeds and expectations of all families, as important tools for, inter alia, fighting \npoverty, social exclusion, discrimination and inequality, promoting work-family \nbalance and gender equality and the empowerment of all women and girls and \nadvancing social integration and intergenerational solidarity, to support the \nimplementation of the 2030 Agenda;  \n \n18. Encourages Member States to continue to enact inclusive and responsive \nfamily-oriented policies for poverty reduction to confront family poverty and social \nexclusion, recognizing the multidimensional aspects of poverty, focusing on inclusive \nand quality education and lifelong learning for all, health and well-being for all at all \nages, full and productive employment, decent work, social security, livelihoods and \nsocial cohesion, including through gender- and age-sensitive social protection \nsystems and measures, such as child allowances for parents and pension benefits for \nolder persons, and to ensure that the rights, capabilities and responsibilities of all \nfamily members are respected;  \n \n19. Also encourages Member States to recognize, reduce and redistribute \nunpaid care and domestic work, particularly by women, and enhance efforts to ensure \nequal pay for equal work or work of equal value, and to promote work-family balance \nas conducive to the well-being of children, youth, persons with disabilities and older \n\nPreparations for and observance of the thirtieth anniversary of the \nInternational Year of the Family \nA/RES/78/176\n \n5/6\n23-25979 \n \npersons and the achievement of gender equality and the empowerment of all women \nand girls, inter alia, through the improvement of working conditions for workers with \nfamily responsibilities, expanding flexible working arrangements, including through \nthe use of new information and communications technologies, and providing and/or \nexpanding leave arrangements, such as maternity leave and paternity leave, and \nadequate social security benefits for both women and men, taking appropriate steps \nto ensure that they are not discriminated against when availing themselves of such \nbenefits and promoting men\u2019s awareness and use of such opportunities, for their \nchildren\u2019s developmental benefit and as a means of enabling women to increase their \nparticipation in the labour market;  \n \n20. Further encourages Member States to take appropriate steps to provide \naffordable, accessible and good-quality childcare facilities and facilities for children \nand other dependants and measures promoting the equal sharing of household \nresponsibilities between women and men, recognizing, reducing and redistributing \nwomen\u2019s and girls\u2019 disproportionate share of unpaid care and domestic work and fully \nengaging men and boys as agents and beneficiaries of change and as strategic partners \nand allies in this regard;  \n \n21. Encourages Member States to invest in family-oriented policies and \nprogrammes \nthat \nenhance \nstrong \nintergenerational \ninteractions, \nsuch \nas \nintergenerational living arrangements, parenting education, including for family \ncaregivers, and support for grandparents, including grandparents who are primary \ncaregivers, in an effort to promote inclusive urbanization, active ageing, \nintergenerational solidarity and social cohesion;  \n \n22. Also encourages Member States to invest in family-oriented policies and \nprogrammes and to provide universal and gender-sensitive social protection systems, \nwhich are key to ensuring poverty reduction, including, as appropriate, targeted cash \ntransfers for families in vulnerable situations, as can be the case of families headed \nby a single parent, in particular those headed by women, and which are most effective \nin reducing poverty when accompanied by other measures, such as providing access \nto basic services, high-quality education and health-care services, in addition to \nfamily services and counselling;  \n \n23. Further encourages Member States to provide legal identity including \nbirth registration, in accordance with international law, including relevant provisions \nof the Convention on the Rights of the Child 3 and/or relevant provisions of the \nInternational Covenant on Civil and Political Rights,4 and death registration, as a \nmeans of, inter alia, promoting peaceful and inclusive societies for sustainable \ndevelopment and access to benefits, including social protection;  \n \n24. Encourages Member States to invest in parenting education as a tool to \nenhance children\u2019s well-being and prevent all forms of violence against children, \nincluding through promoting non-violent forms of discipline, and to ensure that \nparenting education programmes are inclusive of parents, grandparents and, where \napplicable, the members of the extended family or community as provided by local \ncustom, legal guardians or other persons legally responsible for the children, \nmaintaining a gender perspective throughout;  \n \n25. Also encourages Member States to establish policies that support all \nfamilies in providing a nurturing environment, and in preventing and eliminating \ndomestic violence and harmful practices, including female genital mutilation and \nchild, early and forced marriage;  \n \n26. Further encourages Member States to improve the collection and use of \ndata, disaggregated by age, sex and other relevant criteria, for the formulation and \n__________________ \n \n3  United Nations, Treaty Series, vol. 1577, No. 27531. \n \n4  See resolution 2200 A (XXI), annex. \n\nA/RES/78/176 \nPreparations for and observance of the thirtieth anniversary of the \nInternational Year of the Family\n \n23-25979\n6/6 \n \nevaluation of family-oriented policies and programmes to effectively respond to the \nchallenges faced by families and harness their contribution to development;  \n \n27. Encourages Governments to support the United Nations trust fund on \nfamily activities;  \n \n28. Encourages Member States to strengthen cooperation with all relevant \nstakeholders, including United Nations entities, civil society, academic institutions \nand the private sector, in the development and implementation of relevant family-\noriented policies and programmes;  \n \n29. Encourages further collaboration between the Department of Economic \nand Social Affairs of the Secretariat and the United Nations entities, agencies, funds \nand programmes, as well as other relevant intergovernmental and non-governmental \norganizations active in the family field, as well as the enhancement of research efforts \nand awareness-raising activities relating to the objectives of the International Year \nand its follow-up processes, including the preparations for the thirtieth anniversary of \nthe International Year of the Family;  \n \n30. Requests the focal point on the family of the Department of Economic and \nSocial Affairs to enhance collaboration with the regional commissions, funds and \nprogrammes, recommends that the roles of focal points within the United Nations \nsystem be reaffirmed, and invites Member States to increase technical cooperation \nefforts, consider enhancing the role of the regional commissions on family issues and \ncontinue to provide resources for those efforts, facilitate the coordination of national \nand international non-governmental organizations on family issues and enhance \ncooperation with all relevant stakeholders to promote family issues and develop \npartnerships in this regard;  \n \n31. Calls upon Member States and agencies and bodies of the United Nations \nsystem, in consultation with civil society and other relevant stakeholders, to continue \nto provide information on their activities, including on good practices at the national, \nregional and international levels, including the relevant United Nations forums, in \nsupport of the objectives of the International Year and its follow-up processes, \nincluding the preparations for its thirtieth anniversary, to be included in the report of \nthe Secretary-General;  \n \n32. Encourages Member States and other relevant stakeholders to organize \nand participate in events commemorating the thirtieth anniversary of the International \nYear of the Family in 2024;  \n \n33. Takes note of the convening of the Doha conference to commemorate the \nthirtieth anniversary of the International Year of the Family, on the theme \u201cFamily \nand contemporary megatrends\u201d, hosted by Qatar and organized by the Doha \nInternational Family Institute, to be held from 29 to 31 October 2024; \n \n34. Requests the Secretary-General to submit a report to the General Assembly \nat its eightieth session, through the Commission for Social Development and the \nEconomic and Social Council, on the implementation of the present resolution and on \nthe observance of the thirtieth anniversary of the International Year in 2024 at all \nlevels;  \n \n35. Decides to consider the topic \u201cPreparations for and observance of the \nthirtieth anniversary of the International Year of the Family in 2024\u201d at its seventy-\nninth session under the sub-item entitled \u201cSocial development, including questions \nrelating to the world social situation and to youth, ageing, persons with disabilities \nand the family\u201d of the item entitled \u201cSocial development\u201d. \n \n50th plenary meeting \n19 December 2023 \n \n",
  "paragraphs": {
    "1": "Takes note with appreciation of the report of the Secretary-General;2",
    "2": "Encourages Governments to continue their efforts to implement the objectives of the International Year of the Family and its follow-up processes and to develop strategies and programmes aimed at strengthening national capacities to address national priorities relating to family issues and to step up their efforts, in collaboration with relevant stakeholders, to implement those objectives, in particular __________________ 1 Resolution 70/1. 2 A/78/61-E/2023/7. Preparations for and observance of the thirtieth anniversary of the International Year of the Family A/RES/78/176 3/6 23-25979 in the areas of fighting poverty and hunger, to prevent the intergenerational transfer and feminization of poverty and ensure the well-being of all at all ages in order to achieve the 2030 Agenda for Sustainable Development;",
    "3": "Calls upon Member States, United Nations entities, within their respective mandates, and other relevant stakeholders, to offer support to family members, including working parents, and provide access to full and productive employment and decent work, as well as effective, inclusive, resilient and gender-responsive social protection systems and public services, expanded child and family benefits, paid parental leave and sick leave, improved flexibility of working arrangements and investments in parenting education;",
    "4": "Calls upon Member States, United Nations entities and relevant stakeholders to promote the preparations for the observance of the thirtieth anniversary of the International Year of the Family in 2024 at the national, regional and international levels through practical initiatives, including family-oriented policies and programmes responding to the needs of all families;",
    "5": "Invites relevant stakeholders, as part of the preparations for the thirtieth anniversary of the International Year of the Family, to support research and awareness-raising activities at the national, regional and international levels on the impact of technological, urbanization, migration, demographic and climate change trends on families;",
    "6": "Invites Member States and relevant stakeholders, as part of the preparations for the thirtieth anniversary of the International Year of the Family, within the area of technological change and its impact on families, to bridge the digital divide, including between developed and developing countries, as well as the gender digital divide, to enable equal access to risk-informed information, knowledge and communications, by taking concrete measures to promote equal access for all to digital training, capacity-building, through equal access to information and communications technologies, mobile devices and the Internet, so as to promote their empowerment and digital literacy, and to improve access to the Internet, higher-speed Internet and digital devices for families, especially those in vulnerable situations, invest in the digital literacy skills of all family members, invest in parenting education, including through the use of technology, as a valuable preventive strategy against cyberbullying and violence against children in digital contexts and for reducing child neglect, and support the healthy development of children, as part of child-focused policies and as a component of wider family-oriented policies and programmes;",
    "7": "Encourages Member States, as part of the preparations for the thirtieth anniversary of the International Year of the Family, to integrate a family-oriented approach to relevant policymaking;",
    "8": "Invites relevant stakeholders, including Member States, to promote work- family balance in the digital world, grant workers with family responsibilities flexibility in work schedules to enable them to meet the needs of work and family and invest in reliable technology support and education;",
    "9": "Invites Member States and relevant stakeholders, as part of the preparations for the thirtieth anniversary of the International Year of the Family, within the area of urbanization and its impact on families, to invest in sustainable urbanization, including through the provision of adequate infrastructure, accessible transportation, affordable housing and intergenerational living arrangements;",
    "10": "Invites Member States to further invest in services for families, social service centres and transportation, to benefit families and prevent family homelessness and address its causes, including poverty, domestic violence and the A/RES/78/176 Preparations for and observance of the thirtieth anniversary of the International Year of the Family 23-25979 4/6 lack of affordable housing, and to build inclusive and sustainable communities free from discrimination;",
    "11": "Invites all relevant stakeholders to incorporate into urban planning a wide range of stakeholders, including low-income households, female-headed households, women, youth, older persons, persons with disabilities, those experiencing homelessness, those living in poverty, including extreme poverty, and those in vulnerable situations, and to promote planned and well-managed urbanization through effective coordination between local and state governments and long-term public-private financial partnerships;",
    "12": "Invites Member States and all relevant stakeholders to promote reunification policies under national law related to migration, with the best interest of the child as the basic concern, while also taking into consideration the overall well- being of the family;",
    "13": "Encourages Member States to promote social protection systems for all, in line with national policies, and to target families in vulnerable situations, such as migrant families, those in precarious housing situations, those living in conflict zones or areas susceptible to natural disasters induced by climate change, Indigenous families and families with a member with disabilities;",
    "14": "Invites Member States and other stakeholders to invest in awareness- raising and media campaigns to disseminate information on the availability of housing, employment, educational opportunities and social services for families and their members;",
    "15": "Encourages Member States to integrate and maintain a gender perspective in family-related policies, in particular in the context of migration and homelessness;",
    "16": "Encourages Member States and other relevant stakeholders to expand evidence-based research on the impact of rapid technological change, demographic change, migration, urbanization and climate change, in order to develop adequate policies supporting migrant and urban families in these contexts, as part of the preparations for the observance of the thirtieth anniversary of the International Year of the Family;",
    "17": "Invites Member States to invest in a variety of inclusive, family-oriented gender-sensitive policies and programmes, which take into account the different needs and expectations of all families, as important tools for, inter alia, fighting poverty, social exclusion, discrimination and inequality, promoting work-family balance and gender equality and the empowerment of all women and girls and advancing social integration and intergenerational solidarity, to support the implementation of the 2030 Agenda;",
    "18": "Encourages Member States to continue to enact inclusive and responsive family-oriented policies for poverty reduction to confront family poverty and social exclusion, recognizing the multidimensional aspects of poverty, focusing on inclusive and quality education and lifelong learning for all, health and well-being for all at all ages, full and productive employment, decent work, social security, livelihoods and social cohesion, including through gender- and age-sensitive social protection systems and measures, such as child allowances for parents and pension benefits for older persons, and to ensure that the rights, capabilities and responsibilities of all family members are respected;",
    "19": "Also encourages Member States to recognize, reduce and redistribute unpaid care and domestic work, particularly by women, and enhance efforts to ensure equal pay for equal work or work of equal value, and to promote work-family balance as conducive to the well-being of children, youth, persons with disabilities and older Preparations for and observance of the thirtieth anniversary of the International Year of the Family A/RES/78/176 5/6 23-25979 persons and the achievement of gender equality and the empowerment of all women and girls, inter alia, through the improvement of working conditions for workers with family responsibilities, expanding flexible working arrangements, including through the use of new information and communications technologies, and providing and/or expanding leave arrangements, such as maternity leave and paternity leave, and adequate social security benefits for both women and men, taking appropriate steps to ensure that they are not discriminated against when availing themselves of such benefits and promoting men\u2019s awareness and use of such opportunities, for their children\u2019s developmental benefit and as a means of enabling women to increase their participation in the labour market;",
    "20": "Further encourages Member States to take appropriate steps to provide affordable, accessible and good-quality childcare facilities and facilities for children and other dependants and measures promoting the equal sharing of household responsibilities between women and men, recognizing, reducing and redistributing women\u2019s and girls\u2019 disproportionate share of unpaid care and domestic work and fully engaging men and boys as agents and beneficiaries of change and as strategic partners and allies in this regard;",
    "21": "Encourages Member States to invest in family-oriented policies and programmes that enhance strong intergenerational interactions, such as intergenerational living arrangements, parenting education, including for family caregivers, and support for grandparents, including grandparents who are primary caregivers, in an effort to promote inclusive urbanization, active ageing, intergenerational solidarity and social cohesion;",
    "22": "Also encourages Member States to invest in family-oriented policies and programmes and to provide universal and gender-sensitive social protection systems, which are key to ensuring poverty reduction, including, as appropriate, targeted cash transfers for families in vulnerable situations, as can be the case of families headed by a single parent, in particular those headed by women, and which are most effective in reducing poverty when accompanied by other measures, such as providing access to basic services, high-quality education and health-care services, in addition to family services and counselling;",
    "23": "Further encourages Member States to provide legal identity including birth registration, in accordance with international law, including relevant provisions of the Convention on the Rights of the Child 3 and/or relevant provisions of the International Covenant on Civil and Political Rights,4 and death registration, as a means of, inter alia, promoting peaceful and inclusive societies for sustainable development and access to benefits, including social protection;",
    "24": "Encourages Member States to invest in parenting education as a tool to enhance children\u2019s well-being and prevent all forms of violence against children, including through promoting non-violent forms of discipline, and to ensure that parenting education programmes are inclusive of parents, grandparents and, where applicable, the members of the extended family or community as provided by local custom, legal guardians or other persons legally responsible for the children, maintaining a gender perspective throughout;",
    "25": "Also encourages Member States to establish policies that support all families in providing a nurturing environment, and in preventing and eliminating domestic violence and harmful practices, including female genital mutilation and child, early and forced marriage;",
    "26": "Further encourages Member States to improve the collection and use of data, disaggregated by age, sex and other relevant criteria, for the formulation and __________________ 3 United Nations, Treaty Series, vol. 1577, No. 27531. 4 See resolution 2200 A (XXI), annex. A/RES/78/176 Preparations for and observance of the thirtieth anniversary of the International Year of the Family 23-25979 6/6 evaluation of family-oriented policies and programmes to effectively respond to the challenges faced by families and harness their contribution to development;",
    "27": "Encourages Governments to support the United Nations trust fund on family activities;",
    "28": "Encourages Member States to strengthen cooperation with all relevant stakeholders, including United Nations entities, civil society, academic institutions and the private sector, in the development and implementation of relevant family- oriented policies and programmes;",
    "29": "Encourages further collaboration between the Department of Economic and Social Affairs of the Secretariat and the United Nations entities, agencies, funds and programmes, as well as other relevant intergovernmental and non-governmental organizations active in the family field, as well as the enhancement of research efforts and awareness-raising activities relating to the objectives of the International Year and its follow-up processes, including the preparations for the thirtieth anniversary of the International Year of the Family;",
    "30": "Requests the focal point on the family of the Department of Economic and Social Affairs to enhance collaboration with the regional commissions, funds and programmes, recommends that the roles of focal points within the United Nations system be reaffirmed, and invites Member States to increase technical cooperation efforts, consider enhancing the role of the regional commissions on family issues and continue to provide resources for those efforts, facilitate the coordination of national and international non-governmental organizations on family issues and enhance cooperation with all relevant stakeholders to promote family issues and develop partnerships in this regard;",
    "31": "Calls upon Member States and agencies and bodies of the United Nations system, in consultation with civil society and other relevant stakeholders, to continue to provide information on their activities, including on good practices at the national, regional and international levels, including the relevant United Nations forums, in support of the objectives of the International Year and its follow-up processes, including the preparations for its thirtieth anniversary, to be included in the report of the Secretary-General;",
    "32": "Encourages Member States and other relevant stakeholders to organize and participate in events commemorating the thirtieth anniversary of the International Year of the Family in 2024;",
    "33": "Takes note of the convening of the Doha conference to commemorate the thirtieth anniversary of the International Year of the Family, on the theme \u201cFamily and contemporary megatrends\u201d, hosted by Qatar and organized by the Doha International Family Institute, to be held from 29 to 31 October 2024;",
    "34": "Requests the Secretary-General to submit a report to the General Assembly at its eightieth session, through the Commission for Social Development and the Economic and Social Council, on the implementation of the present resolution and on the observance of the thirtieth anniversary of the International Year in 2024 at all levels;",
    "35": "Decides to consider the topic \u201cPreparations for and observance of the thirtieth anniversary of the International Year of the Family in 2024\u201d at its seventy- ninth session under the sub-item entitled \u201cSocial development, including questions relating to the world social situation and to youth, ageing, persons with disabilities and the family\u201d of the item entitled \u201cSocial development\u201d. 50th plenary meeting 19 December 2023"
  },
  "agenda_items": [
    "Item 24"
  ],
  "symbol_references": []
}