{
  "symbol": "A/RES/78/10",
  "filename": "A_RES_78_10.pdf",
  "title": "78/10. Building a peaceful and better world through sport and the Olympic ideal",
  "text": "United Nations \nA/RES/78/10\n \n \nGeneral Assembly \nDistr.: General \n27 November 2023 \n \n23-23443 (E)    011223 \n*2323443* \n \n \nSeventy-eighth session \nAgenda item 11 \nSport for development and peace: building a peaceful and \nbetter world through sport and the Olympic ideal \n \n \n \n \n Resolution adopted by the General Assembly \non 21 November 2023 \n \n \n \n \n[without reference to a Main Committee (A/78/L.9)] \n \n \n \n78/10. Building a peaceful and better world through sport and the \nOlympic ideal \n \n \n \nThe General Assembly, \n \nRecalling its resolution 76/13 of 2 December 2021, in which it decided to \ninclude in the provisional agenda of its seventy-eighth session the sub-item entitled \n\u201cBuilding a peaceful and better world through sport and the Olympic ideal\u201d, and \nrecalling also its prior decision to consider the sub-item every two years, in advance \nof the Summer and Winter Olympic Games,  \n \nRecalling also its resolution 48/11 of 25 October 1993, which, inter alia, revived \nthe ancient Greek tradition of ekecheiria (\u201cOlympic Truce\u201d) calling for a truce during \nthe Olympic Games to encourage a peaceful environment and ensure safe passage, \naccess and participation for athletes and relevant persons at the Games, thereby \nmobilizing the youth of the world to the cause of peace,  \n \nRecalling further that the core concept of ekecheiria, historically, has been the \ncessation of hostilities from seven days before until seven days after the Olympic \nGames, which, according to the legendary oracle of Delphi, was to replace the cycle \nof conflict with a friendly athletic competition every four years,  \n \nRecognizing the valuable contribution of sport in promoting education, \nsustainable development, peace, cooperation, solidarity, fairness, social inclusion and \nhealth at the local, regional and international levels, and noting that, as declared in \nthe 2005 World Summit Outcome, 1  sports can contribute to an atmosphere of \ntolerance and understanding among peoples and nations,  \n \nRecognizing also the role that sports can play to prevent and counter terrorism \nand violent extremism as and when conducive to terrorism, and its contributions to \nbuilding resilience against radicalization to violence and terrorist recruitment,  \n__________________ \n \n1  Resolution 60/1. \n\nA/RES/78/10 \nBuilding a peaceful and better world through sport \nand the Olympic ideal\n \n23-23443\n2/5 \n \n \nWelcoming the designation of 6 April as the International Day of Sport for \nDevelopment and Peace,  \n \nRecalling the inclusion in the United Nations Millennium Declaration 2 of an \nappeal for the observance of the Olympic Truce now and in the future and for support \nfor the International Olympic Committee in its efforts to promote peace and human \nunderstanding through sport and the Olympic ideal,  \n \nRecalling also that, in the 2030 Agenda for Sustainable Development,3 sport is \nrecognized as an important enabler of sustainable development, including for its \ngrowing contribution to the realization of development and peace in its promotion of \ntolerance and respect and the contributions it makes to the empowerment of women \nand of young people, individuals and communities as well as to health, education and \nsocial inclusion objectives,  \n \nAcknowledging the valuable contribution that the appeal launched by the \nInternational Olympic Committee on 21 July 1992 for an Olympic Truce could make \ntowards advancing the purposes and principles of the Charter of the United Nations, \n \nRecalling its resolution 77/27 of 1 December 2022 on sport as an enabler of \nsustainable development, in which it called upon future hosts of the Olympic Games \nand the Paralympic Games and other Member States to include sport, as appropriate, \nin conflict prevention activities and to ensure the effective implementation of the \nOlympic Truce during the Games, \n \nNoting that the Games of the XXXIII Olympiad will be held from 26 July to \n11 August 2024 and that the XVII Paralympic Games will be held from 28 August to \n8 September 2024, in Paris, \n \nNoting also the vision and sustained action of the Paris 2024 Olympic and \nParalympic Games and their legacy to leverage sport as a tool to promote education, \nhealth and social inclusion for all, thereby contributing to the achievement of the 2030 \nAgenda and its Sustainable Development Goals, \n \nAcknowledging that the Paris 2024 Olympic and Paralympic Games will be a \nunifying event and a meaningful opportunity to harness the power of sport to foster \nan atmosphere of peace, development, resilience, tolerance and understanding, \naccessibility and inclusion, and welcoming all the delegations of National Olympic \nand Paralympic Committees athletes and the Refugee Olympic and Paralympic Teams \nadmitted by the International Olympic Committee and the International Paralympic \nCommittee to participate in the Games, \n \nRecognizing that Paris 2024 aims to ensure the delivery of sustainable Olympic \nand Paralympic Games, and aims to hold the Games as a catalyst for innovation and \nchange towards a more sustainable world, contributing to the acceleration of the just \nand equitable transition in sport and major sporting events, and achieving sustainable \ndevelopment in its three dimensions \u2013 economic, social and environmental \u2013 in a \nbalanced and integrated manner, \n \nWelcoming the contribution of Paris 2024 to promoting physical activity for \nbetter health, in all areas of society, in particular for youth, with flagship initiatives \nsuch as 30-minute daily physical activity programmes, \n \nRecalling article 31 of the Convention on the Rights of the Child, 4 which \noutlines the right of the child to engage in play and recreational activities, and the \noutcome document of the twenty-seventh special session of the General Assembly on \n__________________ \n \n2  Resolution 55/2. \n \n3  Resolution 70/1. \n \n4  United Nations, Treaty Series, vol. 1577, No. 27531. \n\nBuilding a peaceful and better world through sport  \nand the Olympic ideal \nA/RES/78/10\n \n3/5\n23-23443 \n \nchildren, entitled \u201cA world fit for children\u201d, 5  which stresses the promotion of \nphysical, mental and emotional health through play and sports, \n \nNoting with appreciation that the International Olympic Committee has \nallocated the same number of quota places to male and female athletes and its efforts \nto achieve gender equality on the field of play as one of the objectives and ambitions \nof the Paris 2024 Olympic and Paralympic Games, creating a legacy from the Games, \n \nRecognizing the imperative need to engage women and girls in the practice of \nsport for development and peace, and welcoming activities that aim to foster and \nencourage initiatives in this regard at the global level, \n \nNoting the successful conclusion of the XXIV Olympic Winter Games and the \nXIII Paralympic Winter Games, held in Beijing from 4 to 20 February and from 4 to \n13 March 2022, respectively, and welcoming the XXV Olympic Winter Games and \nthe XIV Paralympic Winter Games, to be held in Milano-Cortina, Italy, from 6 to \n22 February and from 6 to 15 March 2026, respectively, and the Games of the XXXIV \nOlympiad and the XVIII Paralympic Games, to be held in Los Angeles, United States \nof America, from 14 to 30 July and 15 to 27 August 2028, respectively, \n \nAcknowledging the joint endeavours of the International Olympic Committee, \nthe International Paralympic Committee and relevant United Nations entities in such \nfields as the promotion of human rights, human development, poverty alleviation, \nhumanitarian assistance, health promotion, HIV and AIDS prevention, child and \nyouth education, gender equality, peacebuilding and sustainable development, \n \nAcknowledging also the importance of the Youth Olympic Games in inspiring \nyouth through integrated sports and cultural and educational experiences, noting in \nthis regard the successful conclusion of the third Youth Olympic Winter Games, held \nin Lausanne, Switzerland, from 9 to 22 January 2020, and welcoming the fourth \nWinter Youth Olympic Games, to be held in Gangwon, Republic of Korea, in 2024 \nand the Summer Youth Olympic Games, to be held in Dakar in 2026, \n \nWelcoming the innovative cooperation between the Organizing Committees of \nthe Paris 2024 Olympic and Paralympic Games and the Dakar 2026 Youth Olympic \nGames on the importance of sport for youth and development through the sharing of \ninformation and best practices, as well as the proactive efforts of Paris 2024, in \nconjunction with all Organizing Committees of upcoming Games, to implement new \nstandards for delivering more sustainable Games in accordance with the International \nOlympic Committee reforms, \n \nRecognizing the role that the Paralympic movement plays in showcasing the \nachievements of athletes with disabilities to a global audience and in acting as a \nprimary vehicle to promote positive perceptions and greater inclusion of persons with \ndisabilities in sport and society, \n \nWelcoming the significant impetus that the Olympic Games, the Paralympic \nGames and the Youth Olympic Games give to the volunteer movement around the \nworld, acknowledging the contributions of volunteers to the success of the Games, \nand in this regard calling upon host countries to promote social inclusion without \ndiscrimination of any kind, \n \nRecognizing the important role of supporters working alongside persons with \ndisabilities to organize and develop disability-specific sports, \n \nRecognizing also that the active involvement of persons with disabilities in \nsports and the Paralympic Games contributes to the full and equal realization of their \nhuman rights, as well as respect for their inherent dignity, recalling articles 1 and 30 \n__________________ \n \n5  Resolution S-27/2, annex. \n\nA/RES/78/10 \nBuilding a peaceful and better world through sport \nand the Olympic ideal\n \n23-23443\n4/5 \n \nof the Convention on the Rights of Persons with Disabilities, 6 in which States parties \nrecognized the right of persons with disabilities, including those with long-term \nphysical, mental, intellectual or sensory impairments, to take part on an equal basis \nwith others in cultural life, and committed to take appropriate measures to encourage \nand promote the participation, to the fullest extent possible, of persons with \ndisabilities in mainstream sporting activities at all levels, with a view to enabling \npersons with disabilities to participate on an equal basis with others in recreational, \nleisure and sporting activities, and noting in this regard the need for appropriate \ninstruction, training and resources alongside accessibility of venues, and welcoming \nplans to stage integrated and inclusive Games, \n \nWelcoming the commitment made by various States Members of the United \nNations and other relevant stakeholders to developing national and international \nprogrammes that promote peace and conflict resolution, the Olympic and Paralympic \nvalues and the Olympic Truce ideals through sport and through culture, education, \nsustainable development and wider public engagement, and acknowledging the \ncontribution of former hosts of the Olympic and Paralympic Games in this regard, \n \nRecognizing the humanitarian opportunities presented by the Olympic Truce and \nby other initiatives supported by the United Nations to achieve the cessation of \nconflict, \n \nRecalling that, in its resolution 77/27, it supported the independence and \nautonomy of sport as well as the mission of the International Olympic Committee in \nleading the Olympic movement and of the International Paralympic Committee in \nleading the Paralympic movement, and recognized the unifying and conciliative \nnature of Olympic Games and major international sport events and that such events \nare organized in the spirit of peace, mutual understanding, friendship, tolerance and \ninadmissibility of discrimination of any kind, \n \nAcknowledging the fundamental principles of the Olympic Charter, including \nprinciple 6, which states that the enjoyment of the rights and freedoms set forth in the \nOlympic Charter shall be secured for all, without discrimination of any kind, \n \nNoting with satisfaction that the United Nations flag will be flown at the \nOlympic stadium and in the Olympic and Paralympic villages of the XXXIII \nOlympiad and the XVII Paralympic Games,  \n \n1. \nUrges Member States to observe the Olympic Truce individually and \ncollectively, within the framework of the Charter of the United Nations, throughout \nthe period from the seventh day before the start of the Games of the XXXIII Olympiad \nuntil the seventh day following the end of the XVII Paralympic Games, to be held in \nParis in 2024, in particular, to ensure the safe passage, access and participation of \nathletes, officials and all other accredited persons taking part in the Games of the \nOlympiad and the Paralympic Games, and to contribute through other appropriate \nmeasures to the safe organization of the Games; \n \n2. \nUnderlines the importance of cooperation among Member States to \ncollectively implement the values of the Olympic Truce around the world, and \nemphasizes the important role of the International Olympic Committee, the \nInternational Paralympic Committee and the United Nations in this regard; \n \n3. \nWelcomes the work of the International Olympic Committee and the \nInternational Paralympic Committee, as well as the International Olympic Truce \nCentre, in mobilizing national and international sports federations and organizations, \nNational Olympic and Paralympic Committees and associations of these \norganizations to take concrete actions at the local, national, regional and international \n__________________ \n \n6  United Nations, Treaty Series, vol. 2515, No. 44910. \n\nBuilding a peaceful and better world through sport  \nand the Olympic ideal \nA/RES/78/10\n \n5/5\n23-23443 \n \nlevels to promote and strengthen a culture of peace based on the spirit of the Olympic \nTruce, and invites those organizations and national committees to cooperate and share \ninformation and best practices, as appropriate; \n \n4. \nAlso welcomes the leadership of Olympic and Paralympic athletes in \npromoting peace and human understanding through sport and the Olympic ideal; \n \n5. \nCalls upon all Member States to cooperate with the International Olympic \nCommittee and the International Paralympic Committee in their efforts to use sport \nas a tool to promote peace, dialogue and reconciliation in areas of conflict during and \nbeyond the period of the Olympic and Paralympic Games; \n \n6. \nRecognizes that sport and the Olympic and Paralympic Games can be used \nto promote human rights and strengthen universal respect for such rights, thus \ncontributing to their full realization; \n \n7. \nWelcomes the cooperation among Member States, the United Nations and \nthe specialized agencies, funds and programmes, and the International Olympic \nCommittee and the International Paralympic Committee, to maximize the potential of \nsport to make a meaningful and sustainable contribution to the achievement of the \nSustainable Development Goals within the 2030 Agenda for Sustainable Development, \nand encourages the Olympic and Paralympic movements to work closely with national \nand international sports organizations on the use of sport to this end; \n \n8. \nRequests the Secretary-General and the President of the General Assembly \nto promote the observance of the Olympic Truce among Member States and support \nfor human development initiatives through sport and to continue to cooperate \neffectively with the International Olympic Committee, the International Paralympic \nCommittee and the sporting community in general in the realization of those \nobjectives; \n \n9. \nDecides to include in the provisional agenda of its eightieth session the \nsub-item entitled \u201cBuilding a peaceful and better world through sport and the Olympic \nideal\u201d of the item entitled \u201cSport for development and peace\u201d and to consider the \nsub-item before the XXV Olympic Winter Games and the XIV Paralympic Winter \nGames, to be held in Milano-Cortina in 2026. \n \n38th plenary meeting \n21 November 2023 \n \n",
  "paragraphs": {
    "1": "Urges Member States to observe the Olympic Truce individually and collectively, within the framework of the Charter of the United Nations, throughout the period from the seventh day before the start of the Games of the XXXIII Olympiad until the seventh day following the end of the XVII Paralympic Games, to be held in Paris in 2024, in particular, to ensure the safe passage, access and participation of athletes, officials and all other accredited persons taking part in the Games of the Olympiad and the Paralympic Games, and to contribute through other appropriate measures to the safe organization of the Games;",
    "2": "Underlines the importance of cooperation among Member States to collectively implement the values of the Olympic Truce around the world, and emphasizes the important role of the International Olympic Committee, the International Paralympic Committee and the United Nations in this regard;",
    "3": "Welcomes the work of the International Olympic Committee and the International Paralympic Committee, as well as the International Olympic Truce Centre, in mobilizing national and international sports federations and organizations, National Olympic and Paralympic Committees and associations of these organizations to take concrete actions at the local, national, regional and international __________________ 6 United Nations, Treaty Series, vol. 2515, No. 44910. Building a peaceful and better world through sport and the Olympic ideal A/RES/78/10 5/5 23-23443 levels to promote and strengthen a culture of peace based on the spirit of the Olympic Truce, and invites those organizations and national committees to cooperate and share information and best practices, as appropriate;",
    "4": "Also welcomes the leadership of Olympic and Paralympic athletes in promoting peace and human understanding through sport and the Olympic ideal;",
    "5": "Calls upon all Member States to cooperate with the International Olympic Committee and the International Paralympic Committee in their efforts to use sport as a tool to promote peace, dialogue and reconciliation in areas of conflict during and beyond the period of the Olympic and Paralympic Games;",
    "6": "Recognizes that sport and the Olympic and Paralympic Games can be used to promote human rights and strengthen universal respect for such rights, thus contributing to their full realization;",
    "7": "Welcomes the cooperation among Member States, the United Nations and the specialized agencies, funds and programmes, and the International Olympic Committee and the International Paralympic Committee, to maximize the potential of sport to make a meaningful and sustainable contribution to the achievement of the Sustainable Development Goals within the 2030 Agenda for Sustainable Development, and encourages the Olympic and Paralympic movements to work closely with national and international sports organizations on the use of sport to this end;",
    "8": "Requests the Secretary-General and the President of the General Assembly to promote the observance of the Olympic Truce among Member States and support for human development initiatives through sport and to continue to cooperate effectively with the International Olympic Committee, the International Paralympic Committee and the sporting community in general in the realization of those objectives;",
    "9": "Decides to include in the provisional agenda of its eightieth session the sub-item entitled \u201cBuilding a peaceful and better world through sport and the Olympic ideal\u201d of the item entitled \u201cSport for development and peace\u201d and to consider the sub-item before the XXV Olympic Winter Games and the XIV Paralympic Winter Games, to be held in Milano-Cortina in 2026. 38th plenary meeting 21 November 2023"
  },
  "agenda_items": [
    "Item 11"
  ],
  "symbol_references": [
    "A/78/L.9"
  ]
}