{
  "symbol": "A/RES/72/45",
  "filename": "A_RES_72_45.pdf",
  "title": "72/45. Nuclear-weapon-free southern hemisphere and adjacent areas",
  "text": "United Nations \nA/RES/72/45\n \n \nGeneral Assembly \nDistr.: General \n12 December 2017 \n \n17-21722 (E)    141217 \n*1721722* \n \n \nSeventy-second session \nAgenda item 99 (i) \n \n \n \n \n Resolution adopted by the General Assembly \non 4 December 2017 \n \n \n \n \n[on the report of the First Committee (A/72/409)] \n \n \n \n72/45. Nuclear-weapon-free southern hemisphere and adjacent areas \n \n \n \nThe General Assembly,  \n \nRecalling its resolutions 51/45 B of 10 December 1996, 52/38 N of \n9 December 1997, 53/77 Q of 4 December 1998, 54/54 L of 1 December 1999, \n55/33 I of 20 November 2000, 56/24 G of 29 November 2001, 57/73 of \n22 November 2002, 58/49 of 8 December 2003, 59/85 of 3 December 2004, 60/58 \nof 8 December 2005, 61/69 of 6 December 2006, 62/35 of 5 December 2007, 63/65 \nof 2 December 2008, 64/44 of 2 December 2009, 65/58 of 8 December 2010, 67/55 \nof 3 December 2012, 69/35 of 2 December 2014, 70/45 of 7 December 2015 and \n71/51 of 5 December 2016, \n \nRecalling also the provisions on nuclear-weapon-free zones of the Final \nDocument of the Tenth Special Session of the General Assembly, the first special \nsession devoted to disarmament,1  \n \nRecalling further the adoption by the Disarmament Commission at its 1999 \nsubstantive session of a text entitled \u201cEstablishment of nuclear-weapon-free zones \non the basis of arrangements freely arrived at among the States of the region \nconcerned\u201d,2  \n \nDetermined to pursue the total elimination of nuclear weapons, \n \nDetermined also to continue to contribute to the prevention of the proliferation \nof nuclear weapons in all its aspects and to the process of general and complete \ndisarmament under strict and effective international control, in particular in the field \nof nuclear weapons and other weapons of mass destruction, with a view to \nstrengthening international peace and security, in accordance with the purposes and \nprinciples of the Charter of the United Nations, \n__________________ \n \n1  Resolution S-10/2. \n \n2  Official Records of the General Assembly, Fifty-fourth Session, Supplement No. 42 (A/54/42), \nannex I. \n\nA/RES/72/45 \nNuclear-weapon-free southern hemisphere and adjacent areas\n \n17-21722 \n2/3 \n \n \nWelcoming the adoption on 7 July 2017 of the Treaty on the Prohibition of \nNuclear Weapons3 and its reaffirmation of the conviction that the establishment of \nthe internationally recognized nuclear-weapon-free zones on the basis of \narrangements freely arrived at among the States of the region concerned enhances \nglobal and regional peace and security, strengthens the nuclear non-proliferation \nregime and contributes towards realizing the objective of nuclear disarmament, \n \nRecalling the Final Document of the 2010 Review Conference of the Parties to \nthe Treaty on the Non-Proliferation of Nuclear Weapons,4 which reaffirmed the \nconviction that the establishment of nuclear-weapon-free zones contributes towards \nrealizing the objectives of nuclear disarmament, \n \nStressing the importance of the treaties of Tlatelolco,5 Rarotonga,6 Bangkok7 \nand Pelindaba8 establishing nuclear-weapon-free zones, as well as the Antarctic \nTreaty,9 inter alia, for achieving a world entirely free of nuclear weapons, \n \nWelcoming the convening by Indonesia of the third Conference of States \nParties and Signatories to Treaties that Establish Nuclear-Weapon-Free Zones and \nMongolia, on 24 April 2015, \n \nNoting that 115 States are currently parties and signatories to nuclear-weapon-\nfree zone treaties, \n \nUnderlining the value of enhancing cooperation among the nuclear-weapon-\nfree zone treaty members by means of mechanisms such as joint meetings of States \nparties, signatories and observers to those treaties, \n \nReaffirming the applicable principles and rules of international law relating to \nthe freedom of the high seas and the rights of passage through maritime space, \nincluding those of the United Nations Convention on the Law of the Sea,10  \n \n1. \nReaffirms its conviction of the important role of nuclear-weapon-free \nzones in strengthening the nuclear non-proliferation regime and in extending the \nareas of the world that are nuclear-weapon-free, and calls for greater progress \ntowards the total elimination of all nuclear weapons; \n \n2. \nWelcomes the continued contribution that the Antarctic Treaty9 and the \ntreaties of Tlatelolco,5 Rarotonga,6 Bangkok7 and Pelindaba8 are making towards \nfreeing the southern hemisphere and adjacent areas covered by those treaties from \nnuclear weapons; \n \n3. \nNotes with satisfaction that all nuclear-weapon-free zones in the southern \nhemisphere and adjacent areas are now in force; \n \n4. \nCalls upon all States concerned to continue to work together in order to \nfacilitate adherence to the protocols to nuclear-weapon-free zone treaties by all \nrelevant States that have not yet done so, in this regard welcomes the ratification by \nChina, France, the Russian Federation and the United Kingdom of Great Britain and \nNorthern Ireland of the Protocol to the Treaty on a Nuclear-Weapon-Free Zone in \n__________________ \n \n3 A/CONF.229/2017/8. \n \n4  2010 Review Conference of the Parties to the Treaty on the Non-Proliferation of Nuclear \nWeapons, Final Document, vols. I\u2013III (NPT/CONF.2010/50 (Vol. I), \nNPT/CONF.2010/50 (Vol. II) and NPT/CONF.2010/50 (Vol. III)). \n \n5  United Nations, Treaty Series, vol. 634, No. 9068. \n \n6  The United Nations Disarmament Yearbook, vol. 10: 1985 (United Nations publication, Sales \nNo. E.86.IX.7), appendix VII. \n \n7  United Nations, Treaty Series, vol. 1981, No. 33873. \n \n8  A/50/426, annex. \n \n9  United Nations, Treaty Series, vol. 402, No. 5778. \n \n10  Ibid., vol. 1833, No. 31363. \n\nNuclear-weapon-free southern hemisphere and adjacent areas \nA/RES/72/45\n \n3/3 \n17-21722 \n \nCentral Asia and the steps taken by the United States of America towards the \nratification of the protocols to the Treaty on a Nuclear-Weapon-Free Zone in Central \nAsia, to the Treaty of Pelindaba and to the Treaty of Rarotonga, and encourages \nprogress with a view to concluding consultations between the nuclear-weapon States \nand the parties to the Bangkok Treaty on the Protocol to that Treaty; \n \n5. \nCalls upon the nuclear-weapon States to withdraw any reservations or \ninterpretive declarations contrary to the object and purpose of the treaties \nestablishing nuclear-weapon-free zones; \n \n6. \nWelcomes the steps taken to conclude further nuclear-weapon-free zone \ntreaties on the basis of arrangements freely arrived at among the States of the region \nconcerned, and calls upon all States to consider all relevant proposals, including \nthose reflected in its resolutions on the establishment of a nuclear-weapon-free zone \nin the Middle East; \n \n7. \nCongratulates the States parties and signatories to the treaties of \nTlatelolco, Rarotonga, Bangkok and Pelindaba, as well as of Central Asia and \nMongolia, for their efforts to pursue the common goals envisaged in those treaties \nand to promote the nuclear-weapon-free status of the southern hemisphere and \nadjacent areas, and calls upon them to explore and implement further ways and \nmeans of cooperation among themselves and their treaty agencies; \n \n8. \nEncourages efforts to reinforce coordination among nuclear-weapon-free \nzones; \n \n9. \nEncourages the competent authorities of the nuclear-weapon-free zone \ntreaties to provide assistance to the States parties and signatories to those treaties so \nas to facilitate the accomplishment of the goals of the treaties; \n \n10. Decides to include in the provisional agenda of its seventy-fourth \nsession, under the item entitled \u201cGeneral and complete disarmament\u201d, the sub-item \nentitled \u201cNuclear-weapon-free southern hemisphere and adjacent areas\u201d.  \n \n62nd plenary meeting  \n4 December 2017 \n \n",
  "paragraphs": {
    "1": "Reaffirms its conviction of the important role of nuclear-weapon-free zones in strengthening the nuclear non-proliferation regime and in extending the areas of the world that are nuclear-weapon-free, and calls for greater progress towards the total elimination of all nuclear weapons;",
    "2": "Welcomes the continued contribution that the Antarctic Treaty9 and the treaties of Tlatelolco,5 Rarotonga,6 Bangkok7 and Pelindaba8 are making towards freeing the southern hemisphere and adjacent areas covered by those treaties from nuclear weapons;",
    "3": "Notes with satisfaction that all nuclear-weapon-free zones in the southern hemisphere and adjacent areas are now in force;",
    "4": "Calls upon all States concerned to continue to work together in order to facilitate adherence to the protocols to nuclear-weapon-free zone treaties by all relevant States that have not yet done so, in this regard welcomes the ratification by China, France, the Russian Federation and the United Kingdom of Great Britain and Northern Ireland of the Protocol to the Treaty on a Nuclear-Weapon-Free Zone in __________________ 3 A/CONF.229/2017/8. 4 2010 Review Conference of the Parties to the Treaty on the Non-Proliferation of Nuclear Weapons, Final Document, vols. I\u2013III (NPT/CONF.2010/50 (Vol. I), NPT/CONF.2010/50 (Vol. II) and NPT/CONF.2010/50 (Vol. III)). 5 United Nations, Treaty Series, vol. 634, No. 9068. 6 The United Nations Disarmament Yearbook, vol. 10: 1985 (United Nations publication, Sales No. E.86.IX.7), appendix VII. 7 United Nations, Treaty Series, vol. 1981, No. 33873. 8 A/50/426, annex. 9 United Nations, Treaty Series, vol. 402, No. 5778. 10 Ibid., vol. 1833, No. 31363. Nuclear-weapon-free southern hemisphere and adjacent areas A/RES/72/45 3/3 17-21722 Central Asia and the steps taken by the United States of America towards the ratification of the protocols to the Treaty on a Nuclear-Weapon-Free Zone in Central Asia, to the Treaty of Pelindaba and to the Treaty of Rarotonga, and encourages progress with a view to concluding consultations between the nuclear-weapon States and the parties to the Bangkok Treaty on the Protocol to that Treaty;",
    "5": "Calls upon the nuclear-weapon States to withdraw any reservations or interpretive declarations contrary to the object and purpose of the treaties establishing nuclear-weapon-free zones;",
    "6": "Welcomes the steps taken to conclude further nuclear-weapon-free zone treaties on the basis of arrangements freely arrived at among the States of the region concerned, and calls upon all States to consider all relevant proposals, including those reflected in its resolutions on the establishment of a nuclear-weapon-free zone in the Middle East;",
    "7": "Congratulates the States parties and signatories to the treaties of Tlatelolco, Rarotonga, Bangkok and Pelindaba, as well as of Central Asia and Mongolia, for their efforts to pursue the common goals envisaged in those treaties and to promote the nuclear-weapon-free status of the southern hemisphere and adjacent areas, and calls upon them to explore and implement further ways and means of cooperation among themselves and their treaty agencies;",
    "8": "Encourages efforts to reinforce coordination among nuclear-weapon-free zones;",
    "9": "Encourages the competent authorities of the nuclear-weapon-free zone treaties to provide assistance to the States parties and signatories to those treaties so as to facilitate the accomplishment of the goals of the treaties;",
    "10": "Decides to include in the provisional agenda of its seventy-fourth session, under the item entitled \u201cGeneral and complete disarmament\u201d, the sub-item entitled \u201cNuclear-weapon-free southern hemisphere and adjacent areas\u201d. 62nd plenary meeting 4 December 2017"
  },
  "agenda_items": [
    "Item 99"
  ],
  "symbol_references": []
}