{
  "symbol": "A/RES/79/55",
  "filename": "A_RES_79_55.pdf",
  "title": "79/55. Preventing the acquisition by terrorists of radioactive sources",
  "text": "United Nations \nA/RES/79/55\n \n \nGeneral Assembly \nDistr.: General \n9 December 2024 \n \n24-23080 (E)     \n*2423080* \n \n \nSeventy-ninth session \nAgenda item 98 (dd) \nGeneral and complete disarmament: preventing the \nacquisition by terrorists of radioactive sources\n \n \n \n \n \n Resolution adopted by the General Assembly \non 2 December 2024 \n \n \n \n \n[on the report of the First Committee (A/79/408, para. 114)] \n \n \n \n79/55. Preventing the acquisition by terrorists of radioactive sources \n \n \n \nThe General Assembly, \n \nRecalling its resolutions 62/46 of 5 December 2007, 65/74 of 8 December 2010, \n67/51 of 3 December 2012, 69/50 of 2 December 2014, 71/66 of 5 December 2016, \n73/66 of 5 December 2018, 75/70 of 7 December 2020 and 77/77 of 7 December \n2022, \n \nRecognizing the essential contribution of radioactive sources to social and \neconomic development, and the benefits drawn from their use for all States,  \n \nRecognizing also the determination of the international community to combat \nterrorism, as evident in relevant General Assembly and Security Council resolutions,  \n \nNoting with satisfaction the continued international efforts to strengthen further \nthe security of radioactive sources worldwide,  \n \nMindful of the sovereign rights and the responsibilities of every Member State, \nin accordance with their national legal frameworks and international obligations, to \nmaintain effective nuclear safety and security,  \n \nAsserting that responsibility for nuclear security within a State rests entirely \nwith that State, and noting the important contribution of international cooperation in \nsupporting the efforts of States to fulfil their responsibilities,  \n \nDeeply concerned by the threat of terrorism and the risk that terrorists may \nacquire, traffic in or use radioactive sources in radiological dispersion devices,  \n \nDeeply concerned also by the potential threat to human health and the \nenvironment that would result from the use of such devices by terrorists, \n \nNoting with concern the occurrence of nuclear and radioactive materials that are \noutside of regulatory control or being trafficked,  \n\nA/RES/79/55 \nPreventing the acquisition by terrorists of radioactive sources\n \n24-23080\n2/5 \n \n \nNoting with deep concern the consequences of armed conflicts as well as attacks \nin all forms by terrorists on the safety and security of radioactive sources that could \nlead to a loss or a theft of these sources and increase the risk of trafficking of such \nsources,  \n \nRecalling the importance of international conventions aimed at preventing and \nsuppressing such a risk, in particular the International Convention for the Suppression \nof Acts of Nuclear Terrorism, adopted on 13 April 2005, 1 and the Convention on the \nPhysical Protection of Nuclear Material, adopted on 26 October 1979, 2 as well as its \nAmendment, adopted on 8 July 2005,3 which entered into force on 8 May 2016,  \n \nNoting that actions of the international community to combat the proliferation \nof weapons of mass destruction and prevent access by non-State actors to weapons of \nmass destruction and related material, notably Security Council resolutions 1540 \n(2004) of 28 April 2004, 1977 (2011) of 20 April 2011, 2325 (2016) of 15 December \n2016 and 2663 (2022) of 30 November 2022, constitute contributions to the \nprevention of acts of terrorism using such materials,  \n \nTaking note of resolutions GC(68)/RES/8 and GC(68)/RES/9, adopted on \n20 September 2024 by the General Conference of the International Atomic Energy \nAgency at its sixty-eighth regular session, which address measures to strengthen \ninternational cooperation and measures to enhance nuclear and radiation safety and \nnuclear security, \n \nStressing the importance of the role of the International Atomic Energy Agency \nin promoting and reinforcing the safety and security of radioactive sources, in \nparticular by establishing technical guidance and supporting States in the \nimprovement of national legal and regulatory infrastructure, and in strengthening \ncoordination and complementarities among various nuclear or radiological security \nactivities,  \n \nNoting the organization by the International Atomic Energy Agency of the \nInternational Conference on the Safety and Security of Radioactive Sources \u2013 \nAccomplishments and Future Endeavours, held in Vienna from 20 to 24 June 2022, \nwelcoming the adoption of the Ministerial Declaration at the International Conference \non Nuclear Security: Sustaining and Strengthening Efforts, held in Vienna from 10 to \n14 February 2020, recalling the holding of the first Conference of the Parties to the \nAmendment to the Convention on the Physical Protection of Nuclear Material, in \nVienna from 28 March to 1 April 2022, and the adoption of the Outcome Document, \nand recalling the convening of the International Conference on Nuclear Security: \nShaping the Future, held in Vienna from 20 to 24 May 2024, \n \nNoting also the utility of the Incident and Trafficking Database as a voluntary \nmechanism for the international exchange of information on incidents and illicit \ntrafficking of nuclear and other radioactive material, encouraging the International \nAtomic Energy Agency to further facilitate, including through designated points of \ncontact, the timely exchange of information, including through secured electronic \naccess to information contained in the Database, and encouraging all States to join \nand participate actively in the Database programme in support of their national efforts \nto prevent, detect and respond to radioactive and nuclear materials that may have \nfallen out of regulatory control,  \n__________________ \n \n1  United Nations, Treaty Series, vol. 2445, No. 44004. \n \n2  Ibid., vol. 1456, No. 24631. \n \n3  Ibid., vol. 3132, No. 24631. \n\nPreventing the acquisition by terrorists of radioactive sources \nA/RES/79/55\n \n3/5\n24-23080 \n \n \nNoting further the importance of the Joint Convention on the Safety of Spent \nFuel Management and on the Safety of Radioactive Waste Management 4 with respect \nto its provisions on the safe management of disused sealed sources,  \n \nHighlighting the importance of the Code of Conduct on the Safety and Security \nof Radioactive Sources, of its supplementary Guidance on the Import and Export of \nRadioactive Sources and of its supplementary Guidance on the Management of \nDisused Radioactive Sources as valuable instruments for enhancing the safety and \nsecurity of radioactive sources, noting that 149 States members of the International \nAtomic Energy Agency have made a political commitment to implement the \nprovisions of the Code, 131 States have made a similar commitment to the \nsupplementary Guidance on the Import and Export of Radioactive Sources and 58 \nmember States have made a similar commitment to the supplementary Guidance on \nthe Management of Disused Radioactive Sources, while recognizing that they are not \nlegally binding,  \n \nNoting that a number of States have not yet become parties to the pertinent \ninternational instruments,  \n \nTaking note of the Nuclear Security Plan 2022\u20132025 of the International Atomic \nEnergy Agency,5 and encouraging Member States to make voluntary contributions to \nthe International Atomic Energy Agency Nuclear Security Fund,  \n \nWelcoming the fact that Member States have taken multilateral actions to \naddress the security of radioactive sources, as reflected in General Assembly \nresolution 78/8 of 8 November 2023,  \n \nNoting the various international efforts and partnerships to enhance nuclear and \nradiological security, encouraging further efforts to secure radioactive sources, and \nnoting in this respect guidance and recommendations of the International Atomic \nEnergy Agency with regard to safe and secure management of radioactive sources,  \n \nTaking note of the findings of the International Conference on the Safety and \nSecurity of Radioactive Sources of 2022, which, inter alia, call for further assessment \nof the merits of developing an international convention on the safety and security of \nradioactive sources so that Member States can make the best-informed decisions on \nthe matter,  \n \nNoting that the Radiological and Nuclear Terrorism Prevention Unit of the \nInternational Criminal Police Organization (INTERPOL) works with nations to \nstrengthen capabilities to counter radioactive source smuggling and prevent terrorists \nfrom acquiring such materials, and that INTERPOL Project Geiger promotes the \nsharing of sensitive law enforcement information on known nuclear smugglers and \nincidents involving radioactive materials, \n \nWelcoming the ongoing individual and collective efforts of Member States to \ntake into account in their deliberations the dangers posed by the lack or insufficiency \nof control over radioactive sources, and recognizing the need for States to take more \neffective measures to strengthen those controls in accordance with their national legal \nauthorities and legislation and consistent with international law,  \n \nWelcoming also the activities of Member States to mitigate insider threats, and \nrecognizing the importance of international cooperation and assistance in this regard, \n \nMindful of the urgent need to address, within the United Nations framework and \nthrough international cooperation, this rising concern for international security,  \n__________________ \n \n4  Ibid., vol. 2153, No. 37605. \n \n5  International Atomic Energy Agency, document GC(65)/24. \n\nA/RES/79/55 \nPreventing the acquisition by terrorists of radioactive sources\n \n24-23080\n4/5 \n \n \n1. \nCalls upon Member States to support international efforts to prevent the \nacquisition and use by terrorists of radioactive sources and, if necessary, suppress \nsuch acts, in accordance with their national legal authorities and legislation and \nconsistent with international law;  \n \n2. \nEncourages all Member States that have not yet done so to become party \nto the International Convention for the Suppression of Acts of Nuclear Terrorism as \nsoon as possible, in accordance with their legal and constitutional processes;  \n \n3. \nInvites Member States, in coordination with the International Atomic \nEnergy Agency and in accordance with its statute, to consider the merits of conducting \nan evaluation of the existing international framework applicable to the security of \nradioactive sources and, if necessary, to explore possible options for its potential \nstrengthening;  \n \n4. \nUrges Member States to take and strengthen national measures and \ncapabilities, as appropriate, to prevent the acquisition and use by terrorists of \nradioactive sources as well as terrorist attacks on nuclear plants and facilities which \nwould result in radioactive releases, and, if necessary, to suppress such acts, in \nparticular by taking effective measures to account for, control, secure and physically \nprotect such facilities, materials and sources in accordance with their national legal \nauthorities and legislation and consistent with their international obligations;  \n \n5. \nStresses the need for Member States to take effective measures, following \ntheir international and domestic obligations, for the security and accountability of the \ntransport of radioactive sources;  \n \n6. \nEncourages Member States to enhance their national capacities with \nappropriate means of detection and related architecture or systems, including through \ninternational cooperation and assistance in conformity with international law and \nregulations, with a view to preventing, detecting and responding to illicit trafficking \nin radioactive sources;  \n \n7. \nInvites Member States, in particular those producing and distributing \nradioactive sources, to support and endorse the efforts of the International Atomic \nEnergy Agency to enhance the safety and security of radioactive sources, as described \nin General Conference resolutions GC(68)/RES/8, on nuclear and radiation safety, \nand GC(68)/RES/9, on nuclear security, and to enhance the security of radioactive \nsources, as described in the Nuclear Security Plan 2022\u20132025; \n \n8. \nUrges all States to maintain effective security of radioactive sources, \nincluding of storage facilities, that may pose a significant risk to individuals, society \nand the environment throughout their life cycle, and encourages all States to make \npolitical commitments to the non-legally binding and voluntary Code of Conduct on \nthe Safety and Security of Radioactive Sources and its supplementary Guidance on \nthe Import and Export of Radioactive Sources and Guidance on the Management of \nDisused Radioactive Sources, and to implement these, as appropriate, in order to \nmaintain effective security of radioactive sources throughout their life cycle;  \n \n9. \nEncourages Member States to work with the International Atomic Energy \nAgency to enhance the non-legally binding international framework for the security \nof radioactive sources, especially on the safe and secure management of disused \nradioactive sources, in accordance with relevant resolutions of the Agency, in \nparticular resolutions GC(68)/RES/8 and GC(68)/RES/9;  \n \n10. Recognizes the value of information exchange on national approaches to \ncontrolling radioactive sources, and takes note of the endorsement by the Board of \nGovernors of the International Atomic Energy Agency of a proposal for a formalized \nprocess for a voluntary periodic exchange on information and lessons learned and for \n\nPreventing the acquisition by terrorists of radioactive sources \nA/RES/79/55\n \n5/5\n24-23080 \n \nthe evaluation of progress made by States towards implementing the provisions of the \nCode of Conduct on the Safety and Security of Radioactive Sources;  \n \n11. Encourages Member States to participate, on a voluntary basis, in the \nIncident and Trafficking Database programme of the International Atomic Energy \nAgency;  \n \n12. Welcomes the efforts undertaken by Member States, including through \ninternational cooperation under the auspices of the International Atomic Energy \nAgency, to search for, locate, recover and secure lost or orphaned radioactive sources \nwithin their State jurisdiction or territory, encourages continued efforts in this way, \nand also encourages cooperation among and between Member States and through \nrelevant international and, where appropriate, regional organizations aimed at \nstrengthening national capacities in this regard;  \n \n13. Encourages Member States, in accordance with their national laws, \npolicies and priorities, to provide support for academic and scientific research to \ndevelop technically and economically appropriate technologies with the capability to \nfurther improve the security of radioactive sources or reduce the risk of acquisition \nby terrorists and of malicious use of radioactive sources, including by, on a voluntary \nbasis and when technically feasible and economically realistic, developing \ntechnologies that do not rely on high activity radioactive sources and developing \nexchanges on alternative technologies, without unduly hindering the beneficial uses \nof radioactive sources;  \n \n14. Invites all Member States to participate, on a voluntary basis, in the annual \nmeeting of the ad hoc working group of stakeholder States involved with alternative \ntechnologies to high activity radioactive sources;  \n \n15. Decides to include in the provisional agenda of its eighty-first session, \nunder the item entitled \u201cGeneral and complete disarmament\u201d, the sub-item entitled \n\u201cPreventing the acquisition by terrorists of radioactive sources\u201d. \n \n43rd plenary meeting \n2 December 2024 \n \n",
  "paragraphs": {
    "1": "Calls upon Member States to support international efforts to prevent the acquisition and use by terrorists of radioactive sources and, if necessary, suppress such acts, in accordance with their national legal authorities and legislation and consistent with international law;",
    "2": "Encourages all Member States that have not yet done so to become party to the International Convention for the Suppression of Acts of Nuclear Terrorism as soon as possible, in accordance with their legal and constitutional processes;",
    "3": "Invites Member States, in coordination with the International Atomic Energy Agency and in accordance with its statute, to consider the merits of conducting an evaluation of the existing international framework applicable to the security of radioactive sources and, if necessary, to explore possible options for its potential strengthening;",
    "4": "Urges Member States to take and strengthen national measures and capabilities, as appropriate, to prevent the acquisition and use by terrorists of radioactive sources as well as terrorist attacks on nuclear plants and facilities which would result in radioactive releases, and, if necessary, to suppress such acts, in particular by taking effective measures to account for, control, secure and physically protect such facilities, materials and sources in accordance with their national legal authorities and legislation and consistent with their international obligations;",
    "5": "Stresses the need for Member States to take effective measures, following their international and domestic obligations, for the security and accountability of the transport of radioactive sources;",
    "6": "Encourages Member States to enhance their national capacities with appropriate means of detection and related architecture or systems, including through international cooperation and assistance in conformity with international law and regulations, with a view to preventing, detecting and responding to illicit trafficking in radioactive sources;",
    "7": "Invites Member States, in particular those producing and distributing radioactive sources, to support and endorse the efforts of the International Atomic Energy Agency to enhance the safety and security of radioactive sources, as described in General Conference resolutions GC(68)/RES/8, on nuclear and radiation safety, and GC(68)/RES/9, on nuclear security, and to enhance the security of radioactive sources, as described in the Nuclear Security Plan 2022\u20132025;",
    "8": "Urges all States to maintain effective security of radioactive sources, including of storage facilities, that may pose a significant risk to individuals, society and the environment throughout their life cycle, and encourages all States to make political commitments to the non-legally binding and voluntary Code of Conduct on the Safety and Security of Radioactive Sources and its supplementary Guidance on the Import and Export of Radioactive Sources and Guidance on the Management of Disused Radioactive Sources, and to implement these, as appropriate, in order to maintain effective security of radioactive sources throughout their life cycle;",
    "9": "Encourages Member States to work with the International Atomic Energy Agency to enhance the non-legally binding international framework for the security of radioactive sources, especially on the safe and secure management of disused radioactive sources, in accordance with relevant resolutions of the Agency, in particular resolutions GC(68)/RES/8 and GC(68)/RES/9;",
    "10": " the evaluation of progress made by States towards implementing the provisions of the Code of Conduct on the Safety and Security of Radioactive Sources;",
    "11": "Encourages Member States to participate, on a voluntary basis, in the Incident and Trafficking Database programme of the International Atomic Energy Agency;",
    "12": "Welcomes the efforts undertaken by Member States, including through international cooperation under the auspices of the International Atomic Energy Agency, to search for, locate, recover and secure lost or orphaned radioactive sources within their State jurisdiction or territory, encourages continued efforts in this way, and also encourages cooperation among and between Member States and through relevant international and, where appropriate, regional organizations aimed at strengthening national capacities in this regard;",
    "13": "Encourages Member States, in accordance with their national laws, policies and priorities, to provide support for academic and scientific research to develop technically and economically appropriate technologies with the capability to further improve the security of radioactive sources or reduce the risk of acquisition by terrorists and of malicious use of radioactive sources, including by, on a voluntary basis and when technically feasible and economically realistic, developing technologies that do not rely on high activity radioactive sources and developing exchanges on alternative technologies, without unduly hindering the beneficial uses of radioactive sources;",
    "14": "Invites all Member States to participate, on a voluntary basis, in the annual meeting of the ad hoc working group of stakeholder States involved with alternative technologies to high activity radioactive sources;",
    "15": "Decides to include in the provisional agenda of its eighty-first session, under the item entitled \u201cGeneral and complete disarmament\u201d, the sub-item entitled \u201cPreventing the acquisition by terrorists of radioactive sources\u201d."
  },
  "agenda_items": [
    "Item 98"
  ],
  "symbol_references": []
}