{
  "symbol": "A/RES/73/316",
  "filename": "A_RES_73_316.pdf",
  "title": "73/316. Financing of the United Nations Stabilization Mission in Haiti",
  "text": "United Nations \nA/RES/73/316 \n \n \nGeneral Assembly \nDistr.: General \n16 July 2019 \n \n19-11312 (E)    180719 \n*1911312* \n \n \nSeventy-third session \nAgenda item 157 \n \n \n \n \n Resolution adopted by the General Assembly on 3 July 2019 \n \n \n \n \n[on the report of the Fifth Committee (A/73/922)] \n \n \n \n73/316. Financing of the United Nations Stabilization Mission in Haiti  \n \n \n \nThe General Assembly, \n \nHaving considered the report of the Secretary-General on the financing of the \nUnited Nations Stabilization Mission in Haiti1 and the related report of the Advisory \nCommittee on Administrative and Budgetary Questions,2 \n \nRecalling Security Council resolution 1529 (2004) of 29 February 2004, by \nwhich the Council declared its readiness to establish a United Nations stabilization \nforce to support continuation of a peaceful and constitutional political process and \nthe maintenance of a secure and stable environment in Haiti, \n \nRecalling also Security Council resolution 1542 (2004) of 30 April 2004, by \nwhich the Council established the United Nations Stabilization Mission in Haiti for \nan initial period of six months, and the subsequent resolutions by which the Council \nextended the mandate of the Mission, the latest of which was resolution 2350 (2017) \nof 13 April 2017, by which the Council extended the mandate of the Mission for a \nfinal period of six months, until 15 October 2017, \n \nRecalling further its resolution 58/315 of 1 July 2004, \n \nRecalling its resolution 58/311 of 18 June 2004 on the financing of the Mission \nand its subsequent resolutions thereon, the latest of which was resolution 72/294 of \n5 July 2018, as well as its decision 72/558 of 5 July 2018, \n \nReaffirming the general principles underlying the financing of United Nations \npeacekeeping operations, as stated in its resolutions 1874 (S-IV) of 27 June 1963, \n3101 (XXVIII) of 11 December 1973 and 55/235 of 23 December 2000,  \n \nMindful of the fact that it is essential to provide the Mission with the financial \nresources necessary to enable it to fulfil its responsibilities under the relevant \nresolutions of the Security Council, \n__________________ \n \n1  A/73/621. \n \n2  A/73/856. \n\nA/RES/73/316 \nFinancing of the United Nations Stabilization Mission in Haiti\n \n19-11312\n2/2 \n \n \n1. \nTakes note of the status of contributions to the United Nations Stabilization \nMission in Haiti as at 30 April 2019, including the contributions outstanding in the \namount of 35.3 million United States dollars, representing some 0.4 per cent of the \ntotal assessed contributions, notes with concern that only 110 Member States have \npaid their assessed contributions in full, and urges all other Member States, in \nparticular those in arrears, to ensure payment of their outstanding assessed \ncontributions;  \n \n2. \nExpresses its appreciation to those Member States that have paid their \nassessed contributions in full, and urges all other Member States to make every \npossible effort to ensure payment of their assessed contributions to the Mission in full; \n \n3. \nEndorses the conclusions and recommendations contained in the report of \nthe Advisory Committee on Administrative and Budgetary Questions,2 and requests \nthe Secretary-General to ensure their full implementation;  \n \n \n \nBudget performance report for the period from 1 July 2017 to 30 June 2018 \n \n \n4. \nTakes note of the report of the Secretary-General on the budget \nperformance of the Mission for the period from 1 July 2017 to 30 June 2018; 1 \n \n5. \nDecides to appropriate to the Special Account for the United Nations \nStabilization Mission in Haiti the amount of 89,999,200 dollars for the maintenance \nof the Mission for the period from 1 July to 31 December 2017, previously authorized \nfor the Mission under the terms of its resolution 71/302 of 30 June 2017; \n \n6. \nAlso decides that, for Member States that have fulfilled their financial \nobligations to the Mission, there shall be set off against their apportionment with \nrespect to the United Nations Mission for Justice Support in Haiti, as provided for in \nits resolution 73/317 of 3 July 2019, their respective share of the unencumbered \nbalance and other revenue in the total amount of 8,804,900 dollars in respect of the \nfinancial period ended 30 June 2018, in accordance with the levels updated in its \nresolution 70/246 of 23 December 2015, taking into account the scale of assessments \nfor 2018, as set out in its resolution 70/245 of 23 December 2015;  \n \n7. \nFurther decides that, for Member States that have not fulfilled their \nfinancial obligations to the Mission, there shall be set off against their outstanding \nobligations their respective share of the unencumbered balance and other revenue in \nthe amount of 8,804,900 dollars in respect of the financial period ended 30 June 2018, \nin accordance with the scheme set out in paragraph 6 above;  \n \n8. \nDecides that the increase in the estimated staff assessment income of \n2,026,300 dollars in respect of the financial period ended 30 June 2018 shall be added \nto the credits in the amount of 8,804,900 dollars referred to in paragraphs 6 and 7 \nabove;  \n \n9. \nAlso decides to include in the provisional agenda of its seventy-fourth \nsession the item entitled \u201cFinancing of the United Nations Stabilization Mission in \nHaiti\u201d. \n \n97th plenary meeting \n3 July 2019 \n \n",
  "paragraphs": {
    "1": "Takes note of the status of contributions to the United Nations Stabilization Mission in Haiti as at 30 April 2019, including the contributions outstanding in the amount of 35.3 million United States dollars, representing some 0.4 per cent of the total assessed contributions, notes with concern that only 110 Member States have paid their assessed contributions in full, and urges all other Member States, in particular those in arrears, to ensure payment of their outstanding assessed contributions;",
    "2": "Expresses its appreciation to those Member States that have paid their assessed contributions in full, and urges all other Member States to make every possible effort to ensure payment of their assessed contributions to the Mission in full;",
    "3": "Endorses the conclusions and recommendations contained in the report of the Advisory Committee on Administrative and Budgetary Questions,2 and requests the Secretary-General to ensure their full implementation; Budget performance report for the period from 1 July 2017 to 30 June 2018",
    "4": "Takes note of the report of the Secretary-General on the budget performance of the Mission for the period from 1 July 2017 to 30 June 2018; 1",
    "5": "Decides to appropriate to the Special Account for the United Nations Stabilization Mission in Haiti the amount of 89,999,200 dollars for the maintenance of the Mission for the period from 1 July to 31 December 2017, previously authorized for the Mission under the terms of its resolution 71/302 of 30 June 2017;",
    "6": "Also decides that, for Member States that have fulfilled their financial obligations to the Mission, there shall be set off against their apportionment with respect to the United Nations Mission for Justice Support in Haiti, as provided for in its resolution 73/317 of 3 July 2019, their respective share of the unencumbered balance and other revenue in the total amount of 8,804,900 dollars in respect of the financial period ended 30 June 2018, in accordance with the levels updated in its resolution 70/246 of 23 December 2015, taking into account the scale of assessments for 2018, as set out in its resolution 70/245 of 23 December 2015;",
    "7": "Further decides that, for Member States that have not fulfilled their financial obligations to the Mission, there shall be set off against their outstanding obligations their respective share of the unencumbered balance and other revenue in the amount of 8,804,900 dollars in respect of the financial period ended 30 June 2018, in accordance with the scheme set out in paragraph 6 above;",
    "8": "Decides that the increase in the estimated staff assessment income of 2,026,300 dollars in respect of the financial period ended 30 June 2018 shall be added to the credits in the amount of 8,804,900 dollars referred to in paragraphs 6 and 7 above;",
    "9": "Also decides to include in the provisional agenda of its seventy-fourth session the item entitled \u201cFinancing of the United Nations Stabilization Mission in Haiti\u201d."
  },
  "agenda_items": [
    "Item 157"
  ],
  "symbol_references": []
}