{
  "symbol": "A/RES/76/271",
  "filename": "A_RES_76_271.pdf",
  "title": "76/271. Addressing racism and promoting dignity for all in the United Nations Secretariat",
  "text": "United Nations \nA/RES/76/271\n \n \nGeneral Assembly \nDistr.: General \n7 July 2022 \n \n22-10325 (E)    070722 \n*2210325* \n \n \nSeventy-sixth session \nAgenda item 138 \nProgramme budget for 2022 \n \n \n \n \n Resolution adopted by the General Assembly \non 29 June 2022 \n \n \n \n \n[on the report of the Fifth Committee (A/76/633/Add.2, para. 6)] \n \n \n 76/271. Addressing racism and promoting dignity for all in the \nUnited Nations Secretariat \n \n \n \nThe General Assembly, \n \nHaving considered the report of the Secretary-General1 and the related report of \nthe Advisory Committee on Administrative and Budgetary Questions, 2  \n \n1. \nTakes note of the report of the Secretary-General; \n \n2. \nEndorses the conclusions and recommendations contained in the report of \nthe Advisory Committee on Administrative and Budgetary Questions; \n \n3. \nApproves the establishment of eight new general temporary assistance \npositions for 18 months, as detailed in the table below: \n \nD-2 \nD-1 \nP-5 \nP-4 \nP-3 \nP-2 \nGS (PL) \nGS (OL) \nTotal \nDepartment of Management \nStrategy, Policy and Compliance \n1 \n\u2013 \n2 \n3 \n\u2013 \n1 \n\u2013 \n\u2013 \n7 \nDepartment of Operational Support \n\u2013 \n\u2013 \n\u2013 \n1 \n\u2013 \n\u2013 \n\u2013 \n\u2013 \n1 \nTotal \n1 \n\u2013 \n2 \n4 \n\u2013 \n1 \n\u2013 \n\u2013 \n8 \n \nAbbreviations: GS (OL), General Service (Other level); GS (PL), General Service (Principal level). \n \n \n \n4. \nAppropriates an additional amount of 1,194,200 United States dollars, \ncomprising 861,400 dollars under section 29A, Department of Management Strategy, \n__________________ \n \n1  A/76/771. \n \n2  A/76/7/Add.39. \n\nA/RES/76/271 \nAddressing racism and promoting dignity \nfor all in the United Nations Secretariat\n \n22-10325\n2/2 \n \nPolicy and Compliance, and 332,800 dollars under section 29B, Department of \nOperational Support, of the programme budget for 2022; \n \n5. \nAlso appropriates an amount of 55,700 dollars under section 36, Staff \nassessment, to be offset by an equivalent amount under income section 1, Income \nfrom staff assessment, of the programme budget for 2022. \n \n89th plenary meeting \n29 June 2022 \n \n",
  "paragraphs": {
    "1": "Takes note of the report of the Secretary-General;",
    "2": "Endorses the conclusions and recommendations contained in the report of the Advisory Committee on Administrative and Budgetary Questions;",
    "3": "Approves the establishment of eight new general temporary assistance positions for 18 months, as detailed in the table below: D-2 D-1 P-5 P-4 P-3 P-2 GS (PL) GS (OL) Total Department of Management Strategy, Policy and Compliance 1 \u2013 2 3 \u2013 1 \u2013 \u2013 7 Department of Operational Support \u2013 \u2013 \u2013 1 \u2013 \u2013 \u2013 \u2013 1 Total 1 \u2013 2 4 \u2013 1 \u2013 \u2013 8 Abbreviations: GS (OL), General Service (Other level); GS (PL), General Service (Principal level).",
    "4": "Appropriates an additional amount of 1,194,200 United States dollars, comprising 861,400 dollars under section 29A, Department of Management Strategy, __________________ 1 A/76/771. 2 A/76/7/Add.39. A/RES/76/271 Addressing racism and promoting dignity for all in the United Nations Secretariat 22-10325 2/2 Policy and Compliance, and 332,800 dollars under section 29B, Department of Operational Support, of the programme budget for 2022;",
    "5": "Also appropriates an amount of 55,700 dollars under section 36, Staff assessment, to be offset by an equivalent amount under income section 1, Income from staff assessment, of the programme budget for 2022. 89th plenary meeting 29 June 2022"
  },
  "agenda_items": [
    "Item 138"
  ],
  "symbol_references": []
}