{
  "symbol": "A/RES/73/288",
  "filename": "A_RES_73_288.pdf",
  "title": "73/288. Construction of a new facility for the International Residual Mechanism for Criminal Tribunals, Arusha branch",
  "text": "United Nations \nA/RES/73/288\n \n \nGeneral Assembly \nDistr.: General \n18 April 2019 \n \n19-06366 (E)    230419     \n*1906366* \n \n \nSeventy-third session \nAgenda item 148 \n \n \n \n \n Resolution adopted by the General Assembly \non 15 April 2019 \n \n \n \n \n[on the report of the Fifth Committee (A/73/670/Add.1)] \n \n \n 73/288. Construction of a new facility for the International Residual \nMechanism for Criminal Tribunals, Arusha branch \n \n \n \nThe General Assembly, \n \nRecalling its resolutions 66/240 A of 24 December 2011, 66/240 B of 21 June \n2012, 67/244 A of 24 December 2012, 67/244 B of 12 April 2013, 68/257 of \n27 December 2013, 68/267 of 9 April 2014, 69/256 of 29 December 2014, 69/276 of \n2 April 2015, 70/243 of 23 December 2015, 70/258 of 1 April 2016, 71/282 of 6 April \n2017 and 72/270 of 4 April 2018,  \n \nHaving considered the report of the Secretary-General1 and the related report of \nthe Advisory Committee on Administrative and Budgetary Questions, 2 \n \n1. \nTakes note of the report of the Secretary-General;1 \n \n2. \nEndorses the conclusions and recommendations contained in the report of \nthe Advisory Committee on Administrative and Budgetary Questions; 2 \n \n3. \nNotes with appreciation the continued efforts of the Government of the \nUnited Republic of Tanzania in facilitating the construction project; \n \n4. \nStresses the importance of completing all outstanding works on time and \nwithin budget, and to that end requests the Secretary-General to complete the \nconstruction, including the remediation of defects relating to the heating, ventilation \nand air-conditioning system, within the revised time frame and within the total budget \nof 8,787,733 United States dollars approved for the project;  \n \n5. \nRecalls paragraph 28 of the report of the Advisory Committee, and \nrequests the Secretary-General to continue his efforts to pursue the recovery of the \ndirect and indirect costs arising from errors and delays, where economically feasible \nto do so, and to report thereon in the context of his final report;  \n__________________ \n \n1  A/73/718. \n \n2  A/73/763. \n\nA/RES/73/288 \nConstruction of a new facility for the International Residual\nMechanism for Criminal Tribunals, Arusha branch\n \n19-06366\n2/2 \n \n \n6. \nNotes the progress made in the construction of the new premises, and \nrequests the Secretary-General to submit a final report to the General Assembly \nduring its seventy-fourth session;  \n \n7. \nRequests the Secretary-General, in the context of his final report, to \ninclude, inter alia, an analysis of and comprehensive information on lessons learned \nand best practices for application, as appropriate, to other construction projects;  \n \n8. \nWelcomes the efforts made by the International Residual Mechanism for \nCriminal Tribunals to cooperate with other United Nations entities on construction-\nrelated issues.  \n \n75th plenary meeting \n15 April 2019 \n \n",
  "paragraphs": {
    "1": "Takes note of the report of the Secretary-General;1",
    "2": "Endorses the conclusions and recommendations contained in the report of the Advisory Committee on Administrative and Budgetary Questions; 2",
    "3": "Notes with appreciation the continued efforts of the Government of the United Republic of Tanzania in facilitating the construction project;",
    "4": "Stresses the importance of completing all outstanding works on time and within budget, and to that end requests the Secretary-General to complete the construction, including the remediation of defects relating to the heating, ventilation and air-conditioning system, within the revised time frame and within the total budget of 8,787,733 United States dollars approved for the project;",
    "5": "Recalls paragraph 28 of the report of the Advisory Committee, and requests the Secretary-General to continue his efforts to pursue the recovery of the direct and indirect costs arising from errors and delays, where economically feasible to do so, and to report thereon in the context of his final report; __________________ 1 A/73/718. 2 A/73/763. A/RES/73/288 Construction of a new facility for the International Residual Mechanism for Criminal Tribunals, Arusha branch 19-06366 2/2",
    "6": "Notes the progress made in the construction of the new premises, and requests the Secretary-General to submit a final report to the General Assembly during its seventy-fourth session;",
    "7": "Requests the Secretary-General, in the context of his final report, to include, inter alia, an analysis of and comprehensive information on lessons learned and best practices for application, as appropriate, to other construction projects;",
    "8": "Welcomes the efforts made by the International Residual Mechanism for Criminal Tribunals to cooperate with other United Nations entities on construction- related issues. 75th plenary meeting 15 April 2019"
  },
  "agenda_items": [
    "Item 148"
  ],
  "symbol_references": []
}