{
  "symbol": "A/RES/79/75",
  "filename": "A_RES_79_75.pdf",
  "title": "79/75. Convention on Prohibitions or Restrictions on the Use of Certain Conventional Weapons Which May Be Deemed to Be Excessively Injurious or to Have Indiscriminate Effects",
  "text": "United Nations \nA/RES/79/75\n \n \nGeneral Assembly \nDistr.: General \n10 December 2024 \n \n24-23060 (E)     \n*2423060* \n \n \nSeventy-ninth session \nAgenda item 102 \nConvention on Prohibitions or Restrictions on the Use of \nCertain Conventional Weapons Which May Be Deemed to \nBe Excessively Injurious or to Have Indiscriminate Effects \n \n \n \n \n Resolution adopted by the General Assembly \non 2 December 2024 \n \n \n \n \n[on the report of the First Committee (A/79/412, para. 7)] \n \n \n \n79/75. Convention on Prohibitions or Restrictions on the Use of Certain \nConventional Weapons Which May Be Deemed to Be Excessively \nInjurious or to Have Indiscriminate Effects \n \n \n \nThe General Assembly, \n \nRecalling its resolution 78/64 of 4 December 2023, \n \nRecalling with satisfaction the adoption and entry into force of the Convention \non Prohibitions or Restrictions on the Use of Certain Conventional Weapons Which \nMay Be Deemed to Be Excessively Injurious or to Have Indiscriminate Effects 1 and \nits amended article 1,2 the Protocol on Non-Detectable Fragments (Protocol I),3 the \nProtocol on Prohibitions or Restrictions on the Use of Mines, Booby Traps and Other \nDevices (Protocol II) 4 and its amended version, 5 the Protocol on Prohibitions or \nRestrictions on the Use of Incendiary Weapons (Protocol III), 6  the Protocol on \nBlinding Laser Weapons (Protocol IV)7 and the Protocol on Explosive Remnants of \nWar (Protocol V),8 \n__________________ \n \n1  United Nations, Treaty Series, vol. 1342, No. 22495. \n \n2  Ibid., vol. 2260, No. 22495. \n \n3  Ibid., vol. 1342, No. 22495. \n \n4  Ibid., vol. 1342, No. 22495. \n \n5  Ibid., vol. 2048, No. 22495. \n \n6  Ibid., vol. 1342, No. 22495. \n \n7  Ibid., vol. 2024, No. 22495. \n \n8  Ibid., vol. 2399, No. 22495. \n\nA/RES/79/75 \nConvention on Prohibitions or Restrictions on the Use of Certain \nConventional Weapons Which May Be Deemed to Be Excessively \nInjurious or to Have Indiscriminate Effects\n \n24-23060\n2/4 \n \n \nWelcoming the results of the Sixth Review Conference9 and the Meeting of the \nHigh Contracting Parties to the Convention, held in Geneva from 15 to 17 November \n2023, and the adoption of its final document,10 \n \nWelcoming also the results of the Twenty-fifth Annual Conference of the High \nContracting Parties to Amended Protocol II, held in Geneva on 14 November 2023,  \n \nWelcoming further the work of the Seventeenth Annual Conference of the High \nContracting Parties to Protocol V, held in Geneva on 13 November 2023, \n \nNoting with satisfaction that the Meeting of the Group of Experts of the High \nContracting Parties to Amended Protocol II and the Informal Open Consultations on \nProtocol V were held in Geneva on 9 and 10 November and 8 November 2023, \nrespectively, and the Meeting of the Group of Experts of the High Contracting Parties \nto Amended Protocol II and the Meeting of Experts of the High Contracting Parties \nto Protocol V were held in Geneva on 3 and 4 September and 2 September 2024, \nrespectively, \n \nNoting with satisfaction also that the Group of Governmental Experts on \nEmerging Technologies in the Area of Lethal Autonomous Weapons Systems of the \nHigh Contracting Parties to the Convention met in Geneva from 4 to 8 March and \nfrom 26 to 30 August 2024, \n \nRecalling the role played by the International Committee of the Red Cross in \nthe elaboration of the Convention and the Protocols thereto, and welcoming the \nparticular efforts of various international, non-governmental and other organizations \nin raising awareness of the humanitarian consequences of various categories of \nconventional weapons which may be deemed to be excessively injurious or to have \nindiscriminate effects, \n \nEmphasizing the importance of the perspectives of women, men, boys and girls \nin considering the issues addressed by the Convention and its Protocols, \n \n1. \nCalls upon all States that have not yet done so to take all measures to \nbecome parties, as soon as possible, to the Convention on Prohibitions or Restrictions \non the Use of Certain Conventional Weapons Which May Be Deemed to Be \nExcessively Injurious or to Have Indiscriminate Effects and the Protocols thereto, as \namended, with a view to achieving the widest possible adherence to these instruments \nat an early date and so as to ultimately achieve their universality; \n \n2. \nCalls upon all High Contracting Parties to the Convention that have not \nyet done so to express their consent to be bound by the Protocols to the Convention \nand the amendment extending the scope of the Convention and the Protocols thereto \nto include armed conflicts of a non-international character; \n \n3. \nEmphasizes the importance of the universalization of the Protocol on \nExplosive Remnants of War (Protocol V); \n \n4. \nWelcomes additional ratifications and acceptances of or accessions to the \nConvention, as well as consents to be bound by the Protocols thereto; \n \n5. \nAcknowledges the continued efforts of the Secretary-General, as \ndepositary of the Convention and the Protocols thereto, and of the respective office \nholders of the conferences of the High Contracting Parties to the Convention, \nProtocol V and Amended Protocol II, on behalf of the High Contracting Parties, to \nachieve the goal of universality; \n__________________ \n \n9  CCW/CONF.VI/11. \n \n10  CCW/MSP/2023/7. \n\nConvention on Prohibitions or Restrictions on the Use of Certain \nConventional Weapons Which May Be Deemed to Be Excessively \nInjurious or to Have Indiscriminate Effects \nA/RES/79/75\n \n3/4\n24-23060 \n \n \n6. \nWelcomes the work of the Implementation Support Unit; \n \n7. \nCalls upon the High Contracting Parties and States not parties to the \nConvention participating in the meetings of the High Contracting Parties to the \nConvention and its annexed Protocols to ensure full compliance with all financial \nobligations under the Convention and its annexed Protocols, and calls upon the High \nContracting Parties to explore measures that could reduce costs and improve the \nefficiency and financial stability of such meetings without prejudice to the rules of \nprocedure and to their quality, and their commitment to address issues arising from \noutstanding contributions in a timely manner; \n \n8. \nRecalls the following decisions by the Sixth Review Conference and the \nconclusions and recommendations of the Meeting of the High Contracting Parties to \nthe Convention, held in Geneva from 15 to 17 November 2023: \n \n(a) \nTo continue the work of the open-ended Group of Governmental Experts \non Emerging Technologies in the Area of Lethal Autonomous Weapons Systems, \nestablished in decision 1 of the Fifth Review Conference of the High Contracting \nParties to the Convention,11 adhering to the agreed recommendations contained in \ndocument CCW/CONF.V/2 in line with decision 1 of the Sixth Review Conference, 12 \nto strengthen the Convention;  \n \n(b) \nTo adopt the consolidated financial measures contained in annex III to \ndocument CCW/CONF.VI/11, which may be reviewed by the meetings of the High \nContracting Parties during the review cycle of 2022\u20132026; \n \n(c) \nTo continue the Sponsorship Programme; \n \n(d) \nTo organize in 2024, in an in-person format, in accordance with the regular \npractice under the Convention, and subject to available resources, the following \nConvention-related activities:  \n \n(i) \nThe Meeting of Experts of the High Contracting Parties to Protocol V, on \n2 September 2024, in accordance with the relevant decisions taken by the \nSeventeenth Annual Conference of the High Contracting Parties to Protocol V; \n \n(ii) The Meeting of the Group of Experts of the High Contracting Parties to \nAmended Protocol II, on 3 and 4 September 2024, in accordance with the \nrelevant decisions taken by the Twenty-fifth Annual Conference of the High \nContracting Parties to Amended Protocol II;  \n \n(iii) The open-ended Group of Governmental Experts on Emerging \nTechnologies in the Area of Lethal Autonomous Weapons Systems, for a \nduration of 10 days, from 4 to 8 March and from 26 to 30 August 2024, and to \nadopt its estimated costs;13 \n \n(iv) The Eighteenth Annual Conference of the High Contracting Parties to \nProtocol V, on 11 November 2024, in accordance with the relevant decisions \ntaken by the Seventeenth Annual Conference of the High Contracting Parties to \nProtocol V;14 \n \n(v) \nThe Twenty-sixth Annual Conference of the High Contracting Parties to \nAmended Protocol II, on 12 November 2024, in accordance with the relevant \ndecisions taken by the Twenty-fifth Annual Conference of the High Contracting \nParties to Amended Protocol II;15 \n__________________ \n \n11  See CCW/CONF.V/10. \n \n12  See CCW/CONF.VI/11. \n \n13  CCW/MSP/2023/5. \n \n14 CCW/P.V/CONF/2023/5. \n \n15  CCW/AP.II/CONF.25/5. \n\nA/RES/79/75 \nConvention on Prohibitions or Restrictions on the Use of Certain \nConventional Weapons Which May Be Deemed to Be Excessively \nInjurious or to Have Indiscriminate Effects\n \n24-23060\n4/4 \n \n \n(vi) Meeting of the High Contracting Parties to the Convention, from 13 to \n15 November 2024, and to adopt its estimated costs;16 \n \n9. \nWelcomes the commitment by the High Contracting Parties to continue to \ncontribute to the further development of international humanitarian law, and, in this \ncontext, to keep under review both the development of new weapons and uses of \nweapons, which may have indiscriminate effects or cause unnecessary suffering; \n \n10. Also welcomes the commitment of the High Contracting Parties to \nProtocol V to the effective and efficient implementation of the Protocol and the \nimplementation of the decisions of the First and Second Conferences of the High \nContracting Parties to the Protocol establishing a comprehensive framework for the \nexchange of information and cooperation; \n \n11. \nNotes that, in conformity with article 8 of the Convention, conferences \nmay be convened to examine amendments to the Convention or to any of the Protocols \nthereto, to examine additional protocols concerning other categories of conventional \nweapons not covered by existing Protocols or to review the scope and application of \nthe Convention and the Protocols thereto and to examine any proposed amendments \nor additional protocols; \n \n12. Underlines the vital role of the full and equal participation of women in \ndecision-making and implementation of the Convention; \n \n13. Requests the Secretary-General to render the assistance necessary and to \nprovide such services as may be required for the annual conferences and expert \nmeetings of the High Contracting Parties to the Convention and of the High \nContracting Parties to Amended Protocol II and Protocol V, as well as for any \ncontinuation of the work after the meetings; \n \n14. Also requests the Secretary-General, in his capacity as depositary of the \nConvention and the Protocols thereto, to continue to inform the General Assembly \nperiodically, by electronic means, of ratifications and acceptances of and accessions \nto the Convention, its amended article 1 and the Protocols; \n \n15. Decides to include in the provisional agenda of its eightieth session the \nitem entitled \u201cConvention on Prohibitions or Restrictions on the Use of Certain \nConventional Weapons Which May Be Deemed to Be Excessively Injurious or to \nHave Indiscriminate Effects\u201d. \n \n44th plenary meeting \n2 December 2024 \n \n__________________ \n \n16  CCW/MSP/2023/6. \n",
  "paragraphs": {
    "1": "Calls upon all States that have not yet done so to take all measures to become parties, as soon as possible, to the Convention on Prohibitions or Restrictions on the Use of Certain Conventional Weapons Which May Be Deemed to Be Excessively Injurious or to Have Indiscriminate Effects and the Protocols thereto, as amended, with a view to achieving the widest possible adherence to these instruments at an early date and so as to ultimately achieve their universality;",
    "2": "Calls upon all High Contracting Parties to the Convention that have not yet done so to express their consent to be bound by the Protocols to the Convention and the amendment extending the scope of the Convention and the Protocols thereto to include armed conflicts of a non-international character;",
    "3": "Emphasizes the importance of the universalization of the Protocol on Explosive Remnants of War (Protocol V);",
    "4": "Welcomes additional ratifications and acceptances of or accessions to the Convention, as well as consents to be bound by the Protocols thereto;",
    "5": "Acknowledges the continued efforts of the Secretary-General, as depositary of the Convention and the Protocols thereto, and of the respective office holders of the conferences of the High Contracting Parties to the Convention, Protocol V and Amended Protocol II, on behalf of the High Contracting Parties, to achieve the goal of universality; __________________ 9 CCW/CONF.VI/11. 10 CCW/MSP/2023/7. Convention on Prohibitions or Restrictions on the Use of Certain Conventional Weapons Which May Be Deemed to Be Excessively Injurious or to Have Indiscriminate Effects A/RES/79/75 3/4 24-23060",
    "6": "Welcomes the work of the Implementation Support Unit;",
    "7": "Calls upon the High Contracting Parties and States not parties to the Convention participating in the meetings of the High Contracting Parties to the Convention and its annexed Protocols to ensure full compliance with all financial obligations under the Convention and its annexed Protocols, and calls upon the High Contracting Parties to explore measures that could reduce costs and improve the efficiency and financial stability of such meetings without prejudice to the rules of procedure and to their quality, and their commitment to address issues arising from outstanding contributions in a timely manner;",
    "8": "Recalls the following decisions by the Sixth Review Conference and the conclusions and recommendations of the Meeting of the High Contracting Parties to the Convention, held in Geneva from 15 to 17 November 2023: (a) To continue the work of the open-ended Group of Governmental Experts on Emerging Technologies in the Area of Lethal Autonomous Weapons Systems, established in decision 1 of the Fifth Review Conference of the High Contracting Parties to the Convention,11 adhering to the agreed recommendations contained in document CCW/CONF.V/2 in line with decision 1 of the Sixth Review Conference, 12 to strengthen the Convention; (b) To adopt the consolidated financial measures contained in annex III to document CCW/CONF.VI/11, which may be reviewed by the meetings of the High Contracting Parties during the review cycle of 2022\u20132026; (c) To continue the Sponsorship Programme; (d) To organize in 2024, in an in-person format, in accordance with the regular practice under the Convention, and subject to available resources, the following Convention-related activities: (i) The Meeting of Experts of the High Contracting Parties to Protocol V, on 2 September 2024, in accordance with the relevant decisions taken by the Seventeenth Annual Conference of the High Contracting Parties to Protocol V; (ii) The Meeting of the Group of Experts of the High Contracting Parties to Amended Protocol II, on 3 and 4 September 2024, in accordance with the relevant decisions taken by the Twenty-fifth Annual Conference of the High Contracting Parties to Amended Protocol II; (iii) The open-ended Group of Governmental Experts on Emerging Technologies in the Area of Lethal Autonomous Weapons Systems, for a duration of 10 days, from 4 to 8 March and from 26 to 30 August 2024, and to adopt its estimated costs;13 (iv) The Eighteenth Annual Conference of the High Contracting Parties to Protocol V, on 11 November 2024, in accordance with the relevant decisions taken by the Seventeenth Annual Conference of the High Contracting Parties to Protocol V;14 (v) The Twenty-sixth Annual Conference of the High Contracting Parties to Amended Protocol II, on 12 November 2024, in accordance with the relevant decisions taken by the Twenty-fifth Annual Conference of the High Contracting Parties to Amended Protocol II;15 __________________ 11 See CCW/CONF.V/10. 12 See CCW/CONF.VI/11. 13 CCW/MSP/2023/5. 14 CCW/P.V/CONF/2023/5. 15 CCW/AP.II/CONF.25/5. A/RES/79/75 Convention on Prohibitions or Restrictions on the Use of Certain Conventional Weapons Which May Be Deemed to Be Excessively Injurious or to Have Indiscriminate Effects 24-23060 4/4 (vi) Meeting of the High Contracting Parties to the Convention, from 13 to 15 November 2024, and to adopt its estimated costs;16",
    "9": "Welcomes the commitment by the High Contracting Parties to continue to contribute to the further development of international humanitarian law, and, in this context, to keep under review both the development of new weapons and uses of weapons, which may have indiscriminate effects or cause unnecessary suffering;",
    "10": "Also welcomes the commitment of the High Contracting Parties to Protocol V to the effective and efficient implementation of the Protocol and the implementation of the decisions of the First and Second Conferences of the High Contracting Parties to the Protocol establishing a comprehensive framework for the exchange of information and cooperation;",
    "11": "Notes that, in conformity with article 8 of the Convention, conferences may be convened to examine amendments to the Convention or to any of the Protocols thereto, to examine additional protocols concerning other categories of conventional weapons not covered by existing Protocols or to review the scope and application of the Convention and the Protocols thereto and to examine any proposed amendments or additional protocols;",
    "12": "Underlines the vital role of the full and equal participation of women in decision-making and implementation of the Convention;",
    "13": "Requests the Secretary-General to render the assistance necessary and to provide such services as may be required for the annual conferences and expert meetings of the High Contracting Parties to the Convention and of the High Contracting Parties to Amended Protocol II and Protocol V, as well as for any continuation of the work after the meetings;",
    "14": "Also requests the Secretary-General, in his capacity as depositary of the Convention and the Protocols thereto, to continue to inform the General Assembly periodically, by electronic means, of ratifications and acceptances of and accessions to the Convention, its amended article 1 and the Protocols;",
    "15": "Decides to include in the provisional agenda of its eightieth session the item entitled \u201cConvention on Prohibitions or Restrictions on the Use of Certain Conventional Weapons Which May Be Deemed to Be Excessively Injurious or to Have Indiscriminate Effects\u201d. 44th plenary meeting 2 December 2024 __________________ 16 CCW/MSP/2023/6."
  },
  "agenda_items": [
    "Item 102"
  ],
  "symbol_references": []
}