{
  "symbol": "A/RES/78/318",
  "filename": "A_RES_78_318.pdf",
  "title": "78/318. Modalities of the \u201cWorld Social Summit\u201d under the title \u201cthe Second World Summit for Social Development\u201d",
  "text": "United Nations \nA/RES/78/318\n \n \nGeneral Assembly \nDistr.: General \n23 July 2024 \n \n24-13498 (E)     \n*2413498* \n \n \nSeventy-eighth session \nAgenda item 24 (b) \nSocial development: social development, including \nquestions relating to the world social situation and to \nyouth, ageing, persons with disabilities and the family \n \n \n \n \n Resolution adopted by the General Assembly \non 16 July 2024 \n \n \n \n \n[without reference to a Main Committee (A/78/L.93)] \n \n \n 78/318. Modalities of the \u201cWorld Social Summit\u201d under the title \n\u201cthe Second World Summit for Social Development\u201d \n \n \n \nThe General Assembly,  \n \nRecalling the World Summit for Social Development, held in Copenhagen from \n6 to 12 March 1995, and the twenty-fourth special session of the General Assembly, \nentitled \u201cWorld Summit for Social Development and beyond: achieving social \ndevelopment for all in a globalizing world\u201d, held in Geneva from 26 June to 1 July \n2000, \n \nReaffirming that the Copenhagen Declaration on Social Development and the \nProgramme of Action of the World Summit for Social Development 1 and the further \ninitiatives for social development adopted by the General Assembly at its twenty-\nfourth special session,2 as well as a continued global dialogue on social development \nissues, constitute the basic framework for the promotion of social development for all \nat the national and international levels, \n \nReaffirming also all previous resolutions on the implementation of the outcome \nof the World Summit for Social Development and of the twenty-fourth special session \nof the General Assembly, including resolution 78/174 of 19 December 2023, \n \nReaffirming further its resolution 78/261 of 26 February 2024, entitled \u201cWorld \nSocial Summit\u201d under the title \u201cSecond World Summit for Social Development\u201d, by \nwhich it decided to convene the \u201cWorld Social Summit\u201d in 2025, under the title \u201cthe \nSecond World Summit for Social Development\u201d, to address the gaps and recommit to \nthe Copenhagen Declaration on Social Development and the Programme of Action \n__________________ \n \n1  Report of the World Summit for Social Development, Copenhagen, 6\u201312 March 1995 (United \nNations publication, Sales No. E.96.IV.8), chap. I, resolution 1, annexes I and II. \n \n2  Resolution S-24/2, annex. \n\nA/RES/78/318 \nModalities of the \u201cWorld Social Summit\u201d under the title \n\u201cthe Second World Summit for Social Development\u201d\n \n24-13498\n2/4 \n \nand its implementation and give momentum towards the implementation of the 2030 \nAgenda for Sustainable Development,3  \n \nWelcoming the progress made towards the full implementation of the \nCopenhagen Declaration and the Programme of Action through concerted action at \nthe national, regional and international levels, and expressing its deep concern that, \nmore than 25 years after the convening of the World Summit for Social Development, \nprogress has been slow and uneven, and major gaps remain, \n \nRecognizing that the three core themes of social development, namely, poverty \neradication, full and productive employment and decent work for all and social \nintegration, are interrelated and mutually reinforcing, and that an enabling \nenvironment therefore needs to be created so that all three objectives can be pursued \nsimultaneously, \n \nSharing the conviction that social development and social justice are \nindispensable for the achievement and maintenance of peace and security within and \namong nations, and that, in turn, social development and social justice cannot be \nattained in the absence of peace and security or in the absence of respect for all human \nrights and fundamental freedoms, \n \nReaffirming that the Commission for Social Development continues to have the \nprimary responsibility for the follow-up to and review of the World Summit for Social \nDevelopment and the outcome of the twenty-fourth special session of the General \nAssembly, and that it serves as the main United Nations forum for an intensified \nglobal dialogue on social development issues, \n \nRecognizing the role and positive contributions of the International Labour \nOrganization and its constituents, namely Governments, employers and workers, to \npromote social justice and decent work for all, \n \nRecalling General Assembly resolution 70/1 of 25 September 2015, entitled \n\u201cTransforming our world: the 2030 Agenda for Sustainable Development\u201d, in which \nthe Assembly adopted a comprehensive, far-reaching and people-centred set of \nuniversal and transformative Sustainable Development Goals and targets and \naffirmed its commitment to working tirelessly for the full implementation of the \nAgenda by 2030 with a view to leaving no one behind and reaching the furthest behind \nfirst, and its recognition that eradicating poverty in all its forms and dimensions, \nincluding extreme poverty, is the greatest global challenge and an indispensable \nrequirement for sustainable development, \n \nRecalling also its resolution 76/6 of 15 November 2021, entitled \u201cFollow-up to \nthe report of the Secretary-General entitled \u2018Our Common Agenda\u2019\u201d,4 and noting the \nproposal contained in that report to convene a world social summit in 2025, to be \ndiscussed and agreed upon by Member States, including its modalities, title, \nobjectives, scope and possible outcomes, and emphasizing that the possible summit\u2019s \noutcome should have a social development approach including the need to place \npeople at the centre of development and the pledge to make poverty eradication, full \nemployment and social integration the overriding development objectives, and give \nmomentum towards the implementation of the 2030 Agenda, \n \n1. \nDecides that the \u201cWorld Social Summit\u2019\u2019 under the title \u201cthe Second World \nSummit for Social Development\u201d will be held at the level of Heads of State or \nGovernment in Qatar from 4 to 6 November 2025, and welcomes the offer by the \n__________________ \n \n3  Resolution 70/1. \n \n4  A/75/982. \n\nModalities of the \u201cWorld Social Summit\u201d under the title \n\u201cthe Second World Summit for Social Development\u201d \nA/RES/78/318\n \n3/4\n24-13498 \n \nGovernment of Qatar to host the \u201cWorld Social Summit\u2019\u2019 under the title \u201cthe Second \nWorld Summit on Social Development\u2019\u2019 in 2025; \n \n2. \nAlso decides that the Summit will adopt a concise, action-oriented political \ndeclaration, agreed in advance by consensus through intergovernmental negotiations \nin New York, that should have a social development approach and give momentum \ntowards the implementation of the 2030 Agenda for Sustainable Development; \n \n3. \nFurther decides that the Summit, subject to the rules of procedure of the \nGeneral Assembly, will consist of: \n \n(a) \nPlenary meetings from 9 a.m. to 1 p.m. and from 3 to 6 p.m.; \n \n(b) \nAn opening segment on the first day from 9 to 10.30 a.m., which will \ninclude the adoption of the political declaration followed by statements from the \nPresident of the General Assembly, the Secretary-General and the President of the \nEconomic and Social Council; \n \n(c) \nA closing segment on the third day from 5 to 6 p.m., which will feature a \nstatement from the President of the General Assembly; \n \n4. \nDecides that the Summit will have two high-level round tables, each to be \nco-chaired by two Heads of State or Government, one from a developed country and \none from a developing country, to be appointed by the President of the General \nAssembly after consultations with the Member States, ensuring geographical balance, \non the following themes:  \n Round table 1: Strengthening the three pillars of social development: poverty \neradication, full and productive employment and decent work for all, and social \ninclusion  \n Round table 2: Assessing progress and addressing gaps and challenges in the \nimplementation of the commitments of the Copenhagen Declaration on Social \nDevelopment and its Programme of Action and giving momentum towards the \nimplementation of the 2030 Agenda for Sustainable Development; \n \n5. \nEncourages Member States, members of the United Nations specialized \nagencies and observers of the General Assembly to be represented at the level of Head \nof State or Government or at the highest possible level to make statements in plenary \nof up to five minutes; \n \n6. \nInvites the United Nations system, including the funds, programmes, \nspecialized agencies and regional commissions, as well as the international financial \ninstitutions, to participate in the Summit and make contributions, within their \nrespective mandates, to the preparation of the Summit; \n \n7. \nInvites representatives of non-governmental organizations that are in \nconsultative status with the Economic and Social Council to participate in the Summit \nin accordance with relevant rules and procedures of the General Assembly; \n \n8. \nEncourages Member States and members of the United Nations \nspecialized agencies to include in their delegations to the Summit, as appropriate, \nrepresentatives of relevant stakeholders, such as parliamentarians, representatives of \ncivil society, including non-governmental organizations, Indigenous Peoples, people \nwith disabilities, people of African descent, youth representatives, youth-led \norganizations, community organizations and faith-based organizations, academic \ninstitutions, representatives of workers and employers and the private sector, with due \nregard to gender balance; \n \n9. \nRequests the President of the General Assembly to draw up a list of \nrepresentatives of other relevant non-governmental organizations, civil society \n\nA/RES/78/318 \nModalities of the \u201cWorld Social Summit\u201d under the title \n\u201cthe Second World Summit for Social Development\u201d\n \n24-13498\n4/4 \n \norganizations, academic institutions and the private sector who may participate in the \nSummit, taking into account the principles of transparency and equitable geographical \nrepresentation, with due regard for gender parity, to submit the proposed list to \nMember States for their consideration on a non-objection basis5 and to bring the list \nto the attention of the Assembly for a final decision by the Assembly on participation \nin the Summit; \n \n10. Decides that preparations should be carried out in a most effective, well-\nstructured and broad participatory manner and that, for this purpose, the Department \nof Economic and Social Affairs of the Secretariat, and the relevant organizations of \nthe United Nations system, including the regional commissions, within their \nrespective mandates and available resources, should provide the necessary support to \nthe Summit and its preparatory process; \n \n11. \nRequests the Secretary-General to provide the necessary assistance and \nsupport for the organization of the Summit and its preparation; \n \n12. Encourages States and international donors, as well as the private sector, \nfinancial institutions, foundations and other donors in a position to do so, to support \nthe preparations for the Summit through voluntary contributions to a trust fund in \nsupport of preparations for the Summit and to support the participation of \nrepresentatives of developing countries in the Summit, priority being given to \nrepresentatives of the least developed countries and small island developing States, \nincluding coverage of economy-class air tickets, daily subsistence allowances and \nterminal expenses, in the meetings of the Summit. \n \n101st plenary meeting \n16 July 2024 \n \n__________________ \n \n5  The list will include proposed as well as final names. The general basis of any objections, if \nrequested by one or more States Members of the United Nations or States members of the \nspecialized agencies, will be made known to the Office of the President of the General Assembly \nand the requester. \n",
  "paragraphs": {
    "1": "Decides that the \u201cWorld Social Summit\u2019\u2019 under the title \u201cthe Second World Summit for Social Development\u201d will be held at the level of Heads of State or Government in Qatar from 4 to 6 November 2025, and welcomes the offer by the Government of Qatar to host the \u201cWorld Social Summit\u2019\u2019 under the title \u201cthe Second World Summit on Social Development\u2019\u2019 in 2025;",
    "2": "Also decides that the Summit will adopt a concise, action-oriented political declaration, agreed in advance by consensus through intergovernmental negotiations in New York, that should have a social development approach and give momentum towards the implementation of the 2030 Agenda for Sustainable Development;",
    "3": "Further decides that the Summit, subject to the rules of procedure of the General Assembly, will consist of: (a) Plenary meetings from 9 a.m. to 1 p.m. and from 3 to 6 p.m.; (b) An opening segment on the first day from 9 to 10.30 a.m., which will include the adoption of the political declaration followed by statements from the President of the General Assembly, the Secretary-General and the President of the Economic and Social Council; (c) A closing segment on the third day from 5 to 6 p.m., which will feature a statement from the President of the General Assembly;",
    "4": "Decides that the Summit will have two high-level round tables, each to be co-chaired by two Heads of State or Government, one from a developed country and one from a developing country, to be appointed by the President of the General Assembly after consultations with the Member States, ensuring geographical balance, on the following themes: Round table 1: Strengthening the three pillars of social development: poverty eradication, full and productive employment and decent work for all, and social inclusion Round table 2: Assessing progress and addressing gaps and challenges in the implementation of the commitments of the Copenhagen Declaration on Social Development and its Programme of Action and giving momentum towards the implementation of the 2030 Agenda for Sustainable Development;",
    "5": "Encourages Member States, members of the United Nations specialized agencies and observers of the General Assembly to be represented at the level of Head of State or Government or at the highest possible level to make statements in plenary of up to five minutes;",
    "6": "Invites the United Nations system, including the funds, programmes, specialized agencies and regional commissions, as well as the international financial institutions, to participate in the Summit and make contributions, within their respective mandates, to the preparation of the Summit;",
    "7": "Invites representatives of non-governmental organizations that are in consultative status with the Economic and Social Council to participate in the Summit in accordance with relevant rules and procedures of the General Assembly;",
    "8": "Encourages Member States and members of the United Nations specialized agencies to include in their delegations to the Summit, as appropriate, representatives of relevant stakeholders, such as parliamentarians, representatives of civil society, including non-governmental organizations, Indigenous Peoples, people with disabilities, people of African descent, youth representatives, youth-led organizations, community organizations and faith-based organizations, academic institutions, representatives of workers and employers and the private sector, with due regard to gender balance;",
    "9": " organizations, academic institutions and the private sector who may participate in the Summit, taking into account the principles of transparency and equitable geographical representation, with due regard for gender parity, to submit the proposed list to Member States for their consideration on a non-objection basis5 and to bring the list to the attention of the Assembly for a final decision by the Assembly on participation in the Summit;",
    "10": "Decides that preparations should be carried out in a most effective, well- structured and broad participatory manner and that, for this purpose, the Department of Economic and Social Affairs of the Secretariat, and the relevant organizations of the United Nations system, including the regional commissions, within their respective mandates and available resources, should provide the necessary support to the Summit and its preparatory process;",
    "11": "Requests the Secretary-General to provide the necessary assistance and support for the organization of the Summit and its preparation;",
    "12": "Encourages States and international donors, as well as the private sector, financial institutions, foundations and other donors in a position to do so, to support the preparations for the Summit through voluntary contributions to a trust fund in support of preparations for the Summit and to support the participation of representatives of developing countries in the Summit, priority being given to representatives of the least developed countries and small island developing States, including coverage of economy-class air tickets, daily subsistence allowances and terminal expenses, in the meetings of the Summit."
  },
  "agenda_items": [
    "Item 24"
  ],
  "symbol_references": [
    "A/78/L.93"
  ]
}