{
  "symbol": "A/RES/75/264",
  "filename": "A_RES_75_264.pdf",
  "title": "75/264. Cooperation between the United Nations and the Council of Europe",
  "text": "United Nations \nA/RES/75/264\n \n \nGeneral Assembly \nDistr.: General \n6 March 2021 \n \n \n21-03039 (E)    100321     \n*2103039* \n \n \nSeventy-fifth session \nAgenda item 130 (l) \nCooperation between the United Nations and regional and \nother organizations: cooperation between the United Nations \nand the Council of Europe \n \n \n \n \n Resolution adopted by the General Assembly \non 3 March 2021 \n \n \n \n \n[without reference to a Main Committee (A/75/L.64 and A/75/L.64/Add.1)] \n \n \n 75/264. Cooperation between the United Nations and the Council of Europe \n \n \n \nThe General Assembly, \n \nRecalling the Agreement between the Council of Europe and the Secretariat of \nthe United Nations signed on 15 December 1951 and the Arrangement on Cooperation \nand Liaison between the Secretariats of the United Nations and the Council of Europe \nof 19 November 1971, \n \nRecalling also its resolution 44/6 of 17 October 1989, in which it granted the \nCouncil of Europe a standing invitation to participate as an observer in its sessions \nand work, as well as its previous resolutions on cooperation between the United \nNations and the Council of Europe, \n \nAcknowledging the contribution of the Council of Europe to the strengthening \nof multilateralism as well as to the promotion and protection of all human rights and \nfundamental freedoms, democracy and the rule of law through its standards, \nprinciples, monitoring mechanisms and technical cooperation, as well as to the effective \nimplementation of relevant international legal instruments of the United Nations, \n \nAcknowledging also the contribution of the Council of Europe to the \ndevelopment of international law, and welcoming the openness of the Council of \nEurope to the participation of States of other regions in its legal instruments, \n \nWelcoming the role of the Council of Europe in building a united Europe without \ndividing lines, and the contribution of the Council of Europe to cohesion, stability \nand security in Europe, \n \nCommending the increasing contribution of the Council of Europe, including at \nthe parliamentary level, to democratic transition in its neighbouring regions aimed at \npromoting democratic institutions and procedures, and welcoming the readiness of \n\nA/RES/75/264 \nCooperation between the United Nations and the Council of Europe \n \n21-03039\n2/9 \n \nthe Council of Europe to further share its experience in democracy-building with \ninterested countries on the basis of a demand-driven approach, \n \nWelcoming the increasingly close relations between the United Nations and the \nCouncil of Europe, and commending the contribution of the Permanent Delegations \nof the Council of Europe to the United Nations Offices at Geneva and at Vienna to \nthe enhancement of cooperation and the achievement of greater synergy between the \nUnited Nations and the Council of Europe, \n \nRecognizing that multilingualism contributes to the achievement of the goals of \nthe United Nations and the Council of Europe, welcoming the efforts of the United \nNations and the Council of Europe towards strengthening multilingualism in their \nrespective organizations, and encouraging them to advance in this field, in particular \nthrough the exchange of experience and best practices, \n \nTaking note with appreciation of the report of the Secretary-General on \ncooperation between the United Nations and the Council of Europe, 1 \n \n1. \nWelcomes the contribution of the Council of Europe and of its member \nStates, at all levels of government, to the implementation of the 2030 Agenda for \nSustainable Development2 in Europe and beyond, while also recognizing the need for \nthe United Nations and the Council of Europe to continue to work together, within \ntheir respective mandates, to accelerate the pace of the implementation of the \nSustainable Development Goals towards achieving the 2030 Agenda, recognizes in \nthis context that since 2018, special attention has been given in the design of the \nCouncil of Europe programme and budget to the contribution of the Council of Europe \nto the achievement of the Sustainable Development Goals and that Council of Europe \nprogrammes include links to concrete Goals, and also recognizes that since 2020, the \nterms of reference of intergovernmental committees of the Council of Europe include \nin their tasks reviewing progress towards the Goals; \n \n2. \nEncourages the United Nations and the Council of Europe to strengthen \ntheir cooperation at all levels in order to effectively address the coronavirus disease \n(COVID-19) health crisis and its dramatic consequences for the people of Europe and \nthe world, including deepening already existing inequalities, remains determined to \naddress the COVID-19 pandemic through a multilateral response and cooperation, \nwelcomes the initiatives taken by the two organizations in this respect, recalls the \nresolutions adopted by the General Assembly related to the impact of COVID-19,3 \ntakes note of the policy briefs and statements of the Secretary-General of the United \nNations on COVID-19-related issues, and also takes note of the information papers \nof the Secretary-General of the Council of Europe, which provide guidance to \nmember States on proportionate measures for the pandemic response; \n \n3. \nReiterates its call for the reinforcement of cooperation between the United \nNations and the Council of Europe regarding the promotion and protection of all \nhuman rights and fundamental freedoms, the promotion of democracy and the rule of \nlaw and good governance at all levels, inter alia, the prevention of torture and other \ncruel, inhuman or degrading treatment or punishment, the fight against terrorism, \ntrafficking in human beings, sexual and gender-based violence, including violence \nagainst all women and children, including sexual abuse, the fight against all forms of \nracism, xenophobia and intolerance, the fight against multiple and intersecting forms of \ndiscrimination, the protection of the rights of persons with disabilities, the promotion \nof freedom of expression and freedom of thought, conscience, religion or belief, the \nprotection of the rights and dignity of all members of society without any distinction \n__________________ \n \n1 See A/75/345-S/2020/898, sect. II. \n \n2 Resolution 70/1. \n \n3 Resolutions 74/270, 74/274 and 74/306.  \n\nCooperation between the United Nations and the Council of Europe \nA/RES/75/264\n \n3/9\n21-03039 \n \nand the promotion of gender equality and empowerment of women and girls and of \nhuman rights education, as well as the promotion of human rights obligations relating \nto the enjoyment of a safe, clean, healthy and sustainable environment and to \npromoting respect for human rights by businesses and access to remedy; \n \n4. \nConfirms its recognition of the key role of the European Court of Human \nRights in ensuring effective human rights protection under the European Convention \nfor the Protection of Human Rights and Fundamental Freedoms for the more than \n830 million persons in the 47 States members of the Council of Europe, and notes \nwith interest the efforts to guarantee the long-term effectiveness of the Convention \nsystem and to ensure the rapid and effective execution of Court judgments, as well as to \nconclude, as soon as possible, the accession of the European Union to the Convention; \n \n5. \nRecognizes the important role of the Council of Europe in upholding the \nrule of law and fighting impunity, including by strengthening the capacity of the \nnational judiciaries of its member States to carry out their work consistent with the \nrelevant international obligations of the member States in particular, and where \napplicable, those defined in the Rome Statute of the International Criminal Court; 4 \n \n6. \nAlso recognizes the valuable role of the Council of Europe in advising and \nassisting States with regard to upholding constitutional and fundamental laws \nrespecting human rights, democracy and the rule of law principles, including through \nits European Commission for Democracy through Law (Venice Commission), noting \nin this context the cooperation between the United Nations and the Council of Europe; \n \n7. \nFurther recognizes the role of the revised European Social Charter and of \nthe European Committee of Social Rights in protecting economic and social rights, \nnotes in this context the cooperation between the Council of Europe and the \nInternational Labour Organization, notes also the contribution that the Council of \nEurope can make in ensuring the implementation of the United Nations Convention \non the Rights of Persons with Disabilities,5 notes in this regard the Council of Europe \nStrategy on the Rights of Persons with Disabilities 2017\u20132023, confirms its support \nfor cooperation between the two organizations with respect to the protection and \npromotion of the rights and dignity of persons with disabilities, including women and \ngirls with disabilities and persons with disabilities in sport, the eradication of poverty, \nstrengthening social cohesion and intergenerational solidarity and ensuring the \nprotection of economic, social and cultural rights for all, and encourages further \ncooperation between the Council of Europe and the World Health Organization, \nincluding the World Health Organization Regional Office for Europe; \n \n8. \nNotes the effective implementation of the joint declaration on the \nreinforcement of cooperation between the secretariat of the Council of Europe and \nthe Office of the United Nations High Commissioner for Human Rights, and in this \nrespect encourages further cooperation between the United Nations, including the \nHuman Rights Council, its special procedures, the Office of the High Commissioner \nand the human rights treaty bodies, and the Council of Europe, along with its \nCommissioner for Human Rights, with regard to promoting and ensuring respect for \nhuman rights and the role of human rights defenders; \n \n9. \nNotes with appreciation the contribution of the Council of Europe to the \nenhancement of cooperation between international and regional mechanisms for the \npromotion and protection of human rights, and in this context welcomes, in particular, \nthe contribution of the Council of Europe to the universal periodic review regarding \nthe situation of human rights in States members of the Council of Europe; \n__________________ \n \n4 United Nations, Treaty Series, vol. 2187, No. 38544. \n \n5 Ibid., vol. 2515, No. 44910. \n\nA/RES/75/264 \nCooperation between the United Nations and the Council of Europe \n \n21-03039\n4/9 \n \n \n10. Encourages further cooperation, where appropriate, between the United \nNations and the Council of Europe through their mechanisms on the prevention of \ntorture and other cruel, inhuman or degrading treatment or punishment; \n \n11. \nEncourages the Council of Europe to continue cooperation with the United \nNations in the fight against trafficking in persons, including in the context of the \nInter-Agency Coordination Group against Trafficking in Persons, recalls that the \nCouncil of Europe Convention on Action against Trafficking in Human Beings is open \nfor accession by all States, and notes with interest the results of the monitoring \nactivities carried out by the Group of Experts on Action against Trafficking in Human \nBeings and by the Committee of the Parties to the Convention; \n \n12. Notes with appreciation the Council of Europe Convention against \nTrafficking in Human Organs, as a follow-up to the joint Council of Europe/United \nNations study on trafficking in organs, tissues and cells and trafficking in human \nbeings for the purpose of the removal of organs, encourages further cooperation in \nthis field, and recalls in this respect that the Convention against Trafficking in Human \nOrgans is open for accession by all States; \n \n13. Also notes with appreciation the cooperation between the United Nations \nand the Council of Europe in the field of bioethics, in particular through the \nparticipation of the Council of Europe as an associate member in the Inter-Agency \nCommittee on Bioethics, notes in this context the adoption by the Committee of \nMinisters of the Council of Europe of the Strategic Action Plan on Human Rights and \nTechnologies in Biomedicine (2020\u20132025), and encourages the enhancing of this \ncooperation, taking into account scientific and technological breakthroughs, such as \nartificial intelligence and genetic engineering, and continues to recall that the \nConvention for the Protection of Human Rights and Dignity of the Human Being with \nregard to the Application of Biology and Medicine (Convention on Human Rights and \nBiomedicine) is open for accession by all States; \n \n14. Welcomes and encourages the enhancing of the close collaboration among \nthe United Nations Children\u2019s Fund, the Special Representative of the Secretary-\nGeneral on Violence against Children, the Special Rapporteur of the Human Rights \nCouncil on the sale and sexual exploitation of children, including child prostitution, \nchild pornography and other child sexual abuse material, the Office of the United \nNations High Commissioner for Human Rights, the Committee on the Rights of the \nChild and the Council of Europe aimed at protecting and promoting the rights of the \nchild, recalls the Council of Europe Strategy for the Rights of the Child (2016\u20132021) \npromoting the implementation of the Convention on the Rights of the Child 6 in its \nmember States, continues to recall in this context that the Council of Europe \nConvention on the Protection of Children against Sexual Exploitation and Sexual \nAbuse is open for accession by all States, and in this context recalls once again the \n\u201cStart to talk\u201d initiative calling to public authorities and the sport movement to take \nthe necessary prevention and protection measures to stop child sexual abuse; \n \n15. Recognizes the important contributions made by the Council of Europe \nEuropean Commission against Racism and Intolerance, in the 25 years since its \ncreation, to the implementation of the International Convention on the Elimination of \nAll Forms of Racial Discrimination7 and the development of domestic laws and \npolicies aimed at combating racism and intolerance in Europe, while at the same time \nrecognizing that challenges still remain, and in this regard welcomes the Commission \nRoad Map to Effective Equality for the years to come; \n__________________ \n \n6 Ibid., vol. 1577, No. 27531. \n \n7 Ibid., vol. 660, No. 9464. \n\nCooperation between the United Nations and the Council of Europe \nA/RES/75/264\n \n5/9\n21-03039 \n \n \n16. Welcomes the commitments of the Council of Europe in the field of \nprotection of persons belonging to national minorities, recognizes the important \ncontribution of the Framework Convention for the Protection of National Minorities \nand the European Charter for Regional or Minority Languages in protecting persons \nbelonging to national minorities, as well as the paramount importance of the \nDeclaration on the Rights of Persons Belonging to National or Ethnic, Religious and \nLinguistic Minorities,8 notes with appreciation the setting-up of new Council of \nEurope intergovernmental structures to guide future State action and to enable peer \nreview of experience and good practices in combating discrimination, promoting the \nsocial inclusion and respect for human rights of the Roma, safeguarding the rights of \npersons belonging to national minorities and the use of regional or minority \nlanguages, countering hate speech and promoting inclusive societies, and encourages \ngreater interaction between all relevant United Nations and Council of Europe bodies \nin these important areas; \n \n17. Recognizes the contribution of the Council of Europe to the development \nof international standards for the promotion of women\u2019s rights and gender equality \nand for combating sexual and gender-based violence, including domestic violence, \nsuch as the adoption of recommendation (2019)1 of the Committee of Ministers to \nmember States on preventing and combating sexism, its regular and active \nparticipation in the sessions of the Commission on the Status of Women and the \nagreed and specified cooperation between the Council of Europe and the United \nNations Entity for Gender Equality and the Empowerment of Women (UN-Women), \nwhich includes support to member States, upon their request, in implementing \ncommitments on gender equality and women\u2019s rights and the promotion of the \nCouncil of Europe Gender Equality Strategy, takes note of the Council of Europe \nConvention on Preventing and Combating Violence against Women and Domestic \nViolence and invites States that have not yet done so to consider signing or ratifying \nit, in this context encourages the above-mentioned bodies to continue to develop a \nspecific and fruitful collaboration in eliminating sexual and gender-based violence, \nincluding with the Special Rapporteur of the Human Rights Council on violence \nagainst women, its causes and consequences, and the Committee on the Elimination \nof Discrimination against Women, and the achievement of de facto gender equality, \nand recognizes the contribution of the Convention and of the monitoring activities \ncarried out by the Group of Experts on Action against Violence against Women and \nDomestic Violence and by the Committee of the Parties to the Convention in \neradicating this scourge; \n \n18. Recalls its resolutions on the impact of the COVID-19 pandemic on \nwomen and girls,9 given the disproportionate impact of the COVID-19 pandemic on \nthe social and economic situation of women and girls and their access to education and \nessential health-care services, the increased demand for paid and unpaid care work and \nthe reported surge of sexual and gender-based violence, which risk reversing the \nprogress achieved on gender equality and the empowerment of women and girls in \nrecent decades, and in this regard welcomes the policy brief of the Secretary-General \nof the United Nations on the impact of COVID-19 on women and girls, \n \n19. Encourages continuing cooperation between the Office of the United \nNations High Commissioner for Refugees and the Council of Europe, including the \nCouncil of Europe Development Bank, in particular in the protection and promotion \nof the human rights and fundamental freedoms of refugees, asylum seekers, stateless \npersons and internally displaced persons, under the European Convention on Human \nRights, and in the prevention and reduction of statelessness, in this context welcomes \n__________________ \n \n8 Resolution 47/135, annex. \n \n9 Resolutions 75/156 and 75/157. \n\nA/RES/75/264 \nCooperation between the United Nations and the Council of Europe \n \n21-03039\n6/9 \n \nthe contribution of the Council of Europe to the ongoing work on the implementation \nof the Global Compact for Safe, Orderly and Regular Migration 10 and to the \nimplementation of the global compact on refugees, as well as during the Global \nRefugee Forum held on 17 and 18 December 2019, as activities identifying durable \nsolutions for refugees, including the facilitation of protection and integration through \neducation and the creation of employment opportunities, in this context notes with \ninterest the results of the activities of the Special Representative of the Secretary-\nGeneral of the Council of Europe on Migration and Refugees, welcomes the \nimplementation of the Council of Europe Action Plan on Protecting Refugee and \nMigrant Children in Europe, and recognizes the importance of the interface offered \nby the presence at the Council of Europe of the United Nations High Commissioner \nfor Refugees Representation to the European Institutions in Strasbourg, as well as by \nthe Permanent Delegation of the Council of Europe to the United Nations Office at \nGeneva, welcomes the active contribution of the Council of Europe to the \ndissemination of the European Qualifications Passport for Refugees with a view to \nensuring that qualifications held by refugees and displaced persons receive fair \nrecognition and the development of the new United Nations Educational, Scientific and \nCultural Organization Global Convention on the Recognition of Qualifications \nconcerning Higher Education,11 and welcomes the adoption by the Committee of \nMinisters of the Council of Europe of recommendation (2019)4 to member States on \nsupporting young refugees in transition to adulthood and of recommendation (2019)11 \nof the Committee of Ministers to member States on effective guardianship for \nunaccompanied and separated children in the context of migration; \n \n20. Recognizes and encourages the continuing close liaison and fruitful \ncooperation between United Nations missions and the Council of Europe offices in \nthe field; \n \n21. Encourages further cooperation between the United Nations and the \nCouncil of Europe in the area of democracy and good governance, including through \nactive participation in the Strasbourg World Forum for Democracy and the North-\nSouth Centre Lisbon Forum and engagement with members of parliaments, youth \nrepresentatives and civil society, as appropriate, and the strengthening of the links \nbetween the Council of Europe European Programme for Human Rights Education \nfor Legal Professionals and relevant United Nations agencies; \n \n22. Recognizes the experience of the Council of Europe in engaging young \npeople in the promotion of human rights education, and encourages the strengthening \nof the cooperation between the Council of Europe and the Office of the United \nNations High Commissioner for Human Rights in view of the implementation of the \nfourth phase of the World Programme for Human Rights Education (2020\u20132024), \nwhich is dedicated to youth; \n \n23. Notes the important role of the United Nations Development Programme \nand the Council of Europe in supporting good local democratic governance, in \nparticular through the implementation of the European Charter of Local \nSelf-Government, as well as the fruitful cooperation between them, encourages \nfurther deepening of the cooperation in this field, and calls for enhanced cooperation \nbetween the Council of Europe and the United Nations Human Settlements \nProgramme (UN-Habitat) in the field of sustainable urban governance, in particular \nalso through the Council of Europe Conference of Ministers Responsible for \n__________________ \n \n10 Resolution 73/195, annex. \n \n11 United Nations Educational, Scientific and Cultural Organization, Records of the General \nConference, Fortieth Session, Paris, 12\u201327 November 2019, vol. 1 and corrigendum, \nResolutions, annex II. \n\nCooperation between the United Nations and the Council of Europe \nA/RES/75/264\n \n7/9\n21-03039 \n \nSpatial/Regional Planning and through its Congress of Local and Regional \nAuthorities; \n \n24. Also notes the cooperation between the European and Mediterranean \nMajor Hazards Agreement of the Council of Europe and the United Nations, in \nparticular the United Nations Office for Disaster Risk Reduction, and further notes \nthe cooperation between the Council of Europe and the United Nations in the field of \nnature, in particular on the basis of the enhanced memorandum of cooperation \nbetween the secretariat of the Convention on Biological Diversity and the secretariat \nof the Convention on the Conservation of European Wildlife and Natural Habitats; \n \n25. Further notes the contribution of the Council of Europe in protecting and \npromoting human rights and fundamental freedoms, including the access to \ninformation, the right to freedom of expression and opinion and the freedom of the \nmedia offline and online, including through the Council of Europe platform to \npromote the protection of journalism and the safety of journalists, and continues to \nencourage further cooperation between the Council of Europe and the United Nations \nin this regard, in particular in the implementation of the United Nations Plan of Action \non the Safety of Journalists and the Issue of Impunity; \n \n26. Notes the continued development of the Council of Europe Convention for \nthe Protection of Individuals with regard to Automatic Processing of Personal Data, \nwhich is open for accession by all States and its modernization (Amending Protocol, \nCouncil of Europe Treaty Series No. 223), and reaffirms that, as the information \nsociety and the Internet develop, the rights to privacy and freedom of expression, as \nset out in articles 17 and 19 of the International Covenant on Civil and Political \nRights,12 must be protected and respected, including as they relate to data protection, \nrecalls that any restrictions to these rights must be made in full compliance with \ninternational human rights law, acknowledges the importance of the work of the \nCouncil of Europe in protecting human rights online and offline, including in the fight \nagainst hate speech, and welcomes and encourages the cooperation between relevant \nUnited Nations agencies and special procedures of the Human Rights Council, \nincluding the Special Rapporteur on the right to privacy and the Special Rapporteur \non the promotion and protection of the right to freedom of opinion and expression, \nand the Council of Europe, most notably with regard to the follow-up to General \nAssembly resolution 70/125 of 16 December 2015 on the overall review of the \nimplementation of the outcomes of the World Summit on the Information Society, in \nparticular in promoting greater multi-stakeholder participation and engagement in \ndialogue on Internet governance at the global, regional and national levels; \n \n27. Encourages further cooperation between the United Nations, especially \nthe United Nations Educational, Scientific and Cultural Organization, and the Council \nof Europe through their mechanisms on the development of standard-setting \ninstruments in the digital era, especially for artificial intelligence; notes the ongoing \nwork of the Council of Europe in this field, in particular the creation of the Ad Hoc \nCommittee on Artificial Intelligence and the adoption by the Committee of Ministers \nof the Council of Europe of recommendation (2020)1 to member States on the human \nrights impacts of algorithmic systems; \n \n28. Welcomes and continues to encourage the close cooperation between the \ntwo organizations in the fight against transnational organized crime, cybercrime, \nterrorism, money-laundering and environmental crimes, as well as in the protection \nof the rights of victims of such crimes, and recalls once again that the Council of \nEurope Convention on Cybercrime and the Additional Protocol thereto, concerning \nthe criminalization of acts of a racist and xenophobic nature committed through \n__________________ \n \n12 See resolution 2200 A (XXI), annex. \n\nA/RES/75/264 \nCooperation between the United Nations and the Council of Europe \n \n21-03039\n8/9 \n \ncomputer systems, the Council of Europe Convention on Offences relating to Cultural \nProperty and the Council of Europe Convention on the Counterfeiting of Medical \nProducts and Similar Crimes Involving Threats to Public Health, as well as several \nother relevant Council of Europe conventions, are open for accession by all States; \n \n29. Welcomes and supports the cooperation and enhanced synergies between \nthe respective mechanisms concerning the prevention of and the fight against \ncorruption at all levels, notably by reviewing and mutually reinforcing the \nimplementation of international anti-corruption standards; \n \n30. Welcomes the commitment of the Council of Europe to the promotion of \nthe implementation of the United Nations Global Counter-Terrorism Strategy13 and \nthe collaboration between their respective mechanisms regarding the fight against \nterrorism, including the financing of terrorism, in full respect of human rights and the \nrule of law, acknowledges the contribution of the Council of Europe to the \nimplementation of Security Council resolution 2178 (2014) of 24 September 2014 on \nthreats to international peace and security caused by terrorist acts through the \nAdditional Protocol to the Council of Europe Convention on the Prevention of \nTerrorism and through the recommendation of the Committee of Ministers of the \nCouncil of Europe to its member States of 4 April 2018 on terrorists acting alone, as \nwell as through the updated recommendation of the Committee of Ministers of the \nCouncil of Europe to its member States of 5 July 2017 on \u201cspecial investigation \ntechniques\u201d in relation to serious crimes, including acts of terrorism, and the Council \nof Europe Counter-Terrorism Strategy (2018\u20132022), and recalls that the Council of \nEurope Convention on the Prevention of Terrorism, including its Additional Protocol, \nand the Council of Europe Convention on Laundering, Search, Seizure and \nConfiscation of the Proceeds from Crime and on the Financing of Terrorism are open \nfor accession by all States; \n \n31. Also welcomes the continued cooperation of the Council of Europe, where \nappropriate and in accordance with international drug control conventions, with the \nUnited Nations Office on Drugs and Crime and the International Narcotics Control \nBoard in the fight against drug abuse and drug trafficking, in particular the role played \nby the Pompidou Group in this regard, continues to encourage further cooperation in \nthe light of the recommendations made at the 2016 special session of the General \nAssembly on the world drug problem,14 and recalls the 2019 Ministerial Declaration \non Strengthening Our Actions at the National, Regional and International Levels to \nAccelerate the Implementation of Our Joint Commitments to Address and Counter \nthe World Drug Problem, adopted during the sixty-second session of the Commission \non Narcotic Drugs;15 \n \n32. Further welcomes the contribution of the Council of Europe to the work \nof the Sixth Committee of the General Assembly and the International Law \nCommission; \n \n33. Notes the cooperation established between the United Nations Alliance of \nCivilizations and the Council of Europe following their signature of a memorandum \nof understanding on 29 September 2008 and the accession of the Alliance of \nCivilizations to the Faro Platform, and continues to encourage the United Nations \nEducational, Scientific and Cultural Organization and the Alliance of Civilizations on \nthe one hand, and the Council of Europe and its North-South Centre on the other, to \n__________________ \n \n13 Resolution 60/288. \n \n14 See resolution S-30/1, annex. \n \n15 See Official Records of the Economic and Social Council, 2019, Supplement No. 8 (E/2019/28), \nchap. I, sect. B. \n\nCooperation between the United Nations and the Council of Europe \nA/RES/75/264\n \n9/9\n21-03039 \n \npursue their developing and fruitful collaboration in the fields of intercultural \ndialogue and global development education; \n \n34. Also notes the cooperation between the Council of Europe and the United \nNations Educational, Scientific and Cultural Organization in the field of education, \nand encourages further the extension of this cooperation, which should continue to \nfocus on the role of education in developing just and humane societies characterized \nby the participation of individuals and the ability of individuals and societies to \nconduct intercultural dialogue, as well as on the encouragement of the diversity of \ncultural expressions; \n \n35. Welcomes the cooperation between the Council of Europe, the Office of \nthe Envoy of the Secretary-General on Youth, the United Nations Educational, \nScientific and Cultural Organization and the United Nations Development \nProgramme, encourages further cooperation to promote and implement the World \nProgramme of Action for Youth,16 and notes the adoption by the Committee of \nMinisters of resolution (2020)2 on the Council of Europe youth sector strategy 2030; \n \n36. Also welcomes the cooperation among the Council of Europe, the United \nNations Educational, Scientific and Cultural Organization and the United Nations \nOffice on Drugs and Crime to promote integrity and inclusiveness through sport, \nencourages those organizations to increase their cooperation to support the \nimplementation of the Kazan Action Plan of the United Nations Educational, \nScientific and Cultural Organization, adopted in July 2017, to consolidate the \nInternational Partnership against Corruption in Sport and to promote States\u2019 \ncommitments to international conventions relevant for sport, and recalls that the \nAnti-Doping Convention of the Council of Europe, the Council of Europe Convention \non the Manipulation of Sports Competitions and the Council of Europe Convention \non an Integrated Safety, Security and Service Approach at Football Matches and Other \nSports Events are open for accession by all States; \n \n37. Invites the Secretaries-General of the United Nations and the Council of \nEurope to combine their efforts in seeking answers to global challenges, within their \nrespective mandates, and calls upon all relevant United Nations bodies to support the \nenhancement of cooperation with the Council of Europe, as set out in relevant \nresolutions; \n \n38. Decides to include in the provisional agenda of its seventy-seventh \nsession, under the item entitled \u201cCooperation between the United Nations and \nregional and other organizations\u201d, the sub-item entitled \u201cCooperation between the \nUnited Nations and the Council of Europe\u201d, and requests the Secretary-General to \nsubmit to the General Assembly at its seventy-seventh session a report on cooperation \nbetween the United Nations and the Council of Europe in the implementation of the \npresent resolution. \n \n56th plenary meeting \n3 March 2021 \n \n \n__________________ \n \n16 Resolution 50/81, annex, and resolution 62/126, annex. \n",
  "paragraphs": {
    "1": "Welcomes the contribution of the Council of Europe and of its member States, at all levels of government, to the implementation of the 2030 Agenda for Sustainable Development2 in Europe and beyond, while also recognizing the need for the United Nations and the Council of Europe to continue to work together, within their respective mandates, to accelerate the pace of the implementation of the Sustainable Development Goals towards achieving the 2030 Agenda, recognizes in this context that since 2018, special attention has been given in the design of the Council of Europe programme and budget to the contribution of the Council of Europe to the achievement of the Sustainable Development Goals and that Council of Europe programmes include links to concrete Goals, and also recognizes that since 2020, the terms of reference of intergovernmental committees of the Council of Europe include in their tasks reviewing progress towards the Goals;",
    "2": "Encourages the United Nations and the Council of Europe to strengthen their cooperation at all levels in order to effectively address the coronavirus disease (COVID-19) health crisis and its dramatic consequences for the people of Europe and the world, including deepening already existing inequalities, remains determined to address the COVID-19 pandemic through a multilateral response and cooperation, welcomes the initiatives taken by the two organizations in this respect, recalls the resolutions adopted by the General Assembly related to the impact of COVID-19,3 takes note of the policy briefs and statements of the Secretary-General of the United Nations on COVID-19-related issues, and also takes note of the information papers of the Secretary-General of the Council of Europe, which provide guidance to member States on proportionate measures for the pandemic response;",
    "3": "Reiterates its call for the reinforcement of cooperation between the United Nations and the Council of Europe regarding the promotion and protection of all human rights and fundamental freedoms, the promotion of democracy and the rule of law and good governance at all levels, inter alia, the prevention of torture and other cruel, inhuman or degrading treatment or punishment, the fight against terrorism, trafficking in human beings, sexual and gender-based violence, including violence against all women and children, including sexual abuse, the fight against all forms of racism, xenophobia and intolerance, the fight against multiple and intersecting forms of discrimination, the protection of the rights of persons with disabilities, the promotion of freedom of expression and freedom of thought, conscience, religion or belief, the protection of the rights and dignity of all members of society without any distinction __________________ 1 See A/75/345-S/2020/898, sect. II. 2 Resolution 70/1. 3 Resolutions 74/270, 74/274 and 74/306. Cooperation between the United Nations and the Council of Europe A/RES/75/264 3/9 21-03039 and the promotion of gender equality and empowerment of women and girls and of human rights education, as well as the promotion of human rights obligations relating to the enjoyment of a safe, clean, healthy and sustainable environment and to promoting respect for human rights by businesses and access to remedy;",
    "4": "Confirms its recognition of the key role of the European Court of Human Rights in ensuring effective human rights protection under the European Convention for the Protection of Human Rights and Fundamental Freedoms for the more than 830 million persons in the 47 States members of the Council of Europe, and notes with interest the efforts to guarantee the long-term effectiveness of the Convention system and to ensure the rapid and effective execution of Court judgments, as well as to conclude, as soon as possible, the accession of the European Union to the Convention;",
    "5": "Recognizes the important role of the Council of Europe in upholding the rule of law and fighting impunity, including by strengthening the capacity of the national judiciaries of its member States to carry out their work consistent with the relevant international obligations of the member States in particular, and where applicable, those defined in the Rome Statute of the International Criminal Court; 4",
    "6": "Also recognizes the valuable role of the Council of Europe in advising and assisting States with regard to upholding constitutional and fundamental laws respecting human rights, democracy and the rule of law principles, including through its European Commission for Democracy through Law (Venice Commission), noting in this context the cooperation between the United Nations and the Council of Europe;",
    "7": "Further recognizes the role of the revised European Social Charter and of the European Committee of Social Rights in protecting economic and social rights, notes in this context the cooperation between the Council of Europe and the International Labour Organization, notes also the contribution that the Council of Europe can make in ensuring the implementation of the United Nations Convention on the Rights of Persons with Disabilities,5 notes in this regard the Council of Europe Strategy on the Rights of Persons with Disabilities 2017\u20132023, confirms its support for cooperation between the two organizations with respect to the protection and promotion of the rights and dignity of persons with disabilities, including women and girls with disabilities and persons with disabilities in sport, the eradication of poverty, strengthening social cohesion and intergenerational solidarity and ensuring the protection of economic, social and cultural rights for all, and encourages further cooperation between the Council of Europe and the World Health Organization, including the World Health Organization Regional Office for Europe;",
    "8": "Notes the effective implementation of the joint declaration on the reinforcement of cooperation between the secretariat of the Council of Europe and the Office of the United Nations High Commissioner for Human Rights, and in this respect encourages further cooperation between the United Nations, including the Human Rights Council, its special procedures, the Office of the High Commissioner and the human rights treaty bodies, and the Council of Europe, along with its Commissioner for Human Rights, with regard to promoting and ensuring respect for human rights and the role of human rights defenders;",
    "9": "Notes with appreciation the contribution of the Council of Europe to the enhancement of cooperation between international and regional mechanisms for the promotion and protection of human rights, and in this context welcomes, in particular, the contribution of the Council of Europe to the universal periodic review regarding the situation of human rights in States members of the Council of Europe; __________________ 4 United Nations, Treaty Series, vol. 2187, No. 38544. 5 Ibid., vol. 2515, No. 44910. A/RES/75/264 Cooperation between the United Nations and the Council of Europe 21-03039 4/9",
    "10": "Encourages further cooperation, where appropriate, between the United Nations and the Council of Europe through their mechanisms on the prevention of torture and other cruel, inhuman or degrading treatment or punishment;",
    "11": "Encourages the Council of Europe to continue cooperation with the United Nations in the fight against trafficking in persons, including in the context of the Inter-Agency Coordination Group against Trafficking in Persons, recalls that the Council of Europe Convention on Action against Trafficking in Human Beings is open for accession by all States, and notes with interest the results of the monitoring activities carried out by the Group of Experts on Action against Trafficking in Human Beings and by the Committee of the Parties to the Convention;",
    "12": "Notes with appreciation the Council of Europe Convention against Trafficking in Human Organs, as a follow-up to the joint Council of Europe/United Nations study on trafficking in organs, tissues and cells and trafficking in human beings for the purpose of the removal of organs, encourages further cooperation in this field, and recalls in this respect that the Convention against Trafficking in Human Organs is open for accession by all States;",
    "13": "Also notes with appreciation the cooperation between the United Nations and the Council of Europe in the field of bioethics, in particular through the participation of the Council of Europe as an associate member in the Inter-Agency Committee on Bioethics, notes in this context the adoption by the Committee of Ministers of the Council of Europe of the Strategic Action Plan on Human Rights and Technologies in Biomedicine (2020\u20132025), and encourages the enhancing of this cooperation, taking into account scientific and technological breakthroughs, such as artificial intelligence and genetic engineering, and continues to recall that the Convention for the Protection of Human Rights and Dignity of the Human Being with regard to the Application of Biology and Medicine (Convention on Human Rights and Biomedicine) is open for accession by all States;",
    "14": "Welcomes and encourages the enhancing of the close collaboration among the United Nations Children\u2019s Fund, the Special Representative of the Secretary- General on Violence against Children, the Special Rapporteur of the Human Rights Council on the sale and sexual exploitation of children, including child prostitution, child pornography and other child sexual abuse material, the Office of the United Nations High Commissioner for Human Rights, the Committee on the Rights of the Child and the Council of Europe aimed at protecting and promoting the rights of the child, recalls the Council of Europe Strategy for the Rights of the Child (2016\u20132021) promoting the implementation of the Convention on the Rights of the Child 6 in its member States, continues to recall in this context that the Council of Europe Convention on the Protection of Children against Sexual Exploitation and Sexual Abuse is open for accession by all States, and in this context recalls once again the \u201cStart to talk\u201d initiative calling to public authorities and the sport movement to take the necessary prevention and protection measures to stop child sexual abuse;",
    "15": "Recognizes the important contributions made by the Council of Europe European Commission against Racism and Intolerance, in the 25 years since its creation, to the implementation of the International Convention on the Elimination of All Forms of Racial Discrimination7 and the development of domestic laws and policies aimed at combating racism and intolerance in Europe, while at the same time recognizing that challenges still remain, and in this regard welcomes the Commission Road Map to Effective Equality for the years to come; __________________ 6 Ibid., vol. 1577, No. 27531. 7 Ibid., vol. 660, No. 9464. Cooperation between the United Nations and the Council of Europe A/RES/75/264 5/9 21-03039",
    "16": "Welcomes the commitments of the Council of Europe in the field of protection of persons belonging to national minorities, recognizes the important contribution of the Framework Convention for the Protection of National Minorities and the European Charter for Regional or Minority Languages in protecting persons belonging to national minorities, as well as the paramount importance of the Declaration on the Rights of Persons Belonging to National or Ethnic, Religious and Linguistic Minorities,8 notes with appreciation the setting-up of new Council of Europe intergovernmental structures to guide future State action and to enable peer review of experience and good practices in combating discrimination, promoting the social inclusion and respect for human rights of the Roma, safeguarding the rights of persons belonging to national minorities and the use of regional or minority languages, countering hate speech and promoting inclusive societies, and encourages greater interaction between all relevant United Nations and Council of Europe bodies in these important areas;",
    "17": "Recognizes the contribution of the Council of Europe to the development of international standards for the promotion of women\u2019s rights and gender equality and for combating sexual and gender-based violence, including domestic violence, such as the adoption of recommendation (2019)1 of the Committee of Ministers to member States on preventing and combating sexism, its regular and active participation in the sessions of the Commission on the Status of Women and the agreed and specified cooperation between the Council of Europe and the United Nations Entity for Gender Equality and the Empowerment of Women (UN-Women), which includes support to member States, upon their request, in implementing commitments on gender equality and women\u2019s rights and the promotion of the Council of Europe Gender Equality Strategy, takes note of the Council of Europe Convention on Preventing and Combating Violence against Women and Domestic Violence and invites States that have not yet done so to consider signing or ratifying it, in this context encourages the above-mentioned bodies to continue to develop a specific and fruitful collaboration in eliminating sexual and gender-based violence, including with the Special Rapporteur of the Human Rights Council on violence against women, its causes and consequences, and the Committee on the Elimination of Discrimination against Women, and the achievement of de facto gender equality, and recognizes the contribution of the Convention and of the monitoring activities carried out by the Group of Experts on Action against Violence against Women and Domestic Violence and by the Committee of the Parties to the Convention in eradicating this scourge;",
    "18": "Recalls its resolutions on the impact of the COVID-19 pandemic on women and girls,9 given the disproportionate impact of the COVID-19 pandemic on the social and economic situation of women and girls and their access to education and essential health-care services, the increased demand for paid and unpaid care work and the reported surge of sexual and gender-based violence, which risk reversing the progress achieved on gender equality and the empowerment of women and girls in recent decades, and in this regard welcomes the policy brief of the Secretary-General of the United Nations on the impact of COVID-19 on women and girls,",
    "19": "Encourages continuing cooperation between the Office of the United Nations High Commissioner for Refugees and the Council of Europe, including the Council of Europe Development Bank, in particular in the protection and promotion of the human rights and fundamental freedoms of refugees, asylum seekers, stateless persons and internally displaced persons, under the European Convention on Human Rights, and in the prevention and reduction of statelessness, in this context welcomes __________________ 8 Resolution 47/135, annex. 9 Resolutions 75/156 and 75/157. A/RES/75/264 Cooperation between the United Nations and the Council of Europe 21-03039 6/9 the contribution of the Council of Europe to the ongoing work on the implementation of the Global Compact for Safe, Orderly and Regular Migration 10 and to the implementation of the global compact on refugees, as well as during the Global Refugee Forum held on 17 and 18 December 2019, as activities identifying durable solutions for refugees, including the facilitation of protection and integration through education and the creation of employment opportunities, in this context notes with interest the results of the activities of the Special Representative of the Secretary- General of the Council of Europe on Migration and Refugees, welcomes the implementation of the Council of Europe Action Plan on Protecting Refugee and Migrant Children in Europe, and recognizes the importance of the interface offered by the presence at the Council of Europe of the United Nations High Commissioner for Refugees Representation to the European Institutions in Strasbourg, as well as by the Permanent Delegation of the Council of Europe to the United Nations Office at Geneva, welcomes the active contribution of the Council of Europe to the dissemination of the European Qualifications Passport for Refugees with a view to ensuring that qualifications held by refugees and displaced persons receive fair recognition and the development of the new United Nations Educational, Scientific and Cultural Organization Global Convention on the Recognition of Qualifications concerning Higher Education,11 and welcomes the adoption by the Committee of Ministers of the Council of Europe of recommendation (2019)4 to member States on supporting young refugees in transition to adulthood and of recommendation (2019)11 of the Committee of Ministers to member States on effective guardianship for unaccompanied and separated children in the context of migration;",
    "20": "Recognizes and encourages the continuing close liaison and fruitful cooperation between United Nations missions and the Council of Europe offices in the field;",
    "21": "Encourages further cooperation between the United Nations and the Council of Europe in the area of democracy and good governance, including through active participation in the Strasbourg World Forum for Democracy and the North- South Centre Lisbon Forum and engagement with members of parliaments, youth representatives and civil society, as appropriate, and the strengthening of the links between the Council of Europe European Programme for Human Rights Education for Legal Professionals and relevant United Nations agencies;",
    "22": "Recognizes the experience of the Council of Europe in engaging young people in the promotion of human rights education, and encourages the strengthening of the cooperation between the Council of Europe and the Office of the United Nations High Commissioner for Human Rights in view of the implementation of the fourth phase of the World Programme for Human Rights Education (2020\u20132024), which is dedicated to youth;",
    "23": "Notes the important role of the United Nations Development Programme and the Council of Europe in supporting good local democratic governance, in particular through the implementation of the European Charter of Local Self-Government, as well as the fruitful cooperation between them, encourages further deepening of the cooperation in this field, and calls for enhanced cooperation between the Council of Europe and the United Nations Human Settlements Programme (UN-Habitat) in the field of sustainable urban governance, in particular also through the Council of Europe Conference of Ministers Responsible for __________________ 10 Resolution 73/195, annex. 11 United Nations Educational, Scientific and Cultural Organization, Records of the General Conference, Fortieth Session, Paris, 12\u201327 November 2019, vol. 1 and corrigendum, Resolutions, annex II. Cooperation between the United Nations and the Council of Europe A/RES/75/264 7/9 21-03039 Spatial/Regional Planning and through its Congress of Local and Regional Authorities;",
    "24": "Also notes the cooperation between the European and Mediterranean Major Hazards Agreement of the Council of Europe and the United Nations, in particular the United Nations Office for Disaster Risk Reduction, and further notes the cooperation between the Council of Europe and the United Nations in the field of nature, in particular on the basis of the enhanced memorandum of cooperation between the secretariat of the Convention on Biological Diversity and the secretariat of the Convention on the Conservation of European Wildlife and Natural Habitats;",
    "25": "Further notes the contribution of the Council of Europe in protecting and promoting human rights and fundamental freedoms, including the access to information, the right to freedom of expression and opinion and the freedom of the media offline and online, including through the Council of Europe platform to promote the protection of journalism and the safety of journalists, and continues to encourage further cooperation between the Council of Europe and the United Nations in this regard, in particular in the implementation of the United Nations Plan of Action on the Safety of Journalists and the Issue of Impunity;",
    "26": "Notes the continued development of the Council of Europe Convention for the Protection of Individuals with regard to Automatic Processing of Personal Data, which is open for accession by all States and its modernization (Amending Protocol, Council of Europe Treaty Series No. 223), and reaffirms that, as the information society and the Internet develop, the rights to privacy and freedom of expression, as set out in articles 17 and 19 of the International Covenant on Civil and Political Rights,12 must be protected and respected, including as they relate to data protection, recalls that any restrictions to these rights must be made in full compliance with international human rights law, acknowledges the importance of the work of the Council of Europe in protecting human rights online and offline, including in the fight against hate speech, and welcomes and encourages the cooperation between relevant United Nations agencies and special procedures of the Human Rights Council, including the Special Rapporteur on the right to privacy and the Special Rapporteur on the promotion and protection of the right to freedom of opinion and expression, and the Council of Europe, most notably with regard to the follow-up to General Assembly resolution 70/125 of 16 December 2015 on the overall review of the implementation of the outcomes of the World Summit on the Information Society, in particular in promoting greater multi-stakeholder participation and engagement in dialogue on Internet governance at the global, regional and national levels;",
    "27": "Encourages further cooperation between the United Nations, especially the United Nations Educational, Scientific and Cultural Organization, and the Council of Europe through their mechanisms on the development of standard-setting instruments in the digital era, especially for artificial intelligence; notes the ongoing work of the Council of Europe in this field, in particular the creation of the Ad Hoc Committee on Artificial Intelligence and the adoption by the Committee of Ministers of the Council of Europe of recommendation (2020)1 to member States on the human rights impacts of algorithmic systems;",
    "28": "Welcomes and continues to encourage the close cooperation between the two organizations in the fight against transnational organized crime, cybercrime, terrorism, money-laundering and environmental crimes, as well as in the protection of the rights of victims of such crimes, and recalls once again that the Council of Europe Convention on Cybercrime and the Additional Protocol thereto, concerning the criminalization of acts of a racist and xenophobic nature committed through __________________ 12 See resolution 2200 A (XXI), annex. A/RES/75/264 Cooperation between the United Nations and the Council of Europe 21-03039 8/9 computer systems, the Council of Europe Convention on Offences relating to Cultural Property and the Council of Europe Convention on the Counterfeiting of Medical Products and Similar Crimes Involving Threats to Public Health, as well as several other relevant Council of Europe conventions, are open for accession by all States;",
    "29": "Welcomes and supports the cooperation and enhanced synergies between the respective mechanisms concerning the prevention of and the fight against corruption at all levels, notably by reviewing and mutually reinforcing the implementation of international anti-corruption standards;",
    "30": "Welcomes the commitment of the Council of Europe to the promotion of the implementation of the United Nations Global Counter-Terrorism Strategy13 and the collaboration between their respective mechanisms regarding the fight against terrorism, including the financing of terrorism, in full respect of human rights and the rule of law, acknowledges the contribution of the Council of Europe to the implementation of Security Council resolution 2178 (2014) of 24 September 2014 on threats to international peace and security caused by terrorist acts through the Additional Protocol to the Council of Europe Convention on the Prevention of Terrorism and through the recommendation of the Committee of Ministers of the Council of Europe to its member States of 4 April 2018 on terrorists acting alone, as well as through the updated recommendation of the Committee of Ministers of the Council of Europe to its member States of 5 July 2017 on \u201cspecial investigation techniques\u201d in relation to serious crimes, including acts of terrorism, and the Council of Europe Counter-Terrorism Strategy (2018\u20132022), and recalls that the Council of Europe Convention on the Prevention of Terrorism, including its Additional Protocol, and the Council of Europe Convention on Laundering, Search, Seizure and Confiscation of the Proceeds from Crime and on the Financing of Terrorism are open for accession by all States;",
    "31": "Also welcomes the continued cooperation of the Council of Europe, where appropriate and in accordance with international drug control conventions, with the United Nations Office on Drugs and Crime and the International Narcotics Control Board in the fight against drug abuse and drug trafficking, in particular the role played by the Pompidou Group in this regard, continues to encourage further cooperation in the light of the recommendations made at the 2016 special session of the General Assembly on the world drug problem,14 and recalls the 2019 Ministerial Declaration on Strengthening Our Actions at the National, Regional and International Levels to Accelerate the Implementation of Our Joint Commitments to Address and Counter the World Drug Problem, adopted during the sixty-second session of the Commission on Narcotic Drugs;15",
    "32": "Further welcomes the contribution of the Council of Europe to the work of the Sixth Committee of the General Assembly and the International Law Commission;",
    "33": "Notes the cooperation established between the United Nations Alliance of Civilizations and the Council of Europe following their signature of a memorandum of understanding on 29 September 2008 and the accession of the Alliance of Civilizations to the Faro Platform, and continues to encourage the United Nations Educational, Scientific and Cultural Organization and the Alliance of Civilizations on the one hand, and the Council of Europe and its North-South Centre on the other, to __________________ 13 Resolution 60/288. 14 See resolution S-30/1, annex. 15 See Official Records of the Economic and Social Council, 2019, Supplement No. 8 (E/2019/28), chap. I, sect. B. Cooperation between the United Nations and the Council of Europe A/RES/75/264 9/9 21-03039 pursue their developing and fruitful collaboration in the fields of intercultural dialogue and global development education;",
    "34": "Also notes the cooperation between the Council of Europe and the United Nations Educational, Scientific and Cultural Organization in the field of education, and encourages further the extension of this cooperation, which should continue to focus on the role of education in developing just and humane societies characterized by the participation of individuals and the ability of individuals and societies to conduct intercultural dialogue, as well as on the encouragement of the diversity of cultural expressions;",
    "35": "Welcomes the cooperation between the Council of Europe, the Office of the Envoy of the Secretary-General on Youth, the United Nations Educational, Scientific and Cultural Organization and the United Nations Development Programme, encourages further cooperation to promote and implement the World Programme of Action for Youth,16 and notes the adoption by the Committee of Ministers of resolution (2020)2 on the Council of Europe youth sector strategy 2030;",
    "36": "Also welcomes the cooperation among the Council of Europe, the United Nations Educational, Scientific and Cultural Organization and the United Nations Office on Drugs and Crime to promote integrity and inclusiveness through sport, encourages those organizations to increase their cooperation to support the implementation of the Kazan Action Plan of the United Nations Educational, Scientific and Cultural Organization, adopted in July 2017, to consolidate the International Partnership against Corruption in Sport and to promote States\u2019 commitments to international conventions relevant for sport, and recalls that the Anti-Doping Convention of the Council of Europe, the Council of Europe Convention on the Manipulation of Sports Competitions and the Council of Europe Convention on an Integrated Safety, Security and Service Approach at Football Matches and Other Sports Events are open for accession by all States;",
    "37": "Invites the Secretaries-General of the United Nations and the Council of Europe to combine their efforts in seeking answers to global challenges, within their respective mandates, and calls upon all relevant United Nations bodies to support the enhancement of cooperation with the Council of Europe, as set out in relevant resolutions;",
    "38": "Decides to include in the provisional agenda of its seventy-seventh session, under the item entitled \u201cCooperation between the United Nations and regional and other organizations\u201d, the sub-item entitled \u201cCooperation between the United Nations and the Council of Europe\u201d, and requests the Secretary-General to submit to the General Assembly at its seventy-seventh session a report on cooperation between the United Nations and the Council of Europe in the implementation of the present resolution. 56th plenary meeting 3 March 2021 __________________ 16 Resolution 50/81, annex, and resolution 62/126, annex."
  },
  "agenda_items": [
    "Item 130"
  ],
  "symbol_references": [
    "A/75/L.64"
  ]
}