{
  "symbol": "A/RES/76/131",
  "filename": "A_RES_76_131.pdf",
  "title": "76/131. Fiftieth anniversary of the United Nations Volunteers programme and twentieth anniversary of the International Year of Volunteers",
  "text": "United Nations \nA/RES/76/131\n \n \nGeneral Assembly \nDistr.: General \n5 January 2022 \n \n21-19153 (E)    100122 \n*2119153* \n \n \nSeventy-sixth session \nAgenda item 28 \nSocial development \n \n \n \n \n Resolution adopted by the General Assembly \non 16 December 2021 \n \n \n \n \n[on the report of the Third Committee (A/76/454, para. 51)] \n \n \n 76/131. Fiftieth anniversary of the United Nations Volunteers programme \nand twentieth anniversary of the International Year of Volunteers \n \n \n \nThe General Assembly, \n \nNoting that the year 2021 marks the fiftieth anniversary of the United Nations \nVolunteers programme since its commencement in January 1971 and also marks the \ntwentieth anniversary of the International Year of Volunteers, \n \nRecalling its resolution 73/140 of 17 December 2018, entitled \u201cVolunteering for \nthe 2030 Agenda for Sustainable Development\u201d, \n \nAcknowledging the important role volunteers have played and continue to play \nin their response to the coronavirus disease (COVID-19) pandemic, particularly in \nexercising an active role in national responses and recovery and in addressing the \nconsequences of COVID-19 and mitigating its socioeconomic impacts, including as \nhealth workers and other front-line essential workers, \n \nRecognizing the universal desire of people to contribute through volunteering \nand the importance of ensuring the safety and security of volunteers through adequate \ninsurance, as well as physical and mental health support, \n \nRecognizing also that young persons play a major role in volunteering \nworldwide, and in that regard reaffirming the importance of involving youth and both \nyouth-led and youth-focused organizations in all matters of concern to them, \nincluding within the General Assembly, the Economic and Social Council and its \nfunctional commissions and relevant United Nations conferences, \n \nAcknowledging that the 2030 Agenda for Sustainable Development1 creates an \nunprecedented global and national urgency to accelerate progress in the recognition, \npromotion, facilitation, networking and integration of volunteer action by and \n__________________ \n \n1  Resolution 70/1. \n\nA/RES/76/131 \nFiftieth anniversary of the United Nations Volunteers programme \nand twentieth anniversary of the International Year of Volunteers\n \n21-19153\n2/4 \n \nbetween Governments, communities, civil society, the private sector, academia, the \nmedia and international actors, including the United Nations system, \n \nWelcoming the integration of volunteerism into all relevant issues considered at \nthe United Nations, in particular the 2030 Agenda for Sustainable Development, in \nwhich it adopted a comprehensive, far-reaching and people-centred set of universal \nand transformative Sustainable Development Goals and targets, and the Addis Ababa \nAction Agenda of the Third International Conference on Financing for Development, 2 \nin which it is acknowledged that volunteers and other stakeholders will be important \nto mobilize and share knowledge, expertise, technology and financial resources, \ncomplement the efforts of Governments and support the achievement of the \nSustainable Development Goals, in particular in developing countries, as well as \nresolution 75/233 of 21 December 2020 on the quadrennial comprehensive policy \nreview of operational activities for development of the United Nations system, in \nwhich it recognizes volunteerism as a powerful and cross-cutting means of \nimplementation of the 2030 Agenda for Sustainable Development, \n \nWelcoming also the publication by the United Nations Volunteers programme of \nthe report entitled 2022 State of the World\u2019s Volunteerism Report: Building Equal and \nInclusive Societies, which presents new evidence on the relationship between \nvolunteers and the State and illustrates how emerging models of volunteering can help \naddress the needs of communities in a more inclusive and responsive manner, \n \nAcknowledging the existing contribution of the organizations of the United \nNations system in support of volunteering, especially the work of the United Nations \nVolunteers programme around the world, acknowledging also the efforts of the \nInternational Federation of Red Cross and Red Crescent Societies to promote \nvolunteerism throughout its global network, noting the work of other volunteer-\ninvolving organizations at the local, national, regional and global levels, and \nacknowledging the important role of civil society in facilitating volunteering, \n \nAcknowledging also that, as volunteering practices evolve, including online and \ndigital volunteering, there is a need to understand how they shape the participation of \nvolunteers and to leave no one behind by facilitating access, and stressing in this \nregard the need to close all digital divides, which have been aggravated by the \nCOVID-19 pandemic, both between and within countries and including rural-urban, \nyouth-older persons and gender digital divides, and to promote digital inclusion, by \ntaking into account national and regional contexts and addressing the challenges \nassociated with access, affordability, digital literacy and digital skills and awareness \nand by ensuring that the benefits of new technologies are available to all, taking into \naccount the needs of those who are in vulnerable situations, \n \n1. \nWelcomes the report of the Secretary-General on volunteering for the 2030 \nAgenda for Sustainable Development,3 which aims for all human beings to fulfil their \npotential in dignity and equality and in a healthy environment and notes the progress \nmade by stakeholders under the plan of action to integrate volunteering into the 2030 \nAgenda for Sustainable Development; \n \n2. \nRecalls the importance of integrating volunteerism, as appropriate, into \nthe planning for the implementation of the 2030 Agenda for Sustainable \nDevelopment, and encourages the United Nations system, civil society and the private \nsector, in partnership with Member States, to support such efforts and promote a \nconducive environment for volunteerism and volunteers to enhance the sustainability \nof development results; \n__________________ \n \n2  Resolution 69/313, annex. \n \n3  A/76/137. \n\nFiftieth anniversary of the United Nations Volunteers programme \nand twentieth anniversary of the International Year of Volunteers \nA/RES/76/131\n \n3/4\n21-19153 \n \n \n3. \nRecognizes the critical contributions of volunteers in this regard, and \ncommends the contributions from national and international volunteers for their \nindispensable interaction with local populations in disaster risk reduction and \nrecovery, most recently evidenced by their performance in the aftermath of natural \ndisasters, including those aggravated by climate change in many parts of the world; \n \n4. \nCommends the increasing link between volunteerism and sport, which, \nthrough the invaluable contributions of national and international volunteers to the \npreparation and delivery of major sports events, inter alia, the Olympic and \nParalympic Games, contributes to the promotion of the ideal of peace and inclusive \nsociety; \n \n5. \nAlso commends the measurement of the scale and scope of volunteering \non a national level and the integration of volunteerism into national youth policies \nand strategies, disaster preparedness and response strategies, as well as national \ndevelopment plans, and encourages Governments, in partnership with United Nations \nentities, volunteer-involving organizations, the private sector, civil society, including \nacademia, and other stakeholders, as appropriate, to integrate volunteerism into \nnational development strategies, plans and policies, United Nations Sustainable \nDevelopment Cooperation Frameworks or equivalent planning frameworks; \n \n6. \nEncourages Member States to support volunteer action for the \nachievement of the Sustainable Development Goals, including the integration of \nvolunteerism into sector priorities and national development strategies, plans and \npolicies, and to invest in volunteers and volunteering as part of national capacities to \npromote inclusion, strengthen participation and foster innovation and to strengthen \nevidence on the quality of participation through volunteering under the 2030 Agenda \nfor Sustainable Development, together with other stakeholders; \n \n7. \nEncourages the meaningful participation and integration of all people, \nincluding youth, older persons, women, migrants, refugees, persons with disabilities, \nminorities and other marginalized groups, into volunteer-involving programmes and \nprojects, with the provision of the appropriate means to leverage the full potential of \nvolunteerism; \n \n8. \nCommends the Member States that highlighted the contributions of \nvolunteering to the Sustainable Development Goals in their voluntary national \nreviews for the high-level political forum on sustainable development held in 2016, \n2017, 2018, 2019, 2020 and 2021, and encourages all Member States to increasingly \ncooperate with volunteer-involving and civil society organizations, as well as the \nprivate sector, in supporting such efforts and promoting a conducive environment for \nvolunteerism and volunteers to enhance the sustainability of development results, to \ninclude information on the scale, contribution and impact of volunteerism in future \nvoluntary national reviews and engage volunteers for the monitoring of progress \ntowards achieving the Goals at the national and subnational levels and as part of wider \npeople\u2019s engagement; \n \n9. \nEncourages all Member States to invest in measuring the scale and \ncontribution of people\u2019s voluntary efforts, in line with the nineteenth International \nConference of Labour Statisticians standard on volunteer work and the International \nLabour Organization Volunteer Work Measurement Guide, and to collect and utilize \nhigh-quality data disaggregated by sex, age and disability to support and integrate \nvolunteerism into national strategies and to measure its impact on the implementation \nof the 2030 Agenda for Sustainable Development; \n \n10. Requests United Nations entities, as well as United Nations country teams, \nto reflect the distinct contributions of volunteering in Sustainable Development \nCooperation Frameworks and country programme documents, in line with resolution \n\nA/RES/76/131 \nFiftieth anniversary of the United Nations Volunteers programme \nand twentieth anniversary of the International Year of Volunteers\n \n21-19153\n4/4 \n \n75/233 on the quadrennial comprehensive review of operational activities for \ndevelopment of the United Nations system; \n \n11. \nRecalls the call to action on \u201cVolunteering in the decade of action\u201d, \nwelcomes the contribution of volunteers to the global efforts to overcome the \nCOVID-19 pandemic, and emphasizes the key role of volunteers in responding to, \nrebuilding and recovering from the COVID-19 pandemic, as well as in the \nimplementation of the health-related goals and targets of the 2030 Agenda for \nSustainable Development, inter alia, universal health coverage, recognizing that the \nCOVID-19 pandemic has a disproportionately heavy impact on the poor and most \nvulnerable, with repercussions on health and development gains; \n \n12. Requests Member States and the United Nations system to work together \nwith volunteer-involving organizations, including from civil society, to support \nefforts to enhance the protection, security and well-being of volunteers, calls upon \nStates to create and maintain, in law and in practice, a safe and enabling environment \nfor volunteers, and encourages the adoption of good practices in the promotion, \nfacilitation and, where applicable, management of volunteerism; \n \n13. Recognizes the role of the United Nations Volunteers programme in \nsupporting the integration of volunteerism into the 2030 Agenda for Sustainable \nDevelopment by sharing relevant knowledge and experiences, and encourages \nMember States and other stakeholders to share their continued efforts to integrate \nvolunteering into the 2030 Agenda through the global Knowledge Portal on \nVolunteerism hosted by the United Nations Volunteers programme, including policies, \nstrategies, research and evidence and good practices on volunteering for the \nSustainable Development Goals; \n \n14. Also recognizes the Special Voluntary Fund for the United Nations \nVolunteers as the resource enabling the United Nations Volunteers programme to \ndevelop initiatives that embed the values of volunteerism in the work of Governments \nand the United Nations system, and encourages Member States in a position to do so \nto enhance their contributions to the Fund, thereby ensuring continuing activities; \n \n15. Further recognizes the role of information and communications \ntechnologies in expanding innovative forms of volunteering, and encourages \nGovernments, the private sector, civil society and other stakeholders to support online \nvolunteering, including United Nations online volunteering that provides inclusive \ntechnology-enabled global platforms; \n \n16. Encourages Member States and development partners to continue to share \nknowledge and scale up ways to address barriers to volunteering for all, including \npersons in vulnerable situations; \n \n17. Requests the Secretary-General to report to the General Assembly at its \nseventy-ninth session on the implementation of the present resolution, under the item \nentitled \u201cSocial development\u201d. \n \n53rd plenary meeting \n16 December 2021 \n \n \n",
  "paragraphs": {
    "1": "Welcomes the report of the Secretary-General on volunteering for the 2030 Agenda for Sustainable Development,3 which aims for all human beings to fulfil their potential in dignity and equality and in a healthy environment and notes the progress made by stakeholders under the plan of action to integrate volunteering into the 2030 Agenda for Sustainable Development;",
    "2": "Recalls the importance of integrating volunteerism, as appropriate, into the planning for the implementation of the 2030 Agenda for Sustainable Development, and encourages the United Nations system, civil society and the private sector, in partnership with Member States, to support such efforts and promote a conducive environment for volunteerism and volunteers to enhance the sustainability of development results;",
    "3": "Recognizes the critical contributions of volunteers in this regard, and commends the contributions from national and international volunteers for their indispensable interaction with local populations in disaster risk reduction and recovery, most recently evidenced by their performance in the aftermath of natural disasters, including those aggravated by climate change in many parts of the world;",
    "4": "Commends the increasing link between volunteerism and sport, which, through the invaluable contributions of national and international volunteers to the preparation and delivery of major sports events, inter alia, the Olympic and Paralympic Games, contributes to the promotion of the ideal of peace and inclusive society;",
    "5": "Also commends the measurement of the scale and scope of volunteering on a national level and the integration of volunteerism into national youth policies and strategies, disaster preparedness and response strategies, as well as national development plans, and encourages Governments, in partnership with United Nations entities, volunteer-involving organizations, the private sector, civil society, including academia, and other stakeholders, as appropriate, to integrate volunteerism into national development strategies, plans and policies, United Nations Sustainable Development Cooperation Frameworks or equivalent planning frameworks;",
    "6": "Encourages Member States to support volunteer action for the achievement of the Sustainable Development Goals, including the integration of volunteerism into sector priorities and national development strategies, plans and policies, and to invest in volunteers and volunteering as part of national capacities to promote inclusion, strengthen participation and foster innovation and to strengthen evidence on the quality of participation through volunteering under the 2030 Agenda for Sustainable Development, together with other stakeholders;",
    "7": "Encourages the meaningful participation and integration of all people, including youth, older persons, women, migrants, refugees, persons with disabilities, minorities and other marginalized groups, into volunteer-involving programmes and projects, with the provision of the appropriate means to leverage the full potential of volunteerism;",
    "8": "Commends the Member States that highlighted the contributions of volunteering to the Sustainable Development Goals in their voluntary national reviews for the high-level political forum on sustainable development held in 2016, 2017, 2018, 2019, 2020 and 2021, and encourages all Member States to increasingly cooperate with volunteer-involving and civil society organizations, as well as the private sector, in supporting such efforts and promoting a conducive environment for volunteerism and volunteers to enhance the sustainability of development results, to include information on the scale, contribution and impact of volunteerism in future voluntary national reviews and engage volunteers for the monitoring of progress towards achieving the Goals at the national and subnational levels and as part of wider people\u2019s engagement;",
    "9": "Encourages all Member States to invest in measuring the scale and contribution of people\u2019s voluntary efforts, in line with the nineteenth International Conference of Labour Statisticians standard on volunteer work and the International Labour Organization Volunteer Work Measurement Guide, and to collect and utilize high-quality data disaggregated by sex, age and disability to support and integrate volunteerism into national strategies and to measure its impact on the implementation of the 2030 Agenda for Sustainable Development;",
    "10": " 75/233 on the quadrennial comprehensive review of operational activities for development of the United Nations system;",
    "11": "Recalls the call to action on \u201cVolunteering in the decade of action\u201d, welcomes the contribution of volunteers to the global efforts to overcome the COVID-19 pandemic, and emphasizes the key role of volunteers in responding to, rebuilding and recovering from the COVID-19 pandemic, as well as in the implementation of the health-related goals and targets of the 2030 Agenda for Sustainable Development, inter alia, universal health coverage, recognizing that the COVID-19 pandemic has a disproportionately heavy impact on the poor and most vulnerable, with repercussions on health and development gains;",
    "12": "Requests Member States and the United Nations system to work together with volunteer-involving organizations, including from civil society, to support efforts to enhance the protection, security and well-being of volunteers, calls upon States to create and maintain, in law and in practice, a safe and enabling environment for volunteers, and encourages the adoption of good practices in the promotion, facilitation and, where applicable, management of volunteerism;",
    "13": "Recognizes the role of the United Nations Volunteers programme in supporting the integration of volunteerism into the 2030 Agenda for Sustainable Development by sharing relevant knowledge and experiences, and encourages Member States and other stakeholders to share their continued efforts to integrate volunteering into the 2030 Agenda through the global Knowledge Portal on Volunteerism hosted by the United Nations Volunteers programme, including policies, strategies, research and evidence and good practices on volunteering for the Sustainable Development Goals;",
    "14": "Also recognizes the Special Voluntary Fund for the United Nations Volunteers as the resource enabling the United Nations Volunteers programme to develop initiatives that embed the values of volunteerism in the work of Governments and the United Nations system, and encourages Member States in a position to do so to enhance their contributions to the Fund, thereby ensuring continuing activities;",
    "15": "Further recognizes the role of information and communications technologies in expanding innovative forms of volunteering, and encourages Governments, the private sector, civil society and other stakeholders to support online volunteering, including United Nations online volunteering that provides inclusive technology-enabled global platforms;",
    "16": "Encourages Member States and development partners to continue to share knowledge and scale up ways to address barriers to volunteering for all, including persons in vulnerable situations;",
    "17": "Requests the Secretary-General to report to the General Assembly at its seventy-ninth session on the implementation of the present resolution, under the item entitled \u201cSocial development\u201d."
  },
  "agenda_items": [
    "Item 28"
  ],
  "symbol_references": []
}