{
  "symbol": "A/RES/79/121",
  "filename": "A_RES_79_121.pdf",
  "title": "79/121. Report of the International Law Commission on the work of its seventy-fifth session",
  "text": "United Nations \nA/RES/79/121\n \n \nGeneral Assembly \nDistr.: General \n12 December 2024 \n \n24-23509 (E)     \n*2423509* \n \n \nSeventy-ninth session \nAgenda item 79 \nReport of the International Law Commission on the work \nof its seventy-fifth session \n \n \n \n \n Resolution adopted by the General Assembly \non 4 December 2024 \n \n \n \n \n[on the report of the Sixth Committee (A/79/469, para. 9)] \n \n \n 79/121. Report of the International Law Commission on the work of its \nseventy-fifth session \n \n \n \nThe General Assembly, \n \nHaving considered the report of the International Law Commission on the work \nof its seventy-fifth session,1 \n \nEmphasizing the importance of furthering the progressive development and \ncodification of international law as a means of implementing the purposes and \nprinciples set forth in the Charter of the United Nations and in the Declaration on \nPrinciples of International Law concerning Friendly Relations and Cooperation \namong States in accordance with the Charter of the United Nations, 2 \n \nRecognizing the desirability of referring legal and drafting questions to the Sixth \nCommittee, including topics that might be submitted to the International Law \nCommission for closer examination, and of enabling the Sixth Committee and the \nCommission to enhance further their contribution to the progressive development and \ncodification of international law, \n \nRecalling the need to keep under review those topics of international law which, \ngiven their new or renewed interest for the international community, may be suitable \nfor the progressive development and codification of international law and therefore \nmay be included in the future programme of work of the International Law \nCommission, \n \nRecalling also the role of Member States in submitting proposals for new topics \nfor the consideration of the International Law Commission, and noting in this regard \n__________________ \n \n1  Official Records of the General Assembly, Seventy-ninth Session, Supplement No. 10 (A/79/10). \n \n2  Resolution 2625 (XXV), annex. \n\nA/RES/79/121 \nReport of the International Law Commission on the work of its \nseventy-fifth session\n \n24-23509\n2/7 \n \nthe recommendation of the Commission that such proposals be accompanied by a \nstatement of reasons, \n \nReaffirming the importance for the successful work of the International Law \nCommission of the information provided by Member States concerning their views \nand practice, \n \nRecognizing the importance of the work of the special rapporteurs of the \nInternational Law Commission, \n \nWelcoming the holding of the International Law Seminar, and the voluntary \ncontributions made to the United Nations trust fund for the International Law \nSeminar, \n \nAcknowledging the importance of facilitating the timely publication of the \nYearbook of the International Law Commission and of eliminating the backlog, \n \nRecalling the establishment of a trust fund for assistance to Special Rapporteurs \nof the International Law Commission or Chairs of its Study Groups and matters \nancillary thereto, \n \nStressing the usefulness of focusing and structuring the debate on the report of \nthe International Law Commission in the Sixth Committee in such a manner that \nconditions are provided for concentrated attention to each of the main topics dealt \nwith in the report and for discussions on specific topics, \n \nWishing to enhance further, in the context of the revitalization of the debate on \nthe report of the International Law Commission, the interaction between the Sixth \nCommittee as a body of governmental representatives and the Commission as a body \nof independent legal experts, with a view to improving the dialogue between the two \nbodies, \n \nWelcoming initiatives to hold interactive debates, panel discussions and question \ntime in the Sixth Committee, as envisaged in General Assembly resolution 58/316 of \n1 July 2004 on further measures for the revitalization of the work of the Assembly, \n \n1. \nTakes note of the report of the International Law Commission on the work \nof its seventy-fifth session; \n \n2. \nExpresses its appreciation to the International Law Commission for the \nwork accomplished at its seventy-fifth session; \n \n3. \nRecommends that the International Law Commission continue its work on \nthe topics in its current programme of work, taking into account the comments and \nobservations of Governments, whether submitted in writing or expressed orally in \ndebates in the Sixth Committee; \n \n4. \nDraws the attention of Governments to the importance for the \nInternational Law Commission of having their views on the various aspects of the \ntopics on the agenda of the Commission, in particular on all the specific issues \nidentified in chapter III of its report, including: \n \n(a) \nSea-level rise in relation to international law; \n \n(b) \nNon-legally binding international agreements;3 \n \n5. \nAlso draws the attention of Governments, in particular, to the importance \nfor the International Law Commission of having their comments and observations on \nthe draft conclusions on general principles of law and any further comments and \n__________________ \n \n3  Official Records of the General Assembly, Seventy-ninth Session, Supplement No. 10 (A/79/10), \nparas. 52\u201354. \n\nReport of the International Law Commission on the work of its \nseventy-fifth session \nA/RES/79/121\n \n3/7\n24-23509 \n \nobservations concerning draft articles 7 to 18 and the draft annex to the draft articles \non immunity of State officials from foreign criminal jurisdiction;4 \n \n6. \nEncourages the International Law Commission to continue the \nexamination of the topics that are in its long-term programme of work;5 \n \n7. \nAlso encourages the International Law Commission to take particular \naccount of the capacity and views of Member States, as well as of the workload of \nthe Commission, when including topics in its current programme of work; \n \n8. \nTakes note of paragraphs 422 to 425 of the report of the International Law \nCommission, and notes, in particular, the inclusion of the topics \u201cCompensation for \nthe damage caused by internationally wrongful acts\u201d and \u201cDue diligence in \ninternational law\u201d in the long-term programme of work of the Commission,6 and in \nthis regard calls upon the Commission to take into consideration the comments, \nconcerns and observations expressed by Governments during the debate in the Sixth \nCommittee; \n \n9. \nAlso takes note of paragraphs 443 to 445 of the report of the International \nLaw Commission and notes the commemoration of the seventy-fifth anniversary of \nthe Commission in a reduced format, and expresses its appreciation to the Member \nStates, the academic institutions and others that have made financial contributions \nand contributions in kind to facilitate the commemoration of the seventy-fifth \nanniversary of the Commission; \n \n10. Further takes note of paragraph 446 of the report of the International Law \nCommission, and requests the Secretary-General to continue his efforts to identify \nconcrete options for support for the work of special rapporteurs, additional to those \nprovided under General Assembly resolution 56/272 of 27 March 2002; \n \n11. Welcomes the efforts of the International Law Commission to improve its \nmethods of work, and encourages the Commission to continue this practice;  \n \n12. Recalls that the persons to be elected to the International Law Commission \nshould individually possess the qualifications required and that in the Commission as \na whole representation of the main forms of civilization and of the principal legal \nsystems of the world should be assured, as well as invites Member States to bear in \nmind General Assembly resolution 77/335 of 1 September 2023, concerning working \nmethods of the Assembly and its subsidiary organs, when nominating candidates for \nthe Commission; \n \n13. Invites the International Law Commission to continue to take measures to \nenhance its efficiency and productivity and to consider making proposals to Member \nStates to that end; \n__________________ \n \n4  Ibid., paras. 50 and 51. \n \n5  The following topics are currently in the long-term programme of work of the International Law \nCommission: \u201cOwnership and protection of wrecks beyond the limits of national maritime \njurisdiction\u201d, \u201cJurisdictional immunity of international organizations\u201d, \u201cProtection of personal \ndata in transborder flow of information\u201d, \u201cExtraterritorial jurisdiction\u201d, \u201cThe fair and equitable \ntreatment standard in international investment law\u201d, \u201cEvidence before international courts and \ntribunals\u201d, \u201cUniversal criminal jurisdiction\u201d, \u201cReparation to individuals for gross violations of \ninternational human rights law and serious violations of international humanitarian law\u201d, \n\u201cCompensation for the damage caused by internationally wrongful acts\u201d and \u201cDue diligence in \ninternational law\u201d. \n \n6  Official Records of the General Assembly, Seventy-ninth Session, Supplement No. 10 (A/79/10), \npara. 423. \n\nA/RES/79/121 \nReport of the International Law Commission on the work of its \nseventy-fifth session\n \n24-23509\n4/7 \n \n \n14. Recalls the importance of an in-depth analysis of State practice and the \nconsideration of the diversity of legal systems of Member States to the work of the \nInternational Law Commission;  \n \n15. Takes note of paragraph 452 of the report of the International Law \nCommission, recalls the paramount importance of multilingualism as set forth in \nGeneral Assembly resolution 78/330 of 6 September 2024 on multilingualism, \nunderlines the importance of having the documents of the Commission published in \ndue time in the six official languages of the United Nations while ensuring their \naccuracy in all official languages, and to this end requests special rapporteurs to \nsubmit their reports within the time limits specified by the Secretariat, and the \nSecretariat to give due consideration to the quality of the translation of the documents \nof the Commission in the six official languages; \n \n16. Encourages the International Law Commission to continue to take cost-\nsaving measures at its future sessions, without prejudice to the efficiency and \neffectiveness of its work; \n \n17. Recalls that the seat of the International Law Commission is at the United \nNations Office at Geneva; \n \n18. Takes note of paragraphs 465 and 466 of the report of the International \nLaw Commission, decides that the next session of the Commission shall be held at \nthe United Nations Office at Geneva from 14 April to 30 May 2025 and from 30 June \nto 31 July 2025, and stresses the importance of having a 12-week session for the \nseventy-sixth session of the Commission;  \n \n19. Also takes note of paragraph 464 of the report of the International Law \nCommission, and reiterates its endorsement of the request of the Commission that the \nSecretariat proceed with the necessary administrative and organizational \narrangements to facilitate the holding of the first part of the seventy-seventh session \nof the Commission in New York; \n \n20. Stresses the desirability of further enhancing the dialogue between the \nInternational Law Commission, in particular the special rapporteurs, and the Sixth \nCommittee, and in this context encourages, inter alia, the continued practice of \ninformal consultations in the form of discussions between the members of the Sixth \nCommittee and the members of the Commission throughout the year; \n \n21. Encourages delegations, during the debate on the report of the \nInternational Law Commission, to continue to adhere as far as possible to the \nstructured work programme agreed to by the Sixth Committee and to consider \npresenting concise and focused statements; \n \n22. Encourages Member States to consider being represented at the level of \nlegal adviser during the first week in which the report of the International Law \nCommission is discussed in the Sixth Committee (International Law Week) to enable \nhigh-level discussions on issues of international law; \n \n23. Underlines in this regard the necessity to allow sufficient time for the \nconsideration of the report of the International Law Commission in the Sixth \nCommittee; \n \n24. Requests the International Law Commission to continue to pay special \nattention to indicating in its annual report, for each topic, any specific issues on which \nexpressions of views by Governments, either in the Sixth Committee or in written \nform, would be of particular interest in providing effective guidance for the \nCommission in its further work; \n\nReport of the International Law Commission on the work of its \nseventy-fifth session \nA/RES/79/121\n \n5/7\n24-23509 \n \n \n25. Takes note of paragraphs 467 to 469 of the report of the International Law \nCommission with regard to cooperation and interaction with other bodies, and \nencourages the Commission to continue the implementation of articles 16 (e), 25 and \n26 of its statute in order to further strengthen cooperation between the Commission \nand other bodies concerned with international law, having in mind the usefulness of \nsuch cooperation; \n \n26. Notes that consulting with national organizations and individual experts \nconcerned with international law may assist Governments in considering whether to \nmake comments and observations on drafts submitted by the International Law \nCommission and in formulating their comments and observations; \n \n27. Reaffirms its previous decisions concerning the indispensable role of the \nCodification Division of the Office of Legal Affairs of the Secretariat in providing \nassistance to the International Law Commission, including in the preparation of \nmemorandums and studies on topics on the agenda of the Commission; \n \n28. Also reaffirms its previous decisions concerning the documentation and \nsummary records of the International Law Commission; 7 \n \n29. Takes note of paragraph 450 of the report of the International Law \nCommission, stresses the need to expedite the preparation of the summary records of \nthe International Law Commission, welcomes the continuation of the measures taken \nto streamline the processing of summary records during the sixty-fifth session of the \nCommission,8 which have led to a more rational use of resources, and expresses its \nsatisfaction that the summary records of the Commission, constituting travaux \npr\u00e9paratoires in the progressive development and codification of international law, \nwill not be subject to arbitrary length restrictions; \n \n30. Encourages the continuation of the practice of the Secretariat to include \non the website of the International Law Commission the provisional summary records \nin English and French relating to the work of the Commission; \n \n31. Welcomes the efforts of the Secretariat in seeking to ensure the timely and \nefficient processing of the documents of the International Law Commission and the \ninstitutionalization of the measures taken during the sixty-eighth session of the \nCommission to streamline the editing of those documents; \n \n32. Takes note of paragraph 449 of the report of the International Law \nCommission, and underlines the importance of the publications of the Codification \nDivision to the work of the Commission, welcomes in particular the issuance of the \ntenth edition of The Work of the International Law Commission in Arabic, and \nreiterates its request that the Secretary-General continue to publish The Work of the \nInternational Law Commission in all six official languages at the beginning of each \nquinquennium, the Reports of International Arbitral Awards in English or French and \nthe Summaries of the Judgments, Advisory Opinions and Orders of the International \nCourt of Justice in all six official languages every five years; \n \n33. Also takes note of paragraphs 453 to 456 of the report of the International \nLaw Commission, expresses its appreciation to the United Nations Library at Geneva \nfor the dedicated assistance accorded to the Commission, and notes the Commission\u2019s \nemphasis on the need for adequate funding to ensure the continuation of the Library\u2019s \nability to function as a research library to assist the Commission in the performance \n__________________ \n \n7  See resolutions 32/151, para. 10, and 37/111, para. 5, and all subsequent resolutions on the \nannual reports of the International Law Commission to the General Assembly; see also Yearbook \nof the International Law Commission 1982, vol. II (Part Two), paras. 267\u2013269 and 271, as well \nas all subsequent annual reports of the International Law Commission. \n \n8  Official Records of the General Assembly, Sixty-eighth Session, Supplement No. 10 (A/68/10), \npara. 183. \n\nA/RES/79/121 \nReport of the International Law Commission on the work of its \nseventy-fifth session\n \n24-23509\n6/7 \n \nof its mandate in the codification and progressive development of international law, \nas well as its support for the ongoing development of the capacity of the United \nNations Library and Archives at Geneva to act as a centre for research with a focus \non international law and multilateralism; \n \n34. Further takes note of paragraph 457 of the report of the International Law \nCommission, stresses the unique value of the Yearbook of the International Law \nCommission, and requests the Secretary-General to ensure its timely publication in \nall official languages;  \n \n35. Expresses its appreciation to Governments that have made voluntary \ncontributions to the trust fund on the backlog relating to the Yearbook of the \nInternational Law Commission, and encourages further contributions to the trust \nfund; \n \n36. Takes note of paragraph 458 of the report of the International Law \nCommission, expresses its satisfaction with the remarkable progress achieved in the \npast few years in reducing the backlog of the Yearbook of the International Law \nCommission in all six languages, welcomes the efforts made by the Division of \nConference Management of the United Nations Office at Geneva, especially its \nEditing Section, in effectively implementing relevant resolutions of the General \nAssembly calling for the reduction of the backlog, encourages that Division to \nprovide continuous necessary support to the Editing Section in advancing the \nYearbook of the International Law Commission, and requests that updates on progress \nmade in this respect be provided to the Commission on a regular basis; \n \n37. Welcomes the continuous efforts of the Codification Division to maintain \nand improve the website relating to the work of the International Law Commission; \n \n38. Takes note of paragraph 459 of the report of the International Law \nCommission and expresses its appreciation for contributions made to date to the trust \nfund to receive voluntary contributions for assistance to Special Rapporteurs of the \nInternational Law Commission or Chairs of its Study Groups and matters ancillary \nthereto, and invites further contributions to the trust fund, in accordance with the \nterms of the trust fund, including the need for the financial contributions not to be \nearmarked for any specific activity of the International Law Commission, its Special \nRapporteurs or Chairs of its Study Groups; \n \n39. Expresses the hope that the International Law Seminar will continue to be \nheld in connection with the sessions of the International Law Commission and that \nan increasing number of participants representing the principal legal systems of the \nworld and from different countries in the various regions, including in particular those \nfrom developing countries, will be given the opportunity to attend the Seminar, as \nwell as delegates to the Sixth Committee, and appeals to States to continue to make \nurgently needed voluntary contributions to the United Nations trust fund for the \nInternational Law Seminar;  \n \n40. Requests the Secretary-General to continue to provide the International \nLaw Seminar with adequate services, including interpretation, as required, and \nencourages him to continue to consider ways to improve the structure and content of \nthe Seminar; \n \n41. Underlines the importance of the records and topical summary of the \ndebate in the Sixth Committee for the deliberations of the International Law \nCommission, and in this regard requests the Secretary-General to forward to the \nCommission, for its attention, the records of the debate on the report of the \nCommission, together with such written statements as delegations may circulate in \nconjunction with their oral statements, and to prepare and distribute a topical \nsummary of the debate, following established practice; \n\nReport of the International Law Commission on the work of its \nseventy-fifth session \nA/RES/79/121\n \n7/7\n24-23509 \n \n \n42. Requests the Secretariat to circulate to States, as soon as possible after the \nconclusion of the session of the International Law Commission, chapter II of its report \ncontaining a summary of the work of that session, chapter III containing the specific \nissues on which the views of Governments would be of particular interest to the \nCommission and any draft provisions adopted on either first or second reading by the \nCommission; \n \n43. Also requests the Secretariat to make the complete report of the \nInternational Law Commission available as soon as possible after the conclusion of \nthe session of the Commission for the consideration of Member States with due \nanticipation and no later than the prescribed time limit for reports in the General \nAssembly; \n \n44. Encourages the International Law Commission to continue to consider \nways in which specific issues on which the views of Governments would be of \nparticular interest to the Commission could be framed so as to help Governments to \nhave a better appreciation of the issues on which responses are required; \n \n45. Recommends that the debate on the report of the International Law \nCommission at the eightieth session of the General Assembly commence on \n27 October 2025. \n \n47th plenary meeting \n4 December 2024 \n \n",
  "paragraphs": {
    "1": "Takes note of the report of the International Law Commission on the work of its seventy-fifth session;",
    "2": "Expresses its appreciation to the International Law Commission for the work accomplished at its seventy-fifth session;",
    "3": "Recommends that the International Law Commission continue its work on the topics in its current programme of work, taking into account the comments and observations of Governments, whether submitted in writing or expressed orally in debates in the Sixth Committee;",
    "4": "Draws the attention of Governments to the importance for the International Law Commission of having their views on the various aspects of the topics on the agenda of the Commission, in particular on all the specific issues identified in chapter III of its report, including: (a) Sea-level rise in relation to international law; (b) Non-legally binding international agreements;3",
    "5": "Also draws the attention of Governments, in particular, to the importance for the International Law Commission of having their comments and observations on the draft conclusions on general principles of law and any further comments and __________________ 3 Official Records of the General Assembly, Seventy-ninth Session, Supplement No. 10 (A/79/10), paras. 52\u201354. Report of the International Law Commission on the work of its seventy-fifth session A/RES/79/121 3/7 24-23509 observations concerning draft articles 7 to 18 and the draft annex to the draft articles on immunity of State officials from foreign criminal jurisdiction;4",
    "6": "Encourages the International Law Commission to continue the examination of the topics that are in its long-term programme of work;5",
    "7": "Also encourages the International Law Commission to take particular account of the capacity and views of Member States, as well as of the workload of the Commission, when including topics in its current programme of work;",
    "8": "Takes note of paragraphs 422 to 425 of the report of the International Law Commission, and notes, in particular, the inclusion of the topics \u201cCompensation for the damage caused by internationally wrongful acts\u201d and \u201cDue diligence in international law\u201d in the long-term programme of work of the Commission,6 and in this regard calls upon the Commission to take into consideration the comments, concerns and observations expressed by Governments during the debate in the Sixth Committee;",
    "9": "Also takes note of paragraphs 443 to 445 of the report of the International Law Commission and notes the commemoration of the seventy-fifth anniversary of the Commission in a reduced format, and expresses its appreciation to the Member States, the academic institutions and others that have made financial contributions and contributions in kind to facilitate the commemoration of the seventy-fifth anniversary of the Commission;",
    "10": "Further takes note of paragraph 446 of the report of the International Law Commission, and requests the Secretary-General to continue his efforts to identify concrete options for support for the work of special rapporteurs, additional to those provided under General Assembly resolution 56/272 of 27 March 2002;",
    "11": "Welcomes the efforts of the International Law Commission to improve its methods of work, and encourages the Commission to continue this practice;",
    "12": "Recalls that the persons to be elected to the International Law Commission should individually possess the qualifications required and that in the Commission as a whole representation of the main forms of civilization and of the principal legal systems of the world should be assured, as well as invites Member States to bear in mind General Assembly resolution 77/335 of 1 September 2023, concerning working methods of the Assembly and its subsidiary organs, when nominating candidates for the Commission;",
    "13": "Invites the International Law Commission to continue to take measures to enhance its efficiency and productivity and to consider making proposals to Member States to that end; __________________ 4 Ibid., paras. 50 and 51. 5 The following topics are currently in the long-term programme of work of the International Law Commission: \u201cOwnership and protection of wrecks beyond the limits of national maritime jurisdiction\u201d, \u201cJurisdictional immunity of international organizations\u201d, \u201cProtection of personal data in transborder flow of information\u201d, \u201cExtraterritorial jurisdiction\u201d, \u201cThe fair and equitable treatment standard in international investment law\u201d, \u201cEvidence before international courts and tribunals\u201d, \u201cUniversal criminal jurisdiction\u201d, \u201cReparation to individuals for gross violations of international human rights law and serious violations of international humanitarian law\u201d, \u201cCompensation for the damage caused by internationally wrongful acts\u201d and \u201cDue diligence in international law\u201d. 6 Official Records of the General Assembly, Seventy-ninth Session, Supplement No. 10 (A/79/10), para. 423. A/RES/79/121 Report of the International Law Commission on the work of its seventy-fifth session 24-23509 4/7",
    "14": "Recalls the importance of an in-depth analysis of State practice and the consideration of the diversity of legal systems of Member States to the work of the International Law Commission;",
    "15": "Takes note of paragraph 452 of the report of the International Law Commission, recalls the paramount importance of multilingualism as set forth in General Assembly resolution 78/330 of 6 September 2024 on multilingualism, underlines the importance of having the documents of the Commission published in due time in the six official languages of the United Nations while ensuring their accuracy in all official languages, and to this end requests special rapporteurs to submit their reports within the time limits specified by the Secretariat, and the Secretariat to give due consideration to the quality of the translation of the documents of the Commission in the six official languages;",
    "16": "Encourages the International Law Commission to continue to take cost- saving measures at its future sessions, without prejudice to the efficiency and effectiveness of its work;",
    "17": "Recalls that the seat of the International Law Commission is at the United Nations Office at Geneva;",
    "18": "Takes note of paragraphs 465 and 466 of the report of the International Law Commission, decides that the next session of the Commission shall be held at the United Nations Office at Geneva from 14 April to 30 May 2025 and from 30 June to 31 July 2025, and stresses the importance of having a 12-week session for the seventy-sixth session of the Commission;",
    "19": "Also takes note of paragraph 464 of the report of the International Law Commission, and reiterates its endorsement of the request of the Commission that the Secretariat proceed with the necessary administrative and organizational arrangements to facilitate the holding of the first part of the seventy-seventh session of the Commission in New York;",
    "20": "Stresses the desirability of further enhancing the dialogue between the International Law Commission, in particular the special rapporteurs, and the Sixth Committee, and in this context encourages, inter alia, the continued practice of informal consultations in the form of discussions between the members of the Sixth Committee and the members of the Commission throughout the year;",
    "21": "Encourages delegations, during the debate on the report of the International Law Commission, to continue to adhere as far as possible to the structured work programme agreed to by the Sixth Committee and to consider presenting concise and focused statements;",
    "22": "Encourages Member States to consider being represented at the level of legal adviser during the first week in which the report of the International Law Commission is discussed in the Sixth Committee (International Law Week) to enable high-level discussions on issues of international law;",
    "23": "Underlines in this regard the necessity to allow sufficient time for the consideration of the report of the International Law Commission in the Sixth Committee;",
    "24": "Requests the International Law Commission to continue to pay special attention to indicating in its annual report, for each topic, any specific issues on which expressions of views by Governments, either in the Sixth Committee or in written form, would be of particular interest in providing effective guidance for the Commission in its further work; Report of the International Law Commission on the work of its seventy-fifth session A/RES/79/121 5/7 24-23509",
    "25": "Takes note of paragraphs 467 to 469 of the report of the International Law Commission with regard to cooperation and interaction with other bodies, and encourages the Commission to continue the implementation of articles 16 (e), 25 and 26 of its statute in order to further strengthen cooperation between the Commission and other bodies concerned with international law, having in mind the usefulness of such cooperation;",
    "26": "Notes that consulting with national organizations and individual experts concerned with international law may assist Governments in considering whether to make comments and observations on drafts submitted by the International Law Commission and in formulating their comments and observations;",
    "27": "Reaffirms its previous decisions concerning the indispensable role of the Codification Division of the Office of Legal Affairs of the Secretariat in providing assistance to the International Law Commission, including in the preparation of memorandums and studies on topics on the agenda of the Commission;",
    "28": "Also reaffirms its previous decisions concerning the documentation and summary records of the International Law Commission; 7",
    "29": "Takes note of paragraph 450 of the report of the International Law Commission, stresses the need to expedite the preparation of the summary records of the International Law Commission, welcomes the continuation of the measures taken to streamline the processing of summary records during the sixty-fifth session of the Commission,8 which have led to a more rational use of resources, and expresses its satisfaction that the summary records of the Commission, constituting travaux pr\u00e9paratoires in the progressive development and codification of international law, will not be subject to arbitrary length restrictions;",
    "30": "Encourages the continuation of the practice of the Secretariat to include on the website of the International Law Commission the provisional summary records in English and French relating to the work of the Commission;",
    "31": "Welcomes the efforts of the Secretariat in seeking to ensure the timely and efficient processing of the documents of the International Law Commission and the institutionalization of the measures taken during the sixty-eighth session of the Commission to streamline the editing of those documents;",
    "32": "Takes note of paragraph 449 of the report of the International Law Commission, and underlines the importance of the publications of the Codification Division to the work of the Commission, welcomes in particular the issuance of the tenth edition of The Work of the International Law Commission in Arabic, and reiterates its request that the Secretary-General continue to publish The Work of the International Law Commission in all six official languages at the beginning of each quinquennium, the Reports of International Arbitral Awards in English or French and the Summaries of the Judgments, Advisory Opinions and Orders of the International Court of Justice in all six official languages every five years;",
    "33": "Also takes note of paragraphs 453 to 456 of the report of the International Law Commission, expresses its appreciation to the United Nations Library at Geneva for the dedicated assistance accorded to the Commission, and notes the Commission\u2019s emphasis on the need for adequate funding to ensure the continuation of the Library\u2019s ability to function as a research library to assist the Commission in the performance __________________ 7 See resolutions 32/151, para. 10, and 37/111, para. 5, and all subsequent resolutions on the annual reports of the International Law Commission to the General Assembly; see also Yearbook of the International Law Commission 1982, vol. II (Part Two), paras. 267\u2013269 and 271, as well as all subsequent annual reports of the International Law Commission. 8 Official Records of the General Assembly, Sixty-eighth Session, Supplement No. 10 (A/68/10), para. 183. A/RES/79/121 Report of the International Law Commission on the work of its seventy-fifth session 24-23509 6/7 of its mandate in the codification and progressive development of international law, as well as its support for the ongoing development of the capacity of the United Nations Library and Archives at Geneva to act as a centre for research with a focus on international law and multilateralism;",
    "34": "Further takes note of paragraph 457 of the report of the International Law Commission, stresses the unique value of the Yearbook of the International Law Commission, and requests the Secretary-General to ensure its timely publication in all official languages;",
    "35": "Expresses its appreciation to Governments that have made voluntary contributions to the trust fund on the backlog relating to the Yearbook of the International Law Commission, and encourages further contributions to the trust fund;",
    "36": "Takes note of paragraph 458 of the report of the International Law Commission, expresses its satisfaction with the remarkable progress achieved in the past few years in reducing the backlog of the Yearbook of the International Law Commission in all six languages, welcomes the efforts made by the Division of Conference Management of the United Nations Office at Geneva, especially its Editing Section, in effectively implementing relevant resolutions of the General Assembly calling for the reduction of the backlog, encourages that Division to provide continuous necessary support to the Editing Section in advancing the Yearbook of the International Law Commission, and requests that updates on progress made in this respect be provided to the Commission on a regular basis;",
    "37": "Welcomes the continuous efforts of the Codification Division to maintain and improve the website relating to the work of the International Law Commission;",
    "38": "Takes note of paragraph 459 of the report of the International Law Commission and expresses its appreciation for contributions made to date to the trust fund to receive voluntary contributions for assistance to Special Rapporteurs of the International Law Commission or Chairs of its Study Groups and matters ancillary thereto, and invites further contributions to the trust fund, in accordance with the terms of the trust fund, including the need for the financial contributions not to be earmarked for any specific activity of the International Law Commission, its Special Rapporteurs or Chairs of its Study Groups;",
    "39": "Expresses the hope that the International Law Seminar will continue to be held in connection with the sessions of the International Law Commission and that an increasing number of participants representing the principal legal systems of the world and from different countries in the various regions, including in particular those from developing countries, will be given the opportunity to attend the Seminar, as well as delegates to the Sixth Committee, and appeals to States to continue to make urgently needed voluntary contributions to the United Nations trust fund for the International Law Seminar;",
    "40": "Requests the Secretary-General to continue to provide the International Law Seminar with adequate services, including interpretation, as required, and encourages him to continue to consider ways to improve the structure and content of the Seminar;",
    "41": "Underlines the importance of the records and topical summary of the debate in the Sixth Committee for the deliberations of the International Law Commission, and in this regard requests the Secretary-General to forward to the Commission, for its attention, the records of the debate on the report of the Commission, together with such written statements as delegations may circulate in conjunction with their oral statements, and to prepare and distribute a topical summary of the debate, following established practice; Report of the International Law Commission on the work of its seventy-fifth session A/RES/79/121 7/7 24-23509",
    "42": "Requests the Secretariat to circulate to States, as soon as possible after the conclusion of the session of the International Law Commission, chapter II of its report containing a summary of the work of that session, chapter III containing the specific issues on which the views of Governments would be of particular interest to the Commission and any draft provisions adopted on either first or second reading by the Commission;",
    "43": "Also requests the Secretariat to make the complete report of the International Law Commission available as soon as possible after the conclusion of the session of the Commission for the consideration of Member States with due anticipation and no later than the prescribed time limit for reports in the General Assembly;",
    "44": "Encourages the International Law Commission to continue to consider ways in which specific issues on which the views of Governments would be of particular interest to the Commission could be framed so as to help Governments to have a better appreciation of the issues on which responses are required;",
    "45": "Recommends that the debate on the report of the International Law Commission at the eightieth session of the General Assembly commence on 27 October 2025. 47th plenary meeting 4 December 2024"
  },
  "agenda_items": [
    "Item 79"
  ],
  "symbol_references": []
}