{
  "symbol": "A/RES/76/253",
  "filename": "A_RES_76_253.pdf",
  "title": "76/253. International Year of Rangelands and Pastoralists, 2026",
  "text": "United Nations \nA/RES/76/253\n \n \nGeneral Assembly \nDistr.: General \n17 March 2022 \n \n22-03840 (E)    220322 \n*2203840* \n \n \nSeventy-sixth session \nAgenda item 15 \nIntegrated and coordinated implementation of and follow-\nup to the outcomes of the major United Nations conferences \nand summits in the economic, social and related fields \n \n \n \n \n Resolution adopted by the General Assembly on  \n15 March 2022 \n \n \n \n \n[without reference to a Main Committee (A/76/L.36 and A/76/L.36/Add.1)] \n \n \n 76/253. International Year of Rangelands and Pastoralists, 2026 \n \n \n \nThe General Assembly, \n \nReaffirming its resolution 70/1 of 25 September 2015, entitled \u201cTransforming \nour world: the 2030 Agenda for Sustainable Development\u201d, in which it adopted a \ncomprehensive, far-reaching and people-centred set of universal and transformative \nSustainable Development Goals and targets, its commitment to working tirelessly for \nthe full implementation of the Agenda by 2030, its recognition that eradicating \npoverty in all its forms and dimensions, including extreme poverty, is the greatest \nglobal challenge and an indispensable requirement for sustainable development, its \ncommitment to achieving sustainable development in its three dimensions \u2013 \neconomic, social and environmental \u2013 in a balanced and integrated manner, and to \nbuilding upon the achievements of the Millennium Development Goals and seeking \nto address their unfinished business, \n \nReaffirming also its resolutions 53/199 of 15 December 1998 and 61/185 of \n20 December 2006 on the proclamation of international years, and Economic and \nSocial Council resolution 1980/67 of 25 July 1980 on international years and \nanniversaries, in particular paragraphs 1 to 10 of the annex thereto on the agreed \ncriteria for the proclamation of international years, as well as paragraphs 13 and 14, \nin which it is stated that an international year should not be proclaimed before the \nbasic arrangements for its organization and financing have been made, \n \nRecalling resolution 5/2021 of 18 June 2021, adopted by the Conference of the \nFood and Agriculture Organization of the United Nations at its forty-second session,1 \n__________________ \n \n1  Food and Agriculture Organization of the United Nations, document C/2021/REP, appendix D.  \n\nA/RES/76/253 \nInternational Year of Rangelands and Pastoralists, 2026\n \n22-03840\n2/3 \n \n \nRecognizing the relevance of sustainable rangelands and pastoralism to several \nsubprogrammes and thematic areas of the United Nations, including the United \nNations Environment Programme, the work under the United Nations Convention to \nCombat Desertification in Those Countries Experiencing Serious Drought and/or \nDesertification, Particularly in Africa 2 and the International Fund for Agricultural \nDevelopment, and acknowledging their collaborative efforts with intergovernmental, \nprivate sector and civil society partners, \n \nTaking note of United Nations Environment Assembly resolutions 2/24 of \n27 May 2016 on combating desertification, land degradation and drought and \npromoting sustainable pastoralism and rangelands3 and 4/15 of 15 March 2019 on \ninnovations in sustainable rangelands and pastoralism,4 decision 14.COM 10.b.2 on \n\u201cTranshumance, the seasonal droving of livestock along migratory routes in the \nMediterranean and in the Alps\u201d, adopted by the Intergovernmental Committee for the \nSafeguarding of the Intangible Cultural Heritage of the United Nations Educational, \nScientific and Cultural Organization at its fourteenth session, held from 9 to \n14 December 2019, and decision 26/COP.14 of 13 September 2019 of the Conference \nof the Parties to the United Nations Convention to Combat Desertification,5 \n \nRecognizing that pastoralism is a dynamic and transformative livelihood linked \nto the diverse ecosystems, cultures, identities, traditional knowledge and historical \nexperience of coexisting with nature, \n \nReaffirming that healthy rangelands are vital for contributing to economic \ngrowth, resilient livelihoods and the sustainable development of pastoralism, \n \nAware that a significant number of pastoralists in the world inhabit rangelands \nand that pastoralism is globally practised in many different forms, \n \nNoting that more than half of the Earth\u2019s land surface is classified as rangelands \nand that these areas are suffering considerable desertification, including in countries \nwith substantial drylands, \n \nRecalling its resolution 72/239 of 20 December 2017, by which it proclaimed \nthe United Nations Decade of Family Farming (2019\u20132028), and its resolution 73/284 \nof 1 March 2019, by which it proclaimed the United Nations Decade on Ecosystem \nRestoration (2020\u20132030), and the need to support pastoralists and sustainable \nrangelands management, \n \nRecalling also its resolution 72/210 of 20 December 2017, by which it declared \n2024 the International Year of Camelids to promote awareness among the public of \nthe economic and cultural importance of camelids and to foster the consumption of \nthe goods produced from these mammals, including edible goods, in order to \ncontribute to the eradication of hunger, food insecurity and malnutrition, \n \nAcknowledging that efforts aimed at achieving sustainable rangelands and \npastoralism need to be rapidly upscaled so as to have a significant impact in the \nrealization of the Sustainable Development Goals, \n \nAcknowledging also that rangelands and pastoralism are currently facing urgent \nand different challenges around the world, \n \nRecognizing the importance of national policies on conservation and sustainable \nuse of natural resources in order to manage grazing areas, wildlife, water sources, \n__________________ \n \n2  United Nations, Treaty Series, vol. 1954, No. 33480. \n \n3  See Official Records of the General Assembly, Seventy-first Session, Supplement No. 25 \n(A/71/25), annex. \n \n4  UNEP/EA.4/Res.15. \n \n5  See ICCD/COP(14)/23/Add.1. \n\nInternational Year of Rangelands and Pastoralists, 2026 \nA/RES/76/253\n \n3/3\n22-03840 \n \nlivestock movement, risk and resilience, and to enable land-use planning and \necosystem management by pastoralists and relevant public entities, \n \nEmphasizing that well-developed and fair production pastoral value chains can \nprovide equitable economic opportunities and contribute to ending extreme poverty, \n \nCalling upon Member States to further build the capacity of and continue or \nincrease responsible investment in the pastoral livestock sector, including for \nsustainable land management practices, improved and/or restored ecosystems, \nbalanced access to markets, livestock health and breeding, and enhanced livestock \nextension services, in order to improve productivity, contribute to the reduction of \ngreenhouse gas emissions, increase adaptive capacity, and maintain and enhance \nbiodiversity, \n \nCalling upon all Member States, organizations of the United Nations system, \nother international and regional organizations and other relevant stakeholders, \nincluding civil society, the private sector and academia, to fill knowledge gaps \nrelating to rangelands and pastoralism and to promote innovative solutions for the \nsustainable management and ecological restoration of rangelands, taking into account \nthe traditional knowledge of pastoralists, \n \nRecognizing that the observance of an International Year of Rangelands and \nPastoralists in 2026 by the international community would contribute significantly to \nraising awareness of these issues of global concern, \n \n1. \nDecides to declare 2026 the International Year of Rangelands and \nPastoralists; \n \n2. \nInvites all Member States, organizations of the United Nations system, \nother international and regional organizations and other relevant stakeholders, \nincluding civil society, the private sector and academia, to observe the International \nYear, as appropriate, through activities aimed at raising awareness and the visibility \nof and directing attention to the relevance of the sustainable management of \nrangelands and pastoralism and its contribution to achieving sustainable \ndevelopment; \n \n3. \nInvites the Food and Agriculture Organization of the United Nations, \nmindful of the provisions contained in the annex to Economic and Social Council \nresolution 1980/67, to facilitate the implementation of the International Year; \n \n4. \nAlso invites the Food and Agriculture Organization of the United Nations, \nmindful of the provisions of paragraphs 23 to 27 of the annex to Economic and Social \nCouncil resolution 1980/67, to inform the General Assembly at its eighty-second \nsession about the implementation of the present resolution, including an evaluation \nof the implementation of the International Year; \n \n5. \nStresses that the costs of all the activities that may arise from the \nimplementation of the present resolution should be met through voluntary \ncontributions, including from the private sector; \n \n6. \nInvites all relevant stakeholders to contribute to and support the \nimplementation of the International Year; \n \n7. \nRequests the Secretary-General to bring the present resolution to the \nattention of all Member States, the organizations of the United Nations system and \nother relevant stakeholders, including civil society, the private sector and academia, \nfor appropriate observance. \n \n61st plenary meeting \n15 March 2022 \n",
  "paragraphs": {
    "1": "Decides to declare 2026 the International Year of Rangelands and Pastoralists;",
    "2": "Invites all Member States, organizations of the United Nations system, other international and regional organizations and other relevant stakeholders, including civil society, the private sector and academia, to observe the International Year, as appropriate, through activities aimed at raising awareness and the visibility of and directing attention to the relevance of the sustainable management of rangelands and pastoralism and its contribution to achieving sustainable development;",
    "3": "Invites the Food and Agriculture Organization of the United Nations, mindful of the provisions contained in the annex to Economic and Social Council resolution 1980/67, to facilitate the implementation of the International Year;",
    "4": "Also invites the Food and Agriculture Organization of the United Nations, mindful of the provisions of paragraphs 23 to 27 of the annex to Economic and Social Council resolution 1980/67, to inform the General Assembly at its eighty-second session about the implementation of the present resolution, including an evaluation of the implementation of the International Year;",
    "5": "Stresses that the costs of all the activities that may arise from the implementation of the present resolution should be met through voluntary contributions, including from the private sector;",
    "6": "Invites all relevant stakeholders to contribute to and support the implementation of the International Year;",
    "7": "Requests the Secretary-General to bring the present resolution to the attention of all Member States, the organizations of the United Nations system and other relevant stakeholders, including civil society, the private sector and academia, for appropriate observance."
  },
  "agenda_items": [
    "Item 15"
  ],
  "symbol_references": [
    "A/76/L.36"
  ]
}