{
  "symbol": "A/RES/78/8",
  "filename": "A_RES_78_8.pdf",
  "title": "78/8. Report of the International Atomic Energy Agency",
  "text": "United Nations \nA/RES/78/8\n \n \nGeneral Assembly \nDistr.: General \n9 November 2023 \n \n23-21904 (E)    151123 \n*2321904* \n \n \nSeventy-eighth session \nAgenda item 89 \nReport of the International Atomic Energy Agency \n \n \n \n \n Resolution adopted by the General Assembly \non 8 November 2023 \n \n \n \n \n[without reference to a Main Committee (A/78/L.7)] \n \n \n \n78/8. Report of the International Atomic Energy Agency \n \n \n \nThe General Assembly, \n \nHaving received the report of the International Atomic Energy Agency for 2022 1 \n \nTaking note of the statement by the Director General of the Agency, in which he \nprovided additional information on the main developments in the activities of the \nAgency during 2023, \n \nRecognizing the importance of the work of the Agency,  \n \nRecognizing also the cooperation between the United Nations and the Agency \nand the Agreement governing the relationship between the United Nations and the \nAgency as approved by the General Conference of the Agency on 23 October 1957 \nand by the General Assembly in the annex to its resolution 1145 (XII) of 14 November \n1957, \n \n1. \nTakes note with appreciation of the report of the International Atomic \nEnergy Agency; \n \n2. \nTakes note of resolutions GC(67)/RES/7, entitled \u201cNuclear and radiation \nsafety\u201d; GC(67)/RES/8, entitled \u201cNuclear security\u201d; GC(67)/RES/9, entitled \n\u201cStrengthening of the Agency\u2019s technical cooperation activities\u201d; GC(67)/RES/10, \nentitled \u201cStrengthening the Agency\u2019s activities related to nuclear science, technology \nand applications\u201d, comprising GC(67)/RES/10 A, entitled \u201cNon-power nuclear \napplications\u201d, GC(67)/RES/10 B, entitled \u201cNuclear power applications\u201d, and \nGC(67)/RES/10 C, entitled \u201cNuclear knowledge management\u201d; GC(67)/RES/11, \nentitled \u201cStrengthening the effectiveness and improving the efficiency of Agency \nsafeguards\u201d; GC(67)/RES/12, entitled \u201cImplementation of the NPT safeguards \nagreement between the Agency and the Democratic People\u2019s Republic of Korea\u201d; \nGC(67)/RES/13, entitled \u201cApplication of IAEA safeguards in the Middle East\u201d; \nGC(67)/RES/14, entitled \u201cStatus of Palestine in the IAEA\u201d; GC(67)/RES/15, entitled \n__________________ \n \n1  See A/78/304. \n\nA/RES/78/8 \nReport of the International Atomic Energy Agency\n \n23-21904\n2/2 \n \n\u201cRestoration of the sovereign equality of Member States in the IAEA\u201d; \nGC(67)/RES/16, entitled \u201cNuclear safety, security and safeguards in Ukraine\u201d; and \nGC(67)/RES/17, entitled \u201cPersonnel\u201d, comprising GC(67)/RES/17 A, entitled \n\u201cStaffing of the Agency\u2019s Secretariat\u201d and GC(67)/RES/17 B, entitled \u201cWomen in the \nSecretariat\u201d; and decisions GC(67)/DEC/9, entitled \u201cAmendment to Article XIV.A of \nthe Statute\u201d; GC(67)/DEC/10, entitled \u201cAmendment to Article VI of the Statute\u201d; and \nGC(67)/DEC/11, entitled \u201cPromotion of efficiency and effectiveness of the IAEA \ndecision making process\u201d, adopted by the General Conference of the Agency at its \nsixty-seventh regular session, held from 25 to 29 September 2023;  \n \n3. \nReaffirms its strong support for the indispensable role of the Agency in \nencouraging and assisting the development and practical application of atomic energy \nfor peaceful uses, in technology transfer to developing countries and in nuclear safety, \nverification and security;  \n \n4. \nWelcomes resolution GC(67)/RES/1 on the approval of the appointment of \nRafael Mariano Grossi as Director General of the Agency from 3 December 2023 to \n2 December 2027; \n \n5. \nAppeals to Member States to continue to support the activities of the \nAgency;  \n \n6. \nRequests the Secretary-General to transmit to the Director General of the \nAgency the records of the seventy-eighth session of the General Assembly relating to \nthe activities of the Agency. \n \n30th plenary meeting \n8 November 2023 \n \n",
  "paragraphs": {
    "1": "Takes note with appreciation of the report of the International Atomic Energy Agency;",
    "2": "Takes note of resolutions GC(67)/RES/7, entitled \u201cNuclear and radiation safety\u201d; GC(67)/RES/8, entitled \u201cNuclear security\u201d; GC(67)/RES/9, entitled \u201cStrengthening of the Agency\u2019s technical cooperation activities\u201d; GC(67)/RES/10, entitled \u201cStrengthening the Agency\u2019s activities related to nuclear science, technology and applications\u201d, comprising GC(67)/RES/10 A, entitled \u201cNon-power nuclear applications\u201d, GC(67)/RES/10 B, entitled \u201cNuclear power applications\u201d, and GC(67)/RES/10 C, entitled \u201cNuclear knowledge management\u201d; GC(67)/RES/11, entitled \u201cStrengthening the effectiveness and improving the efficiency of Agency safeguards\u201d; GC(67)/RES/12, entitled \u201cImplementation of the NPT safeguards agreement between the Agency and the Democratic People\u2019s Republic of Korea\u201d; GC(67)/RES/13, entitled \u201cApplication of IAEA safeguards in the Middle East\u201d; GC(67)/RES/14, entitled \u201cStatus of Palestine in the IAEA\u201d; GC(67)/RES/15, entitled __________________ 1 See A/78/304. A/RES/78/8 Report of the International Atomic Energy Agency 23-21904 2/2 \u201cRestoration of the sovereign equality of Member States in the IAEA\u201d; GC(67)/RES/16, entitled \u201cNuclear safety, security and safeguards in Ukraine\u201d; and GC(67)/RES/17, entitled \u201cPersonnel\u201d, comprising GC(67)/RES/17 A, entitled \u201cStaffing of the Agency\u2019s Secretariat\u201d and GC(67)/RES/17 B, entitled \u201cWomen in the Secretariat\u201d; and decisions GC(67)/DEC/9, entitled \u201cAmendment to Article XIV.A of the Statute\u201d; GC(67)/DEC/10, entitled \u201cAmendment to Article VI of the Statute\u201d; and GC(67)/DEC/11, entitled \u201cPromotion of efficiency and effectiveness of the IAEA decision making process\u201d, adopted by the General Conference of the Agency at its sixty-seventh regular session, held from 25 to 29 September 2023;",
    "3": "Reaffirms its strong support for the indispensable role of the Agency in encouraging and assisting the development and practical application of atomic energy for peaceful uses, in technology transfer to developing countries and in nuclear safety, verification and security;",
    "4": "Welcomes resolution GC(67)/RES/1 on the approval of the appointment of Rafael Mariano Grossi as Director General of the Agency from 3 December 2023 to 2 December 2027;",
    "5": "Appeals to Member States to continue to support the activities of the Agency;",
    "6": "Requests the Secretary-General to transmit to the Director General of the Agency the records of the seventy-eighth session of the General Assembly relating to the activities of the Agency. 30th plenary meeting 8 November 2023"
  },
  "agenda_items": [
    "Item 89"
  ],
  "symbol_references": [
    "A/78/L.7"
  ]
}