{
  "symbol": "A/RES/73/119",
  "filename": "A_RES_73_119.pdf",
  "title": "73/119. Question of Bermuda",
  "text": "United Nations \nA/RES/73/119\n \n \nGeneral Assembly \nDistr.: General \n19 December 2018 \n \n18-21507 (E)    211218     \n*1821507* \n \n \nSeventy-third session \nAgenda item 63 \n \n \n \n \n Resolution adopted by the General Assembly \non 7 December 2018 \n \n \n \n \n[on the report of the Special Political and Decolonization Committee \n(Fourth Committee) (A/73/532)] \n \n \n \n73/119. Question of Bermuda  \n \n \n \nThe General Assembly, \n \nHaving considered the question of Bermuda and examined the relevant chapter \nof the report of the Special Committee on the Situation with regard to the \nImplementation of the Declaration on the Granting of Independence to Colonial \nCountries and Peoples for 2018,1  \n \nTaking note of the working paper prepared by the Secretariat on Bermuda 2 and \nother relevant information, \n \nRecognizing that all available options for self-determination of the Territory are \nvalid as long as they are in accordance with the freely expressed wishes of the people \nof Bermuda and in conformity with the clearly defined principles contained in \nGeneral Assembly resolutions 1514 (XV) of 14 December 1960, 1541 (XV) of \n15 December 1960 and other resolutions of the Assembly, \n \nExpressing concern that 58 years after the adoption of the Declaration on the \nGranting of Independence to Colonial Countries and Peoples, 3 there still remain \n17 Non-Self-Governing Territories, including Bermuda, \n \nConscious of the importance of continuing the effective implementation of the \nDeclaration, taking into account the target set by the United Nations to eradicate \ncolonialism by 2020 and the plans of action for the Second 4 and Third International \nDecades for the Eradication of Colonialism, \n__________________ \n \n1  Official Records of the General Assembly, Seventy-third Session, Supplement No. 23 (A/73/23), \nchap. X. \n \n2  A/AC.109/2018/3. \n \n3  Resolution 1514 (XV). \n \n4  A/56/61, annex. \n\nA/RES/73/119 \nQuestion of Bermuda\n \n18-21507\n2/5 \n \n \nRecognizing that the specific characteristics and the aspirations of the people of \nBermuda require flexible, practical and innovative approaches to the options for self-\ndetermination, without any prejudice to territorial size, geographical location, size of \npopulation or natural resources, \n \nConvinced that the wishes and aspirations of the people of the Territory should \ncontinue to guide the development of their future political status and that \nreferendums, free and fair elections and other forms of popular consultation play an \nimportant role in ascertaining the wishes and aspirations of the people, \n \nConcerned by the use and exploitation of the natural resources of the Non-Self-\nGoverning Territories by the administering Powers for their benefit, by the use of the \nTerritories as international financial centres to the detriment of the world economy \nand by the consequences of any economic activities of the administering Powers that \nare contrary to the interests of the people of the Territories, as well as to \nresolution 1514 (XV), \n \nConvinced that any negotiations to determine the status of the Territory must \ntake place with the active involvement and participation of the people of the Territory, \nunder the auspices of the United Nations, on a case-by-case basis, and that the views \nof the people of Bermuda in respect of their right to self-determination should be \nascertained, \n \nNoting the continued cooperation of the Non-Self-Governing Territories at the \nlocal and regional levels, including participation in the work of regional organizations, \n \nMindful that, in order for the Special Committee to enhance its understanding \nof the political status of the people of Bermuda and to fulfil its mandate effectively, \nit is important for it to be apprised by the United Kingdom of Great Britain and \nNorthern Ireland as the administering Power and to receive information from other \nappropriate sources, including the representatives of the Territory, concerning the \nwishes and aspirations of the people of the Territory, \n \nAware of the importance both to Bermuda and to the Special Committee of the \nparticipation of elected and appointed representatives of Bermuda in the work of the \nCommittee, \n \nRecognizing the need for the Special Committee to ensure that the appropriate \nbodies of the United Nations actively pursue a public awareness campaign aimed at \nassisting the people of Bermuda with their inalienable right to self-determination and \nin gaining a better understanding of the options for self-determination, on a case-by-\ncase basis, \n \nMindful, in that connection, that the holding of regional seminars in the \nCaribbean and Pacific regions and at Headquarters, with the active participation of \nrepresentatives of the Non-Self-Governing Territories, provides a helpful means for \nthe Special Committee to fulfil its mandate and that the regional nature of the \nseminars, which alternate between the Caribbean and the Pacific, is a crucial element \nin the context of a United Nations programme for ascertaining the political status of \nthe Territories, \n \nWelcoming the Pacific regional seminar on the theme \u201cImplementation of the \nThird International Decade for the Eradication of Colonialism: towards the \nachievement of the Sustainable Development Goals in the Non-Self-Governing \nTerritories \u2014 social, economic and environmental challenges\u201d, held by the Special \nCommittee in Saint George\u2019s and hosted by the Government of Grenada from 9 to \n11 May 2018, as a significant and forward-looking event, which enabled the \nparticipants to assess progress made and address challenges faced in the \ndecolonization process, review the existing working methods of the Committee and \nrenew its commitment to implementing its historic task, \n\nQuestion of Bermuda \nA/RES/73/119\n \n3/5\n18-21507 \n \n \nRecognizing the importance of the conclusions and recommendations adopted \nby the seminar, which are annexed to the report of the Special Committee5 and which \noutline the findings of the seminar, including, especially, the way forward for the \ndecolonization process within the context of the proclamation by the General \nAssembly of the period 2011\u20132020 as the Third International Decade for the \nEradication of Colonialism,6  \n \nNoting with appreciation the contribution to the development of some \nTerritories by the specialized agencies and other organizations of the United Nations \nsystem, in particular the Economic Commission for Latin America and the Caribbean, \nthe Economic and Social Commission for Asia and the Pacific, the United Nations \nDevelopment Programme and the World Food Programme, as well as regional \ninstitutions such as the Caribbean Development Bank, the Caribbean Community, the \nOrganisation of Eastern Caribbean States, the Pacific Islands Forum and the agencies \nof the Council of Regional Organizations in the Pacific, \n \nRecalling the statement made by the Attorney-General and Minister of Justice \nas a representative of the Government of Bermuda at the Pacific regional seminar \nheld in Quito from 30 May to 1 June 2012, \n \nNoting with serious concern that the Territory last participated in the activities \nof the Special Committee in 2012, \n \nRecalling the dispatch of the United Nations special mission to Bermuda in \n2005, at the request of the territorial Government and with the concurrence of the \nadministering Power, which provided information to the people of the Territory on \nthe role of the United Nations in the process of self-determination, on the legitimate \npolitical status options as clearly defined in General Assembly resolution 1541 (XV) \nand on the experiences of other small States that have achieved a full measure of self-\ngovernment, \n \nStressing the importance of good governance, transparency and accountability \nin the Territory, \n \nCognizant of the potential usefulness of regional ties for the development of a \nsmall island Territory, \n \nRecalling the extension by the administering Power to Bermuda of the \nConvention on the Elimination of All Forms of Discrimination against Women 7 in \nMarch 2017, \n \nRecalling also the general elections which took place in July 2017,8  \n \n1. \nReaffirms the inalienable right of the people of Bermuda to self-\ndetermination, in conformity with the Charter of the United Nations and with General \nAssembly resolution 1514 (XV), containing the Declaration on the Granting of \nIndependence to Colonial Countries and Peoples; \n \n2. \nAlso reaffirms that, in the process of decolonization of Bermuda, there is \nno alternative to the principle of self-determination, which is also a fundamental \nhuman right, as recognized under the relevant human rights conventions; \n \n3. \nFurther reaffirms that it is ultimately for the people of Bermuda to \ndetermine freely their future political status in accordance with the relevant \nprovisions of the Charter, the Declaration and the relevant resolutions of the General \nAssembly, and in that connection calls upon the administering Power, in cooperation \n__________________ \n \n5  Official Records of the General Assembly, Seventy-third Session, Supplement No. 23 (A/73/23). \n \n6  See resolution 65/119. \n \n7  United Nations, Treaty Series, vol. 1249, No. 20378. \n \n8  See A/AC.109/2018/3, para. 4. \n\nA/RES/73/119 \nQuestion of Bermuda\n \n18-21507\n4/5 \n \nwith the territorial Government and appropriate bodies of the United Nations system, \nto develop political education programmes for the Territory in order to foster an \nawareness among the people of their right to self-determination in conformity with \nthe legitimate political status options, based on the principles clearly defined in \nAssembly resolution 1541 (XV) and other relevant resolutions and decisions; \n \n4. \nStresses the importance of the 2005 report of the Bermuda Independence \nCommission, which provides a thorough examination of the facts surrounding \nindependence, and continues to regret that the plans for public meetings and the \npresentation of a Green Paper to the House of Assembly followed by a White Paper \noutlining the policy proposals for an independent Bermuda have so far not \nmaterialized; \n \n5. \nUnderlines the need further to strengthen good governance, transparency \nand accountability in government for the benefit of the Territory; \n \n6. \nRequests the administering Power to assist the Territory by facilitating its \nwork concerning public educational outreach efforts, consistent with Article 73 b of \nthe Charter, and in that regard calls upon the relevant United Nations organizations \nto provide assistance to the Territory, if requested; \n \n7. \nWelcomes the active participation of Bermuda in the work of the Economic \nCommission for Latin America and the Caribbean; \n \n8. \nStresses that the Territory should continue to participate in the activities of \nthe Special Committee, including regional seminars, in order to provide the \nCommittee with up-to-date information regarding the decolonization process; \n \n9. \nAlso stresses the importance of the Special Committee being apprised of \nthe views and wishes of the people of Bermuda and enhancing its understanding of \ntheir conditions, including the nature and scope of the existing political and \nconstitutional arrangements between Bermuda and the administering Power; \n \n10. Calls upon the administering Power to participate in and cooperate fully \nwith the work of the Special Committee in order to implement the provisions of \nArticle 73 e of the Charter and the Declaration and in order to advise the Committee \non the implementation of the provisions under Article 73 b of the Charter on efforts \nto promote self-government in Bermuda, and encourages the administering Power to \nfacilitate visiting and special missions to the Territory; \n \n11. \nReaffirms the responsibility of the administering Power under the Charter \nto promote the economic and social development and to preserve the cultural identity \nof the Territory, and requests the administering Power to take steps to enlist and make \neffective use of all possible assistance, on both a bilateral and a multilateral basis, in \nthe strengthening of the economy of the Territory; \n \n12. Takes into account the 2030 Agenda for Sustainable Development, 9 \nincluding the Sustainable Development Goals, stresses the importance of fostering \nthe economic and social sustainable development of the Territory by promoting \nsustained, inclusive and equitable economic growth, creating greater opportunities for \nall, reducing inequalities, raising basic standards of living, fostering equitable social \ndevelopment and inclusion and promoting the integrated and sustainable management \nof natural resources and ecosystems that supports, inter alia, economic, social and \nhuman development, while facilitating ecosystem conservation, regeneration, \nrestoration and resilience in the face of new and emerging challenges, and strongly \nurges the administering Power to refrain from undertaking any kind of illicit, harmful \n__________________ \n \n9  Resolution 70/1. \n\nQuestion of Bermuda \nA/RES/73/119\n \n5/5\n18-21507 \n \nand unproductive activities, including the use of the Territory as an international \nfinancial centre, that are not aligned with the interest of the people of the Territory; \n \n13. Requests the Territory and the administering Power to take all measures \nnecessary to protect and conserve the environment of the Territory against any \ndegradation, and once again requests the specialized agencies concerned to monitor \nenvironmental conditions in the Territory and to provide assistance to the Territory, \nconsistent with their prevailing rules of procedure; \n \n14. Requests the Special Committee to continue to examine the question of \nBermuda and to report thereon to the General Assembly at its seventy-fourth session \nand on the implementation of the present resolution. \n \n48th plenary meeting  \n7 December 2018 \n \n",
  "paragraphs": {
    "1": "Reaffirms the inalienable right of the people of Bermuda to self- determination, in conformity with the Charter of the United Nations and with General Assembly resolution 1514 (XV), containing the Declaration on the Granting of Independence to Colonial Countries and Peoples;",
    "2": "Also reaffirms that, in the process of decolonization of Bermuda, there is no alternative to the principle of self-determination, which is also a fundamental human right, as recognized under the relevant human rights conventions;",
    "3": "Further reaffirms that it is ultimately for the people of Bermuda to determine freely their future political status in accordance with the relevant provisions of the Charter, the Declaration and the relevant resolutions of the General Assembly, and in that connection calls upon the administering Power, in cooperation __________________ 5 Official Records of the General Assembly, Seventy-third Session, Supplement No. 23 (A/73/23). 6 See resolution 65/119. 7 United Nations, Treaty Series, vol. 1249, No. 20378. 8 See A/AC.109/2018/3, para. 4. A/RES/73/119 Question of Bermuda 18-21507 4/5 with the territorial Government and appropriate bodies of the United Nations system, to develop political education programmes for the Territory in order to foster an awareness among the people of their right to self-determination in conformity with the legitimate political status options, based on the principles clearly defined in Assembly resolution 1541 (XV) and other relevant resolutions and decisions;",
    "4": "Stresses the importance of the 2005 report of the Bermuda Independence Commission, which provides a thorough examination of the facts surrounding independence, and continues to regret that the plans for public meetings and the presentation of a Green Paper to the House of Assembly followed by a White Paper outlining the policy proposals for an independent Bermuda have so far not materialized;",
    "5": "Underlines the need further to strengthen good governance, transparency and accountability in government for the benefit of the Territory;",
    "6": "Requests the administering Power to assist the Territory by facilitating its work concerning public educational outreach efforts, consistent with Article 73 b of the Charter, and in that regard calls upon the relevant United Nations organizations to provide assistance to the Territory, if requested;",
    "7": "Welcomes the active participation of Bermuda in the work of the Economic Commission for Latin America and the Caribbean;",
    "8": "Stresses that the Territory should continue to participate in the activities of the Special Committee, including regional seminars, in order to provide the Committee with up-to-date information regarding the decolonization process;",
    "9": "Also stresses the importance of the Special Committee being apprised of the views and wishes of the people of Bermuda and enhancing its understanding of their conditions, including the nature and scope of the existing political and constitutional arrangements between Bermuda and the administering Power;",
    "10": "Calls upon the administering Power to participate in and cooperate fully with the work of the Special Committee in order to implement the provisions of Article 73 e of the Charter and the Declaration and in order to advise the Committee on the implementation of the provisions under Article 73 b of the Charter on efforts to promote self-government in Bermuda, and encourages the administering Power to facilitate visiting and special missions to the Territory;",
    "11": "Reaffirms the responsibility of the administering Power under the Charter to promote the economic and social development and to preserve the cultural identity of the Territory, and requests the administering Power to take steps to enlist and make effective use of all possible assistance, on both a bilateral and a multilateral basis, in the strengthening of the economy of the Territory;",
    "12": "Takes into account the 2030 Agenda for Sustainable Development, 9 including the Sustainable Development Goals, stresses the importance of fostering the economic and social sustainable development of the Territory by promoting sustained, inclusive and equitable economic growth, creating greater opportunities for all, reducing inequalities, raising basic standards of living, fostering equitable social development and inclusion and promoting the integrated and sustainable management of natural resources and ecosystems that supports, inter alia, economic, social and human development, while facilitating ecosystem conservation, regeneration, restoration and resilience in the face of new and emerging challenges, and strongly urges the administering Power to refrain from undertaking any kind of illicit, harmful __________________ 9 Resolution 70/1. Question of Bermuda A/RES/73/119 5/5 18-21507 and unproductive activities, including the use of the Territory as an international financial centre, that are not aligned with the interest of the people of the Territory;",
    "13": "Requests the Territory and the administering Power to take all measures necessary to protect and conserve the environment of the Territory against any degradation, and once again requests the specialized agencies concerned to monitor environmental conditions in the Territory and to provide assistance to the Territory, consistent with their prevailing rules of procedure;",
    "14": "Requests the Special Committee to continue to examine the question of Bermuda and to report thereon to the General Assembly at its seventy-fourth session and on the implementation of the present resolution. 48th plenary meeting 7 December 2018"
  },
  "agenda_items": [
    "Item 63"
  ],
  "symbol_references": []
}