{
  "symbol": "A/RES/76/305",
  "filename": "A_RES_76_305.pdf",
  "title": "76/305. Financing for peacebuilding",
  "text": "United Nations \nA/RES/76/305\n \n \nGeneral Assembly \nDistr.: General \n12 September 2022 \n \n22-21685 (E)    150922     \n*2221685* \n \n \nSeventy-sixth session \nAgenda item 66 \nPeacebuilding and sustaining peace \n \n \n \n \n Resolution adopted by the General Assembly \non 8 September 2022 \n \n \n \n \n[without reference to a Main Committee (A/76/L.86)] \n \n \n 76/305. Financing for peacebuilding \n \n \n \nThe General Assembly, \n \nGuided by the purposes and principles of the Charter of the United Nations, \n \nReaffirming General Assembly resolution 60/1 of 16 September 2005 and \nGeneral Assembly and Security Council resolutions 60/180 and 1645 (2005) of \n20 December 2005, 70/262 and 2282 (2016) of 27 April 2016, 72/276 and 2413 (2018) \nof 26 April 2018 and 75/201 and 2558 (2020) of 21 December 2020, \n \nRecognizing that peacebuilding is an inherently political process aimed at \npreventing the outbreak, escalation, recurrence or continuation of conflict, and further \nrecognizing that peacebuilding encompasses a wide range of political, development \nand human rights programmes and mechanisms, \n \nRecognizing the need for peacebuilding efforts to have adequate, predictable \nand sustained financing in order to effectively assist countries to build and sustain \npeace, \n \nRecognizing also that financing for peacebuilding remains a critical challenge \nand that additional resources are required to address the existing financing gaps and \nmeet increasing requests for peacebuilding and sustaining peace support from \nMember States, including conflict-affected countries and regions, and recognizing \nfurther the benefits of peacebuilding for the countries concerned, \n \nReaffirming the primary responsibility of national Governments and authorities \nin identifying, driving and directing priorities, strategies and activities for sustaining \npeace, and in this regard emphasizing that inclusivity is key to advancing national \npeacebuilding processes and objectives in order to ensure that the needs of all \nsegments of society are taken into account, \n\nA/RES/76/305 \nFinancing for peacebuilding\n \n22-21685\n2/4 \n \n \nReaffirming also that effective peacebuilding must involve the entire United \nNations system, and recognizing that an integrated, coordinated and coherent \napproach within the United Nations and strategic partnerships with regional and \nsubregional organizations are critical in supporting national efforts to build and \nsustain peace, \n \nRecognizing the need to enhance financing to ensure the full, equal and \nmeaningful participation of women and youth in peacebuilding, \n \nWelcoming the valuable work undertaken by the Peacebuilding Fund as a \ncatalytic, rapid-response and flexible pre-positioned pooled fund providing financing \nto activities to sustain peace in conflict-affected countries, and in advancing strategic \nalignment within the United Nations system and between the United Nations and the \ninternational financial institutions, \n \nWelcoming also the important role of other relevant United Nations funds in \ncontributing to peacebuilding and sustaining peace, including global and country-\nlevel multi-donor funds dedicated to peacebuilding and sustaining peace, \n \nRecognizing the contributions of the United Nations development system to \npeacebuilding, and affirming the importance of financing and implementing the \nSustainable Development Goals,1 which also contributes to comprehensive \npeacebuilding and sustaining peace, \n \nTaking note of the report of the Secretary-General on peacebuilding and \nsustaining peace of 28 January 2022,2 noting the recommendations on financing for \npeacebuilding presented by the Secretary-General in his reports on peacebuilding and \nsustaining peace in 2018, 2019 and 2020, and noting also the submission of the report \nof the Secretary-General on investing in prevention and peacebuilding of 1 March \n2022,3 \n \nWelcoming the valuable inputs of the Peacebuilding Commission contained in \nthe letter dated 21 April 2022 from the Chair of the Commission addressed to the \nPresident of the General Assembly, \n \nWelcoming also the discussions and commitments made by Member States at \nthe high-level meeting on financing for peacebuilding, held on 27 and 29 April 2022, \n \nRecalling its decision 76/548 C of 29 June 2022, \n \n1. \nNotes the progress made in financing for peacebuilding by the entire \nUnited Nations system, while recognizing that financing for peacebuilding remains a \ncritical challenge, and affirms its commitment to consider all options for adequate, \npredictable and sustained financing for peacebuilding, including through voluntary, \ninnovative and assessed funding and other means of resource mobilization, and notes \nthe significance non-monetary contributions can play in peacebuilding efforts; \n \n2. \nCalls upon the Peacebuilding Commission to continue to strengthen the \ndelivery of its advisory, bridging and convening mandate in support of resource \nmobilization for nationally owned peacebuilding priorities in the countries and \nregions under its consideration, and to continue to strengthen its working methods to \nenhance its efficiency and impact in support of peacebuilding and sustaining peace, \nin synergy with the Peacebuilding Fund; \n \n3. \nEncourages all Member States and other partners to consider increasing \ntheir contributions to peacebuilding and sustaining peace activities in conflict-\n__________________ \n \n1 See resolution 70/1. \n \n2 A/76/668-S/2022/66 and A/76/668-S/2022/66/Corr.1. \n \n3 A/76/732. \n\nFinancing for peacebuilding \nA/RES/76/305\n \n3/4\n22-21685 \n \naffected countries and regions, and stresses the importance of multi-year, flexible and \nrisk-tolerant funding commitments, including pooled funding; \n \n4. \nUnderlines the critical contribution of peacekeeping operations and \nspecial political missions to peacebuilding activities, where and as mandated, \nunderscores the importance of transition finance plans established at an early stage, \nand stresses the importance of sufficient funding to support peacebuilding activities \nduring transitions and throughout the life cycle of peacekeeping operations and \nspecial political missions, especially in the period immediately after their departure \nor reconfiguration; \n \n5. \nRequests the Secretary-General to continue to elaborate options for \nadequate resourcing of the peacebuilding activities of United Nations country teams, \nincluding those carried out through the Peacebuilding Fund, and the mandated \npeacebuilding activities of United Nations peacekeeping operations and special \npolitical missions, including during mission transitions and drawdown, for the \nconsideration of Member States; \n \n6. \nUrges efforts to fund initiatives that integrate women\u2019s full, equal and \nmeaningful participation in the planning, implementation and reporting of \npeacebuilding and sustaining peace at all levels, including at the local level, welcomes \nthe progress made by the Peacebuilding Fund in meeting and exceeding the Secretary-\nGeneral\u2019s targets for investments in support of inclusive and gender-responsive \npeacebuilding, and encourages other United Nations and non-United Nations funding \nmechanisms to increase the percentage of peacebuilding funding dedicated to gender \nequality and the empowerment of all women and girls; \n \n7. \nAlso urges efforts to address existing financing gaps for youth-led \ninitiatives and youth organizations to ensure the full, effective and meaningful \nparticipation of youth in the design, monitoring and implementation of peacebuilding \nefforts at all levels, and encourages all financing stakeholders to increase coordination \nand collaboration with youth on financing national priorities; \n \n8. \nRecognizes the importance of taking into account the local context in \npeacebuilding and sustaining peace, and stresses that civil society can play an \nimportant role in advancing efforts in peacebuilding and sustaining peace, and in this \nregard urges longer-term and more flexible funding mechanisms for strengthening \ncapacities of local communities in tandem with national peacebuilding efforts; \n \n9. \nNotes the launch of the Secretary-General\u2019s peacebuilding funding dashboard \nand its contribution to enhancing transparency and coordination of the utilization of funds, \nencourages its further development to strengthen accessibility that enhances information-\nsharing for the planning and coordination of financing, and calls upon the Secretary-\nGeneral to finalize the dashboard to catalogue all existing instruments and funding \nstreams supporting United Nations peacebuilding, including pooled funds within the \nUnited Nations system at the global, regional and national levels; \n \n10. \nEncourages all relevant stakeholders in the field of financing for \npeacebuilding to increase their strategic and operational collaboration at the regional \nand country levels, including in peacebuilding, development and humanitarian efforts, \nwith a view to promoting coordinated and context-specific approaches; \n \n11. \nEncourages the Secretary-General to develop a strategy for resource \nmobilization from the private sector in support of financing for peacebuilding, and \nfurther encourages Member States and the private sector to take practical steps to \nstrengthen partnerships in support of peacebuilding efforts; \n \n12. \nEncourages all Member States to enhance efforts to explore and pilot \ninnovative and flexible mechanisms to mobilize additional public and private financing \nfor peacebuilding that can be further contextualized, implemented and scaled up in \nconflict-affected countries and regions, building on existing best practices; \n\nA/RES/76/305 \nFinancing for peacebuilding\n \n22-21685\n4/4 \n \n \n13. Encourages Member States to foster cooperation, including South-South \nand triangular cooperation for peacebuilding, and also encourages strengthened \nSouth-South cooperation with the Peacebuilding Fund in mobilizing resources for the \njoint implementation of peacebuilding activities, and reaffirms that such cooperation \nis an important element of multilateral cooperation; \n \n14. Recognizes the important role of international and regional financial \ninstitutions \nin \npeacebuilding \nand \nsustaining \npeace, \nand \nencourages \nthe \nimplementation of the strategies adopted by the African Development Bank, the \nIslamic Development Bank, the International Monetary Fund and the World Bank, as \nwell as the relevant strategies adopted or being developed by other regional and \ninternational financial institutions focusing on operating in peacebuilding settings and \nconflict-affected countries and regions, including addressing drivers of conflict, and \nfurther encourages continued efforts towards strengthened partnership and strategic \ncooperation between the United Nations and international financial institutions at \nheadquarters and field levels and consideration of joint initiative and analysis, where \napplicable, and shared priority-setting towards collective outcomes, complementarity \nand coordination in implementation, in line with national priorities; \n \n15. Welcomes the funding compact, noting its voluntary nature, encourages \nMember States and entities of the United Nations system to contribute to its full and \neffective implementation, affirms the importance of voluntary contributions to the \nPeacebuilding Fund, and stresses the need to broaden and diversify the donor base, \nand in this regard encourages Member States and stakeholders to make and increase \nvoluntary, multi-year and flexible contributions to the Fund; \n \n16. Reaffirms the importance of ensuring adequate, predictable and sustained \nfinancing for peacebuilding, notes that the amount of voluntary contributions has not \nbeen sufficient to meet increasing demands for the support of the Peacebuilding Fund, \nand affirms that other sources of funding, including assessed contributions, could be \nused to finance the Fund through modalities determined by the General Assembly as \na means of achieving this objective, and stresses that assessed funding is not meant \nto be a substitute for voluntary contributions and innovative funding; \n \n17. Notes that the provision of assessed contributions to financing for \npeacebuilding would represent a shared commitment of Member States to \npeacebuilding and sustaining peace; \n \n18. Encourages the Fifth Committee to continue and conclude its \nconsideration of the report of the Secretary-General on investing in prevention and \npeacebuilding \nincluding \nconsiderations \nrelated \nto \nincreased \ntransparency, \naccountability and oversight of the Peacebuilding Fund including by requesting the \nSecretary-General to review the terms of reference of the Fund in close consultation \nwith Member States including ensuring a geographically representative Advisory \nGroup of the Fund, while ensuring the continued flexibility and agility of the Fund \nduring the seventy-seventh session of the General Assembly; \n \n19. Requests the Secretary-General to present proposals to standardize the \nreporting procedures of the existing financing for peacebuilding mechanisms of the \nUnited Nations in consideration of the diversity of the implementing partners; \n \n20. Also requests the Secretary-General to include in his regular reports on \npeacebuilding and sustaining peace an update on the implementation of the present \nresolution, as well as recommendations to further advance efforts to ensure adequate, \npredictable and sustained financing for peacebuilding. \n \n102nd plenary meeting \n8 September 2022 \n",
  "paragraphs": {
    "1": "Notes the progress made in financing for peacebuilding by the entire United Nations system, while recognizing that financing for peacebuilding remains a critical challenge, and affirms its commitment to consider all options for adequate, predictable and sustained financing for peacebuilding, including through voluntary, innovative and assessed funding and other means of resource mobilization, and notes the significance non-monetary contributions can play in peacebuilding efforts;",
    "2": "Calls upon the Peacebuilding Commission to continue to strengthen the delivery of its advisory, bridging and convening mandate in support of resource mobilization for nationally owned peacebuilding priorities in the countries and regions under its consideration, and to continue to strengthen its working methods to enhance its efficiency and impact in support of peacebuilding and sustaining peace, in synergy with the Peacebuilding Fund;",
    "3": "Encourages all Member States and other partners to consider increasing their contributions to peacebuilding and sustaining peace activities in conflict- affected countries and regions, and stresses the importance of multi-year, flexible and risk-tolerant funding commitments, including pooled funding;",
    "4": "Underlines the critical contribution of peacekeeping operations and special political missions to peacebuilding activities, where and as mandated, underscores the importance of transition finance plans established at an early stage, and stresses the importance of sufficient funding to support peacebuilding activities during transitions and throughout the life cycle of peacekeeping operations and special political missions, especially in the period immediately after their departure or reconfiguration;",
    "5": "Requests the Secretary-General to continue to elaborate options for adequate resourcing of the peacebuilding activities of United Nations country teams, including those carried out through the Peacebuilding Fund, and the mandated peacebuilding activities of United Nations peacekeeping operations and special political missions, including during mission transitions and drawdown, for the consideration of Member States;",
    "6": "Urges efforts to fund initiatives that integrate women\u2019s full, equal and meaningful participation in the planning, implementation and reporting of peacebuilding and sustaining peace at all levels, including at the local level, welcomes the progress made by the Peacebuilding Fund in meeting and exceeding the Secretary- General\u2019s targets for investments in support of inclusive and gender-responsive peacebuilding, and encourages other United Nations and non-United Nations funding mechanisms to increase the percentage of peacebuilding funding dedicated to gender equality and the empowerment of all women and girls;",
    "7": "Also urges efforts to address existing financing gaps for youth-led initiatives and youth organizations to ensure the full, effective and meaningful participation of youth in the design, monitoring and implementation of peacebuilding efforts at all levels, and encourages all financing stakeholders to increase coordination and collaboration with youth on financing national priorities;",
    "8": "Recognizes the importance of taking into account the local context in peacebuilding and sustaining peace, and stresses that civil society can play an important role in advancing efforts in peacebuilding and sustaining peace, and in this regard urges longer-term and more flexible funding mechanisms for strengthening capacities of local communities in tandem with national peacebuilding efforts;",
    "9": "Notes the launch of the Secretary-General\u2019s peacebuilding funding dashboard and its contribution to enhancing transparency and coordination of the utilization of funds, encourages its further development to strengthen accessibility that enhances information- sharing for the planning and coordination of financing, and calls upon the Secretary- General to finalize the dashboard to catalogue all existing instruments and funding streams supporting United Nations peacebuilding, including pooled funds within the United Nations system at the global, regional and national levels;",
    "10": "Encourages all relevant stakeholders in the field of financing for peacebuilding to increase their strategic and operational collaboration at the regional and country levels, including in peacebuilding, development and humanitarian efforts, with a view to promoting coordinated and context-specific approaches;",
    "11": "Encourages the Secretary-General to develop a strategy for resource mobilization from the private sector in support of financing for peacebuilding, and further encourages Member States and the private sector to take practical steps to strengthen partnerships in support of peacebuilding efforts;",
    "12": "",
    "13": "Encourages Member States to foster cooperation, including South-South and triangular cooperation for peacebuilding, and also encourages strengthened South-South cooperation with the Peacebuilding Fund in mobilizing resources for the joint implementation of peacebuilding activities, and reaffirms that such cooperation is an important element of multilateral cooperation;",
    "14": "Recognizes the important role of international and regional financial institutions in peacebuilding and sustaining peace, and encourages the implementation of the strategies adopted by the African Development Bank, the Islamic Development Bank, the International Monetary Fund and the World Bank, as well as the relevant strategies adopted or being developed by other regional and international financial institutions focusing on operating in peacebuilding settings and conflict-affected countries and regions, including addressing drivers of conflict, and further encourages continued efforts towards strengthened partnership and strategic cooperation between the United Nations and international financial institutions at headquarters and field levels and consideration of joint initiative and analysis, where applicable, and shared priority-setting towards collective outcomes, complementarity and coordination in implementation, in line with national priorities;",
    "15": "Welcomes the funding compact, noting its voluntary nature, encourages Member States and entities of the United Nations system to contribute to its full and effective implementation, affirms the importance of voluntary contributions to the Peacebuilding Fund, and stresses the need to broaden and diversify the donor base, and in this regard encourages Member States and stakeholders to make and increase voluntary, multi-year and flexible contributions to the Fund;",
    "16": "Reaffirms the importance of ensuring adequate, predictable and sustained financing for peacebuilding, notes that the amount of voluntary contributions has not been sufficient to meet increasing demands for the support of the Peacebuilding Fund, and affirms that other sources of funding, including assessed contributions, could be used to finance the Fund through modalities determined by the General Assembly as a means of achieving this objective, and stresses that assessed funding is not meant to be a substitute for voluntary contributions and innovative funding;",
    "17": "Notes that the provision of assessed contributions to financing for peacebuilding would represent a shared commitment of Member States to peacebuilding and sustaining peace;",
    "18": "Encourages the Fifth Committee to continue and conclude its consideration of the report of the Secretary-General on investing in prevention and peacebuilding including considerations related to increased transparency, accountability and oversight of the Peacebuilding Fund including by requesting the Secretary-General to review the terms of reference of the Fund in close consultation with Member States including ensuring a geographically representative Advisory Group of the Fund, while ensuring the continued flexibility and agility of the Fund during the seventy-seventh session of the General Assembly;",
    "19": "Requests the Secretary-General to present proposals to standardize the reporting procedures of the existing financing for peacebuilding mechanisms of the United Nations in consideration of the diversity of the implementing partners;",
    "20": "Also requests the Secretary-General to include in his regular reports on peacebuilding and sustaining peace an update on the implementation of the present resolution, as well as recommendations to further advance efforts to ensure adequate, predictable and sustained financing for peacebuilding."
  },
  "agenda_items": [
    "Item 66"
  ],
  "symbol_references": [
    "A/76/L.86"
  ]
}