{
  "symbol": "A/RES/78/126",
  "filename": "A_RES_78_126.pdf",
  "title": "78/126. Deferral of the graduation of Angola from the least developed country category to a later date",
  "text": "United Nations \nA/RES/78/126\n \n \nGeneral Assembly \nDistr.: General \n21 December 2023 \n \n23-25869 (E)    291223     \n*2325869* \n \n \nSeventy-eighth session \nAgenda item 9 \nReport of the Economic and Social Council \n \n \n \n \n Resolution adopted by the General Assembly \non 18 December 2023 \n \n \n \n \n[without reference to a Main Committee (A/78/L.29)] \n \n \n 78/126. Deferral of the graduation of Angola from the least developed \ncountry category to a later date \n \n \n \nThe General Assembly, \n \nRecalling its resolution 75/259 of 11 February 2021,  \n \nRecalling also Economic and Social Council resolution 2023/10 of 7 June 2023 \non the report of the Committee for Development Policy on its twenty-fifth session,  \n \nTaking into account its resolutions 59/209 of 20 December 2004, 65/286 of \n29 June 2011 and 67/221 of 21 December 2012 on a smooth transition for countries \ngraduating from the category of least developed countries,  \n \nRecalling its resolution 76/258 of 1 April 2022, by which the General Assembly \nendorsed the Doha Programme of Action for the Least Developed Countries,  \n \nReaffirming its commitment to the process of graduation from the least \ndeveloped country category and encouraging smooth transition measures for \ngraduating countries,  \n \n1. \nReaffirms that graduating from the category of least developed countries \nshould be sustainable and irreversible and should not result in a disruption of \ndevelopment plans, programmes and projects; \n \n2. \nTakes note of the recommendation of the Economic and Social Council \nthat the graduation of Angola from the least developed country category be deferred \nto a later date to enable the Committee for Development Policy to consider further \nthe situation of Angola and its smooth transition strategy, and for the Council to \nupdate its recommendation to the Assembly in 2024;  \n \n3. \nDecides to defer the graduation of Angola from the least developed \ncountry category to a later date. \n \n48th plenary meeting \n18 December 2023 \n",
  "paragraphs": {
    "1": "Reaffirms that graduating from the category of least developed countries should be sustainable and irreversible and should not result in a disruption of development plans, programmes and projects;",
    "2": "Takes note of the recommendation of the Economic and Social Council that the graduation of Angola from the least developed country category be deferred to a later date to enable the Committee for Development Policy to consider further the situation of Angola and its smooth transition strategy, and for the Council to update its recommendation to the Assembly in 2024;",
    "3": "Decides to defer the graduation of Angola from the least developed country category to a later date."
  },
  "agenda_items": [
    "Item 9"
  ],
  "symbol_references": [
    "A/78/L.29"
  ]
}