{
  "symbol": "A/RES/75/28",
  "filename": "A_RES_75_28.pdf",
  "title": "75/28. The role and importance of a policy of neutrality in maintaining and strengthening international peace, security and sustainable development",
  "text": "United Nations \nA/RES/75/28\n \n \nGeneral Assembly \nDistr.: General \n14 December 2020 \n \n20-16519 (E)    181220     \n*2016519* \n \n \nSeventy-fifth session \nAgenda item 34 (a) \nPrevention of armed conflict: prevention of armed conflict \n \n \n \n \n Resolution adopted by the General Assembly on \n7 December 2020 \n \n \n \n \n[without reference to a Main Committee (A/75/L.31 and A/75/L.31/Add.1)] \n \n \n \n75/28. The role and importance of a policy of neutrality in maintaining \nand strengthening international peace, security and \nsustainable development \n \n \n \nThe General Assembly, \n \nRecalling its resolutions 50/80 A of 12 December 1995, 69/285 of 3 June 2015 \nand 71/275 of 2 February 2017, \n \nGuided by the purposes and principles enshrined in the Charter of the United \nNations,  \n \nCommemorating the seventy-fifth anniversary of the United Nations, and \nrecognizing the urgent need to promote and strengthen multilateralism and that the \nUnited Nations plays a central role in this regard,  \n \nRecalling the outcome document of the high-level international conference on \nthe theme \u201cPolicy of neutrality: international cooperation for peace, security and \ndevelopment\u201d (the Ashgabat outcome document), adopted on 12 December 2015, 1  \n \nUnderlining that the national policies of neutrality of some States can contribute \nto the strengthening of international peace and security in relevant regions and at the \nglobal level and can play an important role in developing peaceful, friendly and \nmutually beneficial relations between the countries of the world,  \n \nRecognizing that such national policies of neutrality are aimed at promoting the \nuse of preventive diplomacy, including through the prevention of conflict, mediation, \ngood offices, negotiation, the use of special envoys, informal consultations, \npeacebuilding and targeted development activities,  \n \nRecognizing also the positive role that neutral countries could play in the \nprovision and delivery of humanitarian assistance in situations of complex \n__________________ \n \n1  A/70/652-S/2016/20, annex. \n\nA/RES/75/28 \nThe role and importance of a policy of neutrality in maintaining \nand strengthening international peace, security \nand sustainable development\n \n20-16519\n2/2 \n \nemergencies and natural disasters, in accordance with the provisions of General \nAssembly resolution 46/182 of 19 December 1991 on the strengthening of the \ncoordination of humanitarian emergency assistance of the United Nations and the \nannex thereto, including the humanitarian principles of humanity, neutrality, \nimpartiality and independence, and all subsequent Assembly resolutions on the \nsubject, including its resolution 74/118 of 16 December 2019, as well as relevant \nresolutions and agreed conclusions of the Economic and Social Council,  \n \nUnderlining the importance that the economic and geoeconomic aspects of \nnational neutrality can have for subregional, regional and international \ninterconnectivity,  \n \n1. \nInvites the Secretary-General to cooperate closely with neutral States, with \na view to implementing the principles of preventive diplomacy and using those \nprinciples in their mediation activities;  \n \n2. \nRecommends to all Member States, organizations of the United Nations \nsystem and other international, regional and subregional organizations the use, as \nappropriate, of the full potential of neutral States and mediation in the peaceful \nsettlement of disputes, conflict prevention and resolution in accordance with the \nCharter of the United Nations;  \n \n3. \nWelcomes the decision of the Government of Turkmenistan to host an \ninternational conference on peace, security and development, devoted to the \nInternational Day of Neutrality, 12 December;  \n \n4. \nNotes with appreciation the initiative of the Government of Turkmenistan \nto establish the Group of Friends of Neutrality for Peace, Security and Sustainable \nDevelopment;  \n \n5. \nOnce again invites all Member States, organizations of the United Nations \nsystem \nand \nother \ninternational \nand \nregional \norganizations, \nas \nwell \nas \nnon-governmental organizations and individuals, to mark annually the International \nDay of Neutrality on 12 December by means of education and the holding of events \naimed at enhancing the knowledge of the public about the role and importance of a \npolicy of neutrality in maintaining and strengthening international peace and security;  \n \n6. \nInvites the Secretary-General to seek the views of Member States and \nrelevant entities of the United Nations system, including regional commissions, on \nthe role and importance of a policy of neutrality in maintaining and strengthening \ninternational peace and security, and to communicate such views to the General \nAssembly at its seventy-sixth session for further consideration. \n \n \n36th plenary meeting \n7 December 2020 \n \n",
  "paragraphs": {
    "1": "Invites the Secretary-General to cooperate closely with neutral States, with a view to implementing the principles of preventive diplomacy and using those principles in their mediation activities;",
    "2": "Recommends to all Member States, organizations of the United Nations system and other international, regional and subregional organizations the use, as appropriate, of the full potential of neutral States and mediation in the peaceful settlement of disputes, conflict prevention and resolution in accordance with the Charter of the United Nations;",
    "3": "Welcomes the decision of the Government of Turkmenistan to host an international conference on peace, security and development, devoted to the International Day of Neutrality, 12 December;",
    "4": "Notes with appreciation the initiative of the Government of Turkmenistan to establish the Group of Friends of Neutrality for Peace, Security and Sustainable Development;",
    "5": "Once again invites all Member States, organizations of the United Nations system and other international and regional organizations, as well as non-governmental organizations and individuals, to mark annually the International Day of Neutrality on 12 December by means of education and the holding of events aimed at enhancing the knowledge of the public about the role and importance of a policy of neutrality in maintaining and strengthening international peace and security;",
    "6": "Invites the Secretary-General to seek the views of Member States and relevant entities of the United Nations system, including regional commissions, on the role and importance of a policy of neutrality in maintaining and strengthening international peace and security, and to communicate such views to the General Assembly at its seventy-sixth session for further consideration. 36th plenary meeting 7 December 2020"
  },
  "agenda_items": [
    "Item 34"
  ],
  "symbol_references": [
    "A/75/L.31"
  ]
}