{
  "symbol": "A/RES/76/95",
  "filename": "A_RES_76_95.pdf",
  "title": "76/95. Question of French Polynesia",
  "text": "United Nations \nA/RES/76/95\n \n \nGeneral Assembly \nDistr.: General \n16 December 2021 \n \n21-18698 (E)    211221 \n*2118698*\n \n \n \nSeventy-sixth session \nAgenda item 63 \nImplementation of the Declaration on the Granting of \nIndependence to Colonial Countries and Peoples \n \n \n \n \n Resolution adopted by the General Assembly \non 9 December 2021 \n \n \n \n \n[on the report of the Special Political and Decolonization Committee  \n(Fourth Committee) (A/76/425, para. 37)] \n \n \n \n76/95. Question of French Polynesia \n \n \n \nThe General Assembly, \n \nHaving considered the question of French Polynesia, \n \nHaving examined the report of the Special Committee on the Situation with \nregard to the Implementation of the Declaration on the Granting of Independence to \nColonial Countries and Peoples for 2021,1 \n \nTaking note of the working paper prepared by the Secretariat on French \nPolynesia2 and other relevant information, \n \nReaffirming the right of peoples to self-determination, as enshrined in the Charter \nof the United Nations and in accordance with all relevant resolutions, including \nGeneral Assembly resolutions 1514 (XV) of 14 December 1960 and 1541 (XV) of \n15 December 1960, \n \nRecalling its resolution 67/265 of 17 May 2013, entitled \u201cSelf-determination of \nFrench Polynesia\u201d, in which it affirmed the inalienable right of the people of French \nPolynesia to self-determination and independence in accordance with Chapter XI of \nthe Charter and its resolution 1514 (XV), recognized that French Polynesia remains \na Non-Self-Governing Territory within the meaning of the Charter and declared that \nan obligation exists under Article 73 e of the Charter on the part of the Government \nof France, as the administering Power of the Territory, to transmit information on \nFrench Polynesia, \n__________________ \n \n1 Official Records of the General Assembly, Seventy-sixth Session, Supplement No. 23 (A/76/23). \n \n2 A/AC.109/2021/7. \n\nA/RES/76/95 \nQuestion of French Polynesia\n \n21-18698\n2/4 \n \n \nTaking note of the section related to French Polynesia of the Final Document of \nthe Eighteenth Summit of Heads of State or Government of Non-Aligned Countries, \nheld in Baku on 25 and 26 October 2019,3 \n \nExpressing concern that, more than 60 years after the adoption of the \nDeclaration on the Granting of Independence to Colonial Countries and Peoples, 4 \nthere still remain 17 Non-Self-Governing Territories, including French Polynesia, \n \nRecognizing that all available options for self-determination of the Territories \nare valid as long as they are in accordance with the freely expressed wishes of the \npeoples concerned, on a case-by-case basis and in conformity with the clearly defined \nprinciples contained in General Assembly resolutions 1514 (XV), 1541 (XV) and \nother relevant resolutions of the Assembly, \n \nRecognizing also that the specific characteristics and the aspirations of the \npeople of French Polynesia require flexible, practical and innovative approaches to \nthe options for self-determination, without any prejudice to territorial size, \ngeographical location, size of population or natural resources, \n \nReaffirming the inalienable rights of the people of French Polynesia to the \nownership, control and disposal of their natural resources, including marine resources \nand undersea minerals, \n \nConscious of the responsibility of the administering Power to ensure the full and \nspeedy implementation of the Declaration in respect of French Polynesia, \n \nMindful that, in order for the Special Committee to enhance its understanding \nof the political status of the peoples of the Territories and to fulfil its mandate \neffectively, on a case-by-case basis, it is important for it to be apprised by the \nadministering Powers and to receive information from other appropriate sources, \nincluding the representatives of the Territories, concerning the wishes and aspirations \nof the people of the Territories, \n \nRecognizing the significant health and environmental impacts of nuclear testing \nconducted by the administering Power in the Territory over a 30-year period, and \nrecognizing also the concerns in the Territory related to the consequences of those \nactivities for the lives and health of the people, especially children and vulnerable \ngroups, as well as the environment of the region, and bearing in mind General Assembly \nresolution 75/91 of 10 December 2020, entitled \u201cEffects of atomic radiation\u201d, \n \nRecalling the report of the Secretary-General on the environmental, ecological, \nhealth and other impacts of the 30-year period of nuclear testing in French Polynesia, 5 \nprepared pursuant to paragraph 7 of General Assembly resolution 71/120 of \n6 December 2016, \n \nNoting that, in February 2017, the administering Power amended the Act \nconcerning the recognition and compensating of victims of nuclear tests6 in order to allow \nfor the compensation of a larger number of victims, and that further amendments have \nbeen adopted, \n \nRecognizing the need for the Special Committee to ensure that the appropriate \nbodies of the United Nations actively pursue a public awareness campaign aimed at \nassisting the peoples of the Territories in gaining a better understanding of the options \nfor self-determination, \n__________________ \n \n3 See A/74/548, annex. \n \n4 Resolution 1514 (XV). \n \n5 A/72/74. \n \n6 Act No. 2010-2 of 5 January 2010 concerning the recognition and compensating of victims of \nnuclear tests. \n\nQuestion of French Polynesia \nA/RES/76/95\n \n3/4\n21-18698 \n \n \nRecalling the admission of French Polynesia as a full member of the Pacific \nIslands Forum at the forty-seventh Pacific Islands Forum, convened in Pohnpei, \nFederated States of Micronesia, from 8 to 10 September 2016, \n \nRecalling also the statement made by the President of French Polynesia in the \nSpecial Political and Decolonization Committee (Fourth Committee), at the seventy-\nfourth session of the General Assembly, in October 2019,7 \n \nRecalling further the participation of a representative of the Government of the \nTerritory in the regional seminar, which in 2019 was held in Grand Anse, Grenada, \nfrom 2 to 4 May, \n \nRecalling the invitation extended by the President of French Polynesia to the \nSpecial Committee to send a visiting mission to the Territory, as reiterated by his \nrepresentative at the 2019 session of the Special Committee, \n \nStressing the importance of regional ties for the development of a small island \nTerritory, \n \nNoting the municipal elections held in March and June 2020, and recalling the \nterritorial elections that were held in April and May 2018, \n \nRecalling its resolutions 74/270 of 2 April 2020, entitled \u201cGlobal solidarity to \nfight the coronavirus disease 2019 (COVID-19)\u201d, 74/274 of 20 April 2020, entitled \n\u201cInternational cooperation to ensure global access to medicines, vaccines and medical \nequipment to face COVID-19\u201d, 74/306 of 11 September 2020, entitled \u201cComprehensive \nand coordinated response to the coronavirus disease (COVID-19) pandemic\u201d, 74/307 \nof 11 September 2020, entitled \u201cUnited response against global health threats: combating \nCOVID-19\u201d, 75/156 of 16 December 2020, entitled \u201cStrengthening national and \ninternational rapid response to the impact of the coronavirus disease (COVID-19) on \nwomen and girls\u201d, and 75/157 of 16 December 2020, entitled \u201cWomen and girls and the \nresponse to the coronavirus disease (COVID-19)\u201d, as well as other relevant resolutions, \n \n1. \nReaffirms the inalienable right of the people of French Polynesia to self-\ndetermination, in conformity with the Charter of the United Nations and with General \nAssembly resolution 1514 (XV), containing the Declaration on the Granting of \nIndependence to Colonial Countries and Peoples; \n \n2. \nAlso reaffirms that it is ultimately for the people of French Polynesia to \ndetermine freely their future political status in accordance with the relevant \nprovisions of the Charter, the Declaration and the relevant resolutions of the General \nAssembly, and in that connection calls upon the administering Power, in cooperation \nwith the territorial Government and appropriate bodies of the United Nations system, \nto develop political education programmes for the Territory in order to foster an \nawareness among the people of French Polynesia of their right to self-determination in \nconformity with the legitimate political status options, based on the principles clearly \ndefined in Assembly resolution 1541 (XV) and other relevant resolutions and decisions; \n \n3. \nTakes note of the statement made by the President of the Territory in the \nSpecial Political and Decolonization Committee (Fourth Committee) on 8 October 2019 \nreaffirming previous calls to delist French Polynesia from the list of Non-Self-\nGoverning Territories, and also takes note of resolution No. 2013-3, adopted by the \nAssembly of French Polynesia on 30 May 2013, which repealed the resolution of the \nAssembly adopted in 2011 requesting the reinscription of French Polynesia on that \nlist; \n \n4. \nReaffirms, in this regard, General Assembly resolution 67/265, which \nprovided for the reinscription of French Polynesia on the list of Non-Self-Governing \n__________________ \n \n7 See A/C.4/74/SR.3, paras. 15\u201318. \n\nA/RES/76/95 \nQuestion of French Polynesia\n \n21-18698\n4/4 \n \nTerritories, and takes careful note of an independent self-governance assessment of \nthe Territory, presented to the Fourth Committee on 4 October 2016, 8  that the \nTerritory did not meet the full measure of self-government; \n \n5. \nCalls upon the administering Power to participate in and cooperate fully \nwith the work of the Special Committee on the Situation with regard to the \nImplementation of the Declaration on the Granting of Independence to Colonial \nCountries and Peoples in order to implement the provisions of Article 73 e of the Charter \nand the Declaration and in order to advise the Special Committee on the implementation \nof the provisions under Article 73 b of the Charter on efforts to promote self-government \nin French Polynesia, and encourages the administering Power to facilitate visiting and \nspecial missions to the Territory; \n \n6. \nAlso calls upon the administering Power to facilitate a visiting mission to \nthe Territory, and requests the Chair of the Special Committee to take all the steps \nnecessary to that end; \n \n7. \nRegrets that the administering Power has not responded to the request to \nsubmit information on French Polynesia under Article 73 e of the Charter since the \nreinscription of the Territory by the General Assembly in 2013; \n \n8. \nReaffirms that an obligation exists on the part of the administering Power \nto transmit information under Chapter XI of the Charter, and requests the \nadministering Power to transmit to the Secretary-General such information on French \nPolynesia as called for under the Charter; \n \n9. \nUrges the administering Power to ensure the permanent sovereignty of the \npeople of French Polynesia over their natural resources, including marine resources \nand undersea minerals, in accordance with the relevant resolutions of the General \nAssembly; \n \n10. Takes note of the efforts made by the administering Power concerning the \nrecognition and compensation of victims of nuclear tests, and in that regard \nencourages the administering Power to take steps to this effect; \n \n11. \nReiterates its request to the Secretary-General to provide continuous \nupdates on the environmental, ecological, health and other impacts of the 30-year \nperiod of nuclear testing in French Polynesia, in follow-up to the report of the \nSecretary-General on the matter, prepared pursuant to paragraph 7 of General \nAssembly resolution 71/120; \n \n12. Calls upon the administering Power to intensify its dialogue with French \nPolynesia in order to facilitate rapid progress towards a fair and effective self-\ndetermination process, under which the terms and timelines for an act of self-\ndetermination would be agreed; \n \n13. Requests the Special Committee to continue to examine the question of the \nNon-Self-Governing Territory of French Polynesia and to report thereon to the \nGeneral Assembly at its seventy-seventh session. \n \n49th plenary meeting \n9 December 2021 \n \n__________________ \n \n8 See A/C.4/71/SR.3, paras. 71\u201372. \n",
  "paragraphs": {
    "1": "Reaffirms the inalienable right of the people of French Polynesia to self- determination, in conformity with the Charter of the United Nations and with General Assembly resolution 1514 (XV), containing the Declaration on the Granting of Independence to Colonial Countries and Peoples;",
    "2": "Also reaffirms that it is ultimately for the people of French Polynesia to determine freely their future political status in accordance with the relevant provisions of the Charter, the Declaration and the relevant resolutions of the General Assembly, and in that connection calls upon the administering Power, in cooperation with the territorial Government and appropriate bodies of the United Nations system, to develop political education programmes for the Territory in order to foster an awareness among the people of French Polynesia of their right to self-determination in conformity with the legitimate political status options, based on the principles clearly defined in Assembly resolution 1541 (XV) and other relevant resolutions and decisions;",
    "3": "Takes note of the statement made by the President of the Territory in the Special Political and Decolonization Committee (Fourth Committee) on 8 October 2019 reaffirming previous calls to delist French Polynesia from the list of Non-Self- Governing Territories, and also takes note of resolution No. 2013-3, adopted by the Assembly of French Polynesia on 30 May 2013, which repealed the resolution of the Assembly adopted in 2011 requesting the reinscription of French Polynesia on that list;",
    "4": "Reaffirms, in this regard, General Assembly resolution 67/265, which provided for the reinscription of French Polynesia on the list of Non-Self-Governing Territories, and takes careful note of an independent self-governance assessment of the Territory, presented to the Fourth Committee on 4 October 2016, 8 that the Territory did not meet the full measure of self-government;",
    "5": "Calls upon the administering Power to participate in and cooperate fully with the work of the Special Committee on the Situation with regard to the Implementation of the Declaration on the Granting of Independence to Colonial Countries and Peoples in order to implement the provisions of Article 73 e of the Charter and the Declaration and in order to advise the Special Committee on the implementation of the provisions under Article 73 b of the Charter on efforts to promote self-government in French Polynesia, and encourages the administering Power to facilitate visiting and special missions to the Territory;",
    "6": "Also calls upon the administering Power to facilitate a visiting mission to the Territory, and requests the Chair of the Special Committee to take all the steps necessary to that end;",
    "7": "Regrets that the administering Power has not responded to the request to submit information on French Polynesia under Article 73 e of the Charter since the reinscription of the Territory by the General Assembly in 2013;",
    "8": "Reaffirms that an obligation exists on the part of the administering Power to transmit information under Chapter XI of the Charter, and requests the administering Power to transmit to the Secretary-General such information on French Polynesia as called for under the Charter;",
    "9": "Urges the administering Power to ensure the permanent sovereignty of the people of French Polynesia over their natural resources, including marine resources and undersea minerals, in accordance with the relevant resolutions of the General Assembly;",
    "10": "Takes note of the efforts made by the administering Power concerning the recognition and compensation of victims of nuclear tests, and in that regard encourages the administering Power to take steps to this effect;",
    "11": "Reiterates its request to the Secretary-General to provide continuous updates on the environmental, ecological, health and other impacts of the 30-year period of nuclear testing in French Polynesia, in follow-up to the report of the Secretary-General on the matter, prepared pursuant to paragraph 7 of General Assembly resolution 71/120;",
    "12": "Calls upon the administering Power to intensify its dialogue with French Polynesia in order to facilitate rapid progress towards a fair and effective self- determination process, under which the terms and timelines for an act of self- determination would be agreed;",
    "13": "Requests the Special Committee to continue to examine the question of the Non-Self-Governing Territory of French Polynesia and to report thereon to the General Assembly at its seventy-seventh session."
  },
  "agenda_items": [
    "Item 63"
  ],
  "symbol_references": []
}