{
  "symbol": "A/RES/80/53",
  "filename": "A_RES_80_53.pdf",
  "title": "80/53. Establishment of the Group of Scientific and Technical Experts on Nuclear Disarmament Verification",
  "text": "United Nations \nA/RES/80/53\n \nGeneral Assembly \nDistr.: General \n5 December 2025 \n25-19996 (E) \n*2519996* \n \n \nEightieth session \nAgenda item 99 (gg) \nGeneral and complete disarmament: \nnuclear disarmament verification \n \n \n \n \n Resolution adopted by the General Assembly \non 1 December 2025 \n \n \n[on the report of the First Committee (A/80/534, para. 7)] \n \n \n \n80/53. Establishment of the Group of Scientific and Technical Experts on \nNuclear Disarmament Verification \n \n \n \nThe General Assembly, \n \nRecalling the Final Document of the Tenth Special Session of the General \nAssembly, the first special session of the General Assembly devoted to disarmament, \nin particular the paragraphs relevant to nuclear disarmament and to verification, 1 \n \nRecalling also its resolution 62/21 of 5 December 2007, in which it took note of \nthe report of the Panel of Governmental Experts on verification in all its aspects, \nincluding the role of the United Nations in the field of verification, 2 as well as the \nreports of the Secretary-General of 1990 3  and 1995, 4  and the report of the \nDisarmament Commission outlining general principles of verification elaborated \nupon or added to those stated in the Final Document of the Tenth Special Session of \nthe General Assembly,5 \n \nRecalling further its resolution 71/67 of 5 December 2016, in which it, inter alia, \nrequested the Secretary-General to seek the views of Member States and to establish \na group of governmental experts to consider the role of verification in advancing \nnuclear disarmament, and its resolution 74/50 of 12 December 2019, in which it, inter \nalia, requested the Secretary-General to seek the views of Member States and to \nestablish a group of governmental experts to further consider nuclear disarmament \nverification issues, including, inter alia, the concept of a Group of Scientific and \n_______________ \n \n1 Resolution S-10/2, paras. 30, 31, 50, 91 and 92. \n \n2 A/61/1028. \n \n3 A/45/372 and A/45/372/Corr.1. \n \n4 A/50/377 and A/50/377/Corr.1. \n \n5 A/51/182/Rev.1. \n\nA/RES/80/53 \nEstablishment of the Group of Scientific and Technical Experts on \nNuclear Disarmament Verification\n \n25-19996\n2/5 \n \nTechnical Experts on Nuclear Disarmament Verification, as well as the reports of the \naforementioned groups of governmental experts,6 \n \nRecalling its resolution 78/239 of 22 December 2023, in which it welcomed the \nreport of the Group of Governmental Experts to further consider nuclear disarmament \nverification issues,7 and, inter alia, requested the Secretary-General to seek the views \nof Member States and encouraged Member States to continue work on nuclear \ndisarmament verification issues, \n \nRecalling also the report of the Secretary-General containing the substantive \nviews of Member States on the report of the Group of Governmental Experts to further \nconsider nuclear disarmament verification issues,8 \n \nWelcoming the report of the Secretary-General submitted pursuant to resolution \n79/240 of 24 December 2024, containing possible options for the establishment of a \nGroup of Scientific and Technical Experts on Nuclear Disarmament Verification \nwithin the United Nations,9 which took into account the views submitted by Member \nStates in writing and through three informal in-person meetings, \n \nRecalling its resolution 78/22 of 4 December 2023, in which it, inter alia, invited \nMember States to continue efforts to apply developments in science and technology \nfor disarmament-related purposes, including the verification of disarmament, arms \ncontrol and non\u2011proliferation instruments, and to make disarmament-related \ntechnologies available to interested States, \n \nReaffirming the shared commitment to further progress in nuclear disarmament \nand non\u2011proliferation, and that all States Members of the United Nations should be \nenabled to actively engage on an equal footing to this end, \n \nRecognizing that measures in the field of disarmament should be undertaken as \na matter of urgency with a view to halting and reversing the arms race and to give the \nnecessary impetus to efforts designed to achieve genuine disarmament leading to \ngeneral and complete disarmament under effective international control, \n \nRecalling the unequivocal undertaking of nuclear-weapon States to accomplish \nthe total elimination of their nuclear arsenals leading to nuclear disarmament, to \nwhich all States Parties to the Treaty on the Non-Proliferation of Nuclear Weapons10 \nare committed under article VI thereof,11 \n \nRecalling also that all States Parties to the Treaty on the Non-Proliferation of \nNuclear Weapons have committed to the principles of irreversibility, verifiability and \ntransparency in relation to the implementation of their treaty obligations, 12 \n \nReaffirming that, since the process of disarmament affects the vital security \ninterests of all States, they must all be actively concerned with and supportive of the \nmeasures of disarmament and arms limitation, which have an essential part to play in \nmaintaining and strengthening international security, \n \nRecognizing that the decisive factor for achieving real measures of disarmament \nis the political will of States, especially the nuclear-weapon States, \n_______________ \n \n6 A/74/90 and A/78/120. \n \n7 A/78/120. \n \n8 A/79/93. \n \n9 A/80/93. \n \n10 United Nations, Treaty Series, vol. 729, No. 10485. \n \n11 2010 Review Conference of the Parties to the Treaty on the Non-Proliferation of Nuclear \nWeapons, Final Document, vol. I (NPT/CONF.2010/50 (Vol. I)), part I, Conclusions and \nrecommendations for follow-on actions, para. 79. \n \n12 Ibid., action 2 of the action plan. \n\nEstablishment of the Group of Scientific and Technical Experts on \nNuclear Disarmament Verification \nA/RES/80/53\n \n3/5\n25-19996 \n \n \nRecognizing also that credible multilateral nuclear disarmament verification \ncapabilities will be instrumental to providing assurance of compliance with nuclear \ndisarmament agreements for the achievement and maintenance of a world without \nnuclear weapons, \n \nUnderlining that work on nuclear disarmament verification is not an end in itself \nand is not a prerequisite, precondition or substitute for progress in nuclear \ndisarmament, and that such work should aim to promote and facilitate progress in \nnuclear disarmament, \n \nRecognizing that, while the form and modalities of the verification to be \nprovided for in any specific agreement entered into by contracting parties depend \nupon and should be determined by the purposes, scope and nature of the agreement, \ncollaborative multilateral work on tools, technologies, methodologies and procedures \nthat could further contribute to nuclear disarmament verification can provide benefits \nin support of the long-term goal of nuclear disarmament, \n \nConvinced that identifying and developing practical and effective measures of \nnuclear disarmament verification can foster confidence among Member States in this \nkey area for peace and security, \n \nConvinced also of the particular relevance of enabling States, on a voluntary \nbasis, to participate in nuclear disarmament verification discussions, \n \nRecognizing that work on nuclear disarmament verification must conform to \napplicable international legal nuclear disarmament and non\u2011proliferation obligations, \nnational safety and security requirements and the need to protect otherwise sensitive \ninformation, \n \nMindful of the role of verification in existing bilateral and multilateral \ndisarmament, non\u2011proliferation and arms control agreements, and of the need to avoid \nany possible duplication of efforts so that any further work on nuclear disarmament \nverification builds on the existing accumulated scientific and technical knowledge \nand capabilities, especially in the area of nuclear verification and safeguards, keeping \nin mind their competence and mandate, \n \nAware that a considerable amount of knowledge and positive contributions on \nnuclear disarmament verification has already been assembled by past and ongoing \ninitiatives and partnerships among Member States, and stressing the importance of \nincorporating, as appropriate, their experiences, knowledge and lessons learned in \nfuture multilateral discussions on the topic in the context of the United Nations, \n \nNoting the fundamental importance of disarmament education and capacity-\nbuilding to address nuclear disarmament verification challenges and related issues, \n \nUnderlining that equal opportunities for equitable geographical representation \nand participation should be provided for in nuclear disarmament verification \neducation, training and capacity-building, taking into account the special needs of \ninterested developing countries, upon their request, to participate in the relevant \nefforts, \n \nNoting the contribution of civil society and academic and research communities \nto nuclear disarmament verification, \n \nUnderlining that equal opportunities for women and men should be provided for \nin nuclear disarmament verification education, training and capacity-building, \n \n1. \nDecides to establish the Group of Scientific and Technical Experts on \nNuclear Disarmament Verification within the United Nations, consisting of 21 members, \n\nA/RES/80/53 \nEstablishment of the Group of Scientific and Technical Experts on \nNuclear Disarmament Verification\n \n25-19996\n4/5 \n \nparticipating in their personal capacity and without prejudice to national positions in \nfuture negotiations; \n \n2. \nRequests the Secretary-General to select the experts through a wide call \nfor nominations from Member States, on the basis of their outstanding technical \nexpertise and on as wide a geographical basis as possible and giving due regard to \ngender balance; \n \n3. \nDecides that the Group of Scientific and Technical Experts will hold four \n2-week sessions in Geneva and Vienna, from January 2027 to September 2029; \n \n4. \nAlso decides that the Group of Scientific and Technical Experts should \nseek to achieve consensus in its report, and that, whenever consensus cannot be \nachieved, each expert will be entitled to incorporate his or her own view; \n \n5. \nRequests the Group of Scientific and Technical Experts to take the actions \nrequired to accomplish the following objectives: \n \n(a) \nIdentify and consider technical challenges in and possible approaches to \nnuclear disarmament verification in terms of tools, techniques, processes and \nprocedures; \n \n(b) \nAppraise knowledge on nuclear disarmament verification derived from \npast and ongoing initiatives on nuclear disarmament verification or related areas; \n \n(c) \nEnable States to participate in technical discussions on nuclear \ndisarmament verification on a voluntary basis; \n \n(d) \nIncorporate and preserve knowledge on nuclear disarmament verification \nwithin the United Nations system and provide assurances to the international \ncommunity that States are focused on this matter; \n \n6. \nAlso requests the Group of Scientific and Technical Experts, upon its first \nmeeting, to approve its programme of work, taking into account the following \nindicative areas: \n \n(a) \nDeclarations, including initial and progress declarations; \n \n(b) \nRemoval of deployed nuclear warheads; \n \n(c) \nDismantlement and storage of warhead components; \n \n(d) \nConversion of nuclear material with classified characteristics; \n \n(e) \nElimination or irreversible conversion of all nuclear-weapon-related \nfacilities; \n \n(f) \nPlacement of nuclear material and facilities under international \nsafeguards; \n \n(g) \nVerification of the correctness and completeness of the baseline \ndeclarations of nuclear material once the State concerned declares that it no longer \npossesses nuclear weapons or nuclear explosive devices; \n \n(h) \nMeans of delivery of nuclear weapons; \n \n7. \nRequests the Secretary-General to provide, through the Office for \nDisarmament Affairs of the Secretariat, all necessary assistance to the Group of \nScientific and Technical Experts, including the provision of relevant documents; \n \n8. \nInvites the United Nations Institute for Disarmament Research to provide \ntechnical assistance to the Group of Scientific and Technical Experts; \n\nEstablishment of the Group of Scientific and Technical Experts on \nNuclear Disarmament Verification \nA/RES/80/53\n \n5/5\n25-19996 \n \n \n9. \nRequests the High Representative for Disarmament Affairs to provide a \nbriefing to the General Assembly at its eighty-first session on the implementation of \nthe present resolution; \n \n10. Requests the Group of Scientific and Technical Experts to report on its \nwork to the General Assembly at its eighty-fourth session, with a view to making a \npossible decision on the extension of the activities of the Group; \n \n11. \nRequests the Secretary-General to bring the report of the Group of \nScientific and Technical Experts to the attention of all Member States, as well as to \nthe First Committee of the General Assembly, the Disarmament Commission, the \nConference on Disarmament and other relevant organizations, and specifically invites \nthe Conference on Disarmament, as the single multilateral disarmament negotiating \nforum of the international community, to reflect on the report as appropriate; \n \n12. Decides to include in the provisional agenda of its eighty-first session an \nitem entitled \u201cGroup of Scientific and Technical Experts on Nuclear Disarmament \nVerification\u201d. \n \n52nd plenary meeting \n1 December 2025 \n \n",
  "paragraphs": {
    "1": " participating in their personal capacity and without prejudice to national positions in future negotiations;",
    "2": "Requests the Secretary-General to select the experts through a wide call for nominations from Member States, on the basis of their outstanding technical expertise and on as wide a geographical basis as possible and giving due regard to gender balance;",
    "3": "Decides that the Group of Scientific and Technical Experts will hold four 2-week sessions in Geneva and Vienna, from January 2027 to September 2029;",
    "4": "Also decides that the Group of Scientific and Technical Experts should seek to achieve consensus in its report, and that, whenever consensus cannot be achieved, each expert will be entitled to incorporate his or her own view;",
    "5": "Requests the Group of Scientific and Technical Experts to take the actions required to accomplish the following objectives: (a) Identify and consider technical challenges in and possible approaches to nuclear disarmament verification in terms of tools, techniques, processes and procedures; (b) Appraise knowledge on nuclear disarmament verification derived from past and ongoing initiatives on nuclear disarmament verification or related areas; (c) Enable States to participate in technical discussions on nuclear disarmament verification on a voluntary basis; (d) Incorporate and preserve knowledge on nuclear disarmament verification within the United Nations system and provide assurances to the international community that States are focused on this matter;",
    "6": "Also requests the Group of Scientific and Technical Experts, upon its first meeting, to approve its programme of work, taking into account the following indicative areas: (a) Declarations, including initial and progress declarations; (b) Removal of deployed nuclear warheads; (c) Dismantlement and storage of warhead components; (d) Conversion of nuclear material with classified characteristics; (e) Elimination or irreversible conversion of all nuclear-weapon-related facilities; (f) Placement of nuclear material and facilities under international safeguards; (g) Verification of the correctness and completeness of the baseline declarations of nuclear material once the State concerned declares that it no longer possesses nuclear weapons or nuclear explosive devices; (h) Means of delivery of nuclear weapons;",
    "7": "Requests the Secretary-General to provide, through the Office for Disarmament Affairs of the Secretariat, all necessary assistance to the Group of Scientific and Technical Experts, including the provision of relevant documents;",
    "8": "",
    "9": "Requests the High Representative for Disarmament Affairs to provide a briefing to the General Assembly at its eighty-first session on the implementation of the present resolution;",
    "10": "Requests the Group of Scientific and Technical Experts to report on its work to the General Assembly at its eighty-fourth session, with a view to making a possible decision on the extension of the activities of the Group;",
    "11": "Requests the Secretary-General to bring the report of the Group of Scientific and Technical Experts to the attention of all Member States, as well as to the First Committee of the General Assembly, the Disarmament Commission, the Conference on Disarmament and other relevant organizations, and specifically invites the Conference on Disarmament, as the single multilateral disarmament negotiating forum of the international community, to reflect on the report as appropriate;",
    "12": "Decides to include in the provisional agenda of its eighty-first session an item entitled \u201cGroup of Scientific and Technical Experts on Nuclear Disarmament Verification\u201d."
  },
  "agenda_items": [
    "Item 99"
  ],
  "symbol_references": []
}