{
  "symbol": "A/RES/78/167",
  "filename": "A_RES_78_167.pdf",
  "title": "78/167. South-South cooperation",
  "text": "United Nations \nA/RES/78/167\n \n \nGeneral Assembly \nDistr.: General \n21 December 2023 \n \n23-25878 (E)    030124 \n*2325878* \n \n \nSeventy-eighth session \nAgenda item 22 (b) \nOperational activities for development: South-South \ncooperation for development \n \n \n \n \n Resolution adopted by the General Assembly \non 19 December 2023 \n \n \n \n \n[on the report of the Second Committee (A/78/465/Add.2, para. 7)] \n \n \n 78/167. South-South cooperation \n \n \n \nThe General Assembly, \n \nReaffirming its resolution 73/291 of 15 April 2019, in which it endorsed the \nBuenos Aires outcome document of the second High-level United Nations Conference \non South-South Cooperation,  \n \nReaffirming also its resolution 64/222 of 21 December 2009, in which it \nendorsed the Nairobi outcome document of the High-level United Nations Conference \non South-South Cooperation,  \n \nReaffirming further its resolution 33/134 of 19 December 1978, in which it \nendorsed the Buenos Aires Plan of Action for Promoting and Implementing Technical \nCooperation among Developing Countries,1  \n \nRecalling its resolutions 57/270 B of 23 June 2003, 60/212 of 22 December \n2005, 62/209 of 19 December 2007, 63/233 of 19 December 2008, 64/1 of 6 October \n2009, 66/219 of 22 December 2011, 67/227 of 21 December 2012, 68/230 of \n20 December 2013, 69/239 of 19 December 2014, 70/222 of 22 December 2015, \n71/244 of 21 December 2016, 72/237 of 20 December 2017, 73/249 of 20 December \n2018, 74/239 of 19 December 2019, 75/234 of 21 December 2020, 76/221 of \n17 December 2021 and 77/185 of 14 December 2022,  \n \nReaffirming its resolution 70/1 of 25 September 2015, entitled \u201cTransforming \nour world: the 2030 Agenda for Sustainable Development\u201d, in which it adopted a \ncomprehensive, far-reaching and people-centred set of universal and transformative \nSustainable Development Goals and targets, its commitment to working tirelessly for \nthe full implementation of the Agenda by 2030, its recognition that eradicating \npoverty in all its forms and dimensions, including extreme poverty, is the greatest \n__________________ \n \n1 Report of the United Nations Conference on Technical Cooperation among Developing \nCountries, Buenos Aires, 30 August\u201312 September 1978 (United Nations publication, Sales \nNo. E.78.II.A.11 and corrigendum), chap. I. \n\nA/RES/78/167 \nSouth-South cooperation\n \n23-25878\n2/6 \n \nglobal challenge and an indispensable requirement for sustainable development, its \ncommitment to achieving sustainable development in its three dimensions \u2013 \neconomic, social and environmental \u2013 in a balanced and integrated manner, and to \nbuilding upon the achievements of the Millennium Development Goals and seeking \nto address their unfinished business,  \n \nReaffirming also its resolution 69/313 of 27 July 2015 on the Addis Ababa \nAction Agenda of the Third International Conference on Financing for Development, \nwhich is an integral part of the 2030 Agenda for Sustainable Development, supports \nand complements it, helps to contextualize its means of implementation targets with \nconcrete policies and actions and reaffirms the strong political commitment to address \nthe challenge of financing and creating an enabling environment at all levels for \nsustainable development in the spirit of global partnership and solidarity,  \n \nReaffirming further the Paris Agreement2 and its early entry into force, \nencouraging all its parties to fully implement the Agreement, and parties to the United \nNations Framework Convention on Climate Change3 that have not yet done so to \ndeposit their instruments of ratification, acceptance, approval or accession, where \nappropriate, as soon as possible, \n \nReaffirming that South-South cooperation is an important element of \ninternational cooperation for development, and is not a substitute for, but rather a \ncomplement to, North-South cooperation, and commending the contributions of all \nstakeholders of South-South and triangular cooperation, based on unity, solidarity and \nrenewed multilateral cooperation to support developing countries in the coronavirus \ndisease (COVID-19) pandemic response and recovery, in line with national \ndevelopment priorities and the principles of South-South cooperation as outlined in \nresolution 73/291,  \n \nNoting with great concern the severe negative impact on human health, safety \nand well-being caused by the coronavirus disease (COVID-19) pandemic, as well as \nthe severe disruption to societies and economies and the devastating impact on lives \nand livelihoods, and that the poorest and most vulnerable are the hardest hit by the \npandemic, reaffirming the ambition to get back on track to achieve the Sustainable \nDevelopment Goals by designing and implementing sustainable and inclusive recovery \nstrategies to accelerate progress towards the full implementation of the 2030 Agenda \nfor Sustainable Development and to help to reduce the risk of and build resilience to \nfuture shocks, crises and pandemics, including by strengthening health systems and \nachieving universal health coverage, and recognizing that equitable and timely access \nfor all to safe, quality, effective and affordable COVID-19 vaccines, therapeutics and \ndiagnostics are an essential part of a global response based on unity, solidarity, \nrenewed multilateral cooperation and the principle of leaving no one behind,  \n \nEncouraging the continuation and advancement of South-South and triangular \ncooperation on efforts for COVID-19 response and recovery from the socioeconomic \neffects of the pandemic and other multiple crises in the pursuit of the 2030 Agenda \nand its Sustainable Development Goals, and calling for continued support from the \nrelevant United Nations development system entities in that regard, particularly in the \nareas of poverty eradication and food security, as well as reducing inequalities, and \npromoting resilience, including through the establishment of vaccine production \nfacilities in developing countries and strengthening of health systems and economic \ndiversification in developing countries,  \n__________________ \n \n2 Adopted under the United Nations Framework Convention on Climate Change in \nFCCC/CP/2015/10/Add.1, decision 1/CP.21, annex. \n \n3 United Nations, Treaty Series, vol. 1771, No. 30822.  \n\nSouth-South cooperation \nA/RES/78/167\n \n3/6\n23-25878 \n \n \nRecognizing that an unprecedented level of regional and global solidarity is \nrequired to overcome the multiple impacts of the pandemic on developing countries, \nin particular least developed countries, landlocked developing countries and small \nisland developing States and taking into account the specific challenges facing \nmiddle-income countries, and to prepare for and prevent future health emergencies,  \n \nRecognizing also that climate change, the COVID-19 pandemic and ongoing \ngeopolitical tensions and conflicts and their respective negative impacts are creating \nadditional challenges relating to the eradication of poverty, food security, energy \nsecurity and the cost of living, and that developing countries are disproportionately \naffected by these challenges,  \n \nWelcoming the convening of the fifteenth session of the United Nations \nConference on Trade and Development, and taking note of the adoption of its outcome \ndocument, the Bridgetown Covenant,4 and looking forward to the continued work of the \nConference on issues related to South-South cooperation, triangular cooperation and \nregional cooperation, including by promoting dialogue between economic integration \nstructures with a view to enhancing mutual trade and exchanging best practices and \nexperiences, towards the achievement of the Sustainable Development Goals,  \n \nWelcoming also the ongoing efforts to enhance South-South and triangular \ncooperation in the area of trade under the Global System of Trade Preferences among \nDeveloping Countries as a vehicle to support economic resilience and promote \nsustainable development, and looking forward to the continued work of the United \nNations Conference on Trade and Development to support this endeavour,  \n \nWelcoming further the development of an initial voluntary conceptual framework \nfor the measurement of South-South cooperation, which marks a breakthrough in its \nmeasurement on the basis of country-led mechanisms and helps shed light on the \nimportance of South-South cooperation towards achieving the 2030 Agenda,  \n \nRecalling that triangular cooperation complements and adds value to South-South \ncooperation by enabling requesting developing countries to source and access more, and \na broader range of, resources, expertise and capacities, that they identify as needed in \norder to achieve their national development goals and internationally agreed sustainable \ndevelopment goals,  \n \nReaffirming the mandate and the central role of the United Nations Office for \nSouth-South Cooperation as the focal point for promoting and facilitating South-South \nand triangular cooperation for development on a global and United Nations system-wide \nbasis, and noting with appreciation the actions taken by the Office in strengthening the \nUnited Nations system-wide coordination on South-South and triangular cooperation \nthrough the convening of the United Nations Inter-Agency Mechanism for South-South \nand Triangular Cooperation, which has served as a channel to facilitate the \nmainstreaming of South-South and triangular cooperation into the corporate strategies \nand operational activities of United Nations entities, as well as noting the development \nof a handbook on integrating South-South and triangular cooperation in the voluntary \nnational reviews in collaboration with the Co-Chairs of the Group of Friends of the \nVoluntary National Reviews, Morocco and the Philippines,  \n \nReiterating the pledge that no one will be left behind, reaffirming the \nrecognition that the dignity of the human person is fundamental, and the wish to see \nthe Goals and targets met for all nations and peoples and for all segments of society, \nand recommitting to endeavour to reach the furthest behind first,  \n \n1. \nRecalls the convening of the second High-level United Nations Conference \non South-South Cooperation in Buenos Aires from 20 to 22 March 2019 and its outcome \n__________________ \n \n4 TD/541/Add.2. \n\nA/RES/78/167 \nSouth-South cooperation\n \n23-25878\n4/6 \n \ndocument,5 and calls upon the international community to support the full implementation \nof the outcome document of the second High-level Conference;  \n \n2. \nTakes note of the report of the Secretary-General on the state of South-\nSouth cooperation;6  \n \n3. \nReaffirms its support for the High-level Committee on South-South \nCooperation, recalls its decisions 21/1 and 21/2 adopted during its twenty-first session, \nheld from 30 May to 2 June 2023, and calls for the full implementation of the outcome \ndocument of the second High-level United Nations Conference on South-South \nCooperation;  \n \n4. \nEncourages the continuation and advancement of South-South cooperation \nand triangular cooperation on efforts for COVID-19 response and recovery from the \nsocioeconomic effects of the pandemic and other multiple crises in the pursuit of the \n2030 Agenda for Sustainable Development7 and its Sustainable Development Goals, \nand calls for continued support from the relevant United Nations development system \nentities in that regard, particularly in areas such as equitable and non-discriminatory \naccess to safe, quality, effective and affordable health care and services and medical \nsupplies and equipment, including diagnostics, therapeutics, medicine and vaccines, \nas well as digitalization, the environment, climate change, social protection and the \neradication of poverty;  \n \n5. \nWelcomes the support of development partners for triangular cooperation \ntowards the achievement of the Sustainable Development Goals in the global South, \nand urges developed countries to continue providing financial, scientific and \ntechnological assistance to developing countries, to close the digital divides and to \nbetter harness science, technology and innovation to accelerate the achievement of \nthe Sustainable Development Goals by 2030;  \n \n6. \nUrges Member States and United Nations entities to strengthen South-\nSouth and triangular cooperation on access to science, technology and innovation by \ncreating synergies, developing expertise and boosting resources in different regions \nand institutions, and in this regard notes with appreciation the convening of the \nSummit on Science, Technology and Innovation by the Group of 77 and China, in \nHavana on 15 and 16 September 2023, as an effort to boost cooperation in this field \nto increase its benefit to all people;  \n \n7. \nEncourages Member States and all relevant stakeholders, as appropriate, \nto establish or strengthen coordinated mechanisms at the subnational, national, \nregional and global levels to leverage the expertise and other resources of \nmulti-stakeholder partnerships to support South-South cooperation and triangular \ncooperation initiatives towards the attainment of the 2030 Agenda for Sustainable \nDevelopment, while acknowledging that governments have the principal role of \ncoordinating and leading development efforts;  \n \n8. \nWelcomes the convening of the ministerial meeting on South-South \ncooperation held in 2023 during the second part of the Fifth United Nations \nConference on the Least Developed Countries, in Doha, on leveraging South-South \nand triangular cooperation for the attainment of the Sustainable Development Goals;  \n \n9. \nTakes note of the various experiences and locally driven development \napproaches to achieve the Sustainable Development Goals, and reiterates the \nimportance of learning and sharing good practices, including through South-South, \nNorth-South and triangular cooperation through platforms such as South-South \n__________________ \n \n5  Resolution 73/291, annex. \n \n6  A/78/290. \n \n7 Resolution 70/1. \n\nSouth-South cooperation \nA/RES/78/167\n \n5/6\n23-25878 \n \nGalaxy, the Global South-South Development Expo, regional sustainable development \nforums and other knowledge-sharing platforms supported by the different entities of \nthe United Nations system;  \n \n10. Welcomes the organization of the eleventh Global South-South \nDevelopment Expo in Bangkok from 12 to 14 September 2022, under the theme \n\u201cAdvancing South-South and triangular cooperation for sustainable COVID-19 \nrecovery: towards a smart and resilient future\u201d;  \n \n11. Looks forward to the Third South Summit, to be held in Kampala from \n21 to 23 January 2024;  \n \n12. Also looks forward to the convening of the fourth International Conference \non Small Island Developing States, in Antigua and Barbuda from 27 to 30 May 2024, \nand the third United Nations Conference on Landlocked Developing Countries, in \nRwanda from 18 to 21 June 2024, both of which will, inter alia, provide the \nopportunity to the international community to scale its support to small island \ndeveloping States and landlocked developing countries in their efforts to leverage \nSouth-South and triangular cooperation to achieve sustainable development;  \n \n13. Takes note of the recommendations of the Secretary-General, including \nscaling up contributions to the United Nations trust fund for South-South cooperation \nand other relevant financing mechanisms to enable the United Nations development \nsystem to advance South-South and triangular cooperation initiatives championed by \ndeveloping countries, with sufficient resources;  \n \n14. Recognizes the growing debt burden of developing countries, and also \nrecognizes the role of the United Nations, within its mandates, to facilitate South-\nSouth exchanges of knowledge on debt to help countries of the South;  \n \n15. Also recognizes the need to enhance the provision and mobilization of \nadequate resources for enhancing South-South and triangular cooperation, and in this \ncontext invites all countries in a position to do so, in particular developed countries, \nto scale up the contributions, in support of such cooperation, to the United Nations \nFund for South-South Cooperation and to the P\u00e9rez-Guerrero Trust Fund for South-\nSouth Cooperation, in accordance with General Assembly resolution 57/263 of \n20 December 2002, and to support other initiatives for all developing countries;  \n \n16. Highlights that 20 December 2023 will mark the fortieth anniversary of \nthe P\u00e9rez-Guerrero Trust Fund for South-South Cooperation, and acknowledges the \nTrust Fund\u2019s effectiveness in providing catalytic support to South-South cooperation, \nunderscoring the enduring partnership between the Group of 77 and the United \nNations Office for South-South Cooperation;  \n \n17. Encourages United Nations entities to support developing countries in \nintegrating development cooperation perspectives, including, in particular, South-\nSouth and triangular cooperation perspectives, into the preparation and presentation \nof the voluntary national review reports on sustainable development;  \n \n18. Notes that, within the context of the broader reforms of the United Nations \ndevelopment system, the United Nations system-wide strategy on South-South and \ntriangular cooperation has the potential to enhance the role and impact of South-South \nand triangular cooperation through galvanizing the expertise of United Nations \norganizations to support South-South and triangular cooperation, and in this regard \ncalls upon the United Nations development system, including United Nations entities, \nto continue mainstreaming South-South and triangular cooperation into the United \nNations Sustainable Development Cooperation Frameworks, at the country level, as \nappropriate, as a means to accelerate the implementation of the 2030 Agenda for \nSustainable Development and its Sustainable Development Goals, commends the \n\nA/RES/78/167 \nSouth-South cooperation\n \n23-25878\n6/6 \n \nefforts of the different entities of the United Nations system and the regional \ncommissions to promote South-South and triangular cooperation, takes note with \nappreciation of the work done by the United Nations Office for South-South \nCooperation, through inclusive mechanisms, in particular South-South cooperation \ninitiatives established by developing countries, and calls upon it to work in \ncollaboration with the United Nations system organizations and the regional \ncommissions to mainstream South-South and triangular cooperation, including \nthrough regional collaborative frameworks for South-South and triangular cooperation;  \n \n19. \nCalls upon the United Nations development system entities to further \nintegrate, as appropriate, South-South and triangular cooperation into their strategic \nframeworks and planning instruments, and urges them to allocate sufficient financial \nresources dedicated to supporting and facilitating South-South and triangular cooperation;  \n \n20. Requests the United Nations Conference on Trade and Development, in its \nrole as a custodian, to strengthen capacity-building on the initial voluntary conceptual \nframework for the measurement of South-South cooperation based on country-led \nmechanisms, recommends that the United Nations development system support the \nefforts of the United Nations Conference on Trade and Development in raising \nawareness and developing the capacity of national statistical offices and cooperation \nagencies to use this framework, and acknowledges the importance of exploring \npossible options for the measurement of triangular cooperation; \n \n21. Recognizes the contribution of and the need to scale up and strengthen \nSouth-South and triangular cooperation as a complementary means of implementation \nof the 2030 Agenda and its Sustainable Development Goals, including in achieving \nthe overarching goal of the eradication of poverty in all its forms and dimensions and \nthe goals of, inter alia, ending hunger, reducing inequalities, within and among \ncountries, as well as for the use, capacity-building and transfer of digital technologies, \non mutually agreed terms, to accelerate the attainment of the Sustainable \nDevelopment Goals and close the digital divides;  \n \n22. Also recognizes the contribution of South-South and triangular \ncooperation in promoting gender equality and the empowerment of women and girls \nin sustainable development, as well as in achieving the overarching goal of the \neradication of poverty in all its forms and dimensions;  \n \n23. Further recognizes the role of South-South and triangular cooperation in \nenhancing connectivity and digital transformation within and among developing \ncountries, and in this regard invites the United Nations Office for South-South \nCooperation and the United Nations system, in line with their respective mandates, to \nsupport efforts to develop and implement policies to bridge the digital divides and \nfast-track digital transformation to improve the delivery of public services in the South;  \n \n24. Reaffirms the commitment at the very heart of the 2030 Agenda to leave no \none behind and commit to taking more tangible steps to support people in vulnerable \nsituations and the most vulnerable countries and to reach the furthest behind first;  \n \n25. Requests the Secretary-General to submit to the General Assembly at its \nseventy-ninth session a comprehensive report on the state of South-South \ncooperation, including the implementation of the outcome document of the second \nHigh-level Conference;  \n \n26. Decides to include in the provisional agenda of its seventy-ninth session, \nunder the item entitled \u201cOperational activities for development\u201d, the sub-item entitled \n\u201cSouth-South cooperation for development\u201d. \n \n49th plenary meeting \n19 December 2023 \n",
  "paragraphs": {
    "1": "Recalls the convening of the second High-level United Nations Conference on South-South Cooperation in Buenos Aires from 20 to 22 March 2019 and its outcome document,5 and calls upon the international community to support the full implementation of the outcome document of the second High-level Conference;",
    "2": "Takes note of the report of the Secretary-General on the state of South- South cooperation;6",
    "3": "Reaffirms its support for the High-level Committee on South-South Cooperation, recalls its decisions 21/1 and 21/2 adopted during its twenty-first session, held from 30 May to 2 June 2023, and calls for the full implementation of the outcome document of the second High-level United Nations Conference on South-South Cooperation;",
    "4": "Encourages the continuation and advancement of South-South cooperation and triangular cooperation on efforts for COVID-19 response and recovery from the socioeconomic effects of the pandemic and other multiple crises in the pursuit of the 2030 Agenda for Sustainable Development7 and its Sustainable Development Goals, and calls for continued support from the relevant United Nations development system entities in that regard, particularly in areas such as equitable and non-discriminatory access to safe, quality, effective and affordable health care and services and medical supplies and equipment, including diagnostics, therapeutics, medicine and vaccines, as well as digitalization, the environment, climate change, social protection and the eradication of poverty;",
    "5": "Welcomes the support of development partners for triangular cooperation towards the achievement of the Sustainable Development Goals in the global South, and urges developed countries to continue providing financial, scientific and technological assistance to developing countries, to close the digital divides and to better harness science, technology and innovation to accelerate the achievement of the Sustainable Development Goals by 2030;",
    "6": "Urges Member States and United Nations entities to strengthen South- South and triangular cooperation on access to science, technology and innovation by creating synergies, developing expertise and boosting resources in different regions and institutions, and in this regard notes with appreciation the convening of the Summit on Science, Technology and Innovation by the Group of 77 and China, in Havana on 15 and 16 September 2023, as an effort to boost cooperation in this field to increase its benefit to all people;",
    "7": "Encourages Member States and all relevant stakeholders, as appropriate, to establish or strengthen coordinated mechanisms at the subnational, national, regional and global levels to leverage the expertise and other resources of multi-stakeholder partnerships to support South-South cooperation and triangular cooperation initiatives towards the attainment of the 2030 Agenda for Sustainable Development, while acknowledging that governments have the principal role of coordinating and leading development efforts;",
    "8": "Welcomes the convening of the ministerial meeting on South-South cooperation held in 2023 during the second part of the Fifth United Nations Conference on the Least Developed Countries, in Doha, on leveraging South-South and triangular cooperation for the attainment of the Sustainable Development Goals;",
    "9": "Takes note of the various experiences and locally driven development approaches to achieve the Sustainable Development Goals, and reiterates the importance of learning and sharing good practices, including through South-South, North-South and triangular cooperation through platforms such as South-South Galaxy, the Global South-South Development Expo, regional sustainable development forums and other knowledge-sharing platforms supported by the different entities of the United Nations system;",
    "10": "Welcomes the organization of the eleventh Global South-South Development Expo in Bangkok from 12 to 14 September 2022, under the theme \u201cAdvancing South-South and triangular cooperation for sustainable COVID-19 recovery: towards a smart and resilient future\u201d;",
    "11": "Looks forward to the Third South Summit, to be held in Kampala from 21 to 23 January 2024;",
    "12": "Also looks forward to the convening of the fourth International Conference on Small Island Developing States, in Antigua and Barbuda from 27 to 30 May 2024, and the third United Nations Conference on Landlocked Developing Countries, in Rwanda from 18 to 21 June 2024, both of which will, inter alia, provide the opportunity to the international community to scale its support to small island developing States and landlocked developing countries in their efforts to leverage South-South and triangular cooperation to achieve sustainable development;",
    "13": "Takes note of the recommendations of the Secretary-General, including scaling up contributions to the United Nations trust fund for South-South cooperation and other relevant financing mechanisms to enable the United Nations development system to advance South-South and triangular cooperation initiatives championed by developing countries, with sufficient resources;",
    "14": "Recognizes the growing debt burden of developing countries, and also recognizes the role of the United Nations, within its mandates, to facilitate South- South exchanges of knowledge on debt to help countries of the South;",
    "15": "Also recognizes the need to enhance the provision and mobilization of adequate resources for enhancing South-South and triangular cooperation, and in this context invites all countries in a position to do so, in particular developed countries, to scale up the contributions, in support of such cooperation, to the United Nations Fund for South-South Cooperation and to the P\u00e9rez-Guerrero Trust Fund for South- South Cooperation, in accordance with General Assembly resolution 57/263 of 20 December 2002, and to support other initiatives for all developing countries;",
    "16": "Highlights that 20 December 2023 will mark the fortieth anniversary of the P\u00e9rez-Guerrero Trust Fund for South-South Cooperation, and acknowledges the Trust Fund\u2019s effectiveness in providing catalytic support to South-South cooperation, underscoring the enduring partnership between the Group of 77 and the United Nations Office for South-South Cooperation;",
    "17": "Encourages United Nations entities to support developing countries in integrating development cooperation perspectives, including, in particular, South- South and triangular cooperation perspectives, into the preparation and presentation of the voluntary national review reports on sustainable development;",
    "18": " efforts of the different entities of the United Nations system and the regional commissions to promote South-South and triangular cooperation, takes note with appreciation of the work done by the United Nations Office for South-South Cooperation, through inclusive mechanisms, in particular South-South cooperation initiatives established by developing countries, and calls upon it to work in collaboration with the United Nations system organizations and the regional commissions to mainstream South-South and triangular cooperation, including through regional collaborative frameworks for South-South and triangular cooperation;",
    "19": "Calls upon the United Nations development system entities to further integrate, as appropriate, South-South and triangular cooperation into their strategic frameworks and planning instruments, and urges them to allocate sufficient financial resources dedicated to supporting and facilitating South-South and triangular cooperation;",
    "20": "Requests the United Nations Conference on Trade and Development, in its role as a custodian, to strengthen capacity-building on the initial voluntary conceptual framework for the measurement of South-South cooperation based on country-led mechanisms, recommends that the United Nations development system support the efforts of the United Nations Conference on Trade and Development in raising awareness and developing the capacity of national statistical offices and cooperation agencies to use this framework, and acknowledges the importance of exploring possible options for the measurement of triangular cooperation;",
    "21": "Recognizes the contribution of and the need to scale up and strengthen South-South and triangular cooperation as a complementary means of implementation of the 2030 Agenda and its Sustainable Development Goals, including in achieving the overarching goal of the eradication of poverty in all its forms and dimensions and the goals of, inter alia, ending hunger, reducing inequalities, within and among countries, as well as for the use, capacity-building and transfer of digital technologies, on mutually agreed terms, to accelerate the attainment of the Sustainable Development Goals and close the digital divides;",
    "22": "Also recognizes the contribution of South-South and triangular cooperation in promoting gender equality and the empowerment of women and girls in sustainable development, as well as in achieving the overarching goal of the eradication of poverty in all its forms and dimensions;",
    "23": "Further recognizes the role of South-South and triangular cooperation in enhancing connectivity and digital transformation within and among developing countries, and in this regard invites the United Nations Office for South-South Cooperation and the United Nations system, in line with their respective mandates, to support efforts to develop and implement policies to bridge the digital divides and fast-track digital transformation to improve the delivery of public services in the South;",
    "24": "Reaffirms the commitment at the very heart of the 2030 Agenda to leave no one behind and commit to taking more tangible steps to support people in vulnerable situations and the most vulnerable countries and to reach the furthest behind first;",
    "25": "Requests the Secretary-General to submit to the General Assembly at its seventy-ninth session a comprehensive report on the state of South-South cooperation, including the implementation of the outcome document of the second High-level Conference;",
    "26": "Decides to include in the provisional agenda of its seventy-ninth session, under the item entitled \u201cOperational activities for development\u201d, the sub-item entitled \u201cSouth-South cooperation for development\u201d."
  },
  "agenda_items": [
    "Item 22"
  ],
  "symbol_references": []
}