{
  "symbol": "A/RES/78/146",
  "filename": "A_RES_78_146.pdf",
  "title": "78/146. Cooperative measures to assess and increase awareness of environmental effects related to waste originating from chemical munitions dumped at sea",
  "text": "United Nations \nA/RES/78/146\n \n \nGeneral Assembly \nDistr.: General \n21 December 2023 \n \n23-25920 (E)    020124     \n*2325920* \n \n \nSeventy-eighth session \nAgenda item 18 \nSustainable development \n \n \n \n \n Resolution adopted by the General Assembly \non 19 December 2023 \n \n \n \n \n[on the report of the Second Committee (A/78/461, para. 53)] \n \n \n 78/146. Cooperative measures to assess and increase awareness \nof environmental effects related to waste originating from \nchemical munitions dumped at sea \n \n \n \nThe General Assembly, \n \nRecalling its resolutions 65/149 of 20 December 2010, 68/208 of 20 December \n2013, 71/220 of 21 December 2016 and 74/213 of 19 December 2019,  \n \nReaffirming its resolution 70/1 of 25 September 2015, entitled \u201cTransforming \nour world: the 2030 Agenda for Sustainable Development\u201d, in which it adopted a \ncomprehensive, far-reaching and people-centred set of universal and transformative \nSustainable Development Goals and targets, its commitment to working tirelessly for \nthe full implementation of the Agenda by 2030, its recognition that eradicating \npoverty in all its forms and dimensions, including extreme poverty, is the greatest \nglobal challenge and an indispensable requirement for sustainable development, and \nits commitment to achieving sustainable development in its three dimensions \u2013 \neconomic, social and environmental \u2013 in a balanced and integrated manner,  \n \nReaffirming also its resolution 69/313 of 27 July 2015 on the Addis Ababa \nAction Agenda of the Third International Conference on Financing for Development, \nwhich is an integral part of the 2030 Agenda for Sustainable Development, supports \nand complements it, helps to contextualize its means of implementation targets with \nconcrete policies and actions, and reaffirms the strong political commitment to \naddress the challenge of financing and creating an enabling environment at all levels \nfor sustainable development in the spirit of global partnership and solidarity,  \n \nRecalling the relevant recommendations of the United Nations Conference on \nthe Human Environment, held in Stockholm in June 1972, 1  \n__________________ \n \n1 See Report of the United Nations Conference on the Human Environment, Stockholm, 5\u201316 June \n1972 (A/CONF.48/14/Rev.1), part one. \n\nA/RES/78/146 \nCooperative measures to assess and increase awareness \nof environmental effects related to waste originating from \nchemical munitions dumped at sea\n \n23-25920\n2/5 \n \n \nTaking note of the outcomes of the United Nations Conference on Environment \nand Development, held in Rio de Janeiro, Brazil, in June 1992,2 and the Plan of \nImplementation of the World Summit on Sustainable Development (Johannesburg \nPlan of Implementation), adopted in Johannesburg, South Africa, in September 2002, 3 \nand reaffirming the outcome document of the United Nations Conference on \nSustainable Development, entitled \u201cThe future we want\u201d, adopted in Rio de Janeiro, \nBrazil, in June 2012,4  \n \nRecognizing the work of the Convention on Biological Diversity 5  and its \nprogramme of work to reduce marine and coastal biological loss, as well as other \nmultilateral environmental agreements and regional seas conventions to address \nmarine pollution and their contribution to the implementation of the 2030 Agenda for \nSustainable Development,  \n \nWelcoming the Kunming-Montreal Global Biodiversity Framework adopted in \ndecision 15/4 at the fifteenth meeting of the Conference of the Parties to the \nConvention on Biological Diversity, and its target 7,  \n \nRecalling the political declaration of the high-level political forum on \nsustainable development convened under the auspices of the General Assembly \n(Sustainable Development Goals Summit),6 held in New York on 18 and 19 September \n2023, in which Member States confirmed that they remain resolved to ensure the \nlasting protection of the planet and its natural resources and committed to reducing \ndisaster risk,  \n \nRecalling also its resolutions 73/254 of 20 December 2018 and 76/224 of \n17 December 2021, in which it promotes global partnerships that are critical to the \nachievement of the Sustainable Development Goals, as well as a principle-based \napproach to enhanced cooperation between the United Nations and all relevant \npartners,  \n \nRecalling further the efforts to conserve and sustainably use the oceans, seas \nand marine resources for sustainable development, including preventing and \nsignificantly reducing, by 2025, marine pollution of all kinds, 7  \n \nRecalling the 2022 United Nations Conference to Support the Implementation \nof Sustainable Development Goal 14: Conserve and sustainably use the oceans, seas \nand marine resources for sustainable development, co-hosted by Kenya and Portugal,  \n \nEncouraging all parties to support the preparations for the next United Nations \nConference to Support the Implementation of Sustainable Development Goal 14: \nConserve and sustainably use the oceans, seas and marine resources for sustainable \ndevelopment, to be co-hosted by Costa Rica and France in June 2025,  \n \nRecalling its resolution 72/73 of 5 December 2017, in which it proclaimed the \nUnited Nations Decade of Ocean Science for Sustainable Development,  \n__________________ \n \n2 See Report of the United Nations Conference on Environment and Development, Rio de Janeiro, \n3\u201314 June 1992, vol. I, Resolutions Adopted by the Conference (United Nations publication, \nSales No. E.93.I.8 and corrigendum), resolution 1. \n \n3 Report of the World Summit on Sustainable Development, Johannesburg, South Africa, \n26 August\u20134 September 2002 (United Nations publication, Sales No. E.03.II.A.1 and \ncorrigendum), chap. I, resolution 2, annex. \n \n4 Resolution 66/288, annex. \n \n5 United Nations, Treaty Series, vol. 1760, No. 30619. \n \n6 Resolution 78/1, annex. \n \n7 See resolution 70/1. \n\nCooperative measures to assess and increase awareness  \nof environmental effects related to waste originating from  \nchemical munitions dumped at sea \nA/RES/78/146\n \n3/5\n23-25920 \n \n \nReaffirming the United Nations Convention on the Law of the Sea, 8 which \nprovides the legal framework for ocean activities, and emphasizing its fundamental \ncharacter, conscious that the problems of ocean space are closely interrelated and need \nto be considered as a whole through an integrated, interdisciplinary and intersectoral \napproach,  \n \nNoting the importance of cooperation on chemical munitions dumped at sea as \nan effort that contributes to the improvement of the overall marine environment,  \n \nRecalling relevant international and regional instruments such as the \nConvention on the Prohibition of the Development, Production, Stockpiling and Use \nof Chemical Weapons and on Their Destruction,9 the Convention on the Prevention \nof Marine Pollution by Dumping of Wastes and Other Matter,10 the Convention for \nthe Protection and Development of the Marine Environment of the Wider Caribbean \nRegion, 11 the Convention for the Protection of the Marine Environment and the \nCoastal Region of the Mediterranean,12 the Agreement on the Protection of the Marine \nEnvironment and the Coastal Area of the South-East Pacific,13 the Convention on the \nProtection of the Marine Environment of the Baltic Sea Area 14 and the Convention \nfor the Protection of the Marine Environment of the North-East Atlantic,15  \n \nNoting the national, regional and international activities, including scientific \nresearch,16 data collection and sharing, awareness-raising, reporting on encounters \nand technical advice, related to munitions dumped at sea, inter alia, in the frameworks \nof the Convention on the Prevention of Marine Pollution by Dumping of Wastes and \nOther Matter, the Convention for the Protection of the Marine Environment of the \nNorth-East Atlantic, the Convention for the Protection of the Marine Environment \nand the Coastal Region of the Mediterranean and the Convention on the Protection of \nthe Marine Environment of the Baltic Sea Area,  \n \nEmphasizing that, in the report on the Third Special Session of the Conference \nof the States Parties to Review the Operation of the Chemical Weapons Convention \n(the Third Review Conference), adopted at The Hague on 19 April 2013, the States \nparties to the Convention on the Prohibition of the Development, Production, \nStockpiling and Use of Chemical Weapons and on Their Destruction were invited to \nsupport voluntary sharing of information, raising awareness and cooperation on this \nissue, and stressing the value of such voluntary efforts, building upon the discussions \nheld at the Review Conferences of 2018 and 2023,  \n \nNoting that Member States, international and regional organizations and civil \nsociety have undertaken activities to discuss and promote the issues related to waste \noriginating from chemical munitions dumped at sea, including international \ncooperation and the exchange of experiences and practical knowledge,  \n \nNoting also that the first and second World Ocean Assessments (World Ocean \nAssessment I and II), adopted respectively in 2015 and 2021, also highlight the issue \nof marine pollution, including from munitions dumped at sea, and have been taken \n__________________ \n \n8 United Nations, Treaty Series, vol. 1833, No. 31363. \n \n9 Ibid., vol. 1974, No. 33757. \n \n10 Ibid., vol. 1046, No. 15749. \n \n11 Ibid., vol. 1506, No. 25974. \n \n12 Ibid., vol. 1102, No. 16908. \n \n13 Ibid., vol. 1648, No. 28325. \n \n14 Ibid., vol. 2099, No. 36495. \n \n15 Ibid., vol. 2354, No. 42279. \n \n16 See, for example, the findings of the Baltic Sea research project entitled \u201cChemical Munitions, \nSearch and Assessment (CHEMSEA)\u201d, which is conducting research on environmental effects \nrelated to chemical munitions dumped at sea. The findings summarize all results obtained by the \nproject. \n\nA/RES/78/146 \nCooperative measures to assess and increase awareness \nof environmental effects related to waste originating from \nchemical munitions dumped at sea\n \n23-25920\n4/5 \n \ninto account by the General Assembly in its resolutions 70/235 of 23 December 2015, \n71/257 of 23 December 2016, 72/73 of 5 December 2017, 73/124 of 11 December \n2018, 75/239 of 31 December 2020 and 77/248 of 30 December 2022,  \n \nNoting further the concerns about the potential long-term environmental effects \nrelated to waste originating from chemical munitions dumped at sea, including their \npotential impact on human health and safety and on the marine environment and \nresources,  \n \nRecognizing the mandates and capacities of competent United Nations system \nentities in the fields of marine environment monitoring, research and information-\nsharing, as well as pollution preparedness and response, 17  \n \nRecognizing also the ongoing efforts aimed at awareness-raising, information-\nsharing and capacity-building at various levels, as well as partnership and cooperation \non the issue among relevant regional and international bodies, including the United \nNations, the International Maritime Organization, the United Nations Environment \nProgramme, the Organisation for the Prohibition of Chemical Weapons, the United \nNations Educational, Scientific and Cultural Organization, the Commission for the \nProtection of the Marine Environment of the North-East Atlantic and the Baltic \nMarine Environment Protection Commission, as well as the regional seas conventions \nand others,18  \n \n1. \nTakes note of the report of the Secretary-General, including the views \nsubmitted and contained therein;  \n \n2. \nNotes the importance of raising awareness of the environmental effects \nrelated to waste originating from chemical munitions dumped at sea;  \n \n3. \nInvites Member States and relevant international and regional \norganizations to keep under observation the issue of the waste originating from \nchemical munitions dumped at sea, to continue outreach efforts to assess and increase \nawareness of environmental effects related to that issue and to cooperate, including \nby strengthening existing efforts within regional seas conventions and other \ninternational, regional and subregional activities, as appropriate, related to risk \nassessment, monitoring, information-gathering, risk prevention and response to \nincidents;  \n \n4. \nEncourages voluntary sharing of information on waste originating from \nchemical munitions dumped at sea through conferences, seminars, workshops, \ntraining courses and publications aimed at the general public and industry in order to \nreduce related risks;  \n \n5. \nAlso encourages partnerships between Governments, industry and civil \nsociety for raising awareness about, reporting on and monitoring of waste originating \nfrom chemical munitions dumped at sea;  \n \n6. \nInvites Member States to consider providing assistance and sharing \nexpertise aimed at building capacities related to risk assessment, monitoring, \ninformation gathering, risk prevention and response to incidents resulting from waste \noriginating from chemical munitions dumped at sea;  \n \n7. \nEncourages Member States to share experiences, good practices and \ninformation on the technologies available to treat, conserve or safely destroy the \nwaste originating from chemical munitions dumped at sea;  \n__________________ \n \n17 Competent United Nations system entities include, inter alia, the United Nations Environment \nProgramme, the International Maritime Organization, the Intergovernmental Oceanographic \nCommission and the Secretariat. \n \n18 See A/78/276. \n\nCooperative measures to assess and increase awareness  \nof environmental effects related to waste originating from  \nchemical munitions dumped at sea \nA/RES/78/146\n \n5/5\n23-25920 \n \n \n8. \nInvites the Secretary-General to continue analysing all available \ninformation and additionally, if appropriate, to seek the views of Member States and \nrelevant regional and international organizations on cooperative measures to assess \nand increase awareness of the environmental effects related to waste originating from \nchemical munitions dumped at sea, also with a view to providing a global review of \navailable technical means of minimizing potential environmental effects related to the \nwaste originating from chemical munitions dumped at sea, including through their \nelimination, based on the scientific data and information compiled with due regard to \nequitable geographical representation, 19  and further exploring the possibility of \nestablishing a database, 20 as well as identifying the appropriate intergovernmental \nbodies within the United Nations system for further consideration and implementation, \nas appropriate, of the cooperative measures envisaged in the present resolution, \nbuilding on and without duplicating existing activities, and with a view to achieving \nefficiency and synergies, taking into account the mandates and capacities of relevant \ninternational and regional organizations;  \n \n9. \nRequests the Secretary-General, within existing resources, to submit to the \nGeneral Assembly at its eighty-second session a report on the implementation of the \npresent resolution, prepared using responses of Member States and relevant regional \nand international organizations, as well as other available information, with the \ncirculation of the related questionnaire among Member States with due advance \nnotice, and decides to include the item entitled \u201cSustainable development\u201d in the \nprovisional agenda of its eighty-second session, unless otherwise agreed. \n \n49th plenary meeting \n19 December 2023 \n \n__________________ \n \n19 The absence of inputs from certain regions will not invalidate the review, noting the request for \nthe Secretariat to observe the principle of equitable geographical representation. \n \n20 Such a database could contain relevant and voluntarily shared information on, inter alia, the \nlocation of dumping sites, the type, quantity and, to the extent possible, the current condition of \nchemical munitions, the recorded environmental impact, best practices on risk prevention and \nresponse to incidents or accidental encounters and destruction or impact reduction technologies, \nincluding by means of data collection and management. \n",
  "paragraphs": {
    "1": "Takes note of the report of the Secretary-General, including the views submitted and contained therein;",
    "2": "Notes the importance of raising awareness of the environmental effects related to waste originating from chemical munitions dumped at sea;",
    "3": "Invites Member States and relevant international and regional organizations to keep under observation the issue of the waste originating from chemical munitions dumped at sea, to continue outreach efforts to assess and increase awareness of environmental effects related to that issue and to cooperate, including by strengthening existing efforts within regional seas conventions and other international, regional and subregional activities, as appropriate, related to risk assessment, monitoring, information-gathering, risk prevention and response to incidents;",
    "4": "Encourages voluntary sharing of information on waste originating from chemical munitions dumped at sea through conferences, seminars, workshops, training courses and publications aimed at the general public and industry in order to reduce related risks;",
    "5": "Also encourages partnerships between Governments, industry and civil society for raising awareness about, reporting on and monitoring of waste originating from chemical munitions dumped at sea;",
    "6": "Invites Member States to consider providing assistance and sharing expertise aimed at building capacities related to risk assessment, monitoring, information gathering, risk prevention and response to incidents resulting from waste originating from chemical munitions dumped at sea;",
    "7": "Encourages Member States to share experiences, good practices and information on the technologies available to treat, conserve or safely destroy the waste originating from chemical munitions dumped at sea;",
    "8": "Invites the Secretary-General to continue analysing all available information and additionally, if appropriate, to seek the views of Member States and relevant regional and international organizations on cooperative measures to assess and increase awareness of the environmental effects related to waste originating from chemical munitions dumped at sea, also with a view to providing a global review of available technical means of minimizing potential environmental effects related to the waste originating from chemical munitions dumped at sea, including through their elimination, based on the scientific data and information compiled with due regard to equitable geographical representation, 19 and further exploring the possibility of establishing a database, 20 as well as identifying the appropriate intergovernmental bodies within the United Nations system for further consideration and implementation, as appropriate, of the cooperative measures envisaged in the present resolution, building on and without duplicating existing activities, and with a view to achieving efficiency and synergies, taking into account the mandates and capacities of relevant international and regional organizations;",
    "9": "Requests the Secretary-General, within existing resources, to submit to the General Assembly at its eighty-second session a report on the implementation of the present resolution, prepared using responses of Member States and relevant regional and international organizations, as well as other available information, with the circulation of the related questionnaire among Member States with due advance notice, and decides to include the item entitled \u201cSustainable development\u201d in the provisional agenda of its eighty-second session, unless otherwise agreed."
  },
  "agenda_items": [
    "Item 18"
  ],
  "symbol_references": []
}