{
  "symbol": "A/RES/78/154",
  "filename": "A_RES_78_154.pdf",
  "title": "78/154. Implementation of the United Nations Convention to Combat Desertification in Those Countries Experiencing Serious Drought and/or Desertification, Particularly in Africa",
  "text": "United Nations \nA/RES/78/154\n \n \nGeneral Assembly \nDistr.: General \n21 December 2023 \n \n23-25899 (E)    030124 \n*2325899* \n \n \nSeventy-eighth session \nAgenda item 18 (e) \nSustainable development: implementation of the \nUnited Nations Convention to Combat Desertification in \nThose Countries Experiencing Serious Drought and/or \nDesertification, Particularly in Africa  \n \n \n \n \n Resolution adopted by the General Assembly \non 19 December 2023 \n \n \n \n \n[on the report of the Second Committee (A/78/461/Add.5, para. 7)] \n \n \n 78/154. Implementation of the United Nations Convention to Combat \nDesertification in Those Countries Experiencing Serious Drought \nand/or Desertification, Particularly in Africa \n \n \n \nThe General Assembly, \n \nRecalling its resolution 77/166 of 14 December 2022, as well as other \nresolutions relating to the implementation of the United Nations Convention to \nCombat Desertification in Those Countries Experiencing Serious Drought and/or \nDesertification, Particularly in Africa,1 \n \nReaffirming its resolution 70/1 of 25 September 2015, entitled \u201cTransforming \nour world: the 2030 Agenda for Sustainable Development\u201d, in which it adopted a \ncomprehensive, far-reaching and people-centred set of universal and transformative \nSustainable Development Goals and targets, its commitment to working tirelessly for \nthe full implementation of the Agenda by 2030, its recognition that eradicating \npoverty in all its forms and dimensions, including extreme poverty, is the greatest \nglobal challenge and an indispensable requirement for sustainable development, and \nits commitment to achieving sustainable development in its three dimensions \u2013 \neconomic, social and environmental \u2013 in a balanced and integrated manner and to \nbuilding upon the achievements of the Millennium Development Goals and seeking \nto address their unfinished business,  \n \nRecalling that, in the 2030 Agenda, the international community committed to \ncombating desertification, restoring degraded land and soil, including land affected \n__________________ \n \n1 United Nations, Treaty Series, vol. 1954, No. 33480. \n\nA/RES/78/154 \nImplementation of the United Nations Convention to Combat \nDesertification in Those Countries Experiencing Serious Drought \nand/or Desertification, Particularly in Africa\n \n23-25899\n2/9 \n \nby desertification, drought and floods, and striving to achieve a land degradation-\nneutral world by 2030,  \n \nReaffirming its resolution 69/313 of 27 July 2015 on the Addis Ababa Action \nAgenda of the Third International Conference on Financing for Development, which \nis an integral part of the 2030 Agenda for Sustainable Development, supports and \ncomplements it, helps to contextualize its means of implementation targets with \nconcrete policies and actions, and reaffirms the strong political commitment to \naddress the challenge of financing and creating an enabling environment at all levels \nfor sustainable development in the spirit of global partnership and solidarity,  \n \nRecognizing that Sustainable Development Goal targets 15.3, 6.1 and 6.6 and \nthe setting of voluntary land degradation neutrality targets have created strong \nmomentum for accelerating the implementation of the Convention,  \n \nNoting that restoring degraded lands generates benefits for poor populations, \nbrings more food to the hungry and to the markets, restores ecosystems and \nbiodiversity and enhances resilience to climate change impacts, including by \nsequestering huge quantities of carbon from the atmosphere and bringing carbon into \nthe soil,  \n \nRecalling that, in its decision 3/COP.15,2 the Conference of the Parties to the \nConvention invited parties that have committed to voluntary land degradation \nneutrality targets to implement measures to accelerate the achievement thereof, by, \ninter alia, creating an enabling environment for the achievement of land degradation \nneutrality, including the responsible governance of land and tenure security, the \nengagement of stakeholders and the improved access of smallholders to advisory and \nfinancial services, in particular for women and those in vulnerable situations, \ntherefore, taking note with appreciation of the pledge made by 131 countries to \nestablish national voluntary targets and relevant measures to achieve land degradation \nneutrality by 2030, while 112 parties have successfully completed this voluntary \nprocess and 106 have already published their national reports on the website of the \nConvention,  \n \nNoting that combating desertification, land degradation and drought, including \nthrough the sustainable management of natural resources, can contribute to \nsustainable development for all and to easing displacement flows,  \n \nBearing in mind its resolution 73/284 of 1 March 2019, in which it declared the \ndecade 2021\u20132030 as the United Nations Decade on Ecosystem Restoration,  \n \nRecalling the adoption of the 2018\u20132030 Strategic Framework of the \nConvention,3 including a new strategic objective on drought,  \n \nReaffirming the Paris Agreement4 and its early entry into force, encouraging all \nits parties to fully implement the Agreement, and parties to the United Nations \nFramework Convention on Climate Change5 that have not yet done so to deposit their \ninstruments of ratification, acceptance, approval or accession, where appropriate, as \nsoon as possible,  \n \nRecognizing that climate change, unsustainable agricultural and forestry \npractices, and land degradation, inter alia, are major and growing drivers of \nbiodiversity loss and ecosystem degradation, and that conservation, restoration and \nthe sustainable use of biodiversity, and ecosystem functions and services, sustainable \n__________________ \n \n2 See ICCD/COP(15)/23/Add.1. \n \n3 ICCD/COP(13)/21/Add.1, decision 7/COP.13, annex, and ICCD/COP(15)/23/Add.1, decision \n7/COP.15. \n \n4 Adopted under the UNFCCC in FCCC/CP/2015/10/Add.1, decision 1/CP.21. \n \n5 United Nations, Treaty Series, vol. 1771, No. 30822. \n\nImplementation of the United Nations Convention to Combat \nDesertification in Those Countries Experiencing Serious Drought \nand/or Desertification, Particularly in Africa \nA/RES/78/154\n \n3/9\n23-25899 \n \nland management approaches and technologies, including through nature-based \nsolutions, ecosystem-based approaches and other management and conservation \napproaches, in line with resolution 5/5 of 2 March 2022 of the United Nations \nEnvironment Assembly,6 contribute significantly to land degradation neutrality, \nclimate change adaptation and mitigation, disaster risk reduction and food security \nand nutrition,  \n \nNoting with concern the findings of the second edition of Global Land Outlook \nand the findings of the Intergovernmental Science-Policy Platform on Biodiversity \nand Ecosystem Services land degradation and restoration assessment and its Global \nAssessment Report on Biodiversity and Ecosystem Services, the findings of the \nIntergovernmental Panel on Climate Change contained in its special report on climate \nchange, desertification, land degradation, sustainable land management, food \nsecurity, and greenhouse gas fluxes in terrestrial ecosystems, as well as the findings \ncontained in the special report of the Panel entitled Global Warming of 1.5\u00b0C,  \n \nRecognizing the interdependencies between biodiversity loss, pollution, water \nscarcity, climate change, desertification, land degradation and drought and their \ninterlinkages with food security and human well- being, including health,  \n \nDeeply concerned about the continuous trend in land degradation and the fact \nthat the impacts of desertification, land degradation and drought are felt most strongly \nby people in vulnerable situations,  \n \nWelcoming the convening of the United Nations Conference on the Midterm \nComprehensive Review of the Implementation of the Objectives of the International \nDecade for Action, \u201cWater for Sustainable Development\u201d, 2018\u20132028, in New York \nfrom 22 to 24 March 2023,  \n \nNoting with great concern the severe negative impact on human health, safety \nand well-being caused by the coronavirus disease (COVID-19) pandemic, as well as \nthe severe disruption to societies and economies and the devastating impact on lives \nand livelihoods, and that the poorest and most vulnerable are the hardest hit by the \npandemic, reaffirming the ambition to get back on track to achieve the Sustainable \nDevelopment Goals by designing and implementing sustainable and inclusive \nrecovery strategies to accelerate progress towards the full implementation of the 2030 \nAgenda for Sustainable Development and to help to reduce the risk of and build \nresilience to future shocks, crises and pandemics, including by strengthening health \nsystems and achieving universal health coverage, and recognizing that equitable and \ntimely access for all to safe, quality, effective and affordable COVID-19 vaccines, \ntherapeutics and diagnostics are an essential part of a global response based on unity, \nsolidarity, renewed multilateral cooperation and the principle of leaving no one \nbehind,  \n \nRecognizing that combating desertification, land degradation and drought is \nimportant for sustainable, inclusive and climate-resilient recovery from the \nCOVID-19 crisis, that it is important to integrate land conservation, protection and \nrestoration, sustainable land management, degraded soil and terrestrial ecosystems \nrestoration, combating desertification and the aim of land degradation neutrality into \nthe global agenda for sustainable development, and that careful targeting of the \nCOVID-19 recovery investments, including land restoration, creates economic \nopportunities that contribute to environmental sustainability and poverty eradication,  \n \nRecalling the United Nations strategic plan for forests 2017\u20132030,7 and \nacknowledging that all types of forests provide essential ecosystem services, such as \n__________________ \n \n6 UNEP/EA.5/Res.5. \n \n7 See resolution 71/285. \n\nA/RES/78/154 \nImplementation of the United Nations Convention to Combat \nDesertification in Those Countries Experiencing Serious Drought \nand/or Desertification, Particularly in Africa\n \n23-25899\n4/9 \n \ntimber, food, fuel, fodder, non-wood products and shelter, as well as soil and water \nconservation and clean air, that the sustainable management of forests and trees \noutside forests is vital to the integrated implementation of the 2030 Agenda and that \nforests prevent land degradation and desertification and reduce the risk of floods, soil \nerosion, landslides and avalanches, droughts, sand and dust storms and other \ndisasters,  \n \nReiterating its appreciation to the Government of C\u00f4te d\u2019Ivoire for hosting the \nfifteenth session of the Conference of the Parties to the United Nations Convention \nto Combat Desertification in Those Countries Experiencing Serious Drought and/or \nDesertification, Particularly in Africa, held in Abidjan from 9 to 20 May 2022,  \n \nRecalling the establishment of a new intergovernmental working group on \ndrought during the triennium 2022\u20132024, with a view to presenting its findings and \nrecommendations to the parties for their consideration at the sixteenth session of the \nConference of the Parties to the Convention,  \n \nReaffirming the importance of government leadership, multi-stakeholder \npartnerships and increasing private engagement for the sustainable management, \nrestoration and rehabilitation of ecosystems, biodiversity and land,  \n \nRecognizing the Global Initiative on Reducing Land Degradation and Enhancing \nConservation of Terrestrial Habitats to prevent, halt and reverse land degradation \nadopted by the leaders of the Group of 20 in Riyadh in 2020, as well as the Riyadh \nLeader\u2019s Declaration, \n \nRecognizing also the launch of the International Drought Resilience Alliance \nwith a view to enhancing drought resilience, \n \nHighlighting the importance of multi-stakeholder participation at the local, \nsubnational, national and regional levels and from all sectors of society, including \ncivil society organizations, local government and the private sector, as appropriate, in \nthe implementation of the Convention and its 2018\u20132030 Strategic Framework,  \n \nRecognizing the value of knowledge, education, science and new technology to \nsustainable land management, including making use of, inter alia, the Voluntary \nGuidelines for Sustainable Soil Management of the Food and Agriculture \nOrganization of the United Nations, emphasizing the importance of science-based \ndecision-making and that science and technology to combat desertification, land \ndegradation and drought should therefore be further promoted, and acknowledging \nthe work of the Science-Policy Interface of the Convention,  \n \nTaking note with appreciation of the global celebrations of the 2023 World Day \nto Combat Desertification and Drought, under the theme \u201cHer Land. Her Rights: \nAdvancing gender equality and land restoration goals\u201d, on 16 June 2023, \n \n1. \nTakes note of the report of the Secretary-General on the implementation of \nresolution 77/166 on the United Nations Convention to Combat Desertification in \nThose Countries Experiencing Serious Drought and/or Desertification, Particularly in \nAfrica;8 \n \n2. \nWelcomes the decisions of the fifteenth session of the Conference of the \nParties to the United Nations Convention to Combat Desertification in Those \nCountries Experiencing Serious Drought and/or Desertification, Particularly in \nAfrica, and stresses the importance of their effective implementation;  \n \n3. \nWelcomes with appreciation the offer made by the Government of the \nKingdom of Saudi Arabia to host the sixteenth session of the Conference of the Parties \n__________________ \n \n8 A/78/209, sect. II. \n\nImplementation of the United Nations Convention to Combat \nDesertification in Those Countries Experiencing Serious Drought \nand/or Desertification, Particularly in Africa \nA/RES/78/154\n \n5/9\n23-25899 \n \nto the United Nations Convention to Combat Desertification in Those Countries \nExperiencing Serious Drought and/or Desertification, Particularly in Africa, in \nRiyadh from 2 to 13 December 2024, and looks forward to its outcome;  \n \n4. \nWelcomes the first part of the fifteenth meeting of the Conference of the \nParties to the Convention on Biological Diversity, held in Kunming, China, from 11 to \n15 October 2021, and the second part of the fifteenth meeting of the Conference of \nthe Parties to the Convention on Biological Diversity, held in Montreal, Canada, from \n7 to 19 December 2022 under the presidency of China, and its outcomes, including \nthe Kunming-Montreal Global Biodiversity Framework, and urges their early, \ninclusive and effective implementation;  \n \n5. \nUrges the implementation of the Paris Agreement and the agreed \nintergovernmentally negotiated outcomes and decisions of the subsequent United \nNations climate change conferences; \n \n6. \nTakes note of the Abidjan Call, which urged giving the highest priority to \nthe issue of drought prevention, resilience, impact mitigation and accelerating the \nimplementation of existing national commitments, towards achieving land \ndegradation neutrality by 2030 and raising ambition for investments in large-scale \nland restoration projects and programmes, which also help countries and communities \nto prepare for and mitigate the impacts of drought;  \n \n7. \nInvites Member States to support efforts to implement the strategic \nobjectives of the United Nations Convention to Combat Desertification in Those \nCountries Experiencing Serious Drought and/or Desertification, Particularly in \nAfrica;  \n \n8. \nWelcomes the voluntary commitment of the parties to the Convention to \naccelerate the restoration of 1 billion hectares of degraded land by 2030 by improving \ndata gathering and monitoring to track progress against the achievement of land \nrestoration commitments and establishing a new partnership model for large-scale \nintegrated landscape investment programmes;  \n \n9. \nStrongly encourages the parties to the Convention to apply and align with \nthe 2018\u20132030 Strategic Framework of the Convention in their national policies, \nprogrammes, plans and processes relating to desertification, land degradation and \ndrought, and to implement the Strategic Framework, taking into account the Addis \nAbaba Action Agenda of the Third International Conference on Financing for \nDevelopment;9 \n \n10. Welcomes the establishment of an intergovernmental working group to \noversee the midterm evaluation process related to the 2018\u20132030 Strategic \nFramework of the Convention, which is to present its recommendations to the parties \nfor their consideration at the sixteenth session of the Conference of the Parties;  \n \n11. \nReaffirms that reducing land degradation and achieving land degradation \nneutrality has the potential to act as an accelerator and integrator for achieving the \nSustainable Development Goals, and respond to the overall objectives of the 2030 \nAgenda for Sustainable Development;10 \n \n12. Encourages Member States to pursue considering target 15.3 of the \nSustainable Development Goals as an integrator and accelerator to achieve other \nSustainable Development Goals;  \n \n13. Reiterates the need to combat desertification, reduce land degradation, \nrestore degraded land and soil, including land affected by desertification, drought and \n__________________ \n \n9 Resolution 69/313, annex. \n \n10 Resolution 70/1. \n\nA/RES/78/154 \nImplementation of the United Nations Convention to Combat \nDesertification in Those Countries Experiencing Serious Drought \nand/or Desertification, Particularly in Africa\n \n23-25899\n6/9 \n \nfloods, and strive to achieve a land degradation-neutral world, recalls with \nappreciation the voluntary land degradation neutrality target-setting programme \nconsistent with the Convention and the work of the secretariat of the Convention and \npartners to assist parties to the Convention in carrying out voluntary target-setting \nactivities, emphasizes the need for capacity-building and opportunities for parties that \nhave yet to set land degradation neutrality targets, and in this respect reiterates its \ninvitation to parties to the Convention that have not yet subscribed to the programme \nto do so; \n \n14. Recognizes \nthat \nsustainable \nland \nmanagement \napproaches \nand \ntechnologies, including through nature-based solutions, ecosystem-based approaches \nand other management and conservation approaches, in line with resolution 5/5 of the \nUnited Nations Environment Assembly, constitute promising options to evaluate and \nconsider in connection with sequestering carbon and enhancing the resilience of \npeople and ecosystems affected by desertification, land degradation and drought, as \nwell as the adverse effects of climate change and biodiversity loss; \n \n15. Also recognizes the importance of applying new and innovative \ntechnologies and enabling policies and approaches, as well as sharing best practices, \nin combating desertification, land degradation and drought, as well as enhancing \ndrought resilience, and requests the Secretary-General to continue to identify, as \nappropriate, those technologies, enabling policies and best practices in his report on \nthe implementation of the present resolution;  \n \n16. Affirms that combating desertification, land degradation and drought and \nachieving land degradation neutrality through, inter alia, land conservation, \nprotection and restoration, sustainable land management, degraded soil and terrestrial \necosystems restoration, sustainable afforestation and reforestation, which have \nemerged as a pathway to accelerating progress towards achieving the Sustainable \nDevelopment Goals, will also contribute, among others, to safeguarding livelihoods, \npreventing and preparing for future pandemics and achieving a sustainable, inclusive \nand resilient recovery in the aftermath of the COVID-19 pandemic, and underlines \nthe importance of integrating land conservation, protection and restoration, \nsustainable land management and degraded soil and terrestrial ecosystems restoration \ninto post-COVID-19 recovery efforts, with particular emphasis on improving the \nlivelihoods of the poorest, including rural communities and people in vulnerable \nsituations, and recognizing and respecting Indigenous Peoples\u2019 connections to their \ntraditional territories;  \n \n17. Encourages the entities of the United Nations system, when designing and \nimplementing their programmes and projects, to take into account the role of \nachieving land degradation neutrality as a potential accelerator to achieve the \nSustainable Development Goals;  \n \n18. Underlines the importance of comprehensive reporting, follow-up and \nreview at the global, national and regional levels, as appropriate, in order to track \nprogress in the implementation of the Convention;  \n \n19. Reiterates the invitation to parties to the Convention to take measures to \nensure, as appropriate, that their relevant institutions adopt a proactive approach to \ndrought management and integrate drought resilience and risk management, \nsustainable livestock and agricultural policies, drought forecasting work, sustainable \nwater management and climate information and climate change impact assessments \ninto relevant policymaking processes and initiatives;  \n \n20. Reiterates its invitation to the parties to the Convention to provide the \nExecutive Secretary of the Convention with full support in the fulfilment of his \nmandate and in promoting the implementation of the Convention;  \n\nImplementation of the United Nations Convention to Combat \nDesertification in Those Countries Experiencing Serious Drought \nand/or Desertification, Particularly in Africa \nA/RES/78/154\n \n7/9\n23-25899 \n \n \n21. Stresses the urgent need to enhance adaptive capacity, strengthen \nresilience and reduce vulnerability to climate change and extreme weather events, and \nin this regard urges Member States to continue to engage in adaptation planning \nprocesses and to enhance cooperation in disaster risk reduction;  \n \n22. Invites the United Nations Coalition on Combating Sand and Dust Storms, \nwhich was formed at the twenty-fourth meeting of the senior officials of the \nEnvironment Management Group, in September 2018, and other relevant United \nNations entities to continue their collaboration to assist affected country parties in \ndeveloping and implementing national and regional policies on sand and dust storms;  \n \n23. Recognizes that gender equality and the empowerment of all women and \ngirls remain a crucial contribution to the effective implementation of the Convention, \nincluding its 2018\u20132030 Strategic Framework, and to the achievement of the Goals \nof the 2030 Agenda, stresses the importance of parties to the Convention and partners \nstriving to ensure the equal participation of women and men in planning, decision-\nmaking and implementation at all levels and further achieving gender equality and \nthe empowerment of all women and girls, as well as women\u2019s full, equal, effective \nand meaningful participation in desertification, land degradation and drought-related \npolicies and activities, and also stresses the importance of the effective \nimplementation of the four priority thematic areas of the Gender Action Plan adopted \nby the parties to the Convention;  \n \n24. Reiterates the invitation to the secretariat and the Global Mechanism of \nthe Convention to continue to collaborate and build partnerships with the secretariats \nof the other Rio conventions, the United Nations Entity for Gender Equality and the \nEmpowerment of Women (UN-Women), other United Nations entities, international \norganizations and other relevant organizations to explore further ways of \nstrengthening awareness-raising, improving the Gender Action Plan and developing \nfurther tools and guidelines for the use of parties in the thematic areas of the Gender \nAction Plan and the gender-responsive implementation of the Convention;  \n \n25. Recalls the invitation to parties to the Convention to legally recognize \nrights to equal use and ownership of land for women and the enhancement of women\u2019s \nequal access to land and land tenure security, as well as the promotion of gender-\nsensitive measures to combat desertification, land degradation and drought and \nachieve land degradation neutrality, taking into account the national context, and in \nthis context notes the Abidjan Declaration on Achieving Gender Equality for \nSuccessful Land Restoration, which promotes all measures necessary to identify and \neliminate all forms of discrimination against women, with particular attention to the \nrights of older women, widows, women with disabilities and young women;  \n \n26. Encourages parties to the Convention to follow the principles of \nimplementation of the Voluntary Guidelines on the Responsible Governance of \nTenure of Land, Fisheries and Forests in the Context of National Food Security 11 in \nthe implementation of activities to combat desertification, land degradation and \ndrought; \n \n27. Encourages the public and private sectors to continue to invest in \ndeveloping, adapting and scaling up the application of technologies, enabling \npolicies, methods and tools to combat desertification, land degradation and drought \nin different regions, and to boost knowledge exchange, including of traditional \nknowledge with the consent of the knowledge holders, capacity-building and sharing \nof technologies on mutually agreed terms;  \n__________________ \n \n11 Food and Agriculture Organization of the United Nations, document CL 144/9 (C 2013/20), \nappendix D. \n\nA/RES/78/154 \nImplementation of the United Nations Convention to Combat \nDesertification in Those Countries Experiencing Serious Drought \nand/or Desertification, Particularly in Africa\n \n23-25899\n8/9 \n \n \n28. Encourages parties to the Convention to continue to promote the \nprevention of desertification, land degradation and drought with an integrated \nlandscape approach by sustainably managing land and water resources, avoiding \npractices that degrade land and rehabilitating and restoring already degraded land;  \n \n29. Encourages developed countries party to the Convention and other \nrelevant stakeholders to actively support the efforts of developing countries party to \nthe Convention in promoting sustainable land management practices and in seeking \nto achieve a land degradation-neutral world by providing substantial financial \nresources from all sources facilitated access to appropriate technology on mutually \nagreed terms and other forms of support, including through capacity-building \nmeasures;  \n \n30. Recognizes the benefits gained from cooperation through the sharing of \nclimate and weather information, forecasting and early warning systems related to \ndesertification, land degradation and drought, while also taking account of sand and \ndust storms, at the global, regional and subregional levels, and in this regard likewise \nrecognizes the need for further cooperation between parties to the Convention and \nrelevant organizations in the sharing of related information, forecasting and early \nwarning systems;  \n \n31. Calls upon the United Nations entities to mainstream drought resilience in \ntheir programmes when supporting countries prone to droughts or already affected, \nwith an emphasis on enhancing preparation and resilience, noting the need for drought \nmanagement through, inter alia, impactful policies, early warning systems, \npreparedness and mitigation, land restoration, sustainable agricultural and livestock \npolicies and related actions to advance the neutrality of land degradation, in countries \naffected by drought and/or desertification;  \n \n32. Encourages all relevant entities of the United Nations system, within their \nrespective mandates, to harness opportunities for leveraging synergies among the \nConvention on Biological Diversity,12 the United Nations Convention to Combat \nDesertification in Those Countries Experiencing Serious Drought and/or \nDesertification, Particularly in Africa, and the United Nations Framework Convention \non Climate Change and other relevant multilateral environmental agreements, as well \nas the 2030 Agenda, and in this respect welcomes the ongoing efforts to strengthen \nsynergies among the secretariats of the aforementioned conventions;  \n \n33. Welcomes the United Nations Decade for Deserts and the Fight against \nDesertification and the United Nations Decade on Ecosystem Restoration, as well as \nthe convening of the 2021 United Nations Food Systems Summit, underlines the \nimportance of combating desertification and water scarcity and restoring degraded \nlands to ensure sustainable food production during the COVID-19 recovery period \nand recognizes the critical role that healthy land has in the global economy, calls for \nmeasures to explore and promote consumption and production patterns that conserve \nand protect land, advance land degradation neutrality and promote the conservation, \nprotection, sustainable management and restoration of forests, taking note, inter alia, \nof the Glasgow Leaders\u2019 Declaration on Forests and Land Use, and welcomes the \nconvening of the twenty-seventh session of the Conference of the Parties to the United \nNations Framework Convention on Climate Change, held in Sharm el-Sheikh, Egypt, \nfrom 6 to 20 November 2022;  \n \n34. Notes with appreciation the financial contributions that have been made \nby Member States and other donors towards the Land Degradation Neutrality Fund, \nand invites Member States and other donors to make further contributions to the Land \nDegradation Neutrality Fund and the drought initiative of the United Nations \n__________________ \n \n12 United Nations, Treaty Series, vol. 1760, No. 30619. \n\nImplementation of the United Nations Convention to Combat \nDesertification in Those Countries Experiencing Serious Drought \nand/or Desertification, Particularly in Africa \nA/RES/78/154\n \n9/9\n23-25899 \n \nConvention to Combat Desertification in Those Countries Experiencing Serious \nDrought and/or Desertification, Particularly in Africa;  \n \n35. Decides to include, in the United Nations calendar of conferences and \nmeetings for the year 2023 and subsequent years, the sessions of the Conference of \nthe Parties to the Convention and each of its subsidiary bodies, and requests the \nSecretary-General to continue to make provisions for those sessions in the proposed \nprogramme budgets;  \n \n36. Acknowledges the commitment of the parties to the Convention to boost \ndrought resilience by identifying the expansion of arid, semi-arid, dry subhumid areas \nand drylands, improving national policies and early warning systems linked to early \naction, learning and sharing knowledge, building partnerships and coordinating \naction, and mobilizing drought finance to support a shift from reactive to proactive \ndrought management, and welcomes the announcement by the Secretary-General of \nthe Early Warnings for All initiative to ensure that every person on Earth is protected \nby early warning systems within five years;  \n \n37. Takes note of decision 22/COP.15,13 which invites the parties to the \nConvention to promote sustainable territorial development, including multi-level \ngovernance and planning mechanisms, as appropriate, to strengthen urban-rural \nlinkages, address desertification/land degradation and drought, including sand and \ndust storms, and create social and economic opportunities that reduce forced \nmigration and displacement and increase rural resilience and livelihood stability;  \n \n38. Acknowledges the decision of the Conference of the Parties at its fifteenth \nsession with respect to promoting decent land-based jobs for youth and land-based \nyouth entrepreneurship and strengthening youth participation in the processes relating \nto the Convention;  \n \n39. Reaffirms the continuation, for a further five-year period, of the current \ninstitutional linkage and related administrative arrangements with the United Nations \nSecretariat, to be reviewed by both the General Assembly and the Conference of the \nParties no later than 31 December 2026;  \n \n40. Requests the Secretary-General to submit to the General Assembly at its \nseventy-ninth session a report on the implementation of the present resolution, and \ndecides to include in the provisional agenda of its seventy-ninth session, under the \nitem entitled \u201cSustainable development\u201d, the sub-item entitled \u201cImplementation of \nthe United Nations Convention to Combat Desertification in Those Countries \nExperiencing Serious Drought and/or Desertification, Particularly in Africa\u201d. \n \n49th plenary meeting \n19 December 2023 \n \n__________________ \n \n13 See ICCD/COP(15)/23/Add.1. \n",
  "paragraphs": {
    "1": "Takes note of the report of the Secretary-General on the implementation of resolution 77/166 on the United Nations Convention to Combat Desertification in Those Countries Experiencing Serious Drought and/or Desertification, Particularly in Africa;8",
    "2": "Welcomes the decisions of the fifteenth session of the Conference of the Parties to the United Nations Convention to Combat Desertification in Those Countries Experiencing Serious Drought and/or Desertification, Particularly in Africa, and stresses the importance of their effective implementation;",
    "3": "Welcomes with appreciation the offer made by the Government of the Kingdom of Saudi Arabia to host the sixteenth session of the Conference of the Parties to the United Nations Convention to Combat Desertification in Those Countries Experiencing Serious Drought and/or Desertification, Particularly in Africa, in Riyadh from 2 to 13 December 2024, and looks forward to its outcome;",
    "4": "Welcomes the first part of the fifteenth meeting of the Conference of the Parties to the Convention on Biological Diversity, held in Kunming, China, from 11 to 15 October 2021, and the second part of the fifteenth meeting of the Conference of the Parties to the Convention on Biological Diversity, held in Montreal, Canada, from 7 to 19 December 2022 under the presidency of China, and its outcomes, including the Kunming-Montreal Global Biodiversity Framework, and urges their early, inclusive and effective implementation;",
    "5": "Urges the implementation of the Paris Agreement and the agreed intergovernmentally negotiated outcomes and decisions of the subsequent United Nations climate change conferences;",
    "6": "Takes note of the Abidjan Call, which urged giving the highest priority to the issue of drought prevention, resilience, impact mitigation and accelerating the implementation of existing national commitments, towards achieving land degradation neutrality by 2030 and raising ambition for investments in large-scale land restoration projects and programmes, which also help countries and communities to prepare for and mitigate the impacts of drought;",
    "7": "Invites Member States to support efforts to implement the strategic objectives of the United Nations Convention to Combat Desertification in Those Countries Experiencing Serious Drought and/or Desertification, Particularly in Africa;",
    "8": "Welcomes the voluntary commitment of the parties to the Convention to accelerate the restoration of 1 billion hectares of degraded land by 2030 by improving data gathering and monitoring to track progress against the achievement of land restoration commitments and establishing a new partnership model for large-scale integrated landscape investment programmes;",
    "9": "Strongly encourages the parties to the Convention to apply and align with the 2018\u20132030 Strategic Framework of the Convention in their national policies, programmes, plans and processes relating to desertification, land degradation and drought, and to implement the Strategic Framework, taking into account the Addis Ababa Action Agenda of the Third International Conference on Financing for Development;9",
    "10": "Welcomes the establishment of an intergovernmental working group to oversee the midterm evaluation process related to the 2018\u20132030 Strategic Framework of the Convention, which is to present its recommendations to the parties for their consideration at the sixteenth session of the Conference of the Parties;",
    "11": "Reaffirms that reducing land degradation and achieving land degradation neutrality has the potential to act as an accelerator and integrator for achieving the Sustainable Development Goals, and respond to the overall objectives of the 2030 Agenda for Sustainable Development;10",
    "12": "Encourages Member States to pursue considering target 15.3 of the Sustainable Development Goals as an integrator and accelerator to achieve other Sustainable Development Goals;",
    "13": "Reiterates the need to combat desertification, reduce land degradation, restore degraded land and soil, including land affected by desertification, drought and floods, and strive to achieve a land degradation-neutral world, recalls with appreciation the voluntary land degradation neutrality target-setting programme consistent with the Convention and the work of the secretariat of the Convention and partners to assist parties to the Convention in carrying out voluntary target-setting activities, emphasizes the need for capacity-building and opportunities for parties that have yet to set land degradation neutrality targets, and in this respect reiterates its invitation to parties to the Convention that have not yet subscribed to the programme to do so;",
    "14": "Recognizes that sustainable land management approaches and technologies, including through nature-based solutions, ecosystem-based approaches and other management and conservation approaches, in line with resolution 5/5 of the United Nations Environment Assembly, constitute promising options to evaluate and consider in connection with sequestering carbon and enhancing the resilience of people and ecosystems affected by desertification, land degradation and drought, as well as the adverse effects of climate change and biodiversity loss;",
    "15": "Also recognizes the importance of applying new and innovative technologies and enabling policies and approaches, as well as sharing best practices, in combating desertification, land degradation and drought, as well as enhancing drought resilience, and requests the Secretary-General to continue to identify, as appropriate, those technologies, enabling policies and best practices in his report on the implementation of the present resolution;",
    "16": "Affirms that combating desertification, land degradation and drought and achieving land degradation neutrality through, inter alia, land conservation, protection and restoration, sustainable land management, degraded soil and terrestrial ecosystems restoration, sustainable afforestation and reforestation, which have emerged as a pathway to accelerating progress towards achieving the Sustainable Development Goals, will also contribute, among others, to safeguarding livelihoods, preventing and preparing for future pandemics and achieving a sustainable, inclusive and resilient recovery in the aftermath of the COVID-19 pandemic, and underlines the importance of integrating land conservation, protection and restoration, sustainable land management and degraded soil and terrestrial ecosystems restoration into post-COVID-19 recovery efforts, with particular emphasis on improving the livelihoods of the poorest, including rural communities and people in vulnerable situations, and recognizing and respecting Indigenous Peoples\u2019 connections to their traditional territories;",
    "17": "Encourages the entities of the United Nations system, when designing and implementing their programmes and projects, to take into account the role of achieving land degradation neutrality as a potential accelerator to achieve the Sustainable Development Goals;",
    "18": "Underlines the importance of comprehensive reporting, follow-up and review at the global, national and regional levels, as appropriate, in order to track progress in the implementation of the Convention;",
    "19": "Reiterates the invitation to parties to the Convention to take measures to ensure, as appropriate, that their relevant institutions adopt a proactive approach to drought management and integrate drought resilience and risk management, sustainable livestock and agricultural policies, drought forecasting work, sustainable water management and climate information and climate change impact assessments into relevant policymaking processes and initiatives;",
    "20": "",
    "21": "Stresses the urgent need to enhance adaptive capacity, strengthen resilience and reduce vulnerability to climate change and extreme weather events, and in this regard urges Member States to continue to engage in adaptation planning processes and to enhance cooperation in disaster risk reduction;",
    "22": "Invites the United Nations Coalition on Combating Sand and Dust Storms, which was formed at the twenty-fourth meeting of the senior officials of the Environment Management Group, in September 2018, and other relevant United Nations entities to continue their collaboration to assist affected country parties in developing and implementing national and regional policies on sand and dust storms;",
    "23": "Recognizes that gender equality and the empowerment of all women and girls remain a crucial contribution to the effective implementation of the Convention, including its 2018\u20132030 Strategic Framework, and to the achievement of the Goals of the 2030 Agenda, stresses the importance of parties to the Convention and partners striving to ensure the equal participation of women and men in planning, decision- making and implementation at all levels and further achieving gender equality and the empowerment of all women and girls, as well as women\u2019s full, equal, effective and meaningful participation in desertification, land degradation and drought-related policies and activities, and also stresses the importance of the effective implementation of the four priority thematic areas of the Gender Action Plan adopted by the parties to the Convention;",
    "24": "Reiterates the invitation to the secretariat and the Global Mechanism of the Convention to continue to collaborate and build partnerships with the secretariats of the other Rio conventions, the United Nations Entity for Gender Equality and the Empowerment of Women (UN-Women), other United Nations entities, international organizations and other relevant organizations to explore further ways of strengthening awareness-raising, improving the Gender Action Plan and developing further tools and guidelines for the use of parties in the thematic areas of the Gender Action Plan and the gender-responsive implementation of the Convention;",
    "25": "Recalls the invitation to parties to the Convention to legally recognize rights to equal use and ownership of land for women and the enhancement of women\u2019s equal access to land and land tenure security, as well as the promotion of gender- sensitive measures to combat desertification, land degradation and drought and achieve land degradation neutrality, taking into account the national context, and in this context notes the Abidjan Declaration on Achieving Gender Equality for Successful Land Restoration, which promotes all measures necessary to identify and eliminate all forms of discrimination against women, with particular attention to the rights of older women, widows, women with disabilities and young women;",
    "26": "Encourages parties to the Convention to follow the principles of implementation of the Voluntary Guidelines on the Responsible Governance of Tenure of Land, Fisheries and Forests in the Context of National Food Security 11 in the implementation of activities to combat desertification, land degradation and drought;",
    "27": "Encourages the public and private sectors to continue to invest in developing, adapting and scaling up the application of technologies, enabling policies, methods and tools to combat desertification, land degradation and drought in different regions, and to boost knowledge exchange, including of traditional knowledge with the consent of the knowledge holders, capacity-building and sharing of technologies on mutually agreed terms;",
    "28": "Encourages parties to the Convention to continue to promote the prevention of desertification, land degradation and drought with an integrated landscape approach by sustainably managing land and water resources, avoiding practices that degrade land and rehabilitating and restoring already degraded land;",
    "29": "Encourages developed countries party to the Convention and other relevant stakeholders to actively support the efforts of developing countries party to the Convention in promoting sustainable land management practices and in seeking to achieve a land degradation-neutral world by providing substantial financial resources from all sources facilitated access to appropriate technology on mutually agreed terms and other forms of support, including through capacity-building measures;",
    "30": "Recognizes the benefits gained from cooperation through the sharing of climate and weather information, forecasting and early warning systems related to desertification, land degradation and drought, while also taking account of sand and dust storms, at the global, regional and subregional levels, and in this regard likewise recognizes the need for further cooperation between parties to the Convention and relevant organizations in the sharing of related information, forecasting and early warning systems;",
    "31": "Calls upon the United Nations entities to mainstream drought resilience in their programmes when supporting countries prone to droughts or already affected, with an emphasis on enhancing preparation and resilience, noting the need for drought management through, inter alia, impactful policies, early warning systems, preparedness and mitigation, land restoration, sustainable agricultural and livestock policies and related actions to advance the neutrality of land degradation, in countries affected by drought and/or desertification;",
    "32": "Encourages all relevant entities of the United Nations system, within their respective mandates, to harness opportunities for leveraging synergies among the Convention on Biological Diversity,12 the United Nations Convention to Combat Desertification in Those Countries Experiencing Serious Drought and/or Desertification, Particularly in Africa, and the United Nations Framework Convention on Climate Change and other relevant multilateral environmental agreements, as well as the 2030 Agenda, and in this respect welcomes the ongoing efforts to strengthen synergies among the secretariats of the aforementioned conventions;",
    "33": "Welcomes the United Nations Decade for Deserts and the Fight against Desertification and the United Nations Decade on Ecosystem Restoration, as well as the convening of the 2021 United Nations Food Systems Summit, underlines the importance of combating desertification and water scarcity and restoring degraded lands to ensure sustainable food production during the COVID-19 recovery period and recognizes the critical role that healthy land has in the global economy, calls for measures to explore and promote consumption and production patterns that conserve and protect land, advance land degradation neutrality and promote the conservation, protection, sustainable management and restoration of forests, taking note, inter alia, of the Glasgow Leaders\u2019 Declaration on Forests and Land Use, and welcomes the convening of the twenty-seventh session of the Conference of the Parties to the United Nations Framework Convention on Climate Change, held in Sharm el-Sheikh, Egypt, from 6 to 20 November 2022;",
    "34": "Notes with appreciation the financial contributions that have been made by Member States and other donors towards the Land Degradation Neutrality Fund, and invites Member States and other donors to make further contributions to the Land Degradation Neutrality Fund and the drought initiative of the United Nations Convention to Combat Desertification in Those Countries Experiencing Serious Drought and/or Desertification, Particularly in Africa;",
    "35": "Decides to include, in the United Nations calendar of conferences and meetings for the year 2023 and subsequent years, the sessions of the Conference of the Parties to the Convention and each of its subsidiary bodies, and requests the Secretary-General to continue to make provisions for those sessions in the proposed programme budgets;",
    "36": "Acknowledges the commitment of the parties to the Convention to boost drought resilience by identifying the expansion of arid, semi-arid, dry subhumid areas and drylands, improving national policies and early warning systems linked to early action, learning and sharing knowledge, building partnerships and coordinating action, and mobilizing drought finance to support a shift from reactive to proactive drought management, and welcomes the announcement by the Secretary-General of the Early Warnings for All initiative to ensure that every person on Earth is protected by early warning systems within five years;",
    "37": "Takes note of decision 22/COP.15,13 which invites the parties to the Convention to promote sustainable territorial development, including multi-level governance and planning mechanisms, as appropriate, to strengthen urban-rural linkages, address desertification/land degradation and drought, including sand and dust storms, and create social and economic opportunities that reduce forced migration and displacement and increase rural resilience and livelihood stability;",
    "38": "Acknowledges the decision of the Conference of the Parties at its fifteenth session with respect to promoting decent land-based jobs for youth and land-based youth entrepreneurship and strengthening youth participation in the processes relating to the Convention;",
    "39": "Reaffirms the continuation, for a further five-year period, of the current institutional linkage and related administrative arrangements with the United Nations Secretariat, to be reviewed by both the General Assembly and the Conference of the Parties no later than 31 December 2026;",
    "40": "Requests the Secretary-General to submit to the General Assembly at its seventy-ninth session a report on the implementation of the present resolution, and decides to include in the provisional agenda of its seventy-ninth session, under the item entitled \u201cSustainable development\u201d, the sub-item entitled \u201cImplementation of the United Nations Convention to Combat Desertification in Those Countries Experiencing Serious Drought and/or Desertification, Particularly in Africa\u201d."
  },
  "agenda_items": [
    "Item 18"
  ],
  "symbol_references": []
}