{
  "symbol": "A/RES/80/79",
  "filename": "A_RES_80_79.pdf",
  "title": "80/79. Palestine refugees\u2019 properties and their revenues",
  "text": "United Nations \nA/RES/80/79\n \nGeneral Assembly \nDistr.: General \n8 December 2025 \n25-20083 (E) \n*2520083* \n \n \nEightieth session \nAgenda item 49 \nUnited Nations Relief and Works Agency for \nPalestine Refugees in the Near East \n \n \n \n \n Resolution adopted by the General Assembly \non 5 December 2025 \n \n \n[on the report of the Special Political and Decolonization Committee \n(Fourth Committee) (A/80/537, para. 15)] \n \n \n \n80/79. Palestine refugees\u2019 properties and their revenues \n \n \n \nThe General Assembly, \n \nRecalling its resolutions 194 (III) of 11 December 1948 and 36/146 C of \n16 December 1981 and all its subsequent resolutions on the question, \n \nTaking note of the report of the Secretary-General1 submitted pursuant to its \nresolution 79/89 of 4 December 2024, as well as that of the United Nations \nConciliation Commission for Palestine for the period from 1 September 2024 to \n31 August 2025,2 \n \nRecalling that the Universal Declaration of Human Rights3 and the principles of \ninternational law uphold the principle that no one shall be arbitrarily deprived of his \nor her property, \n \nRecalling in particular its resolution 394 (V) of 14 December 1950, in which it \ndirected the Conciliation Commission, in consultation with the parties concerned, to \nprescribe measures for the protection of the rights, property and interests of the \nPalestine refugees, \n \nNoting the completion of the programme of identification and evaluation of Arab \nproperty, as announced by the Conciliation Commission in its twenty-second progress \nreport,4 and the fact that the Land Office had a schedule of Arab owners and a file of \ndocuments defining the location, area and other particulars of Arab property, \n_______________ \n \n1 A/80/311. \n \n2 A/80/295. \n \n3 Resolution 217 A (III). \n \n4 Official Records of the General Assembly, Nineteenth Session, Annexes, Annex No. 11, document \nA/5700. \n\nA/RES/80/79 \nPalestine refugees\u2019 properties and their revenues\n \n25-20083\n2/2 \n \n \nExpressing its appreciation for the preservation and modernization of the \nexisting records, including the land records, of the Conciliation Commission, and \nstressing the importance of such records for a just resolution of the plight of the \nPalestine refugees in conformity with resolution 194 (III), \n \nRecalling that, in the framework of the Middle East peace process, the Palestine \nLiberation Organization and the Government of Israel agreed, in the Declaration of \nPrinciples on Interim Self-Government Arrangements of 13 September 1993, 5  to \ncommence negotiations on permanent status issues, including the important issue of \nthe refugees, \n \n1. \nReaffirms that the Palestine refugees are entitled to their property and to \nthe income derived therefrom, in conformity with the principles of equity and justice; \n \n2. \nRequests the Secretary-General to take all appropriate steps, in \nconsultation with the United Nations Conciliation Commission for Palestine, for the \nprotection of Arab property, assets and property rights in Israel; \n \n3. \nCalls once again upon Israel to render all facilities and assistance to the \nSecretary-General in the implementation of the present resolution; \n \n4. \nCalls upon all the parties concerned to provide the Secretary-General with \nany pertinent information in their possession concerning Arab property, assets and \nproperty rights in Israel that would assist him in the implementation of the present \nresolution; \n \n5. \nUrges the Palestinian and Israeli sides, as agreed between them, to deal \nwith the important issue of Palestine refugees\u2019 properties and their revenues within \nthe framework of the final status peace negotiations; \n \n6. \nRequests the Secretary-General to report to the General Assembly at its \neighty-first session on the implementation of the present resolution. \n \n55th plenary meeting \n5 December 2025 \n \n_______________ \n \n5 A/48/486-S/26560, annex. \n",
  "paragraphs": {
    "1": "Reaffirms that the Palestine refugees are entitled to their property and to the income derived therefrom, in conformity with the principles of equity and justice;",
    "2": "Requests the Secretary-General to take all appropriate steps, in consultation with the United Nations Conciliation Commission for Palestine, for the protection of Arab property, assets and property rights in Israel;",
    "3": "Calls once again upon Israel to render all facilities and assistance to the Secretary-General in the implementation of the present resolution;",
    "4": "Calls upon all the parties concerned to provide the Secretary-General with any pertinent information in their possession concerning Arab property, assets and property rights in Israel that would assist him in the implementation of the present resolution;",
    "5": "Urges the Palestinian and Israeli sides, as agreed between them, to deal with the important issue of Palestine refugees\u2019 properties and their revenues within the framework of the final status peace negotiations;",
    "6": "Requests the Secretary-General to report to the General Assembly at its eighty-first session on the implementation of the present resolution. 55th plenary meeting 5 December 2025 _______________ 5 A/48/486-S/26560, annex."
  },
  "agenda_items": [
    "Item 49"
  ],
  "symbol_references": []
}