{
  "symbol": "A/RES/79/44",
  "filename": "A_RES_79_44.pdf",
  "title": "79/44. Convening of the fourth special session of the General Assembly devoted to disarmament",
  "text": "United Nations \nA/RES/79/44\n \n \nGeneral Assembly \nDistr.: General \n9 December 2024 \n \n24-23064 (E) \n*2423064* \n \n \nSeventy-ninth session \nAgenda item 98 (g) \nGeneral and complete disarmament: convening of \nthe fourth special session of the General Assembly \ndevoted to disarmament  \n \n \n \n \n Resolution adopted by the General Assembly \non 2 December 2024 \n \n \n \n \n[on the report of the First Committee (A/79/408, para. 114)] \n \n \n \n79/44. Convening of the fourth special session of the General Assembly \ndevoted to disarmament \n \n \n \nThe General Assembly, \n \nRecalling its resolutions 49/75 I of 15 December 1994, 50/70 F of 12 December \n1995, 51/45 C of 10 December 1996, 52/38 F of 9 December 1997, 53/77 AA of \n4 December 1998, 54/54 U of 1 December 1999, 55/33 M of 20 November 2000, \n56/24 D of 29 November 2001, 57/61 of 22 November 2002, 59/71 of 3 December \n2004, 61/60 of 6 December 2006, 62/29 of 5 December 2007, 65/66 of 8 December \n2010, 72/49 of 4 December 2017, 73/42 of 5 December 2018, 74/56 of 12 December \n2019, 75/44 of 7 December 2020, 76/38 of 6 December 2021, 77/46 of 7 December \n2022 and 78/24 of 4 December 2023, as well as its decisions 58/521 of 8 December \n2003, 60/518 of 8 December 2005, 60/559 of 6 June 2006, 63/519 of 2 December \n2008, 64/515 of 2 December 2009 and 70/551 of 23 December 2015, \n \nRecalling also that, there being a consensus to do so in each case, three special \nsessions of the General Assembly devoted to disarmament were held in 1978, 1982 \nand 1988, respectively, \n \nBearing in mind the Final Document of the Tenth Special Session of the General \nAssembly, adopted by consensus at the first special session devoted to disarmament, 1  \n \nBearing in mind also the ultimate objective of general and complete \ndisarmament under effective international control, \n__________________ \n \n1  Resolution S-10/2. \n\nA/RES/79/44 \nConvening of the fourth special session of the General Assembly \ndevoted to disarmament\n \n24-23064\n2/2 \n \n \nReiterating its conviction that a special session of the General Assembly devoted \nto disarmament can set the future course of action in the fields of disarmament, arms \ncontrol, non-proliferation and related international security matters, \n \nEmphasizing the importance of multilateralism in the process of disarmament, \narms control, non-proliferation and related international security matters, \n \nRecalling the conclusion of the work of the Open-ended Working Group on the \nfourth special session of the General Assembly devoted to disarmament to consider \nthe objectives and agenda of the fourth special session, and to adopt its report and \nsubstantive recommendations by consensus, \n \nRecalling also the report of the Open-ended Working Group and the \nrecommendations contained therein,2 \n \nWelcoming the commitment of Member States to revitalize the role of the United \nNations in the field of disarmament, including by recommending that the General \nAssembly pursue work that could support preparation of a fourth special session \ndevoted to disarmament (SSOD-IV),3 \n \n1. \nRecalls the adoption by consensus of the recommendations on the \nobjectives and agenda of the fourth special session of the General Assembly devoted \nto disarmament by the Open-ended Working Group on the fourth special session of \nthe General Assembly devoted to disarmament, which was established by the \nAssembly by its resolution 65/66 and its decision 70/551 and which met in New York \nin 2016 and 2017; \n \n2. \nAlso recalls the report of the Open-ended Working Group and the \nsubstantive recommendations contained therein; \n \n3. \nReiterates its appreciation to the participants of the Open-ended Working \nGroup for their constructive contribution to its work; \n \n4. \nEncourages Member States to continue consultations on the next steps for \nthe convening of the fourth special session of the General Assembly devoted to \ndisarmament; \n \n5. \nDecides to include in the provisional agenda of its eightieth session, under \nthe item entitled \u201cGeneral and complete disarmament\u201d, the sub-item entitled \n\u201cConvening of the fourth special session of the General Assembly devoted to \ndisarmament\u201d. \n \n43rd plenary meeting \n2 December 2024 \n \n__________________ \n \n2  A/AC.268/2017/2. \n \n3  See resolution 79/1. \n",
  "paragraphs": {
    "1": "Recalls the adoption by consensus of the recommendations on the objectives and agenda of the fourth special session of the General Assembly devoted to disarmament by the Open-ended Working Group on the fourth special session of the General Assembly devoted to disarmament, which was established by the Assembly by its resolution 65/66 and its decision 70/551 and which met in New York in 2016 and 2017;",
    "2": "Also recalls the report of the Open-ended Working Group and the substantive recommendations contained therein;",
    "3": "Reiterates its appreciation to the participants of the Open-ended Working Group for their constructive contribution to its work;",
    "4": "Encourages Member States to continue consultations on the next steps for the convening of the fourth special session of the General Assembly devoted to disarmament;",
    "5": "Decides to include in the provisional agenda of its eightieth session, under the item entitled \u201cGeneral and complete disarmament\u201d, the sub-item entitled \u201cConvening of the fourth special session of the General Assembly devoted to disarmament\u201d."
  },
  "agenda_items": [
    "Item 98"
  ],
  "symbol_references": []
}