{
  "symbol": "A/RES/76/168",
  "filename": "A_RES_76_168.pdf",
  "title": "76/168. Effective promotion of the Declaration on the Rights of Persons Belonging to National or Ethnic, Religious and Linguistic Minorities",
  "text": "United Nations \nA/RES/76/168\n \n \nGeneral Assembly \nDistr.: General \n7 January 2022 \n \n \n21-19233 (E)    140122 \n*2119233* \n \n \nSeventy-sixth session \nAgenda item 74 (b) \nPromotion and protection of human rights: human \nrights questions, including alternative approaches for \nimproving the effective enjoyment of human rights and \nfundamental freedoms \n \n \n \n \n Resolution adopted by the General Assembly \non 16 December 2021 \n \n \n \n \n[on the report of the Third Committee (A/76/462/Add.2, para. 114)] \n \n \n 76/168. Effective promotion of the Declaration on the Rights of Persons \nBelonging to National or Ethnic, Religious and Linguistic Minorities \n \n \n \nThe General Assembly, \n \nRecalling its resolution 47/135 of 18 December 1992, by which it adopted the \nDeclaration on the Rights of Persons Belonging to National or Ethnic, Religious and \nLinguistic Minorities annexed to that resolution, and bearing in mind article 27 of the \nInternational Covenant on Civil and Political Rights1 as well as other relevant existing \ninternational and regional standards and national legislation, \n \nWelcoming the upcoming thirtieth anniversary of the adoption of the Declaration \nin 2022, and recognizing that, while progress has been made, the situation of persons \nbelonging to national or ethnic, religious and linguistic minorities is critical in many \nparts of the world and many challenges remain to ensure the full enjoyment of their \nrights, and that in this regard the thirtieth anniversary of the adoption of the \nDeclaration is an occasion for States to reflect on implementation gaps and to take \nmeasures for the promotion and protection of the rights of persons belonging to \nnational or ethnic, religious and linguistic minorities, \n \nRecalling its subsequent resolutions on the effective promotion of the \nDeclaration and all relevant resolutions of the Human Rights Council,  \n \nRecalling also Human Rights Council resolution 43/8 of 19 June 2020,2 in which \nthe Council considered the recommendations of the Forum on Minority Issues at its \ntwelfth session, held in November 2019, addressing education, language and the \n__________________ \n \n1  See resolution 2200 A (XXI), annex. \n \n2  See Official Records of the General Assembly, Seventy-fifth Session, Supplement No. 53 \n(A/75/53), chap. IV, sect. A. \n\nA/RES/76/168 \nEffective promotion of the Declaration on the \nRights of Persons Belonging to National or \nEthnic, Religious and Linguistic Minorities\n \n21-19233\n2/7 \n \nhuman rights of persons belonging to national or ethnic, religious and linguistic \nminorities,3  \n \nReaffirming that the promotion and protection of the rights of persons belonging \nto national or ethnic, religious and linguistic minorities and dialogue between these \nminorities and the rest of society, as well as the constructive and inclusive \ndevelopment of practices and institutional arrangements to accommodate diversity \nwithin societies, contribute to political and social stability and the prevention and \npeaceful resolution of conflicts involving the rights of persons belonging to national \nor ethnic, religious and linguistic minorities,  \n \nReaffirming also the 2030 Agenda for Sustainable Development,4 of which the \nAddis Ababa Action Agenda of the Third International Conference on Financing for \nDevelopment5 is an integral part, recalling that the Sustainable Development Goals \nand targets seek to realize the human rights of all, and stressing the need for Member \nStates to integrate the 2030 Agenda into their respective national policies and \ndevelopment frameworks, as appropriate, to promote the effective implementation, \nfollow-up and review of the 2030 Agenda, in order to ensure that no one is left behind,  \n \nExpressing concern at the frequency and severity of disputes and conflicts \ninvolving persons belonging to national or ethnic, religious and linguistic minorities \nin many countries and their often tragic consequences, and that such persons often \nsuffer disproportionately from the effects of conflicts resulting in the violation of their \nhuman rights and are particularly vulnerable to forced displacement through, inter \nalia, population transfers, revocation of previously held identity documents, refugee \nflows and forced relocation,  \n \nEmphasizing the need for reinforced efforts to realize the rights of persons \nbelonging to national or ethnic, religious and linguistic minorities, including by \naddressing economic and social conditions and marginalization, as well as to end any \ntype of discrimination against them, including by addressing multiple, aggravated and \nintersecting forms of discrimination,  \n \nRecognizing that a vast majority of stateless persons are persons belonging to \nnational or ethnic, religious and linguistic minorities, and in this regard emphasizing \nthe need for birth registration, civil registration and national identification documents \nto be provided without discrimination on any grounds, in particular race, ethnicity, \nreligion and language, in line with the 2030 Agenda, especially the target aimed at \nproviding a legal identity for all,  \n \nEmphasizing further the fundamental importance of human rights education, \ntraining and learning as well as of dialogue, including intercultural and interfaith \ndialogue, and interaction among all relevant stakeholders and members of society on \nthe promotion and protection of the rights of persons belonging to national or ethnic, \nreligious and linguistic minorities,  \n \nRecognizing the importance of realizing the right to education for all and, \nwherever possible, providing persons belonging to national or ethnic, religious and \nlinguistic minorities with adequate opportunities to learn their own language or to \nhave instruction in their own language,  \n \nEmphasizing the important role that national institutions can play in the \npromotion and protection of the rights of persons belonging to national or ethnic, \nreligious and linguistic minorities, and acknowledging the role that the United \nNations, its specialized agencies and other relevant organizations, and the Special \n__________________ \n \n3  See A/HRC/43/62. \n \n4  Resolution 70/1. \n \n5  Resolution 69/313, annex. \n\nEffective promotion of the Declaration on the \nRights of Persons Belonging to National or \nEthnic, Religious and Linguistic Minorities \nA/RES/76/168\n \n3/7\n21-19233 \n \nRapporteur of the Human Rights Council on minority issues, play in this regard by, \ninter alia, promoting the implementation of the Declaration,  \n \nExpressing concern about the spread of disinformation and misinformation, \nparticularly on social media platforms, which can be designed and implemented so as \nto mislead, to spread racism, xenophobia, negative stereotyping and stigmatization, \nto violate and abuse human rights, including the right to privacy, to impede freedom \nof expression, including the freedom to seek, receive and impart information, and to \nincite all forms of violence, hatred, intolerance, discrimination and hostility, and \nemphasizing the important contribution of journalists, civil society and academia in \ncountering this trend,  \n \n1. \nReaffirms the obligation of States to ensure that persons belonging to \nnational or ethnic, religious and linguistic minorities may exercise fully and \neffectively all human rights and fundamental freedoms without any discrimination \nand in full equality before the law, as proclaimed in the Declaration on the Rights of \nPersons Belonging to National or Ethnic, Religious and Linguistic Minorities, 6 and \ndraws attention to the relevant provisions of the Durban Declaration and Programme \nof Action,7 including the provisions on forms of multiple discrimination;  \n \n2. \nUrges States and the international community to promote and protect the \nrights of persons belonging to national or ethnic, religious and linguistic minorities, \nas set out in the Declaration on the Rights of Persons Belonging to National or Ethnic, \nReligious and Linguistic Minorities, including through the encouragement of \nconditions for the promotion of their identity, the provision of adequate education and \nthe facilitation of their participation in all aspects of the political, economic, social, \nreligious and cultural life of society and in the economic progress and development \nof their country, without discrimination, and to apply a gender perspective while \ndoing so;  \n \n3. \nEncourages States to take appropriate measures so that, wherever possible, \npersons belonging to national or ethnic, religious and linguistic minorities may have \nadequate opportunities to learn their own language or to have instruction in their own \nlanguage;  \n \n4. \nUrges States to take all appropriate measures, inter alia, constitutional, \nlegislative, administrative and other measures, for the promotion and implementation \nof the Declaration, and appeals to States to cooperate bilaterally and multilaterally, in \nparticular on the exchange of best practices and lessons learned, consistent with the \nDeclaration, in order to promote and protect the rights of persons belonging to \nnational or ethnic, religious and linguistic minorities;  \n \n5. \nRecommends that States continue to reflect on current and emerging \nchallenges facing persons belonging to national or ethnic, religious and linguistic \nminorities, including the rise in persecution on religious and ethnic grounds, the \nprevalence of statelessness among national or ethnic, religious and linguistic \nminorities, human rights violations in law enforcement and the justice sector and \nincreasing levels of hate crimes and hate speech targeting, among others, persons \nbelonging to national or ethnic, religious and linguistic minorities;  \n \n6. \nAlso recommends that States ensure that all measures taken with a view to \nimplementing the Declaration are, to the fullest extent possible, developed, designed, \nimplemented and reviewed with the full, effective and equal participation of persons \nbelonging to national or ethnic, religious and linguistic minorities;  \n__________________ \n \n6  Resolution 47/135, annex. \n \n7  See A/CONF.189/12 and A/CONF.189/12/Corr.1, chap. I. \n\nA/RES/76/168 \nEffective promotion of the Declaration on the \nRights of Persons Belonging to National or \nEthnic, Religious and Linguistic Minorities\n \n21-19233\n4/7 \n \n \n7. \nCalls upon States to undertake effective efforts to prevent and combat acts \nof violence specifically targeting persons belonging to national or ethnic, religious \nand linguistic minorities;  \n \n8. \nAlso calls upon States to take all appropriate measures to ensure the \nprotection of children who belong to national or ethnic, religious and linguistic \nminorities, in accordance with the relevant obligations under the Convention on the \nRights of the Child;8  \n \n9. \nFurther calls upon States to take all appropriate measures to ensure the \nprotection and promote the empowerment of all women and girls who belong to \nnational or ethnic, religious and linguistic minorities and are exposed to all forms of \ndiscrimination as well as sexual and gender-based violence, and also to give special \nattention to the specific needs of older persons and persons with disabilities who \nbelong to national or ethnic, religious and linguistic minorities;  \n \n10. Recommends that States and other relevant actors ensure to the fullest \nextent possible that the Declaration is translated into all minority languages and \ndisseminated widely; \n \n11. Expresses its appreciation for the successful completion, in November \n2020, of the thirteenth session of the Forum on Minority Issues, on the theme \u201cHate \nspeech, social media and minorities\u201d, which, through the wide participation of \nstakeholders, provided an important platform for the promotion of dialogue on this \ntopic and, as part of its outcome, produced recommendations to highlight the need for \nStates to comply with their human rights obligations in relation to addressing hate \nspeech on social media,9 and encourages States to take into consideration the relevant \nrecommendations of the Forum; \n \n12. Calls upon States, while bearing in mind the theme of the thirteenth \nsession of the Forum on Minority Issues and with a view to enhancing the \nimplementation of the Declaration and ensuring the realization of the rights of persons \nbelonging to national or ethnic, religious and linguistic minorities, to take appropriate \nmeasures by, inter alia: \n \n(a) \nReviewing any legislation, policy or practice that has a discriminatory or \ndisproportionately negative effect, both offline and in digital contexts, on persons \nbelonging to national or ethnic, religious and linguistic minorities, with a view to \nconsidering its amendment; \n \n(b) \nConsidering ratifying, acceding to and adhering to all relevant \ninternational instruments that protect and promote the rights of persons belonging to \nnational or ethnic, religious and linguistic minorities with the aim of addressing and \ncountering the spread of racism, xenophobia, negative stereotyping and \nstigmatization;  \n \n(c) \nStrongly condemning any advocacy of national, racial or religious hatred \nthat constitutes incitement to discrimination, hostility or violence, and adopting and \nimplementing measures to criminalize incitement to imminent violence based on \nnationality, race, religion or belief, both online and offline, while respecting all \ninternationally recognized human rights and fundamental freedoms;  \n \n(d) \nEnsuring that persons belonging to national or ethnic, religious and \nlinguistic minorities have access to justice and remedy for human rights violations, \nabuses and/or crimes, including crimes committed on the basis of national, racial or \nreligious hatred;  \n__________________ \n \n8  United Nations, Treaty Series, vol. 1577, No. 27531. \n \n9  See A/HRC/46/58. \n\nEffective promotion of the Declaration on the \nRights of Persons Belonging to National or \nEthnic, Religious and Linguistic Minorities \nA/RES/76/168\n \n5/7\n21-19233 \n \n \n(e) \nStrengthening international cooperation, including with international and \nregional organizations, and cooperation with the private sector, including technology \ncompanies, national human rights institutions and civil society in order to share \nexpertise, knowledge and effective practices in addressing and countering hate speech \nagainst persons belonging to national or ethnic, religious and linguistic minorities, \nwhile respecting and promoting human rights, including in the development and use \nof digital technologies;  \n \n13. Takes note of the report of the Secretary-General on the effective \npromotion of the Declaration10 and the reports of the Special Rapporteur of the Human \nRights Council on minority issues and the special focus on persons belonging to \nnational or ethnic, religious and linguistic minorities, their equal participation, social \nand economic development and the 2030 Agenda for Sustainable Development; 11  \n \n14. Commends the Special Rapporteur for the work that has been done and the \nimportant role played in raising the level of awareness of and in giving added \nvisibility to the rights of persons belonging to national or ethnic, religious and \nlinguistic minorities;  \n \n15. Calls upon all States to cooperate with and assist the Special Rapporteur \nin the performance of the tasks and duties mandated to him, to provide him with all \nthe necessary information requested and to seriously consider responding promptly \nand favourably to the requests of the Special Rapporteur to visit their countries in \norder to enable him to fulfil his duties effectively;  \n \n16. Encourages the specialized agencies, regional organizations, national \nhuman rights institutions and non-governmental organizations to develop regular \ndialogue and cooperation with the Special Rapporteur, as well as to continue to \ncontribute to the promotion and protection of the rights of persons belonging to \nnational or ethnic, religious and linguistic minorities;  \n \n17. Calls upon the United Nations High Commissioner for Human Rights to \ncontinue to promote, within her mandate, the implementation of the Declaration, and \nto engage in a dialogue with Governments for that purpose and regularly update and \ndisseminate widely the United Nations Guide for Minorities;  \n \n18. Welcomes the inter-agency cooperation among United Nations agencies, \nfunds and programmes on minority issues, notes the activities of the United Nations \nnetwork on racial discrimination and protection of minorities, and urges United \nNations agencies, funds and programmes to further increase their coordination and \ncooperation by, inter alia, developing policies on the promotion and protection of the \nrights of persons belonging to minorities, drawing also on relevant outcomes of the \nForum on Minority Issues and taking into account the work of relevant regional \norganizations, in particular in the light of the upcoming thirtieth anniversary of the \nadoption of the Declaration on the Rights of Persons Belonging to National or Ethnic, \nReligious and Linguistic Minorities;  \n \n19. Calls upon the Secretary-General to make available, at the request of \nGovernments concerned, qualified expertise on minority issues, including in the \ncontext of efforts to address and counter hate speech while fully respecting the right \nto freedom of expression, to assist in resolving existing or potential situations \ninvolving minorities;  \n \n20. Invites the human rights treaty bodies, as well as special procedures of the \nHuman Rights Council, to continue to give attention, within their respective \nmandates, to situations and rights of persons belonging to national or ethnic, religious \n__________________ \n \n10  A/76/255. \n \n11  A/75/211 and A/76/162. \n\nA/RES/76/168 \nEffective promotion of the Declaration on the \nRights of Persons Belonging to National or \nEthnic, Religious and Linguistic Minorities\n \n21-19233\n6/7 \n \nand linguistic minorities and in this regard to take into consideration relevant \nrecommendations of the Forum on Minority Issues;  \n \n21. Invites the United Nations mechanisms and bodies, the specialized \nagencies and regional organizations, within their respective mandates, to continue to \ncontribute to the protection and the prevention of violations of the rights of persons \nbelonging to national or ethnic, religious and linguistic minorities, including by \nstrengthening cooperation in respect of information gathering and improving the \ninformation flow between themselves and with States;  \n \n22. Encourages regional intergovernmental bodies, within their respective \nregions, to promote greater attention to the rights of persons belonging to national or \nethnic, religious and linguistic minorities by, inter alia, actively raising awareness of \nand promoting the Declaration in their work, encouraging its implementation at the \nnational level and considering the creation of thematic and/or special mechanisms on \nthis issue;  \n \n23. Encourages national human rights institutions to pay due attention to the \nrights of persons belonging to national or ethnic, religious and linguistic minorities, \nincluding by monitoring situations of potential threats for persons belonging to national \nor ethnic, religious and linguistic minorities, and by investigating and reporting, in \naccordance with the principles relating to the status of national institutions for the \npromotion and protection of human rights (the Paris Principles)12 and their respective \nmandates, episodes of targeted violence against persons belonging to minorities, \nincluding, when necessary, to regional and international bodies;  \n \n24. Encourages civil society, including non-governmental organizations, to \npromote awareness of the Declaration, in particular in the light of the upcoming \nthirtieth anniversary of its adoption, and to review the extent to which it integrates \nthe rights of persons belonging to national or ethnic, religious and linguistic \nminorities and the Declaration into its work, as well as to inform persons belonging \nto national or ethnic, religious and linguistic minorities about their rights;  \n \n25. Requests the Special Rapporteur to report annually to the General \nAssembly and include recommendations for effective strategies for the better \nimplementation of the rights of persons belonging to national or ethnic, religious and \nlinguistic minorities;  \n \n26. Invites the Office of the United Nations High Commissioner for Human \nRights, United Nations entities and Member States to support and collaborate in the \norganization of regional forums on minority issues initiated by the Special Rapporteur \nin accordance with his mandate, in order to complement and enrich the work and \nrecommendations of the Forum on Minority Issues;  \n \n27. Requests the President of the General Assembly to convene a high-level \nmeeting to mark the commemoration of the thirtieth anniversary of the adoption of \nthe Declaration on the Rights of Persons Belonging to National or Ethnic, Religious \nand Linguistic Minorities, on the second day of the general debate of the seventy-\nseventh session, consisting of an opening meeting to hear statements by the President \nof the General Assembly, the Secretary-General and the United Nations High \nCommissioner for Human Rights, and a closing meeting, as well as a general debate, \nand also requests the President of the General Assembly to finalize the organizational \narrangements for the high-level meeting, in consultation with Member States, and to \nprepare a summary of the discussions; \n \n28. Requests the Secretary-General to submit to the General Assembly at its \nseventy-eighth session a report on the implementation of the present resolution, \n__________________ \n \n12  Resolution 48/134, annex. \n\nEffective promotion of the Declaration on the \nRights of Persons Belonging to National or \nEthnic, Religious and Linguistic Minorities \nA/RES/76/168\n \n7/7\n21-19233 \n \nincluding information on activities undertaken by Member States, the Office of the \nHigh Commissioner, the Special Rapporteur, relevant United Nations entities and \nother relevant stakeholders to enhance the implementation of the Declaration and to \nensure the realization of the rights of persons belonging to national or ethnic, religious \nand linguistic minorities, with a special focus on the thirtieth anniversary of the \nadoption of the Declaration in 2022;  \n \n29. Decides to continue consideration of the question at its seventy-eighth \nsession under the item entitled \u201cPromotion and protection of human rights\u201d.  \n \n53rd plenary meeting \n16 December 2021 \n \n \n",
  "paragraphs": {
    "1": "Reaffirms the obligation of States to ensure that persons belonging to national or ethnic, religious and linguistic minorities may exercise fully and effectively all human rights and fundamental freedoms without any discrimination and in full equality before the law, as proclaimed in the Declaration on the Rights of Persons Belonging to National or Ethnic, Religious and Linguistic Minorities, 6 and draws attention to the relevant provisions of the Durban Declaration and Programme of Action,7 including the provisions on forms of multiple discrimination;",
    "2": "Urges States and the international community to promote and protect the rights of persons belonging to national or ethnic, religious and linguistic minorities, as set out in the Declaration on the Rights of Persons Belonging to National or Ethnic, Religious and Linguistic Minorities, including through the encouragement of conditions for the promotion of their identity, the provision of adequate education and the facilitation of their participation in all aspects of the political, economic, social, religious and cultural life of society and in the economic progress and development of their country, without discrimination, and to apply a gender perspective while doing so;",
    "3": "Encourages States to take appropriate measures so that, wherever possible, persons belonging to national or ethnic, religious and linguistic minorities may have adequate opportunities to learn their own language or to have instruction in their own language;",
    "4": "Urges States to take all appropriate measures, inter alia, constitutional, legislative, administrative and other measures, for the promotion and implementation of the Declaration, and appeals to States to cooperate bilaterally and multilaterally, in particular on the exchange of best practices and lessons learned, consistent with the Declaration, in order to promote and protect the rights of persons belonging to national or ethnic, religious and linguistic minorities;",
    "5": "Recommends that States continue to reflect on current and emerging challenges facing persons belonging to national or ethnic, religious and linguistic minorities, including the rise in persecution on religious and ethnic grounds, the prevalence of statelessness among national or ethnic, religious and linguistic minorities, human rights violations in law enforcement and the justice sector and increasing levels of hate crimes and hate speech targeting, among others, persons belonging to national or ethnic, religious and linguistic minorities;",
    "6": "Also recommends that States ensure that all measures taken with a view to implementing the Declaration are, to the fullest extent possible, developed, designed, implemented and reviewed with the full, effective and equal participation of persons belonging to national or ethnic, religious and linguistic minorities;",
    "7": "Calls upon States to undertake effective efforts to prevent and combat acts of violence specifically targeting persons belonging to national or ethnic, religious and linguistic minorities;",
    "8": "Also calls upon States to take all appropriate measures to ensure the protection of children who belong to national or ethnic, religious and linguistic minorities, in accordance with the relevant obligations under the Convention on the Rights of the Child;8",
    "9": "Further calls upon States to take all appropriate measures to ensure the protection and promote the empowerment of all women and girls who belong to national or ethnic, religious and linguistic minorities and are exposed to all forms of discrimination as well as sexual and gender-based violence, and also to give special attention to the specific needs of older persons and persons with disabilities who belong to national or ethnic, religious and linguistic minorities;",
    "10": "Recommends that States and other relevant actors ensure to the fullest extent possible that the Declaration is translated into all minority languages and disseminated widely;",
    "11": "Expresses its appreciation for the successful completion, in November 2020, of the thirteenth session of the Forum on Minority Issues, on the theme \u201cHate speech, social media and minorities\u201d, which, through the wide participation of stakeholders, provided an important platform for the promotion of dialogue on this topic and, as part of its outcome, produced recommendations to highlight the need for States to comply with their human rights obligations in relation to addressing hate speech on social media,9 and encourages States to take into consideration the relevant recommendations of the Forum;",
    "12": "Calls upon States, while bearing in mind the theme of the thirteenth session of the Forum on Minority Issues and with a view to enhancing the implementation of the Declaration and ensuring the realization of the rights of persons belonging to national or ethnic, religious and linguistic minorities, to take appropriate measures by, inter alia: (a) Reviewing any legislation, policy or practice that has a discriminatory or disproportionately negative effect, both offline and in digital contexts, on persons belonging to national or ethnic, religious and linguistic minorities, with a view to considering its amendment; (b) Considering ratifying, acceding to and adhering to all relevant international instruments that protect and promote the rights of persons belonging to national or ethnic, religious and linguistic minorities with the aim of addressing and countering the spread of racism, xenophobia, negative stereotyping and stigmatization; (c) Strongly condemning any advocacy of national, racial or religious hatred that constitutes incitement to discrimination, hostility or violence, and adopting and implementing measures to criminalize incitement to imminent violence based on nationality, race, religion or belief, both online and offline, while respecting all internationally recognized human rights and fundamental freedoms; (d) Ensuring that persons belonging to national or ethnic, religious and linguistic minorities have access to justice and remedy for human rights violations, abuses and/or crimes, including crimes committed on the basis of national, racial or religious hatred; (e) Strengthening international cooperation, including with international and regional organizations, and cooperation with the private sector, including technology companies, national human rights institutions and civil society in order to share expertise, knowledge and effective practices in addressing and countering hate speech against persons belonging to national or ethnic, religious and linguistic minorities, while respecting and promoting human rights, including in the development and use of digital technologies;",
    "13": "Takes note of the report of the Secretary-General on the effective promotion of the Declaration10 and the reports of the Special Rapporteur of the Human Rights Council on minority issues and the special focus on persons belonging to national or ethnic, religious and linguistic minorities, their equal participation, social and economic development and the 2030 Agenda for Sustainable Development; 11",
    "14": "Commends the Special Rapporteur for the work that has been done and the important role played in raising the level of awareness of and in giving added visibility to the rights of persons belonging to national or ethnic, religious and linguistic minorities;",
    "15": "Calls upon all States to cooperate with and assist the Special Rapporteur in the performance of the tasks and duties mandated to him, to provide him with all the necessary information requested and to seriously consider responding promptly and favourably to the requests of the Special Rapporteur to visit their countries in order to enable him to fulfil his duties effectively;",
    "16": "Encourages the specialized agencies, regional organizations, national human rights institutions and non-governmental organizations to develop regular dialogue and cooperation with the Special Rapporteur, as well as to continue to contribute to the promotion and protection of the rights of persons belonging to national or ethnic, religious and linguistic minorities;",
    "17": "Calls upon the United Nations High Commissioner for Human Rights to continue to promote, within her mandate, the implementation of the Declaration, and to engage in a dialogue with Governments for that purpose and regularly update and disseminate widely the United Nations Guide for Minorities;",
    "18": "Welcomes the inter-agency cooperation among United Nations agencies, funds and programmes on minority issues, notes the activities of the United Nations network on racial discrimination and protection of minorities, and urges United Nations agencies, funds and programmes to further increase their coordination and cooperation by, inter alia, developing policies on the promotion and protection of the rights of persons belonging to minorities, drawing also on relevant outcomes of the Forum on Minority Issues and taking into account the work of relevant regional organizations, in particular in the light of the upcoming thirtieth anniversary of the adoption of the Declaration on the Rights of Persons Belonging to National or Ethnic, Religious and Linguistic Minorities;",
    "19": "Calls upon the Secretary-General to make available, at the request of Governments concerned, qualified expertise on minority issues, including in the context of efforts to address and counter hate speech while fully respecting the right to freedom of expression, to assist in resolving existing or potential situations involving minorities;",
    "20": "Invites the human rights treaty bodies, as well as special procedures of the Human Rights Council, to continue to give attention, within their respective mandates, to situations and rights of persons belonging to national or ethnic, religious and linguistic minorities and in this regard to take into consideration relevant recommendations of the Forum on Minority Issues;",
    "21": "Invites the United Nations mechanisms and bodies, the specialized agencies and regional organizations, within their respective mandates, to continue to contribute to the protection and the prevention of violations of the rights of persons belonging to national or ethnic, religious and linguistic minorities, including by strengthening cooperation in respect of information gathering and improving the information flow between themselves and with States;",
    "22": "Encourages regional intergovernmental bodies, within their respective regions, to promote greater attention to the rights of persons belonging to national or ethnic, religious and linguistic minorities by, inter alia, actively raising awareness of and promoting the Declaration in their work, encouraging its implementation at the national level and considering the creation of thematic and/or special mechanisms on this issue;",
    "23": "Encourages national human rights institutions to pay due attention to the rights of persons belonging to national or ethnic, religious and linguistic minorities, including by monitoring situations of potential threats for persons belonging to national or ethnic, religious and linguistic minorities, and by investigating and reporting, in accordance with the principles relating to the status of national institutions for the promotion and protection of human rights (the Paris Principles)12 and their respective mandates, episodes of targeted violence against persons belonging to minorities, including, when necessary, to regional and international bodies;",
    "24": "Encourages civil society, including non-governmental organizations, to promote awareness of the Declaration, in particular in the light of the upcoming thirtieth anniversary of its adoption, and to review the extent to which it integrates the rights of persons belonging to national or ethnic, religious and linguistic minorities and the Declaration into its work, as well as to inform persons belonging to national or ethnic, religious and linguistic minorities about their rights;",
    "25": "Requests the Special Rapporteur to report annually to the General Assembly and include recommendations for effective strategies for the better implementation of the rights of persons belonging to national or ethnic, religious and linguistic minorities;",
    "26": "Invites the Office of the United Nations High Commissioner for Human Rights, United Nations entities and Member States to support and collaborate in the organization of regional forums on minority issues initiated by the Special Rapporteur in accordance with his mandate, in order to complement and enrich the work and recommendations of the Forum on Minority Issues;",
    "27": "Requests the President of the General Assembly to convene a high-level meeting to mark the commemoration of the thirtieth anniversary of the adoption of the Declaration on the Rights of Persons Belonging to National or Ethnic, Religious and Linguistic Minorities, on the second day of the general debate of the seventy- seventh session, consisting of an opening meeting to hear statements by the President of the General Assembly, the Secretary-General and the United Nations High Commissioner for Human Rights, and a closing meeting, as well as a general debate, and also requests the President of the General Assembly to finalize the organizational arrangements for the high-level meeting, in consultation with Member States, and to prepare a summary of the discussions;",
    "28": "Requests the Secretary-General to submit to the General Assembly at its seventy-eighth session a report on the implementation of the present resolution, including information on activities undertaken by Member States, the Office of the High Commissioner, the Special Rapporteur, relevant United Nations entities and other relevant stakeholders to enhance the implementation of the Declaration and to ensure the realization of the rights of persons belonging to national or ethnic, religious and linguistic minorities, with a special focus on the thirtieth anniversary of the adoption of the Declaration in 2022;",
    "29": "Decides to continue consideration of the question at its seventy-eighth session under the item entitled \u201cPromotion and protection of human rights\u201d."
  },
  "agenda_items": [
    "Item 74"
  ],
  "symbol_references": []
}