{
  "symbol": "A/RES/73/292",
  "filename": "A_RES_73_292.pdf",
  "title": "73/292. 2020 United Nations Conference to Support the Implementation of Sustainable Development Goal 14: Conserve and sustainably use the oceans, seas and marine resources for sustainable development",
  "text": "United Nations \nA/RES/73/292\n \n \nGeneral Assembly \nDistr.: General \n14 May 2019 \n \n19-07696 (E)    210519     \n*1907696* \n \n \nSeventy-third session \nAgenda items 20 and 78 (a) \n \n \n \n \n Resolution adopted by the General Assembly on 9 May 2019 \n \n \n \n \n[without reference to a Main Committee (A/73/L.82 and A/73/L.82/Add.1)] \n \n \n 73/292. 2020 United Nations Conference to Support the Implementation of \nSustainable Development Goal 14: Conserve and sustainably use \nthe oceans, seas and marine resources for sustainable development \n \n \n \nThe General Assembly,  \n \nRecalling the outcome document of the United Nations Conference on \nSustainable Development, held in Rio de Janeiro, Brazil, from 20 to 22 June 2012, \nentitled \u201cThe future we want\u201d,1 \n \nReaffirming its resolution 70/1 of 25 September 2015, entitled \u201cTransforming \nour world: the 2030 Agenda for Sustainable Development\u201d, in which it adopted a \ncomprehensive, far-reaching and people-centred set of universal and transformative \nSustainable Development Goals and targets, its commitment to working tirelessly for \nthe full implementation of the Agenda by 2030, its recognition that eradicating \npoverty in all its forms and dimensions, including extreme poverty, is the greatest \nglobal challenge and an indispensable requirement for sustainable development, its \ncommitment to achieving sustainable development in its three dimensions \u2013 \neconomic, social and environmental \u2013 in a balanced and integrated manner, and to \nbuilding upon the achievements of the Millennium Development Goals and seeking \nto address their unfinished business,  \n \nReaffirming also its resolution 69/313 of 27 July 2015 on the Addis Ababa \nAction Agenda of the Third International Conference on Financing for Development, \nwhich is an integral part of the 2030 Agenda for Sustainable Development, supports \nand complements it, helps to contextualize its means of implementation targets with \nconcrete policies and actions, and reaffirms the strong political commitment to \naddress the challenge of financing and creating an enabling environment at all levels \nfor sustainable development in the spirit of global partnership and solidarity,  \n \nReaffirming further that the implementation of the Sustainable Development \nGoals will depend upon a revitalized and enhanced Global Partnership for Sustainable \nDevelopment, bringing together Governments, civil society, the private sector, the \n__________________ \n \n1  Resolution 66/288, annex. \n\nA/RES/73/292 \n2020 United Nations Conference to Support the Implementation of \nSustainable Development Goal 14: Conserve and sustainably use \nthe oceans, seas and marine resources for sustainable development \n \n19-07696\n2/23 \n \nUnited Nations system and other actors, and noting in this regard the interest \nexpressed in holding future conferences or events at a high level that would \ncomplement but not duplicate existing efforts and activities to support the \nimplementation of and to maintain political momentum to achieve Sustainable \nDevelopment Goal 14,  \n \nRecognizing the central role of the General Assembly and the Economic and \nSocial Council, and the high-level political forum on sustainable development held \nunder their auspices, as well as the significant role of the United Nations Open-ended \nInformal Consultative Process on Oceans and the Law of the Sea and the important \ncontribution of all relevant specialized agencies, funds and programmes of the United \nNations in the implementation of Sustainable Development Goal 14,  \n \nRecalling that, pursuant to its resolutions 70/226 of 22 December 2015 and \n70/303 of 9 September 2016, the United Nations Conference to Support the \nImplementation of Sustainable Development Goal 14: Conserve and sustainably use \nthe oceans, seas and marine resources for sustainable development was convened at \nUnited Nations Headquarters from 5 to 9 June 2017, coinciding with World Oceans \nDay, to support the implementation of Sustainable Development Goal 14,  \n \nRecalling also its resolution 71/312 of 6 July 2017, in which it endorsed the \ndeclaration entitled \u201cOur ocean, our future: call for action\u201d adopted by the United \nNations Conference to Support the Implementation of Sustainable Development \nGoal 14: Conserve and sustainably use the oceans, seas and marine resources for \nsustainable development, and in this regard affirming the important role of the \ndeclaration in demonstrating the collective will to take action to conserve and \nsustainably use our oceans, seas and marine resources for sustainable development,  \n \nRecalling further that the Sustainable Development Goals and targets are \nintegrated and indivisible and balance the three dimensions of sustainable \ndevelopment: the economic, social and environmental, \n \nRecognizing the important contributions of the partnership dialogues and \nvoluntary commitments made in the context of the United Nations Conference to \nSupport the Implementation of Sustainable Development Goal 14: Conserve and \nsustainably use the oceans, seas and marine resources for sustainable development to \nthe effective and timely implementation of Sustainable Development Goal 14,  \n \nRecalling its call upon all stakeholders to urgently undertake, inter alia, the \nactions highlighted in the declaration entitled \u201cOur ocean, our future: call for action\u201d \nand implement the respective voluntary commitments pledged by individual Member \nStates and other stakeholders during the United Nations Conference to Support the \nImplementation of Sustainable Development Goal 14: Conserve and sustainably use \nthe oceans, seas and marine resources for sustainable development,  \n \nRecalling also that the high-level political forum on sustainable development \nconvened under the auspices of the Economic and Social Council, held from 10 to \n19 July 2017, reviewed in depth Sustainable Development Goals 1, 2, 3, 5, 9 and 14, \nas well as Goal 17, which is reviewed annually, and that the outcome of the United \nNations Conference to Support the Implementation of Sustainable Development \nGoal 14: Conserve and sustainably use the oceans, seas and marine resources for \nsustainable development was welcomed in the ministerial declaration of the 2017 \nhigh-level political forum convened under the auspices of the Council on the theme \n\u201cEradicating poverty and promoting prosperity in a changing world\u201d,2 \n__________________ \n \n2  Official Records of the General Assembly, Seventy-second Session, Supplement No. 3 (A/72/3), \nchap. VI, sect. E. \n\n2020 United Nations Conference to Support the Implementation of \nSustainable Development Goal 14: Conserve and sustainably use \nthe oceans, seas and marine resources for sustainable development \nA/RES/73/292\n \n3/23\n19-07696 \n \n \nRecognizing synergies between the 2030 Agenda for Sustainable Development, \nthe Addis Ababa Action Agenda of the Third International Conference on Financing \nfor Development, the Paris Agreement adopted under the United Nations Framework \nConvention on Climate Change 3  and the Sendai Framework for Disaster Risk \nReduction 2015\u20132030,4 \n \nAcknowledging the importance of the conservation and sustainable use of the \noceans, seas and marine resources for delivering on the Sustainable Development \nGoals and the 2030 Agenda for Sustainable Development as a whole,  \n \n1. \nDecides to convene the high-level 2020 United Nations Conference to \nSupport the Implementation of Sustainable Development Goal 14: Conserve and \nsustainably use the oceans, seas and marine resources for sustainable development in \nLisbon, from 2 to 6 June 2020, to support the implementation of Sustainable \nDevelopment Goal 14;  \n \n2. \nAlso decides that all costs relating to the Conference and its preparation \nshall be financed through extrabudgetary resources;  \n \n3. \nWelcomes the generous offer by the Governments of Kenya and Portugal \nto co-host and assume the costs of the Conference;  \n \n4. \nReiterates the call made in the declaration entitled \u201cOur ocean, our future: \ncall for action\u201d5 for action to be taken on an urgent basis to conserve and sustainably \nuse the oceans, seas and marine resources for sustainable development; \n \n5. \nDecides that the Conference shall:  \n \n(a) \nBuild on existing successful partnerships and stimulate innovative and \nconcrete new partnerships to advance the implementation of Goal 14;  \n \n(b) \nSupport further action to conserve and sustainably use the oceans, seas and \nmarine resources for sustainable development, giving due consideration to the call \nmade in the declaration entitled \u201cOur ocean, our future: call for action\u201d;  \n \n(c) \nIdentify further ways and means to support the implementation of Goal 14; \n \n(d) \nInvolve all relevant stakeholders, bringing together Governments, the \nUnited Nations system, intergovernmental organizations, international financial \ninstitutions, other interested international bodies, non-governmental organizations, \ncivil society organizations, academic institutions, the scientific community, the \nprivate sector, philanthropic organizations and other actors to assess challenges and \nopportunities relating to, as well as actions taken towards, the implementation of \nGoal 14;  \n \n(e) \nShare the experiences gained at the national, regional and international \nlevels in the implementation of Goal 14;  \n \n(f) \nIdentify possible challenges and obstacles relating to the achievement of \nall the targets under Goal 14, as well as opportunities and innovative ways and means \nto support their implementation;  \n \n(g) \nInvite Member States and other relevant stakeholders to provide an update \non the implementation of the voluntary commitments made in the context of the \nUnited Nations Conference to Support the Implementation of Sustainable \nDevelopment Goal 14: Conserve and sustainably use the oceans, seas and marine \nresources for sustainable development, and invite new voluntary commitments in \n__________________ \n \n3  See FCCC/CP/2015/10/Add.1, decision 1/CP.21, annex. \n \n4  Resolution 69/283, annex II. \n \n5  Resolution 71/312, annex. \n\nA/RES/73/292 \n2020 United Nations Conference to Support the Implementation of \nSustainable Development Goal 14: Conserve and sustainably use \nthe oceans, seas and marine resources for sustainable development \n \n19-07696\n4/23 \n \nsupport of Goal 14, as well as support the sharing of experiences and lessons learned \non their implementation;  \n \n(h) \nShare ongoing efforts, successes and challenges between relevant ocean-\nrelated initiatives and processes with a view to promoting collaboration, cooperation \nand coordination, as well as preventing the unnecessary duplication of efforts, to \nensure further efficiency and effectiveness in support of Goal 14;  \n \n(i) \nContribute to the follow-up and review process of the 2030 Agenda for \nSustainable Development6 by providing an input to the high-level political forum on \nsustainable development, in accordance with resolutions 67/290 of 9 July 2013, 70/1, \nand 70/299 of 29 July 2016, unless otherwise agreed in line with the aforementioned \nresolutions, on the implementation of Goal 14, including on opportunities to \nstrengthen progress in the future;  \n \n6. \nAlso decides that the overarching theme of the Conference shall be \n\u201cScaling up ocean action based on science and innovation for the implementation of \nGoal 14: stocktaking, partnerships and solutions\u201d;  \n \n7. \nEncourages participation in the Conference at the highest possible level;  \n \n8. \nDecides that the Conference shall elect from among the representatives of \nparticipating States the following officers: two Presidents, one from Kenya and one \nfrom Portugal, and 13 Vice-Presidents, 7  one of whom shall be designated as \nRapporteur-General;  \n \n9. \nAlso decides that the Conference shall comprise eight plenary meetings \nand eight interactive dialogues, to be held from 2 to 6 June 2020;  \n \n10. Further decides that the first plenary meeting of the Conference will \ncommence at 9 a.m. on 2 June and will resume at 10 a.m. on 3 June to continue with \nthe opening of the Conference and that the plenary meetings will be held as follows:  \n \nTuesday, 2 June: from 9 to 10 a.m.  \n \nWednesday, 3 June: from 10 a.m. to 1 p.m. and from 3 to 6 p.m. \n \nThursday, 4 June: from 10 a.m. to 1 p.m. and from 3 to 6 p.m. \n \nFriday, 5 June: from 10 a.m. to 1 p.m. and from 3 to 6 p.m. \n \nSaturday, 6 June: from 10 a.m. to 1 p.m. and from 3 to 6 p.m.;  \n \n11. \nDecides that the interactive dialogues will be held in parallel with the \nplenary meetings, as follows:  \n \nTuesday, 2 June: from 10 a.m. to 1 p.m. and from 3 to 6 p.m. \n \nWednesday, 3 June: from 3 to 6 p.m. \n \nThursday, 4 June: from 10 a.m. to 1 p.m. and from 3 to 6 p.m. \n \nFriday, 5 June: from 10 a.m. to 1 p.m. and from 3 to 6 p.m.  \n \nSaturday 6 June: from 10 a.m. to 1 p.m.;  \n \n12. Also decides that the interactive dialogues shall be collaborative and \nmulti-stakeholder in nature and will focus on recommendations to support the \nimplementation of Goal 14, including through strengthened cooperation, building on \n__________________ \n \n6  Resolution 70/1. \n \n7  Three from each of the following groups: African States; Asia-Pacific States; Eastern European \nStates; Latin American and Caribbean States; and Western European and other States. The \nelection of the Presidents will, however, have the effect of reducing by one the number of \nVice-Presidents allocated to the regions from which each of the Presidents is elected. \n\n2020 United Nations Conference to Support the Implementation of \nSustainable Development Goal 14: Conserve and sustainably use \nthe oceans, seas and marine resources for sustainable development \nA/RES/73/292\n \n5/23\n19-07696 \n \nexisting successful partnerships and stimulating innovative and concrete new ones, \ntaking into account the theme of the Conference;  \n \n13. Further decides that the organizational arrangements for the interactive \ndialogues will be as follows: \n \n(a) \nEach interactive dialogue will be presided over by two co-chairs, one from \na developing country and one from a developed country, to be appointed by the \nPresidents of the Conference;  \n \n(b) \nThe Secretary-General of the Conference will select a moderator and up \nto four panellists for each of the interactive dialogues. The panel discussions, \nfacilitated by the moderator, will be followed by an interactive debate among States \nand other relevant stakeholders;  \n \n14. Recommends the provisional agenda set forth in annex I to the present \nresolution for adoption by the Conference;  \n \n15. Decides that the Conference shall be organized in accordance with the \norganization of work set forth in annex II to the present resolution;  \n \n16. Recommends the provisional rules of procedure set forth in annex III to \nthe present resolution for adoption by the Conference;  \n \n17. Requests the Secretary-General to appoint a Secretary-General of the \nConference to serve as focal point within the Secretariat for providing support to the \norganization of the Conference;  \n \n18. Also requests the Secretary-General to appoint a Special Adviser to the \nPresidents of the Conference on oceans and legal matters;  \n \n19. Decides that the Conference shall adopt, by consensus, a brief, concise, \naction-oriented and intergovernmentally agreed declaration focusing on, and \nhighlighting, the science-based and innovative areas of action to support the \nimplementation of Goal 14 and a report containing the co-chairs\u2019 summaries of the \ninteractive dialogues, as well as a list of voluntary commitments for the implementation \nof Goal 14 registered after 9 June 2017 and announced at the Conference;  \n \n20. Requests the President of the General Assembly to appoint two \nco-facilitators, one from a developing country and one from a developed country, to \noversee the preparatory process and to conclude the intergovernmental consultations \non the declaration by May 2020;  \n \n21. Also requests the President of the General Assembly to convene a two-day \npreparatory meeting, in February 2020, at United Nations Headquarters in New York, \nto be chaired by the two co-facilitators, with interpretation services on an as-available \nbasis, with a view to considering the themes for the interactive dialogues and elements \nfor the declaration, taking into consideration paragraph 19 above, in particular the \ncall for a brief, concise, action-oriented and intergovernmentally agreed declaration;  \n \n22. Requests the Secretary-General to prepare a background note by the end \nof January 2020, including a proposal for themes of the interactive dialogues, for the \npreparatory meeting;  \n \n23. Requests the Secretary-General of the Conference to prepare concept \npapers on each of the themes of the interactive dialogues, taking into account the \nrelevant ocean-related processes of the General Assembly and other possible \ncontributions, and in that regard invites the stakeholders referred to in paragraph 5 (d) \nabove to submit inputs;  \n \n24. Requests the co-facilitators to present a brief, concise and action-oriented \ndraft declaration no later than March 2020, taking into account the deliberations of \nthe preparatory meeting and other inputs, without prejudice to the intergovernmental \n\nA/RES/73/292 \n2020 United Nations Conference to Support the Implementation of \nSustainable Development Goal 14: Conserve and sustainably use \nthe oceans, seas and marine resources for sustainable development \n \n19-07696\n6/23 \n \nconference, under the auspices of the United Nations, to consider the \nrecommendations of the Preparatory Committee established by General Assembly \nresolution 69/292 of 19 June 2015 on the elements and to elaborate the text of an \ninternational legally binding instrument under the United Nations Convention on the \nLaw of Sea on the conservation and sustainable use of marine biological diversity of \nareas beyond national jurisdiction, with a view to developing the instrument as soon \nas possible, which was convened by the Assembly in its resolution 72/249 of \n24 December 2017;  \n \n25. Requests the President of the General Assembly to finalize the \norganizational arrangements for the Conference no later than April 2020;  \n \n26. Decides that the Conference and its preparatory process shall be open to \nall States Members of the United Nations, members of the specialized agencies and \nparties to the United Nations Convention on the Law of the Sea,8 recognizing that \nneither participation in the preparatory process and the Conference nor its outcome \nmay affect the legal status of non-parties to the Convention or any other related \nagreements with regard to those instruments, or the legal status of parties to the \nConvention or any other related agreements with regard to those instruments;  \n \n27. Invites other relevant stakeholders, including organizations and bodies of \nthe United Nations, intergovernmental organizations, international financial \ninstitutions, \nother \ninterested \ninternational \nbodies \nand \nnon-governmental \norganizations, civil society organizations, academic institutions, the scientific \ncommunity, the private sector and philanthropic organizations, whose work is \nrelevant to the Conference, accredited in accordance with the provisions set forth in \nannex II to the present resolution, to participate as observers in the Conference and \nits preparatory meeting;  \n \n28. Invites associate members of the regional commissions9 to participate in \nthe Conference and the preparatory meeting, in the same capacity specified for their \nparticipation in the global conferences on the sustainable development of small island \ndeveloping States held in 1994, 2005 and 2014;  \n \n29. \nDecides that accreditation to the Conference and the preparatory meeting \nshall be in accordance with the provisions set forth in annex II to the present resolution;  \n \n30. Requests the Secretary-General to provide appropriate support from all \nrelevant parts of the Secretariat, and in cooperation with other relevant parts of the \nUnited Nations system, to the work of the Conference and to facilitate inter-agency \ncooperation to that end, as well as to ensure the efficient use of resources, so that the \nobjectives of the Conference can be achieved;  \n \n31. Encourages States and international donors, as well as the private sector, \nfinancial institutions, foundations and other donors in a position to do so, to support \nthe preparations for the Conference through voluntary contributions to a trust fund in \nsupport of preparations for the Conference and to support the participation of \nrepresentatives of developing countries, priority being given to representatives of the \nleast developed countries and small island developing States, including coverage of \neconomy-class air tickets, daily subsistence allowances and terminal expenses, in the \nmeetings of the Conference and its preparatory meeting.  \n \n80th plenary meeting  \n__________________ \n \n8  United Nations, Treaty Series, vol. 1833, No. 31363. \n \n9  American Samoa, Anguilla, Aruba, Bermuda, the British Virgin Islands, the Cayman Islands, the \nCommonwealth of the Northern Mariana Islands, Cura\u00e7ao, French Polynesia, Guam, Montserrat, \nNew Caledonia, Puerto Rico, Sint Maarten, the Turks and Caicos Islands and the United States \nVirgin Islands. \n\n2020 United Nations Conference to Support the Implementation of \nSustainable Development Goal 14: Conserve and sustainably use \nthe oceans, seas and marine resources for sustainable development \nA/RES/73/292\n \n7/23\n19-07696 \n \n9 May 2019 \n \nAnnex I  \n \n \n Provisional agenda of the 2020 United Nations Conference to \nSupport the Implementation of Sustainable Development \nGoal 14: Conserve and sustainably use the oceans, seas \nand marine resources for sustainable development \n \n \n \n \nLisbon, 2 to 6 June 2020 \n \n1. \nOpening of the Conference. \n2. \nElection of the two Presidents. \n3. \nAdoption of the rules of procedure. \n4. \nAdoption of the agenda of the Conference. \n5. \nElection of officers other than the Presidents. \n6. \nOrganization of work, including the establishment of subsidiary organs, and \nother organizational matters. \n7. \nCredentials of representatives to the Conference: \n \n(a) \nAppointment of the members of the Credentials Committee; \n \n(b) \nReport of the Credentials Committee. \n8. \nGeneral debate. \n9. \nInteractive dialogues. \n10. Outcome of the Conference. \n11. \nAdoption of the report of the Conference. \n12. Closure of the Conference. \n \n \nAnnex II  \n \n \n Proposed organization of work of the 2020 United Nations \nConference to Support the Implementation of Sustainable \nDevelopment Goal 14: Conserve and sustainably use the \noceans, seas and marine resources for sustainable \ndevelopment  \n \n \n \n \nLisbon, 2 to 6 June 2020 \n \n1. \nThe 2020 United Nations Conference to Support the Implementation of \nSustainable Development Goal 14: Conserve and sustainably use the oceans, seas \nand marine resources for sustainable development will be held in Lisbon, from 2 to \n6 June 2020.  \n \n \nI. \nOrganization of work \n \n \nA. \nPlenary meetings \n \n2. \nThe Conference will consist of a total of eight plenary meetings, to be held as \nfollows: \n \nTuesday, 2 June: from 9 to 10 a.m.  \n\nA/RES/73/292 \n2020 United Nations Conference to Support the Implementation of \nSustainable Development Goal 14: Conserve and sustainably use \nthe oceans, seas and marine resources for sustainable development \n \n19-07696\n8/23 \n \n \nWednesday, 3 June: from 10 a.m. to 1 p.m. and from 3 to 6 p.m. \n \nThursday, 4 June: from 10 a.m. to 1 p.m. and from 3 to 6 p.m. \n \nFriday, 5 June: from 10 a.m. to 1 p.m. and from 3 to 6 p.m. \n \nSaturday, 6 June: from 10 a.m. to 1 p.m. and from 3 to 6 p.m.  \n3. \nThe plenary meetings will be devoted to statements.  \n4. \nThe list of speakers for the plenary meetings will be established on a first-come \nfirst-served basis, with the customary protocol that ensures that Heads of State or \nGovernment speak first, followed by other heads of delegation. The European Union \nwill be included in the list of speakers. Detailed arrangements will be communicated \nin a timely manner through a note by the Secretariat.  \n5. \nAt the opening of the Conference, to take place during the first plenary meeting, \nto be held on the morning of Tuesday, 2 June, consideration will be given to all \nprocedural and organizational matters, including the adoption of the rules of \nprocedure and the agenda, the election of the two Presidents of the Conference, the \nelection of officers, the establishment of subsidiary organs, as appropriate, the \nappointment of the members of the Credentials Committee, arrangements for the \npreparation of the report of the Conference and other matters. At the resumed first \nplenary meeting, to be held on the morning of Wednesday, 3 June, statements will be \nmade by the Presidents of the Conference, the Secretary-General of the United \nNations, the President of the General Assembly, the President of the Economic and \nSocial Council and the Secretary-General of the Conference.  \n6. \nThe plenary meetings will also hear statements from representatives of other \nintergovernmental organizations, international financial institutions, international \nbodies, the United Nations specialized agencies, funds and programmes, as well as \nmajor groups and other stakeholders listed in paragraph 27 in accordance with the \npractices of the General Assembly.  \n7. \nThe final plenary meeting, to be held on the afternoon of Saturday, 6 June, is \nexpected to conclude with, inter alia, reporting on the interactive dialogues, to be \nfollowed \nby \nthe \nadoption \nof \nthe \nbrief, \nconcise, \naction-oriented \nand \nintergovernmentally agreed declaration and of the report of the Conference.  \n8. \nThe plenary meetings will run in parallel with the interactive dialogues, unless \notherwise specified in the present resolution.  \n \n \nB. \nInteractive dialogues \n \n9. \nThe Conference will include eight interactive dialogues, to be held in parallel \nwith the plenary meetings, as follows: \n \nTuesday, 2 June: from 10 a.m. to 1 p.m. and from 3 to 6 p.m. \n \nWednesday, 3 June: from 3 to 6 p.m. \n \nThursday, 4 June: from 10 a.m. to 1 p.m. and from 3 to 6 p.m. \n \nFriday, 5 June: from 10 a.m. to 1 p.m. and from 3 to 6 p.m. \n \nSaturday, 6 June: from 10 a.m. to 1 p.m.  \n10. Summaries of the interactive dialogues should be submitted to the Conference \nat its closing plenary meeting and included in the final report of the Conference.  \n \n \nC. \nMain Committee \n \n11. \nThe Main Committee, established in accordance with the rules of procedure of \nthe Conference, will meet, if necessary, in parallel with plenary meetings, except \n\n2020 United Nations Conference to Support the Implementation of \nSustainable Development Goal 14: Conserve and sustainably use \nthe oceans, seas and marine resources for sustainable development \nA/RES/73/292\n \n9/23\n19-07696 \n \nduring the opening and closing of the Conference, and will be responsible for \nfinalizing any outstanding matters.  \n \n \nII. \nCredentials of representatives to the Conference: appointment of the members \nof the Credentials Committee \n \n12. The Credentials Committee will be appointed according to the rules of \nprocedure of the Conference.  \n \n \nIII. \nAccreditation: institutional stakeholders \n \n13. Relevant intergovernmental organizations, international financial institutions \nand international bodies that were accredited to the World Summit on Sustainable \nDevelopment, the United Nations Conference on Sustainable Development, the high-\nlevel United Nations Conference to Support the Implementation of Sustainable \nDevelopment Goal 14: Conserve and sustainably use the oceans, seas and marine \nresources for sustainable development, the intergovernmental conference on an \ninternational legally binding instrument under the United Nations Convention on the \nLaw of the Sea on the conservation and sustainable use of marine biological diversity \nof areas beyond national jurisdiction and to previous United Nations conferences on \nthe sustainable development of small island developing States, held in Barbados, \nMauritius and Samoa, including associate members of the regional commissions, 10 \nmay participate in the deliberations of the Conference and its preparatory meeting, as \nappropriate, in accordance with the rules of procedure of the Conference.  \n14. Interested intergovernmental organizations that were not accredited to the \nconferences and summits listed in paragraph 13 above may apply to the General \nAssembly for accreditation following the established accreditation procedure. \n \n \nIV. \nAccreditation: non-governmental organizations and other stakeholders \n \n15. The non-governmental organizations and major groups as identified in \nAgenda 21,11 in consultative status with the Economic and Social Council, as well as \nthose that were accredited to the conferences and summits listed in paragraph 13 \nabove, shall register in order to participate. \n16. The President of the General Assembly shall also draw up lists of representatives \nof other relevant non-governmental organizations, civil society organizations, \nacademic institutions, the scientific community, the private sector and philanthropic \norganizations whose work is relevant to the Conference, who may participate in the \nConference and the preparatory meeting as observers, taking into account the \nprinciples of transparency and of equitable geographical representation, and shall \nsubmit the proposed lists to Member States for their consideration on a non-objection \nbasis. The President of the General Assembly shall bring a list to the attention of the \nGeneral Assembly before the preparatory meeting and, in any case, no later than \nDecember 2019, and, where applicable, shall bring another list to the attention of the \nAssembly before the Conference and, in any case, no later than April 2020. 12 \n__________________ \n \n10  American Samoa, Anguilla, Aruba, Bermuda, the British Virgin Islands, the Cayman Islands, the \nCommonwealth of the Northern Mariana Islands, Cura\u00e7ao, French Polynesia, Guam, Montserrat, \nNew Caledonia, Puerto Rico, Sint Maarten, the Turks and Caicos Islands and the United States \nVirgin Islands.  \n \n11  Report of the United Nations Conference on Environment and Development, Rio de Janeiro, 3\u201314 June \n1992, vol. I, Resolutions Adopted by the Conference (United Nations publication, Sales No. E.93.I.8 and \ncorrigendum), resolution 1, annex II. \n \n12  The lists will include proposed as well as final names. The general basis of any objections, if \nrequested by one or more States Members of the United Nations or States members of the \nspecialized agencies, will be made known to the Office of the President of the General Assembly \nand the requester.  \n\nA/RES/73/292 \n2020 United Nations Conference to Support the Implementation of \nSustainable Development Goal 14: Conserve and sustainably use \nthe oceans, seas and marine resources for sustainable development \n \n19-07696\n10/23 \n \n17. The provisions of paragraph 15 of General Assembly resolution 67/290 of 9 July \n2013 shall apply mutatis mutandis to the Conference and its preparatory process.  \n \n \nV. \nSecretariat \n \n18. The Secretary-General of the Conference will serve as focal point within the \nSecretariat for providing support to the organization of the Conference, in cooperation \nwith the representatives of the two Presidents.  \n19. The Special Adviser to the Presidents of the Conference on oceans and legal \nmatters will support the achievement of the goals of the Conference by providing both \nsubstantive and procedural advice.  \n \n \nVI. \nDocumentation \n \n20. In accordance with the practice followed at previous United Nations \nconferences, the official documentation of the Conference will include documents \nissued before, during and after the Conference.  \n21. In accordance with the practice followed at previous United Nations \nconferences, it is recommended that the Conference adopt a report consisting of the \ndecisions of the Conference, including the intergovernmentally agreed declaration, a \nbrief account of the proceedings and a reportorial account of the work of the \nConference and the action taken at the plenary meetings.  \n22. Summaries of the plenary meetings and interactive dialogues and a list of \nvoluntary commitments registered after 9 June 2017 and those announced at the \nConference should also be included in the report of the Conference.  \n \n \nVII. \nOrganization of parallel meetings and other events of the Conference \n \n23. Parallel meetings and other events, including those of major groups and other \nstakeholders, will be held during the same hours as the plenary meetings and \ninteractive dialogues, space permitting. Interpretation services will be provided for \nsuch meetings, as available.  \n \n \nVIII. \nSide events \n \n24. Side events, including briefings, seminars, workshops and panel discussions on \nissues related to the implementation of Goal 14, will be organized by participants in \nthe Conference. Guidelines for organizing such events and the calendar of those \nevents will be made available on the Conference website.  \n \n \nIX. \nMedia coverage \n \n25. Press materials will be prepared by the Department of Global Communications \nof the Secretariat for journalists covering the Conference. In addition, regular press \nreleases will be issued on the results of plenary meetings, interactive dialogues and \nother events. All relevant documentation will be made available on the Conference \nwebsite.  \n26. The plenary meetings, the interactive dialogues and the press conferences will \nbe broadcast live to the media area. A programme of special media briefings and press \nconferences will be announced.  \n \n\n2020 United Nations Conference to Support the Implementation of \nSustainable Development Goal 14: Conserve and sustainably use \nthe oceans, seas and marine resources for sustainable development \nA/RES/73/292\n \n11/23\n19-07696 \n \nAnnex III  \n \n \n Provisional rules of procedure of the 2020 United Nations \nConference to Support the Implementation of Sustainable \nDevelopment Goal 14: Conserve and sustainably use the \noceans, seas and marine resources for sustainable \ndevelopment \n \n \nI. \nRepresentation and credentials  \n \n \n \nRule 1 \n \n \nComposition of delegations  \n \n \nThe delegation of each State participating in the Conference and that of the \nEuropean Union shall consist of a head of delegation and such other representatives, \nalternate representatives and advisers as may be required. \n \n \n \nRule 2 \n \n \nAlternates and advisers  \n \n \nThe head of delegation may designate an alternate representative or an adviser \nto act as a representative. \n \n \n \nRule 3 \n \n \nSubmission of credentials  \n \n \nThe credentials of representatives and the names of alternate representatives and \nadvisers shall be submitted to the Secretary-General of the United Nations, if \npossible, not less than one week before the date fixed for the opening of the \nConference. The credentials shall be issued either by the Head of the State or \nGovernment or by the Minister for Foreign Affairs or, in the case of the European \nUnion, by the President of the European Commission. \n \n \n \nRule 4  \n \n \nCredentials Committee  \n \n \nA Credentials Committee of nine members shall be appointed at the beginning \nof the Conference. Its composition shall be based on that of the Credentials \nCommittee of the General Assembly at its seventy-fourth session. It shall examine the \ncredentials of representatives and report to the Conference without delay. \n \n \n \nRule 5 \n \n \nProvisional participation in the Conference  \n \n \nPending a decision of the Conference on their credentials, representatives shall \nbe entitled to participate provisionally in the Conference. \n \n \nII. \nOfficers  \n \n \n \nRule 6  \n \n \nElections  \n \n \nThe Conference shall elect from among the representatives of participating \nStates the following officers: two Presidents, one from Kenya and one from Portugal, \neach of whom shall preside separately. The Conference shall also elect 13 Vice-\n\nA/RES/73/292 \n2020 United Nations Conference to Support the Implementation of \nSustainable Development Goal 14: Conserve and sustainably use \nthe oceans, seas and marine resources for sustainable development \n \n19-07696\n12/23 \n \nPresidents,13 one of whom shall be designated as Rapporteur-General, as well as a \nchair for the Main Committee established in accordance with rule 46. The officers \nshall be elected with a view to ensuring the representative character of the General \nCommittee. The Conference may also elect such other officers as it deems necessary \nfor the performance of its functions.  \n \n \n \nRule 7  \n \n \nGeneral powers of the presiding President  \n \n1. \nThe Presidents shall take turns in presiding at the plenary meetings of the \nConference. In addition to exercising the powers conferred upon her or him elsewhere \nby these rules, the presiding President shall declare the opening and closing of each \nmeeting, put questions to the vote and announce decisions. The presiding President \nshall rule on points of order and, subject to those rules, shall have complete control \nover the proceedings and the maintenance of order thereat. The presiding President \nmay propose to the Conference the closure of the list of speakers, a limitation on the \ntime to be allowed to speakers and on the number of times each representative may \nspeak on a question, the adjournment or closure of the debate and the suspension or \nadjournment of a meeting. \n2. \nThe presiding President remains, in the exercise of her or his functions, under \nthe authority of the Conference. \n \n \n \nRule 8 \n \n \nActing President  \n \n1. \nIf both Presidents are to be absent from a meeting or any part thereof, they may \ndesignate one of the Vice-Presidents to preside. \n2. \nA Vice-President acting as President shall have the same powers and duties as \nthe President. \n \n \n \nRule 9  \n \n \nReplacement of a President or the Presidents \n \n \nIf either of the Presidents is unable to perform her or his functions, a new \nPresident shall be elected. If both Presidents are unable to perform their functions, \nnew Presidents shall be elected. \n \n \n \nRule 10 \n \n \nVoting rights of the presiding President  \n \n \nThe presiding President, or a Vice-President acting as the presiding President, \nshall not vote in the Conference, but may appoint another member of her or his \ndelegation to vote in her or his place. \n \n \nIII. \nGeneral Committee  \n \n \n \nRule 11  \n \n \nComposition  \n \n \nThe two Presidents, the Vice-Presidents, the Rapporteur-General and the Chair \nof the Main Committee shall constitute the General Committee. One of the two \nPresidents, as agreed between them, or, in their absence, one of the Vice-Presidents \n__________________ \n \n13  Three from each of the following groups: African States; Asia-Pacific States; Eastern European \nStates; Latin American and Caribbean States; and Western European and other States. The \nelection of the two Presidents will, however, have the effect of reducing by one the number of \nVice-Presidents allocated to the regions from which each of the Presidents is elected. \n\n2020 United Nations Conference to Support the Implementation of \nSustainable Development Goal 14: Conserve and sustainably use \nthe oceans, seas and marine resources for sustainable development \nA/RES/73/292\n \n13/23\n19-07696 \n \ndesignated by them, shall serve as Chair of the General Committee. The Chair of the \nCredentials Committee and other committees established by the Conference in \naccordance with rule 48 may participate, without the right to vote, in the General \nCommittee. \n \n \n \nRule 12 \n \n \nSubstitute members  \n \n \nIf a President or a Vice-President of the Conference is to be absent during a \nmeeting of the General Committee, she or he may designate a member of her or his \ndelegation to sit and vote in the Committee. In case of absence, the Chair of the Main \nCommittee shall designate the Vice-Chair of that Committee as her or his substitute. \nWhen serving on the General Committee, a Vice-Chair of the Main Committee shall \nnot have the right to vote if she or he is a member of the same delegation as another \nmember of the General Committee. \n \n \n \nRule 13 \n \n \nFunctions  \n \n \nThe General Committee shall assist both Presidents in the general conduct of \nthe business of the Conference and, subject to the decisions of the Conference, shall \nensure the coordination of the work of the Conference. \n \n \nIV. \nSecretariat of the Conference  \n \n \n \nRule 14 \n \n \nDuties of the Secretary-General of the United Nations  \n \n1. \nThe Secretary-General of the United Nations or a designated representative shall \nact in that capacity in all meetings of the Conference and its subsidiary organs. \n2. \nThe Secretary-General of the United Nations or a designated representative shall \ndirect the staff required by the Conference. \n \n \n \nRule 15 \n \n \nDuties of the secretariat of the Conference  \n \n \nThe secretariat of the Conference shall, in accordance with the present rules: \n \n(a) \nProvide simultaneous interpretation of speeches made at meetings; \n \n(b) \nReceive, translate, reproduce and circulate the documents of the \nConference; \n \n(c) \nPublish and circulate the official documents of the Conference; \n \n(d) \nPrepare and circulate records of public meetings; \n \n(e) \nMake and arrange for the keeping of sound recordings of meetings; \n \n(f) \nArrange for the custody and preservation of the documents of the \nConference in the archives of the United Nations; \n \n(g) \nGenerally perform all other work that the Conference may require. \n \n \n \nRule 16 \n \n \nStatements by the Secretariat  \n \n \nThe Secretary-General of the United Nations, or any member of the Secretariat \ndesignated for that purpose, may, at any time, make either oral or written statements \nconcerning any question under consideration. \n\nA/RES/73/292 \n2020 United Nations Conference to Support the Implementation of \nSustainable Development Goal 14: Conserve and sustainably use \nthe oceans, seas and marine resources for sustainable development \n \n19-07696\n14/23 \n \n \nV. \nOpening of the Conference  \n \n \n \nRule 17 \n \n \nTemporary President  \n \n \nThe Secretary-General of the United Nations or, in his absence, any member of \nthe Secretariat designated by him for that purpose, shall open the first meeting of the \nConference and preside until the Conference has elected its Presidents. \n \n \n \nRule 18 \n \n \nDecisions concerning organization  \n \n \nThe Conference shall, at its first meeting: \n \n(a) \nAdopt its rules of procedure; \n \n(b) \nElect its officers and constitute its subsidiary organs; \n \n(c) \nAdopt its agenda, the draft of which shall, until such adoption, be the \nprovisional agenda of the Conference; \n \n(d) \nDecide on the organization of its work. \n \n \nVI. \nConduct of business  \n \n \n \nRule 19 \n \n \nQuorum  \n \n \nThe presiding President may declare a meeting open and permit the debate to \nproceed when at least one third of the States participating in the Conference are \npresent. The presence of a majority of the States so participating shall be required for \nany decision to be taken. \n \n \n \nRule 20 \n \n \nSpeeches  \n \n1. \nNo representative may address the Conference without having previously \nobtained the permission of the presiding President. Subject to rules 21, 22 and 25 to \n27, the presiding President shall call upon speakers in the order in which they indicate \ntheir desire to speak. The secretariat shall be in charge of drawing up a list of speakers. \n2. \nDebate shall be confined to the question before the Conference and the presiding \nPresident may call a speaker to order if her or his remarks are not relevant to the \nsubject under discussion. \n3. \nThe Conference may limit the time allowed to each speaker and the number of \ntimes each participant may speak on any question. Permission to speak on a motion \nto set such limits shall be accorded to only two representatives in favour of and to \ntwo opposing such limits, after which the motion shall be immediately put to the vote. \nIn any event, with the consent of the Conference, the presiding President shall limit \neach intervention on procedural matters to five minutes. When the debate is limited \nand a speaker exceeds the allotted time, the presiding President shall call her or him \nto order without delay. \n \n \n \nRule 21 \n \n \nPoints of order  \n \n \nDuring the discussion of any matter, a representative may at any time raise a \npoint of order, which shall be immediately decided by the presiding President in \naccordance with the present rules. A representative may appeal against the ruling of \nthe presiding President. The appeal shall be immediately put to the vote, and the \n\n2020 United Nations Conference to Support the Implementation of \nSustainable Development Goal 14: Conserve and sustainably use \nthe oceans, seas and marine resources for sustainable development \nA/RES/73/292\n \n15/23\n19-07696 \n \npresiding President\u2019s ruling shall stand unless overruled by a majority of the States \npresent and voting. A representative may not, in raising a point of order, speak on the \nsubstance of the matter under discussion. \n \n \n \nRule 22 \n \n \nPrecedence  \n \n \nThe Chair or the Rapporteur of the Main Committee, or of other subsidiary \norgans, may be accorded precedence for the purpose of explaining the conclusions \narrived at by the body concerned. \n \n \n \nRule 23 \n \n \nClosing of the list of speakers  \n \n \nDuring the course of a debate, the presiding President may announce the list of \nspeakers and, with the consent of the Conference, declare the list closed. \n \n \n \nRule 24 \n \n \nRight of reply  \n \n1. \nNotwithstanding rule 23, the presiding President shall accord the right of reply \nto a representative of any State participating in the Conference or of the European \nUnion who requests it. Any other representative of a State may be granted the \nopportunity to make a reply. \n2. \nThe statements made under the present rule shall normally be made at the end \nof the last meeting of the day, or at the conclusion of the consideration of the relevant \nitem if that is sooner. \n3. \nRepresentatives of a State or of the European Union may make no more than \ntwo statements under the present rule at a given meeting on any item. The first shall \nbe limited to five minutes and the second to three minutes. Representatives shall, in \nany event, attempt to be as brief as possible. \n \n \n \nRule 25 \n \n \nAdjournment of debate  \n \n \nA representative of any State participating in the Conference may at any time \nmove the adjournment of the debate on the question under discussion. In addition to \nthe proposer of the motion, permission to speak on the motion shall be accorded to \nonly two representatives in favour and to two opposing the adjournment, after which \nthe motion shall, subject to rule 28, be immediately put to the vote. \n \n \n \nRule 26 \n \n \nClosure of debate  \n \n \nA representative of any State participating in the Conference may at any time \nmove the closure of the debate on the question under discussion, whether or not any \nother representative has signified her or his wish to speak. Permission to speak on the \nmotion shall be accorded to only two representatives opposing the closure, after \nwhich the motion shall, subject to rule 28, be immediately put to the vote. \n \n \n \nRule 27  \n \n \nSuspension or adjournment of the meeting  \n \n \nSubject to rule 38, a representative of any State participating in the Conference \nmay at any time move the suspension or the adjournment of the meeting. No \ndiscussion on such motions shall be permitted and they shall, subject to rule 28, be \nimmediately put to the vote. \n\nA/RES/73/292 \n2020 United Nations Conference to Support the Implementation of \nSustainable Development Goal 14: Conserve and sustainably use \nthe oceans, seas and marine resources for sustainable development \n \n19-07696\n16/23 \n \n \n \nRule 28 \n \n \nOrder of motions  \n \n \nThe motions indicated below shall have precedence in the following order over \nall proposals or other motions before the meeting: \n \n(a) \nTo suspend the meeting; \n \n(b) \nTo adjourn the meeting; \n \n(c) \nTo adjourn the debate on the question under discussion; \n \n(d) \nTo close the debate on the question under discussion. \n \n \n \nRule 29 \n \n \nSubmission of proposals and substantive amendments  \n \n \nProposals and substantive amendments shall normally be submitted in writing \nto the Secretary-General or her or his designated representative, who shall circulate \ncopies to all delegations in the languages of the Conference. Unless the Conference \ndecides otherwise, substantive proposals shall not be discussed or put to a decision \nunless copies have been circulated to all delegations not later than the day preceding \nthe meeting. The presiding President may, however, permit the discussion and \nconsideration of amendments, even though those amendments have not been \ncirculated or have been circulated only the same day. \n \n \n \nRule 30 \n \n \nWithdrawal of proposals and motions  \n \n \nA proposal or a motion may be withdrawn by its sponsor at any time before a \ndecision on it has been taken, provided that it has not been amended. A proposal or a \nmotion thus withdrawn may be reintroduced by any representative. \n \n \n \nRule 31 \n \n \nDecisions on competence  \n \n \nSubject to rule 28, any motion calling for a decision on the competence of the \nConference to adopt a proposal submitted to it shall be put to the vote before a \ndecision is taken on the proposal in question. \n \n \n \nRule 32 \n \n \nReconsideration of proposals  \n \n \nWhen a proposal has been adopted or rejected, it may not be reconsidered unless \nthe Conference, by a two-thirds majority of the States present and voting, so decides. \nPermission to speak on a motion to reconsider shall be accorded to only two speakers \nopposing reconsideration, after which the motion shall be immediately put to the vote. \n \n \nVII. \nDecision-making  \n \n \n \nRule 33 \n \n \nGeneral agreement  \n \n \nThe Conference shall adopt, by consensus, a brief, concise, action-oriented and \nintergovernmentally agreed declaration focusing on, and highlighting, the science-\nbased and innovative areas of action to support the implementation of Goal 14 and \nmake its best endeavour to ensure that all the other work of the Conference is \naccomplished by consensus.  \n \n\n2020 United Nations Conference to Support the Implementation of \nSustainable Development Goal 14: Conserve and sustainably use \nthe oceans, seas and marine resources for sustainable development \nA/RES/73/292\n \n17/23\n19-07696 \n \n \n \nRule 34 \n \n \nVoting rights  \n \n \nEach State participating in the Conference shall have one vote. \n \n \n \nRule 35 \n \n \nMajority required  \n \n1. \nSubject to rule 33, decisions of the Conference on all matters of substance shall \nbe taken by a two-thirds majority of the States present and voting. \n2. \nExcept as otherwise provided in the present rules, decisions of the Conference \non all matters of procedure shall be taken by a majority of the States present and \nvoting. \n3. \nIf the question arises whether a matter is one of procedure or of substance, the \npresiding President of the Conference shall rule on the question. An appeal against \nthat ruling shall be immediately put to the vote, and the presiding President\u2019s ruling \nshall stand unless overruled by a majority of the States present and voting. \n4. \nIf a vote is equally divided, the proposal or motion shall be regarded as rejected. \n \n \n \nRule 36  \n \n \nMeaning of the phrase \u201cStates present and voting\u201d  \n \n \nFor the purpose of the present rules, the phrase \u201cStates present and voting\u201d \nmeans States casting an affirmative or negative vote. States which abstain from voting \nshall be regarded as not voting. \n \n \n \nRule 37 \n \n \nMethod of voting  \n \n1. \nExcept as provided in rule 44, the Conference may vote by show of hands, \nexcept that a representative may request a roll call, which shall then be taken in the \nEnglish alphabetical order of the names of the States participating in the Conference, \nbeginning with the delegation whose name is drawn by lot by the presiding President. \nThe name of each State shall be called in all roll calls, and its representative shall \nreply \u201cyes\u201d, \u201cno\u201d or \u201cabstention\u201d. \n2. \nWhen the Conference votes by mechanical means, a non-recorded vote shall \nreplace a vote by show of hands and a recorded vote shall replace a roll call. A \nrepresentative may request a recorded vote, which shall, unless a representative \nrequests otherwise, be taken without calling out the names of the States participating \nin the Conference. \n3. \nThe vote of each State participating in a roll-call or a recorded vote shall be \ninserted in any record of or report on the meeting. \n \n \n \nRule 38 \n \n \nConduct during voting  \n \n \nAfter the presiding President has announced the commencement of voting, no \nrepresentative shall interrupt the voting, except on a point of order in connection with \nthe actual conduct of the voting. \n \n \n \n \nRule 39 \n \n \nExplanation of vote  \n \n\nA/RES/73/292 \n2020 United Nations Conference to Support the Implementation of \nSustainable Development Goal 14: Conserve and sustainably use \nthe oceans, seas and marine resources for sustainable development \n \n19-07696\n18/23 \n \n1. \nRepresentatives may make brief statements, consisting solely of explanations of \nvote, before the voting has commenced or after the voting has been completed. The \npresiding President may limit the time to be allowed for such explanations. The \nrepresentative of a State sponsoring a proposal or motion shall not speak in \nexplanation of vote thereon, except if it has been amended. \n2. \nWhen the same matter is considered successively in several organs of the \nConference, a State should, as far as possible, explain its vote only in one such organ, \nunless its vote in one organ is different from that in another organ. \n \n \n \nRule 40 \n \n \nDivision of proposals  \n \n \nA representative may move that parts of a proposal be decided on separately. If \na representative objects, the motion for division shall be voted upon. Permission to \nspeak on the motion shall be accorded to only two representatives in favour of and to \ntwo opposing the division. If the motion is carried, those parts of the proposal that \nare subsequently approved shall be put to the Conference for decision as a whole. If \nall operative parts of the proposal have been rejected, the proposal shall be considered \nto have been rejected as a whole. \n \n \n \nRule 41 \n \n \nAmendments  \n \n \nA proposal is considered an amendment to another proposal if it merely adds to, \ndeletes from or revises part of that proposal. Unless specified otherwise, the word \n\u201cproposal\u201d in these rules shall be regarded as including amendments. \n \n \n \nRule 42 \n \n \nOrder of voting on amendments  \n \n \nWhen an amendment is moved to a proposal, the amendment shall be voted on \nfirst. When two or more amendments are moved to a proposal, the Conference shall \nvote first on the amendment furthest removed in substance from the original proposal \nand then on the amendment next furthest removed therefrom, and so on, until all the \namendments have been put to the vote. Where, however, the adoption of one \namendment necessarily implies the rejection of another amendment, the latter shall \nnot be put to the vote. If one or more amendments are adopted, the amended proposal \nshall then be voted upon. \n \n \n \nRule 43 \n \n \nOrder of voting on proposals  \n \n1. \nIf two or more proposals, other than amendments, relate to the same question, \nthey shall, unless the Conference decides otherwise, be voted on in the order in which \nthey were submitted. The Conference may, after each vote on a proposal, decide \nwhether to vote on the next proposal. \n2. \nRevised proposals shall be voted on in the order in which the original proposals \nwere submitted, unless the revision substantially departs from the original proposal. \nIn that case, the original proposal shall be regarded as withdrawn and the revised \nproposal shall be treated as a new proposal. \n3. \nA motion requiring that no decision be taken on a proposal shall be put to the \nvote before a decision is taken on the proposal in question. \n \n \n \nRule 44 \n \n \nElections  \n \n\n2020 United Nations Conference to Support the Implementation of \nSustainable Development Goal 14: Conserve and sustainably use \nthe oceans, seas and marine resources for sustainable development \nA/RES/73/292\n \n19/23\n19-07696 \n \n \nAll elections shall be held by secret ballot unless, in the absence of any \nobjection, the Conference decides to proceed without taking a ballot when there is an \nagreed candidate or slate of candidates. \n \n \n \nRule 45 \n \n \nBalloting  \n \n1. \nWhen one or more elective places are to be filled at one time under the same \nconditions, those candidates, in a number not exceeding the number of such places, \nobtaining in the first ballot a majority of the votes cast and the largest number of votes \nshall be elected. \n2. \nIf the number of candidates obtaining such majority is less than the number of \nplaces to be filled, additional ballots shall be held to fill the remaining places, the \nvoting being restricted to the candidates obtaining the largest number of votes in the \nprevious ballot, to a number not more than twice the places remaining to be filled. \n \n \nVIII. \nSubsidiary organs \n \n \n \nRule 46 \n \n \nMain Committee  \n \n \nThe Conference may establish a Main Committee. \n \n \n \nRule 47 \n \n \nRepresentation on the Main Committee  \n \n \nEach State participating in the Conference and the European Union may be \nrepresented by one representative on the Main Committee. They may assign to the \nCommittee such alternate representatives and advisers as may be required. \n \n \n \nRule 48 \n \n \nOther committees and working groups  \n \n1. \nIn addition to the Main Committee referred to above, the Conference may \nestablish such committees and working groups as it deems necessary for the \nperformance of its functions. \n2. \nSubject to the decision of the plenary of the Conference, the committees may \nset up subcommittees and working groups. \n \n \n \nRule 49 \n \n \nMembers of committees, subcommittees and working groups  \n \n1. \nThe members of the committees and working groups of the Conference, referred \nto in rule 48, paragraph 1, shall be appointed by the two Presidents, subject to the \napproval of the Conference, unless the Conference decides otherwise. \n2. \nMembers of the subcommittees and working groups of committees shall be \nappointed by the Chair of the committee in question, subject to the approval of that \ncommittee, unless the committee decides otherwise. \n \n \n \nRule 50 \n \n \nOfficers  \n \n \nExcept as otherwise provided in rule 6, each committee, subcommittee and \nworking group shall elect its own officers. \n \n \n \nRule 51 \n \n \nQuorum  \n \n\nA/RES/73/292 \n2020 United Nations Conference to Support the Implementation of \nSustainable Development Goal 14: Conserve and sustainably use \nthe oceans, seas and marine resources for sustainable development \n \n19-07696\n20/23 \n \n1. \nThe Chair of the Main Committee may declare a meeting open and permit the \ndebate to proceed when at least one quarter of the States participating in the \nConference are present. The presence of a majority of the States so participating shall \nbe required for any decision to be taken. \n2. \nA majority of the members of the General Committee or the Credentials Committee \nor of any committee, subcommittee or working group shall constitute a quorum. \n \n \n \nRule 52 \n \n \nOfficers, conduct of business and voting  \n \n \nThe rules contained in sections II, VI (except rule 19) and VII above shall be \napplicable, mutatis mutandis, to the proceedings of committees, subcommittees and \nworking groups, except that: \n \n(a) \nThe Chairs of the General Committee and the Credentials Committee and \nthe Chairs of the committees, subcommittees and working groups may exercise the \nright to vote, provided that they are representatives of participating States; \n \n(b) \nDecisions of committees, subcommittees and working groups shall be \ntaken by a majority of the members present and voting, except that the reconsideration \nof a proposal or an amendment shall require the majority established by rule 32. \n \n \nIX. \nLanguages and records  \n \n \n \nRule 53 \n \n \nLanguages of the Conference  \n \n \nArabic, Chinese, English, French, Russian and Spanish shall be the languages \nof the Conference. \n \n \n \nRule 54 \n \n \nInterpretation  \n \n1. \nSpeeches made in a language of the Conference shall be interpreted into the \nother five languages. \n2. \nA representative may speak in a language other than a language of the \nConference if the delegation concerned provides for interpretation into one of the \nlanguages of the Conference. \n \n \n \nRule 55 \n \n \nLanguages of official documents  \n \n \nOfficial documents of the Conference shall be made available in the languages \nof the Conference. \n \n \n \nRule 56 \n \n \nSound recordings of meetings  \n \n \nSound recordings of the plenary meetings of the Conference, the interactive \ndialogues and of the meetings of the Main Committee shall be made and kept in \naccordance with the practice of the United Nations. Unless otherwise decided by the \nConference or the Main Committee, no such recordings shall be made of any of the \nother meetings held during the Conference.  \n \n \nX. \nPublic and private meetings  \n \n \n \nGeneral principles  \n \n \n \nRule 57  \n \n\n2020 United Nations Conference to Support the Implementation of \nSustainable Development Goal 14: Conserve and sustainably use \nthe oceans, seas and marine resources for sustainable development \nA/RES/73/292\n \n21/23\n19-07696 \n \n \nThe plenary meetings of the Conference and the meetings of any committee \nshall be held in public unless the body concerned decides otherwise. All decisions \ntaken by the plenary of the Conference at a private meeting shall be announced at an \nearly public meeting of the plenary.  \n \n \n \nRule 58  \n \n \nAs a general rule, meetings of the General Committee, the Credentials \nCommittee, subcommittees or working groups shall be held in private.  \n \n \n \nRule 59 \n \n \nCommuniqu\u00e9s on private meetings  \n \n \nAt the close of a private meeting, the presiding officer of the organ concerned \nmay issue a communiqu\u00e9 through the Secretary-General of the United Nations or a \ndesignated representative.  \n \n \nXI. \nOther participants and observers  \n \n \n \nRule 60 \n \n \nIntergovernmental organizations and other entities14 having received \na standing invitation to participate as observers in the sessions \nand work of the General Assembly  \n \n \nRepresentatives designated by intergovernmental organizations and other \nentities having received a standing invitation to participate as observers in the \nsessions and work of the General Assembly have the right to participate as observers, \nwithout the right to vote, in the deliberations of the Conference, the Main Committee \nand, as appropriate, any other committee or working group.  \n \n \n \nRule 61 \n \n \nAssociate members of regional commissions15 \n \n \nRepresentatives designated by the associate members of regional commissions \nlisted in the footnote below may participate as observers, without the right to vote, in \nthe deliberations of the Conference, the Main Committee and, as appropriate, any \nother committee or working group.  \n \n \n \nRule 62 \n \n \nRepresentatives of the specialized agencies and related organizations16 \n \n \nRepresentatives \ndesignated \nby \nthe \nspecialized \nagencies \nand \nrelated \norganizations may participate as observers, without the right to vote, in the \ndeliberations of the Conference, the Main Committee and, as appropriate, any other \ncommittee or working group on questions within the scope of their activities.  \n \n__________________ \n \n14  For the purpose of the present rules, the term \u201cother entities\u201d includes the International Committee \nof the Red Cross, the International Federation of Red Cross and Red Crescent Societies, the \nInternational Olympic Committee, the Inter-Parliamentary Union and the Sovereign Order of Malta. \n \n15  American Samoa, Anguilla, Aruba, Bermuda, the British Virgin Islands, the Cayman Islands, the \nCommonwealth of the Northern Mariana Islands, Cura\u00e7ao, French Polynesia, Guam, Montserrat, \nNew Caledonia, Puerto Rico, Sint Maarten, the Turks and Caicos Islands and the United States \nVirgin Islands. \n \n16  For the purpose of the present rules, the term \u201crelated organizations\u201d includes the International \nAtomic Energy Agency, the International Criminal Court, the International Organization for \nMigration, the International Seabed Authority, the International Tribunal for the Law of the Sea, the \nOrganisation for the Prohibition of Chemical Weapons, the Preparatory Commission for the \nComprehensive Nuclear-Test-Ban Treaty Organization and the World Trade Organization. \n\nA/RES/73/292 \n2020 United Nations Conference to Support the Implementation of \nSustainable Development Goal 14: Conserve and sustainably use \nthe oceans, seas and marine resources for sustainable development \n \n19-07696\n22/23 \n \n \n \nRule 63  \n \n \nRepresentatives of other intergovernmental organizations and other \ninternational bodies \n \n \nSave where otherwise specifically provided with respect to the European Union \nin these rules of procedure, representatives designated by other intergovernmental \norganizations and other international bodies invited to the Conference may participate \nas observers, without the right to vote, in the deliberations of the Conference, the \nMain Committee and, as appropriate, any other committee or working group on \nquestions within the scope of their activities.  \n \n \n \nRule 64  \n \n \nRepresentatives of interested United Nations organs  \n \n \nRepresentatives designated by interested organs of the United Nations may \nparticipate as observers, without the right to vote, in the deliberations of the \nConference, the Main Committee and, as appropriate, any other committee or working \ngroup on questions within the scope of their activities.  \n \n \n \nRule 65 \n \n \nRepresentatives of non-governmental organizations17 \n \n1. \nNon-governmental organizations accredited to participate in the Conference \nmay designate representatives to attend public meetings of the Conference and the \nMain Committee as observers.  \n2. \nUpon the invitation of the presiding officer of the Conference and subject to the \napproval of the Conference, such observers may make oral statements on questions \nin which they have special competence. If the number of requests to speak is too large, \nthe non-governmental organizations shall be requested to form themselves into \nconstituencies, such constituencies to speak through spokespersons.  \n \n \n \nRule 66 \n \n \nWritten statements  \n \n \nWritten statements submitted by the designated representatives referred to in \nrules 60 to 65 shall be circulated by the secretariat to all delegations in the quantities \nand the languages in which the statements are made available to it at the site of the \nConference, provided that a statement submitted on behalf of a non-governmental \norganization must be related to the work of the Conference and be on a subject in \nwhich the organization has a special competence. Written statements shall not be \nmade available at United Nations expense and shall not be issued as official \ndocuments.  \n \n \n \nXII. \nSuspension and amendment of the rules of procedure  \n \n \n \nRule 67 \n \n \nMethod of suspension  \n__________________ \n \n17  Paragraph 23.3 of Agenda 21 provides that \u201cAny policies, definitions or rules affecting access to \nand participation by non-governmental organizations in the work of United Nations institutions or \nagencies associated with the implementation of Agenda 21 must apply equally to all major groups\u201d. \nAgenda 21 defines major groups as comprising women, children and youth, indigenous people, \nnon-governmental organizations, local authorities, workers and their trade unions, business and \nindustry, the scientific and technological community and farmers. Therefore, based on Agenda 21, \nrule 65 shall apply equally to non-governmental organizations and other major groups. \n\n2020 United Nations Conference to Support the Implementation of \nSustainable Development Goal 14: Conserve and sustainably use \nthe oceans, seas and marine resources for sustainable development \nA/RES/73/292\n \n23/23\n19-07696 \n \n \n \nAny of these rules may be suspended by the Conference provided that 24 hours\u2019 \nnotice of the proposal for the suspension has been given, which may be waived if no \nrepresentative objects. Any such suspension shall be limited to a specific and stated \npurpose and to a period required to achieve that purpose.  \n \n \n \nRule 68 \n \n \nMethod of amendment  \n \n \nThese rules of procedure may be amended by a decision of the Conference taken \nby a two-thirds majority of the States present and voting, after the General Committee \nhas reported on the proposed amendment. \n \n \n",
  "paragraphs": {
    "1": "Non-governmental organizations accredited to participate in the Conference may designate representatives to attend public meetings of the Conference and the Main Committee as observers.",
    "2": "Upon the invitation of the presiding officer of the Conference and subject to the approval of the Conference, such observers may make oral statements on questions in which they have special competence. If the number of requests to speak is too large, the non-governmental organizations shall be requested to form themselves into constituencies, such constituencies to speak through spokespersons. Rule 66 Written statements Written statements submitted by the designated representatives referred to in rules 60 to 65 shall be circulated by the secretariat to all delegations in the quantities and the languages in which the statements are made available to it at the site of the Conference, provided that a statement submitted on behalf of a non-governmental organization must be related to the work of the Conference and be on a subject in which the organization has a special competence. Written statements shall not be made available at United Nations expense and shall not be issued as official documents. XII. Suspension and amendment of the rules of procedure Rule 67 Method of suspension __________________ 17 Paragraph 23.3 of Agenda 21 provides that \u201cAny policies, definitions or rules affecting access to and participation by non-governmental organizations in the work of United Nations institutions or agencies associated with the implementation of Agenda 21 must apply equally to all major groups\u201d. Agenda 21 defines major groups as comprising women, children and youth, indigenous people, non-governmental organizations, local authorities, workers and their trade unions, business and industry, the scientific and technological community and farmers. Therefore, based on Agenda 21, rule 65 shall apply equally to non-governmental organizations and other major groups. 2020 United Nations Conference to Support the Implementation of Sustainable Development Goal 14: Conserve and sustainably use the oceans, seas and marine resources for sustainable development A/RES/73/292 23/23 19-07696 Any of these rules may be suspended by the Conference provided that 24 hours\u2019 notice of the proposal for the suspension has been given, which may be waived if no representative objects. Any such suspension shall be limited to a specific and stated purpose and to a period required to achieve that purpose. Rule 68 Method of amendment These rules of procedure may be amended by a decision of the Conference taken by a two-thirds majority of the States present and voting, after the General Committee has reported on the proposed amendment.",
    "3": "A motion requiring that no decision be taken on a proposal shall be put to the vote before a decision is taken on the proposal in question. Rule 44 Elections 2020 United Nations Conference to Support the Implementation of Sustainable Development Goal 14: Conserve and sustainably use the oceans, seas and marine resources for sustainable development A/RES/73/292 19/23 19-07696 All elections shall be held by secret ballot unless, in the absence of any objection, the Conference decides to proceed without taking a ballot when there is an agreed candidate or slate of candidates. Rule 45 Balloting",
    "4": "If a vote is equally divided, the proposal or motion shall be regarded as rejected. Rule 36 Meaning of the phrase \u201cStates present and voting\u201d For the purpose of the present rules, the phrase \u201cStates present and voting\u201d means States casting an affirmative or negative vote. States which abstain from voting shall be regarded as not voting. Rule 37 Method of voting",
    "5": "At the opening of the Conference, to take place during the first plenary meeting, to be held on the morning of Tuesday, 2 June, consideration will be given to all procedural and organizational matters, including the adoption of the rules of procedure and the agenda, the election of the two Presidents of the Conference, the election of officers, the establishment of subsidiary organs, as appropriate, the appointment of the members of the Credentials Committee, arrangements for the preparation of the report of the Conference and other matters. At the resumed first plenary meeting, to be held on the morning of Wednesday, 3 June, statements will be made by the Presidents of the Conference, the Secretary-General of the United Nations, the President of the General Assembly, the President of the Economic and Social Council and the Secretary-General of the Conference.",
    "6": "The plenary meetings will also hear statements from representatives of other intergovernmental organizations, international financial institutions, international bodies, the United Nations specialized agencies, funds and programmes, as well as major groups and other stakeholders listed in paragraph 27 in accordance with the practices of the General Assembly.",
    "7": "The final plenary meeting, to be held on the afternoon of Saturday, 6 June, is expected to conclude with, inter alia, reporting on the interactive dialogues, to be followed by the adoption of the brief, concise, action-oriented and intergovernmentally agreed declaration and of the report of the Conference.",
    "8": "The plenary meetings will run in parallel with the interactive dialogues, unless otherwise specified in the present resolution. B. Interactive dialogues",
    "9": "The Conference will include eight interactive dialogues, to be held in parallel with the plenary meetings, as follows: Tuesday, 2 June: from 10 a.m. to 1 p.m. and from 3 to 6 p.m. Wednesday, 3 June: from 3 to 6 p.m. Thursday, 4 June: from 10 a.m. to 1 p.m. and from 3 to 6 p.m. Friday, 5 June: from 10 a.m. to 1 p.m. and from 3 to 6 p.m. Saturday, 6 June: from 10 a.m. to 1 p.m.",
    "10": "Summaries of the interactive dialogues should be submitted to the Conference at its closing plenary meeting and included in the final report of the Conference. C. Main Committee",
    "11": "The Main Committee, established in accordance with the rules of procedure of the Conference, will meet, if necessary, in parallel with plenary meetings, except 2020 United Nations Conference to Support the Implementation of Sustainable Development Goal 14: Conserve and sustainably use the oceans, seas and marine resources for sustainable development A/RES/73/292 9/23 19-07696 during the opening and closing of the Conference, and will be responsible for finalizing any outstanding matters. II. Credentials of representatives to the Conference: appointment of the members of the Credentials Committee",
    "12": "The Credentials Committee will be appointed according to the rules of procedure of the Conference. III. Accreditation: institutional stakeholders",
    "13": "Relevant intergovernmental organizations, international financial institutions and international bodies that were accredited to the World Summit on Sustainable Development, the United Nations Conference on Sustainable Development, the high- level United Nations Conference to Support the Implementation of Sustainable Development Goal 14: Conserve and sustainably use the oceans, seas and marine resources for sustainable development, the intergovernmental conference on an international legally binding instrument under the United Nations Convention on the Law of the Sea on the conservation and sustainable use of marine biological diversity of areas beyond national jurisdiction and to previous United Nations conferences on the sustainable development of small island developing States, held in Barbados, Mauritius and Samoa, including associate members of the regional commissions, 10 may participate in the deliberations of the Conference and its preparatory meeting, as appropriate, in accordance with the rules of procedure of the Conference.",
    "14": "Interested intergovernmental organizations that were not accredited to the conferences and summits listed in paragraph 13 above may apply to the General Assembly for accreditation following the established accreditation procedure. IV. Accreditation: non-governmental organizations and other stakeholders",
    "15": "The non-governmental organizations and major groups as identified in Agenda 21,11 in consultative status with the Economic and Social Council, as well as those that were accredited to the conferences and summits listed in paragraph 13 above, shall register in order to participate.",
    "16": "The President of the General Assembly shall also draw up lists of representatives of other relevant non-governmental organizations, civil society organizations, academic institutions, the scientific community, the private sector and philanthropic organizations whose work is relevant to the Conference, who may participate in the Conference and the preparatory meeting as observers, taking into account the principles of transparency and of equitable geographical representation, and shall submit the proposed lists to Member States for their consideration on a non-objection basis. The President of the General Assembly shall bring a list to the attention of the General Assembly before the preparatory meeting and, in any case, no later than December 2019, and, where applicable, shall bring another list to the attention of the Assembly before the Conference and, in any case, no later than April 2020. 12 __________________ 10 American Samoa, Anguilla, Aruba, Bermuda, the British Virgin Islands, the Cayman Islands, the Commonwealth of the Northern Mariana Islands, Cura\u00e7ao, French Polynesia, Guam, Montserrat, New Caledonia, Puerto Rico, Sint Maarten, the Turks and Caicos Islands and the United States Virgin Islands. 11 Report of the United Nations Conference on Environment and Development, Rio de Janeiro, 3\u201314 June 1992, vol. I, Resolutions Adopted by the Conference (United Nations publication, Sales No. E.93.I.8 and corrigendum), resolution 1, annex II. 12 The lists will include proposed as well as final names. The general basis of any objections, if requested by one or more States Members of the United Nations or States members of the specialized agencies, will be made known to the Office of the President of the General Assembly and the requester. A/RES/73/292 2020 United Nations Conference to Support the Implementation of Sustainable Development Goal 14: Conserve and sustainably use the oceans, seas and marine resources for sustainable development 19-07696 10/23",
    "17": "The provisions of paragraph 15 of General Assembly resolution 67/290 of 9 July 2013 shall apply mutatis mutandis to the Conference and its preparatory process. V. Secretariat",
    "18": "The Secretary-General of the Conference will serve as focal point within the Secretariat for providing support to the organization of the Conference, in cooperation with the representatives of the two Presidents.",
    "19": "The Special Adviser to the Presidents of the Conference on oceans and legal matters will support the achievement of the goals of the Conference by providing both substantive and procedural advice. VI. Documentation",
    "20": "In accordance with the practice followed at previous United Nations conferences, the official documentation of the Conference will include documents issued before, during and after the Conference.",
    "21": "In accordance with the practice followed at previous United Nations conferences, it is recommended that the Conference adopt a report consisting of the decisions of the Conference, including the intergovernmentally agreed declaration, a brief account of the proceedings and a reportorial account of the work of the Conference and the action taken at the plenary meetings.",
    "22": "Summaries of the plenary meetings and interactive dialogues and a list of voluntary commitments registered after 9 June 2017 and those announced at the Conference should also be included in the report of the Conference. VII. Organization of parallel meetings and other events of the Conference",
    "23": "Parallel meetings and other events, including those of major groups and other stakeholders, will be held during the same hours as the plenary meetings and interactive dialogues, space permitting. Interpretation services will be provided for such meetings, as available. VIII. Side events",
    "24": "Side events, including briefings, seminars, workshops and panel discussions on issues related to the implementation of Goal 14, will be organized by participants in the Conference. Guidelines for organizing such events and the calendar of those events will be made available on the Conference website. IX. Media coverage",
    "25": "Press materials will be prepared by the Department of Global Communications of the Secretariat for journalists covering the Conference. In addition, regular press releases will be issued on the results of plenary meetings, interactive dialogues and other events. All relevant documentation will be made available on the Conference website.",
    "26": "The plenary meetings, the interactive dialogues and the press conferences will be broadcast live to the media area. A programme of special media briefings and press conferences will be announced. 2020 United Nations Conference to Support the Implementation of Sustainable Development Goal 14: Conserve and sustainably use the oceans, seas and marine resources for sustainable development A/RES/73/292 11/23 19-07696 Annex III Provisional rules of procedure of the 2020 United Nations Conference to Support the Implementation of Sustainable Development Goal 14: Conserve and sustainably use the oceans, seas and marine resources for sustainable development I. Representation and credentials Rule 1 Composition of delegations The delegation of each State participating in the Conference and that of the European Union shall consist of a head of delegation and such other representatives, alternate representatives and advisers as may be required. Rule 2 Alternates and advisers The head of delegation may designate an alternate representative or an adviser to act as a representative. Rule 3 Submission of credentials The credentials of representatives and the names of alternate representatives and advisers shall be submitted to the Secretary-General of the United Nations, if possible, not less than one week before the date fixed for the opening of the Conference. The credentials shall be issued either by the Head of the State or Government or by the Minister for Foreign Affairs or, in the case of the European Union, by the President of the European Commission. Rule 4 Credentials Committee A Credentials Committee of nine members shall be appointed at the beginning of the Conference. Its composition shall be based on that of the Credentials Committee of the General Assembly at its seventy-fourth session. It shall examine the credentials of representatives and report to the Conference without delay. Rule 5 Provisional participation in the Conference Pending a decision of the Conference on their credentials, representatives shall be entitled to participate provisionally in the Conference. II. Officers Rule 6 Elections The Conference shall elect from among the representatives of participating States the following officers: two Presidents, one from Kenya and one from Portugal, each of whom shall preside separately. The Conference shall also elect 13 Vice- A/RES/73/292 2020 United Nations Conference to Support the Implementation of Sustainable Development Goal 14: Conserve and sustainably use the oceans, seas and marine resources for sustainable development 19-07696 12/23 Presidents,13 one of whom shall be designated as Rapporteur-General, as well as a chair for the Main Committee established in accordance with rule 46. The officers shall be elected with a view to ensuring the representative character of the General Committee. The Conference may also elect such other officers as it deems necessary for the performance of its functions. Rule 7 General powers of the presiding President",
    "27": "Invites other relevant stakeholders, including organizations and bodies of the United Nations, intergovernmental organizations, international financial institutions, other interested international bodies and non-governmental organizations, civil society organizations, academic institutions, the scientific community, the private sector and philanthropic organizations, whose work is relevant to the Conference, accredited in accordance with the provisions set forth in annex II to the present resolution, to participate as observers in the Conference and its preparatory meeting;",
    "28": "Invites associate members of the regional commissions9 to participate in the Conference and the preparatory meeting, in the same capacity specified for their participation in the global conferences on the sustainable development of small island developing States held in 1994, 2005 and 2014;",
    "29": "Decides that accreditation to the Conference and the preparatory meeting shall be in accordance with the provisions set forth in annex II to the present resolution;",
    "30": "Requests the Secretary-General to provide appropriate support from all relevant parts of the Secretariat, and in cooperation with other relevant parts of the United Nations system, to the work of the Conference and to facilitate inter-agency cooperation to that end, as well as to ensure the efficient use of resources, so that the objectives of the Conference can be achieved;",
    "31": "Encourages States and international donors, as well as the private sector, financial institutions, foundations and other donors in a position to do so, to support the preparations for the Conference through voluntary contributions to a trust fund in support of preparations for the Conference and to support the participation of representatives of developing countries, priority being given to representatives of the least developed countries and small island developing States, including coverage of economy-class air tickets, daily subsistence allowances and terminal expenses, in the meetings of the Conference and its preparatory meeting. 80th plenary meeting __________________ 8 United Nations, Treaty Series, vol. 1833, No. 31363. 9 American Samoa, Anguilla, Aruba, Bermuda, the British Virgin Islands, the Cayman Islands, the Commonwealth of the Northern Mariana Islands, Cura\u00e7ao, French Polynesia, Guam, Montserrat, New Caledonia, Puerto Rico, Sint Maarten, the Turks and Caicos Islands and the United States Virgin Islands. 2020 United Nations Conference to Support the Implementation of Sustainable Development Goal 14: Conserve and sustainably use the oceans, seas and marine resources for sustainable development A/RES/73/292 7/23 19-07696 9 May 2019 Annex I Provisional agenda of the 2020 United Nations Conference to Support the Implementation of Sustainable Development Goal 14: Conserve and sustainably use the oceans, seas and marine resources for sustainable development Lisbon, 2 to 6 June 2020"
  },
  "agenda_items": [
    "Item 20"
  ],
  "symbol_references": [
    "A/73/L.82"
  ]
}