{
  "symbol": "A/RES/79/13",
  "filename": "A_RES_79_13.pdf",
  "title": "79/13. Cooperation between the United Nations and the Latin American and Caribbean Economic System",
  "text": "United Nations \nA/RES/79/13\n \nGeneral Assembly \nDistr.: General \n19 November 2024 \n24-21673 (E) \n*2421673* \n \n \nSeventy-ninth session \nAgenda item 125 (e) \nCooperation between the United Nations and regional and \nother organizations: cooperation between the United Nations \nand the Latin American and Caribbean Economic System \n \n \n \n \n Resolution adopted by the General Assembly \non 18 November 2024 \n \n \n[without reference to a Main Committee (A/79/L.14)] \n \n \n \n79/13. Cooperation between the United Nations and the Latin American \nand Caribbean Economic System \n \n \n \nThe General Assembly, \n \nRecalling its resolution 77/117 of 7 December 2022 on cooperation between the \nUnited Nations and the Latin American and Caribbean Economic System, \n \nBearing in mind the Agreement between the United Nations and the Latin \nAmerican and Caribbean Economic System,1 in which the parties agree to strengthen \nand expand their cooperation in matters that are of common concern in the fields of \ntheir respective competence pursuant to their constitutional instruments, \n \nTaking note of the report of the Secretary-General on cooperation between the \nUnited Nations and regional and other organizations, 2 \n \nReaffirming that cooperation between the Latin American and Caribbean \nEconomic System and the United Nations has evolved and diversified with regard to \nareas of cooperation, \n \nRecalling the signing of the framework agreement between the Latin American \nand Caribbean Economic System and the Economic Commission for Latin America \nand the Caribbean, on 26 October 2017, to strengthen technical and institutional \ncooperation in the region, \n \nRecalling also the signing of the memorandum of understanding between the \nWorld Tourism Organization and the Latin American and Caribbean Economic \n_______________ \n \n1 Agreement between the United Nations and the Latin American Economic System (United Nations, \nTreaty Series, vol. 1651, No. 1061). \n \n2 A/79/302-S/2024/600. \n\nA/RES/79/13 \nCooperation between the United Nations and the Latin American \nand Caribbean Economic System\n \n24-21673\n2/2 \n \nSystem, on 11 October 2021 to promote and strengthen the sustainable development \nof tourism, highlighting its contribution to poverty reduction and development, \n \nEmphasizing that the Latin American and Caribbean Economic System is an \nimportant partner in the implementation of the 2015\u20132030 regional action plan for the \nimplementation of the Sendai Framework for Disaster Risk Reduction 2015\u201320303 in \nthe Americas and the Caribbean, which was updated at the seventh Regional Platform \nfor Disaster Risk Reduction in the Americas and the Caribbean, held in Jamaica from \n1 to 4 November 2021, \n \nAcknowledging with satisfaction the joint efforts made by the international \ncommunity in its struggle to counter the effects of one of the greatest global \nchallenges to humanity, the coronavirus disease (COVID\u201119) pandemic, \n \n1. \nTakes note with satisfaction of the positive assessment of the \nimplementation of the Agreement between the United Nations and the Latin American \nand Caribbean Economic System, and urges the parties to continue strengthening the \ncollaboration between both organizations; \n \n2. \nAlso takes note with satisfaction of the holding of the forty-ninth regular \nmeeting of the Latin American Council of the Latin American and Caribbean \nEconomic System, in Caracas on 5 and 6 December 2023, as well as its work \nprogramme aimed at building a regional agenda for integration and cooperation that \ncontributes to overcoming the economic and social lags in its member countries; \n \n3. \nUrges the Economic Commission for Latin America and the Caribbean to \ncontinue to deepen its coordination and mutual support activities with the Latin \nAmerican and Caribbean Economic System; \n \n4. \nUrges the specialized agencies and other organizations, funds and \nprogrammes of the United Nations system, in particular the Food and Agriculture \nOrganization of the United Nations, the World Health Organization, the United \nNations Industrial Development Organization, the World Food Programme, the \nUnited Nations Development Programme, the United Nations Conference on Trade \nand Development, the United Nations Educational, Scientific and Cultural \nOrganization, the United Nations Children\u2019s Fund, the United Nations Office for \nDisaster Risk Reduction and the Office for the Coordination of Humanitarian Affairs \nof the Secretariat, as well as the International Organization for Migration and the \nWorld Tourism Organization, to continue and intensify their support for and to \nstrengthen their cooperation, in accordance with their respective mandates, with the \nactivities of the Latin American and Caribbean Economic System, and to contribute \nto joint actions to achieve sustainable development in Latin America and the \nCaribbean, in line with the 2030 Agenda for Sustainable Development and all its \nGoals and objectives;4 \n \n5. \nInvites the international community to continue to support the work of the \ndifferent regional organizations in order to intensify cooperation and the exchange of \nrelevant information to mitigate the consequences of the current economic crisis; \n \n6. \nRequests the Secretary-General to submit to the General Assembly at its \neighty-first session a report on the implementation of the present resolution.  \n \n39th plenary meeting \n18 November 2024 \n \n_______________ \n \n3 Resolution 69/283, annex II. \n \n4 Resolution 70/1. \n",
  "paragraphs": {
    "1": "Takes note with satisfaction of the positive assessment of the implementation of the Agreement between the United Nations and the Latin American and Caribbean Economic System, and urges the parties to continue strengthening the collaboration between both organizations;",
    "2": "Also takes note with satisfaction of the holding of the forty-ninth regular meeting of the Latin American Council of the Latin American and Caribbean Economic System, in Caracas on 5 and 6 December 2023, as well as its work programme aimed at building a regional agenda for integration and cooperation that contributes to overcoming the economic and social lags in its member countries;",
    "3": "Urges the Economic Commission for Latin America and the Caribbean to continue to deepen its coordination and mutual support activities with the Latin American and Caribbean Economic System;",
    "4": "Urges the specialized agencies and other organizations, funds and programmes of the United Nations system, in particular the Food and Agriculture Organization of the United Nations, the World Health Organization, the United Nations Industrial Development Organization, the World Food Programme, the United Nations Development Programme, the United Nations Conference on Trade and Development, the United Nations Educational, Scientific and Cultural Organization, the United Nations Children\u2019s Fund, the United Nations Office for Disaster Risk Reduction and the Office for the Coordination of Humanitarian Affairs of the Secretariat, as well as the International Organization for Migration and the World Tourism Organization, to continue and intensify their support for and to strengthen their cooperation, in accordance with their respective mandates, with the activities of the Latin American and Caribbean Economic System, and to contribute to joint actions to achieve sustainable development in Latin America and the Caribbean, in line with the 2030 Agenda for Sustainable Development and all its Goals and objectives;4",
    "5": "Invites the international community to continue to support the work of the different regional organizations in order to intensify cooperation and the exchange of relevant information to mitigate the consequences of the current economic crisis;",
    "6": "Requests the Secretary-General to submit to the General Assembly at its eighty-first session a report on the implementation of the present resolution. 39th plenary meeting 18 November 2024 _______________ 3 Resolution 69/283, annex II. 4 Resolution 70/1."
  },
  "agenda_items": [
    "Item 125"
  ],
  "symbol_references": [
    "A/79/L.14"
  ]
}