{
  "symbol": "A/RES/78/95",
  "filename": "A_RES_78_95.pdf",
  "title": "78/95. Question of Pitcairn",
  "text": "United Nations \nA/RES/78/95\n \n \nGeneral Assembly \nDistr.: General \n11 December 2023 \n \n23-24975 (E)    211223 \n*2324975* \n \n \nSeventy-eighth session \nAgenda item 58 \nImplementation of the Declaration on the Granting of \nIndependence to Colonial Countries and Peoples \n \n \n \n \n Resolution adopted by the General Assembly on \n7 December 2023 \n \n \n \n \n[on the report of the Special Political and Decolonization Committee \n(Fourth Committee) (A/78/429, para. 33)] \n \n \n \n78/95. Question of Pitcairn \n \n \n \nThe General Assembly, \n \nHaving considered the question of Pitcairn and examined the report of the Special \nCommittee on the Situation with regard to the Implementation of the Declaration on the \nGranting of Independence to Colonial Countries and Peoples for 2023,1 \n \nTaking note of the working paper prepared by the Secretariat on Pitcairn2 and \nother relevant information, \n \nRecognizing that all available options for self-determination of the Territory are \nvalid as long as they are in accordance with the freely expressed wishes of the people \nof Pitcairn and in conformity with the clearly defined principles contained in General \nAssembly resolutions 1514 (XV) of 14 December 1960, 1541 (XV) of 15 December \n1960 and other resolutions of the Assembly, \n \nExpressing concern that, more than 60 years after the adoption of the \nDeclaration on the Granting of Independence to Colonial Countries and Peoples,3 \nthere still remain 17 Non-Self-Governing Territories, including Pitcairn, \n \nConscious of the importance of continuing the effective implementation of the \nDeclaration, taking into account the target set by the United Nations to eradicate \ncolonialism by 2030 and the plan of action for the International Decades for the \nEradication of Colonialism,4 \n \nRecognizing that the specific characteristics and the aspirations of the people of \nPitcairn require flexible, practical and innovative approaches to the options for self-\n__________________ \n \n1 Official Records of the General Assembly, Seventy-eighth Session, Supplement No. 23 (A/78/23). \n \n2 A/AC.109/2023/12. \n \n3 Resolution 1514 (XV). \n \n4 A/56/61, annex. \n\nA/RES/78/95 \nQuestion of Pitcairn\n \n23-24975\n2/5 \n \ndetermination, without any prejudice to territorial size, geographical location, size of \npopulation or natural resources, \n \nConvinced that the wishes and aspirations of the people of the Territory should \ncontinue to guide the development of their future political status and that \nreferendums, free and fair elections and other forms of popular consultation play an \nimportant role in ascertaining the wishes and aspirations of the people, \n \nConcerned by the use and exploitation of the natural resources of the Non-Self-\nGoverning Territories by the administering Powers for their benefit, by the use of the \nTerritories as international financial centres to the detriment of the world economy \nand by the consequences of any economic activities of the administering Powers that \nare contrary to the interests of the people of the Territories, as well as to resolution \n1514 (XV), \n \nConvinced that any negotiations to determine the status of the Territory must \ntake place with the active involvement and participation of the people of the Territory, \nunder the auspices of the United Nations, on a case-by-case basis, and that the views \nof the people of Pitcairn in respect of their right to self-determination should be \nascertained, \n \nNoting the continued cooperation of the Non-Self-Governing Territories at the \nlocal and regional levels, including participation in the work of regional \norganizations, \n \nMindful that, in order for the Special Committee to enhance its understanding \nof the political status of the people of Pitcairn and to fulfil its mandate effectively, it \nis important for it to be apprised by the United Kingdom of Great Britain and Northern \nIreland as the administering Power and to receive information from other appropriate \nsources, including the representatives of the Territory, concerning the wishes and \naspirations of the people of the Territory, \n \nAware of the importance both to Pitcairn and to the Special Committee of the \nparticipation of elected and appointed representatives of Pitcairn in the work of the \nCommittee, \n \nRecognizing the need for the Special Committee to ensure that the appropriate \nbodies of the United Nations actively pursue a public awareness campaign aimed at \nassisting the people of Pitcairn with their inalienable right to self-determination and \nin gaining a better understanding of the options for self-determination, on a case-by-\ncase basis, \n \nMindful, in that connection, that the holding of regional seminars in the \nCaribbean and Pacific regions and at Headquarters, with the active participation of \nrepresentatives of the Non-Self-Governing Territories, provides a helpful means for \nthe Special Committee to fulfil its mandate and that the regional nature of the \nseminars, which alternate between the Caribbean and the Pacific, is a crucial element \nin the context of a United Nations programme for ascertaining the political status of \nthe Territories, \n \nWelcoming the Pacific regional seminar on the theme \u201cInnovative steps to ensure \nthe attainment of the Sustainable Development Goals in the Non-Self-Governing \nTerritories\u201d, held by the Special Committee in Bali, Indonesia, and hosted by the \nGovernment of Indonesia from 24 to 26 May 2023, as a significant and forward-\nlooking event, which enabled the participants to assess progress made and address \nchallenges faced in the decolonization process, review the existing working methods \nof the Committee and renew its commitment to implementing its historic task, \n \nRecalling the importance of the conclusions and recommendations adopted by \nthe seminar, which are annexed to the report of the Special Committee and which \n\nQuestion of Pitcairn \nA/RES/78/95\n \n3/5\n23-24975 \n \noutline the findings of the seminar, including, especially, the way forward for the \ndecolonization process within the context of the proclamation by the General \nAssembly of the period 2021\u20132030 as the Fourth International Decade for the \nEradication of Colonialism,5 \n \nNoting with appreciation the contribution to the development of some \nTerritories by the specialized agencies and other organizations of the United Nations \nsystem, in particular the Economic Commission for Latin America and the Caribbean, \nthe Economic and Social Commission for Asia and the Pacific, the United Nations \nDevelopment Programme and the World Food Programme, as well as regional \ninstitutions such as the Caribbean Development Bank, the Caribbean Community, the \nOrganisation of Eastern Caribbean States, the Pacific Islands Forum and the agencies \nof the Council of Regional Organizations in the Pacific, \n \nNoting with serious concern that the Territory last participated in the activities \nof the Special Committee in 2004, \n \nTaking into account the unique character of Pitcairn in terms of population, area \nand access, \n \nAware that the administering Power and the territorial Government have \nimplemented a governance structure to strengthen administrative capacity in the \nTerritory, based on consultations with the people of the Territory, \n \nNoting that the administering Power and the territorial Government have \ndeveloped a five-year strategic development plan, covering the period from 2019 to \n2024, that sets out the views and aspirations of the people of the Territory for the \nsocioeconomic development of the Territory, \n \nRecalling with concern the findings contained in the final report on the survey \ncommissioned by the Pitcairn Island Council to ascertain whether members of the \ndiaspora had any interest in returning to the Territory and the factors conditioning a \ndecision,6 \n \nNoting the main challenges to socioeconomic development in the Territory, \nincluding the legacy of the child sexual abuse history and the continuing need to \nmaintain stringent child protection procedures, the ageing population and its declining \neconomic activity, with little or no migration to the island, and limited access to and \nfrom the island, \n \nRecalling that a marine protected area was established around Pitcairn in \nSeptember 2016, and noting the Pitcairn Islands marine protected area management \nplan for the period 2021\u20132026,7 \n \nWelcoming the measures taken by the administering Power to improve \naccessibility to the Territory with the introduction of enhanced transport and shipping \nservices, \n \nStressing the importance of regional ties for the development of a small island \nTerritory, \n \nNoting the elections that were held in November 2022,8 \n \nRecalling relevant resolutions adopted by the General Assembly in connection \nwith the coronavirus disease (COVID-19) pandemic, \n__________________ \n \n5 See resolution 75/123. \n \n6 See A/AC.109/2015/5, para. 14. \n \n7 See A/AC.109/2022/12, para. 41. \n \n8 See A/AC.109/2023/12, \u201cThe Territory at a glance\u201d. \n\nA/RES/78/95 \nQuestion of Pitcairn\n \n23-24975\n4/5 \n \n \n1. \nReaffirms the inalienable right of the people of Pitcairn to self-\ndetermination, in conformity with the Charter of the United Nations and with General \nAssembly resolution 1514 (XV), containing the Declaration on the Granting of \nIndependence to Colonial Countries and Peoples; \n \n2. \nAlso reaffirms that, in the process of decolonization of Pitcairn, there is no \nalternative to the principle of self-determination, which is also a fundamental human \nright, as recognized under the relevant human rights conventions; \n \n3. \nFurther reaffirms that it is ultimately for the people of Pitcairn to \ndetermine freely their future political status in accordance with the relevant \nprovisions of the Charter, the Declaration and the relevant resolutions of the General \nAssembly, and in that connection calls upon the administering Power, in cooperation \nwith the territorial Government and appropriate bodies of the United Nations system, \nto develop political education programmes for the Territory in order to foster an \nawareness among the people of their right to self-determination in conformity with \nthe legitimate political status options, based on the principles clearly defined in \nAssembly resolution 1541 (XV) and other relevant resolutions and decisions; \n \n4. \nWelcomes all efforts by the administering Power and the territorial \nGovernment that would further devolve operational responsibilities to the Territory, \nwith a view to gradually expanding self-government, including through the training \nof local personnel; \n \n5. \nRequests the administering Power to assist the Territory by facilitating its \nwork concerning public educational outreach efforts, consistent with Article 73 b of \nthe Charter, and in that regard calls upon the relevant United Nations organizations \nto provide assistance to the Territory, if requested; \n \n6. \nAlso requests the administering Power to continue its assistance for the \nimprovement of the economic, social, educational and other conditions of the \npopulation of the Territory and to continue its discussions with the territorial \nGovernment on how best to support socioeconomic and environmental security in \nPitcairn, including as regards demographic matters; \n \n7. \nStresses that the Territory should continue to participate in the activities of \nthe Special Committee on the Situation with regard to the Implementation of the \nDeclaration on the Granting of Independence to Colonial Countries and Peoples, \nincluding regional seminars, in order to provide the Committee with up-to-date \ninformation regarding the decolonization process; \n \n8. \nNotes the development of a new strategy for repopulation and the creation \nof a child safeguarding framework in place in Pitcairn; \n \n9. \nStresses the importance of the Special Committee being apprised of the \nviews and wishes of the people of Pitcairn and enhancing its understanding of their \nconditions, including the nature and scope of the existing political and constitutional \narrangements between Pitcairn and the administering Power; \n \n10. Calls upon the administering Power to participate in and cooperate fully \nwith the work of the Special Committee in order to implement the provisions of \nArticle 73 e of the Charter and the Declaration and in order to advise the Committee \non the implementation of the provisions under Article 73 b of the Charter on efforts \nto promote self-government in Pitcairn, and encourages the administering Power to \nfacilitate visiting and special missions to the Territory; \n \n11. \nReaffirms the responsibility of the administering Power under the Charter \nto promote the economic and social development and to preserve the cultural identity \nof the Territory, and requests the administering Power to take steps to enlist and make \n\nQuestion of Pitcairn \nA/RES/78/95\n \n5/5\n23-24975 \n \neffective use of all possible assistance, on both a bilateral and a multilateral basis, in \nthe strengthening of the economy of the Territory; \n \n12. Takes into account the 2030 Agenda for Sustainable Development, 9 \nincluding the Sustainable Development Goals, stresses the importance of fostering \nthe economic and social sustainable development of the Territory by promoting \nsustained, inclusive and equitable economic growth, creating greater opportunities for \nall, reducing inequalities, raising basic standards of living, fostering equitable social \ndevelopment and inclusion and promoting the integrated and sustainable management \nof natural resources and ecosystems that supports, inter alia, economic, social and \nhuman development, while facilitating ecosystem conservation, regeneration, \nrestoration and resilience in the face of new and emerging challenges, and strongly \nurges the administering Power to refrain from undertaking any kind of illicit, harmful \nand unproductive activities, including the use of the Territory as an international \nfinancial centre, that are not aligned with the interest of the people of the Territory; \n \n13. Requests the Territory and the administering Power to take all measures \nnecessary to protect and conserve the environment of the Territory against any \ndegradation, and once again requests the specialized agencies concerned to monitor \nenvironmental conditions in the Territory and to provide assistance to the Territory, \nconsistent with their prevailing rules of procedure; \n \n14. Requests the Special Committee to continue to examine the question of \nPitcairn and to report thereon to the General Assembly at its seventy-ninth session \nand on the implementation of the present resolution. \n \n45th plenary meeting \n7 December 2023 \n \n__________________ \n \n9 Resolution 70/1. \n",
  "paragraphs": {
    "1": "Reaffirms the inalienable right of the people of Pitcairn to self- determination, in conformity with the Charter of the United Nations and with General Assembly resolution 1514 (XV), containing the Declaration on the Granting of Independence to Colonial Countries and Peoples;",
    "2": "Also reaffirms that, in the process of decolonization of Pitcairn, there is no alternative to the principle of self-determination, which is also a fundamental human right, as recognized under the relevant human rights conventions;",
    "3": "Further reaffirms that it is ultimately for the people of Pitcairn to determine freely their future political status in accordance with the relevant provisions of the Charter, the Declaration and the relevant resolutions of the General Assembly, and in that connection calls upon the administering Power, in cooperation with the territorial Government and appropriate bodies of the United Nations system, to develop political education programmes for the Territory in order to foster an awareness among the people of their right to self-determination in conformity with the legitimate political status options, based on the principles clearly defined in Assembly resolution 1541 (XV) and other relevant resolutions and decisions;",
    "4": "Welcomes all efforts by the administering Power and the territorial Government that would further devolve operational responsibilities to the Territory, with a view to gradually expanding self-government, including through the training of local personnel;",
    "5": "Requests the administering Power to assist the Territory by facilitating its work concerning public educational outreach efforts, consistent with Article 73 b of the Charter, and in that regard calls upon the relevant United Nations organizations to provide assistance to the Territory, if requested;",
    "6": "Also requests the administering Power to continue its assistance for the improvement of the economic, social, educational and other conditions of the population of the Territory and to continue its discussions with the territorial Government on how best to support socioeconomic and environmental security in Pitcairn, including as regards demographic matters;",
    "7": "Stresses that the Territory should continue to participate in the activities of the Special Committee on the Situation with regard to the Implementation of the Declaration on the Granting of Independence to Colonial Countries and Peoples, including regional seminars, in order to provide the Committee with up-to-date information regarding the decolonization process;",
    "8": "Notes the development of a new strategy for repopulation and the creation of a child safeguarding framework in place in Pitcairn;",
    "9": "Stresses the importance of the Special Committee being apprised of the views and wishes of the people of Pitcairn and enhancing its understanding of their conditions, including the nature and scope of the existing political and constitutional arrangements between Pitcairn and the administering Power;",
    "10": "Calls upon the administering Power to participate in and cooperate fully with the work of the Special Committee in order to implement the provisions of Article 73 e of the Charter and the Declaration and in order to advise the Committee on the implementation of the provisions under Article 73 b of the Charter on efforts to promote self-government in Pitcairn, and encourages the administering Power to facilitate visiting and special missions to the Territory;",
    "11": " effective use of all possible assistance, on both a bilateral and a multilateral basis, in the strengthening of the economy of the Territory;",
    "12": "Takes into account the 2030 Agenda for Sustainable Development, 9 including the Sustainable Development Goals, stresses the importance of fostering the economic and social sustainable development of the Territory by promoting sustained, inclusive and equitable economic growth, creating greater opportunities for all, reducing inequalities, raising basic standards of living, fostering equitable social development and inclusion and promoting the integrated and sustainable management of natural resources and ecosystems that supports, inter alia, economic, social and human development, while facilitating ecosystem conservation, regeneration, restoration and resilience in the face of new and emerging challenges, and strongly urges the administering Power to refrain from undertaking any kind of illicit, harmful and unproductive activities, including the use of the Territory as an international financial centre, that are not aligned with the interest of the people of the Territory;",
    "13": "Requests the Territory and the administering Power to take all measures necessary to protect and conserve the environment of the Territory against any degradation, and once again requests the specialized agencies concerned to monitor environmental conditions in the Territory and to provide assistance to the Territory, consistent with their prevailing rules of procedure;",
    "14": "Requests the Special Committee to continue to examine the question of Pitcairn and to report thereon to the General Assembly at its seventy-ninth session and on the implementation of the present resolution."
  },
  "agenda_items": [
    "Item 58"
  ],
  "symbol_references": []
}