{
  "symbol": "A/RES/79/318",
  "filename": "A_RES_79_318.pdf",
  "title": "79/318. UN80 Initiative",
  "text": "United Nations \nA/RES/79/318\n \nGeneral Assembly \nDistr.: General \n18 July 2025 \n25-11845 (E) \n*2511845* \n \n \nSeventy-ninth session \nAgenda item 123 (a) \nStrengthening of the United Nations system: \nstrengthening of the United Nations system \n \n \n \n \n Resolution adopted by the General Assembly \non 18 July 2025 \n \n \n[without reference to a Main Committee (A/79/L.99)] \n \n \n 79/318. UN80 Initiative \n \n \n \nThe General Assembly, \n \nRecalling the purposes and principles of the Charter of the United Nations, \n \nUnderlining the important role and comparative advantage of an adequately \nresourced, relevant, coherent, efficient and effective United Nations system in \npromoting international cooperation, \n \nRecalling the role of the Secretary-General as the chief administrative officer of \nthe Organization, in accordance with Article 97 of the Charter, \n \nRecognizing the central role of Member States in the reform process, which \nshould be inclusive and transparent, \n \n1. \nWelcomes the efforts of the Secretary-General to strengthen the United \nNations in order to keep pace with a changing world and to make it fit for the present \nand future challenges; \n \n2. \nLooks forward to receiving, in accordance with established procedures, the \nrelevant proposals of the Secretary-General in the framework of his UN80 initiative, \ntaking into account the necessity to have clearly defined objectives and an evidence-\nbased approach, and aiming at strengthening the impact of the United Nations and \nenhancing its agility, responsiveness and resilience while addressing the issue of \nduplicative efforts and ensuring effective and efficient mandate delivery across all \nthree pillars of the work of the United Nations; \n\nA/RES/79/318 \nUN80 Initiative\n \n25-11845\n2/2 \n \n \n3. \nCalls upon the entities and specialized agencies of the United Nations \nsystem to align their reform efforts with this approach, as appropriate.  \n \n85th plenary meeting \n18 July 2025 \n \n",
  "paragraphs": {
    "1": "Welcomes the efforts of the Secretary-General to strengthen the United Nations in order to keep pace with a changing world and to make it fit for the present and future challenges;",
    "2": "Looks forward to receiving, in accordance with established procedures, the relevant proposals of the Secretary-General in the framework of his UN80 initiative, taking into account the necessity to have clearly defined objectives and an evidence- based approach, and aiming at strengthening the impact of the United Nations and enhancing its agility, responsiveness and resilience while addressing the issue of duplicative efforts and ensuring effective and efficient mandate delivery across all three pillars of the work of the United Nations; A/RES/79/318 UN80 Initiative 25-11845 2/2",
    "3": "Calls upon the entities and specialized agencies of the United Nations system to align their reform efforts with this approach, as appropriate. 85th plenary meeting 18 July 2025"
  },
  "agenda_items": [
    "Item 123"
  ],
  "symbol_references": [
    "A/79/L.99"
  ]
}