{
  "symbol": "A/RES/75/314",
  "filename": "A_RES_75_314.pdf",
  "title": "75/314. Establishment of the Permanent Forum of People of African Descent",
  "text": "United Nations \nA/RES/75/314\n \n \nGeneral Assembly \nDistr.: General \n6 August 2021 \n \n21-10629 (E)    110821    \n*2110629* \n \n \nSeventy-fifth session \nAgenda item 70 (b) \nElimination of racism, racial discrimination, xenophobia \nand related intolerance: comprehensive implementation of \nand follow-up to the Durban Declaration and Programme \nof Action \n \n \n \n \n Resolution adopted by the General Assembly \non 2 August 2021 \n \n \n \n \n[without reference to a Main Committee (A/75/L.119/Rev.1)] \n \n \n 75/314. Establishment of the Permanent Forum of People of \nAfrican Descent \n \n \n \nThe General Assembly, \n \nGuided by the purposes and principles of the Charter of the United Nations, and \ngood faith in the fulfilment of the obligations assumed by States in accordance with \nthe Charter, \n \nRecalling its resolution 52/111 of 12 December 1997, by which it decided to \nconvene the World Conference against Racism, Racial Discrimination, Xenophobia \nand Related Intolerance, and its resolutions 56/266 of 27 March 2002, 57/195 of \n18 December 2002, 58/160 of 22 December 2003, 59/177 of 20 December 2004 and \n60/144 of 16 December 2005, which guided the comprehensive follow-up to the \nWorld Conference and the effective implementation of the Durban Declaration and \nProgramme of Action,1 \n \nRecalling also its resolution 68/237 of 23 December 2013, by which it \nproclaimed the International Decade for People of African Descent, commencing on \n1 January 2015 and ending on 31 December 2024, with the theme \u201cPeople of African \ndescent: recognition, justice and development\u201d, to be officially launched immediately \nfollowing the general debate of the sixty-ninth session of the General Assembly, and \nto this end emphasizing the opportunity for achieving important synergy in the \ncombating of all the scourges of racism through the effective observance of the \nDecade, and in this regard contributing to the implementation of the Durban \nDeclaration and Programme of Action, \n__________________ \n \n1  See A/CONF.189/12 and A/CONF.189/12/Corr.1, chap. I. \n\nA/RES/75/314 \nEstablishment of the Permanent Forum of People of \nAfrican Descent\n \n21-10629\n2/5 \n \n \nRecalling further its resolution 69/16 of 18 November 2014, in which it adopted \nthe programme of activities for the implementation of the International Decade for \nPeople of African Descent, and decided to establish a forum as a consultation \nmechanism for people of African descent and other relevant stakeholders and that \nconsideration should be given to the elaboration of a draft United Nations declaration \non the promotion and full respect of the human rights of people of African descent, \n \nNoting the contributions submitted by relevant stakeholders, individuals, groups \nand organizations to the Office of the United Nations High Commissioner for Human \nRights in March 2015 on their vision for the new forum for people of African descent, \nnoting also the constructive discussions held in Geneva on the modalities of the \nPermanent Forum on People of African Descent on 10 May 2019, and taking note of \nthe report of the Chair resulting from the one-day consultation on the Permanent \nForum on People of African Descent,2 \n \nTaking note with appreciation of the statement of the United Nations High \nCommissioner for Human Rights that the Permanent Forum will join other similar \nmechanisms under the Human Rights Council that have all proven to be vibrant \nmechanisms that build on the expertise of the United Nations human rights system \nunder the Human Rights Council and supported by the Office of the High \nCommissioner, \n \nRecognizing with concern that, despite efforts to combat racism, racial \ndiscrimination, xenophobia and related intolerance, instances of and various forms of \nracism, racial discrimination, xenophobia and related intolerance remain widespread, \nacknowledging that acts of racism, racial discrimination, xenophobia and related \nintolerance should be condemned wherever and whenever they occur, and recognizing \nthat people of African descent have for centuries been victims of racism, racial \ndiscrimination and enslavement and the denial of many of their rights, and asserting \nthat they should be treated with fairness and respect for their dignity and should not \nsuffer discrimination of any kind, \n \nReiterating that all human beings are born free and equal in dignity and rights \nand have the potential to contribute constructively to the development and well-being \nof their societies, and that any doctrine of racial superiority is scientifically false, \nmorally condemnable, socially unjust and dangerous and must be rejected, together \nwith theories that attempt to determine the existence of separate human races, \n \nNoting that 2021 marks the twentieth anniversary of the adoption of the Durban \nDeclaration and Programme of Action, and recalling that the midterm review of the \nInternational Decade for People of African Descent and its programme of activities \nwas supposed to take place in 2020, \n \nCommitting to finalizing the modalities, format and substantive and procedural \naspects of the Permanent Forum before the midterm review of the International \nDecade for People of African Descent as one means of furthering the objectives of \nthe International Decade in partnership between Governments, people of African \ndescent and relevant stakeholders, \n \nBearing in mind that the global fight against racism, racial discrimination, \nxenophobia and related intolerance and all their abhorrent and contemporary forms \nand manifestations is a matter of priority for the international community, \n \nCommitted to upholding human dignity and equality for the victims of slavery, \nthe slave trade and colonialism, in particular people of African descent in the African \ndiaspora, \n__________________ \n \n2  A/PFPAD/2019/1. \n\nEstablishment of the Permanent Forum of People of \nAfrican Descent \nA/RES/75/314\n \n3/5\n21-10629 \n \n \n1. \nDecides to establish the Permanent Forum of People of African Descent as \na consultative mechanism for people of African descent and other relevant \nstakeholders as a platform for improving the safety and quality of life and livelihoods \nof people of African descent, as well as an advisory body to the Human Rights \nCouncil, in line with paragraph 29 (i) of the programme of activities for the \nimplementation of the International Decade for People of African Descent 3 and in \nclose coordination with existing mechanisms, with the mandate: \n \n(a) \nTo contribute to the full political, economic and social inclusion of people \nof African descent in the societies in which they live as equal citizens without \ndiscrimination of any kind and contribute to ensuring equal enjoyment of all human \nrights; \n \n(b) \nTo provide, in coordination with existing mechanisms, expert advice and \nrecommendations to the Human Rights Council, the Main Committees of the General \nAssembly and organs, programmes, funds and agencies of the United Nations aimed \nat addressing challenges of all the scourges of racism, racial discrimination, \nxenophobia and related intolerance and all their contemporary forms and \nmanifestations confronted by people of African descent and that impede the full and \neffective realization and enjoyment of all their human rights and fundamental \nfreedoms; \n \n(c) \nTo consider the elaboration of a United Nations declaration on the \npromotion, protection and full respect of the human rights of people of African \ndescent; \n \n(d) \nTo identify and analyse best practices, challenges, opportunities and \ninitiatives to address, as appropriate, the issues highlighted in the provisions of the \nDurban Declaration and Programme of Action relevant to people of African descent; \n \n(e) \nTo monitor and review progress on the effective implementation of the \nprogramme of activities of the International Decade for People of African Descent, \nand to this end gather relevant information from Governments, United Nations bodies \nand organs, intergovernmental organizations, non-governmental organizations and \nother relevant sources; \n \n(f) \nTo request the preparation and dissemination of information by the United \nNations system on issues relating to people of African descent and promote a greater \nknowledge of and respect for the diverse heritage, culture and contribution of people \nof African descent to the development of societies; \n \n(g) \nTo raise awareness and promote integration and coordination of activities \nof agencies, funds and programmes relating to people of African descent within the \nUnited Nations system; \n \n(h) \nTo support the coordination of programmes aimed at the socioeconomic \ndevelopment of communities and people of African descent, and to examine the \nurgent global need to establish adequate channels to obtain data disaggregated by \nincome, sex, age, race, ethnicity, migratory status, disability, geographical location \nand other characteristics relevant in national contexts, to enable the systematic design \nand collection of and access to high-quality, reliable and timely disaggregated data \nand gender statistics, conducive to the better execution of public policies in relation \nto people of African descent; \n \n(i) \nTo offer advice and recommendations on matters concerning the \nprotection, promotion and respect of all human rights of people of African descent, \n__________________ \n \n3  Resolution 69/16, annex. \n\nA/RES/75/314 \nEstablishment of the Permanent Forum of People of \nAfrican Descent\n \n21-10629\n4/5 \n \nand to undertake any specific task as requested by the Human Rights Council or the \nGeneral Assembly; \n \n2. \nAlso decides that the Permanent Forum shall consist of 10 members: \n5 members to be nominated by Governments, based on equitable geographical \ndistribution, and elected by the General Assembly and 5 members to be appointed by \nthe President of the Human Rights Council following consultation with the Bureau \nand the regional groups through their coordinators, on the basis of broad consultations \nwith organizations of people of African descent; membership shall take into account \nthe diversity and geographical distribution of people of African descent in the world, \nensuring gender parity as well as the principles of transparency, representativity and \nequal opportunity for all people of African descent, and all members shall serve in \ntheir personal capacity as independent experts on issues of people of African descent \nfor a period of three years with the possibility of re-election or reappointment for one \nfurther period; \n \n3. \nFurther decides that the Permanent Forum shall be open to the \nparticipation of States, United Nations mechanisms, bodies and specialized agencies, \nfunds and programmes, intergovernmental organizations, regional organizations and \nmechanisms in the field of human rights, national human rights institutions and other \nrelevant national bodies, academics and experts on issues related to people of African \ndescent and non-governmental organizations in consultative status with the Economic \nand Social Council; the Permanent Forum shall also be open to the participation of \nother non-governmental organizations, including grass-roots and community-based \norganizations, whose aims and purposes are in conformity with the spirit, purposes \nand principles of the Charter of the United Nations; \n \n4. \nDecides that the Permanent Forum shall submit an annual report to the \nHuman Rights Council and the General Assembly on its activities, including advice \nand recommendations for future thematic subjects for their consideration, and engage \nin the interactive dialogue; the report shall be distributed to all Member States and \nthe relevant United Nations organs, funds, programmes and agencies as a means, inter \nalia, of furthering the dialogue within the United Nations system on issues affecting \npeople of African descent; \n \n5. \nAlso decides that the Permanent Forum of People of African Descent shall \nappoint for each session, on the basis of regional rotation, and in consultation with \nregional groups and organizations of people of African descent, a Chair and a Vice-\nChair of the Permanent Forum of People of African Descent selected from among the \nmembers of the Permanent Forum; the Permanent Forum shall appoint the Rapporteur \nfrom among the members of the Permanent Forum, who may retain this role for \nsuccessive sessions without rotation; the Chair, Vice-Chair and Rapporteur, serving \nin their personal capacity, shall be responsible for the preparation of a summary of \nthe discussions of the Forum, to be made available to all participants in the Forum; \n \n6. \nFurther decides that the Permanent Forum shall meet annually, rotating \nbetween the United Nations Office at Geneva and United Nations Headquarters or at \nsuch other place as the Permanent Forum may decide in accordance with existing \nfinancial rules and regulations of the United Nations, for four working days, allocated \nto thematic discussions, and decides that the Permanent Forum shall be organized, to \nthe extent possible, back-to-back with a session of the Working Group of Experts on \nPeople of African Descent or the Intergovernmental Working Group on the Effective \nImplementation of the Durban Declaration and Programme of Action; \n \n7. \nDecides that the Permanent Forum will contribute to and promote the \nefforts of the United Nations High Commissioner for Human Rights to improve the \ncooperation among United Nations mechanisms, the universal periodic review, the \n\nEstablishment of the Permanent Forum of People of \nAfrican Descent \nA/RES/75/314\n \n5/5\n21-10629 \n \nEconomic and Social Council high-level political forum on sustainable development, \ntreaty bodies, special procedures and specialized agencies, funds and programmes on \nactivities related to the promotion and protection and full respect of all human rights \nof people of African descent, including at the national and regional levels, ensuring \nthat there is complementarity and non-duplication; \n \n8. \nRequests that the work of the Permanent Forum be carried out in \ncoordination with existing United Nations mechanisms relevant to the mandate of the \nPermanent Forum; \n \n9. \nRequests the Secretary-General and the High Commissioner to provide the \nPermanent Forum, through the regular budget as well as voluntary contributions, with \nall necessary resources, including services and facilities, to fulfil its mandate, through \nthe convening of the Permanent Forum, the organization of its sessions and the \nparticipation of relevant stakeholders from every region in its meetings, ensuring \nbroadest, equitable geographical and diverse participation, including, in particular, \nthe full and equal participation of women; \n \n10. Decides that the Permanent Forum shall convene its first session the \nfollowing year after the present resolution is adopted and that, after four annual \nsessions of the Permanent Forum, an evaluation of its modalities shall be carried out \nby the General Assembly on the basis of an evaluation made by the Human Rights \nCouncil in the light of the experience gained. \n \n97th plenary meeting \n2 August 2021 \n \n",
  "paragraphs": {
    "1": "Decides to establish the Permanent Forum of People of African Descent as a consultative mechanism for people of African descent and other relevant stakeholders as a platform for improving the safety and quality of life and livelihoods of people of African descent, as well as an advisory body to the Human Rights Council, in line with paragraph 29 (i) of the programme of activities for the implementation of the International Decade for People of African Descent 3 and in close coordination with existing mechanisms, with the mandate: (a) To contribute to the full political, economic and social inclusion of people of African descent in the societies in which they live as equal citizens without discrimination of any kind and contribute to ensuring equal enjoyment of all human rights; (b) To provide, in coordination with existing mechanisms, expert advice and recommendations to the Human Rights Council, the Main Committees of the General Assembly and organs, programmes, funds and agencies of the United Nations aimed at addressing challenges of all the scourges of racism, racial discrimination, xenophobia and related intolerance and all their contemporary forms and manifestations confronted by people of African descent and that impede the full and effective realization and enjoyment of all their human rights and fundamental freedoms; (c) To consider the elaboration of a United Nations declaration on the promotion, protection and full respect of the human rights of people of African descent; (d) To identify and analyse best practices, challenges, opportunities and initiatives to address, as appropriate, the issues highlighted in the provisions of the Durban Declaration and Programme of Action relevant to people of African descent; (e) To monitor and review progress on the effective implementation of the programme of activities of the International Decade for People of African Descent, and to this end gather relevant information from Governments, United Nations bodies and organs, intergovernmental organizations, non-governmental organizations and other relevant sources; (f) To request the preparation and dissemination of information by the United Nations system on issues relating to people of African descent and promote a greater knowledge of and respect for the diverse heritage, culture and contribution of people of African descent to the development of societies; (g) To raise awareness and promote integration and coordination of activities of agencies, funds and programmes relating to people of African descent within the United Nations system; (h) To support the coordination of programmes aimed at the socioeconomic development of communities and people of African descent, and to examine the urgent global need to establish adequate channels to obtain data disaggregated by income, sex, age, race, ethnicity, migratory status, disability, geographical location and other characteristics relevant in national contexts, to enable the systematic design and collection of and access to high-quality, reliable and timely disaggregated data and gender statistics, conducive to the better execution of public policies in relation to people of African descent; (i) To offer advice and recommendations on matters concerning the protection, promotion and respect of all human rights of people of African descent, __________________ 3 Resolution 69/16, annex. A/RES/75/314 Establishment of the Permanent Forum of People of African Descent 21-10629 4/5 and to undertake any specific task as requested by the Human Rights Council or the General Assembly;",
    "2": "Also decides that the Permanent Forum shall consist of 10 members: 5 members to be nominated by Governments, based on equitable geographical distribution, and elected by the General Assembly and 5 members to be appointed by the President of the Human Rights Council following consultation with the Bureau and the regional groups through their coordinators, on the basis of broad consultations with organizations of people of African descent; membership shall take into account the diversity and geographical distribution of people of African descent in the world, ensuring gender parity as well as the principles of transparency, representativity and equal opportunity for all people of African descent, and all members shall serve in their personal capacity as independent experts on issues of people of African descent for a period of three years with the possibility of re-election or reappointment for one further period;",
    "3": "Further decides that the Permanent Forum shall be open to the participation of States, United Nations mechanisms, bodies and specialized agencies, funds and programmes, intergovernmental organizations, regional organizations and mechanisms in the field of human rights, national human rights institutions and other relevant national bodies, academics and experts on issues related to people of African descent and non-governmental organizations in consultative status with the Economic and Social Council; the Permanent Forum shall also be open to the participation of other non-governmental organizations, including grass-roots and community-based organizations, whose aims and purposes are in conformity with the spirit, purposes and principles of the Charter of the United Nations;",
    "4": "Decides that the Permanent Forum shall submit an annual report to the Human Rights Council and the General Assembly on its activities, including advice and recommendations for future thematic subjects for their consideration, and engage in the interactive dialogue; the report shall be distributed to all Member States and the relevant United Nations organs, funds, programmes and agencies as a means, inter alia, of furthering the dialogue within the United Nations system on issues affecting people of African descent;",
    "5": "Also decides that the Permanent Forum of People of African Descent shall appoint for each session, on the basis of regional rotation, and in consultation with regional groups and organizations of people of African descent, a Chair and a Vice- Chair of the Permanent Forum of People of African Descent selected from among the members of the Permanent Forum; the Permanent Forum shall appoint the Rapporteur from among the members of the Permanent Forum, who may retain this role for successive sessions without rotation; the Chair, Vice-Chair and Rapporteur, serving in their personal capacity, shall be responsible for the preparation of a summary of the discussions of the Forum, to be made available to all participants in the Forum;",
    "6": "Further decides that the Permanent Forum shall meet annually, rotating between the United Nations Office at Geneva and United Nations Headquarters or at such other place as the Permanent Forum may decide in accordance with existing financial rules and regulations of the United Nations, for four working days, allocated to thematic discussions, and decides that the Permanent Forum shall be organized, to the extent possible, back-to-back with a session of the Working Group of Experts on People of African Descent or the Intergovernmental Working Group on the Effective Implementation of the Durban Declaration and Programme of Action;",
    "7": "Decides that the Permanent Forum will contribute to and promote the efforts of the United Nations High Commissioner for Human Rights to improve the cooperation among United Nations mechanisms, the universal periodic review, the Establishment of the Permanent Forum of People of African Descent A/RES/75/314 5/5 21-10629 Economic and Social Council high-level political forum on sustainable development, treaty bodies, special procedures and specialized agencies, funds and programmes on activities related to the promotion and protection and full respect of all human rights of people of African descent, including at the national and regional levels, ensuring that there is complementarity and non-duplication;",
    "8": "Requests that the work of the Permanent Forum be carried out in coordination with existing United Nations mechanisms relevant to the mandate of the Permanent Forum;",
    "9": "Requests the Secretary-General and the High Commissioner to provide the Permanent Forum, through the regular budget as well as voluntary contributions, with all necessary resources, including services and facilities, to fulfil its mandate, through the convening of the Permanent Forum, the organization of its sessions and the participation of relevant stakeholders from every region in its meetings, ensuring broadest, equitable geographical and diverse participation, including, in particular, the full and equal participation of women;",
    "10": "Decides that the Permanent Forum shall convene its first session the following year after the present resolution is adopted and that, after four annual sessions of the Permanent Forum, an evaluation of its modalities shall be carried out by the General Assembly on the basis of an evaluation made by the Human Rights Council in the light of the experience gained. 97th plenary meeting 2 August 2021"
  },
  "agenda_items": [
    "Item 70"
  ],
  "symbol_references": [
    "A/75/L.119"
  ]
}