{
  "symbol": "A/RES/75/278",
  "filename": "A_RES_75_278.pdf",
  "title": "75/278. Declaring the Aral Sea region a zone of ecological innovations and technologies",
  "text": "United Nations \nA/RES/75/278 \n \n \nGeneral Assembly \nDistr.: General \n21 May 2021 \n \n21-06599 (E)    070621     \n*2106599* \n \n \nSeventy-fifth session \nAgenda item 19 \nSustainable development \n \n \n \n \n Resolution adopted by the General Assembly \non 18 May 2021 \n \n \n \n \n[without reference to a Main Committee (A/75/L.83 and A/75/L.83/Add.1)] \n \n \n 75/278. Declaring the Aral Sea region a zone of ecological innovations \nand technologies \n \n \n \nThe General Assembly, \n \nGuided by the provisions of the Charter of the United Nations, which \nencourages the adoption of measures to improve standards of living, full employment \nand conditions of economic and social progress and development, \n \nRecalling its resolution 75/266 of 3 March 2021 on cooperation between the \nUnited Nations and the International Fund for Saving the Aral Sea, and convinced that \nthe activities of the International Fund for Saving the Aral Sea and its bodies should \ntake into account the interests and needs of all the countries of Central Asia, \n \nRecalling its resolution 74/229 of 19 December 2019 on science, technology \nand innovation for sustainable development, \n \nRecalling also its resolution 72/283 of 22 June 2018 on strengthening regional \nand international cooperation to ensure peace, stability and sustainable development \nin the Central Asian region, in which it noted the importance of developing and \nstrengthening bilateral and regional cooperation in the sphere of the rational and \nintegrated use of water and energy resources in Central Asia, taking into account the \ninterests of all States of the region, \n \nRecalling further its resolution 74/214 of 19 December 2019 on sustainable \ntourism and sustainable development in Central Asia, in which it recognized the \nimportant role of sustainable tourism as a positive instrument towards the \nimprovement of the quality of life for all people and its contribution to sustainable \ndevelopment and to the eradication of poverty and the protection of the environment, \n \nReaffirming its resolution 70/1 of 25 September 2015, entitled \u201cTransforming \nour world: the 2030 Agenda for Sustainable Development\u201d, in which it adopted a \ncomprehensive, far-reaching and people-centred set of universal and transformative \n\nA/RES/75/278 \nDeclaring the Aral Sea region a zone of ecological innovations \nand technologies\n \n21-06599\n2/3 \n \nSustainable Development Goals and targets, its commitment to working tirelessly for \nthe full implementation of the Agenda by 2030, its recognition that eradicating \npoverty in all its forms and dimensions, including extreme poverty, is the greatest \nglobal challenge and an indispensable requirement for sustainable development, its \ncommitment to achieving sustainable development in its three dimensions \u2013 economic, \nsocial and environmental \u2013 in a balanced and integrated manner, and to building upon \nthe achievements of the Millennium Development Goals and seeking to address their \nunfinished business, \n \nRecalling the report of the Secretary-General,1 which provides information on \ntrends in new and emerging technologies and their impact on sustainable \ndevelopment, showcases lessons learned and good practices from developing \ncountries in strengthening capacities for science, technology and innovation, and \nhighlights findings from high-level policy discussions and research on science, \ntechnology and innovation as an enabler of sustainable development at the national, \nregional and global levels, \n \nRecalling also the report of the High-level Panel on Digital Cooperation, \nentitled \u201cThe age of digital interdependence\u201d, submitted to the Secretary-General on \n10 June 2019, and recalling further the report of the Secretary-General entitled \u201cRoad \nmap for digital cooperation\u201d, presented on 11 June 2020, \n \nRecognizing the vital role that science, technology and innovation, including \nenvironmentally sound technologies, can play in development and in facilitating efforts \nto address global challenges, such as efforts to protect the environment, accelerate the \npace of economic diversification and transformation, improve productivity and \ncompetitiveness and ultimately support sustainable development, \n \nRecognizing also that science, technology and innovation cooperation and \ncollaboration with, as well as foreign direct investment in and trade with and among, \ndeveloping countries is fundamental to enhancing their ability to produce, access, \ncomprehend, select, adapt and use science, technology and innovation knowledge, \n \nAcknowledging that the negative humanitarian, environmental and socioeconomic \nconsequences of the Aral Sea basin tragedy go well beyond the region and represent \na global concern, \n \nRecalling the creation of the multi-partner human security trust fund for the Aral \nSea region under the auspices of the United Nations, which aims to overcome the \nnegative circumstances of the ecological catastrophe in the Aral Sea region and \nimplement projects to improve the socioeconomic situation in the region, \n \nNoting the creation of the International Innovation Center for the Aral Sea Basin \nunder the President of the Republic of Uzbekistan, whose activities at the national \nlevel are aimed at improving the ecosystem and sustainable life in saline lands, as \nwell as partnership cooperation with international organizations for the development \nand implementation of innovations and solutions to various problems of saline \nenvironments of the drained bottom of the Aral Sea, \n \n1. \nSupports the initiative to transform the Aral Sea region from a zone of \necological crisis into a zone of ecological innovations and technologies; \n \n2. \nExpresses its support for the ongoing regional efforts and initiatives to \nstrengthen the environmental, social, economic and demographic situation of the Aral \nSea region; \n__________________ \n \n1 A/74/230. \n\nDeclaring the Aral Sea region a zone of ecological innovations \nand technologies \nA/RES/75/278\n \n3/3\n21-06599 \n \n \n3. \nEncourages research and scientific advisory activities to further recover \nand improve the environment, preserve natural resources and enhance the quality of \nlife of the population of the Aral Sea region; \n \n4. \nReaffirms that the International Fund for Saving the Aral Sea remains the \nmain international agency that aims to solve international problems of an economic, \nsocial or humanitarian nature in the Aral Sea region, and the whole Aral Sea basin, \ntaking into account the interests of all countries of the region; \n \n5. \nInvites Member States, the funds, programmes and agencies of the United \nNations system, international financial institutions and other relevant stakeholders to \nconduct joint collaborative interdisciplinary research and scientific and innovative \ncooperation in the Aral Sea region with the International Fund for Saving the Aral Sea, \nas well as with national initiatives such as the International Innovation Center for the \nAral Sea Basin under the President of the Republic of Uzbekistan, and to establish \nprotective forest plantations on the drained bottom of the Aral Sea; \n \n6. \nEmphasizes the importance of strengthening regional cooperation in the \nimplementation of joint actions to overcome the consequences of the Aral Sea crisis \nand stabilize the ecological situation in the Aral Sea region, prevent further \ndesertification and mitigate the negative environmental and socioeconomic \nconsequences by stabilizing the methods of forest amelioration of sand formations on \nthe drained bottom of the Aral Sea, which is subject to ash, salt and dust transfer, and \npromoting socioeconomic development and adaptation to climate change, the \ndevelopment of ecotourism and the implementation of other measures; \n \n7. \nDeclares the Aral Sea region a zone of ecological innovations and \ntechnologies, and in this context calls upon Member States, the funds, programmes \nand agencies of the United Nations system, international financial institutions and \nother relevant stakeholders to develop and implement in the Aral Sea region \nenvironmentally sound technologies, sustained, inclusive and sustainable economic \ngrowth, and energy- and water-saving technologies, in line with goal 17.7 of the 2030 \nAgenda for Sustainable Development.2 \n \n66th plenary meeting \n18 May 2021 \n \n__________________ \n \n2 Resolution 70/1. \n",
  "paragraphs": {
    "1": "Supports the initiative to transform the Aral Sea region from a zone of ecological crisis into a zone of ecological innovations and technologies;",
    "2": "Expresses its support for the ongoing regional efforts and initiatives to strengthen the environmental, social, economic and demographic situation of the Aral Sea region; __________________ 1 A/74/230. Declaring the Aral Sea region a zone of ecological innovations and technologies A/RES/75/278 3/3 21-06599",
    "3": "Encourages research and scientific advisory activities to further recover and improve the environment, preserve natural resources and enhance the quality of life of the population of the Aral Sea region;",
    "4": "Reaffirms that the International Fund for Saving the Aral Sea remains the main international agency that aims to solve international problems of an economic, social or humanitarian nature in the Aral Sea region, and the whole Aral Sea basin, taking into account the interests of all countries of the region;",
    "5": "Invites Member States, the funds, programmes and agencies of the United Nations system, international financial institutions and other relevant stakeholders to conduct joint collaborative interdisciplinary research and scientific and innovative cooperation in the Aral Sea region with the International Fund for Saving the Aral Sea, as well as with national initiatives such as the International Innovation Center for the Aral Sea Basin under the President of the Republic of Uzbekistan, and to establish protective forest plantations on the drained bottom of the Aral Sea;",
    "6": "Emphasizes the importance of strengthening regional cooperation in the implementation of joint actions to overcome the consequences of the Aral Sea crisis and stabilize the ecological situation in the Aral Sea region, prevent further desertification and mitigate the negative environmental and socioeconomic consequences by stabilizing the methods of forest amelioration of sand formations on the drained bottom of the Aral Sea, which is subject to ash, salt and dust transfer, and promoting socioeconomic development and adaptation to climate change, the development of ecotourism and the implementation of other measures;",
    "7": "Declares the Aral Sea region a zone of ecological innovations and technologies, and in this context calls upon Member States, the funds, programmes and agencies of the United Nations system, international financial institutions and other relevant stakeholders to develop and implement in the Aral Sea region environmentally sound technologies, sustained, inclusive and sustainable economic growth, and energy- and water-saving technologies, in line with goal 17.7 of the 2030 Agenda for Sustainable Development.2 66th plenary meeting 18 May 2021 __________________ 2 Resolution 70/1."
  },
  "agenda_items": [
    "Item 19"
  ],
  "symbol_references": [
    "A/75/L.83"
  ]
}