{
  "symbol": "A/RES/78/147",
  "filename": "A_RES_78_147.pdf",
  "title": "78/147. Central Asia facing environmental challenges: fostering regional solidarity for sustainable development and prosperity",
  "text": "United Nations \nA/RES/78/147\n \n \nGeneral Assembly \nDistr.: General \n21 December 2023 \n \n23-25918 (E)    020124     \n*2325918* \n \n \nSeventy-eighth session \nAgenda item 18 \nSustainable development \n \n \n \n \n Resolution adopted by the General Assembly \non 19 December 2023 \n \n \n \n \n[on the report of the Second Committee (A/78/461, para. 53)] \n \n \n 78/147. Central Asia facing environmental challenges: fostering regional \nsolidarity for sustainable development and prosperity \n \n \n \nThe General Assembly, \n \nReaffirming its resolution 70/1 of 25 September 2015, entitled \u201cTransforming \nour world: the 2030 Agenda for Sustainable Development\u201d, in which it adopted a \ncomprehensive, far-reaching and people-centred set of universal and transformative \nSustainable Development Goals and targets, its commitment to working tirelessly for \nthe full implementation of the Agenda by 2030, its recognition that eradicating \npoverty in all its forms and dimensions, including extreme poverty, is the greatest \nglobal challenge and an indispensable requirement for sustainable development, its \ncommitment to achieving sustainable development in its three dimensions \u2013 \neconomic, social and environmental \u2013 in a balanced and integrated manner, and to \nbuilding upon the achievements of the Millennium Development Goals and seeking \nto address their unfinished business,  \n \nRecalling its resolutions 75/278 of 18 May 2021 on declaring the Aral Sea \nregion a zone of ecological innovations and technologies, 77/158 of 14 December \n2022 on the proclamation of the International Year of Glaciers\u2019 Preservation, 77/165 \nof 14 December 2022 on the protection of global climate for present and future \ngenerations of humankind, 77/172 of 14 December 2022 on sustainable mountain \ndevelopment, 77/286 of 16 May 2023 on the proclamation of World Sustainable \nTransport Day and 77/334 of 1 September 2023 on the follow-up to the United \nNations Conference on the Midterm Comprehensive Review of the Implementation \nof the Objectives of the International Decade for Action, \u201cWater for Sustainable \nDevelopment\u201d, 2018\u20132028, \n \nRecognizing the need to take urgent action to combat climate change and its \nimpacts, \n\nA/RES/78/147 \nCentral Asia facing environmental challenges: fostering regional \nsolidarity for sustainable development and prosperity\n \n23-25918\n2/3 \n \n \nRecognizing also the importance of the unique ecological and geographical \nsignificance of the Aral Sea region, recognizing the catastrophic consequences of the \ndrying up of the Aral Sea, supporting the efforts of the countries of Central Asia aimed \nat preserving the Aral Sea, including the rational and effective use of the Aral water \nbasin, and acknowledging the urgent need for sustainable development in the Aral \nSea region, by promoting regional and international cooperation as well as financial \nand technical support, as appropriate, including, among other initiatives, through the \nInternational Fund for Saving the Aral Sea and the multi-partner human security trust \nfund for the Aral Sea region, \n \nRecognizing further that mountain ecosystems are highly vulnerable to the \nincreasing adverse impacts of climate change, extreme weather events, deforestation, \nforest fires and forest degradation, land-use change, land degradation and natural \ndisasters, from which they recover slowly, and that mountain glaciers around the \nworld are retreating and getting thinner, with increasing impacts on the environment, \nsustainable livelihoods and human well-being, while reaffirming the importance of \nthe Five Years of Action for the Development of Mountain Regions proclaimed for \nthe period 2023\u20132027 to give new impetus to the international community\u2019s efforts \nto address the challenges and problems of mountain countries,  \n \nNoting that, over the past decades, global warming has led to widespread \nshrinking of the cryosphere, with mass loss from ice sheets and glaciers and \nreductions in snow cover, and stressing the urgent need to raise awareness of and to \npromote and facilitate actions and sustainable measures towards preserving glaciers, \nwhile seizing the opportunities of the International Year of Glaciers\u2019 Preservation in \n2025, \n \nWelcoming the offer of the Government of Tajikistan to convene an international \nconference dedicated to glaciers\u2019 preservation in Tajikistan in 2025, and the offer of \nthe Government of Kyrgyzstan to convene the second Global Mountain Summit in \nBishkek in 2027, \n \nNoting the intention of Turkmenistan to host the Regional Centre for Climate \nChange Mitigating Technologies, in cooperation with the Climate Technology Centre \nand Network, \n \nNoting also the adoption, by the Economic and Social Commission for Asia and \nthe Pacific at its seventy-ninth session, of resolution 79/8 of 19 May 2023 on the \nmodalities for the establishment of the United Nations special programme for the Aral \nSea basin, \n \nRecognizing that water is critical for sustainable development and the \neradication of poverty and hunger, that water, ecosystems, energy, food security and \nnutrition are linked and that water is indispensable for health, well-being and human \ndevelopment, including the empowerment of women, and a vital element of achieving \nthe Sustainable Development Goals and other relevant goals in the social, \nenvironmental and economic fields, \n \nWelcoming the convening of the United Nations Conference on the Midterm \nComprehensive Review of the Implementation of the Objectives of the International \nDecade for Action, \u201cWater for Sustainable Development,\u201d 2018\u20132028, from 22 to \n24 March 2023, \n \n1. \nReaffirms that climate change is one of the greatest challenges of our time, \npresenting a serious challenge to the sustainable development of all countries; \n \n2. \nEmphasizes the importance of strengthening regional cooperation to tackle \nenvironmental challenges in Central Asia, including the Aral Sea region, and \npromoting socioeconomic development and adaptation to climate change; \n\nCentral Asia facing environmental challenges: fostering regional \nsolidarity for sustainable development and prosperity \nA/RES/78/147\n \n3/3\n23-25918 \n \n \n3. \nTakes note of the adoption by the Heads of State of the Central Asian \ncountries of the regional programme known as \u201cGreen Agenda for Central Asia\u201d, \naimed at fostering sustainable development; \n \n4. \nWelcomes the initiative of Uzbekistan to convene an International Climate \nForum in Samarkand in 2024, dedicated to seeking coordinated approaches and \nsolutions to environmental challenges in the Central Asian region for achieving the \nSustainable Development Goals; \n \n5. \nAlso welcomes the initiative of Kazakhstan to organize a regional climate \nsummit in 2026, aimed at strengthening the regional response to climate change; \n \n6. \nFurther welcomes the commitment of the multi-partner human security \ntrust fund for the Aral Sea region to addressing climate change and promoting \nclimate-resilient development in the Aral Sea basin and Aral Sea region in its next \ncycle, invites Member States and relevant international organizations to contribute to \nthe trust fund, and calls for increased financial resources to support climate-resilient \ndevelopment projects in the Aral Sea basin and Aral Sea region; \n \n7. \nEncourages the multi-partner human security trust fund for the Aral Sea \nregion to prioritize projects and initiatives that are aimed at enhancing the climate \nresilience of communities in the Aral Sea basin and Aral Sea region, and to support \ninitiatives that are aimed at implementing climate-resilient development projects and \nachieving climate-related goals in the Aral Sea basin and Aral Sea region, including \nthose related to water management, building drought resilience, agriculture and \ndisaster risk reduction; \n \n8. \nRecognizes the importance of new and innovative technologies and best \npractices in combating desertification, drought and sand and dust storms and in \nachieving land degradation neutrality and drought resilience in Central Asia, \nwelcomes in this regard the holding of the twenty-first session of the Committee for \nthe Review of the Implementation of the United Nations Convention to Combat \nDesertification  and a high-level event on sand and dust storms in Samarkand, \nUzbekistan, from \n13 to 17 November 2023 to discuss action-oriented \nrecommendations and address the challenges faced by the affected countries; \n \n9. \nEncourages greater efforts by Central Asian countries, Member States, all \nrelevant stakeholders and the international community towards the conservation of \nmountain ecosystems and the preservation of glaciers; \n \n10. Also encourages the strengthening of the scientific and technological \ncapacities of Central Asian countries to promote sustainable agriculture, sustainable \npatterns of consumption and production, afforestation and reforestation, the \nsustainable use of freshwater resources, the recycling of waste, energy efficiency, \nsustainable tourism, smart cities and sustainable transport, building drought \nresistance and combating land degradation, which will contribute significantly to \nclimate change adaptation and mitigation in the region and in the world; \n \n11. \nFurther encourages the United Nations system, international and financial \ninstitutions, the private sector, investors and donors and other relevant stakeholders \nto continue to mobilize resources and provide capacity-building and assistance for \naddressing the environmental challenges in Central Asia. \n \n49th plenary meeting \n19 December 2023 \n \n \n",
  "paragraphs": {
    "1": "Reaffirms that climate change is one of the greatest challenges of our time, presenting a serious challenge to the sustainable development of all countries;",
    "2": "Emphasizes the importance of strengthening regional cooperation to tackle environmental challenges in Central Asia, including the Aral Sea region, and promoting socioeconomic development and adaptation to climate change; Central Asia facing environmental challenges: fostering regional solidarity for sustainable development and prosperity A/RES/78/147 3/3 23-25918",
    "3": "Takes note of the adoption by the Heads of State of the Central Asian countries of the regional programme known as \u201cGreen Agenda for Central Asia\u201d, aimed at fostering sustainable development;",
    "4": "Welcomes the initiative of Uzbekistan to convene an International Climate Forum in Samarkand in 2024, dedicated to seeking coordinated approaches and solutions to environmental challenges in the Central Asian region for achieving the Sustainable Development Goals;",
    "5": "Also welcomes the initiative of Kazakhstan to organize a regional climate summit in 2026, aimed at strengthening the regional response to climate change;",
    "6": "Further welcomes the commitment of the multi-partner human security trust fund for the Aral Sea region to addressing climate change and promoting climate-resilient development in the Aral Sea basin and Aral Sea region in its next cycle, invites Member States and relevant international organizations to contribute to the trust fund, and calls for increased financial resources to support climate-resilient development projects in the Aral Sea basin and Aral Sea region;",
    "7": "Encourages the multi-partner human security trust fund for the Aral Sea region to prioritize projects and initiatives that are aimed at enhancing the climate resilience of communities in the Aral Sea basin and Aral Sea region, and to support initiatives that are aimed at implementing climate-resilient development projects and achieving climate-related goals in the Aral Sea basin and Aral Sea region, including those related to water management, building drought resilience, agriculture and disaster risk reduction;",
    "8": "Recognizes the importance of new and innovative technologies and best practices in combating desertification, drought and sand and dust storms and in achieving land degradation neutrality and drought resilience in Central Asia, welcomes in this regard the holding of the twenty-first session of the Committee for the Review of the Implementation of the United Nations Convention to Combat Desertification and a high-level event on sand and dust storms in Samarkand, Uzbekistan, from 13 to 17 November 2023 to discuss action-oriented recommendations and address the challenges faced by the affected countries;",
    "9": "Encourages greater efforts by Central Asian countries, Member States, all relevant stakeholders and the international community towards the conservation of mountain ecosystems and the preservation of glaciers;",
    "10": "Also encourages the strengthening of the scientific and technological capacities of Central Asian countries to promote sustainable agriculture, sustainable patterns of consumption and production, afforestation and reforestation, the sustainable use of freshwater resources, the recycling of waste, energy efficiency, sustainable tourism, smart cities and sustainable transport, building drought resistance and combating land degradation, which will contribute significantly to climate change adaptation and mitigation in the region and in the world;",
    "11": "Further encourages the United Nations system, international and financial institutions, the private sector, investors and donors and other relevant stakeholders to continue to mobilize resources and provide capacity-building and assistance for addressing the environmental challenges in Central Asia. 49th plenary meeting 19 December 2023"
  },
  "agenda_items": [
    "Item 18"
  ],
  "symbol_references": []
}