{
  "symbol": "A/RES/80/140",
  "filename": "A_RES_80_140.pdf",
  "title": "80/140. Implementation of the Convention on Biological Diversity and its contribution to sustainable development",
  "text": "United Nations \nA/RES/80/140 \n \nGeneral Assembly \nDistr.: General \n18 December 2025 \n25-20770 (E) \n*2520770* \n \n \nEightieth session \nAgenda item 18 (f) \nSustainable development: Convention on Biological Diversity \n \n \n \n \n Resolution adopted by the General Assembly \non 15 December 2025 \n \n \n[on the report of the Second Committee (A/80/555, para. 7)] \n \n \n 80/140. Implementation of the Convention on Biological Diversity and its \ncontribution to sustainable development \n \n \n \nThe General Assembly, \n \nRecalling its resolution 79/208 of 19 December 2024 and its previous \nresolutions relating to the Convention on Biological Diversity,1 \n \nReaffirming the outcomes of the United Nations Conference on Environment and \nDevelopment, including the Rio Declaration on Environment and Development 2 and \nits principles, the outcome document of the United Nations Conference on Sustainable \nDevelopment, entitled \u201cThe future we want\u201d, 3  and, inter alia, the commitments \nconcerning biodiversity contained therein, the Programme for the Further Implementation \nof Agenda 21,4 the Johannesburg Declaration on Sustainable Development5 and the \nPlan of Implementation of the World Summit on Sustainable Development \n(Johannesburg Plan of Implementation) 6 and the outcome document of the special \nevent to follow up efforts made towards achieving the Millennium Development Goals \nconvened by the President of the General Assembly,7 \n \nReaffirming also its resolution 70/1 of 25 September 2015, entitled \n\u201cTransforming our world: the 2030 Agenda for Sustainable Development\u201d, in which \n_______________ \n \n1 United Nations, Treaty Series, vol. 1760, No. 30619. \n \n2 Report of the United Nations Conference on Environment and Development, Rio de Janeiro, \n3\u201314 June 1992, vol. I, Resolutions Adopted by the Conference (United Nations publication, \nSales No. E.93.I.8 and corrigendum), resolution 1, annex I. \n \n3 Resolution 66/288, annex. \n \n4 Resolution S-19/2, annex. \n \n5 Report of the World Summit on Sustainable Development, Johannesburg, South Africa, \n26 August\u20134 September 2002 (United Nations publication, Sales No. E.03.II.A.1 and \ncorrigendum), chap. I, resolution 1, annex. \n \n6 Ibid., resolution 2, annex. \n \n7 Resolution 68/6. \n\nA/RES/80/140 \nImplementation of the Convention on Biological Diversity and its \ncontribution to sustainable development\n \n25-20770\n2/13 \n \nit adopted a comprehensive, far-reaching and people-centred set of universal and \ntransformative Sustainable Development Goals and targets, its commitment to \nworking tirelessly for the full implementation of the Agenda by 2030, its recognition \nthat eradicating poverty in all its forms and dimensions, including extreme poverty, \nis the greatest global challenge and an indispensable requirement for sustainable \ndevelopment, its commitment to achieving sustainable development in its three \ndimensions \u2013 economic, social and environmental \u2013 in a balanced and integrated \nmanner, and to building upon the achievements of the Millennium Development Goals \nand seeking to address their unfinished business, \n \nReaffirming further its resolution 69/313 of 27 July 2015 on the Addis Ababa \nAction Agenda of the Third International Conference on Financing for Development, \nwhich is an integral part of the 2030 Agenda for Sustainable Development, supports \nand complements it, helps to contextualize its means of implementation targets with \nconcrete policies and actions, and reaffirms the strong political commitment to \naddress the challenge of financing and creating an enabling environment at all levels \nfor sustainable development in the spirit of global partnership and solidarity, \n \nWelcoming the convening of the Fourth International Conference on Financing \nfor Development from 30 June to 3 July 2025 in Sevilla, Spain, and reaffirming its \noutcome document, the Sevilla Commitment, endorsed by the General Assembly in \nits resolution 79/323 of 25 August 2025, which sets forth a renewed global framework \nfor financing for development, building on the 2015 Addis Ababa Action Agenda, 8 to \nclose with urgency the estimated annual 4 trillion United States dollar financing gap, 9 \nand catalyse sustainable development investments at scale in developing countries \nand continue the reform of the international financial architecture through continued \nand strong commitment to multilateralism, international cooperation, and global \nsolidarity, \n \nReaffirming the New Urban Agenda, adopted at the United Nations Conference \non Housing and Sustainable Urban Development (Habitat III), held in Quito, Ecuador, \nfrom 17 to 20 October 2016,10 and its vision for cities and human settlements that \nprotect, conserve, restore and promote their ecosystems, water, natural habitats and \nbiodiversity and minimize their environmental impact, and looking forward to the \nconvening of the thirteenth session of the World Urban Forum, to be held in Baku, \nfrom 17 to 22 May 2026, under the theme \u201cHousing the world: safe and resilient cities \nand communities\u201d as an important platform to advance the implementation of the New \nUrban Agenda, \n \nReaffirming also the Paris Agreement11 and encouraging all its Parties to fully \nimplement the Agreement, and Parties to the United Nations Framework Convention \non Climate Change 12  that have not yet done so to deposit their instruments of \nratification, acceptance, approval or accession, where appropriate, as soon as \npossible, \n \nWelcoming the convening of the thirtieth session of the Conference of the Parties \nto the United Nations Framework Convention on Climate Change, to be held in \nBel\u00e9m, Brazil, from 10 to 21 November 2025, and looking forward to the convening \nof the thirty-first session of the Conference of the Parties to the United Nations \nFramework Convention on Climate Change to be held in 2026, \n_______________ \n \n8 General Assembly resolution 69/313, annex. \n \n9 Financing for Sustainable Development Report 2024 (United Nations publication, 2024), \nfigure I.1. \n \n10 Resolution 71/256, annex. \n \n11 Adopted under the UNFCCC in FCCC/CP/2015/10/Add.1, decision 1/CP.21. \n \n12 United Nations, Treaty Series, vol. 1771, No. 30822. \n\nImplementation of the Convention on Biological Diversity and its \ncontribution to sustainable development \nA/RES/80/140\n \n3/13\n25-20770 \n \n \nNoting with serious concern the findings from the Intergovernmental Panel on \nClimate Change in its special reports entitled Global Warming of 1.5\u00b0C, The Ocean \nand Cryosphere in a Changing Climate and Climate Change and Land: An IPCC \nSpecial Report on Climate Change, Desertification, Land Degradation, Sustainable \nLand Management, Food Security, and Greenhouse Gas Fluxes in Terrestrial \nEcosystems, as well as the contribution of Working Groups I, II and III and the \nsynthesis report of the Sixth Assessment Report of the Intergovernmental Panel on \nClimate Change, in which the Intergovernmental Panel highlights the linkages \nbetween climate change and extreme weather events and slow-onset events and their \nnegative impacts on people and nature, and highlighting the increasing frequency and \nintensity of extreme weather events, such as heatwaves, droughts and heavy \nprecipitation, \n \nNoting with profound concern the findings of the Intergovernmental Science \nPolicy Platform on Biodiversity and Ecosystem Services Global Assessment Report \non Biodiversity and Ecosystem Services, \n \nRecalling the convening of the summit on biodiversity on 30 September 2020, \nin order to highlight the urgency of action at the highest levels in support of a global \nbiodiversity framework that contributes to the 2030 Agenda and places the global \ncommunity on a path towards realizing the 2050 Vision for Biodiversity, \u201cLiving in \nharmony with nature\u201d, \n \nRecalling its resolution 76/300 of 28 July 2022 on the human right to a clean, \nhealthy and sustainable environment, \n \nWelcoming the convening of the 2025 United Nations Conference to Support the \nImplementation of Sustainable Development Goal 14: Conserve and sustainably use \nthe oceans, seas and marine resources for sustainable development, co-hosted by \nCosta Rica and France, held in Nice, France, from 9 to 13 June 2025, at which its \npolitical declaration13 was adopted, \n \nTaking note of voluntary initiatives and efforts to achieve the effective \nconservation and management of at least 30 per cent of terrestrial and inland water \nareas and of marine and coastal areas by 2030, which can further contribute to halt \nand reverse biodiversity loss, \n \nRecalling its resolution 73/284 of 1 March 2019, in which it proclaimed 2021\u2013\n2030 the United Nations Decade on Ecosystem Restoration, with the aim of \nsupporting and scaling up efforts to prevent, halt and reverse the degradation of \necosystems worldwide and raise awareness of the importance of successful ecosystem \nrestoration, \n \nRecalling also the United Nations strategic plan for forests 2017\u20132030,14 and \nrecognizing that forests are home to an estimated 80 per cent of all terrestrial species \nand that forests, including boreal, temperate and tropical, contribute substantially to \nclimate change mitigation and adaptation and to the conservation of biodiversity, \n \nRecalling further the fifth edition of the Global Biodiversity Outlook, in which \nit was highlighted that none of the 20 Aichi Biodiversity Targets were fully achieved, \nalthough six were partially achieved (targets 9, 11, 16, 17, 19 and 20), and \nemphasizing the need for support and investments at all levels to enhance efforts for \nthe implementation of the goals and targets of the Kunming-Montreal Global \nBiodiversity Framework, \n_______________ \n \n13 Resolution 79/314, annex. \n \n14 See resolution 71/285. \n\nA/RES/80/140 \nImplementation of the Convention on Biological Diversity and its \ncontribution to sustainable development\n \n25-20770\n4/13 \n \n \nNoting with concern that the Sustainable Development Goal targets with a 2020 \ndeadline have not been fully achieved, \n \nRecognizing that the coronavirus disease (COVID\u201119) pandemic and other \npandemics underscore the need to conserve, restore and sustainably use biodiversity, \non land and below water, to reduce the risk of the economic, social and environmental \nimpacts of disasters and future pandemic outbreaks, many of which are exacerbated \nby biodiversity loss, the increased scale of poaching and the illegal use of and trade \nin wildlife and wildlife products, desertification, land degradation and drought, \nclimate change and plastic pollution, including in the marine environment, and \nemphasizing the need to support and invest at all levels, to enhance efforts to build \nresilience, to reduce the likelihood of zoonotic infections and to avoid or minimize \nadverse impacts on biological diversity in order to achieve the objectives of the \nConvention on Biological Diversity and to achieve a sustainable, resilient and \ninclusive recovery, \n \nRecalling with appreciation the intergovernmentally agreed outcomes of the \nmeetings of the Conference of the Parties to the Convention on Biological Diversity \nand the meetings of the Conference of the Parties serving as the Meetings of the \nParties to the Protocols to the Convention, \n \nRecalling that the objectives of the Convention on Biological Diversity, to be \npursued in accordance with its relevant provisions, are the conservation of biological \ndiversity, the sustainable use of its components and the fair and equitable sharing of \nthe benefits arising out of the utilization of genetic resources, including by appropriate \naccess to genetic resources, by appropriate transfer of relevant technologies, taking \ninto account all rights over those resources and to technologies, and by appropriate \nfunding, \n \nRecognizing that the achievement of the three objectives of the Convention on \nBiological Diversity is crucial for sustainable development, poverty eradication, food \nsecurity and the improvement of human health and well-being, and a major factor \nunderpinning the achievement of the Sustainable Development Goals and other \ninternationally agreed development goals, \n \nReaffirming that, in accordance with the Charter of the United Nations, States \nhave the sovereign right to exploit their own resources pursuant to their own \nenvironmental policies and the responsibility to ensure that activities within their \njurisdiction or control do not cause damage to the environment of other States or of \nareas beyond the limits of national jurisdiction, \n \nReaffirming also the intrinsic value of biological diversity, as well as the \necological, genetic, social, economic, scientific, educational, cultural, recreational \nand aesthetic values of biological diversity, and its critical role in maintaining \necosystems that provide essential functions and services, which are critical \nfoundations for sustainable development, and human health and well-being, \n \nEncouraging Parties, other Governments and relevant organizations to integrate \nnature-based solutions, ecosystem-based approaches and other management and \nconservation approaches, in line with resolution 5/5 of 7 March 2022 of the United \nNations Environment Assembly,15 to climate change adaptation and mitigation and \ndisaster risk reduction into their strategic planning, as appropriate, across sectors, \n \nRecognizing that the traditional knowledge, innovations and practices of \nIndigenous Peoples and local communities that are relevant to the Convention make \n_______________ \n \n15 UNEP/EA.5/Res.5. \n\nImplementation of the Convention on Biological Diversity and its \ncontribution to sustainable development \nA/RES/80/140\n \n5/13\n25-20770 \n \na key contribution to the conservation and sustainable use of biodiversity and that \ntheir wider application can support social well-being and sustainable livelihoods, \n \nRecalling the decisions adopted by the Conference of the Parties to the \nConvention on Biological Diversity on article 8 (j) and related provisions, as well as \nthe work done by the Ad Hoc Open-ended Intersessional Working Group on Article \n8 (j) and Related Provisions of the Convention on Biological Diversity, \n \nRecalling also the United Nations Declaration on the Rights of Indigenous \nPeoples16 and the outcome document of the high-level plenary meeting of the General \nAssembly known as the World Conference on Indigenous Peoples, 17 \n \nRecognizing the vital role that women play in the conservation and sustainable \nuse of biological diversity, and reaffirming the need for their full, equal, effective and \nmeaningful participation at all levels of policymaking and implementation for the \nconservation and sustainable use of biological diversity, as well as ecosystem \nrestoration, \n \nRecognizing also the important role of other biodiversity-related multilateral \nenvironmental agreements, regional agreements and initiatives in contributing to the \nconservation and sustainable use of biodiversity, \n \nRecognizing further the important role of the Convention on International Trade \nin Endangered Species of Wild Fauna and Flora18 in contributing to the conservation \nand sustainable use of biodiversity and in ensuring that no species entering into \ninternational trade is threatened with extinction, recognizing also the economic, social \nand environmental impacts of poaching and trafficking in wildlife, \n \nRecalling the convening of the 2023 United Nations Conference on the Midterm \nComprehensive Review of the Implementation of the Objectives of the International \nDecade for Action, \u201cWater for Sustainable Development\u201d, 2018\u20132028, and looking \nforward to the 2026 United Nations Water Conference to Accelerate the \nImplementation of Sustainable Development Goal 6: Ensure availability and \nsustainable management of water and sanitation for all, to be co-hosted by Senegal \nand the United Arab Emirates and held in the United Arab Emirates from 2 to \n4 December 2026, \n \nRecognizing the importance of the outcomes of the sixth session of the United \nNations Environment Assembly, held in Nairobi from 26 February to 1 March 2024, \nand looking forward to the seventh session of the United Nations Environment \nAssembly, to be held in Nairobi from 8 to 12 December 2025, \n \nWelcoming the decision by the United Nations Environment Assembly at its \nresumed fifth session, in resolution 5/14 of 2 March 2022, 19  to convene an \nintergovernmental negotiating committee to develop an international legally binding \ninstrument on plastic pollution, including in the marine environment, and welcoming \nalso the decisions taken by the Environment Assembly at its resumed fifth session to \nstrengthen global action on the sound management of chemicals and waste and to \nprevent pollution, in line with Environment Assembly resolutions 5/2, 5/7 and 5/8 of \n2 March 2022,20 \n \nWelcoming also the convening of the sixteenth session of the Conference of the \nParties to the United Nations Convention to Combat Desertification in Those \n_______________ \n \n16 Resolution 61/295, annex. \n \n17 Resolution 69/2. \n \n18 United Nations, Treaty Series, vol. 993, No. 14537. \n \n19 UNEP/EA.5/Res.14. \n \n20 UNEP/EA.5/Res.2, UNEP/EA.5/Res.7 and UNEP/EA.5/Res.8. \n\nA/RES/80/140 \nImplementation of the Convention on Biological Diversity and its \ncontribution to sustainable development\n \n25-20770\n6/13 \n \nCountries Experiencing Serious Drought and/or Desertification, Particularly in \nAfrica, held in Riyadh, from 2 to 13 December 2024 under the theme \u201cOur land, our \nfuture\u201d, and the adoption of its decisions, and calling for their full implementation; \nand looking forward to the convening of the seventeenth session of the Conference of \nthe Parties, to be held in Ulaanbaatar, from 17 to 28 August 2026, \n \nNoting the adoption by the Conference of the Parties to the Convention on \nBiological Diversity, at its tenth meeting, of the Nagoya Protocol on Access to Genetic \nResources and the Fair and Equitable Sharing of Benefits Arising from Their \nUtilization to the Convention on Biological Diversity,21 the objective of which is the \nfair and equitable sharing of the benefits arising from the utilization of genetic \nresources, including by appropriate access to genetic resources and by appropriate \ntransfer of relevant technologies, taking into account all rights over those resources \nand to technologies, and by appropriate funding, and acknowledging the role of access \nto genetic resources and equitable benefit-sharing arising from their utilization in \ncontributing to the conservation and sustainable use of biological diversity, poverty \neradication and environmental sustainability, and thereby to the achievement of \nsustainable development, \n \nNoting also that 195 States and 1 regional economic integration organization are \nParties to the Convention and that 141 States and 1 regional economic integration \norganization are Parties to the Nagoya Protocol, noting further that 172 States and \n1 regional economic integration organization are Parties to the Cartagena Protocol on \nBiosafety to the Convention on Biological Diversity 22  and that 54 States and \n1 regional economic integration organization are Parties to the Nagoya-Kuala Lumpur \nSupplementary Protocol on Liability and Redress to the Cartagena Protocol on \nBiosafety, 23  and recalling the entry into force of the Nagoya-Kuala Lumpur \nSupplementary Protocol on 5 March 2018, \n \nStressing that adequate, predictable and easily accessible financial resources \nfrom all sources will be key to place the global community on a path towards realizing \nthe 2050 Vision for Biodiversity of living in harmony with nature, \n \nReiterating the pledge that no one will be left behind, reaffirming the \nrecognition that the dignity of the human person is fundamental, and the wish to see \nthe Goals and targets met for all nations and peoples and for all segments of society, \nand recommitting to endeavour to reach the furthest behind first, \n \n1. \nTakes note of the report of the Executive Secretary of the Convention on \nBiological Diversity;24 \n \n2. \nInvites the Parties to the Convention to provide the Executive Secretary of \nthe Convention with full support in the fulfilment of her mandate and in promoting \nthe implementation of the Convention; \n \n3. \nStresses the urgent need to halt the global decline of biodiversity, which is \nunprecedented in human history, including its main indirect and direct drivers, in \nparticular changes in land and sea use, direct exploitation of organisms, climate \nchange, pollution and invasion of alien species; \n \n4. \nNotes the findings of the Intergovernmental Science-Policy Platform on \nBiodiversity and Ecosystem Services in its assessment report on the diverse values \nand valuation of nature, as well as in its subsequent assessment reports, and stresses \n_______________ \n \n21 United Nations Environment Programme, document UNEP/CBD/COP/10/27, annex, decision X/1. \n \n22 United Nations, Treaty Series, vol. 2226, No. 30619. \n \n23 See United Nations Environment Programme, document UNEP/CBD/BS/COP-MOP/5/17, annex, \ndecision BS-V/11. \n \n24 A/80/373, sect. III. \n\nImplementation of the Convention on Biological Diversity and its \ncontribution to sustainable development \nA/RES/80/140\n \n7/13\n25-20770 \n \nthat achieving a sustainable and just future requires institutions that enable a \nrecognition and integration of the diverse values of nature and nature\u2019s contributions \nto people, and that the transformative change needed to address the global biodiversity \ncrisis relies on shifting away from predominant values that currently overemphasize \nshort-term and individual material gains to nurturing sustainability-aligned values \nacross society; \n \n5. \nTakes note of the Intergovernmental Science-Policy Platform on \nBiodiversity and Ecosystem Services assessment reports on the sustainable use of \nwild species and on invasive alien species and their control, and stresses that the \nimpacts of invasive alien species are increasing rapidly and are predicted to continue \nrising in the future, whereas they can be prevented and mitigated through effective \nmanagement, with closer collaboration across sectors and countries; \n \n6. \nWelcomes the convening of the sixteenth meeting of the Conference of the \nParties to the Convention on Biological Diversity, as well as the Meetings of the \nParties to the Protocols to the Convention, held in Cali, Colombia, from 21 October \nto 1 November 2024, under the theme \u201cPeace with nature\u201d, as well as of the two \nresumed sessions of the sixteenth meeting of the Conference of the Parties to the \nConvention held online from 3 to 6 December 2024 and in Rome, Italy, from 25 to \n27 February 2025 and takes note of their adopted decisions, and looks forward to the \nseventeenth meeting of the Conference of the Parties and the meetings of the \nConference of the Parties serving as the Meetings of the Parties to the Protocols to \nthe Convention to be held in Yerevan, Armenia, from 18 to 30 October 2026; \n \n7. \nAlso welcomes the Kunming-Montreal Global Biodiversity Framework to \ncontribute to the 2030 Agenda for Sustainable Development,25 to the 2030 mission to \nhalt and reverse biodiversity loss by 2030 and to place the global community on a \npath towards realizing the 2050 Vision for Biodiversity, and urges Parties and invites \nother Governments, with the support of United Nations entities and the participation \nof all other stakeholders, to ensure the early, inclusive and effective implementation \nof the Framework and all other decisions adopted by the Parties; \n \n8. \nCalls for the provision and mobilization of new and additional means of \nimplementation to support the full implementation of the Convention on Biological \nDiversity, and further emphasizes the importance of urgently increasing the \nmobilization of financial resources from all sources, domestic and international, \npublic and private, with a view to closing the biodiversity financing gap and making \nadequate and predictable resources available in a timely manner for the effective \nimplementation of the Kunming-Montreal Global Biodiversity Framework; \n \n9. \nWelcomes the strategy for resource mobilization for the period 2025\u20132030, \nadopted at the sixteenth meeting of the Conference of the Parties to the Convention, \nfor the implementation of the Convention and its Protocols, as well as the achievement \nof the goals and targets of the Kunming-Montreal Global Biodiversity Framework, \nand the decision to implement articles 21 and 39 of the Convention and to address the \nglobal biodiversity finance gap by 2030 by establishing the permanent arrangement \nfor the financial mechanism envisioned under article 21 of the Convention and \nassessing and improving the mobilization of finance from all sources; \n \n10. Emphasizes that the successful implementation of the Kunming-Montreal \nGlobal Biodiversity Framework requires responsibility and transparency, which will \nbe supported by effective mechanisms for planning, monitoring, reporting and review, \nincluding through revising or updating national biodiversity strategies and action \n_______________ \n \n25 Resolution 70/1. \n\nA/RES/80/140 \nImplementation of the Convention on Biological Diversity and its \ncontribution to sustainable development\n \n25-20770\n8/13 \n \nplans, in alignment with the Framework, its goals and its targets, in line with decisions \n15/6, 16/31 and 16/32; \n \n11. Looks forward to the global review of the collective progress in \nimplementation of the Kunming-Montreal Global Biodiversity Framework, and \nrecalls that Parties are requested to submit their seventh national report, in line with \ndecision 16/32, and for those that have not yet done so, to revise or update their \nnational biodiversity strategies and action plans in line with decisions 15/6 and 16/1; \n \n12. Requests the continuation of efforts made by the secretariat of the \nConvention, Parties to the Convention and the Global Environment Facility, as the \nfinancial mechanism of the Convention, in conjunction with United Nations funds and \nprogrammes and the specialized agencies, as well as other entities, in organizing \ncapacity-building activities to support countries in the updating of national \nbiodiversity strategies and action plans, with a view to enhancing capacity and \naddressing the need for human, technical and financial resources to implement the \nConvention and the Kunming-Montreal Global Biodiversity Framework, in particular \nfor developing countries; \n \n13. Welcomes the establishment by the Global Environment Facility of the \nGlobal Biodiversity Framework Fund to support the implementation of the Kunming-\nMontreal Global Biodiversity Framework; \n \n14. Calls for continued capitalization and timely operationalization of the \nGlobal Biodiversity Framework Fund commensurate with the targets of the \nFramework, from all sources, including, inter alia, international financial resources \nfrom developed countries, philanthropic organizations and the private sector, and to \nprogress towards implementation as soon as possible; \n \n15. Acknowledges the adoption of the decision on the modalities for \noperationalizing the multilateral mechanism for the fair and equitable sharing of \nbenefits from the use of digital sequence information on genetic resources, and \nwelcomes the launch of the global fund (referred to as the Cali Fund), at the sixteenth \nmeeting of the Conference of the Parties to the Convention; \n \n16. Also acknowledges the important roles and contributions of Indigenous \nPeoples and local communities as custodians of biodiversity and as partners in its \nconservation, restoration and sustainable use, stresses that the implementation of the \nKunming-Montreal Global Biodiversity Framework must ensure that the rights, \nknowledge, \nincluding \ntraditional \nknowledge \nassociated \nwith \nbiodiversity, \ninnovations, world views, values and practices of Indigenous Peoples and local \ncommunities are respected, and documented and preserved with their free, prior and \ninformed consent, 26  including through their full and effective participation in \ndecision-making, in accordance with relevant national legislation, international \ninstruments, including the United Nations Declaration on the Rights of Indigenous \nPeoples, and human rights law, and takes note with appreciation of the goal of \nproviding up to 20 per cent of the programming share of the Global Biodiversity \nFramework Fund by 2030 to support action by Indigenous Peoples and local \ncommunities for the conservation, restoration, sustainable use and management of \nbiodiversity; \n \n17. Recalls decision 16/6 entitled \u201cRole of people of African descent, \ncomprising collectives embodying traditional lifestyles, in the implementation of the \n_______________ \n \n26 In this framework, free, prior and informed consent refers to the tripartite terminology of \u201cprior \nand informed consent\u201d or \u201cfree, prior and informed consent\u201d or \u201capproval and involvement\u201d. \n\nImplementation of the Convention on Biological Diversity and its \ncontribution to sustainable development \nA/RES/80/140\n \n9/13\n25-20770 \n \nConvention on Biological Diversity\u201d, adopted at the sixteenth meeting of the \nConference of the Parties to the Convention on Biological Diversity; \n \n18. Urges Parties to the Convention to ensure the coherence and \ncomplementarity of the Kunming-Montreal Global Biodiversity Framework with \nother existing or upcoming international processes, in particular with regard to the \n2030 Agenda, the Paris Agreement, and other related processes, frameworks and \nstrategies, and reiterates the invitation to the other multilateral environmental \nagreements, including biodiversity-related conventions and the Rio conventions, \nrelevant international organizations and their programmes, and other relevant \nprocesses to actively participate in their implementation; \n \n19. Encourages support for the Sharm el-Sheikh to Kunming Action Agenda \nfor Nature and People, which is aimed at collecting, coordinating and celebrating \nactions in support of biodiversity conservation and its sustainable use, encourages all \nrelevant stakeholders, including Indigenous Peoples and local communities and the \nprivate sector, to consider developing biodiversity commitments, and invites relevant \nagencies, funds and programmes of the United Nations system and other relevant \ninstitutions and intergovernmental organizations, where relevant, to support the \nimplementation of the Action Agenda; \n \n20. Welcomes the adoption of the Global Action Plan on Biodiversity and \nHealth at the sixteenth meeting of the Conference of the Parties to the Convention on \nBiological Diversity, as a voluntary plan for supporting the implementation of the \nKunming-Montreal Global Biodiversity Framework, and encourages Parties to \nimplement it when mainstreaming biodiversity and health interlinkages and to provide \ninformation on their implementing activities and the result thereof, including in \nnational reports, as appropriate; \n \n21. Notes that the COVID\u201119 pandemic has exacerbated pre\u2011existing \ninequalities and challenges for the implementation of the Convention and further \nhighlighted that the loss and degradation of biodiversity increases the risk of zoonotic \ndisease spillover from wildlife to people and urges Parties to the Convention and all \nother relevant stakeholders to continue to mainstream biodiversity into COVID\u201119 \nrecovery plans and in plans aimed at reducing the risk of future pandemics, \nemphasizes the importance of a One Health approach and other holistic approaches \nthat deliver multiple benefits to the health and well-being of people and planet, that \nwould further strengthen the capacity to address biodiversity loss, prevent and \nrespond to the emergence of diseases, including zoonotic infections, and future \npandemics, and contribute to reducing the adverse impacts of climate change, calls \nfor transformative actions from all relevant stakeholders and adequate and sufficient \nmeans of implementation, particularly for developing countries, to ensure the full \nimplementation of the Convention to halt and reverse biodiversity loss, and welcomes \nthe financial commitments and initiatives that have been announced from \ngovernments, organizations and the private sector that contribute to biodiversity \nconservation, restoration and sustainable use and maintain the political momentum \nfor the implementation of the Kunming-Montreal Global Biodiversity Framework; \n \n22. Notes with concern the limited progress made in the implementation of the \nthree objectives of the Convention, namely, the conservation of biological diversity, \nthe sustainable use of its components and the fair and equitable sharing of the benefits \narising out of the utilization of genetic resources, as well as the limited progress made \nin the implementation of the Nagoya Protocol on Access to Genetic Resources and \nthe Fair and Equitable Sharing of Benefits Arising from Their Utilization; \n \n23. Notes the limited progress made in mainstreaming article 8 (j) of the \nConvention and related provisions into various areas of work under the Convention, \n\nA/RES/80/140 \nImplementation of the Convention on Biological Diversity and its \ncontribution to sustainable development\n \n25-20770\n10/13 \n \ntakes note with appreciation of decisions 15/10 and 16/4 of the Conference of the Parties \nto the Convention to develop and adopt a new programme of work on article 8 (j) and \nother provisions of the Convention related to Indigenous Peoples and local communities \nto 2030 aligned with the Kunming-Montreal Global Biodiversity Framework, with \nthe full and effective participation of Indigenous Peoples and local communities, and \nin this regard invites the secretariat of the Convention, through the Secretary-General, \nto report on the progress made by the Subsidiary Body on Article 8 (j) and Other \nProvisions of the Convention on Biological Diversity related to Indigenous Peoples \nand Local Communities when reporting on the implementation of the present \nresolution to the General Assembly; \n \n24. Welcomes the decision to establish the Subsidiary Body on Article 8 (j) and \nOther Provisions of the Convention on Biological Diversity related to Indigenous \nPeoples and Local Communities, which met for the first time from 27 to 30 October \n2025 in Panama City, and encourages Parties, other Governments and relevant \norganizations to provide additional support to representatives of Indigenous Peoples \nand local communities, to participate effectively in its meetings; \n \n25. Encourages the respective Parties, in close collaboration with the relevant \nstakeholders, to take concrete measures towards achieving and coherently and \neffectively implementing the objectives of the Convention and its Protocols, and calls \nupon parties and stakeholders to strengthen international cooperation measures for \nthe fulfilment of obligations contained in the Convention and its protocols, including \nthrough comprehensively addressing at all levels the difficulties that may impede their \nimplementation; \n \n26. Highlights the importance of Parties raising high-level political \nengagement for the achievement of the objectives of the Convention and the \nKunming-Montreal Global Biodiversity Framework adopted at the fifteenth session \nof the Conference of the Parties, and the related Goals and targets of the 2030 Agenda; \n \n27. Invites all Parties, relevant departments of the Secretariat, the specialized \nagencies, funds and programmes of the United Nations system and the regional \ncommissions to continue to contribute to the achievement of the objectives of the \nConvention; \n \n28. Notes the important role of the United Nations Environment Management \nGroup in enhancing inter-agency coordination to support the implementation of the \nKunming-Montreal Global Biodiversity Framework; \n \n29. Stresses the importance of mainstreaming biodiversity across government \nand society for achieving the objectives of the Convention, as well as the mission, \nvision, goals and targets of the Kunming-Montreal Global Biodiversity Framework \nadopted at the fifteenth session of the Conference of the Parties, and urges all relevant \nstakeholders to mainstream biodiversity in all relevant sectors; \n \n30. Calls upon Governments and all stakeholders to take appropriate measures \nto mainstream consideration of the socioeconomic impacts and benefits of the \nconservation and sustainable use of biodiversity and its components, as well as \necosystems that provide essential services, into relevant programmes and policies at \nall levels, in accordance with national legislation, circumstances and priorities; \n \n31. Stresses \nthe \nimportance \nof \nmainstreaming \nbiodiversity \nin \nthe \nimplementation of the 2030 Agenda as part of national implementation plans for the \nSustainable Development Goals, in particular all biodiversity-related Goals and \ntargets; \n\nImplementation of the Convention on Biological Diversity and its \ncontribution to sustainable development \nA/RES/80/140\n \n11/13\n25-20770 \n \n \n32. Recognizes that integrating biodiversity considerations into sectoral and \ncross-sectoral policies, plans and programmes at all levels is critical for harnessing \nthe benefits of enhanced synergies and policy coherence; \n \n33. Welcomes the decisions of the Parties to the Convention to better \nmainstream biodiversity and to take specific actions tailored to national needs and \ncircumstances, and in line with other relevant international agreements, including in \nkey sectors, such as agriculture, forestry, fisheries and tourism, as well as health, \nenergy, mining, infrastructure, manufacturing and processing sectors, which are \ncrucial for addressing biodiversity loss, bearing in mind the impact of these sectors \non biodiversity; \n \n34. Recalls its resolution 77/321 of 1 August 2023 entitled \u201cAgreement under \nthe United Nations Convention on the Law of the Sea on the Conservation and \nSustainable Use of Marine Biological Diversity of Areas beyond National \nJurisdiction\u201d, and welcomes the upcoming entry into force on 17 January 2026 of the \nAgreement; \n \n35. Emphasizes the importance of ending illegal, unreported and unregulated \nfishing, and welcomes the Agreement on Fisheries Subsidies reached at the Twelfth \nMinisterial Conference of the World Trade Organization;  \n \n36. Notes the critical role of biodiversity and ecosystem functions and services \nfor climate change adaptation, mitigation and disaster risk reduction, including by \nadding resilience to fragile ecosystems and making them less vulnerable, and that \ncontinued climate change will have predominantly adverse and often irreversible \nimpacts on many ecosystems and their functions and services, with significant \nnegative economic, social and cultural consequences, and notes in this regard decision \n16/22 on biodiversity and climate change, adopted at the sixteenth meeting of the \nConference of the Parties to the Convention on Biological Diversity; \n \n37. Urges the Parties to the Convention to facilitate the transfer of technology \non mutually agreed terms for the effective implementation of the Convention in \naccordance with article 16 and other relevant provisions of the Convention, and in \nthis regard welcomes the decision to establish an informal advisory group on technical \nand scientific cooperation, to provide strategic advice on practical measures, tools \nand opportunities to promote and facilitate technical and scientific cooperation in \naccordance with the terms of reference contained in annex III to decision 15/8 of the \nConference of the Parties to the Convention; \n \n38. Urges parties and invites other Governments and relevant organizations to \nrecognize the important role of, and to promote, science, technology and innovation \nin supporting the implementation of the goals and targets of the Kunming-Montreal \nGlobal Biodiversity Framework towards achieving the 2050 Vision for Biodiversity \nof living in harmony with nature; \n \n39. Recalls decision 15/11 of the Conference of the Parties to the Convention, \nentitled \u201cGender Plan of Action\u201d, which recognizes the importance of advancing \nefforts to achieve gender equality and the empowerment of all women and girls and \nof supporting and advancing gender mainstreaming and gender-responsive \nimplementation of the Kunming-Montreal Global Biodiversity Framework, and \nencourages Parties to promote the mainstreaming of a gender perspective in \ndeveloping, implementing and revising their national, and where appropriate, regional \nand subnational biodiversity strategies and action plans and equivalent instruments in \nimplementing the three objectives of the Convention, and also recognizes the need to \nenhance cooperation on capacity-building in order to support Parties in this process; \n\nA/RES/80/140 \nImplementation of the Convention on Biological Diversity and its \ncontribution to sustainable development\n \n25-20770\n12/13 \n \n \n40. Notes decision 16/35 adopted at the sixteenth meeting of the Conference \nof the Parties to the Convention on Biological Diversity, which notes the work of the \nJoint Liaison Group of the Rio Conventions and the Liaison Group of Biodiversity-\nrelated Conventions for enhancing cooperation and synergies among the conventions, \ninvites the Parties to the Rio conventions to strengthen synergies and cooperation in \nthe implementation of each convention, in accordance with national circumstances \nand priorities, and further invites Parties and other Governments to continue to \nenhance synergies among the biodiversity-related conventions, in line with options \nfor action at the national level provided in decision XIII/24, in accordance with their \nnational circumstances and priorities; \n \n41. Invites countries that have not yet done so to ratify or accede to the \nConvention; \n \n42. Invites Parties to the Convention to ratify or accede to the Nagoya \nProtocol, and invites the Executive Secretary of the Convention and the Global \nEnvironment Facility, within its mandate as the financial mechanism of the \nConvention, in collaboration with relevant organizations, to continue to support \ncapacity-building and development activities to support the ratification and \nimplementation of the Protocol; \n \n43. Also invites Parties to the Convention to consider, as appropriate, ratifying \nor acceding to the Cartagena Protocol; \n \n44. Invites Parties to the Cartagena Protocol to consider, as appropriate, \nratifying or acceding to the Nagoya-Kuala Lumpur Supplementary Protocol on \nLiability and Redress to the Cartagena Protocol on Biosafety; \n \n45. Notes that increasing investments in nature-based solutions, ecosystem-\nbased approaches and other management and conservation approaches, in line with \nresolution 5/5 of the United Nations Environment Assembly, has the potential to cost-\neffectively support biodiversity conservation, restoration and its sustainable use, to \nhelp advance climate mitigation and adaptation and to reduce adverse impacts of \nclimate change and to slow, halt and even reverse some aspects of biodiversity and \necosystem loss, and therefore invites all relevant stakeholders to consider the \nopportunities it presents; \n \n46. Stresses the importance of engaging Indigenous Peoples and local \ncommunities, women, youth, civil society, local governments and authorities, \nacademia, the business and financial sectors and other relevant stakeholders to \nsupport action towards the implementation of the Kunming-Montreal Global \nBiodiversity Framework, the 2050 Vision for Biodiversity and the three objectives of \nthe Convention, and invites them to align their practices more explicitly with the \nobjectives of the Convention, including through partnerships, in accordance with \nnational legislation, circumstances and priorities; \n \n47. Encourages the private sector, in particular business and financial \ninstitutions, to progressively reduce negative impacts on biodiversity, increase \npositive impacts, reduce biodiversity-related risks to business and financial \ninstitutions, and promote actions to ensure sustainable patterns of production, in this \nregard stresses the importance of the work of the Global Partnership for Business and \nBiodiversity, and notes other related and complementary initiatives; \n \n48. Reaffirms the commitment at the very heart of the 2030 Agenda to leave \nno one behind and commit to taking more tangible steps to support people in \nvulnerable situations and the most vulnerable countries and to reach the furthest \nbehind first; \n\nImplementation of the Convention on Biological Diversity and its \ncontribution to sustainable development \nA/RES/80/140\n \n13/13\n25-20770 \n \n \n49. Requests the Secretary-General to submit to the General Assembly, at its \neighty-first session, a report on the implementation of the present resolution, progress \nin the implementation of the Convention on Biological Diversity and the Kunming-\nMontreal Global Biodiversity Framework, and decides to include in the provisional \nagenda of its eighty-first session, under the item entitled \u201cSustainable development\u201d, \nthe sub-item entitled \u201cConvention on Biological Diversity\u201d. \n \n64th plenary meeting \n15 December 2025 \n \n",
  "paragraphs": {
    "1": "Takes note of the report of the Executive Secretary of the Convention on Biological Diversity;24",
    "2": "Invites the Parties to the Convention to provide the Executive Secretary of the Convention with full support in the fulfilment of her mandate and in promoting the implementation of the Convention;",
    "3": "Stresses the urgent need to halt the global decline of biodiversity, which is unprecedented in human history, including its main indirect and direct drivers, in particular changes in land and sea use, direct exploitation of organisms, climate change, pollution and invasion of alien species;",
    "4": "Notes the findings of the Intergovernmental Science-Policy Platform on Biodiversity and Ecosystem Services in its assessment report on the diverse values and valuation of nature, as well as in its subsequent assessment reports, and stresses _______________ 21 United Nations Environment Programme, document UNEP/CBD/COP/10/27, annex, decision X/1. 22 United Nations, Treaty Series, vol. 2226, No. 30619. 23 See United Nations Environment Programme, document UNEP/CBD/BS/COP-MOP/5/17, annex, decision BS-V/11. 24 A/80/373, sect. III. Implementation of the Convention on Biological Diversity and its contribution to sustainable development A/RES/80/140 7/13 25-20770 that achieving a sustainable and just future requires institutions that enable a recognition and integration of the diverse values of nature and nature\u2019s contributions to people, and that the transformative change needed to address the global biodiversity crisis relies on shifting away from predominant values that currently overemphasize short-term and individual material gains to nurturing sustainability-aligned values across society;",
    "5": "Takes note of the Intergovernmental Science-Policy Platform on Biodiversity and Ecosystem Services assessment reports on the sustainable use of wild species and on invasive alien species and their control, and stresses that the impacts of invasive alien species are increasing rapidly and are predicted to continue rising in the future, whereas they can be prevented and mitigated through effective management, with closer collaboration across sectors and countries;",
    "6": "Welcomes the convening of the sixteenth meeting of the Conference of the Parties to the Convention on Biological Diversity, as well as the Meetings of the Parties to the Protocols to the Convention, held in Cali, Colombia, from 21 October to 1 November 2024, under the theme \u201cPeace with nature\u201d, as well as of the two resumed sessions of the sixteenth meeting of the Conference of the Parties to the Convention held online from 3 to 6 December 2024 and in Rome, Italy, from 25 to 27 February 2025 and takes note of their adopted decisions, and looks forward to the seventeenth meeting of the Conference of the Parties and the meetings of the Conference of the Parties serving as the Meetings of the Parties to the Protocols to the Convention to be held in Yerevan, Armenia, from 18 to 30 October 2026;",
    "7": "Also welcomes the Kunming-Montreal Global Biodiversity Framework to contribute to the 2030 Agenda for Sustainable Development,25 to the 2030 mission to halt and reverse biodiversity loss by 2030 and to place the global community on a path towards realizing the 2050 Vision for Biodiversity, and urges Parties and invites other Governments, with the support of United Nations entities and the participation of all other stakeholders, to ensure the early, inclusive and effective implementation of the Framework and all other decisions adopted by the Parties;",
    "8": "Calls for the provision and mobilization of new and additional means of implementation to support the full implementation of the Convention on Biological Diversity, and further emphasizes the importance of urgently increasing the mobilization of financial resources from all sources, domestic and international, public and private, with a view to closing the biodiversity financing gap and making adequate and predictable resources available in a timely manner for the effective implementation of the Kunming-Montreal Global Biodiversity Framework;",
    "9": "Welcomes the strategy for resource mobilization for the period 2025\u20132030, adopted at the sixteenth meeting of the Conference of the Parties to the Convention, for the implementation of the Convention and its Protocols, as well as the achievement of the goals and targets of the Kunming-Montreal Global Biodiversity Framework, and the decision to implement articles 21 and 39 of the Convention and to address the global biodiversity finance gap by 2030 by establishing the permanent arrangement for the financial mechanism envisioned under article 21 of the Convention and assessing and improving the mobilization of finance from all sources;",
    "10": "Emphasizes that the successful implementation of the Kunming-Montreal Global Biodiversity Framework requires responsibility and transparency, which will be supported by effective mechanisms for planning, monitoring, reporting and review, including through revising or updating national biodiversity strategies and action _______________ 25 Resolution 70/1. A/RES/80/140 Implementation of the Convention on Biological Diversity and its contribution to sustainable development 25-20770 8/13 plans, in alignment with the Framework, its goals and its targets, in line with decisions 15/6, 16/31 and 16/32;",
    "11": "Looks forward to the global review of the collective progress in implementation of the Kunming-Montreal Global Biodiversity Framework, and recalls that Parties are requested to submit their seventh national report, in line with decision 16/32, and for those that have not yet done so, to revise or update their national biodiversity strategies and action plans in line with decisions 15/6 and 16/1;",
    "12": "Requests the continuation of efforts made by the secretariat of the Convention, Parties to the Convention and the Global Environment Facility, as the financial mechanism of the Convention, in conjunction with United Nations funds and programmes and the specialized agencies, as well as other entities, in organizing capacity-building activities to support countries in the updating of national biodiversity strategies and action plans, with a view to enhancing capacity and addressing the need for human, technical and financial resources to implement the Convention and the Kunming-Montreal Global Biodiversity Framework, in particular for developing countries;",
    "13": "Welcomes the establishment by the Global Environment Facility of the Global Biodiversity Framework Fund to support the implementation of the Kunming- Montreal Global Biodiversity Framework;",
    "14": "Calls for continued capitalization and timely operationalization of the Global Biodiversity Framework Fund commensurate with the targets of the Framework, from all sources, including, inter alia, international financial resources from developed countries, philanthropic organizations and the private sector, and to progress towards implementation as soon as possible;",
    "15": "Acknowledges the adoption of the decision on the modalities for operationalizing the multilateral mechanism for the fair and equitable sharing of benefits from the use of digital sequence information on genetic resources, and welcomes the launch of the global fund (referred to as the Cali Fund), at the sixteenth meeting of the Conference of the Parties to the Convention;",
    "16": "Also acknowledges the important roles and contributions of Indigenous Peoples and local communities as custodians of biodiversity and as partners in its conservation, restoration and sustainable use, stresses that the implementation of the Kunming-Montreal Global Biodiversity Framework must ensure that the rights, knowledge, including traditional knowledge associated with biodiversity, innovations, world views, values and practices of Indigenous Peoples and local communities are respected, and documented and preserved with their free, prior and informed consent, 26 including through their full and effective participation in decision-making, in accordance with relevant national legislation, international instruments, including the United Nations Declaration on the Rights of Indigenous Peoples, and human rights law, and takes note with appreciation of the goal of providing up to 20 per cent of the programming share of the Global Biodiversity Framework Fund by 2030 to support action by Indigenous Peoples and local communities for the conservation, restoration, sustainable use and management of biodiversity;",
    "17": "Recalls decision 16/6 entitled \u201cRole of people of African descent, comprising collectives embodying traditional lifestyles, in the implementation of the _______________ 26 In this framework, free, prior and informed consent refers to the tripartite terminology of \u201cprior and informed consent\u201d or \u201cfree, prior and informed consent\u201d or \u201capproval and involvement\u201d. Implementation of the Convention on Biological Diversity and its contribution to sustainable development A/RES/80/140 9/13 25-20770 Convention on Biological Diversity\u201d, adopted at the sixteenth meeting of the Conference of the Parties to the Convention on Biological Diversity;",
    "18": "Urges Parties to the Convention to ensure the coherence and complementarity of the Kunming-Montreal Global Biodiversity Framework with other existing or upcoming international processes, in particular with regard to the 2030 Agenda, the Paris Agreement, and other related processes, frameworks and strategies, and reiterates the invitation to the other multilateral environmental agreements, including biodiversity-related conventions and the Rio conventions, relevant international organizations and their programmes, and other relevant processes to actively participate in their implementation;",
    "19": "Encourages support for the Sharm el-Sheikh to Kunming Action Agenda for Nature and People, which is aimed at collecting, coordinating and celebrating actions in support of biodiversity conservation and its sustainable use, encourages all relevant stakeholders, including Indigenous Peoples and local communities and the private sector, to consider developing biodiversity commitments, and invites relevant agencies, funds and programmes of the United Nations system and other relevant institutions and intergovernmental organizations, where relevant, to support the implementation of the Action Agenda;",
    "20": "Welcomes the adoption of the Global Action Plan on Biodiversity and Health at the sixteenth meeting of the Conference of the Parties to the Convention on Biological Diversity, as a voluntary plan for supporting the implementation of the Kunming-Montreal Global Biodiversity Framework, and encourages Parties to implement it when mainstreaming biodiversity and health interlinkages and to provide information on their implementing activities and the result thereof, including in national reports, as appropriate;",
    "21": "Notes that the COVID\u201119 pandemic has exacerbated pre\u2011existing inequalities and challenges for the implementation of the Convention and further highlighted that the loss and degradation of biodiversity increases the risk of zoonotic disease spillover from wildlife to people and urges Parties to the Convention and all other relevant stakeholders to continue to mainstream biodiversity into COVID\u201119 recovery plans and in plans aimed at reducing the risk of future pandemics, emphasizes the importance of a One Health approach and other holistic approaches that deliver multiple benefits to the health and well-being of people and planet, that would further strengthen the capacity to address biodiversity loss, prevent and respond to the emergence of diseases, including zoonotic infections, and future pandemics, and contribute to reducing the adverse impacts of climate change, calls for transformative actions from all relevant stakeholders and adequate and sufficient means of implementation, particularly for developing countries, to ensure the full implementation of the Convention to halt and reverse biodiversity loss, and welcomes the financial commitments and initiatives that have been announced from governments, organizations and the private sector that contribute to biodiversity conservation, restoration and sustainable use and maintain the political momentum for the implementation of the Kunming-Montreal Global Biodiversity Framework;",
    "22": "Notes with concern the limited progress made in the implementation of the three objectives of the Convention, namely, the conservation of biological diversity, the sustainable use of its components and the fair and equitable sharing of the benefits arising out of the utilization of genetic resources, as well as the limited progress made in the implementation of the Nagoya Protocol on Access to Genetic Resources and the Fair and Equitable Sharing of Benefits Arising from Their Utilization;",
    "23": "Notes the limited progress made in mainstreaming article 8 (j) of the Convention and related provisions into various areas of work under the Convention, A/RES/80/140 Implementation of the Convention on Biological Diversity and its contribution to sustainable development 25-20770 10/13 takes note with appreciation of decisions 15/10 and 16/4 of the Conference of the Parties to the Convention to develop and adopt a new programme of work on article 8 (j) and other provisions of the Convention related to Indigenous Peoples and local communities to 2030 aligned with the Kunming-Montreal Global Biodiversity Framework, with the full and effective participation of Indigenous Peoples and local communities, and in this regard invites the secretariat of the Convention, through the Secretary-General, to report on the progress made by the Subsidiary Body on Article 8 (j) and Other Provisions of the Convention on Biological Diversity related to Indigenous Peoples and Local Communities when reporting on the implementation of the present resolution to the General Assembly;",
    "24": "Welcomes the decision to establish the Subsidiary Body on Article 8 (j) and Other Provisions of the Convention on Biological Diversity related to Indigenous Peoples and Local Communities, which met for the first time from 27 to 30 October 2025 in Panama City, and encourages Parties, other Governments and relevant organizations to provide additional support to representatives of Indigenous Peoples and local communities, to participate effectively in its meetings;",
    "25": "Encourages the respective Parties, in close collaboration with the relevant stakeholders, to take concrete measures towards achieving and coherently and effectively implementing the objectives of the Convention and its Protocols, and calls upon parties and stakeholders to strengthen international cooperation measures for the fulfilment of obligations contained in the Convention and its protocols, including through comprehensively addressing at all levels the difficulties that may impede their implementation;",
    "26": "Highlights the importance of Parties raising high-level political engagement for the achievement of the objectives of the Convention and the Kunming-Montreal Global Biodiversity Framework adopted at the fifteenth session of the Conference of the Parties, and the related Goals and targets of the 2030 Agenda;",
    "27": "Invites all Parties, relevant departments of the Secretariat, the specialized agencies, funds and programmes of the United Nations system and the regional commissions to continue to contribute to the achievement of the objectives of the Convention;",
    "28": "Notes the important role of the United Nations Environment Management Group in enhancing inter-agency coordination to support the implementation of the Kunming-Montreal Global Biodiversity Framework;",
    "29": "Stresses the importance of mainstreaming biodiversity across government and society for achieving the objectives of the Convention, as well as the mission, vision, goals and targets of the Kunming-Montreal Global Biodiversity Framework adopted at the fifteenth session of the Conference of the Parties, and urges all relevant stakeholders to mainstream biodiversity in all relevant sectors;",
    "30": "Calls upon Governments and all stakeholders to take appropriate measures to mainstream consideration of the socioeconomic impacts and benefits of the conservation and sustainable use of biodiversity and its components, as well as ecosystems that provide essential services, into relevant programmes and policies at all levels, in accordance with national legislation, circumstances and priorities;",
    "31": "Stresses the importance of mainstreaming biodiversity in the implementation of the 2030 Agenda as part of national implementation plans for the Sustainable Development Goals, in particular all biodiversity-related Goals and targets; Implementation of the Convention on Biological Diversity and its contribution to sustainable development A/RES/80/140 11/13 25-20770",
    "32": "Recognizes that integrating biodiversity considerations into sectoral and cross-sectoral policies, plans and programmes at all levels is critical for harnessing the benefits of enhanced synergies and policy coherence;",
    "33": "Welcomes the decisions of the Parties to the Convention to better mainstream biodiversity and to take specific actions tailored to national needs and circumstances, and in line with other relevant international agreements, including in key sectors, such as agriculture, forestry, fisheries and tourism, as well as health, energy, mining, infrastructure, manufacturing and processing sectors, which are crucial for addressing biodiversity loss, bearing in mind the impact of these sectors on biodiversity;",
    "34": "Recalls its resolution 77/321 of 1 August 2023 entitled \u201cAgreement under the United Nations Convention on the Law of the Sea on the Conservation and Sustainable Use of Marine Biological Diversity of Areas beyond National Jurisdiction\u201d, and welcomes the upcoming entry into force on 17 January 2026 of the Agreement;",
    "35": "Emphasizes the importance of ending illegal, unreported and unregulated fishing, and welcomes the Agreement on Fisheries Subsidies reached at the Twelfth Ministerial Conference of the World Trade Organization;",
    "36": "Notes the critical role of biodiversity and ecosystem functions and services for climate change adaptation, mitigation and disaster risk reduction, including by adding resilience to fragile ecosystems and making them less vulnerable, and that continued climate change will have predominantly adverse and often irreversible impacts on many ecosystems and their functions and services, with significant negative economic, social and cultural consequences, and notes in this regard decision 16/22 on biodiversity and climate change, adopted at the sixteenth meeting of the Conference of the Parties to the Convention on Biological Diversity;",
    "37": "Urges the Parties to the Convention to facilitate the transfer of technology on mutually agreed terms for the effective implementation of the Convention in accordance with article 16 and other relevant provisions of the Convention, and in this regard welcomes the decision to establish an informal advisory group on technical and scientific cooperation, to provide strategic advice on practical measures, tools and opportunities to promote and facilitate technical and scientific cooperation in accordance with the terms of reference contained in annex III to decision 15/8 of the Conference of the Parties to the Convention;",
    "38": "Urges parties and invites other Governments and relevant organizations to recognize the important role of, and to promote, science, technology and innovation in supporting the implementation of the goals and targets of the Kunming-Montreal Global Biodiversity Framework towards achieving the 2050 Vision for Biodiversity of living in harmony with nature;",
    "39": "Recalls decision 15/11 of the Conference of the Parties to the Convention, entitled \u201cGender Plan of Action\u201d, which recognizes the importance of advancing efforts to achieve gender equality and the empowerment of all women and girls and of supporting and advancing gender mainstreaming and gender-responsive implementation of the Kunming-Montreal Global Biodiversity Framework, and encourages Parties to promote the mainstreaming of a gender perspective in developing, implementing and revising their national, and where appropriate, regional and subnational biodiversity strategies and action plans and equivalent instruments in implementing the three objectives of the Convention, and also recognizes the need to enhance cooperation on capacity-building in order to support Parties in this process; A/RES/80/140 Implementation of the Convention on Biological Diversity and its contribution to sustainable development 25-20770 12/13",
    "40": "Notes decision 16/35 adopted at the sixteenth meeting of the Conference of the Parties to the Convention on Biological Diversity, which notes the work of the Joint Liaison Group of the Rio Conventions and the Liaison Group of Biodiversity- related Conventions for enhancing cooperation and synergies among the conventions, invites the Parties to the Rio conventions to strengthen synergies and cooperation in the implementation of each convention, in accordance with national circumstances and priorities, and further invites Parties and other Governments to continue to enhance synergies among the biodiversity-related conventions, in line with options for action at the national level provided in decision XIII/24, in accordance with their national circumstances and priorities;",
    "41": "Invites countries that have not yet done so to ratify or accede to the Convention;",
    "42": "Invites Parties to the Convention to ratify or accede to the Nagoya Protocol, and invites the Executive Secretary of the Convention and the Global Environment Facility, within its mandate as the financial mechanism of the Convention, in collaboration with relevant organizations, to continue to support capacity-building and development activities to support the ratification and implementation of the Protocol;",
    "43": "Also invites Parties to the Convention to consider, as appropriate, ratifying or acceding to the Cartagena Protocol;",
    "44": "Invites Parties to the Cartagena Protocol to consider, as appropriate, ratifying or acceding to the Nagoya-Kuala Lumpur Supplementary Protocol on Liability and Redress to the Cartagena Protocol on Biosafety;",
    "45": "Notes that increasing investments in nature-based solutions, ecosystem- based approaches and other management and conservation approaches, in line with resolution 5/5 of the United Nations Environment Assembly, has the potential to cost- effectively support biodiversity conservation, restoration and its sustainable use, to help advance climate mitigation and adaptation and to reduce adverse impacts of climate change and to slow, halt and even reverse some aspects of biodiversity and ecosystem loss, and therefore invites all relevant stakeholders to consider the opportunities it presents;",
    "46": "Stresses the importance of engaging Indigenous Peoples and local communities, women, youth, civil society, local governments and authorities, academia, the business and financial sectors and other relevant stakeholders to support action towards the implementation of the Kunming-Montreal Global Biodiversity Framework, the 2050 Vision for Biodiversity and the three objectives of the Convention, and invites them to align their practices more explicitly with the objectives of the Convention, including through partnerships, in accordance with national legislation, circumstances and priorities;",
    "47": "Encourages the private sector, in particular business and financial institutions, to progressively reduce negative impacts on biodiversity, increase positive impacts, reduce biodiversity-related risks to business and financial institutions, and promote actions to ensure sustainable patterns of production, in this regard stresses the importance of the work of the Global Partnership for Business and Biodiversity, and notes other related and complementary initiatives;",
    "48": "Reaffirms the commitment at the very heart of the 2030 Agenda to leave no one behind and commit to taking more tangible steps to support people in vulnerable situations and the most vulnerable countries and to reach the furthest behind first; Implementation of the Convention on Biological Diversity and its contribution to sustainable development A/RES/80/140 13/13 25-20770",
    "49": "Requests the Secretary-General to submit to the General Assembly, at its eighty-first session, a report on the implementation of the present resolution, progress in the implementation of the Convention on Biological Diversity and the Kunming- Montreal Global Biodiversity Framework, and decides to include in the provisional agenda of its eighty-first session, under the item entitled \u201cSustainable development\u201d, the sub-item entitled \u201cConvention on Biological Diversity\u201d. 64th plenary meeting 15 December 2025"
  },
  "agenda_items": [
    "Item 18"
  ],
  "symbol_references": []
}